mlp_models/gemm/20251026_041954/worst_cases_top100.csv
M,N,K,avg_duration,tile_M,tile_N,tile_K,is_split_k,cta_count,hardware,tc_bf16,xu_fp32,fma_fp32,num_sms,sm_freq,mem_bandwidth,l2_cache_bandwidth,shared_memory_bandwidth,tensor_all_ops,tensor_all_cycle,tensor_sm_max_ops,tensor_sm_max_cycle,global_in_flight,global_cycle,local_cycle,sm_max_in_flight,sm_max_global_cycle,sm_max_shared_cycle,sm_max_local_cycle,overall_perf,predicted,rel_error
3,2560,8192,1026.7022,64,128,64,1,60,NVIDIA A40,1024,16,128,84,1740,696.096,2430,128,2684354560.0,31207.61904761905,45088768.0,44032.0,41984.0,100083.85158081644,28669.94598765433,1032.0,206651.7941558169,8256.0,59197.31987847223,0.0174689537489625,0.20226663,10.578629
50,1024,256,3.2019999999999995,64,8,64,0,128,NVIDIA H200,4096,16,128,132,1830,4916.7,10403,128,33554432.0,62.06060606060606,262144.0,64.0,544.0,193.09737333348588,91.26231428133713,36.0,1686.7623494130971,288.0,797.2031571046213,0.0105911616135758,0.1005465,8.493426
58,1024,256,3.0612,64,8,64,0,128,NVIDIA H200,4096,16,128,132,1830,4916.7,10403,128,33554432.0,62.06060606060606,262144.0,64.0,544.0,193.09737333348588,91.26231428133713,36.0,1686.7623494130971,288.0,797.2031571046213,0.0110783024587318,0.1005465,8.075976
60,1024,256,3.0356,64,8,64,0,128,NVIDIA H200,4096,16,128,132,1830,4916.7,10403,128,33554432.0,62.06060606060606,262144.0,64.0,544.0,193.09737333348588,91.26231428133713,36.0,1686.7623494130971,288.0,797.2031571046213,0.0111717286489227,0.1005465,8.000077
5,2560,8192,631.2006000000001,64,128,64,1,60,NVIDIA A40,1024,16,128,84,1740,696.096,2430,128,2684354560.0,31207.61904761905,45088768.0,44032.0,41984.0,100083.85158081644,28669.94598765433,1032.0,206651.7941558169,8256.0,59197.31987847223,0.0284147595007958,0.20226663,6.1183634
423,7168,1792,205.6662,128,256,32,1,336,NVIDIA RTX PRO 6000 Blackwell Server Edition,1024,16,128,188,2340,1792.0,7444,128,13153337344.0,68324.76595744681,79691776.0,77824.0,26880.0,33473.968505859375,8058.214879433101,912.0,213516.09911237445,7296.0,51399.89919524114,0.1419709117518232,0.71902233,4.0645742
489,6144,1024,117.0388,128,128,32,1,576,NVIDIA RTX PRO 6000 Blackwell Server Edition,1024,16,128,188,2340,1792.0,7444,128,6442450944.0,33465.1914893617,46137344.0,45056.0,13312.0,16577.584402901786,3990.7349879097264,704.0,164819.44492885043,5632.0,39677.11516825632,0.1221933571118518,0.5814817,3.758701
471,6144,1024,114.4916,128,128,32,1,576,NVIDIA RTX PRO 6000 Blackwell Server Edition,1024,16,128,188,2340,1792.0,7444,128,6442450944.0,33465.1914893617,46137344.0,45056.0,13312.0,16577.584402901786,3990.7349879097264,704.0,164819.44492885043,5632.0,39677.11516825632,0.1249119051907965,0.5814817,3.6551342
459,6144,1024,110.6066,128,128,32,1,576,NVIDIA RTX PRO 6000 Blackwell Server Edition,1024,16,128,188,2340,1792.0,7444,128,6442450944.0,33465.1914893617,46137344.0,45056.0,13312.0,16577.584402901786,3990.7349879097264,704.0,164819.44492885043,5632.0,39677.11516825632,0.1292993716861616,0.5814817,3.497173
339,8192,1024,110.4788,128,128,32,1,384,NVIDIA RTX PRO 6000 Blackwell Server Edition,1024,16,128,188,2340,1792.0,7444,128,6442450944.0,33465.1914893617,50331648.0,49152.0,17152.0,21359.57990373884,5141.908542114455,768.0,179803.0308314732,6144.0,43284.125638097794,0.1294489430039302,0.553049,3.2723327
327,8192,1024,107.30440000000002,128,128,32,1,384,NVIDIA RTX PRO 6000 Blackwell Server Edition,1024,16,128,188,2340,1792.0,7444,128,6442450944.0,33465.1914893617,50331648.0,49152.0,17152.0,21359.57990373884,5141.908542114455,768.0,179803.0308314732,6144.0,43284.125638097794,0.1332784478953575,0.553049,3.1495757
657,4480,1536,173.9092,64,128,64,1,385,NVIDIA RTX PRO 6000 Blackwell Server Edition,1024,16,128,188,2340,1792.0,7444,128,9688842240.0,50328.51063829787,75497472.0,73728.0,15552.0,19367.081778390067,4662.252894529151,1728.0,404556.8193708148,13824.0,97389.28268572004,0.1236732187209597,0.5043926,3.0784304
375,8192,2048,230.3762,128,256,32,1,96,NVIDIA RTX PRO 6000 Blackwell Server Edition,1024,16,128,188,2340,1792.0,7444,128,12884901888.0,66930.3829787234,134217728.0,131072.0,34304.0,42719.15980747768,10283.81708422891,1536.0,359606.0616629464,12288.0,86568.25127619559,0.1241566089235138,0.47345984,2.8134081
736,4096,1536,175.906,128,128,32,1,192,NVIDIA RTX PRO 6000 Blackwell Server Edition,1024,16,128,188,2340,1792.0,7444,128,9663676416.0,50197.78723404255,100663296.0,98304.0,14592.0,18171.582903180803,4374.459505977969,1536.0,359606.0616629464,12288.0,86568.25127619559,0.1219517573392261,0.44821936,2.6753824
729,4096,1536,175.4324,128,128,32,1,192,NVIDIA RTX PRO 6000 Blackwell Server Edition,1024,16,128,188,2340,1792.0,7444,128,9663676416.0,50197.78723404255,100663296.0,98304.0,14592.0,18171.582903180803,4374.459505977969,1536.0,359606.0616629464,12288.0,86568.25127619559,0.1222809801753491,0.44821936,2.665487
736,4096,1792,202.5044,128,128,32,1,192,NVIDIA RTX PRO 6000 Blackwell Server Edition,1024,16,128,188,2340,1792.0,7444,128,11274289152.0,58564.085106382976,117440512.0,114688.0,17024.0,21200.180053710938,5103.53609030763,1792.0,419540.4052734375,14336.0,100996.29315556154,0.1235893481702104,0.45104727,2.6495638
736,4096,2048,225.70420000000004,128,128,32,1,192,NVIDIA RTX PRO 6000 Blackwell Server Edition,1024,16,128,188,2340,1792.0,7444,128,12884901888.0,66930.3829787234,134217728.0,131072.0,19456.0,24228.777204241072,5832.612674637291,2048.0,479474.7488839286,16384.0,115424.33503492748,0.1267266084046517,0.45378706,2.5808346
609,2560,5120,192.738,128,256,32,1,150,NVIDIA RTX PRO 6000 Blackwell Server Edition,1024,16,128,188,2340,1792.0,7444,128,16777216000.0,87148.93617021276,113246208.0,110592.0,32000.0,39849.96250697545,9593.11295170607,1296.0,303417.61452811107,10368.0,73041.96201429002,0.1932319268409734,0.67734134,2.505328
736,4096,1024,116.8212,128,128,32,1,192,NVIDIA RTX PRO 6000 Blackwell Server Edition,1024,16,128,188,2340,1792.0,7444,128,6442450944.0,33465.1914893617,67108864.0,65536.0,9728.0,12114.388602120536,2916.306337318645,1024.0,239737.3744419643,8192.0,57712.167517463735,0.1224209636978785,0.42822775,2.4979935
225,6400,5120,194.0244,128,256,32,1,150,NVIDIA RTX PRO 6000 Blackwell Server Edition,1024,16,128,188,2340,1792.0,7444,128,16777216000.0,87148.93617021276,113246208.0,110592.0,66560.0,82887.92201450893,19953.67493954863,1296.0,303417.61452811107,10368.0,73041.96201429002,0.1919507810124682,0.66871536,2.4837852
729,4096,1024,116.3158,128,128,32,1,192,NVIDIA RTX PRO 6000 Blackwell Server Edition,1024,16,128,188,2340,1792.0,7444,128,6442450944.0,33465.1914893617,67108864.0,65536.0,9728.0,12114.388602120536,2916.306337318645,1024.0,239737.3744419643,8192.0,57712.167517463735,0.1229528910461227,0.42822775,2.48286
224,6912,5120,195.7012,128,256,32,1,162,NVIDIA RTX PRO 6000 Blackwell Server Edition,1024,16,128,188,2340,1792.0,7444,128,18119393280.0,94120.8510638298,113246208.0,110592.0,71680.0,89263.916015625,21488.5730118216,1296.0,303417.61452811107,10368.0,73041.96201429002,0.2055306044353002,0.7134284,2.471154
768,2048,6144,223.221,128,256,32,1,144,NVIDIA RTX PRO 6000 Blackwell Server Edition,1024,16,128,188,2340,1792.0,7444,128,19327352832.0,100395.5744680851,134217728.0,131072.0,33792.0,42081.56040736607,10130.327277001612,1536.0,359606.0616629464,12288.0,86568.25127619559,0.1922045490927279,0.6650558,2.460146
219,6912,5120,194.4018,128,256,32,1,162,NVIDIA RTX PRO 6000 Blackwell Server Edition,1024,16,128,188,2340,1792.0,7444,128,18119393280.0,94120.8510638298,113246208.0,110592.0,71680.0,89263.916015625,21488.5730118216,1296.0,303417.61452811107,10368.0,73041.96201429002,0.2069043904156936,0.7134284,2.4481063
753,2048,6144,221.39720000000003,128,256,32,1,144,NVIDIA RTX PRO 6000 Blackwell Server Edition,1024,16,128,188,2340,1792.0,7444,128,19327352832.0,100395.5744680851,134217728.0,131072.0,33792.0,42081.56040736607,10130.327277001612,1536.0,359606.0616629464,12288.0,86568.25127619559,0.193787869282122,0.6650558,2.431875
608,2560,4864,177.8068,128,256,32,1,150,NVIDIA RTX PRO 6000 Blackwell Server Edition,1024,16,128,188,2340,1792.0,7444,128,15938355200.0,82791.48936170213,106954752.0,104448.0,30400.0,37857.46438162668,9113.45730412077,1224.0,286561.0803876605,9792.0,68984.07523571837,0.198985518887364,0.6766831,2.400665
768,2048,5504,197.455,128,256,32,1,144,NVIDIA RTX PRO 6000 Blackwell Server Edition,1024,16,128,188,2340,1792.0,7444,128,17314086912.0,89937.70212765958,121634816.0,118784.0,30272.0,37698.06453159877,9075.084852313945,1392.0,325892.99338204524,11136.0,78452.47771905227,0.1946515177593414,0.65571827,2.3686779
608,2560,3072,116.1812,128,256,32,1,150,NVIDIA RTX PRO 6000 Blackwell Server Edition,1024,16,128,188,2340,1792.0,7444,128,10066329600.0,52289.36170212766,67108864.0,65536.0,19200.0,23909.977504185263,5755.867771023643,768.0,179803.0308314732,6144.0,43284.125638097794,0.1923364629499895,0.64432895,2.350009
609,2560,3072,115.5092,128,256,32,1,150,NVIDIA RTX PRO 6000 Blackwell Server Edition,1024,16,128,188,2340,1792.0,7444,128,10066329600.0,52289.36170212766,67108864.0,65536.0,19200.0,23909.977504185263,5755.867771023643,768.0,179803.0308314732,6144.0,43284.125638097794,0.1934554223324663,0.64432895,2.3306324
609,2560,4096,149.41,128,256,32,1,150,NVIDIA RTX PRO 6000 Blackwell Server Edition,1024,16,128,188,2340,1792.0,7444,128,13421772800.0,69719.14893617021,90177536.0,88064.0,25600.0,31879.970005580355,7674.490361364858,1032.0,241610.3226797921,8256.0,58163.04382619392,0.1994144173240107,0.6610657,2.3150344
608,2560,4096,148.3156,128,256,32,1,150,NVIDIA RTX PRO 6000 Blackwell Server Edition,1024,16,128,188,2340,1792.0,7444,128,13421772800.0,69719.14893617021,90177536.0,88064.0,25600.0,31879.970005580355,7674.490361364858,1032.0,241610.3226797921,8256.0,58163.04382619392,0.2008858683265983,0.6610657,2.2907526
249,6144,4096,147.2596,128,256,32,1,144,NVIDIA RTX PRO 6000 Blackwell Server Edition,1024,16,128,188,2340,1792.0,7444,128,12884901888.0,66930.3829787234,90177536.0,88064.0,51200.0,63759.94001116071,15348.980722729715,1032.0,241610.3226797921,8256.0,58163.04382619392,0.1942333658972672,0.63721776,2.2806811
753,2048,2752,101.7812,128,256,32,1,144,NVIDIA RTX PRO 6000 Blackwell Server Edition,1024,16,128,188,2340,1792.0,7444,128,8657043456.0,44968.85106382979,60817408.0,59392.0,15136.0,18849.032265799386,4537.542426156972,696.0,162946.49669102262,5568.0,39226.23885952614,0.1888114673396008,0.6174174,2.2700205
5889,1024,768,102.4532,128,128,32,1,376,NVIDIA RTX PRO 6000 Blackwell Server Edition,1024,16,128,188,2340,1792.0,7444,128,9462349824.0,49152.0,50331648.0,49152.0,10560.0,13150.487627301898,3165.727274063004,768.0,179803.0308314732,6144.0,43284.125638097794,0.2050216899533465,0.6685232,2.2607436
219,7168,7168,260.117,128,128,16,1,560,NVIDIA RTX PRO 6000 Blackwell Server Edition,1024,16,128,188,2340,1792.0,7444,128,26306674688.0,136649.53191489365,141557760.0,138240.0,103936.0,129432.67822265624,31158.43086714132,2160.0,505696.0242135184,17280.0,121736.60335715006,0.2245037266348053,0.72255075,2.2184353
5889,1024,512,69.749,128,128,32,1,376,NVIDIA RTX PRO 6000 Blackwell Server Edition,1024,16,128,188,2340,1792.0,7444,128,6308233216.0,32768.0,33554432.0,32768.0,7040.0,8766.991751534599,2110.484849375336,512.0,119868.68722098214,4096.0,28856.083758731867,0.2007687393857805,0.6449773,2.2125382
5121,1152,896,114.549,128,128,16,1,369,NVIDIA RTX PRO 6000 Blackwell Server Edition,1024,16,128,188,2340,1792.0,7444,128,10833887232.0,56276.425531914894,58720256.0,57344.0,11200.0,13947.486877441406,3357.589533097125,896.0,209770.20263671875,7168.0,50498.14657778077,0.2099516757092452,0.6653566,2.1690938
6561,896,448,59.912400000000005,128,128,32,1,364,NVIDIA RTX PRO 6000 Blackwell Server Edition,1024,16,128,188,2340,1792.0,7444,128,5343543296.0,27756.936170212764,29360128.0,28672.0,6608.0,8229.01725769043,1980.977824527304,448.0,104885.10131835938,3584.0,25249.073288890384,0.1979880381069521,0.62727195,2.1682315
5697,1024,512,67.68199999999999,128,128,32,1,360,NVIDIA RTX PRO 6000 Blackwell Server Edition,1024,16,128,188,2340,1792.0,7444,128,6039797760.0,31373.6170212766,33554432.0,32768.0,6784.0,8448.192051478794,2033.7399457616875,512.0,119868.68722098214,4096.0,28856.083758731867,0.198095928630525,0.625804,2.1590955
5505,1024,768,95.7716,128,128,32,1,352,NVIDIA RTX PRO 6000 Blackwell Server Edition,1024,16,128,188,2340,1792.0,7444,128,8858370048.0,46014.63829787234,50331648.0,49152.0,9984.0,12433.18830217634,2993.0512409322946,768.0,179803.0308314732,6144.0,43284.125638097794,0.2053257473089212,0.6441388,2.1371553
896,1536,4480,133.8388,128,128,32,1,168,NVIDIA RTX PRO 6000 Blackwell Server Edition,1024,16,128,188,2340,1792.0,7444,128,12331253760.0,64054.46808510638,73400320.0,71680.0,21280.0,26500.225067138672,6379.420112884538,1120.0,262212.75329589844,8960.0,63122.68322222596,0.2045274188790883,0.6385892,2.1222668
1737,896,2432,91.701,128,256,32,1,168,NVIDIA RTX PRO 6000 Blackwell Server Edition,1024,16,128,188,2340,1792.0,7444,128,8925478912.0,46363.2340425532,54525952.0,53248.0,13376.0,16657.28432791574,4009.921213813138,624.0,146089.962550572,4992.0,35168.35208095446,0.2160646872055156,0.67394936,2.1192017
63489,1024,256,327.035,128,128,16,1,3976,NVIDIA RTX PRO 6000 Blackwell Server Edition,1024,16,128,188,2340,1792.0,7444,128,33353105408.0,173252.085106383,184549376.0,180224.0,32320.0,40248.4621320452,9689.044081223132,2816.0,659277.7797154018,22528.0,158708.46067302526,0.2263958065942953,0.705175,2.1147883
32768,1024,256,173.6018,128,128,16,1,2048,NVIDIA RTX PRO 6000 Blackwell Server Edition,1024,16,128,188,2340,1792.0,7444,128,17179869184.0,89240.51063829787,92274688.0,90112.0,16896.0,21040.78020368304,5065.163638500806,1408.0,329638.8898577009,11264.0,79354.23033651263,0.2196807311804771,0.6821671,2.1052659
6369,896,448,58.1142,128,128,32,1,350,NVIDIA RTX PRO 6000 Blackwell Server Edition,1024,16,128,188,2340,1792.0,7444,128,5138022400.0,26689.36170212766,29360128.0,28672.0,6384.0,7950.067520141602,1913.8260338653613,448.0,104885.10131835938,3584.0,25249.073288890384,0.196263738107285,0.6093693,2.1048489
60417,1024,256,311.7906,128,128,16,1,3784,NVIDIA RTX PRO 6000 Blackwell Server Edition,1024,16,128,188,2340,1792.0,7444,128,31742492672.0,164885.78723404257,176160768.0,172032.0,30784.0,38335.663931710376,9228.574659541242,2688.0,629310.6079101562,21504.0,151494.4397333423,0.2259978704889747,0.6984263,2.090411
32769,1024,256,172.9748,128,128,16,1,2056,NVIDIA RTX PRO 6000 Blackwell Server Edition,1024,16,128,188,2340,1792.0,7444,128,17246978048.0,89589.10638297872,92274688.0,90112.0,16960.0,21120.480128696985,5084.349864404218,1408.0,329638.8898577009,11264.0,79354.23033651263,0.221338269497689,0.6834731,2.0879118
6177,896,896,107.6624,128,128,32,1,343,NVIDIA RTX PRO 6000 Blackwell Server Edition,1024,16,128,188,2340,1792.0,7444,128,10070523904.0,52311.14893617021,58720256.0,57344.0,12544.0,15621.185302734377,3760.50027706878,896.0,209770.20263671875,7168.0,50498.14657778077,0.2076415893855625,0.63936967,2.0791984
608,2688,7168,259.6946,128,128,32,1,315,NVIDIA RTX PRO 6000 Blackwell Server Edition,1024,16,128,188,2340,1792.0,7444,128,24662507520.0,128108.93617021276,157286400.0,153600.0,46592.0,58021.54541015625,13967.57245768404,2400.0,561884.4713483539,19200.0,135262.8926190556,0.2108145822814531,0.64785403,2.0730987
5313,1024,768,92.8788,128,128,32,1,336,NVIDIA RTX PRO 6000 Blackwell Server Edition,1024,16,128,188,2340,1792.0,7444,128,8455716864.0,43923.06382978724,50331648.0,49152.0,9600.0,11954.988752092631,2877.9338855118217,768.0,179803.0308314732,6144.0,43284.125638097794,0.2020971427085586,0.62084335,2.0720043
5505,1024,512,65.378,128,128,32,1,352,NVIDIA RTX PRO 6000 Blackwell Server Edition,1024,16,128,188,2340,1792.0,7444,128,5905580032.0,30676.42553191489,33554432.0,32768.0,6656.0,8288.792201450893,1995.3674939548632,512.0,119868.68722098214,4096.0,28856.083758731867,0.2005198011662545,0.61554277,2.0697355
46593,1024,256,243.1954,128,128,16,1,2920,NVIDIA RTX PRO 6000 Blackwell Server Edition,1024,16,128,188,2340,1792.0,7444,128,24494735360.0,127237.44680851063,134217728.0,131072.0,23872.0,29728.072030203683,7156.46226197273,2048.0,479474.7488839286,16384.0,115424.33503492748,0.2235855500087349,0.6863335,2.0696683
23553,1024,256,126.3952,128,128,16,1,1480,NVIDIA RTX PRO 6000 Blackwell Server Edition,1024,16,128,188,2340,1792.0,7444,128,12415139840.0,64490.21276595745,67108864.0,65536.0,12352.0,15382.085527692523,3702.941599358544,1024.0,239737.3744419643,8192.0,57712.167517463735,0.2180456218705449,0.66855043,2.0661032
896,1536,4096,119.6884,128,128,32,1,168,NVIDIA RTX PRO 6000 Blackwell Server Edition,1024,16,128,188,2340,1792.0,7444,128,11274289152.0,58564.085106382976,67108864.0,65536.0,19456.0,24228.777204241072,5832.612674637291,1024.0,239737.3744419643,8192.0,57712.167517463735,0.2091045314132326,0.6367899,2.0453184
6144,896,448,56.0208,128,128,32,1,336,NVIDIA RTX PRO 6000 Blackwell Server Edition,1024,16,128,188,2340,1792.0,7444,128,4932501504.0,25621.78723404256,29360128.0,28672.0,6160.0,7671.117782592773,1846.6742432034189,448.0,104885.10131835938,3584.0,25249.073288890384,0.1954538622074267,0.5914469,2.0260174
28545,1024,256,152.162,128,128,16,1,1792,NVIDIA RTX PRO 6000 Blackwell Server Edition,1024,16,128,188,2340,1792.0,7444,128,15032385536.0,78085.44680851063,83886080.0,81920.0,14848.0,18490.38260323661,4451.204409591618,1280.0,299671.7180524554,10240.0,72140.20939682967,0.2193047479887625,0.660595,2.0122237
5505,896,896,96.8466,128,256,32,1,176,NVIDIA RTX PRO 6000 Blackwell Server Edition,1024,16,128,188,2340,1792.0,7444,128,10334765056.0,53683.744680851065,58720256.0,57344.0,11648.0,14505.386352539062,3491.89311442101,672.0,157327.65197753906,5376.0,37873.60993333557,0.236887729988796,0.7122072,2.006518
3072,512,2048,77.6658,128,256,32,1,144,NVIDIA RTX PRO 6000 Blackwell Server Edition,1024,16,128,188,2340,1792.0,7444,128,6442450944.0,33465.1914893617,46137344.0,45056.0,14336.0,17852.783203125,4297.71460236432,528.0,123614.58369663784,4224.0,29757.83637619224,0.1841397871951696,0.55290395,2.0026314
5889,896,896,103.1634,128,128,32,1,329,NVIDIA RTX PRO 6000 Blackwell Server Edition,1024,16,128,188,2340,1792.0,7444,128,9659482112.0,50176.0,58720256.0,57344.0,12096.0,15063.28582763672,3626.196695744896,896.0,209770.20263671875,7168.0,50498.14657778077,0.2078521553451615,0.6214984,1.9900984
14337,1024,256,78.72840000000001,128,128,16,1,904,NVIDIA RTX PRO 6000 Blackwell Server Edition,1024,16,128,188,2340,1792.0,7444,128,7583301632.0,39391.31914893617,41943040.0,40960.0,7744.0,9643.690926688058,2321.5333343128696,640.0,149835.8590262277,5120.0,36070.104698414834,0.2138224207807467,0.63806117,1.9840703
5121,1024,768,89.43539999999999,128,128,32,1,328,NVIDIA RTX PRO 6000 Blackwell Server Edition,1024,16,128,188,2340,1792.0,7444,128,8254390272.0,42877.27659574468,50331648.0,49152.0,9408.0,11715.88897705078,2820.375207801585,768.0,179803.0308314732,6144.0,43284.125638097794,0.2048810926860501,0.6110858,1.9826362
5313,1024,512,62.709,128,128,32,1,336,NVIDIA RTX PRO 6000 Blackwell Server Edition,1024,16,128,188,2340,1792.0,7444,128,5637144576.0,29282.042553191488,33554432.0,32768.0,6400.0,7969.992501395089,1918.6225903412144,512.0,119868.68722098214,4096.0,28856.083758731867,0.1995517931843879,0.59503525,1.9818586
27777,1024,256,147.7396,128,128,16,1,1744,NVIDIA RTX PRO 6000 Blackwell Server Edition,1024,16,128,188,2340,1792.0,7444,128,14629732352.0,75993.87234042553,83886080.0,81920.0,14464.0,18012.1830531529,4336.087054171145,1280.0,299671.7180524554,10240.0,72140.20939682967,0.2198192889428066,0.648773,1.9513923
5697,896,896,99.701,128,128,32,1,315,NVIDIA RTX PRO 6000 Blackwell Server Edition,1024,16,128,188,2340,1792.0,7444,128,9248440320.0,48040.85106382979,58720256.0,57344.0,11648.0,14505.386352539062,3491.89311442101,896.0,209770.20263671875,7168.0,50498.14657778077,0.2059184785749981,0.60370004,1.9317428
4449,1152,896,100.296,128,128,16,1,315,NVIDIA RTX PRO 6000 Blackwell Server Edition,1024,16,128,188,2340,1792.0,7444,128,9248440320.0,48040.85106382979,58720256.0,57344.0,9856.0,12273.788452148438,2954.6787891254703,896.0,209770.20263671875,7168.0,50498.14657778077,0.2046968795605596,0.59840256,1.9233593
18945,1024,256,102.6578,128,128,16,1,1192,NVIDIA RTX PRO 6000 Blackwell Server Edition,1024,16,128,188,2340,1792.0,7444,128,9999220736.0,51940.765957446805,58720256.0,57344.0,10048.0,12512.88822719029,3012.2374668357065,896.0,209770.20263671875,7168.0,50498.14657778077,0.2162223282480573,0.6310178,1.9183747
5889,1024,256,36.7316,128,128,16,1,376,NVIDIA RTX PRO 6000 Blackwell Server Edition,1024,16,128,188,2340,1792.0,7444,128,3154116608.0,16384.0,16777216.0,16384.0,3520.0,4383.495875767299,1055.2424246876678,256.0,59934.34361049107,2048.0,14428.041879365934,0.1906181435524017,0.5560486,1.9170809
1024,1280,5120,138.23559999999998,128,128,32,1,320,NVIDIA RTX PRO 6000 Blackwell Server Edition,1024,16,128,188,2340,1792.0,7444,128,13421772800.0,69719.14893617021,83886080.0,81920.0,23040.0,28691.97300502232,6907.041325228372,1280.0,299671.7180524554,10240.0,72140.20939682967,0.2155342624648096,0.62232924,1.8873794
21249,1024,256,114.6324,128,128,16,1,1336,NVIDIA RTX PRO 6000 Blackwell Server Edition,1024,16,128,188,2340,1792.0,7444,128,11207180288.0,58215.48936170213,67108864.0,65536.0,11200.0,13947.486877441406,3357.589533097125,1024.0,239737.3744419643,8192.0,57712.167517463735,0.217027771006606,0.6261378,1.8850583
5697,896,448,52.296400000000006,128,128,32,1,315,NVIDIA RTX PRO 6000 Blackwell Server Edition,1024,16,128,188,2340,1792.0,7444,128,4624220160.0,24020.42553191489,29360128.0,28672.0,5824.0,7252.693176269531,1745.946557210505,448.0,104885.10131835938,3584.0,25249.073288890384,0.196287681679866,0.5630272,1.8683776
29313,2048,256,302.568,128,128,16,1,3680,NVIDIA RTX PRO 6000 Blackwell Server Edition,1024,16,128,188,2340,1792.0,7444,128,30870077440.0,160354.04255319148,167772160.0,163840.0,15744.0,19606.18155343192,4719.811572239387,2560.0,599343.4361049108,20480.0,144280.41879365934,0.2264858432235894,0.6482757,1.8623229
5121,896,896,90.2164,128,256,32,1,164,NVIDIA RTX PRO 6000 Blackwell Server Edition,1024,16,128,188,2340,1792.0,7444,128,9630121984.0,50023.48936170213,58720256.0,57344.0,10976.0,13668.537139892578,3290.4377424351824,672.0,157327.65197753906,5376.0,37873.60993333557,0.2369586855192954,0.6765793,1.8552626
18432,1024,256,99.68200000000002,128,128,16,1,1152,NVIDIA RTX PRO 6000 Blackwell Server Edition,1024,16,128,188,2340,1792.0,7444,128,9663676416.0,50197.78723404255,58720256.0,57344.0,9728.0,12114.388602120536,2916.306337318645,896.0,209770.20263671875,7168.0,50498.14657778077,0.2152048095595384,0.613203,1.8493925
23553,2048,256,245.5634,128,128,16,1,2960,NVIDIA RTX PRO 6000 Blackwell Server Edition,1024,16,128,188,2340,1792.0,7444,128,24830279680.0,128980.4255319149,134217728.0,131072.0,12864.0,16019.684927804132,3856.431406585841,2048.0,479474.7488839286,16384.0,115424.33503492748,0.2244627659126066,0.6392827,1.8480568
5697,1024,256,35.406800000000004,128,128,16,1,360,NVIDIA RTX PRO 6000 Blackwell Server Edition,1024,16,128,188,2340,1792.0,7444,128,3019898880.0,15686.8085106383,16777216.0,16384.0,3392.0,4224.096025739397,1016.8699728808436,256.0,59934.34361049107,2048.0,14428.041879365934,0.18933550393669,0.5385344,1.8443389
16384,2048,256,172.73780000000002,128,128,16,1,2048,NVIDIA RTX PRO 6000 Blackwell Server Edition,1024,16,128,188,2340,1792.0,7444,128,17179869184.0,89240.51063829787,92274688.0,90112.0,9216.0,11476.78920200893,2762.8165300913483,1408.0,329638.8898577009,11264.0,79354.23033651263,0.2207795303532113,0.62774414,1.8433076
17793,2048,256,187.3362,128,128,16,1,2240,NVIDIA RTX PRO 6000 Blackwell Server Edition,1024,16,128,188,2340,1792.0,7444,128,18790481920.0,97606.8085106383,100663296.0,98304.0,9984.0,12433.18830217634,2993.0512409322946,1536.0,359606.0616629464,12288.0,86568.25127619559,0.2226601763531693,0.63234776,1.8399678
4929,896,896,87.2018,128,256,32,1,156,NVIDIA RTX PRO 6000 Blackwell Server Edition,1024,16,128,188,2340,1792.0,7444,128,9160359936.0,47583.31914893617,58720256.0,57344.0,10528.0,13110.637664794922,3156.134161111297,672.0,157327.65197753906,5376.0,37873.60993333557,0.2331918810511898,0.6610615,1.8348393
20481,2048,256,214.2866,128,128,16,1,2576,NVIDIA RTX PRO 6000 Blackwell Server Edition,1024,16,128,188,2340,1792.0,7444,128,21609054208.0,112247.82978723403,117440512.0,114688.0,11328.0,14106.886727469308,3395.961984903949,1792.0,419540.4052734375,14336.0,100996.29315556154,0.2238551455328168,0.6306775,1.8173465
921,1280,5120,134.5238,128,128,32,1,160,NVIDIA RTX PRO 6000 Blackwell Server Edition,1024,16,128,188,2340,1792.0,7444,128,13421772800.0,69719.14893617021,83886080.0,81920.0,23040.0,28691.97300502232,6907.041325228372,1280.0,299671.7180524554,10240.0,72140.20939682967,0.2214813147738945,0.62232924,1.8098497
1185,3072,768,65.2182,128,128,32,1,480,NVIDIA RTX PRO 6000 Blackwell Server Edition,1024,16,128,188,2340,1792.0,7444,128,6039797760.0,31373.6170212766,37748736.0,36864.0,6528.0,8129.392351422991,1956.9950421480385,576.0,134852.27312360491,4608.0,32463.094228573347,0.2055795566509225,0.57714903,1.807424
18945,2048,256,198.5172,128,128,16,1,2384,NVIDIA RTX PRO 6000 Blackwell Server Edition,1024,16,128,188,2340,1792.0,7444,128,19998441472.0,103881.5319148936,109051904.0,106496.0,10560.0,13150.487627301898,3165.727274063004,1664.0,389573.233468192,13312.0,93782.27221587856,0.2236270562835202,0.62608916,1.799702
27009,2048,256,280.1428,128,128,16,1,3392,NVIDIA RTX PRO 6000 Blackwell Server Edition,1024,16,128,188,2340,1792.0,7444,128,28454158336.0,147804.59574468085,159383552.0,155648.0,14592.0,18171.582903180803,4374.459505977969,2432.0,569376.2642996652,19456.0,137066.39785397638,0.2254719991227563,0.63116175,1.7992909
1024,1536,1024,40.2772,128,128,32,1,288,NVIDIA RTX PRO 6000 Blackwell Server Edition,1024,16,128,188,2340,1792.0,7444,128,3221225472.0,16732.59574468085,23068672.0,22528.0,5120.0,6375.994001116072,1534.8980722729716,352.0,82409.72246442523,2816.0,19838.55758412816,0.177536719090982,0.49578676,1.7925869
993,1536,1024,40.2516,128,128,32,1,288,NVIDIA RTX PRO 6000 Blackwell Server Edition,1024,16,128,188,2340,1792.0,7444,128,3221225472.0,16732.59574468085,23068672.0,22528.0,5120.0,6375.994001116072,1534.8980722729716,352.0,82409.72246442523,2816.0,19838.55758412816,0.177649632366696,0.49578676,1.7908119
1113,2048,768,44.3856,128,128,32,1,288,NVIDIA RTX PRO 6000 Blackwell Server Edition,1024,16,128,188,2340,1792.0,7444,128,3623878656.0,18824.17021276596,25165824.0,24576.0,4800.0,5977.494376046317,1438.9669427559108,384.0,89901.5154157366,3072.0,21642.062819048897,0.1812416005403265,0.50452274,1.7837026
1185,2048,768,45.7104,128,128,32,1,160,NVIDIA RTX PRO 6000 Blackwell Server Edition,1024,16,128,188,2340,1792.0,7444,128,4026531840.0,20915.744680851065,25165824.0,24576.0,4992.0,6216.594151088169,1496.5256204661473,384.0,89901.5154157366,3072.0,21642.062819048897,0.1955430805180906,0.54275656,1.7756366
15873,2048,256,167.586,128,128,16,1,2000,NVIDIA RTX PRO 6000 Blackwell Server Edition,1024,16,128,188,2340,1792.0,7444,128,16777216000.0,87148.93617021276,92274688.0,90112.0,9024.0,11237.689426967076,2705.257852381112,1408.0,329638.8898577009,11264.0,79354.23033651263,0.2222329736104181,0.6154094,1.7692082
1233,4096,512,58.9784,128,128,32,1,320,NVIDIA RTX PRO 6000 Blackwell Server Edition,1024,16,128,188,2340,1792.0,7444,128,5368709120.0,27887.659574468085,33554432.0,32768.0,5376.0,6694.793701171875,1611.6429758866202,512.0,119868.68722098214,4096.0,28856.083758731867,0.202070643438143,0.55945003,1.7685863
14337,2048,256,152.5268,128,128,16,1,1808,NVIDIA RTX PRO 6000 Blackwell Server Edition,1024,16,128,188,2340,1792.0,7444,128,15166603264.0,78782.63829787234,83886080.0,81920.0,8256.0,10281.290326799664,2475.0231415401668,1280.0,299671.7180524554,10240.0,72140.20939682967,0.2207336293975215,0.60971797,1.762234
7137,896,896,124.4822,128,128,32,1,392,NVIDIA RTX PRO 6000 Blackwell Server Edition,1024,16,128,188,2340,1792.0,7444,128,11509170176.0,59784.17021276596,88080384.0,86016.0,14112.0,17573.833465576172,4230.562811702378,1344.0,314655.3039550781,10752.0,75747.21986667115,0.2052405138181701,0.5629812,1.7430313
32385,2048,256,315.5666,128,128,16,1,4064,NVIDIA RTX PRO 6000 Blackwell Server Edition,1024,16,128,188,2340,1792.0,7444,128,34091302912.0,177086.63829787233,184549376.0,180224.0,17280.0,21518.97975376674,5180.280993921278,2816.0,659277.7797154018,22528.0,158708.46067302526,0.2398164145212018,0.6547493,1.7302103
4608,1024,512,54.6326,128,128,32,1,288,NVIDIA RTX PRO 6000 Blackwell Server Edition,1024,16,128,188,2340,1792.0,7444,128,4831838208.0,25098.89361702128,33554432.0,32768.0,5632.0,7013.593401227678,1688.3878795002686,512.0,119868.68722098214,4096.0,28856.083758731867,0.196330083379831,0.53503966,1.7252046
960,1280,4096,104.2708,128,128,32,1,160,NVIDIA RTX PRO 6000 Blackwell Server Edition,1024,16,128,188,2340,1792.0,7444,128,10737418240.0,55775.31914893617,67108864.0,65536.0,18432.0,22953.57840401786,5525.633060182697,1024.0,239737.3744419643,8192.0,57712.167517463735,0.228593301997341,0.6172612,1.7002591
4257,1024,768,75.3488,128,128,32,1,272,NVIDIA RTX PRO 6000 Blackwell Server Edition,1024,16,128,188,2340,1792.0,7444,128,6845104128.0,35556.765957446805,50331648.0,49152.0,8064.0,10042.190551757812,2417.46446382993,768.0,179803.0308314732,6144.0,43284.125638097794,0.2016647793609721,0.5441406,1.6982429
7137,2048,256,78.4596,128,128,16,1,896,NVIDIA RTX PRO 6000 Blackwell Server Edition,1024,16,128,188,2340,1792.0,7444,128,7516192768.0,39042.72340425532,41943040.0,40960.0,4608.0,5738.394601004465,1381.4082650456742,640.0,149835.8590262277,5120.0,36070.104698414834,0.2126562527942156,0.5733796,1.696274
1185,4096,512,57.3972,128,128,32,1,320,NVIDIA RTX PRO 6000 Blackwell Server Edition,1024,16,128,188,2340,1792.0,7444,128,5368709120.0,27887.659574468085,33554432.0,32768.0,5376.0,6694.793701171875,1611.6429758866202,512.0,119868.68722098214,4096.0,28856.083758731867,0.2076373627450846,0.55945003,1.6943609
7137,896,448,65.0448,128,128,32,1,392,NVIDIA RTX PRO 6000 Blackwell Server Edition,1024,16,128,188,2340,1792.0,7444,128,5754585088.0,29892.08510638298,44040192.0,43008.0,7056.0,8786.916732788086,2115.281405851189,672.0,157327.65197753906,5376.0,37873.60993333557,0.1963937984990054,0.52903265,1.6937338
849,1536,4096,105.858,128,128,32,1,168,NVIDIA RTX PRO 6000 Blackwell Server Edition,1024,16,128,188,2340,1792.0,7444,128,11274289152.0,58564.085106382976,67108864.0,65536.0,19456.0,24228.777204241072,5832.612674637291,1024.0,239737.3744419643,8192.0,57712.167517463735,0.2364241417521544,0.6367899,1.6934215
3393,896,896,61.9858,128,128,16,1,378,NVIDIA RTX PRO 6000 Blackwell Server Edition,1024,16,128,188,2340,1792.0,7444,128,5549064192.0,28824.51063829788,44040192.0,43008.0,7616.0,9484.291076660156,2283.1608825060453,672.0,157327.65197753906,5376.0,37873.60993333557,0.1987256265054824,0.53440267,1.6891481
