mlp_models/ablation/gemm_without_math/worst_cases_top100.csv
M,N,K,avg_duration,tile_M,tile_N,tile_K,is_split_k,cta_count,hardware,tc_bf16,xu_fp32,fma_fp32,num_sms,sm_freq,mem_bandwidth,l2_cache_bandwidth,shared_memory_bandwidth,tensor_all_ops,tensor_all_cycle,tensor_sm_max_ops,tensor_sm_max_cycle,global_in_flight,global_cycle,local_cycle,sm_max_in_flight,sm_max_global_cycle,sm_max_shared_cycle,sm_max_local_cycle,overall_perf,predicted,rel_error
6,1024,2048,12.6292,8,64,64,0,16,NVIDIA H200,4096,16,128,132,1830,4916.7,10403,128,33554432.0,62.06060606060606,2097152.0,512.0,4128.0,1465.2683035305697,692.5199142524992,288.0,13494.098795304775,2304.0,6377.62525683697,0.0026852769365177,0.04745496,16.672215
6,896,2432,7.7268,8,64,64,0,16,NVIDIA H200,4096,16,128,132,1830,4916.7,10403,128,39845888.0,73.6969696969697,2490368.0,608.0,4294.0,1524.1913990698315,720.3683410368778,342.0,16024.242319424422,2736.0,7573.429992493901,0.0052119335482244,0.0759258,13.567657
6,1024,1024,7.630800000000001,8,64,64,0,16,NVIDIA H200,4096,16,128,132,1830,4916.7,10403,128,16777216.0,31.03030303030303,1048576.0,256.0,2064.0,732.6341517652847,346.2599571262496,144.0,6747.0493976523885,1152.0,3188.812628418485,0.0022221064296449,0.028645528,11.891107
8,768,2048,6.818,8,64,64,0,12,NVIDIA H200,4096,16,128,132,1830,4916.7,10403,128,25165824.0,46.54545454545455,2097152.0,512.0,3104.0,1101.790894902831,520.732028546453,288.0,13494.098795304775,2304.0,6377.62525683697,0.003730518424025,0.04747814,11.726924
6,1024,1536,6.6004000000000005,8,64,64,0,16,NVIDIA H200,4096,16,128,132,1830,4916.7,10403,128,25165824.0,46.54545454545455,1572864.0,384.0,3096.0,1098.951227647927,519.3899356893745,216.0,10120.574096478582,1728.0,4783.218942627727,0.0038535050322711,0.048430562,11.567895
2,768,2048,6.3764,8,64,64,0,12,NVIDIA H200,4096,16,128,132,1830,4916.7,10403,128,25165824.0,46.54545454545455,2097152.0,512.0,3104.0,1101.790894902831,520.732028546453,288.0,13494.098795304775,2304.0,6377.62525683697,0.0039888768921338,0.04747814,10.902607
3,2560,8192,1026.7022,64,128,64,1,60,NVIDIA A40,1024,16,128,84,1740,696.096,2430,128,2684354560.0,31207.61904761905,45088768.0,44032.0,41984.0,100083.85158081644,28669.94598765433,1032.0,206651.7941558169,8256.0,59197.31987847223,0.0174689537489625,0.20710781,10.85576
8,768,2560,5.621,8,64,64,0,12,NVIDIA H20,1024,16,128,78,1830,4022.784,8815,128,31457280.0,393.84615384615387,2621440.0,2560.0,3880.0,1683.2793200457538,768.1757363824092,360.0,12182.083326516691,2880.0,5559.374916911869,0.0382879340885179,0.4373182,10.421825
4,1024,2048,7.970000000000001,8,64,64,0,16,NVIDIA H200,4096,16,128,132,1830,4916.7,10403,128,33554432.0,62.06060606060606,2097152.0,512.0,4128.0,1465.2683035305697,692.5199142524992,288.0,13494.098795304775,2304.0,6377.62525683697,0.0042550689443751,0.04745496,10.152549
16,1024,3072,13.244,16,16,128,1,64,NVIDIA RTX 6000 Ada Generation,1024,16,128,142,2505,960.0,6326,128,100663296.0,692.2816901408451,1572864.0,1536.0,6240.0,15528.202056884766,2356.477074709038,192.0,67846.29821777344,1536.0,10295.992141805642,0.0208668042996111,0.22943623,9.995271
8,640,1536,4.7508,8,64,64,0,12,NVIDIA H200,4096,16,128,132,1830,4916.7,10403,128,18874368.0,34.90909090909091,1572864.0,384.0,1944.0,690.0391429417216,326.1285642700724,216.0,10120.574096478582,1728.0,4783.218942627727,0.0040153249897389,0.039630093,8.869688
16,896,2432,10.9844,16,16,128,1,56,NVIDIA RTX 6000 Ada Generation,1024,16,128,142,2505,960.0,6326,128,69730304.0,479.5492957746479,1245184.0,1216.0,4332.0,10780.155658721924,1635.9388922499284,152.0,53711.652755737305,1216.0,8150.993778929466,0.0174280656768342,0.17004564,8.756995
4,18432,16384,204.5472,8,256,64,0,72,NVIDIA H800,4096,16,128,132,1830,3352.32,8820,128,4831838208.0,8936.727272727272,67108864.0,16384.0,590080.0,307196.74056884483,116759.83870110544,8448.0,580541.866341817,67584.0,220653.30038265308,0.0238744775097409,0.23046108,8.653028
2,768,1024,4.7256,8,64,64,0,12,NVIDIA H200,4096,16,128,132,1830,4916.7,10403,128,12582912.0,23.27272727272728,1048576.0,256.0,1552.0,550.8954474514155,260.3660142732265,144.0,6747.0493976523885,1152.0,3188.812628418485,0.0026911582248817,0.025371123,8.427553
8,768,2560,5.922,8,64,64,0,12,NVIDIA H100,4096,16,128,132,1830,3352.32,8820,128,31457280.0,58.18181818181818,2621440.0,640.0,3880.0,2019.9351840549043,767.7402626089498,360.0,24738.99998615697,2880.0,9402.839504942604,0.005368683429374,0.050451748,8.3974
6,768,1024,4.6868,8,64,64,0,12,NVIDIA H200,4096,16,128,132,1830,4916.7,10403,128,12582912.0,23.27272727272728,1048576.0,256.0,1552.0,550.8954474514155,260.3660142732265,144.0,6747.0493976523885,1152.0,3188.812628418485,0.0027134371655503,0.025371123,8.350147
4,1536,2560,7.963600000000001,8,64,64,0,24,NVIDIA H200,4096,16,128,132,1830,4916.7,10403,128,62914560.0,116.36363636363636,2621440.0,640.0,7720.0,2740.278900982557,1295.1196070807398,360.0,16867.62349413097,2880.0,7972.031571046211,0.0079846660477053,0.07271798,8.107193
8,512,1024,3.8548,8,64,64,0,8,NVIDIA H200,4096,16,128,132,1830,4916.7,10403,128,8388608.0,15.515151515151516,1048576.0,256.0,1040.0,369.1567431375465,174.47207142020332,144.0,6747.0493976523885,1152.0,3188.812628418485,0.002199394228408,0.019549072,7.8883533
3,768,2048,4.962,8,64,64,0,12,NVIDIA H20,1024,16,128,78,1830,4022.784,8815,128,25165824.0,315.0769230769231,2097152.0,2048.0,3104.0,1346.6234560366029,614.5405891059273,288.0,9745.666661213354,2304.0,4447.499933529496,0.0346983438148423,0.30231073,7.7125382
14,768,2560,7.777799999999999,8,64,64,0,24,NVIDIA H200,4096,16,128,132,1830,4916.7,10403,128,62914560.0,116.36363636363636,2621440.0,640.0,3920.0,1391.43695490306,657.6254999684586,360.0,16867.62349413097,2880.0,7972.031571046211,0.0081754077679428,0.07077011,7.656452
6,768,2048,4.9236,8,64,64,0,12,NVIDIA H20,1024,16,128,78,1830,4022.784,8815,128,25165824.0,315.0769230769231,2097152.0,2048.0,3104.0,1346.6234560366029,614.5405891059273,288.0,9745.666661213354,2304.0,4447.499933529496,0.0349689621434006,0.30231073,7.6451135
5,768,2048,4.923399999999999,8,64,64,0,12,NVIDIA H20,1024,16,128,78,1830,4022.784,8815,128,25165824.0,315.0769230769231,2097152.0,2048.0,3104.0,1346.6234560366029,614.5405891059273,288.0,9745.666661213354,2304.0,4447.499933529496,0.034970382664266,0.30231073,7.6447625
8,1024,1536,4.482,8,64,64,0,16,NVIDIA H200,4096,16,128,132,1830,4916.7,10403,128,25165824.0,46.54545454545455,1572864.0,384.0,3096.0,1098.951227647927,519.3899356893745,216.0,10120.574096478582,1728.0,4783.218942627727,0.0056748493116917,0.048430562,7.534233
6,1024,768,5.6916,8,64,64,0,16,NVIDIA H200,4096,16,128,132,1830,4916.7,10403,128,12582912.0,23.27272727272728,786432.0,192.0,1548.0,549.4756138239635,259.69496784468726,108.0,5060.287048239291,864.0,2391.609471313864,0.0022344046151348,0.018700251,7.369199
40,768,4096,8.764000000000001,8,64,64,0,96,NVIDIA H200,4096,16,128,132,1830,4916.7,10403,128,402653184.0,744.7272727272727,4194304.0,1024.0,6464.0,2294.451141962597,1084.4110285194174,576.0,26988.19759060956,4608.0,12755.25051367394,0.0464348235782792,0.38821417,7.3604083
8,640,1536,4.3154,8,64,64,0,12,NVIDIA H20,1024,16,128,78,1830,4022.784,8815,128,18874368.0,236.30769230769232,1572864.0,1536.0,1944.0,843.3749995280788,384.87980194005246,216.0,7309.249995910015,1728.0,3335.6249501471216,0.029923039928381,0.2474365,7.269094
8,896,2432,5.5892,8,64,64,0,16,NVIDIA H20,1024,16,128,78,1830,4022.784,8815,128,39845888.0,498.87179487179486,2490368.0,2432.0,4294.0,1862.8869588341408,850.1408793881611,342.0,11572.979160190858,2736.0,5281.406171066275,0.0487739816398247,0.37598482,6.7087154
4,1536,8960,39.487100000000005,16,16,128,1,96,NVIDIA L20,516,16,128,92,2520,864.096,4011,128,440401920.0,9277.087967644084,9175040.0,17781.08527131783,27160.0,75538.50726384134,16273.378701734291,1120.0,286579.07910405786,8960.0,61738.1789921466,0.0932300451069964,0.71709615,6.6916842
12,2304,16384,65.046,16,16,128,1,144,NVIDIA RTX 6000 Ada Generation,1024,16,128,142,2505,960.0,6326,128,1207959552.0,8307.38028169014,16777216.0,16384.0,74240.0,184745.78857421875,28036.034940128044,2048.0,723693.84765625,16384.0,109823.91617926018,0.0509842184566091,0.37639892,6.382654
16,512,2048,5.2116,8,64,64,0,16,NVIDIA H200,4096,16,128,132,1830,4916.7,10403,128,33554432.0,62.06060606060606,2097152.0,512.0,2112.0,749.6721552947099,354.3125142687206,288.0,13494.098795304775,2304.0,6377.62525683697,0.0065071953884929,0.047650628,6.32275
5,2560,8192,631.2006000000001,64,128,64,1,60,NVIDIA A40,1024,16,128,84,1740,696.096,2430,128,2684354560.0,31207.61904761905,45088768.0,44032.0,41984.0,100083.85158081644,28669.94598765433,1032.0,206651.7941558169,8256.0,59197.31987847223,0.0284147595007958,0.20710781,6.2887387
2,768,1024,3.995600000000001,8,64,64,0,12,NVIDIA H100,4096,16,128,132,1830,3352.32,8820,128,12582912.0,23.27272727272728,1048576.0,256.0,1552.0,807.9740736219618,307.09610504357994,144.0,9895.59999446279,1152.0,3761.135801977041,0.0031828354458657,0.022913508,6.199067
6,768,1024,3.8676,8,64,64,0,12,NVIDIA H800,4096,16,128,132,1830,3352.32,8820,128,12582912.0,23.27272727272728,1048576.0,256.0,1552.0,807.9740736219618,307.09610504357994,144.0,9895.59999446279,1152.0,3761.135801977041,0.003288172848149,0.022913508,5.9684443
8,4608,16384,181.9104,16,16,128,1,288,NVIDIA RTX 6000 Ada Generation,1024,16,128,142,2505,960.0,6326,128,2415919104.0,16614.76056338028,25165824.0,24576.0,147968.0,368217.4682617188,55878.71791515176,3072.0,1085540.771484375,24576.0,164735.87426889027,0.0364610211810715,0.2506093,5.873347
6,1280,2048,6.319000000000001,8,64,64,0,20,NVIDIA H200,4096,16,128,132,1830,4916.7,10403,128,41943040.0,77.57575757575758,2097152.0,512.0,5152.0,1828.7457121583072,864.3077999585456,288.0,13494.098795304775,2304.0,6377.62525683697,0.0067085178601578,0.045682512,5.80962
13,1536,4480,21.4421,16,16,128,1,96,NVIDIA L20,516,16,128,92,2520,864.096,4011,128,220200960.0,4638.543983822043,4587520.0,8890.542635658914,13580.0,37769.25363192067,8136.689350867147,560.0,143289.53955202893,4480.0,30869.0894960733,0.0858447660011024,0.5844086,5.807737
14,1536,4480,21.3751,16,16,128,1,96,NVIDIA L20,516,16,128,92,2520,864.096,4011,128,220200960.0,4638.543983822043,4587520.0,8890.542635658914,13580.0,37769.25363192067,8136.689350867147,560.0,143289.53955202893,4480.0,30869.0894960733,0.0861138454122899,0.5844086,5.786464
8,1536,2560,5.7940000000000005,8,64,64,0,24,NVIDIA H200,4096,16,128,132,1830,4916.7,10403,128,62914560.0,116.36363636363636,2621440.0,640.0,7720.0,2740.278900982557,1295.1196070807398,360.0,16867.62349413097,2880.0,7972.031571046211,0.0109745748252513,0.07271798,5.626035
8,1024,1024,3.8618,8,64,64,0,16,NVIDIA H200,4096,16,128,132,1830,4916.7,10403,128,16777216.0,31.03030303030303,1048576.0,256.0,2064.0,732.6341517652847,346.2599571262496,144.0,6747.0493976523885,1152.0,3188.812628418485,0.0043908150974506,0.028645528,5.5239534
6,896,2432,5.7492,8,64,64,0,16,NVIDIA H100,4096,16,128,132,1830,3352.32,8820,128,39845888.0,73.6969696969697,2490368.0,608.0,4294.0,2235.4643506009693,849.6589401141316,342.0,23502.049986849124,2736.0,8932.697529695472,0.0070047255514542,0.045520328,5.498509
8,1024,768,3.4388,8,64,64,0,16,NVIDIA H20,1024,16,128,78,1830,4022.784,8815,128,12582912.0,157.53846153846155,786432.0,768.0,1548.0,671.5763885130997,306.4783608041159,108.0,3654.624997955008,864.0,1667.8124750735608,0.0250339045610747,0.16233999,5.4848027
14,896,2432,11.6277,16,16,128,1,56,NVIDIA L20,516,16,128,92,2520,864.096,4011,128,69730304.0,1468.8722615436468,1245184.0,2413.1472868217056,4332.0,12048.33628376144,2595.591919584424,152.0,38892.875021265005,1216.0,8378.752863219894,0.0501290726517605,0.32473817,5.4780393
8,1280,2048,5.9796,8,64,64,0,20,NVIDIA H200,4096,16,128,132,1830,4916.7,10403,128,41943040.0,77.57575757575758,2097152.0,512.0,5152.0,1828.7457121583072,864.3077999585456,288.0,13494.098795304775,2304.0,6377.62525683697,0.0070892909823963,0.045682512,5.4438686
5,896,2432,5.6916,8,64,64,0,16,NVIDIA H800,4096,16,128,132,1830,3352.32,8820,128,39845888.0,73.6969696969697,2490368.0,608.0,4294.0,2235.4643506009693,849.6589401141316,342.0,23502.049986849124,2736.0,8932.697529695472,0.0070756146145935,0.045520328,5.433402
8,896,2432,5.6916,8,64,64,0,16,NVIDIA H800,4096,16,128,132,1830,3352.32,8820,128,39845888.0,73.6969696969697,2490368.0,608.0,4294.0,2235.4643506009693,849.6589401141316,342.0,23502.049986849124,2736.0,8932.697529695472,0.0070756146145935,0.045520328,5.433402
3,1536,4096,19.1317,16,16,128,1,96,NVIDIA L20,516,16,128,92,2520,864.096,4011,128,201326592.0,4240.954499494439,4194304.0,8128.496124031008,12416.0,34531.8890348989,7439.2588350785345,512.0,131007.5790189979,4096.0,28223.16753926702,0.0879649195931534,0.5646235,5.418734
36,896,4864,8.526999999999997,8,64,64,0,112,NVIDIA H200,4096,16,128,132,1830,4916.7,10403,128,557842432.0,1031.7575757575758,4980736.0,1216.0,8892.0,3156.2901538260226,1491.7362106427383,684.0,32048.484638848844,5472.0,15146.859984987805,0.0661196146318621,0.4209853,5.367026
38,896,4864,8.5268,8,64,64,0,112,NVIDIA H200,4096,16,128,132,1830,4916.7,10403,128,557842432.0,1031.7575757575758,4980736.0,1216.0,8892.0,3156.2901538260226,1491.7362106427383,684.0,32048.484638848844,5472.0,15146.859984987805,0.0661211654977117,0.4209853,5.366876
4,2304,4096,17.9284,16,16,128,1,144,NVIDIA RTX 6000 Ada Generation,1024,16,128,142,2505,960.0,6326,128,301989888.0,2076.845070422535,4194304.0,4096.0,18560.0,46186.44714355469,7009.008735032011,512.0,180923.4619140625,4096.0,27455.979044815045,0.046243940810789,0.29427332,5.363499
6,2304,4096,17.89,16,16,128,1,144,NVIDIA RTX 6000 Ada Generation,1024,16,128,142,2505,960.0,6326,128,301989888.0,2076.845070422535,4194304.0,4096.0,18560.0,46186.44714355469,7009.008735032011,512.0,180923.4619140625,4096.0,27455.979044815045,0.0463432011420989,0.29427332,5.3498693
4,2304,3584,16.162,16,16,128,1,144,NVIDIA RTX 6000 Ada Generation,1024,16,128,142,2505,960.0,6326,128,264241152.0,1817.2394366197184,3670016.0,3584.0,16240.0,40413.14125061035,6132.88264315301,448.0,158308.0291748047,3584.0,24023.981664213166,0.0448858362132243,0.28435948,5.3351703
10,640,3072,8.622800000000002,8,64,64,1,48,NVIDIA H200,4096,16,128,132,1830,4916.7,10403,128,62914560.0,116.36363636363636,1572864.0,384.0,3936.0,1397.1162894128686,660.3096856826156,216.0,10120.574096478582,1728.0,4783.218942627727,0.0073742504218474,0.046513643,5.307569
2,768,2048,5.2882,8,64,64,0,12,NVIDIA H100,4096,16,128,132,1830,3352.32,8820,128,25165824.0,46.54545454545455,2097152.0,512.0,3104.0,1615.9481472439236,614.1922100871599,288.0,19791.19998892558,2304.0,7522.271603954082,0.0048097036070879,0.030166887,5.2720776
40,768,4096,8.1874,8,64,64,0,96,NVIDIA H100,4096,16,128,132,1830,3352.32,8820,128,402653184.0,744.7272727272727,4194304.0,1024.0,6464.0,3365.170368487346,1279.0394478103742,576.0,39582.39997785116,4608.0,15044.543207908164,0.0497050093851576,0.30951074,5.2269516
6,1536,2048,7.643800000000001,8,64,64,0,24,NVIDIA H200,4096,16,128,132,1830,4916.7,10403,128,50331648.0,93.0909090909091,2097152.0,512.0,6176.0,2192.223120786046,1036.095685664592,288.0,13494.098795304775,2304.0,6377.62525683697,0.0066549817145928,0.040304676,5.056309
20,1152,3584,8.8978,8,64,64,0,72,NVIDIA H100,4096,16,128,132,1830,3352.32,8820,128,264241152.0,488.7272727272728,3670016.0,896.0,8232.0,4285.594442046385,1628.875732421875,504.0,34634.59998061976,4032.0,13163.975306919643,0.0300146197326896,0.18088318,5.026501
24,1152,3584,8.8726,8,64,64,0,72,NVIDIA H100,4096,16,128,132,1830,3352.32,8820,128,264241152.0,488.7272727272728,3670016.0,896.0,8232.0,4285.594442046385,1628.875732421875,504.0,34634.59998061976,4032.0,13163.975306919643,0.0300998673959748,0.18088318,5.0094333
5,10752,7168,60.99400000000001,8,192,64,1,78,NVIDIA H20,1024,16,128,78,1830,4022.784,8815,128,1233125376.0,15438.76923076923,22020096.0,21504.0,150640.0,65352.88576590009,29824.224981609823,2800.0,94749.5369840187,22400.0,43239.58268709231,0.1383166527601588,0.81990725,4.927755
15,768,2048,9.880400000000002,16,16,128,1,48,NVIDIA L20,516,16,128,92,2520,864.096,4011,128,50331648.0,1060.2386248736098,1048576.0,2032.124031007752,3136.0,8721.971972732197,1878.9880562827225,128.0,32751.894754749475,1024.0,7055.791884816755,0.04258224495416,0.25089985,4.8921227
4,10752,7168,60.386,8,192,64,1,78,NVIDIA H20,1024,16,128,78,1830,4022.784,8815,128,1233125376.0,15438.76923076923,22020096.0,21504.0,150640.0,65352.88576590009,29824.224981609823,2800.0,94749.5369840187,22400.0,43239.58268709231,0.1397093021305125,0.81990725,4.868665
16,896,2432,11.7526,16,16,128,1,56,NVIDIA L40,512,16,128,142,2490,864.096,5647,128,69730304.0,959.0985915492956,1245184.0,2432.0,4332.0,11904.903708954756,1821.67162657924,152.0,59315.66058496756,1216.0,9076.398981552706,0.0327740378510893,0.1910874,4.8304486
13,768,2048,9.7685,16,16,128,1,48,NVIDIA L20,516,16,128,92,2520,864.096,4011,128,50331648.0,1060.2386248736098,1048576.0,2032.124031007752,3136.0,8721.971972732197,1878.9880562827225,128.0,32751.894754749475,1024.0,7055.791884816755,0.0430700325582313,0.25089985,4.8253913
16,1536,2560,13.1831,16,16,128,1,96,NVIDIA L20,516,16,128,92,2520,864.096,4011,128,125829120.0,2650.596562184024,2621440.0,5080.31007751938,7760.0,21582.430646811816,4649.536771924084,320.0,81879.7368868737,2560.0,17639.479712041884,0.0797857888214993,0.46274644,4.79986
13,768,2560,5.6788,8,64,64,0,24,NVIDIA H20,1024,16,128,78,1830,4022.784,8815,128,62914560.0,787.6923076923077,2621440.0,2560.0,3920.0,1700.632715097772,776.0950738708876,360.0,12182.083326516691,2880.0,5559.374916911869,0.0757964631653023,0.43346357,4.7187834
34,896,4864,9.4292,8,64,64,0,112,NVIDIA H100,4096,16,128,132,1830,3352.32,8820,128,557842432.0,1031.7575757575758,4980736.0,1216.0,8892.0,4629.191664076343,1759.470725546078,684.0,47004.09997369825,5472.0,17865.395059390943,0.0597931907230611,0.34067324,4.6975245
10,1536,2560,12.9172,16,16,128,1,96,NVIDIA L20,516,16,128,92,2520,864.096,4011,128,125829120.0,2650.596562184024,2621440.0,5080.31007751938,7760.0,21582.430646811816,4649.536771924084,320.0,81879.7368868737,2560.0,17639.479712041884,0.0814281758130793,0.46274644,4.682878
8,1536,4480,18.914,32,32,128,1,48,NVIDIA RTX PRO 6000 Blackwell Server Edition,1024,16,128,188,2340,1792.0,7444,128,440401920.0,2287.659574468085,9175040.0,8960.0,13720.0,17085.671424865723,4113.0471780439775,560.0,131106.37664794922,4480.0,31561.34161111298,0.0516882889278435,0.29110038,4.631843
8,1024,1536,4.603400000000001,8,64,64,0,16,NVIDIA H100,4096,16,128,132,1830,3352.32,8820,128,25165824.0,46.54545454545455,1572864.0,384.0,3096.0,1611.7833324314392,612.6092404735332,216.0,14843.399991694185,1728.0,5641.703702965561,0.0055251932517275,0.030975737,4.6062636
5,25600,5120,91.4204,8,320,64,0,80,NVIDIA H800,4096,16,128,132,1830,3352.32,8820,128,2097152000.0,3878.787878787879,26214400.0,6400.0,256080.0,133315.7221476237,50670.85733219069,3280.0,225399.77765165243,26240.0,85670.31548947704,0.0231847182676609,0.12963378,4.5913444
2,1536,4480,18.6836,32,32,128,1,48,NVIDIA RTX PRO 6000 Blackwell Server Edition,1024,16,128,188,2340,1792.0,7444,128,440401920.0,2287.659574468085,9175040.0,8960.0,13720.0,17085.671424865723,4113.0471780439775,560.0,131106.37664794922,4480.0,31561.34161111298,0.0523256918785048,0.29110038,4.563239
2,1792,5120,23.6341,16,16,128,1,112,NVIDIA L20,516,16,128,92,2520,864.096,4011,128,293601280.0,6184.725311762723,5242880.0,10160.62015503876,18080.0,50284.83841422133,10832.941344895287,640.0,163759.4737737474,5120.0,35278.95942408377,0.1038438559579725,0.57585967,4.545438
2,1536,2560,12.603599999999998,16,16,128,1,96,NVIDIA L20,516,16,128,92,2520,864.096,4011,128,125829120.0,2650.596562184024,2621440.0,5080.31007751938,7760.0,21582.430646811816,4649.536771924084,320.0,81879.7368868737,2560.0,17639.479712041884,0.0834542537539042,0.46274644,4.544911
7,1024,1536,4.5526,8,64,64,0,16,NVIDIA H800,4096,16,128,132,1830,3352.32,8820,128,25165824.0,46.54545454545455,1572864.0,384.0,3096.0,1611.7833324314392,612.6092404735332,216.0,14843.399991694185,1728.0,5641.703702965561,0.0055868458935558,0.030975737,4.5443974
2,1536,2048,6.978400000000001,8,64,64,0,24,NVIDIA H200,4096,16,128,132,1830,4916.7,10403,128,50331648.0,93.0909090909091,2097152.0,512.0,6176.0,2192.223120786046,1036.095685664592,288.0,13494.098795304775,2304.0,6377.62525683697,0.0072895433380151,0.040304676,4.5291023
6,640,3072,8.462799999999998,8,64,64,1,24,NVIDIA H100,4096,16,128,132,1830,3352.32,8820,128,31457280.0,58.18181818181818,1572864.0,384.0,3888.0,2024.0999988673889,769.3232322225766,216.0,14843.399991694185,1728.0,5641.703702965561,0.0037568350036339,0.020758782,4.525592
8,1024,1536,4.5268,8,64,64,0,16,NVIDIA H800,4096,16,128,132,1830,3352.32,8820,128,25165824.0,46.54545454545455,1572864.0,384.0,3096.0,1611.7833324314392,612.6092404735332,216.0,14843.399991694185,1728.0,5641.703702965561,0.0056186875088368,0.030975737,4.512976
3,1792,5120,23.3656,16,16,128,1,112,NVIDIA L20,516,16,128,92,2520,864.096,4011,128,293601280.0,6184.725311762723,5242880.0,10160.62015503876,18080.0,50284.83841422133,10832.941344895287,640.0,163759.4737737474,5120.0,35278.95942408377,0.1050371518855205,0.57585967,4.4824376
16,1536,2240,12.0213,16,16,128,1,96,NVIDIA L20,516,16,128,92,2520,864.096,4011,128,113246208.0,2385.536905965622,2359296.0,4572.279069767442,6984.0,19424.18758213063,4184.583094731675,288.0,73691.76319818632,2304.0,15875.531740837696,0.0787470264739618,0.43141812,4.478532
14,2560,8192,35.5992,16,16,128,1,160,NVIDIA RTX 6000 Ada Generation,1024,16,128,142,2505,960.0,6326,128,671088640.0,4615.211267605634,8388608.0,8192.0,41216.0,102565.76538085936,15564.833190898671,1024.0,361846.923828125,8192.0,54911.95808963009,0.0517539637864614,0.2826898,4.4621854
38,896,4864,9.039,8,64,64,0,112,NVIDIA H100,4096,16,128,132,1830,3352.32,8820,128,557842432.0,1031.7575757575758,4980736.0,1216.0,8892.0,4629.191664076343,1759.470725546078,684.0,47004.09997369825,5472.0,17865.395059390943,0.0623743726038155,0.34067324,4.461749
36,896,4864,8.9942,8,64,64,0,112,NVIDIA H800,4096,16,128,132,1830,3352.32,8820,128,557842432.0,1031.7575757575758,4980736.0,1216.0,8892.0,4629.191664076343,1759.470725546078,684.0,47004.09997369825,5472.0,17865.395059390943,0.062685058589523,0.34067324,4.43468
12,1536,2240,11.8807,16,16,128,1,96,NVIDIA L20,516,16,128,92,2520,864.096,4011,128,113246208.0,2385.536905965622,2359296.0,4572.279069767442,6984.0,19424.18758213063,4184.583094731675,288.0,73691.76319818632,2304.0,15875.531740837696,0.0796789439470264,0.43141812,4.4144554
36,896,4864,8.9492,8,64,64,0,112,NVIDIA H100,4096,16,128,132,1830,3352.32,8820,128,557842432.0,1031.7575757575758,4980736.0,1216.0,8892.0,4629.191664076343,1759.470725546078,684.0,47004.09997369825,5472.0,17865.395059390943,0.06300026303646,0.34067324,4.407489
5,13312,16384,145.6154,8,64,64,0,120,NVIDIA H800,4096,16,128,132,1830,3352.32,8820,128,3489660928.0,6454.30303030303,33554432.0,8192.0,426240.0,221901.3332091656,84340.6210140306,4608.0,316659.19982280926,36864.0,120356.34566326533,0.0242209378033757,0.12965363,4.3529553
8,1536,2240,11.7239,16,16,128,1,96,NVIDIA L20,516,16,128,92,2520,864.096,4011,128,113246208.0,2385.536905965622,2359296.0,4572.279069767442,6984.0,19424.18758213063,4184.583094731675,288.0,73691.76319818632,2304.0,15875.531740837696,0.0807446011439399,0.43141812,4.342996
7,1024,1024,3.8804,8,64,64,0,16,NVIDIA H800,4096,16,128,132,1830,3352.32,8820,128,16777216.0,31.03030303030303,1048576.0,256.0,2064.0,1074.5222216209593,408.4061603156888,144.0,9895.59999446279,1152.0,3761.135801977041,0.0043697685144147,0.023322618,4.337257
4,1536,2560,5.73,8,64,64,0,24,NVIDIA H20,1024,16,128,78,1830,4022.784,8815,128,62914560.0,787.6923076923077,2621440.0,2560.0,7720.0,3349.205245039489,1528.4321352763402,360.0,12182.083326516691,2880.0,5559.374916911869,0.0751191893583104,0.39954916,4.3188686
6,2560,9728,37.417,16,16,128,1,160,NVIDIA RTX 6000 Ada Generation,1024,16,128,142,2505,960.0,6326,128,796917760.0,5480.56338028169,9961472.0,9728.0,48944.0,121796.84638977052,18483.23941419217,1216.0,429693.2220458984,9728.0,65207.95023143573,0.0584720756021878,0.30712876,4.252571
15,18432,16384,205.2132,16,256,64,0,72,NVIDIA H800,4096,16,128,132,1830,3352.32,8820,128,9663676416.0,17873.454545454544,134217728.0,32768.0,590336.0,307330.0146428443,116810.49372874148,8704.0,598134.0441097508,69632.0,227339.76403061225,0.0475939903093999,0.24959238,4.2441983
16,1024,3072,14.267600000000002,16,16,128,1,64,NVIDIA L40,512,16,128,142,2490,864.096,5647,128,100663296.0,1384.56338028169,1572864.0,3072.0,6240.0,17148.337752511005,2624.014531360678,192.0,74925.0449494327,1536.0,11464.925029329734,0.0389728861416027,0.20411621,4.237389
4,2560,9728,37.2696,16,16,128,1,160,NVIDIA RTX 6000 Ada Generation,1024,16,128,142,2505,960.0,6326,128,796917760.0,5480.56338028169,9961472.0,9728.0,48944.0,121796.84638977052,18483.23941419217,1216.0,429693.2220458984,9728.0,65207.95023143573,0.058703330671836,0.30712876,4.2318788
3,25600,5120,90.2098,8,512,64,1,78,NVIDIA H20,1024,16,128,78,1830,4022.784,8815,128,2097152000.0,26256.410256410258,41943040.0,40960.0,256080.0,111096.43512301974,50699.59860123901,5200.0,175963.42582746333,41600.0,80302.08213317144,0.1590488524244294,0.83107173,4.2252603
32,1280,8192,62.9431,32,32,128,1,40,NVIDIA A40,1024,16,128,84,1740,696.096,2430,128,671088640.0,7801.9047619047615,16777216.0,16384.0,20992.0,50041.92579040822,14334.972993827165,1024.0,205049.8422631361,8192.0,58738.42592592593,0.0712366138852315,0.3676711,4.161266
16,512,1024,5.7014000000000005,16,16,128,1,32,NVIDIA L20,516,16,128,92,2520,864.096,4011,128,16777216.0,353.4128749578699,524288.0,1016.062015503876,1056.0,2936.990562246556,632.7204679319372,64.0,16375.947377374738,512.0,3527.8959424083773,0.0245980293170731,0.12603669,4.123852
8,1536,2048,10.523599999999998,16,16,128,1,96,NVIDIA L20,516,16,128,92,2520,864.096,4011,128,100663296.0,2120.4772497472195,2097152.0,4064.248062015504,6208.0,17265.94451744945,3719.6294175392673,256.0,65503.78950949895,2048.0,14111.58376963351,0.0799592559666052,0.40878046,4.1123586
15,512,1024,5.6724000000000006,16,16,128,1,32,NVIDIA L20,516,16,128,92,2520,864.096,4011,128,16777216.0,353.4128749578699,524288.0,1016.062015503876,1056.0,2936.990562246556,632.7204679319372,64.0,16375.947377374738,512.0,3527.8959424083773,0.0247237861131727,0.12603669,4.0977893
36,768,4096,12.712,64,64,64,1,12,NVIDIA RTX PRO 6000 Blackwell Server Edition,1024,16,128,188,2340,1792.0,7444,128,402653184.0,2091.574468085106,33554432.0,32768.0,6656.0,8288.792201450893,1995.3674939548632,1024.0,239737.3744419643,8192.0,57712.167517463735,0.0703142890789343,0.35722446,4.080396
6,896,896,3.7972,8,64,64,0,16,NVIDIA H100,4096,16,128,132,1830,3352.32,8820,128,14680064.0,27.151515151515152,917504.0,224.0,1582.0,823.592129168778,313.03224109468005,126.0,8658.64999515494,1008.0,3290.993826729911,0.0039073247459754,0.019552002,4.003926
8,896,896,3.797,8,64,64,0,16,NVIDIA H100,4096,16,128,132,1830,3352.32,8820,128,14680064.0,27.151515151515152,917504.0,224.0,1582.0,823.592129168778,313.03224109468005,126.0,8658.64999515494,1008.0,3290.993826729911,0.0039075305571288,0.019552002,4.003662
5,53248,16384,583.135,8,256,64,0,132,NVIDIA H800,4096,16,128,132,1830,3352.32,8820,128,13958643712.0,25817.21212121212,134217728.0,32768.0,1704192.0,887205.5106146638,337210.5189732143,16896.0,1161083.732683634,135168.0,441306.60076530615,0.0241929676429209,0.12011835,3.9650095
