pipetuning_test/moe_dse/moe_dse_PRO6000S_99_5.csv
weight_type,M,E,topk,H,N,BLOCK_SIZE_M,BLOCK_SIZE_N,BLOCK_SIZE_K,GROUP_SIZE_M,num_warps,num_stages,avg_duration,sample_count
w13,1,8,2,1024,512,16,16,64,1,4,4,3.714,3
w13,1,16,2,1536,768,16,32,128,1,4,3,4.748,3
w13,1,16,2,1536,768,16,32,128,1,4,4,4.748666666666667,3
w13,1,16,2,1536,768,16,32,128,4,4,4,4.738,3
w13,1,16,2,1536,768,16,32,128,16,4,4,4.738,3
w13,1,16,2,1536,768,16,32,128,32,4,4,4.759333333333333,3
w13,1,16,2,1536,768,16,32,128,64,4,4,4.748666666666667,3
w13,1,16,4,1536,1024,16,64,64,1,4,4,6.903333333333333,3
w13,1,16,4,1536,1024,16,64,64,1,8,4,6.935,3
w13,1,32,4,2048,768,16,64,64,1,4,4,7.031333333333333,3
w13,1,32,6,3072,1024,16,128,64,1,8,4,14.999333333333333,3
w13,1,60,4,2048,1408,16,64,128,1,8,4,10.348666666666666,3
w13,1,60,6,3584,2304,16,32,64,1,4,2,118.70100000000001,3
w13,1,60,6,3584,2304,16,64,128,1,8,2,118.24233333333332,3
w13,1,60,6,3584,2304,16,64,128,16,4,2,118.125,3
w13,1,60,6,3584,2304,16,64,128,32,8,2,118.13566666666667,3
w13,1,60,6,3584,2304,16,64,128,64,4,2,118.42333333333333,3
w13,1,60,6,3584,2304,16,64,128,64,8,2,118.37033333333333,3
w13,1,60,6,3584,2304,32,32,256,1,4,2,118.60466666666667,3
w13,1,60,8,2048,1536,16,256,32,8,4,4,17.569666666666667,3
w13,1,64,6,3072,2048,16,32,128,4,4,2,60.812666666666665,3
w13,1,64,6,3072,2048,16,32,128,32,4,2,60.812666666666665,3
w13,1,64,6,3072,2048,16,32,128,64,4,2,60.674,3
w13,1,64,6,3072,2048,16,64,128,32,4,2,60.61033333333333,3
w13,1,64,6,3584,1536,16,128,128,1,8,3,24.802000000000003,3
w13,1,64,8,3584,2560,16,32,64,1,4,2,185.79433333333336,3
w13,1,64,8,3584,2560,16,32,256,16,4,2,185.965,3
w13,1,128,4,2048,512,16,32,128,1,4,4,5.633666666666667,3
w13,1,128,4,2048,512,16,32,128,32,4,4,5.634,3
w13,1,128,4,2048,512,16,32,128,64,4,4,5.623333333333334,3
w13,1,128,6,4096,2048,16,64,128,16,4,2,115.99166666666666,3
w13,1,128,6,4096,2048,16,64,128,32,4,2,116.37566666666667,3
w13,1,128,8,2048,768,16,128,64,1,8,4,10.189,3
w13,1,128,8,4096,1536,16,64,128,16,4,2,116.63133333333333,3
w13,1,128,8,4096,1536,32,64,128,16,4,2,117.07966666666668,3
w13,1,128,8,4096,3072,32,32,256,1,4,2,260.2476666666667,3
w13,2,8,2,1024,512,16,32,128,4,4,4,3.8633333333333333,3
w13,2,16,2,1536,768,16,64,64,1,4,4,5.729666666666667,3
w13,2,16,4,1536,1024,16,64,64,1,4,4,10.796333333333331,3
w13,2,16,4,1536,1024,16,128,64,1,8,4,10.839666666666666,3
w13,2,32,4,2048,768,16,128,64,1,8,4,10.53,3
w13,2,32,6,3072,1024,16,32,128,32,4,2,60.84466666666666,3
w13,2,32,6,3072,1024,16,32,128,64,4,2,60.941,3
w13,2,60,4,2048,1408,16,128,64,16,8,4,17.335333333333335,3
w13,2,60,4,2048,1408,16,128,64,32,8,4,17.292666666666666,3
w13,2,60,4,2048,1408,16,128,64,64,8,4,17.356666666666666,3
w13,2,60,6,3584,2304,16,32,256,1,4,2,256.0563333333333,3
w13,2,60,6,3584,2304,16,32,256,16,4,2,255.56533333333334,3
w13,2,60,8,2048,1536,32,32,64,1,4,2,118.18799999999999,3
w13,2,64,6,3072,2048,32,32,256,1,4,2,193.31433333333334,3
w13,2,64,6,3072,2048,32,32,256,16,4,2,194.08233333333337,3
w13,2,64,6,3584,1536,16,32,64,1,4,2,163.309,3
w13,2,64,6,3584,1536,32,32,64,1,4,2,163.67133333333334,3
w13,2,64,8,3584,2560,16,32,256,1,4,2,382.9576666666667,3
w13,2,64,8,3584,2560,16,32,256,16,4,2,381.5176666666666,3
w13,2,64,8,3584,2560,16,64,256,1,4,2,382.9793333333334,3
w13,2,64,8,3584,2560,16,64,256,16,4,2,382.49933333333337,3
w13,2,64,8,3584,2560,32,32,128,1,4,2,382.47766666666666,3
w13,2,64,8,3584,2560,32,32,256,1,4,2,382.16833333333335,3
w13,2,128,4,2048,512,16,64,64,1,4,4,7.884666666666667,3
w13,2,128,4,2048,512,16,64,128,32,8,4,7.863333333333333,3
w13,2,128,4,2048,512,16,64,128,64,8,4,7.874,3
w13,2,128,6,4096,2048,32,32,256,1,4,2,259.0423333333334,3
w13,2,128,8,2048,768,16,256,32,8,4,4,17.420666666666666,3
w13,2,128,8,4096,1536,16,32,64,1,4,2,260.91966666666667,3
w13,2,128,8,4096,1536,32,32,256,1,4,2,259.6716666666667,3
w13,2,128,8,4096,3072,16,16,64,1,4,3,526.7436666666666,3
w13,2,128,8,4096,3072,16,16,128,1,4,3,526.4876666666667,3
w13,2,128,8,4096,3072,16,16,256,1,4,3,527.0853333333333,3
w13,2,128,8,4096,3072,16,16,256,4,4,4,527.1706666666666,3
w13,2,128,8,4096,3072,16,32,64,1,4,3,525.8473333333333,3
w13,2,128,8,4096,3072,16,32,64,1,4,4,526.0613333333333,3
w13,2,128,8,4096,3072,16,32,64,16,4,3,526.9566666666666,3
w13,2,128,8,4096,3072,16,32,64,16,4,4,527.1383333333333,3
w13,2,128,8,4096,3072,16,32,64,32,4,3,526.6370000000001,3
w13,2,128,8,4096,3072,16,32,64,32,4,4,526.6476666666666,3
w13,2,128,8,4096,3072,16,32,64,64,4,3,527.17,3
w13,2,128,8,4096,3072,16,32,64,64,4,4,527.1916666666666,3
w13,2,128,8,4096,3072,16,32,128,1,4,2,524.5573333333333,3
w13,2,128,8,4096,3072,16,32,128,4,4,2,526.6793333333334,3
w13,2,128,8,4096,3072,16,32,128,16,4,2,526.4346666666667,3
w13,2,128,8,4096,3072,16,32,128,32,4,2,526.0396666666667,3
w13,2,128,8,4096,3072,16,32,128,64,4,2,526.0713333333333,3
w13,2,128,8,4096,3072,16,64,64,16,4,2,526.84,3
w13,2,128,8,4096,3072,16,64,64,32,4,2,526.7223333333333,3
w13,2,128,8,4096,3072,16,64,64,64,4,2,527.0853333333333,3
w13,2,128,8,4096,3072,32,32,64,1,4,3,526.4236666666667,3
w13,2,128,8,4096,3072,32,32,64,32,4,3,526.9253333333332,3
w13,2,128,8,4096,3072,32,32,64,128,4,3,527.1063333333333,3
w13,2,128,8,4096,3072,32,32,128,1,4,2,526.2103333333333,3
w13,2,128,8,4096,3072,32,32,128,1,4,3,526.552,3
w13,2,128,8,4096,3072,32,32,128,1,8,3,526.8606666666667,3
w13,2,128,8,4096,3072,32,32,128,4,4,3,527.1916666666667,3
w13,2,128,8,4096,3072,32,32,128,4,8,3,526.9036666666667,3
w13,2,128,8,4096,3072,32,32,128,16,4,2,527.0,3
w13,2,128,8,4096,3072,32,32,128,16,4,3,526.658,3
w13,2,128,8,4096,3072,32,32,128,16,8,3,527.1063333333333,3
w13,2,128,8,4096,3072,32,32,128,64,4,2,526.9886666666666,3
w13,2,128,8,4096,3072,32,32,128,64,4,3,527.0853333333333,3
w13,2,128,8,4096,3072,32,32,128,64,8,3,526.6476666666666,3
w13,2,128,8,4096,3072,32,32,256,1,4,2,525.7406666666667,3
w13,2,128,8,4096,3072,32,32,256,1,4,4,527.0743333333334,3
w13,2,128,8,4096,3072,32,32,256,4,4,3,526.968,3
w13,2,128,8,4096,3072,32,32,256,4,4,4,526.9993333333333,3
w13,2,128,8,4096,3072,32,32,256,4,8,3,526.8183333333333,3
w13,2,128,8,4096,3072,32,32,256,16,4,3,526.8506666666667,3
w13,2,128,8,4096,3072,32,32,256,16,8,3,526.9676666666667,3
w13,2,128,8,4096,3072,32,32,256,32,8,3,526.7866666666666,3
w13,2,128,8,4096,3072,64,64,128,1,4,2,526.6046666666666,3
w13,4,8,2,1024,512,16,64,64,1,4,4,5.037,3
w13,4,16,2,1536,768,16,128,64,1,8,4,8.334999999999999,3
w13,4,16,4,1536,1024,16,64,64,16,4,3,18.284666666666666,3
w13,4,16,4,1536,1024,16,64,64,32,4,3,18.242,3
w13,4,16,4,1536,1024,16,64,64,32,4,4,18.327333333333332,3
w13,4,32,4,2048,768,16,256,32,8,4,4,18.37,3
w13,4,32,6,3072,1024,32,32,128,64,4,2,195.09533333333331,3
w13,4,32,6,3072,1024,32,32,256,1,4,2,194.23166666666665,3
w13,4,60,4,2048,1408,16,32,64,1,4,2,103.60766666666666,3
w13,4,60,6,3584,2304,16,16,128,1,4,2,518.3603333333334,3
w13,4,60,6,3584,2304,16,16,128,4,4,3,518.371,3
w13,4,60,6,3584,2304,16,32,128,1,4,2,518.2643333333334,3
w13,4,60,6,3584,2304,16,32,128,1,4,3,518.0296666666667,3
w13,4,60,6,3584,2304,16,32,128,4,4,3,518.1576666666666,3
w13,4,60,6,3584,2304,16,32,128,16,4,3,518.2856666666667,3
w13,4,60,6,3584,2304,16,32,256,1,4,2,515.8753333333333,3
w13,4,60,6,3584,2304,16,32,256,16,4,2,518.1793333333334,3
w13,4,60,6,3584,2304,16,64,256,1,4,2,516.7710000000001,3
w13,4,60,6,3584,2304,16,128,128,1,8,3,518.3603333333334,3
w13,4,60,6,3584,2304,32,32,128,1,4,2,517.368,3
w13,4,60,6,3584,2304,32,32,128,4,4,2,518.3713333333334,3
w13,4,60,6,3584,2304,32,64,256,1,4,2,517.3149999999999,3
w13,4,60,8,2048,1536,32,32,128,1,4,2,259.75666666666666,3
w13,4,60,8,2048,1536,32,32,256,1,4,2,260.47133333333335,3
w13,4,60,8,2048,1536,64,64,128,1,4,2,260.3533333333333,3
w13,4,64,6,3072,2048,16,16,128,1,4,3,396.6003333333333,3
w13,4,64,6,3072,2048,16,16,256,1,4,2,396.291,3
w13,4,64,6,3072,2048,16,16,256,1,4,3,396.10966666666667,3
w13,4,64,6,3072,2048,16,16,256,1,4,4,396.9203333333333,3
w13,4,64,6,3072,2048,16,16,256,4,4,3,396.30133333333333,3
w13,4,64,6,3072,2048,16,16,256,4,4,4,396.013,3
w13,4,64,6,3072,2048,16,16,256,4,8,3,396.93100000000004,3
w13,4,64,6,3072,2048,16,32,128,1,4,2,397.08033333333333,3
w13,4,64,6,3072,2048,16,32,128,1,4,4,396.90933333333334,3
w13,4,64,6,3072,2048,16,32,128,4,4,4,396.387,3
w13,4,64,6,3072,2048,16,32,256,1,4,4,396.41900000000004,3
w13,4,64,6,3072,2048,16,32,256,1,8,4,396.05600000000004,3
w13,4,64,6,3072,2048,16,32,256,16,4,4,396.70700000000005,3
w13,4,64,6,3072,2048,16,32,256,16,8,4,396.7816666666667,3
w13,4,64,6,3072,2048,16,32,256,32,4,4,397.06933333333336,3
w13,4,64,6,3072,2048,16,32,256,64,4,4,397.0806666666667,3
w13,4,64,6,3072,2048,16,32,256,64,8,4,397.0056666666666,3
w13,4,64,6,3072,2048,16,64,128,64,4,4,397.2083333333333,3
w13,4,64,6,3072,2048,32,16,128,4,4,3,397.1333333333334,3
w13,4,64,6,3072,2048,32,16,128,4,4,4,396.4936666666667,3
w13,4,64,6,3072,2048,32,32,128,4,4,3,397.02700000000004,3
w13,4,64,6,3072,2048,32,32,256,1,4,2,395.23499999999996,3
w13,4,64,6,3072,2048,32,32,256,1,4,3,396.6323333333333,3
w13,4,64,6,3072,2048,32,32,256,1,4,4,396.483,3
w13,4,64,6,3072,2048,32,32,256,1,8,2,397.1863333333333,3
w13,4,64,6,3072,2048,32,32,256,1,8,3,397.1016666666667,3
w13,4,64,6,3072,2048,32,32,256,1,8,4,396.61100000000005,3
w13,4,64,6,3072,2048,32,32,256,4,4,2,396.99500000000006,3
w13,4,64,6,3072,2048,32,32,256,4,4,3,396.3976666666667,3
w13,4,64,6,3072,2048,32,32,256,4,4,4,396.49333333333334,3
w13,4,64,6,3072,2048,32,32,256,4,8,2,397.0586666666666,3
w13,4,64,6,3072,2048,32,32,256,4,8,3,396.6003333333333,3
w13,4,64,6,3072,2048,32,32,256,4,8,4,396.66433333333333,3
w13,4,64,6,3072,2048,32,32,256,16,4,2,396.8243333333333,3
w13,4,64,6,3072,2048,32,32,256,16,4,3,396.93100000000004,3
w13,4,64,6,3072,2048,32,32,256,16,4,4,396.80266666666665,3
w13,4,64,6,3072,2048,32,32,256,16,8,3,397.16499999999996,3
w13,4,64,6,3072,2048,32,32,256,16,8,4,396.7283333333333,3
w13,4,64,6,3072,2048,32,32,256,32,8,4,397.09100000000007,3
w13,4,64,6,3584,1536,16,32,128,1,4,2,344.801,3
w13,4,64,8,3584,2560,16,16,64,1,4,3,767.5346666666666,3
w13,4,64,8,3584,2560,16,16,128,1,4,2,766.9476666666666,3
w13,4,64,8,3584,2560,16,16,128,1,4,3,766.4786666666665,3
w13,4,64,8,3584,2560,16,16,128,1,4,4,767.652,3
w13,4,64,8,3584,2560,16,16,128,1,8,3,768.004,3
w13,4,64,8,3584,2560,16,16,128,4,4,2,767.4066666666668,3
w13,4,64,8,3584,2560,16,16,128,4,4,3,766.649,3
w13,4,64,8,3584,2560,16,16,128,4,4,4,766.4996666666666,3
w13,4,64,8,3584,2560,16,16,128,4,8,3,767.6946666666666,3
w13,4,64,8,3584,2560,16,16,128,4,8,4,768.2703333333334,3
w13,4,64,8,3584,2560,16,16,256,1,4,2,768.5586666666667,3
w13,4,64,8,3584,2560,16,16,256,1,4,3,767.364,3
w13,4,64,8,3584,2560,16,16,256,1,4,4,767.0646666666667,3
w13,4,64,8,3584,2560,16,16,256,1,8,2,768.3560000000001,3
w13,4,64,8,3584,2560,16,16,256,1,8,4,769.0813333333334,3
w13,4,64,8,3584,2560,16,16,256,4,4,2,766.8306666666667,3
w13,4,64,8,3584,2560,16,16,256,4,4,3,767.5133333333333,3
w13,4,64,8,3584,2560,16,16,256,4,4,4,766.9266666666666,3
w13,4,64,8,3584,2560,16,16,256,4,8,2,768.2386666666666,3
w13,4,64,8,3584,2560,16,16,256,4,8,4,768.676,3
w13,4,64,8,3584,2560,16,32,64,1,8,3,769.1986666666667,3
w13,4,64,8,3584,2560,16,32,128,1,4,2,766.2863333333333,3
w13,4,64,8,3584,2560,16,32,128,1,4,3,766.724,3
w13,4,64,8,3584,2560,16,32,128,1,4,4,766.1053333333333,3
w13,4,64,8,3584,2560,16,32,128,1,8,2,766.852,3
w13,4,64,8,3584,2560,16,32,128,1,8,3,767.5556666666666,3
w13,4,64,8,3584,2560,16,32,128,1,8,4,767.268,3
w13,4,64,8,3584,2560,16,32,128,4,4,2,767.3636666666666,3
w13,4,64,8,3584,2560,16,32,128,4,4,3,767.5343333333334,3
w13,4,64,8,3584,2560,16,32,128,4,4,4,766.0733333333334,3
w13,4,64,8,3584,2560,16,32,128,4,8,2,767.428,3
w13,4,64,8,3584,2560,16,32,128,4,8,3,768.1423333333333,3
w13,4,64,8,3584,2560,16,32,128,4,8,4,766.8306666666667,3
w13,4,64,8,3584,2560,16,32,128,16,4,2,768.1853333333333,3
w13,4,64,8,3584,2560,16,32,128,16,4,3,768.2813333333334,3
w13,4,64,8,3584,2560,16,32,128,16,4,4,767.0120000000001,3
w13,4,64,8,3584,2560,16,32,128,16,8,2,769.0383333333334,3
w13,4,64,8,3584,2560,16,32,128,16,8,3,767.7373333333334,3
w13,4,64,8,3584,2560,16,32,128,16,8,4,768.1529999999999,3
w13,4,64,8,3584,2560,16,32,128,32,4,2,768.0566666666667,3
w13,4,64,8,3584,2560,16,32,128,32,4,3,767.9396666666667,3
w13,4,64,8,3584,2560,16,32,128,32,4,4,767.3533333333334,3
w13,4,64,8,3584,2560,16,32,128,32,8,2,768.4946666666666,3
w13,4,64,8,3584,2560,16,32,128,32,8,3,767.9076666666666,3
w13,4,64,8,3584,2560,16,32,128,32,8,4,768.8466666666667,3
w13,4,64,8,3584,2560,16,32,128,64,4,2,767.9399999999999,3
w13,4,64,8,3584,2560,16,32,128,64,4,3,767.9506666666666,3
w13,4,64,8,3584,2560,16,32,128,64,4,4,768.0573333333333,3
w13,4,64,8,3584,2560,16,32,128,64,8,2,769.081,3
w13,4,64,8,3584,2560,16,32,128,64,8,3,768.9110000000001,3
w13,4,64,8,3584,2560,16,32,128,64,8,4,768.1640000000001,3
w13,4,64,8,3584,2560,16,32,256,1,4,2,766.148,3
w13,4,64,8,3584,2560,16,32,256,1,4,3,766.4573333333334,3
w13,4,64,8,3584,2560,16,32,256,1,4,4,767.1186666666666,3
w13,4,64,8,3584,2560,16,32,256,1,8,2,767.3213333333333,3
w13,4,64,8,3584,2560,16,32,256,1,8,3,767.4173333333333,3
w13,4,64,8,3584,2560,16,32,256,1,8,4,767.3103333333333,3
w13,4,64,8,3584,2560,16,32,256,16,4,2,767.4173333333333,3
w13,4,64,8,3584,2560,16,32,256,16,4,3,767.3746666666667,3
w13,4,64,8,3584,2560,16,32,256,16,4,4,767.844,3
w13,4,64,8,3584,2560,16,32,256,16,8,2,768.3879999999999,3
w13,4,64,8,3584,2560,16,32,256,16,8,3,767.1503333333334,3
w13,4,64,8,3584,2560,16,32,256,16,8,4,768.2600000000001,3
w13,4,64,8,3584,2560,16,32,256,32,4,2,767.6306666666666,3
w13,4,64,8,3584,2560,16,32,256,32,4,3,768.1206666666667,3
w13,4,64,8,3584,2560,16,32,256,32,4,4,767.8546666666667,3
w13,4,64,8,3584,2560,16,32,256,32,8,2,768.8679999999999,3
w13,4,64,8,3584,2560,16,32,256,32,8,3,767.9396666666667,3
w13,4,64,8,3584,2560,16,32,256,32,8,4,768.8040000000001,3
w13,4,64,8,3584,2560,16,32,256,64,4,2,767.2893333333333,3
w13,4,64,8,3584,2560,16,32,256,64,4,3,767.609,3
w13,4,64,8,3584,2560,16,32,256,64,4,4,767.9720000000001,3
w13,4,64,8,3584,2560,16,32,256,64,8,2,767.6946666666666,3
w13,4,64,8,3584,2560,16,32,256,64,8,3,768.6329999999999,3
w13,4,64,8,3584,2560,16,32,256,64,8,4,769.3156666666667,3
w13,4,64,8,3584,2560,16,64,64,1,4,3,769.3159999999999,3
w13,4,64,8,3584,2560,16,64,128,1,4,2,766.4573333333333,3
w13,4,64,8,3584,2560,16,64,128,1,4,3,767.1613333333333,3
w13,4,64,8,3584,2560,16,64,128,1,4,4,766.692,3
w13,4,64,8,3584,2560,16,64,128,1,8,2,766.532,3
w13,4,64,8,3584,2560,16,64,128,1,8,3,767.5236666666666,3
w13,4,64,8,3584,2560,16,64,128,1,8,4,766.3933333333334,3
w13,4,64,8,3584,2560,16,64,128,16,4,2,768.1746666666667,3
w13,4,64,8,3584,2560,16,64,128,16,4,3,767.9506666666666,3
w13,4,64,8,3584,2560,16,64,128,16,4,4,766.895,3
w13,4,64,8,3584,2560,16,64,128,16,8,2,768.0573333333333,3
w13,4,64,8,3584,2560,16,64,128,16,8,3,767.7693333333333,3
w13,4,64,8,3584,2560,16,64,128,16,8,4,767.3423333333334,3
w13,4,64,8,3584,2560,16,64,128,32,4,2,767.7693333333333,3
w13,4,64,8,3584,2560,16,64,128,32,4,3,768.0146666666666,3
w13,4,64,8,3584,2560,16,64,128,32,4,4,767.3743333333333,3
w13,4,64,8,3584,2560,16,64,128,32,8,2,768.1853333333333,3
w13,4,64,8,3584,2560,16,64,128,32,8,3,767.5243333333334,3
w13,4,64,8,3584,2560,16,64,128,32,8,4,768.6973333333332,3
w13,4,64,8,3584,2560,16,64,128,64,4,2,767.3000000000001,3
w13,4,64,8,3584,2560,16,64,128,64,4,3,768.1853333333333,3
w13,4,64,8,3584,2560,16,64,128,64,4,4,767.5026666666666,3
w13,4,64,8,3584,2560,16,64,128,64,8,2,767.9826666666667,3
w13,4,64,8,3584,2560,16,64,128,64,8,3,767.7053333333333,3
w13,4,64,8,3584,2560,16,64,128,64,8,4,767.9720000000001,3
w13,4,64,8,3584,2560,16,64,256,1,4,2,766.5,3
w13,4,64,8,3584,2560,16,64,256,1,4,3,767.0010000000001,3
w13,4,64,8,3584,2560,16,64,256,1,8,2,767.2893333333333,3
w13,4,64,8,3584,2560,16,64,256,1,8,3,766.6170000000001,3
w13,4,64,8,3584,2560,16,64,256,16,4,2,767.5666666666666,3
w13,4,64,8,3584,2560,16,64,256,16,4,3,767.7370000000001,3
w13,4,64,8,3584,2560,16,64,256,16,8,2,768.0143333333334,3
w13,4,64,8,3584,2560,16,64,256,16,8,3,767.268,3
w13,4,64,8,3584,2560,16,64,256,32,4,2,767.9609999999999,3
w13,4,64,8,3584,2560,16,64,256,32,4,3,768.4626666666667,3
w13,4,64,8,3584,2560,16,64,256,32,8,2,767.9826666666667,3
w13,4,64,8,3584,2560,16,64,256,32,8,3,768.2063333333334,3
w13,4,64,8,3584,2560,16,64,256,64,4,2,768.1103333333334,3
w13,4,64,8,3584,2560,16,64,256,64,4,3,768.3023333333334,3
w13,4,64,8,3584,2560,16,64,256,64,8,2,768.1856666666666,3
w13,4,64,8,3584,2560,16,64,256,64,8,3,767.6626666666666,3
w13,4,64,8,3584,2560,16,128,128,1,4,2,767.3426666666668,3
w13,4,64,8,3584,2560,16,128,128,1,4,3,767.8863333333334,3
w13,4,64,8,3584,2560,16,128,128,1,8,2,767.8116666666666,3
w13,4,64,8,3584,2560,16,128,128,1,8,3,766.628,3
w13,4,64,8,3584,2560,16,128,128,16,4,2,769.348,3
w13,4,64,8,3584,2560,16,128,128,16,4,3,768.3986666666666,3
w13,4,64,8,3584,2560,16,128,128,16,8,2,769.1346666666667,3
w13,4,64,8,3584,2560,16,128,128,16,8,3,767.9293333333334,3
w13,4,64,8,3584,2560,16,128,128,32,4,2,768.6653333333334,3
w13,4,64,8,3584,2560,16,128,128,32,4,3,768.3666666666667,3
w13,4,64,8,3584,2560,16,128,128,32,8,2,768.1210000000001,3
w13,4,64,8,3584,2560,16,128,128,32,8,3,767.4706666666666,3
w13,4,64,8,3584,2560,16,128,128,64,4,2,769.2093333333333,3
w13,4,64,8,3584,2560,16,128,128,64,4,3,769.1133333333333,3
w13,4,64,8,3584,2560,16,128,128,64,8,2,767.9609999999999,3
w13,4,64,8,3584,2560,16,128,128,64,8,3,767.0973333333333,3
w13,4,64,8,3584,2560,32,16,128,4,4,2,765.668,3
w13,4,64,8,3584,2560,32,16,128,4,4,3,766.4566666666666,3
w13,4,64,8,3584,2560,32,16,128,4,4,4,768.2173333333334,3
w13,4,64,8,3584,2560,32,16,128,4,8,3,767.428,3
w13,4,64,8,3584,2560,32,32,64,1,4,3,769.156,3
w13,4,64,8,3584,2560,32,32,128,1,4,2,765.5186666666667,3
w13,4,64,8,3584,2560,32,32,128,1,4,4,767.0009999999999,3
w13,4,64,8,3584,2560,32,32,128,1,8,2,767.033,3
w13,4,64,8,3584,2560,32,32,128,1,8,4,767.6943333333334,3
w13,4,64,8,3584,2560,32,32,128,4,4,2,767.4813333333333,3
w13,4,64,8,3584,2560,32,32,128,4,4,4,767.1613333333333,3
w13,4,64,8,3584,2560,32,32,128,4,8,2,767.5666666666666,3
w13,4,64,8,3584,2560,32,32,128,4,8,4,767.375,3
w13,4,64,8,3584,2560,32,32,128,16,4,2,769.1986666666667,3
w13,4,64,8,3584,2560,32,32,128,16,4,4,767.3213333333333,3
w13,4,64,8,3584,2560,32,32,128,16,8,2,769.0279999999999,3
w13,4,64,8,3584,2560,32,32,128,16,8,4,767.9933333333333,3
w13,4,64,8,3584,2560,32,32,128,64,4,2,768.3556666666667,3
w13,4,64,8,3584,2560,32,32,128,64,4,4,767.9506666666666,3
w13,4,64,8,3584,2560,32,32,128,64,8,2,768.292,3
w13,4,64,8,3584,2560,32,32,128,64,8,4,768.676,3
w13,4,64,8,3584,2560,32,32,256,1,4,3,768.0356666666667,3
w13,4,64,8,3584,2560,32,32,256,1,4,4,767.0013333333333,3
w13,4,64,8,3584,2560,32,32,256,1,8,3,767.7583333333333,3
w13,4,64,8,3584,2560,32,32,256,1,8,4,768.228,3
w13,4,64,8,3584,2560,32,32,256,4,4,3,768.1,3
w13,4,64,8,3584,2560,32,32,256,4,4,4,767.2146666666667,3
w13,4,64,8,3584,2560,32,32,256,4,8,3,767.748,3
w13,4,64,8,3584,2560,32,32,256,4,8,4,767.364,3
w13,4,64,8,3584,2560,32,32,256,16,4,3,768.3666666666667,3
w13,4,64,8,3584,2560,32,32,256,16,4,4,768.1426666666666,3
w13,4,64,8,3584,2560,32,32,256,16,8,3,768.0360000000001,3
w13,4,64,8,3584,2560,32,32,256,16,8,4,768.0679999999999,3
w13,4,64,8,3584,2560,32,32,256,32,4,3,768.985,3
w13,4,64,8,3584,2560,32,32,256,32,4,4,768.3879999999999,3
w13,4,64,8,3584,2560,32,32,256,32,8,3,768.9319999999999,3
w13,4,64,8,3584,2560,32,32,256,32,8,4,768.9213333333333,3
w13,4,64,8,3584,2560,32,64,128,1,4,2,767.2040000000001,3
w13,4,64,8,3584,2560,32,64,128,1,4,3,766.8843333333334,3
w13,4,64,8,3584,2560,32,64,128,1,4,4,767.076,3
w13,4,64,8,3584,2560,32,64,128,1,8,2,767.2576666666668,3
w13,4,64,8,3584,2560,32,64,128,1,8,3,766.8626666666668,3
w13,4,64,8,3584,2560,32,64,128,1,8,4,767.1826666666666,3
w13,4,64,8,3584,2560,32,64,128,4,4,2,767.7693333333333,3
w13,4,64,8,3584,2560,32,64,128,4,4,3,767.6306666666666,3
w13,4,64,8,3584,2560,32,64,128,4,4,4,766.8523333333333,3
w13,4,64,8,3584,2560,32,64,128,4,8,2,767.62,3
w13,4,64,8,3584,2560,32,64,128,4,8,3,767.6839999999999,3
w13,4,64,8,3584,2560,32,64,128,4,8,4,766.6706666666665,3
w13,4,64,8,3584,2560,32,64,128,16,4,2,768.3879999999999,3
w13,4,64,8,3584,2560,32,64,128,16,4,3,769.0603333333333,3
w13,4,64,8,3584,2560,32,64,128,16,4,4,767.6516666666666,3
w13,4,64,8,3584,2560,32,64,128,16,8,2,769.1876666666667,3
w13,4,64,8,3584,2560,32,64,128,16,8,3,768.0896666666667,3
w13,4,64,8,3584,2560,32,64,128,16,8,4,767.6626666666667,3
w13,4,64,8,3584,2560,32,64,128,32,4,2,768.0576666666666,3
w13,4,64,8,3584,2560,32,64,128,32,4,3,768.8683333333333,3
w13,4,64,8,3584,2560,32,64,128,32,4,4,768.0790000000001,3
w13,4,64,8,3584,2560,32,64,128,32,8,2,768.3986666666666,3
w13,4,64,8,3584,2560,32,64,128,32,8,3,768.0786666666667,3
w13,4,64,8,3584,2560,32,64,128,32,8,4,768.9216666666666,3
w13,4,64,8,3584,2560,32,64,128,64,4,2,768.5799999999999,3
w13,4,64,8,3584,2560,32,64,128,64,4,3,768.8789999999999,3
w13,4,64,8,3584,2560,32,64,128,64,4,4,767.919,3
w13,4,64,8,3584,2560,32,64,128,64,8,2,768.6336666666666,3
w13,4,64,8,3584,2560,32,64,128,64,8,3,767.6093333333333,3
w13,4,64,8,3584,2560,32,64,128,64,8,4,768.4626666666667,3
w13,4,64,8,3584,2560,32,64,256,1,4,2,767.3960000000001,3
w13,4,64,8,3584,2560,32,64,256,1,4,3,767.5023333333334,3
w13,4,64,8,3584,2560,32,64,256,1,8,3,766.8626666666665,3
w13,4,64,8,3584,2560,32,64,256,8,4,2,767.3636666666666,3
w13,4,64,8,3584,2560,32,64,256,8,4,3,767.9506666666666,3
w13,4,64,8,3584,2560,32,64,256,8,8,2,767.3323333333333,3
w13,4,64,8,3584,2560,32,64,256,8,8,3,766.948,3
w13,4,64,8,3584,2560,32,64,256,16,4,2,767.652,3
w13,4,64,8,3584,2560,32,64,256,16,4,3,768.132,3
w13,4,64,8,3584,2560,32,64,256,16,8,2,768.2063333333334,3
w13,4,64,8,3584,2560,32,64,256,16,8,3,767.4923333333332,3
w13,4,64,8,3584,2560,32,64,256,32,4,2,768.3879999999999,3
w13,4,64,8,3584,2560,32,64,256,32,4,3,768.6016666666666,3
w13,4,64,8,3584,2560,32,64,256,32,8,2,767.8116666666666,3
w13,4,64,8,3584,2560,32,64,256,32,8,3,768.217,3
w13,4,64,8,3584,2560,32,64,256,64,4,2,768.2493333333333,3
w13,4,64,8,3584,2560,32,64,256,64,4,3,769.0066666666667,3
w13,4,64,8,3584,2560,32,64,256,64,8,2,768.324,3
w13,4,64,8,3584,2560,32,64,256,64,8,3,768.3883333333333,3
w13,4,64,8,3584,2560,32,128,128,1,4,2,768.6653333333334,3
w13,4,64,8,3584,2560,32,128,128,1,4,3,768.2386666666666,3
w13,4,64,8,3584,2560,32,128,128,1,8,2,767.5456666666668,3
w13,4,64,8,3584,2560,32,128,128,1,8,3,767.0653333333333,3
w13,4,64,8,3584,2560,32,128,128,4,4,2,769.1773333333334,3
w13,4,64,8,3584,2560,32,128,128,4,4,3,768.0679999999999,3
w13,4,64,8,3584,2560,32,128,128,4,8,2,768.2280000000001,3
w13,4,64,8,3584,2560,32,128,128,4,8,3,767.343,3
w13,4,64,8,3584,2560,32,128,128,8,4,3,768.6226666666666,3
w13,4,64,8,3584,2560,32,128,128,8,8,3,767.7800000000001,3
w13,4,64,8,3584,2560,32,128,128,16,4,3,768.7296666666666,3
w13,4,64,8,3584,2560,32,128,128,16,8,3,768.2493333333333,3
w13,4,64,8,3584,2560,32,128,128,32,4,3,768.9639999999999,3
w13,4,64,8,3584,2560,32,128,128,32,8,2,768.7936666666668,3
w13,4,64,8,3584,2560,32,128,128,32,8,3,767.8543333333333,3
w13,4,64,8,3584,2560,32,128,128,64,8,3,767.62,3
w13,4,64,8,3584,2560,64,32,128,1,4,2,767.695,3
w13,4,64,8,3584,2560,64,32,128,1,4,3,767.5773333333333,3
w13,4,64,8,3584,2560,64,32,128,1,8,2,768.0573333333333,3
w13,4,64,8,3584,2560,64,32,128,1,8,3,768.2710000000001,3
w13,4,64,8,3584,2560,64,32,128,16,4,2,769.263,3
w13,4,64,8,3584,2560,64,32,128,16,4,3,769.1666666666666,3
w13,4,64,8,3584,2560,64,32,128,16,8,3,768.8786666666666,3
w13,4,64,8,3584,2560,64,32,256,1,4,2,768.0256666666666,3
w13,4,64,8,3584,2560,64,32,256,1,8,2,768.569,3
w13,4,64,8,3584,2560,64,64,128,1,4,2,768.0680000000001,3
w13,4,64,8,3584,2560,64,64,128,1,4,3,768.4413333333333,3
w13,4,64,8,3584,2560,64,64,128,1,4,4,767.6946666666666,3
w13,4,64,8,3584,2560,64,64,128,1,8,2,767.9186666666666,3
w13,4,64,8,3584,2560,64,64,128,1,8,3,767.5876666666667,3
w13,4,64,8,3584,2560,64,64,128,1,8,4,768.5903333333332,3
w13,4,64,8,3584,2560,64,64,128,4,4,2,769.348,3
w13,4,64,8,3584,2560,64,64,128,4,4,4,768.5586666666667,3
w13,4,64,8,3584,2560,64,64,128,4,8,2,768.7933333333334,3
w13,4,64,8,3584,2560,64,64,128,4,8,3,769.0279999999999,3
w13,4,64,8,3584,2560,64,64,128,4,8,4,768.1743333333334,3
w13,4,64,8,3584,2560,64,64,128,8,4,3,769.1026666666667,3
w13,4,64,8,3584,2560,64,64,128,8,4,4,768.569,3
w13,4,64,8,3584,2560,64,64,128,8,8,3,768.6973333333334,3
w13,4,64,8,3584,2560,64,64,128,8,8,4,768.6333333333333,3
w13,4,64,8,3584,2560,64,64,128,16,4,4,769.2946666666667,3
w13,4,64,8,3584,2560,64,64,128,16,8,4,769.0283333333333,3
w13,4,64,8,3584,2560,64,128,128,1,8,3,768.6333333333333,3
w13,4,64,8,3584,2560,64,128,128,64,8,3,769.3159999999999,3
w13,4,128,4,2048,512,16,32,128,16,4,3,12.567333333333332,3
w13,4,128,4,2048,512,16,32,128,32,4,3,12.525,3
w13,4,128,4,2048,512,16,32,128,64,4,3,12.567333333333332,3
w13,4,128,4,2048,512,16,64,64,1,4,4,12.546,3
w13,4,128,4,2048,512,16,64,64,32,4,4,12.577666666666666,3
w13,4,128,6,4096,2048,16,16,128,1,4,3,526.3816666666667,3
w13,4,128,6,4096,2048,16,16,128,4,4,3,526.2103333333333,3
w13,4,128,6,4096,2048,16,16,256,1,4,2,526.2423333333332,3
w13,4,128,6,4096,2048,16,16,256,1,4,3,526.605,3
w13,4,128,6,4096,2048,16,16,256,4,4,2,526.04,3
w13,4,128,6,4096,2048,16,16,256,4,4,3,526.68,3
w13,4,128,6,4096,2048,16,32,64,1,4,3,525.4536666666667,3
w13,4,128,6,4096,2048,16,32,64,1,4,4,526.0616666666666,3
w13,4,128,6,4096,2048,16,32,128,1,4,2,524.2696666666667,3
w13,4,128,6,4096,2048,16,32,128,1,4,4,526.712,3
w13,4,128,6,4096,2048,16,32,128,4,4,2,525.4423333333333,3
w13,4,128,6,4096,2048,16,32,128,4,4,4,526.68,3
w13,4,128,6,4096,2048,16,32,128,16,4,2,525.837,3
w13,4,128,6,4096,2048,16,32,128,32,4,2,526.1036666666668,3
w13,4,128,6,4096,2048,16,32,128,64,4,2,525.4536666666667,3
w13,4,128,6,4096,2048,16,32,256,1,4,4,526.8190000000001,3
w13,4,128,6,4096,2048,16,64,64,1,4,4,526.7123333333334,3
w13,4,128,6,4096,2048,32,16,128,4,4,2,526.2106666666667,3
w13,4,128,6,4096,2048,32,32,64,1,4,3,526.5736666666667,3
w13,4,128,6,4096,2048,32,32,128,1,4,2,526.0406666666667,3
w13,4,128,6,4096,2048,32,32,128,1,4,3,526.3173333333333,3
w13,4,128,6,4096,2048,32,32,128,1,8,3,526.5946666666667,3
w13,4,128,6,4096,2048,32,32,128,4,4,2,526.2003333333333,3
w13,4,128,6,4096,2048,32,32,128,16,4,2,526.8936666666667,3
w13,4,128,6,4096,2048,32,32,128,16,4,3,526.5843333333333,3
w13,4,128,6,4096,2048,32,32,128,16,8,3,526.5943333333333,3
w13,4,128,6,4096,2048,32,32,128,64,4,3,526.3276666666667,3
w13,4,128,6,4096,2048,32,32,128,64,8,3,526.627,3
w13,4,128,6,4096,2048,32,32,256,1,4,2,524.8456666666667,3
w13,4,128,6,4096,2048,32,32,256,1,8,3,526.3816666666667,3
w13,4,128,6,4096,2048,32,32,256,4,4,3,526.808,3
w13,4,128,6,4096,2048,32,32,256,4,8,3,526.4456666666666,3
w13,4,128,6,4096,2048,32,32,256,16,4,3,526.8936666666667,3
w13,4,128,6,4096,2048,32,32,256,16,8,3,526.4776666666667,3
w13,4,128,6,4096,2048,32,32,256,32,4,3,526.7976666666667,3
w13,4,128,6,4096,2048,32,32,256,32,8,3,526.5943333333333,3
w13,4,128,8,2048,768,16,32,64,1,4,2,118.51933333333334,3
w13,4,128,8,2048,768,32,32,64,1,4,2,118.97833333333334,3
w13,4,128,8,4096,1536,16,16,64,1,8,4,527.2666666666668,3
w13,4,128,8,4096,1536,16,16,128,1,4,3,526.5306666666667,3
w13,4,128,8,4096,1536,16,16,128,1,8,3,527.1063333333333,3
w13,4,128,8,4096,1536,16,16,128,4,4,3,526.36,3
w13,4,128,8,4096,1536,16,16,256,1,4,2,526.7226666666667,3
w13,4,128,8,4096,1536,16,16,256,1,4,3,526.7013333333333,3
w13,4,128,8,4096,1536,16,16,256,1,4,4,527.0533333333333,3
w13,4,128,8,4096,1536,16,16,256,4,4,2,526.0186666666667,3
w13,4,128,8,4096,1536,16,16,256,4,4,3,526.9146666666667,3
w13,4,128,8,4096,1536,16,32,64,1,4,2,527.2556666666667,3
w13,4,128,8,4096,1536,16,32,64,1,4,3,525.4636666666667,3
w13,4,128,8,4096,1536,16,32,64,1,4,4,525.7196666666667,3
w13,4,128,8,4096,1536,16,32,64,1,8,4,527.288,3
w13,4,128,8,4096,1536,16,32,64,32,4,3,526.349,3
w13,4,128,8,4096,1536,16,32,64,64,4,3,526.1036666666668,3
w13,4,128,8,4096,1536,16,32,128,1,4,2,524.7066666666666,3
w13,4,128,8,4096,1536,16,32,128,1,4,4,526.8933333333333,3
w13,4,128,8,4096,1536,16,32,128,32,4,2,526.7333333333332,3
w13,4,128,8,4096,1536,16,32,128,64,4,2,525.9013333333334,3
w13,4,128,8,4096,1536,16,32,256,1,8,4,527.3416666666667,3
w13,4,128,8,4096,1536,16,64,64,1,4,2,526.6906666666667,3
w13,4,128,8,4096,1536,16,64,64,1,4,4,527.2983333333333,3
w13,4,128,8,4096,1536,16,64,64,16,4,2,526.68,3
w13,4,128,8,4096,1536,32,32,64,1,4,3,526.8933333333333,3
w13,4,128,8,4096,1536,32,32,64,64,4,3,526.5623333333334,3
w13,4,128,8,4096,1536,32,32,64,128,4,3,527.2666666666668,3
w13,4,128,8,4096,1536,32,32,128,1,4,2,526.1573333333333,3
w13,4,128,8,4096,1536,32,32,128,1,4,3,527.032,3
w13,4,128,8,4096,1536,32,32,128,1,8,3,526.4556666666666,3
w13,4,128,8,4096,1536,32,32,128,4,4,3,526.9143333333333,3
w13,4,128,8,4096,1536,32,32,128,4,8,3,526.8716666666666,3
w13,4,128,8,4096,1536,32,32,128,64,4,2,527.3093333333334,3
w13,4,128,8,4096,1536,32,32,256,1,4,2,524.9946666666666,3
w13,4,128,8,4096,1536,32,32,256,1,4,3,526.7226666666667,3
w13,4,128,8,4096,1536,32,32,256,1,4,4,527.2986666666667,3
w13,4,128,8,4096,1536,32,32,256,1,8,2,527.32,3
w13,4,128,8,4096,1536,32,32,256,4,4,3,526.8183333333333,3
w13,4,128,8,4096,1536,32,32,256,4,8,2,527.0213333333332,3
w13,4,128,8,4096,1536,32,32,256,4,8,3,526.7866666666667,3
w13,4,128,8,4096,1536,32,32,256,4,8,4,526.776,3
w13,4,128,8,4096,1536,32,32,256,32,8,3,527.2023333333333,3
w13,4,128,8,4096,3072,16,16,64,1,8,3,1051.3096666666668,3
w13,4,128,8,4096,3072,16,16,64,1,8,4,1051.3096666666668,3
w13,4,128,8,4096,3072,16,16,128,1,4,2,1049.3043333333333,3
w13,4,128,8,4096,3072,16,16,128,1,4,4,1051.2030000000002,3
w13,4,128,8,4096,3072,16,16,128,1,8,2,1049.5923333333333,3
w13,4,128,8,4096,3072,16,16,128,4,4,2,1050.2856666666667,3
w13,4,128,8,4096,3072,16,16,128,4,4,4,1049.8590000000002,3
w13,4,128,8,4096,3072,16,16,128,4,8,2,1049.5496666666666,3
w13,4,128,8,4096,3072,16,16,256,1,4,2,1050.6270000000002,3
w13,4,128,8,4096,3072,16,16,256,1,4,3,1049.2830000000001,3
w13,4,128,8,4096,3072,16,16,256,1,4,4,1051.747,3
w13,4,128,8,4096,3072,16,16,256,1,8,3,1051.8853333333334,3
w13,4,128,8,4096,3072,16,16,256,4,4,2,1052.0033333333333,3
w13,4,128,8,4096,3072,16,16,256,4,4,3,1049.539,3
w13,4,128,8,4096,3072,16,16,256,4,4,4,1049.987,3
w13,4,128,8,4096,3072,16,16,256,4,8,3,1050.6696666666667,3
w13,4,128,8,4096,3072,16,16,256,4,8,4,1052.0456666666666,3
w13,4,128,8,4096,3072,16,32,64,1,4,2,1052.7176666666667,3
w13,4,128,8,4096,3072,16,32,64,1,4,3,1048.7283333333332,3
w13,4,128,8,4096,3072,16,32,64,1,4,4,1050.8723333333335,3
w13,4,128,8,4096,3072,16,32,64,1,8,2,1051.8216666666667,3
w13,4,128,8,4096,3072,16,32,64,1,8,3,1049.4113333333332,3
w13,4,128,8,4096,3072,16,32,64,1,8,4,1049.187,3
w13,4,128,8,4096,3072,16,32,64,16,8,3,1052.7920000000001,3
w13,4,128,8,4096,3072,16,32,64,32,4,4,1050.3286666666665,3
w13,4,128,8,4096,3072,16,32,64,32,8,3,1051.8326666666665,3
w13,4,128,8,4096,3072,16,32,64,32,8,4,1051.1283333333333,3
w13,4,128,8,4096,3072,16,32,64,64,4,4,1050.8296666666668,3
w13,4,128,8,4096,3072,16,32,64,64,8,3,1053.0483333333334,3
w13,4,128,8,4096,3072,16,32,64,64,8,4,1051.0536666666667,3
w13,4,128,8,4096,3072,16,32,128,1,4,2,1048.8243333333332,3
w13,4,128,8,4096,3072,16,32,128,1,4,3,1049.827,3
w13,4,128,8,4096,3072,16,32,128,1,4,4,1050.211,3
w13,4,128,8,4096,3072,16,32,128,1,8,2,1048.3976666666667,3
w13,4,128,8,4096,3072,16,32,128,1,8,4,1051.491,3
w13,4,128,8,4096,3072,16,32,128,4,4,2,1048.5893333333333,3
w13,4,128,8,4096,3072,16,32,128,4,4,3,1051.0856666666666,3
w13,4,128,8,4096,3072,16,32,128,4,4,4,1050.4776666666667,3
w13,4,128,8,4096,3072,16,32,128,4,8,2,1049.1336666666666,3
w13,4,128,8,4096,3072,16,32,128,4,8,4,1050.6589999999999,3
w13,4,128,8,4096,3072,16,32,128,16,4,2,1050.712,3
w13,4,128,8,4096,3072,16,32,128,16,4,3,1050.115,3
w13,4,128,8,4096,3072,16,32,128,16,4,4,1050.0186666666666,3
w13,4,128,8,4096,3072,16,32,128,16,8,2,1051.2883333333334,3
w13,4,128,8,4096,3072,16,32,128,16,8,4,1053.0696666666665,3
w13,4,128,8,4096,3072,16,32,128,32,4,4,1053.219,3
w13,4,128,8,4096,3072,16,32,128,32,8,2,1048.8136666666667,3
w13,4,128,8,4096,3072,16,32,128,64,4,4,1052.2056666666667,3
w13,4,128,8,4096,3072,16,32,128,64,8,2,1049.539,3
w13,4,128,8,4096,3072,16,32,256,1,4,3,1051.1283333333333,3
w13,4,128,8,4096,3072,16,32,256,1,4,4,1051.1176666666668,3
w13,4,128,8,4096,3072,16,32,256,1,8,3,1053.0159999999998,3
w13,4,128,8,4096,3072,16,32,256,1,8,4,1050.6803333333335,3
w13,4,128,8,4096,3072,16,32,256,16,4,2,1052.8239999999998,3
w13,4,128,8,4096,3072,16,32,256,16,4,3,1052.003,3
w13,4,128,8,4096,3072,16,32,256,16,4,4,1050.3926666666666,3
w13,4,128,8,4096,3072,16,32,256,16,8,3,1052.9203333333335,3
w13,4,128,8,4096,3072,16,32,256,16,8,4,1051.203,3
w13,4,128,8,4096,3072,16,32,256,32,4,3,1053.1976666666667,3
w13,4,128,8,4096,3072,16,32,256,64,4,3,1052.8776666666665,3
w13,4,128,8,4096,3072,16,32,256,64,4,4,1053.0910000000001,3
w13,4,128,8,4096,3072,16,64,64,1,4,4,1049.4426666666666,3
w13,4,128,8,4096,3072,16,64,64,1,8,2,1052.611,3
w13,4,128,8,4096,3072,16,64,64,1,8,4,1048.7176666666667,3
w13,4,128,8,4096,3072,16,64,64,16,8,3,1053.112,3
w13,4,128,8,4096,3072,16,64,64,32,8,3,1051.7146666666667,3
w13,4,128,8,4096,3072,16,64,64,64,8,3,1052.4403333333332,3
w13,4,128,8,4096,3072,16,64,128,1,4,3,1051.3416666666665,3
w13,4,128,8,4096,3072,16,64,128,1,4,4,1051.1496666666667,3
w13,4,128,8,4096,3072,16,64,128,1,8,3,1052.4833333333333,3
w13,4,128,8,4096,3072,16,64,128,1,8,4,1050.3926666666666,3
w13,4,128,8,4096,3072,16,64,256,1,4,3,1052.5683333333334,3
w13,4,128,8,4096,3072,16,64,256,1,8,3,1052.2696666666668,3
w13,4,128,8,4096,3072,16,128,64,1,4,2,1052.174,3
w13,4,128,8,4096,3072,16,128,64,1,8,2,1051.6943333333331,3
w13,4,128,8,4096,3072,16,128,64,1,8,3,1049.6993333333332,3
w13,4,128,8,4096,3072,16,128,64,16,8,2,1052.59,3
w13,4,128,8,4096,3072,16,128,64,16,8,3,1051.9393333333335,3
w13,4,128,8,4096,3072,16,128,64,32,4,3,1053.1233333333332,3
w13,4,128,8,4096,3072,16,128,64,32,8,3,1053.0483333333334,3
w13,4,128,8,4096,3072,16,128,64,64,4,2,1052.366,3
w13,4,128,8,4096,3072,16,128,64,64,8,3,1052.43,3
w13,4,128,8,4096,3072,16,256,64,1,8,3,1052.0243333333333,3
w13,4,128,8,4096,3072,16,256,64,64,8,3,1053.2403333333334,3
w13,4,128,8,4096,3072,32,16,128,4,4,3,1049.731,3
w13,4,128,8,4096,3072,32,16,128,4,4,4,1050.4353333333333,3
w13,4,128,8,4096,3072,32,16,128,4,8,2,1051.086,3
w13,4,128,8,4096,3072,32,16,128,4,8,4,1053.219,3
w13,4,128,8,4096,3072,32,32,64,1,4,2,1050.7659999999998,3
w13,4,128,8,4096,3072,32,32,64,1,4,3,1048.4833333333333,3
w13,4,128,8,4096,3072,32,32,64,1,8,2,1051.9073333333333,3
w13,4,128,8,4096,3072,32,32,64,1,8,3,1049.6246666666666,3
w13,4,128,8,4096,3072,32,32,64,32,4,3,1050.3176666666666,3
w13,4,128,8,4096,3072,32,32,64,32,8,3,1049.4116666666666,3
w13,4,128,8,4096,3072,32,32,64,64,4,3,1049.7633333333333,3
w13,4,128,8,4096,3072,32,32,64,64,8,3,1050.0406666666668,3
w13,4,128,8,4096,3072,32,32,64,128,4,3,1049.486,3
w13,4,128,8,4096,3072,32,32,64,128,8,3,1050.03,3
w13,4,128,8,4096,3072,32,32,128,1,4,2,1048.0353333333333,3
w13,4,128,8,4096,3072,32,32,128,1,4,3,1049.8483333333334,3
w13,4,128,8,4096,3072,32,32,128,1,4,4,1050.1046666666668,3
w13,4,128,8,4096,3072,32,32,128,1,8,2,1049.4006666666667,3
w13,4,128,8,4096,3072,32,32,128,1,8,3,1050.3286666666665,3
w13,4,128,8,4096,3072,32,32,128,1,8,4,1052.1526666666666,3
w13,4,128,8,4096,3072,32,32,128,4,4,2,1049.7416666666668,3
w13,4,128,8,4096,3072,32,32,128,4,4,3,1049.71,3
w13,4,128,8,4096,3072,32,32,128,4,4,4,1051.9283333333333,3
w13,4,128,8,4096,3072,32,32,128,4,8,2,1050.094,3
w13,4,128,8,4096,3072,32,32,128,4,8,3,1050.1256666666668,3
w13,4,128,8,4096,3072,32,32,128,4,8,4,1051.8643333333332,3
w13,4,128,8,4096,3072,32,32,128,16,4,2,1053.2833333333333,3
w13,4,128,8,4096,3072,32,32,128,16,4,3,1050.0513333333333,3
w13,4,128,8,4096,3072,32,32,128,16,4,4,1051.715,3
w13,4,128,8,4096,3072,32,32,128,16,8,2,1050.414,3
w13,4,128,8,4096,3072,32,32,128,16,8,3,1050.318,3
w13,4,128,8,4096,3072,32,32,128,16,8,4,1053.1976666666667,3
w13,4,128,8,4096,3072,32,32,128,64,4,2,1049.1660000000002,3
w13,4,128,8,4096,3072,32,32,128,64,8,2,1049.0483333333334,3
w13,4,128,8,4096,3072,32,32,256,1,4,2,1048.5896666666667,3
w13,4,128,8,4096,3072,32,32,256,1,4,3,1050.4566666666667,3
w13,4,128,8,4096,3072,32,32,256,1,4,4,1050.3926666666666,3
w13,4,128,8,4096,3072,32,32,256,1,8,2,1050.6270000000002,3
w13,4,128,8,4096,3072,32,32,256,1,8,3,1050.2646666666667,3
w13,4,128,8,4096,3072,32,32,256,1,8,4,1050.723,3
w13,4,128,8,4096,3072,32,32,256,4,4,2,1050.318,3
w13,4,128,8,4096,3072,32,32,256,4,4,3,1049.9873333333333,3
w13,4,128,8,4096,3072,32,32,256,4,4,4,1050.638,3
w13,4,128,8,4096,3072,32,32,256,4,8,2,1050.8403333333333,3
w13,4,128,8,4096,3072,32,32,256,4,8,3,1049.5603333333333,3
w13,4,128,8,4096,3072,32,32,256,4,8,4,1050.787,3
w13,4,128,8,4096,3072,32,32,256,16,4,2,1050.115,3
w13,4,128,8,4096,3072,32,32,256,16,4,3,1051.096,3
w13,4,128,8,4096,3072,32,32,256,16,4,4,1050.7876666666668,3
w13,4,128,8,4096,3072,32,32,256,16,8,2,1049.806,3
w13,4,128,8,4096,3072,32,32,256,16,8,3,1050.7553333333333,3
w13,4,128,8,4096,3072,32,32,256,16,8,4,1050.9473333333333,3
w13,4,128,8,4096,3072,32,64,64,1,4,4,1051.3636666666669,3
w13,4,128,8,4096,3072,32,64,64,1,8,4,1052.1846666666668,3
w13,4,128,8,4096,3072,32,64,128,1,4,4,1049.6243333333334,3
w13,4,128,8,4096,3072,32,64,128,1,8,4,1051.9930000000002,3
w13,4,128,8,4096,3072,32,64,128,4,8,3,1052.2803333333334,3
w13,4,128,8,4096,3072,32,64,256,1,4,3,1053.006,3
w13,4,128,8,4096,3072,32,64,256,1,8,3,1051.502,3
w13,4,128,8,4096,3072,32,128,64,64,8,3,1052.771,3
w13,4,128,8,4096,3072,64,16,128,1,8,3,1052.0136666666667,3
w13,4,128,8,4096,3072,64,32,128,1,4,3,1051.4916666666666,3
w13,4,128,8,4096,3072,64,32,128,1,8,3,1052.387,3
w13,4,128,8,4096,3072,64,32,128,16,4,3,1051.6296666666667,3
w13,4,128,8,4096,3072,64,32,128,16,8,3,1053.0910000000001,3
w13,4,128,8,4096,3072,64,32,256,1,4,2,1052.6223333333335,3
w13,4,128,8,4096,3072,64,32,256,1,4,3,1051.3523333333333,3
w13,4,128,8,4096,3072,64,32,256,1,8,3,1051.8113333333333,3
w13,4,128,8,4096,3072,64,64,64,1,4,3,1051.9603333333332,3
w13,4,128,8,4096,3072,64,64,64,1,8,3,1052.0993333333333,3
w13,4,128,8,4096,3072,64,64,128,1,4,2,1052.1096666666665,3
w13,4,128,8,4096,3072,64,64,128,1,4,3,1051.0856666666666,3
w13,4,128,8,4096,3072,64,64,128,1,8,3,1050.5313333333334,3
w13,4,128,8,4096,3072,64,64,128,4,4,3,1051.9286666666667,3
w13,4,128,8,4096,3072,64,64,128,4,8,3,1050.9683333333332,3
w13,8,8,2,1024,512,16,64,64,16,4,4,5.1113333333333335,3
w13,8,8,2,1024,512,16,64,64,32,4,4,5.132666666666666,3
w13,8,16,2,1536,768,16,32,64,1,4,3,14.822000000000001,3
w13,8,16,2,1536,768,16,32,64,32,4,3,14.811666666666667,3
w13,8,16,2,1536,768,16,32,64,64,4,3,14.811666666666667,3
w13,8,16,2,1536,768,16,64,64,1,4,3,14.822000000000001,3
w13,8,16,2,1536,768,16,256,32,8,4,4,14.758666666666668,3
w13,8,16,4,1536,1024,16,64,64,16,4,3,18.572666666666667,3
w13,8,16,4,1536,1024,16,64,64,16,4,4,18.540666666666667,3
w13,8,16,4,1536,1024,16,64,64,32,4,3,18.594,3
w13,8,16,4,1536,1024,16,64,64,32,4,4,18.519333333333336,3
w13,8,16,4,1536,1024,16,64,64,64,4,4,18.53,3
w13,8,32,4,2048,768,16,32,64,1,4,2,117.95466666666668,3
w13,8,32,4,2048,768,32,32,64,1,4,2,118.11399999999999,3
w13,8,32,6,3072,1024,16,32,256,1,4,2,261.41,3
w13,8,32,6,3072,1024,16,64,256,1,4,2,261.965,3
w13,8,32,6,3072,1024,32,32,256,1,4,2,260.845,3
w13,8,32,6,3072,1024,32,64,256,1,4,2,262.11466666666666,3
w13,8,60,4,2048,1408,16,32,128,1,4,2,237.442,3
w13,8,60,4,2048,1408,16,32,256,1,4,2,238.28533333333334,3
w13,8,60,4,2048,1408,32,64,128,1,4,2,238.13566666666668,3
w13,8,60,6,3584,2304,16,16,64,1,4,3,1035.8973333333333,3
w13,8,60,6,3584,2304,16,16,64,1,4,4,1036.996,3
w13,8,60,6,3584,2304,16,16,128,1,4,2,1034.127,3
w13,8,60,6,3584,2304,16,16,128,1,4,3,1033.4866666666667,3
w13,8,60,6,3584,2304,16,16,128,1,4,4,1034.212,3
w13,8,60,6,3584,2304,16,16,128,1,8,3,1034.4573333333333,3
w13,8,60,6,3584,2304,16,16,128,4,4,2,1035.7376666666667,3
w13,8,60,6,3584,2304,16,16,128,4,4,3,1033.4546666666668,3
w13,8,60,6,3584,2304,16,16,128,4,4,4,1034.191,3
w13,8,60,6,3584,2304,16,16,128,4,8,3,1035.0123333333333,3
w13,8,60,6,3584,2304,16,16,128,4,8,4,1037.8813333333335,3
w13,8,60,6,3584,2304,16,16,256,1,4,2,1032.9746666666667,3
w13,8,60,6,3584,2304,16,16,256,1,4,3,1033.5936666666666,3
w13,8,60,6,3584,2304,16,16,256,1,4,4,1033.743,3
w13,8,60,6,3584,2304,16,16,256,1,8,2,1036.1000000000001,3
w13,8,60,6,3584,2304,16,16,256,1,8,3,1036.4416666666666,3
w13,8,60,6,3584,2304,16,16,256,1,8,4,1035.3216666666667,3
w13,8,60,6,3584,2304,16,16,256,4,4,2,1033.5293333333332,3
w13,8,60,6,3584,2304,16,16,256,4,4,3,1033.5829999999999,3
w13,8,60,6,3584,2304,16,16,256,4,4,4,1034.4573333333335,3
w13,8,60,6,3584,2304,16,16,256,4,8,2,1036.7079999999999,3
w13,8,60,6,3584,2304,16,16,256,4,8,3,1035.2146666666667,3
w13,8,60,6,3584,2304,16,16,256,4,8,4,1036.196,3
w13,8,60,6,3584,2304,16,32,64,1,4,3,1036.932,3
w13,8,60,6,3584,2304,16,32,128,1,4,2,1033.4123333333334,3
w13,8,60,6,3584,2304,16,32,128,1,4,3,1035.6626666666668,3
w13,8,60,6,3584,2304,16,32,128,1,4,4,1034.0096666666666,3
w13,8,60,6,3584,2304,16,32,128,1,8,2,1035.0656666666666,3
w13,8,60,6,3584,2304,16,32,128,1,8,3,1038.084,3
w13,8,60,6,3584,2304,16,32,128,1,8,4,1034.5856666666666,3
w13,8,60,6,3584,2304,16,32,128,4,4,2,1035.876,3
w13,8,60,6,3584,2304,16,32,128,4,4,3,1037.0813333333333,3
w13,8,60,6,3584,2304,16,32,128,4,4,4,1034.0733333333333,3
w13,8,60,6,3584,2304,16,32,128,4,8,2,1036.6970000000001,3
w13,8,60,6,3584,2304,16,32,128,4,8,4,1034.7453333333333,3
w13,8,60,6,3584,2304,16,32,128,16,4,2,1037.0919999999999,3
w13,8,60,6,3584,2304,16,32,128,16,4,4,1034.6493333333335,3
w13,8,60,6,3584,2304,16,32,128,16,8,2,1036.2920000000001,3
w13,8,60,6,3584,2304,16,32,128,16,8,4,1035.3213333333333,3
w13,8,60,6,3584,2304,16,32,128,32,4,2,1036.9003333333333,3
w13,8,60,6,3584,2304,16,32,128,32,4,3,1037.86,3
w13,8,60,6,3584,2304,16,32,128,32,4,4,1035.268,3
w13,8,60,6,3584,2304,16,32,128,32,8,2,1036.0249999999999,3
w13,8,60,6,3584,2304,16,32,128,32,8,4,1035.7906666666668,3
w13,8,60,6,3584,2304,16,32,128,64,4,3,1037.935,3
w13,8,60,6,3584,2304,16,32,128,64,4,4,1035.663,3
w13,8,60,6,3584,2304,16,32,128,64,8,2,1036.9216666666669,3
w13,8,60,6,3584,2304,16,32,128,64,8,4,1036.751,3
w13,8,60,6,3584,2304,16,32,256,1,4,2,1034.7346666666665,3
w13,8,60,6,3584,2304,16,32,256,1,4,3,1033.7963333333335,3
w13,8,60,6,3584,2304,16,32,256,1,4,4,1034.2763333333332,3
w13,8,60,6,3584,2304,16,32,256,1,8,2,1036.7293333333334,3
w13,8,60,6,3584,2304,16,32,256,1,8,3,1035.183,3
w13,8,60,6,3584,2304,16,32,256,1,8,4,1035.1933333333334,3
w13,8,60,6,3584,2304,16,32,256,16,4,2,1037.924,3
w13,8,60,6,3584,2304,16,32,256,16,4,3,1034.9906666666666,3
w13,8,60,6,3584,2304,16,32,256,16,4,4,1034.9376666666667,3
w13,8,60,6,3584,2304,16,32,256,16,8,3,1035.2683333333334,3
w13,8,60,6,3584,2304,16,32,256,16,8,4,1035.0756666666666,3
w13,8,60,6,3584,2304,16,32,256,32,4,3,1034.9376666666667,3
w13,8,60,6,3584,2304,16,32,256,32,4,4,1035.8763333333334,3
w13,8,60,6,3584,2304,16,32,256,32,8,3,1036.548,3
w13,8,60,6,3584,2304,16,32,256,32,8,4,1035.6626666666668,3
w13,8,60,6,3584,2304,16,32,256,64,4,3,1036.8253333333332,3
w13,8,60,6,3584,2304,16,32,256,64,4,4,1035.9826666666668,3
w13,8,60,6,3584,2304,16,32,256,64,8,3,1036.6760000000002,3
w13,8,60,6,3584,2304,16,32,256,64,8,4,1036.2923333333333,3
w13,8,60,6,3584,2304,16,64,128,1,4,2,1033.6146666666666,3
w13,8,60,6,3584,2304,16,64,128,1,4,3,1037.828,3
w13,8,60,6,3584,2304,16,64,128,1,4,4,1034.724,3
w13,8,60,6,3584,2304,16,64,128,1,8,2,1033.2413333333334,3
w13,8,60,6,3584,2304,16,64,128,1,8,4,1033.9023333333334,3
w13,8,60,6,3584,2304,16,64,128,16,4,2,1036.1109999999999,3
w13,8,60,6,3584,2304,16,64,128,16,4,4,1034.8096666666668,3
w13,8,60,6,3584,2304,16,64,128,16,8,2,1035.4386666666667,3
w13,8,60,6,3584,2304,16,64,128,16,8,4,1035.4066666666665,3
w13,8,60,6,3584,2304,16,64,128,32,4,2,1036.644,3
w13,8,60,6,3584,2304,16,64,128,32,4,4,1035.0973333333334,3
w13,8,60,6,3584,2304,16,64,128,32,8,2,1035.5559999999998,3
w13,8,60,6,3584,2304,16,64,128,32,8,4,1035.492,3
w13,8,60,6,3584,2304,16,64,128,64,4,2,1036.164,3
w13,8,60,6,3584,2304,16,64,128,64,4,4,1036.0363333333335,3
w13,8,60,6,3584,2304,16,64,128,64,8,2,1036.7079999999999,3
w13,8,60,6,3584,2304,16,64,128,64,8,4,1035.684,3
w13,8,60,6,3584,2304,16,64,256,1,4,3,1034.0733333333333,3
w13,8,60,6,3584,2304,16,64,256,1,8,3,1034.532,3
w13,8,60,6,3584,2304,16,64,256,16,4,3,1035.247,3
w13,8,60,6,3584,2304,16,64,256,16,8,3,1035.855,3
w13,8,60,6,3584,2304,16,64,256,32,4,3,1035.5243333333333,3
w13,8,60,6,3584,2304,16,64,256,32,8,3,1035.3743333333332,3
w13,8,60,6,3584,2304,16,64,256,64,4,3,1036.2063333333333,3
w13,8,60,6,3584,2304,16,64,256,64,8,3,1036.2813333333334,3
w13,8,60,6,3584,2304,16,128,128,1,4,2,1033.9986666666666,3
w13,8,60,6,3584,2304,16,128,128,1,8,2,1033.6360000000002,3
w13,8,60,6,3584,2304,16,128,128,16,4,2,1035.823,3
w13,8,60,6,3584,2304,16,128,128,16,8,2,1035.204,3
w13,8,60,6,3584,2304,16,128,128,32,4,2,1035.951,3
w13,8,60,6,3584,2304,16,128,128,32,8,2,1035.1293333333333,3
w13,8,60,6,3584,2304,16,128,128,64,4,2,1037.0710000000001,3
w13,8,60,6,3584,2304,16,128,128,64,8,2,1036.4306666666666,3
w13,8,60,6,3584,2304,32,16,128,4,4,2,1035.855,3
w13,8,60,6,3584,2304,32,16,128,4,4,3,1034.532,3
w13,8,60,6,3584,2304,32,16,128,4,4,4,1035.3853333333334,3
w13,8,60,6,3584,2304,32,16,128,4,8,3,1037.3693333333333,3
w13,8,60,6,3584,2304,32,32,64,1,4,3,1037.3693333333333,3
w13,8,60,6,3584,2304,32,32,128,1,4,2,1034.0306666666668,3
w13,8,60,6,3584,2304,32,32,128,1,4,3,1036.2816666666665,3
w13,8,60,6,3584,2304,32,32,128,1,4,4,1034.852,3
w13,8,60,6,3584,2304,32,32,128,1,8,2,1035.7906666666668,3
w13,8,60,6,3584,2304,32,32,128,1,8,3,1035.8866666666665,3
w13,8,60,6,3584,2304,32,32,128,1,8,4,1036.0783333333334,3
w13,8,60,6,3584,2304,32,32,128,4,4,2,1035.876,3
w13,8,60,6,3584,2304,32,32,128,4,4,3,1035.2893333333334,3
w13,8,60,6,3584,2304,32,32,128,4,4,4,1035.3426666666667,3
w13,8,60,6,3584,2304,32,32,128,4,8,2,1037.0493333333334,3
w13,8,60,6,3584,2304,32,32,128,4,8,3,1037.3693333333333,3
w13,8,60,6,3584,2304,32,32,128,4,8,4,1035.8016666666665,3
w13,8,60,6,3584,2304,32,32,128,16,4,2,1036.1533333333334,3
w13,8,60,6,3584,2304,32,32,128,16,4,3,1036.6866666666667,3
w13,8,60,6,3584,2304,32,32,128,16,4,4,1035.684,3
w13,8,60,6,3584,2304,32,32,128,16,8,2,1037.1879999999999,3
w13,8,60,6,3584,2304,32,32,128,16,8,3,1036.4523333333334,3
w13,8,60,6,3584,2304,32,32,128,16,8,4,1036.2279999999998,3
w13,8,60,6,3584,2304,32,32,128,64,4,2,1036.8039999999999,3
w13,8,60,6,3584,2304,32,32,128,64,4,3,1036.8790000000001,3
w13,8,60,6,3584,2304,32,32,128,64,4,4,1036.8466666666666,3
w13,8,60,6,3584,2304,32,32,128,64,8,2,1037.1883333333333,3
w13,8,60,6,3584,2304,32,32,128,64,8,4,1038.148,3
w13,8,60,6,3584,2304,32,32,256,1,4,2,1035.4173333333333,3
w13,8,60,6,3584,2304,32,32,256,1,4,3,1033.7213333333332,3
w13,8,60,6,3584,2304,32,32,256,1,4,4,1034.5213333333334,3
w13,8,60,6,3584,2304,32,32,256,1,8,2,1037.423,3
w13,8,60,6,3584,2304,32,32,256,1,8,3,1035.3963333333334,3
w13,8,60,6,3584,2304,32,32,256,1,8,4,1034.372,3
w13,8,60,6,3584,2304,32,32,256,4,4,2,1036.7933333333333,3
w13,8,60,6,3584,2304,32,32,256,4,4,3,1034.98,3
w13,8,60,6,3584,2304,32,32,256,4,4,4,1034.3826666666666,3
w13,8,60,6,3584,2304,32,32,256,4,8,2,1037.3586666666667,3
w13,8,60,6,3584,2304,32,32,256,4,8,3,1034.852,3
w13,8,60,6,3584,2304,32,32,256,4,8,4,1035.364,3
w13,8,60,6,3584,2304,32,32,256,16,4,2,1036.58,3
w13,8,60,6,3584,2304,32,32,256,16,4,3,1035.556,3
w13,8,60,6,3584,2304,32,32,256,16,4,4,1036.1000000000001,3
w13,8,60,6,3584,2304,32,32,256,16,8,2,1037.7216666666666,3
w13,8,60,6,3584,2304,32,32,256,16,8,3,1035.396,3
w13,8,60,6,3584,2304,32,32,256,16,8,4,1035.8226666666667,3
w13,8,60,6,3584,2304,32,32,256,32,4,2,1036.772,3
w13,8,60,6,3584,2304,32,32,256,32,4,3,1035.7906666666665,3
w13,8,60,6,3584,2304,32,32,256,32,4,4,1035.3,3
w13,8,60,6,3584,2304,32,32,256,32,8,2,1036.7079999999999,3
w13,8,60,6,3584,2304,32,32,256,32,8,3,1035.876,3
w13,8,60,6,3584,2304,32,32,256,32,8,4,1035.919,3
w13,8,60,6,3584,2304,32,64,128,1,4,2,1033.7,3
w13,8,60,6,3584,2304,32,64,128,1,4,4,1034.18,3
w13,8,60,6,3584,2304,32,64,128,1,8,2,1034.7456666666667,3
w13,8,60,6,3584,2304,32,64,128,1,8,4,1034.3823333333332,3
w13,8,60,6,3584,2304,32,64,128,4,4,2,1035.4813333333334,3
w13,8,60,6,3584,2304,32,64,128,4,4,4,1034.372,3
w13,8,60,6,3584,2304,32,64,128,4,8,2,1035.2466666666667,3
w13,8,60,6,3584,2304,32,64,128,4,8,4,1034.9906666666666,3
w13,8,60,6,3584,2304,32,64,128,16,4,2,1036.3243333333332,3
w13,8,60,6,3584,2304,32,64,128,16,4,4,1035.5023333333331,3
w13,8,60,6,3584,2304,32,64,128,16,8,2,1036.356,3
w13,8,60,6,3584,2304,32,64,128,16,8,4,1036.4093333333333,3
w13,8,60,6,3584,2304,32,64,128,32,4,2,1037.1136666666666,3
w13,8,60,6,3584,2304,32,64,128,32,4,4,1035.7373333333333,3
w13,8,60,6,3584,2304,32,64,128,32,8,2,1035.8653333333332,3
w13,8,60,6,3584,2304,32,64,128,32,8,4,1035.6200000000001,3
w13,8,60,6,3584,2304,32,64,128,64,4,2,1036.8256666666666,3
w13,8,60,6,3584,2304,32,64,128,64,4,4,1036.847,3
w13,8,60,6,3584,2304,32,64,128,64,8,2,1037.231,3
w13,8,60,6,3584,2304,32,64,128,64,8,4,1036.0576666666666,3
w13,8,60,6,3584,2304,32,64,256,1,4,3,1034.7346666666665,3
w13,8,60,6,3584,2304,32,64,256,1,8,3,1034.4043333333334,3
w13,8,60,6,3584,2304,32,64,256,8,4,3,1035.46,3
w13,8,60,6,3584,2304,32,64,256,8,8,3,1034.9696666666666,3
w13,8,60,6,3584,2304,32,64,256,16,4,3,1036.0786666666665,3
w13,8,60,6,3584,2304,32,64,256,16,8,3,1035.7903333333334,3
w13,8,60,6,3584,2304,32,64,256,32,4,3,1035.7586666666666,3
w13,8,60,6,3584,2304,32,64,256,32,8,3,1035.7266666666667,3
w13,8,60,6,3584,2304,32,64,256,64,4,3,1036.8253333333334,3
w13,8,60,6,3584,2304,32,64,256,64,8,3,1036.5266666666666,3
w13,8,60,6,3584,2304,32,128,128,1,4,2,1035.535,3
w13,8,60,6,3584,2304,32,128,128,1,8,2,1033.9773333333333,3
w13,8,60,6,3584,2304,32,128,128,4,4,2,1036.6123333333333,3
w13,8,60,6,3584,2304,32,128,128,4,8,2,1035.876,3
w13,8,60,6,3584,2304,32,128,128,8,4,2,1035.919,3
w13,8,60,6,3584,2304,32,128,128,8,8,2,1035.3323333333333,3
w13,8,60,6,3584,2304,32,128,128,16,4,2,1036.9536666666665,3
w13,8,60,6,3584,2304,32,128,128,16,8,2,1035.8976666666667,3
w13,8,60,6,3584,2304,32,128,128,32,4,2,1037.2736666666667,3
w13,8,60,6,3584,2304,32,128,128,32,8,2,1036.1966666666667,3
w13,8,60,6,3584,2304,32,128,128,64,4,2,1037.8706666666667,3
w13,8,60,6,3584,2304,64,32,128,1,4,3,1035.9186666666667,3
w13,8,60,6,3584,2304,64,32,128,1,4,4,1036.7293333333334,3
w13,8,60,6,3584,2304,64,32,128,1,8,3,1036.7503333333334,3
w13,8,60,6,3584,2304,64,32,128,1,8,4,1036.281,3
w13,8,60,6,3584,2304,64,32,128,16,4,3,1036.7616666666665,3
w13,8,60,6,3584,2304,64,32,128,16,8,3,1037.5720000000001,3
w13,8,60,6,3584,2304,64,32,256,1,4,2,1036.996,3
w13,8,60,6,3584,2304,64,32,256,1,4,3,1036.2386666666669,3
w13,8,60,6,3584,2304,64,32,256,1,8,2,1036.5053333333333,3
w13,8,60,6,3584,2304,64,32,256,1,8,3,1035.3323333333335,3
w13,8,60,6,3584,2304,64,64,128,1,4,3,1035.5133333333333,3
w13,8,60,6,3584,2304,64,64,128,1,4,4,1036.4309999999998,3
w13,8,60,6,3584,2304,64,64,128,1,8,3,1036.1109999999999,3
w13,8,60,6,3584,2304,64,64,128,1,8,4,1036.6013333333333,3
w13,8,60,6,3584,2304,64,64,128,4,4,4,1036.3456666666668,3
w13,8,60,6,3584,2304,64,64,128,4,8,4,1036.3776666666665,3
w13,8,60,6,3584,2304,64,64,128,8,4,4,1036.9536666666665,3
w13,8,60,6,3584,2304,64,64,128,8,8,4,1036.42,3
w13,8,60,6,3584,2304,64,64,128,16,4,3,1038.148,3
w13,8,60,6,3584,2304,64,64,128,16,4,4,1037.0063333333333,3
w13,8,60,6,3584,2304,64,64,128,16,8,3,1037.0706666666667,3
w13,8,60,6,3584,2304,64,64,128,16,8,4,1036.8683333333333,3
w13,8,60,6,3584,2304,64,64,128,32,4,4,1037.0603333333333,3
w13,8,60,6,3584,2304,64,64,128,32,8,4,1037.903,3
w13,8,60,6,3584,2304,64,64,128,64,4,4,1038.1589999999999,3
w13,8,60,6,3584,2304,64,64,128,64,8,4,1037.9776666666667,3
w13,8,60,6,3584,2304,64,128,128,1,4,2,1037.4336666666668,3
w13,8,60,6,3584,2304,64,128,128,1,8,2,1035.9296666666667,3
w13,8,60,6,3584,2304,64,128,128,4,8,2,1038.0306666666665,3
w13,8,60,8,2048,1536,16,32,64,1,4,3,493.911,3
w13,8,60,8,2048,1536,16,32,128,1,4,2,491.6286666666667,3
w13,8,60,8,2048,1536,16,32,256,1,4,2,493.04733333333337,3
w13,8,60,8,2048,1536,16,64,128,1,4,2,493.69800000000004,3
w13,8,60,8,2048,1536,16,64,128,1,8,2,494.02833333333336,3
w13,8,60,8,2048,1536,16,64,256,1,4,2,492.86566666666664,3
w13,8,60,8,2048,1536,16,128,128,1,4,2,493.922,3
w13,8,60,8,2048,1536,32,16,128,4,4,2,493.23900000000003,3
w13,8,60,8,2048,1536,32,64,128,1,4,2,492.67366666666663,3
w13,8,60,8,2048,1536,32,64,256,1,4,2,493.9753333333333,3
w13,8,60,8,2048,1536,32,128,128,1,4,2,493.9536666666667,3
w13,8,64,6,3072,2048,16,16,128,1,4,2,791.598,3
w13,8,64,6,3072,2048,16,16,128,1,4,3,791.46,3
w13,8,64,6,3072,2048,16,16,128,1,4,4,791.4273333333334,3
w13,8,64,6,3072,2048,16,16,256,1,4,2,791.129,3
w13,8,64,6,3072,2048,16,16,256,1,4,3,788.4413333333333,3
w13,8,64,6,3072,2048,16,16,256,1,4,4,789.1869999999999,3
w13,8,64,6,3072,2048,16,16,256,1,8,2,791.5133333333333,3
w13,8,64,6,3072,2048,16,16,256,1,8,3,791.1926666666667,3
w13,8,64,6,3072,2048,16,16,256,1,8,4,790.6493333333333,3
w13,8,64,6,3072,2048,16,16,256,4,4,3,788.857,3
w13,8,64,6,3072,2048,16,16,256,4,4,4,788.8359999999999,3
w13,8,64,6,3072,2048,16,16,256,4,8,2,792.2173333333334,3
w13,8,64,6,3072,2048,16,16,256,4,8,3,790.564,3
w13,8,64,6,3072,2048,16,16,256,4,8,4,789.966,3
w13,8,64,6,3072,2048,16,32,128,1,4,2,789.8173333333334,3
w13,8,64,6,3072,2048,16,32,128,1,4,3,791.0003333333334,3
w13,8,64,6,3072,2048,16,32,128,1,4,4,789.1453333333333,3
w13,8,64,6,3072,2048,16,32,128,1,8,2,791.5446666666667,3
w13,8,64,6,3072,2048,16,32,128,1,8,4,791.5766666666667,3
w13,8,64,6,3072,2048,16,32,128,4,4,2,792.2599999999999,3
w13,8,64,6,3072,2048,16,32,128,4,4,4,790.243,3
w13,8,64,6,3072,2048,16,32,128,4,8,4,791.9293333333334,3
w13,8,64,6,3072,2048,16,32,128,16,4,3,791.8119999999999,3
w13,8,64,6,3072,2048,16,32,128,16,4,4,788.9843333333333,3
w13,8,64,6,3072,2048,16,32,128,16,8,4,790.0733333333333,3
w13,8,64,6,3072,2048,16,32,128,32,4,2,792.3876666666666,3
w13,8,64,6,3072,2048,16,32,128,32,4,4,789.3159999999999,3
w13,8,64,6,3072,2048,16,32,128,32,8,2,790.8833333333333,3
w13,8,64,6,3072,2048,16,32,128,32,8,4,790.1896666666667,3
w13,8,64,6,3072,2048,16,32,128,64,4,2,791.3000000000001,3
w13,8,64,6,3072,2048,16,32,128,64,4,3,792.355,3
w13,8,64,6,3072,2048,16,32,128,64,4,4,789.3693333333334,3
w13,8,64,6,3072,2048,16,32,128,64,8,2,790.8616666666667,3
w13,8,64,6,3072,2048,16,32,128,64,8,4,790.7983333333333,3
w13,8,64,6,3072,2048,16,32,256,1,4,2,791.8326666666667,3
w13,8,64,6,3072,2048,16,32,256,1,4,3,789.1239999999999,3
w13,8,64,6,3072,2048,16,32,256,1,4,4,789.0063333333334,3
w13,8,64,6,3072,2048,16,32,256,1,8,3,790.457,3
w13,8,64,6,3072,2048,16,32,256,1,8,4,789.9340000000001,3
w13,8,64,6,3072,2048,16,32,256,16,4,3,789.6460000000001,3
w13,8,64,6,3072,2048,16,32,256,16,4,4,789.7959999999999,3
w13,8,64,6,3072,2048,16,32,256,16,8,3,790.1266666666667,3
w13,8,64,6,3072,2048,16,32,256,16,8,4,790.5203333333333,3
w13,8,64,6,3072,2048,16,32,256,32,4,3,789.9229999999999,3
w13,8,64,6,3072,2048,16,32,256,32,4,4,790.0619999999999,3
w13,8,64,6,3072,2048,16,32,256,32,8,3,790.436,3
w13,8,64,6,3072,2048,16,32,256,32,8,4,791.1283333333334,3
w13,8,64,6,3072,2048,16,32,256,64,4,3,790.393,3
w13,8,64,6,3072,2048,16,32,256,64,4,4,790.5213333333335,3
w13,8,64,6,3072,2048,16,32,256,64,8,3,790.4886666666666,3
w13,8,64,6,3072,2048,16,32,256,64,8,4,790.98,3
w13,8,64,6,3072,2048,16,64,128,1,4,4,790.5206666666667,3
w13,8,64,6,3072,2048,16,64,128,1,8,4,790.3826666666668,3
w13,8,64,6,3072,2048,16,64,128,16,4,4,789.348,3
w13,8,64,6,3072,2048,16,64,128,16,8,4,789.7313333333333,3
w13,8,64,6,3072,2048,16,64,128,32,4,4,789.2946666666667,3
w13,8,64,6,3072,2048,16,64,128,32,8,4,789.4226666666667,3
w13,8,64,6,3072,2048,16,64,128,64,4,4,789.4856666666668,3
w13,8,64,6,3072,2048,16,64,128,64,8,4,790.532,3
w13,8,64,6,3072,2048,16,64,256,1,4,3,790.19,3
w13,8,64,6,3072,2048,16,64,256,1,8,3,789.3159999999999,3
w13,8,64,6,3072,2048,16,64,256,16,4,3,789.7426666666667,3
w13,8,64,6,3072,2048,16,64,256,16,8,3,789.6783333333333,3
w13,8,64,6,3072,2048,16,64,256,32,4,3,790.2226666666667,3
w13,8,64,6,3072,2048,16,64,256,32,8,3,789.6786666666667,3
w13,8,64,6,3072,2048,16,64,256,64,4,3,790.308,3
w13,8,64,6,3072,2048,16,64,256,64,8,3,790.4456666666666,3
w13,8,64,6,3072,2048,32,16,128,4,4,3,790.4143333333333,3
w13,8,64,6,3072,2048,32,16,128,4,4,4,788.718,3
w13,8,64,6,3072,2048,32,16,128,4,8,3,792.3026666666668,3
w13,8,64,6,3072,2048,32,16,128,4,8,4,790.7020000000001,3
w13,8,64,6,3072,2048,32,32,128,1,4,2,790.628,3
w13,8,64,6,3072,2048,32,32,128,1,4,3,790.1586666666666,3
w13,8,64,6,3072,2048,32,32,128,1,4,4,791.2036666666667,3
w13,8,64,6,3072,2048,32,32,128,1,8,2,791.7046666666666,3
w13,8,64,6,3072,2048,32,32,128,1,8,3,791.1186666666666,3
w13,8,64,6,3072,2048,32,32,128,1,8,4,791.5986666666668,3
w13,8,64,6,3072,2048,32,32,128,4,4,3,791.6306666666666,3
w13,8,64,6,3072,2048,32,32,128,4,4,4,792.1096666666667,3
w13,8,64,6,3072,2048,32,32,128,4,8,3,792.1640000000001,3
w13,8,64,6,3072,2048,32,32,128,4,8,4,792.2916666666666,3
w13,8,64,6,3072,2048,32,32,128,16,4,2,792.0673333333334,3
w13,8,64,6,3072,2048,32,32,128,16,4,3,790.1053333333333,3
w13,8,64,6,3072,2048,32,32,128,16,4,4,789.9133333333333,3
w13,8,64,6,3072,2048,32,32,128,16,8,3,790.0616666666666,3
w13,8,64,6,3072,2048,32,32,128,16,8,4,790.98,3
w13,8,64,6,3072,2048,32,32,128,64,4,2,790.596,3
w13,8,64,6,3072,2048,32,32,128,64,4,3,790.5843333333333,3
w13,8,64,6,3072,2048,32,32,128,64,4,4,789.9026666666667,3
w13,8,64,6,3072,2048,32,32,128,64,8,2,791.0333333333333,3
w13,8,64,6,3072,2048,32,32,128,64,8,3,788.942,3
w13,8,64,6,3072,2048,32,32,128,64,8,4,791.3416666666667,3
w13,8,64,6,3072,2048,32,32,256,1,4,2,788.6116666666667,3
w13,8,64,6,3072,2048,32,32,256,1,4,3,789.2413333333334,3
w13,8,64,6,3072,2048,32,32,256,1,4,4,788.9523333333333,3
w13,8,64,6,3072,2048,32,32,256,1,8,2,790.6173333333332,3
w13,8,64,6,3072,2048,32,32,256,1,8,3,788.9,3
w13,8,64,6,3072,2048,32,32,256,1,8,4,788.996,3
w13,8,64,6,3072,2048,32,32,256,4,4,2,790.4456666666666,3
w13,8,64,6,3072,2048,32,32,256,4,4,3,789.5823333333334,3
w13,8,64,6,3072,2048,32,32,256,4,4,4,789.3266666666667,3
w13,8,64,6,3072,2048,32,32,256,4,8,2,790.628,3
w13,8,64,6,3072,2048,32,32,256,4,8,3,789.1233333333333,3
w13,8,64,6,3072,2048,32,32,256,4,8,4,789.284,3
w13,8,64,6,3072,2048,32,32,256,16,4,2,789.636,3
w13,8,64,6,3072,2048,32,32,256,16,4,3,790.7016666666667,3
w13,8,64,6,3072,2048,32,32,256,16,4,4,789.8173333333334,3
w13,8,64,6,3072,2048,32,32,256,16,8,2,789.7213333333333,3
w13,8,64,6,3072,2048,32,32,256,16,8,3,790.308,3
w13,8,64,6,3072,2048,32,32,256,16,8,4,790.062,3
w13,8,64,6,3072,2048,32,32,256,32,4,2,789.091,3
w13,8,64,6,3072,2048,32,32,256,32,4,3,790.457,3
w13,8,64,6,3072,2048,32,32,256,32,4,4,790.1259999999999,3
w13,8,64,6,3072,2048,32,32,256,32,8,2,788.8040000000001,3
w13,8,64,6,3072,2048,32,32,256,32,8,3,790.468,3
w13,8,64,6,3072,2048,32,32,256,32,8,4,790.2006666666666,3
w13,8,64,6,3072,2048,32,64,128,1,4,4,790.6066666666667,3
w13,8,64,6,3072,2048,32,64,128,1,8,4,791.1826666666666,3
w13,8,64,6,3072,2048,32,64,128,4,4,4,791.4813333333333,3
w13,8,64,6,3072,2048,32,64,128,4,8,4,791.107,3
w13,8,64,6,3072,2048,32,64,128,16,4,4,789.444,3
w13,8,64,6,3072,2048,32,64,128,16,8,4,790.4786666666668,3
w13,8,64,6,3072,2048,32,64,128,32,4,4,789.7423333333332,3
w13,8,64,6,3072,2048,32,64,128,32,8,4,790.3389999999999,3
w13,8,64,6,3072,2048,32,64,128,64,4,4,789.8386666666667,3
w13,8,64,6,3072,2048,32,64,128,64,8,4,790.2653333333334,3
w13,8,64,6,3072,2048,32,64,256,1,4,3,790.3710000000001,3
w13,8,64,6,3072,2048,32,64,256,1,8,3,790.0733333333333,3
w13,8,64,6,3072,2048,32,64,256,8,4,3,790.4893333333333,3
w13,8,64,6,3072,2048,32,64,256,8,8,3,790.2860000000001,3
w13,8,64,6,3072,2048,32,64,256,16,4,3,790.6706666666668,3
w13,8,64,6,3072,2048,32,64,256,16,8,3,790.0626666666667,3
w13,8,64,6,3072,2048,32,64,256,32,4,3,790.7346666666667,3
w13,8,64,6,3072,2048,32,64,256,32,8,3,790.9366666666666,3
w13,8,64,6,3072,2048,32,64,256,64,4,3,791.2253333333333,3
w13,8,64,6,3072,2048,32,64,256,64,8,3,790.2756666666668,3
w13,8,64,6,3072,2048,64,32,128,1,4,3,791.556,3
w13,8,64,6,3072,2048,64,32,128,1,4,4,791.9186666666668,3
w13,8,64,6,3072,2048,64,32,128,1,8,4,791.9929999999999,3
w13,8,64,6,3072,2048,64,32,128,16,4,3,791.4813333333333,3
w13,8,64,6,3072,2048,64,32,128,16,8,3,790.958,3
w13,8,64,6,3072,2048,64,32,256,1,4,2,792.163,3
w13,8,64,6,3072,2048,64,32,256,1,4,3,790.2860000000001,3
w13,8,64,6,3072,2048,64,32,256,1,8,3,790.19,3
w13,8,64,6,3072,2048,64,64,128,8,4,4,791.6946666666666,3
w13,8,64,6,3072,2048,64,64,128,16,4,3,792.1636666666667,3
w13,8,64,6,3072,2048,64,64,128,16,4,4,791.427,3
w13,8,64,6,3072,2048,64,64,128,16,8,3,791.1923333333334,3
w13,8,64,6,3072,2048,64,64,128,32,4,3,791.203,3
w13,8,64,6,3072,2048,64,64,128,32,4,4,790.6593333333334,3
w13,8,64,6,3072,2048,64,64,128,32,8,3,790.5736666666667,3
w13,8,64,6,3072,2048,64,64,128,32,8,4,791.8433333333334,3
w13,8,64,6,3072,2048,64,64,128,64,4,3,791.5769999999999,3
w13,8,64,6,3072,2048,64,64,128,64,4,4,791.3746666666666,3
w13,8,64,6,3072,2048,64,64,128,64,8,3,790.4893333333333,3
w13,8,64,6,3072,2048,64,64,128,64,8,4,792.0573333333333,3
w13,8,64,6,3584,1536,16,16,64,1,4,3,691.777,3
w13,8,64,6,3584,1536,16,16,128,1,4,2,690.3046666666668,3
w13,8,64,6,3584,1536,16,16,128,1,4,3,690.0696666666666,3
w13,8,64,6,3584,1536,16,16,128,1,4,4,691.2006666666666,3
w13,8,64,6,3584,1536,16,16,128,1,8,3,692.1076666666668,3
w13,8,64,6,3584,1536,16,16,128,4,4,2,690.422,3
w13,8,64,6,3584,1536,16,16,128,4,4,3,690.1656666666667,3
w13,8,64,6,3584,1536,16,16,128,4,4,4,691.9476666666666,3
w13,8,64,6,3584,1536,16,16,128,4,8,3,691.4033333333333,3
w13,8,64,6,3584,1536,16,16,256,1,4,2,690.2510000000001,3
w13,8,64,6,3584,1536,16,16,256,1,4,3,690.7953333333334,3
w13,8,64,6,3584,1536,16,16,256,1,4,4,690.7846666666668,3
w13,8,64,6,3584,1536,16,16,256,1,8,4,693.1746666666667,3
w13,8,64,6,3584,1536,16,16,256,4,4,2,690.3896666666666,3
w13,8,64,6,3584,1536,16,16,256,4,4,3,690.8806666666666,3
w13,8,64,6,3584,1536,16,16,256,4,4,4,691.1793333333334,3
w13,8,64,6,3584,1536,16,16,256,4,8,3,693.0569999999999,3
w13,8,64,6,3584,1536,16,16,256,4,8,4,693.0039999999999,3
w13,8,64,6,3584,1536,16,32,64,1,4,3,692.449,3
w13,8,64,6,3584,1536,16,32,64,1,4,4,693.0996666666666,3
w13,8,64,6,3584,1536,16,32,128,1,4,2,690.6676666666667,3
w13,8,64,6,3584,1536,16,32,128,1,4,3,693.3026666666666,3
w13,8,64,6,3584,1536,16,32,128,1,4,4,691.2539999999999,3
w13,8,64,6,3584,1536,16,32,128,1,8,2,690.8913333333334,3
w13,8,64,6,3584,1536,16,32,128,1,8,4,692.2783333333333,3
w13,8,64,6,3584,1536,16,32,128,4,4,2,690.699,3
w13,8,64,6,3584,1536,16,32,128,4,4,3,693.0573333333333,3
w13,8,64,6,3584,1536,16,32,128,4,4,4,690.6353333333333,3
w13,8,64,6,3584,1536,16,32,128,4,8,2,690.3793333333333,3
w13,8,64,6,3584,1536,16,32,128,4,8,4,692.748,3
w13,8,64,6,3584,1536,16,32,128,16,4,2,692.524,3
w13,8,64,6,3584,1536,16,32,128,16,4,3,692.9613333333333,3
w13,8,64,6,3584,1536,16,32,128,16,4,4,691.1043333333333,3
w13,8,64,6,3584,1536,16,32,128,16,8,2,691.3820000000001,3
w13,8,64,6,3584,1536,16,32,128,16,8,4,692.8223333333334,3
w13,8,64,6,3584,1536,16,32,128,32,4,2,691.7130000000001,3
w13,8,64,6,3584,1536,16,32,128,32,4,3,692.428,3
w13,8,64,6,3584,1536,16,32,128,32,4,4,691.467,3
w13,8,64,6,3584,1536,16,32,128,32,8,2,690.7523333333334,3
w13,8,64,6,3584,1536,16,32,128,32,8,4,693.1640000000001,3
w13,8,64,6,3584,1536,16,32,128,64,4,2,692.8226666666666,3
w13,8,64,6,3584,1536,16,32,128,64,4,3,692.6726666666667,3
w13,8,64,6,3584,1536,16,32,128,64,4,4,692.2463333333334,3
w13,8,64,6,3584,1536,16,32,128,64,8,2,691.0406666666667,3
w13,8,64,6,3584,1536,16,32,128,64,8,4,692.641,3
w13,8,64,6,3584,1536,16,32,256,1,4,2,692.7156666666666,3
w13,8,64,6,3584,1536,16,32,256,1,4,3,692.4813333333333,3
w13,8,64,6,3584,1536,16,32,256,1,4,4,690.7956666666665,3
w13,8,64,6,3584,1536,16,32,256,1,8,3,692.5876666666667,3
w13,8,64,6,3584,1536,16,32,256,1,8,4,692.0646666666667,3
w13,8,64,6,3584,1536,16,32,256,16,4,2,693.2066666666666,3
w13,8,64,6,3584,1536,16,32,256,16,4,3,692.1610000000001,3
w13,8,64,6,3584,1536,16,32,256,16,4,4,692.1503333333334,3
w13,8,64,6,3584,1536,16,32,256,16,8,4,691.6060000000001,3
w13,8,64,6,3584,1536,16,32,256,32,4,2,693.1959999999999,3
w13,8,64,6,3584,1536,16,32,256,32,4,3,692.1610000000001,3
w13,8,64,6,3584,1536,16,32,256,32,4,4,691.2543333333333,3
w13,8,64,6,3584,1536,16,32,256,32,8,4,691.7873333333333,3
w13,8,64,6,3584,1536,16,32,256,64,4,3,692.5986666666666,3
w13,8,64,6,3584,1536,16,32,256,64,4,4,691.6596666666666,3
w13,8,64,6,3584,1536,16,32,256,64,8,4,692.235,3
w13,8,64,6,3584,1536,16,64,128,1,4,3,692.3846666666667,3
w13,8,64,6,3584,1536,16,64,128,1,4,4,690.881,3
w13,8,64,6,3584,1536,16,64,128,1,8,3,692.9823333333334,3
w13,8,64,6,3584,1536,16,64,128,1,8,4,691.8403333333332,3
w13,8,64,6,3584,1536,16,64,128,16,4,3,693.1533333333333,3
w13,8,64,6,3584,1536,16,64,128,16,4,4,691.1793333333334,3
w13,8,64,6,3584,1536,16,64,128,16,8,3,693.1850000000001,3
w13,8,64,6,3584,1536,16,64,128,16,8,4,691.5206666666667,3
w13,8,64,6,3584,1536,16,64,128,32,4,3,692.172,3
w13,8,64,6,3584,1536,16,64,128,32,4,4,691.1156666666666,3
w13,8,64,6,3584,1536,16,64,128,32,8,3,692.4483333333334,3
w13,8,64,6,3584,1536,16,64,128,32,8,4,691.7980000000001,3
w13,8,64,6,3584,1536,16,64,128,64,4,3,693.3876666666666,3
w13,8,64,6,3584,1536,16,64,128,64,4,4,691.8939999999999,3
w13,8,64,6,3584,1536,16,64,128,64,8,3,693.0573333333333,3
w13,8,64,6,3584,1536,16,64,128,64,8,4,691.8733333333333,3
w13,8,64,6,3584,1536,16,64,256,1,4,3,692.46,3
w13,8,64,6,3584,1536,16,64,256,1,8,3,692.3000000000001,3
w13,8,64,6,3584,1536,16,64,256,16,4,3,692.9826666666667,3
w13,8,64,6,3584,1536,16,64,256,16,8,3,692.4273333333334,3
w13,8,64,6,3584,1536,16,64,256,32,8,3,693.1103333333334,3
w13,8,64,6,3584,1536,16,64,256,64,4,3,693.4523333333333,3
w13,8,64,6,3584,1536,16,64,256,64,8,3,693.1533333333333,3
w13,8,64,6,3584,1536,16,128,128,1,8,3,693.1423333333333,3
w13,8,64,6,3584,1536,32,16,128,4,4,3,691.6593333333334,3
w13,8,64,6,3584,1536,32,16,128,4,4,4,691.5949999999999,3
w13,8,64,6,3584,1536,32,16,128,4,8,4,693.3453333333333,3
w13,8,64,6,3584,1536,32,32,64,1,4,3,692.8649999999999,3
w13,8,64,6,3584,1536,32,32,64,1,8,3,693.3773333333334,3
w13,8,64,6,3584,1536,32,32,128,1,4,2,690.2620000000001,3
w13,8,64,6,3584,1536,32,32,128,1,4,3,692.8759999999999,3
w13,8,64,6,3584,1536,32,32,128,1,4,4,692.1286666666666,3
w13,8,64,6,3584,1536,32,32,128,1,8,2,690.3043333333334,3
w13,8,64,6,3584,1536,32,32,128,4,4,2,690.422,3
w13,8,64,6,3584,1536,32,32,128,4,4,3,692.7266666666666,3
w13,8,64,6,3584,1536,32,32,128,4,4,4,692.0970000000001,3
w13,8,64,6,3584,1536,32,32,128,4,8,2,690.486,3
w13,8,64,6,3584,1536,32,32,128,16,4,2,690.859,3
w13,8,64,6,3584,1536,32,32,128,16,4,3,692.9290000000001,3
w13,8,64,6,3584,1536,32,32,128,16,4,4,692.257,3
w13,8,64,6,3584,1536,32,32,128,16,8,2,690.774,3
w13,8,64,6,3584,1536,32,32,128,64,4,2,691.8406666666666,3
w13,8,64,6,3584,1536,32,32,128,64,4,3,692.7053333333333,3
w13,8,64,6,3584,1536,32,32,128,64,4,4,692.6306666666666,3
w13,8,64,6,3584,1536,32,32,128,64,8,2,691.7446666666666,3
w13,8,64,6,3584,1536,32,32,128,64,8,4,693.4626666666667,3
w13,8,64,6,3584,1536,32,32,256,1,4,3,691.4463333333333,3
w13,8,64,6,3584,1536,32,32,256,1,4,4,691.3076666666666,3
w13,8,64,6,3584,1536,32,32,256,1,8,3,690.9016666666666,3
w13,8,64,6,3584,1536,32,32,256,1,8,4,691.4993333333333,3
w13,8,64,6,3584,1536,32,32,256,4,4,3,691.9050000000001,3
w13,8,64,6,3584,1536,32,32,256,4,4,4,691.2220000000001,3
w13,8,64,6,3584,1536,32,32,256,4,8,3,691.2753333333334,3
w13,8,64,6,3584,1536,32,32,256,4,8,4,691.393,3
w13,8,64,6,3584,1536,32,32,256,16,4,3,691.2323333333334,3
w13,8,64,6,3584,1536,32,32,256,16,4,4,691.6273333333334,3
w13,8,64,6,3584,1536,32,32,256,16,8,3,691.0193333333333,3
w13,8,64,6,3584,1536,32,32,256,16,8,4,691.4883333333333,3
w13,8,64,6,3584,1536,32,32,256,32,4,3,691.2753333333334,3
w13,8,64,6,3584,1536,32,32,256,32,4,4,691.2856666666667,3
w13,8,64,6,3584,1536,32,32,256,32,8,3,691.2856666666667,3
w13,8,64,6,3584,1536,32,32,256,32,8,4,691.5313333333334,3
w13,8,64,6,3584,1536,32,64,128,1,4,3,693.5053333333334,3
w13,8,64,6,3584,1536,32,64,128,1,4,4,691.6273333333334,3
w13,8,64,6,3584,1536,32,64,128,1,8,4,692.5773333333333,3
w13,8,64,6,3584,1536,32,64,128,4,4,3,693.4200000000001,3
w13,8,64,6,3584,1536,32,64,128,4,4,4,691.489,3
w13,8,64,6,3584,1536,32,64,128,4,8,4,692.3746666666666,3
w13,8,64,6,3584,1536,32,64,128,16,4,4,691.724,3
w13,8,64,6,3584,1536,32,64,128,16,8,4,692.3636666666666,3
w13,8,64,6,3584,1536,32,64,128,32,4,3,692.908,3
w13,8,64,6,3584,1536,32,64,128,32,4,4,692.0756666666666,3
w13,8,64,6,3584,1536,32,64,128,32,8,4,692.332,3
w13,8,64,6,3584,1536,32,64,128,64,4,3,693.4416666666666,3
w13,8,64,6,3584,1536,32,64,128,64,4,4,692.8336666666668,3
w13,8,64,6,3584,1536,32,64,128,64,8,4,692.7689999999999,3
w13,8,64,6,3584,1536,32,64,256,1,8,3,693.4630000000001,3
w13,8,64,6,3584,1536,32,64,256,8,4,3,693.5266666666666,3
w13,8,64,6,3584,1536,32,64,256,8,8,3,692.812,3
w13,8,64,6,3584,1536,32,64,256,16,8,3,693.3666666666667,3
w13,8,64,6,3584,1536,64,32,256,1,8,3,692.3953333333334,3
w13,8,64,6,3584,1536,64,64,128,4,4,4,692.8116666666666,3
w13,8,64,8,3584,2560,16,16,64,1,4,3,1532.635,3
w13,8,64,8,3584,2560,16,16,64,1,8,3,1536.6566666666665,3
w13,8,64,8,3584,2560,16,16,128,1,4,2,1530.3313333333335,3
w13,8,64,8,3584,2560,16,16,128,1,4,3,1529.7446666666667,3
w13,8,64,8,3584,2560,16,16,128,1,4,4,1530.5553333333335,3
w13,8,64,8,3584,2560,16,16,128,1,8,3,1531.3233333333335,3
w13,8,64,8,3584,2560,16,16,128,1,8,4,1534.2353333333333,3
w13,8,64,8,3584,2560,16,16,128,4,4,2,1532.134,3
w13,8,64,8,3584,2560,16,16,128,4,4,3,1530.854,3
w13,8,64,8,3584,2560,16,16,128,4,4,4,1530.5019999999997,3
w13,8,64,8,3584,2560,16,16,128,4,8,3,1532.55,3
w13,8,64,8,3584,2560,16,16,128,4,8,4,1534.6086666666667,3
w13,8,64,8,3584,2560,16,16,256,1,4,2,1530.4913333333334,3
w13,8,64,8,3584,2560,16,16,256,1,4,3,1530.2993333333334,3
w13,8,64,8,3584,2560,16,16,256,1,4,4,1531.0033333333333,3
w13,8,64,8,3584,2560,16,16,256,1,8,2,1533.7659999999998,3
w13,8,64,8,3584,2560,16,16,256,1,8,3,1532.177,3
w13,8,64,8,3584,2560,16,16,256,1,8,4,1531.7606666666668,3
w13,8,64,8,3584,2560,16,16,256,4,4,2,1532.4326666666666,3
w13,8,64,8,3584,2560,16,16,256,4,4,3,1529.9043333333332,3
w13,8,64,8,3584,2560,16,16,256,4,4,4,1529.3286666666665,3
w13,8,64,8,3584,2560,16,16,256,4,8,2,1533.8086666666666,3
w13,8,64,8,3584,2560,16,16,256,4,8,3,1531.4193333333333,3
w13,8,64,8,3584,2560,16,16,256,4,8,4,1531.0353333333333,3
w13,8,64,8,3584,2560,16,32,64,1,4,3,1534.961,3
w13,8,64,8,3584,2560,16,32,64,1,8,3,1536.6673333333335,3
w13,8,64,8,3584,2560,16,32,64,32,4,3,1536.4113333333335,3
w13,8,64,8,3584,2560,16,32,128,1,4,2,1530.0113333333331,3
w13,8,64,8,3584,2560,16,32,128,1,4,3,1529.5103333333334,3
w13,8,64,8,3584,2560,16,32,128,1,4,4,1529.478,3
w13,8,64,8,3584,2560,16,32,128,1,8,2,1529.1793333333333,3
w13,8,64,8,3584,2560,16,32,128,1,8,3,1530.1393333333333,3
w13,8,64,8,3584,2560,16,32,128,1,8,4,1532.7213333333336,3
w13,8,64,8,3584,2560,16,32,128,4,4,2,1531.7286666666666,3
w13,8,64,8,3584,2560,16,32,128,4,4,3,1529.6166666666668,3
w13,8,64,8,3584,2560,16,32,128,4,4,4,1530.5016666666668,3
w13,8,64,8,3584,2560,16,32,128,4,8,2,1531.963,3
w13,8,64,8,3584,2560,16,32,128,4,8,3,1530.7579999999998,3
w13,8,64,8,3584,2560,16,32,128,4,8,4,1532.6996666666666,3
w13,8,64,8,3584,2560,16,32,128,16,4,2,1532.3156666666666,3
w13,8,64,8,3584,2560,16,32,128,16,4,3,1530.7259999999999,3
w13,8,64,8,3584,2560,16,32,128,16,4,4,1531.622,3
w13,8,64,8,3584,2560,16,32,128,16,8,2,1530.566,3
w13,8,64,8,3584,2560,16,32,128,16,8,3,1531.8456666666668,3
w13,8,64,8,3584,2560,16,32,128,16,8,4,1533.4566666666667,3
w13,8,64,8,3584,2560,16,32,128,32,4,2,1531.408666666667,3
w13,8,64,8,3584,2560,16,32,128,32,4,3,1532.3156666666666,3
w13,8,64,8,3584,2560,16,32,128,32,4,4,1531.3976666666667,3
w13,8,64,8,3584,2560,16,32,128,32,8,2,1531.1850000000002,3
w13,8,64,8,3584,2560,16,32,128,32,8,3,1530.8753333333334,3
w13,8,64,8,3584,2560,16,32,128,32,8,4,1533.5313333333334,3
w13,8,64,8,3584,2560,16,32,128,64,4,2,1535.0356666666667,3
w13,8,64,8,3584,2560,16,32,128,64,4,3,1531.6223333333335,3
w13,8,64,8,3584,2560,16,32,128,64,4,4,1533.5103333333334,3
w13,8,64,8,3584,2560,16,32,128,64,8,2,1536.5396666666666,3
w13,8,64,8,3584,2560,16,32,128,64,8,3,1533.0833333333333,3
w13,8,64,8,3584,2560,16,32,128,64,8,4,1533.5313333333334,3
w13,8,64,8,3584,2560,16,32,256,1,4,2,1529.4886666666669,3
w13,8,64,8,3584,2560,16,32,256,1,4,3,1529.7443333333333,3
w13,8,64,8,3584,2560,16,32,256,1,4,4,1530.2246666666667,3
w13,8,64,8,3584,2560,16,32,256,1,8,2,1529.4246666666666,3
w13,8,64,8,3584,2560,16,32,256,1,8,3,1530.1823333333334,3
w13,8,64,8,3584,2560,16,32,256,1,8,4,1529.798,3
w13,8,64,8,3584,2560,16,32,256,16,4,2,1529.7443333333333,3
w13,8,64,8,3584,2560,16,32,256,16,4,3,1531.174,3
w13,8,64,8,3584,2560,16,32,256,16,4,4,1531.366,3
w13,8,64,8,3584,2560,16,32,256,16,8,2,1531.1419999999998,3
w13,8,64,8,3584,2560,16,32,256,16,8,3,1530.9926666666668,3
w13,8,64,8,3584,2560,16,32,256,16,8,4,1531.2486666666666,3
w13,8,64,8,3584,2560,16,32,256,32,4,2,1530.4276666666667,3
w13,8,64,8,3584,2560,16,32,256,32,4,3,1533.1796666666667,3
w13,8,64,8,3584,2560,16,32,256,32,4,4,1532.6353333333334,3
w13,8,64,8,3584,2560,16,32,256,32,8,2,1531.5473333333332,3
w13,8,64,8,3584,2560,16,32,256,32,8,3,1531.878,3
w13,8,64,8,3584,2560,16,32,256,32,8,4,1532.6566666666668,3
w13,8,64,8,3584,2560,16,32,256,64,4,2,1531.5583333333334,3
w13,8,64,8,3584,2560,16,32,256,64,4,3,1532.9976666666669,3
w13,8,64,8,3584,2560,16,32,256,64,4,4,1533.4566666666667,3
w13,8,64,8,3584,2560,16,32,256,64,8,2,1532.134,3
w13,8,64,8,3584,2560,16,32,256,64,8,3,1533.062,3
w13,8,64,8,3584,2560,16,32,256,64,8,4,1533.7233333333334,3
w13,8,64,8,3584,2560,16,64,64,1,4,3,1534.3739999999998,3
w13,8,64,8,3584,2560,16,64,128,1,4,2,1530.865,3
w13,8,64,8,3584,2560,16,64,128,1,4,3,1530.0330000000001,3
w13,8,64,8,3584,2560,16,64,128,1,4,4,1530.8113333333333,3
w13,8,64,8,3584,2560,16,64,128,1,8,2,1530.6726666666666,3
w13,8,64,8,3584,2560,16,64,128,1,8,3,1530.1503333333333,3
w13,8,64,8,3584,2560,16,64,128,1,8,4,1531.4193333333333,3
w13,8,64,8,3584,2560,16,64,128,16,4,2,1532.7843333333333,3
w13,8,64,8,3584,2560,16,64,128,16,4,3,1531.5153333333335,3
w13,8,64,8,3584,2560,16,64,128,16,4,4,1531.857,3
w13,8,64,8,3584,2560,16,64,128,16,8,2,1533.894,3
w13,8,64,8,3584,2560,16,64,128,16,8,3,1531.5153333333335,3
w13,8,64,8,3584,2560,16,64,128,16,8,4,1532.379,3
w13,8,64,8,3584,2560,16,64,128,32,4,2,1531.7073333333335,3
w13,8,64,8,3584,2560,16,64,128,32,4,3,1530.9926666666668,3
w13,8,64,8,3584,2560,16,64,128,32,4,4,1532.71,3
w13,8,64,8,3584,2560,16,64,128,32,8,2,1532.486,3
w13,8,64,8,3584,2560,16,64,128,32,8,3,1530.8646666666666,3
w13,8,64,8,3584,2560,16,64,128,32,8,4,1533.5743333333332,3
w13,8,64,8,3584,2560,16,64,128,64,4,2,1534.7793333333332,3
w13,8,64,8,3584,2560,16,64,128,64,4,3,1531.9743333333333,3
w13,8,64,8,3584,2560,16,64,128,64,4,4,1533.9473333333335,3
w13,8,64,8,3584,2560,16,64,128,64,8,2,1534.8006666666668,3
w13,8,64,8,3584,2560,16,64,128,64,8,3,1533.5526666666667,3
w13,8,64,8,3584,2560,16,64,128,64,8,4,1533.2326666666668,3
w13,8,64,8,3584,2560,16,64,256,1,4,2,1530.001,3
w13,8,64,8,3584,2560,16,64,256,1,4,3,1530.1073333333334,3
w13,8,64,8,3584,2560,16,64,256,1,8,2,1530.2036666666665,3
w13,8,64,8,3584,2560,16,64,256,1,8,3,1529.5523333333333,3
w13,8,64,8,3584,2560,16,64,256,16,4,2,1529.9156666666665,3
w13,8,64,8,3584,2560,16,64,256,16,4,3,1531.451,3
w13,8,64,8,3584,2560,16,64,256,16,8,2,1529.7983333333334,3
w13,8,64,8,3584,2560,16,64,256,16,8,3,1531.6326666666666,3
w13,8,64,8,3584,2560,16,64,256,32,4,2,1531.313,3
w13,8,64,8,3584,2560,16,64,256,32,4,3,1532.4116666666666,3
w13,8,64,8,3584,2560,16,64,256,32,8,2,1531.4406666666666,3
w13,8,64,8,3584,2560,16,64,256,32,8,3,1532.475333333333,3
w13,8,64,8,3584,2560,16,64,256,64,4,2,1532.934,3
w13,8,64,8,3584,2560,16,64,256,64,4,3,1533.99,3
w13,8,64,8,3584,2560,16,64,256,64,8,2,1531.9740000000002,3
w13,8,64,8,3584,2560,16,64,256,64,8,3,1533.1046666666668,3
w13,8,64,8,3584,2560,16,128,128,1,4,2,1529.9260000000002,3
w13,8,64,8,3584,2560,16,128,128,1,4,3,1530.2033333333336,3
w13,8,64,8,3584,2560,16,128,128,1,8,2,1529.7450000000001,3
w13,8,64,8,3584,2560,16,128,128,1,8,3,1529.8410000000001,3
w13,8,64,8,3584,2560,16,128,128,16,4,2,1532.859333333333,3
w13,8,64,8,3584,2560,16,128,128,16,4,3,1531.0356666666667,3
w13,8,64,8,3584,2560,16,128,128,16,8,2,1533.425,3
w13,8,64,8,3584,2560,16,128,128,16,8,3,1530.2250000000001,3
w13,8,64,8,3584,2560,16,128,128,32,4,2,1531.8029999999999,3
w13,8,64,8,3584,2560,16,128,128,32,4,3,1531.974,3
w13,8,64,8,3584,2560,16,128,128,32,8,2,1531.7393333333332,3
w13,8,64,8,3584,2560,16,128,128,32,8,3,1530.854,3
w13,8,64,8,3584,2560,16,128,128,64,4,2,1535.4836666666667,3
w13,8,64,8,3584,2560,16,128,128,64,4,3,1533.0086666666666,3
w13,8,64,8,3584,2560,16,128,128,64,8,2,1535.75,3
w13,8,64,8,3584,2560,16,128,128,64,8,3,1533.4143333333334,3
w13,8,64,8,3584,2560,32,16,128,4,4,2,1530.1823333333334,3
w13,8,64,8,3584,2560,32,16,128,4,4,3,1530.4166666666667,3
w13,8,64,8,3584,2560,32,16,128,4,4,4,1531.3023333333333,3
w13,8,64,8,3584,2560,32,16,128,4,8,3,1533.1899999999998,3
w13,8,64,8,3584,2560,32,16,128,4,8,4,1533.3286666666665,3
w13,8,64,8,3584,2560,32,32,64,1,4,3,1534.5553333333335,3
w13,8,64,8,3584,2560,32,32,64,1,8,3,1534.705,3
w13,8,64,8,3584,2560,32,32,128,1,4,2,1529.5846666666666,3
w13,8,64,8,3584,2560,32,32,128,1,4,3,1532.198,3
w13,8,64,8,3584,2560,32,32,128,1,4,4,1531.942,3
w13,8,64,8,3584,2560,32,32,128,1,8,2,1530.8646666666666,3
w13,8,64,8,3584,2560,32,32,128,1,8,3,1532.6246666666666,3
w13,8,64,8,3584,2560,32,32,128,1,8,4,1532.977,3
w13,8,64,8,3584,2560,32,32,128,4,4,2,1530.5023333333331,3
w13,8,64,8,3584,2560,32,32,128,4,4,3,1532.2086666666667,3
w13,8,64,8,3584,2560,32,32,128,4,4,4,1532.1016666666667,3
w13,8,64,8,3584,2560,32,32,128,4,8,2,1531.8246666666666,3
w13,8,64,8,3584,2560,32,32,128,4,8,3,1533.8509999999999,3
w13,8,64,8,3584,2560,32,32,128,4,8,4,1531.8886666666667,3
w13,8,64,8,3584,2560,32,32,128,16,4,2,1531.014,3
w13,8,64,8,3584,2560,32,32,128,16,4,3,1533.062,3
w13,8,64,8,3584,2560,32,32,128,16,4,4,1532.166,3
w13,8,64,8,3584,2560,32,32,128,16,8,2,1531.3766666666668,3
w13,8,64,8,3584,2560,32,32,128,16,8,3,1532.9553333333333,3
w13,8,64,8,3584,2560,32,32,128,16,8,4,1534.0756666666666,3
w13,8,64,8,3584,2560,32,32,128,64,4,3,1534.1500000000003,3
w13,8,64,8,3584,2560,32,32,128,64,4,4,1534.9503333333332,3
w13,8,64,8,3584,2560,32,32,128,64,8,2,1536.0379999999998,3
w13,8,64,8,3584,2560,32,32,128,64,8,3,1534.3953333333332,3
w13,8,64,8,3584,2560,32,32,128,64,8,4,1534.1286666666667,3
w13,8,64,8,3584,2560,32,32,256,1,4,2,1531.8566666666666,3
w13,8,64,8,3584,2560,32,32,256,1,4,3,1529.5526666666667,3
w13,8,64,8,3584,2560,32,32,256,1,4,4,1529.7983333333334,3
w13,8,64,8,3584,2560,32,32,256,1,8,2,1531.9636666666665,3
w13,8,64,8,3584,2560,32,32,256,1,8,3,1529.6490000000001,3
w13,8,64,8,3584,2560,32,32,256,1,8,4,1529.4886666666669,3
w13,8,64,8,3584,2560,32,32,256,4,4,2,1533.585,3
w13,8,64,8,3584,2560,32,32,256,4,4,3,1530.5766666666666,3
w13,8,64,8,3584,2560,32,32,256,4,4,4,1529.8726666666669,3
w13,8,64,8,3584,2560,32,32,256,4,8,2,1533.1793333333335,3
w13,8,64,8,3584,2560,32,32,256,4,8,3,1529.67,3
w13,8,64,8,3584,2560,32,32,256,4,8,4,1530.5343333333333,3
w13,8,64,8,3584,2560,32,32,256,16,4,2,1533.2006666666666,3
w13,8,64,8,3584,2560,32,32,256,16,4,3,1531.174,3
w13,8,64,8,3584,2560,32,32,256,16,4,4,1531.9633333333334,3
w13,8,64,8,3584,2560,32,32,256,16,8,2,1533.5420000000001,3
w13,8,64,8,3584,2560,32,32,256,16,8,3,1531.5049999999999,3
w13,8,64,8,3584,2560,32,32,256,16,8,4,1531.2273333333333,3
w13,8,64,8,3584,2560,32,32,256,32,4,2,1534.214,3
w13,8,64,8,3584,2560,32,32,256,32,4,3,1532.4006666666667,3
w13,8,64,8,3584,2560,32,32,256,32,4,4,1531.8886666666667,3
w13,8,64,8,3584,2560,32,32,256,32,8,2,1536.0593333333334,3
w13,8,64,8,3584,2560,32,32,256,32,8,3,1532.8059999999998,3
w13,8,64,8,3584,2560,32,32,256,32,8,4,1532.176666666667,3
w13,8,64,8,3584,2560,32,64,128,1,4,2,1530.875,3
w13,8,64,8,3584,2560,32,64,128,1,4,3,1530.8010000000002,3
w13,8,64,8,3584,2560,32,64,128,1,4,4,1531.8246666666666,3
w13,8,64,8,3584,2560,32,64,128,1,8,2,1530.7686666666668,3
w13,8,64,8,3584,2560,32,64,128,1,8,3,1529.7446666666667,3
w13,8,64,8,3584,2560,32,64,128,1,8,4,1532.2623333333333,3
w13,8,64,8,3584,2560,32,64,128,4,4,2,1531.6223333333335,3
w13,8,64,8,3584,2560,32,64,128,4,4,3,1531.0349999999999,3
w13,8,64,8,3584,2560,32,64,128,4,4,4,1533.2969999999998,3
w13,8,64,8,3584,2560,32,64,128,4,8,2,1531.0673333333334,3
w13,8,64,8,3584,2560,32,64,128,4,8,3,1530.8753333333334,3
w13,8,64,8,3584,2560,32,64,128,4,8,4,1531.7286666666666,3
w13,8,64,8,3584,2560,32,64,128,16,4,2,1533.702,3
w13,8,64,8,3584,2560,32,64,128,16,4,3,1531.11,3
w13,8,64,8,3584,2560,32,64,128,16,4,4,1533.3183333333334,3
w13,8,64,8,3584,2560,32,64,128,16,8,2,1536.1873333333333,3
w13,8,64,8,3584,2560,32,64,128,16,8,3,1531.3873333333333,3
w13,8,64,8,3584,2560,32,64,128,16,8,4,1533.3393333333333,3
w13,8,64,8,3584,2560,32,64,128,32,4,2,1531.7823333333333,3
w13,8,64,8,3584,2560,32,64,128,32,4,3,1532.4646666666667,3
w13,8,64,8,3584,2560,32,64,128,32,4,4,1534.3313333333333,3
w13,8,64,8,3584,2560,32,64,128,32,8,2,1532.742,3
w13,8,64,8,3584,2560,32,64,128,32,8,3,1531.9846666666665,3
w13,8,64,8,3584,2560,32,64,128,32,8,4,1533.4143333333334,3
w13,8,64,8,3584,2560,32,64,128,64,4,2,1535.099,3
w13,8,64,8,3584,2560,32,64,128,64,4,3,1532.7633333333333,3
w13,8,64,8,3584,2560,32,64,128,64,4,4,1535.0036666666667,3
w13,8,64,8,3584,2560,32,64,128,64,8,2,1535.089,3
w13,8,64,8,3584,2560,32,64,128,64,8,3,1533.7873333333334,3
w13,8,64,8,3584,2560,32,64,128,64,8,4,1534.6403333333335,3
w13,8,64,8,3584,2560,32,64,256,1,4,2,1529.5420000000001,3
w13,8,64,8,3584,2560,32,64,256,1,4,3,1530.8220000000001,3
w13,8,64,8,3584,2560,32,64,256,1,8,2,1531.8563333333332,3
w13,8,64,8,3584,2560,32,64,256,1,8,3,1531.0033333333333,3
w13,8,64,8,3584,2560,32,64,256,8,4,2,1530.5339999999999,3
w13,8,64,8,3584,2560,32,64,256,8,4,3,1531.4513333333332,3
w13,8,64,8,3584,2560,32,64,256,8,8,2,1530.3526666666667,3
w13,8,64,8,3584,2560,32,64,256,8,8,3,1530.8006666666668,3
w13,8,64,8,3584,2560,32,64,256,16,4,2,1530.662,3
w13,8,64,8,3584,2560,32,64,256,16,4,3,1532.6993333333332,3
w13,8,64,8,3584,2560,32,64,256,16,8,2,1530.182,3
w13,8,64,8,3584,2560,32,64,256,16,8,3,1531.131666666667,3
w13,8,64,8,3584,2560,32,64,256,32,4,2,1532.273,3
w13,8,64,8,3584,2560,32,64,256,32,4,3,1532.6673333333335,3
w13,8,64,8,3584,2560,32,64,256,32,8,2,1531.4513333333332,3
w13,8,64,8,3584,2560,32,64,256,32,8,3,1533.3393333333333,3
w13,8,64,8,3584,2560,32,64,256,64,4,2,1533.3286666666665,3
w13,8,64,8,3584,2560,32,64,256,64,4,3,1533.9046666666666,3
w13,8,64,8,3584,2560,32,64,256,64,8,2,1532.7953333333335,3
w13,8,64,8,3584,2560,32,64,256,64,8,3,1534.662,3
w13,8,64,8,3584,2560,32,128,128,1,4,2,1530.7686666666668,3
w13,8,64,8,3584,2560,32,128,128,1,4,3,1530.640666666667,3
w13,8,64,8,3584,2560,32,128,128,1,8,2,1530.0546666666667,3
w13,8,64,8,3584,2560,32,128,128,1,8,3,1529.9153333333334,3
w13,8,64,8,3584,2560,32,128,128,4,4,2,1532.6779999999999,3
w13,8,64,8,3584,2560,32,128,128,4,4,3,1530.8006666666668,3
w13,8,64,8,3584,2560,32,128,128,4,8,2,1531.6006666666665,3
w13,8,64,8,3584,2560,32,128,128,4,8,3,1530.4596666666666,3
w13,8,64,8,3584,2560,32,128,128,8,4,2,1532.732,3
w13,8,64,8,3584,2560,32,128,128,8,4,3,1530.8436666666666,3
w13,8,64,8,3584,2560,32,128,128,8,8,2,1531.6113333333333,3
w13,8,64,8,3584,2560,32,128,128,8,8,3,1530.7259999999999,3
w13,8,64,8,3584,2560,32,128,128,16,4,2,1533.8513333333333,3
w13,8,64,8,3584,2560,32,128,128,16,4,3,1531.6009999999999,3
w13,8,64,8,3584,2560,32,128,128,16,8,2,1533.5103333333334,3
w13,8,64,8,3584,2560,32,128,128,16,8,3,1531.0783333333336,3
w13,8,64,8,3584,2560,32,128,128,32,4,2,1532.4436666666668,3
w13,8,64,8,3584,2560,32,128,128,32,4,3,1532.3793333333333,3
w13,8,64,8,3584,2560,32,128,128,32,8,2,1532.2513333333334,3
w13,8,64,8,3584,2560,32,128,128,32,8,3,1531.1953333333333,3
w13,8,64,8,3584,2560,32,128,128,64,4,3,1534.5019999999997,3
w13,8,64,8,3584,2560,32,128,128,64,8,2,1536.4006666666667,3
w13,8,64,8,3584,2560,32,128,128,64,8,3,1534.6090000000002,3
w13,8,64,8,3584,2560,64,32,128,1,4,2,1531.3446666666666,3
w13,8,64,8,3584,2560,64,32,128,1,4,3,1533.4246666666668,3
w13,8,64,8,3584,2560,64,32,128,1,4,4,1534.5336666666665,3
w13,8,64,8,3584,2560,64,32,128,1,8,2,1530.438,3
w13,8,64,8,3584,2560,64,32,128,1,8,3,1534.246,3
w13,8,64,8,3584,2560,64,32,128,1,8,4,1533.2326666666668,3
w13,8,64,8,3584,2560,64,32,128,16,4,2,1532.6779999999999,3
w13,8,64,8,3584,2560,64,32,128,16,4,3,1534.939333333333,3
w13,8,64,8,3584,2560,64,32,128,16,8,2,1532.9553333333333,3
w13,8,64,8,3584,2560,64,32,128,16,8,3,1534.5553333333335,3
w13,8,64,8,3584,2560,64,32,256,1,4,2,1533.8943333333334,3
w13,8,64,8,3584,2560,64,32,256,1,4,3,1531.6970000000001,3
w13,8,64,8,3584,2560,64,32,256,1,8,2,1535.302,3
w13,8,64,8,3584,2560,64,32,256,1,8,3,1530.3310000000001,3
w13,8,64,8,3584,2560,64,64,128,1,4,3,1533.6593333333333,3
w13,8,64,8,3584,2560,64,64,128,1,4,4,1534.7153333333333,3
w13,8,64,8,3584,2560,64,64,128,1,8,2,1531.7823333333333,3
w13,8,64,8,3584,2560,64,64,128,1,8,3,1533.243333333333,3
w13,8,64,8,3584,2560,64,64,128,1,8,4,1535.4303333333335,3
w13,8,64,8,3584,2560,64,64,128,4,4,3,1534.0013333333334,3
w13,8,64,8,3584,2560,64,64,128,4,4,4,1536.2093333333332,3
w13,8,64,8,3584,2560,64,64,128,4,8,2,1534.6193333333333,3
w13,8,64,8,3584,2560,64,64,128,4,8,3,1534.2563333333335,3
w13,8,64,8,3584,2560,64,64,128,4,8,4,1535.3873333333333,3
w13,8,64,8,3584,2560,64,64,128,8,4,3,1532.9660000000001,3
w13,8,64,8,3584,2560,64,64,128,8,4,4,1534.4703333333334,3
w13,8,64,8,3584,2560,64,64,128,8,8,2,1533.9903333333332,3
w13,8,64,8,3584,2560,64,64,128,8,8,3,1534.1286666666667,3
w13,8,64,8,3584,2560,64,64,128,8,8,4,1533.777,3
w13,8,64,8,3584,2560,64,64,128,16,4,4,1534.6943333333331,3
w13,8,64,8,3584,2560,64,64,128,16,8,2,1535.889,3
w13,8,64,8,3584,2560,64,64,128,16,8,4,1534.7796666666666,3
w13,8,64,8,3584,2560,64,64,128,32,4,4,1535.2273333333333,3
w13,8,64,8,3584,2560,64,128,128,1,4,2,1531.9533333333331,3
w13,8,64,8,3584,2560,64,128,128,1,8,2,1532.8706666666667,3
w13,8,64,8,3584,2560,64,128,128,1,8,3,1530.9930000000002,3
w13,8,64,8,3584,2560,64,128,128,4,4,2,1532.9876666666667,3
w13,8,64,8,3584,2560,64,128,128,4,8,2,1533.457333333333,3
w13,8,64,8,3584,2560,64,128,128,4,8,3,1531.899666666667,3
w13,8,64,8,3584,2560,64,128,128,16,4,2,1536.0813333333333,3
w13,8,64,8,3584,2560,64,128,128,16,8,2,1536.369,3
w13,8,64,8,3584,2560,64,128,128,16,8,3,1533.0836666666667,3
w13,8,64,8,3584,2560,64,128,128,32,4,2,1535.793,3
w13,8,64,8,3584,2560,64,128,128,32,8,2,1534.3636666666669,3
w13,8,64,8,3584,2560,64,128,128,32,8,3,1532.9233333333332,3
w13,8,64,8,3584,2560,64,128,128,64,8,3,1536.2520000000002,3
w13,8,128,4,2048,512,16,64,64,1,4,3,23.394000000000002,3
w13,8,128,4,2048,512,16,64,64,1,8,4,23.394000000000002,3
w13,8,128,6,4096,2048,16,16,64,1,4,3,1050.8516666666667,3
w13,8,128,6,4096,2048,16,16,64,1,4,4,1049.9660000000001,3
w13,8,128,6,4096,2048,16,16,64,1,8,3,1050.6383333333333,3
w13,8,128,6,4096,2048,16,16,64,1,8,4,1050.7663333333333,3
w13,8,128,6,4096,2048,16,16,128,1,4,2,1048.441,3
w13,8,128,6,4096,2048,16,16,128,1,4,4,1050.67,3
w13,8,128,6,4096,2048,16,16,128,1,8,2,1049.3473333333334,3
w13,8,128,6,4096,2048,16,16,128,4,4,2,1049.3263333333332,3
w13,8,128,6,4096,2048,16,16,128,4,4,4,1050.0086666666666,3
w13,8,128,6,4096,2048,16,16,128,4,8,2,1049.7743333333335,3
w13,8,128,6,4096,2048,16,16,256,1,4,3,1050.03,3
w13,8,128,6,4096,2048,16,16,256,1,4,4,1050.5633333333333,3
w13,8,128,6,4096,2048,16,16,256,1,8,3,1051.9503333333334,3
w13,8,128,6,4096,2048,16,16,256,1,8,4,1051.566,3
w13,8,128,6,4096,2048,16,16,256,4,4,3,1049.422,3
w13,8,128,6,4096,2048,16,16,256,4,4,4,1049.6779999999999,3
w13,8,128,6,4096,2048,16,16,256,4,8,3,1050.969,3
w13,8,128,6,4096,2048,16,16,256,4,8,4,1051.9713333333332,3
w13,8,128,6,4096,2048,16,32,64,1,4,3,1049.1983333333335,3
w13,8,128,6,4096,2048,16,32,64,1,4,4,1050.9579999999999,3
w13,8,128,6,4096,2048,16,32,64,1,8,2,1051.6086666666667,3
w13,8,128,6,4096,2048,16,32,64,1,8,3,1049.4436666666668,3
w13,8,128,6,4096,2048,16,32,64,1,8,4,1049.8486666666668,3
w13,8,128,6,4096,2048,16,32,64,16,4,3,1052.8566666666666,3
w13,8,128,6,4096,2048,16,32,64,16,8,3,1051.246,3
w13,8,128,6,4096,2048,16,32,64,32,4,3,1051.0543333333333,3
w13,8,128,6,4096,2048,16,32,64,32,4,4,1051.2033333333334,3
w13,8,128,6,4096,2048,16,32,64,32,8,3,1050.478,3
w13,8,128,6,4096,2048,16,32,64,32,8,4,1052.1633333333332,3
w13,8,128,6,4096,2048,16,32,64,64,4,3,1053.2623333333333,3
w13,8,128,6,4096,2048,16,32,64,64,4,4,1052.3446666666666,3
w13,8,128,6,4096,2048,16,32,64,64,8,3,1051.0753333333332,3
w13,8,128,6,4096,2048,16,32,64,64,8,4,1052.9633333333334,3
w13,8,128,6,4096,2048,16,32,128,1,4,2,1048.3983333333333,3
w13,8,128,6,4096,2048,16,32,128,1,4,3,1049.454,3
w13,8,128,6,4096,2048,16,32,128,1,4,4,1049.081,3
w13,8,128,6,4096,2048,16,32,128,1,8,2,1048.558,3
w13,8,128,6,4096,2048,16,32,128,1,8,4,1050.51,3
w13,8,128,6,4096,2048,16,32,128,4,4,2,1049.1663333333333,3
w13,8,128,6,4096,2048,16,32,128,4,4,3,1049.5396666666666,3
w13,8,128,6,4096,2048,16,32,128,4,4,4,1049.2623333333333,3
w13,8,128,6,4096,2048,16,32,128,4,8,2,1049.3153333333332,3
w13,8,128,6,4096,2048,16,32,128,4,8,4,1050.713,3
w13,8,128,6,4096,2048,16,32,128,16,4,2,1049.881,3
w13,8,128,6,4096,2048,16,32,128,16,4,3,1051.577,3
w13,8,128,6,4096,2048,16,32,128,16,4,4,1050.7766666666666,3
w13,8,128,6,4096,2048,16,32,128,16,8,2,1049.7526666666665,3
w13,8,128,6,4096,2048,16,32,128,16,8,4,1051.918,3
w13,8,128,6,4096,2048,16,32,128,32,4,2,1049.326,3
w13,8,128,6,4096,2048,16,32,128,32,4,4,1051.3419999999999,3
w13,8,128,6,4096,2048,16,32,128,32,8,2,1050.3286666666665,3
w13,8,128,6,4096,2048,16,32,128,64,4,2,1049.945,3
w13,8,128,6,4096,2048,16,32,128,64,4,4,1051.0003333333334,3
w13,8,128,6,4096,2048,16,32,128,64,8,2,1049.3156666666666,3
w13,8,128,6,4096,2048,16,32,256,1,4,2,1052.9426666666666,3
w13,8,128,6,4096,2048,16,32,256,1,4,3,1049.134,3
w13,8,128,6,4096,2048,16,32,256,1,4,4,1050.201,3
w13,8,128,6,4096,2048,16,32,256,1,8,3,1050.7340000000002,3
w13,8,128,6,4096,2048,16,32,256,1,8,4,1051.2996666666666,3
w13,8,128,6,4096,2048,16,32,256,16,4,2,1052.6326666666666,3
w13,8,128,6,4096,2048,16,32,256,16,4,3,1052.2273333333335,3
w13,8,128,6,4096,2048,16,32,256,16,4,4,1050.9156666666668,3
w13,8,128,6,4096,2048,16,32,256,16,8,4,1051.1716666666666,3
w13,8,128,6,4096,2048,16,32,256,32,4,3,1053.2833333333333,3
w13,8,128,6,4096,2048,16,32,256,32,4,4,1051.0006666666666,3
w13,8,128,6,4096,2048,16,32,256,32,8,4,1052.0993333333333,3
w13,8,128,6,4096,2048,16,32,256,64,4,4,1051.9393333333335,3
w13,8,128,6,4096,2048,16,32,256,64,8,4,1053.0166666666667,3
w13,8,128,6,4096,2048,16,64,64,1,4,2,1052.5156666666664,3
w13,8,128,6,4096,2048,16,64,64,1,4,4,1049.678,3
w13,8,128,6,4096,2048,16,64,64,1,8,2,1052.526,3
w13,8,128,6,4096,2048,16,64,64,1,8,3,1052.8353333333334,3
w13,8,128,6,4096,2048,16,64,64,1,8,4,1049.2623333333333,3
w13,8,128,6,4096,2048,16,64,64,32,4,4,1050.7340000000002,3
w13,8,128,6,4096,2048,16,64,64,32,8,4,1052.91,3
w13,8,128,6,4096,2048,16,64,64,64,4,4,1052.6113333333333,3
w13,8,128,6,4096,2048,16,64,64,64,8,4,1052.8036666666667,3
w13,8,128,6,4096,2048,16,64,128,1,4,3,1051.0753333333334,3
w13,8,128,6,4096,2048,16,64,128,1,4,4,1049.5393333333334,3
w13,8,128,6,4096,2048,16,64,128,1,8,3,1051.3419999999999,3
w13,8,128,6,4096,2048,16,64,128,1,8,4,1049.39,3
w13,8,128,6,4096,2048,16,64,128,16,4,4,1052.4833333333333,3
w13,8,128,6,4096,2048,16,64,128,16,8,4,1050.9476666666667,3
w13,8,128,6,4096,2048,16,64,128,32,4,4,1052.3236666666667,3
w13,8,128,6,4096,2048,16,64,128,32,8,4,1052.153,3
w13,8,128,6,4096,2048,16,64,128,64,4,2,1052.793,3
w13,8,128,6,4096,2048,16,64,128,64,4,4,1051.79,3
w13,8,128,6,4096,2048,16,64,128,64,8,4,1051.9073333333333,3
w13,8,128,6,4096,2048,16,64,256,1,4,3,1052.1633333333332,3
w13,8,128,6,4096,2048,16,64,256,1,8,3,1051.9073333333333,3
w13,8,128,6,4096,2048,16,64,256,16,4,3,1053.2406666666666,3
w13,8,128,6,4096,2048,16,128,64,1,4,2,1050.5743333333332,3
w13,8,128,6,4096,2048,16,128,64,1,8,2,1051.2566666666667,3
w13,8,128,6,4096,2048,16,128,64,1,8,3,1050.8946666666668,3
w13,8,128,6,4096,2048,16,128,64,32,8,3,1052.5256666666667,3
w13,8,128,6,4096,2048,32,16,128,4,4,2,1050.3183333333334,3
w13,8,128,6,4096,2048,32,16,128,4,4,3,1049.8059999999998,3
w13,8,128,6,4096,2048,32,16,128,4,4,4,1049.646,3
w13,8,128,6,4096,2048,32,16,128,4,8,2,1049.998,3
w13,8,128,6,4096,2048,32,16,128,4,8,4,1051.4276666666667,3
w13,8,128,6,4096,2048,32,32,64,1,4,3,1049.8916666666667,3
w13,8,128,6,4096,2048,32,32,64,1,8,2,1051.7576666666666,3
w13,8,128,6,4096,2048,32,32,64,1,8,3,1048.7393333333332,3
w13,8,128,6,4096,2048,32,32,64,32,4,3,1051.1076666666665,3
w13,8,128,6,4096,2048,32,32,64,32,8,3,1050.2540000000001,3
w13,8,128,6,4096,2048,32,32,64,64,4,3,1051.854,3
w13,8,128,6,4096,2048,32,32,64,64,8,3,1050.5420000000001,3
w13,8,128,6,4096,2048,32,32,64,128,4,3,1050.9793333333334,3
w13,8,128,6,4096,2048,32,32,64,128,8,3,1050.5529999999999,3
w13,8,128,6,4096,2048,32,32,128,1,4,2,1048.142,3
w13,8,128,6,4096,2048,32,32,128,1,4,3,1050.99,3
w13,8,128,6,4096,2048,32,32,128,1,4,4,1051.0003333333334,3
w13,8,128,6,4096,2048,32,32,128,1,8,2,1048.7183333333332,3
w13,8,128,6,4096,2048,32,32,128,1,8,4,1050.201,3
w13,8,128,6,4096,2048,32,32,128,4,4,2,1049.1983333333333,3
w13,8,128,6,4096,2048,32,32,128,4,4,3,1050.2116666666668,3
w13,8,128,6,4096,2048,32,32,128,4,4,4,1049.806,3
w13,8,128,6,4096,2048,32,32,128,4,8,2,1049.07,3
w13,8,128,6,4096,2048,32,32,128,4,8,3,1049.9553333333333,3
w13,8,128,6,4096,2048,32,32,128,4,8,4,1051.8433333333332,3
w13,8,128,6,4096,2048,32,32,128,16,4,2,1048.7926666666665,3
w13,8,128,6,4096,2048,32,32,128,16,4,3,1049.8593333333333,3
w13,8,128,6,4096,2048,32,32,128,16,4,4,1052.142,3
w13,8,128,6,4096,2048,32,32,128,16,8,2,1049.39,3
w13,8,128,6,4096,2048,32,32,128,16,8,3,1051.5233333333333,3
w13,8,128,6,4096,2048,32,32,128,16,8,4,1053.1236666666666,3
w13,8,128,6,4096,2048,32,32,128,64,4,2,1049.4006666666667,3
w13,8,128,6,4096,2048,32,32,128,64,4,3,1050.4036666666668,3
w13,8,128,6,4096,2048,32,32,128,64,4,4,1052.7606666666668,3
w13,8,128,6,4096,2048,32,32,128,64,8,2,1050.521,3
w13,8,128,6,4096,2048,32,32,128,64,8,3,1050.3606666666667,3
w13,8,128,6,4096,2048,32,32,256,1,4,2,1051.6623333333334,3
w13,8,128,6,4096,2048,32,32,256,1,4,3,1049.4003333333333,3
w13,8,128,6,4096,2048,32,32,256,1,4,4,1050.585,3
w13,8,128,6,4096,2048,32,32,256,1,8,2,1051.022,3
w13,8,128,6,4096,2048,32,32,256,1,8,3,1049.5396666666668,3
w13,8,128,6,4096,2048,32,32,256,1,8,4,1050.4246666666668,3
w13,8,128,6,4096,2048,32,32,256,4,4,2,1049.6563333333334,3
w13,8,128,6,4096,2048,32,32,256,4,4,3,1049.9343333333334,3
w13,8,128,6,4096,2048,32,32,256,4,4,4,1050.009,3
w13,8,128,6,4096,2048,32,32,256,4,8,2,1051.9393333333335,3
w13,8,128,6,4096,2048,32,32,256,4,8,3,1049.6463333333334,3
w13,8,128,6,4096,2048,32,32,256,4,8,4,1050.5633333333333,3
w13,8,128,6,4096,2048,32,32,256,16,4,2,1050.7766666666666,3
w13,8,128,6,4096,2048,32,32,256,16,4,3,1050.4033333333334,3
w13,8,128,6,4096,2048,32,32,256,16,4,4,1051.043,3
w13,8,128,6,4096,2048,32,32,256,16,8,2,1049.8806666666667,3
w13,8,128,6,4096,2048,32,32,256,16,8,3,1050.8300000000002,3
w13,8,128,6,4096,2048,32,32,256,16,8,4,1051.3636666666666,3
w13,8,128,6,4096,2048,32,32,256,32,4,2,1050.2543333333333,3
w13,8,128,6,4096,2048,32,32,256,32,4,3,1050.7763333333335,3
w13,8,128,6,4096,2048,32,32,256,32,4,4,1051.4276666666667,3
w13,8,128,6,4096,2048,32,32,256,32,8,2,1049.6886666666667,3
w13,8,128,6,4096,2048,32,32,256,32,8,3,1051.0436666666667,3
w13,8,128,6,4096,2048,32,32,256,32,8,4,1052.121,3
w13,8,128,6,4096,2048,32,64,64,1,4,4,1052.067,3
w13,8,128,6,4096,2048,32,64,64,1,8,2,1052.8033333333333,3
w13,8,128,6,4096,2048,32,64,64,1,8,4,1052.8566666666666,3
w13,8,128,6,4096,2048,32,64,128,1,4,3,1053.2830000000001,3
w13,8,128,6,4096,2048,32,64,128,1,4,4,1049.9126666666668,3
w13,8,128,6,4096,2048,32,64,128,1,8,3,1052.857,3
w13,8,128,6,4096,2048,32,64,128,1,8,4,1049.7203333333334,3
w13,8,128,6,4096,2048,32,64,128,4,4,4,1050.381666666667,3
w13,8,128,6,4096,2048,32,64,128,4,8,4,1051.8756666666666,3
w13,8,128,6,4096,2048,32,64,128,16,4,4,1052.622,3
w13,8,128,6,4096,2048,32,64,128,16,8,4,1051.4596666666666,3
w13,8,128,6,4096,2048,32,64,128,32,8,4,1052.7716666666668,3
w13,8,128,6,4096,2048,32,64,128,64,4,4,1051.918,3
w13,8,128,6,4096,2048,32,64,128,64,8,4,1052.867,3
w13,8,128,6,4096,2048,32,64,256,1,4,3,1051.8006666666668,3
w13,8,128,6,4096,2048,32,64,256,1,8,3,1051.4063333333334,3
w13,8,128,6,4096,2048,32,128,64,1,8,2,1051.4063333333334,3
w13,8,128,6,4096,2048,64,16,128,1,4,3,1052.5796666666665,3
w13,8,128,6,4096,2048,64,16,128,1,8,3,1052.2383333333335,3
w13,8,128,6,4096,2048,64,32,128,1,4,3,1051.7366666666667,3
w13,8,128,6,4096,2048,64,32,128,1,8,3,1052.3556666666666,3
w13,8,128,6,4096,2048,64,32,128,1,8,4,1052.91,3
w13,8,128,6,4096,2048,64,32,128,16,4,3,1052.057,3
w13,8,128,6,4096,2048,64,32,128,16,8,3,1052.2593333333332,3
w13,8,128,6,4096,2048,64,32,256,1,4,2,1052.9846666666665,3
w13,8,128,6,4096,2048,64,32,256,1,4,3,1051.854,3
w13,8,128,6,4096,2048,64,32,256,1,8,3,1050.67,3
w13,8,128,6,4096,2048,64,64,64,1,8,3,1052.0033333333333,3
w13,8,128,6,4096,2048,64,64,128,1,4,2,1052.014,3
w13,8,128,6,4096,2048,64,64,128,1,4,3,1051.1286666666667,3
w13,8,128,6,4096,2048,64,64,128,1,8,3,1051.5766666666666,3
w13,8,128,6,4096,2048,64,64,128,4,4,2,1052.5259999999998,3
w13,8,128,6,4096,2048,64,64,128,4,4,3,1052.057,3
w13,8,128,6,4096,2048,64,64,128,4,4,4,1053.1983333333335,3
w13,8,128,6,4096,2048,64,64,128,4,8,3,1051.3423333333333,3
w13,8,128,6,4096,2048,64,64,128,8,4,2,1052.5686666666668,3
w13,8,128,6,4096,2048,64,64,128,8,4,3,1051.214,3
w13,8,128,6,4096,2048,64,64,128,8,8,3,1051.172,3
w13,8,128,6,4096,2048,64,64,128,16,4,3,1051.6943333333331,3
w13,8,128,6,4096,2048,64,64,128,16,8,3,1051.9073333333333,3
w13,8,128,6,4096,2048,64,64,128,32,4,2,1053.262,3
w13,8,128,6,4096,2048,64,64,128,32,4,3,1050.6703333333332,3
w13,8,128,6,4096,2048,64,64,128,32,8,3,1051.8220000000001,3
w13,8,128,6,4096,2048,64,64,128,64,4,3,1052.782,3
w13,8,128,6,4096,2048,64,64,128,64,8,3,1051.9073333333333,3
w13,8,128,8,2048,768,16,32,128,1,4,2,260.71700000000004,3
w13,8,128,8,2048,768,32,32,128,1,4,2,259.9916666666667,3
w13,8,128,8,2048,768,32,32,256,1,4,2,260.557,3
w13,8,128,8,2048,768,64,64,128,1,4,2,260.205,3
w13,8,128,8,4096,1536,16,16,64,1,4,3,1050.2753333333333,3
w13,8,128,8,4096,1536,16,16,64,1,4,4,1050.606,3
w13,8,128,8,4096,1536,16,16,64,1,8,3,1050.787,3
w13,8,128,8,4096,1536,16,16,64,1,8,4,1050.7656666666664,3
w13,8,128,8,4096,1536,16,16,128,1,4,2,1048.7606666666668,3
w13,8,128,8,4096,1536,16,16,128,1,4,4,1050.1793333333333,3
w13,8,128,8,4096,1536,16,16,128,1,8,2,1049.9763333333333,3
w13,8,128,8,4096,1536,16,16,128,4,4,2,1048.6966666666667,3
w13,8,128,8,4096,1536,16,16,128,4,4,4,1053.1553333333334,3
w13,8,128,8,4096,1536,16,16,128,4,8,2,1051.1603333333333,3
w13,8,128,8,4096,1536,16,16,256,1,4,3,1050.7123333333332,3
w13,8,128,8,4096,1536,16,16,256,1,4,4,1050.2643333333333,3
w13,8,128,8,4096,1536,16,16,256,1,8,2,1052.5683333333334,3
w13,8,128,8,4096,1536,16,16,256,1,8,3,1051.2669999999998,3
w13,8,128,8,4096,1536,16,16,256,1,8,4,1052.2163333333333,3
w13,8,128,8,4096,1536,16,16,256,4,4,3,1049.6776666666667,3
w13,8,128,8,4096,1536,16,16,256,4,4,4,1049.9656666666667,3
w13,8,128,8,4096,1536,16,16,256,4,8,3,1051.2136666666668,3
w13,8,128,8,4096,1536,16,16,256,4,8,4,1051.7259999999999,3
w13,8,128,8,4096,1536,16,32,64,1,4,2,1052.5686666666668,3
w13,8,128,8,4096,1536,16,32,64,1,4,3,1048.8563333333334,3
w13,8,128,8,4096,1536,16,32,64,1,4,4,1051.267,3
w13,8,128,8,4096,1536,16,32,64,1,8,2,1051.9603333333334,3
w13,8,128,8,4096,1536,16,32,64,1,8,3,1050.094,3
w13,8,128,8,4096,1536,16,32,64,1,8,4,1049.8593333333333,3
w13,8,128,8,4096,1536,16,32,128,1,4,2,1048.131,3
w13,8,128,8,4096,1536,16,32,128,1,4,3,1049.7313333333334,3
w13,8,128,8,4096,1536,16,32,128,1,4,4,1049.2833333333335,3
w13,8,128,8,4096,1536,16,32,128,1,8,2,1048.7496666666666,3
w13,8,128,8,4096,1536,16,32,128,1,8,4,1050.3283333333334,3
w13,8,128,8,4096,1536,16,32,128,4,4,2,1052.3126666666667,3
w13,8,128,8,4096,1536,16,32,128,4,4,3,1049.4853333333333,3
w13,8,128,8,4096,1536,16,32,128,4,4,4,1053.1760000000002,3
w13,8,128,8,4096,1536,16,32,128,4,8,2,1049.7520000000002,3
w13,8,128,8,4096,1536,16,32,128,4,8,4,1053.315,3
w13,8,128,8,4096,1536,16,32,256,1,4,2,1050.4783333333332,3
w13,8,128,8,4096,1536,16,32,256,1,4,3,1049.2293333333334,3
w13,8,128,8,4096,1536,16,32,256,1,4,4,1050.009,3
w13,8,128,8,4096,1536,16,32,256,1,8,3,1049.9766666666667,3
w13,8,128,8,4096,1536,16,32,256,1,8,4,1050.9046666666666,3
w13,8,128,8,4096,1536,16,64,64,1,4,4,1048.5896666666667,3
w13,8,128,8,4096,1536,16,64,64,1,8,2,1051.4806666666666,3
w13,8,128,8,4096,1536,16,64,64,1,8,3,1051.9713333333332,3
w13,8,128,8,4096,1536,16,64,64,1,8,4,1049.07,3
w13,8,128,8,4096,1536,16,64,128,1,4,3,1051.7683333333334,3
w13,8,128,8,4096,1536,16,64,128,1,4,4,1049.55,3
w13,8,128,8,4096,1536,16,64,128,1,8,3,1052.451,3
w13,8,128,8,4096,1536,16,64,128,1,8,4,1049.4966666666667,3
w13,8,128,8,4096,1536,16,64,256,1,4,2,1052.6213333333333,3
w13,8,128,8,4096,1536,16,64,256,1,4,3,1051.3843333333334,3
w13,8,128,8,4096,1536,16,64,256,1,8,3,1051.1823333333334,3
w13,8,128,8,4096,1536,16,128,64,1,4,2,1050.403,3
w13,8,128,8,4096,1536,16,128,64,1,8,2,1050.5313333333334,3
w13,8,128,8,4096,1536,16,128,64,1,8,3,1051.9283333333333,3
w13,8,128,8,4096,1536,16,128,64,16,4,2,1052.547,3
w13,8,128,8,4096,1536,16,128,64,16,4,3,1052.5469999999998,3
w13,8,128,8,4096,1536,16,128,64,16,8,3,1050.6803333333335,3
w13,8,128,8,4096,1536,16,128,64,32,8,2,1052.451,3
w13,8,128,8,4096,1536,32,16,128,4,4,4,1049.8056666666666,3
w13,8,128,8,4096,1536,32,16,128,4,8,2,1051.2356666666667,3
w13,8,128,8,4096,1536,32,16,128,4,8,4,1052.8136666666667,3
w13,8,128,8,4096,1536,32,32,64,1,4,2,1053.0586666666668,3
w13,8,128,8,4096,1536,32,32,64,1,4,3,1049.5073333333332,3
w13,8,128,8,4096,1536,32,32,64,1,8,2,1052.2163333333335,3
w13,8,128,8,4096,1536,32,32,64,1,8,3,1049.7096666666666,3
w13,8,128,8,4096,1536,32,32,128,1,4,2,1048.1736666666668,3
w13,8,128,8,4096,1536,32,32,128,1,4,3,1050.211,3
w13,8,128,8,4096,1536,32,32,128,1,4,4,1050.3816666666667,3
w13,8,128,8,4096,1536,32,32,128,1,8,2,1048.878,3
w13,8,128,8,4096,1536,32,32,128,1,8,4,1051.235,3
w13,8,128,8,4096,1536,32,32,128,4,4,2,1048.707,3
w13,8,128,8,4096,1536,32,32,128,4,4,3,1052.1843333333334,3
w13,8,128,8,4096,1536,32,32,128,4,8,2,1049.9016666666666,3
w13,8,128,8,4096,1536,32,32,128,4,8,3,1052.8883333333333,3
w13,8,128,8,4096,1536,32,32,256,1,4,2,1048.5686666666668,3
w13,8,128,8,4096,1536,32,32,256,1,4,3,1050.1580000000001,3
w13,8,128,8,4096,1536,32,32,256,1,4,4,1050.179,3
w13,8,128,8,4096,1536,32,32,256,1,8,2,1050.6696666666667,3
w13,8,128,8,4096,1536,32,32,256,1,8,3,1049.87,3
w13,8,128,8,4096,1536,32,32,256,1,8,4,1051.7153333333333,3
w13,8,128,8,4096,1536,32,32,256,4,4,2,1051.2563333333335,3
w13,8,128,8,4096,1536,32,32,256,4,4,3,1050.0086666666666,3
w13,8,128,8,4096,1536,32,32,256,4,4,4,1050.6163333333334,3
w13,8,128,8,4096,1536,32,32,256,4,8,2,1050.883,3
w13,8,128,8,4096,1536,32,32,256,4,8,3,1049.8909999999998,3
w13,8,128,8,4096,1536,32,32,256,4,8,4,1051.214,3
w13,8,128,8,4096,1536,32,32,256,32,4,3,1053.0486666666666,3
w13,8,128,8,4096,1536,32,32,256,32,8,3,1052.5473333333332,3
w13,8,128,8,4096,1536,32,64,64,1,4,4,1053.3363333333334,3
w13,8,128,8,4096,1536,32,64,64,1,8,2,1051.907,3
w13,8,128,8,4096,1536,32,64,128,1,4,4,1049.731,3
w13,8,128,8,4096,1536,32,64,128,1,8,3,1052.7496666666666,3
w13,8,128,8,4096,1536,32,64,128,1,8,4,1051.427,3
w13,8,128,8,4096,1536,32,64,128,4,8,3,1052.4083333333335,3
w13,8,128,8,4096,1536,32,64,256,1,4,3,1053.2083333333333,3
w13,8,128,8,4096,1536,32,64,256,1,8,3,1053.2833333333335,3
w13,8,128,8,4096,1536,32,128,64,1,8,2,1052.7066666666667,3
w13,8,128,8,4096,1536,64,16,128,1,4,3,1053.3576666666668,3
w13,8,128,8,4096,1536,64,16,128,1,8,3,1052.9953333333333,3
w13,8,128,8,4096,1536,64,32,128,1,4,3,1051.427,3
w13,8,128,8,4096,1536,64,32,128,1,8,3,1053.1126666666667,3
w13,8,128,8,4096,1536,64,32,128,1,8,4,1053.3573333333334,3
w13,8,128,8,4096,1536,64,32,256,1,4,2,1052.2803333333334,3
w13,8,128,8,4096,1536,64,32,256,1,4,3,1052.7816666666668,3
w13,8,128,8,4096,1536,64,32,256,1,8,3,1051.9073333333333,3
w13,8,128,8,4096,1536,64,64,64,1,8,3,1051.5443333333333,3
w13,8,128,8,4096,1536,64,64,128,1,4,2,1050.819,3
w13,8,128,8,4096,1536,64,64,128,1,4,3,1051.1283333333333,3
w13,8,128,8,4096,1536,64,64,128,1,4,4,1053.2406666666666,3
w13,8,128,8,4096,1536,64,64,128,1,8,3,1050.6486666666667,3
w13,8,128,8,4096,1536,64,128,64,1,4,2,1053.1656666666668,3
w13,8,128,8,4096,3072,16,16,64,1,4,3,2094.863,3
w13,8,128,8,4096,3072,16,16,64,1,4,4,2098.7136666666665,3
w13,8,128,8,4096,3072,16,16,64,1,8,2,2103.460333333333,3
w13,8,128,8,4096,3072,16,16,64,1,8,3,2095.866,3
w13,8,128,8,4096,3072,16,16,64,1,8,4,2098.489666666667,3
w13,8,128,8,4096,3072,16,16,128,1,4,2,2100.1536666666666,3
w13,8,128,8,4096,3072,16,16,128,1,4,3,2098.255333333333,3
w13,8,128,8,4096,3072,16,16,128,1,4,4,2096.9643333333333,3
w13,8,128,8,4096,3072,16,16,128,1,8,2,2095.204333333333,3
w13,8,128,8,4096,3072,16,16,128,1,8,4,2099.4816666666666,3
w13,8,128,8,4096,3072,16,16,128,4,4,2,2098.4153333333334,3
w13,8,128,8,4096,3072,16,16,128,4,4,3,2098.735,3
w13,8,128,8,4096,3072,16,16,128,4,4,4,2096.058,3
w13,8,128,8,4096,3072,16,16,128,4,8,2,2096.303,3
w13,8,128,8,4096,3072,16,16,128,4,8,4,2099.7803333333336,3
w13,8,128,8,4096,3072,16,16,256,1,4,2,2098.521666666667,3
w13,8,128,8,4096,3072,16,16,256,1,4,3,2097.4976666666666,3
w13,8,128,8,4096,3072,16,16,256,1,4,4,2096.0043333333333,3
w13,8,128,8,4096,3072,16,16,256,1,8,2,2100.2926666666667,3
w13,8,128,8,4096,3072,16,16,256,1,8,3,2097.178,3
w13,8,128,8,4096,3072,16,16,256,1,8,4,2098.778,3
w13,8,128,8,4096,3072,16,16,256,4,4,2,2097.711,3
w13,8,128,8,4096,3072,16,16,256,4,4,3,2095.3216666666667,3
w13,8,128,8,4096,3072,16,16,256,4,4,4,2096.6126666666664,3
w13,8,128,8,4096,3072,16,16,256,4,8,2,2098.7143333333333,3
w13,8,128,8,4096,3072,16,16,256,4,8,3,2096.9756666666667,3
w13,8,128,8,4096,3072,16,16,256,4,8,4,2098.3520000000003,3
w13,8,128,8,4096,3072,16,32,64,1,4,2,2098.213,3
w13,8,128,8,4096,3072,16,32,64,1,4,3,2094.789,3
w13,8,128,8,4096,3072,16,32,64,1,4,4,2101.775666666667,3
w13,8,128,8,4096,3072,16,32,64,1,8,2,2096.592,3
w13,8,128,8,4096,3072,16,32,64,1,8,3,2096.4533333333334,3
w13,8,128,8,4096,3072,16,32,64,1,8,4,2095.9303333333332,3
w13,8,128,8,4096,3072,16,32,128,1,4,2,2093.3173333333334,3
w13,8,128,8,4096,3072,16,32,128,1,4,3,2095.109,3
w13,8,128,8,4096,3072,16,32,128,1,4,4,2095.76,3
w13,8,128,8,4096,3072,16,32,128,1,8,2,2102.8103333333333,3
w13,8,128,8,4096,3072,16,32,128,1,8,3,2096.271666666667,3
w13,8,128,8,4096,3072,16,32,128,1,8,4,2096.997,3
w13,8,128,8,4096,3072,16,32,128,4,4,2,2094.4480000000003,3
w13,8,128,8,4096,3072,16,32,128,4,4,3,2095.962666666667,3
w13,8,128,8,4096,3072,16,32,128,4,4,4,2096.624,3
w13,8,128,8,4096,3072,16,32,128,4,8,3,2097.5513333333333,3
w13,8,128,8,4096,3072,16,32,128,4,8,4,2096.634666666667,3
w13,8,128,8,4096,3072,16,32,128,16,4,3,2101.637,3
w13,8,128,8,4096,3072,16,32,128,16,4,4,2100.0266666666666,3
w13,8,128,8,4096,3072,16,32,128,16,8,3,2103.7276666666667,3
w13,8,128,8,4096,3072,16,32,128,16,8,4,2101.1786666666667,3
w13,8,128,8,4096,3072,16,32,128,32,4,3,2103.632,3
w13,8,128,8,4096,3072,16,32,256,1,4,2,2094.2343333333333,3
w13,8,128,8,4096,3072,16,32,256,1,4,3,2097.6266666666666,3
w13,8,128,8,4096,3072,16,32,256,1,4,4,2095.6743333333334,3
w13,8,128,8,4096,3072,16,32,256,1,8,2,2101.9783333333335,3
w13,8,128,8,4096,3072,16,32,256,1,8,3,2097.967666666667,3
w13,8,128,8,4096,3072,16,32,256,1,8,4,2097.5626666666667,3
w13,8,128,8,4096,3072,16,32,256,16,4,2,2103.237333333333,3
w13,8,128,8,4096,3072,16,32,256,16,8,3,2102.2236666666668,3
w13,8,128,8,4096,3072,16,64,64,1,4,3,2097.9463333333333,3
w13,8,128,8,4096,3072,16,64,64,1,4,4,2095.418333333333,3
w13,8,128,8,4096,3072,16,64,64,1,8,2,2097.1676666666667,3
w13,8,128,8,4096,3072,16,64,64,1,8,4,2096.9223333333334,3
w13,8,128,8,4096,3072,16,64,128,1,4,2,2100.0480000000002,3
w13,8,128,8,4096,3072,16,64,128,1,4,3,2098.757,3
w13,8,128,8,4096,3072,16,64,128,1,4,4,2095.663666666667,3
w13,8,128,8,4096,3072,16,64,128,1,8,2,2099.546333333333,3
w13,8,128,8,4096,3072,16,64,128,1,8,3,2097.626333333333,3
w13,8,128,8,4096,3072,16,64,128,1,8,4,2096.293,3
w13,8,128,8,4096,3072,16,64,256,1,4,2,2098.341,3
w13,8,128,8,4096,3072,16,64,256,1,4,3,2097.253,3
w13,8,128,8,4096,3072,16,64,256,1,8,3,2097.242333333333,3
w13,8,128,8,4096,3072,16,128,64,1,4,2,2095.802333333333,3
w13,8,128,8,4096,3072,16,128,64,1,4,4,2102.757,3
w13,8,128,8,4096,3072,16,128,64,1,8,2,2096.9223333333334,3
w13,8,128,8,4096,3072,16,128,64,1,8,4,2103.1730000000002,3
w13,8,128,8,4096,3072,16,128,64,16,4,2,2098.1703333333335,3
w13,8,128,8,4096,3072,16,128,64,16,8,2,2099.013,3
w13,8,128,8,4096,3072,16,128,64,32,4,2,2102.4686666666666,3
w13,8,128,8,4096,3072,16,128,64,32,8,2,2101.765,3
w13,8,128,8,4096,3072,16,128,64,32,8,4,2103.226666666667,3
w13,8,128,8,4096,3072,16,128,128,1,8,3,2103.504,3
w13,8,128,8,4096,3072,16,256,64,1,8,2,2099.748666666667,3
w13,8,128,8,4096,3072,16,256,64,16,4,2,2102.9493333333335,3
w13,8,128,8,4096,3072,16,256,64,16,8,2,2100.1653333333334,3
w13,8,128,8,4096,3072,32,16,128,4,4,3,2095.1200000000003,3
w13,8,128,8,4096,3072,32,16,128,4,4,4,2097.690666666667,3
w13,8,128,8,4096,3072,32,16,128,4,8,2,2095.8986666666665,3
w13,8,128,8,4096,3072,32,16,128,4,8,3,2097.3276666666666,3
w13,8,128,8,4096,3072,32,16,128,4,8,4,2099.248,3
w13,8,128,8,4096,3072,32,32,64,1,4,2,2097.5513333333333,3
w13,8,128,8,4096,3072,32,32,64,1,4,3,2100.7090000000003,3
w13,8,128,8,4096,3072,32,32,64,1,4,4,2096.517333333333,3
w13,8,128,8,4096,3072,32,32,64,1,8,2,2095.1730000000002,3
w13,8,128,8,4096,3072,32,32,64,1,8,4,2095.866666666667,3
w13,8,128,8,4096,3072,32,32,64,32,8,3,2103.642333333333,3
w13,8,128,8,4096,3072,32,32,128,1,4,2,2099.8023333333335,3
w13,8,128,8,4096,3072,32,32,128,1,4,3,2095.333,3
w13,8,128,8,4096,3072,32,32,128,1,4,4,2095.5679999999998,3
w13,8,128,8,4096,3072,32,32,128,1,8,3,2096.282333333333,3
w13,8,128,8,4096,3072,32,32,128,1,8,4,2096.6986666666667,3
w13,8,128,8,4096,3072,32,32,128,4,4,2,2100.346,3
w13,8,128,8,4096,3072,32,32,128,4,4,3,2095.525333333333,3
w13,8,128,8,4096,3072,32,32,128,4,4,4,2096.9863333333337,3
w13,8,128,8,4096,3072,32,32,128,4,8,3,2096.293,3
w13,8,128,8,4096,3072,32,32,128,4,8,4,2097.6053333333334,3
w13,8,128,8,4096,3072,32,32,128,16,4,4,2100.005,3
w13,8,128,8,4096,3072,32,32,128,16,8,4,2101.2746666666667,3
w13,8,128,8,4096,3072,32,32,256,1,4,2,2095.6316666666667,3
w13,8,128,8,4096,3072,32,32,256,1,4,3,2095.7916666666665,3
w13,8,128,8,4096,3072,32,32,256,1,4,4,2095.652666666667,3
w13,8,128,8,4096,3072,32,32,256,1,8,2,2095.119666666667,3
w13,8,128,8,4096,3072,32,32,256,1,8,3,2098.2450000000003,3
w13,8,128,8,4096,3072,32,32,256,1,8,4,2096.3783333333336,3
w13,8,128,8,4096,3072,32,32,256,4,4,2,2095.3333333333335,3
w13,8,128,8,4096,3072,32,32,256,4,4,3,2095.6743333333334,3
w13,8,128,8,4096,3072,32,32,256,4,4,4,2095.5893333333333,3
w13,8,128,8,4096,3072,32,32,256,4,8,2,2096.9436666666666,3
w13,8,128,8,4096,3072,32,32,256,4,8,3,2095.610666666667,3
w13,8,128,8,4096,3072,32,32,256,4,8,4,2096.1543333333334,3
w13,8,128,8,4096,3072,32,32,256,16,8,2,2101.6476666666667,3
w13,8,128,8,4096,3072,32,32,256,16,8,3,2101.3813333333333,3
w13,8,128,8,4096,3072,32,64,64,1,4,3,2100.474333333333,3
w13,8,128,8,4096,3072,32,64,64,1,4,4,2095.973,3
w13,8,128,8,4096,3072,32,64,64,1,8,2,2098.970333333333,3
w13,8,128,8,4096,3072,32,64,64,1,8,3,2103.088,3
w13,8,128,8,4096,3072,32,64,64,1,8,4,2096.5916666666667,3
w13,8,128,8,4096,3072,32,64,128,1,4,2,2099.0983333333334,3
w13,8,128,8,4096,3072,32,64,128,1,4,3,2097.637,3
w13,8,128,8,4096,3072,32,64,128,1,4,4,2096.123,3
w13,8,128,8,4096,3072,32,64,128,1,8,2,2101.541333333333,3
w13,8,128,8,4096,3072,32,64,128,1,8,3,2097.818333333333,3
w13,8,128,8,4096,3072,32,64,128,1,8,4,2097.3703333333333,3
w13,8,128,8,4096,3072,32,64,128,4,4,2,2099.471666666667,3
w13,8,128,8,4096,3072,32,64,128,4,4,3,2096.933333333333,3
w13,8,128,8,4096,3072,32,64,128,4,4,4,2097.744,3
w13,8,128,8,4096,3072,32,64,128,4,8,2,2099.5356666666667,3
w13,8,128,8,4096,3072,32,64,128,4,8,3,2097.6796666666664,3
w13,8,128,8,4096,3072,32,64,128,4,8,4,2096.6126666666664,3
w13,8,128,8,4096,3072,32,64,256,1,4,2,2100.421333333333,3
w13,8,128,8,4096,3072,32,64,256,1,4,3,2096.6769999999997,3
w13,8,128,8,4096,3072,32,64,256,1,8,2,2097.1246666666666,3
w13,8,128,8,4096,3072,32,64,256,1,8,3,2097.1253333333334,3
w13,8,128,8,4096,3072,32,64,256,8,4,3,2100.208,3
w13,8,128,8,4096,3072,32,64,256,8,8,3,2099.1516666666666,3
w13,8,128,8,4096,3072,32,128,64,1,8,2,2098.0106666666666,3
w13,8,128,8,4096,3072,32,128,64,1,8,4,2103.664,3
w13,8,128,8,4096,3072,64,16,128,1,4,2,2096.0796666666665,3
w13,8,128,8,4096,3072,64,16,128,1,4,3,2100.2606666666666,3
w13,8,128,8,4096,3072,64,16,128,1,4,4,2101.7116666666666,3
w13,8,128,8,4096,3072,64,16,128,1,8,2,2098.917,3
w13,8,128,8,4096,3072,64,16,128,1,8,3,2101.136,3
w13,8,128,8,4096,3072,64,16,128,1,8,4,2101.210333333333,3
w13,8,128,8,4096,3072,64,32,128,1,4,2,2098.8746666666666,3
w13,8,128,8,4096,3072,64,32,128,1,4,3,2096.9436666666666,3
w13,8,128,8,4096,3072,64,32,128,1,4,4,2100.869,3
w13,8,128,8,4096,3072,64,32,128,1,8,2,2100.9223333333334,3
w13,8,128,8,4096,3072,64,32,128,1,8,3,2098.021,3
w13,8,128,8,4096,3072,64,32,128,1,8,4,2100.239666666667,3
w13,8,128,8,4096,3072,64,32,256,1,4,2,2097.3489999999997,3
w13,8,128,8,4096,3072,64,32,256,1,4,3,2098.607666666667,3
w13,8,128,8,4096,3072,64,32,256,1,8,2,2097.104,3
w13,8,128,8,4096,3072,64,32,256,1,8,3,2097.9036666666666,3
w13,8,128,8,4096,3072,64,64,64,1,4,3,2097.2636666666667,3
w13,8,128,8,4096,3072,64,64,64,1,8,3,2099.6956666666665,3
w13,8,128,8,4096,3072,64,64,128,1,4,2,2096.4106666666667,3
w13,8,128,8,4096,3072,64,64,128,1,4,3,2097.029,3
w13,8,128,8,4096,3072,64,64,128,1,4,4,2097.4553333333333,3
w13,8,128,8,4096,3072,64,64,128,1,8,2,2098.16,3
w13,8,128,8,4096,3072,64,64,128,1,8,3,2096.6876666666667,3
w13,8,128,8,4096,3072,64,64,128,1,8,4,2097.6583333333333,3
w13,8,128,8,4096,3072,64,64,128,4,4,2,2102.970333333333,3
w13,8,128,8,4096,3072,64,64,128,4,4,3,2096.559333333333,3
w13,8,128,8,4096,3072,64,64,128,4,4,4,2100.3036666666667,3
w13,8,128,8,4096,3072,64,64,128,4,8,2,2096.8693333333335,3
w13,8,128,8,4096,3072,64,64,128,4,8,3,2097.3063333333334,3
w13,8,128,8,4096,3072,64,64,128,4,8,4,2097.8503333333333,3
w13,8,128,8,4096,3072,64,64,128,8,4,3,2103.0453333333335,3
w13,8,128,8,4096,3072,64,64,128,8,4,4,2101.072,3
w13,8,128,8,4096,3072,64,64,128,8,8,4,2103.4933333333333,3
w13,8,128,8,4096,3072,64,128,64,1,4,2,2103.4083333333333,3
w13,8,128,8,4096,3072,128,32,128,1,4,2,2103.8346666666666,3
w13,8,128,8,4096,3072,128,64,64,1,4,2,2103.1733333333336,3
w13,8,128,8,4096,3072,128,64,64,1,4,4,2100.4966666666664,3
w13,8,128,8,4096,3072,128,64,64,1,8,4,2098.8536666666664,3
w13,8,128,8,4096,3072,128,64,128,1,4,3,2103.5473333333334,3
w13,8,128,8,4096,3072,128,64,128,1,8,3,2098.7360000000003,3
w13,16,8,2,1024,512,16,64,64,64,4,4,5.164666666666666,3
w13,16,16,2,1536,768,16,256,32,8,4,4,14.854333333333335,3
w13,16,16,4,1536,1024,16,64,64,1,4,4,18.754,3
w13,16,16,4,1536,1024,16,64,64,32,4,3,18.754,3
w13,16,16,4,1536,1024,16,64,64,32,4,4,18.775333333333336,3
w13,16,16,4,1536,1024,16,64,64,64,4,4,18.743333333333336,3
w13,16,16,4,1536,1024,16,64,64,64,8,4,18.818,3
w13,16,32,4,2048,768,16,32,64,1,4,2,118.03933333333333,3
w13,16,32,6,3072,1024,16,32,256,1,4,2,262.253,3
w13,16,32,6,3072,1024,16,64,256,1,4,2,262.978,3
w13,16,32,6,3072,1024,32,32,256,1,4,2,262.1356666666666,3
w13,16,32,6,3072,1024,32,64,256,1,4,2,263.25533333333334,3
w13,16,60,4,2048,1408,16,32,256,1,4,2,451.88533333333334,3
w13,16,60,4,2048,1408,16,64,128,1,4,2,450.45633333333336,3
w13,16,60,4,2048,1408,16,64,256,1,4,2,451.5653333333333,3
w13,16,60,4,2048,1408,16,128,128,1,4,2,451.949,3
w13,16,60,4,2048,1408,32,32,128,1,4,2,450.76533333333333,3
w13,16,60,4,2048,1408,32,32,256,1,4,2,452.12000000000006,3
w13,16,60,4,2048,1408,32,64,128,1,4,2,450.57366666666667,3
w13,16,60,4,2048,1408,32,64,256,1,4,2,452.51500000000004,3
w13,16,60,4,2048,1408,32,128,128,1,4,2,451.9066666666667,3
w13,16,60,4,2048,1408,64,64,128,1,4,2,451.5653333333333,3
w13,16,60,6,3584,2304,16,16,64,1,4,3,1295.4083333333333,3
w13,16,60,6,3584,2304,16,16,128,1,4,2,1296.2079999999999,3
w13,16,60,6,3584,2304,16,16,128,1,4,3,1292.4323333333334,3
w13,16,60,6,3584,2304,16,16,128,1,4,4,1292.5496666666666,3
w13,16,60,6,3584,2304,16,16,128,1,8,2,1296.4003333333333,3
w13,16,60,6,3584,2304,16,16,128,1,8,3,1294.7996666666666,3
w13,16,60,6,3584,2304,16,16,128,1,8,4,1294.7253333333335,3
w13,16,60,6,3584,2304,16,16,128,4,4,2,1297.0826666666667,3
w13,16,60,6,3584,2304,16,16,128,4,4,3,1295.1843333333334,3
w13,16,60,6,3584,2304,16,16,128,4,4,4,1293.189,3
w13,16,60,6,3584,2304,16,16,128,4,8,3,1295.5466666666666,3
w13,16,60,6,3584,2304,16,16,128,4,8,4,1295.4826666666668,3
w13,16,60,6,3584,2304,16,16,256,1,4,2,1292.0266666666666,3
w13,16,60,6,3584,2304,16,16,256,1,4,3,1291.7173333333333,3
w13,16,60,6,3584,2304,16,16,256,1,4,4,1292.0263333333335,3
w13,16,60,6,3584,2304,16,16,256,1,8,2,1294.1813333333332,3
w13,16,60,6,3584,2304,16,16,256,1,8,3,1294.3516666666667,3
w13,16,60,6,3584,2304,16,16,256,1,8,4,1292.997,3
w13,16,60,6,3584,2304,16,16,256,4,4,2,1292.24,3
w13,16,60,6,3584,2304,16,16,256,4,4,3,1292.9653333333333,3
w13,16,60,6,3584,2304,16,16,256,4,4,4,1293.1786666666667,3
w13,16,60,6,3584,2304,16,16,256,4,8,2,1294.5546666666667,3
w13,16,60,6,3584,2304,16,16,256,4,8,3,1293.5623333333333,3
w13,16,60,6,3584,2304,16,16,256,4,8,4,1294.5333333333333,3
w13,16,60,6,3584,2304,16,32,64,1,4,3,1295.9733333333334,3
w13,16,60,6,3584,2304,16,32,64,32,4,3,1298.2026666666666,3
w13,16,60,6,3584,2304,16,32,128,1,4,2,1293.4556666666667,3
w13,16,60,6,3584,2304,16,32,128,1,4,3,1292.7303333333332,3
w13,16,60,6,3584,2304,16,32,128,1,4,4,1292.2186666666666,3
w13,16,60,6,3584,2304,16,32,128,1,8,3,1293.1360000000002,3
w13,16,60,6,3584,2304,16,32,128,1,8,4,1292.4959999999999,3
w13,16,60,6,3584,2304,16,32,128,4,4,2,1293.5946666666666,3
w13,16,60,6,3584,2304,16,32,128,4,4,3,1293.8933333333332,3
w13,16,60,6,3584,2304,16,32,128,4,4,4,1292.3680000000002,3
w13,16,60,6,3584,2304,16,32,128,4,8,3,1294.096,3
w13,16,60,6,3584,2304,16,32,128,4,8,4,1294.085,3
w13,16,60,6,3584,2304,16,32,128,16,4,2,1295.3333333333333,3
w13,16,60,6,3584,2304,16,32,128,16,4,3,1294.789,3
w13,16,60,6,3584,2304,16,32,128,16,4,4,1294.2243333333333,3
w13,16,60,6,3584,2304,16,32,128,16,8,3,1295.771,3
w13,16,60,6,3584,2304,16,32,128,16,8,4,1294.629,3
w13,16,60,6,3584,2304,16,32,128,32,4,2,1294.5226666666667,3
w13,16,60,6,3584,2304,16,32,128,32,4,3,1295.3866666666665,3
w13,16,60,6,3584,2304,16,32,128,32,4,4,1294.6826666666666,3
w13,16,60,6,3584,2304,16,32,128,32,8,3,1295.76,3
w13,16,60,6,3584,2304,16,32,128,32,8,4,1295.344,3
w13,16,60,6,3584,2304,16,32,128,64,4,2,1294.2876666666666,3
w13,16,60,6,3584,2304,16,32,128,64,4,3,1293.4983333333332,3
w13,16,60,6,3584,2304,16,32,128,64,4,4,1294.7253333333335,3
w13,16,60,6,3584,2304,16,32,128,64,8,3,1294.0423333333333,3
w13,16,60,6,3584,2304,16,32,128,64,8,4,1294.8636666666666,3
w13,16,60,6,3584,2304,16,32,256,1,4,2,1291.7493333333332,3
w13,16,60,6,3584,2304,16,32,256,1,4,3,1293.1463333333334,3
w13,16,60,6,3584,2304,16,32,256,1,4,4,1292.1543333333332,3
w13,16,60,6,3584,2304,16,32,256,1,8,2,1292.336,3
w13,16,60,6,3584,2304,16,32,256,1,8,3,1293.2746666666667,3
w13,16,60,6,3584,2304,16,32,256,1,8,4,1292.4743333333333,3
w13,16,60,6,3584,2304,16,32,256,16,4,2,1294.8533333333332,3
w13,16,60,6,3584,2304,16,32,256,16,4,3,1293.3703333333333,3
w13,16,60,6,3584,2304,16,32,256,16,4,4,1293.9996666666666,3
w13,16,60,6,3584,2304,16,32,256,16,8,2,1295.4613333333334,3
w13,16,60,6,3584,2304,16,32,256,16,8,3,1293.477,3
w13,16,60,6,3584,2304,16,32,256,16,8,4,1293.6903333333332,3
w13,16,60,6,3584,2304,16,32,256,32,4,2,1295.9096666666667,3
w13,16,60,6,3584,2304,16,32,256,32,4,3,1295.6106666666667,3
w13,16,60,6,3584,2304,16,32,256,32,4,4,1295.568,3
w13,16,60,6,3584,2304,16,32,256,32,8,2,1294.7146666666667,3
w13,16,60,6,3584,2304,16,32,256,32,8,3,1294.832,3
w13,16,60,6,3584,2304,16,32,256,32,8,4,1295.7596666666666,3
w13,16,60,6,3584,2304,16,32,256,64,4,2,1293.9356666666665,3
w13,16,60,6,3584,2304,16,32,256,64,4,3,1294.704,3
w13,16,60,6,3584,2304,16,32,256,64,4,4,1295.7920000000001,3
w13,16,60,6,3584,2304,16,32,256,64,8,2,1295.344,3
w13,16,60,6,3584,2304,16,32,256,64,8,3,1294.7783333333334,3
w13,16,60,6,3584,2304,16,32,256,64,8,4,1295.7706666666666,3
w13,16,60,6,3584,2304,16,64,64,1,4,3,1297.7226666666666,3
w13,16,60,6,3584,2304,16,64,128,1,4,2,1294.9496666666666,3
w13,16,60,6,3584,2304,16,64,128,1,4,3,1292.9763333333333,3
w13,16,60,6,3584,2304,16,64,128,1,4,4,1292.325,3
w13,16,60,6,3584,2304,16,64,128,1,8,2,1294.6613333333335,3
w13,16,60,6,3584,2304,16,64,128,1,8,3,1292.517,3
w13,16,60,6,3584,2304,16,64,128,1,8,4,1292.464,3
w13,16,60,6,3584,2304,16,64,128,16,4,2,1295.696,3
w13,16,60,6,3584,2304,16,64,128,16,4,3,1294.2986666666666,3
w13,16,60,6,3584,2304,16,64,128,16,4,4,1294.032,3
w13,16,60,6,3584,2304,16,64,128,16,8,2,1295.696,3
w13,16,60,6,3584,2304,16,64,128,16,8,3,1294.2453333333333,3
w13,16,60,6,3584,2304,16,64,128,16,8,4,1294.4266666666665,3
w13,16,60,6,3584,2304,16,64,128,32,4,2,1297.9253333333334,3
w13,16,60,6,3584,2304,16,64,128,32,4,3,1295.6423333333335,3
w13,16,60,6,3584,2304,16,64,128,32,4,4,1295.7706666666666,3
w13,16,60,6,3584,2304,16,64,128,32,8,2,1295.8986666666667,3
w13,16,60,6,3584,2304,16,64,128,32,8,3,1295.7596666666668,3
w13,16,60,6,3584,2304,16,64,128,32,8,4,1295.28,3
w13,16,60,6,3584,2304,16,64,128,64,4,3,1294.7683333333334,3
w13,16,60,6,3584,2304,16,64,128,64,4,4,1296.0159999999998,3
w13,16,60,6,3584,2304,16,64,128,64,8,3,1294.8426666666667,3
w13,16,60,6,3584,2304,16,64,128,64,8,4,1295.9946666666667,3
w13,16,60,6,3584,2304,16,64,256,1,4,2,1292.1973333333333,3
w13,16,60,6,3584,2304,16,64,256,1,4,3,1293.0933333333332,3
w13,16,60,6,3584,2304,16,64,256,1,8,2,1292.8693333333333,3
w13,16,60,6,3584,2304,16,64,256,1,8,3,1292.3043333333333,3
w13,16,60,6,3584,2304,16,64,256,16,4,2,1295.4293333333333,3
w13,16,60,6,3584,2304,16,64,256,16,4,3,1293.6053333333332,3
w13,16,60,6,3584,2304,16,64,256,16,8,2,1293.9143333333334,3
w13,16,60,6,3584,2304,16,64,256,16,8,3,1293.1893333333335,3
w13,16,60,6,3584,2304,16,64,256,32,4,2,1295.6423333333335,3
w13,16,60,6,3584,2304,16,64,256,32,4,3,1294.8746666666668,3
w13,16,60,6,3584,2304,16,64,256,32,8,2,1294.9170000000001,3
w13,16,60,6,3584,2304,16,64,256,32,8,3,1294.6613333333335,3
w13,16,60,6,3584,2304,16,64,256,64,4,2,1294.7576666666666,3
w13,16,60,6,3584,2304,16,64,256,64,4,3,1296.2610000000002,3
w13,16,60,6,3584,2304,16,64,256,64,8,2,1294.7996666666668,3
w13,16,60,6,3584,2304,16,64,256,64,8,3,1295.7603333333334,3
w13,16,60,6,3584,2304,16,128,128,1,4,2,1292.901,3
w13,16,60,6,3584,2304,16,128,128,1,4,3,1292.6023333333333,3
w13,16,60,6,3584,2304,16,128,128,1,8,2,1293.6053333333332,3
w13,16,60,6,3584,2304,16,128,128,1,8,3,1291.973,3
w13,16,60,6,3584,2304,16,128,128,16,4,2,1294.9489999999998,3
w13,16,60,6,3584,2304,16,128,128,16,4,3,1294.683,3
w13,16,60,6,3584,2304,16,128,128,16,8,2,1294.5333333333333,3
w13,16,60,6,3584,2304,16,128,128,16,8,3,1294.7146666666667,3
w13,16,60,6,3584,2304,16,128,128,32,4,2,1295.2266666666667,3
w13,16,60,6,3584,2304,16,128,128,32,4,3,1295.621,3
w13,16,60,6,3584,2304,16,128,128,32,8,2,1294.3303333333333,3
w13,16,60,6,3584,2304,16,128,128,32,8,3,1295.5036666666667,3
w13,16,60,6,3584,2304,16,128,128,64,4,2,1296.3896666666667,3
w13,16,60,6,3584,2304,16,128,128,64,4,3,1295.376,3
w13,16,60,6,3584,2304,16,128,128,64,8,2,1297.392,3
w13,16,60,6,3584,2304,16,128,128,64,8,3,1294.8643333333332,3
w13,16,60,6,3584,2304,32,16,128,4,4,2,1297.509,3
w13,16,60,6,3584,2304,32,16,128,4,4,3,1292.741,3
w13,16,60,6,3584,2304,32,16,128,4,4,4,1293.093,3
w13,16,60,6,3584,2304,32,16,128,4,8,3,1295.0666666666666,3
w13,16,60,6,3584,2304,32,16,128,4,8,4,1296.1866666666667,3
w13,16,60,6,3584,2304,32,32,128,1,4,2,1296.4530000000002,3
w13,16,60,6,3584,2304,32,32,128,1,4,3,1293.7013333333334,3
w13,16,60,6,3584,2304,32,32,128,1,4,4,1292.6773333333333,3
w13,16,60,6,3584,2304,32,32,128,1,8,3,1295.6106666666667,3
w13,16,60,6,3584,2304,32,32,128,1,8,4,1293.1036666666666,3
w13,16,60,6,3584,2304,32,32,128,4,4,2,1296.901,3
w13,16,60,6,3584,2304,32,32,128,4,4,3,1293.723,3
w13,16,60,6,3584,2304,32,32,128,4,4,4,1293.712,3
w13,16,60,6,3584,2304,32,32,128,4,8,3,1295.2053333333333,3
w13,16,60,6,3584,2304,32,32,128,4,8,4,1293.9896666666666,3
w13,16,60,6,3584,2304,32,32,128,16,4,3,1294.629,3
w13,16,60,6,3584,2304,32,32,128,16,4,4,1294.608,3
w13,16,60,6,3584,2304,32,32,128,16,8,3,1298.1493333333335,3
w13,16,60,6,3584,2304,32,32,128,16,8,4,1294.992,3
w13,16,60,6,3584,2304,32,32,128,64,4,3,1294.9703333333334,3
w13,16,60,6,3584,2304,32,32,128,64,4,4,1295.7276666666667,3
w13,16,60,6,3584,2304,32,32,128,64,8,3,1297.36,3
w13,16,60,6,3584,2304,32,32,128,64,8,4,1295.472,3
w13,16,60,6,3584,2304,32,32,256,1,4,2,1295.4613333333334,3
w13,16,60,6,3584,2304,32,32,256,1,4,3,1292.795,3
w13,16,60,6,3584,2304,32,32,256,1,4,4,1292.24,3
w13,16,60,6,3584,2304,32,32,256,1,8,2,1297.0186666666666,3
w13,16,60,6,3584,2304,32,32,256,1,8,3,1292.1116666666667,3
w13,16,60,6,3584,2304,32,32,256,1,8,4,1292.763,3
w13,16,60,6,3584,2304,32,32,256,4,4,2,1296.5916666666667,3
w13,16,60,6,3584,2304,32,32,256,4,4,3,1293.445,3
w13,16,60,6,3584,2304,32,32,256,4,4,4,1292.912,3
w13,16,60,6,3584,2304,32,32,256,4,8,2,1295.0559999999998,3
w13,16,60,6,3584,2304,32,32,256,4,8,3,1292.7836666666667,3
w13,16,60,6,3584,2304,32,32,256,4,8,4,1293.8293333333334,3
w13,16,60,6,3584,2304,32,32,256,16,4,2,1295.8239999999998,3
w13,16,60,6,3584,2304,32,32,256,16,4,3,1294.2983333333334,3
w13,16,60,6,3584,2304,32,32,256,16,4,4,1293.9253333333334,3
w13,16,60,6,3584,2304,32,32,256,16,8,2,1294.981,3
w13,16,60,6,3584,2304,32,32,256,16,8,3,1295.1626666666668,3
w13,16,60,6,3584,2304,32,32,256,16,8,4,1294.32,3
w13,16,60,6,3584,2304,32,32,256,32,4,2,1295.8133333333335,3
w13,16,60,6,3584,2304,32,32,256,32,4,3,1295.0663333333334,3
w13,16,60,6,3584,2304,32,32,256,32,4,4,1296.0693333333334,3
w13,16,60,6,3584,2304,32,32,256,32,8,2,1297.2,3
w13,16,60,6,3584,2304,32,32,256,32,8,3,1296.144,3
w13,16,60,6,3584,2304,32,32,256,32,8,4,1295.2160000000001,3
w13,16,60,6,3584,2304,32,64,128,1,4,2,1294.747,3
w13,16,60,6,3584,2304,32,64,128,1,4,3,1293.9679999999998,3
w13,16,60,6,3584,2304,32,64,128,1,4,4,1293.4453333333333,3
w13,16,60,6,3584,2304,32,64,128,1,8,2,1294.96,3
w13,16,60,6,3584,2304,32,64,128,1,8,3,1292.8906666666664,3
w13,16,60,6,3584,2304,32,64,128,1,8,4,1293.5946666666666,3
w13,16,60,6,3584,2304,32,64,128,4,4,2,1295.0240000000001,3
w13,16,60,6,3584,2304,32,64,128,4,4,3,1294.3729999999998,3
w13,16,60,6,3584,2304,32,64,128,4,4,4,1293.9036666666668,3
w13,16,60,6,3584,2304,32,64,128,4,8,2,1294.8533333333332,3
w13,16,60,6,3584,2304,32,64,128,4,8,3,1294.9813333333334,3
w13,16,60,6,3584,2304,32,64,128,4,8,4,1294.5116666666665,3
w13,16,60,6,3584,2304,32,64,128,16,4,2,1296.3999999999999,3
w13,16,60,6,3584,2304,32,64,128,16,4,3,1294.981,3
w13,16,60,6,3584,2304,32,64,128,16,4,4,1294.9173333333335,3
w13,16,60,6,3584,2304,32,64,128,16,8,2,1295.3656666666666,3
w13,16,60,6,3584,2304,32,64,128,16,8,3,1294.8426666666667,3
w13,16,60,6,3584,2304,32,64,128,16,8,4,1295.0986666666668,3
w13,16,60,6,3584,2304,32,64,128,32,4,2,1296.9440000000002,3
w13,16,60,6,3584,2304,32,64,128,32,4,3,1295.9413333333332,3
w13,16,60,6,3584,2304,32,64,128,32,4,4,1296.741,3
w13,16,60,6,3584,2304,32,64,128,32,8,2,1296.773,3
w13,16,60,6,3584,2304,32,64,128,32,8,3,1297.04,3
w13,16,60,6,3584,2304,32,64,128,32,8,4,1296.4856666666667,3
w13,16,60,6,3584,2304,32,64,128,64,4,3,1295.2373333333333,3
w13,16,60,6,3584,2304,32,64,128,64,4,4,1296.6983333333333,3
w13,16,60,6,3584,2304,32,64,128,64,8,3,1296.2186666666666,3
w13,16,60,6,3584,2304,32,64,128,64,8,4,1296.773,3
w13,16,60,6,3584,2304,32,64,256,1,4,2,1292.7413333333334,3
w13,16,60,6,3584,2304,32,64,256,1,4,3,1293.8506666666667,3
w13,16,60,6,3584,2304,32,64,256,1,8,2,1294.7466666666667,3
w13,16,60,6,3584,2304,32,64,256,1,8,3,1292.8906666666667,3
w13,16,60,6,3584,2304,32,64,256,8,4,2,1294.5546666666667,3
w13,16,60,6,3584,2304,32,64,256,8,4,3,1293.7013333333334,3
w13,16,60,6,3584,2304,32,64,256,8,8,2,1294.5866666666668,3
w13,16,60,6,3584,2304,32,64,256,8,8,3,1293.1036666666666,3
w13,16,60,6,3584,2304,32,64,256,16,4,2,1296.005,3
w13,16,60,6,3584,2304,32,64,256,16,4,3,1295.376,3
w13,16,60,6,3584,2304,32,64,256,16,8,2,1296.0906666666667,3
w13,16,60,6,3584,2304,32,64,256,16,8,3,1293.9893333333332,3
w13,16,60,6,3584,2304,32,64,256,32,4,2,1296.2823333333333,3
w13,16,60,6,3584,2304,32,64,256,32,4,3,1295.7169999999999,3
w13,16,60,6,3584,2304,32,64,256,32,8,2,1296.4959999999999,3
w13,16,60,6,3584,2304,32,64,256,32,8,3,1295.8556666666666,3
w13,16,60,6,3584,2304,32,64,256,64,4,2,1295.6853333333333,3
w13,16,60,6,3584,2304,32,64,256,64,4,3,1297.008,3
w13,16,60,6,3584,2304,32,64,256,64,8,2,1297.0829999999999,3
w13,16,60,6,3584,2304,32,64,256,64,8,3,1296.2503333333332,3
w13,16,60,6,3584,2304,32,128,128,1,4,2,1294.597,3
w13,16,60,6,3584,2304,32,128,128,1,4,3,1293.9683333333332,3
w13,16,60,6,3584,2304,32,128,128,1,8,2,1292.9336666666668,3
w13,16,60,6,3584,2304,32,128,128,1,8,3,1292.1863333333333,3
w13,16,60,6,3584,2304,32,128,128,4,4,2,1295.4933333333333,3
w13,16,60,6,3584,2304,32,128,128,4,4,3,1295.4823333333334,3
w13,16,60,6,3584,2304,32,128,128,4,8,2,1293.531,3
w13,16,60,6,3584,2304,32,128,128,4,8,3,1294.8639999999998,3
w13,16,60,6,3584,2304,32,128,128,8,4,2,1297.595,3
w13,16,60,6,3584,2304,32,128,128,8,4,3,1295.0346666666667,3
w13,16,60,6,3584,2304,32,128,128,8,8,2,1295.0453333333332,3
w13,16,60,6,3584,2304,32,128,128,8,8,3,1295.3763333333334,3
w13,16,60,6,3584,2304,32,128,128,16,4,2,1295.2266666666667,3
w13,16,60,6,3584,2304,32,128,128,16,4,3,1296.1009999999999,3
w13,16,60,6,3584,2304,32,128,128,16,8,2,1295.1096666666665,3
w13,16,60,6,3584,2304,32,128,128,16,8,3,1295.461,3
w13,16,60,6,3584,2304,32,128,128,32,4,2,1296.848,3
w13,16,60,6,3584,2304,32,128,128,32,4,3,1297.7223333333334,3
w13,16,60,6,3584,2304,32,128,128,32,8,2,1295.344,3
w13,16,60,6,3584,2304,32,128,128,32,8,3,1296.0906666666667,3
w13,16,60,6,3584,2304,32,128,128,64,4,2,1297.552,3
w13,16,60,6,3584,2304,32,128,128,64,4,3,1296.6666666666667,3
w13,16,60,6,3584,2304,32,128,128,64,8,2,1297.445,3
w13,16,60,6,3584,2304,32,128,128,64,8,3,1296.613,3
w13,16,60,6,3584,2304,64,32,128,1,4,2,1295.7173333333333,3
w13,16,60,6,3584,2304,64,32,128,1,4,3,1294.4796666666666,3
w13,16,60,6,3584,2304,64,32,128,1,4,4,1296.3573333333334,3
w13,16,60,6,3584,2304,64,32,128,1,8,2,1294.981,3
w13,16,60,6,3584,2304,64,32,128,1,8,3,1294.576,3
w13,16,60,6,3584,2304,64,32,128,1,8,4,1295.664,3
w13,16,60,6,3584,2304,64,32,128,16,4,3,1294.8746666666666,3
w13,16,60,6,3584,2304,64,32,128,16,8,2,1298.16,3
w13,16,60,6,3584,2304,64,32,128,16,8,3,1294.9706666666666,3
w13,16,60,6,3584,2304,64,32,256,1,4,2,1295.3226666666667,3
w13,16,60,6,3584,2304,64,32,256,1,4,3,1294.768,3
w13,16,60,6,3584,2304,64,32,256,1,8,2,1295.088,3
w13,16,60,6,3584,2304,64,32,256,1,8,3,1292.8370000000002,3
w13,16,60,6,3584,2304,64,64,128,1,4,2,1295.1946666666665,3
w13,16,60,6,3584,2304,64,64,128,1,4,3,1294.9176666666665,3
w13,16,60,6,3584,2304,64,64,128,1,4,4,1294.2453333333333,3
w13,16,60,6,3584,2304,64,64,128,1,8,2,1295.5896666666667,3
w13,16,60,6,3584,2304,64,64,128,1,8,3,1294.2556666666667,3
w13,16,60,6,3584,2304,64,64,128,1,8,4,1297.317,3
w13,16,60,6,3584,2304,64,64,128,4,4,2,1294.789,3
w13,16,60,6,3584,2304,64,64,128,4,4,3,1294.5013333333334,3
w13,16,60,6,3584,2304,64,64,128,4,4,4,1296.3999999999999,3
w13,16,60,6,3584,2304,64,64,128,4,8,2,1296.4636666666668,3
w13,16,60,6,3584,2304,64,64,128,4,8,3,1294.7256666666667,3
w13,16,60,6,3584,2304,64,64,128,4,8,4,1297.8076666666666,3
w13,16,60,6,3584,2304,64,64,128,8,4,2,1295.4076666666667,3
w13,16,60,6,3584,2304,64,64,128,8,4,3,1296.9863333333333,3
w13,16,60,6,3584,2304,64,64,128,8,4,4,1296.2933333333333,3
w13,16,60,6,3584,2304,64,64,128,8,8,3,1296.005,3
w13,16,60,6,3584,2304,64,64,128,8,8,4,1297.9783333333332,3
w13,16,60,6,3584,2304,64,64,128,16,4,2,1296.4856666666667,3
w13,16,60,6,3584,2304,64,64,128,16,4,3,1296.165,3
w13,16,60,6,3584,2304,64,64,128,16,4,4,1298.107,3
w13,16,60,6,3584,2304,64,64,128,16,8,4,1298.1916666666666,3
w13,16,60,6,3584,2304,64,64,128,32,4,2,1298.0,3
w13,16,60,6,3584,2304,64,128,128,1,4,2,1295.1623333333334,3
w13,16,60,6,3584,2304,64,128,128,1,8,2,1296.229,3
w13,16,60,6,3584,2304,64,128,128,1,8,3,1295.0666666666666,3
w13,16,60,6,3584,2304,64,128,128,4,4,2,1295.9303333333335,3
w13,16,60,6,3584,2304,64,128,128,4,8,2,1297.2106666666666,3
w13,16,60,6,3584,2304,64,128,128,4,8,3,1296.624,3
w13,16,60,6,3584,2304,64,128,128,16,4,2,1296.3146666666667,3
w13,16,60,6,3584,2304,64,128,128,16,8,2,1297.0720000000001,3
w13,16,60,6,3584,2304,64,128,128,16,8,3,1297.7973333333332,3
w13,16,60,6,3584,2304,64,128,128,32,4,2,1298.032,3
w13,16,60,6,3584,2304,64,128,128,32,8,2,1297.8613333333333,3
w13,16,60,6,3584,2304,64,128,128,32,8,3,1297.755,3
w13,16,60,8,2048,1536,16,32,64,1,4,3,495.27666666666664,3
w13,16,60,8,2048,1536,16,32,128,1,4,2,493.1006666666667,3
w13,16,60,8,2048,1536,16,32,128,4,4,2,495.50066666666663,3
w13,16,60,8,2048,1536,16,32,256,1,4,2,493.5493333333334,3
w13,16,60,8,2048,1536,16,64,128,1,4,2,494.3166666666666,3
w13,16,60,8,2048,1536,16,64,128,1,8,2,495.3833333333334,3
w13,16,60,8,2048,1536,16,64,128,1,8,3,495.54333333333335,3
w13,16,60,8,2048,1536,16,64,256,1,4,2,494.02933333333334,3
w13,16,60,8,2048,1536,16,64,256,1,8,2,495.54333333333335,3
w13,16,60,8,2048,1536,16,128,64,1,8,4,495.33,3
w13,16,60,8,2048,1536,16,128,128,1,4,2,494.7223333333333,3
w13,16,60,8,2048,1536,16,128,128,1,8,2,495.56466666666665,3
w13,16,60,8,2048,1536,32,16,128,4,4,2,494.13533333333334,3
w13,16,60,8,2048,1536,32,32,256,1,4,2,494.701,3
w13,16,60,8,2048,1536,32,64,128,1,4,2,493.80466666666666,3
w13,16,60,8,2048,1536,32,64,128,4,4,2,495.53266666666667,3
w13,16,60,8,2048,1536,32,64,128,4,8,2,495.42533333333336,3
w13,16,60,8,2048,1536,32,64,256,1,4,2,494.4873333333333,3
w13,16,60,8,2048,1536,32,128,128,1,4,2,495.14866666666666,3
w13,16,60,8,2048,1536,32,128,128,1,8,2,495.53266666666667,3
w13,16,64,6,3072,2048,16,16,128,1,4,2,1055.1933333333334,3
w13,16,64,6,3072,2048,16,16,128,1,4,3,1052.367,3
w13,16,64,6,3072,2048,16,16,128,1,4,4,1052.271,3
w13,16,64,6,3072,2048,16,16,128,1,8,4,1055.0333333333335,3
w13,16,64,6,3072,2048,16,16,128,4,4,3,1053.9456666666667,3
w13,16,64,6,3072,2048,16,16,128,4,8,3,1055.6843333333334,3
w13,16,64,6,3072,2048,16,16,256,1,4,2,1052.719,3
w13,16,64,6,3072,2048,16,16,256,1,4,3,1050.7886666666666,3
w13,16,64,6,3072,2048,16,16,256,1,4,4,1052.655,3
w13,16,64,6,3072,2048,16,16,256,1,8,2,1054.8950000000002,3
w13,16,64,6,3072,2048,16,16,256,1,8,3,1052.474,3
w13,16,64,6,3072,2048,16,16,256,1,8,4,1052.9643333333333,3
w13,16,64,6,3072,2048,16,16,256,4,4,2,1054.1483333333333,3
w13,16,64,6,3072,2048,16,16,256,4,4,3,1052.719,3
w13,16,64,6,3072,2048,16,16,256,4,4,4,1051.6206666666667,3
w13,16,64,6,3072,2048,16,16,256,4,8,2,1052.559,3
w13,16,64,6,3072,2048,16,16,256,4,8,3,1054.0203333333332,3
w13,16,64,6,3072,2048,16,16,256,4,8,4,1052.719,3
w13,16,64,6,3072,2048,16,32,128,1,4,2,1055.4393333333335,3
w13,16,64,6,3072,2048,16,32,128,1,4,3,1054.4046666666666,3
w13,16,64,6,3072,2048,16,32,128,1,4,4,1052.5693333333334,3
w13,16,64,6,3072,2048,16,32,128,1,8,2,1053.8923333333335,3
w13,16,64,6,3072,2048,16,32,128,1,8,3,1055.759,3
w13,16,64,6,3072,2048,16,32,128,1,8,4,1052.3136666666667,3
w13,16,64,6,3072,2048,16,32,128,4,4,2,1056.0256666666667,3
w13,16,64,6,3072,2048,16,32,128,4,4,3,1055.3536666666666,3
w13,16,64,6,3072,2048,16,32,128,4,4,4,1053.6793333333333,3
w13,16,64,6,3072,2048,16,32,128,4,8,4,1054.778,3
w13,16,64,6,3072,2048,16,32,128,16,4,3,1054.8416666666665,3
w13,16,64,6,3072,2048,16,32,128,16,4,4,1053.0926666666667,3
w13,16,64,6,3072,2048,16,32,128,16,8,2,1054.959,3
w13,16,64,6,3072,2048,16,32,128,16,8,4,1054.01,3
w13,16,64,6,3072,2048,16,32,128,32,4,2,1055.4496666666666,3
w13,16,64,6,3072,2048,16,32,128,32,4,3,1053.3056666666669,3
w13,16,64,6,3072,2048,16,32,128,32,4,4,1053.3909999999998,3
w13,16,64,6,3072,2048,16,32,128,32,8,2,1054.6073333333334,3
w13,16,64,6,3072,2048,16,32,128,32,8,3,1053.8286666666665,3
w13,16,64,6,3072,2048,16,32,128,32,8,4,1053.6363333333334,3
w13,16,64,6,3072,2048,16,32,128,64,4,3,1052.9963333333333,3
w13,16,64,6,3072,2048,16,32,128,64,4,4,1053.7326666666668,3
w13,16,64,6,3072,2048,16,32,128,64,8,2,1053.4016666666666,3
w13,16,64,6,3072,2048,16,32,128,64,8,3,1053.508,3
w13,16,64,6,3072,2048,16,32,128,64,8,4,1053.5406666666668,3
w13,16,64,6,3072,2048,16,32,256,1,4,2,1055.3646666666666,3
w13,16,64,6,3072,2048,16,32,256,1,4,3,1051.3113333333333,3
w13,16,64,6,3072,2048,16,32,256,1,4,4,1051.3113333333333,3
w13,16,64,6,3072,2048,16,32,256,1,8,2,1055.4923333333334,3
w13,16,64,6,3072,2048,16,32,256,1,8,3,1052.1006666666665,3
w13,16,64,6,3072,2048,16,32,256,1,8,4,1052.2603333333334,3
w13,16,64,6,3072,2048,16,32,256,16,4,2,1055.3323333333335,3
w13,16,64,6,3072,2048,16,32,256,16,4,3,1053.3376666666666,3
w13,16,64,6,3072,2048,16,32,256,16,4,4,1052.7723333333333,3
w13,16,64,6,3072,2048,16,32,256,16,8,2,1055.1726666666666,3
w13,16,64,6,3072,2048,16,32,256,16,8,3,1053.839,3
w13,16,64,6,3072,2048,16,32,256,16,8,4,1053.295,3
w13,16,64,6,3072,2048,16,32,256,32,4,2,1053.2843333333333,3
w13,16,64,6,3072,2048,16,32,256,32,4,3,1053.519,3
w13,16,64,6,3072,2048,16,32,256,32,4,4,1054.3616666666667,3
w13,16,64,6,3072,2048,16,32,256,32,8,2,1054.0206666666666,3
w13,16,64,6,3072,2048,16,32,256,32,8,3,1053.1353333333334,3
w13,16,64,6,3072,2048,16,32,256,32,8,4,1053.892,3
w13,16,64,6,3072,2048,16,32,256,64,4,2,1053.6043333333334,3
w13,16,64,6,3072,2048,16,32,256,64,4,3,1054.5643333333333,3
w13,16,64,6,3072,2048,16,32,256,64,4,4,1054.8416666666667,3
w13,16,64,6,3072,2048,16,32,256,64,8,2,1054.0626666666667,3
w13,16,64,6,3072,2048,16,32,256,64,8,3,1054.6180000000002,3
w13,16,64,6,3072,2048,16,32,256,64,8,4,1055.215,3
w13,16,64,6,3072,2048,16,64,128,1,4,3,1054.063,3
w13,16,64,6,3072,2048,16,64,128,1,4,4,1052.026,3
w13,16,64,6,3072,2048,16,64,128,1,8,3,1055.0233333333333,3
w13,16,64,6,3072,2048,16,64,128,1,8,4,1052.4946666666667,3
w13,16,64,6,3072,2048,16,64,128,16,4,4,1053.135,3
w13,16,64,6,3072,2048,16,64,128,16,8,3,1055.2043333333334,3
w13,16,64,6,3072,2048,16,64,128,16,8,4,1053.0710000000001,3
w13,16,64,6,3072,2048,16,64,128,32,4,3,1053.1136666666666,3
w13,16,64,6,3072,2048,16,64,128,32,4,4,1053.8496666666667,3
w13,16,64,6,3072,2048,16,64,128,32,8,2,1055.3753333333334,3
w13,16,64,6,3072,2048,16,64,128,32,8,3,1054.0093333333334,3
w13,16,64,6,3072,2048,16,64,128,32,8,4,1052.8366666666668,3
w13,16,64,6,3072,2048,16,64,128,64,4,3,1053.7003333333332,3
w13,16,64,6,3072,2048,16,64,128,64,4,4,1053.999,3
w13,16,64,6,3072,2048,16,64,128,64,8,2,1055.407,3
w13,16,64,6,3072,2048,16,64,128,64,8,3,1052.847,3
w13,16,64,6,3072,2048,16,64,128,64,8,4,1053.5293333333334,3
w13,16,64,6,3072,2048,16,64,256,1,4,3,1051.2046666666668,3
w13,16,64,6,3072,2048,16,64,256,1,8,3,1051.407,3
w13,16,64,6,3072,2048,16,64,256,16,4,2,1054.9913333333334,3
w13,16,64,6,3072,2048,16,64,256,16,4,3,1053.039,3
w13,16,64,6,3072,2048,16,64,256,16,8,2,1054.106,3
w13,16,64,6,3072,2048,16,64,256,16,8,3,1052.6976666666667,3
w13,16,64,6,3072,2048,16,64,256,32,4,2,1053.8283333333334,3
w13,16,64,6,3072,2048,16,64,256,32,4,3,1053.4443333333334,3
w13,16,64,6,3072,2048,16,64,256,32,8,2,1053.679,3
w13,16,64,6,3072,2048,16,64,256,32,8,3,1053.3163333333332,3
w13,16,64,6,3072,2048,16,64,256,64,4,2,1053.946,3
w13,16,64,6,3072,2048,16,64,256,64,4,3,1054.0203333333332,3
w13,16,64,6,3072,2048,16,64,256,64,8,2,1052.463,3
w13,16,64,6,3072,2048,16,64,256,64,8,3,1053.711,3
w13,16,64,6,3072,2048,16,128,128,1,4,3,1055.044,3
w13,16,64,6,3072,2048,16,128,128,1,8,3,1054.3723333333335,3
w13,16,64,6,3072,2048,16,128,128,16,4,3,1055.7163333333335,3
w13,16,64,6,3072,2048,16,128,128,16,8,3,1054.735,3
w13,16,64,6,3072,2048,16,128,128,32,4,2,1054.7346666666665,3
w13,16,64,6,3072,2048,16,128,128,32,4,3,1055.0546666666667,3
w13,16,64,6,3072,2048,16,128,128,32,8,2,1056.0153333333333,3
w13,16,64,6,3072,2048,16,128,128,32,8,3,1053.2523333333331,3
w13,16,64,6,3072,2048,16,128,128,64,4,2,1056.0473333333332,3
w13,16,64,6,3072,2048,16,128,128,64,4,3,1053.946,3
w13,16,64,6,3072,2048,16,128,128,64,8,2,1054.3723333333335,3
w13,16,64,6,3072,2048,16,128,128,64,8,3,1053.3696666666667,3
w13,16,64,6,3072,2048,32,16,128,4,4,3,1051.7803333333334,3
w13,16,64,6,3072,2048,32,16,128,4,4,4,1051.5559999999998,3
w13,16,64,6,3072,2048,32,16,128,4,8,3,1053.1993333333332,3
w13,16,64,6,3072,2048,32,16,128,4,8,4,1053.5510000000002,3
w13,16,64,6,3072,2048,32,32,64,64,4,3,1055.7913333333333,3
w13,16,64,6,3072,2048,32,32,64,128,4,3,1055.6096666666667,3
w13,16,64,6,3072,2048,32,32,128,1,4,2,1053.6683333333333,3
w13,16,64,6,3072,2048,32,32,128,1,4,3,1053.4866666666667,3
w13,16,64,6,3072,2048,32,32,128,1,4,4,1052.1963333333333,3
w13,16,64,6,3072,2048,32,32,128,1,8,2,1054.0416666666667,3
w13,16,64,6,3072,2048,32,32,128,1,8,3,1054.5433333333333,3
w13,16,64,6,3072,2048,32,32,128,1,8,4,1052.8149999999998,3
w13,16,64,6,3072,2048,32,32,128,4,4,3,1053.679,3
w13,16,64,6,3072,2048,32,32,128,4,4,4,1055.0763333333334,3
w13,16,64,6,3072,2048,32,32,128,4,8,3,1054.895,3
w13,16,64,6,3072,2048,32,32,128,4,8,4,1054.8203333333333,3
w13,16,64,6,3072,2048,32,32,128,16,4,2,1054.3403333333333,3
w13,16,64,6,3072,2048,32,32,128,16,4,3,1053.0496666666668,3
w13,16,64,6,3072,2048,32,32,128,16,4,4,1053.5513333333333,3
w13,16,64,6,3072,2048,32,32,128,16,8,2,1054.3723333333335,3
w13,16,64,6,3072,2048,32,32,128,16,8,3,1053.8816666666667,3
w13,16,64,6,3072,2048,32,32,128,16,8,4,1054.0096666666666,3
w13,16,64,6,3072,2048,32,32,128,64,4,2,1053.263,3
w13,16,64,6,3072,2048,32,32,128,64,4,3,1053.978,3
w13,16,64,6,3072,2048,32,32,128,64,4,4,1054.3190000000002,3
w13,16,64,6,3072,2048,32,32,128,64,8,2,1053.8926666666666,3
w13,16,64,6,3072,2048,32,32,128,64,8,3,1053.9456666666667,3
w13,16,64,6,3072,2048,32,32,128,64,8,4,1054.2016666666666,3
w13,16,64,6,3072,2048,32,32,256,1,4,2,1053.7533333333333,3
w13,16,64,6,3072,2048,32,32,256,1,4,3,1051.258,3
w13,16,64,6,3072,2048,32,32,256,1,4,4,1051.2683333333332,3
w13,16,64,6,3072,2048,32,32,256,1,8,2,1052.559,3
w13,16,64,6,3072,2048,32,32,256,1,8,3,1051.3853333333334,3
w13,16,64,6,3072,2048,32,32,256,1,8,4,1051.2896666666668,3
w13,16,64,6,3072,2048,32,32,256,4,4,2,1052.7079999999999,3
w13,16,64,6,3072,2048,32,32,256,4,4,3,1051.61,3
w13,16,64,6,3072,2048,32,32,256,4,4,4,1052.026,3
w13,16,64,6,3072,2048,32,32,256,4,8,2,1052.6016666666667,3
w13,16,64,6,3072,2048,32,32,256,4,8,3,1051.5566666666666,3
w13,16,64,6,3072,2048,32,32,256,4,8,4,1051.9083333333335,3
w13,16,64,6,3072,2048,32,32,256,16,4,2,1052.943,3
w13,16,64,6,3072,2048,32,32,256,16,4,3,1052.5483333333334,3
w13,16,64,6,3072,2048,32,32,256,16,4,4,1053.7749999999999,3
w13,16,64,6,3072,2048,32,32,256,16,8,2,1052.9856666666667,3
w13,16,64,6,3072,2048,32,32,256,16,8,3,1052.9003333333333,3
w13,16,64,6,3072,2048,32,32,256,16,8,4,1053.5723333333333,3
w13,16,64,6,3072,2048,32,32,256,32,4,2,1052.858,3
w13,16,64,6,3072,2048,32,32,256,32,4,3,1053.5193333333334,3
w13,16,64,6,3072,2048,32,32,256,32,4,4,1054.2763333333335,3
w13,16,64,6,3072,2048,32,32,256,32,8,2,1052.559,3
w13,16,64,6,3072,2048,32,32,256,32,8,3,1054.0629999999999,3
w13,16,64,6,3072,2048,32,32,256,32,8,4,1054.4363333333333,3
w13,16,64,6,3072,2048,32,64,128,1,4,3,1053.7753333333333,3
w13,16,64,6,3072,2048,32,64,128,1,4,4,1052.6229999999998,3
w13,16,64,6,3072,2048,32,64,128,1,8,3,1055.4176666666667,3
w13,16,64,6,3072,2048,32,64,128,1,8,4,1053.3059999999998,3
w13,16,64,6,3072,2048,32,64,128,4,4,3,1055.7483333333332,3
w13,16,64,6,3072,2048,32,64,128,4,4,4,1053.071,3
w13,16,64,6,3072,2048,32,64,128,4,8,4,1053.8286666666665,3
w13,16,64,6,3072,2048,32,64,128,16,4,4,1054.191,3
w13,16,64,6,3072,2048,32,64,128,16,8,4,1053.338,3
w13,16,64,6,3072,2048,32,64,128,32,4,3,1054.543,3
w13,16,64,6,3072,2048,32,64,128,32,4,4,1053.7966666666669,3
w13,16,64,6,3072,2048,32,64,128,32,8,2,1055.6953333333333,3
w13,16,64,6,3072,2048,32,64,128,32,8,3,1053.7963333333335,3
w13,16,64,6,3072,2048,32,64,128,32,8,4,1054.3083333333334,3
w13,16,64,6,3072,2048,32,64,128,64,4,3,1053.498,3
w13,16,64,6,3072,2048,32,64,128,64,4,4,1054.1273333333331,3
w13,16,64,6,3072,2048,32,64,128,64,8,3,1054.1376666666667,3
w13,16,64,6,3072,2048,32,64,128,64,8,4,1054.2016666666666,3
w13,16,64,6,3072,2048,32,64,256,1,4,2,1055.247,3
w13,16,64,6,3072,2048,32,64,256,1,4,3,1052.0043333333333,3
w13,16,64,6,3072,2048,32,64,256,1,8,2,1053.818,3
w13,16,64,6,3072,2048,32,64,256,1,8,3,1052.0363333333332,3
w13,16,64,6,3072,2048,32,64,256,8,4,2,1054.607,3
w13,16,64,6,3072,2048,32,64,256,8,4,3,1053.3273333333334,3
w13,16,64,6,3072,2048,32,64,256,8,8,2,1054.3513333333333,3
w13,16,64,6,3072,2048,32,64,256,8,8,3,1053.263,3
w13,16,64,6,3072,2048,32,64,256,16,4,2,1055.2473333333335,3
w13,16,64,6,3072,2048,32,64,256,16,4,3,1053.5936666666666,3
w13,16,64,6,3072,2048,32,64,256,16,8,2,1054.607,3
w13,16,64,6,3072,2048,32,64,256,16,8,3,1053.3376666666666,3
w13,16,64,6,3072,2048,32,64,256,32,4,2,1054.1806666666666,3
w13,16,64,6,3072,2048,32,64,256,32,4,3,1054.4366666666667,3
w13,16,64,6,3072,2048,32,64,256,32,8,2,1053.4336666666668,3
w13,16,64,6,3072,2048,32,64,256,32,8,3,1053.7856666666667,3
w13,16,64,6,3072,2048,32,64,256,64,4,2,1054.9379999999999,3
w13,16,64,6,3072,2048,32,64,256,64,4,3,1054.1483333333333,3
w13,16,64,6,3072,2048,32,64,256,64,8,2,1052.9750000000001,3
w13,16,64,6,3072,2048,32,64,256,64,8,3,1054.4363333333333,3
w13,16,64,6,3072,2048,32,128,128,1,8,3,1055.2573333333332,3
w13,16,64,6,3072,2048,32,128,128,8,4,3,1055.6096666666665,3
w13,16,64,6,3072,2048,32,128,128,8,8,3,1055.055,3
w13,16,64,6,3072,2048,32,128,128,32,4,3,1054.9486666666667,3
w13,16,64,6,3072,2048,32,128,128,32,8,3,1054.6283333333333,3
w13,16,64,6,3072,2048,32,128,128,64,4,3,1054.1696666666667,3
w13,16,64,6,3072,2048,32,128,128,64,8,3,1052.826,3
w13,16,64,6,3072,2048,64,32,128,1,4,3,1053.0706666666667,3
w13,16,64,6,3072,2048,64,32,128,1,4,4,1055.3326666666665,3
w13,16,64,6,3072,2048,64,32,128,1,8,2,1055.653,3
w13,16,64,6,3072,2048,64,32,128,1,8,3,1052.73,3
w13,16,64,6,3072,2048,64,32,128,1,8,4,1055.2363333333333,3
w13,16,64,6,3072,2048,64,32,128,16,4,3,1053.7853333333333,3
w13,16,64,6,3072,2048,64,32,128,16,8,3,1053.893,3
w13,16,64,6,3072,2048,64,32,256,1,4,2,1053.1996666666666,3
w13,16,64,6,3072,2048,64,32,256,1,4,3,1052.8153333333332,3
w13,16,64,6,3072,2048,64,32,256,1,8,2,1053.0710000000001,3
w13,16,64,6,3072,2048,64,32,256,1,8,3,1052.741,3
w13,16,64,6,3072,2048,64,64,128,1,4,3,1054.4579999999999,3
w13,16,64,6,3072,2048,64,64,128,1,4,4,1053.3913333333333,3
w13,16,64,6,3072,2048,64,64,128,1,8,3,1054.981,3
w13,16,64,6,3072,2048,64,64,128,1,8,4,1053.9669999999999,3
w13,16,64,6,3072,2048,64,64,128,4,4,4,1054.9063333333334,3
w13,16,64,6,3072,2048,64,64,128,4,8,3,1055.461,3
w13,16,64,6,3072,2048,64,64,128,4,8,4,1055.8013333333333,3
w13,16,64,6,3072,2048,64,64,128,8,4,3,1053.988,3
w13,16,64,6,3072,2048,64,64,128,8,4,4,1054.7783333333334,3
w13,16,64,6,3072,2048,64,64,128,8,8,2,1055.6736666666666,3
w13,16,64,6,3072,2048,64,64,128,8,8,3,1054.1383333333333,3
w13,16,64,6,3072,2048,64,64,128,8,8,4,1054.1373333333333,3
w13,16,64,6,3072,2048,64,64,128,16,4,3,1054.5536666666667,3
w13,16,64,6,3072,2048,64,64,128,16,4,4,1055.0873333333332,3
w13,16,64,6,3072,2048,64,64,128,16,8,3,1053.9026666666666,3
w13,16,64,6,3072,2048,64,64,128,16,8,4,1054.5223333333333,3
w13,16,64,6,3072,2048,64,64,128,32,4,3,1053.989,3
w13,16,64,6,3072,2048,64,64,128,32,4,4,1054.6813333333332,3
w13,16,64,6,3072,2048,64,64,128,32,8,3,1053.9669999999999,3
w13,16,64,6,3072,2048,64,64,128,32,8,4,1055.2156666666667,3
w13,16,64,6,3072,2048,64,64,128,64,4,3,1055.653,3
w13,16,64,6,3072,2048,64,64,128,64,4,4,1055.631,3
w13,16,64,6,3072,2048,64,64,128,64,8,3,1055.6733333333334,3
w13,16,64,6,3072,2048,64,128,128,64,8,3,1055.7063333333333,3
w13,16,64,6,3584,1536,16,16,64,1,4,3,922.574,3
w13,16,64,6,3584,1536,16,16,64,1,4,4,923.3846666666667,3
w13,16,64,6,3584,1536,16,16,128,1,4,2,920.3870000000001,3
w13,16,64,6,3584,1536,16,16,128,1,4,3,923.043,3
w13,16,64,6,3584,1536,16,16,128,1,4,4,921.3473333333333,3
w13,16,64,6,3584,1536,16,16,128,1,8,2,921.091,3
w13,16,64,6,3584,1536,16,16,128,4,4,2,921.4116666666667,3
w13,16,64,6,3584,1536,16,16,128,4,4,4,920.899,3
w13,16,64,6,3584,1536,16,16,128,4,8,2,922.0406666666667,3
w13,16,64,6,3584,1536,16,16,256,1,4,2,922.3923333333333,3
w13,16,64,6,3584,1536,16,16,256,1,4,3,919.7793333333333,3
w13,16,64,6,3584,1536,16,16,256,1,4,4,920.6323333333333,3
w13,16,64,6,3584,1536,16,16,256,1,8,2,922.9793333333333,3
w13,16,64,6,3584,1536,16,16,256,1,8,3,921.87,3
w13,16,64,6,3584,1536,16,16,256,1,8,4,921.9446666666666,3
w13,16,64,6,3584,1536,16,16,256,4,4,3,919.9499999999999,3
w13,16,64,6,3584,1536,16,16,256,4,4,4,920.6643333333333,3
w13,16,64,6,3584,1536,16,16,256,4,8,3,921.486,3
w13,16,64,6,3584,1536,16,16,256,4,8,4,922.158,3
w13,16,64,6,3584,1536,16,32,64,16,4,3,923.3736666666667,3
w13,16,64,6,3584,1536,16,32,128,1,4,2,919.694,3
w13,16,64,6,3584,1536,16,32,128,1,4,3,921.5496666666667,3
w13,16,64,6,3584,1536,16,32,128,1,4,4,920.2913333333332,3
w13,16,64,6,3584,1536,16,32,128,1,8,2,920.8243333333334,3
w13,16,64,6,3584,1536,16,32,128,1,8,4,922.659,3
w13,16,64,6,3584,1536,16,32,128,4,4,2,920.2379999999999,3
w13,16,64,6,3584,1536,16,32,128,4,4,3,921.0483333333333,3
w13,16,64,6,3584,1536,16,32,128,4,4,4,920.739,3
w13,16,64,6,3584,1536,16,32,128,4,8,2,920.4303333333334,3
w13,16,64,6,3584,1536,16,32,128,4,8,4,921.7420000000001,3
w13,16,64,6,3584,1536,16,32,128,16,4,2,920.782,3
w13,16,64,6,3584,1536,16,32,128,16,4,3,922.8406666666666,3
w13,16,64,6,3584,1536,16,32,128,16,4,4,921.0166666666668,3
w13,16,64,6,3584,1536,16,32,128,16,8,2,922.4356666666666,3
w13,16,64,6,3584,1536,16,32,128,16,8,4,922.1793333333334,3
w13,16,64,6,3584,1536,16,32,128,32,4,2,921.8163333333333,3
w13,16,64,6,3584,1536,16,32,128,32,4,4,922.8939999999999,3
w13,16,64,6,3584,1536,16,32,128,32,8,2,921.5603333333333,3
w13,16,64,6,3584,1536,16,32,128,32,8,4,922.6063333333333,3
w13,16,64,6,3584,1536,16,32,128,64,4,2,922.947,3
w13,16,64,6,3584,1536,16,32,128,64,8,4,923.2676666666666,3
w13,16,64,6,3584,1536,16,32,256,1,4,2,922.4353333333333,3
w13,16,64,6,3584,1536,16,32,256,1,4,3,920.899,3
w13,16,64,6,3584,1536,16,32,256,1,4,4,920.5793333333332,3
w13,16,64,6,3584,1536,16,32,256,1,8,3,922.0193333333333,3
w13,16,64,6,3584,1536,16,32,256,1,8,4,920.9203333333334,3
w13,16,64,6,3584,1536,16,32,256,16,4,3,920.889,3
w13,16,64,6,3584,1536,16,32,256,16,4,4,921.39,3
w13,16,64,6,3584,1536,16,32,256,16,8,3,921.7633333333333,3
w13,16,64,6,3584,1536,16,32,256,16,8,4,922.3923333333333,3
w13,16,64,6,3584,1536,16,32,256,32,4,3,921.7206666666666,3
w13,16,64,6,3584,1536,16,32,256,32,4,4,922.7019999999999,3
w13,16,64,6,3584,1536,16,32,256,32,8,3,923.0859999999999,3
w13,16,64,6,3584,1536,16,32,256,32,8,4,922.563,3
w13,16,64,6,3584,1536,16,32,256,64,4,3,922.382,3
w13,16,64,6,3584,1536,16,32,256,64,4,4,922.9363333333334,3
w13,16,64,6,3584,1536,16,32,256,64,8,4,922.937,3
w13,16,64,6,3584,1536,16,64,128,1,4,4,921.3896666666666,3
w13,16,64,6,3584,1536,16,64,128,1,8,4,920.7286666666665,3
w13,16,64,6,3584,1536,16,64,128,16,4,4,921.4540000000001,3
w13,16,64,6,3584,1536,16,64,128,16,8,4,921.422,3
w13,16,64,6,3584,1536,16,64,128,32,4,4,922.3073333333333,3
w13,16,64,6,3584,1536,16,64,128,32,8,4,922.4353333333333,3
w13,16,64,6,3584,1536,16,64,128,64,8,4,921.9553333333333,3
w13,16,64,6,3584,1536,16,64,256,1,4,3,920.9523333333333,3
w13,16,64,6,3584,1536,16,64,256,1,8,3,920.9636666666667,3
w13,16,64,6,3584,1536,16,64,256,16,4,3,921.4113333333333,3
w13,16,64,6,3584,1536,16,64,256,16,8,3,921.1016666666666,3
w13,16,64,6,3584,1536,16,64,256,32,4,3,922.8193333333334,3
w13,16,64,6,3584,1536,16,64,256,32,8,3,922.7980000000001,3
w13,16,64,6,3584,1536,16,64,256,64,4,3,923.2463333333334,3
w13,16,64,6,3584,1536,32,16,128,4,4,2,922.2966666666667,3
w13,16,64,6,3584,1536,32,16,128,4,4,3,920.2056666666667,3
w13,16,64,6,3584,1536,32,16,128,4,4,4,921.4966666666666,3
w13,16,64,6,3584,1536,32,16,128,4,8,2,922.5523333333334,3
w13,16,64,6,3584,1536,32,16,128,4,8,4,923.0856666666667,3
w13,16,64,6,3584,1536,32,32,64,1,8,3,923.2246666666666,3
w13,16,64,6,3584,1536,32,32,128,1,4,2,920.2806666666667,3
w13,16,64,6,3584,1536,32,32,128,1,4,3,920.366,3
w13,16,64,6,3584,1536,32,32,128,1,4,4,922.4883333333333,3
w13,16,64,6,3584,1536,32,32,128,1,8,2,921.4646666666667,3
w13,16,64,6,3584,1536,32,32,128,1,8,3,920.451,3
w13,16,64,6,3584,1536,32,32,128,1,8,4,922.6056666666667,3
w13,16,64,6,3584,1536,32,32,128,4,4,2,920.227,3
w13,16,64,6,3584,1536,32,32,128,4,4,3,920.7286666666665,3
w13,16,64,6,3584,1536,32,32,128,4,4,4,921.2086666666668,3
w13,16,64,6,3584,1536,32,32,128,4,8,2,920.9313333333333,3
w13,16,64,6,3584,1536,32,32,128,4,8,3,920.4833333333332,3
w13,16,64,6,3584,1536,32,32,128,4,8,4,922.3926666666666,3
w13,16,64,6,3584,1536,32,32,128,16,4,2,922.073,3
w13,16,64,6,3584,1536,32,32,128,16,4,3,920.739,3
w13,16,64,6,3584,1536,32,32,128,16,4,4,922.4883333333333,3
w13,16,64,6,3584,1536,32,32,128,16,8,2,921.4646666666667,3
w13,16,64,6,3584,1536,32,32,128,16,8,3,920.6003333333333,3
w13,16,64,6,3584,1536,32,32,128,16,8,4,922.265,3
w13,16,64,6,3584,1536,32,32,128,64,4,3,921.721,3
w13,16,64,6,3584,1536,32,32,128,64,8,3,921.9446666666666,3
w13,16,64,6,3584,1536,32,32,256,1,4,2,918.8299999999999,3
w13,16,64,6,3584,1536,32,32,256,1,4,3,920.398,3
w13,16,64,6,3584,1536,32,32,256,1,4,4,920.643,3
w13,16,64,6,3584,1536,32,32,256,1,8,2,920.601,3
w13,16,64,6,3584,1536,32,32,256,1,8,3,921.2836666666667,3
w13,16,64,6,3584,1536,32,32,256,1,8,4,920.803,3
w13,16,64,6,3584,1536,32,32,256,4,4,2,920.942,3
w13,16,64,6,3584,1536,32,32,256,4,4,3,920.505,3
w13,16,64,6,3584,1536,32,32,256,4,4,4,920.5256666666668,3
w13,16,64,6,3584,1536,32,32,256,4,8,2,920.8356666666667,3
w13,16,64,6,3584,1536,32,32,256,4,8,3,920.8243333333334,3
w13,16,64,6,3584,1536,32,32,256,4,8,4,921.3366666666667,3
w13,16,64,6,3584,1536,32,32,256,16,4,2,920.4403333333333,3
w13,16,64,6,3584,1536,32,32,256,16,4,3,921.102,3
w13,16,64,6,3584,1536,32,32,256,16,4,4,922.1686666666666,3
w13,16,64,6,3584,1536,32,32,256,16,8,2,920.0993333333332,3
w13,16,64,6,3584,1536,32,32,256,16,8,3,921.5393333333333,3
w13,16,64,6,3584,1536,32,32,256,16,8,4,921.9443333333334,3
w13,16,64,6,3584,1536,32,32,256,32,4,2,921.4756666666667,3
w13,16,64,6,3584,1536,32,32,256,32,4,3,922.5949999999999,3
w13,16,64,6,3584,1536,32,32,256,32,4,4,923.2993333333334,3
w13,16,64,6,3584,1536,32,32,256,32,8,2,921.4963333333334,3
w13,16,64,6,3584,1536,32,32,256,32,8,3,922.5526666666666,3
w13,16,64,6,3584,1536,32,32,256,32,8,4,922.7553333333334,3
w13,16,64,6,3584,1536,32,64,128,1,4,4,921.6886666666666,3
w13,16,64,6,3584,1536,32,64,128,1,8,4,921.273,3
w13,16,64,6,3584,1536,32,64,128,4,4,4,921.3263333333333,3
w13,16,64,6,3584,1536,32,64,128,4,8,4,920.9203333333334,3
w13,16,64,6,3584,1536,32,64,128,16,4,4,922.1046666666666,3
w13,16,64,6,3584,1536,32,64,128,16,8,4,921.497,3
w13,16,64,6,3584,1536,32,64,128,32,4,4,923.0970000000001,3
w13,16,64,6,3584,1536,32,64,128,32,8,4,922.627,3
w13,16,64,6,3584,1536,32,64,128,64,8,4,922.4036666666667,3
w13,16,64,6,3584,1536,32,64,256,1,4,3,922.5206666666667,3
w13,16,64,6,3584,1536,32,64,256,1,8,3,921.859,3
w13,16,64,6,3584,1536,32,64,256,8,4,3,922.5096666666667,3
w13,16,64,6,3584,1536,32,64,256,8,8,3,921.283,3
w13,16,64,6,3584,1536,32,64,256,16,4,3,922.7766666666666,3
w13,16,64,6,3584,1536,32,64,256,16,8,3,921.9230000000001,3
w13,16,64,6,3584,1536,32,64,256,32,4,3,923.3203333333335,3
w13,16,64,6,3584,1536,32,64,256,32,8,3,923.0749999999999,3
w13,16,64,6,3584,1536,32,64,256,64,4,3,923.299,3
w13,16,64,6,3584,1536,64,32,128,1,4,3,922.9789999999999,3
w13,16,64,6,3584,1536,64,32,128,1,8,3,922.926,3
w13,16,64,6,3584,1536,64,32,128,1,8,4,923.0966666666667,3
w13,16,64,6,3584,1536,64,32,128,16,4,3,923.4273333333334,3
w13,16,64,6,3584,1536,64,32,256,1,4,3,922.8939999999999,3
w13,16,64,6,3584,1536,64,32,256,1,8,3,921.7416666666667,3
w13,16,64,6,3584,1536,64,64,128,1,8,3,922.5630000000001,3
w13,16,64,6,3584,1536,64,64,128,1,8,4,923.2886666666667,3
w13,16,64,6,3584,1536,64,64,128,4,4,3,923.2669999999999,3
w13,16,64,6,3584,1536,64,64,128,4,4,4,922.3713333333334,3
w13,16,64,6,3584,1536,64,64,128,4,8,3,922.6916666666666,3
w13,16,64,6,3584,1536,64,64,128,4,8,4,923.0219999999999,3
w13,16,64,6,3584,1536,64,64,128,8,4,3,923.3846666666667,3
w13,16,64,6,3584,1536,64,64,128,8,4,4,922.4989999999999,3
w13,16,64,6,3584,1536,64,64,128,8,8,4,922.969,3
w13,16,64,8,3584,2560,16,16,64,1,4,3,1535.943,3
w13,16,64,8,3584,2560,16,16,64,1,4,4,1537.8406666666667,3
w13,16,64,8,3584,2560,16,16,128,1,4,2,1532.7316666666666,3
w13,16,64,8,3584,2560,16,16,128,1,4,3,1532.3483333333334,3
w13,16,64,8,3584,2560,16,16,128,1,4,4,1533.3826666666666,3
w13,16,64,8,3584,2560,16,16,128,1,8,3,1534.8656666666666,3
w13,16,64,8,3584,2560,16,16,128,1,8,4,1535.5690000000002,3
w13,16,64,8,3584,2560,16,16,128,4,4,2,1534.012,3
w13,16,64,8,3584,2560,16,16,128,4,4,3,1533.3609999999999,3
w13,16,64,8,3584,2560,16,16,128,4,4,4,1533.1163333333334,3
w13,16,64,8,3584,2560,16,16,128,4,8,3,1534.0763333333334,3
w13,16,64,8,3584,2560,16,16,128,4,8,4,1537.0303333333334,3
w13,16,64,8,3584,2560,16,16,256,1,4,2,1533.9803333333332,3
w13,16,64,8,3584,2560,16,16,256,1,4,3,1532.0173333333332,3
w13,16,64,8,3584,2560,16,16,256,1,4,4,1532.4976666666669,3
w13,16,64,8,3584,2560,16,16,256,1,8,2,1535.6539999999998,3
w13,16,64,8,3584,2560,16,16,256,1,8,3,1535.2923333333335,3
w13,16,64,8,3584,2560,16,16,256,1,8,4,1533.6380000000001,3
w13,16,64,8,3584,2560,16,16,256,4,4,2,1532.9456666666665,3
w13,16,64,8,3584,2560,16,16,256,4,4,3,1532.07,3
w13,16,64,8,3584,2560,16,16,256,4,4,4,1532.9243333333334,3
w13,16,64,8,3584,2560,16,16,256,4,8,2,1536.5073333333332,3
w13,16,64,8,3584,2560,16,16,256,4,8,3,1533.8843333333334,3
w13,16,64,8,3584,2560,16,16,256,4,8,4,1533.0726666666667,3
w13,16,64,8,3584,2560,16,32,64,1,4,3,1537.2219999999998,3
w13,16,64,8,3584,2560,16,32,64,32,4,3,1538.7056666666667,3
w13,16,64,8,3584,2560,16,32,128,1,4,2,1534.204,3
w13,16,64,8,3584,2560,16,32,128,1,4,3,1532.1663333333333,3
w13,16,64,8,3584,2560,16,32,128,1,4,4,1532.7430000000002,3
w13,16,64,8,3584,2560,16,32,128,1,8,2,1532.2623333333333,3
w13,16,64,8,3584,2560,16,32,128,1,8,3,1533.2763333333332,3
w13,16,64,8,3584,2560,16,32,128,1,8,4,1534.9393333333335,3
w13,16,64,8,3584,2560,16,32,128,4,4,2,1534.4813333333332,3
w13,16,64,8,3584,2560,16,32,128,4,4,3,1533.5953333333334,3
w13,16,64,8,3584,2560,16,32,128,4,4,4,1533.1483333333333,3
w13,16,64,8,3584,2560,16,32,128,4,8,2,1534.1713333333335,3
w13,16,64,8,3584,2560,16,32,128,4,8,3,1534.4283333333333,3
w13,16,64,8,3584,2560,16,32,128,4,8,4,1534.8966666666668,3
w13,16,64,8,3584,2560,16,32,128,16,4,2,1536.2416666666668,3
w13,16,64,8,3584,2560,16,32,128,16,4,3,1533.6383333333333,3
w13,16,64,8,3584,2560,16,32,128,16,4,4,1535.2169999999999,3
w13,16,64,8,3584,2560,16,32,128,16,8,2,1537.3296666666668,3
w13,16,64,8,3584,2560,16,32,128,16,8,3,1534.2886666666666,3
w13,16,64,8,3584,2560,16,32,128,16,8,4,1536.135,3
w13,16,64,8,3584,2560,16,32,128,32,4,2,1535.207,3
w13,16,64,8,3584,2560,16,32,128,32,4,3,1534.737,3
w13,16,64,8,3584,2560,16,32,128,32,4,4,1535.6226666666669,3
w13,16,64,8,3584,2560,16,32,128,32,8,2,1534.7686666666668,3
w13,16,64,8,3584,2560,16,32,128,32,8,3,1535.5910000000001,3
w13,16,64,8,3584,2560,16,32,128,32,8,4,1536.3473333333332,3
w13,16,64,8,3584,2560,16,32,128,64,4,2,1537.3403333333335,3
w13,16,64,8,3584,2560,16,32,128,64,4,3,1537.222,3
w13,16,64,8,3584,2560,16,32,128,64,4,4,1536.5829999999999,3
w13,16,64,8,3584,2560,16,32,128,64,8,2,1538.4273333333333,3
w13,16,64,8,3584,2560,16,32,128,64,8,3,1536.7216666666666,3
w13,16,64,8,3584,2560,16,32,128,64,8,4,1538.854,3
w13,16,64,8,3584,2560,16,32,256,1,4,2,1533.6603333333333,3
w13,16,64,8,3584,2560,16,32,256,1,4,3,1531.8886666666667,3
w13,16,64,8,3584,2560,16,32,256,1,4,4,1531.7830000000001,3
w13,16,64,8,3584,2560,16,32,256,1,8,2,1533.4353333333336,3
w13,16,64,8,3584,2560,16,32,256,1,8,3,1532.6683333333333,3
w13,16,64,8,3584,2560,16,32,256,1,8,4,1532.5713333333333,3
w13,16,64,8,3584,2560,16,32,256,16,4,2,1533.959,3
w13,16,64,8,3584,2560,16,32,256,16,4,3,1533.7133333333334,3
w13,16,64,8,3584,2560,16,32,256,16,4,4,1535.452,3
w13,16,64,8,3584,2560,16,32,256,16,8,2,1534.1293333333333,3
w13,16,64,8,3584,2560,16,32,256,16,8,3,1534.1936666666668,3
w13,16,64,8,3584,2560,16,32,256,16,8,4,1534.684,3
w13,16,64,8,3584,2560,16,32,256,32,4,2,1534.5126666666667,3
w13,16,64,8,3584,2560,16,32,256,32,4,3,1535.9323333333334,3
w13,16,64,8,3584,2560,16,32,256,32,4,4,1536.113,3
w13,16,64,8,3584,2560,16,32,256,32,8,2,1534.5233333333333,3
w13,16,64,8,3584,2560,16,32,256,32,8,3,1535.879,3
w13,16,64,8,3584,2560,16,32,256,32,8,4,1536.9660000000001,3
w13,16,64,8,3584,2560,16,32,256,64,4,2,1535.7723333333333,3
w13,16,64,8,3584,2560,16,32,256,64,4,3,1537.4036666666668,3
w13,16,64,8,3584,2560,16,32,256,64,4,4,1537.9376666666667,3
w13,16,64,8,3584,2560,16,32,256,64,8,2,1536.3793333333333,3
w13,16,64,8,3584,2560,16,32,256,64,8,3,1537.3713333333333,3
w13,16,64,8,3584,2560,16,32,256,64,8,4,1537.063,3
w13,16,64,8,3584,2560,16,64,64,1,4,3,1538.6410000000003,3
w13,16,64,8,3584,2560,16,64,128,1,4,2,1533.863,3
w13,16,64,8,3584,2560,16,64,128,1,4,3,1532.2623333333333,3
w13,16,64,8,3584,2560,16,64,128,1,4,4,1533.3506666666665,3
w13,16,64,8,3584,2560,16,64,128,1,8,2,1534.3316666666667,3
w13,16,64,8,3584,2560,16,64,128,1,8,3,1532.3376666666666,3
w13,16,64,8,3584,2560,16,64,128,1,8,4,1533.2866666666666,3
w13,16,64,8,3584,2560,16,64,128,16,4,2,1536.455,3
w13,16,64,8,3584,2560,16,64,128,16,4,3,1534.7376666666667,3
w13,16,64,8,3584,2560,16,64,128,16,4,4,1535.1313333333335,3
w13,16,64,8,3584,2560,16,64,128,16,8,2,1535.836,3
w13,16,64,8,3584,2560,16,64,128,16,8,3,1535.143,3
w13,16,64,8,3584,2560,16,64,128,16,8,4,1535.792666666667,3
w13,16,64,8,3584,2560,16,64,128,32,4,2,1534.8763333333334,3
w13,16,64,8,3584,2560,16,64,128,32,4,3,1535.2166666666665,3
w13,16,64,8,3584,2560,16,64,128,32,4,4,1536.0706666666665,3
w13,16,64,8,3584,2560,16,64,128,32,8,2,1534.8976666666667,3
w13,16,64,8,3584,2560,16,64,128,32,8,3,1534.256666666667,3
w13,16,64,8,3584,2560,16,64,128,32,8,4,1537.735,3
w13,16,64,8,3584,2560,16,64,128,64,4,3,1535.8679999999997,3
w13,16,64,8,3584,2560,16,64,128,64,8,3,1535.6970000000001,3
w13,16,64,8,3584,2560,16,64,128,64,8,4,1537.8519999999999,3
w13,16,64,8,3584,2560,16,64,256,1,4,2,1534.9186666666667,3
w13,16,64,8,3584,2560,16,64,256,1,4,3,1531.985,3
w13,16,64,8,3584,2560,16,64,256,1,8,2,1532.6143333333332,3
w13,16,64,8,3584,2560,16,64,256,1,8,3,1532.7963333333335,3
w13,16,64,8,3584,2560,16,64,256,16,4,2,1534.47,3
w13,16,64,8,3584,2560,16,64,256,16,4,3,1533.9163333333333,3
w13,16,64,8,3584,2560,16,64,256,16,8,2,1534.076,3
w13,16,64,8,3584,2560,16,64,256,16,8,3,1534.3633333333335,3
w13,16,64,8,3584,2560,16,64,256,32,4,2,1534.5243333333335,3
w13,16,64,8,3584,2560,16,64,256,32,4,3,1535.814,3
w13,16,64,8,3584,2560,16,64,256,32,8,2,1534.1509999999998,3
w13,16,64,8,3584,2560,16,64,256,32,8,3,1535.1846666666668,3
w13,16,64,8,3584,2560,16,64,256,64,4,2,1537.2753333333333,3
w13,16,64,8,3584,2560,16,64,256,64,4,3,1537.4683333333332,3
w13,16,64,8,3584,2560,16,64,256,64,8,2,1535.5473333333332,3
w13,16,64,8,3584,2560,16,64,256,64,8,3,1537.137,3
w13,16,64,8,3584,2560,16,128,64,1,8,4,1538.4170000000001,3
w13,16,64,8,3584,2560,16,128,128,1,4,2,1532.4440000000002,3
w13,16,64,8,3584,2560,16,128,128,1,4,3,1532.9236666666666,3
w13,16,64,8,3584,2560,16,128,128,1,8,2,1532.7003333333334,3
w13,16,64,8,3584,2560,16,128,128,1,8,3,1531.9963333333333,3
w13,16,64,8,3584,2560,16,128,128,16,4,2,1536.3046666666667,3
w13,16,64,8,3584,2560,16,128,128,16,4,3,1533.7456666666667,3
w13,16,64,8,3584,2560,16,128,128,16,8,2,1535.3023333333333,3
w13,16,64,8,3584,2560,16,128,128,16,8,3,1533.9693333333335,3
w13,16,64,8,3584,2560,16,128,128,32,4,2,1534.407,3
w13,16,64,8,3584,2560,16,128,128,32,4,3,1533.9373333333333,3
w13,16,64,8,3584,2560,16,128,128,32,8,2,1533.9483333333335,3
w13,16,64,8,3584,2560,16,128,128,32,8,3,1534.0646666666664,3
w13,16,64,8,3584,2560,16,128,128,64,4,2,1536.9023333333334,3
w13,16,64,8,3584,2560,16,128,128,64,4,3,1536.0496666666668,3
w13,16,64,8,3584,2560,16,128,128,64,8,2,1536.4219999999998,3
w13,16,64,8,3584,2560,16,128,128,64,8,3,1534.5133333333333,3
w13,16,64,8,3584,2560,32,16,128,4,4,2,1533.0203333333332,3
w13,16,64,8,3584,2560,32,16,128,4,4,3,1533.4683333333332,3
w13,16,64,8,3584,2560,32,16,128,4,4,4,1532.9023333333334,3
w13,16,64,8,3584,2560,32,16,128,4,8,3,1535.8256666666666,3
w13,16,64,8,3584,2560,32,16,128,4,8,4,1535.2283333333332,3
w13,16,64,8,3584,2560,32,32,64,1,4,3,1536.9776666666667,3
w13,16,64,8,3584,2560,32,32,64,1,8,3,1536.8593333333336,3
w13,16,64,8,3584,2560,32,32,128,1,4,2,1532.8063333333332,3
w13,16,64,8,3584,2560,32,32,128,1,4,3,1534.183,3
w13,16,64,8,3584,2560,32,32,128,1,4,4,1534.0113333333331,3
w13,16,64,8,3584,2560,32,32,128,1,8,2,1532.0806666666667,3
w13,16,64,8,3584,2560,32,32,128,1,8,3,1535.4203333333335,3
w13,16,64,8,3584,2560,32,32,128,1,8,4,1535.8790000000001,3
w13,16,64,8,3584,2560,32,32,128,4,4,2,1534.791,3
w13,16,64,8,3584,2560,32,32,128,4,4,3,1535.0043333333333,3
w13,16,64,8,3584,2560,32,32,128,4,4,4,1534.6736666666668,3
w13,16,64,8,3584,2560,32,32,128,4,8,2,1535.1853333333336,3
w13,16,64,8,3584,2560,32,32,128,4,8,3,1536.5076666666666,3
w13,16,64,8,3584,2560,32,32,128,4,8,4,1535.6223333333335,3
w13,16,64,8,3584,2560,32,32,128,16,4,2,1535.1856666666665,3
w13,16,64,8,3584,2560,32,32,128,16,4,3,1535.4203333333335,3
w13,16,64,8,3584,2560,32,32,128,16,4,4,1536.4006666666667,3
w13,16,64,8,3584,2560,32,32,128,16,8,2,1536.8063333333332,3
w13,16,64,8,3584,2560,32,32,128,16,8,3,1536.5296666666666,3
w13,16,64,8,3584,2560,32,32,128,16,8,4,1536.6683333333333,3
w13,16,64,8,3584,2560,32,32,128,64,4,3,1538.5873333333336,3
w13,16,64,8,3584,2560,32,32,128,64,4,4,1537.7773333333334,3
w13,16,64,8,3584,2560,32,32,128,64,8,3,1538.3536666666666,3
w13,16,64,8,3584,2560,32,32,128,64,8,4,1538.2466666666667,3
w13,16,64,8,3584,2560,32,32,256,1,4,2,1534.3633333333335,3
w13,16,64,8,3584,2560,32,32,256,1,4,3,1531.6653333333334,3
w13,16,64,8,3584,2560,32,32,256,1,4,4,1532.2306666666666,3
w13,16,64,8,3584,2560,32,32,256,1,8,2,1535.494,3
w13,16,64,8,3584,2560,32,32,256,1,8,3,1531.4516666666666,3
w13,16,64,8,3584,2560,32,32,256,1,8,4,1532.6363333333331,3
w13,16,64,8,3584,2560,32,32,256,4,4,2,1536.6896666666664,3
w13,16,64,8,3584,2560,32,32,256,4,4,3,1532.5296666666666,3
w13,16,64,8,3584,2560,32,32,256,4,4,4,1533.041,3
w13,16,64,8,3584,2560,32,32,256,4,8,2,1534.7803333333334,3
w13,16,64,8,3584,2560,32,32,256,4,8,3,1531.5056666666667,3
w13,16,64,8,3584,2560,32,32,256,4,8,4,1532.6033333333335,3
w13,16,64,8,3584,2560,32,32,256,16,4,2,1537.3286666666665,3
w13,16,64,8,3584,2560,32,32,256,16,4,3,1533.916,3
w13,16,64,8,3584,2560,32,32,256,16,4,4,1534.4283333333333,3
w13,16,64,8,3584,2560,32,32,256,16,8,2,1538.0653333333332,3
w13,16,64,8,3584,2560,32,32,256,16,8,3,1534.8006666666668,3
w13,16,64,8,3584,2560,32,32,256,16,8,4,1535.0893333333333,3
w13,16,64,8,3584,2560,32,32,256,32,4,2,1537.5536666666667,3
w13,16,64,8,3584,2560,32,32,256,32,4,3,1537.1583333333335,3
w13,16,64,8,3584,2560,32,32,256,32,4,4,1536.369,3
w13,16,64,8,3584,2560,32,32,256,32,8,2,1538.3003333333334,3
w13,16,64,8,3584,2560,32,32,256,32,8,3,1537.3826666666666,3
w13,16,64,8,3584,2560,32,32,256,32,8,4,1536.6566666666668,3
w13,16,64,8,3584,2560,32,64,128,1,4,2,1533.66,3
w13,16,64,8,3584,2560,32,64,128,1,4,3,1532.2736666666667,3
w13,16,64,8,3584,2560,32,64,128,1,4,4,1534.705,3
w13,16,64,8,3584,2560,32,64,128,1,8,2,1534.8646666666666,3
w13,16,64,8,3584,2560,32,64,128,1,8,3,1532.7316666666666,3
w13,16,64,8,3584,2560,32,64,128,1,8,4,1534.2576666666666,3
w13,16,64,8,3584,2560,32,64,128,4,4,2,1535.5046666666667,3
w13,16,64,8,3584,2560,32,64,128,4,4,3,1533.3609999999999,3
w13,16,64,8,3584,2560,32,64,128,4,4,4,1534.1613333333335,3
w13,16,64,8,3584,2560,32,64,128,4,8,2,1534.9616666666668,3
w13,16,64,8,3584,2560,32,64,128,4,8,3,1533.6066666666666,3
w13,16,64,8,3584,2560,32,64,128,4,8,4,1535.3126666666667,3
w13,16,64,8,3584,2560,32,64,128,16,4,2,1535.4516666666666,3
w13,16,64,8,3584,2560,32,64,128,16,4,3,1535.1323333333332,3
w13,16,64,8,3584,2560,32,64,128,16,4,4,1536.2516666666668,3
w13,16,64,8,3584,2560,32,64,128,16,8,2,1536.7633333333333,3
w13,16,64,8,3584,2560,32,64,128,16,8,3,1535.6226666666669,3
w13,16,64,8,3584,2560,32,64,128,16,8,4,1535.6326666666666,3
w13,16,64,8,3584,2560,32,64,128,32,4,2,1536.1553333333334,3
w13,16,64,8,3584,2560,32,64,128,32,4,3,1535.9003333333333,3
w13,16,64,8,3584,2560,32,64,128,32,4,4,1537.265666666667,3
w13,16,64,8,3584,2560,32,64,128,32,8,2,1535.1633333333332,3
w13,16,64,8,3584,2560,32,64,128,32,8,3,1534.865,3
w13,16,64,8,3584,2560,32,64,128,32,8,4,1537.607,3
w13,16,64,8,3584,2560,32,64,128,64,4,3,1537.2336666666667,3
w13,16,64,8,3584,2560,32,64,128,64,8,3,1537.052,3
w13,16,64,8,3584,2560,32,64,256,1,4,2,1532.8806666666667,3
w13,16,64,8,3584,2560,32,64,256,1,4,3,1533.1476666666667,3
w13,16,64,8,3584,2560,32,64,256,1,8,2,1533.5313333333334,3
w13,16,64,8,3584,2560,32,64,256,1,8,3,1532.4326666666666,3
w13,16,64,8,3584,2560,32,64,256,8,4,2,1533.6283333333333,3
w13,16,64,8,3584,2560,32,64,256,8,4,3,1534.8443333333332,3
w13,16,64,8,3584,2560,32,64,256,8,8,2,1533.639,3
w13,16,64,8,3584,2560,32,64,256,8,8,3,1533.6816666666666,3
w13,16,64,8,3584,2560,32,64,256,16,4,2,1535.8256666666666,3
w13,16,64,8,3584,2560,32,64,256,16,4,3,1534.8010000000002,3
w13,16,64,8,3584,2560,32,64,256,16,8,2,1533.5953333333334,3
w13,16,64,8,3584,2560,32,64,256,16,8,3,1534.737,3
w13,16,64,8,3584,2560,32,64,256,32,4,2,1534.4920000000002,3
w13,16,64,8,3584,2560,32,64,256,32,4,3,1536.4436666666668,3
w13,16,64,8,3584,2560,32,64,256,32,8,2,1534.3536666666666,3
w13,16,64,8,3584,2560,32,64,256,32,8,3,1536.2096666666666,3
w13,16,64,8,3584,2560,32,64,256,64,4,2,1536.668,3
w13,16,64,8,3584,2560,32,64,256,64,4,3,1538.023,3
w13,16,64,8,3584,2560,32,64,256,64,8,2,1536.2736666666667,3
w13,16,64,8,3584,2560,32,64,256,64,8,3,1537.8096666666668,3
w13,16,64,8,3584,2560,32,128,128,1,4,2,1532.7533333333333,3
w13,16,64,8,3584,2560,32,128,128,1,4,3,1532.3909999999998,3
w13,16,64,8,3584,2560,32,128,128,1,8,2,1532.7323333333334,3
w13,16,64,8,3584,2560,32,128,128,1,8,3,1531.9323333333334,3
w13,16,64,8,3584,2560,32,128,128,4,4,2,1534.375,3
w13,16,64,8,3584,2560,32,128,128,4,4,3,1534.3853333333334,3
w13,16,64,8,3584,2560,32,128,128,4,8,2,1533.8306666666667,3
w13,16,64,8,3584,2560,32,128,128,4,8,3,1533.1476666666667,3
w13,16,64,8,3584,2560,32,128,128,8,4,2,1535.2700000000002,3
w13,16,64,8,3584,2560,32,128,128,8,4,3,1533.638,3
w13,16,64,8,3584,2560,32,128,128,8,8,2,1533.5746666666666,3
w13,16,64,8,3584,2560,32,128,128,8,8,3,1533.7243333333333,3
w13,16,64,8,3584,2560,32,128,128,16,4,2,1536.1456666666666,3
w13,16,64,8,3584,2560,32,128,128,16,4,3,1535.4089999999999,3
w13,16,64,8,3584,2560,32,128,128,16,8,2,1535.559,3
w13,16,64,8,3584,2560,32,128,128,16,8,3,1534.7476666666669,3
w13,16,64,8,3584,2560,32,128,128,32,4,2,1535.2493333333332,3
w13,16,64,8,3584,2560,32,128,128,32,4,3,1534.6523333333334,3
w13,16,64,8,3584,2560,32,128,128,32,8,2,1536.166,3
w13,16,64,8,3584,2560,32,128,128,32,8,3,1534.3963333333334,3
w13,16,64,8,3584,2560,32,128,128,64,4,2,1537.8416666666665,3
w13,16,64,8,3584,2560,32,128,128,64,4,3,1538.535,3
w13,16,64,8,3584,2560,32,128,128,64,8,2,1537.3819999999998,3
w13,16,64,8,3584,2560,32,128,128,64,8,3,1536.1989999999998,3
w13,16,64,8,3584,2560,64,32,128,1,4,2,1533.1153333333332,3
w13,16,64,8,3584,2560,64,32,128,1,4,3,1535.0253333333333,3
w13,16,64,8,3584,2560,64,32,128,1,4,4,1536.9350000000002,3
w13,16,64,8,3584,2560,64,32,128,1,8,2,1533.3936666666668,3
w13,16,64,8,3584,2560,64,32,128,1,8,3,1535.9106666666667,3
w13,16,64,8,3584,2560,64,32,128,1,8,4,1535.1743333333334,3
w13,16,64,8,3584,2560,64,32,128,16,4,2,1538.6196666666667,3
w13,16,64,8,3584,2560,64,32,128,16,4,3,1537.9903333333332,3
w13,16,64,8,3584,2560,64,32,128,16,8,2,1537.7126666666666,3
w13,16,64,8,3584,2560,64,32,256,1,4,2,1536.2303333333336,3
w13,16,64,8,3584,2560,64,32,256,1,4,3,1534.5233333333333,3
w13,16,64,8,3584,2560,64,32,256,1,8,2,1536.1873333333333,3
w13,16,64,8,3584,2560,64,32,256,1,8,3,1533.0626666666667,3
w13,16,64,8,3584,2560,64,64,128,1,4,3,1534.887,3
w13,16,64,8,3584,2560,64,64,128,1,4,4,1536.732,3
w13,16,64,8,3584,2560,64,64,128,1,8,2,1533.8093333333334,3
w13,16,64,8,3584,2560,64,64,128,1,8,3,1536.198,3
w13,16,64,8,3584,2560,64,64,128,1,8,4,1536.358,3
w13,16,64,8,3584,2560,64,64,128,4,4,3,1536.6043333333334,3
w13,16,64,8,3584,2560,64,64,128,4,4,4,1537.735,3
w13,16,64,8,3584,2560,64,64,128,4,8,2,1535.6333333333332,3
w13,16,64,8,3584,2560,64,64,128,4,8,3,1536.6033333333332,3
w13,16,64,8,3584,2560,64,64,128,4,8,4,1537.8513333333333,3
w13,16,64,8,3584,2560,64,64,128,8,4,3,1535.5906666666667,3
w13,16,64,8,3584,2560,64,64,128,8,4,4,1537.5426666666665,3
w13,16,64,8,3584,2560,64,64,128,8,8,3,1536.423,3
w13,16,64,8,3584,2560,64,64,128,8,8,4,1537.7553333333333,3
w13,16,64,8,3584,2560,64,128,128,1,4,2,1534.640666666667,3
w13,16,64,8,3584,2560,64,128,128,1,8,2,1534.183,3
w13,16,64,8,3584,2560,64,128,128,1,8,3,1533.0203333333332,3
w13,16,64,8,3584,2560,64,128,128,4,4,2,1536.0276666666666,3
w13,16,64,8,3584,2560,64,128,128,4,8,2,1535.4833333333333,3
w13,16,64,8,3584,2560,64,128,128,4,8,3,1535.8253333333332,3
w13,16,64,8,3584,2560,64,128,128,16,4,2,1536.326,3
w13,16,64,8,3584,2560,64,128,128,16,8,2,1537.6816666666666,3
w13,16,64,8,3584,2560,64,128,128,16,8,3,1536.263,3
w13,16,64,8,3584,2560,64,128,128,32,4,2,1536.3590000000002,3
w13,16,64,8,3584,2560,64,128,128,32,8,2,1535.388,3
w13,16,64,8,3584,2560,64,128,128,32,8,3,1536.156,3
w13,16,64,8,3584,2560,64,128,128,64,4,2,1538.9830000000002,3
w13,16,128,4,2048,512,16,32,64,1,4,2,168.41866666666667,3
w13,16,128,4,2048,512,64,64,128,1,4,2,167.93833333333333,3
w13,16,128,6,4096,2048,16,16,64,1,4,3,2095.3343333333332,3
w13,16,128,6,4096,2048,16,16,64,1,4,4,2097.8513333333335,3
w13,16,128,6,4096,2048,16,16,64,1,8,2,2102.886,3
w13,16,128,6,4096,2048,16,16,64,1,8,3,2096.5393333333336,3
w13,16,128,6,4096,2048,16,16,64,1,8,4,2096.7960000000003,3
w13,16,128,6,4096,2048,16,16,128,1,4,2,2100.550333333333,3
w13,16,128,6,4096,2048,16,16,128,1,4,3,2098.480666666667,3
w13,16,128,6,4096,2048,16,16,128,1,4,4,2095.5583333333334,3
w13,16,128,6,4096,2048,16,16,128,1,8,2,2096.1020000000003,3
w13,16,128,6,4096,2048,16,16,128,1,8,4,2098.0223333333333,3
w13,16,128,6,4096,2048,16,16,128,4,4,2,2098.3313333333335,3
w13,16,128,6,4096,2048,16,16,128,4,4,3,2097.8513333333335,3
w13,16,128,6,4096,2048,16,16,128,4,4,4,2095.558,3
w13,16,128,6,4096,2048,16,16,128,4,8,2,2094.9926666666665,3
w13,16,128,6,4096,2048,16,16,128,4,8,4,2099.11,3
w13,16,128,6,4096,2048,16,16,256,1,4,2,2097.808666666667,3
w13,16,128,6,4096,2048,16,16,256,1,4,3,2095.0356666666667,3
w13,16,128,6,4096,2048,16,16,256,1,4,4,2096.422,3
w13,16,128,6,4096,2048,16,16,256,1,8,2,2096.8703333333333,3
w13,16,128,6,4096,2048,16,16,256,1,8,3,2098.3206666666665,3
w13,16,128,6,4096,2048,16,16,256,1,8,4,2098.1290000000004,3
w13,16,128,6,4096,2048,16,16,256,4,4,2,2098.0866666666666,3
w13,16,128,6,4096,2048,16,16,256,4,4,3,2097.6806666666666,3
w13,16,128,6,4096,2048,16,16,256,4,4,4,2095.8783333333336,3
w13,16,128,6,4096,2048,16,16,256,4,8,2,2096.123666666667,3
w13,16,128,6,4096,2048,16,16,256,4,8,3,2097.744666666667,3
w13,16,128,6,4096,2048,16,16,256,4,8,4,2098.267333333333,3
w13,16,128,6,4096,2048,16,32,64,1,4,2,2098.321,3
w13,16,128,6,4096,2048,16,32,64,1,4,3,2095.206,3
w13,16,128,6,4096,2048,16,32,64,1,4,4,2099.2273333333337,3
w13,16,128,6,4096,2048,16,32,64,1,8,2,2097.318333333333,3
w13,16,128,6,4096,2048,16,32,64,1,8,3,2096.998,3
w13,16,128,6,4096,2048,16,32,64,1,8,4,2095.846666666667,3
w13,16,128,6,4096,2048,16,32,64,16,4,3,2096.7103333333334,3
w13,16,128,6,4096,2048,16,32,64,16,8,3,2097.1583333333333,3
w13,16,128,6,4096,2048,16,32,64,16,8,4,2103.3126666666667,3
w13,16,128,6,4096,2048,16,32,64,32,4,3,2096.785,3
w13,16,128,6,4096,2048,16,32,64,32,4,4,2100.2943333333333,3
w13,16,128,6,4096,2048,16,32,64,32,8,3,2098.630333333333,3
w13,16,128,6,4096,2048,16,32,64,32,8,4,2100.721,3
w13,16,128,6,4096,2048,16,32,64,64,4,3,2099.3343333333337,3
w13,16,128,6,4096,2048,16,32,64,64,4,4,2103.6116666666667,3
w13,16,128,6,4096,2048,16,32,64,64,8,3,2102.7906666666663,3
w13,16,128,6,4096,2048,16,32,64,64,8,4,2102.9823333333334,3
w13,16,128,6,4096,2048,16,32,128,1,4,2,2093.3073333333336,3
w13,16,128,6,4096,2048,16,32,128,1,4,3,2095.3343333333337,3
w13,16,128,6,4096,2048,16,32,128,1,4,4,2095.5793333333336,3
w13,16,128,6,4096,2048,16,32,128,1,8,2,2100.742,3
w13,16,128,6,4096,2048,16,32,128,1,8,3,2095.824666666667,3
w13,16,128,6,4096,2048,16,32,128,1,8,4,2096.4649999999997,3
w13,16,128,6,4096,2048,16,32,128,4,4,2,2093.883333333333,3
w13,16,128,6,4096,2048,16,32,128,4,4,3,2096.3903333333333,3
w13,16,128,6,4096,2048,16,32,128,4,4,4,2095.142333333333,3
w13,16,128,6,4096,2048,16,32,128,4,8,2,2100.6566666666663,3
w13,16,128,6,4096,2048,16,32,128,4,8,3,2097.414,3
w13,16,128,6,4096,2048,16,32,128,4,8,4,2096.1766666666667,3
w13,16,128,6,4096,2048,16,32,128,16,4,2,2095.078,3
w13,16,128,6,4096,2048,16,32,128,16,4,3,2096.8913333333335,3
w13,16,128,6,4096,2048,16,32,128,16,4,4,2097.3610000000003,3
w13,16,128,6,4096,2048,16,32,128,16,8,2,2102.033,3
w13,16,128,6,4096,2048,16,32,128,16,8,3,2100.5073333333335,3
w13,16,128,6,4096,2048,16,32,128,16,8,4,2098.054333333333,3
w13,16,128,6,4096,2048,16,32,128,32,4,2,2095.921,3
w13,16,128,6,4096,2048,16,32,128,32,4,3,2100.5713333333333,3
w13,16,128,6,4096,2048,16,32,128,32,4,4,2099.59,3
w13,16,128,6,4096,2048,16,32,128,32,8,2,2096.8806666666665,3
w13,16,128,6,4096,2048,16,32,128,32,8,3,2102.331666666667,3
w13,16,128,6,4096,2048,16,32,128,32,8,4,2100.817,3
w13,16,128,6,4096,2048,16,32,128,64,4,2,2096.1020000000003,3
w13,16,128,6,4096,2048,16,32,128,64,4,3,2103.558333333333,3
w13,16,128,6,4096,2048,16,32,128,64,4,4,2100.1553333333336,3
w13,16,128,6,4096,2048,16,32,128,64,8,2,2097.1366666666668,3
w13,16,128,6,4096,2048,16,32,128,64,8,4,2102.086,3
w13,16,128,6,4096,2048,16,32,256,1,4,2,2094.7586666666666,3
w13,16,128,6,4096,2048,16,32,256,1,4,3,2096.443333333333,3
w13,16,128,6,4096,2048,16,32,256,1,4,4,2095.185,3
w13,16,128,6,4096,2048,16,32,256,1,8,2,2096.219333333333,3
w13,16,128,6,4096,2048,16,32,256,1,8,3,2095.8356666666664,3
w13,16,128,6,4096,2048,16,32,256,1,8,4,2095.7720000000004,3
w13,16,128,6,4096,2048,16,32,256,16,4,2,2097.947333333333,3
w13,16,128,6,4096,2048,16,32,256,16,4,3,2097.905,3
w13,16,128,6,4096,2048,16,32,256,16,4,4,2097.9686666666666,3
w13,16,128,6,4096,2048,16,32,256,16,8,2,2100.7316666666666,3
w13,16,128,6,4096,2048,16,32,256,16,8,3,2099.3233333333333,3
w13,16,128,6,4096,2048,16,32,256,16,8,4,2099.4623333333334,3
w13,16,128,6,4096,2048,16,32,256,32,4,2,2102.886,3
w13,16,128,6,4096,2048,16,32,256,32,4,3,2099.8143333333333,3
w13,16,128,6,4096,2048,16,32,256,32,4,4,2100.518,3
w13,16,128,6,4096,2048,16,32,256,32,8,3,2101.4996666666666,3
w13,16,128,6,4096,2048,16,32,256,32,8,4,2099.9636666666665,3
w13,16,128,6,4096,2048,16,32,256,64,4,3,2102.7369999999996,3
w13,16,128,6,4096,2048,16,32,256,64,4,4,2101.6593333333335,3
w13,16,128,6,4096,2048,16,32,256,64,8,3,2103.5686666666666,3
w13,16,128,6,4096,2048,16,32,256,64,8,4,2102.065,3
w13,16,128,6,4096,2048,16,64,64,1,4,3,2097.1156666666666,3
w13,16,128,6,4096,2048,16,64,64,1,4,4,2096.678,3
w13,16,128,6,4096,2048,16,64,64,1,8,2,2098.7053333333333,3
w13,16,128,6,4096,2048,16,64,64,1,8,4,2097.5846666666666,3
w13,16,128,6,4096,2048,16,64,64,16,4,4,2102.246333333333,3
w13,16,128,6,4096,2048,16,64,64,16,8,4,2102.7906666666668,3
w13,16,128,6,4096,2048,16,64,64,32,4,4,2099.953,3
w13,16,128,6,4096,2048,16,64,64,32,8,4,2101.105,3
w13,16,128,6,4096,2048,16,64,128,1,4,2,2099.7503333333334,3
w13,16,128,6,4096,2048,16,64,128,1,4,3,2097.851666666667,3
w13,16,128,6,4096,2048,16,64,128,1,4,4,2095.7286666666664,3
w13,16,128,6,4096,2048,16,64,128,1,8,2,2098.7903333333334,3
w13,16,128,6,4096,2048,16,64,128,1,8,3,2097.766,3
w13,16,128,6,4096,2048,16,64,128,1,8,4,2096.636,3
w13,16,128,6,4096,2048,16,64,128,16,4,3,2103.4516666666664,3
w13,16,128,6,4096,2048,16,64,128,16,4,4,2097.8193333333334,3
w13,16,128,6,4096,2048,16,64,128,16,8,4,2097.7343333333333,3
w13,16,128,6,4096,2048,16,64,128,32,4,3,2102.8326666666667,3
w13,16,128,6,4096,2048,16,64,128,32,4,4,2100.081,3
w13,16,128,6,4096,2048,16,64,128,32,8,4,2101.7556666666665,3
w13,16,128,6,4096,2048,16,64,128,64,4,3,2103.3553333333334,3
w13,16,128,6,4096,2048,16,64,128,64,4,4,2101.105,3
w13,16,128,6,4096,2048,16,64,128,64,8,4,2099.9,3
w13,16,128,6,4096,2048,16,64,256,1,4,2,2099.8676666666665,3
w13,16,128,6,4096,2048,16,64,256,1,4,3,2097.6593333333335,3
w13,16,128,6,4096,2048,16,64,256,1,8,2,2100.2946666666667,3
w13,16,128,6,4096,2048,16,64,256,1,8,3,2096.913,3
w13,16,128,6,4096,2048,16,64,256,16,4,3,2098.694,3
w13,16,128,6,4096,2048,16,64,256,16,8,3,2099.003666666667,3
w13,16,128,6,4096,2048,16,64,256,32,4,3,2100.337,3
w13,16,128,6,4096,2048,16,64,256,32,8,3,2100.6143333333334,3
w13,16,128,6,4096,2048,16,64,256,64,4,3,2102.054,3
w13,16,128,6,4096,2048,16,64,256,64,8,3,2102.065,3
w13,16,128,6,4096,2048,16,128,64,1,4,2,2095.8993333333333,3
w13,16,128,6,4096,2048,16,128,64,1,4,4,2102.2033333333334,3
w13,16,128,6,4096,2048,16,128,64,1,8,2,2095.7076666666667,3
w13,16,128,6,4096,2048,16,128,64,1,8,4,2101.6380000000004,3
w13,16,128,6,4096,2048,16,128,64,32,4,2,2101.873,3
w13,16,128,6,4096,2048,16,128,64,32,8,2,2102.395666666667,3
w13,16,128,6,4096,2048,32,16,128,4,4,2,2093.969,3
w13,16,128,6,4096,2048,32,16,128,4,4,3,2096.0916666666667,3
w13,16,128,6,4096,2048,32,16,128,4,4,4,2097.6913333333337,3
w13,16,128,6,4096,2048,32,16,128,4,8,2,2095.9846666666667,3
w13,16,128,6,4096,2048,32,16,128,4,8,3,2098.4913333333334,3
w13,16,128,6,4096,2048,32,16,128,4,8,4,2098.8753333333334,3
w13,16,128,6,4096,2048,32,32,64,1,4,2,2099.569,3
w13,16,128,6,4096,2048,32,32,64,1,4,3,2098.79,3
w13,16,128,6,4096,2048,32,32,64,1,4,4,2096.1876666666667,3
w13,16,128,6,4096,2048,32,32,64,1,8,2,2096.6993333333335,3
w13,16,128,6,4096,2048,32,32,64,1,8,3,2095.664666666667,3
w13,16,128,6,4096,2048,32,32,64,1,8,4,2096.518,3
w13,16,128,6,4096,2048,32,32,64,32,4,3,2097.510333333333,3
w13,16,128,6,4096,2048,32,32,64,32,8,3,2100.3160000000003,3
w13,16,128,6,4096,2048,32,32,64,64,4,3,2099.8143333333333,3
w13,16,128,6,4096,2048,32,32,64,64,8,3,2099.238,3
w13,16,128,6,4096,2048,32,32,64,128,4,3,2097.958,3
w13,16,128,6,4096,2048,32,32,64,128,8,3,2097.958,3
w13,16,128,6,4096,2048,32,32,128,1,4,2,2097.3926666666666,3
w13,16,128,6,4096,2048,32,32,128,1,4,3,2095.3766666666666,3
w13,16,128,6,4096,2048,32,32,128,1,4,4,2096.145,3
w13,16,128,6,4096,2048,32,32,128,1,8,2,2099.3446666666664,3
w13,16,128,6,4096,2048,32,32,128,1,8,3,2096.2943333333333,3
w13,16,128,6,4096,2048,32,32,128,1,8,4,2096.924,3
w13,16,128,6,4096,2048,32,32,128,4,4,2,2097.0093333333334,3
w13,16,128,6,4096,2048,32,32,128,4,4,3,2096.1873333333333,3
w13,16,128,6,4096,2048,32,32,128,4,4,4,2095.8463333333334,3
w13,16,128,6,4096,2048,32,32,128,4,8,2,2103.0996666666665,3
w13,16,128,6,4096,2048,32,32,128,4,8,3,2095.7926666666667,3
w13,16,128,6,4096,2048,32,32,128,4,8,4,2096.2193333333335,3
w13,16,128,6,4096,2048,32,32,128,16,4,2,2099.152666666667,3
w13,16,128,6,4096,2048,32,32,128,16,4,3,2096.8169999999996,3
w13,16,128,6,4096,2048,32,32,128,16,4,4,2098.150333333333,3
w13,16,128,6,4096,2048,32,32,128,16,8,2,2102.6086666666665,3
w13,16,128,6,4096,2048,32,32,128,16,8,3,2097.3393333333333,3
w13,16,128,6,4096,2048,32,32,128,16,8,4,2098.6086666666665,3
w13,16,128,6,4096,2048,32,32,128,64,4,2,2098.2566666666667,3
w13,16,128,6,4096,2048,32,32,128,64,4,3,2098.833,3
w13,16,128,6,4096,2048,32,32,128,64,4,4,2103.0356666666667,3
w13,16,128,6,4096,2048,32,32,128,64,8,2,2097.2646666666665,3
w13,16,128,6,4096,2048,32,32,128,64,8,3,2100.0806666666667,3
w13,16,128,6,4096,2048,32,32,128,64,8,4,2103.3236666666667,3
w13,16,128,6,4096,2048,32,32,256,1,4,2,2096.561,3
w13,16,128,6,4096,2048,32,32,256,1,4,3,2096.208666666667,3
w13,16,128,6,4096,2048,32,32,256,1,4,4,2095.1526666666664,3
w13,16,128,6,4096,2048,32,32,256,1,8,2,2095.793,3
w13,16,128,6,4096,2048,32,32,256,1,8,3,2095.8036666666667,3
w13,16,128,6,4096,2048,32,32,256,1,8,4,2096.252,3
w13,16,128,6,4096,2048,32,32,256,4,4,2,2095.7826666666665,3
w13,16,128,6,4096,2048,32,32,256,4,4,3,2096.1873333333333,3
w13,16,128,6,4096,2048,32,32,256,4,4,4,2096.1133333333332,3
w13,16,128,6,4096,2048,32,32,256,4,8,2,2095.366666666667,3
w13,16,128,6,4096,2048,32,32,256,4,8,3,2095.484,3
w13,16,128,6,4096,2048,32,32,256,4,8,4,2097.616666666667,3
w13,16,128,6,4096,2048,32,32,256,16,4,2,2096.070333333333,3
w13,16,128,6,4096,2048,32,32,256,16,4,3,2098.619666666667,3
w13,16,128,6,4096,2048,32,32,256,16,4,4,2098.6516666666666,3
w13,16,128,6,4096,2048,32,32,256,16,8,2,2096.262,3
w13,16,128,6,4096,2048,32,32,256,16,8,3,2098.9926666666665,3
w13,16,128,6,4096,2048,32,32,256,16,8,4,2099.281,3
w13,16,128,6,4096,2048,32,32,256,32,4,2,2097.232666666667,3
w13,16,128,6,4096,2048,32,32,256,32,4,3,2099.7393333333334,3
w13,16,128,6,4096,2048,32,32,256,32,4,4,2099.8036666666667,3
w13,16,128,6,4096,2048,32,32,256,32,8,2,2097.9476666666665,3
w13,16,128,6,4096,2048,32,32,256,32,8,3,2100.07,3
w13,16,128,6,4096,2048,32,32,256,32,8,4,2100.678,3
w13,16,128,6,4096,2048,32,64,64,1,4,3,2100.6676666666667,3
w13,16,128,6,4096,2048,32,64,64,1,4,4,2098.8013333333333,3
w13,16,128,6,4096,2048,32,64,64,1,8,2,2098.587666666667,3
w13,16,128,6,4096,2048,32,64,64,1,8,4,2096.721,3
w13,16,128,6,4096,2048,32,64,128,1,4,2,2098.5446666666667,3
w13,16,128,6,4096,2048,32,64,128,1,4,3,2096.742666666667,3
w13,16,128,6,4096,2048,32,64,128,1,4,4,2096.774,3
w13,16,128,6,4096,2048,32,64,128,1,8,2,2099.5366666666664,3
w13,16,128,6,4096,2048,32,64,128,1,8,3,2098.2676666666666,3
w13,16,128,6,4096,2048,32,64,128,1,8,4,2096.0913333333333,3
w13,16,128,6,4096,2048,32,64,128,4,4,2,2102.054,3
w13,16,128,6,4096,2048,32,64,128,4,4,3,2099.9956666666662,3
w13,16,128,6,4096,2048,32,64,128,4,4,4,2096.326333333333,3
w13,16,128,6,4096,2048,32,64,128,4,8,2,2099.7183333333337,3
w13,16,128,6,4096,2048,32,64,128,4,8,3,2097.702333333333,3
w13,16,128,6,4096,2048,32,64,128,4,8,4,2095.8253333333337,3
w13,16,128,6,4096,2048,32,64,128,16,4,4,2099.2490000000003,3
w13,16,128,6,4096,2048,32,64,128,16,8,3,2103.4410000000003,3
w13,16,128,6,4096,2048,32,64,128,16,8,4,2098.971666666667,3
w13,16,128,6,4096,2048,32,64,128,32,4,4,2101.1686666666665,3
w13,16,128,6,4096,2048,32,64,128,32,8,4,2100.902666666667,3
w13,16,128,6,4096,2048,32,64,128,64,4,4,2101.3713333333335,3
w13,16,128,6,4096,2048,32,64,128,64,8,4,2101.7556666666665,3
w13,16,128,6,4096,2048,32,64,256,1,4,2,2103.601,3
w13,16,128,6,4096,2048,32,64,256,1,4,3,2097.5423333333333,3
w13,16,128,6,4096,2048,32,64,256,1,8,2,2100.208666666667,3
w13,16,128,6,4096,2048,32,64,256,1,8,3,2097.5526666666665,3
w13,16,128,6,4096,2048,32,64,256,8,4,3,2097.638,3
w13,16,128,6,4096,2048,32,64,256,8,8,2,2101.712666666667,3
w13,16,128,6,4096,2048,32,64,256,8,8,3,2098.6093333333333,3
w13,16,128,6,4096,2048,32,64,256,16,4,3,2098.5126666666665,3
w13,16,128,6,4096,2048,32,64,256,16,8,3,2099.43,3
w13,16,128,6,4096,2048,32,64,256,32,4,3,2101.905,3
w13,16,128,6,4096,2048,32,64,256,32,8,3,2100.998,3
w13,16,128,6,4096,2048,32,64,256,64,4,3,2102.5983333333334,3
w13,16,128,6,4096,2048,32,64,256,64,8,3,2103.5153333333333,3
w13,16,128,6,4096,2048,32,128,64,1,8,2,2097.02,3
w13,16,128,6,4096,2048,64,16,128,1,4,2,2095.974333333333,3
w13,16,128,6,4096,2048,64,16,128,1,4,3,2100.0703333333336,3
w13,16,128,6,4096,2048,64,16,128,1,4,4,2101.478,3
w13,16,128,6,4096,2048,64,16,128,1,8,2,2098.0433333333335,3
w13,16,128,6,4096,2048,64,16,128,1,8,3,2100.251333333333,3
w13,16,128,6,4096,2048,64,16,128,1,8,4,2102.662333333333,3
w13,16,128,6,4096,2048,64,32,128,1,4,2,2097.211333333333,3
w13,16,128,6,4096,2048,64,32,128,1,4,3,2097.67,3
w13,16,128,6,4096,2048,64,32,128,1,4,4,2103.121,3
w13,16,128,6,4096,2048,64,32,128,1,8,2,2098.982,3
w13,16,128,6,4096,2048,64,32,128,1,8,3,2097.0303333333336,3
w13,16,128,6,4096,2048,64,32,128,1,8,4,2100.369,3
w13,16,128,6,4096,2048,64,32,128,16,4,2,2097.9476666666665,3
w13,16,128,6,4096,2048,64,32,128,16,4,3,2098.001333333333,3
w13,16,128,6,4096,2048,64,32,128,16,8,2,2097.7776666666664,3
w13,16,128,6,4096,2048,64,32,128,16,8,3,2096.7106666666664,3
w13,16,128,6,4096,2048,64,32,128,16,8,4,2102.822666666667,3
w13,16,128,6,4096,2048,64,32,256,1,4,2,2098.023,3
w13,16,128,6,4096,2048,64,32,256,1,4,3,2097.1266666666666,3
w13,16,128,6,4096,2048,64,32,256,1,8,2,2098.1510000000003,3
w13,16,128,6,4096,2048,64,32,256,1,8,3,2096.071,3
w13,16,128,6,4096,2048,64,64,64,1,8,3,2098.2256666666667,3
w13,16,128,6,4096,2048,64,64,64,4,4,3,2100.3373333333334,3
w13,16,128,6,4096,2048,64,64,64,32,4,3,2103.7296666666666,3
w13,16,128,6,4096,2048,64,64,64,32,8,3,2102.823,3
w13,16,128,6,4096,2048,64,64,128,1,4,2,2099.5473333333334,3
w13,16,128,6,4096,2048,64,64,128,1,4,3,2096.4016666666666,3
w13,16,128,6,4096,2048,64,64,128,1,4,4,2097.8416666666667,3
w13,16,128,6,4096,2048,64,64,128,1,8,2,2095.8250000000003,3
w13,16,128,6,4096,2048,64,64,128,1,8,3,2096.3269999999998,3
w13,16,128,6,4096,2048,64,64,128,1,8,4,2097.1696666666667,3
w13,16,128,6,4096,2048,64,64,128,4,4,2,2098.2466666666664,3
w13,16,128,6,4096,2048,64,64,128,4,4,3,2097.639,3
w13,16,128,6,4096,2048,64,64,128,4,4,4,2097.383,3
w13,16,128,6,4096,2048,64,64,128,4,8,2,2097.0203333333334,3
w13,16,128,6,4096,2048,64,64,128,4,8,3,2097.436333333333,3
w13,16,128,6,4096,2048,64,64,128,4,8,4,2096.817,3
w13,16,128,6,4096,2048,64,64,128,8,4,2,2096.2843333333335,3
w13,16,128,6,4096,2048,64,64,128,8,4,3,2097.0843333333337,3
w13,16,128,6,4096,2048,64,64,128,8,4,4,2097.083666666667,3
w13,16,128,6,4096,2048,64,64,128,8,8,2,2098.2253333333333,3
w13,16,128,6,4096,2048,64,64,128,8,8,3,2096.444,3
w13,16,128,6,4096,2048,64,64,128,8,8,4,2098.332,3
w13,16,128,6,4096,2048,64,64,128,16,4,2,2095.996,3
w13,16,128,6,4096,2048,64,64,128,16,4,3,2098.4816666666666,3
w13,16,128,6,4096,2048,64,64,128,16,4,4,2100.903,3
w13,16,128,6,4096,2048,64,64,128,16,8,2,2096.668,3
w13,16,128,6,4096,2048,64,64,128,16,8,3,2098.0229999999997,3
w13,16,128,6,4096,2048,64,64,128,16,8,4,2098.1403333333333,3
w13,16,128,6,4096,2048,64,64,128,32,4,2,2097.105666666667,3
w13,16,128,6,4096,2048,64,64,128,32,4,3,2099.3773333333334,3
w13,16,128,6,4096,2048,64,64,128,32,4,4,2100.8709999999996,3
w13,16,128,6,4096,2048,64,64,128,32,8,2,2098.1403333333333,3
w13,16,128,6,4096,2048,64,64,128,32,8,3,2098.5453333333335,3
w13,16,128,6,4096,2048,64,64,128,32,8,4,2101.4466666666667,3
w13,16,128,6,4096,2048,64,64,128,64,4,2,2099.399,3
w13,16,128,6,4096,2048,64,64,128,64,4,3,2099.5803333333333,3
w13,16,128,6,4096,2048,64,64,128,64,4,4,2103.6006666666667,3
w13,16,128,6,4096,2048,64,64,128,64,8,2,2097.3933333333334,3
w13,16,128,6,4096,2048,64,64,128,64,8,3,2099.644333333333,3
w13,16,128,6,4096,2048,64,64,128,64,8,4,2102.6626666666666,3
w13,16,128,6,4096,2048,128,32,128,1,8,2,2103.0573333333336,3
w13,16,128,6,4096,2048,128,64,64,1,4,2,2103.228333333333,3
w13,16,128,6,4096,2048,128,64,64,1,4,4,2099.3236666666667,3
w13,16,128,6,4096,2048,128,64,64,1,8,4,2100.476,3
w13,16,128,6,4096,2048,128,64,128,1,4,3,2102.6203333333333,3
w13,16,128,6,4096,2048,128,64,128,1,8,3,2098.5769999999998,3
w13,16,128,6,4096,2048,128,64,128,16,4,3,2103.6763333333333,3
w13,16,128,6,4096,2048,128,64,128,16,8,3,2102.108,3
w13,16,128,8,2048,768,16,16,128,1,4,2,527.1819999999999,3
w13,16,128,8,2048,768,16,16,128,1,8,2,527.1926666666667,3
w13,16,128,8,2048,768,16,16,256,1,4,3,527.043,3
w13,16,128,8,2048,768,16,16,256,4,4,3,527.0216666666666,3
w13,16,128,8,2048,768,16,32,64,1,4,3,527.0856666666667,3
w13,16,128,8,2048,768,16,32,128,4,4,2,527.139,3
w13,16,128,8,2048,768,16,32,128,4,8,2,527.0963333333333,3
w13,16,128,8,2048,768,16,32,128,32,4,2,527.182,3
w13,16,128,8,2048,768,16,32,256,1,4,4,526.9256666666666,3
w13,16,128,8,2048,768,16,32,256,1,8,4,526.9896666666667,3
w13,16,128,8,2048,768,16,64,64,1,4,4,526.7763333333334,3
w13,16,128,8,2048,768,16,64,64,1,8,4,527.1709999999999,3
w13,16,128,8,2048,768,16,64,64,16,8,4,527.1386666666667,3
w13,16,128,8,2048,768,32,16,128,4,4,2,527.107,3
w13,16,128,8,2048,768,32,32,64,1,4,3,527.1173333333334,3
w13,16,128,8,2048,768,32,32,64,32,4,3,527.1816666666667,3
w13,16,128,8,2048,768,32,32,128,1,4,2,524.5576666666667,3
w13,16,128,8,2048,768,32,32,128,4,4,2,526.8296666666666,3
w13,16,128,8,2048,768,32,32,128,16,4,2,526.9686666666666,3
w13,16,128,8,2048,768,32,32,128,64,4,2,527.1496666666667,3
w13,16,128,8,4096,1536,16,16,64,1,4,3,2096.6240000000003,3
w13,16,128,8,4096,1536,16,16,64,1,4,4,2096.6666666666665,3
w13,16,128,8,4096,1536,16,16,64,1,8,3,2095.2053333333333,3
w13,16,128,8,4096,1536,16,16,64,1,8,4,2096.378666666667,3
w13,16,128,8,4096,1536,16,16,128,1,4,2,2100.8483333333334,3
w13,16,128,8,4096,1536,16,16,128,1,4,3,2098.032333333333,3
w13,16,128,8,4096,1536,16,16,128,1,4,4,2096.197333333333,3
w13,16,128,8,4096,1536,16,16,128,1,8,2,2095.4506666666666,3
w13,16,128,8,4096,1536,16,16,128,1,8,4,2097.787,3
w13,16,128,8,4096,1536,16,16,128,4,4,2,2102.1283333333336,3
w13,16,128,8,4096,1536,16,16,128,4,4,3,2099.1413333333335,3
w13,16,128,8,4096,1536,16,16,128,4,4,4,2098.1496666666667,3
w13,16,128,8,4096,1536,16,16,128,4,8,2,2098.694,3
w13,16,128,8,4096,1536,16,16,128,4,8,3,2104.581666666667,3
w13,16,128,8,4096,1536,16,16,128,4,8,4,2101.339,3
w13,16,128,8,4096,1536,16,16,256,1,4,2,2097.0293333333334,3
w13,16,128,8,4096,1536,16,16,256,1,4,3,2095.717,3
w13,16,128,8,4096,1536,16,16,256,1,4,4,2095.6,3
w13,16,128,8,4096,1536,16,16,256,1,8,2,2100.250666666667,3
w13,16,128,8,4096,1536,16,16,256,1,8,3,2097.104333333333,3
w13,16,128,8,4096,1536,16,16,256,1,8,4,2099.035,3
w13,16,128,8,4096,1536,16,16,256,4,4,2,2097.989666666667,3
w13,16,128,8,4096,1536,16,16,256,4,4,3,2096.8913333333335,3
w13,16,128,8,4096,1536,16,16,256,4,4,4,2095.8776666666668,3
w13,16,128,8,4096,1536,16,16,256,4,8,2,2100.421333333333,3
w13,16,128,8,4096,1536,16,16,256,4,8,3,2097.0403333333334,3
w13,16,128,8,4096,1536,16,16,256,4,8,4,2098.0963333333334,3
w13,16,128,8,4096,1536,16,32,64,1,4,2,2100.891,3
w13,16,128,8,4096,1536,16,32,64,1,4,3,2095.5043333333333,3
w13,16,128,8,4096,1536,16,32,64,1,4,4,2098.693333333333,3
w13,16,128,8,4096,1536,16,32,64,1,8,2,2096.528333333333,3
w13,16,128,8,4096,1536,16,32,64,1,8,3,2097.2533333333336,3
w13,16,128,8,4096,1536,16,32,64,1,8,4,2096.475,3
w13,16,128,8,4096,1536,16,32,128,1,4,2,2094.107,3
w13,16,128,8,4096,1536,16,32,128,1,4,3,2095.7276666666667,3
w13,16,128,8,4096,1536,16,32,128,1,4,4,2095.482666666667,3
w13,16,128,8,4096,1536,16,32,128,1,8,2,2095.568333333333,3
w13,16,128,8,4096,1536,16,32,128,1,8,3,2096.368,3
w13,16,128,8,4096,1536,16,32,128,1,8,4,2095.995,3
w13,16,128,8,4096,1536,16,32,128,4,4,2,2097.0826666666667,3
w13,16,128,8,4096,1536,16,32,128,4,4,3,2095.643,3
w13,16,128,8,4096,1536,16,32,128,4,4,4,2097.509666666667,3
w13,16,128,8,4096,1536,16,32,128,4,8,2,2101.776,3
w13,16,128,8,4096,1536,16,32,128,4,8,3,2096.474666666667,3
w13,16,128,8,4096,1536,16,32,128,4,8,4,2099.195,3
w13,16,128,8,4096,1536,16,32,256,1,4,2,2094.512,3
w13,16,128,8,4096,1536,16,32,256,1,4,3,2095.8883333333333,3
w13,16,128,8,4096,1536,16,32,256,1,4,4,2095.579,3
w13,16,128,8,4096,1536,16,32,256,1,8,2,2099.5043333333333,3
w13,16,128,8,4096,1536,16,32,256,1,8,3,2095.408,3
w13,16,128,8,4096,1536,16,32,256,1,8,4,2097.2533333333336,3
w13,16,128,8,4096,1536,16,64,64,1,4,3,2096.8913333333335,3
w13,16,128,8,4096,1536,16,64,64,1,4,4,2095.4403333333335,3
w13,16,128,8,4096,1536,16,64,64,1,8,2,2097.2856666666667,3
w13,16,128,8,4096,1536,16,64,64,1,8,4,2096.187,3
w13,16,128,8,4096,1536,16,64,128,1,4,2,2097.413666666667,3
w13,16,128,8,4096,1536,16,64,128,1,4,3,2099.653333333333,3
w13,16,128,8,4096,1536,16,64,128,1,4,4,2095.8346666666666,3
w13,16,128,8,4096,1536,16,64,128,1,8,2,2098.565666666667,3
w13,16,128,8,4096,1536,16,64,128,1,8,3,2096.965666666667,3
w13,16,128,8,4096,1536,16,64,128,1,8,4,2096.0589999999997,3
w13,16,128,8,4096,1536,16,64,256,1,4,2,2100.123,3
w13,16,128,8,4096,1536,16,64,256,1,4,3,2096.720333333333,3
w13,16,128,8,4096,1536,16,64,256,1,8,2,2101.253666666667,3
w13,16,128,8,4096,1536,16,64,256,1,8,3,2096.1756666666665,3
w13,16,128,8,4096,1536,16,128,64,1,4,2,2095.152,3
w13,16,128,8,4096,1536,16,128,64,1,4,4,2103.269,3
w13,16,128,8,4096,1536,16,128,64,1,8,2,2095.9516666666664,3
w13,16,128,8,4096,1536,16,128,64,1,8,4,2101.8506666666667,3
w13,16,128,8,4096,1536,16,128,64,16,4,2,2098.6936666666666,3
w13,16,128,8,4096,1536,16,128,64,16,8,2,2098.0753333333337,3
w13,16,128,8,4096,1536,16,128,64,32,4,2,2101.4563333333335,3
w13,16,128,8,4096,1536,16,128,64,32,8,2,2099.568333333333,3
w13,16,128,8,4096,1536,16,128,64,32,8,4,2104.1336666666666,3
w13,16,128,8,4096,1536,16,128,128,1,4,3,2104.475,3
w13,16,128,8,4096,1536,16,128,128,1,8,3,2103.760333333333,3
w13,16,128,8,4096,1536,32,16,128,4,4,2,2104.4113333333335,3
w13,16,128,8,4096,1536,32,16,128,4,4,3,2102.0643333333333,3
w13,16,128,8,4096,1536,32,16,128,4,4,4,2096.6453333333334,3
w13,16,128,8,4096,1536,32,16,128,4,8,2,2098.8213333333333,3
w13,16,128,8,4096,1536,32,16,128,4,8,3,2100.9763333333335,3
w13,16,128,8,4096,1536,32,16,128,4,8,4,2099.4936666666667,3
w13,16,128,8,4096,1536,32,32,64,1,4,2,2100.336333333333,3
w13,16,128,8,4096,1536,32,32,64,1,4,3,2099.2056666666667,3
w13,16,128,8,4096,1536,32,32,64,1,4,4,2094.7043333333336,3
w13,16,128,8,4096,1536,32,32,64,1,8,2,2096.8269999999998,3
w13,16,128,8,4096,1536,32,32,64,1,8,3,2100.133333333333,3
w13,16,128,8,4096,1536,32,32,64,1,8,4,2096.176,3
w13,16,128,8,4096,1536,32,32,128,1,4,2,2101.2746666666667,3
w13,16,128,8,4096,1536,32,32,128,1,4,3,2096.1543333333334,3
w13,16,128,8,4096,1536,32,32,128,1,4,4,2096.091,3
w13,16,128,8,4096,1536,32,32,128,1,8,2,2103.622,3
w13,16,128,8,4096,1536,32,32,128,1,8,3,2095.3656666666666,3
w13,16,128,8,4096,1536,32,32,128,1,8,4,2097.146666666667,3
w13,16,128,8,4096,1536,32,32,128,4,4,2,2100.7623333333336,3
w13,16,128,8,4096,1536,32,32,128,4,4,3,2097.5626666666667,3
w13,16,128,8,4096,1536,32,32,128,4,4,4,2102.373666666667,3
w13,16,128,8,4096,1536,32,32,128,4,8,3,2096.8693333333335,3
w13,16,128,8,4096,1536,32,32,128,4,8,4,2101.5733333333333,3
w13,16,128,8,4096,1536,32,32,256,1,4,2,2095.984,3
w13,16,128,8,4096,1536,32,32,256,1,4,3,2097.019,3
w13,16,128,8,4096,1536,32,32,256,1,4,4,2096.027,3
w13,16,128,8,4096,1536,32,32,256,1,8,2,2095.749333333333,3
w13,16,128,8,4096,1536,32,32,256,1,8,3,2097.6910000000003,3
w13,16,128,8,4096,1536,32,32,256,1,8,4,2096.720333333333,3
w13,16,128,8,4096,1536,32,32,256,4,4,2,2097.595,3
w13,16,128,8,4096,1536,32,32,256,4,4,3,2096.3683333333333,3
w13,16,128,8,4096,1536,32,32,256,4,4,4,2095.7819999999997,3
w13,16,128,8,4096,1536,32,32,256,4,8,2,2097.9043333333334,3
w13,16,128,8,4096,1536,32,32,256,4,8,3,2095.632,3
w13,16,128,8,4096,1536,32,32,256,4,8,4,2097.0613333333336,3
w13,16,128,8,4096,1536,32,64,64,1,4,3,2100.2933333333335,3
w13,16,128,8,4096,1536,32,64,64,1,4,4,2099.4616666666666,3
w13,16,128,8,4096,1536,32,64,64,1,8,2,2097.2003333333337,3
w13,16,128,8,4096,1536,32,64,64,1,8,3,2100.047666666667,3
w13,16,128,8,4096,1536,32,64,64,1,8,4,2097.690666666667,3
w13,16,128,8,4096,1536,32,64,128,1,4,2,2098.8536666666664,3
w13,16,128,8,4096,1536,32,64,128,1,4,3,2097.1363333333334,3
w13,16,128,8,4096,1536,32,64,128,1,4,4,2097.232,3
w13,16,128,8,4096,1536,32,64,128,1,8,2,2098.565666666667,3
w13,16,128,8,4096,1536,32,64,128,1,8,3,2100.464,3
w13,16,128,8,4096,1536,32,64,128,1,8,4,2097.1146666666664,3
w13,16,128,8,4096,1536,32,64,128,4,4,2,2098.3196666666668,3
w13,16,128,8,4096,1536,32,64,128,4,4,3,2098.661666666667,3
w13,16,128,8,4096,1536,32,64,128,4,4,4,2099.035,3
w13,16,128,8,4096,1536,32,64,128,4,8,2,2098.8646666666664,3
w13,16,128,8,4096,1536,32,64,128,4,8,3,2097.819,3
w13,16,128,8,4096,1536,32,64,128,4,8,4,2098.96,3
w13,16,128,8,4096,1536,32,64,256,1,4,3,2097.0293333333334,3
w13,16,128,8,4096,1536,32,64,256,1,8,2,2099.7496666666666,3
w13,16,128,8,4096,1536,32,64,256,1,8,3,2098.9493333333335,3
w13,16,128,8,4096,1536,32,64,256,8,4,2,2104.2933333333335,3
w13,16,128,8,4096,1536,32,64,256,8,4,3,2098.693333333333,3
w13,16,128,8,4096,1536,32,64,256,8,8,3,2098.5976666666666,3
w13,16,128,8,4096,1536,32,128,64,1,8,2,2097.605666666667,3
w13,16,128,8,4096,1536,32,128,64,4,8,4,2103.2586666666666,3
w13,16,128,8,4096,1536,64,16,128,1,4,2,2096.123666666667,3
w13,16,128,8,4096,1536,64,16,128,1,4,3,2100.006,3
w13,16,128,8,4096,1536,64,16,128,1,4,4,2102.9286666666667,3
w13,16,128,8,4096,1536,64,16,128,1,8,2,2099.142,3
w13,16,128,8,4096,1536,64,16,128,1,8,3,2101.7343333333333,3
w13,16,128,8,4096,1536,64,16,128,1,8,4,2101.3823333333335,3
w13,16,128,8,4096,1536,64,32,128,1,4,2,2096.689,3
w13,16,128,8,4096,1536,64,32,128,1,4,3,2096.241,3
w13,16,128,8,4096,1536,64,32,128,1,4,4,2100.827333333333,3
w13,16,128,8,4096,1536,64,32,128,1,8,2,2098.854,3
w13,16,128,8,4096,1536,64,32,128,1,8,3,2096.1446666666666,3
w13,16,128,8,4096,1536,64,32,128,1,8,4,2101.232666666667,3
w13,16,128,8,4096,1536,64,32,256,1,4,2,2097.5743333333335,3
w13,16,128,8,4096,1536,64,32,256,1,4,3,2097.6173333333336,3
w13,16,128,8,4096,1536,64,32,256,1,8,2,2097.0409999999997,3
w13,16,128,8,4096,1536,64,32,256,1,8,3,2098.000666666667,3
w13,16,128,8,4096,1536,64,64,64,1,4,3,2099.6006666666667,3
w13,16,128,8,4096,1536,64,64,64,1,8,3,2097.9156666666668,3
w13,16,128,8,4096,1536,64,64,128,1,4,2,2095.2276666666667,3
w13,16,128,8,4096,1536,64,64,128,1,4,3,2097.1903333333335,3
w13,16,128,8,4096,1536,64,64,128,1,4,4,2096.976666666667,3
w13,16,128,8,4096,1536,64,64,128,1,8,2,2097.3179999999998,3
w13,16,128,8,4096,1536,64,64,128,1,8,3,2096.7526666666668,3
w13,16,128,8,4096,1536,64,64,128,1,8,4,2097.1903333333335,3
w13,16,128,8,4096,1536,64,64,128,4,4,3,2102.694,3
w13,16,128,8,4096,1536,64,64,128,4,8,2,2095.8886666666667,3
w13,16,128,8,4096,1536,64,64,128,4,8,3,2100.5076666666664,3
w13,16,128,8,4096,1536,64,64,128,4,8,4,2103.003666666667,3
w13,16,128,8,4096,1536,64,64,128,8,4,3,2102.0433333333335,3
w13,16,128,8,4096,1536,64,64,128,8,4,4,2104.1233333333334,3
w13,16,128,8,4096,1536,64,64,128,8,8,3,2102.438333333333,3
w13,16,128,8,4096,1536,64,64,128,8,8,4,2103.7713333333336,3
w13,16,128,8,4096,1536,64,128,64,1,4,2,2101.158,3
w13,16,128,8,4096,1536,128,32,128,1,8,2,2104.529,3
w13,16,128,8,4096,1536,128,64,64,1,4,2,2103.5796666666665,3
w13,16,128,8,4096,1536,128,64,64,1,4,4,2102.2143333333333,3
w13,16,128,8,4096,1536,128,64,64,1,8,4,2098.896666666667,3
w13,16,128,8,4096,1536,128,64,128,1,4,3,2103.4516666666664,3
w13,16,128,8,4096,1536,128,64,128,1,8,3,2099.5153333333333,3
w13,16,128,8,4096,3072,16,16,64,1,4,3,4188.532,3
w13,16,128,8,4096,3072,16,16,64,1,4,4,4191.689333333333,3
w13,16,128,8,4096,3072,16,16,64,1,8,2,4194.4839999999995,3
w13,16,128,8,4096,3072,16,16,64,1,8,3,4189.333333333333,3
w13,16,128,8,4096,3072,16,16,64,1,8,4,4189.312,3
w13,16,128,8,4096,3072,16,16,128,1,4,2,4189.237,3
w13,16,128,8,4096,3072,16,16,128,1,4,3,4188.010333333333,3
w13,16,128,8,4096,3072,16,16,128,1,4,4,4190.474333333333,3
w13,16,128,8,4096,3072,16,16,128,1,8,2,4186.239666666667,3
w13,16,128,8,4096,3072,16,16,128,1,8,3,4191.636666666666,3
w13,16,128,8,4096,3072,16,16,128,1,8,4,4192.128000000001,3
w13,16,128,8,4096,3072,16,16,128,4,4,2,4191.530333333333,3
w13,16,128,8,4096,3072,16,16,128,4,4,3,4190.495666666667,3
w13,16,128,8,4096,3072,16,16,128,4,4,4,4190.677,3
w13,16,128,8,4096,3072,16,16,128,4,8,2,4188.127666666666,3
w13,16,128,8,4096,3072,16,16,128,4,8,3,4194.015666666667,3
w13,16,128,8,4096,3072,16,16,128,4,8,4,4191.093333333333,3
w13,16,128,8,4096,3072,16,16,256,1,4,2,4189.354666666667,3
w13,16,128,8,4096,3072,16,16,256,1,4,3,4189.013,3
w13,16,128,8,4096,3072,16,16,256,1,4,4,4187.818333333334,3
w13,16,128,8,4096,3072,16,16,256,1,8,2,4192.3516666666665,3
w13,16,128,8,4096,3072,16,16,256,1,8,3,4189.375666666667,3
w13,16,128,8,4096,3072,16,16,256,1,8,4,4189.908666666666,3
w13,16,128,8,4096,3072,16,16,256,4,4,2,4189.557,3
w13,16,128,8,4096,3072,16,16,256,4,4,3,4187.679666666667,3
w13,16,128,8,4096,3072,16,16,256,4,4,4,4189.1303333333335,3
w13,16,128,8,4096,3072,16,16,256,4,8,2,4189.237,3
w13,16,128,8,4096,3072,16,16,256,4,8,3,4189.2046666666665,3
w13,16,128,8,4096,3072,16,16,256,4,8,4,4190.293000000001,3
w13,16,128,8,4096,3072,16,32,64,1,4,2,4196.319333333333,3
w13,16,128,8,4096,3072,16,32,64,1,4,3,4187.242333333334,3
w13,16,128,8,4096,3072,16,32,64,1,4,4,4190.090333333334,3
w13,16,128,8,4096,3072,16,32,64,1,8,2,4189.3223333333335,3
w13,16,128,8,4096,3072,16,32,64,1,8,3,4185.930333333334,3
w13,16,128,8,4096,3072,16,32,64,1,8,4,4188.5543333333335,3
w13,16,128,8,4096,3072,16,32,64,16,4,3,4202.389,3
w13,16,128,8,4096,3072,16,32,64,16,4,4,4202.485333333333,3
w13,16,128,8,4096,3072,16,32,64,16,8,2,4202.228666666667,3
w13,16,128,8,4096,3072,16,32,64,16,8,3,4196.437333333334,3
w13,16,128,8,4096,3072,16,32,64,16,8,4,4199.679999999999,3
w13,16,128,8,4096,3072,16,32,128,1,4,2,4184.202333333334,3
w13,16,128,8,4096,3072,16,32,128,1,4,3,4187.647666666667,3
w13,16,128,8,4096,3072,16,32,128,1,4,4,4189.183666666667,3
w13,16,128,8,4096,3072,16,32,128,1,8,2,4191.060666666667,3
w13,16,128,8,4096,3072,16,32,128,1,8,3,4189.706333333333,3
w13,16,128,8,4096,3072,16,32,128,1,8,4,4190.442666666667,3
w13,16,128,8,4096,3072,16,32,128,4,4,2,4188.223333333332,3
w13,16,128,8,4096,3072,16,32,128,4,4,3,4187.530333333333,3
w13,16,128,8,4096,3072,16,32,128,4,4,4,4189.173,3
w13,16,128,8,4096,3072,16,32,128,4,8,2,4189.226333333333,3
w13,16,128,8,4096,3072,16,32,128,4,8,3,4189.258333333333,3
w13,16,128,8,4096,3072,16,32,128,4,8,4,4189.024,3
w13,16,128,8,4096,3072,16,32,128,16,4,2,4194.826333333333,3
w13,16,128,8,4096,3072,16,32,128,16,4,3,4193.055666666666,3
w13,16,128,8,4096,3072,16,32,128,16,4,4,4193.557,3
w13,16,128,8,4096,3072,16,32,128,16,8,2,4203.423666666667,3
w13,16,128,8,4096,3072,16,32,128,16,8,3,4197.301,3
w13,16,128,8,4096,3072,16,32,128,16,8,4,4193.237,3
w13,16,128,8,4096,3072,16,32,128,32,4,2,4204.821333333333,3
w13,16,128,8,4096,3072,16,32,128,32,8,2,4190.858333333334,3
w13,16,128,8,4096,3072,16,32,256,1,4,2,4189.439666666666,3
w13,16,128,8,4096,3072,16,32,256,1,4,3,4188.831666666667,3
w13,16,128,8,4096,3072,16,32,256,1,4,4,4187.445333333333,3
w13,16,128,8,4096,3072,16,32,256,1,8,2,4190.826,3
w13,16,128,8,4096,3072,16,32,256,1,8,3,4188.842,3
w13,16,128,8,4096,3072,16,32,256,1,8,4,4188.714333333333,3
w13,16,128,8,4096,3072,16,32,256,16,4,2,4192.127333333333,3
w13,16,128,8,4096,3072,16,32,256,16,4,3,4193.013,3
w13,16,128,8,4096,3072,16,32,256,16,4,4,4202.773,3
w13,16,128,8,4096,3072,16,32,256,16,8,2,4193.8983333333335,3
w13,16,128,8,4096,3072,16,32,256,16,8,3,4195.157,3
w13,16,128,8,4096,3072,16,32,256,16,8,4,4203.263333333333,3
w13,16,128,8,4096,3072,16,32,256,32,4,3,4202.549,3
w13,16,128,8,4096,3072,16,32,256,32,8,3,4202.538333333333,3
w13,16,128,8,4096,3072,16,64,64,1,4,3,4184.991666666667,3
w13,16,128,8,4096,3072,16,64,64,1,4,4,4187.722333333334,3
w13,16,128,8,4096,3072,16,64,64,1,8,2,4190.506333333334,3
w13,16,128,8,4096,3072,16,64,64,1,8,3,4202.506333333334,3
w13,16,128,8,4096,3072,16,64,64,1,8,4,4186.794333333333,3
w13,16,128,8,4096,3072,16,64,128,1,4,2,4184.991666666666,3
w13,16,128,8,4096,3072,16,64,128,1,4,3,4191.744,3
w13,16,128,8,4096,3072,16,64,128,1,4,4,4189.1196666666665,3
w13,16,128,8,4096,3072,16,64,128,1,8,2,4187.338333333333,3
w13,16,128,8,4096,3072,16,64,128,1,8,3,4188.426,3
w13,16,128,8,4096,3072,16,64,128,1,8,4,4188.522,3
w13,16,128,8,4096,3072,16,64,128,16,4,4,4204.831333333333,3
w13,16,128,8,4096,3072,16,64,128,16,8,2,4198.282666666667,3
w13,16,128,8,4096,3072,16,64,128,16,8,4,4203.4130000000005,3
w13,16,128,8,4096,3072,16,64,256,1,4,2,4189.215333333334,3
w13,16,128,8,4096,3072,16,64,256,1,4,3,4188.725,3
w13,16,128,8,4096,3072,16,64,256,1,8,2,4193.877,3
w13,16,128,8,4096,3072,16,64,256,1,8,3,4188.863666666667,3
w13,16,128,8,4096,3072,16,64,256,16,4,3,4201.237,3
w13,16,128,8,4096,3072,16,64,256,16,8,3,4201.6956666666665,3
w13,16,128,8,4096,3072,16,128,64,1,4,2,4194.410333333333,3
w13,16,128,8,4096,3072,16,128,64,1,4,3,4200.031666666667,3
w13,16,128,8,4096,3072,16,128,64,1,4,4,4189.4929999999995,3
w13,16,128,8,4096,3072,16,128,64,1,8,2,4188.437333333333,3
w13,16,128,8,4096,3072,16,128,64,1,8,3,4194.687666666667,3
w13,16,128,8,4096,3072,16,128,64,1,8,4,4189.418333333334,3
w13,16,128,8,4096,3072,16,128,64,16,4,2,4196.159666666666,3
w13,16,128,8,4096,3072,16,128,64,16,4,3,4199.9890000000005,3
w13,16,128,8,4096,3072,16,128,64,16,4,4,4192.511666666666,3
w13,16,128,8,4096,3072,16,128,64,16,8,2,4193.983666666667,3
w13,16,128,8,4096,3072,16,128,64,16,8,3,4195.925,3
w13,16,128,8,4096,3072,16,128,64,16,8,4,4191.893,3
w13,16,128,8,4096,3072,16,128,64,32,4,2,4201.706666666666,3
w13,16,128,8,4096,3072,16,128,64,32,4,3,4198.442333333333,3
w13,16,128,8,4096,3072,16,128,64,32,4,4,4193.248,3
w13,16,128,8,4096,3072,16,128,64,32,8,2,4196.0,3
w13,16,128,8,4096,3072,16,128,64,32,8,3,4197.333,3
w13,16,128,8,4096,3072,16,128,64,32,8,4,4192.703666666667,3
w13,16,128,8,4096,3072,16,128,64,64,4,4,4193.866,3
w13,16,128,8,4096,3072,16,128,64,64,8,4,4191.285,3
w13,16,128,8,4096,3072,16,128,128,1,4,2,4198.7406666666675,3
w13,16,128,8,4096,3072,16,128,128,1,4,3,4193.525000000001,3
w13,16,128,8,4096,3072,16,128,128,1,8,2,4195.274333333334,3
w13,16,128,8,4096,3072,16,128,128,1,8,3,4192.469,3
w13,16,128,8,4096,3072,16,128,128,16,4,2,4203.007666666667,3
w13,16,128,8,4096,3072,16,128,128,16,4,3,4194.997,3
w13,16,128,8,4096,3072,16,128,128,16,8,2,4203.711666666667,3
w13,16,128,8,4096,3072,16,128,128,16,8,3,4193.834333333333,3
w13,16,128,8,4096,3072,16,128,128,32,4,2,4198.047666666666,3
w13,16,128,8,4096,3072,16,128,128,32,4,3,4194.687666666667,3
w13,16,128,8,4096,3072,16,128,128,32,8,2,4200.074333333333,3
w13,16,128,8,4096,3072,16,128,128,32,8,3,4193.333,3
w13,16,128,8,4096,3072,16,128,128,64,4,2,4197.664,3
w13,16,128,8,4096,3072,16,128,128,64,4,3,4197.173,3
w13,16,128,8,4096,3072,16,128,128,64,8,2,4201.034333333333,3
w13,16,128,8,4096,3072,16,128,128,64,8,3,4195.722333333334,3
w13,16,128,8,4096,3072,16,256,64,1,4,3,4196.448,3
w13,16,128,8,4096,3072,16,256,64,1,8,3,4197.791666666667,3
w13,16,128,8,4096,3072,16,256,64,16,4,3,4203.754666666667,3
w13,16,128,8,4096,3072,16,256,64,16,8,3,4202.666333333334,3
w13,16,128,8,4096,3072,16,256,64,32,4,3,4202.101,3
w13,16,128,8,4096,3072,16,256,64,32,8,3,4202.111666666667,3
w13,16,128,8,4096,3072,32,16,128,4,4,2,4202.197,3
w13,16,128,8,4096,3072,32,16,128,4,4,3,4188.202333333334,3
w13,16,128,8,4096,3072,32,16,128,4,4,4,4190.559333333334,3
w13,16,128,8,4096,3072,32,16,128,4,8,2,4188.447666666667,3
w13,16,128,8,4096,3072,32,16,128,4,8,3,4191.935666666667,3
w13,16,128,8,4096,3072,32,16,128,4,8,4,4193.333,3
w13,16,128,8,4096,3072,32,32,64,1,4,2,4187.359333333334,3
w13,16,128,8,4096,3072,32,32,64,1,4,3,4192.575333333333,3
w13,16,128,8,4096,3072,32,32,64,1,4,4,4187.882333333334,3
w13,16,128,8,4096,3072,32,32,64,1,8,2,4187.733,3
w13,16,128,8,4096,3072,32,32,64,1,8,3,4188.3623333333335,3
w13,16,128,8,4096,3072,32,32,64,1,8,4,4189.194333333334,3
w13,16,128,8,4096,3072,32,32,64,32,4,3,4204.938333333333,3
w13,16,128,8,4096,3072,32,32,64,32,8,3,4195.999666666667,3
w13,16,128,8,4096,3072,32,32,128,1,4,2,4198.250333333333,3
w13,16,128,8,4096,3072,32,32,128,1,4,3,4188.053333333333,3
w13,16,128,8,4096,3072,32,32,128,1,4,4,4189.419333333334,3
w13,16,128,8,4096,3072,32,32,128,1,8,2,4189.035333333333,3
w13,16,128,8,4096,3072,32,32,128,1,8,3,4192.917666666667,3
w13,16,128,8,4096,3072,32,32,128,1,8,4,4190.6140000000005,3
w13,16,128,8,4096,3072,32,32,128,4,4,2,4188.896333333333,3
w13,16,128,8,4096,3072,32,32,128,4,4,3,4190.955333333333,3
w13,16,128,8,4096,3072,32,32,128,4,4,4,4190.955000000001,3
w13,16,128,8,4096,3072,32,32,128,4,8,2,4192.150000000001,3
w13,16,128,8,4096,3072,32,32,128,4,8,3,4194.261666666666,3
w13,16,128,8,4096,3072,32,32,128,4,8,4,4190.966,3
w13,16,128,8,4096,3072,32,32,128,16,4,2,4198.518,3
w13,16,128,8,4096,3072,32,32,128,16,4,3,4196.651,3
w13,16,128,8,4096,3072,32,32,128,16,4,4,4194.805666666666,3
w13,16,128,8,4096,3072,32,32,128,16,8,3,4196.939333333333,3
w13,16,128,8,4096,3072,32,32,128,16,8,4,4195.3606666666665,3
w13,16,128,8,4096,3072,32,32,256,1,4,2,4191.243333333333,3
w13,16,128,8,4096,3072,32,32,256,1,4,3,4187.777,3
w13,16,128,8,4096,3072,32,32,256,1,4,4,4189.227,3
w13,16,128,8,4096,3072,32,32,256,1,8,2,4190.624666666667,3
w13,16,128,8,4096,3072,32,32,256,1,8,3,4188.992666666666,3
w13,16,128,8,4096,3072,32,32,256,1,8,4,4187.627333333333,3
w13,16,128,8,4096,3072,32,32,256,4,4,2,4189.632666666667,3
w13,16,128,8,4096,3072,32,32,256,4,4,3,4187.979333333334,3
w13,16,128,8,4096,3072,32,32,256,4,4,4,4188.843333333333,3
w13,16,128,8,4096,3072,32,32,256,4,8,2,4191.669666666667,3
w13,16,128,8,4096,3072,32,32,256,4,8,3,4188.416666666667,3
w13,16,128,8,4096,3072,32,32,256,4,8,4,4188.725666666666,3
w13,16,128,8,4096,3072,32,32,256,16,4,2,4196.5233333333335,3
w13,16,128,8,4096,3072,32,32,256,16,4,3,4193.195,3
w13,16,128,8,4096,3072,32,32,256,16,4,4,4201.686000000001,3
w13,16,128,8,4096,3072,32,32,256,16,8,2,4199.157666666667,3
w13,16,128,8,4096,3072,32,32,256,16,8,3,4192.875333333333,3
w13,16,128,8,4096,3072,32,32,256,16,8,4,4202.219,3
w13,16,128,8,4096,3072,32,64,64,1,4,3,4186.304666666667,3
w13,16,128,8,4096,3072,32,64,64,1,4,4,4187.808666666667,3
w13,16,128,8,4096,3072,32,64,64,1,8,2,4189.643,3
w13,16,128,8,4096,3072,32,64,64,1,8,3,4187.488666666667,3
w13,16,128,8,4096,3072,32,64,64,1,8,4,4188.321,3
w13,16,128,8,4096,3072,32,64,128,1,4,2,4185.792666666667,3
w13,16,128,8,4096,3072,32,64,128,1,4,3,4190.464333333333,3
w13,16,128,8,4096,3072,32,64,128,1,4,4,4188.352666666667,3
w13,16,128,8,4096,3072,32,64,128,1,8,2,4185.6539999999995,3
w13,16,128,8,4096,3072,32,64,128,1,8,3,4190.326,3
w13,16,128,8,4096,3072,32,64,128,1,8,4,4188.512333333333,3
w13,16,128,8,4096,3072,32,64,128,4,4,2,4187.349666666666,3
w13,16,128,8,4096,3072,32,64,128,4,4,3,4189.558,3
w13,16,128,8,4096,3072,32,64,128,4,4,4,4191.083333333333,3
w13,16,128,8,4096,3072,32,64,128,4,8,2,4188.128333333333,3
w13,16,128,8,4096,3072,32,64,128,4,8,3,4189.4619999999995,3
w13,16,128,8,4096,3072,32,64,128,4,8,4,4191.318,3
w13,16,128,8,4096,3072,32,64,128,16,4,4,4202.240666666667,3
w13,16,128,8,4096,3072,32,64,128,16,8,2,4199.200333333333,3
w13,16,128,8,4096,3072,32,64,128,16,8,4,4204.182,3
w13,16,128,8,4096,3072,32,64,256,1,4,2,4191.563666666666,3
w13,16,128,8,4096,3072,32,64,256,1,4,3,4190.208333333333,3
w13,16,128,8,4096,3072,32,64,256,1,8,2,4197.024666666667,3
w13,16,128,8,4096,3072,32,64,256,1,8,3,4188.277999999999,3
w13,16,128,8,4096,3072,32,64,256,8,4,2,4205.003333333333,3
w13,16,128,8,4096,3072,32,64,256,8,4,3,4191.446,3
w13,16,128,8,4096,3072,32,64,256,8,8,2,4200.2136666666665,3
w13,16,128,8,4096,3072,32,64,256,8,8,3,4191.798,3
w13,16,128,8,4096,3072,32,64,256,16,4,3,4201.302,3
w13,16,128,8,4096,3072,32,64,256,16,8,2,4204.822,3
w13,16,128,8,4096,3072,32,64,256,16,8,3,4200.758,3
w13,16,128,8,4096,3072,32,128,64,1,4,4,4191.936333333334,3
w13,16,128,8,4096,3072,32,128,64,1,8,2,4189.942333333333,3
w13,16,128,8,4096,3072,32,128,64,1,8,4,4193.579666666667,3
w13,16,128,8,4096,3072,32,128,64,4,4,2,4202.059333333334,3
w13,16,128,8,4096,3072,32,128,64,4,4,4,4194.155333333333,3
w13,16,128,8,4096,3072,32,128,64,4,8,4,4193.291333333334,3
w13,16,128,8,4096,3072,32,128,64,16,4,3,4204.341666666666,3
w13,16,128,8,4096,3072,32,128,64,16,4,4,4196.896333333333,3
w13,16,128,8,4096,3072,32,128,64,16,8,3,4201.451,3
w13,16,128,8,4096,3072,32,128,64,16,8,4,4195.339,3
w13,16,128,8,4096,3072,32,128,64,32,4,3,4201.857,3
w13,16,128,8,4096,3072,32,128,64,32,4,4,4196.5233333333335,3
w13,16,128,8,4096,3072,32,128,64,32,8,3,4202.6140000000005,3
w13,16,128,8,4096,3072,32,128,64,32,8,4,4193.867333333333,3
w13,16,128,8,4096,3072,32,128,64,64,4,4,4195.7553333333335,3
w13,16,128,8,4096,3072,32,128,64,64,8,4,4195.414333333333,3
w13,16,128,8,4096,3072,32,128,128,1,4,2,4199.659333333333,3
w13,16,128,8,4096,3072,32,128,128,1,4,3,4194.9766666666665,3
w13,16,128,8,4096,3072,32,128,128,1,8,2,4199.702,3
w13,16,128,8,4096,3072,32,128,128,1,8,3,4194.144333333334,3
w13,16,128,8,4096,3072,32,128,128,4,4,2,4201.27,3
w13,16,128,8,4096,3072,32,128,128,4,4,3,4195.062000000001,3
w13,16,128,8,4096,3072,32,128,128,4,8,2,4201.387333333333,3
w13,16,128,8,4096,3072,32,128,128,4,8,3,4194.432333333333,3
w13,16,128,8,4096,3072,32,128,128,8,4,2,4203.915333333333,3
w13,16,128,8,4096,3072,32,128,128,8,4,3,4195.680666666667,3
w13,16,128,8,4096,3072,32,128,128,8,8,2,4202.272333333333,3
w13,16,128,8,4096,3072,32,128,128,8,8,3,4194.059333333334,3
w13,16,128,8,4096,3072,32,128,128,16,4,3,4196.203333333334,3
w13,16,128,8,4096,3072,32,128,128,16,8,3,4195.371,3
w13,16,128,8,4096,3072,32,128,128,32,4,3,4196.683333333333,3
w13,16,128,8,4096,3072,32,128,128,32,8,2,4203.275333333334,3
w13,16,128,8,4096,3072,32,128,128,32,8,3,4197.344333333333,3
w13,16,128,8,4096,3072,32,128,128,64,4,3,4197.3550000000005,3
w13,16,128,8,4096,3072,32,128,128,64,8,2,4204.170999999999,3
w13,16,128,8,4096,3072,32,128,128,64,8,3,4195.797333333333,3
w13,16,128,8,4096,3072,32,256,64,1,4,3,4202.624333333333,3
w13,16,128,8,4096,3072,32,256,64,1,8,3,4203.009,3
w13,16,128,8,4096,3072,64,16,128,1,4,2,4190.699333333333,3
w13,16,128,8,4096,3072,64,16,128,1,4,3,4192.598333333334,3
w13,16,128,8,4096,3072,64,16,128,1,4,4,4194.336666666667,3
w13,16,128,8,4096,3072,64,16,128,1,8,2,4190.806,3
w13,16,128,8,4096,3072,64,16,128,1,8,3,4191.819,3
w13,16,128,8,4096,3072,64,16,128,1,8,4,4193.291666666667,3
w13,16,128,8,4096,3072,64,32,128,1,4,2,4186.720333333334,3
w13,16,128,8,4096,3072,64,32,128,1,4,3,4189.888333333333,3
w13,16,128,8,4096,3072,64,32,128,1,4,4,4193.024666666667,3
w13,16,128,8,4096,3072,64,32,128,1,8,2,4185.963333333333,3
w13,16,128,8,4096,3072,64,32,128,1,8,3,4191.339333333333,3
w13,16,128,8,4096,3072,64,32,128,1,8,4,4193.216666666666,3
w13,16,128,8,4096,3072,64,32,128,16,4,2,4191.606000000001,3
w13,16,128,8,4096,3072,64,32,128,16,4,3,4190.827,3
w13,16,128,8,4096,3072,64,32,128,16,4,4,4198.2300000000005,3
w13,16,128,8,4096,3072,64,32,128,16,8,2,4188.907,3
w13,16,128,8,4096,3072,64,32,128,16,8,3,4193.803333333333,3
w13,16,128,8,4096,3072,64,32,128,16,8,4,4197.920666666666,3
w13,16,128,8,4096,3072,64,32,256,1,4,2,4188.673,3
w13,16,128,8,4096,3072,64,32,256,1,4,3,4190.838,3
w13,16,128,8,4096,3072,64,32,256,1,8,2,4191.275333333334,3
w13,16,128,8,4096,3072,64,32,256,1,8,3,4189.301666666667,3
w13,16,128,8,4096,3072,64,64,64,1,4,3,4189.494,3
w13,16,128,8,4096,3072,64,64,64,1,4,4,4193.696666666667,3
w13,16,128,8,4096,3072,64,64,64,1,8,2,4197.557666666667,3
w13,16,128,8,4096,3072,64,64,64,1,8,3,4194.560666666667,3
w13,16,128,8,4096,3072,64,64,64,1,8,4,4195.659333333333,3
w13,16,128,8,4096,3072,64,64,64,4,4,2,4200.971333333334,3
w13,16,128,8,4096,3072,64,64,64,4,4,3,4202.827333333334,3
w13,16,128,8,4096,3072,64,64,64,4,4,4,4195.222333333333,3
w13,16,128,8,4096,3072,64,64,64,4,8,2,4202.881,3
w13,16,128,8,4096,3072,64,64,64,4,8,4,4196.384999999999,3
w13,16,128,8,4096,3072,64,64,128,1,4,2,4186.55,3
w13,16,128,8,4096,3072,64,64,128,1,4,3,4191.040666666667,3
w13,16,128,8,4096,3072,64,64,128,1,4,4,4190.912333333334,3
w13,16,128,8,4096,3072,64,64,128,1,8,2,4185.782,3
w13,16,128,8,4096,3072,64,64,128,1,8,3,4190.581666666666,3
w13,16,128,8,4096,3072,64,64,128,1,8,4,4190.805666666667,3
w13,16,128,8,4096,3072,64,64,128,4,4,2,4197.590333333334,3
w13,16,128,8,4096,3072,64,64,128,4,4,3,4190.763,3
w13,16,128,8,4096,3072,64,64,128,4,4,4,4193.142,3
w13,16,128,8,4096,3072,64,64,128,4,8,2,4185.526,3
w13,16,128,8,4096,3072,64,64,128,4,8,3,4191.275333333334,3
w13,16,128,8,4096,3072,64,64,128,4,8,4,4191.189666666666,3
w13,16,128,8,4096,3072,64,64,128,8,4,2,4201.984666666667,3
w13,16,128,8,4096,3072,64,64,128,8,4,3,4200.096666666667,3
w13,16,128,8,4096,3072,64,64,128,8,4,4,4197.323,3
w13,16,128,8,4096,3072,64,64,128,8,8,3,4199.040666666667,3
w13,16,128,8,4096,3072,64,64,128,8,8,4,4199.115333333334,3
w13,16,128,8,4096,3072,64,64,128,16,4,3,4201.302,3
w13,16,128,8,4096,3072,64,64,128,16,8,2,4200.384666666667,3
w13,16,128,8,4096,3072,64,64,128,16,8,3,4200.992666666666,3
w13,16,128,8,4096,3072,64,128,64,1,4,2,4191.926666666667,3
w13,16,128,8,4096,3072,64,128,64,1,4,4,4201.164,3
w13,16,128,8,4096,3072,64,128,64,1,8,2,4198.721333333334,3
w13,16,128,8,4096,3072,64,128,64,1,8,3,4203.425333333334,3
w13,16,128,8,4096,3072,64,128,64,1,8,4,4199.052,3
w13,16,128,8,4096,3072,64,128,64,4,4,2,4199.276,3
w13,16,128,8,4096,3072,64,128,64,4,4,4,4204.481666666667,3
w13,16,128,8,4096,3072,64,128,64,4,8,2,4198.092333333333,3
w13,16,128,8,4096,3072,64,128,64,4,8,4,4201.751,3
w13,16,128,8,4096,3072,64,128,64,16,4,2,4202.412,3
w13,16,128,8,4096,3072,64,128,64,16,8,2,4200.257333333334,3
w13,16,128,8,4096,3072,64,128,64,16,8,3,4204.289333333333,3
w13,16,128,8,4096,3072,64,128,64,32,4,2,4199.532,3
w13,16,128,8,4096,3072,64,128,64,32,8,2,4202.625333333333,3
w13,16,128,8,4096,3072,64,128,64,32,8,3,4204.705333333333,3
w13,16,128,8,4096,3072,64,128,64,64,8,2,4201.462666666666,3
w13,16,128,8,4096,3072,64,128,128,1,8,3,4196.62,3
w13,16,128,8,4096,3072,64,128,128,4,8,3,4200.311000000001,3
w13,16,128,8,4096,3072,64,128,128,16,8,3,4205.1320000000005,3
w13,16,128,8,4096,3072,128,32,128,1,4,2,4197.995666666667,3
w13,16,128,8,4096,3072,128,32,128,1,4,3,4199.958666666666,3
w13,16,128,8,4096,3072,128,32,128,1,8,2,4195.3189999999995,3
w13,16,128,8,4096,3072,128,32,128,1,8,3,4199.052333333333,3
w13,16,128,8,4096,3072,128,64,64,1,4,2,4199.884333333333,3
w13,16,128,8,4096,3072,128,64,64,1,4,3,4195.926666666666,3
w13,16,128,8,4096,3072,128,64,64,1,4,4,4195.169666666668,3
w13,16,128,8,4096,3072,128,64,64,1,8,2,4203.202,3
w13,16,128,8,4096,3072,128,64,64,1,8,3,4194.721333333334,3
w13,16,128,8,4096,3072,128,64,64,1,8,4,4193.708333333333,3
w13,16,128,8,4096,3072,128,64,128,1,4,3,4200.481333333333,3
w13,16,128,8,4096,3072,128,64,128,1,8,2,4189.633666666667,3
w13,16,128,8,4096,3072,128,64,128,1,8,3,4195.894666666667,3
w13,16,128,8,4096,3072,128,128,64,1,8,3,4195.169333333333,3
w13,16,128,8,4096,3072,128,128,64,4,8,3,4197.281333333333,3
w13,16,128,8,4096,3072,128,128,64,8,8,3,4204.919,3
w13,16,128,8,4096,3072,128,128,64,64,8,3,4203.948,3
w13,24,8,2,1024,512,16,64,64,1,8,4,5.218,3
w13,24,8,2,1024,512,16,64,64,32,4,4,5.218,3
w13,24,8,2,1024,512,16,64,64,64,4,4,5.218,3
w13,24,16,2,1536,768,16,256,32,8,4,4,14.725999999999999,3
w13,24,16,4,1536,1024,16,128,64,16,8,3,19.244666666666667,3
w13,24,16,4,1536,1024,16,128,64,32,8,3,19.212666666666667,3
w13,24,16,4,1536,1024,16,128,64,64,8,3,19.191333333333333,3
w13,24,32,4,2048,768,16,32,64,1,4,2,118.221,3
w13,24,32,6,3072,1024,16,32,256,1,4,2,261.8793333333333,3
w13,24,32,6,3072,1024,16,64,256,1,4,2,261.97566666666665,3
w13,24,32,6,3072,1024,32,32,256,1,4,2,261.933,3
w13,24,32,6,3072,1024,32,64,256,1,4,2,262.79733333333337,3
w13,24,60,4,2048,1408,16,32,256,1,4,2,452.5463333333334,3
w13,24,60,4,2048,1408,16,64,128,1,4,2,451.213,3
w13,24,60,4,2048,1408,16,64,256,1,4,2,452.95166666666665,3
w13,24,60,4,2048,1408,16,128,128,1,4,2,451.92833333333334,3
w13,24,60,4,2048,1408,32,32,128,1,4,2,451.35133333333334,3
w13,24,60,4,2048,1408,32,32,256,1,4,2,452.65333333333336,3
w13,24,60,4,2048,1408,32,64,128,1,4,2,452.3443333333333,3
w13,24,60,4,2048,1408,32,128,128,1,4,2,452.39733333333334,3
w13,24,60,4,2048,1408,64,64,128,1,4,2,451.715,3
w13,24,60,6,3584,2304,16,16,64,1,4,3,1297.5203333333332,3
w13,24,60,6,3584,2304,16,16,128,1,4,2,1295.7176666666667,3
w13,24,60,6,3584,2304,16,16,128,1,4,3,1294.832,3
w13,24,60,6,3584,2304,16,16,128,1,4,4,1294.0113333333334,3
w13,24,60,6,3584,2304,16,16,128,1,8,2,1298.7250000000001,3
w13,24,60,6,3584,2304,16,16,128,1,8,3,1296.8266666666666,3
w13,24,60,6,3584,2304,16,16,128,1,8,4,1296.518,3
w13,24,60,6,3584,2304,16,16,128,4,4,3,1294.2346666666665,3
w13,24,60,6,3584,2304,16,16,128,4,4,4,1294.9926666666668,3
w13,24,60,6,3584,2304,16,16,128,4,8,3,1296.7623333333333,3
w13,24,60,6,3584,2304,16,16,128,4,8,4,1296.0379999999998,3
w13,24,60,6,3584,2304,16,16,256,1,4,2,1293.573666666667,3
w13,24,60,6,3584,2304,16,16,256,1,4,3,1293.8186666666668,3
w13,24,60,6,3584,2304,16,16,256,1,4,4,1293.862,3
w13,24,60,6,3584,2304,16,16,256,1,8,2,1295.654,3
w13,24,60,6,3584,2304,16,16,256,1,8,3,1295.1203333333333,3
w13,24,60,6,3584,2304,16,16,256,1,8,4,1296.4213333333335,3
w13,24,60,6,3584,2304,16,16,256,4,4,2,1294.1713333333335,3
w13,24,60,6,3584,2304,16,16,256,4,4,3,1293.3923333333335,3
w13,24,60,6,3584,2304,16,16,256,4,4,4,1294.0433333333333,3
w13,24,60,6,3584,2304,16,16,256,4,8,2,1296.454,3
w13,24,60,6,3584,2304,16,16,256,4,8,3,1295.6963333333333,3
w13,24,60,6,3584,2304,16,16,256,4,8,4,1296.4113333333335,3
w13,24,60,6,3584,2304,16,32,64,1,4,3,1298.5233333333333,3
w13,24,60,6,3584,2304,16,32,128,1,4,2,1294.982,3
w13,24,60,6,3584,2304,16,32,128,1,4,3,1294.3206666666667,3
w13,24,60,6,3584,2304,16,32,128,1,4,4,1293.552,3
w13,24,60,6,3584,2304,16,32,128,1,8,3,1295.28,3
w13,24,60,6,3584,2304,16,32,128,1,8,4,1294.1173333333334,3
w13,24,60,6,3584,2304,16,32,128,4,4,2,1296.1126666666667,3
w13,24,60,6,3584,2304,16,32,128,4,4,3,1295.952,3
w13,24,60,6,3584,2304,16,32,128,4,4,4,1294.5553333333335,3
w13,24,60,6,3584,2304,16,32,128,4,8,3,1296.656,3
w13,24,60,6,3584,2304,16,32,128,4,8,4,1295.366,3
w13,24,60,6,3584,2304,16,32,128,16,4,2,1298.5863333333334,3
w13,24,60,6,3584,2304,16,32,128,16,4,3,1297.9579999999999,3
w13,24,60,6,3584,2304,16,32,128,16,4,4,1295.6536666666668,3
w13,24,60,6,3584,2304,16,32,128,16,8,3,1298.6833333333334,3
w13,24,60,6,3584,2304,16,32,128,16,8,4,1296.4853333333333,3
w13,24,60,6,3584,2304,16,32,128,32,4,2,1297.648,3
w13,24,60,6,3584,2304,16,32,128,32,4,3,1296.4006666666667,3
w13,24,60,6,3584,2304,16,32,128,32,4,4,1297.0396666666666,3
w13,24,60,6,3584,2304,16,32,128,32,8,3,1296.5386666666666,3
w13,24,60,6,3584,2304,16,32,128,32,8,4,1297.3916666666667,3
w13,24,60,6,3584,2304,16,32,128,64,4,3,1298.3096666666668,3
w13,24,60,6,3584,2304,16,32,256,1,4,2,1292.3143333333335,3
w13,24,60,6,3584,2304,16,32,256,1,4,3,1293.478,3
w13,24,60,6,3584,2304,16,32,256,1,4,4,1293.9363333333333,3
w13,24,60,6,3584,2304,16,32,256,1,8,2,1294.7146666666667,3
w13,24,60,6,3584,2304,16,32,256,1,8,3,1294.1926666666666,3
w13,24,60,6,3584,2304,16,32,256,1,8,4,1293.8293333333334,3
w13,24,60,6,3584,2304,16,32,256,16,4,2,1297.2966666666666,3
w13,24,60,6,3584,2304,16,32,256,16,4,3,1295.696,3
w13,24,60,6,3584,2304,16,32,256,16,4,4,1295.995,3
w13,24,60,6,3584,2304,16,32,256,16,8,2,1298.0213333333334,3
w13,24,60,6,3584,2304,16,32,256,16,8,3,1295.2373333333333,3
w13,24,60,6,3584,2304,16,32,256,16,8,4,1296.454,3
w13,24,60,6,3584,2304,16,32,256,32,4,2,1296.3356666666666,3
w13,24,60,6,3584,2304,16,32,256,32,4,3,1295.8033333333333,3
w13,24,60,6,3584,2304,16,32,256,32,4,4,1297.7546666666667,3
w13,24,60,6,3584,2304,16,32,256,32,8,2,1296.5706666666667,3
w13,24,60,6,3584,2304,16,32,256,32,8,3,1296.2086666666667,3
w13,24,60,6,3584,2304,16,32,256,32,8,4,1297.4133333333332,3
w13,24,60,6,3584,2304,16,32,256,64,4,2,1297.2540000000001,3
w13,24,60,6,3584,2304,16,32,256,64,4,4,1296.9436666666668,3
w13,24,60,6,3584,2304,16,64,128,1,4,2,1295.75,3
w13,24,60,6,3584,2304,16,64,128,1,4,3,1294.832,3
w13,24,60,6,3584,2304,16,64,128,1,4,4,1293.84,3
w13,24,60,6,3584,2304,16,64,128,1,8,2,1295.1736666666668,3
w13,24,60,6,3584,2304,16,64,128,1,8,3,1294.5116666666665,3
w13,24,60,6,3584,2304,16,64,128,1,8,4,1293.8403333333333,3
w13,24,60,6,3584,2304,16,64,128,16,4,2,1297.5523333333333,3
w13,24,60,6,3584,2304,16,64,128,16,4,3,1298.3196666666665,3
w13,24,60,6,3584,2304,16,64,128,16,4,4,1296.1233333333332,3
w13,24,60,6,3584,2304,16,64,128,16,8,2,1297.7659999999998,3
w13,24,60,6,3584,2304,16,64,128,16,8,3,1298.1813333333332,3
w13,24,60,6,3584,2304,16,64,128,16,8,4,1297.3819999999998,3
w13,24,60,6,3584,2304,16,64,128,32,4,2,1297.9573333333333,3
w13,24,60,6,3584,2304,16,64,128,32,4,3,1296.5816666666667,3
w13,24,60,6,3584,2304,16,64,128,32,4,4,1297.616,3
w13,24,60,6,3584,2304,16,64,128,32,8,2,1298.2346666666665,3
w13,24,60,6,3584,2304,16,64,128,32,8,3,1296.6779999999999,3
w13,24,60,6,3584,2304,16,64,128,32,8,4,1296.7303333333332,3
w13,24,60,6,3584,2304,16,64,128,64,8,2,1298.4486666666667,3
w13,24,60,6,3584,2304,16,64,128,64,8,3,1298.3733333333332,3
w13,24,60,6,3584,2304,16,64,256,1,4,2,1293.2746666666667,3
w13,24,60,6,3584,2304,16,64,256,1,4,3,1294.0533333333333,3
w13,24,60,6,3584,2304,16,64,256,1,8,2,1294.8963333333334,3
w13,24,60,6,3584,2304,16,64,256,1,8,3,1294.2666666666667,3
w13,24,60,6,3584,2304,16,64,256,16,4,2,1297.19,3
w13,24,60,6,3584,2304,16,64,256,16,4,3,1295.8886666666667,3
w13,24,60,6,3584,2304,16,64,256,16,8,2,1298.4376666666667,3
w13,24,60,6,3584,2304,16,64,256,16,8,3,1295.3866666666665,3
w13,24,60,6,3584,2304,16,64,256,32,4,2,1296.4859999999999,3
w13,24,60,6,3584,2304,16,64,256,32,4,3,1296.997,3
w13,24,60,6,3584,2304,16,64,256,32,8,2,1296.2726666666667,3
w13,24,60,6,3584,2304,16,64,256,32,8,3,1296.581,3
w13,24,60,6,3584,2304,16,64,256,64,4,2,1297.296,3
w13,24,60,6,3584,2304,16,64,256,64,8,2,1297.8823333333332,3
w13,24,60,6,3584,2304,16,64,256,64,8,3,1298.5873333333332,3
w13,24,60,6,3584,2304,16,128,128,1,4,2,1294.3196666666665,3
w13,24,60,6,3584,2304,16,128,128,1,4,3,1294.1180000000002,3
w13,24,60,6,3584,2304,16,128,128,1,8,2,1293.893,3
w13,24,60,6,3584,2304,16,128,128,1,8,3,1294.1603333333333,3
w13,24,60,6,3584,2304,16,128,128,16,4,2,1296.7740000000001,3
w13,24,60,6,3584,2304,16,128,128,16,4,3,1297.541,3
w13,24,60,6,3584,2304,16,128,128,16,8,2,1295.5366666666666,3
w13,24,60,6,3584,2304,16,128,128,16,8,3,1297.9466666666667,3
w13,24,60,6,3584,2304,16,128,128,32,4,2,1296.7946666666667,3
w13,24,60,6,3584,2304,16,128,128,32,4,3,1296.3790000000001,3
w13,24,60,6,3584,2304,16,128,128,32,8,2,1297.125,3
w13,24,60,6,3584,2304,16,128,128,32,8,3,1295.8566666666666,3
w13,24,60,6,3584,2304,16,128,128,64,4,2,1298.277,3
w13,24,60,6,3584,2304,16,128,128,64,4,3,1296.1233333333332,3
w13,24,60,6,3584,2304,16,128,128,64,8,3,1297.4456666666667,3
w13,24,60,6,3584,2304,32,16,128,4,4,3,1294.821,3
w13,24,60,6,3584,2304,32,16,128,4,4,4,1297.1366666666665,3
w13,24,60,6,3584,2304,32,16,128,4,8,3,1296.123,3
w13,24,60,6,3584,2304,32,32,128,1,4,2,1297.9996666666666,3
w13,24,60,6,3584,2304,32,32,128,1,4,3,1295.0566666666666,3
w13,24,60,6,3584,2304,32,32,128,1,4,4,1294.1493333333335,3
w13,24,60,6,3584,2304,32,32,128,1,8,3,1295.7393333333332,3
w13,24,60,6,3584,2304,32,32,128,1,8,4,1295.0346666666667,3
w13,24,60,6,3584,2304,32,32,128,4,4,3,1296.1866666666667,3
w13,24,60,6,3584,2304,32,32,128,4,4,4,1295.59,3
w13,24,60,6,3584,2304,32,32,128,4,8,3,1295.9633333333334,3
w13,24,60,6,3584,2304,32,32,128,4,8,4,1296.3893333333333,3
w13,24,60,6,3584,2304,32,32,128,16,4,3,1296.7093333333332,3
w13,24,60,6,3584,2304,32,32,128,16,4,4,1295.5473333333332,3
w13,24,60,6,3584,2304,32,32,128,16,8,4,1297.286,3
w13,24,60,6,3584,2304,32,32,256,1,4,2,1295.195,3
w13,24,60,6,3584,2304,32,32,256,1,4,3,1293.3063333333332,3
w13,24,60,6,3584,2304,32,32,256,1,4,4,1294.107,3
w13,24,60,6,3584,2304,32,32,256,1,8,2,1296.7203333333334,3
w13,24,60,6,3584,2304,32,32,256,1,8,3,1293.4986666666666,3
w13,24,60,6,3584,2304,32,32,256,1,8,4,1293.7233333333334,3
w13,24,60,6,3584,2304,32,32,256,4,4,2,1296.539,3
w13,24,60,6,3584,2304,32,32,256,4,4,3,1295.568,3
w13,24,60,6,3584,2304,32,32,256,4,4,4,1294.853,3
w13,24,60,6,3584,2304,32,32,256,4,8,2,1296.219,3
w13,24,60,6,3584,2304,32,32,256,4,8,3,1295.6006666666667,3
w13,24,60,6,3584,2304,32,32,256,4,8,4,1295.536,3
w13,24,60,6,3584,2304,32,32,256,16,4,2,1297.8293333333334,3
w13,24,60,6,3584,2304,32,32,256,16,4,3,1296.4216666666669,3
w13,24,60,6,3584,2304,32,32,256,16,4,4,1296.7203333333334,3
w13,24,60,6,3584,2304,32,32,256,16,8,2,1297.6056666666666,3
w13,24,60,6,3584,2304,32,32,256,16,8,3,1296.8483333333334,3
w13,24,60,6,3584,2304,32,32,256,16,8,4,1297.04,3
w13,24,60,6,3584,2304,32,32,256,32,4,3,1297.4773333333333,3
w13,24,60,6,3584,2304,32,32,256,32,4,4,1296.965,3
w13,24,60,6,3584,2304,32,32,256,32,8,2,1298.1606666666667,3
w13,24,60,6,3584,2304,32,32,256,32,8,3,1298.5330000000001,3
w13,24,60,6,3584,2304,32,32,256,32,8,4,1297.9363333333333,3
w13,24,60,6,3584,2304,32,64,128,1,4,2,1295.4716666666666,3
w13,24,60,6,3584,2304,32,64,128,1,4,3,1294.8966666666668,3
w13,24,60,6,3584,2304,32,64,128,1,4,4,1295.0240000000001,3
w13,24,60,6,3584,2304,32,64,128,1,8,2,1296.123,3
w13,24,60,6,3584,2304,32,64,128,1,8,3,1295.0136666666667,3
w13,24,60,6,3584,2304,32,64,128,1,8,4,1294.438,3
w13,24,60,6,3584,2304,32,64,128,4,4,2,1297.4350000000002,3
w13,24,60,6,3584,2304,32,64,128,4,4,3,1297.0086666666666,3
w13,24,60,6,3584,2304,32,64,128,4,4,4,1296.144,3
w13,24,60,6,3584,2304,32,64,128,4,8,2,1297.5526666666667,3
w13,24,60,6,3584,2304,32,64,128,4,8,3,1298.2343333333333,3
w13,24,60,6,3584,2304,32,64,128,4,8,4,1295.3126666666667,3
w13,24,60,6,3584,2304,32,64,128,16,4,2,1298.064,3
w13,24,60,6,3584,2304,32,64,128,16,4,4,1298.224,3
w13,24,60,6,3584,2304,32,64,128,16,8,2,1297.702,3
w13,24,60,6,3584,2304,32,64,128,16,8,4,1297.0723333333333,3
w13,24,60,6,3584,2304,32,64,128,32,4,2,1297.755,3
w13,24,60,6,3584,2304,32,64,128,32,4,3,1297.7866666666666,3
w13,24,60,6,3584,2304,32,64,128,32,4,4,1297.5633333333333,3
w13,24,60,6,3584,2304,32,64,128,32,8,2,1298.5653333333332,3
w13,24,60,6,3584,2304,32,64,128,32,8,3,1297.0193333333334,3
w13,24,60,6,3584,2304,32,64,128,32,8,4,1297.2,3
w13,24,60,6,3584,2304,32,64,128,64,8,3,1298.5543333333333,3
w13,24,60,6,3584,2304,32,64,256,1,4,2,1294.3310000000001,3
w13,24,60,6,3584,2304,32,64,256,1,4,3,1294.6716666666666,3
w13,24,60,6,3584,2304,32,64,256,1,8,2,1295.0456666666666,3
w13,24,60,6,3584,2304,32,64,256,1,8,3,1294.3096666666668,3
w13,24,60,6,3584,2304,32,64,256,8,4,2,1296.0266666666666,3
w13,24,60,6,3584,2304,32,64,256,8,4,3,1295.462,3
w13,24,60,6,3584,2304,32,64,256,8,8,2,1297.5736666666667,3
w13,24,60,6,3584,2304,32,64,256,8,8,3,1295.9840000000002,3
w13,24,60,6,3584,2304,32,64,256,16,4,2,1297.5420000000001,3
w13,24,60,6,3584,2304,32,64,256,16,4,3,1296.006,3
w13,24,60,6,3584,2304,32,64,256,16,8,2,1298.1706666666666,3
w13,24,60,6,3584,2304,32,64,256,16,8,3,1295.835,3
w13,24,60,6,3584,2304,32,64,256,32,4,2,1296.998,3
w13,24,60,6,3584,2304,32,64,256,32,8,2,1297.3819999999998,3
w13,24,60,6,3584,2304,32,64,256,32,8,3,1296.9543333333334,3
w13,24,60,6,3584,2304,32,64,256,64,8,2,1298.491,3
w13,24,60,6,3584,2304,32,128,128,1,4,2,1295.8663333333334,3
w13,24,60,6,3584,2304,32,128,128,1,4,3,1294.9286666666667,3
w13,24,60,6,3584,2304,32,128,128,1,8,2,1295.2483333333332,3
w13,24,60,6,3584,2304,32,128,128,1,8,3,1294.3633333333335,3
w13,24,60,6,3584,2304,32,128,128,4,4,2,1297.2423333333334,3
w13,24,60,6,3584,2304,32,128,128,4,4,3,1297.1153333333334,3
w13,24,60,6,3584,2304,32,128,128,4,8,2,1296.3473333333334,3
w13,24,60,6,3584,2304,32,128,128,4,8,3,1298.1276666666665,3
w13,24,60,6,3584,2304,32,128,128,8,4,2,1298.278,3
w13,24,60,6,3584,2304,32,128,128,8,4,3,1297.509,3
w13,24,60,6,3584,2304,32,128,128,8,8,2,1297.3279999999997,3
w13,24,60,6,3584,2304,32,128,128,8,8,3,1296.1333333333332,3
w13,24,60,6,3584,2304,32,128,128,16,4,2,1297.7126666666666,3
w13,24,60,6,3584,2304,32,128,128,16,4,3,1298.0643333333335,3
w13,24,60,6,3584,2304,32,128,128,16,8,2,1296.485,3
w13,24,60,6,3584,2304,32,128,128,16,8,3,1298.246,3
w13,24,60,6,3584,2304,32,128,128,32,4,2,1296.7843333333333,3
w13,24,60,6,3584,2304,32,128,128,32,4,3,1298.2993333333334,3
w13,24,60,6,3584,2304,32,128,128,32,8,2,1298.214,3
w13,24,60,6,3584,2304,32,128,128,32,8,3,1296.656,3
w13,24,60,6,3584,2304,32,128,128,64,4,3,1297.776,3
w13,24,60,6,3584,2304,32,128,128,64,8,3,1297.5206666666666,3
w13,24,60,6,3584,2304,64,32,128,1,4,2,1297.9896666666666,3
w13,24,60,6,3584,2304,64,32,128,1,4,3,1295.8136666666667,3
w13,24,60,6,3584,2304,64,32,128,1,4,4,1297.5736666666667,3
w13,24,60,6,3584,2304,64,32,128,1,8,2,1295.8566666666666,3
w13,24,60,6,3584,2304,64,32,128,1,8,3,1295.9313333333332,3
w13,24,60,6,3584,2304,64,32,128,1,8,4,1296.102,3
w13,24,60,6,3584,2304,64,32,128,16,4,3,1297.6696666666667,3
w13,24,60,6,3584,2304,64,32,128,16,8,3,1298.214,3
w13,24,60,6,3584,2304,64,32,256,1,4,2,1296.763,3
w13,24,60,6,3584,2304,64,32,256,1,4,3,1294.6716666666666,3
w13,24,60,6,3584,2304,64,32,256,1,8,2,1296.2936666666667,3
w13,24,60,6,3584,2304,64,32,256,1,8,3,1294.7259999999999,3
w13,24,60,6,3584,2304,64,64,128,1,4,2,1295.419,3
w13,24,60,6,3584,2304,64,64,128,1,4,3,1296.2193333333335,3
w13,24,60,6,3584,2304,64,64,128,1,4,4,1296.3686666666665,3
w13,24,60,6,3584,2304,64,64,128,1,8,2,1296.614,3
w13,24,60,6,3584,2304,64,64,128,1,8,3,1295.6643333333334,3
w13,24,60,6,3584,2304,64,64,128,1,8,4,1296.9123333333334,3
w13,24,60,6,3584,2304,64,64,128,4,4,2,1296.923,3
w13,24,60,6,3584,2304,64,64,128,4,4,4,1298.2566666666664,3
w13,24,60,6,3584,2304,64,64,128,4,8,4,1298.47,3
w13,24,60,6,3584,2304,64,64,128,8,4,2,1297.1580000000001,3
w13,24,60,6,3584,2304,64,64,128,8,4,4,1298.1073333333334,3
w13,24,60,6,3584,2304,64,64,128,8,8,4,1298.2563333333335,3
w13,24,60,6,3584,2304,64,128,128,1,4,2,1297.3386666666668,3
w13,24,60,6,3584,2304,64,128,128,1,8,2,1296.752,3
w13,24,60,6,3584,2304,64,128,128,1,8,3,1295.483,3
w13,24,60,6,3584,2304,64,128,128,4,8,2,1298.7146666666667,3
w13,24,60,6,3584,2304,64,128,128,4,8,3,1298.694,3
w13,24,60,6,3584,2304,64,128,128,16,8,2,1298.0856666666666,3
w13,24,60,8,2048,1536,16,32,128,1,4,2,493.6766666666667,3
w13,24,60,8,2048,1536,16,32,256,1,4,2,495.05300000000005,3
w13,24,60,8,2048,1536,16,64,128,1,4,2,494.99933333333337,3
w13,24,60,8,2048,1536,16,128,128,1,4,2,494.9246666666666,3
w13,24,60,8,2048,1536,32,16,128,4,4,2,495.05266666666665,3
w13,24,60,8,2048,1536,32,32,256,1,4,2,495.81,3
w13,24,60,8,2048,1536,32,64,128,1,4,2,494.42333333333335,3
w13,24,60,8,2048,1536,32,64,256,1,4,2,495.3513333333333,3
w13,24,60,8,2048,1536,32,128,128,1,4,2,495.82099999999997,3
w13,24,64,6,3072,2048,16,16,128,1,4,3,1053.6046666666668,3
w13,24,64,6,3072,2048,16,16,128,1,4,4,1054.2023333333334,3
w13,24,64,6,3072,2048,16,16,128,1,8,4,1056.3143333333335,3
w13,24,64,6,3072,2048,16,16,128,4,4,3,1055.3106666666665,3
w13,24,64,6,3072,2048,16,16,128,4,4,4,1054.9596666666666,3
w13,24,64,6,3072,2048,16,16,256,1,4,3,1051.8876666666667,3
w13,24,64,6,3072,2048,16,16,256,1,4,4,1052.4306666666666,3
w13,24,64,6,3072,2048,16,16,256,1,8,2,1054.1053333333332,3
w13,24,64,6,3072,2048,16,16,256,1,8,3,1054.501,3
w13,24,64,6,3072,2048,16,16,256,1,8,4,1054.1276666666665,3
w13,24,64,6,3072,2048,16,16,256,4,4,2,1056.293,3
w13,24,64,6,3072,2048,16,16,256,4,4,3,1052.8149999999998,3
w13,24,64,6,3072,2048,16,16,256,4,4,4,1052.7833333333333,3
w13,24,64,6,3072,2048,16,16,256,4,8,2,1055.845,3
w13,24,64,6,3072,2048,16,16,256,4,8,3,1054.2763333333335,3
w13,24,64,6,3072,2048,16,16,256,4,8,4,1053.711,3
w13,24,64,6,3072,2048,16,32,128,1,4,3,1055.5356666666667,3
w13,24,64,6,3072,2048,16,32,128,1,4,4,1053.6903333333332,3
w13,24,64,6,3072,2048,16,32,128,1,8,2,1056.1006666666665,3
w13,24,64,6,3072,2048,16,32,128,1,8,3,1055.6523333333332,3
w13,24,64,6,3072,2048,16,32,128,1,8,4,1055.1303333333333,3
w13,24,64,6,3072,2048,16,32,128,4,4,4,1055.012,3
w13,24,64,6,3072,2048,16,32,128,4,8,4,1055.8866666666665,3
w13,24,64,6,3072,2048,16,32,128,16,4,3,1054.7673333333332,3
w13,24,64,6,3072,2048,16,32,128,16,4,4,1054.7346666666665,3
w13,24,64,6,3072,2048,16,32,128,16,8,2,1056.8476666666668,3
w13,24,64,6,3072,2048,16,32,128,16,8,3,1055.3116666666667,3
w13,24,64,6,3072,2048,16,32,128,16,8,4,1054.6386666666667,3
w13,24,64,6,3072,2048,16,32,128,32,4,3,1055.0763333333334,3
w13,24,64,6,3072,2048,16,32,128,32,4,4,1054.9063333333334,3
w13,24,64,6,3072,2048,16,32,128,32,8,2,1056.74,3
w13,24,64,6,3072,2048,16,32,128,32,8,3,1056.1006666666665,3
w13,24,64,6,3072,2048,16,32,128,32,8,4,1054.3943333333334,3
w13,24,64,6,3072,2048,16,32,128,64,4,3,1054.0953333333334,3
w13,24,64,6,3072,2048,16,32,128,64,4,4,1054.8423333333333,3
w13,24,64,6,3072,2048,16,32,128,64,8,2,1055.0123333333333,3
w13,24,64,6,3072,2048,16,32,128,64,8,3,1055.7160000000001,3
w13,24,64,6,3072,2048,16,32,128,64,8,4,1055.5993333333333,3
w13,24,64,6,3072,2048,16,32,256,1,4,2,1053.4236666666666,3
w13,24,64,6,3072,2048,16,32,256,1,4,3,1052.442,3
w13,24,64,6,3072,2048,16,32,256,1,4,4,1053.4653333333333,3
w13,24,64,6,3072,2048,16,32,256,1,8,2,1053.9673333333333,3
w13,24,64,6,3072,2048,16,32,256,1,8,3,1053.9996666666666,3
w13,24,64,6,3072,2048,16,32,256,1,8,4,1052.8786666666667,3
w13,24,64,6,3072,2048,16,32,256,16,4,2,1054.2976666666666,3
w13,24,64,6,3072,2048,16,32,256,16,4,3,1055.0236666666667,3
w13,24,64,6,3072,2048,16,32,256,16,4,4,1054.4146666666666,3
w13,24,64,6,3072,2048,16,32,256,16,8,2,1054.202,3
w13,24,64,6,3072,2048,16,32,256,16,8,3,1055.205,3
w13,24,64,6,3072,2048,16,32,256,16,8,4,1054.3613333333333,3
w13,24,64,6,3072,2048,16,32,256,32,4,2,1055.162,3
w13,24,64,6,3072,2048,16,32,256,32,4,3,1054.6713333333335,3
w13,24,64,6,3072,2048,16,32,256,32,4,4,1055.7060000000001,3
w13,24,64,6,3072,2048,16,32,256,32,8,2,1055.0876666666666,3
w13,24,64,6,3072,2048,16,32,256,32,8,3,1055.9083333333335,3
w13,24,64,6,3072,2048,16,32,256,32,8,4,1055.268,3
w13,24,64,6,3072,2048,16,32,256,64,4,2,1054.0313333333334,3
w13,24,64,6,3072,2048,16,32,256,64,4,3,1056.9116666666666,3
w13,24,64,6,3072,2048,16,32,256,64,4,4,1056.6016666666667,3
w13,24,64,6,3072,2048,16,32,256,64,8,2,1055.8336666666667,3
w13,24,64,6,3072,2048,16,32,256,64,8,3,1055.4823333333334,3
w13,24,64,6,3072,2048,16,32,256,64,8,4,1056.7079999999999,3
w13,24,64,6,3072,2048,16,64,128,1,4,2,1056.4953333333333,3
w13,24,64,6,3072,2048,16,64,128,1,4,3,1055.631,3
w13,24,64,6,3072,2048,16,64,128,1,4,4,1053.8500000000001,3
w13,24,64,6,3072,2048,16,64,128,1,8,2,1056.6983333333335,3
w13,24,64,6,3072,2048,16,64,128,1,8,3,1055.3756666666666,3
w13,24,64,6,3072,2048,16,64,128,1,8,4,1054.628,3
w13,24,64,6,3072,2048,16,64,128,16,4,3,1056.6236666666666,3
w13,24,64,6,3072,2048,16,64,128,16,4,4,1054.277,3
w13,24,64,6,3072,2048,16,64,128,16,8,3,1057.061,3
w13,24,64,6,3072,2048,16,64,128,16,8,4,1053.839,3
w13,24,64,6,3072,2048,16,64,128,32,4,3,1055.5143333333333,3
w13,24,64,6,3072,2048,16,64,128,32,4,4,1056.015,3
w13,24,64,6,3072,2048,16,64,128,32,8,3,1055.173,3
w13,24,64,6,3072,2048,16,64,128,32,8,4,1054.522,3
w13,24,64,6,3072,2048,16,64,128,64,4,2,1055.556,3
w13,24,64,6,3072,2048,16,64,128,64,4,3,1055.119,3
w13,24,64,6,3072,2048,16,64,128,64,4,4,1055.1836666666666,3
w13,24,64,6,3072,2048,16,64,128,64,8,2,1055.45,3
w13,24,64,6,3072,2048,16,64,128,64,8,3,1054.436,3
w13,24,64,6,3072,2048,16,64,128,64,8,4,1056.4316666666666,3
w13,24,64,6,3072,2048,16,64,256,1,4,2,1056.2493333333334,3
w13,24,64,6,3072,2048,16,64,256,1,4,3,1052.9213333333335,3
w13,24,64,6,3072,2048,16,64,256,1,8,2,1054.3729999999998,3
w13,24,64,6,3072,2048,16,64,256,1,8,3,1052.3033333333333,3
w13,24,64,6,3072,2048,16,64,256,16,4,2,1054.9906666666666,3
w13,24,64,6,3072,2048,16,64,256,16,4,3,1053.7863333333335,3
w13,24,64,6,3072,2048,16,64,256,16,8,2,1055.2046666666668,3
w13,24,64,6,3072,2048,16,64,256,16,8,3,1053.6146666666666,3
w13,24,64,6,3072,2048,16,64,256,32,4,2,1055.3426666666667,3
w13,24,64,6,3072,2048,16,64,256,32,4,3,1055.9193333333333,3
w13,24,64,6,3072,2048,16,64,256,32,8,2,1055.0236666666667,3
w13,24,64,6,3072,2048,16,64,256,32,8,3,1054.6823333333332,3
w13,24,64,6,3072,2048,16,64,256,64,4,2,1054.8636666666666,3
w13,24,64,6,3072,2048,16,64,256,64,4,3,1056.1536666666668,3
w13,24,64,6,3072,2048,16,64,256,64,8,2,1054.8633333333335,3
w13,24,64,6,3072,2048,16,64,256,64,8,3,1055.7163333333335,3
w13,24,64,6,3072,2048,16,128,128,1,4,2,1056.2396666666666,3
w13,24,64,6,3072,2048,16,128,128,1,4,3,1055.162,3
w13,24,64,6,3072,2048,16,128,128,1,8,3,1055.6636666666666,3
w13,24,64,6,3072,2048,16,128,128,16,4,3,1056.0263333333332,3
w13,24,64,6,3072,2048,16,128,128,16,8,3,1056.1436666666666,3
w13,24,64,6,3072,2048,16,128,128,32,4,2,1056.6343333333334,3
w13,24,64,6,3072,2048,16,128,128,32,4,3,1055.993333333333,3
w13,24,64,6,3072,2048,16,128,128,32,8,2,1055.8976666666667,3
w13,24,64,6,3072,2048,16,128,128,32,8,3,1056.8796666666667,3
w13,24,64,6,3072,2048,16,128,128,64,4,3,1054.3729999999998,3
w13,24,64,6,3072,2048,16,128,128,64,8,3,1054.309,3
w13,24,64,6,3072,2048,32,16,128,4,4,3,1053.9136666666666,3
w13,24,64,6,3072,2048,32,16,128,4,4,4,1052.901,3
w13,24,64,6,3072,2048,32,16,128,4,8,3,1055.8983333333333,3
w13,24,64,6,3072,2048,32,16,128,4,8,4,1054.852,3
w13,24,64,6,3072,2048,32,32,128,1,4,2,1056.751,3
w13,24,64,6,3072,2048,32,32,128,1,4,3,1055.151,3
w13,24,64,6,3072,2048,32,32,128,1,4,4,1054.575,3
w13,24,64,6,3072,2048,32,32,128,1,8,2,1056.261,3
w13,24,64,6,3072,2048,32,32,128,1,8,3,1056.122,3
w13,24,64,6,3072,2048,32,32,128,1,8,4,1055.8763333333334,3
w13,24,64,6,3072,2048,32,32,128,4,4,4,1055.1516666666666,3
w13,24,64,6,3072,2048,32,32,128,4,8,3,1054.959,3
w13,24,64,6,3072,2048,32,32,128,4,8,4,1056.5483333333334,3
w13,24,64,6,3072,2048,32,32,128,16,4,3,1055.2046666666668,3
w13,24,64,6,3072,2048,32,32,128,16,4,4,1055.055,3
w13,24,64,6,3072,2048,32,32,128,16,8,2,1056.9323333333334,3
w13,24,64,6,3072,2048,32,32,128,16,8,3,1055.5356666666667,3
w13,24,64,6,3072,2048,32,32,128,16,8,4,1054.618,3
w13,24,64,6,3072,2048,32,32,128,64,4,2,1054.309,3
w13,24,64,6,3072,2048,32,32,128,64,4,3,1055.3746666666666,3
w13,24,64,6,3072,2048,32,32,128,64,4,4,1054.9063333333334,3
w13,24,64,6,3072,2048,32,32,128,64,8,2,1055.6416666666667,3
w13,24,64,6,3072,2048,32,32,128,64,8,3,1054.714,3
w13,24,64,6,3072,2048,32,32,128,64,8,4,1056.186,3
w13,24,64,6,3072,2048,32,32,256,1,4,2,1054.6706666666666,3
w13,24,64,6,3072,2048,32,32,256,1,4,3,1052.6343333333334,3
w13,24,64,6,3072,2048,32,32,256,1,4,4,1052.527,3
w13,24,64,6,3072,2048,32,32,256,1,8,2,1054.586,3
w13,24,64,6,3072,2048,32,32,256,1,8,3,1052.7196666666666,3
w13,24,64,6,3072,2048,32,32,256,1,8,4,1052.8146666666669,3
w13,24,64,6,3072,2048,32,32,256,4,4,2,1054.3943333333334,3
w13,24,64,6,3072,2048,32,32,256,4,4,3,1052.5486666666666,3
w13,24,64,6,3072,2048,32,32,256,4,4,4,1053.4973333333335,3
w13,24,64,6,3072,2048,32,32,256,4,8,2,1054.501,3
w13,24,64,6,3072,2048,32,32,256,4,8,3,1053.2203333333334,3
w13,24,64,6,3072,2048,32,32,256,4,8,4,1053.669,3
w13,24,64,6,3072,2048,32,32,256,16,4,2,1054.5006666666666,3
w13,24,64,6,3072,2048,32,32,256,16,4,3,1054.4576666666667,3
w13,24,64,6,3072,2048,32,32,256,16,4,4,1054.213,3
w13,24,64,6,3072,2048,32,32,256,16,8,2,1055.0976666666666,3
w13,24,64,6,3072,2048,32,32,256,16,8,3,1054.9703333333334,3
w13,24,64,6,3072,2048,32,32,256,16,8,4,1054.372,3
w13,24,64,6,3072,2048,32,32,256,32,4,2,1054.2663333333333,3
w13,24,64,6,3072,2048,32,32,256,32,4,3,1055.0876666666666,3
w13,24,64,6,3072,2048,32,32,256,32,4,4,1056.1756666666668,3
w13,24,64,6,3072,2048,32,32,256,32,8,2,1054.1166666666666,3
w13,24,64,6,3072,2048,32,32,256,32,8,3,1056.207,3
w13,24,64,6,3072,2048,32,32,256,32,8,4,1055.6956666666667,3
w13,24,64,6,3072,2048,32,64,128,1,4,3,1055.7273333333333,3
w13,24,64,6,3072,2048,32,64,128,1,4,4,1054.5113333333334,3
w13,24,64,6,3072,2048,32,64,128,1,8,3,1055.567,3
w13,24,64,6,3072,2048,32,64,128,1,8,4,1054.6393333333333,3
w13,24,64,6,3072,2048,32,64,128,4,4,4,1055.397,3
w13,24,64,6,3072,2048,32,64,128,4,8,4,1055.1506666666667,3
w13,24,64,6,3072,2048,32,64,128,16,4,3,1056.58,3
w13,24,64,6,3072,2048,32,64,128,16,4,4,1054.8953333333334,3
w13,24,64,6,3072,2048,32,64,128,16,8,4,1054.319,3
w13,24,64,6,3072,2048,32,64,128,32,4,3,1056.9533333333334,3
w13,24,64,6,3072,2048,32,64,128,32,4,4,1055.0023333333334,3
w13,24,64,6,3072,2048,32,64,128,32,8,3,1056.5593333333334,3
w13,24,64,6,3072,2048,32,64,128,32,8,4,1054.4263333333333,3
w13,24,64,6,3072,2048,32,64,128,64,4,2,1056.5266666666666,3
w13,24,64,6,3072,2048,32,64,128,64,4,3,1055.3113333333333,3
w13,24,64,6,3072,2048,32,64,128,64,4,4,1055.887,3
w13,24,64,6,3072,2048,32,64,128,64,8,2,1055.7593333333334,3
w13,24,64,6,3072,2048,32,64,128,64,8,3,1054.6816666666666,3
w13,24,64,6,3072,2048,32,64,128,64,8,4,1055.621,3
w13,24,64,6,3072,2048,32,64,256,1,4,2,1055.332,3
w13,24,64,6,3072,2048,32,64,256,1,4,3,1053.5836666666667,3
w13,24,64,6,3072,2048,32,64,256,1,8,2,1055.8770000000002,3
w13,24,64,6,3072,2048,32,64,256,1,8,3,1052.8573333333334,3
w13,24,64,6,3072,2048,32,64,256,8,4,3,1054.4370000000001,3
w13,24,64,6,3072,2048,32,64,256,8,8,2,1057.103,3
w13,24,64,6,3072,2048,32,64,256,8,8,3,1053.8076666666666,3
w13,24,64,6,3072,2048,32,64,256,16,4,2,1056.5159999999998,3
w13,24,64,6,3072,2048,32,64,256,16,4,3,1054.5756666666666,3
w13,24,64,6,3072,2048,32,64,256,16,8,2,1054.7783333333334,3
w13,24,64,6,3072,2048,32,64,256,16,8,3,1054.5856666666666,3
w13,24,64,6,3072,2048,32,64,256,32,4,2,1056.8793333333333,3
w13,24,64,6,3072,2048,32,64,256,32,4,3,1055.6953333333333,3
w13,24,64,6,3072,2048,32,64,256,32,8,2,1055.8336666666667,3
w13,24,64,6,3072,2048,32,64,256,32,8,3,1055.1943333333334,3
w13,24,64,6,3072,2048,32,64,256,64,4,2,1055.3856666666668,3
w13,24,64,6,3072,2048,32,64,256,64,4,3,1056.6343333333332,3
w13,24,64,6,3072,2048,32,64,256,64,8,2,1054.8423333333333,3
w13,24,64,6,3072,2048,32,64,256,64,8,3,1055.7266666666667,3
w13,24,64,6,3072,2048,32,128,128,1,4,3,1057.103,3
w13,24,64,6,3072,2048,32,128,128,1,8,3,1055.9196666666667,3
w13,24,64,6,3072,2048,32,128,128,16,4,3,1057.093,3
w13,24,64,6,3072,2048,32,128,128,16,8,3,1056.932,3
w13,24,64,6,3072,2048,32,128,128,32,8,2,1057.156,3
w13,24,64,6,3072,2048,32,128,128,32,8,3,1056.6236666666666,3
w13,24,64,6,3072,2048,32,128,128,64,4,3,1055.4716666666666,3
w13,24,64,6,3072,2048,32,128,128,64,8,3,1053.8500000000001,3
w13,24,64,6,3072,2048,64,32,128,1,4,3,1054.6076666666665,3
w13,24,64,6,3072,2048,64,32,128,1,8,3,1054.2126666666666,3
w13,24,64,6,3072,2048,64,32,128,1,8,4,1055.6103333333333,3
w13,24,64,6,3072,2048,64,32,128,16,4,2,1056.25,3
w13,24,64,6,3072,2048,64,32,128,16,4,3,1055.1623333333334,3
w13,24,64,6,3072,2048,64,32,128,16,8,2,1056.7089999999998,3
w13,24,64,6,3072,2048,64,32,128,16,8,3,1054.799,3
w13,24,64,6,3072,2048,64,32,256,1,4,2,1056.8686666666665,3
w13,24,64,6,3072,2048,64,32,256,1,4,3,1055.1836666666668,3
w13,24,64,6,3072,2048,64,32,256,1,8,2,1054.2659999999998,3
w13,24,64,6,3072,2048,64,32,256,1,8,3,1053.423,3
w13,24,64,6,3072,2048,64,64,128,1,4,3,1056.0156666666667,3
w13,24,64,6,3072,2048,64,64,128,1,4,4,1055.8976666666667,3
w13,24,64,6,3072,2048,64,64,128,4,4,4,1057.114,3
w13,24,64,6,3072,2048,64,64,128,4,8,4,1056.069,3
w13,24,64,6,3072,2048,64,64,128,8,4,3,1056.3036666666667,3
w13,24,64,6,3072,2048,64,64,128,8,4,4,1056.0153333333335,3
w13,24,64,6,3072,2048,64,64,128,8,8,3,1055.5463333333335,3
w13,24,64,6,3072,2048,64,64,128,8,8,4,1056.517,3
w13,24,64,6,3072,2048,64,64,128,16,4,3,1055.269,3
w13,24,64,6,3072,2048,64,64,128,16,4,4,1055.8333333333333,3
w13,24,64,6,3072,2048,64,64,128,16,8,3,1055.5883333333334,3
w13,24,64,6,3072,2048,64,64,128,16,8,4,1055.9303333333335,3
w13,24,64,6,3072,2048,64,64,128,32,4,3,1055.365,3
w13,24,64,6,3072,2048,64,64,128,32,8,3,1055.6850000000002,3
w13,24,64,6,3072,2048,64,64,128,32,8,4,1055.5993333333333,3
w13,24,64,6,3072,2048,64,64,128,64,4,3,1056.6866666666667,3
w13,24,64,6,3072,2048,64,64,128,64,4,4,1056.165,3
w13,24,64,6,3072,2048,64,64,128,64,8,2,1056.2823333333333,3
w13,24,64,6,3072,2048,64,64,128,64,8,3,1056.3463333333332,3
w13,24,64,6,3072,2048,64,128,128,64,8,3,1056.2286666666666,3
w13,24,64,6,3584,1536,16,16,64,1,4,3,924.6536666666667,3
w13,24,64,6,3584,1536,16,16,128,1,4,2,921.4433333333333,3
w13,24,64,6,3584,1536,16,16,128,1,4,3,924.1523333333333,3
w13,24,64,6,3584,1536,16,16,128,1,4,4,921.4323333333333,3
w13,24,64,6,3584,1536,16,16,128,1,8,2,922.9793333333333,3
w13,24,64,6,3584,1536,16,16,128,1,8,4,924.4513333333334,3
w13,24,64,6,3584,1536,16,16,128,4,4,2,920.8029999999999,3
w13,24,64,6,3584,1536,16,16,128,4,4,4,921.9870000000001,3
w13,24,64,6,3584,1536,16,16,128,4,8,2,922.8193333333334,3
w13,24,64,6,3584,1536,16,16,128,4,8,4,924.473,3
w13,24,64,6,3584,1536,16,16,256,1,4,3,920.942,3
w13,24,64,6,3584,1536,16,16,256,1,4,4,921.614,3
w13,24,64,6,3584,1536,16,16,256,1,8,3,921.9549999999999,3
w13,24,64,6,3584,1536,16,16,256,1,8,4,922.9476666666666,3
w13,24,64,6,3584,1536,16,16,256,4,4,2,924.686,3
w13,24,64,6,3584,1536,16,16,256,4,4,3,920.974,3
w13,24,64,6,3584,1536,16,16,256,4,4,4,920.8356666666667,3
w13,24,64,6,3584,1536,16,16,256,4,8,2,924.526,3
w13,24,64,6,3584,1536,16,16,256,4,8,3,921.1766666666666,3
