pipetuning_test/moe_dse/moe_dse_H20_top3.csv
weight_type,M,E,topk,H,N,BLOCK_SIZE_M,BLOCK_SIZE_N,BLOCK_SIZE_K,GROUP_SIZE_M,num_warps,num_stages,smem_size_KB,avg_duration,sample_count
w13,1,8,2,1024,512,16,32,128,1,4,3,37.0,4.034,3
w13,1,8,2,1024,512,16,32,128,4,4,3,37.0,4.034,3
w13,1,8,2,1024,512,16,32,128,16,4,3,37.0,4.034,3
w13,1,16,2,1536,768,16,64,128,32,8,3,62.0,6.199333333333333,3
w13,1,16,2,1536,768,16,64,128,64,8,3,62.0,6.199666666666666,3
w13,1,16,2,1536,768,16,64,128,16,8,3,62.0,6.231333333333333,3
w13,1,16,4,1536,1024,16,128,64,1,8,3,58.0,9.602,3
w13,1,16,4,1536,1024,16,128,64,1,8,4,76.0,9.634333333333332,3
w13,1,16,4,1536,1024,16,64,128,32,4,3,62.0,9.741,3
w13,1,32,4,2048,768,16,32,128,64,4,3,37.0,10.53,3
w13,1,32,4,2048,768,16,32,128,1,4,3,37.0,10.541,3
w13,1,32,4,2048,768,16,32,128,32,4,3,37.0,10.551666666666668,3
w13,1,32,6,3072,1024,16,32,128,64,4,4,49.0,25.06866666666667,3
w13,1,32,6,3072,1024,16,32,128,1,4,4,49.0,25.122,3
w13,1,32,6,3072,1024,16,32,128,4,4,4,49.0,25.239666666666665,3
w13,1,60,4,2048,1408,16,32,128,4,4,4,49.0,15.820666666666668,3
w13,1,60,4,2048,1408,16,32,128,32,4,4,49.0,15.831666666666669,3
w13,1,60,4,2048,1408,16,32,128,1,4,4,49.0,15.895666666666664,3
w13,1,60,6,3584,2304,16,64,128,32,4,4,82.0,60.535333333333334,3
w13,1,60,6,3584,2304,16,64,128,16,4,4,82.0,60.812666666666665,3
w13,1,60,6,3584,2304,16,128,128,1,8,3,112.0,60.834,3
w13,1,60,8,2048,1536,16,64,64,32,4,3,32.0,32.54633333333333,3
w13,1,60,8,2048,1536,16,64,64,16,4,3,32.0,32.86633333333334,3
w13,1,60,8,2048,1536,16,64,64,1,4,3,32.0,32.88733333333334,3
w13,1,64,6,3072,2048,16,64,64,1,4,4,42.0,47.778333333333336,3
w13,1,64,6,3072,2048,16,64,64,16,4,3,32.0,47.970333333333336,3
w13,1,64,6,3072,2048,16,64,64,64,4,3,32.0,48.034,3
w13,1,64,6,3584,1536,16,64,128,32,4,3,62.0,40.97266666666667,3
w13,1,64,6,3584,1536,16,64,128,1,4,3,62.0,41.069,3
w13,1,64,6,3584,1536,16,64,128,64,4,3,62.0,41.346,3
w13,1,64,8,3584,2560,16,64,128,1,4,4,82.0,88.109,3
w13,1,64,8,3584,2560,16,64,128,32,4,4,82.0,88.61033333333334,3
w13,1,64,8,3584,2560,16,64,128,64,4,4,82.0,89.11166666666668,3
w13,1,128,4,2048,512,16,64,128,32,8,3,62.0,7.5856666666666674,3
w13,1,128,4,2048,512,16,64,128,16,8,3,62.0,7.586333333333333,3
w13,1,128,4,2048,512,16,64,128,64,8,3,62.0,7.586333333333333,3
w13,1,128,6,4096,2048,16,64,64,16,4,3,32.0,63.51166666666666,3
w13,1,128,6,4096,2048,16,64,64,16,4,4,42.0,63.78933333333333,3
w13,1,128,6,4096,2048,16,64,128,64,4,4,82.0,63.81,3
w13,1,128,8,2048,768,16,32,128,4,4,4,49.0,16.29,3
w13,1,128,8,2048,768,16,32,128,16,4,4,49.0,16.386,3
w13,1,128,8,2048,768,16,32,128,32,4,4,49.0,16.386333333333333,3
w13,1,128,8,4096,1536,16,64,64,32,4,3,32.0,64.09833333333334,3
w13,1,128,8,4096,1536,16,64,64,16,4,4,42.0,64.13,3
w13,1,128,8,4096,1536,16,64,64,16,4,3,32.0,64.173,3
w13,1,128,8,4096,3072,16,64,128,1,4,3,62.0,118.63733333333334,3
w13,1,128,8,4096,3072,16,32,128,64,4,5,61.0,119.62933333333332,3
w13,1,128,8,4096,3072,16,32,128,4,4,5,61.0,119.81033333333332,3
w13,2,8,2,1024,512,16,64,128,16,8,3,62.0,4.887333333333333,3
w13,2,8,2,1024,512,16,64,128,64,8,3,62.0,4.898,3
w13,2,8,2,1024,512,16,64,128,32,8,3,62.0,4.909,3
w13,2,16,2,1536,768,16,32,128,1,4,3,37.0,8.449666666666666,3
w13,2,16,2,1536,768,16,32,128,16,4,3,37.0,8.482,3
w13,2,16,2,1536,768,16,32,128,32,4,3,37.0,8.503666666666666,3
w13,2,16,4,1536,1024,16,128,64,1,8,4,76.0,16.631666666666664,3
w13,2,16,4,1536,1024,16,128,64,64,8,4,76.0,16.801666666666666,3
w13,2,16,4,1536,1024,16,128,64,32,8,4,76.0,16.81266666666667,3
w13,2,32,4,2048,768,16,32,128,1,4,4,49.0,16.343333333333334,3
w13,2,32,4,2048,768,16,32,128,16,4,4,49.0,16.364666666666665,3
w13,2,32,4,2048,768,16,32,128,32,4,4,49.0,16.396666666666665,3
w13,2,32,6,3072,1024,16,64,64,1,4,4,42.0,47.586333333333336,3
w13,2,32,6,3072,1024,16,64,64,64,4,4,42.0,47.76733333333333,3
w13,2,32,6,3072,1024,16,64,64,32,4,4,42.0,47.86366666666667,3
w13,2,60,4,2048,1408,16,64,64,32,4,4,42.0,30.73266666666667,3
w13,2,60,4,2048,1408,16,64,64,1,4,4,42.0,30.754,3
w13,2,60,4,2048,1408,16,64,64,16,4,3,32.0,30.828999999999997,3
w13,2,60,6,3584,2304,16,128,128,32,8,3,112.0,115.20266666666669,3
w13,2,60,6,3584,2304,16,128,128,64,8,3,112.0,115.23433333333332,3
w13,2,60,6,3584,2304,16,128,128,16,8,3,112.0,115.34166666666664,3
w13,2,60,8,2048,1536,16,64,128,64,4,3,62.0,61.14333333333334,3
w13,2,60,8,2048,1536,16,64,128,16,4,3,62.0,61.23933333333334,3
w13,2,60,8,2048,1536,16,64,128,32,4,3,62.0,61.29266666666666,3
w13,2,64,6,3072,2048,16,64,128,16,4,3,62.0,88.66399999999999,3
w13,2,64,6,3072,2048,16,64,128,32,4,3,62.0,88.84500000000001,3
w13,2,64,6,3072,2048,16,64,128,64,4,3,62.0,89.00466666666667,3
w13,2,64,6,3584,1536,16,128,128,1,8,4,148.0,79.373,3
w13,2,64,6,3584,1536,16,128,128,16,8,4,148.0,79.39433333333334,3
w13,2,64,6,3584,1536,16,128,128,64,8,4,148.0,79.928,3
w13,2,64,8,3584,2560,16,128,128,1,8,3,112.0,167.07500000000002,3
w13,2,64,8,3584,2560,16,128,128,64,8,3,112.0,167.363,3
w13,2,64,8,3584,2560,16,128,128,32,8,3,112.0,167.85333333333332,3
w13,2,128,4,2048,512,16,128,64,1,8,3,58.0,11.96,3
w13,2,128,4,2048,512,16,128,64,1,8,4,76.0,12.023666666666664,3
w13,2,128,4,2048,512,16,64,128,32,4,3,62.0,12.034,3
w13,2,128,6,4096,2048,16,64,128,1,4,3,62.0,118.89333333333332,3
w13,2,128,6,4096,2048,16,64,128,16,8,5,102.0,120.06633333333332,3
w13,2,128,6,4096,2048,16,64,128,32,4,4,82.0,120.07733333333331,3
w13,2,128,8,2048,768,16,64,64,64,4,3,32.0,32.685,3
w13,2,128,8,2048,768,16,64,64,16,4,3,32.0,32.69533333333334,3
w13,2,128,8,2048,768,16,64,128,16,4,2,42.0,32.77033333333333,3
w13,2,128,8,4096,1536,16,32,128,64,4,5,61.0,119.704,3
w13,2,128,8,4096,1536,16,64,128,32,4,5,102.0,119.96,3
w13,2,128,8,4096,1536,16,64,128,16,4,3,62.0,120.14066666666668,3
w13,2,128,8,4096,3072,16,64,128,32,4,4,82.0,225.05866666666665,3
w13,2,128,8,4096,3072,16,64,128,16,4,4,82.0,225.14433333333332,3
w13,2,128,8,4096,3072,16,64,128,64,4,4,82.0,225.187,3
w13,4,8,2,1024,512,16,128,64,1,8,3,58.0,6.967666666666666,3
w13,4,8,2,1024,512,16,128,64,1,8,4,76.0,7.010000000000001,3
w13,4,8,2,1024,512,16,128,64,1,8,5,94.0,7.105999999999999,3
w13,4,16,2,1536,768,16,32,128,64,4,3,37.0,12.684666666666669,3
w13,4,16,2,1536,768,16,32,128,32,4,3,37.0,12.695666666666668,3
w13,4,16,2,1536,768,16,32,128,64,4,4,49.0,12.705999999999998,3
w13,4,16,4,1536,1024,16,64,64,64,4,3,32.0,32.386,3
w13,4,16,4,1536,1024,16,64,64,32,4,3,32.0,32.39666666666667,3
w13,4,16,4,1536,1024,16,64,64,1,4,3,32.0,32.492666666666665,3
w13,4,32,4,2048,768,16,64,64,32,4,3,32.0,32.08733333333333,3
w13,4,32,4,2048,768,16,64,64,16,4,3,32.0,32.119,3
w13,4,32,4,2048,768,16,64,64,1,4,3,32.0,32.183,3
w13,4,32,6,3072,1024,16,64,128,32,4,3,62.0,88.51400000000001,3
w13,4,32,6,3072,1024,16,64,128,64,4,3,62.0,88.63166666666666,3
w13,4,32,6,3072,1024,16,64,128,1,4,3,62.0,88.96233333333333,3
w13,4,60,4,2048,1408,16,64,128,1,4,3,62.0,55.681999999999995,3
w13,4,60,4,2048,1408,16,64,128,32,4,3,62.0,55.821,3
w13,4,60,4,2048,1408,16,64,128,16,4,3,62.0,55.864,3
w13,4,60,6,3584,2304,16,128,128,64,8,3,112.0,222.16066666666663,3
w13,4,60,6,3584,2304,16,128,128,1,8,3,112.0,222.16133333333337,3
w13,4,60,6,3584,2304,16,128,128,16,8,3,112.0,222.4813333333333,3
w13,4,60,8,2048,1536,16,64,128,1,4,3,62.0,116.05533333333334,3
w13,4,60,8,2048,1536,16,64,128,1,4,4,82.0,116.36533333333334,3
w13,4,60,8,2048,1536,16,64,128,32,4,3,62.0,116.45033333333332,3
w13,4,64,6,3072,2048,16,64,128,32,4,3,62.0,171.53366666666668,3
w13,4,64,6,3072,2048,16,64,128,1,4,3,62.0,171.98233333333334,3
w13,4,64,6,3072,2048,16,64,128,64,4,3,62.0,172.04566666666665,3
w13,4,64,6,3584,1536,16,64,128,1,4,3,62.0,150.45833333333334,3
w13,4,64,6,3584,1536,16,64,128,16,4,3,62.0,151.109,3
w13,4,64,6,3584,1536,16,64,128,64,4,3,62.0,151.38666666666666,3
w13,4,64,8,3584,2560,16,64,128,1,4,3,62.0,324.41900000000004,3
w13,4,64,8,3584,2560,16,64,128,64,4,3,62.0,325.987,3
w13,4,64,8,3584,2560,16,64,128,1,4,4,82.0,326.60633333333334,3
w13,4,128,4,2048,512,16,32,128,64,4,3,37.0,22.668666666666667,3
w13,4,128,4,2048,512,16,32,128,16,4,3,37.0,22.807,3
w13,4,128,4,2048,512,16,32,128,1,4,3,37.0,22.807333333333332,3
w13,4,128,6,4096,2048,16,64,128,16,4,4,82.0,224.658,3
w13,4,128,6,4096,2048,16,64,128,64,4,4,82.0,224.82833333333335,3
w13,4,128,6,4096,2048,16,64,128,32,4,4,82.0,224.914,3
w13,4,128,8,2048,768,16,64,128,16,4,3,62.0,61.23266666666667,3
w13,4,128,8,2048,768,16,64,128,32,4,3,62.0,61.24366666666666,3
w13,4,128,8,2048,768,16,64,128,1,4,3,62.0,61.32966666666667,3
w13,4,128,8,4096,1536,16,64,128,32,4,4,82.0,225.05866666666665,3
w13,4,128,8,4096,1536,16,64,128,64,4,4,82.0,226.24266666666665,3
w13,4,128,8,4096,1536,16,32,128,32,4,4,49.0,226.29633333333337,3
w13,4,128,8,4096,3072,16,128,128,16,8,4,148.0,436.633,3
w13,4,128,8,4096,3072,16,64,128,16,4,4,82.0,438.26433333333335,3
w13,4,128,8,4096,3072,16,64,128,16,8,4,82.0,439.5333333333333,3
w13,8,8,2,1024,512,16,128,64,1,8,3,58.0,6.956666666666666,3
w13,8,8,2,1024,512,16,128,64,1,8,4,76.0,6.967333333333333,3
w13,8,8,2,1024,512,16,128,64,1,8,5,94.0,7.106333333333333,3
w13,8,16,2,1536,768,16,64,64,1,4,4,42.0,25.17533333333333,3
w13,8,16,2,1536,768,16,64,64,32,4,4,42.0,25.506333333333338,3
w13,8,16,2,1536,768,16,64,64,16,4,4,42.0,25.53833333333333,3
w13,8,16,4,1536,1024,16,64,64,1,4,3,32.0,32.215333333333334,3
w13,8,16,4,1536,1024,16,64,64,32,4,3,32.0,32.61000000000001,3
w13,8,16,4,1536,1024,16,64,128,1,4,2,42.0,32.653,3
w13,8,32,4,2048,768,16,64,128,1,4,3,62.0,60.60933333333333,3
w13,8,32,4,2048,768,16,64,128,64,4,3,62.0,60.823,3
w13,8,32,4,2048,768,16,64,128,16,4,3,62.0,60.907999999999994,3
w13,8,32,6,3072,1024,16,32,128,4,4,3,37.0,118.50866666666668,3
w13,8,32,6,3072,1024,16,32,128,32,4,3,37.0,118.66866666666664,3
w13,8,32,6,3072,1024,16,32,128,16,4,3,37.0,119.03133333333334,3
w13,8,60,4,2048,1408,16,64,128,1,4,3,62.0,106.221,3
w13,8,60,4,2048,1408,16,64,128,64,4,3,62.0,106.76566666666668,3
w13,8,60,4,2048,1408,16,64,128,16,4,3,62.0,106.91433333333332,3
w13,8,60,6,3584,2304,16,64,128,64,4,3,62.0,435.33166666666665,3
w13,8,60,6,3584,2304,16,64,128,1,4,3,62.0,435.37466666666666,3
w13,8,60,6,3584,2304,16,64,128,1,4,4,82.0,435.684,3
w13,8,60,8,2048,1536,16,128,128,1,8,3,112.0,207.26699999999997,3
w13,8,60,8,2048,1536,16,64,128,1,4,3,62.0,207.77866666666668,3
w13,8,60,8,2048,1536,16,64,128,16,4,3,62.0,209.112,3
w13,8,64,6,3072,2048,16,128,128,1,8,3,112.0,332.185,3
w13,8,64,6,3072,2048,16,128,128,32,8,3,112.0,332.388,3
w13,8,64,6,3072,2048,16,128,128,64,8,3,112.0,332.974,3
w13,8,64,6,3584,1536,16,128,128,1,8,3,112.0,295.939,3
w13,8,64,6,3584,1536,16,64,128,1,4,4,82.0,296.0783333333334,3
w13,8,64,6,3584,1536,16,128,128,16,8,4,148.0,296.34433333333334,3
w13,8,64,8,3584,2560,16,128,128,1,8,3,112.0,638.906,3
w13,8,64,8,3584,2560,16,64,128,64,4,3,62.0,639.1306666666666,3
w13,8,64,8,3584,2560,16,128,128,1,8,4,148.0,639.44,3
w13,8,128,4,2048,512,16,64,128,64,4,2,42.0,41.73,3
w13,8,128,4,2048,512,16,64,128,16,4,2,42.0,41.86866666666666,3
w13,8,128,4,2048,512,16,64,128,32,4,2,42.0,41.97533333333333,3
w13,8,128,6,4096,2048,16,128,128,16,8,4,148.0,438.713,3
w13,8,128,6,4096,2048,16,64,128,16,4,4,82.0,439.7159999999999,3
w13,8,128,6,4096,2048,16,64,128,64,4,4,82.0,439.8113333333333,3
w13,8,128,8,2048,768,16,128,128,1,8,4,148.0,115.76366666666668,3
w13,8,128,8,2048,768,16,64,128,1,4,3,62.0,115.79533333333336,3
w13,8,128,8,2048,768,16,128,128,1,8,3,112.0,116.243,3
w13,8,128,8,4096,1536,16,128,128,16,8,4,148.0,439.4703333333334,3
w13,8,128,8,4096,1536,16,64,128,32,4,4,82.0,440.7393333333334,3
w13,8,128,8,4096,1536,16,64,128,16,4,3,62.0,441.326,3
w13,8,128,8,4096,3072,16,64,128,16,4,4,82.0,867.6,3
w13,8,128,8,4096,3072,16,128,128,16,8,4,148.0,867.7283333333334,3
w13,8,128,8,4096,3072,16,32,128,16,4,4,49.0,868.3470000000001,3
w13,16,8,2,1024,512,16,128,64,1,8,3,58.0,6.977999999999999,3
w13,16,8,2,1024,512,16,128,64,1,8,4,76.0,7.074000000000001,3
w13,16,8,2,1024,512,16,128,64,1,8,5,94.0,7.191666666666666,3
w13,16,16,2,1536,768,16,64,64,1,4,4,42.0,25.09,3
w13,16,16,2,1536,768,16,64,64,32,4,4,42.0,25.45266666666667,3
w13,16,16,2,1536,768,16,64,64,16,4,4,42.0,25.474,3
w13,16,16,4,1536,1024,16,64,128,16,4,2,42.0,32.812999999999995,3
w13,16,16,4,1536,1024,16,64,64,1,4,3,32.0,32.877,3
w13,16,16,4,1536,1024,16,64,64,16,4,3,32.0,33.01533333333334,3
w13,16,32,4,2048,768,16,64,128,32,4,3,62.0,61.34633333333333,3
w13,16,32,4,2048,768,16,64,128,1,4,3,62.0,61.46333333333333,3
w13,16,32,4,2048,768,16,64,128,64,4,3,62.0,61.87966666666667,3
w13,16,32,6,3072,1024,16,32,128,16,4,3,37.0,118.59433333333334,3
w13,16,32,6,3072,1024,16,32,128,1,4,3,37.0,119.02066666666668,3
w13,16,32,6,3072,1024,16,32,128,32,4,3,37.0,119.117,3
w13,16,60,4,2048,1408,16,64,128,1,4,3,62.0,190.68,3
w13,16,60,4,2048,1408,16,128,128,1,8,3,112.0,191.33066666666664,3
w13,16,60,4,2048,1408,16,128,128,1,8,4,148.0,192.0666666666667,3
w13,16,60,6,3584,2304,16,128,128,16,8,3,112.0,540.6226666666666,3
w13,16,60,6,3584,2304,16,128,128,1,8,3,112.0,541.103,3
w13,16,60,6,3584,2304,16,64,128,32,4,3,62.0,541.2413333333333,3
w13,16,60,8,2048,1536,16,128,128,1,8,3,112.0,208.07766666666663,3
w13,16,60,8,2048,1536,16,64,128,1,4,3,62.0,209.05866666666668,3
w13,16,60,8,2048,1536,16,128,128,32,8,3,112.0,210.12566666666663,3
w13,16,64,6,3072,2048,16,128,128,1,8,4,148.0,441.46566666666666,3
w13,16,64,6,3072,2048,16,64,128,1,4,4,82.0,441.6893333333333,3
w13,16,64,6,3072,2048,16,128,128,64,8,3,112.0,441.69,3
w13,16,64,6,3584,1536,16,128,128,32,8,3,112.0,388.2803333333333,3
w13,16,64,6,3584,1536,16,64,128,16,4,3,62.0,388.5153333333334,3
w13,16,64,6,3584,1536,16,128,128,1,8,3,112.0,388.7826666666666,3
w13,16,64,8,3584,2560,16,64,128,1,4,3,62.0,639.845,3
w13,16,64,8,3584,2560,16,128,128,1,8,4,148.0,640.1436666666667,3
w13,16,64,8,3584,2560,16,64,128,64,4,3,62.0,641.3703333333333,3
w13,16,128,4,2048,512,16,64,128,16,4,2,42.0,79.21333333333332,3
w13,16,128,4,2048,512,16,64,128,64,4,2,42.0,79.672,3
w13,16,128,4,2048,512,16,64,128,32,4,2,42.0,79.70333333333333,3
w13,16,128,6,4096,2048,16,64,128,16,4,4,82.0,868.3573333333334,3
w13,16,128,6,4096,2048,16,64,128,32,4,4,82.0,869.4556666666667,3
w13,16,128,6,4096,2048,16,128,128,16,8,4,148.0,870.2346666666666,3
w13,16,128,8,2048,768,16,128,128,1,8,3,112.0,220.34399999999997,3
w13,16,128,8,2048,768,16,64,128,1,4,3,62.0,221.78366666666668,3
w13,16,128,8,2048,768,16,64,128,1,4,4,82.0,222.179,3
w13,16,128,8,4096,1536,16,64,128,16,4,4,82.0,867.9306666666666,3
w13,16,128,8,4096,1536,16,128,128,16,8,4,148.0,869.509,3
w13,16,128,8,4096,1536,16,64,128,32,4,4,82.0,869.734,3
w13,16,128,8,4096,3072,16,128,128,16,8,4,148.0,1725.7913333333331,3
w13,16,128,8,4096,3072,16,32,128,16,4,4,49.0,1726.0366666666669,3
w13,16,128,8,4096,3072,16,32,128,16,4,3,37.0,1726.6333333333332,3
w13,24,8,2,1024,512,16,128,64,1,8,3,58.0,7.073666666666667,3
w13,24,8,2,1024,512,16,128,64,1,8,4,76.0,7.0953333333333335,3
w13,24,8,2,1024,512,16,128,64,1,8,5,94.0,7.266000000000001,3
w13,24,16,2,1536,768,16,64,64,64,4,3,32.0,25.719333333333335,3
w13,24,16,2,1536,768,16,64,64,1,4,4,42.0,25.773,3
w13,24,16,2,1536,768,16,64,64,64,4,4,42.0,25.783666666666665,3
w13,24,16,4,1536,1024,16,64,64,16,4,3,32.0,32.89833333333333,3
w13,24,16,4,1536,1024,16,64,64,32,4,3,32.0,32.92966666666667,3
w13,24,16,4,1536,1024,16,64,128,32,4,2,42.0,32.961999999999996,3
w13,24,32,4,2048,768,16,64,128,1,4,3,62.0,61.666333333333334,3
w13,24,32,4,2048,768,16,64,128,16,4,3,62.0,61.74066666666667,3
w13,24,32,4,2048,768,16,64,128,64,4,3,62.0,61.78333333333333,3
w13,24,32,6,3072,1024,16,64,128,32,4,2,42.0,119.07433333333334,3
w13,24,32,6,3072,1024,16,32,128,16,4,3,37.0,119.38366666666668,3
w13,24,32,6,3072,1024,16,32,128,1,4,3,37.0,119.52233333333334,3
w13,24,60,4,2048,1408,16,128,128,1,8,3,112.0,190.6483333333333,3
w13,24,60,4,2048,1408,16,64,128,1,4,4,82.0,192.21633333333332,3
w13,24,60,4,2048,1408,16,64,128,1,4,3,62.0,192.46133333333333,3
w13,24,60,6,3584,2304,16,64,128,1,4,3,62.0,540.196,3
w13,24,60,6,3584,2304,16,64,128,16,4,3,62.0,540.8366666666667,3
w13,24,60,6,3584,2304,16,128,128,1,8,3,112.0,540.9216666666667,3
w13,24,60,8,2048,1536,16,128,128,1,8,3,112.0,209.35766666666663,3
w13,24,60,8,2048,1536,16,64,128,1,4,4,82.0,210.04033333333336,3
w13,24,60,8,2048,1536,16,64,128,1,4,3,62.0,210.275,3
w13,24,64,6,3072,2048,16,128,128,1,8,4,148.0,441.8813333333333,3
w13,24,64,6,3072,2048,16,128,128,32,8,3,112.0,442.10533333333336,3
w13,24,64,6,3072,2048,16,128,128,32,8,4,148.0,442.3296666666667,3
w13,24,64,6,3584,1536,16,128,128,16,8,3,112.0,388.79333333333335,3
w13,24,64,6,3584,1536,16,128,128,64,8,3,112.0,388.98533333333336,3
w13,24,64,6,3584,1536,16,128,128,1,8,3,112.0,389.76366666666667,3
w13,24,64,8,3584,2560,16,128,128,1,8,4,148.0,640.8373333333334,3
w13,24,64,8,3584,2560,16,64,128,1,4,3,62.0,641.0823333333334,3
w13,24,64,8,3584,2560,16,64,128,1,4,4,82.0,642.3306666666666,3
w13,24,128,4,2048,512,16,128,128,1,8,4,148.0,115.587,3
w13,24,128,4,2048,512,16,64,128,1,4,4,82.0,115.885,3
w13,24,128,4,2048,512,16,128,128,64,8,4,148.0,116.53633333333332,3
w13,24,128,6,4096,2048,16,64,128,16,4,4,82.0,1152.486666666667,3
w13,24,128,6,4096,2048,16,128,128,16,8,4,148.0,1153.8946666666668,3
w13,24,128,6,4096,2048,16,64,128,32,4,4,82.0,1154.8763333333334,3
w13,24,128,8,2048,768,16,64,128,1,4,3,62.0,221.176,3
w13,24,128,8,2048,768,16,128,128,1,8,3,112.0,221.54966666666667,3
w13,24,128,8,2048,768,16,64,128,1,4,4,82.0,222.12566666666663,3
w13,24,128,8,4096,1536,16,64,128,32,4,4,82.0,870.3953333333334,3
w13,24,128,8,4096,1536,16,128,128,16,8,4,148.0,870.7366666666667,3
w13,24,128,8,4096,1536,16,128,128,16,4,3,112.0,871.1206666666667,3
w13,24,128,8,4096,3072,16,64,128,16,4,4,82.0,1724.1486666666667,3
w13,24,128,8,4096,3072,16,128,128,16,8,4,148.0,1724.459,3
w13,24,128,8,4096,3072,16,128,128,16,4,4,148.0,1726.2616666666663,3
w13,32,8,2,1024,512,16,128,64,1,8,3,58.0,7.117,3
w13,32,8,2,1024,512,16,128,64,1,8,4,76.0,7.169999999999999,3
w13,32,8,2,1024,512,16,128,64,1,8,5,94.0,7.297999999999999,3
w13,32,16,2,1536,768,16,64,64,1,4,4,42.0,25.52733333333333,3
w13,32,16,2,1536,768,16,64,64,16,4,4,42.0,25.71966666666667,3
w13,32,16,2,1536,768,16,64,64,64,4,4,42.0,25.826000000000004,3
w13,32,16,4,1536,1024,16,64,64,16,4,3,32.0,32.844,3
w13,32,16,4,1536,1024,16,64,64,32,4,3,32.0,32.866,3
w13,32,16,4,1536,1024,16,64,64,64,4,3,32.0,32.86633333333334,3
w13,32,32,4,2048,768,16,64,128,1,4,3,62.0,61.709,3
w13,32,32,4,2048,768,16,64,128,16,4,3,62.0,61.836666666666666,3
w13,32,32,4,2048,768,16,64,128,32,4,3,62.0,62.626,3
w13,32,32,6,3072,1024,16,128,128,32,8,4,148.0,119.71433333333334,3
w13,32,32,6,3072,1024,16,32,128,64,4,3,37.0,119.725,3
w13,32,32,6,3072,1024,16,32,128,1,4,3,37.0,119.789,3
w13,32,60,4,2048,1408,16,128,128,1,8,3,112.0,191.06433333333337,3
w13,32,60,4,2048,1408,16,128,128,1,8,4,148.0,192.41866666666667,3
w13,32,60,4,2048,1408,16,64,128,1,4,4,82.0,192.995,3
w13,32,60,6,3584,2304,16,128,128,16,8,3,112.0,541.8183333333333,3
w13,32,60,6,3584,2304,16,128,128,1,8,4,148.0,542.5543333333334,3
w13,32,60,6,3584,2304,16,64,128,32,4,3,62.0,542.5753333333333,3
w13,32,60,8,2048,1536,16,64,128,1,4,3,62.0,210.466,3
w13,32,60,8,2048,1536,16,128,128,1,8,3,112.0,210.595,3
w13,32,60,8,2048,1536,16,64,128,1,4,4,82.0,211.35233333333335,3
w13,32,64,6,3072,2048,16,128,128,1,8,3,112.0,443.15066666666667,3
w13,32,64,6,3072,2048,16,128,128,16,8,3,112.0,443.18266666666665,3
w13,32,64,6,3072,2048,16,128,128,1,8,4,148.0,443.2146666666667,3
w13,32,64,6,3584,1536,16,128,128,32,8,3,112.0,389.4973333333334,3
w13,32,64,6,3584,1536,16,64,128,1,4,4,82.0,390.02,3
w13,32,64,6,3584,1536,16,128,128,1,8,3,112.0,390.0306666666667,3
w13,32,64,8,3584,2560,16,128,128,1,8,4,148.0,641.8933333333333,3
w13,32,64,8,3584,2560,16,64,128,1,4,3,62.0,643.632,3
w13,32,64,8,3584,2560,16,128,128,16,8,3,112.0,644.2399999999999,3
w13,32,128,4,2048,512,16,64,128,1,4,4,82.0,150.60566666666668,3
w13,32,128,4,2048,512,16,128,128,1,8,4,148.0,150.659,3
w13,32,128,4,2048,512,16,64,128,32,4,3,62.0,150.691,3
w13,32,128,6,4096,2048,16,64,128,16,4,4,82.0,1153.81,3
w13,32,128,6,4096,2048,16,64,128,32,4,4,82.0,1156.1993333333332,3
w13,32,128,6,4096,2048,16,128,128,16,8,4,148.0,1156.775,3
w13,32,128,8,2048,768,16,64,128,1,4,3,62.0,221.62433333333337,3
w13,32,128,8,2048,768,16,128,128,1,8,3,112.0,222.23233333333337,3
w13,32,128,8,2048,768,16,64,128,1,4,4,82.0,222.90466666666663,3
w13,32,128,8,4096,1536,16,64,128,16,4,4,82.0,870.4593333333332,3
w13,32,128,8,4096,1536,16,64,128,32,4,4,82.0,870.9393333333334,3
w13,32,128,8,4096,1536,16,128,128,16,8,4,148.0,871.27,3
w13,32,128,8,4096,3072,16,128,128,16,8,4,148.0,1725.4513333333334,3
w13,32,128,8,4096,3072,16,64,128,16,4,4,82.0,1726.7636666666665,3
w13,32,128,8,4096,3072,16,128,128,16,4,4,148.0,1727.542,3
w13,48,8,2,1024,512,16,128,64,1,8,3,58.0,7.233999999999999,3
w13,48,8,2,1024,512,16,128,64,1,8,4,76.0,7.287333333333334,3
w13,48,8,2,1024,512,16,128,64,1,8,5,94.0,7.297999999999999,3
w13,48,16,2,1536,768,16,64,128,16,4,2,42.0,25.81533333333333,3
w13,48,16,2,1536,768,16,64,64,64,4,3,32.0,25.826000000000004,3
w13,48,16,2,1536,768,16,64,64,64,4,4,42.0,25.901,3
w13,48,16,4,1536,1024,16,64,64,32,4,3,32.0,32.64266666666666,3
w13,48,16,4,1536,1024,16,64,64,1,4,3,32.0,32.909,3
w13,48,16,4,1536,1024,16,64,128,1,4,2,42.0,32.95133333333334,3
w13,48,32,4,2048,768,16,64,128,32,4,3,62.0,61.677,3
w13,48,32,4,2048,768,16,64,128,1,4,3,62.0,61.954,3
w13,48,32,4,2048,768,16,64,128,64,4,3,62.0,61.97566666666666,3
w13,48,32,6,3072,1024,16,32,128,64,4,3,37.0,119.43733333333334,3
w13,48,32,6,3072,1024,16,32,128,1,4,3,37.0,119.67166666666668,3
w13,48,32,6,3072,1024,16,32,128,32,4,3,37.0,119.725,3
w13,48,60,4,2048,1408,16,128,128,1,8,3,112.0,191.8213333333333,3
w13,48,60,4,2048,1408,16,64,128,1,4,3,62.0,193.02666666666664,3
w13,48,60,4,2048,1408,16,64,128,1,4,4,82.0,193.84833333333333,3
w13,48,60,6,3584,2304,16,128,128,1,8,4,148.0,544.1536666666667,3
w13,48,60,6,3584,2304,16,64,128,16,4,3,62.0,544.5063333333334,3
w13,48,60,6,3584,2304,16,128,128,1,8,3,112.0,544.6446666666667,3
w13,48,60,8,2048,1536,16,128,128,1,8,3,112.0,210.691,3
w13,48,60,8,2048,1536,16,128,128,16,8,3,112.0,211.8216666666667,3
w13,48,60,8,2048,1536,16,64,128,1,4,3,62.0,212.067,3
w13,48,64,6,3072,2048,16,128,128,1,8,4,148.0,443.8546666666666,3
w13,48,64,6,3072,2048,16,128,128,1,8,3,112.0,444.53766666666667,3
w13,48,64,6,3072,2048,16,64,128,1,4,4,82.0,444.8573333333334,3
w13,48,64,6,3584,1536,16,128,128,16,8,3,112.0,391.08666666666664,3
w13,48,64,6,3584,1536,16,64,128,1,4,3,62.0,391.78,3
w13,48,64,6,3584,1536,16,128,128,32,8,3,112.0,391.7906666666667,3
w13,48,64,8,3584,2560,16,128,128,1,8,4,148.0,644.8906666666667,3
w13,48,64,8,3584,2560,16,64,128,1,4,3,62.0,645.9573333333333,3
w13,48,64,8,3584,2560,16,128,128,1,8,3,112.0,646.107,3
w13,48,128,4,2048,512,16,64,128,1,4,4,82.0,150.659,3
w13,48,128,4,2048,512,16,128,128,1,8,3,112.0,150.8826666666667,3
w13,48,128,4,2048,512,16,128,128,1,8,4,148.0,151.16033333333334,3
w13,48,128,6,4096,2048,16,128,128,16,8,4,148.0,1157.7676666666666,3
w13,48,128,6,4096,2048,16,64,128,16,4,4,82.0,1158.2256666666667,3
w13,48,128,6,4096,2048,16,64,128,16,4,3,62.0,1159.3146666666669,3
w13,48,128,8,2048,768,16,128,128,1,8,3,112.0,222.979,3
w13,48,128,8,2048,768,16,64,128,1,4,3,62.0,223.06433333333337,3
w13,48,128,8,2048,768,16,64,128,1,4,4,82.0,223.747,3
w13,48,128,8,4096,1536,16,128,128,16,8,4,148.0,872.5076666666668,3
w13,48,128,8,4096,1536,16,64,128,16,4,4,82.0,873.926,3
w13,48,128,8,4096,1536,16,128,128,16,8,3,112.0,873.9583333333334,3
w13,48,128,8,4096,3072,16,128,128,16,8,4,148.0,1729.537,3
w13,48,128,8,4096,3072,16,64,128,16,4,4,82.0,1730.6036666666666,3
w13,48,128,8,4096,3072,16,128,128,16,4,4,148.0,1731.3293333333334,3
w13,64,8,2,1024,512,16,128,64,1,8,4,76.0,7.308333333333334,3
w13,64,8,2,1024,512,16,128,64,1,8,3,58.0,7.372333333333334,3
w13,64,8,2,1024,512,16,128,64,1,8,5,94.0,7.425999999999999,3
w13,64,16,2,1536,768,16,64,64,1,4,3,32.0,25.911333333333335,3
w13,64,16,2,1536,768,16,64,64,16,4,4,42.0,26.039666666666665,3
w13,64,16,2,1536,768,16,32,64,1,4,3,19.0,26.060999999999996,3
w13,64,16,4,1536,1024,16,64,128,32,4,2,42.0,33.153999999999996,3
w13,64,16,4,1536,1024,16,64,64,64,4,3,32.0,33.282333333333334,3
w13,64,16,4,1536,1024,16,64,64,1,4,3,32.0,33.29266666666667,3
w13,64,32,4,2048,768,16,64,128,1,4,3,62.0,61.858666666666664,3
w13,64,32,4,2048,768,16,64,128,32,4,3,62.0,62.477,3
w13,64,32,4,2048,768,16,64,128,16,4,3,62.0,62.61566666666667,3
w13,64,32,6,3072,1024,16,32,128,4,4,3,37.0,120.39733333333334,3
w13,64,32,6,3072,1024,16,32,128,16,4,3,37.0,121.05833333333334,3
w13,64,32,6,3072,1024,16,64,128,32,4,3,62.0,121.06933333333332,3
w13,64,60,4,2048,1408,16,128,128,1,8,3,112.0,193.21866666666665,3
w13,64,60,4,2048,1408,16,128,128,1,8,4,148.0,193.869,3
w13,64,60,4,2048,1408,16,128,128,64,8,3,112.0,194.275,3
w13,64,60,6,3584,2304,16,128,128,1,8,4,148.0,545.6903333333333,3
w13,64,60,6,3584,2304,16,64,128,1,4,3,62.0,546.7676666666666,3
w13,64,60,6,3584,2304,16,64,128,16,4,3,62.0,546.8743333333333,3
w13,64,60,8,2048,1536,16,128,128,1,8,3,112.0,212.451,3
w13,64,60,8,2048,1536,16,64,128,1,4,3,62.0,212.8563333333333,3
w13,64,60,8,2048,1536,16,64,128,1,4,4,82.0,214.232,3
w13,64,64,6,3072,2048,16,128,128,1,8,4,148.0,445.4013333333333,3
w13,64,64,6,3072,2048,16,128,128,1,8,3,112.0,445.626,3
w13,64,64,6,3072,2048,16,64,128,1,4,3,62.0,445.78566666666666,3
w13,64,64,6,3584,1536,16,128,128,16,8,3,112.0,390.916,3
w13,64,64,6,3584,1536,16,64,128,1,4,4,82.0,392.05733333333336,3
w13,64,64,6,3584,1536,16,128,128,1,8,4,148.0,392.30266666666665,3
w13,64,64,8,3584,2560,16,128,128,1,8,4,148.0,646.5866666666667,3
w13,64,64,8,3584,2560,16,128,128,1,8,3,112.0,648.1329999999999,3
w13,64,64,8,3584,2560,16,128,128,16,8,3,112.0,649.264,3
w13,64,128,4,2048,512,16,64,128,1,4,4,82.0,150.65866666666668,3
w13,64,128,4,2048,512,16,128,128,1,8,3,112.0,151.11766666666665,3
w13,64,128,4,2048,512,16,64,128,1,4,3,62.0,151.61866666666666,3
w13,64,128,6,4096,2048,16,64,128,16,4,4,82.0,1160.253333333333,3
w13,64,128,6,4096,2048,16,128,128,16,8,4,148.0,1161.0426666666667,3
w13,64,128,6,4096,2048,16,64,128,32,4,4,82.0,1162.717666666667,3
w13,64,128,8,2048,768,16,128,128,1,8,3,112.0,222.48799999999997,3
w13,64,128,8,2048,768,16,64,128,1,4,3,62.0,223.854,3
w13,64,128,8,2048,768,16,64,128,1,4,4,82.0,223.9706666666667,3
w13,64,128,8,4096,1536,16,128,128,16,8,4,148.0,875.4196666666667,3
w13,64,128,8,4096,1536,16,32,128,4,4,4,49.0,876.6043333333333,3
w13,64,128,8,4096,1536,16,64,128,32,4,4,82.0,876.689,3
w13,64,128,8,4096,3072,16,128,128,16,8,4,148.0,1731.18,3
w13,64,128,8,4096,3072,16,128,128,16,4,4,148.0,1733.5373333333334,3
w13,64,128,8,4096,3072,16,64,128,16,4,4,82.0,1735.9906666666666,3
w13,96,8,2,1024,512,16,128,32,1,4,4,40.0,10.284333333333334,3
w13,96,8,2,1024,512,16,128,32,1,4,3,31.0,10.401666666666666,3
w13,96,8,2,1024,512,16,128,32,1,4,5,49.0,10.540666666666668,3
w13,96,16,2,1536,768,16,64,64,1,4,4,42.0,26.25266666666667,3
w13,96,16,2,1536,768,16,64,64,64,4,3,32.0,26.306,3
w13,96,16,2,1536,768,16,64,64,16,4,4,42.0,26.380666666666663,3
w13,96,16,4,1536,1024,32,64,128,16,8,3,76.0,45.27166666666667,3
w13,96,16,4,1536,1024,32,64,128,4,8,3,76.0,45.324666666666666,3
w13,96,16,4,1536,1024,32,64,128,32,8,3,76.0,45.35666666666666,3
w13,96,32,4,2048,768,16,64,128,1,4,3,62.0,63.02066666666667,3
w13,96,32,4,2048,768,16,128,128,1,8,3,112.0,63.074333333333335,3
w13,96,32,4,2048,768,16,64,128,16,4,3,62.0,63.096,3
w13,96,32,6,3072,1024,32,128,64,1,4,4,88.0,166.1676666666667,3
w13,96,32,6,3072,1024,32,128,64,1,4,3,68.0,166.48766666666668,3
w13,96,32,6,3072,1024,32,64,128,64,8,3,76.0,166.86066666666667,3
w13,96,60,4,2048,1408,16,128,128,1,8,3,112.0,193.22933333333333,3
w13,96,60,4,2048,1408,16,128,128,16,8,3,112.0,195.07466666666664,3
w13,96,60,4,2048,1408,16,64,128,1,4,4,82.0,195.235,3
w13,96,60,6,3584,2304,16,128,128,1,8,4,148.0,548.7623333333332,3
w13,96,60,6,3584,2304,16,128,128,1,8,3,112.0,548.8476666666667,3
w13,96,60,6,3584,2304,16,128,128,16,8,4,148.0,549.8183333333333,3
w13,96,60,8,2048,1536,16,128,128,1,8,3,112.0,214.02966666666663,3
w13,96,60,8,2048,1536,16,64,128,1,4,3,62.0,214.09366666666665,3
w13,96,60,8,2048,1536,16,128,128,32,8,3,112.0,215.843,3
w13,96,64,6,3072,2048,16,128,128,1,8,3,112.0,446.82,3
w13,96,64,6,3072,2048,16,128,128,1,8,4,148.0,448.132,3
w13,96,64,6,3072,2048,16,128,128,32,8,3,112.0,448.28133333333335,3
w13,96,64,6,3584,1536,16,128,128,16,8,3,112.0,393.1666666666667,3
w13,96,64,6,3584,1536,16,128,128,32,8,3,112.0,393.817,3
w13,96,64,6,3584,1536,16,128,128,1,8,3,112.0,394.585,3
w13,96,64,8,3584,2560,16,128,128,1,8,4,148.0,651.7386666666666,3
w13,96,64,8,3584,2560,16,128,128,1,8,3,112.0,652.5286666666667,3
w13,96,64,8,3584,2560,16,64,128,1,4,3,62.0,653.7973333333333,3
w13,96,128,4,2048,512,16,128,128,1,8,3,112.0,151.459,3
w13,96,128,4,2048,512,16,128,128,1,8,4,148.0,151.907,3
w13,96,128,4,2048,512,16,64,128,1,4,4,82.0,151.917,3
w13,96,128,6,4096,2048,16,64,128,16,4,4,82.0,1162.856,3
w13,96,128,6,4096,2048,16,128,128,16,8,4,148.0,1163.2506666666666,3
w13,96,128,6,4096,2048,16,128,128,16,4,4,148.0,1165.8536666666666,3
w13,96,128,8,2048,768,16,64,128,1,4,3,62.0,224.47233333333335,3
w13,96,128,8,2048,768,16,128,128,1,8,3,112.0,224.91033333333337,3
w13,96,128,8,2048,768,16,128,128,1,8,4,148.0,225.67766666666668,3
w13,96,128,8,4096,1536,16,128,128,16,8,4,148.0,878.6619999999999,3
w13,96,128,8,4096,1536,16,128,128,16,8,3,112.0,879.3023333333334,3
w13,96,128,8,4096,1536,16,128,128,16,4,4,148.0,880.3586666666666,3
w13,96,128,8,4096,3072,16,128,128,16,8,4,148.0,1739.1593333333333,3
w13,96,128,8,4096,3072,16,128,128,16,4,4,148.0,1740.1719999999998,3
w13,96,128,8,4096,3072,16,128,128,32,8,4,148.0,1744.3116666666667,3
w13,128,8,2,1024,512,16,128,32,1,4,3,31.0,10.434,3
w13,128,8,2,1024,512,16,128,32,1,4,4,40.0,10.434,3
w13,128,8,2,1024,512,32,64,64,16,8,2,28.0,10.519333333333334,3
w13,128,16,2,1536,768,16,64,64,1,4,4,42.0,26.124666666666663,3
w13,128,16,2,1536,768,16,64,64,64,4,3,32.0,26.146,3
w13,128,16,2,1536,768,16,64,64,1,4,3,32.0,26.327333333333332,3
w13,128,16,4,1536,1024,32,64,128,64,8,3,76.0,45.303666666666665,3
w13,128,16,4,1536,1024,32,64,128,32,8,3,76.0,45.36766666666667,3
w13,128,16,4,1536,1024,32,64,64,1,8,4,52.0,45.42066666666667,3
w13,128,32,4,2048,768,16,64,128,1,4,3,62.0,63.11666666666667,3
w13,128,32,4,2048,768,16,64,128,16,4,3,62.0,63.544,3
w13,128,32,4,2048,768,16,64,128,64,4,3,62.0,63.61833333333334,3
w13,128,32,6,3072,1024,32,128,64,1,4,4,88.0,166.24266666666668,3
w13,128,32,6,3072,1024,32,128,64,1,4,3,68.0,166.50966666666667,3
w13,128,32,6,3072,1024,32,64,128,16,8,3,76.0,167.27766666666665,3
w13,128,60,4,2048,1408,16,128,128,1,8,3,112.0,194.84,3
w13,128,60,4,2048,1408,16,64,128,1,4,3,62.0,195.395,3
w13,128,60,4,2048,1408,16,128,128,1,8,4,148.0,195.928,3
w13,128,60,6,3584,2304,16,128,128,1,8,4,148.0,550.5966666666667,3
w13,128,60,6,3584,2304,16,128,128,16,8,3,112.0,550.757,3
w13,128,60,6,3584,2304,16,128,128,16,8,4,148.0,551.8236666666667,3
w13,128,60,8,2048,1536,32,64,64,64,4,4,52.0,288.8136666666667,3
w13,128,60,8,2048,1536,32,64,64,64,4,3,40.0,289.1976666666667,3
w13,128,60,8,2048,1536,32,64,64,1,4,4,52.0,289.699,3
w13,128,64,6,3072,2048,16,128,128,1,8,3,112.0,448.8573333333334,3
w13,128,64,6,3072,2048,16,128,128,1,8,4,148.0,449.359,3
w13,128,64,6,3072,2048,16,64,128,1,4,3,62.0,450.27666666666664,3
w13,128,64,6,3584,1536,16,128,128,16,8,3,112.0,394.80933333333337,3
w13,128,64,6,3584,1536,16,128,128,1,8,3,112.0,394.884,3
w13,128,64,6,3584,1536,16,128,128,32,8,3,112.0,396.8143333333333,3
w13,128,64,8,3584,2560,16,128,128,1,8,4,148.0,654.5443333333333,3
w13,128,64,8,3584,2560,16,128,128,1,8,3,112.0,656.582,3
w13,128,64,8,3584,2560,16,128,128,16,8,3,112.0,657.2109999999999,3
w13,128,128,4,2048,512,16,128,128,1,8,3,112.0,151.72566666666668,3
w13,128,128,4,2048,512,16,128,128,1,8,4,148.0,152.45066666666665,3
w13,128,128,4,2048,512,16,128,128,16,8,3,112.0,152.57899999999998,3
w13,128,128,6,4096,2048,16,128,128,16,8,4,148.0,1167.1976666666667,3
w13,128,128,6,4096,2048,16,64,128,16,4,4,82.0,1169.1076666666668,3
w13,128,128,6,4096,2048,16,128,128,16,8,3,112.0,1169.4586666666669,3
w13,128,128,8,2048,768,16,128,128,1,8,3,112.0,225.97633333333332,3
w13,128,128,8,2048,768,16,64,128,1,4,3,62.0,226.63766666666663,3
w13,128,128,8,2048,768,16,128,128,32,8,3,112.0,227.224,3
w13,128,128,8,4096,1536,16,128,128,16,8,4,148.0,880.7323333333334,3
w13,128,128,8,4096,1536,16,32,128,4,4,5,61.0,882.6836666666667,3
w13,128,128,8,4096,1536,16,128,128,32,8,3,112.0,882.7373333333334,3
w13,128,128,8,4096,3072,16,128,128,16,8,4,148.0,1743.9273333333333,3
w13,128,128,8,4096,3072,16,128,128,16,8,3,112.0,1746.5296666666666,3
w13,128,128,8,4096,3072,16,128,128,16,4,4,148.0,1748.3436666666666,3
w13,256,8,2,1024,512,64,128,32,8,4,3,52.0,11.596666666666666,3
w13,256,8,2,1024,512,64,128,32,8,8,3,52.0,11.618,3
w13,256,8,2,1024,512,64,64,64,32,8,2,40.0,11.628666666666668,3
w13,256,16,2,1536,768,32,64,64,1,4,4,52.0,34.03933333333333,3
w13,256,16,2,1536,768,32,64,64,1,8,4,52.0,34.050333333333334,3
w13,256,16,2,1536,768,32,64,128,32,8,3,76.0,34.209666666666664,3
w13,256,16,4,1536,1024,64,64,64,64,4,4,72.0,52.96233333333333,3
w13,256,16,4,1536,1024,64,64,64,32,4,4,72.0,53.07933333333333,3
w13,256,16,4,1536,1024,64,64,64,1,4,4,72.0,53.101,3
w13,256,32,4,2048,768,32,64,64,1,4,4,52.0,81.85833333333333,3
w13,256,32,4,2048,768,32,128,64,1,4,4,88.0,81.96466666666667,3
w13,256,32,4,2048,768,32,64,64,1,8,5,64.0,82.13566666666667,3
w13,256,32,6,3072,1024,64,128,64,16,4,4,112.0,200.08833333333337,3
w13,256,32,6,3072,1024,64,128,64,16,8,3,88.0,200.131,3
w13,256,32,6,3072,1024,64,128,64,32,4,4,112.0,200.23733333333337,3
w13,256,60,4,2048,1408,32,128,64,1,4,3,68.0,263.502,3
w13,256,60,4,2048,1408,32,128,64,1,4,4,88.0,264.0566666666667,3
w13,256,60,4,2048,1408,32,64,64,1,4,4,52.0,265.4963333333333,3
w13,256,60,6,3584,2304,32,128,64,1,4,3,68.0,736.0486666666666,3
w13,256,60,6,3584,2304,32,128,64,1,4,4,88.0,737.083,3
w13,256,60,6,3584,2304,32,64,64,1,4,4,52.0,742.1926666666667,3
w13,256,60,8,2048,1536,64,64,64,32,4,4,72.0,347.2036666666666,3
w13,256,60,8,2048,1536,64,64,64,16,4,4,72.0,348.3766666666667,3
w13,256,60,8,2048,1536,64,64,64,4,4,4,72.0,349.0163333333333,3
w13,256,64,6,3072,2048,32,64,64,1,4,4,52.0,603.8343333333333,3
w13,256,64,6,3072,2048,32,64,64,64,4,4,52.0,604.2503333333333,3
w13,256,64,6,3072,2048,32,64,64,64,4,3,40.0,605.232,3
w13,256,64,6,3584,1536,32,128,64,1,4,4,88.0,532.4526666666667,3
w13,256,64,6,3584,1536,32,64,64,64,4,4,52.0,532.7613333333333,3
w13,256,64,6,3584,1536,32,64,64,1,4,4,52.0,533.0176666666666,3
w13,256,64,8,3584,2560,32,128,64,1,4,3,68.0,871.5373333333333,3
w13,256,64,8,3584,2560,32,64,64,1,4,4,52.0,872.8603333333334,3
w13,256,64,8,3584,2560,32,64,64,1,4,3,40.0,873.927,3
w13,256,128,4,2048,512,16,128,128,1,8,3,112.0,153.18666666666664,3
w13,256,128,4,2048,512,16,64,128,1,4,3,62.0,153.54933333333332,3
w13,256,128,4,2048,512,16,64,128,1,4,4,82.0,154.15733333333333,3
w13,256,128,6,4096,2048,16,128,128,16,8,4,148.0,1178.0246666666665,3
w13,256,128,6,4096,2048,16,128,128,16,8,3,112.0,1178.942,3
w13,256,128,6,4096,2048,16,128,128,16,4,4,148.0,1179.5393333333334,3
w13,256,128,8,2048,768,16,128,128,1,8,3,112.0,229.176,3
w13,256,128,8,2048,768,16,64,128,1,4,3,62.0,229.27233333333336,3
w13,256,128,8,2048,768,16,128,128,32,8,3,112.0,231.13933333333333,3
w13,256,128,8,4096,1536,16,128,128,16,8,3,112.0,892.956,3
w13,256,128,8,4096,1536,16,128,128,16,8,4,148.0,894.4066666666668,3
w13,256,128,8,4096,1536,16,128,128,16,4,4,148.0,895.6546666666667,3
w13,256,128,8,4096,3072,16,128,128,16,8,4,148.0,1766.7543333333333,3
w13,256,128,8,4096,3072,16,128,128,16,4,4,148.0,1769.0690000000002,3
w13,256,128,8,4096,3072,16,128,128,16,8,3,112.0,1771.3836666666666,3
w13,512,8,2,1024,512,64,32,128,1,4,2,52.0,20.674,3
w13,512,8,2,1024,512,64,32,128,16,4,2,52.0,20.833666666666662,3
w13,512,8,2,1024,512,64,128,32,8,8,2,40.0,21.111333333333334,3
w13,512,16,2,1536,768,64,64,64,16,8,4,72.0,39.81033333333334,3
w13,512,16,2,1536,768,64,64,64,4,8,4,72.0,39.83133333333333,3
w13,512,16,2,1536,768,64,64,64,1,8,4,72.0,39.90633333333333,3
w13,512,16,4,1536,1024,64,128,64,64,4,4,112.0,100.99466666666666,3
w13,512,16,4,1536,1024,64,64,64,4,4,4,72.0,101.03733333333334,3
w13,512,16,4,1536,1024,64,128,64,32,4,4,112.0,101.05833333333334,3
w13,512,32,4,2048,768,64,128,64,64,8,3,88.0,98.31666666666666,3
w13,512,32,4,2048,768,64,64,64,32,4,4,72.0,98.38133333333332,3
w13,512,32,4,2048,768,64,128,64,4,8,3,88.0,98.62633333333332,3
w13,512,32,6,3072,1024,64,64,64,4,4,4,72.0,378.2006666666666,3
w13,512,32,6,3072,1024,64,64,64,16,4,4,72.0,378.3926666666667,3
w13,512,32,6,3072,1024,64,64,64,16,4,3,56.0,379.04333333333335,3
w13,512,60,4,2048,1408,64,64,64,1,4,4,72.0,319.779,3
w13,512,60,4,2048,1408,64,128,64,32,4,3,88.0,320.07866666666666,3
w13,512,60,4,2048,1408,64,128,64,16,4,4,112.0,320.185,3
w13,512,60,6,3584,2304,64,128,64,16,4,4,112.0,900.6149999999999,3
w13,512,60,6,3584,2304,64,128,64,1,4,4,112.0,901.4473333333334,3
w13,512,60,6,3584,2304,64,128,64,1,4,3,88.0,903.5266666666666,3
w13,512,60,8,2048,1536,64,128,64,32,4,4,112.0,684.901,3
w13,512,60,8,2048,1536,64,128,64,1,4,4,112.0,684.965,3
w13,512,60,8,2048,1536,64,128,64,4,4,3,88.0,684.986,3
w13,512,64,6,3072,2048,64,64,64,64,4,4,72.0,736.3583333333332,3
w13,512,64,6,3072,2048,64,64,64,4,4,4,72.0,738.0219999999999,3
w13,512,64,6,3072,2048,64,64,64,32,4,4,72.0,738.4806666666667,3
w13,512,64,6,3584,1536,64,128,64,4,4,4,112.0,645.3919999999999,3
w13,512,64,6,3584,1536,64,128,64,32,4,4,112.0,647.6853333333333,3
w13,512,64,6,3584,1536,64,128,64,4,4,3,88.0,647.9406666666667,3
w13,512,64,8,3584,2560,64,128,64,32,4,4,112.0,1063.7306666666666,3
w13,512,64,8,3584,2560,64,128,64,4,4,4,112.0,1064.541,3
w13,512,64,8,3584,2560,64,128,64,32,4,3,88.0,1065.032,3
w13,512,128,4,2048,512,16,128,128,1,8,3,112.0,154.456,3
w13,512,128,4,2048,512,16,128,128,32,8,3,112.0,155.91766666666666,3
w13,512,128,4,2048,512,16,64,128,1,4,4,82.0,156.56766666666667,3
w13,512,128,6,4096,2048,32,128,64,1,4,3,68.0,1573.7813333333334,3
w13,512,128,6,4096,2048,32,128,64,1,4,4,88.0,1579.84,3
w13,512,128,6,4096,2048,32,64,64,64,4,4,52.0,1586.347,3
w13,512,128,8,2048,768,32,128,64,1,4,3,68.0,310.08366666666666,3
w13,512,128,8,2048,768,32,64,64,1,4,4,52.0,312.0253333333333,3
w13,512,128,8,2048,768,32,128,64,1,4,4,88.0,312.3983333333333,3
w13,512,128,8,4096,1536,32,128,64,1,4,3,68.0,1188.2,3
w13,512,128,8,4096,1536,32,64,64,1,8,5,64.0,1191.4536666666663,3
w13,512,128,8,4096,1536,32,64,64,64,4,4,52.0,1191.784666666667,3
w13,512,128,8,4096,3072,32,128,64,1,4,3,68.0,2337.019,3
w13,512,128,8,4096,3072,32,128,64,1,4,4,88.0,2347.664,3
w13,512,128,8,4096,3072,32,64,64,1,4,4,52.0,2360.4326666666666,3
w13,1024,8,2,1024,512,64,64,64,4,4,3,56.0,35.44733333333333,3
w13,1024,8,2,1024,512,64,64,64,64,4,3,56.0,35.47933333333333,3
w13,1024,8,2,1024,512,64,64,64,1,4,4,72.0,35.54333333333333,3
w13,1024,16,2,1536,768,64,64,64,4,4,4,72.0,73.22933333333333,3
w13,1024,16,2,1536,768,128,64,64,16,8,3,88.0,73.29299999999999,3
w13,1024,16,2,1536,768,128,64,64,16,8,4,112.0,73.35733333333333,3
w13,1024,16,4,1536,1024,64,64,64,64,4,4,72.0,191.34166666666667,3
w13,1024,16,4,1536,1024,64,64,64,1,4,4,72.0,191.55466666666663,3
w13,1024,16,4,1536,1024,64,64,64,64,4,3,56.0,191.725,3
w13,1024,32,4,2048,768,64,128,64,16,4,4,112.0,188.79166666666663,3
w13,1024,32,4,2048,768,64,128,64,32,4,4,112.0,188.952,3
w13,1024,32,4,2048,768,64,128,64,1,4,4,112.0,188.9523333333333,3
w13,1024,32,6,3072,1024,64,128,64,64,4,4,112.0,556.8146666666667,3
w13,1024,32,6,3072,1024,64,128,64,4,4,4,112.0,556.8573333333334,3
w13,1024,32,6,3072,1024,64,128,64,1,4,4,112.0,557.0386666666667,3
w13,1024,60,4,2048,1408,128,128,64,4,8,3,128.0,629.1353333333333,3
w13,1024,60,4,2048,1408,64,128,64,4,4,4,112.0,629.6793333333334,3
w13,1024,60,4,2048,1408,64,128,64,4,4,3,88.0,629.701,3
w13,1024,60,6,3584,2304,64,64,64,16,4,4,72.0,1785.6223333333337,3
w13,1024,60,6,3584,2304,64,64,64,32,4,4,72.0,1786.924,3
w13,1024,60,6,3584,2304,64,64,64,16,4,3,56.0,1788.844,3
w13,1024,60,8,2048,1536,64,64,64,16,4,4,72.0,1029.467666666667,3
w13,1024,60,8,2048,1536,64,64,64,32,4,4,72.0,1029.6276666666663,3
w13,1024,60,8,2048,1536,64,64,64,4,4,4,72.0,1029.8836666666666,3
w13,1024,64,6,3072,2048,64,128,64,16,4,4,112.0,1454.698,3
w13,1024,64,6,3072,2048,64,128,64,32,4,4,112.0,1454.8793333333333,3
w13,1024,64,6,3072,2048,64,128,64,32,4,3,88.0,1456.575,3
w13,1024,64,6,3584,1536,64,64,64,4,4,4,72.0,1272.744,3
w13,1024,64,6,3584,1536,64,64,64,64,4,4,72.0,1273.0433333333333,3
w13,1024,64,6,3584,1536,64,64,64,1,4,4,72.0,1273.6616666666666,3
w13,1024,64,8,3584,2560,64,128,64,1,4,4,112.0,2112.9736666666668,3
w13,1024,64,8,3584,2560,128,128,64,64,8,3,128.0,2114.605666666667,3
w13,1024,64,8,3584,2560,64,128,64,64,4,4,112.0,2114.798,3
w13,1024,128,4,2048,512,32,64,64,1,4,4,52.0,211.62966666666668,3
w13,1024,128,4,2048,512,32,64,64,16,4,4,52.0,212.78166666666667,3
w13,1024,128,4,2048,512,32,64,64,1,4,3,40.0,212.8456666666667,3
w13,1024,128,6,4096,2048,64,128,64,32,4,4,112.0,1938.092666666667,3
w13,1024,128,6,4096,2048,64,128,64,16,4,4,112.0,1939.4043333333332,3
w13,1024,128,6,4096,2048,64,128,64,4,4,4,112.0,1943.8313333333333,3
w13,1024,128,8,2048,768,64,128,64,4,4,4,112.0,376.302,3
w13,1024,128,8,2048,768,64,64,64,1,4,4,72.0,376.52566666666667,3
w13,1024,128,8,2048,768,64,128,64,64,4,4,112.0,376.708,3
w13,1024,128,8,4096,1536,64,64,64,16,4,4,72.0,1461.5776666666668,3
w13,1024,128,8,4096,1536,64,64,64,16,4,3,56.0,1463.7323333333334,3
w13,1024,128,8,4096,1536,64,64,64,1,4,4,72.0,1463.7963333333337,3
w13,1024,128,8,4096,3072,64,128,64,16,4,4,112.0,2891.144,3
w13,1024,128,8,4096,3072,64,128,64,32,4,4,112.0,2892.1999999999994,3
w13,1024,128,8,4096,3072,64,128,64,16,4,3,88.0,2897.9816666666666,3
w13,1536,8,2,1024,512,64,128,64,32,4,3,88.0,49.452666666666666,3
w13,1536,8,2,1024,512,64,128,64,64,4,4,112.0,49.48466666666667,3
w13,1536,8,2,1024,512,128,64,64,1,8,3,88.0,49.52766666666667,3
w13,1536,16,2,1536,768,64,64,64,4,4,4,72.0,108.25833333333333,3
w13,1536,16,2,1536,768,64,64,64,16,4,4,72.0,108.31166666666668,3
w13,1536,16,2,1536,768,64,64,64,4,4,3,56.0,108.408,3
w13,1536,16,4,1536,1024,64,128,64,4,4,4,112.0,280.39733333333334,3
w13,1536,16,4,1536,1024,64,128,64,16,4,4,112.0,280.66433333333333,3
w13,1536,16,4,1536,1024,128,64,64,1,8,3,88.0,280.9203333333333,3
w13,1536,32,4,2048,768,64,128,64,1,4,4,112.0,280.2483333333334,3
w13,1536,32,4,2048,768,64,128,64,32,4,4,112.0,280.46166666666664,3
w13,1536,32,4,2048,768,64,128,64,4,4,4,112.0,280.6856666666667,3
w13,1536,32,6,3072,1024,64,128,64,1,4,4,112.0,915.2486666666668,3
w13,1536,32,6,3072,1024,64,128,64,32,4,4,112.0,915.8563333333332,3
w13,1536,32,6,3072,1024,64,128,64,4,4,4,112.0,916.9653333333332,3
w13,1536,60,4,2048,1408,128,128,64,64,8,3,128.0,630.3733333333333,3
w13,1536,60,4,2048,1408,64,128,64,1,4,3,88.0,630.437,3
w13,1536,60,4,2048,1408,64,128,64,64,4,4,112.0,630.533,3
w13,1536,60,6,3584,2304,64,64,64,64,4,4,72.0,2679.622,3
w13,1536,60,6,3584,2304,64,64,64,32,4,4,72.0,2679.846,3
w13,1536,60,6,3584,2304,64,64,64,16,4,4,72.0,2679.9956666666667,3
w13,1536,60,8,2048,1536,64,128,64,1,4,3,88.0,1365.799,3
w13,1536,60,8,2048,1536,64,128,64,1,4,4,112.0,1366.4076666666667,3
w13,1536,60,8,2048,1536,64,128,64,64,4,3,88.0,1366.4929999999997,3
w13,1536,64,6,3072,2048,64,128,64,1,4,4,112.0,2165.955,3
w13,1536,64,6,3072,2048,64,128,64,4,4,4,112.0,2169.741,3
w13,1536,64,6,3072,2048,64,128,64,32,4,3,88.0,2170.488666666666,3
w13,1536,64,6,3584,1536,64,64,64,4,4,4,72.0,1910.827,3
w13,1536,64,6,3584,1536,64,64,64,32,4,4,72.0,1911.041,3
w13,1536,64,6,3584,1536,64,64,64,64,4,4,72.0,1911.0833333333333,3
w13,1536,64,8,3584,2560,64,128,64,32,4,4,112.0,3163.197666666667,3
w13,1536,64,8,3584,2560,64,128,64,1,4,4,112.0,3163.625,3
w13,1536,64,8,3584,2560,64,128,64,32,4,3,88.0,3166.963333333333,3
w13,1536,128,4,2048,512,64,64,64,16,4,4,72.0,255.6723333333333,3
w13,1536,128,4,2048,512,64,64,64,32,4,4,72.0,256.39799999999997,3
w13,1536,128,4,2048,512,64,64,64,64,4,4,72.0,256.5683333333333,3
w13,1536,128,6,4096,2048,64,128,64,1,4,4,112.0,3861.6323333333335,3
w13,1536,128,6,4096,2048,64,128,64,64,4,3,88.0,3864.416333333333,3
w13,1536,128,6,4096,2048,64,128,64,64,4,4,112.0,3864.566,3
w13,1536,128,8,2048,768,64,64,64,64,4,4,72.0,734.266,3
w13,1536,128,8,2048,768,64,64,64,32,4,4,72.0,734.7356666666666,3
w13,1536,128,8,2048,768,64,64,64,64,4,3,56.0,736.1013333333334,3
w13,1536,128,8,4096,1536,64,128,64,1,4,4,112.0,2886.3306666666667,3
w13,1536,128,8,4096,1536,64,128,64,4,4,4,112.0,2889.541333333333,3
w13,1536,128,8,4096,1536,64,128,64,16,4,4,112.0,2890.992,3
w13,1536,128,8,4096,3072,64,128,64,4,4,4,112.0,5769.068666666666,3
w13,1536,128,8,4096,3072,64,128,64,32,4,4,112.0,5769.559666666667,3
w13,1536,128,8,4096,3072,128,128,64,64,8,3,128.0,5769.8460000000005,3
w13,2048,8,2,1024,512,64,64,64,64,4,4,72.0,67.73566666666666,3
w13,2048,8,2,1024,512,64,64,64,32,4,4,72.0,67.746,3
w13,2048,8,2,1024,512,64,128,64,4,4,4,112.0,67.88466666666666,3
w13,2048,16,2,1536,768,64,128,64,1,4,4,112.0,142.093,3
w13,2048,16,2,1536,768,64,128,64,32,4,4,112.0,142.189,3
w13,2048,16,2,1536,768,64,128,64,64,4,3,88.0,142.28566666666666,3
w13,2048,16,4,1536,1024,64,64,64,16,4,4,72.0,371.459,3
w13,2048,16,4,1536,1024,64,64,64,16,4,3,56.0,372.45166666666665,3
w13,2048,16,4,1536,1024,64,64,64,64,4,4,72.0,372.483,3
w13,2048,32,4,2048,768,64,128,64,4,4,4,112.0,372.1096666666666,3
w13,2048,32,4,2048,768,64,128,64,4,4,3,88.0,372.441,3
w13,2048,32,4,2048,768,64,128,64,32,4,4,112.0,372.708,3
w13,2048,32,6,3072,1024,64,64,64,1,4,4,72.0,1100.348,3
w13,2048,32,6,3072,1024,64,64,64,32,4,4,72.0,1100.5606666666667,3
w13,2048,32,6,3072,1024,64,64,64,64,4,4,72.0,1100.849333333333,3
w13,2048,60,4,2048,1408,64,128,64,16,4,3,88.0,942.8433333333332,3
w13,2048,60,4,2048,1408,64,128,64,32,4,3,88.0,942.865,3
w13,2048,60,4,2048,1408,64,128,64,16,4,4,112.0,942.8863333333334,3
w13,2048,60,6,3584,2304,64,128,64,1,4,4,112.0,3551.8823333333335,3
w13,2048,60,6,3584,2304,64,128,64,16,4,3,88.0,3555.9463333333333,3
w13,2048,60,6,3584,2304,64,128,32,8,4,5,76.0,3556.0750000000003,3
w13,2048,60,8,2048,1536,64,128,64,1,4,4,112.0,1712.8943333333334,3
w13,2048,60,8,2048,1536,64,128,64,1,4,3,88.0,1712.937,3
w13,2048,60,8,2048,1536,64,64,64,64,4,4,72.0,1713.3106666666663,3
w13,2048,64,6,3072,2048,64,128,64,1,4,3,88.0,2171.4906666666666,3
w13,2048,64,6,3072,2048,64,128,64,16,4,3,88.0,2172.098333333334,3
w13,2048,64,6,3072,2048,64,128,64,64,4,4,112.0,2172.717666666667,3
w13,2048,64,6,3584,1536,64,64,64,64,4,4,72.0,1913.4403333333332,3
w13,2048,64,6,3584,1536,64,64,64,16,4,4,72.0,1913.6756666666668,3
w13,2048,64,6,3584,1536,64,64,64,16,4,3,56.0,1915.8093333333336,3
w13,2048,64,8,3584,2560,64,128,64,1,4,4,112.0,4215.1393333333335,3
w13,2048,64,8,3584,2560,64,128,64,64,4,3,88.0,4219.288666666666,3
w13,2048,64,8,3584,2560,64,128,64,16,4,3,88.0,4219.79,3
w13,2048,128,4,2048,512,64,64,64,4,4,4,72.0,255.89666666666668,3
w13,2048,128,4,2048,512,64,64,64,1,4,4,72.0,255.93933333333337,3
w13,2048,128,4,2048,512,64,64,64,64,4,4,72.0,256.974,3
w13,2048,128,6,4096,2048,64,128,64,1,4,4,112.0,3863.3176666666664,3
w13,2048,128,6,4096,2048,64,64,64,64,4,4,72.0,3866.219333333333,3
w13,2048,128,6,4096,2048,64,64,64,4,4,4,72.0,3866.5813333333335,3
w13,2048,128,8,2048,768,64,64,64,4,4,4,72.0,734.81,3
w13,2048,128,8,2048,768,64,64,64,1,4,4,72.0,736.8583333333332,3
w13,2048,128,8,2048,768,64,64,64,16,4,4,72.0,737.093,3
w13,2048,128,8,4096,1536,64,128,64,1,4,3,88.0,2894.202,3
w13,2048,128,8,4096,1536,64,128,64,32,4,3,88.0,2895.717,3
w13,2048,128,8,4096,1536,64,128,64,16,4,3,88.0,2896.058333333333,3
w13,2048,128,8,4096,3072,64,128,64,32,4,4,112.0,5775.787666666666,3
w13,2048,128,8,4096,3072,64,128,64,1,4,3,88.0,5778.934,3
w13,2048,128,8,4096,3072,64,128,64,1,4,4,112.0,5780.469666666667,3
w13,3072,8,2,1024,512,64,128,64,1,4,4,112.0,95.83166666666666,3
w13,3072,8,2,1024,512,64,128,64,4,4,4,112.0,95.89566666666668,3
w13,3072,8,2,1024,512,64,64,64,64,4,4,72.0,95.938,3
w13,3072,16,2,1536,768,64,128,64,16,4,4,112.0,211.36233333333337,3
w13,3072,16,2,1536,768,64,128,64,1,4,4,112.0,211.54433333333336,3
w13,3072,16,2,1536,768,64,128,64,16,4,3,88.0,211.55466666666663,3
w13,3072,16,4,1536,1024,64,64,64,32,4,4,72.0,552.2280000000001,3
w13,3072,16,4,1536,1024,64,64,64,1,4,4,72.0,552.3346666666666,3
w13,3072,16,4,1536,1024,64,64,64,4,4,4,72.0,552.3453333333333,3
w13,3072,32,4,2048,768,64,128,64,32,4,4,112.0,555.9616666666667,3
w13,3072,32,4,2048,768,64,128,64,16,4,4,112.0,556.4846666666667,3
w13,3072,32,4,2048,768,64,128,64,64,4,3,88.0,556.6653333333334,3
w13,3072,32,6,3072,1024,64,64,64,32,4,4,72.0,1652.8406666666667,3
w13,3072,32,6,3072,1024,64,64,64,64,4,4,72.0,1653.0433333333333,3
w13,3072,32,6,3072,1024,64,64,64,4,4,4,72.0,1655.5076666666666,3
w13,3072,60,4,2048,1408,64,128,64,32,4,4,112.0,1255.8366666666666,3
w13,3072,60,4,2048,1408,64,128,64,64,4,3,88.0,1256.242,3
w13,3072,60,4,2048,1408,64,128,64,4,4,3,88.0,1256.8396666666667,3
w13,3072,60,6,3584,2304,64,128,64,1,4,4,112.0,4437.231333333333,3
w13,3072,60,6,3584,2304,64,128,64,32,4,3,88.0,4446.532333333334,3
w13,3072,60,6,3584,2304,64,128,64,64,4,3,88.0,4447.684666666667,3
w13,3072,60,8,2048,1536,64,128,64,1,4,4,112.0,2390.3053333333332,3
w13,3072,60,8,2048,1536,64,128,64,32,4,3,88.0,2393.377333333334,3
w13,3072,60,8,2048,1536,64,128,64,16,4,3,88.0,2394.7960000000003,3
w13,3072,64,6,3072,2048,64,128,64,1,4,4,112.0,3611.145666666667,3
w13,3072,64,6,3072,2048,64,128,64,16,4,4,112.0,3618.110666666667,3
w13,3072,64,6,3072,2048,64,128,64,4,4,3,88.0,3618.5056666666665,3
w13,3072,64,6,3584,1536,64,128,64,64,4,3,88.0,3166.4606666666664,3
w13,3072,64,6,3584,1536,64,128,64,32,4,4,112.0,3169.083666666667,3
w13,3072,64,6,3584,1536,64,128,64,4,4,4,112.0,3169.1693333333333,3
w13,3072,64,8,3584,2560,64,128,64,1,4,4,112.0,6309.305,3
w13,3072,64,8,3584,2560,64,128,64,32,4,3,88.0,6311.523666666667,3
w13,3072,64,8,3584,2560,64,128,64,64,4,3,88.0,6311.886333333333,3
w13,3072,128,4,2048,512,64,64,64,32,4,4,72.0,493.924,3
w13,3072,128,4,2048,512,64,64,64,1,4,4,72.0,494.32933333333335,3
w13,3072,128,4,2048,512,64,64,64,4,4,4,72.0,494.884,3
w13,3072,128,6,4096,2048,64,128,64,16,4,3,88.0,5771.838,3
w13,3072,128,6,4096,2048,64,128,64,32,4,3,88.0,5772.244,3
w13,3072,128,6,4096,2048,64,128,64,64,4,4,112.0,5774.591,3
w13,3072,128,8,2048,768,64,64,64,64,4,4,72.0,1101.8513333333333,3
w13,3072,128,8,2048,768,64,64,64,32,4,4,72.0,1101.9260000000002,3
w13,3072,128,8,2048,768,64,64,64,1,4,4,72.0,1103.3766666666668,3
w13,3072,128,8,4096,1536,64,128,64,1,4,4,112.0,4375.594333333333,3
w13,3072,128,8,4096,1536,64,128,64,32,4,4,112.0,4380.917,3
w13,3072,128,8,4096,1536,64,64,64,64,4,4,72.0,4381.546333333333,3
w13,3072,128,8,4096,3072,64,128,64,64,4,3,88.0,8650.671,3
w13,3072,128,8,4096,3072,64,128,64,1,4,3,88.0,8650.778333333334,3
w13,3072,128,8,4096,3072,64,128,64,32,4,3,88.0,8653.103333333333,3
w13,4096,8,2,1024,512,64,64,64,64,4,4,72.0,128.19433333333333,3
w13,4096,8,2,1024,512,64,64,64,1,4,4,72.0,128.35466666666665,3
w13,4096,8,2,1024,512,64,64,64,4,4,4,72.0,128.46133333333333,3
w13,4096,16,2,1536,768,64,128,64,16,4,4,112.0,280.1093333333333,3
w13,4096,16,2,1536,768,64,128,64,1,4,4,112.0,280.376,3
w13,4096,16,2,1536,768,64,128,64,64,4,3,88.0,280.70700000000005,3
w13,4096,16,4,1536,1024,64,128,64,4,4,3,88.0,735.6743333333334,3
w13,4096,16,4,1536,1024,64,128,64,32,4,4,112.0,735.8766666666667,3
w13,4096,16,4,1536,1024,64,128,64,1,4,3,88.0,735.9193333333333,3
w13,4096,32,4,2048,768,64,64,64,16,4,4,72.0,734.4156666666668,3
w13,4096,32,4,2048,768,64,64,64,32,4,4,72.0,735.0343333333334,3
w13,4096,32,4,2048,768,64,64,64,64,4,4,72.0,735.0769999999999,3
w13,4096,32,6,3072,1024,64,128,64,1,4,4,112.0,2184.4593333333337,3
w13,4096,32,6,3072,1024,64,128,64,4,4,4,112.0,2186.4223333333334,3
w13,4096,32,6,3072,1024,64,128,64,1,4,3,88.0,2187.808333333333,3
w13,4096,60,4,2048,1408,64,128,64,16,4,4,112.0,1568.4133333333332,3
w13,4096,60,4,2048,1408,64,128,64,64,4,3,88.0,1568.446,3
w13,4096,60,4,2048,1408,64,128,64,4,4,4,112.0,1568.584,3
w13,4096,60,6,3584,2304,64,128,64,1,4,4,112.0,6203.277333333334,3
w13,4096,60,6,3584,2304,64,256,64,4,4,2,112.0,6205.570333333333,3
w13,4096,60,6,3584,2304,64,128,64,64,4,3,88.0,6210.935666666667,3
w13,4096,60,8,2048,1536,64,128,64,1,4,4,112.0,3069.9456666666665,3
w13,4096,60,8,2048,1536,64,128,64,1,4,3,88.0,3072.6336666666666,3
w13,4096,60,8,2048,1536,64,128,64,16,4,3,88.0,3074.0519999999997,3
w13,4096,64,6,3072,2048,64,128,64,1,4,4,112.0,4328.161666666667,3
w13,4096,64,6,3072,2048,64,128,64,1,4,3,88.0,4328.855333333333,3
w13,4096,64,6,3072,2048,64,128,64,4,4,3,88.0,4329.41,3
w13,4096,64,6,3584,1536,64,128,64,64,4,4,112.0,3800.5643333333337,3
w13,4096,64,6,3584,1536,64,128,64,16,4,3,88.0,3802.399,3
w13,4096,64,6,3584,1536,64,64,64,4,4,4,72.0,3804.0733333333337,3
w13,4096,64,8,3584,2560,64,128,64,1,4,4,112.0,8401.955333333333,3
w13,4096,64,8,3584,2560,64,128,64,32,4,3,88.0,8406.990333333333,3
w13,4096,64,8,3584,2560,64,128,64,1,4,3,88.0,8407.203666666666,3
w13,4096,128,4,2048,512,64,64,64,16,4,4,72.0,494.92633333333333,3
w13,4096,128,4,2048,512,64,64,64,64,4,4,72.0,495.18266666666665,3
w13,4096,128,4,2048,512,64,64,64,1,4,4,72.0,495.37466666666666,3
w13,4096,128,6,4096,2048,64,128,64,1,4,4,112.0,5767.592666666666,3
w13,4096,128,6,4096,2048,64,128,64,32,4,3,88.0,5772.424333333333,3
w13,4096,128,6,4096,2048,64,128,64,16,4,3,88.0,5774.248333333334,3
w13,4096,128,8,2048,768,64,128,64,1,4,4,112.0,1457.8416666666665,3
w13,4096,128,8,2048,768,64,128,64,64,4,3,88.0,1458.8976666666667,3
w13,4096,128,8,2048,768,64,128,64,1,4,3,88.0,1459.1006666666665,3
w13,4096,128,8,4096,1536,64,128,64,1,4,4,112.0,5816.399,3
w13,4096,128,8,4096,1536,64,128,64,32,4,4,112.0,5820.238333333334,3
w13,4096,128,8,4096,1536,64,128,64,16,4,4,112.0,5820.548,3
w13,4096,128,8,4096,3072,64,128,64,1,4,3,88.0,11525.032333333334,3
w13,4096,128,8,4096,3072,64,128,64,16,4,3,88.0,11530.163333333332,3
w13,4096,128,8,4096,3072,64,128,64,4,4,3,88.0,11530.407666666666,3
