pipetuning_test/moe_dse/moe_dse_H800_top3.csv
weight_type,M,E,topk,H,N,BLOCK_SIZE_M,BLOCK_SIZE_N,BLOCK_SIZE_K,GROUP_SIZE_M,num_warps,num_stages,smem_size_KB,avg_duration,sample_count
w13,1,8,2,1024,512,16,16,128,1,4,3,24.5,4.268666666666667,3
w13,1,8,2,1024,512,16,16,128,4,4,3,24.5,4.29,3
w13,1,8,2,1024,512,16,16,128,1,4,4,32.5,4.354,3
w13,1,16,2,1536,768,16,32,128,4,4,3,37.0,5.623333333333334,3
w13,1,16,2,1536,768,16,32,128,32,4,3,37.0,5.623333333333334,3
w13,1,16,2,1536,768,16,32,128,64,4,3,37.0,5.623333333333334,3
w13,1,16,4,1536,1024,16,64,128,16,8,3,62.0,6.754,3
w13,1,16,4,1536,1024,16,64,128,64,8,3,62.0,6.754,3
w13,1,16,4,1536,1024,16,64,128,32,8,3,62.0,6.785999999999999,3
w13,1,32,4,2048,768,16,64,128,64,8,3,62.0,7.927333333333333,3
w13,1,32,4,2048,768,16,64,128,16,8,3,62.0,7.938,3
w13,1,32,4,2048,768,16,64,128,32,8,3,62.0,7.948666666666667,3
w13,1,32,6,3072,1024,16,32,64,32,4,5,31.0,27.874666666666663,3
w13,1,32,6,3072,1024,16,32,128,4,4,4,49.0,27.89533333333333,3
w13,1,32,6,3072,1024,16,32,128,4,4,3,37.0,27.916666666666668,3
w13,1,60,4,2048,1408,16,32,256,32,4,3,73.0,17.527666666666665,3
w13,1,60,4,2048,1408,32,32,256,16,4,3,98.0,17.527666666666665,3
w13,1,60,4,2048,1408,16,32,128,32,4,4,49.0,17.62366666666667,3
w13,1,60,6,3584,2304,16,32,128,32,4,2,25.0,66.23233333333333,3
w13,1,60,6,3584,2304,16,32,128,16,4,2,25.0,66.466,3
w13,1,60,6,3584,2304,16,32,64,16,4,3,19.0,66.48833333333333,3
w13,1,60,8,2048,1536,16,32,64,32,4,5,31.0,35.853,3
w13,1,60,8,2048,1536,16,64,128,1,4,3,62.0,35.949,3
w13,1,60,8,2048,1536,16,64,64,32,4,5,52.0,35.949333333333335,3
w13,1,64,6,3072,2048,16,32,128,32,4,3,37.0,51.629,3
w13,1,64,6,3072,2048,16,32,128,4,4,3,37.0,51.67166666666666,3
w13,1,64,6,3072,2048,16,64,64,16,4,5,52.0,51.832,3
w13,1,64,6,3584,1536,16,32,128,4,4,3,37.0,45.495666666666665,3
w13,1,64,6,3584,1536,16,32,128,16,4,3,37.0,45.559333333333335,3
w13,1,64,6,3584,1536,16,32,128,1,4,3,37.0,45.602,3
w13,1,64,8,3584,2560,16,64,128,1,4,3,62.0,96.781,3
w13,1,64,8,3584,2560,16,64,128,64,4,2,42.0,96.87766666666666,3
w13,1,64,8,3584,2560,16,64,64,32,4,3,32.0,96.888,3
w13,1,128,4,2048,512,16,32,128,1,4,5,61.0,6.519666666666667,3
w13,1,128,4,2048,512,16,32,128,16,4,5,61.0,6.551333333333333,3
w13,1,128,4,2048,512,16,32,128,32,4,5,61.0,6.551666666666667,3
w13,1,128,6,4096,2048,16,32,128,32,4,3,37.0,66.914,3
w13,1,128,6,4096,2048,16,64,128,1,4,3,62.0,67.07433333333334,3
w13,1,128,6,4096,2048,16,32,128,64,4,3,37.0,67.10633333333334,3
w13,1,128,8,2048,768,16,32,128,64,4,3,37.0,19.490333333333332,3
w13,1,128,8,2048,768,16,32,256,16,4,2,49.0,19.586333333333332,3
w13,1,128,8,2048,768,16,32,128,32,4,4,49.0,19.65,1
w13,1,128,8,4096,1536,16,64,128,1,4,3,62.0,67.25633333333333,3
w13,1,128,8,4096,1536,16,64,128,64,8,4,82.0,67.522,3
w13,1,128,8,4096,1536,16,64,128,32,4,4,82.0,67.597,3
w13,1,128,8,4096,3072,16,64,128,16,8,5,102.0,130.8083333333333,3
w13,1,128,8,4096,3072,16,64,128,1,4,4,82.0,130.819,3
w13,1,128,8,4096,3072,16,32,256,64,4,3,73.0,130.84033333333332,3
w13,2,8,2,1024,512,16,32,128,1,4,3,37.0,4.673333333333333,3
w13,2,8,2,1024,512,16,32,128,16,4,3,37.0,4.674,3
w13,2,8,2,1024,512,16,32,128,64,4,3,37.0,4.674,3
w13,2,16,2,1536,768,16,64,128,16,8,3,62.0,6.733333333333333,3
w13,2,16,2,1536,768,16,64,128,16,8,4,82.0,6.754333333333332,3
w13,2,16,2,1536,768,16,64,128,64,8,3,62.0,6.764666666666667,3
w13,2,16,4,1536,1024,16,32,256,16,4,2,49.0,19.031666666666663,3
w13,2,16,4,1536,1024,16,32,256,32,4,2,49.0,19.266333333333332,3
w13,2,16,4,1536,1024,16,32,128,1,4,3,37.0,19.394,3
w13,2,32,4,2048,768,16,128,64,1,8,5,94.0,19.383666666666667,3
w13,2,32,4,2048,768,16,32,128,16,4,4,49.0,19.415333333333333,3
w13,2,32,4,2048,768,16,32,256,16,4,2,49.0,19.447333333333333,3
w13,2,32,6,3072,1024,16,64,128,16,4,3,62.0,51.629,3
w13,2,32,6,3072,1024,16,32,128,32,4,3,37.0,51.63933333333333,3
w13,2,32,6,3072,1024,16,64,128,1,8,5,102.0,51.78933333333333,3
w13,2,60,4,2048,1408,16,32,128,4,4,2,25.0,32.589,3
w13,2,60,4,2048,1408,16,32,128,16,4,2,25.0,32.663666666666664,3
w13,2,60,4,2048,1408,16,64,128,16,8,2,42.0,32.727666666666664,3
w13,2,60,6,3584,2304,16,64,128,16,4,2,42.0,129.47466666666665,3
w13,2,60,6,3584,2304,16,64,128,32,4,2,42.0,129.49633333333335,3
w13,2,60,6,3584,2304,16,32,128,4,4,3,37.0,129.54966666666667,3
w13,2,60,8,2048,1536,16,64,64,64,4,3,32.0,67.35199999999999,3
w13,2,60,8,2048,1536,16,64,128,64,4,2,42.0,67.45833333333333,3
w13,2,60,8,2048,1536,16,64,64,16,4,3,32.0,67.533,3
w13,2,64,6,3072,2048,16,64,128,32,4,2,42.0,98.82933333333334,3
w13,2,64,6,3072,2048,16,64,64,1,4,3,32.0,99.427,3
w13,2,64,6,3072,2048,16,128,128,1,8,2,76.0,99.469,3
w13,2,64,6,3584,1536,16,32,128,1,4,2,25.0,86.93599999999999,3
w13,2,64,6,3584,1536,16,32,128,16,4,2,25.0,86.96833333333332,3
w13,2,64,6,3584,1536,16,32,128,64,4,2,25.0,87.13833333333334,3
w13,2,64,8,3584,2560,16,64,256,1,8,3,122.0,188.37633333333335,3
w13,2,64,8,3584,2560,16,64,256,32,8,3,122.0,188.6326666666667,3
w13,2,64,8,3584,2560,16,64,128,16,8,2,42.0,188.81433333333337,3
w13,2,128,4,2048,512,16,64,128,32,8,4,82.0,8.119,3
w13,2,128,4,2048,512,16,64,128,16,8,3,62.0,8.119333333333335,3
w13,2,128,4,2048,512,16,64,128,64,8,4,82.0,8.13,3
w13,2,128,6,4096,2048,16,32,128,1,4,5,61.0,131.0536666666667,3
w13,2,128,6,4096,2048,16,64,128,32,4,5,102.0,131.07466666666667,3
w13,2,128,6,4096,2048,16,32,128,16,4,5,61.0,131.25633333333334,3
w13,2,128,8,2048,768,16,32,128,1,4,5,61.0,35.394,3
w13,2,128,8,2048,768,16,32,128,1,4,3,37.0,35.54366666666667,3
w13,2,128,8,2048,768,16,64,128,16,4,3,62.0,35.55433333333333,3
w13,2,128,8,4096,1536,16,64,128,1,4,5,102.0,130.72233333333335,3
w13,2,128,8,4096,1536,16,64,128,64,4,5,102.0,130.81833333333333,3
w13,2,128,8,4096,1536,16,64,128,16,4,4,82.0,130.96766666666667,3
w13,2,128,8,4096,3072,16,64,128,1,4,5,102.0,256.23833333333334,3
w13,2,128,8,4096,3072,16,64,128,64,4,5,102.0,256.61133333333333,3
w13,2,128,8,4096,3072,16,64,256,1,4,3,122.0,256.65433333333334,3
w13,4,8,2,1024,512,16,64,128,16,8,3,62.0,5.442,3
w13,4,8,2,1024,512,16,64,128,64,8,3,62.0,5.442,3
w13,4,8,2,1024,512,16,64,128,32,8,3,62.0,5.4526666666666666,3
w13,4,16,2,1536,768,16,32,128,32,4,3,37.0,9.149666666666668,3
w13,4,16,2,1536,768,16,32,128,4,4,3,37.0,9.181666666666668,3
w13,4,16,2,1536,768,16,32,128,64,4,3,37.0,9.192,3
w13,4,16,4,1536,1024,16,32,128,32,4,2,25.0,35.682,3
w13,4,16,4,1536,1024,16,32,128,4,4,2,25.0,35.778,3
w13,4,16,4,1536,1024,16,64,64,1,8,3,32.0,35.821333333333335,3
w13,4,32,4,2048,768,16,64,128,64,8,3,62.0,35.458333333333336,3
w13,4,32,4,2048,768,16,64,128,1,8,5,102.0,35.629,3
w13,4,32,4,2048,768,16,64,64,1,4,4,42.0,35.63933333333333,3
w13,4,32,6,3072,1024,16,128,128,64,8,4,148.0,99.17033333333332,3
w13,4,32,6,3072,1024,16,64,128,64,4,4,82.0,99.34133333333334,3
w13,4,32,6,3072,1024,16,64,128,16,4,2,42.0,99.51166666666668,3
w13,4,60,4,2048,1408,16,64,128,16,4,2,42.0,62.413,3
w13,4,60,4,2048,1408,16,64,128,32,4,2,42.0,62.57366666666667,3
w13,4,60,4,2048,1408,16,32,64,64,4,3,19.0,62.61600000000001,3
w13,4,60,6,3584,2304,16,32,128,1,4,2,25.0,252.368,3
w13,4,60,6,3584,2304,16,32,128,4,4,2,25.0,252.805,3
w13,4,60,6,3584,2304,16,32,128,64,4,2,25.0,252.89033333333336,3
w13,4,60,8,2048,1536,16,32,128,4,4,2,25.0,130.29633333333334,3
w13,4,60,8,2048,1536,16,32,256,1,4,3,73.0,130.30666666666667,3
w13,4,60,8,2048,1536,16,32,128,64,4,5,61.0,130.41366666666667,3
w13,4,64,6,3072,2048,16,32,256,1,4,3,73.0,193.87066666666664,3
w13,4,64,6,3072,2048,16,64,128,32,4,5,102.0,193.95566666666664,3
w13,4,64,6,3072,2048,16,32,256,1,4,2,49.0,194.02999999999997,3
w13,4,64,6,3584,1536,16,64,128,1,4,4,82.0,170.31766666666667,3
w13,4,64,6,3584,1536,16,32,256,1,4,2,49.0,170.46666666666667,3
w13,4,64,6,3584,1536,16,32,128,4,4,2,25.0,170.57366666666667,3
w13,4,64,8,3584,2560,16,32,256,1,4,5,121.0,372.22333333333336,3
w13,4,64,8,3584,2560,16,64,256,1,4,3,122.0,372.288,3
w13,4,64,8,3584,2560,16,64,128,1,4,5,102.0,372.362,3
w13,4,128,4,2048,512,16,32,256,16,4,2,49.0,24.706333333333333,3
w13,4,128,4,2048,512,16,64,128,64,8,3,62.0,24.791666666666668,3
w13,4,128,4,2048,512,16,64,64,1,4,5,52.0,24.834333333333333,3
w13,4,128,6,4096,2048,16,32,128,64,4,5,61.0,256.1073333333333,3
w13,4,128,6,4096,2048,16,32,128,1,4,5,61.0,256.22433333333333,3
w13,4,128,6,4096,2048,16,64,128,32,4,5,102.0,256.2563333333333,3
w13,4,128,8,2048,768,16,128,128,1,8,2,76.0,67.25866666666667,3
w13,4,128,8,2048,768,16,64,64,16,4,3,32.0,67.408,3
w13,4,128,8,2048,768,16,64,128,32,4,2,42.0,67.54633333333334,3
w13,4,128,8,4096,1536,16,64,128,64,4,5,102.0,256.4316666666667,3
w13,4,128,8,4096,1536,16,64,256,1,4,3,122.0,256.4633333333333,3
w13,4,128,8,4096,1536,16,128,128,1,8,5,184.0,256.5273333333334,3
w13,4,128,8,4096,3072,16,32,128,1,4,5,61.0,505.754,3
w13,4,128,8,4096,3072,16,64,128,1,4,5,102.0,505.9446666666667,3
w13,4,128,8,4096,3072,16,32,256,1,4,5,121.0,506.0683333333333,3
w13,8,8,2,1024,512,16,64,128,32,8,3,62.0,5.474,3
w13,8,8,2,1024,512,16,64,128,64,8,3,62.0,5.484666666666667,3
w13,8,8,2,1024,512,16,64,128,16,8,3,62.0,5.495333333333334,3
w13,8,16,2,1536,768,16,32,128,4,4,2,25.0,27.114333333333335,3
w13,8,16,2,1536,768,16,32,128,64,4,2,25.0,27.146666666666665,3
w13,8,16,2,1536,768,16,32,128,16,4,2,25.0,27.24266666666667,3
w13,8,16,4,1536,1024,16,32,128,16,4,2,25.0,35.33,3
w13,8,16,4,1536,1024,16,32,128,32,4,2,25.0,35.405,3
w13,8,16,4,1536,1024,16,64,64,1,4,3,32.0,35.47933333333333,3
w13,8,32,4,2048,768,16,64,64,1,4,3,32.0,67.14933333333333,3
w13,8,32,4,2048,768,16,64,128,16,4,2,42.0,67.171,3
w13,8,32,4,2048,768,16,64,128,1,4,2,42.0,67.34133333333334,3
w13,8,32,6,3072,1024,16,64,128,1,4,5,102.0,131.16033333333334,3
w13,8,32,6,3072,1024,16,32,128,16,4,2,25.0,131.36233333333334,3
w13,8,32,6,3072,1024,16,32,128,1,4,5,61.0,131.40566666666666,3
w13,8,60,4,2048,1408,16,128,128,1,8,2,76.0,120.43933333333332,3
w13,8,60,4,2048,1408,16,64,128,1,4,4,82.0,120.69533333333334,3
w13,8,60,4,2048,1408,16,32,256,1,4,3,73.0,120.83433333333332,3
w13,8,60,6,3584,2304,16,64,128,1,4,5,102.0,498.23533333333336,3
w13,8,60,6,3584,2304,16,128,128,1,8,5,184.0,498.3409999999999,3
w13,8,60,6,3584,2304,16,32,256,1,4,3,73.0,498.4156666666666,3
w13,8,60,8,2048,1536,16,32,256,1,4,3,73.0,240.035,3
w13,8,60,8,2048,1536,16,32,128,4,4,2,25.0,240.11,3
w13,8,60,8,2048,1536,16,64,128,1,4,2,42.0,240.14233333333337,3
w13,8,64,6,3072,2048,16,32,256,1,4,5,121.0,381.5116666666666,3
w13,8,64,6,3072,2048,16,32,256,1,4,4,97.0,381.90633333333335,3
w13,8,64,6,3072,2048,16,32,256,16,4,5,121.0,382.03399999999993,3
w13,8,64,6,3584,1536,16,64,128,1,4,4,82.0,334.6496666666667,3
w13,8,64,6,3584,1536,16,64,128,1,4,5,102.0,334.74566666666664,3
w13,8,64,6,3584,1536,16,32,128,32,4,5,61.0,334.9483333333333,3
w13,8,64,8,3584,2560,16,32,256,1,4,5,121.0,734.3216666666667,3
w13,8,64,8,3584,2560,16,32,256,1,4,3,73.0,734.93,3
w13,8,64,8,3584,2560,16,64,256,1,8,5,202.0,735.4853333333334,3
w13,8,128,4,2048,512,16,32,64,1,4,3,19.0,46.15533333333334,3
w13,8,128,4,2048,512,16,64,64,1,4,3,32.0,46.209333333333326,3
w13,8,128,4,2048,512,16,32,128,4,4,2,25.0,46.27333333333333,3
w13,8,128,6,4096,2048,16,32,128,1,4,5,61.0,506.1176666666667,3
w13,8,128,6,4096,2048,16,64,128,1,4,5,102.0,506.3086666666666,3
w13,8,128,6,4096,2048,16,64,256,1,4,5,202.0,506.384,3
w13,8,128,8,2048,768,16,128,128,1,8,2,76.0,130.20466666666667,3
w13,8,128,8,2048,768,16,64,128,16,8,3,62.0,130.46066666666667,3
w13,8,128,8,2048,768,16,32,128,1,4,5,61.0,130.557,3
w13,8,128,8,4096,1536,16,64,128,1,4,5,102.0,505.71133333333336,3
w13,8,128,8,4096,1536,16,32,256,1,4,5,121.0,505.8503333333333,3
w13,8,128,8,4096,1536,16,32,128,4,4,5,61.0,506.3833333333334,3
w13,8,128,8,4096,3072,16,32,256,16,4,5,121.0,1004.7663333333334,3
w13,8,128,8,4096,3072,16,64,128,1,4,5,102.0,1004.809,3
w13,8,128,8,4096,3072,16,32,256,1,4,5,121.0,1005.0863333333332,3
w13,16,8,2,1024,512,16,64,128,32,8,3,62.0,5.517,3
w13,16,8,2,1024,512,16,64,128,64,8,3,62.0,5.527333333333334,3
w13,16,8,2,1024,512,16,64,128,16,8,3,62.0,5.527666666666666,3
w13,16,16,2,1536,768,16,32,128,4,4,2,25.0,27.285,3
w13,16,16,2,1536,768,16,32,128,16,4,2,25.0,27.445333333333338,3
w13,16,16,2,1536,768,16,32,128,32,4,2,25.0,27.46666666666667,3
w13,16,16,4,1536,1024,16,32,128,16,4,2,25.0,35.65,3
w13,16,16,4,1536,1024,16,32,128,1,4,2,25.0,35.661,3
w13,16,16,4,1536,1024,16,32,128,64,4,2,25.0,35.74633333333333,3
w13,16,32,4,2048,768,16,64,128,16,4,2,42.0,67.37266666666666,3
w13,16,32,4,2048,768,16,64,128,32,4,2,42.0,67.63966666666666,3
w13,16,32,4,2048,768,16,64,64,16,4,3,32.0,67.661,3
w13,16,32,6,3072,1024,16,32,128,4,4,2,25.0,131.39466666666667,3
w13,16,32,6,3072,1024,16,32,128,32,4,2,25.0,131.587,3
w13,16,32,6,3072,1024,16,32,128,16,4,2,25.0,131.78933333333333,3
w13,16,60,4,2048,1408,16,32,256,1,4,3,73.0,220.56933333333333,3
w13,16,60,4,2048,1408,16,64,128,16,4,5,102.0,220.6003333333333,3
w13,16,60,4,2048,1408,16,64,128,1,4,5,102.0,220.7603333333333,3
w13,16,60,6,3584,2304,16,32,256,1,4,5,121.0,622.641,3
w13,16,60,6,3584,2304,16,128,128,1,8,5,184.0,623.0463333333333,3
w13,16,60,6,3584,2304,16,64,256,1,8,3,122.0,623.2810000000001,3
w13,16,60,8,2048,1536,16,64,128,1,4,5,102.0,240.878,3
w13,16,60,8,2048,1536,16,32,128,4,4,2,25.0,240.92033333333333,3
w13,16,60,8,2048,1536,16,32,128,1,4,2,25.0,241.284,3
w13,16,64,6,3072,2048,16,32,256,1,4,5,121.0,507.38633333333337,3
w13,16,64,6,3072,2048,16,32,256,1,4,4,97.0,507.79266666666666,3
w13,16,64,6,3072,2048,16,64,256,1,4,5,202.0,507.99500000000006,3
w13,16,64,6,3584,1536,16,32,256,1,4,4,97.0,445.3063333333334,3
w13,16,64,6,3584,1536,16,32,256,1,4,5,121.0,445.6366666666666,3
w13,16,64,6,3584,1536,16,32,256,1,4,2,49.0,445.893,3
w13,16,64,8,3584,2560,16,64,128,1,4,5,102.0,737.181,3
w13,16,64,8,3584,2560,16,32,256,1,4,5,121.0,737.3829999999999,3
w13,16,64,8,3584,2560,16,128,128,1,8,5,184.0,738.0663333333333,3
w13,16,128,4,2048,512,16,32,128,32,4,2,25.0,88.714,3
w13,16,128,4,2048,512,16,32,128,4,4,5,61.0,88.85266666666666,3
w13,16,128,4,2048,512,16,64,128,1,8,3,62.0,88.86333333333334,3
w13,16,128,6,4096,2048,16,64,256,1,4,5,202.0,1003.9876666666664,3
w13,16,128,6,4096,2048,16,32,256,1,4,5,121.0,1004.3823333333332,3
w13,16,128,6,4096,2048,16,64,256,1,8,5,202.0,1005.5233333333332,3
w13,16,128,8,2048,768,16,32,256,16,4,3,73.0,255.801,3
w13,16,128,8,2048,768,16,32,256,32,4,2,49.0,255.876,3
w13,16,128,8,2048,768,16,32,128,1,4,5,61.0,255.90766666666664,3
w13,16,128,8,4096,1536,16,32,256,1,4,5,121.0,1003.1123333333334,3
w13,16,128,8,4096,1536,16,64,256,1,4,5,202.0,1004.819,3
w13,16,128,8,4096,1536,16,64,128,1,4,5,102.0,1005.224,3
w13,16,128,8,4096,3072,16,32,256,1,4,5,121.0,1999.718,3
w13,16,128,8,4096,3072,16,64,256,1,4,4,162.0,2000.2086666666669,3
w13,16,128,8,4096,3072,16,64,256,1,4,5,202.0,2000.4436666666668,3
w13,24,8,2,1024,512,16,64,128,32,8,3,62.0,5.506,3
w13,24,8,2,1024,512,16,64,128,16,8,3,62.0,5.516333333333333,3
w13,24,8,2,1024,512,16,64,128,64,8,3,62.0,5.538,3
w13,24,16,2,1536,768,16,32,128,16,4,2,25.0,27.264333333333337,3
w13,24,16,2,1536,768,16,32,128,32,4,2,25.0,27.59466666666667,3
w13,24,16,2,1536,768,16,32,128,4,4,2,25.0,27.69066666666667,3
w13,24,16,4,1536,1024,16,64,64,1,4,3,32.0,35.60766666666667,3
w13,24,16,4,1536,1024,16,32,128,64,4,2,25.0,35.842333333333336,3
w13,24,16,4,1536,1024,16,32,64,16,4,3,19.0,35.853,3
w13,24,32,4,2048,768,16,64,128,1,4,2,42.0,67.587,3
w13,24,32,4,2048,768,16,64,64,16,4,3,32.0,67.60833333333333,3
w13,24,32,4,2048,768,16,64,64,1,4,3,32.0,67.64999999999999,3
w13,24,32,6,3072,1024,64,64,64,1,4,3,56.0,132.131,3
w13,24,32,6,3072,1024,16,128,128,1,8,4,148.0,132.15200000000002,3
w13,24,32,6,3072,1024,16,32,128,1,4,2,25.0,132.163,3
w13,24,60,4,2048,1408,16,32,256,1,4,3,73.0,220.91033333333337,3
w13,24,60,4,2048,1408,16,32,128,1,4,5,61.0,221.145,3
w13,24,60,4,2048,1408,16,64,128,1,4,5,102.0,221.19866666666667,3
w13,24,60,6,3584,2304,16,128,128,1,8,5,184.0,623.6763333333333,3
w13,24,60,6,3584,2304,16,64,128,1,4,5,102.0,624.134,3
w13,24,60,6,3584,2304,16,32,256,1,4,5,121.0,624.1876666666666,3
w13,24,60,8,2048,1536,16,32,128,1,4,2,25.0,242.051,3
w13,24,60,8,2048,1536,16,64,128,16,4,2,42.0,242.073,3
w13,24,60,8,2048,1536,16,64,128,64,4,2,42.0,242.254,3
w13,24,64,6,3072,2048,16,32,256,1,4,5,121.0,508.2296666666667,3
w13,24,64,6,3072,2048,16,64,256,1,4,5,202.0,509.2006666666666,3
w13,24,64,6,3072,2048,16,128,128,1,8,3,112.0,509.2326666666666,3
w13,24,64,6,3584,1536,16,128,128,1,8,2,76.0,445.8183333333333,3
w13,24,64,6,3584,1536,16,32,256,1,4,4,97.0,445.95733333333334,3
w13,24,64,6,3584,1536,16,32,256,1,4,5,121.0,446.3516666666667,3
w13,24,64,8,3584,2560,16,32,256,1,4,5,121.0,739.773,3
w13,24,64,8,3584,2560,16,128,128,1,8,5,184.0,739.8580000000001,3
w13,24,64,8,3584,2560,16,64,256,1,8,5,202.0,740.2313333333333,3
w13,24,128,4,2048,512,16,32,128,16,4,5,61.0,130.35366666666667,3
w13,24,128,4,2048,512,16,64,128,1,8,3,62.0,130.375,3
w13,24,128,4,2048,512,16,128,128,32,8,2,76.0,130.456,3
w13,24,128,6,4096,2048,16,32,256,1,4,5,121.0,1336.6293333333333,3
w13,24,128,6,4096,2048,16,64,256,1,4,5,202.0,1337.0243333333333,3
w13,24,128,6,4096,2048,16,64,256,1,8,5,202.0,1337.7389999999998,3
w13,24,128,8,2048,768,16,128,128,1,8,2,76.0,255.972,3
w13,24,128,8,2048,768,16,32,256,1,4,3,73.0,256.36633333333333,3
w13,24,128,8,2048,768,16,32,128,32,4,5,61.0,256.3876666666667,3
w13,24,128,8,4096,1536,16,64,256,1,4,5,202.0,1005.651,3
w13,24,128,8,4096,1536,16,32,256,1,4,5,121.0,1006.3333333333334,3
w13,24,128,8,4096,1536,16,32,256,16,4,5,121.0,1006.6856666666666,3
w13,24,128,8,4096,3072,16,32,256,1,4,5,121.0,2003.046,3
w13,24,128,8,4096,3072,16,64,256,1,8,4,162.0,2003.0996666666667,3
w13,24,128,8,4096,3072,16,64,256,1,4,5,202.0,2003.611666666667,3
w13,32,8,2,1024,512,16,64,128,32,8,3,62.0,5.506333333333333,3
w13,32,8,2,1024,512,16,64,128,16,8,3,62.0,5.527666666666666,3
w13,32,8,2,1024,512,16,64,128,64,8,3,62.0,5.548666666666667,3
w13,32,16,2,1536,768,16,32,128,16,4,2,25.0,27.52,3
w13,32,16,2,1536,768,16,64,128,16,4,2,42.0,27.765333333333334,3
w13,32,16,2,1536,768,16,32,256,16,4,2,49.0,27.828666666666667,3
w13,32,16,4,1536,1024,16,32,128,16,4,2,25.0,35.76733333333333,3
w13,32,16,4,1536,1024,16,32,64,16,4,3,19.0,36.05533333333333,3
w13,32,16,4,1536,1024,16,32,64,64,4,3,19.0,36.05533333333333,3
w13,32,32,4,2048,768,16,64,128,64,4,2,42.0,67.757,3
w13,32,32,4,2048,768,16,128,128,1,8,2,76.0,67.757,3
w13,32,32,4,2048,768,16,64,64,32,4,3,32.0,67.80033333333334,3
w13,32,32,6,3072,1024,16,32,128,1,4,2,25.0,132.216,3
w13,32,32,6,3072,1024,16,32,128,16,4,2,25.0,132.344,3
w13,32,32,6,3072,1024,16,32,128,4,4,2,25.0,132.46166666666667,3
w13,32,60,4,2048,1408,16,32,128,4,4,5,61.0,221.46433333333337,3
w13,32,60,4,2048,1408,16,32,256,1,4,2,49.0,221.4863333333333,3
w13,32,60,4,2048,1408,16,64,128,1,4,5,102.0,221.69966666666664,3
w13,32,60,6,3584,2304,16,64,128,1,4,5,102.0,625.2863333333333,3
w13,32,60,6,3584,2304,16,32,256,1,4,3,73.0,625.7660000000001,3
w13,32,60,6,3584,2304,16,128,128,1,8,5,184.0,625.7983333333333,3
w13,32,60,8,2048,1536,16,128,128,1,8,2,76.0,242.88333333333333,3
w13,32,60,8,2048,1536,16,64,128,32,4,2,42.0,242.915,3
w13,32,60,8,2048,1536,16,32,128,1,4,2,25.0,243.01133333333337,3
w13,32,64,6,3072,2048,16,32,256,1,4,5,121.0,509.90433333333334,3
w13,32,64,6,3072,2048,16,64,128,1,4,5,102.0,510.92833333333334,3
w13,32,64,6,3072,2048,16,64,256,1,4,5,202.0,511.067,3
w13,32,64,6,3584,1536,16,32,256,1,4,5,121.0,447.02400000000006,3
w13,32,64,6,3584,1536,16,32,256,1,4,4,97.0,447.4183333333333,3
w13,32,64,6,3584,1536,16,32,256,1,4,2,49.0,447.525,3
w13,32,64,8,3584,2560,16,64,128,1,4,5,102.0,740.6476666666667,3
w13,32,64,8,3584,2560,16,128,128,1,8,5,184.0,741.0740000000001,3
w13,32,64,8,3584,2560,16,64,256,1,4,5,202.0,741.6926666666667,3
w13,32,128,4,2048,512,16,32,256,16,4,3,73.0,172.409,3
w13,32,128,4,2048,512,16,32,256,32,4,3,73.0,172.55766666666668,3
w13,32,128,4,2048,512,16,64,128,1,4,3,62.0,172.6003333333333,3
w13,32,128,6,4096,2048,16,32,256,1,4,5,121.0,1338.3363333333334,3
w13,32,128,6,4096,2048,16,64,256,1,4,5,202.0,1338.369333333333,3
w13,32,128,6,4096,2048,16,64,256,1,4,4,162.0,1338.8163333333334,3
w13,32,128,8,2048,768,16,128,128,1,8,2,76.0,256.55833333333334,3
w13,32,128,8,2048,768,16,32,256,1,4,2,49.0,256.84633333333335,3
w13,32,128,8,2048,768,16,128,128,64,8,2,76.0,257.113,3
w13,32,128,8,4096,1536,16,32,256,1,4,5,121.0,1006.7713333333336,3
w13,32,128,8,4096,1536,16,64,256,1,4,5,202.0,1007.2196666666669,3
w13,32,128,8,4096,1536,16,32,256,16,4,5,121.0,1007.518,3
w13,32,128,8,4096,3072,16,64,256,1,4,5,202.0,2005.3833333333332,3
w13,32,128,8,4096,3072,16,32,256,1,4,5,121.0,2005.5213333333336,3
w13,32,128,8,4096,3072,16,128,128,1,8,5,184.0,2006.3636666666669,3
w13,48,8,2,1024,512,16,64,128,64,8,3,62.0,5.538,3
w13,48,8,2,1024,512,16,64,128,32,8,3,62.0,5.559333333333334,3
w13,48,8,2,1024,512,16,64,128,16,8,4,82.0,5.5696666666666665,3
w13,48,16,2,1536,768,16,32,128,16,4,2,25.0,27.49,3
w13,48,16,2,1536,768,16,32,128,32,4,2,25.0,27.746,3
w13,48,16,2,1536,768,16,32,128,64,4,2,25.0,27.842,3
w13,48,16,4,1536,1024,16,32,64,64,4,3,19.0,35.98066666666667,3
w13,48,16,4,1536,1024,16,32,128,1,4,2,25.0,36.05566666666667,3
w13,48,16,4,1536,1024,16,32,64,32,4,3,19.0,36.077,3
w13,48,32,4,2048,768,16,128,128,1,8,2,76.0,67.94966666666666,3
w13,48,32,4,2048,768,16,64,64,1,4,3,32.0,68.30066666666666,3
w13,48,32,4,2048,768,16,64,128,32,4,2,42.0,68.365,3
w13,48,32,6,3072,1024,64,64,64,1,4,3,56.0,132.40800000000002,3
w13,48,32,6,3072,1024,16,32,128,16,4,2,25.0,132.69633333333334,3
w13,48,32,6,3072,1024,16,128,128,32,4,2,76.0,132.79233333333332,3
w13,48,60,4,2048,1408,16,64,128,1,4,2,42.0,222.05133333333333,3
w13,48,60,4,2048,1408,16,64,128,16,4,2,42.0,222.649,3
w13,48,60,4,2048,1408,16,64,128,1,4,5,102.0,222.852,3
w13,48,60,6,3584,2304,16,128,128,1,8,5,184.0,627.9746666666666,3
w13,48,60,6,3584,2304,16,64,256,1,4,3,122.0,628.348,3
w13,48,60,6,3584,2304,16,64,256,1,8,3,122.0,628.5613333333333,3
w13,48,60,8,2048,1536,16,128,128,1,8,2,76.0,243.36333333333332,3
w13,48,60,8,2048,1536,16,32,128,4,4,2,25.0,243.66166666666663,3
w13,48,60,8,2048,1536,16,128,128,16,8,2,76.0,243.886,3
w13,48,64,6,3072,2048,16,128,128,1,8,3,112.0,511.8566666666666,3
w13,48,64,6,3072,2048,16,32,256,1,4,5,121.0,512.1446666666667,3
w13,48,64,6,3072,2048,16,128,128,1,4,3,112.0,512.4323333333333,3
w13,48,64,6,3584,1536,16,64,128,1,4,4,82.0,448.6236666666667,3
w13,48,64,6,3584,1536,16,128,128,16,8,2,76.0,448.74066666666664,3
w13,48,64,6,3584,1536,16,32,128,1,4,3,37.0,448.837,3
w13,48,64,8,3584,2560,16,128,128,1,8,5,184.0,744.7330000000001,3
w13,48,64,8,3584,2560,16,64,128,1,4,5,102.0,744.882,3
w13,48,64,8,3584,2560,16,32,256,1,4,5,121.0,745.2666666666668,3
w13,48,128,4,2048,512,16,64,128,1,4,5,102.0,172.6963333333333,3
w13,48,128,4,2048,512,16,32,256,16,4,3,73.0,172.82466666666664,3
w13,48,128,4,2048,512,16,64,128,32,4,3,62.0,172.963,3
w13,48,128,6,4096,2048,16,128,128,1,8,5,184.0,1340.95,3
w13,48,128,6,4096,2048,16,64,256,1,4,5,202.0,1341.0466666666666,3
w13,48,128,6,4096,2048,16,32,256,1,4,5,121.0,1341.2703333333332,3
w13,48,128,8,2048,768,16,128,128,1,8,2,76.0,257.2513333333333,3
w13,48,128,8,2048,768,16,128,128,32,8,2,76.0,257.42233333333337,3
w13,48,128,8,2048,768,16,128,128,16,8,2,76.0,257.43333333333334,3
w13,48,128,8,4096,1536,16,32,256,1,4,5,121.0,1010.0566666666668,3
w13,48,128,8,4096,1536,16,64,256,1,4,5,202.0,1010.2376666666664,3
w13,48,128,8,4096,1536,16,64,256,1,8,4,162.0,1010.8566666666666,3
w13,48,128,8,4096,3072,16,32,256,1,4,5,121.0,2010.599333333333,3
w13,48,128,8,4096,3072,16,64,256,1,8,4,162.0,2010.994,3
w13,48,128,8,4096,3072,16,64,256,1,4,5,202.0,2011.09,3
w13,64,8,2,1024,512,16,64,128,64,8,3,62.0,5.559,3
w13,64,8,2,1024,512,16,64,128,16,8,3,62.0,5.580666666666667,3
w13,64,8,2,1024,512,16,64,128,32,8,3,62.0,5.581,3
w13,64,16,2,1536,768,16,32,128,16,4,2,25.0,27.394333333333332,3
w13,64,16,2,1536,768,16,32,128,32,4,2,25.0,27.671333333333333,3
w13,64,16,2,1536,768,16,32,128,4,4,2,25.0,28.076666666666668,3
w13,64,16,4,1536,1024,16,64,64,64,4,3,32.0,36.16233333333333,3
w13,64,16,4,1536,1024,16,32,128,16,4,2,25.0,36.24766666666667,3
w13,64,16,4,1536,1024,16,128,64,64,8,3,58.0,36.37566666666667,3
w13,64,32,4,2048,768,16,128,128,1,8,2,76.0,67.97066666666666,3
w13,64,32,4,2048,768,16,64,64,32,4,3,32.0,68.195,3
w13,64,32,4,2048,768,16,64,64,1,4,3,32.0,68.24733333333334,3
w13,64,32,6,3072,1024,16,32,128,16,4,2,25.0,133.11233333333334,3
w13,64,32,6,3072,1024,16,32,128,4,4,2,25.0,133.36800000000002,3
w13,64,32,6,3072,1024,16,128,128,32,4,2,76.0,133.36800000000002,3
w13,64,60,4,2048,1408,16,128,128,1,8,5,184.0,223.68366666666668,3
w13,64,60,4,2048,1408,16,64,128,16,4,2,42.0,223.737,3
w13,64,60,4,2048,1408,16,32,256,1,4,2,49.0,223.75833333333333,3
w13,64,60,6,3584,2304,16,128,128,1,8,5,184.0,628.9133333333333,3
w13,64,60,6,3584,2304,32,128,128,4,8,3,128.0,630.0013333333333,3
w13,64,60,6,3584,2304,32,128,128,1,4,3,128.0,630.4063333333334,3
w13,64,60,8,2048,1536,16,64,128,32,4,2,42.0,244.54733333333337,3
w13,64,60,8,2048,1536,16,128,128,1,8,2,76.0,244.9,3
w13,64,60,8,2048,1536,16,64,128,1,4,2,42.0,245.01633333333336,3
w13,64,64,6,3072,2048,16,128,128,1,8,5,184.0,514.1286666666666,3
w13,64,64,6,3072,2048,16,128,128,1,8,3,112.0,514.2033333333334,3
w13,64,64,6,3072,2048,16,64,128,1,4,5,102.0,514.5656666666667,3
w13,64,64,6,3584,1536,16,64,128,1,4,4,82.0,450.05300000000005,3
w13,64,64,6,3584,1536,16,32,256,1,4,5,121.0,450.09566666666666,3
w13,64,64,6,3584,1536,16,32,256,1,4,2,49.0,450.20233333333334,3
w13,64,64,8,3584,2560,16,128,128,1,8,5,184.0,747.0476666666667,3
w13,64,64,8,3584,2560,16,128,128,16,8,5,184.0,748.1039999999999,3
w13,64,64,8,3584,2560,16,64,128,1,4,5,102.0,748.2423333333332,3
w13,64,128,4,2048,512,16,32,256,1,4,3,73.0,172.96366666666663,3
w13,64,128,4,2048,512,32,128,128,1,8,3,128.0,173.24033333333333,3
w13,64,128,4,2048,512,16,64,128,32,4,3,62.0,173.45399999999998,3
w13,64,128,6,4096,2048,16,32,256,1,4,5,121.0,1342.8919999999998,3
w13,64,128,6,4096,2048,16,64,256,1,4,5,202.0,1343.1373333333331,3
w13,64,128,6,4096,2048,16,64,256,1,4,4,162.0,1343.9693333333332,3
w13,64,128,8,2048,768,16,128,128,1,8,2,76.0,258.12666666666667,3
w13,64,128,8,2048,768,16,128,128,32,4,2,76.0,258.425,3
w13,64,128,8,2048,768,16,128,128,16,8,2,76.0,258.66,3
w13,64,128,8,4096,1536,16,128,128,1,8,5,184.0,1012.553,3
w13,64,128,8,4096,1536,16,32,256,1,4,5,121.0,1012.8733333333332,3
w13,64,128,8,4096,1536,16,64,256,1,4,5,202.0,1013.6196666666666,3
w13,64,128,8,4096,3072,16,128,128,1,8,5,184.0,2013.9056666666663,3
w13,64,128,8,4096,3072,16,32,256,1,4,5,121.0,2015.282,3
w13,64,128,8,4096,3072,16,64,256,1,4,4,162.0,2015.9646666666667,3
w13,96,8,2,1024,512,64,64,128,1,8,3,104.0,6.327000000000001,3
w13,96,8,2,1024,512,64,64,128,64,8,3,104.0,6.391333333333333,3
w13,96,8,2,1024,512,64,64,128,8,8,3,104.0,6.4126666666666665,3
w13,96,16,2,1536,768,16,32,128,16,4,2,25.0,27.756666666666664,3
w13,96,16,2,1536,768,16,32,128,64,4,2,25.0,27.959333333333333,3
w13,96,16,2,1536,768,16,32,128,4,4,2,25.0,28.183333333333337,3
w13,96,16,4,1536,1024,32,32,128,16,4,2,34.0,36.684666666666665,3
w13,96,16,4,1536,1024,32,64,64,16,4,3,40.0,36.940666666666665,3
w13,96,16,4,1536,1024,32,32,128,4,4,2,34.0,37.03666666666667,3
w13,96,32,4,2048,768,16,128,128,1,8,2,76.0,68.42866666666667,3
w13,96,32,4,2048,768,16,64,128,16,4,2,42.0,68.53633333333333,3
w13,96,32,4,2048,768,16,64,64,16,4,3,32.0,68.60033333333332,3
w13,96,32,6,3072,1024,64,64,64,32,4,3,56.0,134.37033333333332,3
w13,96,32,6,3072,1024,64,64,64,16,4,3,56.0,134.41333333333333,3
w13,96,32,6,3072,1024,64,64,64,1,4,3,56.0,134.42366666666666,3
w13,96,60,4,2048,1408,16,64,128,1,4,3,62.0,224.53633333333337,3
w13,96,60,4,2048,1408,16,64,256,1,8,3,122.0,224.8033333333333,3
w13,96,60,4,2048,1408,32,128,128,1,8,3,128.0,224.99566666666664,3
w13,96,60,6,3584,2304,16,128,128,1,8,5,184.0,632.636,3
w13,96,60,6,3584,2304,32,128,128,1,8,3,128.0,632.9986666666667,3
w13,96,60,6,3584,2304,16,128,128,32,4,2,76.0,633.052,3
w13,96,60,8,2048,1536,16,128,128,1,8,2,76.0,245.46466666666663,3
w13,96,60,8,2048,1536,16,128,128,16,8,2,76.0,246.53133333333335,3
w13,96,60,8,2048,1536,16,64,128,16,4,2,42.0,246.86233333333337,3
w13,96,64,6,3072,2048,16,128,128,1,8,3,112.0,515.9526666666667,3
w13,96,64,6,3072,2048,16,128,128,1,4,3,112.0,516.1226666666666,3
w13,96,64,6,3072,2048,16,128,128,1,4,2,76.0,517.1683333333334,3
w13,96,64,6,3584,1536,16,64,128,1,4,4,82.0,451.43966666666665,3
w13,96,64,6,3584,1536,32,128,128,1,4,2,88.0,451.5783333333334,3
w13,96,64,6,3584,1536,16,128,128,1,8,2,76.0,451.696,3
w13,96,64,8,3584,2560,16,128,128,1,8,5,184.0,752.7863333333333,3
w13,96,64,8,3584,2560,16,64,256,1,4,3,122.0,753.544,3
w13,96,64,8,3584,2560,16,64,128,1,4,5,102.0,753.5970000000001,3
w13,96,128,4,2048,512,16,64,128,1,4,3,62.0,173.74166666666667,3
w13,96,128,4,2048,512,16,64,128,1,4,5,102.0,173.97633333333332,3
w13,96,128,4,2048,512,16,64,128,16,4,4,82.0,174.073,3
w13,96,128,6,4096,2048,16,128,128,1,8,5,184.0,1346.669,3
w13,96,128,6,4096,2048,64,128,128,1,8,4,208.0,1349.068,3
w13,96,128,6,4096,2048,16,128,128,16,8,5,184.0,1349.314,3
w13,96,128,8,2048,768,16,128,128,1,8,2,76.0,258.49966666666666,3
w13,96,128,8,2048,768,16,128,128,32,8,2,76.0,259.513,3
w13,96,128,8,2048,768,16,128,128,64,8,2,76.0,259.79033333333336,3
w13,96,128,8,4096,1536,16,128,128,1,8,5,184.0,1016.1263333333332,3
w13,96,128,8,4096,1536,64,128,128,1,8,4,208.0,1017.0863333333332,3
w13,96,128,8,4096,1536,16,32,256,1,4,5,121.0,1017.5133333333332,3
w13,96,128,8,4096,3072,16,128,128,1,8,5,184.0,2023.3673333333336,3
w13,96,128,8,4096,3072,64,128,128,1,8,4,208.0,2024.2316666666663,3
w13,96,128,8,4096,3072,32,128,128,1,4,5,208.0,2024.6366666666663,3
w13,128,8,2,1024,512,64,64,128,1,8,3,104.0,6.391000000000001,3
w13,128,8,2,1024,512,32,64,64,1,8,3,40.0,6.401666666666666,3
w13,128,8,2,1024,512,64,64,128,1,8,4,136.0,6.4126666666666665,3
w13,128,16,2,1536,768,16,32,128,32,4,2,25.0,27.778333333333332,3
w13,128,16,2,1536,768,16,32,128,64,4,2,25.0,28.13,3
w13,128,16,2,1536,768,16,32,128,16,4,2,25.0,28.13033333333333,3
w13,128,16,4,1536,1024,64,64,64,32,4,3,56.0,37.239333333333335,3
w13,128,16,4,1536,1024,64,64,64,16,4,3,56.0,37.25033333333334,3
w13,128,16,4,1536,1024,32,32,128,16,4,2,34.0,37.41,3
w13,128,32,4,2048,768,16,64,128,32,4,2,42.0,68.835,3
w13,128,32,4,2048,768,16,128,128,64,8,2,76.0,68.88833333333334,3
w13,128,32,4,2048,768,16,64,128,1,4,2,42.0,69.005,3
w13,128,32,6,3072,1024,64,64,64,4,4,3,56.0,134.47733333333335,3
w13,128,32,6,3072,1024,64,64,64,1,4,3,56.0,134.68033333333332,3
w13,128,32,6,3072,1024,64,64,64,16,4,3,56.0,134.79733333333334,3
w13,128,60,4,2048,1408,16,64,128,1,4,2,42.0,225.7746666666667,3
w13,128,60,4,2048,1408,16,64,128,16,8,2,42.0,225.92366666666663,3
w13,128,60,4,2048,1408,16,128,128,1,8,4,148.0,225.934,3
w13,128,60,6,3584,2304,16,128,128,16,4,2,76.0,635.0256666666667,3
w13,128,60,6,3584,2304,16,128,128,1,4,2,76.0,635.356,3
w13,128,60,6,3584,2304,32,128,128,1,4,3,128.0,635.4733333333334,3
w13,128,60,8,2048,1536,32,128,128,4,4,2,88.0,249.059,3
w13,128,60,8,2048,1536,32,128,128,16,4,2,88.0,249.26200000000003,3
w13,128,60,8,2048,1536,32,128,128,1,4,2,88.0,249.42233333333337,3
w13,128,64,6,3072,2048,16,128,128,1,8,3,112.0,518.2243333333333,3
w13,128,64,6,3072,2048,16,128,128,1,4,3,112.0,518.6186666666666,3
w13,128,64,6,3072,2048,32,128,128,4,4,3,128.0,519.7603333333333,3
w13,128,64,6,3584,1536,16,128,128,1,8,2,76.0,453.33833333333337,3
w13,128,64,6,3584,1536,16,64,128,1,4,4,82.0,453.46633333333335,3
w13,128,64,6,3584,1536,32,128,128,1,8,3,128.0,454.1173333333333,3
w13,128,64,8,3584,2560,16,128,128,1,8,5,184.0,754.1093333333333,3
w13,128,64,8,3584,2560,16,128,128,16,8,5,184.0,756.648,3
w13,128,64,8,3584,2560,16,128,128,1,4,4,148.0,756.9573333333333,3
w13,128,128,4,2048,512,16,128,128,1,4,2,76.0,174.31799999999998,3
w13,128,128,4,2048,512,16,128,128,16,4,2,76.0,174.62699999999998,3
w13,128,128,4,2048,512,16,64,128,16,4,5,102.0,174.713,3
w13,128,128,6,4096,2048,16,128,128,1,8,5,184.0,1350.274,3
w13,128,128,6,4096,2048,16,128,128,16,8,5,184.0,1352.61,3
w13,128,128,6,4096,2048,16,128,128,1,4,5,184.0,1352.706,3
w13,128,128,8,2048,768,16,128,128,1,8,2,76.0,260.0996666666667,3
w13,128,128,8,2048,768,16,128,128,1,4,2,76.0,260.54766666666666,3
w13,128,128,8,2048,768,16,128,128,32,4,2,76.0,260.5586666666666,3
w13,128,128,8,4096,1536,16,128,128,1,8,5,184.0,1019.2303333333332,3
w13,128,128,8,4096,1536,64,128,128,1,8,4,208.0,1020.0523333333334,3
w13,128,128,8,4096,1536,16,128,128,1,4,4,148.0,1020.1476666666669,3
w13,128,128,8,4096,3072,16,128,128,1,8,5,184.0,2030.5996666666667,3
w13,128,128,8,4096,3072,16,128,128,16,8,5,184.0,2030.8876666666667,3
w13,128,128,8,4096,3072,32,128,128,8,4,5,208.0,2031.6453333333332,3
w13,256,8,2,1024,512,64,64,128,1,8,4,136.0,6.646999999999999,3
w13,256,8,2,1024,512,64,64,128,1,8,3,104.0,6.658,3
w13,256,8,2,1024,512,64,64,128,8,8,3,104.0,6.668666666666667,3
w13,256,16,2,1536,768,32,32,128,4,4,2,34.0,29.250333333333337,3
w13,256,16,2,1536,768,32,32,128,16,4,2,34.0,29.41,3
w13,256,16,2,1536,768,64,64,64,1,4,3,56.0,29.442333333333337,3
w13,256,16,4,1536,1024,64,64,64,1,4,3,56.0,38.509,3
w13,256,16,4,1536,1024,64,64,64,4,4,3,56.0,38.637,3
w13,256,16,4,1536,1024,64,64,64,32,4,3,56.0,38.63733333333334,3
w13,256,32,4,2048,768,32,128,128,8,4,2,88.0,70.66933333333333,3
w13,256,32,4,2048,768,32,64,64,1,4,3,40.0,70.80733333333333,3
w13,256,32,4,2048,768,32,128,128,1,4,2,88.0,71.01,3
w13,256,32,6,3072,1024,64,64,64,16,4,3,56.0,136.74933333333334,3
w13,256,32,6,3072,1024,64,64,64,1,4,3,56.0,137.02700000000002,3
w13,256,32,6,3072,1024,64,64,64,4,4,3,56.0,137.56033333333335,3
w13,256,60,4,2048,1408,32,128,128,4,4,3,128.0,228.81433333333337,3
w13,256,60,4,2048,1408,64,64,64,4,4,3,56.0,229.006,3
w13,256,60,4,2048,1408,32,128,128,1,4,3,128.0,229.04933333333335,3
w13,256,60,6,3584,2304,32,128,128,4,8,3,128.0,641.5426666666666,3
w13,256,60,6,3584,2304,32,128,128,1,8,3,128.0,642.8336666666667,3
w13,256,60,6,3584,2304,32,128,128,1,4,3,128.0,643.1643333333333,3
w13,256,60,8,2048,1536,64,128,64,16,4,3,88.0,255.097,3
w13,256,60,8,2048,1536,64,128,64,4,4,3,88.0,255.17166666666665,3
w13,256,60,8,2048,1536,64,128,64,1,4,3,88.0,255.86533333333333,3
w13,256,64,6,3072,2048,32,128,128,1,4,3,128.0,526.4273333333334,3
w13,256,64,6,3072,2048,32,128,128,4,4,3,128.0,526.7046666666666,3
w13,256,64,6,3072,2048,32,128,128,1,8,3,128.0,527.2379999999999,3
w13,256,64,6,3584,1536,32,128,128,1,4,2,88.0,456.731,3
w13,256,64,6,3584,1536,32,128,128,4,4,2,88.0,457.979,3
w13,256,64,6,3584,1536,32,128,128,8,4,2,88.0,458.0423333333333,3
w13,256,64,8,3584,2560,32,128,128,4,4,3,128.0,767.5916666666667,3
w13,256,64,8,3584,2560,32,128,128,1,4,3,128.0,768.3703333333333,3
w13,256,64,8,3584,2560,32,128,128,1,8,3,128.0,769.043,3
w13,256,128,4,2048,512,16,128,128,64,4,2,76.0,175.758,3
w13,256,128,4,2048,512,16,128,128,16,8,2,76.0,175.86433333333335,3
w13,256,128,4,2048,512,16,128,128,32,8,2,76.0,175.89633333333336,3
w13,256,128,6,4096,2048,16,128,128,1,8,5,184.0,1363.7996666666666,3
w13,256,128,6,4096,2048,64,128,128,1,8,4,208.0,1365.0686666666668,3
w13,256,128,6,4096,2048,16,128,128,16,8,5,184.0,1365.666,3
w13,256,128,8,2048,768,16,128,128,1,8,2,76.0,262.212,3
w13,256,128,8,2048,768,16,128,128,1,4,2,76.0,263.02233333333334,3
w13,256,128,8,2048,768,16,128,128,16,4,2,76.0,263.14,3
w13,256,128,8,4096,1536,16,128,128,1,8,2,76.0,1029.7056666666667,3
w13,256,128,8,4096,1536,64,128,128,1,8,4,208.0,1030.025666666667,3
w13,256,128,8,4096,1536,16,128,128,1,4,2,76.0,1030.6229999999998,3
w13,256,128,8,4096,3072,32,128,128,1,4,3,128.0,2053.4156666666663,3
w13,256,128,8,4096,3072,16,128,128,1,8,5,184.0,2054.717,3
w13,256,128,8,4096,3072,16,128,128,1,4,5,184.0,2054.92,3
w13,512,8,2,1024,512,64,128,32,8,4,4,64.0,8.183666666666667,3
w13,512,8,2,1024,512,64,128,32,8,4,5,76.0,8.215333333333334,3
w13,512,8,2,1024,512,128,64,64,1,8,4,112.0,8.215666666666666,3
w13,512,16,2,1536,768,64,64,128,1,8,2,72.0,30.316999999999997,3
w13,512,16,2,1536,768,64,64,128,8,4,2,72.0,30.37,3
w13,512,16,2,1536,768,64,64,128,16,4,2,72.0,30.412666666666667,3
w13,512,16,4,1536,1024,128,128,64,64,8,3,128.0,42.391333333333336,3
w13,512,16,4,1536,1024,128,128,64,4,8,3,128.0,42.45533333333333,3
w13,512,16,4,1536,1024,128,128,64,32,8,3,128.0,42.76500000000001,3
w13,512,32,4,2048,768,64,128,64,32,8,3,88.0,73.47433333333333,3
w13,512,32,4,2048,768,64,128,64,1,4,3,88.0,73.57033333333334,3
w13,512,32,4,2048,768,64,128,64,64,4,3,88.0,73.63466666666666,3
w13,512,32,6,3072,1024,128,128,64,1,8,3,128.0,146.25366666666665,3
w13,512,32,6,3072,1024,128,128,64,4,8,3,128.0,146.41333333333333,3
w13,512,32,6,3072,1024,128,128,64,16,8,3,128.0,146.99966666666668,3
w13,512,60,4,2048,1408,64,128,128,1,8,2,112.0,234.3183333333333,3
w13,512,60,4,2048,1408,64,128,128,16,8,2,112.0,234.32933333333335,3
w13,512,60,4,2048,1408,64,128,128,4,8,2,112.0,235.45933333333335,3
w13,512,60,6,3584,2304,64,128,128,1,8,4,208.0,660.327,3
w13,512,60,6,3584,2304,64,128,128,4,8,4,208.0,661.458,3
w13,512,60,6,3584,2304,64,128,128,1,4,4,208.0,662.7593333333333,3
w13,512,60,8,2048,1536,128,128,64,1,8,5,192.0,272.76133333333337,3
w13,512,60,8,2048,1536,128,128,64,1,8,3,128.0,272.964,3
w13,512,60,8,2048,1536,128,128,64,8,8,3,128.0,273.29466666666667,3
w13,512,64,6,3072,2048,64,128,128,1,8,2,112.0,537.1153333333333,3
w13,512,64,6,3072,2048,64,128,128,4,8,2,112.0,537.574,3
w13,512,64,6,3072,2048,64,128,128,1,4,2,112.0,538.8966666666666,3
w13,512,64,6,3584,1536,64,64,64,1,4,3,56.0,468.14466666666664,3
w13,512,64,6,3584,1536,64,128,128,1,8,2,112.0,469.1046666666667,3
w13,512,64,6,3584,1536,64,128,128,4,8,2,112.0,469.382,3
w13,512,64,8,3584,2560,64,128,128,4,8,2,112.0,782.6,3
w13,512,64,8,3584,2560,64,128,128,16,8,2,112.0,782.643,3
w13,512,64,8,3584,2560,64,128,128,1,8,2,112.0,782.8879999999999,3
w13,512,128,4,2048,512,16,128,128,1,4,2,76.0,176.995,3
w13,512,128,4,2048,512,16,128,128,16,4,2,76.0,177.91233333333335,3
w13,512,128,4,2048,512,16,128,128,1,8,2,76.0,177.99766666666665,3
w13,512,128,6,4096,2048,32,128,128,1,4,3,128.0,1384.130666666667,3
w13,512,128,6,4096,2048,32,128,128,16,8,3,128.0,1384.727666666667,3
w13,512,128,6,4096,2048,32,128,128,1,8,3,128.0,1384.749,3
w13,512,128,8,2048,768,32,128,128,4,4,2,88.0,267.855,3
w13,512,128,8,2048,768,32,128,128,8,4,2,88.0,267.91866666666664,3
w13,512,128,8,2048,768,32,128,128,1,4,2,88.0,268.7293333333334,3
w13,512,128,8,4096,1536,32,128,128,1,4,3,128.0,1045.5883333333334,3
w13,512,128,8,4096,1536,64,128,128,1,8,4,208.0,1046.6976666666667,3
w13,512,128,8,4096,1536,32,128,128,16,4,3,128.0,1047.754,3
w13,512,128,8,4096,3072,32,128,128,1,4,2,88.0,2079.6883333333335,3
w13,512,128,8,4096,3072,32,128,128,1,4,3,128.0,2082.706666666667,3
w13,512,128,8,4096,3072,32,128,128,4,4,3,128.0,2086.0033333333336,3
w13,1024,8,2,1024,512,128,128,64,4,8,3,128.0,11.618,3
w13,1024,8,2,1024,512,128,128,64,8,8,3,128.0,11.703333333333331,3
w13,1024,8,2,1024,512,128,128,64,64,8,3,128.0,11.703333333333331,3
w13,1024,16,2,1536,768,64,128,64,32,4,3,88.0,34.189,3
w13,1024,16,2,1536,768,64,128,64,32,8,3,88.0,34.199666666666666,3
w13,1024,16,2,1536,768,64,128,64,4,4,3,88.0,34.221333333333334,3
w13,1024,16,4,1536,1024,128,256,64,16,8,4,256.0,53.964666666666666,3
w13,1024,16,4,1536,1024,128,256,64,32,8,4,256.0,54.583666666666666,3
w13,1024,16,4,1536,1024,128,256,64,64,8,4,256.0,55.25566666666666,3
w13,1024,32,4,2048,768,128,64,64,1,8,3,88.0,81.11200000000001,3
w13,1024,32,4,2048,768,128,64,64,1,4,3,88.0,82.64800000000001,3
w13,1024,32,4,2048,768,128,64,64,16,8,3,88.0,82.66933333333334,3
w13,1024,32,6,3072,1024,128,256,64,16,8,4,256.0,177.80566666666667,3
w13,1024,32,6,3072,1024,128,256,64,32,8,4,256.0,180.771,3
w13,1024,32,6,3072,1024,128,256,64,1,8,4,256.0,182.9896666666667,3
w13,1024,60,4,2048,1408,128,128,64,1,8,3,128.0,246.05166666666665,3
w13,1024,60,4,2048,1408,128,128,64,4,8,3,128.0,246.09433333333337,3
w13,1024,60,4,2048,1408,128,128,64,8,8,3,128.0,246.28633333333337,3
w13,1024,60,6,3584,2304,128,256,64,1,8,4,256.0,694.9833333333332,3
w13,1024,60,6,3584,2304,128,128,64,1,8,5,192.0,697.2019999999999,3
w13,1024,60,6,3584,2304,128,128,64,4,8,5,192.0,699.058,3
w13,1024,60,8,2048,1536,128,256,64,16,8,4,256.0,329.84933333333333,3
w13,1024,60,8,2048,1536,128,256,64,32,8,4,256.0,331.2253333333333,3
w13,1024,60,8,2048,1536,128,256,64,64,8,4,256.0,333.08200000000005,3
w13,1024,64,6,3072,2048,128,128,64,4,8,3,128.0,564.5186666666667,3
w13,1024,64,6,3072,2048,128,128,64,1,8,3,128.0,565.585,3
w13,1024,64,6,3072,2048,128,128,64,8,8,3,128.0,566.7473333333334,3
w13,1024,64,6,3584,1536,128,128,64,1,8,3,128.0,490.3093333333333,3
w13,1024,64,6,3584,1536,128,128,64,4,8,3,128.0,490.5973333333333,3
w13,1024,64,6,3584,1536,128,128,64,8,8,3,128.0,493.6376666666667,3
w13,1024,64,8,3584,2560,128,128,64,1,8,3,128.0,828.0616666666666,3
w13,1024,64,8,3584,2560,128,128,64,4,8,3,128.0,830.9416666666666,3
w13,1024,64,8,3584,2560,128,128,64,8,8,3,128.0,831.8913333333334,3
w13,1024,128,4,2048,512,64,64,64,4,4,3,56.0,182.13633333333337,3
w13,1024,128,4,2048,512,32,128,128,8,4,2,88.0,182.53133333333335,3
w13,1024,128,4,2048,512,32,64,128,4,8,2,52.0,182.55266666666668,3
w13,1024,128,6,4096,2048,64,128,128,1,4,2,112.0,1410.5836666666669,3
w13,1024,128,6,4096,2048,64,128,128,1,8,2,112.0,1411.3836666666666,3
w13,1024,128,6,4096,2048,64,128,128,4,8,2,112.0,1414.0076666666666,3
w13,1024,128,8,2048,768,64,128,128,1,8,2,112.0,277.8066666666667,3
w13,1024,128,8,2048,768,64,128,128,32,8,2,112.0,278.27566666666667,3
w13,1024,128,8,2048,768,64,128,64,4,4,3,88.0,278.4463333333333,3
w13,1024,128,8,4096,1536,64,128,128,1,4,2,112.0,1061.3963333333334,3
w13,1024,128,8,4096,1536,64,128,128,1,8,2,112.0,1062.7086666666669,3
w13,1024,128,8,4096,1536,64,128,128,4,4,2,112.0,1064.169666666667,3
w13,1024,128,8,4096,3072,64,128,128,16,8,3,160.0,2133.181666666667,3
w13,1024,128,8,4096,3072,64,128,128,16,4,2,112.0,2133.565666666667,3
w13,1024,128,8,4096,3072,64,128,128,1,4,2,112.0,2133.6936666666666,3
w13,1536,8,2,1024,512,64,128,64,16,4,3,88.0,16.258,3
w13,1536,8,2,1024,512,64,128,64,32,4,3,88.0,16.29,3
w13,1536,8,2,1024,512,64,128,64,64,4,3,88.0,16.311333333333334,3
w13,1536,16,2,1536,768,64,128,64,4,8,3,88.0,45.44233333333333,3
w13,1536,16,2,1536,768,64,128,64,32,8,3,88.0,46.178,3
w13,1536,16,2,1536,768,128,128,64,1,8,5,192.0,46.53,3
w13,1536,16,4,1536,1024,128,256,64,64,8,4,256.0,73.50699999999999,3
w13,1536,16,4,1536,1024,128,256,64,1,8,4,256.0,73.99733333333334,3
w13,1536,16,4,1536,1024,128,256,64,32,8,4,256.0,74.02933333333334,3
w13,1536,32,4,2048,768,128,256,64,1,8,4,256.0,97.45333333333332,3
w13,1536,32,4,2048,768,128,256,64,16,8,4,256.0,97.763,3
w13,1536,32,4,2048,768,128,256,64,32,8,4,256.0,98.32766666666669,3
w13,1536,32,6,3072,1024,128,256,64,1,8,4,256.0,243.85433333333333,3
w13,1536,32,6,3072,1024,128,256,64,64,8,4,256.0,245.11299999999997,3
w13,1536,32,6,3072,1024,128,256,64,32,8,4,256.0,245.294,3
w13,1536,60,4,2048,1408,128,128,64,1,8,3,128.0,254.18999999999997,3
w13,1536,60,4,2048,1408,128,128,64,4,8,3,128.0,254.40366666666668,3
w13,1536,60,4,2048,1408,128,128,64,8,8,3,128.0,254.71333333333337,3
w13,1536,60,6,3584,2304,128,256,64,16,8,4,256.0,831.123,3
w13,1536,60,6,3584,2304,128,256,64,32,8,4,256.0,838.931,3
w13,1536,60,6,3584,2304,128,256,64,64,8,4,256.0,855.081,3
w13,1536,60,8,2048,1536,128,256,64,16,8,4,256.0,345.6583333333333,3
w13,1536,60,8,2048,1536,128,256,64,32,8,4,256.0,347.0233333333333,3
w13,1536,60,8,2048,1536,128,256,64,64,8,4,256.0,349.7006666666666,3
w13,1536,64,6,3072,2048,128,256,64,16,8,4,256.0,681.2123333333334,3
w13,1536,64,6,3072,2048,128,256,64,32,8,4,256.0,684.8816666666667,3
w13,1536,64,6,3072,2048,128,256,64,64,8,4,256.0,700.5403333333334,3
w13,1536,64,6,3584,1536,128,256,64,16,8,4,256.0,591.174,3
w13,1536,64,6,3584,1536,128,256,64,32,8,4,256.0,594.1073333333334,3
w13,1536,64,6,3584,1536,128,256,64,1,8,4,256.0,601.6386666666666,3
w13,1536,64,8,3584,2560,128,256,64,16,8,4,256.0,1000.4046666666668,3
w13,1536,64,8,3584,2560,128,256,64,32,8,4,256.0,1005.9726666666668,3
w13,1536,64,8,3584,2560,128,256,64,64,8,4,256.0,1029.599333333333,3
w13,1536,128,4,2048,512,64,64,64,16,4,3,56.0,185.89133333333336,3
w13,1536,128,4,2048,512,64,64,64,4,4,3,56.0,185.902,3
w13,1536,128,4,2048,512,64,128,128,1,8,2,112.0,185.93433333333337,3
w13,1536,128,6,4096,2048,128,128,64,1,8,5,192.0,1457.677,3
w13,1536,128,6,4096,2048,128,128,64,4,8,5,192.0,1465.005,3
w13,1536,128,6,4096,2048,128,128,64,1,4,5,192.0,1470.5516666666665,3
w13,1536,128,8,2048,768,128,128,64,4,8,3,128.0,292.30266666666665,3
w13,1536,128,8,2048,768,128,128,64,1,8,3,128.0,292.43066666666664,3
w13,1536,128,8,2048,768,128,128,64,8,8,3,128.0,293.16633333333334,3
w13,1536,128,8,4096,1536,128,128,64,1,8,3,128.0,1110.9856666666667,3
w13,1536,128,8,4096,1536,128,128,64,1,8,5,192.0,1111.9563333333333,3
w13,1536,128,8,4096,1536,128,128,64,8,8,5,192.0,1113.983,3
w13,1536,128,8,4096,3072,128,128,64,8,8,5,192.0,2205.800333333333,3
w13,1536,128,8,4096,3072,128,128,64,8,4,5,192.0,2207.656333333334,3
w13,1536,128,8,4096,3072,128,128,64,1,8,5,192.0,2208.9256666666665,3
w13,2048,8,2,1024,512,128,256,64,1,8,3,208.0,17.591333333333335,3
w13,2048,8,2,1024,512,128,256,64,16,8,3,208.0,17.634333333333334,3
w13,2048,8,2,1024,512,128,256,64,64,8,3,208.0,17.655666666666665,3
w13,2048,16,2,1536,768,128,128,64,8,8,5,192.0,47.811,3
w13,2048,16,2,1536,768,128,128,64,4,8,5,192.0,48.38633333333333,3
w13,2048,16,2,1536,768,128,256,64,1,8,4,256.0,48.46099999999999,3
w13,2048,16,4,1536,1024,128,256,64,32,8,4,256.0,94.317,3
w13,2048,16,4,1536,1024,128,256,64,16,8,4,256.0,94.43466666666666,3
w13,2048,16,4,1536,1024,128,256,64,64,8,4,256.0,95.01033333333334,3
w13,2048,32,4,2048,768,128,256,64,16,8,4,256.0,100.13066666666668,3
w13,2048,32,4,2048,768,128,256,64,1,8,4,256.0,101.19733333333332,3
w13,2048,32,4,2048,768,128,256,64,32,8,4,256.0,103.02133333333336,3
w13,2048,32,6,3072,1024,128,256,64,16,8,4,256.0,252.857,3
w13,2048,32,6,3072,1024,128,256,64,32,8,4,256.0,253.85933333333332,3
w13,2048,32,6,3072,1024,128,256,64,1,8,4,256.0,254.39266666666663,3
w13,2048,60,4,2048,1408,128,256,64,1,8,4,256.0,300.2606666666667,3
w13,2048,60,4,2048,1408,128,256,64,16,8,4,256.0,306.98,3
w13,2048,60,4,2048,1408,128,256,64,32,8,4,256.0,309.96666666666664,3
w13,2048,60,6,3584,2304,128,256,64,16,8,4,256.0,856.9369999999999,3
w13,2048,60,6,3584,2304,128,256,64,32,8,4,256.0,869.5343333333334,3
w13,2048,60,6,3584,2304,128,256,64,1,8,4,256.0,889.0756666666666,3
w13,2048,60,8,2048,1536,128,256,64,32,8,4,256.0,470.29833333333335,3
w13,2048,60,8,2048,1536,128,256,64,64,8,4,256.0,472.997,3
w13,2048,60,8,2048,1536,128,256,64,1,8,4,256.0,473.093,3
w13,2048,64,6,3072,2048,128,256,64,16,8,4,256.0,702.0123333333335,3
w13,2048,64,6,3072,2048,128,256,64,32,8,4,256.0,708.0709999999999,3
w13,2048,64,6,3072,2048,128,256,64,1,8,4,256.0,725.245,3
w13,2048,64,6,3584,1536,128,256,64,16,8,4,256.0,606.641,3
w13,2048,64,6,3584,1536,128,256,64,32,8,4,256.0,615.0253333333334,3
w13,2048,64,6,3584,1536,128,256,64,1,8,4,256.0,619.75,3
w13,2048,64,8,3584,2560,128,256,64,16,8,4,256.0,1025.1086666666667,3
w13,2048,64,8,3584,2560,128,256,64,32,8,4,256.0,1037.1086666666667,3
w13,2048,64,8,3584,2560,128,256,64,64,8,4,256.0,1057.4826666666663,3
w13,2048,128,4,2048,512,64,128,128,4,8,2,112.0,188.37633333333335,3
w13,2048,128,4,2048,512,64,64,64,4,4,3,56.0,188.69666666666663,3
w13,2048,128,4,2048,512,64,128,128,1,8,2,112.0,188.8456666666667,3
w13,2048,128,6,4096,2048,128,128,64,1,8,5,192.0,1471.789,3
w13,2048,128,6,4096,2048,128,128,64,4,8,5,192.0,1480.718,3
w13,2048,128,6,4096,2048,128,128,64,1,4,5,192.0,1485.997,3
w13,2048,128,8,2048,768,128,128,64,4,8,3,128.0,299.32099999999997,3
w13,2048,128,8,2048,768,128,128,64,1,8,3,128.0,299.4173333333333,3
w13,2048,128,8,2048,768,128,128,64,8,8,3,128.0,300.569,3
w13,2048,128,8,4096,1536,128,256,64,1,8,3,208.0,1129.236666666667,3
w13,2048,128,8,4096,1536,128,128,64,1,8,5,192.0,1131.2520000000002,3
w13,2048,128,8,4096,1536,128,128,64,8,8,5,192.0,1131.7430000000002,3
w13,2048,128,8,4096,3072,128,128,64,1,8,5,192.0,2230.462,3
w13,2048,128,8,4096,3072,128,128,64,8,8,5,192.0,2231.5066666666667,3
w13,2048,128,8,4096,3072,128,128,64,4,8,5,192.0,2237.117333333333,3
w13,3072,8,2,1024,512,128,128,64,16,8,3,128.0,29.55966666666667,3
w13,3072,8,2,1024,512,128,128,64,64,8,3,128.0,29.570000000000004,3
w13,3072,8,2,1024,512,128,128,64,32,8,3,128.0,29.837,3
w13,3072,16,2,1536,768,128,128,64,16,8,3,128.0,69.93366666666667,3
w13,3072,16,2,1536,768,128,128,64,32,8,3,128.0,70.70066666666666,3
w13,3072,16,2,1536,768,128,256,64,1,8,4,256.0,71.042,3
w13,3072,16,4,1536,1024,128,256,64,32,8,4,256.0,137.20833333333334,3
w13,3072,16,4,1536,1024,128,256,64,64,8,4,256.0,137.688,3
w13,3072,16,4,1536,1024,128,256,64,16,8,4,256.0,137.9226666666667,3
w13,3072,32,4,2048,768,128,256,64,16,8,4,256.0,149.667,3
w13,3072,32,4,2048,768,128,256,64,32,8,4,256.0,149.859,3
w13,3072,32,4,2048,768,128,256,64,1,8,4,256.0,150.50933333333333,3
w13,3072,32,6,3072,1024,128,256,64,64,8,4,256.0,398.9703333333334,3
w13,3072,32,6,3072,1024,128,256,64,1,8,4,256.0,399.2266666666667,3
w13,3072,32,6,3072,1024,128,256,64,32,8,4,256.0,399.845,3
w13,3072,60,4,2048,1408,128,256,64,1,8,4,256.0,313.81766666666664,3
w13,3072,60,4,2048,1408,128,256,64,16,8,4,256.0,320.8256666666667,3
w13,3072,60,4,2048,1408,128,256,64,32,8,4,256.0,322.69233333333335,3
w13,3072,60,6,3584,2304,128,256,64,32,8,4,256.0,1182.23,3
w13,3072,60,6,3584,2304,128,256,64,16,8,4,256.0,1186.2516666666668,3
w13,3072,60,6,3584,2304,128,256,64,64,8,4,256.0,1186.5183333333332,3
w13,3072,60,8,2048,1536,128,256,64,16,8,4,256.0,605.574,3
w13,3072,60,8,2048,1536,128,256,64,64,8,4,256.0,607.8673333333332,3
w13,3072,60,8,2048,1536,128,256,64,32,8,4,256.0,607.91,3
w13,3072,64,6,3072,2048,128,256,64,32,8,4,256.0,967.583,3
w13,3072,64,6,3072,2048,128,256,64,16,8,4,256.0,971.6576666666666,3
w13,3072,64,6,3072,2048,128,256,64,64,8,4,256.0,973.3956666666668,3
w13,3072,64,6,3584,1536,128,256,64,32,8,4,256.0,838.035,3
w13,3072,64,6,3584,1536,128,256,64,64,8,4,256.0,841.245,3
w13,3072,64,6,3584,1536,128,256,64,16,8,4,256.0,841.5866666666667,3
w13,3072,64,8,3584,2560,128,256,64,32,8,4,256.0,1446.0183333333334,3
w13,3072,64,8,3584,2560,128,256,64,64,8,4,256.0,1449.933,3
w13,3072,64,8,3584,2560,128,256,64,16,8,4,256.0,1456.91,3
w13,3072,128,4,2048,512,128,128,64,4,8,3,128.0,199.27766666666665,3
w13,3072,128,4,2048,512,128,128,64,1,8,3,128.0,199.71533333333332,3
w13,3072,128,4,2048,512,128,128,64,16,8,3,128.0,200.9523333333333,3
w13,3072,128,6,4096,2048,128,256,64,16,8,4,256.0,1740.9963333333333,3
w13,3072,128,6,4096,2048,128,256,64,32,8,4,256.0,1752.7083333333333,3
w13,3072,128,6,4096,2048,128,256,64,64,8,4,256.0,1802.1913333333337,3
w13,3072,128,8,2048,768,128,256,64,1,8,4,256.0,362.98,3
w13,3072,128,8,2048,768,128,256,64,16,8,4,256.0,365.412,3
w13,3072,128,8,2048,768,128,256,64,32,8,4,256.0,368.2923333333333,3
w13,3072,128,8,4096,1536,128,256,64,16,8,4,256.0,1343.083,3
w13,3072,128,8,4096,1536,128,256,64,32,8,4,256.0,1351.2536666666667,3
w13,3072,128,8,4096,1536,128,256,64,1,8,4,256.0,1377.696333333333,3
w13,3072,128,8,4096,3072,128,256,64,16,8,4,256.0,2632.842666666667,3
w13,3072,128,8,4096,3072,128,256,64,32,8,4,256.0,2659.0933333333332,3
w13,3072,128,8,4096,3072,128,256,64,64,8,4,256.0,2736.3953333333334,3
w13,4096,8,2,1024,512,128,256,64,64,8,3,208.0,34.44466666666667,3
w13,4096,8,2,1024,512,128,256,64,16,8,4,256.0,34.48733333333333,3
w13,4096,8,2,1024,512,128,256,64,1,8,4,256.0,34.53066666666667,3
w13,4096,16,2,1536,768,128,256,64,16,8,4,256.0,70.072,3
w13,4096,16,2,1536,768,128,256,64,1,8,4,256.0,71.746,3
w13,4096,16,2,1536,768,128,256,64,32,8,4,256.0,72.79166666666667,3
w13,4096,16,4,1536,1024,128,256,64,16,8,3,208.0,178.211,3
w13,4096,16,4,1536,1024,128,256,64,1,8,3,208.0,178.67,3
w13,4096,16,4,1536,1024,128,256,64,16,8,4,256.0,178.947,3
w13,4096,32,4,2048,768,128,256,64,16,8,4,256.0,174.50966666666667,3
w13,4096,32,4,2048,768,128,256,64,32,8,4,256.0,175.438,3
w13,4096,32,4,2048,768,128,256,64,1,8,4,256.0,176.35500000000002,3
w13,4096,32,6,3072,1024,128,256,64,64,8,4,256.0,481.71233333333333,3
w13,4096,32,6,3072,1024,128,256,64,32,8,4,256.0,482.4693333333333,3
w13,4096,32,6,3072,1024,128,256,64,16,8,4,256.0,482.63966666666664,3
w13,4096,60,4,2048,1408,128,256,64,1,8,4,256.0,416.2716666666667,3
w13,4096,60,4,2048,1408,128,256,64,32,8,4,256.0,430.864,3
w13,4096,60,4,2048,1408,128,256,64,16,8,4,256.0,432.25033333333334,3
w13,4096,60,6,3584,2304,128,256,64,16,8,4,256.0,1516.4723333333334,3
w13,4096,60,6,3584,2304,128,256,64,32,8,4,256.0,1520.7396666666666,3
w13,4096,60,6,3584,2304,128,256,64,64,8,4,256.0,1525.838,3
w13,4096,60,8,2048,1536,128,256,64,64,8,4,256.0,764.9456666666666,3
w13,4096,60,8,2048,1536,128,256,64,32,8,4,256.0,766.375,3
w13,4096,60,8,2048,1536,128,256,64,16,8,4,256.0,768.7003333333333,3
w13,4096,64,6,3072,2048,128,256,64,32,8,4,256.0,1005.9723333333332,3
w13,4096,64,6,3072,2048,128,256,64,16,8,4,256.0,1009.2576666666668,3
w13,4096,64,6,3072,2048,128,256,64,64,8,4,256.0,1016.3933333333334,3
w13,4096,64,6,3584,1536,128,256,64,32,8,4,256.0,872.1043333333333,3
w13,4096,64,6,3584,1536,128,256,64,16,8,4,256.0,875.0803333333333,3
w13,4096,64,6,3584,1536,128,256,64,64,8,4,256.0,876.584,3
w13,4096,64,8,3584,2560,128,256,64,32,8,4,256.0,1835.493333333333,3
w13,4096,64,8,3584,2560,128,256,64,16,8,4,256.0,1839.462,3
w13,4096,64,8,3584,2560,128,256,64,64,8,4,256.0,1843.493333333333,3
w13,4096,128,4,2048,512,128,128,64,4,8,3,128.0,205.91233333333332,3
w13,4096,128,4,2048,512,128,128,64,8,8,3,128.0,206.052,3
w13,4096,128,4,2048,512,128,128,64,1,8,3,128.0,206.542,3
w13,4096,128,6,4096,2048,128,256,64,16,8,4,256.0,1787.2793333333332,3
w13,4096,128,6,4096,2048,128,256,64,32,8,4,256.0,1811.6636666666664,3
w13,4096,128,6,4096,2048,128,256,64,64,8,4,256.0,1874.246,3
w13,4096,128,8,2048,768,128,256,64,16,8,4,256.0,377.6686666666667,3
w13,4096,128,8,2048,768,128,256,64,1,8,4,256.0,379.7163333333333,3
w13,4096,128,8,2048,768,128,256,64,32,8,4,256.0,380.86799999999994,3
w13,4096,128,8,4096,1536,128,256,64,16,8,4,256.0,1382.1866666666665,3
w13,4096,128,8,4096,1536,128,256,64,32,8,4,256.0,1383.8083333333334,3
w13,4096,128,8,4096,1536,128,256,64,64,8,4,256.0,1421.099,3
w13,4096,128,8,4096,3072,128,256,64,16,8,4,256.0,2711.0406666666668,3
w13,4096,128,8,4096,3072,128,256,64,32,8,4,256.0,2744.886333333334,3
w13,4096,128,8,4096,3072,128,256,64,64,8,4,256.0,2803.7556666666665,3
