pipetuning_test/moe_dse/moe_dse_PRO6000S_top3.csv
weight_type,M,E,topk,H,N,BLOCK_SIZE_M,BLOCK_SIZE_N,BLOCK_SIZE_K,GROUP_SIZE_M,num_warps,num_stages,smem_size_KB,avg_duration,sample_count
w13,1,8,2,1024,512,16,16,64,1,4,4,16.5,3.714,3
w13,1,8,2,1024,512,32,16,128,4,4,3,37.0,3.7566666666666664,3
w13,1,8,2,1024,512,16,32,128,4,4,3,37.0,3.778,3
w13,1,16,2,1536,768,16,32,128,4,4,4,49.0,4.738,3
w13,1,16,2,1536,768,16,32,128,16,4,4,49.0,4.738,3
w13,1,16,2,1536,768,16,32,128,1,4,3,37.0,4.748,3
w13,1,16,4,1536,1024,16,64,64,1,4,4,42.0,6.903333333333333,3
w13,1,16,4,1536,1024,16,64,64,1,8,4,42.0,6.935,3
w13,1,16,4,1536,1024,16,64,128,1,8,4,82.0,6.956333333333333,3
w13,1,32,4,2048,768,16,64,64,1,4,4,42.0,7.031333333333333,3
w13,1,32,4,2048,768,16,64,128,1,8,4,82.0,7.308333333333334,3
w13,1,32,4,2048,768,16,64,128,1,8,3,62.0,7.479333333333334,3
w13,1,32,6,3072,1024,16,128,64,1,8,4,76.0,14.999333333333333,3
w13,1,32,6,3072,1024,16,128,64,16,8,4,76.0,15.586,3
w13,1,32,6,3072,1024,16,128,64,64,8,4,76.0,15.618,3
w13,1,60,4,2048,1408,16,64,128,1,8,4,82.0,10.348666666666666,3
w13,1,60,4,2048,1408,16,64,128,64,8,4,82.0,10.434,3
w13,1,60,4,2048,1408,16,64,128,16,8,4,82.0,10.444666666666665,3
w13,1,60,6,3584,2304,16,64,128,16,4,2,42.0,118.125,3
w13,1,60,6,3584,2304,16,64,128,32,8,2,42.0,118.13566666666668,3
w13,1,60,6,3584,2304,16,64,128,1,8,2,42.0,118.24233333333332,3
w13,1,60,8,2048,1536,16,256,32,8,4,4,76.0,17.569666666666667,3
w13,1,60,8,2048,1536,16,128,32,1,4,4,40.0,18.359333333333336,3
w13,1,60,8,2048,1536,16,64,32,1,4,4,22.0,18.466,3
w13,1,64,6,3072,2048,16,64,128,32,4,2,42.0,60.61033333333333,3
w13,1,64,6,3072,2048,16,32,128,64,4,2,25.0,60.674,3
w13,1,64,6,3072,2048,16,32,128,4,4,2,25.0,60.812666666666665,3
w13,1,64,6,3584,1536,16,128,128,1,8,3,112.0,24.802000000000003,3
w13,1,64,6,3584,1536,16,64,128,64,8,3,62.0,25.01533333333333,3
w13,1,64,6,3584,1536,16,64,128,64,4,3,62.0,25.079333333333334,3
w13,1,64,8,3584,2560,16,32,64,1,4,2,13.0,185.79433333333336,3
w13,1,64,8,3584,2560,16,32,256,16,4,2,49.0,185.965,3
w13,1,64,8,3584,2560,32,32,64,1,4,2,18.0,186.88233333333332,3
w13,1,128,4,2048,512,16,32,128,64,4,4,49.0,5.623333333333334,3
w13,1,128,4,2048,512,16,32,128,1,4,4,49.0,5.633666666666667,3
w13,1,128,4,2048,512,16,32,128,32,4,4,49.0,5.634,3
w13,1,128,6,4096,2048,16,64,128,16,4,2,42.0,115.99166666666666,3
w13,1,128,6,4096,2048,16,64,128,32,4,2,42.0,116.37566666666667,3
w13,1,128,6,4096,2048,16,64,128,16,8,2,42.0,116.781,3
w13,1,128,8,2048,768,16,128,64,1,8,4,76.0,10.189,3
w13,1,128,8,2048,768,16,128,64,32,8,4,76.0,10.700666666666663,3
w13,1,128,8,2048,768,16,128,64,16,8,4,76.0,10.711666666666666,3
w13,1,128,8,4096,1536,16,64,128,16,4,2,42.0,116.63133333333332,3
w13,1,128,8,4096,1536,32,64,128,16,4,2,52.0,117.07966666666668,3
w13,1,128,8,4096,1536,16,64,128,1,8,2,42.0,117.41,3
w13,1,128,8,4096,3072,32,32,256,1,4,2,66.0,260.2476666666667,3
w13,1,128,8,4096,3072,16,32,64,1,4,2,13.0,261.6023333333333,3
w13,1,128,8,4096,3072,32,32,64,1,4,2,18.0,262.018,3
w13,2,8,2,1024,512,16,32,128,4,4,4,49.0,3.8633333333333337,3
w13,2,8,2,1024,512,16,32,128,16,4,4,49.0,3.8843333333333336,3
w13,2,8,2,1024,512,16,32,128,32,4,4,49.0,3.8953333333333338,3
w13,2,16,2,1536,768,16,64,64,1,4,4,42.0,5.729666666666667,3
w13,2,16,2,1536,768,16,64,128,1,8,4,82.0,5.922,3
w13,2,16,2,1536,768,16,64,128,1,8,3,62.0,5.9753333333333325,3
w13,2,16,4,1536,1024,16,64,64,1,4,4,42.0,10.796333333333331,3
w13,2,16,4,1536,1024,16,128,64,1,8,4,76.0,10.839666666666666,3
w13,2,16,4,1536,1024,16,64,64,32,4,4,42.0,10.924666666666669,3
w13,2,32,4,2048,768,16,128,64,1,8,4,76.0,10.53,3
w13,2,32,4,2048,768,16,128,32,1,4,4,40.0,10.903666666666666,3
w13,2,32,4,2048,768,16,128,64,64,8,4,76.0,10.999333333333333,3
w13,2,32,6,3072,1024,16,32,128,32,4,2,25.0,60.84466666666666,3
w13,2,32,6,3072,1024,16,32,128,64,4,2,25.0,60.941,3
w13,2,32,6,3072,1024,16,32,128,16,4,2,25.0,61.69833333333333,3
w13,2,60,4,2048,1408,16,128,64,32,8,4,76.0,17.292666666666666,3
w13,2,60,4,2048,1408,16,128,64,16,8,4,76.0,17.335333333333335,3
w13,2,60,4,2048,1408,16,128,64,64,8,4,76.0,17.356666666666666,3
w13,2,60,6,3584,2304,16,32,256,16,4,2,49.0,255.56533333333337,3
w13,2,60,6,3584,2304,16,32,256,1,4,2,49.0,256.0563333333333,3
w13,2,60,6,3584,2304,16,64,256,1,4,2,82.0,256.99466666666666,3
w13,2,60,8,2048,1536,32,32,64,1,4,2,18.0,118.188,3
w13,2,60,8,2048,1536,16,32,64,1,4,2,13.0,118.89266666666668,3
w13,2,60,8,2048,1536,16,128,64,16,4,2,40.0,119.746,3
w13,2,64,6,3072,2048,32,32,256,1,4,2,66.0,193.31433333333337,3
w13,2,64,6,3072,2048,32,32,256,16,4,2,66.0,194.08233333333337,3
w13,2,64,6,3072,2048,16,32,64,1,4,2,13.0,195.44733333333332,3
w13,2,64,6,3584,1536,16,32,64,1,4,2,13.0,163.309,3
w13,2,64,6,3584,1536,32,32,64,1,4,2,18.0,163.67133333333334,3
w13,2,64,6,3584,1536,16,32,256,16,4,2,49.0,165.05833333333334,3
w13,2,64,8,3584,2560,16,32,256,16,4,2,49.0,381.5176666666666,3
w13,2,64,8,3584,2560,32,32,256,1,4,2,66.0,382.16833333333335,3
w13,2,64,8,3584,2560,32,32,128,1,4,2,34.0,382.47766666666666,3
w13,2,128,4,2048,512,16,64,128,32,8,4,82.0,7.863333333333333,3
w13,2,128,4,2048,512,16,64,128,64,8,4,82.0,7.874,3
w13,2,128,4,2048,512,16,64,64,1,4,4,42.0,7.884666666666667,3
w13,2,128,6,4096,2048,32,32,256,1,4,2,66.0,259.0423333333334,3
w13,2,128,6,4096,2048,32,32,64,1,4,2,18.0,261.49600000000004,3
w13,2,128,6,4096,2048,16,32,64,1,4,2,13.0,261.8156666666667,3
w13,2,128,8,2048,768,16,256,32,8,4,4,76.0,17.420666666666666,3
w13,2,128,8,2048,768,16,64,64,32,4,4,42.0,17.997,3
w13,2,128,8,2048,768,16,64,64,1,4,4,42.0,18.018,3
w13,2,128,8,4096,1536,32,32,256,1,4,2,66.0,259.6716666666667,3
w13,2,128,8,4096,1536,16,32,64,1,4,2,13.0,260.91966666666667,3
w13,2,128,8,4096,1536,32,32,64,1,4,2,18.0,261.05833333333334,3
w13,2,128,8,4096,3072,16,32,128,1,4,2,25.0,524.5573333333333,3
w13,2,128,8,4096,3072,32,32,256,1,4,2,66.0,525.7406666666667,3
w13,2,128,8,4096,3072,16,32,64,1,4,3,19.0,525.8473333333333,3
w13,4,8,2,1024,512,16,64,64,1,4,4,42.0,5.037,3
w13,4,8,2,1024,512,16,64,64,64,4,4,42.0,5.100666666666666,3
w13,4,8,2,1024,512,16,64,64,32,4,4,42.0,5.132666666666666,3
w13,4,16,2,1536,768,16,128,64,1,8,4,76.0,8.334999999999999,3
w13,4,16,2,1536,768,16,128,64,64,8,4,76.0,8.634,3
w13,4,16,2,1536,768,16,128,64,32,8,4,76.0,8.644333333333334,3
w13,4,16,4,1536,1024,16,64,64,32,4,3,32.0,18.242,3
w13,4,16,4,1536,1024,16,64,64,16,4,3,32.0,18.284666666666663,3
w13,4,16,4,1536,1024,16,64,64,32,4,4,42.0,18.327333333333332,3
w13,4,32,4,2048,768,16,256,32,8,4,4,76.0,18.37,3
w13,4,32,4,2048,768,16,64,64,64,4,4,42.0,18.989,3
w13,4,32,4,2048,768,16,128,32,1,4,4,40.0,19.01,3
w13,4,32,6,3072,1024,32,32,256,1,4,2,66.0,194.23166666666663,3
w13,4,32,6,3072,1024,32,32,128,64,4,2,34.0,195.09533333333331,3
w13,4,32,6,3072,1024,32,32,256,32,4,2,66.0,195.42633333333333,3
w13,4,60,4,2048,1408,16,32,64,1,4,2,13.0,103.60766666666666,3
w13,4,60,4,2048,1408,32,32,64,1,4,2,18.0,104.38633333333333,3
w13,4,60,4,2048,1408,16,128,64,1,8,2,40.0,104.589,3
w13,4,60,6,3584,2304,16,32,256,1,4,2,49.0,515.8753333333333,3
w13,4,60,6,3584,2304,16,64,256,1,4,2,82.0,516.7710000000001,3
w13,4,60,6,3584,2304,32,64,256,1,4,2,100.0,517.3149999999999,3
w13,4,60,8,2048,1536,32,32,128,1,4,2,34.0,259.75666666666666,3
w13,4,60,8,2048,1536,64,64,128,1,4,2,72.0,260.3533333333333,3
w13,4,60,8,2048,1536,32,32,256,1,4,2,66.0,260.47133333333335,3
w13,4,64,6,3072,2048,32,32,256,1,4,2,66.0,395.235,3
w13,4,64,6,3072,2048,16,16,256,4,4,4,64.5,396.013,3
w13,4,64,6,3072,2048,16,32,256,1,8,4,97.0,396.056,3
w13,4,64,6,3584,1536,16,32,128,1,4,2,25.0,344.801,3
w13,4,64,6,3584,1536,32,64,128,1,4,2,52.0,346.551,3
w13,4,64,6,3584,1536,16,16,256,4,4,2,32.5,346.7863333333333,3
w13,4,64,8,3584,2560,32,32,128,1,4,2,34.0,765.5186666666667,3
w13,4,64,8,3584,2560,32,16,128,4,4,2,25.0,765.668,3
w13,4,64,8,3584,2560,16,32,128,4,4,4,49.0,766.0733333333334,3
w13,4,128,4,2048,512,16,32,128,32,4,3,37.0,12.525,3
w13,4,128,4,2048,512,16,64,64,1,4,4,42.0,12.546,3
w13,4,128,4,2048,512,16,32,128,16,4,3,37.0,12.567333333333332,3
w13,4,128,6,4096,2048,16,32,128,1,4,2,25.0,524.2696666666667,3
w13,4,128,6,4096,2048,32,32,256,1,4,2,66.0,524.8456666666667,3
w13,4,128,6,4096,2048,16,32,128,4,4,2,25.0,525.4423333333333,3
w13,4,128,8,2048,768,16,32,64,1,4,2,13.0,118.51933333333334,3
w13,4,128,8,2048,768,32,32,64,1,4,2,18.0,118.97833333333334,3
w13,4,128,8,2048,768,32,32,128,1,4,2,34.0,120.89833333333333,3
w13,4,128,8,4096,1536,16,32,128,1,4,2,25.0,524.7066666666666,3
w13,4,128,8,4096,1536,32,32,256,1,4,2,66.0,524.9946666666666,3
w13,4,128,8,4096,1536,16,32,64,1,4,3,19.0,525.4636666666667,3
w13,4,128,8,4096,3072,32,32,128,1,4,2,34.0,1048.0353333333333,3
w13,4,128,8,4096,3072,16,32,128,1,8,2,25.0,1048.3976666666667,3
w13,4,128,8,4096,3072,32,32,64,1,4,3,26.0,1048.4833333333331,3
w13,8,8,2,1024,512,16,64,64,16,4,4,42.0,5.1113333333333335,3
w13,8,8,2,1024,512,16,64,64,32,4,4,42.0,5.132666666666666,3
w13,8,8,2,1024,512,16,64,64,64,4,4,42.0,5.1433333333333335,3
w13,8,16,2,1536,768,16,256,32,8,4,4,76.0,14.758666666666668,3
w13,8,16,2,1536,768,16,32,64,32,4,3,19.0,14.811666666666667,3
w13,8,16,2,1536,768,16,32,64,64,4,3,19.0,14.811666666666667,3
w13,8,16,4,1536,1024,16,64,64,32,4,4,42.0,18.519333333333336,3
w13,8,16,4,1536,1024,16,64,64,64,4,4,42.0,18.53,3
w13,8,16,4,1536,1024,16,64,64,16,4,4,42.0,18.540666666666667,3
w13,8,32,4,2048,768,16,32,64,1,4,2,13.0,117.95466666666668,3
w13,8,32,4,2048,768,32,32,64,1,4,2,18.0,118.114,3
w13,8,32,4,2048,768,16,128,64,1,8,2,40.0,118.92466666666668,3
w13,8,32,6,3072,1024,32,32,256,1,4,2,66.0,260.845,3
w13,8,32,6,3072,1024,16,32,256,1,4,2,49.0,261.41,3
w13,8,32,6,3072,1024,16,64,256,1,4,2,82.0,261.965,3
w13,8,60,4,2048,1408,16,32,128,1,4,2,25.0,237.442,3
w13,8,60,4,2048,1408,32,64,128,1,4,2,52.0,238.13566666666668,3
w13,8,60,4,2048,1408,16,32,256,1,4,2,49.0,238.28533333333337,3
w13,8,60,6,3584,2304,16,16,256,1,4,2,32.5,1032.9746666666667,3
w13,8,60,6,3584,2304,16,64,128,1,8,2,42.0,1033.2413333333334,3
w13,8,60,6,3584,2304,16,32,128,1,4,2,25.0,1033.4123333333334,3
w13,8,60,8,2048,1536,16,32,128,1,4,2,25.0,491.6286666666667,3
w13,8,60,8,2048,1536,32,64,128,1,4,2,52.0,492.67366666666663,3
w13,8,60,8,2048,1536,16,64,256,1,4,2,82.0,492.86566666666664,3
w13,8,64,6,3072,2048,16,16,256,1,4,3,48.5,788.4413333333333,3
w13,8,64,6,3072,2048,32,32,256,1,4,2,66.0,788.6116666666667,3
w13,8,64,6,3072,2048,32,16,128,4,4,4,49.0,788.718,3
w13,8,64,6,3584,1536,16,16,128,1,4,3,24.5,690.0696666666666,3
w13,8,64,6,3584,1536,16,16,128,4,4,3,24.5,690.1656666666667,3
w13,8,64,6,3584,1536,16,16,256,1,4,2,32.5,690.2510000000001,3
w13,8,64,8,3584,2560,16,32,128,1,8,2,25.0,1529.1793333333333,3
w13,8,64,8,3584,2560,16,16,256,4,4,4,64.5,1529.3286666666663,3
w13,8,64,8,3584,2560,16,32,256,1,8,2,49.0,1529.4246666666666,3
w13,8,128,4,2048,512,16,64,64,1,4,3,32.0,23.394,3
w13,8,128,4,2048,512,16,64,64,1,8,4,42.0,23.394,3
w13,8,128,4,2048,512,16,32,64,16,4,3,19.0,23.543333333333333,3
w13,8,128,6,4096,2048,32,32,128,1,4,2,34.0,1048.142,3
w13,8,128,6,4096,2048,16,32,128,1,4,2,25.0,1048.3983333333333,3
w13,8,128,6,4096,2048,16,16,128,1,4,2,16.5,1048.441,3
w13,8,128,8,2048,768,32,32,128,1,4,2,34.0,259.9916666666667,3
w13,8,128,8,2048,768,64,64,128,1,4,2,72.0,260.205,3
w13,8,128,8,2048,768,32,32,256,1,4,2,66.0,260.557,3
w13,8,128,8,4096,1536,16,32,128,1,4,2,25.0,1048.131,3
w13,8,128,8,4096,1536,32,32,128,1,4,2,34.0,1048.1736666666668,3
w13,8,128,8,4096,1536,32,32,256,1,4,2,66.0,1048.5686666666668,3
w13,8,128,8,4096,3072,16,32,128,1,4,2,25.0,2093.3173333333334,3
w13,8,128,8,4096,3072,16,32,256,1,4,2,49.0,2094.2343333333333,3
w13,8,128,8,4096,3072,16,32,128,4,4,2,25.0,2094.4480000000003,3
w13,16,8,2,1024,512,16,64,64,64,4,4,42.0,5.164666666666666,3
w13,16,8,2,1024,512,16,64,64,32,4,4,42.0,5.196666666666666,3
w13,16,8,2,1024,512,16,64,64,16,4,4,42.0,5.207333333333334,3
w13,16,16,2,1536,768,16,256,32,8,4,4,76.0,14.854333333333336,3
w13,16,16,2,1536,768,16,128,32,1,4,4,40.0,15.014666666666663,3
w13,16,16,2,1536,768,16,64,64,1,4,3,32.0,15.057,3
w13,16,16,4,1536,1024,16,64,64,64,4,4,42.0,18.743333333333336,3
w13,16,16,4,1536,1024,16,64,64,1,4,4,42.0,18.754,3
w13,16,16,4,1536,1024,16,64,64,32,4,3,32.0,18.754,3
w13,16,32,4,2048,768,16,32,64,1,4,2,13.0,118.03933333333332,3
w13,16,32,4,2048,768,32,32,64,1,4,2,18.0,118.66866666666664,3
w13,16,32,4,2048,768,16,128,64,1,8,2,40.0,119.61866666666668,3
w13,16,32,6,3072,1024,32,32,256,1,4,2,66.0,262.1356666666666,3
w13,16,32,6,3072,1024,16,32,256,1,4,2,49.0,262.253,3
w13,16,32,6,3072,1024,16,64,256,1,4,2,82.0,262.978,3
w13,16,60,4,2048,1408,16,64,128,1,4,2,42.0,450.45633333333336,3
w13,16,60,4,2048,1408,32,64,128,1,4,2,52.0,450.57366666666667,3
w13,16,60,4,2048,1408,32,32,128,1,4,2,34.0,450.7653333333334,3
w13,16,60,6,3584,2304,16,16,256,1,4,3,48.5,1291.7173333333333,3
w13,16,60,6,3584,2304,16,32,256,1,4,2,49.0,1291.7493333333332,3
w13,16,60,6,3584,2304,16,128,128,1,8,3,112.0,1291.973,3
w13,16,60,8,2048,1536,16,32,128,1,4,2,25.0,493.1006666666667,3
w13,16,60,8,2048,1536,16,32,256,1,4,2,49.0,493.5493333333334,3
w13,16,60,8,2048,1536,32,64,128,1,4,2,52.0,493.80466666666666,3
w13,16,64,6,3072,2048,16,16,256,1,4,3,48.5,1050.7886666666666,3
w13,16,64,6,3072,2048,16,64,256,1,4,3,122.0,1051.2046666666668,3
w13,16,64,6,3072,2048,32,32,256,1,4,3,98.0,1051.258,3
w13,16,64,6,3584,1536,32,32,256,1,4,2,66.0,918.83,3
w13,16,64,6,3584,1536,16,32,128,1,4,2,25.0,919.694,3
w13,16,64,6,3584,1536,16,16,256,1,4,3,48.5,919.7793333333332,3
w13,16,64,8,3584,2560,32,32,256,1,8,3,98.0,1531.4516666666666,3
w13,16,64,8,3584,2560,32,32,256,4,8,3,98.0,1531.505666666667,3
w13,16,64,8,3584,2560,32,32,256,1,4,3,98.0,1531.6653333333334,3
w13,16,128,4,2048,512,64,64,128,1,4,2,72.0,167.93833333333333,3
w13,16,128,4,2048,512,16,32,64,1,4,2,13.0,168.41866666666667,3
w13,16,128,4,2048,512,16,32,256,1,4,2,49.0,169.29333333333332,3
w13,16,128,6,4096,2048,16,32,128,1,4,2,25.0,2093.3073333333336,3
w13,16,128,6,4096,2048,16,32,128,4,4,2,25.0,2093.883333333333,3
w13,16,128,6,4096,2048,32,16,128,4,4,2,25.0,2093.969,3
w13,16,128,8,2048,768,32,32,128,1,4,2,34.0,524.5576666666667,3
w13,16,128,8,2048,768,16,64,64,1,4,4,42.0,526.7763333333334,3
w13,16,128,8,2048,768,32,32,128,4,4,2,34.0,526.8296666666666,3
w13,16,128,8,4096,1536,16,32,128,1,4,2,25.0,2094.107,3
w13,16,128,8,4096,1536,16,32,256,1,4,2,49.0,2094.512,3
w13,16,128,8,4096,1536,32,32,64,1,4,4,34.0,2094.7043333333336,3
w13,16,128,8,4096,3072,16,32,128,1,4,2,25.0,4184.202333333334,3
w13,16,128,8,4096,3072,16,64,128,1,4,2,42.0,4184.991666666666,3
w13,16,128,8,4096,3072,16,64,64,1,4,3,32.0,4184.991666666667,3
w13,24,8,2,1024,512,16,64,64,1,8,4,42.0,5.218,3
w13,24,8,2,1024,512,16,64,64,32,4,4,42.0,5.218,3
w13,24,8,2,1024,512,16,64,64,64,4,4,42.0,5.218,3
w13,24,16,2,1536,768,16,256,32,8,4,4,76.0,14.726,3
w13,24,16,2,1536,768,16,128,32,1,4,4,40.0,15.035333333333332,3
w13,24,16,2,1536,768,16,64,64,1,4,3,32.0,15.324,3
w13,24,16,4,1536,1024,16,128,64,64,8,3,58.0,19.191333333333333,3
w13,24,16,4,1536,1024,16,128,64,32,8,3,58.0,19.212666666666667,3
w13,24,16,4,1536,1024,16,128,64,16,8,3,58.0,19.244666666666667,3
w13,24,32,4,2048,768,16,32,64,1,4,2,13.0,118.221,3
w13,24,32,4,2048,768,32,32,64,1,4,2,18.0,118.91433333333332,3
w13,24,32,4,2048,768,16,128,64,1,8,2,40.0,119.47933333333332,3
w13,24,32,6,3072,1024,16,32,256,1,4,2,49.0,261.8793333333333,3
w13,24,32,6,3072,1024,32,32,256,1,4,2,66.0,261.933,3
w13,24,32,6,3072,1024,16,64,256,1,4,2,82.0,261.97566666666665,3
w13,24,60,4,2048,1408,16,64,128,1,4,2,42.0,451.213,3
w13,24,60,4,2048,1408,32,32,128,1,4,2,34.0,451.35133333333334,3
w13,24,60,4,2048,1408,64,64,128,1,4,2,72.0,451.715,3
w13,24,60,6,3584,2304,16,32,256,1,4,2,49.0,1292.3143333333337,3
w13,24,60,6,3584,2304,16,64,256,1,4,2,82.0,1293.2746666666667,3
w13,24,60,6,3584,2304,32,32,256,1,4,3,98.0,1293.3063333333332,3
w13,24,60,8,2048,1536,16,32,128,1,4,2,25.0,493.6766666666667,3
w13,24,60,8,2048,1536,32,64,128,1,4,2,52.0,494.42333333333335,3
w13,24,60,8,2048,1536,16,128,128,1,4,2,76.0,494.9246666666666,3
w13,24,64,6,3072,2048,16,16,256,1,4,3,48.5,1051.8876666666667,3
w13,24,64,6,3072,2048,16,64,256,1,8,3,122.0,1052.3033333333333,3
w13,24,64,6,3072,2048,16,16,256,1,4,4,64.5,1052.4306666666666,3
w13,24,64,6,3584,1536,32,32,256,1,4,2,66.0,920.0883333333333,3
w13,24,64,6,3584,1536,32,32,128,1,4,2,34.0,920.6116666666668,3
w13,24,64,6,3584,1536,16,32,256,1,4,3,73.0,920.7823333333332,3
w13,24,64,8,3584,2560,16,16,256,1,4,3,48.5,1533.265,3
w13,24,64,8,3584,2560,16,32,256,1,4,3,73.0,1533.564,3
w13,24,64,8,3584,2560,16,16,256,1,4,4,64.5,1533.6496666666665,3
w13,24,128,4,2048,512,32,32,128,1,4,2,34.0,259.91766666666666,3
w13,24,128,4,2048,512,16,64,64,16,4,2,22.0,263.032,3
w13,24,128,4,2048,512,16,128,64,16,4,2,40.0,264.36533333333335,3
w13,24,128,6,4096,2048,32,32,128,1,4,2,34.0,2790.9959999999996,3
w13,24,128,6,4096,2048,32,16,128,4,4,2,25.0,2791.124,3
w13,24,128,6,4096,2048,64,64,128,1,8,2,72.0,2791.220333333333,3
w13,24,128,8,2048,768,32,32,128,1,4,2,34.0,525.3153333333333,3
w13,24,128,8,2048,768,16,64,64,1,4,4,42.0,527.2886666666667,3
w13,24,128,8,2048,768,16,32,256,1,4,4,97.0,527.4056666666667,3
w13,24,128,8,4096,1536,16,32,128,1,4,2,25.0,2094.833666666667,3
w13,24,128,8,4096,1536,16,128,64,1,4,2,40.0,2096.1023333333333,3
w13,24,128,8,4096,1536,16,32,256,1,4,2,49.0,2096.2090000000003,3
w13,24,128,8,4096,3072,16,64,128,1,4,2,42.0,4187.010666666666,3
w13,24,128,8,4096,3072,16,64,128,1,8,2,42.0,4187.405,3
w13,24,128,8,4096,3072,16,64,64,1,4,3,32.0,4187.437666666667,3
w13,32,8,2,1024,512,16,64,64,64,4,4,42.0,5.303333333333334,3
w13,32,8,2,1024,512,16,64,64,32,4,4,42.0,5.313666666666666,3
w13,32,8,2,1024,512,16,64,32,1,4,4,22.0,5.324666666666666,3
w13,32,16,2,1536,768,16,256,32,8,4,4,76.0,14.715333333333334,3
w13,32,16,2,1536,768,16,128,32,1,4,4,40.0,15.068,3
w13,32,16,2,1536,768,16,64,64,1,4,3,32.0,15.334333333333332,3
w13,32,16,4,1536,1024,16,128,32,1,4,4,40.0,19.628666666666664,3
w13,32,16,4,1536,1024,16,128,64,1,8,3,58.0,19.628666666666664,3
w13,32,16,4,1536,1024,16,128,64,1,4,3,58.0,19.660666666666668,3
w13,32,32,4,2048,768,32,32,64,1,4,2,18.0,118.83966666666667,3
w13,32,32,4,2048,768,16,32,64,1,4,2,13.0,118.936,3
w13,32,32,4,2048,768,32,128,64,1,8,2,48.0,119.89566666666668,3
w13,32,32,6,3072,1024,16,32,256,1,4,2,49.0,262.797,3
w13,32,32,6,3072,1024,32,32,256,1,4,2,66.0,262.989,3
w13,32,32,6,3072,1024,16,64,256,1,4,2,82.0,263.6073333333333,3
w13,32,60,4,2048,1408,16,64,128,1,4,2,42.0,451.18133333333327,3
w13,32,60,4,2048,1408,32,64,128,1,4,2,52.0,451.6613333333333,3
w13,32,60,4,2048,1408,32,32,128,1,4,2,34.0,451.7360000000001,3
w13,32,60,6,3584,2304,16,16,256,1,4,4,64.5,1294.4593333333337,3
w13,32,60,6,3584,2304,32,32,256,1,4,3,98.0,1294.619333333333,3
w13,32,60,6,3584,2304,16,64,256,1,8,3,122.0,1294.811333333333,3
w13,32,60,8,2048,1536,16,32,128,1,4,2,25.0,495.0953333333334,3
w13,32,60,8,2048,1536,16,128,128,1,4,2,76.0,495.458,3
w13,32,60,8,2048,1536,16,32,256,1,4,2,49.0,495.59666666666664,3
w13,32,64,6,3072,2048,16,16,256,1,4,3,48.5,1053.3486666666668,3
w13,32,64,6,3072,2048,32,32,256,1,8,4,130.0,1053.445,3
w13,32,64,6,3072,2048,16,64,256,1,4,3,122.0,1053.5836666666669,3
w13,32,64,6,3584,1536,16,16,256,1,4,3,48.5,921.2946666666668,3
w13,32,64,6,3584,1536,32,32,128,1,4,3,50.0,921.9773333333331,3
w13,32,64,6,3584,1536,32,32,256,4,8,2,66.0,921.988,3
w13,32,64,8,3584,2560,16,32,256,1,4,4,97.0,1534.9083333333335,3
w13,32,64,8,3584,2560,32,32,256,1,4,3,98.0,1535.025666666667,3
w13,32,64,8,3584,2560,16,32,256,1,8,4,97.0,1535.0896666666667,3
w13,32,128,4,2048,512,32,32,128,1,4,2,34.0,349.5493333333333,3
w13,32,128,4,2048,512,16,128,64,1,8,4,76.0,352.174,3
w13,32,128,4,2048,512,16,32,64,1,4,4,25.0,352.19533333333334,3
w13,32,128,6,4096,2048,16,128,128,1,4,2,76.0,2792.064,3
w13,32,128,6,4096,2048,16,128,128,1,8,2,76.0,2792.3626666666664,3
w13,32,128,6,4096,2048,32,128,128,1,8,2,88.0,2792.4166666666665,3
w13,32,128,8,2048,768,32,32,128,1,4,2,34.0,525.8376666666667,3
w13,32,128,8,2048,768,16,64,64,1,4,4,42.0,527.8856666666667,3
w13,32,128,8,2048,768,16,16,128,4,4,2,16.5,527.9603333333333,3
w13,32,128,8,4096,1536,16,32,128,1,4,2,25.0,2097.16,3
w13,32,128,8,4096,1536,32,32,256,1,8,3,98.0,2097.7893333333336,3
w13,32,128,8,4096,1536,16,16,256,1,4,3,48.5,2097.906333333333,3
w13,32,128,8,4096,3072,16,64,128,1,8,2,42.0,4189.775000000001,3
w13,32,128,8,4096,3072,16,64,128,1,4,2,42.0,4190.575666666667,3
w13,32,128,8,4096,3072,16,64,64,1,4,3,32.0,4190.7356666666665,3
w13,48,8,2,1024,512,16,64,64,1,4,4,42.0,5.527333333333334,3
w13,48,8,2,1024,512,16,64,64,1,8,4,42.0,5.57,3
w13,48,8,2,1024,512,16,64,32,1,4,4,22.0,5.580666666666667,3
w13,48,16,2,1536,768,16,256,32,8,4,4,76.0,14.907666666666666,3
w13,48,16,2,1536,768,16,128,32,1,4,4,40.0,15.271,3
w13,48,16,2,1536,768,16,256,32,8,8,4,76.0,15.590666666666666,3
w13,48,16,4,1536,1024,16,128,64,1,8,3,58.0,19.863333333333333,3
w13,48,16,4,1536,1024,16,128,64,32,8,3,58.0,19.863333333333333,3
w13,48,16,4,1536,1024,16,128,32,1,4,4,40.0,19.874,3
w13,48,32,4,2048,768,16,128,64,16,4,2,40.0,120.045,3
w13,48,32,4,2048,768,16,32,64,1,4,2,13.0,120.16233333333332,3
w13,48,32,4,2048,768,16,128,64,1,8,2,40.0,120.36466666666666,3
w13,48,32,6,3072,1024,16,32,256,1,4,2,49.0,263.6716666666667,3
w13,48,32,6,3072,1024,16,64,256,1,4,2,82.0,263.8206666666667,3
w13,48,32,6,3072,1024,32,32,256,1,4,2,66.0,263.90633333333335,3
w13,48,60,4,2048,1408,16,64,128,1,4,2,42.0,452.39733333333334,3
w13,48,60,4,2048,1408,32,32,128,1,4,2,34.0,452.5466666666666,3
w13,48,60,4,2048,1408,32,64,128,1,4,2,52.0,452.7283333333333,3
w13,48,60,6,3584,2304,16,32,256,1,4,4,97.0,1297.0406666666663,3
w13,48,60,6,3584,2304,16,16,256,1,4,3,48.5,1297.1046666666666,3
w13,48,60,6,3584,2304,32,32,256,1,4,3,98.0,1297.35,3
w13,48,60,8,2048,1536,32,64,128,1,4,2,52.0,496.47166666666664,3
w13,48,60,8,2048,1536,16,32,128,1,4,2,25.0,496.93066666666664,3
w13,48,60,8,2048,1536,16,128,128,1,4,2,76.0,497.026,3
w13,48,64,6,3072,2048,32,32,256,1,8,3,98.0,1055.2046666666668,3
w13,48,64,6,3072,2048,16,16,256,1,4,3,48.5,1055.503333333333,3
w13,48,64,6,3072,2048,32,32,256,1,4,3,98.0,1055.5886666666668,3
w13,48,64,6,3584,1536,16,16,256,1,4,3,48.5,923.3096666666668,3
w13,48,64,6,3584,1536,16,16,256,4,4,3,48.5,923.374,3
w13,48,64,6,3584,1536,32,32,256,1,8,4,130.0,923.4383333333334,3
w13,48,64,8,3584,2560,16,32,256,1,4,4,97.0,1537.948333333333,3
w13,48,64,8,3584,2560,32,32,256,1,4,3,98.0,1538.631,3
w13,48,64,8,3584,2560,32,32,256,1,8,3,98.0,1538.6523333333334,3
w13,48,128,4,2048,512,32,32,128,1,4,2,34.0,349.51800000000003,3
w13,48,128,4,2048,512,16,32,128,1,4,3,37.0,352.51500000000004,3
w13,48,128,4,2048,512,16,16,128,4,4,3,24.5,352.70700000000005,3
w13,48,128,6,4096,2048,16,128,128,1,8,2,76.0,2795.392333333333,3
w13,48,128,6,4096,2048,16,128,128,1,4,2,76.0,2795.819,3
w13,48,128,6,4096,2048,32,32,256,1,8,3,98.0,2796.054666666667,3
w13,48,128,8,2048,768,32,32,128,1,4,2,34.0,527.0006666666667,3
w13,48,128,8,2048,768,32,32,128,1,8,2,34.0,529.1016666666667,3
w13,48,128,8,2048,768,16,64,64,1,8,4,42.0,529.2513333333333,3
w13,48,128,8,4096,1536,32,32,256,1,4,4,130.0,2099.9013333333332,3
w13,48,128,8,4096,1536,16,64,256,1,8,3,122.0,2100.2106666666664,3
w13,48,128,8,4096,1536,32,32,256,1,4,2,66.0,2100.296333333333,3
w13,48,128,8,4096,3072,16,64,128,1,4,2,42.0,4193.861333333333,3
w13,48,128,8,4096,3072,16,64,128,1,8,2,42.0,4194.789666666667,3
w13,48,128,8,4096,3072,32,32,256,1,4,3,98.0,4194.992,3
w13,64,8,2,1024,512,16,64,64,1,4,4,42.0,5.655333333333334,3
w13,64,8,2,1024,512,16,64,64,1,8,4,42.0,5.676666666666667,3
w13,64,8,2,1024,512,16,64,64,16,4,4,42.0,5.708666666666667,3
w13,64,16,2,1536,768,16,256,32,8,4,4,76.0,14.882,3
w13,64,16,2,1536,768,16,128,32,1,4,4,40.0,15.575666666666669,3
w13,64,16,2,1536,768,16,256,32,8,8,4,76.0,15.607333333333337,3
w13,64,16,4,1536,1024,16,128,64,32,8,3,58.0,20.66333333333333,3
w13,64,16,4,1536,1024,16,128,64,64,8,3,58.0,20.685,3
w13,64,16,4,1536,1024,16,128,64,16,8,3,58.0,20.716666666666665,3
w13,64,32,4,2048,768,32,32,64,1,4,2,18.0,119.458,3
w13,64,32,4,2048,768,16,32,64,1,4,2,13.0,119.63933333333334,3
w13,64,32,4,2048,768,16,128,64,1,8,2,40.0,120.418,3
w13,64,32,6,3072,1024,16,32,256,1,4,2,49.0,264.29,3
w13,64,32,6,3072,1024,32,32,256,1,4,2,66.0,264.5143333333333,3
w13,64,32,6,3072,1024,16,64,256,1,4,2,82.0,265.28266666666667,3
w13,64,60,4,2048,1408,32,32,128,1,4,2,34.0,453.475,3
w13,64,60,4,2048,1408,16,64,128,1,4,2,42.0,453.62433333333337,3
w13,64,60,4,2048,1408,32,64,128,1,4,2,52.0,453.86966666666666,3
w13,64,60,6,3584,2304,16,16,256,1,4,3,48.5,1299.0886666666663,3
w13,64,60,6,3584,2304,32,32,256,1,4,3,98.0,1299.217,3
w13,64,60,6,3584,2304,16,32,256,1,4,4,97.0,1299.5263333333332,3
w13,64,60,8,2048,1536,32,64,128,1,4,2,52.0,497.8796666666667,3
w13,64,60,8,2048,1536,16,128,128,1,4,2,76.0,498.08233333333334,3
w13,64,60,8,2048,1536,16,32,128,1,4,2,25.0,498.2636666666667,3
w13,64,64,6,3072,2048,32,32,256,1,8,3,98.0,1057.5836666666669,3
w13,64,64,6,3072,2048,32,32,256,1,4,3,98.0,1057.765,3
w13,64,64,6,3072,2048,16,32,256,1,8,3,73.0,1057.7753333333333,3
w13,64,64,6,3584,1536,16,16,256,1,4,3,48.5,925.06,3
w13,64,64,6,3584,1536,16,32,256,1,4,2,49.0,925.1453333333332,3
w13,64,64,6,3584,1536,32,32,256,1,8,2,66.0,925.1773333333334,3
w13,64,64,8,3584,2560,16,16,256,1,4,3,48.5,1541.1056666666666,3
w13,64,64,8,3584,2560,32,32,256,1,4,3,98.0,1541.4153333333334,3
w13,64,64,8,3584,2560,32,32,256,1,8,3,98.0,1541.532333333333,3
w13,64,128,4,2048,512,32,32,128,1,4,2,34.0,350.22166666666664,3
w13,64,128,4,2048,512,16,32,128,1,4,3,37.0,353.0806666666667,3
w13,64,128,4,2048,512,32,32,128,16,4,2,34.0,353.1336666666666,3
w13,64,128,6,4096,2048,32,128,128,4,8,2,88.0,2797.7090000000003,3
w13,64,128,6,4096,2048,16,128,128,1,8,2,76.0,2798.039666666667,3
w13,64,128,6,4096,2048,32,32,256,1,8,3,98.0,2798.071,3
w13,64,128,8,2048,768,32,32,128,1,4,2,34.0,528.1206666666667,3
w13,64,128,8,2048,768,16,16,256,1,4,3,48.5,529.9763333333334,3
w13,64,128,8,2048,768,16,32,128,1,8,2,25.0,530.062,3
w13,64,128,8,4096,1536,16,128,64,1,4,2,40.0,2101.555666666666,3
w13,64,128,8,4096,1536,16,32,256,1,4,2,49.0,2101.7263333333335,3
w13,64,128,8,4096,1536,16,16,256,1,4,3,48.5,2102.345,3
w13,64,128,8,4096,3072,16,64,128,1,4,2,42.0,4197.243666666666,3
w13,64,128,8,4096,3072,16,64,128,1,8,2,42.0,4197.3606666666665,3
w13,64,128,8,4096,3072,32,64,128,1,8,2,52.0,4197.424333333333,3
w13,96,8,2,1024,512,32,64,128,64,8,4,100.0,6.092666666666666,3
w13,96,8,2,1024,512,32,64,64,16,8,4,52.0,6.135666666666666,3
w13,96,8,2,1024,512,32,64,64,64,8,4,52.0,6.146,3
w13,96,16,2,1536,768,16,256,32,8,4,4,76.0,15.223333333333334,3
w13,96,16,2,1536,768,16,256,32,8,8,4,76.0,15.714,3
w13,96,16,2,1536,768,16,128,32,1,4,4,40.0,15.852666666666666,3
w13,96,16,4,1536,1024,32,128,32,128,4,4,48.0,21.762,3
w13,96,16,4,1536,1024,32,128,64,64,8,3,68.0,21.975333333333335,3
w13,96,16,4,1536,1024,32,128,64,16,8,3,68.0,22.07133333333333,3
w13,96,32,4,2048,768,16,128,64,16,4,2,40.0,120.482,3
w13,96,32,4,2048,768,32,128,64,1,8,2,48.0,121.00466666666668,3
w13,96,32,4,2048,768,16,128,64,1,8,2,40.0,121.23933333333332,3
w13,96,32,6,3072,1024,32,32,256,1,4,2,66.0,265.4526666666667,3
w13,96,32,6,3072,1024,32,64,256,1,4,2,100.0,267.16,3
w13,96,32,6,3072,1024,16,64,128,1,4,2,42.0,268.62100000000004,3
w13,96,60,4,2048,1408,16,64,128,1,4,2,42.0,454.85100000000006,3
w13,96,60,4,2048,1408,16,128,128,1,4,2,76.0,455.1603333333333,3
w13,96,60,4,2048,1408,32,32,128,1,4,2,34.0,455.2136666666667,3
w13,96,60,6,3584,2304,32,32,256,1,8,3,98.0,1303.6539999999998,3
w13,96,60,6,3584,2304,16,32,256,1,4,4,97.0,1303.8463333333332,3
w13,96,60,6,3584,2304,32,32,256,1,4,4,130.0,1303.91,3
w13,96,60,8,2048,1536,16,32,128,1,4,2,25.0,500.2159999999999,3
w13,96,60,8,2048,1536,32,64,128,1,4,2,52.0,500.237,3
w13,96,60,8,2048,1536,16,128,128,1,4,2,76.0,500.429,3
w13,96,64,6,3072,2048,32,32,256,1,8,3,98.0,1061.381,3
w13,96,64,6,3072,2048,32,32,256,1,4,3,98.0,1061.4556666666667,3
w13,96,64,6,3072,2048,16,16,256,1,4,3,48.5,1062.138,3
w13,96,64,6,3584,1536,16,16,256,1,4,3,48.5,927.5666666666666,3
w13,96,64,6,3584,1536,32,32,256,1,8,3,98.0,928.0576666666666,3
w13,96,64,6,3584,1536,32,32,256,1,4,3,98.0,928.2496666666666,3
w13,96,64,8,3584,2560,32,32,256,1,4,4,130.0,1548.0606666666663,3
w13,96,64,8,3584,2560,16,128,128,1,8,3,112.0,1548.071333333333,3
w13,96,64,8,3584,2560,32,32,256,1,8,3,98.0,1548.21,3
w13,96,128,4,2048,512,32,32,128,1,4,2,34.0,350.67,3
w13,96,128,4,2048,512,16,32,128,4,4,3,37.0,353.9766666666667,3
w13,96,128,4,2048,512,16,64,64,1,4,4,42.0,353.987,3
w13,96,128,6,4096,2048,16,32,256,1,4,4,97.0,2803.138333333334,3
w13,96,128,6,4096,2048,32,32,256,1,8,3,98.0,2803.3303333333333,3
w13,96,128,6,4096,2048,32,32,256,1,4,3,98.0,2803.437,3
w13,96,128,8,2048,768,32,32,128,1,4,2,34.0,529.6356666666667,3
w13,96,128,8,2048,768,16,64,64,1,4,2,22.0,531.5876666666667,3
w13,96,128,8,2048,768,16,64,64,16,4,2,22.0,531.7683333333333,3
w13,96,128,8,4096,1536,16,32,256,1,4,2,49.0,2105.2566666666667,3
w13,96,128,8,4096,1536,16,64,256,1,4,2,82.0,2106.2273333333333,3
w13,96,128,8,4096,1536,32,32,256,1,4,3,98.0,2106.398333333333,3
w13,96,128,8,4096,3072,16,64,128,1,4,2,42.0,4203.59,3
w13,96,128,8,4096,3072,16,64,128,1,8,2,42.0,4203.920666666667,3
w13,96,128,8,4096,3072,32,64,128,1,4,2,52.0,4205.093333333333,3
w13,128,8,2,1024,512,32,64,64,1,8,4,52.0,6.092666666666666,3
w13,128,8,2,1024,512,32,64,64,16,8,4,52.0,6.124666666666666,3
w13,128,8,2,1024,512,32,64,64,64,8,4,52.0,6.157333333333334,3
w13,128,16,2,1536,768,16,256,32,8,4,4,76.0,15.340666666666666,3
w13,128,16,2,1536,768,16,256,32,8,8,4,76.0,15.852666666666666,3
w13,128,16,2,1536,768,16,128,32,1,4,4,40.0,16.353666666666665,3
w13,128,16,4,1536,1024,32,128,32,128,4,4,48.0,22.924666666666667,3
w13,128,16,4,1536,1024,32,128,64,64,8,3,68.0,23.052666666666667,3
w13,128,16,4,1536,1024,32,128,64,32,8,3,68.0,23.074,3
w13,128,32,4,2048,768,16,32,64,1,4,2,13.0,120.53566666666666,3
w13,128,32,4,2048,768,32,32,64,1,4,2,18.0,120.89833333333333,3
w13,128,32,4,2048,768,32,128,64,1,8,2,48.0,122.21033333333332,3
w13,128,32,6,3072,1024,32,32,256,1,4,2,66.0,267.59666666666664,3
w13,128,32,6,3072,1024,32,64,256,1,4,2,100.0,268.37533333333334,3
w13,128,32,6,3072,1024,32,64,128,1,4,2,52.0,269.752,3
w13,128,60,4,2048,1408,16,128,128,1,4,2,76.0,456.33366666666666,3
w13,128,60,4,2048,1408,16,64,128,1,4,2,42.0,456.6323333333333,3
w13,128,60,4,2048,1408,32,32,128,1,4,2,34.0,457.166,3
w13,128,60,6,3584,2304,32,32,256,1,4,3,98.0,1307.463,3
w13,128,60,6,3584,2304,32,32,256,1,8,3,98.0,1307.6226666666666,3
w13,128,60,6,3584,2304,16,128,128,1,8,2,76.0,1307.6646666666668,3
w13,128,60,8,2048,1536,32,64,128,1,4,2,52.0,502.2426666666667,3
w13,128,60,8,2048,1536,32,128,128,1,4,2,88.0,502.8933333333334,3
w13,128,60,8,2048,1536,32,128,128,4,8,2,88.0,503.8426666666667,3
w13,128,64,6,3072,2048,32,32,256,1,8,3,98.0,1065.36,3
w13,128,64,6,3072,2048,32,32,256,1,4,3,98.0,1065.5303333333334,3
w13,128,64,6,3072,2048,16,64,256,1,8,3,122.0,1065.7546666666667,3
w13,128,64,6,3584,1536,32,32,256,1,4,2,66.0,929.754,3
w13,128,64,6,3584,1536,32,32,256,1,4,3,98.0,930.5646666666668,3
w13,128,64,6,3584,1536,16,32,256,1,4,2,49.0,930.799,3
w13,128,64,8,3584,2560,32,32,256,1,4,3,98.0,1553.3083333333334,3
w13,128,64,8,3584,2560,16,128,128,1,4,2,76.0,1553.458,3
w13,128,64,8,3584,2560,16,128,128,1,8,2,76.0,1553.8523333333333,3
w13,128,128,4,2048,512,32,32,128,1,4,2,34.0,351.5976666666667,3
w13,128,128,4,2048,512,16,32,64,32,4,4,25.0,354.5203333333333,3
w13,128,128,4,2048,512,16,128,128,32,8,2,76.0,354.5843333333333,3
w13,128,128,6,4096,2048,32,32,256,1,4,3,98.0,2806.03,3
w13,128,128,6,4096,2048,32,32,256,1,8,3,98.0,2806.125,3
w13,128,128,6,4096,2048,16,128,128,16,8,2,76.0,2807.6513333333332,3
w13,128,128,8,2048,768,32,32,128,1,4,2,34.0,532.9633333333334,3
w13,128,128,8,2048,768,16,128,64,16,8,2,40.0,533.326,3
w13,128,128,8,2048,768,16,128,64,1,8,2,40.0,533.8056666666666,3
w13,128,128,8,4096,1536,16,128,64,1,4,2,40.0,2107.8706666666667,3
w13,128,128,8,4096,1536,16,128,64,1,8,2,40.0,2109.161333333333,3
w13,128,128,8,4096,1536,32,32,256,1,4,3,98.0,2109.801,3
w13,128,128,8,4096,3072,16,64,128,1,4,2,42.0,4209.937000000001,3
w13,128,128,8,4096,3072,16,64,128,1,8,2,42.0,4211.046333333333,3
w13,128,128,8,4096,3072,32,64,128,1,8,2,52.0,4211.8026666666665,3
w13,256,8,2,1024,512,64,64,64,32,4,4,72.0,8.183333333333335,3
w13,256,8,2,1024,512,64,64,64,1,8,4,72.0,8.204333333333333,3
w13,256,8,2,1024,512,64,64,64,4,4,4,72.0,8.215333333333334,3
w13,256,16,2,1536,768,32,128,32,128,4,4,48.0,18.53,3
w13,256,16,2,1536,768,32,128,32,128,4,3,38.0,19.180666666666667,3
w13,256,16,2,1536,768,32,128,64,64,4,3,68.0,19.489666666666665,3
w13,256,16,4,1536,1024,64,128,32,8,4,4,64.0,30.05,3
w13,256,16,4,1536,1024,64,128,32,8,4,3,52.0,30.242,3
w13,256,16,4,1536,1024,64,256,64,1,8,3,152.0,30.316666666666663,3
w13,256,32,4,2048,768,32,128,64,32,4,2,48.0,125.048,3
w13,256,32,4,2048,768,32,128,64,1,8,2,48.0,125.14333333333332,3
w13,256,32,4,2048,768,32,32,64,1,4,2,18.0,125.15433333333333,3
w13,256,32,6,3072,1024,32,64,128,1,4,2,52.0,273.77333333333337,3
w13,256,32,6,3072,1024,64,64,128,1,4,2,72.0,275.3093333333333,3
w13,256,32,6,3072,1024,32,128,128,1,4,2,88.0,276.216,3
w13,256,60,4,2048,1408,32,128,128,1,4,2,88.0,461.2726666666667,3
w13,256,60,4,2048,1408,32,128,128,1,8,2,88.0,461.859,3
w13,256,60,4,2048,1408,32,32,128,1,4,2,34.0,462.01933333333335,3
w13,256,60,6,3584,2304,32,128,128,1,8,2,88.0,1319.3563333333334,3
w13,256,60,6,3584,2304,32,128,128,1,4,2,88.0,1319.8996666666667,3
w13,256,60,6,3584,2304,32,128,128,4,8,2,88.0,1321.5110000000002,3
w13,256,60,8,2048,1536,64,128,128,1,8,2,112.0,511.48,3
w13,256,60,8,2048,1536,64,64,64,1,4,2,40.0,512.045,3
w13,256,60,8,2048,1536,64,128,64,1,8,2,64.0,512.195,3
w13,256,64,6,3072,2048,32,32,256,1,4,3,98.0,1077.136,3
w13,256,64,6,3072,2048,32,32,256,1,8,3,98.0,1077.477,3
w13,256,64,6,3072,2048,32,64,128,1,4,2,52.0,1077.584,3
w13,256,64,6,3584,1536,32,32,128,1,4,2,34.0,940.6233333333332,3
w13,256,64,6,3584,1536,32,32,256,1,4,3,98.0,940.773,3
w13,256,64,6,3584,1536,32,32,256,1,4,2,66.0,941.06,3
w13,256,64,8,3584,2560,32,128,128,8,8,2,88.0,1569.8953333333332,3
w13,256,64,8,3584,2560,32,128,128,4,8,2,88.0,1570.7913333333331,3
w13,256,64,8,3584,2560,32,128,128,1,4,2,88.0,1571.1539999999998,3
w13,256,128,4,2048,512,32,32,128,1,4,2,34.0,354.13633333333337,3
w13,256,128,4,2048,512,16,128,128,1,8,2,76.0,356.291,3
w13,256,128,4,2048,512,16,64,128,1,8,2,42.0,356.675,3
w13,256,128,6,4096,2048,16,128,128,1,8,2,76.0,2816.2906666666663,3
w13,256,128,6,4096,2048,32,128,128,1,4,2,88.0,2817.3043333333335,3
w13,256,128,6,4096,2048,16,128,128,1,4,2,76.0,2817.5393333333336,3
w13,256,128,8,2048,768,16,128,64,16,8,2,40.0,536.2486666666667,3
w13,256,128,8,2048,768,16,64,64,16,4,2,22.0,536.7713333333334,3
w13,256,128,8,2048,768,32,32,128,1,4,2,34.0,536.7923333333333,3
w13,256,128,8,4096,1536,16,128,64,1,4,2,40.0,2116.308333333333,3
w13,256,128,8,4096,1536,16,128,64,16,4,2,40.0,2120.98,3
w13,256,128,8,4096,1536,16,256,64,1,8,2,76.0,2121.8223333333335,3
w13,256,128,8,4096,3072,16,64,128,1,4,2,42.0,4232.571666666667,3
w13,256,128,8,4096,3072,32,64,128,1,8,2,52.0,4233.03,3
w13,256,128,8,4096,3072,16,128,64,1,4,2,40.0,4234.395333333333,3
w13,512,8,2,1024,512,64,128,64,1,8,3,88.0,11.554333333333332,3
w13,512,8,2,1024,512,64,128,64,1,8,4,112.0,11.596333333333334,3
w13,512,8,2,1024,512,128,64,64,1,8,3,88.0,11.746,3
w13,512,16,2,1536,768,64,128,32,8,4,3,52.0,28.396666666666665,3
w13,512,16,2,1536,768,64,128,32,8,4,4,64.0,28.429,3
w13,512,16,2,1536,768,64,64,64,4,4,3,56.0,28.983333333333334,3
w13,512,16,4,1536,1024,64,128,32,8,4,3,52.0,51.980333333333334,3
w13,512,16,4,1536,1024,64,128,32,8,4,2,40.0,52.11966666666666,3
w13,512,16,4,1536,1024,64,128,32,8,8,2,40.0,53.37866666666667,3
w13,512,32,4,2048,768,64,64,128,1,4,2,72.0,131.94866666666667,3
w13,512,32,4,2048,768,64,128,64,32,4,2,64.0,132.57833333333335,3
w13,512,32,4,2048,768,64,128,64,4,4,2,64.0,133.016,3
w13,512,32,6,3072,1024,64,64,128,1,4,2,72.0,287.405,3
w13,512,32,6,3072,1024,64,128,128,1,4,2,112.0,287.9916666666667,3
w13,512,32,6,3072,1024,64,128,128,4,8,2,112.0,289.0693333333333,3
w13,512,60,4,2048,1408,64,128,128,1,4,2,112.0,470.4026666666667,3
w13,512,60,4,2048,1408,64,128,128,1,8,2,112.0,470.627,3
w13,512,60,4,2048,1408,64,128,64,1,8,2,64.0,470.7443333333333,3
w13,512,60,6,3584,2304,64,128,128,1,4,2,112.0,1338.3856666666668,3
w13,512,60,6,3584,2304,64,128,128,1,8,2,112.0,1338.897,3
w13,512,60,6,3584,2304,64,128,128,4,8,2,112.0,1341.5856666666666,3
w13,512,60,8,2048,1536,128,64,128,1,8,2,112.0,527.8643333333333,3
w13,512,60,8,2048,1536,128,64,64,1,8,3,88.0,529.219,3
w13,512,60,8,2048,1536,64,128,128,4,8,2,112.0,529.4323333333333,3
w13,512,64,6,3072,2048,64,128,128,1,8,2,112.0,1097.445,3
w13,512,64,6,3072,2048,64,128,128,1,4,2,112.0,1098.043,3
w13,512,64,6,3072,2048,64,128,128,4,4,2,112.0,1098.1706666666666,3
w13,512,64,6,3584,1536,64,64,128,1,4,2,72.0,956.8046666666664,3
w13,512,64,6,3584,1536,64,64,128,4,4,2,72.0,957.2743333333332,3
w13,512,64,6,3584,1536,32,32,128,1,4,2,34.0,957.6043333333332,3
w13,512,64,8,3584,2560,64,128,128,1,8,2,112.0,1596.9246666666668,3
w13,512,64,8,3584,2560,64,128,128,4,8,2,112.0,1597.6923333333334,3
w13,512,64,8,3584,2560,64,128,128,4,4,2,112.0,1598.407,3
w13,512,128,4,2048,512,32,32,128,1,4,2,34.0,358.7126666666666,3
w13,512,128,4,2048,512,16,64,64,16,4,2,22.0,359.61899999999997,3
w13,512,128,4,2048,512,16,64,64,32,4,2,22.0,359.683,3
w13,512,128,6,4096,2048,64,256,64,1,8,2,112.0,2833.485,3
w13,512,128,6,4096,2048,32,128,128,1,8,2,88.0,2835.9176666666667,3
w13,512,128,6,4096,2048,32,128,128,4,8,2,88.0,2836.311666666667,3
w13,512,128,8,2048,768,32,32,128,1,4,2,34.0,545.1656666666667,3
w13,512,128,8,2048,768,32,64,64,1,4,2,28.0,545.39,3
w13,512,128,8,2048,768,32,32,64,1,4,2,18.0,546.8296666666666,3
w13,512,128,8,4096,1536,64,64,64,1,4,3,56.0,2142.4943333333335,3
w13,512,128,8,4096,1536,64,64,128,1,4,2,72.0,2142.59,3
w13,512,128,8,4096,1536,32,32,256,1,8,2,66.0,2143.304666666667,3
w13,512,128,8,4096,3072,32,64,64,1,8,2,28.0,4272.432333333333,3
w13,512,128,8,4096,3072,32,128,64,1,8,2,48.0,4275.7390000000005,3
w13,512,128,8,4096,3072,32,32,64,1,4,2,18.0,4276.454000000001,3
w13,1024,8,2,1024,512,64,128,32,8,4,3,52.0,19.97,3
w13,1024,8,2,1024,512,64,128,32,8,4,4,64.0,20.129666666666665,3
w13,1024,8,2,1024,512,64,128,64,1,8,3,88.0,20.482,3
w13,1024,16,2,1536,768,64,128,32,8,4,3,52.0,44.86600000000001,3
w13,1024,16,2,1536,768,64,128,32,8,4,2,40.0,46.57266666666666,3
w13,1024,16,2,1536,768,64,128,32,8,8,2,40.0,48.279333333333334,3
w13,1024,16,4,1536,1024,128,128,64,1,4,3,128.0,94.70066666666666,3
w13,1024,16,4,1536,1024,128,128,64,16,4,3,128.0,95.415,3
w13,1024,16,4,1536,1024,128,128,64,32,4,3,128.0,95.88466666666666,3
w13,1024,32,4,2048,768,64,64,128,64,4,2,72.0,145.91166666666666,3
w13,1024,32,4,2048,768,64,64,128,1,4,2,72.0,146.97833333333332,3
w13,1024,32,4,2048,768,64,64,64,64,4,3,56.0,150.48799999999997,3
w13,1024,32,6,3072,1024,64,128,64,1,8,3,88.0,332.34366666666665,3
w13,1024,32,6,3072,1024,64,128,64,16,8,3,88.0,332.3546666666667,3
w13,1024,32,6,3072,1024,64,128,64,16,4,3,88.0,334.16766666666666,3
w13,1024,60,4,2048,1408,128,64,64,1,4,2,64.0,487.4376666666667,3
w13,1024,60,4,2048,1408,64,128,128,1,8,2,112.0,487.694,3
w13,1024,60,4,2048,1408,64,128,64,1,4,2,64.0,488.633,3
w13,1024,60,6,3584,2304,128,64,128,1,8,2,112.0,1386.0336666666665,3
w13,1024,60,6,3584,2304,128,256,64,1,8,3,208.0,1386.727,3
w13,1024,60,6,3584,2304,64,128,128,4,8,2,112.0,1392.5083333333332,3
w13,1024,60,8,2048,1536,64,128,64,1,8,3,88.0,560.4616666666667,3
w13,1024,60,8,2048,1536,64,128,64,4,8,3,88.0,563.619,3
w13,1024,60,8,2048,1536,64,128,64,1,4,3,88.0,564.418,3
w13,1024,64,6,3072,2048,64,128,128,4,4,2,112.0,1130.1063333333334,3
w13,1024,64,6,3072,2048,64,128,128,4,8,2,112.0,1131.2583333333334,3
w13,1024,64,6,3072,2048,128,64,128,1,8,3,160.0,1134.2773333333332,3
w13,1024,64,6,3584,1536,64,64,128,1,4,2,72.0,985.3373333333332,3
w13,1024,64,6,3584,1536,64,64,128,8,4,2,72.0,986.1276666666666,3
w13,1024,64,6,3584,1536,64,64,128,4,4,2,72.0,986.2023333333332,3
w13,1024,64,8,3584,2560,64,128,128,4,8,2,112.0,1653.906,3
w13,1024,64,8,3584,2560,64,128,128,4,4,2,112.0,1656.7226666666666,3
w13,1024,64,8,3584,2560,128,64,128,1,8,2,112.0,1657.927,3
w13,1024,128,4,2048,512,32,32,128,1,4,2,34.0,363.715,3
w13,1024,128,4,2048,512,32,128,64,4,8,2,48.0,364.04566666666665,3
w13,1024,128,4,2048,512,32,256,64,1,4,2,88.0,364.65366666666665,3
w13,1024,128,6,4096,2048,64,256,64,1,8,2,112.0,2861.719333333333,3
w13,1024,128,6,4096,2048,64,128,64,4,8,3,88.0,2878.2423333333336,3
w13,1024,128,6,4096,2048,64,128,64,1,4,3,88.0,2878.413,3
w13,1024,128,8,2048,768,64,64,128,4,4,2,72.0,560.7813333333334,3
w13,1024,128,8,2048,768,64,128,64,16,4,2,64.0,560.803,3
w13,1024,128,8,2048,768,64,64,128,8,4,2,72.0,561.0803333333333,3
w13,1024,128,8,4096,1536,64,64,128,1,4,2,72.0,2169.693333333333,3
w13,1024,128,8,4096,1536,64,64,64,1,8,3,56.0,2171.645666666667,3
w13,1024,128,8,4096,1536,64,64,64,1,4,3,56.0,2173.2346666666667,3
w13,1024,128,8,4096,3072,64,256,64,1,8,2,112.0,4327.705666666667,3
w13,1024,128,8,4096,3072,64,128,64,1,4,2,64.0,4332.324666666666,3
w13,1024,128,8,4096,3072,64,64,64,1,4,2,40.0,4332.325333333333,3
w13,1536,8,2,1024,512,64,128,32,8,4,3,52.0,29.399333333333335,3
w13,1536,8,2,1024,512,64,128,32,8,4,2,40.0,29.58066666666667,3
w13,1536,8,2,1024,512,64,128,32,8,8,2,40.0,31.469,3
w13,1536,16,2,1536,768,64,256,32,8,4,3,92.0,53.101,3
w13,1536,16,2,1536,768,64,256,32,32,4,3,92.0,53.580666666666666,3
w13,1536,16,2,1536,768,64,256,32,8,4,2,72.0,57.282,3
w13,1536,16,4,1536,1024,64,256,32,32,4,3,92.0,144.749,3
w13,1536,16,4,1536,1024,64,256,32,8,4,3,92.0,145.29266666666666,3
w13,1536,16,4,1536,1024,64,128,32,8,4,3,52.0,150.189,3
w13,1536,32,4,2048,768,64,128,64,64,8,3,88.0,169.33566666666667,3
w13,1536,32,4,2048,768,64,128,64,1,8,3,88.0,169.68766666666667,3
w13,1536,32,4,2048,768,64,128,64,4,8,3,88.0,169.85833333333332,3
w13,1536,32,6,3072,1024,64,256,64,1,8,3,152.0,441.67766666666665,3
w13,1536,32,6,3072,1024,64,256,64,32,8,3,152.0,443.107,3
w13,1536,32,6,3072,1024,64,256,64,4,8,3,152.0,443.5656666666667,3
w13,1536,60,4,2048,1408,64,128,128,1,8,2,112.0,497.6993333333333,3
w13,1536,60,4,2048,1408,64,128,128,1,4,2,112.0,498.382,3
w13,1536,60,4,2048,1408,128,64,64,1,4,2,64.0,498.94733333333335,3
w13,1536,60,6,3584,2304,64,128,64,1,8,3,88.0,1484.7323333333334,3
w13,1536,60,6,3584,2304,64,128,64,1,4,3,88.0,1494.2683333333334,3
w13,1536,60,6,3584,2304,64,128,128,1,4,2,112.0,1494.6846666666668,3
w13,1536,60,8,2048,1536,128,256,64,1,8,3,208.0,598.2109999999999,3
w13,1536,60,8,2048,1536,256,128,64,1,8,3,208.0,599.0853333333333,3
w13,1536,60,8,2048,1536,128,256,64,64,8,3,208.0,602.9783333333334,3
w13,1536,64,6,3072,2048,256,128,64,1,8,3,208.0,1207.7386666666669,3
w13,1536,64,6,3072,2048,64,128,128,1,4,2,112.0,1210.4586666666669,3
w13,1536,64,6,3072,2048,64,128,64,1,8,3,88.0,1213.4666666666665,3
w13,1536,64,6,3584,1536,64,128,64,1,8,3,88.0,1052.922,3
w13,1536,64,6,3584,1536,64,128,128,1,4,2,112.0,1055.2473333333337,3
w13,1536,64,6,3584,1536,64,128,64,1,4,3,88.0,1059.5996666666667,3
w13,1536,64,8,3584,2560,64,128,64,1,8,3,88.0,1770.1413333333333,3
w13,1536,64,8,3584,2560,64,128,64,1,4,3,88.0,1783.5166666666669,3
w13,1536,64,8,3584,2560,256,128,64,1,8,3,208.0,1793.17,3
w13,1536,128,4,2048,512,64,128,64,1,8,2,64.0,371.09633333333335,3
w13,1536,128,4,2048,512,64,256,64,1,8,2,112.0,371.2346666666666,3
w13,1536,128,4,2048,512,64,64,64,1,8,2,40.0,371.66166666666663,3
w13,1536,128,6,4096,2048,64,64,128,1,8,2,72.0,2907.702333333333,3
w13,1536,128,6,4096,2048,128,256,64,1,8,3,208.0,2914.497,3
w13,1536,128,6,4096,2048,64,128,128,1,8,3,160.0,2917.014333333333,3
w13,1536,128,8,2048,768,64,64,128,1,4,2,72.0,577.037,3
w13,1536,128,8,2048,768,32,64,64,1,4,2,28.0,577.2616666666667,3
w13,1536,128,8,2048,768,64,64,128,4,4,2,72.0,577.7520000000001,3
w13,1536,128,8,4096,1536,128,64,64,1,4,2,64.0,2217.2556666666665,3
w13,1536,128,8,4096,1536,128,64,128,1,8,3,160.0,2217.489666666667,3
w13,1536,128,8,4096,1536,128,64,128,1,4,3,160.0,2221.458,3
w13,1536,128,8,4096,3072,64,64,128,1,8,2,72.0,4417.176666666666,3
w13,1536,128,8,4096,3072,64,128,128,1,8,3,160.0,4418.628,3
w13,1536,128,8,4096,3072,64,128,128,1,4,3,160.0,4420.163666666666,3
w13,2048,8,2,1024,512,64,128,32,8,4,2,40.0,33.698,3
w13,2048,8,2,1024,512,64,128,32,8,4,3,52.0,33.815333333333335,3
w13,2048,8,2,1024,512,64,128,32,8,8,2,40.0,34.69,3
w13,2048,16,2,1536,768,64,128,64,1,8,3,88.0,78.10333333333334,3
w13,2048,16,2,1536,768,128,64,64,16,8,3,88.0,78.99933333333333,3
w13,2048,16,2,1536,768,64,128,64,16,8,3,88.0,79.22333333333334,3
w13,2048,16,4,1536,1024,256,128,64,1,8,3,208.0,162.946,3
w13,2048,16,4,1536,1024,128,256,64,1,8,3,208.0,164.74866666666665,3
w13,2048,16,4,1536,1024,128,256,64,32,8,3,208.0,167.28733333333332,3
w13,2048,32,4,2048,768,64,128,64,1,8,3,88.0,191.38433333333333,3
w13,2048,32,4,2048,768,128,64,64,16,8,3,88.0,191.629,3
w13,2048,32,4,2048,768,128,64,64,1,8,3,88.0,192.258,3
w13,2048,32,6,3072,1024,128,256,64,1,8,3,208.0,512.1196666666667,3
w13,2048,32,6,3072,1024,128,128,64,1,4,3,128.0,514.5303333333333,3
w13,2048,32,6,3072,1024,128,128,64,4,4,2,96.0,515.491,3
w13,2048,60,4,2048,1408,64,128,64,1,4,2,64.0,519.5766666666667,3
w13,2048,60,4,2048,1408,64,128,64,4,4,2,64.0,521.4856666666666,3
w13,2048,60,4,2048,1408,64,128,64,4,8,3,88.0,521.955,3
w13,2048,60,6,3584,2304,256,128,64,1,8,3,208.0,1545.6826666666666,3
w13,2048,60,6,3584,2304,128,256,64,16,8,3,208.0,1596.1466666666668,3
w13,2048,60,6,3584,2304,128,256,64,32,8,3,208.0,1604.8186666666668,3
w13,2048,60,8,2048,1536,64,128,64,64,8,3,88.0,808.835,3
w13,2048,60,8,2048,1536,64,128,64,1,8,3,88.0,808.8776666666666,3
w13,2048,60,8,2048,1536,64,128,64,64,4,3,88.0,810.7123333333334,3
w13,2048,64,6,3072,2048,256,128,64,1,8,3,208.0,1234.330333333333,3
w13,2048,64,6,3072,2048,64,128,64,1,8,3,88.0,1235.2693333333334,3
w13,2048,64,6,3072,2048,64,128,64,1,4,3,88.0,1242.288,3
w13,2048,64,6,3584,1536,64,128,64,1,8,3,88.0,1072.196,3
w13,2048,64,6,3584,1536,64,128,64,1,4,3,88.0,1079.994333333333,3
w13,2048,64,6,3584,1536,64,128,64,4,8,3,88.0,1080.133,3
w13,2048,64,8,3584,2560,256,128,64,1,8,3,208.0,1856.1993333333332,3
w13,2048,64,8,3584,2560,128,256,64,16,8,3,208.0,1885.597,3
w13,2048,64,8,3584,2560,128,256,64,32,8,3,208.0,1902.952,3
w13,2048,128,4,2048,512,64,128,64,4,4,2,64.0,376.07766666666663,3
w13,2048,128,4,2048,512,64,64,128,4,4,2,72.0,376.39733333333334,3
w13,2048,128,4,2048,512,64,64,128,1,4,2,72.0,376.90933333333334,3
w13,2048,128,6,4096,2048,128,256,64,1,8,3,208.0,2933.002,3
w13,2048,128,6,4096,2048,128,128,64,1,8,3,128.0,2939.3703333333337,3
w13,2048,128,6,4096,2048,64,64,128,1,8,2,72.0,2941.781333333334,3
w13,2048,128,8,2048,768,64,64,64,4,4,3,56.0,589.1436666666667,3
w13,2048,128,8,2048,768,64,64,64,1,4,3,56.0,589.6883333333334,3
w13,2048,128,8,2048,768,64,64,64,32,4,3,56.0,589.9870000000001,3
w13,2048,128,8,4096,1536,128,64,128,1,8,3,160.0,2241.414,3
w13,2048,128,8,4096,1536,128,64,64,1,4,2,64.0,2241.820333333333,3
w13,2048,128,8,4096,1536,64,128,64,4,4,2,64.0,2242.1723333333334,3
w13,2048,128,8,4096,3072,64,128,128,1,8,3,160.0,4465.752,3
w13,2048,128,8,4096,3072,128,128,64,1,8,3,128.0,4472.226,3
w13,2048,128,8,4096,3072,64,128,128,4,4,2,112.0,4475.170666666666,3
w13,3072,8,2,1024,512,64,128,64,1,8,3,88.0,53.580666666666666,3
w13,3072,8,2,1024,512,64,128,32,8,8,3,52.0,53.87966666666667,3
w13,3072,8,2,1024,512,64,128,32,8,8,4,64.0,53.975,3
w13,3072,16,2,1536,768,128,256,64,1,8,3,208.0,107.83133333333336,3
w13,3072,16,2,1536,768,64,256,32,8,4,3,92.0,109.00466666666668,3
w13,3072,16,2,1536,768,128,256,64,32,8,3,208.0,109.04733333333331,3
w13,3072,16,4,1536,1024,128,128,64,32,4,2,96.0,260.6846666666667,3
w13,3072,16,4,1536,1024,128,128,64,16,4,2,96.0,261.30333333333334,3
w13,3072,16,4,1536,1024,128,128,64,4,4,2,96.0,261.3143333333333,3
w13,3072,32,4,2048,768,128,128,64,1,4,2,96.0,267.58666666666664,3
w13,3072,32,4,2048,768,128,128,64,8,4,2,96.0,269.5276666666667,3
w13,3072,32,4,2048,768,128,128,64,4,4,2,96.0,270.79733333333337,3
w13,3072,32,6,3072,1024,128,256,64,1,8,3,208.0,717.582,3
w13,3072,32,6,3072,1024,128,256,64,16,8,3,208.0,727.6300000000001,3
w13,3072,32,6,3072,1024,128,256,64,64,8,3,208.0,729.0806666666667,3
w13,3072,60,4,2048,1408,128,64,64,16,4,3,88.0,571.5123333333333,3
w13,3072,60,4,2048,1408,128,128,64,1,4,2,96.0,572.099,3
w13,3072,60,4,2048,1408,128,256,64,1,8,3,208.0,578.4456666666666,3
w13,3072,60,6,3584,2304,64,256,64,1,8,3,152.0,2129.6306666666665,3
w13,3072,60,6,3584,2304,64,256,64,64,8,3,152.0,2137.385,3
w13,3072,60,6,3584,2304,64,256,64,1,4,3,152.0,2137.982333333334,3
w13,3072,60,8,2048,1536,64,256,32,8,4,3,92.0,1045.070333333333,3
w13,3072,60,8,2048,1536,64,256,32,32,4,3,92.0,1071.6733333333334,3
w13,3072,60,8,2048,1536,256,128,64,1,8,3,208.0,1077.369333333333,3
w13,3072,64,6,3072,2048,64,128,64,64,4,3,88.0,1711.3226666666667,3
w13,3072,64,6,3072,2048,64,256,64,1,8,3,152.0,1712.8696666666667,3
w13,3072,64,6,3072,2048,64,128,64,16,4,3,88.0,1717.3926666666666,3
w13,3072,64,6,3584,1536,64,256,64,1,8,3,152.0,1504.688666666667,3
w13,3072,64,6,3584,1536,64,256,64,16,8,3,152.0,1511.8246666666666,3
w13,3072,64,6,3584,1536,64,256,64,1,4,3,152.0,1514.3206666666665,3
w13,3072,64,8,3584,2560,128,256,64,1,8,3,208.0,2568.286333333333,3
w13,3072,64,8,3584,2560,128,256,64,64,8,3,208.0,2572.702333333333,3
w13,3072,64,8,3584,2560,128,256,64,32,8,3,208.0,2578.7509999999997,3
w13,3072,128,4,2048,512,128,64,64,1,8,3,88.0,391.597,3
w13,3072,128,4,2048,512,64,128,64,4,4,2,64.0,391.88533333333334,3
w13,3072,128,4,2048,512,128,128,64,1,8,3,128.0,392.173,3
w13,3072,128,6,4096,2048,256,128,64,1,8,3,208.0,3027.905,3
w13,3072,128,6,4096,2048,64,128,64,1,4,3,88.0,3030.709666666667,3
w13,3072,128,6,4096,2048,64,128,64,1,8,3,88.0,3037.2166666666667,3
w13,3072,128,8,2048,768,64,128,64,1,8,3,88.0,617.677,3
w13,3072,128,8,2048,768,64,128,64,4,8,3,88.0,620.6419999999999,3
w13,3072,128,8,2048,768,64,128,64,1,4,3,88.0,621.9756666666667,3
w13,3072,128,8,4096,1536,64,128,64,1,8,3,88.0,2324.443333333333,3
w13,3072,128,8,4096,1536,64,128,64,1,4,3,88.0,2327.9216666666666,3
w13,3072,128,8,4096,1536,64,128,64,4,4,3,88.0,2336.423,3
w13,3072,128,8,4096,3072,256,128,64,1,8,3,208.0,4627.2119999999995,3
w13,3072,128,8,4096,3072,64,128,64,1,8,3,88.0,4658.903,3
w13,3072,128,8,4096,3072,64,128,64,1,4,3,88.0,4672.268333333333,3
w13,4096,8,2,1024,512,128,128,64,8,4,2,96.0,63.159333333333336,3
w13,4096,8,2,1024,512,128,128,64,16,4,2,96.0,63.25533333333333,3
w13,4096,8,2,1024,512,128,128,64,4,4,2,96.0,63.37233333333333,3
w13,4096,16,2,1536,768,64,256,32,8,4,3,92.0,139.085,3
w13,4096,16,2,1536,768,64,256,32,32,4,3,92.0,139.76766666666666,3
w13,4096,16,2,1536,768,128,128,64,1,4,2,96.0,143.33,3
w13,4096,16,4,1536,1024,256,128,64,1,8,3,208.0,319.7993333333333,3
w13,4096,16,4,1536,1024,128,256,64,1,8,3,208.0,323.76800000000003,3
w13,4096,16,4,1536,1024,128,128,64,64,4,2,96.0,323.853,3
w13,4096,32,4,2048,768,256,128,64,1,8,3,208.0,342.5416666666667,3
w13,4096,32,4,2048,768,128,128,64,64,4,2,96.0,342.98966666666666,3
w13,4096,32,4,2048,768,128,128,64,1,4,2,96.0,343.82166666666666,3
w13,4096,32,6,3072,1024,256,128,64,1,8,3,208.0,897.2946666666667,3
w13,4096,32,6,3072,1024,128,256,64,1,8,3,208.0,911.214,3
w13,4096,32,6,3072,1024,128,256,64,64,8,3,208.0,925.8273333333332,3
w13,4096,60,4,2048,1408,64,128,64,64,4,3,88.0,735.7473333333334,3
w13,4096,60,4,2048,1408,64,128,64,64,8,3,88.0,738.1796666666665,3
w13,4096,60,4,2048,1408,64,128,64,1,8,3,88.0,740.569,3
w13,4096,60,6,3584,2304,256,128,64,1,8,3,208.0,2674.6033333333335,3
w13,4096,60,6,3584,2304,128,256,64,1,8,3,208.0,2727.7763333333332,3
w13,4096,60,6,3584,2304,128,256,64,16,8,3,208.0,2758.006,3
w13,4096,60,8,2048,1536,64,256,32,8,4,3,92.0,1347.7793333333332,3
w13,4096,60,8,2048,1536,64,256,32,32,4,3,92.0,1350.1046666666668,3
w13,4096,60,8,2048,1536,128,256,64,1,8,3,208.0,1371.2886666666666,3
w13,4096,64,6,3072,2048,128,256,64,1,8,3,208.0,1765.4036666666668,3
w13,4096,64,6,3072,2048,128,256,64,32,8,3,208.0,1788.486,3
w13,4096,64,6,3072,2048,128,256,64,64,8,3,208.0,1789.457,3
w13,4096,64,6,3584,1536,128,256,64,1,8,3,208.0,1565.6053333333332,3
w13,4096,64,6,3584,1536,128,256,64,64,8,3,208.0,1586.3623333333333,3
w13,4096,64,6,3584,1536,128,256,64,32,8,3,208.0,1586.726,3
w13,4096,64,8,3584,2560,256,128,64,1,8,3,208.0,3301.313,3
w13,4096,64,8,3584,2560,128,256,64,1,8,3,208.0,3342.091,3
w13,4096,64,8,3584,2560,128,256,64,16,8,3,208.0,3381.921333333333,3
w13,4096,128,4,2048,512,64,128,64,1,8,4,112.0,401.1756666666667,3
w13,4096,128,4,2048,512,128,64,64,1,4,2,64.0,401.4316666666667,3
w13,4096,128,4,2048,512,64,128,64,4,4,2,64.0,401.634,3
w13,4096,128,6,4096,2048,64,128,64,1,4,3,88.0,3078.1209999999996,3
w13,4096,128,6,4096,2048,64,128,64,4,8,3,88.0,3083.795666666667,3
w13,4096,128,6,4096,2048,256,128,64,1,8,3,208.0,3086.825666666666,3
w13,4096,128,8,2048,768,128,256,64,1,8,3,208.0,700.3653333333333,3
w13,4096,128,8,2048,768,256,128,64,1,8,3,208.0,701.645,3
w13,4096,128,8,2048,768,128,256,64,64,8,3,208.0,706.0606666666666,3
w13,4096,128,8,4096,1536,256,128,64,1,8,3,208.0,2563.61,3
w13,4096,128,8,4096,1536,128,256,64,16,8,3,208.0,2609.956333333333,3
w13,4096,128,8,4096,1536,128,256,64,32,8,3,208.0,2610.607333333334,3
w13,4096,128,8,4096,3072,256,128,64,1,8,3,208.0,4779.477666666667,3
w13,4096,128,8,4096,3072,128,256,64,16,8,3,208.0,4830.997333333334,3
w13,4096,128,8,4096,3072,128,256,64,32,8,3,208.0,4857.973000000001,3
