pipetuning_test/moe_dse/moe_dse_A40_99.csv
weight_type,M,E,topk,H,N,BLOCK_SIZE_M,BLOCK_SIZE_N,BLOCK_SIZE_K,GROUP_SIZE_M,num_warps,num_stages,avg_duration,sample_count
w13,1,8,2,1024,512,16,32,128,1,4,4,5.143666666666667,3
w13,1,8,2,1024,512,16,32,128,4,4,4,5.153666666666666,3
w13,1,8,2,1024,512,16,32,128,16,4,4,5.175666666666667,3
w13,1,8,2,1024,512,16,32,128,32,4,4,5.186333333333334,3
w13,1,8,2,1024,512,16,32,128,64,4,4,5.186,3
w13,1,16,2,1536,768,16,16,256,4,4,2,19.266,3
w13,1,16,4,1536,1024,16,16,128,1,4,2,46.701,3
w13,1,16,4,1536,1024,16,16,128,4,4,2,46.711666666666666,3
w13,1,16,4,1536,1024,16,16,128,4,4,3,46.74366666666666,3
w13,1,16,4,1536,1024,16,32,128,1,4,2,46.626000000000005,3
w13,1,16,4,1536,1024,16,32,128,1,4,3,46.85033333333334,3
w13,1,16,4,1536,1024,16,32,128,1,4,4,46.80766666666667,3
w13,1,16,4,1536,1024,16,32,128,1,8,2,46.87166666666667,3
w13,1,16,4,1536,1024,16,32,128,4,4,2,46.435,3
w13,1,16,4,1536,1024,16,32,128,4,4,4,46.78666666666667,3
w13,1,16,4,1536,1024,16,32,128,16,4,2,46.594,3
w13,1,16,4,1536,1024,16,32,128,16,4,3,46.87166666666667,3
w13,1,16,4,1536,1024,16,32,128,16,4,4,46.77533333333334,3
w13,1,16,4,1536,1024,16,32,128,32,4,2,46.50933333333333,3
w13,1,16,4,1536,1024,16,32,128,32,8,2,46.81833333333333,3
w13,1,16,4,1536,1024,16,32,128,64,4,2,46.583666666666666,3
w13,1,16,4,1536,1024,16,32,128,64,4,3,46.80766666666667,3
w13,1,16,4,1536,1024,16,64,128,1,8,2,46.80766666666667,3
w13,1,16,4,1536,1024,16,64,128,16,8,2,46.62633333333334,3
w13,1,16,4,1536,1024,16,64,128,32,8,2,46.775666666666666,3
w13,1,16,4,1536,1024,32,16,128,4,4,2,46.775666666666666,3
w13,1,16,4,1536,1024,32,32,128,1,4,2,46.74333333333334,3
w13,1,16,4,1536,1024,32,32,128,4,4,2,46.797,3
w13,1,16,4,1536,1024,32,32,128,16,4,2,46.893,3
w13,1,16,4,1536,1024,32,32,128,64,4,2,46.78633333333334,3
w13,1,32,4,2048,768,16,16,128,4,4,2,46.25333333333333,3
w13,1,32,4,2048,768,16,32,128,4,4,2,45.99699999999999,3
w13,1,32,4,2048,768,16,32,128,4,8,2,46.29566666666667,3
w13,1,32,4,2048,768,16,32,128,16,4,2,46.135333333333335,3
w13,1,32,4,2048,768,16,32,128,32,4,2,45.964666666666666,3
w13,1,32,4,2048,768,16,32,128,64,4,2,46.02866666666667,3
w13,1,32,4,2048,768,16,32,128,64,8,2,46.28433333333333,3
w13,1,32,4,2048,768,16,64,128,1,8,2,46.36033333333334,3
w13,1,32,4,2048,768,16,64,128,16,8,2,46.40233333333333,3
w13,1,32,4,2048,768,16,64,128,32,8,2,46.37033333333333,3
w13,1,32,4,2048,768,16,64,128,64,8,2,46.327666666666666,3
w13,1,32,4,2048,768,32,32,128,4,4,2,46.18866666666667,3
w13,1,32,4,2048,768,32,32,128,16,4,2,46.178,3
w13,1,32,4,2048,768,32,32,128,64,4,2,46.220666666666666,3
w13,1,32,4,2048,768,32,32,128,64,8,2,46.40233333333333,3
w13,1,32,6,3072,1024,16,16,128,1,4,3,133.33599999999998,3
w13,1,32,6,3072,1024,16,16,128,4,4,3,133.32566666666665,3
w13,1,32,6,3072,1024,16,16,256,1,4,4,132.55766666666668,3
w13,1,32,6,3072,1024,16,16,256,4,4,2,133.32566666666665,3
w13,1,32,6,3072,1024,16,16,256,4,4,4,132.04600000000002,3
w13,1,32,6,3072,1024,16,16,256,4,8,4,133.12300000000002,3
w13,1,32,6,3072,1024,16,32,128,1,4,2,132.6,3
w13,1,32,6,3072,1024,16,32,128,1,4,4,132.71733333333336,3
w13,1,32,6,3072,1024,16,32,128,4,4,2,133.08066666666664,3
w13,1,32,6,3072,1024,16,32,128,4,4,3,132.81333333333333,3
w13,1,32,6,3072,1024,16,32,128,4,4,4,132.717,3
w13,1,32,6,3072,1024,16,32,128,16,4,2,132.73800000000003,3
w13,1,32,6,3072,1024,16,32,128,16,4,3,132.792,3
w13,1,32,6,3072,1024,16,32,128,16,4,4,132.33333333333334,3
w13,1,32,6,3072,1024,16,32,128,32,4,2,132.835,3
w13,1,32,6,3072,1024,16,32,128,32,4,3,132.73866666666666,3
w13,1,32,6,3072,1024,16,32,128,32,4,4,132.48266666666666,3
w13,1,32,6,3072,1024,16,32,128,64,4,2,132.64266666666666,3
w13,1,32,6,3072,1024,16,32,128,64,4,3,132.771,3
w13,1,32,6,3072,1024,16,32,128,64,4,4,132.38666666666668,3
w13,1,32,6,3072,1024,16,32,256,1,4,3,132.42899999999997,3
w13,1,32,6,3072,1024,16,32,256,1,8,3,132.20566666666664,3
w13,1,32,6,3072,1024,16,32,256,1,8,4,133.33566666666664,3
w13,1,32,6,3072,1024,16,32,256,16,4,3,132.82399999999998,3
w13,1,32,6,3072,1024,16,32,256,16,8,3,132.80233333333334,3
w13,1,32,6,3072,1024,16,32,256,32,4,3,132.739,3
w13,1,32,6,3072,1024,16,32,256,32,8,3,132.49366666666666,3
w13,1,32,6,3072,1024,16,32,256,64,4,3,132.72799999999998,3
w13,1,32,6,3072,1024,16,32,256,64,8,3,132.21633333333332,3
w13,1,32,6,3072,1024,16,64,128,1,8,2,133.16566666666665,3
w13,1,32,6,3072,1024,16,64,128,16,4,2,133.0053333333333,3
w13,1,32,6,3072,1024,16,64,128,16,8,2,133.048,3
w13,1,32,6,3072,1024,16,64,128,16,8,3,133.208,3
w13,1,32,6,3072,1024,16,64,128,16,8,4,133.12266666666667,3
w13,1,32,6,3072,1024,16,64,128,32,4,2,133.07966666666667,3
w13,1,32,6,3072,1024,16,64,128,32,8,2,133.176,3
w13,1,32,6,3072,1024,16,64,128,32,8,3,133.10166666666666,3
w13,1,32,6,3072,1024,16,64,128,32,8,4,133.347,3
w13,1,32,6,3072,1024,16,64,128,64,4,2,132.92,3
w13,1,32,6,3072,1024,16,64,128,64,8,2,132.856,3
w13,1,32,6,3072,1024,16,64,128,64,8,3,133.02666666666664,3
w13,1,32,6,3072,1024,16,64,128,64,8,4,133.19733333333332,3
w13,1,32,6,3072,1024,32,16,128,4,4,3,133.37866666666665,3
w13,1,32,6,3072,1024,32,16,128,4,4,4,132.34366666666668,3
w13,1,32,6,3072,1024,32,32,128,1,4,2,133.10133333333332,3
w13,1,32,6,3072,1024,32,32,128,1,4,3,133.22933333333333,3
w13,1,32,6,3072,1024,32,32,128,1,8,2,133.37866666666665,3
w13,1,32,6,3072,1024,32,32,128,4,4,3,133.123,3
w13,1,32,6,3072,1024,32,32,128,4,8,3,133.33633333333333,3
w13,1,32,6,3072,1024,32,32,128,16,4,3,133.16533333333334,3
w13,1,32,6,3072,1024,32,32,128,16,4,4,133.32566666666665,3
w13,1,32,6,3072,1024,32,32,128,64,4,3,133.133,3
w13,1,32,6,3072,1024,32,32,128,64,4,4,133.36800000000002,3
w13,1,32,6,3072,1024,32,32,128,64,8,3,133.29333333333332,3
w13,1,32,6,3072,1024,32,32,256,1,4,3,132.22633333333332,3
w13,1,32,6,3072,1024,32,32,256,1,8,3,132.33266666666665,3
w13,1,32,6,3072,1024,32,32,256,4,4,3,132.54666666666665,3
w13,1,32,6,3072,1024,32,32,256,4,8,3,132.20533333333336,3
w13,1,32,6,3072,1024,32,32,256,16,4,3,132.67433333333335,3
w13,1,32,6,3072,1024,32,32,256,16,8,3,132.53533333333334,3
w13,1,32,6,3072,1024,32,32,256,32,4,3,132.42933333333335,3
w13,1,32,6,3072,1024,32,32,256,32,8,3,132.30133333333333,3
w13,1,32,6,3072,1024,32,64,128,4,8,2,133.33599999999998,3
w13,1,32,6,3072,1024,32,64,128,4,8,3,133.379,3
w13,1,32,6,3072,1024,32,64,128,16,8,2,133.19766666666666,3
w13,1,32,6,3072,1024,32,64,128,32,8,2,133.32566666666665,3
w13,1,60,4,2048,1408,16,16,128,1,4,3,82.00733333333334,3
w13,1,60,4,2048,1408,16,16,128,4,4,3,82.028,3
w13,1,60,4,2048,1408,16,16,256,1,4,3,81.90066666666667,3
w13,1,60,4,2048,1408,16,16,256,1,8,3,82.19933333333333,3
w13,1,60,4,2048,1408,16,16,256,4,4,2,82.42333333333333,3
w13,1,60,4,2048,1408,16,16,256,4,4,3,81.60199999999999,3
w13,1,60,4,2048,1408,16,16,256,4,8,3,82.25233333333334,3
w13,1,60,4,2048,1408,16,32,128,4,4,2,82.16733333333333,3
w13,1,60,4,2048,1408,16,32,128,4,8,2,82.423,3
w13,1,60,4,2048,1408,16,32,128,16,4,2,82.15633333333334,3
w13,1,60,4,2048,1408,16,32,128,32,4,2,82.242,3
w13,1,60,4,2048,1408,16,32,128,64,4,2,82.29533333333335,3
w13,1,60,4,2048,1408,32,32,128,64,4,2,82.41266666666667,3
w13,1,60,6,3584,2304,16,16,256,1,4,3,336.50433333333336,3
w13,1,60,6,3584,2304,16,16,256,4,4,3,335.2666666666667,3
w13,1,60,6,3584,2304,16,16,256,4,4,4,338.43466666666666,3
w13,1,60,6,3584,2304,16,16,256,4,8,3,338.435,3
w13,1,60,6,3584,2304,16,32,256,1,4,3,337.6773333333333,3
w13,1,60,6,3584,2304,16,32,256,1,8,3,338.10433333333333,3
w13,1,60,6,3584,2304,16,32,256,16,4,3,337.699,3
w13,1,60,6,3584,2304,16,32,256,32,4,3,338.4666666666667,3
w13,1,60,6,3584,2304,16,32,256,64,4,3,338.64733333333334,3
w13,1,60,6,3584,2304,32,32,256,1,4,3,336.54699999999997,3
w13,1,60,6,3584,2304,32,32,256,1,8,3,337.6456666666666,3
w13,1,60,6,3584,2304,32,32,256,4,4,3,336.9203333333333,3
w13,1,60,6,3584,2304,32,32,256,4,8,3,337.443,3
w13,1,60,6,3584,2304,32,32,256,16,4,3,337.33633333333336,3
w13,1,60,6,3584,2304,32,32,256,16,8,3,337.955,3
w13,1,60,6,3584,2304,32,32,256,32,4,3,337.33633333333336,3
w13,1,60,6,3584,2304,32,32,256,32,8,3,337.976,3
w13,1,60,8,2048,1536,16,16,128,1,4,3,174.73299999999998,3
w13,1,60,8,2048,1536,16,16,128,4,4,3,174.56233333333333,3
w13,1,60,8,2048,1536,16,16,128,4,4,4,174.58399999999997,3
w13,1,60,8,2048,1536,16,16,256,1,4,3,173.229,3
w13,1,60,8,2048,1536,16,16,256,1,4,4,173.51733333333334,3
w13,1,60,8,2048,1536,16,16,256,4,4,3,173.7413333333333,3
w13,1,60,8,2048,1536,16,16,256,4,4,4,173.70900000000003,3
w13,1,60,8,2048,1536,16,32,128,1,4,4,174.861,3
w13,1,60,8,2048,1536,16,32,128,4,4,4,174.3273333333333,3
w13,1,60,8,2048,1536,16,32,128,4,8,4,174.78666666666666,3
w13,1,60,8,2048,1536,16,32,128,16,4,3,174.69066666666666,3
w13,1,60,8,2048,1536,16,32,128,16,4,4,174.58399999999997,3
w13,1,60,8,2048,1536,16,32,128,32,4,3,174.883,3
w13,1,60,8,2048,1536,16,32,128,32,4,4,174.35966666666664,3
w13,1,60,8,2048,1536,16,32,128,64,4,3,174.968,3
w13,1,60,8,2048,1536,16,32,128,64,4,4,174.52033333333335,3
w13,1,60,8,2048,1536,16,32,256,1,4,3,174.008,3
w13,1,60,8,2048,1536,16,32,256,1,4,4,174.44500000000002,3
w13,1,60,8,2048,1536,16,32,256,1,8,3,174.53033333333335,3
w13,1,60,8,2048,1536,16,32,256,1,8,4,174.0293333333333,3
w13,1,60,8,2048,1536,16,32,256,16,4,3,173.549,3
w13,1,60,8,2048,1536,16,32,256,16,8,3,174.11433333333335,3
w13,1,60,8,2048,1536,16,32,256,32,4,3,173.55966666666666,3
w13,1,60,8,2048,1536,16,32,256,32,8,3,173.82633333333334,3
w13,1,60,8,2048,1536,16,32,256,64,4,3,173.46400000000003,3
w13,1,60,8,2048,1536,16,32,256,64,8,3,174.26333333333332,3
w13,1,60,8,2048,1536,16,64,128,1,8,4,174.97799999999998,3
w13,1,60,8,2048,1536,16,64,256,1,8,3,174.88266666666667,3
w13,1,60,8,2048,1536,16,64,256,16,8,3,174.78599999999997,3
w13,1,60,8,2048,1536,16,64,256,64,8,3,174.81799999999998,3
w13,1,60,8,2048,1536,32,16,128,4,4,3,174.45533333333333,3
w13,1,64,6,3072,2048,16,16,256,1,4,4,259.98166666666674,3
w13,1,64,6,3072,2048,16,16,256,4,4,3,259.09633333333335,3
w13,1,64,6,3072,2048,16,32,128,4,4,4,260.2803333333333,3
w13,1,64,6,3072,2048,16,32,128,32,4,4,260.40833333333336,3
w13,1,64,6,3072,2048,16,32,256,1,4,3,258.5416666666667,3
w13,1,64,6,3072,2048,16,32,256,1,8,3,259.22433333333333,3
w13,1,64,6,3072,2048,16,32,256,16,4,3,257.83733333333333,3
w13,1,64,6,3072,2048,16,32,256,16,8,3,258.18966666666665,3
w13,1,64,6,3072,2048,16,32,256,32,4,3,258.1046666666667,3
w13,1,64,6,3072,2048,16,32,256,32,8,3,258.33933333333334,3
w13,1,64,6,3072,2048,16,32,256,64,4,3,257.8163333333334,3
w13,1,64,6,3072,2048,16,32,256,64,8,3,258.0933333333333,3
w13,1,64,6,3072,2048,16,64,256,1,4,3,259.96033333333327,3
w13,1,64,6,3072,2048,16,64,256,1,8,3,260.31266666666664,3
w13,1,64,6,3072,2048,16,64,256,16,4,3,260.0563333333334,3
w13,1,64,6,3072,2048,16,64,256,16,8,3,259.8433333333333,3
w13,1,64,6,3072,2048,16,64,256,32,4,3,260.07766666666663,3
w13,1,64,6,3072,2048,16,64,256,32,8,3,260.1516666666667,3
w13,1,64,6,3072,2048,16,64,256,64,4,3,260.0246666666667,3
w13,1,64,6,3072,2048,16,64,256,64,8,3,260.163,3
w13,1,64,6,3072,2048,32,32,256,1,4,3,260.33366666666666,3
w13,1,64,6,3584,1536,16,16,256,1,4,3,225.677,3
w13,1,64,6,3584,1536,16,16,256,1,4,4,227.56500000000003,3
w13,1,64,6,3584,1536,16,16,256,4,4,3,225.43166666666664,3
w13,1,64,6,3584,1536,16,16,256,4,4,4,227.117,3
w13,1,64,6,3584,1536,16,32,256,1,4,3,227.28733333333332,3
w13,1,64,6,3584,1536,16,32,256,16,4,3,227.149,3
w13,1,64,6,3584,1536,16,32,256,32,4,3,227.1916666666667,3
w13,1,64,6,3584,1536,16,32,256,32,8,3,227.59733333333335,3
w13,1,64,6,3584,1536,16,32,256,64,4,3,227.24533333333332,3
w13,1,64,6,3584,1536,32,32,256,1,4,3,226.07166666666663,3
w13,1,64,6,3584,1536,32,32,256,1,8,3,226.63733333333334,3
w13,1,64,6,3584,1536,32,32,256,4,4,3,226.39166666666668,3
w13,1,64,6,3584,1536,32,32,256,4,8,3,226.03966666666668,3
w13,1,64,6,3584,1536,32,32,256,16,4,3,226.54100000000003,3
w13,1,64,6,3584,1536,32,32,256,16,8,3,226.44500000000002,3
w13,1,64,6,3584,1536,32,32,256,32,4,3,226.63700000000003,3
w13,1,64,6,3584,1536,32,32,256,32,8,3,226.658,3
w13,1,64,8,3584,2560,16,16,256,1,4,3,496.29766666666666,3
w13,1,64,8,3584,2560,16,16,256,1,4,4,499.4873333333333,3
w13,1,64,8,3584,2560,16,16,256,4,4,3,495.81766666666664,3
w13,1,64,8,3584,2560,16,16,256,4,4,4,499.34799999999996,3
w13,1,64,8,3584,2560,16,32,256,1,4,3,496.21233333333333,3
w13,1,64,8,3584,2560,16,32,256,1,4,4,499.32733333333334,3
w13,1,64,8,3584,2560,16,32,256,1,8,3,498.78266666666667,3
w13,1,64,8,3584,2560,16,32,256,16,4,3,495.96633333333335,3
w13,1,64,8,3584,2560,16,32,256,16,8,3,497.4493333333333,3
w13,1,64,8,3584,2560,16,32,256,32,4,3,496.16966666666667,3
w13,1,64,8,3584,2560,16,32,256,32,8,3,497.4493333333333,3
w13,1,64,8,3584,2560,16,32,256,64,4,3,495.999,3
w13,1,64,8,3584,2560,16,32,256,64,8,3,497.63033333333334,3
w13,1,64,8,3584,2560,16,64,256,1,4,3,497.80099999999993,3
w13,1,64,8,3584,2560,16,64,256,1,8,3,498.96433333333334,3
w13,1,64,8,3584,2560,16,64,256,16,4,3,497.9186666666667,3
w13,1,64,8,3584,2560,16,64,256,16,8,3,499.2203333333334,3
w13,1,64,8,3584,2560,16,64,256,32,4,3,498.26033333333334,3
w13,1,64,8,3584,2560,16,64,256,32,8,3,498.93266666666665,3
w13,1,64,8,3584,2560,16,64,256,64,4,3,498.2916666666667,3
w13,1,64,8,3584,2560,16,64,256,64,8,3,499.26233333333334,3
w13,1,64,8,3584,2560,32,32,256,1,4,3,495.40166666666664,3
w13,1,64,8,3584,2560,32,32,256,1,8,3,496.8416666666667,3
w13,1,64,8,3584,2560,32,32,256,4,4,3,496.2226666666666,3
w13,1,64,8,3584,2560,32,32,256,4,8,3,497.1936666666666,3
w13,1,64,8,3584,2560,32,32,256,16,4,3,497.0436666666667,3
w13,1,64,8,3584,2560,32,32,256,16,8,3,498.0363333333333,3
w13,1,64,8,3584,2560,32,32,256,32,4,3,496.86266666666666,3
w13,1,64,8,3584,2560,32,32,256,32,8,3,497.96133333333336,3
w13,1,128,4,2048,512,16,16,128,1,4,2,32.08766666666667,3
w13,1,128,4,2048,512,16,16,128,1,4,3,32.08766666666667,3
w13,1,128,4,2048,512,16,16,128,4,4,2,32.141,3
w13,1,128,4,2048,512,16,16,256,4,4,2,31.831666666666667,3
w13,1,128,4,2048,512,16,32,128,1,4,2,32.01266666666667,3
w13,1,128,4,2048,512,16,32,128,1,4,3,32.11966666666667,3
w13,1,128,4,2048,512,16,32,128,1,4,4,31.99166666666667,3
w13,1,128,4,2048,512,16,32,128,4,4,2,32.07666666666667,3
w13,1,128,4,2048,512,16,32,128,4,4,3,32.03433333333333,3
w13,1,128,4,2048,512,16,32,128,16,4,2,31.938333333333333,3
w13,1,128,4,2048,512,16,32,128,16,4,3,32.109,3
w13,1,128,4,2048,512,16,32,128,16,4,4,32.088,3
w13,1,128,4,2048,512,16,32,128,32,4,2,31.89533333333333,3
w13,1,128,4,2048,512,16,32,128,32,4,3,32.12,3
w13,1,128,4,2048,512,16,32,128,32,8,2,32.10866666666667,3
w13,1,128,4,2048,512,16,32,128,64,4,2,32.034666666666666,3
w13,1,128,4,2048,512,16,32,128,64,4,3,32.05566666666667,3
w13,1,128,4,2048,512,16,32,128,64,4,4,32.07666666666667,3
w13,1,128,4,2048,512,16,32,256,16,4,2,32.088,3
w13,1,128,4,2048,512,16,32,256,32,4,2,32.08766666666667,3
w13,1,128,4,2048,512,16,64,128,32,8,3,32.13033333333334,3
w13,1,128,4,2048,512,32,32,128,16,4,2,32.13033333333333,3
w13,1,128,6,4096,2048,16,16,128,4,4,3,345.13433333333336,3
w13,1,128,6,4096,2048,16,16,128,4,4,4,345.0063333333333,3
w13,1,128,6,4096,2048,16,16,256,1,4,4,345.1023333333333,3
w13,1,128,6,4096,2048,16,16,256,4,4,4,345.4653333333334,3
w13,1,128,6,4096,2048,16,32,128,1,4,4,344.8253333333334,3
w13,1,128,6,4096,2048,16,32,128,4,4,4,344.825,3
w13,1,128,6,4096,2048,16,32,128,4,8,4,345.23066666666665,3
w13,1,128,6,4096,2048,16,32,128,16,4,3,345.4866666666667,3
w13,1,128,6,4096,2048,16,32,128,16,4,4,344.8676666666667,3
w13,1,128,6,4096,2048,16,32,128,16,8,4,345.0813333333333,3
w13,1,128,6,4096,2048,16,32,128,32,4,4,344.3876666666667,3
w13,1,128,6,4096,2048,16,32,128,32,8,4,345.1453333333334,3
w13,1,128,6,4096,2048,16,32,128,64,4,4,344.66499999999996,3
w13,1,128,6,4096,2048,16,32,256,1,4,3,342.93699999999995,3
w13,1,128,6,4096,2048,16,32,256,1,8,3,343.33200000000005,3
w13,1,128,6,4096,2048,16,32,256,16,4,3,342.29733333333337,3
w13,1,128,6,4096,2048,16,32,256,16,8,3,342.7773333333333,3
w13,1,128,6,4096,2048,16,32,256,32,4,3,342.66,3
w13,1,128,6,4096,2048,16,32,256,32,8,3,342.63866666666667,3
w13,1,128,6,4096,2048,16,32,256,64,4,3,342.1376666666667,3
w13,1,128,6,4096,2048,16,32,256,64,8,3,342.51033333333334,3
w13,1,128,6,4096,2048,16,64,128,16,4,4,345.39000000000004,3
w13,1,128,6,4096,2048,16,64,128,16,8,4,345.19866666666667,3
w13,1,128,6,4096,2048,16,64,128,64,4,4,345.3586666666667,3
w13,1,128,6,4096,2048,16,64,128,64,8,4,345.19866666666667,3
w13,1,128,6,4096,2048,16,64,256,1,4,3,344.1003333333333,3
w13,1,128,6,4096,2048,16,64,256,1,8,3,344.11033333333336,3
w13,1,128,6,4096,2048,16,64,256,16,4,3,344.1423333333334,3
w13,1,128,6,4096,2048,16,64,256,16,8,3,343.6836666666666,3
w13,1,128,6,4096,2048,16,64,256,32,4,3,343.9826666666666,3
w13,1,128,6,4096,2048,16,64,256,32,8,3,343.79033333333336,3
w13,1,128,6,4096,2048,16,64,256,64,4,3,343.9826666666666,3
w13,1,128,6,4096,2048,16,64,256,64,8,3,343.844,3
w13,1,128,6,4096,2048,32,16,128,4,4,3,344.6123333333333,3
w13,1,128,6,4096,2048,32,32,128,16,4,4,345.2836666666667,3
w13,1,128,6,4096,2048,32,32,128,64,4,4,345.4543333333333,3
w13,1,128,6,4096,2048,32,64,256,1,8,3,344.39866666666666,3
w13,1,128,6,4096,2048,32,64,256,8,8,3,344.3453333333334,3
w13,1,128,6,4096,2048,32,64,256,16,8,3,344.2706666666667,3
w13,1,128,6,4096,2048,32,64,256,32,8,3,344.33500000000004,3
w13,1,128,6,4096,2048,32,64,256,64,8,3,344.24966666666666,3
w13,1,128,8,2048,768,16,16,128,1,4,3,89.41066666666666,3
w13,1,128,8,2048,768,16,16,128,1,4,4,89.45333333333333,3
w13,1,128,8,2048,768,16,16,128,4,4,3,89.19766666666668,3
w13,1,128,8,2048,768,16,16,128,4,4,4,89.41066666666666,3
w13,1,128,8,2048,768,16,16,256,1,4,2,89.389,3
w13,1,128,8,2048,768,16,16,256,1,4,4,88.89866666666667,3
w13,1,128,8,2048,768,16,16,256,4,4,4,88.87733333333334,3
w13,1,128,8,2048,768,16,32,128,1,4,2,89.48466666666667,3
w13,1,128,8,2048,768,16,32,128,1,4,4,89.63433333333334,3
w13,1,128,8,2048,768,16,32,128,4,4,2,89.496,3
w13,1,128,8,2048,768,16,32,128,4,4,3,89.28233333333333,3
w13,1,128,8,2048,768,16,32,128,4,4,4,89.16566666666667,3
w13,1,128,8,2048,768,16,32,128,16,4,2,89.49633333333334,3
w13,1,128,8,2048,768,16,32,128,16,4,3,89.27133333333332,3
w13,1,128,8,2048,768,16,32,128,16,4,4,89.11200000000001,3
w13,1,128,8,2048,768,16,32,128,16,8,2,89.76266666666668,3
w13,1,128,8,2048,768,16,32,128,16,8,3,89.32566666666668,3
w13,1,128,8,2048,768,16,32,128,32,4,2,89.44233333333334,3
w13,1,128,8,2048,768,16,32,128,32,4,3,89.218,3
w13,1,128,8,2048,768,16,32,128,32,4,4,89.45366666666666,3
w13,1,128,8,2048,768,16,32,128,32,8,3,89.18633333333332,3
w13,1,128,8,2048,768,16,32,128,64,4,2,89.46433333333334,3
w13,1,128,8,2048,768,16,32,128,64,4,3,89.25033333333333,3
w13,1,128,8,2048,768,16,32,128,64,4,4,89.38966666666666,3
w13,1,128,8,2048,768,16,32,128,64,8,3,89.315,3
w13,1,128,8,2048,768,16,32,256,1,4,3,89.60266666666666,3
w13,1,128,8,2048,768,16,32,256,1,8,3,89.27133333333335,3
w13,1,128,8,2048,768,16,32,256,1,8,4,89.67733333333332,3
w13,1,128,8,2048,768,16,32,256,16,4,3,89.09066666666666,3
w13,1,128,8,2048,768,16,32,256,16,4,4,89.73066666666666,3
w13,1,128,8,2048,768,16,32,256,16,8,3,89.05866666666668,3
w13,1,128,8,2048,768,16,32,256,16,8,4,89.76199999999999,3
w13,1,128,8,2048,768,16,32,256,32,4,3,89.23966666666666,3
w13,1,128,8,2048,768,16,32,256,32,8,2,89.61333333333333,3
w13,1,128,8,2048,768,16,32,256,64,4,3,89.20766666666668,3
w13,1,128,8,2048,768,16,64,128,16,8,2,89.76233333333334,3
w13,1,128,8,2048,768,32,16,128,4,4,4,89.741,3
w13,1,128,8,2048,768,32,32,128,4,8,3,89.66633333333334,3
w13,1,128,8,2048,768,32,32,128,16,4,2,89.741,3
w13,1,128,8,2048,768,32,32,128,64,4,2,89.77266666666667,3
w13,1,128,8,2048,768,32,32,128,64,4,3,89.68799999999999,3
w13,1,128,8,2048,768,32,32,128,64,8,3,89.67733333333335,3
w13,1,128,8,2048,768,32,32,256,1,8,2,89.59166666666665,3
w13,1,128,8,2048,768,32,32,256,1,8,3,89.613,3
w13,1,128,8,2048,768,32,32,256,4,8,3,89.47466666666666,3
w13,1,128,8,2048,768,32,32,256,16,8,3,89.41066666666667,3
w13,1,128,8,2048,768,32,32,256,32,8,3,89.26133333333333,3
w13,1,128,8,4096,1536,16,16,256,1,4,3,345.1236666666667,3
w13,1,128,8,4096,1536,16,16,256,1,4,4,345.07,3
w13,1,128,8,4096,1536,16,16,256,4,4,3,345.1236666666667,3
w13,1,128,8,4096,1536,16,32,128,1,4,4,344.8673333333333,3
w13,1,128,8,4096,1536,16,32,128,4,4,4,344.9213333333333,3
w13,1,128,8,4096,1536,16,32,128,4,8,4,345.20866666666666,3
w13,1,128,8,4096,1536,16,32,128,16,4,4,345.08099999999996,3
w13,1,128,8,4096,1536,16,32,128,32,4,4,344.921,3
w13,1,128,8,4096,1536,16,32,128,32,8,4,345.44366666666673,3
w13,1,128,8,4096,1536,16,32,128,64,4,4,344.846,3
w13,1,128,8,4096,1536,16,32,256,1,4,3,342.9156666666666,3
w13,1,128,8,4096,1536,16,32,256,1,8,3,344.2486666666667,3
w13,1,128,8,4096,1536,16,32,256,16,4,3,342.06200000000007,3
w13,1,128,8,4096,1536,16,32,256,16,8,3,342.8623333333333,3
w13,1,128,8,4096,1536,16,32,256,32,4,3,342.5956666666666,3
w13,1,128,8,4096,1536,16,32,256,32,8,3,342.8516666666667,3
w13,1,128,8,4096,1536,16,32,256,64,4,3,342.58466666666664,3
w13,1,128,8,4096,1536,16,32,256,64,8,3,342.56333333333333,3
w13,1,128,8,4096,1536,16,64,128,16,4,4,345.06,3
w13,1,128,8,4096,1536,16,64,128,16,8,4,345.10200000000003,3
w13,1,128,8,4096,1536,16,64,128,64,8,4,345.49666666666667,3
w13,1,128,8,4096,1536,16,64,256,1,4,3,344.0143333333333,3
w13,1,128,8,4096,1536,16,64,256,1,8,3,343.897,3
w13,1,128,8,4096,1536,16,64,256,16,4,3,343.97133333333335,3
w13,1,128,8,4096,1536,16,64,256,16,8,3,343.3956666666666,3
w13,1,128,8,4096,1536,16,64,256,32,4,3,343.49133333333333,3
w13,1,128,8,4096,1536,16,64,256,32,8,3,343.88633333333337,3
w13,1,128,8,4096,1536,16,64,256,64,4,3,343.66200000000003,3
w13,1,128,8,4096,1536,16,64,256,64,8,3,343.56600000000003,3
w13,1,128,8,4096,1536,32,16,128,4,4,3,344.7293333333333,3
w13,1,128,8,4096,1536,32,32,128,4,8,4,345.50766666666664,3
w13,1,128,8,4096,1536,32,64,128,64,8,4,345.39000000000004,3
w13,1,128,8,4096,1536,32,64,256,1,8,3,344.6006666666667,3
w13,1,128,8,4096,1536,32,64,256,8,4,3,345.422,3
w13,1,128,8,4096,1536,32,64,256,8,8,3,344.2383333333333,3
w13,1,128,8,4096,1536,32,64,256,16,8,3,344.3446666666667,3
w13,1,128,8,4096,1536,32,64,256,32,8,3,344.28099999999995,3
w13,1,128,8,4096,1536,32,64,256,64,8,3,344.29133333333334,3
w13,1,128,8,4096,3072,16,16,256,1,4,3,677.5603333333333,3
w13,1,128,8,4096,3072,16,16,256,1,4,4,679.8753333333333,3
w13,1,128,8,4096,3072,16,16,256,4,4,3,679.1073333333333,3
w13,1,128,8,4096,3072,16,16,256,4,4,4,681.134,3
w13,1,128,8,4096,3072,16,32,256,1,4,3,680.6326666666666,3
w13,1,128,8,4096,3072,16,32,256,1,4,4,680.4726666666667,3
w13,1,128,8,4096,3072,16,32,256,1,8,3,684.1203333333333,3
w13,1,128,8,4096,3072,16,32,256,1,8,4,681.464,3
w13,1,128,8,4096,3072,16,32,256,16,4,3,679.79,3
w13,1,128,8,4096,3072,16,32,256,16,4,4,681.2723333333333,3
w13,1,128,8,4096,3072,16,32,256,16,8,3,683.2033333333334,3
w13,1,128,8,4096,3072,16,32,256,16,8,4,683.6406666666667,3
w13,1,128,8,4096,3072,16,32,256,32,4,3,680.7073333333333,3
w13,1,128,8,4096,3072,16,32,256,32,4,4,682.4986666666667,3
w13,1,128,8,4096,3072,16,32,256,32,8,4,683.2666666666668,3
w13,1,128,8,4096,3072,16,32,256,64,4,3,680.9953333333333,3
w13,1,128,8,4096,3072,16,32,256,64,4,4,681.699,3
w13,1,128,8,4096,3072,16,32,256,64,8,3,680.2273333333334,3
w13,1,128,8,4096,3072,16,32,256,64,8,4,683.4806666666667,3
w13,1,128,8,4096,3072,16,64,256,1,4,3,680.5683333333333,3
w13,1,128,8,4096,3072,16,64,256,1,8,3,681.955,3
w13,1,128,8,4096,3072,16,64,256,16,4,3,681.6776666666666,3
w13,1,128,8,4096,3072,16,64,256,16,8,3,682.275,3
w13,1,128,8,4096,3072,16,64,256,32,4,3,681.07,3
w13,1,128,8,4096,3072,16,64,256,32,8,3,683.1713333333333,3
w13,1,128,8,4096,3072,16,64,256,64,4,3,682.254,3
w13,1,128,8,4096,3072,16,64,256,64,8,3,682.6806666666668,3
w13,1,128,8,4096,3072,32,32,256,1,4,3,679.438,3
w13,1,128,8,4096,3072,32,32,256,1,4,4,682.5313333333334,3
w13,1,128,8,4096,3072,32,32,256,1,8,3,680.6116666666667,3
w13,1,128,8,4096,3072,32,32,256,1,8,4,682.7553333333334,3
w13,1,128,8,4096,3072,32,32,256,4,4,3,679.3736666666667,3
w13,1,128,8,4096,3072,32,32,256,4,4,4,682.9796666666666,3
w13,1,128,8,4096,3072,32,32,256,4,8,3,680.6753333333332,3
w13,1,128,8,4096,3072,32,32,256,4,8,4,684.2913333333332,3
w13,1,128,8,4096,3072,32,32,256,16,4,3,679.8543333333333,3
w13,1,128,8,4096,3072,32,32,256,16,4,4,683.7363333333333,3
w13,1,128,8,4096,3072,32,32,256,16,8,3,681.7313333333333,3
w13,1,128,8,4096,3072,32,32,256,16,8,4,683.5659999999999,3
w13,1,128,8,4096,3072,32,32,256,32,4,3,680.014,3
w13,1,128,8,4096,3072,32,32,256,32,4,4,683.3739999999999,3
w13,1,128,8,4096,3072,32,32,256,32,8,3,681.4646666666667,3
w13,1,128,8,4096,3072,32,32,256,32,8,4,684.3443333333333,3
w13,2,8,2,1024,512,16,32,256,1,8,2,15.756666666666666,3
w13,2,16,2,1536,768,16,16,128,4,4,2,35.042,3
w13,2,16,2,1536,768,16,32,128,4,4,2,35.043,3
w13,2,16,2,1536,768,16,32,128,16,4,2,34.91433333333333,3
w13,2,16,2,1536,768,16,32,128,32,4,2,34.967333333333336,3
w13,2,16,2,1536,768,16,32,128,64,4,2,34.98866666666667,3
w13,2,16,2,1536,768,16,32,128,64,8,2,35.25533333333333,3
w13,2,16,2,1536,768,32,32,128,4,4,2,35.053,3
w13,2,16,2,1536,768,32,32,128,64,4,2,35.202,3
w13,2,16,4,1536,1024,16,16,128,1,4,2,89.90066666666667,3
w13,2,16,4,1536,1024,16,16,128,1,4,3,89.64566666666667,3
w13,2,16,4,1536,1024,16,16,128,4,4,2,90.02933333333333,3
w13,2,16,4,1536,1024,16,16,128,4,4,3,90.03966666666668,3
w13,2,16,4,1536,1024,16,16,256,1,4,2,89.91166666666668,3
w13,2,16,4,1536,1024,16,16,256,1,4,3,89.80499999999999,3
w13,2,16,4,1536,1024,16,16,256,1,4,4,90.19933333333331,3
w13,2,16,4,1536,1024,16,16,256,4,4,2,89.88,3
w13,2,16,4,1536,1024,16,16,256,4,4,3,89.986,3
w13,2,16,4,1536,1024,16,16,256,4,4,4,90.14633333333332,3
w13,2,16,4,1536,1024,16,32,128,1,4,2,89.63466666666666,3
w13,2,16,4,1536,1024,16,32,128,1,4,3,89.74133333333333,3
w13,2,16,4,1536,1024,16,32,128,4,4,2,89.666,3
w13,2,16,4,1536,1024,16,32,128,4,4,3,89.96466666666667,3
w13,2,16,4,1536,1024,16,32,128,16,4,2,89.39966666666665,3
w13,2,16,4,1536,1024,16,32,128,16,4,3,89.93299999999999,3
w13,2,16,4,1536,1024,16,32,128,32,4,2,89.43166666666666,3
w13,2,16,4,1536,1024,16,32,128,32,4,3,89.91199999999999,3
w13,2,16,4,1536,1024,16,32,128,64,4,2,89.53833333333334,3
w13,2,16,4,1536,1024,16,32,128,64,4,3,89.63466666666666,3
w13,2,16,4,1536,1024,16,32,128,64,8,2,90.28466666666667,3
w13,2,16,4,1536,1024,16,32,128,64,8,3,90.12466666666667,3
w13,2,16,4,1536,1024,16,32,256,1,4,3,90.10433333333333,3
w13,2,16,4,1536,1024,16,32,256,32,8,2,90.29633333333334,3
w13,2,16,4,1536,1024,16,64,128,1,4,2,90.12533333333333,3
w13,2,16,4,1536,1024,16,64,128,1,8,2,89.67733333333335,3
w13,2,16,4,1536,1024,16,64,128,1,8,3,90.07133333333333,3
w13,2,16,4,1536,1024,16,64,128,16,8,2,89.93333333333334,3
w13,2,16,4,1536,1024,16,64,128,16,8,3,90.05033333333334,3
w13,2,16,4,1536,1024,16,64,128,32,4,2,90.19966666666666,3
w13,2,16,4,1536,1024,16,64,128,32,8,3,89.97566666666667,3
w13,2,16,4,1536,1024,16,64,128,64,4,2,90.04033333333332,3
w13,2,16,4,1536,1024,16,64,128,64,4,3,90.28533333333333,3
w13,2,16,4,1536,1024,16,64,128,64,8,2,90.15733333333333,3
w13,2,16,4,1536,1024,16,64,128,64,8,3,90.14633333333335,3
w13,2,16,4,1536,1024,16,128,128,16,8,2,90.18966666666665,3
w13,2,16,4,1536,1024,32,16,128,4,4,2,89.741,3
w13,2,16,4,1536,1024,32,32,128,1,4,2,90.18933333333332,3
w13,2,16,4,1536,1024,32,32,128,4,4,2,90.178,3
w13,2,16,4,1536,1024,32,32,128,16,4,2,90.28466666666668,3
w13,2,16,4,1536,1024,32,32,128,64,4,2,90.04,3
w13,2,16,4,1536,1024,32,64,128,1,8,2,90.082,3
w13,2,16,4,1536,1024,32,64,128,1,8,3,90.29566666666666,3
w13,2,16,4,1536,1024,32,64,128,4,8,2,90.22066666666667,3
w13,2,16,4,1536,1024,32,64,128,4,8,3,90.29533333333332,3
w13,2,16,4,1536,1024,32,64,128,64,8,2,90.274,3
w13,2,32,4,2048,768,16,16,128,1,4,3,89.197,3
w13,2,32,4,2048,768,16,16,128,1,4,4,89.33600000000001,3
w13,2,32,4,2048,768,16,16,128,4,4,3,89.21866666666666,3
w13,2,32,4,2048,768,16,16,128,4,4,4,89.54899999999999,3
w13,2,32,4,2048,768,16,16,256,1,4,2,89.187,3
w13,2,32,4,2048,768,16,16,256,1,4,4,89.41133333333333,3
w13,2,32,4,2048,768,16,16,256,4,4,4,89.05866666666667,3
w13,2,32,4,2048,768,16,32,128,1,4,2,89.69833333333332,3
w13,2,32,4,2048,768,16,32,128,1,4,3,89.592,3
w13,2,32,4,2048,768,16,32,128,1,4,4,89.48533333333334,3
w13,2,32,4,2048,768,16,32,128,4,4,2,89.52766666666666,3
w13,2,32,4,2048,768,16,32,128,4,4,3,89.37866666666666,3
w13,2,32,4,2048,768,16,32,128,4,4,4,89.32533333333333,3
w13,2,32,4,2048,768,16,32,128,16,4,2,89.48533333333334,3
w13,2,32,4,2048,768,16,32,128,16,4,3,89.50666666666666,3
w13,2,32,4,2048,768,16,32,128,16,4,4,89.36766666666666,3
w13,2,32,4,2048,768,16,32,128,16,8,2,89.68766666666666,3
w13,2,32,4,2048,768,16,32,128,16,8,3,89.25066666666667,3
w13,2,32,4,2048,768,16,32,128,16,8,4,89.70933333333335,3
w13,2,32,4,2048,768,16,32,128,32,4,2,89.47433333333333,3
w13,2,32,4,2048,768,16,32,128,32,4,3,89.421,3
w13,2,32,4,2048,768,16,32,128,32,4,4,89.28233333333333,3
w13,2,32,4,2048,768,16,32,128,32,8,2,89.73066666666666,3
w13,2,32,4,2048,768,16,32,128,32,8,3,89.03699999999999,3
w13,2,32,4,2048,768,16,32,128,64,4,2,89.54899999999999,3
w13,2,32,4,2048,768,16,32,128,64,4,3,89.55966666666666,3
w13,2,32,4,2048,768,16,32,128,64,4,4,89.36833333333334,3
w13,2,32,4,2048,768,16,32,128,64,8,2,89.592,3
w13,2,32,4,2048,768,16,32,128,64,8,3,89.49566666666665,3
w13,2,32,4,2048,768,16,32,256,1,4,3,89.85833333333333,3
w13,2,32,4,2048,768,16,32,256,1,8,3,89.53866666666666,3
w13,2,32,4,2048,768,16,32,256,16,4,3,89.229,3
w13,2,32,4,2048,768,16,32,256,16,8,2,89.59199999999998,3
w13,2,32,4,2048,768,16,32,256,16,8,3,88.98333333333335,3
w13,2,32,4,2048,768,16,32,256,32,4,3,89.091,3
w13,2,32,4,2048,768,16,32,256,32,4,4,89.69866666666667,3
w13,2,32,4,2048,768,16,32,256,32,8,2,89.485,3
w13,2,32,4,2048,768,16,32,256,32,8,4,89.82666666666667,3
w13,2,32,4,2048,768,16,32,256,64,4,2,89.45333333333333,3
w13,2,32,4,2048,768,16,32,256,64,4,3,89.165,3
w13,2,32,4,2048,768,16,32,256,64,8,2,89.12266666666666,3
w13,2,32,4,2048,768,16,32,256,64,8,3,89.41033333333333,3
w13,2,32,4,2048,768,16,32,256,64,8,4,89.86899999999999,3
w13,2,32,4,2048,768,16,64,128,1,8,2,89.752,3
w13,2,32,4,2048,768,16,64,128,16,8,3,89.77333333333333,3
w13,2,32,4,2048,768,16,64,128,32,8,2,89.86933333333333,3
w13,2,32,4,2048,768,16,64,128,32,8,3,89.68799999999999,3
w13,2,32,4,2048,768,16,64,128,64,8,3,89.677,3
w13,2,32,4,2048,768,32,16,128,4,4,4,89.65599999999999,3
w13,2,32,4,2048,768,32,32,128,1,4,3,89.79466666666667,3
w13,2,32,4,2048,768,32,32,128,4,4,3,89.795,3
w13,2,32,4,2048,768,32,32,128,16,4,2,89.76266666666668,3
w13,2,32,4,2048,768,32,32,128,16,4,3,89.83733333333333,3
w13,2,32,4,2048,768,32,32,128,16,8,2,89.78399999999999,3
w13,2,32,4,2048,768,32,32,128,16,8,3,89.64566666666667,3
w13,2,32,4,2048,768,32,32,128,64,4,2,89.656,3
w13,2,32,4,2048,768,32,32,128,64,4,3,89.76233333333333,3
w13,2,32,4,2048,768,32,32,256,1,8,2,89.79466666666667,3
w13,2,32,4,2048,768,32,32,256,4,8,3,89.53866666666666,3
w13,2,32,4,2048,768,32,32,256,32,8,2,89.76299999999999,3
w13,2,32,4,2048,768,32,32,256,32,8,3,89.87966666666667,3
w13,2,32,6,3072,1024,16,16,128,1,4,4,260.84566666666666,3
w13,2,32,6,3072,1024,16,16,128,4,4,4,260.73900000000003,3
w13,2,32,6,3072,1024,16,16,256,1,4,3,260.12,3
w13,2,32,6,3072,1024,16,16,256,1,4,4,260.675,3
w13,2,32,6,3072,1024,16,16,256,4,4,3,260.32300000000004,3
w13,2,32,6,3072,1024,16,16,256,4,4,4,260.579,3
w13,2,32,6,3072,1024,16,32,128,1,4,4,260.6966666666667,3
w13,2,32,6,3072,1024,16,32,128,4,4,4,260.3976666666667,3
w13,2,32,6,3072,1024,16,32,128,4,8,4,260.99466666666666,3
w13,2,32,6,3072,1024,16,32,128,16,4,4,260.568,3
w13,2,32,6,3072,1024,16,32,128,32,4,4,260.7923333333333,3
w13,2,32,6,3072,1024,16,32,128,64,4,4,260.6753333333333,3
w13,2,32,6,3072,1024,16,32,256,1,4,3,259.0323333333333,3
w13,2,32,6,3072,1024,16,32,256,1,8,3,258.85066666666665,3
w13,2,32,6,3072,1024,16,32,256,16,4,3,258.62733333333335,3
w13,2,32,6,3072,1024,16,32,256,16,8,3,258.69100000000003,3
w13,2,32,6,3072,1024,16,32,256,32,4,3,258.53133333333335,3
w13,2,32,6,3072,1024,16,32,256,32,8,3,258.6166666666666,3
w13,2,32,6,3072,1024,16,32,256,64,4,3,259.2993333333334,3
w13,2,32,6,3072,1024,16,32,256,64,8,3,258.61600000000004,3
w13,2,32,6,3072,1024,16,64,256,1,4,3,260.547,3
w13,2,32,6,3072,1024,16,64,256,1,8,3,260.09933333333333,3
w13,2,32,6,3072,1024,16,64,256,16,4,3,260.1313333333333,3
w13,2,32,6,3072,1024,16,64,256,16,8,3,260.22700000000003,3
w13,2,32,6,3072,1024,16,64,256,32,4,3,260.21666666666664,3
w13,2,32,6,3072,1024,16,64,256,32,8,3,260.2486666666667,3
w13,2,32,6,3072,1024,16,64,256,64,4,3,260.1843333333333,3
w13,2,32,6,3072,1024,16,64,256,64,8,3,260.152,3
w13,2,32,6,3072,1024,32,32,256,1,4,3,260.718,3
w13,2,32,6,3072,1024,32,32,256,4,4,3,261.02700000000004,3
w13,2,32,6,3072,1024,32,64,256,8,8,3,260.718,3
w13,2,60,4,2048,1408,16,16,256,1,4,3,158.80733333333333,3
w13,2,60,4,2048,1408,16,16,256,1,4,4,159.73533333333333,3
w13,2,60,4,2048,1408,16,16,256,4,4,3,158.41166666666666,3
w13,2,60,4,2048,1408,16,16,256,4,4,4,159.394,3
w13,2,60,4,2048,1408,16,32,256,1,4,3,159.34066666666666,3
w13,2,60,4,2048,1408,16,32,256,1,8,3,159.34033333333335,3
w13,2,60,4,2048,1408,16,32,256,16,4,3,159.39333333333332,3
w13,2,60,4,2048,1408,16,32,256,16,8,4,159.97,3
w13,2,60,4,2048,1408,16,32,256,32,4,3,159.03133333333335,3
w13,2,60,4,2048,1408,16,32,256,32,8,3,159.799,3
w13,2,60,4,2048,1408,16,32,256,64,4,3,159.04133333333334,3
w13,2,60,4,2048,1408,32,32,256,4,8,3,159.89533333333335,3
w13,2,60,4,2048,1408,32,32,256,16,8,3,159.95933333333332,3
w13,2,60,6,3584,2304,16,16,256,1,4,3,665.3586666666666,3
w13,2,60,6,3584,2304,16,16,256,1,4,4,670.276,3
w13,2,60,6,3584,2304,16,16,256,1,8,3,670.66,3
w13,2,60,6,3584,2304,16,16,256,4,4,3,664.5053333333334,3
w13,2,60,6,3584,2304,16,16,256,4,4,4,670.2543333333333,3
w13,2,60,6,3584,2304,16,16,256,4,8,3,670.2546666666667,3
w13,2,60,6,3584,2304,16,32,256,1,4,3,667.6733333333333,3
w13,2,60,6,3584,2304,16,32,256,1,4,4,670.9900000000001,3
w13,2,60,6,3584,2304,16,32,256,1,8,3,670.2546666666667,3
w13,2,60,6,3584,2304,16,32,256,16,4,3,667.6729999999999,3
w13,2,60,6,3584,2304,16,32,256,16,8,3,670.041,3
w13,2,60,6,3584,2304,16,32,256,32,4,3,667.5666666666667,3
w13,2,60,6,3584,2304,16,32,256,32,8,3,669.8813333333334,3
w13,2,60,6,3584,2304,16,32,256,64,4,3,667.6843333333333,3
w13,2,60,6,3584,2304,16,32,256,64,8,3,669.2093333333333,3
w13,2,60,6,3584,2304,16,64,256,1,4,3,670.0196666666666,3
w13,2,60,6,3584,2304,16,64,256,1,8,3,670.8733333333333,3
w13,2,60,6,3584,2304,16,64,256,16,4,3,669.2199999999999,3
w13,2,60,6,3584,2304,16,64,256,16,8,3,670.8946666666667,3
w13,2,60,6,3584,2304,16,64,256,32,4,3,668.8563333333333,3
w13,2,60,6,3584,2304,16,64,256,32,8,3,670.5426666666666,3
w13,2,60,6,3584,2304,16,64,256,64,4,3,669.4973333333334,3
w13,2,60,6,3584,2304,16,64,256,64,8,3,670.9159999999999,3
w13,2,60,6,3584,2304,32,32,256,1,4,3,664.686,3
w13,2,60,6,3584,2304,32,32,256,1,8,3,665.6996666666665,3
w13,2,60,6,3584,2304,32,32,256,4,4,3,665.38,3
w13,2,60,6,3584,2304,32,32,256,4,8,3,665.8173333333333,3
w13,2,60,6,3584,2304,32,32,256,16,4,3,666.3070000000001,3
w13,2,60,6,3584,2304,32,32,256,16,8,3,667.0963333333334,3
w13,2,60,6,3584,2304,32,32,256,32,4,3,666.0733333333333,3
w13,2,60,6,3584,2304,32,32,256,32,8,3,667.1716666666667,3
w13,2,60,8,2048,1536,16,16,256,1,4,3,341.1333333333333,3
w13,2,60,8,2048,1536,16,16,256,1,4,4,341.6983333333333,3
w13,2,60,8,2048,1536,16,16,256,1,8,3,344.43966666666665,3
w13,2,60,8,2048,1536,16,16,256,1,8,4,344.3223333333333,3
w13,2,60,8,2048,1536,16,16,256,4,4,3,341.38866666666667,3
w13,2,60,8,2048,1536,16,16,256,4,4,4,341.634,3
w13,2,60,8,2048,1536,16,16,256,4,8,3,343.3086666666666,3
w13,2,60,8,2048,1536,16,16,256,4,8,4,344.13000000000005,3
w13,2,60,8,2048,1536,16,32,256,1,4,3,341.5276666666666,3
w13,2,60,8,2048,1536,16,32,256,1,4,4,342.6266666666667,3
w13,2,60,8,2048,1536,16,32,256,1,8,3,342.65766666666667,3
w13,2,60,8,2048,1536,16,32,256,1,8,4,342.8926666666666,3
w13,2,60,8,2048,1536,16,32,256,16,4,3,342.27433333333335,3
w13,2,60,8,2048,1536,16,32,256,16,4,4,343.021,3
w13,2,60,8,2048,1536,16,32,256,16,8,3,343.7996666666666,3
w13,2,60,8,2048,1536,16,32,256,16,8,4,343.90599999999995,3
w13,2,60,8,2048,1536,16,32,256,32,4,3,342.30600000000004,3
w13,2,60,8,2048,1536,16,32,256,32,4,4,342.797,3
w13,2,60,8,2048,1536,16,32,256,32,8,3,344.3329999999999,3
w13,2,60,8,2048,1536,16,32,256,32,8,4,344.3433333333333,3
w13,2,60,8,2048,1536,16,32,256,64,4,3,342.5296666666666,3
w13,2,60,8,2048,1536,16,32,256,64,4,4,343.22333333333336,3
w13,2,60,8,2048,1536,16,32,256,64,8,3,343.7676666666666,3
w13,2,60,8,2048,1536,16,32,256,64,8,4,343.92766666666665,3
w13,2,60,8,2048,1536,16,64,256,1,4,3,343.4046666666666,3
w13,2,60,8,2048,1536,16,64,256,1,8,3,343.618,3
w13,2,60,8,2048,1536,16,64,256,16,4,3,344.0126666666667,3
w13,2,60,8,2048,1536,16,64,256,32,4,3,344.1836666666666,3
w13,2,60,8,2048,1536,16,64,256,32,8,3,344.4823333333334,3
w13,2,60,8,2048,1536,16,64,256,64,4,3,344.333,3
w13,2,60,8,2048,1536,16,64,256,64,8,3,344.5353333333333,3
w13,2,60,8,2048,1536,32,32,256,1,4,3,341.82666666666665,3
w13,2,60,8,2048,1536,32,32,256,1,4,4,343.6713333333333,3
w13,2,60,8,2048,1536,32,32,256,1,8,3,341.9006666666666,3
w13,2,60,8,2048,1536,32,32,256,1,8,4,343.9703333333334,3
w13,2,60,8,2048,1536,32,32,256,4,4,3,343.14900000000006,3
w13,2,60,8,2048,1536,32,32,256,4,4,4,344.205,3
w13,2,60,8,2048,1536,32,32,256,4,8,3,343.693,3
w13,2,60,8,2048,1536,32,32,256,4,8,4,344.50333333333333,3
w13,2,60,8,2048,1536,32,32,256,16,4,3,344.24766666666665,3
w13,2,60,8,2048,1536,32,32,256,16,4,4,343.959,3
w13,2,60,8,2048,1536,32,32,256,16,8,3,344.4073333333333,3
w13,2,60,8,2048,1536,32,32,256,32,4,3,344.1513333333333,3
w13,2,60,8,2048,1536,32,32,256,32,4,4,344.3433333333333,3
w13,2,64,6,3072,2048,16,16,256,1,4,3,510.14799999999997,3
w13,2,64,6,3072,2048,16,16,256,1,4,4,513.1560000000001,3
w13,2,64,6,3072,2048,16,16,256,4,4,3,509.91333333333336,3
w13,2,64,6,3072,2048,16,16,256,4,4,4,512.9743333333333,3
w13,2,64,6,3072,2048,16,32,256,1,4,3,510.61733333333336,3
w13,2,64,6,3072,2048,16,32,256,1,4,4,514.1586666666667,3
w13,2,64,6,3072,2048,16,32,256,1,8,3,513.7956666666666,3
w13,2,64,6,3072,2048,16,32,256,1,8,4,514.18,3
w13,2,64,6,3072,2048,16,32,256,16,4,3,509.9669999999999,3
w13,2,64,6,3072,2048,16,32,256,16,4,4,514.3933333333334,3
w13,2,64,6,3072,2048,16,32,256,16,8,3,512.804,3
w13,2,64,6,3072,2048,16,32,256,32,4,3,510.5746666666667,3
w13,2,64,6,3072,2048,16,32,256,32,8,3,513.6253333333334,3
w13,2,64,6,3072,2048,16,32,256,64,4,3,509.924,3
w13,2,64,6,3072,2048,16,32,256,64,8,3,513.327,3
w13,2,64,6,3072,2048,16,64,256,1,4,3,511.8223333333333,3
w13,2,64,6,3072,2048,16,64,256,1,8,3,513.3903333333334,3
w13,2,64,6,3072,2048,16,64,256,16,4,3,512.548,3
w13,2,64,6,3072,2048,16,64,256,16,8,3,514.212,3
w13,2,64,6,3072,2048,16,64,256,32,4,3,512.5266666666666,3
w13,2,64,6,3072,2048,16,64,256,32,8,3,513.902,3
w13,2,64,6,3072,2048,16,64,256,64,4,3,512.5796666666666,3
w13,2,64,6,3072,2048,16,64,256,64,8,3,514.1373333333333,3
w13,2,64,6,3072,2048,32,32,256,1,4,3,509.34799999999996,3
w13,2,64,6,3072,2048,32,32,256,1,8,3,510.212,3
w13,2,64,6,3072,2048,32,32,256,4,4,3,509.59366666666665,3
w13,2,64,6,3072,2048,32,32,256,4,8,3,510.51033333333334,3
w13,2,64,6,3072,2048,32,32,256,16,4,3,510.4676666666667,3
w13,2,64,6,3072,2048,32,32,256,16,8,3,512.1106666666666,3
w13,2,64,6,3072,2048,32,32,256,32,4,3,510.14799999999997,3
w13,2,64,6,3072,2048,32,32,256,32,8,3,511.577,3
w13,2,64,6,3584,1536,16,16,256,1,4,3,447.779,3
w13,2,64,6,3584,1536,16,16,256,1,4,4,449.112,3
w13,2,64,6,3584,1536,16,16,256,4,4,3,447.4483333333333,3
w13,2,64,6,3584,1536,16,16,256,4,4,4,448.8456666666666,3
w13,2,64,6,3584,1536,16,32,256,1,4,3,447.60833333333335,3
w13,2,64,6,3584,1536,16,32,256,1,4,4,449.5496666666667,3
w13,2,64,6,3584,1536,16,32,256,1,8,3,448.4726666666667,3
w13,2,64,6,3584,1536,16,32,256,1,8,4,450.2,3
w13,2,64,6,3584,1536,16,32,256,16,4,3,447.61899999999997,3
w13,2,64,6,3584,1536,16,32,256,16,8,3,448.44000000000005,3
w13,2,64,6,3584,1536,16,32,256,32,4,3,447.6296666666667,3
w13,2,64,6,3584,1536,16,32,256,32,4,4,450.25333333333333,3
w13,2,64,6,3584,1536,16,32,256,32,8,3,448.2486666666667,3
w13,2,64,6,3584,1536,16,32,256,64,4,3,447.5013333333334,3
w13,2,64,6,3584,1536,16,32,256,64,8,3,448.1203333333333,3
w13,2,64,6,3584,1536,16,64,256,1,4,3,449.1123333333333,3
w13,2,64,6,3584,1536,16,64,256,1,8,3,450.2536666666667,3
w13,2,64,6,3584,1536,16,64,256,16,4,3,449.5710000000001,3
w13,2,64,6,3584,1536,16,64,256,32,4,3,449.1656666666666,3
w13,2,64,6,3584,1536,16,64,256,64,4,3,449.1873333333333,3
w13,2,64,6,3584,1536,16,64,256,64,8,3,449.82733333333334,3
w13,2,64,6,3584,1536,32,32,256,1,4,3,445.8593333333333,3
w13,2,64,6,3584,1536,32,32,256,1,8,3,446.2426666666667,3
w13,2,64,6,3584,1536,32,32,256,4,4,3,446.11466666666666,3
w13,2,64,6,3584,1536,32,32,256,4,8,3,446.2536666666667,3
w13,2,64,6,3584,1536,32,32,256,16,4,3,446.094,3
w13,2,64,6,3584,1536,32,32,256,16,8,3,446.3926666666666,3
w13,2,64,6,3584,1536,32,32,256,32,4,3,446.147,3
w13,2,64,6,3584,1536,32,32,256,32,8,3,446.80833333333334,3
w13,2,64,6,3584,1536,64,32,256,1,8,3,450.06200000000007,3
w13,2,64,8,3584,2560,16,16,256,1,4,3,982.7156666666666,3
w13,2,64,8,3584,2560,16,16,256,1,4,4,990.2773333333333,3
w13,2,64,8,3584,2560,16,16,256,4,4,3,982.4380000000001,3
w13,2,64,8,3584,2560,16,16,256,4,4,4,991.3130000000001,3
w13,2,64,8,3584,2560,16,32,256,1,4,3,985.265,3
w13,2,64,8,3584,2560,16,32,256,1,4,4,990.8966666666666,3
w13,2,64,8,3584,2560,16,32,256,1,8,3,990.1073333333334,3
w13,2,64,8,3584,2560,16,32,256,1,8,4,991.014,3
w13,2,64,8,3584,2560,16,32,256,16,4,3,985.8623333333334,3
w13,2,64,8,3584,2560,16,32,256,16,8,3,989.041,3
w13,2,64,8,3584,2560,16,32,256,32,4,3,985.7873333333333,3
w13,2,64,8,3584,2560,16,32,256,32,8,3,989.5313333333334,3
w13,2,64,8,3584,2560,16,32,256,64,4,3,985.4676666666666,3
w13,2,64,8,3584,2560,16,32,256,64,8,3,989.073,3
w13,2,64,8,3584,2560,16,64,256,1,4,3,987.2596666666667,3
w13,2,64,8,3584,2560,16,64,256,1,8,3,988.881,3
w13,2,64,8,3584,2560,16,64,256,16,4,3,987.91,3
w13,2,64,8,3584,2560,16,64,256,16,8,3,990.4276666666666,3
w13,2,64,8,3584,2560,16,64,256,32,4,3,988.2833333333333,3
w13,2,64,8,3584,2560,16,64,256,32,8,3,989.8623333333334,3
w13,2,64,8,3584,2560,16,64,256,64,4,3,987.857,3
w13,2,64,8,3584,2560,16,64,256,64,8,3,990.4163333333332,3
w13,2,64,8,3584,2560,32,32,256,1,4,3,981.7130000000001,3
w13,2,64,8,3584,2560,32,32,256,1,8,3,982.065,3
w13,2,64,8,3584,2560,32,32,256,4,4,3,981.9256666666666,3
w13,2,64,8,3584,2560,32,32,256,4,8,3,982.2673333333333,3
w13,2,64,8,3584,2560,32,32,256,16,4,3,983.878,3
w13,2,64,8,3584,2560,32,32,256,16,8,3,985.2330000000001,3
w13,2,64,8,3584,2560,32,32,256,32,4,3,983.8356666666667,3
w13,2,64,8,3584,2560,32,32,256,32,8,3,985.4676666666668,3
w13,2,64,8,3584,2560,64,32,256,1,8,3,989.297,3
w13,2,128,4,2048,512,16,16,128,1,4,2,60.94166666666666,3
w13,2,128,4,2048,512,16,16,128,1,4,3,60.98366666666667,3
w13,2,128,4,2048,512,16,16,128,1,4,4,61.272333333333336,3
w13,2,128,4,2048,512,16,16,128,4,4,2,61.06933333333333,3
w13,2,128,4,2048,512,16,16,128,4,4,3,61.37866666666667,3
w13,2,128,4,2048,512,16,16,128,4,4,4,61.21866666666667,3
w13,2,128,4,2048,512,16,32,128,1,4,2,60.812999999999995,3
w13,2,128,4,2048,512,16,32,128,1,4,3,60.919999999999995,3
w13,2,128,4,2048,512,16,32,128,1,4,4,60.96266666666666,3
w13,2,128,4,2048,512,16,32,128,1,8,2,61.239666666666665,3
w13,2,128,4,2048,512,16,32,128,1,8,4,61.411,3
w13,2,128,4,2048,512,16,32,128,4,4,2,61.026666666666664,3
w13,2,128,4,2048,512,16,32,128,4,4,3,61.155,3
w13,2,128,4,2048,512,16,32,128,4,4,4,61.23933333333333,3
w13,2,128,4,2048,512,16,32,128,4,8,2,61.06966666666667,3
w13,2,128,4,2048,512,16,32,128,16,4,2,60.93000000000001,3
w13,2,128,4,2048,512,16,32,128,16,4,3,61.05866666666666,3
w13,2,128,4,2048,512,16,32,128,16,4,4,60.94133333333334,3
w13,2,128,4,2048,512,16,32,128,16,8,2,61.175333333333334,3
w13,2,128,4,2048,512,16,32,128,32,4,2,60.898666666666664,3
w13,2,128,4,2048,512,16,32,128,32,4,3,61.10166666666667,3
w13,2,128,4,2048,512,16,32,128,32,4,4,61.14366666666667,3
w13,2,128,4,2048,512,16,32,128,32,8,2,61.325666666666656,3
w13,2,128,4,2048,512,16,32,128,32,8,3,61.32500000000001,3
w13,2,128,4,2048,512,16,32,128,64,4,2,60.909333333333336,3
w13,2,128,4,2048,512,16,32,128,64,4,3,61.02633333333333,3
w13,2,128,4,2048,512,16,32,128,64,4,4,61.154666666666664,3
w13,2,128,4,2048,512,16,32,128,64,8,2,61.36766666666666,3
w13,2,128,4,2048,512,16,32,128,64,8,3,61.347,3
w13,2,128,4,2048,512,16,32,128,64,8,4,61.40033333333334,3
w13,2,128,4,2048,512,16,32,256,1,4,3,61.208,3
w13,2,128,4,2048,512,16,32,256,16,4,3,61.208000000000006,3
w13,2,128,4,2048,512,16,32,256,16,8,2,61.12233333333334,3
w13,2,128,4,2048,512,16,32,256,32,4,3,61.38933333333333,3
w13,2,128,4,2048,512,16,32,256,32,8,2,60.962999999999994,3
w13,2,128,4,2048,512,16,32,256,32,8,3,61.314,3
w13,2,128,4,2048,512,16,32,256,64,4,2,61.40033333333333,3
w13,2,128,4,2048,512,16,32,256,64,4,3,61.32566666666667,3
w13,2,128,4,2048,512,16,32,256,64,8,2,61.02633333333333,3
w13,2,128,4,2048,512,16,64,128,1,4,2,61.282333333333334,3
w13,2,128,4,2048,512,16,64,128,1,8,2,60.90966666666666,3
w13,2,128,4,2048,512,16,64,128,1,8,3,61.379,3
w13,2,128,4,2048,512,16,64,128,1,8,4,61.36833333333333,3
w13,2,128,4,2048,512,16,64,128,16,4,2,61.218999999999994,3
w13,2,128,4,2048,512,16,64,128,16,8,2,60.952333333333335,3
w13,2,128,4,2048,512,16,64,128,32,4,2,61.28233333333333,3
w13,2,128,4,2048,512,16,64,128,32,8,2,61.047666666666665,3
w13,2,128,4,2048,512,16,64,128,64,4,2,61.21866666666667,3
w13,2,128,4,2048,512,16,64,128,64,8,2,60.86666666666667,3
w13,2,128,4,2048,512,16,128,128,1,8,2,61.12299999999999,3
w13,2,128,4,2048,512,32,16,128,4,4,2,61.26133333333333,3
w13,2,128,4,2048,512,32,16,128,4,4,3,60.85566666666667,3
w13,2,128,4,2048,512,32,32,128,1,4,2,61.090666666666664,3
w13,2,128,4,2048,512,32,32,128,1,8,2,61.25066666666667,3
w13,2,128,4,2048,512,32,32,128,4,4,2,61.01533333333333,3
w13,2,128,4,2048,512,32,32,128,64,4,2,61.12266666666667,3
w13,2,128,4,2048,512,32,32,128,64,8,2,61.379,3
w13,2,128,4,2048,512,32,64,128,1,8,2,61.18633333333333,3
w13,2,128,4,2048,512,32,64,128,4,8,2,61.24,3
w13,2,128,4,2048,512,32,64,128,16,8,2,61.20766666666666,3
w13,2,128,4,2048,512,32,64,128,32,8,2,61.33566666666667,3
w13,2,128,4,2048,512,32,64,128,64,8,2,61.218333333333334,3
w13,2,128,6,4096,2048,16,16,256,1,4,3,678.4060000000001,3
w13,2,128,6,4096,2048,16,16,256,1,4,4,680.5709999999999,3
w13,2,128,6,4096,2048,16,16,256,4,4,3,676.955,3
w13,2,128,6,4096,2048,16,16,256,4,4,4,681.2966666666667,3
w13,2,128,6,4096,2048,16,32,256,1,4,3,680.6883333333334,3
w13,2,128,6,4096,2048,16,32,256,1,4,4,680.4856666666667,3
w13,2,128,6,4096,2048,16,32,256,1,8,3,682.3096666666667,3
w13,2,128,6,4096,2048,16,32,256,1,8,4,681.7983333333334,3
w13,2,128,6,4096,2048,16,32,256,16,4,3,679.814,3
w13,2,128,6,4096,2048,16,32,256,16,4,4,682.683,3
w13,2,128,6,4096,2048,16,32,256,32,4,3,680.5500000000001,3
w13,2,128,6,4096,2048,16,32,256,32,4,4,683.0136666666667,3
w13,2,128,6,4096,2048,16,32,256,32,8,3,683.2376666666665,3
w13,2,128,6,4096,2048,16,32,256,64,4,3,679.376,3
w13,2,128,6,4096,2048,16,32,256,64,4,4,682.928,3
w13,2,128,6,4096,2048,16,32,256,64,8,4,683.6113333333333,3
w13,2,128,6,4096,2048,16,64,256,1,4,3,681.158,3
w13,2,128,6,4096,2048,16,64,256,1,8,3,682.406,3
w13,2,128,6,4096,2048,16,64,256,16,4,3,682.1073333333334,3
w13,2,128,6,4096,2048,16,64,256,16,8,3,683.0876666666667,3
w13,2,128,6,4096,2048,16,64,256,32,4,3,681.5203333333334,3
w13,2,128,6,4096,2048,16,64,256,32,8,3,683.2379999999999,3
w13,2,128,6,4096,2048,16,64,256,64,4,3,681.766,3
w13,2,128,6,4096,2048,16,64,256,64,8,3,682.9393333333334,3
w13,2,128,6,4096,2048,32,32,256,1,4,3,678.7366666666667,3
w13,2,128,6,4096,2048,32,32,256,1,4,4,682.1179999999999,3
w13,2,128,6,4096,2048,32,32,256,1,8,3,680.4753333333333,3
w13,2,128,6,4096,2048,32,32,256,1,8,4,682.6936666666667,3
w13,2,128,6,4096,2048,32,32,256,4,4,3,679.6006666666666,3
w13,2,128,6,4096,2048,32,32,256,4,4,4,682.3736666666666,3
w13,2,128,6,4096,2048,32,32,256,4,8,3,680.9976666666666,3
w13,2,128,6,4096,2048,32,32,256,16,4,3,680.667,3
w13,2,128,6,4096,2048,32,32,256,16,4,4,683.547,3
w13,2,128,6,4096,2048,32,32,256,16,8,3,682.2883333333333,3
w13,2,128,6,4096,2048,32,32,256,32,4,3,680.8589999999999,3
w13,2,128,6,4096,2048,32,32,256,32,8,3,682.0856666666667,3
w13,2,128,8,2048,768,16,16,128,1,4,3,174.552,3
w13,2,128,8,2048,768,16,16,128,1,4,4,174.90433333333337,3
w13,2,128,8,2048,768,16,16,128,4,4,3,174.7976666666667,3
w13,2,128,8,2048,768,16,16,128,4,4,4,174.31766666666667,3
w13,2,128,8,2048,768,16,16,256,1,4,2,174.808,3
w13,2,128,8,2048,768,16,16,256,1,4,3,173.61366666666666,3
w13,2,128,8,2048,768,16,16,256,1,4,4,174.24300000000002,3
w13,2,128,8,2048,768,16,16,256,4,4,3,173.688,3
w13,2,128,8,2048,768,16,16,256,4,4,4,173.87966666666662,3
w13,2,128,8,2048,768,16,32,128,1,4,3,174.9896666666667,3
w13,2,128,8,2048,768,16,32,128,1,4,4,174.62699999999998,3
w13,2,128,8,2048,768,16,32,128,4,4,3,175.011,3
w13,2,128,8,2048,768,16,32,128,4,4,4,174.05100000000002,3
w13,2,128,8,2048,768,16,32,128,4,8,3,175.0536666666667,3
w13,2,128,8,2048,768,16,32,128,4,8,4,174.86133333333336,3
w13,2,128,8,2048,768,16,32,128,16,4,3,174.76533333333336,3
w13,2,128,8,2048,768,16,32,128,16,4,4,175.06466666666665,3
w13,2,128,8,2048,768,16,32,128,32,4,3,175.10699999999997,3
w13,2,128,8,2048,768,16,32,128,32,4,4,174.7123333333333,3
w13,2,128,8,2048,768,16,32,128,64,4,3,174.8083333333333,3
w13,2,128,8,2048,768,16,32,128,64,4,4,174.82933333333335,3
w13,2,128,8,2048,768,16,32,256,1,4,3,173.64533333333335,3
w13,2,128,8,2048,768,16,32,256,1,4,4,174.819,3
w13,2,128,8,2048,768,16,32,256,1,8,3,173.763,3
w13,2,128,8,2048,768,16,32,256,1,8,4,174.35999999999999,3
w13,2,128,8,2048,768,16,32,256,16,4,3,173.50699999999998,3
w13,2,128,8,2048,768,16,32,256,16,8,3,173.987,3
w13,2,128,8,2048,768,16,32,256,32,4,3,173.3793333333333,3
w13,2,128,8,2048,768,16,32,256,32,8,2,174.883,3
w13,2,128,8,2048,768,16,32,256,32,8,3,173.84833333333333,3
w13,2,128,8,2048,768,16,32,256,64,4,3,173.47466666666665,3
w13,2,128,8,2048,768,16,32,256,64,4,4,174.9043333333333,3
w13,2,128,8,2048,768,16,32,256,64,8,3,174.13633333333334,3
w13,2,128,8,2048,768,16,64,128,1,8,3,175.086,3
w13,2,128,8,2048,768,16,64,128,32,8,3,175.08533333333335,3
w13,2,128,8,2048,768,16,64,256,1,8,3,174.947,3
w13,2,128,8,2048,768,16,64,256,16,4,3,174.79733333333334,3
w13,2,128,8,2048,768,16,64,256,16,8,3,174.82966666666667,3
w13,2,128,8,2048,768,16,64,256,32,4,3,174.883,3
w13,2,128,8,2048,768,16,64,256,32,8,2,175.00033333333332,3
w13,2,128,8,2048,768,16,64,256,32,8,3,174.659,3
w13,2,128,8,2048,768,16,64,256,64,4,3,174.86166666666668,3
w13,2,128,8,2048,768,16,64,256,64,8,3,174.81933333333333,3
w13,2,128,8,2048,768,32,16,128,4,4,3,174.43500000000003,3
w13,2,128,8,2048,768,32,32,128,4,8,4,175.03233333333336,3
w13,2,128,8,4096,1536,16,16,256,1,4,3,677.8186666666667,3
w13,2,128,8,4096,1536,16,16,256,1,4,4,680.3893333333333,3
w13,2,128,8,4096,1536,16,16,256,1,8,3,684.1336666666666,3
w13,2,128,8,4096,1536,16,16,256,4,4,3,679.0770000000001,3
w13,2,128,8,4096,1536,16,16,256,4,4,4,680.3466666666667,3
w13,2,128,8,4096,1536,16,32,256,1,4,3,679.9523333333333,3
w13,2,128,8,4096,1536,16,32,256,1,4,4,680.5916666666667,3
w13,2,128,8,4096,1536,16,32,256,1,8,3,681.6586666666667,3
w13,2,128,8,4096,1536,16,32,256,1,8,4,681.5203333333334,3
w13,2,128,8,4096,1536,16,32,256,16,4,3,679.109,3
w13,2,128,8,4096,1536,16,32,256,16,4,4,681.5413333333332,3
w13,2,128,8,4096,1536,16,32,256,16,8,4,682.3946666666667,3
w13,2,128,8,4096,1536,16,32,256,32,4,3,678.8960000000001,3
w13,2,128,8,4096,1536,16,32,256,32,4,4,681.4563333333334,3
w13,2,128,8,4096,1536,16,32,256,32,8,3,684.485,3
w13,2,128,8,4096,1536,16,32,256,32,8,4,682.053,3
w13,2,128,8,4096,1536,16,32,256,64,4,3,680.0803333333333,3
w13,2,128,8,4096,1536,16,32,256,64,4,4,681.3386666666667,3
w13,2,128,8,4096,1536,16,32,256,64,8,4,682.6186666666666,3
w13,2,128,8,4096,1536,16,64,256,1,4,3,681.274,3
w13,2,128,8,4096,1536,16,64,256,1,8,3,682.0743333333334,3
w13,2,128,8,4096,1536,16,64,256,16,4,3,681.1466666666666,3
w13,2,128,8,4096,1536,16,64,256,16,8,3,682.4163333333333,3
w13,2,128,8,4096,1536,16,64,256,32,4,3,681.851,3
w13,2,128,8,4096,1536,16,64,256,32,8,3,683.109,3
w13,2,128,8,4096,1536,16,64,256,64,4,3,682.1703333333334,3
w13,2,128,8,4096,1536,16,64,256,64,8,3,682.8636666666666,3
w13,2,128,8,4096,1536,32,32,256,1,4,3,679.7383333333333,3
w13,2,128,8,4096,1536,32,32,256,1,4,4,681.7866666666667,3
w13,2,128,8,4096,1536,32,32,256,1,8,3,680.5169999999999,3
w13,2,128,8,4096,1536,32,32,256,1,8,4,682.6186666666666,3
w13,2,128,8,4096,1536,32,32,256,4,4,3,679.6103333333333,3
w13,2,128,8,4096,1536,32,32,256,4,4,4,682.011,3
w13,2,128,8,4096,1536,32,32,256,4,8,3,680.24,3
w13,2,128,8,4096,1536,32,32,256,4,8,4,683.8026666666666,3
w13,2,128,8,4096,1536,32,32,256,16,4,3,680.2613333333333,3
w13,2,128,8,4096,1536,32,32,256,16,4,4,683.216,3
w13,2,128,8,4096,1536,32,32,256,16,8,3,681.6583333333333,3
w13,2,128,8,4096,1536,32,32,256,32,4,3,680.5383333333334,3
w13,2,128,8,4096,1536,32,32,256,32,4,4,683.2373333333334,3
w13,2,128,8,4096,1536,32,32,256,32,8,3,682.1063333333333,3
w13,2,128,8,4096,3072,16,16,256,1,4,3,1348.5913333333335,3
w13,2,128,8,4096,3072,16,16,256,1,4,4,1353.5296666666666,3
w13,2,128,8,4096,3072,16,16,256,1,8,3,1356.2923333333333,3
w13,2,128,8,4096,3072,16,16,256,1,8,4,1357.711,3
w13,2,128,8,4096,3072,16,16,256,4,4,3,1348.634,3
w13,2,128,8,4096,3072,16,16,256,4,4,4,1353.786,3
w13,2,128,8,4096,3072,16,16,256,4,8,3,1355.6736666666666,3
w13,2,128,8,4096,3072,16,16,256,4,8,4,1357.1563333333334,3
w13,2,128,8,4096,3072,16,32,256,1,4,3,1351.727,3
w13,2,128,8,4096,3072,16,32,256,1,4,4,1354.1913333333334,3
w13,2,128,8,4096,3072,16,32,256,1,8,3,1354.9376666666667,3
w13,2,128,8,4096,3072,16,32,256,1,8,4,1354.8416666666665,3
w13,2,128,8,4096,3072,16,32,256,16,4,3,1351.8023333333333,3
w13,2,128,8,4096,3072,16,32,256,16,4,4,1356.2493333333334,3
w13,2,128,8,4096,3072,16,32,256,16,8,3,1354.607,3
w13,2,128,8,4096,3072,16,32,256,16,8,4,1358.2553333333333,3
w13,2,128,8,4096,3072,16,32,256,32,4,3,1351.6093333333333,3
w13,2,128,8,4096,3072,16,32,256,32,4,4,1356.378,3
w13,2,128,8,4096,3072,16,32,256,32,8,3,1354.0523333333333,3
w13,2,128,8,4096,3072,16,32,256,32,8,4,1358.6393333333333,3
w13,2,128,8,4096,3072,16,32,256,64,4,3,1351.7906666666668,3
w13,2,128,8,4096,3072,16,32,256,64,4,4,1356.6123333333333,3
w13,2,128,8,4096,3072,16,32,256,64,8,3,1354.501,3
w13,2,128,8,4096,3072,16,32,256,64,8,4,1357.8076666666668,3
w13,2,128,8,4096,3072,16,64,256,1,4,3,1353.6793333333335,3
w13,2,128,8,4096,3072,16,64,256,1,8,3,1354.0846666666666,3
w13,2,128,8,4096,3072,16,64,256,16,4,3,1354.938,3
w13,2,128,8,4096,3072,16,64,256,16,8,3,1356.3883333333335,3
w13,2,128,8,4096,3072,16,64,256,32,4,3,1355.1723333333332,3
w13,2,128,8,4096,3072,16,64,256,32,8,3,1355.9189999999999,3
w13,2,128,8,4096,3072,16,64,256,64,4,3,1354.927,3
w13,2,128,8,4096,3072,16,64,256,64,8,3,1355.6096666666665,3
w13,2,128,8,4096,3072,32,16,128,4,4,4,1362.1803333333332,3
w13,2,128,8,4096,3072,32,32,256,1,4,3,1350.9056666666668,3
w13,2,128,8,4096,3072,32,32,256,1,4,4,1355.5780000000002,3
w13,2,128,8,4096,3072,32,32,256,1,8,3,1351.8016666666667,3
w13,2,128,8,4096,3072,32,32,256,1,8,4,1356.442,3
w13,2,128,8,4096,3072,32,32,256,4,4,3,1352.2393333333332,3
w13,2,128,8,4096,3072,32,32,256,4,4,4,1357.8073333333334,3
w13,2,128,8,4096,3072,32,32,256,4,8,3,1352.5803333333333,3
w13,2,128,8,4096,3072,32,32,256,4,8,4,1357.743333333333,3
w13,2,128,8,4096,3072,32,32,256,16,4,3,1353.390666666667,3
w13,2,128,8,4096,3072,32,32,256,16,4,4,1358.4363333333333,3
w13,2,128,8,4096,3072,32,32,256,16,8,3,1355.258,3
w13,2,128,8,4096,3072,32,32,256,16,8,4,1359.9296666666667,3
w13,2,128,8,4096,3072,32,32,256,32,4,3,1352.8793333333333,3
w13,2,128,8,4096,3072,32,32,256,32,4,4,1358.2656666666664,3
w13,2,128,8,4096,3072,32,32,256,32,8,3,1354.714,3
w13,2,128,8,4096,3072,32,32,256,32,8,4,1358.8950000000002,3
w13,2,128,8,4096,3072,32,64,256,1,4,3,1358.5216666666668,3
w13,2,128,8,4096,3072,32,64,256,1,8,3,1356.6656666666665,3
w13,2,128,8,4096,3072,32,64,256,8,4,3,1359.3536666666666,3
w13,2,128,8,4096,3072,32,64,256,8,8,3,1358.6390000000001,3
w13,2,128,8,4096,3072,32,64,256,16,4,3,1360.6446666666668,3
w13,2,128,8,4096,3072,32,64,256,16,8,3,1358.4043333333332,3
w13,2,128,8,4096,3072,32,64,256,32,4,3,1360.2283333333332,3
w13,2,128,8,4096,3072,32,64,256,32,8,3,1358.383,3
w13,2,128,8,4096,3072,32,64,256,64,4,3,1360.5376666666668,3
w13,2,128,8,4096,3072,32,64,256,64,8,3,1358.383,3
w13,2,128,8,4096,3072,64,32,256,1,4,3,1358.383,3
w13,2,128,8,4096,3072,64,32,256,1,8,3,1356.2820000000002,3
w13,4,8,2,1024,512,16,16,128,4,4,2,31.831999999999997,3
w13,4,8,2,1024,512,16,32,128,1,4,2,31.927666666666667,3
w13,4,8,2,1024,512,16,32,128,4,4,2,31.69333333333333,3
w13,4,8,2,1024,512,16,32,128,4,8,2,31.842,3
w13,4,8,2,1024,512,16,32,128,16,4,2,31.671333333333337,3
w13,4,8,2,1024,512,16,32,128,16,8,2,31.948666666666668,3
w13,4,8,2,1024,512,16,32,128,32,4,2,31.778999999999996,3
w13,4,8,2,1024,512,16,32,128,32,8,2,31.884666666666664,3
w13,4,8,2,1024,512,16,32,128,64,4,2,31.768333333333334,3
w13,4,8,2,1024,512,16,64,128,1,8,2,31.927666666666667,3
w13,4,8,2,1024,512,16,64,128,16,4,2,31.959333333333337,3
w13,4,8,2,1024,512,16,64,128,32,8,2,31.831999999999997,3
w13,4,8,2,1024,512,32,32,128,4,4,2,31.873999999999995,3
w13,4,8,2,1024,512,32,32,128,16,4,2,31.831333333333333,3
w13,4,16,2,1536,768,16,16,128,1,4,3,68.22733333333333,3
w13,4,16,2,1536,768,16,16,128,1,4,4,68.42966666666666,3
w13,4,16,2,1536,768,16,16,128,4,4,2,68.153,3
w13,4,16,2,1536,768,16,16,128,4,4,3,68.18533333333333,3
w13,4,16,2,1536,768,16,16,128,4,4,4,68.20633333333335,3
w13,4,16,2,1536,768,16,16,256,1,4,2,68.38733333333333,3
w13,4,16,2,1536,768,16,16,256,1,4,3,68.409,3
w13,4,16,2,1536,768,16,16,256,4,4,4,68.40866666666666,3
w13,4,16,2,1536,768,16,32,128,1,4,2,67.865,3
w13,4,16,2,1536,768,16,32,128,1,4,3,68.01433333333334,3
w13,4,16,2,1536,768,16,32,128,1,4,4,68.45133333333332,3
w13,4,16,2,1536,768,16,32,128,1,8,2,68.345,3
w13,4,16,2,1536,768,16,32,128,1,8,3,68.35533333333333,3
w13,4,16,2,1536,768,16,32,128,4,4,2,67.84366666666666,3
w13,4,16,2,1536,768,16,32,128,4,4,3,67.95066666666666,3
w13,4,16,2,1536,768,16,32,128,4,4,4,68.20633333333333,3
w13,4,16,2,1536,768,16,32,128,4,8,2,68.08933333333333,3
w13,4,16,2,1536,768,16,32,128,4,8,3,68.25966666666666,3
w13,4,16,2,1536,768,16,32,128,16,4,2,67.86566666666667,3
w13,4,16,2,1536,768,16,32,128,16,4,3,68.057,3
w13,4,16,2,1536,768,16,32,128,16,4,4,67.97166666666668,3
w13,4,16,2,1536,768,16,32,128,16,8,2,68.02499999999999,3
w13,4,16,2,1536,768,16,32,128,16,8,3,68.39766666666667,3
w13,4,16,2,1536,768,16,32,128,32,4,2,67.80199999999999,3
w13,4,16,2,1536,768,16,32,128,32,4,3,67.87599999999999,3
w13,4,16,2,1536,768,16,32,128,32,4,4,67.93966666666667,3
w13,4,16,2,1536,768,16,32,128,32,8,2,68.22733333333333,3
w13,4,16,2,1536,768,16,32,128,32,8,4,68.40866666666666,3
w13,4,16,2,1536,768,16,32,128,64,4,2,67.844,3
w13,4,16,2,1536,768,16,32,128,64,4,3,68.09933333333333,3
w13,4,16,2,1536,768,16,32,128,64,4,4,68.04666666666667,3
w13,4,16,2,1536,768,16,32,128,64,8,2,68.12133333333334,3
w13,4,16,2,1536,768,16,32,128,64,8,4,68.30233333333332,3
w13,4,16,2,1536,768,16,32,256,1,4,3,68.43033333333334,3
w13,4,16,2,1536,768,16,32,256,1,8,3,68.35566666666666,3
w13,4,16,2,1536,768,16,32,256,16,4,3,68.45133333333334,3
w13,4,16,2,1536,768,16,32,256,16,8,3,68.164,3
w13,4,16,2,1536,768,16,32,256,32,4,3,68.43033333333334,3
w13,4,16,2,1536,768,16,32,256,32,8,3,68.19566666666667,3
w13,4,16,2,1536,768,16,32,256,64,4,3,68.40866666666666,3
w13,4,16,2,1536,768,16,32,256,64,8,3,68.19566666666667,3
w13,4,16,2,1536,768,16,64,128,1,8,2,68.15266666666666,3
w13,4,16,2,1536,768,16,64,128,1,8,3,68.313,3
w13,4,16,2,1536,768,16,64,128,16,8,2,68.29133333333333,3
w13,4,16,2,1536,768,16,64,128,32,8,2,68.14200000000001,3
w13,4,16,2,1536,768,16,64,128,64,4,2,68.41966666666667,3
w13,4,16,2,1536,768,16,64,128,64,8,2,68.355,3
w13,4,16,2,1536,768,16,64,128,64,8,3,68.43,3
w13,4,16,2,1536,768,32,16,128,4,4,4,68.09966666666666,3
w13,4,16,2,1536,768,32,32,128,1,4,2,68.164,3
w13,4,16,2,1536,768,32,32,128,1,8,4,68.47233333333332,3
w13,4,16,2,1536,768,32,32,128,4,4,2,68.22766666666666,3
w13,4,16,2,1536,768,32,32,128,4,4,3,68.33366666666666,3
w13,4,16,2,1536,768,32,32,128,4,8,2,68.196,3
w13,4,16,2,1536,768,32,32,128,4,8,4,68.10000000000001,3
w13,4,16,2,1536,768,32,32,128,16,4,2,68.18533333333335,3
w13,4,16,2,1536,768,32,32,128,16,4,3,68.355,3
w13,4,16,2,1536,768,32,32,128,16,4,4,68.462,3
w13,4,16,2,1536,768,32,32,128,16,8,2,68.29133333333333,3
w13,4,16,2,1536,768,32,32,128,16,8,4,68.31266666666666,3
w13,4,16,2,1536,768,32,32,128,64,4,2,68.01433333333334,3
w13,4,16,2,1536,768,32,32,128,64,4,4,68.32366666666667,3
w13,4,16,2,1536,768,32,32,128,64,8,2,68.35533333333333,3
w13,4,16,2,1536,768,32,32,128,64,8,4,68.22733333333333,3
w13,4,16,2,1536,768,32,64,128,1,8,2,68.302,3
w13,4,16,2,1536,768,32,64,128,64,8,2,68.345,3
w13,4,16,4,1536,1024,16,16,256,1,4,3,173.933,3
w13,4,16,4,1536,1024,16,16,256,1,4,4,174.456,3
w13,4,16,4,1536,1024,16,16,256,4,4,3,173.43233333333333,3
w13,4,16,4,1536,1024,16,16,256,4,4,4,174.30666666666664,3
w13,4,16,4,1536,1024,16,32,256,1,4,3,174.06133333333332,3
w13,4,16,4,1536,1024,16,32,256,1,8,3,174.66933333333336,3
w13,4,16,4,1536,1024,16,32,256,16,4,3,174.78733333333332,3
w13,4,16,4,1536,1024,16,32,256,16,8,3,174.67966666666666,3
w13,4,16,4,1536,1024,16,32,256,32,4,3,174.47766666666666,3
w13,4,16,4,1536,1024,16,32,256,32,8,3,175.11766666666665,3
w13,4,16,4,1536,1024,16,32,256,64,4,3,174.73366666666666,3
w13,4,16,4,1536,1024,16,32,256,64,8,4,175.17066666666665,3
w13,4,16,4,1536,1024,32,32,256,1,4,3,175.03233333333333,3
w13,4,16,4,1536,1024,32,32,256,1,8,3,174.275,3
w13,4,16,4,1536,1024,32,32,256,4,8,3,175.18166666666664,3
w13,4,16,4,1536,1024,32,32,256,16,4,3,173.66666666666666,3
w13,4,16,4,1536,1024,32,32,256,16,8,3,173.731,3
w13,4,16,4,1536,1024,32,32,256,32,4,3,173.88,3
w13,4,16,4,1536,1024,32,32,256,32,8,3,173.763,3
w13,4,32,4,2048,768,16,16,128,1,4,3,174.607,3
w13,4,32,4,2048,768,16,16,128,4,4,3,174.79866666666666,3
w13,4,32,4,2048,768,16,16,128,4,4,4,174.87333333333333,3
w13,4,32,4,2048,768,16,16,256,1,4,3,173.43200000000002,3
w13,4,32,4,2048,768,16,16,256,1,4,4,173.8596666666667,3
w13,4,32,4,2048,768,16,16,256,4,4,2,174.94833333333335,3
w13,4,32,4,2048,768,16,16,256,4,4,3,173.76333333333332,3
w13,4,32,4,2048,768,16,16,256,4,4,4,174.08366666666666,3
w13,4,32,4,2048,768,16,32,128,1,4,3,175.14000000000001,3
w13,4,32,4,2048,768,16,32,128,1,4,4,174.681,3
w13,4,32,4,2048,768,16,32,128,4,4,4,174.58533333333332,3
w13,4,32,4,2048,768,16,32,128,4,8,4,175.11933333333332,3
w13,4,32,4,2048,768,16,32,128,16,4,3,175.01233333333334,3
w13,4,32,4,2048,768,16,32,128,16,4,4,174.92666666666665,3
w13,4,32,4,2048,768,16,32,128,32,4,3,175.01199999999997,3
w13,4,32,4,2048,768,16,32,128,32,4,4,174.93733333333333,3
w13,4,32,4,2048,768,16,32,128,64,4,4,175.02300000000002,3
w13,4,32,4,2048,768,16,32,256,1,4,3,173.913,3
w13,4,32,4,2048,768,16,32,256,1,4,4,174.99133333333336,3
w13,4,32,4,2048,768,16,32,256,1,8,3,174.489,3
w13,4,32,4,2048,768,16,32,256,1,8,4,174.26533333333336,3
w13,4,32,4,2048,768,16,32,256,16,4,2,174.93666666666664,3
w13,4,32,4,2048,768,16,32,256,16,4,3,173.41166666666666,3
w13,4,32,4,2048,768,16,32,256,16,8,3,173.6773333333333,3
w13,4,32,4,2048,768,16,32,256,32,4,2,174.8416666666667,3
w13,4,32,4,2048,768,16,32,256,32,4,3,173.45366666666666,3
w13,4,32,4,2048,768,16,32,256,32,8,3,174.47833333333335,3
w13,4,32,4,2048,768,16,32,256,64,4,2,174.93733333333333,3
w13,4,32,4,2048,768,16,32,256,64,4,3,173.50699999999998,3
w13,4,32,4,2048,768,16,32,256,64,8,3,174.13666666666666,3
w13,4,32,4,2048,768,16,64,256,16,4,3,175.01200000000003,3
w13,4,32,4,2048,768,16,64,256,16,8,2,174.80966666666666,3
w13,4,32,4,2048,768,16,64,256,16,8,3,174.94833333333335,3
w13,4,32,4,2048,768,16,64,256,32,4,3,175.12966666666668,3
w13,4,32,4,2048,768,16,64,256,32,8,3,174.85233333333335,3
w13,4,32,4,2048,768,16,64,256,64,4,3,175.10799999999998,3
w13,4,32,4,2048,768,16,64,256,64,8,3,174.91633333333334,3
w13,4,32,4,2048,768,32,16,128,4,4,3,175.09766666666667,3
w13,4,32,6,3072,1024,16,16,256,1,4,3,509.62566666666663,3
w13,4,32,6,3072,1024,16,16,256,1,4,4,513.3373333333334,3
w13,4,32,6,3072,1024,16,16,256,4,4,3,508.836,3
w13,4,32,6,3072,1024,16,16,256,4,4,4,512.9323333333333,3
w13,4,32,6,3072,1024,16,32,256,1,4,3,510.5,3
w13,4,32,6,3072,1024,16,32,256,1,8,3,513.263,3
w13,4,32,6,3072,1024,16,32,256,16,4,3,509.988,3
w13,4,32,6,3072,1024,16,32,256,32,4,3,511.1296666666667,3
w13,4,32,6,3072,1024,16,32,256,64,4,3,510.76666666666665,3
w13,4,32,6,3072,1024,16,64,256,1,4,3,512.5803333333333,3
w13,4,32,6,3072,1024,16,64,256,1,8,3,513.8493333333333,3
w13,4,32,6,3072,1024,16,64,256,16,4,3,512.3456666666667,3
w13,4,32,6,3072,1024,16,64,256,16,8,3,513.3696666666666,3
w13,4,32,6,3072,1024,16,64,256,32,4,3,512.4843333333334,3
w13,4,32,6,3072,1024,16,64,256,32,8,3,513.7959999999999,3
w13,4,32,6,3072,1024,16,64,256,64,4,3,512.42,3
w13,4,32,6,3072,1024,32,32,256,1,4,3,509.31600000000003,3
w13,4,32,6,3072,1024,32,32,256,1,8,3,511.396,3
w13,4,32,6,3072,1024,32,32,256,4,4,3,509.3376666666666,3
w13,4,32,6,3072,1024,32,32,256,4,8,3,510.93766666666664,3
w13,4,32,6,3072,1024,32,32,256,16,4,3,509.91333333333336,3
w13,4,32,6,3072,1024,32,32,256,16,8,3,511.204,3
w13,4,32,6,3072,1024,32,32,256,32,4,3,511.17233333333337,3
w13,4,32,6,3072,1024,32,32,256,32,8,3,513.3163333333333,3
w13,4,60,4,2048,1408,16,16,256,1,4,3,312.89799999999997,3
w13,4,60,4,2048,1408,16,16,256,1,4,4,314.12466666666666,3
w13,4,60,4,2048,1408,16,16,256,4,4,3,312.16200000000003,3
w13,4,60,4,2048,1408,16,16,256,4,4,4,313.719,3
w13,4,60,4,2048,1408,16,16,256,4,8,3,315.14866666666666,3
w13,4,60,4,2048,1408,16,32,256,1,4,3,313.7513333333333,3
w13,4,60,4,2048,1408,16,32,256,1,4,4,314.45533333333333,3
w13,4,60,4,2048,1408,16,32,256,1,8,3,314.78566666666666,3
w13,4,60,4,2048,1408,16,32,256,1,8,4,314.786,3
w13,4,60,4,2048,1408,16,32,256,16,4,3,313.41,3
w13,4,60,4,2048,1408,16,32,256,16,8,3,313.4633333333333,3
w13,4,60,4,2048,1408,16,32,256,32,4,3,313.5806666666667,3
w13,4,60,4,2048,1408,16,32,256,32,8,3,314.2426666666667,3
w13,4,60,4,2048,1408,16,32,256,64,4,3,313.5593333333333,3
w13,4,60,4,2048,1408,16,32,256,64,8,3,314.36999999999995,3
w13,4,60,4,2048,1408,16,64,256,1,8,3,315.1166666666666,3
w13,4,60,4,2048,1408,16,64,256,16,4,3,315.24466666666666,3
w13,4,60,4,2048,1408,16,64,256,64,8,3,315.21233333333333,3
w13,4,60,4,2048,1408,32,32,256,1,4,3,313.92199999999997,3
w13,4,60,4,2048,1408,32,32,256,1,8,3,314.92466666666667,3
w13,4,60,4,2048,1408,32,32,256,4,4,3,314.13599999999997,3
w13,4,60,4,2048,1408,32,32,256,4,8,3,313.901,3
w13,4,60,4,2048,1408,32,32,256,16,4,3,314.56199999999995,3
w13,4,60,4,2048,1408,32,32,256,16,8,3,314.71133333333336,3
w13,4,60,4,2048,1408,32,32,256,32,4,3,314.5836666666667,3
w13,4,60,4,2048,1408,32,32,256,32,8,3,314.7753333333333,3
w13,4,60,6,3584,2304,16,16,256,1,4,3,1324.5713333333333,3
w13,4,60,6,3584,2304,16,16,256,1,4,4,1334.7576666666666,3
w13,4,60,6,3584,2304,16,16,256,1,8,3,1336.1019999999999,3
w13,4,60,6,3584,2304,16,16,256,4,4,3,1323.814,3
w13,4,60,6,3584,2304,16,16,256,4,4,4,1334.9386666666667,3
w13,4,60,6,3584,2304,16,16,256,4,8,3,1333.6586666666665,3
w13,4,60,6,3584,2304,16,32,256,1,4,3,1328.4433333333334,3
w13,4,60,6,3584,2304,16,32,256,1,4,4,1336.2823333333333,3
w13,4,60,6,3584,2304,16,32,256,1,8,3,1332.0906666666667,3
w13,4,60,6,3584,2304,16,32,256,16,4,3,1327.8990000000001,3
w13,4,60,6,3584,2304,16,32,256,16,8,3,1331.568,3
w13,4,60,6,3584,2304,16,32,256,32,4,3,1329.2753333333333,3
w13,4,60,6,3584,2304,16,32,256,32,8,3,1332.229,3
w13,4,60,6,3584,2304,16,32,256,64,4,3,1329.563,3
w13,4,60,6,3584,2304,16,32,256,64,8,3,1333.2323333333334,3
w13,4,60,6,3584,2304,16,64,256,1,4,3,1330.1386666666665,3
w13,4,60,6,3584,2304,16,64,256,1,8,3,1333.7446666666667,3
w13,4,60,6,3584,2304,16,64,256,16,4,3,1330.1606666666667,3
w13,4,60,6,3584,2304,16,64,256,16,8,3,1333.9896666666666,3
w13,4,60,6,3584,2304,16,64,256,32,4,3,1331.8986666666667,3
w13,4,60,6,3584,2304,16,64,256,32,8,3,1335.664,3
w13,4,60,6,3584,2304,16,64,256,64,4,3,1331.974,3
w13,4,60,6,3584,2304,16,64,256,64,8,3,1335.5686666666668,3
w13,4,60,6,3584,2304,32,32,256,1,4,3,1324.3786666666667,3
w13,4,60,6,3584,2304,32,32,256,1,4,4,1336.987,3
w13,4,60,6,3584,2304,32,32,256,1,8,3,1327.3863333333334,3
w13,4,60,6,3584,2304,32,32,256,4,4,3,1326.9073333333333,3
w13,4,60,6,3584,2304,32,32,256,4,8,3,1329.1573333333333,3
w13,4,60,6,3584,2304,32,32,256,16,4,3,1327.8456666666668,3
w13,4,60,6,3584,2304,32,32,256,16,8,3,1330.8216666666667,3
w13,4,60,6,3584,2304,32,32,256,32,4,3,1328.2296666666668,3
w13,4,60,6,3584,2304,32,32,256,32,8,3,1332.955,3
w13,4,60,6,3584,2304,64,32,256,1,4,3,1334.8003333333334,3
w13,4,60,6,3584,2304,64,32,256,1,8,3,1336.5176666666666,3
w13,4,60,8,2048,1536,16,16,256,1,4,3,676.1303333333333,3
w13,4,60,8,2048,1536,16,16,256,1,4,4,678.3493333333332,3
w13,4,60,8,2048,1536,16,16,256,1,8,3,679.565,3
w13,4,60,8,2048,1536,16,16,256,1,8,4,679.736,3
w13,4,60,8,2048,1536,16,16,256,4,4,3,676.0876666666667,3
w13,4,60,8,2048,1536,16,16,256,4,4,4,677.9866666666667,3
w13,4,60,8,2048,1536,16,16,256,4,8,3,679.7890000000001,3
w13,4,60,8,2048,1536,16,16,256,4,8,4,680.0023333333334,3
w13,4,60,8,2048,1536,16,32,256,1,4,3,677.7943333333334,3
w13,4,60,8,2048,1536,16,32,256,1,4,4,678.701,3
w13,4,60,8,2048,1536,16,32,256,1,8,3,679.2446666666667,3
w13,4,60,8,2048,1536,16,32,256,1,8,4,678.8293333333335,3
w13,4,60,8,2048,1536,16,32,256,16,4,3,677.2073333333334,3
w13,4,60,8,2048,1536,16,32,256,16,4,4,679.533,3
w13,4,60,8,2048,1536,16,32,256,16,8,3,678.6373333333332,3
w13,4,60,8,2048,1536,16,32,256,16,8,4,680.5783333333334,3
w13,4,60,8,2048,1536,16,32,256,32,4,3,678.2529999999999,3
w13,4,60,8,2048,1536,16,32,256,32,4,4,680.5033333333334,3
w13,4,60,8,2048,1536,16,32,256,32,8,3,679.3193333333332,3
w13,4,60,8,2048,1536,16,32,256,32,8,4,681.1653333333334,3
w13,4,60,8,2048,1536,16,32,256,64,4,3,678.3173333333334,3
w13,4,60,8,2048,1536,16,32,256,64,4,4,681.069,3
w13,4,60,8,2048,1536,16,32,256,64,8,3,679.6076666666667,3
w13,4,60,8,2048,1536,16,32,256,64,8,4,680.6206666666666,3
w13,4,60,8,2048,1536,16,64,256,1,4,3,680.0023333333334,3
w13,4,60,8,2048,1536,16,64,256,1,8,3,679.8743333333333,3
w13,4,60,8,2048,1536,16,64,256,16,4,3,680.6210000000001,3
w13,4,60,8,2048,1536,16,64,256,16,8,3,680.6636666666667,3
w13,4,60,8,2048,1536,16,64,256,32,4,3,681.4316666666667,3
w13,4,60,8,2048,1536,16,64,256,32,8,3,680.9086666666666,3
w13,4,60,8,2048,1536,16,64,256,64,4,3,681.4423333333333,3
w13,4,60,8,2048,1536,16,64,256,64,8,3,680.994,3
w13,4,60,8,2048,1536,32,32,256,1,4,3,677.005,3
w13,4,60,8,2048,1536,32,32,256,1,4,4,679.9276666666666,3
w13,4,60,8,2048,1536,32,32,256,1,8,3,677.2826666666666,3
w13,4,60,8,2048,1536,32,32,256,1,8,4,680.5356666666667,3
w13,4,60,8,2048,1536,32,32,256,4,4,3,678.413,3
w13,4,60,8,2048,1536,32,32,256,4,4,4,680.9193333333334,3
w13,4,60,8,2048,1536,32,32,256,4,8,3,678.3593333333333,3
w13,4,60,8,2048,1536,32,32,256,4,8,4,681.7406666666667,3
w13,4,60,8,2048,1536,32,32,256,16,4,3,678.8290000000001,3
w13,4,60,8,2048,1536,32,32,256,16,4,4,682.093,3
w13,4,60,8,2048,1536,32,32,256,16,8,3,679.4366666666666,3
w13,4,60,8,2048,1536,32,32,256,16,8,4,682.6903333333333,3
w13,4,60,8,2048,1536,32,32,256,32,4,3,679.6503333333334,3
w13,4,60,8,2048,1536,32,32,256,32,4,4,681.3359999999999,3
w13,4,60,8,2048,1536,32,32,256,32,8,3,680.6743333333334,3
w13,4,60,8,2048,1536,32,64,256,1,4,3,682.893,3
w13,4,60,8,2048,1536,32,64,256,1,8,3,681.1006666666667,3
w13,4,60,8,2048,1536,32,64,256,8,8,3,681.496,3
w13,4,60,8,2048,1536,32,64,256,16,8,3,681.9226666666667,3
w13,4,60,8,2048,1536,32,64,256,32,8,3,682.3596666666666,3
w13,4,60,8,2048,1536,64,32,256,1,4,3,682.616,3
w13,4,60,8,2048,1536,64,32,256,1,8,3,680.9516666666667,3
w13,4,64,6,3072,2048,16,16,256,1,4,3,1012.1550000000001,3
w13,4,64,6,3072,2048,16,16,256,1,4,4,1019.0776666666667,3
w13,4,64,6,3072,2048,16,16,256,1,8,3,1019.4516666666667,3
w13,4,64,6,3072,2048,16,16,256,4,4,3,1009.361,3
w13,4,64,6,3072,2048,16,16,256,4,4,4,1019.5050000000001,3
w13,4,64,6,3072,2048,16,16,256,4,8,3,1017.5740000000001,3
w13,4,64,6,3072,2048,16,32,256,1,4,3,1013.2856666666667,3
w13,4,64,6,3072,2048,16,32,256,1,8,3,1017.7336666666666,3
w13,4,64,6,3072,2048,16,32,256,16,4,3,1013.5206666666667,3
w13,4,64,6,3072,2048,16,32,256,16,8,3,1016.0056666666666,3
w13,4,64,6,3072,2048,16,32,256,32,4,3,1013.6806666666666,3
w13,4,64,6,3072,2048,16,32,256,32,8,3,1016.8593333333333,3
w13,4,64,6,3072,2048,16,32,256,64,4,3,1013.755,3
w13,4,64,6,3072,2048,16,32,256,64,8,3,1016.774,3
w13,4,64,6,3072,2048,16,64,256,1,4,3,1014.7046666666666,3
w13,4,64,6,3072,2048,16,64,256,1,8,3,1016.5173333333333,3
w13,4,64,6,3072,2048,16,64,256,16,4,3,1015.281,3
w13,4,64,6,3072,2048,16,64,256,16,8,3,1017.5740000000001,3
w13,4,64,6,3072,2048,16,64,256,32,4,3,1015.5256666666668,3
w13,4,64,6,3072,2048,16,64,256,32,8,3,1019.1946666666666,3
w13,4,64,6,3072,2048,16,64,256,64,4,3,1015.2913333333332,3
w13,4,64,6,3072,2048,16,64,256,64,8,3,1018.427,3
w13,4,64,6,3072,2048,32,32,256,1,4,3,1010.63,3
w13,4,64,6,3072,2048,32,32,256,1,8,3,1011.8776666666666,3
w13,4,64,6,3072,2048,32,32,256,4,4,3,1011.2806666666667,3
w13,4,64,6,3072,2048,32,32,256,4,8,3,1012.3786666666666,3
w13,4,64,6,3072,2048,32,32,256,16,4,3,1012.9229999999999,3
w13,4,64,6,3072,2048,32,32,256,16,8,3,1013.9473333333334,3
w13,4,64,6,3072,2048,32,32,256,32,4,3,1014.1286666666666,3
w13,4,64,6,3072,2048,32,32,256,32,8,3,1016.6776666666666,3
w13,4,64,6,3072,2048,64,32,256,1,8,3,1018.1926666666667,3
w13,4,64,6,3584,1536,16,16,256,1,4,3,886.415,3
w13,4,64,6,3584,1536,16,16,256,1,4,4,892.3233333333334,3
w13,4,64,6,3584,1536,16,16,256,4,4,3,885.0923333333334,3
w13,4,64,6,3584,1536,16,16,256,4,4,4,891.6096666666666,3
w13,4,64,6,3584,1536,16,32,256,1,4,3,888.2066666666666,3
w13,4,64,6,3584,1536,16,32,256,1,4,4,892.1966666666667,3
w13,4,64,6,3584,1536,16,32,256,1,8,3,891.3856666666667,3
w13,4,64,6,3584,1536,16,32,256,1,8,4,892.9426666666667,3
w13,4,64,6,3584,1536,16,32,256,16,4,3,888.9316666666667,3
w13,4,64,6,3584,1536,16,32,256,16,8,3,890.4576666666667,3
w13,4,64,6,3584,1536,16,32,256,32,4,3,888.5056666666666,3
w13,4,64,6,3584,1536,16,32,256,32,8,3,891.0553333333334,3
w13,4,64,6,3584,1536,16,32,256,64,4,3,889.2310000000001,3
w13,4,64,6,3584,1536,16,32,256,64,8,3,891.7373333333334,3
w13,4,64,6,3584,1536,16,64,256,1,4,3,890.5,3
w13,4,64,6,3584,1536,16,64,256,1,8,3,892.6546666666667,3
w13,4,64,6,3584,1536,16,64,256,16,4,3,890.3616666666667,3
w13,4,64,6,3584,1536,16,64,256,32,4,3,890.9483333333333,3
w13,4,64,6,3584,1536,16,64,256,64,4,3,891.471,3
w13,4,64,6,3584,1536,16,64,256,64,8,3,893.0706666666669,3
w13,4,64,6,3584,1536,32,32,256,1,4,3,884.3026666666666,3
w13,4,64,6,3584,1536,32,32,256,1,4,4,892.8470000000001,3
w13,4,64,6,3584,1536,32,32,256,1,8,3,885.7959999999999,3
w13,4,64,6,3584,1536,32,32,256,4,4,3,884.4733333333334,3
w13,4,64,6,3584,1536,32,32,256,4,4,4,893.1990000000001,3
w13,4,64,6,3584,1536,32,32,256,4,8,3,885.3906666666667,3
w13,4,64,6,3584,1536,32,32,256,16,4,3,886.4256666666666,3
w13,4,64,6,3584,1536,32,32,256,16,8,3,887.0973333333333,3
w13,4,64,6,3584,1536,32,32,256,32,4,3,887.6840000000001,3
w13,4,64,6,3584,1536,32,32,256,32,8,3,888.4413333333333,3
w13,4,64,6,3584,1536,64,32,256,1,8,3,892.4843333333333,3
w13,4,64,8,3584,2560,16,16,256,1,4,3,1957.5780000000002,3
w13,4,64,8,3584,2560,16,16,256,1,4,4,1974.1653333333334,3
w13,4,64,8,3584,2560,16,16,256,1,8,3,1970.9116666666669,3
w13,4,64,8,3584,2560,16,16,256,4,4,3,1958.4526666666668,3
w13,4,64,8,3584,2560,16,16,256,4,8,3,1972.4476666666667,3
w13,4,64,8,3584,2560,16,32,256,1,4,3,1963.4233333333334,3
w13,4,64,8,3584,2560,16,32,256,1,8,3,1969.749,3
w13,4,64,8,3584,2560,16,32,256,16,4,3,1964.5753333333332,3
w13,4,64,8,3584,2560,16,32,256,16,8,3,1970.9863333333335,3
w13,4,64,8,3584,2560,16,32,256,32,4,3,1967.4233333333332,3
w13,4,64,8,3584,2560,16,32,256,32,8,3,1972.7573333333332,3
w13,4,64,8,3584,2560,16,32,256,64,4,3,1967.167666666667,3
w13,4,64,8,3584,2560,16,32,256,64,8,3,1973.6853333333336,3
w13,4,64,8,3584,2560,16,64,256,1,4,3,1965.6103333333333,3
w13,4,64,8,3584,2560,16,64,256,1,8,3,1971.5836666666667,3
w13,4,64,8,3584,2560,16,64,256,16,4,3,1968.3410000000001,3
w13,4,64,8,3584,2560,16,64,256,16,8,3,1973.7169999999999,3
w13,4,64,8,3584,2560,16,64,256,32,4,3,1971.552,3
w13,4,64,8,3584,2560,16,64,256,64,4,3,1971.3813333333335,3
w13,4,64,8,3584,2560,32,32,256,1,4,3,1954.7830000000001,3
w13,4,64,8,3584,2560,32,32,256,1,8,3,1957.2369999999999,3
w13,4,64,8,3584,2560,32,32,256,4,4,3,1956.938,3
w13,4,64,8,3584,2560,32,32,256,4,8,3,1958.805,3
w13,4,64,8,3584,2560,32,32,256,16,4,3,1959.4023333333334,3
w13,4,64,8,3584,2560,32,32,256,16,8,3,1962.591333333333,3
w13,4,64,8,3584,2560,32,32,256,32,4,3,1964.6286666666667,3
w13,4,64,8,3584,2560,32,32,256,32,8,3,1967.722,3
w13,4,64,8,3584,2560,64,32,256,1,4,3,1970.528,3
w13,4,64,8,3584,2560,64,32,256,1,8,3,1967.6473333333333,3
w13,4,128,4,2048,512,16,16,128,1,4,2,118.54199999999999,3
w13,4,128,4,2048,512,16,16,128,1,4,3,117.96600000000001,3
w13,4,128,4,2048,512,16,16,128,4,4,2,118.69166666666666,3
w13,4,128,4,2048,512,16,16,128,4,4,3,117.625,3
w13,4,128,4,2048,512,16,16,256,1,4,2,117.83800000000001,3
w13,4,128,4,2048,512,16,16,256,1,4,3,118.32833333333333,3
w13,4,128,4,2048,512,16,16,256,1,4,4,117.859,3
w13,4,128,4,2048,512,16,16,256,4,4,2,117.65733333333333,3
w13,4,128,4,2048,512,16,16,256,4,4,4,117.68866666666668,3
w13,4,128,4,2048,512,16,32,128,1,4,2,118.24400000000001,3
w13,4,128,4,2048,512,16,32,128,1,4,3,118.5,3
w13,4,128,4,2048,512,16,32,128,4,4,2,118.20133333333335,3
w13,4,128,4,2048,512,16,32,128,4,4,3,118.137,3
w13,4,128,4,2048,512,16,32,128,4,8,2,118.74466666666666,3
w13,4,128,4,2048,512,16,32,128,4,8,3,118.62733333333334,3
w13,4,128,4,2048,512,16,32,128,16,4,2,118.22233333333334,3
w13,4,128,4,2048,512,16,32,128,16,4,3,117.94466666666666,3
w13,4,128,4,2048,512,16,32,128,16,8,3,118.425,3
w13,4,128,4,2048,512,16,32,128,32,4,2,118.254,3
w13,4,128,4,2048,512,16,32,128,32,4,3,118.05133333333333,3
w13,4,128,4,2048,512,16,32,128,32,8,3,118.26499999999999,3
w13,4,128,4,2048,512,16,32,128,64,4,2,118.14733333333334,3
w13,4,128,4,2048,512,16,32,128,64,4,3,117.88066666666667,3
w13,4,128,4,2048,512,16,32,128,64,8,3,118.06166666666667,3
w13,4,128,4,2048,512,16,32,256,1,4,2,118.28566666666666,3
w13,4,128,4,2048,512,16,32,256,16,4,2,117.96666666666665,3
w13,4,128,4,2048,512,16,32,256,16,8,2,117.78466666666667,3
w13,4,128,4,2048,512,16,32,256,32,4,2,118.02999999999999,3
w13,4,128,4,2048,512,16,32,256,32,8,2,118.39266666666667,3
w13,4,128,4,2048,512,16,32,256,64,4,2,117.88033333333333,3
w13,4,128,4,2048,512,16,32,256,64,8,2,118.01933333333334,3
w13,4,128,4,2048,512,16,64,128,1,8,2,118.521,3
w13,4,128,4,2048,512,16,64,128,1,8,3,118.41433333333333,3
w13,4,128,4,2048,512,16,64,128,16,8,3,118.44566666666667,3
w13,4,128,4,2048,512,16,64,128,32,8,3,118.47833333333334,3
w13,4,128,4,2048,512,16,64,128,64,8,2,118.78733333333332,3
w13,4,128,4,2048,512,16,64,256,16,8,2,118.57433333333331,3
w13,4,128,4,2048,512,16,64,256,32,8,2,118.75533333333333,3
w13,4,128,4,2048,512,32,16,128,4,4,2,118.532,3
w13,4,128,4,2048,512,32,64,128,1,8,2,118.80866666666667,3
w13,4,128,4,2048,512,32,64,128,1,8,3,118.78733333333334,3
w13,4,128,4,2048,512,32,64,256,16,8,2,118.79833333333333,3
w13,4,128,6,4096,2048,16,16,256,1,4,3,1349.642,3
w13,4,128,6,4096,2048,16,16,256,1,4,4,1353.3003333333334,3
w13,4,128,6,4096,2048,16,16,256,1,8,3,1359.0393333333334,3
w13,4,128,6,4096,2048,16,16,256,1,8,4,1356.5220000000002,3
w13,4,128,6,4096,2048,16,16,256,4,4,3,1348.5106666666668,3
w13,4,128,6,4096,2048,16,16,256,4,4,4,1353.8343333333332,3
w13,4,128,6,4096,2048,16,16,256,4,8,3,1355.2309999999998,3
w13,4,128,6,4096,2048,16,16,256,4,8,4,1357.1086666666667,3
w13,4,128,6,4096,2048,16,32,256,1,4,3,1351.37,3
w13,4,128,6,4096,2048,16,32,256,1,4,4,1353.7803333333331,3
w13,4,128,6,4096,2048,16,32,256,1,8,3,1354.8256666666666,3
w13,4,128,6,4096,2048,16,32,256,1,8,4,1354.7936666666667,3
w13,4,128,6,4096,2048,16,32,256,16,4,3,1351.9993333333332,3
w13,4,128,6,4096,2048,16,32,256,16,4,4,1356.4366666666667,3
w13,4,128,6,4096,2048,16,32,256,16,8,3,1353.5246666666665,3
w13,4,128,6,4096,2048,16,32,256,16,8,4,1357.4603333333334,3
w13,4,128,6,4096,2048,16,32,256,32,4,3,1351.807,3
w13,4,128,6,4096,2048,16,32,256,32,4,4,1358.837,3
w13,4,128,6,4096,2048,16,32,256,32,8,3,1354.3566666666668,3
w13,4,128,6,4096,2048,16,32,256,32,8,4,1359.54,3
w13,4,128,6,4096,2048,16,32,256,64,4,3,1351.8926666666666,3
w13,4,128,6,4096,2048,16,32,256,64,4,4,1359.4550000000002,3
w13,4,128,6,4096,2048,16,32,256,64,8,3,1354.7943333333335,3
w13,4,128,6,4096,2048,16,32,256,64,8,4,1360.1803333333335,3
w13,4,128,6,4096,2048,16,64,256,1,4,3,1353.6953333333333,3
w13,4,128,6,4096,2048,16,64,256,1,8,3,1354.5803333333333,3
w13,4,128,6,4096,2048,16,64,256,16,4,3,1354.527,3
w13,4,128,6,4096,2048,16,64,256,16,8,3,1356.0633333333333,3
w13,4,128,6,4096,2048,16,64,256,32,4,3,1355.21,3
w13,4,128,6,4096,2048,16,64,256,32,8,3,1357.0553333333332,3
w13,4,128,6,4096,2048,16,64,256,64,4,3,1355.2526666666665,3
w13,4,128,6,4096,2048,16,64,256,64,8,3,1356.5326666666667,3
w13,4,128,6,4096,2048,32,16,128,4,4,4,1361.834,3
w13,4,128,6,4096,2048,32,32,256,1,4,3,1350.0903333333333,3
w13,4,128,6,4096,2048,32,32,256,1,4,4,1355.3276666666666,3
w13,4,128,6,4096,2048,32,32,256,1,8,3,1351.818,3
w13,4,128,6,4096,2048,32,32,256,1,8,4,1356.4153333333334,3
w13,4,128,6,4096,2048,32,32,256,4,4,3,1351.1139999999998,3
w13,4,128,6,4096,2048,32,32,256,4,4,4,1355.7653333333333,3
w13,4,128,6,4096,2048,32,32,256,4,8,3,1351.8073333333334,3
w13,4,128,6,4096,2048,32,32,256,4,8,4,1356.5646666666667,3
w13,4,128,6,4096,2048,32,32,256,16,4,3,1354.3886666666667,3
w13,4,128,6,4096,2048,32,32,256,16,4,4,1357.994,3
w13,4,128,6,4096,2048,32,32,256,16,8,3,1354.7196666666666,3
w13,4,128,6,4096,2048,32,32,256,16,8,4,1359.114,3
w13,4,128,6,4096,2048,32,32,256,32,4,3,1354.9433333333334,3
w13,4,128,6,4096,2048,32,32,256,32,4,4,1360.3196666666665,3
w13,4,128,6,4096,2048,32,32,256,32,8,3,1356.2126666666666,3
w13,4,128,6,4096,2048,32,32,256,32,8,4,1361.2903333333331,3
w13,4,128,6,4096,2048,32,64,256,1,4,3,1358.8373333333334,3
w13,4,128,6,4096,2048,32,64,256,1,8,3,1356.4260000000002,3
w13,4,128,6,4096,2048,32,64,256,8,4,3,1359.1566666666668,3
w13,4,128,6,4096,2048,32,64,256,8,8,3,1357.6846666666668,3
w13,4,128,6,4096,2048,32,64,256,16,4,3,1359.4873333333333,3
w13,4,128,6,4096,2048,32,64,256,16,8,3,1357.802,3
w13,4,128,6,4096,2048,32,64,256,32,8,3,1359.082,3
w13,4,128,6,4096,2048,32,64,256,64,4,3,1361.1196666666667,3
w13,4,128,6,4096,2048,32,64,256,64,8,3,1360.1166666666668,3
w13,4,128,6,4096,2048,64,32,256,1,4,3,1358.314,3
w13,4,128,6,4096,2048,64,32,256,1,8,3,1356.426333333333,3
w13,4,128,8,2048,768,16,16,256,1,4,3,340.69700000000006,3
w13,4,128,8,2048,768,16,16,256,1,4,4,342.0946666666667,3
w13,4,128,8,2048,768,16,16,256,1,8,3,343.45966666666664,3
w13,4,128,8,2048,768,16,16,256,1,8,4,343.2036666666667,3
w13,4,128,8,2048,768,16,16,256,4,4,3,340.44166666666666,3
w13,4,128,8,2048,768,16,16,256,4,4,4,341.892,3
w13,4,128,8,2048,768,16,16,256,4,8,3,343.33199999999994,3
w13,4,128,8,2048,768,16,16,256,4,8,4,343.7263333333333,3
w13,4,128,8,2048,768,16,32,256,1,4,3,341.72133333333335,3
w13,4,128,8,2048,768,16,32,256,1,4,4,343.08633333333336,3
w13,4,128,8,2048,768,16,32,256,1,8,3,343.4276666666667,3
w13,4,128,8,2048,768,16,32,256,1,8,4,342.8096666666667,3
w13,4,128,8,2048,768,16,32,256,16,4,3,341.84933333333333,3
w13,4,128,8,2048,768,16,32,256,16,4,4,343.87566666666663,3
w13,4,128,8,2048,768,16,32,256,16,8,3,342.99066666666664,3
w13,4,128,8,2048,768,16,32,256,16,8,4,343.705,3
w13,4,128,8,2048,768,16,32,256,32,4,3,342.233,3
w13,4,128,8,2048,768,16,32,256,32,4,4,343.4173333333333,3
w13,4,128,8,2048,768,16,32,256,64,4,3,342.1476666666667,3
w13,4,128,8,2048,768,16,64,256,1,4,3,343.353,3
w13,4,128,8,2048,768,16,64,256,1,8,3,343.5986666666667,3
w13,4,128,8,2048,768,16,64,256,16,4,3,343.34233333333333,3
w13,4,128,8,2048,768,16,64,256,16,8,3,343.8543333333334,3
w13,4,128,8,2048,768,16,64,256,32,4,3,343.854,3
w13,4,128,8,2048,768,32,32,256,1,4,3,342.30766666666665,3
w13,4,128,8,2048,768,32,32,256,1,8,3,342.40366666666665,3
w13,4,128,8,2048,768,32,32,256,4,4,3,341.97666666666663,3
w13,4,128,8,2048,768,32,32,256,4,4,4,343.69433333333336,3
w13,4,128,8,2048,768,32,32,256,4,8,3,342.0943333333333,3
w13,4,128,8,2048,768,32,32,256,16,4,3,343.44900000000007,3
w13,4,128,8,2048,768,32,32,256,16,8,3,343.81200000000007,3
w13,4,128,8,4096,1536,16,16,256,1,4,3,1348.3396666666667,3
w13,4,128,8,4096,1536,16,16,256,1,4,4,1353.5873333333332,3
w13,4,128,8,4096,1536,16,16,256,1,8,3,1355.1016666666665,3
w13,4,128,8,4096,1536,16,16,256,1,8,4,1357.2993333333334,3
w13,4,128,8,4096,1536,16,16,256,4,4,3,1348.563,3
w13,4,128,8,4096,1536,16,16,256,4,4,4,1353.865,3
w13,4,128,8,4096,1536,16,16,256,4,8,3,1357.0643333333335,3
w13,4,128,8,4096,1536,16,16,256,4,8,4,1356.8193333333334,3
w13,4,128,8,4096,1536,16,32,256,1,4,3,1351.5176666666666,3
w13,4,128,8,4096,1536,16,32,256,1,4,4,1354.2373333333333,3
w13,4,128,8,4096,1536,16,32,256,1,8,3,1354.9846666666665,3
w13,4,128,8,4096,1536,16,32,256,1,8,4,1355.3363333333334,3
w13,4,128,8,4096,1536,16,32,256,16,4,3,1351.2826666666667,3
w13,4,128,8,4096,1536,16,32,256,16,4,4,1356.4246666666666,3
w13,4,128,8,4096,1536,16,32,256,16,8,3,1354.5466666666666,3
w13,4,128,8,4096,1536,16,32,256,16,8,4,1357.406,3
w13,4,128,8,4096,1536,16,32,256,32,4,3,1352.4133333333332,3
w13,4,128,8,4096,1536,16,32,256,32,4,4,1359.486,3
w13,4,128,8,4096,1536,16,32,256,32,8,3,1354.7603333333332,3
w13,4,128,8,4096,1536,16,32,256,32,8,4,1360.3286666666665,3
w13,4,128,8,4096,1536,16,32,256,64,4,3,1352.2430000000002,3
w13,4,128,8,4096,1536,16,32,256,64,4,4,1359.7633333333333,3
w13,4,128,8,4096,1536,16,32,256,64,8,3,1354.878,3
w13,4,128,8,4096,1536,16,32,256,64,8,4,1359.902,3
w13,4,128,8,4096,1536,16,64,256,1,4,3,1354.3653333333334,3
w13,4,128,8,4096,1536,16,64,256,1,8,3,1354.4936666666665,3
w13,4,128,8,4096,1536,16,64,256,16,4,3,1354.9956666666667,3
w13,4,128,8,4096,1536,16,64,256,16,8,3,1355.7423333333334,3
w13,4,128,8,4096,1536,16,64,256,32,4,3,1355.9023333333334,3
w13,4,128,8,4096,1536,16,64,256,32,8,3,1356.7763333333332,3
w13,4,128,8,4096,1536,16,64,256,64,4,3,1355.624,3
w13,4,128,8,4096,1536,16,64,256,64,8,3,1357.0326666666667,3
w13,4,128,8,4096,1536,32,32,256,1,4,3,1351.0596666666668,3
w13,4,128,8,4096,1536,32,32,256,1,4,4,1355.4436666666668,3
w13,4,128,8,4096,1536,32,32,256,1,8,3,1352.041,3
w13,4,128,8,4096,1536,32,32,256,1,8,4,1356.6913333333332,3
w13,4,128,8,4096,1536,32,32,256,4,4,3,1351.4966666666667,3
w13,4,128,8,4096,1536,32,32,256,4,4,4,1356.4246666666666,3
w13,4,128,8,4096,1536,32,32,256,4,8,3,1352.4036666666668,3
w13,4,128,8,4096,1536,32,32,256,4,8,4,1358.377,3
w13,4,128,8,4096,1536,32,32,256,16,4,3,1352.7023333333334,3
w13,4,128,8,4096,1536,32,32,256,16,4,4,1358.5690000000002,3
w13,4,128,8,4096,1536,32,32,256,16,8,3,1353.7903333333334,3
w13,4,128,8,4096,1536,32,32,256,16,8,4,1358.772,3
w13,4,128,8,4096,1536,32,32,256,32,4,3,1355.6779999999999,3
w13,4,128,8,4096,1536,32,32,256,32,4,4,1360.6593333333333,3
w13,4,128,8,4096,1536,32,32,256,32,8,3,1356.723,3
w13,4,128,8,4096,1536,32,64,256,1,4,3,1358.792,3
w13,4,128,8,4096,1536,32,64,256,1,8,3,1356.414,3
w13,4,128,8,4096,1536,32,64,256,8,4,3,1359.1236666666666,3
w13,4,128,8,4096,1536,32,64,256,8,8,3,1357.4166666666667,3
w13,4,128,8,4096,1536,32,64,256,16,4,3,1359.625,3
w13,4,128,8,4096,1536,32,64,256,16,8,3,1357.4916666666666,3
w13,4,128,8,4096,1536,32,64,256,32,4,3,1361.3423333333333,3
w13,4,128,8,4096,1536,32,64,256,32,8,3,1358.8253333333332,3
w13,4,128,8,4096,1536,32,64,256,64,4,3,1361.331,3
w13,4,128,8,4096,1536,32,64,256,64,8,3,1359.4863333333333,3
w13,4,128,8,4096,1536,64,32,256,1,4,3,1358.2593333333332,3
w13,4,128,8,4096,1536,64,32,256,1,8,3,1356.1796666666667,3
w13,4,128,8,4096,3072,16,16,256,1,4,3,2690.492333333333,3
w13,4,128,8,4096,3072,16,16,256,1,4,4,2701.2766666666666,3
w13,4,128,8,4096,3072,16,16,256,1,8,3,2702.2893333333336,3
w13,4,128,8,4096,3072,16,16,256,1,8,4,2705.6603333333333,3
w13,4,128,8,4096,3072,16,16,256,4,4,3,2692.0603333333333,3
w13,4,128,8,4096,3072,16,16,256,4,4,4,2702.226,3
w13,4,128,8,4096,3072,16,16,256,4,8,3,2701.191333333333,3
w13,4,128,8,4096,3072,16,16,256,4,8,4,2706.3113333333336,3
w13,4,128,8,4096,3072,16,32,256,1,4,3,2696.7646666666665,3
w13,4,128,8,4096,3072,16,32,256,1,4,4,2701.9383333333335,3
w13,4,128,8,4096,3072,16,32,256,1,8,3,2700.6363333333334,3
w13,4,128,8,4096,3072,16,32,256,1,8,4,2704.562,3
w13,4,128,8,4096,3072,16,32,256,16,4,3,2696.9779999999996,3
w13,4,128,8,4096,3072,16,32,256,16,4,4,2707.1216666666664,3
w13,4,128,8,4096,3072,16,32,256,16,8,3,2700.5723333333335,3
w13,4,128,8,4096,3072,16,32,256,16,8,4,2709.927333333333,3
w13,4,128,8,4096,3072,16,32,256,32,4,3,2698.301,3
w13,4,128,8,4096,3072,16,32,256,32,4,4,2711.826,3
w13,4,128,8,4096,3072,16,32,256,32,8,3,2702.6416666666664,3
w13,4,128,8,4096,3072,16,32,256,32,8,4,2713.2763333333332,3
w13,4,128,8,4096,3072,16,32,256,64,4,3,2698.0229999999997,3
w13,4,128,8,4096,3072,16,32,256,64,4,4,2712.0606666666667,3
w13,4,128,8,4096,3072,16,32,256,64,8,3,2702.8233333333337,3
w13,4,128,8,4096,3072,16,32,256,64,8,4,2714.354333333333,3
w13,4,128,8,4096,3072,16,64,256,1,4,3,2700.7646666666665,3
w13,4,128,8,4096,3072,16,64,256,1,8,3,2703.346,3
w13,4,128,8,4096,3072,16,64,256,16,4,3,2703.111,3
w13,4,128,8,4096,3072,16,64,256,16,8,3,2704.722,3
w13,4,128,8,4096,3072,16,64,256,32,4,3,2704.199,3
w13,4,128,8,4096,3072,16,64,256,32,8,3,2707.709,3
w13,4,128,8,4096,3072,16,64,256,64,4,3,2704.274,3
w13,4,128,8,4096,3072,16,64,256,64,8,3,2707.6656666666668,3
w13,4,128,8,4096,3072,32,32,256,1,4,3,2696.242,3
w13,4,128,8,4096,3072,32,32,256,1,4,4,2704.4233333333336,3
w13,4,128,8,4096,3072,32,32,256,1,8,3,2699.1646666666666,3
w13,4,128,8,4096,3072,32,32,256,1,8,4,2706.695,3
w13,4,128,8,4096,3072,32,32,256,4,4,3,2698.7273333333337,3
w13,4,128,8,4096,3072,32,32,256,4,4,4,2706.482,3
w13,4,128,8,4096,3072,32,32,256,4,8,3,2701.778333333333,3
w13,4,128,8,4096,3072,32,32,256,4,8,4,2708.7756666666664,3
w13,4,128,8,4096,3072,32,32,256,16,4,3,2701.3726666666666,3
w13,4,128,8,4096,3072,32,32,256,16,4,4,2709.298,3
w13,4,128,8,4096,3072,32,32,256,16,8,3,2704.029,3
w13,4,128,8,4096,3072,32,32,256,16,8,4,2711.1966666666667,3
w13,4,128,8,4096,3072,32,32,256,32,4,3,2706.4069999999997,3
w13,4,128,8,4096,3072,32,32,256,32,4,4,2713.095333333333,3
w13,4,128,8,4096,3072,32,32,256,32,8,3,2708.593666666667,3
w13,4,128,8,4096,3072,32,32,256,32,8,4,2716.6793333333335,3
w13,4,128,8,4096,3072,32,64,256,1,4,3,2709.842,3
w13,4,128,8,4096,3072,32,64,256,1,8,3,2707.079,3
w13,4,128,8,4096,3072,32,64,256,8,4,3,2710.29,3
w13,4,128,8,4096,3072,32,64,256,8,8,3,2708.3913333333335,3
w13,4,128,8,4096,3072,32,64,256,16,4,3,2711.2926666666667,3
w13,4,128,8,4096,3072,32,64,256,16,8,3,2708.487333333333,3
w13,4,128,8,4096,3072,32,64,256,32,4,3,2714.6740000000004,3
w13,4,128,8,4096,3072,32,64,256,32,8,3,2710.9196666666667,3
w13,4,128,8,4096,3072,32,64,256,64,4,3,2714.759666666667,3
w13,4,128,8,4096,3072,32,64,256,64,8,3,2711.2286666666664,3
w13,4,128,8,4096,3072,64,32,256,1,4,3,2706.706,3
w13,4,128,8,4096,3072,64,32,256,1,8,3,2708.860666666667,3
w13,8,8,2,1024,512,16,16,128,4,4,2,31.991333333333333,3
w13,8,8,2,1024,512,16,16,128,4,4,3,32.21533333333333,3
w13,8,8,2,1024,512,16,16,256,4,4,2,32.19466666666667,3
w13,8,8,2,1024,512,16,32,128,1,4,2,32.215333333333334,3
w13,8,8,2,1024,512,16,32,128,4,4,2,31.906666666666666,3
w13,8,8,2,1024,512,16,32,128,4,8,2,32.066,3
w13,8,8,2,1024,512,16,32,128,16,4,2,31.970333333333333,3
w13,8,8,2,1024,512,16,32,128,16,8,2,31.949,3
w13,8,8,2,1024,512,16,32,128,32,4,2,31.927333333333333,3
w13,8,8,2,1024,512,16,32,128,32,8,2,32.162,3
w13,8,8,2,1024,512,16,32,128,64,4,2,31.948666666666668,3
w13,8,8,2,1024,512,16,32,128,64,4,4,32.21533333333333,3
w13,8,8,2,1024,512,16,32,128,64,8,2,31.99133333333333,3
w13,8,8,2,1024,512,16,64,128,1,8,2,32.00299999999999,3
w13,8,8,2,1024,512,16,64,128,16,8,2,31.98133333333333,3
w13,8,8,2,1024,512,16,64,128,32,8,2,32.09866666666667,3
w13,8,8,2,1024,512,16,64,128,64,8,2,32.06633333333333,3
w13,8,8,2,1024,512,32,32,128,1,8,2,32.226,3
w13,8,8,2,1024,512,32,32,128,4,4,2,32.193999999999996,3
w13,8,8,2,1024,512,32,32,128,16,4,2,32.14066666666667,3
w13,8,8,2,1024,512,32,64,128,16,8,2,32.19466666666667,3
w13,8,8,2,1024,512,64,32,128,1,4,2,32.22666666666667,3
w13,8,16,2,1536,768,16,16,128,1,4,4,132.23333333333335,3
w13,8,16,2,1536,768,16,16,128,4,4,4,132.03099999999998,3
w13,8,16,2,1536,768,16,16,256,1,4,3,131.083,3
w13,8,16,2,1536,768,16,16,256,1,4,4,132.03166666666667,3
w13,8,16,2,1536,768,16,16,256,4,4,3,131.22066666666663,3
w13,8,16,2,1536,768,16,16,256,4,4,4,132.01999999999998,3
w13,8,16,2,1536,768,16,32,128,1,4,4,132.255,3
w13,8,16,2,1536,768,16,32,128,1,8,4,132.27600000000004,3
w13,8,16,2,1536,768,16,32,128,4,4,4,132.138,3
w13,8,16,2,1536,768,16,32,128,16,4,4,132.32933333333335,3
w13,8,16,2,1536,768,16,32,128,64,4,4,132.2446666666667,3
w13,8,16,2,1536,768,16,32,256,1,4,3,131.90333333333334,3
w13,8,16,2,1536,768,16,32,256,1,8,3,131.871,3
w13,8,16,2,1536,768,16,32,256,16,4,3,131.99866666666668,3
w13,8,16,2,1536,768,16,32,256,16,8,3,131.903,3
w13,8,16,2,1536,768,16,32,256,32,4,3,131.67966666666666,3
w13,8,16,2,1536,768,16,32,256,64,4,3,132.12733333333333,3
w13,8,16,2,1536,768,16,32,256,64,8,3,132.255,3
w13,8,16,2,1536,768,32,16,128,4,4,4,132.234,3
w13,8,16,2,1536,768,32,32,256,4,4,3,132.28733333333332,3
w13,8,16,2,1536,768,32,32,256,4,8,3,132.39333333333332,3
w13,8,16,4,1536,1024,16,16,256,1,4,3,174.29633333333334,3
w13,8,16,4,1536,1024,16,16,256,1,4,4,175.0,3
w13,8,16,4,1536,1024,16,16,256,4,4,3,173.43200000000002,3
w13,8,16,4,1536,1024,16,16,256,4,4,4,175.054,3
w13,8,16,4,1536,1024,16,32,256,1,4,3,174.86166666666668,3
w13,8,16,4,1536,1024,16,32,256,1,8,3,174.82966666666667,3
w13,8,16,4,1536,1024,16,32,256,16,4,3,174.84033333333332,3
w13,8,16,4,1536,1024,16,32,256,32,4,3,175.01066666666665,3
w13,8,16,4,1536,1024,16,32,256,64,4,3,174.76566666666668,3
w13,8,16,4,1536,1024,16,32,256,64,8,3,175.13833333333335,3
w13,8,16,4,1536,1024,32,32,256,16,4,3,174.819,3
w13,8,16,4,1536,1024,32,32,256,16,8,3,174.595,3
w13,8,16,4,1536,1024,32,32,256,32,4,3,174.62666666666667,3
w13,8,32,4,2048,768,16,16,256,1,4,3,341.56766666666664,3
w13,8,32,4,2048,768,16,16,256,1,4,4,342.2513333333333,3
w13,8,32,4,2048,768,16,16,256,1,8,3,343.01966666666664,3
w13,8,32,4,2048,768,16,16,256,1,8,4,343.78866666666664,3
w13,8,32,4,2048,768,16,16,256,4,4,3,341.3433333333333,3
w13,8,32,4,2048,768,16,16,256,4,4,4,341.856,3
w13,8,32,4,2048,768,16,16,256,4,8,3,344.503,3
w13,8,32,4,2048,768,16,16,256,4,8,4,343.54299999999995,3
w13,8,32,4,2048,768,16,32,256,1,4,3,342.1976666666667,3
w13,8,32,4,2048,768,16,32,256,1,4,4,343.01966666666664,3
w13,8,32,4,2048,768,16,32,256,1,8,3,342.7423333333333,3
w13,8,32,4,2048,768,16,32,256,1,8,4,342.71000000000004,3
w13,8,32,4,2048,768,16,32,256,16,4,3,342.10133333333334,3
w13,8,32,4,2048,768,16,32,256,16,4,4,343.8096666666667,3
w13,8,32,4,2048,768,16,32,256,16,8,3,343.1366666666667,3
w13,8,32,4,2048,768,16,32,256,16,8,4,344.46066666666667,3
w13,8,32,4,2048,768,16,32,256,32,4,3,342.1863333333333,3
w13,8,32,4,2048,768,16,32,256,32,4,4,344.0333333333333,3
w13,8,32,4,2048,768,16,32,256,32,8,3,344.52500000000003,3
w13,8,32,4,2048,768,16,32,256,32,8,4,344.76,3
w13,8,32,4,2048,768,16,32,256,64,4,3,342.4113333333333,3
w13,8,32,4,2048,768,16,32,256,64,4,4,344.06600000000003,3
w13,8,32,4,2048,768,16,32,256,64,8,4,344.557,3
w13,8,32,4,2048,768,16,64,256,1,4,3,343.9696666666667,3
w13,8,32,4,2048,768,16,64,256,1,8,3,343.80899999999997,3
w13,8,32,4,2048,768,16,64,256,16,4,3,344.141,3
w13,8,32,4,2048,768,16,64,256,64,4,3,344.6743333333333,3
w13,8,32,4,2048,768,32,32,256,1,4,3,342.06899999999996,3
w13,8,32,4,2048,768,32,32,256,1,4,4,344.7063333333333,3
w13,8,32,4,2048,768,32,32,256,1,8,3,342.20866666666666,3
w13,8,32,4,2048,768,32,32,256,1,8,4,344.365,3
w13,8,32,4,2048,768,32,32,256,4,4,3,343.009,3
w13,8,32,4,2048,768,32,32,256,4,4,4,344.11899999999997,3
w13,8,32,4,2048,768,32,32,256,4,8,3,342.5926666666667,3
w13,8,32,4,2048,768,32,32,256,4,8,4,344.3213333333333,3
w13,8,32,4,2048,768,32,32,256,16,4,3,343.7563333333333,3
w13,8,32,4,2048,768,32,32,256,16,8,3,344.51433333333335,3
w13,8,32,4,2048,768,32,32,256,32,4,3,344.47166666666664,3
w13,8,32,6,3072,1024,16,16,256,1,4,3,678.3196666666666,3
w13,8,32,6,3072,1024,16,16,256,1,4,4,682.757,3
w13,8,32,6,3072,1024,16,16,256,4,4,3,676.4213333333333,3
w13,8,32,6,3072,1024,16,16,256,4,4,4,682.8533333333334,3
w13,8,32,6,3072,1024,16,16,256,4,8,3,683.0446666666667,3
w13,8,32,6,3072,1024,16,32,256,1,4,3,678.8956666666667,3
w13,8,32,6,3072,1024,16,32,256,16,4,3,679.0559999999999,3
w13,8,32,6,3072,1024,16,32,256,16,8,3,682.5756666666667,3
w13,8,32,6,3072,1024,16,32,256,32,4,3,680.3360000000001,3
w13,8,32,6,3072,1024,16,32,256,64,4,3,680.3359999999999,3
w13,8,32,6,3072,1024,16,64,256,1,4,3,680.602,3
w13,8,32,6,3072,1024,16,64,256,1,8,3,682.16,3
w13,8,32,6,3072,1024,16,64,256,16,4,3,680.272,3
w13,8,32,6,3072,1024,16,64,256,16,8,3,682.16,3
w13,8,32,6,3072,1024,16,64,256,32,4,3,681.978,3
w13,8,32,6,3072,1024,16,64,256,64,4,3,682.8533333333334,3
w13,8,32,6,3072,1024,16,64,256,64,8,3,682.9386666666666,3
w13,8,32,6,3072,1024,32,32,256,1,4,3,676.709,3
w13,8,32,6,3072,1024,32,32,256,1,8,3,679.365,3
w13,8,32,6,3072,1024,32,32,256,4,4,3,677.9256666666666,3
w13,8,32,6,3072,1024,32,32,256,4,8,3,678.8103333333333,3
w13,8,32,6,3072,1024,32,32,256,16,4,3,678.6610000000001,3
w13,8,32,6,3072,1024,32,32,256,16,8,3,680.0583333333333,3
w13,8,32,6,3072,1024,32,32,256,32,4,3,680.7196666666667,3
w13,8,32,6,3072,1024,32,32,256,32,8,3,681.5306666666667,3
w13,8,60,4,2048,1408,16,16,256,1,4,3,620.0666666666667,3
w13,8,60,4,2048,1408,16,16,256,1,4,4,622.8816666666667,3
w13,8,60,4,2048,1408,16,16,256,1,8,3,624.1723333333333,3
w13,8,60,4,2048,1408,16,16,256,1,8,4,625.0476666666667,3
w13,8,60,4,2048,1408,16,16,256,4,4,3,619.4473333333334,3
w13,8,60,4,2048,1408,16,16,256,4,4,4,621.9753333333333,3
w13,8,60,4,2048,1408,16,16,256,4,8,3,622.8926666666666,3
w13,8,60,4,2048,1408,16,16,256,4,8,4,624.1293333333333,3
w13,8,60,4,2048,1408,16,32,256,1,4,3,621.3993333333333,3
w13,8,60,4,2048,1408,16,32,256,1,4,4,622.3273333333333,3
w13,8,60,4,2048,1408,16,32,256,1,8,3,623.384,3
w13,8,60,4,2048,1408,16,32,256,1,8,4,623.351,3
w13,8,60,4,2048,1408,16,32,256,16,4,3,621.0473333333333,3
w13,8,60,4,2048,1408,16,32,256,16,4,4,623.682,3
w13,8,60,4,2048,1408,16,32,256,16,8,3,622.5406666666667,3
w13,8,60,4,2048,1408,16,32,256,16,8,4,624.1193333333333,3
w13,8,60,4,2048,1408,16,32,256,32,4,3,622.0179999999999,3
w13,8,60,4,2048,1408,16,32,256,32,4,4,624.1513333333334,3
w13,8,60,4,2048,1408,16,32,256,32,8,3,623.501,3
w13,8,60,4,2048,1408,16,32,256,32,8,4,624.8766666666667,3
w13,8,60,4,2048,1408,16,32,256,64,4,3,622.2420000000001,3
w13,8,60,4,2048,1408,16,32,256,64,4,4,624.1086666666666,3
w13,8,60,4,2048,1408,16,32,256,64,8,3,623.2873333333333,3
w13,8,60,4,2048,1408,16,32,256,64,8,4,624.7916666666666,3
w13,8,60,4,2048,1408,16,64,256,1,4,3,623.9699999999999,3
w13,8,60,4,2048,1408,16,64,256,1,8,3,624.0763333333333,3
w13,8,60,4,2048,1408,16,64,256,16,4,3,624.418,3
w13,8,60,4,2048,1408,16,64,256,16,8,3,625.1326666666668,3
w13,8,60,4,2048,1408,16,64,256,32,4,3,624.9623333333334,3
w13,8,60,4,2048,1408,16,64,256,64,4,3,624.9303333333334,3
w13,8,60,4,2048,1408,16,64,256,64,8,3,625.6123333333334,3
w13,8,60,4,2048,1408,32,32,256,1,4,3,621.8686666666666,3
w13,8,60,4,2048,1408,32,32,256,1,4,4,624.2686666666667,3
w13,8,60,4,2048,1408,32,32,256,1,8,3,622.9886666666667,3
w13,8,60,4,2048,1408,32,32,256,1,8,4,624.6846666666667,3
w13,8,60,4,2048,1408,32,32,256,4,4,3,621.5273333333333,3
w13,8,60,4,2048,1408,32,32,256,4,4,4,624.0016666666667,3
w13,8,60,4,2048,1408,32,32,256,4,8,3,621.7833333333333,3
w13,8,60,4,2048,1408,32,32,256,4,8,4,625.25,3
w13,8,60,4,2048,1408,32,32,256,16,4,3,622.5726666666667,3
w13,8,60,4,2048,1408,32,32,256,16,4,4,624.7593333333334,3
w13,8,60,4,2048,1408,32,32,256,16,8,3,623.2553333333334,3
w13,8,60,4,2048,1408,32,32,256,16,8,4,625.5166666666667,3
w13,8,60,4,2048,1408,32,32,256,32,4,3,623.3196666666666,3
w13,8,60,4,2048,1408,32,32,256,32,4,4,625.6876666666667,3
w13,8,60,4,2048,1408,32,32,256,32,8,3,624.5033333333333,3
w13,8,60,4,2048,1408,32,64,256,1,8,3,625.1433333333334,3
w13,8,60,4,2048,1408,32,64,256,8,8,3,625.5596666666667,3
w13,8,60,6,3584,2304,16,16,256,1,4,3,2641.0653333333335,3
w13,8,60,6,3584,2304,16,16,256,1,8,3,2659.7426666666665,3
w13,8,60,6,3584,2304,16,16,256,4,4,3,2641.5136666666663,3
w13,8,60,6,3584,2304,16,16,256,4,8,3,2658.1963333333333,3
w13,8,60,6,3584,2304,16,32,256,1,4,3,2648.6066666666666,3
w13,8,60,6,3584,2304,16,32,256,1,4,4,2663.892333333333,3
w13,8,60,6,3584,2304,16,32,256,1,8,3,2659.274,3
w13,8,60,6,3584,2304,16,32,256,16,4,3,2651.1566666666668,3
w13,8,60,6,3584,2304,16,32,256,16,8,3,2660.254666666667,3
w13,8,60,6,3584,2304,16,32,256,32,4,3,2654.516,3
w13,8,60,6,3584,2304,16,32,256,32,8,3,2663.369666666667,3
w13,8,60,6,3584,2304,16,32,256,64,4,3,2657.855,3
w13,8,60,6,3584,2304,16,64,256,1,4,3,2652.052,3
w13,8,60,6,3584,2304,16,64,256,1,8,3,2659.902666666667,3
w13,8,60,6,3584,2304,16,64,256,16,4,3,2654.729333333333,3
w13,8,60,6,3584,2304,16,64,256,16,8,3,2663.06,3
w13,8,60,6,3584,2304,16,64,256,32,4,3,2657.9190000000003,3
w13,8,60,6,3584,2304,32,32,256,1,4,3,2637.4386666666664,3
w13,8,60,6,3584,2304,32,32,256,1,8,3,2641.5666666666666,3
w13,8,60,6,3584,2304,32,32,256,4,4,3,2640.638333333334,3
w13,8,60,6,3584,2304,32,32,256,4,8,3,2644.02,3
w13,8,60,6,3584,2304,32,32,256,16,4,3,2645.7906666666663,3
w13,8,60,6,3584,2304,32,32,256,16,8,3,2650.1746666666663,3
w13,8,60,6,3584,2304,32,32,256,32,4,3,2650.772333333333,3
w13,8,60,6,3584,2304,32,32,256,32,8,3,2654.1533333333336,3
w13,8,60,6,3584,2304,64,32,256,1,4,3,2656.115666666667,3
w13,8,60,6,3584,2304,64,32,256,1,8,3,2658.7826666666665,3
w13,8,60,8,2048,1536,16,16,256,1,4,3,1263.7576666666666,3
w13,8,60,8,2048,1536,16,16,256,1,4,4,1266.8083333333332,3
w13,8,60,8,2048,1536,16,16,256,1,8,3,1267.2986666666668,3
w13,8,60,8,2048,1536,16,16,256,1,8,4,1268.7386666666666,3
w13,8,60,8,2048,1536,16,16,256,4,4,3,1263.0426666666667,3
w13,8,60,8,2048,1536,16,16,256,4,4,4,1266.5626666666667,3
w13,8,60,8,2048,1536,16,16,256,4,8,3,1268.856,3
w13,8,60,8,2048,1536,16,16,256,4,8,4,1270.0933333333335,3
w13,8,60,8,2048,1536,16,32,256,1,4,3,1265.912,3
w13,8,60,8,2048,1536,16,32,256,1,4,4,1266.4026666666666,3
w13,8,60,8,2048,1536,16,32,256,1,8,3,1267.9706666666668,3
w13,8,60,8,2048,1536,16,32,256,1,8,4,1267.9916666666666,3
w13,8,60,8,2048,1536,16,32,256,16,4,3,1265.0906666666667,3
w13,8,60,8,2048,1536,16,32,256,16,4,4,1270.0716666666667,3
w13,8,60,8,2048,1536,16,32,256,16,8,3,1267.2880000000002,3
w13,8,60,8,2048,1536,16,32,256,16,8,4,1271.8,3
w13,8,60,8,2048,1536,16,32,256,32,4,3,1265.9656666666667,3
w13,8,60,8,2048,1536,16,32,256,32,4,4,1270.861,3
w13,8,60,8,2048,1536,16,32,256,32,8,3,1268.7920000000001,3
w13,8,60,8,2048,1536,16,32,256,32,8,4,1271.768,3
w13,8,60,8,2048,1536,16,32,256,64,4,3,1268.7596666666666,3
w13,8,60,8,2048,1536,16,32,256,64,8,3,1271.309,3
w13,8,60,8,2048,1536,16,64,256,1,4,3,1268.8133333333333,3
w13,8,60,8,2048,1536,16,64,256,1,8,3,1269.6343333333334,3
w13,8,60,8,2048,1536,16,64,256,16,4,3,1269.6773333333333,3
w13,8,60,8,2048,1536,16,64,256,16,8,3,1270.7223333333332,3
w13,8,60,8,2048,1536,16,64,256,32,4,3,1271.309,3
w13,8,60,8,2048,1536,16,64,256,32,8,3,1272.3546666666668,3
w13,8,60,8,2048,1536,16,64,256,64,4,3,1273.3573333333334,3
w13,8,60,8,2048,1536,16,64,256,64,8,3,1274.7116666666666,3
w13,8,60,8,2048,1536,32,32,256,1,4,3,1263.5330000000001,3
w13,8,60,8,2048,1536,32,32,256,1,4,4,1268.472,3
w13,8,60,8,2048,1536,32,32,256,1,8,3,1264.4080000000001,3
w13,8,60,8,2048,1536,32,32,256,1,8,4,1270.3813333333335,3
w13,8,60,8,2048,1536,32,32,256,4,4,3,1266.285,3
w13,8,60,8,2048,1536,32,32,256,4,4,4,1269.9759999999999,3
w13,8,60,8,2048,1536,32,32,256,4,8,3,1266.8613333333333,3
w13,8,60,8,2048,1536,32,32,256,4,8,4,1271.074,3
w13,8,60,8,2048,1536,32,32,256,16,4,3,1268.483,3
w13,8,60,8,2048,1536,32,32,256,16,4,4,1272.7813333333334,3
w13,8,60,8,2048,1536,32,32,256,16,8,3,1269.4959999999999,3
w13,8,60,8,2048,1536,32,32,256,16,8,4,1273.5813333333333,3
w13,8,60,8,2048,1536,32,32,256,32,4,3,1269.4533333333334,3
w13,8,60,8,2048,1536,32,32,256,32,4,4,1272.7493333333334,3
w13,8,60,8,2048,1536,32,32,256,32,8,3,1272.195,3
w13,8,60,8,2048,1536,32,64,256,1,4,3,1274.072,3
w13,8,60,8,2048,1536,32,64,256,1,8,3,1271.395,3
w13,8,60,8,2048,1536,32,64,256,8,4,3,1274.7976666666666,3
w13,8,60,8,2048,1536,32,64,256,8,8,3,1272.291,3
w13,8,60,8,2048,1536,32,64,256,16,4,3,1275.1283333333333,3
w13,8,60,8,2048,1536,32,64,256,16,8,3,1272.8563333333334,3
w13,8,60,8,2048,1536,32,64,256,32,8,3,1275.0856666666668,3
w13,8,60,8,2048,1536,64,32,256,1,4,3,1270.8616666666667,3
w13,8,60,8,2048,1536,64,32,256,1,8,3,1269.1443333333334,3
w13,8,64,6,3072,2048,16,16,256,1,4,3,2016.4896666666666,3
w13,8,64,6,3072,2048,16,16,256,1,4,4,2032.0100000000002,3
w13,8,64,6,3072,2048,16,16,256,1,8,3,2027.743333333333,3
w13,8,64,6,3072,2048,16,16,256,4,4,3,2012.6603333333333,3
w13,8,64,6,3072,2048,16,16,256,4,4,4,2032.2873333333334,3
w13,8,64,6,3072,2048,16,16,256,4,8,3,2025.1403333333335,3
w13,8,64,6,3072,2048,16,32,256,1,4,3,2019.2313333333332,3
w13,8,64,6,3072,2048,16,32,256,1,8,3,2025.5349999999999,3
w13,8,64,6,3072,2048,16,32,256,16,4,3,2020.3293333333334,3
w13,8,64,6,3072,2048,16,32,256,16,8,3,2024.6926666666668,3
w13,8,64,6,3072,2048,16,32,256,32,4,3,2023.7430000000002,3
w13,8,64,6,3072,2048,16,32,256,32,8,3,2027.8076666666668,3
w13,8,64,6,3072,2048,16,32,256,64,4,3,2026.3029999999999,3
w13,8,64,6,3072,2048,16,32,256,64,8,3,2031.4440000000002,3
w13,8,64,6,3072,2048,16,64,256,1,4,3,2020.2126666666666,3
w13,8,64,6,3072,2048,16,64,256,1,8,3,2024.8196666666665,3
w13,8,64,6,3072,2048,16,64,256,16,4,3,2022.9326666666666,3
w13,8,64,6,3072,2048,16,64,256,16,8,3,2027.53,3
w13,8,64,6,3072,2048,16,64,256,32,4,3,2025.268,3
w13,8,64,6,3072,2048,16,64,256,32,8,3,2030.0469999999998,3
w13,8,64,6,3072,2048,16,64,256,64,4,3,2028.2016666666666,3
w13,8,64,6,3072,2048,32,32,256,1,4,3,2013.9193333333333,3
w13,8,64,6,3072,2048,32,32,256,1,8,3,2017.524666666667,3
w13,8,64,6,3072,2048,32,32,256,4,4,3,2016.383,3
w13,8,64,6,3072,2048,32,32,256,4,8,3,2020.8096666666668,3
w13,8,64,6,3072,2048,32,32,256,16,4,3,2020.4473333333335,3
w13,8,64,6,3072,2048,32,32,256,16,8,3,2025.5136666666667,3
w13,8,64,6,3072,2048,32,32,256,32,4,3,2023.4126666666668,3
w13,8,64,6,3072,2048,32,32,256,32,8,3,2026.0043333333333,3
w13,8,64,6,3072,2048,32,64,256,1,8,3,2031.6260000000002,3
w13,8,64,6,3072,2048,64,32,256,1,4,3,2027.4869999999999,3
w13,8,64,6,3072,2048,64,32,256,1,8,3,2027.3590000000002,3
w13,8,64,6,3584,1536,16,16,256,1,4,3,1762.5556666666664,3
w13,8,64,6,3584,1536,16,16,256,1,4,4,1778.7903333333334,3
w13,8,64,6,3584,1536,16,16,256,1,8,3,1776.9446666666665,3
w13,8,64,6,3584,1536,16,16,256,4,4,3,1762.6410000000003,3
w13,8,64,6,3584,1536,16,16,256,4,4,4,1778.3203333333333,3
w13,8,64,6,3584,1536,16,16,256,4,8,3,1775.9956666666667,3
w13,8,64,6,3584,1536,16,32,256,1,4,3,1767.9313333333332,3
w13,8,64,6,3584,1536,16,32,256,1,4,4,1778.0439999999999,3
w13,8,64,6,3584,1536,16,32,256,1,8,3,1774.7583333333332,3
w13,8,64,6,3584,1536,16,32,256,16,4,3,1769.9796666666668,3
w13,8,64,6,3584,1536,16,32,256,16,8,3,1774.3103333333336,3
w13,8,64,6,3584,1536,16,32,256,32,4,3,1771.964,3
w13,8,64,6,3584,1536,16,32,256,32,8,3,1777.329,3
w13,8,64,6,3584,1536,16,32,256,64,4,3,1773.7450000000001,3
w13,8,64,6,3584,1536,16,32,256,64,8,3,1778.033333333333,3
w13,8,64,6,3584,1536,16,64,256,1,4,3,1770.6303333333333,3
w13,8,64,6,3584,1536,16,64,256,1,8,3,1775.4943333333333,3
w13,8,64,6,3584,1536,16,64,256,16,4,3,1772.8490000000002,3
w13,8,64,6,3584,1536,16,64,256,16,8,3,1777.5956666666668,3
w13,8,64,6,3584,1536,16,64,256,32,4,3,1775.4303333333335,3
w13,8,64,6,3584,1536,16,64,256,64,4,3,1777.7446666666667,3
w13,8,64,6,3584,1536,32,32,256,1,4,3,1761.0836666666667,3
w13,8,64,6,3584,1536,32,32,256,1,8,3,1764.4859999999999,3
w13,8,64,6,3584,1536,32,32,256,4,4,3,1761.5100000000002,3
w13,8,64,6,3584,1536,32,32,256,4,8,3,1763.388,3
w13,8,64,6,3584,1536,32,32,256,16,4,3,1765.5956666666668,3
w13,8,64,6,3584,1536,32,32,256,16,8,3,1768.2413333333334,3
w13,8,64,6,3584,1536,32,32,256,32,4,3,1769.308,3
w13,8,64,6,3584,1536,32,32,256,32,8,3,1771.1956666666665,3
w13,8,64,6,3584,1536,64,32,256,1,4,3,1775.0356666666667,3
w13,8,64,6,3584,1536,64,32,256,1,8,3,1774.8863333333331,3
w13,8,64,8,3584,2560,16,16,256,1,4,3,3909.5113333333334,3
w13,8,64,8,3584,2560,16,16,256,1,8,3,3934.4719999999998,3
w13,8,64,8,3584,2560,16,16,256,4,4,3,3910.5993333333336,3
w13,8,64,8,3584,2560,16,16,256,4,8,3,3936.0073333333335,3
w13,8,64,8,3584,2560,16,32,256,1,4,3,3919.186333333333,3
w13,8,64,8,3584,2560,16,32,256,1,8,3,3931.1650000000004,3
w13,8,64,8,3584,2560,16,32,256,16,4,3,3923.2396666666664,3
w13,8,64,8,3584,2560,16,32,256,16,8,3,3935.773333333333,3
w13,8,64,8,3584,2560,16,32,256,32,4,3,3927.0263333333332,3
w13,8,64,8,3584,2560,16,32,256,32,8,3,3937.587,3
w13,8,64,8,3584,2560,16,32,256,64,4,3,3941.085333333333,3
w13,8,64,8,3584,2560,16,64,256,1,4,3,3923.8153333333335,3
w13,8,64,8,3584,2560,16,64,256,1,8,3,3936.669,3
w13,8,64,8,3584,2560,16,64,256,16,4,3,3928.4556666666667,3
w13,8,64,8,3584,2560,16,64,256,16,8,3,3941.3303333333333,3
w13,8,64,8,3584,2560,16,64,256,32,4,3,3932.9996666666666,3
w13,8,64,8,3584,2560,16,64,256,64,4,3,3941.1496666666667,3
w13,8,64,8,3584,2560,32,32,256,1,4,3,3901.9373333333333,3
w13,8,64,8,3584,2560,32,32,256,1,8,3,3905.746333333333,3
w13,8,64,8,3584,2560,32,32,256,4,4,3,3907.2073333333333,3
w13,8,64,8,3584,2560,32,32,256,4,8,3,3910.162333333333,3
w13,8,64,8,3584,2560,32,32,256,16,4,3,3911.901,3
w13,8,64,8,3584,2560,32,32,256,16,8,3,3917.191666666666,3
w13,8,64,8,3584,2560,32,32,256,32,4,3,3924.957,3
w13,8,64,8,3584,2560,32,32,256,32,8,3,3931.815666666667,3
w13,8,64,8,3584,2560,64,32,256,1,4,3,3927.1110000000003,3
w13,8,64,8,3584,2560,64,32,256,1,8,3,3925.2983333333336,3
w13,8,128,4,2048,512,16,16,128,1,4,3,231.66333333333333,3
w13,8,128,4,2048,512,16,16,256,1,4,3,229.81833333333336,3
w13,8,128,4,2048,512,16,16,256,1,4,4,229.47633333333337,3
w13,8,128,4,2048,512,16,16,256,1,8,4,231.2363333333333,3
w13,8,128,4,2048,512,16,16,256,4,4,3,230.82066666666665,3
w13,8,128,4,2048,512,16,16,256,4,4,4,229.76466666666667,3
w13,8,128,4,2048,512,16,16,256,4,8,4,231.40766666666664,3
w13,8,128,4,2048,512,16,32,256,1,4,3,229.94566666666665,3
w13,8,128,4,2048,512,16,32,256,1,4,4,231.407,3
w13,8,128,4,2048,512,16,32,256,1,8,3,230.68200000000002,3
w13,8,128,4,2048,512,16,32,256,1,8,4,230.319,3
w13,8,128,4,2048,512,16,32,256,16,4,3,230.35133333333332,3
w13,8,128,4,2048,512,16,32,256,16,8,4,231.54599999999996,3
w13,8,128,4,2048,512,16,32,256,32,4,3,231.24699999999999,3
w13,8,128,4,2048,512,16,32,256,32,4,4,231.15166666666667,3
w13,8,128,4,2048,512,16,32,256,32,8,4,231.50300000000001,3
w13,8,128,4,2048,512,16,32,256,64,4,3,230.51166666666666,3
w13,8,128,4,2048,512,16,32,256,64,4,4,231.35366666666667,3
w13,8,128,4,2048,512,16,32,256,64,8,4,231.53533333333334,3
w13,8,128,4,2048,512,16,64,256,1,4,3,231.71699999999998,3
w13,8,128,4,2048,512,32,32,256,1,4,3,230.447,3
w13,8,128,4,2048,512,32,32,256,1,4,4,231.59933333333333,3
w13,8,128,4,2048,512,32,32,256,1,8,3,230.46900000000002,3
w13,8,128,4,2048,512,32,32,256,1,8,4,231.60933333333332,3
w13,8,128,4,2048,512,32,32,256,4,4,3,231.077,3
w13,8,128,4,2048,512,32,32,256,4,8,3,231.15099999999998,3
w13,8,128,4,2048,512,32,32,256,16,4,3,231.73799999999997,3
w13,8,128,4,2048,512,32,32,256,32,4,3,231.311,3
w13,8,128,6,4096,2048,16,16,256,1,4,3,2691.101666666667,3
w13,8,128,6,4096,2048,16,16,256,1,4,4,2701.2666666666664,3
w13,8,128,6,4096,2048,16,16,256,1,8,3,2704.5203333333334,3
w13,8,128,6,4096,2048,16,16,256,1,8,4,2706.216,3
w13,8,128,6,4096,2048,16,16,256,4,4,3,2690.3866666666668,3
w13,8,128,6,4096,2048,16,16,256,4,4,4,2700.904,3
w13,8,128,6,4096,2048,16,16,256,4,8,3,2700.712,3
w13,8,128,6,4096,2048,16,16,256,4,8,4,2707.8163333333337,3
w13,8,128,6,4096,2048,16,32,256,1,4,3,2695.4746666666665,3
w13,8,128,6,4096,2048,16,32,256,1,4,4,2702.547,3
w13,8,128,6,4096,2048,16,32,256,1,8,3,2701.1603333333333,3
w13,8,128,6,4096,2048,16,32,256,1,8,4,2703.986666666666,3
w13,8,128,6,4096,2048,16,32,256,16,4,3,2696.3703333333337,3
w13,8,128,6,4096,2048,16,32,256,16,4,4,2708.5416666666665,3
w13,8,128,6,4096,2048,16,32,256,16,8,3,2700.3070000000002,3
w13,8,128,6,4096,2048,16,32,256,16,8,4,2709.885333333333,3
w13,8,128,6,4096,2048,16,32,256,32,4,3,2697.555,3
w13,8,128,6,4096,2048,16,32,256,32,4,4,2712.552,3
w13,8,128,6,4096,2048,16,32,256,32,8,3,2701.2243333333336,3
w13,8,128,6,4096,2048,16,32,256,32,8,4,2715.357666666667,3
w13,8,128,6,4096,2048,16,32,256,64,4,3,2701.0426666666667,3
w13,8,128,6,4096,2048,16,32,256,64,8,3,2705.448,3
w13,8,128,6,4096,2048,16,64,256,1,4,3,2701.0316666666663,3
w13,8,128,6,4096,2048,16,64,256,1,8,3,2704.1253333333334,3
w13,8,128,6,4096,2048,16,64,256,16,4,3,2702.6963333333333,3
w13,8,128,6,4096,2048,16,64,256,16,8,3,2705.064,3
w13,8,128,6,4096,2048,16,64,256,32,4,3,2705.2026666666666,3
w13,8,128,6,4096,2048,16,64,256,32,8,3,2707.667,3
w13,8,128,6,4096,2048,16,64,256,64,4,3,2708.5736666666667,3
w13,8,128,6,4096,2048,16,64,256,64,8,3,2710.248666666667,3
w13,8,128,6,4096,2048,32,32,256,1,4,3,2696.4876666666664,3
w13,8,128,6,4096,2048,32,32,256,1,4,4,2704.168333333333,3
w13,8,128,6,4096,2048,32,32,256,1,8,3,2700.861666666666,3
w13,8,128,6,4096,2048,32,32,256,1,8,4,2706.471666666667,3
w13,8,128,6,4096,2048,32,32,256,4,4,3,2697.6929999999998,3
w13,8,128,6,4096,2048,32,32,256,4,4,4,2706.2803333333336,3
w13,8,128,6,4096,2048,32,32,256,4,8,3,2701.896,3
w13,8,128,6,4096,2048,32,32,256,4,8,4,2708.4346666666665,3
w13,8,128,6,4096,2048,32,32,256,16,4,3,2703.0376666666666,3
w13,8,128,6,4096,2048,32,32,256,16,4,4,2710.0879999999997,3
w13,8,128,6,4096,2048,32,32,256,16,8,3,2707.912333333333,3
w13,8,128,6,4096,2048,32,32,256,16,8,4,2711.699,3
w13,8,128,6,4096,2048,32,32,256,32,4,3,2705.096,3
w13,8,128,6,4096,2048,32,32,256,32,4,4,2715.5496666666663,3
w13,8,128,6,4096,2048,32,32,256,32,8,3,2708.893666666667,3
w13,8,128,6,4096,2048,32,32,256,32,8,4,2716.5736666666667,3
w13,8,128,6,4096,2048,32,64,256,1,4,3,2710.333,3
w13,8,128,6,4096,2048,32,64,256,1,8,3,2706.824,3
w13,8,128,6,4096,2048,32,64,256,8,4,3,2710.8559999999998,3
w13,8,128,6,4096,2048,32,64,256,8,8,3,2707.624,3
w13,8,128,6,4096,2048,32,64,256,16,4,3,2712.4883333333332,3
w13,8,128,6,4096,2048,32,64,256,16,8,3,2709.1386666666667,3
w13,8,128,6,4096,2048,32,64,256,32,4,3,2714.547,3
w13,8,128,6,4096,2048,32,64,256,32,8,3,2712.0400000000004,3
w13,8,128,6,4096,2048,32,64,256,64,8,3,2715.901666666666,3
w13,8,128,6,4096,2048,64,32,256,1,4,3,2710.1096666666667,3
w13,8,128,6,4096,2048,64,32,256,1,8,3,2711.6136666666666,3
w13,8,128,8,2048,768,16,16,256,1,4,3,675.547,3
w13,8,128,8,2048,768,16,16,256,1,4,4,678.299,3
w13,8,128,8,2048,768,16,16,256,1,8,3,679.4086666666667,3
w13,8,128,8,2048,768,16,16,256,1,8,4,680.2403333333333,3
w13,8,128,8,2048,768,16,16,256,4,4,3,676.2936666666667,3
w13,8,128,8,2048,768,16,16,256,4,4,4,677.6693333333333,3
w13,8,128,8,2048,768,16,16,256,4,8,3,679.7813333333334,3
w13,8,128,8,2048,768,16,16,256,4,8,4,679.942,3
w13,8,128,8,2048,768,16,32,256,1,4,3,677.5733333333333,3
w13,8,128,8,2048,768,16,32,256,1,4,4,678.3843333333333,3
w13,8,128,8,2048,768,16,32,256,1,8,3,678.374,3
w13,8,128,8,2048,768,16,32,256,1,8,4,678.5123333333333,3
w13,8,128,8,2048,768,16,32,256,16,4,3,677.0936666666666,3
w13,8,128,8,2048,768,16,32,256,16,4,4,680.3256666666667,3
w13,8,128,8,2048,768,16,32,256,16,8,3,678.8326666666666,3
w13,8,128,8,2048,768,16,32,256,16,8,4,680.87,3
w13,8,128,8,2048,768,16,32,256,32,4,3,677.7656666666667,3
w13,8,128,8,2048,768,16,32,256,32,4,4,679.611,3
w13,8,128,8,2048,768,16,32,256,32,8,3,679.4936666666667,3
w13,8,128,8,2048,768,16,32,256,32,8,4,680.5283333333333,3
w13,8,128,8,2048,768,16,32,256,64,4,3,680.0373333333333,3
w13,8,128,8,2048,768,16,32,256,64,8,3,681.7546666666667,3
w13,8,128,8,2048,768,16,64,256,1,4,3,679.952,3
w13,8,128,8,2048,768,16,64,256,1,8,3,680.1226666666666,3
w13,8,128,8,2048,768,16,64,256,16,4,3,680.2186666666666,3
w13,8,128,8,2048,768,16,64,256,16,8,3,680.923,3
w13,8,128,8,2048,768,16,64,256,32,4,3,680.9016666666666,3
w13,8,128,8,2048,768,16,64,256,32,8,3,681.1043333333333,3
w13,8,128,8,2048,768,32,32,256,1,4,3,677.4879999999999,3
w13,8,128,8,2048,768,32,32,256,1,4,4,679.7926666666667,3
w13,8,128,8,2048,768,32,32,256,1,8,3,677.7233333333334,3
w13,8,128,8,2048,768,32,32,256,1,8,4,681.2213333333333,3
w13,8,128,8,2048,768,32,32,256,4,4,3,678.107,3
w13,8,128,8,2048,768,32,32,256,4,4,4,680.464,3
w13,8,128,8,2048,768,32,32,256,4,8,3,678.4586666666665,3
w13,8,128,8,2048,768,32,32,256,4,8,4,681.2856666666667,3
w13,8,128,8,2048,768,32,32,256,16,4,3,679.6746666666667,3
w13,8,128,8,2048,768,32,32,256,16,4,4,681.9683333333334,3
w13,8,128,8,2048,768,32,32,256,16,8,3,679.707,3
w13,8,128,8,2048,768,32,32,256,32,4,3,679.4406666666666,3
w13,8,128,8,2048,768,32,32,256,32,4,4,681.861,3
w13,8,128,8,2048,768,32,32,256,32,8,3,680.3576666666667,3
w13,8,128,8,2048,768,32,64,256,1,8,3,681.3389999999999,3
w13,8,128,8,2048,768,32,64,256,8,8,3,681.6266666666667,3
w13,8,128,8,2048,768,32,64,256,16,8,3,681.8613333333334,3
w13,8,128,8,2048,768,64,32,256,1,8,3,680.8376666666667,3
w13,8,128,8,4096,1536,16,16,256,1,4,3,2690.4476666666665,3
w13,8,128,8,4096,1536,16,16,256,1,4,4,2701.1253333333334,3
w13,8,128,8,4096,1536,16,16,256,1,8,3,2700.762666666667,3
w13,8,128,8,4096,1536,16,16,256,1,8,4,2706.7149999999997,3
w13,8,128,8,4096,1536,16,16,256,4,4,3,2691.706666666667,3
w13,8,128,8,4096,1536,16,16,256,4,4,4,2701.2533333333336,3
w13,8,128,8,4096,1536,16,16,256,4,8,3,2703.8023333333335,3
w13,8,128,8,4096,1536,16,16,256,4,8,4,2707.3866666666668,3
w13,8,128,8,4096,1536,16,32,256,1,4,3,2696.549333333334,3
w13,8,128,8,4096,1536,16,32,256,1,4,4,2702.7256666666667,3
w13,8,128,8,4096,1536,16,32,256,1,8,3,2700.815666666667,3
w13,8,128,8,4096,1536,16,32,256,1,8,4,2704.133,3
w13,8,128,8,4096,1536,16,32,256,16,4,3,2696.4,3
w13,8,128,8,4096,1536,16,32,256,16,4,4,2707.888333333333,3
w13,8,128,8,4096,1536,16,32,256,16,8,3,2700.666333333333,3
w13,8,128,8,4096,1536,16,32,256,16,8,4,2707.7066666666665,3
w13,8,128,8,4096,1536,16,32,256,32,4,3,2698.181,3
w13,8,128,8,4096,1536,16,32,256,32,4,4,2711.461333333333,3
w13,8,128,8,4096,1536,16,32,256,32,8,3,2702.512,3
w13,8,128,8,4096,1536,16,32,256,32,8,4,2713.4453333333336,3
w13,8,128,8,4096,1536,16,32,256,64,4,3,2703.9410000000003,3
w13,8,128,8,4096,1536,16,32,256,64,8,3,2708.6986666666667,3
w13,8,128,8,4096,1536,16,64,256,1,4,3,2701.2853333333333,3
w13,8,128,8,4096,1536,16,64,256,1,8,3,2703.0133333333333,3
w13,8,128,8,4096,1536,16,64,256,16,4,3,2702.5973333333336,3
w13,8,128,8,4096,1536,16,64,256,16,8,3,2704.8693333333335,3
w13,8,128,8,4096,1536,16,64,256,32,4,3,2704.5706666666665,3
w13,8,128,8,4096,1536,16,64,256,32,8,3,2708.155,3
w13,8,128,8,4096,1536,16,64,256,64,4,3,2708.7306666666664,3
w13,8,128,8,4096,1536,16,64,256,64,8,3,2712.3783333333336,3
w13,8,128,8,4096,1536,32,32,256,1,4,3,2698.010666666667,3
w13,8,128,8,4096,1536,32,32,256,1,4,4,2704.187,3
w13,8,128,8,4096,1536,32,32,256,1,8,3,2702.0,3
w13,8,128,8,4096,1536,32,32,256,1,8,4,2706.1603333333333,3
w13,8,128,8,4096,1536,32,32,256,4,4,3,2699.418333333333,3
w13,8,128,8,4096,1536,32,32,256,4,4,4,2706.5333333333333,3
w13,8,128,8,4096,1536,32,32,256,4,8,3,2703.099,3
w13,8,128,8,4096,1536,32,32,256,4,8,4,2707.4933333333333,3
w13,8,128,8,4096,1536,32,32,256,16,4,3,2700.7946666666667,3
w13,8,128,8,4096,1536,32,32,256,16,4,4,2708.5280000000002,3
w13,8,128,8,4096,1536,32,32,256,16,8,3,2703.28,3
w13,8,128,8,4096,1536,32,32,256,16,8,4,2711.7599999999998,3
w13,8,128,8,4096,1536,32,32,256,32,4,3,2705.8506666666667,3
w13,8,128,8,4096,1536,32,32,256,32,4,4,2714.5226666666667,3
w13,8,128,8,4096,1536,32,32,256,32,8,3,2706.490333333333,3
w13,8,128,8,4096,1536,32,32,256,32,8,4,2716.9120000000003,3
w13,8,128,8,4096,1536,32,64,256,1,4,3,2710.2133333333336,3
w13,8,128,8,4096,1536,32,64,256,1,8,3,2708.112333333333,3
w13,8,128,8,4096,1536,32,64,256,8,4,3,2709.488,3
w13,8,128,8,4096,1536,32,64,256,8,8,3,2707.781333333334,3
w13,8,128,8,4096,1536,32,64,256,16,4,3,2711.9306666666666,3
w13,8,128,8,4096,1536,32,64,256,16,8,3,2709.712,3
w13,8,128,8,4096,1536,32,64,256,32,4,3,2715.2806666666665,3
w13,8,128,8,4096,1536,32,64,256,32,8,3,2712.1336666666666,3
w13,8,128,8,4096,1536,64,32,256,1,4,3,2713.594333333333,3
w13,8,128,8,4096,1536,64,32,256,1,8,3,2713.5516666666663,3
w13,8,128,8,4096,3072,16,16,256,1,4,3,5375.223666666666,3
w13,8,128,8,4096,3072,16,16,256,1,4,4,5393.336333333334,3
w13,8,128,8,4096,3072,16,16,256,1,8,3,5394.487666666667,3
w13,8,128,8,4096,3072,16,16,256,1,8,4,5401.293333333334,3
w13,8,128,8,4096,3072,16,16,256,4,4,3,5376.727666666667,3
w13,8,128,8,4096,3072,16,16,256,4,4,4,5398.541333333334,3
w13,8,128,8,4096,3072,16,16,256,4,8,3,5394.146333333333,3
w13,8,128,8,4096,3072,16,16,256,4,8,4,5405.3679999999995,3
w13,8,128,8,4096,3072,16,32,256,1,4,3,5385.826666666667,3
w13,8,128,8,4096,3072,16,32,256,1,4,4,5397.091,3
w13,8,128,8,4096,3072,16,32,256,1,8,3,5393.325,3
w13,8,128,8,4096,3072,16,32,256,1,8,4,5401.560333333334,3
w13,8,128,8,4096,3072,16,32,256,16,4,3,5387.575666666667,3
w13,8,128,8,4096,3072,16,32,256,16,4,4,5405.357,3
w13,8,128,8,4096,3072,16,32,256,16,8,3,5396.130666666667,3
w13,8,128,8,4096,3072,16,32,256,16,8,4,5407.715,3
w13,8,128,8,4096,3072,16,32,256,32,4,3,5390.658333333334,3
w13,8,128,8,4096,3072,16,32,256,32,4,4,5418.466666666667,3
w13,8,128,8,4096,3072,16,32,256,32,8,3,5401.282666666666,3
w13,8,128,8,4096,3072,16,32,256,32,8,4,5420.1196666666665,3
w13,8,128,8,4096,3072,16,32,256,64,4,3,5406.787,3
w13,8,128,8,4096,3072,16,32,256,64,8,3,5417.282666666667,3
w13,8,128,8,4096,3072,16,64,256,1,4,3,5394.477333333333,3
w13,8,128,8,4096,3072,16,64,256,1,8,3,5399.490333333332,3
w13,8,128,8,4096,3072,16,64,256,16,4,3,5400.387,3
w13,8,128,8,4096,3072,16,64,256,16,8,3,5404.269,3
w13,8,128,8,4096,3072,16,64,256,32,4,3,5404.813666666667,3
w13,8,128,8,4096,3072,16,64,256,32,8,3,5410.787,3
w13,8,128,8,4096,3072,16,64,256,64,4,3,5410.9890000000005,3
w13,8,128,8,4096,3072,16,64,256,64,8,3,5415.223999999999,3
w13,8,128,8,4096,3072,32,32,256,1,4,3,5380.664333333333,3
w13,8,128,8,4096,3072,32,32,256,1,4,4,5401.218666666667,3
w13,8,128,8,4096,3072,32,32,256,1,8,3,5385.037333333334,3
w13,8,128,8,4096,3072,32,32,256,1,8,4,5404.238,3
w13,8,128,8,4096,3072,32,32,256,4,4,3,5385.293999999999,3
w13,8,128,8,4096,3072,32,32,256,4,4,4,5405.0053333333335,3
w13,8,128,8,4096,3072,32,32,256,4,8,3,5388.952,3
w13,8,128,8,4096,3072,32,32,256,4,8,4,5407.693666666666,3
w13,8,128,8,4096,3072,32,32,256,16,4,3,5391.063666666666,3
w13,8,128,8,4096,3072,32,32,256,16,4,4,5408.322666666666,3
w13,8,128,8,4096,3072,32,32,256,16,8,3,5395.821666666667,3
w13,8,128,8,4096,3072,32,32,256,16,8,4,5412.44,3
w13,8,128,8,4096,3072,32,32,256,32,4,3,5404.642666666667,3
w13,8,128,8,4096,3072,32,32,256,32,4,4,5422.808,3
w13,8,128,8,4096,3072,32,32,256,32,8,3,5410.189333333333,3
w13,8,128,8,4096,3072,32,32,256,32,8,4,5426.531333333333,3
w13,8,128,8,4096,3072,32,64,256,1,4,3,5410.477333333333,3
w13,8,128,8,4096,3072,32,64,256,1,8,3,5406.423666666667,3
w13,8,128,8,4096,3072,32,64,256,8,4,3,5415.917666666667,3
w13,8,128,8,4096,3072,32,64,256,8,8,3,5409.016333333334,3
w13,8,128,8,4096,3072,32,64,256,16,4,3,5417.005,3
w13,8,128,8,4096,3072,32,64,256,16,8,3,5412.578333333334,3
w13,8,128,8,4096,3072,32,64,256,32,4,3,5424.866999999999,3
w13,8,128,8,4096,3072,32,64,256,32,8,3,5418.264,3
w13,8,128,8,4096,3072,32,64,256,64,8,3,5425.720666666666,3
w13,8,128,8,4096,3072,64,32,256,1,4,3,5402.562666666667,3
w13,8,128,8,4096,3072,64,32,256,1,8,3,5402.392333333333,3
w13,16,8,2,1024,512,16,16,128,1,4,2,32.193999999999996,3
w13,16,8,2,1024,512,16,16,128,1,4,4,32.24733333333334,3
w13,16,8,2,1024,512,16,16,128,4,4,2,32.226,3
w13,16,8,2,1024,512,16,32,128,1,4,2,32.21566666666667,3
w13,16,8,2,1024,512,16,32,128,4,4,2,32.08766666666667,3
w13,16,8,2,1024,512,16,32,128,16,4,2,32.01266666666667,3
w13,16,8,2,1024,512,16,32,128,16,8,2,32.15133333333333,3
w13,16,8,2,1024,512,16,32,128,32,4,2,32.077,3
w13,16,8,2,1024,512,16,32,128,32,8,2,32.13,3
w13,16,8,2,1024,512,16,32,128,64,4,2,31.948999999999998,3
w13,16,8,2,1024,512,16,32,128,64,8,2,32.24733333333334,3
w13,16,8,2,1024,512,16,64,128,1,8,2,32.20466666666667,3
w13,16,8,2,1024,512,16,64,128,16,8,2,32.162,3
w13,16,8,2,1024,512,16,64,128,32,8,2,32.20466666666667,3
w13,16,8,2,1024,512,16,64,128,64,8,2,32.11933333333334,3
w13,16,8,2,1024,512,32,32,128,4,4,2,32.226,3
w13,16,8,2,1024,512,32,32,128,16,4,2,32.129999999999995,3
w13,16,8,2,1024,512,32,32,128,64,4,2,32.24766666666667,3
w13,16,8,2,1024,512,64,32,128,1,4,2,32.226,3
w13,16,16,2,1536,768,16,16,256,1,4,3,131.31733333333332,3
w13,16,16,2,1536,768,16,16,256,1,4,4,131.99933333333334,3
w13,16,16,2,1536,768,16,16,256,4,4,3,131.16833333333332,3
w13,16,16,2,1536,768,16,16,256,4,4,4,132.22299999999998,3
w13,16,16,2,1536,768,16,32,128,4,4,4,132.45766666666668,3
w13,16,16,2,1536,768,16,32,256,1,4,3,132.2653333333333,3
w13,16,16,2,1536,768,16,32,256,1,8,3,132.27599999999998,3
w13,16,16,2,1536,768,16,32,256,16,4,3,132.16966666666667,3
w13,16,16,2,1536,768,16,32,256,32,4,3,132.23333333333335,3
w13,16,16,2,1536,768,16,32,256,64,4,3,132.31866666666667,3
w13,16,16,2,1536,768,16,32,256,64,8,3,132.46766666666667,3
w13,16,16,4,1536,1024,16,16,256,1,4,3,174.8083333333333,3
w13,16,16,4,1536,1024,16,16,256,4,4,3,173.9226666666667,3
w13,16,16,4,1536,1024,16,32,256,1,4,3,175.12800000000001,3
w13,16,16,4,1536,1024,16,32,256,1,8,3,175.49066666666667,3
w13,16,16,4,1536,1024,16,32,256,32,4,3,175.48000000000002,3
w13,16,16,4,1536,1024,16,32,256,64,4,3,175.45900000000003,3
w13,16,16,4,1536,1024,32,32,256,16,4,3,175.34133333333332,3
w13,16,16,4,1536,1024,32,32,256,16,8,3,175.33066666666664,3
w13,16,16,4,1536,1024,32,32,256,32,4,3,175.41633333333334,3
w13,16,16,4,1536,1024,32,32,256,32,8,3,175.34166666666667,3
w13,16,32,4,2048,768,16,16,256,1,4,3,341.44399999999996,3
w13,16,32,4,2048,768,16,16,256,1,4,4,342.8626666666667,3
w13,16,32,4,2048,768,16,16,256,1,8,3,343.68399999999997,3
w13,16,32,4,2048,768,16,16,256,1,8,4,343.89733333333334,3
w13,16,32,4,2048,768,16,16,256,4,4,3,340.86833333333334,3
w13,16,32,4,2048,768,16,16,256,4,4,4,342.91633333333334,3
w13,16,32,4,2048,768,16,16,256,4,8,3,343.9506666666667,3
w13,16,32,4,2048,768,16,32,256,1,4,3,342.55333333333334,3
w13,16,32,4,2048,768,16,32,256,1,4,4,342.6713333333334,3
w13,16,32,4,2048,768,16,32,256,1,8,3,342.78866666666664,3
w13,16,32,4,2048,768,16,32,256,1,8,4,342.94800000000004,3
w13,16,32,4,2048,768,16,32,256,16,4,3,342.6493333333333,3
w13,16,32,4,2048,768,16,32,256,16,4,4,344.00399999999996,3
w13,16,32,4,2048,768,16,32,256,16,8,4,344.2706666666666,3
w13,16,32,4,2048,768,16,32,256,32,4,3,343.5986666666667,3
w13,16,32,4,2048,768,16,32,256,64,4,3,343.3426666666666,3
w13,16,32,4,2048,768,16,32,256,64,8,3,344.11066666666665,3
w13,16,32,4,2048,768,16,64,256,1,8,3,343.91866666666664,3
w13,16,32,4,2048,768,32,32,256,1,4,3,342.4793333333334,3
w13,16,32,4,2048,768,32,32,256,1,4,4,343.385,3
w13,16,32,4,2048,768,32,32,256,1,8,3,342.67066666666665,3
w13,16,32,4,2048,768,32,32,256,1,8,4,343.844,3
w13,16,32,4,2048,768,32,32,256,4,4,3,342.51033333333334,3
w13,16,32,4,2048,768,32,32,256,4,8,3,343.6093333333333,3
w13,16,32,4,2048,768,32,32,256,16,4,3,343.99333333333334,3
w13,16,32,6,3072,1024,16,16,256,1,4,3,678.6503333333334,3
w13,16,32,6,3072,1024,16,16,256,1,4,4,684.197,3
w13,16,32,6,3072,1024,16,16,256,4,4,3,677.6583333333333,3
w13,16,32,6,3072,1024,16,32,256,1,4,3,679.845,3
w13,16,32,6,3072,1024,16,32,256,16,4,3,681.3916666666668,3
w13,16,32,6,3072,1024,16,32,256,16,8,3,684.069,3
w13,16,32,6,3072,1024,16,32,256,32,4,3,682.4156666666667,3
w13,16,32,6,3072,1024,16,32,256,64,4,3,682.9169999999999,3
w13,16,32,6,3072,1024,16,64,256,1,4,3,682.138,3
w13,16,32,6,3072,1024,16,64,256,1,8,3,683.5676666666667,3
w13,16,32,6,3072,1024,16,64,256,16,4,3,682.8103333333333,3
w13,16,32,6,3072,1024,16,64,256,16,8,3,684.0686666666667,3
w13,16,32,6,3072,1024,16,64,256,32,4,3,684.0050000000001,3
w13,16,32,6,3072,1024,16,64,256,64,4,3,684.4743333333334,3
w13,16,32,6,3072,1024,32,32,256,1,4,3,678.2023333333333,3
w13,16,32,6,3072,1024,32,32,256,1,8,3,680.3033333333334,3
w13,16,32,6,3072,1024,32,32,256,4,4,3,680.069,3
w13,16,32,6,3072,1024,32,32,256,4,8,3,680.1436666666667,3
w13,16,32,6,3072,1024,32,32,256,16,4,3,681.7433333333333,3
w13,16,32,6,3072,1024,32,32,256,16,8,3,683.5783333333334,3
w13,16,32,6,3072,1024,32,32,256,32,4,3,684.069,3
w13,16,60,4,2048,1408,16,16,256,1,4,3,1158.4979999999998,3
w13,16,60,4,2048,1408,16,16,256,1,4,4,1162.5726666666667,3
w13,16,60,4,2048,1408,16,16,256,1,8,3,1163.1706666666666,3
w13,16,60,4,2048,1408,16,16,256,1,8,4,1165.89,3
w13,16,60,4,2048,1408,16,16,256,4,4,3,1157.9433333333334,3
w13,16,60,4,2048,1408,16,16,256,4,4,4,1162.1143333333332,3
w13,16,60,4,2048,1408,16,16,256,4,8,3,1162.9783333333335,3
w13,16,60,4,2048,1408,16,16,256,4,8,4,1164.6313333333335,3
w13,16,60,4,2048,1408,16,32,256,1,4,3,1161.037,3
w13,16,60,4,2048,1408,16,32,256,1,4,4,1162.1033333333332,3
w13,16,60,4,2048,1408,16,32,256,1,8,3,1162.8609999999999,3
w13,16,60,4,2048,1408,16,32,256,1,8,4,1162.9456666666667,3
w13,16,60,4,2048,1408,16,32,256,16,4,3,1159.2663333333333,3
w13,16,60,4,2048,1408,16,32,256,16,4,4,1163.4476666666667,3
w13,16,60,4,2048,1408,16,32,256,16,8,3,1161.6986666666667,3
w13,16,60,4,2048,1408,16,32,256,16,8,4,1165.4526666666668,3
w13,16,60,4,2048,1408,16,32,256,32,4,3,1161.0473333333334,3
w13,16,60,4,2048,1408,16,32,256,32,4,4,1165.1006666666665,3
w13,16,60,4,2048,1408,16,32,256,32,8,3,1163.1063333333334,3
w13,16,60,4,2048,1408,16,32,256,32,8,4,1166.1566666666668,3
w13,16,60,4,2048,1408,16,32,256,64,4,3,1164.7916666666667,3
w13,16,60,4,2048,1408,16,32,256,64,8,3,1168.0663333333334,3
w13,16,60,4,2048,1408,16,64,256,1,4,3,1164.1083333333333,3
w13,16,60,4,2048,1408,16,64,256,1,8,3,1164.5353333333335,3
w13,16,60,4,2048,1408,16,64,256,16,4,3,1164.7276666666667,3
w13,16,60,4,2048,1408,16,64,256,16,8,3,1165.6986666666664,3
w13,16,60,4,2048,1408,16,64,256,32,4,3,1167.0633333333333,3
w13,16,60,4,2048,1408,16,64,256,32,8,3,1167.33,3
w13,16,60,4,2048,1408,32,32,256,1,4,3,1160.3966666666668,3
w13,16,60,4,2048,1408,32,32,256,1,4,4,1163.746,3
w13,16,60,4,2048,1408,32,32,256,1,8,3,1161.7516666666668,3
w13,16,60,4,2048,1408,32,32,256,1,8,4,1165.5063333333335,3
w13,16,60,4,2048,1408,32,32,256,4,4,3,1160.866,3
w13,16,60,4,2048,1408,32,32,256,4,4,4,1165.1113333333333,3
w13,16,60,4,2048,1408,32,32,256,4,8,3,1161.6976666666667,3
w13,16,60,4,2048,1408,32,32,256,4,8,4,1166.2636666666667,3
w13,16,60,4,2048,1408,32,32,256,16,4,3,1162.1993333333332,3
w13,16,60,4,2048,1408,32,32,256,16,4,4,1165.549,3
w13,16,60,4,2048,1408,32,32,256,16,8,3,1162.7436666666665,3
w13,16,60,4,2048,1408,32,32,256,16,8,4,1167.4263333333333,3
w13,16,60,4,2048,1408,32,32,256,32,4,3,1164.706,3
w13,16,60,4,2048,1408,32,32,256,32,4,4,1166.4556666666667,3
w13,16,60,4,2048,1408,32,32,256,32,8,3,1164.6206666666667,3
w13,16,60,4,2048,1408,32,32,256,32,8,4,1169.1006666666665,3
w13,16,60,4,2048,1408,32,64,256,1,4,3,1168.5886666666668,3
w13,16,60,4,2048,1408,32,64,256,1,8,3,1166.0819999999999,3
w13,16,60,4,2048,1408,32,64,256,8,4,3,1169.1326666666666,3
w13,16,60,4,2048,1408,32,64,256,8,8,3,1166.8393333333333,3
w13,16,60,4,2048,1408,32,64,256,16,8,3,1167.6393333333333,3
w13,16,60,4,2048,1408,32,64,256,32,8,3,1169.0476666666666,3
w13,16,60,4,2048,1408,64,32,256,1,4,3,1167.1383333333333,3
w13,16,60,4,2048,1408,64,32,256,1,8,3,1166.8603333333333,3
w13,16,60,6,3584,2304,16,16,256,1,4,3,3304.012,3
w13,16,60,6,3584,2304,16,16,256,1,8,3,3324.524,3
w13,16,60,6,3584,2304,16,16,256,4,4,3,3303.851666666667,3
w13,16,60,6,3584,2304,16,16,256,4,8,3,3326.0816666666665,3
w13,16,60,6,3584,2304,16,32,256,1,4,3,3311.329333333333,3
w13,16,60,6,3584,2304,16,32,256,1,8,3,3321.964,3
w13,16,60,6,3584,2304,16,32,256,16,4,3,3316.599333333333,3
w13,16,60,6,3584,2304,16,32,256,16,8,3,3326.6683333333335,3
w13,16,60,6,3584,2304,16,32,256,32,4,3,3323.820333333333,3
w13,16,60,6,3584,2304,16,64,256,1,4,3,3315.5956666666666,3
w13,16,60,6,3584,2304,16,64,256,1,8,3,3324.919,3
w13,16,60,6,3584,2304,16,64,256,16,4,3,3320.5453333333335,3
w13,16,60,6,3584,2304,16,64,256,32,4,3,3326.956333333333,3
w13,16,60,6,3584,2304,32,32,256,1,4,3,3296.908,3
w13,16,60,6,3584,2304,32,32,256,1,8,3,3301.4413333333337,3
w13,16,60,6,3584,2304,32,32,256,4,4,3,3302.422666666667,3
w13,16,60,6,3584,2304,32,32,256,4,8,3,3304.6200000000003,3
w13,16,60,6,3584,2304,32,32,256,16,4,3,3309.6119999999996,3
w13,16,60,6,3584,2304,32,32,256,16,8,3,3315.116,3
w13,16,60,6,3584,2304,32,32,256,32,4,3,3321.3033333333333,3
w13,16,60,6,3584,2304,32,32,256,32,8,3,3325.612333333333,3
w13,16,60,6,3584,2304,64,32,256,1,4,3,3317.8146666666667,3
w13,16,60,6,3584,2304,64,32,256,1,8,3,3316.758666666667,3
w13,16,60,8,2048,1536,16,16,256,1,4,3,1265.4113333333332,3
w13,16,60,8,2048,1536,16,16,256,1,4,4,1269.561,3
w13,16,60,8,2048,1536,16,16,256,1,8,3,1270.8406666666667,3
w13,16,60,8,2048,1536,16,16,256,1,8,4,1271.7263333333333,3
w13,16,60,8,2048,1536,16,16,256,4,4,3,1265.9236666666666,3
w13,16,60,8,2048,1536,16,16,256,4,4,4,1270.5743333333332,3
w13,16,60,8,2048,1536,16,16,256,4,8,3,1270.094,3
w13,16,60,8,2048,1536,16,16,256,4,8,4,1272.7933333333333,3
w13,16,60,8,2048,1536,16,32,256,1,4,3,1268.4726666666668,3
w13,16,60,8,2048,1536,16,32,256,1,4,4,1269.1236666666666,3
w13,16,60,8,2048,1536,16,32,256,1,8,3,1269.8596666666665,3
w13,16,60,8,2048,1536,16,32,256,1,8,4,1270.9256666666668,3
w13,16,60,8,2048,1536,16,32,256,16,4,3,1267.7366666666667,3
w13,16,60,8,2048,1536,16,32,256,16,4,4,1273.3583333333333,3
w13,16,60,8,2048,1536,16,32,256,16,8,3,1270.0943333333335,3
w13,16,60,8,2048,1536,16,32,256,16,8,4,1274.2436666666667,3
w13,16,60,8,2048,1536,16,32,256,32,4,3,1269.39,3
w13,16,60,8,2048,1536,16,32,256,32,4,4,1273.9446666666665,3
w13,16,60,8,2048,1536,16,32,256,32,8,3,1272.0893333333333,3
w13,16,60,8,2048,1536,16,32,256,32,8,4,1275.2573333333332,3
w13,16,60,8,2048,1536,16,32,256,64,4,3,1273.8703333333335,3
w13,16,60,8,2048,1536,16,32,256,64,8,3,1276.1316666666664,3
w13,16,60,8,2048,1536,16,64,256,1,4,3,1271.8966666666668,3
w13,16,60,8,2048,1536,16,64,256,1,8,3,1272.3023333333333,3
w13,16,60,8,2048,1536,16,64,256,16,4,3,1273.401,3
w13,16,60,8,2048,1536,16,64,256,16,8,3,1274.6166666666668,3
w13,16,60,8,2048,1536,16,64,256,32,4,3,1275.2036666666665,3
w13,16,60,8,2048,1536,16,64,256,32,8,3,1276.9636666666665,3
w13,16,60,8,2048,1536,32,32,256,1,4,3,1266.3396666666665,3
w13,16,60,8,2048,1536,32,32,256,1,4,4,1271.353,3
w13,16,60,8,2048,1536,32,32,256,1,8,3,1266.9366666666667,3
w13,16,60,8,2048,1536,32,32,256,1,8,4,1272.782,3
w13,16,60,8,2048,1536,32,32,256,4,4,3,1269.6139999999998,3
w13,16,60,8,2048,1536,32,32,256,4,4,4,1273.9446666666665,3
w13,16,60,8,2048,1536,32,32,256,4,8,3,1270.446,3
w13,16,60,8,2048,1536,32,32,256,4,8,4,1275.3636666666669,3
w13,16,60,8,2048,1536,32,32,256,16,4,3,1271.0753333333334,3
w13,16,60,8,2048,1536,32,32,256,16,4,4,1275.7263333333333,3
w13,16,60,8,2048,1536,32,32,256,16,8,3,1271.9503333333334,3
w13,16,60,8,2048,1536,32,32,256,16,8,4,1277.0379999999998,3
w13,16,60,8,2048,1536,32,32,256,32,4,3,1272.5473333333332,3
w13,16,60,8,2048,1536,32,32,256,32,4,4,1276.4619999999998,3
w13,16,60,8,2048,1536,32,32,256,32,8,3,1274.382,3
w13,16,60,8,2048,1536,32,64,256,1,4,3,1277.0919999999999,3
w13,16,60,8,2048,1536,32,64,256,1,8,3,1274.381666666667,3
w13,16,60,8,2048,1536,32,64,256,8,4,3,1278.1156666666666,3
w13,16,60,8,2048,1536,32,64,256,8,8,3,1276.0566666666666,3
w13,16,60,8,2048,1536,32,64,256,16,8,3,1276.75,3
w13,16,60,8,2048,1536,64,32,256,1,4,3,1273.8383333333331,3
w13,16,60,8,2048,1536,64,32,256,1,8,3,1272.2063333333333,3
w13,16,64,6,3072,2048,16,16,256,1,4,3,2687.809333333333,3
w13,16,64,6,3072,2048,16,16,256,1,4,4,2709.943333333333,3
w13,16,64,6,3072,2048,16,16,256,1,8,3,2702.721333333333,3
w13,16,64,6,3072,2048,16,16,256,4,4,3,2683.7883333333334,3
w13,16,64,6,3072,2048,16,16,256,4,8,3,2698.668,3
w13,16,64,6,3072,2048,16,32,256,1,4,3,2692.7166666666667,3
w13,16,64,6,3072,2048,16,32,256,1,8,3,2699.9590000000003,3
w13,16,64,6,3072,2048,16,32,256,16,4,3,2694.7856666666667,3
w13,16,64,6,3072,2048,16,32,256,16,8,3,2701.676,3
w13,16,64,6,3072,2048,16,32,256,32,4,3,2700.642,3
w13,16,64,6,3072,2048,16,32,256,32,8,3,2706.722,3
w13,16,64,6,3072,2048,16,64,256,1,4,3,2692.802,3
w13,16,64,6,3072,2048,16,64,256,1,8,3,2698.4013333333332,3
w13,16,64,6,3072,2048,16,64,256,16,4,3,2697.1856666666667,3
w13,16,64,6,3072,2048,16,64,256,16,8,3,2703.8626666666664,3
w13,16,64,6,3072,2048,16,64,256,32,4,3,2703.052333333333,3
w13,16,64,6,3072,2048,16,64,256,32,8,3,2707.6389999999997,3
w13,16,64,6,3072,2048,16,64,256,64,4,3,2708.7273333333337,3
w13,16,64,6,3072,2048,32,32,256,1,4,3,2684.652,3
w13,16,64,6,3072,2048,32,32,256,1,8,3,2688.876333333333,3
w13,16,64,6,3072,2048,32,32,256,4,4,3,2687.1380000000004,3
w13,16,64,6,3072,2048,32,32,256,4,8,3,2689.634,3
w13,16,64,6,3072,2048,32,32,256,16,4,3,2695.5646666666667,3
w13,16,64,6,3072,2048,32,32,256,16,8,3,2699.6920000000005,3
w13,16,64,6,3072,2048,32,32,256,32,4,3,2703.4256666666665,3
w13,16,64,6,3072,2048,32,32,256,32,8,3,2706.86,3
w13,16,64,6,3072,2048,32,64,256,1,8,3,2708.8126666666667,3
w13,16,64,6,3072,2048,64,32,256,1,4,3,2700.7376666666664,3
w13,16,64,6,3072,2048,64,32,256,1,8,3,2699.9590000000003,3
w13,16,64,6,3584,1536,16,16,256,1,4,3,2350.578666666667,3
w13,16,64,6,3584,1536,16,16,256,1,4,4,2371.368,3
w13,16,64,6,3584,1536,16,16,256,1,8,3,2366.131,3
w13,16,64,6,3584,1536,16,16,256,4,4,3,2350.909333333333,3
w13,16,64,6,3584,1536,16,16,256,4,4,4,2371.8803333333335,3
w13,16,64,6,3584,1536,16,16,256,4,8,3,2367.5176666666666,3
w13,16,64,6,3584,1536,16,32,256,1,4,3,2357.085,3
w13,16,64,6,3584,1536,16,32,256,1,4,4,2370.8243333333335,3
w13,16,64,6,3584,1536,16,32,256,1,8,3,2364.36,3
w13,16,64,6,3584,1536,16,32,256,1,8,4,2372.1253333333334,3
w13,16,64,6,3584,1536,16,32,256,16,4,3,2360.435,3
w13,16,64,6,3584,1536,16,32,256,16,8,3,2367.2616666666668,3
w13,16,64,6,3584,1536,16,32,256,32,4,3,2363.8586666666665,3
w13,16,64,6,3584,1536,16,32,256,32,8,3,2369.896,3
w13,16,64,6,3584,1536,16,32,256,64,4,3,2373.2346666666667,3
w13,16,64,6,3584,1536,16,64,256,1,4,3,2360.1576666666665,3
w13,16,64,6,3584,1536,16,64,256,1,8,3,2366.792,3
w13,16,64,6,3584,1536,16,64,256,16,4,3,2363.6243333333337,3
w13,16,64,6,3584,1536,16,64,256,16,8,3,2369.469666666667,3
w13,16,64,6,3584,1536,16,64,256,32,4,3,2367.954666666667,3
w13,16,64,6,3584,1536,16,64,256,32,8,3,2372.1679999999997,3
w13,16,64,6,3584,1536,32,32,256,1,4,3,2350.013,3
w13,16,64,6,3584,1536,32,32,256,1,4,4,2372.541333333333,3
w13,16,64,6,3584,1536,32,32,256,1,8,3,2355.2183333333337,3
w13,16,64,6,3584,1536,32,32,256,4,4,3,2352.1470000000004,3
w13,16,64,6,3584,1536,32,32,256,4,8,3,2356.509666666667,3
w13,16,64,6,3584,1536,32,32,256,16,4,3,2358.3763333333336,3
w13,16,64,6,3584,1536,32,32,256,16,8,3,2362.8773333333334,3
w13,16,64,6,3584,1536,32,32,256,32,4,3,2364.637333333333,3
w13,16,64,6,3584,1536,32,32,256,32,8,3,2367.7309999999998,3
w13,16,64,6,3584,1536,64,32,256,1,4,3,2364.787,3
w13,16,64,6,3584,1536,64,32,256,1,8,3,2370.3016666666663,3
w13,16,64,8,3584,2560,16,16,256,1,4,3,3915.5063333333333,3
w13,16,64,8,3584,2560,16,16,256,1,8,3,3942.1946666666663,3
w13,16,64,8,3584,2560,16,16,256,4,4,3,3918.375666666667,3
w13,16,64,8,3584,2560,16,16,256,4,8,3,3945.7039999999997,3
w13,16,64,8,3584,2560,16,32,256,1,4,3,3925.3620000000005,3
w13,16,64,8,3584,2560,16,32,256,1,8,3,3938.2160000000003,3
w13,16,64,8,3584,2560,16,32,256,16,4,3,3930.44,3
w13,16,64,8,3584,2560,16,32,256,16,8,3,3944.007333333333,3
w13,16,64,8,3584,2560,16,32,256,32,4,3,3940.0723333333335,3
w13,16,64,8,3584,2560,16,64,256,1,4,3,3930.5996666666665,3
w13,16,64,8,3584,2560,16,64,256,1,8,3,3942.642333333333,3
w13,16,64,8,3584,2560,16,64,256,16,4,3,3937.6613333333335,3
w13,16,64,8,3584,2560,16,64,256,32,4,3,3946.2163333333338,3
w13,16,64,8,3584,2560,32,32,256,1,4,3,3907.6766666666663,3
w13,16,64,8,3584,2560,32,32,256,1,8,3,3911.8583333333336,3
w13,16,64,8,3584,2560,32,32,256,4,4,3,3912.9353333333333,3
w13,16,64,8,3584,2560,32,32,256,4,8,3,3917.8313333333335,3
w13,16,64,8,3584,2560,32,32,256,16,4,3,3921.5646666666667,3
w13,16,64,8,3584,2560,32,32,256,16,8,3,3927.6983333333333,3
w13,16,64,8,3584,2560,32,32,256,32,4,3,3938.663666666667,3
w13,16,64,8,3584,2560,32,32,256,32,8,3,3944.7543333333338,3
w13,16,64,8,3584,2560,64,32,256,1,4,3,3932.818333333333,3
w13,16,64,8,3584,2560,64,32,256,1,8,3,3931.602666666666,3
w13,16,128,4,2048,512,16,16,256,1,4,3,453.43666666666667,3
w13,16,128,4,2048,512,16,16,256,1,4,4,453.575,3
w13,16,128,4,2048,512,16,16,256,1,8,3,456.07166666666666,3
w13,16,128,4,2048,512,16,16,256,1,8,4,454.79133333333334,3
w13,16,128,4,2048,512,16,16,256,4,4,3,453.7033333333334,3
w13,16,128,4,2048,512,16,16,256,4,4,4,454.33233333333334,3
w13,16,128,4,2048,512,16,16,256,4,8,3,457.1913333333334,3
w13,16,128,4,2048,512,16,16,256,4,8,4,456.146,3
w13,16,128,4,2048,512,16,32,256,1,4,3,453.34066666666666,3
w13,16,128,4,2048,512,16,32,256,1,4,4,454.5136666666667,3
w13,16,128,4,2048,512,16,32,256,1,8,3,453.43666666666667,3
w13,16,128,4,2048,512,16,32,256,1,8,4,454.42866666666663,3
w13,16,128,4,2048,512,16,32,256,16,4,3,453.7776666666667,3
w13,16,128,4,2048,512,16,32,256,16,4,4,455.132,3
w13,16,128,4,2048,512,16,32,256,16,8,3,455.346,3
w13,16,128,4,2048,512,16,32,256,16,8,4,456.1673333333333,3
w13,16,128,4,2048,512,16,32,256,32,4,3,454.4073333333333,3
w13,16,128,4,2048,512,16,32,256,32,4,4,455.997,3
w13,16,128,4,2048,512,16,32,256,32,8,3,455.86833333333334,3
w13,16,128,4,2048,512,16,32,256,32,8,4,456.5303333333333,3
w13,16,128,4,2048,512,16,32,256,64,4,3,456.24166666666673,3
w13,16,128,4,2048,512,16,32,256,64,8,3,457.2663333333333,3
w13,16,128,4,2048,512,16,64,256,1,4,3,455.83666666666664,3
w13,16,128,4,2048,512,16,64,256,1,8,3,456.08166666666665,3
w13,16,128,4,2048,512,16,64,256,16,4,3,455.77299999999997,3
w13,16,128,4,2048,512,16,64,256,16,8,3,455.41,3
w13,16,128,4,2048,512,16,64,256,32,4,3,456.90333333333336,3
w13,16,128,4,2048,512,16,64,256,32,8,3,456.413,3
w13,16,128,4,2048,512,16,64,256,64,4,3,457.66066666666666,3
w13,16,128,4,2048,512,16,64,256,64,8,3,457.63933333333335,3
w13,16,128,4,2048,512,32,32,256,1,4,3,454.75966666666665,3
w13,16,128,4,2048,512,32,32,256,1,4,4,455.9750000000001,3
w13,16,128,4,2048,512,32,32,256,1,8,3,453.9916666666666,3
w13,16,128,4,2048,512,32,32,256,1,8,4,456.7543333333333,3
w13,16,128,4,2048,512,32,32,256,4,4,3,455.20666666666665,3
w13,16,128,4,2048,512,32,32,256,4,4,4,456.7536666666667,3
w13,16,128,4,2048,512,32,32,256,4,8,3,454.82300000000004,3
w13,16,128,4,2048,512,32,32,256,4,8,4,457.479,3
w13,16,128,4,2048,512,32,32,256,16,4,3,454.7166666666667,3
w13,16,128,4,2048,512,32,32,256,16,4,4,456.3913333333333,3
w13,16,128,4,2048,512,32,32,256,16,8,3,454.8233333333333,3
w13,16,128,4,2048,512,32,32,256,16,8,4,457.83166666666665,3
w13,16,128,4,2048,512,32,32,256,32,4,3,455.91100000000006,3
w13,16,128,4,2048,512,32,32,256,32,4,4,456.818,3
w13,16,128,4,2048,512,32,32,256,32,8,3,456.146,3
w13,16,128,4,2048,512,32,32,256,32,8,4,457.863,3
w13,16,128,4,2048,512,32,64,256,1,8,3,457.138,3
w13,16,128,4,2048,512,32,64,256,8,8,3,457.55400000000003,3
w13,16,128,4,2048,512,32,64,256,16,8,3,456.95700000000005,3
w13,16,128,4,2048,512,64,32,256,1,8,3,457.682,3
w13,16,128,6,4096,2048,16,16,256,1,4,3,5377.073333333334,3
w13,16,128,6,4096,2048,16,16,256,1,4,4,5396.273666666667,3
w13,16,128,6,4096,2048,16,16,256,1,8,3,5399.345333333334,3
w13,16,128,6,4096,2048,16,16,256,1,8,4,5401.372333333333,3
w13,16,128,6,4096,2048,16,16,256,4,4,3,5374.727,3
w13,16,128,6,4096,2048,16,16,256,4,4,4,5396.263,3
w13,16,128,6,4096,2048,16,16,256,4,8,3,5393.959,3
w13,16,128,6,4096,2048,16,16,256,4,8,4,5404.551,3
w13,16,128,6,4096,2048,16,32,256,1,4,3,5385.190666666666,3
w13,16,128,6,4096,2048,16,32,256,1,4,4,5399.260333333333,3
w13,16,128,6,4096,2048,16,32,256,1,8,3,5395.068333333333,3
w13,16,128,6,4096,2048,16,32,256,1,8,4,5401.553666666667,3
w13,16,128,6,4096,2048,16,32,256,16,4,3,5385.841666666666,3
w13,16,128,6,4096,2048,16,32,256,16,4,4,5408.113333333334,3
w13,16,128,6,4096,2048,16,32,256,16,8,3,5394.236333333333,3
w13,16,128,6,4096,2048,16,32,256,16,8,4,5409.841666666667,3
w13,16,128,6,4096,2048,16,32,256,32,4,3,5393.585666666666,3
w13,16,128,6,4096,2048,16,32,256,32,4,4,5423.175,3
w13,16,128,6,4096,2048,16,32,256,32,8,3,5402.695,3
w13,16,128,6,4096,2048,16,32,256,32,8,4,5426.887,3
w13,16,128,6,4096,2048,16,32,256,64,4,3,5401.777666666666,3
w13,16,128,6,4096,2048,16,32,256,64,8,3,5413.052666666667,3
w13,16,128,6,4096,2048,16,64,256,1,4,3,5394.728,3
w13,16,128,6,4096,2048,16,64,256,1,8,3,5399.442333333333,3
w13,16,128,6,4096,2048,16,64,256,16,4,3,5399.239666666667,3
w13,16,128,6,4096,2048,16,64,256,16,8,3,5405.234333333333,3
w13,16,128,6,4096,2048,16,64,256,32,4,3,5407.549,3
w13,16,128,6,4096,2048,16,64,256,32,8,3,5411.495666666667,3
w13,16,128,6,4096,2048,16,64,256,64,4,3,5411.442333333333,3
w13,16,128,6,4096,2048,16,64,256,64,8,3,5417.084999999999,3
w13,16,128,6,4096,2048,32,32,256,1,4,3,5381.458333333333,3
w13,16,128,6,4096,2048,32,32,256,1,4,4,5401.2880000000005,3
w13,16,128,6,4096,2048,32,32,256,1,8,3,5387.09,3
w13,16,128,6,4096,2048,32,32,256,1,8,4,5405.8206666666665,3
w13,16,128,6,4096,2048,32,32,256,4,4,3,5384.306333333334,3
w13,16,128,6,4096,2048,32,32,256,4,4,4,5404.306333333334,3
w13,16,128,6,4096,2048,32,32,256,4,8,3,5389.703666666667,3
w13,16,128,6,4096,2048,32,32,256,4,8,4,5407.570333333333,3
w13,16,128,6,4096,2048,32,32,256,16,4,3,5393.085,3
w13,16,128,6,4096,2048,32,32,256,16,4,4,5410.461333333334,3
w13,16,128,6,4096,2048,32,32,256,16,8,3,5400.220666666667,3
w13,16,128,6,4096,2048,32,32,256,16,8,4,5414.472000000001,3
w13,16,128,6,4096,2048,32,32,256,32,4,3,5406.418333333334,3
w13,16,128,6,4096,2048,32,32,256,32,4,4,5427.218666666667,3
w13,16,128,6,4096,2048,32,32,256,32,8,3,5410.1410000000005,3
w13,16,128,6,4096,2048,32,64,256,1,4,3,5411.635,3
w13,16,128,6,4096,2048,32,64,256,1,8,3,5406.599999999999,3
w13,16,128,6,4096,2048,32,64,256,8,4,3,5414.942,3
w13,16,128,6,4096,2048,32,64,256,8,8,3,5409.416333333334,3
w13,16,128,6,4096,2048,32,64,256,16,4,3,5417.682666666667,3
w13,16,128,6,4096,2048,32,64,256,16,8,3,5412.627333333333,3
w13,16,128,6,4096,2048,32,64,256,32,4,3,5427.475666666666,3
w13,16,128,6,4096,2048,32,64,256,32,8,3,5421.918000000001,3
w13,16,128,6,4096,2048,32,64,256,64,8,3,5425.576,3
w13,16,128,6,4096,2048,64,32,256,1,4,3,5404.883333333333,3
w13,16,128,6,4096,2048,64,32,256,1,8,3,5402.899,3
w13,16,128,8,2048,768,16,16,256,1,4,3,1347.7106666666668,3
w13,16,128,8,2048,768,16,16,256,1,4,4,1350.6546666666666,3
w13,16,128,8,2048,768,16,16,256,1,8,3,1352.02,3
w13,16,128,8,2048,768,16,16,256,1,8,4,1352.457,3
w13,16,128,8,2048,768,16,16,256,4,4,3,1346.9640000000002,3
w13,16,128,8,2048,768,16,16,256,4,4,4,1350.409,3
w13,16,128,8,2048,768,16,16,256,4,8,3,1352.7026666666668,3
w13,16,128,8,2048,768,16,16,256,4,8,4,1353.7796666666666,3
w13,16,128,8,2048,768,16,32,256,1,4,3,1348.9796666666664,3
w13,16,128,8,2048,768,16,32,256,1,4,4,1350.8036666666667,3
w13,16,128,8,2048,768,16,32,256,1,8,3,1350.6546666666668,3
w13,16,128,8,2048,768,16,32,256,1,8,4,1351.390666666667,3
w13,16,128,8,2048,768,16,32,256,16,4,3,1348.4889999999998,3
w13,16,128,8,2048,768,16,32,256,16,4,4,1354.1106666666667,3
w13,16,128,8,2048,768,16,32,256,16,8,3,1351.305,3
w13,16,128,8,2048,768,16,32,256,16,8,4,1354.8256666666666,3
w13,16,128,8,2048,768,16,32,256,32,4,3,1350.495,3
w13,16,128,8,2048,768,16,32,256,32,4,4,1354.7503333333334,3
w13,16,128,8,2048,768,16,32,256,32,8,3,1352.9160000000002,3
w13,16,128,8,2048,768,16,32,256,32,8,4,1355.913,3
w13,16,128,8,2048,768,16,32,256,64,4,3,1354.4413333333332,3
w13,16,128,8,2048,768,16,32,256,64,8,3,1356.6813333333332,3
w13,16,128,8,2048,768,16,64,256,1,4,3,1352.5739999999998,3
w13,16,128,8,2048,768,16,64,256,1,8,3,1353.8010000000002,3
w13,16,128,8,2048,768,16,64,256,16,4,3,1354.58,3
w13,16,128,8,2048,768,16,64,256,16,8,3,1355.4973333333335,3
w13,16,128,8,2048,768,16,64,256,32,4,3,1355.786,3
w13,16,128,8,2048,768,16,64,256,32,8,3,1357.8010000000002,3
w13,16,128,8,2048,768,16,64,256,64,4,3,1359.6783333333333,3
w13,16,128,8,2048,768,16,64,256,64,8,3,1360.0946666666666,3
w13,16,128,8,2048,768,32,32,256,1,4,3,1348.2436666666665,3
w13,16,128,8,2048,768,32,32,256,1,4,4,1353.1503333333333,3
w13,16,128,8,2048,768,32,32,256,1,8,3,1348.6490000000001,3
w13,16,128,8,2048,768,32,32,256,1,8,4,1355.2836666666665,3
w13,16,128,8,2048,768,32,32,256,4,4,3,1349.4489999999998,3
w13,16,128,8,2048,768,32,32,256,4,4,4,1353.5346666666667,3
w13,16,128,8,2048,768,32,32,256,4,8,3,1350.3346666666669,3
w13,16,128,8,2048,768,32,32,256,4,8,4,1355.38,3
w13,16,128,8,2048,768,32,32,256,16,4,3,1351.6146666666666,3
w13,16,128,8,2048,768,32,32,256,16,4,4,1356.052,3
w13,16,128,8,2048,768,32,32,256,16,8,3,1353.0653333333332,3
w13,16,128,8,2048,768,32,32,256,16,8,4,1357.396,3
w13,16,128,8,2048,768,32,32,256,32,4,3,1353.1503333333333,3
w13,16,128,8,2048,768,32,32,256,32,4,4,1356.3396666666667,3
w13,16,128,8,2048,768,32,32,256,32,8,3,1355.5826666666665,3
w13,16,128,8,2048,768,32,32,256,32,8,4,1358.6223333333335,3
w13,16,128,8,2048,768,32,64,256,1,4,3,1357.823,3
w13,16,128,8,2048,768,32,64,256,1,8,3,1356.0623333333333,3
w13,16,128,8,2048,768,32,64,256,8,4,3,1359.9343333333334,3
w13,16,128,8,2048,768,32,64,256,8,8,3,1357.7903333333334,3
w13,16,128,8,2048,768,32,64,256,16,4,3,1359.6786666666667,3
w13,16,128,8,2048,768,32,64,256,16,8,3,1357.7263333333333,3
w13,16,128,8,2048,768,32,64,256,32,8,3,1359.2196666666666,3
w13,16,128,8,2048,768,64,32,256,1,4,3,1356.2336666666667,3
w13,16,128,8,2048,768,64,32,256,1,8,3,1354.0253333333333,3
w13,16,128,8,4096,1536,16,16,256,1,4,3,5375.041,3
w13,16,128,8,4096,1536,16,16,256,1,4,4,5394.945,3
w13,16,128,8,4096,1536,16,16,256,1,8,3,5395.7446666666665,3
w13,16,128,8,4096,1536,16,16,256,1,8,4,5402.6033333333335,3
w13,16,128,8,4096,1536,16,16,256,4,4,3,5376.651666666666,3
w13,16,128,8,4096,1536,16,16,256,4,4,4,5397.120666666667,3
w13,16,128,8,4096,1536,16,16,256,4,8,3,5393.579666666667,3
w13,16,128,8,4096,1536,16,16,256,4,8,4,5404.992666666667,3
w13,16,128,8,4096,1536,16,32,256,1,4,3,5386.390333333333,3
w13,16,128,8,4096,1536,16,32,256,1,4,4,5397.163666666666,3
w13,16,128,8,4096,1536,16,32,256,1,8,3,5395.659666666666,3
w13,16,128,8,4096,1536,16,32,256,1,8,4,5400.939666666666,3
w13,16,128,8,4096,1536,16,32,256,16,4,3,5386.624666666667,3
w13,16,128,8,4096,1536,16,32,256,16,4,4,5404.4913333333325,3
w13,16,128,8,4096,1536,16,32,256,16,8,3,5394.571333333333,3
w13,16,128,8,4096,1536,16,32,256,16,8,4,5408.395333333333,3
w13,16,128,8,4096,1536,16,32,256,32,4,3,5391.393,3
w13,16,128,8,4096,1536,16,32,256,32,4,4,5415.979666666667,3
w13,16,128,8,4096,1536,16,32,256,32,8,3,5399.019666666667,3
w13,16,128,8,4096,1536,16,32,256,32,8,4,5419.862,3
w13,16,128,8,4096,1536,16,32,256,64,4,3,5405.259333333334,3
w13,16,128,8,4096,1536,16,32,256,64,8,3,5414.518333333333,3
w13,16,128,8,4096,1536,16,64,256,1,4,3,5394.572666666667,3
w13,16,128,8,4096,1536,16,64,256,1,8,3,5400.087,3
w13,16,128,8,4096,1536,16,64,256,16,4,3,5398.753333333333,3
w13,16,128,8,4096,1536,16,64,256,16,8,3,5403.446666666667,3
w13,16,128,8,4096,1536,16,64,256,32,4,3,5404.545,3
w13,16,128,8,4096,1536,16,64,256,32,8,3,5409.932333333333,3
w13,16,128,8,4096,1536,16,64,256,64,4,3,5408.887333333333,3
w13,16,128,8,4096,1536,16,64,256,64,8,3,5414.551,3
w13,16,128,8,4096,1536,32,32,256,1,4,3,5382.092,3
w13,16,128,8,4096,1536,32,32,256,1,4,4,5401.068333333334,3
w13,16,128,8,4096,1536,32,32,256,1,8,3,5387.905333333333,3
w13,16,128,8,4096,1536,32,32,256,1,8,4,5405.206666666666,3
w13,16,128,8,4096,1536,32,32,256,4,4,3,5386.156333333333,3
w13,16,128,8,4096,1536,32,32,256,4,4,4,5404.374666666667,3
w13,16,128,8,4096,1536,32,32,256,4,8,3,5390.54,3
w13,16,128,8,4096,1536,32,32,256,4,8,4,5408.609333333334,3
w13,16,128,8,4096,1536,32,32,256,16,4,3,5390.604333333333,3
w13,16,128,8,4096,1536,32,32,256,16,4,4,5409.068333333333,3
w13,16,128,8,4096,1536,32,32,256,16,8,3,5394.870666666667,3
w13,16,128,8,4096,1536,32,32,256,16,8,4,5415.095333333334,3
w13,16,128,8,4096,1536,32,32,256,32,4,3,5401.3026666666665,3
w13,16,128,8,4096,1536,32,32,256,32,4,4,5420.172333333333,3
w13,16,128,8,4096,1536,32,32,256,32,8,3,5404.631,3
w13,16,128,8,4096,1536,32,32,256,32,8,4,5423.169999999999,3
w13,16,128,8,4096,1536,32,64,256,1,4,3,5411.458333333333,3
w13,16,128,8,4096,1536,32,64,256,1,8,3,5406.732666666667,3
w13,16,128,8,4096,1536,32,64,256,8,4,3,5412.45,3
w13,16,128,8,4096,1536,32,64,256,8,8,3,5408.44,3
w13,16,128,8,4096,1536,32,64,256,16,4,3,5415.874333333333,3
w13,16,128,8,4096,1536,32,64,256,16,8,3,5410.796666666666,3
w13,16,128,8,4096,1536,32,64,256,32,4,3,5421.986,3
w13,16,128,8,4096,1536,32,64,256,32,8,3,5417.932666666667,3
w13,16,128,8,4096,1536,32,64,256,64,4,3,5426.167666666667,3
w13,16,128,8,4096,1536,32,64,256,64,8,3,5422.007333333334,3
w13,16,128,8,4096,1536,64,32,256,1,4,3,5405.676666666667,3
w13,16,128,8,4096,1536,64,32,256,1,8,3,5404.823333333333,3
w13,16,128,8,4096,3072,16,16,256,1,4,3,10742.81,3
w13,16,128,8,4096,3072,16,16,256,1,4,4,10783.268333333333,3
w13,16,128,8,4096,3072,16,16,256,1,8,3,10775.929333333333,3
w13,16,128,8,4096,3072,16,16,256,1,8,4,10799.375,3
w13,16,128,8,4096,3072,16,16,256,4,4,3,10747.822666666667,3
w13,16,128,8,4096,3072,16,16,256,4,4,4,10790.009666666665,3
w13,16,128,8,4096,3072,16,16,256,4,8,3,10780.633666666667,3
w13,16,128,8,4096,3072,16,16,256,4,8,4,10802.788333333332,3
w13,16,128,8,4096,3072,16,32,256,1,4,3,10766.82,3
w13,16,128,8,4096,3072,16,32,256,1,4,4,10793.935333333335,3
w13,16,128,8,4096,3072,16,32,256,1,8,3,10781.497666666666,3
w13,16,128,8,4096,3072,16,32,256,1,8,4,10798.820333333331,3
w13,16,128,8,4096,3072,16,32,256,16,4,3,10768.762,3
w13,16,128,8,4096,3072,16,32,256,16,4,4,10804.846333333333,3
w13,16,128,8,4096,3072,16,32,256,16,8,3,10783.908333333333,3
w13,16,128,8,4096,3072,16,32,256,16,8,4,10810.916333333333,3
w13,16,128,8,4096,3072,16,32,256,32,4,3,10777.977666666668,3
w13,16,128,8,4096,3072,16,32,256,32,4,4,10828.697333333335,3
w13,16,128,8,4096,3072,16,32,256,32,8,3,10794.18,3
w13,16,128,8,4096,3072,16,32,256,32,8,4,10835.545666666667,3
w13,16,128,8,4096,3072,16,32,256,64,4,3,10811.225333333334,3
w13,16,128,8,4096,3072,16,32,256,64,8,3,10829.807333333332,3
w13,16,128,8,4096,3072,16,64,256,1,4,3,10781.593666666668,3
w13,16,128,8,4096,3072,16,64,256,1,8,3,10790.446333333333,3
w13,16,128,8,4096,3072,16,64,256,16,4,3,10792.430666666667,3
w13,16,128,8,4096,3072,16,64,256,16,8,3,10802.094666666666,3
w13,16,128,8,4096,3072,16,64,256,32,4,3,10802.49,3
w13,16,128,8,4096,3072,16,64,256,32,8,3,10814.382666666666,3
w13,16,128,8,4096,3072,16,64,256,64,4,3,10809.743,3
w13,16,128,8,4096,3072,16,64,256,64,8,3,10821.935,3
w13,16,128,8,4096,3072,32,32,256,1,4,3,10753.443333333333,3
w13,16,128,8,4096,3072,32,32,256,1,4,4,10797.518333333333,3
w13,16,128,8,4096,3072,32,32,256,1,8,3,10763.555666666667,3
w13,16,128,8,4096,3072,32,32,256,1,8,4,10802.745333333334,3
w13,16,128,8,4096,3072,32,32,256,4,4,3,10761.432999999999,3
w13,16,128,8,4096,3072,32,32,256,4,4,4,10802.734666666669,3
w13,16,128,8,4096,3072,32,32,256,4,8,3,10769.976999999999,3
w13,16,128,8,4096,3072,32,32,256,4,8,4,10809.784666666666,3
w13,16,128,8,4096,3072,32,32,256,16,4,3,10774.158333333335,3
w13,16,128,8,4096,3072,32,32,256,16,4,4,10812.035666666667,3
w13,16,128,8,4096,3072,32,32,256,16,8,3,10785.945333333333,3
w13,16,128,8,4096,3072,32,32,256,16,8,4,10816.974666666667,3
w13,16,128,8,4096,3072,32,32,256,32,4,3,10806.169666666667,3
w13,16,128,8,4096,3072,32,32,256,32,4,4,10837.134333333333,3
w13,16,128,8,4096,3072,32,32,256,32,8,3,10813.582666666667,3
w13,16,128,8,4096,3072,32,32,256,32,8,4,10843.982333333333,3
w13,16,128,8,4096,3072,32,64,256,1,4,3,10810.457,3
w13,16,128,8,4096,3072,32,64,256,1,8,3,10804.494,3
w13,16,128,8,4096,3072,32,64,256,8,4,3,10816.984999999999,3
w13,16,128,8,4096,3072,32,64,256,8,8,3,10812.760666666667,3
w13,16,128,8,4096,3072,32,64,256,16,4,3,10822.478666666668,3
w13,16,128,8,4096,3072,32,64,256,16,8,3,10817.166333333333,3
w13,16,128,8,4096,3072,32,64,256,32,4,3,10836.238,3
w13,16,128,8,4096,3072,32,64,256,32,8,3,10830.200666666666,3
w13,16,128,8,4096,3072,32,64,256,64,4,3,10841.54,3
w13,16,128,8,4096,3072,32,64,256,64,8,3,10835.47,3
w13,16,128,8,4096,3072,64,32,256,1,4,3,10793.731666666667,3
w13,16,128,8,4096,3072,64,32,256,1,8,3,10788.932666666668,3
w13,24,8,2,1024,512,16,16,128,1,4,3,32.34433333333333,3
w13,24,8,2,1024,512,16,16,128,1,4,4,32.50333333333333,3
w13,24,8,2,1024,512,16,16,128,4,4,2,32.28033333333334,3
w13,24,8,2,1024,512,16,16,128,4,4,3,32.407333333333334,3
w13,24,8,2,1024,512,16,32,128,1,4,2,32.41866666666667,3
w13,24,8,2,1024,512,16,32,128,1,8,2,32.193999999999996,3
w13,24,8,2,1024,512,16,32,128,4,4,2,32.205000000000005,3
w13,24,8,2,1024,512,16,32,128,4,8,2,32.24766666666667,3
w13,24,8,2,1024,512,16,32,128,16,4,2,32.20466666666667,3
w13,24,8,2,1024,512,16,32,128,16,4,4,32.429,3
w13,24,8,2,1024,512,16,32,128,16,8,2,32.290333333333336,3
w13,24,8,2,1024,512,16,32,128,32,4,2,32.193999999999996,3
w13,24,8,2,1024,512,16,32,128,32,8,2,32.258,3
w13,24,8,2,1024,512,16,32,128,64,4,2,32.216,3
w13,24,8,2,1024,512,16,32,128,64,8,2,32.28,3
w13,24,8,2,1024,512,16,32,256,16,4,2,32.43933333333333,3
w13,24,8,2,1024,512,16,64,128,1,8,2,32.46133333333333,3
w13,24,8,2,1024,512,16,64,128,16,4,2,32.514,3
w13,24,8,2,1024,512,16,64,128,16,8,2,32.25866666666667,3
w13,24,8,2,1024,512,16,64,128,32,8,2,32.226,3
w13,24,8,2,1024,512,16,64,128,64,8,2,32.300999999999995,3
w13,24,8,2,1024,512,32,32,128,1,8,2,32.39666666666667,3
w13,24,8,2,1024,512,32,32,128,4,4,2,32.449999999999996,3
w13,24,8,2,1024,512,32,32,128,4,8,2,32.39666666666667,3
w13,24,8,2,1024,512,32,32,128,16,4,2,32.33266666666666,3
w13,24,8,2,1024,512,32,32,128,16,8,2,32.45033333333333,3
w13,24,8,2,1024,512,32,32,128,64,4,2,32.428666666666665,3
w13,24,8,2,1024,512,32,32,128,64,8,2,32.354,3
w13,24,8,2,1024,512,64,32,128,16,8,2,32.461000000000006,3
w13,24,16,2,1536,768,16,16,128,1,4,4,133.18666666666664,3
w13,24,16,2,1536,768,16,16,128,4,4,4,132.94133333333335,3
w13,24,16,2,1536,768,16,16,256,1,4,3,131.86433333333332,3
w13,24,16,2,1536,768,16,16,256,4,4,3,132.01366666666664,3
w13,24,16,2,1536,768,16,16,256,4,4,4,132.739,3
w13,24,16,2,1536,768,16,32,128,1,4,2,132.89866666666668,3
w13,24,16,2,1536,768,16,32,128,4,4,2,133.08033333333333,3
w13,24,16,2,1536,768,16,32,128,4,4,4,132.888,3
w13,24,16,2,1536,768,16,32,128,16,4,2,133.04766666666666,3
w13,24,16,2,1536,768,16,32,128,32,4,2,133.0906666666667,3
w13,24,16,2,1536,768,16,32,128,64,4,2,133.14433333333332,3
w13,24,16,2,1536,768,16,32,256,1,4,3,132.9946666666667,3
w13,24,16,2,1536,768,16,32,256,16,4,3,133.05866666666668,3
w13,24,16,2,1536,768,16,32,256,32,4,3,133.09066666666666,3
w13,24,16,2,1536,768,16,32,256,64,4,3,132.9523333333333,3
w13,24,16,2,1536,768,32,32,256,4,8,3,133.10133333333332,3
w13,24,16,4,1536,1024,16,16,256,1,4,3,175.56566666666666,3
w13,24,16,4,1536,1024,16,16,256,1,4,4,176.323,3
w13,24,16,4,1536,1024,16,16,256,4,4,3,174.75466666666668,3
w13,24,16,4,1536,1024,16,32,256,1,4,3,175.907,3
w13,24,16,4,1536,1024,16,32,256,1,8,3,176.24800000000002,3
w13,24,16,4,1536,1024,16,32,256,16,4,3,176.40800000000002,3
w13,24,16,4,1536,1024,16,32,256,32,4,3,176.03533333333334,3
w13,24,16,4,1536,1024,16,32,256,32,8,3,176.42966666666666,3
w13,24,16,4,1536,1024,16,32,256,64,4,3,175.875,3
w13,24,16,4,1536,1024,32,32,256,16,4,3,176.00300000000001,3
w13,24,16,4,1536,1024,32,32,256,16,8,3,175.96033333333332,3
w13,24,16,4,1536,1024,32,32,256,32,4,3,176.22699999999998,3
w13,24,16,4,1536,1024,32,32,256,32,8,3,176.163,3
w13,24,32,4,2048,768,16,16,256,1,4,3,341.94533333333334,3
w13,24,32,4,2048,768,16,16,256,1,4,4,343.89733333333334,3
w13,24,32,4,2048,768,16,16,256,4,4,3,341.4546666666667,3
w13,24,32,4,2048,768,16,16,256,4,4,4,343.503,3
w13,24,32,4,2048,768,16,16,256,4,8,3,344.7193333333334,3
w13,24,32,4,2048,768,16,32,256,1,4,3,343.23600000000005,3
w13,24,32,4,2048,768,16,32,256,1,4,4,344.74,3
w13,24,32,4,2048,768,16,32,256,1,8,3,343.89733333333334,3
w13,24,32,4,2048,768,16,32,256,1,8,4,344.84666666666664,3
w13,24,32,4,2048,768,16,32,256,16,4,3,343.588,3
w13,24,32,4,2048,768,16,32,256,32,4,3,344.75100000000003,3
w13,24,32,4,2048,768,16,32,256,64,4,3,344.7936666666667,3
w13,24,32,4,2048,768,32,32,256,1,4,3,344.068,3
w13,24,32,4,2048,768,32,32,256,1,8,3,343.81233333333336,3
w13,24,32,4,2048,768,32,32,256,4,4,3,344.1863333333333,3
w13,24,32,4,2048,768,32,32,256,4,8,3,343.855,3
w13,24,32,6,3072,1024,16,16,256,1,4,3,680.24,3
w13,24,32,6,3072,1024,16,16,256,1,4,4,685.4556666666667,3
w13,24,32,6,3072,1024,16,16,256,1,8,3,686.1806666666666,3
w13,24,32,6,3072,1024,16,16,256,4,4,3,679.6103333333334,3
w13,24,32,6,3072,1024,16,16,256,4,4,4,685.8506666666667,3
w13,24,32,6,3072,1024,16,16,256,4,8,3,686.1703333333334,3
w13,24,32,6,3072,1024,16,32,256,1,4,3,682.3299999999999,3
w13,24,32,6,3072,1024,16,32,256,1,8,3,685.5836666666668,3
w13,24,32,6,3072,1024,16,32,256,16,4,3,683.4720000000001,3
w13,24,32,6,3072,1024,16,32,256,16,8,3,685.7326666666667,3
w13,24,32,6,3072,1024,16,32,256,32,4,3,684.7623333333332,3
w13,24,32,6,3072,1024,16,32,256,64,4,3,684.4636666666667,3
w13,24,32,6,3072,1024,16,64,256,1,4,3,683.9086666666667,3
w13,24,32,6,3072,1024,16,64,256,1,8,3,684.1543333333333,3
w13,24,32,6,3072,1024,16,64,256,16,4,3,684.5916666666666,3
w13,24,32,6,3072,1024,16,64,256,16,8,3,685.8290000000001,3
w13,24,32,6,3072,1024,16,64,256,32,4,3,686.1386666666667,3
w13,24,32,6,3072,1024,32,32,256,1,4,3,679.7703333333334,3
w13,24,32,6,3072,1024,32,32,256,1,8,3,681.413,3
w13,24,32,6,3072,1024,32,32,256,4,4,3,681.36,3
w13,24,32,6,3072,1024,32,32,256,4,8,3,681.8396666666666,3
w13,24,32,6,3072,1024,32,32,256,16,4,3,683.8133333333334,3
w13,24,32,6,3072,1024,32,32,256,16,8,3,685.3916666666668,3
w13,24,32,6,3072,1024,64,32,256,1,8,3,686.0,3
w13,24,60,4,2048,1408,16,16,256,1,4,3,1159.6180000000002,3
w13,24,60,4,2048,1408,16,16,256,1,4,4,1163.682,3
w13,24,60,4,2048,1408,16,16,256,1,8,3,1165.5276666666666,3
w13,24,60,4,2048,1408,16,16,256,1,8,4,1167.0423333333333,3
w13,24,60,4,2048,1408,16,16,256,4,4,3,1159.17,3
w13,24,60,4,2048,1408,16,16,256,4,4,4,1163.7463333333333,3
w13,24,60,4,2048,1408,16,16,256,4,8,3,1164.0766666666668,3
w13,24,60,4,2048,1408,16,16,256,4,8,4,1166.2313333333334,3
w13,24,60,4,2048,1408,16,32,256,1,4,3,1161.9546666666665,3
w13,24,60,4,2048,1408,16,32,256,1,4,4,1162.4983333333332,3
w13,24,60,4,2048,1408,16,32,256,1,8,3,1163.3516666666667,3
w13,24,60,4,2048,1408,16,32,256,1,8,4,1164.162,3
w13,24,60,4,2048,1408,16,32,256,16,4,3,1161.698,3
w13,24,60,4,2048,1408,16,32,256,16,4,4,1166.1246666666668,3
w13,24,60,4,2048,1408,16,32,256,16,8,3,1163.501,3
w13,24,60,4,2048,1408,16,32,256,16,8,4,1167.17,3
w13,24,60,4,2048,1408,16,32,256,32,4,3,1163.6180000000002,3
w13,24,60,4,2048,1408,16,32,256,32,4,4,1167.7353333333333,3
w13,24,60,4,2048,1408,16,32,256,32,8,3,1166.3166666666666,3
w13,24,60,4,2048,1408,16,32,256,32,8,4,1168.3543333333334,3
w13,24,60,4,2048,1408,16,32,256,64,4,3,1169.0366666666666,3
w13,24,60,4,2048,1408,16,64,256,1,4,3,1165.0583333333334,3
w13,24,60,4,2048,1408,16,64,256,1,8,3,1165.8793333333333,3
w13,24,60,4,2048,1408,16,64,256,16,4,3,1166.6796666666667,3
w13,24,60,4,2048,1408,16,64,256,16,8,3,1167.9803333333332,3
w13,24,60,4,2048,1408,16,64,256,32,4,3,1169.1433333333334,3
w13,24,60,4,2048,1408,16,64,256,32,8,3,1169.7726666666667,3
w13,24,60,4,2048,1408,32,32,256,1,4,3,1161.7086666666667,3
w13,24,60,4,2048,1408,32,32,256,1,4,4,1165.1336666666668,3
w13,24,60,4,2048,1408,32,32,256,1,8,3,1162.9779999999998,3
w13,24,60,4,2048,1408,32,32,256,1,8,4,1167.0960000000002,3
w13,24,60,4,2048,1408,32,32,256,4,4,3,1162.445,3
w13,24,60,4,2048,1408,32,32,256,4,4,4,1166.722,3
w13,24,60,4,2048,1408,32,32,256,4,8,3,1163.0846666666666,3
w13,24,60,4,2048,1408,32,32,256,4,8,4,1168.0976666666668,3
w13,24,60,4,2048,1408,32,32,256,16,4,3,1164.6426666666666,3
w13,24,60,4,2048,1408,32,32,256,16,4,4,1167.3513333333333,3
w13,24,60,4,2048,1408,32,32,256,16,8,3,1165.517,3
w13,24,60,4,2048,1408,32,32,256,16,8,4,1169.4846666666665,3
w13,24,60,4,2048,1408,32,32,256,32,4,3,1166.135,3
w13,24,60,4,2048,1408,32,32,256,32,4,4,1169.0046666666667,3
w13,24,60,4,2048,1408,32,32,256,32,8,3,1166.7433333333333,3
w13,24,60,4,2048,1408,32,32,256,32,8,4,1170.6580000000001,3
w13,24,60,4,2048,1408,32,64,256,1,4,3,1170.551333333333,3
w13,24,60,4,2048,1408,32,64,256,1,8,3,1167.9276666666667,3
w13,24,60,4,2048,1408,32,64,256,8,4,3,1170.2636666666667,3
w13,24,60,4,2048,1408,32,64,256,8,8,3,1168.7273333333333,3
w13,24,60,4,2048,1408,32,64,256,16,8,3,1169.5380000000002,3
w13,24,60,4,2048,1408,64,32,256,1,4,3,1168.5033333333333,3
w13,24,60,4,2048,1408,64,32,256,1,8,3,1167.757,3
w13,24,60,6,3584,2304,16,16,256,1,4,3,3305.9960000000005,3
w13,24,60,6,3584,2304,16,16,256,1,8,3,3326.189,3
w13,24,60,6,3584,2304,16,16,256,4,4,3,3309.3566666666666,3
w13,24,60,6,3584,2304,16,16,256,4,8,3,3330.4449999999997,3
w13,24,60,6,3584,2304,16,32,256,1,4,3,3315.2019999999998,3
w13,24,60,6,3584,2304,16,32,256,1,8,3,3325.527,3
w13,24,60,6,3584,2304,16,32,256,16,4,3,3323.490333333333,3
w13,24,60,6,3584,2304,16,32,256,16,8,3,3331.5319999999997,3
w13,24,60,6,3584,2304,16,32,256,32,4,3,3332.7596666666664,3
w13,24,60,6,3584,2304,16,64,256,1,4,3,3319.597,3
w13,24,60,6,3584,2304,16,64,256,1,8,3,3328.2046666666665,3
w13,24,60,6,3584,2304,16,64,256,16,4,3,3326.743,3
w13,24,60,6,3584,2304,32,32,256,1,4,3,3300.1090000000004,3
w13,24,60,6,3584,2304,32,32,256,1,8,3,3303.820333333333,3
w13,24,60,6,3584,2304,32,32,256,4,4,3,3306.8706666666662,3
w13,24,60,6,3584,2304,32,32,256,4,8,3,3309.5696666666663,3
w13,24,60,6,3584,2304,32,32,256,16,4,3,3316.769666666667,3
w13,24,60,6,3584,2304,32,32,256,16,8,3,3322.231333333333,3
w13,24,60,6,3584,2304,64,32,256,1,4,3,3321.911666666667,3
w13,24,60,6,3584,2304,64,32,256,1,8,3,3321.676,3
w13,24,60,8,2048,1536,16,16,256,1,4,3,1266.9476666666667,3
w13,24,60,8,2048,1536,16,16,256,1,4,4,1271.3639999999998,3
w13,24,60,8,2048,1536,16,16,256,1,8,3,1271.9716666666666,3
w13,24,60,8,2048,1536,16,16,256,1,8,4,1273.988,3
w13,24,60,8,2048,1536,16,16,256,4,4,3,1268.1850000000002,3
w13,24,60,8,2048,1536,16,16,256,4,4,4,1273.3583333333333,3
w13,24,60,8,2048,1536,16,16,256,4,8,3,1274.276,3
w13,24,60,8,2048,1536,16,16,256,4,8,4,1276.6436666666668,3
w13,24,60,8,2048,1536,16,32,256,1,4,3,1270.2866666666666,3
w13,24,60,8,2048,1536,16,32,256,1,4,4,1271.4593333333335,3
w13,24,60,8,2048,1536,16,32,256,1,8,3,1272.5586666666668,3
w13,24,60,8,2048,1536,16,32,256,1,8,4,1272.601,3
w13,24,60,8,2048,1536,16,32,256,16,4,3,1271.0333333333333,3
w13,24,60,8,2048,1536,16,32,256,16,4,4,1277.0386666666666,3
w13,24,60,8,2048,1536,16,32,256,16,8,3,1273.156,3
w13,24,60,8,2048,1536,16,32,256,16,8,4,1278.8413333333335,3
w13,24,60,8,2048,1536,16,32,256,32,4,3,1273.2406666666666,3
w13,24,60,8,2048,1536,16,32,256,32,4,4,1278.6166666666668,3
w13,24,60,8,2048,1536,16,32,256,32,8,3,1275.2036666666665,3
w13,24,60,8,2048,1536,16,64,256,1,4,3,1274.2973333333332,3
w13,24,60,8,2048,1536,16,64,256,1,8,3,1275.0866666666668,3
w13,24,60,8,2048,1536,16,64,256,16,4,3,1276.0786666666668,3
w13,24,60,8,2048,1536,16,64,256,16,8,3,1277.4436666666668,3
w13,24,60,8,2048,1536,16,64,256,32,4,3,1279.0653333333332,3
w13,24,60,8,2048,1536,32,32,256,1,4,3,1268.1216666666667,3
w13,24,60,8,2048,1536,32,32,256,1,4,4,1273.9876666666667,3
w13,24,60,8,2048,1536,32,32,256,1,8,3,1269.316,3
w13,24,60,8,2048,1536,32,32,256,1,8,4,1274.948,3
w13,24,60,8,2048,1536,32,32,256,4,4,3,1272.8473333333334,3
w13,24,60,8,2048,1536,32,32,256,4,4,4,1276.452,3
w13,24,60,8,2048,1536,32,32,256,4,8,3,1272.9533333333334,3
w13,24,60,8,2048,1536,32,32,256,4,8,4,1278.7986666666668,3
w13,24,60,8,2048,1536,32,32,256,16,4,3,1275.1083333333333,3
w13,24,60,8,2048,1536,32,32,256,16,4,4,1279.4599999999998,3
w13,24,60,8,2048,1536,32,32,256,16,8,3,1277.0706666666667,3
w13,24,60,8,2048,1536,32,32,256,32,4,3,1279.0866666666668,3
w13,24,60,8,2048,1536,32,64,256,1,8,3,1276.5376666666668,3
w13,24,60,8,2048,1536,32,64,256,8,8,3,1278.4573333333335,3
w13,24,60,8,2048,1536,32,64,256,16,8,3,1279.6200000000001,3
w13,24,60,8,2048,1536,64,32,256,1,4,3,1275.8976666666665,3
w13,24,60,8,2048,1536,64,32,256,1,8,3,1274.3400000000001,3
w13,24,64,6,3072,2048,16,16,256,1,4,3,2689.718666666667,3
w13,24,64,6,3072,2048,16,16,256,1,4,4,2712.8236666666667,3
w13,24,64,6,3072,2048,16,16,256,1,8,3,2703.063,3
w13,24,64,6,3072,2048,16,16,256,4,4,3,2687.5533333333333,3
w13,24,64,6,3072,2048,16,16,256,4,8,3,2703.2653333333333,3
w13,24,64,6,3072,2048,16,32,256,1,4,3,2695.809333333333,3
w13,24,64,6,3072,2048,16,32,256,1,8,3,2703.895,3
w13,24,64,6,3072,2048,16,32,256,16,4,3,2699.3723333333332,3
w13,24,64,6,3072,2048,16,32,256,16,8,3,2706.5933333333337,3
w13,24,64,6,3072,2048,16,32,256,32,4,3,2708.7593333333334,3
w13,24,64,6,3072,2048,16,32,256,32,8,3,2714.338,3
w13,24,64,6,3072,2048,16,64,256,1,4,3,2696.2686666666664,3
w13,24,64,6,3072,2048,16,64,256,1,8,3,2702.828,3
w13,24,64,6,3072,2048,16,64,256,16,4,3,2703.3506666666667,3
w13,24,64,6,3072,2048,16,64,256,16,8,3,2708.9293333333335,3
w13,24,64,6,3072,2048,16,64,256,32,4,3,2710.6363333333334,3
w13,24,64,6,3072,2048,32,32,256,1,4,3,2688.0556666666666,3
w13,24,64,6,3072,2048,32,32,256,1,8,3,2692.226,3
w13,24,64,6,3072,2048,32,32,256,4,4,3,2691.4576666666667,3
w13,24,64,6,3072,2048,32,32,256,4,8,3,2693.3773333333334,3
w13,24,64,6,3072,2048,32,32,256,16,4,3,2701.654666666667,3
w13,24,64,6,3072,2048,32,32,256,16,8,3,2706.422666666667,3
w13,24,64,6,3072,2048,32,32,256,32,4,3,2712.7696666666666,3
w13,24,64,6,3072,2048,32,64,256,1,8,3,2712.2893333333336,3
w13,24,64,6,3072,2048,64,32,256,1,4,3,2703.714,3
w13,24,64,6,3072,2048,64,32,256,1,8,3,2702.818,3
w13,24,64,6,3584,1536,16,16,256,1,4,3,2352.947,3
w13,24,64,6,3584,1536,16,16,256,1,4,4,2373.257,3
w13,24,64,6,3584,1536,16,16,256,1,8,3,2367.9230000000002,3
w13,24,64,6,3584,1536,16,16,256,4,4,3,2354.3016666666667,3
w13,24,64,6,3584,1536,16,16,256,4,8,3,2370.3336666666664,3
w13,24,64,6,3584,1536,16,32,256,1,4,3,2359.1976666666665,3
w13,24,64,6,3584,1536,16,32,256,1,4,4,2373.085333333334,3
w13,24,64,6,3584,1536,16,32,256,1,8,3,2366.1200000000003,3
w13,24,64,6,3584,1536,16,32,256,16,4,3,2364.7019999999998,3
w13,24,64,6,3584,1536,16,32,256,16,8,3,2371.0273333333334,3
w13,24,64,6,3584,1536,16,32,256,32,4,3,2370.057,3
w13,24,64,6,3584,1536,16,64,256,1,4,3,2363.218666666667,3
w13,24,64,6,3584,1536,16,64,256,1,8,3,2368.5946666666664,3
w13,24,64,6,3584,1536,16,64,256,16,4,3,2366.835333333333,3
w13,24,64,6,3584,1536,16,64,256,16,8,3,2373.1290000000004,3
w13,24,64,6,3584,1536,16,64,256,32,4,3,2371.741666666667,3
w13,24,64,6,3584,1536,32,32,256,1,4,3,2350.0353333333333,3
w13,24,64,6,3584,1536,32,32,256,1,8,3,2356.531333333333,3
w13,24,64,6,3584,1536,32,32,256,4,4,3,2355.592666666667,3
w13,24,64,6,3584,1536,32,32,256,4,8,3,2359.656333333333,3
w13,24,64,6,3584,1536,32,32,256,16,4,3,2362.6650000000004,3
w13,24,64,6,3584,1536,32,32,256,16,8,3,2367.9016666666666,3
w13,24,64,6,3584,1536,32,32,256,32,4,3,2372.2646666666665,3
w13,24,64,6,3584,1536,64,32,256,1,4,3,2365.9066666666668,3
w13,24,64,6,3584,1536,64,32,256,1,8,3,2373.5766666666664,3
w13,24,64,8,3584,2560,16,16,256,1,4,3,3921.1596666666665,3
w13,24,64,8,3584,2560,16,16,256,1,8,3,3947.8053333333332,3
w13,24,64,8,3584,2560,16,16,256,4,4,3,3925.959666666667,3
w13,24,64,8,3584,2560,16,16,256,4,8,3,3951.708666666667,3
w13,24,64,8,3584,2560,16,32,256,1,4,3,3929.3410000000003,3
w13,24,64,8,3584,2560,16,32,256,1,8,3,3943.8686666666667,3
w13,24,64,8,3584,2560,16,32,256,16,4,3,3939.954333333333,3
w13,24,64,8,3584,2560,16,32,256,32,4,3,3950.5253333333335,3
w13,24,64,8,3584,2560,16,64,256,1,4,3,3934.961333333333,3
w13,24,64,8,3584,2560,16,64,256,1,8,3,3948.967666666667,3
w13,24,64,8,3584,2560,16,64,256,16,4,3,3944.4449999999997,3
w13,24,64,8,3584,2560,32,32,256,1,4,3,3912.3269999999998,3
w13,24,64,8,3584,2560,32,32,256,1,8,3,3916.924333333333,3
w13,24,64,8,3584,2560,32,32,256,4,4,3,3921.415333333333,3
w13,24,64,8,3584,2560,32,32,256,4,8,3,3923.4526666666666,3
w13,24,64,8,3584,2560,32,32,256,16,4,3,3932.0713333333333,3
w13,24,64,8,3584,2560,32,32,256,16,8,3,3939.5066666666667,3
w13,24,64,8,3584,2560,64,32,256,1,4,3,3937.2763333333332,3
w13,24,64,8,3584,2560,64,32,256,1,8,3,3936.124333333333,3
w13,24,128,4,2048,512,16,16,256,1,4,3,676.1806666666666,3
w13,24,128,4,2048,512,16,16,256,1,4,4,677.354,3
w13,24,128,4,2048,512,16,16,256,1,8,3,679.4979999999999,3
w13,24,128,4,2048,512,16,16,256,1,8,4,678.5383333333334,3
w13,24,128,4,2048,512,16,16,256,4,4,3,677.066,3
w13,24,128,4,2048,512,16,16,256,4,4,4,678.335,3
w13,24,128,4,2048,512,16,16,256,4,8,3,681.172,3
w13,24,128,4,2048,512,16,16,256,4,8,4,680.7673333333333,3
w13,24,128,4,2048,512,16,32,256,1,4,3,677.0013333333333,3
w13,24,128,4,2048,512,16,32,256,1,4,4,678.8043333333334,3
w13,24,128,4,2048,512,16,32,256,1,8,3,677.546,3
w13,24,128,4,2048,512,16,32,256,1,8,4,678.3993333333333,3
w13,24,128,4,2048,512,16,32,256,16,4,3,677.1193333333333,3
w13,24,128,4,2048,512,16,32,256,16,4,4,679.5403333333334,3
w13,24,128,4,2048,512,16,32,256,16,8,3,678.5486666666666,3
w13,24,128,4,2048,512,16,32,256,16,8,4,679.9783333333334,3
w13,24,128,4,2048,512,16,32,256,32,4,3,678.4629999999999,3
w13,24,128,4,2048,512,16,32,256,32,4,4,680.2233333333334,3
w13,24,128,4,2048,512,16,32,256,32,8,3,679.7216666666667,3
w13,24,128,4,2048,512,16,32,256,32,8,4,680.3403333333333,3
w13,24,128,4,2048,512,16,32,256,64,4,3,679.9136666666667,3
w13,24,128,4,2048,512,16,32,256,64,8,3,681.311,3
w13,24,128,4,2048,512,16,64,256,1,4,3,679.7426666666667,3
w13,24,128,4,2048,512,16,64,256,1,8,3,680.031,3
w13,24,128,4,2048,512,16,64,256,16,4,3,679.9033333333333,3
w13,24,128,4,2048,512,16,64,256,16,8,3,680.4573333333333,3
w13,24,128,4,2048,512,16,64,256,32,4,3,681.3433333333334,3
w13,24,128,4,2048,512,16,64,256,32,8,3,681.7696666666667,3
w13,24,128,4,2048,512,16,64,256,64,4,3,682.8580000000001,3
w13,24,128,4,2048,512,32,32,256,1,4,3,677.9833333333332,3
w13,24,128,4,2048,512,32,32,256,1,4,4,679.7853333333334,3
w13,24,128,4,2048,512,32,32,256,1,8,3,677.7379999999999,3
w13,24,128,4,2048,512,32,32,256,1,8,4,681.0443333333334,3
w13,24,128,4,2048,512,32,32,256,4,4,3,679.0390000000001,3
w13,24,128,4,2048,512,32,32,256,4,4,4,681.1723333333333,3
w13,24,128,4,2048,512,32,32,256,4,8,3,678.7836666666666,3
w13,24,128,4,2048,512,32,32,256,4,8,4,682.4313333333333,3
w13,24,128,4,2048,512,32,32,256,16,4,3,678.4313333333333,3
w13,24,128,4,2048,512,32,32,256,16,4,4,681.343,3
w13,24,128,4,2048,512,32,32,256,16,8,3,679.1463333333332,3
w13,24,128,4,2048,512,32,32,256,16,8,4,681.7593333333333,3
w13,24,128,4,2048,512,32,32,256,32,4,3,679.4123333333333,3
w13,24,128,4,2048,512,32,32,256,32,4,4,681.4816666666667,3
w13,24,128,4,2048,512,32,32,256,32,8,3,679.9986666666666,3
w13,24,128,4,2048,512,32,32,256,32,8,4,682.623,3
w13,24,128,4,2048,512,32,64,256,1,8,3,681.6416666666667,3
w13,24,128,4,2048,512,32,64,256,8,8,3,681.2473333333334,3
w13,24,128,4,2048,512,32,64,256,16,8,3,682.1113333333334,3
w13,24,128,4,2048,512,64,32,256,1,4,3,682.367,3
w13,24,128,4,2048,512,64,32,256,1,8,3,681.8233333333334,3
w13,24,128,6,4096,2048,16,16,256,1,4,3,7167.030666666667,3
w13,24,128,6,4096,2048,16,16,256,1,4,4,7192.449666666667,3
w13,24,128,6,4096,2048,16,16,256,1,8,3,7191.8206666666665,3
w13,24,128,6,4096,2048,16,16,256,1,8,4,7201.708666666666,3
w13,24,128,6,4096,2048,16,16,256,4,4,3,7165.153666666668,3
w13,24,128,6,4096,2048,16,16,256,4,4,4,7194.018333333333,3
w13,24,128,6,4096,2048,16,16,256,4,8,3,7188.599333333333,3
w13,24,128,6,4096,2048,16,16,256,4,8,4,7203.415333333333,3
w13,24,128,6,4096,2048,16,32,256,1,4,3,7180.684666666667,3
w13,24,128,6,4096,2048,16,32,256,1,4,4,7199.308666666667,3
w13,24,128,6,4096,2048,16,32,256,1,8,3,7191.0103333333345,3
w13,24,128,6,4096,2048,16,32,256,1,8,4,7201.655666666667,3
w13,24,128,6,4096,2048,16,32,256,16,4,3,7180.8876666666665,3
w13,24,128,6,4096,2048,16,32,256,16,4,4,7211.874333333333,3
w13,24,128,6,4096,2048,16,32,256,16,8,3,7193.036666666667,3
w13,24,128,6,4096,2048,16,32,256,16,8,4,7215.074666666667,3
w13,24,128,6,4096,2048,16,32,256,32,4,3,7192.461,3
w13,24,128,6,4096,2048,16,32,256,32,8,3,7205.698333333333,3
w13,24,128,6,4096,2048,16,32,256,64,4,3,7221.549333333333,3
w13,24,128,6,4096,2048,16,32,256,64,8,3,7233.656,3
w13,24,128,6,4096,2048,16,64,256,1,4,3,7190.9783333333335,3
w13,24,128,6,4096,2048,16,64,256,1,8,3,7198.114333333334,3
w13,24,128,6,4096,2048,16,64,256,16,4,3,7200.3966666666665,3
w13,24,128,6,4096,2048,16,64,256,16,8,3,7207.874333333333,3
w13,24,128,6,4096,2048,16,64,256,32,4,3,7211.693333333334,3
w13,24,128,6,4096,2048,16,64,256,32,8,3,7219.159666666666,3
w13,24,128,6,4096,2048,16,64,256,64,4,3,7218.049666666667,3
w13,24,128,6,4096,2048,16,64,256,64,8,3,7226.2,3
w13,24,128,6,4096,2048,32,32,256,1,4,3,7174.637333333333,3
w13,24,128,6,4096,2048,32,32,256,1,4,4,7200.899333333334,3
w13,24,128,6,4096,2048,32,32,256,1,8,3,7184.717333333334,3
w13,24,128,6,4096,2048,32,32,256,1,8,4,7205.613333333334,3
w13,24,128,6,4096,2048,32,32,256,4,4,3,7178.925666666667,3
w13,24,128,6,4096,2048,32,32,256,4,4,4,7203.459,3
w13,24,128,6,4096,2048,32,32,256,4,8,3,7189.101333333333,3
w13,24,128,6,4096,2048,32,32,256,4,8,4,7208.174,3
w13,24,128,6,4096,2048,32,32,256,16,4,3,7193.666666666667,3
w13,24,128,6,4096,2048,32,32,256,16,4,4,7214.627,3
w13,24,128,6,4096,2048,32,32,256,16,8,3,7203.843,3
w13,24,128,6,4096,2048,32,32,256,16,8,4,7219.437666666668,3
w13,24,128,6,4096,2048,32,32,256,32,4,3,7210.978999999999,3
w13,24,128,6,4096,2048,32,32,256,32,8,3,7216.024333333334,3
w13,24,128,6,4096,2048,32,64,256,1,4,3,7211.522666666667,3
w13,24,128,6,4096,2048,32,64,256,1,8,3,7207.277333333334,3
w13,24,128,6,4096,2048,32,64,256,8,4,3,7216.472333333334,3
w13,24,128,6,4096,2048,32,64,256,8,8,3,7212.866999999999,3
w13,24,128,6,4096,2048,32,64,256,16,4,3,7222.946666666667,3
w13,24,128,6,4096,2048,32,64,256,16,8,3,7219.501333333334,3
w13,24,128,6,4096,2048,32,64,256,32,4,3,7235.789666666667,3
w13,24,128,6,4096,2048,32,64,256,32,8,3,7231.128,3
w13,24,128,6,4096,2048,32,64,256,64,8,3,7236.759999999999,3
w13,24,128,6,4096,2048,64,32,256,1,4,3,7208.558,3
w13,24,128,6,4096,2048,64,32,256,1,8,3,7207.907333333334,3
w13,24,128,8,2048,768,16,16,256,1,4,3,1347.8916666666667,3
w13,24,128,8,2048,768,16,16,256,1,4,4,1352.2333333333333,3
w13,24,128,8,2048,768,16,16,256,1,8,3,1353.0653333333335,3
w13,24,128,8,2048,768,16,16,256,1,8,4,1354.7076666666665,3
w13,24,128,8,2048,768,16,16,256,4,4,3,1348.1476666666667,3
w13,24,128,8,2048,768,16,16,256,4,4,4,1352.457,3
w13,24,128,8,2048,768,16,16,256,4,8,3,1353.4916666666666,3
w13,24,128,8,2048,768,16,16,256,4,8,4,1355.658,3
w13,24,128,8,2048,768,16,32,256,1,4,3,1350.1323333333332,3
w13,24,128,8,2048,768,16,32,256,1,4,4,1352.009,3
w13,24,128,8,2048,768,16,32,256,1,8,3,1351.9346666666668,3
w13,24,128,8,2048,768,16,32,256,1,8,4,1353.2356666666667,3
w13,24,128,8,2048,768,16,32,256,16,4,3,1350.5796666666668,3
w13,24,128,8,2048,768,16,32,256,16,4,4,1356.1263333333334,3
w13,24,128,8,2048,768,16,32,256,16,8,3,1352.9903333333334,3
w13,24,128,8,2048,768,16,32,256,16,8,4,1356.745,3
w13,24,128,8,2048,768,16,32,256,32,4,3,1351.8596666666665,3
w13,24,128,8,2048,768,16,32,256,32,4,4,1356.2969999999998,3
w13,24,128,8,2048,768,16,32,256,32,8,3,1354.964,3
w13,24,128,8,2048,768,16,32,256,32,8,4,1357.8756666666666,3
w13,24,128,8,2048,768,16,32,256,64,4,3,1355.9669999999999,3
w13,24,128,8,2048,768,16,32,256,64,8,3,1359.8709999999999,3
w13,24,128,8,2048,768,16,64,256,1,4,3,1354.1853333333333,3
w13,24,128,8,2048,768,16,64,256,1,8,3,1354.9956666666667,3
w13,24,128,8,2048,768,16,64,256,16,4,3,1355.9773333333333,3
w13,24,128,8,2048,768,16,64,256,16,8,3,1357.4816666666668,3
w13,24,128,8,2048,768,16,64,256,32,4,3,1357.6306666666667,3
w13,24,128,8,2048,768,16,64,256,32,8,3,1358.825,3
w13,24,128,8,2048,768,16,64,256,64,4,3,1361.4279999999999,3
w13,24,128,8,2048,768,32,32,256,1,4,3,1348.8836666666666,3
w13,24,128,8,2048,768,32,32,256,1,4,4,1353.8010000000002,3
w13,24,128,8,2048,768,32,32,256,1,8,3,1349.9183333333333,3
w13,24,128,8,2048,768,32,32,256,1,8,4,1356.3613333333333,3
w13,24,128,8,2048,768,32,32,256,4,4,3,1351.3796666666667,3
w13,24,128,8,2048,768,32,32,256,4,4,4,1355.242,3
w13,24,128,8,2048,768,32,32,256,4,8,3,1352.244,3
w13,24,128,8,2048,768,32,32,256,4,8,4,1357.3536666666666,3
w13,24,128,8,2048,768,32,32,256,16,4,3,1353.993,3
w13,24,128,8,2048,768,32,32,256,16,4,4,1358.281,3
w13,24,128,8,2048,768,32,32,256,16,8,3,1354.911,3
w13,24,128,8,2048,768,32,32,256,16,8,4,1360.3076666666668,3
w13,24,128,8,2048,768,32,32,256,32,4,3,1354.7183333333332,3
w13,24,128,8,2048,768,32,32,256,32,4,4,1358.6546666666666,3
w13,24,128,8,2048,768,32,32,256,32,8,3,1357.1503333333333,3
w13,24,128,8,2048,768,32,32,256,32,8,4,1360.5216666666668,3
w13,24,128,8,2048,768,32,64,256,1,4,3,1359.6996666666666,3
w13,24,128,8,2048,768,32,64,256,1,8,3,1357.0436666666667,3
w13,24,128,8,2048,768,32,64,256,8,4,3,1360.617,3
w13,24,128,8,2048,768,32,64,256,8,8,3,1359.1246666666666,3
w13,24,128,8,2048,768,32,64,256,16,4,3,1361.2786666666668,3
w13,24,128,8,2048,768,32,64,256,16,8,3,1359.4543333333334,3
w13,24,128,8,2048,768,64,32,256,1,4,3,1357.737,3
w13,24,128,8,2048,768,64,32,256,1,8,3,1354.7079999999999,3
w13,24,128,8,4096,1536,16,16,256,1,4,3,5375.991999999999,3
w13,24,128,8,4096,1536,16,16,256,1,4,4,5397.560333333334,3
w13,24,128,8,4096,1536,16,16,256,1,8,3,5395.449,3
w13,24,128,8,4096,1536,16,16,256,1,8,4,5406.264666666667,3
w13,24,128,8,4096,1536,16,16,256,4,4,3,5379.7373333333335,3
w13,24,128,8,4096,1536,16,16,256,4,4,4,5402.19,3
w13,24,128,8,4096,1536,16,16,256,4,8,3,5398.233,3
w13,24,128,8,4096,1536,16,16,256,4,8,4,5409.0273333333325,3
w13,24,128,8,4096,1536,16,32,256,1,4,3,5387.683666666667,3
w13,24,128,8,4096,1536,16,32,256,1,4,4,5401.668000000001,3
w13,24,128,8,4096,1536,16,32,256,1,8,3,5397.784666666666,3
w13,24,128,8,4096,1536,16,32,256,1,8,4,5404.824666666666,3
w13,24,128,8,4096,1536,16,32,256,16,4,3,5389.486000000001,3
w13,24,128,8,4096,1536,16,32,256,16,4,4,5411.331666666667,3
w13,24,128,8,4096,1536,16,32,256,16,8,3,5399.086333333334,3
w13,24,128,8,4096,1536,16,32,256,16,8,4,5415.833,3
w13,24,128,8,4096,1536,16,32,256,32,4,3,5396.835666666667,3
w13,24,128,8,4096,1536,16,32,256,32,4,4,5425.763333333333,3
w13,24,128,8,4096,1536,16,32,256,32,8,3,5406.841,3
w13,24,128,8,4096,1536,16,32,256,32,8,4,5428.878,3
w13,24,128,8,4096,1536,16,32,256,64,4,3,5417.6140000000005,3
w13,24,128,8,4096,1536,16,32,256,64,8,3,5427.012,3
w13,24,128,8,4096,1536,16,64,256,1,4,3,5397.678333333333,3
w13,24,128,8,4096,1536,16,64,256,1,8,3,5402.798,3
w13,24,128,8,4096,1536,16,64,256,16,4,3,5403.384666666666,3
w13,24,128,8,4096,1536,16,64,256,16,8,3,5409.3476666666675,3
w13,24,128,8,4096,1536,16,64,256,32,4,3,5409.870333333333,3
w13,24,128,8,4096,1536,16,64,256,32,8,3,5416.643666666667,3
w13,24,128,8,4096,1536,16,64,256,64,4,3,5418.841,3
w13,24,128,8,4096,1536,16,64,256,64,8,3,5426.766666666667,3
w13,24,128,8,4096,1536,32,32,256,1,4,3,5385.977,3
w13,24,128,8,4096,1536,32,32,256,1,4,4,5404.313666666667,3
w13,24,128,8,4096,1536,32,32,256,1,8,3,5391.631,3
w13,24,128,8,4096,1536,32,32,256,1,8,4,5408.2063333333335,3
w13,24,128,8,4096,1536,32,32,256,4,4,3,5390.905,3
w13,24,128,8,4096,1536,32,32,256,4,4,4,5408.910666666667,3
w13,24,128,8,4096,1536,32,32,256,4,8,3,5395.406,3
w13,24,128,8,4096,1536,32,32,256,4,8,4,5413.668000000001,3
w13,24,128,8,4096,1536,32,32,256,16,4,3,5398.638666666667,3
w13,24,128,8,4096,1536,32,32,256,16,4,4,5415.321,3
w13,24,128,8,4096,1536,32,32,256,16,8,3,5402.617333333334,3
w13,24,128,8,4096,1536,32,32,256,16,8,4,5420.537333333334,3
w13,24,128,8,4096,1536,32,32,256,32,4,3,5412.046333333334,3
w13,24,128,8,4096,1536,32,32,256,32,4,4,5429.071,3
w13,24,128,8,4096,1536,32,32,256,32,8,3,5413.177333333333,3
w13,24,128,8,4096,1536,32,64,256,1,4,3,5414.553,3
w13,24,128,8,4096,1536,32,64,256,1,8,3,5410.756333333334,3
w13,24,128,8,4096,1536,32,64,256,8,4,3,5416.899333333334,3
w13,24,128,8,4096,1536,32,64,256,8,8,3,5412.761333333333,3
w13,24,128,8,4096,1536,32,64,256,16,4,3,5420.462666666667,3
w13,24,128,8,4096,1536,32,64,256,16,8,3,5417.337333333333,3
w13,24,128,8,4096,1536,32,64,256,32,4,3,5429.049333333333,3
w13,24,128,8,4096,1536,32,64,256,32,8,3,5425.848666666668,3
w13,24,128,8,4096,1536,64,32,256,1,4,3,5410.543333333333,3
w13,24,128,8,4096,1536,64,32,256,1,8,3,5409.305333333333,3
w13,24,128,8,4096,3072,16,16,256,1,4,3,10749.111666666668,3
w13,24,128,8,4096,3072,16,16,256,1,4,4,10790.252333333334,3
w13,24,128,8,4096,3072,16,16,256,1,8,3,10782.839999999998,3
w13,24,128,8,4096,3072,16,16,256,1,8,4,10802.584333333332,3
w13,24,128,8,4096,3072,16,16,256,4,4,3,10755.788999999999,3
w13,24,128,8,4096,3072,16,16,256,4,4,4,10797.815666666667,3
w13,24,128,8,4096,3072,16,16,256,4,8,3,10789.613,3
w13,24,128,8,4096,3072,16,16,256,4,8,4,10810.883000000002,3
w13,24,128,8,4096,3072,16,32,256,1,4,3,10767.138666666668,3
w13,24,128,8,4096,3072,16,32,256,1,4,4,10797.837333333335,3
w13,24,128,8,4096,3072,16,32,256,1,8,3,10784.386333333334,3
w13,24,128,8,4096,3072,16,32,256,1,8,4,10803.394333333332,3
w13,24,128,8,4096,3072,16,32,256,16,4,3,10772.205,3
w13,24,128,8,4096,3072,16,32,256,16,4,4,10814.455666666667,3
w13,24,128,8,4096,3072,16,32,256,16,8,3,10790.381,3
w13,24,128,8,4096,3072,16,32,256,16,8,4,10821.88,3
w13,24,128,8,4096,3072,16,32,256,32,4,3,10787.106333333333,3
w13,24,128,8,4096,3072,16,32,256,32,4,4,10847.245666666668,3
w13,24,128,8,4096,3072,16,32,256,32,8,3,10806.359999999999,3
w13,24,128,8,4096,3072,16,32,256,32,8,4,10851.437333333333,3
w13,24,128,8,4096,3072,16,32,256,64,4,3,10836.909666666666,3
w13,24,128,8,4096,3072,16,64,256,1,4,3,10787.191333333334,3
w13,24,128,8,4096,3072,16,64,256,1,8,3,10795.362000000001,3
w13,24,128,8,4096,3072,16,64,256,16,4,3,10799.672,3
w13,24,128,8,4096,3072,16,64,256,16,8,3,10810.349,3
w13,24,128,8,4096,3072,16,64,256,32,4,3,10815.682,3
w13,24,128,8,4096,3072,16,64,256,32,8,3,10830.210000000001,3
w13,24,128,8,4096,3072,16,64,256,64,4,3,10824.706666666667,3
w13,24,128,8,4096,3072,16,64,256,64,8,3,10839.606999999998,3
w13,24,128,8,4096,3072,32,32,256,1,4,3,10759.980333333333,3
w13,24,128,8,4096,3072,32,32,256,1,4,4,10801.067666666668,3
w13,24,128,8,4096,3072,32,32,256,1,8,3,10768.855333333333,3
w13,24,128,8,4096,3072,32,32,256,1,8,4,10809.527333333332,3
w13,24,128,8,4096,3072,32,32,256,4,4,3,10770.497666666664,3
w13,24,128,8,4096,3072,32,32,256,4,4,4,10810.444666666668,3
w13,24,128,8,4096,3072,32,32,256,4,8,3,10777.815,3
w13,24,128,8,4096,3072,32,32,256,4,8,4,10817.601666666667,3
w13,24,128,8,4096,3072,32,32,256,16,4,3,10786.274,3
w13,24,128,8,4096,3072,32,32,256,16,4,4,10820.620333333334,3
w13,24,128,8,4096,3072,32,32,256,16,8,3,10797.004666666666,3
w13,24,128,8,4096,3072,32,32,256,16,8,4,10828.919,3
w13,24,128,8,4096,3072,32,32,256,32,4,3,10824.599,3
w13,24,128,8,4096,3072,32,32,256,32,4,4,10853.100666666667,3
w13,24,128,8,4096,3072,32,32,256,32,8,3,10829.57,3
w13,24,128,8,4096,3072,32,64,256,1,4,3,10817.931333333334,3
w13,24,128,8,4096,3072,32,64,256,1,8,3,10810.380333333333,3
w13,24,128,8,4096,3072,32,64,256,8,4,3,10826.081666666667,3
w13,24,128,8,4096,3072,32,64,256,8,8,3,10819.916333333333,3
w13,24,128,8,4096,3072,32,64,256,16,4,3,10831.798333333334,3
w13,24,128,8,4096,3072,32,64,256,16,8,3,10825.569666666668,3
w13,24,128,8,4096,3072,32,64,256,32,4,3,10851.670333333333,3
w13,24,128,8,4096,3072,32,64,256,32,8,3,10845.1,3
w13,24,128,8,4096,3072,32,64,256,64,8,3,10854.475666666667,3
w13,24,128,8,4096,3072,64,32,256,1,4,3,10800.565666666667,3
w13,24,128,8,4096,3072,64,32,256,1,8,3,10794.272666666666,3
w13,32,8,2,1024,512,16,16,128,4,4,2,32.364666666666665,3
w13,32,8,2,1024,512,16,16,256,4,4,2,32.312000000000005,3
w13,32,8,2,1024,512,16,32,128,1,4,2,32.343333333333334,3
w13,32,8,2,1024,512,16,32,128,4,4,2,32.18366666666667,3
w13,32,8,2,1024,512,16,32,128,4,8,2,32.40766666666667,3
w13,32,8,2,1024,512,16,32,128,16,4,2,32.08733333333333,3
w13,32,8,2,1024,512,16,32,128,32,4,2,32.290333333333336,3
w13,32,8,2,1024,512,16,32,128,32,8,2,32.344,3
w13,32,8,2,1024,512,16,32,128,64,4,2,32.258,3
w13,32,8,2,1024,512,16,32,128,64,8,2,32.37533333333334,3
w13,32,8,2,1024,512,16,64,128,16,8,2,32.343333333333334,3
w13,32,8,2,1024,512,16,64,128,32,8,2,32.397,3
w13,32,8,2,1024,512,16,64,128,64,8,2,32.39666666666667,3
w13,32,8,2,1024,512,32,32,128,16,4,2,32.344,3
w13,32,8,2,1024,512,32,32,128,64,4,2,32.31166666666667,3
w13,32,16,2,1536,768,16,16,128,4,4,4,133.08033333333333,3
w13,32,16,2,1536,768,16,16,256,1,4,3,131.96033333333332,3
w13,32,16,2,1536,768,16,16,256,4,4,3,131.90666666666667,3
w13,32,16,2,1536,768,16,16,256,4,4,4,133.13366666666664,3
w13,32,16,2,1536,768,16,32,128,1,4,2,133.21866666666668,3
w13,32,16,2,1536,768,16,32,128,1,4,3,133.22966666666667,3
w13,32,16,2,1536,768,16,32,128,4,4,4,133.18666666666667,3
w13,32,16,2,1536,768,16,32,256,1,4,3,132.952,3
w13,32,16,2,1536,768,16,32,256,1,8,3,133.02700000000002,3
w13,32,16,4,1536,1024,16,16,128,1,4,2,177.091,3
w13,32,16,4,1536,1024,16,16,128,4,4,2,177.1336666666667,3
w13,32,16,4,1536,1024,16,16,256,1,4,3,175.45899999999997,3
w13,32,16,4,1536,1024,16,16,256,1,4,4,176.55766666666668,3
w13,32,16,4,1536,1024,16,16,256,4,4,3,175.36266666666666,3
w13,32,16,4,1536,1024,16,32,128,4,4,4,177.00566666666666,3
w13,32,16,4,1536,1024,16,32,256,1,4,3,176.23733333333334,3
w13,32,16,4,1536,1024,16,32,256,1,8,3,176.40833333333333,3
w13,32,16,4,1536,1024,16,32,256,16,4,3,177.12299999999996,3
w13,32,16,4,1536,1024,16,32,256,32,4,3,176.96266666666665,3
w13,32,16,4,1536,1024,16,32,256,64,4,3,176.984,3
w13,32,16,4,1536,1024,16,32,256,64,8,3,177.08,3
w13,32,16,4,1536,1024,32,32,256,1,8,3,177.02633333333333,3
w13,32,16,4,1536,1024,32,32,256,16,4,3,176.46166666666667,3
w13,32,16,4,1536,1024,32,32,256,16,8,3,176.55733333333333,3
w13,32,16,4,1536,1024,32,32,256,32,4,3,176.46133333333333,3
w13,32,16,4,1536,1024,32,32,256,32,8,3,176.49333333333334,3
w13,32,32,4,2048,768,16,16,256,1,4,3,342.4256666666667,3
w13,32,32,4,2048,768,16,16,256,1,4,4,344.30266666666665,3
w13,32,32,4,2048,768,16,16,256,1,8,3,345.5506666666667,3
w13,32,32,4,2048,768,16,16,256,4,4,3,342.372,3
w13,32,32,4,2048,768,16,16,256,4,4,4,344.59066666666666,3
w13,32,32,4,2048,768,16,16,256,4,8,3,345.4866666666667,3
w13,32,32,4,2048,768,16,32,256,1,4,3,343.5353333333333,3
w13,32,32,4,2048,768,16,32,256,1,4,4,344.5373333333334,3
w13,32,32,4,2048,768,16,32,256,1,8,3,344.11066666666665,3
w13,32,32,4,2048,768,16,32,256,1,8,4,344.1746666666666,3
w13,32,32,4,2048,768,16,32,256,16,4,3,344.0466666666666,3
w13,32,32,4,2048,768,16,32,256,32,4,3,345.04999999999995,3
w13,32,32,4,2048,768,16,32,256,64,4,3,345.508,3
w13,32,32,4,2048,768,16,64,256,1,4,3,345.7753333333333,3
w13,32,32,4,2048,768,16,64,256,1,8,3,345.0173333333333,3
w13,32,32,4,2048,768,32,32,256,1,4,3,343.87600000000003,3
w13,32,32,4,2048,768,32,32,256,1,8,3,344.86899999999997,3
w13,32,32,4,2048,768,32,32,256,4,4,3,344.6656666666667,3
w13,32,32,4,2048,768,32,32,256,4,8,3,344.86833333333334,3
w13,32,32,6,3072,1024,16,16,256,1,4,3,681.04,3
w13,32,32,6,3072,1024,16,16,256,1,4,4,687.1516666666666,3
w13,32,32,6,3072,1024,16,16,256,1,8,3,686.192,3
w13,32,32,6,3072,1024,16,16,256,4,4,3,681.9996666666667,3
w13,32,32,6,3072,1024,16,32,256,1,4,3,683.0563333333333,3
w13,32,32,6,3072,1024,16,32,256,1,8,3,686.7256666666667,3
w13,32,32,6,3072,1024,16,32,256,16,4,3,684.9756666666667,3
w13,32,32,6,3072,1024,16,64,256,1,4,3,685.062,3
w13,32,32,6,3072,1024,16,64,256,1,8,3,685.808,3
w13,32,32,6,3072,1024,16,64,256,16,4,3,685.552,3
w13,32,32,6,3072,1024,16,64,256,16,8,3,687.1946666666668,3
w13,32,32,6,3072,1024,32,32,256,1,4,3,681.477,3
w13,32,32,6,3072,1024,32,32,256,1,8,3,682.661,3
w13,32,32,6,3072,1024,32,32,256,4,4,3,683.1093333333333,3
w13,32,32,6,3072,1024,32,32,256,4,8,3,683.6003333333333,3
w13,32,32,6,3072,1024,32,32,256,16,4,3,686.8326666666666,3
w13,32,32,6,3072,1024,64,32,256,1,8,3,687.2049999999999,3
w13,32,60,4,2048,1408,16,16,256,1,4,3,1160.4716666666666,3
w13,32,60,4,2048,1408,16,16,256,1,4,4,1165.1646666666668,3
w13,32,60,4,2048,1408,16,16,256,1,8,3,1166.0926666666667,3
w13,32,60,4,2048,1408,16,16,256,1,8,4,1167.6933333333334,3
w13,32,60,4,2048,1408,16,16,256,4,4,3,1161.058,3
w13,32,60,4,2048,1408,16,16,256,4,4,4,1165.186,3
w13,32,60,4,2048,1408,16,16,256,4,8,3,1165.207,3
w13,32,60,4,2048,1408,16,16,256,4,8,4,1167.3406666666667,3
w13,32,60,4,2048,1408,16,32,256,1,4,3,1162.8076666666666,3
w13,32,60,4,2048,1408,16,32,256,1,4,4,1164.7703333333334,3
w13,32,60,4,2048,1408,16,32,256,1,8,3,1164.8663333333332,3
w13,32,60,4,2048,1408,16,32,256,1,8,4,1165.442,3
w13,32,60,4,2048,1408,16,32,256,16,4,3,1162.37,3
w13,32,60,4,2048,1408,16,32,256,16,4,4,1167.6499999999999,3
w13,32,60,4,2048,1408,16,32,256,16,8,3,1164.6746666666666,3
w13,32,60,4,2048,1408,16,32,256,16,8,4,1169.432,3
w13,32,60,4,2048,1408,16,32,256,32,4,3,1165.6660000000002,3
w13,32,60,4,2048,1408,16,32,256,32,4,4,1168.877,3
w13,32,60,4,2048,1408,16,32,256,32,8,3,1167.7356666666667,3
w13,32,60,4,2048,1408,16,32,256,32,8,4,1170.4446666666665,3
w13,32,60,4,2048,1408,16,64,256,1,4,3,1166.1779999999999,3
w13,32,60,4,2048,1408,16,64,256,1,8,3,1166.7966666666666,3
w13,32,60,4,2048,1408,16,64,256,16,4,3,1168.0446666666667,3
w13,32,60,4,2048,1408,16,64,256,16,8,3,1169.4103333333333,3
w13,32,60,4,2048,1408,16,64,256,32,4,3,1171.2126666666666,3
w13,32,60,4,2048,1408,32,32,256,1,4,3,1162.701,3
w13,32,60,4,2048,1408,32,32,256,1,4,4,1166.21,3
w13,32,60,4,2048,1408,32,32,256,1,8,3,1163.8316666666667,3
w13,32,60,4,2048,1408,32,32,256,1,8,4,1168.13,3
w13,32,60,4,2048,1408,32,32,256,4,4,3,1164.365,3
w13,32,60,4,2048,1408,32,32,256,4,4,4,1167.9276666666667,3
w13,32,60,4,2048,1408,32,32,256,4,8,3,1164.781,3
w13,32,60,4,2048,1408,32,32,256,4,8,4,1169.8153333333332,3
w13,32,60,4,2048,1408,32,32,256,16,4,3,1165.741,3
w13,32,60,4,2048,1408,32,32,256,16,4,4,1169.7836666666665,3
w13,32,60,4,2048,1408,32,32,256,16,8,3,1167.5326666666667,3
w13,32,60,4,2048,1408,32,32,256,16,8,4,1171.064,3
w13,32,60,4,2048,1408,32,32,256,32,4,3,1168.5140000000001,3
w13,32,60,4,2048,1408,32,32,256,32,4,4,1171.0953333333334,3
w13,32,60,4,2048,1408,32,32,256,32,8,3,1168.8126666666667,3
w13,32,60,4,2048,1408,32,64,256,1,4,3,1171.6606666666667,3
w13,32,60,4,2048,1408,32,64,256,1,8,3,1168.941,3
w13,32,60,4,2048,1408,32,64,256,8,8,3,1169.9646666666667,3
w13,32,60,4,2048,1408,32,64,256,16,8,3,1171.1063333333334,3
w13,32,60,4,2048,1408,64,32,256,1,4,3,1169.1646666666666,3
w13,32,60,4,2048,1408,64,32,256,1,8,3,1169.037,3
w13,32,60,6,3584,2304,16,16,256,1,4,3,3310.4126666666666,3
w13,32,60,6,3584,2304,16,16,256,1,8,3,3334.893,3
w13,32,60,6,3584,2304,16,16,256,4,4,3,3312.727666666667,3
w13,32,60,6,3584,2304,16,32,256,1,4,3,3318.786,3
w13,32,60,6,3584,2304,16,32,256,1,8,3,3330.5723333333335,3
w13,32,60,6,3584,2304,16,32,256,16,4,3,3329.0903333333335,3
w13,32,60,6,3584,2304,16,64,256,1,4,3,3323.0736666666667,3
w13,32,60,6,3584,2304,16,64,256,1,8,3,3334.0713333333333,3
w13,32,60,6,3584,2304,16,64,256,16,4,3,3332.492666666667,3
w13,32,60,6,3584,2304,32,32,256,1,4,3,3304.023333333333,3
w13,32,60,6,3584,2304,32,32,256,1,8,3,3307.884666666667,3
w13,32,60,6,3584,2304,32,32,256,4,4,3,3311.0956666666666,3
w13,32,60,6,3584,2304,32,32,256,4,8,3,3313.996333333333,3
w13,32,60,6,3584,2304,32,32,256,16,4,3,3324.919,3
w13,32,60,6,3584,2304,32,32,256,16,8,3,3329.8153333333335,3
w13,32,60,6,3584,2304,64,32,256,1,4,3,3326.6263333333336,3
w13,32,60,6,3584,2304,64,32,256,1,8,3,3325.6343333333334,3
w13,32,60,8,2048,1536,16,16,256,1,4,3,1268.9643333333333,3
w13,32,60,8,2048,1536,16,16,256,1,4,4,1274.9263333333336,3
w13,32,60,8,2048,1536,16,16,256,1,8,3,1274.031,3
w13,32,60,8,2048,1536,16,16,256,1,8,4,1277.5726666666667,3
w13,32,60,8,2048,1536,16,16,256,4,4,3,1270.053,3
w13,32,60,8,2048,1536,16,16,256,4,4,4,1276.1216666666667,3
w13,32,60,8,2048,1536,16,16,256,4,8,3,1277.2843333333333,3
w13,32,60,8,2048,1536,16,16,256,4,8,4,1279.4496666666666,3
w13,32,60,8,2048,1536,16,32,256,1,4,3,1271.7803333333334,3
w13,32,60,8,2048,1536,16,32,256,1,4,4,1274.2446666666667,3
w13,32,60,8,2048,1536,16,32,256,1,8,3,1274.1803333333335,3
w13,32,60,8,2048,1536,16,32,256,1,8,4,1275.354,3
w13,32,60,8,2048,1536,16,32,256,16,4,3,1273.2096666666666,3
w13,32,60,8,2048,1536,16,32,256,16,4,4,1280.2076666666667,3
w13,32,60,8,2048,1536,16,32,256,16,8,3,1276.2073333333335,3
w13,32,60,8,2048,1536,16,32,256,16,8,4,1281.6363333333336,3
w13,32,60,8,2048,1536,16,32,256,32,4,3,1275.9403333333332,3
w13,32,60,8,2048,1536,16,32,256,32,8,3,1278.9379999999999,3
w13,32,60,8,2048,1536,16,64,256,1,4,3,1275.8549999999998,3
w13,32,60,8,2048,1536,16,64,256,1,8,3,1276.9113333333335,3
w13,32,60,8,2048,1536,16,64,256,16,4,3,1279.5463333333335,3
w13,32,60,8,2048,1536,16,64,256,16,8,3,1280.2713333333334,3
w13,32,60,8,2048,1536,32,32,256,1,4,3,1270.1376666666667,3
w13,32,60,8,2048,1536,32,32,256,1,4,4,1276.9750000000001,3
w13,32,60,8,2048,1536,32,32,256,1,8,3,1271.8663333333334,3
w13,32,60,8,2048,1536,32,32,256,1,8,4,1277.8066666666666,3
w13,32,60,8,2048,1536,32,32,256,4,4,3,1275.1933333333334,3
w13,32,60,8,2048,1536,32,32,256,4,4,4,1279.4183333333333,3
w13,32,60,8,2048,1536,32,32,256,4,8,3,1275.738,3
w13,32,60,8,2048,1536,32,32,256,4,8,4,1280.2073333333335,3
w13,32,60,8,2048,1536,32,32,256,16,4,3,1278.1909999999998,3
w13,32,60,8,2048,1536,32,32,256,16,8,3,1279.588,3
w13,32,60,8,2048,1536,32,32,256,32,4,3,1281.6789999999999,3
w13,32,60,8,2048,1536,32,64,256,1,4,3,1281.54,3
w13,32,60,8,2048,1536,32,64,256,1,8,3,1279.0663333333334,3
w13,32,60,8,2048,1536,64,32,256,1,4,3,1278.0206666666666,3
w13,32,60,8,2048,1536,64,32,256,1,8,3,1277.114,3
w13,32,64,6,3072,2048,16,16,256,1,4,3,2691.3726666666666,3
w13,32,64,6,3072,2048,16,16,256,1,4,4,2716.076,3
w13,32,64,6,3072,2048,16,16,256,1,8,3,2708.087,3
w13,32,64,6,3072,2048,16,16,256,4,4,3,2690.7646666666665,3
w13,32,64,6,3072,2048,16,16,256,4,8,3,2706.9990000000003,3
w13,32,64,6,3072,2048,16,32,256,1,4,3,2698.6786666666667,3
w13,32,64,6,3072,2048,16,32,256,1,8,3,2706.018,3
w13,32,64,6,3072,2048,16,32,256,16,4,3,2705.8683333333333,3
w13,32,64,6,3072,2048,16,32,256,16,8,3,2711.564,3
w13,32,64,6,3072,2048,16,32,256,32,4,3,2715.767,3
w13,32,64,6,3072,2048,16,64,256,1,4,3,2700.8653333333336,3
w13,32,64,6,3072,2048,16,64,256,1,8,3,2706.4333333333334,3
w13,32,64,6,3072,2048,16,64,256,16,4,3,2709.0356666666667,3
w13,32,64,6,3072,2048,16,64,256,16,8,3,2714.508,3
w13,32,64,6,3072,2048,32,32,256,1,4,3,2691.3300000000004,3
w13,32,64,6,3072,2048,32,32,256,1,8,3,2696.0443333333333,3
w13,32,64,6,3072,2048,32,32,256,4,4,3,2695.0626666666667,3
w13,32,64,6,3072,2048,32,32,256,4,8,3,2697.3456666666666,3
w13,32,64,6,3072,2048,32,32,256,16,4,3,2706.2096666666666,3
w13,32,64,6,3072,2048,32,32,256,16,8,3,2713.036,3
w13,32,64,6,3072,2048,32,64,256,1,8,3,2715.1913333333337,3
w13,32,64,6,3072,2048,64,32,256,1,4,3,2706.849666666667,3
w13,32,64,6,3072,2048,64,32,256,1,8,3,2705.836333333333,3
w13,32,64,6,3584,1536,16,16,256,1,4,3,2355.4649999999997,3
w13,32,64,6,3584,1536,16,16,256,1,4,4,2375.5280000000002,3
w13,32,64,6,3584,1536,16,16,256,1,8,3,2372.0723333333335,3
w13,32,64,6,3584,1536,16,16,256,4,4,3,2356.2863333333335,3
w13,32,64,6,3584,1536,16,16,256,4,4,4,2378.280333333333,3
w13,32,64,6,3584,1536,16,16,256,4,8,3,2372.072,3
w13,32,64,6,3584,1536,16,32,256,1,4,3,2361.907333333333,3
w13,32,64,6,3584,1536,16,32,256,1,4,4,2376.574,3
w13,32,64,6,3584,1536,16,32,256,1,8,3,2368.915,3
w13,32,64,6,3584,1536,16,32,256,1,8,4,2377.235666666667,3
w13,32,64,6,3584,1536,16,32,256,16,4,3,2369.1493333333333,3
w13,32,64,6,3584,1536,16,32,256,16,8,3,2375.6566666666663,3
w13,32,64,6,3584,1536,16,32,256,32,4,3,2377.0433333333335,3
w13,32,64,6,3584,1536,16,64,256,1,4,3,2366.0996666666665,3
w13,32,64,6,3584,1536,16,64,256,1,8,3,2371.8700000000003,3
w13,32,64,6,3584,1536,16,64,256,16,4,3,2373.0323333333336,3
w13,32,64,6,3584,1536,32,32,256,1,4,3,2354.8246666666664,3
w13,32,64,6,3584,1536,32,32,256,1,8,3,2360.7653333333333,3
w13,32,64,6,3584,1536,32,32,256,1,8,4,2378.4513333333334,3
w13,32,64,6,3584,1536,32,32,256,4,4,3,2359.4756666666667,3
w13,32,64,6,3584,1536,32,32,256,4,8,3,2363.1766666666667,3
w13,32,64,6,3584,1536,32,32,256,16,4,3,2369.470333333333,3
w13,32,64,6,3584,1536,32,32,256,16,8,3,2373.48,3
w13,32,64,6,3584,1536,64,32,256,1,4,3,2371.0266666666666,3
w13,32,64,6,3584,1536,64,32,256,1,8,3,2376.7653333333333,3
w13,32,64,8,3584,2560,16,16,256,1,4,3,3925.745666666667,3
w13,32,64,8,3584,2560,16,16,256,1,8,3,3952.860666666667,3
w13,32,64,8,3584,2560,16,16,256,4,4,3,3930.7810000000004,3
w13,32,64,8,3584,2560,16,32,256,1,4,3,3935.997,3
w13,32,64,8,3584,2560,16,32,256,1,8,3,3949.7246666666665,3
w13,32,64,8,3584,2560,16,32,256,16,4,3,3947.6013333333335,3
w13,32,64,8,3584,2560,16,64,256,1,4,3,3942.1836666666663,3
w13,32,64,8,3584,2560,16,64,256,1,8,3,3953.2870000000003,3
w13,32,64,8,3584,2560,16,64,256,16,4,3,3952.4656666666665,3
w13,32,64,8,3584,2560,32,32,256,1,4,3,3918.023333333333,3
w13,32,64,8,3584,2560,32,32,256,1,8,3,3922.6096666666667,3
w13,32,64,8,3584,2560,32,32,256,4,4,3,3925.201333333333,3
w13,32,64,8,3584,2560,32,32,256,4,8,3,3929.863,3
w13,32,64,8,3584,2560,32,32,256,16,4,3,3940.0606666666667,3
w13,32,64,8,3584,2560,32,32,256,16,8,3,3947.655,3
w13,32,64,8,3584,2560,64,32,256,1,4,3,3942.994,3
w13,32,64,8,3584,2560,64,32,256,1,8,3,3942.6209999999996,3
w13,32,128,4,2048,512,16,16,256,1,4,3,899.8629999999999,3
w13,32,128,4,2048,512,16,16,256,1,4,4,901.5376666666666,3
w13,32,128,4,2048,512,16,16,256,1,8,3,903.415,3
w13,32,128,4,2048,512,16,16,256,1,8,4,903.596,3
w13,32,128,4,2048,512,16,16,256,4,4,3,900.4393333333334,3
w13,32,128,4,2048,512,16,16,256,4,4,4,902.3376666666667,3
w13,32,128,4,2048,512,16,16,256,4,8,3,905.5373333333333,3
w13,32,128,4,2048,512,16,16,256,4,8,4,904.7373333333334,3
w13,32,128,4,2048,512,16,32,256,1,4,3,900.3533333333334,3
w13,32,128,4,2048,512,16,32,256,1,4,4,901.6129999999999,3
w13,32,128,4,2048,512,16,32,256,1,8,3,902.1773333333334,3
w13,32,128,4,2048,512,16,32,256,1,8,4,902.7426666666667,3
w13,32,128,4,2048,512,16,32,256,16,4,3,900.8656666666667,3
w13,32,128,4,2048,512,16,32,256,16,4,4,903.4789999999999,3
w13,32,128,4,2048,512,16,32,256,16,8,3,903.351,3
w13,32,128,4,2048,512,16,32,256,16,8,4,905.1753333333332,3
w13,32,128,4,2048,512,16,32,256,32,4,3,902.2206666666666,3
w13,32,128,4,2048,512,16,32,256,32,4,4,904.4283333333333,3
w13,32,128,4,2048,512,16,32,256,32,8,3,904.0763333333334,3
w13,32,128,4,2048,512,16,32,256,32,8,4,905.0683333333333,3
w13,32,128,4,2048,512,16,32,256,64,4,3,906.0813333333332,3
w13,32,128,4,2048,512,16,32,256,64,8,3,907.5859999999999,3
w13,32,128,4,2048,512,16,64,256,1,4,3,904.418,3
w13,32,128,4,2048,512,16,64,256,1,8,3,904.6846666666667,3
w13,32,128,4,2048,512,16,64,256,16,4,3,905.4200000000001,3
w13,32,128,4,2048,512,16,64,256,16,8,3,905.4519999999999,3
w13,32,128,4,2048,512,16,64,256,32,4,3,905.9319999999999,3
w13,32,128,4,2048,512,16,64,256,32,8,3,906.37,3
w13,32,128,4,2048,512,16,64,256,64,4,3,908.7379999999999,3
w13,32,128,4,2048,512,32,32,256,1,4,3,900.3533333333334,3
w13,32,128,4,2048,512,32,32,256,1,4,4,903.884,3
w13,32,128,4,2048,512,32,32,256,1,8,3,901.6766666666667,3
w13,32,128,4,2048,512,32,32,256,1,8,4,905.1,3
w13,32,128,4,2048,512,32,32,256,4,4,3,902.9346666666667,3
w13,32,128,4,2048,512,32,32,256,4,4,4,905.623,3
w13,32,128,4,2048,512,32,32,256,4,8,3,903.159,3
w13,32,128,4,2048,512,32,32,256,4,8,4,907.2983333333333,3
w13,32,128,4,2048,512,32,32,256,16,4,3,902.6370000000001,3
w13,32,128,4,2048,512,32,32,256,16,4,4,905.773,3
w13,32,128,4,2048,512,32,32,256,16,8,3,903.628,3
w13,32,128,4,2048,512,32,32,256,16,8,4,906.7433333333333,3
w13,32,128,4,2048,512,32,32,256,32,4,3,904.1730000000001,3
w13,32,128,4,2048,512,32,32,256,32,4,4,905.89,3
w13,32,128,4,2048,512,32,32,256,32,8,3,904.6416666666665,3
w13,32,128,4,2048,512,32,32,256,32,8,4,907.543,3
w13,32,128,4,2048,512,32,64,256,1,4,3,908.7593333333334,3
w13,32,128,4,2048,512,32,64,256,1,8,3,906.6146666666667,3
w13,32,128,4,2048,512,32,64,256,8,4,3,908.5783333333333,3
w13,32,128,4,2048,512,32,64,256,8,8,3,906.7109999999999,3
w13,32,128,4,2048,512,32,64,256,16,4,3,908.7483333333333,3
w13,32,128,4,2048,512,32,64,256,16,8,3,907.6496666666667,3
w13,32,128,4,2048,512,32,64,256,32,8,3,908.4286666666667,3
w13,32,128,4,2048,512,64,32,256,1,4,3,906.6576666666666,3
w13,32,128,4,2048,512,64,32,256,1,8,3,904.9933333333333,3
w13,32,128,6,4096,2048,16,16,256,1,4,3,7168.473000000001,3
w13,32,128,6,4096,2048,16,16,256,1,4,4,7195.011666666666,3
w13,32,128,6,4096,2048,16,16,256,1,8,3,7195.790666666668,3
w13,32,128,6,4096,2048,16,16,256,1,8,4,7205.603999999999,3
w13,32,128,6,4096,2048,16,16,256,4,4,3,7167.566333333333,3
w13,32,128,6,4096,2048,16,16,256,4,4,4,7196.793666666667,3
w13,32,128,6,4096,2048,16,16,256,4,8,3,7192.7609999999995,3
w13,32,128,6,4096,2048,16,16,256,4,8,4,7207.481333333334,3
w13,32,128,6,4096,2048,16,32,256,1,4,3,7182.467666666666,3
w13,32,128,6,4096,2048,16,32,256,1,4,4,7200.867666666668,3
w13,32,128,6,4096,2048,16,32,256,1,8,3,7191.961666666667,3
w13,32,128,6,4096,2048,16,32,256,1,8,4,7204.728999999999,3
w13,32,128,6,4096,2048,16,32,256,16,4,3,7185.657333333333,3
w13,32,128,6,4096,2048,16,32,256,16,4,4,7219.684,3
w13,32,128,6,4096,2048,16,32,256,16,8,3,7198.222666666666,3
w13,32,128,6,4096,2048,16,32,256,16,8,4,7225.412333333334,3
w13,32,128,6,4096,2048,16,32,256,32,4,3,7202.531666666667,3
w13,32,128,6,4096,2048,16,32,256,32,8,3,7215.246666666667,3
w13,32,128,6,4096,2048,16,32,256,64,4,3,7233.518666666667,3
w13,32,128,6,4096,2048,16,64,256,1,4,3,7194.436333333334,3
w13,32,128,6,4096,2048,16,64,256,1,8,3,7199.577,3
w13,32,128,6,4096,2048,16,64,256,16,4,3,7205.785333333333,3
w13,32,128,6,4096,2048,16,64,256,16,8,3,7214.745,3
w13,32,128,6,4096,2048,16,64,256,32,4,3,7219.310333333334,3
w13,32,128,6,4096,2048,16,64,256,32,8,3,7226.980333333333,3
w13,32,128,6,4096,2048,16,64,256,64,4,3,7228.355666666666,3
w13,32,128,6,4096,2048,16,64,256,64,8,3,7236.2390000000005,3
w13,32,128,6,4096,2048,32,32,256,1,4,3,7177.646333333333,3
w13,32,128,6,4096,2048,32,32,256,1,4,4,7204.782666666666,3
w13,32,128,6,4096,2048,32,32,256,1,8,3,7186.649333333334,3
w13,32,128,6,4096,2048,32,32,256,1,8,4,7209.454666666667,3
w13,32,128,6,4096,2048,32,32,256,4,4,3,7182.126666666667,3
w13,32,128,6,4096,2048,32,32,256,4,4,4,7208.5053333333335,3
w13,32,128,6,4096,2048,32,32,256,4,8,3,7195.043666666666,3
w13,32,128,6,4096,2048,32,32,256,4,8,4,7211.897333333333,3
w13,32,128,6,4096,2048,32,32,256,16,4,3,7202.147666666667,3
w13,32,128,6,4096,2048,32,32,256,16,4,4,7224.111,3
w13,32,128,6,4096,2048,32,32,256,16,8,3,7208.398666666667,3
w13,32,128,6,4096,2048,32,32,256,16,8,4,7228.484333333334,3
w13,32,128,6,4096,2048,32,32,256,32,4,3,7221.839,3
w13,32,128,6,4096,2048,32,32,256,32,8,3,7227.310666666667,3
w13,32,128,6,4096,2048,32,64,256,1,4,3,7215.523666666667,3
w13,32,128,6,4096,2048,32,64,256,1,8,3,7210.169666666666,3
w13,32,128,6,4096,2048,32,64,256,8,4,3,7222.1050000000005,3
w13,32,128,6,4096,2048,32,64,256,8,8,3,7219.225333333333,3
w13,32,128,6,4096,2048,32,64,256,16,4,3,7229.412333333334,3
w13,32,128,6,4096,2048,32,64,256,16,8,3,7225.977666666667,3
w13,32,128,6,4096,2048,64,32,256,1,4,3,7209.230666666666,3
w13,32,128,6,4096,2048,64,32,256,1,8,3,7212.131666666667,3
w13,32,128,8,2048,768,16,16,256,1,4,3,1348.4786666666666,3
w13,32,128,8,2048,768,16,16,256,1,4,4,1353.9716666666666,3
w13,32,128,8,2048,768,16,16,256,1,8,3,1353.898,3
w13,32,128,8,2048,768,16,16,256,1,8,4,1355.273,3
w13,32,128,8,2048,768,16,16,256,4,4,3,1349.588,3
w13,32,128,8,2048,768,16,16,256,4,4,4,1354.26,3
w13,32,128,8,2048,768,16,16,256,4,8,3,1354.8676666666665,3
w13,32,128,8,2048,768,16,16,256,4,8,4,1357.343,3
w13,32,128,8,2048,768,16,32,256,1,4,3,1351.0706666666667,3
w13,32,128,8,2048,768,16,32,256,1,4,4,1353.7053333333333,3
w13,32,128,8,2048,768,16,32,256,1,8,3,1352.8196666666665,3
w13,32,128,8,2048,768,16,32,256,1,8,4,1354.751,3
w13,32,128,8,2048,768,16,32,256,16,4,3,1351.8066666666666,3
w13,32,128,8,2048,768,16,32,256,16,4,4,1358.6009999999999,3
w13,32,128,8,2048,768,16,32,256,16,8,3,1353.8653333333334,3
w13,32,128,8,2048,768,16,32,256,16,8,4,1359.198333333333,3
w13,32,128,8,2048,768,16,32,256,32,4,3,1353.9400000000003,3
w13,32,128,8,2048,768,16,32,256,32,4,4,1359.1663333333333,3
w13,32,128,8,2048,768,16,32,256,32,8,3,1356.5743333333332,3
w13,32,128,8,2048,768,16,32,256,32,8,4,1360.937,3
w13,32,128,8,2048,768,16,32,256,64,4,3,1359.593,3
w13,32,128,8,2048,768,16,64,256,1,4,3,1355.5503333333334,3
w13,32,128,8,2048,768,16,64,256,1,8,3,1356.5103333333334,3
w13,32,128,8,2048,768,16,64,256,16,4,3,1358.0356666666667,3
w13,32,128,8,2048,768,16,64,256,16,8,3,1359.561,3
w13,32,128,8,2048,768,16,64,256,32,4,3,1359.8279999999997,3
w13,32,128,8,2048,768,16,64,256,32,8,3,1361.0866666666668,3
w13,32,128,8,2048,768,32,32,256,1,4,3,1351.1983333333333,3
w13,32,128,8,2048,768,32,32,256,1,4,4,1356.5426666666667,3
w13,32,128,8,2048,768,32,32,256,1,8,3,1351.679,3
w13,32,128,8,2048,768,32,32,256,1,8,4,1358.313,3
w13,32,128,8,2048,768,32,32,256,4,4,3,1353.577,3
w13,32,128,8,2048,768,32,32,256,4,4,4,1357.332666666667,3
w13,32,128,8,2048,768,32,32,256,4,8,3,1353.6943333333334,3
w13,32,128,8,2048,768,32,32,256,4,8,4,1359.6996666666666,3
w13,32,128,8,2048,768,32,32,256,16,4,3,1356.4143333333334,3
w13,32,128,8,2048,768,32,32,256,16,4,4,1360.7876666666668,3
w13,32,128,8,2048,768,32,32,256,16,8,3,1357.5876666666666,3
w13,32,128,8,2048,768,32,32,256,32,4,3,1358.2169999999999,3
w13,32,128,8,2048,768,32,32,256,32,4,4,1361.2893333333334,3
w13,32,128,8,2048,768,32,32,256,32,8,3,1361.5666666666666,3
w13,32,128,8,2048,768,32,64,256,1,4,3,1361.268,3
w13,32,128,8,2048,768,32,64,256,1,8,3,1358.8999999999999,3
w13,32,128,8,2048,768,32,64,256,8,8,3,1360.969,3
w13,32,128,8,2048,768,32,64,256,16,8,3,1361.6943333333331,3
w13,32,128,8,2048,768,64,32,256,1,4,3,1357.9076666666667,3
w13,32,128,8,2048,768,64,32,256,1,8,3,1356.7243333333333,3
w13,32,128,8,4096,1536,16,16,256,1,4,3,5380.5053333333335,3
w13,32,128,8,4096,1536,16,16,256,1,4,4,5401.572,3
w13,32,128,8,4096,1536,16,16,256,1,8,3,5399.3859999999995,3
w13,32,128,8,4096,1536,16,16,256,1,8,4,5408.665666666667,3
w13,32,128,8,4096,1536,16,16,256,4,4,3,5382.958666666666,3
w13,32,128,8,4096,1536,16,16,256,4,4,4,5406.244,3
w13,32,128,8,4096,1536,16,16,256,4,8,3,5402.874,3
w13,32,128,8,4096,1536,16,16,256,4,8,4,5413.85,3
w13,32,128,8,4096,1536,16,32,256,1,4,3,5389.422666666666,3
w13,32,128,8,4096,1536,16,32,256,1,4,4,5405.177333333333,3
w13,32,128,8,4096,1536,16,32,256,1,8,3,5397.946,3
w13,32,128,8,4096,1536,16,32,256,1,8,4,5408.6123333333335,3
w13,32,128,8,4096,1536,16,32,256,16,4,3,5391.748666666666,3
w13,32,128,8,4096,1536,16,32,256,16,4,4,5417.551,3
w13,32,128,8,4096,1536,16,32,256,16,8,3,5402.586,3
w13,32,128,8,4096,1536,16,32,256,16,8,4,5422.414666666667,3
w13,32,128,8,4096,1536,16,32,256,32,4,3,5402.425333333333,3
w13,32,128,8,4096,1536,16,32,256,32,8,3,5411.258,3
w13,32,128,8,4096,1536,16,32,256,64,4,3,5430.873666666666,3
w13,32,128,8,4096,1536,16,64,256,1,4,3,5400.399,3
w13,32,128,8,4096,1536,16,64,256,1,8,3,5405.358666666667,3
w13,32,128,8,4096,1536,16,64,256,16,4,3,5406.190666666666,3
w13,32,128,8,4096,1536,16,64,256,16,8,3,5412.366999999999,3
w13,32,128,8,4096,1536,16,64,256,32,4,3,5417.700333333333,3
w13,32,128,8,4096,1536,16,64,256,32,8,3,5423.822666666667,3
w13,32,128,8,4096,1536,16,64,256,64,4,3,5427.119,3
w13,32,128,8,4096,1536,16,64,256,64,8,3,5432.516333333333,3
w13,32,128,8,4096,1536,32,32,256,1,4,3,5390.073333333334,3
w13,32,128,8,4096,1536,32,32,256,1,4,4,5408.175333333333,3
w13,32,128,8,4096,1536,32,32,256,1,8,3,5395.3,3
w13,32,128,8,4096,1536,32,32,256,1,8,4,5411.087333333333,3
w13,32,128,8,4096,1536,32,32,256,4,4,3,5396.441333333333,3
w13,32,128,8,4096,1536,32,32,256,4,4,4,5412.750666666667,3
w13,32,128,8,4096,1536,32,32,256,4,8,3,5399.907999999999,3
w13,32,128,8,4096,1536,32,32,256,4,8,4,5416.878333333334,3
w13,32,128,8,4096,1536,32,32,256,16,4,3,5403.961333333333,3
w13,32,128,8,4096,1536,32,32,256,16,4,4,5420.025333333334,3
w13,32,128,8,4096,1536,32,32,256,16,8,3,5408.569333333333,3
w13,32,128,8,4096,1536,32,32,256,16,8,4,5426.414666666667,3
w13,32,128,8,4096,1536,32,32,256,32,4,3,5423.183333333333,3
w13,32,128,8,4096,1536,32,32,256,32,8,3,5427.289333333333,3
w13,32,128,8,4096,1536,32,64,256,1,4,3,5418.799,3
w13,32,128,8,4096,1536,32,64,256,1,8,3,5412.249666666667,3
w13,32,128,8,4096,1536,32,64,256,8,4,3,5420.388666666667,3
w13,32,128,8,4096,1536,32,64,256,8,8,3,5415.812666666667,3
w13,32,128,8,4096,1536,32,64,256,16,4,3,5425.199333333333,3
w13,32,128,8,4096,1536,32,64,256,16,8,3,5420.772666666667,3
w13,32,128,8,4096,1536,32,64,256,32,8,3,5432.484333333334,3
w13,32,128,8,4096,1536,64,32,256,1,4,3,5414.169666666667,3
w13,32,128,8,4096,1536,64,32,256,1,8,3,5413.295000000001,3
w13,32,128,8,4096,3072,16,16,256,1,4,3,10753.098666666667,3
w13,32,128,8,4096,3072,16,16,256,1,4,4,10796.63,3
w13,32,128,8,4096,3072,16,16,256,1,8,3,10788.021666666667,3
w13,32,128,8,4096,3072,16,16,256,1,8,4,10809.814,3
w13,32,128,8,4096,3072,16,16,256,4,4,3,10762.603000000001,3
w13,32,128,8,4096,3072,16,16,256,4,4,4,10807.488333333333,3
w13,32,128,8,4096,3072,16,16,256,4,8,3,10797.856000000002,3
w13,32,128,8,4096,3072,16,16,256,4,8,4,10822.890666666668,3
w13,32,128,8,4096,3072,16,32,256,1,4,3,10770.730333333333,3
w13,32,128,8,4096,3072,16,32,256,1,4,4,10802.24,3
w13,32,128,8,4096,3072,16,32,256,1,8,3,10788.053,3
w13,32,128,8,4096,3072,16,32,256,1,8,4,10809.716999999999,3
w13,32,128,8,4096,3072,16,32,256,16,4,3,10778.292666666666,3
w13,32,128,8,4096,3072,16,32,256,16,4,4,10824.746333333334,3
w13,32,128,8,4096,3072,16,32,256,16,8,3,10797.450333333332,3
w13,32,128,8,4096,3072,16,32,256,16,8,4,10831.690333333334,3
w13,32,128,8,4096,3072,16,32,256,32,4,3,10795.679666666665,3
w13,32,128,8,4096,3072,16,32,256,32,8,3,10816.469,3
w13,32,128,8,4096,3072,16,64,256,1,4,3,10791.669,3
w13,32,128,8,4096,3072,16,64,256,1,8,3,10803.445333333333,3
w13,32,128,8,4096,3072,16,64,256,16,4,3,10808.010666666667,3
w13,32,128,8,4096,3072,16,64,256,16,8,3,10819.572333333332,3
w13,32,128,8,4096,3072,16,64,256,32,4,3,10832.49,3
w13,32,128,8,4096,3072,16,64,256,32,8,3,10846.197,3
w13,32,128,8,4096,3072,16,64,256,64,4,3,10840.394333333332,3
w13,32,128,8,4096,3072,16,64,256,64,8,3,10856.650666666666,3
w13,32,128,8,4096,3072,32,32,256,1,4,3,10766.697,3
w13,32,128,8,4096,3072,32,32,256,1,4,4,10807.529333333332,3
w13,32,128,8,4096,3072,32,32,256,1,8,3,10776.595333333333,3
w13,32,128,8,4096,3072,32,32,256,1,8,4,10814.26,3
w13,32,128,8,4096,3072,32,32,256,4,4,3,10780.510666666667,3
w13,32,128,8,4096,3072,32,32,256,4,4,4,10819.347333333333,3
w13,32,128,8,4096,3072,32,32,256,4,8,3,10786.867333333334,3
w13,32,128,8,4096,3072,32,32,256,4,8,4,10826.42,3
w13,32,128,8,4096,3072,32,32,256,16,4,3,10798.483999999999,3
w13,32,128,8,4096,3072,32,32,256,16,4,4,10831.763666666666,3
w13,32,128,8,4096,3072,32,32,256,16,8,3,10809.598333333333,3
w13,32,128,8,4096,3072,32,32,256,16,8,4,10838.409333333333,3
w13,32,128,8,4096,3072,32,32,256,32,4,3,10853.065,3
w13,32,128,8,4096,3072,32,32,256,32,8,3,10852.532,3
w13,32,128,8,4096,3072,32,64,256,1,4,3,10825.364,3
w13,32,128,8,4096,3072,32,64,256,1,8,3,10816.809333333333,3
w13,32,128,8,4096,3072,32,64,256,8,4,3,10835.571666666665,3
w13,32,128,8,4096,3072,32,64,256,8,8,3,10829.428,3
w13,32,128,8,4096,3072,32,64,256,16,4,3,10844.393333333333,3
w13,32,128,8,4096,3072,32,64,256,16,8,3,10836.307333333332,3
w13,32,128,8,4096,3072,64,32,256,1,4,3,10807.912666666665,3
w13,32,128,8,4096,3072,64,32,256,1,8,3,10802.995333333332,3
w13,48,8,2,1024,512,16,16,128,1,4,2,32.74933333333333,3
w13,48,8,2,1024,512,16,16,128,4,4,2,32.62166666666666,3
w13,48,8,2,1024,512,16,16,128,4,4,4,32.67466666666667,3
w13,48,8,2,1024,512,16,16,256,4,4,2,32.53566666666667,3
w13,48,8,2,1024,512,16,32,128,1,4,2,32.706,3
w13,48,8,2,1024,512,16,32,128,4,4,2,32.556666666666665,3
w13,48,8,2,1024,512,16,32,128,4,8,2,32.684666666666665,3
w13,48,8,2,1024,512,16,32,128,16,4,2,32.43933333333333,3
w13,48,8,2,1024,512,16,32,128,16,8,2,32.71666666666666,3
w13,48,8,2,1024,512,16,32,128,32,4,2,32.556666666666665,3
w13,48,8,2,1024,512,16,32,128,32,8,2,32.535999999999994,3
w13,48,8,2,1024,512,16,32,128,64,4,2,32.429,3
w13,48,8,2,1024,512,16,32,128,64,8,2,32.631,3
w13,48,8,2,1024,512,16,64,128,1,8,2,32.69533333333333,3
w13,48,8,2,1024,512,16,64,128,16,8,2,32.685,3
w13,48,8,2,1024,512,16,64,128,32,8,2,32.663000000000004,3
w13,48,8,2,1024,512,16,64,128,64,8,2,32.49366666666666,3
w13,48,8,2,1024,512,32,32,128,4,4,2,32.653333333333336,3
w13,48,8,2,1024,512,32,32,128,4,8,2,32.695666666666675,3
w13,48,8,2,1024,512,32,32,128,16,4,2,32.717333333333336,3
w13,48,8,2,1024,512,32,32,128,16,8,2,32.58866666666667,3
w13,48,8,2,1024,512,32,32,128,64,4,2,32.69533333333334,3
w13,48,8,2,1024,512,32,32,128,64,8,2,32.67433333333333,3
w13,48,8,2,1024,512,32,64,128,16,8,2,32.65266666666667,3
w13,48,16,2,1536,768,16,16,128,1,4,2,133.549,3
w13,48,16,2,1536,768,16,16,128,1,4,4,133.51766666666668,3
w13,48,16,2,1536,768,16,16,128,4,4,4,133.62433333333334,3
w13,48,16,2,1536,768,16,16,256,1,4,3,132.30166666666668,3
w13,48,16,2,1536,768,16,16,256,4,4,3,132.97366666666667,3
w13,48,16,2,1536,768,16,16,256,4,4,4,133.58133333333333,3
w13,48,16,2,1536,768,16,32,128,1,4,2,133.46433333333334,3
w13,48,16,2,1536,768,16,32,128,1,4,3,133.61333333333334,3
w13,48,16,2,1536,768,16,32,128,4,4,2,133.368,3
w13,48,16,2,1536,768,16,32,256,1,4,3,133.02666666666667,3
w13,48,16,2,1536,768,16,32,256,1,8,3,133.52800000000002,3
w13,48,16,4,1536,1024,16,16,256,1,4,3,177.08033333333333,3
w13,48,16,4,1536,1024,16,16,256,1,4,4,177.74166666666667,3
w13,48,16,4,1536,1024,16,16,256,4,4,3,176.024,3
w13,48,16,4,1536,1024,16,32,256,1,4,3,177.65633333333335,3
w13,48,16,4,1536,1024,16,32,256,1,8,3,177.62433333333334,3
w13,48,16,4,1536,1024,32,32,256,16,4,3,177.731,3
w13,48,16,4,1536,1024,32,32,256,32,4,3,177.69899999999998,3
w13,48,32,4,2048,768,16,16,256,1,4,3,343.9506666666666,3
w13,48,32,4,2048,768,16,16,256,1,4,4,345.061,3
w13,48,32,4,2048,768,16,16,256,1,8,3,344.94266666666664,3
w13,48,32,4,2048,768,16,16,256,1,8,4,346.7033333333333,3
w13,48,32,4,2048,768,16,16,256,4,4,3,343.2573333333333,3
w13,48,32,4,2048,768,16,16,256,4,4,4,345.0926666666667,3
w13,48,32,4,2048,768,16,32,256,1,4,3,344.815,3
w13,48,32,4,2048,768,16,32,256,1,4,4,346.308,3
w13,48,32,4,2048,768,16,32,256,1,8,3,345.412,3
w13,48,32,4,2048,768,16,32,256,1,8,4,346.25500000000005,3
w13,48,32,4,2048,768,16,32,256,16,4,3,345.84933333333333,3
w13,48,32,4,2048,768,16,32,256,16,8,3,346.436,3
w13,48,32,4,2048,768,16,64,256,1,8,3,346.1693333333333,3
w13,48,32,4,2048,768,32,32,256,1,4,3,345.594,3
w13,48,32,4,2048,768,32,32,256,1,8,3,345.85999999999996,3
w13,48,32,4,2048,768,32,32,256,4,4,3,346.24500000000006,3
w13,48,32,4,2048,768,32,32,256,4,8,3,345.8286666666666,3
w13,48,32,6,3072,1024,16,16,256,1,4,3,683.1516666666666,3
w13,48,32,6,3072,1024,16,16,256,1,4,4,689.541,3
w13,48,32,6,3072,1024,16,16,256,1,8,3,688.7730000000001,3
w13,48,32,6,3072,1024,16,16,256,4,4,3,683.2263333333334,3
w13,48,32,6,3072,1024,16,32,256,1,4,3,685.701,3
w13,48,32,6,3072,1024,16,32,256,1,8,3,689.1463333333332,3
w13,48,32,6,3072,1024,16,32,256,16,4,3,688.2510000000001,3
w13,48,32,6,3072,1024,16,64,256,1,4,3,687.878,3
w13,48,32,6,3072,1024,16,64,256,1,8,3,688.7736666666666,3
w13,48,32,6,3072,1024,16,64,256,16,4,3,688.4963333333332,3
w13,48,32,6,3072,1024,16,64,256,16,8,3,689.8403333333332,3
w13,48,32,6,3072,1024,32,32,256,1,4,3,683.696,3
w13,48,32,6,3072,1024,32,32,256,1,8,3,685.1256666666667,3
w13,48,32,6,3072,1024,32,32,256,4,4,3,686.1283333333334,3
w13,48,32,6,3072,1024,32,32,256,4,8,3,687.1203333333333,3
w13,48,60,4,2048,1408,16,16,256,1,4,3,1162.6153333333334,3
w13,48,60,4,2048,1408,16,16,256,1,4,4,1167.106,3
w13,48,60,4,2048,1408,16,16,256,1,8,3,1167.3626666666667,3
w13,48,60,4,2048,1408,16,16,256,1,8,4,1170.1776666666667,3
w13,48,60,4,2048,1408,16,16,256,4,4,3,1162.9996666666666,3
w13,48,60,4,2048,1408,16,16,256,4,4,4,1167.949,3
w13,48,60,4,2048,1408,16,16,256,4,8,3,1168.9513333333334,3
w13,48,60,4,2048,1408,16,16,256,4,8,4,1171.4473333333335,3
w13,48,60,4,2048,1408,16,32,256,1,4,3,1164.941,3
w13,48,60,4,2048,1408,16,32,256,1,4,4,1166.125,3
w13,48,60,4,2048,1408,16,32,256,1,8,3,1166.7863333333335,3
w13,48,60,4,2048,1408,16,32,256,1,8,4,1167.426,3
w13,48,60,4,2048,1408,16,32,256,16,4,3,1165.3890000000001,3
w13,48,60,4,2048,1408,16,32,256,16,4,4,1171.0310000000002,3
w13,48,60,4,2048,1408,16,32,256,16,8,3,1168.173,3
w13,48,60,4,2048,1408,16,32,256,16,8,4,1172.1193333333333,3
w13,48,60,4,2048,1408,16,32,256,32,4,3,1170.221,3
w13,48,60,4,2048,1408,16,32,256,32,4,4,1173.9543333333334,3
w13,48,60,4,2048,1408,16,32,256,32,8,3,1171.7563333333335,3
w13,48,60,4,2048,1408,16,64,256,1,4,3,1168.8553333333332,3
w13,48,60,4,2048,1408,16,64,256,1,8,3,1168.8343333333332,3
w13,48,60,4,2048,1408,16,64,256,16,4,3,1171.2876666666668,3
w13,48,60,4,2048,1408,16,64,256,16,8,3,1172.6103333333333,3
w13,48,60,4,2048,1408,32,32,256,1,4,3,1164.3226666666667,3
w13,48,60,4,2048,1408,32,32,256,1,4,4,1168.8553333333332,3
w13,48,60,4,2048,1408,32,32,256,1,8,3,1165.9859999999999,3
w13,48,60,4,2048,1408,32,32,256,1,8,4,1170.3600000000001,3
w13,48,60,4,2048,1408,32,32,256,4,4,3,1166.957,3
w13,48,60,4,2048,1408,32,32,256,4,4,4,1171.2663333333333,3
w13,48,60,4,2048,1408,32,32,256,4,8,3,1167.6926666666666,3
w13,48,60,4,2048,1408,32,32,256,4,8,4,1172.1833333333334,3
w13,48,60,4,2048,1408,32,32,256,16,4,3,1169.1333333333332,3
w13,48,60,4,2048,1408,32,32,256,16,4,4,1173.069,3
w13,48,60,4,2048,1408,32,32,256,16,8,3,1170.4023333333332,3
w13,48,60,4,2048,1408,32,32,256,32,4,3,1172.8556666666666,3
w13,48,60,4,2048,1408,32,64,256,1,4,3,1173.848,3
w13,48,60,4,2048,1408,32,64,256,1,8,3,1171.9276666666667,3
w13,48,60,4,2048,1408,32,64,256,8,8,3,1172.8446666666666,3
w13,48,60,4,2048,1408,64,32,256,1,4,3,1171.8533333333332,3
w13,48,60,4,2048,1408,64,32,256,1,8,3,1170.5620000000001,3
w13,48,60,6,3584,2304,16,16,256,1,4,3,3316.322,3
w13,48,60,6,3584,2304,16,16,256,1,8,3,3339.7883333333334,3
w13,48,60,6,3584,2304,16,16,256,4,4,3,3320.7063333333335,3
w13,48,60,6,3584,2304,16,16,256,4,8,3,3343.074,3
w13,48,60,6,3584,2304,16,32,256,1,4,3,3325.4526666666666,3
w13,48,60,6,3584,2304,16,32,256,1,8,3,3335.927333333333,3
w13,48,60,6,3584,2304,16,32,256,16,4,3,3342.391666666667,3
w13,48,60,6,3584,2304,16,64,256,1,4,3,3330.882,3
w13,48,60,6,3584,2304,16,64,256,1,8,3,3339.714,3
w13,48,60,6,3584,2304,16,64,256,16,4,3,3344.034,3
w13,48,60,6,3584,2304,32,32,256,1,4,3,3310.594333333333,3
w13,48,60,6,3584,2304,32,32,256,1,8,3,3315.661,3
w13,48,60,6,3584,2304,32,32,256,4,4,3,3319.9490000000005,3
w13,48,60,6,3584,2304,32,32,256,4,8,3,3324.503666666667,3
w13,48,60,6,3584,2304,32,32,256,16,4,3,3338.6583333333333,3
w13,48,60,6,3584,2304,64,32,256,1,4,3,3332.77,3
w13,48,60,6,3584,2304,64,32,256,1,8,3,3333.3996666666667,3
w13,48,60,8,2048,1536,16,16,256,1,4,3,1272.5166666666667,3
w13,48,60,8,2048,1536,16,16,256,1,4,4,1278.778,3
w13,48,60,8,2048,1536,16,16,256,1,8,3,1279.8973333333333,3
w13,48,60,8,2048,1536,16,16,256,1,8,4,1281.3273333333334,3
w13,48,60,8,2048,1536,16,16,256,4,4,3,1275.1303333333333,3
w13,48,60,8,2048,1536,16,16,256,4,4,4,1281.7756666666667,3
w13,48,60,8,2048,1536,16,16,256,4,8,3,1282.117,3
w13,48,60,8,2048,1536,16,16,256,4,8,4,1284.7406666666666,3
w13,48,60,8,2048,1536,16,32,256,1,4,3,1276.2926666666665,3
w13,48,60,8,2048,1536,16,32,256,1,4,4,1278.778,3
w13,48,60,8,2048,1536,16,32,256,1,8,3,1278.7356666666667,3
w13,48,60,8,2048,1536,16,32,256,1,8,4,1280.698,3
w13,48,60,8,2048,1536,16,32,256,16,4,3,1278.1586666666667,3
w13,48,60,8,2048,1536,16,32,256,16,8,3,1281.2093333333332,3
w13,48,60,8,2048,1536,16,32,256,32,4,3,1281.9666666666665,3
w13,48,60,8,2048,1536,16,64,256,1,4,3,1280.2079999999999,3
w13,48,60,8,2048,1536,16,64,256,1,8,3,1281.8183333333334,3
w13,48,60,8,2048,1536,16,64,256,16,4,3,1284.197,3
w13,48,60,8,2048,1536,32,32,256,1,4,3,1274.469,3
w13,48,60,8,2048,1536,32,32,256,1,4,4,1280.7939999999999,3
w13,48,60,8,2048,1536,32,32,256,1,8,3,1275.6850000000002,3
w13,48,60,8,2048,1536,32,32,256,1,8,4,1282.6076666666668,3
w13,48,60,8,2048,1536,32,32,256,4,4,3,1280.0156666666667,3
w13,48,60,8,2048,1536,32,32,256,4,8,3,1280.9543333333334,3
w13,48,60,8,2048,1536,32,32,256,16,4,3,1284.292666666667,3
w13,48,60,8,2048,1536,32,64,256,1,8,3,1283.6853333333336,3
w13,48,60,8,2048,1536,64,32,256,1,4,3,1283.0553333333335,3
w13,48,60,8,2048,1536,64,32,256,1,8,3,1281.2210000000002,3
w13,48,64,6,3072,2048,16,16,256,1,4,3,2697.078666666667,3
w13,48,64,6,3072,2048,16,16,256,1,4,4,2721.8469999999998,3
w13,48,64,6,3072,2048,16,16,256,1,8,3,2714.1560000000004,3
w13,48,64,6,3072,2048,16,16,256,4,4,3,2697.4199999999996,3
w13,48,64,6,3072,2048,16,16,256,4,8,3,2713.3033333333333,3
w13,48,64,6,3072,2048,16,32,256,1,4,3,2704.9303333333332,3
w13,48,64,6,3072,2048,16,32,256,1,8,3,2712.0123333333336,3
w13,48,64,6,3072,2048,16,32,256,16,4,3,2717.5373333333337,3
w13,48,64,6,3072,2048,16,32,256,16,8,3,2720.076,3
w13,48,64,6,3072,2048,16,64,256,1,4,3,2706.498,3
w13,48,64,6,3072,2048,16,64,256,1,8,3,2711.618,3
w13,48,64,6,3072,2048,16,64,256,16,4,3,2720.3326666666667,3
w13,48,64,6,3072,2048,16,64,256,16,8,3,2722.8496666666665,3
w13,48,64,6,3072,2048,32,32,256,1,4,3,2696.3433333333337,3
w13,48,64,6,3072,2048,32,32,256,1,8,3,2699.3403333333335,3
w13,48,64,6,3072,2048,32,32,256,4,4,3,2702.0603333333333,3
w13,48,64,6,3072,2048,32,32,256,4,8,3,2704.354333333333,3
w13,48,64,6,3072,2048,32,32,256,16,4,3,2720.375,3
w13,48,64,6,3072,2048,32,32,256,16,8,3,2722.668,3
w13,48,64,6,3072,2048,32,64,256,1,8,3,2722.145666666667,3
w13,48,64,6,3072,2048,64,32,256,1,4,3,2711.297666666667,3
w13,48,64,6,3072,2048,64,32,256,1,8,3,2711.6496666666667,3
w13,48,64,6,3584,1536,16,16,256,1,4,3,2359.593,3
w13,48,64,6,3584,1536,16,16,256,1,4,4,2381.170666666667,3
w13,48,64,6,3584,1536,16,16,256,1,8,3,2375.645666666667,3
w13,48,64,6,3584,1536,16,16,256,4,4,3,2361.8113333333336,3
w13,48,64,6,3584,1536,16,16,256,4,8,3,2378.739,3
w13,48,64,6,3584,1536,16,32,256,1,4,3,2365.801,3
w13,48,64,6,3584,1536,16,32,256,1,4,4,2381.15,3
w13,48,64,6,3584,1536,16,32,256,1,8,3,2374.6963333333333,3
w13,48,64,6,3584,1536,16,32,256,16,4,3,2377.374,3
w13,48,64,6,3584,1536,16,64,256,1,4,3,2369.705,3
w13,48,64,6,3584,1536,16,64,256,1,8,3,2376.499333333333,3
w13,48,64,6,3584,1536,16,64,256,16,4,3,2379.357666666667,3
w13,48,64,6,3584,1536,32,32,256,1,4,3,2358.1953333333336,3
w13,48,64,6,3584,1536,32,32,256,1,8,3,2366.8136666666664,3
w13,48,64,6,3584,1536,32,32,256,4,4,3,2364.4776666666667,3
w13,48,64,6,3584,1536,32,32,256,4,8,3,2369.833,3
w13,48,64,6,3584,1536,32,32,256,16,4,3,2378.462333333333,3
w13,48,64,6,3584,1536,64,32,256,1,4,3,2372.478333333333,3
w13,48,64,6,3584,1536,64,32,256,1,8,3,2381.918333333333,3
w13,48,64,8,3584,2560,16,16,256,1,4,3,3935.9643333333333,3
w13,48,64,8,3584,2560,16,16,256,1,8,3,3963.346,3
w13,48,64,8,3584,2560,16,16,256,4,4,3,3943.0046666666663,3
w13,48,64,8,3584,2560,16,32,256,1,4,3,3946.3109999999997,3
w13,48,64,8,3584,2560,16,32,256,1,8,3,3958.5993333333336,3
w13,48,64,8,3584,2560,16,32,256,16,4,3,3960.679,3
w13,48,64,8,3584,2560,16,64,256,1,4,3,3952.050333333334,3
w13,48,64,8,3584,2560,16,64,256,1,8,3,3963.581,3
w13,48,64,8,3584,2560,16,64,256,16,4,3,3963.911666666667,3
w13,48,64,8,3584,2560,32,32,256,1,4,3,3927.794,3
w13,48,64,8,3584,2560,32,32,256,1,8,3,3930.940666666667,3
w13,48,64,8,3584,2560,32,32,256,4,4,3,3938.0333333333333,3
w13,48,64,8,3584,2560,32,32,256,4,8,3,3942.492,3
w13,48,64,8,3584,2560,32,32,256,16,4,3,3956.85,3
w13,48,64,8,3584,2560,32,32,256,16,8,3,3964.605,3
w13,48,64,8,3584,2560,64,32,256,1,4,3,3952.8603333333335,3
w13,48,64,8,3584,2560,64,32,256,1,8,3,3951.2286666666664,3
w13,48,128,4,2048,512,16,16,256,1,4,3,900.9403333333333,3
w13,48,128,4,2048,512,16,16,256,1,4,4,902.359,3
w13,48,128,4,2048,512,16,16,256,1,8,3,903.3303333333333,3
w13,48,128,4,2048,512,16,16,256,1,8,4,905.0263333333332,3
w13,48,128,4,2048,512,16,16,256,4,4,3,901.5166666666668,3
w13,48,128,4,2048,512,16,16,256,4,4,4,903.8633333333333,3
w13,48,128,4,2048,512,16,16,256,4,8,3,905.89,3
w13,48,128,4,2048,512,16,16,256,4,8,4,905.6866666666666,3
w13,48,128,4,2048,512,16,32,256,1,4,3,901.3353333333334,3
w13,48,128,4,2048,512,16,32,256,1,4,4,903.7996666666668,3
w13,48,128,4,2048,512,16,32,256,1,8,3,903.5006666666667,3
w13,48,128,4,2048,512,16,32,256,1,8,4,903.9803333333334,3
w13,48,128,4,2048,512,16,32,256,16,4,3,901.6126666666665,3
w13,48,128,4,2048,512,16,32,256,16,4,4,906.0183333333333,3
w13,48,128,4,2048,512,16,32,256,16,8,3,904.1293333333333,3
w13,48,128,4,2048,512,16,32,256,16,8,4,907.458,3
w13,48,128,4,2048,512,16,32,256,32,4,3,903.7026666666667,3
w13,48,128,4,2048,512,16,32,256,32,4,4,907.6713333333333,3
w13,48,128,4,2048,512,16,32,256,32,8,3,905.73,3
w13,48,128,4,2048,512,16,32,256,32,8,4,907.212,3
w13,48,128,4,2048,512,16,32,256,64,4,3,908.0973333333333,3
w13,48,128,4,2048,512,16,64,256,1,4,3,905.0683333333333,3
w13,48,128,4,2048,512,16,64,256,1,8,3,905.7193333333335,3
w13,48,128,4,2048,512,16,64,256,16,4,3,906.0073333333333,3
w13,48,128,4,2048,512,16,64,256,16,8,3,906.5506666666666,3
w13,48,128,4,2048,512,16,64,256,32,4,3,907.5,3
w13,48,128,4,2048,512,16,64,256,32,8,3,908.4073333333332,3
w13,48,128,4,2048,512,32,32,256,1,4,3,902.1033333333334,3
w13,48,128,4,2048,512,32,32,256,1,4,4,905.5596666666667,3
w13,48,128,4,2048,512,32,32,256,1,8,3,902.3373333333333,3
w13,48,128,4,2048,512,32,32,256,1,8,4,907.0633333333334,3
w13,48,128,4,2048,512,32,32,256,4,4,3,903.5536666666667,3
w13,48,128,4,2048,512,32,32,256,4,4,4,906.9673333333334,3
w13,48,128,4,2048,512,32,32,256,4,8,3,904.1186666666666,3
w13,48,128,4,2048,512,32,32,256,4,8,4,908.3433333333332,3
w13,48,128,4,2048,512,32,32,256,16,4,3,904.1826666666666,3
w13,48,128,4,2048,512,32,32,256,16,4,4,908.3533333333334,3
w13,48,128,4,2048,512,32,32,256,16,8,3,905.9536666666668,3
w13,48,128,4,2048,512,32,32,256,16,8,4,909.3133333333332,3
w13,48,128,4,2048,512,32,32,256,32,4,3,905.4306666666668,3
w13,48,128,4,2048,512,32,32,256,32,4,4,908.2359999999999,3
w13,48,128,4,2048,512,32,32,256,32,8,3,907.5856666666667,3
w13,48,128,4,2048,512,32,32,256,32,8,4,909.3776666666666,3
w13,48,128,4,2048,512,32,64,256,1,4,3,909.5053333333332,3
w13,48,128,4,2048,512,32,64,256,1,8,3,907.074,3
w13,48,128,4,2048,512,32,64,256,8,8,3,907.6283333333332,3
w13,48,128,4,2048,512,32,64,256,16,4,3,909.826,3
w13,48,128,4,2048,512,32,64,256,16,8,3,908.5353333333333,3
w13,48,128,4,2048,512,64,32,256,1,4,3,908.2786666666667,3
w13,48,128,4,2048,512,64,32,256,1,8,3,905.9006666666668,3
w13,48,128,6,4096,2048,16,16,256,1,4,3,7172.366333333334,3
w13,48,128,6,4096,2048,16,16,256,1,4,4,7200.526333333334,3
w13,48,128,6,4096,2048,16,16,256,1,8,3,7201.411,3
w13,48,128,6,4096,2048,16,16,256,1,8,4,7211.2463333333335,3
w13,48,128,6,4096,2048,16,16,256,4,4,3,7173.3043333333335,3
w13,48,128,6,4096,2048,16,16,256,4,4,4,7206.147666666667,3
w13,48,128,6,4096,2048,16,16,256,4,8,3,7198.755666666667,3
w13,48,128,6,4096,2048,16,16,256,4,8,4,7216.110333333334,3
w13,48,128,6,4096,2048,16,32,256,1,4,3,7184.793000000001,3
w13,48,128,6,4096,2048,16,32,256,1,4,4,7208.376666666666,3
w13,48,128,6,4096,2048,16,32,256,1,8,3,7196.963666666667,3
w13,48,128,6,4096,2048,16,32,256,1,8,4,7211.021666666667,3
w13,48,128,6,4096,2048,16,32,256,16,4,3,7194.680666666667,3
w13,48,128,6,4096,2048,16,32,256,16,4,4,7236.238333333334,3
w13,48,128,6,4096,2048,16,32,256,16,8,3,7208.856666666667,3
w13,48,128,6,4096,2048,16,32,256,16,8,4,7238.5,3
w13,48,128,6,4096,2048,16,32,256,32,4,3,7217.688999999999,3
w13,48,128,6,4096,2048,16,32,256,32,8,3,7236.046333333333,3
w13,48,128,6,4096,2048,16,64,256,1,4,3,7199.651333333332,3
w13,48,128,6,4096,2048,16,64,256,1,8,3,7207.9929999999995,3
w13,48,128,6,4096,2048,16,64,256,16,4,3,7215.779666666666,3
w13,48,128,6,4096,2048,16,64,256,16,8,3,7226.702666666667,3
w13,48,128,6,4096,2048,16,64,256,32,4,3,7238.137333333333,3
w13,48,128,6,4096,2048,32,32,256,1,4,3,7187.011333333333,3
w13,48,128,6,4096,2048,32,32,256,1,4,4,7211.480333333333,3
w13,48,128,6,4096,2048,32,32,256,1,8,3,7199.022666666667,3
w13,48,128,6,4096,2048,32,32,256,1,8,4,7214.873,3
w13,48,128,6,4096,2048,32,32,256,4,4,3,7191.257333333332,3
w13,48,128,6,4096,2048,32,32,256,4,4,4,7216.377,3
w13,48,128,6,4096,2048,32,32,256,4,8,3,7203.086333333333,3
w13,48,128,6,4096,2048,32,32,256,4,8,4,7220.91,3
w13,48,128,6,4096,2048,32,32,256,16,4,3,7217.646333333333,3
w13,48,128,6,4096,2048,32,32,256,16,4,4,7240.622333333333,3
w13,48,128,6,4096,2048,32,32,256,16,8,3,7225.625333333333,3
w13,48,128,6,4096,2048,32,32,256,16,8,4,7242.8836666666675,3
w13,48,128,6,4096,2048,32,64,256,1,4,3,7223.161,3
w13,48,128,6,4096,2048,32,64,256,1,8,3,7216.259999999999,3
w13,48,128,6,4096,2048,32,64,256,8,4,3,7231.790666666667,3
w13,48,128,6,4096,2048,32,64,256,8,8,3,7227.544999999999,3
w13,48,128,6,4096,2048,32,64,256,16,4,3,7242.617000000001,3
w13,48,128,6,4096,2048,32,64,256,16,8,3,7240.2699999999995,3
w13,48,128,6,4096,2048,64,32,256,1,4,3,7212.813999999999,3
w13,48,128,6,4096,2048,64,32,256,1,8,3,7219.2463333333335,3
w13,48,128,8,2048,768,16,16,256,1,4,3,1350.1213333333333,3
w13,48,128,8,2048,768,16,16,256,1,4,4,1356.0410000000002,3
w13,48,128,8,2048,768,16,16,256,1,8,3,1355.572,3
w13,48,128,8,2048,768,16,16,256,1,8,4,1358.6656666666665,3
w13,48,128,8,2048,768,16,16,256,4,4,3,1352.2116666666668,3
w13,48,128,8,2048,768,16,16,256,4,4,4,1356.969,3
w13,48,128,8,2048,768,16,16,256,4,8,3,1356.8736666666666,3
w13,48,128,8,2048,768,16,16,256,4,8,4,1360.4146666666668,3
w13,48,128,8,2048,768,16,32,256,1,4,3,1352.9796666666668,3
w13,48,128,8,2048,768,16,32,256,1,4,4,1355.3799999999999,3
w13,48,128,8,2048,768,16,32,256,1,8,3,1355.3583333333333,3
w13,48,128,8,2048,768,16,32,256,1,8,4,1356.9586666666667,3
w13,48,128,8,2048,768,16,32,256,16,4,3,1354.6656666666665,3
w13,48,128,8,2048,768,16,32,256,16,4,4,1361.3639999999998,3
w13,48,128,8,2048,768,16,32,256,16,8,3,1357.0649999999998,3
w13,48,128,8,2048,768,16,32,256,16,8,4,1363.2943333333335,3
w13,48,128,8,2048,768,16,32,256,32,4,3,1357.5130000000001,3
w13,48,128,8,2048,768,16,32,256,32,4,4,1362.5689999999997,3
w13,48,128,8,2048,768,16,32,256,32,8,3,1360.0413333333333,3
w13,48,128,8,2048,768,16,32,256,32,8,4,1363.6686666666665,3
w13,48,128,8,2048,768,16,64,256,1,4,3,1357.8333333333333,3
w13,48,128,8,2048,768,16,64,256,1,8,3,1358.537,3
w13,48,128,8,2048,768,16,64,256,16,4,3,1360.2756666666667,3
w13,48,128,8,2048,768,16,64,256,16,8,3,1362.036,3
w13,48,128,8,2048,768,16,64,256,32,4,3,1363.4223333333332,3
w13,48,128,8,2048,768,32,32,256,1,4,3,1351.7430000000002,3
w13,48,128,8,2048,768,32,32,256,1,4,4,1358.185,3
w13,48,128,8,2048,768,32,32,256,1,8,3,1353.9193333333333,3
w13,48,128,8,2048,768,32,32,256,1,8,4,1360.3613333333333,3
w13,48,128,8,2048,768,32,32,256,4,4,3,1355.6676666666665,3
w13,48,128,8,2048,768,32,32,256,4,4,4,1360.1483333333333,3
w13,48,128,8,2048,768,32,32,256,4,8,3,1356.6173333333334,3
w13,48,128,8,2048,768,32,32,256,4,8,4,1362.4089999999999,3
w13,48,128,8,2048,768,32,32,256,16,4,3,1359.903,3
w13,48,128,8,2048,768,32,32,256,16,8,3,1360.6809999999998,3
w13,48,128,8,2048,768,32,32,256,32,4,3,1361.2356666666667,3
w13,48,128,8,2048,768,32,64,256,1,4,3,1363.6893333333335,3
w13,48,128,8,2048,768,32,64,256,1,8,3,1361.5990000000002,3
w13,48,128,8,2048,768,32,64,256,8,8,3,1363.6676666666667,3
w13,48,128,8,2048,768,64,32,256,1,4,3,1360.233,3
w13,48,128,8,2048,768,64,32,256,1,8,3,1358.4413333333334,3
w13,48,128,8,4096,1536,16,16,256,1,4,3,5382.415,3
w13,48,128,8,4096,1536,16,16,256,1,4,4,5408.441666666667,3
w13,48,128,8,4096,1536,16,16,256,1,8,3,5403.716333333333,3
w13,48,128,8,4096,1536,16,16,256,1,8,4,5416.57,3
w13,48,128,8,4096,1536,16,16,256,4,4,3,5387.886666666666,3
w13,48,128,8,4096,1536,16,16,256,4,4,4,5414.1483333333335,3
w13,48,128,8,4096,1536,16,16,256,4,8,3,5409.018,3
w13,48,128,8,4096,1536,16,16,256,4,8,4,5420.964666666667,3
w13,48,128,8,4096,1536,16,32,256,1,4,3,5390.798666666667,3
w13,48,128,8,4096,1536,16,32,256,1,4,4,5411.119,3
w13,48,128,8,4096,1536,16,32,256,1,8,3,5400.835999999999,3
w13,48,128,8,4096,1536,16,32,256,1,8,4,5414.564333333334,3
w13,48,128,8,4096,1536,16,32,256,16,4,3,5397.497666666666,3
w13,48,128,8,4096,1536,16,32,256,16,4,4,5427.770333333333,3
w13,48,128,8,4096,1536,16,32,256,16,8,3,5409.337333333333,3
w13,48,128,8,4096,1536,16,32,256,16,8,4,5431.834,3
w13,48,128,8,4096,1536,16,32,256,32,4,3,5414.436000000001,3
w13,48,128,8,4096,1536,16,32,256,32,8,3,5425.060333333334,3
w13,48,128,8,4096,1536,16,64,256,1,4,3,5405.615000000001,3
w13,48,128,8,4096,1536,16,64,256,1,8,3,5411.460666666666,3
w13,48,128,8,4096,1536,16,64,256,16,4,3,5413.657333333333,3
w13,48,128,8,4096,1536,16,64,256,16,8,3,5421.284666666666,3
w13,48,128,8,4096,1536,16,64,256,32,4,3,5429.689666666666,3
w13,48,128,8,4096,1536,32,32,256,1,4,3,5397.583,3
w13,48,128,8,4096,1536,32,32,256,1,4,4,5414.927333333334,3
w13,48,128,8,4096,1536,32,32,256,1,8,3,5403.353333333333,3
w13,48,128,8,4096,1536,32,32,256,1,8,4,5417.518666666667,3
w13,48,128,8,4096,1536,32,32,256,4,4,3,5403.812,3
w13,48,128,8,4096,1536,32,32,256,4,4,4,5420.42,3
w13,48,128,8,4096,1536,32,32,256,4,8,3,5408.847333333333,3
w13,48,128,8,4096,1536,32,32,256,4,8,4,5424.590999999999,3
w13,48,128,8,4096,1536,32,32,256,16,4,3,5415.9186666666665,3
w13,48,128,8,4096,1536,32,32,256,16,4,4,5432.986,3
w13,48,128,8,4096,1536,32,32,256,16,8,3,5420.623,3
w13,48,128,8,4096,1536,32,32,256,16,8,4,5435.897666666667,3
w13,48,128,8,4096,1536,32,32,256,32,4,3,5435.577666666667,3
w13,48,128,8,4096,1536,32,64,256,1,4,3,5425.327333333334,3
w13,48,128,8,4096,1536,32,64,256,1,8,3,5420.175,3
w13,48,128,8,4096,1536,32,64,256,8,4,3,5427.172333333333,3
w13,48,128,8,4096,1536,32,64,256,8,8,3,5423.172,3
w13,48,128,8,4096,1536,32,64,256,16,4,3,5434.457333333333,3
w13,48,128,8,4096,1536,32,64,256,16,8,3,5432.260333333333,3
w13,48,128,8,4096,1536,64,32,256,1,4,3,5421.455333333333,3
w13,48,128,8,4096,1536,64,32,256,1,8,3,5419.748,3
w13,48,128,8,4096,3072,16,16,256,1,4,3,10761.768333333333,3
w13,48,128,8,4096,3072,16,16,256,1,4,4,10807.795,3
w13,48,128,8,4096,3072,16,16,256,1,8,3,10799.805666666667,3
w13,48,128,8,4096,3072,16,16,256,1,8,4,10822.557999999999,3
w13,48,128,8,4096,3072,16,16,256,4,4,3,10771.901666666665,3
w13,48,128,8,4096,3072,16,16,256,4,4,4,10823.987333333333,3
w13,48,128,8,4096,3072,16,16,256,4,8,3,10813.107,3
w13,48,128,8,4096,3072,16,16,256,4,8,4,10834.739333333333,3
w13,48,128,8,4096,3072,16,32,256,1,4,3,10778.664333333332,3
w13,48,128,8,4096,3072,16,32,256,1,4,4,10814.536333333335,3
w13,48,128,8,4096,3072,16,32,256,1,8,3,10797.800333333333,3
w13,48,128,8,4096,3072,16,32,256,1,8,4,10820.403,3
w13,48,128,8,4096,3072,16,32,256,16,4,3,10791.389666666668,3
w13,48,128,8,4096,3072,16,32,256,16,4,4,10846.515333333335,3
w13,48,128,8,4096,3072,16,32,256,16,8,3,10812.808333333334,3
w13,48,128,8,4096,3072,16,32,256,16,8,4,10853.416333333333,3
w13,48,128,8,4096,3072,16,32,256,32,4,3,10828.968333333332,3
w13,48,128,8,4096,3072,16,32,256,32,8,3,10849.843,3
w13,48,128,8,4096,3072,16,64,256,1,4,3,10805.192666666666,3
w13,48,128,8,4096,3072,16,64,256,1,8,3,10816.904,3
w13,48,128,8,4096,3072,16,64,256,16,4,3,10824.509666666667,3
w13,48,128,8,4096,3072,16,64,256,16,8,3,10839.475,3
w13,48,128,8,4096,3072,16,64,256,32,4,3,10868.403333333334,3
w13,48,128,8,4096,3072,32,32,256,1,4,3,10779.964333333335,3
w13,48,128,8,4096,3072,32,32,256,1,4,4,10821.148333333333,3
w13,48,128,8,4096,3072,32,32,256,1,8,3,10788.711000000001,3
w13,48,128,8,4096,3072,32,32,256,1,8,4,10826.225666666667,3
w13,48,128,8,4096,3072,32,32,256,4,4,3,10796.049333333334,3
w13,48,128,8,4096,3072,32,32,256,4,4,4,10835.868,3
w13,48,128,8,4096,3072,32,32,256,4,8,3,10804.550333333334,3
w13,48,128,8,4096,3072,32,32,256,4,8,4,10839.196333333333,3
w13,48,128,8,4096,3072,32,32,256,16,4,3,10824.465000000002,3
w13,48,128,8,4096,3072,32,32,256,16,4,4,10851.964333333335,3
w13,48,128,8,4096,3072,32,32,256,16,8,3,10836.092666666666,3
w13,48,128,8,4096,3072,32,32,256,16,8,4,10860.658000000001,3
w13,48,128,8,4096,3072,32,64,256,1,4,3,10836.828666666666,3
w13,48,128,8,4096,3072,32,64,256,1,8,3,10830.673333333332,3
w13,48,128,8,4096,3072,32,64,256,8,4,3,10847.665333333332,3
w13,48,128,8,4096,3072,32,64,256,8,8,3,10843.174666666666,3
w13,48,128,8,4096,3072,32,64,256,16,4,3,10862.374666666668,3
w13,48,128,8,4096,3072,32,64,256,16,8,3,10859.014000000001,3
w13,48,128,8,4096,3072,64,32,256,1,4,3,10819.867666666667,3
w13,48,128,8,4096,3072,64,32,256,1,8,3,10817.414,3
w13,64,8,2,1024,512,16,16,128,4,4,2,32.748999999999995,3
w13,64,8,2,1024,512,16,16,256,4,4,2,32.812999999999995,3
w13,64,8,2,1024,512,16,32,128,1,4,2,32.77033333333333,3
w13,64,8,2,1024,512,16,32,128,4,4,2,32.58866666666666,3
w13,64,8,2,1024,512,16,32,128,16,4,2,32.67466666666667,3
w13,64,8,2,1024,512,16,32,128,16,8,2,32.80233333333333,3
w13,64,8,2,1024,512,16,32,128,32,4,2,32.53566666666667,3
w13,64,8,2,1024,512,16,32,128,64,4,2,32.65266666666667,3
w13,64,8,2,1024,512,16,32,128,64,8,2,32.812999999999995,3
w13,64,8,2,1024,512,16,64,128,16,8,2,32.69533333333333,3
w13,64,8,2,1024,512,16,64,128,64,8,2,32.791333333333334,3
w13,64,8,2,1024,512,32,32,128,64,4,2,32.75933333333334,3
w13,64,16,2,1536,768,16,16,256,1,4,3,132.84533333333334,3
w13,64,16,2,1536,768,16,16,256,1,8,3,133.77366666666663,3
w13,64,16,2,1536,768,16,16,256,4,4,3,132.888,3
w13,64,16,2,1536,768,16,32,128,1,4,2,133.83766666666665,3
w13,64,16,2,1536,768,16,32,128,1,4,3,133.93366666666665,3
w13,64,16,2,1536,768,16,32,128,4,4,2,133.81633333333332,3
w13,64,16,2,1536,768,16,32,128,16,4,2,134.104,3
w13,64,16,2,1536,768,16,32,128,32,4,2,134.05066666666667,3
w13,64,16,2,1536,768,16,32,256,1,4,3,133.44299999999998,3
w13,64,16,2,1536,768,16,32,256,1,8,3,134.05066666666667,3
w13,64,16,2,1536,768,16,64,128,1,8,2,134.0293333333333,3
w13,64,16,2,1536,768,16,128,128,1,8,2,134.1256666666667,3
w13,64,16,4,1536,1024,16,16,256,1,4,3,177.17600000000002,3
w13,64,16,4,1536,1024,16,16,256,4,4,3,176.92033333333336,3
w13,64,16,4,1536,1024,16,32,128,16,4,2,178.58433333333332,3
w13,64,16,4,1536,1024,16,32,128,32,4,2,178.648,3
w13,64,16,4,1536,1024,16,32,256,1,4,3,178.6483333333333,3
w13,64,16,4,1536,1024,16,32,256,1,8,3,178.69066666666666,3
w13,64,16,4,1536,1024,16,64,128,1,8,2,178.4563333333333,3
w13,64,16,4,1536,1024,32,32,256,1,4,3,178.31766666666667,3
w13,64,16,4,1536,1024,32,32,256,1,8,3,178.07199999999997,3
w13,64,16,4,1536,1024,32,32,256,32,4,3,178.61599999999999,3
w13,64,32,4,2048,768,16,16,256,1,4,3,344.0786666666667,3
w13,64,32,4,2048,768,16,16,256,1,4,4,346.26533333333333,3
w13,64,32,4,2048,768,16,16,256,1,8,3,346.1693333333333,3
w13,64,32,4,2048,768,16,16,256,4,4,3,343.855,3
w13,64,32,4,2048,768,16,16,256,4,4,4,346.671,3
w13,64,32,4,2048,768,16,16,256,4,8,3,347.04400000000004,3
w13,64,32,4,2048,768,16,32,256,1,4,3,345.05999999999995,3
w13,64,32,4,2048,768,16,32,256,1,8,3,346.6713333333334,3
w13,64,32,4,2048,768,16,32,256,1,8,4,347.2573333333333,3
w13,64,32,4,2048,768,16,32,256,16,4,3,347.1186666666667,3
w13,64,32,4,2048,768,16,64,256,1,8,3,347.215,3
w13,64,32,4,2048,768,32,32,256,1,4,3,346.5216666666667,3
w13,64,32,4,2048,768,32,32,256,1,8,3,345.8709999999999,3
w13,64,32,4,2048,768,32,32,256,4,4,3,346.8733333333334,3
w13,64,32,4,2048,768,32,32,256,4,8,3,347.0226666666667,3
w13,64,32,6,3072,1024,16,16,256,1,4,3,685.3710000000001,3
w13,64,32,6,3072,1024,16,16,256,1,4,4,691.6646666666666,3
w13,64,32,6,3072,1024,16,16,256,1,8,3,691.6536666666666,3
w13,64,32,6,3072,1024,16,16,256,4,4,3,685.467,3
w13,64,32,6,3072,1024,16,16,256,4,8,3,691.494,3
w13,64,32,6,3072,1024,16,32,256,1,4,3,688.4639999999999,3
w13,64,32,6,3072,1024,16,32,256,1,8,3,689.7546666666666,3
w13,64,32,6,3072,1024,16,32,256,16,4,3,692.1550000000001,3
w13,64,32,6,3072,1024,16,64,256,1,4,3,689.7873333333333,3
w13,64,32,6,3072,1024,16,64,256,1,8,3,690.555,3
w13,64,32,6,3072,1024,32,32,256,1,4,3,686.256,3
w13,64,32,6,3072,1024,32,32,256,1,8,3,688.2403333333333,3
w13,64,32,6,3072,1024,32,32,256,4,4,3,688.8696666666666,3
w13,64,32,6,3072,1024,32,32,256,4,8,3,689.5740000000001,3
w13,64,60,4,2048,1408,16,16,256,1,4,3,1164.823666666667,3
w13,64,60,4,2048,1408,16,16,256,1,4,4,1170.178,3
w13,64,60,4,2048,1408,16,16,256,1,8,3,1169.698,3
w13,64,60,4,2048,1408,16,16,256,1,8,4,1173.314,3
w13,64,60,4,2048,1408,16,16,256,4,4,3,1165.218,3
w13,64,60,4,2048,1408,16,16,256,4,4,4,1170.5516666666665,3
w13,64,60,4,2048,1408,16,16,256,4,8,3,1171.0849999999998,3
w13,64,60,4,2048,1408,16,16,256,4,8,4,1174.0929999999998,3
w13,64,60,4,2048,1408,16,32,256,1,4,3,1167.3623333333333,3
w13,64,60,4,2048,1408,16,32,256,1,4,4,1169.5593333333334,3
w13,64,60,4,2048,1408,16,32,256,1,8,3,1168.9413333333334,3
w13,64,60,4,2048,1408,16,32,256,1,8,4,1170.8823333333332,3
w13,64,60,4,2048,1408,16,32,256,16,4,3,1168.066,3
w13,64,60,4,2048,1408,16,32,256,16,4,4,1174.2956666666666,3
w13,64,60,4,2048,1408,16,32,256,16,8,3,1170.562,3
w13,64,60,4,2048,1408,16,32,256,16,8,4,1175.1276666666665,3
w13,64,60,4,2048,1408,16,32,256,32,4,3,1173.0693333333331,3
w13,64,60,4,2048,1408,16,32,256,32,4,4,1176.482,3
w13,64,60,4,2048,1408,16,32,256,32,8,3,1175.5116666666665,3
w13,64,60,4,2048,1408,16,64,256,1,4,3,1170.3276666666668,3
w13,64,60,4,2048,1408,16,64,256,1,8,3,1171.7246666666667,3
w13,64,60,4,2048,1408,16,64,256,16,4,3,1174.0716666666667,3
w13,64,60,4,2048,1408,16,64,256,16,8,3,1175.2766666666666,3
w13,64,60,4,2048,1408,32,32,256,1,4,3,1166.7756666666667,3
w13,64,60,4,2048,1408,32,32,256,1,4,4,1171.693,3
w13,64,60,4,2048,1408,32,32,256,1,8,3,1168.7593333333334,3
w13,64,60,4,2048,1408,32,32,256,1,8,4,1172.578,3
w13,64,60,4,2048,1408,32,32,256,4,4,3,1169.133,3
w13,64,60,4,2048,1408,32,32,256,4,4,4,1173.89,3
w13,64,60,4,2048,1408,32,32,256,4,8,3,1170.2103333333332,3
w13,64,60,4,2048,1408,32,32,256,4,8,4,1175.394,3
w13,64,60,4,2048,1408,32,32,256,16,4,3,1172.1196666666665,3
w13,64,60,4,2048,1408,32,32,256,16,4,4,1176.1303333333333,3
w13,64,60,4,2048,1408,32,32,256,16,8,3,1173.698,3
w13,64,60,4,2048,1408,32,64,256,1,4,3,1176.461,3
w13,64,60,4,2048,1408,32,64,256,1,8,3,1173.5596666666668,3
w13,64,60,4,2048,1408,32,64,256,8,8,3,1175.213,3
w13,64,60,4,2048,1408,64,32,256,1,4,3,1174.4453333333333,3
w13,64,60,4,2048,1408,64,32,256,1,8,3,1173.4106666666667,3
w13,64,60,6,3584,2304,16,16,256,1,4,3,3322.999333333333,3
w13,64,60,6,3584,2304,16,16,256,1,8,3,3345.218333333333,3
w13,64,60,6,3584,2304,16,16,256,4,4,3,3328.0336666666667,3
w13,64,60,6,3584,2304,16,32,256,1,4,3,3332.8343333333337,3
w13,64,60,6,3584,2304,16,32,256,1,8,3,3342.509,3
w13,64,60,6,3584,2304,16,64,256,1,4,3,3337.4103333333333,3
w13,64,60,6,3584,2304,16,64,256,1,8,3,3346.8073333333336,3
w13,64,60,6,3584,2304,32,32,256,1,4,3,3317.3673333333336,3
w13,64,60,6,3584,2304,32,32,256,1,8,3,3322.455333333334,3
w13,64,60,6,3584,2304,32,32,256,4,4,3,3328.354,3
w13,64,60,6,3584,2304,32,32,256,4,8,3,3330.444333333333,3
w13,64,60,6,3584,2304,64,32,256,1,4,3,3340.813,3
w13,64,60,6,3584,2304,64,32,256,1,8,3,3340.215,3
w13,64,60,8,2048,1536,16,16,256,1,4,3,1276.3996666666665,3
w13,64,60,8,2048,1536,16,16,256,1,4,4,1282.7459999999999,3
w13,64,60,8,2048,1536,16,16,256,1,8,3,1282.0423333333335,3
w13,64,60,8,2048,1536,16,16,256,1,8,4,1284.944,3
w13,64,60,8,2048,1536,16,16,256,4,4,3,1277.904,3
w13,64,60,8,2048,1536,16,16,256,4,4,4,1284.6133333333332,3
w13,64,60,8,2048,1536,16,16,256,4,8,3,1284.549,3
w13,64,60,8,2048,1536,16,16,256,4,8,4,1287.4823333333334,3
w13,64,60,8,2048,1536,16,32,256,1,4,3,1279.845,3
w13,64,60,8,2048,1536,16,32,256,1,4,4,1282.0216666666668,3
w13,64,60,8,2048,1536,16,32,256,1,8,3,1281.3916666666667,3
w13,64,60,8,2048,1536,16,32,256,1,8,4,1284.08,3
w13,64,60,8,2048,1536,16,32,256,16,4,3,1281.9573333333335,3
w13,64,60,8,2048,1536,16,32,256,16,8,3,1283.8876666666665,3
w13,64,60,8,2048,1536,16,32,256,32,4,3,1287.3329999999999,3
w13,64,60,8,2048,1536,16,64,256,1,4,3,1284.2506666666666,3
w13,64,60,8,2048,1536,16,64,256,1,8,3,1284.5813333333333,3
w13,64,60,8,2048,1536,16,64,256,16,4,3,1288.3146666666667,3
w13,64,60,8,2048,1536,16,64,256,16,8,3,1289.2103333333334,3
w13,64,60,8,2048,1536,32,32,256,1,4,3,1278.2343333333336,3
w13,64,60,8,2048,1536,32,32,256,1,4,4,1285.2103333333334,3
w13,64,60,8,2048,1536,32,32,256,1,8,3,1279.2796666666666,3
w13,64,60,8,2048,1536,32,32,256,1,8,4,1286.4896666666666,3
w13,64,60,8,2048,1536,32,32,256,4,4,3,1283.952,3
w13,64,60,8,2048,1536,32,32,256,4,8,3,1283.9733333333334,3
w13,64,60,8,2048,1536,32,32,256,16,4,3,1288.0689999999997,3
w13,64,60,8,2048,1536,32,32,256,16,8,3,1288.2079999999999,3
w13,64,60,8,2048,1536,32,64,256,1,8,3,1287.2266666666667,3
w13,64,60,8,2048,1536,32,64,256,8,8,3,1289.0933333333335,3
w13,64,60,8,2048,1536,64,32,256,1,4,3,1286.906,3
w13,64,60,8,2048,1536,64,32,256,1,8,3,1284.89,3
w13,64,64,6,3072,2048,16,16,256,1,4,3,2702.7646666666665,3
w13,64,64,6,3072,2048,16,16,256,1,4,4,2728.2363333333337,3
w13,64,64,6,3072,2048,16,16,256,1,8,3,2719.8096666666665,3
w13,64,64,6,3072,2048,16,16,256,4,4,3,2701.8683333333333,3
w13,64,64,6,3072,2048,16,16,256,4,8,3,2718.721666666667,3
w13,64,64,6,3072,2048,16,32,256,1,4,3,2710.945666666667,3
w13,64,64,6,3072,2048,16,32,256,1,8,3,2719.628333333333,3
w13,64,64,6,3072,2048,16,32,256,16,4,3,2722.4543333333336,3
w13,64,64,6,3072,2048,16,64,256,1,4,3,2711.479,3
w13,64,64,6,3072,2048,16,64,256,1,8,3,2718.412333333333,3
w13,64,64,6,3072,2048,16,64,256,16,4,3,2723.5216666666665,3
w13,64,64,6,3072,2048,32,32,256,1,4,3,2701.6973333333335,3
w13,64,64,6,3072,2048,32,32,256,1,8,3,2706.167,3
w13,64,64,6,3072,2048,32,32,256,4,4,3,2706.4553333333333,3
w13,64,64,6,3072,2048,32,32,256,4,8,3,2710.209666666666,3
w13,64,64,6,3072,2048,32,32,256,16,4,3,2728.7483333333334,3
w13,64,64,6,3072,2048,32,64,256,1,8,3,2727.479,3
w13,64,64,6,3072,2048,64,32,256,1,4,3,2718.0923333333335,3
w13,64,64,6,3072,2048,64,32,256,1,8,3,2718.2843333333335,3
w13,64,64,6,3584,1536,16,16,256,1,4,3,2363.891666666667,3
w13,64,64,6,3584,1536,16,16,256,1,4,4,2385.2033333333334,3
w13,64,64,6,3584,1536,16,16,256,1,8,3,2380.702333333333,3
w13,64,64,6,3584,1536,16,16,256,4,4,3,2367.7206666666666,3
w13,64,64,6,3584,1536,16,16,256,4,8,3,2384.979333333333,3
w13,64,64,6,3584,1536,16,32,256,1,4,3,2371.155666666667,3
w13,64,64,6,3584,1536,16,32,256,1,4,4,2385.7156666666665,3
w13,64,64,6,3584,1536,16,32,256,1,8,3,2378.3343333333337,3
w13,64,64,6,3584,1536,16,32,256,1,8,4,2386.4836666666665,3
w13,64,64,6,3584,1536,16,32,256,16,4,3,2384.6383333333333,3
w13,64,64,6,3584,1536,16,64,256,1,4,3,2374.9313333333334,3
w13,64,64,6,3584,1536,16,64,256,1,8,3,2381.096666666667,3
w13,64,64,6,3584,1536,16,64,256,16,4,3,2384.9156666666668,3
w13,64,64,6,3584,1536,32,32,256,1,4,3,2364.8193333333334,3
w13,64,64,6,3584,1536,32,32,256,1,4,4,2387.3366666666666,3
w13,64,64,6,3584,1536,32,32,256,1,8,3,2370.643666666667,3
w13,64,64,6,3584,1536,32,32,256,4,4,3,2372.425,3
w13,64,64,6,3584,1536,32,32,256,4,8,3,2375.123666666667,3
w13,64,64,6,3584,1536,64,32,256,1,4,3,2379.668,3
w13,64,64,6,3584,1536,64,32,256,1,8,3,2386.6006666666667,3
w13,64,64,8,3584,2560,16,16,256,1,4,3,3943.196,3
w13,64,64,8,3584,2560,16,16,256,4,4,3,3953.970333333333,3
w13,64,64,8,3584,2560,16,32,256,1,4,3,3953.9803333333334,3
w13,64,64,8,3584,2560,16,32,256,1,8,3,3970.2363333333337,3
w13,64,64,8,3584,2560,16,32,256,16,4,3,3972.9246666666672,3
w13,64,64,8,3584,2560,16,64,256,1,4,3,3960.764333333333,3
w13,64,64,8,3584,2560,16,64,256,1,8,3,3972.8496666666665,3
w13,64,64,8,3584,2560,32,32,256,1,4,3,3935.9960000000005,3
w13,64,64,8,3584,2560,32,32,256,1,8,3,3941.4893333333334,3
w13,64,64,8,3584,2560,32,32,256,4,4,3,3948.5183333333334,3
w13,64,64,8,3584,2560,32,32,256,4,8,3,3953.638666666667,3
w13,64,64,8,3584,2560,32,32,256,16,4,3,3973.020666666667,3
w13,64,64,8,3584,2560,64,32,256,1,4,3,3961.447333333333,3
w13,64,64,8,3584,2560,64,32,256,1,8,3,3960.999,3
w13,64,128,4,2048,512,16,16,256,1,4,3,901.3986666666666,3
w13,64,128,4,2048,512,16,16,256,1,4,4,903.4253333333332,3
w13,64,128,4,2048,512,16,16,256,1,8,3,904.866,3
w13,64,128,4,2048,512,16,16,256,1,8,4,906.7216666666667,3
w13,64,128,4,2048,512,16,16,256,4,4,3,902.3906666666667,3
w13,64,128,4,2048,512,16,16,256,4,4,4,905.0679999999999,3
w13,64,128,4,2048,512,16,16,256,4,8,3,907.6820000000001,3
w13,64,128,4,2048,512,16,16,256,4,8,4,907.3613333333333,3
w13,64,128,4,2048,512,16,32,256,1,4,3,902.2946666666667,3
