pipetuning_test/moe_dse/moe_dse_H800_99_5.csv
weight_type,M,E,topk,H,N,BLOCK_SIZE_M,BLOCK_SIZE_N,BLOCK_SIZE_K,GROUP_SIZE_M,num_warps,num_stages,avg_duration,sample_count
w13,1,8,2,1024,512,16,16,128,1,4,3,4.268666666666667,3
w13,1,8,2,1024,512,16,16,128,4,4,3,4.29,3
w13,1,16,2,1536,768,16,32,128,1,4,3,5.634,3
w13,1,16,2,1536,768,16,32,128,4,4,3,5.623333333333334,3
w13,1,16,2,1536,768,16,32,128,16,4,3,5.634,3
w13,1,16,2,1536,768,16,32,128,32,4,3,5.623333333333334,3
w13,1,16,2,1536,768,16,32,128,64,4,3,5.623333333333334,3
w13,1,16,4,1536,1024,16,64,128,16,8,3,6.7540000000000004,3
w13,1,16,4,1536,1024,16,64,128,32,8,3,6.785999999999999,3
w13,1,16,4,1536,1024,16,64,128,64,8,3,6.7540000000000004,3
w13,1,32,4,2048,768,16,64,128,16,8,3,7.938,3
w13,1,32,4,2048,768,16,64,128,32,8,3,7.948666666666667,3
w13,1,32,4,2048,768,16,64,128,64,8,3,7.927333333333333,3
w13,1,32,6,3072,1024,16,32,64,16,4,5,27.938666666666666,3
w13,1,32,6,3072,1024,16,32,64,32,4,5,27.874666666666666,3
w13,1,32,6,3072,1024,16,32,128,1,4,3,28.002333333333336,3
w13,1,32,6,3072,1024,16,32,128,1,4,5,28.012666666666664,3
w13,1,32,6,3072,1024,16,32,128,4,4,3,27.916666666666668,3
w13,1,32,6,3072,1024,16,32,128,4,4,4,27.89533333333333,3
w13,1,32,6,3072,1024,16,32,128,16,4,3,27.981333333333335,3
w13,1,60,4,2048,1408,16,32,256,32,4,3,17.527666666666665,3
w13,1,60,4,2048,1408,32,32,256,16,4,3,17.527666666666665,3
w13,1,60,6,3584,2304,16,32,64,16,4,3,66.48833333333333,3
w13,1,60,6,3584,2304,16,32,128,16,4,2,66.466,3
w13,1,60,6,3584,2304,16,32,128,32,4,2,66.23233333333333,3
w13,1,60,8,2048,1536,16,32,64,32,4,5,35.853,3
w13,1,60,8,2048,1536,16,64,64,32,4,5,35.949333333333335,3
w13,1,60,8,2048,1536,16,64,128,1,4,3,35.949,3
w13,1,64,6,3072,2048,16,32,128,4,4,3,51.67166666666666,3
w13,1,64,6,3072,2048,16,32,128,32,4,3,51.629,3
w13,1,64,6,3072,2048,16,64,64,16,4,5,51.832,3
w13,1,64,6,3072,2048,16,64,64,64,4,5,51.885,3
w13,1,64,6,3584,1536,16,32,128,1,4,3,45.602,3
w13,1,64,6,3584,1536,16,32,128,4,4,3,45.495666666666665,3
w13,1,64,6,3584,1536,16,32,128,16,4,3,45.559333333333335,3
w13,1,64,8,3584,2560,16,32,64,32,4,3,97.26166666666666,3
w13,1,64,8,3584,2560,16,64,64,16,4,3,97.12266666666666,3
w13,1,64,8,3584,2560,16,64,64,32,4,3,96.88799999999999,3
w13,1,64,8,3584,2560,16,64,64,64,4,3,97.03766666666667,3
w13,1,64,8,3584,2560,16,64,128,1,4,3,96.781,3
w13,1,64,8,3584,2560,16,64,128,16,4,2,97.00533333333334,3
w13,1,64,8,3584,2560,16,64,128,16,4,3,97.05866666666667,3
w13,1,64,8,3584,2560,16,64,128,16,8,2,97.09066666666666,3
w13,1,64,8,3584,2560,16,64,128,64,4,2,96.87766666666666,3
w13,1,64,8,3584,2560,16,128,128,1,8,2,97.123,3
w13,1,128,4,2048,512,16,32,128,1,4,5,6.519666666666667,3
w13,1,128,4,2048,512,16,32,128,16,4,5,6.551333333333333,3
w13,1,128,4,2048,512,16,32,128,32,4,5,6.551666666666667,3
w13,1,128,6,4096,2048,16,32,128,32,4,3,66.914,3
w13,1,128,6,4096,2048,16,32,128,64,4,3,67.10633333333334,3
w13,1,128,6,4096,2048,16,64,128,1,4,3,67.07433333333334,3
w13,1,128,6,4096,2048,16,64,128,1,4,4,67.14966666666668,3
w13,1,128,8,2048,768,16,32,128,64,4,3,19.490333333333332,3
w13,1,128,8,2048,768,16,32,256,16,4,2,19.586333333333332,3
w13,1,128,8,4096,1536,16,64,128,1,4,3,67.25633333333333,3
w13,1,128,8,4096,1536,16,64,128,64,8,4,67.522,3
w13,1,128,8,4096,3072,16,32,256,16,4,3,130.93633333333332,3
w13,1,128,8,4096,3072,16,32,256,32,4,5,131.40566666666666,3
w13,1,128,8,4096,3072,16,32,256,64,4,3,130.84033333333332,3
w13,1,128,8,4096,3072,16,32,256,64,4,5,131.405,3
w13,1,128,8,4096,3072,16,64,128,1,4,2,131.06366666666668,3
w13,1,128,8,4096,3072,16,64,128,1,4,4,130.819,3
w13,1,128,8,4096,3072,16,64,128,1,4,5,131.395,3
w13,1,128,8,4096,3072,16,64,128,1,8,5,131.30966666666666,3
w13,1,128,8,4096,3072,16,64,128,16,4,4,130.9466666666667,3
w13,1,128,8,4096,3072,16,64,128,16,4,5,131.24566666666666,3
w13,1,128,8,4096,3072,16,64,128,16,8,5,130.8083333333333,3
w13,1,128,8,4096,3072,16,64,128,32,4,5,131.07500000000002,3
w13,1,128,8,4096,3072,16,64,128,32,8,5,130.904,3
w13,1,128,8,4096,3072,16,64,128,64,4,4,130.851,3
w13,1,128,8,4096,3072,16,64,128,64,4,5,131.299,3
w13,1,128,8,4096,3072,16,64,128,64,8,4,131.39466666666667,3
w13,2,8,2,1024,512,16,32,128,1,4,3,4.673333333333333,3
w13,2,8,2,1024,512,16,32,128,4,4,3,4.695333333333334,3
w13,2,8,2,1024,512,16,32,128,16,4,3,4.674,3
w13,2,8,2,1024,512,16,32,128,32,4,3,4.695,3
w13,2,8,2,1024,512,16,32,128,64,4,3,4.674,3
w13,2,16,2,1536,768,16,64,128,16,8,3,6.733333333333333,3
w13,2,16,2,1536,768,16,64,128,16,8,4,6.754333333333332,3
w13,2,16,2,1536,768,16,64,128,64,8,3,6.764666666666667,3
w13,2,16,4,1536,1024,16,32,256,16,4,2,19.031666666666666,3
w13,2,32,4,2048,768,16,32,128,16,4,4,19.415333333333333,3
w13,2,32,4,2048,768,16,32,256,16,4,2,19.447333333333333,3
w13,2,32,4,2048,768,16,128,64,1,8,5,19.383666666666667,3
w13,2,32,6,3072,1024,16,32,128,32,4,3,51.63933333333333,3
w13,2,32,6,3072,1024,16,64,64,16,4,5,51.842666666666666,3
w13,2,32,6,3072,1024,16,64,128,1,8,5,51.78933333333333,3
w13,2,32,6,3072,1024,16,64,128,16,4,3,51.629,3
w13,2,32,6,3072,1024,16,64,128,16,8,3,51.83133333333333,3
w13,2,32,6,3072,1024,16,64,128,64,8,3,51.800000000000004,3
w13,2,60,4,2048,1408,16,32,128,4,4,2,32.589,3
w13,2,60,4,2048,1408,16,32,128,16,4,2,32.663666666666664,3
w13,2,60,4,2048,1408,16,64,128,16,8,2,32.727666666666664,3
w13,2,60,6,3584,2304,16,32,128,1,4,3,129.61333333333334,3
w13,2,60,6,3584,2304,16,32,128,4,4,3,129.54966666666667,3
w13,2,60,6,3584,2304,16,32,128,16,4,3,129.56033333333335,3
w13,2,60,6,3584,2304,16,32,128,64,4,3,129.624,3
w13,2,60,6,3584,2304,16,64,128,16,4,2,129.47466666666665,3
w13,2,60,6,3584,2304,16,64,128,32,4,2,129.49633333333335,3
w13,2,60,6,3584,2304,16,64,128,64,4,2,130.019,3
w13,2,60,8,2048,1536,16,32,64,1,4,3,67.618,3
w13,2,60,8,2048,1536,16,64,64,16,4,3,67.533,3
w13,2,60,8,2048,1536,16,64,64,64,4,3,67.35199999999999,3
w13,2,60,8,2048,1536,16,64,128,32,4,2,67.55466666666666,3
w13,2,60,8,2048,1536,16,64,128,64,4,2,67.45833333333333,3
w13,2,60,8,2048,1536,16,128,64,1,8,3,67.67200000000001,3
w13,2,64,6,3072,2048,16,64,128,32,4,2,98.82933333333334,3
w13,2,64,6,3584,1536,16,32,128,1,4,2,86.93599999999999,3
w13,2,64,6,3584,1536,16,32,128,4,4,2,87.28800000000001,3
w13,2,64,6,3584,1536,16,32,128,16,4,2,86.96833333333332,3
w13,2,64,6,3584,1536,16,32,128,64,4,2,87.13833333333334,3
w13,2,64,6,3584,1536,16,64,64,32,4,3,87.28800000000001,3
w13,2,64,6,3584,1536,16,64,128,32,4,2,87.181,3
w13,2,64,8,3584,2560,16,32,128,1,4,5,189.19766666666666,3
w13,2,64,8,3584,2560,16,32,256,16,4,3,188.8456666666667,3
w13,2,64,8,3584,2560,16,64,128,1,8,2,188.97366666666667,3
w13,2,64,8,3584,2560,16,64,128,1,8,5,189.13433333333333,3
w13,2,64,8,3584,2560,16,64,128,16,8,2,188.81433333333334,3
w13,2,64,8,3584,2560,16,64,128,32,4,3,188.86766666666665,3
w13,2,64,8,3584,2560,16,64,128,32,8,2,189.05966666666666,3
w13,2,64,8,3584,2560,16,64,128,64,4,3,189.155,3
w13,2,64,8,3584,2560,16,64,256,1,8,3,188.37633333333335,3
w13,2,64,8,3584,2560,16,64,256,16,8,3,188.97366666666667,3
w13,2,64,8,3584,2560,16,64,256,32,8,3,188.63266666666667,3
w13,2,64,8,3584,2560,16,128,128,1,8,5,188.8456666666667,3
w13,2,128,4,2048,512,16,64,128,16,8,3,8.119333333333335,3
w13,2,128,4,2048,512,16,64,128,16,8,4,8.130333333333335,3
w13,2,128,4,2048,512,16,64,128,32,8,4,8.119,3
w13,2,128,4,2048,512,16,64,128,64,8,4,8.13,3
w13,2,128,6,4096,2048,16,32,128,1,4,5,131.0536666666667,3
w13,2,128,6,4096,2048,16,32,128,4,4,4,131.54433333333336,3
w13,2,128,6,4096,2048,16,32,128,4,4,5,131.55499999999998,3
w13,2,128,6,4096,2048,16,32,128,16,4,5,131.25633333333334,3
w13,2,128,6,4096,2048,16,32,128,32,4,5,131.608,3
w13,2,128,6,4096,2048,16,32,128,64,4,5,131.50166666666667,3
w13,2,128,6,4096,2048,16,32,256,1,4,3,131.57633333333334,3
w13,2,128,6,4096,2048,16,32,256,16,4,3,131.62933333333334,3
w13,2,128,6,4096,2048,16,32,256,32,4,3,131.64000000000001,3
w13,2,128,6,4096,2048,16,64,128,1,4,4,131.51233333333334,3
w13,2,128,6,4096,2048,16,64,128,1,4,5,131.64,3
w13,2,128,6,4096,2048,16,64,128,16,8,5,131.44833333333335,3
w13,2,128,6,4096,2048,16,64,128,32,4,5,131.07466666666667,3
w13,2,128,6,4096,2048,16,64,128,64,4,4,131.544,3
w13,2,128,6,4096,2048,16,64,128,64,4,5,131.49066666666667,3
w13,2,128,6,4096,2048,16,64,128,64,8,4,131.58666666666667,3
w13,2,128,6,4096,2048,16,64,256,1,4,3,131.45833333333334,3
w13,2,128,6,4096,2048,16,64,256,16,4,3,131.56566666666666,3
w13,2,128,6,4096,2048,16,64,256,32,4,3,131.608,3
w13,2,128,6,4096,2048,16,64,256,64,4,3,131.53366666666668,3
w13,2,128,8,2048,768,16,32,128,1,4,3,35.54366666666667,3
w13,2,128,8,2048,768,16,32,128,1,4,5,35.394,3
w13,2,128,8,2048,768,16,64,128,16,4,3,35.55433333333333,3
w13,2,128,8,4096,1536,16,32,128,1,4,5,131.22400000000002,3
w13,2,128,8,4096,1536,16,32,128,16,4,5,131.203,3
w13,2,128,8,4096,1536,16,32,128,32,4,5,131.03233333333333,3
w13,2,128,8,4096,1536,16,32,128,64,4,5,131.32033333333334,3
w13,2,128,8,4096,1536,16,32,256,1,4,3,131.12833333333333,3
w13,2,128,8,4096,1536,16,32,256,16,4,3,131.26633333333334,3
w13,2,128,8,4096,1536,16,32,256,32,4,3,131.29866666666666,3
w13,2,128,8,4096,1536,16,64,128,1,4,4,131.21333333333334,3
w13,2,128,8,4096,1536,16,64,128,1,4,5,130.72233333333335,3
w13,2,128,8,4096,1536,16,64,128,16,4,4,130.96766666666667,3
w13,2,128,8,4096,1536,16,64,128,16,4,5,131.37333333333333,3
w13,2,128,8,4096,1536,16,64,128,32,4,4,131.10666666666668,3
w13,2,128,8,4096,1536,16,64,128,32,4,5,131.06366666666668,3
w13,2,128,8,4096,1536,16,64,128,64,4,4,131.00033333333332,3
w13,2,128,8,4096,1536,16,64,128,64,4,5,130.81833333333333,3
w13,2,128,8,4096,3072,16,32,128,32,4,5,257.03833333333336,3
w13,2,128,8,4096,3072,16,32,128,64,4,5,257.316,3
w13,2,128,8,4096,3072,16,32,256,16,4,3,257.5183333333334,3
w13,2,128,8,4096,3072,16,32,256,64,4,3,256.9213333333333,3
w13,2,128,8,4096,3072,16,64,128,1,4,5,256.23833333333334,3
w13,2,128,8,4096,3072,16,64,128,1,8,5,257.1023333333333,3
w13,2,128,8,4096,3072,16,64,128,16,4,5,257.0596666666667,3
w13,2,128,8,4096,3072,16,64,128,16,8,5,257.348,3
w13,2,128,8,4096,3072,16,64,128,32,4,5,256.7716666666667,3
w13,2,128,8,4096,3072,16,64,128,64,4,5,256.61133333333333,3
w13,2,128,8,4096,3072,16,64,256,1,4,3,256.65433333333334,3
w13,2,128,8,4096,3072,16,64,256,16,4,3,257.25166666666667,3
w13,2,128,8,4096,3072,16,64,256,32,4,3,257.47566666666665,3
w13,2,128,8,4096,3072,16,64,256,64,4,3,257.48633333333333,3
w13,2,128,8,4096,3072,16,128,128,1,8,5,257.2196666666667,3
w13,2,128,8,4096,3072,16,128,128,32,8,5,257.156,3
w13,4,8,2,1024,512,16,64,128,16,8,3,5.442,3
w13,4,8,2,1024,512,16,64,128,32,8,3,5.4526666666666666,3
w13,4,8,2,1024,512,16,64,128,64,8,3,5.442,3
w13,4,16,2,1536,768,16,32,128,4,4,3,9.181666666666667,3
w13,4,16,2,1536,768,16,32,128,32,4,3,9.149666666666667,3
w13,4,16,2,1536,768,16,32,128,64,4,3,9.192,3
w13,4,16,4,1536,1024,16,32,64,16,4,3,35.832,3
w13,4,16,4,1536,1024,16,32,128,4,4,2,35.778,3
w13,4,16,4,1536,1024,16,32,128,32,4,2,35.682,3
w13,4,16,4,1536,1024,16,32,128,64,4,2,35.842666666666666,3
w13,4,16,4,1536,1024,16,64,64,1,8,3,35.821333333333335,3
w13,4,32,4,2048,768,16,64,128,1,8,5,35.629,3
w13,4,32,4,2048,768,16,64,128,64,8,3,35.458333333333336,3
w13,4,32,6,3072,1024,16,32,256,1,4,3,99.59766666666667,3
w13,4,32,6,3072,1024,16,64,128,16,4,2,99.51166666666667,3
w13,4,32,6,3072,1024,16,64,128,64,4,4,99.34133333333334,3
w13,4,32,6,3072,1024,16,128,128,1,8,4,99.52233333333334,3
w13,4,32,6,3072,1024,16,128,128,32,8,4,99.52300000000001,3
w13,4,32,6,3072,1024,16,128,128,64,8,4,99.17033333333332,3
w13,4,60,4,2048,1408,16,32,64,64,4,3,62.61600000000001,3
w13,4,60,4,2048,1408,16,64,64,32,4,3,62.711999999999996,3
w13,4,60,4,2048,1408,16,64,128,16,4,2,62.413000000000004,3
w13,4,60,4,2048,1408,16,64,128,32,4,2,62.57366666666667,3
w13,4,60,4,2048,1408,16,128,128,1,8,4,62.723000000000006,3
w13,4,60,6,3584,2304,16,32,128,1,4,2,252.36800000000002,3
w13,4,60,6,3584,2304,16,32,128,4,4,2,252.80499999999998,3
w13,4,60,6,3584,2304,16,32,128,16,4,2,253.08233333333337,3
w13,4,60,6,3584,2304,16,32,128,64,4,2,252.89033333333336,3
w13,4,60,6,3584,2304,16,32,256,1,4,3,253.328,3
w13,4,60,6,3584,2304,16,64,256,1,4,3,253.53033333333335,3
w13,4,60,8,2048,1536,16,32,128,1,4,2,130.92533333333333,3
w13,4,60,8,2048,1536,16,32,128,1,4,5,130.488,3
w13,4,60,8,2048,1536,16,32,128,4,4,2,130.29633333333334,3
w13,4,60,8,2048,1536,16,32,128,16,4,2,130.84033333333335,3
w13,4,60,8,2048,1536,16,32,128,16,4,5,130.82933333333332,3
w13,4,60,8,2048,1536,16,32,128,32,4,2,130.851,3
w13,4,60,8,2048,1536,16,32,128,64,4,5,130.41366666666667,3
w13,4,60,8,2048,1536,16,32,256,1,4,3,130.30666666666667,3
w13,4,60,8,2048,1536,16,32,256,16,4,2,130.76533333333333,3
w13,4,60,8,2048,1536,16,32,256,32,4,3,130.776,3
w13,4,60,8,2048,1536,16,32,256,64,4,2,130.43433333333334,3
w13,4,60,8,2048,1536,16,64,128,1,4,5,130.73333333333332,3
w13,4,60,8,2048,1536,16,64,128,1,8,3,130.48799999999997,3
w13,4,60,8,2048,1536,16,64,128,16,4,5,130.87199999999999,3
w13,4,60,8,2048,1536,16,64,128,16,8,3,130.85066666666668,3
w13,4,60,8,2048,1536,16,64,128,32,8,3,130.7973333333333,3
w13,4,60,8,2048,1536,16,64,256,1,4,2,130.66933333333336,3
w13,4,60,8,2048,1536,16,64,256,32,4,2,130.73366666666666,3
w13,4,60,8,2048,1536,16,128,128,1,8,2,130.45633333333333,3
w13,4,60,8,2048,1536,16,128,128,32,8,2,130.49866666666665,3
w13,4,60,8,2048,1536,16,128,128,64,8,2,130.808,3
w13,4,64,6,3072,2048,16,32,128,1,4,5,194.38233333333335,3
w13,4,64,6,3072,2048,16,32,128,16,4,2,194.70266666666666,3
w13,4,64,6,3072,2048,16,32,256,1,4,2,194.02999999999997,3
w13,4,64,6,3072,2048,16,32,256,1,4,3,193.87066666666666,3
w13,4,64,6,3072,2048,16,32,256,1,4,5,194.80866666666665,3
w13,4,64,6,3072,2048,16,32,256,64,4,2,194.67,3
w13,4,64,6,3072,2048,16,32,256,64,4,3,194.6916666666667,3
w13,4,64,6,3072,2048,16,32,256,64,4,4,194.57466666666664,3
w13,4,64,6,3072,2048,16,64,128,16,4,4,194.48933333333332,3
w13,4,64,6,3072,2048,16,64,128,16,8,3,194.4466666666667,3
w13,4,64,6,3072,2048,16,64,128,32,4,5,193.95566666666664,3
w13,4,64,6,3072,2048,16,64,128,64,4,5,194.638,3
w13,4,64,6,3072,2048,16,64,128,64,8,5,194.84066666666664,3
w13,4,64,6,3072,2048,16,64,256,1,8,2,194.77633333333333,3
w13,4,64,6,3072,2048,16,64,256,1,8,3,194.542,3
w13,4,64,6,3072,2048,16,64,256,16,4,3,194.67033333333333,3
w13,4,64,6,3072,2048,16,64,256,16,8,3,194.58466666666666,3
w13,4,64,6,3072,2048,16,128,128,1,8,5,194.32899999999998,3
w13,4,64,6,3072,2048,16,128,128,16,8,2,194.53133333333335,3
w13,4,64,6,3584,1536,16,32,128,1,4,4,170.87233333333333,3
w13,4,64,6,3584,1536,16,32,128,4,4,2,170.57366666666667,3
w13,4,64,6,3584,1536,16,32,128,16,4,2,170.95766666666668,3
w13,4,64,6,3584,1536,16,32,128,32,4,2,170.77633333333333,3
w13,4,64,6,3584,1536,16,32,256,1,4,2,170.46666666666667,3
w13,4,64,6,3584,1536,16,32,256,16,4,2,171.06433333333334,3
w13,4,64,6,3584,1536,16,32,256,32,4,2,170.70166666666668,3
w13,4,64,6,3584,1536,16,64,128,1,4,4,170.31766666666667,3
w13,4,64,6,3584,1536,16,64,128,16,4,4,170.85133333333332,3
w13,4,64,6,3584,1536,16,64,128,32,4,4,171.07500000000002,3
w13,4,64,6,3584,1536,16,64,256,64,8,2,170.9043333333333,3
w13,4,64,8,3584,2560,16,32,128,1,4,5,373.38633333333337,3
w13,4,64,8,3584,2560,16,32,128,4,4,5,373.90933333333334,3
w13,4,64,8,3584,2560,16,32,256,1,4,3,372.4583333333333,3
w13,4,64,8,3584,2560,16,32,256,1,4,4,373.01366666666667,3
w13,4,64,8,3584,2560,16,32,256,1,4,5,372.22333333333336,3
w13,4,64,8,3584,2560,16,32,256,16,4,3,373.3546666666666,3
w13,4,64,8,3584,2560,16,32,256,16,4,4,372.98133333333334,3
w13,4,64,8,3584,2560,16,32,256,16,4,5,373.6213333333333,3
w13,4,64,8,3584,2560,16,32,256,32,4,3,372.8419999999999,3
w13,4,64,8,3584,2560,16,32,256,32,4,4,373.9846666666667,3
w13,4,64,8,3584,2560,16,32,256,32,4,5,372.81033333333335,3
w13,4,64,8,3584,2560,16,32,256,64,4,3,373.26933333333335,3
w13,4,64,8,3584,2560,16,32,256,64,4,4,373.76,3
w13,4,64,8,3584,2560,16,32,256,64,4,5,373.09833333333336,3
w13,4,64,8,3584,2560,16,64,128,1,4,5,372.362,3
w13,4,64,8,3584,2560,16,64,128,1,8,2,372.49,3
w13,4,64,8,3584,2560,16,64,128,1,8,5,373.93066666666664,3
w13,4,64,8,3584,2560,16,64,128,16,8,2,373.9626666666666,3
w13,4,64,8,3584,2560,16,64,128,32,4,5,373.8453333333334,3
w13,4,64,8,3584,2560,16,64,128,32,8,2,373.76,3
w13,4,64,8,3584,2560,16,64,128,32,8,5,373.93100000000004,3
w13,4,64,8,3584,2560,16,64,128,64,4,5,373.97333333333336,3
w13,4,64,8,3584,2560,16,64,128,64,8,5,373.9096666666667,3
w13,4,64,8,3584,2560,16,64,256,1,4,3,372.288,3
w13,4,64,8,3584,2560,16,64,256,1,4,5,373.5246666666667,3
w13,4,64,8,3584,2560,16,64,256,1,8,3,373.21566666666666,3
w13,4,64,8,3584,2560,16,64,256,1,8,5,373.15166666666664,3
w13,4,64,8,3584,2560,16,64,256,16,4,3,373.6206666666667,3
w13,4,64,8,3584,2560,16,64,256,32,4,3,372.7036666666666,3
w13,4,64,8,3584,2560,16,64,256,64,4,3,372.83133333333336,3
w13,4,64,8,3584,2560,16,128,128,1,8,5,372.92766666666665,3
w13,4,64,8,3584,2560,16,128,128,16,8,5,373.81333333333333,3
w13,4,64,8,3584,2560,16,128,128,64,8,5,373.888,3
w13,4,64,8,3584,2560,32,32,128,1,4,5,373.077,3
w13,4,64,8,3584,2560,32,32,128,16,4,2,374.02666666666664,3
w13,4,64,8,3584,2560,32,32,128,16,4,5,373.6426666666666,3
w13,4,64,8,3584,2560,32,64,128,1,4,2,373.653,3
w13,4,64,8,3584,2560,32,64,128,4,4,2,373.92,3
w13,4,64,8,3584,2560,32,128,128,1,8,3,373.7176666666667,3
w13,4,64,8,3584,2560,32,128,128,8,4,3,373.73900000000003,3
w13,4,64,8,3584,2560,32,128,128,8,8,3,373.84566666666666,3
w13,4,64,8,3584,2560,32,128,128,64,8,3,374.0843333333333,3
w13,4,64,8,3584,2560,64,128,128,1,8,4,373.8713333333333,3
w13,4,128,4,2048,512,16,32,256,16,4,2,24.706333333333333,3
w13,4,128,4,2048,512,16,64,128,64,8,3,24.791666666666668,3
w13,4,128,6,4096,2048,16,32,128,1,4,5,256.22433333333333,3
w13,4,128,6,4096,2048,16,32,128,4,4,5,257.17333333333335,3
w13,4,128,6,4096,2048,16,32,128,16,4,5,256.63033333333334,3
w13,4,128,6,4096,2048,16,32,128,32,4,5,256.91766666666666,3
w13,4,128,6,4096,2048,16,32,128,64,4,5,256.1073333333333,3
w13,4,128,6,4096,2048,16,32,256,1,4,2,257.1526666666667,3
w13,4,128,6,4096,2048,16,32,256,1,4,3,257.19533333333334,3
w13,4,128,6,4096,2048,16,32,256,16,4,3,256.9923333333333,3
w13,4,128,6,4096,2048,16,32,256,32,4,3,256.9603333333333,3
w13,4,128,6,4096,2048,16,32,256,64,4,2,256.9823333333333,3
w13,4,128,6,4096,2048,16,32,256,64,4,3,256.3953333333333,3
w13,4,128,6,4096,2048,16,64,128,1,4,4,256.87533333333334,3
w13,4,128,6,4096,2048,16,64,128,1,4,5,256.5656666666667,3
w13,4,128,6,4096,2048,16,64,128,16,4,5,256.43766666666664,3
w13,4,128,6,4096,2048,16,64,128,16,8,5,257.02433333333335,3
w13,4,128,6,4096,2048,16,64,128,32,4,4,257.33366666666666,3
w13,4,128,6,4096,2048,16,64,128,32,4,5,256.2563333333333,3
w13,4,128,6,4096,2048,16,64,128,32,8,5,257.36566666666664,3
w13,4,128,6,4096,2048,16,64,128,64,4,5,257.20599999999996,3
w13,4,128,6,4096,2048,16,64,128,64,8,5,257.1956666666667,3
w13,4,128,6,4096,2048,16,64,256,1,4,3,256.9603333333333,3
w13,4,128,6,4096,2048,16,64,256,1,8,3,256.95,3
w13,4,128,6,4096,2048,16,64,256,16,4,3,257.18466666666666,3
w13,4,128,6,4096,2048,16,64,256,32,4,3,256.779,3
w13,4,128,6,4096,2048,16,64,256,32,8,3,257.195,3
w13,4,128,6,4096,2048,16,64,256,64,4,3,257.078,3
w13,4,128,6,4096,2048,16,128,128,1,8,5,256.73633333333333,3
w13,4,128,6,4096,2048,16,128,128,16,8,5,256.79,3
w13,4,128,6,4096,2048,16,128,128,32,8,5,256.6193333333334,3
w13,4,128,6,4096,2048,16,128,128,64,8,5,257.22700000000003,3
w13,4,128,8,2048,768,16,64,64,16,4,3,67.408,3
w13,4,128,8,2048,768,16,64,128,32,4,2,67.54633333333334,3
w13,4,128,8,2048,768,16,128,128,1,8,2,67.25866666666667,3
w13,4,128,8,4096,1536,16,32,128,1,4,5,256.9753333333333,3
w13,4,128,8,4096,1536,16,32,128,4,4,5,256.8686666666667,3
w13,4,128,8,4096,1536,16,32,128,16,4,5,257.231,3
w13,4,128,8,4096,1536,16,32,128,32,4,5,257.36899999999997,3
w13,4,128,8,4096,1536,16,32,128,64,4,5,257.359,3
w13,4,128,8,4096,1536,16,32,256,1,4,2,256.78299999999996,3
w13,4,128,8,4096,1536,16,32,256,1,4,3,256.8473333333333,3
w13,4,128,8,4096,1536,16,32,256,1,4,4,257.508,3
w13,4,128,8,4096,1536,16,32,256,1,4,5,257.52933333333334,3
w13,4,128,8,4096,1536,16,32,256,16,4,3,257.412,3
w13,4,128,8,4096,1536,16,32,256,16,4,5,257.57166666666666,3
w13,4,128,8,4096,1536,16,32,256,32,4,2,257.402,3
w13,4,128,8,4096,1536,16,32,256,64,4,3,257.57166666666666,3
w13,4,128,8,4096,1536,16,64,128,1,4,5,256.975,3
w13,4,128,8,4096,1536,16,64,128,1,8,3,257.7,3
w13,4,128,8,4096,1536,16,64,128,1,8,5,257.32733333333334,3
w13,4,128,8,4096,1536,16,64,128,16,4,5,256.89000000000004,3
w13,4,128,8,4096,1536,16,64,128,32,4,5,256.78266666666667,3
w13,4,128,8,4096,1536,16,64,128,64,4,5,256.4316666666667,3
w13,4,128,8,4096,1536,16,64,128,64,8,5,257.4123333333333,3
w13,4,128,8,4096,1536,16,64,256,1,4,2,257.231,3
w13,4,128,8,4096,1536,16,64,256,1,4,3,256.4633333333333,3
w13,4,128,8,4096,1536,16,64,256,16,4,3,257.24100000000004,3
w13,4,128,8,4096,1536,16,64,256,32,4,3,257.348,3
w13,4,128,8,4096,1536,16,64,256,32,8,3,257.71066666666667,3
w13,4,128,8,4096,1536,16,128,128,1,8,4,257.62566666666663,3
w13,4,128,8,4096,1536,16,128,128,1,8,5,256.5273333333334,3
w13,4,128,8,4096,1536,16,128,128,16,8,5,256.847,3
w13,4,128,8,4096,1536,16,128,128,32,8,5,256.9216666666667,3
w13,4,128,8,4096,1536,16,128,128,64,8,5,257.02866666666665,3
w13,4,128,8,4096,1536,32,128,128,1,4,3,257.28433333333334,3
w13,4,128,8,4096,1536,32,128,128,1,8,3,257.3483333333333,3
w13,4,128,8,4096,3072,16,32,128,1,4,3,507.29033333333336,3
w13,4,128,8,4096,3072,16,32,128,1,4,5,505.75399999999996,3
w13,4,128,8,4096,3072,16,32,128,4,4,3,508.01,3
w13,4,128,8,4096,3072,16,32,128,4,4,5,507.50399999999996,3
w13,4,128,8,4096,3072,16,32,128,16,4,5,506.57166666666666,3
w13,4,128,8,4096,3072,16,32,128,32,4,5,507.2923333333333,3
w13,4,128,8,4096,3072,16,32,128,64,4,5,507.2176666666667,3
w13,4,128,8,4096,3072,16,32,256,1,4,2,507.423,3
w13,4,128,8,4096,3072,16,32,256,1,4,4,507.8023333333333,3
w13,4,128,8,4096,3072,16,32,256,1,4,5,506.0683333333333,3
w13,4,128,8,4096,3072,16,32,256,16,4,3,507.7683333333334,3
w13,4,128,8,4096,3072,16,32,256,16,4,5,506.5396666666666,3
w13,4,128,8,4096,3072,16,32,256,32,4,5,507.365,3
w13,4,128,8,4096,3072,16,32,256,64,4,3,507.704,3
w13,4,128,8,4096,3072,16,32,256,64,4,4,507.93966666666665,3
w13,4,128,8,4096,3072,16,32,256,64,4,5,507.34366666666665,3
w13,4,128,8,4096,3072,16,64,128,1,4,5,505.9446666666667,3
w13,4,128,8,4096,3072,16,64,128,16,4,5,507.42066666666665,3
w13,4,128,8,4096,3072,16,64,128,32,4,5,507.6036666666667,3
w13,4,128,8,4096,3072,16,64,128,64,4,5,507.2486666666667,3
w13,4,128,8,4096,3072,16,64,256,1,4,5,507.23766666666666,3
w13,4,128,8,4096,3072,16,64,256,1,8,5,507.04766666666666,3
w13,4,128,8,4096,3072,16,64,256,16,4,5,506.69800000000004,3
w13,4,128,8,4096,3072,64,64,128,1,4,3,508.059,3
w13,4,128,8,4096,3072,64,128,128,64,8,4,508.0696666666667,3
w13,8,8,2,1024,512,16,64,128,16,8,3,5.495333333333334,3
w13,8,8,2,1024,512,16,64,128,32,8,3,5.474,3
w13,8,8,2,1024,512,16,64,128,64,8,3,5.484666666666667,3
w13,8,16,2,1536,768,16,32,128,4,4,2,27.114333333333335,3
w13,8,16,2,1536,768,16,32,128,16,4,2,27.24266666666667,3
w13,8,16,2,1536,768,16,32,128,64,4,2,27.146666666666665,3
w13,8,16,4,1536,1024,16,32,128,16,4,2,35.33,3
w13,8,16,4,1536,1024,16,32,128,32,4,2,35.405,3
w13,8,16,4,1536,1024,16,64,64,1,4,3,35.47933333333333,3
w13,8,16,4,1536,1024,16,64,64,32,4,3,35.49033333333333,3
w13,8,32,4,2048,768,16,64,64,1,4,3,67.14933333333333,3
w13,8,32,4,2048,768,16,64,128,1,4,2,67.34133333333334,3
w13,8,32,4,2048,768,16,64,128,16,4,2,67.171,3
w13,8,32,6,3072,1024,16,32,128,1,4,2,131.736,3
w13,8,32,6,3072,1024,16,32,128,1,4,5,131.40566666666666,3
w13,8,32,6,3072,1024,16,32,128,4,4,2,131.46966666666665,3
w13,8,32,6,3072,1024,16,32,128,16,4,2,131.36233333333334,3
w13,8,32,6,3072,1024,16,32,128,16,4,5,131.69333333333336,3
w13,8,32,6,3072,1024,16,32,256,16,4,3,131.7363333333333,3
w13,8,32,6,3072,1024,16,64,128,1,4,5,131.16033333333334,3
w13,8,32,6,3072,1024,16,64,128,32,4,4,131.80033333333333,3
w13,8,32,6,3072,1024,16,64,128,64,4,5,131.565,3
w13,8,60,4,2048,1408,16,32,128,1,4,3,120.95166666666667,3
w13,8,60,4,2048,1408,16,32,128,1,4,5,120.92,3
w13,8,60,4,2048,1408,16,32,256,1,4,3,120.83433333333333,3
w13,8,60,4,2048,1408,16,64,128,1,4,3,120.91966666666667,3
w13,8,60,4,2048,1408,16,64,128,1,4,4,120.69533333333334,3
w13,8,60,4,2048,1408,16,64,128,1,4,5,121.016,3
w13,8,60,4,2048,1408,16,128,128,1,8,2,120.43933333333332,3
w13,8,60,4,2048,1408,16,128,128,32,8,2,120.85633333333334,3
w13,8,60,6,3584,2304,16,32,128,1,4,5,499.6646666666666,3
w13,8,60,6,3584,2304,16,32,128,4,4,5,500.421,3
w13,8,60,6,3584,2304,16,32,128,16,4,5,500.57099999999997,3
w13,8,60,6,3584,2304,16,32,128,32,4,5,499.97299999999996,3
w13,8,60,6,3584,2304,16,32,128,64,4,5,500.56,3
w13,8,60,6,3584,2304,16,32,256,1,4,2,499.579,3
w13,8,60,6,3584,2304,16,32,256,1,4,3,498.4156666666666,3
w13,8,60,6,3584,2304,16,32,256,1,4,4,499.26933333333335,3
w13,8,60,6,3584,2304,16,32,256,1,4,5,499.0246666666667,3
w13,8,60,6,3584,2304,16,32,256,16,4,3,499.046,3
w13,8,60,6,3584,2304,16,32,256,16,4,4,500.5496666666666,3
w13,8,60,6,3584,2304,16,32,256,16,4,5,500.2076666666667,3
w13,8,60,6,3584,2304,16,32,256,32,4,2,500.4216666666666,3
w13,8,60,6,3584,2304,16,32,256,32,4,3,499.942,3
w13,8,60,6,3584,2304,16,32,256,32,4,4,500.2083333333333,3
w13,8,60,6,3584,2304,16,32,256,32,4,5,500.7203333333334,3
w13,8,60,6,3584,2304,16,32,256,64,4,3,499.96233333333333,3
w13,8,60,6,3584,2304,16,32,256,64,4,4,500.2083333333333,3
w13,8,60,6,3584,2304,16,32,256,64,4,5,500.2616666666666,3
w13,8,60,6,3584,2304,16,64,128,1,4,3,500.5596666666667,3
w13,8,60,6,3584,2304,16,64,128,1,4,5,498.23533333333336,3
w13,8,60,6,3584,2304,16,64,128,1,8,5,498.7896666666666,3
w13,8,60,6,3584,2304,16,64,128,16,4,3,500.63533333333334,3
w13,8,60,6,3584,2304,16,64,128,16,4,5,499.6743333333333,3
w13,8,60,6,3584,2304,16,64,128,16,8,5,499.9736666666667,3
w13,8,60,6,3584,2304,16,64,128,32,4,5,499.579,3
w13,8,60,6,3584,2304,16,64,128,32,8,5,499.65333333333336,3
w13,8,60,6,3584,2304,16,64,128,64,4,3,500.3153333333333,3
w13,8,60,6,3584,2304,16,64,128,64,4,5,499.2583333333334,3
w13,8,60,6,3584,2304,16,64,128,64,8,5,500.4113333333333,3
w13,8,60,6,3584,2304,16,64,256,1,4,3,498.704,3
w13,8,60,6,3584,2304,16,64,256,1,4,5,499.95166666666665,3
w13,8,60,6,3584,2304,16,64,256,1,8,3,498.66200000000003,3
w13,8,60,6,3584,2304,16,64,256,1,8,5,500.58166666666665,3
w13,8,60,6,3584,2304,16,64,256,16,4,3,500.04766666666666,3
w13,8,60,6,3584,2304,16,64,256,16,8,3,499.5783333333333,3
w13,8,60,6,3584,2304,16,64,256,32,4,3,499.88866666666667,3
w13,8,60,6,3584,2304,16,64,256,32,8,3,499.0986666666667,3
w13,8,60,6,3584,2304,16,64,256,64,4,3,500.06933333333336,3
w13,8,60,6,3584,2304,16,128,128,1,8,5,498.34099999999995,3
w13,8,60,6,3584,2304,16,128,128,16,8,5,500.14466666666664,3
w13,8,60,6,3584,2304,16,128,128,32,8,5,499.61066666666665,3
w13,8,60,6,3584,2304,32,32,128,1,4,4,500.00500000000005,3
w13,8,60,8,2048,1536,16,32,128,1,4,2,240.2166666666667,3
w13,8,60,8,2048,1536,16,32,128,1,4,4,241.18733333333333,3
w13,8,60,8,2048,1536,16,32,128,1,4,5,240.52599999999998,3
w13,8,60,8,2048,1536,16,32,128,4,4,2,240.10999999999999,3
w13,8,60,8,2048,1536,16,32,128,16,4,2,240.47299999999998,3
w13,8,60,8,2048,1536,16,32,128,16,4,4,241.03833333333333,3
w13,8,60,8,2048,1536,16,32,128,16,4,5,240.48333333333335,3
w13,8,60,8,2048,1536,16,32,128,32,4,2,241.20866666666666,3
w13,8,60,8,2048,1536,16,32,128,32,4,5,240.292,3
w13,8,60,8,2048,1536,16,32,128,64,4,4,241.16600000000003,3
w13,8,60,8,2048,1536,16,32,256,1,4,3,240.035,3
w13,8,60,8,2048,1536,16,32,256,1,4,4,241.13400000000001,3
w13,8,60,8,2048,1536,16,32,256,16,4,3,240.345,3
w13,8,60,8,2048,1536,16,32,256,16,4,4,240.867,3
w13,8,60,8,2048,1536,16,32,256,16,4,5,241.17666666666665,3
w13,8,60,8,2048,1536,16,32,256,32,4,3,240.96366666666665,3
w13,8,60,8,2048,1536,16,32,256,32,4,4,240.78166666666667,3
w13,8,60,8,2048,1536,16,64,128,1,4,2,240.14233333333334,3
w13,8,60,8,2048,1536,16,64,128,1,4,4,240.75,3
w13,8,60,8,2048,1536,16,64,128,1,4,5,240.40866666666668,3
w13,8,60,8,2048,1536,16,64,128,1,8,5,240.4723333333333,3
w13,8,60,8,2048,1536,16,64,128,16,4,2,240.49433333333332,3
w13,8,60,8,2048,1536,16,64,128,16,4,4,240.7603333333333,3
w13,8,60,8,2048,1536,16,64,128,16,4,5,240.35566666666668,3
w13,8,60,8,2048,1536,16,64,128,16,8,4,240.547,3
w13,8,60,8,2048,1536,16,64,128,16,8,5,240.729,3
w13,8,60,8,2048,1536,16,64,128,32,4,2,240.867,3
w13,8,60,8,2048,1536,16,64,128,32,4,4,240.41966666666667,3
w13,8,60,8,2048,1536,16,64,128,32,4,5,240.36566666666667,3
w13,8,60,8,2048,1536,16,64,128,32,8,4,241.19766666666666,3
w13,8,60,8,2048,1536,16,64,128,64,4,2,240.75033333333332,3
w13,8,60,8,2048,1536,16,64,128,64,8,5,241.187,3
w13,8,60,8,2048,1536,16,64,256,1,4,3,240.67566666666667,3
w13,8,60,8,2048,1536,16,64,256,1,8,3,241.02766666666665,3
w13,8,60,8,2048,1536,16,64,256,16,4,3,241.23033333333333,3
w13,8,60,8,2048,1536,16,64,256,16,8,3,240.49366666666666,3
w13,8,60,8,2048,1536,16,64,256,32,4,3,241.00633333333334,3
w13,8,60,8,2048,1536,16,64,256,32,8,3,240.91,3
w13,8,60,8,2048,1536,16,128,128,1,4,3,240.889,3
w13,8,60,8,2048,1536,16,128,128,1,8,2,240.46166666666667,3
w13,8,60,8,2048,1536,16,128,128,1,8,3,240.857,3
w13,8,60,8,2048,1536,16,128,128,1,8,5,240.92066666666665,3
w13,8,60,8,2048,1536,16,128,128,16,8,3,241.02766666666665,3
w13,8,60,8,2048,1536,16,128,128,16,8,5,241.20866666666666,3
w13,8,60,8,2048,1536,16,128,128,64,8,2,241.01733333333334,3
w13,8,64,6,3072,2048,16,32,128,1,4,5,383.07933333333335,3
w13,8,64,6,3072,2048,16,32,256,1,4,4,381.90633333333335,3
w13,8,64,6,3072,2048,16,32,256,1,4,5,381.5116666666666,3
w13,8,64,6,3072,2048,16,32,256,16,4,4,383.047,3
w13,8,64,6,3072,2048,16,32,256,16,4,5,382.03399999999993,3
w13,8,64,6,3072,2048,16,32,256,32,4,4,382.9726666666667,3
w13,8,64,6,3072,2048,16,32,256,32,4,5,382.50333333333333,3
w13,8,64,6,3072,2048,16,32,256,64,4,5,383.26,3
w13,8,64,6,3072,2048,16,64,128,1,4,4,382.4506666666667,3
w13,8,64,6,3072,2048,16,64,256,1,4,4,383.29299999999995,3
w13,8,64,6,3072,2048,16,128,128,1,8,2,383.2176666666667,3
w13,8,64,6,3584,1536,16,32,128,1,4,2,335.04466666666667,3
w13,8,64,6,3584,1536,16,32,128,1,4,5,336.303,3
w13,8,64,6,3584,1536,16,32,128,32,4,5,334.9483333333333,3
w13,8,64,6,3584,1536,16,32,128,64,4,2,335.62033333333335,3
w13,8,64,6,3584,1536,16,32,256,1,4,2,335.79066666666665,3
w13,8,64,6,3584,1536,16,32,256,1,4,3,335.428,3
w13,8,64,6,3584,1536,16,32,256,1,4,4,336.2386666666667,3
w13,8,64,6,3584,1536,16,32,256,1,4,5,336.03633333333335,3
w13,8,64,6,3584,1536,16,32,256,16,4,2,336.2176666666667,3
w13,8,64,6,3584,1536,16,32,256,16,4,3,335.6093333333333,3
w13,8,64,6,3584,1536,16,32,256,32,4,2,336.036,3
w13,8,64,6,3584,1536,16,32,256,32,4,3,335.71633333333335,3
w13,8,64,6,3584,1536,16,32,256,64,4,3,335.84433333333334,3
w13,8,64,6,3584,1536,16,64,128,1,4,4,334.6496666666667,3
w13,8,64,6,3584,1536,16,64,128,1,4,5,334.74566666666664,3
w13,8,64,6,3584,1536,16,64,128,1,8,5,336.08933333333334,3
w13,8,64,6,3584,1536,16,64,128,16,4,4,335.70533333333333,3
w13,8,64,6,3584,1536,16,64,128,16,4,5,335.66266666666667,3
w13,8,64,6,3584,1536,16,64,128,16,8,5,335.972,3
w13,8,64,6,3584,1536,16,64,128,32,4,4,336.2386666666667,3
w13,8,64,6,3584,1536,16,64,128,32,4,5,334.959,3
w13,8,64,6,3584,1536,16,64,128,32,8,5,336.14233333333334,3
w13,8,64,6,3584,1536,16,64,128,64,4,4,335.6843333333333,3
w13,8,64,6,3584,1536,16,64,128,64,4,5,335.7266666666667,3
w13,8,64,6,3584,1536,16,64,256,1,4,3,336.20666666666665,3
w13,8,64,6,3584,1536,16,64,256,1,8,2,335.812,3
w13,8,64,6,3584,1536,16,64,256,1,8,3,336.24933333333337,3
w13,8,64,6,3584,1536,16,64,256,32,4,3,335.887,3
w13,8,64,6,3584,1536,16,64,256,32,8,3,336.11066666666665,3
w13,8,64,6,3584,1536,16,128,128,1,8,2,336.292,3
w13,8,64,6,3584,1536,16,128,128,1,8,5,335.08666666666664,3
w13,8,64,6,3584,1536,16,128,128,16,8,5,335.87666666666667,3
w13,8,64,6,3584,1536,16,128,128,32,8,2,336.15333333333336,3
w13,8,64,8,3584,2560,16,32,128,1,4,5,737.6073333333334,3
w13,8,64,8,3584,2560,16,32,256,1,4,3,734.93,3
w13,8,64,8,3584,2560,16,32,256,1,4,4,736.2743333333333,3
w13,8,64,8,3584,2560,16,32,256,1,4,5,734.3216666666667,3
w13,8,64,8,3584,2560,16,32,256,16,4,3,737.447,3
w13,8,64,8,3584,2560,16,32,256,16,4,4,736.7216666666667,3
w13,8,64,8,3584,2560,16,32,256,16,4,5,736.1243333333333,3
w13,8,64,8,3584,2560,16,32,256,32,4,5,737.0206666666667,3
w13,8,64,8,3584,2560,16,64,128,1,4,5,735.5166666666668,3
w13,8,64,8,3584,2560,16,64,128,1,8,5,736.0186666666667,3
w13,8,64,8,3584,2560,16,64,128,16,8,5,737.031,3
w13,8,64,8,3584,2560,16,64,256,1,4,3,736.199,3
w13,8,64,8,3584,2560,16,64,256,1,4,4,737.4156666666667,3
w13,8,64,8,3584,2560,16,64,256,1,4,5,735.57,3
w13,8,64,8,3584,2560,16,64,256,1,8,3,735.5166666666668,3
w13,8,64,8,3584,2560,16,64,256,1,8,5,735.4853333333334,3
w13,8,64,8,3584,2560,16,64,256,16,4,3,737.2656666666667,3
w13,8,64,8,3584,2560,16,64,256,16,4,5,737.6186666666666,3
w13,8,64,8,3584,2560,16,64,256,16,8,3,736.5086666666666,3
w13,8,64,8,3584,2560,16,64,256,16,8,5,737.149,3
w13,8,64,8,3584,2560,16,128,128,1,8,5,735.623,3
w13,8,64,8,3584,2560,16,128,128,16,8,5,737.4896666666667,3
w13,8,128,4,2048,512,16,32,64,1,4,3,46.15533333333334,3
w13,8,128,4,2048,512,16,32,128,1,4,2,46.36966666666666,3
w13,8,128,4,2048,512,16,32,128,4,4,2,46.27333333333333,3
w13,8,128,4,2048,512,16,64,64,1,4,3,46.209333333333326,3
w13,8,128,4,2048,512,16,64,64,1,8,3,46.32666666666666,3
w13,8,128,4,2048,512,16,64,64,16,4,3,46.29433333333333,3
w13,8,128,6,4096,2048,16,32,128,1,4,3,507.7706666666666,3
w13,8,128,6,4096,2048,16,32,128,1,4,4,508.5916666666667,3
w13,8,128,6,4096,2048,16,32,128,1,4,5,506.1176666666667,3
w13,8,128,6,4096,2048,16,32,128,4,4,5,506.9386666666667,3
w13,8,128,6,4096,2048,16,32,128,16,4,3,508.2076666666667,3
w13,8,128,6,4096,2048,16,32,128,16,4,5,507.2583333333334,3
w13,8,128,6,4096,2048,16,32,128,32,4,3,508.44266666666664,3
w13,8,128,6,4096,2048,16,32,128,32,4,5,507.02400000000006,3
w13,8,128,6,4096,2048,16,32,128,64,4,5,507.97299999999996,3
w13,8,128,6,4096,2048,16,32,256,1,4,2,508.30400000000003,3
w13,8,128,6,4096,2048,16,32,256,1,4,3,507.2373333333333,3
w13,8,128,6,4096,2048,16,32,256,1,4,4,507.0876666666666,3
w13,8,128,6,4096,2048,16,32,256,1,4,5,506.55466666666666,3
w13,8,128,6,4096,2048,16,32,256,16,4,3,506.83166666666665,3
w13,8,128,6,4096,2048,16,32,256,16,4,4,507.15166666666664,3
w13,8,128,6,4096,2048,16,32,256,16,4,5,507.26933333333335,3
w13,8,128,6,4096,2048,16,32,256,32,4,2,507.7706666666667,3
w13,8,128,6,4096,2048,16,32,256,32,4,3,507.0986666666667,3
w13,8,128,6,4096,2048,16,32,256,32,4,5,507.66366666666664,3
w13,8,128,6,4096,2048,16,32,256,64,4,2,508.10133333333334,3
w13,8,128,6,4096,2048,16,32,256,64,4,3,507.59999999999997,3
w13,8,128,6,4096,2048,16,32,256,64,4,4,508.4316666666667,3
w13,8,128,6,4096,2048,16,64,128,1,4,5,506.3086666666666,3
w13,8,128,6,4096,2048,16,64,128,1,8,3,508.26099999999997,3
w13,8,128,6,4096,2048,16,64,128,16,4,5,507.19399999999996,3
w13,8,128,6,4096,2048,16,64,128,16,8,5,508.05833333333334,3
w13,8,128,6,4096,2048,16,64,128,32,4,5,507.76,3
w13,8,128,6,4096,2048,16,64,128,64,4,5,507.728,3
w13,8,128,6,4096,2048,16,64,256,1,4,3,508.31466666666665,3
w13,8,128,6,4096,2048,16,64,256,1,4,5,506.384,3
w13,8,128,6,4096,2048,16,64,256,1,8,5,507.96233333333333,3
w13,8,128,6,4096,2048,16,64,256,16,4,3,508.25066666666663,3
w13,8,128,6,4096,2048,16,64,256,16,4,5,507.84499999999997,3
w13,8,128,6,4096,2048,16,64,256,16,8,2,508.208,3
w13,8,128,6,4096,2048,16,64,256,32,4,5,508.336,3
w13,8,128,6,4096,2048,16,64,256,64,8,2,508.3036666666667,3
w13,8,128,6,4096,2048,16,128,128,64,4,4,508.4636666666667,3
w13,8,128,6,4096,2048,16,128,128,64,8,2,508.15433333333334,3
w13,8,128,6,4096,2048,16,128,128,64,8,4,507.78133333333335,3
w13,8,128,6,4096,2048,32,128,128,4,8,4,508.29300000000006,3
w13,8,128,6,4096,2048,32,128,128,32,4,3,508.6236666666667,3
w13,8,128,6,4096,2048,64,64,64,1,4,5,508.603,3
w13,8,128,6,4096,2048,64,64,128,1,4,3,508.00499999999994,3
w13,8,128,6,4096,2048,64,64,128,16,4,3,508.5063333333333,3
w13,8,128,6,4096,2048,64,128,128,1,8,4,508.34666666666664,3
w13,8,128,6,4096,2048,64,128,128,4,8,4,507.91966666666667,3
w13,8,128,6,4096,2048,64,128,128,16,8,4,508.3786666666667,3
w13,8,128,6,4096,2048,64,128,128,32,8,4,508.6023333333333,3
w13,8,128,8,2048,768,16,32,128,1,4,5,130.557,3
w13,8,128,8,2048,768,16,32,128,4,4,2,130.59966666666665,3
w13,8,128,8,2048,768,16,32,128,64,4,5,130.66366666666667,3
w13,8,128,8,2048,768,16,32,256,1,4,2,130.61066666666667,3
w13,8,128,8,2048,768,16,32,256,16,4,2,130.82366666666667,3
w13,8,128,8,2048,768,16,32,256,64,4,2,130.82366666666667,3
w13,8,128,8,2048,768,16,64,128,1,8,3,130.85533333333333,3
w13,8,128,8,2048,768,16,64,128,16,8,3,130.46066666666667,3
w13,8,128,8,2048,768,16,64,256,1,4,2,130.73833333333334,3
w13,8,128,8,2048,768,16,128,128,1,8,2,130.20466666666667,3
w13,8,128,8,2048,768,16,128,128,16,8,2,130.64233333333334,3
w13,8,128,8,4096,1536,16,32,128,1,4,3,507.6956666666667,3
w13,8,128,8,4096,1536,16,32,128,1,4,5,507.2906666666667,3
w13,8,128,8,4096,1536,16,32,128,4,4,5,506.3833333333334,3
w13,8,128,8,4096,1536,16,32,128,16,4,5,506.8956666666666,3
w13,8,128,8,4096,1536,16,32,128,32,4,5,507.40766666666667,3
w13,8,128,8,4096,1536,16,32,128,64,4,5,507.22633333333334,3
w13,8,128,8,4096,1536,16,32,256,1,4,3,507.1623333333334,3
w13,8,128,8,4096,1536,16,32,256,1,4,4,506.9916666666666,3
w13,8,128,8,4096,1536,16,32,256,1,4,5,505.8503333333333,3
w13,8,128,8,4096,1536,16,32,256,16,4,3,507.1623333333334,3
w13,8,128,8,4096,1536,16,32,256,16,4,5,506.917,3
w13,8,128,8,4096,1536,16,32,256,32,4,3,507.7916666666667,3
w13,8,128,8,4096,1536,16,32,256,32,4,5,507.66366666666664,3
w13,8,128,8,4096,1536,16,32,256,64,4,5,508.0796666666667,3
w13,8,128,8,4096,1536,16,64,128,1,4,5,505.71133333333336,3
w13,8,128,8,4096,1536,16,64,128,16,4,5,507.68533333333335,3
w13,8,128,8,4096,1536,16,64,128,64,4,5,507.6746666666666,3
w13,8,128,8,4096,1536,16,64,256,1,4,3,508.06933333333336,3
w13,8,128,8,4096,1536,16,64,256,1,4,4,507.9943333333333,3
w13,8,128,8,4096,1536,16,64,256,1,4,5,506.5333333333333,3
w13,8,128,8,4096,1536,16,64,256,1,8,2,508.165,3
w13,8,128,8,4096,1536,16,64,256,1,8,5,507.7056666666667,3
w13,8,128,8,4096,1536,16,64,256,16,4,5,507.237,3
w13,8,128,8,4096,1536,64,64,128,1,4,3,508.0366666666667,3
w13,8,128,8,4096,1536,64,128,128,1,8,4,508.037,3
w13,8,128,8,4096,1536,64,128,128,32,8,4,508.0903333333333,3
w13,8,128,8,4096,3072,16,16,256,1,4,4,1009.3853333333333,3
w13,8,128,8,4096,3072,16,16,256,1,4,5,1007.9773333333333,3
w13,8,128,8,4096,3072,16,16,256,4,4,4,1009.0433333333334,3
w13,8,128,8,4096,3072,16,16,256,4,4,5,1008.297,3
w13,8,128,8,4096,3072,16,32,128,1,4,5,1006.9423333333334,3
w13,8,128,8,4096,3072,16,32,128,4,4,5,1007.0063333333333,3
w13,8,128,8,4096,3072,16,32,128,16,4,5,1009.0756666666666,3
w13,8,128,8,4096,3072,16,32,128,32,4,5,1008.6063333333333,3
w13,8,128,8,4096,3072,16,32,128,64,4,5,1008.4143333333333,3
w13,8,128,8,4096,3072,16,32,256,1,4,2,1008.5853333333333,3
w13,8,128,8,4096,3072,16,32,256,1,4,3,1005.5453333333334,3
w13,8,128,8,4096,3072,16,32,256,1,4,4,1008.212,3
w13,8,128,8,4096,3072,16,32,256,1,4,5,1005.0863333333333,3
w13,8,128,8,4096,3072,16,32,256,1,8,5,1009.044,3
w13,8,128,8,4096,3072,16,32,256,16,4,3,1007.8276666666667,3
w13,8,128,8,4096,3072,16,32,256,16,4,4,1008.5426666666667,3
w13,8,128,8,4096,3072,16,32,256,16,4,5,1004.7663333333334,3
w13,8,128,8,4096,3072,16,32,256,32,4,4,1009.812,3
w13,8,128,8,4096,3072,16,32,256,32,4,5,1006.6223333333334,3
w13,8,128,8,4096,3072,16,32,256,64,4,3,1008.5103333333333,3
w13,8,128,8,4096,3072,16,32,256,64,4,5,1007.4653333333332,3
w13,8,128,8,4096,3072,16,64,128,1,4,4,1007.337,3
w13,8,128,8,4096,3072,16,64,128,1,4,5,1004.8090000000001,3
w13,8,128,8,4096,3072,16,64,128,1,8,5,1007.8916666666668,3
w13,8,128,8,4096,3072,16,64,128,16,4,4,1009.1186666666667,3
w13,8,128,8,4096,3072,16,64,128,16,4,5,1007.0383333333333,3
w13,8,128,8,4096,3072,16,64,128,16,8,5,1008.2973333333333,3
w13,8,128,8,4096,3072,16,64,128,32,4,5,1008.0196666666667,3
w13,8,128,8,4096,3072,16,64,128,32,8,5,1009.3746666666666,3
w13,8,128,8,4096,3072,16,64,128,64,4,4,1009.556,3
w13,8,128,8,4096,3072,16,64,128,64,4,5,1008.66,3
w13,8,128,8,4096,3072,16,64,128,64,8,5,1008.9053333333333,3
w13,8,128,8,4096,3072,16,64,256,1,4,3,1005.2463333333334,3
w13,8,128,8,4096,3072,16,64,256,1,4,4,1005.4276666666666,3
w13,8,128,8,4096,3072,16,64,256,1,4,5,1005.2356666666666,3
w13,8,128,8,4096,3072,16,64,256,1,8,3,1008.6276666666666,3
w13,8,128,8,4096,3072,16,64,256,1,8,4,1005.6093333333333,3
w13,8,128,8,4096,3072,16,64,256,1,8,5,1005.7370000000001,3
w13,8,128,8,4096,3072,16,64,256,16,4,3,1007.8386666666667,3
w13,8,128,8,4096,3072,16,64,256,16,4,4,1006.526,3
w13,8,128,8,4096,3072,16,64,256,16,4,5,1005.2570000000001,3
w13,8,128,8,4096,3072,16,64,256,16,8,4,1007.4543333333335,3
w13,8,128,8,4096,3072,16,64,256,16,8,5,1006.0676666666667,3
w13,8,128,8,4096,3072,16,64,256,32,4,3,1008.5636666666666,3
w13,8,128,8,4096,3072,16,64,256,32,4,4,1008.8623333333334,3
w13,8,128,8,4096,3072,16,64,256,32,4,5,1006.185,3
w13,8,128,8,4096,3072,16,64,256,32,8,4,1009.5233333333332,3
w13,8,128,8,4096,3072,16,64,256,32,8,5,1007.2303333333333,3
w13,8,128,8,4096,3072,16,64,256,64,4,3,1009.6623333333333,3
w13,8,128,8,4096,3072,16,64,256,64,4,5,1008.116,3
w13,8,128,8,4096,3072,16,128,128,1,4,5,1008.7986666666666,3
w13,8,128,8,4096,3072,16,128,128,1,8,4,1009.1503333333334,3
w13,8,128,8,4096,3072,16,128,128,1,8,5,1006.2486666666667,3
w13,8,128,8,4096,3072,16,128,128,16,4,5,1009.1186666666666,3
w13,8,128,8,4096,3072,16,128,128,16,8,5,1009.4916666666667,3
w13,8,128,8,4096,3072,16,128,128,32,4,5,1008.18,3
w13,8,128,8,4096,3072,16,128,128,32,8,5,1009.0866666666667,3
w13,8,128,8,4096,3072,16,128,128,64,8,5,1009.1610000000001,3
w13,8,128,8,4096,3072,32,32,128,1,4,4,1009.2893333333333,3
w13,8,128,8,4096,3072,32,32,128,1,4,5,1008.6063333333333,3
w13,8,128,8,4096,3072,32,32,128,4,4,5,1006.7719999999999,3
w13,8,128,8,4096,3072,32,32,128,16,4,5,1008.393,3
w13,8,128,8,4096,3072,32,32,256,1,4,4,1007.6886666666666,3
w13,8,128,8,4096,3072,32,32,256,4,4,3,1009.3213333333333,3
w13,8,128,8,4096,3072,32,32,256,4,4,4,1008.3183333333333,3
w13,8,128,8,4096,3072,32,32,256,16,4,4,1009.342,3
w13,8,128,8,4096,3072,32,64,256,1,8,3,1009.5343333333334,3
w13,8,128,8,4096,3072,32,64,256,1,8,4,1009.0753333333333,3
w13,8,128,8,4096,3072,32,64,256,1,8,5,1008.116,3
w13,8,128,8,4096,3072,32,64,256,8,8,3,1009.6626666666666,3
w13,8,128,8,4096,3072,32,64,256,8,8,5,1009.2673333333333,3
w13,8,128,8,4096,3072,32,64,256,16,8,5,1008.7449999999999,3
w13,8,128,8,4096,3072,32,128,128,1,4,4,1007.4436666666667,3
w13,8,128,8,4096,3072,32,128,128,1,4,5,1008.3503333333333,3
w13,8,128,8,4096,3072,32,128,128,1,8,5,1008.2220000000001,3
w13,8,128,8,4096,3072,32,128,128,4,4,4,1008.2866666666667,3
w13,8,128,8,4096,3072,32,128,128,4,4,5,1009.5663333333333,3
w13,8,128,8,4096,3072,32,128,128,8,4,4,1008.18,3
w13,8,128,8,4096,3072,32,128,128,8,4,5,1008.5636666666666,3
w13,8,128,8,4096,3072,32,128,128,8,8,5,1009.7266666666666,3
w13,8,128,8,4096,3072,32,128,128,16,4,4,1009.236,3
w13,8,128,8,4096,3072,32,128,128,16,4,5,1008.3183333333333,3
w13,8,128,8,4096,3072,32,128,128,32,4,4,1009.5450000000001,3
w13,8,128,8,4096,3072,32,128,128,32,4,5,1009.0543333333334,3
w13,8,128,8,4096,3072,32,128,128,32,8,5,1009.7906666666667,3
w13,8,128,8,4096,3072,64,128,128,1,8,4,1007.7533333333334,3
w13,8,128,8,4096,3072,64,128,128,4,8,4,1007.38,3
w13,16,8,2,1024,512,16,64,128,16,8,3,5.527666666666666,3
w13,16,8,2,1024,512,16,64,128,32,8,3,5.517,3
w13,16,8,2,1024,512,16,64,128,64,8,3,5.527333333333334,3
w13,16,16,2,1536,768,16,32,128,4,4,2,27.285,3
w13,16,16,4,1536,1024,16,32,64,64,4,3,35.81,3
w13,16,16,4,1536,1024,16,32,128,1,4,2,35.661,3
w13,16,16,4,1536,1024,16,32,128,16,4,2,35.65,3
w13,16,16,4,1536,1024,16,32,128,64,4,2,35.74633333333333,3
w13,16,16,4,1536,1024,16,64,64,1,4,3,35.821,3
w13,16,32,4,2048,768,16,64,64,16,4,3,67.661,3
w13,16,32,4,2048,768,16,64,128,16,4,2,67.37266666666666,3
w13,16,32,4,2048,768,16,64,128,32,4,2,67.63966666666666,3
w13,16,32,4,2048,768,16,64,128,64,4,2,67.70366666666666,3
w13,16,32,6,3072,1024,16,32,128,4,4,2,131.39466666666667,3
w13,16,32,6,3072,1024,16,32,128,16,4,2,131.78933333333333,3
w13,16,32,6,3072,1024,16,32,128,32,4,2,131.587,3
w13,16,60,4,2048,1408,16,32,128,1,4,5,221.20899999999997,3
w13,16,60,4,2048,1408,16,32,128,4,4,5,221.15566666666666,3
w13,16,60,4,2048,1408,16,32,256,1,4,2,220.782,3
w13,16,60,4,2048,1408,16,32,256,1,4,3,220.56933333333333,3
w13,16,60,4,2048,1408,16,32,256,1,4,4,221.6676666666667,3
w13,16,60,4,2048,1408,16,32,256,1,4,5,221.3793333333333,3
w13,16,60,4,2048,1408,16,32,256,16,4,2,220.88866666666664,3
w13,16,60,4,2048,1408,16,32,256,16,4,3,221.33633333333333,3
w13,16,60,4,2048,1408,16,32,256,16,4,5,221.43266666666668,3
w13,16,60,4,2048,1408,16,64,128,1,4,2,221.58233333333337,3
w13,16,60,4,2048,1408,16,64,128,1,4,4,221.54,3
w13,16,60,4,2048,1408,16,64,128,1,4,5,220.7603333333333,3
w13,16,60,4,2048,1408,16,64,128,1,8,3,221.45366666666666,3
w13,16,60,4,2048,1408,16,64,128,1,8,5,220.94233333333332,3
w13,16,60,4,2048,1408,16,64,128,16,4,4,221.19833333333335,3
w13,16,60,4,2048,1408,16,64,128,16,4,5,220.6003333333333,3
w13,16,60,4,2048,1408,16,64,128,16,8,2,221.486,3
w13,16,60,4,2048,1408,16,64,128,32,4,3,221.36933333333332,3
w13,16,60,4,2048,1408,16,64,128,32,4,4,221.28333333333333,3
w13,16,60,4,2048,1408,16,64,128,32,8,3,221.11233333333334,3
w13,16,60,4,2048,1408,16,64,128,32,8,5,221.20866666666666,3
w13,16,60,4,2048,1408,16,64,128,64,8,3,221.51833333333335,3
w13,16,60,4,2048,1408,16,64,256,1,4,2,221.64633333333336,3
w13,16,60,4,2048,1408,16,64,256,1,8,3,221.45466666666667,3
w13,16,60,4,2048,1408,16,64,256,16,4,2,221.31566666666666,3
w13,16,60,4,2048,1408,16,64,256,16,4,3,221.12400000000002,3
w13,16,60,4,2048,1408,16,64,256,16,8,3,220.82500000000002,3
w13,16,60,4,2048,1408,16,128,128,1,8,5,221.48566666666667,3
w13,16,60,6,3584,2304,16,32,128,1,4,5,623.612,3
w13,16,60,6,3584,2304,16,32,128,4,4,5,624.5503333333332,3
w13,16,60,6,3584,2304,16,32,128,16,4,5,624.1126666666667,3
w13,16,60,6,3584,2304,16,32,128,32,4,5,624.6033333333334,3
w13,16,60,6,3584,2304,16,32,128,64,4,5,625.766,3
w13,16,60,6,3584,2304,16,32,256,1,4,2,624.5823333333333,3
w13,16,60,6,3584,2304,16,32,256,1,4,3,623.4093333333334,3
w13,16,60,6,3584,2304,16,32,256,1,4,4,623.9526666666667,3
w13,16,60,6,3584,2304,16,32,256,1,4,5,622.641,3
w13,16,60,6,3584,2304,16,32,256,16,4,2,625.105,3
w13,16,60,6,3584,2304,16,32,256,16,4,3,625.0193333333333,3
w13,16,60,6,3584,2304,16,32,256,16,4,4,623.975,3
w13,16,60,6,3584,2304,16,32,256,16,4,5,624.102,3
w13,16,60,6,3584,2304,16,32,256,32,4,2,625.7453333333334,3
w13,16,60,6,3584,2304,16,32,256,32,4,3,624.806,3
w13,16,60,6,3584,2304,16,32,256,32,4,5,625.255,3
w13,16,60,6,3584,2304,16,32,256,64,4,2,625.7669999999999,3
w13,16,60,6,3584,2304,16,64,128,1,4,4,625.2966666666666,3
w13,16,60,6,3584,2304,16,64,128,1,4,5,623.654,3
w13,16,60,6,3584,2304,16,64,128,1,8,5,624.679,3
w13,16,60,6,3584,2304,16,64,128,16,4,5,624.2416666666667,3
w13,16,60,6,3584,2304,16,64,128,16,8,5,624.1883333333334,3
w13,16,60,6,3584,2304,16,64,128,32,4,5,624.0916666666667,3
w13,16,60,6,3584,2304,16,64,128,32,8,5,623.9206666666668,3
w13,16,60,6,3584,2304,16,64,128,64,8,5,625.447,3
w13,16,60,6,3584,2304,16,64,256,1,4,3,623.8353333333333,3
w13,16,60,6,3584,2304,16,64,256,1,4,4,625.2866666666667,3
w13,16,60,6,3584,2304,16,64,256,1,4,5,624.4540000000001,3
w13,16,60,6,3584,2304,16,64,256,1,8,2,625.703,3
w13,16,60,6,3584,2304,16,64,256,1,8,3,623.2810000000001,3
w13,16,60,6,3584,2304,16,64,256,1,8,5,624.487,3
w13,16,60,6,3584,2304,16,64,256,16,4,3,624.6893333333334,3
w13,16,60,6,3584,2304,16,64,256,16,4,5,624.8386666666667,3
w13,16,60,6,3584,2304,16,64,256,16,8,3,624.2833333333333,3
w13,16,60,6,3584,2304,16,64,256,16,8,5,625.2006666666666,3
w13,16,60,6,3584,2304,16,64,256,32,4,3,624.6146666666667,3
w13,16,60,6,3584,2304,16,64,256,32,8,3,624.945,3
w13,16,60,6,3584,2304,16,64,256,64,8,3,624.5179999999999,3
w13,16,60,6,3584,2304,16,128,128,1,8,5,623.0463333333333,3
w13,16,60,6,3584,2304,16,128,128,16,8,5,623.4843333333333,3
w13,16,60,6,3584,2304,16,128,128,32,8,5,624.2946666666667,3
w13,16,60,6,3584,2304,16,128,128,64,8,5,624.7743333333334,3
w13,16,60,6,3584,2304,32,32,128,4,4,4,625.6276666666666,3
w13,16,60,6,3584,2304,32,128,128,1,4,3,625.3723333333334,3
w13,16,60,6,3584,2304,32,128,128,1,8,3,625.4466666666667,3
w13,16,60,8,2048,1536,16,32,128,1,4,2,241.284,3
w13,16,60,8,2048,1536,16,32,128,1,4,5,241.977,3
w13,16,60,8,2048,1536,16,32,128,4,4,2,240.92033333333333,3
w13,16,60,8,2048,1536,16,32,128,16,4,2,241.571,3
w13,16,60,8,2048,1536,16,32,128,16,4,5,241.924,3
w13,16,60,8,2048,1536,16,32,128,32,4,5,241.90200000000002,3
w13,16,60,8,2048,1536,16,32,128,64,4,2,241.731,3
w13,16,60,8,2048,1536,16,32,256,1,4,3,241.62466666666668,3
w13,16,60,8,2048,1536,16,32,256,16,4,3,241.508,3
w13,16,60,8,2048,1536,16,32,256,32,4,3,242.03,3
w13,16,60,8,2048,1536,16,64,128,1,4,4,241.68933333333334,3
w13,16,60,8,2048,1536,16,64,128,1,4,5,240.87800000000001,3
w13,16,60,8,2048,1536,16,64,128,1,8,5,241.51833333333335,3
w13,16,60,8,2048,1536,16,64,128,16,4,2,241.9766666666667,3
w13,16,60,8,2048,1536,16,64,128,16,4,5,241.54999999999998,3
w13,16,60,8,2048,1536,16,64,128,32,4,2,241.475,3
w13,16,60,8,2048,1536,16,64,128,32,4,4,241.9766666666667,3
w13,16,60,8,2048,1536,16,64,128,32,4,5,241.68833333333336,3
w13,16,60,8,2048,1536,16,64,128,64,4,2,241.84833333333333,3
w13,16,60,8,2048,1536,16,64,256,1,4,3,241.92333333333332,3
w13,16,60,8,2048,1536,16,64,256,1,8,3,241.891,3
w13,16,60,8,2048,1536,16,128,128,1,4,2,241.70966666666666,3
w13,16,60,8,2048,1536,16,128,128,1,8,2,241.47566666666668,3
w13,16,60,8,2048,1536,16,128,128,1,8,5,241.923,3
w13,16,60,8,2048,1536,16,128,128,16,8,5,242.04133333333334,3
w13,16,64,6,3072,2048,16,32,128,1,4,5,508.63533333333334,3
w13,16,64,6,3072,2048,16,32,128,4,4,5,509.85100000000006,3
w13,16,64,6,3072,2048,16,32,256,1,4,4,507.79266666666666,3
w13,16,64,6,3072,2048,16,32,256,1,4,5,507.38633333333337,3
w13,16,64,6,3072,2048,16,32,256,16,4,4,508.2716666666667,3
w13,16,64,6,3072,2048,16,32,256,16,4,5,508.02700000000004,3
w13,16,64,6,3072,2048,16,32,256,32,4,4,508.67766666666665,3
w13,16,64,6,3072,2048,16,32,256,32,4,5,508.933,3
w13,16,64,6,3072,2048,16,64,128,1,4,4,509.30733333333336,3
w13,16,64,6,3072,2048,16,64,128,1,4,5,509.03,3
w13,16,64,6,3072,2048,16,64,256,1,4,3,509.382,3
w13,16,64,6,3072,2048,16,64,256,1,4,4,509.126,3
w13,16,64,6,3072,2048,16,64,256,1,4,5,507.99500000000006,3
w13,16,64,6,3072,2048,16,64,256,1,8,4,509.926,3
w13,16,64,6,3072,2048,16,64,256,1,8,5,508.86966666666666,3
w13,16,64,6,3072,2048,16,64,256,16,4,5,509.2316666666666,3
w13,16,64,6,3072,2048,16,64,256,16,8,5,509.2006666666667,3
w13,16,64,6,3072,2048,16,128,128,16,8,5,509.57300000000004,3
w13,16,64,6,3584,1536,16,32,128,1,4,3,446.37266666666665,3
w13,16,64,6,3584,1536,16,32,128,4,4,3,446.416,3
w13,16,64,6,3584,1536,16,32,128,16,4,5,447.15200000000004,3
w13,16,64,6,3584,1536,16,32,128,32,4,5,446.9703333333334,3
w13,16,64,6,3584,1536,16,32,128,64,4,3,447.02366666666666,3
w13,16,64,6,3584,1536,16,32,256,1,4,2,445.89300000000003,3
w13,16,64,6,3584,1536,16,32,256,1,4,3,446.7463333333333,3
w13,16,64,6,3584,1536,16,32,256,1,4,4,445.3063333333334,3
w13,16,64,6,3584,1536,16,32,256,1,4,5,445.6366666666666,3
w13,16,64,6,3584,1536,16,32,256,16,4,2,447.11966666666666,3
w13,16,64,6,3584,1536,16,32,256,16,4,4,446.181,3
w13,16,64,6,3584,1536,16,32,256,16,4,5,446.373,3
w13,16,64,6,3584,1536,16,32,256,32,4,2,447.49333333333334,3
w13,16,64,6,3584,1536,16,32,256,32,4,4,446.5116666666666,3
w13,16,64,6,3584,1536,16,32,256,64,4,2,447.397,3
w13,16,64,6,3584,1536,16,64,128,1,4,3,447.173,3
w13,16,64,6,3584,1536,16,64,128,1,4,4,446.789,3
w13,16,64,6,3584,1536,16,64,256,1,4,3,446.469,3
w13,16,64,6,3584,1536,16,64,256,1,4,5,446.90633333333335,3
w13,16,64,6,3584,1536,16,64,256,1,8,2,447.237,3
w13,16,64,6,3584,1536,16,64,256,1,8,3,447.2373333333333,3
w13,16,64,6,3584,1536,16,64,256,1,8,5,446.36266666666666,3
w13,16,64,6,3584,1536,16,64,256,32,4,3,447.3546666666667,3
w13,16,64,6,3584,1536,16,128,128,1,8,5,446.83166666666665,3
w13,16,64,6,3584,1536,16,128,128,16,8,2,446.2556666666667,3
w13,16,64,6,3584,1536,32,128,128,1,4,3,447.1093333333333,3
w13,16,64,8,3584,2560,16,32,128,1,4,5,739.8366666666667,3
w13,16,64,8,3584,2560,16,32,128,4,4,5,739.2816666666666,3
w13,16,64,8,3584,2560,16,32,128,16,4,5,740.8076666666666,3
w13,16,64,8,3584,2560,16,32,256,1,4,2,739.9113333333333,3
w13,16,64,8,3584,2560,16,32,256,1,4,3,738.7599999999999,3
w13,16,64,8,3584,2560,16,32,256,1,4,4,739.0043333333333,3
w13,16,64,8,3584,2560,16,32,256,1,4,5,737.3829999999999,3
w13,16,64,8,3584,2560,16,32,256,16,4,3,740.8076666666666,3
w13,16,64,8,3584,2560,16,32,256,16,4,4,739.688,3
w13,16,64,8,3584,2560,16,32,256,16,4,5,738.9623333333334,3
w13,16,64,8,3584,2560,16,32,256,32,4,5,740.4016666666666,3
w13,16,64,8,3584,2560,16,64,128,1,4,5,737.181,3
w13,16,64,8,3584,2560,16,64,128,1,8,5,738.386,3
w13,16,64,8,3584,2560,16,64,128,16,4,5,738.8656666666666,3
w13,16,64,8,3584,2560,16,64,128,16,8,5,739.645,3
w13,16,64,8,3584,2560,16,64,128,32,4,5,740.3803333333334,3
w13,16,64,8,3584,2560,16,64,128,32,8,5,740.7643333333332,3
w13,16,64,8,3584,2560,16,64,256,1,4,3,738.7376666666668,3
w13,16,64,8,3584,2560,16,64,256,1,4,4,740.2106666666667,3
w13,16,64,8,3584,2560,16,64,256,1,4,5,738.2046666666666,3
w13,16,64,8,3584,2560,16,64,256,1,8,2,740.1350000000001,3
w13,16,64,8,3584,2560,16,64,256,1,8,3,738.9193333333333,3
w13,16,64,8,3584,2560,16,64,256,1,8,4,739.9653333333332,3
w13,16,64,8,3584,2560,16,64,256,1,8,5,738.375,3
w13,16,64,8,3584,2560,16,64,256,16,4,3,739.527,3
w13,16,64,8,3584,2560,16,64,256,16,4,5,740.4126666666667,3
w13,16,64,8,3584,2560,16,64,256,16,8,3,738.6633333333334,3
w13,16,64,8,3584,2560,16,128,128,1,4,5,739.581,3
w13,16,64,8,3584,2560,16,128,128,1,8,5,738.0663333333333,3
w13,16,64,8,3584,2560,16,128,128,16,8,5,739.6126666666665,3
w13,16,64,8,3584,2560,32,32,128,1,4,4,740.4336666666667,3
w13,16,64,8,3584,2560,32,32,128,4,4,4,740.3166666666666,3
w13,16,64,8,3584,2560,32,64,256,1,8,3,740.861,3
w13,16,64,8,3584,2560,32,64,256,1,8,5,740.6156666666666,3
w13,16,64,8,3584,2560,32,128,128,1,8,5,740.3593333333333,3
w13,16,64,8,3584,2560,32,128,128,4,4,5,740.7966666666666,3
w13,16,128,4,2048,512,16,32,128,1,4,5,89.10833333333333,3
w13,16,128,4,2048,512,16,32,128,4,4,2,88.927,3
w13,16,128,4,2048,512,16,32,128,4,4,5,88.85266666666666,3
w13,16,128,4,2048,512,16,32,128,16,4,2,89.06599999999999,3
w13,16,128,4,2048,512,16,32,128,32,4,2,88.714,3
w13,16,128,4,2048,512,16,32,256,1,4,3,88.927,3
w13,16,128,4,2048,512,16,64,128,1,4,5,88.906,3
w13,16,128,4,2048,512,16,64,128,1,8,3,88.86333333333334,3
w13,16,128,4,2048,512,16,64,128,16,4,3,89.03399999999999,3
w13,16,128,4,2048,512,16,64,128,16,8,3,88.87399999999998,3
w13,16,128,4,2048,512,16,64,128,64,8,3,89.03399999999999,3
w13,16,128,6,4096,2048,16,16,256,1,4,4,1009.0006666666667,3
w13,16,128,6,4096,2048,16,16,256,1,4,5,1008.649,3
w13,16,128,6,4096,2048,16,16,256,4,4,4,1008.2113333333333,3
w13,16,128,6,4096,2048,16,16,256,4,4,5,1008.3816666666667,3
w13,16,128,6,4096,2048,16,32,128,1,4,5,1005.9926666666667,3
w13,16,128,6,4096,2048,16,32,128,4,4,5,1006.9733333333334,3
w13,16,128,6,4096,2048,16,32,128,16,4,5,1008.7233333333334,3
w13,16,128,6,4096,2048,16,32,128,32,4,5,1006.7073333333333,3
w13,16,128,6,4096,2048,16,32,256,1,4,2,1008.6596666666668,3
w13,16,128,6,4096,2048,16,32,256,1,4,3,1005.7796666666667,3
w13,16,128,6,4096,2048,16,32,256,1,4,4,1006.7716666666666,3
w13,16,128,6,4096,2048,16,32,256,1,4,5,1004.3823333333333,3
w13,16,128,6,4096,2048,16,32,256,1,8,5,1007.71,3
w13,16,128,6,4096,2048,16,32,256,16,4,3,1006.9526666666667,3
w13,16,128,6,4096,2048,16,32,256,16,4,4,1008.7130000000001,3
w13,16,128,6,4096,2048,16,32,256,16,4,5,1006.1316666666667,3
w13,16,128,6,4096,2048,16,32,256,32,4,2,1008.1263333333333,3
w13,16,128,6,4096,2048,16,32,256,32,4,3,1007.2510000000001,3
w13,16,128,6,4096,2048,16,32,256,32,4,4,1007.6139999999999,3
w13,16,128,6,4096,2048,16,32,256,32,4,5,1007.3149999999999,3
w13,16,128,6,4096,2048,16,32,256,64,4,3,1007.7743333333333,3
w13,16,128,6,4096,2048,16,32,256,64,4,4,1008.4566666666666,3
w13,16,128,6,4096,2048,16,32,256,64,4,5,1008.0300000000001,3
w13,16,128,6,4096,2048,16,64,128,1,4,4,1007.049,3
w13,16,128,6,4096,2048,16,64,128,1,4,5,1005.79,3
w13,16,128,6,4096,2048,16,64,128,1,8,3,1008.947,3
w13,16,128,6,4096,2048,16,64,128,16,4,5,1005.8966666666666,3
w13,16,128,6,4096,2048,16,64,128,16,8,5,1007.3580000000001,3
w13,16,128,6,4096,2048,16,64,128,32,4,5,1007.9446666666666,3
w13,16,128,6,4096,2048,16,64,128,32,8,5,1007.3046666666665,3
w13,16,128,6,4096,2048,16,64,128,64,4,4,1008.0623333333333,3
w13,16,128,6,4096,2048,16,64,128,64,4,5,1006.8566666666667,3
w13,16,128,6,4096,2048,16,64,128,64,8,5,1007.9336666666667,3
w13,16,128,6,4096,2048,16,64,256,1,4,3,1006.4829999999998,3
w13,16,128,6,4096,2048,16,64,256,1,4,4,1006.281,3
w13,16,128,6,4096,2048,16,64,256,1,4,5,1003.9876666666665,3
w13,16,128,6,4096,2048,16,64,256,1,8,3,1007.966,3
w13,16,128,6,4096,2048,16,64,256,1,8,4,1006.355,3
w13,16,128,6,4096,2048,16,64,256,1,8,5,1005.5233333333332,3
w13,16,128,6,4096,2048,16,64,256,16,4,3,1006.2806666666667,3
w13,16,128,6,4096,2048,16,64,256,16,4,5,1007.23,3
w13,16,128,6,4096,2048,16,64,256,16,8,4,1008.361,3
w13,16,128,6,4096,2048,16,64,256,16,8,5,1006.953,3
w13,16,128,6,4096,2048,16,64,256,32,4,2,1008.4463333333333,3
w13,16,128,6,4096,2048,16,64,256,32,4,3,1007.4113333333333,3
w13,16,128,6,4096,2048,16,64,256,32,4,4,1007.614,3
w13,16,128,6,4096,2048,16,64,256,32,4,5,1006.9736666666666,3
w13,16,128,6,4096,2048,16,64,256,32,8,5,1009.0326666666666,3
w13,16,128,6,4096,2048,16,64,256,64,4,3,1006.8243333333334,3
w13,16,128,6,4096,2048,16,64,256,64,4,5,1008.6060000000001,3
w13,16,128,6,4096,2048,16,128,128,1,4,5,1007.8063333333333,3
w13,16,128,6,4096,2048,16,128,128,1,8,5,1006.814,3
w13,16,128,6,4096,2048,16,128,128,16,4,5,1007.518,3
w13,16,128,6,4096,2048,16,128,128,16,8,5,1008.5736666666667,3
w13,16,128,6,4096,2048,16,128,128,32,4,5,1008.1686666666666,3
w13,16,128,6,4096,2048,16,128,128,32,8,4,1008.9900000000001,3
w13,16,128,6,4096,2048,16,128,128,32,8,5,1008.8406666666666,3
w13,16,128,6,4096,2048,16,128,128,64,4,5,1008.6700000000001,3
w13,16,128,6,4096,2048,16,128,128,64,8,5,1008.8513333333334,3
w13,16,128,6,4096,2048,32,32,128,1,4,5,1008.9683333333332,3
w13,16,128,6,4096,2048,32,32,128,4,4,5,1008.5103333333333,3
w13,16,128,6,4096,2048,32,32,256,1,4,3,1008.489,3
w13,16,128,6,4096,2048,32,32,256,1,4,4,1008.1363333333333,3
w13,16,128,6,4096,2048,32,32,256,4,4,3,1008.8829999999999,3
w13,16,128,6,4096,2048,32,32,256,4,4,4,1008.19,3
w13,16,128,6,4096,2048,32,64,128,32,4,3,1008.7873333333333,3
w13,16,128,6,4096,2048,32,64,256,1,8,5,1007.763,3
w13,16,128,6,4096,2048,32,64,256,8,8,3,1007.966,3
w13,16,128,6,4096,2048,32,64,256,8,8,5,1008.7023333333333,3
w13,16,128,6,4096,2048,32,128,128,1,4,4,1008.158,3
w13,16,128,6,4096,2048,32,128,128,1,4,5,1008.5846666666666,3
w13,16,128,6,4096,2048,32,128,128,1,8,5,1008.9900000000001,3
w13,16,128,6,4096,2048,32,128,128,4,4,5,1007.6673333333333,3
w13,16,128,6,4096,2048,32,128,128,16,4,5,1008.8726666666666,3
w13,16,128,8,2048,768,16,32,128,1,4,3,256.31333333333333,3
w13,16,128,8,2048,768,16,32,128,1,4,5,255.90766666666664,3
w13,16,128,8,2048,768,16,32,128,4,4,3,257.0593333333333,3
w13,16,128,8,2048,768,16,32,128,4,4,4,256.65433333333334,3
w13,16,128,8,2048,768,16,32,128,4,4,5,256.4303333333333,3
w13,16,128,8,2048,768,16,32,128,16,4,4,257.0813333333333,3
w13,16,128,8,2048,768,16,32,128,16,4,5,256.7183333333333,3
w13,16,128,8,2048,768,16,32,128,32,4,5,256.88899999999995,3
w13,16,128,8,2048,768,16,32,128,64,4,5,256.7716666666667,3
w13,16,128,8,2048,768,16,32,256,1,4,2,256.537,3
w13,16,128,8,2048,768,16,32,256,1,4,3,256.06733333333335,3
w13,16,128,8,2048,768,16,32,256,1,4,4,256.3343333333333,3
w13,16,128,8,2048,768,16,32,256,1,4,5,256.65433333333334,3
w13,16,128,8,2048,768,16,32,256,16,4,2,256.3453333333333,3
w13,16,128,8,2048,768,16,32,256,16,4,3,255.80100000000002,3
w13,16,128,8,2048,768,16,32,256,16,4,4,256.8573333333334,3
w13,16,128,8,2048,768,16,32,256,32,4,2,255.876,3
w13,16,128,8,2048,768,16,32,256,32,4,3,256.836,3
w13,16,128,8,2048,768,16,32,256,64,4,2,256.31333333333333,3
w13,16,128,8,2048,768,16,32,256,64,4,3,256.953,3
w13,16,128,8,2048,768,16,64,128,1,4,3,256.59066666666666,3
w13,16,128,8,2048,768,16,64,128,1,4,4,255.96133333333333,3
w13,16,128,8,2048,768,16,64,128,1,4,5,256.1423333333333,3
w13,16,128,8,2048,768,16,64,128,1,8,2,256.50533333333334,3
w13,16,128,8,2048,768,16,64,128,1,8,3,257.02833333333336,3
w13,16,128,8,2048,768,16,64,128,1,8,5,257.03833333333336,3
w13,16,128,8,2048,768,16,64,128,16,4,3,256.601,3
w13,16,128,8,2048,768,16,64,128,16,4,4,256.708,3
w13,16,128,8,2048,768,16,64,128,16,4,5,256.24899999999997,3
w13,16,128,8,2048,768,16,64,128,16,8,2,256.825,3
w13,16,128,8,2048,768,16,64,128,16,8,4,256.964,3
w13,16,128,8,2048,768,16,64,128,16,8,5,256.8036666666667,3
w13,16,128,8,2048,768,16,64,128,32,4,4,256.42,3
w13,16,128,8,2048,768,16,64,128,32,4,5,256.35566666666665,3
w13,16,128,8,2048,768,16,64,128,32,8,5,256.526,3
w13,16,128,8,2048,768,16,64,128,64,4,4,256.7183333333333,3
w13,16,128,8,2048,768,16,64,128,64,4,5,257.017,3
w13,16,128,8,2048,768,16,64,128,64,8,3,257.017,3
w13,16,128,8,2048,768,16,64,256,1,4,2,256.601,3
w13,16,128,8,2048,768,16,64,256,1,4,3,256.41966666666667,3
w13,16,128,8,2048,768,16,64,256,1,8,2,256.48333333333335,3
w13,16,128,8,2048,768,16,64,256,1,8,3,256.64366666666666,3
w13,16,128,8,2048,768,16,64,256,16,4,3,256.964,3
w13,16,128,8,2048,768,16,64,256,16,8,2,256.964,3
w13,16,128,8,2048,768,16,64,256,16,8,3,256.75033333333334,3
w13,16,128,8,2048,768,16,64,256,32,4,2,256.43066666666664,3
w13,16,128,8,2048,768,16,64,256,32,4,3,256.84666666666664,3
w13,16,128,8,2048,768,16,64,256,32,8,3,256.88899999999995,3
w13,16,128,8,2048,768,16,64,256,64,4,2,257.03866666666664,3
w13,16,128,8,2048,768,16,64,256,64,8,2,256.964,3
w13,16,128,8,2048,768,16,128,128,1,4,2,256.41966666666667,3
w13,16,128,8,2048,768,16,128,128,1,8,2,256.0466666666667,3
w13,16,128,8,2048,768,16,128,128,1,8,5,257.0493333333333,3
w13,16,128,8,2048,768,16,128,128,16,4,2,257.07033333333334,3
w13,16,128,8,2048,768,16,128,128,16,8,2,256.21733333333333,3
w13,16,128,8,2048,768,16,128,128,16,8,4,256.99566666666664,3
w13,16,128,8,2048,768,16,128,128,32,4,2,256.8996666666667,3
w13,16,128,8,2048,768,16,128,128,32,8,2,257.00666666666666,3
w13,16,128,8,2048,768,16,128,128,64,4,2,256.7823333333333,3
w13,16,128,8,2048,768,16,128,128,64,8,2,256.409,3
w13,16,128,8,2048,768,32,32,128,4,4,3,256.9103333333333,3
w13,16,128,8,2048,768,32,128,128,1,4,2,256.9103333333333,3
w13,16,128,8,2048,768,32,128,128,4,4,3,257.03833333333336,3
w13,16,128,8,2048,768,32,128,128,4,8,3,256.729,3
w13,16,128,8,2048,768,32,128,128,32,8,3,256.72933333333333,3
w13,16,128,8,4096,1536,16,16,256,4,4,5,1007.3470000000001,3
w13,16,128,8,4096,1536,16,32,128,1,4,5,1006.259,3
w13,16,128,8,4096,1536,16,32,128,4,4,5,1006.9946666666666,3
w13,16,128,8,4096,1536,16,32,128,16,4,5,1007.7203333333333,3
w13,16,128,8,4096,1536,16,32,256,1,4,2,1007.8373333333333,3
w13,16,128,8,4096,1536,16,32,256,1,4,3,1006.355,3
w13,16,128,8,4096,1536,16,32,256,1,4,4,1005.9816666666666,3
w13,16,128,8,4096,1536,16,32,256,1,4,5,1003.1123333333334,3
w13,16,128,8,4096,1536,16,32,256,16,4,3,1007.752,3
w13,16,128,8,4096,1536,16,32,256,16,4,5,1005.7256666666667,3
w13,16,128,8,4096,1536,16,32,256,32,4,5,1006.0773333333333,3
w13,16,128,8,4096,1536,16,64,128,1,4,4,1007.5813333333332,3
w13,16,128,8,4096,1536,16,64,128,1,4,5,1005.224,3
w13,16,128,8,4096,1536,16,64,128,1,8,5,1006.9736666666666,3
w13,16,128,8,4096,1536,16,64,128,16,4,5,1007.9763333333334,3
w13,16,128,8,4096,1536,16,64,128,32,4,5,1007.3256666666666,3
w13,16,128,8,4096,1536,16,64,256,1,4,3,1005.2346666666667,3
w13,16,128,8,4096,1536,16,64,256,1,4,4,1005.7573333333333,3
w13,16,128,8,4096,1536,16,64,256,1,4,5,1004.8190000000001,3
w13,16,128,8,4096,1536,16,64,256,1,8,3,1007.773,3
w13,16,128,8,4096,1536,16,64,256,1,8,4,1005.832,3
w13,16,128,8,4096,1536,16,64,256,1,8,5,1005.4163333333332,3
w13,16,128,8,4096,1536,16,64,256,16,4,3,1007.4963333333334,3
w13,16,128,8,4096,1536,16,64,256,16,4,4,1006.8346666666666,3
w13,16,128,8,4096,1536,16,64,256,16,4,5,1005.2773333333333,3
w13,16,128,8,4096,1536,16,64,256,16,8,5,1006.4186666666666,3
w13,16,128,8,4096,1536,16,64,256,32,4,3,1007.5496666666667,3
w13,16,128,8,4096,1536,16,64,256,32,4,5,1006.5893333333333,3
w13,16,128,8,4096,1536,16,64,256,32,8,5,1008.04,3
w13,16,128,8,4096,1536,16,128,128,1,8,5,1006.5683333333333,3
w13,16,128,8,4096,1536,32,32,256,4,4,3,1008.0293333333333,3
w13,16,128,8,4096,1536,32,32,256,4,4,4,1008.072,3
w13,16,128,8,4096,1536,32,64,256,1,8,5,1007.8159999999999,3
w13,16,128,8,4096,1536,64,128,128,1,8,4,1007.5816666666666,3
w13,16,128,8,4096,3072,16,16,128,1,4,5,2006.7786666666668,3
w13,16,128,8,4096,3072,16,16,128,4,4,5,2005.4666666666665,3
w13,16,128,8,4096,3072,16,16,256,1,4,3,2005.6696666666667,3
w13,16,128,8,4096,3072,16,16,256,1,4,4,2003.9093333333333,3
w13,16,128,8,4096,3072,16,16,256,1,4,5,2000.7843333333333,3
w13,16,128,8,4096,3072,16,16,256,4,4,3,2004.539,3
w13,16,128,8,4096,3072,16,16,256,4,4,4,2002.6193333333333,3
w13,16,128,8,4096,3072,16,16,256,4,4,5,2002.4586666666667,3
w13,16,128,8,4096,3072,16,32,128,1,4,5,2007.5686666666668,3
w13,16,128,8,4096,3072,16,32,128,4,4,5,2007.7386666666669,3
w13,16,128,8,4096,3072,16,32,256,1,4,2,2008.2513333333334,3
w13,16,128,8,4096,3072,16,32,256,1,4,3,2006.1706666666669,3
w13,16,128,8,4096,3072,16,32,256,1,4,4,2005.2863333333335,3
w13,16,128,8,4096,3072,16,32,256,1,4,5,1999.718,3
w13,16,128,8,4096,3072,16,32,256,1,8,5,2004.6773333333333,3
w13,16,128,8,4096,3072,16,32,256,16,4,3,2008.7206666666668,3
w13,16,128,8,4096,3072,16,32,256,16,4,4,2006.5126666666667,3
w13,16,128,8,4096,3072,16,32,256,16,4,5,2001.8086666666666,3
w13,16,128,8,4096,3072,16,32,256,16,8,5,2006.5126666666667,3
w13,16,128,8,4096,3072,16,32,256,32,4,4,2009.4566666666667,3
w13,16,128,8,4096,3072,16,32,256,32,4,5,2003.7286666666666,3
w13,16,128,8,4096,3072,16,32,256,32,8,5,2009.3500000000001,3
w13,16,128,8,4096,3072,16,32,256,64,4,5,2007.579,3
w13,16,128,8,4096,3072,16,64,128,1,4,4,2007.7926666666665,3
w13,16,128,8,4096,3072,16,64,128,1,4,5,2002.6193333333333,3
w13,16,128,8,4096,3072,16,64,128,1,8,5,2004.923,3
w13,16,128,8,4096,3072,16,64,128,16,4,5,2006.9713333333336,3
w13,16,128,8,4096,3072,16,64,128,16,8,5,2007.3873333333333,3
w13,16,128,8,4096,3072,16,64,128,32,4,5,2008.0810000000001,3
w13,16,128,8,4096,3072,16,64,128,32,8,5,2008.8163333333334,3
w13,16,128,8,4096,3072,16,64,128,64,4,5,2009.4246666666668,3
w13,16,128,8,4096,3072,16,64,256,1,4,3,2002.2676666666666,3
w13,16,128,8,4096,3072,16,64,256,1,4,4,2000.2086666666667,3
w13,16,128,8,4096,3072,16,64,256,1,4,5,2000.4436666666668,3
w13,16,128,8,4096,3072,16,64,256,1,8,2,2009.6490000000001,3
w13,16,128,8,4096,3072,16,64,256,1,8,3,2004.6670000000001,3
w13,16,128,8,4096,3072,16,64,256,1,8,4,2001.7873333333334,3
w13,16,128,8,4096,3072,16,64,256,1,8,5,2000.742,3
w13,16,128,8,4096,3072,16,64,256,16,4,3,2006.6623333333334,3
w13,16,128,8,4096,3072,16,64,256,16,4,4,2003.5900000000001,3
w13,16,128,8,4096,3072,16,64,256,16,4,5,2001.5846666666666,3
w13,16,128,8,4096,3072,16,64,256,16,8,3,2007.7286666666666,3
w13,16,128,8,4096,3072,16,64,256,16,8,4,2004.8486666666668,3
w13,16,128,8,4096,3072,16,64,256,16,8,5,2001.8943333333334,3
w13,16,128,8,4096,3072,16,64,256,32,4,3,2008.454,3
w13,16,128,8,4096,3072,16,64,256,32,4,4,2006.4063333333334,3
w13,16,128,8,4096,3072,16,64,256,32,4,5,2003.8033333333333,3
w13,16,128,8,4096,3072,16,64,256,32,8,3,2009.1793333333335,3
w13,16,128,8,4096,3072,16,64,256,32,8,4,2007.6216666666667,3
w13,16,128,8,4096,3072,16,64,256,32,8,5,2004.7633333333333,3
w13,16,128,8,4096,3072,16,64,256,64,4,5,2007.6436666666668,3
w13,16,128,8,4096,3072,16,128,128,1,4,5,2004.1126666666667,3
w13,16,128,8,4096,3072,16,128,128,1,8,5,2002.662,3
w13,16,128,8,4096,3072,16,128,128,16,4,5,2004.9126666666664,3
w13,16,128,8,4096,3072,16,128,128,32,4,5,2005.9153333333334,3
w13,16,128,8,4096,3072,16,128,128,32,8,5,2003.9953333333333,3
w13,16,128,8,4096,3072,16,128,128,64,4,5,2008.5606666666665,3
w13,16,128,8,4096,3072,16,128,128,64,8,5,2006.5339999999999,3
w13,16,128,8,4096,3072,32,32,128,1,4,4,2008.198,3
w13,16,128,8,4096,3072,32,32,128,1,4,5,2005.7133333333334,3
w13,16,128,8,4096,3072,32,32,128,4,4,4,2007.9313333333332,3
w13,16,128,8,4096,3072,32,32,128,4,4,5,2006.0966666666666,3
w13,16,128,8,4096,3072,32,32,128,16,4,5,2007.9096666666667,3
w13,16,128,8,4096,3072,32,32,256,1,4,3,2005.3716666666667,3
w13,16,128,8,4096,3072,32,32,256,1,4,4,2003.2486666666666,3
w13,16,128,8,4096,3072,32,32,256,1,8,4,2009.3819999999998,3
w13,16,128,8,4096,3072,32,32,256,4,4,3,2006.2036666666665,3
w13,16,128,8,4096,3072,32,32,256,4,4,4,2005.393,3
w13,16,128,8,4096,3072,32,32,256,16,4,3,2008.3046666666667,3
w13,16,128,8,4096,3072,32,32,256,16,4,4,2005.4993333333332,3
w13,16,128,8,4096,3072,32,32,256,32,4,4,2008.6566666666668,3
w13,16,128,8,4096,3072,32,64,128,1,4,5,2008.198,3
w13,16,128,8,4096,3072,32,64,128,1,8,5,2009.1793333333335,3
w13,16,128,8,4096,3072,32,64,128,4,8,5,2008.3153333333332,3
w13,16,128,8,4096,3072,32,64,256,1,4,3,2008.4646666666667,3
w13,16,128,8,4096,3072,32,64,256,1,4,5,2007.494,3
w13,16,128,8,4096,3072,32,64,256,1,8,3,2008.209,3
w13,16,128,8,4096,3072,32,64,256,1,8,4,2005.2863333333335,3
w13,16,128,8,4096,3072,32,64,256,1,8,5,2003.718,3
w13,16,128,8,4096,3072,32,64,256,8,4,3,2009.6490000000001,3
w13,16,128,8,4096,3072,32,64,256,8,4,5,2008.9556666666667,3
w13,16,128,8,4096,3072,32,64,256,8,8,3,2008.0703333333333,3
w13,16,128,8,4096,3072,32,64,256,8,8,4,2006.3419999999999,3
w13,16,128,8,4096,3072,32,64,256,8,8,5,2005.6170000000002,3
w13,16,128,8,4096,3072,32,64,256,16,8,4,2007.4943333333333,3
w13,16,128,8,4096,3072,32,64,256,16,8,5,2005.563,3
w13,16,128,8,4096,3072,32,64,256,32,8,5,2008.859333333333,3
w13,16,128,8,4096,3072,32,128,128,1,4,3,2009.1580000000001,3
w13,16,128,8,4096,3072,32,128,128,1,4,4,2006.5233333333333,3
w13,16,128,8,4096,3072,32,128,128,1,4,5,2005.243333333333,3
w13,16,128,8,4096,3072,32,128,128,1,8,4,2009.585,3
w13,16,128,8,4096,3072,32,128,128,1,8,5,2007.3770000000002,3
w13,16,128,8,4096,3072,32,128,128,4,4,4,2005.339,3
w13,16,128,8,4096,3072,32,128,128,4,4,5,2005.1793333333335,3
w13,16,128,8,4096,3072,32,128,128,4,8,4,2008.39,3
w13,16,128,8,4096,3072,32,128,128,4,8,5,2006.7153333333333,3
w13,16,128,8,4096,3072,32,128,128,8,4,4,2005.777,3
w13,16,128,8,4096,3072,32,128,128,8,4,5,2006.5446666666667,3
w13,16,128,8,4096,3072,32,128,128,8,8,4,2007.281,3
w13,16,128,8,4096,3072,32,128,128,8,8,5,2009.2753333333333,3
w13,16,128,8,4096,3072,32,128,128,16,4,4,2006.640666666667,3
w13,16,128,8,4096,3072,32,128,128,16,4,5,2005.905,3
w13,16,128,8,4096,3072,32,128,128,16,8,5,2006.4806666666666,3
w13,16,128,8,4096,3072,32,128,128,32,4,4,2007.0996666666667,3
w13,16,128,8,4096,3072,32,128,128,32,4,5,2007.4516666666666,3
w13,16,128,8,4096,3072,32,128,128,32,8,5,2008.5290000000002,3
w13,16,128,8,4096,3072,32,128,128,64,4,4,2009.3613333333333,3
w13,16,128,8,4096,3072,32,128,128,64,4,5,2008.4543333333334,3
w13,16,128,8,4096,3072,32,128,128,64,8,5,2009.1689999999999,3
w13,16,128,8,4096,3072,64,64,128,1,4,3,2007.4726666666666,3
w13,16,128,8,4096,3072,64,64,128,1,8,3,2009.3820000000003,3
w13,16,128,8,4096,3072,64,64,128,4,4,3,2009.0833333333333,3
w13,16,128,8,4096,3072,64,64,128,8,4,3,2008.7423333333334,3
w13,16,128,8,4096,3072,64,128,128,1,4,4,2008.657,3
w13,16,128,8,4096,3072,64,128,128,4,4,4,2007.5159999999998,3
w13,16,128,8,4096,3072,64,128,128,4,8,4,2004.8803333333333,3
w13,16,128,8,4096,3072,64,128,128,16,4,4,2006.8116666666667,3
w13,16,128,8,4096,3072,64,128,128,16,8,4,2005.9156666666668,3
w13,16,128,8,4096,3072,64,128,128,32,4,4,2008.8386666666665,3
w13,16,128,8,4096,3072,64,128,128,32,8,4,2006.6513333333332,3
w13,16,128,8,4096,3072,64,128,128,64,4,4,2009.6596666666665,3
w13,16,128,8,4096,3072,64,128,128,64,8,4,2009.0623333333333,3
w13,24,8,2,1024,512,16,64,128,16,8,3,5.516333333333333,3
w13,24,8,2,1024,512,16,64,128,32,8,3,5.506,3
w13,24,16,2,1536,768,16,32,128,16,4,2,27.264333333333337,3
w13,24,16,4,1536,1024,16,64,64,1,4,3,35.60766666666667,3
w13,24,32,4,2048,768,16,64,64,1,4,3,67.64999999999999,3
w13,24,32,4,2048,768,16,64,64,16,4,3,67.60833333333333,3
w13,24,32,4,2048,768,16,64,128,1,4,2,67.587,3
w13,24,32,4,2048,768,16,64,128,16,4,2,67.85266666666666,3
w13,24,32,6,3072,1024,16,32,128,1,4,2,132.163,3
w13,24,32,6,3072,1024,16,32,128,4,4,2,132.611,3
w13,24,32,6,3072,1024,16,32,128,4,4,5,132.163,3
w13,24,32,6,3072,1024,16,32,128,16,4,2,132.67533333333333,3
w13,24,32,6,3072,1024,16,32,128,32,4,5,132.36533333333333,3
w13,24,32,6,3072,1024,16,32,128,64,4,2,132.23733333333334,3
w13,24,32,6,3072,1024,16,32,256,1,4,3,132.55733333333333,3
w13,24,32,6,3072,1024,16,32,256,32,4,3,132.46133333333333,3
w13,24,32,6,3072,1024,16,64,128,1,8,5,132.36533333333333,3
w13,24,32,6,3072,1024,16,64,128,16,8,5,132.696,3
w13,24,32,6,3072,1024,16,64,128,64,8,3,132.66433333333333,3
w13,24,32,6,3072,1024,16,64,128,64,8,5,132.696,3
w13,24,32,6,3072,1024,16,64,256,1,4,3,132.42966666666666,3
w13,24,32,6,3072,1024,16,128,128,1,4,4,132.79233333333335,3
w13,24,32,6,3072,1024,16,128,128,1,8,4,132.15200000000002,3
w13,24,32,6,3072,1024,16,128,128,16,4,2,132.74933333333334,3
w13,24,32,6,3072,1024,16,128,128,32,4,4,132.71766666666667,3
w13,24,32,6,3072,1024,16,128,128,64,4,2,132.78166666666667,3
w13,24,32,6,3072,1024,16,128,128,64,8,4,132.46166666666667,3
w13,24,32,6,3072,1024,64,64,64,1,4,3,132.131,3
w13,24,32,6,3072,1024,64,64,64,4,4,3,132.72799999999998,3
w13,24,60,4,2048,1408,16,32,128,1,4,5,221.14499999999998,3
w13,24,60,4,2048,1408,16,32,256,1,4,2,221.45466666666667,3
w13,24,60,4,2048,1408,16,32,256,1,4,3,220.91033333333334,3
w13,24,60,4,2048,1408,16,32,256,1,4,4,221.98766666666666,3
w13,24,60,4,2048,1408,16,32,256,16,4,2,221.8273333333333,3
w13,24,60,4,2048,1408,16,32,256,16,4,3,221.369,3
w13,24,60,4,2048,1408,16,32,256,16,4,4,221.97733333333335,3
w13,24,60,4,2048,1408,16,64,128,1,4,2,221.45366666666666,3
w13,24,60,4,2048,1408,16,64,128,1,4,3,221.50733333333332,3
w13,24,60,4,2048,1408,16,64,128,1,4,4,221.55033333333336,3
w13,24,60,4,2048,1408,16,64,128,1,4,5,221.19866666666667,3
w13,24,60,4,2048,1408,16,64,128,1,8,5,221.71033333333332,3
w13,24,60,4,2048,1408,16,64,128,16,4,2,221.646,3
w13,24,60,4,2048,1408,16,64,128,16,8,5,221.68833333333336,3
w13,24,60,4,2048,1408,16,64,128,32,4,4,222.01966666666667,3
w13,24,60,4,2048,1408,16,64,128,32,4,5,221.56066666666666,3
w13,24,60,4,2048,1408,16,64,128,32,8,5,221.99799999999996,3
w13,24,60,4,2048,1408,16,64,128,64,4,3,221.89133333333334,3
w13,24,60,4,2048,1408,16,64,256,1,4,3,221.92333333333332,3
w13,24,60,4,2048,1408,16,64,256,16,8,3,221.966,3
w13,24,60,4,2048,1408,16,64,256,32,8,3,222.00933333333333,3
w13,24,60,4,2048,1408,16,64,256,64,4,2,222.00900000000001,3
w13,24,60,4,2048,1408,16,128,128,32,8,5,221.98799999999997,3
w13,24,60,4,2048,1408,32,128,128,1,4,3,221.77466666666666,3
w13,24,60,4,2048,1408,32,128,128,1,8,3,221.7636666666667,3
w13,24,60,6,3584,2304,16,32,128,1,4,5,625.1803333333334,3
w13,24,60,6,3584,2304,16,32,128,4,4,5,626.0543333333334,3
w13,24,60,6,3584,2304,16,32,128,16,4,5,626.1933333333333,3
w13,24,60,6,3584,2304,16,32,256,1,4,2,625.8096666666667,3
w13,24,60,6,3584,2304,16,32,256,1,4,3,625.6276666666666,3
w13,24,60,6,3584,2304,16,32,256,1,4,4,624.7633333333333,3
w13,24,60,6,3584,2304,16,32,256,1,4,5,624.1876666666666,3
w13,24,60,6,3584,2304,16,32,256,16,4,3,626.4806666666667,3
w13,24,60,6,3584,2304,16,32,256,16,4,4,625.607,3
w13,24,60,6,3584,2304,16,32,256,16,4,5,625.9053333333334,3
w13,24,60,6,3584,2304,16,32,256,32,4,4,626.2033333333334,3
w13,24,60,6,3584,2304,16,64,128,1,4,5,624.134,3
w13,24,60,6,3584,2304,16,64,128,1,8,5,625.457,3
w13,24,60,6,3584,2304,16,64,128,16,4,5,626.0546666666668,3
w13,24,60,6,3584,2304,16,64,128,16,8,3,626.7476666666666,3
w13,24,60,6,3584,2304,16,64,128,16,8,5,626.63,3
w13,24,60,6,3584,2304,16,64,128,32,4,5,626.225,3
w13,24,60,6,3584,2304,16,64,256,1,4,3,625.1370000000001,3
w13,24,60,6,3584,2304,16,64,256,1,4,5,625.9056666666667,3
w13,24,60,6,3584,2304,16,64,256,1,8,3,625.1153333333333,3
w13,24,60,6,3584,2304,16,64,256,1,8,5,625.4996666666666,3
w13,24,60,6,3584,2304,16,64,256,16,4,3,625.5210000000001,3
w13,24,60,6,3584,2304,16,64,256,16,8,3,626.1613333333333,3
w13,24,60,6,3584,2304,16,64,256,32,4,3,626.3106666666666,3
w13,24,60,6,3584,2304,16,128,128,1,4,5,626.5766666666667,3
w13,24,60,6,3584,2304,16,128,128,1,8,5,623.6763333333333,3
w13,24,60,6,3584,2304,16,128,128,16,8,5,625.745,3
w13,24,60,6,3584,2304,16,128,128,32,8,5,626.214,3
w13,24,60,6,3584,2304,16,128,128,64,8,5,626.4816666666667,3
w13,24,60,6,3584,2304,32,128,128,1,8,3,625.895,3
w13,24,60,6,3584,2304,32,128,128,4,4,3,626.3636666666666,3
w13,24,60,6,3584,2304,32,128,128,8,8,3,626.6626666666667,3
w13,24,60,6,3584,2304,32,128,128,16,4,3,626.5986666666666,3
w13,24,60,8,2048,1536,16,32,128,1,4,2,242.05100000000002,3
w13,24,60,8,2048,1536,16,32,128,1,4,5,243.06466666666665,3
w13,24,60,8,2048,1536,16,32,128,4,4,2,242.275,3
w13,24,60,8,2048,1536,16,32,128,4,4,5,243.23533333333333,3
w13,24,60,8,2048,1536,16,32,128,16,4,2,242.467,3
w13,24,60,8,2048,1536,16,32,128,16,4,5,242.57366666666667,3
w13,24,60,8,2048,1536,16,32,128,32,4,2,243.23533333333333,3
w13,24,60,8,2048,1536,16,32,128,32,4,5,243.06433333333334,3
w13,24,60,8,2048,1536,16,32,256,1,4,3,243.06499999999997,3
w13,24,60,8,2048,1536,16,32,256,1,4,4,242.96899999999997,3
w13,24,60,8,2048,1536,16,32,256,16,4,3,243.00033333333332,3
w13,24,60,8,2048,1536,16,32,256,32,4,3,242.92600000000002,3
w13,24,60,8,2048,1536,16,64,128,1,4,4,242.947,3
w13,24,60,8,2048,1536,16,64,128,1,4,5,242.67066666666665,3
w13,24,60,8,2048,1536,16,64,128,1,8,5,242.7976666666667,3
w13,24,60,8,2048,1536,16,64,128,16,4,2,242.07299999999998,3
w13,24,60,8,2048,1536,16,64,128,16,4,4,243.23600000000002,3
w13,24,60,8,2048,1536,16,64,128,16,4,5,243.00066666666666,3
w13,24,60,8,2048,1536,16,64,128,16,8,5,242.73466666666664,3
w13,24,60,8,2048,1536,16,64,128,32,4,2,242.48866666666666,3
w13,24,60,8,2048,1536,16,64,128,32,4,5,242.77666666666667,3
w13,24,60,8,2048,1536,16,64,128,32,8,5,243.24666666666667,3
w13,24,60,8,2048,1536,16,64,128,64,4,2,242.25400000000002,3
w13,24,60,8,2048,1536,16,64,256,1,4,3,243.12933333333334,3
w13,24,60,8,2048,1536,16,64,256,16,8,3,243.10733333333334,3
w13,24,60,8,2048,1536,16,128,128,1,4,2,242.787,3
w13,24,60,8,2048,1536,16,128,128,1,4,3,242.65966666666668,3
w13,24,60,8,2048,1536,16,128,128,1,8,2,242.42433333333335,3
w13,24,60,8,2048,1536,16,128,128,1,8,5,243.20299999999997,3
w13,24,60,8,2048,1536,16,128,128,16,4,2,243.08633333333333,3
w13,24,60,8,2048,1536,16,128,128,16,8,2,243.11766666666668,3
w13,24,60,8,2048,1536,16,128,128,16,8,5,243.16099999999997,3
w13,24,64,6,3072,2048,16,32,128,1,4,5,510.22433333333333,3
w13,24,64,6,3072,2048,16,32,128,4,4,5,510.16,3
w13,24,64,6,3072,2048,16,32,256,1,4,3,510.73600000000005,3
w13,24,64,6,3072,2048,16,32,256,1,4,4,509.74399999999997,3
w13,24,64,6,3072,2048,16,32,256,1,4,5,508.2296666666667,3
w13,24,64,6,3072,2048,16,32,256,16,4,5,509.46700000000004,3
w13,24,64,6,3072,2048,16,64,128,1,4,3,510.7473333333333,3
w13,24,64,6,3072,2048,16,64,128,1,4,4,510.6513333333334,3
w13,24,64,6,3072,2048,16,64,128,1,4,5,510.182,3
w13,24,64,6,3072,2048,16,64,128,1,8,5,510.10699999999997,3
w13,24,64,6,3072,2048,16,64,256,1,4,3,510.704,3
w13,24,64,6,3072,2048,16,64,256,1,4,4,509.75533333333334,3
w13,24,64,6,3072,2048,16,64,256,1,4,5,509.2006666666666,3
w13,24,64,6,3072,2048,16,64,256,1,8,3,510.288,3
w13,24,64,6,3072,2048,16,64,256,1,8,4,510.41633333333334,3
w13,24,64,6,3072,2048,16,64,256,1,8,5,510.49066666666664,3
w13,24,64,6,3072,2048,16,128,128,1,4,3,510.61899999999997,3
w13,24,64,6,3072,2048,16,128,128,1,8,3,509.2326666666666,3
w13,24,64,6,3072,2048,16,128,128,1,8,5,510.00033333333334,3
w13,24,64,6,3584,1536,16,32,128,1,4,3,447.5463333333333,3
w13,24,64,6,3584,1536,16,32,128,1,4,5,447.53566666666666,3
w13,24,64,6,3584,1536,16,32,128,4,4,3,447.16266666666667,3
w13,24,64,6,3584,1536,16,32,128,32,4,3,448.05833333333334,3
w13,24,64,6,3584,1536,16,32,128,32,4,5,447.06666666666666,3
w13,24,64,6,3584,1536,16,32,256,1,4,2,447.32233333333335,3
w13,24,64,6,3584,1536,16,32,256,1,4,3,447.1946666666667,3
w13,24,64,6,3584,1536,16,32,256,1,4,4,445.95733333333334,3
w13,24,64,6,3584,1536,16,32,256,1,4,5,446.3516666666667,3
w13,24,64,6,3584,1536,16,32,256,16,4,2,447.98333333333335,3
w13,24,64,6,3584,1536,16,32,256,16,4,4,447.4823333333334,3
w13,24,64,6,3584,1536,16,32,256,16,4,5,447.5786666666666,3
w13,24,64,6,3584,1536,16,32,256,32,4,2,448.03700000000003,3
w13,24,64,6,3584,1536,16,32,256,32,4,4,447.95133333333337,3
w13,24,64,6,3584,1536,16,64,128,1,4,4,446.71433333333334,3
w13,24,64,6,3584,1536,16,64,256,1,4,3,447.05566666666664,3
w13,24,64,6,3584,1536,16,64,256,1,4,5,447.653,3
w13,24,64,6,3584,1536,16,64,256,1,8,3,447.86633333333333,3
w13,24,64,6,3584,1536,16,128,128,1,8,2,445.8183333333333,3
w13,24,64,6,3584,1536,32,128,128,1,8,3,447.8023333333333,3
w13,24,64,6,3584,1536,32,128,128,4,8,3,447.5363333333333,3
w13,24,64,8,3584,2560,16,32,128,1,4,5,741.0956666666667,3
w13,24,64,8,3584,2560,16,32,128,4,4,5,742.5466666666666,3
w13,24,64,8,3584,2560,16,32,128,16,4,5,742.6529999999999,3
w13,24,64,8,3584,2560,16,32,256,1,4,2,741.959,3
w13,24,64,8,3584,2560,16,32,256,1,4,3,740.797,3
w13,24,64,8,3584,2560,16,32,256,1,4,4,740.8816666666667,3
w13,24,64,8,3584,2560,16,32,256,1,4,5,739.773,3
w13,24,64,8,3584,2560,16,32,256,1,8,5,743.026,3
w13,24,64,8,3584,2560,16,32,256,16,4,2,743.4743333333334,3
w13,24,64,8,3584,2560,16,32,256,16,4,3,743.3253333333333,3
w13,24,64,8,3584,2560,16,32,256,16,4,4,743.154,3
w13,24,64,8,3584,2560,16,32,256,16,4,5,741.5543333333334,3
w13,24,64,8,3584,2560,16,64,128,1,4,5,741.4583333333334,3
w13,24,64,8,3584,2560,16,64,128,1,8,5,741.5436666666666,3
w13,24,64,8,3584,2560,16,64,128,16,4,5,742.567,3
w13,24,64,8,3584,2560,16,64,128,16,8,5,743.1966666666667,3
w13,24,64,8,3584,2560,16,64,128,32,4,5,743.1866666666666,3
w13,24,64,8,3584,2560,16,64,128,32,8,5,742.9410000000001,3
w13,24,64,8,3584,2560,16,64,256,1,4,3,740.7436666666666,3
w13,24,64,8,3584,2560,16,64,256,1,4,4,742.098,3
w13,24,64,8,3584,2560,16,64,256,1,4,5,741.9486666666667,3
w13,24,64,8,3584,2560,16,64,256,1,8,2,743.0903333333334,3
w13,24,64,8,3584,2560,16,64,256,1,8,3,740.4023333333333,3
w13,24,64,8,3584,2560,16,64,256,1,8,4,742.6529999999999,3
w13,24,64,8,3584,2560,16,64,256,1,8,5,740.2313333333333,3
w13,24,64,8,3584,2560,16,64,256,16,4,3,742.1196666666666,3
w13,24,64,8,3584,2560,16,64,256,16,8,5,742.9516666666667,3
w13,24,64,8,3584,2560,16,64,256,32,4,3,742.8133333333334,3
w13,24,64,8,3584,2560,16,128,128,1,4,5,741.5863333333333,3
w13,24,64,8,3584,2560,16,128,128,1,8,5,739.8580000000001,3
w13,24,64,8,3584,2560,16,128,128,16,4,5,742.5889999999999,3
w13,24,64,8,3584,2560,16,128,128,16,8,5,740.85,3
w13,24,64,8,3584,2560,16,128,128,32,4,5,742.8876666666666,3
w13,24,64,8,3584,2560,16,128,128,32,8,5,742.3116666666666,3
w13,24,64,8,3584,2560,32,32,128,1,4,4,742.8666666666667,3
w13,24,64,8,3584,2560,32,32,128,4,4,4,742.9413333333333,3
w13,24,64,8,3584,2560,32,64,128,1,4,5,742.8343333333333,3
w13,24,64,8,3584,2560,32,64,128,1,8,5,741.864,3
w13,24,64,8,3584,2560,32,64,256,1,8,3,743.0583333333334,3
w13,24,64,8,3584,2560,32,64,256,1,8,5,743.2183333333332,3
w13,24,64,8,3584,2560,32,128,128,1,4,5,741.4156666666668,3
w13,24,64,8,3584,2560,32,128,128,1,8,5,743.101,3
w13,24,64,8,3584,2560,32,128,128,4,4,5,742.7276666666667,3
w13,24,64,8,3584,2560,32,128,128,16,4,5,743.197,3
w13,24,128,4,2048,512,16,32,128,16,4,5,130.35366666666667,3
w13,24,128,4,2048,512,16,32,128,64,4,2,130.88733333333334,3
w13,24,128,4,2048,512,16,32,128,64,4,5,130.91966666666667,3
w13,24,128,4,2048,512,16,32,256,32,4,2,130.73766666666666,3
w13,24,128,4,2048,512,16,32,256,64,4,3,130.82366666666667,3
w13,24,128,4,2048,512,16,64,128,1,8,3,130.375,3
w13,24,128,4,2048,512,16,64,128,1,8,5,130.68499999999997,3
w13,24,128,4,2048,512,16,64,128,16,8,3,130.76966666666667,3
w13,24,128,4,2048,512,16,64,128,32,4,5,130.98333333333335,3
w13,24,128,4,2048,512,16,64,128,64,4,5,130.87699999999998,3
w13,24,128,4,2048,512,16,64,128,64,8,3,130.85933333333332,3
w13,24,128,4,2048,512,16,64,256,1,4,2,130.691,3
w13,24,128,4,2048,512,16,64,256,32,4,2,130.70133333333334,3
w13,24,128,4,2048,512,16,128,128,1,8,2,130.73366666666666,3
w13,24,128,4,2048,512,16,128,128,16,8,2,130.542,3
w13,24,128,4,2048,512,16,128,128,32,8,2,130.456,3
w13,24,128,4,2048,512,16,128,128,64,8,2,130.979,3
w13,24,128,6,4096,2048,16,16,256,1,4,3,1341.995,3
w13,24,128,6,4096,2048,16,16,256,1,4,4,1341.7173333333333,3
w13,24,128,6,4096,2048,16,16,256,1,4,5,1340.0856666666666,3
w13,24,128,6,4096,2048,16,16,256,4,4,3,1342.582,3
w13,24,128,6,4096,2048,16,16,256,4,4,4,1341.291,3
w13,24,128,6,4096,2048,16,16,256,4,4,5,1340.1173333333334,3
w13,24,128,6,4096,2048,16,32,128,1,4,5,1340.6723333333332,3
w13,24,128,6,4096,2048,16,32,128,4,4,5,1341.28,3
w13,24,128,6,4096,2048,16,32,128,16,4,5,1340.0856666666666,3
w13,24,128,6,4096,2048,16,32,128,32,4,5,1342.6666666666667,3
w13,24,128,6,4096,2048,16,32,256,1,4,2,1342.6346666666666,3
w13,24,128,6,4096,2048,16,32,256,1,4,3,1340.4056666666668,3
w13,24,128,6,4096,2048,16,32,256,1,4,4,1340.021,3
w13,24,128,6,4096,2048,16,32,256,1,4,5,1336.6293333333333,3
w13,24,128,6,4096,2048,16,32,256,1,8,5,1341.152,3
w13,24,128,6,4096,2048,16,32,256,16,4,3,1340.704,3
w13,24,128,6,4096,2048,16,32,256,16,4,4,1341.1096666666665,3
w13,24,128,6,4096,2048,16,32,256,16,4,5,1338.582,3
w13,24,128,6,4096,2048,16,32,256,32,4,3,1342.2830000000001,3
w13,24,128,6,4096,2048,16,32,256,32,4,4,1342.1226666666666,3
w13,24,128,6,4096,2048,16,32,256,32,4,5,1341.28,3
w13,24,128,6,4096,2048,16,64,128,1,4,4,1343.2749999999999,3
w13,24,128,6,4096,2048,16,64,128,1,4,5,1339.414,3
w13,24,128,6,4096,2048,16,64,128,1,8,5,1340.9386666666667,3
w13,24,128,6,4096,2048,16,64,128,16,4,5,1339.4666666666665,3
w13,24,128,6,4096,2048,16,64,128,16,8,5,1340.8426666666667,3
w13,24,128,6,4096,2048,16,64,128,32,4,5,1340.7146666666665,3
w13,24,128,6,4096,2048,16,64,128,32,8,5,1342.4106666666667,3
w13,24,128,6,4096,2048,16,64,128,64,4,5,1343.019,3
w13,24,128,6,4096,2048,16,64,256,1,4,3,1337.8453333333334,3
w13,24,128,6,4096,2048,16,64,256,1,4,4,1338.7736666666667,3
w13,24,128,6,4096,2048,16,64,256,1,4,5,1337.0243333333333,3
w13,24,128,6,4096,2048,16,64,256,1,8,3,1338.6773333333333,3
w13,24,128,6,4096,2048,16,64,256,1,8,4,1338.1976666666667,3
w13,24,128,6,4096,2048,16,64,256,1,8,5,1337.7389999999998,3
w13,24,128,6,4096,2048,16,64,256,16,4,3,1341.1629999999998,3
w13,24,128,6,4096,2048,16,64,256,16,4,4,1339.8083333333334,3
w13,24,128,6,4096,2048,16,64,256,16,4,5,1338.411,3
w13,24,128,6,4096,2048,16,64,256,16,8,3,1340.1603333333335,3
w13,24,128,6,4096,2048,16,64,256,16,8,4,1340.1926666666666,3
w13,24,128,6,4096,2048,16,64,256,16,8,5,1340.331,3
w13,24,128,6,4096,2048,16,64,256,32,4,3,1341.0990000000002,3
w13,24,128,6,4096,2048,16,64,256,32,4,4,1342.1016666666667,3
w13,24,128,6,4096,2048,16,64,256,32,4,5,1341.9843333333333,3
w13,24,128,6,4096,2048,16,64,256,32,8,3,1342.4216666666669,3
w13,24,128,6,4096,2048,16,64,256,32,8,4,1343.2749999999999,3
w13,24,128,6,4096,2048,16,64,256,32,8,5,1342.7633333333333,3
w13,24,128,6,4096,2048,16,64,256,64,4,3,1341.5576666666666,3
w13,24,128,6,4096,2048,16,64,256,64,8,3,1342.8376666666666,3
w13,24,128,6,4096,2048,16,128,128,1,4,5,1340.2353333333333,3
w13,24,128,6,4096,2048,16,128,128,1,8,5,1339.019,3
w13,24,128,6,4096,2048,16,128,128,16,4,5,1341.2803333333334,3
w13,24,128,6,4096,2048,16,128,128,16,8,5,1338.7740000000001,3
w13,24,128,6,4096,2048,16,128,128,32,4,5,1341.515,3
w13,24,128,6,4096,2048,16,128,128,32,8,5,1340.7786666666668,3
w13,24,128,6,4096,2048,16,128,128,64,8,5,1342.3149999999998,3
w13,24,128,6,4096,2048,32,32,128,1,4,4,1341.099,3
w13,24,128,6,4096,2048,32,32,128,1,4,5,1341.451,3
w13,24,128,6,4096,2048,32,32,128,4,4,4,1342.2513333333334,3
w13,24,128,6,4096,2048,32,32,128,4,4,5,1341.9633333333334,3
w13,24,128,6,4096,2048,32,32,128,16,4,5,1342.8590000000002,3
w13,24,128,6,4096,2048,32,32,256,1,4,3,1341.6013333333333,3
w13,24,128,6,4096,2048,32,32,256,4,4,3,1340.8323333333335,3
w13,24,128,6,4096,2048,32,32,256,4,4,4,1340.459,3
w13,24,128,6,4096,2048,32,32,256,16,4,3,1340.8003333333334,3
w13,24,128,6,4096,2048,32,32,256,16,4,4,1342.4856666666667,3
w13,24,128,6,4096,2048,32,64,128,1,4,5,1342.4113333333332,3
w13,24,128,6,4096,2048,32,64,128,4,4,5,1343.1053333333332,3
w13,24,128,6,4096,2048,32,64,128,16,8,5,1342.4003333333333,3
w13,24,128,6,4096,2048,32,64,256,1,4,3,1342.956,3
w13,24,128,6,4096,2048,32,64,256,1,8,5,1339.6803333333335,3
w13,24,128,6,4096,2048,32,64,256,8,4,3,1343.0626666666667,3
w13,24,128,6,4096,2048,32,64,256,8,8,3,1342.326,3
w13,24,128,6,4096,2048,32,64,256,8,8,4,1341.5796666666665,3
w13,24,128,6,4096,2048,32,64,256,8,8,5,1340.779,3
w13,24,128,6,4096,2048,32,64,256,16,8,3,1342.3476666666666,3
w13,24,128,6,4096,2048,32,128,128,1,4,3,1342.8056666666666,3
w13,24,128,6,4096,2048,32,128,128,1,4,4,1342.4543333333334,3
w13,24,128,6,4096,2048,32,128,128,1,4,5,1340.7686666666666,3
w13,24,128,6,4096,2048,32,128,128,1,8,4,1340.9186666666667,3
w13,24,128,6,4096,2048,32,128,128,4,4,4,1341.59,3
w13,24,128,6,4096,2048,32,128,128,4,4,5,1340.7046666666668,3
w13,24,128,6,4096,2048,32,128,128,4,8,4,1341.334,3
w13,24,128,6,4096,2048,32,128,128,4,8,5,1340.6723333333332,3
w13,24,128,6,4096,2048,32,128,128,8,4,4,1340.9816666666666,3
w13,24,128,6,4096,2048,32,128,128,8,4,5,1340.1606666666667,3
w13,24,128,6,4096,2048,32,128,128,8,8,4,1341.441,3
w13,24,128,6,4096,2048,32,128,128,8,8,5,1341.9099999999999,3
w13,24,128,6,4096,2048,32,128,128,16,4,4,1341.1213333333333,3
w13,24,128,6,4096,2048,32,128,128,16,4,5,1342.796,3
w13,24,128,6,4096,2048,32,128,128,16,8,4,1342.1763333333333,3
w13,24,128,6,4096,2048,32,128,128,16,8,5,1342.3576666666668,3
w13,24,128,6,4096,2048,32,128,128,32,4,3,1342.4116666666666,3
w13,24,128,6,4096,2048,32,128,128,32,4,4,1342.571,3
w13,24,128,6,4096,2048,32,128,128,32,8,3,1342.7953333333332,3
w13,24,128,6,4096,2048,32,128,128,32,8,4,1341.6536666666668,3
w13,24,128,6,4096,2048,32,128,128,32,8,5,1343.3293333333334,3
w13,24,128,6,4096,2048,32,128,128,64,4,3,1342.1656666666665,3
w13,24,128,6,4096,2048,32,128,128,64,8,3,1343.0510000000002,3
w13,24,128,6,4096,2048,64,64,128,1,4,3,1342.3896666666667,3
w13,24,128,6,4096,2048,64,64,128,8,4,3,1343.2436666666665,3
w13,24,128,6,4096,2048,64,128,128,1,8,4,1340.6936666666668,3
w13,24,128,6,4096,2048,64,128,128,4,4,4,1342.326,3
w13,24,128,6,4096,2048,64,128,128,4,8,4,1340.0439999999999,3
w13,24,128,6,4096,2048,64,128,128,16,4,4,1343.0946666666666,3
w13,24,128,6,4096,2048,64,128,128,16,8,4,1339.9256666666668,3
w13,24,128,6,4096,2048,64,128,128,32,8,4,1343.0510000000002,3
w13,24,128,6,4096,2048,64,128,128,64,8,4,1343.019,3
w13,24,128,8,2048,768,16,32,128,1,4,5,256.69699999999995,3
w13,24,128,8,2048,768,16,32,128,4,4,3,257.17699999999996,3
w13,24,128,8,2048,768,16,32,128,4,4,5,257.1773333333333,3
w13,24,128,8,2048,768,16,32,128,16,4,5,257.241,3
w13,24,128,8,2048,768,16,32,128,32,4,5,256.3876666666667,3
w13,24,128,8,2048,768,16,32,256,1,4,2,256.484,3
w13,24,128,8,2048,768,16,32,256,1,4,3,256.36633333333333,3
w13,24,128,8,2048,768,16,32,256,1,4,5,256.89966666666663,3
w13,24,128,8,2048,768,16,32,256,16,4,3,257.1983333333333,3
w13,24,128,8,2048,768,16,32,256,32,4,2,256.932,3
w13,24,128,8,2048,768,16,32,256,32,4,3,256.87833333333333,3
w13,24,128,8,2048,768,16,32,256,64,4,2,257.1453333333333,3
w13,24,128,8,2048,768,16,64,128,1,4,3,257.15566666666666,3
w13,24,128,8,2048,768,16,64,128,1,4,4,256.4303333333333,3
w13,24,128,8,2048,768,16,64,128,1,4,5,256.932,3
w13,24,128,8,2048,768,16,64,128,1,8,2,256.878,3
w13,24,128,8,2048,768,16,64,128,16,4,4,256.92133333333334,3
w13,24,128,8,2048,768,16,64,128,16,4,5,256.9213333333333,3
w13,24,128,8,2048,768,16,64,128,32,4,4,256.60133333333334,3
w13,24,128,8,2048,768,16,64,128,32,4,5,256.708,3
w13,24,128,8,2048,768,16,64,128,32,8,2,257.1236666666667,3
w13,24,128,8,2048,768,16,64,128,64,4,3,257.145,3
w13,24,128,8,2048,768,16,64,256,16,4,2,256.9746666666667,3
w13,24,128,8,2048,768,16,128,128,1,4,2,257.0706666666667,3
w13,24,128,8,2048,768,16,128,128,1,8,2,255.97199999999998,3
w13,24,128,8,2048,768,16,128,128,16,8,2,257.0063333333333,3
w13,24,128,8,2048,768,16,128,128,64,8,2,256.932,3
w13,24,128,8,2048,768,32,128,128,16,4,3,257.2513333333333,3
w13,24,128,8,4096,1536,16,16,256,1,4,3,1010.5576666666666,3
w13,24,128,8,4096,1536,16,16,256,1,4,4,1009.4906666666667,3
w13,24,128,8,4096,1536,16,16,256,1,4,5,1009.0643333333333,3
w13,24,128,8,4096,1536,16,16,256,4,4,4,1009.8643333333333,3
w13,24,128,8,4096,1536,16,32,128,1,4,4,1010.5679999999999,3
w13,24,128,8,4096,1536,16,32,128,1,4,5,1006.7280000000001,3
w13,24,128,8,4096,1536,16,32,128,4,4,5,1008.8299999999999,3
w13,24,128,8,4096,1536,16,32,128,16,4,5,1009.9706666666667,3
w13,24,128,8,4096,1536,16,32,256,1,4,2,1010.0450000000001,3
w13,24,128,8,4096,1536,16,32,256,1,4,3,1007.5386666666667,3
w13,24,128,8,4096,1536,16,32,256,1,4,4,1008.467,3
w13,24,128,8,4096,1536,16,32,256,1,4,5,1006.3333333333334,3
w13,24,128,8,4096,1536,16,32,256,16,4,3,1009.7893333333333,3
w13,24,128,8,4096,1536,16,32,256,16,4,4,1009.9066666666668,3
w13,24,128,8,4096,1536,16,32,256,16,4,5,1006.6856666666666,3
w13,24,128,8,4096,1536,16,32,256,32,4,5,1007.752,3
w13,24,128,8,4096,1536,16,32,256,64,4,5,1009.1386666666667,3
w13,24,128,8,4096,1536,16,64,128,1,4,4,1008.0723333333334,3
w13,24,128,8,4096,1536,16,64,128,1,4,5,1006.8560000000001,3
w13,24,128,8,4096,1536,16,64,128,1,8,5,1009.715,3
w13,24,128,8,4096,1536,16,64,128,16,4,5,1009.4376666666667,3
w13,24,128,8,4096,1536,16,64,128,16,8,5,1010.3976666666667,3
w13,24,128,8,4096,1536,16,64,128,32,4,5,1009.0216666666666,3
w13,24,128,8,4096,1536,16,64,128,64,4,5,1010.6426666666666,3
w13,24,128,8,4096,1536,16,64,256,1,4,3,1006.8670000000001,3
w13,24,128,8,4096,1536,16,64,256,1,4,4,1007.5926666666668,3
w13,24,128,8,4096,1536,16,64,256,1,4,5,1005.651,3
w13,24,128,8,4096,1536,16,64,256,1,8,3,1009.2456666666667,3
w13,24,128,8,4096,1536,16,64,256,1,8,4,1007.3470000000001,3
w13,24,128,8,4096,1536,16,64,256,1,8,5,1006.9733333333334,3
w13,24,128,8,4096,1536,16,64,256,16,4,3,1010.4403333333333,3
w13,24,128,8,4096,1536,16,64,256,16,4,5,1007.4853333333334,3
w13,24,128,8,4096,1536,16,64,256,16,8,4,1010.2483333333333,3
w13,24,128,8,4096,1536,16,64,256,16,8,5,1008.9256666666666,3
w13,24,128,8,4096,1536,16,64,256,32,4,5,1008.6379999999999,3
w13,24,128,8,4096,1536,16,64,256,64,4,5,1010.4513333333333,3
w13,24,128,8,4096,1536,16,128,128,1,4,4,1010.6856666666666,3
w13,24,128,8,4096,1536,16,128,128,1,4,5,1009.6833333333334,3
w13,24,128,8,4096,1536,16,128,128,1,8,5,1007.0383333333333,3
w13,24,128,8,4096,1536,16,128,128,16,4,5,1010.4623333333334,3
w13,24,128,8,4096,1536,16,128,128,16,8,5,1009.9813333333333,3
w13,24,128,8,4096,1536,16,128,128,32,8,5,1009.64,3
w13,24,128,8,4096,1536,32,32,128,1,4,3,1010.3023333333334,3
w13,24,128,8,4096,1536,32,32,128,1,4,4,1010.4296666666665,3
w13,24,128,8,4096,1536,32,32,128,1,4,5,1010.0996666666666,3
w13,24,128,8,4096,1536,32,32,128,4,4,5,1009.3736666666667,3
w13,24,128,8,4096,1536,32,32,256,1,4,3,1009.2676666666666,3
w13,24,128,8,4096,1536,32,32,256,1,4,4,1009.832,3
w13,24,128,8,4096,1536,32,32,256,4,4,3,1009.3416666666667,3
w13,24,128,8,4096,1536,32,32,256,4,4,4,1010.4403333333333,3
w13,24,128,8,4096,1536,32,64,256,1,8,3,1010.4623333333333,3
w13,24,128,8,4096,1536,32,64,256,1,8,5,1010.0993333333332,3
w13,24,128,8,4096,1536,32,64,256,8,8,5,1009.8323333333333,3
w13,24,128,8,4096,1536,32,128,128,1,4,4,1009.4063333333334,3
w13,24,128,8,4096,1536,32,128,128,1,4,5,1009.128,3
w13,24,128,8,4096,1536,32,128,128,1,8,5,1009.9923333333332,3
w13,24,128,8,4096,1536,32,128,128,4,4,4,1010.035,3
w13,24,128,8,4096,1536,32,128,128,4,4,5,1010.0353333333333,3
w13,24,128,8,4096,1536,32,128,128,8,4,4,1010.2703333333334,3
w13,24,128,8,4096,1536,32,128,128,8,4,5,1010.6106666666668,3
w13,24,128,8,4096,1536,32,128,128,16,4,4,1010.056,3
w13,24,128,8,4096,1536,32,128,128,16,4,5,1010.3759999999999,3
w13,24,128,8,4096,1536,64,128,128,1,8,4,1007.7423333333332,3
w13,24,128,8,4096,1536,64,128,128,4,8,4,1009.2890000000001,3
w13,24,128,8,4096,1536,64,128,128,16,8,4,1010.0773333333333,3
w13,24,128,8,4096,3072,16,16,128,1,4,5,2010.2463333333333,3
w13,24,128,8,4096,3072,16,16,128,4,4,5,2009.3183333333334,3
w13,24,128,8,4096,3072,16,16,256,1,4,3,2008.209,3
w13,24,128,8,4096,3072,16,16,256,1,4,4,2006.513,3
w13,24,128,8,4096,3072,16,16,256,1,4,5,2004.0596666666668,3
w13,24,128,8,4096,3072,16,16,256,4,4,3,2009.4143333333334,3
w13,24,128,8,4096,3072,16,16,256,4,4,4,2006.4383333333335,3
w13,24,128,8,4096,3072,16,16,256,4,4,5,2005.1689999999999,3
w13,24,128,8,4096,3072,16,32,128,1,4,5,2010.0226666666667,3
w13,24,128,8,4096,3072,16,32,128,4,4,5,2011.772,3
w13,24,128,8,4096,3072,16,32,256,1,4,2,2012.1126666666667,3
w13,24,128,8,4096,3072,16,32,256,1,4,3,2007.9099999999999,3
w13,24,128,8,4096,3072,16,32,256,1,4,4,2009.5206666666666,3
w13,24,128,8,4096,3072,16,32,256,1,4,5,2003.046,3
w13,24,128,8,4096,3072,16,32,256,1,8,5,2006.7796666666666,3
w13,24,128,8,4096,3072,16,32,256,16,4,4,2011.4733333333334,3
w13,24,128,8,4096,3072,16,32,256,16,4,5,2005.4996666666666,3
w13,24,128,8,4096,3072,16,32,256,16,8,5,2008.9126666666664,3
w13,24,128,8,4096,3072,16,32,256,32,4,5,2007.1743333333334,3
w13,24,128,8,4096,3072,16,32,256,64,4,5,2012.2300000000002,3
w13,24,128,8,4096,3072,16,64,128,1,4,4,2011.4513333333334,3
w13,24,128,8,4096,3072,16,64,128,1,4,5,2008.7853333333333,3
w13,24,128,8,4096,3072,16,64,128,1,8,4,2012.4116666666666,3
w13,24,128,8,4096,3072,16,64,128,1,8,5,2008.6783333333333,3
w13,24,128,8,4096,3072,16,64,128,16,4,5,2010.0863333333334,3
w13,24,128,8,4096,3072,16,64,128,16,8,5,2011.4413333333334,3
w13,24,128,8,4096,3072,16,64,128,32,4,5,2011.2066666666667,3
w13,24,128,8,4096,3072,16,64,128,32,8,5,2012.7743333333335,3
w13,24,128,8,4096,3072,16,64,256,1,4,3,2006.78,3
w13,24,128,8,4096,3072,16,64,256,1,4,4,2004.0600000000002,3
w13,24,128,8,4096,3072,16,64,256,1,4,5,2003.6116666666667,3
w13,24,128,8,4096,3072,16,64,256,1,8,3,2008.1876666666667,3
w13,24,128,8,4096,3072,16,64,256,1,8,4,2003.0996666666667,3
w13,24,128,8,4096,3072,16,64,256,1,8,5,2003.9956666666667,3
w13,24,128,8,4096,3072,16,64,256,16,4,3,2009.7773333333334,3
w13,24,128,8,4096,3072,16,64,256,16,4,4,2005.2653333333335,3
w13,24,128,8,4096,3072,16,64,256,16,4,5,2004.3903333333335,3
w13,24,128,8,4096,3072,16,64,256,16,8,3,2011.7186666666666,3
w13,24,128,8,4096,3072,16,64,256,16,8,4,2007.6763333333336,3
w13,24,128,8,4096,3072,16,64,256,16,8,5,2007.6866666666667,3
w13,24,128,8,4096,3072,16,64,256,32,4,3,2010.9930000000002,3
w13,24,128,8,4096,3072,16,64,256,32,4,4,2011.26,3
w13,24,128,8,4096,3072,16,64,256,32,4,5,2009.425,3
w13,24,128,8,4096,3072,16,64,256,32,8,3,2011.9633333333334,3
w13,24,128,8,4096,3072,16,64,256,32,8,4,2011.7506666666668,3
w13,24,128,8,4096,3072,16,64,256,32,8,5,2008.8383333333334,3
w13,24,128,8,4096,3072,16,64,256,64,4,5,2011.9959999999999,3
w13,24,128,8,4096,3072,16,128,128,1,4,5,2006.4273333333333,3
w13,24,128,8,4096,3072,16,128,128,1,8,4,2012.113,3
w13,24,128,8,4096,3072,16,128,128,1,8,5,2004.0493333333334,3
w13,24,128,8,4096,3072,16,128,128,16,4,5,2007.7826666666667,3
w13,24,128,8,4096,3072,16,128,128,16,8,5,2005.7240000000002,3
w13,24,128,8,4096,3072,16,128,128,32,4,5,2009.3503333333335,3
w13,24,128,8,4096,3072,16,128,128,32,8,5,2007.8146666666669,3
w13,24,128,8,4096,3072,16,128,128,64,4,5,2012.8490000000002,3
w13,24,128,8,4096,3072,32,32,128,1,4,4,2011.345,3
w13,24,128,8,4096,3072,32,32,128,1,4,5,2008.8176666666666,3
w13,24,128,8,4096,3072,32,32,128,4,4,4,2012.3059999999998,3
w13,24,128,8,4096,3072,32,32,128,4,4,5,2008.593,3
w13,24,128,8,4096,3072,32,32,128,16,4,5,2010.9186666666667,3
w13,24,128,8,4096,3072,32,32,256,1,4,3,2008.0173333333332,3
w13,24,128,8,4096,3072,32,32,256,1,4,4,2007.826,3
w13,24,128,8,4096,3072,32,32,256,1,8,4,2011.7933333333333,3
w13,24,128,8,4096,3072,32,32,256,4,4,3,2009.0736666666664,3
w13,24,128,8,4096,3072,32,32,256,4,4,4,2007.0783333333336,3
w13,24,128,8,4096,3072,32,32,256,16,4,3,2012.2413333333334,3
w13,24,128,8,4096,3072,32,32,256,16,4,4,2009.9913333333334,3
w13,24,128,8,4096,3072,32,32,256,32,4,4,2012.22,3
w13,24,128,8,4096,3072,32,64,128,1,4,5,2012.7210000000002,3
w13,24,128,8,4096,3072,32,64,128,4,4,5,2011.5583333333334,3
w13,24,128,8,4096,3072,32,64,128,4,8,5,2012.1343333333334,3
w13,24,128,8,4096,3072,32,64,256,1,4,3,2011.4626666666666,3
w13,24,128,8,4096,3072,32,64,256,1,4,5,2011.1106666666667,3
w13,24,128,8,4096,3072,32,64,256,1,8,3,2011.1966666666667,3
w13,24,128,8,4096,3072,32,64,256,1,8,4,2006.929,3
w13,24,128,8,4096,3072,32,64,256,1,8,5,2006.6736666666666,3
w13,24,128,8,4096,3072,32,64,256,8,4,5,2011.3239999999998,3
w13,24,128,8,4096,3072,32,64,256,8,8,3,2012.6153333333332,3
w13,24,128,8,4096,3072,32,64,256,8,8,4,2008.9033333333334,3
w13,24,128,8,4096,3072,32,64,256,8,8,5,2006.7156666666667,3
w13,24,128,8,4096,3072,32,64,256,16,8,4,2010.9296666666667,3
w13,24,128,8,4096,3072,32,64,256,16,8,5,2009.6816666666666,3
w13,24,128,8,4096,3072,32,64,256,32,8,5,2012.5296666666666,3
w13,24,128,8,4096,3072,32,128,128,1,4,4,2007.986,3
w13,24,128,8,4096,3072,32,128,128,1,4,5,2007.3983333333333,3
w13,24,128,8,4096,3072,32,128,128,1,8,4,2012.6356666666668,3
w13,24,128,8,4096,3072,32,128,128,1,8,5,2008.8490000000002,3
w13,24,128,8,4096,3072,32,128,128,4,4,4,2007.7826666666667,3
w13,24,128,8,4096,3072,32,128,128,4,4,5,2007.4196666666667,3
w13,24,128,8,4096,3072,32,128,128,4,8,4,2010.567,3
w13,24,128,8,4096,3072,32,128,128,4,8,5,2007.7613333333331,3
w13,24,128,8,4096,3072,32,128,128,8,4,4,2008.8706666666667,3
w13,24,128,8,4096,3072,32,128,128,8,4,5,2008.0393333333332,3
w13,24,128,8,4096,3072,32,128,128,8,8,4,2011.4846666666665,3
w13,24,128,8,4096,3072,32,128,128,8,8,5,2008.3903333333335,3
w13,24,128,8,4096,3072,32,128,128,16,4,4,2008.9129999999998,3
w13,24,128,8,4096,3072,32,128,128,16,4,5,2009.0416666666667,3
w13,24,128,8,4096,3072,32,128,128,16,8,4,2011.8686666666665,3
w13,24,128,8,4096,3072,32,128,128,16,8,5,2009.0946666666666,3
w13,24,128,8,4096,3072,32,128,128,32,4,4,2010.097,3
w13,24,128,8,4096,3072,32,128,128,32,4,5,2009.009,3
w13,24,128,8,4096,3072,32,128,128,32,8,5,2010.876,3
w13,24,128,8,4096,3072,32,128,128,64,4,4,2011.4943333333333,3
w13,24,128,8,4096,3072,32,128,128,64,4,5,2012.4336666666666,3
w13,24,128,8,4096,3072,32,128,128,64,8,5,2012.2946666666667,3
w13,24,128,8,4096,3072,64,64,128,4,4,3,2012.5826666666665,3
w13,24,128,8,4096,3072,64,128,128,1,4,4,2010.0873333333332,3
w13,24,128,8,4096,3072,64,128,128,1,8,4,2008.6793333333335,3
w13,24,128,8,4096,3072,64,128,128,4,4,4,2010.2143333333333,3
w13,24,128,8,4096,3072,64,128,128,4,8,4,2006.8976666666667,3
w13,24,128,8,4096,3072,64,128,128,16,4,4,2010.439,3
w13,24,128,8,4096,3072,64,128,128,16,8,4,2008.0926666666667,3
w13,24,128,8,4096,3072,64,128,128,32,8,4,2008.807,3
w13,24,128,8,4096,3072,64,128,128,64,4,4,2011.9963333333333,3
w13,24,128,8,4096,3072,64,128,128,64,8,4,2009.8093333333334,3
w13,32,8,2,1024,512,16,64,128,16,8,3,5.527666666666666,3
w13,32,8,2,1024,512,16,64,128,32,8,3,5.506333333333333,3
w13,32,16,2,1536,768,16,32,128,16,4,2,27.52,3
w13,32,16,4,1536,1024,16,32,128,16,4,2,35.76733333333333,3
w13,32,32,4,2048,768,16,64,64,32,4,3,67.80033333333334,3
w13,32,32,4,2048,768,16,64,128,16,4,2,68.01266666666668,3
w13,32,32,4,2048,768,16,64,128,32,4,2,68.01333333333334,3
w13,32,32,4,2048,768,16,64,128,64,4,2,67.757,3
w13,32,32,4,2048,768,16,128,128,1,8,2,67.757,3
w13,32,32,6,3072,1024,16,32,128,1,4,2,132.216,3
w13,32,32,6,3072,1024,16,32,128,1,4,5,132.48266666666666,3
w13,32,32,6,3072,1024,16,32,128,4,4,2,132.46166666666667,3
w13,32,32,6,3072,1024,16,32,128,16,4,2,132.344,3
w13,32,32,6,3072,1024,16,128,128,1,8,4,132.54666666666665,3
w13,32,32,6,3072,1024,16,128,128,16,4,2,132.82399999999998,3
w13,32,32,6,3072,1024,64,64,64,4,4,3,132.71733333333336,3
w13,32,60,4,2048,1408,16,32,128,4,4,5,221.46433333333334,3
w13,32,60,4,2048,1408,16,32,128,16,4,5,221.98799999999997,3
w13,32,60,4,2048,1408,16,32,256,1,4,2,221.4863333333333,3
w13,32,60,4,2048,1408,16,32,256,1,4,3,221.87033333333332,3
w13,32,60,4,2048,1408,16,32,256,16,4,2,222.36033333333333,3
w13,32,60,4,2048,1408,16,64,128,1,4,3,222.30766666666668,3
w13,32,60,4,2048,1408,16,64,128,1,4,4,222.1046666666667,3
w13,32,60,4,2048,1408,16,64,128,1,4,5,221.69966666666664,3
w13,32,60,4,2048,1408,16,64,128,16,8,2,222.3183333333333,3
w13,32,60,4,2048,1408,16,64,128,16,8,5,222.31799999999998,3
w13,32,60,4,2048,1408,16,64,128,32,4,2,221.9766666666667,3
w13,32,60,4,2048,1408,16,64,128,32,8,2,222.09466666666665,3
w13,32,60,4,2048,1408,16,64,256,1,4,2,222.40333333333334,3
w13,32,60,4,2048,1408,16,64,256,1,4,3,222.31833333333336,3
w13,32,60,4,2048,1408,16,64,256,1,8,2,222.57433333333333,3
w13,32,60,4,2048,1408,16,64,256,16,8,3,222.49900000000002,3
w13,32,60,4,2048,1408,16,128,128,16,8,5,222.52133333333333,3
w13,32,60,6,3584,2304,16,32,128,1,4,5,627.025,3
w13,32,60,6,3584,2304,16,32,128,4,4,5,627.2383333333333,3
w13,32,60,6,3584,2304,16,32,128,32,4,5,627.7076666666667,3
w13,32,60,6,3584,2304,16,32,256,1,4,2,628.391,3
w13,32,60,6,3584,2304,16,32,256,1,4,3,625.7660000000001,3
w13,32,60,6,3584,2304,16,32,256,1,4,4,626.076,3
w13,32,60,6,3584,2304,16,32,256,1,4,5,625.841,3
w13,32,60,6,3584,2304,16,32,256,16,4,2,628.3153333333333,3
w13,32,60,6,3584,2304,16,32,256,16,4,3,627.0680000000001,3
w13,32,60,6,3584,2304,16,32,256,16,4,4,627.3026666666666,3
w13,32,60,6,3584,2304,16,32,256,16,4,5,627.324,3
w13,32,60,6,3584,2304,16,32,256,32,4,5,628.2833333333333,3
w13,32,60,6,3584,2304,16,64,128,1,4,4,626.4493333333334,3
w13,32,60,6,3584,2304,16,64,128,1,4,5,625.2863333333333,3
w13,32,60,6,3584,2304,16,64,128,1,8,5,626.5026666666666,3
w13,32,60,6,3584,2304,16,64,128,16,4,5,628.209,3
w13,32,60,6,3584,2304,16,64,128,32,4,5,627.975,3
w13,32,60,6,3584,2304,16,64,256,1,4,2,628.2199999999999,3
w13,32,60,6,3584,2304,16,64,256,1,4,3,626.0866666666667,3
w13,32,60,6,3584,2304,16,64,256,1,4,5,626.7906666666667,3
w13,32,60,6,3584,2304,16,64,256,1,8,2,627.6223333333334,3
w13,32,60,6,3584,2304,16,64,256,1,8,3,626.0646666666667,3
w13,32,60,6,3584,2304,16,64,256,1,8,4,628.3266666666667,3
w13,32,60,6,3584,2304,16,64,256,1,8,5,627.068,3
w13,32,60,6,3584,2304,16,64,256,16,4,3,627.3556666666667,3
w13,32,60,6,3584,2304,16,64,256,16,8,2,628.2843333333334,3
w13,32,60,6,3584,2304,16,64,256,16,8,3,627.5583333333334,3
w13,32,60,6,3584,2304,16,64,256,32,4,3,628.2946666666667,3
w13,32,60,6,3584,2304,16,128,128,1,4,5,628.3476666666667,3
w13,32,60,6,3584,2304,16,128,128,1,8,4,627.6333333333333,3
w13,32,60,6,3584,2304,16,128,128,1,8,5,625.7983333333333,3
w13,32,60,6,3584,2304,16,128,128,16,8,5,626.4703333333333,3
w13,32,60,6,3584,2304,16,128,128,32,8,5,628.081,3
w13,32,60,6,3584,2304,16,128,128,64,8,5,628.0706666666666,3
w13,32,60,6,3584,2304,32,128,128,1,4,3,627.025,3
w13,32,60,6,3584,2304,32,128,128,4,4,3,627.249,3
w13,32,60,6,3584,2304,32,128,128,4,8,3,627.7933333333334,3
w13,32,60,6,3584,2304,32,128,128,8,4,3,627.8576666666667,3
w13,32,60,6,3584,2304,32,128,128,16,8,3,627.8896666666666,3
w13,32,60,6,3584,2304,32,128,128,32,8,3,628.3803333333334,3
w13,32,60,8,2048,1536,16,32,128,1,4,2,243.01133333333334,3
w13,32,60,8,2048,1536,16,32,128,4,4,2,243.481,3
w13,32,60,8,2048,1536,16,32,128,16,4,2,243.70533333333333,3
w13,32,60,8,2048,1536,16,32,128,32,4,2,243.95066666666665,3
w13,32,60,8,2048,1536,16,32,128,64,4,2,243.99266666666668,3
w13,32,60,8,2048,1536,16,32,256,1,4,5,244.08866666666665,3
w13,32,60,8,2048,1536,16,32,256,16,4,3,244.004,3
w13,32,60,8,2048,1536,16,64,128,1,4,2,243.64033333333336,3
w13,32,60,8,2048,1536,16,64,128,1,4,5,243.9283333333333,3
w13,32,60,8,2048,1536,16,64,128,16,4,2,243.21400000000003,3
w13,32,60,8,2048,1536,16,64,128,16,4,5,243.812,3
w13,32,60,8,2048,1536,16,64,128,32,4,2,242.915,3
w13,32,60,8,2048,1536,16,64,128,32,4,5,244.00300000000001,3
w13,32,60,8,2048,1536,16,64,128,64,4,2,243.63,3
w13,32,60,8,2048,1536,16,128,128,1,8,2,242.88333333333333,3
w13,32,60,8,2048,1536,16,128,128,1,8,5,243.35299999999998,3
w13,32,60,8,2048,1536,16,128,128,16,4,2,244.00366666666665,3
w13,32,60,8,2048,1536,16,128,128,16,8,2,243.22433333333333,3
w13,32,60,8,2048,1536,16,128,128,16,8,5,243.69366666666667,3
w13,32,60,8,2048,1536,16,128,128,32,8,2,243.24633333333335,3
w13,32,64,6,3072,2048,16,32,128,1,4,2,512.4433333333333,3
w13,32,64,6,3072,2048,16,32,128,1,4,5,512.2296666666667,3
w13,32,64,6,3072,2048,16,32,128,4,4,5,511.82466666666664,3
w13,32,64,6,3072,2048,16,32,256,1,4,3,511.771,3
w13,32,64,6,3072,2048,16,32,256,1,4,4,511.259,3
w13,32,64,6,3072,2048,16,32,256,1,4,5,509.90433333333334,3
w13,32,64,6,3072,2048,16,32,256,16,4,4,511.6963333333333,3
w13,32,64,6,3072,2048,16,32,256,16,4,5,511.36566666666664,3
w13,32,64,6,3072,2048,16,32,256,32,4,5,511.5363333333333,3
w13,32,64,6,3072,2048,16,64,128,1,4,4,511.579,3
w13,32,64,6,3072,2048,16,64,128,1,4,5,510.92833333333334,3
w13,32,64,6,3072,2048,16,64,128,1,8,5,511.6433333333334,3
w13,32,64,6,3072,2048,16,64,256,1,4,3,511.7383333333333,3
w13,32,64,6,3072,2048,16,64,256,1,4,4,511.7706666666666,3
w13,32,64,6,3072,2048,16,64,256,1,4,5,511.067,3
w13,32,64,6,3072,2048,16,64,256,1,8,4,512.4319999999999,3
w13,32,64,6,3072,2048,16,64,256,1,8,5,511.75,3
w13,32,64,6,3072,2048,16,64,256,16,4,5,512.1013333333334,3
w13,32,64,6,3072,2048,16,128,128,1,4,3,511.984,3
w13,32,64,6,3072,2048,16,128,128,1,8,3,511.792,3
w13,32,64,6,3072,2048,16,128,128,1,8,5,511.088,3
w13,32,64,6,3072,2048,32,128,128,1,4,3,512.4536666666667,3
w13,32,64,6,3584,1536,16,32,128,1,4,3,448.453,3
w13,32,64,6,3584,1536,16,32,128,1,4,4,449.26366666666667,3
w13,32,64,6,3584,1536,16,32,128,4,4,3,449.13599999999997,3
w13,32,64,6,3584,1536,16,32,128,4,4,5,449.17833333333334,3
w13,32,64,6,3584,1536,16,32,128,32,4,5,448.89033333333333,3
w13,32,64,6,3584,1536,16,32,256,1,4,2,447.52500000000003,3
w13,32,64,6,3584,1536,16,32,256,1,4,3,449.0183333333334,3
w13,32,64,6,3584,1536,16,32,256,1,4,4,447.4183333333333,3
w13,32,64,6,3584,1536,16,32,256,1,4,5,447.02400000000006,3
w13,32,64,6,3584,1536,16,32,256,16,4,2,448.7726666666667,3
w13,32,64,6,3584,1536,16,32,256,16,4,3,449.1783333333333,3
w13,32,64,6,3584,1536,16,32,256,16,4,4,448.68800000000005,3
w13,32,64,6,3584,1536,16,32,256,16,4,5,449.1783333333333,3
w13,32,64,6,3584,1536,16,32,256,32,4,4,449.19966666666664,3
w13,32,64,6,3584,1536,16,64,128,1,4,3,448.91200000000003,3
w13,32,64,6,3584,1536,16,64,128,1,4,4,447.92,3
w13,32,64,6,3584,1536,16,64,128,1,8,3,448.3036666666667,3
w13,32,64,6,3584,1536,16,64,256,1,4,2,448.4316666666667,3
w13,32,64,6,3584,1536,16,64,256,1,4,3,447.7706666666666,3
w13,32,64,6,3584,1536,16,64,256,1,4,5,448.2076666666667,3
w13,32,64,6,3584,1536,16,64,256,1,8,2,449.17833333333334,3
w13,32,64,6,3584,1536,16,64,256,1,8,3,448.709,3
w13,32,64,6,3584,1536,16,64,256,1,8,5,447.973,3
w13,32,64,6,3584,1536,16,128,128,1,4,4,449.1893333333333,3
w13,32,64,6,3584,1536,16,128,128,1,8,2,448.3993333333333,3
w13,32,64,6,3584,1536,16,128,128,1,8,4,448.3786666666667,3
w13,32,64,6,3584,1536,16,128,128,1,8,5,448.48533333333336,3
w13,32,64,6,3584,1536,16,128,128,16,8,2,448.77299999999997,3
w13,32,64,6,3584,1536,16,128,128,64,8,2,448.837,3
w13,32,64,6,3584,1536,32,32,128,1,4,3,449.2316666666666,3
w13,32,64,6,3584,1536,32,128,128,1,4,3,449.16766666666666,3
w13,32,64,6,3584,1536,32,128,128,1,8,3,448.5706666666667,3
w13,32,64,6,3584,1536,32,128,128,8,4,2,449.08233333333334,3
w13,32,64,8,3584,2560,16,32,256,1,4,2,743.805,3
w13,32,64,8,3584,2560,16,32,256,1,4,3,743.7726666666666,3
w13,32,64,8,3584,2560,16,32,256,1,4,4,742.7166666666667,3
w13,32,64,8,3584,2560,16,32,256,1,4,5,742.0450000000001,3
w13,32,64,8,3584,2560,16,32,256,16,4,5,743.5806666666667,3
w13,32,64,8,3584,2560,16,64,128,1,4,5,740.6476666666667,3
w13,32,64,8,3584,2560,16,64,128,1,8,5,743.0476666666667,3
w13,32,64,8,3584,2560,16,64,128,32,8,5,743.9756666666667,3
w13,32,64,8,3584,2560,16,64,256,1,4,3,742.3649999999999,3
w13,32,64,8,3584,2560,16,64,256,1,4,4,743.5806666666667,3
w13,32,64,8,3584,2560,16,64,256,1,4,5,741.6926666666667,3
w13,32,64,8,3584,2560,16,64,256,1,8,3,742.1306666666666,3
w13,32,64,8,3584,2560,16,64,256,1,8,5,742.6423333333333,3
w13,32,64,8,3584,2560,16,64,256,16,4,3,744.2206666666667,3
w13,32,64,8,3584,2560,16,64,256,16,8,3,744.285,3
w13,32,64,8,3584,2560,16,128,128,1,4,5,743.2713333333335,3
w13,32,64,8,3584,2560,16,128,128,1,8,5,741.0740000000001,3
w13,32,64,8,3584,2560,16,128,128,16,8,5,743.0903333333332,3
w13,32,64,8,3584,2560,16,128,128,32,8,5,744.3593333333333,3
w13,32,64,8,3584,2560,32,128,128,1,4,5,743.1436666666667,3
w13,32,64,8,3584,2560,32,128,128,4,4,5,743.5276666666667,3
w13,32,128,4,2048,512,16,32,128,1,4,5,173.22966666666665,3
w13,32,128,4,2048,512,16,32,128,4,4,5,173.102,3
w13,32,128,4,2048,512,16,32,128,16,4,5,172.98433333333332,3
w13,32,128,4,2048,512,16,32,128,32,4,5,172.846,3
w13,32,128,4,2048,512,16,32,128,64,4,5,173.26166666666666,3
w13,32,128,4,2048,512,16,32,256,16,4,2,173.18766666666667,3
w13,32,128,4,2048,512,16,32,256,16,4,3,172.409,3
w13,32,128,4,2048,512,16,32,256,32,4,3,172.55766666666668,3
w13,32,128,4,2048,512,16,64,128,1,4,3,172.6003333333333,3
w13,32,128,4,2048,512,16,64,128,1,4,4,173.08033333333333,3
w13,32,128,4,2048,512,16,64,128,1,4,5,172.85666666666665,3
w13,32,128,4,2048,512,16,64,128,16,4,3,172.77166666666668,3
w13,32,128,4,2048,512,16,64,128,16,4,4,172.857,3
w13,32,128,4,2048,512,16,64,128,16,4,5,172.611,3
w13,32,128,4,2048,512,16,64,128,32,4,3,172.87766666666667,3
w13,32,128,4,2048,512,16,64,128,32,4,5,172.76066666666668,3
w13,32,128,4,2048,512,16,64,128,64,4,3,173.18766666666667,3
w13,32,128,4,2048,512,16,64,128,64,4,4,172.9316666666667,3
w13,32,128,4,2048,512,16,64,128,64,4,5,173.25133333333335,3
w13,32,128,4,2048,512,16,64,128,64,8,5,172.867,3
w13,32,128,4,2048,512,16,64,256,1,8,3,173.02733333333333,3
w13,32,128,4,2048,512,16,64,256,16,8,3,173.23000000000002,3
w13,32,128,4,2048,512,16,64,256,32,8,3,173.04866666666666,3
w13,32,128,4,2048,512,16,128,128,32,8,2,173.26199999999997,3
w13,32,128,4,2048,512,32,128,128,1,8,3,173.20833333333334,3
w13,32,128,4,2048,512,32,128,128,16,8,3,173.01633333333334,3
w13,32,128,4,2048,512,32,128,128,32,8,3,173.26166666666666,3
w13,32,128,6,4096,2048,16,16,256,1,4,4,1343.0193333333334,3
w13,32,128,6,4096,2048,16,16,256,1,4,5,1341.8786666666667,3
w13,32,128,6,4096,2048,16,16,256,4,4,3,1343.1683333333333,3
w13,32,128,6,4096,2048,16,16,256,4,4,4,1341.942,3
w13,32,128,6,4096,2048,16,16,256,4,4,5,1341.5796666666665,3
w13,32,128,6,4096,2048,16,32,128,1,4,5,1342.9766666666667,3
w13,32,128,6,4096,2048,16,32,128,4,4,5,1344.374,3
w13,32,128,6,4096,2048,16,32,128,16,4,5,1341.675,3
w13,32,128,6,4096,2048,16,32,128,32,4,5,1344.108,3
w13,32,128,6,4096,2048,16,32,256,1,4,2,1344.801,3
w13,32,128,6,4096,2048,16,32,256,1,4,3,1342.7213333333332,3
w13,32,128,6,4096,2048,16,32,256,1,4,4,1340.8536666666666,3
w13,32,128,6,4096,2048,16,32,256,1,4,5,1338.3363333333334,3
w13,32,128,6,4096,2048,16,32,256,1,8,5,1341.9846666666665,3
w13,32,128,6,4096,2048,16,32,256,16,4,3,1342.2723333333333,3
w13,32,128,6,4096,2048,16,32,256,16,4,4,1343.7879999999998,3
w13,32,128,6,4096,2048,16,32,256,16,4,5,1340.4489999999998,3
w13,32,128,6,4096,2048,16,32,256,16,8,5,1345.0036666666667,3
w13,32,128,6,4096,2048,16,32,256,32,4,2,1344.1073333333334,3
w13,32,128,6,4096,2048,16,32,256,32,4,3,1344.214,3
w13,32,128,6,4096,2048,16,32,256,32,4,4,1344.4163333333333,3
w13,32,128,6,4096,2048,16,32,256,32,4,5,1343.3933333333334,3
w13,32,128,6,4096,2048,16,64,128,1,4,4,1344.0753333333332,3
w13,32,128,6,4096,2048,16,64,128,1,4,5,1339.7983333333334,3
w13,32,128,6,4096,2048,16,64,128,1,8,5,1343.7766666666666,3
w13,32,128,6,4096,2048,16,64,128,16,4,5,1341.8893333333333,3
w13,32,128,6,4096,2048,16,64,128,16,8,5,1343.0516666666665,3
w13,32,128,6,4096,2048,16,64,128,32,4,4,1344.2783333333334,3
w13,32,128,6,4096,2048,16,64,128,32,4,5,1343.211,3
w13,32,128,6,4096,2048,16,64,128,32,8,5,1344.0966666666666,3
w13,32,128,6,4096,2048,16,64,256,1,4,3,1340.075,3
w13,32,128,6,4096,2048,16,64,256,1,4,4,1338.8163333333334,3
w13,32,128,6,4096,2048,16,64,256,1,4,5,1338.3693333333333,3
w13,32,128,6,4096,2048,16,64,256,1,8,3,1340.673,3
w13,32,128,6,4096,2048,16,64,256,1,8,4,1338.8700000000001,3
w13,32,128,6,4096,2048,16,64,256,1,8,5,1339.6173333333334,3
w13,32,128,6,4096,2048,16,64,256,16,4,3,1341.398,3
w13,32,128,6,4096,2048,16,64,256,16,4,4,1341.8146666666667,3
w13,32,128,6,4096,2048,16,64,256,16,4,5,1341.1416666666667,3
w13,32,128,6,4096,2048,16,64,256,16,8,3,1341.259,3
w13,32,128,6,4096,2048,16,64,256,16,8,4,1342.2306666666666,3
w13,32,128,6,4096,2048,16,64,256,16,8,5,1343.0723333333333,3
w13,32,128,6,4096,2048,16,64,256,32,4,3,1341.867,3
w13,32,128,6,4096,2048,16,64,256,32,4,4,1343.2546666666667,3
w13,32,128,6,4096,2048,16,64,256,32,4,5,1343.3286666666665,3
w13,32,128,6,4096,2048,16,64,256,32,8,3,1342.486,3
w13,32,128,6,4096,2048,16,64,256,32,8,4,1344.1393333333333,3
w13,32,128,6,4096,2048,16,64,256,32,8,5,1343.7133333333334,3
w13,32,128,6,4096,2048,16,64,256,64,4,3,1344.8756666666666,3
w13,32,128,6,4096,2048,16,128,128,1,4,4,1344.8756666666666,3
w13,32,128,6,4096,2048,16,128,128,1,4,5,1340.875,3
w13,32,128,6,4096,2048,16,128,128,1,8,5,1338.9016666666666,3
w13,32,128,6,4096,2048,16,128,128,16,4,5,1341.4946666666667,3
w13,32,128,6,4096,2048,16,128,128,16,8,5,1340.1393333333333,3
w13,32,128,6,4096,2048,16,128,128,32,4,5,1342.7953333333332,3
w13,32,128,6,4096,2048,16,128,128,32,8,5,1340.747,3
w13,32,128,6,4096,2048,16,128,128,64,4,4,1345.0136666666667,3
w13,32,128,6,4096,2048,16,128,128,64,4,5,1344.0546666666667,3
w13,32,128,6,4096,2048,16,128,128,64,8,5,1341.5683333333334,3
w13,32,128,6,4096,2048,32,32,128,1,4,4,1343.9906666666666,3
w13,32,128,6,4096,2048,32,32,128,1,4,5,1343.211,3
w13,32,128,6,4096,2048,32,32,128,4,4,4,1344.9396666666667,3
w13,32,128,6,4096,2048,32,32,128,4,4,5,1341.836,3
w13,32,128,6,4096,2048,32,32,128,16,4,4,1344.139,3
w13,32,128,6,4096,2048,32,32,128,16,4,5,1343.67,3
w13,32,128,6,4096,2048,32,32,256,1,4,3,1343.5420000000001,3
w13,32,128,6,4096,2048,32,32,256,4,4,3,1342.4863333333333,3
w13,32,128,6,4096,2048,32,32,256,4,4,4,1342.8596666666665,3
w13,32,128,6,4096,2048,32,32,256,16,4,3,1344.9710000000002,3
w13,32,128,6,4096,2048,32,64,128,1,4,5,1342.5929999999998,3
w13,32,128,6,4096,2048,32,64,128,1,8,5,1343.8296666666668,3
w13,32,128,6,4096,2048,32,64,128,4,4,5,1344.4066666666668,3
w13,32,128,6,4096,2048,32,64,128,4,8,5,1344.2783333333334,3
w13,32,128,6,4096,2048,32,64,128,16,4,5,1344.3853333333334,3
w13,32,128,6,4096,2048,32,64,128,32,4,5,1344.7686666666668,3
w13,32,128,6,4096,2048,32,64,256,1,4,3,1344.5446666666667,3
w13,32,128,6,4096,2048,32,64,256,1,8,3,1342.2513333333334,3
w13,32,128,6,4096,2048,32,64,256,1,8,4,1342.219,3
w13,32,128,6,4096,2048,32,64,256,1,8,5,1341.9426666666666,3
w13,32,128,6,4096,2048,32,64,256,8,8,3,1344.086,3
w13,32,128,6,4096,2048,32,64,256,8,8,4,1344.108,3
w13,32,128,6,4096,2048,32,64,256,8,8,5,1342.6783333333333,3
w13,32,128,6,4096,2048,32,64,256,16,4,3,1344.9076666666667,3
w13,32,128,6,4096,2048,32,64,256,16,8,5,1343.8193333333331,3
w13,32,128,6,4096,2048,32,128,128,1,4,3,1344.2250000000001,3
w13,32,128,6,4096,2048,32,128,128,1,4,4,1342.9133333333332,3
w13,32,128,6,4096,2048,32,128,128,1,4,5,1341.4303333333335,3
w13,32,128,6,4096,2048,32,128,128,1,8,4,1344.3,3
w13,32,128,6,4096,2048,32,128,128,1,8,5,1345.0356666666667,3
w13,32,128,6,4096,2048,32,128,128,4,4,4,1343.5316666666665,3
w13,32,128,6,4096,2048,32,128,128,4,4,5,1341.9213333333335,3
w13,32,128,6,4096,2048,32,128,128,4,8,4,1343.372,3
w13,32,128,6,4096,2048,32,128,128,4,8,5,1342.5076666666666,3
w13,32,128,6,4096,2048,32,128,128,8,4,4,1341.9956666666667,3
w13,32,128,6,4096,2048,32,128,128,8,4,5,1341.75,3
w13,32,128,6,4096,2048,32,128,128,8,8,4,1343.713,3
w13,32,128,6,4096,2048,32,128,128,8,8,5,1342.8173333333334,3
w13,32,128,6,4096,2048,32,128,128,16,4,3,1343.9156666666668,3
w13,32,128,6,4096,2048,32,128,128,16,4,4,1343.0836666666667,3
w13,32,128,6,4096,2048,32,128,128,16,4,5,1343.4143333333334,3
w13,32,128,6,4096,2048,32,128,128,16,8,4,1342.2196666666666,3
w13,32,128,6,4096,2048,32,128,128,16,8,5,1342.881,3
w13,32,128,6,4096,2048,32,128,128,32,4,3,1344.897,3
w13,32,128,6,4096,2048,32,128,128,32,4,4,1342.5823333333333,3
w13,32,128,6,4096,2048,32,128,128,32,4,5,1342.6146666666666,3
w13,32,128,6,4096,2048,32,128,128,32,8,4,1343.969,3
w13,32,128,6,4096,2048,32,128,128,32,8,5,1343.948,3
w13,32,128,6,4096,2048,32,128,128,64,4,4,1344.684,3
w13,32,128,6,4096,2048,32,128,128,64,4,5,1344.7153333333333,3
w13,32,128,6,4096,2048,64,64,128,1,4,3,1344.1396666666667,3
w13,32,128,6,4096,2048,64,128,128,1,4,4,1343.9796666666668,3
w13,32,128,6,4096,2048,64,128,128,1,8,4,1340.865,3
w13,32,128,6,4096,2048,64,128,128,4,4,4,1344.7693333333334,3
w13,32,128,6,4096,2048,64,128,128,4,8,4,1342.0706666666667,3
w13,32,128,6,4096,2048,64,128,128,16,4,4,1343.724,3
w13,32,128,6,4096,2048,64,128,128,16,8,4,1341.857,3
w13,32,128,6,4096,2048,64,128,128,32,4,4,1344.0966666666666,3
w13,32,128,6,4096,2048,64,128,128,32,8,4,1341.0036666666667,3
w13,32,128,6,4096,2048,64,128,128,64,8,4,1343.9693333333335,3
w13,32,128,8,2048,768,16,32,128,1,4,5,257.124,3
w13,32,128,8,2048,768,16,32,128,16,4,5,257.38000000000005,3
w13,32,128,8,2048,768,16,32,256,1,4,2,256.84633333333335,3
w13,32,128,8,2048,768,16,32,256,1,4,3,257.67833333333334,3
w13,32,128,8,2048,768,16,32,256,1,4,4,257.7,3
w13,32,128,8,2048,768,16,32,256,1,4,5,257.721,3
w13,32,128,8,2048,768,16,32,256,16,4,2,257.37966666666665,3
w13,32,128,8,2048,768,16,32,256,16,4,3,257.30466666666666,3
w13,32,128,8,2048,768,16,32,256,32,4,2,257.72133333333335,3
w13,32,128,8,2048,768,16,64,128,1,4,4,257.1773333333333,3
w13,32,128,8,2048,768,16,64,128,1,4,5,257.81666666666666,3
w13,32,128,8,2048,768,16,64,128,1,8,5,257.69966666666664,3
w13,32,128,8,2048,768,16,64,128,16,4,4,257.8386666666667,3
w13,32,128,8,2048,768,16,64,128,16,4,5,257.4013333333333,3
w13,32,128,8,2048,768,16,64,128,16,8,5,257.3693333333333,3
w13,32,128,8,2048,768,16,64,256,1,8,3,257.6036666666667,3
w13,32,128,8,2048,768,16,128,128,1,4,2,257.5613333333333,3
w13,32,128,8,2048,768,16,128,128,1,8,2,256.55833333333334,3
w13,32,128,8,2048,768,16,128,128,16,8,2,257.6573333333333,3
w13,32,128,8,2048,768,16,128,128,32,4,2,257.444,3
w13,32,128,8,2048,768,16,128,128,64,4,2,257.8383333333333,3
w13,32,128,8,2048,768,16,128,128,64,8,2,257.113,3
w13,32,128,8,2048,768,32,128,128,32,8,3,257.82800000000003,3
w13,32,128,8,4096,1536,16,16,256,1,4,4,1011.4960000000001,3
w13,32,128,8,4096,1536,16,16,256,1,4,5,1010.707,3
w13,32,128,8,4096,1536,16,16,256,4,4,4,1011.3796666666667,3
w13,32,128,8,4096,1536,16,16,256,4,4,5,1010.4513333333333,3
w13,32,128,8,4096,1536,16,32,128,1,4,5,1009.203,3
w13,32,128,8,4096,1536,16,32,128,4,4,5,1010.9743333333332,3
w13,32,128,8,4096,1536,16,32,256,1,4,2,1011.6460000000001,3
w13,32,128,8,4096,1536,16,32,256,1,4,3,1010.0673333333334,3
w13,32,128,8,4096,1536,16,32,256,1,4,4,1010.1626666666666,3
w13,32,128,8,4096,1536,16,32,256,1,4,5,1006.7713333333335,3
w13,32,128,8,4096,1536,16,32,256,1,8,5,1010.8993333333333,3
w13,32,128,8,4096,1536,16,32,256,16,4,5,1007.518,3
w13,32,128,8,4096,1536,16,32,256,32,4,5,1009.9609999999999,3
w13,32,128,8,4096,1536,16,64,128,1,4,5,1008.8836666666666,3
w13,32,128,8,4096,1536,16,64,128,1,8,5,1010.5050000000001,3
w13,32,128,8,4096,1536,16,64,128,16,4,5,1010.4613333333333,3
w13,32,128,8,4096,1536,16,64,128,16,8,5,1011.337,3
w13,32,128,8,4096,1536,16,64,128,32,4,5,1010.8566666666666,3
w13,32,128,8,4096,1536,16,64,256,1,4,3,1007.966,3
w13,32,128,8,4096,1536,16,64,256,1,4,4,1008.8723333333334,3
w13,32,128,8,4096,1536,16,64,256,1,4,5,1007.2196666666667,3
w13,32,128,8,4096,1536,16,64,256,1,8,3,1011.0383333333334,3
w13,32,128,8,4096,1536,16,64,256,1,8,4,1010.4399999999999,3
w13,32,128,8,4096,1536,16,64,256,1,8,5,1008.5633333333334,3
w13,32,128,8,4096,1536,16,64,256,16,4,3,1010.9736666666666,3
w13,32,128,8,4096,1536,16,64,256,16,4,4,1011.0803333333333,3
w13,32,128,8,4096,1536,16,64,256,16,4,5,1008.6266666666667,3
w13,32,128,8,4096,1536,16,64,256,16,8,4,1010.7280000000001,3
w13,32,128,8,4096,1536,16,64,256,16,8,5,1010.1206666666667,3
w13,32,128,8,4096,1536,16,64,256,32,4,5,1010.7813333333334,3
w13,32,128,8,4096,1536,16,128,128,1,4,4,1011.1343333333334,3
w13,32,128,8,4096,1536,16,128,128,1,4,5,1010.6326666666668,3
w13,32,128,8,4096,1536,16,128,128,1,8,4,1011.2086666666668,3
w13,32,128,8,4096,1536,16,128,128,1,8,5,1008.8190000000001,3
w13,32,128,8,4096,1536,16,128,128,16,4,5,1010.6646666666667,3
w13,32,128,8,4096,1536,16,128,128,16,8,5,1010.9526666666667,3
w13,32,128,8,4096,1536,16,128,128,32,8,5,1011.6666666666666,3
w13,32,128,8,4096,1536,16,128,128,64,8,5,1011.2193333333333,3
w13,32,128,8,4096,1536,32,32,128,1,4,3,1011.7953333333334,3
w13,32,128,8,4096,1536,32,32,128,1,4,5,1010.9956666666667,3
w13,32,128,8,4096,1536,32,32,128,4,4,5,1011.593,3
w13,32,128,8,4096,1536,32,32,256,1,4,4,1010.0783333333333,3
w13,32,128,8,4096,1536,32,32,256,4,4,4,1010.9313333333333,3
w13,32,128,8,4096,1536,32,64,256,1,8,5,1011.7526666666666,3
w13,32,128,8,4096,1536,32,64,256,8,8,5,1011.721,3
w13,32,128,8,4096,1536,32,128,128,1,4,4,1010.7073333333334,3
w13,32,128,8,4096,1536,32,128,128,1,4,5,1011.1766666666666,3
w13,32,128,8,4096,1536,32,128,128,1,8,5,1011.187,3
w13,32,128,8,4096,1536,32,128,128,4,4,4,1011.219,3
w13,32,128,8,4096,1536,32,128,128,4,4,5,1010.1103333333334,3
w13,32,128,8,4096,1536,32,128,128,8,4,4,1011.0806666666667,3
w13,32,128,8,4096,1536,32,128,128,8,4,5,1010.2383333333333,3
w13,32,128,8,4096,1536,32,128,128,8,8,5,1011.806,3
w13,32,128,8,4096,1536,64,128,128,1,8,4,1009.5129999999999,3
w13,32,128,8,4096,1536,64,128,128,4,8,4,1010.9743333333332,3
w13,32,128,8,4096,3072,16,16,128,1,4,5,2013.3403333333333,3
w13,32,128,8,4096,3072,16,16,128,4,4,5,2012.7533333333333,3
w13,32,128,8,4096,3072,16,16,256,1,4,3,2011.655,3
w13,32,128,8,4096,3072,16,16,256,1,4,4,2009.3406666666667,3
w13,32,128,8,4096,3072,16,16,256,1,4,5,2007.6229999999998,3
w13,32,128,8,4096,3072,16,16,256,4,4,3,2013.9156666666668,3
w13,32,128,8,4096,3072,16,16,256,4,4,4,2010.46,3
w13,32,128,8,4096,3072,16,16,256,4,4,5,2007.4523333333334,3
w13,32,128,8,4096,3072,16,32,128,1,4,5,2013.5110000000002,3
w13,32,128,8,4096,3072,16,32,128,4,4,5,2014.5026666666665,3
w13,32,128,8,4096,3072,16,32,256,1,4,2,2015.0469999999998,3
w13,32,128,8,4096,3072,16,32,256,1,4,3,2013.82,3
w13,32,128,8,4096,3072,16,32,256,1,4,4,2014.3003333333334,3
w13,32,128,8,4096,3072,16,32,256,1,4,5,2005.5213333333334,3
w13,32,128,8,4096,3072,16,32,256,1,8,5,2009.2659999999998,3
w13,32,128,8,4096,3072,16,32,256,16,4,4,2014.9186666666665,3
w13,32,128,8,4096,3072,16,32,256,16,4,5,2007.3029999999999,3
w13,32,128,8,4096,3072,16,32,256,16,8,5,2012.86,3
w13,32,128,8,4096,3072,16,32,256,32,4,5,2011.762,3
w13,32,128,8,4096,3072,16,64,128,1,4,4,2015.2606666666668,3
w13,32,128,8,4096,3072,16,64,128,1,4,5,2009.4683333333332,3
w13,32,128,8,4096,3072,16,64,128,1,8,5,2011.1643333333334,3
w13,32,128,8,4096,3072,16,64,128,16,4,5,2012.7536666666667,3
w13,32,128,8,4096,3072,16,64,128,16,8,5,2013.9483333333335,3
w13,32,128,8,4096,3072,16,64,128,32,4,5,2015.4203333333335,3
w13,32,128,8,4096,3072,16,64,256,1,4,3,2008.6043333333334,3
w13,32,128,8,4096,3072,16,64,256,1,4,4,2006.78,3
w13,32,128,8,4096,3072,16,64,256,1,4,5,2005.3833333333332,3
w13,32,128,8,4096,3072,16,64,256,1,8,3,2010.9936666666665,3
w13,32,128,8,4096,3072,16,64,256,1,8,4,2006.5240000000001,3
w13,32,128,8,4096,3072,16,64,256,1,8,5,2007.0146666666667,3
w13,32,128,8,4096,3072,16,64,256,16,4,3,2013.959,3
w13,32,128,8,4096,3072,16,64,256,16,4,4,2009.8306666666667,3
w13,32,128,8,4096,3072,16,64,256,16,4,5,2008.9346666666668,3
w13,32,128,8,4096,3072,16,64,256,16,8,4,2010.876,3
w13,32,128,8,4096,3072,16,64,256,16,8,5,2009.7883333333332,3
w13,32,128,8,4096,3072,16,64,256,32,4,4,2014.9613333333334,3
w13,32,128,8,4096,3072,16,64,256,32,4,5,2011.0466666666664,3
w13,32,128,8,4096,3072,16,64,256,32,8,5,2012.4016666666666,3
w13,32,128,8,4096,3072,16,128,128,1,4,5,2008.1136666666669,3
w13,32,128,8,4096,3072,16,128,128,1,8,4,2015.3133333333335,3
w13,32,128,8,4096,3072,16,128,128,1,8,5,2006.3636666666669,3
w13,32,128,8,4096,3072,16,128,128,16,4,5,2010.3423333333333,3
w13,32,128,8,4096,3072,16,128,128,16,8,5,2009.2013333333334,3
w13,32,128,8,4096,3072,16,128,128,32,4,5,2011.1323333333332,3
w13,32,128,8,4096,3072,16,128,128,32,8,5,2010.0763333333332,3
w13,32,128,8,4096,3072,16,128,128,64,4,5,2014.844,3
w13,32,128,8,4096,3072,16,128,128,64,8,5,2012.5506666666668,3
w13,32,128,8,4096,3072,32,32,128,1,4,4,2014.6626666666668,3
w13,32,128,8,4096,3072,32,32,128,1,4,5,2011.441,3
w13,32,128,8,4096,3072,32,32,128,4,4,5,2010.9830000000002,3
w13,32,128,8,4096,3072,32,32,128,16,4,5,2014.311,3
w13,32,128,8,4096,3072,32,32,256,1,4,3,2011.4306666666664,3
w13,32,128,8,4096,3072,32,32,256,1,4,4,2009.2973333333332,3
w13,32,128,8,4096,3072,32,32,256,1,8,4,2013.9053333333334,3
w13,32,128,8,4096,3072,32,32,256,4,4,3,2011.5049999999999,3
w13,32,128,8,4096,3072,32,32,256,4,4,4,2009.9376666666667,3
w13,32,128,8,4096,3072,32,32,256,4,8,4,2015.1646666666666,3
w13,32,128,8,4096,3072,32,32,256,16,4,3,2015.271,3
w13,32,128,8,4096,3072,32,32,256,16,4,4,2012.6893333333335,3
w13,32,128,8,4096,3072,32,64,128,1,4,5,2015.335,3
w13,32,128,8,4096,3072,32,64,128,4,4,5,2014.5026666666665,3
w13,32,128,8,4096,3072,32,64,256,1,4,5,2013.1586666666665,3
w13,32,128,8,4096,3072,32,64,256,1,8,3,2013.1696666666667,3
w13,32,128,8,4096,3072,32,64,256,1,8,4,2011.5163333333333,3
w13,32,128,8,4096,3072,32,64,256,1,8,5,2008.8603333333333,3
w13,32,128,8,4096,3072,32,64,256,8,4,5,2015.0259999999998,3
w13,32,128,8,4096,3072,32,64,256,8,8,4,2012.732,3
w13,32,128,8,4096,3072,32,64,256,8,8,5,2010.4393333333335,3
w13,32,128,8,4096,3072,32,64,256,16,8,4,2015.3673333333334,3
w13,32,128,8,4096,3072,32,64,256,16,8,5,2012.6473333333333,3
w13,32,128,8,4096,3072,32,128,128,1,4,3,2014.0553333333335,3
w13,32,128,8,4096,3072,32,128,128,1,4,4,2011.6446666666668,3
w13,32,128,8,4096,3072,32,128,128,1,4,5,2008.8500000000001,3
w13,32,128,8,4096,3072,32,128,128,1,8,4,2013.9273333333333,3
w13,32,128,8,4096,3072,32,128,128,1,8,5,2012.3586666666667,3
w13,32,128,8,4096,3072,32,128,128,4,4,4,2010.2789999999998,3
w13,32,128,8,4096,3072,32,128,128,4,4,5,2008.9563333333333,3
w13,32,128,8,4096,3072,32,128,128,4,8,4,2011.1966666666667,3
w13,32,128,8,4096,3072,32,128,128,4,8,5,2011.4740000000002,3
w13,32,128,8,4096,3072,32,128,128,8,4,4,2011.0686666666668,3
w13,32,128,8,4096,3072,32,128,128,8,4,5,2011.079,3
w13,32,128,8,4096,3072,32,128,128,8,8,4,2011.0043333333333,3
w13,32,128,8,4096,3072,32,128,128,8,8,5,2011.8153333333332,3
w13,32,128,8,4096,3072,32,128,128,16,4,4,2011.5693333333336,3
w13,32,128,8,4096,3072,32,128,128,16,4,5,2011.6016666666667,3
w13,32,128,8,4096,3072,32,128,128,16,8,4,2014.6523333333334,3
w13,32,128,8,4096,3072,32,128,128,16,8,5,2012.4656666666667,3
w13,32,128,8,4096,3072,32,128,128,32,4,4,2012.6363333333331,3
w13,32,128,8,4096,3072,32,128,128,32,4,5,2013.6286666666667,3
w13,32,128,8,4096,3072,32,128,128,32,8,5,2012.5086666666666,3
w13,32,128,8,4096,3072,64,64,128,1,4,3,2014.6206666666667,3
w13,32,128,8,4096,3072,64,128,128,1,4,4,2012.5193333333334,3
w13,32,128,8,4096,3072,64,128,128,1,8,4,2009.4046666666666,3
w13,32,128,8,4096,3072,64,128,128,4,4,4,2011.975333333333,3
w13,32,128,8,4096,3072,64,128,128,4,8,4,2009.9593333333332,3
w13,32,128,8,4096,3072,64,128,128,16,4,4,2012.7003333333332,3
w13,32,128,8,4096,3072,64,128,128,16,8,4,2010.5353333333333,3
w13,32,128,8,4096,3072,64,128,128,32,4,4,2013.1803333333335,3
w13,32,128,8,4096,3072,64,128,128,32,8,4,2011.9219999999998,3
w13,32,128,8,4096,3072,64,128,128,64,8,4,2014.6629999999998,3
w13,48,8,2,1024,512,16,64,128,32,8,3,5.559333333333334,3
w13,48,8,2,1024,512,16,64,128,64,8,3,5.538,3
w13,48,16,2,1536,768,16,32,128,16,4,2,27.49,3
w13,48,16,4,1536,1024,16,32,64,32,4,3,36.077,3
w13,48,16,4,1536,1024,16,32,64,64,4,3,35.98066666666667,3
w13,48,16,4,1536,1024,16,32,128,1,4,2,36.05566666666667,3
w13,48,16,4,1536,1024,16,32,128,4,4,2,36.10866666666667,3
w13,48,16,4,1536,1024,16,64,128,32,8,2,36.108666666666664,3
w13,48,32,4,2048,768,16,128,128,1,8,2,67.94966666666666,3
w13,48,32,6,3072,1024,16,32,128,4,4,2,132.952,3
w13,48,32,6,3072,1024,16,32,128,16,4,2,132.69633333333334,3
w13,48,32,6,3072,1024,16,128,128,32,4,2,132.79233333333332,3
w13,48,32,6,3072,1024,64,64,64,1,4,3,132.40800000000002,3
w13,48,60,4,2048,1408,16,32,256,1,4,3,223.02266666666665,3
w13,48,60,4,2048,1408,16,32,256,16,4,2,223.01133333333334,3
w13,48,60,4,2048,1408,16,64,128,1,4,2,222.05133333333333,3
w13,48,60,4,2048,1408,16,64,128,1,4,5,222.852,3
w13,48,60,4,2048,1408,16,64,128,1,8,3,223.09733333333335,3
w13,48,60,4,2048,1408,16,64,128,16,4,2,222.649,3
w13,48,60,4,2048,1408,16,64,128,16,8,2,223.15033333333335,3
w13,48,60,4,2048,1408,16,64,128,32,8,5,223.00066666666666,3
w13,48,60,4,2048,1408,32,128,128,1,4,3,222.98000000000002,3
w13,48,60,6,3584,2304,16,32,128,1,4,5,630.5023333333334,3
w13,48,60,6,3584,2304,16,32,128,4,4,5,630.5346666666667,3
w13,48,60,6,3584,2304,16,32,128,16,4,5,630.481,3
w13,48,60,6,3584,2304,16,32,256,1,4,2,630.2040000000001,3
w13,48,60,6,3584,2304,16,32,256,1,4,3,629.1266666666667,3
w13,48,60,6,3584,2304,16,32,256,1,4,4,629.7563333333334,3
w13,48,60,6,3584,2304,16,32,256,1,4,5,628.9663333333333,3
w13,48,60,6,3584,2304,16,32,256,16,4,2,630.6416666666668,3
w13,48,60,6,3584,2304,16,32,256,16,4,3,630.8226666666666,3
w13,48,60,6,3584,2304,16,32,256,16,4,5,630.62,3
w13,48,60,6,3584,2304,16,64,128,1,4,4,629.7453333333333,3
w13,48,60,6,3584,2304,16,64,128,1,4,5,628.7213333333333,3
w13,48,60,6,3584,2304,16,64,128,1,8,5,629.6173333333332,3
w13,48,60,6,3584,2304,16,64,128,16,4,5,629.4253333333332,3
w13,48,60,6,3584,2304,16,64,128,16,8,5,630.364,3
w13,48,60,6,3584,2304,16,64,128,32,4,5,631.0356666666667,3
w13,48,60,6,3584,2304,16,64,256,1,4,2,630.7800000000001,3
w13,48,60,6,3584,2304,16,64,256,1,4,3,628.348,3
w13,48,60,6,3584,2304,16,64,256,1,4,4,630.5023333333334,3
w13,48,60,6,3584,2304,16,64,256,1,4,5,629.799,3
w13,48,60,6,3584,2304,16,64,256,1,8,2,630.6516666666666,3
w13,48,60,6,3584,2304,16,64,256,1,8,3,628.5613333333333,3
w13,48,60,6,3584,2304,16,64,256,1,8,4,631.0466666666666,3
w13,48,60,6,3584,2304,16,64,256,1,8,5,629.9796666666666,3
w13,48,60,6,3584,2304,16,64,256,16,4,2,630.8973333333333,3
w13,48,60,6,3584,2304,16,64,256,16,4,3,631.1106666666666,3
w13,48,60,6,3584,2304,16,64,256,32,4,3,630.6413333333334,3
w13,48,60,6,3584,2304,16,128,128,1,4,2,630.716,3
w13,48,60,6,3584,2304,16,128,128,1,4,5,630.065,3
w13,48,60,6,3584,2304,16,128,128,1,8,4,630.8760000000001,3
w13,48,60,6,3584,2304,16,128,128,1,8,5,627.9746666666666,3
w13,48,60,6,3584,2304,16,128,128,16,4,4,630.7056666666667,3
w13,48,60,6,3584,2304,16,128,128,16,8,4,630.5883333333333,3
w13,48,60,6,3584,2304,16,128,128,16,8,5,629.5426666666666,3
w13,48,60,6,3584,2304,16,128,128,32,8,4,631.0896666666667,3
w13,48,60,6,3584,2304,16,128,128,32,8,5,630.0226666666666,3
w13,48,60,6,3584,2304,32,64,128,1,4,3,630.14,3
w13,48,60,6,3584,2304,32,128,128,1,4,3,629.7669999999999,3
w13,48,60,6,3584,2304,32,128,128,1,8,3,630.481,3
w13,48,60,6,3584,2304,32,128,128,4,4,3,629.5956666666667,3
w13,48,60,6,3584,2304,32,128,128,4,8,3,628.9989999999999,3
w13,48,60,6,3584,2304,32,128,128,4,8,5,630.9830000000001,3
w13,48,60,6,3584,2304,32,128,128,8,4,3,629.02,3
w13,48,60,6,3584,2304,32,128,128,8,4,5,630.513,3
w13,48,60,6,3584,2304,32,128,128,8,8,3,629.3613333333334,3
w13,48,60,6,3584,2304,32,128,128,8,8,5,630.0973333333333,3
w13,48,60,6,3584,2304,32,128,128,16,4,3,629.8946666666667,3
w13,48,60,6,3584,2304,32,128,128,16,8,3,629.2436666666666,3
w13,48,60,6,3584,2304,32,128,128,32,4,3,630.3213333333333,3
w13,48,60,6,3584,2304,32,128,128,32,8,3,629.4576666666667,3
w13,48,60,8,2048,1536,16,32,128,4,4,2,243.66166666666666,3
w13,48,60,8,2048,1536,16,64,128,1,4,2,244.21666666666667,3
w13,48,60,8,2048,1536,16,64,128,16,4,2,244.04566666666665,3
w13,48,60,8,2048,1536,16,64,128,32,4,2,244.121,3
w13,48,60,8,2048,1536,16,64,128,64,4,2,244.48299999999998,3
w13,48,60,8,2048,1536,16,128,128,1,8,2,243.36333333333332,3
w13,48,60,8,2048,1536,16,128,128,1,8,3,244.43033333333332,3
w13,48,60,8,2048,1536,16,128,128,16,8,2,243.886,3
w13,48,64,6,3072,2048,16,32,128,1,4,2,513.5733333333334,3
w13,48,64,6,3072,2048,16,32,128,4,4,2,514.203,3
w13,48,64,6,3072,2048,16,32,128,4,4,5,514.32,3
w13,48,64,6,3072,2048,16,32,256,1,4,3,513.659,3
w13,48,64,6,3072,2048,16,32,256,1,4,4,513.5093333333333,3
w13,48,64,6,3072,2048,16,32,256,1,4,5,512.1446666666667,3
w13,48,64,6,3072,2048,16,32,256,16,4,4,514.2456666666667,3
w13,48,64,6,3072,2048,16,32,256,16,4,5,513.35,3
w13,48,64,6,3072,2048,16,64,128,1,4,3,514.2136666666667,3
w13,48,64,6,3072,2048,16,64,128,1,4,5,513.3713333333334,3
w13,48,64,6,3072,2048,16,64,128,1,8,5,514.3629999999999,3
w13,48,64,6,3072,2048,16,64,256,1,4,3,513.6056666666667,3
w13,48,64,6,3072,2048,16,64,256,1,4,4,513.9150000000001,3
w13,48,64,6,3072,2048,16,64,256,1,4,5,512.88,3
w13,48,64,6,3072,2048,16,64,256,1,8,3,514.2243333333332,3
w13,48,64,6,3072,2048,16,64,256,1,8,4,514.2133333333333,3
w13,48,64,6,3072,2048,16,64,256,1,8,5,514.1603333333334,3
w13,48,64,6,3072,2048,16,128,128,1,4,2,513.84,3
w13,48,64,6,3072,2048,16,128,128,1,4,3,512.4323333333333,3
w13,48,64,6,3072,2048,16,128,128,1,8,3,511.8566666666666,3
w13,48,64,6,3072,2048,16,128,128,1,8,5,512.528,3
w13,48,64,6,3072,2048,16,128,128,16,8,5,514.2669999999999,3
w13,48,64,6,3072,2048,32,128,128,1,4,3,513.8186666666667,3
w13,48,64,6,3584,1536,16,32,128,1,4,3,448.837,3
w13,48,64,6,3584,1536,16,32,128,4,4,3,449.81866666666673,3
w13,48,64,6,3584,1536,16,32,128,16,4,5,450.39466666666664,3
w13,48,64,6,3584,1536,16,32,128,32,4,5,450.5973333333333,3
w13,48,64,6,3584,1536,16,32,256,1,4,2,448.9863333333333,3
w13,48,64,6,3584,1536,16,32,256,1,4,4,449.338,3
w13,48,64,6,3584,1536,16,32,256,1,4,5,449.22133333333335,3
w13,48,64,6,3584,1536,16,32,256,16,4,2,449.7753333333333,3
w13,48,64,6,3584,1536,16,32,256,16,4,4,450.69300000000004,3
w13,48,64,6,3584,1536,16,32,256,16,4,5,450.74666666666667,3
w13,48,64,6,3584,1536,16,64,128,1,4,4,448.6236666666667,3
w13,48,64,6,3584,1536,16,64,128,1,4,5,450.63933333333335,3
w13,48,64,6,3584,1536,16,64,128,1,8,4,450.83166666666665,3
w13,48,64,6,3584,1536,16,64,128,16,4,3,450.14900000000006,3
w13,48,64,6,3584,1536,16,64,256,1,4,3,450.1493333333333,3
w13,48,64,6,3584,1536,16,64,256,1,8,2,450.1493333333333,3
w13,48,64,6,3584,1536,16,64,256,1,8,3,450.309,3
w13,48,64,6,3584,1536,16,128,128,1,4,4,450.853,3
w13,48,64,6,3584,1536,16,128,128,1,4,5,450.8426666666667,3
w13,48,64,6,3584,1536,16,128,128,1,8,2,449.26399999999995,3
w13,48,64,6,3584,1536,16,128,128,1,8,4,449.57300000000004,3
w13,48,64,6,3584,1536,16,128,128,1,8,5,449.7863333333333,3
w13,48,64,6,3584,1536,16,128,128,16,8,2,448.74066666666664,3
w13,48,64,6,3584,1536,16,128,128,32,8,2,450.309,3
w13,48,64,6,3584,1536,16,128,128,64,8,2,450.2663333333333,3
w13,48,64,6,3584,1536,32,32,128,1,4,2,450.73566666666665,3
w13,48,64,6,3584,1536,32,32,128,4,4,2,450.81033333333335,3
w13,48,64,6,3584,1536,32,128,128,1,4,2,450.42633333333333,3
w13,48,64,6,3584,1536,32,128,128,1,4,3,450.789,3
w13,48,64,6,3584,1536,32,128,128,4,4,2,450.5756666666667,3
w13,48,64,6,3584,1536,32,128,128,4,8,3,450.87433333333337,3
w13,48,64,6,3584,1536,32,128,128,8,4,3,450.1383333333333,3
w13,48,64,6,3584,1536,32,128,128,8,8,3,450.82099999999997,3
w13,48,64,6,3584,1536,32,128,128,16,8,3,450.78866666666664,3
w13,48,64,6,3584,1536,64,64,64,1,4,3,450.52233333333334,3
w13,48,64,8,3584,2560,16,32,128,1,4,5,747.7196666666667,3
w13,48,64,8,3584,2560,16,32,128,4,4,5,748.1143333333333,3
w13,48,64,8,3584,2560,16,32,256,1,4,2,747.7623333333332,3
w13,48,64,8,3584,2560,16,32,256,1,4,3,746.5889999999999,3
w13,48,64,8,3584,2560,16,32,256,1,4,4,747.9119999999999,3
w13,48,64,8,3584,2560,16,32,256,1,4,5,745.2666666666668,3
w13,48,64,8,3584,2560,16,32,256,16,4,5,748.0076666666668,3
w13,48,64,8,3584,2560,16,64,128,1,4,3,746.6956666666666,3
w13,48,64,8,3584,2560,16,64,128,1,4,4,747.592,3
w13,48,64,8,3584,2560,16,64,128,1,4,5,744.882,3
w13,48,64,8,3584,2560,16,64,128,1,8,5,746.493,3
w13,48,64,8,3584,2560,16,64,128,16,4,5,747.5596666666667,3
w13,48,64,8,3584,2560,16,64,256,1,4,3,745.7036666666667,3
w13,48,64,8,3584,2560,16,64,256,1,4,4,748.413,3
w13,48,64,8,3584,2560,16,64,256,1,4,5,747.4423333333334,3
w13,48,64,8,3584,2560,16,64,256,1,8,2,747.4103333333333,3
w13,48,64,8,3584,2560,16,64,256,1,8,3,746.2689999999999,3
w13,48,64,8,3584,2560,16,64,256,1,8,4,747.7303333333333,3
w13,48,64,8,3584,2560,16,64,256,1,8,5,746.61,3
w13,48,64,8,3584,2560,16,64,256,16,4,3,748.232,3
w13,48,64,8,3584,2560,16,64,256,16,8,3,747.4956666666667,3
w13,48,64,8,3584,2560,16,128,128,1,4,5,746.6743333333334,3
w13,48,64,8,3584,2560,16,128,128,1,8,3,748.0503333333332,3
w13,48,64,8,3584,2560,16,128,128,1,8,4,747.7513333333333,3
w13,48,64,8,3584,2560,16,128,128,1,8,5,744.7330000000001,3
w13,48,64,8,3584,2560,16,128,128,16,4,4,748.253,3
w13,48,64,8,3584,2560,16,128,128,16,4,5,747.378,3
w13,48,64,8,3584,2560,16,128,128,16,8,5,747.9433333333333,3
w13,48,64,8,3584,2560,16,128,128,32,8,5,747.0053333333334,3
w13,48,64,8,3584,2560,32,32,128,1,4,4,747.8366666666667,3
w13,48,64,8,3584,2560,32,64,128,1,8,5,748.445,3
w13,48,64,8,3584,2560,32,64,128,4,4,2,748.4023333333333,3
w13,48,64,8,3584,2560,32,128,128,1,4,5,746.6316666666667,3
w13,48,64,8,3584,2560,32,128,128,1,8,5,747.8046666666668,3
w13,48,64,8,3584,2560,32,128,128,4,4,5,747.8156666666667,3
w13,48,64,8,3584,2560,32,128,128,4,8,5,747.6129999999999,3
w13,48,64,8,3584,2560,32,128,128,8,4,5,748.1676666666666,3
w13,48,64,8,3584,2560,32,128,128,8,8,5,747.5383333333333,3
w13,48,64,8,3584,2560,32,128,128,16,4,5,748.1143333333333,3
w13,48,64,8,3584,2560,32,128,128,16,8,5,747.794,3
w13,48,128,4,2048,512,16,32,128,1,4,5,173.49699999999999,3
w13,48,128,4,2048,512,16,32,128,4,4,5,173.07033333333334,3
w13,48,128,4,2048,512,16,32,128,16,4,5,173.1016666666667,3
w13,48,128,4,2048,512,16,32,256,1,4,3,173.08066666666664,3
w13,48,128,4,2048,512,16,32,256,16,4,3,172.82466666666664,3
w13,48,128,4,2048,512,16,32,256,32,4,3,173.14433333333332,3
w13,48,128,4,2048,512,16,32,256,64,4,3,173.46433333333334,3
w13,48,128,4,2048,512,16,64,128,1,4,3,173.31566666666666,3
w13,48,128,4,2048,512,16,64,128,1,4,4,172.97400000000002,3
w13,48,128,4,2048,512,16,64,128,1,4,5,172.6963333333333,3
w13,48,128,4,2048,512,16,64,128,16,4,3,173.187,3
w13,48,128,4,2048,512,16,64,128,16,4,4,173.12400000000002,3
w13,48,128,4,2048,512,16,64,128,16,4,5,173.23033333333333,3
w13,48,128,4,2048,512,16,64,128,32,4,3,172.963,3
w13,48,128,4,2048,512,16,64,128,32,4,4,173.33666666666667,3
w13,48,128,4,2048,512,16,64,128,64,4,3,173.13400000000001,3
w13,48,128,4,2048,512,16,64,128,64,4,5,173.50733333333335,3
w13,48,128,4,2048,512,16,64,256,1,4,2,173.12333333333333,3
w13,48,128,4,2048,512,16,64,256,1,8,3,173.379,3
w13,48,128,4,2048,512,16,64,256,16,8,3,173.48566666666667,3
w13,48,128,4,2048,512,16,64,256,32,8,3,173.41133333333335,3
w13,48,128,4,2048,512,16,128,128,1,8,2,173.16566666666668,3
w13,48,128,4,2048,512,16,128,128,1,8,5,173.26200000000003,3
w13,48,128,4,2048,512,16,128,128,16,8,2,173.55033333333336,3
w13,48,128,4,2048,512,16,128,128,32,4,2,173.43266666666668,3
w13,48,128,4,2048,512,16,128,128,32,8,2,173.40033333333335,3
w13,48,128,4,2048,512,32,128,128,32,4,3,173.40033333333335,3
w13,48,128,6,4096,2048,16,16,256,1,4,3,1346.4546666666668,3
w13,48,128,6,4096,2048,16,16,256,1,4,4,1344.8656666666666,3
w13,48,128,6,4096,2048,16,16,256,1,4,5,1343.5746666666666,3
w13,48,128,6,4096,2048,16,16,256,4,4,3,1347.2756666666667,3
w13,48,128,6,4096,2048,16,16,256,4,4,4,1345.9853333333333,3
w13,48,128,6,4096,2048,16,16,256,4,4,5,1344.0866666666668,3
w13,48,128,6,4096,2048,16,32,128,1,4,5,1346.9986666666666,3
w13,48,128,6,4096,2048,16,32,128,4,4,5,1347.3506666666665,3
w13,48,128,6,4096,2048,16,32,128,16,4,5,1346.892,3
w13,48,128,6,4096,2048,16,32,256,1,4,3,1344.4486666666667,3
w13,48,128,6,4096,2048,16,32,256,1,4,4,1346.54,3
w13,48,128,6,4096,2048,16,32,256,1,4,5,1341.2703333333332,3
w13,48,128,6,4096,2048,16,32,256,1,8,5,1345.2173333333333,3
w13,48,128,6,4096,2048,16,32,256,16,4,3,1346.1663333333333,3
w13,48,128,6,4096,2048,16,32,256,16,4,4,1347.265,3
w13,48,128,6,4096,2048,16,32,256,16,4,5,1343.4356666666665,3
w13,48,128,6,4096,2048,16,64,128,1,4,4,1347.02,3
w13,48,128,6,4096,2048,16,64,128,1,4,5,1344.0436666666667,3
w13,48,128,6,4096,2048,16,64,128,1,8,5,1345.5053333333333,3
w13,48,128,6,4096,2048,16,64,128,16,4,5,1345.11,3
w13,48,128,6,4096,2048,16,64,128,16,8,5,1347.404,3
w13,48,128,6,4096,2048,16,64,128,32,4,5,1346.6573333333333,3
w13,48,128,6,4096,2048,16,64,256,1,4,3,1343.2436666666667,3
w13,48,128,6,4096,2048,16,64,256,1,4,4,1341.4413333333332,3
w13,48,128,6,4096,2048,16,64,256,1,4,5,1341.0466666666666,3
w13,48,128,6,4096,2048,16,64,256,1,8,3,1343.5853333333334,3
w13,48,128,6,4096,2048,16,64,256,1,8,4,1341.74,3
w13,48,128,6,4096,2048,16,64,256,1,8,5,1341.665,3
w13,48,128,6,4096,2048,16,64,256,16,4,3,1344.1933333333334,3
w13,48,128,6,4096,2048,16,64,256,16,4,4,1345.4089999999999,3
w13,48,128,6,4096,2048,16,64,256,16,4,5,1343.5103333333334,3
w13,48,128,6,4096,2048,16,64,256,16,8,3,1345.5156666666667,3
w13,48,128,6,4096,2048,16,64,256,16,8,4,1345.548,3
w13,48,128,6,4096,2048,16,64,256,16,8,5,1344.6409999999998,3
w13,48,128,6,4096,2048,16,64,256,32,4,3,1345.761,3
w13,48,128,6,4096,2048,16,64,256,32,4,5,1346.668,3
w13,48,128,6,4096,2048,16,64,256,32,8,3,1347.0413333333333,3
w13,48,128,6,4096,2048,16,128,128,1,4,4,1347.4576666666667,3
w13,48,128,6,4096,2048,16,128,128,1,4,5,1343.3506666666665,3
w13,48,128,6,4096,2048,16,128,128,1,8,4,1346.5926666666667,3
w13,48,128,6,4096,2048,16,128,128,1,8,5,1340.95,3
w13,48,128,6,4096,2048,16,128,128,16,4,5,1344.5663333333332,3
w13,48,128,6,4096,2048,16,128,128,16,8,4,1347.18,3
w13,48,128,6,4096,2048,16,128,128,16,8,5,1341.9953333333333,3
w13,48,128,6,4096,2048,16,128,128,32,4,5,1344.6516666666666,3
w13,48,128,6,4096,2048,16,128,128,32,8,5,1344.0116666666665,3
w13,48,128,6,4096,2048,16,128,128,64,4,4,1347.2549999999999,3
w13,48,128,6,4096,2048,16,128,128,64,8,5,1346.5926666666667,3
w13,48,128,6,4096,2048,32,32,128,1,4,4,1346.9983333333332,3
w13,48,128,6,4096,2048,32,32,128,1,4,5,1345.5586666666668,3
w13,48,128,6,4096,2048,32,32,128,4,4,4,1347.6813333333332,3
w13,48,128,6,4096,2048,32,32,128,4,4,5,1345.3986666666667,3
w13,48,128,6,4096,2048,32,32,128,16,4,5,1346.2306666666666,3
w13,48,128,6,4096,2048,32,32,256,1,4,3,1345.0356666666667,3
w13,48,128,6,4096,2048,32,32,256,1,4,4,1345.7293333333334,3
w13,48,128,6,4096,2048,32,32,256,4,4,3,1345.7186666666666,3
w13,48,128,6,4096,2048,32,32,256,4,4,4,1345.558,3
w13,48,128,6,4096,2048,32,32,256,16,4,3,1347.585,3
w13,48,128,6,4096,2048,32,64,128,1,8,5,1346.668,3
w13,48,128,6,4096,2048,32,64,256,1,4,3,1347.116,3
w13,48,128,6,4096,2048,32,64,256,1,8,3,1346.9023333333332,3
w13,48,128,6,4096,2048,32,64,256,1,8,4,1346.3156666666666,3
w13,48,128,6,4096,2048,32,64,256,8,8,3,1346.2093333333335,3
w13,48,128,6,4096,2048,32,64,256,8,8,4,1346.7953333333332,3
w13,48,128,6,4096,2048,32,64,256,8,8,5,1345.4736666666668,3
w13,48,128,6,4096,2048,32,128,128,1,4,3,1346.4756666666667,3
w13,48,128,6,4096,2048,32,128,128,1,4,4,1346.1986666666667,3
w13,48,128,6,4096,2048,32,128,128,1,4,5,1344.065,3
w13,48,128,6,4096,2048,32,128,128,1,8,3,1347.6273333333331,3
w13,48,128,6,4096,2048,32,128,128,1,8,4,1344.4703333333334,3
w13,48,128,6,4096,2048,32,128,128,1,8,5,1345.4946666666667,3
w13,48,128,6,4096,2048,32,128,128,4,4,4,1345.4089999999999,3
w13,48,128,6,4096,2048,32,128,128,4,4,5,1344.3423333333333,3
w13,48,128,6,4096,2048,32,128,128,4,8,4,1344.9393333333335,3
w13,48,128,6,4096,2048,32,128,128,4,8,5,1345.8036666666667,3
w13,48,128,6,4096,2048,32,128,128,8,4,4,1344.321,3
w13,48,128,6,4096,2048,32,128,128,8,4,5,1345.068,3
w13,48,128,6,4096,2048,32,128,128,8,8,4,1344.8443333333335,3
w13,48,128,6,4096,2048,32,128,128,8,8,5,1345.238,3
w13,48,128,6,4096,2048,32,128,128,16,4,4,1345.0040000000001,3
w13,48,128,6,4096,2048,32,128,128,16,4,5,1344.1716666666669,3
w13,48,128,6,4096,2048,32,128,128,16,8,4,1345.8463333333332,3
w13,48,128,6,4096,2048,32,128,128,16,8,5,1346.2626666666665,3
w13,48,128,6,4096,2048,32,128,128,32,4,3,1346.0706666666667,3
w13,48,128,6,4096,2048,32,128,128,32,4,4,1346.3373333333332,3
w13,48,128,6,4096,2048,32,128,128,32,4,5,1345.8890000000001,3
w13,48,128,6,4096,2048,32,128,128,32,8,4,1346.6463333333334,3
w13,48,128,6,4096,2048,32,128,128,32,8,5,1347.4146666666668,3
w13,48,128,6,4096,2048,64,64,128,1,4,3,1346.4113333333332,3
w13,48,128,6,4096,2048,64,128,128,1,4,4,1346.6463333333334,3
w13,48,128,6,4096,2048,64,128,128,1,8,4,1343.724,3
w13,48,128,6,4096,2048,64,128,128,4,4,4,1346.0706666666667,3
w13,48,128,6,4096,2048,64,128,128,4,8,4,1343.1903333333332,3
w13,48,128,6,4096,2048,64,128,128,16,4,4,1346.3373333333332,3
w13,48,128,6,4096,2048,64,128,128,16,8,4,1343.5316666666668,3
w13,48,128,6,4096,2048,64,128,128,32,8,4,1344.7163333333335,3
w13,48,128,8,2048,768,16,32,256,1,4,2,258.1476666666667,3
w13,48,128,8,2048,768,16,32,256,16,4,2,258.276,3
w13,48,128,8,2048,768,16,64,128,1,4,4,257.96633333333335,3
w13,48,128,8,2048,768,16,64,128,1,4,5,258.0516666666667,3
w13,48,128,8,2048,768,16,64,256,1,4,2,258.0516666666667,3
w13,48,128,8,2048,768,16,128,128,1,4,2,257.8386666666667,3
w13,48,128,8,2048,768,16,128,128,1,8,2,257.2513333333333,3
w13,48,128,8,2048,768,16,128,128,16,4,2,258.08366666666666,3
w13,48,128,8,2048,768,16,128,128,16,8,2,257.43333333333334,3
w13,48,128,8,2048,768,16,128,128,32,4,2,258.27566666666667,3
w13,48,128,8,2048,768,16,128,128,32,8,2,257.42233333333337,3
w13,48,128,8,2048,768,16,128,128,64,4,2,258.5316666666667,3
w13,48,128,8,2048,768,16,128,128,64,8,2,257.9023333333334,3
w13,48,128,8,4096,1536,16,16,256,1,4,4,1013.7579999999999,3
w13,48,128,8,4096,1536,16,16,256,1,4,5,1013.7263333333334,3
w13,48,128,8,4096,1536,16,16,256,4,4,4,1014.8566666666667,3
w13,48,128,8,4096,1536,16,16,256,4,4,5,1013.3313333333334,3
w13,48,128,8,4096,1536,16,32,128,1,4,5,1012.1793333333334,3
w13,48,128,8,4096,1536,16,32,256,1,4,3,1012.7663333333334,3
w13,48,128,8,4096,1536,16,32,256,1,4,4,1014.4836666666666,3
w13,48,128,8,4096,1536,16,32,256,1,4,5,1010.0566666666667,3
w13,48,128,8,4096,1536,16,32,256,1,8,5,1013.7366666666667,3
w13,48,128,8,4096,1536,16,32,256,16,4,5,1010.878,3
w13,48,128,8,4096,1536,16,32,256,32,4,5,1013.9503333333333,3
w13,48,128,8,4096,1536,16,64,128,1,4,4,1013.8433333333332,3
w13,48,128,8,4096,1536,16,64,128,1,4,5,1012.6913333333333,3
w13,48,128,8,4096,1536,16,64,128,1,8,4,1015.102,3
w13,48,128,8,4096,1536,16,64,128,1,8,5,1014.1956666666666,3
w13,48,128,8,4096,1536,16,64,128,16,4,5,1014.206,3
w13,48,128,8,4096,1536,16,64,128,16,8,5,1015.081,3
w13,48,128,8,4096,1536,16,64,128,32,4,5,1014.5796666666666,3
w13,48,128,8,4096,1536,16,64,256,1,4,3,1011.1343333333334,3
w13,48,128,8,4096,1536,16,64,256,1,4,4,1011.6460000000001,3
w13,48,128,8,4096,1536,16,64,256,1,4,5,1010.2376666666665,3
w13,48,128,8,4096,1536,16,64,256,1,8,3,1013.2996666666667,3
w13,48,128,8,4096,1536,16,64,256,1,8,4,1010.8566666666666,3
w13,48,128,8,4096,1536,16,64,256,1,8,5,1010.9633333333335,3
w13,48,128,8,4096,1536,16,64,256,16,4,3,1014.1636666666667,3
w13,48,128,8,4096,1536,16,64,256,16,4,4,1014.1203333333333,3
w13,48,128,8,4096,1536,16,64,256,16,4,5,1011.9553333333333,3
w13,48,128,8,4096,1536,16,64,256,16,8,4,1014.0353333333333,3
w13,48,128,8,4096,1536,16,64,256,32,4,5,1013.6730000000001,3
w13,48,128,8,4096,1536,16,128,128,1,4,4,1014.2696666666667,3
w13,48,128,8,4096,1536,16,128,128,1,4,5,1014.0463333333333,3
w13,48,128,8,4096,1536,16,128,128,1,8,4,1013.9613333333333,3
w13,48,128,8,4096,1536,16,128,128,1,8,5,1011.006,3
w13,48,128,8,4096,1536,16,128,128,16,4,5,1013.918,3
w13,48,128,8,4096,1536,16,128,128,16,8,5,1013.9823333333334,3
w13,48,128,8,4096,1536,16,128,128,32,4,5,1014.3343333333333,3
w13,48,128,8,4096,1536,16,128,128,32,8,5,1013.6516666666666,3
w13,48,128,8,4096,1536,32,32,128,1,4,5,1014.8033333333333,3
w13,48,128,8,4096,1536,32,32,128,4,4,5,1013.7689999999999,3
w13,48,128,8,4096,1536,32,32,256,1,4,3,1014.5583333333334,3
w13,48,128,8,4096,1536,32,32,256,1,4,4,1014.2703333333333,3
w13,48,128,8,4096,1536,32,32,256,4,4,3,1014.6116666666667,3
w13,48,128,8,4096,1536,32,32,256,4,4,4,1014.3770000000001,3
w13,48,128,8,4096,1536,32,64,256,1,8,3,1014.7926666666667,3
w13,48,128,8,4096,1536,32,64,256,1,8,5,1014.1316666666667,3
w13,48,128,8,4096,1536,32,128,128,1,4,4,1013.225,3
w13,48,128,8,4096,1536,32,128,128,1,4,5,1012.1796666666665,3
w13,48,128,8,4096,1536,32,128,128,1,8,5,1012.5526666666666,3
w13,48,128,8,4096,1536,32,128,128,4,4,4,1014.6433333333333,3
w13,48,128,8,4096,1536,32,128,128,4,4,5,1013.2890000000001,3
w13,48,128,8,4096,1536,32,128,128,4,8,5,1014.2273333333333,3
w13,48,128,8,4096,1536,32,128,128,8,4,4,1014.0356666666667,3
w13,48,128,8,4096,1536,32,128,128,8,4,5,1013.0540000000001,3
w13,48,128,8,4096,1536,32,128,128,16,4,4,1013.4276666666666,3
w13,48,128,8,4096,1536,32,128,128,16,4,5,1014.7823333333332,3
w13,48,128,8,4096,1536,32,128,128,32,4,5,1014.3663333333334,3
w13,48,128,8,4096,1536,64,128,128,1,4,4,1014.6433333333333,3
w13,48,128,8,4096,1536,64,128,128,1,8,4,1012.1259999999999,3
w13,48,128,8,4096,1536,64,128,128,4,4,4,1014.4943333333334,3
w13,48,128,8,4096,1536,64,128,128,4,8,4,1012.9899999999999,3
w13,48,128,8,4096,1536,64,128,128,16,4,4,1014.7503333333334,3
w13,48,128,8,4096,1536,64,128,128,16,8,4,1014.953,3
w13,48,128,8,4096,1536,64,128,128,32,8,4,1015.1126666666668,3
w13,48,128,8,4096,3072,16,16,128,1,4,5,2019.2176666666667,3
w13,48,128,8,4096,3072,16,16,128,4,4,5,2018.2366666666667,3
w13,48,128,8,4096,3072,16,16,256,1,4,3,2016.6580000000001,3
w13,48,128,8,4096,3072,16,16,256,1,4,4,2013.8736666666666,3
w13,48,128,8,4096,3072,16,16,256,1,4,5,2011.3883333333333,3
w13,48,128,8,4096,3072,16,16,256,4,4,3,2017.4046666666666,3
w13,48,128,8,4096,3072,16,16,256,4,4,4,2014.994,3
w13,48,128,8,4096,3072,16,16,256,4,4,5,2014.2366666666667,3
w13,48,128,8,4096,3072,16,32,256,1,4,3,2018.3753333333334,3
w13,48,128,8,4096,3072,16,32,256,1,4,4,2018.8016666666665,3
w13,48,128,8,4096,3072,16,32,256,1,4,5,2010.5993333333333,3
w13,48,128,8,4096,3072,16,32,256,1,8,5,2014.482,3
w13,48,128,8,4096,3072,16,32,256,16,4,5,2013.661,3
w13,48,128,8,4096,3072,16,32,256,16,8,5,2019.5486666666666,3
w13,48,128,8,4096,3072,16,32,256,32,4,5,2019.9536666666665,3
w13,48,128,8,4096,3072,16,64,128,1,4,4,2019.527,3
w13,48,128,8,4096,3072,16,64,128,1,4,5,2015.2286666666666,3
w13,48,128,8,4096,3072,16,64,128,1,8,5,2017.6283333333333,3
w13,48,128,8,4096,3072,16,64,128,16,4,5,2020.1993333333332,3
w13,48,128,8,4096,3072,16,64,256,1,4,3,2015.09,3
w13,48,128,8,4096,3072,16,64,256,1,4,4,2012.722,3
w13,48,128,8,4096,3072,16,64,256,1,4,5,2011.0900000000001,3
w13,48,128,8,4096,3072,16,64,256,1,8,3,2019.218,3
w13,48,128,8,4096,3072,16,64,256,1,8,4,2010.994,3
w13,48,128,8,4096,3072,16,64,256,1,8,5,2012.5086666666666,3
w13,48,128,8,4096,3072,16,64,256,16,4,3,2019.911,3
w13,48,128,8,4096,3072,16,64,256,16,4,4,2016.4986666666666,3
w13,48,128,8,4096,3072,16,64,256,16,4,5,2014.1726666666666,3
w13,48,128,8,4096,3072,16,64,256,16,8,4,2018.173,3
w13,48,128,8,4096,3072,16,64,256,16,8,5,2015.4416666666666,3
w13,48,128,8,4096,3072,16,64,256,32,4,5,2018.2363333333333,3
w13,48,128,8,4096,3072,16,64,256,32,8,5,2020.071,3
w13,48,128,8,4096,3072,16,128,128,1,4,5,2012.9993333333332,3
w13,48,128,8,4096,3072,16,128,128,1,8,4,2018.9616666666668,3
w13,48,128,8,4096,3072,16,128,128,1,8,5,2011.6873333333333,3
w13,48,128,8,4096,3072,16,128,128,16,4,5,2014.4930000000002,3
w13,48,128,8,4096,3072,16,128,128,16,8,5,2013.0846666666666,3
w13,48,128,8,4096,3072,16,128,128,32,4,5,2015.7513333333334,3
w13,48,128,8,4096,3072,16,128,128,32,8,5,2014.5353333333333,3
w13,48,128,8,4096,3072,16,128,128,64,8,5,2019.3136666666667,3
w13,48,128,8,4096,3072,32,32,128,1,4,5,2017.97,3
w13,48,128,8,4096,3072,32,32,128,4,4,5,2016.6050000000002,3
w13,48,128,8,4096,3072,32,32,256,1,4,3,2016.3806666666667,3
w13,48,128,8,4096,3072,32,32,256,1,4,4,2015.1323333333332,3
w13,48,128,8,4096,3072,32,32,256,1,8,4,2019.3679999999997,3
w13,48,128,8,4096,3072,32,32,256,4,4,3,2017.2023333333334,3
w13,48,128,8,4096,3072,32,32,256,4,4,4,2016.4660000000001,3
w13,48,128,8,4096,3072,32,32,256,16,4,4,2019.1223333333335,3
w13,48,128,8,4096,3072,32,64,128,1,4,5,2020.4766666666667,3
w13,48,128,8,4096,3072,32,64,128,4,4,5,2020.1779999999999,3
w13,48,128,8,4096,3072,32,64,256,1,4,5,2018.29,3
w13,48,128,8,4096,3072,32,64,256,1,8,3,2018.6523333333334,3
w13,48,128,8,4096,3072,32,64,256,1,8,4,2015.5810000000001,3
w13,48,128,8,4096,3072,32,64,256,1,8,5,2014.7806666666668,3
w13,48,128,8,4096,3072,32,64,256,8,8,4,2018.5886666666665,3
w13,48,128,8,4096,3072,32,64,256,8,8,5,2016.5193333333334,3
w13,48,128,8,4096,3072,32,64,256,16,8,5,2017.874,3
w13,48,128,8,4096,3072,32,128,128,1,4,3,2018.023,3
w13,48,128,8,4096,3072,32,128,128,1,4,4,2014.6850000000002,3
w13,48,128,8,4096,3072,32,128,128,1,4,5,2013.2446666666667,3
w13,48,128,8,4096,3072,32,128,128,1,8,4,2017.405,3
w13,48,128,8,4096,3072,32,128,128,1,8,5,2014.514,3
w13,48,128,8,4096,3072,32,128,128,4,4,4,2014.514,3
w13,48,128,8,4096,3072,32,128,128,4,4,5,2013.2766666666666,3
w13,48,128,8,4096,3072,32,128,128,4,8,4,2015.25,3
w13,48,128,8,4096,3072,32,128,128,4,8,5,2015.1753333333334,3
w13,48,128,8,4096,3072,32,128,128,8,4,4,2014.546,3
w13,48,128,8,4096,3072,32,128,128,8,4,5,2014.9620000000002,3
w13,48,128,8,4096,3072,32,128,128,8,8,4,2017.3833333333332,3
w13,48,128,8,4096,3072,32,128,128,8,8,5,2014.8766666666668,3
w13,48,128,8,4096,3072,32,128,128,16,4,3,2019.1116666666667,3
w13,48,128,8,4096,3072,32,128,128,16,4,4,2015.7943333333333,3
w13,48,128,8,4096,3072,32,128,128,16,4,5,2015.0683333333334,3
w13,48,128,8,4096,3072,32,128,128,16,8,4,2017.586,3
w13,48,128,8,4096,3072,32,128,128,16,8,5,2016.4873333333335,3
w13,48,128,8,4096,3072,32,128,128,32,4,4,2016.0073333333332,3
w13,48,128,8,4096,3072,32,128,128,32,4,5,2016.8716666666667,3
w13,48,128,8,4096,3072,32,128,128,32,8,4,2018.823333333333,3
w13,48,128,8,4096,3072,32,128,128,32,8,5,2016.338,3
w13,48,128,8,4096,3072,32,128,128,64,8,5,2020.3486666666668,3
w13,48,128,8,4096,3072,64,64,128,1,4,3,2020.6473333333333,3
w13,48,128,8,4096,3072,64,128,128,1,4,4,2016.1566666666668,3
w13,48,128,8,4096,3072,64,128,128,1,8,4,2013.4256666666668,3
w13,48,128,8,4096,3072,64,128,128,4,4,4,2015.3783333333333,3
w13,48,128,8,4096,3072,64,128,128,4,8,4,2013.3196666666665,3
w13,48,128,8,4096,3072,64,128,128,16,4,4,2016.6473333333333,3
w13,48,128,8,4096,3072,64,128,128,16,8,4,2015.5166666666667,3
w13,48,128,8,4096,3072,64,128,128,32,4,4,2018.098,3
w13,48,128,8,4096,3072,64,128,128,32,8,4,2016.6899999999998,3
w13,48,128,8,4096,3072,64,128,128,64,8,4,2019.0583333333334,3
w13,64,8,2,1024,512,16,64,128,16,8,3,5.580666666666667,3
w13,64,8,2,1024,512,16,64,128,32,8,3,5.581,3
w13,64,8,2,1024,512,16,64,128,64,8,3,5.559,3
w13,64,16,2,1536,768,16,32,128,16,4,2,27.394333333333332,3
w13,64,16,4,1536,1024,16,32,128,16,4,2,36.24766666666667,3
w13,64,16,4,1536,1024,16,64,64,64,4,3,36.16233333333333,3
w13,64,32,4,2048,768,16,64,64,1,4,3,68.24733333333334,3
w13,64,32,4,2048,768,16,64,64,32,4,3,68.195,3
w13,64,32,4,2048,768,16,64,128,16,4,2,68.30133333333333,3
w13,64,32,4,2048,768,16,128,128,1,8,2,67.97066666666666,3
w13,64,32,6,3072,1024,16,32,128,4,4,2,133.36800000000002,3
w13,64,32,6,3072,1024,16,32,128,16,4,2,133.11233333333334,3
w13,64,32,6,3072,1024,16,32,128,64,4,2,133.77366666666668,3
w13,64,32,6,3072,1024,16,128,128,16,4,2,133.61333333333334,3
w13,64,32,6,3072,1024,16,128,128,32,4,2,133.36800000000002,3
w13,64,32,6,3072,1024,64,64,64,64,4,3,133.60266666666666,3
w13,64,60,4,2048,1408,16,32,128,1,4,2,224.51533333333336,3
w13,64,60,4,2048,1408,16,32,128,1,4,4,224.5583333333333,3
w13,64,60,4,2048,1408,16,32,128,1,4,5,223.92933333333335,3
w13,64,60,4,2048,1408,16,32,128,4,4,5,223.99233333333333,3
w13,64,60,4,2048,1408,16,32,128,16,4,5,224.04600000000002,3
w13,64,60,4,2048,1408,16,32,128,32,4,5,224.697,3
w13,64,60,4,2048,1408,16,32,256,1,4,2,223.75833333333333,3
w13,64,60,4,2048,1408,16,32,256,1,4,3,224.1526666666667,3
w13,64,60,4,2048,1408,16,32,256,1,4,5,224.35566666666668,3
w13,64,60,4,2048,1408,16,32,256,16,4,2,223.91833333333332,3
w13,64,60,4,2048,1408,16,32,256,16,4,3,224.06766666666667,3
w13,64,60,4,2048,1408,16,32,256,16,4,5,224.75,3
w13,64,60,4,2048,1408,16,32,256,32,4,2,224.77166666666668,3
w13,64,60,4,2048,1408,16,64,128,1,4,2,224.03599999999997,3
w13,64,60,4,2048,1408,16,64,128,1,4,3,224.48366666666666,3
w13,64,60,4,2048,1408,16,64,128,1,4,4,223.95000000000002,3
w13,64,60,4,2048,1408,16,64,128,1,4,5,224.47266666666667,3
w13,64,60,4,2048,1408,16,64,128,1,8,3,224.16366666666667,3
w13,64,60,4,2048,1408,16,64,128,1,8,5,224.22733333333335,3
w13,64,60,4,2048,1408,16,64,128,16,4,2,223.737,3
w13,64,60,4,2048,1408,16,64,128,16,4,3,224.13133333333334,3
w13,64,60,4,2048,1408,16,64,128,16,4,5,223.82233333333332,3
w13,64,60,4,2048,1408,16,64,128,16,8,2,224.33433333333332,3
w13,64,60,4,2048,1408,16,64,128,16,8,3,224.75,3
w13,64,60,4,2048,1408,16,64,128,16,8,5,224.42,3
w13,64,60,4,2048,1408,16,64,128,32,4,2,224.32399999999998,3
w13,64,60,4,2048,1408,16,64,128,32,4,4,224.68633333333332,3
w13,64,60,4,2048,1408,16,64,128,32,8,5,224.76133333333334,3
w13,64,60,4,2048,1408,16,64,256,1,4,2,223.7586666666667,3
w13,64,60,4,2048,1408,16,64,256,1,4,3,224.793,3
w13,64,60,4,2048,1408,16,64,256,1,8,3,224.52666666666667,3
w13,64,60,4,2048,1408,16,64,256,16,4,3,224.63333333333333,3
w13,64,60,4,2048,1408,16,64,256,16,8,3,224.67533333333333,3
w13,64,60,4,2048,1408,16,64,256,32,8,3,224.803,3
w13,64,60,4,2048,1408,16,128,128,1,8,4,224.07833333333335,3
w13,64,60,4,2048,1408,16,128,128,1,8,5,223.68366666666668,3
w13,64,60,4,2048,1408,32,32,128,1,4,4,224.761,3
w13,64,60,4,2048,1408,32,64,128,1,4,2,224.29166666666666,3
w13,64,60,4,2048,1408,32,64,128,4,4,2,224.09966666666665,3
w13,64,60,4,2048,1408,32,64,128,4,4,3,224.729,3
w13,64,60,4,2048,1408,32,64,128,16,4,2,224.1743333333333,3
w13,64,60,4,2048,1408,32,128,128,1,4,3,224.37700000000004,3
w13,64,60,4,2048,1408,32,128,128,1,8,3,224.17433333333335,3
w13,64,60,4,2048,1408,32,128,128,4,4,3,224.01433333333333,3
w13,64,60,4,2048,1408,32,128,128,4,8,3,224.6436666666667,3
w13,64,60,4,2048,1408,32,128,128,8,4,3,224.25966666666667,3
w13,64,60,4,2048,1408,32,128,128,16,4,3,224.22766666666666,3
w13,64,60,6,3584,2304,16,32,128,1,4,5,631.6546666666667,3
w13,64,60,6,3584,2304,16,32,256,1,4,2,632.0279999999999,3
w13,64,60,6,3584,2304,16,32,256,1,4,3,631.3670000000001,3
w13,64,60,6,3584,2304,16,32,256,1,4,5,631.516,3
w13,64,60,6,3584,2304,16,64,128,1,4,4,630.6733333333333,3
w13,64,60,6,3584,2304,16,64,128,1,4,5,630.791,3
w13,64,60,6,3584,2304,16,64,128,1,8,5,631.1216666666666,3
w13,64,60,6,3584,2304,16,64,128,16,4,5,631.7083333333334,3
w13,64,60,6,3584,2304,16,64,256,1,4,3,630.5773333333333,3
w13,64,60,6,3584,2304,16,64,256,1,8,2,631.6013333333334,3
w13,64,60,6,3584,2304,16,64,256,1,8,3,631.4733333333334,3
w13,64,60,6,3584,2304,16,128,128,1,4,2,631.964,3
w13,64,60,6,3584,2304,16,128,128,1,4,4,631.0790000000001,3
w13,64,60,6,3584,2304,16,128,128,1,4,5,631.591,3
w13,64,60,6,3584,2304,16,128,128,1,8,4,631.8783333333333,3
w13,64,60,6,3584,2304,16,128,128,1,8,5,628.9133333333333,3
w13,64,60,6,3584,2304,16,128,128,16,4,2,630.7800000000001,3
w13,64,60,6,3584,2304,16,128,128,16,8,4,631.8786666666666,3
w13,64,60,6,3584,2304,16,128,128,16,8,5,631.0790000000001,3
w13,64,60,6,3584,2304,16,128,128,32,4,2,631.591,3
w13,64,60,6,3584,2304,16,128,128,32,8,5,631.9643333333333,3
w13,64,60,6,3584,2304,32,128,128,1,4,3,630.4063333333334,3
w13,64,60,6,3584,2304,32,128,128,1,8,3,630.407,3
w13,64,60,6,3584,2304,32,128,128,4,4,3,631.0466666666667,3
w13,64,60,6,3584,2304,32,128,128,4,8,3,630.0013333333333,3
w13,64,60,6,3584,2304,32,128,128,8,4,3,631.0790000000001,3
w13,64,60,6,3584,2304,32,128,128,16,4,3,630.876,3
w13,64,60,6,3584,2304,32,128,128,16,8,3,631.2173333333334,3
w13,64,60,8,2048,1536,16,32,128,1,4,2,245.26200000000003,3
w13,64,60,8,2048,1536,16,32,128,4,4,2,245.69966666666667,3
w13,64,60,8,2048,1536,16,64,128,1,4,2,245.01633333333334,3
w13,64,60,8,2048,1536,16,64,128,16,4,2,245.17633333333333,3
w13,64,60,8,2048,1536,16,64,128,32,4,2,244.54733333333334,3
w13,64,60,8,2048,1536,16,64,128,64,4,2,245.2413333333333,3
w13,64,60,8,2048,1536,16,128,128,1,8,2,244.9,3
w13,64,60,8,2048,1536,16,128,128,32,4,2,245.44366666666667,3
w13,64,60,8,2048,1536,16,128,128,32,8,2,245.09133333333332,3
w13,64,64,6,3072,2048,16,16,256,1,4,5,516.2403333333333,3
w13,64,64,6,3072,2048,16,32,128,1,4,2,515.7286666666668,3
w13,64,64,6,3072,2048,16,32,128,4,4,2,516.4963333333334,3
w13,64,64,6,3072,2048,16,32,128,4,4,5,516.4966666666667,3
w13,64,64,6,3072,2048,16,32,256,1,4,4,515.782,3
w13,64,64,6,3072,2048,16,32,256,1,4,5,515.1626666666667,3
w13,64,64,6,3072,2048,16,32,256,16,4,4,516.6566666666666,3
w13,64,64,6,3072,2048,16,32,256,16,4,5,514.7363333333334,3
w13,64,64,6,3072,2048,16,32,256,32,4,4,516.6353333333333,3
w13,64,64,6,3072,2048,16,64,128,1,4,3,515.728,3
w13,64,64,6,3072,2048,16,64,128,1,4,4,514.6619999999999,3
w13,64,64,6,3072,2048,16,64,128,1,4,5,514.5656666666667,3
w13,64,64,6,3072,2048,16,64,128,1,8,5,515.9416666666667,3
w13,64,64,6,3072,2048,16,64,256,1,4,2,516.187,3
w13,64,64,6,3072,2048,16,64,256,1,4,3,515.4296666666667,3
w13,64,64,6,3072,2048,16,64,256,1,4,4,516.4003333333334,3
w13,64,64,6,3072,2048,16,64,256,1,4,5,515.2593333333333,3
w13,64,64,6,3072,2048,16,64,256,1,8,3,515.8776666666666,3
w13,64,64,6,3072,2048,16,64,256,1,8,4,516.0273333333333,3
w13,64,64,6,3072,2048,16,64,256,1,8,5,515.0880000000001,3
w13,64,64,6,3072,2048,16,128,128,1,4,3,514.6083333333333,3
w13,64,64,6,3072,2048,16,128,128,1,8,3,514.2033333333334,3
w13,64,64,6,3072,2048,16,128,128,1,8,4,516.2193333333333,3
w13,64,64,6,3072,2048,16,128,128,1,8,5,514.1286666666666,3
w13,64,64,6,3072,2048,16,128,128,32,8,5,516.4113333333333,3
w13,64,64,6,3072,2048,32,128,128,1,4,3,515.8026666666666,3
w13,64,64,6,3072,2048,32,128,128,1,8,3,516.5070000000001,3
w13,64,64,6,3072,2048,32,128,128,4,4,3,516.2833333333333,3
w13,64,64,6,3584,1536,16,32,128,1,4,3,450.9703333333334,3
w13,64,64,6,3584,1536,16,32,256,1,4,2,450.20233333333334,3
w13,64,64,6,3584,1536,16,32,256,1,4,3,451.93066666666664,3
w13,64,64,6,3584,1536,16,32,256,1,4,4,450.757,3
w13,64,64,6,3584,1536,16,32,256,1,4,5,450.09566666666666,3
w13,64,64,6,3584,1536,16,32,256,16,4,4,452.23966666666666,3
w13,64,64,6,3584,1536,16,64,128,1,4,3,452.133,3
w13,64,64,6,3584,1536,16,64,128,1,4,4,450.05300000000005,3
w13,64,64,6,3584,1536,16,64,128,1,8,2,452.12266666666665,3
w13,64,64,6,3584,1536,16,64,128,32,4,3,452.10133333333334,3
w13,64,64,6,3584,1536,16,64,256,1,4,2,450.20233333333334,3
w13,64,64,6,3584,1536,16,64,256,1,4,3,451.22633333333334,3
w13,64,64,6,3584,1536,16,64,256,1,4,5,452.272,3
w13,64,64,6,3584,1536,16,64,256,1,8,2,451.96233333333333,3
w13,64,64,6,3584,1536,16,64,256,1,8,3,452.12266666666665,3
w13,64,64,6,3584,1536,16,64,256,1,8,5,451.749,3
w13,64,64,6,3584,1536,16,128,128,1,4,2,451.045,3
w13,64,64,6,3584,1536,16,128,128,1,8,2,450.693,3
w13,64,64,6,3584,1536,16,128,128,1,8,5,450.77833333333336,3
w13,64,64,6,3584,1536,16,128,128,16,8,2,450.3413333333333,3
w13,64,64,6,3584,1536,16,128,128,32,4,2,452.25066666666663,3
w13,64,64,6,3584,1536,16,128,128,32,8,2,451.824,3
w13,64,64,6,3584,1536,16,128,128,64,4,2,452.27233333333334,3
w13,64,64,6,3584,1536,16,128,128,64,8,2,450.6503333333333,3
w13,64,64,6,3584,1536,32,32,128,1,4,2,451.1413333333333,3
w13,64,64,6,3584,1536,32,32,128,4,4,2,451.9836666666667,3
w13,64,64,6,3584,1536,32,64,128,1,4,2,451.888,3
w13,64,64,6,3584,1536,32,128,128,1,4,2,451.866,3
w13,64,64,6,3584,1536,32,128,128,1,4,3,450.25600000000003,3
w13,64,64,6,3584,1536,32,128,128,1,8,3,450.54400000000004,3
w13,64,64,6,3584,1536,32,128,128,4,4,2,451.5786666666666,3
w13,64,64,6,3584,1536,32,128,128,4,4,3,451.4293333333333,3
w13,64,64,6,3584,1536,32,128,128,8,4,2,452.176,3
w13,64,64,6,3584,1536,32,128,128,16,4,2,451.95233333333334,3
w13,64,64,6,3584,1536,64,128,128,1,8,4,451.85566666666665,3
w13,64,64,8,3584,2560,16,32,256,1,4,2,749.7570000000001,3
w13,64,64,8,3584,2560,16,32,256,1,4,3,749.4263333333333,3
w13,64,64,8,3584,2560,16,32,256,1,4,5,748.2853333333334,3
w13,64,64,8,3584,2560,16,64,128,1,4,5,748.2423333333332,3
w13,64,64,8,3584,2560,16,64,128,1,8,2,750.6106666666666,3
w13,64,64,8,3584,2560,16,64,128,1,8,5,749.7463333333334,3
w13,64,64,8,3584,2560,16,64,128,16,4,5,750.2906666666667,3
w13,64,64,8,3584,2560,16,64,256,1,4,3,748.9783333333334,3
w13,64,64,8,3584,2560,16,64,256,1,4,5,750.6850000000001,3
w13,64,64,8,3584,2560,16,64,256,1,8,2,749.5756666666666,3
w13,64,64,8,3584,2560,16,64,256,1,8,3,749.4263333333333,3
w13,64,64,8,3584,2560,16,128,128,1,4,4,750.1623333333333,3
w13,64,64,8,3584,2560,16,128,128,1,4,5,749.864,3
w13,64,64,8,3584,2560,16,128,128,1,8,5,747.0476666666667,3
w13,64,64,8,3584,2560,16,128,128,16,4,5,749.8846666666667,3
w13,64,64,8,3584,2560,16,128,128,16,8,5,748.1039999999999,3
w13,64,64,8,3584,2560,32,128,128,1,4,5,750.0556666666666,3
w13,64,64,8,3584,2560,32,128,128,1,8,5,750.1306666666666,3
w13,64,64,8,3584,2560,32,128,128,4,4,5,750.2689999999999,3
w13,64,64,8,3584,2560,32,128,128,4,8,5,749.7573333333333,3
w13,64,64,8,3584,2560,32,128,128,8,4,5,750.696,3
w13,64,64,8,3584,2560,32,128,128,8,8,5,749.9493333333334,3
w13,64,64,8,3584,2560,32,128,128,16,4,5,749.9810000000001,3
w13,64,64,8,3584,2560,32,128,128,16,8,5,750.6213333333334,3
w13,64,128,4,2048,512,16,32,128,1,4,5,173.62466666666668,3
w13,64,128,4,2048,512,16,32,256,1,4,3,172.96366666666665,3
w13,64,128,4,2048,512,16,64,128,1,4,4,173.80566666666664,3
w13,64,128,4,2048,512,16,64,128,16,4,4,173.678,3
w13,64,128,4,2048,512,16,64,128,32,4,3,173.45399999999998,3
w13,64,128,4,2048,512,16,64,128,32,4,4,173.78466666666668,3
w13,64,128,4,2048,512,16,64,128,32,4,5,173.77366666666668,3
w13,64,128,4,2048,512,16,64,128,64,4,5,173.80566666666667,3
w13,64,128,4,2048,512,16,64,256,1,8,3,173.54966666666667,3
w13,64,128,4,2048,512,16,64,256,32,8,3,173.795,3
w13,64,128,4,2048,512,16,128,128,1,4,2,173.61366666666666,3
w13,64,128,4,2048,512,16,128,128,1,8,2,173.51833333333332,3
w13,64,128,4,2048,512,16,128,128,1,8,5,173.827,3
w13,64,128,4,2048,512,16,128,128,16,4,2,173.58166666666668,3
w13,64,128,4,2048,512,32,128,128,1,8,3,173.24033333333333,3
w13,64,128,6,4096,2048,16,16,256,1,4,3,1348.5673333333332,3
w13,64,128,6,4096,2048,16,16,256,1,4,4,1347.031,3
w13,64,128,6,4096,2048,16,16,256,1,4,5,1345.666,3
w13,64,128,6,4096,2048,16,16,256,4,4,4,1348.29,3
w13,64,128,6,4096,2048,16,16,256,4,4,5,1346.7746666666667,3
w13,64,128,6,4096,2048,16,32,128,1,4,5,1349.218,3
w13,64,128,6,4096,2048,16,32,256,1,4,4,1348.6416666666667,3
w13,64,128,6,4096,2048,16,32,256,1,4,5,1342.8919999999998,3
w13,64,128,6,4096,2048,16,32,256,1,8,5,1347.8946666666668,3
w13,64,128,6,4096,2048,16,32,256,16,4,5,1346.402,3
w13,64,128,6,4096,2048,16,64,128,1,4,4,1349.452,3
w13,64,128,6,4096,2048,16,64,128,1,4,5,1347.1373333333333,3
w13,64,128,6,4096,2048,16,64,128,1,8,5,1347.5,3
w13,64,128,6,4096,2048,16,64,128,16,4,5,1347.9373333333333,3
w13,64,128,6,4096,2048,16,64,128,32,4,5,1349.1746666666666,3
w13,64,128,6,4096,2048,16,64,256,1,4,3,1346.1236666666666,3
w13,64,128,6,4096,2048,16,64,256,1,4,4,1343.9693333333332,3
w13,64,128,6,4096,2048,16,64,256,1,4,5,1343.1373333333333,3
w13,64,128,6,4096,2048,16,64,256,1,8,3,1346.9346666666668,3
w13,64,128,6,4096,2048,16,64,256,1,8,4,1344.3533333333332,3
w13,64,128,6,4096,2048,16,64,256,1,8,5,1344.4816666666668,3
w13,64,128,6,4096,2048,16,64,256,16,4,3,1347.2866666666666,3
w13,64,128,6,4096,2048,16,64,256,16,4,4,1348.0546666666667,3
w13,64,128,6,4096,2048,16,64,256,16,4,5,1346.3909999999998,3
w13,64,128,6,4096,2048,16,64,256,16,8,3,1347.607,3
w13,64,128,6,4096,2048,16,64,256,16,8,4,1348.983,3
w13,64,128,6,4096,2048,16,64,256,16,8,5,1347.084,3
w13,64,128,6,4096,2048,16,64,256,32,4,3,1348.9723333333334,3
w13,64,128,6,4096,2048,16,64,256,32,8,3,1348.6946666666665,3
w13,64,128,6,4096,2048,16,128,128,1,4,5,1345.196,3
w13,64,128,6,4096,2048,16,128,128,1,8,4,1349.356,3
w13,64,128,6,4096,2048,16,128,128,1,8,5,1344.3533333333332,3
w13,64,128,6,4096,2048,16,128,128,16,4,5,1345.7613333333334,3
w13,64,128,6,4096,2048,16,128,128,16,8,5,1345.7723333333333,3
w13,64,128,6,4096,2048,16,128,128,32,4,5,1348.4279999999999,3
w13,64,128,6,4096,2048,16,128,128,32,8,5,1345.4413333333334,3
w13,64,128,6,4096,2048,16,128,128,64,8,5,1348.9506666666666,3
w13,64,128,6,4096,2048,32,32,128,1,4,5,1347.298,3
w13,64,128,6,4096,2048,32,32,128,4,4,5,1348.642,3
w13,64,128,6,4096,2048,32,32,256,1,4,3,1347.3186666666668,3
w13,64,128,6,4096,2048,32,32,256,1,4,4,1347.4043333333332,3
w13,64,128,6,4096,2048,32,32,256,4,4,4,1347.7133333333334,3
w13,64,128,6,4096,2048,32,64,256,1,8,4,1347.8306666666667,3
w13,64,128,6,4096,2048,32,64,256,1,8,5,1347.2016666666666,3
w13,64,128,6,4096,2048,32,64,256,8,8,5,1348.8120000000001,3
w13,64,128,6,4096,2048,32,128,128,1,4,3,1348.9086666666665,3
w13,64,128,6,4096,2048,32,128,128,1,4,4,1347.981,3
w13,64,128,6,4096,2048,32,128,128,1,4,5,1346.6146666666666,3
w13,64,128,6,4096,2048,32,128,128,1,8,4,1346.327,3
w13,64,128,6,4096,2048,32,128,128,1,8,5,1348.0866666666666,3
w13,64,128,6,4096,2048,32,128,128,4,4,4,1347.2333333333333,3
w13,64,128,6,4096,2048,32,128,128,4,4,5,1346.9346666666668,3
w13,64,128,6,4096,2048,32,128,128,4,8,4,1347.4363333333333,3
w13,64,128,6,4096,2048,32,128,128,4,8,5,1346.4546666666668,3
w13,64,128,6,4096,2048,32,128,128,8,4,4,1347.1483333333333,3
w13,64,128,6,4096,2048,32,128,128,8,4,5,1346.9026666666666,3
w13,64,128,6,4096,2048,32,128,128,8,8,4,1346.8713333333335,3
w13,64,128,6,4096,2048,32,128,128,8,8,5,1347.5110000000002,3
w13,64,128,6,4096,2048,32,128,128,16,4,4,1346.9666666666667,3
w13,64,128,6,4096,2048,32,128,128,16,4,5,1346.796,3
w13,64,128,6,4096,2048,32,128,128,16,8,4,1348.0653333333332,3
w13,64,128,6,4096,2048,32,128,128,16,8,5,1347.522,3
w13,64,128,6,4096,2048,32,128,128,32,4,3,1349.4413333333334,3
w13,64,128,6,4096,2048,32,128,128,32,4,4,1348.2359999999999,3
w13,64,128,6,4096,2048,32,128,128,32,4,5,1348.4496666666666,3
w13,64,128,6,4096,2048,32,128,128,32,8,4,1348.1296666666667,3
w13,64,128,6,4096,2048,32,128,128,32,8,5,1349.218,3
w13,64,128,6,4096,2048,64,64,128,1,4,3,1348.9936666666665,3
w13,64,128,6,4096,2048,64,128,128,1,4,4,1349.4840000000002,3
w13,64,128,6,4096,2048,64,128,128,1,8,4,1345.6553333333334,3
w13,64,128,6,4096,2048,64,128,128,4,8,4,1345.7516666666668,3
w13,64,128,6,4096,2048,64,128,128,16,4,4,1349.036,3
w13,64,128,6,4096,2048,64,128,128,16,8,4,1345.6866666666667,3
w13,64,128,6,4096,2048,64,128,128,32,8,4,1348.0446666666667,3
w13,64,128,8,2048,768,16,32,256,1,4,2,259.0543333333333,3
w13,64,128,8,2048,768,16,32,256,1,4,3,259.11833333333334,3
w13,64,128,8,2048,768,16,64,128,1,4,4,258.99033333333335,3
w13,64,128,8,2048,768,16,64,128,1,4,5,258.89433333333335,3
w13,64,128,8,2048,768,16,64,128,16,4,5,259.3106666666667,3
w13,64,128,8,2048,768,16,64,256,1,4,2,259.20366666666666,3
w13,64,128,8,2048,768,16,128,128,1,4,2,258.8086666666666,3
w13,64,128,8,2048,768,16,128,128,1,8,2,258.12666666666667,3
w13,64,128,8,2048,768,16,128,128,16,4,2,258.884,3
w13,64,128,8,2048,768,16,128,128,16,8,2,258.66,3
w13,64,128,8,2048,768,16,128,128,32,4,2,258.425,3
w13,64,128,8,2048,768,16,128,128,32,8,2,258.84133333333335,3
w13,64,128,8,2048,768,16,128,128,64,8,2,258.89466666666664,3
w13,64,128,8,2048,768,32,128,128,1,4,2,259.40633333333335,3
w13,64,128,8,4096,1536,16,16,256,1,4,4,1015.8273333333333,3
w13,64,128,8,4096,1536,16,16,256,1,4,5,1015.6996666666668,3
w13,64,128,8,4096,1536,16,16,256,4,4,4,1016.841,3
w13,64,128,8,4096,1536,16,16,256,4,4,5,1016.4143333333333,3
w13,64,128,8,4096,1536,16,32,128,1,4,5,1015.8916666666668,3
w13,64,128,8,4096,1536,16,32,128,4,4,5,1016.4893333333333,3
w13,64,128,8,4096,1536,16,32,256,1,4,3,1015.6036666666668,3
w13,64,128,8,4096,1536,16,32,256,1,4,4,1015.9879999999999,3
w13,64,128,8,4096,1536,16,32,256,1,4,5,1012.8733333333333,3
w13,64,128,8,4096,1536,16,32,256,16,4,5,1013.8436666666666,3
w13,64,128,8,4096,1536,16,32,256,32,4,5,1016.5956666666666,3
w13,64,128,8,4096,1536,16,64,128,1,4,4,1015.2413333333334,3
w13,64,128,8,4096,1536,16,64,128,1,4,5,1013.7476666666666,3
w13,64,128,8,4096,1536,16,64,128,1,8,5,1017.15,3
w13,64,128,8,4096,1536,16,64,128,16,4,5,1016.308,3
w13,64,128,8,4096,1536,16,64,128,16,8,5,1016.9900000000001,3
w13,64,128,8,4096,1536,16,64,128,32,4,5,1017.524,3
w13,64,128,8,4096,1536,16,64,256,1,4,3,1013.9823333333334,3
w13,64,128,8,4096,1536,16,64,256,1,4,4,1014.2703333333334,3
w13,64,128,8,4096,1536,16,64,256,1,4,5,1013.6196666666666,3
w13,64,128,8,4096,1536,16,64,256,1,8,3,1015.6676666666667,3
w13,64,128,8,4096,1536,16,64,256,1,8,4,1014.7400000000001,3
w13,64,128,8,4096,1536,16,64,256,1,8,5,1013.8969999999999,3
w13,64,128,8,4096,1536,16,64,256,16,4,4,1015.9986666666667,3
w13,64,128,8,4096,1536,16,64,256,16,4,5,1014.2703333333334,3
w13,64,128,8,4096,1536,16,64,256,16,8,4,1017.4493333333334,3
w13,64,128,8,4096,1536,16,64,256,16,8,5,1015.7316666666667,3
w13,64,128,8,4096,1536,16,64,256,32,4,5,1016.8306666666667,3
w13,64,128,8,4096,1536,16,128,128,1,4,4,1015.721,3
w13,64,128,8,4096,1536,16,128,128,1,4,5,1014.3449999999999,3
w13,64,128,8,4096,1536,16,128,128,1,8,4,1015.284,3
w13,64,128,8,4096,1536,16,128,128,1,8,5,1012.553,3
w13,64,128,8,4096,1536,16,128,128,16,8,5,1015.5183333333333,3
w13,64,128,8,4096,1536,16,128,128,32,4,5,1017.0863333333333,3
w13,64,128,8,4096,1536,16,128,128,32,8,5,1014.6329999999999,3
w13,64,128,8,4096,1536,32,32,128,1,4,5,1016.9903333333333,3
w13,64,128,8,4096,1536,32,32,128,4,4,5,1016.7983333333333,3
w13,64,128,8,4096,1536,32,32,256,1,4,3,1016.724,3
w13,64,128,8,4096,1536,32,32,256,1,4,4,1015.8383333333333,3
w13,64,128,8,4096,1536,32,32,256,4,4,3,1017.609,3
w13,64,128,8,4096,1536,32,32,256,4,4,4,1016.7346666666666,3
w13,64,128,8,4096,1536,32,64,256,1,8,4,1017.4490000000001,3
w13,64,128,8,4096,1536,32,64,256,1,8,5,1017.172,3
w13,64,128,8,4096,1536,32,128,128,1,4,4,1014.1636666666667,3
w13,64,128,8,4096,1536,32,128,128,1,4,5,1013.9823333333334,3
w13,64,128,8,4096,1536,32,128,128,1,8,5,1014.8676666666667,3
w13,64,128,8,4096,1536,32,128,128,4,4,4,1015.145,3
w13,64,128,8,4096,1536,32,128,128,4,4,5,1014.857,3
w13,64,128,8,4096,1536,32,128,128,4,8,5,1015.9983333333333,3
w13,64,128,8,4096,1536,32,128,128,8,4,4,1015.1343333333334,3
w13,64,128,8,4096,1536,32,128,128,8,4,5,1014.3023333333334,3
w13,64,128,8,4096,1536,32,128,128,8,8,5,1017.1076666666667,3
w13,64,128,8,4096,1536,32,128,128,16,4,4,1016.393,3
w13,64,128,8,4096,1536,32,128,128,16,4,5,1016.7986666666666,3
w13,64,128,8,4096,1536,32,128,128,32,4,4,1016.4789999999999,3
w13,64,128,8,4096,1536,32,128,128,32,4,5,1016.7556666666666,3
w13,64,128,8,4096,1536,32,128,128,32,8,5,1017.2463333333334,3
w13,64,128,8,4096,1536,64,128,128,1,4,4,1017.0009999999999,3
w13,64,128,8,4096,1536,64,128,128,1,8,4,1015.0916666666667,3
w13,64,128,8,4096,1536,64,128,128,4,8,4,1015.2306666666667,3
w13,64,128,8,4096,1536,64,128,128,16,8,4,1016.681,3
w13,64,128,8,4096,3072,16,16,128,1,4,5,2023.9543333333334,3
w13,64,128,8,4096,3072,16,16,128,4,4,5,2023.7300000000002,3
w13,64,128,8,4096,3072,16,16,256,1,4,4,2019.5273333333334,3
w13,64,128,8,4096,3072,16,16,256,1,4,5,2016.5086666666666,3
w13,64,128,8,4096,3072,16,16,256,4,4,3,2022.6843333333334,3
w13,64,128,8,4096,3072,16,16,256,4,4,4,2020.4023333333334,3
w13,64,128,8,4096,3072,16,16,256,4,4,5,2017.0533333333333,3
w13,64,128,8,4096,3072,16,32,256,1,4,5,2015.282,3
w13,64,128,8,4096,3072,16,32,256,1,8,5,2018.8873333333333,3
w13,64,128,8,4096,3072,16,32,256,16,4,5,2020.0393333333334,3
w13,64,128,8,4096,3072,16,64,128,1,4,5,2020.2526666666665,3
w13,64,128,8,4096,3072,16,64,128,1,8,5,2021.0956666666668,3
w13,64,128,8,4096,3072,16,64,256,1,4,3,2021.618333333333,3
w13,64,128,8,4096,3072,16,64,256,1,4,4,2015.9646666666667,3
w13,64,128,8,4096,3072,16,64,256,1,4,5,2016.8819999999998,3
w13,64,128,8,4096,3072,16,64,256,1,8,3,2022.5363333333335,3
w13,64,128,8,4096,3072,16,64,256,1,8,4,2016.594,3
w13,64,128,8,4096,3072,16,64,256,1,8,5,2016.562,3
w13,64,128,8,4096,3072,16,64,256,16,4,4,2022.4926666666668,3
w13,64,128,8,4096,3072,16,64,256,16,4,5,2020.722,3
w13,64,128,8,4096,3072,16,64,256,16,8,4,2023.634,3
w13,64,128,8,4096,3072,16,64,256,16,8,5,2021.49,3
w13,64,128,8,4096,3072,16,128,128,1,4,5,2015.9966666666667,3
w13,64,128,8,4096,3072,16,128,128,1,8,5,2013.9056666666665,3
w13,64,128,8,4096,3072,16,128,128,16,4,5,2018.13,3
w13,64,128,8,4096,3072,16,128,128,16,8,5,2016.7969999999998,3
w13,64,128,8,4096,3072,16,128,128,32,4,5,2021.682,3
w13,64,128,8,4096,3072,16,128,128,32,8,5,2018.5566666666666,3
w13,64,128,8,4096,3072,16,128,128,64,8,5,2022.4183333333333,3
w13,64,128,8,4096,3072,32,32,128,4,4,5,2022.2153333333333,3
w13,64,128,8,4096,3072,32,32,256,1,4,4,2020.2533333333333,3
w13,64,128,8,4096,3072,32,32,256,1,8,4,2022.7913333333333,3
w13,64,128,8,4096,3072,32,32,256,4,4,3,2021.6723333333332,3
w13,64,128,8,4096,3072,32,32,256,4,4,4,2019.613,3
w13,64,128,8,4096,3072,32,32,256,4,8,4,2023.9326666666666,3
w13,64,128,8,4096,3072,32,64,256,1,4,4,2023.8046666666667,3
w13,64,128,8,4096,3072,32,64,256,1,4,5,2023.058,3
w13,64,128,8,4096,3072,32,64,256,1,8,4,2020.2953333333335,3
w13,64,128,8,4096,3072,32,64,256,1,8,5,2020.7966666666664,3
w13,64,128,8,4096,3072,32,64,256,8,8,4,2023.442,3
w13,64,128,8,4096,3072,32,64,256,8,8,5,2021.3833333333332,3
w13,64,128,8,4096,3072,32,64,256,16,8,5,2023.9966666666667,3
w13,64,128,8,4096,3072,32,128,128,1,4,3,2023.9433333333334,3
w13,64,128,8,4096,3072,32,128,128,1,4,4,2019.3673333333334,3
w13,64,128,8,4096,3072,32,128,128,1,4,5,2016.4656666666667,3
w13,64,128,8,4096,3072,32,128,128,1,8,4,2018.9089999999999,3
w13,64,128,8,4096,3072,32,128,128,1,8,5,2018.4926666666668,3
w13,64,128,8,4096,3072,32,128,128,4,4,3,2023.1973333333335,3
w13,64,128,8,4096,3072,32,128,128,4,4,4,2018.2153333333333,3
w13,64,128,8,4096,3072,32,128,128,4,4,5,2017.4793333333334,3
w13,64,128,8,4096,3072,32,128,128,4,8,4,2019.314,3
w13,64,128,8,4096,3072,32,128,128,4,8,5,2019.3460000000002,3
w13,64,128,8,4096,3072,32,128,128,8,4,4,2020.0073333333332,3
w13,64,128,8,4096,3072,32,128,128,8,4,5,2019.357,3
w13,64,128,8,4096,3072,32,128,128,8,8,4,2021.0526666666665,3
w13,64,128,8,4096,3072,32,128,128,8,8,5,2019.8369999999998,3
w13,64,128,8,4096,3072,32,128,128,16,4,3,2022.6526666666668,3
w13,64,128,8,4096,3072,32,128,128,16,4,4,2019.6766666666665,3
w13,64,128,8,4096,3072,32,128,128,16,4,5,2019.4633333333331,3
w13,64,128,8,4096,3072,32,128,128,16,8,4,2023.0163333333333,3
w13,64,128,8,4096,3072,32,128,128,16,8,5,2020.594,3
w13,64,128,8,4096,3072,32,128,128,32,4,4,2023.4740000000002,3
w13,64,128,8,4096,3072,32,128,128,32,4,5,2022.514,3
w13,64,128,8,4096,3072,32,128,128,32,8,5,2022.2579999999998,3
w13,64,128,8,4096,3072,64,128,128,1,4,4,2020.7006666666666,3
w13,64,128,8,4096,3072,64,128,128,1,8,4,2017.5436666666667,3
w13,64,128,8,4096,3072,64,128,128,4,4,4,2019.3353333333334,3
w13,64,128,8,4096,3072,64,128,128,4,8,4,2018.2263333333333,3
w13,64,128,8,4096,3072,64,128,128,16,4,4,2021.2446666666667,3
w13,64,128,8,4096,3072,64,128,128,16,8,4,2020.1466666666668,3
w13,64,128,8,4096,3072,64,128,128,32,8,4,2022.6419999999998,3
w13,96,8,2,1024,512,64,64,128,1,8,3,6.327000000000001,3
w13,96,16,2,1536,768,16,32,128,16,4,2,27.756666666666664,3
w13,96,16,4,1536,1024,32,32,128,16,4,2,36.684666666666665,3
w13,96,32,4,2048,768,16,64,64,16,4,3,68.60033333333332,3
w13,96,32,4,2048,768,16,64,128,1,4,2,68.738,3
w13,96,32,4,2048,768,16,64,128,16,4,2,68.53633333333333,3
w13,96,32,4,2048,768,16,64,128,32,4,2,68.67466666666667,3
w13,96,32,4,2048,768,16,128,128,1,8,2,68.42866666666667,3
w13,96,32,6,3072,1024,32,32,128,64,4,2,134.58399999999997,3
w13,96,32,6,3072,1024,32,128,128,16,4,3,135.04266666666666,3
w13,96,32,6,3072,1024,64,64,64,1,4,3,134.42366666666666,3
w13,96,32,6,3072,1024,64,64,64,4,4,3,134.86166666666668,3
w13,96,32,6,3072,1024,64,64,64,16,4,3,134.41333333333333,3
w13,96,32,6,3072,1024,64,64,64,32,4,3,134.37033333333332,3
w13,96,60,4,2048,1408,16,32,128,1,4,5,225.10266666666666,3
w13,96,60,4,2048,1408,16,32,128,4,4,5,225.12366666666665,3
w13,96,60,4,2048,1408,16,32,256,1,4,2,225.00633333333334,3
w13,96,60,4,2048,1408,16,32,256,1,4,3,225.3373333333333,3
w13,96,60,4,2048,1408,16,32,256,1,4,5,225.21966666666665,3
w13,96,60,4,2048,1408,16,32,256,16,4,3,225.45433333333335,3
w13,96,60,4,2048,1408,16,64,128,1,4,2,225.25133333333335,3
w13,96,60,4,2048,1408,16,64,128,1,4,3,224.53633333333335,3
w13,96,60,4,2048,1408,16,64,128,1,8,3,225.59266666666667,3
w13,96,60,4,2048,1408,16,64,128,16,4,2,225.476,3
w13,96,60,4,2048,1408,16,64,128,16,8,2,225.12300000000002,3
w13,96,60,4,2048,1408,16,64,128,16,8,3,225.50733333333332,3
w13,96,60,4,2048,1408,16,64,128,32,8,2,225.038,3
w13,96,60,4,2048,1408,16,64,256,1,4,2,225.465,3
w13,96,60,4,2048,1408,16,64,256,1,4,3,225.646,3
w13,96,60,4,2048,1408,16,64,256,1,8,3,224.8033333333333,3
w13,96,60,4,2048,1408,16,128,128,1,8,4,225.582,3
w13,96,60,4,2048,1408,16,128,128,1,8,5,225.37933333333334,3
w13,96,60,4,2048,1408,16,128,128,16,4,2,225.39033333333336,3
w13,96,60,4,2048,1408,32,64,128,32,4,2,225.56066666666666,3
w13,96,60,4,2048,1408,32,128,128,1,8,3,224.99566666666666,3
w13,96,60,4,2048,1408,32,128,128,4,4,3,225.5186666666667,3
w13,96,60,4,2048,1408,32,128,128,4,8,3,225.17666666666665,3
w13,96,60,4,2048,1408,32,128,128,16,4,3,225.45466666666667,3
w13,96,60,4,2048,1408,64,64,64,1,4,3,225.593,3
w13,96,60,4,2048,1408,64,64,64,4,4,3,225.21966666666665,3
w13,96,60,6,3584,2304,16,32,256,1,4,3,635.4843333333333,3
w13,96,60,6,3584,2304,16,64,128,1,4,4,634.4386666666667,3
w13,96,60,6,3584,2304,16,64,128,1,8,3,635.452,3
w13,96,60,6,3584,2304,16,64,128,1,8,5,635.2280000000001,3
w13,96,60,6,3584,2304,16,64,128,16,4,5,635.1426666666666,3
w13,96,60,6,3584,2304,16,64,256,1,4,2,634.8870000000001,3
w13,96,60,6,3584,2304,16,64,256,1,8,3,634.5773333333333,3
w13,96,60,6,3584,2304,16,128,128,1,4,2,633.3936666666667,3
w13,96,60,6,3584,2304,16,128,128,1,4,4,634.9936666666666,3
w13,96,60,6,3584,2304,16,128,128,1,4,5,635.3876666666666,3
w13,96,60,6,3584,2304,16,128,128,1,8,4,634.353,3
w13,96,60,6,3584,2304,16,128,128,1,8,5,632.636,3
w13,96,60,6,3584,2304,16,128,128,16,4,2,634.247,3
w13,96,60,6,3584,2304,16,128,128,16,8,4,635.4736666666666,3
w13,96,60,6,3584,2304,16,128,128,16,8,5,634.6946666666666,3
w13,96,60,6,3584,2304,16,128,128,32,4,2,633.052,3
w13,96,60,6,3584,2304,16,128,128,32,8,5,635.5266666666666,3
w13,96,60,6,3584,2304,16,128,128,64,4,2,635.2816666666666,3
w13,96,60,6,3584,2304,32,128,128,1,4,3,634.5883333333333,3
w13,96,60,6,3584,2304,32,128,128,1,8,3,632.9986666666667,3
w13,96,60,6,3584,2304,32,128,128,4,4,3,633.5426666666667,3
w13,96,60,6,3584,2304,32,128,128,4,8,3,633.2333333333333,3
w13,96,60,6,3584,2304,32,128,128,4,8,5,635.5373333333333,3
w13,96,60,6,3584,2304,32,128,128,8,4,3,634.503,3
w13,96,60,6,3584,2304,32,128,128,8,8,3,634.0123333333333,3
w13,96,60,6,3584,2304,32,128,128,8,8,5,635.0573333333333,3
w13,96,60,6,3584,2304,32,128,128,16,4,3,634.247,3
w13,96,60,6,3584,2304,32,128,128,16,8,3,634.151,3
w13,96,60,6,3584,2304,32,128,128,32,8,3,634.2683333333333,3
w13,96,60,8,2048,1536,16,128,128,1,8,2,245.46466666666666,3
w13,96,60,8,2048,1536,16,128,128,16,8,2,246.53133333333335,3
w13,96,64,6,3072,2048,16,32,128,4,4,2,518.4166666666666,3
w13,96,64,6,3072,2048,16,32,256,1,4,5,518.2136666666667,3
w13,96,64,6,3072,2048,16,64,128,1,4,3,518.3953333333333,3
w13,96,64,6,3072,2048,16,128,128,1,4,2,517.1683333333334,3
w13,96,64,6,3072,2048,16,128,128,1,4,3,516.1226666666666,3
w13,96,64,6,3072,2048,16,128,128,1,8,3,515.9526666666667,3
w13,96,64,6,3072,2048,16,128,128,1,8,5,517.6273333333334,3
w13,96,64,6,3584,1536,16,32,256,1,4,2,452.53833333333336,3
w13,96,64,6,3584,1536,16,32,256,1,4,4,453.584,3
w13,96,64,6,3584,1536,16,32,256,1,4,5,453.221,3
w13,96,64,6,3584,1536,16,64,128,1,4,4,451.43966666666665,3
w13,96,64,6,3584,1536,16,64,256,1,4,3,453.115,3
w13,96,64,6,3584,1536,16,128,128,1,8,2,451.69599999999997,3
w13,96,64,6,3584,1536,16,128,128,1,8,5,452.44233333333335,3
w13,96,64,6,3584,1536,16,128,128,16,4,2,452.613,3
w13,96,64,6,3584,1536,16,128,128,16,8,2,452.0373333333334,3
w13,96,64,6,3584,1536,16,128,128,32,4,2,452.44266666666664,3
w13,96,64,6,3584,1536,32,32,128,1,4,2,453.435,3
w13,96,64,6,3584,1536,32,128,128,1,4,2,451.5783333333334,3
w13,96,64,6,3584,1536,32,128,128,1,4,3,452.1756666666667,3
w13,96,64,6,3584,1536,32,128,128,1,8,3,452.68833333333333,3
w13,96,64,6,3584,1536,32,128,128,4,4,2,453.12533333333334,3
w13,96,64,6,3584,1536,32,128,128,4,4,3,453.296,3
w13,96,64,6,3584,1536,32,128,128,8,4,2,451.9943333333333,3
w13,96,64,6,3584,1536,32,128,128,8,8,3,453.11433333333326,3
w13,96,64,8,3584,2560,16,32,128,1,4,2,755.4636666666667,3
w13,96,64,8,3584,2560,16,32,128,1,4,5,755.7413333333334,3
w13,96,64,8,3584,2560,16,32,128,4,4,2,756.381,3
w13,96,64,8,3584,2560,16,32,256,1,4,2,755.0046666666667,3
w13,96,64,8,3584,2560,16,32,256,1,4,3,755.9440000000001,3
w13,96,64,8,3584,2560,16,32,256,1,4,4,756.2106666666667,3
w13,96,64,8,3584,2560,16,32,256,1,4,5,754.6636666666667,3
w13,96,64,8,3584,2560,16,64,128,1,4,2,755.485,3
w13,96,64,8,3584,2560,16,64,128,1,4,3,753.9386666666666,3
w13,96,64,8,3584,2560,16,64,128,1,4,4,754.8773333333334,3
w13,96,64,8,3584,2560,16,64,128,1,4,5,753.5970000000001,3
w13,96,64,8,3584,2560,16,64,128,1,8,2,753.7253333333333,3
w13,96,64,8,3584,2560,16,64,128,1,8,5,754.1840000000001,3
w13,96,64,8,3584,2560,16,64,128,16,4,3,754.5253333333334,3
w13,96,64,8,3584,2560,16,64,256,1,4,3,753.544,3
w13,96,64,8,3584,2560,16,64,256,1,4,5,755.4953333333333,3
w13,96,64,8,3584,2560,16,64,256,1,8,2,754.12,3
w13,96,64,8,3584,2560,16,64,256,1,8,3,754.6213333333334,3
w13,96,64,8,3584,2560,16,64,256,1,8,5,756.3919999999999,3
w13,96,64,8,3584,2560,16,128,128,1,4,2,754.8236666666667,3
w13,96,64,8,3584,2560,16,128,128,1,4,3,756.4983333333333,3
w13,96,64,8,3584,2560,16,128,128,1,4,4,754.5786666666667,3
w13,96,64,8,3584,2560,16,128,128,1,4,5,754.4076666666666,3
w13,96,64,8,3584,2560,16,128,128,1,8,4,754.5146666666666,3
w13,96,64,8,3584,2560,16,128,128,1,8,5,752.7863333333333,3
w13,96,64,8,3584,2560,16,128,128,16,4,2,756.4986666666667,3
w13,96,64,8,3584,2560,16,128,128,16,4,4,755.571,3
w13,96,64,8,3584,2560,16,128,128,16,4,5,755.9333333333334,3
w13,96,64,8,3584,2560,16,128,128,16,8,3,756.2426666666667,3
w13,96,64,8,3584,2560,16,128,128,16,8,4,754.4823333333334,3
w13,96,64,8,3584,2560,16,128,128,16,8,5,754.3546666666666,3
w13,96,64,8,3584,2560,16,128,128,32,4,2,754.0986666666668,3
w13,96,64,8,3584,2560,16,128,128,32,4,3,756.1253333333334,3
w13,96,64,8,3584,2560,16,128,128,32,8,3,755.0266666666666,3
w13,96,64,8,3584,2560,16,128,128,32,8,4,756.4666666666667,3
w13,96,64,8,3584,2560,16,128,128,32,8,5,754.9306666666666,3
w13,96,64,8,3584,2560,32,64,128,1,4,2,755.741,3
w13,96,64,8,3584,2560,32,64,128,4,4,2,754.781,3
w13,96,64,8,3584,2560,32,64,256,1,8,3,756.541,3
w13,96,64,8,3584,2560,32,128,128,1,4,5,754.301,3
w13,96,64,8,3584,2560,32,128,128,1,8,3,755.8373333333334,3
w13,96,64,8,3584,2560,32,128,128,1,8,5,753.8536666666668,3
w13,96,64,8,3584,2560,32,128,128,4,4,5,754.621,3
w13,96,64,8,3584,2560,32,128,128,4,8,3,756.136,3
w13,96,64,8,3584,2560,32,128,128,4,8,5,754.9093333333334,3
w13,96,64,8,3584,2560,32,128,128,8,4,5,755.1329999999999,3
w13,96,64,8,3584,2560,32,128,128,8,8,5,754.2693333333333,3
w13,96,64,8,3584,2560,32,128,128,16,4,5,756.0076666666668,3
w13,96,64,8,3584,2560,32,128,128,16,8,3,755.8373333333333,3
w13,96,64,8,3584,2560,32,128,128,16,8,5,755.0586666666667,3
w13,96,64,8,3584,2560,64,128,128,1,8,4,756.4663333333333,3
w13,96,128,4,2048,512,16,32,128,1,4,5,174.33900000000003,3
w13,96,128,4,2048,512,16,32,128,16,4,5,174.54166666666666,3
w13,96,128,4,2048,512,16,32,256,1,4,3,174.34,3
w13,96,128,4,2048,512,16,32,256,16,4,3,174.39266666666666,3
w13,96,128,4,2048,512,16,32,256,32,4,3,174.563,3
w13,96,128,4,2048,512,16,64,128,1,4,3,173.74166666666667,3
w13,96,128,4,2048,512,16,64,128,1,4,5,173.97633333333332,3
w13,96,128,4,2048,512,16,64,128,16,4,3,174.18966666666665,3
w13,96,128,4,2048,512,16,64,128,16,4,4,174.073,3
w13,96,128,4,2048,512,16,64,128,16,4,5,174.38166666666666,3
w13,96,128,4,2048,512,16,64,128,32,4,4,174.56333333333336,3
w13,96,128,4,2048,512,16,64,128,32,4,5,174.222,3
w13,96,128,4,2048,512,16,64,256,1,8,3,174.47766666666666,3
w13,96,128,4,2048,512,16,128,128,1,8,5,174.59500000000003,3
w13,96,128,4,2048,512,16,128,128,16,4,2,174.18966666666665,3
w13,96,128,4,2048,512,16,128,128,16,8,2,174.57399999999998,3
w13,96,128,4,2048,512,16,128,128,16,8,5,174.57333333333335,3
w13,96,128,4,2048,512,16,128,128,32,4,2,174.35,3
w13,96,128,4,2048,512,16,128,128,32,8,2,174.211,3
w13,96,128,4,2048,512,16,128,128,64,4,2,174.29700000000003,3
w13,96,128,4,2048,512,16,128,128,64,8,2,174.40300000000002,3
w13,96,128,4,2048,512,32,128,128,1,8,3,174.26433333333333,3
w13,96,128,4,2048,512,32,128,128,8,8,3,174.16833333333332,3
w13,96,128,6,4096,2048,16,16,256,1,4,4,1352.855,3
w13,96,128,6,4096,2048,16,16,256,1,4,5,1351.3186666666668,3
w13,96,128,6,4096,2048,16,16,256,4,4,4,1353.3773333333334,3
w13,96,128,6,4096,2048,16,16,256,4,4,5,1352.1933333333334,3
w13,96,128,6,4096,2048,16,32,256,1,4,5,1350.3916666666667,3
w13,96,128,6,4096,2048,16,32,256,1,8,5,1353.2076666666667,3
w13,96,128,6,4096,2048,16,64,128,1,4,5,1352.6846666666668,3
w13,96,128,6,4096,2048,16,64,128,16,4,5,1353.1963333333333,3
w13,96,128,6,4096,2048,16,64,256,1,4,3,1351.5,3
w13,96,128,6,4096,2048,16,64,256,1,4,4,1350.9986666666666,3
w13,96,128,6,4096,2048,16,64,256,1,4,5,1349.6126666666667,3
w13,96,128,6,4096,2048,16,64,256,1,8,3,1351.5536666666667,3
w13,96,128,6,4096,2048,16,64,256,1,8,4,1350.8819999999998,3
w13,96,128,6,4096,2048,16,64,256,1,8,5,1350.3163333333334,3
w13,96,128,6,4096,2048,16,64,256,16,4,3,1352.9933333333336,3
w13,96,128,6,4096,2048,16,64,256,16,4,5,1352.3963333333334,3
w13,96,128,6,4096,2048,16,128,128,1,4,4,1352.3746666666666,3
w13,96,128,6,4096,2048,16,128,128,1,4,5,1349.3453333333334,3
w13,96,128,6,4096,2048,16,128,128,1,8,4,1352.2793333333332,3
w13,96,128,6,4096,2048,16,128,128,1,8,5,1346.669,3
w13,96,128,6,4096,2048,16,128,128,16,4,5,1350.8500000000001,3
w13,96,128,6,4096,2048,16,128,128,16,8,5,1349.314,3
w13,96,128,6,4096,2048,16,128,128,32,4,5,1352.7376666666667,3
w13,96,128,6,4096,2048,16,128,128,32,8,5,1351.4573333333333,3
w13,96,128,6,4096,2048,32,32,256,1,4,4,1351.4366666666667,3
w13,96,128,6,4096,2048,32,32,256,4,4,4,1352.5240000000001,3
w13,96,128,6,4096,2048,32,64,256,1,8,4,1353.0153333333335,3
w13,96,128,6,4096,2048,32,64,256,1,8,5,1352.9296666666667,3
w13,96,128,6,4096,2048,32,128,128,1,4,3,1352.9826666666668,3
w13,96,128,6,4096,2048,32,128,128,1,4,4,1352.0339999999999,3
w13,96,128,6,4096,2048,32,128,128,1,4,5,1350.285,3
w13,96,128,6,4096,2048,32,128,128,1,8,4,1351.7666666666667,3
w13,96,128,6,4096,2048,32,128,128,1,8,5,1352.4706666666668,3
w13,96,128,6,4096,2048,32,128,128,4,4,4,1350.8386666666665,3
w13,96,128,6,4096,2048,32,128,128,4,4,5,1350.4013333333332,3
w13,96,128,6,4096,2048,32,128,128,4,8,4,1350.6466666666668,3
w13,96,128,6,4096,2048,32,128,128,4,8,5,1351.0956666666668,3
w13,96,128,6,4096,2048,32,128,128,8,4,4,1351.245,3
w13,96,128,6,4096,2048,32,128,128,8,4,5,1351.4476666666667,3
w13,96,128,6,4096,2048,32,128,128,8,8,4,1350.733,3
w13,96,128,6,4096,2048,32,128,128,8,8,5,1351.3293333333334,3
w13,96,128,6,4096,2048,32,128,128,16,4,3,1352.9086666666667,3
w13,96,128,6,4096,2048,32,128,128,16,4,4,1351.3936666666666,3
w13,96,128,6,4096,2048,32,128,128,16,4,5,1350.9776666666667,3
w13,96,128,6,4096,2048,32,128,128,16,8,4,1352.354,3
w13,96,128,6,4096,2048,32,128,128,16,8,5,1351.8096666666668,3
w13,96,128,6,4096,2048,64,128,128,1,8,4,1349.068,3
w13,96,128,6,4096,2048,64,128,128,4,4,4,1352.7376666666667,3
w13,96,128,6,4096,2048,64,128,128,4,8,4,1350.231,3
w13,96,128,6,4096,2048,64,128,128,16,4,4,1352.7913333333333,3
w13,96,128,6,4096,2048,64,128,128,16,8,4,1351.1056666666666,3
w13,96,128,6,4096,2048,64,128,128,32,8,4,1352.3223333333333,3
w13,96,128,8,2048,768,16,128,128,1,8,2,258.49966666666666,3
w13,96,128,8,2048,768,16,128,128,32,8,2,259.513,3
w13,96,128,8,2048,768,16,128,128,64,8,2,259.79033333333336,3
w13,96,128,8,4096,1536,16,16,256,1,4,5,1020.4356666666666,3
w13,96,128,8,4096,1536,16,16,256,4,4,5,1020.5743333333334,3
w13,96,128,8,4096,1536,16,32,128,1,4,5,1021.1080000000001,3
w13,96,128,8,4096,1536,16,32,256,1,4,4,1020.6813333333333,3
w13,96,128,8,4096,1536,16,32,256,1,4,5,1017.5133333333333,3
w13,96,128,8,4096,1536,16,32,256,16,4,5,1019.092,3
w13,96,128,8,4096,1536,16,32,256,32,4,5,1021.2143333333333,3
w13,96,128,8,4096,1536,16,64,128,1,4,4,1020.8733333333333,3
w13,96,128,8,4096,1536,16,64,128,1,4,5,1018.2280000000001,3
w13,96,128,8,4096,1536,16,64,128,1,8,5,1019.7959999999999,3
w13,96,128,8,4096,1536,16,64,256,1,4,3,1019.0916666666667,3
w13,96,128,8,4096,1536,16,64,256,1,4,4,1019.145,3
w13,96,128,8,4096,1536,16,64,256,1,4,5,1018.1,3
w13,96,128,8,4096,1536,16,64,256,1,8,3,1020.4146666666666,3
w13,96,128,8,4096,1536,16,64,256,1,8,4,1018.8783333333334,3
w13,96,128,8,4096,1536,16,64,256,1,8,5,1018.6329999999999,3
w13,96,128,8,4096,1536,16,64,256,16,4,5,1019.1876666666667,3
w13,96,128,8,4096,1536,16,64,256,16,8,5,1021.0120000000001,3
w13,96,128,8,4096,1536,16,128,128,1,4,2,1020.212,3
w13,96,128,8,4096,1536,16,128,128,1,4,4,1019.5716666666667,3
w13,96,128,8,4096,1536,16,128,128,1,4,5,1018.5480000000001,3
w13,96,128,8,4096,1536,16,128,128,1,8,2,1020.969,3
w13,96,128,8,4096,1536,16,128,128,1,8,4,1018.8789999999999,3
w13,96,128,8,4096,1536,16,128,128,1,8,5,1016.1263333333333,3
w13,96,128,8,4096,1536,16,128,128,16,4,5,1019.9556666666667,3
w13,96,128,8,4096,1536,16,128,128,16,8,5,1019.4866666666667,3
w13,96,128,8,4096,1536,16,128,128,32,8,5,1020.223,3
w13,96,128,8,4096,1536,32,32,256,1,4,4,1021.033,3
w13,96,128,8,4096,1536,32,64,256,1,8,5,1021.1933333333333,3
w13,96,128,8,4096,1536,32,128,128,1,4,4,1018.313,3
w13,96,128,8,4096,1536,32,128,128,1,4,5,1018.9639999999999,3
w13,96,128,8,4096,1536,32,128,128,1,8,5,1019.828,3
w13,96,128,8,4096,1536,32,128,128,4,4,4,1020.372,3
w13,96,128,8,4096,1536,32,128,128,4,8,5,1020.9903333333333,3
w13,96,128,8,4096,1536,32,128,128,8,4,4,1020.0736666666667,3
w13,96,128,8,4096,1536,32,128,128,8,4,5,1021.0116666666667,3
w13,96,128,8,4096,1536,32,128,128,16,4,4,1019.2626666666666,3
w13,96,128,8,4096,1536,32,128,128,16,4,5,1020.7346666666667,3
w13,96,128,8,4096,1536,32,128,128,32,4,4,1020.9693333333333,3
w13,96,128,8,4096,1536,32,128,128,32,4,5,1020.7666666666668,3
w13,96,128,8,4096,1536,32,128,128,32,8,5,1020.6813333333333,3
w13,96,128,8,4096,1536,64,128,128,1,4,4,1020.3396666666667,3
w13,96,128,8,4096,1536,64,128,128,1,8,4,1017.0863333333333,3
w13,96,128,8,4096,1536,64,128,128,4,4,4,1020.6923333333334,3
w13,96,128,8,4096,1536,64,128,128,4,8,4,1018.3773333333334,3
w13,96,128,8,4096,1536,64,128,128,16,4,4,1021.0436666666666,3
w13,96,128,8,4096,1536,64,128,128,16,8,4,1018.3563333333333,3
w13,96,128,8,4096,1536,64,128,128,32,8,4,1020.8629999999999,3
w13,96,128,8,4096,3072,16,16,128,1,4,5,2033.394,3
w13,96,128,8,4096,3072,16,16,256,1,4,3,2032.8509999999999,3
w13,96,128,8,4096,3072,16,16,256,1,4,4,2028.381,3
w13,96,128,8,4096,3072,16,16,256,1,4,5,2026.2479999999998,3
w13,96,128,8,4096,3072,16,16,256,4,4,3,2033.4579999999999,3
w13,96,128,8,4096,3072,16,16,256,4,4,4,2032.5836666666667,3
w13,96,128,8,4096,3072,16,16,256,4,4,5,2031.4526666666668,3
w13,96,128,8,4096,3072,16,32,256,1,4,5,2027.6236666666666,3
w13,96,128,8,4096,3072,16,32,256,1,8,5,2027.4740000000002,3
w13,96,128,8,4096,3072,16,32,256,16,4,5,2029.2563333333335,3
w13,96,128,8,4096,3072,16,64,128,1,4,4,2033.4473333333335,3
w13,96,128,8,4096,3072,16,64,128,1,4,5,2030.9726666666666,3
w13,96,128,8,4096,3072,16,64,128,1,8,5,2031.2073333333335,3
w13,96,128,8,4096,3072,16,64,256,1,4,3,2030.4823333333334,3
w13,96,128,8,4096,3072,16,64,256,1,4,4,2025.9816666666666,3
w13,96,128,8,4096,3072,16,64,256,1,4,5,2026.1409999999998,3
w13,96,128,8,4096,3072,16,64,256,1,8,3,2031.7300000000002,3
w13,96,128,8,4096,3072,16,64,256,1,8,4,2024.68,3
w13,96,128,8,4096,3072,16,64,256,1,8,5,2025.8746666666666,3
w13,96,128,8,4096,3072,16,64,256,16,4,4,2032.2640000000001,3
w13,96,128,8,4096,3072,16,64,256,16,4,5,2029.5333333333335,3
w13,96,128,8,4096,3072,16,64,256,16,8,4,2032.818,3
w13,96,128,8,4096,3072,16,64,256,16,8,5,2030.7169999999999,3
w13,96,128,8,4096,3072,16,128,128,1,4,4,2030.0236666666667,3
w13,96,128,8,4096,3072,16,128,128,1,4,5,2025.128,3
w13,96,128,8,4096,3072,16,128,128,1,8,4,2029.138,3
w13,96,128,8,4096,3072,16,128,128,1,8,5,2023.3673333333334,3
w13,96,128,8,4096,3072,16,128,128,16,4,5,2026.0343333333333,3
w13,96,128,8,4096,3072,16,128,128,16,8,5,2024.6589999999999,3
w13,96,128,8,4096,3072,16,128,128,32,4,5,2029.554,3
w13,96,128,8,4096,3072,16,128,128,32,8,5,2027.3353333333334,3
w13,96,128,8,4096,3072,16,128,128,64,8,5,2033.5326666666667,3
w13,96,128,8,4096,3072,32,32,128,1,4,5,2032.6899999999998,3
w13,96,128,8,4096,3072,32,32,128,4,4,5,2033.0423333333335,3
w13,96,128,8,4096,3072,32,32,256,1,4,3,2031.72,3
w13,96,128,8,4096,3072,32,32,256,1,4,4,2029.235,3
w13,96,128,8,4096,3072,32,32,256,1,8,4,2031.4750000000001,3
w13,96,128,8,4096,3072,32,32,256,4,4,3,2031.0473333333332,3
w13,96,128,8,4096,3072,32,32,256,4,4,4,2029.6293333333333,3
w13,96,128,8,4096,3072,32,32,256,4,8,4,2032.2213333333332,3
w13,96,128,8,4096,3072,32,64,256,1,4,5,2031.528,3
w13,96,128,8,4096,3072,32,64,256,1,8,3,2033.5113333333331,3
w13,96,128,8,4096,3072,32,64,256,1,8,4,2028.8823333333332,3
w13,96,128,8,4096,3072,32,64,256,1,8,5,2028.4026666666668,3
w13,96,128,8,4096,3072,32,64,256,8,8,4,2031.2399999999998,3
w13,96,128,8,4096,3072,32,64,256,8,8,5,2030.461,3
w13,96,128,8,4096,3072,32,128,128,1,4,3,2027.677,3
w13,96,128,8,4096,3072,32,128,128,1,4,4,2026.8876666666667,3
w13,96,128,8,4096,3072,32,128,128,1,4,5,2024.6366666666665,3
w13,96,128,8,4096,3072,32,128,128,1,8,4,2029.9166666666667,3
w13,96,128,8,4096,3072,32,128,128,1,8,5,2025.8526666666667,3
w13,96,128,8,4096,3072,32,128,128,4,4,4,2025.49,3
w13,96,128,8,4096,3072,32,128,128,4,4,5,2024.9353333333336,3
w13,96,128,8,4096,3072,32,128,128,4,8,4,2026.738,3
w13,96,128,8,4096,3072,32,128,128,4,8,5,2026.0666666666666,3
w13,96,128,8,4096,3072,32,128,128,8,4,4,2026.728,3
w13,96,128,8,4096,3072,32,128,128,8,4,5,2026.3113333333333,3
w13,96,128,8,4096,3072,32,128,128,8,8,4,2027.5386666666666,3
w13,96,128,8,4096,3072,32,128,128,8,8,5,2025.469,3
w13,96,128,8,4096,3072,32,128,128,16,4,3,2029.3513333333333,3
w13,96,128,8,4096,3072,32,128,128,16,4,4,2027.1433333333334,3
w13,96,128,8,4096,3072,32,128,128,16,4,5,2028.2430000000002,3
w13,96,128,8,4096,3072,32,128,128,16,8,3,2030.7699999999998,3
w13,96,128,8,4096,3072,32,128,128,16,8,4,2029.9170000000001,3
w13,96,128,8,4096,3072,32,128,128,16,8,5,2027.4423333333332,3
w13,96,128,8,4096,3072,32,128,128,32,4,3,2032.68,3
w13,96,128,8,4096,3072,32,128,128,32,4,4,2030.1200000000001,3
w13,96,128,8,4096,3072,32,128,128,32,4,5,2029.9913333333334,3
w13,96,128,8,4096,3072,32,128,128,32,8,4,2033.2766666666666,3
w13,96,128,8,4096,3072,32,128,128,32,8,5,2029.9493333333332,3
w13,96,128,8,4096,3072,64,128,128,1,4,4,2028.5406666666668,3
w13,96,128,8,4096,3072,64,128,128,1,8,4,2024.2316666666666,3
w13,96,128,8,4096,3072,64,128,128,4,4,4,2026.9833333333333,3
w13,96,128,8,4096,3072,64,128,128,4,8,4,2025.3513333333333,3
w13,96,128,8,4096,3072,64,128,128,16,4,4,2029.4473333333335,3
w13,96,128,8,4096,3072,64,128,128,16,8,4,2025.97,3
w13,96,128,8,4096,3072,64,128,128,32,4,4,2032.4883333333335,3
w13,96,128,8,4096,3072,64,128,128,32,8,4,2030.2686666666666,3
w13,128,8,2,1024,512,32,64,64,1,8,3,6.401666666666666,3
w13,128,8,2,1024,512,64,64,128,1,8,3,6.391000000000001,3
w13,128,8,2,1024,512,64,64,128,1,8,4,6.4126666666666665,3
w13,128,16,2,1536,768,16,32,128,32,4,2,27.778333333333332,3
w13,128,16,4,1536,1024,32,32,128,16,4,2,37.41,3
w13,128,16,4,1536,1024,64,64,64,16,4,3,37.25033333333334,3
w13,128,16,4,1536,1024,64,64,64,32,4,3,37.239333333333335,3
w13,128,32,4,2048,768,16,64,64,16,4,3,69.11200000000001,3
w13,128,32,4,2048,768,16,64,64,64,4,3,69.10133333333333,3
w13,128,32,4,2048,768,16,64,128,1,4,2,69.005,3
w13,128,32,4,2048,768,16,64,128,16,4,2,69.14333333333333,3
w13,128,32,4,2048,768,16,64,128,32,4,2,68.835,3
w13,128,32,4,2048,768,16,64,128,64,4,2,69.05866666666667,3
w13,128,32,4,2048,768,16,128,128,1,8,2,69.14333333333333,3
w13,128,32,4,2048,768,16,128,128,32,8,2,69.09,3
w13,128,32,4,2048,768,16,128,128,64,8,2,68.88833333333334,3
w13,128,32,6,3072,1024,64,64,64,1,4,3,134.68033333333332,3
w13,128,32,6,3072,1024,64,64,64,4,4,3,134.47733333333335,3
w13,128,32,6,3072,1024,64,64,64,16,4,3,134.79733333333334,3
w13,128,60,4,2048,1408,16,32,256,1,4,2,226.14766666666665,3
w13,128,60,4,2048,1408,16,32,256,1,4,3,226.222,3
w13,128,60,4,2048,1408,16,64,128,1,4,2,225.7746666666667,3
w13,128,60,4,2048,1408,16,64,128,1,4,4,226.68133333333333,3
w13,128,60,4,2048,1408,16,64,128,1,4,5,226.71266666666668,3
w13,128,60,4,2048,1408,16,64,128,1,8,3,226.564,3
w13,128,60,4,2048,1408,16,64,128,1,8,5,226.24366666666666,3
w13,128,60,4,2048,1408,16,64,128,16,4,2,226.13700000000003,3
w13,128,60,4,2048,1408,16,64,128,16,4,4,226.71333333333334,3
w13,128,60,4,2048,1408,16,64,128,16,8,2,225.92366666666666,3
w13,128,60,4,2048,1408,16,64,128,32,4,2,226.06233333333333,3
w13,128,60,4,2048,1408,16,64,128,32,4,3,226.649,3
w13,128,60,4,2048,1408,16,64,128,32,8,2,226.40366666666668,3
w13,128,60,4,2048,1408,16,64,128,64,4,2,226.03066666666666,3
w13,128,60,4,2048,1408,16,64,256,1,4,2,226.37199999999999,3
w13,128,60,4,2048,1408,16,128,128,1,4,2,226.88400000000001,3
w13,128,60,4,2048,1408,16,128,128,1,8,4,225.934,3
w13,128,60,4,2048,1408,16,128,128,1,8,5,226.30733333333333,3
w13,128,60,4,2048,1408,16,128,128,16,8,4,226.65966666666668,3
w13,128,60,4,2048,1408,32,64,128,1,4,2,226.49966666666668,3
w13,128,60,4,2048,1408,32,64,128,4,4,2,226.18999999999997,3
w13,128,60,4,2048,1408,32,64,128,32,4,2,226.85166666666666,3
w13,128,60,4,2048,1408,32,128,128,1,8,3,226.90499999999997,3
w13,128,60,4,2048,1408,32,128,128,4,4,3,226.73433333333332,3
w13,128,60,4,2048,1408,32,128,128,4,8,3,226.54233333333332,3
w13,128,60,4,2048,1408,32,128,128,8,4,3,226.80866666666665,3
w13,128,60,4,2048,1408,32,128,128,8,8,3,226.75566666666668,3
w13,128,60,4,2048,1408,32,128,128,16,4,3,226.43566666666666,3
w13,128,60,4,2048,1408,32,128,128,16,8,3,226.27533333333335,3
w13,128,60,4,2048,1408,64,64,64,4,4,3,226.71266666666665,3
w13,128,60,6,3584,2304,16,64,128,1,4,4,637.543,3
w13,128,60,6,3584,2304,16,128,128,1,4,2,635.356,3
w13,128,60,6,3584,2304,16,128,128,1,4,4,637.0096666666667,3
w13,128,60,6,3584,2304,16,128,128,1,8,4,637.9056666666667,3
w13,128,60,6,3584,2304,16,128,128,1,8,5,635.623,3
w13,128,60,6,3584,2304,16,128,128,16,4,2,635.0256666666667,3
w13,128,60,6,3584,2304,16,128,128,16,4,4,638.0546666666668,3
w13,128,60,6,3584,2304,16,128,128,16,8,4,638.1083333333333,3
w13,128,60,6,3584,2304,16,128,128,16,8,5,637.9693333333333,3
w13,128,60,6,3584,2304,16,128,128,32,4,2,636.1776666666666,3
w13,128,60,6,3584,2304,16,128,128,64,4,2,637.2336666666666,3
w13,128,60,6,3584,2304,32,128,128,1,4,3,635.4733333333334,3
w13,128,60,6,3584,2304,32,128,128,1,8,3,636.5616666666666,3
w13,128,60,6,3584,2304,32,128,128,4,8,3,636.818,3
w13,128,60,6,3584,2304,32,128,128,4,8,5,638.1723333333333,3
w13,128,60,6,3584,2304,32,128,128,8,4,3,636.9989999999999,3
w13,128,60,6,3584,2304,32,128,128,8,8,3,636.316,3
w13,128,60,6,3584,2304,32,128,128,16,4,3,636.3803333333334,3
w13,128,60,6,3584,2304,32,128,128,16,8,3,636.028,3
w13,128,60,6,3584,2304,32,128,128,32,4,3,638.1403333333334,3
w13,128,60,8,2048,1536,32,128,128,1,4,2,249.42233333333334,3
w13,128,60,8,2048,1536,32,128,128,1,4,3,250.02999999999997,3
w13,128,60,8,2048,1536,32,128,128,4,4,2,249.059,3
w13,128,60,8,2048,1536,32,128,128,8,4,2,249.87066666666666,3
w13,128,60,8,2048,1536,32,128,128,8,4,3,249.817,3
w13,128,60,8,2048,1536,32,128,128,16,4,2,249.26200000000003,3
w13,128,60,8,2048,1536,32,128,128,32,4,2,250.08366666666666,3
w13,128,60,8,2048,1536,32,128,128,64,4,2,250.148,3
w13,128,64,6,3072,2048,16,128,128,1,4,2,520.3043333333334,3
w13,128,64,6,3072,2048,16,128,128,1,4,3,518.6186666666666,3
w13,128,64,6,3072,2048,16,128,128,1,8,3,518.2243333333333,3
w13,128,64,6,3072,2048,16,128,128,1,8,5,519.8136666666667,3
w13,128,64,6,3072,2048,32,128,128,1,4,3,520.3149999999999,3
w13,128,64,6,3072,2048,32,128,128,1,8,3,520.657,3
w13,128,64,6,3072,2048,32,128,128,4,4,3,519.7603333333333,3
w13,128,64,6,3072,2048,32,128,128,4,8,3,520.7096666666666,3
w13,128,64,6,3584,1536,16,32,256,1,4,2,454.63966666666664,3
w13,128,64,6,3584,1536,16,64,128,1,4,3,454.5976666666667,3
w13,128,64,6,3584,1536,16,64,128,1,4,4,453.46633333333335,3
w13,128,64,6,3584,1536,16,64,128,1,8,2,454.757,3
w13,128,64,6,3584,1536,16,64,256,1,4,2,455.2796666666666,3
w13,128,64,6,3584,1536,16,128,128,1,4,2,454.8106666666667,3
w13,128,64,6,3584,1536,16,128,128,1,4,3,455.51500000000004,3
w13,128,64,6,3584,1536,16,128,128,1,8,2,453.33833333333337,3
w13,128,64,6,3584,1536,16,128,128,1,8,3,455.248,3
w13,128,64,6,3584,1536,16,128,128,1,8,4,454.83200000000005,3
w13,128,64,6,3584,1536,16,128,128,1,8,5,455.365,3
w13,128,64,6,3584,1536,16,128,128,16,4,2,454.6186666666667,3
w13,128,64,6,3584,1536,16,128,128,16,8,2,454.565,3
w13,128,64,6,3584,1536,16,128,128,32,4,2,455.3543333333334,3
w13,128,64,6,3584,1536,16,128,128,32,8,2,455.1836666666666,3
w13,128,64,6,3584,1536,16,128,128,64,4,2,454.9066666666667,3
w13,128,64,6,3584,1536,32,32,128,1,4,2,454.49066666666664,3
w13,128,64,6,3584,1536,32,32,128,4,4,2,454.7253333333333,3
w13,128,64,6,3584,1536,32,64,128,4,4,2,454.885,3
w13,128,64,6,3584,1536,32,128,128,1,4,3,455.1523333333333,3
w13,128,64,6,3584,1536,32,128,128,1,8,3,454.1173333333333,3
w13,128,64,6,3584,1536,32,128,128,1,8,4,455.1306666666666,3
w13,128,64,6,3584,1536,32,128,128,4,4,3,454.71433333333334,3
w13,128,64,6,3584,1536,32,128,128,4,8,3,454.44766666666663,3
w13,128,64,6,3584,1536,32,128,128,8,4,2,454.9703333333334,3
w13,128,64,6,3584,1536,32,128,128,8,8,3,455.2266666666667,3
w13,128,64,6,3584,1536,32,128,128,16,4,2,454.6293333333333,3
w13,128,64,6,3584,1536,32,128,128,16,4,3,455.57933333333335,3
w13,128,64,6,3584,1536,64,64,64,1,4,3,455.173,3
w13,128,64,6,3584,1536,64,64,64,4,4,3,455.5463333333334,3
w13,128,64,6,3584,1536,64,128,128,1,8,4,455.1836666666666,3
w13,128,64,8,3584,2560,16,128,128,1,4,4,756.9573333333333,3
w13,128,64,8,3584,2560,16,128,128,1,8,4,757.1170000000001,3
w13,128,64,8,3584,2560,16,128,128,1,8,5,754.1093333333333,3
w13,128,64,8,3584,2560,16,128,128,16,8,5,756.648,3
w13,128,64,8,3584,2560,32,128,128,8,4,3,757.683,3
w13,128,128,4,2048,512,16,64,128,1,4,3,175.0856666666667,3
w13,128,128,4,2048,512,16,64,128,1,4,4,174.74433333333332,3
w13,128,128,4,2048,512,16,64,128,1,4,5,175.054,3
w13,128,128,4,2048,512,16,64,128,16,4,3,174.755,3
w13,128,128,4,2048,512,16,64,128,16,4,4,174.819,3
w13,128,128,4,2048,512,16,64,128,16,4,5,174.713,3
w13,128,128,4,2048,512,16,64,128,32,4,5,175.18200000000002,3
w13,128,128,4,2048,512,16,64,128,64,4,3,174.93666666666664,3
w13,128,128,4,2048,512,16,64,128,64,4,5,175.18166666666664,3
w13,128,128,4,2048,512,16,64,256,1,4,2,175.09633333333332,3
w13,128,128,4,2048,512,16,128,128,1,4,2,174.31799999999998,3
w13,128,128,4,2048,512,16,128,128,16,4,2,174.62699999999998,3
w13,128,128,4,2048,512,16,128,128,16,8,2,175.12833333333333,3
w13,128,128,4,2048,512,16,128,128,32,4,2,175.12833333333333,3
w13,128,128,4,2048,512,16,128,128,32,8,2,174.77633333333333,3
w13,128,128,6,4096,2048,16,16,256,1,4,4,1356.1726666666666,3
w13,128,128,6,4096,2048,16,16,256,1,4,5,1354.5623333333333,3
w13,128,128,6,4096,2048,16,16,256,4,4,5,1356.3113333333333,3
w13,128,128,6,4096,2048,16,32,256,1,4,5,1353.9213333333335,3
w13,128,128,6,4096,2048,16,32,256,1,8,5,1355.8523333333333,3
w13,128,128,6,4096,2048,16,32,256,16,4,5,1356.674,3
w13,128,128,6,4096,2048,16,64,128,1,4,5,1356.173,3
w13,128,128,6,4096,2048,16,64,128,1,8,5,1356.8873333333333,3
w13,128,128,6,4096,2048,16,64,256,1,4,3,1356.066,3
w13,128,128,6,4096,2048,16,64,256,1,4,4,1353.5806666666667,3
w13,128,128,6,4096,2048,16,64,256,1,4,5,1353.9750000000001,3
w13,128,128,6,4096,2048,16,64,256,1,8,3,1356.4709999999998,3
w13,128,128,6,4096,2048,16,64,256,1,8,4,1353.634,3
w13,128,128,6,4096,2048,16,64,256,1,8,5,1355.1063333333332,3
w13,128,128,6,4096,2048,16,64,256,16,4,5,1356.7803333333334,3
w13,128,128,6,4096,2048,16,128,128,1,4,5,1352.7060000000001,3
w13,128,128,6,4096,2048,16,128,128,1,8,4,1356.6526666666666,3
w13,128,128,6,4096,2048,16,128,128,1,8,5,1350.2740000000001,3
w13,128,128,6,4096,2048,16,128,128,16,4,5,1355.309,3
w13,128,128,6,4096,2048,16,128,128,16,8,5,1352.61,3
w13,128,128,6,4096,2048,16,128,128,32,4,5,1356.6103333333333,3
w13,128,128,6,4096,2048,16,128,128,32,8,5,1354.7113333333334,3
w13,128,128,6,4096,2048,32,32,256,1,4,4,1356.5353333333335,3
w13,128,128,6,4096,2048,32,128,128,1,4,4,1355.287,3
w13,128,128,6,4096,2048,32,128,128,1,4,5,1353.3353333333332,3
w13,128,128,6,4096,2048,32,128,128,1,8,4,1354.6366666666665,3
w13,128,128,6,4096,2048,32,128,128,1,8,5,1356.6316666666667,3
w13,128,128,6,4096,2048,32,128,128,4,4,4,1356.3003333333334,3
w13,128,128,6,4096,2048,32,128,128,4,4,5,1354.9673333333333,3
w13,128,128,6,4096,2048,32,128,128,4,8,4,1354.327,3
w13,128,128,6,4096,2048,32,128,128,4,8,5,1354.6046666666668,3
w13,128,128,6,4096,2048,32,128,128,8,4,4,1354.21,3
w13,128,128,6,4096,2048,32,128,128,8,4,5,1353.41,3
w13,128,128,6,4096,2048,32,128,128,8,8,4,1355.3726666666666,3
w13,128,128,6,4096,2048,32,128,128,8,8,5,1355.682,3
w13,128,128,6,4096,2048,32,128,128,16,4,4,1355.1166666666666,3
w13,128,128,6,4096,2048,32,128,128,16,4,5,1355.4896666666666,3
w13,128,128,6,4096,2048,32,128,128,16,8,4,1355.6713333333335,3
w13,128,128,6,4096,2048,64,128,128,1,4,4,1356.0023333333331,3
w13,128,128,6,4096,2048,64,128,128,1,8,4,1352.9616666666668,3
w13,128,128,6,4096,2048,64,128,128,4,4,4,1356.2576666666666,3
w13,128,128,6,4096,2048,64,128,128,4,8,4,1353.911,3
w13,128,128,6,4096,2048,64,128,128,16,4,4,1356.2366666666667,3
w13,128,128,6,4096,2048,64,128,128,16,8,4,1353.4416666666666,3
w13,128,128,6,4096,2048,64,128,128,32,8,4,1354.9566666666667,3
w13,128,128,8,2048,768,16,128,128,1,4,2,260.54766666666666,3
w13,128,128,8,2048,768,16,128,128,1,8,2,260.0996666666667,3
w13,128,128,8,2048,768,16,128,128,16,4,2,260.7183333333333,3
w13,128,128,8,2048,768,16,128,128,16,8,2,260.56933333333336,3
w13,128,128,8,2048,768,16,128,128,32,4,2,260.5586666666666,3
w13,128,128,8,2048,768,16,128,128,32,8,2,260.8573333333333,3
w13,128,128,8,2048,768,16,128,128,64,4,2,260.676,3
w13,128,128,8,2048,768,16,128,128,64,8,2,260.7506666666667,3
w13,128,128,8,2048,768,32,128,128,8,4,2,261.3693333333333,3
w13,128,128,8,4096,1536,16,16,256,1,4,5,1023.2623333333335,3
w13,128,128,8,4096,1536,16,32,256,1,4,5,1020.4036666666667,3
w13,128,128,8,4096,1536,16,32,256,16,4,5,1024.287,3
w13,128,128,8,4096,1536,16,64,128,1,4,4,1023.8276666666667,3
w13,128,128,8,4096,1536,16,64,128,1,4,5,1022.111,3
w13,128,128,8,4096,1536,16,64,256,1,4,3,1022.4733333333334,3
w13,128,128,8,4096,1536,16,64,256,1,4,4,1022.8676666666667,3
w13,128,128,8,4096,1536,16,64,256,1,4,5,1020.9913333333334,3
w13,128,128,8,4096,1536,16,64,256,1,8,4,1023.1666666666666,3
w13,128,128,8,4096,1536,16,64,256,1,8,5,1022.665,3
w13,128,128,8,4096,1536,16,64,256,16,4,5,1023.9983333333333,3
w13,128,128,8,4096,1536,16,128,128,1,4,4,1020.1476666666667,3
w13,128,128,8,4096,1536,16,128,128,1,4,5,1020.351,3
w13,128,128,8,4096,1536,16,128,128,1,8,4,1021.3960000000001,3
w13,128,128,8,4096,1536,16,128,128,1,8,5,1019.2303333333333,3
w13,128,128,8,4096,1536,16,128,128,16,4,5,1023.9459999999999,3
w13,128,128,8,4096,1536,16,128,128,16,8,5,1021.812,3
w13,128,128,8,4096,1536,16,128,128,32,8,5,1024.0943333333332,3
w13,128,128,8,4096,1536,32,128,128,1,4,4,1022.1963333333333,3
w13,128,128,8,4096,1536,32,128,128,1,4,5,1021.0120000000001,3
w13,128,128,8,4096,1536,32,128,128,1,8,5,1022.8143333333334,3
w13,128,128,8,4096,1536,32,128,128,4,4,4,1021.417,3
w13,128,128,8,4096,1536,32,128,128,4,4,5,1022.185,3
w13,128,128,8,4096,1536,32,128,128,4,8,5,1022.9956666666667,3
w13,128,128,8,4096,1536,32,128,128,8,4,4,1022.324,3
w13,128,128,8,4096,1536,32,128,128,8,4,5,1023.0176666666666,3
w13,128,128,8,4096,1536,32,128,128,8,8,5,1023.7959999999999,3
w13,128,128,8,4096,1536,32,128,128,16,4,4,1022.8146666666667,3
w13,128,128,8,4096,1536,32,128,128,16,4,5,1022.7933333333334,3
w13,128,128,8,4096,1536,32,128,128,16,8,5,1023.3376666666667,3
w13,128,128,8,4096,1536,64,128,128,1,4,4,1023.1556666666665,3
w13,128,128,8,4096,1536,64,128,128,1,8,4,1020.0523333333334,3
w13,128,128,8,4096,1536,64,128,128,4,4,4,1023.337,3
w13,128,128,8,4096,1536,64,128,128,4,8,4,1020.916,3
w13,128,128,8,4096,1536,64,128,128,16,8,4,1022.4203333333334,3
w13,128,128,8,4096,3072,16,16,256,1,4,4,2036.3596666666665,3
w13,128,128,8,4096,3072,16,16,256,1,4,5,2033.2340000000002,3
w13,128,128,8,4096,3072,16,16,256,4,4,3,2040.104,3
w13,128,128,8,4096,3072,16,16,256,4,4,4,2036.818,3
w13,128,128,8,4096,3072,16,16,256,4,4,5,2035.9759999999999,3
w13,128,128,8,4096,3072,16,32,256,1,4,5,2034.2476666666669,3
w13,128,128,8,4096,3072,16,32,256,1,8,5,2036.2743333333335,3
w13,128,128,8,4096,3072,16,32,256,16,4,5,2038.8770000000002,3
w13,128,128,8,4096,3072,16,64,128,1,4,5,2038.3760000000002,3
w13,128,128,8,4096,3072,16,64,128,1,8,5,2039.8903333333335,3
w13,128,128,8,4096,3072,16,64,256,1,4,3,2038.1516666666666,3
w13,128,128,8,4096,3072,16,64,256,1,4,4,2036.1576666666667,3
w13,128,128,8,4096,3072,16,64,256,1,4,5,2033.2136666666665,3
w13,128,128,8,4096,3072,16,64,256,1,8,3,2038.9836666666667,3
w13,128,128,8,4096,3072,16,64,256,1,8,4,2033.6073333333334,3
w13,128,128,8,4096,3072,16,64,256,1,8,5,2034.6319999999998,3
w13,128,128,8,4096,3072,16,64,256,16,4,5,2038.4399999999998,3
w13,128,128,8,4096,3072,16,64,256,16,8,5,2040.232,3
w13,128,128,8,4096,3072,16,128,128,1,4,2,2040.6480000000001,3
w13,128,128,8,4096,3072,16,128,128,1,4,4,2036.701,3
w13,128,128,8,4096,3072,16,128,128,1,4,5,2031.9326666666666,3
w13,128,128,8,4096,3072,16,128,128,1,8,2,2039.7623333333333,3
w13,128,128,8,4096,3072,16,128,128,1,8,4,2035.8373333333336,3
w13,128,128,8,4096,3072,16,128,128,1,8,5,2030.5996666666667,3
w13,128,128,8,4096,3072,16,128,128,16,4,4,2038.8990000000001,3
w13,128,128,8,4096,3072,16,128,128,16,4,5,2033.245,3
w13,128,128,8,4096,3072,16,128,128,16,8,4,2040.7866666666669,3
w13,128,128,8,4096,3072,16,128,128,16,8,5,2030.8876666666667,3
w13,128,128,8,4096,3072,16,128,128,32,4,5,2037.6719999999998,3
w13,128,128,8,4096,3072,16,128,128,32,8,5,2033.1703333333335,3
w13,128,128,8,4096,3072,32,32,256,1,4,4,2036.4243333333334,3
w13,128,128,8,4096,3072,32,32,256,1,8,4,2039.2293333333334,3
w13,128,128,8,4096,3072,32,32,256,4,4,3,2039.6666666666667,3
w13,128,128,8,4096,3072,32,32,256,4,4,4,2037.8743333333332,3
w13,128,128,8,4096,3072,32,32,256,4,8,4,2040.509,3
w13,128,128,8,4096,3072,32,64,256,1,4,5,2040.637,3
w13,128,128,8,4096,3072,32,64,256,1,8,4,2036.402,3
w13,128,128,8,4096,3072,32,64,256,1,8,5,2037.5656666666666,3
w13,128,128,8,4096,3072,32,64,256,8,8,4,2040.4026666666668,3
w13,128,128,8,4096,3072,32,64,256,8,8,5,2038.5573333333334,3
w13,128,128,8,4096,3072,32,128,128,1,4,3,2034.2053333333333,3
w13,128,128,8,4096,3072,32,128,128,1,4,4,2034.5463333333335,3
w13,128,128,8,4096,3072,32,128,128,1,4,5,2031.7839999999999,3
w13,128,128,8,4096,3072,32,128,128,1,8,4,2033.1493333333335,3
w13,128,128,8,4096,3072,32,128,128,1,8,5,2033.8103333333336,3
w13,128,128,8,4096,3072,32,128,128,4,4,3,2037.9916666666668,3
w13,128,128,8,4096,3072,32,128,128,4,4,4,2032.7436666666665,3
w13,128,128,8,4096,3072,32,128,128,4,4,5,2033.032,3
w13,128,128,8,4096,3072,32,128,128,4,8,4,2034.1623333333334,3
w13,128,128,8,4096,3072,32,128,128,4,8,5,2031.7626666666667,3
w13,128,128,8,4096,3072,32,128,128,8,4,4,2032.946,3
w13,128,128,8,4096,3072,32,128,128,8,4,5,2031.6453333333332,3
w13,128,128,8,4096,3072,32,128,128,8,8,4,2034.173,3
w13,128,128,8,4096,3072,32,128,128,8,8,5,2032.872,3
w13,128,128,8,4096,3072,32,128,128,16,4,3,2036.0829999999999,3
w13,128,128,8,4096,3072,32,128,128,16,4,4,2034.0553333333335,3
w13,128,128,8,4096,3072,32,128,128,16,4,5,2033.778,3
w13,128,128,8,4096,3072,32,128,128,16,8,3,2039.6556666666668,3
w13,128,128,8,4096,3072,32,128,128,16,8,4,2037.3733333333332,3
w13,128,128,8,4096,3072,32,128,128,16,8,5,2033.8316666666667,3
w13,128,128,8,4096,3072,32,128,128,32,4,3,2039.1009999999999,3
w13,128,128,8,4096,3072,32,128,128,32,4,4,2038.3113333333333,3
w13,128,128,8,4096,3072,32,128,128,32,4,5,2036.861,3
w13,128,128,8,4096,3072,32,128,128,32,8,5,2038.2160000000001,3
w13,128,128,8,4096,3072,32,128,128,64,4,3,2040.5413333333333,3
w13,128,128,8,4096,3072,64,128,128,1,4,4,2033.5546666666667,3
w13,128,128,8,4096,3072,64,128,128,1,8,4,2032.3280000000002,3
w13,128,128,8,4096,3072,64,128,128,4,4,4,2034.5253333333333,3
w13,128,128,8,4096,3072,64,128,128,4,8,4,2031.666,3
w13,128,128,8,4096,3072,64,128,128,16,4,4,2035.1436666666668,3
w13,128,128,8,4096,3072,64,128,128,16,8,4,2033.0743333333332,3
w13,128,128,8,4096,3072,64,128,128,32,4,4,2040.3913333333333,3
w13,128,128,8,4096,3072,64,128,128,32,8,4,2037.4373333333333,3
w13,256,8,2,1024,512,64,64,128,1,8,3,6.658,3
w13,256,8,2,1024,512,64,64,128,1,8,4,6.646999999999999,3
w13,256,8,2,1024,512,64,64,128,8,8,3,6.668666666666667,3
w13,256,8,2,1024,512,64,64,128,32,8,3,6.679333333333333,3
w13,256,8,2,1024,512,64,64,128,64,8,3,6.679333333333333,3
w13,256,16,2,1536,768,32,32,128,4,4,2,29.250333333333334,3
w13,256,16,4,1536,1024,64,64,64,1,4,3,38.509,3
w13,256,16,4,1536,1024,64,64,64,4,4,3,38.637,3
w13,256,16,4,1536,1024,64,64,64,4,8,3,38.690333333333335,3
w13,256,16,4,1536,1024,64,64,64,32,4,3,38.63733333333334,3
w13,256,16,4,1536,1024,64,64,64,64,4,3,38.669000000000004,3
w13,256,16,4,1536,1024,64,128,64,1,8,3,38.69,3
w13,256,16,4,1536,1024,64,128,64,32,8,3,38.70066666666667,3
w13,256,32,4,2048,768,32,64,64,1,4,3,70.80733333333333,3
w13,256,32,4,2048,768,32,128,128,1,4,2,71.01,3
w13,256,32,4,2048,768,32,128,128,8,4,2,70.66933333333333,3
w13,256,32,6,3072,1024,64,64,64,1,4,3,137.02700000000002,3
w13,256,32,6,3072,1024,64,64,64,16,4,3,136.74933333333334,3
w13,256,60,4,2048,1408,32,64,128,1,4,2,229.27266666666665,3
w13,256,60,4,2048,1408,32,64,128,4,4,2,229.20866666666666,3
w13,256,60,4,2048,1408,32,128,128,1,4,3,229.04933333333335,3
w13,256,60,4,2048,1408,32,128,128,1,8,3,229.593,3
w13,256,60,4,2048,1408,32,128,128,4,4,3,228.81433333333334,3
w13,256,60,4,2048,1408,32,128,128,4,8,3,229.25166666666667,3
w13,256,60,4,2048,1408,32,128,128,8,4,3,229.24133333333336,3
w13,256,60,4,2048,1408,32,128,128,8,8,3,229.84900000000002,3
w13,256,60,4,2048,1408,64,64,64,1,4,3,229.5393333333333,3
w13,256,60,4,2048,1408,64,64,64,4,4,3,229.006,3
w13,256,60,6,3584,2304,32,128,128,1,4,3,643.1643333333333,3
w13,256,60,6,3584,2304,32,128,128,1,8,3,642.8336666666667,3
w13,256,60,6,3584,2304,32,128,128,4,4,3,643.7723333333333,3
w13,256,60,6,3584,2304,32,128,128,4,8,3,641.5426666666666,3
w13,256,60,6,3584,2304,32,128,128,8,4,3,644.1990000000001,3
w13,256,60,6,3584,2304,32,128,128,16,8,3,644.4976666666666,3
w13,256,60,8,2048,1536,64,128,64,1,4,3,255.86533333333333,3
w13,256,60,8,2048,1536,64,128,64,4,4,3,255.17166666666665,3
w13,256,60,8,2048,1536,64,128,64,16,4,3,255.09699999999998,3
w13,256,64,6,3072,2048,32,128,128,1,4,3,526.4273333333334,3
w13,256,64,6,3072,2048,32,128,128,1,8,3,527.2379999999999,3
w13,256,64,6,3072,2048,32,128,128,4,4,3,526.7046666666666,3
w13,256,64,6,3072,2048,32,128,128,4,8,3,527.6750000000001,3
w13,256,64,6,3072,2048,32,128,128,8,4,3,528.7096666666666,3
w13,256,64,6,3584,1536,32,128,128,1,4,2,456.731,3
w13,256,64,6,3584,1536,32,128,128,4,4,2,457.979,3
w13,256,64,6,3584,1536,32,128,128,8,4,2,458.0423333333333,3
w13,256,64,6,3584,1536,32,128,128,16,4,2,458.49033333333335,3
w13,256,64,8,3584,2560,32,64,128,1,4,2,769.224,3
w13,256,64,8,3584,2560,32,64,128,1,8,2,769.8746666666666,3
w13,256,64,8,3584,2560,32,64,128,4,4,2,769.1706666666668,3
w13,256,64,8,3584,2560,32,64,128,4,8,2,770.7173333333334,3
w13,256,64,8,3584,2560,32,64,128,16,4,2,770.8666666666667,3
w13,256,64,8,3584,2560,32,128,128,1,4,3,768.3703333333333,3
w13,256,64,8,3584,2560,32,128,128,1,8,3,769.043,3
w13,256,64,8,3584,2560,32,128,128,4,4,3,767.5916666666667,3
w13,256,64,8,3584,2560,32,128,128,4,8,3,770.131,3
w13,256,64,8,3584,2560,32,128,128,8,4,2,770.9516666666667,3
w13,256,64,8,3584,2560,32,128,128,8,4,3,769.4163333333332,3
w13,256,64,8,3584,2560,32,128,128,8,8,3,769.8426666666668,3
w13,256,128,4,2048,512,16,64,128,1,4,3,175.94966666666664,3
w13,256,128,4,2048,512,16,64,128,16,4,3,176.52566666666667,3
w13,256,128,4,2048,512,16,64,128,32,4,3,176.30166666666665,3
w13,256,128,4,2048,512,16,128,128,1,4,2,175.99266666666665,3
w13,256,128,4,2048,512,16,128,128,1,8,2,176.37733333333335,3
w13,256,128,4,2048,512,16,128,128,16,4,2,175.9283333333333,3
w13,256,128,4,2048,512,16,128,128,16,8,2,175.86433333333335,3
w13,256,128,4,2048,512,16,128,128,32,4,2,176.16333333333333,3
w13,256,128,4,2048,512,16,128,128,32,8,2,175.89633333333336,3
w13,256,128,4,2048,512,16,128,128,64,4,2,175.758,3
w13,256,128,4,2048,512,16,128,128,64,8,2,176.46166666666667,3
w13,256,128,4,2048,512,32,32,128,4,4,2,176.08833333333334,3
w13,256,128,4,2048,512,32,32,128,16,4,2,176.47299999999998,3
w13,256,128,6,4096,2048,16,16,256,1,4,5,1368.7700000000002,3
w13,256,128,6,4096,2048,16,32,256,1,4,5,1370.1783333333333,3
w13,256,128,6,4096,2048,16,64,256,1,4,4,1368.8446666666666,3
w13,256,128,6,4096,2048,16,64,256,1,4,5,1370.4446666666665,3
w13,256,128,6,4096,2048,16,64,256,1,8,4,1368.866,3
w13,256,128,6,4096,2048,16,128,128,1,4,4,1366.434,3
w13,256,128,6,4096,2048,16,128,128,1,4,5,1365.8583333333333,3
w13,256,128,6,4096,2048,16,128,128,1,8,2,1368.1509999999998,3
w13,256,128,6,4096,2048,16,128,128,1,8,4,1367.8526666666667,3
w13,256,128,6,4096,2048,16,128,128,1,8,5,1363.7996666666666,3
w13,256,128,6,4096,2048,16,128,128,16,4,4,1369.1756666666668,3
w13,256,128,6,4096,2048,16,128,128,16,4,5,1367.9806666666666,3
w13,256,128,6,4096,2048,16,128,128,16,8,5,1365.666,3
w13,256,128,6,4096,2048,16,128,128,32,8,5,1370.125,3
w13,256,128,6,4096,2048,32,128,128,1,4,3,1366.8716666666667,3
w13,256,128,6,4096,2048,32,128,128,1,4,4,1367.6816666666666,3
w13,256,128,6,4096,2048,32,128,128,1,4,5,1366.402,3
w13,256,128,6,4096,2048,32,128,128,1,8,3,1368.3753333333334,3
w13,256,128,6,4096,2048,32,128,128,1,8,4,1366.573,3
w13,256,128,6,4096,2048,32,128,128,1,8,5,1368.7383333333335,3
w13,256,128,6,4096,2048,32,128,128,4,4,4,1368.1196666666667,3
w13,256,128,6,4096,2048,32,128,128,4,4,5,1367.0533333333333,3
w13,256,128,6,4096,2048,32,128,128,4,8,4,1366.9886666666669,3
w13,256,128,6,4096,2048,32,128,128,4,8,5,1366.893,3
w13,256,128,6,4096,2048,32,128,128,8,4,4,1367.7246666666667,3
w13,256,128,6,4096,2048,32,128,128,8,4,5,1366.7753333333333,3
w13,256,128,6,4096,2048,32,128,128,8,8,4,1367.0956666666668,3
w13,256,128,6,4096,2048,32,128,128,8,8,5,1367.0206666666666,3
w13,256,128,6,4096,2048,32,128,128,16,4,3,1369.5810000000001,3
w13,256,128,6,4096,2048,32,128,128,16,4,4,1370.5086666666666,3
w13,256,128,6,4096,2048,32,128,128,16,4,5,1368.6206666666667,3
w13,256,128,6,4096,2048,32,128,128,16,8,3,1369.57,3
w13,256,128,6,4096,2048,32,128,128,16,8,4,1369.6553333333334,3
w13,256,128,6,4096,2048,32,128,128,16,8,5,1368.6956666666665,3
w13,256,128,6,4096,2048,32,128,128,32,4,3,1370.018,3
w13,256,128,6,4096,2048,32,128,128,32,8,3,1368.8553333333332,3
w13,256,128,6,4096,2048,64,128,128,1,4,4,1368.2686666666668,3
w13,256,128,6,4096,2048,64,128,128,1,8,4,1365.0686666666668,3
w13,256,128,6,4096,2048,64,128,128,4,4,4,1370.0289999999998,3
w13,256,128,6,4096,2048,64,128,128,4,8,4,1366.21,3
w13,256,128,6,4096,2048,64,128,128,16,8,4,1367.7143333333333,3
w13,256,128,8,2048,768,16,128,128,1,4,2,263.02233333333334,3
w13,256,128,8,2048,768,16,128,128,1,8,2,262.212,3
w13,256,128,8,2048,768,16,128,128,16,4,2,263.14,3
w13,256,128,8,2048,768,16,128,128,16,8,2,263.43833333333333,3
w13,256,128,8,2048,768,16,128,128,32,8,2,263.43833333333333,3
w13,256,128,8,4096,1536,16,128,128,1,4,2,1030.6229999999998,3
w13,256,128,8,4096,1536,16,128,128,1,4,4,1032.0516666666665,3
w13,256,128,8,4096,1536,16,128,128,1,4,5,1033.5563333333332,3
w13,256,128,8,4096,1536,16,128,128,1,8,2,1029.7056666666667,3
w13,256,128,8,4096,1536,16,128,128,1,8,4,1032.639,3
w13,256,128,8,4096,1536,16,128,128,1,8,5,1031.9883333333335,3
w13,256,128,8,4096,1536,16,128,128,16,8,5,1033.6096666666665,3
w13,256,128,8,4096,1536,32,128,128,1,4,2,1032.361,3
w13,256,128,8,4096,1536,32,128,128,1,4,3,1031.0176666666666,3
w13,256,128,8,4096,1536,32,128,128,1,4,4,1031.988,3
w13,256,128,8,4096,1536,32,128,128,1,4,5,1032.969,3
w13,256,128,8,4096,1536,32,128,128,1,8,5,1034.2393333333332,3
w13,256,128,8,4096,1536,32,128,128,4,4,2,1033.4066666666668,3
w13,256,128,8,4096,1536,32,128,128,4,4,4,1033.13,3
w13,256,128,8,4096,1536,32,128,128,4,8,4,1034.4626666666666,3
w13,256,128,8,4096,1536,32,128,128,4,8,5,1033.343,3
w13,256,128,8,4096,1536,32,128,128,8,4,4,1033.5986666666668,3
w13,256,128,8,4096,1536,32,128,128,8,4,5,1033.9616666666666,3
w13,256,128,8,4096,1536,32,128,128,8,8,5,1033.3106666666667,3
w13,256,128,8,4096,1536,32,128,128,16,4,4,1034.0043333333333,3
w13,256,128,8,4096,1536,32,128,128,16,8,5,1034.473,3
w13,256,128,8,4096,1536,64,128,128,1,8,4,1030.0256666666667,3
w13,256,128,8,4096,1536,64,128,128,4,8,4,1032.8096666666668,3
w13,256,128,8,4096,1536,64,128,128,16,8,4,1032.6073333333334,3
w13,256,128,8,4096,3072,16,16,256,1,4,5,2061.9069999999997,3
w13,256,128,8,4096,3072,16,16,256,4,4,5,2063.5490000000004,3
w13,256,128,8,4096,3072,16,128,128,1,4,2,2059.603,3
w13,256,128,8,4096,3072,16,128,128,1,4,4,2056.7973333333334,3
w13,256,128,8,4096,3072,16,128,128,1,4,5,2054.92,3
w13,256,128,8,4096,3072,16,128,128,1,8,2,2057.0319999999997,3
w13,256,128,8,4096,3072,16,128,128,1,8,4,2056.370666666667,3
w13,256,128,8,4096,3072,16,128,128,1,8,5,2054.717,3
w13,256,128,8,4096,3072,16,128,128,16,4,2,2058.6426666666666,3
w13,256,128,8,4096,3072,16,128,128,16,4,4,2063.1119999999996,3
w13,256,128,8,4096,3072,16,128,128,16,4,5,2056.306666666667,3
w13,256,128,8,4096,3072,16,128,128,16,8,4,2062.1839999999997,3
w13,256,128,8,4096,3072,16,128,128,16,8,5,2055.1013333333335,3
w13,256,128,8,4096,3072,16,128,128,32,4,5,2063.336,3
w13,256,128,8,4096,3072,16,128,128,32,8,5,2060.6373333333336,3
w13,256,128,8,4096,3072,32,128,128,1,4,2,2061.4696666666664,3
w13,256,128,8,4096,3072,32,128,128,1,4,3,2053.4156666666663,3
w13,256,128,8,4096,3072,32,128,128,1,4,4,2058.1516666666666,3
w13,256,128,8,4096,3072,32,128,128,1,4,5,2055.208,3
w13,256,128,8,4096,3072,32,128,128,1,8,3,2055.133,3
w13,256,128,8,4096,3072,32,128,128,1,8,4,2057.981,3
w13,256,128,8,4096,3072,32,128,128,1,8,5,2056.4449999999997,3
w13,256,128,8,4096,3072,32,128,128,4,4,3,2059.5813333333335,3
w13,256,128,8,4096,3072,32,128,128,4,4,4,2056.317,3
w13,256,128,8,4096,3072,32,128,128,4,4,5,2056.1786666666667,3
w13,256,128,8,4096,3072,32,128,128,4,8,3,2061.1169999999997,3
w13,256,128,8,4096,3072,32,128,128,4,8,4,2055.9863333333333,3
w13,256,128,8,4096,3072,32,128,128,4,8,5,2056.637666666667,3
w13,256,128,8,4096,3072,32,128,128,8,4,3,2061.0313333333334,3
w13,256,128,8,4096,3072,32,128,128,8,4,4,2057.928,3
w13,256,128,8,4096,3072,32,128,128,8,4,5,2055.8160000000003,3
w13,256,128,8,4096,3072,32,128,128,8,8,3,2062.6216666666664,3
w13,256,128,8,4096,3072,32,128,128,8,8,4,2057.351666666667,3
w13,256,128,8,4096,3072,32,128,128,8,8,5,2056.925333333333,3
w13,256,128,8,4096,3072,32,128,128,16,4,3,2057.5440000000003,3
w13,256,128,8,4096,3072,32,128,128,16,4,4,2058.301,3
w13,256,128,8,4096,3072,32,128,128,16,4,5,2056.5733333333333,3
w13,256,128,8,4096,3072,32,128,128,16,8,3,2057.970333333333,3
w13,256,128,8,4096,3072,32,128,128,16,8,4,2060.2533333333336,3
w13,256,128,8,4096,3072,32,128,128,16,8,5,2058.291,3
w13,256,128,8,4096,3072,32,128,128,32,4,3,2061.778333333333,3
w13,256,128,8,4096,3072,32,128,128,32,4,4,2063.527666666667,3
w13,256,128,8,4096,3072,32,128,128,32,8,3,2060.8933333333334,3
w13,256,128,8,4096,3072,32,128,128,32,8,5,2062.9519999999998,3
w13,256,128,8,4096,3072,64,128,128,1,4,4,2059.2933333333335,3
w13,256,128,8,4096,3072,64,128,128,1,8,4,2055.741666666667,3
w13,256,128,8,4096,3072,64,128,128,4,4,4,2059.0049999999997,3
w13,256,128,8,4096,3072,64,128,128,4,8,4,2057.1496666666667,3
w13,256,128,8,4096,3072,64,128,128,16,4,4,2060.509,3
w13,256,128,8,4096,3072,64,128,128,16,8,4,2056.723,3
w13,256,128,8,4096,3072,64,128,128,32,8,4,2062.632,3
w13,512,8,2,1024,512,64,128,32,8,4,4,8.183666666666667,3
w13,512,8,2,1024,512,64,128,32,8,4,5,8.215333333333334,3
w13,512,8,2,1024,512,128,64,64,1,8,3,8.215666666666667,3
w13,512,8,2,1024,512,128,64,64,1,8,4,8.215666666666666,3
w13,512,16,2,1536,768,64,64,64,32,4,3,30.423666666666666,3
w13,512,16,2,1536,768,64,64,128,1,8,2,30.316999999999997,3
w13,512,16,2,1536,768,64,64,128,8,4,2,30.37,3
w13,512,16,2,1536,768,64,64,128,16,4,2,30.412666666666667,3
w13,512,16,2,1536,768,64,64,128,16,8,2,30.455333333333332,3
w13,512,16,4,1536,1024,128,128,64,4,8,3,42.45533333333333,3
w13,512,16,4,1536,1024,128,128,64,64,8,3,42.391333333333336,3
w13,512,32,4,2048,768,64,128,64,1,4,3,73.57033333333334,3
w13,512,32,4,2048,768,64,128,64,16,8,3,73.67766666666667,3
w13,512,32,4,2048,768,64,128,64,32,4,3,73.76233333333333,3
w13,512,32,4,2048,768,64,128,64,32,8,3,73.47433333333333,3
w13,512,32,4,2048,768,64,128,64,64,4,3,73.63466666666666,3
w13,512,32,6,3072,1024,128,128,64,1,8,3,146.25366666666665,3
w13,512,32,6,3072,1024,128,128,64,4,8,3,146.41333333333333,3
w13,512,60,4,2048,1408,64,128,128,1,8,2,234.3183333333333,3
w13,512,60,4,2048,1408,64,128,128,4,8,2,235.45933333333335,3
w13,512,60,4,2048,1408,64,128,128,16,8,2,234.32933333333335,3
w13,512,60,6,3584,2304,64,128,128,1,4,4,662.7593333333333,3
w13,512,60,6,3584,2304,64,128,128,1,8,4,660.327,3
w13,512,60,6,3584,2304,64,128,128,4,8,4,661.458,3
w13,512,60,6,3584,2304,64,128,128,16,8,4,663.2816666666666,3
w13,512,60,8,2048,1536,128,128,64,1,8,3,272.964,3
w13,512,60,8,2048,1536,128,128,64,1,8,5,272.76133333333337,3
w13,512,60,8,2048,1536,128,128,64,4,8,3,273.764,3
w13,512,60,8,2048,1536,128,128,64,4,8,5,273.9026666666667,3
w13,512,60,8,2048,1536,128,128,64,8,8,3,273.29466666666667,3
w13,512,60,8,2048,1536,128,128,64,8,8,5,273.742,3
w13,512,64,6,3072,2048,64,64,64,4,4,3,539.8033333333333,3
w13,512,64,6,3072,2048,64,128,128,1,4,2,538.8966666666666,3
w13,512,64,6,3072,2048,64,128,128,1,8,2,537.1153333333333,3
w13,512,64,6,3072,2048,64,128,128,4,4,2,539.0456666666668,3
w13,512,64,6,3072,2048,64,128,128,4,8,2,537.574,3
w13,512,64,6,3584,1536,64,64,64,1,4,3,468.14466666666664,3
w13,512,64,6,3584,1536,64,64,64,4,4,3,469.7653333333333,3
w13,512,64,6,3584,1536,64,128,128,1,4,2,469.61633333333333,3
w13,512,64,6,3584,1536,64,128,128,1,8,2,469.1046666666667,3
w13,512,64,6,3584,1536,64,128,128,1,8,4,469.68,3
w13,512,64,6,3584,1536,64,128,128,4,4,2,470.25600000000003,3
w13,512,64,6,3584,1536,64,128,128,4,8,2,469.382,3
w13,512,64,6,3584,1536,64,128,128,4,8,4,470.26666666666665,3
w13,512,64,6,3584,1536,64,128,128,16,8,2,470.3523333333333,3
w13,512,64,8,3584,2560,64,128,128,1,4,2,783.8586666666666,3
w13,512,64,8,3584,2560,64,128,128,1,8,2,782.8879999999999,3
w13,512,64,8,3584,2560,64,128,128,4,4,2,785.139,3
w13,512,64,8,3584,2560,64,128,128,4,8,2,782.6,3
w13,512,64,8,3584,2560,64,128,128,16,4,2,784.3066666666667,3
w13,512,64,8,3584,2560,64,128,128,16,8,2,782.643,3
w13,512,64,8,3584,2560,64,128,128,32,8,2,785.9813333333333,3
w13,512,128,4,2048,512,16,128,128,1,4,2,176.995,3
w13,512,128,6,4096,2048,32,128,128,1,4,2,1384.8983333333333,3
w13,512,128,6,4096,2048,32,128,128,1,4,3,1384.1306666666667,3
w13,512,128,6,4096,2048,32,128,128,1,4,4,1387.2023333333334,3
w13,512,128,6,4096,2048,32,128,128,1,4,5,1386.4236666666666,3
w13,512,128,6,4096,2048,32,128,128,1,8,3,1384.749,3
w13,512,128,6,4096,2048,32,128,128,1,8,4,1385.6023333333333,3
w13,512,128,6,4096,2048,32,128,128,1,8,5,1386.7436666666665,3
w13,512,128,6,4096,2048,32,128,128,4,4,2,1387.9383333333335,3
w13,512,128,6,4096,2048,32,128,128,4,4,3,1387.1383333333333,3
w13,512,128,6,4096,2048,32,128,128,4,4,4,1387.3943333333334,3
w13,512,128,6,4096,2048,32,128,128,4,4,5,1384.749,3
w13,512,128,6,4096,2048,32,128,128,4,8,3,1386.573,3
w13,512,128,6,4096,2048,32,128,128,4,8,4,1386.317,3
w13,512,128,6,4096,2048,32,128,128,4,8,5,1385.5703333333333,3
w13,512,128,6,4096,2048,32,128,128,8,4,2,1390.7966666666669,3
w13,512,128,6,4096,2048,32,128,128,8,4,4,1388.6636666666666,3
w13,512,128,6,4096,2048,32,128,128,8,4,5,1387.2553333333333,3
w13,512,128,6,4096,2048,32,128,128,8,8,3,1390.701,3
w13,512,128,6,4096,2048,32,128,128,8,8,4,1387.3623333333333,3
w13,512,128,6,4096,2048,32,128,128,8,8,5,1386.466333333333,3
w13,512,128,6,4096,2048,32,128,128,16,4,2,1390.7436666666665,3
w13,512,128,6,4096,2048,32,128,128,16,4,3,1387.6716666666669,3
w13,512,128,6,4096,2048,32,128,128,16,4,4,1390.4876666666667,3
w13,512,128,6,4096,2048,32,128,128,16,4,5,1390.9783333333332,3
w13,512,128,6,4096,2048,32,128,128,16,8,3,1384.7276666666667,3
w13,512,128,6,4096,2048,32,128,128,16,8,4,1389.9646666666667,3
w13,512,128,6,4096,2048,32,128,128,16,8,5,1390.2313333333334,3
w13,512,128,6,4096,2048,32,128,128,32,4,3,1390.2956666666666,3
w13,512,128,6,4096,2048,32,128,128,32,8,3,1390.0073333333332,3
w13,512,128,6,4096,2048,64,128,128,1,4,4,1387.938,3
w13,512,128,6,4096,2048,64,128,128,1,8,4,1385.0796666666665,3
w13,512,128,6,4096,2048,64,128,128,4,4,4,1388.461,3
w13,512,128,6,4096,2048,64,128,128,4,8,4,1386.4873333333333,3
w13,512,128,6,4096,2048,64,128,128,16,8,4,1389.026,3
w13,512,128,8,2048,768,32,128,128,1,4,2,268.7293333333334,3
w13,512,128,8,2048,768,32,128,128,4,4,2,267.855,3
w13,512,128,8,2048,768,32,128,128,8,4,2,267.91866666666664,3
w13,512,128,8,2048,768,32,128,128,32,4,2,268.825,3
w13,512,128,8,4096,1536,32,128,128,1,4,2,1048.2973333333332,3
w13,512,128,8,4096,1536,32,128,128,1,4,3,1045.5883333333334,3
w13,512,128,8,4096,1536,32,128,128,1,4,4,1049.7693333333334,3
w13,512,128,8,4096,1536,32,128,128,1,8,4,1050.463,3
w13,512,128,8,4096,1536,32,128,128,4,4,2,1049.9189999999999,3
w13,512,128,8,4096,1536,32,128,128,4,4,3,1050.8149999999998,3
w13,512,128,8,4096,1536,32,128,128,4,8,4,1050.3136666666667,3
w13,512,128,8,4096,1536,32,128,128,8,4,2,1050.6016666666667,3
w13,512,128,8,4096,1536,32,128,128,8,4,4,1050.3990000000001,3
w13,512,128,8,4096,1536,32,128,128,8,8,4,1050.0896666666667,3
w13,512,128,8,4096,1536,32,128,128,16,4,2,1049.364,3
w13,512,128,8,4096,1536,32,128,128,16,4,3,1047.754,3
w13,512,128,8,4096,1536,32,128,128,16,8,4,1050.1753333333334,3
w13,512,128,8,4096,1536,64,128,128,1,4,2,1048.6603333333333,3
w13,512,128,8,4096,1536,64,128,128,1,8,2,1050.3136666666667,3
w13,512,128,8,4096,1536,64,128,128,1,8,4,1046.6976666666667,3
w13,512,128,8,4096,1536,64,128,128,4,8,4,1049.1723333333332,3
w13,512,128,8,4096,1536,64,128,128,16,8,4,1049.6093333333333,3
w13,512,128,8,4096,3072,32,128,128,1,4,2,2079.6883333333335,3
w13,512,128,8,4096,3072,32,128,128,1,4,3,2082.706666666667,3
w13,512,128,8,4096,3072,32,128,128,1,8,3,2086.066666666667,3
w13,512,128,8,4096,3072,32,128,128,4,4,2,2087.795,3
w13,512,128,8,4096,3072,32,128,128,4,4,3,2086.0033333333336,3
w13,512,128,8,4096,3072,32,128,128,4,8,3,2087.3043333333335,3
w13,512,128,8,4096,3072,32,128,128,4,8,4,2089.683,3
w13,512,128,8,4096,3072,32,128,128,8,4,2,2089.672,3
w13,512,128,8,4096,3072,32,128,128,8,4,3,2089.9706666666666,3
w13,512,128,8,4096,3072,32,128,128,16,4,2,2087.3790000000004,3
w13,512,128,8,4096,3072,32,128,128,16,4,3,2087.4959999999996,3
w13,512,128,8,4096,3072,32,128,128,16,8,3,2087.2083333333335,3
w13,512,128,8,4096,3072,64,128,128,1,8,4,2088.979,3
w13,512,128,8,4096,3072,64,128,128,4,8,4,2089.0856666666664,3
w13,1024,8,2,1024,512,128,128,64,4,8,3,11.618,3
w13,1024,16,2,1536,768,64,128,64,4,4,3,34.221333333333334,3
w13,1024,16,2,1536,768,64,128,64,4,8,3,34.26333333333333,3
w13,1024,16,2,1536,768,64,128,64,32,4,3,34.189,3
w13,1024,16,2,1536,768,64,128,64,32,8,3,34.199666666666666,3
w13,1024,16,2,1536,768,64,128,64,64,4,3,34.27433333333334,3
w13,1024,16,2,1536,768,128,64,64,1,8,3,34.242333333333335,3
w13,1024,16,4,1536,1024,128,256,64,16,8,4,53.964666666666666,3
w13,1024,32,4,2048,768,128,64,64,1,8,3,81.11200000000001,3
w13,1024,32,6,3072,1024,128,256,64,16,8,4,177.80566666666667,3
w13,1024,60,4,2048,1408,128,128,64,1,8,3,246.05166666666665,3
w13,1024,60,4,2048,1408,128,128,64,4,8,3,246.09433333333334,3
w13,1024,60,4,2048,1408,128,128,64,8,8,3,246.28633333333335,3
w13,1024,60,6,3584,2304,128,128,64,1,8,5,697.2019999999999,3
w13,1024,60,6,3584,2304,128,256,64,1,8,4,694.9833333333332,3
w13,1024,60,8,2048,1536,128,256,64,16,8,4,329.84933333333333,3
w13,1024,60,8,2048,1536,128,256,64,32,8,4,331.2253333333333,3
w13,1024,64,6,3072,2048,128,128,64,1,8,3,565.585,3
w13,1024,64,6,3072,2048,128,128,64,4,8,3,564.5186666666667,3
w13,1024,64,6,3072,2048,128,128,64,8,8,3,566.7473333333334,3
w13,1024,64,6,3584,1536,128,128,64,1,8,3,490.3093333333333,3
w13,1024,64,6,3584,1536,128,128,64,4,8,3,490.5973333333333,3
w13,1024,64,8,3584,2560,128,128,64,1,8,3,828.0616666666666,3
w13,1024,64,8,3584,2560,128,128,64,4,8,3,830.9416666666666,3
w13,1024,64,8,3584,2560,128,128,64,8,8,3,831.8913333333334,3
w13,1024,128,4,2048,512,32,64,128,4,8,2,182.55266666666668,3
w13,1024,128,4,2048,512,32,128,128,1,8,3,182.585,3
w13,1024,128,4,2048,512,32,128,128,8,4,2,182.53133333333335,3
w13,1024,128,4,2048,512,32,128,128,16,4,2,182.9896666666667,3
w13,1024,128,4,2048,512,32,128,128,32,8,3,182.91600000000003,3
w13,1024,128,4,2048,512,64,64,64,4,4,3,182.13633333333334,3
w13,1024,128,4,2048,512,64,128,128,4,8,2,182.87266666666665,3
w13,1024,128,6,4096,2048,64,128,128,1,4,2,1410.5836666666667,3
w13,1024,128,6,4096,2048,64,128,128,1,8,2,1411.3836666666666,3
w13,1024,128,6,4096,2048,64,128,128,1,8,3,1417.5063333333335,3
w13,1024,128,6,4096,2048,64,128,128,1,8,4,1416.013,3
w13,1024,128,6,4096,2048,64,128,128,4,4,2,1414.7443333333333,3
w13,1024,128,6,4096,2048,64,128,128,4,8,2,1414.0076666666666,3
w13,1024,128,6,4096,2048,64,128,128,4,8,4,1414.0396666666666,3
w13,1024,128,8,2048,768,64,64,64,1,4,3,278.489,3
w13,1024,128,8,2048,768,64,64,64,4,4,3,279.08666666666664,3
w13,1024,128,8,2048,768,64,128,64,1,4,3,278.4786666666667,3
w13,1024,128,8,2048,768,64,128,64,1,8,3,278.74566666666664,3
w13,1024,128,8,2048,768,64,128,64,4,4,3,278.4463333333333,3
w13,1024,128,8,2048,768,64,128,64,4,8,3,278.47833333333335,3
w13,1024,128,8,2048,768,64,128,64,32,4,3,279.16066666666666,3
w13,1024,128,8,2048,768,64,128,128,1,4,2,279.14000000000004,3
w13,1024,128,8,2048,768,64,128,128,1,8,2,277.8066666666667,3
w13,1024,128,8,2048,768,64,128,128,4,8,2,278.5213333333333,3
w13,1024,128,8,2048,768,64,128,128,16,8,2,278.8516666666667,3
w13,1024,128,8,2048,768,64,128,128,32,8,2,278.27566666666667,3
w13,1024,128,8,4096,1536,64,128,128,1,4,2,1061.3963333333334,3
w13,1024,128,8,4096,1536,64,128,128,1,8,2,1062.7086666666667,3
w13,1024,128,8,4096,1536,64,128,128,4,4,2,1064.1696666666667,3
w13,1024,128,8,4096,1536,64,128,128,32,8,2,1065.1936666666668,3
w13,1024,128,8,4096,3072,64,128,128,1,4,2,2133.6936666666666,3
w13,1024,128,8,4096,3072,64,128,128,1,4,4,2143.1336666666666,3
w13,1024,128,8,4096,3072,64,128,128,1,8,2,2135.837666666667,3
w13,1024,128,8,4096,3072,64,128,128,1,8,3,2137.021666666667,3
w13,1024,128,8,4096,3072,64,128,128,1,8,4,2135.3259999999996,3
w13,1024,128,8,4096,3072,64,128,128,4,4,4,2142.8133333333335,3
w13,1024,128,8,4096,3072,64,128,128,4,8,4,2137.032333333333,3
w13,1024,128,8,4096,3072,64,128,128,16,4,2,2133.565666666667,3
w13,1024,128,8,4096,3072,64,128,128,16,4,3,2142.4083333333333,3
w13,1024,128,8,4096,3072,64,128,128,16,8,2,2135.3153333333335,3
w13,1024,128,8,4096,3072,64,128,128,16,8,3,2133.181666666667,3
w13,1024,128,8,4096,3072,64,128,128,16,8,4,2140.883,3
w13,1024,128,8,4096,3072,64,128,128,32,4,2,2136.072333333333,3
w13,1024,128,8,4096,3072,64,128,128,32,8,2,2138.7816666666668,3
w13,1536,8,2,1024,512,64,128,64,16,4,3,16.258,3
w13,1536,8,2,1024,512,64,128,64,32,4,3,16.29,3
w13,1536,8,2,1024,512,64,128,64,64,4,3,16.311333333333334,3
w13,1536,16,2,1536,768,64,128,64,4,8,3,45.44233333333333,3
w13,1536,16,4,1536,1024,128,256,64,64,8,4,73.50699999999999,3
w13,1536,32,4,2048,768,128,256,64,1,8,4,97.45333333333333,3
w13,1536,32,4,2048,768,128,256,64,16,8,4,97.76299999999999,3
w13,1536,32,6,3072,1024,128,256,64,1,8,4,243.85433333333333,3
w13,1536,60,4,2048,1408,128,128,64,1,8,3,254.18999999999997,3
w13,1536,60,4,2048,1408,128,128,64,4,8,3,254.40366666666668,3
w13,1536,60,4,2048,1408,128,128,64,8,8,3,254.71333333333334,3
w13,1536,60,6,3584,2304,128,256,64,16,8,4,831.123,3
w13,1536,60,8,2048,1536,128,256,64,16,8,4,345.6583333333333,3
w13,1536,60,8,2048,1536,128,256,64,32,8,4,347.0233333333333,3
w13,1536,64,6,3072,2048,128,256,64,16,8,4,681.2123333333334,3
w13,1536,64,6,3584,1536,128,256,64,16,8,4,591.174,3
w13,1536,64,6,3584,1536,128,256,64,32,8,4,594.1073333333334,3
w13,1536,64,8,3584,2560,128,256,64,16,8,4,1000.4046666666667,3
w13,1536,128,4,2048,512,64,64,64,1,4,3,185.94466666666668,3
w13,1536,128,4,2048,512,64,64,64,1,8,3,186.649,3
w13,1536,128,4,2048,512,64,64,64,4,4,3,185.90200000000002,3
w13,1536,128,4,2048,512,64,64,64,4,8,3,186.52066666666667,3
w13,1536,128,4,2048,512,64,64,64,16,4,3,185.89133333333334,3
w13,1536,128,4,2048,512,64,128,128,1,8,2,185.93433333333334,3
w13,1536,128,4,2048,512,64,128,128,4,8,2,186.5523333333333,3
w13,1536,128,4,2048,512,64,128,128,16,8,2,186.26466666666667,3
w13,1536,128,6,4096,2048,128,128,64,1,8,5,1457.677,3
w13,1536,128,8,2048,768,128,128,64,1,8,3,292.43066666666664,3
w13,1536,128,8,2048,768,128,128,64,4,8,3,292.30266666666665,3
w13,1536,128,8,2048,768,128,128,64,8,8,3,293.16633333333334,3
w13,1536,128,8,4096,1536,128,128,64,1,8,3,1110.9856666666667,3
w13,1536,128,8,4096,1536,128,128,64,1,8,5,1111.9563333333333,3
w13,1536,128,8,4096,1536,128,128,64,4,8,5,1115.2633333333333,3
w13,1536,128,8,4096,1536,128,128,64,8,8,5,1113.983,3
w13,1536,128,8,4096,3072,128,128,64,1,4,5,2216.03,3
w13,1536,128,8,4096,3072,128,128,64,1,8,5,2208.9256666666665,3
w13,1536,128,8,4096,3072,128,128,64,4,8,5,2215.4323333333336,3
w13,1536,128,8,4096,3072,128,128,64,8,4,5,2207.656333333334,3
w13,1536,128,8,4096,3072,128,128,64,8,8,5,2205.800333333333,3
w13,1536,128,8,4096,3072,128,128,64,16,4,5,2209.8323333333333,3
w13,1536,128,8,4096,3072,128,128,64,16,8,5,2209.192333333333,3
w13,2048,8,2,1024,512,128,256,64,1,8,3,17.591333333333335,3
w13,2048,8,2,1024,512,128,256,64,16,8,3,17.634333333333334,3
w13,2048,8,2,1024,512,128,256,64,32,8,3,17.666,3
w13,2048,8,2,1024,512,128,256,64,64,8,3,17.655666666666665,3
w13,2048,16,2,1536,768,128,128,64,8,8,5,47.811,3
w13,2048,16,4,1536,1024,128,256,64,16,8,4,94.43466666666666,3
w13,2048,16,4,1536,1024,128,256,64,32,8,4,94.31700000000001,3
w13,2048,32,4,2048,768,128,256,64,16,8,4,100.13066666666667,3
w13,2048,32,6,3072,1024,128,256,64,16,8,4,252.857,3
w13,2048,32,6,3072,1024,128,256,64,32,8,4,253.85933333333332,3
w13,2048,60,4,2048,1408,128,256,64,1,8,4,300.2606666666667,3
w13,2048,60,6,3584,2304,128,256,64,16,8,4,856.9369999999999,3
w13,2048,60,8,2048,1536,128,256,64,32,8,4,470.29833333333335,3
w13,2048,64,6,3072,2048,128,256,64,16,8,4,702.0123333333335,3
w13,2048,64,6,3584,1536,128,256,64,16,8,4,606.641,3
w13,2048,64,8,3584,2560,128,256,64,16,8,4,1025.1086666666667,3
w13,2048,128,4,2048,512,64,64,64,1,4,3,188.899,3
w13,2048,128,4,2048,512,64,64,64,4,4,3,188.69666666666663,3
w13,2048,128,4,2048,512,64,128,128,1,8,2,188.8456666666667,3
w13,2048,128,4,2048,512,64,128,128,4,8,2,188.37633333333335,3
w13,2048,128,6,4096,2048,128,128,64,1,8,5,1471.789,3
w13,2048,128,8,2048,768,128,128,64,1,8,3,299.4173333333333,3
w13,2048,128,8,2048,768,128,128,64,4,8,3,299.32099999999997,3
w13,2048,128,8,2048,768,128,128,64,8,8,3,300.569,3
w13,2048,128,8,4096,1536,128,128,64,1,4,3,1134.5056666666667,3
w13,2048,128,8,4096,1536,128,128,64,1,4,5,1134.8790000000001,3
w13,2048,128,8,4096,1536,128,128,64,1,8,3,1131.9669999999999,3
w13,2048,128,8,4096,1536,128,128,64,1,8,5,1131.2520000000002,3
w13,2048,128,8,4096,1536,128,128,64,4,8,5,1133.279,3
w13,2048,128,8,4096,1536,128,128,64,8,8,5,1131.7430000000002,3
w13,2048,128,8,4096,1536,128,256,64,1,8,3,1129.2366666666667,3
w13,2048,128,8,4096,3072,128,128,64,1,8,5,2230.462,3
w13,2048,128,8,4096,3072,128,128,64,4,8,5,2237.117333333333,3
w13,2048,128,8,4096,3072,128,128,64,8,8,5,2231.5066666666667,3
w13,3072,8,2,1024,512,128,128,64,16,8,3,29.55966666666667,3
w13,3072,8,2,1024,512,128,128,64,64,8,3,29.570000000000004,3
w13,3072,16,2,1536,768,128,128,64,16,8,3,69.93366666666667,3
w13,3072,16,4,1536,1024,128,256,64,32,8,4,137.20833333333334,3
w13,3072,16,4,1536,1024,128,256,64,64,8,4,137.688,3
w13,3072,32,4,2048,768,128,256,64,16,8,4,149.667,3
w13,3072,32,4,2048,768,128,256,64,32,8,4,149.859,3
w13,3072,32,6,3072,1024,128,256,64,1,8,4,399.2266666666667,3
w13,3072,32,6,3072,1024,128,256,64,32,8,4,399.84499999999997,3
w13,3072,32,6,3072,1024,128,256,64,64,8,4,398.9703333333334,3
w13,3072,60,4,2048,1408,128,256,64,1,8,4,313.81766666666664,3
w13,3072,60,6,3584,2304,128,256,64,16,8,4,1186.2516666666668,3
w13,3072,60,6,3584,2304,128,256,64,32,8,4,1182.23,3
w13,3072,60,6,3584,2304,128,256,64,64,8,4,1186.5183333333332,3
w13,3072,60,8,2048,1536,128,256,64,16,8,4,605.574,3
w13,3072,60,8,2048,1536,128,256,64,32,8,4,607.91,3
w13,3072,60,8,2048,1536,128,256,64,64,8,4,607.8673333333332,3
w13,3072,64,6,3072,2048,128,256,64,16,8,4,971.6576666666666,3
w13,3072,64,6,3072,2048,128,256,64,32,8,4,967.583,3
w13,3072,64,6,3584,1536,128,256,64,16,8,4,841.5866666666667,3
w13,3072,64,6,3584,1536,128,256,64,32,8,4,838.035,3
w13,3072,64,6,3584,1536,128,256,64,64,8,4,841.245,3
w13,3072,64,8,3584,2560,128,256,64,32,8,4,1446.0183333333334,3
w13,3072,64,8,3584,2560,128,256,64,64,8,4,1449.933,3
w13,3072,128,4,2048,512,128,128,64,1,8,3,199.71533333333332,3
w13,3072,128,4,2048,512,128,128,64,4,8,3,199.27766666666665,3
w13,3072,128,6,4096,2048,128,256,64,16,8,4,1740.9963333333333,3
w13,3072,128,8,2048,768,128,256,64,1,8,4,362.98,3
w13,3072,128,8,4096,1536,128,256,64,16,8,4,1343.0829999999999,3
w13,3072,128,8,4096,3072,128,256,64,16,8,4,2632.842666666667,3
w13,4096,8,2,1024,512,128,256,64,1,8,4,34.53066666666667,3
w13,4096,8,2,1024,512,128,256,64,16,8,4,34.48733333333333,3
w13,4096,8,2,1024,512,128,256,64,32,8,4,34.583333333333336,3
w13,4096,8,2,1024,512,128,256,64,64,8,3,34.44466666666667,3
w13,4096,16,2,1536,768,128,256,64,16,8,4,70.072,3
w13,4096,16,4,1536,1024,128,256,64,1,8,3,178.67,3
w13,4096,16,4,1536,1024,128,256,64,16,8,3,178.211,3
w13,4096,16,4,1536,1024,128,256,64,16,8,4,178.947,3
w13,4096,16,4,1536,1024,128,256,64,32,8,3,179.0856666666667,3
w13,4096,32,4,2048,768,128,256,64,16,8,4,174.50966666666667,3
w13,4096,32,6,3072,1024,128,256,64,16,8,4,482.63966666666664,3
w13,4096,32,6,3072,1024,128,256,64,32,8,4,482.4693333333333,3
w13,4096,32,6,3072,1024,128,256,64,64,8,4,481.71233333333333,3
w13,4096,60,4,2048,1408,128,256,64,1,8,4,416.2716666666667,3
w13,4096,60,6,3584,2304,128,256,64,16,8,4,1516.4723333333334,3
w13,4096,60,6,3584,2304,128,256,64,32,8,4,1520.7396666666666,3
w13,4096,60,8,2048,1536,128,256,64,16,8,4,768.7003333333333,3
w13,4096,60,8,2048,1536,128,256,64,32,8,4,766.375,3
w13,4096,60,8,2048,1536,128,256,64,64,8,4,764.9456666666666,3
w13,4096,64,6,3072,2048,128,256,64,16,8,4,1009.2576666666668,3
w13,4096,64,6,3072,2048,128,256,64,32,8,4,1005.9723333333333,3
w13,4096,64,6,3584,1536,128,256,64,16,8,4,875.0803333333333,3
w13,4096,64,6,3584,1536,128,256,64,32,8,4,872.1043333333333,3
w13,4096,64,8,3584,2560,128,256,64,16,8,4,1839.4620000000002,3
w13,4096,64,8,3584,2560,128,256,64,32,8,4,1835.493333333333,3
w13,4096,64,8,3584,2560,128,256,64,64,8,4,1843.493333333333,3
w13,4096,128,4,2048,512,128,128,64,1,8,3,206.542,3
w13,4096,128,4,2048,512,128,128,64,4,8,3,205.91233333333332,3
w13,4096,128,4,2048,512,128,128,64,8,8,3,206.052,3
w13,4096,128,6,4096,2048,128,256,64,16,8,4,1787.2793333333332,3
w13,4096,128,8,2048,768,128,256,64,16,8,4,377.6686666666667,3
w13,4096,128,8,4096,1536,128,256,64,16,8,4,1382.1866666666665,3
w13,4096,128,8,4096,1536,128,256,64,32,8,4,1383.8083333333334,3
w13,4096,128,8,4096,3072,128,256,64,16,8,4,2711.0406666666668,3
