pipetuning_test/moe_dse/moe_dse_L40_99.csv
weight_type,M,E,topk,H,N,BLOCK_SIZE_M,BLOCK_SIZE_N,BLOCK_SIZE_K,GROUP_SIZE_M,num_warps,num_stages,avg_duration,sample_count
w13,1,8,2,1024,512,16,32,128,1,4,3,3.6183333333333336,3
w13,1,8,2,1024,512,16,32,128,1,4,4,3.6286666666666663,3
w13,1,8,2,1024,512,16,32,128,4,4,3,3.6286666666666663,3
w13,1,8,2,1024,512,16,32,128,16,4,3,3.65,3
w13,1,8,2,1024,512,16,32,128,16,4,4,3.6496666666666666,3
w13,1,8,2,1024,512,16,32,128,32,4,3,3.65,3
w13,1,8,2,1024,512,16,32,128,32,4,4,3.639333333333333,3
w13,1,8,2,1024,512,16,32,128,64,4,3,3.6286666666666663,3
w13,1,8,2,1024,512,16,32,128,64,4,4,3.65,3
w13,1,16,2,1536,768,16,32,128,1,4,4,4.706,3
w13,1,16,2,1536,768,16,32,128,16,4,4,4.748666666666667,3
w13,1,16,2,1536,768,16,32,128,32,4,4,4.727333333333333,3
w13,1,16,2,1536,768,16,32,128,64,4,4,4.738,3
w13,1,16,4,1536,1024,16,64,64,1,4,4,7.820666666666667,3
w13,1,16,4,1536,1024,16,64,64,16,4,4,7.873666666666666,3
w13,1,32,4,2048,768,16,64,128,1,4,4,8.247333333333334,3
w13,1,32,4,2048,768,16,64,128,16,4,4,8.301,3
w13,1,32,4,2048,768,16,64,128,32,4,4,8.300666666666666,3
w13,1,32,6,3072,1024,16,128,64,1,8,4,18.423333333333336,3
w13,1,32,6,3072,1024,16,128,64,16,8,4,18.391666666666666,3
w13,1,32,6,3072,1024,16,128,64,32,8,4,18.413,3
w13,1,32,6,3072,1024,16,128,64,64,8,4,18.434,3
w13,1,60,4,2048,1408,16,128,64,1,8,3,12.695333333333332,3
w13,1,60,4,2048,1408,16,128,64,1,8,4,12.642333333333333,3
w13,1,60,6,3584,2304,16,32,256,1,4,2,262.0843333333333,3
w13,1,60,6,3584,2304,16,32,256,16,4,2,261.83833333333337,3
w13,1,60,6,3584,2304,16,64,256,1,4,2,263.375,3
w13,1,60,6,3584,2304,32,32,128,1,4,2,262.3933333333333,3
w13,1,60,6,3584,2304,64,32,128,16,4,2,260.79333333333335,3
w13,1,60,8,2048,1536,16,32,128,4,4,2,36.205333333333336,3
w13,1,60,8,2048,1536,16,32,128,4,4,3,36.37533333333334,3
w13,1,60,8,2048,1536,16,64,256,16,8,2,36.044666666666664,3
w13,1,64,6,3072,2048,16,32,128,4,4,2,190.43533333333335,3
w13,1,64,6,3072,2048,16,32,128,16,4,2,190.09400000000002,3
w13,1,64,6,3072,2048,16,32,128,32,4,2,190.56300000000002,3
w13,1,64,6,3072,2048,16,32,128,64,4,2,190.6163333333333,3
w13,1,64,6,3072,2048,16,32,256,16,4,2,190.553,3
w13,1,64,6,3072,2048,16,64,128,1,8,2,190.755,3
w13,1,64,6,3072,2048,16,64,128,16,4,2,190.68033333333335,3
w13,1,64,6,3072,2048,16,64,128,16,8,2,190.64833333333334,3
w13,1,64,6,3072,2048,16,64,128,32,4,2,190.26433333333333,3
w13,1,64,6,3072,2048,16,64,128,32,8,2,190.87233333333333,3
w13,1,64,6,3072,2048,16,64,128,64,4,2,190.275,3
w13,1,64,6,3072,2048,16,64,128,64,8,2,190.45633333333333,3
w13,1,64,6,3072,2048,16,64,256,16,4,2,191.16033333333334,3
w13,1,64,6,3072,2048,32,64,128,1,8,2,191.64066666666668,3
w13,1,64,6,3072,2048,32,64,128,4,4,2,191.81133333333332,3
w13,1,64,6,3072,2048,32,64,128,4,8,2,191.63,3
w13,1,64,6,3072,2048,32,64,128,16,4,2,191.55499999999998,3
w13,1,64,6,3072,2048,32,64,128,16,8,2,191.37366666666665,3
w13,1,64,6,3072,2048,32,64,128,32,4,2,191.16033333333334,3
w13,1,64,6,3072,2048,32,64,128,64,4,2,191.60866666666666,3
w13,1,64,6,3072,2048,64,32,128,16,4,2,191.30966666666666,3
w13,1,64,6,3584,1536,16,32,64,1,4,2,148.59966666666665,3
w13,1,64,8,3584,2560,16,16,256,1,4,3,397.2633333333333,3
w13,1,64,8,3584,2560,16,16,256,1,8,3,399.8343333333333,3
w13,1,64,8,3584,2560,16,16,256,4,4,3,396.549,3
w13,1,64,8,3584,2560,16,16,256,4,4,4,399.95166666666665,3
w13,1,64,8,3584,2560,16,16,256,4,8,3,399.46066666666667,3
w13,1,64,8,3584,2560,16,32,256,1,4,2,399.3856666666666,3
w13,1,64,8,3584,2560,16,32,256,1,4,4,400.5063333333333,3
w13,1,64,8,3584,2560,16,32,256,16,4,2,398.703,3
w13,1,64,8,3584,2560,16,32,256,32,4,4,400.2713333333333,3
w13,1,64,8,3584,2560,16,64,128,16,4,2,400.549,3
w13,1,64,8,3584,2560,16,64,256,1,4,2,400.1116666666667,3
w13,1,64,8,3584,2560,16,64,256,16,4,2,399.85533333333336,3
w13,1,64,8,3584,2560,32,32,256,1,4,3,398.39433333333335,3
w13,1,64,8,3584,2560,32,32,256,1,8,3,399.237,3
w13,1,64,8,3584,2560,32,32,256,4,4,3,398.37266666666665,3
w13,1,64,8,3584,2560,32,32,256,4,8,3,397.96733333333333,3
w13,1,64,8,3584,2560,32,32,256,16,4,3,398.94866666666667,3
w13,1,64,8,3584,2560,32,32,256,16,8,3,397.98900000000003,3
w13,1,64,8,3584,2560,32,32,256,32,4,3,398.71433333333334,3
w13,1,64,8,3584,2560,32,32,256,32,8,3,398.9166666666667,3
w13,1,128,4,2048,512,16,32,128,16,4,4,6.274,3
w13,1,128,4,2048,512,16,32,128,32,4,4,6.2956666666666665,3
w13,1,128,6,4096,2048,16,32,128,4,4,2,269.667,3
w13,1,128,6,4096,2048,16,32,128,16,4,2,268.568,3
w13,1,128,6,4096,2048,16,32,128,32,4,2,269.2083333333333,3
w13,1,128,6,4096,2048,16,32,128,64,4,2,269.1546666666666,3
w13,1,128,6,4096,2048,16,32,256,1,4,2,269.176,3
w13,1,128,6,4096,2048,16,32,256,16,4,2,269.00533333333334,3
w13,1,128,6,4096,2048,16,64,128,1,8,2,269.17633333333333,3
w13,1,128,6,4096,2048,16,64,128,16,4,2,269.38966666666664,3
w13,1,128,6,4096,2048,16,64,128,16,8,2,269.27233333333334,3
w13,1,128,6,4096,2048,16,64,128,32,4,2,269.00533333333334,3
w13,1,128,6,4096,2048,16,64,128,32,8,2,269.283,3
w13,1,128,6,4096,2048,16,64,128,64,4,2,268.89866666666666,3
w13,1,128,6,4096,2048,16,64,128,64,8,2,269.272,3
w13,1,128,6,4096,2048,32,32,256,1,4,2,268.6963333333333,3
w13,1,128,6,4096,2048,32,32,256,16,4,2,269.08033333333333,3
w13,1,128,6,4096,2048,32,64,128,1,4,2,269.4963333333333,3
w13,1,128,6,4096,2048,64,32,256,1,4,2,267.02133333333336,3
w13,1,128,8,2048,768,16,128,64,1,8,4,12.759333333333332,3
w13,1,128,8,4096,1536,16,32,128,32,4,2,268.996,3
w13,1,128,8,4096,1536,16,32,128,64,4,2,269.1236666666667,3
w13,1,128,8,4096,1536,16,32,256,1,4,2,269.72066666666666,3
w13,1,128,8,4096,1536,16,32,256,16,4,2,268.1206666666667,3
w13,1,128,8,4096,1536,16,64,128,1,8,2,269.028,3
w13,1,128,8,4096,1536,16,64,128,16,4,2,269.3906666666667,3
w13,1,128,8,4096,1536,16,64,128,16,8,2,269.625,3
w13,1,128,8,4096,1536,16,64,128,32,4,2,269.5076666666667,3
w13,1,128,8,4096,1536,16,64,128,32,8,2,269.561,3
w13,1,128,8,4096,1536,16,64,128,64,4,2,269.4436666666667,3
w13,1,128,8,4096,1536,16,64,128,64,8,2,269.4543333333333,3
w13,1,128,8,4096,1536,16,64,256,1,4,2,269.497,3
w13,1,128,8,4096,1536,16,64,256,16,4,2,267.9506666666667,3
w13,1,128,8,4096,1536,16,128,128,1,8,2,269.47566666666665,3
w13,1,128,8,4096,1536,16,128,128,16,8,2,269.97700000000003,3
w13,1,128,8,4096,1536,16,128,128,32,8,2,269.7426666666667,3
w13,1,128,8,4096,1536,16,128,128,64,8,2,269.7956666666667,3
w13,1,128,8,4096,1536,32,32,256,1,4,2,267.6306666666667,3
w13,1,128,8,4096,1536,32,64,128,1,4,2,269.4646666666667,3
w13,1,128,8,4096,1536,32,64,128,1,8,2,269.23033333333336,3
w13,1,128,8,4096,1536,32,64,128,4,4,2,269.6036666666667,3
w13,1,128,8,4096,1536,32,64,128,4,8,2,269.6356666666667,3
w13,1,128,8,4096,1536,64,32,128,16,4,2,269.838,3
w13,1,128,8,4096,1536,64,32,256,1,4,2,267.40633333333335,3
w13,1,128,8,4096,3072,16,16,256,1,4,3,544.369,3
w13,1,128,8,4096,3072,16,16,256,1,4,4,546.545,3
w13,1,128,8,4096,3072,16,16,256,1,8,4,548.198,3
w13,1,128,8,4096,3072,16,16,256,4,4,3,543.1846666666667,3
w13,1,128,8,4096,3072,16,16,256,4,4,4,546.2570000000001,3
w13,1,128,8,4096,3072,16,16,256,4,8,3,546.2676666666666,3
w13,1,128,8,4096,3072,16,16,256,4,8,4,547.3663333333334,3
w13,1,128,8,4096,3072,16,32,256,1,4,3,547.0676666666667,3
w13,1,128,8,4096,3072,16,32,256,1,4,4,546.2673333333333,3
w13,1,128,8,4096,3072,16,32,256,1,8,3,547.4086666666667,3
w13,1,128,8,4096,3072,16,32,256,1,8,4,546.8863333333334,3
w13,1,128,8,4096,3072,16,32,256,16,4,3,546.5236666666666,3
w13,1,128,8,4096,3072,16,32,256,16,4,4,546.652,3
w13,1,128,8,4096,3072,16,32,256,16,8,3,547.1106666666666,3
w13,1,128,8,4096,3072,16,32,256,16,8,4,547.0783333333334,3
w13,1,128,8,4096,3072,16,32,256,32,4,3,546.5663333333333,3
w13,1,128,8,4096,3072,16,32,256,32,4,4,546.6943333333334,3
w13,1,128,8,4096,3072,16,32,256,32,8,3,546.9073333333333,3
w13,1,128,8,4096,3072,16,32,256,32,8,4,547.2063333333334,3
w13,1,128,8,4096,3072,16,32,256,64,4,3,546.203,3
w13,1,128,8,4096,3072,16,32,256,64,4,4,546.5766666666667,3
w13,1,128,8,4096,3072,16,32,256,64,8,3,546.7579999999999,3
w13,1,128,8,4096,3072,16,32,256,64,8,4,547.0889999999999,3
w13,1,128,8,4096,3072,16,64,256,16,8,3,548.5500000000001,3
w13,1,128,8,4096,3072,16,64,256,64,8,3,548.6463333333332,3
w13,1,128,8,4096,3072,32,32,256,1,4,3,544.998,3
w13,1,128,8,4096,3072,32,32,256,1,4,4,547.4833333333333,3
w13,1,128,8,4096,3072,32,32,256,1,8,3,545.4780000000001,3
w13,1,128,8,4096,3072,32,32,256,1,8,4,547.324,3
w13,1,128,8,4096,3072,32,32,256,4,4,3,544.9343333333333,3
w13,1,128,8,4096,3072,32,32,256,4,4,4,547.8573333333334,3
w13,1,128,8,4096,3072,32,32,256,4,8,3,544.4443333333334,3
w13,1,128,8,4096,3072,32,32,256,4,8,4,548.1343333333333,3
w13,1,128,8,4096,3072,32,32,256,16,4,3,545.243,3
w13,1,128,8,4096,3072,32,32,256,16,4,4,547.793,3
w13,1,128,8,4096,3072,32,32,256,16,8,3,544.561,3
w13,1,128,8,4096,3072,32,32,256,16,8,4,547.1426666666666,3
w13,1,128,8,4096,3072,32,32,256,32,4,3,545.0513333333333,3
w13,1,128,8,4096,3072,32,32,256,32,4,4,548.3793333333333,3
w13,1,128,8,4096,3072,32,32,256,32,8,3,544.6783333333333,3
w13,1,128,8,4096,3072,32,32,256,32,8,4,547.3666666666667,3
w13,2,8,2,1024,512,16,32,128,1,4,4,3.9593333333333334,3
w13,2,16,2,1536,768,16,32,64,16,4,4,6.860666666666667,3
w13,2,16,2,1536,768,16,32,64,64,4,4,6.828666666666666,3
w13,2,16,2,1536,768,16,32,128,1,4,3,6.8180000000000005,3
w13,2,16,2,1536,768,16,32,128,1,4,4,6.839333333333333,3
w13,2,16,2,1536,768,16,32,128,4,4,3,6.839333333333333,3
w13,2,16,2,1536,768,16,32,128,4,4,4,6.828666666666666,3
w13,2,16,2,1536,768,16,32,128,32,4,3,6.860666666666667,3
w13,2,16,2,1536,768,16,32,128,32,4,4,6.8180000000000005,3
w13,2,16,2,1536,768,16,32,128,64,4,3,6.8183333333333325,3
w13,2,16,2,1536,768,16,64,64,1,4,4,6.797,3
w13,2,16,2,1536,768,16,64,64,16,4,4,6.861,3
w13,2,16,2,1536,768,16,64,64,32,4,4,6.807333333333332,3
w13,2,16,2,1536,768,16,64,128,1,4,3,6.860666666666667,3
w13,2,16,2,1536,768,16,64,128,1,4,4,6.860666666666667,3
w13,2,16,4,1536,1024,16,128,32,1,8,4,12.258000000000001,3
w13,2,16,4,1536,1024,16,128,64,1,8,4,12.204666666666668,3
w13,2,32,4,2048,768,16,128,64,1,8,3,12.652666666666667,3
w13,2,32,4,2048,768,16,128,64,1,8,4,12.631333333333332,3
w13,2,32,6,3072,1024,16,32,128,4,4,2,190.04,3
w13,2,32,6,3072,1024,16,32,256,16,4,2,190.48799999999997,3
w13,2,32,6,3072,1024,16,64,128,1,8,2,189.95466666666667,3
w13,2,32,6,3072,1024,16,64,128,16,4,2,189.24033333333333,3
w13,2,32,6,3072,1024,16,64,128,32,4,2,190.26433333333333,3
w13,2,32,6,3072,1024,16,64,128,64,4,2,189.9126666666667,3
w13,2,32,6,3072,1024,16,64,256,16,4,2,190.58433333333332,3
w13,2,32,6,3072,1024,32,64,128,4,4,2,190.51999999999998,3
w13,2,60,4,2048,1408,16,64,32,1,4,4,20.27933333333333,3
w13,2,60,4,2048,1408,16,64,64,1,4,4,20.343333333333334,3
w13,2,60,6,3584,2304,16,16,256,1,4,3,535.558,3
w13,2,60,6,3584,2304,16,16,256,1,4,4,540.0383333333333,3
w13,2,60,6,3584,2304,16,16,256,1,8,3,539.569,3
w13,2,60,6,3584,2304,16,16,256,4,4,3,534.6516666666666,3
w13,2,60,6,3584,2304,16,16,256,4,4,4,539.121,3
w13,2,60,6,3584,2304,16,16,256,4,8,3,537.9263333333333,3
w13,2,60,6,3584,2304,16,32,256,1,4,4,538.7579999999999,3
w13,2,60,6,3584,2304,16,32,256,16,4,4,539.5263333333334,3
w13,2,60,6,3584,2304,16,32,256,32,4,4,539.11,3
w13,2,60,6,3584,2304,16,32,256,64,4,4,539.0893333333333,3
w13,2,60,6,3584,2304,32,32,256,1,4,3,537.3393333333333,3
w13,2,60,6,3584,2304,32,32,256,1,8,3,537.308,3
w13,2,60,6,3584,2304,32,32,256,4,4,3,537.6173333333332,3
w13,2,60,6,3584,2304,32,32,256,4,8,3,537.1583333333333,3
w13,2,60,6,3584,2304,32,32,256,16,4,3,537.5210000000001,3
w13,2,60,6,3584,2304,32,32,256,16,8,3,536.9879999999999,3
w13,2,60,6,3584,2304,32,32,256,32,4,3,536.689,3
w13,2,60,6,3584,2304,32,32,256,32,8,3,536.6036666666668,3
w13,2,60,8,2048,1536,16,32,256,1,4,2,265.5496666666667,3
w13,2,60,8,2048,1536,16,32,256,16,4,2,265.14466666666664,3
w13,2,60,8,2048,1536,16,64,256,1,4,2,265.752,3
w13,2,60,8,2048,1536,16,64,256,16,4,2,264.899,3
w13,2,60,8,2048,1536,32,32,256,1,4,2,265.97566666666665,3
w13,2,60,8,2048,1536,64,32,256,1,4,2,266.435,3
w13,2,64,6,3072,2048,16,16,256,1,4,3,408.2823333333333,3
w13,2,64,6,3072,2048,16,16,256,4,4,3,406.78866666666664,3
w13,2,64,6,3072,2048,16,16,256,4,8,3,410.1483333333333,3
w13,2,64,6,3072,2048,16,32,256,1,4,2,409.69,3
w13,2,64,6,3072,2048,16,32,256,16,4,2,409.7536666666667,3
w13,2,64,6,3072,2048,16,64,256,1,4,2,410.2873333333334,3
w13,2,64,6,3072,2048,16,64,256,16,4,2,410.86366666666663,3
w13,2,64,6,3072,2048,32,32,256,1,4,2,410.59666666666664,3
w13,2,64,6,3072,2048,32,32,256,1,4,3,408.559,3
w13,2,64,6,3072,2048,32,32,256,1,8,3,408.50600000000003,3
w13,2,64,6,3072,2048,32,32,256,4,4,3,409.12433333333337,3
w13,2,64,6,3072,2048,32,32,256,4,8,3,408.60200000000003,3
w13,2,64,6,3072,2048,32,32,256,16,4,3,409.13533333333334,3
w13,2,64,6,3072,2048,32,32,256,16,8,3,408.9003333333333,3
w13,2,64,6,3072,2048,32,32,256,32,4,3,409.391,3
w13,2,64,6,3072,2048,32,32,256,32,8,3,408.7833333333333,3
w13,2,64,6,3072,2048,64,32,128,16,4,2,410.73533333333336,3
w13,2,64,6,3584,1536,16,16,256,1,4,3,358.18,3
w13,2,64,6,3584,1536,16,16,256,1,8,3,360.6326666666667,3
w13,2,64,6,3584,1536,16,16,256,4,4,3,357.18800000000005,3
w13,2,64,6,3584,1536,16,16,256,4,8,3,359.491,3
w13,2,64,6,3584,1536,16,32,128,16,4,2,359.41633333333334,3
w13,2,64,6,3584,1536,16,32,256,1,4,2,360.3443333333333,3
w13,2,64,6,3584,1536,16,32,256,16,4,2,359.3633333333334,3
w13,2,64,6,3584,1536,16,64,256,1,4,2,359.32033333333334,3
w13,2,64,6,3584,1536,32,32,256,1,4,2,358.07300000000004,3
w13,2,64,8,3584,2560,16,16,256,1,4,3,788.381,3
w13,2,64,8,3584,2560,16,16,256,1,8,3,792.989,3
w13,2,64,8,3584,2560,16,16,256,4,4,3,787.7193333333333,3
w13,2,64,8,3584,2560,16,16,256,4,4,4,795.5386666666667,3
w13,2,64,8,3584,2560,16,16,256,4,8,3,791.7833333333333,3
w13,2,64,8,3584,2560,16,32,256,1,4,3,794.7276666666667,3
w13,2,64,8,3584,2560,16,32,256,1,8,3,795.6236666666667,3
w13,2,64,8,3584,2560,16,32,256,16,4,3,794.1623333333333,3
w13,2,64,8,3584,2560,16,32,256,16,8,3,795.2503333333334,3
w13,2,64,8,3584,2560,16,32,256,32,4,3,793.9596666666666,3
w13,2,64,8,3584,2560,16,32,256,64,4,3,794.5886666666667,3
w13,2,64,8,3584,2560,32,32,256,1,4,3,790.759,3
w13,2,64,8,3584,2560,32,32,256,1,8,3,791.165,3
w13,2,64,8,3584,2560,32,32,256,4,4,3,790.0450000000001,3
w13,2,64,8,3584,2560,32,32,256,4,8,3,790.0880000000001,3
w13,2,64,8,3584,2560,32,32,256,16,4,3,790.4823333333334,3
w13,2,64,8,3584,2560,32,32,256,16,8,3,789.8846666666667,3
w13,2,64,8,3584,2560,32,32,256,32,4,3,790.9836666666666,3
w13,2,64,8,3584,2560,32,32,256,32,8,3,790.5676666666667,3
w13,2,128,4,2048,512,16,64,64,1,4,4,8.802666666666667,3
w13,2,128,4,2048,512,16,64,64,16,4,4,8.844666666666667,3
w13,2,128,4,2048,512,16,64,64,32,4,4,8.844666666666667,3
w13,2,128,4,2048,512,16,64,64,64,4,4,8.834,3
w13,2,128,6,4096,2048,16,16,256,1,4,3,544.0563333333333,3
w13,2,128,6,4096,2048,16,16,256,1,4,4,546.724,3
w13,2,128,6,4096,2048,16,16,256,4,4,3,543.086,3
w13,2,128,6,4096,2048,16,16,256,4,4,4,545.9879999999999,3
w13,2,128,6,4096,2048,16,16,256,4,8,3,546.8616666666667,3
w13,2,128,6,4096,2048,16,16,256,4,8,4,548.2493333333333,3
w13,2,128,6,4096,2048,16,32,256,1,4,3,548.004,3
w13,2,128,6,4096,2048,16,32,256,1,4,4,546.2323333333333,3
w13,2,128,6,4096,2048,16,32,256,1,8,3,547.7266666666666,3
w13,2,128,6,4096,2048,16,32,256,1,8,4,547.2146666666666,3
w13,2,128,6,4096,2048,16,32,256,16,4,3,546.1260000000001,3
w13,2,128,6,4096,2048,16,32,256,16,4,4,546.82,3
w13,2,128,6,4096,2048,16,32,256,16,8,3,547.0536666666667,3
w13,2,128,6,4096,2048,16,32,256,16,8,4,546.8196666666666,3
w13,2,128,6,4096,2048,16,32,256,32,4,3,546.0093333333333,3
w13,2,128,6,4096,2048,16,32,256,32,4,4,546.499,3
w13,2,128,6,4096,2048,16,32,256,32,8,3,545.9879999999999,3
w13,2,128,6,4096,2048,16,32,256,32,8,4,547.2786666666666,3
w13,2,128,6,4096,2048,16,32,256,64,4,3,546.4883333333333,3
w13,2,128,6,4096,2048,16,32,256,64,4,4,546.2333333333333,3
w13,2,128,6,4096,2048,16,32,256,64,8,3,546.564,3
w13,2,128,6,4096,2048,16,32,256,64,8,4,546.8829999999999,3
w13,2,128,6,4096,2048,32,32,256,1,4,3,544.8566666666667,3
w13,2,128,6,4096,2048,32,32,256,1,4,4,548.0573333333333,3
w13,2,128,6,4096,2048,32,32,256,1,8,3,545.3896666666666,3
w13,2,128,6,4096,2048,32,32,256,1,8,4,547.2776666666667,3
w13,2,128,6,4096,2048,32,32,256,4,4,3,544.9106666666667,3
w13,2,128,6,4096,2048,32,32,256,4,4,4,547.4066666666666,3
w13,2,128,6,4096,2048,32,32,256,4,8,3,544.8883333333333,3
w13,2,128,6,4096,2048,32,32,256,4,8,4,547.236,3
w13,2,128,6,4096,2048,32,32,256,16,4,3,544.964,3
w13,2,128,6,4096,2048,32,32,256,16,4,4,548.1106666666667,3
w13,2,128,6,4096,2048,32,32,256,16,8,3,544.4413333333333,3
w13,2,128,6,4096,2048,32,32,256,16,8,4,547.5443333333333,3
w13,2,128,6,4096,2048,32,32,256,32,4,3,544.8359999999999,3
w13,2,128,6,4096,2048,32,32,256,32,4,4,548.0786666666667,3
w13,2,128,6,4096,2048,32,32,256,32,8,3,544.5043333333333,3
w13,2,128,6,4096,2048,32,32,256,32,8,4,547.0546666666667,3
w13,2,128,8,2048,768,16,32,128,16,8,2,33.20766666666666,3
w13,2,128,8,2048,768,16,32,128,32,8,2,33.27166666666667,3
w13,2,128,8,2048,768,16,32,128,64,8,2,33.431333333333335,3
w13,2,128,8,4096,1536,16,16,256,1,4,3,542.5443333333333,3
w13,2,128,8,4096,1536,16,16,256,1,4,4,546.2456666666667,3
w13,2,128,8,4096,1536,16,16,256,4,4,3,542.598,3
w13,2,128,8,4096,1536,16,16,256,4,4,4,545.8293333333332,3
w13,2,128,8,4096,1536,16,16,256,4,8,3,546.5333333333333,3
w13,2,128,8,4096,1536,16,16,256,4,8,4,547.9843333333333,3
w13,2,128,8,4096,1536,16,32,256,1,4,3,547.782,3
w13,2,128,8,4096,1536,16,32,256,1,4,4,546.3413333333333,3
w13,2,128,8,4096,1536,16,32,256,1,8,4,546.5333333333333,3
w13,2,128,8,4096,1536,16,32,256,16,4,3,546.8426666666667,3
w13,2,128,8,4096,1536,16,32,256,16,4,4,546.459,3
w13,2,128,8,4096,1536,16,32,256,16,8,3,546.374,3
w13,2,128,8,4096,1536,16,32,256,16,8,4,547.2049999999999,3
w13,2,128,8,4096,1536,16,32,256,32,4,3,546.7573333333333,3
w13,2,128,8,4096,1536,16,32,256,32,4,4,546.214,3
w13,2,128,8,4096,1536,16,32,256,32,8,3,546.0216666666666,3
w13,2,128,8,4096,1536,16,32,256,32,8,4,547.4296666666665,3
w13,2,128,8,4096,1536,16,32,256,64,4,3,546.5546666666667,3
w13,2,128,8,4096,1536,16,32,256,64,4,4,546.6076666666667,3
w13,2,128,8,4096,1536,16,32,256,64,8,3,546.469,3
w13,2,128,8,4096,1536,16,32,256,64,8,4,547.4183333333334,3
w13,2,128,8,4096,1536,32,32,256,1,4,3,545.2959999999999,3
w13,2,128,8,4096,1536,32,32,256,1,4,4,547.6213333333334,3
w13,2,128,8,4096,1536,32,32,256,1,8,3,545.0723333333334,3
w13,2,128,8,4096,1536,32,32,256,1,8,4,547.728,3
w13,2,128,8,4096,1536,32,32,256,4,4,3,545.1996666666666,3
w13,2,128,8,4096,1536,32,32,256,4,8,3,545.1146666666667,3
w13,2,128,8,4096,1536,32,32,256,4,8,4,547.5360000000001,3
w13,2,128,8,4096,1536,32,32,256,16,4,3,545.616,3
w13,2,128,8,4096,1536,32,32,256,16,4,4,547.8776666666666,3
w13,2,128,8,4096,1536,32,32,256,16,8,3,544.8483333333334,3
w13,2,128,8,4096,1536,32,32,256,16,8,4,547.686,3
w13,2,128,8,4096,1536,32,32,256,32,4,3,545.1686666666666,3
w13,2,128,8,4096,1536,32,32,256,32,8,3,544.9223333333333,3
w13,2,128,8,4096,1536,32,32,256,32,8,4,547.4830000000001,3
w13,2,128,8,4096,3072,16,16,256,1,4,3,1081.675,3
w13,2,128,8,4096,3072,16,16,256,1,4,4,1087.0826666666667,3
w13,2,128,8,4096,3072,16,16,256,1,8,3,1086.869,3
w13,2,128,8,4096,3072,16,16,256,1,8,4,1090.6343333333334,3
w13,2,128,8,4096,3072,16,16,256,4,4,3,1081.0663333333334,3
w13,2,128,8,4096,3072,16,16,256,4,4,4,1086.6663333333333,3
w13,2,128,8,4096,3072,16,16,256,4,8,3,1084.5973333333334,3
w13,2,128,8,4096,3072,16,16,256,4,8,4,1089.258,3
w13,2,128,8,4096,3072,16,32,256,1,4,3,1089.5363333333335,3
w13,2,128,8,4096,3072,16,32,256,1,4,4,1087.7436666666665,3
w13,2,128,8,4096,3072,16,32,256,1,8,3,1089.4083333333333,3
w13,2,128,8,4096,3072,16,32,256,1,8,4,1089.323,3
w13,2,128,8,4096,3072,16,32,256,16,4,3,1087.2963333333335,3
w13,2,128,8,4096,3072,16,32,256,16,4,4,1088.4696666666666,3
w13,2,128,8,4096,3072,16,32,256,16,8,3,1087.424,3
w13,2,128,8,4096,3072,16,32,256,16,8,4,1089.0666666666666,3
w13,2,128,8,4096,3072,16,32,256,32,4,3,1087.2426666666668,3
w13,2,128,8,4096,3072,16,32,256,32,4,4,1088.2346666666665,3
w13,2,128,8,4096,3072,16,32,256,32,8,3,1087.7113333333334,3
w13,2,128,8,4096,3072,16,32,256,32,8,4,1089.376,3
w13,2,128,8,4096,3072,16,32,256,64,4,3,1087.3603333333333,3
w13,2,128,8,4096,3072,16,32,256,64,4,4,1087.8503333333335,3
w13,2,128,8,4096,3072,16,32,256,64,8,3,1087.8296666666668,3
w13,2,128,8,4096,3072,16,32,256,64,8,4,1089.3333333333333,3
w13,2,128,8,4096,3072,32,32,256,1,4,3,1085.1943333333331,3
w13,2,128,8,4096,3072,32,32,256,1,4,4,1090.2186666666666,3
w13,2,128,8,4096,3072,32,32,256,1,8,3,1085.1303333333333,3
w13,2,128,8,4096,3072,32,32,256,1,8,4,1089.5256666666667,3
w13,2,128,8,4096,3072,32,32,256,4,4,3,1084.9923333333334,3
w13,2,128,8,4096,3072,32,32,256,4,4,4,1089.984,3
w13,2,128,8,4096,3072,32,32,256,4,8,3,1084.8636666666669,3
w13,2,128,8,4096,3072,32,32,256,4,8,4,1088.9383333333333,3
w13,2,128,8,4096,3072,32,32,256,16,4,3,1085.7920000000001,3
w13,2,128,8,4096,3072,32,32,256,16,4,4,1090.9336666666666,3
w13,2,128,8,4096,3072,32,32,256,16,8,3,1085.9946666666667,3
w13,2,128,8,4096,3072,32,32,256,16,8,4,1089.4083333333335,3
w13,2,128,8,4096,3072,32,32,256,32,4,3,1085.9196666666667,3
w13,2,128,8,4096,3072,32,32,256,32,4,4,1090.8376666666666,3
w13,2,128,8,4096,3072,32,32,256,32,8,3,1085.994,3
w13,2,128,8,4096,3072,32,32,256,32,8,4,1089.7813333333334,3
w13,2,128,8,4096,3072,64,32,256,1,4,3,1091.7336666666667,3
w13,2,128,8,4096,3072,64,32,256,1,8,3,1089.941,3
w13,4,8,2,1024,512,16,64,64,1,4,4,5.484666666666667,3
w13,4,8,2,1024,512,16,64,64,16,4,4,5.506,3
w13,4,8,2,1024,512,16,64,64,32,4,4,5.4526666666666666,3
w13,4,8,2,1024,512,16,64,64,64,4,4,5.484666666666667,3
w13,4,16,2,1536,768,16,128,64,1,8,4,10.096666666666666,3
w13,4,16,4,1536,1024,16,64,128,1,8,2,24.076666666666664,3
w13,4,32,4,2048,768,16,32,128,16,8,2,33.77333333333333,3
w13,4,32,6,3072,1024,16,16,256,1,4,3,408.0463333333334,3
w13,4,32,6,3072,1024,16,16,256,1,8,3,411.05466666666666,3
w13,4,32,6,3072,1024,16,16,256,4,4,3,407.39599999999996,3
w13,4,32,6,3072,1024,16,16,256,4,8,3,410.25533333333334,3
w13,4,32,6,3072,1024,16,32,256,1,4,2,409.75333333333333,3
w13,4,32,6,3072,1024,16,64,256,1,4,2,409.8496666666667,3
w13,4,32,6,3072,1024,32,32,256,1,4,2,411.375,3
w13,4,32,6,3072,1024,32,32,256,1,4,3,408.75066666666663,3
w13,4,32,6,3072,1024,32,32,256,1,8,3,408.473,3
w13,4,32,6,3072,1024,32,32,256,4,4,3,408.94266666666664,3
w13,4,32,6,3072,1024,32,32,256,4,8,3,408.452,3
w13,4,32,6,3072,1024,32,32,256,16,4,3,408.94266666666664,3
w13,4,32,6,3072,1024,32,32,256,16,8,3,408.8143333333333,3
w13,4,32,6,3072,1024,32,32,256,32,4,3,409.06,3
w13,4,32,6,3072,1024,32,32,256,32,8,3,408.99600000000004,3
w13,4,60,4,2048,1408,16,32,256,16,4,2,238.687,3
w13,4,60,4,2048,1408,16,64,256,16,4,2,240.72400000000002,3
w13,4,60,6,3584,2304,16,16,256,1,4,3,1063.5736666666667,3
w13,4,60,6,3584,2304,16,16,256,1,8,3,1068.5763333333332,3
w13,4,60,6,3584,2304,16,16,256,4,4,3,1061.5043333333333,3
w13,4,60,6,3584,2304,16,16,256,4,8,3,1068.491,3
w13,4,60,6,3584,2304,16,32,256,1,4,3,1072.0330000000001,3
w13,4,60,6,3584,2304,16,32,256,16,4,3,1071.0406666666665,3
w13,4,60,6,3584,2304,16,32,256,32,4,3,1071.19,3
w13,4,60,6,3584,2304,16,32,256,64,4,3,1070.9443333333334,3
w13,4,60,6,3584,2304,32,32,256,1,4,3,1065.9203333333332,3
w13,4,60,6,3584,2304,32,32,256,1,8,3,1064.5116666666665,3
w13,4,60,6,3584,2304,32,32,256,4,4,3,1065.7176666666667,3
w13,4,60,6,3584,2304,32,32,256,4,8,3,1064.5870000000002,3
w13,4,60,6,3584,2304,32,32,256,16,4,3,1066.2506666666666,3
w13,4,60,6,3584,2304,32,32,256,16,8,3,1065.451,3
w13,4,60,6,3584,2304,32,32,256,32,4,3,1066.9016666666666,3
w13,4,60,6,3584,2304,32,32,256,32,8,3,1065.707,3
w13,4,60,8,2048,1536,16,16,256,1,4,3,543.14,3
w13,4,60,8,2048,1536,16,16,256,1,4,4,545.8916666666667,3
w13,4,60,8,2048,1536,16,16,256,1,8,3,545.38,3
w13,4,60,8,2048,1536,16,16,256,1,8,4,547.6519999999999,3
w13,4,60,8,2048,1536,16,16,256,4,4,3,542.564,3
w13,4,60,8,2048,1536,16,16,256,4,4,4,545.433,3
w13,4,60,8,2048,1536,16,16,256,4,8,3,545.209,3
w13,4,60,8,2048,1536,16,16,256,4,8,4,546.8413333333334,3
w13,4,60,8,2048,1536,16,32,256,1,4,3,544.9736666666666,3
w13,4,60,8,2048,1536,16,32,256,1,4,4,545.1129999999999,3
w13,4,60,8,2048,1536,16,32,256,1,8,3,545.8173333333333,3
w13,4,60,8,2048,1536,16,32,256,1,8,4,546.0413333333333,3
w13,4,60,8,2048,1536,16,32,256,16,4,3,544.1853333333333,3
w13,4,60,8,2048,1536,16,32,256,16,4,4,545.444,3
w13,4,60,8,2048,1536,16,32,256,16,8,3,545.2093333333333,3
w13,4,60,8,2048,1536,16,32,256,16,8,4,546.276,3
w13,4,60,8,2048,1536,16,32,256,32,4,3,543.812,3
w13,4,60,8,2048,1536,16,32,256,32,4,4,545.6033333333334,3
w13,4,60,8,2048,1536,16,32,256,32,8,3,544.803,3
w13,4,60,8,2048,1536,16,32,256,32,8,4,546.3503333333333,3
w13,4,60,8,2048,1536,16,32,256,64,4,3,544.0569999999999,3
w13,4,60,8,2048,1536,16,32,256,64,4,4,545.796,3
w13,4,60,8,2048,1536,16,32,256,64,8,3,544.5266666666666,3
w13,4,60,8,2048,1536,16,32,256,64,8,4,546.4356666666666,3
w13,4,60,8,2048,1536,16,64,256,1,8,3,547.62,3
w13,4,60,8,2048,1536,16,64,256,16,4,3,547.9823333333334,3
w13,4,60,8,2048,1536,16,64,256,16,8,3,547.46,3
w13,4,60,8,2048,1536,16,64,256,32,4,3,547.9506666666666,3
w13,4,60,8,2048,1536,16,64,256,32,8,3,547.6626666666667,3
w13,4,60,8,2048,1536,16,64,256,64,8,3,547.6626666666667,3
w13,4,60,8,2048,1536,32,32,256,1,4,3,544.1416666666668,3
w13,4,60,8,2048,1536,32,32,256,1,4,4,546.7986666666667,3
w13,4,60,8,2048,1536,32,32,256,1,8,3,544.004,3
w13,4,60,8,2048,1536,32,32,256,1,8,4,546.8723333333334,3
w13,4,60,8,2048,1536,32,32,256,4,4,3,544.26,3
w13,4,60,8,2048,1536,32,32,256,4,4,4,547.2996666666667,3
w13,4,60,8,2048,1536,32,32,256,4,8,3,543.929,3
w13,4,60,8,2048,1536,32,32,256,4,8,4,546.5423333333333,3
w13,4,60,8,2048,1536,32,32,256,16,4,3,545.6996666666668,3
w13,4,60,8,2048,1536,32,32,256,16,4,4,547.3103333333333,3
w13,4,60,8,2048,1536,32,32,256,16,8,3,544.9106666666667,3
w13,4,60,8,2048,1536,32,32,256,16,8,4,547.1933333333333,3
w13,4,60,8,2048,1536,32,32,256,32,4,3,546.0936666666666,3
w13,4,60,8,2048,1536,32,32,256,32,4,4,547.2786666666667,3
w13,4,60,8,2048,1536,32,32,256,32,8,3,545.2723333333333,3
w13,4,60,8,2048,1536,32,32,256,32,8,4,547.0436666666667,3
w13,4,60,8,2048,1536,64,32,256,1,4,3,547.78,3
w13,4,60,8,2048,1536,64,32,256,1,8,3,546.7453333333333,3
w13,4,64,6,3072,2048,16,16,256,1,4,3,809.5963333333333,3
w13,4,64,6,3072,2048,16,16,256,1,8,3,814.8976666666667,3
w13,4,64,6,3072,2048,16,16,256,4,4,3,808.2843333333334,3
w13,4,64,6,3072,2048,16,16,256,4,8,3,812.7963333333333,3
w13,4,64,6,3072,2048,32,32,256,1,4,3,812.3273333333333,3
w13,4,64,6,3072,2048,32,32,256,1,8,3,811.7513333333333,3
w13,4,64,6,3072,2048,32,32,256,4,4,3,812.743,3
w13,4,64,6,3072,2048,32,32,256,4,8,3,812.551,3
w13,4,64,6,3072,2048,32,32,256,16,4,3,812.967,3
w13,4,64,6,3072,2048,32,32,256,16,8,3,812.5189999999999,3
w13,4,64,6,3072,2048,32,32,256,32,4,3,813.2976666666667,3
w13,4,64,6,3072,2048,32,32,256,32,8,3,812.7856666666667,3
w13,4,64,6,3584,1536,16,16,256,1,4,3,710.9810000000001,3
w13,4,64,6,3584,1536,16,16,256,1,8,3,714.917,3
w13,4,64,6,3584,1536,16,16,256,4,4,3,709.8389999999999,3
w13,4,64,6,3584,1536,16,16,256,4,8,3,713.6906666666667,3
w13,4,64,6,3584,1536,16,32,256,64,4,3,716.7726666666667,3
w13,4,64,6,3584,1536,32,32,256,1,4,3,713.0500000000001,3
w13,4,64,6,3584,1536,32,32,256,1,8,3,711.5886666666667,3
w13,4,64,6,3584,1536,32,32,256,4,4,3,712.9119999999999,3
w13,4,64,6,3584,1536,32,32,256,4,8,3,712.261,3
w13,4,64,6,3584,1536,32,32,256,16,4,3,713.3166666666666,3
w13,4,64,6,3584,1536,32,32,256,16,8,3,712.6343333333334,3
w13,4,64,6,3584,1536,32,32,256,32,4,3,713.5300000000001,3
w13,4,64,6,3584,1536,32,32,256,32,8,3,712.9966666666666,3
w13,4,64,8,3584,2560,16,16,256,1,4,3,1571.32,3
w13,4,64,8,3584,2560,16,16,256,1,8,3,1578.8616666666667,3
w13,4,64,8,3584,2560,16,16,256,4,4,3,1569.795,3
w13,4,64,8,3584,2560,16,16,256,4,8,3,1578.6373333333333,3
w13,4,64,8,3584,2560,16,32,256,1,4,3,1582.0083333333332,3
w13,4,64,8,3584,2560,16,32,256,1,8,3,1584.387,3
w13,4,64,8,3584,2560,16,32,256,16,4,3,1580.6746666666666,3
w13,4,64,8,3584,2560,16,32,256,16,8,3,1583.9283333333333,3
w13,4,64,8,3584,2560,16,32,256,32,4,3,1581.624,3
w13,4,64,8,3584,2560,16,32,256,32,8,3,1584.6319999999998,3
w13,4,64,8,3584,2560,16,32,256,64,4,3,1580.9096666666665,3
w13,4,64,8,3584,2560,16,32,256,64,8,3,1584.5469999999998,3
w13,4,64,8,3584,2560,32,32,256,1,4,3,1575.8106666666665,3
w13,4,64,8,3584,2560,32,32,256,1,8,3,1575.0959999999998,3
w13,4,64,8,3584,2560,32,32,256,4,4,3,1575.2136666666665,3
w13,4,64,8,3584,2560,32,32,256,4,8,3,1574.9576666666665,3
w13,4,64,8,3584,2560,32,32,256,16,4,3,1576.3123333333333,3
w13,4,64,8,3584,2560,32,32,256,16,8,3,1575.5443333333333,3
w13,4,64,8,3584,2560,32,32,256,32,4,3,1577.72,3
w13,4,64,8,3584,2560,32,32,256,32,8,3,1576.2586666666666,3
w13,4,128,4,2048,512,16,128,64,1,4,4,14.956666666666665,3
w13,4,128,4,2048,512,16,128,64,1,8,4,14.828666666666665,3
w13,4,128,6,4096,2048,16,16,256,1,4,3,1081.8190000000002,3
w13,4,128,6,4096,2048,16,16,256,1,4,4,1087.1090000000002,3
w13,4,128,6,4096,2048,16,16,256,1,8,3,1085.8509999999999,3
w13,4,128,6,4096,2048,16,16,256,4,4,3,1078.7363333333333,3
w13,4,128,6,4096,2048,16,16,256,4,4,4,1085.5739999999998,3
w13,4,128,6,4096,2048,16,16,256,4,8,3,1083.558,3
w13,4,128,6,4096,2048,16,16,256,4,8,4,1088.4853333333333,3
w13,4,128,6,4096,2048,16,32,256,1,4,3,1088.944,3
w13,4,128,6,4096,2048,16,32,256,1,4,4,1088.0166666666667,3
w13,4,128,6,4096,2048,16,32,256,1,8,3,1088.603,3
w13,4,128,6,4096,2048,16,32,256,1,8,4,1088.72,3
w13,4,128,6,4096,2048,16,32,256,16,4,3,1086.4266666666667,3
w13,4,128,6,4096,2048,16,32,256,16,4,4,1087.494,3
w13,4,128,6,4096,2048,16,32,256,16,8,3,1087.5469999999998,3
w13,4,128,6,4096,2048,16,32,256,16,8,4,1088.5176666666666,3
w13,4,128,6,4096,2048,16,32,256,32,4,3,1086.395,3
w13,4,128,6,4096,2048,16,32,256,32,4,4,1087.1633333333332,3
w13,4,128,6,4096,2048,16,32,256,32,8,3,1087.1203333333333,3
w13,4,128,6,4096,2048,16,32,256,32,8,4,1088.8593333333333,3
w13,4,128,6,4096,2048,16,32,256,64,4,3,1085.531,3
w13,4,128,6,4096,2048,16,32,256,64,4,4,1087.173,3
w13,4,128,6,4096,2048,16,32,256,64,8,3,1086.7256666666665,3
w13,4,128,6,4096,2048,16,32,256,64,8,4,1088.5383333333332,3
w13,4,128,6,4096,2048,32,32,256,1,4,3,1084.6140000000003,3
w13,4,128,6,4096,2048,32,32,256,1,8,3,1084.646,3
w13,4,128,6,4096,2048,32,32,256,1,8,4,1089.2536666666667,3
w13,4,128,6,4096,2048,32,32,256,4,4,3,1084.8053333333335,3
w13,4,128,6,4096,2048,32,32,256,4,4,4,1088.8163333333334,3
w13,4,128,6,4096,2048,32,32,256,4,8,3,1084.1333333333332,3
w13,4,128,6,4096,2048,32,32,256,4,8,4,1088.7203333333334,3
w13,4,128,6,4096,2048,32,32,256,16,4,3,1084.8803333333333,3
w13,4,128,6,4096,2048,32,32,256,16,8,3,1084.7313333333334,3
w13,4,128,6,4096,2048,32,32,256,16,8,4,1088.6563333333334,3
w13,4,128,6,4096,2048,32,32,256,32,4,3,1085.5736666666667,3
w13,4,128,6,4096,2048,32,32,256,32,4,4,1089.1466666666668,3
w13,4,128,6,4096,2048,32,32,256,32,8,3,1085.3286666666665,3
w13,4,128,6,4096,2048,32,32,256,32,8,4,1089.2753333333333,3
w13,4,128,8,2048,768,16,32,256,1,4,2,266.76366666666667,3
w13,4,128,8,2048,768,16,64,256,1,4,2,266.92366666666663,3
w13,4,128,8,2048,768,32,32,128,1,4,2,269.06733333333335,3
w13,4,128,8,2048,768,32,32,256,1,4,2,267.33933333333334,3
w13,4,128,8,2048,768,32,64,256,1,4,2,268.1496666666667,3
w13,4,128,8,4096,1536,16,16,256,1,4,3,1080.2756666666667,3
w13,4,128,8,4096,1536,16,16,256,1,4,4,1087.3156666666666,3
w13,4,128,8,4096,1536,16,16,256,1,8,3,1084.7343333333333,3
w13,4,128,8,4096,1536,16,16,256,1,8,4,1089.5556666666669,3
w13,4,128,8,4096,1536,16,16,256,4,4,3,1079.241,3
w13,4,128,8,4096,1536,16,16,256,4,4,4,1086.6009999999999,3
w13,4,128,8,4096,1536,16,16,256,4,8,3,1082.8143333333335,3
w13,4,128,8,4096,1536,16,16,256,4,8,4,1089.2250000000001,3
w13,4,128,8,4096,1536,16,32,256,1,4,3,1088.329,3
w13,4,128,8,4096,1536,16,32,256,1,4,4,1087.8166666666666,3
w13,4,128,8,4096,1536,16,32,256,1,8,3,1088.7023333333334,3
w13,4,128,8,4096,1536,16,32,256,1,8,4,1089.0116666666665,3
w13,4,128,8,4096,1536,16,32,256,16,4,3,1086.0996666666667,3
w13,4,128,8,4096,1536,16,32,256,16,4,4,1088.0303333333334,3
w13,4,128,8,4096,1536,16,32,256,16,8,3,1087.4116666666666,3
w13,4,128,8,4096,1536,16,32,256,16,8,4,1088.937,3
w13,4,128,8,4096,1536,16,32,256,32,4,3,1085.6836666666666,3
w13,4,128,8,4096,1536,16,32,256,32,4,4,1087.7536666666667,3
w13,4,128,8,4096,1536,16,32,256,32,8,3,1087.0063333333335,3
w13,4,128,8,4096,1536,16,32,256,32,8,4,1089.1076666666665,3
w13,4,128,8,4096,1536,16,32,256,64,4,3,1085.7473333333335,3
w13,4,128,8,4096,1536,16,32,256,64,4,4,1088.1583333333335,3
w13,4,128,8,4096,1536,16,32,256,64,8,3,1086.8463333333332,3
w13,4,128,8,4096,1536,16,32,256,64,8,4,1089.3423333333333,3
w13,4,128,8,4096,1536,32,32,256,1,4,3,1085.0223333333333,3
w13,4,128,8,4096,1536,32,32,256,1,4,4,1089.8756666666666,3
w13,4,128,8,4096,1536,32,32,256,1,8,3,1084.809,3
w13,4,128,8,4096,1536,32,32,256,1,8,4,1089.9930000000002,3
w13,4,128,8,4096,1536,32,32,256,4,4,3,1085.193,3
w13,4,128,8,4096,1536,32,32,256,4,4,4,1090.0036666666667,3
w13,4,128,8,4096,1536,32,32,256,4,8,3,1085.321,3
w13,4,128,8,4096,1536,32,32,256,4,8,4,1089.9076666666667,3
w13,4,128,8,4096,1536,32,32,256,16,4,3,1086.089,3
w13,4,128,8,4096,1536,32,32,256,16,4,4,1089.7903333333334,3
w13,4,128,8,4096,1536,32,32,256,16,8,3,1085.129,3
w13,4,128,8,4096,1536,32,32,256,16,8,4,1089.6193333333333,3
w13,4,128,8,4096,1536,32,32,256,32,4,3,1086.1636666666666,3
w13,4,128,8,4096,1536,32,32,256,32,8,3,1086.014,3
w13,4,128,8,4096,1536,32,32,256,32,8,4,1089.6836666666666,3
w13,4,128,8,4096,3072,16,16,256,1,4,3,2155.646666666667,3
w13,4,128,8,4096,3072,16,16,256,1,4,4,2169.182666666667,3
w13,4,128,8,4096,3072,16,16,256,1,8,3,2162.921333333333,3
w13,4,128,8,4096,3072,16,16,256,1,8,4,2172.116,3
w13,4,128,8,4096,3072,16,16,256,4,4,3,2155.0703333333336,3
w13,4,128,8,4096,3072,16,16,256,4,4,4,2168.244,3
w13,4,128,8,4096,3072,16,16,256,4,8,3,2163.3263333333334,3
w13,4,128,8,4096,3072,16,16,256,4,8,4,2171.5293333333334,3
w13,4,128,8,4096,3072,16,32,256,1,4,3,2172.404,3
w13,4,128,8,4096,3072,16,32,256,1,4,4,2171.5506666666665,3
w13,4,128,8,4096,3072,16,32,256,1,8,3,2172.948,3
w13,4,128,8,4096,3072,16,32,256,1,8,4,2173.193333333333,3
w13,4,128,8,4096,3072,16,32,256,16,4,3,2165.182666666667,3
w13,4,128,8,4096,3072,16,32,256,16,4,4,2172.617333333333,3
w13,4,128,8,4096,3072,16,32,256,16,8,3,2168.4893333333334,3
w13,4,128,8,4096,3072,16,32,256,16,8,4,2173.3106666666667,3
w13,4,128,8,4096,3072,16,32,256,32,4,3,2164.2116666666666,3
w13,4,128,8,4096,3072,16,32,256,32,4,4,2170.921333333333,3
w13,4,128,8,4096,3072,16,32,256,32,8,3,2165.246333333333,3
w13,4,128,8,4096,3072,16,32,256,32,8,4,2174.036,3
w13,4,128,8,4096,3072,16,32,256,64,4,3,2164.958666666667,3
w13,4,128,8,4096,3072,16,32,256,64,4,4,2171.038666666667,3
w13,4,128,8,4096,3072,16,32,256,64,8,3,2166.4413333333337,3
w13,4,128,8,4096,3072,16,32,256,64,8,4,2172.9159999999997,3
w13,4,128,8,4096,3072,32,32,256,1,4,3,2165.4386666666664,3
w13,4,128,8,4096,3072,32,32,256,1,4,4,2174.367,3
w13,4,128,8,4096,3072,32,32,256,1,8,3,2165.0866666666666,3
w13,4,128,8,4096,3072,32,32,256,1,8,4,2173.950666666667,3
w13,4,128,8,4096,3072,32,32,256,4,4,3,2166.7933333333335,3
w13,4,128,8,4096,3072,32,32,256,4,4,4,2174.8573333333334,3
w13,4,128,8,4096,3072,32,32,256,4,8,3,2165.716,3
w13,4,128,8,4096,3072,32,32,256,4,8,4,2174.0679999999998,3
w13,4,128,8,4096,3072,32,32,256,16,4,3,2167.998666666667,3
w13,4,128,8,4096,3072,32,32,256,16,4,4,2174.7613333333334,3
w13,4,128,8,4096,3072,32,32,256,16,8,3,2167.518666666667,3
w13,4,128,8,4096,3072,32,32,256,16,8,4,2174.0040000000004,3
w13,4,128,8,4096,3072,32,32,256,32,4,3,2169.2893333333336,3
w13,4,128,8,4096,3072,32,32,256,32,4,4,2174.366666666667,3
w13,4,128,8,4096,3072,32,32,256,32,8,3,2168.3506666666667,3
w13,4,128,8,4096,3072,32,32,256,32,8,4,2174.654666666667,3
w13,4,128,8,4096,3072,64,32,256,1,4,3,2176.1486666666665,3
w13,4,128,8,4096,3072,64,32,256,1,8,3,2173.5353333333333,3
w13,8,8,2,1024,512,16,64,64,1,4,4,5.3886666666666665,3
w13,8,16,2,1536,768,16,64,32,1,4,3,16.829333333333334,3
w13,8,16,2,1536,768,16,64,32,1,4,4,16.733,3
w13,8,16,4,1536,1024,16,64,128,1,4,2,24.972333333333335,3
w13,8,16,4,1536,1024,16,64,128,16,4,2,24.887,3
w13,8,16,4,1536,1024,16,64,128,32,4,2,24.962,3
w13,8,16,4,1536,1024,16,64,128,64,4,2,24.749,3
w13,8,32,4,2048,768,16,32,256,1,4,2,263.8643333333333,3
w13,8,32,4,2048,768,16,64,256,1,4,2,265.1126666666667,3
w13,8,32,4,2048,768,32,32,256,1,4,2,265.62466666666666,3
w13,8,32,4,2048,768,32,64,256,1,4,2,266.21099999999996,3
w13,8,32,6,3072,1024,16,16,256,1,4,3,542.4366666666666,3
w13,8,32,6,3072,1024,16,16,256,1,8,3,544.4636666666667,3
w13,8,32,6,3072,1024,16,16,256,4,4,3,541.9033333333333,3
w13,8,32,6,3072,1024,16,16,256,4,8,3,545.3703333333333,3
w13,8,32,6,3072,1024,32,32,256,1,4,3,544.3243333333334,3
w13,8,32,6,3072,1024,32,32,256,1,8,3,544.1326666666668,3
w13,8,32,6,3072,1024,32,32,256,4,4,3,544.25,3
w13,8,32,6,3072,1024,32,32,256,4,8,3,543.8870000000001,3
w13,8,32,6,3072,1024,32,32,256,16,4,3,544.9543333333332,3
w13,8,32,6,3072,1024,32,32,256,16,8,3,544.602,3
w13,8,32,6,3072,1024,32,32,256,32,4,3,545.295,3
w13,8,32,6,3072,1024,32,32,256,32,8,3,544.7406666666667,3
w13,8,60,4,2048,1408,16,16,256,1,4,3,497.5396666666666,3
w13,8,60,4,2048,1408,16,16,256,1,4,4,501.1336666666666,3
w13,8,60,4,2048,1408,16,16,256,1,8,3,500.42900000000003,3
w13,8,60,4,2048,1408,16,16,256,4,4,3,497.13366666666667,3
w13,8,60,4,2048,1408,16,16,256,4,4,4,500.01366666666667,3
w13,8,60,4,2048,1408,16,16,256,4,8,3,499.4373333333333,3
w13,8,60,4,2048,1408,16,16,256,4,8,4,501.1863333333333,3
w13,8,60,4,2048,1408,16,32,256,1,4,3,499.7253333333333,3
w13,8,60,4,2048,1408,16,32,256,1,4,4,499.64033333333333,3
w13,8,60,4,2048,1408,16,32,256,1,8,3,499.7573333333333,3
w13,8,60,4,2048,1408,16,32,256,1,8,4,500.50333333333333,3
w13,8,60,4,2048,1408,16,32,256,16,4,3,498.0296666666666,3
w13,8,60,4,2048,1408,16,32,256,16,4,4,500.0986666666667,3
w13,8,60,4,2048,1408,16,32,256,16,8,3,498.6263333333333,3
w13,8,60,4,2048,1408,16,32,256,16,8,4,500.32300000000004,3
w13,8,60,4,2048,1408,16,32,256,32,4,3,498.21066666666667,3
w13,8,60,4,2048,1408,16,32,256,32,4,4,500.291,3
w13,8,60,4,2048,1408,16,32,256,32,8,3,499.267,3
w13,8,60,4,2048,1408,16,32,256,32,8,4,501.123,3
w13,8,60,4,2048,1408,16,32,256,64,4,3,497.955,3
w13,8,60,4,2048,1408,16,32,256,64,4,4,500.36533333333335,3
w13,8,60,4,2048,1408,16,32,256,64,8,3,498.7656666666667,3
w13,8,60,4,2048,1408,16,32,256,64,8,4,501.30400000000003,3
w13,8,60,4,2048,1408,16,64,256,16,4,3,501.91166666666663,3
w13,8,60,4,2048,1408,16,64,256,16,8,3,501.56,3
w13,8,60,4,2048,1408,16,64,256,32,8,3,502.1466666666667,3
w13,8,60,4,2048,1408,16,64,256,64,4,3,502.146,3
w13,8,60,4,2048,1408,16,64,256,64,8,3,502.093,3
w13,8,60,4,2048,1408,32,32,256,1,4,3,499.12833333333333,3
w13,8,60,4,2048,1408,32,32,256,1,4,4,501.251,3
w13,8,60,4,2048,1408,32,32,256,1,8,3,499.01133333333337,3
w13,8,60,4,2048,1408,32,32,256,1,8,4,500.89866666666666,3
w13,8,60,4,2048,1408,32,32,256,4,4,3,499.2136666666667,3
w13,8,60,4,2048,1408,32,32,256,4,4,4,501.66633333333334,3
w13,8,60,4,2048,1408,32,32,256,4,8,3,498.8403333333333,3
w13,8,60,4,2048,1408,32,32,256,4,8,4,501.55933333333337,3
w13,8,60,4,2048,1408,32,32,256,16,4,3,499.8006666666667,3
w13,8,60,4,2048,1408,32,32,256,16,4,4,501.34633333333335,3
w13,8,60,4,2048,1408,32,32,256,16,8,3,499.416,3
w13,8,60,4,2048,1408,32,32,256,16,8,4,501.40000000000003,3
w13,8,60,4,2048,1408,32,32,256,32,4,3,500.205,3
w13,8,60,4,2048,1408,32,32,256,32,4,4,501.91166666666663,3
w13,8,60,4,2048,1408,32,32,256,32,8,3,499.8006666666667,3
w13,8,60,4,2048,1408,32,32,256,32,8,4,501.5063333333333,3
w13,8,60,4,2048,1408,64,32,256,1,8,3,501.69866666666667,3
w13,8,60,6,3584,2304,16,16,256,1,4,3,2119.4546666666665,3
w13,8,60,6,3584,2304,16,16,256,1,8,3,2129.183,3
w13,8,60,6,3584,2304,16,16,256,4,4,3,2117.6316666666667,3
w13,8,60,6,3584,2304,16,16,256,4,8,3,2129.0123333333336,3
w13,8,60,6,3584,2304,16,32,256,1,4,3,2135.476666666667,3
w13,8,60,6,3584,2304,16,32,256,1,8,3,2137.6733333333336,3
w13,8,60,6,3584,2304,16,32,256,16,4,3,2133.087,3
w13,8,60,6,3584,2304,16,32,256,16,8,3,2138.8043333333335,3
w13,8,60,6,3584,2304,16,32,256,32,4,3,2132.5536666666667,3
w13,8,60,6,3584,2304,16,32,256,32,8,3,2139.007333333333,3
w13,8,60,6,3584,2304,16,32,256,64,4,3,2133.428,3
w13,8,60,6,3584,2304,32,32,256,1,4,3,2125.023333333333,3
w13,8,60,6,3584,2304,32,32,256,1,8,3,2123.924,3
w13,8,60,6,3584,2304,32,32,256,4,4,3,2126.505333333333,3
w13,8,60,6,3584,2304,32,32,256,4,8,3,2125.1083333333336,3
w13,8,60,6,3584,2304,32,32,256,16,4,3,2126.7613333333334,3
w13,8,60,6,3584,2304,32,32,256,16,8,3,2126.004666666667,3
w13,8,60,6,3584,2304,32,32,256,32,4,3,2126.996333333333,3
w13,8,60,6,3584,2304,32,32,256,32,8,3,2126.270666666667,3
w13,8,60,8,2048,1536,16,16,256,1,4,3,1013.5630000000001,3
w13,8,60,8,2048,1536,16,16,256,1,4,4,1020.6026666666667,3
w13,8,60,8,2048,1536,16,16,256,1,8,3,1017.0826666666667,3
w13,8,60,8,2048,1536,16,16,256,1,8,4,1021.584,3
w13,8,60,8,2048,1536,16,16,256,4,4,3,1013.0396666666667,3
w13,8,60,8,2048,1536,16,16,256,4,4,4,1019.4609999999999,3
w13,8,60,8,2048,1536,16,16,256,4,8,3,1016.176,3
w13,8,60,8,2048,1536,16,16,256,4,8,4,1021.1143333333333,3
w13,8,60,8,2048,1536,16,32,256,1,4,3,1017.4773333333333,3
w13,8,60,8,2048,1536,16,32,256,1,4,4,1018.5113333333334,3
w13,8,60,8,2048,1536,16,32,256,1,8,3,1017.6373333333335,3
w13,8,60,8,2048,1536,16,32,256,1,8,4,1020.2183333333334,3
w13,8,60,8,2048,1536,16,32,256,16,4,3,1014.3090000000001,3
w13,8,60,8,2048,1536,16,32,256,16,4,4,1019.0026666666666,3
w13,8,60,8,2048,1536,16,32,256,16,8,3,1016.0799999999999,3
w13,8,60,8,2048,1536,16,32,256,16,8,4,1019.973,3
w13,8,60,8,2048,1536,16,32,256,32,4,3,1013.541,3
w13,8,60,8,2048,1536,16,32,256,32,4,4,1019.7706666666667,3
w13,8,60,8,2048,1536,16,32,256,32,8,3,1015.12,3
w13,8,60,8,2048,1536,16,32,256,32,8,4,1020.5813333333334,3
w13,8,60,8,2048,1536,16,32,256,64,4,3,1014.096,3
w13,8,60,8,2048,1536,16,32,256,64,4,4,1020.2289999999999,3
w13,8,60,8,2048,1536,16,32,256,64,8,3,1015.6426666666666,3
w13,8,60,8,2048,1536,16,32,256,64,8,4,1021.5946666666667,3
w13,8,60,8,2048,1536,16,64,256,1,4,3,1022.6396666666666,3
w13,8,60,8,2048,1536,16,64,256,1,8,3,1022.0426666666666,3
w13,8,60,8,2048,1536,16,64,256,16,4,3,1021.7013333333334,3
w13,8,60,8,2048,1536,16,64,256,16,8,3,1021.2426666666667,3
w13,8,60,8,2048,1536,16,64,256,32,4,3,1021.8396666666667,3
w13,8,60,8,2048,1536,16,64,256,32,8,3,1022.32,3
w13,8,60,8,2048,1536,16,64,256,64,4,3,1022.8106666666666,3
w13,8,60,8,2048,1536,16,64,256,64,8,3,1022.6613333333333,3
w13,8,60,8,2048,1536,32,32,256,1,4,3,1017.1573333333334,3
w13,8,60,8,2048,1536,32,32,256,1,4,4,1020.4003333333334,3
w13,8,60,8,2048,1536,32,32,256,1,8,3,1016.9119999999999,3
w13,8,60,8,2048,1536,32,32,256,1,8,4,1020.752,3
w13,8,60,8,2048,1536,32,32,256,4,4,3,1017.0826666666667,3
w13,8,60,8,2048,1536,32,32,256,4,4,4,1021.6376666666666,3
w13,8,60,8,2048,1536,32,32,256,4,8,3,1016.6673333333333,3
w13,8,60,8,2048,1536,32,32,256,4,8,4,1021.3180000000001,3
w13,8,60,8,2048,1536,32,32,256,16,4,3,1018.4273333333334,3
w13,8,60,8,2048,1536,32,32,256,16,4,4,1021.3389999999999,3
w13,8,60,8,2048,1536,32,32,256,16,8,3,1017.9046666666667,3
w13,8,60,8,2048,1536,32,32,256,16,8,4,1021.5099999999999,3
w13,8,60,8,2048,1536,32,32,256,32,4,3,1019.5783333333334,3
w13,8,60,8,2048,1536,32,32,256,32,4,4,1022.0213333333332,3
w13,8,60,8,2048,1536,32,32,256,32,8,3,1018.7356666666666,3
w13,8,60,8,2048,1536,32,32,256,32,8,4,1021.862,3
w13,8,60,8,2048,1536,64,32,256,1,4,3,1021.5626666666667,3
w13,8,60,8,2048,1536,64,32,256,1,8,3,1021.0406666666667,3
w13,8,64,6,3072,2048,16,16,256,1,4,3,1613.8363333333334,3
w13,8,64,6,3072,2048,16,16,256,1,8,3,1619.9483333333335,3
w13,8,64,6,3072,2048,16,16,256,4,4,3,1612.1086666666667,3
w13,8,64,6,3072,2048,16,16,256,4,8,3,1619.9483333333335,3
w13,8,64,6,3072,2048,16,32,256,16,4,3,1626.6683333333333,3
w13,8,64,6,3072,2048,16,32,256,32,4,3,1626.1673333333335,3
w13,8,64,6,3072,2048,32,32,256,1,4,3,1619.8739999999998,3
w13,8,64,6,3072,2048,32,32,256,1,8,3,1619.01,3
w13,8,64,6,3072,2048,32,32,256,4,4,3,1621.2713333333334,3
w13,8,64,6,3072,2048,32,32,256,4,8,3,1620.6743333333334,3
w13,8,64,6,3072,2048,32,32,256,16,4,3,1622.4766666666667,3
w13,8,64,6,3072,2048,32,32,256,16,8,3,1621.5806666666667,3
w13,8,64,6,3072,2048,32,32,256,32,4,3,1622.0926666666667,3
w13,8,64,6,3072,2048,32,32,256,32,8,3,1621.4953333333333,3
w13,8,64,6,3584,1536,16,16,256,1,4,3,1414.493333333333,3
w13,8,64,6,3584,1536,16,16,256,1,8,3,1421.1283333333333,3
w13,8,64,6,3584,1536,16,16,256,4,4,3,1413.2026666666668,3
w13,8,64,6,3584,1536,16,16,256,4,8,3,1421.8853333333334,3
w13,8,64,6,3584,1536,16,32,256,1,4,3,1426.4506666666666,3
w13,8,64,6,3584,1536,16,32,256,16,4,3,1424.531,3
w13,8,64,6,3584,1536,16,32,256,32,4,3,1424.4986666666666,3
w13,8,64,6,3584,1536,16,32,256,64,4,3,1425.8213333333333,3
w13,8,64,6,3584,1536,32,32,256,1,4,3,1418.1946666666665,3
w13,8,64,6,3584,1536,32,32,256,1,8,3,1418.2693333333334,3
w13,8,64,6,3584,1536,32,32,256,4,4,3,1418.152,3
w13,8,64,6,3584,1536,32,32,256,4,8,3,1417.8533333333335,3
w13,8,64,6,3584,1536,32,32,256,16,4,3,1420.6483333333333,3
w13,8,64,6,3584,1536,32,32,256,16,8,3,1419.7626666666667,3
w13,8,64,6,3584,1536,32,32,256,32,4,3,1420.7013333333334,3
w13,8,64,6,3584,1536,32,32,256,32,8,3,1419.4746666666667,3
w13,8,64,8,3584,2560,16,16,256,1,4,3,3134.842,3
w13,8,64,8,3584,2560,16,16,256,1,8,3,3151.1730000000002,3
w13,8,64,8,3584,2560,16,16,256,4,4,3,3134.1059999999998,3
w13,8,64,8,3584,2560,16,16,256,4,8,3,3150.1493333333333,3
w13,8,64,8,3584,2560,16,32,256,1,4,3,3163.034333333333,3
w13,8,64,8,3584,2560,16,32,256,1,8,3,3159.9300000000003,3
w13,8,64,8,3584,2560,16,32,256,16,4,3,3154.5433333333335,3
w13,8,64,8,3584,2560,16,32,256,16,8,3,3165.1463333333336,3
w13,8,64,8,3584,2560,16,32,256,32,4,3,3153.5093333333334,3
w13,8,64,8,3584,2560,16,32,256,32,8,3,3162.981333333333,3
w13,8,64,8,3584,2560,16,32,256,64,4,3,3154.2556666666665,3
w13,8,64,8,3584,2560,16,32,256,64,8,3,3161.338333333333,3
w13,8,64,8,3584,2560,32,32,256,1,4,3,3145.9673333333335,3
w13,8,64,8,3584,2560,32,32,256,1,8,3,3143.759666666667,3
w13,8,64,8,3584,2560,32,32,256,4,4,3,3146.7996666666663,3
w13,8,64,8,3584,2560,32,32,256,4,8,3,3144.6343333333334,3
w13,8,64,8,3584,2560,32,32,256,16,4,3,3148.7196666666664,3
w13,8,64,8,3584,2560,32,32,256,16,8,3,3146.8313333333335,3
w13,8,64,8,3584,2560,32,32,256,32,4,3,3149.6693333333333,3
w13,8,64,8,3584,2560,32,32,256,32,8,3,3148.7623333333336,3
w13,8,128,4,2048,512,16,64,128,1,8,2,160.25733333333332,3
w13,8,128,4,2048,512,16,64,128,16,4,2,160.054,3
w13,8,128,4,2048,512,16,64,128,32,8,2,160.69366666666667,3
w13,8,128,4,2048,512,16,64,128,64,4,2,160.39533333333333,3
w13,8,128,4,2048,512,16,64,128,64,8,2,160.961,3
w13,8,128,4,2048,512,32,32,256,1,4,2,161.57933333333332,3
w13,8,128,4,2048,512,32,64,128,4,4,2,161.43,3
w13,8,128,6,4096,2048,16,16,256,1,4,3,2153.5886666666665,3
w13,8,128,6,4096,2048,16,16,256,1,4,4,2169.0873333333334,3
w13,8,128,6,4096,2048,16,16,256,1,8,3,2161.482,3
w13,8,128,6,4096,2048,16,16,256,4,4,3,2149.61,3
w13,8,128,6,4096,2048,16,16,256,4,4,4,2166.154,3
w13,8,128,6,4096,2048,16,16,256,4,8,3,2158.058333333333,3
w13,8,128,6,4096,2048,16,16,256,4,8,4,2170.2606666666666,3
w13,8,128,6,4096,2048,16,32,256,1,4,4,2170.73,3
w13,8,128,6,4096,2048,16,32,256,1,8,3,2170.5806666666667,3
w13,8,128,6,4096,2048,16,32,256,16,4,3,2163.658,3
w13,8,128,6,4096,2048,16,32,256,16,4,4,2169.8979999999997,3
w13,8,128,6,4096,2048,16,32,256,16,8,3,2166.058666666667,3
w13,8,128,6,4096,2048,16,32,256,32,4,3,2164.426,3
w13,8,128,6,4096,2048,16,32,256,32,4,4,2170.8686666666667,3
w13,8,128,6,4096,2048,16,32,256,32,8,3,2165.652666666667,3
w13,8,128,6,4096,2048,16,32,256,64,4,3,2164.6606666666667,3
w13,8,128,6,4096,2048,16,32,256,64,4,4,2170.7940000000003,3
w13,8,128,6,4096,2048,16,32,256,64,8,3,2165.7490000000003,3
w13,8,128,6,4096,2048,32,32,256,1,4,3,2165.322,3
w13,8,128,6,4096,2048,32,32,256,1,8,3,2164.788666666667,3
w13,8,128,6,4096,2048,32,32,256,4,4,3,2165.3753333333334,3
w13,8,128,6,4096,2048,32,32,256,4,8,3,2164.778,3
w13,8,128,6,4096,2048,32,32,256,16,4,3,2166.3889999999997,3
w13,8,128,6,4096,2048,32,32,256,16,8,3,2166.954,3
w13,8,128,6,4096,2048,32,32,256,32,4,3,2167.6046666666666,3
w13,8,128,6,4096,2048,32,32,256,32,8,3,2167.0073333333335,3
w13,8,128,8,2048,768,16,16,256,1,4,3,542.6003333333333,3
w13,8,128,8,2048,768,16,16,256,1,4,4,545.4796666666667,3
w13,8,128,8,2048,768,16,16,256,1,8,3,544.2853333333334,3
w13,8,128,8,2048,768,16,16,256,1,8,4,546.6633333333333,3
w13,8,128,8,2048,768,16,16,256,4,4,3,541.8646666666667,3
w13,8,128,8,2048,768,16,16,256,4,4,4,544.957,3
w13,8,128,8,2048,768,16,16,256,4,8,3,544.8183333333333,3
w13,8,128,8,2048,768,16,16,256,4,8,4,547.09,3
w13,8,128,8,2048,768,16,32,256,1,4,3,544.3386666666667,3
w13,8,128,8,2048,768,16,32,256,1,4,4,544.8823333333333,3
w13,8,128,8,2048,768,16,32,256,1,8,3,545.0,3
w13,8,128,8,2048,768,16,32,256,1,8,4,545.9490000000001,3
w13,8,128,8,2048,768,16,32,256,16,4,3,543.2403333333333,3
w13,8,128,8,2048,768,16,32,256,16,4,4,544.9893333333333,3
w13,8,128,8,2048,768,16,32,256,16,8,3,543.7199999999999,3
w13,8,128,8,2048,768,16,32,256,16,8,4,545.9809999999999,3
w13,8,128,8,2048,768,16,32,256,32,4,3,543.4006666666667,3
w13,8,128,8,2048,768,16,32,256,32,4,4,545.6073333333334,3
w13,8,128,8,2048,768,16,32,256,32,8,3,544.1896666666667,3
w13,8,128,8,2048,768,16,32,256,32,8,4,546.2256666666666,3
w13,8,128,8,2048,768,16,32,256,64,4,3,543.8053333333334,3
w13,8,128,8,2048,768,16,32,256,64,4,4,545.9693333333333,3
w13,8,128,8,2048,768,16,32,256,64,8,3,544.744,3
w13,8,128,8,2048,768,16,32,256,64,8,4,546.706,3
w13,8,128,8,2048,768,16,64,256,1,8,3,547.2923333333333,3
w13,8,128,8,2048,768,16,64,256,16,4,3,547.2710000000001,3
w13,8,128,8,2048,768,16,64,256,16,8,3,547.2926666666667,3
w13,8,128,8,2048,768,32,32,256,1,4,3,544.3913333333334,3
w13,8,128,8,2048,768,32,32,256,1,4,4,546.3860000000001,3
w13,8,128,8,2048,768,32,32,256,1,8,3,543.891,3
w13,8,128,8,2048,768,32,32,256,1,8,4,546.2363333333334,3
w13,8,128,8,2048,768,32,32,256,4,4,3,544.0933333333334,3
w13,8,128,8,2048,768,32,32,256,4,4,4,547.0573333333333,3
w13,8,128,8,2048,768,32,32,256,4,8,3,543.965,3
w13,8,128,8,2048,768,32,32,256,4,8,4,546.6419999999999,3
w13,8,128,8,2048,768,32,32,256,16,4,3,544.9463333333333,3
w13,8,128,8,2048,768,32,32,256,16,4,4,547.1436666666667,3
w13,8,128,8,2048,768,32,32,256,16,8,3,544.4236666666667,3
w13,8,128,8,2048,768,32,32,256,16,8,4,546.3539999999999,3
w13,8,128,8,2048,768,32,32,256,32,4,3,544.957,3
w13,8,128,8,2048,768,32,32,256,32,4,4,546.8016666666666,3
w13,8,128,8,2048,768,32,32,256,32,8,3,545.0633333333334,3
w13,8,128,8,2048,768,32,32,256,32,8,4,546.5566666666667,3
w13,8,128,8,4096,1536,16,16,256,1,4,3,2153.7016666666664,3
w13,8,128,8,4096,1536,16,16,256,1,4,4,2169.979333333333,3
w13,8,128,8,4096,1536,16,16,256,1,8,3,2162.1926666666664,3
w13,8,128,8,4096,1536,16,16,256,1,8,4,2172.902,3
w13,8,128,8,4096,1536,16,16,256,4,4,3,2153.094,3
w13,8,128,8,4096,1536,16,16,256,4,4,4,2167.8886666666667,3
w13,8,128,8,4096,1536,16,16,256,4,8,3,2161.4673333333335,3
w13,8,128,8,4096,1536,16,16,256,4,8,4,2172.0486666666666,3
w13,8,128,8,4096,1536,16,32,256,1,4,3,2170.246,3
w13,8,128,8,4096,1536,16,32,256,1,4,4,2171.248666666667,3
w13,8,128,8,4096,1536,16,32,256,1,8,3,2170.8223333333335,3
w13,8,128,8,4096,1536,16,32,256,1,8,4,2173.1366666666668,3
w13,8,128,8,4096,1536,16,32,256,16,4,3,2166.2993333333334,3
w13,8,128,8,4096,1536,16,32,256,16,4,4,2171.0246666666667,3
w13,8,128,8,4096,1536,16,32,256,16,8,3,2167.921,3
w13,8,128,8,4096,1536,16,32,256,16,8,4,2173.2540000000004,3
w13,8,128,8,4096,1536,16,32,256,32,4,3,2164.2729999999997,3
w13,8,128,8,4096,1536,16,32,256,32,4,4,2172.3153333333335,3
w13,8,128,8,4096,1536,16,32,256,32,8,3,2166.7686666666664,3
w13,8,128,8,4096,1536,16,32,256,32,8,4,2173.360666666667,3
w13,8,128,8,4096,1536,16,32,256,64,4,3,2164.806,3
w13,8,128,8,4096,1536,16,32,256,64,4,4,2171.9846666666667,3
w13,8,128,8,4096,1536,16,32,256,64,8,3,2167.7606666666666,3
w13,8,128,8,4096,1536,16,32,256,64,8,4,2174.1823333333336,3
w13,8,128,8,4096,1536,32,32,256,1,4,3,2165.5526666666665,3
w13,8,128,8,4096,1536,32,32,256,1,8,3,2164.7736666666665,3
w13,8,128,8,4096,1536,32,32,256,1,8,4,2174.2466666666664,3
w13,8,128,8,4096,1536,32,32,256,4,4,3,2166.118,3
w13,8,128,8,4096,1536,32,32,256,4,4,4,2174.6299999999997,3
w13,8,128,8,4096,1536,32,32,256,4,8,3,2166.107666666667,3
w13,8,128,8,4096,1536,32,32,256,4,8,4,2173.9686666666666,3
w13,8,128,8,4096,1536,32,32,256,16,4,3,2168.2726666666663,3
w13,8,128,8,4096,1536,32,32,256,16,4,4,2174.2883333333334,3
w13,8,128,8,4096,1536,32,32,256,16,8,3,2167.526,3
w13,8,128,8,4096,1536,32,32,256,16,8,4,2174.214,3
w13,8,128,8,4096,1536,32,32,256,32,4,3,2168.8593333333333,3
w13,8,128,8,4096,1536,32,32,256,32,4,4,2174.7793333333334,3
w13,8,128,8,4096,1536,32,32,256,32,8,3,2168.027666666667,3
w13,8,128,8,4096,1536,64,32,256,1,8,3,2173.8513333333335,3
w13,8,128,8,4096,3072,16,16,256,1,4,3,4306.065666666666,3
w13,8,128,8,4096,3072,16,16,256,1,4,4,4332.925333333334,3
w13,8,128,8,4096,3072,16,16,256,1,8,3,4315.623666666666,3
w13,8,128,8,4096,3072,16,16,256,1,8,4,4336.701333333333,3
w13,8,128,8,4096,3072,16,16,256,4,4,3,4304.349333333334,3
w13,8,128,8,4096,3072,16,16,256,4,4,4,4330.973333333333,3
w13,8,128,8,4096,3072,16,16,256,4,8,3,4318.173,3
w13,8,128,8,4096,3072,16,16,256,4,8,4,4336.978666666667,3
w13,8,128,8,4096,3072,16,32,256,1,4,3,4340.861333333333,3
w13,8,128,8,4096,3072,16,32,256,1,4,4,4337.234666666667,3
w13,8,128,8,4096,3072,16,32,256,1,8,3,4338.866333333333,3
w13,8,128,8,4096,3072,16,32,256,1,8,4,4340.402666666666,3
w13,8,128,8,4096,3072,16,32,256,16,4,3,4330.290666666667,3
w13,8,128,8,4096,3072,16,32,256,16,4,4,4338.354666666667,3
w13,8,128,8,4096,3072,16,32,256,16,8,3,4331.826666666667,3
w13,8,128,8,4096,3072,16,32,256,16,8,4,4342.781666666667,3
w13,8,128,8,4096,3072,16,32,256,32,4,3,4321.501666666667,3
w13,8,128,8,4096,3072,16,32,256,32,4,4,4338.419,3
w13,8,128,8,4096,3072,16,32,256,32,8,3,4328.381333333334,3
w13,8,128,8,4096,3072,16,32,256,32,8,4,4342.151999999999,3
w13,8,128,8,4096,3072,16,32,256,64,4,3,4326.547,3
w13,8,128,8,4096,3072,16,32,256,64,4,4,4338.376,3
w13,8,128,8,4096,3072,16,32,256,64,8,3,4329.032,3
w13,8,128,8,4096,3072,16,32,256,64,8,4,4341.789333333333,3
w13,8,128,8,4096,3072,32,32,256,1,4,3,4326.046333333333,3
w13,8,128,8,4096,3072,32,32,256,1,4,4,4341.78,3
w13,8,128,8,4096,3072,32,32,256,1,8,3,4325.502333333334,3
w13,8,128,8,4096,3072,32,32,256,1,8,4,4341.502333333334,3
w13,8,128,8,4096,3072,32,32,256,4,4,3,4328.265,3
w13,8,128,8,4096,3072,32,32,256,4,4,4,4343.198333333334,3
w13,8,128,8,4096,3072,32,32,256,4,8,3,4327.027666666667,3
w13,8,128,8,4096,3072,32,32,256,4,8,4,4343.027666666666,3
w13,8,128,8,4096,3072,32,32,256,16,4,3,4331.0706666666665,3
w13,8,128,8,4096,3072,32,32,256,16,4,4,4344.105333333333,3
w13,8,128,8,4096,3072,32,32,256,16,8,3,4329.203666666667,3
w13,8,128,8,4096,3072,32,32,256,16,8,4,4344.4783333333335,3
w13,8,128,8,4096,3072,32,32,256,32,4,3,4331.593,3
w13,8,128,8,4096,3072,32,32,256,32,4,4,4344.4783333333335,3
w13,8,128,8,4096,3072,32,32,256,32,8,3,4330.281,3
w13,8,128,8,4096,3072,32,32,256,32,8,4,4343.742333333333,3
w13,8,128,8,4096,3072,64,32,256,1,4,3,4343.455,3
w13,8,128,8,4096,3072,64,32,256,1,8,3,4340.958333333333,3
w13,16,8,2,1024,512,16,64,64,1,4,4,5.612666666666667,3
w13,16,8,2,1024,512,16,64,64,16,4,4,5.634,3
w13,16,8,2,1024,512,16,64,64,32,4,4,5.666,3
w13,16,8,2,1024,512,16,64,64,64,4,4,5.666,3
w13,16,16,2,1536,768,16,64,32,1,4,3,17.321,3
w13,16,16,2,1536,768,16,64,32,1,4,4,17.341333333333335,3
w13,16,16,4,1536,1024,16,64,128,1,8,2,24.81233333333333,3
w13,16,16,4,1536,1024,16,64,128,16,4,2,24.887333333333334,3
w13,16,16,4,1536,1024,16,64,128,32,8,2,25.058333333333334,3
w13,16,32,4,2048,768,16,32,256,1,4,2,265.67833333333334,3
w13,16,32,4,2048,768,16,64,256,1,4,2,266.37100000000004,3
w13,16,32,4,2048,768,32,32,128,1,4,2,266.98966666666666,3
w13,16,32,4,2048,768,32,32,256,1,4,2,266.894,3
w13,16,32,4,2048,768,32,64,256,1,4,2,267.72566666666665,3
w13,16,32,6,3072,1024,16,16,256,1,4,3,544.0473333333333,3
w13,16,32,6,3072,1024,16,16,256,1,8,3,545.9676666666666,3
w13,16,32,6,3072,1024,16,16,256,4,4,3,543.3216666666667,3
w13,16,32,6,3072,1024,16,16,256,4,8,3,546.0423333333333,3
w13,16,32,6,3072,1024,32,32,256,1,4,3,545.4556666666666,3
w13,16,32,6,3072,1024,32,32,256,1,8,3,545.1993333333334,3
w13,16,32,6,3072,1024,32,32,256,4,4,3,545.6473333333333,3
w13,16,32,6,3072,1024,32,32,256,4,8,3,545.221,3
w13,16,32,6,3072,1024,32,32,256,16,4,3,546.2230000000001,3
w13,16,32,6,3072,1024,32,32,256,16,8,3,546.106,3
w13,16,32,6,3072,1024,32,32,256,32,4,3,547.322,3
w13,16,32,6,3072,1024,32,32,256,32,8,3,546.2766666666666,3
w13,16,60,4,2048,1408,16,16,256,1,4,3,929.7383333333333,3
w13,16,60,4,2048,1408,16,16,256,1,4,4,935.7969999999999,3
w13,16,60,4,2048,1408,16,16,256,1,8,3,931.7433333333333,3
w13,16,60,4,2048,1408,16,16,256,1,8,4,936.8846666666667,3
w13,16,60,4,2048,1408,16,16,256,4,4,3,929.1623333333333,3
w13,16,60,4,2048,1408,16,16,256,4,4,4,934.4106666666667,3
w13,16,60,4,2048,1408,16,16,256,4,8,3,931.9253333333332,3
w13,16,60,4,2048,1408,16,16,256,4,8,4,936.6926666666667,3
w13,16,60,4,2048,1408,16,32,256,1,4,3,932.4053333333333,3
w13,16,60,4,2048,1408,16,32,256,1,4,4,933.9519999999999,3
w13,16,60,4,2048,1408,16,32,256,1,8,3,932.9916666666667,3
w13,16,60,4,2048,1408,16,32,256,1,8,4,935.7756666666668,3
w13,16,60,4,2048,1408,16,32,256,16,4,3,929.514,3
w13,16,60,4,2048,1408,16,32,256,16,4,4,933.7379999999999,3
w13,16,60,4,2048,1408,16,32,256,16,8,3,930.6763333333333,3
w13,16,60,4,2048,1408,16,32,256,16,8,4,935.3380000000001,3
w13,16,60,4,2048,1408,16,32,256,32,4,3,929.44,3
w13,16,60,4,2048,1408,16,32,256,32,4,4,934.677,3
w13,16,60,4,2048,1408,16,32,256,32,8,3,930.3573333333334,3
w13,16,60,4,2048,1408,16,32,256,32,8,4,936.2236666666666,3
w13,16,60,4,2048,1408,16,32,256,64,4,3,930.1226666666666,3
w13,16,60,4,2048,1408,16,32,256,64,4,4,935.6266666666667,3
w13,16,60,4,2048,1408,16,32,256,64,8,3,930.8793333333333,3
w13,16,60,4,2048,1408,16,32,256,64,8,4,936.4153333333334,3
w13,16,60,4,2048,1408,16,64,256,1,4,3,937.5886666666667,3
w13,16,60,4,2048,1408,16,64,256,1,8,3,937.386,3
w13,16,60,4,2048,1408,16,64,256,16,4,3,936.7353333333334,3
w13,16,60,4,2048,1408,16,64,256,16,8,3,936.3516666666668,3
w13,16,60,4,2048,1408,16,64,256,32,4,3,936.2130000000001,3
w13,16,60,4,2048,1408,16,64,256,32,8,3,936.1806666666666,3
w13,16,60,4,2048,1408,16,64,256,64,4,3,936.5433333333334,3
w13,16,60,4,2048,1408,16,64,256,64,8,3,936.4263333333333,3
w13,16,60,4,2048,1408,32,32,256,1,4,3,932.2233333333334,3
w13,16,60,4,2048,1408,32,32,256,1,4,4,936.3726666666666,3
w13,16,60,4,2048,1408,32,32,256,1,8,3,932.1706666666668,3
w13,16,60,4,2048,1408,32,32,256,1,8,4,935.936,3
w13,16,60,4,2048,1408,32,32,256,4,4,3,933.099,3
w13,16,60,4,2048,1408,32,32,256,4,4,4,936.576,3
w13,16,60,4,2048,1408,32,32,256,4,8,3,932.5333333333333,3
w13,16,60,4,2048,1408,32,32,256,4,8,4,936.6396666666666,3
w13,16,60,4,2048,1408,32,32,256,16,4,3,933.5353333333334,3
w13,16,60,4,2048,1408,32,32,256,16,4,4,936.245,3
w13,16,60,4,2048,1408,32,32,256,16,8,3,932.3516666666668,3
w13,16,60,4,2048,1408,32,32,256,16,8,4,935.68,3
w13,16,60,4,2048,1408,32,32,256,32,4,3,935.1143333333333,3
w13,16,60,4,2048,1408,32,32,256,32,4,4,936.6506666666668,3
w13,16,60,4,2048,1408,32,32,256,32,8,3,934.1013333333334,3
w13,16,60,4,2048,1408,32,32,256,32,8,4,936.7463333333334,3
w13,16,60,4,2048,1408,32,64,256,8,8,3,937.9303333333334,3
w13,16,60,4,2048,1408,32,64,256,16,8,3,938.2610000000001,3
w13,16,60,4,2048,1408,32,64,256,32,8,3,938.314,3
w13,16,60,4,2048,1408,64,32,256,1,4,3,937.418,3
w13,16,60,4,2048,1408,64,32,256,1,8,3,936.0316666666668,3
w13,16,60,6,3584,2304,16,16,256,1,4,3,2650.223,3
w13,16,60,6,3584,2304,16,16,256,1,8,3,2661.860666666667,3
w13,16,60,6,3584,2304,16,16,256,4,4,3,2648.6336666666666,3
w13,16,60,6,3584,2304,16,16,256,4,8,3,2662.3933333333334,3
w13,16,60,6,3584,2304,16,32,256,1,4,3,2673.923666666667,3
w13,16,60,6,3584,2304,16,32,256,1,8,3,2673.8073333333336,3
w13,16,60,6,3584,2304,16,32,256,16,4,3,2670.4680000000003,3
w13,16,60,6,3584,2304,16,32,256,16,8,3,2673.967,3
w13,16,60,6,3584,2304,16,32,256,32,4,3,2671.3116666666665,3
w13,16,60,6,3584,2304,16,32,256,64,4,3,2668.7826666666665,3
w13,16,60,6,3584,2304,16,32,256,64,8,3,2675.087,3
w13,16,60,6,3584,2304,32,32,256,1,4,3,2657.8179999999998,3
w13,16,60,6,3584,2304,32,32,256,1,8,3,2657.039,3
w13,16,60,6,3584,2304,32,32,256,4,4,3,2657.978,3
w13,16,60,6,3584,2304,32,32,256,4,8,3,2657.4126666666666,3
w13,16,60,6,3584,2304,32,32,256,16,4,3,2660.5806666666667,3
w13,16,60,6,3584,2304,32,32,256,16,8,3,2659.364666666667,3
w13,16,60,6,3584,2304,32,32,256,32,4,3,2663.354333333333,3
w13,16,60,6,3584,2304,32,32,256,32,8,3,2662.671,3
w13,16,60,8,2048,1536,16,16,256,1,4,3,1014.5446666666667,3
w13,16,60,8,2048,1536,16,16,256,1,4,4,1022.5756666666666,3
w13,16,60,8,2048,1536,16,16,256,1,8,3,1017.7980000000001,3
w13,16,60,8,2048,1536,16,16,256,1,8,4,1023.6646666666666,3
w13,16,60,8,2048,1536,16,16,256,4,4,3,1013.68,3
w13,16,60,8,2048,1536,16,16,256,4,4,4,1021.5523333333334,3
w13,16,60,8,2048,1536,16,16,256,4,8,3,1017.3393333333333,3
w13,16,60,8,2048,1536,16,16,256,4,8,4,1022.7579999999999,3
w13,16,60,8,2048,1536,16,32,256,1,4,3,1019.409,3
w13,16,60,8,2048,1536,16,32,256,1,4,4,1020.9016666666666,3
w13,16,60,8,2048,1536,16,32,256,1,8,3,1020.3476666666667,3
w13,16,60,8,2048,1536,16,32,256,1,8,4,1022.1716666666666,3
w13,16,60,8,2048,1536,16,32,256,16,4,3,1016.752,3
w13,16,60,8,2048,1536,16,32,256,16,4,4,1022.2673333333332,3
w13,16,60,8,2048,1536,16,32,256,16,8,3,1018.7583333333333,3
w13,16,60,8,2048,1536,16,32,256,16,8,4,1023.5369999999999,3
w13,16,60,8,2048,1536,16,32,256,32,4,3,1016.326,3
w13,16,60,8,2048,1536,16,32,256,32,4,4,1022.7256666666667,3
w13,16,60,8,2048,1536,16,32,256,32,8,3,1018.1393333333334,3
w13,16,60,8,2048,1536,16,32,256,64,4,3,1017.2113333333333,3
w13,16,60,8,2048,1536,16,32,256,64,8,3,1018.6619999999999,3
w13,16,60,8,2048,1536,32,32,256,1,4,3,1019.5156666666667,3
w13,16,60,8,2048,1536,32,32,256,1,4,4,1022.9923333333332,3
w13,16,60,8,2048,1536,32,32,256,1,8,3,1018.8113333333334,3
w13,16,60,8,2048,1536,32,32,256,1,8,4,1022.8333333333334,3
w13,16,60,8,2048,1536,32,32,256,4,4,3,1019.302,3
w13,16,60,8,2048,1536,32,32,256,4,8,3,1018.6943333333334,3
w13,16,60,8,2048,1536,32,32,256,16,4,3,1021.6063333333333,3
w13,16,60,8,2048,1536,32,32,256,16,8,3,1021.4033333333333,3
w13,16,60,8,2048,1536,32,32,256,32,4,3,1022.801,3
w13,16,60,8,2048,1536,32,32,256,32,8,3,1022.3636666666666,3
w13,16,60,8,2048,1536,64,32,256,1,8,3,1023.5583333333334,3
w13,16,64,6,3072,2048,16,16,256,1,4,3,2151.7713333333336,3
w13,16,64,6,3072,2048,16,16,256,1,8,3,2159.5156666666667,3
w13,16,64,6,3072,2048,16,16,256,4,4,3,2150.0433333333335,3
w13,16,64,6,3072,2048,16,16,256,4,8,3,2159.590333333333,3
w13,16,64,6,3072,2048,16,32,256,32,4,3,2169.393,3
w13,16,64,6,3072,2048,16,32,256,64,4,3,2170.7476666666666,3
w13,16,64,6,3072,2048,32,32,256,1,4,3,2160.1126666666664,3
w13,16,64,6,3072,2048,32,32,256,1,8,3,2159.11,3
w13,16,64,6,3072,2048,32,32,256,4,4,3,2161.552666666667,3
w13,16,64,6,3072,2048,32,32,256,4,8,3,2160.432666666667,3
w13,16,64,6,3072,2048,32,32,256,16,4,3,2163.184333333333,3
w13,16,64,6,3072,2048,32,32,256,16,8,3,2163.0139999999997,3
w13,16,64,6,3072,2048,32,32,256,32,4,3,2164.764,3
w13,16,64,6,3072,2048,32,32,256,32,8,3,2165.19,3
w13,16,64,6,3584,1536,16,16,256,1,4,3,1885.7703333333332,3
w13,16,64,6,3584,1536,16,16,256,1,8,3,1895.371,3
w13,16,64,6,3584,1536,16,16,256,4,4,3,1885.0349999999999,3
w13,16,64,6,3584,1536,16,16,256,4,8,3,1895.0296666666666,3
w13,16,64,6,3584,1536,16,32,256,1,4,3,1899.765666666667,3
w13,16,64,6,3584,1536,16,32,256,1,8,3,1902.9656666666667,3
w13,16,64,6,3584,1536,16,32,256,16,4,3,1899.7443333333333,3
w13,16,64,6,3584,1536,16,32,256,16,8,3,1903.7226666666666,3
w13,16,64,6,3584,1536,16,32,256,32,4,3,1900.0109999999997,3
w13,16,64,6,3584,1536,16,32,256,32,8,3,1904.0,3
w13,16,64,6,3584,1536,16,32,256,64,4,3,1899.3386666666665,3
w13,16,64,6,3584,1536,32,32,256,1,4,3,1890.0266666666666,3
w13,16,64,6,3584,1536,32,32,256,1,8,3,1888.9710000000002,3
w13,16,64,6,3584,1536,32,32,256,4,4,3,1891.296,3
w13,16,64,6,3584,1536,32,32,256,4,8,3,1890.5283333333334,3
w13,16,64,6,3584,1536,32,32,256,16,4,3,1893.8776666666665,3
w13,16,64,6,3584,1536,32,32,256,16,8,3,1892.96,3
w13,16,64,6,3584,1536,32,32,256,32,4,3,1894.2616666666665,3
w13,16,64,6,3584,1536,32,32,256,32,8,3,1893.184,3
w13,16,64,8,3584,2560,16,16,256,1,4,3,3140.5716666666667,3
w13,16,64,8,3584,2560,16,16,256,1,8,3,3155.9739999999997,3
w13,16,64,8,3584,2560,16,16,256,4,4,3,3140.0916666666667,3
w13,16,64,8,3584,2560,16,16,256,4,8,3,3157.1476666666663,3
w13,16,64,8,3584,2560,16,32,256,1,4,3,3168.9553333333333,3
w13,16,64,8,3584,2560,16,32,256,1,8,3,3170.4493333333335,3
w13,16,64,8,3584,2560,16,32,256,16,4,3,3164.9773333333337,3
w13,16,64,8,3584,2560,16,32,256,32,4,3,3163.836,3
w13,16,64,8,3584,2560,16,32,256,64,4,3,3169.5,3
w13,16,64,8,3584,2560,32,32,256,1,4,3,3151.068333333333,3
w13,16,64,8,3584,2560,32,32,256,1,8,3,3150.3430000000003,3
w13,16,64,8,3584,2560,32,32,256,4,4,3,3152.199,3
w13,16,64,8,3584,2560,32,32,256,4,8,3,3151.356333333333,3
w13,16,64,8,3584,2560,32,32,256,16,4,3,3156.796333333333,3
w13,16,64,8,3584,2560,32,32,256,16,8,3,3155.036666666667,3
w13,16,64,8,3584,2560,32,32,256,32,4,3,3159.388333333334,3
w13,16,64,8,3584,2560,32,32,256,32,8,3,3157.4149999999995,3
w13,16,128,4,2048,512,16,16,256,1,4,3,362.5973333333333,3
w13,16,128,4,2048,512,16,16,256,1,4,4,364.79466666666667,3
w13,16,128,4,2048,512,16,16,256,1,8,3,364.33633333333336,3
w13,16,128,4,2048,512,16,16,256,4,4,3,362.72566666666665,3
w13,16,128,4,2048,512,16,16,256,4,4,4,364.6133333333333,3
w13,16,128,4,2048,512,16,32,256,1,4,2,361.349,3
w13,16,128,4,2048,512,16,32,256,1,4,3,364.4213333333333,3
w13,16,128,4,2048,512,16,32,256,1,4,4,364.63466666666665,3
w13,16,128,4,2048,512,16,32,256,1,8,3,364.453,3
w13,16,128,4,2048,512,16,32,256,16,4,3,364.04766666666666,3
w13,16,128,4,2048,512,16,32,256,16,4,4,364.63433333333336,3
w13,16,128,4,2048,512,16,32,256,16,8,3,364.24,3
w13,16,128,4,2048,512,16,32,256,32,4,3,364.06933333333336,3
w13,16,128,4,2048,512,16,32,256,32,4,4,364.9973333333333,3
w13,16,128,4,2048,512,16,32,256,64,4,3,364.12266666666665,3
w13,16,128,4,2048,512,16,32,256,64,4,4,364.9546666666667,3
w13,16,128,4,2048,512,16,64,256,1,4,2,362.23499999999996,3
w13,16,128,4,2048,512,32,32,128,1,4,2,363.6746666666666,3
w13,16,128,4,2048,512,32,32,256,1,4,2,362.0,3
w13,16,128,4,2048,512,32,32,256,1,4,3,364.7093333333334,3
w13,16,128,4,2048,512,32,32,256,1,8,3,363.941,3
w13,16,128,4,2048,512,32,32,256,4,4,3,364.83733333333333,3
w13,16,128,4,2048,512,32,32,256,4,8,3,364.368,3
w13,16,128,4,2048,512,32,32,256,16,4,3,364.5493333333333,3
w13,16,128,4,2048,512,32,32,256,16,8,3,363.81300000000005,3
w13,16,128,4,2048,512,32,32,256,32,8,3,364.48533333333336,3
w13,16,128,4,2048,512,32,64,256,1,4,2,363.5896666666667,3
w13,16,128,6,4096,2048,16,16,256,1,4,3,4303.200333333333,3
w13,16,128,6,4096,2048,16,16,256,1,4,4,4333.045,3
w13,16,128,6,4096,2048,16,16,256,1,8,3,4314.143666666667,3
w13,16,128,6,4096,2048,16,16,256,1,8,4,4336.298333333333,3
w13,16,128,6,4096,2048,16,16,256,4,4,3,4295.637,3
w13,16,128,6,4096,2048,16,16,256,4,4,4,4327.359666666666,3
w13,16,128,6,4096,2048,16,16,256,4,8,3,4309.994333333333,3
w13,16,128,6,4096,2048,16,16,256,4,8,4,4334.026333333334,3
w13,16,128,6,4096,2048,16,32,256,1,4,4,4336.438333333333,3
w13,16,128,6,4096,2048,16,32,256,1,8,3,4335.104666666666,3
w13,16,128,6,4096,2048,16,32,256,16,4,3,4321.3876666666665,3
w13,16,128,6,4096,2048,16,32,256,16,4,4,4334.9563333333335,3
w13,16,128,6,4096,2048,16,32,256,16,8,3,4325.003333333333,3
w13,16,128,6,4096,2048,16,32,256,16,8,4,4338.411666666667,3
w13,16,128,6,4096,2048,16,32,256,32,4,3,4321.227333333333,3
w13,16,128,6,4096,2048,16,32,256,32,4,4,4336.3206666666665,3
w13,16,128,6,4096,2048,16,32,256,32,8,3,4326.091666666666,3
w13,16,128,6,4096,2048,16,32,256,64,4,3,4323.211333333333,3
w13,16,128,6,4096,2048,16,32,256,64,4,4,4337.409333333333,3
w13,16,128,6,4096,2048,16,32,256,64,8,3,4324.758333333334,3
w13,16,128,6,4096,2048,32,32,256,1,4,3,4325.547333333333,3
w13,16,128,6,4096,2048,32,32,256,1,8,3,4325.238333333334,3
w13,16,128,6,4096,2048,32,32,256,4,4,3,4325.27,3
w13,16,128,6,4096,2048,32,32,256,4,8,3,4324.203666666667,3
w13,16,128,6,4096,2048,32,32,256,16,4,3,4328.161,3
w13,16,128,6,4096,2048,32,32,256,16,8,3,4327.7660000000005,3
w13,16,128,6,4096,2048,32,32,256,32,4,3,4330.059333333334,3
w13,16,128,6,4096,2048,32,32,256,32,8,3,4329.612,3
w13,16,128,8,2048,768,16,16,256,1,4,3,1080.11,3
w13,16,128,8,2048,768,16,16,256,1,4,4,1087.5226666666667,3
w13,16,128,8,2048,768,16,16,256,1,8,3,1083.523,3
w13,16,128,8,2048,768,16,16,256,1,8,4,1089.2506666666666,3
w13,16,128,8,2048,768,16,16,256,4,4,3,1079.7366666666667,3
w13,16,128,8,2048,768,16,16,256,4,4,4,1086.4033333333334,3
w13,16,128,8,2048,768,16,16,256,4,8,3,1083.2883333333332,3
w13,16,128,8,2048,768,16,16,256,4,8,4,1088.8243333333332,3
w13,16,128,8,2048,768,16,32,256,1,4,3,1083.3306666666667,3
w13,16,128,8,2048,768,16,32,256,1,4,4,1086.3493333333333,3
w13,16,128,8,2048,768,16,32,256,1,8,3,1084.2700000000002,3
w13,16,128,8,2048,768,16,32,256,1,8,4,1088.0666666666668,3
w13,16,128,8,2048,768,16,32,256,16,4,3,1080.5683333333334,3
w13,16,128,8,2048,768,16,32,256,16,4,4,1086.4886666666666,3
w13,16,128,8,2048,768,16,32,256,16,8,3,1082.435,3
w13,16,128,8,2048,768,16,32,256,16,8,4,1087.8426666666667,3
w13,16,128,8,2048,768,16,32,256,32,4,3,1081.2936666666667,3
w13,16,128,8,2048,768,16,32,256,32,4,4,1087.3736666666666,3
w13,16,128,8,2048,768,16,32,256,32,8,3,1082.8403333333333,3
w13,16,128,8,2048,768,16,32,256,32,8,4,1088.7496666666666,3
w13,16,128,8,2048,768,16,32,256,64,4,3,1081.699,3
w13,16,128,8,2048,768,16,32,256,64,4,4,1087.8006666666668,3
w13,16,128,8,2048,768,16,32,256,64,8,3,1082.6163333333334,3
w13,16,128,8,2048,768,16,32,256,64,8,4,1089.6243333333334,3
w13,16,128,8,2048,768,16,64,256,1,4,3,1089.7943333333333,3
w13,16,128,8,2048,768,16,64,256,1,8,3,1089.4433333333334,3
w13,16,128,8,2048,768,16,64,256,16,4,3,1089.0166666666667,3
w13,16,128,8,2048,768,16,64,256,16,8,3,1089.1336666666666,3
w13,16,128,8,2048,768,16,64,256,32,4,3,1089.8486666666665,3
w13,16,128,8,2048,768,16,64,256,32,8,3,1088.9953333333333,3
w13,16,128,8,2048,768,16,64,256,64,4,3,1090.1893333333335,3
w13,16,128,8,2048,768,16,64,256,64,8,3,1089.827,3
w13,16,128,8,2048,768,32,32,256,1,4,3,1085.155,3
w13,16,128,8,2048,768,32,32,256,1,4,4,1088.526,3
w13,16,128,8,2048,768,32,32,256,1,8,3,1084.0883333333334,3
w13,16,128,8,2048,768,32,32,256,1,8,4,1088.4186666666667,3
w13,16,128,8,2048,768,32,32,256,4,4,3,1084.3333333333333,3
w13,16,128,8,2048,768,32,32,256,4,4,4,1088.963,3
w13,16,128,8,2048,768,32,32,256,4,8,3,1084.3013333333336,3
w13,16,128,8,2048,768,32,32,256,4,8,4,1088.6963333333333,3
w13,16,128,8,2048,768,32,32,256,16,4,3,1085.4113333333332,3
w13,16,128,8,2048,768,32,32,256,16,4,4,1088.9313333333332,3
w13,16,128,8,2048,768,32,32,256,16,8,3,1085.1333333333332,3
w13,16,128,8,2048,768,32,32,256,16,8,4,1088.9840000000002,3
w13,16,128,8,2048,768,32,32,256,32,4,3,1086.9363333333333,3
w13,16,128,8,2048,768,32,32,256,32,4,4,1089.7740000000001,3
w13,16,128,8,2048,768,32,32,256,32,8,3,1086.4136666666666,3
w13,16,128,8,2048,768,32,32,256,32,8,4,1089.8799999999999,3
w13,16,128,8,2048,768,64,32,256,1,4,3,1090.4033333333334,3
w13,16,128,8,2048,768,64,32,256,1,8,3,1088.5896666666667,3
w13,16,128,8,4096,1536,16,16,256,1,4,3,4301.708666666666,3
w13,16,128,8,4096,1536,16,16,256,1,4,4,4333.367333333334,3
w13,16,128,8,4096,1536,16,16,256,1,8,3,4313.037,3
w13,16,128,8,4096,1536,16,16,256,1,8,4,4336.962666666667,3
w13,16,128,8,4096,1536,16,16,256,4,4,3,4301.452666666667,3
w13,16,128,8,4096,1536,16,16,256,4,4,4,4330.914333333333,3
w13,16,128,8,4096,1536,16,16,256,4,8,3,4315.138,3
w13,16,128,8,4096,1536,16,16,256,4,8,4,4337.901,3
w13,16,128,8,4096,1536,16,32,256,1,4,3,4336.5689999999995,3
w13,16,128,8,4096,1536,16,32,256,1,4,4,4336.782,3
w13,16,128,8,4096,1536,16,32,256,1,8,3,4335.203,3
w13,16,128,8,4096,1536,16,32,256,1,8,4,4340.569,3
w13,16,128,8,4096,1536,16,32,256,16,4,3,4328.174333333333,3
w13,16,128,8,4096,1536,16,32,256,16,4,4,4337.155333333333,3
w13,16,128,8,4096,1536,16,32,256,16,8,3,4331.0109999999995,3
w13,16,128,8,4096,1536,16,32,256,16,8,4,4341.507333333334,3
w13,16,128,8,4096,1536,16,32,256,32,4,3,4321.39,3
w13,16,128,8,4096,1536,16,32,256,32,4,4,4337.475666666666,3
w13,16,128,8,4096,1536,16,32,256,32,8,3,4323.065,3
w13,16,128,8,4096,1536,16,32,256,32,8,4,4341.081,3
w13,16,128,8,4096,1536,16,32,256,64,4,3,4324.728666666667,3
w13,16,128,8,4096,1536,16,32,256,64,4,4,4338.755666666667,3
w13,16,128,8,4096,1536,16,32,256,64,8,3,4326.094333333333,3
w13,16,128,8,4096,1536,16,32,256,64,8,4,4341.838,3
w13,16,128,8,4096,1536,32,32,256,1,4,3,4326.734,3
w13,16,128,8,4096,1536,32,32,256,1,4,4,4342.755666666667,3
w13,16,128,8,4096,1536,32,32,256,1,8,3,4325.166333333334,3
w13,16,128,8,4096,1536,32,32,256,1,8,4,4342.019666666667,3
w13,16,128,8,4096,1536,32,32,256,4,4,3,4328.184666666667,3
w13,16,128,8,4096,1536,32,32,256,4,4,4,4342.905,3
w13,16,128,8,4096,1536,32,32,256,4,8,3,4326.403333333333,3
w13,16,128,8,4096,1536,32,32,256,4,8,4,4342.115333333334,3
w13,16,128,8,4096,1536,32,32,256,16,4,3,4330.712666666667,3
w13,16,128,8,4096,1536,32,32,256,16,4,4,4342.723666666667,3
w13,16,128,8,4096,1536,32,32,256,16,8,3,4329.902,3
w13,16,128,8,4096,1536,32,32,256,16,8,4,4342.840666666666,3
w13,16,128,8,4096,1536,32,32,256,32,4,3,4332.227333333333,3
w13,16,128,8,4096,1536,32,32,256,32,4,4,4343.503333333333,3
w13,16,128,8,4096,1536,32,32,256,32,8,3,4330.308666666667,3
w13,16,128,8,4096,1536,32,32,256,32,8,4,4343.023,3
w13,16,128,8,4096,1536,64,32,256,1,4,3,4343.215666666667,3
w13,16,128,8,4096,1536,64,32,256,1,8,3,4340.026333333333,3
w13,16,128,8,4096,3072,16,16,256,1,4,3,8605.995333333332,3
w13,16,128,8,4096,3072,16,16,256,1,4,4,8659.585333333334,3
w13,16,128,8,4096,3072,16,16,256,1,8,3,8625.291666666666,3
w13,16,128,8,4096,3072,16,16,256,1,8,4,8664.705,3
w13,16,128,8,4096,3072,16,16,256,4,4,3,8605.483333333334,3
w13,16,128,8,4096,3072,16,16,256,4,4,4,8656.502333333332,3
w13,16,128,8,4096,3072,16,16,256,4,8,3,8631.179333333333,3
w13,16,128,8,4096,3072,16,16,256,4,8,4,8668.139666666668,3
w13,16,128,8,4096,3072,16,32,256,1,4,3,8681.910333333333,3
w13,16,128,8,4096,3072,16,32,256,1,4,4,8669.302666666668,3
w13,16,128,8,4096,3072,16,32,256,1,8,3,8670.892,3
w13,16,128,8,4096,3072,16,32,256,1,8,4,8675.329,3
w13,16,128,8,4096,3072,16,32,256,16,4,3,8657.152666666667,3
w13,16,128,8,4096,3072,16,32,256,16,4,4,8672.683666666666,3
w13,16,128,8,4096,3072,16,32,256,16,8,3,8664.384666666667,3
w13,16,128,8,4096,3072,16,32,256,16,8,4,8678.497333333333,3
w13,16,128,8,4096,3072,16,32,256,32,4,3,8636.907333333334,3
w13,16,128,8,4096,3072,16,32,256,32,4,4,8671.169,3
w13,16,128,8,4096,3072,16,32,256,32,8,3,8645.931333333334,3
w13,16,128,8,4096,3072,16,32,256,32,8,4,8677.899666666666,3
w13,16,128,8,4096,3072,16,32,256,64,4,3,8643.542,3
w13,16,128,8,4096,3072,16,32,256,64,4,4,8671.200666666666,3
w13,16,128,8,4096,3072,16,32,256,64,8,3,8646.475333333334,3
w13,16,128,8,4096,3072,16,32,256,64,8,4,8678.614666666666,3
w13,16,128,8,4096,3072,32,32,256,1,4,3,8649.689,3
w13,16,128,8,4096,3072,32,32,256,1,4,4,8678.874000000002,3
w13,16,128,8,4096,3072,32,32,256,1,8,3,8647.343,3
w13,16,128,8,4096,3072,32,32,256,1,8,4,8677.817666666668,3
w13,16,128,8,4096,3072,32,32,256,4,4,3,8651.011666666667,3
w13,16,128,8,4096,3072,32,32,256,4,4,4,8679.865666666667,3
w13,16,128,8,4096,3072,32,32,256,4,8,3,8649.337666666666,3
w13,16,128,8,4096,3072,32,32,256,4,8,4,8679.375333333333,3
w13,16,128,8,4096,3072,32,32,256,16,4,3,8657.721666666666,3
w13,16,128,8,4096,3072,32,32,256,16,4,4,8681.251666666665,3
w13,16,128,8,4096,3072,32,32,256,16,8,3,8656.249666666667,3
w13,16,128,8,4096,3072,32,32,256,16,8,4,8681.550666666668,3
w13,16,128,8,4096,3072,32,32,256,32,4,3,8659.556333333334,3
w13,16,128,8,4096,3072,32,32,256,32,4,4,8681.156333333332,3
w13,16,128,8,4096,3072,32,32,256,32,8,3,8658.052000000001,3
w13,16,128,8,4096,3072,32,32,256,32,8,4,8680.761333333334,3
w13,16,128,8,4096,3072,64,32,256,1,4,3,8680.325666666666,3
w13,16,128,8,4096,3072,64,32,256,1,8,3,8676.325666666666,3
w13,24,8,2,1024,512,16,64,64,1,4,4,5.655666666666666,3
w13,24,16,2,1536,768,16,64,32,1,4,3,17.139,3
w13,24,16,2,1536,768,16,64,32,1,4,4,17.266666666666666,3
w13,24,16,4,1536,1024,16,64,128,1,8,2,25.548999999999996,3
w13,24,16,4,1536,1024,16,128,128,1,8,2,25.612666666666666,3
w13,24,32,4,2048,768,16,32,256,1,4,2,265.742,3
w13,24,32,4,2048,768,16,64,256,1,4,2,266.44533333333334,3
w13,24,32,4,2048,768,32,32,128,1,4,2,267.6193333333333,3
w13,24,32,4,2048,768,32,32,256,1,4,2,266.9683333333333,3
w13,24,32,4,2048,768,32,64,256,1,4,2,267.92833333333334,3
w13,24,32,6,3072,1024,16,16,256,1,4,3,545.3703333333333,3
w13,24,32,6,3072,1024,16,16,256,1,8,3,548.4953333333333,3
w13,24,32,6,3072,1024,16,16,256,4,4,3,544.57,3
w13,24,32,6,3072,1024,16,16,256,4,8,3,547.8873333333332,3
w13,24,32,6,3072,1024,32,32,256,1,4,3,546.6823333333333,3
w13,24,32,6,3072,1024,32,32,256,1,8,3,546.458,3
w13,24,32,6,3072,1024,32,32,256,4,4,3,546.9060000000001,3
w13,24,32,6,3072,1024,32,32,256,4,8,3,546.4263333333333,3
w13,24,32,6,3072,1024,32,32,256,16,4,3,548.0369999999999,3
w13,24,32,6,3072,1024,32,32,256,16,8,3,547.4073333333333,3
w13,24,32,6,3072,1024,32,32,256,32,4,3,548.602,3
w13,24,32,6,3072,1024,32,32,256,32,8,3,548.1113333333334,3
w13,24,60,4,2048,1408,16,16,256,1,4,3,929.4503333333333,3
w13,24,60,4,2048,1408,16,16,256,1,4,4,936.6613333333333,3
w13,24,60,4,2048,1408,16,16,256,1,8,3,931.9253333333332,3
w13,24,60,4,2048,1408,16,16,256,1,8,4,938.1013333333334,3
w13,24,60,4,2048,1408,16,16,256,4,4,3,929.0666666666666,3
w13,24,60,4,2048,1408,16,16,256,4,4,4,935.5943333333333,3
w13,24,60,4,2048,1408,16,16,256,4,8,3,932.416,3
w13,24,60,4,2048,1408,16,16,256,4,8,4,937.866,3
w13,24,60,4,2048,1408,16,32,256,1,4,3,933.3756666666667,3
w13,24,60,4,2048,1408,16,32,256,1,4,4,934.9863333333333,3
w13,24,60,4,2048,1408,16,32,256,1,8,3,933.984,3
w13,24,60,4,2048,1408,16,32,256,1,8,4,936.6716666666666,3
w13,24,60,4,2048,1408,16,32,256,16,4,3,929.9086666666667,3
w13,24,60,4,2048,1408,16,32,256,16,4,4,935.1999999999999,3
w13,24,60,4,2048,1408,16,32,256,16,8,3,932.2666666666668,3
w13,24,60,4,2048,1408,16,32,256,16,8,4,936.5646666666667,3
w13,24,60,4,2048,1408,16,32,256,32,4,3,930.73,3
w13,24,60,4,2048,1408,16,32,256,32,4,4,936.2556666666666,3
w13,24,60,4,2048,1408,16,32,256,32,8,3,932.3093333333333,3
w13,24,60,4,2048,1408,16,32,256,32,8,4,937.6316666666667,3
w13,24,60,4,2048,1408,16,32,256,64,4,3,931.5193333333333,3
w13,24,60,4,2048,1408,16,32,256,64,4,4,937.1730000000001,3
w13,24,60,4,2048,1408,16,32,256,64,8,3,932.7463333333334,3
w13,24,60,4,2048,1408,16,64,256,16,4,3,937.4929999999999,3
w13,24,60,4,2048,1408,16,64,256,16,8,3,937.2796666666667,3
w13,24,60,4,2048,1408,16,64,256,32,4,3,938.0153333333334,3
w13,24,60,4,2048,1408,16,64,256,32,8,3,937.5783333333334,3
w13,24,60,4,2048,1408,32,32,256,1,4,3,933.674,3
w13,24,60,4,2048,1408,32,32,256,1,4,4,937.3866666666667,3
w13,24,60,4,2048,1408,32,32,256,1,8,3,933.0659999999999,3
w13,24,60,4,2048,1408,32,32,256,1,8,4,936.8746666666666,3
w13,24,60,4,2048,1408,32,32,256,4,4,3,934.1333333333333,3
w13,24,60,4,2048,1408,32,32,256,4,4,4,937.866,3
w13,24,60,4,2048,1408,32,32,256,4,8,3,933.344,3
w13,24,60,4,2048,1408,32,32,256,4,8,4,937.3543333333333,3
w13,24,60,4,2048,1408,32,32,256,16,4,3,934.8476666666667,3
w13,24,60,4,2048,1408,32,32,256,16,4,4,937.6853333333333,3
w13,24,60,4,2048,1408,32,32,256,16,8,3,934.2183333333332,3
w13,24,60,4,2048,1408,32,32,256,16,8,4,937.3226666666666,3
w13,24,60,4,2048,1408,32,32,256,32,4,3,936.085,3
w13,24,60,4,2048,1408,32,32,256,32,8,3,935.7543333333333,3
w13,24,60,4,2048,1408,64,32,256,1,8,3,937.4830000000001,3
w13,24,60,6,3584,2304,16,16,256,1,4,3,2652.208,3
w13,24,60,6,3584,2304,16,16,256,1,8,3,2665.349333333333,3
w13,24,60,6,3584,2304,16,16,256,4,4,3,2651.333,3
w13,24,60,6,3584,2304,16,16,256,4,8,3,2666.491,3
w13,24,60,6,3584,2304,16,32,256,32,4,3,2676.0166666666664,3
w13,24,60,6,3584,2304,16,32,256,64,4,3,2676.5176666666666,3
w13,24,60,6,3584,2304,32,32,256,1,4,3,2661.029,3
w13,24,60,6,3584,2304,32,32,256,1,8,3,2659.152,3
w13,24,60,6,3584,2304,32,32,256,4,4,3,2662.3946666666666,3
w13,24,60,6,3584,2304,32,32,256,4,8,3,2661.67,3
w13,24,60,6,3584,2304,32,32,256,16,4,3,2664.933666666667,3
w13,24,60,6,3584,2304,32,32,256,16,8,3,2664.347,3
w13,24,60,6,3584,2304,32,32,256,32,4,3,2666.651,3
w13,24,60,6,3584,2304,32,32,256,32,8,3,2666.7466666666664,3
w13,24,60,8,2048,1536,16,16,256,1,4,3,1016.3686666666666,3
w13,24,60,8,2048,1536,16,16,256,1,4,4,1024.8383333333334,3
w13,24,60,8,2048,1536,16,16,256,1,8,3,1019.5683333333333,3
w13,24,60,8,2048,1536,16,16,256,4,4,3,1015.6323333333333,3
w13,24,60,8,2048,1536,16,16,256,4,4,4,1023.601,3
w13,24,60,8,2048,1536,16,16,256,4,8,3,1020.486,3
w13,24,60,8,2048,1536,16,16,256,4,8,4,1025.7663333333333,3
w13,24,60,8,2048,1536,16,32,256,1,4,3,1022.5126666666666,3
w13,24,60,8,2048,1536,16,32,256,1,4,4,1023.8036666666667,3
w13,24,60,8,2048,1536,16,32,256,1,8,3,1023.1743333333334,3
w13,24,60,8,2048,1536,16,32,256,1,8,4,1024.5286666666668,3
w13,24,60,8,2048,1536,16,32,256,16,4,3,1019.9846666666666,3
w13,24,60,8,2048,1536,16,32,256,16,4,4,1025.1043333333334,3
w13,24,60,8,2048,1536,16,32,256,16,8,3,1021.788,3
w13,24,60,8,2048,1536,16,32,256,32,4,3,1021.0836666666668,3
w13,24,60,8,2048,1536,16,32,256,32,8,3,1023.3556666666667,3
w13,24,60,8,2048,1536,16,32,256,64,4,3,1022.747,3
w13,24,60,8,2048,1536,16,32,256,64,8,3,1023.1846666666667,3
w13,24,60,8,2048,1536,32,32,256,1,4,3,1021.4463333333333,3
w13,24,60,8,2048,1536,32,32,256,1,4,4,1025.084,3
w13,24,60,8,2048,1536,32,32,256,1,8,3,1021.0096666666667,3
w13,24,60,8,2048,1536,32,32,256,1,8,4,1025.3296666666668,3
w13,24,60,8,2048,1536,32,32,256,4,4,3,1021.8626666666665,3
w13,24,60,8,2048,1536,32,32,256,4,8,3,1021.1903333333333,3
w13,24,60,8,2048,1536,32,32,256,16,4,3,1024.1876666666667,3
w13,24,60,8,2048,1536,32,32,256,16,8,3,1023.6753333333332,3
w13,24,60,8,2048,1536,32,32,256,32,8,3,1025.8626666666667,3
w13,24,64,6,3072,2048,16,16,256,1,4,3,2154.7906666666663,3
w13,24,64,6,3072,2048,16,16,256,1,8,3,2162.2893333333336,3
w13,24,64,6,3072,2048,16,16,256,4,4,3,2153.5853333333334,3
w13,24,64,6,3072,2048,16,16,256,4,8,3,2162.4173333333333,3
w13,24,64,6,3072,2048,32,32,256,1,4,3,2163.7186666666666,3
w13,24,64,6,3072,2048,32,32,256,1,8,3,2162.0546666666664,3
w13,24,64,6,3072,2048,32,32,256,4,4,3,2164.764,3
w13,24,64,6,3072,2048,32,32,256,4,8,3,2163.996,3
w13,24,64,6,3072,2048,32,32,256,16,4,3,2167.932333333333,3
w13,24,64,6,3072,2048,32,32,256,16,8,3,2167.047,3
w13,24,64,6,3072,2048,32,32,256,32,4,3,2169.9483333333333,3
w13,24,64,6,3072,2048,32,32,256,32,8,3,2169.4893333333334,3
w13,24,64,6,3584,1536,16,16,256,1,4,3,1888.0863333333334,3
w13,24,64,6,3584,1536,16,16,256,1,8,3,1897.3983333333333,3
w13,24,64,6,3584,1536,16,16,256,4,4,3,1887.3713333333333,3
w13,24,64,6,3584,1536,16,16,256,4,8,3,1897.2596666666668,3
w13,24,64,6,3584,1536,16,32,256,1,4,3,1903.7663333333333,3
w13,24,64,6,3584,1536,16,32,256,1,8,3,1906.3686666666665,3
w13,24,64,6,3584,1536,16,32,256,16,4,3,1903.8516666666667,3
w13,24,64,6,3584,1536,16,32,256,32,4,3,1903.5743333333332,3
w13,24,64,6,3584,1536,16,32,256,64,4,3,1904.385,3
w13,24,64,6,3584,1536,32,32,256,1,4,3,1893.334,3
w13,24,64,6,3584,1536,32,32,256,1,8,3,1891.9800000000002,3
w13,24,64,6,3584,1536,32,32,256,4,4,3,1894.2086666666667,3
w13,24,64,6,3584,1536,32,32,256,4,8,3,1893.046,3
w13,24,64,6,3584,1536,32,32,256,16,4,3,1897.5690000000002,3
w13,24,64,6,3584,1536,32,32,256,16,8,3,1896.1076666666668,3
w13,24,64,6,3584,1536,32,32,256,32,4,3,1898.6566666666665,3
w13,24,64,6,3584,1536,32,32,256,32,8,3,1897.5686666666668,3
w13,24,64,8,3584,2560,16,16,256,1,4,3,3146.1626666666666,3
w13,24,64,8,3584,2560,16,16,256,1,8,3,3160.2003333333328,3
w13,24,64,8,3584,2560,16,16,256,4,4,3,3145.565,3
w13,24,64,8,3584,2560,16,16,256,4,8,3,3163.1440000000002,3
w13,24,64,8,3584,2560,16,32,256,32,4,3,3174.536666666667,3
w13,24,64,8,3584,2560,32,32,256,1,4,3,3156.67,3
w13,24,64,8,3584,2560,32,32,256,1,8,3,3154.696,3
w13,24,64,8,3584,2560,32,32,256,4,4,3,3157.5653333333335,3
w13,24,64,8,3584,2560,32,32,256,4,8,3,3156.2856666666667,3
w13,24,64,8,3584,2560,32,32,256,16,4,3,3164.8619999999996,3
w13,24,64,8,3584,2560,32,32,256,16,8,3,3162.6,3
w13,24,64,8,3584,2560,32,32,256,32,4,3,3166.3656666666666,3
w13,24,64,8,3584,2560,32,32,256,32,8,3,3164.6270000000004,3
w13,24,128,4,2048,512,16,16,256,1,4,3,541.4043333333333,3
w13,24,128,4,2048,512,16,16,256,1,4,4,545.298,3
w13,24,128,4,2048,512,16,16,256,1,8,3,543.8149999999999,3
w13,24,128,4,2048,512,16,16,256,1,8,4,546.2253333333333,3
w13,24,128,4,2048,512,16,16,256,4,4,3,542.0763333333333,3
w13,24,128,4,2048,512,16,16,256,4,4,4,545.959,3
w13,24,128,4,2048,512,16,16,256,4,8,3,543.975,3
w13,24,128,4,2048,512,16,16,256,4,8,4,546.695,3
w13,24,128,4,2048,512,16,32,256,1,4,3,543.879,3
w13,24,128,4,2048,512,16,32,256,1,4,4,545.2869999999999,3
w13,24,128,4,2048,512,16,32,256,1,8,3,544.935,3
w13,24,128,4,2048,512,16,32,256,1,8,4,545.788,3
w13,24,128,4,2048,512,16,32,256,16,4,3,542.7053333333333,3
w13,24,128,4,2048,512,16,32,256,16,4,4,544.7536666666666,3
w13,24,128,4,2048,512,16,32,256,16,8,3,543.6656666666667,3
w13,24,128,4,2048,512,16,32,256,16,8,4,545.9803333333333,3
w13,24,128,4,2048,512,16,32,256,32,4,3,542.9083333333333,3
w13,24,128,4,2048,512,16,32,256,32,4,4,545.4153333333334,3
w13,24,128,4,2048,512,16,32,256,32,8,3,543.719,3
w13,24,128,4,2048,512,16,32,256,32,8,4,546.503,3
w13,24,128,4,2048,512,16,32,256,64,4,3,543.4520000000001,3
w13,24,128,4,2048,512,16,32,256,64,4,4,545.7883333333334,3
w13,24,128,4,2048,512,16,32,256,64,8,3,544.0496666666667,3
w13,24,128,4,2048,512,16,32,256,64,8,4,546.407,3
w13,24,128,4,2048,512,32,32,256,1,4,3,544.082,3
w13,24,128,4,2048,512,32,32,256,1,4,4,546.439,3
w13,24,128,4,2048,512,32,32,256,1,8,3,543.9323333333333,3
w13,24,128,4,2048,512,32,32,256,1,8,4,546.311,3
w13,24,128,4,2048,512,32,32,256,4,4,3,544.5723333333334,3
w13,24,128,4,2048,512,32,32,256,4,8,3,544.231,3
w13,24,128,4,2048,512,32,32,256,16,4,3,544.6366666666667,3
w13,24,128,4,2048,512,32,32,256,16,4,4,546.599,3
w13,24,128,4,2048,512,32,32,256,16,8,3,544.135,3
w13,24,128,4,2048,512,32,32,256,16,8,4,546.4176666666667,3
w13,24,128,4,2048,512,32,32,256,32,4,3,545.543,3
w13,24,128,4,2048,512,32,32,256,32,4,4,546.7483333333333,3
w13,24,128,4,2048,512,32,32,256,32,8,3,544.5616666666666,3
w13,24,128,6,4096,2048,16,16,256,1,4,3,5736.769333333334,3
w13,24,128,6,4096,2048,16,16,256,1,4,4,5777.463,3
w13,24,128,6,4096,2048,16,16,256,1,8,3,5748.246666666666,3
w13,24,128,6,4096,2048,16,16,256,1,8,4,5781.058,3
w13,24,128,6,4096,2048,16,16,256,4,4,3,5725.463333333333,3
w13,24,128,6,4096,2048,16,16,256,4,4,4,5768.93,3
w13,24,128,6,4096,2048,16,16,256,4,8,3,5745.303333333333,3
w13,24,128,6,4096,2048,16,16,256,4,8,4,5777.463,3
w13,24,128,6,4096,2048,16,32,256,1,4,4,5781.772666666667,3
w13,24,128,6,4096,2048,16,32,256,1,8,3,5780.332666666666,3
w13,24,128,6,4096,2048,16,32,256,16,4,3,5761.068333333334,3
w13,24,128,6,4096,2048,16,32,256,16,4,4,5779.404333333333,3
w13,24,128,6,4096,2048,16,32,256,16,8,3,5768.481666666667,3
w13,24,128,6,4096,2048,16,32,256,32,4,3,5759.809666666667,3
w13,24,128,6,4096,2048,16,32,256,32,4,4,5781.826,3
w13,24,128,6,4096,2048,16,32,256,32,8,3,5764.567333333333,3
w13,24,128,6,4096,2048,16,32,256,64,4,3,5761.922,3
w13,24,128,6,4096,2048,16,32,256,64,4,4,5782.594333333333,3
w13,24,128,6,4096,2048,16,32,256,64,8,3,5765.111,3
w13,24,128,6,4096,2048,32,32,256,1,4,3,5766.434666666667,3
w13,24,128,6,4096,2048,32,32,256,1,8,3,5766.456333333333,3
w13,24,128,6,4096,2048,32,32,256,4,4,3,5765.656333333333,3
w13,24,128,6,4096,2048,32,32,256,4,8,3,5764.812999999999,3
w13,24,128,6,4096,2048,32,32,256,16,4,3,5770.9039999999995,3
w13,24,128,6,4096,2048,32,32,256,16,8,3,5770.392333333333,3
w13,24,128,6,4096,2048,32,32,256,32,4,3,5773.486,3
w13,24,128,6,4096,2048,32,32,256,32,8,3,5772.952666666667,3
w13,24,128,8,2048,768,16,16,256,1,4,3,1081.1126666666667,3
w13,24,128,8,2048,768,16,16,256,1,4,4,1088.0563333333332,3
w13,24,128,8,2048,768,16,16,256,1,8,3,1083.523,3
w13,24,128,8,2048,768,16,16,256,1,8,4,1090.1043333333334,3
w13,24,128,8,2048,768,16,16,256,4,4,3,1079.8966666666665,3
w13,24,128,8,2048,768,16,16,256,4,4,4,1087.0856666666666,3
w13,24,128,8,2048,768,16,16,256,4,8,3,1083.512,3
w13,24,128,8,2048,768,16,16,256,4,8,4,1089.5713333333333,3
w13,24,128,8,2048,768,16,32,256,1,4,3,1083.832666666667,3
w13,24,128,8,2048,768,16,32,256,1,4,4,1087.0216666666668,3
w13,24,128,8,2048,768,16,32,256,1,8,3,1085.1013333333333,3
w13,24,128,8,2048,768,16,32,256,1,8,4,1088.8033333333333,3
w13,24,128,8,2048,768,16,32,256,16,4,3,1080.4293333333333,3
w13,24,128,8,2048,768,16,32,256,16,4,4,1086.9366666666667,3
w13,24,128,8,2048,768,16,32,256,16,8,3,1082.2433333333333,3
w13,24,128,8,2048,768,16,32,256,16,8,4,1088.622,3
w13,24,128,8,2048,768,16,32,256,32,4,3,1081.0693333333334,3
w13,24,128,8,2048,768,16,32,256,32,4,4,1088.4296666666667,3
w13,24,128,8,2048,768,16,32,256,32,8,3,1083.32,3
w13,24,128,8,2048,768,16,32,256,32,8,4,1089.6246666666666,3
w13,24,128,8,2048,768,16,32,256,64,4,3,1083.2566666666667,3
w13,24,128,8,2048,768,16,32,256,64,4,4,1090.307,3
w13,24,128,8,2048,768,16,32,256,64,8,3,1085.134,3
w13,24,128,8,2048,768,16,64,256,1,8,3,1090.4566666666667,3
w13,24,128,8,2048,768,16,64,256,16,4,3,1089.9016666666666,3
w13,24,128,8,2048,768,16,64,256,16,8,3,1089.1866666666667,3
w13,24,128,8,2048,768,16,64,256,32,4,3,1090.1146666666666,3
w13,24,128,8,2048,768,16,64,256,32,8,3,1090.1153333333334,3
w13,24,128,8,2048,768,32,32,256,1,4,3,1086.0829999999999,3
w13,24,128,8,2048,768,32,32,256,1,4,4,1089.5283333333334,3
w13,24,128,8,2048,768,32,32,256,1,8,3,1085.0913333333333,3
w13,24,128,8,2048,768,32,32,256,1,8,4,1089.422,3
w13,24,128,8,2048,768,32,32,256,4,4,3,1085.8693333333333,3
w13,24,128,8,2048,768,32,32,256,4,4,4,1090.254,3
w13,24,128,8,2048,768,32,32,256,4,8,3,1084.8566666666666,3
w13,24,128,8,2048,768,32,32,256,4,8,4,1089.7416666666666,3
w13,24,128,8,2048,768,32,32,256,16,4,3,1086.7553333333333,3
w13,24,128,8,2048,768,32,32,256,16,4,4,1089.6993333333332,3
w13,24,128,8,2048,768,32,32,256,16,8,3,1086.4566666666667,3
w13,24,128,8,2048,768,32,32,256,16,8,4,1089.3896666666667,3
w13,24,128,8,2048,768,32,32,256,32,4,3,1088.067,3
w13,24,128,8,2048,768,32,32,256,32,8,3,1087.47,3
w13,24,128,8,2048,768,32,32,256,32,8,4,1090.67,3
w13,24,128,8,2048,768,64,32,256,1,8,3,1090.7553333333333,3
w13,24,128,8,4096,1536,16,16,256,1,4,3,4300.615,3
w13,24,128,8,4096,1536,16,16,256,1,4,4,4336.007333333334,3
w13,24,128,8,4096,1536,16,16,256,1,8,3,4312.903333333333,3
w13,24,128,8,4096,1536,16,16,256,1,8,4,4338.620333333333,3
w13,24,128,8,4096,1536,16,16,256,4,4,3,4299.559,3
w13,24,128,8,4096,1536,16,16,256,4,4,4,4337.661,3
w13,24,128,8,4096,1536,16,16,256,4,8,3,4315.794333333333,3
w13,24,128,8,4096,1536,16,32,256,1,4,3,4337.981000000001,3
w13,24,128,8,4096,1536,16,32,256,1,4,4,4339.548666666667,3
w13,24,128,8,4096,1536,16,32,256,1,8,3,4338.312,3
w13,24,128,8,4096,1536,16,32,256,1,8,4,4342.919666666667,3
w13,24,128,8,4096,1536,16,32,256,16,4,3,4333.821,3
w13,24,128,8,4096,1536,16,32,256,16,4,4,4342.087666666666,3
w13,24,128,8,4096,1536,16,32,256,16,8,3,4338.162,3
w13,24,128,8,4096,1536,16,32,256,32,4,3,4328.711,3
w13,24,128,8,4096,1536,16,32,256,32,4,4,4342.247666666666,3
w13,24,128,8,4096,1536,16,32,256,32,8,3,4330.674333333333,3
w13,24,128,8,4096,1536,16,32,256,64,4,3,4331.676666666666,3
w13,24,128,8,4096,1536,16,32,256,64,8,3,4334.845333333334,3
w13,24,128,8,4096,1536,32,32,256,1,4,3,4328.019,3
w13,24,128,8,4096,1536,32,32,256,1,8,3,4327.474666666666,3
w13,24,128,8,4096,1536,32,32,256,4,4,3,4329.928,3
w13,24,128,8,4096,1536,32,32,256,4,8,3,4329.651,3
w13,24,128,8,4096,1536,32,32,256,16,4,3,4335.016666666666,3
w13,24,128,8,4096,1536,32,32,256,16,8,3,4334.312,3
w13,24,128,8,4096,1536,32,32,256,32,4,3,4337.331333333333,3
w13,24,128,8,4096,1536,32,32,256,32,8,3,4335.742,3
w13,24,128,8,4096,3072,16,16,256,1,4,3,8603.797,3
w13,24,128,8,4096,3072,16,16,256,1,4,4,8664.597666666667,3
w13,24,128,8,4096,3072,16,16,256,1,8,3,8623.370333333334,3
w13,24,128,8,4096,3072,16,16,256,1,8,4,8670.229666666666,3
w13,24,128,8,4096,3072,16,16,256,4,4,3,8602.452666666666,3
w13,24,128,8,4096,3072,16,16,256,4,4,4,8668.074999999999,3
w13,24,128,8,4096,3072,16,16,256,4,8,3,8629.973666666667,3
w13,24,128,8,4096,3072,16,16,256,4,8,4,8674.23,3
w13,24,128,8,4096,3072,16,32,256,1,4,3,8680.906666666668,3
w13,24,128,8,4096,3072,16,32,256,1,4,4,8673.824666666666,3
w13,24,128,8,4096,3072,16,32,256,1,8,3,8676.853666666668,3
w13,24,128,8,4096,3072,16,32,256,1,8,4,8679.659666666666,3
w13,24,128,8,4096,3072,16,32,256,16,4,3,8657.493333333334,3
w13,24,128,8,4096,3072,16,32,256,16,4,4,8679.712333333333,3
w13,24,128,8,4096,3072,16,32,256,16,8,3,8662.923,3
w13,24,128,8,4096,3072,16,32,256,16,8,4,8686.112333333333,3
w13,24,128,8,4096,3072,16,32,256,32,4,3,8636.383333333333,3
w13,24,128,8,4096,3072,16,32,256,32,4,4,8680.821666666667,3
w13,24,128,8,4096,3072,16,32,256,32,8,3,8649.216333333332,3
w13,24,128,8,4096,3072,16,32,256,32,8,4,8687.542333333333,3
w13,24,128,8,4096,3072,16,32,256,64,4,3,8640.853333333333,3
w13,24,128,8,4096,3072,16,32,256,64,4,4,8680.523666666668,3
w13,24,128,8,4096,3072,16,32,256,64,8,3,8656.31,3
w13,24,128,8,4096,3072,16,32,256,64,8,4,8686.560666666666,3
w13,24,128,8,4096,3072,32,32,256,1,4,3,8652.759666666667,3
w13,24,128,8,4096,3072,32,32,256,1,4,4,8683.788999999999,3
w13,24,128,8,4096,3072,32,32,256,1,8,3,8651.544,3
w13,24,128,8,4096,3072,32,32,256,1,8,4,8683.117666666667,3
w13,24,128,8,4096,3072,32,32,256,4,4,3,8657.186666666666,3
w13,24,128,8,4096,3072,32,32,256,4,4,4,8685.186666666666,3
w13,24,128,8,4096,3072,32,32,256,4,8,3,8654.904,3
w13,24,128,8,4096,3072,32,32,256,4,8,4,8684.930333333334,3
w13,24,128,8,4096,3072,32,32,256,16,4,3,8666.391666666666,3
w13,24,128,8,4096,3072,32,32,256,16,4,4,8688.813666666667,3
w13,24,128,8,4096,3072,32,32,256,16,8,3,8663.448,3
w13,24,128,8,4096,3072,32,32,256,32,4,3,8668.707,3
w13,24,128,8,4096,3072,32,32,256,32,8,3,8667.276666666667,3
w13,24,128,8,4096,3072,64,32,256,1,4,3,8687.811,3
w13,24,128,8,4096,3072,64,32,256,1,8,3,8681.976999999999,3
w13,32,8,2,1024,512,16,64,64,1,4,4,5.794,3
w13,32,8,2,1024,512,16,64,64,16,4,4,5.847333333333332,3
w13,32,8,2,1024,512,16,64,64,32,4,4,5.815333333333332,3
w13,32,8,2,1024,512,16,64,64,64,4,4,5.794333333333333,3
w13,32,16,2,1536,768,16,64,32,1,4,3,17.50166666666667,3
w13,32,16,2,1536,768,16,64,32,1,4,4,17.608,3
w13,32,16,4,1536,1024,16,64,128,16,8,2,25.697999999999997,3
w13,32,16,4,1536,1024,16,64,128,32,8,2,25.68766666666667,3
w13,32,16,4,1536,1024,16,64,128,64,8,2,25.70866666666667,3
w13,32,16,4,1536,1024,16,128,128,1,8,2,25.92233333333333,3
w13,32,16,4,1536,1024,16,128,128,16,8,2,25.762,3
w13,32,32,4,2048,768,16,32,256,1,4,2,267.21366666666665,3
w13,32,32,4,2048,768,16,64,256,1,4,2,268.38733333333334,3
w13,32,32,4,2048,768,32,32,128,1,4,2,268.3446666666667,3
w13,32,32,4,2048,768,32,32,256,1,4,2,268.70733333333334,3
w13,32,32,4,2048,768,32,64,256,1,4,2,269.7526666666667,3
w13,32,32,6,3072,1024,16,16,256,1,4,3,546.6926666666667,3
w13,32,32,6,3072,1024,16,16,256,1,8,3,549.264,3
w13,32,32,6,3072,1024,16,16,256,4,4,3,546.3833333333333,3
w13,32,32,6,3072,1024,16,16,256,4,8,3,548.709,3
w13,32,32,6,3072,1024,32,32,256,1,4,3,547.9303333333334,3
w13,32,32,6,3072,1024,32,32,256,1,8,3,547.8986666666666,3
w13,32,32,6,3072,1024,32,32,256,4,4,3,548.1753333333332,3
w13,32,32,6,3072,1024,32,32,256,4,8,3,548.0263333333334,3
w13,32,32,6,3072,1024,32,32,256,16,4,3,549.4876666666667,3
w13,32,32,6,3072,1024,32,32,256,16,8,3,549.0716666666667,3
w13,32,32,6,3072,1024,32,32,256,32,4,3,550.821,3
w13,32,32,6,3072,1024,32,32,256,32,8,3,549.7863333333333,3
w13,32,60,4,2048,1408,16,16,256,1,4,3,930.197,3
w13,32,60,4,2048,1408,16,16,256,1,4,4,938.2076666666667,3
w13,32,60,4,2048,1408,16,16,256,1,8,3,933.0243333333334,3
w13,32,60,4,2048,1408,16,16,256,4,4,3,929.6636666666667,3
w13,32,60,4,2048,1408,16,16,256,4,4,4,936.4693333333333,3
w13,32,60,4,2048,1408,16,16,256,4,8,3,933.792,3
w13,32,60,4,2048,1408,16,16,256,4,8,4,938.9543333333335,3
w13,32,60,4,2048,1408,16,32,256,1,4,3,934.3253333333333,3
w13,32,60,4,2048,1408,16,32,256,1,4,4,936.5116666666667,3
w13,32,60,4,2048,1408,16,32,256,1,8,3,934.3896666666666,3
w13,32,60,4,2048,1408,16,32,256,1,8,4,937.6536666666666,3
w13,32,60,4,2048,1408,16,32,256,16,4,3,931.7973333333333,3
w13,32,60,4,2048,1408,16,32,256,16,4,4,936.8533333333334,3
w13,32,60,4,2048,1408,16,32,256,16,8,3,933.6323333333333,3
w13,32,60,4,2048,1408,16,32,256,16,8,4,938.0373333333333,3
w13,32,60,4,2048,1408,16,32,256,32,4,3,932.64,3
w13,32,60,4,2048,1408,16,32,256,32,4,4,937.8136666666666,3
w13,32,60,4,2048,1408,16,32,256,32,8,3,933.7599999999999,3
w13,32,60,4,2048,1408,16,32,256,64,4,3,933.2696666666667,3
w13,32,60,4,2048,1408,16,32,256,64,4,4,939.04,3
w13,32,60,4,2048,1408,16,32,256,64,8,3,934.6136666666666,3
w13,32,60,4,2048,1408,16,64,256,16,8,3,938.7843333333334,3
w13,32,60,4,2048,1408,32,32,256,1,4,3,935.4343333333333,3
w13,32,60,4,2048,1408,32,32,256,1,4,4,938.8476666666667,3
w13,32,60,4,2048,1408,32,32,256,1,8,3,934.4636666666667,3
w13,32,60,4,2048,1408,32,32,256,1,8,4,938.5706666666666,3
w13,32,60,4,2048,1408,32,32,256,4,4,3,935.3176666666667,3
w13,32,60,4,2048,1408,32,32,256,4,8,3,934.5173333333332,3
w13,32,60,4,2048,1408,32,32,256,4,8,4,938.6030000000001,3
w13,32,60,4,2048,1408,32,32,256,16,4,3,935.7863333333333,3
w13,32,60,4,2048,1408,32,32,256,16,4,4,938.7203333333333,3
w13,32,60,4,2048,1408,32,32,256,16,8,3,935.168,3
w13,32,60,4,2048,1408,32,32,256,16,8,4,938.7413333333334,3
w13,32,60,4,2048,1408,32,32,256,32,4,3,937.8563333333333,3
w13,32,60,4,2048,1408,32,32,256,32,8,3,937.1306666666666,3
w13,32,60,4,2048,1408,64,32,256,1,8,3,938.826,3
w13,32,60,6,3584,2304,16,16,256,1,4,3,2656.9876666666664,3
w13,32,60,6,3584,2304,16,16,256,1,8,3,2668.0066666666667,3
w13,32,60,6,3584,2304,16,16,256,4,4,3,2656.550333333333,3
w13,32,60,6,3584,2304,16,16,256,4,8,3,2670.9186666666665,3
w13,32,60,6,3584,2304,16,32,256,32,4,3,2679.8033333333333,3
w13,32,60,6,3584,2304,16,32,256,64,4,3,2678.801,3
w13,32,60,6,3584,2304,16,32,256,64,8,3,2683.0146666666665,3
w13,32,60,6,3584,2304,32,32,256,1,4,3,2664.7000000000003,3
w13,32,60,6,3584,2304,32,32,256,1,8,3,2663.6866666666665,3
w13,32,60,6,3584,2304,32,32,256,4,4,3,2666.353333333333,3
w13,32,60,6,3584,2304,32,32,256,4,8,3,2664.7426666666665,3
w13,32,60,6,3584,2304,32,32,256,16,4,3,2670.6413333333335,3
w13,32,60,6,3584,2304,32,32,256,16,8,3,2669.7346666666667,3
w13,32,60,6,3584,2304,32,32,256,32,4,3,2672.508333333333,3
w13,32,60,6,3584,2304,32,32,256,32,8,3,2671.068333333333,3
w13,32,60,8,2048,1536,16,16,256,1,4,3,1017.457,3
w13,32,60,8,2048,1536,16,16,256,1,4,4,1027.1853333333333,3
w13,32,60,8,2048,1536,16,16,256,1,8,3,1020.668,3
w13,32,60,8,2048,1536,16,16,256,4,4,3,1017.6386666666667,3
w13,32,60,8,2048,1536,16,16,256,4,4,4,1025.703,3
w13,32,60,8,2048,1536,16,16,256,4,8,3,1021.6066666666667,3
w13,32,60,8,2048,1536,16,16,256,4,8,4,1027.6226666666666,3
w13,32,60,8,2048,1536,16,32,256,1,4,3,1025.863,3
w13,32,60,8,2048,1536,16,32,256,1,4,4,1025.5106666666668,3
w13,32,60,8,2048,1536,16,32,256,1,8,3,1024.8490000000002,3
w13,32,60,8,2048,1536,16,32,256,1,8,4,1026.4383333333333,3
w13,32,60,8,2048,1536,16,32,256,16,4,3,1022.1936666666667,3
w13,32,60,8,2048,1536,16,32,256,16,4,4,1027.5906666666667,3
w13,32,60,8,2048,1536,16,32,256,16,8,3,1023.6973333333334,3
w13,32,60,8,2048,1536,16,32,256,32,4,3,1023.7509999999999,3
w13,32,60,8,2048,1536,16,32,256,32,8,3,1025.4256666666668,3
w13,32,60,8,2048,1536,16,32,256,64,4,3,1024.5720000000001,3
w13,32,60,8,2048,1536,16,32,256,64,8,3,1026.8443333333335,3
w13,32,60,8,2048,1536,32,32,256,1,4,3,1024.1986666666667,3
w13,32,60,8,2048,1536,32,32,256,1,8,3,1022.8016666666667,3
w13,32,60,8,2048,1536,32,32,256,1,8,4,1027.5693333333334,3
w13,32,60,8,2048,1536,32,32,256,4,4,3,1023.7506666666667,3
w13,32,60,8,2048,1536,32,32,256,4,8,3,1023.399,3
w13,32,60,8,2048,1536,32,32,256,16,4,3,1026.7053333333333,3
w13,32,60,8,2048,1536,32,32,256,16,8,3,1026.5240000000001,3
w13,32,64,6,3072,2048,16,16,256,1,4,3,2158.087666666667,3
w13,32,64,6,3072,2048,16,16,256,1,8,3,2165.7033333333334,3
w13,32,64,6,3072,2048,16,16,256,4,4,3,2156.2526666666668,3
w13,32,64,6,3072,2048,16,16,256,4,8,3,2165.5436666666665,3
w13,32,64,6,3072,2048,32,32,256,1,4,3,2166.119666666667,3
w13,32,64,6,3072,2048,32,32,256,1,8,3,2165.5756666666666,3
w13,32,64,6,3072,2048,32,32,256,4,4,3,2168.338,3
w13,32,64,6,3072,2048,32,32,256,4,8,3,2166.7703333333334,3
w13,32,64,6,3072,2048,32,32,256,16,4,3,2172.626333333333,3
w13,32,64,6,3072,2048,32,32,256,16,8,3,2172.4770000000003,3
w13,32,64,6,3072,2048,32,32,256,32,4,3,2175.4953333333337,3
w13,32,64,6,3072,2048,32,32,256,32,8,3,2175.1863333333336,3
w13,32,64,6,3584,1536,16,16,256,1,4,3,1890.6893333333335,3
w13,32,64,6,3584,1536,16,16,256,1,8,3,1899.2233333333334,3
w13,32,64,6,3584,1536,16,16,256,4,4,3,1889.6443333333334,3
w13,32,64,6,3584,1536,16,16,256,4,8,3,1899.372,3
w13,32,64,6,3584,1536,16,32,256,1,4,3,1907.628,3
w13,32,64,6,3584,1536,16,32,256,16,4,3,1908.1826666666666,3
w13,32,64,6,3584,1536,16,32,256,32,4,3,1907.7666666666667,3
w13,32,64,6,3584,1536,32,32,256,1,4,3,1896.2893333333334,3
w13,32,64,6,3584,1536,32,32,256,1,8,3,1894.892,3
w13,32,64,6,3584,1536,32,32,256,4,4,3,1897.0573333333334,3
w13,32,64,6,3584,1536,32,32,256,4,8,3,1896.6413333333333,3
w13,32,64,6,3584,1536,32,32,256,16,4,3,1900.759,3
w13,32,64,6,3584,1536,32,32,256,16,8,3,1899.948,3
w13,32,64,6,3584,1536,32,32,256,32,4,3,1902.5613333333333,3
w13,32,64,6,3584,1536,32,32,256,32,8,3,1901.196,3
w13,32,64,8,3584,2560,16,16,256,1,4,3,3150.3986666666665,3
w13,32,64,8,3584,2560,16,16,256,1,8,3,3165.726666666667,3
w13,32,64,8,3584,2560,16,16,256,4,4,3,3151.038666666667,3
w13,32,64,8,3584,2560,16,16,256,4,8,3,3165.7909999999997,3
w13,32,64,8,3584,2560,32,32,256,1,4,3,3160.788666666667,3
w13,32,64,8,3584,2560,32,32,256,1,8,3,3161.1193333333335,3
w13,32,64,8,3584,2560,32,32,256,4,4,3,3164.7563333333333,3
w13,32,64,8,3584,2560,32,32,256,4,8,3,3162.9966666666664,3
w13,32,64,8,3584,2560,32,32,256,16,4,3,3171.4013333333332,3
w13,32,64,8,3584,2560,32,32,256,16,8,3,3171.103333333333,3
w13,32,64,8,3584,2560,32,32,256,32,4,3,3174.9643333333333,3
w13,32,64,8,3584,2560,32,32,256,32,8,3,3173.385333333333,3
w13,32,128,4,2048,512,16,16,256,1,4,3,720.3713333333334,3
w13,32,128,4,2048,512,16,16,256,1,4,4,725.918,3
w13,32,128,4,2048,512,16,16,256,1,8,3,723.5709999999999,3
w13,32,128,4,2048,512,16,16,256,1,8,4,727.3156666666667,3
w13,32,128,4,2048,512,16,16,256,4,4,3,720.4883333333333,3
w13,32,128,4,2048,512,16,16,256,4,4,4,725.8220000000001,3
w13,32,128,4,2048,512,16,16,256,4,8,3,723.9653333333332,3
w13,32,128,4,2048,512,16,32,256,1,4,3,722.5043333333333,3
w13,32,128,4,2048,512,16,32,256,1,4,4,725.4593333333332,3
w13,32,128,4,2048,512,16,32,256,1,8,3,723.7736666666666,3
w13,32,128,4,2048,512,16,32,256,1,8,4,726.2379999999999,3
w13,32,128,4,2048,512,16,32,256,16,4,3,721.6513333333334,3
w13,32,128,4,2048,512,16,32,256,16,4,4,725.1606666666667,3
w13,32,128,4,2048,512,16,32,256,16,8,3,722.6536666666667,3
w13,32,128,4,2048,512,16,32,256,16,8,4,726.1956666666666,3
w13,32,128,4,2048,512,16,32,256,32,4,3,721.9176666666666,3
w13,32,128,4,2048,512,16,32,256,32,4,4,726.11,3
w13,32,128,4,2048,512,16,32,256,32,8,3,723.2833333333333,3
w13,32,128,4,2048,512,16,32,256,32,8,4,727.1120000000001,3
w13,32,128,4,2048,512,16,32,256,64,4,3,722.558,3
w13,32,128,4,2048,512,16,32,256,64,4,4,725.7896666666667,3
w13,32,128,4,2048,512,16,32,256,64,8,3,723.9123333333333,3
w13,32,128,4,2048,512,16,32,256,64,8,4,727.294,3
w13,32,128,4,2048,512,16,64,256,16,4,3,727.3473333333333,3
w13,32,128,4,2048,512,16,64,256,16,8,3,727.1123333333334,3
w13,32,128,4,2048,512,16,64,256,32,4,3,727.6033333333334,3
w13,32,128,4,2048,512,32,32,256,1,4,3,724.6700000000001,3
w13,32,128,4,2048,512,32,32,256,1,4,4,727.2833333333333,3
w13,32,128,4,2048,512,32,32,256,1,8,3,724.3816666666667,3
w13,32,128,4,2048,512,32,32,256,1,8,4,727.038,3
w13,32,128,4,2048,512,32,32,256,4,4,3,724.7763333333332,3
w13,32,128,4,2048,512,32,32,256,4,8,3,724.3823333333333,3
w13,32,128,4,2048,512,32,32,256,4,8,4,727.1976666666666,3
w13,32,128,4,2048,512,32,32,256,16,4,3,725.1393333333334,3
w13,32,128,4,2048,512,32,32,256,16,4,4,727.401,3
w13,32,128,4,2048,512,32,32,256,16,8,3,724.5949999999999,3
w13,32,128,4,2048,512,32,32,256,16,8,4,726.8566666666667,3
w13,32,128,4,2048,512,32,32,256,32,4,3,725.875,3
w13,32,128,4,2048,512,32,32,256,32,8,3,725.3843333333334,3
w13,32,128,4,2048,512,32,32,256,32,8,4,727.3153333333333,3
w13,32,128,6,4096,2048,16,16,256,1,4,3,5732.273666666667,3
w13,32,128,6,4096,2048,16,16,256,1,4,4,5778.684333333334,3
w13,32,128,6,4096,2048,16,16,256,1,8,3,5744.284333333333,3
w13,32,128,6,4096,2048,16,16,256,4,4,3,5722.961666666667,3
w13,32,128,6,4096,2048,16,16,256,4,4,4,5770.855333333333,3
w13,32,128,6,4096,2048,16,16,256,4,8,3,5745.553666666667,3
w13,32,128,6,4096,2048,16,32,256,16,4,3,5766.332333333333,3
w13,32,128,6,4096,2048,16,32,256,16,8,3,5772.167333333334,3
w13,32,128,6,4096,2048,16,32,256,32,4,3,5766.162333333334,3
w13,32,128,6,4096,2048,16,32,256,32,8,3,5771.079000000001,3
w13,32,128,6,4096,2048,16,32,256,64,4,3,5769.97,3
w13,32,128,6,4096,2048,16,32,256,64,8,3,5770.076666666667,3
w13,32,128,6,4096,2048,32,32,256,1,4,3,5769.298666666667,3
w13,32,128,6,4096,2048,32,32,256,1,8,3,5767.795000000001,3
w13,32,128,6,4096,2048,32,32,256,4,4,3,5768.008666666666,3
w13,32,128,6,4096,2048,32,32,256,4,8,3,5767.304,3
w13,32,128,6,4096,2048,32,32,256,16,4,3,5774.184333333334,3
w13,32,128,6,4096,2048,32,32,256,16,8,3,5773.757666666667,3
w13,32,128,6,4096,2048,32,32,256,32,4,3,5778.035,3
w13,32,128,6,4096,2048,32,32,256,32,8,3,5776.531,3
w13,32,128,8,2048,768,16,16,256,1,4,3,1080.6856666666665,3
w13,32,128,8,2048,768,16,16,256,1,4,4,1089.4856666666667,3
w13,32,128,8,2048,768,16,16,256,1,8,3,1084.11,3
w13,32,128,8,2048,768,16,16,256,1,8,4,1090.798,3
w13,32,128,8,2048,768,16,16,256,4,4,3,1080.1093333333333,3
w13,32,128,8,2048,768,16,16,256,4,4,4,1088.355,3
w13,32,128,8,2048,768,16,16,256,4,8,3,1084.0246666666667,3
w13,32,128,8,2048,768,16,16,256,4,8,4,1090.0726666666667,3
w13,32,128,8,2048,768,16,32,256,1,4,3,1084.2163333333335,3
w13,32,128,8,2048,768,16,32,256,1,4,4,1088.6109999999999,3
w13,32,128,8,2048,768,16,32,256,1,8,3,1085.646,3
w13,32,128,8,2048,768,16,32,256,1,8,4,1090.1580000000001,3
w13,32,128,8,2048,768,16,32,256,16,4,3,1082.2646666666667,3
w13,32,128,8,2048,768,16,32,256,16,4,4,1088.9953333333333,3
w13,32,128,8,2048,768,16,32,256,16,8,3,1083.9816666666668,3
w13,32,128,8,2048,768,16,32,256,16,8,4,1090.3503333333333,3
w13,32,128,8,2048,768,16,32,256,32,4,3,1083.0113333333331,3
w13,32,128,8,2048,768,16,32,256,32,4,4,1090.5316666666668,3
w13,32,128,8,2048,768,16,32,256,32,8,3,1084.7283333333332,3
w13,32,128,8,2048,768,16,32,256,64,4,3,1084.259,3
w13,32,128,8,2048,768,16,32,256,64,8,3,1086.3713333333333,3
w13,32,128,8,2048,768,16,64,256,16,4,3,1090.617,3
w13,32,128,8,2048,768,16,64,256,16,8,3,1090.3606666666667,3
w13,32,128,8,2048,768,32,32,256,1,4,3,1086.9363333333333,3
w13,32,128,8,2048,768,32,32,256,1,4,4,1090.5313333333334,3
w13,32,128,8,2048,768,32,32,256,1,8,3,1086.8086666666666,3
w13,32,128,8,2048,768,32,32,256,1,8,4,1090.7450000000001,3
w13,32,128,8,2048,768,32,32,256,4,4,3,1086.8516666666667,3
w13,32,128,8,2048,768,32,32,256,4,8,3,1086.499,3
w13,32,128,8,2048,768,32,32,256,4,8,4,1090.798,3
w13,32,128,8,2048,768,32,32,256,16,4,3,1088.9843333333333,3
w13,32,128,8,2048,768,32,32,256,16,8,3,1088.014,3
w13,32,128,8,2048,768,32,32,256,32,4,3,1090.5096666666666,3
w13,32,128,8,2048,768,32,32,256,32,8,3,1090.212,3
w13,32,128,8,4096,1536,16,16,256,1,4,3,4301.194666666666,3
w13,32,128,8,4096,1536,16,16,256,1,4,4,4338.901999999999,3
w13,32,128,8,4096,1536,16,16,256,1,8,3,4313.803,3
w13,32,128,8,4096,1536,16,16,256,1,8,4,4341.334,3
w13,32,128,8,4096,1536,16,16,256,4,4,3,4300.629333333333,3
w13,32,128,8,4096,1536,16,16,256,4,4,4,4336.715,3
w13,32,128,8,4096,1536,16,16,256,4,8,3,4318.347000000001,3
w13,32,128,8,4096,1536,16,32,256,1,4,3,4341.899333333334,3
w13,32,128,8,4096,1536,16,32,256,1,4,4,4341.664333333333,3
w13,32,128,8,4096,1536,16,32,256,1,8,3,4341.3550000000005,3
w13,32,128,8,4096,1536,16,32,256,16,4,3,4331.286,3
w13,32,128,8,4096,1536,16,32,256,16,8,3,4335.222000000001,3
w13,32,128,8,4096,1536,16,32,256,32,4,3,4328.096333333334,3
w13,32,128,8,4096,1536,16,32,256,32,8,3,4332.534,3
w13,32,128,8,4096,1536,16,32,256,64,4,3,4327.830000000001,3
w13,32,128,8,4096,1536,16,32,256,64,8,3,4332.854,3
w13,32,128,8,4096,1536,32,32,256,1,4,3,4330.817333333333,3
w13,32,128,8,4096,1536,32,32,256,1,8,3,4329.3876666666665,3
w13,32,128,8,4096,1536,32,32,256,4,4,3,4333.228,3
w13,32,128,8,4096,1536,32,32,256,4,8,3,4331.8516666666665,3
w13,32,128,8,4096,1536,32,32,256,16,4,3,4338.582666666666,3
w13,32,128,8,4096,1536,32,32,256,16,8,3,4337.527,3
w13,32,128,8,4096,1536,32,32,256,32,4,3,4341.249333333333,3
w13,32,128,8,4096,1536,32,32,256,32,8,3,4340.587333333333,3
w13,32,128,8,4096,3072,16,16,256,1,4,3,8603.910000000002,3
w13,32,128,8,4096,3072,16,16,256,1,4,4,8669.745,3
w13,32,128,8,4096,3072,16,16,256,1,8,3,8624.198,3
w13,32,128,8,4096,3072,16,16,256,1,8,4,8681.553666666667,3
w13,32,128,8,4096,3072,16,16,256,4,4,3,8604.699333333332,3
w13,32,128,8,4096,3072,16,16,256,4,4,4,8676.593666666668,3
w13,32,128,8,4096,3072,16,16,256,4,8,3,8635.014333333333,3
w13,32,128,8,4096,3072,16,16,256,4,8,4,8679.367,3
w13,32,128,8,4096,3072,16,32,256,1,4,3,8665.499333333333,3
w13,32,128,8,4096,3072,16,32,256,1,4,4,8678.161333333333,3
w13,32,128,8,4096,3072,16,32,256,1,8,3,8678.673333333334,3
w13,32,128,8,4096,3072,16,32,256,1,8,4,8685.062666666667,3
w13,32,128,8,4096,3072,16,32,256,16,4,3,8654.523333333333,3
w13,32,128,8,4096,3072,16,32,256,16,4,4,8686.695,3
w13,32,128,8,4096,3072,16,32,256,16,8,3,8664.102666666668,3
w13,32,128,8,4096,3072,16,32,256,32,4,3,8644.017333333335,3
w13,32,128,8,4096,3072,16,32,256,32,4,4,8688.732,3
w13,32,128,8,4096,3072,16,32,256,32,8,3,8650.694666666666,3
w13,32,128,8,4096,3072,16,32,256,64,4,3,8643.857000000002,3
w13,32,128,8,4096,3072,16,32,256,64,8,3,8654.599,3
w13,32,128,8,4096,3072,32,32,256,1,4,3,8657.810666666666,3
w13,32,128,8,4096,3072,32,32,256,1,4,4,8687.752333333332,3
w13,32,128,8,4096,3072,32,32,256,1,8,3,8656.264000000001,3
w13,32,128,8,4096,3072,32,32,256,1,8,4,8688.435,3
w13,32,128,8,4096,3072,32,32,256,4,4,3,8662.131,3
w13,32,128,8,4096,3072,32,32,256,4,4,4,8690.813666666667,3
w13,32,128,8,4096,3072,32,32,256,4,8,3,8659.432333333332,3
w13,32,128,8,4096,3072,32,32,256,16,4,3,8673.971333333333,3
w13,32,128,8,4096,3072,32,32,256,16,8,3,8671.56,3
w13,32,128,8,4096,3072,32,32,256,32,4,3,8679.059000000001,3
w13,32,128,8,4096,3072,32,32,256,32,8,3,8676.232,3
w13,32,128,8,4096,3072,64,32,256,1,8,3,8687.550333333334,3
w13,48,8,2,1024,512,16,64,32,1,4,4,5.836333333333333,3
w13,48,16,2,1536,768,16,64,32,1,4,4,17.832333333333334,3
w13,48,16,4,1536,1024,16,128,128,1,8,2,27.084666666666667,3
w13,48,16,4,1536,1024,16,128,128,16,8,2,27.191333333333333,3
w13,48,32,4,2048,768,16,32,256,1,4,2,268.33433333333335,3
w13,48,32,4,2048,768,16,64,256,1,4,2,268.81333333333333,3
w13,48,32,4,2048,768,32,32,128,1,4,2,269.18766666666664,3
w13,48,32,4,2048,768,32,32,256,1,4,2,270.23266666666666,3
w13,48,32,4,2048,768,32,64,256,1,4,2,269.721,3
w13,48,32,6,3072,1024,16,16,256,1,4,3,550.7786666666666,3
w13,48,32,6,3072,1024,16,16,256,1,8,3,552.5806666666666,3
w13,48,32,6,3072,1024,16,16,256,4,4,3,549.466,3
w13,48,32,6,3072,1024,16,16,256,4,4,4,554.8636666666666,3
w13,48,32,6,3072,1024,16,16,256,4,8,3,551.8126666666667,3
w13,48,32,6,3072,1024,32,32,256,1,4,3,550.5436666666666,3
w13,48,32,6,3072,1024,32,32,256,1,8,3,550.4263333333333,3
w13,48,32,6,3072,1024,32,32,256,4,4,3,550.981,3
w13,48,32,6,3072,1024,32,32,256,4,8,3,550.4373333333334,3
w13,48,32,6,3072,1024,32,32,256,16,4,3,552.197,3
w13,48,32,6,3072,1024,32,32,256,16,8,3,551.7706666666667,3
w13,48,32,6,3072,1024,32,32,256,32,4,3,553.0186666666667,3
w13,48,32,6,3072,1024,32,32,256,32,8,3,553.1039999999999,3
w13,48,60,4,2048,1408,16,16,256,1,4,3,932.0853333333333,3
w13,48,60,4,2048,1408,16,16,256,1,4,4,939.7763333333332,3
w13,48,60,4,2048,1408,16,16,256,1,8,3,935.594,3
w13,48,60,4,2048,1408,16,16,256,4,4,3,931.6586666666666,3
w13,48,60,4,2048,1408,16,16,256,4,4,4,938.389,3
w13,48,60,4,2048,1408,16,16,256,4,8,3,935.5196666666667,3
w13,48,60,4,2048,1408,16,16,256,4,8,4,940.6933333333333,3
w13,48,60,4,2048,1408,16,32,256,1,4,3,937.1943333333334,3
w13,48,60,4,2048,1408,16,32,256,1,4,4,938.3679999999999,3
w13,48,60,4,2048,1408,16,32,256,1,8,3,937.312,3
w13,48,60,4,2048,1408,16,32,256,1,8,4,940.1283333333334,3
w13,48,60,4,2048,1408,16,32,256,16,4,3,934.5923333333334,3
w13,48,60,4,2048,1408,16,32,256,16,4,4,939.093,3
w13,48,60,4,2048,1408,16,32,256,16,8,3,936.4376666666667,3
w13,48,60,4,2048,1408,16,32,256,16,8,4,940.5763333333334,3
w13,48,60,4,2048,1408,16,32,256,32,4,3,935.3066666666667,3
w13,48,60,4,2048,1408,16,32,256,32,8,3,937.131,3
w13,48,60,4,2048,1408,16,32,256,64,4,3,936.0323333333332,3
w13,48,60,4,2048,1408,16,32,256,64,8,3,937.781,3
w13,48,60,4,2048,1408,32,32,256,1,4,3,936.9276666666666,3
w13,48,60,4,2048,1408,32,32,256,1,4,4,940.7143333333333,3
w13,48,60,4,2048,1408,32,32,256,1,8,3,936.235,3
w13,48,60,4,2048,1408,32,32,256,1,8,4,940.9923333333332,3
w13,48,60,4,2048,1408,32,32,256,4,4,3,937.4716666666667,3
w13,48,60,4,2048,1408,32,32,256,4,8,3,936.6396666666666,3
w13,48,60,4,2048,1408,32,32,256,16,4,3,938.6666666666666,3
w13,48,60,4,2048,1408,32,32,256,16,8,3,938.1546666666667,3
w13,48,60,4,2048,1408,32,32,256,32,8,3,940.4906666666666,3
w13,48,60,6,3584,2304,16,16,256,1,4,3,2663.8366666666666,3
w13,48,60,6,3584,2304,16,16,256,1,8,3,2675.174666666667,3
w13,48,60,6,3584,2304,16,16,256,4,4,3,2662.0229999999997,3
w13,48,60,6,3584,2304,16,16,256,4,8,3,2676.146,3
w13,48,60,6,3584,2304,32,32,256,1,4,3,2670.428,3
w13,48,60,6,3584,2304,32,32,256,1,8,3,2670.3863333333334,3
w13,48,60,6,3584,2304,32,32,256,4,4,3,2674.5243333333333,3
w13,48,60,6,3584,2304,32,32,256,4,8,3,2672.146,3
w13,48,60,6,3584,2304,32,32,256,16,4,3,2678.8973333333333,3
w13,48,60,6,3584,2304,32,32,256,16,8,3,2676.9776666666667,3
w13,48,60,6,3584,2304,32,32,256,32,4,3,2681.650333333333,3
w13,48,60,6,3584,2304,32,32,256,32,8,3,2679.623666666667,3
w13,48,60,8,2048,1536,16,16,256,1,4,3,1022.3533333333334,3
w13,48,60,8,2048,1536,16,16,256,1,4,4,1031.7616666666665,3
w13,48,60,8,2048,1536,16,16,256,1,8,3,1024.9776666666667,3
w13,48,60,8,2048,1536,16,16,256,4,4,3,1021.799,3
w13,48,60,8,2048,1536,16,16,256,4,4,4,1029.884,3
w13,48,60,8,2048,1536,16,16,256,4,8,3,1025.9266666666667,3
w13,48,60,8,2048,1536,16,16,256,4,8,4,1031.9213333333335,3
w13,48,60,8,2048,1536,16,32,256,1,4,3,1029.2973333333332,3
w13,48,60,8,2048,1536,16,32,256,1,4,4,1030.2573333333332,3
w13,48,60,8,2048,1536,16,32,256,1,8,3,1029.308,3
w13,48,60,8,2048,1536,16,32,256,1,8,4,1031.0466666666669,3
w13,48,60,8,2048,1536,16,32,256,16,4,3,1028.2523333333334,3
w13,48,60,8,2048,1536,16,32,256,16,8,3,1030.1616666666666,3
w13,48,60,8,2048,1536,16,32,256,32,4,3,1030.439,3
w13,48,60,8,2048,1536,16,32,256,32,8,3,1031.7723333333333,3
w13,48,60,8,2048,1536,16,32,256,64,4,3,1031.996,3
w13,48,60,8,2048,1536,32,32,256,1,4,3,1028.263,3
w13,48,60,8,2048,1536,32,32,256,1,4,4,1032.0283333333334,3
w13,48,60,8,2048,1536,32,32,256,1,8,3,1027.2923333333333,3
w13,48,60,8,2048,1536,32,32,256,1,8,4,1031.719,3
w13,48,60,8,2048,1536,32,32,256,4,4,3,1028.2526666666665,3
w13,48,60,8,2048,1536,32,32,256,4,8,3,1027.826,3
w13,48,60,8,2048,1536,32,32,256,16,4,3,1031.7833333333333,3
w13,48,60,8,2048,1536,32,32,256,16,8,3,1031.0153333333335,3
w13,48,64,6,3072,2048,16,16,256,1,4,3,2164.7006666666666,3
w13,48,64,6,3072,2048,16,16,256,1,8,3,2170.8343333333337,3
w13,48,64,6,3072,2048,16,16,256,4,4,3,2162.61,3
w13,48,64,6,3072,2048,16,16,256,4,8,3,2171.6446666666666,3
w13,48,64,6,3072,2048,32,32,256,1,4,3,2172.0286666666666,3
w13,48,64,6,3072,2048,32,32,256,1,8,3,2170.9303333333332,3
w13,48,64,6,3072,2048,32,32,256,4,4,3,2173.116666666667,3
w13,48,64,6,3072,2048,32,32,256,4,8,3,2172.989,3
w13,48,64,6,3072,2048,32,32,256,16,4,3,2179.1543333333334,3
w13,48,64,6,3072,2048,32,32,256,16,8,3,2178.2369999999996,3
w13,48,64,6,3072,2048,32,32,256,32,4,3,2182.92,3
w13,48,64,6,3072,2048,32,32,256,32,8,3,2182.450666666667,3
w13,48,64,6,3584,1536,16,16,256,1,4,3,1895.6499999999999,3
w13,48,64,6,3584,1536,16,16,256,1,8,3,1904.066,3
w13,48,64,6,3584,1536,16,16,256,4,4,3,1895.2873333333334,3
w13,48,64,6,3584,1536,16,16,256,4,8,3,1904.2256666666665,3
w13,48,64,6,3584,1536,32,32,256,1,4,3,1900.3753333333334,3
w13,48,64,6,3584,1536,32,32,256,1,8,3,1900.066,3
w13,48,64,6,3584,1536,32,32,256,4,4,3,1902.0076666666666,3
w13,48,64,6,3584,1536,32,32,256,4,8,3,1900.9616666666668,3
w13,48,64,6,3584,1536,32,32,256,16,4,3,1907.1803333333335,3
w13,48,64,6,3584,1536,32,32,256,16,8,3,1905.6446666666668,3
w13,48,64,6,3584,1536,32,32,256,32,4,3,1908.0876666666666,3
w13,48,64,6,3584,1536,32,32,256,32,8,3,1907.117,3
w13,48,64,8,3584,2560,16,16,256,1,4,3,3162.9223333333334,3
w13,48,64,8,3584,2560,16,16,256,1,8,3,3175.9786666666664,3
w13,48,64,8,3584,2560,16,16,256,4,4,3,3163.7436666666667,3
w13,48,64,8,3584,2560,16,16,256,4,8,3,3177.461333333333,3
w13,48,64,8,3584,2560,32,32,256,1,4,3,3171.199666666667,3
w13,48,64,8,3584,2560,32,32,256,1,8,3,3169.194333333333,3
w13,48,64,8,3584,2560,32,32,256,4,4,3,3174.0796666666665,3
w13,48,64,8,3584,2560,32,32,256,4,8,3,3172.213333333333,3
w13,48,64,8,3584,2560,32,32,256,16,4,3,3183.8506666666667,3
w13,48,64,8,3584,2560,32,32,256,16,8,3,3180.362333333333,3
w13,48,64,8,3584,2560,32,32,256,32,4,3,3187.893,3
w13,48,64,8,3584,2560,32,32,256,32,8,3,3186.250666666667,3
w13,48,128,4,2048,512,16,16,256,1,4,3,720.7876666666667,3
w13,48,128,4,2048,512,16,16,256,1,4,4,726.3873333333335,3
w13,48,128,4,2048,512,16,16,256,1,8,3,723.7736666666666,3
w13,48,128,4,2048,512,16,16,256,4,4,3,721.0009999999999,3
w13,48,128,4,2048,512,16,16,256,4,4,4,726.9846666666667,3
w13,48,128,4,2048,512,16,16,256,4,8,3,725.3843333333334,3
w13,48,128,4,2048,512,16,32,256,1,4,3,723.1229999999999,3
w13,48,128,4,2048,512,16,32,256,1,4,4,725.9176666666666,3
w13,48,128,4,2048,512,16,32,256,1,8,3,724.4463333333333,3
w13,48,128,4,2048,512,16,32,256,1,8,4,727.1766666666666,3
w13,48,128,4,2048,512,16,32,256,16,4,3,722.9736666666666,3
w13,48,128,4,2048,512,16,32,256,16,4,4,726.3873333333335,3
w13,48,128,4,2048,512,16,32,256,16,8,3,723.8696666666666,3
w13,48,128,4,2048,512,16,32,256,16,8,4,727.102,3
w13,48,128,4,2048,512,16,32,256,32,4,3,723.006,3
w13,48,128,4,2048,512,16,32,256,32,4,4,726.974,3
w13,48,128,4,2048,512,16,32,256,32,8,3,724.297,3
w13,48,128,4,2048,512,16,32,256,64,4,3,723.8486666666666,3
w13,48,128,4,2048,512,16,32,256,64,4,4,727.5603333333333,3
w13,48,128,4,2048,512,16,32,256,64,8,3,725.0326666666666,3
w13,48,128,4,2048,512,32,32,256,1,4,3,725.1610000000001,3
w13,48,128,4,2048,512,32,32,256,1,4,4,727.998,3
w13,48,128,4,2048,512,32,32,256,1,8,3,724.4243333333334,3
w13,48,128,4,2048,512,32,32,256,1,8,4,727.667,3
w13,48,128,4,2048,512,32,32,256,4,4,3,725.5336666666667,3
w13,48,128,4,2048,512,32,32,256,4,8,3,725.118,3
w13,48,128,4,2048,512,32,32,256,16,4,3,726.3023333333334,3
w13,48,128,4,2048,512,32,32,256,16,8,3,725.8643333333333,3
w13,48,128,4,2048,512,32,32,256,16,8,4,727.9336666666667,3
w13,48,128,4,2048,512,32,32,256,32,4,3,727.1876666666667,3
w13,48,128,4,2048,512,32,32,256,32,8,3,726.313,3
w13,48,128,6,4096,2048,16,16,256,1,4,3,5731.223333333332,3
w13,48,128,6,4096,2048,16,16,256,1,8,3,5748.738333333334,3
w13,48,128,6,4096,2048,16,16,256,4,4,3,5722.146000000001,3
w13,48,128,6,4096,2048,16,16,256,4,8,3,5746.018666666667,3
w13,48,128,6,4096,2048,16,32,256,16,4,3,5771.287666666667,3
w13,48,128,6,4096,2048,16,32,256,16,8,3,5778.68,3
w13,48,128,6,4096,2048,16,32,256,32,4,3,5776.941333333333,3
w13,48,128,6,4096,2048,16,32,256,64,4,3,5771.842333333334,3
w13,48,128,6,4096,2048,32,32,256,1,4,3,5773.475333333333,3
w13,48,128,6,4096,2048,32,32,256,1,8,3,5772.782333333334,3
w13,48,128,6,4096,2048,32,32,256,4,4,3,5771.417,3
w13,48,128,6,4096,2048,32,32,256,4,8,3,5770.862666666667,3
w13,48,128,8,2048,768,16,16,256,1,4,3,1082.5956666666668,3
w13,48,128,8,2048,768,16,16,256,1,4,4,1092.078,3
w13,48,128,8,2048,768,16,16,256,1,8,3,1086.3603333333333,3
w13,48,128,8,2048,768,16,16,256,4,4,3,1082.0833333333333,3
w13,48,128,8,2048,768,16,16,256,4,4,4,1090.4036666666668,3
w13,48,128,8,2048,768,16,16,256,4,8,3,1085.6886666666667,3
w13,48,128,8,2048,768,16,16,256,4,8,4,1092.43,3
w13,48,128,8,2048,768,16,32,256,1,4,3,1088.014,3
w13,48,128,8,2048,768,16,32,256,1,4,4,1090.2966666666666,3
w13,48,128,8,2048,768,16,32,256,1,8,3,1087.9286666666667,3
w13,48,128,8,2048,768,16,32,256,1,8,4,1092.59,3
w13,48,128,8,2048,768,16,32,256,16,4,3,1085.1123333333335,3
w13,48,128,8,2048,768,16,32,256,16,4,4,1090.862,3
w13,48,128,8,2048,768,16,32,256,16,8,3,1085.5496666666668,3
w13,48,128,8,2048,768,16,32,256,16,8,4,1092.558,3
w13,48,128,8,2048,768,16,32,256,32,4,3,1086.9686666666666,3
w13,48,128,8,2048,768,16,32,256,32,4,4,1092.345,3
w13,48,128,8,2048,768,16,32,256,32,8,3,1087.5343333333333,3
w13,48,128,8,2048,768,16,32,256,64,4,3,1088.7606666666668,3
w13,48,128,8,2048,768,16,32,256,64,8,3,1090.1043333333334,3
w13,48,128,8,2048,768,32,32,256,1,4,3,1089.6139999999998,3
w13,48,128,8,2048,768,32,32,256,1,8,3,1088.579,3
w13,48,128,8,2048,768,32,32,256,4,4,3,1089.5283333333334,3
w13,48,128,8,2048,768,32,32,256,4,8,3,1088.9423333333334,3
w13,48,128,8,2048,768,32,32,256,16,4,3,1090.446,3
w13,48,128,8,2048,768,32,32,256,16,8,3,1089.6673333333333,3
w13,48,128,8,2048,768,32,32,256,32,8,3,1092.4086666666667,3
w13,48,128,8,4096,1536,16,16,256,1,4,3,4298.456,3
w13,48,128,8,4096,1536,16,16,256,1,8,3,4310.9039999999995,3
w13,48,128,8,4096,1536,16,16,256,4,4,3,4300.717666666666,3
w13,48,128,8,4096,1536,16,16,256,4,4,4,4341.634999999999,3
w13,48,128,8,4096,1536,16,16,256,4,8,3,4318.157666666667,3
w13,48,128,8,4096,1536,32,32,256,1,4,3,4335.310333333334,3
w13,48,128,8,4096,1536,32,32,256,1,8,3,4334.062333333333,3
w13,48,128,8,4096,1536,32,32,256,4,4,3,4339.14,3
w13,48,128,8,4096,1536,32,32,256,4,8,3,4337.646333333333,3
w13,48,128,8,4096,3072,16,16,256,1,4,3,8598.783333333333,3
w13,48,128,8,4096,3072,16,16,256,1,4,4,8680.138666666668,3
w13,48,128,8,4096,3072,16,16,256,1,8,3,8621.204666666667,3
w13,48,128,8,4096,3072,16,16,256,1,8,4,8684.640333333335,3
w13,48,128,8,4096,3072,16,16,256,4,4,3,8601.898,3
w13,48,128,8,4096,3072,16,16,256,4,4,4,8680.501666666667,3
w13,48,128,8,4096,3072,16,16,256,4,8,3,8636.522333333332,3
w13,48,128,8,4096,3072,16,32,256,16,4,3,8681.664333333334,3
w13,48,128,8,4096,3072,16,32,256,32,4,3,8678.891000000001,3
w13,48,128,8,4096,3072,16,32,256,32,8,3,8680.171,3
w13,48,128,8,4096,3072,16,32,256,64,4,3,8674.133333333333,3
w13,48,128,8,4096,3072,32,32,256,1,4,3,8667.222,3
w13,48,128,8,4096,3072,32,32,256,1,8,3,8664.779333333334,3
w13,48,128,8,4096,3072,32,32,256,4,4,3,8672.768666666665,3
w13,48,128,8,4096,3072,32,32,256,4,8,3,8671.477666666666,3
w13,64,8,2,1024,512,16,64,32,1,4,4,6.178,3
w13,64,8,2,1024,512,16,64,64,1,8,4,6.188333333333333,3
w13,64,16,2,1536,768,16,64,32,1,4,3,18.508666666666667,3
w13,64,16,2,1536,768,16,64,32,1,4,4,18.423333333333336,3
w13,64,16,2,1536,768,16,128,32,1,8,4,18.476333333333333,3
w13,64,16,2,1536,768,16,128,64,1,8,3,18.412666666666667,3
w13,64,16,4,1536,1024,16,128,128,1,8,2,29.143333333333334,3
w13,64,16,4,1536,1024,16,128,128,32,8,2,29.292333333333332,3
w13,64,16,4,1536,1024,16,128,128,64,8,2,29.207333333333334,3
w13,64,32,4,2048,768,16,32,256,1,4,2,269.4433333333333,3
w13,64,32,4,2048,768,16,64,256,1,4,2,270.61633333333333,3
w13,64,32,4,2048,768,32,32,128,1,4,2,270.638,3
w13,64,32,4,2048,768,32,32,256,1,4,2,271.2246666666667,3
w13,64,32,4,2048,768,32,64,256,1,4,2,272.1526666666667,3
w13,64,32,6,3072,1024,16,16,256,1,4,3,554.4583333333334,3
w13,64,32,6,3072,1024,16,16,256,1,8,3,554.7573333333333,3
w13,64,32,6,3072,1024,16,16,256,4,4,3,553.2106666666667,3
w13,64,32,6,3072,1024,16,16,256,4,4,4,557.8506666666667,3
w13,64,32,6,3072,1024,16,16,256,4,8,3,555.6320000000001,3
w13,64,32,6,3072,1024,16,32,256,1,4,4,557.7116666666667,3
w13,64,32,6,3072,1024,32,32,256,1,4,3,552.4636666666667,3
w13,64,32,6,3072,1024,32,32,256,1,8,3,552.3249999999999,3
w13,64,32,6,3072,1024,32,32,256,4,4,3,552.784,3
w13,64,32,6,3072,1024,32,32,256,4,8,3,552.933,3
w13,64,32,6,3072,1024,32,32,256,16,4,3,555.227,3
w13,64,32,6,3072,1024,32,32,256,16,8,3,553.915,3
w13,64,32,6,3072,1024,32,32,256,32,4,3,555.877,3
w13,64,32,6,3072,1024,32,32,256,32,8,3,555.6,3
w13,64,60,4,2048,1408,16,16,256,1,4,3,934.1550000000001,3
w13,64,60,4,2048,1408,16,16,256,1,4,4,942.1869999999999,3
w13,64,60,4,2048,1408,16,16,256,1,8,3,937.3866666666667,3
w13,64,60,4,2048,1408,16,16,256,4,4,3,933.1733333333333,3
w13,64,60,4,2048,1408,16,16,256,4,4,4,940.598,3
w13,64,60,4,2048,1408,16,16,256,4,8,3,936.8213333333333,3
w13,64,60,4,2048,1408,16,16,256,4,8,4,942.5603333333333,3
w13,64,60,4,2048,1408,16,32,256,1,4,3,939.1790000000001,3
w13,64,60,4,2048,1408,16,32,256,1,4,4,940.8216666666667,3
w13,64,60,4,2048,1408,16,32,256,1,8,3,939.7869999999999,3
w13,64,60,4,2048,1408,16,32,256,1,8,4,941.8243333333334,3
w13,64,60,4,2048,1408,16,32,256,16,4,3,937.259,3
w13,64,60,4,2048,1408,16,32,256,16,4,4,941.355,3
w13,64,60,4,2048,1408,16,32,256,16,8,3,937.9416666666666,3
w13,64,60,4,2048,1408,16,32,256,32,4,3,938.0376666666666,3
w13,64,60,4,2048,1408,16,32,256,32,8,3,940.0856666666667,3
w13,64,60,4,2048,1408,16,32,256,64,4,3,940.0749999999999,3
w13,64,60,4,2048,1408,16,32,256,64,8,3,941.1416666666668,3
w13,64,60,4,2048,1408,32,32,256,1,4,3,939.819,3
w13,64,60,4,2048,1408,32,32,256,1,8,3,938.187,3
w13,64,60,4,2048,1408,32,32,256,4,4,3,939.8936666666667,3
w13,64,60,4,2048,1408,32,32,256,4,8,3,939.1253333333334,3
w13,64,60,4,2048,1408,32,32,256,16,4,3,940.9923333333332,3
w13,64,60,4,2048,1408,32,32,256,16,8,3,940.32,3
w13,64,60,6,3584,2304,16,16,256,1,4,3,2671.454,3
w13,64,60,6,3584,2304,16,16,256,1,8,3,2681.0646666666667,3
w13,64,60,6,3584,2304,16,16,256,4,4,3,2671.517,3
w13,64,60,6,3584,2304,16,16,256,4,8,3,2683.2726666666667,3
w13,64,60,6,3584,2304,32,32,256,1,4,3,2676.6806666666666,3
w13,64,60,6,3584,2304,32,32,256,1,8,3,2677.6193333333335,3
w13,64,60,6,3584,2304,32,32,256,4,4,3,2679.815666666667,3
w13,64,60,6,3584,2304,32,32,256,4,8,3,2679.059333333333,3
w13,64,60,6,3584,2304,32,32,256,16,4,3,2687.1446666666666,3
w13,64,60,6,3584,2304,32,32,256,16,8,3,2684.894,3
w13,64,60,6,3584,2304,32,32,256,32,4,3,2690.1313333333333,3
w13,64,60,6,3584,2304,32,32,256,32,8,3,2689.598,3
w13,64,60,8,2048,1536,16,16,256,1,4,3,1027.6123333333333,3
w13,64,60,8,2048,1536,16,16,256,1,4,4,1035.154,3
w13,64,60,8,2048,1536,16,16,256,1,8,3,1030.1833333333334,3
w13,64,60,8,2048,1536,16,16,256,1,8,4,1036.253,3
w13,64,60,8,2048,1536,16,16,256,4,4,3,1027.7306666666666,3
w13,64,60,8,2048,1536,16,16,256,4,4,4,1033.7143333333333,3
w13,64,60,8,2048,1536,16,16,256,4,8,3,1029.8846666666668,3
w13,64,60,8,2048,1536,16,16,256,4,8,4,1035.666,3
w13,64,60,8,2048,1536,16,32,256,1,4,3,1034.6960000000001,3
w13,64,60,8,2048,1536,16,32,256,1,4,4,1033.373,3
w13,64,60,8,2048,1536,16,32,256,1,8,3,1034.2903333333334,3
w13,64,60,8,2048,1536,16,32,256,1,8,4,1035.037,3
w13,64,60,8,2048,1536,16,32,256,16,4,3,1035.6983333333335,3
w13,64,60,8,2048,1536,16,32,256,16,4,4,1037.3086666666668,3
w13,64,60,8,2048,1536,16,32,256,16,8,3,1035.1223333333335,3
w13,64,60,8,2048,1536,16,32,256,32,4,3,1037.6180000000002,3
w13,64,60,8,2048,1536,32,32,256,1,4,3,1031.943,3
w13,64,60,8,2048,1536,32,32,256,1,4,4,1035.9863333333333,3
w13,64,60,8,2048,1536,32,32,256,1,8,3,1030.7703333333332,3
w13,64,60,8,2048,1536,32,32,256,1,8,4,1036.2743333333335,3
w13,64,60,8,2048,1536,32,32,256,4,4,3,1031.8370000000002,3
w13,64,60,8,2048,1536,32,32,256,4,4,4,1036.1353333333334,3
w13,64,60,8,2048,1536,32,32,256,4,8,3,1030.8343333333332,3
w13,64,60,8,2048,1536,32,32,256,4,8,4,1036.0076666666666,3
w13,64,60,8,2048,1536,32,32,256,16,4,3,1037.7246666666667,3
w13,64,60,8,2048,1536,32,32,256,16,8,3,1036.1566666666668,3
w13,64,60,8,2048,1536,64,32,256,1,8,3,1036.797,3
w13,64,64,6,3072,2048,16,16,256,1,4,3,2169.575333333333,3
w13,64,64,6,3072,2048,16,16,256,1,8,3,2176.8396666666667,3
w13,64,64,6,3072,2048,16,16,256,4,4,3,2169.3940000000002,3
w13,64,64,6,3072,2048,16,16,256,4,8,3,2178.1733333333336,3
w13,64,64,6,3072,2048,32,32,256,1,4,3,2177.1383333333333,3
w13,64,64,6,3072,2048,32,32,256,1,8,3,2176.765,3
w13,64,64,6,3072,2048,32,32,256,4,4,3,2179.3783333333336,3
w13,64,64,6,3072,2048,32,32,256,4,8,3,2178.7916666666665,3
w13,64,64,6,3072,2048,32,32,256,16,4,3,2187.1973333333335,3
w13,64,64,6,3072,2048,32,32,256,16,8,3,2186.28,3
w13,64,64,6,3072,2048,32,32,256,32,8,3,2190.408,3
w13,64,64,6,3584,1536,16,16,256,1,4,3,1899.7783333333334,3
w13,64,64,6,3584,1536,16,16,256,1,8,3,1907.661,3
w13,64,64,6,3584,1536,16,16,256,4,4,3,1900.2156666666667,3
w13,64,64,6,3584,1536,16,16,256,4,8,3,1908.7486666666666,3
w13,64,64,6,3584,1536,32,32,256,1,4,3,1904.472,3
w13,64,64,6,3584,1536,32,32,256,1,8,3,1904.5143333333333,3
w13,64,64,6,3584,1536,32,32,256,4,4,3,1907.117,3
w13,64,64,6,3584,1536,32,32,256,4,8,3,1906.296,3
w13,64,64,6,3584,1536,32,32,256,16,4,3,1911.4263333333336,3
w13,64,64,6,3584,1536,32,32,256,16,8,3,1911.3943333333334,3
w13,64,64,6,3584,1536,32,32,256,32,4,3,1913.1116666666667,3
w13,64,64,6,3584,1536,32,32,256,32,8,3,1913.4633333333334,3
w13,64,64,8,3584,2560,16,16,256,1,4,3,3171.7236666666668,3
w13,64,64,8,3584,2560,16,16,256,1,8,3,3183.6913333333337,3
w13,64,64,8,3584,2560,16,16,256,4,4,3,3174.741666666667,3
w13,64,64,8,3584,2560,16,16,256,4,8,3,3187.9473333333335,3
w13,64,64,8,3584,2560,32,32,256,1,4,3,3180.736666666666,3
w13,64,64,8,3584,2560,32,32,256,1,8,3,3178.2513333333336,3
w13,64,64,8,3584,2560,32,32,256,4,4,3,3184.6936666666666,3
w13,64,64,8,3584,2560,32,32,256,4,8,3,3180.6936666666666,3
w13,64,64,8,3584,2560,32,32,256,16,4,3,3194.326333333333,3
w13,64,64,8,3584,2560,32,32,256,16,8,3,3192.545,3
w13,64,64,8,3584,2560,32,32,256,32,4,3,3199.8089999999997,3
w13,64,64,8,3584,2560,32,32,256,32,8,3,3198.1876666666667,3
w13,64,128,4,2048,512,16,16,256,1,4,3,721.4163333333332,3
w13,64,128,4,2048,512,16,16,256,1,4,4,727.6136666666666,3
w13,64,128,4,2048,512,16,16,256,1,8,3,723.9126666666666,3
w13,64,128,4,2048,512,16,16,256,4,4,3,721.4056666666667,3
w13,64,128,4,2048,512,16,16,256,4,4,4,727.3046666666665,3
w13,64,128,4,2048,512,16,16,256,4,8,3,724.8623333333334,3
w13,64,128,4,2048,512,16,32,256,1,4,3,724.094,3
w13,64,128,4,2048,512,16,32,256,1,4,4,726.942,3
w13,64,128,4,2048,512,16,32,256,1,8,3,725.2673333333333,3
w13,64,128,4,2048,512,16,32,256,1,8,4,728.5636666666666,3
w13,64,128,4,2048,512,16,32,256,16,4,3,723.4966666666666,3
w13,64,128,4,2048,512,16,32,256,16,4,4,727.145,3
w13,64,128,4,2048,512,16,32,256,16,8,3,724.6696666666667,3
w13,64,128,4,2048,512,16,32,256,16,8,4,728.275,3
w13,64,128,4,2048,512,16,32,256,32,4,3,724.062,3
w13,64,128,4,2048,512,16,32,256,32,4,4,728.0619999999999,3
w13,64,128,4,2048,512,16,32,256,32,8,3,725.4596666666666,3
w13,64,128,4,2048,512,16,32,256,64,4,3,725.2139999999999,3
w13,64,128,4,2048,512,16,32,256,64,4,4,728.6700000000001,3
w13,64,128,4,2048,512,16,32,256,64,8,3,726.4726666666667,3
w13,64,128,4,2048,512,32,32,256,1,4,3,725.9603333333333,3
w13,64,128,4,2048,512,32,32,256,1,8,3,725.8216666666667,3
w13,64,128,4,2048,512,32,32,256,4,4,3,726.323,3
w13,64,128,4,2048,512,32,32,256,4,8,3,725.747,3
w13,64,128,4,2048,512,32,32,256,16,4,3,726.5256666666668,3
w13,64,128,4,2048,512,32,32,256,16,8,3,726.206,3
w13,64,128,4,2048,512,32,32,256,32,4,3,727.753,3
w13,64,128,4,2048,512,32,32,256,32,8,3,727.123,3
w13,64,128,6,4096,2048,16,16,256,1,4,3,5732.359666666666,3
w13,64,128,6,4096,2048,16,16,256,1,8,3,5747.7626666666665,3
w13,64,128,6,4096,2048,16,16,256,4,4,3,5724.199666666666,3
w13,64,128,6,4096,2048,16,16,256,4,8,3,5748.626666666667,3
w13,64,128,6,4096,2048,16,32,256,16,4,3,5778.334666666667,3
w13,64,128,6,4096,2048,32,32,256,1,4,3,5779.028333333333,3
w13,64,128,6,4096,2048,32,32,256,1,8,3,5778.751333333334,3
w13,64,128,6,4096,2048,32,32,256,4,4,3,5776.788666666667,3
w13,64,128,6,4096,2048,32,32,256,4,8,3,5776.564666666666,3
w13,64,128,8,2048,768,16,16,256,1,4,3,1084.6003333333333,3
w13,64,128,8,2048,768,16,16,256,1,4,4,1093.6996666666666,3
w13,64,128,8,2048,768,16,16,256,1,8,3,1088.2916666666667,3
w13,64,128,8,2048,768,16,16,256,1,8,4,1095.4386666666667,3
w13,64,128,8,2048,768,16,16,256,4,4,3,1084.5263333333332,3
w13,64,128,8,2048,768,16,16,256,4,4,4,1092.8453333333334,3
w13,64,128,8,2048,768,16,16,256,4,8,3,1087.9286666666667,3
w13,64,128,8,2048,768,16,16,256,4,8,4,1094.6916666666666,3
w13,64,128,8,2048,768,16,32,256,1,4,3,1090.361,3
w13,64,128,8,2048,768,16,32,256,1,4,4,1092.7506666666668,3
w13,64,128,8,2048,768,16,32,256,1,8,3,1091.022,3
w13,64,128,8,2048,768,16,32,256,1,8,4,1094.222,3
w13,64,128,8,2048,768,16,32,256,16,4,3,1089.5186666666666,3
w13,64,128,8,2048,768,16,32,256,16,4,4,1095.3100000000002,3
w13,64,128,8,2048,768,16,32,256,16,8,3,1091.0013333333334,3
w13,64,128,8,2048,768,16,32,256,16,8,4,1095.215,3
w13,64,128,8,2048,768,16,32,256,32,4,3,1090.041,3
w13,64,128,8,2048,768,16,32,256,32,8,3,1092.5473333333332,3
w13,64,128,8,2048,768,16,32,256,64,4,3,1091.5873333333332,3
w13,64,128,8,2048,768,16,32,256,64,8,3,1093.39,3
w13,64,128,8,2048,768,32,32,256,1,4,3,1092.4733333333334,3
w13,64,128,8,2048,768,32,32,256,1,4,4,1095.2566666666667,3
w13,64,128,8,2048,768,32,32,256,1,8,3,1091.2143333333333,3
w13,64,128,8,2048,768,32,32,256,4,4,3,1091.448,3
w13,64,128,8,2048,768,32,32,256,4,8,3,1090.969,3
w13,64,128,8,2048,768,32,32,256,4,8,4,1095.1716666666669,3
w13,64,128,8,2048,768,32,32,256,16,4,3,1093.4433333333334,3
w13,64,128,8,2048,768,32,32,256,16,8,3,1093.9876666666667,3
w13,64,128,8,4096,1536,16,16,256,1,4,3,4303.483,3
w13,64,128,8,4096,1536,16,16,256,1,8,3,4316.219,3
w13,64,128,8,4096,1536,16,16,256,4,4,3,4304.901333333334,3
w13,64,128,8,4096,1536,16,16,256,4,8,3,4323.728666666667,3
w13,64,128,8,4096,1536,16,32,256,1,4,3,4341.734333333333,3
w13,64,128,8,4096,1536,32,32,256,1,4,3,4339.760666666666,3
w13,64,128,8,4096,1536,32,32,256,1,8,3,4338.480666666666,3
w13,64,128,8,4096,1536,32,32,256,4,4,3,4344.113,3
w13,64,128,8,4096,1536,32,32,256,4,8,3,4343.131333333334,3
w13,64,128,8,4096,3072,16,16,256,1,4,3,8600.865333333333,3
w13,64,128,8,4096,3072,16,16,256,1,8,3,8625.399666666666,3
w13,64,128,8,4096,3072,16,16,256,4,4,3,8605.794,3
w13,64,128,8,4096,3072,16,16,256,4,8,3,8644.002333333332,3
w13,64,128,8,4096,3072,16,32,256,1,4,3,8680.781666666668,3
w13,64,128,8,4096,3072,32,32,256,1,4,3,8674.840666666667,3
w13,64,128,8,4096,3072,32,32,256,1,8,3,8673.123333333335,3
w13,64,128,8,4096,3072,32,32,256,4,4,3,8682.659666666666,3
w13,64,128,8,4096,3072,32,32,256,4,8,3,8681.752333333334,3
w13,96,8,2,1024,512,32,64,64,1,8,3,7.532666666666667,3
w13,96,8,2,1024,512,32,64,128,1,8,4,7.489999999999999,3
w13,96,8,2,1024,512,32,64,128,4,8,4,7.532666666666667,3
w13,96,8,2,1024,512,32,64,128,16,8,4,7.554666666666667,3
w13,96,16,2,1536,768,16,64,32,1,4,4,19.180666666666667,3
w13,96,16,2,1536,768,16,128,32,1,8,4,19.191333333333333,3
w13,96,16,2,1536,768,16,128,64,1,8,3,19.138,3
w13,96,16,2,1536,768,16,128,64,16,8,3,19.084666666666667,3
w13,96,16,2,1536,768,16,128,64,32,8,3,19.084666666666667,3
w13,96,16,2,1536,768,16,128,64,64,8,3,19.074,3
w13,96,16,4,1536,1024,32,64,128,1,4,2,37.580666666666666,3
w13,96,16,4,1536,1024,32,64,128,1,8,2,37.324666666666666,3
w13,96,16,4,1536,1024,32,64,128,4,4,2,37.559,3
w13,96,16,4,1536,1024,32,64,128,4,8,2,37.452333333333335,3
w13,96,16,4,1536,1024,32,64,128,16,4,2,37.37833333333333,3
w13,96,16,4,1536,1024,32,64,128,16,8,2,37.677,3
w13,96,16,4,1536,1024,32,64,128,32,4,2,37.63366666666667,3
w13,96,16,4,1536,1024,32,64,128,32,8,2,37.452666666666666,3
w13,96,16,4,1536,1024,32,64,128,64,4,2,37.42066666666667,3
w13,96,16,4,1536,1024,32,64,128,64,8,2,37.677,3
w13,96,32,4,2048,768,16,32,256,1,4,2,271.57666666666665,3
w13,96,32,4,2048,768,16,64,256,1,4,2,272.675,3
w13,96,32,4,2048,768,32,32,128,1,4,2,272.21700000000004,3
w13,96,32,4,2048,768,32,32,256,1,4,2,272.6756666666667,3
w13,96,32,4,2048,768,32,64,256,1,4,2,273.1553333333333,3
w13,96,32,6,3072,1024,16,16,256,1,4,3,555.7916666666666,3
w13,96,32,6,3072,1024,16,16,256,1,4,4,558.7466666666667,3
w13,96,32,6,3072,1024,16,16,256,4,4,3,553.9676666666667,3
w13,96,32,6,3072,1024,16,32,256,1,4,3,557.563,3
w13,96,32,6,3072,1024,16,32,256,1,4,4,558.9706666666667,3
w13,96,32,6,3072,1024,16,32,256,1,8,3,559.1736666666667,3
w13,96,32,6,3072,1024,16,32,256,16,4,3,557.1366666666667,3
w13,96,32,6,3072,1024,16,32,256,16,8,3,559.3446666666667,3
w13,96,32,6,3072,1024,16,32,256,32,4,3,558.5333333333333,3
w13,96,32,6,3072,1024,16,64,256,1,4,3,559.525,3
w13,96,32,6,3072,1024,16,64,256,1,8,3,559.5573333333333,3
w13,96,32,6,3072,1024,16,64,256,16,4,3,558.9276666666666,3
w13,96,32,6,3072,1024,16,64,256,16,8,3,558.8746666666667,3
w13,96,32,6,3072,1024,32,32,256,1,4,3,556.4209999999999,3
w13,96,32,6,3072,1024,32,32,256,1,8,3,555.728,3
w13,96,32,6,3072,1024,32,32,256,4,4,3,557.317,3
w13,96,32,6,3072,1024,32,32,256,4,8,3,556.5493333333334,3
w13,96,32,6,3072,1024,32,32,256,16,4,3,559.1733333333333,3
w13,96,32,6,3072,1024,32,32,256,16,8,3,557.5203333333334,3
w13,96,32,6,3072,1024,32,32,256,32,8,3,559.3009999999999,3
w13,96,60,4,2048,1408,16,16,256,1,4,3,938.6353333333333,3
w13,96,60,4,2048,1408,16,16,256,1,4,4,946.4540000000001,3
w13,96,60,4,2048,1408,16,16,256,1,8,3,940.4913333333334,3
w13,96,60,4,2048,1408,16,16,256,4,4,3,937.6643333333333,3
w13,96,60,4,2048,1408,16,16,256,4,4,4,945.227,3
w13,96,60,4,2048,1408,16,16,256,4,8,3,941.846,3
w13,96,60,4,2048,1408,16,16,256,4,8,4,946.7309999999999,3
w13,96,60,4,2048,1408,16,32,256,1,4,3,944.651,3
w13,96,60,4,2048,1408,16,32,256,1,4,4,945.163,3
w13,96,60,4,2048,1408,16,32,256,1,8,3,945.4403333333333,3
w13,96,60,4,2048,1408,16,32,256,1,8,4,946.656,3
w13,96,60,4,2048,1408,16,32,256,16,4,3,942.7523333333334,3
w13,96,60,4,2048,1408,16,32,256,16,4,4,946.1229999999999,3
w13,96,60,4,2048,1408,16,32,256,16,8,3,943.8826666666668,3
w13,96,60,4,2048,1408,16,32,256,32,4,3,944.4483333333334,3
w13,96,60,4,2048,1408,16,32,256,32,8,3,945.3976666666667,3
w13,96,60,4,2048,1408,16,32,256,64,4,3,946.0376666666666,3
w13,96,60,4,2048,1408,16,32,256,64,8,3,947.1150000000001,3
w13,96,60,4,2048,1408,32,32,256,1,4,3,943.2539999999999,3
w13,96,60,4,2048,1408,32,32,256,1,8,3,942.486,3
w13,96,60,4,2048,1408,32,32,256,4,4,3,944.0003333333334,3
w13,96,60,4,2048,1408,32,32,256,4,8,3,943.5949999999999,3
w13,96,60,4,2048,1408,32,32,256,16,4,3,946.0593333333333,3
w13,96,60,4,2048,1408,32,32,256,16,8,3,945.4296666666665,3
w13,96,60,6,3584,2304,16,16,256,1,4,3,2686.782333333333,3
w13,96,60,6,3584,2304,16,16,256,1,4,4,2713.2143333333333,3
w13,96,60,6,3584,2304,16,16,256,1,8,3,2696.7236666666668,3
w13,96,60,6,3584,2304,16,16,256,4,4,3,2688.5316666666663,3
w13,96,60,6,3584,2304,16,16,256,4,8,3,2699.9346666666665,3
w13,96,60,6,3584,2304,16,32,256,1,4,4,2710.537333333333,3
w13,96,60,6,3584,2304,32,32,256,1,4,3,2689.2996666666663,3
w13,96,60,6,3584,2304,32,32,256,1,8,3,2687.7323333333334,3
w13,96,60,6,3584,2304,32,32,256,1,8,4,2713.2893333333336,3
w13,96,60,6,3584,2304,32,32,256,4,4,3,2692.19,3
w13,96,60,6,3584,2304,32,32,256,4,8,3,2692.393666666667,3
w13,96,60,6,3584,2304,32,32,256,16,4,3,2700.1903333333335,3
w13,96,60,6,3584,2304,32,32,256,16,8,3,2700.148333333333,3
w13,96,60,6,3584,2304,32,32,256,32,4,3,2706.4093333333335,3
w13,96,60,6,3584,2304,32,32,256,32,8,3,2704.0946666666664,3
w13,96,60,8,2048,1536,16,16,256,1,4,3,1037.7886666666666,3
w13,96,60,8,2048,1536,16,16,256,1,4,4,1043.08,3
w13,96,60,8,2048,1536,16,16,256,1,8,3,1038.578,3
w13,96,60,8,2048,1536,16,16,256,1,8,4,1043.6983333333335,3
w13,96,60,8,2048,1536,16,16,256,4,4,3,1035.8476666666668,3
w13,96,60,8,2048,1536,16,16,256,4,4,4,1041.7993333333334,3
w13,96,60,8,2048,1536,16,16,256,4,8,3,1039.7513333333334,3
w13,96,60,8,2048,1536,16,16,256,4,8,4,1043.826,3
w13,96,60,8,2048,1536,16,32,256,1,4,3,1044.4986666666666,3
w13,96,60,8,2048,1536,16,32,256,1,4,4,1040.9573333333335,3
w13,96,60,8,2048,1536,16,32,256,1,8,3,1043.5813333333333,3
w13,96,60,8,2048,1536,16,32,256,1,8,4,1041.9279999999999,3
w13,96,60,8,2048,1536,16,32,256,16,4,3,1043.1543333333334,3
w13,96,60,8,2048,1536,16,32,256,16,4,4,1044.2316666666666,3
w13,96,60,8,2048,1536,16,32,256,16,8,3,1044.232,3
w13,96,60,8,2048,1536,16,32,256,16,8,4,1045.1490000000001,3
w13,96,60,8,2048,1536,16,32,256,32,4,3,1045.1063333333334,3
w13,96,60,8,2048,1536,32,32,256,1,4,3,1038.045,3
w13,96,60,8,2048,1536,32,32,256,1,4,4,1043.2186666666666,3
w13,96,60,8,2048,1536,32,32,256,1,8,3,1037.9066666666668,3
w13,96,60,8,2048,1536,32,32,256,1,8,4,1042.7920000000001,3
w13,96,60,8,2048,1536,32,32,256,4,4,3,1038.6423333333332,3
w13,96,60,8,2048,1536,32,32,256,4,4,4,1044.413,3
w13,96,60,8,2048,1536,32,32,256,4,8,3,1038.461,3
w13,96,60,8,2048,1536,32,32,256,4,8,4,1043.528,3
w13,96,60,8,2048,1536,32,32,256,16,4,3,1043.496,3
w13,96,60,8,2048,1536,32,32,256,16,8,3,1042.4930000000002,3
w13,96,60,8,2048,1536,64,32,256,1,8,3,1045.0213333333334,3
w13,96,64,6,3072,2048,16,16,256,1,4,3,2182.1086666666665,3
w13,96,64,6,3072,2048,16,16,256,1,8,3,2188.605,3
w13,96,64,6,3072,2048,16,16,256,4,4,3,2181.0956666666666,3
w13,96,64,6,3072,2048,16,16,256,4,8,3,2189.2876666666666,3
w13,96,64,6,3072,2048,32,32,256,1,4,3,2187.2073333333333,3
w13,96,64,6,3072,2048,32,32,256,1,8,3,2186.141,3
w13,96,64,6,3072,2048,32,32,256,4,4,3,2189.842,3
w13,96,64,6,3072,2048,32,32,256,4,8,3,2188.3593333333333,3
w13,96,64,6,3072,2048,32,32,256,16,4,3,2198.7383333333332,3
w13,96,64,6,3072,2048,32,32,256,16,8,3,2197.991666666667,3
w13,96,64,6,3584,1536,16,16,256,1,4,3,1910.1786666666667,3
w13,96,64,6,3584,1536,16,16,256,1,8,3,1917.997,3
w13,96,64,6,3584,1536,16,16,256,4,4,3,1910.3813333333335,3
w13,96,64,6,3584,1536,16,16,256,4,8,3,1918.5516666666665,3
w13,96,64,6,3584,1536,16,32,256,1,4,4,1927.9063333333334,3
w13,96,64,6,3584,1536,32,32,256,1,4,3,1912.4183333333333,3
w13,96,64,6,3584,1536,32,32,256,1,8,3,1913.1863333333333,3
w13,96,64,6,3584,1536,32,32,256,4,4,3,1914.2216666666666,3
w13,96,64,6,3584,1536,32,32,256,4,8,3,1913.8903333333335,3
w13,96,64,6,3584,1536,32,32,256,16,4,3,1921.8370000000002,3
w13,96,64,6,3584,1536,32,32,256,16,8,3,1922.2430000000002,3
w13,96,64,6,3584,1536,32,32,256,32,4,3,1924.6213333333333,3
w13,96,64,6,3584,1536,32,32,256,32,8,3,1924.0026666666665,3
w13,96,64,8,3584,2560,16,16,256,1,4,3,3199.275666666667,3
w13,96,64,8,3584,2560,16,16,256,1,4,4,3224.577333333333,3
w13,96,64,8,3584,2560,16,16,256,1,8,3,3210.9876666666664,3
w13,96,64,8,3584,2560,16,16,256,1,8,4,3227.009,3
w13,96,64,8,3584,2560,16,16,256,4,4,3,3198.3050000000003,3
w13,96,64,8,3584,2560,16,16,256,4,4,4,3226.998333333333,3
w13,96,64,8,3584,2560,16,16,256,4,8,3,3209.345333333333,3
w13,96,64,8,3584,2560,16,32,256,1,4,4,3221.5373333333337,3
w13,96,64,8,3584,2560,16,32,256,1,8,4,3226.711,3
w13,96,64,8,3584,2560,32,32,256,1,4,3,3196.6516666666666,3
w13,96,64,8,3584,2560,32,32,256,1,4,4,3226.721666666667,3
w13,96,64,8,3584,2560,32,32,256,1,8,3,3195.9263333333333,3
w13,96,64,8,3584,2560,32,32,256,1,8,4,3225.8463333333334,3
w13,96,64,8,3584,2560,32,32,256,4,4,3,3201.4943333333335,3
w13,96,64,8,3584,2560,32,32,256,4,8,3,3199.2009999999996,3
w13,96,64,8,3584,2560,32,32,256,16,4,3,3212.3530000000005,3
w13,96,64,8,3584,2560,32,32,256,16,8,3,3210.7426666666665,3
w13,96,64,8,3584,2560,32,32,256,32,4,3,3219.4786666666664,3
w13,96,64,8,3584,2560,32,32,256,32,8,3,3217.42,3
w13,96,128,4,2048,512,16,16,256,1,4,3,722.0243333333334,3
w13,96,128,4,2048,512,16,16,256,1,4,4,728.8833333333332,3
w13,96,128,4,2048,512,16,16,256,1,8,3,725.0856666666667,3
w13,96,128,4,2048,512,16,16,256,4,4,3,722.9206666666668,3
w13,96,128,4,2048,512,16,16,256,4,4,4,728.9050000000001,3
w13,96,128,4,2048,512,16,16,256,4,8,3,726.5576666666666,3
w13,96,128,4,2048,512,16,32,256,1,4,3,725.6623333333333,3
w13,96,128,4,2048,512,16,32,256,1,4,4,728.8836666666666,3
w13,96,128,4,2048,512,16,32,256,1,8,3,726.291,3
w13,96,128,4,2048,512,16,32,256,16,4,3,725.5866666666667,3
w13,96,128,4,2048,512,16,32,256,16,4,4,728.6703333333334,3
w13,96,128,4,2048,512,16,32,256,16,8,3,726.6003333333333,3
w13,96,128,4,2048,512,16,32,256,32,4,3,725.8863333333334,3
w13,96,128,4,2048,512,16,32,256,32,8,3,726.59,3
w13,96,128,4,2048,512,16,32,256,64,4,3,728.041,3
w13,96,128,4,2048,512,16,32,256,64,8,3,728.4783333333334,3
w13,96,128,4,2048,512,32,32,256,1,4,3,728.1583333333333,3
w13,96,128,4,2048,512,32,32,256,1,8,3,727.0593333333333,3
w13,96,128,4,2048,512,32,32,256,4,4,3,728.4993333333333,3
w13,96,128,4,2048,512,32,32,256,4,8,3,727.774,3
w13,96,128,4,2048,512,32,32,256,16,8,3,728.1790000000001,3
w13,96,128,4,2048,512,32,32,256,32,8,3,729.2993333333334,3
w13,96,128,6,4096,2048,16,16,256,1,4,3,5737.463,3
w13,96,128,6,4096,2048,16,16,256,1,8,3,5755.543000000001,3
w13,96,128,6,4096,2048,16,16,256,4,4,3,5731.009999999999,3
w13,96,128,6,4096,2048,16,16,256,4,8,3,5757.613,3
w13,96,128,6,4096,2048,32,32,256,1,4,3,5786.830666666666,3
w13,96,128,6,4096,2048,32,32,256,1,8,3,5788.142333333333,3
w13,96,128,6,4096,2048,32,32,256,4,4,3,5784.483666666667,3
w13,96,128,6,4096,2048,32,32,256,4,8,3,5783.779666666666,3
w13,96,128,8,2048,768,16,16,256,1,4,3,1088.7393333333332,3
w13,96,128,8,2048,768,16,16,256,1,4,4,1097.657,3
w13,96,128,8,2048,768,16,16,256,1,8,3,1090.4033333333334,3
w13,96,128,8,2048,768,16,16,256,4,4,3,1087.5876666666666,3
w13,96,128,8,2048,768,16,16,256,4,4,4,1096.8036666666667,3
w13,96,128,8,2048,768,16,16,256,4,8,3,1091.182,3
w13,96,128,8,2048,768,16,32,256,1,4,3,1093.2513333333334,3
w13,96,128,8,2048,768,16,32,256,1,4,4,1097.134,3
w13,96,128,8,2048,768,16,32,256,1,8,3,1093.9126666666668,3
w13,96,128,8,2048,768,16,32,256,1,8,4,1098.5,3
w13,96,128,8,2048,768,16,32,256,16,4,3,1091.1606666666667,3
w13,96,128,8,2048,768,16,32,256,16,4,4,1096.3983333333333,3
w13,96,128,8,2048,768,16,32,256,16,8,3,1091.9506666666666,3
w13,96,128,8,2048,768,16,32,256,32,4,3,1093.7630000000001,3
w13,96,128,8,2048,768,16,32,256,32,8,3,1096.3980000000001,3
w13,96,128,8,2048,768,16,32,256,64,4,3,1097.7213333333332,3
w13,96,128,8,2048,768,16,64,256,16,8,3,1098.3500000000001,3
w13,96,128,8,2048,768,32,32,256,1,4,3,1096.0143333333333,3
w13,96,128,8,2048,768,32,32,256,1,8,3,1094.5313333333334,3
w13,96,128,8,2048,768,32,32,256,4,4,3,1095.3206666666667,3
w13,96,128,8,2048,768,32,32,256,4,8,3,1095.1823333333332,3
w13,96,128,8,2048,768,32,32,256,16,4,3,1097.817,3
w13,96,128,8,2048,768,32,32,256,16,8,3,1096.3023333333333,3
w13,96,128,8,4096,1536,16,16,256,1,4,3,4307.079666666667,3
w13,96,128,8,4096,1536,16,16,256,1,8,3,4321.991666666666,3
w13,96,128,8,4096,1536,16,16,256,4,4,3,4312.626333333334,3
w13,96,128,8,4096,1536,16,16,256,4,8,3,4332.392,3
w13,96,128,8,4096,1536,32,32,256,1,4,3,4348.701333333333,3
w13,96,128,8,4096,1536,32,32,256,1,8,3,4347.539333333333,3
w13,96,128,8,4096,3072,16,16,256,1,4,3,8609.678333333333,3
w13,96,128,8,4096,3072,16,16,256,1,8,3,8637.572333333334,3
w13,96,128,8,4096,3072,16,16,256,4,4,3,8634.969,3
w13,96,128,8,4096,3072,16,16,256,4,8,3,8668.537666666665,3
w13,96,128,8,4096,3072,32,32,256,1,4,3,8691.695333333333,3
w13,96,128,8,4096,3072,32,32,256,1,8,3,8689.754666666668,3
w13,128,8,2,1024,512,32,64,64,1,8,3,7.575333333333333,3
w13,128,8,2,1024,512,32,64,64,1,8,4,7.639333333333333,3
w13,128,8,2,1024,512,32,64,64,16,8,3,7.639333333333333,3
w13,128,16,2,1536,768,16,128,32,1,4,4,19.490333333333332,3
w13,128,16,2,1536,768,16,128,32,1,8,3,19.501,3
w13,128,16,2,1536,768,16,128,64,1,8,3,19.458666666666666,3
w13,128,16,2,1536,768,16,128,64,16,8,3,19.618,3
w13,128,16,2,1536,768,16,128,64,32,8,3,19.596666666666664,3
w13,128,16,2,1536,768,16,128,64,64,8,3,19.500666666666664,3
w13,128,16,2,1536,768,16,256,64,1,8,3,19.554,3
w13,128,16,4,1536,1024,32,64,128,1,8,2,43.38366666666667,3
w13,128,16,4,1536,1024,32,64,128,16,8,2,43.341,3
w13,128,16,4,1536,1024,32,64,128,32,8,2,43.181000000000004,3
w13,128,16,4,1536,1024,32,64,128,64,8,2,43.405,3
w13,128,16,4,1536,1024,32,128,128,1,8,2,43.06333333333333,3
w13,128,32,4,2048,768,16,32,256,1,4,2,273.817,3
w13,128,32,4,2048,768,16,64,256,1,4,2,274.94733333333335,3
w13,128,32,4,2048,768,32,32,128,1,4,2,274.2223333333333,3
w13,128,32,4,2048,768,32,32,256,1,4,2,275.0216666666667,3
w13,128,32,4,2048,768,32,64,256,1,4,2,275.28866666666664,3
w13,128,32,6,3072,1024,16,16,256,1,4,3,559.003,3
w13,128,32,6,3072,1024,16,16,256,1,4,4,561.6476666666666,3
w13,128,32,6,3072,1024,16,16,256,4,4,3,556.9863333333333,3
w13,128,32,6,3072,1024,16,16,256,4,8,3,562.4476666666667,3
w13,128,32,6,3072,1024,16,32,256,1,4,3,561.5733333333334,3
w13,128,32,6,3072,1024,16,32,256,1,4,4,562.1819999999999,3
w13,128,32,6,3072,1024,16,32,256,1,8,3,562.2023333333333,3
w13,128,32,6,3072,1024,16,32,256,1,8,4,562.3093333333333,3
w13,128,32,6,3072,1024,16,32,256,16,4,3,561.8513333333333,3
w13,128,32,6,3072,1024,16,32,256,32,4,3,562.032,3
w13,128,32,6,3072,1024,16,64,256,1,4,3,562.3733333333333,3
w13,128,32,6,3072,1024,16,64,256,16,8,3,562.5546666666668,3
w13,128,32,6,3072,1024,32,32,256,1,4,3,560.07,3
w13,128,32,6,3072,1024,32,32,256,1,8,3,559.5676666666667,3
w13,128,32,6,3072,1024,32,32,256,4,4,3,560.283,3
w13,128,32,6,3072,1024,32,32,256,4,8,3,559.5680000000001,3
w13,128,32,6,3072,1024,32,32,256,16,4,3,561.5943333333333,3
w13,128,32,6,3072,1024,32,32,256,16,8,3,561.648,3
w13,128,60,4,2048,1408,16,16,256,1,4,3,942.6566666666668,3
w13,128,60,4,2048,1408,16,16,256,1,4,4,950.3470000000001,3
w13,128,60,4,2048,1408,16,16,256,1,8,3,945.8786666666666,3
w13,128,60,4,2048,1408,16,16,256,1,8,4,951.2223333333333,3
w13,128,60,4,2048,1408,16,16,256,4,4,3,942.433,3
w13,128,60,4,2048,1408,16,16,256,4,4,4,949.2483333333333,3
w13,128,60,4,2048,1408,16,16,256,4,8,3,945.5793333333335,3
w13,128,60,4,2048,1408,16,16,256,4,8,4,950.849,3
w13,128,60,4,2048,1408,16,32,256,1,4,3,948.9496666666668,3
w13,128,60,4,2048,1408,16,32,256,1,4,4,948.7693333333333,3
w13,128,60,4,2048,1408,16,32,256,1,8,3,949.995,3
w13,128,60,4,2048,1408,16,32,256,1,8,4,950.2620000000001,3
w13,128,60,4,2048,1408,16,32,256,16,4,3,949.3976666666667,3
w13,128,60,4,2048,1408,16,32,256,16,4,4,950.2943333333333,3
w13,128,60,4,2048,1408,16,32,256,16,8,3,948.9286666666667,3
w13,128,60,4,2048,1408,16,32,256,32,4,3,950.0383333333333,3
w13,128,60,4,2048,1408,16,32,256,32,8,3,950.8376666666667,3
w13,128,60,4,2048,1408,16,32,256,64,4,3,951.489,3
w13,128,60,4,2048,1408,32,32,256,1,4,3,946.8066666666667,3
w13,128,60,4,2048,1408,32,32,256,1,4,4,951.3283333333334,3
w13,128,60,4,2048,1408,32,32,256,1,8,3,945.8466666666667,3
w13,128,60,4,2048,1408,32,32,256,1,8,4,951.0936666666666,3
w13,128,60,4,2048,1408,32,32,256,4,4,3,947.4140000000001,3
w13,128,60,4,2048,1408,32,32,256,4,4,4,951.2753333333334,3
w13,128,60,4,2048,1408,32,32,256,4,8,3,946.8913333333334,3
w13,128,60,4,2048,1408,32,32,256,4,8,4,951.7763333333334,3
w13,128,60,4,2048,1408,32,32,256,16,4,3,949.7613333333334,3
w13,128,60,4,2048,1408,32,32,256,16,8,3,948.8113333333334,3
w13,128,60,4,2048,1408,64,32,256,1,8,3,951.9473333333334,3
w13,128,60,6,3584,2304,16,16,256,1,4,3,2708.384,3
w13,128,60,6,3584,2304,16,16,256,1,8,3,2715.3276666666666,3
w13,128,60,6,3584,2304,16,16,256,4,4,3,2708.628666666667,3
w13,128,60,6,3584,2304,16,16,256,4,8,3,2713.216,3
w13,128,60,6,3584,2304,16,32,256,1,4,4,2721.8663333333334,3
w13,128,60,6,3584,2304,32,32,256,1,4,3,2699.125,3
w13,128,60,6,3584,2304,32,32,256,1,8,3,2697.2476666666666,3
w13,128,60,6,3584,2304,32,32,256,4,4,3,2703.52,3
w13,128,60,6,3584,2304,32,32,256,4,8,3,2701.9519999999998,3
w13,128,60,6,3584,2304,32,32,256,16,4,3,2712.2556666666665,3
w13,128,60,6,3584,2304,32,32,256,16,8,3,2711.6583333333333,3
w13,128,60,6,3584,2304,32,32,256,32,4,3,2717.589,3
w13,128,60,6,3584,2304,32,32,256,32,8,3,2716.7253333333333,3
w13,128,60,8,2048,1536,16,16,256,1,4,3,1039.1333333333334,3
w13,128,60,8,2048,1536,16,16,256,1,8,3,1043.6453333333332,3
w13,128,60,8,2048,1536,16,16,256,4,4,3,1039.635,3
w13,128,60,8,2048,1536,16,16,256,4,4,4,1045.747,3
w13,128,60,8,2048,1536,16,16,256,4,8,3,1045.9816666666666,3
w13,128,60,8,2048,1536,16,32,256,16,4,3,1043.7413333333334,3
w13,128,60,8,2048,1536,16,32,256,16,4,4,1047.7626666666667,3
w13,128,60,8,2048,1536,16,32,256,16,8,3,1045.8853333333334,3
w13,128,60,8,2048,1536,16,32,256,32,4,3,1046.9413333333332,3
w13,128,60,8,2048,1536,16,32,256,32,8,3,1048.712,3
w13,128,60,8,2048,1536,16,32,256,64,4,3,1049.3626666666667,3
w13,128,60,8,2048,1536,16,64,256,16,4,3,1049.608,3
w13,128,60,8,2048,1536,16,64,256,16,8,3,1049.4586666666667,3
w13,128,60,8,2048,1536,32,32,256,1,4,3,1043.582,3
w13,128,60,8,2048,1536,32,32,256,1,4,4,1048.6270000000002,3
w13,128,60,8,2048,1536,32,32,256,1,8,3,1042.6323333333332,3
w13,128,60,8,2048,1536,32,32,256,1,8,4,1048.3603333333333,3
w13,128,60,8,2048,1536,32,32,256,4,4,3,1045.48,3
w13,128,60,8,2048,1536,32,32,256,4,8,3,1043.8906666666667,3
w13,128,60,8,2048,1536,32,32,256,16,8,3,1049.0113333333331,3
w13,128,60,8,2048,1536,64,32,256,1,8,3,1049.5546666666667,3
w13,128,64,6,3072,2048,16,16,256,1,4,3,2199.750666666667,3
w13,128,64,6,3072,2048,16,16,256,1,8,3,2201.1806666666666,3
w13,128,64,6,3072,2048,16,16,256,4,4,3,2196.561666666667,3
w13,128,64,6,3072,2048,16,16,256,4,8,3,2203.6233333333334,3
w13,128,64,6,3072,2048,16,32,256,1,4,4,2216.1349999999998,3
w13,128,64,6,3072,2048,32,32,256,1,4,3,2195.5589999999997,3
w13,128,64,6,3072,2048,32,32,256,1,8,3,2194.6626666666666,3
w13,128,64,6,3072,2048,32,32,256,4,4,3,2199.399,3
w13,128,64,6,3072,2048,32,32,256,4,8,3,2198.961333333333,3
w13,128,64,6,3072,2048,32,32,256,16,4,3,2210.14,3
w13,128,64,6,3072,2048,32,32,256,16,8,3,2210.0123333333336,3
w13,128,64,6,3072,2048,32,32,256,32,4,3,2216.145666666667,3
w13,128,64,6,3072,2048,32,32,256,32,8,3,2214.3963333333336,3
w13,128,64,6,3072,2048,64,32,256,1,8,3,2215.4519999999998,3
w13,128,64,6,3584,1536,16,16,256,1,4,3,1919.918,3
w13,128,64,6,3584,1536,16,16,256,1,8,3,1926.7763333333332,3
w13,128,64,6,3584,1536,16,16,256,4,4,3,1921.187,3
w13,128,64,6,3584,1536,16,16,256,4,8,3,1927.0536666666667,3
w13,128,64,6,3584,1536,16,32,256,1,4,4,1934.9896666666666,3
w13,128,64,6,3584,1536,32,32,256,1,4,3,1917.8693333333333,3
w13,128,64,6,3584,1536,32,32,256,1,8,3,1917.5816666666667,3
w13,128,64,6,3584,1536,32,32,256,4,4,3,1922.2213333333332,3
w13,128,64,6,3584,1536,32,32,256,4,8,3,1920.2696666666668,3
w13,128,64,6,3584,1536,32,32,256,16,4,3,1931.47,3
w13,128,64,6,3584,1536,32,32,256,16,8,3,1929.3576666666668,3
w13,128,64,6,3584,1536,32,32,256,32,4,3,1934.0083333333332,3
w13,128,64,6,3584,1536,32,32,256,32,8,3,1932.0349999999999,3
w13,128,64,8,3584,2560,16,16,256,1,4,3,3225.5903333333335,3
w13,128,64,8,3584,2560,16,16,256,1,8,3,3224.118,3
w13,128,64,8,3584,2560,16,16,256,4,4,3,3227.521,3
w13,128,64,8,3584,2560,16,16,256,4,8,3,3227.67,3
w13,128,64,8,3584,2560,16,32,256,1,4,4,3237.3026666666665,3
w13,128,64,8,3584,2560,32,32,256,1,4,3,3208.5339999999997,3
w13,128,64,8,3584,2560,32,32,256,1,8,3,3206.2196666666664,3
w13,128,64,8,3584,2560,32,32,256,4,4,3,3213.5903333333335,3
w13,128,64,8,3584,2560,32,32,256,4,8,3,3213.686,3
w13,128,64,8,3584,2560,32,32,256,16,4,3,3228.619666666667,3
w13,128,64,8,3584,2560,32,32,256,16,8,3,3227.5743333333335,3
w13,128,64,8,3584,2560,32,32,256,32,4,3,3235.7876666666666,3
w13,128,64,8,3584,2560,32,32,256,32,8,3,3236.6306666666665,3
w13,128,128,4,2048,512,16,16,256,1,4,3,723.3580000000001,3
w13,128,128,4,2048,512,16,16,256,1,4,4,730.5583333333334,3
w13,128,128,4,2048,512,16,16,256,1,8,3,726.6006666666667,3
w13,128,128,4,2048,512,16,16,256,4,4,3,724.1259999999999,3
w13,128,128,4,2048,512,16,16,256,4,8,3,727.8383333333333,3
w13,128,128,4,2048,512,16,32,256,1,4,3,727.3793333333333,3
w13,128,128,4,2048,512,16,32,256,1,4,4,730.2166666666667,3
w13,128,128,4,2048,512,16,32,256,1,8,3,727.8803333333334,3
w13,128,128,4,2048,512,16,32,256,16,4,3,727.4323333333333,3
w13,128,128,4,2048,512,16,32,256,16,8,3,728.3716666666666,3
w13,128,128,4,2048,512,16,32,256,32,4,3,728.4033333333333,3
w13,128,128,4,2048,512,16,32,256,32,8,3,728.9366666666666,3
w13,128,128,4,2048,512,16,32,256,64,4,3,730.0036666666666,3
w13,128,128,4,2048,512,16,32,256,64,8,3,730.0143333333334,3
w13,128,128,4,2048,512,32,32,256,1,4,3,729.0219999999999,3
w13,128,128,4,2048,512,32,32,256,1,8,3,729.0543333333334,3
w13,128,128,4,2048,512,32,32,256,4,4,3,729.6723333333333,3
w13,128,128,4,2048,512,32,32,256,4,8,3,729.4376666666667,3
w13,128,128,4,2048,512,32,32,256,16,4,3,730.6326666666668,3
w13,128,128,4,2048,512,32,32,256,16,8,3,730.0143333333334,3
w13,128,128,6,4096,2048,16,16,256,1,4,3,5756.9766666666665,3
w13,128,128,6,4096,2048,16,16,256,1,8,3,5770.8859999999995,3
w13,128,128,6,4096,2048,16,16,256,4,4,3,5745.701666666667,3
w13,128,128,6,4096,2048,16,16,256,4,8,3,5767.686000000001,3
w13,128,128,6,4096,2048,32,32,256,1,4,3,5797.702333333334,3
w13,128,128,6,4096,2048,32,32,256,1,8,3,5797.446333333333,3
w13,128,128,6,4096,2048,32,32,256,4,4,3,5795.004333333333,3
w13,128,128,6,4096,2048,32,32,256,4,8,3,5793.276333333332,3
w13,128,128,8,2048,768,16,16,256,1,4,3,1092.729,3
w13,128,128,8,2048,768,16,16,256,1,4,4,1102.7346666666665,3
w13,128,128,8,2048,768,16,16,256,1,8,3,1095.9826666666665,3
w13,128,128,8,2048,768,16,16,256,1,8,4,1103.5876666666666,3
w13,128,128,8,2048,768,16,16,256,4,4,3,1092.6013333333333,3
w13,128,128,8,2048,768,16,16,256,4,4,4,1101.1233333333332,3
w13,128,128,8,2048,768,16,16,256,4,8,3,1096.4306666666666,3
w13,128,128,8,2048,768,16,16,256,4,8,4,1102.8086666666666,3
w13,128,128,8,2048,768,16,32,256,1,4,3,1099.8016666666665,3
w13,128,128,8,2048,768,16,32,256,1,4,4,1101.5613333333333,3
w13,128,128,8,2048,768,16,32,256,1,8,3,1100.974,3
w13,128,128,8,2048,768,16,32,256,1,8,4,1103.0546666666667,3
w13,128,128,8,2048,768,16,32,256,16,4,3,1100.9426666666666,3
w13,128,128,8,2048,768,16,32,256,16,8,3,1102.7026666666668,3
w13,128,128,8,2048,768,16,32,256,32,4,3,1102.617,3
w13,128,128,8,2048,768,32,32,256,1,4,3,1099.3106666666665,3
w13,128,128,8,2048,768,32,32,256,1,8,3,1099.0646666666667,3
w13,128,128,8,2048,768,32,32,256,4,4,3,1099.1606666666667,3
w13,128,128,8,2048,768,32,32,256,4,8,3,1098.6063333333334,3
w13,128,128,8,2048,768,32,32,256,4,8,4,1103.3419999999999,3
w13,128,128,8,2048,768,32,32,256,16,4,3,1103.5126666666667,3
w13,128,128,8,2048,768,32,32,256,16,8,3,1103.2673333333335,3
w13,128,128,8,4096,1536,16,16,256,1,4,3,4324.137333333333,3
w13,128,128,8,4096,1536,16,16,256,1,8,3,4336.670666666667,3
w13,128,128,8,4096,1536,16,16,256,4,4,3,4327.4439999999995,3
w13,128,128,8,4096,1536,16,16,256,4,8,3,4347.113666666667,3
w13,128,128,8,4096,1536,16,32,256,1,4,3,4360.489666666667,3
w13,128,128,8,4096,1536,32,32,256,1,4,3,4357.972333333334,3
w13,128,128,8,4096,1536,32,32,256,1,8,3,4357.332333333333,3
w13,128,128,8,4096,1536,32,32,256,4,4,3,4365.247666666666,3
w13,128,128,8,4096,1536,32,32,256,4,8,3,4365.002333333334,3
w13,128,128,8,4096,3072,16,16,256,1,4,3,8631.994333333334,3
w13,128,128,8,4096,3072,16,16,256,1,8,3,8664.112,3
w13,128,128,8,4096,3072,16,16,256,4,4,3,8656.036999999998,3
w13,128,128,8,4096,3072,16,16,256,4,8,3,8697.019333333332,3
w13,128,128,8,4096,3072,32,32,256,1,4,3,8708.902333333333,3
w13,128,128,8,4096,3072,32,32,256,1,8,3,8707.131,3
w13,256,8,2,1024,512,64,64,64,1,4,3,11.223333333333334,3
w13,256,8,2,1024,512,64,64,64,1,4,4,11.276666666666666,3
w13,256,8,2,1024,512,64,64,64,4,4,3,11.276666666666666,3
w13,256,8,2,1024,512,64,64,64,16,4,3,11.223333333333334,3
w13,256,8,2,1024,512,64,64,64,16,4,4,11.277000000000001,3
w13,256,8,2,1024,512,64,64,64,32,4,3,11.202,3
w13,256,8,2,1024,512,64,64,64,32,4,4,11.287333333333335,3
w13,256,8,2,1024,512,64,64,64,64,4,3,11.244666666666667,3
w13,256,8,2,1024,512,64,64,64,64,4,4,11.265666666666666,3
w13,256,16,2,1536,768,32,64,32,2,4,3,24.77,3
w13,256,16,2,1536,768,32,64,32,2,4,4,24.695333333333334,3
w13,256,16,2,1536,768,32,64,64,1,8,3,24.929999999999996,3
w13,256,16,4,1536,1024,32,128,64,32,8,2,70.26333333333334,3
w13,256,16,4,1536,1024,32,128,64,64,8,2,70.829,3
w13,256,16,4,1536,1024,64,128,128,1,8,2,70.76433333333334,3
w13,256,32,4,2048,768,16,32,256,1,4,2,278.57466666666664,3
w13,256,32,4,2048,768,16,64,256,1,4,2,279.971,3
w13,256,32,4,2048,768,32,32,128,1,4,2,278.92633333333333,3
w13,256,32,4,2048,768,32,32,256,1,4,2,280.13166666666666,3
w13,256,32,6,3072,1024,16,16,256,1,4,3,572.6350000000001,3
w13,256,32,6,3072,1024,16,32,256,1,4,3,572.9549999999999,3
w13,256,32,6,3072,1024,16,32,256,16,4,3,569.755,3
w13,256,32,6,3072,1024,16,32,256,16,8,3,571.707,3
w13,256,32,6,3072,1024,16,64,256,16,4,3,571.1633333333333,3
w13,256,32,6,3072,1024,16,64,256,16,8,3,571.334,3
w13,256,32,6,3072,1024,32,32,256,1,4,3,568.1233333333333,3
w13,256,32,6,3072,1024,32,32,256,1,8,3,567.4616666666667,3
w13,256,32,6,3072,1024,32,32,256,1,8,4,572.7843333333334,3
w13,256,32,6,3072,1024,32,32,256,4,4,3,569.2966666666666,3
w13,256,32,6,3072,1024,32,32,256,4,8,3,568.8166666666667,3
w13,256,32,6,3072,1024,32,32,256,16,4,3,571.6216666666667,3
w13,256,32,6,3072,1024,32,32,256,16,8,3,570.5866666666667,3
w13,256,32,6,3072,1024,32,32,256,32,4,3,571.8886666666667,3
w13,256,32,6,3072,1024,32,32,256,32,8,3,570.7683333333333,3
w13,256,60,4,2048,1408,16,16,256,1,4,3,955.9053333333333,3
w13,256,60,4,2048,1408,16,16,256,1,8,3,960.9933333333333,3
w13,256,60,4,2048,1408,16,16,256,4,4,3,955.0513333333333,3
w13,256,60,4,2048,1408,16,16,256,4,4,4,961.1526666666667,3
w13,256,60,4,2048,1408,16,16,256,4,8,3,960.9933333333333,3
w13,256,60,4,2048,1408,16,16,256,4,8,4,964.5556666666666,3
w13,256,60,4,2048,1408,16,32,256,1,4,3,964.1826666666666,3
w13,256,60,4,2048,1408,16,32,256,16,4,3,957.5046666666667,3
w13,256,60,4,2048,1408,16,32,256,16,4,4,961.8353333333333,3
w13,256,60,4,2048,1408,16,32,256,16,8,3,959.7773333333333,3
w13,256,60,4,2048,1408,16,32,256,16,8,4,964.5453333333334,3
w13,256,60,4,2048,1408,16,32,256,32,4,3,959.467,3
w13,256,60,4,2048,1408,16,32,256,32,4,4,964.3740000000001,3
w13,256,60,4,2048,1408,16,32,256,32,8,3,961.4196666666667,3
w13,256,60,4,2048,1408,16,32,256,64,4,3,963.34,3
w13,256,60,4,2048,1408,16,64,256,16,4,3,962.123,3
w13,256,60,4,2048,1408,16,64,256,16,8,3,962.2520000000001,3
w13,256,60,4,2048,1408,16,64,256,32,4,3,964.5126666666666,3
w13,256,60,4,2048,1408,16,64,256,32,8,3,964.2139999999999,3
w13,256,60,4,2048,1408,32,32,256,1,4,3,959.4033333333333,3
w13,256,60,4,2048,1408,32,32,256,1,4,4,963.553,3
w13,256,60,4,2048,1408,32,32,256,1,8,3,958.0066666666667,3
w13,256,60,4,2048,1408,32,32,256,1,8,4,963.3389999999999,3
w13,256,60,4,2048,1408,32,32,256,4,4,3,960.3533333333334,3
w13,256,60,4,2048,1408,32,32,256,4,4,4,964.172,3
w13,256,60,4,2048,1408,32,32,256,4,8,3,959.3716666666666,3
w13,256,60,4,2048,1408,32,32,256,4,8,4,964.1283333333334,3
w13,256,60,4,2048,1408,32,32,256,16,4,3,963.1043333333333,3
w13,256,60,4,2048,1408,32,32,256,16,8,3,962.2936666666666,3
w13,256,60,6,3584,2304,16,16,256,4,4,3,2716.9816666666666,3
w13,256,60,6,3584,2304,16,16,256,4,8,3,2741.322666666667,3
w13,256,60,6,3584,2304,16,32,256,1,4,3,2731.062,3
w13,256,60,6,3584,2304,16,32,256,1,8,3,2730.4959999999996,3
w13,256,60,6,3584,2304,16,32,256,16,4,3,2737.4509999999996,3
w13,256,60,6,3584,2304,16,32,256,16,8,3,2743.9256666666665,3
w13,256,60,6,3584,2304,16,32,256,32,4,3,2743.179,3
w13,256,60,6,3584,2304,16,64,256,1,4,3,2734.2189999999996,3
w13,256,60,6,3584,2304,16,64,256,1,8,3,2738.6673333333333,3
w13,256,60,6,3584,2304,32,32,256,1,4,3,2732.6090000000004,3
w13,256,60,6,3584,2304,32,32,256,1,8,3,2728.608,3
w13,256,60,6,3584,2304,32,32,256,4,4,3,2734.965666666667,3
w13,256,60,6,3584,2304,32,32,256,4,8,3,2736.4590000000003,3
w13,256,60,8,2048,1536,16,16,256,4,4,3,1061.5446666666667,3
w13,256,60,8,2048,1536,16,32,256,16,4,3,1059.2296666666668,3
w13,256,60,8,2048,1536,16,32,256,16,4,4,1063.646,3
w13,256,60,8,2048,1536,16,32,256,16,8,3,1063.3793333333333,3
w13,256,60,8,2048,1536,16,32,256,16,8,4,1067.134,3
w13,256,60,8,2048,1536,16,64,256,16,4,3,1064.414,3
w13,256,60,8,2048,1536,16,64,256,16,8,3,1064.4886666666666,3
w13,256,60,8,2048,1536,32,32,256,4,4,3,1061.406,3
w13,256,60,8,2048,1536,32,32,256,4,4,4,1066.2593333333332,3
w13,256,60,8,2048,1536,32,32,256,4,8,3,1060.5843333333332,3
w13,256,60,8,2048,1536,32,32,256,4,8,4,1066.5366666666666,3
w13,256,60,8,2048,1536,32,32,256,16,4,3,1065.4486666666667,3
w13,256,60,8,2048,1536,32,32,256,16,4,4,1068.2966666666669,3
w13,256,60,8,2048,1536,32,32,256,16,8,3,1064.5743333333332,3
w13,256,60,8,2048,1536,32,32,256,16,8,4,1068.2006666666666,3
w13,256,60,8,2048,1536,32,32,256,32,4,3,1068.8513333333333,3
w13,256,60,8,2048,1536,32,32,256,32,8,3,1067.5496666666668,3
w13,256,60,8,2048,1536,32,64,256,8,8,3,1069.8433333333332,3
w13,256,60,8,2048,1536,64,32,256,1,4,3,1068.9260000000002,3
w13,256,60,8,2048,1536,64,32,256,1,8,3,1066.878,3
w13,256,64,6,3072,2048,16,16,256,1,4,3,2232.114,3
w13,256,64,6,3072,2048,16,16,256,4,4,3,2210.0653333333335,3
w13,256,64,6,3072,2048,16,16,256,4,8,3,2227.9323333333336,3
w13,256,64,6,3072,2048,16,32,256,1,4,3,2222.503,3
w13,256,64,6,3072,2048,16,32,256,1,8,3,2225.3613333333337,3
w13,256,64,6,3072,2048,16,32,256,16,4,3,2228.9983333333334,3
w13,256,64,6,3072,2048,16,64,256,1,4,3,2227.2923333333333,3
w13,256,64,6,3072,2048,16,64,256,1,8,3,2228.998666666667,3
w13,256,64,6,3072,2048,32,32,256,1,4,3,2222.332,3
w13,256,64,6,3072,2048,32,32,256,1,8,3,2220.8276666666666,3
w13,256,64,6,3072,2048,32,32,256,4,4,3,2227.409,3
w13,256,64,6,3072,2048,32,32,256,4,8,3,2225.7556666666665,3
w13,256,64,6,3584,1536,16,16,256,1,4,3,1930.0833333333333,3
w13,256,64,6,3584,1536,16,16,256,1,8,3,1943.6513333333332,3
w13,256,64,6,3584,1536,16,16,256,4,4,3,1931.5019999999997,3
w13,256,64,6,3584,1536,16,16,256,4,8,3,1947.5986666666668,3
w13,256,64,6,3584,1536,16,32,256,16,4,3,1948.8886666666667,3
w13,256,64,6,3584,1536,32,32,256,1,4,3,1940.9956666666667,3
w13,256,64,6,3584,1536,32,32,256,1,8,3,1939.8859999999997,3
w13,256,64,6,3584,1536,32,32,256,4,4,3,1946.6599999999999,3
w13,256,64,6,3584,1536,32,32,256,4,8,3,1943.9076666666667,3
w13,256,64,8,3584,2560,16,16,256,4,4,3,3234.849,3
w13,256,64,8,3584,2560,16,16,256,4,8,3,3263.211333333333,3
w13,256,64,8,3584,2560,16,32,256,16,4,3,3257.4936666666667,3
w13,256,64,8,3584,2560,16,32,256,16,8,3,3265.7926666666667,3
w13,256,64,8,3584,2560,16,32,256,32,4,3,3267.4466666666667,3
w13,256,64,8,3584,2560,32,32,256,1,4,3,3247.670666666667,3
w13,256,64,8,3584,2560,32,32,256,1,8,3,3248.4493333333335,3
w13,256,64,8,3584,2560,32,32,256,4,4,3,3254.144666666667,3
w13,256,64,8,3584,2560,32,32,256,4,8,3,3253.7503333333334,3
w13,256,128,4,2048,512,16,16,256,1,4,3,729.5976666666666,3
w13,256,128,4,2048,512,16,16,256,1,8,3,733.3530000000001,3
w13,256,128,4,2048,512,16,16,256,4,4,3,730.5046666666667,3
w13,256,128,4,2048,512,16,16,256,4,8,3,734.0459999999999,3
w13,256,128,4,2048,512,16,32,256,1,4,3,735.4540000000001,3
w13,256,128,4,2048,512,16,32,256,1,4,4,736.2433333333333,3
w13,256,128,4,2048,512,16,32,256,1,8,3,736.0726666666666,3
w13,256,128,4,2048,512,16,32,256,16,4,3,735.4113333333333,3
w13,256,128,4,2048,512,16,32,256,16,8,3,736.0833333333334,3
w13,256,128,4,2048,512,16,32,256,32,4,3,736.6703333333334,3
w13,256,128,4,2048,512,32,32,256,1,4,3,734.8143333333334,3
w13,256,128,4,2048,512,32,32,256,1,8,3,734.3553333333333,3
w13,256,128,4,2048,512,32,32,256,4,4,3,736.4033333333333,3
w13,256,128,4,2048,512,32,32,256,4,8,3,735.2723333333333,3
w13,256,128,4,2048,512,32,32,256,16,8,3,736.3069999999999,3
w13,256,128,6,4096,2048,16,16,256,1,4,3,5824.350333333333,3
w13,256,128,6,4096,2048,16,16,256,1,8,3,5827.422333333333,3
w13,256,128,6,4096,2048,16,16,256,4,4,3,5809.384666666668,3
w13,256,128,6,4096,2048,16,16,256,4,8,3,5817.907333333334,3
w13,256,128,6,4096,2048,16,32,256,1,4,3,5853.2570000000005,3
w13,256,128,6,4096,2048,16,32,256,1,4,4,5863.721666666667,3
w13,256,128,6,4096,2048,16,32,256,1,8,3,5864.457666666666,3
w13,256,128,6,4096,2048,16,32,256,1,8,4,5867.027666666666,3
w13,256,128,6,4096,2048,32,32,256,1,4,3,5832.329000000001,3
w13,256,128,6,4096,2048,32,32,256,1,8,3,5832.874,3
w13,256,128,6,4096,2048,32,32,256,4,4,3,5827.839,3
w13,256,128,6,4096,2048,32,32,256,4,8,3,5827.081666666668,3
w13,256,128,6,4096,2048,32,32,256,16,4,3,5860.852333333333,3
w13,256,128,6,4096,2048,32,32,256,16,8,3,5859.519,3
w13,256,128,8,2048,768,16,16,256,1,4,3,1111.7476666666669,3
w13,256,128,8,2048,768,16,16,256,1,4,4,1117.145,3
w13,256,128,8,2048,768,16,16,256,1,8,3,1112.537,3
w13,256,128,8,2048,768,16,16,256,1,8,4,1118.5856666666666,3
w13,256,128,8,2048,768,16,16,256,4,4,3,1111.599,3
w13,256,128,8,2048,768,16,16,256,4,4,4,1117.3693333333333,3
w13,256,128,8,2048,768,16,16,256,4,8,3,1113.7633333333333,3
w13,256,128,8,2048,768,16,16,256,4,8,4,1118.6596666666667,3
w13,256,128,8,2048,768,16,32,256,1,4,3,1117.7216666666666,3
w13,256,128,8,2048,768,16,32,256,1,4,4,1114.8410000000001,3
w13,256,128,8,2048,768,16,32,256,1,8,3,1117.7423333333334,3
w13,256,128,8,2048,768,16,32,256,1,8,4,1116.5910000000001,3
w13,256,128,8,2048,768,16,32,256,16,4,3,1117.07,3
w13,256,128,8,2048,768,16,32,256,16,4,4,1117.3473333333334,3
w13,256,128,8,2048,768,16,32,256,16,8,3,1118.809,3
w13,256,128,8,2048,768,16,32,256,16,8,4,1118.4253333333334,3
w13,256,128,8,2048,768,16,32,256,32,4,3,1121.3906666666667,3
w13,256,128,8,2048,768,16,64,256,1,4,3,1121.6043333333334,3
w13,256,128,8,2048,768,16,64,256,1,8,3,1120.6966666666667,3
w13,256,128,8,2048,768,16,64,256,16,4,3,1120.0673333333334,3
w13,256,128,8,2048,768,16,64,256,16,8,3,1121.4646666666667,3
w13,256,128,8,2048,768,32,32,256,1,4,3,1111.3103333333333,3
w13,256,128,8,2048,768,32,32,256,1,4,4,1116.686,3
w13,256,128,8,2048,768,32,32,256,1,8,3,1110.9373333333333,3
w13,256,128,8,2048,768,32,32,256,1,8,4,1116.5583333333334,3
w13,256,128,8,2048,768,32,32,256,4,4,3,1112.1956666666667,3
w13,256,128,8,2048,768,32,32,256,4,4,4,1118.6596666666667,3
w13,256,128,8,2048,768,32,32,256,4,8,3,1111.577,3
w13,256,128,8,2048,768,32,32,256,4,8,4,1117.2836666666665,3
w13,256,128,8,2048,768,32,32,256,16,4,3,1116.1633333333332,3
w13,256,128,8,2048,768,32,32,256,16,4,4,1119.8006666666668,3
w13,256,128,8,2048,768,32,32,256,16,8,3,1115.3746666666668,3
w13,256,128,8,2048,768,32,32,256,16,8,4,1118.98,3
w13,256,128,8,2048,768,32,32,256,32,4,3,1121.3796666666667,3
w13,256,128,8,2048,768,32,32,256,32,8,3,1121.8063333333332,3
w13,256,128,8,2048,768,64,32,256,1,4,3,1119.951,3
w13,256,128,8,2048,768,64,32,256,1,8,3,1119.2356666666667,3
w13,256,128,8,4096,1536,16,16,256,1,4,3,4383.509666666667,3
w13,256,128,8,4096,1536,16,16,256,1,4,4,4422.784666666666,3
w13,256,128,8,4096,1536,16,16,256,1,8,3,4389.493333333333,3
w13,256,128,8,4096,1536,16,16,256,1,8,4,4425.888666666667,3
w13,256,128,8,4096,1536,16,16,256,4,4,3,4391.797666666666,3
w13,256,128,8,4096,1536,16,16,256,4,8,3,4398.453666666667,3
w13,256,128,8,4096,1536,16,32,256,1,4,3,4403.7446666666665,3
w13,256,128,8,4096,1536,16,32,256,1,4,4,4416.438,3
w13,256,128,8,4096,1536,16,32,256,1,8,3,4421.525666666666,3
w13,256,128,8,4096,1536,16,32,256,1,8,4,4418.731333333333,3
w13,256,128,8,4096,1536,16,64,256,1,4,3,4416.598,3
w13,256,128,8,4096,1536,16,64,256,1,8,3,4418.667333333334,3
w13,256,128,8,4096,1536,32,32,256,1,4,3,4390.486,3
w13,256,128,8,4096,1536,32,32,256,1,4,4,4421.035333333333,3
w13,256,128,8,4096,1536,32,32,256,1,8,3,4389.173666666667,3
w13,256,128,8,4096,1536,32,32,256,1,8,4,4420.769,3
w13,256,128,8,4096,1536,32,32,256,4,4,3,4399.904333333333,3
w13,256,128,8,4096,1536,32,32,256,4,4,4,4427.243333333333,3
w13,256,128,8,4096,1536,32,32,256,4,8,3,4399.488333333334,3
w13,256,128,8,4096,1536,32,32,256,4,8,4,4427.104666666666,3
w13,256,128,8,4096,1536,32,32,256,16,4,3,4423.211333333334,3
w13,256,128,8,4096,1536,32,32,256,16,8,3,4422.817,3
w13,256,128,8,4096,1536,64,32,256,1,4,3,4423.328666666667,3
w13,256,128,8,4096,1536,64,32,256,1,8,3,4420.022333333333,3
w13,256,128,8,4096,3072,16,16,256,1,4,3,8760.252333333332,3
w13,256,128,8,4096,3072,16,16,256,1,4,4,8838.589666666667,3
w13,256,128,8,4096,3072,16,16,256,1,8,3,8779.762,3
w13,256,128,8,4096,3072,16,16,256,1,8,4,8837.266666666666,3
w13,256,128,8,4096,3072,16,16,256,4,4,3,8780.647333333332,3
w13,256,128,8,4096,3072,16,16,256,4,8,3,8797.149,3
w13,256,128,8,4096,3072,16,32,256,1,4,3,8798.439333333334,3
w13,256,128,8,4096,3072,16,32,256,1,4,4,8822.301333333333,3
w13,256,128,8,4096,3072,16,32,256,1,8,3,8815.698,3
w13,256,128,8,4096,3072,16,32,256,1,8,4,8829.512333333332,3
w13,256,128,8,4096,3072,16,64,256,1,4,3,8824.168,3
w13,256,128,8,4096,3072,16,64,256,1,8,3,8825.554666666667,3
w13,256,128,8,4096,3072,32,32,256,1,4,3,8769.734666666665,3
w13,256,128,8,4096,3072,32,32,256,1,4,4,8838.013333333334,3
w13,256,128,8,4096,3072,32,32,256,1,8,3,8768.860666666667,3
w13,256,128,8,4096,3072,32,32,256,1,8,4,8830.013666666666,3
w13,256,128,8,4096,3072,32,32,256,4,4,3,8793.010333333334,3
w13,256,128,8,4096,3072,32,32,256,4,8,3,8794.514333333334,3
w13,256,128,8,4096,3072,32,32,256,4,8,4,8847.112,3
w13,256,128,8,4096,3072,32,32,256,16,4,3,8843.027,3
w13,256,128,8,4096,3072,32,32,256,16,8,3,8843.955,3
w13,256,128,8,4096,3072,64,32,256,1,4,3,8830.813666666667,3
w13,256,128,8,4096,3072,64,32,256,1,8,3,8829.970333333333,3
w13,512,8,2,1024,512,64,128,32,8,8,3,18.103666666666665,3
w13,512,8,2,1024,512,64,128,32,8,8,4,18.178,3
w13,512,16,2,1536,768,64,64,64,1,4,3,39.42633333333333,3
w13,512,16,2,1536,768,64,64,64,4,4,3,39.73533333333333,3
w13,512,16,2,1536,768,64,64,64,16,4,3,39.62866666666667,3
w13,512,16,2,1536,768,64,64,64,32,4,3,39.746,3
w13,512,16,2,1536,768,64,64,64,64,4,3,39.586333333333336,3
w13,512,16,4,1536,1024,64,128,128,1,8,2,121.97566666666667,3
w13,512,32,4,2048,768,32,32,256,1,4,2,288.76099999999997,3
w13,512,32,4,2048,768,32,64,128,1,4,2,291.3316666666667,3
w13,512,32,4,2048,768,64,64,128,1,4,2,290.0516666666667,3
w13,512,32,6,3072,1024,32,32,256,16,4,3,594.1716666666666,3
w13,512,32,6,3072,1024,32,32,256,16,4,4,592.8166666666666,3
w13,512,32,6,3072,1024,32,32,256,16,8,3,592.1553333333333,3
w13,512,32,6,3072,1024,32,32,256,16,8,4,591.654,3
w13,512,32,6,3072,1024,32,64,256,8,4,3,596.8486666666666,3
w13,512,32,6,3072,1024,32,64,256,8,8,3,593.7986666666667,3
w13,512,32,6,3072,1024,32,64,256,16,4,3,597.2860000000001,3
w13,512,32,6,3072,1024,32,64,256,16,8,3,593.8833333333333,3
w13,512,32,6,3072,1024,64,32,256,1,4,3,597.3606666666666,3
w13,512,32,6,3072,1024,64,32,256,1,8,3,595.1419999999999,3
w13,512,60,4,2048,1408,16,16,256,4,4,3,979.2766666666666,3
w13,512,60,4,2048,1408,16,32,256,1,4,3,970.849,3
w13,512,60,4,2048,1408,16,32,256,1,8,3,974.2093333333333,3
w13,512,60,4,2048,1408,16,32,256,16,4,3,972.918,3
w13,512,60,4,2048,1408,16,32,256,16,4,4,977.612,3
w13,512,60,4,2048,1408,16,32,256,16,8,3,977.5796666666666,3
w13,512,60,4,2048,1408,16,32,256,16,8,4,979.8626666666668,3
w13,512,60,4,2048,1408,16,64,256,1,4,3,975.4573333333333,3
w13,512,60,4,2048,1408,16,64,256,1,8,3,975.8729999999999,3
w13,512,60,4,2048,1408,16,64,256,16,4,3,977.0679999999999,3
w13,512,60,4,2048,1408,16,64,256,16,8,3,978.6466666666666,3
w13,512,60,4,2048,1408,32,32,256,4,4,3,975.6286666666666,3
w13,512,60,4,2048,1408,32,32,256,4,8,3,975.18,3
w13,512,60,4,2048,1408,32,32,256,4,8,4,980.0120000000001,3
w13,512,60,4,2048,1408,32,32,256,16,4,3,978.433,3
w13,512,60,4,2048,1408,32,32,256,16,8,3,978.1983333333333,3
w13,512,60,4,2048,1408,32,32,256,32,8,3,980.5133333333333,3
w13,512,60,6,3584,2304,16,32,256,16,4,3,2773.2810000000004,3
w13,512,60,6,3584,2304,16,32,256,32,4,3,2782.6036666666664,3
w13,512,60,6,3584,2304,16,64,256,16,4,3,2786.5616666666665,3
w13,512,60,6,3584,2304,32,32,256,4,4,3,2763.137,3
w13,512,60,6,3584,2304,32,32,256,4,8,3,2762.5499999999997,3
w13,512,60,6,3584,2304,32,32,256,16,4,3,2776.78,3
w13,512,60,6,3584,2304,32,32,256,16,8,3,2774.508,3
w13,512,60,6,3584,2304,32,32,256,32,4,3,2784.971666666667,3
w13,512,60,6,3584,2304,32,32,256,32,8,3,2782.9773333333337,3
w13,512,60,8,2048,1536,16,64,256,16,4,3,1100.692,3
w13,512,60,8,2048,1536,16,64,256,16,8,3,1099.1236666666666,3
w13,512,60,8,2048,1536,32,32,128,4,4,4,1102.8143333333335,3
w13,512,60,8,2048,1536,32,32,128,4,8,4,1103.732,3
w13,512,60,8,2048,1536,32,32,128,16,4,4,1105.0013333333334,3
w13,512,60,8,2048,1536,32,32,128,16,8,4,1106.3343333333335,3
w13,512,60,8,2048,1536,32,32,256,16,4,3,1106.8573333333334,3
w13,512,60,8,2048,1536,32,32,256,16,4,4,1097.3423333333333,3
w13,512,60,8,2048,1536,32,32,256,16,8,3,1102.3663333333334,3
w13,512,60,8,2048,1536,32,32,256,16,8,4,1097.311,3
w13,512,60,8,2048,1536,32,64,128,4,4,4,1103.5823333333333,3
w13,512,60,8,2048,1536,32,64,128,4,8,4,1103.9876666666667,3
w13,512,60,8,2048,1536,32,64,256,8,4,3,1099.188,3
w13,512,60,8,2048,1536,32,64,256,8,8,3,1096.0196666666668,3
w13,512,60,8,2048,1536,32,64,256,16,4,3,1100.6706666666666,3
w13,512,60,8,2048,1536,32,64,256,16,8,3,1097.4703333333334,3
w13,512,64,6,3072,2048,32,32,256,4,4,3,2254.1606666666667,3
w13,512,64,6,3072,2048,32,32,256,4,8,3,2253.6919999999996,3
w13,512,64,6,3072,2048,32,32,256,16,4,3,2266.8326666666667,3
w13,512,64,6,3072,2048,32,32,256,16,8,3,2268.027666666667,3
w13,512,64,6,3072,2048,32,32,256,32,4,3,2270.3526666666667,3
w13,512,64,6,3072,2048,32,32,256,32,8,3,2270.833,3
w13,512,64,6,3584,1536,16,32,256,1,4,3,1977.4976666666669,3
w13,512,64,6,3584,1536,16,32,256,1,8,3,1982.4683333333332,3
w13,512,64,6,3584,1536,16,64,256,1,4,3,1989.1353333333334,3
w13,512,64,6,3584,1536,16,64,256,1,8,3,1990.1589999999999,3
w13,512,64,6,3584,1536,32,32,256,4,4,3,1980.9643333333333,3
w13,512,64,6,3584,1536,32,32,256,4,4,4,1992.7196666666666,3
w13,512,64,6,3584,1536,32,32,256,4,8,3,1975.215,3
w13,512,64,6,3584,1536,32,32,256,16,4,3,1985.6043333333334,3
w13,512,64,6,3584,1536,32,32,256,16,8,3,1979.0443333333333,3
w13,512,64,6,3584,1536,32,32,256,32,4,3,1985.8923333333332,3
w13,512,64,6,3584,1536,32,32,256,32,8,3,1980.2073333333335,3
w13,512,64,6,3584,1536,64,32,256,1,8,3,1991.8763333333334,3
w13,512,64,8,3584,2560,16,32,256,16,4,3,3304.706,3
w13,512,64,8,3584,2560,16,32,256,32,4,3,3309.505333333333,3
w13,512,64,8,3584,2560,16,32,256,64,4,3,3316.4393333333333,3
w13,512,64,8,3584,2560,16,64,256,16,4,3,3318.69,3
w13,512,64,8,3584,2560,32,32,256,4,4,3,3291.703,3
w13,512,64,8,3584,2560,32,32,256,4,8,3,3289.8366666666666,3
w13,512,64,8,3584,2560,32,32,256,16,4,3,3306.092666666667,3
w13,512,64,8,3584,2560,32,32,256,16,8,3,3305.9966666666664,3
w13,512,64,8,3584,2560,32,32,256,32,4,3,3312.449,3
w13,512,64,8,3584,2560,32,32,256,32,8,3,3310.732666666667,3
w13,512,128,4,2048,512,16,16,256,1,4,3,744.5096666666667,3
w13,512,128,4,2048,512,16,16,256,1,4,4,748.1259999999999,3
w13,512,128,4,2048,512,16,16,256,1,8,3,746.0886666666667,3
w13,512,128,4,2048,512,16,16,256,1,8,4,749.0859999999999,3
w13,512,128,4,2048,512,16,16,256,4,4,3,744.1363333333334,3
w13,512,128,4,2048,512,16,16,256,4,4,4,748.201,3
w13,512,128,4,2048,512,16,16,256,4,8,3,746.8033333333333,3
w13,512,128,4,2048,512,16,16,256,4,8,4,750.4196666666667,3
w13,512,128,4,2048,512,16,32,256,1,4,3,748.531,3
w13,512,128,4,2048,512,16,32,256,1,4,4,746.686,3
w13,512,128,4,2048,512,16,32,256,1,8,3,748.8090000000001,3
w13,512,128,4,2048,512,16,32,256,1,8,4,747.1976666666666,3
w13,512,128,4,2048,512,16,32,256,16,4,3,749.8543333333333,3
w13,512,128,4,2048,512,16,32,256,16,4,4,749.0756666666666,3
w13,512,128,4,2048,512,16,32,256,16,8,3,750.6646666666667,3
w13,512,128,4,2048,512,16,32,256,16,8,4,749.406,3
w13,512,128,4,2048,512,16,32,256,32,4,4,751.177,3
w13,512,128,4,2048,512,16,64,256,1,4,3,750.9523333333333,3
w13,512,128,4,2048,512,32,32,256,1,4,3,744.3179999999999,3
w13,512,128,4,2048,512,32,32,256,1,4,4,748.5843333333333,3
w13,512,128,4,2048,512,32,32,256,1,8,3,743.6886666666666,3
w13,512,128,4,2048,512,32,32,256,1,8,4,747.5503333333332,3
w13,512,128,4,2048,512,32,32,256,4,4,3,745.1393333333334,3
w13,512,128,4,2048,512,32,32,256,4,4,4,749.5450000000001,3
w13,512,128,4,2048,512,32,32,256,4,8,3,744.158,3
w13,512,128,4,2048,512,32,32,256,4,8,4,748.8406666666666,3
w13,512,128,4,2048,512,32,32,256,16,4,3,746.8136666666666,3
w13,512,128,4,2048,512,32,32,256,16,4,4,751.1126666666668,3
w13,512,128,4,2048,512,32,32,256,16,8,3,747.0169999999999,3
w13,512,128,4,2048,512,32,32,256,16,8,4,750.3126666666667,3
w13,512,128,4,2048,512,32,32,256,32,4,3,749.3526666666667,3
w13,512,128,4,2048,512,32,32,256,32,8,3,749.0219999999999,3
w13,512,128,4,2048,512,64,32,256,1,4,3,751.0056666666666,3
w13,512,128,4,2048,512,64,32,256,1,8,3,750.5683333333333,3
w13,512,128,6,4096,2048,16,16,256,1,4,3,5888.747666666666,3
w13,512,128,6,4096,2048,16,16,256,4,4,3,5876.341333333333,3
w13,512,128,6,4096,2048,16,16,256,4,4,4,5921.195,3
w13,512,128,6,4096,2048,16,16,256,4,8,3,5917.750333333333,3
w13,512,128,6,4096,2048,16,16,256,4,8,4,5929.1320000000005,3
w13,512,128,6,4096,2048,16,32,256,1,4,3,5895.329000000001,3
w13,512,128,6,4096,2048,16,32,256,1,8,3,5900.416333333334,3
w13,512,128,6,4096,2048,16,32,256,16,4,3,5901.920999999999,3
w13,512,128,6,4096,2048,16,32,256,16,8,3,5915.083666666666,3
w13,512,128,6,4096,2048,16,32,256,32,4,3,5922.603666666667,3
w13,512,128,6,4096,2048,16,64,256,1,4,3,5910.027333333334,3
w13,512,128,6,4096,2048,16,64,256,1,8,3,5915.136666666666,3
w13,512,128,6,4096,2048,16,64,256,16,4,3,5921.665000000001,3
w13,512,128,6,4096,2048,16,64,256,16,8,3,5929.942666666667,3
w13,512,128,6,4096,2048,32,32,256,1,4,3,5900.875666666667,3
w13,512,128,6,4096,2048,32,32,256,1,8,3,5899.083666666666,3
w13,512,128,6,4096,2048,32,32,256,4,4,3,5898.699666666666,3
w13,512,128,6,4096,2048,32,32,256,4,8,3,5896.875666666667,3
w13,512,128,8,2048,768,16,16,256,1,4,3,1124.7186666666666,3
w13,512,128,8,2048,768,16,16,256,1,8,3,1133.4013333333335,3
w13,512,128,8,2048,768,16,16,256,4,4,3,1123.1293333333333,3
w13,512,128,8,2048,768,16,16,256,4,4,4,1131.6203333333333,3
w13,512,128,8,2048,768,16,16,256,4,8,3,1130.6706666666666,3
w13,512,128,8,2048,768,16,32,256,1,4,3,1129.433,3
w13,512,128,8,2048,768,16,32,256,1,8,3,1132.0033333333333,3
w13,512,128,8,2048,768,16,32,256,16,4,3,1129.2303333333332,3
w13,512,128,8,2048,768,16,32,256,16,4,4,1133.0596666666668,3
w13,512,128,8,2048,768,16,32,256,16,8,3,1131.577,3
w13,512,128,8,2048,768,16,32,256,32,4,3,1131.6413333333333,3
w13,512,128,8,2048,768,16,32,256,32,8,3,1133.4759999999999,3
w13,512,128,8,2048,768,16,64,256,16,4,3,1134.329,3
w13,512,128,8,2048,768,16,64,256,16,8,3,1134.393,3
w13,512,128,8,2048,768,32,32,256,1,4,3,1129.9233333333334,3
w13,512,128,8,2048,768,32,32,256,1,8,3,1128.7393333333332,3
w13,512,128,8,2048,768,32,32,256,4,4,3,1131.0649999999998,3
w13,512,128,8,2048,768,32,32,256,4,8,3,1129.8916666666667,3
w13,512,128,8,2048,768,32,32,256,16,8,3,1133.0913333333333,3
w13,512,128,8,4096,1536,16,16,256,1,4,3,4424.865000000001,3
w13,512,128,8,4096,1536,16,16,256,1,8,3,4453.398666666667,3
w13,512,128,8,4096,1536,16,16,256,4,4,3,4434.0273333333325,3
w13,512,128,8,4096,1536,16,16,256,4,4,4,4467.446666666667,3
w13,512,128,8,4096,1536,16,32,256,1,4,3,4461.484333333334,3
w13,512,128,8,4096,1536,16,32,256,16,4,3,4464.257333333334,3
w13,512,128,8,4096,1536,32,32,256,1,4,3,4451.638666666667,3
w13,512,128,8,4096,1536,32,32,256,1,8,3,4452.001333333334,3
w13,512,128,8,4096,1536,32,32,256,4,4,3,4465.345666666667,3
w13,512,128,8,4096,1536,32,32,256,4,8,3,4466.103,3
w13,512,128,8,4096,3072,16,16,256,4,4,3,8863.208333333334,3
w13,512,128,8,4096,3072,16,16,256,4,4,4,8917.449333333332,3
w13,512,128,8,4096,3072,16,32,256,1,4,3,8944.5,3
w13,512,128,8,4096,3072,16,32,256,16,4,3,8923.049333333334,3
w13,512,128,8,4096,3072,16,32,256,16,8,3,8933.779999999999,3
w13,512,128,8,4096,3072,16,32,256,32,4,3,8948.446666666667,3
w13,512,128,8,4096,3072,16,64,256,16,4,3,8945.769333333332,3
w13,512,128,8,4096,3072,16,64,256,16,8,3,8949.311,3
w13,512,128,8,4096,3072,32,32,256,1,4,3,8894.408666666666,3
w13,512,128,8,4096,3072,32,32,256,1,8,3,8891.635666666667,3
w13,512,128,8,4096,3072,32,32,256,4,4,3,8924.222666666667,3
w13,512,128,8,4096,3072,32,32,256,4,8,3,8920.360333333332,3
w13,512,128,8,4096,3072,64,32,256,1,4,3,8943.742,3
w13,512,128,8,4096,3072,64,32,256,1,8,3,8935.325666666666,3
w13,1024,8,2,1024,512,64,128,32,8,8,3,32.83433333333333,3
w13,1024,16,2,1536,768,64,128,32,8,8,3,69.77266666666667,3
w13,1024,16,2,1536,768,64,128,32,8,8,4,70.39166666666667,3
w13,1024,16,4,1536,1024,64,64,64,32,4,4,194.99966666666668,3
w13,1024,32,4,2048,768,64,64,128,1,4,2,313.5183333333334,3
w13,1024,32,4,2048,768,64,64,128,64,4,3,314.617,3
w13,1024,32,4,2048,768,64,64,128,64,4,4,314.6383333333333,3
w13,1024,32,4,2048,768,64,64,128,64,8,3,312.16366666666664,3
w13,1024,32,4,2048,768,64,64,128,64,8,4,313.305,3
w13,1024,32,6,3072,1024,64,64,128,16,8,4,641.5423333333333,3
w13,1024,32,6,3072,1024,64,128,128,1,8,3,635.3346666666666,3
w13,1024,32,6,3072,1024,64,128,128,16,8,3,638.5986666666666,3
w13,1024,60,4,2048,1408,16,64,256,16,4,3,1010.2313333333333,3
w13,1024,60,4,2048,1408,16,64,256,16,8,3,1009.8576666666667,3
w13,1024,60,4,2048,1408,32,32,128,16,4,4,1015.7346666666667,3
w13,1024,60,4,2048,1408,32,32,256,16,4,3,1011.3296666666666,3
w13,1024,60,4,2048,1408,32,32,256,16,4,4,1009.2926666666667,3
w13,1024,60,4,2048,1408,32,32,256,16,8,3,1008.855,3
w13,1024,60,4,2048,1408,32,32,256,16,8,4,1009.783,3
w13,1024,60,4,2048,1408,32,64,128,1,4,4,1014.893,3
w13,1024,60,4,2048,1408,32,64,128,1,8,4,1015.1910000000001,3
w13,1024,60,4,2048,1408,32,64,256,1,4,3,1007.7776666666667,3
w13,1024,60,4,2048,1408,32,64,256,1,8,3,1005.6016666666666,3
w13,1024,60,4,2048,1408,32,64,256,8,4,3,1012.3003333333332,3
w13,1024,60,4,2048,1408,32,64,256,8,8,3,1008.226,3
w13,1024,60,4,2048,1408,32,64,256,16,4,3,1011.7779999999999,3
w13,1024,60,4,2048,1408,32,64,256,16,8,3,1009.2823333333334,3
w13,1024,60,6,3584,2304,32,32,128,4,4,3,2922.3176666666664,3
w13,1024,60,6,3584,2304,32,32,128,4,4,4,2910.4449999999997,3
w13,1024,60,6,3584,2304,32,32,128,16,4,3,2925.592,3
w13,1024,60,6,3584,2304,32,32,128,16,4,4,2916.1096666666667,3
w13,1024,60,6,3584,2304,32,32,128,64,4,4,2930.253666666667,3
w13,1024,60,6,3584,2304,32,32,256,4,4,2,2925.0586666666663,3
w13,1024,60,6,3584,2304,32,32,256,16,4,2,2929.357666666667,3
w13,1024,60,6,3584,2304,32,32,256,32,4,2,2933.411,3
w13,1024,60,6,3584,2304,32,64,128,1,4,2,2933.3253333333337,3
w13,1024,60,6,3584,2304,32,64,128,1,4,3,2926.5733333333333,3
w13,1024,60,6,3584,2304,32,64,128,1,8,2,2932.547,3
w13,1024,60,6,3584,2304,32,64,128,1,8,3,2923.3843333333334,3
w13,1024,60,6,3584,2304,32,64,128,4,4,2,2926.8826666666664,3
w13,1024,60,6,3584,2304,32,64,128,4,4,3,2924.2476666666666,3
w13,1024,60,6,3584,2304,32,64,128,4,4,4,2914.7656666666667,3
w13,1024,60,6,3584,2304,32,64,128,4,8,2,2928.3866666666668,3
w13,1024,60,6,3584,2304,32,64,128,4,8,3,2923.0643333333333,3
w13,1024,60,6,3584,2304,32,64,128,4,8,4,2914.1890000000003,3
w13,1024,60,6,3584,2304,32,64,128,16,4,3,2925.880333333333,3
w13,1024,60,6,3584,2304,32,64,128,16,4,4,2920.482666666667,3
w13,1024,60,6,3584,2304,32,64,128,16,8,2,2931.885333333333,3
w13,1024,60,6,3584,2304,32,64,128,16,8,3,2925.56,3
w13,1024,60,6,3584,2304,32,64,128,16,8,4,2919.469333333333,3
w13,1024,60,6,3584,2304,32,64,128,32,4,3,2930.648333333333,3
w13,1024,60,6,3584,2304,32,64,128,32,4,4,2925.8376666666663,3
w13,1024,60,6,3584,2304,32,64,128,32,8,3,2931.4266666666663,3
w13,1024,60,6,3584,2304,32,64,128,32,8,4,2926.882666666667,3
w13,1024,60,6,3584,2304,32,64,256,1,4,2,2931.757333333333,3
w13,1024,60,6,3584,2304,32,64,256,1,8,2,2929.7729999999997,3
w13,1024,60,6,3584,2304,32,64,256,8,4,3,2912.087333333333,3
w13,1024,60,6,3584,2304,32,64,256,8,8,2,2923.992333333333,3
w13,1024,60,6,3584,2304,32,64,256,8,8,3,2904.7923333333333,3
w13,1024,60,6,3584,2304,32,64,256,16,4,3,2916.6323333333335,3
w13,1024,60,6,3584,2304,32,64,256,16,8,2,2927.5976666666666,3
w13,1024,60,6,3584,2304,32,64,256,16,8,3,2907.725,3
w13,1024,60,6,3584,2304,32,64,256,32,4,3,2923.703666666667,3
w13,1024,60,6,3584,2304,32,64,256,32,8,2,2933.9443333333334,3
w13,1024,60,6,3584,2304,32,64,256,32,8,3,2913.752,3
w13,1024,60,6,3584,2304,32,64,256,64,4,3,2933.0803333333333,3
w13,1024,60,6,3584,2304,32,64,256,64,8,3,2924.6963333333333,3
w13,1024,60,6,3584,2304,32,128,128,1,8,2,2931.885333333333,3
w13,1024,60,6,3584,2304,32,128,128,4,4,3,2933.2189999999996,3
w13,1024,60,6,3584,2304,32,128,128,4,8,2,2933.9013333333332,3
w13,1024,60,6,3584,2304,32,128,128,4,8,3,2929.027,3
w13,1024,60,6,3584,2304,32,128,128,8,4,3,2930.435,3
w13,1024,60,6,3584,2304,32,128,128,8,8,3,2931.8213333333333,3
w13,1024,60,6,3584,2304,32,128,128,16,4,3,2931.619,3
w13,1024,60,6,3584,2304,32,128,128,16,8,3,2928.6216666666664,3
w13,1024,60,6,3584,2304,32,128,128,32,4,3,2930.306666666667,3
w13,1024,60,6,3584,2304,32,128,128,32,8,3,2927.8430000000003,3
w13,1024,60,6,3584,2304,32,128,128,64,4,3,2933.880333333333,3
w13,1024,60,6,3584,2304,32,128,128,64,8,3,2932.3866666666668,3
w13,1024,60,6,3584,2304,64,32,128,1,4,2,2927.2346666666667,3
w13,1024,60,6,3584,2304,64,32,128,1,4,3,2927.2666666666664,3
w13,1024,60,6,3584,2304,64,32,128,1,8,2,2928.664,3
w13,1024,60,6,3584,2304,64,32,128,1,8,3,2922.4023333333334,3
w13,1024,60,6,3584,2304,64,32,128,16,4,3,2928.482666666667,3
w13,1024,60,6,3584,2304,64,32,128,16,4,4,2927.0,3
w13,1024,60,6,3584,2304,64,32,128,16,8,3,2928.579,3
w13,1024,60,6,3584,2304,64,32,128,16,8,4,2922.3070000000002,3
w13,1024,60,6,3584,2304,64,32,256,1,4,2,2926.3496666666665,3
w13,1024,60,6,3584,2304,64,32,256,1,8,2,2928.216,3
w13,1024,60,6,3584,2304,64,64,128,1,4,4,2928.2909999999997,3
w13,1024,60,6,3584,2304,64,64,128,1,8,4,2927.1706666666664,3
w13,1024,60,6,3584,2304,64,64,128,4,4,3,2924.568333333333,3
w13,1024,60,6,3584,2304,64,64,128,4,4,4,2920.482666666667,3
w13,1024,60,6,3584,2304,64,64,128,4,8,3,2921.922666666667,3
w13,1024,60,6,3584,2304,64,64,128,4,8,4,2917.688,3
w13,1024,60,6,3584,2304,64,64,128,8,4,3,2926.595,3
w13,1024,60,6,3584,2304,64,64,128,8,4,4,2922.0823333333333,3
w13,1024,60,6,3584,2304,64,64,128,8,8,3,2923.043,3
w13,1024,60,6,3584,2304,64,64,128,8,8,4,2919.8746666666666,3
w13,1024,60,6,3584,2304,64,64,128,16,4,3,2931.554666666667,3
w13,1024,60,6,3584,2304,64,64,128,16,4,4,2925.005333333333,3
w13,1024,60,6,3584,2304,64,64,128,16,8,3,2928.9626666666663,3
w13,1024,60,6,3584,2304,64,64,128,16,8,4,2920.4293333333335,3
w13,1024,60,6,3584,2304,64,64,128,32,4,4,2933.6883333333335,3
w13,1024,60,6,3584,2304,64,64,128,32,8,4,2929.315,3
w13,1024,60,6,3584,2304,64,128,128,1,8,3,2931.992,3
w13,1024,60,6,3584,2304,64,128,128,4,4,3,2926.9256666666665,3
w13,1024,60,6,3584,2304,64,128,128,4,8,3,2923.650333333333,3
w13,1024,60,6,3584,2304,64,128,128,16,4,3,2930.3283333333334,3
w13,1024,60,6,3584,2304,64,128,128,16,8,3,2924.632,3
w13,1024,60,6,3584,2304,64,128,128,32,4,3,2933.1973333333335,3
w13,1024,60,6,3584,2304,64,128,128,32,8,3,2930.2216666666664,3
w13,1024,60,6,3584,2304,64,128,128,64,8,3,2927.832,3
w13,1024,60,6,3584,2304,128,32,128,1,4,3,2929.187,3
w13,1024,60,6,3584,2304,128,32,128,1,8,2,2926.072,3
w13,1024,60,6,3584,2304,128,32,128,1,8,3,2924.9843333333333,3
w13,1024,60,6,3584,2304,128,64,128,1,8,3,2928.2376666666664,3
w13,1024,60,8,2048,1536,32,64,128,1,4,2,1178.4953333333333,3
w13,1024,60,8,2048,1536,32,64,128,1,4,3,1176.1913333333334,3
w13,1024,60,8,2048,1536,32,64,128,1,8,2,1176.6926666666668,3
w13,1024,60,8,2048,1536,32,64,128,1,8,3,1181.6633333333332,3
w13,1024,60,8,2048,1536,32,64,128,4,4,2,1178.9113333333335,3
w13,1024,60,8,2048,1536,32,64,128,16,4,3,1170.5593333333334,3
w13,1024,60,8,2048,1536,32,64,128,16,8,3,1173.9623333333332,3
w13,1024,60,8,2048,1536,32,128,128,1,4,3,1177.973,3
w13,1024,60,8,2048,1536,32,128,128,1,8,2,1179.1783333333333,3
w13,1024,60,8,2048,1536,32,128,128,1,8,3,1175.594,3
w13,1024,60,8,2048,1536,32,128,128,4,8,2,1180.17,3
w13,1024,60,8,2048,1536,32,128,128,8,8,2,1181.0126666666667,3
w13,1024,60,8,2048,1536,32,128,128,16,8,3,1178.2073333333335,3
w13,1024,60,8,2048,1536,64,64,128,1,4,2,1177.3010000000002,3
w13,1024,60,8,2048,1536,64,64,128,16,8,4,1177.4073333333333,3
w13,1024,64,6,3072,2048,32,64,128,1,8,2,2387.5803333333333,3
w13,1024,64,6,3072,2048,32,64,128,4,4,3,2387.4843333333333,3
w13,1024,64,6,3072,2048,32,64,128,4,4,4,2365.0306666666665,3
w13,1024,64,6,3072,2048,32,64,128,4,8,3,2385.0946666666664,3
w13,1024,64,6,3072,2048,32,64,128,4,8,4,2366.8123333333333,3
w13,1024,64,6,3072,2048,32,128,128,1,4,2,2382.6730000000002,3
w13,1024,64,6,3072,2048,32,128,128,1,8,2,2383.4733333333334,3
w13,1024,64,6,3072,2048,32,128,128,4,4,3,2384.7213333333334,3
w13,1024,64,6,3072,2048,32,128,128,4,8,3,2382.3643333333334,3
w13,1024,64,6,3072,2048,64,32,128,1,4,2,2386.8973333333333,3
w13,1024,64,6,3072,2048,64,32,128,1,4,3,2380.422666666667,3
w13,1024,64,6,3072,2048,64,32,128,1,8,2,2388.4016666666666,3
w13,1024,64,6,3072,2048,64,32,128,1,8,3,2379.0146666666665,3
w13,1024,64,6,3072,2048,64,32,128,16,4,2,2387.110666666667,3
w13,1024,64,6,3072,2048,64,32,128,16,4,3,2388.518666666667,3
w13,1024,64,6,3072,2048,64,32,128,16,4,4,2380.3799999999997,3
w13,1024,64,6,3072,2048,64,32,128,16,8,3,2383.335,3
w13,1024,64,6,3072,2048,64,32,128,16,8,4,2378.8333333333335,3
w13,1024,64,6,3072,2048,64,32,256,1,8,2,2386.2999999999997,3
w13,1024,64,6,3072,2048,64,64,128,1,4,3,2388.0813333333335,3
w13,1024,64,6,3072,2048,64,64,128,1,4,4,2373.7883333333334,3
w13,1024,64,6,3072,2048,64,64,128,1,8,3,2382.1613333333335,3
w13,1024,64,6,3072,2048,64,64,128,1,8,4,2372.550333333333,3
w13,1024,64,6,3072,2048,64,64,128,4,4,3,2384.0493333333334,3
w13,1024,64,6,3072,2048,64,64,128,4,4,4,2380.166333333333,3
w13,1024,64,6,3072,2048,64,64,128,4,8,3,2379.6440000000002,3
w13,1024,64,6,3072,2048,64,64,128,4,8,4,2379.367,3
w13,1024,64,6,3072,2048,64,64,128,8,4,3,2385.489666666667,3
w13,1024,64,6,3072,2048,64,64,128,8,4,4,2381.404,3
w13,1024,64,6,3072,2048,64,64,128,8,8,3,2380.2516666666666,3
w13,1024,64,6,3072,2048,64,64,128,8,8,4,2379.4836666666665,3
w13,1024,64,6,3072,2048,64,64,128,16,4,3,2387.4736666666668,3
w13,1024,64,6,3072,2048,64,64,128,16,4,4,2383.0896666666667,3
w13,1024,64,6,3072,2048,64,64,128,16,8,3,2382.5133333333333,3
w13,1024,64,6,3072,2048,64,64,128,16,8,4,2383.985666666667,3
w13,1024,64,6,3072,2048,64,64,128,32,8,3,2387.644333333333,3
w13,1024,64,6,3072,2048,64,64,128,32,8,4,2388.422666666667,3
w13,1024,64,6,3072,2048,64,128,128,1,8,3,2382.438666666667,3
w13,1024,64,6,3072,2048,64,128,128,4,8,3,2384.4230000000002,3
w13,1024,64,6,3072,2048,64,128,128,16,8,3,2383.7186666666666,3
w13,1024,64,6,3072,2048,64,128,128,32,8,3,2382.9396666666667,3
w13,1024,64,6,3072,2048,64,128,128,64,8,3,2386.662333333333,3
w13,1024,64,6,3072,2048,128,32,128,1,4,3,2386.481333333333,3
w13,1024,64,6,3072,2048,128,32,128,1,8,2,2388.3269999999998,3
w13,1024,64,6,3072,2048,128,32,128,1,8,3,2382.4813333333336,3
w13,1024,64,6,3584,1536,32,64,256,1,8,3,2076.955,3
w13,1024,64,6,3584,1536,32,64,256,8,4,3,2067.6103333333335,3
w13,1024,64,6,3584,1536,32,64,256,8,8,3,2060.986666666666,3
w13,1024,64,6,3584,1536,64,128,128,16,8,3,2080.1440000000002,3
w13,1024,64,6,3584,1536,64,128,128,32,8,3,2079.013,3
w13,1024,64,6,3584,1536,64,128,128,64,8,3,2077.5303333333336,3
w13,1024,64,8,3584,2560,32,64,128,4,4,2,3497.007666666667,3
w13,1024,64,8,3584,2560,32,64,128,4,4,3,3491.717,3
w13,1024,64,8,3584,2560,32,64,128,4,4,4,3474.2656666666667,3
w13,1024,64,8,3584,2560,32,64,128,4,8,2,3498.917,3
w13,1024,64,8,3584,2560,32,64,128,4,8,3,3491.0020000000004,3
w13,1024,64,8,3584,2560,32,64,128,4,8,4,3474.565,3
w13,1024,64,8,3584,2560,32,64,128,16,4,3,3496.0370000000003,3
w13,1024,64,8,3584,2560,32,64,128,16,4,4,3492.5910000000003,3
w13,1024,64,8,3584,2560,32,64,128,16,8,3,3497.199666666667,3
w13,1024,64,8,3584,2560,32,64,128,16,8,4,3490.266,3
w13,1024,64,8,3584,2560,32,64,256,8,4,3,3478.6183333333333,3
w13,1024,64,8,3584,2560,32,64,256,8,8,2,3495.6316666666667,3
w13,1024,64,8,3584,2560,32,64,256,8,8,3,3466.5220000000004,3
w13,1024,64,8,3584,2560,32,64,256,16,4,3,3490.138333333334,3
w13,1024,64,8,3584,2560,32,64,256,16,8,2,3499.8976666666663,3
w13,1024,64,8,3584,2560,32,64,256,16,8,3,3479.5879999999997,3
w13,1024,64,8,3584,2560,32,64,256,32,8,3,3489.956,3
w13,1024,64,8,3584,2560,32,128,128,4,4,2,3490.095333333333,3
w13,1024,64,8,3584,2560,32,128,128,4,4,3,3495.5986666666668,3
w13,1024,64,8,3584,2560,32,128,128,4,8,2,3490.522333333333,3
w13,1024,64,8,3584,2560,32,128,128,4,8,3,3490.905666666667,3
w13,1024,64,8,3584,2560,32,128,128,8,4,2,3496.9113333333335,3
w13,1024,64,8,3584,2560,32,128,128,8,4,3,3498.138333333334,3
w13,1024,64,8,3584,2560,32,128,128,8,8,2,3498.7026666666666,3
w13,1024,64,8,3584,2560,32,128,128,8,8,3,3495.0020000000004,3
w13,1024,64,8,3584,2560,32,128,128,16,4,2,3497.6793333333335,3
w13,1024,64,8,3584,2560,32,128,128,16,4,3,3497.572666666667,3
w13,1024,64,8,3584,2560,32,128,128,16,8,3,3498.788666666667,3
w13,1024,64,8,3584,2560,32,128,128,32,4,2,3497.882,3
w13,1024,64,8,3584,2560,32,128,128,32,4,3,3500.9966666666664,3
w13,1024,64,8,3584,2560,32,128,128,32,8,2,3497.1356666666666,3
w13,1024,64,8,3584,2560,32,128,128,32,8,3,3495.503,3
w13,1024,64,8,3584,2560,32,128,128,64,8,3,3496.527666666667,3
w13,1024,64,8,3584,2560,64,64,128,1,8,4,3500.0049999999997,3
w13,1024,64,8,3584,2560,64,64,128,4,4,2,3500.965,3
w13,1024,64,8,3584,2560,64,64,128,4,4,3,3498.820333333333,3
w13,1024,64,8,3584,2560,64,64,128,4,4,4,3486.2659999999996,3
w13,1024,64,8,3584,2560,64,64,128,4,8,3,3492.7296666666666,3
w13,1024,64,8,3584,2560,64,64,128,4,8,4,3484.6766666666663,3
w13,1024,64,8,3584,2560,64,64,128,8,4,4,3489.0073333333335,3
w13,1024,64,8,3584,2560,64,64,128,8,8,3,3500.111333333333,3
w13,1024,64,8,3584,2560,64,64,128,8,8,4,3487.1829999999995,3
w13,1024,64,8,3584,2560,64,64,128,16,4,4,3495.909,3
w13,1024,64,8,3584,2560,64,64,128,16,8,4,3493.711333333333,3
w13,1024,64,8,3584,2560,64,128,128,1,8,3,3497.135,3
w13,1024,64,8,3584,2560,64,128,128,4,4,2,3496.740333333333,3
w13,1024,64,8,3584,2560,64,128,128,4,4,3,3497.0286666666666,3
w13,1024,64,8,3584,2560,64,128,128,4,8,3,3489.9036666666666,3
w13,1024,64,8,3584,2560,64,128,128,16,4,3,3497.9036666666666,3
w13,1024,64,8,3584,2560,64,128,128,16,8,2,3496.815666666667,3
w13,1024,64,8,3584,2560,64,128,128,16,8,3,3496.2503333333334,3
w13,1024,64,8,3584,2560,64,128,128,32,4,2,3499.5783333333334,3
w13,1024,64,8,3584,2560,64,128,128,32,4,3,3500.6336666666666,3
w13,1024,64,8,3584,2560,64,128,128,32,8,3,3496.858,3
w13,1024,64,8,3584,2560,64,128,128,64,8,3,3496.6126666666664,3
w13,1024,64,8,3584,2560,128,32,128,1,4,3,3494.4583333333335,3
w13,1024,64,8,3584,2560,128,32,128,1,8,2,3498.3403333333335,3
w13,1024,64,8,3584,2560,128,32,128,1,8,3,3491.6203333333337,3
w13,1024,128,4,2048,512,16,16,256,1,4,3,755.7953333333334,3
w13,1024,128,4,2048,512,16,16,256,1,4,4,760.5846666666666,3
w13,1024,128,4,2048,512,16,16,256,1,8,3,760.627,3
w13,1024,128,4,2048,512,16,16,256,4,4,3,755.5606666666666,3
w13,1024,128,4,2048,512,16,16,256,4,4,4,760.9683333333332,3
w13,1024,128,4,2048,512,16,16,256,4,8,3,760.4993333333333,3
w13,1024,128,4,2048,512,16,32,256,1,4,3,759.0590000000001,3
w13,1024,128,4,2048,512,16,32,256,1,4,4,759.9549999999999,3
w13,1024,128,4,2048,512,16,32,256,1,8,3,760.3389999999999,3
w13,1024,128,4,2048,512,16,32,256,1,8,4,761.448,3
w13,1024,128,4,2048,512,16,32,256,16,4,3,758.8246666666668,3
w13,1024,128,4,2048,512,16,32,256,16,8,3,760.7336666666666,3
w13,1024,128,4,2048,512,16,32,256,32,4,3,759.2613333333333,3
w13,1024,128,4,2048,512,16,32,256,32,8,3,761.3313333333332,3
w13,1024,128,4,2048,512,16,32,256,64,4,3,760.8833333333333,3
w13,1024,128,4,2048,512,16,32,256,64,8,3,762.2483333333333,3
w13,1024,128,4,2048,512,16,64,256,1,4,3,762.7923333333333,3
w13,1024,128,4,2048,512,16,64,256,1,8,3,762.6643333333333,3
w13,1024,128,4,2048,512,16,64,256,16,4,3,762.2056666666667,3
w13,1024,128,4,2048,512,16,64,256,16,8,3,762.259,3
w13,1024,128,4,2048,512,16,64,256,32,4,3,763.1656666666667,3
w13,1024,128,4,2048,512,32,32,256,1,4,3,759.9226666666667,3
w13,1024,128,4,2048,512,32,32,256,1,8,3,758.9733333333334,3
w13,1024,128,4,2048,512,32,32,256,4,4,3,760.8089999999999,3
w13,1024,128,4,2048,512,32,32,256,4,8,3,759.9230000000001,3
w13,1024,128,4,2048,512,32,32,256,16,4,3,762.685,3
w13,1024,128,4,2048,512,32,32,256,16,8,3,761.6406666666667,3
w13,1024,128,6,4096,2048,32,32,256,4,4,3,5990.825,3
w13,1024,128,6,4096,2048,32,32,256,4,4,4,6019.593000000001,3
w13,1024,128,6,4096,2048,32,32,256,4,8,3,5989.288666666667,3
w13,1024,128,6,4096,2048,32,32,256,4,8,4,6021.022666666667,3
w13,1024,128,6,4096,2048,32,32,256,16,4,3,6014.590333333334,3
w13,1024,128,6,4096,2048,32,32,256,16,4,4,6036.073666666666,3
w13,1024,128,6,4096,2048,32,32,256,16,8,3,6011.187666666668,3
w13,1024,128,6,4096,2048,32,32,256,16,8,4,6036.169333333334,3
w13,1024,128,6,4096,2048,32,32,256,32,4,3,6032.3820000000005,3
w13,1024,128,6,4096,2048,32,32,256,32,8,3,6030.846666666667,3
w13,1024,128,6,4096,2048,32,64,256,1,4,3,6031.390333333334,3
w13,1024,128,6,4096,2048,32,64,256,1,8,3,6026.568333333334,3
w13,1024,128,6,4096,2048,32,64,256,8,4,3,6037.086,3
w13,1024,128,6,4096,2048,32,64,256,8,8,3,6030.984666666667,3
w13,1024,128,6,4096,2048,32,64,256,16,8,3,6042.665,3
w13,1024,128,6,4096,2048,64,32,256,1,4,3,6028.6376666666665,3
w13,1024,128,6,4096,2048,64,32,256,1,8,3,6022.812999999999,3
w13,1024,128,8,2048,768,16,32,256,16,4,3,1161.4756666666665,3
w13,1024,128,8,2048,768,16,32,256,32,4,3,1159.7373333333333,3
w13,1024,128,8,2048,768,16,32,256,64,4,3,1162.6386666666667,3
w13,1024,128,8,2048,768,16,64,256,16,4,3,1168.9956666666667,3
w13,1024,128,8,2048,768,16,64,256,32,4,3,1165.7103333333334,3
w13,1024,128,8,2048,768,16,64,256,32,8,3,1167.9716666666666,3
w13,1024,128,8,2048,768,16,64,256,64,4,3,1168.8566666666666,3
w13,1024,128,8,2048,768,32,32,256,4,4,3,1165.1976666666667,3
w13,1024,128,8,2048,768,32,32,256,4,4,4,1167.8966666666668,3
w13,1024,128,8,2048,768,32,32,256,4,8,3,1165.732,3
w13,1024,128,8,2048,768,32,32,256,4,8,4,1165.902,3
w13,1024,128,8,2048,768,32,32,256,16,4,3,1162.798,3
w13,1024,128,8,2048,768,32,32,256,16,4,4,1166.2323333333334,3
w13,1024,128,8,2048,768,32,32,256,16,8,3,1163.3633333333335,3
w13,1024,128,8,2048,768,32,32,256,16,8,4,1164.5156666666667,3
w13,1024,128,8,2048,768,32,32,256,32,4,3,1165.4963333333335,3
w13,1024,128,8,2048,768,32,32,256,32,8,3,1167.8326666666667,3
w13,1024,128,8,2048,768,32,32,256,32,8,4,1168.633,3
w13,1024,128,8,2048,768,32,64,256,1,4,3,1171.406,3
w13,1024,128,8,2048,768,32,64,256,1,8,3,1171.374,3
w13,1024,128,8,2048,768,32,64,256,8,4,3,1169.8593333333333,3
w13,1024,128,8,2048,768,32,64,256,8,8,3,1169.3793333333333,3
w13,1024,128,8,2048,768,32,64,256,16,4,3,1168.6753333333334,3
w13,1024,128,8,2048,768,32,64,256,16,8,3,1168.1633333333332,3
w13,1024,128,8,2048,768,64,32,256,1,4,3,1167.971,3
w13,1024,128,8,2048,768,64,32,256,1,8,3,1168.5153333333333,3
w13,1024,128,8,4096,1536,16,32,256,16,4,3,4551.565,3
w13,1024,128,8,4096,1536,16,32,256,16,4,4,4574.978666666667,3
w13,1024,128,8,4096,1536,16,32,256,16,8,3,4592.7390000000005,3
w13,1024,128,8,4096,1536,16,32,256,16,8,4,4590.445333333333,3
w13,1024,128,8,4096,1536,16,32,256,32,4,3,4548.919333333334,3
w13,1024,128,8,4096,1536,16,32,256,32,4,4,4571.693333333334,3
w13,1024,128,8,4096,1536,16,32,256,32,8,3,4589.016,3
w13,1024,128,8,4096,1536,16,32,256,32,8,4,4587.107,3
w13,1024,128,8,4096,1536,16,32,256,64,4,3,4550.541,3
w13,1024,128,8,4096,1536,16,32,256,64,4,4,4564.781333333333,3
w13,1024,128,8,4096,1536,16,32,256,64,8,3,4592.856,3
w13,1024,128,8,4096,1536,16,32,256,64,8,4,4589.517333333333,3
w13,1024,128,8,4096,1536,16,64,256,16,4,3,4569.218666666667,3
w13,1024,128,8,4096,1536,16,64,256,16,8,3,4574.573333333334,3
w13,1024,128,8,4096,1536,16,64,256,32,4,3,4567.768,3
w13,1024,128,8,4096,1536,16,64,256,32,8,3,4572.311666666667,3
w13,1024,128,8,4096,1536,16,64,256,64,4,3,4565.324666666666,3
w13,1024,128,8,4096,1536,16,64,256,64,8,3,4570.253333333333,3
w13,1024,128,8,4096,1536,32,32,256,4,4,3,4562.636333333333,3
w13,1024,128,8,4096,1536,32,32,256,4,4,4,4561.879333333333,3
w13,1024,128,8,4096,1536,32,32,256,4,8,3,4562.775333333334,3
w13,1024,128,8,4096,1536,32,32,256,4,8,4,4559.1163333333325,3
w13,1024,128,8,4096,1536,32,32,256,16,4,3,4555.937666666667,3
w13,1024,128,8,4096,1536,32,32,256,16,4,4,4563.468333333333,3
w13,1024,128,8,4096,1536,32,32,256,16,8,3,4554.060333333334,3
w13,1024,128,8,4096,1536,32,32,256,16,8,4,4564.492333333333,3
w13,1024,128,8,4096,1536,32,32,256,32,4,3,4555.799,3
w13,1024,128,8,4096,1536,32,32,256,32,4,4,4569.9856666666665,3
w13,1024,128,8,4096,1536,32,32,256,32,8,3,4553.559,3
w13,1024,128,8,4096,1536,32,32,256,32,8,4,4570.817666666667,3
w13,1024,128,8,4096,1536,32,64,256,1,4,3,4578.37,3
w13,1024,128,8,4096,1536,32,64,256,1,8,3,4575.116333333333,3
w13,1024,128,8,4096,1536,32,64,256,8,4,3,4568.428666666667,3
w13,1024,128,8,4096,1536,32,64,256,8,8,3,4564.0869999999995,3
w13,1024,128,8,4096,1536,32,64,256,16,4,3,4574.721666666667,3
w13,1024,128,8,4096,1536,32,64,256,16,8,3,4569.217666666666,3
w13,1024,128,8,4096,1536,32,64,256,32,4,3,4582.263,3
w13,1024,128,8,4096,1536,32,64,256,32,8,3,4577.335,3
w13,1024,128,8,4096,1536,32,64,256,64,4,3,4585.250333333333,3
w13,1024,128,8,4096,1536,32,64,256,64,8,3,4582.145666666666,3
w13,1024,128,8,4096,1536,64,32,256,1,4,3,4553.120666666667,3
w13,1024,128,8,4096,1536,64,32,256,1,8,3,4547.0086666666675,3
w13,1024,128,8,4096,3072,16,32,256,16,4,3,9071.285333333333,3
w13,1024,128,8,4096,3072,16,32,256,16,4,4,9116.074999999999,3
w13,1024,128,8,4096,3072,16,32,256,32,4,3,9071.167333333333,3
w13,1024,128,8,4096,3072,16,32,256,32,4,4,9102.144,3
w13,1024,128,8,4096,3072,16,32,256,64,4,3,9127.936333333333,3
w13,1024,128,8,4096,3072,16,32,256,64,4,4,9120.459333333334,3
w13,1024,128,8,4096,3072,16,64,256,16,4,3,9097.674333333334,3
w13,1024,128,8,4096,3072,16,64,256,16,8,3,9111.903666666667,3
w13,1024,128,8,4096,3072,16,64,256,32,4,3,9102.954333333333,3
w13,1024,128,8,4096,3072,16,64,256,32,8,3,9114.816,3
w13,1024,128,8,4096,3072,16,64,256,64,4,3,9112.533000000001,3
w13,1024,128,8,4096,3072,16,64,256,64,8,3,9124.96,3
w13,1024,128,8,4096,3072,32,32,256,4,4,3,9076.597,3
w13,1024,128,8,4096,3072,32,32,256,4,4,4,9081.396333333332,3
w13,1024,128,8,4096,3072,32,32,256,4,8,3,9075.263333333334,3
w13,1024,128,8,4096,3072,32,32,256,4,8,4,9081.993666666667,3
w13,1024,128,8,4096,3072,32,32,256,16,4,3,9083.028666666667,3
w13,1024,128,8,4096,3072,32,32,256,16,4,4,9115.039999999999,3
w13,1024,128,8,4096,3072,32,32,256,16,8,3,9081.877,3
w13,1024,128,8,4096,3072,32,32,256,16,8,4,9115.647666666666,3
w13,1024,128,8,4096,3072,32,32,256,32,4,3,9094.538,3
w13,1024,128,8,4096,3072,32,32,256,32,4,4,9127.252999999999,3
w13,1024,128,8,4096,3072,32,32,256,32,8,3,9094.207666666667,3
w13,1024,128,8,4096,3072,32,32,256,32,8,4,9126.219,3
w13,1024,128,8,4096,3072,32,64,256,8,4,3,9117.183666666666,3
w13,1024,128,8,4096,3072,32,64,256,8,8,3,9111.210000000001,3
w13,1024,128,8,4096,3072,32,64,256,16,4,3,9130.581,3
w13,1024,128,8,4096,3072,32,64,256,16,8,3,9124.778,3
w13,1024,128,8,4096,3072,32,64,256,32,4,3,9142.901,3
w13,1024,128,8,4096,3072,32,64,256,32,8,3,9140.010333333334,3
w13,1024,128,8,4096,3072,32,64,256,64,4,3,9150.303333333335,3
w13,1024,128,8,4096,3072,32,64,256,64,8,3,9146.495,3
w13,1024,128,8,4096,3072,64,32,256,1,4,3,9083.016666666666,3
w13,1024,128,8,4096,3072,64,32,256,1,8,3,9076.915333333332,3
w13,1536,8,2,1024,512,64,128,32,8,8,3,48.77,3
w13,1536,16,2,1536,768,64,64,64,1,4,3,109.16466666666668,3
w13,1536,16,2,1536,768,64,64,64,4,4,3,108.707,3
w13,1536,16,2,1536,768,64,64,64,16,4,3,108.39666666666666,3
w13,1536,16,2,1536,768,64,64,64,32,4,3,108.813,3
w13,1536,16,2,1536,768,64,64,64,64,4,3,108.397,3
w13,1536,16,4,1536,1024,64,128,64,1,4,3,257.74133333333333,3
w13,1536,16,4,1536,1024,64,128,64,1,8,3,258.76533333333333,3
w13,1536,16,4,1536,1024,64,128,64,16,8,3,258.4456666666667,3
w13,1536,16,4,1536,1024,64,128,64,32,4,3,258.45599999999996,3
w13,1536,16,4,1536,1024,64,128,64,32,8,3,258.872,3
w13,1536,16,4,1536,1024,64,128,64,64,4,3,257.8376666666666,3
w13,1536,16,4,1536,1024,64,128,64,64,8,3,257.41066666666666,3
w13,1536,32,4,2048,768,64,64,128,64,8,4,340.7183333333333,3
w13,1536,32,6,3072,1024,64,128,64,1,4,3,844.4033333333333,3
w13,1536,32,6,3072,1024,64,128,64,1,8,3,837.9713333333333,3
w13,1536,32,6,3072,1024,64,128,64,4,4,3,844.8620000000001,3
w13,1536,32,6,3072,1024,64,128,64,4,8,3,844.6593333333334,3
w13,1536,32,6,3072,1024,64,128,64,16,8,3,844.435,3
w13,1536,32,6,3072,1024,64,128,64,32,8,3,844.8296666666666,3
w13,1536,32,6,3072,1024,64,128,64,64,4,3,846.3870000000001,3
w13,1536,32,6,3072,1024,64,128,64,64,8,3,843.9123333333333,3
w13,1536,60,4,2048,1408,32,32,128,4,4,3,1044.3116666666667,3
w13,1536,60,4,2048,1408,32,32,128,4,4,4,1044.7376666666667,3
w13,1536,60,4,2048,1408,32,32,128,16,4,3,1047.6283333333333,3
w13,1536,60,4,2048,1408,32,32,128,16,4,4,1045.495,3
w13,1536,60,4,2048,1408,32,32,256,4,4,2,1044.0663333333332,3
w13,1536,60,4,2048,1408,32,32,256,4,8,2,1047.2556666666667,3
w13,1536,60,4,2048,1408,32,32,256,16,4,2,1046.3696666666667,3
w13,1536,60,4,2048,1408,32,32,256,32,4,2,1046.3913333333333,3
w13,1536,60,4,2048,1408,32,64,128,4,4,4,1044.492,3
w13,1536,60,4,2048,1408,32,64,128,4,8,3,1047.1166666666666,3
w13,1536,60,4,2048,1408,32,64,128,4,8,4,1043.5006666666666,3
w13,1536,60,4,2048,1408,32,64,128,16,4,4,1047.0739999999998,3
w13,1536,60,4,2048,1408,32,64,128,16,8,3,1047.4156666666668,3
w13,1536,60,4,2048,1408,32,64,128,16,8,4,1046.413,3
w13,1536,60,4,2048,1408,32,64,256,8,4,3,1044.0653333333332,3
w13,1536,60,4,2048,1408,32,64,256,8,8,2,1046.0069999999998,3
w13,1536,60,4,2048,1408,32,64,256,8,8,3,1037.463,3
w13,1536,60,4,2048,1408,32,64,256,16,4,3,1044.5883333333334,3
w13,1536,60,4,2048,1408,32,64,256,16,8,2,1047.2656666666667,3
w13,1536,60,4,2048,1408,32,64,256,16,8,3,1039.1273333333334,3
w13,1536,60,4,2048,1408,32,64,256,32,4,3,1046.1989999999998,3
w13,1536,60,4,2048,1408,32,64,256,32,8,3,1041.3883333333333,3
w13,1536,60,4,2048,1408,32,64,256,64,8,3,1047.298,3
w13,1536,60,4,2048,1408,64,32,128,16,8,3,1047.095,3
w13,1536,60,6,3584,2304,64,64,128,1,4,2,3009.422666666667,3
w13,1536,60,6,3584,2304,64,64,128,4,4,2,3039.2369999999996,3
w13,1536,60,6,3584,2304,64,128,128,1,8,3,3025.369666666667,3
w13,1536,60,8,2048,1536,128,64,128,1,4,2,1279.809,3
w13,1536,64,6,3072,2048,32,64,128,1,4,2,2479.783,3
w13,1536,64,6,3072,2048,32,64,128,1,8,2,2473.682666666667,3
w13,1536,64,6,3072,2048,32,64,128,4,4,2,2477.266333333333,3
w13,1536,64,6,3072,2048,32,128,128,4,8,2,2485.895666666667,3
w13,1536,64,6,3072,2048,32,128,128,8,8,2,2483.6876666666667,3
w13,1536,64,6,3072,2048,64,64,128,1,4,2,2469.6073333333334,3
w13,1536,64,6,3072,2048,64,64,128,4,4,2,2474.642,3
w13,1536,64,6,3072,2048,64,128,128,1,4,2,2469.629,3
w13,1536,64,6,3072,2048,64,128,128,1,8,2,2464.018,3
w13,1536,64,6,3584,1536,32,64,128,1,4,2,2179.4303333333332,3
w13,1536,64,6,3584,1536,32,64,128,1,8,2,2181.2543333333333,3
w13,1536,64,6,3584,1536,32,64,128,4,4,2,2182.7046666666665,3
w13,1536,64,6,3584,1536,32,64,128,4,8,2,2194.0113333333334,3
w13,1536,64,6,3584,1536,32,128,128,1,4,2,2190.406,3
w13,1536,64,6,3584,1536,32,128,128,1,4,3,2181.499333333333,3
w13,1536,64,6,3584,1536,32,128,128,1,8,2,2183.1739999999995,3
w13,1536,64,6,3584,1536,32,128,128,1,8,3,2180.9663333333333,3
w13,1536,64,6,3584,1536,32,128,128,4,4,2,2188.2729999999997,3
w13,1536,64,6,3584,1536,32,128,128,4,8,2,2185.6913333333337,3
w13,1536,64,6,3584,1536,32,128,128,8,4,2,2187.0886666666665,3
w13,1536,64,6,3584,1536,32,128,128,8,8,2,2184.8379999999997,3
w13,1536,64,6,3584,1536,64,64,128,1,4,2,2172.549666666667,3
w13,1536,64,6,3584,1536,64,64,128,4,4,2,2181.6806666666666,3
w13,1536,64,6,3584,1536,64,128,128,1,4,2,2173.8503333333333,3
w13,1536,64,6,3584,1536,64,128,128,1,4,3,2188.3253333333337,3
w13,1536,64,6,3584,1536,64,128,128,1,8,2,2186.0643333333333,3
w13,1536,64,6,3584,1536,64,128,128,1,8,3,2177.0293333333334,3
w13,1536,64,6,3584,1536,64,128,128,4,4,2,2181.808,3
w13,1536,64,6,3584,1536,64,128,128,4,8,2,2192.187,3
w13,1536,64,8,3584,2560,64,128,128,1,4,3,3600.5706666666665,3
w13,1536,64,8,3584,2560,64,128,128,1,8,3,3589.84,3
w13,1536,128,4,2048,512,16,16,256,1,4,3,773.3836666666666,3
w13,1536,128,4,2048,512,16,16,256,4,4,3,769.7779999999999,3
w13,1536,128,4,2048,512,16,32,256,1,4,3,770.781,3
w13,1536,128,4,2048,512,16,32,256,1,4,4,776.0393333333333,3
w13,1536,128,4,2048,512,16,32,256,1,8,3,773.8316666666666,3
w13,1536,128,4,2048,512,16,32,256,16,4,3,769.4473333333334,3
w13,1536,128,4,2048,512,16,32,256,16,4,4,773.2663333333334,3
w13,1536,128,4,2048,512,16,32,256,16,8,3,772.3383333333333,3
w13,1536,128,4,2048,512,16,32,256,16,8,4,776.1036666666665,3
w13,1536,128,4,2048,512,16,32,256,32,4,3,771.634,3
w13,1536,128,4,2048,512,16,32,256,32,4,4,775.4743333333332,3
w13,1536,128,4,2048,512,16,32,256,32,8,3,775.0576666666666,3
w13,1536,128,4,2048,512,16,64,256,1,4,3,775.1653333333334,3
w13,1536,128,4,2048,512,16,64,256,1,8,3,776.7220000000001,3
w13,1536,128,4,2048,512,16,64,256,16,4,3,773.2550000000001,3
w13,1536,128,4,2048,512,16,64,256,16,8,3,773.7773333333333,3
w13,1536,128,4,2048,512,16,64,256,32,4,3,774.8976666666667,3
w13,1536,128,4,2048,512,16,64,256,32,8,3,775.2076666666667,3
w13,1536,128,4,2048,512,32,32,256,1,4,3,771.143,3
w13,1536,128,4,2048,512,32,32,256,1,4,4,774.5136666666667,3
w13,1536,128,4,2048,512,32,32,256,1,8,3,770.5456666666668,3
w13,1536,128,4,2048,512,32,32,256,1,8,4,774.4813333333333,3
w13,1536,128,4,2048,512,32,32,256,4,4,3,772.2093333333333,3
w13,1536,128,4,2048,512,32,32,256,4,4,4,775.4626666666667,3
w13,1536,128,4,2048,512,32,32,256,4,8,3,770.7156666666666,3
w13,1536,128,4,2048,512,32,32,256,4,8,4,775.4946666666666,3
w13,1536,128,4,2048,512,32,32,256,16,4,3,774.7053333333333,3
w13,1536,128,4,2048,512,32,32,256,16,4,4,776.4976666666666,3
w13,1536,128,4,2048,512,32,32,256,16,8,3,773.532,3
w13,1536,128,4,2048,512,32,32,256,32,4,3,775.612,3
w13,1536,128,4,2048,512,32,32,256,32,8,3,774.7800000000001,3
w13,1536,128,6,4096,2048,32,32,128,4,4,4,6150.057333333333,3
w13,1536,128,6,4096,2048,32,32,256,1,4,2,6155.8386666666665,3
w13,1536,128,6,4096,2048,32,32,256,1,8,2,6153.588,3
w13,1536,128,6,4096,2048,32,32,256,4,4,2,6157.182666666667,3
w13,1536,128,6,4096,2048,32,32,256,4,4,4,6107.688666666666,3
w13,1536,128,6,4096,2048,32,32,256,4,8,2,6160.9906666666675,3
w13,1536,128,6,4096,2048,32,64,128,4,4,4,6161.748,3
w13,1536,128,6,4096,2048,32,64,128,4,8,4,6166.740333333332,3
w13,1536,128,6,4096,2048,64,32,128,16,8,4,6168.809,3
w13,1536,128,6,4096,2048,64,32,256,1,4,2,6160.1793333333335,3
w13,1536,128,6,4096,2048,64,32,256,1,8,2,6153.448666666667,3
w13,1536,128,8,2048,768,32,32,128,16,4,4,1208.184,3
w13,1536,128,8,2048,768,32,32,256,16,4,3,1205.464,3
w13,1536,128,8,2048,768,32,32,256,16,4,4,1207.3523333333333,3
w13,1536,128,8,2048,768,32,32,256,16,8,3,1204.1733333333334,3
w13,1536,128,8,2048,768,32,32,256,16,8,4,1208.0346666666667,3
w13,1536,128,8,2048,768,32,32,256,32,4,4,1208.0026666666665,3
w13,1536,128,8,2048,768,32,32,256,32,8,3,1207.7893333333334,3
w13,1536,128,8,2048,768,32,32,256,32,8,4,1207.5333333333335,3
w13,1536,128,8,2048,768,32,64,256,8,4,3,1205.8806666666667,3
w13,1536,128,8,2048,768,32,64,256,8,8,3,1201.3676666666668,3
w13,1536,128,8,2048,768,32,64,256,16,4,3,1202.3493333333333,3
w13,1536,128,8,2048,768,32,64,256,16,8,3,1197.144,3
w13,1536,128,8,2048,768,32,64,256,32,4,3,1207.5976666666666,3
w13,1536,128,8,2048,768,32,64,256,32,8,3,1202.765,3
w13,1536,128,8,4096,1536,32,32,128,1,4,4,4688.748333333333,3
w13,1536,128,8,4096,1536,32,32,128,1,8,4,4691.201666666667,3
w13,1536,128,8,4096,1536,32,32,128,4,4,3,4711.660666666667,3
w13,1536,128,8,4096,1536,32,32,128,4,4,4,4707.937666666667,3
w13,1536,128,8,4096,1536,32,32,256,4,4,2,4704.299666666667,3
w13,1536,128,8,4096,1536,32,64,128,1,4,4,4717.431,3
w13,1536,128,8,4096,1536,32,64,128,1,8,3,4715.34,3
w13,1536,128,8,4096,1536,32,64,128,4,4,4,4708.598666666666,3
w13,1536,128,8,4096,1536,32,64,128,4,8,3,4716.363666666667,3
w13,1536,128,8,4096,1536,32,64,128,4,8,4,4708.683333333333,3
w13,1536,128,8,4096,1536,32,64,256,1,4,2,4702.934,3
w13,1536,128,8,4096,1536,32,64,256,1,4,3,4687.563333333333,3
w13,1536,128,8,4096,1536,32,64,256,1,8,2,4690.998,3
w13,1536,128,8,4096,1536,32,64,256,1,8,3,4670.987,3
w13,1536,128,8,4096,1536,64,32,128,16,4,3,4701.3,3
w13,1536,128,8,4096,1536,64,32,128,16,4,4,4696.3623333333335,3
w13,1536,128,8,4096,1536,64,32,128,16,8,3,4695.5086666666675,3
w13,1536,128,8,4096,1536,64,32,128,16,8,4,4691.732,3
w13,1536,128,8,4096,1536,64,64,128,1,8,4,4715.667333333334,3
w13,1536,128,8,4096,1536,64,64,128,8,4,4,4714.718666666667,3
w13,1536,128,8,4096,1536,64,64,128,8,8,4,4708.467666666666,3
w13,1536,128,8,4096,1536,64,64,128,16,4,4,4707.6466666666665,3
w13,1536,128,8,4096,1536,64,64,128,16,8,3,4714.004333333333,3
w13,1536,128,8,4096,1536,64,64,128,16,8,4,4702.537333333334,3
w13,1536,128,8,4096,1536,64,64,128,32,4,3,4717.171333333333,3
w13,1536,128,8,4096,1536,64,64,128,32,4,4,4701.492,3
w13,1536,128,8,4096,1536,64,64,128,32,8,3,4701.288333333333,3
w13,1536,128,8,4096,1536,64,64,128,32,8,4,4699.134000000001,3
w13,1536,128,8,4096,1536,64,64,128,64,4,4,4710.4946666666665,3
w13,1536,128,8,4096,1536,64,64,128,64,8,3,4711.476,3
w13,1536,128,8,4096,1536,64,64,128,64,8,4,4708.499666666667,3
w13,1536,128,8,4096,1536,64,128,128,1,4,3,4713.011333333333,3
w13,1536,128,8,4096,1536,64,128,128,1,8,3,4705.576333333333,3
w13,1536,128,8,4096,1536,64,128,128,32,4,3,4716.232,3
w13,1536,128,8,4096,1536,64,128,128,32,8,3,4712.925333333334,3
w13,1536,128,8,4096,1536,64,128,128,64,8,3,4713.31,3
w13,1536,128,8,4096,3072,32,64,128,1,8,3,9415.359333333334,3
w13,1536,128,8,4096,3072,32,64,256,1,4,2,9380.712,3
w13,1536,128,8,4096,3072,32,64,256,1,8,2,9376.68,3
w13,1536,128,8,4096,3072,32,128,128,1,4,3,9400.743,3
w13,1536,128,8,4096,3072,32,128,128,1,8,3,9392.220666666666,3
w13,1536,128,8,4096,3072,64,32,128,16,4,3,9332.485333333332,3
w13,1536,128,8,4096,3072,64,32,128,16,4,4,9328.282000000001,3
w13,1536,128,8,4096,3072,64,32,128,16,8,3,9334.372666666668,3
w13,1536,128,8,4096,3072,64,32,128,16,8,4,9322.917,3
w13,1536,128,8,4096,3072,64,64,128,4,4,4,9394.831666666667,3
w13,1536,128,8,4096,3072,64,64,128,4,8,4,9390.404333333334,3
w13,1536,128,8,4096,3072,64,64,128,8,4,4,9377.37,3
w13,1536,128,8,4096,3072,64,64,128,8,8,3,9392.399,3
w13,1536,128,8,4096,3072,64,64,128,8,8,4,9372.025333333333,3
w13,1536,128,8,4096,3072,64,64,128,16,4,3,9393.199,3
w13,1536,128,8,4096,3072,64,64,128,16,4,4,9360.367,3
w13,1536,128,8,4096,3072,64,64,128,16,8,3,9365.134666666667,3
w13,1536,128,8,4096,3072,64,64,128,16,8,4,9358.33,3
w13,1536,128,8,4096,3072,64,64,128,32,4,4,9382.340333333334,3
w13,1536,128,8,4096,3072,64,64,128,32,8,3,9386.360333333332,3
w13,1536,128,8,4096,3072,64,64,128,32,8,4,9379.544333333333,3
w13,1536,128,8,4096,3072,64,64,128,64,4,4,9407.512333333334,3
w13,1536,128,8,4096,3072,64,64,128,64,8,3,9411.341999999999,3
w13,1536,128,8,4096,3072,64,64,128,64,8,4,9405.283333333333,3
w13,1536,128,8,4096,3072,64,128,128,4,4,3,9404.481333333333,3
w13,1536,128,8,4096,3072,64,128,128,4,8,3,9389.569000000001,3
w13,1536,128,8,4096,3072,64,128,128,16,4,3,9398.400666666666,3
w13,1536,128,8,4096,3072,64,128,128,16,8,3,9386.849333333334,3
w13,1536,128,8,4096,3072,64,128,128,32,4,3,9397.377,3
w13,1536,128,8,4096,3072,64,128,128,32,8,3,9386.059333333333,3
w13,1536,128,8,4096,3072,64,128,128,64,4,3,9404.000999999998,3
w13,1536,128,8,4096,3072,64,128,128,64,8,3,9390.326000000001,3
w13,2048,8,2,1024,512,64,128,32,8,8,3,63.24466666666667,3
w13,2048,16,2,1536,768,64,64,64,1,4,3,134.92533333333333,3
w13,2048,16,2,1536,768,64,64,64,4,4,3,135.12800000000001,3
w13,2048,16,2,1536,768,64,64,64,16,4,3,135.68233333333333,3
w13,2048,16,2,1536,768,64,64,64,32,4,3,134.38133333333334,3
w13,2048,16,2,1536,768,64,64,64,64,4,3,135.714,3
w13,2048,16,2,1536,768,64,128,32,8,8,3,134.87233333333333,3
w13,2048,16,4,1536,1024,64,128,64,1,4,3,343.13966666666664,3
w13,2048,16,4,1536,1024,64,128,64,1,8,3,341.539,3
w13,2048,16,4,1536,1024,64,128,64,4,8,3,342.15799999999996,3
w13,2048,16,4,1536,1024,64,128,64,16,4,3,343.15000000000003,3
w13,2048,16,4,1536,1024,64,128,64,16,8,3,340.931,3
w13,2048,16,4,1536,1024,64,128,64,32,4,3,342.7656666666667,3
w13,2048,16,4,1536,1024,64,128,64,32,8,3,341.77366666666666,3
w13,2048,16,4,1536,1024,64,128,64,64,4,3,342.083,3
w13,2048,16,4,1536,1024,64,128,64,64,8,3,340.36633333333333,3
w13,2048,32,4,2048,768,64,128,128,1,4,2,371.05466666666666,3
w13,2048,32,4,2048,768,64,128,128,4,4,2,373.85999999999996,3
w13,2048,32,4,2048,768,64,128,128,16,4,2,371.42800000000005,3
w13,2048,32,4,2048,768,64,128,128,32,4,2,372.228,3
w13,2048,32,4,2048,768,64,128,128,64,4,2,370.14799999999997,3
w13,2048,32,6,3072,1024,64,128,64,1,4,3,983.0933333333332,3
w13,2048,32,6,3072,1024,64,128,64,1,8,3,981.8343333333332,3
w13,2048,32,6,3072,1024,64,128,64,4,4,3,986.8796666666667,3
w13,2048,32,6,3072,1024,64,128,64,4,8,3,986.026,3
w13,2048,32,6,3072,1024,64,128,64,16,4,3,987.5623333333333,3
w13,2048,32,6,3072,1024,64,128,64,16,8,3,983.5196666666667,3
w13,2048,32,6,3072,1024,64,128,64,32,4,3,987.4553333333333,3
w13,2048,32,6,3072,1024,64,128,64,32,8,3,985.9196666666667,3
w13,2048,32,6,3072,1024,64,128,64,64,4,3,987.5193333333333,3
w13,2048,32,6,3072,1024,64,128,64,64,8,3,989.034,3
w13,2048,32,6,3072,1024,128,128,64,4,4,2,989.333,3
w13,2048,32,6,3072,1024,128,128,64,8,4,2,990.7196666666667,3
w13,2048,60,4,2048,1408,32,64,128,16,4,3,1079.2546666666667,3
w13,2048,60,4,2048,1408,64,64,128,1,8,4,1069.9743333333333,3
w13,2048,60,6,3584,2304,64,128,64,4,4,3,3335.3050000000003,3
w13,2048,60,6,3584,2304,64,128,64,4,8,3,3337.097,3
w13,2048,60,6,3584,2304,64,128,64,16,4,3,3337.2676666666666,3
w13,2048,60,6,3584,2304,64,128,64,16,8,3,3334.7076666666667,3
w13,2048,60,6,3584,2304,64,128,64,32,4,3,3330.4516666666664,3
w13,2048,60,6,3584,2304,64,128,64,32,8,3,3335.539666666666,3
w13,2048,60,6,3584,2304,64,128,64,64,4,3,3333.459666666667,3
w13,2048,60,6,3584,2304,64,128,64,64,8,3,3340.531666666667,3
w13,2048,60,6,3584,2304,128,64,64,16,4,3,3336.2009999999996,3
w13,2048,60,6,3584,2304,128,64,64,16,8,3,3327.881,3
w13,2048,60,6,3584,2304,128,64,128,1,4,2,3312.787666666667,3
w13,2048,60,6,3584,2304,128,64,128,16,4,2,3325.374333333333,3
w13,2048,60,8,2048,1536,64,128,64,1,4,3,1527.1490000000001,3
w13,2048,60,8,2048,1536,64,128,64,1,8,3,1523.5436666666665,3
w13,2048,60,8,2048,1536,64,128,64,4,4,3,1535.2663333333333,3
w13,2048,60,8,2048,1536,64,128,64,4,8,3,1534.317,3
w13,2048,60,8,2048,1536,64,128,64,16,4,3,1538.093,3
w13,2048,60,8,2048,1536,64,128,64,16,8,3,1533.2506666666668,3
w13,2048,60,8,2048,1536,64,128,64,32,4,3,1534.5303333333334,3
w13,2048,60,8,2048,1536,64,128,64,32,8,3,1529.4103333333333,3
w13,2048,60,8,2048,1536,64,128,64,64,4,3,1531.7893333333334,3
w13,2048,60,8,2048,1536,64,128,64,64,8,3,1528.2903333333334,3
w13,2048,64,6,3072,2048,64,64,128,1,4,2,2520.1876666666667,3
w13,2048,64,6,3072,2048,64,64,128,4,4,2,2522.9503333333337,3
w13,2048,64,6,3072,2048,64,128,128,1,4,2,2512.9983333333334,3
w13,2048,64,6,3072,2048,64,128,128,1,8,2,2515.889333333333,3
w13,2048,64,6,3072,2048,64,128,128,4,4,2,2537.8843333333334,3
w13,2048,64,6,3584,1536,64,64,128,1,4,2,2217.5383333333334,3
w13,2048,64,6,3584,1536,64,64,128,4,4,2,2228.0663333333337,3
w13,2048,64,6,3584,1536,64,128,128,1,4,2,2222.52,3
w13,2048,64,6,3584,1536,64,128,128,1,4,3,2232.759666666667,3
w13,2048,64,6,3584,1536,64,128,128,1,8,2,2225.644333333333,3
w13,2048,64,6,3584,1536,64,128,128,1,8,3,2222.2423333333336,3
w13,2048,64,6,3584,1536,64,128,128,4,4,2,2230.6586666666667,3
w13,2048,64,6,3584,1536,64,128,128,4,8,3,2236.364666666667,3
w13,2048,64,8,3584,2560,64,128,64,1,4,3,4038.173666666667,3
w13,2048,64,8,3584,2560,64,128,64,4,4,3,4021.384666666667,3
w13,2048,64,8,3584,2560,64,128,64,16,4,3,4019.8806666666665,3
w13,2048,64,8,3584,2560,64,128,64,32,4,3,4020.349333333333,3
w13,2048,64,8,3584,2560,64,128,64,64,4,3,4031.037333333333,3
w13,2048,64,8,3584,2560,64,128,128,16,4,2,4060.35,3
w13,2048,64,8,3584,2560,64,128,128,32,4,2,4060.200666666666,3
w13,2048,64,8,3584,2560,128,64,64,16,4,3,4043.838333333333,3
w13,2048,64,8,3584,2560,128,64,128,1,4,2,4022.1306666666665,3
w13,2048,64,8,3584,2560,128,64,128,16,4,2,4033.0,3
w13,2048,64,8,3584,2560,128,128,64,4,4,4,4058.6963333333333,3
w13,2048,64,8,3584,2560,128,128,64,8,4,4,4059.795333333333,3
w13,2048,64,8,3584,2560,128,128,64,16,4,4,4051.0480000000002,3
w13,2048,64,8,3584,2560,128,128,64,32,4,4,4056.7656666666667,3
w13,2048,128,4,2048,512,16,32,256,1,4,3,781.8513333333334,3
w13,2048,128,4,2048,512,16,32,256,1,8,3,788.4966666666666,3
w13,2048,128,4,2048,512,16,32,256,16,4,3,782.0113333333334,3
w13,2048,128,4,2048,512,16,32,256,16,4,4,787.2916666666666,3
w13,2048,128,4,2048,512,16,32,256,16,8,3,787.846,3
w13,2048,128,4,2048,512,16,32,256,32,4,3,783.9423333333333,3
w13,2048,128,4,2048,512,16,32,256,32,4,4,787.6966666666667,3
w13,2048,128,4,2048,512,16,32,256,32,8,3,788.6246666666666,3
w13,2048,128,4,2048,512,16,32,256,64,4,3,784.6673333333333,3
w13,2048,128,4,2048,512,16,32,256,64,4,4,789.2113333333333,3
w13,2048,128,4,2048,512,16,64,256,1,4,3,785.1683333333334,3
w13,2048,128,4,2048,512,16,64,256,1,8,3,785.3179999999999,3
w13,2048,128,4,2048,512,16,64,256,16,4,3,786.4163333333332,3
w13,2048,128,4,2048,512,16,64,256,16,8,3,786.6086666666666,3
w13,2048,128,4,2048,512,16,64,256,32,4,3,788.4540000000001,3
w13,2048,128,4,2048,512,16,64,256,32,8,3,787.9953333333333,3
w13,2048,128,4,2048,512,32,32,256,1,4,3,782.043,3
w13,2048,128,4,2048,512,32,32,256,1,4,4,785.2433333333333,3
w13,2048,128,4,2048,512,32,32,256,1,8,3,781.3496666666666,3
w13,2048,128,4,2048,512,32,32,256,1,8,4,784.9553333333333,3
w13,2048,128,4,2048,512,32,32,256,4,4,3,782.8323333333334,3
w13,2048,128,4,2048,512,32,32,256,4,4,4,786.406,3
w13,2048,128,4,2048,512,32,32,256,4,8,3,781.5736666666667,3
w13,2048,128,4,2048,512,32,32,256,4,8,4,786.0636666666666,3
w13,2048,128,4,2048,512,32,32,256,16,4,3,785.0616666666666,3
w13,2048,128,4,2048,512,32,32,256,16,4,4,788.166,3
w13,2048,128,4,2048,512,32,32,256,16,8,3,784.5393333333333,3
w13,2048,128,4,2048,512,32,32,256,16,8,4,788.3249999999999,3
w13,2048,128,4,2048,512,32,32,256,32,4,3,786.9073333333332,3
w13,2048,128,4,2048,512,32,32,256,32,4,4,789.0079999999999,3
w13,2048,128,4,2048,512,32,32,256,32,8,3,785.0826666666667,3
w13,2048,128,4,2048,512,32,64,256,8,8,3,788.859,3
w13,2048,128,4,2048,512,64,32,256,1,4,3,789.2220000000001,3
w13,2048,128,4,2048,512,64,32,256,1,8,3,787.7173333333334,3
w13,2048,128,6,4096,2048,32,32,128,1,4,3,6245.584666666667,3
w13,2048,128,6,4096,2048,32,32,128,1,8,3,6243.707333333333,3
w13,2048,128,6,4096,2048,32,32,128,4,4,3,6237.712666666666,3
w13,2048,128,6,4096,2048,32,32,128,4,4,4,6247.057,3
w13,2048,128,6,4096,2048,32,32,256,1,4,2,6224.507333333334,3
w13,2048,128,6,4096,2048,32,32,256,1,8,2,6223.536666666667,3
w13,2048,128,6,4096,2048,32,32,256,4,4,2,6226.245666666667,3
w13,2048,128,6,4096,2048,32,32,256,4,8,2,6247.7716666666665,3
w13,2048,128,6,4096,2048,32,64,128,1,4,3,6267.888666666667,3
w13,2048,128,6,4096,2048,32,64,128,1,8,3,6264.635333333333,3
w13,2048,128,6,4096,2048,32,64,128,4,4,3,6259.184,3
w13,2048,128,6,4096,2048,32,64,128,4,4,4,6223.013666666667,3
w13,2048,128,6,4096,2048,32,64,128,4,8,3,6257.553,3
w13,2048,128,6,4096,2048,32,64,128,4,8,4,6228.048333333333,3
w13,2048,128,6,4096,2048,32,64,256,1,4,2,6241.530333333333,3
w13,2048,128,6,4096,2048,32,64,256,1,8,2,6234.223999999999,3
w13,2048,128,6,4096,2048,32,128,128,1,4,3,6265.572666666667,3
w13,2048,128,6,4096,2048,32,128,128,1,8,3,6261.519333333334,3
w13,2048,128,6,4096,2048,32,128,128,4,4,3,6258.2660000000005,3
w13,2048,128,6,4096,2048,32,128,128,4,8,3,6254.500666666667,3
w13,2048,128,6,4096,2048,64,32,128,1,4,3,6239.076333333333,3
w13,2048,128,6,4096,2048,64,32,128,1,8,3,6233.667666666667,3
w13,2048,128,6,4096,2048,64,32,128,16,4,3,6236.036,3
w13,2048,128,6,4096,2048,64,32,128,16,4,4,6234.415,3
w13,2048,128,6,4096,2048,64,32,128,16,8,3,6236.2390000000005,3
w13,2048,128,6,4096,2048,64,32,128,16,8,4,6226.233666666667,3
w13,2048,128,6,4096,2048,64,32,256,1,4,2,6220.899666666667,3
w13,2048,128,6,4096,2048,64,32,256,1,8,2,6217.860333333333,3
w13,2048,128,6,4096,2048,64,64,128,1,4,3,6262.575,3
w13,2048,128,6,4096,2048,64,64,128,1,4,4,6236.441333333333,3
w13,2048,128,6,4096,2048,64,64,128,1,8,3,6247.118666666666,3
w13,2048,128,6,4096,2048,64,64,128,1,8,4,6236.675666666667,3
w13,2048,128,6,4096,2048,64,64,128,4,4,3,6280.644333333334,3
w13,2048,128,6,4096,2048,64,64,128,4,4,4,6252.633000000001,3
w13,2048,128,6,4096,2048,64,64,128,4,8,3,6264.728999999999,3
w13,2048,128,6,4096,2048,64,64,128,4,8,4,6251.214,3
w13,2048,128,6,4096,2048,64,64,128,8,4,3,6274.767,3
w13,2048,128,6,4096,2048,64,64,128,8,4,4,6250.382333333334,3
w13,2048,128,6,4096,2048,64,64,128,8,8,3,6256.782999999999,3
w13,2048,128,6,4096,2048,64,64,128,8,8,4,6251.491666666666,3
w13,2048,128,6,4096,2048,64,64,128,16,4,3,6279.491666666666,3
w13,2048,128,6,4096,2048,64,64,128,16,4,4,6261.316,3
w13,2048,128,6,4096,2048,64,64,128,16,8,3,6259.737666666667,3
w13,2048,128,6,4096,2048,64,64,128,16,8,4,6257.028000000001,3
w13,2048,128,6,4096,2048,64,64,128,32,4,4,6272.910666666667,3
w13,2048,128,6,4096,2048,64,64,128,32,8,3,6269.1990000000005,3
w13,2048,128,6,4096,2048,64,64,128,32,8,4,6270.723999999999,3
w13,2048,128,6,4096,2048,64,64,128,64,8,3,6279.652333333334,3
w13,2048,128,6,4096,2048,64,128,128,1,8,3,6274.105,3
w13,2048,128,6,4096,2048,64,128,128,4,8,3,6273.593333333333,3
w13,2048,128,6,4096,2048,64,128,128,16,8,3,6273.732,3
w13,2048,128,6,4096,2048,64,128,128,32,8,3,6274.169333333334,3
w13,2048,128,6,4096,2048,64,128,128,64,8,3,6277.699666666666,3
w13,2048,128,6,4096,2048,128,32,128,1,4,3,6265.507333333334,3
w13,2048,128,6,4096,2048,128,32,128,1,8,3,6264.899,3
w13,2048,128,8,2048,768,32,64,128,16,8,3,1244.045,3
w13,2048,128,8,2048,768,32,64,128,32,4,3,1241.6236666666666,3
w13,2048,128,8,2048,768,32,64,128,32,4,4,1241.0146666666667,3
w13,2048,128,8,2048,768,32,64,128,32,8,3,1238.6363333333331,3
w13,2048,128,8,2048,768,32,64,128,32,8,4,1240.119,3
w13,2048,128,8,2048,768,32,64,128,64,4,3,1240.4603333333334,3
w13,2048,128,8,2048,768,32,64,128,64,4,4,1241.9006666666667,3
w13,2048,128,8,2048,768,32,64,128,64,8,3,1238.4333333333334,3
w13,2048,128,8,2048,768,32,64,128,64,8,4,1241.0046666666667,3
w13,2048,128,8,2048,768,32,64,256,8,4,3,1245.0686666666668,3
w13,2048,128,8,2048,768,32,64,256,8,8,3,1237.9003333333333,3
w13,2048,128,8,2048,768,32,64,256,16,4,3,1243.1809999999998,3
w13,2048,128,8,2048,768,32,64,256,16,8,2,1244.823,3
w13,2048,128,8,2048,768,32,64,256,16,8,3,1237.7933333333333,3
w13,2048,128,8,2048,768,32,64,256,32,4,3,1238.4653333333333,3
w13,2048,128,8,2048,768,32,64,256,32,8,2,1240.7806666666668,3
w13,2048,128,8,2048,768,32,64,256,32,8,3,1232.8123333333333,3
w13,2048,128,8,2048,768,32,64,256,64,4,3,1241.0153333333335,3
w13,2048,128,8,2048,768,32,64,256,64,8,2,1240.5026666666665,3
w13,2048,128,8,2048,768,32,64,256,64,8,3,1234.2093333333335,3
w13,2048,128,8,2048,768,32,128,128,64,8,3,1244.4286666666667,3
w13,2048,128,8,2048,768,64,32,128,1,8,3,1244.5140000000001,3
w13,2048,128,8,2048,768,64,32,128,16,4,3,1239.2653333333335,3
w13,2048,128,8,2048,768,64,32,128,16,4,4,1243.8096666666668,3
w13,2048,128,8,2048,768,64,32,128,16,8,3,1237.4633333333334,3
w13,2048,128,8,2048,768,64,32,128,16,8,4,1241.3566666666666,3
w13,2048,128,8,2048,768,64,64,128,1,8,4,1243.1266666666668,3
w13,2048,128,8,2048,768,64,64,128,4,4,4,1244.396,3
w13,2048,128,8,2048,768,64,64,128,4,8,4,1241.847,3
w13,2048,128,8,2048,768,64,64,128,8,4,4,1243.2016666666666,3
w13,2048,128,8,2048,768,64,64,128,8,8,4,1241.719,3
w13,2048,128,8,2048,768,64,64,128,16,4,4,1238.9669999999999,3
w13,2048,128,8,2048,768,64,64,128,16,8,4,1236.5243333333333,3
w13,2048,128,8,2048,768,64,64,128,32,4,4,1239.116,3
w13,2048,128,8,2048,768,64,64,128,32,8,3,1243.3296666666668,3
w13,2048,128,8,2048,768,64,64,128,32,8,4,1237.8893333333333,3
w13,2048,128,8,2048,768,64,128,128,16,8,3,1243.468,3
w13,2048,128,8,2048,768,64,128,128,32,4,3,1244.0546666666667,3
w13,2048,128,8,2048,768,64,128,128,32,8,3,1240.2253333333333,3
w13,2048,128,8,2048,768,64,128,128,64,8,3,1242.8816666666667,3
w13,2048,128,8,4096,1536,32,64,128,32,4,4,4773.289,3
w13,2048,128,8,4096,1536,32,64,128,32,8,3,4778.910333333333,3
w13,2048,128,8,4096,1536,32,64,128,32,8,4,4774.227666666667,3
w13,2048,128,8,4096,1536,32,64,128,64,4,3,4763.848666666667,3
w13,2048,128,8,4096,1536,32,64,128,64,4,4,4754.057,3
w13,2048,128,8,4096,1536,32,64,128,64,8,3,4760.627333333333,3
w13,2048,128,8,4096,1536,32,64,128,64,8,4,4756.8623333333335,3
w13,2048,128,8,4096,1536,32,64,256,8,4,3,4778.131666666667,3
w13,2048,128,8,4096,1536,32,64,256,8,8,3,4768.915666666667,3
w13,2048,128,8,4096,1536,32,64,256,16,4,3,4766.793000000001,3
w13,2048,128,8,4096,1536,32,64,256,16,8,2,4778.707666666666,3
w13,2048,128,8,4096,1536,32,64,256,16,8,3,4756.8836666666675,3
w13,2048,128,8,4096,1536,32,64,256,32,4,2,4775.987,3
w13,2048,128,8,4096,1536,32,64,256,32,4,3,4759.688999999999,3
w13,2048,128,8,4096,1536,32,64,256,32,8,2,4766.291666666667,3
w13,2048,128,8,4096,1536,32,64,256,32,8,3,4751.55,3
w13,2048,128,8,4096,1536,32,64,256,64,4,2,4754.899,3
w13,2048,128,8,4096,1536,32,64,256,64,4,3,4745.374333333333,3
w13,2048,128,8,4096,1536,32,64,256,64,8,2,4749.043333333334,3
w13,2048,128,8,4096,1536,32,64,256,64,8,3,4734.195333333333,3
w13,2048,128,8,4096,1536,32,128,128,64,4,2,4779.549333333333,3
w13,2048,128,8,4096,1536,32,128,128,64,4,3,4767.229333333333,3
w13,2048,128,8,4096,1536,32,128,128,64,8,2,4777.181333333333,3
w13,2048,128,8,4096,1536,32,128,128,64,8,3,4761.906666666667,3
w13,2048,128,8,4096,1536,64,32,128,16,4,3,4773.5976666666675,3
w13,2048,128,8,4096,1536,64,32,128,16,4,4,4771.208,3
w13,2048,128,8,4096,1536,64,32,128,16,8,3,4770.984,3
w13,2048,128,8,4096,1536,64,32,128,16,8,4,4768.242666666667,3
w13,2048,128,8,4096,1536,64,64,128,8,8,4,4781.533,3
w13,2048,128,8,4096,1536,64,64,128,16,4,4,4777.3623333333335,3
w13,2048,128,8,4096,1536,64,64,128,16,8,3,4781.959666666667,3
w13,2048,128,8,4096,1536,64,64,128,16,8,4,4774.194,3
w13,2048,128,8,4096,1536,64,64,128,32,4,3,4781.256,3
w13,2048,128,8,4096,1536,64,64,128,32,4,4,4766.471333333334,3
w13,2048,128,8,4096,1536,64,64,128,32,8,3,4766.664,3
w13,2048,128,8,4096,1536,64,64,128,32,8,4,4762.599333333334,3
w13,2048,128,8,4096,1536,64,64,128,64,8,4,4780.605,3
w13,2048,128,8,4096,1536,64,128,128,1,8,3,4780.743333333333,3
w13,2048,128,8,4096,1536,64,128,128,16,4,3,4777.138,3
w13,2048,128,8,4096,1536,64,128,128,16,8,3,4764.370333333333,3
w13,2048,128,8,4096,1536,64,128,128,32,4,3,4769.564666666666,3
w13,2048,128,8,4096,1536,64,128,128,32,8,3,4763.997,3
w13,2048,128,8,4096,1536,64,128,128,64,4,3,4770.631333333334,3
w13,2048,128,8,4096,1536,64,128,128,64,8,3,4765.0633333333335,3
w13,2048,128,8,4096,3072,32,64,128,16,4,4,9487.592333333334,3
w13,2048,128,8,4096,3072,32,64,128,16,8,4,9494.344666666666,3
w13,2048,128,8,4096,3072,32,64,128,32,4,3,9475.069666666666,3
w13,2048,128,8,4096,3072,32,64,128,32,4,4,9445.405666666666,3
w13,2048,128,8,4096,3072,32,64,128,32,8,3,9462.824,3
w13,2048,128,8,4096,3072,32,64,128,32,8,4,9449.917333333333,3
w13,2048,128,8,4096,3072,32,64,128,64,4,4,9488.744666666667,3
w13,2048,128,8,4096,3072,32,64,128,64,8,3,9500.574,3
w13,2048,128,8,4096,3072,32,64,128,64,8,4,9492.712666666666,3
w13,2048,128,8,4096,3072,32,64,256,8,4,3,9471.358,3
w13,2048,128,8,4096,3072,32,64,256,8,8,3,9454.12,3
w13,2048,128,8,4096,3072,32,64,256,16,4,2,9489.405666666666,3
w13,2048,128,8,4096,3072,32,64,256,16,4,3,9454.909333333333,3
w13,2048,128,8,4096,3072,32,64,256,16,8,2,9480.509666666667,3
w13,2048,128,8,4096,3072,32,64,256,16,8,3,9439.666333333334,3
w13,2048,128,8,4096,3072,32,64,256,32,4,2,9439.645,3
w13,2048,128,8,4096,3072,32,64,256,32,4,3,9413.757,3
w13,2048,128,8,4096,3072,32,64,256,32,8,2,9436.669,3
w13,2048,128,8,4096,3072,32,64,256,32,8,3,9405.65,3
w13,2048,128,8,4096,3072,32,64,256,64,4,2,9482.355000000001,3
w13,2048,128,8,4096,3072,32,64,256,64,4,3,9464.413666666667,3
w13,2048,128,8,4096,3072,32,64,256,64,8,2,9481.682666666668,3
w13,2048,128,8,4096,3072,32,64,256,64,8,3,9446.226333333334,3
w13,2048,128,8,4096,3072,32,128,128,32,4,3,9490.355333333333,3
w13,2048,128,8,4096,3072,32,128,128,32,8,3,9481.789666666666,3
w13,2048,128,8,4096,3072,32,128,128,64,4,3,9498.152333333333,3
w13,2048,128,8,4096,3072,32,128,128,64,8,3,9486.504333333332,3
w13,2048,128,8,4096,3072,64,32,128,16,4,3,9456.231666666667,3
w13,2048,128,8,4096,3072,64,32,128,16,4,4,9445.202,3
w13,2048,128,8,4096,3072,64,32,128,16,8,3,9448.487000000001,3
w13,2048,128,8,4096,3072,64,32,128,16,8,4,9447.783333333333,3
w13,2048,128,8,4096,3072,64,64,128,8,8,4,9497.170333333333,3
w13,2048,128,8,4096,3072,64,64,128,16,4,4,9470.482333333333,3
w13,2048,128,8,4096,3072,64,64,128,16,8,3,9477.063666666667,3
w13,2048,128,8,4096,3072,64,64,128,16,8,4,9468.572333333334,3
w13,2048,128,8,4096,3072,64,128,128,16,4,3,9496.605000000001,3
w13,2048,128,8,4096,3072,64,128,128,16,8,3,9485.799666666666,3
w13,2048,128,8,4096,3072,64,128,128,32,8,3,9491.047333333334,3
w13,2048,128,8,4096,3072,64,128,128,64,8,3,9493.223333333333,3
w13,3072,8,2,1024,512,64,64,64,1,4,3,92.301,3
w13,3072,8,2,1024,512,64,64,64,16,4,3,91.84233333333333,3
w13,3072,8,2,1024,512,64,64,64,32,4,3,91.63933333333334,3
w13,3072,8,2,1024,512,64,64,64,64,4,3,91.47933333333333,3
w13,3072,8,2,1024,512,64,128,32,8,8,3,92.11966666666667,3
w13,3072,16,2,1536,768,64,128,64,1,8,3,205.101,3
w13,3072,16,2,1536,768,64,128,64,4,8,3,204.2586666666667,3
w13,3072,16,2,1536,768,64,128,64,16,8,3,204.46133333333333,3
w13,3072,16,2,1536,768,64,128,64,32,8,3,205.84799999999998,3
w13,3072,16,2,1536,768,64,128,64,64,8,3,204.09866666666667,3
w13,3072,16,4,1536,1024,64,128,64,1,4,3,496.00399999999996,3
w13,3072,16,4,1536,1024,64,128,64,1,8,3,494.47866666666664,3
w13,3072,16,4,1536,1024,64,128,64,4,4,3,496.73966666666666,3
w13,3072,16,4,1536,1024,64,128,64,4,8,3,494.8196666666667,3
w13,3072,16,4,1536,1024,64,128,64,16,4,3,497.39033333333333,3
w13,3072,16,4,1536,1024,64,128,64,16,8,3,495.3,3
w13,3072,16,4,1536,1024,64,128,64,32,8,3,495.38533333333334,3
w13,3072,16,4,1536,1024,64,128,64,64,4,3,497.4653333333333,3
w13,3072,16,4,1536,1024,64,128,64,64,8,3,494.38266666666664,3
w13,3072,16,4,1536,1024,64,256,32,8,4,3,493.85999999999996,3
w13,3072,16,4,1536,1024,64,256,32,32,4,3,492.61133333333333,3
w13,3072,16,4,1536,1024,128,128,64,1,4,2,493.37999999999994,3
w13,3072,16,4,1536,1024,128,128,64,4,4,2,493.3156666666667,3
w13,3072,16,4,1536,1024,128,128,64,8,4,2,494.201,3
w13,3072,16,4,1536,1024,128,128,64,16,4,2,495.4393333333333,3
w13,3072,16,4,1536,1024,128,128,64,32,4,2,495.4593333333333,3
w13,3072,16,4,1536,1024,128,128,64,64,4,2,495.04400000000004,3
w13,3072,32,4,2048,768,64,128,64,1,4,3,512.7303333333333,3
w13,3072,32,4,2048,768,64,128,64,1,8,3,511.866,3
w13,3072,32,4,2048,768,64,128,64,4,4,3,513.3380000000001,3
w13,3072,32,4,2048,768,64,128,64,4,8,3,511.5883333333333,3
w13,3072,32,4,2048,768,64,128,64,16,8,3,514.8203333333333,3
w13,3072,32,4,2048,768,64,128,64,32,8,3,514.4476666666666,3
w13,3072,32,4,2048,768,64,128,64,64,4,3,516.1536666666667,3
w13,3072,32,4,2048,768,64,128,64,64,8,3,513.53,3
w13,3072,32,6,3072,1024,64,128,64,1,4,3,1463.93,3
w13,3072,32,6,3072,1024,64,128,64,1,8,3,1460.0683333333334,3
w13,3072,32,6,3072,1024,64,128,64,4,4,3,1465.9246666666666,3
w13,3072,32,6,3072,1024,64,128,64,4,8,3,1463.7486666666666,3
w13,3072,32,6,3072,1024,64,128,64,16,4,3,1465.1029999999998,3
w13,3072,32,6,3072,1024,64,128,64,16,8,3,1461.2846666666667,3
w13,3072,32,6,3072,1024,64,128,64,32,4,3,1465.3163333333334,3
w13,3072,32,6,3072,1024,64,128,64,32,8,3,1461.477,3
w13,3072,32,6,3072,1024,64,128,64,64,4,3,1467.6526666666668,3
w13,3072,32,6,3072,1024,64,128,64,64,8,3,1464.2716666666668,3
w13,3072,60,4,2048,1408,64,128,128,1,4,2,1194.6263333333334,3
w13,3072,60,4,2048,1408,128,64,128,1,4,2,1183.5753333333334,3
w13,3072,60,4,2048,1408,128,64,128,16,4,2,1194.562,3
w13,3072,60,6,3584,2304,64,128,64,1,4,3,4040.3143333333333,3
w13,3072,60,6,3584,2304,64,128,64,4,4,3,4067.866666666667,3
w13,3072,60,6,3584,2304,64,128,64,64,4,3,4046.170333333333,3
w13,3072,60,8,2048,1536,64,128,64,1,4,3,2115.2916666666665,3
w13,3072,60,8,2048,1536,64,128,64,1,8,3,2109.7566666666667,3
w13,3072,60,8,2048,1536,64,128,64,4,4,3,2119.857666666667,3
w13,3072,60,8,2048,1536,64,128,64,4,8,3,2117.4363333333336,3
w13,3072,60,8,2048,1536,64,128,64,16,4,3,2119.527,3
w13,3072,60,8,2048,1536,64,128,64,16,8,3,2116.0496666666663,3
w13,3072,60,8,2048,1536,64,128,64,32,4,3,2119.8146666666667,3
w13,3072,60,8,2048,1536,64,128,64,32,8,3,2117.6283333333336,3
w13,3072,60,8,2048,1536,64,128,64,64,4,3,2122.1086666666665,3
w13,3072,60,8,2048,1536,64,128,64,64,8,3,2120.071,3
w13,3072,64,6,3072,2048,64,128,64,1,4,3,3240.5976666666666,3
w13,3072,64,6,3072,2048,64,128,64,1,8,3,3257.0236666666665,3
w13,3072,64,6,3072,2048,64,128,64,4,4,3,3271.370666666667,3
w13,3072,64,6,3072,2048,64,128,64,64,4,3,3245.9943333333335,3
w13,3072,64,6,3072,2048,64,128,64,64,8,3,3249.2160000000003,3
w13,3072,64,6,3584,1536,64,128,64,1,4,3,2852.5596666666665,3
w13,3072,64,6,3584,1536,64,128,64,1,8,3,2845.9893333333334,3
w13,3072,64,6,3584,1536,64,128,64,4,4,3,2860.143666666667,3
w13,3072,64,6,3584,1536,64,128,64,4,8,3,2858.672,3
w13,3072,64,6,3584,1536,64,128,64,16,4,3,2862.661,3
w13,3072,64,6,3584,1536,64,128,64,16,8,3,2861.914666666667,3
w13,3072,64,6,3584,1536,64,128,64,64,4,3,2844.474,3
w13,3072,64,6,3584,1536,64,128,64,64,8,3,2848.847,3
w13,3072,64,8,3584,2560,128,128,64,1,4,2,5652.906666666667,3
w13,3072,64,8,3584,2560,128,128,64,32,4,2,5686.7626666666665,3
w13,3072,64,8,3584,2560,128,128,64,64,4,2,5677.003,3
w13,3072,64,8,3584,2560,128,256,64,16,8,3,5704.278333333333,3
w13,3072,64,8,3584,2560,128,256,64,32,8,3,5670.22,3
w13,3072,64,8,3584,2560,128,256,64,64,8,3,5656.428666666667,3
w13,3072,128,4,2048,512,32,32,128,4,4,4,816.198,3
w13,3072,128,4,2048,512,32,32,128,4,8,4,817.1786666666667,3
w13,3072,128,4,2048,512,32,32,128,16,4,4,816.9976666666666,3
w13,3072,128,4,2048,512,32,32,128,16,8,4,817.2856666666667,3
w13,3072,128,4,2048,512,32,32,256,16,4,3,810.5970000000001,3
w13,3072,128,4,2048,512,32,32,256,16,4,4,811.7493333333333,3
w13,3072,128,4,2048,512,32,32,256,16,8,3,809.7016666666667,3
w13,3072,128,4,2048,512,32,32,256,16,8,4,810.437,3
w13,3072,128,4,2048,512,32,32,256,32,4,3,813.0086666666666,3
w13,3072,128,4,2048,512,32,32,256,32,4,4,813.221,3
w13,3072,128,4,2048,512,32,32,256,32,8,3,810.9066666666668,3
w13,3072,128,4,2048,512,32,32,256,32,8,4,812.0590000000001,3
w13,3072,128,4,2048,512,32,64,128,4,4,4,817.5413333333332,3
w13,3072,128,4,2048,512,32,64,128,4,8,4,817.0076666666668,3
w13,3072,128,4,2048,512,32,64,256,1,4,3,816.8693333333334,3
w13,3072,128,4,2048,512,32,64,256,1,8,3,812.8796666666667,3
w13,3072,128,4,2048,512,32,64,256,8,4,3,813.2746666666667,3
w13,3072,128,4,2048,512,32,64,256,8,8,3,810.4476666666666,3
w13,3072,128,4,2048,512,32,64,256,16,4,3,813.7333333333332,3
w13,3072,128,4,2048,512,32,64,256,16,8,3,810.8533333333334,3
w13,3072,128,4,2048,512,32,64,256,32,4,3,816.4960000000001,3
w13,3072,128,4,2048,512,32,64,256,32,8,3,813.9250000000001,3
w13,3072,128,4,2048,512,64,32,256,1,4,3,814.0423333333333,3
w13,3072,128,4,2048,512,64,32,256,1,8,3,811.6640000000001,3
w13,3072,128,6,4096,2048,32,64,128,1,4,2,6471.132999999999,3
w13,3072,128,6,4096,2048,32,64,128,1,8,2,6508.349333333333,3
w13,3072,128,6,4096,2048,32,64,128,4,4,2,6526.322666666667,3
w13,3072,128,6,4096,2048,32,128,128,1,4,2,6517.533,3
w13,3072,128,6,4096,2048,32,128,128,1,8,2,6499.260666666666,3
w13,3072,128,6,4096,2048,32,128,128,4,4,2,6499.004666666667,3
w13,3072,128,6,4096,2048,32,128,128,4,8,2,6485.415333333333,3
w13,3072,128,6,4096,2048,64,64,128,1,4,2,6468.763666666667,3
w13,3072,128,6,4096,2048,64,64,128,4,4,2,6498.684,3
w13,3072,128,6,4096,2048,64,128,128,1,4,2,6502.662333333334,3
w13,3072,128,6,4096,2048,64,128,128,1,8,2,6500.5289999999995,3
w13,3072,128,6,4096,2048,64,128,128,4,8,3,6519.548,3
w13,3072,128,8,2048,768,64,64,128,16,8,3,1322.7746666666665,3
w13,3072,128,8,2048,768,64,64,128,16,8,4,1311.009,3
w13,3072,128,8,2048,768,64,64,128,32,8,4,1311.595,3
w13,3072,128,8,2048,768,64,128,128,16,8,3,1314.753,3
w13,3072,128,8,2048,768,64,128,128,32,8,3,1317.8036666666667,3
w13,3072,128,8,4096,1536,64,64,128,1,4,2,4986.489666666667,3
w13,3072,128,8,4096,1536,64,64,128,4,4,2,5013.807666666667,3
w13,3072,128,8,4096,1536,64,128,128,1,4,2,5004.239333333334,3
w13,3072,128,8,4096,1536,64,128,128,1,4,3,4989.241666666666,3
w13,3072,128,8,4096,1536,64,128,128,1,8,2,5014.660333333333,3
w13,3072,128,8,4096,1536,64,128,128,1,8,3,4965.881333333334,3
w13,3072,128,8,4096,1536,64,128,128,4,8,3,4997.550666666667,3
w13,3072,128,8,4096,3072,64,128,128,1,8,3,9862.005666666666,3
w13,4096,8,2,1024,512,64,64,64,1,4,3,121.82666666666667,3
w13,4096,8,2,1024,512,64,64,64,4,4,3,121.87966666666667,3
w13,4096,8,2,1024,512,64,64,64,16,4,3,121.57033333333334,3
w13,4096,8,2,1024,512,64,64,64,32,4,3,122.05033333333334,3
w13,4096,8,2,1024,512,64,64,64,64,4,3,121.60233333333333,3
w13,4096,8,2,1024,512,64,128,32,8,8,3,121.20733333333334,3
w13,4096,8,2,1024,512,64,128,32,8,8,4,121.955,3
w13,4096,16,2,1536,768,64,128,64,1,4,3,255.768,3
w13,4096,16,2,1536,768,64,128,64,1,8,3,255.07500000000002,3
w13,4096,16,2,1536,768,64,128,64,4,4,3,256.62166666666667,3
w13,4096,16,2,1536,768,64,128,64,4,8,3,256.547,3
w13,4096,16,2,1536,768,64,128,64,16,4,3,255.48033333333333,3
w13,4096,16,2,1536,768,64,128,64,16,8,3,256.32300000000004,3
w13,4096,16,2,1536,768,64,128,64,32,4,3,255.26699999999997,3
w13,4096,16,2,1536,768,64,128,64,32,8,3,256.771,3
w13,4096,16,2,1536,768,64,128,64,64,4,3,255.41633333333334,3
w13,4096,16,2,1536,768,64,128,64,64,8,3,256.2803333333333,3
w13,4096,16,2,1536,768,128,64,64,16,8,3,256.22700000000003,3
w13,4096,16,4,1536,1024,64,128,64,1,4,3,650.3513333333334,3
w13,4096,16,4,1536,1024,64,128,64,1,8,3,647.6850000000001,3
w13,4096,16,4,1536,1024,64,128,64,4,4,3,652.357,3
w13,4096,16,4,1536,1024,64,128,64,4,8,3,650.4153333333334,3
w13,4096,16,4,1536,1024,64,128,64,16,4,3,652.2716666666666,3
w13,4096,16,4,1536,1024,64,128,64,16,8,3,650.3836666666667,3
w13,4096,16,4,1536,1024,64,128,64,32,4,3,652.997,3
w13,4096,16,4,1536,1024,64,128,64,32,8,3,650.6186666666666,3
w13,4096,16,4,1536,1024,64,128,64,64,4,3,653.3273333333333,3
w13,4096,16,4,1536,1024,64,128,64,64,8,3,650.9916666666667,3
w13,4096,32,4,2048,768,64,128,64,1,4,3,659.7706666666667,3
w13,4096,32,4,2048,768,64,128,64,1,8,3,658.7253333333333,3
w13,4096,32,4,2048,768,64,128,64,4,4,3,660.5070000000001,3
w13,4096,32,4,2048,768,64,128,64,4,8,3,659.355,3
w13,4096,32,4,2048,768,64,128,64,16,4,3,659.515,3
w13,4096,32,4,2048,768,64,128,64,16,8,3,658.8316666666666,3
w13,4096,32,4,2048,768,64,128,64,32,4,3,658.598,3
w13,4096,32,4,2048,768,64,128,64,32,8,3,658.0956666666666,3
w13,4096,32,4,2048,768,64,128,64,64,4,3,659.5256666666667,3
w13,4096,32,4,2048,768,64,128,64,64,8,3,658.5446666666667,3
w13,4096,32,4,2048,768,128,64,64,16,8,3,663.5576666666666,3
w13,4096,32,4,2048,768,128,128,64,1,4,2,659.611,3
w13,4096,32,4,2048,768,128,128,64,4,4,2,659.8456666666667,3
w13,4096,32,4,2048,768,128,128,64,8,4,2,660.4,3
w13,4096,32,4,2048,768,128,128,64,16,4,2,660.0913333333333,3
w13,4096,32,4,2048,768,128,128,64,32,4,2,659.7283333333334,3
w13,4096,32,4,2048,768,128,128,64,64,4,2,661.9893333333333,3
w13,4096,32,6,3072,1024,64,128,64,4,8,3,1930.89,3
w13,4096,32,6,3072,1024,64,256,32,8,4,3,1921.684,3
w13,4096,32,6,3072,1024,64,256,32,32,4,3,1921.1509999999998,3
w13,4096,32,6,3072,1024,128,128,64,1,4,2,1912.991,3
w13,4096,32,6,3072,1024,128,128,64,4,4,2,1911.6573333333333,3
w13,4096,32,6,3072,1024,128,128,64,8,4,2,1915.3590000000002,3
w13,4096,32,6,3072,1024,128,128,64,16,4,2,1917.0333333333335,3
w13,4096,32,6,3072,1024,128,128,64,32,4,2,1919.2413333333334,3
w13,4096,32,6,3072,1024,128,128,64,64,4,2,1919.796,3
w13,4096,32,6,3072,1024,128,256,64,1,8,3,1917.492,3
w13,4096,32,6,3072,1024,128,256,64,16,8,3,1922.1533333333334,3
w13,4096,32,6,3072,1024,128,256,64,32,8,3,1922.58,3
w13,4096,32,6,3072,1024,128,256,64,64,8,3,1922.1426666666666,3
w13,4096,32,6,3072,1024,256,128,64,1,8,2,1923.54,3
w13,4096,32,6,3072,1024,256,128,64,1,8,3,1912.1476666666667,3
w13,4096,60,4,2048,1408,64,128,64,1,4,3,1403.95,3
w13,4096,60,4,2048,1408,64,128,64,1,8,3,1401.764,3
w13,4096,60,4,2048,1408,64,128,64,4,4,3,1412.5266666666666,3
w13,4096,60,4,2048,1408,64,128,64,4,8,3,1410.671,3
w13,4096,60,4,2048,1408,64,128,64,16,8,3,1415.3,3
w13,4096,60,4,2048,1408,64,128,64,32,4,3,1414.5643333333335,3
w13,4096,60,4,2048,1408,64,128,64,32,8,3,1410.2120000000002,3
w13,4096,60,4,2048,1408,64,128,64,64,4,3,1414.575,3
w13,4096,60,4,2048,1408,64,128,64,64,8,3,1411.0546666666667,3
w13,4096,60,6,3584,2304,64,128,64,1,4,3,5578.551333333334,3
w13,4096,60,6,3584,2304,64,128,64,1,8,3,5567.564666666666,3
w13,4096,60,6,3584,2304,64,128,64,4,4,3,5568.748333333333,3
w13,4096,60,6,3584,2304,64,128,64,4,8,3,5597.41,3
w13,4096,60,6,3584,2304,64,128,64,16,4,3,5608.258333333334,3
w13,4096,60,6,3584,2304,64,128,64,32,4,3,5598.007333333332,3
w13,4096,60,6,3584,2304,64,128,64,64,4,3,5583.671333333333,3
w13,4096,60,6,3584,2304,64,256,64,4,4,2,5563.883666666666,3
w13,4096,60,6,3584,2304,64,256,64,8,4,2,5576.876333333334,3
w13,4096,60,6,3584,2304,64,256,64,32,4,2,5612.076333333333,3
w13,4096,60,6,3584,2304,64,256,64,64,4,2,5596.577666666667,3
w13,4096,60,8,2048,1536,64,128,64,1,4,3,2712.416333333333,3
w13,4096,60,8,2048,1536,64,128,64,1,8,3,2704.8853333333336,3
w13,4096,60,8,2048,1536,64,128,64,4,4,3,2718.1330000000003,3
w13,4096,60,8,2048,1536,64,128,64,4,8,3,2715.392,3
w13,4096,60,8,2048,1536,64,128,64,16,4,3,2718.3463333333334,3
w13,4096,60,8,2048,1536,64,128,64,16,8,3,2711.349333333333,3
w13,4096,60,8,2048,1536,64,128,64,32,4,3,2718.5806666666667,3
w13,4096,60,8,2048,1536,64,128,64,32,8,3,2715.4773333333333,3
w13,4096,60,8,2048,1536,64,128,64,64,4,3,2724.0099999999998,3
w13,4096,60,8,2048,1536,64,128,64,64,8,3,2718.9966666666664,3
w13,4096,60,8,2048,1536,64,256,32,8,4,3,2698.6553333333336,3
w13,4096,60,8,2048,1536,64,256,32,32,4,3,2702.837,3
w13,4096,60,8,2048,1536,64,256,64,4,4,2,2713.024,3
w13,4096,60,8,2048,1536,64,256,64,8,4,2,2710.3676666666665,3
w13,4096,60,8,2048,1536,64,256,64,16,4,2,2709.0983333333334,3
w13,4096,60,8,2048,1536,64,256,64,32,4,2,2707.637,3
w13,4096,60,8,2048,1536,64,256,64,64,4,2,2710.8160000000003,3
w13,4096,64,6,3072,2048,128,128,64,1,4,2,3855.609,3
w13,4096,64,6,3072,2048,128,256,64,1,8,3,3843.578,3
w13,4096,64,6,3072,2048,128,256,64,16,8,3,3833.6576666666665,3
w13,4096,64,6,3072,2048,128,256,64,32,8,3,3832.0586666666663,3
w13,4096,64,6,3072,2048,128,256,64,64,8,3,3835.333,3
w13,4096,64,6,3584,1536,64,128,64,1,4,3,3406.527666666667,3
w13,4096,64,6,3584,1536,64,128,64,1,8,3,3421.354,3
w13,4096,64,6,3584,1536,64,128,64,4,4,3,3409.376,3
w13,4096,64,6,3584,1536,64,128,64,16,4,3,3411.6156666666666,3
w13,4096,64,6,3584,1536,64,128,64,32,4,3,3421.1409999999996,3
w13,4096,64,6,3584,1536,64,128,64,64,4,3,3424.064,3
w13,4096,64,6,3584,1536,128,128,64,1,4,2,3393.3969999999995,3
w13,4096,64,6,3584,1536,128,128,64,4,4,2,3390.0156666666667,3
w13,4096,64,6,3584,1536,128,128,64,8,4,2,3409.8770000000004,3
w13,4096,64,6,3584,1536,128,128,64,32,4,2,3406.804666666667,3
w13,4096,64,6,3584,1536,128,128,64,64,4,2,3399.8393333333333,3
w13,4096,64,8,3584,2560,128,128,64,1,4,2,7390.308,3
w13,4096,64,8,3584,2560,128,128,64,8,4,2,7431.960666666667,3
w13,4096,64,8,3584,2560,128,128,64,16,4,2,7427.470333333334,3
w13,4096,64,8,3584,2560,128,128,64,64,4,2,7442.840666666666,3
w13,4096,64,8,3584,2560,128,256,64,32,8,3,7460.475333333333,3
w13,4096,64,8,3584,2560,128,256,64,64,8,3,7461.083333333333,3
w13,4096,64,8,3584,2560,256,128,64,1,8,3,7455.473333333332,3
w13,4096,128,4,2048,512,32,64,128,1,4,4,839.6206666666667,3
w13,4096,128,4,2048,512,32,64,128,1,8,4,838.7136666666667,3
w13,4096,128,4,2048,512,32,64,128,4,8,4,840.015,3
w13,4096,128,4,2048,512,32,64,256,1,8,3,839.7483333333333,3
w13,4096,128,4,2048,512,32,64,256,8,4,3,840.101,3
w13,4096,128,4,2048,512,32,64,256,8,8,3,834.8103333333333,3
w13,4096,128,4,2048,512,32,64,256,16,8,3,836.7509999999999,3
w13,4096,128,4,2048,512,32,64,256,32,8,3,839.183,3
w13,4096,128,4,2048,512,32,64,256,64,8,3,840.0576666666666,3
w13,4096,128,4,2048,512,64,32,128,1,8,4,838.4473333333334,3
w13,4096,128,4,2048,512,64,32,256,1,4,3,834.8633333333333,3
w13,4096,128,4,2048,512,64,32,256,1,8,2,840.2286666666668,3
