pipetuning_test/moe_dse/moe_dse_A100_top3.csv
weight_type,M,E,topk,H,N,BLOCK_SIZE_M,BLOCK_SIZE_N,BLOCK_SIZE_K,GROUP_SIZE_M,num_warps,num_stages,smem_size_KB,avg_duration,sample_count
w13,1,8,2,1024,512,16,64,64,64,4,3,32.0,7.330000000000001,3
w13,1,8,2,1024,512,16,64,64,64,4,4,42.0,7.361666666666667,3
w13,1,8,2,1024,512,16,64,64,64,4,5,52.0,7.372333333333334,3
w13,2,8,2,1024,512,16,64,128,1,8,4,82.0,8.545666666666667,3
w13,2,8,2,1024,512,16,64,128,1,8,3,62.0,8.61,3
w13,2,8,2,1024,512,16,64,128,1,8,5,102.0,8.706,3
w13,4,8,2,1024,512,16,128,64,1,4,4,76.0,10.732666666666669,3
w13,4,8,2,1024,512,16,128,64,1,4,5,94.0,10.796333333333331,3
w13,4,8,2,1024,512,16,128,64,1,4,3,58.0,10.967333333333334,3
w13,8,8,2,1024,512,16,128,64,64,4,4,76.0,9.271333333333333,3
w13,8,8,2,1024,512,16,128,64,64,4,5,94.0,9.293,3
w13,8,8,2,1024,512,16,128,64,32,4,5,94.0,9.367333333333333,3
w13,16,8,2,1024,512,16,128,64,1,4,4,76.0,10.807333333333332,3
w13,16,8,2,1024,512,16,128,64,1,4,5,94.0,10.882,3
w13,16,8,2,1024,512,16,128,64,1,4,3,58.0,10.999666666666664,3
w13,24,8,2,1024,512,16,128,64,1,4,4,76.0,9.623,3
w13,24,8,2,1024,512,16,128,64,1,4,5,94.0,9.687,3
w13,24,8,2,1024,512,16,128,64,1,4,3,58.0,9.794666666666666,3
w13,32,8,2,1024,512,16,128,64,1,4,4,76.0,8.823666666666666,3
w13,32,8,2,1024,512,16,128,64,1,4,5,94.0,8.887,3
w13,32,8,2,1024,512,16,128,64,1,4,3,58.0,9.026,3
w13,48,8,2,1024,512,16,128,64,1,4,4,76.0,8.855333333333332,3
w13,48,8,2,1024,512,16,128,64,1,4,5,94.0,8.982999999999999,3
w13,48,8,2,1024,512,16,128,64,1,4,3,58.0,9.100333333333332,3
w13,64,8,2,1024,512,16,128,64,1,4,4,76.0,9.516666666666667,3
w13,64,8,2,1024,512,16,128,64,1,4,5,94.0,9.623,3
w13,64,8,2,1024,512,16,128,64,1,4,3,58.0,9.868666666666668,3
w13,96,8,2,1024,512,32,128,64,1,4,4,88.0,12.727666666666666,3
w13,96,8,2,1024,512,32,128,64,1,4,3,68.0,12.77,3
w13,96,8,2,1024,512,32,128,64,1,4,5,108.0,12.844666666666669,3
w13,128,8,2,1024,512,32,128,64,1,4,3,68.0,12.876666666666663,3
w13,128,8,2,1024,512,32,128,64,1,4,4,88.0,12.919333333333332,3
w13,128,8,2,1024,512,32,128,64,1,4,5,108.0,13.005,3
w13,256,8,2,1024,512,64,128,128,1,8,3,160.0,17.718999999999998,3
w13,256,8,2,1024,512,64,64,64,1,4,3,56.0,17.826,3
w13,256,8,2,1024,512,64,128,64,1,4,3,88.0,17.847333333333335,3
w13,512,8,2,1024,512,64,64,64,1,4,3,56.0,20.215,3
w13,512,8,2,1024,512,64,64,64,16,4,3,56.0,20.354,3
w13,512,8,2,1024,512,64,64,64,4,4,3,56.0,20.45,3
w13,1024,8,2,1024,512,64,128,64,1,4,3,88.0,39.554,3
w13,1024,8,2,1024,512,64,128,32,8,4,4,64.0,39.778,3
w13,1024,8,2,1024,512,64,128,32,8,4,3,52.0,40.04433333333333,3
w13,1536,8,2,1024,512,128,256,64,64,8,3,208.0,41.80466666666667,3
w13,1536,8,2,1024,512,128,256,64,32,8,3,208.0,41.826,3
w13,1536,8,2,1024,512,128,256,64,16,8,3,208.0,41.91133333333333,3
w13,2048,8,2,1024,512,64,128,64,1,4,3,88.0,63.202,3
w13,2048,8,2,1024,512,64,128,32,8,4,4,64.0,63.37266666666667,3
w13,2048,8,2,1024,512,64,128,32,8,4,5,76.0,63.78866666666667,3
w13,3072,8,2,1024,512,128,256,64,1,8,3,208.0,76.88733333333334,3
w13,3072,8,2,1024,512,256,128,64,1,8,3,208.0,76.90866666666666,3
w13,3072,8,2,1024,512,256,128,64,1,8,4,256.0,78.31633333333333,3
w13,4096,8,2,1024,512,256,128,64,1,8,3,208.0,112.53533333333333,3
w13,4096,8,2,1024,512,128,256,64,16,8,3,208.0,114.22066666666666,3
w13,4096,8,2,1024,512,256,128,64,1,8,4,256.0,114.31666666666666,3
w13,1,16,2,1536,768,16,32,128,64,4,3,37.0,9.569666666666668,3
w13,1,16,2,1536,768,16,32,128,4,4,3,37.0,9.57,3
w13,1,16,2,1536,768,16,32,128,32,4,3,37.0,9.57,3
w13,2,16,2,1536,768,16,64,128,1,8,3,62.0,9.185666666666668,3
w13,2,16,2,1536,768,16,64,128,1,8,5,102.0,9.271333333333333,3
w13,2,16,2,1536,768,16,64,128,32,8,4,82.0,9.282,3
w13,4,16,2,1536,768,16,32,256,16,4,2,49.0,23.992,3
w13,4,16,2,1536,768,16,32,256,64,4,2,49.0,24.131333333333338,3
w13,4,16,2,1536,768,16,64,128,16,8,3,62.0,24.206,3
w13,8,16,2,1536,768,16,128,128,1,8,4,148.0,45.22966666666667,3
w13,8,16,2,1536,768,16,128,128,1,8,2,76.0,45.53866666666666,3
w13,8,16,2,1536,768,16,32,128,1,4,2,25.0,45.62433333333333,3
w13,16,16,2,1536,768,16,128,128,1,8,4,148.0,45.04733333333333,3
w13,16,16,2,1536,768,16,128,128,1,8,2,76.0,45.50566666666666,3
w13,16,16,2,1536,768,16,32,128,4,4,2,25.0,45.61266666666666,3
w13,24,16,2,1536,768,16,128,128,1,8,4,148.0,45.52733333333333,3
w13,24,16,2,1536,768,16,128,128,1,8,3,112.0,45.79366666666667,3
w13,24,16,2,1536,768,16,128,128,16,8,3,112.0,45.815333333333335,3
w13,32,16,2,1536,768,16,128,128,1,8,4,148.0,45.580666666666666,3
w13,32,16,2,1536,768,16,128,128,1,8,3,112.0,45.88999999999999,3
w13,32,16,2,1536,768,16,32,128,32,4,2,25.0,45.922,3
w13,48,16,2,1536,768,16,128,128,1,8,3,112.0,46.31666666666666,3
w13,48,16,2,1536,768,16,32,128,16,4,2,25.0,46.35933333333333,3
w13,48,16,2,1536,768,16,64,128,1,4,3,62.0,46.391333333333336,3
w13,64,16,2,1536,768,16,128,128,1,8,2,76.0,46.31666666666666,3
w13,64,16,2,1536,768,16,32,128,16,4,2,25.0,46.44466666666667,3
w13,64,16,2,1536,768,16,32,128,32,4,2,25.0,46.455000000000005,3
w13,96,16,2,1536,768,16,128,128,1,8,3,112.0,46.41266666666667,3
w13,96,16,2,1536,768,16,128,128,64,8,3,112.0,46.69,3
w13,96,16,2,1536,768,16,128,128,32,8,3,112.0,46.88233333333333,3
w13,128,16,2,1536,768,16,128,128,1,8,2,76.0,46.95633333333333,3
w13,128,16,2,1536,768,16,32,128,16,4,2,25.0,46.967000000000006,3
w13,128,16,2,1536,768,16,128,128,64,8,2,76.0,47.01,3
w13,256,16,2,1536,768,32,128,128,16,4,3,128.0,49.51666666666667,3
w13,256,16,2,1536,768,32,128,128,64,4,3,128.0,49.56999999999999,3
w13,256,16,2,1536,768,32,128,128,8,4,3,128.0,49.623,3
w13,512,16,2,1536,768,64,128,128,1,8,4,208.0,54.05,3
w13,512,16,2,1536,768,64,128,128,1,8,3,160.0,54.476333333333336,3
w13,512,16,2,1536,768,64,128,64,1,4,3,88.0,54.63666666666666,3
w13,1024,16,2,1536,768,128,256,64,1,8,3,208.0,66.96733333333333,3
w13,1024,16,2,1536,768,128,128,64,1,4,3,128.0,68.81266666666666,3
w13,1024,16,2,1536,768,128,256,64,16,8,3,208.0,68.92966666666668,3
w13,1536,16,2,1536,768,64,128,64,1,4,3,88.0,105.61233333333332,3
w13,1536,16,2,1536,768,64,128,64,16,4,3,88.0,106.62566666666667,3
w13,1536,16,2,1536,768,64,128,64,4,4,3,88.0,107.042,3
w13,2048,16,2,1536,768,256,128,64,1,8,3,208.0,109.05766666666666,3
w13,2048,16,2,1536,768,128,256,64,1,8,3,208.0,109.23933333333332,3
w13,2048,16,2,1536,768,128,256,64,1,8,4,256.0,110.32733333333331,3
w13,3072,16,2,1536,768,128,256,64,1,8,3,208.0,161.367,3
w13,3072,16,2,1536,768,128,256,64,1,8,4,256.0,162.89233333333334,3
w13,3072,16,2,1536,768,128,256,64,32,8,3,208.0,163.47933333333333,3
w13,4096,16,2,1536,768,64,128,64,1,4,3,88.0,204.51366666666664,3
w13,4096,16,2,1536,768,64,128,64,64,4,3,88.0,207.03100000000003,3
w13,4096,16,2,1536,768,64,128,64,32,4,3,88.0,207.671,3
w13,1,16,4,1536,1024,16,128,128,64,8,4,148.0,12.577999999999998,3
w13,1,16,4,1536,1024,16,128,128,64,8,5,184.0,12.748666666666663,3
w13,1,16,4,1536,1024,16,64,64,16,4,4,42.0,13.026000000000002,3
w13,2,16,4,1536,1024,16,32,128,4,4,2,25.0,33.48466666666667,3
w13,2,16,4,1536,1024,16,32,256,16,4,2,49.0,33.698,3
w13,2,16,4,1536,1024,16,32,128,32,4,3,37.0,33.708666666666666,3
w13,4,16,4,1536,1024,32,64,128,4,4,2,52.0,59.50066666666667,3
w13,4,16,4,1536,1024,32,64,128,32,4,2,52.0,60.24733333333333,3
w13,4,16,4,1536,1024,32,64,128,4,4,3,76.0,60.258,3
w13,8,16,4,1536,1024,16,64,128,32,4,2,42.0,60.364666666666665,3
w13,8,16,4,1536,1024,16,64,128,16,4,2,42.0,60.71733333333333,3
w13,8,16,4,1536,1024,16,64,128,64,4,2,42.0,60.845,3
w13,16,16,4,1536,1024,16,64,128,16,4,2,42.0,58.51933333333333,3
w13,16,16,4,1536,1024,16,64,128,1,8,2,42.0,58.818000000000005,3
w13,16,16,4,1536,1024,16,64,128,1,4,2,42.0,58.85,3
w13,24,16,4,1536,1024,16,64,128,16,4,2,42.0,59.54366666666667,3
w13,24,16,4,1536,1024,16,64,128,64,4,2,42.0,59.63966666666667,3
w13,24,16,4,1536,1024,16,64,128,1,8,2,42.0,59.682,3
w13,32,16,4,1536,1024,16,128,128,1,8,2,76.0,59.57533333333333,3
w13,32,16,4,1536,1024,16,64,128,1,4,2,42.0,59.618,3
w13,32,16,4,1536,1024,16,64,128,64,4,2,42.0,59.61833333333334,3
w13,48,16,4,1536,1024,16,64,128,32,4,2,42.0,59.714333333333336,3
w13,48,16,4,1536,1024,16,64,128,16,4,2,42.0,60.21533333333334,3
w13,48,16,4,1536,1024,16,128,128,16,8,2,76.0,60.27933333333333,3
w13,64,16,4,1536,1024,16,64,128,64,4,2,42.0,60.21533333333334,3
w13,64,16,4,1536,1024,16,128,128,1,8,2,76.0,60.26866666666666,3
w13,64,16,4,1536,1024,16,64,128,16,4,2,42.0,60.364666666666665,3
w13,96,16,4,1536,1024,32,64,128,64,4,2,52.0,62.071333333333335,3
w13,96,16,4,1536,1024,32,64,128,16,4,2,52.0,62.10333333333333,3
w13,96,16,4,1536,1024,32,64,128,4,4,2,52.0,62.754333333333335,3
w13,128,16,4,1536,1024,32,64,128,64,4,2,52.0,63.12733333333333,3
w13,128,16,4,1536,1024,32,64,128,32,4,2,52.0,63.50066666666667,3
w13,128,16,4,1536,1024,32,64,128,16,4,2,52.0,63.522,3
w13,256,16,4,1536,1024,64,64,64,1,4,4,72.0,73.101,3
w13,256,16,4,1536,1024,64,64,64,4,8,4,72.0,73.22866666666665,3
w13,256,16,4,1536,1024,64,64,64,1,8,4,72.0,73.37833333333333,3
w13,512,16,4,1536,1024,64,128,64,1,4,3,88.0,83.842,3
w13,512,16,4,1536,1024,64,128,64,4,4,3,88.0,84.91966666666667,3
w13,512,16,4,1536,1024,64,128,64,16,4,3,88.0,86.31700000000001,3
w13,1024,16,4,1536,1024,128,64,64,16,4,3,88.0,147.917,3
w13,1024,16,4,1536,1024,128,64,64,1,4,3,88.0,150.08233333333334,3
w13,1024,16,4,1536,1024,64,256,64,1,4,3,152.0,153.90099999999998,3
w13,1536,16,4,1536,1024,128,256,64,1,8,3,208.0,211.768,3
w13,1536,16,4,1536,1024,128,256,64,1,8,4,256.0,214.0716666666667,3
w13,1536,16,4,1536,1024,128,256,64,16,8,3,208.0,216.02366666666668,3
w13,2048,16,4,1536,1024,256,128,64,1,8,3,208.0,266.403,3
w13,2048,16,4,1536,1024,128,256,64,1,8,3,208.0,266.66966666666667,3
w13,2048,16,4,1536,1024,128,256,64,32,8,3,208.0,268.74933333333337,3
w13,3072,16,4,1536,1024,128,256,64,1,8,3,208.0,419.0216666666667,3
w13,3072,16,4,1536,1024,256,128,64,1,8,3,208.0,419.1496666666667,3
w13,3072,16,4,1536,1024,128,256,64,1,8,4,256.0,420.7176666666667,3
w13,4096,16,4,1536,1024,256,128,64,1,8,3,208.0,523.9499999999999,3
w13,4096,16,4,1536,1024,128,256,64,1,8,3,208.0,525.7420000000001,3
w13,4096,16,4,1536,1024,128,256,64,32,8,3,208.0,527.534,3
w13,1,32,4,2048,768,16,64,128,1,8,3,62.0,11.106,3
w13,1,32,4,2048,768,16,64,128,1,8,4,82.0,11.212666666666664,3
w13,1,32,4,2048,768,16,64,128,1,8,5,102.0,11.287333333333336,3
w13,2,32,4,2048,768,16,128,128,1,8,3,112.0,31.415000000000003,3
w13,2,32,4,2048,768,16,64,128,1,8,3,62.0,31.53233333333333,3
w13,2,32,4,2048,768,16,64,128,1,4,3,62.0,31.55433333333333,3
w13,4,32,4,2048,768,16,32,128,64,4,2,25.0,58.274,3
w13,4,32,4,2048,768,16,128,128,1,8,3,112.0,58.34866666666667,3
w13,4,32,4,2048,768,16,32,128,16,4,2,25.0,58.434,3
w13,8,32,4,2048,768,16,64,128,32,8,4,82.0,110.93566666666668,3
w13,8,32,4,2048,768,16,32,128,32,4,2,25.0,111.06366666666668,3
w13,8,32,4,2048,768,16,128,128,16,8,3,112.0,111.31933333333332,3
w13,16,32,4,2048,768,16,128,128,1,8,3,112.0,111.17066666666666,3
w13,16,32,4,2048,768,16,128,128,16,8,3,112.0,111.76733333333334,3
w13,16,32,4,2048,768,16,64,128,16,8,4,82.0,111.95933333333336,3
w13,24,32,4,2048,768,16,128,128,32,8,3,112.0,111.73566666666666,3
w13,24,32,4,2048,768,16,128,128,16,4,2,76.0,112.05533333333334,3
w13,24,32,4,2048,768,16,64,128,16,4,3,62.0,112.24766666666666,3
w13,32,32,4,2048,768,16,128,128,1,8,4,148.0,111.693,3
w13,32,32,4,2048,768,16,64,128,16,4,3,62.0,112.31133333333334,3
w13,32,32,4,2048,768,16,128,128,1,8,3,112.0,112.32266666666663,3
w13,48,32,4,2048,768,16,128,128,16,4,2,76.0,113.165,3
w13,48,32,4,2048,768,16,128,128,32,4,2,76.0,113.27166666666666,3
w13,48,32,4,2048,768,16,128,128,64,4,2,76.0,113.28233333333333,3
w13,64,32,4,2048,768,16,128,128,1,8,3,112.0,112.93066666666668,3
w13,64,32,4,2048,768,16,128,128,64,8,4,148.0,113.17566666666666,3
w13,64,32,4,2048,768,16,128,128,1,4,2,76.0,113.61333333333332,3
w13,96,32,4,2048,768,16,128,128,32,4,2,76.0,113.43133333333331,3
w13,96,32,4,2048,768,16,128,128,1,4,2,76.0,113.53833333333334,3
w13,96,32,4,2048,768,16,128,128,16,4,2,76.0,114.01833333333332,3
w13,128,32,4,2048,768,16,128,128,16,8,3,112.0,114.541,3
w13,128,32,4,2048,768,16,128,128,1,8,3,112.0,114.957,3
w13,128,32,4,2048,768,16,128,128,1,8,4,148.0,115.245,3
w13,256,32,4,2048,768,32,64,128,1,8,2,52.0,118.67933333333332,3
w13,256,32,4,2048,768,32,32,128,4,4,2,34.0,119.04233333333332,3
w13,256,32,4,2048,768,32,32,128,16,4,2,34.0,119.693,3
w13,512,32,4,2048,768,64,64,64,4,4,3,56.0,135.10633333333334,3
w13,512,32,4,2048,768,64,64,64,16,4,3,56.0,135.18066666666667,3
w13,512,32,4,2048,768,64,64,64,32,4,3,56.0,135.53300000000002,3
w13,1024,32,4,2048,768,128,256,64,1,8,3,208.0,155.917,3
w13,1024,32,4,2048,768,128,256,64,1,8,4,256.0,156.24766666666667,3
w13,1024,32,4,2048,768,128,256,64,16,8,4,256.0,157.59199999999998,3
w13,1536,32,4,2048,768,64,128,64,64,4,3,88.0,207.80033333333336,3
w13,1536,32,4,2048,768,64,128,64,32,4,3,88.0,209.251,3
w13,1536,32,4,2048,768,64,128,64,16,4,3,88.0,210.46666666666667,3
w13,2048,32,4,2048,768,128,256,64,1,8,3,208.0,272.6426666666666,3
w13,2048,32,4,2048,768,256,128,64,1,8,3,208.0,273.67766666666665,3
w13,2048,32,4,2048,768,128,256,64,1,8,4,256.0,274.49833333333333,3
w13,3072,32,4,2048,768,128,256,64,1,8,3,208.0,403.9176666666667,3
w13,3072,32,4,2048,768,128,256,64,1,8,4,256.0,406.638,3
w13,3072,32,4,2048,768,128,256,64,16,8,3,208.0,409.58166666666665,3
w13,4096,32,4,2048,768,128,256,64,1,8,3,208.0,535.3636666666666,3
w13,4096,32,4,2048,768,128,256,64,1,8,4,256.0,536.7923333333333,3
w13,4096,32,4,2048,768,256,128,64,1,8,3,208.0,536.899,3
w13,1,32,6,3072,1024,16,128,128,32,4,3,112.0,45.783,3
w13,1,32,6,3072,1024,16,64,64,1,4,5,52.0,46.082,3
w13,1,32,6,3072,1024,16,128,128,32,4,4,148.0,46.157,3
w13,2,32,6,3072,1024,16,128,128,1,8,3,112.0,85.474,3
w13,2,32,6,3072,1024,16,128,128,16,4,3,112.0,86.47666666666667,3
w13,2,32,6,3072,1024,16,64,128,16,4,3,62.0,86.498,3
w13,4,32,6,3072,1024,16,128,128,1,8,4,148.0,164.55700000000002,3
w13,4,32,6,3072,1024,16,128,128,16,4,3,112.0,165.741,3
w13,4,32,6,3072,1024,16,128,128,16,4,2,76.0,166.06066666666666,3
w13,8,32,6,3072,1024,16,128,128,64,8,4,148.0,219.298,3
w13,8,32,6,3072,1024,32,32,128,1,4,3,50.0,219.853,3
w13,8,32,6,3072,1024,32,32,128,16,8,3,50.0,221.389,3
w13,16,32,6,3072,1024,16,128,128,16,8,5,184.0,220.781,3
w13,16,32,6,3072,1024,16,128,128,64,8,5,184.0,222.13566666666668,3
w13,16,32,6,3072,1024,16,128,128,1,8,4,148.0,222.19933333333333,3
w13,24,32,6,3072,1024,16,128,128,64,8,5,184.0,222.125,3
w13,24,32,6,3072,1024,16,128,128,32,4,3,112.0,222.53066666666663,3
w13,24,32,6,3072,1024,16,128,128,16,8,5,184.0,222.59433333333337,3
w13,32,32,6,3072,1024,16,128,128,32,4,3,112.0,224.045,3
w13,32,32,6,3072,1024,16,128,128,1,4,3,112.0,224.09866666666667,3
w13,32,32,6,3072,1024,16,64,256,32,4,3,122.0,224.141,3
w13,48,32,6,3072,1024,16,128,128,1,4,3,112.0,225.101,3
w13,48,32,6,3072,1024,16,128,128,16,8,3,112.0,225.44233333333327,3
w13,48,32,6,3072,1024,16,128,128,32,8,3,112.0,225.46333333333337,3
w13,64,32,6,3072,1024,16,128,128,1,8,3,112.0,226.62633333333332,3
w13,64,32,6,3072,1024,16,128,128,32,4,3,112.0,226.89333333333337,3
w13,64,32,6,3072,1024,16,128,128,64,8,3,112.0,227.064,3
w13,96,32,6,3072,1024,32,32,256,4,4,2,66.0,230.36,3
w13,96,32,6,3072,1024,32,128,128,4,4,3,128.0,230.89333333333337,3
w13,96,32,6,3072,1024,32,32,256,1,4,2,66.0,231.021,3
w13,128,32,6,3072,1024,32,64,128,32,4,2,52.0,231.8213333333333,3
w13,128,32,6,3072,1024,32,64,128,64,4,2,52.0,232.05633333333333,3
w13,128,32,6,3072,1024,32,64,128,4,4,2,52.0,232.30133333333333,3
w13,256,32,6,3072,1024,64,128,128,1,8,3,160.0,237.698,3
w13,256,32,6,3072,1024,64,128,128,64,8,3,160.0,240.52533333333332,3
w13,256,32,6,3072,1024,64,128,128,16,8,3,160.0,240.867,3
w13,512,32,6,3072,1024,128,256,64,1,8,4,256.0,325.24,3
w13,512,32,6,3072,1024,128,256,64,16,8,4,256.0,329.763,3
w13,512,32,6,3072,1024,128,256,64,1,8,3,208.0,331.064,3
w13,1024,32,6,3072,1024,64,128,64,32,4,3,88.0,475.80033333333336,3
w13,1024,32,6,3072,1024,64,128,64,64,4,3,88.0,476.8676666666667,3
w13,1024,32,6,3072,1024,64,128,64,16,4,3,88.0,479.0323333333333,3
w13,1536,32,6,3072,1024,64,128,64,64,4,3,88.0,753.444,3
w13,1536,32,6,3072,1024,64,128,64,32,4,3,88.0,754.2973333333333,3
w13,1536,32,6,3072,1024,64,128,64,1,4,3,88.0,756.7726666666667,3
w13,2048,32,6,3072,1024,128,256,64,1,8,3,208.0,777.5616666666666,3
w13,2048,32,6,3072,1024,128,256,64,1,8,4,256.0,781.1356666666667,3
w13,2048,32,6,3072,1024,128,256,64,16,8,3,208.0,782.0949999999999,3
w13,3072,32,6,3072,1024,64,128,64,64,4,3,88.0,1144.2299999999998,3
w13,3072,32,6,3072,1024,64,128,64,1,4,3,88.0,1146.5766666666666,3
w13,3072,32,6,3072,1024,64,128,64,32,4,3,88.0,1147.2166666666667,3
w13,4096,32,6,3072,1024,128,256,64,1,8,3,208.0,1457.340333333333,3
w13,4096,32,6,3072,1024,256,128,64,1,8,3,208.0,1459.527,3
w13,4096,32,6,3072,1024,128,256,64,1,8,4,256.0,1460.3163333333334,3
w13,1,60,4,2048,1408,16,128,128,1,8,3,112.0,30.317,3
w13,1,60,4,2048,1408,16,64,128,1,8,3,62.0,30.796666666666667,3
w13,1,60,4,2048,1408,16,64,128,1,4,3,62.0,30.913666666666668,3
w13,2,60,4,2048,1408,16,32,128,32,4,2,25.0,53.954,3
w13,2,60,4,2048,1408,16,128,128,16,8,3,112.0,54.25300000000001,3
w13,2,60,4,2048,1408,16,128,128,32,8,3,112.0,54.39166666666667,3
w13,4,60,4,2048,1408,16,128,128,16,8,3,112.0,101.85833333333332,3
w13,4,60,4,2048,1408,16,128,128,16,4,2,76.0,102.03966666666668,3
w13,4,60,4,2048,1408,16,64,128,16,4,2,42.0,102.157,3
w13,8,60,4,2048,1408,16,64,128,1,4,5,102.0,201.986,3
w13,8,60,4,2048,1408,16,64,128,32,4,2,42.0,202.15766666666664,3
w13,8,60,4,2048,1408,16,64,128,1,8,3,62.0,202.77533333333332,3
w13,16,60,4,2048,1408,16,128,128,64,4,3,112.0,372.7816666666667,3
w13,16,60,4,2048,1408,16,128,128,32,4,3,112.0,373.2296666666667,3
w13,16,60,4,2048,1408,16,64,128,64,4,3,62.0,373.48566666666665,3
w13,24,60,4,2048,1408,16,128,128,16,4,3,112.0,373.4966666666666,3
w13,24,60,4,2048,1408,16,128,128,16,8,3,112.0,373.84833333333336,3
w13,24,60,4,2048,1408,16,64,128,16,8,3,62.0,373.912,3
w13,32,60,4,2048,1408,16,128,128,16,4,2,76.0,374.7656666666667,3
w13,32,60,4,2048,1408,16,128,128,64,8,3,112.0,375.1073333333334,3
w13,32,60,4,2048,1408,16,128,128,16,4,3,112.0,375.13933333333335,3
w13,48,60,4,2048,1408,16,128,128,16,4,3,112.0,376.7073333333333,3
w13,48,60,4,2048,1408,16,128,128,16,8,3,112.0,377.40066666666667,3
w13,48,60,4,2048,1408,16,128,128,32,4,3,112.0,377.731,3
w13,64,60,4,2048,1408,16,128,128,16,4,3,112.0,377.67800000000005,3
w13,64,60,4,2048,1408,16,128,128,32,4,3,112.0,379.235,3
w13,64,60,4,2048,1408,16,64,128,16,8,3,62.0,379.4483333333333,3
w13,96,60,4,2048,1408,16,128,128,1,8,3,112.0,381.11266666666666,3
w13,96,60,4,2048,1408,16,128,128,16,4,3,112.0,381.52833333333336,3
w13,96,60,4,2048,1408,16,128,128,16,8,3,112.0,382.03,3
w13,128,60,4,2048,1408,16,128,128,16,4,3,112.0,382.8296666666667,3
w13,128,60,4,2048,1408,16,128,128,16,8,3,112.0,384.867,3
w13,128,60,4,2048,1408,32,128,128,16,4,3,128.0,384.8776666666667,3
w13,256,60,4,2048,1408,32,128,128,16,8,3,128.0,403.80033333333336,3
w13,256,60,4,2048,1408,32,128,128,32,4,3,128.0,405.01666666666665,3
w13,256,60,4,2048,1408,32,128,128,1,8,3,128.0,405.62466666666666,3
w13,512,60,4,2048,1408,64,64,128,1,4,2,72.0,424.163,3
w13,512,60,4,2048,1408,64,64,64,1,4,3,56.0,424.3766666666667,3
w13,512,60,4,2048,1408,64,64,128,8,4,2,72.0,424.3973333333333,3
w13,1024,60,4,2048,1408,64,128,64,4,4,3,88.0,487.48066666666665,3
w13,1024,60,4,2048,1408,64,128,64,32,4,3,88.0,489.699,3
w13,1024,60,4,2048,1408,64,128,64,16,4,3,88.0,491.939,3
w13,1536,60,4,2048,1408,128,256,64,1,8,4,256.0,529.528,3
w13,1536,60,4,2048,1408,128,256,64,1,8,3,208.0,542.4133333333334,3
w13,1536,60,4,2048,1408,128,256,64,16,8,4,256.0,543.7046666666666,3
w13,2048,60,4,2048,1408,64,128,64,64,4,3,88.0,771.9926666666667,3
w13,2048,60,4,2048,1408,64,128,64,32,4,3,88.0,773.1873333333333,3
w13,2048,60,4,2048,1408,64,128,64,1,4,3,88.0,775.8216666666667,3
w13,3072,60,4,2048,1408,256,128,64,1,8,3,208.0,867.0536666666667,3
w13,3072,60,4,2048,1408,128,256,64,1,8,4,256.0,868.6536666666667,3
w13,3072,60,4,2048,1408,128,256,64,1,8,3,208.0,869.8906666666667,3
w13,4096,60,4,2048,1408,128,256,64,1,8,3,208.0,1261.7103333333334,3
w13,4096,60,4,2048,1408,128,256,64,1,8,4,256.0,1268.974333333333,3
w13,4096,60,4,2048,1408,128,256,64,32,8,3,208.0,1278.638333333333,3
w13,1,60,6,3584,2304,16,64,128,32,8,3,62.0,107.95933333333332,3
w13,1,60,6,3584,2304,16,128,128,64,8,3,112.0,108.546,3
w13,1,60,6,3584,2304,32,128,128,32,4,3,128.0,109.14333333333332,3
w13,2,60,6,3584,2304,16,64,128,64,4,3,62.0,215.106,3
w13,2,60,6,3584,2304,16,128,128,1,8,3,112.0,215.458,3
w13,2,60,6,3584,2304,16,64,128,16,4,5,102.0,215.661,3
w13,4,60,6,3584,2304,16,64,256,64,4,3,122.0,423.8636666666666,3
w13,4,60,6,3584,2304,16,64,256,32,4,3,122.0,424.3756666666666,3
w13,4,60,6,3584,2304,16,128,128,64,4,3,112.0,425.2823333333333,3
w13,8,60,6,3584,2304,16,128,128,1,4,3,112.0,842.4673333333334,3
w13,8,60,6,3584,2304,16,64,256,1,4,3,122.0,842.9899999999999,3
w13,8,60,6,3584,2304,16,64,256,16,4,3,122.0,843.3526666666667,3
w13,16,60,6,3584,2304,16,64,256,16,4,3,122.0,1053.6253333333334,3
w13,16,60,6,3584,2304,16,64,256,64,4,3,122.0,1054.8413333333335,3
w13,16,60,6,3584,2304,16,64,256,1,4,3,122.0,1056.047,3
w13,24,60,6,3584,2304,16,64,256,1,4,3,122.0,1055.7803333333334,3
w13,24,60,6,3584,2304,16,64,256,16,4,3,122.0,1055.9293333333333,3
w13,24,60,6,3584,2304,16,64,256,64,4,3,122.0,1057.637,3
w13,32,60,6,3584,2304,16,64,256,1,4,3,122.0,1060.4746666666667,3
w13,32,60,6,3584,2304,16,64,256,32,4,3,122.0,1060.8480000000002,3
w13,32,60,6,3584,2304,16,128,128,16,4,3,112.0,1062.107,3
w13,48,60,6,3584,2304,16,64,256,1,4,3,122.0,1066.693,3
w13,48,60,6,3584,2304,16,128,128,16,4,3,112.0,1066.6933333333334,3
w13,48,60,6,3584,2304,16,128,128,1,4,3,112.0,1067.814,3
w13,64,60,6,3584,2304,16,128,128,1,4,2,76.0,1070.4803333333332,3
w13,64,60,6,3584,2304,16,64,256,1,4,3,122.0,1070.907333333333,3
w13,64,60,6,3584,2304,16,128,128,16,4,2,76.0,1072.5283333333334,3
w13,96,60,6,3584,2304,16,128,128,1,4,3,112.0,1076.774,3
w13,96,60,6,3584,2304,16,128,128,1,4,2,76.0,1078.7896666666668,3
w13,96,60,6,3584,2304,16,128,128,16,4,2,76.0,1079.429666666667,3
w13,128,60,6,3584,2304,16,128,128,1,4,2,76.0,1082.3206666666667,3
w13,128,60,6,3584,2304,16,128,128,1,8,3,112.0,1085.553,3
w13,128,60,6,3584,2304,16,64,256,1,4,3,122.0,1087.782,3
w13,256,60,6,3584,2304,32,128,128,1,4,3,128.0,1114.1286666666667,3
w13,256,60,6,3584,2304,32,128,128,8,4,3,128.0,1114.8863333333331,3
w13,256,60,6,3584,2304,32,128,128,4,4,3,128.0,1115.1313333333335,3
w13,512,60,6,3584,2304,64,128,128,1,8,4,208.0,1185.575,3
w13,512,60,6,3584,2304,64,128,128,4,8,4,208.0,1188.9243333333334,3
w13,512,60,6,3584,2304,64,128,128,16,8,4,208.0,1203.9323333333334,3
w13,1024,60,6,3584,2304,128,256,64,1,8,3,208.0,1358.3429999999998,3
w13,1024,60,6,3584,2304,128,256,64,16,8,3,208.0,1377.1270000000002,3
w13,1024,60,6,3584,2304,128,256,64,1,8,4,256.0,1379.2493333333332,3
w13,1536,60,6,3584,2304,64,128,64,64,4,3,88.0,2158.1856666666667,3
w13,1536,60,6,3584,2304,64,128,64,32,4,3,88.0,2158.6873333333333,3
w13,1536,60,6,3584,2304,64,128,64,16,4,3,88.0,2180.607333333334,3
w13,2048,60,6,3584,2304,256,128,64,1,8,3,208.0,2247.369666666667,3
w13,2048,60,6,3584,2304,128,256,64,1,8,3,208.0,2250.3663333333334,3
w13,2048,60,6,3584,2304,128,256,64,1,8,4,256.0,2255.0606666666667,3
w13,3072,60,6,3584,2304,128,256,64,1,8,3,208.0,3357.921,3
w13,3072,60,6,3584,2304,128,256,64,1,8,4,256.0,3374.411666666667,3
w13,3072,60,6,3584,2304,128,256,64,32,8,3,208.0,3380.396,3
w13,4096,60,6,3584,2304,128,256,64,1,8,3,208.0,4476.868,3
w13,4096,60,6,3584,2304,128,256,64,1,8,4,256.0,4497.519,3
w13,4096,60,6,3584,2304,256,128,64,1,8,3,208.0,4497.775333333334,3
w13,1,60,8,2048,1536,16,64,256,32,4,2,82.0,60.02333333333333,3
w13,1,60,8,2048,1536,16,128,64,16,8,3,58.0,60.69566666666666,3
w13,1,60,8,2048,1536,16,128,128,1,8,2,76.0,60.74866666666667,3
w13,2,60,8,2048,1536,16,64,128,32,4,4,82.0,110.978,3
w13,2,60,8,2048,1536,16,64,128,64,8,4,82.0,110.98866666666667,3
w13,2,60,8,2048,1536,16,64,128,16,4,5,102.0,111.37333333333332,3
w13,4,60,8,2048,1536,16,128,128,32,8,3,112.0,219.533,3
w13,4,60,8,2048,1536,16,128,128,32,4,3,112.0,219.57533333333333,3
w13,4,60,8,2048,1536,16,128,128,16,8,3,112.0,219.62833333333333,3
w13,8,60,8,2048,1536,16,128,128,64,4,3,112.0,403.949,3
w13,8,60,8,2048,1536,16,128,128,16,4,3,112.0,404.482,3
w13,8,60,8,2048,1536,16,128,128,16,8,3,112.0,404.6846666666667,3
w13,16,60,8,2048,1536,16,128,128,32,4,3,112.0,405.0583333333333,3
w13,16,60,8,2048,1536,16,128,128,16,4,3,112.0,405.176,3
w13,16,60,8,2048,1536,16,128,128,32,8,3,112.0,405.8476666666667,3
w13,24,60,8,2048,1536,16,128,128,16,4,3,112.0,407.512,3
w13,24,60,8,2048,1536,16,128,128,16,4,2,76.0,407.92800000000005,3
w13,24,60,8,2048,1536,16,128,128,16,8,3,112.0,408.3756666666666,3
w13,32,60,8,2048,1536,16,128,128,32,4,3,112.0,408.163,3
w13,32,60,8,2048,1536,16,128,128,32,8,3,112.0,408.9523333333333,3
w13,32,60,8,2048,1536,16,128,128,16,4,3,112.0,410.349,3
w13,48,60,8,2048,1536,16,128,128,32,8,3,112.0,411.3203333333333,3
w13,48,60,8,2048,1536,16,128,128,16,4,3,112.0,411.779,3
w13,48,60,8,2048,1536,16,128,128,1,8,3,112.0,412.8776666666667,3
w13,64,60,8,2048,1536,16,128,128,32,8,3,112.0,414.051,3
w13,64,60,8,2048,1536,16,128,128,16,4,3,112.0,414.07233333333335,3
w13,64,60,8,2048,1536,16,128,128,32,4,3,112.0,414.4346666666667,3
w13,96,60,8,2048,1536,16,128,128,16,4,3,112.0,419.45866666666666,3
w13,96,60,8,2048,1536,16,128,128,32,8,3,112.0,419.7683333333334,3
w13,96,60,8,2048,1536,16,128,128,64,4,3,112.0,420.06666666666666,3
w13,128,60,8,2048,1536,32,128,128,32,8,3,128.0,437.43233333333336,3
w13,128,60,8,2048,1536,32,128,128,64,8,3,128.0,437.699,3
w13,128,60,8,2048,1536,32,128,128,16,4,3,128.0,437.795,3
w13,256,60,8,2048,1536,64,128,64,1,4,3,88.0,465.859,3
w13,256,60,8,2048,1536,64,64,64,4,4,5,88.0,466.2326666666666,3
w13,256,60,8,2048,1536,64,128,128,32,4,2,112.0,466.5846666666666,3
w13,512,60,8,2048,1536,128,256,64,1,8,3,208.0,539.2243333333333,3
w13,512,60,8,2048,1536,128,256,64,16,8,3,208.0,542.0083333333333,3
w13,512,60,8,2048,1536,32,256,64,1,8,3,124.0,542.8829999999999,3
w13,1024,60,8,2048,1536,64,128,64,64,4,3,88.0,837.9023333333333,3
w13,1024,60,8,2048,1536,64,128,64,1,4,3,88.0,839.8009999999999,3
w13,1024,60,8,2048,1536,64,128,64,32,4,3,88.0,842.4250000000001,3
w13,1536,60,8,2048,1536,128,256,64,1,8,3,208.0,934.8616666666668,3
w13,1536,60,8,2048,1536,128,256,64,1,8,4,256.0,935.9713333333334,3
w13,1536,60,8,2048,1536,256,128,64,1,8,3,208.0,936.068,3
w13,2048,60,8,2048,1536,128,256,64,1,8,3,208.0,1335.695333333333,3
w13,2048,60,8,2048,1536,128,256,64,1,8,4,256.0,1345.6899999999998,3
w13,2048,60,8,2048,1536,128,256,64,64,8,3,208.0,1352.645,3
w13,3072,60,8,2048,1536,128,256,64,1,8,3,208.0,1798.2233333333334,3
w13,3072,60,8,2048,1536,256,128,64,1,8,3,208.0,1802.181,3
w13,3072,60,8,2048,1536,128,256,64,1,8,4,256.0,1810.405,3
w13,4096,60,8,2048,1536,128,256,64,1,8,3,208.0,2260.112,3
w13,4096,60,8,2048,1536,128,256,64,1,8,4,256.0,2274.9176666666667,3
w13,4096,60,8,2048,1536,128,256,64,16,8,3,208.0,2288.9330000000004,3
w13,1,64,6,3072,2048,16,128,128,1,8,3,112.0,85.901,3
w13,1,64,6,3072,2048,16,128,128,64,8,3,112.0,86.06099999999999,3
w13,1,64,6,3072,2048,16,128,128,16,8,3,112.0,86.42399999999999,3
w13,2,64,6,3072,2048,32,128,128,64,8,2,88.0,166.11433333333332,3
w13,2,64,6,3072,2048,16,32,128,16,4,2,25.0,166.66933333333333,3
w13,2,64,6,3072,2048,16,32,256,64,4,3,73.0,166.68,3
w13,4,64,6,3072,2048,16,64,128,64,8,3,62.0,327.3736666666667,3
w13,4,64,6,3072,2048,16,128,128,16,8,3,112.0,327.8,3
w13,4,64,6,3072,2048,16,128,128,64,8,3,112.0,328.0133333333333,3
w13,8,64,6,3072,2048,16,64,256,16,4,3,122.0,644.0673333333334,3
w13,8,64,6,3072,2048,16,64,128,16,8,3,62.0,644.366,3
w13,8,64,6,3072,2048,16,64,256,16,4,2,82.0,645.5713333333333,3
w13,16,64,6,3072,2048,16,128,128,32,4,3,112.0,857.6573333333332,3
w13,16,64,6,3072,2048,16,128,128,16,4,2,76.0,858.7453333333333,3
w13,16,64,6,3072,2048,16,64,256,64,4,2,82.0,859.087,3
w13,24,64,6,3072,2048,16,64,256,32,4,3,122.0,860.111,3
w13,24,64,6,3072,2048,16,64,256,16,4,3,122.0,860.6446666666667,3
w13,24,64,6,3072,2048,16,128,128,32,4,3,112.0,860.9643333333333,3
w13,32,64,6,3072,2048,16,128,128,32,4,3,112.0,859.6743333333334,3
w13,32,64,6,3072,2048,16,128,128,32,8,3,112.0,860.6446666666667,3
w13,32,64,6,3072,2048,16,128,128,16,4,3,112.0,861.349,3
w13,48,64,6,3072,2048,16,128,128,16,8,3,112.0,864.8583333333332,3
w13,48,64,6,3072,2048,16,128,128,16,4,2,76.0,866.4796666666667,3
w13,48,64,6,3072,2048,16,128,128,1,8,3,112.0,866.5116666666667,3
w13,64,64,6,3072,2048,16,128,128,16,4,3,112.0,869.9676666666668,3
w13,64,64,6,3072,2048,16,128,128,32,8,3,112.0,871.0876666666667,3
w13,64,64,6,3072,2048,16,128,128,32,4,3,112.0,871.8773333333334,3
w13,96,64,6,3072,2048,16,128,128,16,4,2,76.0,873.616,3
w13,96,64,6,3072,2048,16,128,128,16,4,3,112.0,875.4503333333333,3
w13,96,64,6,3072,2048,16,128,128,32,4,2,76.0,877.755,3
w13,128,64,6,3072,2048,16,128,128,1,4,2,76.0,882.9596666666666,3
w13,128,64,6,3072,2048,16,128,128,16,4,2,76.0,883.8879999999999,3
w13,128,64,6,3072,2048,16,128,128,64,4,2,76.0,884.3893333333332,3
w13,256,64,6,3072,2048,32,128,128,1,4,3,128.0,903.7173333333334,3
w13,256,64,6,3072,2048,32,128,128,8,4,3,128.0,906.0636666666666,3
w13,256,64,6,3072,2048,32,128,128,4,4,3,128.0,906.2456666666668,3
w13,512,64,6,3072,2048,64,128,128,1,8,4,208.0,977.861,3
w13,512,64,6,3072,2048,64,128,128,4,8,4,208.0,980.3996666666668,3
w13,512,64,6,3072,2048,64,128,128,16,8,4,208.0,984.699,3
w13,1024,64,6,3072,2048,128,256,64,1,8,4,256.0,1128.0806666666667,3
w13,1024,64,6,3072,2048,128,256,64,1,8,3,208.0,1133.8193333333331,3
w13,1024,64,6,3072,2048,128,256,64,16,8,4,256.0,1134.8853333333334,3
w13,1536,64,6,3072,2048,64,128,64,32,4,3,88.0,1749.351,3
w13,1536,64,6,3072,2048,64,128,64,64,4,3,88.0,1749.5856666666666,3
w13,1536,64,6,3072,2048,64,128,64,16,4,3,88.0,1753.8313333333333,3
w13,2048,64,6,3072,2048,64,128,64,32,4,3,88.0,1813.0313333333336,3
w13,2048,64,6,3072,2048,64,128,64,64,4,3,88.0,1818.162,3
w13,2048,64,6,3072,2048,64,128,64,16,4,3,88.0,1834.8666666666668,3
w13,3072,64,6,3072,2048,128,256,64,1,8,3,208.0,2800.5533333333333,3
w13,3072,64,6,3072,2048,128,256,64,1,8,4,256.0,2812.489333333333,3
w13,3072,64,6,3072,2048,128,256,64,16,8,3,208.0,2817.7053333333333,3
w13,4096,64,6,3072,2048,128,256,64,1,8,3,208.0,2811.818,3
w13,4096,64,6,3072,2048,128,256,64,1,8,4,256.0,2824.2876666666666,3
w13,4096,64,6,3072,2048,128,256,64,16,8,3,208.0,2832.084666666667,3
w13,1,64,6,3584,1536,16,64,128,32,4,3,62.0,76.62066666666666,3
w13,1,64,6,3584,1536,16,32,128,1,4,5,61.0,76.69533333333334,3
w13,1,64,6,3584,1536,16,64,128,16,4,3,62.0,76.834,3
w13,2,64,6,3584,1536,16,32,128,1,4,4,49.0,144.21566666666666,3
w13,2,64,6,3584,1536,32,64,128,16,8,3,76.0,144.40733333333333,3
w13,2,64,6,3584,1536,16,64,128,1,4,4,82.0,145.06866666666667,3
w13,4,64,6,3584,1536,16,128,128,1,8,3,112.0,287.7146666666667,3
w13,4,64,6,3584,1536,16,64,256,1,4,2,82.0,287.8636666666667,3
w13,4,64,6,3584,1536,16,64,256,16,4,3,122.0,288.2373333333333,3
w13,8,64,6,3584,1536,16,64,256,1,4,3,122.0,563.0433333333334,3
w13,8,64,6,3584,1536,16,64,256,32,4,3,122.0,565.6030000000001,3
w13,8,64,6,3584,1536,16,64,256,16,4,3,122.0,566.0406666666667,3
w13,16,64,6,3584,1536,16,64,256,1,4,3,122.0,750.1266666666667,3
w13,16,64,6,3584,1536,16,64,256,16,4,3,122.0,753.5826666666667,3
w13,16,64,6,3584,1536,16,128,128,16,4,3,112.0,753.9446666666666,3
w13,24,64,6,3584,1536,16,64,256,1,4,3,122.0,754.4140000000001,3
w13,24,64,6,3584,1536,16,64,256,1,4,2,82.0,755.1933333333333,3
w13,24,64,6,3584,1536,16,128,128,1,4,3,112.0,755.534,3
w13,32,64,6,3584,1536,16,64,256,1,4,3,122.0,756.8783333333334,3
w13,32,64,6,3584,1536,16,64,256,1,4,5,202.0,757.156,3
w13,32,64,6,3584,1536,16,64,256,1,4,2,82.0,758.6383333333333,3
w13,48,64,6,3584,1536,16,128,128,1,4,3,112.0,760.4946666666666,3
w13,48,64,6,3584,1536,16,128,128,16,4,3,112.0,760.623,3
w13,48,64,6,3584,1536,16,64,256,1,4,3,122.0,760.708,3
w13,64,64,6,3584,1536,16,128,128,1,8,5,184.0,764.1963333333333,3
w13,64,64,6,3584,1536,16,64,256,1,4,3,122.0,764.4306666666666,3
w13,64,64,6,3584,1536,16,128,128,1,4,3,112.0,764.7193333333333,3
w13,96,64,6,3584,1536,16,128,128,32,4,3,112.0,765.957,3
w13,96,64,6,3584,1536,16,128,128,1,4,3,112.0,766.4050000000001,3
w13,96,64,6,3584,1536,16,64,256,1,4,3,122.0,767.94,3
w13,128,64,6,3584,1536,16,128,128,16,4,3,112.0,770.7033333333334,3
w13,128,64,6,3584,1536,16,128,128,1,8,3,112.0,773.765,3
w13,128,64,6,3584,1536,16,128,128,32,4,3,112.0,774.6610000000001,3
w13,256,64,6,3584,1536,32,128,128,8,4,3,128.0,793.1566666666668,3
w13,256,64,6,3584,1536,32,128,128,1,4,3,128.0,793.4666666666667,3
w13,256,64,6,3584,1536,32,128,128,4,4,3,128.0,794.3939999999999,3
w13,512,64,6,3584,1536,64,128,128,1,8,4,208.0,853.4663333333333,3
w13,512,64,6,3584,1536,64,128,128,4,8,4,208.0,862.5649999999999,3
w13,512,64,6,3584,1536,64,128,128,16,8,4,208.0,866.8316666666666,3
w13,1024,64,6,3584,1536,128,256,64,1,8,4,256.0,1019.8663333333334,3
w13,1024,64,6,3584,1536,128,256,64,16,8,4,256.0,1028.25,3
w13,1024,64,6,3584,1536,128,256,64,1,8,3,208.0,1030.149,3
w13,1536,64,6,3584,1536,64,128,64,64,4,3,88.0,1526.544666666667,3
w13,1536,64,6,3584,1536,64,128,64,32,4,3,88.0,1528.7423333333334,3
w13,1536,64,6,3584,1536,64,128,64,16,4,3,88.0,1538.406,3
w13,2048,64,6,3584,1536,64,256,64,1,4,3,152.0,1598.854,3
w13,2048,64,6,3584,1536,64,128,64,64,4,3,88.0,1600.5073333333332,3
w13,2048,64,6,3584,1536,64,128,64,32,4,3,88.0,1602.7686666666668,3
w13,3072,64,6,3584,1536,64,256,64,32,4,3,152.0,2171.047,3
w13,3072,64,6,3584,1536,64,256,64,64,4,3,152.0,2173.8103333333333,3
w13,3072,64,6,3584,1536,64,256,64,16,4,3,152.0,2176.145666666667,3
w13,4096,64,6,3584,1536,128,256,64,1,8,3,208.0,2461.9166666666665,3
w13,4096,64,6,3584,1536,128,256,64,1,8,4,256.0,2472.113666666666,3
w13,4096,64,6,3584,1536,128,256,64,16,8,3,208.0,2477.618,3
w13,1,64,8,3584,2560,16,128,128,64,8,2,76.0,160.64233333333334,3
w13,1,64,8,3584,2560,32,32,128,4,4,3,50.0,160.65333333333334,3
w13,1,64,8,3584,2560,16,128,128,32,8,3,112.0,161.07933333333332,3
w13,2,64,8,3584,2560,16,64,256,16,4,3,122.0,317.6236666666667,3
w13,2,64,8,3584,2560,16,128,128,1,8,3,112.0,317.96566666666666,3
w13,2,64,8,3584,2560,16,128,128,16,8,3,112.0,318.0083333333333,3
w13,4,64,8,3584,2560,16,64,256,64,4,3,122.0,627.0006666666667,3
w13,4,64,8,3584,2560,16,64,256,1,4,3,122.0,627.172,3
w13,4,64,8,3584,2560,16,64,256,16,4,3,122.0,627.8646666666667,3
w13,8,64,8,3584,2560,16,64,256,16,4,3,122.0,1243.0773333333334,3
w13,8,64,8,3584,2560,16,64,256,64,4,3,122.0,1243.0776666666668,3
w13,8,64,8,3584,2560,16,64,256,32,4,3,122.0,1244.1233333333332,3
w13,16,64,8,3584,2560,16,64,256,16,4,3,122.0,1247.271,3
w13,16,64,8,3584,2560,16,64,256,32,4,3,122.0,1247.7613333333334,3
w13,16,64,8,3584,2560,16,64,256,1,4,3,122.0,1249.095,3
w13,24,64,8,3584,2560,16,64,256,1,4,2,82.0,1253.725,3
w13,24,64,8,3584,2560,16,64,256,32,4,3,122.0,1254.749,3
w13,24,64,8,3584,2560,16,64,256,1,4,3,122.0,1255.0683333333334,3
w13,32,64,8,3584,2560,16,64,256,1,4,3,122.0,1256.8933333333332,3
w13,32,64,8,3584,2560,16,128,128,1,4,3,112.0,1258.557,3
w13,32,64,8,3584,2560,16,64,256,32,4,3,122.0,1260.061,3
w13,48,64,8,3584,2560,16,128,128,1,4,3,112.0,1264.5206666666666,3
w13,48,64,8,3584,2560,16,128,128,32,4,2,76.0,1265.1706666666666,3
w13,48,64,8,3584,2560,16,64,256,16,4,3,122.0,1266.4399999999998,3
w13,64,64,8,3584,2560,16,64,256,1,4,3,122.0,1271.9979999999998,3
w13,64,64,8,3584,2560,16,64,256,16,4,3,122.0,1273.7046666666663,3
w13,64,64,8,3584,2560,32,128,128,16,4,3,128.0,1273.8863333333334,3
w13,96,64,8,3584,2560,16,128,128,1,4,2,76.0,1277.929,3
w13,96,64,8,3584,2560,16,128,128,32,4,3,112.0,1281.4063333333334,3
w13,96,64,8,3584,2560,16,128,128,16,4,3,112.0,1281.663,3
w13,128,64,8,3584,2560,16,128,128,32,4,2,76.0,1293.2143333333331,3
w13,128,64,8,3584,2560,16,128,128,16,4,2,76.0,1293.545,3
w13,128,64,8,3584,2560,16,128,128,1,4,2,76.0,1294.527,3
w13,256,64,8,3584,2560,32,128,128,8,4,3,128.0,1329.7913333333331,3
w13,256,64,8,3584,2560,32,128,128,16,4,3,128.0,1331.8503333333335,3
w13,256,64,8,3584,2560,32,128,128,8,8,3,128.0,1332.8313333333333,3
w13,512,64,8,3584,2560,64,128,128,4,8,4,208.0,1411.6053333333332,3
w13,512,64,8,3584,2560,64,128,128,16,8,4,208.0,1413.6850000000002,3
w13,512,64,8,3584,2560,64,128,128,16,4,4,208.0,1423.8613333333333,3
w13,1024,64,8,3584,2560,128,256,64,1,8,3,208.0,1615.798,3
w13,1024,64,8,3584,2560,128,256,64,1,8,4,256.0,1620.79,3
w13,1024,64,8,3584,2560,128,256,64,16,8,3,208.0,1628.8223333333335,3
w13,1536,64,8,3584,2560,64,128,64,64,4,3,88.0,2638.459666666667,3
w13,1536,64,8,3584,2560,64,128,64,32,4,3,88.0,2638.993,3
w13,1536,64,8,3584,2560,64,128,64,16,4,3,88.0,2649.8836666666666,3
w13,2048,64,8,3584,2560,256,128,64,1,8,3,208.0,2715.0886666666665,3
w13,2048,64,8,3584,2560,128,256,64,32,8,3,208.0,2725.968666666666,3
w13,2048,64,8,3584,2560,128,256,64,16,8,3,208.0,2727.622,3
w13,3072,64,8,3584,2560,128,256,64,1,8,3,208.0,4061.836333333333,3
w13,3072,64,8,3584,2560,128,256,64,1,8,4,256.0,4070.8176666666654,3
w13,3072,64,8,3584,2560,128,256,64,16,8,3,208.0,4071.255,3
w13,4096,64,8,3584,2560,128,256,64,1,8,3,208.0,5397.565,3
w13,4096,64,8,3584,2560,256,128,64,1,8,3,208.0,5407.838,3
w13,4096,64,8,3584,2560,128,256,64,1,8,4,256.0,5409.202666666667,3
w13,1,128,4,2048,512,16,64,128,1,8,3,62.0,13.004666666666663,3
w13,1,128,4,2048,512,16,64,128,1,8,5,102.0,13.089999999999998,3
w13,1,128,4,2048,512,16,64,256,64,4,4,162.0,13.153666666666666,3
w13,2,128,4,2048,512,16,64,64,1,4,5,52.0,19.479666666666663,3
w13,2,128,4,2048,512,16,128,128,32,8,4,148.0,19.725,3
w13,2,128,4,2048,512,16,128,64,1,4,5,94.0,19.81,3
w13,4,128,4,2048,512,16,32,128,1,4,3,37.0,41.31433333333333,3
w13,4,128,4,2048,512,16,32,256,16,4,2,49.0,41.46333333333333,3
w13,4,128,4,2048,512,16,32,128,4,4,3,37.0,41.50666666666667,3
w13,8,128,4,2048,512,16,64,128,1,4,2,42.0,75.84233333333334,3
w13,8,128,4,2048,512,16,64,128,64,8,2,42.0,75.94866666666667,3
w13,8,128,4,2048,512,16,64,128,64,4,2,42.0,75.94933333333333,3
w13,16,128,4,2048,512,16,128,128,1,8,3,112.0,148.45066666666665,3
w13,16,128,4,2048,512,16,128,128,64,4,3,112.0,148.46099999999998,3
w13,16,128,4,2048,512,16,16,128,1,4,3,24.5,148.47233333333335,3
w13,24,128,4,2048,512,16,128,128,64,8,3,112.0,219.19233333333327,3
w13,24,128,4,2048,512,16,128,128,16,8,3,112.0,219.96033333333327,3
w13,24,128,4,2048,512,16,64,128,32,4,5,102.0,220.419,3
w13,32,128,4,2048,512,16,128,128,64,8,3,112.0,289.6886666666667,3
w13,32,128,4,2048,512,16,64,128,32,4,3,62.0,290.65933333333334,3
w13,32,128,4,2048,512,16,128,128,64,4,3,112.0,291.427,3
w13,48,128,4,2048,512,16,128,128,64,8,3,112.0,291.38466666666665,3
w13,48,128,4,2048,512,16,64,128,32,4,3,62.0,292.4406666666667,3
w13,48,128,4,2048,512,16,128,128,1,8,3,112.0,293.21933333333334,3
w13,64,128,4,2048,512,16,64,128,1,8,3,62.0,293.54966666666667,3
w13,64,128,4,2048,512,16,64,128,64,8,3,62.0,293.62433333333337,3
w13,64,128,4,2048,512,16,128,128,1,8,3,112.0,293.806,3
w13,96,128,4,2048,512,16,128,128,64,4,3,112.0,293.326,3
w13,96,128,4,2048,512,16,128,128,32,8,3,112.0,294.14733333333334,3
w13,96,128,4,2048,512,16,64,128,32,4,2,42.0,294.58466666666664,3
w13,128,128,4,2048,512,16,16,256,1,4,4,64.5,301.03833333333336,3
w13,128,128,4,2048,512,16,16,128,1,4,2,16.5,301.518,3
w13,128,128,4,2048,512,16,16,256,4,4,4,64.5,301.582,3
w13,256,128,4,2048,512,16,64,128,1,4,2,42.0,300.0673333333333,3
w13,256,128,4,2048,512,16,64,128,1,8,3,62.0,300.771,3
w13,256,128,4,2048,512,16,64,128,32,4,2,42.0,300.86733333333336,3
w13,512,128,4,2048,512,16,32,128,32,4,3,37.0,310.766,3
w13,512,128,4,2048,512,16,64,128,32,4,2,42.0,311.075,3
w13,512,128,4,2048,512,16,32,128,4,4,3,37.0,311.875,3
w13,1024,128,4,2048,512,32,128,128,1,8,3,128.0,320.6,3
w13,1024,128,4,2048,512,32,128,128,32,4,3,128.0,322.115,3
w13,1024,128,4,2048,512,32,128,128,4,4,3,128.0,322.3713333333333,3
w13,1536,128,4,2048,512,64,128,128,1,4,2,112.0,340.7923333333333,3
w13,1536,128,4,2048,512,64,128,128,32,4,2,112.0,341.5493333333334,3
w13,1536,128,4,2048,512,64,64,64,1,4,3,56.0,341.6673333333333,3
w13,2048,128,4,2048,512,64,128,128,4,4,2,112.0,345.763,3
w13,2048,128,4,2048,512,64,128,128,1,4,2,112.0,346.45633333333336,3
w13,2048,128,4,2048,512,64,128,128,32,4,2,112.0,346.4883333333334,3
w13,3072,128,4,2048,512,128,256,64,1,8,3,208.0,392.74966666666666,3
w13,3072,128,4,2048,512,128,256,64,32,8,3,208.0,407.4476666666667,3
w13,3072,128,4,2048,512,128,256,64,1,8,4,256.0,408.429,3
w13,4096,128,4,2048,512,128,256,64,1,8,3,208.0,403.042,3
w13,4096,128,4,2048,512,128,256,64,1,8,4,256.0,413.346,3
w13,4096,128,4,2048,512,128,256,64,64,8,3,208.0,432.365,3
w13,1,128,6,4096,2048,16,128,128,1,8,2,76.0,109.794,3
w13,1,128,6,4096,2048,16,64,128,1,4,2,42.0,109.89033333333332,3
w13,1,128,6,4096,2048,16,128,128,1,8,3,112.0,109.98633333333332,3
w13,2,128,6,4096,2048,16,128,128,1,8,5,184.0,219.89533333333333,3
w13,2,128,6,4096,2048,16,64,256,64,4,3,122.0,220.3753333333333,3
w13,2,128,6,4096,2048,16,128,128,32,4,3,112.0,220.3753333333333,3
w13,4,128,6,4096,2048,16,64,256,64,4,3,122.0,431.89633333333336,3
w13,4,128,6,4096,2048,16,64,256,32,4,2,82.0,432.0243333333333,3
w13,4,128,6,4096,2048,16,64,256,1,4,5,202.0,432.9203333333333,3
w13,8,128,6,4096,2048,16,64,256,64,4,3,122.0,853.476,3
w13,8,128,6,4096,2048,16,64,256,32,4,3,122.0,853.753,3
w13,8,128,6,4096,2048,16,64,256,1,4,3,122.0,853.9026666666667,3
w13,16,128,6,4096,2048,16,64,256,16,4,3,122.0,1695.943,3
w13,16,128,6,4096,2048,16,64,256,64,4,3,122.0,1696.6996666666666,3
w13,16,128,6,4096,2048,16,64,256,32,4,3,122.0,1697.2969999999998,3
w13,24,128,6,4096,2048,16,64,256,16,4,3,122.0,2261.141,3
w13,24,128,6,4096,2048,16,64,256,32,4,3,122.0,2261.557,3
w13,24,128,6,4096,2048,16,64,256,1,4,3,122.0,2261.802,3
w13,32,128,6,4096,2048,16,64,256,16,4,3,122.0,2260.5353333333333,3
w13,32,128,6,4096,2048,16,64,256,1,4,3,122.0,2263.8316666666665,3
w13,32,128,6,4096,2048,16,64,256,32,4,3,122.0,2264.8873333333336,3
w13,48,128,6,4096,2048,16,64,256,16,4,3,122.0,2272.75,3
w13,48,128,6,4096,2048,16,64,256,1,4,3,122.0,2273.517666666666,3
w13,48,128,6,4096,2048,16,64,256,32,4,3,122.0,2274.552333333333,3
w13,64,128,6,4096,2048,16,64,256,1,4,3,122.0,2277.742666666667,3
w13,64,128,6,4096,2048,16,64,256,16,4,3,122.0,2278.3610000000003,3
w13,64,128,6,4096,2048,16,64,256,1,4,5,202.0,2282.3506666666667,3
w13,96,128,6,4096,2048,16,64,256,1,4,3,122.0,2288.623333333333,3
w13,96,128,6,4096,2048,16,64,256,32,4,3,122.0,2291.364666666667,3
w13,96,128,6,4096,2048,16,64,256,16,4,3,122.0,2292.144,3
w13,128,128,6,4096,2048,16,64,256,1,4,3,122.0,2299.525333333333,3
w13,128,128,6,4096,2048,16,64,256,16,4,2,82.0,2304.72,3
w13,128,128,6,4096,2048,16,64,256,16,4,3,122.0,2304.965333333333,3
w13,256,128,6,4096,2048,16,64,256,1,4,3,122.0,2329.157333333333,3
w13,256,128,6,4096,2048,16,64,256,1,4,2,82.0,2335.4723333333336,3
w13,256,128,6,4096,2048,16,64,256,16,4,3,122.0,2339.8566666666666,3
w13,512,128,6,4096,2048,32,128,128,4,4,3,128.0,2415.2273333333333,3
w13,512,128,6,4096,2048,32,128,128,1,4,3,128.0,2415.430333333333,3
w13,512,128,6,4096,2048,32,128,128,4,4,5,208.0,2419.7286666666664,3
w13,1024,128,6,4096,2048,64,128,128,1,8,4,208.0,2533.3163333333337,3
w13,1024,128,6,4096,2048,64,128,128,4,8,4,208.0,2534.916,3
w13,1024,128,6,4096,2048,64,128,128,16,8,4,208.0,2552.462,3
w13,1536,128,6,4096,2048,128,256,64,1,8,3,208.0,2823.534,3
w13,1536,128,6,4096,2048,128,256,64,1,8,4,256.0,2854.7983333333336,3
w13,1536,128,6,4096,2048,128,256,64,16,8,3,208.0,2890.756,3
w13,2048,128,6,4096,2048,128,256,64,1,8,3,208.0,2849.090666666667,3
w13,2048,128,6,4096,2048,128,64,64,1,4,3,88.0,2886.1036666666664,3
w13,2048,128,6,4096,2048,128,256,64,16,8,3,208.0,2904.6536666666666,3
w13,3072,128,6,4096,2048,64,128,64,32,4,3,88.0,3875.429,3
w13,3072,128,6,4096,2048,64,128,64,16,4,3,88.0,3886.0533333333337,3
w13,3072,128,6,4096,2048,64,128,64,32,4,4,112.0,4070.2996666666654,3
w13,4096,128,6,4096,2048,64,256,64,8,4,3,152.0,4201.498,3
w13,4096,128,6,4096,2048,64,256,64,8,8,4,192.0,4561.136,3
w13,4096,128,6,4096,2048,64,256,64,8,8,5,232.0,4565.819,3
w13,1,128,8,2048,768,16,128,128,1,8,3,112.0,32.61000000000001,3
w13,1,128,8,2048,768,16,64,128,16,4,3,62.0,32.834,3
w13,1,128,8,2048,768,16,64,128,1,8,3,62.0,32.96233333333333,3
w13,2,128,8,2048,768,16,128,128,1,8,3,112.0,57.97533333333333,3
w13,2,128,8,2048,768,16,32,128,16,4,2,25.0,58.156666666666666,3
w13,2,128,8,2048,768,16,32,128,4,4,2,25.0,58.28466666666666,3
w13,4,128,8,2048,768,16,128,128,64,8,5,184.0,110.91466666666668,3
w13,4,128,8,2048,768,16,64,128,1,4,4,82.0,111.362,3
w13,4,128,8,2048,768,16,32,128,16,4,4,49.0,111.36266666666666,3
w13,8,128,8,2048,768,16,128,128,32,8,3,112.0,218.563,3
w13,8,128,8,2048,768,16,64,128,16,4,3,62.0,218.60566666666668,3
w13,8,128,8,2048,768,16,128,128,32,4,2,76.0,218.79733333333337,3
w13,16,128,8,2048,768,16,128,128,32,8,3,112.0,430.00933333333336,3
w13,16,128,8,2048,768,16,64,128,64,4,5,102.0,430.16833333333335,3
w13,16,128,8,2048,768,16,64,256,32,4,3,122.0,430.809,3
w13,24,128,8,2048,768,16,128,128,64,8,3,112.0,430.499,3
w13,24,128,8,2048,768,16,128,128,32,4,3,112.0,430.9906666666666,3
w13,24,128,8,2048,768,16,128,128,64,4,3,112.0,431.588,3
w13,32,128,8,2048,768,16,128,128,32,4,3,112.0,432.7716666666667,3
w13,32,128,8,2048,768,16,128,128,64,4,2,76.0,433.1123333333333,3
w13,32,128,8,2048,768,16,128,128,64,4,3,112.0,433.1553333333333,3
w13,48,128,8,2048,768,16,128,128,32,4,3,112.0,433.4646666666667,3
w13,48,128,8,2048,768,16,128,128,32,4,2,76.0,434.6493333333333,3
w13,48,128,8,2048,768,16,128,128,64,4,2,76.0,435.2143333333333,3
w13,64,128,8,2048,768,16,128,128,32,8,3,112.0,435.619,3
w13,64,128,8,2048,768,16,128,128,64,4,2,76.0,436.0033333333334,3
w13,64,128,8,2048,768,16,128,128,16,4,3,112.0,436.3126666666667,3
w13,96,128,8,2048,768,16,64,128,32,4,2,42.0,442.734,3
w13,96,128,8,2048,768,16,64,128,32,4,3,62.0,443.097,3
w13,96,128,8,2048,768,16,64,128,16,4,2,42.0,443.2673333333334,3
w13,128,128,8,2048,768,16,64,128,32,4,2,42.0,444.174,3
w13,128,128,8,2048,768,32,128,128,32,4,3,128.0,444.9,3
w13,128,128,8,2048,768,32,128,128,16,4,3,128.0,446.094,3
w13,256,128,8,2048,768,16,32,128,16,4,3,37.0,462.297,3
w13,256,128,8,2048,768,16,64,128,64,8,3,62.0,462.4143333333333,3
w13,256,128,8,2048,768,16,32,128,4,4,3,37.0,462.66,3
w13,512,128,8,2048,768,32,128,128,16,4,2,88.0,465.529,3
w13,512,128,8,2048,768,32,128,128,32,4,3,128.0,466.74533333333335,3
w13,512,128,8,2048,768,32,128,128,16,4,3,128.0,466.8303333333334,3
w13,1024,128,8,2048,768,64,128,64,1,4,3,88.0,508.9526666666666,3
w13,1024,128,8,2048,768,64,128,64,16,4,3,88.0,510.98966666666666,3
w13,1024,128,8,2048,768,64,128,64,4,4,3,88.0,511.5986666666666,3
w13,1536,128,8,2048,768,128,256,64,1,8,4,256.0,601.9340000000001,3
w13,1536,128,8,2048,768,128,256,64,16,8,4,256.0,611.2886666666667,3
w13,1536,128,8,2048,768,128,256,64,32,8,4,256.0,616.089,3
w13,2048,128,8,2048,768,128,256,64,1,8,4,256.0,611.662,3
w13,2048,128,8,2048,768,128,256,64,16,8,4,256.0,626.062,3
w13,2048,128,8,2048,768,128,256,64,1,8,3,208.0,626.2860000000001,3
w13,3072,128,8,2048,768,64,128,64,1,4,3,88.0,793.4543333333335,3
w13,3072,128,8,2048,768,64,128,64,4,4,3,88.0,797.6030000000001,3
w13,3072,128,8,2048,768,64,128,64,1,4,4,112.0,823.524,3
w13,4096,128,8,2048,768,128,256,64,1,8,3,208.0,1003.5133333333332,3
w13,4096,128,8,2048,768,128,256,64,1,8,4,256.0,1006.148,3
w13,4096,128,8,2048,768,256,128,64,1,8,3,208.0,1006.6816666666668,3
w13,1,128,8,4096,1536,16,128,128,32,8,5,184.0,109.741,3
w13,1,128,8,4096,1536,16,64,128,1,4,3,62.0,110.093,3
w13,1,128,8,4096,1536,16,128,128,1,8,2,76.0,110.69033333333334,3
w13,2,128,8,4096,1536,16,64,256,32,4,5,202.0,219.86366666666663,3
w13,2,128,8,4096,1536,16,64,256,1,4,3,122.0,220.23733333333337,3
w13,2,128,8,4096,1536,16,64,256,32,4,3,122.0,220.2693333333333,3
w13,4,128,8,4096,1536,16,64,256,16,4,3,122.0,429.29333333333335,3
w13,4,128,8,4096,1536,16,64,256,32,4,3,122.0,431.2033333333333,3
w13,4,128,8,4096,1536,16,64,256,64,4,3,122.0,431.8320000000001,3
w13,8,128,8,4096,1536,16,64,256,32,4,3,122.0,853.3266666666667,3
w13,8,128,8,4096,1536,16,64,256,1,4,3,122.0,853.4336666666667,3
w13,8,128,8,4096,1536,16,64,256,64,4,3,122.0,854.8093333333333,3
w13,16,128,8,4096,1536,16,64,256,32,4,3,122.0,1695.8896666666667,3
w13,16,128,8,4096,1536,16,64,256,1,4,3,122.0,1698.0126666666667,3
w13,16,128,8,4096,1536,16,64,256,16,4,3,122.0,1699.111,3
w13,24,128,8,4096,1536,16,64,256,1,4,3,122.0,1701.097,3
w13,24,128,8,4096,1536,16,64,256,16,4,3,122.0,1701.3093333333334,3
w13,24,128,8,4096,1536,16,64,256,64,4,3,122.0,1702.6533333333334,3
w13,32,128,8,4096,1536,16,64,256,1,4,3,122.0,1705.9716666666666,3
w13,32,128,8,4096,1536,16,64,256,32,4,3,122.0,1707.487,3
w13,32,128,8,4096,1536,16,64,256,32,4,2,82.0,1707.9136666666666,3
w13,48,128,8,4096,1536,16,64,256,1,4,3,122.0,1709.866,3
w13,48,128,8,4096,1536,16,64,256,32,4,3,122.0,1711.8190000000002,3
w13,48,128,8,4096,1536,16,64,256,16,4,3,122.0,1714.5173333333332,3
w13,64,128,8,4096,1536,16,64,256,1,4,3,122.0,1717.643,3
w13,64,128,8,4096,1536,16,64,256,1,4,5,202.0,1720.1496666666665,3
w13,64,128,8,4096,1536,16,64,256,32,4,3,122.0,1720.5763333333334,3
w13,96,128,8,4096,1536,16,64,256,1,4,3,122.0,1730.1016666666667,3
w13,96,128,8,4096,1536,16,64,256,32,4,3,122.0,1731.7340000000002,3
w13,96,128,8,4096,1536,16,64,256,1,4,2,82.0,1732.811,3
w13,128,128,8,4096,1536,16,64,256,1,4,3,122.0,1736.5020000000002,3
w13,128,128,8,4096,1536,16,64,256,1,4,2,82.0,1741.4193333333333,3
w13,128,128,8,4096,1536,16,64,256,32,4,3,122.0,1742.5603333333336,3
w13,256,128,8,4096,1536,16,64,256,16,4,2,82.0,1774.0276666666666,3
w13,256,128,8,4096,1536,16,64,256,1,4,2,82.0,1774.2516666666668,3
w13,256,128,8,4096,1536,16,128,128,16,4,2,76.0,1774.6143333333332,3
w13,512,128,8,4096,1536,32,128,128,1,4,3,128.0,1840.2673333333328,3
w13,512,128,8,4096,1536,32,128,128,16,8,3,128.0,1840.2886666666664,3
w13,512,128,8,4096,1536,32,128,128,8,4,3,128.0,1840.374,3
w13,1024,128,8,4096,1536,64,128,128,1,8,4,208.0,1953.0663333333337,3
w13,1024,128,8,4096,1536,64,128,128,4,8,4,208.0,1959.775666666667,3
w13,1024,128,8,4096,1536,64,128,128,16,8,4,208.0,1961.7056666666667,3
w13,1536,128,8,4096,1536,128,256,64,1,8,3,208.0,2153.951333333333,3
w13,1536,128,8,4096,1536,128,256,64,1,8,4,256.0,2173.3316666666665,3
w13,1536,128,8,4096,1536,128,256,64,16,8,3,208.0,2180.404666666667,3
w13,2048,128,8,4096,1536,128,256,64,1,8,3,208.0,2179.113,3
w13,2048,128,8,4096,1536,128,256,64,1,8,4,256.0,2197.1183333333333,3
w13,2048,128,8,4096,1536,128,256,64,16,8,3,208.0,2208.809,3
w13,3072,128,8,4096,1536,64,256,64,64,4,3,152.0,3066.112333333333,3
w13,3072,128,8,4096,1536,64,128,64,4,4,3,88.0,3284.523333333333,3
w13,3072,128,8,4096,1536,64,128,64,1,4,4,112.0,3297.58,3
w13,4096,128,8,4096,1536,128,256,64,1,8,4,256.0,3693.2820000000006,3
w13,4096,128,8,4096,1536,128,256,64,1,8,3,208.0,3699.736,3
w13,4096,128,8,4096,1536,256,128,64,1,8,4,256.0,3713.0166666666655,3
w13,1,128,8,4096,3072,16,64,256,32,4,3,122.0,219.48033333333333,3
w13,1,128,8,4096,3072,16,128,128,1,4,3,112.0,219.77866666666668,3
w13,1,128,8,4096,3072,16,64,128,64,4,4,82.0,219.86366666666663,3
w13,2,128,8,4096,3072,16,64,256,64,4,2,82.0,430.0296666666666,3
w13,2,128,8,4096,3072,16,64,256,32,8,5,202.0,430.64866666666666,3
w13,2,128,8,4096,3072,16,64,256,16,4,3,122.0,430.9043333333333,3
w13,4,128,8,4096,3072,16,64,256,16,4,3,122.0,851.5143333333334,3
w13,4,128,8,4096,3072,16,64,256,64,4,3,122.0,852.6866666666666,3
w13,4,128,8,4096,3072,16,64,256,32,4,3,122.0,852.869,3
w13,8,128,8,4096,3072,16,64,256,16,4,3,122.0,1695.7196666666666,3
w13,8,128,8,4096,3072,16,64,256,64,4,3,122.0,1696.4026666666668,3
w13,8,128,8,4096,3072,16,64,256,32,4,3,122.0,1697.128333333333,3
w13,16,128,8,4096,3072,16,64,256,16,4,3,122.0,3382.1920000000005,3
w13,16,128,8,4096,3072,16,64,256,1,4,3,122.0,3383.610666666667,3
w13,16,128,8,4096,3072,16,64,256,32,4,3,122.0,3384.1756666666665,3
w13,24,128,8,4096,3072,16,64,256,1,4,3,122.0,3391.826,3
w13,24,128,8,4096,3072,16,64,256,16,4,3,122.0,3391.9966666666664,3
w13,24,128,8,4096,3072,16,64,256,64,4,3,122.0,3394.3323333333333,3
w13,32,128,8,4096,3072,16,64,256,1,4,3,122.0,3398.5246666666667,3
w13,32,128,8,4096,3072,16,64,256,16,4,3,122.0,3399.89,3
w13,32,128,8,4096,3072,16,64,256,64,4,3,122.0,3400.1469999999995,3
w13,48,128,8,4096,3072,16,64,256,1,4,3,122.0,3413.511333333334,3
w13,48,128,8,4096,3072,16,64,256,16,4,3,122.0,3414.099,3
w13,48,128,8,4096,3072,16,64,256,32,4,3,122.0,3414.4286666666667,3
w13,64,128,8,4096,3072,16,64,256,16,4,3,122.0,3422.291,3
w13,64,128,8,4096,3072,16,64,256,1,4,3,122.0,3424.295333333333,3
w13,64,128,8,4096,3072,16,64,256,32,4,3,122.0,3429.853333333333,3
w13,96,128,8,4096,3072,16,64,256,16,4,3,122.0,3451.6553333333336,3
w13,96,128,8,4096,3072,16,64,256,32,4,3,122.0,3452.8496666666665,3
w13,96,128,8,4096,3072,16,64,256,1,4,3,122.0,3452.946,3
w13,128,128,8,4096,3072,16,64,256,1,4,3,122.0,3466.630333333333,3
w13,128,128,8,4096,3072,16,64,256,16,4,3,122.0,3469.34,3
w13,128,128,8,4096,3072,16,64,256,16,4,2,82.0,3471.1,3
w13,256,128,8,4096,3072,16,128,128,16,4,2,76.0,3534.1396666666665,3
w13,256,128,8,4096,3072,16,64,256,16,4,2,82.0,3535.121,3
w13,256,128,8,4096,3072,16,128,128,16,4,3,112.0,3535.931666666667,3
w13,512,128,8,4096,3072,32,128,128,8,4,2,88.0,3630.2996666666672,3
w13,512,128,8,4096,3072,32,128,128,16,4,2,88.0,3630.492,3
w13,512,128,8,4096,3072,32,128,128,1,4,3,128.0,3632.3163333333337,3
w13,1024,128,8,4096,3072,64,128,128,1,8,4,208.0,3869.497666666666,3
w13,1024,128,8,4096,3072,64,128,128,16,8,4,208.0,3880.89,3
w13,1024,128,8,4096,3072,64,128,128,4,8,4,208.0,3891.150666666667,3
w13,1536,128,8,4096,3072,128,256,64,1,8,3,208.0,4312.727,3
w13,1536,128,8,4096,3072,128,256,64,1,8,4,256.0,4320.663333333333,3
w13,1536,128,8,4096,3072,128,256,64,16,8,3,208.0,4358.167666666667,3
w13,2048,128,8,4096,3072,128,256,64,1,8,3,208.0,4354.828,3
w13,2048,128,8,4096,3072,128,256,64,1,8,4,256.0,4389.153333333333,3
w13,2048,128,8,4096,3072,128,256,64,16,8,3,208.0,4411.670666666666,3
w13,3072,128,8,4096,3072,64,128,64,32,4,3,88.0,7098.718666666667,3
w13,3072,128,8,4096,3072,64,256,64,16,4,3,152.0,7132.573,3
w13,3072,128,8,4096,3072,64,256,64,32,4,3,152.0,7137.895666666666,3
w13,4096,128,8,4096,3072,128,256,64,16,8,3,208.0,7318.517666666667,3
w13,4096,128,8,4096,3072,256,128,64,1,8,3,208.0,7326.083,3
w13,4096,128,8,4096,3072,128,256,64,64,8,3,208.0,7338.925333333333,3
