pipetuning_test/moe_dse/moe_dse_L40_top3.csv
weight_type,M,E,topk,H,N,BLOCK_SIZE_M,BLOCK_SIZE_N,BLOCK_SIZE_K,GROUP_SIZE_M,num_warps,num_stages,smem_size_KB,avg_duration,sample_count
w13,1,8,2,1024,512,16,32,128,1,4,3,37.0,3.6183333333333336,3
w13,1,8,2,1024,512,16,32,128,1,4,4,49.0,3.6286666666666663,3
w13,1,8,2,1024,512,16,32,128,4,4,3,37.0,3.6286666666666663,3
w13,1,16,2,1536,768,16,32,128,1,4,4,49.0,4.706,3
w13,1,16,2,1536,768,16,32,128,32,4,4,49.0,4.727333333333333,3
w13,1,16,2,1536,768,16,32,128,64,4,4,49.0,4.738,3
w13,1,16,4,1536,1024,16,64,64,1,4,4,42.0,7.820666666666667,3
w13,1,16,4,1536,1024,16,64,64,16,4,4,42.0,7.873666666666666,3
w13,1,16,4,1536,1024,16,64,64,64,4,4,42.0,7.906,3
w13,1,32,4,2048,768,16,64,128,1,4,4,82.0,8.247333333333334,3
w13,1,32,4,2048,768,16,64,128,32,4,4,82.0,8.300666666666666,3
w13,1,32,4,2048,768,16,64,128,16,4,4,82.0,8.301,3
w13,1,32,6,3072,1024,16,128,64,16,8,4,76.0,18.391666666666666,3
w13,1,32,6,3072,1024,16,128,64,32,8,4,76.0,18.413,3
w13,1,32,6,3072,1024,16,128,64,1,8,4,76.0,18.423333333333336,3
w13,1,60,4,2048,1408,16,128,64,1,8,4,76.0,12.642333333333331,3
w13,1,60,4,2048,1408,16,128,64,1,8,3,58.0,12.695333333333332,3
w13,1,60,4,2048,1408,16,128,64,64,8,4,76.0,12.812666666666669,3
w13,1,60,6,3584,2304,64,32,128,16,4,2,52.0,260.79333333333335,3
w13,1,60,6,3584,2304,16,32,256,16,4,2,49.0,261.83833333333337,3
w13,1,60,6,3584,2304,16,32,256,1,4,2,49.0,262.0843333333333,3
w13,1,60,8,2048,1536,16,64,256,16,8,2,82.0,36.044666666666664,3
w13,1,60,8,2048,1536,16,32,128,4,4,2,25.0,36.205333333333336,3
w13,1,60,8,2048,1536,16,32,128,4,4,3,37.0,36.37533333333334,3
w13,1,64,6,3072,2048,16,32,128,16,4,2,25.0,190.094,3
w13,1,64,6,3072,2048,16,64,128,32,4,2,42.0,190.26433333333333,3
w13,1,64,6,3072,2048,16,64,128,64,4,2,42.0,190.275,3
w13,1,64,6,3584,1536,16,32,64,1,4,2,13.0,148.59966666666665,3
w13,1,64,6,3584,1536,32,32,64,1,4,2,18.0,152.387,3
w13,1,64,6,3584,1536,16,32,128,32,4,2,25.0,152.89866666666666,3
w13,1,64,8,3584,2560,16,16,256,4,4,3,48.5,396.549,3
w13,1,64,8,3584,2560,16,16,256,1,4,3,48.5,397.2633333333333,3
w13,1,64,8,3584,2560,32,32,256,4,8,3,98.0,397.9673333333334,3
w13,1,128,4,2048,512,16,32,128,16,4,4,49.0,6.274,3
w13,1,128,4,2048,512,16,32,128,32,4,4,49.0,6.2956666666666665,3
w13,1,128,4,2048,512,16,32,128,64,4,4,49.0,6.359333333333333,3
w13,1,128,6,4096,2048,64,32,256,1,4,2,100.0,267.02133333333336,3
w13,1,128,6,4096,2048,16,32,128,16,4,2,25.0,268.568,3
w13,1,128,6,4096,2048,32,32,256,1,4,2,66.0,268.6963333333333,3
w13,1,128,8,2048,768,16,128,64,1,8,4,76.0,12.759333333333332,3
w13,1,128,8,2048,768,16,128,64,64,8,4,76.0,12.919333333333332,3
w13,1,128,8,2048,768,16,128,64,16,8,4,76.0,12.951333333333332,3
w13,1,128,8,4096,1536,64,32,256,1,4,2,100.0,267.40633333333335,3
w13,1,128,8,4096,1536,32,32,256,1,4,2,66.0,267.6306666666667,3
w13,1,128,8,4096,1536,16,64,256,16,4,2,82.0,267.9506666666667,3
w13,1,128,8,4096,3072,16,16,256,4,4,3,48.5,543.1846666666667,3
w13,1,128,8,4096,3072,16,16,256,1,4,3,48.5,544.369,3
w13,1,128,8,4096,3072,32,32,256,4,8,3,98.0,544.4443333333334,3
w13,2,8,2,1024,512,16,32,128,1,4,4,49.0,3.959333333333334,3
w13,2,8,2,1024,512,16,32,128,1,4,3,37.0,4.012666666666667,3
w13,2,8,2,1024,512,16,32,128,16,4,4,49.0,4.034,3
w13,2,16,2,1536,768,16,64,64,1,4,4,42.0,6.797,3
w13,2,16,2,1536,768,16,64,64,32,4,4,42.0,6.807333333333332,3
w13,2,16,2,1536,768,16,32,128,1,4,3,37.0,6.8180000000000005,3
w13,2,16,4,1536,1024,16,128,64,1,8,4,76.0,12.204666666666668,3
w13,2,16,4,1536,1024,16,128,32,1,8,4,40.0,12.258,3
w13,2,16,4,1536,1024,16,128,64,1,8,3,58.0,12.343333333333334,3
w13,2,32,4,2048,768,16,128,64,1,8,4,76.0,12.631333333333332,3
w13,2,32,4,2048,768,16,128,64,1,8,3,58.0,12.652666666666669,3
w13,2,32,4,2048,768,16,64,64,16,4,4,42.0,12.823333333333332,3
w13,2,32,6,3072,1024,16,64,128,16,4,2,42.0,189.24033333333333,3
w13,2,32,6,3072,1024,16,64,128,64,4,2,42.0,189.9126666666667,3
w13,2,32,6,3072,1024,16,64,128,1,8,2,42.0,189.95466666666667,3
w13,2,60,4,2048,1408,16,64,32,1,4,4,22.0,20.27933333333333,3
w13,2,60,4,2048,1408,16,64,64,1,4,4,42.0,20.343333333333337,3
w13,2,60,4,2048,1408,16,64,64,32,4,4,42.0,20.546333333333333,3
w13,2,60,6,3584,2304,16,16,256,4,4,3,48.5,534.6516666666666,3
w13,2,60,6,3584,2304,16,16,256,1,4,3,48.5,535.558,3
w13,2,60,6,3584,2304,32,32,256,32,8,3,98.0,536.6036666666668,3
w13,2,60,8,2048,1536,16,64,256,16,4,2,82.0,264.899,3
w13,2,60,8,2048,1536,16,32,256,16,4,2,49.0,265.14466666666664,3
w13,2,60,8,2048,1536,16,32,256,1,4,2,49.0,265.5496666666667,3
w13,2,64,6,3072,2048,16,16,256,4,4,3,48.5,406.78866666666664,3
w13,2,64,6,3072,2048,16,16,256,1,4,3,48.5,408.2823333333333,3
w13,2,64,6,3072,2048,32,32,256,1,8,3,98.0,408.506,3
w13,2,64,6,3584,1536,16,16,256,4,4,3,48.5,357.18800000000005,3
w13,2,64,6,3584,1536,32,32,256,1,4,2,66.0,358.07300000000004,3
w13,2,64,6,3584,1536,16,16,256,1,4,3,48.5,358.18,3
w13,2,64,8,3584,2560,16,16,256,4,4,3,48.5,787.7193333333333,3
w13,2,64,8,3584,2560,16,16,256,1,4,3,48.5,788.381,3
w13,2,64,8,3584,2560,32,32,256,16,8,3,98.0,789.8846666666667,3
w13,2,128,4,2048,512,16,64,64,1,4,4,42.0,8.802666666666667,3
w13,2,128,4,2048,512,16,64,64,64,4,4,42.0,8.834,3
w13,2,128,4,2048,512,16,64,64,16,4,4,42.0,8.844666666666667,3
w13,2,128,6,4096,2048,16,16,256,4,4,3,48.5,543.086,3
w13,2,128,6,4096,2048,16,16,256,1,4,3,48.5,544.0563333333333,3
w13,2,128,6,4096,2048,32,32,256,16,8,3,98.0,544.4413333333333,3
w13,2,128,8,2048,768,16,32,128,16,8,2,25.0,33.20766666666666,3
w13,2,128,8,2048,768,16,32,128,32,8,2,25.0,33.27166666666667,3
w13,2,128,8,2048,768,16,32,128,64,8,2,25.0,33.431333333333335,3
w13,2,128,8,4096,1536,16,16,256,1,4,3,48.5,542.5443333333333,3
w13,2,128,8,4096,1536,16,16,256,4,4,3,48.5,542.598,3
w13,2,128,8,4096,1536,32,32,256,16,8,3,98.0,544.8483333333334,3
w13,2,128,8,4096,3072,16,16,256,4,4,3,48.5,1081.0663333333334,3
w13,2,128,8,4096,3072,16,16,256,1,4,3,48.5,1081.675,3
w13,2,128,8,4096,3072,16,16,256,4,8,3,48.5,1084.5973333333334,3
w13,4,8,2,1024,512,16,64,64,32,4,4,42.0,5.4526666666666666,3
w13,4,8,2,1024,512,16,64,64,1,4,4,42.0,5.484666666666667,3
w13,4,8,2,1024,512,16,64,64,64,4,4,42.0,5.484666666666667,3
w13,4,16,2,1536,768,16,128,64,1,8,4,76.0,10.096666666666666,3
w13,4,16,2,1536,768,16,128,64,64,8,4,76.0,10.245666666666668,3
w13,4,16,2,1536,768,16,32,64,1,4,4,25.0,10.256,3
w13,4,16,4,1536,1024,16,64,128,1,8,2,42.0,24.076666666666664,3
w13,4,16,4,1536,1024,16,64,128,16,8,2,42.0,24.396666666666665,3
w13,4,16,4,1536,1024,16,64,128,1,4,2,42.0,24.557,3
w13,4,32,4,2048,768,16,32,128,16,8,2,25.0,33.77333333333333,3
w13,4,32,4,2048,768,16,32,128,4,4,2,25.0,34.54066666666667,3
w13,4,32,4,2048,768,16,32,64,64,4,3,19.0,34.55166666666667,3
w13,4,32,6,3072,1024,16,16,256,4,4,3,48.5,407.396,3
w13,4,32,6,3072,1024,16,16,256,1,4,3,48.5,408.0463333333334,3
w13,4,32,6,3072,1024,32,32,256,4,8,3,98.0,408.452,3
w13,4,60,4,2048,1408,16,32,256,16,4,2,49.0,238.687,3
w13,4,60,4,2048,1408,16,64,256,16,4,2,82.0,240.724,3
w13,4,60,4,2048,1408,16,64,128,16,4,2,42.0,241.6196666666667,3
w13,4,60,6,3584,2304,16,16,256,4,4,3,48.5,1061.5043333333333,3
w13,4,60,6,3584,2304,16,16,256,1,4,3,48.5,1063.573666666667,3
w13,4,60,6,3584,2304,32,32,256,1,8,3,98.0,1064.5116666666663,3
w13,4,60,8,2048,1536,16,16,256,4,4,3,48.5,542.564,3
w13,4,60,8,2048,1536,16,16,256,1,4,3,48.5,543.14,3
w13,4,60,8,2048,1536,16,32,256,32,4,3,73.0,543.812,3
w13,4,64,6,3072,2048,16,16,256,4,4,3,48.5,808.2843333333334,3
w13,4,64,6,3072,2048,16,16,256,1,4,3,48.5,809.5963333333333,3
w13,4,64,6,3072,2048,32,32,256,1,8,3,98.0,811.7513333333333,3
w13,4,64,6,3584,1536,16,16,256,4,4,3,48.5,709.8389999999999,3
w13,4,64,6,3584,1536,16,16,256,1,4,3,48.5,710.9810000000001,3
w13,4,64,6,3584,1536,32,32,256,1,8,3,98.0,711.5886666666667,3
w13,4,64,8,3584,2560,16,16,256,4,4,3,48.5,1569.795,3
w13,4,64,8,3584,2560,16,16,256,1,4,3,48.5,1571.32,3
w13,4,64,8,3584,2560,32,32,256,4,8,3,98.0,1574.9576666666665,3
w13,4,128,4,2048,512,16,128,64,1,8,4,76.0,14.828666666666663,3
w13,4,128,4,2048,512,16,128,64,1,4,4,76.0,14.956666666666663,3
w13,4,128,4,2048,512,16,128,64,1,8,3,58.0,14.988333333333337,3
w13,4,128,6,4096,2048,16,16,256,4,4,3,48.5,1078.7363333333333,3
w13,4,128,6,4096,2048,16,16,256,1,4,3,48.5,1081.8190000000002,3
w13,4,128,6,4096,2048,16,16,256,4,8,3,48.5,1083.558,3
w13,4,128,8,2048,768,16,32,256,1,4,2,49.0,266.76366666666667,3
w13,4,128,8,2048,768,16,64,256,1,4,2,82.0,266.92366666666663,3
w13,4,128,8,2048,768,32,32,256,1,4,2,66.0,267.33933333333334,3
w13,4,128,8,4096,1536,16,16,256,4,4,3,48.5,1079.241,3
w13,4,128,8,4096,1536,16,16,256,1,4,3,48.5,1080.275666666667,3
w13,4,128,8,4096,1536,16,16,256,4,8,3,48.5,1082.8143333333337,3
w13,4,128,8,4096,3072,16,16,256,4,4,3,48.5,2155.0703333333336,3
w13,4,128,8,4096,3072,16,16,256,1,4,3,48.5,2155.646666666667,3
w13,4,128,8,4096,3072,16,16,256,1,8,3,48.5,2162.921333333333,3
w13,8,8,2,1024,512,16,64,64,1,4,4,42.0,5.3886666666666665,3
w13,8,8,2,1024,512,16,64,64,64,4,4,42.0,5.463333333333334,3
w13,8,8,2,1024,512,16,64,64,32,4,4,42.0,5.474,3
w13,8,16,2,1536,768,16,64,32,1,4,4,22.0,16.733,3
w13,8,16,2,1536,768,16,64,32,1,4,3,17.0,16.829333333333334,3
w13,8,16,2,1536,768,16,64,64,1,4,3,32.0,17.0,3
w13,8,16,4,1536,1024,16,64,128,64,4,2,42.0,24.749,3
w13,8,16,4,1536,1024,16,64,128,16,4,2,42.0,24.887,3
w13,8,16,4,1536,1024,16,64,128,32,4,2,42.0,24.962,3
w13,8,32,4,2048,768,16,32,256,1,4,2,49.0,263.8643333333333,3
w13,8,32,4,2048,768,16,64,256,1,4,2,82.0,265.1126666666667,3
w13,8,32,4,2048,768,32,32,256,1,4,2,66.0,265.62466666666666,3
w13,8,32,6,3072,1024,16,16,256,4,4,3,48.5,541.9033333333333,3
w13,8,32,6,3072,1024,16,16,256,1,4,3,48.5,542.4366666666666,3
w13,8,32,6,3072,1024,32,32,256,4,8,3,98.0,543.8870000000001,3
w13,8,60,4,2048,1408,16,16,256,4,4,3,48.5,497.1336666666666,3
w13,8,60,4,2048,1408,16,16,256,1,4,3,48.5,497.5396666666666,3
w13,8,60,4,2048,1408,16,32,256,64,4,3,73.0,497.955,3
w13,8,60,6,3584,2304,16,16,256,4,4,3,48.5,2117.6316666666667,3
w13,8,60,6,3584,2304,16,16,256,1,4,3,48.5,2119.4546666666665,3
w13,8,60,6,3584,2304,32,32,256,1,8,3,98.0,2123.924,3
w13,8,60,8,2048,1536,16,16,256,4,4,3,48.5,1013.0396666666668,3
w13,8,60,8,2048,1536,16,32,256,32,4,3,73.0,1013.541,3
w13,8,60,8,2048,1536,16,16,256,1,4,3,48.5,1013.563,3
w13,8,64,6,3072,2048,16,16,256,4,4,3,48.5,1612.1086666666667,3
w13,8,64,6,3072,2048,16,16,256,1,4,3,48.5,1613.8363333333334,3
w13,8,64,6,3072,2048,32,32,256,1,8,3,98.0,1619.01,3
w13,8,64,6,3584,1536,16,16,256,4,4,3,48.5,1413.2026666666668,3
w13,8,64,6,3584,1536,16,16,256,1,4,3,48.5,1414.493333333333,3
w13,8,64,6,3584,1536,32,32,256,4,8,3,98.0,1417.8533333333337,3
w13,8,64,8,3584,2560,16,16,256,4,4,3,48.5,3134.106,3
w13,8,64,8,3584,2560,16,16,256,1,4,3,48.5,3134.842,3
w13,8,64,8,3584,2560,32,32,256,1,8,3,98.0,3143.759666666667,3
w13,8,128,4,2048,512,16,64,128,16,4,2,42.0,160.054,3
w13,8,128,4,2048,512,16,64,128,1,8,2,42.0,160.25733333333332,3
w13,8,128,4,2048,512,16,64,128,64,4,2,42.0,160.39533333333333,3
w13,8,128,6,4096,2048,16,16,256,4,4,3,48.5,2149.61,3
w13,8,128,6,4096,2048,16,16,256,1,4,3,48.5,2153.5886666666665,3
w13,8,128,6,4096,2048,16,16,256,4,8,3,48.5,2158.058333333333,3
w13,8,128,8,2048,768,16,16,256,4,4,3,48.5,541.8646666666667,3
w13,8,128,8,2048,768,16,16,256,1,4,3,48.5,542.6003333333333,3
w13,8,128,8,2048,768,16,32,256,16,4,3,73.0,543.2403333333333,3
w13,8,128,8,4096,1536,16,16,256,4,4,3,48.5,2153.094,3
w13,8,128,8,4096,1536,16,16,256,1,4,3,48.5,2153.7016666666664,3
w13,8,128,8,4096,1536,16,16,256,4,8,3,48.5,2161.4673333333335,3
w13,8,128,8,4096,3072,16,16,256,4,4,3,48.5,4304.349333333334,3
w13,8,128,8,4096,3072,16,16,256,1,4,3,48.5,4306.065666666666,3
w13,8,128,8,4096,3072,16,16,256,1,8,3,48.5,4315.623666666666,3
w13,16,8,2,1024,512,16,64,64,1,4,4,42.0,5.612666666666667,3
w13,16,8,2,1024,512,16,64,64,16,4,4,42.0,5.634,3
w13,16,8,2,1024,512,16,64,64,32,4,4,42.0,5.666,3
w13,16,16,2,1536,768,16,64,32,1,4,3,17.0,17.321,3
w13,16,16,2,1536,768,16,64,32,1,4,4,22.0,17.341333333333335,3
w13,16,16,2,1536,768,16,64,64,64,4,3,32.0,17.533,3
w13,16,16,4,1536,1024,16,64,128,1,8,2,42.0,24.81233333333333,3
w13,16,16,4,1536,1024,16,64,128,16,4,2,42.0,24.887333333333338,3
w13,16,16,4,1536,1024,16,64,128,32,8,2,42.0,25.058333333333337,3
w13,16,32,4,2048,768,16,32,256,1,4,2,49.0,265.67833333333334,3
w13,16,32,4,2048,768,16,64,256,1,4,2,82.0,266.37100000000004,3
w13,16,32,4,2048,768,32,32,256,1,4,2,66.0,266.894,3
w13,16,32,6,3072,1024,16,16,256,4,4,3,48.5,543.3216666666667,3
w13,16,32,6,3072,1024,16,16,256,1,4,3,48.5,544.0473333333333,3
w13,16,32,6,3072,1024,32,32,256,1,8,3,98.0,545.1993333333334,3
w13,16,60,4,2048,1408,16,16,256,4,4,3,48.5,929.1623333333332,3
w13,16,60,4,2048,1408,16,32,256,32,4,3,73.0,929.44,3
w13,16,60,4,2048,1408,16,32,256,16,4,3,73.0,929.514,3
w13,16,60,6,3584,2304,16,16,256,4,4,3,48.5,2648.6336666666666,3
w13,16,60,6,3584,2304,16,16,256,1,4,3,48.5,2650.223,3
w13,16,60,6,3584,2304,32,32,256,1,8,3,98.0,2657.039,3
w13,16,60,8,2048,1536,16,16,256,4,4,3,48.5,1013.68,3
w13,16,60,8,2048,1536,16,16,256,1,4,3,48.5,1014.5446666666668,3
w13,16,60,8,2048,1536,16,32,256,32,4,3,73.0,1016.326,3
w13,16,64,6,3072,2048,16,16,256,4,4,3,48.5,2150.0433333333335,3
w13,16,64,6,3072,2048,16,16,256,1,4,3,48.5,2151.7713333333336,3
w13,16,64,6,3072,2048,32,32,256,1,8,3,98.0,2159.11,3
w13,16,64,6,3584,1536,16,16,256,4,4,3,48.5,1885.035,3
w13,16,64,6,3584,1536,16,16,256,1,4,3,48.5,1885.7703333333332,3
w13,16,64,6,3584,1536,32,32,256,1,8,3,98.0,1888.971,3
w13,16,64,8,3584,2560,16,16,256,4,4,3,48.5,3140.0916666666667,3
w13,16,64,8,3584,2560,16,16,256,1,4,3,48.5,3140.5716666666667,3
w13,16,64,8,3584,2560,32,32,256,1,8,3,98.0,3150.3430000000003,3
w13,16,128,4,2048,512,16,32,256,1,4,2,49.0,361.349,3
w13,16,128,4,2048,512,32,32,256,1,4,2,66.0,362.0,3
w13,16,128,4,2048,512,16,64,256,1,4,2,82.0,362.235,3
w13,16,128,6,4096,2048,16,16,256,4,4,3,48.5,4295.637,3
w13,16,128,6,4096,2048,16,16,256,1,4,3,48.5,4303.200333333333,3
w13,16,128,6,4096,2048,16,16,256,4,8,3,48.5,4309.994333333333,3
w13,16,128,8,2048,768,16,16,256,4,4,3,48.5,1079.736666666667,3
w13,16,128,8,2048,768,16,16,256,1,4,3,48.5,1080.11,3
w13,16,128,8,2048,768,16,32,256,16,4,3,73.0,1080.5683333333334,3
w13,16,128,8,4096,1536,16,16,256,4,4,3,48.5,4301.452666666667,3
w13,16,128,8,4096,1536,16,16,256,1,4,3,48.5,4301.708666666666,3
w13,16,128,8,4096,1536,16,16,256,1,8,3,48.5,4313.037,3
w13,16,128,8,4096,3072,16,16,256,4,4,3,48.5,8605.483333333334,3
w13,16,128,8,4096,3072,16,16,256,1,4,3,48.5,8605.995333333332,3
w13,16,128,8,4096,3072,16,16,256,1,8,3,48.5,8625.291666666666,3
w13,24,8,2,1024,512,16,64,64,1,4,4,42.0,5.655666666666666,3
w13,24,8,2,1024,512,16,64,64,64,4,4,42.0,5.730333333333333,3
w13,24,8,2,1024,512,16,64,32,1,4,4,22.0,5.762,3
w13,24,16,2,1536,768,16,64,32,1,4,3,17.0,17.139,3
w13,24,16,2,1536,768,16,64,32,1,4,4,22.0,17.266666666666666,3
w13,24,16,2,1536,768,16,64,64,1,4,3,32.0,17.438000000000002,3
w13,24,16,4,1536,1024,16,64,128,1,8,2,42.0,25.548999999999996,3
w13,24,16,4,1536,1024,16,128,128,1,8,2,76.0,25.612666666666662,3
w13,24,16,4,1536,1024,16,64,128,64,8,2,42.0,25.858333333333334,3
w13,24,32,4,2048,768,16,32,256,1,4,2,49.0,265.742,3
w13,24,32,4,2048,768,16,64,256,1,4,2,82.0,266.44533333333334,3
w13,24,32,4,2048,768,32,32,256,1,4,2,66.0,266.9683333333333,3
w13,24,32,6,3072,1024,16,16,256,4,4,3,48.5,544.57,3
w13,24,32,6,3072,1024,16,16,256,1,4,3,48.5,545.3703333333333,3
w13,24,32,6,3072,1024,32,32,256,4,8,3,98.0,546.4263333333333,3
w13,24,60,4,2048,1408,16,16,256,4,4,3,48.5,929.0666666666666,3
w13,24,60,4,2048,1408,16,16,256,1,4,3,48.5,929.4503333333332,3
w13,24,60,4,2048,1408,16,32,256,16,4,3,73.0,929.9086666666668,3
w13,24,60,6,3584,2304,16,16,256,4,4,3,48.5,2651.333,3
w13,24,60,6,3584,2304,16,16,256,1,4,3,48.5,2652.208,3
w13,24,60,6,3584,2304,32,32,256,1,8,3,98.0,2659.152,3
w13,24,60,8,2048,1536,16,16,256,4,4,3,48.5,1015.6323333333332,3
w13,24,60,8,2048,1536,16,16,256,1,4,3,48.5,1016.3686666666666,3
w13,24,60,8,2048,1536,16,16,256,1,8,3,48.5,1019.5683333333332,3
w13,24,64,6,3072,2048,16,16,256,4,4,3,48.5,2153.5853333333334,3
w13,24,64,6,3072,2048,16,16,256,1,4,3,48.5,2154.7906666666663,3
w13,24,64,6,3072,2048,32,32,256,1,8,3,98.0,2162.0546666666664,3
w13,24,64,6,3584,1536,16,16,256,4,4,3,48.5,1887.3713333333333,3
w13,24,64,6,3584,1536,16,16,256,1,4,3,48.5,1888.0863333333336,3
w13,24,64,6,3584,1536,32,32,256,1,8,3,98.0,1891.98,3
w13,24,64,8,3584,2560,16,16,256,4,4,3,48.5,3145.565,3
w13,24,64,8,3584,2560,16,16,256,1,4,3,48.5,3146.1626666666666,3
w13,24,64,8,3584,2560,32,32,256,1,8,3,98.0,3154.696,3
w13,24,128,4,2048,512,16,16,256,1,4,3,48.5,541.4043333333333,3
w13,24,128,4,2048,512,16,16,256,4,4,3,48.5,542.0763333333333,3
w13,24,128,4,2048,512,16,32,256,16,4,3,73.0,542.7053333333333,3
w13,24,128,6,4096,2048,16,16,256,4,4,3,48.5,5725.463333333333,3
w13,24,128,6,4096,2048,16,16,256,1,4,3,48.5,5736.769333333334,3
w13,24,128,6,4096,2048,16,16,256,4,8,3,48.5,5745.303333333333,3
w13,24,128,8,2048,768,16,16,256,4,4,3,48.5,1079.8966666666663,3
w13,24,128,8,2048,768,16,32,256,16,4,3,73.0,1080.4293333333333,3
w13,24,128,8,2048,768,16,32,256,32,4,3,73.0,1081.0693333333334,3
w13,24,128,8,4096,1536,16,16,256,4,4,3,48.5,4299.559,3
w13,24,128,8,4096,1536,16,16,256,1,4,3,48.5,4300.615,3
w13,24,128,8,4096,1536,16,16,256,1,8,3,48.5,4312.903333333333,3
w13,24,128,8,4096,3072,16,16,256,4,4,3,48.5,8602.452666666666,3
w13,24,128,8,4096,3072,16,16,256,1,4,3,48.5,8603.797,3
w13,24,128,8,4096,3072,16,16,256,1,8,3,48.5,8623.370333333334,3
w13,32,8,2,1024,512,16,64,64,1,4,4,42.0,5.794,3
w13,32,8,2,1024,512,16,64,64,64,4,4,42.0,5.794333333333333,3
w13,32,8,2,1024,512,16,64,64,32,4,4,42.0,5.815333333333332,3
w13,32,16,2,1536,768,16,64,32,1,4,3,17.0,17.50166666666667,3
w13,32,16,2,1536,768,16,64,32,1,4,4,22.0,17.608,3
w13,32,16,2,1536,768,16,64,64,1,4,4,42.0,17.852999999999998,3
w13,32,16,4,1536,1024,16,64,128,32,8,2,42.0,25.68766666666667,3
w13,32,16,4,1536,1024,16,64,128,16,8,2,42.0,25.697999999999997,3
w13,32,16,4,1536,1024,16,64,128,64,8,2,42.0,25.70866666666667,3
w13,32,32,4,2048,768,16,32,256,1,4,2,49.0,267.21366666666665,3
w13,32,32,4,2048,768,32,32,128,1,4,2,34.0,268.3446666666667,3
w13,32,32,4,2048,768,16,64,256,1,4,2,82.0,268.38733333333334,3
w13,32,32,6,3072,1024,16,16,256,4,4,3,48.5,546.3833333333333,3
w13,32,32,6,3072,1024,16,16,256,1,4,3,48.5,546.6926666666667,3
w13,32,32,6,3072,1024,32,32,256,1,8,3,98.0,547.8986666666666,3
w13,32,60,4,2048,1408,16,16,256,4,4,3,48.5,929.6636666666668,3
w13,32,60,4,2048,1408,16,16,256,1,4,3,48.5,930.197,3
w13,32,60,4,2048,1408,16,32,256,16,4,3,73.0,931.7973333333332,3
w13,32,60,6,3584,2304,16,16,256,4,4,3,48.5,2656.550333333333,3
w13,32,60,6,3584,2304,16,16,256,1,4,3,48.5,2656.9876666666664,3
w13,32,60,6,3584,2304,32,32,256,1,8,3,98.0,2663.6866666666665,3
w13,32,60,8,2048,1536,16,16,256,1,4,3,48.5,1017.457,3
w13,32,60,8,2048,1536,16,16,256,4,4,3,48.5,1017.6386666666668,3
w13,32,60,8,2048,1536,16,16,256,1,8,3,48.5,1020.668,3
w13,32,64,6,3072,2048,16,16,256,4,4,3,48.5,2156.2526666666668,3
w13,32,64,6,3072,2048,16,16,256,1,4,3,48.5,2158.087666666667,3
w13,32,64,6,3072,2048,16,16,256,4,8,3,48.5,2165.5436666666665,3
w13,32,64,6,3584,1536,16,16,256,4,4,3,48.5,1889.6443333333336,3
w13,32,64,6,3584,1536,16,16,256,1,4,3,48.5,1890.6893333333337,3
w13,32,64,6,3584,1536,32,32,256,1,8,3,98.0,1894.892,3
w13,32,64,8,3584,2560,16,16,256,1,4,3,48.5,3150.3986666666665,3
w13,32,64,8,3584,2560,16,16,256,4,4,3,48.5,3151.038666666667,3
w13,32,64,8,3584,2560,32,32,256,1,4,3,98.0,3160.788666666667,3
w13,32,128,4,2048,512,16,16,256,1,4,3,48.5,720.3713333333334,3
w13,32,128,4,2048,512,16,16,256,4,4,3,48.5,720.4883333333333,3
w13,32,128,4,2048,512,16,32,256,16,4,3,73.0,721.6513333333334,3
w13,32,128,6,4096,2048,16,16,256,4,4,3,48.5,5722.961666666667,3
w13,32,128,6,4096,2048,16,16,256,1,4,3,48.5,5732.273666666667,3
w13,32,128,6,4096,2048,16,16,256,1,8,3,48.5,5744.284333333333,3
w13,32,128,8,2048,768,16,16,256,4,4,3,48.5,1080.109333333333,3
w13,32,128,8,2048,768,16,16,256,1,4,3,48.5,1080.6856666666663,3
w13,32,128,8,2048,768,16,32,256,16,4,3,73.0,1082.2646666666667,3
w13,32,128,8,4096,1536,16,16,256,4,4,3,48.5,4300.629333333333,3
w13,32,128,8,4096,1536,16,16,256,1,4,3,48.5,4301.194666666666,3
w13,32,128,8,4096,1536,16,16,256,1,8,3,48.5,4313.803,3
w13,32,128,8,4096,3072,16,16,256,1,4,3,48.5,8603.910000000002,3
w13,32,128,8,4096,3072,16,16,256,4,4,3,48.5,8604.699333333332,3
w13,32,128,8,4096,3072,16,16,256,1,8,3,48.5,8624.198,3
w13,48,8,2,1024,512,16,64,32,1,4,4,22.0,5.836333333333333,3
w13,48,8,2,1024,512,16,64,64,1,4,4,42.0,5.900666666666666,3
w13,48,8,2,1024,512,16,64,64,64,4,4,42.0,6.018,3
w13,48,16,2,1536,768,16,64,32,1,4,4,22.0,17.832333333333334,3
w13,48,16,2,1536,768,16,64,32,1,4,3,17.0,18.141666666666666,3
w13,48,16,2,1536,768,16,128,32,1,8,4,40.0,18.376666666666665,3
w13,48,16,4,1536,1024,16,128,128,1,8,2,76.0,27.084666666666667,3
w13,48,16,4,1536,1024,16,128,128,16,8,2,76.0,27.191333333333333,3
w13,48,16,4,1536,1024,16,128,128,32,8,2,76.0,27.618333333333336,3
w13,48,32,4,2048,768,16,32,256,1,4,2,49.0,268.33433333333335,3
w13,48,32,4,2048,768,16,64,256,1,4,2,82.0,268.81333333333333,3
w13,48,32,4,2048,768,32,32,128,1,4,2,34.0,269.18766666666664,3
w13,48,32,6,3072,1024,16,16,256,4,4,3,48.5,549.466,3
w13,48,32,6,3072,1024,32,32,256,1,8,3,98.0,550.4263333333333,3
w13,48,32,6,3072,1024,32,32,256,4,8,3,98.0,550.4373333333334,3
w13,48,60,4,2048,1408,16,16,256,4,4,3,48.5,931.6586666666666,3
w13,48,60,4,2048,1408,16,16,256,1,4,3,48.5,932.0853333333332,3
w13,48,60,4,2048,1408,16,32,256,16,4,3,73.0,934.5923333333334,3
w13,48,60,6,3584,2304,16,16,256,4,4,3,48.5,2662.0229999999997,3
w13,48,60,6,3584,2304,16,16,256,1,4,3,48.5,2663.8366666666666,3
w13,48,60,6,3584,2304,32,32,256,1,8,3,98.0,2670.386333333334,3
w13,48,60,8,2048,1536,16,16,256,4,4,3,48.5,1021.799,3
w13,48,60,8,2048,1536,16,16,256,1,4,3,48.5,1022.3533333333334,3
w13,48,60,8,2048,1536,16,16,256,1,8,3,48.5,1024.977666666667,3
w13,48,64,6,3072,2048,16,16,256,4,4,3,48.5,2162.61,3
w13,48,64,6,3072,2048,16,16,256,1,4,3,48.5,2164.7006666666666,3
w13,48,64,6,3072,2048,16,16,256,1,8,3,48.5,2170.8343333333337,3
w13,48,64,6,3584,1536,16,16,256,4,4,3,48.5,1895.2873333333337,3
w13,48,64,6,3584,1536,16,16,256,1,4,3,48.5,1895.65,3
w13,48,64,6,3584,1536,32,32,256,1,8,3,98.0,1900.066,3
w13,48,64,8,3584,2560,16,16,256,1,4,3,48.5,3162.9223333333334,3
w13,48,64,8,3584,2560,16,16,256,4,4,3,48.5,3163.7436666666667,3
w13,48,64,8,3584,2560,32,32,256,1,8,3,98.0,3169.194333333333,3
w13,48,128,4,2048,512,16,16,256,1,4,3,48.5,720.7876666666667,3
w13,48,128,4,2048,512,16,16,256,4,4,3,48.5,721.0009999999999,3
w13,48,128,4,2048,512,16,32,256,16,4,3,73.0,722.9736666666666,3
w13,48,128,6,4096,2048,16,16,256,4,4,3,48.5,5722.146000000001,3
w13,48,128,6,4096,2048,16,16,256,1,4,3,48.5,5731.223333333332,3
w13,48,128,6,4096,2048,16,16,256,4,8,3,48.5,5746.018666666667,3
w13,48,128,8,2048,768,16,16,256,4,4,3,48.5,1082.0833333333333,3
w13,48,128,8,2048,768,16,16,256,1,4,3,48.5,1082.5956666666668,3
w13,48,128,8,2048,768,16,32,256,16,4,3,73.0,1085.1123333333337,3
w13,48,128,8,4096,1536,16,16,256,1,4,3,48.5,4298.456,3
w13,48,128,8,4096,1536,16,16,256,4,4,3,48.5,4300.717666666666,3
w13,48,128,8,4096,1536,16,16,256,1,8,3,48.5,4310.9039999999995,3
w13,48,128,8,4096,3072,16,16,256,1,4,3,48.5,8598.783333333333,3
w13,48,128,8,4096,3072,16,16,256,4,4,3,48.5,8601.898,3
w13,48,128,8,4096,3072,16,16,256,1,8,3,48.5,8621.204666666667,3
w13,64,8,2,1024,512,16,64,32,1,4,4,22.0,6.178,3
w13,64,8,2,1024,512,16,64,64,1,8,4,42.0,6.188333333333333,3
w13,64,8,2,1024,512,16,64,64,64,4,4,42.0,6.252666666666666,3
w13,64,16,2,1536,768,16,128,64,1,8,3,58.0,18.412666666666667,3
w13,64,16,2,1536,768,16,64,32,1,4,4,22.0,18.423333333333336,3
w13,64,16,2,1536,768,16,128,32,1,8,4,40.0,18.476333333333333,3
w13,64,16,4,1536,1024,16,128,128,1,8,2,76.0,29.143333333333334,3
w13,64,16,4,1536,1024,16,128,128,64,8,2,76.0,29.207333333333334,3
w13,64,16,4,1536,1024,16,128,128,32,8,2,76.0,29.292333333333332,3
w13,64,32,4,2048,768,16,32,256,1,4,2,49.0,269.4433333333333,3
w13,64,32,4,2048,768,16,64,256,1,4,2,82.0,270.61633333333333,3
w13,64,32,4,2048,768,32,32,128,1,4,2,34.0,270.638,3
w13,64,32,6,3072,1024,32,32,256,1,8,3,98.0,552.3249999999999,3
w13,64,32,6,3072,1024,32,32,256,1,4,3,98.0,552.4636666666667,3
w13,64,32,6,3072,1024,32,32,256,4,4,3,98.0,552.784,3
w13,64,60,4,2048,1408,16,16,256,4,4,3,48.5,933.1733333333332,3
w13,64,60,4,2048,1408,16,16,256,1,4,3,48.5,934.155,3
w13,64,60,4,2048,1408,16,16,256,4,8,3,48.5,936.8213333333332,3
w13,64,60,6,3584,2304,16,16,256,1,4,3,48.5,2671.454,3
w13,64,60,6,3584,2304,16,16,256,4,4,3,48.5,2671.517,3
w13,64,60,6,3584,2304,32,32,256,1,4,3,98.0,2676.680666666666,3
w13,64,60,8,2048,1536,16,16,256,1,4,3,48.5,1027.6123333333333,3
w13,64,60,8,2048,1536,16,16,256,4,4,3,48.5,1027.7306666666666,3
w13,64,60,8,2048,1536,16,16,256,4,8,3,48.5,1029.8846666666668,3
w13,64,64,6,3072,2048,16,16,256,4,4,3,48.5,2169.394,3
w13,64,64,6,3072,2048,16,16,256,1,4,3,48.5,2169.575333333333,3
w13,64,64,6,3072,2048,32,32,256,1,8,3,98.0,2176.765,3
w13,64,64,6,3584,1536,16,16,256,1,4,3,48.5,1899.7783333333336,3
w13,64,64,6,3584,1536,16,16,256,4,4,3,48.5,1900.2156666666667,3
w13,64,64,6,3584,1536,32,32,256,1,4,3,98.0,1904.472,3
w13,64,64,8,3584,2560,16,16,256,1,4,3,48.5,3171.7236666666668,3
w13,64,64,8,3584,2560,16,16,256,4,4,3,48.5,3174.741666666667,3
w13,64,64,8,3584,2560,32,32,256,1,8,3,98.0,3178.2513333333336,3
w13,64,128,4,2048,512,16,16,256,4,4,3,48.5,721.4056666666667,3
w13,64,128,4,2048,512,16,16,256,1,4,3,48.5,721.4163333333332,3
w13,64,128,4,2048,512,16,32,256,16,4,3,73.0,723.4966666666666,3
w13,64,128,6,4096,2048,16,16,256,4,4,3,48.5,5724.199666666666,3
w13,64,128,6,4096,2048,16,16,256,1,4,3,48.5,5732.359666666666,3
w13,64,128,6,4096,2048,16,16,256,1,8,3,48.5,5747.7626666666665,3
w13,64,128,8,2048,768,16,16,256,4,4,3,48.5,1084.5263333333332,3
w13,64,128,8,2048,768,16,16,256,1,4,3,48.5,1084.6003333333333,3
w13,64,128,8,2048,768,16,16,256,4,8,3,48.5,1087.928666666667,3
w13,64,128,8,4096,1536,16,16,256,1,4,3,48.5,4303.483,3
w13,64,128,8,4096,1536,16,16,256,4,4,3,48.5,4304.901333333334,3
w13,64,128,8,4096,1536,16,16,256,1,8,3,48.5,4316.219,3
w13,64,128,8,4096,3072,16,16,256,1,4,3,48.5,8600.865333333333,3
w13,64,128,8,4096,3072,16,16,256,4,4,3,48.5,8605.794,3
w13,64,128,8,4096,3072,16,16,256,1,8,3,48.5,8625.399666666666,3
w13,96,8,2,1024,512,32,64,128,1,8,4,100.0,7.489999999999999,3
w13,96,8,2,1024,512,32,64,64,1,8,3,40.0,7.532666666666667,3
w13,96,8,2,1024,512,32,64,128,4,8,4,100.0,7.532666666666667,3
w13,96,16,2,1536,768,16,128,64,64,8,3,58.0,19.074,3
w13,96,16,2,1536,768,16,128,64,16,8,3,58.0,19.084666666666667,3
w13,96,16,2,1536,768,16,128,64,32,8,3,58.0,19.084666666666667,3
w13,96,16,4,1536,1024,32,64,128,1,8,2,52.0,37.324666666666666,3
w13,96,16,4,1536,1024,32,64,128,16,4,2,52.0,37.37833333333333,3
w13,96,16,4,1536,1024,32,64,128,64,4,2,52.0,37.42066666666667,3
w13,96,32,4,2048,768,16,32,256,1,4,2,49.0,271.57666666666665,3
w13,96,32,4,2048,768,32,32,128,1,4,2,34.0,272.21700000000004,3
w13,96,32,4,2048,768,16,64,256,1,4,2,82.0,272.675,3
w13,96,32,6,3072,1024,16,16,256,4,4,3,48.5,553.9676666666667,3
w13,96,32,6,3072,1024,32,32,256,1,8,3,98.0,555.728,3
w13,96,32,6,3072,1024,16,16,256,1,4,3,48.5,555.7916666666666,3
w13,96,60,4,2048,1408,16,16,256,4,4,3,48.5,937.6643333333332,3
w13,96,60,4,2048,1408,16,16,256,1,4,3,48.5,938.6353333333332,3
w13,96,60,4,2048,1408,16,16,256,1,8,3,48.5,940.4913333333334,3
w13,96,60,6,3584,2304,16,16,256,1,4,3,48.5,2686.782333333333,3
w13,96,60,6,3584,2304,32,32,256,1,8,3,98.0,2687.732333333334,3
w13,96,60,6,3584,2304,16,16,256,4,4,3,48.5,2688.5316666666663,3
w13,96,60,8,2048,1536,16,16,256,4,4,3,48.5,1035.8476666666668,3
w13,96,60,8,2048,1536,16,16,256,1,4,3,48.5,1037.7886666666666,3
w13,96,60,8,2048,1536,32,32,256,1,8,3,98.0,1037.9066666666668,3
w13,96,64,6,3072,2048,16,16,256,4,4,3,48.5,2181.0956666666666,3
w13,96,64,6,3072,2048,16,16,256,1,4,3,48.5,2182.1086666666665,3
w13,96,64,6,3072,2048,32,32,256,1,8,3,98.0,2186.141,3
w13,96,64,6,3584,1536,16,16,256,1,4,3,48.5,1910.178666666667,3
w13,96,64,6,3584,1536,16,16,256,4,4,3,48.5,1910.3813333333335,3
w13,96,64,6,3584,1536,32,32,256,1,4,3,98.0,1912.4183333333333,3
w13,96,64,8,3584,2560,32,32,256,1,8,3,98.0,3195.9263333333333,3
w13,96,64,8,3584,2560,32,32,256,1,4,3,98.0,3196.651666666666,3
w13,96,64,8,3584,2560,16,16,256,4,4,3,48.5,3198.3050000000003,3
w13,96,128,4,2048,512,16,16,256,1,4,3,48.5,722.0243333333334,3
w13,96,128,4,2048,512,16,16,256,4,4,3,48.5,722.9206666666668,3
w13,96,128,4,2048,512,16,16,256,1,8,3,48.5,725.0856666666667,3
w13,96,128,6,4096,2048,16,16,256,4,4,3,48.5,5731.009999999999,3
w13,96,128,6,4096,2048,16,16,256,1,4,3,48.5,5737.463,3
w13,96,128,6,4096,2048,16,16,256,1,8,3,48.5,5755.543000000001,3
w13,96,128,8,2048,768,16,16,256,4,4,3,48.5,1087.5876666666666,3
w13,96,128,8,2048,768,16,16,256,1,4,3,48.5,1088.7393333333332,3
w13,96,128,8,2048,768,16,16,256,1,8,3,48.5,1090.4033333333334,3
w13,96,128,8,4096,1536,16,16,256,1,4,3,48.5,4307.079666666667,3
w13,96,128,8,4096,1536,16,16,256,4,4,3,48.5,4312.626333333334,3
w13,96,128,8,4096,1536,16,16,256,1,8,3,48.5,4321.991666666666,3
w13,96,128,8,4096,3072,16,16,256,1,4,3,48.5,8609.678333333333,3
w13,96,128,8,4096,3072,16,16,256,4,4,3,48.5,8634.969,3
w13,96,128,8,4096,3072,16,16,256,1,8,3,48.5,8637.572333333334,3
w13,128,8,2,1024,512,32,64,64,1,8,3,40.0,7.575333333333333,3
w13,128,8,2,1024,512,32,64,64,1,8,4,52.0,7.639333333333333,3
w13,128,8,2,1024,512,32,64,64,16,8,3,40.0,7.639333333333333,3
w13,128,16,2,1536,768,16,128,64,1,8,3,58.0,19.458666666666662,3
w13,128,16,2,1536,768,16,128,32,1,4,4,40.0,19.490333333333332,3
w13,128,16,2,1536,768,16,128,64,64,8,3,58.0,19.500666666666664,3
w13,128,16,4,1536,1024,32,128,128,1,8,2,88.0,43.06333333333333,3
w13,128,16,4,1536,1024,32,64,128,32,8,2,52.0,43.181,3
w13,128,16,4,1536,1024,32,64,128,16,8,2,52.0,43.341,3
w13,128,32,4,2048,768,16,32,256,1,4,2,49.0,273.817,3
w13,128,32,4,2048,768,32,32,128,1,4,2,34.0,274.2223333333333,3
w13,128,32,4,2048,768,16,64,256,1,4,2,82.0,274.94733333333335,3
w13,128,32,6,3072,1024,16,16,256,4,4,3,48.5,556.9863333333333,3
w13,128,32,6,3072,1024,16,16,256,1,4,3,48.5,559.003,3
w13,128,32,6,3072,1024,32,32,256,1,8,3,98.0,559.5676666666667,3
w13,128,60,4,2048,1408,16,16,256,4,4,3,48.5,942.433,3
w13,128,60,4,2048,1408,16,16,256,1,4,3,48.5,942.6566666666668,3
w13,128,60,4,2048,1408,16,16,256,4,8,3,48.5,945.5793333333336,3
w13,128,60,6,3584,2304,32,32,256,1,8,3,98.0,2697.247666666666,3
w13,128,60,6,3584,2304,32,32,256,1,4,3,98.0,2699.125,3
w13,128,60,6,3584,2304,32,32,256,4,8,3,98.0,2701.952,3
w13,128,60,8,2048,1536,16,16,256,1,4,3,48.5,1039.1333333333334,3
w13,128,60,8,2048,1536,16,16,256,4,4,3,48.5,1039.635,3
w13,128,60,8,2048,1536,32,32,256,1,8,3,98.0,1042.6323333333332,3
w13,128,64,6,3072,2048,32,32,256,1,8,3,98.0,2194.6626666666666,3
w13,128,64,6,3072,2048,32,32,256,1,4,3,98.0,2195.5589999999997,3
w13,128,64,6,3072,2048,16,16,256,4,4,3,48.5,2196.561666666667,3
w13,128,64,6,3584,1536,32,32,256,1,8,3,98.0,1917.5816666666667,3
w13,128,64,6,3584,1536,32,32,256,1,4,3,98.0,1917.869333333333,3
w13,128,64,6,3584,1536,16,16,256,1,4,3,48.5,1919.918,3
w13,128,64,8,3584,2560,32,32,256,1,8,3,98.0,3206.2196666666664,3
w13,128,64,8,3584,2560,32,32,256,1,4,3,98.0,3208.5339999999997,3
w13,128,64,8,3584,2560,32,32,256,4,4,3,98.0,3213.5903333333335,3
w13,128,128,4,2048,512,16,16,256,1,4,3,48.5,723.3580000000001,3
w13,128,128,4,2048,512,16,16,256,4,4,3,48.5,724.1259999999999,3
w13,128,128,4,2048,512,16,16,256,1,8,3,48.5,726.6006666666667,3
w13,128,128,6,4096,2048,16,16,256,4,4,3,48.5,5745.701666666667,3
w13,128,128,6,4096,2048,16,16,256,1,4,3,48.5,5756.9766666666665,3
w13,128,128,6,4096,2048,16,16,256,4,8,3,48.5,5767.686000000001,3
w13,128,128,8,2048,768,16,16,256,4,4,3,48.5,1092.6013333333333,3
w13,128,128,8,2048,768,16,16,256,1,4,3,48.5,1092.729,3
w13,128,128,8,2048,768,16,16,256,1,8,3,48.5,1095.9826666666663,3
w13,128,128,8,4096,1536,16,16,256,1,4,3,48.5,4324.137333333333,3
w13,128,128,8,4096,1536,16,16,256,4,4,3,48.5,4327.4439999999995,3
w13,128,128,8,4096,1536,16,16,256,1,8,3,48.5,4336.670666666667,3
w13,128,128,8,4096,3072,16,16,256,1,4,3,48.5,8631.994333333334,3
w13,128,128,8,4096,3072,16,16,256,4,4,3,48.5,8656.036999999998,3
w13,128,128,8,4096,3072,16,16,256,1,8,3,48.5,8664.112,3
w13,256,8,2,1024,512,64,64,64,32,4,3,56.0,11.202,3
w13,256,8,2,1024,512,64,64,64,1,4,3,56.0,11.223333333333334,3
w13,256,8,2,1024,512,64,64,64,16,4,3,56.0,11.223333333333334,3
w13,256,16,2,1536,768,32,64,32,2,4,4,28.0,24.695333333333338,3
w13,256,16,2,1536,768,32,64,32,2,4,3,22.0,24.77,3
w13,256,16,2,1536,768,32,64,64,1,8,3,40.0,24.929999999999996,3
w13,256,16,4,1536,1024,32,128,64,32,8,2,48.0,70.26333333333334,3
w13,256,16,4,1536,1024,64,128,128,1,8,2,112.0,70.76433333333334,3
w13,256,16,4,1536,1024,32,128,64,64,8,2,48.0,70.829,3
w13,256,32,4,2048,768,16,32,256,1,4,2,49.0,278.57466666666664,3
w13,256,32,4,2048,768,32,32,128,1,4,2,34.0,278.92633333333333,3
w13,256,32,4,2048,768,16,64,256,1,4,2,82.0,279.971,3
w13,256,32,6,3072,1024,32,32,256,1,8,3,98.0,567.4616666666667,3
w13,256,32,6,3072,1024,32,32,256,1,4,3,98.0,568.1233333333333,3
w13,256,32,6,3072,1024,32,32,256,4,8,3,98.0,568.8166666666667,3
w13,256,60,4,2048,1408,16,16,256,4,4,3,48.5,955.0513333333332,3
w13,256,60,4,2048,1408,16,16,256,1,4,3,48.5,955.9053333333331,3
w13,256,60,4,2048,1408,16,32,256,16,4,3,73.0,957.5046666666668,3
w13,256,60,6,3584,2304,16,16,256,4,4,3,48.5,2716.9816666666666,3
w13,256,60,6,3584,2304,32,32,256,1,8,3,98.0,2728.608,3
w13,256,60,6,3584,2304,16,32,256,1,8,3,73.0,2730.4959999999996,3
w13,256,60,8,2048,1536,16,32,256,16,4,3,73.0,1059.2296666666668,3
w13,256,60,8,2048,1536,32,32,256,4,8,3,98.0,1060.5843333333332,3
w13,256,60,8,2048,1536,32,32,256,4,4,3,98.0,1061.406,3
w13,256,64,6,3072,2048,16,16,256,4,4,3,48.5,2210.0653333333335,3
w13,256,64,6,3072,2048,32,32,256,1,8,3,98.0,2220.8276666666666,3
w13,256,64,6,3072,2048,32,32,256,1,4,3,98.0,2222.332,3
w13,256,64,6,3584,1536,16,16,256,1,4,3,48.5,1930.0833333333333,3
w13,256,64,6,3584,1536,16,16,256,4,4,3,48.5,1931.5019999999995,3
w13,256,64,6,3584,1536,32,32,256,1,8,3,98.0,1939.8859999999995,3
w13,256,64,8,3584,2560,16,16,256,4,4,3,48.5,3234.849,3
w13,256,64,8,3584,2560,32,32,256,1,4,3,98.0,3247.670666666667,3
w13,256,64,8,3584,2560,32,32,256,1,8,3,98.0,3248.4493333333335,3
w13,256,128,4,2048,512,16,16,256,1,4,3,48.5,729.5976666666666,3
w13,256,128,4,2048,512,16,16,256,4,4,3,48.5,730.5046666666667,3
w13,256,128,4,2048,512,16,16,256,1,8,3,48.5,733.3530000000001,3
w13,256,128,6,4096,2048,16,16,256,4,4,3,48.5,5809.384666666668,3
w13,256,128,6,4096,2048,16,16,256,4,8,3,48.5,5817.907333333334,3
w13,256,128,6,4096,2048,16,16,256,1,4,3,48.5,5824.350333333333,3
w13,256,128,8,2048,768,32,32,256,1,8,3,98.0,1110.9373333333333,3
w13,256,128,8,2048,768,32,32,256,1,4,3,98.0,1111.3103333333331,3
w13,256,128,8,2048,768,32,32,256,4,8,3,98.0,1111.577,3
w13,256,128,8,4096,1536,16,16,256,1,4,3,48.5,4383.509666666667,3
w13,256,128,8,4096,1536,32,32,256,1,8,3,98.0,4389.173666666667,3
w13,256,128,8,4096,1536,16,16,256,1,8,3,48.5,4389.493333333333,3
w13,256,128,8,4096,3072,16,16,256,1,4,3,48.5,8760.252333333332,3
w13,256,128,8,4096,3072,32,32,256,1,8,3,98.0,8768.860666666667,3
w13,256,128,8,4096,3072,32,32,256,1,4,3,98.0,8769.734666666665,3
w13,512,8,2,1024,512,64,128,32,8,8,3,52.0,18.103666666666665,3
w13,512,8,2,1024,512,64,128,32,8,8,4,64.0,18.178,3
w13,512,8,2,1024,512,64,128,64,1,8,4,112.0,18.615333333333336,3
w13,512,16,2,1536,768,64,64,64,1,4,3,56.0,39.42633333333333,3
w13,512,16,2,1536,768,64,64,64,64,4,3,56.0,39.586333333333336,3
w13,512,16,2,1536,768,64,64,64,16,4,3,56.0,39.62866666666667,3
w13,512,16,4,1536,1024,64,128,128,1,8,2,112.0,121.97566666666668,3
w13,512,16,4,1536,1024,128,64,128,16,4,2,112.0,123.757,3
w13,512,16,4,1536,1024,128,64,128,16,8,2,112.0,125.34633333333332,3
w13,512,32,4,2048,768,32,32,256,1,4,2,66.0,288.76099999999997,3
w13,512,32,4,2048,768,64,64,128,1,4,2,72.0,290.0516666666667,3
w13,512,32,4,2048,768,32,64,128,1,4,2,52.0,291.3316666666667,3
w13,512,32,6,3072,1024,32,32,256,16,8,4,130.0,591.654,3
w13,512,32,6,3072,1024,32,32,256,16,8,3,98.0,592.1553333333333,3
w13,512,32,6,3072,1024,32,32,256,16,4,4,130.0,592.8166666666666,3
w13,512,60,4,2048,1408,16,32,256,1,4,3,73.0,970.849,3
w13,512,60,4,2048,1408,16,32,256,16,4,3,73.0,972.918,3
w13,512,60,4,2048,1408,16,32,256,1,8,3,73.0,974.2093333333332,3
w13,512,60,6,3584,2304,32,32,256,4,8,3,98.0,2762.5499999999997,3
w13,512,60,6,3584,2304,32,32,256,4,4,3,98.0,2763.137,3
w13,512,60,6,3584,2304,16,32,256,16,4,3,73.0,2773.2810000000004,3
w13,512,60,8,2048,1536,32,64,256,8,8,3,148.0,1096.0196666666668,3
w13,512,60,8,2048,1536,32,32,256,16,8,4,130.0,1097.311,3
w13,512,60,8,2048,1536,32,32,256,16,4,4,130.0,1097.3423333333333,3
w13,512,64,6,3072,2048,32,32,256,4,8,3,98.0,2253.6919999999996,3
w13,512,64,6,3072,2048,32,32,256,4,4,3,98.0,2254.1606666666667,3
w13,512,64,6,3072,2048,32,32,256,16,4,3,98.0,2266.8326666666667,3
w13,512,64,6,3584,1536,32,32,256,4,8,3,98.0,1975.215,3
w13,512,64,6,3584,1536,16,32,256,1,4,3,73.0,1977.4976666666669,3
w13,512,64,6,3584,1536,32,32,256,16,8,3,98.0,1979.0443333333333,3
w13,512,64,8,3584,2560,32,32,256,4,8,3,98.0,3289.8366666666666,3
w13,512,64,8,3584,2560,32,32,256,4,4,3,98.0,3291.703,3
w13,512,64,8,3584,2560,16,32,256,16,4,3,73.0,3304.706,3
w13,512,128,4,2048,512,32,32,256,1,8,3,98.0,743.6886666666666,3
w13,512,128,4,2048,512,16,16,256,4,4,3,48.5,744.1363333333334,3
w13,512,128,4,2048,512,32,32,256,4,8,3,98.0,744.158,3
w13,512,128,6,4096,2048,16,16,256,4,4,3,48.5,5876.341333333333,3
w13,512,128,6,4096,2048,16,16,256,1,4,3,48.5,5888.747666666666,3
w13,512,128,6,4096,2048,16,32,256,1,4,3,73.0,5895.329000000001,3
w13,512,128,8,2048,768,16,16,256,4,4,3,48.5,1123.1293333333333,3
w13,512,128,8,2048,768,16,16,256,1,4,3,48.5,1124.7186666666666,3
w13,512,128,8,2048,768,32,32,256,1,8,3,98.0,1128.7393333333332,3
w13,512,128,8,4096,1536,16,16,256,1,4,3,48.5,4424.865000000001,3
w13,512,128,8,4096,1536,16,16,256,4,4,3,48.5,4434.0273333333325,3
w13,512,128,8,4096,1536,32,32,256,1,4,3,98.0,4451.638666666667,3
w13,512,128,8,4096,3072,16,16,256,4,4,3,48.5,8863.208333333334,3
w13,512,128,8,4096,3072,32,32,256,1,8,3,98.0,8891.635666666667,3
w13,512,128,8,4096,3072,32,32,256,1,4,3,98.0,8894.408666666666,3
w13,1024,8,2,1024,512,64,128,32,8,8,3,52.0,32.83433333333333,3
w13,1024,8,2,1024,512,64,128,32,8,8,4,64.0,33.20766666666666,3
w13,1024,8,2,1024,512,64,128,32,8,8,2,40.0,33.580999999999996,3
w13,1024,16,2,1536,768,64,128,32,8,8,3,52.0,69.77266666666667,3
w13,1024,16,2,1536,768,64,128,32,8,8,4,64.0,70.39166666666667,3
w13,1024,16,2,1536,768,64,128,64,1,8,3,88.0,71.512,3
w13,1024,16,4,1536,1024,64,64,64,32,4,4,72.0,194.99966666666668,3
w13,1024,16,4,1536,1024,64,64,64,4,4,4,72.0,197.26133333333337,3
w13,1024,16,4,1536,1024,64,64,64,32,4,3,56.0,197.46433333333337,3
w13,1024,32,4,2048,768,64,64,128,64,8,3,104.0,312.16366666666664,3
w13,1024,32,4,2048,768,64,64,128,64,8,4,136.0,313.305,3
w13,1024,32,4,2048,768,64,64,128,1,4,2,72.0,313.5183333333334,3
w13,1024,32,6,3072,1024,64,128,128,1,8,3,160.0,635.3346666666666,3
w13,1024,32,6,3072,1024,64,128,128,16,8,3,160.0,638.5986666666666,3
w13,1024,32,6,3072,1024,64,64,128,16,8,4,136.0,641.5423333333333,3
w13,1024,60,4,2048,1408,32,64,256,1,8,3,148.0,1005.6016666666666,3
w13,1024,60,4,2048,1408,32,64,256,1,4,3,148.0,1007.7776666666668,3
w13,1024,60,4,2048,1408,32,64,256,8,8,3,148.0,1008.226,3
w13,1024,60,6,3584,2304,32,64,256,8,8,3,148.0,2904.7923333333333,3
w13,1024,60,6,3584,2304,32,64,256,16,8,3,148.0,2907.725,3
w13,1024,60,6,3584,2304,32,32,128,4,4,4,66.0,2910.4449999999997,3
w13,1024,60,8,2048,1536,32,64,128,16,4,3,76.0,1170.5593333333334,3
w13,1024,60,8,2048,1536,32,64,128,16,8,3,76.0,1173.9623333333332,3
w13,1024,60,8,2048,1536,32,128,128,1,8,3,128.0,1175.594,3
w13,1024,64,6,3072,2048,32,64,128,4,4,4,100.0,2365.0306666666665,3
w13,1024,64,6,3072,2048,32,64,128,4,8,4,100.0,2366.8123333333333,3
w13,1024,64,6,3072,2048,64,64,128,1,8,4,136.0,2372.550333333333,3
w13,1024,64,6,3584,1536,32,64,256,8,8,3,148.0,2060.986666666666,3
w13,1024,64,6,3584,1536,32,64,256,8,4,3,148.0,2067.6103333333335,3
w13,1024,64,6,3584,1536,32,64,256,1,8,3,148.0,2076.955,3
w13,1024,64,8,3584,2560,32,64,256,8,8,3,148.0,3466.5220000000004,3
w13,1024,64,8,3584,2560,32,64,128,4,4,4,100.0,3474.2656666666667,3
w13,1024,64,8,3584,2560,32,64,128,4,8,4,100.0,3474.565,3
w13,1024,128,4,2048,512,16,16,256,4,4,3,48.5,755.5606666666666,3
w13,1024,128,4,2048,512,16,16,256,1,4,3,48.5,755.7953333333334,3
w13,1024,128,4,2048,512,16,32,256,16,4,3,73.0,758.8246666666668,3
w13,1024,128,6,4096,2048,32,32,256,4,8,3,98.0,5989.288666666667,3
w13,1024,128,6,4096,2048,32,32,256,4,4,3,98.0,5990.825,3
w13,1024,128,6,4096,2048,32,32,256,16,8,3,98.0,6011.187666666668,3
w13,1024,128,8,2048,768,16,32,256,32,4,3,73.0,1159.7373333333333,3
w13,1024,128,8,2048,768,16,32,256,16,4,3,73.0,1161.4756666666665,3
w13,1024,128,8,2048,768,16,32,256,64,4,3,73.0,1162.6386666666667,3
w13,1024,128,8,4096,1536,64,32,256,1,8,3,148.0,4547.0086666666675,3
w13,1024,128,8,4096,1536,16,32,256,32,4,3,73.0,4548.919333333334,3
w13,1024,128,8,4096,1536,16,32,256,64,4,3,73.0,4550.541,3
w13,1024,128,8,4096,3072,16,32,256,32,4,3,73.0,9071.167333333333,3
w13,1024,128,8,4096,3072,16,32,256,16,4,3,73.0,9071.285333333331,3
w13,1024,128,8,4096,3072,32,32,256,4,8,3,98.0,9075.263333333334,3
w13,1536,8,2,1024,512,64,128,32,8,8,3,52.0,48.77,3
w13,1536,8,2,1024,512,64,128,32,8,8,4,64.0,49.37833333333333,3
w13,1536,8,2,1024,512,64,128,64,1,8,3,88.0,50.11433333333334,3
w13,1536,16,2,1536,768,64,64,64,16,4,3,56.0,108.39666666666666,3
w13,1536,16,2,1536,768,64,64,64,64,4,3,56.0,108.397,3
w13,1536,16,2,1536,768,64,64,64,4,4,3,56.0,108.707,3
w13,1536,16,4,1536,1024,64,128,64,64,8,3,88.0,257.41066666666666,3
w13,1536,16,4,1536,1024,64,128,64,1,4,3,88.0,257.74133333333333,3
w13,1536,16,4,1536,1024,64,128,64,64,4,3,88.0,257.8376666666666,3
w13,1536,32,4,2048,768,64,64,128,64,8,4,136.0,340.7183333333333,3
w13,1536,32,4,2048,768,64,64,128,32,8,4,136.0,344.516,3
w13,1536,32,4,2048,768,64,64,128,16,8,4,136.0,345.3053333333334,3
w13,1536,32,6,3072,1024,64,128,64,1,8,3,88.0,837.9713333333333,3
w13,1536,32,6,3072,1024,64,128,64,64,8,3,88.0,843.9123333333333,3
w13,1536,32,6,3072,1024,64,128,64,1,4,3,88.0,844.4033333333333,3
w13,1536,60,4,2048,1408,32,64,256,8,8,3,148.0,1037.463,3
w13,1536,60,4,2048,1408,32,64,256,16,8,3,148.0,1039.1273333333334,3
w13,1536,60,4,2048,1408,32,64,256,32,8,3,148.0,1041.388333333333,3
w13,1536,60,6,3584,2304,64,64,128,1,4,2,72.0,3009.422666666667,3
w13,1536,60,6,3584,2304,64,128,128,1,8,3,160.0,3025.369666666667,3
w13,1536,60,6,3584,2304,64,64,128,4,4,2,72.0,3039.2369999999996,3
w13,1536,60,8,2048,1536,128,64,128,1,4,2,112.0,1279.809,3
w13,1536,60,8,2048,1536,64,128,128,4,4,2,112.0,1293.813666666667,3
w13,1536,60,8,2048,1536,128,64,128,16,4,2,112.0,1296.8863333333334,3
w13,1536,64,6,3072,2048,64,128,128,1,8,2,112.0,2464.018,3
w13,1536,64,6,3072,2048,64,64,128,1,4,2,72.0,2469.607333333334,3
w13,1536,64,6,3072,2048,64,128,128,1,4,2,112.0,2469.629,3
w13,1536,64,6,3584,1536,64,64,128,1,4,2,72.0,2172.549666666667,3
w13,1536,64,6,3584,1536,64,128,128,1,4,2,112.0,2173.8503333333333,3
w13,1536,64,6,3584,1536,64,128,128,1,8,3,160.0,2177.0293333333334,3
w13,1536,64,8,3584,2560,64,128,128,1,8,3,160.0,3589.84,3
w13,1536,64,8,3584,2560,64,128,128,1,4,3,160.0,3600.5706666666665,3
w13,1536,64,8,3584,2560,64,64,128,1,4,2,72.0,3633.807999999999,3
w13,1536,128,4,2048,512,16,32,256,16,4,3,73.0,769.4473333333334,3
w13,1536,128,4,2048,512,16,16,256,4,4,3,48.5,769.7779999999999,3
w13,1536,128,4,2048,512,32,32,256,1,8,3,98.0,770.5456666666668,3
w13,1536,128,6,4096,2048,32,32,256,4,4,4,130.0,6107.688666666666,3
w13,1536,128,6,4096,2048,32,32,128,4,4,4,66.0,6150.057333333333,3
w13,1536,128,6,4096,2048,64,32,256,1,8,2,100.0,6153.448666666667,3
w13,1536,128,8,2048,768,32,64,256,16,8,3,148.0,1197.144,3
w13,1536,128,8,2048,768,32,64,256,8,8,3,148.0,1201.3676666666668,3
w13,1536,128,8,2048,768,32,64,256,16,4,3,148.0,1202.349333333333,3
w13,1536,128,8,4096,1536,32,64,256,1,8,3,148.0,4670.987,3
w13,1536,128,8,4096,1536,32,64,256,1,4,3,148.0,4687.563333333333,3
w13,1536,128,8,4096,1536,32,32,128,1,4,4,66.0,4688.748333333333,3
w13,1536,128,8,4096,3072,64,32,128,16,8,4,100.0,9322.917,3
w13,1536,128,8,4096,3072,64,32,128,16,4,4,100.0,9328.282,3
w13,1536,128,8,4096,3072,64,32,128,16,4,3,76.0,9332.485333333332,3
w13,2048,8,2,1024,512,64,128,32,8,8,3,52.0,63.24466666666667,3
w13,2048,8,2,1024,512,64,128,32,8,8,4,64.0,64.05566666666667,3
w13,2048,8,2,1024,512,128,256,64,1,8,3,208.0,64.962,3
w13,2048,16,2,1536,768,64,64,64,32,4,3,56.0,134.38133333333334,3
w13,2048,16,2,1536,768,64,128,32,8,8,3,52.0,134.87233333333333,3
w13,2048,16,2,1536,768,64,64,64,1,4,3,56.0,134.92533333333333,3
w13,2048,16,4,1536,1024,64,128,64,64,8,3,88.0,340.36633333333333,3
w13,2048,16,4,1536,1024,64,128,64,16,8,3,88.0,340.931,3
w13,2048,16,4,1536,1024,64,128,64,1,8,3,88.0,341.539,3
w13,2048,32,4,2048,768,64,128,128,64,4,2,112.0,370.148,3
w13,2048,32,4,2048,768,64,128,128,1,4,2,112.0,371.05466666666666,3
w13,2048,32,4,2048,768,64,128,128,16,4,2,112.0,371.42800000000005,3
w13,2048,32,6,3072,1024,64,128,64,1,8,3,88.0,981.8343333333332,3
w13,2048,32,6,3072,1024,64,128,64,1,4,3,88.0,983.0933333333332,3
w13,2048,32,6,3072,1024,64,128,64,16,8,3,88.0,983.5196666666668,3
w13,2048,60,4,2048,1408,64,64,128,1,8,4,136.0,1069.974333333333,3
w13,2048,60,4,2048,1408,32,64,128,16,4,3,76.0,1079.2546666666667,3
w13,2048,60,4,2048,1408,64,128,128,1,8,3,160.0,1083.02,3
w13,2048,60,6,3584,2304,128,64,128,1,4,2,112.0,3312.787666666667,3
w13,2048,60,6,3584,2304,128,64,128,16,4,2,112.0,3325.374333333333,3
w13,2048,60,6,3584,2304,128,64,64,16,8,3,88.0,3327.881,3
w13,2048,60,8,2048,1536,64,128,64,1,8,3,88.0,1523.5436666666665,3
w13,2048,60,8,2048,1536,64,128,64,1,4,3,88.0,1527.149,3
w13,2048,60,8,2048,1536,64,128,64,64,8,3,88.0,1528.2903333333334,3
w13,2048,64,6,3072,2048,64,128,128,1,4,2,112.0,2512.9983333333334,3
w13,2048,64,6,3072,2048,64,128,128,1,8,2,112.0,2515.889333333333,3
w13,2048,64,6,3072,2048,64,64,128,1,4,2,72.0,2520.1876666666667,3
w13,2048,64,6,3584,1536,64,64,128,1,4,2,72.0,2217.5383333333334,3
w13,2048,64,6,3584,1536,64,128,128,1,8,3,160.0,2222.2423333333336,3
w13,2048,64,6,3584,1536,64,128,128,1,4,2,112.0,2222.52,3
w13,2048,64,8,3584,2560,64,128,64,16,4,3,88.0,4019.8806666666665,3
w13,2048,64,8,3584,2560,64,128,64,32,4,3,88.0,4020.349333333333,3
w13,2048,64,8,3584,2560,64,128,64,4,4,3,88.0,4021.384666666667,3
w13,2048,128,4,2048,512,32,32,256,1,8,3,98.0,781.3496666666666,3
w13,2048,128,4,2048,512,32,32,256,4,8,3,98.0,781.5736666666667,3
w13,2048,128,4,2048,512,16,32,256,1,4,3,73.0,781.8513333333334,3
w13,2048,128,6,4096,2048,64,32,256,1,8,2,100.0,6217.860333333333,3
w13,2048,128,6,4096,2048,64,32,256,1,4,2,100.0,6220.899666666667,3
w13,2048,128,6,4096,2048,32,64,128,4,4,4,100.0,6223.013666666667,3
w13,2048,128,8,2048,768,32,64,256,32,8,3,148.0,1232.8123333333333,3
w13,2048,128,8,2048,768,32,64,256,64,8,3,148.0,1234.2093333333337,3
w13,2048,128,8,2048,768,64,64,128,16,8,4,136.0,1236.5243333333333,3
w13,2048,128,8,4096,1536,32,64,256,64,8,3,148.0,4734.195333333333,3
w13,2048,128,8,4096,1536,32,64,256,64,4,3,148.0,4745.374333333333,3
w13,2048,128,8,4096,1536,32,64,256,64,8,2,100.0,4749.043333333334,3
w13,2048,128,8,4096,3072,32,64,256,32,8,3,148.0,9405.65,3
w13,2048,128,8,4096,3072,32,64,256,32,4,3,148.0,9413.757,3
w13,2048,128,8,4096,3072,32,64,256,32,8,2,100.0,9436.669,3
w13,3072,8,2,1024,512,64,64,64,64,4,3,56.0,91.47933333333332,3
w13,3072,8,2,1024,512,64,64,64,32,4,3,56.0,91.63933333333334,3
w13,3072,8,2,1024,512,64,64,64,16,4,3,56.0,91.84233333333331,3
w13,3072,16,2,1536,768,64,128,64,64,8,3,88.0,204.09866666666667,3
w13,3072,16,2,1536,768,64,128,64,4,8,3,88.0,204.2586666666667,3
w13,3072,16,2,1536,768,64,128,64,16,8,3,88.0,204.46133333333333,3
w13,3072,16,4,1536,1024,64,256,32,32,4,3,92.0,492.61133333333333,3
w13,3072,16,4,1536,1024,128,128,64,4,4,2,96.0,493.3156666666667,3
w13,3072,16,4,1536,1024,128,128,64,1,4,2,96.0,493.37999999999994,3
w13,3072,32,4,2048,768,64,128,64,4,8,3,88.0,511.5883333333333,3
w13,3072,32,4,2048,768,64,128,64,1,8,3,88.0,511.866,3
w13,3072,32,4,2048,768,64,128,64,1,4,3,88.0,512.7303333333333,3
w13,3072,32,6,3072,1024,64,128,64,1,8,3,88.0,1460.0683333333334,3
w13,3072,32,6,3072,1024,64,128,64,16,8,3,88.0,1461.284666666667,3
w13,3072,32,6,3072,1024,64,128,64,32,8,3,88.0,1461.477,3
w13,3072,60,4,2048,1408,128,64,128,1,4,2,112.0,1183.5753333333334,3
w13,3072,60,4,2048,1408,128,64,128,16,4,2,112.0,1194.562,3
w13,3072,60,4,2048,1408,64,128,128,1,4,2,112.0,1194.6263333333334,3
w13,3072,60,6,3584,2304,64,128,64,1,4,3,88.0,4040.3143333333337,3
w13,3072,60,6,3584,2304,64,128,64,64,4,3,88.0,4046.170333333333,3
w13,3072,60,6,3584,2304,64,128,64,4,4,3,88.0,4067.866666666667,3
w13,3072,60,8,2048,1536,64,128,64,1,8,3,88.0,2109.7566666666667,3
w13,3072,60,8,2048,1536,64,128,64,1,4,3,88.0,2115.2916666666665,3
w13,3072,60,8,2048,1536,64,128,64,16,8,3,88.0,2116.0496666666663,3
w13,3072,64,6,3072,2048,64,128,64,1,4,3,88.0,3240.5976666666666,3
w13,3072,64,6,3072,2048,64,128,64,64,4,3,88.0,3245.9943333333335,3
w13,3072,64,6,3072,2048,64,128,64,64,8,3,88.0,3249.2160000000003,3
w13,3072,64,6,3584,1536,64,128,64,64,4,3,88.0,2844.474,3
w13,3072,64,6,3584,1536,64,128,64,1,8,3,88.0,2845.9893333333334,3
w13,3072,64,6,3584,1536,64,128,64,64,8,3,88.0,2848.847,3
w13,3072,64,8,3584,2560,128,128,64,1,4,2,96.0,5652.906666666667,3
w13,3072,64,8,3584,2560,128,256,64,64,8,3,208.0,5656.428666666667,3
w13,3072,64,8,3584,2560,128,256,64,32,8,3,208.0,5670.22,3
w13,3072,128,4,2048,512,32,32,256,16,8,3,98.0,809.7016666666667,3
w13,3072,128,4,2048,512,32,32,256,16,8,4,130.0,810.437,3
w13,3072,128,4,2048,512,32,64,256,8,8,3,148.0,810.4476666666666,3
w13,3072,128,6,4096,2048,64,64,128,1,4,2,72.0,6468.763666666667,3
w13,3072,128,6,4096,2048,32,64,128,1,4,2,52.0,6471.132999999999,3
w13,3072,128,6,4096,2048,32,128,128,4,8,2,88.0,6485.415333333333,3
w13,3072,128,8,2048,768,64,64,128,16,8,4,136.0,1311.009,3
w13,3072,128,8,2048,768,64,64,128,32,8,4,136.0,1311.595,3
w13,3072,128,8,2048,768,64,128,128,16,8,3,160.0,1314.753,3
w13,3072,128,8,4096,1536,64,128,128,1,8,3,160.0,4965.881333333334,3
w13,3072,128,8,4096,1536,64,64,128,1,4,2,72.0,4986.489666666667,3
w13,3072,128,8,4096,1536,64,128,128,1,4,3,160.0,4989.241666666666,3
w13,3072,128,8,4096,3072,64,128,128,1,8,3,160.0,9862.005666666666,3
w13,3072,128,8,4096,3072,64,128,128,1,8,2,112.0,9963.873666666666,3
w13,3072,128,8,4096,3072,64,128,128,1,4,3,160.0,9978.359,3
w13,4096,8,2,1024,512,64,128,32,8,8,3,52.0,121.20733333333334,3
w13,4096,8,2,1024,512,64,64,64,16,4,3,56.0,121.57033333333334,3
w13,4096,8,2,1024,512,64,64,64,64,4,3,56.0,121.60233333333332,3
w13,4096,16,2,1536,768,64,128,64,1,8,3,88.0,255.075,3
w13,4096,16,2,1536,768,64,128,64,32,4,3,88.0,255.26699999999997,3
w13,4096,16,2,1536,768,64,128,64,64,4,3,88.0,255.41633333333337,3
w13,4096,16,4,1536,1024,64,128,64,1,8,3,88.0,647.6850000000001,3
w13,4096,16,4,1536,1024,64,128,64,1,4,3,88.0,650.3513333333334,3
w13,4096,16,4,1536,1024,64,128,64,16,8,3,88.0,650.3836666666667,3
w13,4096,32,4,2048,768,64,128,64,32,8,3,88.0,658.0956666666666,3
w13,4096,32,4,2048,768,64,128,64,64,8,3,88.0,658.5446666666667,3
w13,4096,32,4,2048,768,64,128,64,32,4,3,88.0,658.598,3
w13,4096,32,6,3072,1024,128,128,64,4,4,2,96.0,1911.657333333333,3
w13,4096,32,6,3072,1024,256,128,64,1,8,3,208.0,1912.1476666666667,3
w13,4096,32,6,3072,1024,128,128,64,1,4,2,96.0,1912.991,3
w13,4096,60,4,2048,1408,64,128,64,1,8,3,88.0,1401.764,3
w13,4096,60,4,2048,1408,64,128,64,1,4,3,88.0,1403.95,3
w13,4096,60,4,2048,1408,64,128,64,32,8,3,88.0,1410.2120000000002,3
w13,4096,60,6,3584,2304,64,256,64,4,4,2,112.0,5563.883666666666,3
w13,4096,60,6,3584,2304,64,128,64,1,8,3,88.0,5567.564666666666,3
w13,4096,60,6,3584,2304,64,128,64,4,4,3,88.0,5568.748333333333,3
w13,4096,60,8,2048,1536,64,256,32,8,4,3,92.0,2698.6553333333336,3
w13,4096,60,8,2048,1536,64,256,32,32,4,3,92.0,2702.837,3
w13,4096,60,8,2048,1536,64,128,64,1,8,3,88.0,2704.8853333333336,3
w13,4096,64,6,3072,2048,128,256,64,32,8,3,208.0,3832.0586666666663,3
w13,4096,64,6,3072,2048,128,256,64,16,8,3,208.0,3833.6576666666665,3
w13,4096,64,6,3072,2048,128,256,64,64,8,3,208.0,3835.333,3
w13,4096,64,6,3584,1536,128,128,64,4,4,2,96.0,3390.0156666666667,3
w13,4096,64,6,3584,1536,128,128,64,1,4,2,96.0,3393.3969999999995,3
w13,4096,64,6,3584,1536,128,128,64,64,4,2,96.0,3399.8393333333333,3
w13,4096,64,8,3584,2560,128,128,64,1,4,2,96.0,7390.308,3
w13,4096,64,8,3584,2560,128,128,64,16,4,2,96.0,7427.470333333334,3
w13,4096,64,8,3584,2560,128,128,64,8,4,2,96.0,7431.960666666667,3
w13,4096,128,4,2048,512,64,32,256,1,8,3,148.0,832.154,3
w13,4096,128,4,2048,512,32,64,256,8,8,3,148.0,834.8103333333333,3
w13,4096,128,4,2048,512,64,32,256,1,4,3,148.0,834.8633333333333,3
w13,4096,128,6,4096,2048,64,64,128,1,4,2,72.0,6585.874333333333,3
w13,4096,128,6,4096,2048,64,128,128,1,8,2,112.0,6617.116333333334,3
w13,4096,128,6,4096,2048,64,128,128,4,8,3,160.0,6630.513333333333,3
w13,4096,128,8,2048,768,64,128,128,32,4,2,112.0,1417.4403333333332,3
w13,4096,128,8,2048,768,64,128,128,1,4,2,112.0,1417.9309999999998,3
w13,4096,128,8,2048,768,64,128,128,16,4,2,112.0,1419.1576666666667,3
w13,4096,128,8,4096,1536,128,64,128,1,4,2,112.0,5429.0273333333325,3
w13,4096,128,8,4096,1536,64,128,128,1,4,2,112.0,5431.960999999999,3
w13,4096,128,8,4096,1536,128,64,128,16,4,2,112.0,5450.083333333333,3
w13,4096,128,8,4096,3072,64,128,128,64,4,2,112.0,10964.820666666668,3
w13,4096,128,8,4096,3072,64,128,128,32,4,2,112.0,10971.114333333331,3
w13,4096,128,8,4096,3072,64,128,128,16,4,2,112.0,10973.099333333332,3
