pipetuning_test/moe_dse/moe_dse_H800_99.csv
weight_type,M,E,topk,H,N,BLOCK_SIZE_M,BLOCK_SIZE_N,BLOCK_SIZE_K,GROUP_SIZE_M,num_warps,num_stages,avg_duration,sample_count
w13,1,8,2,1024,512,16,16,128,1,4,3,4.268666666666667,3
w13,1,8,2,1024,512,16,16,128,4,4,3,4.29,3
w13,1,16,2,1536,768,16,32,128,1,4,3,5.634,3
w13,1,16,2,1536,768,16,32,128,1,4,4,5.655333333333334,3
w13,1,16,2,1536,768,16,32,128,1,4,5,5.666,3
w13,1,16,2,1536,768,16,32,128,4,4,3,5.623333333333334,3
w13,1,16,2,1536,768,16,32,128,4,4,4,5.655333333333334,3
w13,1,16,2,1536,768,16,32,128,4,4,5,5.676666666666667,3
w13,1,16,2,1536,768,16,32,128,16,4,3,5.634,3
w13,1,16,2,1536,768,16,32,128,16,4,4,5.676666666666667,3
w13,1,16,2,1536,768,16,32,128,32,4,3,5.623333333333334,3
w13,1,16,2,1536,768,16,32,128,32,4,4,5.666,3
w13,1,16,2,1536,768,16,32,128,32,4,5,5.655333333333334,3
w13,1,16,2,1536,768,16,32,128,64,4,3,5.623333333333334,3
w13,1,16,2,1536,768,16,32,128,64,4,4,5.676666666666667,3
w13,1,16,2,1536,768,16,32,128,64,4,5,5.676666666666667,3
w13,1,16,4,1536,1024,16,64,128,16,8,3,6.7540000000000004,3
w13,1,16,4,1536,1024,16,64,128,16,8,4,6.807666666666666,3
w13,1,16,4,1536,1024,16,64,128,32,8,3,6.785999999999999,3
w13,1,16,4,1536,1024,16,64,128,64,8,3,6.7540000000000004,3
w13,1,16,4,1536,1024,16,64,128,64,8,4,6.797,3
w13,1,32,4,2048,768,16,64,128,16,8,3,7.938,3
w13,1,32,4,2048,768,16,64,128,32,8,3,7.948666666666667,3
w13,1,32,4,2048,768,16,64,128,32,8,4,8.002333333333334,3
w13,1,32,4,2048,768,16,64,128,64,8,3,7.927333333333333,3
w13,1,32,4,2048,768,16,64,128,64,8,4,8.002,3
w13,1,32,6,3072,1024,16,32,64,16,4,5,27.938666666666666,3
w13,1,32,6,3072,1024,16,32,64,32,4,5,27.874666666666666,3
w13,1,32,6,3072,1024,16,32,128,1,4,3,28.002333333333336,3
w13,1,32,6,3072,1024,16,32,128,1,4,5,28.012666666666664,3
w13,1,32,6,3072,1024,16,32,128,4,4,3,27.916666666666668,3
w13,1,32,6,3072,1024,16,32,128,4,4,4,27.89533333333333,3
w13,1,32,6,3072,1024,16,32,128,4,4,5,28.034000000000002,3
w13,1,32,6,3072,1024,16,32,128,16,4,3,27.981333333333335,3
w13,1,32,6,3072,1024,16,32,128,16,4,4,28.077333333333332,3
w13,1,32,6,3072,1024,16,32,128,32,4,3,28.055666666666667,3
w13,1,32,6,3072,1024,16,32,128,32,4,4,28.02333333333333,3
w13,1,60,4,2048,1408,16,32,128,16,4,4,17.698,3
w13,1,60,4,2048,1408,16,32,128,32,4,4,17.62366666666667,3
w13,1,60,4,2048,1408,16,32,128,64,4,4,17.677000000000003,3
w13,1,60,4,2048,1408,16,32,256,32,4,3,17.527666666666665,3
w13,1,60,4,2048,1408,32,32,256,16,4,3,17.527666666666665,3
w13,1,60,6,3584,2304,16,32,64,16,4,3,66.48833333333333,3
w13,1,60,6,3584,2304,16,32,64,64,4,3,66.72266666666667,3
w13,1,60,6,3584,2304,16,32,128,4,4,2,66.89266666666667,3
w13,1,60,6,3584,2304,16,32,128,16,4,2,66.466,3
w13,1,60,6,3584,2304,16,32,128,32,4,2,66.23233333333333,3
w13,1,60,8,2048,1536,16,32,64,16,4,5,36.034,3
w13,1,60,8,2048,1536,16,32,64,32,4,4,36.05533333333333,3
w13,1,60,8,2048,1536,16,32,64,32,4,5,35.853,3
w13,1,60,8,2048,1536,16,32,128,1,4,3,36.034333333333336,3
w13,1,60,8,2048,1536,16,32,128,1,4,5,36.109,3
w13,1,60,8,2048,1536,16,32,128,4,4,3,36.066,3
w13,1,60,8,2048,1536,16,32,128,4,4,4,36.20466666666667,3
w13,1,60,8,2048,1536,16,32,128,64,4,3,36.16233333333333,3
w13,1,60,8,2048,1536,16,32,256,1,4,2,36.18366666666667,3
w13,1,60,8,2048,1536,16,64,64,1,4,5,36.08766666666667,3
w13,1,60,8,2048,1536,16,64,64,32,4,5,35.949333333333335,3
w13,1,60,8,2048,1536,16,64,64,64,4,5,36.151666666666664,3
w13,1,60,8,2048,1536,16,64,128,1,4,3,35.949,3
w13,1,60,8,2048,1536,16,64,128,32,4,3,36.15133333333333,3
w13,1,60,8,2048,1536,16,64,128,32,8,5,36.034333333333336,3
w13,1,60,8,2048,1536,16,64,128,64,8,3,36.13033333333333,3
w13,1,60,8,2048,1536,16,64,128,64,8,5,36.077,3
w13,1,64,6,3072,2048,16,32,64,16,4,3,52.03466666666667,3
w13,1,64,6,3072,2048,16,32,64,32,4,5,52.108666666666664,3
w13,1,64,6,3072,2048,16,32,128,1,4,3,52.024,3
w13,1,64,6,3072,2048,16,32,128,1,4,5,52.141,3
w13,1,64,6,3072,2048,16,32,128,4,4,3,51.67166666666666,3
w13,1,64,6,3072,2048,16,32,128,32,4,2,52.077,3
w13,1,64,6,3072,2048,16,32,128,32,4,3,51.629,3
w13,1,64,6,3072,2048,16,64,64,16,4,4,51.98066666666667,3
w13,1,64,6,3072,2048,16,64,64,16,4,5,51.832,3
w13,1,64,6,3072,2048,16,64,64,16,8,4,52.14066666666667,3
w13,1,64,6,3072,2048,16,64,64,32,4,4,52.129999999999995,3
w13,1,64,6,3072,2048,16,64,64,32,4,5,51.970666666666666,3
w13,1,64,6,3072,2048,16,64,64,64,4,5,51.885,3
w13,1,64,6,3072,2048,16,64,128,1,4,3,52.034333333333336,3
w13,1,64,6,3072,2048,16,64,128,32,8,3,52.14066666666667,3
w13,1,64,6,3072,2048,16,64,128,64,8,5,52.131,3
w13,1,64,6,3584,1536,16,32,128,1,4,3,45.602,3
w13,1,64,6,3584,1536,16,32,128,4,4,3,45.495666666666665,3
w13,1,64,6,3584,1536,16,32,128,16,4,3,45.559333333333335,3
w13,1,64,6,3584,1536,16,64,128,1,4,3,45.900666666666666,3
w13,1,64,8,3584,2560,16,32,64,32,4,3,97.26166666666666,3
w13,1,64,8,3584,2560,16,64,64,1,4,3,97.30400000000002,3
w13,1,64,8,3584,2560,16,64,64,16,4,3,97.12266666666666,3
w13,1,64,8,3584,2560,16,64,64,32,4,3,96.88799999999999,3
w13,1,64,8,3584,2560,16,64,64,64,4,3,97.03766666666667,3
w13,1,64,8,3584,2560,16,64,128,1,4,2,97.283,3
w13,1,64,8,3584,2560,16,64,128,1,4,3,96.781,3
w13,1,64,8,3584,2560,16,64,128,1,8,2,97.39999999999999,3
w13,1,64,8,3584,2560,16,64,128,16,4,2,97.00533333333334,3
w13,1,64,8,3584,2560,16,64,128,16,4,3,97.05866666666667,3
w13,1,64,8,3584,2560,16,64,128,16,8,2,97.09066666666666,3
w13,1,64,8,3584,2560,16,64,128,32,4,2,97.293,3
w13,1,64,8,3584,2560,16,64,128,32,4,3,97.66666666666667,3
w13,1,64,8,3584,2560,16,64,128,32,8,2,97.46433333333333,3
w13,1,64,8,3584,2560,16,64,128,64,4,2,96.87766666666666,3
w13,1,64,8,3584,2560,16,128,128,1,8,2,97.123,3
w13,1,64,8,3584,2560,16,128,128,32,8,2,97.39999999999999,3
w13,1,64,8,3584,2560,32,64,128,4,4,2,97.67733333333332,3
w13,1,64,8,3584,2560,32,64,128,16,4,2,97.75166666666667,3
w13,1,128,4,2048,512,16,32,128,1,4,5,6.519666666666667,3
w13,1,128,4,2048,512,16,32,128,4,4,5,6.562,3
w13,1,128,4,2048,512,16,32,128,16,4,5,6.551333333333333,3
w13,1,128,4,2048,512,16,32,128,32,4,5,6.551666666666667,3
w13,1,128,4,2048,512,16,32,128,64,4,5,6.583333333333333,3
w13,1,128,6,4096,2048,16,32,128,16,4,3,67.54433333333333,3
w13,1,128,6,4096,2048,16,32,128,32,4,3,66.914,3
w13,1,128,6,4096,2048,16,32,128,64,4,3,67.10633333333334,3
w13,1,128,6,4096,2048,16,32,128,64,4,4,67.44766666666668,3
w13,1,128,6,4096,2048,16,64,128,1,4,3,67.07433333333334,3
w13,1,128,6,4096,2048,16,64,128,1,4,4,67.14966666666668,3
w13,1,128,6,4096,2048,16,64,128,32,8,3,67.586,3
w13,1,128,6,4096,2048,16,64,128,64,4,3,67.49,3
w13,1,128,8,2048,768,16,32,128,32,4,4,19.65,1
w13,1,128,8,2048,768,16,32,128,64,4,3,19.490333333333332,3
w13,1,128,8,2048,768,16,32,256,16,4,2,19.586333333333332,3
w13,1,128,8,4096,1536,16,64,128,1,4,3,67.25633333333333,3
w13,1,128,8,4096,1536,16,64,128,1,4,4,67.746,3
w13,1,128,8,4096,1536,16,64,128,16,4,3,67.76766666666667,3
w13,1,128,8,4096,1536,16,64,128,32,4,4,67.597,3
w13,1,128,8,4096,1536,16,64,128,64,8,3,67.86433333333333,3
w13,1,128,8,4096,1536,16,64,128,64,8,4,67.522,3
w13,1,128,8,4096,3072,16,32,256,1,4,5,131.4745,2
w13,1,128,8,4096,3072,16,32,256,16,4,2,131.98166666666665,3
w13,1,128,8,4096,3072,16,32,256,16,4,3,130.93633333333332,3
w13,1,128,8,4096,3072,16,32,256,16,4,5,131.76833333333335,3
w13,1,128,8,4096,3072,16,32,256,32,4,2,131.69333333333336,3
w13,1,128,8,4096,3072,16,32,256,32,4,3,131.60833333333335,3
w13,1,128,8,4096,3072,16,32,256,32,4,5,131.40566666666666,3
w13,1,128,8,4096,3072,16,32,256,64,4,2,131.907,3
w13,1,128,8,4096,3072,16,32,256,64,4,3,130.84033333333332,3
w13,1,128,8,4096,3072,16,32,256,64,4,5,131.405,3
w13,1,128,8,4096,3072,16,64,128,1,4,2,131.06366666666668,3
w13,1,128,8,4096,3072,16,64,128,1,4,4,130.819,3
w13,1,128,8,4096,3072,16,64,128,1,4,5,131.395,3
w13,1,128,8,4096,3072,16,64,128,1,8,4,132.10933333333332,3
w13,1,128,8,4096,3072,16,64,128,1,8,5,131.30966666666666,3
w13,1,128,8,4096,3072,16,64,128,16,4,4,130.9466666666667,3
w13,1,128,8,4096,3072,16,64,128,16,4,5,131.24566666666666,3
w13,1,128,8,4096,3072,16,64,128,16,8,5,130.8083333333333,3
w13,1,128,8,4096,3072,16,64,128,32,4,4,131.56566666666666,3
w13,1,128,8,4096,3072,16,64,128,32,4,5,131.07500000000002,3
w13,1,128,8,4096,3072,16,64,128,32,8,4,131.53366666666668,3
w13,1,128,8,4096,3072,16,64,128,32,8,5,130.904,3
w13,1,128,8,4096,3072,16,64,128,64,4,4,130.851,3
w13,1,128,8,4096,3072,16,64,128,64,4,5,131.299,3
w13,1,128,8,4096,3072,16,64,128,64,8,4,131.39466666666667,3
w13,1,128,8,4096,3072,16,64,128,64,8,5,131.66166666666666,3
w13,1,128,8,4096,3072,16,64,256,1,4,2,132.067,3
w13,1,128,8,4096,3072,16,64,256,1,4,3,132.07766666666666,3
w13,1,128,8,4096,3072,16,64,256,1,8,2,132.08833333333334,3
w13,1,128,8,4096,3072,16,64,256,1,8,3,131.61933333333334,3
w13,1,128,8,4096,3072,16,64,256,16,4,3,131.82166666666666,3
w13,1,128,8,4096,3072,16,64,256,16,8,3,131.62966666666668,3
w13,1,128,8,4096,3072,16,64,256,32,4,3,131.49099999999999,3
w13,1,128,8,4096,3072,16,64,256,32,8,2,131.80033333333336,3
w13,1,128,8,4096,3072,16,64,256,64,4,3,131.94966666666667,3
w13,1,128,8,4096,3072,16,64,256,64,8,3,131.70399999999998,3
w13,1,128,8,4096,3072,16,128,128,1,8,5,131.70433333333332,3
w13,1,128,8,4096,3072,16,128,128,16,8,5,131.98166666666665,3
w13,1,128,8,4096,3072,16,128,128,32,8,5,132.10999999999999,3
w13,1,128,8,4096,3072,32,32,128,1,4,4,132.00300000000001,3
w13,1,128,8,4096,3072,64,64,128,1,4,3,131.55533333333332,3
w13,2,8,2,1024,512,16,32,128,1,4,3,4.673333333333333,3
w13,2,8,2,1024,512,16,32,128,4,4,3,4.695333333333334,3
w13,2,8,2,1024,512,16,32,128,16,4,3,4.674,3
w13,2,8,2,1024,512,16,32,128,32,4,3,4.695,3
w13,2,8,2,1024,512,16,32,128,64,4,3,4.674,3
w13,2,16,2,1536,768,16,64,128,16,8,3,6.733333333333333,3
w13,2,16,2,1536,768,16,64,128,16,8,4,6.754333333333332,3
w13,2,16,2,1536,768,16,64,128,32,8,3,6.7749999999999995,3
w13,2,16,2,1536,768,16,64,128,64,8,3,6.764666666666667,3
w13,2,16,4,1536,1024,16,32,256,16,4,2,19.031666666666666,3
w13,2,32,4,2048,768,16,32,64,16,4,5,19.511666666666667,3
w13,2,32,4,2048,768,16,32,128,4,4,3,19.490333333333332,3
w13,2,32,4,2048,768,16,32,128,16,4,4,19.415333333333333,3
w13,2,32,4,2048,768,16,32,128,64,4,3,19.575666666666667,3
w13,2,32,4,2048,768,16,32,128,64,4,4,19.500666666666664,3
w13,2,32,4,2048,768,16,32,256,16,4,2,19.447333333333333,3
w13,2,32,4,2048,768,16,32,256,32,4,2,19.564666666666668,3
w13,2,32,4,2048,768,16,128,64,1,8,5,19.383666666666667,3
w13,2,32,4,2048,768,16,128,64,32,8,5,19.511666666666667,3
w13,2,32,6,3072,1024,16,32,64,32,4,3,52.14166666666667,3
w13,2,32,6,3072,1024,16,32,64,64,4,3,52.141,3
w13,2,32,6,3072,1024,16,32,128,1,4,3,51.96033333333333,3
w13,2,32,6,3072,1024,16,32,128,1,4,5,52.098000000000006,3
w13,2,32,6,3072,1024,16,32,128,4,4,3,51.981,3
w13,2,32,6,3072,1024,16,32,128,16,4,5,51.992,3
w13,2,32,6,3072,1024,16,32,128,32,4,3,51.63933333333333,3
w13,2,32,6,3072,1024,16,64,64,16,4,5,51.842666666666666,3
w13,2,32,6,3072,1024,16,64,64,64,4,5,52.05566666666667,3
w13,2,32,6,3072,1024,16,64,128,1,4,3,51.959333333333326,3
w13,2,32,6,3072,1024,16,64,128,1,8,3,52.077,3
w13,2,32,6,3072,1024,16,64,128,1,8,5,51.78933333333333,3
w13,2,32,6,3072,1024,16,64,128,16,4,3,51.629,3
w13,2,32,6,3072,1024,16,64,128,16,8,3,51.83133333333333,3
w13,2,32,6,3072,1024,16,64,128,32,4,3,51.90633333333333,3
w13,2,32,6,3072,1024,16,64,128,64,4,3,51.94866666666667,3
w13,2,32,6,3072,1024,16,64,128,64,8,3,51.800000000000004,3
w13,2,60,4,2048,1408,16,32,128,4,4,2,32.589,3
w13,2,60,4,2048,1408,16,32,128,16,4,2,32.663666666666664,3
w13,2,60,4,2048,1408,16,64,64,32,4,3,32.876666666666665,3
w13,2,60,4,2048,1408,16,64,64,32,8,3,32.855333333333334,3
w13,2,60,4,2048,1408,16,64,128,16,8,2,32.727666666666664,3
w13,2,60,4,2048,1408,16,64,128,64,4,2,32.845,3
w13,2,60,6,3584,2304,16,32,128,1,4,3,129.61333333333334,3
w13,2,60,6,3584,2304,16,32,128,4,4,3,129.54966666666667,3
w13,2,60,6,3584,2304,16,32,128,16,4,3,129.56033333333335,3
w13,2,60,6,3584,2304,16,32,128,32,4,3,130.39233333333334,3
w13,2,60,6,3584,2304,16,32,128,64,4,3,129.624,3
w13,2,60,6,3584,2304,16,64,128,1,4,2,130.14700000000002,3
w13,2,60,6,3584,2304,16,64,128,16,4,2,129.47466666666665,3
w13,2,60,6,3584,2304,16,64,128,16,4,3,130.584,3
w13,2,60,6,3584,2304,16,64,128,32,4,2,129.49633333333335,3
w13,2,60,6,3584,2304,16,64,128,64,4,2,130.019,3
w13,2,60,6,3584,2304,16,64,256,16,4,2,130.16833333333332,3
w13,2,60,8,2048,1536,16,32,64,1,4,3,67.618,3
w13,2,60,8,2048,1536,16,32,128,1,4,5,68.01299999999999,3
w13,2,60,8,2048,1536,16,32,128,16,4,5,68.01266666666668,3
w13,2,60,8,2048,1536,16,32,128,32,4,5,67.95966666666668,3
w13,2,60,8,2048,1536,16,64,64,16,4,3,67.533,3
w13,2,60,8,2048,1536,16,64,64,32,4,3,67.971,3
w13,2,60,8,2048,1536,16,64,64,64,4,3,67.35199999999999,3
w13,2,60,8,2048,1536,16,64,128,1,4,2,67.86333333333333,3
w13,2,60,8,2048,1536,16,64,128,1,8,5,68.01299999999999,3
w13,2,60,8,2048,1536,16,64,128,16,4,2,67.92766666666667,3
w13,2,60,8,2048,1536,16,64,128,32,4,2,67.55466666666666,3
w13,2,60,8,2048,1536,16,64,128,64,4,2,67.45833333333333,3
w13,2,60,8,2048,1536,16,128,64,1,8,3,67.67200000000001,3
w13,2,60,8,2048,1536,16,128,64,16,8,3,67.98133333333332,3
w13,2,60,8,2048,1536,16,128,128,1,8,2,67.91733333333333,3
w13,2,60,8,2048,1536,16,128,128,32,8,2,67.99133333333333,3
w13,2,64,6,3072,2048,16,64,64,1,4,3,99.427,3
w13,2,64,6,3072,2048,16,64,64,32,4,3,99.67200000000001,3
w13,2,64,6,3072,2048,16,64,128,1,4,2,99.66133333333333,3
w13,2,64,6,3072,2048,16,64,128,1,4,4,99.72533333333332,3
w13,2,64,6,3072,2048,16,64,128,16,4,2,99.76833333333333,3
w13,2,64,6,3072,2048,16,64,128,32,4,2,98.82933333333334,3
w13,2,64,6,3072,2048,16,64,128,64,4,2,99.55466666666666,3
w13,2,64,6,3072,2048,16,128,128,1,8,2,99.469,3
w13,2,64,6,3072,2048,16,128,128,1,8,4,99.57600000000001,3
w13,2,64,6,3584,1536,16,32,64,1,4,3,87.682,3
w13,2,64,6,3584,1536,16,32,64,64,4,3,87.40533333333333,3
w13,2,64,6,3584,1536,16,32,128,1,4,2,86.93599999999999,3
w13,2,64,6,3584,1536,16,32,128,4,4,2,87.28800000000001,3
w13,2,64,6,3584,1536,16,32,128,16,4,2,86.96833333333332,3
w13,2,64,6,3584,1536,16,32,128,32,4,2,87.608,3
w13,2,64,6,3584,1536,16,32,128,64,4,2,87.13833333333334,3
w13,2,64,6,3584,1536,16,64,64,16,4,3,87.46933333333334,3
w13,2,64,6,3584,1536,16,64,64,32,4,3,87.28800000000001,3
w13,2,64,6,3584,1536,16,64,64,64,4,3,87.37333333333333,3
w13,2,64,6,3584,1536,16,64,128,1,4,2,87.45866666666666,3
w13,2,64,6,3584,1536,16,64,128,1,8,2,87.51233333333334,3
w13,2,64,6,3584,1536,16,64,128,16,4,2,87.59733333333334,3
w13,2,64,6,3584,1536,16,64,128,32,4,2,87.181,3
w13,2,64,6,3584,1536,16,64,128,64,4,2,87.70366666666666,3
w13,2,64,8,3584,2560,16,32,128,1,4,5,189.19766666666666,3
w13,2,64,8,3584,2560,16,32,128,4,4,5,189.97633333333332,3
w13,2,64,8,3584,2560,16,32,128,16,4,5,190.24333333333334,3
w13,2,64,8,3584,2560,16,32,128,64,4,5,189.71,3
w13,2,64,8,3584,2560,16,32,256,1,4,3,189.62466666666668,3
w13,2,64,8,3584,2560,16,32,256,16,4,3,188.8456666666667,3
w13,2,64,8,3584,2560,16,32,256,32,4,3,190.20033333333333,3
w13,2,64,8,3584,2560,16,32,256,64,4,3,189.5713333333333,3
w13,2,64,8,3584,2560,16,32,256,64,4,4,190.19066666666666,3
w13,2,64,8,3584,2560,16,64,128,1,4,3,189.38966666666667,3
w13,2,64,8,3584,2560,16,64,128,1,4,5,189.58233333333337,3
w13,2,64,8,3584,2560,16,64,128,1,8,2,188.97366666666667,3
w13,2,64,8,3584,2560,16,64,128,1,8,5,189.13433333333333,3
w13,2,64,8,3584,2560,16,64,128,16,4,3,189.35866666666666,3
w13,2,64,8,3584,2560,16,64,128,16,4,5,189.571,3
w13,2,64,8,3584,2560,16,64,128,16,8,2,188.81433333333334,3
w13,2,64,8,3584,2560,16,64,128,16,8,5,190.09366666666665,3
w13,2,64,8,3584,2560,16,64,128,32,4,3,188.86766666666665,3
w13,2,64,8,3584,2560,16,64,128,32,4,5,189.94433333333333,3
w13,2,64,8,3584,2560,16,64,128,32,8,2,189.05966666666666,3
w13,2,64,8,3584,2560,16,64,128,32,8,5,190.115,3
w13,2,64,8,3584,2560,16,64,128,64,4,3,189.155,3
w13,2,64,8,3584,2560,16,64,128,64,4,5,189.44366666666667,3
w13,2,64,8,3584,2560,16,64,128,64,8,2,189.44333333333336,3
w13,2,64,8,3584,2560,16,64,128,64,8,5,190.04133333333334,3
w13,2,64,8,3584,2560,16,64,256,1,8,3,188.37633333333335,3
w13,2,64,8,3584,2560,16,64,256,16,4,3,189.88033333333337,3
w13,2,64,8,3584,2560,16,64,256,16,8,3,188.97366666666667,3
w13,2,64,8,3584,2560,16,64,256,32,4,3,189.70966666666666,3
w13,2,64,8,3584,2560,16,64,256,32,8,3,188.63266666666667,3
w13,2,64,8,3584,2560,16,64,256,64,4,3,189.817,3
w13,2,64,8,3584,2560,16,64,256,64,8,3,189.32633333333334,3
w13,2,64,8,3584,2560,16,128,128,1,8,5,188.8456666666667,3
w13,2,64,8,3584,2560,16,128,128,16,8,5,189.5716666666667,3
w13,2,64,8,3584,2560,16,128,128,32,8,5,189.64666666666668,3
w13,2,64,8,3584,2560,16,128,128,64,8,5,190.15833333333333,3
w13,2,64,8,3584,2560,32,64,128,1,4,2,189.3886666666667,3
w13,2,64,8,3584,2560,32,64,128,4,4,2,189.975,3
w13,2,64,8,3584,2560,32,64,128,16,4,2,190.26333333333332,3
w13,2,64,8,3584,2560,32,64,128,32,4,2,189.78333333333333,3
w13,2,64,8,3584,2560,32,64,128,64,4,2,190.02866666666668,3
w13,2,128,4,2048,512,16,64,128,16,8,3,8.119333333333335,3
w13,2,128,4,2048,512,16,64,128,16,8,4,8.130333333333335,3
w13,2,128,4,2048,512,16,64,128,32,8,4,8.119,3
w13,2,128,4,2048,512,16,64,128,64,8,4,8.13,3
w13,2,128,4,2048,512,16,64,128,64,8,5,8.162,3
w13,2,128,6,4096,2048,16,32,128,1,4,4,132.00266666666667,3
w13,2,128,6,4096,2048,16,32,128,1,4,5,131.0536666666667,3
w13,2,128,6,4096,2048,16,32,128,4,4,4,131.54433333333336,3
w13,2,128,6,4096,2048,16,32,128,4,4,5,131.55499999999998,3
w13,2,128,6,4096,2048,16,32,128,16,4,5,131.25633333333334,3
w13,2,128,6,4096,2048,16,32,128,32,4,4,131.97066666666666,3
w13,2,128,6,4096,2048,16,32,128,32,4,5,131.608,3
w13,2,128,6,4096,2048,16,32,128,64,4,4,132.34433333333334,3
w13,2,128,6,4096,2048,16,32,128,64,4,5,131.50166666666667,3
w13,2,128,6,4096,2048,16,32,256,1,4,3,131.57633333333334,3
w13,2,128,6,4096,2048,16,32,256,16,4,3,131.62933333333334,3
w13,2,128,6,4096,2048,16,32,256,32,4,3,131.64000000000001,3
w13,2,128,6,4096,2048,16,32,256,32,4,5,132.36566666666667,3
w13,2,128,6,4096,2048,16,32,256,64,4,3,131.99233333333333,3
w13,2,128,6,4096,2048,16,64,128,1,4,4,131.51233333333334,3
w13,2,128,6,4096,2048,16,64,128,1,4,5,131.64,3
w13,2,128,6,4096,2048,16,64,128,1,8,5,131.8,3
w13,2,128,6,4096,2048,16,64,128,16,4,4,132.07766666666666,3
w13,2,128,6,4096,2048,16,64,128,16,4,5,131.86433333333332,3
w13,2,128,6,4096,2048,16,64,128,16,8,5,131.44833333333335,3
w13,2,128,6,4096,2048,16,64,128,32,4,2,132.16266666666667,3
w13,2,128,6,4096,2048,16,64,128,32,4,4,132.15233333333333,3
w13,2,128,6,4096,2048,16,64,128,32,4,5,131.07466666666667,3
w13,2,128,6,4096,2048,16,64,128,32,8,5,132.14133333333334,3
w13,2,128,6,4096,2048,16,64,128,64,4,4,131.544,3
w13,2,128,6,4096,2048,16,64,128,64,4,5,131.49066666666667,3
w13,2,128,6,4096,2048,16,64,128,64,8,4,131.58666666666667,3
w13,2,128,6,4096,2048,16,64,128,64,8,5,132.24833333333333,3
w13,2,128,6,4096,2048,16,64,256,1,4,3,131.45833333333334,3
w13,2,128,6,4096,2048,16,64,256,1,4,5,131.98166666666665,3
w13,2,128,6,4096,2048,16,64,256,1,8,3,132.36533333333333,3
w13,2,128,6,4096,2048,16,64,256,16,4,3,131.56566666666666,3
w13,2,128,6,4096,2048,16,64,256,16,8,3,132.17333333333332,3
w13,2,128,6,4096,2048,16,64,256,32,4,3,131.608,3
w13,2,128,6,4096,2048,16,64,256,32,8,3,131.992,3
w13,2,128,6,4096,2048,16,64,256,64,4,3,131.53366666666668,3
w13,2,128,6,4096,2048,16,64,256,64,8,3,132.04566666666668,3
w13,2,128,6,4096,2048,16,128,128,1,8,5,132.05633333333333,3
w13,2,128,6,4096,2048,16,128,128,32,8,5,132.131,3
w13,2,128,6,4096,2048,16,128,128,64,8,5,132.03433333333334,3
w13,2,128,6,4096,2048,64,64,64,1,4,5,131.984,3
w13,2,128,8,2048,768,16,32,128,1,4,3,35.54366666666667,3
w13,2,128,8,2048,768,16,32,128,1,4,5,35.394,3
w13,2,128,8,2048,768,16,32,128,16,4,2,35.68233333333333,3
w13,2,128,8,2048,768,16,64,64,1,4,5,35.72466666666667,3
w13,2,128,8,2048,768,16,64,64,32,4,4,35.629,3
w13,2,128,8,2048,768,16,64,64,32,4,5,35.714333333333336,3
w13,2,128,8,2048,768,16,64,64,64,4,5,35.746,3
w13,2,128,8,2048,768,16,64,128,1,4,3,35.69266666666667,3
w13,2,128,8,2048,768,16,64,128,16,4,3,35.55433333333333,3
w13,2,128,8,2048,768,16,64,128,64,4,3,35.660666666666664,3
w13,2,128,8,4096,1536,16,32,128,1,4,4,131.79999999999998,3
w13,2,128,8,4096,1536,16,32,128,1,4,5,131.22400000000002,3
w13,2,128,8,4096,1536,16,32,128,4,4,4,132.02433333333332,3
w13,2,128,8,4096,1536,16,32,128,4,4,5,131.68266666666668,3
w13,2,128,8,4096,1536,16,32,128,16,4,5,131.203,3
w13,2,128,8,4096,1536,16,32,128,32,4,4,132.02433333333335,3
w13,2,128,8,4096,1536,16,32,128,32,4,5,131.03233333333333,3
w13,2,128,8,4096,1536,16,32,128,64,4,4,131.757,3
w13,2,128,8,4096,1536,16,32,128,64,4,5,131.32033333333334,3
w13,2,128,8,4096,1536,16,32,256,1,4,2,131.50133333333335,3
w13,2,128,8,4096,1536,16,32,256,1,4,3,131.12833333333333,3
w13,2,128,8,4096,1536,16,32,256,1,4,5,131.395,3
w13,2,128,8,4096,1536,16,32,256,16,4,2,131.96,3
w13,2,128,8,4096,1536,16,32,256,16,4,3,131.26633333333334,3
w13,2,128,8,4096,1536,16,32,256,32,4,2,131.83233333333334,3
w13,2,128,8,4096,1536,16,32,256,32,4,3,131.29866666666666,3
w13,2,128,8,4096,1536,16,32,256,64,4,2,131.8853333333333,3
w13,2,128,8,4096,1536,16,32,256,64,4,3,131.448,3
w13,2,128,8,4096,1536,16,64,128,1,4,4,131.21333333333334,3
w13,2,128,8,4096,1536,16,64,128,1,4,5,130.72233333333335,3
w13,2,128,8,4096,1536,16,64,128,1,8,4,132.01333333333332,3
w13,2,128,8,4096,1536,16,64,128,16,4,4,130.96766666666667,3
w13,2,128,8,4096,1536,16,64,128,16,4,5,131.37333333333333,3
w13,2,128,8,4096,1536,16,64,128,16,8,5,131.65099999999998,3
w13,2,128,8,4096,1536,16,64,128,32,4,2,131.91733333333335,3
w13,2,128,8,4096,1536,16,64,128,32,4,4,131.10666666666668,3
w13,2,128,8,4096,1536,16,64,128,32,4,5,131.06366666666668,3
w13,2,128,8,4096,1536,16,64,128,32,8,4,131.87466666666668,3
w13,2,128,8,4096,1536,16,64,128,32,8,5,131.91733333333335,3
w13,2,128,8,4096,1536,16,64,128,64,4,4,131.00033333333332,3
w13,2,128,8,4096,1536,16,64,128,64,4,5,130.81833333333333,3
w13,2,128,8,4096,1536,16,64,128,64,8,5,131.63966666666667,3
w13,2,128,8,4096,1536,16,64,256,1,4,3,131.864,3
w13,2,128,8,4096,1536,16,64,256,16,4,3,131.53333333333333,3
w13,2,128,8,4096,1536,16,64,256,16,8,2,131.64000000000001,3
w13,2,128,8,4096,1536,16,64,256,16,8,3,131.48033333333333,3
w13,2,128,8,4096,1536,16,64,256,32,4,3,131.87466666666668,3
w13,2,128,8,4096,1536,16,64,256,64,4,3,131.736,3
w13,2,128,8,4096,1536,16,64,256,64,8,3,132.035,3
w13,2,128,8,4096,1536,16,128,128,1,8,2,131.66166666666666,3
w13,2,128,8,4096,1536,16,128,128,1,8,5,131.99233333333333,3
w13,2,128,8,4096,1536,32,32,128,1,4,3,131.96,3
w13,2,128,8,4096,3072,16,32,128,1,4,5,257.849,3
w13,2,128,8,4096,3072,16,32,128,4,4,5,257.8706666666667,3
w13,2,128,8,4096,3072,16,32,128,16,4,5,258.11566666666664,3
w13,2,128,8,4096,3072,16,32,128,32,4,5,257.03833333333336,3
w13,2,128,8,4096,3072,16,32,128,64,4,5,257.316,3
w13,2,128,8,4096,3072,16,32,256,1,4,2,257.82800000000003,3
w13,2,128,8,4096,3072,16,32,256,1,4,3,257.572,3
w13,2,128,8,4096,3072,16,32,256,1,4,4,257.77466666666663,3
w13,2,128,8,4096,3072,16,32,256,16,4,2,258.57466666666664,3
w13,2,128,8,4096,3072,16,32,256,16,4,3,257.5183333333334,3
w13,2,128,8,4096,3072,16,32,256,16,4,4,258.51033333333334,3
w13,2,128,8,4096,3072,16,32,256,16,4,5,258.4783333333333,3
w13,2,128,8,4096,3072,16,32,256,32,4,2,258.40366666666665,3
w13,2,128,8,4096,3072,16,32,256,32,4,3,258.1583333333333,3
w13,2,128,8,4096,3072,16,32,256,32,4,4,258.745,3
w13,2,128,8,4096,3072,16,32,256,64,4,3,256.9213333333333,3
w13,2,128,8,4096,3072,16,32,256,64,4,4,258.6166666666667,3
w13,2,128,8,4096,3072,16,32,256,64,4,5,257.593,3
w13,2,128,8,4096,3072,16,64,128,1,4,4,258.04133333333334,3
w13,2,128,8,4096,3072,16,64,128,1,4,5,256.23833333333334,3
w13,2,128,8,4096,3072,16,64,128,1,8,3,258.24399999999997,3
w13,2,128,8,4096,3072,16,64,128,1,8,4,258.41433333333333,3
w13,2,128,8,4096,3072,16,64,128,1,8,5,257.1023333333333,3
w13,2,128,8,4096,3072,16,64,128,16,4,4,258.06233333333336,3
w13,2,128,8,4096,3072,16,64,128,16,4,5,257.0596666666667,3
w13,2,128,8,4096,3072,16,64,128,16,8,5,257.348,3
w13,2,128,8,4096,3072,16,64,128,32,4,4,258.425,3
w13,2,128,8,4096,3072,16,64,128,32,4,5,256.7716666666667,3
w13,2,128,8,4096,3072,16,64,128,32,8,5,258.36066666666665,3
w13,2,128,8,4096,3072,16,64,128,64,4,5,256.61133333333333,3
w13,2,128,8,4096,3072,16,64,128,64,8,5,258.10566666666665,3
w13,2,128,8,4096,3072,16,64,256,1,4,2,257.71066666666667,3
w13,2,128,8,4096,3072,16,64,256,1,4,3,256.65433333333334,3
w13,2,128,8,4096,3072,16,64,256,1,4,5,258.1263333333333,3
w13,2,128,8,4096,3072,16,64,256,1,8,2,258.29733333333337,3
w13,2,128,8,4096,3072,16,64,256,1,8,3,257.828,3
w13,2,128,8,4096,3072,16,64,256,16,4,3,257.25166666666667,3
w13,2,128,8,4096,3072,16,64,256,16,4,5,258.6703333333333,3
w13,2,128,8,4096,3072,16,64,256,16,8,3,257.7853333333333,3
w13,2,128,8,4096,3072,16,64,256,32,4,3,257.47566666666665,3
w13,2,128,8,4096,3072,16,64,256,32,4,5,258.32933333333335,3
w13,2,128,8,4096,3072,16,64,256,32,8,3,257.529,3
w13,2,128,8,4096,3072,16,64,256,64,4,3,257.48633333333333,3
w13,2,128,8,4096,3072,16,64,256,64,4,5,258.49966666666666,3
w13,2,128,8,4096,3072,16,64,256,64,8,3,257.796,3
w13,2,128,8,4096,3072,16,128,128,1,4,4,258.393,3
w13,2,128,8,4096,3072,16,128,128,1,4,5,258.596,3
w13,2,128,8,4096,3072,16,128,128,1,8,2,258.64933333333335,3
w13,2,128,8,4096,3072,16,128,128,1,8,4,257.9556666666667,3
w13,2,128,8,4096,3072,16,128,128,1,8,5,257.2196666666667,3
w13,2,128,8,4096,3072,16,128,128,16,8,5,257.74233333333336,3
w13,2,128,8,4096,3072,16,128,128,32,8,5,257.156,3
w13,2,128,8,4096,3072,16,128,128,64,8,5,257.593,3
w13,2,128,8,4096,3072,32,32,128,4,4,4,258.067,3
w13,2,128,8,4096,3072,32,128,128,1,4,3,258.17966666666666,3
w13,2,128,8,4096,3072,32,128,128,1,8,3,258.73466666666667,3
w13,2,128,8,4096,3072,32,128,128,1,8,4,258.59633333333335,3
w13,2,128,8,4096,3072,64,64,128,1,4,3,258.513,3
w13,2,128,8,4096,3072,64,64,128,16,8,3,258.75399999999996,3
w13,2,128,8,4096,3072,64,64,128,32,8,3,258.737,3
w13,2,128,8,4096,3072,64,128,128,1,8,4,257.603,3
w13,2,128,8,4096,3072,64,128,128,4,8,4,258.4653333333333,3
w13,2,128,8,4096,3072,64,128,128,32,8,4,258.53333333333336,3
w13,2,128,8,4096,3072,64,128,128,64,8,4,258.62899999999996,3
w13,4,8,2,1024,512,16,64,128,16,8,3,5.442,3
w13,4,8,2,1024,512,16,64,128,32,8,3,5.4526666666666666,3
w13,4,8,2,1024,512,16,64,128,32,8,4,5.495333333333334,3
w13,4,8,2,1024,512,16,64,128,64,8,3,5.442,3
w13,4,16,2,1536,768,16,32,128,4,4,3,9.181666666666667,3
w13,4,16,2,1536,768,16,32,128,32,4,3,9.149666666666667,3
w13,4,16,2,1536,768,16,32,128,64,4,3,9.192,3
w13,4,16,2,1536,768,16,128,64,1,8,4,9.235333333333335,3
w13,4,16,4,1536,1024,16,32,64,1,4,3,35.916666666666664,3
w13,4,16,4,1536,1024,16,32,64,16,4,3,35.832,3
w13,4,16,4,1536,1024,16,32,64,32,4,3,35.92766666666667,3
w13,4,16,4,1536,1024,16,32,64,64,4,3,35.949000000000005,3
w13,4,16,4,1536,1024,16,32,128,1,4,2,35.916666666666664,3
w13,4,16,4,1536,1024,16,32,128,4,4,2,35.778,3
w13,4,16,4,1536,1024,16,32,128,16,4,3,35.99133333333334,3
w13,4,16,4,1536,1024,16,32,128,32,4,2,35.682,3
w13,4,16,4,1536,1024,16,32,128,64,4,2,35.842666666666666,3
w13,4,16,4,1536,1024,16,64,64,1,4,3,35.92733333333334,3
w13,4,16,4,1536,1024,16,64,64,1,8,3,35.821333333333335,3
w13,4,16,4,1536,1024,16,64,64,16,4,3,36.002,3
w13,4,16,4,1536,1024,16,64,64,32,4,3,36.034,3
w13,4,16,4,1536,1024,16,64,64,32,8,3,35.949000000000005,3
w13,4,16,4,1536,1024,16,64,64,64,4,3,35.99166666666667,3
w13,4,16,4,1536,1024,16,64,128,1,8,2,35.95966666666667,3
w13,4,16,4,1536,1024,16,64,128,16,4,2,35.99133333333334,3
w13,4,16,4,1536,1024,16,64,128,32,8,2,36.013,3
w13,4,16,4,1536,1024,64,64,64,64,4,3,35.98133333333334,3
w13,4,32,4,2048,768,16,32,128,1,4,3,35.65,3
w13,4,32,4,2048,768,16,32,128,16,4,2,35.70333333333333,3
w13,4,32,4,2048,768,16,64,64,1,4,4,35.63933333333333,3
w13,4,32,4,2048,768,16,64,64,64,8,3,35.650333333333336,3
w13,4,32,4,2048,768,16,64,128,1,8,5,35.629,3
w13,4,32,4,2048,768,16,64,128,16,4,4,35.746,3
w13,4,32,4,2048,768,16,64,128,32,4,3,35.81033333333334,3
w13,4,32,4,2048,768,16,64,128,64,4,3,35.693000000000005,3
w13,4,32,4,2048,768,16,64,128,64,8,3,35.458333333333336,3
w13,4,32,6,3072,1024,16,32,128,1,4,5,99.76833333333333,3
w13,4,32,6,3072,1024,16,32,128,32,4,5,99.87433333333333,3
w13,4,32,6,3072,1024,16,32,128,64,4,4,100.06666666666666,3
w13,4,32,6,3072,1024,16,32,128,64,4,5,100.05566666666668,3
w13,4,32,6,3072,1024,16,32,256,1,4,3,99.59766666666667,3
w13,4,32,6,3072,1024,16,32,256,16,4,3,100.08766666666668,3
w13,4,32,6,3072,1024,16,32,256,32,4,2,99.74666666666667,3
w13,4,32,6,3072,1024,16,32,256,32,4,3,99.74666666666667,3
w13,4,32,6,3072,1024,16,32,256,64,4,2,100.03466666666667,3
w13,4,32,6,3072,1024,16,32,256,64,4,3,100.03500000000001,3
w13,4,32,6,3072,1024,16,64,64,1,4,3,100.04566666666666,3
w13,4,32,6,3072,1024,16,64,64,32,4,3,100.098,3
w13,4,32,6,3072,1024,16,64,64,64,4,3,99.72533333333332,3
w13,4,32,6,3072,1024,16,64,128,1,4,2,99.98066666666666,3
w13,4,32,6,3072,1024,16,64,128,1,4,4,100.024,3
w13,4,32,6,3072,1024,16,64,128,1,4,5,100.13066666666667,3
w13,4,32,6,3072,1024,16,64,128,16,4,2,99.51166666666667,3
w13,4,32,6,3072,1024,16,64,128,16,8,4,99.78966666666668,3
w13,4,32,6,3072,1024,16,64,128,32,4,4,99.73566666666666,3
w13,4,32,6,3072,1024,16,64,128,32,4,5,100.08766666666666,3
w13,4,32,6,3072,1024,16,64,128,64,4,4,99.34133333333334,3
w13,4,32,6,3072,1024,16,64,128,64,8,4,99.96,3
w13,4,32,6,3072,1024,16,128,128,1,8,2,99.84266666666667,3
w13,4,32,6,3072,1024,16,128,128,1,8,4,99.52233333333334,3
w13,4,32,6,3072,1024,16,128,128,16,8,2,100.06700000000001,3
w13,4,32,6,3072,1024,16,128,128,32,8,4,99.52300000000001,3
w13,4,32,6,3072,1024,16,128,128,64,8,4,99.17033333333332,3
w13,4,60,4,2048,1408,16,32,64,1,4,3,62.797666666666665,3
w13,4,60,4,2048,1408,16,32,64,16,4,3,62.87199999999999,3
w13,4,60,4,2048,1408,16,32,64,64,4,3,62.61600000000001,3
w13,4,60,4,2048,1408,16,64,64,1,4,3,62.89366666666666,3
w13,4,60,4,2048,1408,16,64,64,32,4,3,62.711999999999996,3
w13,4,60,4,2048,1408,16,64,64,64,4,3,63.00066666666667,3
w13,4,60,4,2048,1408,16,64,128,1,4,2,62.82966666666667,3
w13,4,60,4,2048,1408,16,64,128,16,4,2,62.413000000000004,3
w13,4,60,4,2048,1408,16,64,128,32,4,2,62.57366666666667,3
w13,4,60,4,2048,1408,16,64,128,64,4,2,62.97866666666666,3
w13,4,60,4,2048,1408,16,128,128,1,8,2,62.787,3
w13,4,60,4,2048,1408,16,128,128,1,8,4,62.723000000000006,3
w13,4,60,4,2048,1408,16,128,128,32,8,4,62.776,3
w13,4,60,6,3584,2304,16,32,128,1,4,2,252.36800000000002,3
w13,4,60,6,3584,2304,16,32,128,1,4,3,254.064,3
w13,4,60,6,3584,2304,16,32,128,1,4,5,254.544,3
w13,4,60,6,3584,2304,16,32,128,4,4,2,252.80499999999998,3
w13,4,60,6,3584,2304,16,32,128,16,4,2,253.08233333333337,3
w13,4,60,6,3584,2304,16,32,128,32,4,2,253.63700000000003,3
w13,4,60,6,3584,2304,16,32,128,32,4,3,254.533,3
w13,4,60,6,3584,2304,16,32,128,64,4,2,252.89033333333336,3
w13,4,60,6,3584,2304,16,32,128,64,4,3,254.917,3
w13,4,60,6,3584,2304,16,32,256,1,4,3,253.328,3
w13,4,60,6,3584,2304,16,32,256,1,4,4,253.96866666666665,3
w13,4,60,6,3584,2304,16,32,256,1,4,5,254.23466666666664,3
w13,4,60,6,3584,2304,16,32,256,16,4,3,253.83966666666666,3
w13,4,60,6,3584,2304,16,32,256,16,4,4,253.63700000000003,3
w13,4,60,6,3584,2304,16,32,256,16,4,5,254.42633333333333,3
w13,4,60,6,3584,2304,16,32,256,32,4,3,254.14933333333332,3
w13,4,60,6,3584,2304,16,32,256,32,4,4,254.74699999999999,3
w13,4,60,6,3584,2304,16,32,256,32,4,5,254.89566666666667,3
w13,4,60,6,3584,2304,16,32,256,64,4,3,254.0103333333333,3
w13,4,60,6,3584,2304,16,32,256,64,4,5,254.33033333333333,3
w13,4,60,6,3584,2304,16,64,128,16,4,2,254.66099999999997,3
w13,4,60,6,3584,2304,16,64,128,32,4,2,254.46933333333334,3
w13,4,60,6,3584,2304,16,64,256,1,4,3,253.53033333333335,3
w13,4,60,6,3584,2304,16,64,256,1,4,5,254.86433333333332,3
w13,4,60,6,3584,2304,16,64,256,1,8,3,253.797,3
w13,4,60,6,3584,2304,16,64,256,16,4,3,254.181,3
w13,4,60,6,3584,2304,16,64,256,16,8,3,254.45866666666666,3
w13,4,60,6,3584,2304,16,64,256,32,4,3,254.85299999999998,3
w13,4,60,6,3584,2304,16,64,256,32,8,3,254.29833333333332,3
w13,4,60,6,3584,2304,16,64,256,64,4,3,254.52233333333334,3
w13,4,60,6,3584,2304,16,64,256,64,8,3,254.768,3
w13,4,60,6,3584,2304,16,128,128,1,8,5,254.04233333333332,3
w13,4,60,8,2048,1536,16,32,128,1,4,2,130.92533333333333,3
w13,4,60,8,2048,1536,16,32,128,1,4,5,130.488,3
w13,4,60,8,2048,1536,16,32,128,4,4,2,130.29633333333334,3
w13,4,60,8,2048,1536,16,32,128,4,4,5,131.10666666666665,3
w13,4,60,8,2048,1536,16,32,128,16,4,2,130.84033333333335,3
w13,4,60,8,2048,1536,16,32,128,16,4,5,130.82933333333332,3
w13,4,60,8,2048,1536,16,32,128,32,4,2,130.851,3
w13,4,60,8,2048,1536,16,32,128,32,4,5,131.02166666666668,3
w13,4,60,8,2048,1536,16,32,128,64,4,2,131.08566666666667,3
w13,4,60,8,2048,1536,16,32,128,64,4,5,130.41366666666667,3
w13,4,60,8,2048,1536,16,32,256,1,4,2,131.00033333333332,3
w13,4,60,8,2048,1536,16,32,256,1,4,3,130.30666666666667,3
w13,4,60,8,2048,1536,16,32,256,1,4,4,131.27733333333333,3
w13,4,60,8,2048,1536,16,32,256,16,4,2,130.76533333333333,3
w13,4,60,8,2048,1536,16,32,256,16,4,3,131.267,3
w13,4,60,8,2048,1536,16,32,256,16,4,4,131.18133333333333,3
w13,4,60,8,2048,1536,16,32,256,32,4,2,131.32,3
w13,4,60,8,2048,1536,16,32,256,32,4,3,130.776,3
w13,4,60,8,2048,1536,16,32,256,64,4,2,130.43433333333334,3
w13,4,60,8,2048,1536,16,32,256,64,4,3,131.0426666666667,3
w13,4,60,8,2048,1536,16,64,128,1,4,5,130.73333333333332,3
w13,4,60,8,2048,1536,16,64,128,1,8,3,130.48799999999997,3
w13,4,60,8,2048,1536,16,64,128,1,8,5,131.107,3
w13,4,60,8,2048,1536,16,64,128,16,4,4,131.58666666666667,3
w13,4,60,8,2048,1536,16,64,128,16,4,5,130.87199999999999,3
w13,4,60,8,2048,1536,16,64,128,16,8,3,130.85066666666668,3
w13,4,60,8,2048,1536,16,64,128,16,8,5,131.44833333333335,3
w13,4,60,8,2048,1536,16,64,128,32,4,4,131.04266666666666,3
w13,4,60,8,2048,1536,16,64,128,32,4,5,131.32033333333334,3
w13,4,60,8,2048,1536,16,64,128,32,8,3,130.7973333333333,3
w13,4,60,8,2048,1536,16,64,128,32,8,5,131.49066666666667,3
w13,4,60,8,2048,1536,16,64,128,64,4,5,131.107,3
w13,4,60,8,2048,1536,16,64,128,64,8,3,131.0536666666667,3
w13,4,60,8,2048,1536,16,64,256,1,4,2,130.66933333333336,3
w13,4,60,8,2048,1536,16,64,256,1,8,2,131.01066666666668,3
w13,4,60,8,2048,1536,16,64,256,1,8,3,131.256,3
w13,4,60,8,2048,1536,16,64,256,16,4,2,131.37333333333333,3
w13,4,60,8,2048,1536,16,64,256,16,8,2,131.40533333333335,3
w13,4,60,8,2048,1536,16,64,256,16,8,3,131.21366666666665,3
w13,4,60,8,2048,1536,16,64,256,32,4,2,130.73366666666666,3
w13,4,60,8,2048,1536,16,64,256,32,8,2,131.54433333333336,3
w13,4,60,8,2048,1536,16,64,256,32,8,3,131.40533333333335,3
w13,4,60,8,2048,1536,16,64,256,64,4,2,131.30966666666666,3
w13,4,60,8,2048,1536,16,64,256,64,8,2,131.51233333333334,3
w13,4,60,8,2048,1536,16,128,128,1,8,2,130.45633333333333,3
w13,4,60,8,2048,1536,16,128,128,1,8,5,131.27733333333333,3
w13,4,60,8,2048,1536,16,128,128,16,8,2,131.192,3
w13,4,60,8,2048,1536,16,128,128,32,8,2,130.49866666666665,3
w13,4,60,8,2048,1536,16,128,128,32,8,5,131.40566666666666,3
w13,4,60,8,2048,1536,16,128,128,64,8,2,130.808,3
w13,4,60,8,2048,1536,32,32,128,64,4,2,131.384,3
w13,4,60,8,2048,1536,32,64,128,4,4,3,131.20266666666666,3
w13,4,60,8,2048,1536,32,128,128,4,4,3,131.36266666666666,3
w13,4,60,8,2048,1536,32,128,128,8,4,3,131.25633333333334,3
w13,4,60,8,2048,1536,64,64,64,1,4,3,131.46900000000002,3
w13,4,60,8,2048,1536,64,64,64,64,4,3,131.05333333333334,3
w13,4,64,6,3072,2048,16,32,128,1,4,2,194.99033333333333,3
w13,4,64,6,3072,2048,16,32,128,1,4,4,195.38466666666667,3
w13,4,64,6,3072,2048,16,32,128,1,4,5,194.38233333333335,3
w13,4,64,6,3072,2048,16,32,128,4,4,2,194.97966666666665,3
w13,4,64,6,3072,2048,16,32,128,4,4,5,194.958,3
w13,4,64,6,3072,2048,16,32,128,16,4,2,194.70266666666666,3
w13,4,64,6,3072,2048,16,32,128,16,4,5,195.27800000000002,3
w13,4,64,6,3072,2048,16,32,128,32,4,5,195.47,3
w13,4,64,6,3072,2048,16,32,128,64,4,5,195.38466666666667,3
w13,4,64,6,3072,2048,16,32,256,1,4,2,194.02999999999997,3
w13,4,64,6,3072,2048,16,32,256,1,4,3,193.87066666666666,3
w13,4,64,6,3072,2048,16,32,256,1,4,4,195.44866666666667,3
w13,4,64,6,3072,2048,16,32,256,1,4,5,194.80866666666665,3
w13,4,64,6,3072,2048,16,32,256,16,4,2,195.04366666666667,3
w13,4,64,6,3072,2048,16,32,256,16,4,3,195.36299999999997,3
w13,4,64,6,3072,2048,16,32,256,16,4,4,195.21400000000003,3
w13,4,64,6,3072,2048,16,32,256,16,4,5,195.25699999999998,3
w13,4,64,6,3072,2048,16,32,256,32,4,2,195.40599999999998,3
w13,4,64,6,3072,2048,16,32,256,32,4,3,194.95766666666668,3
w13,4,64,6,3072,2048,16,32,256,32,4,4,195.1293333333333,3
w13,4,64,6,3072,2048,16,32,256,32,4,5,195.662,3
w13,4,64,6,3072,2048,16,32,256,64,4,2,194.67,3
w13,4,64,6,3072,2048,16,32,256,64,4,3,194.6916666666667,3
w13,4,64,6,3072,2048,16,32,256,64,4,4,194.57466666666664,3
w13,4,64,6,3072,2048,16,32,256,64,4,5,195.23533333333333,3
w13,4,64,6,3072,2048,16,64,128,1,4,4,194.88400000000001,3
w13,4,64,6,3072,2048,16,64,128,1,4,5,195.03300000000002,3
w13,4,64,6,3072,2048,16,64,128,16,4,4,194.48933333333332,3
w13,4,64,6,3072,2048,16,64,128,16,4,5,195.41666666666666,3
w13,4,64,6,3072,2048,16,64,128,16,8,3,194.4466666666667,3
w13,4,64,6,3072,2048,16,64,128,16,8,5,195.0536666666667,3
w13,4,64,6,3072,2048,16,64,128,32,4,4,195.24566666666666,3
w13,4,64,6,3072,2048,16,64,128,32,4,5,193.95566666666664,3
w13,4,64,6,3072,2048,16,64,128,32,8,3,195.44866666666667,3
w13,4,64,6,3072,2048,16,64,128,32,8,5,195.73666666666668,3
w13,4,64,6,3072,2048,16,64,128,64,4,4,195.69366666666667,3
w13,4,64,6,3072,2048,16,64,128,64,4,5,194.638,3
w13,4,64,6,3072,2048,16,64,128,64,8,3,195.66166666666666,3
w13,4,64,6,3072,2048,16,64,128,64,8,5,194.84066666666664,3
w13,4,64,6,3072,2048,16,64,256,1,4,2,195.57633333333334,3
w13,4,64,6,3072,2048,16,64,256,1,4,3,195.08633333333333,3
w13,4,64,6,3072,2048,16,64,256,1,8,2,194.77633333333333,3
w13,4,64,6,3072,2048,16,64,256,1,8,3,194.542,3
w13,4,64,6,3072,2048,16,64,256,16,4,3,194.67033333333333,3
w13,4,64,6,3072,2048,16,64,256,16,8,3,194.58466666666666,3
w13,4,64,6,3072,2048,16,64,256,32,4,2,195.66233333333332,3
w13,4,64,6,3072,2048,16,64,256,32,4,3,195.74800000000002,3
w13,4,64,6,3072,2048,16,64,256,32,8,3,194.92633333333333,3
w13,4,64,6,3072,2048,16,64,256,64,4,2,195.427,3
w13,4,64,6,3072,2048,16,64,256,64,4,3,195.21400000000003,3
w13,4,64,6,3072,2048,16,64,256,64,8,2,195.75766666666667,3
w13,4,64,6,3072,2048,16,64,256,64,8,3,194.93666666666664,3
w13,4,64,6,3072,2048,16,128,128,1,4,3,195.50233333333335,3
w13,4,64,6,3072,2048,16,128,128,1,4,4,195.55499999999998,3
w13,4,64,6,3072,2048,16,128,128,1,8,2,194.94733333333332,3
w13,4,64,6,3072,2048,16,128,128,1,8,3,194.88366666666664,3
w13,4,64,6,3072,2048,16,128,128,1,8,4,195.11800000000002,3
w13,4,64,6,3072,2048,16,128,128,1,8,5,194.32899999999998,3
w13,4,64,6,3072,2048,16,128,128,16,4,3,195.22433333333333,3
w13,4,64,6,3072,2048,16,128,128,16,8,2,194.53133333333335,3
w13,4,64,6,3072,2048,16,128,128,16,8,3,195.07500000000002,3
w13,4,64,6,3072,2048,16,128,128,16,8,5,195.20366666666666,3
w13,4,64,6,3072,2048,16,128,128,64,8,5,195.50199999999998,3
w13,4,64,6,3072,2048,32,32,128,1,4,2,195.71533333333332,3
w13,4,64,6,3072,2048,32,32,128,1,4,3,195.5233333333333,3
w13,4,64,6,3072,2048,32,32,128,1,4,4,195.27833333333334,3
w13,4,64,6,3072,2048,32,32,128,4,4,2,195.49166666666667,3
w13,4,64,6,3072,2048,32,32,128,4,4,3,195.662,3
w13,4,64,6,3072,2048,32,32,128,4,4,4,195.545,3
w13,4,64,6,3072,2048,32,64,128,1,4,3,195.779,3
w13,4,64,6,3072,2048,32,128,128,1,4,3,195.63,3
w13,4,64,6,3072,2048,32,128,128,1,8,3,195.77966666666666,3
w13,4,64,6,3072,2048,32,128,128,8,4,3,195.67233333333334,3
w13,4,64,6,3072,2048,32,128,128,16,4,2,195.29933333333335,3
w13,4,64,6,3072,2048,64,64,64,1,4,3,195.811,3
w13,4,64,6,3072,2048,64,64,64,4,4,3,195.26733333333334,3
w13,4,64,6,3072,2048,64,64,64,16,4,3,195.332,3
w13,4,64,6,3584,1536,16,32,128,1,4,2,171.72566666666668,3
w13,4,64,6,3584,1536,16,32,128,1,4,3,171.51200000000003,3
w13,4,64,6,3584,1536,16,32,128,1,4,4,170.87233333333333,3
w13,4,64,6,3584,1536,16,32,128,4,4,2,170.57366666666667,3
w13,4,64,6,3584,1536,16,32,128,4,4,3,172.03533333333334,3
w13,4,64,6,3584,1536,16,32,128,4,4,4,171.67233333333334,3
w13,4,64,6,3584,1536,16,32,128,16,4,2,170.95766666666668,3
w13,4,64,6,3584,1536,16,32,128,16,4,4,171.40633333333335,3
w13,4,64,6,3584,1536,16,32,128,32,4,2,170.77633333333333,3
w13,4,64,6,3584,1536,16,32,128,32,4,3,171.918,3
w13,4,64,6,3584,1536,16,32,128,32,4,4,171.77866666666668,3
w13,4,64,6,3584,1536,16,32,128,64,4,2,171.427,3
w13,4,64,6,3584,1536,16,32,128,64,4,4,171.98233333333334,3
w13,4,64,6,3584,1536,16,32,256,1,4,2,170.46666666666667,3
w13,4,64,6,3584,1536,16,32,256,1,4,4,171.811,3
w13,4,64,6,3584,1536,16,32,256,1,4,5,171.918,3
w13,4,64,6,3584,1536,16,32,256,16,4,2,171.06433333333334,3
w13,4,64,6,3584,1536,16,32,256,32,4,2,170.70166666666668,3
w13,4,64,6,3584,1536,16,32,256,64,4,2,171.1816666666667,3
w13,4,64,6,3584,1536,16,64,128,1,4,4,170.31766666666667,3
w13,4,64,6,3584,1536,16,64,128,1,8,2,171.9606666666667,3
w13,4,64,6,3584,1536,16,64,128,1,8,4,171.41600000000003,3
w13,4,64,6,3584,1536,16,64,128,16,4,4,170.85133333333332,3
w13,4,64,6,3584,1536,16,64,128,16,8,2,171.99233333333333,3
w13,4,64,6,3584,1536,16,64,128,32,4,4,171.07500000000002,3
w13,4,64,6,3584,1536,16,64,128,64,4,4,171.23533333333333,3
w13,4,64,6,3584,1536,16,64,256,1,8,2,171.48033333333333,3
w13,4,64,6,3584,1536,16,64,256,32,8,2,171.80033333333333,3
w13,4,64,6,3584,1536,16,64,256,64,8,2,170.9043333333333,3
w13,4,64,6,3584,1536,16,128,128,32,8,3,171.56566666666666,3
w13,4,64,6,3584,1536,32,32,128,64,4,3,171.89666666666668,3
w13,4,64,8,3584,2560,16,32,128,1,4,5,373.38633333333337,3
w13,4,64,8,3584,2560,16,32,128,4,4,5,373.90933333333334,3
w13,4,64,8,3584,2560,16,32,128,16,4,5,374.48566666666665,3
w13,4,64,8,3584,2560,16,32,128,32,4,5,374.26133333333337,3
w13,4,64,8,3584,2560,16,32,128,64,4,5,374.8486666666666,3
w13,4,64,8,3584,2560,16,32,256,1,4,3,372.4583333333333,3
w13,4,64,8,3584,2560,16,32,256,1,4,4,373.01366666666667,3
w13,4,64,8,3584,2560,16,32,256,1,4,5,372.22333333333336,3
w13,4,64,8,3584,2560,16,32,256,16,4,3,373.3546666666666,3
w13,4,64,8,3584,2560,16,32,256,16,4,4,372.98133333333334,3
w13,4,64,8,3584,2560,16,32,256,16,4,5,373.6213333333333,3
w13,4,64,8,3584,2560,16,32,256,32,4,3,372.8419999999999,3
w13,4,64,8,3584,2560,16,32,256,32,4,4,373.9846666666667,3
w13,4,64,8,3584,2560,16,32,256,32,4,5,372.81033333333335,3
w13,4,64,8,3584,2560,16,32,256,64,4,3,373.26933333333335,3
w13,4,64,8,3584,2560,16,32,256,64,4,4,373.76,3
w13,4,64,8,3584,2560,16,32,256,64,4,5,373.09833333333336,3
w13,4,64,8,3584,2560,16,64,128,1,4,2,375.40333333333336,3
w13,4,64,8,3584,2560,16,64,128,1,4,3,374.86999999999995,3
w13,4,64,8,3584,2560,16,64,128,1,4,5,372.362,3
w13,4,64,8,3584,2560,16,64,128,1,8,2,372.49,3
w13,4,64,8,3584,2560,16,64,128,1,8,5,373.93066666666664,3
w13,4,64,8,3584,2560,16,64,128,16,4,3,375.45666666666665,3
w13,4,64,8,3584,2560,16,64,128,16,4,5,374.6886666666667,3
w13,4,64,8,3584,2560,16,64,128,16,8,2,373.9626666666666,3
w13,4,64,8,3584,2560,16,64,128,16,8,5,374.92333333333335,3
w13,4,64,8,3584,2560,16,64,128,32,4,2,374.731,3
w13,4,64,8,3584,2560,16,64,128,32,4,3,375.56299999999993,3
w13,4,64,8,3584,2560,16,64,128,32,4,5,373.8453333333334,3
w13,4,64,8,3584,2560,16,64,128,32,8,2,373.76,3
w13,4,64,8,3584,2560,16,64,128,32,8,5,373.93100000000004,3
w13,4,64,8,3584,2560,16,64,128,64,4,2,375.0726666666667,3
w13,4,64,8,3584,2560,16,64,128,64,4,3,375.53133333333335,3
w13,4,64,8,3584,2560,16,64,128,64,4,5,373.97333333333336,3
w13,4,64,8,3584,2560,16,64,128,64,8,2,374.61400000000003,3
w13,4,64,8,3584,2560,16,64,128,64,8,5,373.9096666666667,3
w13,4,64,8,3584,2560,16,64,256,1,4,2,375.2426666666667,3
w13,4,64,8,3584,2560,16,64,256,1,4,3,372.288,3
w13,4,64,8,3584,2560,16,64,256,1,4,5,373.5246666666667,3
w13,4,64,8,3584,2560,16,64,256,1,8,2,375.307,3
w13,4,64,8,3584,2560,16,64,256,1,8,3,373.21566666666666,3
w13,4,64,8,3584,2560,16,64,256,1,8,4,375.414,3
w13,4,64,8,3584,2560,16,64,256,1,8,5,373.15166666666664,3
w13,4,64,8,3584,2560,16,64,256,16,4,2,375.2006666666666,3
w13,4,64,8,3584,2560,16,64,256,16,4,3,373.6206666666667,3
w13,4,64,8,3584,2560,16,64,256,16,4,5,374.5176666666666,3
w13,4,64,8,3584,2560,16,64,256,16,8,3,374.272,3
w13,4,64,8,3584,2560,16,64,256,16,8,5,374.10133333333334,3
w13,4,64,8,3584,2560,16,64,256,32,4,3,372.7036666666666,3
w13,4,64,8,3584,2560,16,64,256,32,4,5,375.17900000000003,3
w13,4,64,8,3584,2560,16,64,256,32,8,3,374.2293333333334,3
w13,4,64,8,3584,2560,16,64,256,64,4,3,372.83133333333336,3
w13,4,64,8,3584,2560,16,64,256,64,4,5,374.70966666666664,3
w13,4,64,8,3584,2560,16,64,256,64,8,3,374.3256666666667,3
w13,4,64,8,3584,2560,16,64,256,64,8,5,375.26433333333335,3
w13,4,64,8,3584,2560,16,128,128,1,4,4,375.115,3
w13,4,64,8,3584,2560,16,128,128,1,4,5,374.859,3
w13,4,64,8,3584,2560,16,128,128,1,8,4,375.0726666666667,3
w13,4,64,8,3584,2560,16,128,128,1,8,5,372.92766666666665,3
w13,4,64,8,3584,2560,16,128,128,16,4,5,375.531,3
w13,4,64,8,3584,2560,16,128,128,16,8,4,375.69166666666666,3
w13,4,64,8,3584,2560,16,128,128,16,8,5,373.81333333333333,3
w13,4,64,8,3584,2560,16,128,128,32,4,5,375.38166666666666,3
w13,4,64,8,3584,2560,16,128,128,32,8,5,374.3153333333333,3
w13,4,64,8,3584,2560,16,128,128,64,4,4,375.6913333333334,3
w13,4,64,8,3584,2560,16,128,128,64,4,5,375.6483333333333,3
w13,4,64,8,3584,2560,16,128,128,64,8,5,373.888,3
w13,4,64,8,3584,2560,32,32,128,1,4,2,374.443,3
w13,4,64,8,3584,2560,32,32,128,1,4,4,375.07233333333335,3
w13,4,64,8,3584,2560,32,32,128,1,4,5,373.077,3
w13,4,64,8,3584,2560,32,32,128,4,4,2,375.65900000000005,3
w13,4,64,8,3584,2560,32,32,128,4,4,4,374.65633333333335,3
w13,4,64,8,3584,2560,32,32,128,4,4,5,374.272,3
w13,4,64,8,3584,2560,32,32,128,16,4,2,374.02666666666664,3
w13,4,64,8,3584,2560,32,32,128,16,4,4,375.56299999999993,3
w13,4,64,8,3584,2560,32,32,128,16,4,5,373.6426666666666,3
w13,4,64,8,3584,2560,32,32,128,64,4,2,374.29366666666664,3
w13,4,64,8,3584,2560,32,32,128,64,4,4,375.9476666666667,3
w13,4,64,8,3584,2560,32,32,128,64,4,5,374.25066666666663,3
w13,4,64,8,3584,2560,32,32,256,1,4,3,375.57366666666667,3
w13,4,64,8,3584,2560,32,32,256,4,4,3,374.7203333333334,3
w13,4,64,8,3584,2560,32,64,128,1,4,2,373.653,3
w13,4,64,8,3584,2560,32,64,128,1,4,3,375.85133333333334,3
w13,4,64,8,3584,2560,32,64,128,4,4,2,373.92,3
w13,4,64,8,3584,2560,32,64,128,16,4,2,374.11266666666666,3
w13,4,64,8,3584,2560,32,64,128,32,4,2,375.1583333333333,3
w13,4,64,8,3584,2560,32,64,128,64,4,2,375.1476666666667,3
w13,4,64,8,3584,2560,32,64,256,1,8,3,375.09366666666665,3
w13,4,64,8,3584,2560,32,64,256,8,8,3,375.72333333333336,3
w13,4,64,8,3584,2560,32,128,128,1,4,3,375.38166666666666,3
w13,4,64,8,3584,2560,32,128,128,1,4,5,375.77666666666664,3
w13,4,64,8,3584,2560,32,128,128,1,8,3,373.7176666666667,3
w13,4,64,8,3584,2560,32,128,128,1,8,4,374.75233333333335,3
w13,4,64,8,3584,2560,32,128,128,4,4,3,374.58166666666665,3
w13,4,64,8,3584,2560,32,128,128,4,8,3,375.84066666666666,3
w13,4,64,8,3584,2560,32,128,128,8,4,3,373.73900000000003,3
w13,4,64,8,3584,2560,32,128,128,8,8,3,373.84566666666666,3
w13,4,64,8,3584,2560,32,128,128,16,4,3,374.4433333333333,3
w13,4,64,8,3584,2560,32,128,128,16,8,3,375.45599999999996,3
w13,4,64,8,3584,2560,32,128,128,32,4,3,374.59200000000004,3
w13,4,64,8,3584,2560,32,128,128,32,8,3,375.04466666666667,3
w13,4,64,8,3584,2560,32,128,128,64,4,3,375.7163333333333,3
w13,4,64,8,3584,2560,32,128,128,64,8,3,374.0843333333333,3
w13,4,64,8,3584,2560,64,64,64,1,4,3,375.013,3
w13,4,64,8,3584,2560,64,64,64,1,4,5,375.04466666666667,3
w13,4,64,8,3584,2560,64,64,64,4,4,3,374.56466666666665,3
w13,4,64,8,3584,2560,64,64,64,4,4,5,375.2153333333333,3
w13,4,64,8,3584,2560,64,64,64,16,4,3,374.77799999999996,3
w13,4,64,8,3584,2560,64,64,64,32,4,3,375.2153333333333,3
w13,4,64,8,3584,2560,64,64,64,64,4,3,375.56766666666664,3
w13,4,64,8,3584,2560,64,128,128,1,8,4,373.8713333333333,3
w13,4,64,8,3584,2560,64,128,128,4,8,4,375.045,3
w13,4,64,8,3584,2560,64,128,128,16,8,4,375.5783333333334,3
w13,4,128,4,2048,512,16,32,64,32,4,5,24.941,3
w13,4,128,4,2048,512,16,32,128,1,4,4,24.845,3
w13,4,128,4,2048,512,16,32,256,16,4,2,24.706333333333333,3
w13,4,128,4,2048,512,16,64,64,1,4,5,24.834333333333333,3
w13,4,128,4,2048,512,16,64,64,16,4,5,24.888,3
w13,4,128,4,2048,512,16,64,128,1,4,3,24.898666666666667,3
w13,4,128,4,2048,512,16,64,128,16,8,3,24.855666666666664,3
w13,4,128,4,2048,512,16,64,128,64,4,3,24.909333333333333,3
w13,4,128,4,2048,512,16,64,128,64,8,3,24.791666666666668,3
w13,4,128,6,4096,2048,16,32,128,1,4,4,258.26233333333334,3
w13,4,128,6,4096,2048,16,32,128,1,4,5,256.22433333333333,3
w13,4,128,6,4096,2048,16,32,128,4,4,5,257.17333333333335,3
w13,4,128,6,4096,2048,16,32,128,16,4,5,256.63033333333334,3
w13,4,128,6,4096,2048,16,32,128,32,4,5,256.91766666666666,3
w13,4,128,6,4096,2048,16,32,128,64,4,5,256.1073333333333,3
w13,4,128,6,4096,2048,16,32,256,1,4,2,257.1526666666667,3
w13,4,128,6,4096,2048,16,32,256,1,4,3,257.19533333333334,3
w13,4,128,6,4096,2048,16,32,256,1,4,5,258.433,3
w13,4,128,6,4096,2048,16,32,256,16,4,2,258.2836666666667,3
w13,4,128,6,4096,2048,16,32,256,16,4,3,256.9923333333333,3
w13,4,128,6,4096,2048,16,32,256,16,4,5,257.857,3
w13,4,128,6,4096,2048,16,32,256,32,4,2,257.8996666666667,3
w13,4,128,6,4096,2048,16,32,256,32,4,3,256.9603333333333,3
w13,4,128,6,4096,2048,16,32,256,32,4,4,258.32666666666665,3
w13,4,128,6,4096,2048,16,32,256,32,4,5,258.6893333333333,3
w13,4,128,6,4096,2048,16,32,256,64,4,2,256.9823333333333,3
w13,4,128,6,4096,2048,16,32,256,64,4,3,256.3953333333333,3
w13,4,128,6,4096,2048,16,32,256,64,4,4,258.433,3
w13,4,128,6,4096,2048,16,32,256,64,4,5,258.4436666666667,3
w13,4,128,6,4096,2048,16,64,128,1,4,4,256.87533333333334,3
w13,4,128,6,4096,2048,16,64,128,1,4,5,256.5656666666667,3
w13,4,128,6,4096,2048,16,64,128,1,8,3,258.42233333333337,3
w13,4,128,6,4096,2048,16,64,128,1,8,4,258.497,3
w13,4,128,6,4096,2048,16,64,128,1,8,5,257.8353333333334,3
w13,4,128,6,4096,2048,16,64,128,16,4,5,256.43766666666664,3
w13,4,128,6,4096,2048,16,64,128,16,8,5,257.02433333333335,3
w13,4,128,6,4096,2048,16,64,128,32,4,4,257.33366666666666,3
w13,4,128,6,4096,2048,16,64,128,32,4,5,256.2563333333333,3
w13,4,128,6,4096,2048,16,64,128,32,8,5,257.36566666666664,3
w13,4,128,6,4096,2048,16,64,128,64,4,4,257.7076666666667,3
w13,4,128,6,4096,2048,16,64,128,64,4,5,257.20599999999996,3
w13,4,128,6,4096,2048,16,64,128,64,8,4,258.657,3
w13,4,128,6,4096,2048,16,64,128,64,8,5,257.1956666666667,3
w13,4,128,6,4096,2048,16,64,256,1,4,2,258.166,3
w13,4,128,6,4096,2048,16,64,256,1,4,3,256.9603333333333,3
w13,4,128,6,4096,2048,16,64,256,1,4,5,258.43266666666665,3
w13,4,128,6,4096,2048,16,64,256,1,8,2,258.049,3
w13,4,128,6,4096,2048,16,64,256,1,8,3,256.95,3
w13,4,128,6,4096,2048,16,64,256,16,4,2,258.497,3
w13,4,128,6,4096,2048,16,64,256,16,4,3,257.18466666666666,3
w13,4,128,6,4096,2048,16,64,256,16,8,3,257.4193333333333,3
w13,4,128,6,4096,2048,16,64,256,32,4,3,256.779,3
w13,4,128,6,4096,2048,16,64,256,32,8,2,258.43266666666665,3
w13,4,128,6,4096,2048,16,64,256,32,8,3,257.195,3
w13,4,128,6,4096,2048,16,64,256,64,4,3,257.078,3
w13,4,128,6,4096,2048,16,64,256,64,8,2,258.305,3
w13,4,128,6,4096,2048,16,64,256,64,8,3,257.5366666666667,3
w13,4,128,6,4096,2048,16,128,128,1,4,5,258.5506666666667,3
w13,4,128,6,4096,2048,16,128,128,1,8,2,258.50766666666664,3
w13,4,128,6,4096,2048,16,128,128,1,8,4,258.2093333333333,3
w13,4,128,6,4096,2048,16,128,128,1,8,5,256.73633333333333,3
w13,4,128,6,4096,2048,16,128,128,16,4,5,258.45433333333335,3
w13,4,128,6,4096,2048,16,128,128,16,8,5,256.79,3
w13,4,128,6,4096,2048,16,128,128,32,8,5,256.6193333333334,3
w13,4,128,6,4096,2048,16,128,128,64,4,5,258.6566666666667,3
w13,4,128,6,4096,2048,16,128,128,64,8,5,257.22700000000003,3
w13,4,128,6,4096,2048,32,32,128,1,4,3,257.857,3
w13,4,128,6,4096,2048,32,32,128,1,4,4,258.6143333333334,3
w13,4,128,6,4096,2048,32,32,128,4,4,4,258.39,3
w13,4,128,6,4096,2048,32,32,128,16,4,4,258.5183333333334,3
w13,4,128,6,4096,2048,32,32,128,64,4,4,258.518,3
w13,4,128,6,4096,2048,32,64,256,64,8,3,258.6566666666667,3
w13,4,128,6,4096,2048,32,128,128,1,8,4,258.41166666666663,3
w13,4,128,6,4096,2048,32,128,128,4,4,3,258.49666666666667,3
w13,4,128,6,4096,2048,32,128,128,16,4,3,258.593,3
w13,4,128,6,4096,2048,64,64,64,1,4,5,258.55266666666665,3
w13,4,128,6,4096,2048,64,64,64,32,4,5,258.09433333333334,3
w13,4,128,6,4096,2048,64,64,64,64,4,5,258.2326666666667,3
w13,4,128,6,4096,2048,64,64,128,1,4,3,257.96633333333335,3
w13,4,128,6,4096,2048,64,64,128,1,8,3,258.45700000000005,3
w13,4,128,6,4096,2048,64,64,128,4,4,3,258.404,3
w13,4,128,6,4096,2048,64,64,128,32,4,3,258.606,3
w13,4,128,6,4096,2048,64,64,128,32,8,3,258.3503333333333,3
w13,4,128,6,4096,2048,64,64,128,64,4,3,258.26533333333333,3
w13,4,128,6,4096,2048,64,64,128,64,8,3,258.22266666666667,3
w13,4,128,6,4096,2048,64,128,128,1,8,4,257.8916666666667,3
w13,4,128,6,4096,2048,64,128,128,4,8,4,258.0303333333333,3
w13,4,128,6,4096,2048,64,128,128,64,8,4,257.82766666666663,3
w13,4,128,8,2048,768,16,32,128,16,4,5,67.899,3
w13,4,128,8,2048,768,16,32,128,64,4,5,67.93066666666667,3
w13,4,128,8,2048,768,16,32,256,1,4,2,67.61066666666666,3
w13,4,128,8,2048,768,16,32,256,16,4,2,67.78133333333334,3
w13,4,128,8,2048,768,16,64,64,1,4,3,67.78166666666665,3
w13,4,128,8,2048,768,16,64,64,16,4,3,67.408,3
w13,4,128,8,2048,768,16,64,64,32,4,3,67.78166666666667,3
w13,4,128,8,2048,768,16,64,64,64,4,3,67.82333333333334,3
w13,4,128,8,2048,768,16,64,128,1,4,2,67.653,3
w13,4,128,8,2048,768,16,64,128,16,4,2,67.62166666666667,3
w13,4,128,8,2048,768,16,64,128,32,4,2,67.54633333333334,3
w13,4,128,8,2048,768,16,64,128,32,4,4,67.84566666666667,3
w13,4,128,8,2048,768,16,64,128,64,4,2,67.72833333333334,3
w13,4,128,8,2048,768,16,128,128,1,8,2,67.25866666666667,3
w13,4,128,8,2048,768,16,128,128,32,8,2,67.86666666666667,3
w13,4,128,8,4096,1536,16,32,128,1,4,2,258.18,3
w13,4,128,8,4096,1536,16,32,128,1,4,4,259.001,3
w13,4,128,8,4096,1536,16,32,128,1,4,5,256.9753333333333,3
w13,4,128,8,4096,1536,16,32,128,4,4,5,256.8686666666667,3
w13,4,128,8,4096,1536,16,32,128,16,4,5,257.231,3
w13,4,128,8,4096,1536,16,32,128,32,4,5,257.36899999999997,3
w13,4,128,8,4096,1536,16,32,128,64,4,5,257.359,3
w13,4,128,8,4096,1536,16,32,256,1,4,2,256.78299999999996,3
w13,4,128,8,4096,1536,16,32,256,1,4,3,256.8473333333333,3
w13,4,128,8,4096,1536,16,32,256,1,4,4,257.508,3
w13,4,128,8,4096,1536,16,32,256,1,4,5,257.52933333333334,3
w13,4,128,8,4096,1536,16,32,256,16,4,2,258.62733333333335,3
w13,4,128,8,4096,1536,16,32,256,16,4,3,257.412,3
w13,4,128,8,4096,1536,16,32,256,16,4,4,258.97933333333333,3
w13,4,128,8,4096,1536,16,32,256,16,4,5,257.57166666666666,3
w13,4,128,8,4096,1536,16,32,256,32,4,2,257.402,3
w13,4,128,8,4096,1536,16,32,256,32,4,3,257.9026666666667,3
w13,4,128,8,4096,1536,16,32,256,32,4,4,258.8193333333333,3
w13,4,128,8,4096,1536,16,32,256,32,4,5,257.88100000000003,3
w13,4,128,8,4096,1536,16,32,256,64,4,2,257.9773333333333,3
w13,4,128,8,4096,1536,16,32,256,64,4,3,257.57166666666666,3
w13,4,128,8,4096,1536,16,32,256,64,4,5,258.9793333333334,3
w13,4,128,8,4096,1536,16,64,128,1,4,2,257.94533333333334,3
w13,4,128,8,4096,1536,16,64,128,1,4,4,257.913,3
w13,4,128,8,4096,1536,16,64,128,1,4,5,256.975,3
w13,4,128,8,4096,1536,16,64,128,1,8,3,257.7,3
w13,4,128,8,4096,1536,16,64,128,1,8,5,257.32733333333334,3
w13,4,128,8,4096,1536,16,64,128,16,4,4,258.69100000000003,3
w13,4,128,8,4096,1536,16,64,128,16,4,5,256.89000000000004,3
w13,4,128,8,4096,1536,16,64,128,16,8,3,258.201,3
w13,4,128,8,4096,1536,16,64,128,16,8,5,257.79633333333334,3
w13,4,128,8,4096,1536,16,64,128,32,4,4,258.4463333333333,3
w13,4,128,8,4096,1536,16,64,128,32,4,5,256.78266666666667,3
w13,4,128,8,4096,1536,16,64,128,32,8,3,258.77666666666664,3
w13,4,128,8,4096,1536,16,64,128,32,8,5,257.7323333333333,3
w13,4,128,8,4096,1536,16,64,128,64,4,4,258.2753333333333,3
w13,4,128,8,4096,1536,16,64,128,64,4,5,256.4316666666667,3
w13,4,128,8,4096,1536,16,64,128,64,8,3,258.1686666666667,3
w13,4,128,8,4096,1536,16,64,128,64,8,5,257.4123333333333,3
w13,4,128,8,4096,1536,16,64,256,1,4,2,257.231,3
w13,4,128,8,4096,1536,16,64,256,1,4,3,256.4633333333333,3
w13,4,128,8,4096,1536,16,64,256,1,4,5,258.29699999999997,3
w13,4,128,8,4096,1536,16,64,256,1,8,2,258.01933333333335,3
w13,4,128,8,4096,1536,16,64,256,1,8,3,258.2436666666667,3
w13,4,128,8,4096,1536,16,64,256,16,4,2,258.15799999999996,3
w13,4,128,8,4096,1536,16,64,256,16,4,3,257.24100000000004,3
w13,4,128,8,4096,1536,16,64,256,16,4,5,258.649,3
w13,4,128,8,4096,1536,16,64,256,16,8,2,258.809,3
w13,4,128,8,4096,1536,16,64,256,16,8,3,257.74266666666665,3
w13,4,128,8,4096,1536,16,64,256,32,4,2,257.988,3
w13,4,128,8,4096,1536,16,64,256,32,4,3,257.348,3
w13,4,128,8,4096,1536,16,64,256,32,8,2,258.44666666666666,3
w13,4,128,8,4096,1536,16,64,256,32,8,3,257.71066666666667,3
w13,4,128,8,4096,1536,16,64,256,64,4,3,257.8283333333333,3
w13,4,128,8,4096,1536,16,64,256,64,4,5,258.798,3
w13,4,128,8,4096,1536,16,64,256,64,8,2,258.649,3
w13,4,128,8,4096,1536,16,64,256,64,8,3,258.39300000000003,3
w13,4,128,8,4096,1536,16,128,128,1,4,4,257.892,3
w13,4,128,8,4096,1536,16,128,128,1,4,5,258.84066666666666,3
w13,4,128,8,4096,1536,16,128,128,1,8,4,257.62566666666663,3
w13,4,128,8,4096,1536,16,128,128,1,8,5,256.5273333333334,3
w13,4,128,8,4096,1536,16,128,128,16,4,5,258.979,3
w13,4,128,8,4096,1536,16,128,128,16,8,4,258.851,3
w13,4,128,8,4096,1536,16,128,128,16,8,5,256.847,3
w13,4,128,8,4096,1536,16,128,128,32,4,4,258.968,3
w13,4,128,8,4096,1536,16,128,128,32,8,4,258.3926666666667,3
w13,4,128,8,4096,1536,16,128,128,32,8,5,256.9216666666667,3
w13,4,128,8,4096,1536,16,128,128,64,4,4,258.93666666666667,3
w13,4,128,8,4096,1536,16,128,128,64,8,5,257.02866666666665,3
w13,4,128,8,4096,1536,32,32,128,1,4,2,258.894,3
w13,4,128,8,4096,1536,32,32,128,1,4,3,258.212,3
w13,4,128,8,4096,1536,32,32,128,1,4,4,258.75533333333334,3
w13,4,128,8,4096,1536,32,32,128,1,4,5,259.01099999999997,3
w13,4,128,8,4096,1536,32,32,128,4,4,3,258.8196666666667,3
w13,4,128,8,4096,1536,32,32,128,4,4,4,258.14799999999997,3
w13,4,128,8,4096,1536,32,32,128,64,4,3,258.5953333333334,3
w13,4,128,8,4096,1536,32,32,128,64,4,4,258.606,3
w13,4,128,8,4096,1536,32,64,128,1,4,3,258.3926666666667,3
w13,4,128,8,4096,1536,32,64,256,1,8,3,258.98966666666666,3
w13,4,128,8,4096,1536,32,64,256,8,8,3,258.48900000000003,3
w13,4,128,8,4096,1536,32,128,128,1,4,3,257.28433333333334,3
w13,4,128,8,4096,1536,32,128,128,1,4,5,258.40366666666665,3
w13,4,128,8,4096,1536,32,128,128,1,8,3,257.3483333333333,3
w13,4,128,8,4096,1536,32,128,128,1,8,4,258.49966666666666,3
w13,4,128,8,4096,1536,32,128,128,1,8,5,258.37100000000004,3
w13,4,128,8,4096,1536,32,128,128,4,4,3,258.532,3
w13,4,128,8,4096,1536,32,128,128,4,4,5,258.926,3
w13,4,128,8,4096,1536,32,128,128,4,8,3,257.892,3
w13,4,128,8,4096,1536,32,128,128,4,8,5,258.6913333333333,3
w13,4,128,8,4096,1536,32,128,128,8,8,5,258.2863333333333,3
w13,4,128,8,4096,1536,32,128,128,16,4,3,258.9683333333333,3
w13,4,128,8,4096,1536,32,128,128,16,8,4,258.91566666666665,3
w13,4,128,8,4096,1536,32,128,128,16,8,5,258.9793333333333,3
w13,4,128,8,4096,1536,32,128,128,32,4,3,258.57366666666667,3
w13,4,128,8,4096,1536,32,128,128,32,8,4,258.2323333333333,3
w13,4,128,8,4096,1536,32,128,128,32,8,5,259.0013333333333,3
w13,4,128,8,4096,1536,32,128,128,64,4,3,258.25399999999996,3
w13,4,128,8,4096,1536,32,128,128,64,4,4,258.8193333333333,3
w13,4,128,8,4096,1536,32,128,128,64,8,4,258.93666666666667,3
w13,4,128,8,4096,1536,32,128,128,64,8,5,258.4243333333333,3
w13,4,128,8,4096,1536,64,64,64,1,4,5,258.542,3
w13,4,128,8,4096,1536,64,64,64,4,4,5,258.3496666666667,3
w13,4,128,8,4096,1536,64,64,64,32,4,5,258.2436666666667,3
w13,4,128,8,4096,1536,64,64,64,64,4,5,258.34999999999997,3
w13,4,128,8,4096,1536,64,64,128,1,4,3,257.86966666666666,3
w13,4,128,8,4096,1536,64,64,128,1,8,3,258.947,3
w13,4,128,8,4096,1536,64,64,128,4,4,3,258.46700000000004,3
w13,4,128,8,4096,1536,64,64,128,8,4,3,258.467,3
w13,4,128,8,4096,1536,64,64,128,16,4,3,258.62733333333335,3
w13,4,128,8,4096,1536,64,64,128,32,4,3,258.89466666666664,3
w13,4,128,8,4096,1536,64,64,128,32,8,3,258.72333333333336,3
w13,4,128,8,4096,1536,64,64,128,64,4,3,259.01166666666666,3
w13,4,128,8,4096,1536,64,128,64,1,4,5,258.94766666666663,3
w13,4,128,8,4096,1536,64,128,64,32,4,5,258.7236666666667,3
w13,4,128,8,4096,1536,64,128,128,1,8,3,259.00066666666663,3
w13,4,128,8,4096,1536,64,128,128,1,8,4,257.7203333333334,3
w13,4,128,8,4096,1536,64,128,128,16,8,4,258.59499999999997,3
w13,4,128,8,4096,1536,64,128,128,32,8,4,257.8806666666667,3
w13,4,128,8,4096,1536,64,128,128,64,8,4,258.2006666666667,3
w13,4,128,8,4096,3072,16,16,256,1,4,5,510.72299999999996,3
w13,4,128,8,4096,3072,16,16,256,4,4,4,510.83099999999996,3
w13,4,128,8,4096,3072,16,16,256,4,4,5,510.68133333333327,3
w13,4,128,8,4096,3072,16,32,128,1,4,3,507.29033333333336,3
w13,4,128,8,4096,3072,16,32,128,1,4,5,505.75399999999996,3
w13,4,128,8,4096,3072,16,32,128,4,4,3,508.01,3
w13,4,128,8,4096,3072,16,32,128,4,4,5,507.50399999999996,3
w13,4,128,8,4096,3072,16,32,128,16,4,3,509.0686666666666,3
w13,4,128,8,4096,3072,16,32,128,16,4,5,506.57166666666666,3
w13,4,128,8,4096,3072,16,32,128,32,4,3,509.96566666666666,3
w13,4,128,8,4096,3072,16,32,128,32,4,5,507.2923333333333,3
w13,4,128,8,4096,3072,16,32,128,64,4,3,509.38366666666667,3
w13,4,128,8,4096,3072,16,32,128,64,4,5,507.2176666666667,3
w13,4,128,8,4096,3072,16,32,256,1,4,2,507.423,3
w13,4,128,8,4096,3072,16,32,256,1,4,3,508.5063333333333,3
w13,4,128,8,4096,3072,16,32,256,1,4,4,507.8023333333333,3
w13,4,128,8,4096,3072,16,32,256,1,4,5,506.0683333333333,3
w13,4,128,8,4096,3072,16,32,256,16,4,2,508.942,3
w13,4,128,8,4096,3072,16,32,256,16,4,3,507.7683333333334,3
w13,4,128,8,4096,3072,16,32,256,16,4,4,508.388,3
w13,4,128,8,4096,3072,16,32,256,16,4,5,506.5396666666666,3
w13,4,128,8,4096,3072,16,32,256,32,4,2,509.35200000000003,3
w13,4,128,8,4096,3072,16,32,256,32,4,3,508.5733333333333,3
w13,4,128,8,4096,3072,16,32,256,32,4,4,508.37999999999994,3
w13,4,128,8,4096,3072,16,32,256,32,4,5,507.365,3
w13,4,128,8,4096,3072,16,32,256,64,4,2,510.11833333333334,3
w13,4,128,8,4096,3072,16,32,256,64,4,3,507.704,3
w13,4,128,8,4096,3072,16,32,256,64,4,4,507.93966666666665,3
w13,4,128,8,4096,3072,16,32,256,64,4,5,507.34366666666665,3
w13,4,128,8,4096,3072,16,64,128,1,4,4,508.934,3
w13,4,128,8,4096,3072,16,64,128,1,4,5,505.9446666666667,3
w13,4,128,8,4096,3072,16,64,128,1,8,2,510.503,3
w13,4,128,8,4096,3072,16,64,128,1,8,3,509.7,3
w13,4,128,8,4096,3072,16,64,128,1,8,5,510.07033333333334,3
w13,4,128,8,4096,3072,16,64,128,16,4,3,510.66799999999995,3
w13,4,128,8,4096,3072,16,64,128,16,4,4,510.48933333333326,3
w13,4,128,8,4096,3072,16,64,128,16,4,5,507.42066666666665,3
w13,4,128,8,4096,3072,16,64,128,16,8,5,509.3833333333334,3
w13,4,128,8,4096,3072,16,64,128,32,4,5,507.6036666666667,3
w13,4,128,8,4096,3072,16,64,128,32,8,3,509.99466666666666,3
w13,4,128,8,4096,3072,16,64,128,32,8,5,509.11266666666666,3
w13,4,128,8,4096,3072,16,64,128,64,4,4,510.0733333333333,3
w13,4,128,8,4096,3072,16,64,128,64,4,5,507.2486666666667,3
w13,4,128,8,4096,3072,16,64,128,64,8,5,508.903,3
w13,4,128,8,4096,3072,16,64,256,1,4,2,509.729,3
w13,4,128,8,4096,3072,16,64,256,1,4,3,509.27666666666664,3
w13,4,128,8,4096,3072,16,64,256,1,4,4,508.9013333333333,3
w13,4,128,8,4096,3072,16,64,256,1,4,5,507.23766666666666,3
w13,4,128,8,4096,3072,16,64,256,1,8,2,508.67733333333337,3
w13,4,128,8,4096,3072,16,64,256,1,8,4,508.68533333333335,3
w13,4,128,8,4096,3072,16,64,256,1,8,5,507.04766666666666,3
w13,4,128,8,4096,3072,16,64,256,16,4,2,510.82099999999997,3
w13,4,128,8,4096,3072,16,64,256,16,4,3,508.6803333333334,3
w13,4,128,8,4096,3072,16,64,256,16,4,4,509.8296666666667,3
w13,4,128,8,4096,3072,16,64,256,16,4,5,506.69800000000004,3
w13,4,128,8,4096,3072,16,64,256,16,8,2,510.23633333333333,3
w13,4,128,8,4096,3072,16,64,256,16,8,4,509.9073333333333,3
w13,4,128,8,4096,3072,16,64,256,16,8,5,508.337,3
w13,4,128,8,4096,3072,16,64,256,32,4,2,509.3713333333333,3
w13,4,128,8,4096,3072,16,64,256,32,4,3,509.9256666666667,3
w13,4,128,8,4096,3072,16,64,256,32,4,5,508.4636666666667,3
w13,4,128,8,4096,3072,16,64,256,32,8,2,508.827,3
w13,4,128,8,4096,3072,16,64,256,32,8,5,508.9753333333333,3
w13,4,128,8,4096,3072,16,64,256,64,4,2,509.90500000000003,3
w13,4,128,8,4096,3072,16,64,256,64,4,3,509.373,3
w13,4,128,8,4096,3072,16,64,256,64,4,4,510.0946666666667,3
w13,4,128,8,4096,3072,16,64,256,64,4,5,508.39900000000006,3
w13,4,128,8,4096,3072,16,64,256,64,8,2,509.7526666666667,3
w13,4,128,8,4096,3072,16,64,256,64,8,5,509.10100000000006,3
w13,4,128,8,4096,3072,16,128,128,1,4,5,510.52233333333334,3
w13,4,128,8,4096,3072,16,128,128,1,8,2,509.66900000000004,3
w13,4,128,8,4096,3072,16,128,128,1,8,4,510.3736666666666,3
w13,4,128,8,4096,3072,16,128,128,1,8,5,510.566,3
w13,4,128,8,4096,3072,16,128,128,16,8,4,510.3156666666667,3
w13,4,128,8,4096,3072,16,128,128,32,8,2,509.597,3
w13,4,128,8,4096,3072,16,128,128,64,4,4,510.5706666666667,3
w13,4,128,8,4096,3072,16,128,128,64,8,4,510.651,3
w13,4,128,8,4096,3072,32,32,256,1,4,4,510.37300000000005,3
w13,4,128,8,4096,3072,32,128,128,1,4,3,509.808,3
w13,4,128,8,4096,3072,32,128,128,1,4,4,509.48766666666666,3
w13,4,128,8,4096,3072,32,128,128,1,8,3,510.4156666666667,3
w13,4,128,8,4096,3072,32,128,128,1,8,4,510.09566666666666,3
w13,4,128,8,4096,3072,32,128,128,4,4,3,510.288,3
w13,4,128,8,4096,3072,32,128,128,4,4,4,510.032,3
w13,4,128,8,4096,3072,32,128,128,4,8,4,509.47700000000003,3
w13,4,128,8,4096,3072,32,128,128,8,4,2,510.64033333333333,3
w13,4,128,8,4096,3072,32,128,128,8,4,3,509.776,3
w13,4,128,8,4096,3072,32,128,128,8,4,4,509.9786666666667,3
w13,4,128,8,4096,3072,32,128,128,8,8,3,509.74399999999997,3
w13,4,128,8,4096,3072,32,128,128,8,8,4,509.2746666666667,3
w13,4,128,8,4096,3072,32,128,128,16,4,3,509.6793333333333,3
w13,4,128,8,4096,3072,32,128,128,16,4,4,509.968,3
w13,4,128,8,4096,3072,32,128,128,16,8,3,510.54400000000004,3
w13,4,128,8,4096,3072,32,128,128,16,8,4,509.86100000000005,3
w13,4,128,8,4096,3072,32,128,128,32,4,3,508.7626666666667,3
w13,4,128,8,4096,3072,32,128,128,32,4,4,510.1746666666666,3
w13,4,128,8,4096,3072,32,128,128,32,8,3,510.23499999999996,3
w13,4,128,8,4096,3072,32,128,128,32,8,4,509.808,3
w13,4,128,8,4096,3072,32,128,128,64,4,3,509.25333333333333,3
w13,4,128,8,4096,3072,32,128,128,64,4,4,509.03,3
w13,4,128,8,4096,3072,32,128,128,64,8,3,509.6693333333333,3
w13,4,128,8,4096,3072,32,128,128,64,8,4,509.296,3
w13,4,128,8,4096,3072,64,64,64,1,4,5,509.0083333333334,3
w13,4,128,8,4096,3072,64,64,64,4,4,5,509.5416666666667,3
w13,4,128,8,4096,3072,64,64,64,16,4,5,509.98900000000003,3
w13,4,128,8,4096,3072,64,64,64,32,4,5,510.3953333333334,3
w13,4,128,8,4096,3072,64,64,64,64,4,5,510.3096666666667,3
w13,4,128,8,4096,3072,64,64,128,1,4,3,508.059,3
w13,4,128,8,4096,3072,64,64,128,1,8,3,509.8403333333333,3
w13,4,128,8,4096,3072,64,64,128,4,4,3,509.18966666666665,3
w13,4,128,8,4096,3072,64,64,128,4,8,3,510.4373333333333,3
w13,4,128,8,4096,3072,64,64,128,8,4,3,509.2853333333333,3
w13,4,128,8,4096,3072,64,64,128,8,8,3,510.4156666666667,3
w13,4,128,8,4096,3072,64,64,128,16,4,3,509.435,3
w13,4,128,8,4096,3072,64,64,128,32,4,3,509.445,3
w13,4,128,8,4096,3072,64,64,128,32,8,3,510.37300000000005,3
w13,4,128,8,4096,3072,64,64,128,64,4,3,510.0213333333333,3
w13,4,128,8,4096,3072,64,128,64,16,4,5,510.6716666666666,3
w13,4,128,8,4096,3072,64,128,128,1,8,4,508.624,3
w13,4,128,8,4096,3072,64,128,128,4,8,4,509.4346666666667,3
w13,4,128,8,4096,3072,64,128,128,16,8,3,510.80033333333336,3
w13,4,128,8,4096,3072,64,128,128,16,8,4,509.424,3
w13,4,128,8,4096,3072,64,128,128,32,8,4,508.3253333333334,3
w13,4,128,8,4096,3072,64,128,128,64,8,3,510.56566666666663,3
w13,4,128,8,4096,3072,64,128,128,64,8,4,508.0696666666667,3
w13,8,8,2,1024,512,16,64,128,16,8,3,5.495333333333334,3
w13,8,8,2,1024,512,16,64,128,32,8,3,5.474,3
w13,8,8,2,1024,512,16,64,128,32,8,4,5.517,3
w13,8,8,2,1024,512,16,64,128,64,8,3,5.484666666666667,3
w13,8,8,2,1024,512,16,64,128,64,8,4,5.506,3
w13,8,16,2,1536,768,16,32,128,4,4,2,27.114333333333335,3
w13,8,16,2,1536,768,16,32,128,16,4,2,27.24266666666667,3
w13,8,16,2,1536,768,16,32,128,64,4,2,27.146666666666665,3
w13,8,16,4,1536,1024,16,32,64,32,4,3,35.63933333333333,3
w13,8,16,4,1536,1024,16,32,128,1,4,2,35.586333333333336,3
w13,8,16,4,1536,1024,16,32,128,4,4,2,35.60766666666667,3
w13,8,16,4,1536,1024,16,32,128,16,4,2,35.33,3
w13,8,16,4,1536,1024,16,32,128,32,4,2,35.405,3
w13,8,16,4,1536,1024,16,64,64,1,4,3,35.47933333333333,3
w13,8,16,4,1536,1024,16,64,64,32,4,3,35.49033333333333,3
w13,8,16,4,1536,1024,16,64,64,64,4,3,35.682,3
w13,8,16,4,1536,1024,16,64,128,32,4,2,35.512,3
w13,8,32,4,2048,768,16,32,64,1,4,3,67.682,3
w13,8,32,4,2048,768,16,32,128,1,4,5,67.70366666666666,3
w13,8,32,4,2048,768,16,32,128,4,4,5,67.79966666666667,3
w13,8,32,4,2048,768,16,32,128,32,4,5,67.736,3
w13,8,32,4,2048,768,16,64,64,1,4,3,67.14933333333333,3
w13,8,32,4,2048,768,16,64,64,64,4,3,67.586,3
w13,8,32,4,2048,768,16,64,128,1,4,2,67.34133333333334,3
w13,8,32,4,2048,768,16,64,128,16,4,2,67.171,3
w13,8,32,4,2048,768,16,64,128,32,4,2,67.58633333333334,3
w13,8,32,4,2048,768,16,64,128,64,4,2,67.64999999999999,3
w13,8,32,4,2048,768,16,128,128,1,8,2,67.71466666666667,3
w13,8,32,4,2048,768,16,128,128,64,8,2,67.66133333333333,3
w13,8,32,6,3072,1024,16,32,128,1,4,2,131.736,3
w13,8,32,6,3072,1024,16,32,128,1,4,5,131.40566666666666,3
w13,8,32,6,3072,1024,16,32,128,4,4,2,131.46966666666665,3
w13,8,32,6,3072,1024,16,32,128,4,4,5,132.44,3
w13,8,32,6,3072,1024,16,32,128,16,4,2,131.36233333333334,3
w13,8,32,6,3072,1024,16,32,128,16,4,5,131.69333333333336,3
w13,8,32,6,3072,1024,16,32,128,32,4,2,131.93833333333333,3
w13,8,32,6,3072,1024,16,32,128,64,4,2,131.9706666666667,3
w13,8,32,6,3072,1024,16,32,128,64,4,5,132.03433333333334,3
w13,8,32,6,3072,1024,16,32,256,1,4,3,132.05633333333333,3
w13,8,32,6,3072,1024,16,32,256,1,4,4,132.47233333333335,3
w13,8,32,6,3072,1024,16,32,256,16,4,3,131.7363333333333,3
w13,8,32,6,3072,1024,16,32,256,32,4,3,132.163,3
w13,8,32,6,3072,1024,16,32,256,32,4,4,132.39733333333334,3
w13,8,32,6,3072,1024,16,32,256,64,4,2,132.33366666666666,3
w13,8,32,6,3072,1024,16,32,256,64,4,4,132.14166666666668,3
w13,8,32,6,3072,1024,16,64,128,1,4,5,131.16033333333334,3
w13,8,32,6,3072,1024,16,64,128,1,8,5,132.01366666666667,3
w13,8,32,6,3072,1024,16,64,128,16,4,4,132.184,3
w13,8,32,6,3072,1024,16,64,128,16,4,5,132.16266666666667,3
w13,8,32,6,3072,1024,16,64,128,16,8,5,132.28,3
w13,8,32,6,3072,1024,16,64,128,32,4,4,131.80033333333333,3
w13,8,32,6,3072,1024,16,64,128,32,4,5,131.82133333333334,3
w13,8,32,6,3072,1024,16,64,128,32,8,3,131.84266666666667,3
w13,8,32,6,3072,1024,16,64,128,64,4,5,131.565,3
w13,8,32,6,3072,1024,16,64,128,64,8,3,132.163,3
w13,8,32,6,3072,1024,16,64,128,64,8,5,132.41866666666667,3
w13,8,32,6,3072,1024,16,64,256,1,8,3,132.20533333333333,3
w13,8,32,6,3072,1024,16,64,256,16,4,2,132.47233333333335,3
w13,8,32,6,3072,1024,16,64,256,16,8,3,132.30133333333333,3
w13,8,32,6,3072,1024,16,128,128,1,8,4,132.0773333333333,3
w13,8,32,6,3072,1024,16,128,128,1,8,5,132.33333333333334,3
w13,8,32,6,3072,1024,16,128,128,16,4,2,132.48299999999998,3
w13,8,32,6,3072,1024,16,128,128,16,4,4,132.451,3
w13,8,32,6,3072,1024,16,128,128,16,8,3,132.376,3
w13,8,32,6,3072,1024,16,128,128,16,8,4,132.12,3
w13,8,32,6,3072,1024,16,128,128,32,8,4,132.163,3
w13,8,32,6,3072,1024,16,128,128,64,4,2,132.259,3
w13,8,32,6,3072,1024,16,128,128,64,8,4,132.34433333333334,3
w13,8,32,6,3072,1024,32,32,128,64,4,2,132.25900000000001,3
w13,8,32,6,3072,1024,64,64,64,1,4,3,132.21633333333332,3
w13,8,32,6,3072,1024,64,64,64,4,4,3,132.08833333333334,3
w13,8,32,6,3072,1024,64,64,64,16,4,3,132.18433333333334,3
w13,8,32,6,3072,1024,64,64,64,64,4,3,132.472,3
w13,8,60,4,2048,1408,16,32,128,1,4,3,120.95166666666667,3
w13,8,60,4,2048,1408,16,32,128,1,4,5,120.92,3
w13,8,60,4,2048,1408,16,32,128,4,4,5,121.325,3
w13,8,60,4,2048,1408,16,32,128,16,4,5,121.23899999999999,3
w13,8,60,4,2048,1408,16,32,256,1,4,2,121.45299999999999,3
w13,8,60,4,2048,1408,16,32,256,1,4,3,120.83433333333333,3
w13,8,60,4,2048,1408,16,32,256,16,4,3,121.27233333333334,3
w13,8,60,4,2048,1408,16,32,256,32,4,3,121.293,3
w13,8,60,4,2048,1408,16,32,256,64,4,2,121.645,3
w13,8,60,4,2048,1408,16,32,256,64,4,3,121.63433333333334,3
w13,8,60,4,2048,1408,16,64,128,1,4,3,120.91966666666667,3
w13,8,60,4,2048,1408,16,64,128,1,4,4,120.69533333333334,3
w13,8,60,4,2048,1408,16,64,128,1,4,5,121.016,3
w13,8,60,4,2048,1408,16,64,128,1,8,3,121.39966666666668,3
w13,8,60,4,2048,1408,16,64,128,16,4,2,121.17566666666669,3
w13,8,60,4,2048,1408,16,64,128,16,4,4,121.61366666666667,3
w13,8,60,4,2048,1408,16,64,128,16,8,3,121.51733333333334,3
w13,8,60,4,2048,1408,16,64,128,32,4,3,121.46366666666665,3
w13,8,60,4,2048,1408,16,64,128,32,4,4,121.15466666666667,3
w13,8,60,4,2048,1408,16,64,256,16,4,2,121.62366666666667,3
w13,8,60,4,2048,1408,16,64,256,32,4,2,121.39999999999999,3
w13,8,60,4,2048,1408,16,64,256,64,4,2,121.45333333333333,3
w13,8,60,4,2048,1408,16,128,128,1,8,2,120.43933333333332,3
w13,8,60,4,2048,1408,16,128,128,32,8,2,120.85633333333334,3
w13,8,60,4,2048,1408,16,128,128,32,8,3,121.62433333333333,3
w13,8,60,4,2048,1408,16,128,128,64,8,2,121.46366666666665,3
w13,8,60,4,2048,1408,32,128,128,4,4,3,121.32566666666666,3
w13,8,60,4,2048,1408,32,128,128,32,4,3,121.57133333333333,3
w13,8,60,4,2048,1408,32,128,128,64,4,3,121.64533333333334,3
w13,8,60,6,3584,2304,16,32,128,1,4,2,500.891,3
w13,8,60,6,3584,2304,16,32,128,1,4,4,503.25933333333336,3
w13,8,60,6,3584,2304,16,32,128,1,4,5,499.6646666666666,3
w13,8,60,6,3584,2304,16,32,128,4,4,2,500.806,3
w13,8,60,6,3584,2304,16,32,128,4,4,4,503.1843333333333,3
w13,8,60,6,3584,2304,16,32,128,4,4,5,500.421,3
w13,8,60,6,3584,2304,16,32,128,16,4,2,501.68066666666664,3
w13,8,60,6,3584,2304,16,32,128,16,4,5,500.57099999999997,3
w13,8,60,6,3584,2304,16,32,128,32,4,2,500.83733333333333,3
w13,8,60,6,3584,2304,16,32,128,32,4,5,499.97299999999996,3
w13,8,60,6,3584,2304,16,32,128,64,4,2,501.4246666666667,3
w13,8,60,6,3584,2304,16,32,128,64,4,5,500.56,3
w13,8,60,6,3584,2304,16,32,256,1,4,2,499.579,3
w13,8,60,6,3584,2304,16,32,256,1,4,3,498.4156666666666,3
w13,8,60,6,3584,2304,16,32,256,1,4,4,499.26933333333335,3
w13,8,60,6,3584,2304,16,32,256,1,4,5,499.0246666666667,3
w13,8,60,6,3584,2304,16,32,256,16,4,2,500.9013333333333,3
w13,8,60,6,3584,2304,16,32,256,16,4,3,499.046,3
w13,8,60,6,3584,2304,16,32,256,16,4,4,500.5496666666666,3
w13,8,60,6,3584,2304,16,32,256,16,4,5,500.2076666666667,3
w13,8,60,6,3584,2304,16,32,256,32,4,2,500.4216666666666,3
w13,8,60,6,3584,2304,16,32,256,32,4,3,499.942,3
w13,8,60,6,3584,2304,16,32,256,32,4,4,500.2083333333333,3
w13,8,60,6,3584,2304,16,32,256,32,4,5,500.7203333333334,3
w13,8,60,6,3584,2304,16,32,256,64,4,2,502.04266666666666,3
w13,8,60,6,3584,2304,16,32,256,64,4,3,499.96233333333333,3
w13,8,60,6,3584,2304,16,32,256,64,4,4,500.2083333333333,3
w13,8,60,6,3584,2304,16,32,256,64,4,5,500.2616666666666,3
w13,8,60,6,3584,2304,16,64,128,1,4,3,500.5596666666667,3
w13,8,60,6,3584,2304,16,64,128,1,4,5,498.23533333333336,3
w13,8,60,6,3584,2304,16,64,128,1,8,5,498.7896666666666,3
w13,8,60,6,3584,2304,16,64,128,16,4,3,500.63533333333334,3
w13,8,60,6,3584,2304,16,64,128,16,4,4,501.89300000000003,3
w13,8,60,6,3584,2304,16,64,128,16,4,5,499.6743333333333,3
w13,8,60,6,3584,2304,16,64,128,16,8,5,499.9736666666667,3
w13,8,60,6,3584,2304,16,64,128,32,4,2,503.195,3
w13,8,60,6,3584,2304,16,64,128,32,4,3,500.82633333333337,3
w13,8,60,6,3584,2304,16,64,128,32,4,4,502.981,3
w13,8,60,6,3584,2304,16,64,128,32,4,5,499.579,3
w13,8,60,6,3584,2304,16,64,128,32,8,5,499.65333333333336,3
w13,8,60,6,3584,2304,16,64,128,64,4,3,500.3153333333333,3
w13,8,60,6,3584,2304,16,64,128,64,4,4,502.3093333333333,3
w13,8,60,6,3584,2304,16,64,128,64,4,5,499.2583333333334,3
w13,8,60,6,3584,2304,16,64,128,64,8,5,500.4113333333333,3
w13,8,60,6,3584,2304,16,64,256,1,4,3,498.704,3
w13,8,60,6,3584,2304,16,64,256,1,4,4,502.2776666666667,3
w13,8,60,6,3584,2304,16,64,256,1,4,5,499.95166666666665,3
w13,8,60,6,3584,2304,16,64,256,1,8,2,501.8503333333333,3
w13,8,60,6,3584,2304,16,64,256,1,8,3,498.66200000000003,3
w13,8,60,6,3584,2304,16,64,256,1,8,4,501.9363333333333,3
w13,8,60,6,3584,2304,16,64,256,1,8,5,500.58166666666665,3
w13,8,60,6,3584,2304,16,64,256,16,4,3,500.04766666666666,3
w13,8,60,6,3584,2304,16,64,256,16,4,5,501.25399999999996,3
w13,8,60,6,3584,2304,16,64,256,16,8,2,502.23533333333336,3
w13,8,60,6,3584,2304,16,64,256,16,8,3,499.5783333333333,3
w13,8,60,6,3584,2304,16,64,256,16,8,5,502.1073333333334,3
w13,8,60,6,3584,2304,16,64,256,32,4,3,499.88866666666667,3
w13,8,60,6,3584,2304,16,64,256,32,4,5,501.7443333333333,3
w13,8,60,6,3584,2304,16,64,256,32,8,2,502.3413333333333,3
w13,8,60,6,3584,2304,16,64,256,32,8,3,499.0986666666667,3
w13,8,60,6,3584,2304,16,64,256,32,8,5,501.797,3
w13,8,60,6,3584,2304,16,64,256,64,4,3,500.06933333333336,3
w13,8,60,6,3584,2304,16,64,256,64,4,5,502.6513333333333,3
w13,8,60,6,3584,2304,16,64,256,64,8,2,501.6913333333334,3
w13,8,60,6,3584,2304,16,64,256,64,8,3,501.12533333333334,3
w13,8,60,6,3584,2304,16,64,256,64,8,5,502.72566666666665,3
w13,8,60,6,3584,2304,16,128,128,1,4,5,501.8296666666667,3
w13,8,60,6,3584,2304,16,128,128,1,8,5,498.34099999999995,3
w13,8,60,6,3584,2304,16,128,128,16,4,5,501.9463333333333,3
w13,8,60,6,3584,2304,16,128,128,16,8,5,500.14466666666664,3
w13,8,60,6,3584,2304,16,128,128,32,4,5,501.6913333333334,3
w13,8,60,6,3584,2304,16,128,128,32,8,5,499.61066666666665,3
w13,8,60,6,3584,2304,16,128,128,64,4,5,503.09933333333333,3
w13,8,60,6,3584,2304,16,128,128,64,8,5,500.816,3
w13,8,60,6,3584,2304,32,32,128,1,4,4,500.00500000000005,3
w13,8,60,6,3584,2304,32,32,128,4,4,4,501.926,3
w13,8,60,6,3584,2304,32,32,128,4,4,5,502.843,3
w13,8,60,6,3584,2304,32,32,128,16,4,4,501.8833333333334,3
w13,8,60,6,3584,2304,32,32,128,16,4,5,502.77933333333334,3
w13,8,60,6,3584,2304,32,32,128,64,4,4,501.94733333333335,3
w13,8,60,6,3584,2304,32,64,128,1,4,5,501.712,3
w13,8,60,6,3584,2304,32,64,128,1,8,5,501.883,3
w13,8,60,6,3584,2304,32,64,128,4,4,5,501.445,3
w13,8,60,6,3584,2304,32,64,128,4,8,5,501.74399999999997,3
w13,8,60,6,3584,2304,32,64,128,16,4,5,502.469,3
w13,8,60,6,3584,2304,32,64,128,16,8,5,502.2453333333333,3
w13,8,60,6,3584,2304,32,64,128,32,4,5,503.19533333333334,3
w13,8,60,6,3584,2304,32,64,128,32,8,5,502.54400000000004,3
w13,8,60,6,3584,2304,32,64,128,64,4,5,502.853,3
w13,8,60,6,3584,2304,32,64,128,64,8,5,503.1623333333334,3
w13,8,60,6,3584,2304,32,64,256,1,8,3,501.21133333333336,3
w13,8,60,6,3584,2304,32,64,256,1,8,5,502.7996666666666,3
w13,8,60,6,3584,2304,32,64,256,8,8,3,502.29833333333335,3
w13,8,60,6,3584,2304,32,64,256,16,8,3,503.0456666666667,3
w13,8,60,6,3584,2304,32,64,256,32,8,3,502.10666666666674,3
w13,8,60,6,3584,2304,32,64,256,64,8,3,502.5653333333333,3
w13,8,60,6,3584,2304,32,128,128,1,4,4,502.90633333333335,3
w13,8,60,6,3584,2304,32,128,128,1,4,5,501.5416666666667,3
w13,8,60,6,3584,2304,32,128,128,1,8,5,501.26433333333335,3
w13,8,60,6,3584,2304,32,128,128,4,4,5,503.1093333333333,3
w13,8,60,6,3584,2304,32,128,128,8,4,5,502.24600000000004,3
w13,8,60,6,3584,2304,32,128,128,8,8,5,501.616,3
w13,8,60,6,3584,2304,32,128,128,16,4,5,503.03433333333334,3
w13,8,60,6,3584,2304,32,128,128,16,8,5,502.853,3
w13,8,60,6,3584,2304,32,128,128,32,4,5,502.87466666666666,3
w13,8,60,6,3584,2304,32,128,128,32,8,5,502.3313333333333,3
w13,8,60,6,3584,2304,32,128,128,64,4,5,503.1623333333334,3
w13,8,60,6,3584,2304,32,128,128,64,8,5,501.8833333333334,3
w13,8,60,6,3584,2304,64,128,128,1,8,4,502.9703333333334,3
w13,8,60,8,2048,1536,16,32,128,1,4,2,240.2166666666667,3
w13,8,60,8,2048,1536,16,32,128,1,4,4,241.18733333333333,3
w13,8,60,8,2048,1536,16,32,128,1,4,5,240.52599999999998,3
w13,8,60,8,2048,1536,16,32,128,4,4,2,240.10999999999999,3
w13,8,60,8,2048,1536,16,32,128,4,4,4,241.83866666666665,3
w13,8,60,8,2048,1536,16,32,128,4,4,5,241.27233333333334,3
w13,8,60,8,2048,1536,16,32,128,16,4,2,240.47299999999998,3
w13,8,60,8,2048,1536,16,32,128,16,4,4,241.03833333333333,3
w13,8,60,8,2048,1536,16,32,128,16,4,5,240.48333333333335,3
w13,8,60,8,2048,1536,16,32,128,32,4,2,241.20866666666666,3
w13,8,60,8,2048,1536,16,32,128,32,4,4,241.283,3
w13,8,60,8,2048,1536,16,32,128,32,4,5,240.292,3
w13,8,60,8,2048,1536,16,32,128,64,4,2,241.43233333333333,3
w13,8,60,8,2048,1536,16,32,128,64,4,4,241.16600000000003,3
w13,8,60,8,2048,1536,16,32,128,64,4,5,241.68833333333336,3
w13,8,60,8,2048,1536,16,32,256,1,4,3,240.035,3
w13,8,60,8,2048,1536,16,32,256,1,4,4,241.13400000000001,3
w13,8,60,8,2048,1536,16,32,256,1,4,5,241.273,3
w13,8,60,8,2048,1536,16,32,256,16,4,2,242.32866666666666,3
w13,8,60,8,2048,1536,16,32,256,16,4,3,240.345,3
w13,8,60,8,2048,1536,16,32,256,16,4,4,240.867,3
w13,8,60,8,2048,1536,16,32,256,16,4,5,241.17666666666665,3
w13,8,60,8,2048,1536,16,32,256,32,4,2,242.32833333333335,3
w13,8,60,8,2048,1536,16,32,256,32,4,3,240.96366666666665,3
w13,8,60,8,2048,1536,16,32,256,32,4,4,240.78166666666667,3
w13,8,60,8,2048,1536,16,32,256,32,4,5,241.89133333333334,3
w13,8,60,8,2048,1536,16,32,256,64,4,3,241.30533333333332,3
w13,8,60,8,2048,1536,16,32,256,64,4,4,241.46433333333334,3
w13,8,60,8,2048,1536,16,32,256,64,4,5,242.37133333333335,3
w13,8,60,8,2048,1536,16,64,128,1,4,2,240.14233333333334,3
w13,8,60,8,2048,1536,16,64,128,1,4,4,240.75,3
w13,8,60,8,2048,1536,16,64,128,1,4,5,240.40866666666668,3
w13,8,60,8,2048,1536,16,64,128,1,8,3,242.42499999999998,3
w13,8,60,8,2048,1536,16,64,128,1,8,4,241.731,3
w13,8,60,8,2048,1536,16,64,128,1,8,5,240.4723333333333,3
w13,8,60,8,2048,1536,16,64,128,16,4,2,240.49433333333332,3
w13,8,60,8,2048,1536,16,64,128,16,4,4,240.7603333333333,3
w13,8,60,8,2048,1536,16,64,128,16,4,5,240.35566666666668,3
w13,8,60,8,2048,1536,16,64,128,16,8,4,240.547,3
w13,8,60,8,2048,1536,16,64,128,16,8,5,240.729,3
w13,8,60,8,2048,1536,16,64,128,32,4,2,240.867,3
w13,8,60,8,2048,1536,16,64,128,32,4,4,240.41966666666667,3
w13,8,60,8,2048,1536,16,64,128,32,4,5,240.36566666666667,3
w13,8,60,8,2048,1536,16,64,128,32,8,4,241.19766666666666,3
w13,8,60,8,2048,1536,16,64,128,32,8,5,241.51833333333335,3
w13,8,60,8,2048,1536,16,64,128,64,4,2,240.75033333333332,3
w13,8,60,8,2048,1536,16,64,128,64,4,4,241.316,3
w13,8,60,8,2048,1536,16,64,128,64,4,5,242.16833333333332,3
w13,8,60,8,2048,1536,16,64,128,64,8,4,242.06166666666664,3
w13,8,60,8,2048,1536,16,64,128,64,8,5,241.187,3
w13,8,60,8,2048,1536,16,64,256,1,4,2,242.08333333333334,3
w13,8,60,8,2048,1536,16,64,256,1,4,3,240.67566666666667,3
w13,8,60,8,2048,1536,16,64,256,1,8,3,241.02766666666665,3
w13,8,60,8,2048,1536,16,64,256,16,4,2,241.667,3
w13,8,60,8,2048,1536,16,64,256,16,4,3,241.23033333333333,3
w13,8,60,8,2048,1536,16,64,256,16,8,3,240.49366666666666,3
w13,8,60,8,2048,1536,16,64,256,32,4,3,241.00633333333334,3
w13,8,60,8,2048,1536,16,64,256,32,8,3,240.91,3
w13,8,60,8,2048,1536,16,64,256,64,4,3,241.795,3
w13,8,60,8,2048,1536,16,64,256,64,8,3,241.51766666666666,3
w13,8,60,8,2048,1536,16,128,128,1,4,2,241.59233333333336,3
w13,8,60,8,2048,1536,16,128,128,1,4,3,240.889,3
w13,8,60,8,2048,1536,16,128,128,1,4,5,242.44566666666665,3
w13,8,60,8,2048,1536,16,128,128,1,8,2,240.46166666666667,3
w13,8,60,8,2048,1536,16,128,128,1,8,3,240.857,3
w13,8,60,8,2048,1536,16,128,128,1,8,5,240.92066666666665,3
w13,8,60,8,2048,1536,16,128,128,16,4,2,241.35799999999998,3
w13,8,60,8,2048,1536,16,128,128,16,8,2,241.25199999999998,3
w13,8,60,8,2048,1536,16,128,128,16,8,3,241.02766666666665,3
w13,8,60,8,2048,1536,16,128,128,16,8,5,241.20866666666666,3
w13,8,60,8,2048,1536,16,128,128,32,4,3,242.211,3
w13,8,60,8,2048,1536,16,128,128,32,8,2,241.625,3
w13,8,60,8,2048,1536,16,128,128,32,8,3,241.26200000000003,3
w13,8,60,8,2048,1536,16,128,128,32,8,5,241.29366666666667,3
w13,8,60,8,2048,1536,16,128,128,64,4,2,242.41466666666668,3
w13,8,60,8,2048,1536,16,128,128,64,4,3,242.13666666666666,3
w13,8,60,8,2048,1536,16,128,128,64,8,2,241.01733333333334,3
w13,8,60,8,2048,1536,16,128,128,64,8,5,241.32633333333334,3
w13,8,60,8,2048,1536,32,32,128,1,4,4,242.01933333333332,3
w13,8,60,8,2048,1536,32,32,128,4,4,4,242.25366666666665,3
w13,8,60,8,2048,1536,32,32,128,16,4,4,242.02966666666669,3
w13,8,60,8,2048,1536,32,128,128,4,4,3,242.44566666666665,3
w13,8,60,8,2048,1536,32,128,128,16,4,3,242.14700000000002,3
w13,8,64,6,3072,2048,16,32,128,1,4,3,383.50600000000003,3
w13,8,64,6,3072,2048,16,32,128,1,4,5,383.07933333333335,3
w13,8,64,6,3072,2048,16,32,128,4,4,3,384.103,3
w13,8,64,6,3072,2048,16,32,128,4,4,4,385.26533333333333,3
w13,8,64,6,3072,2048,16,32,128,4,4,5,383.87899999999996,3
w13,8,64,6,3072,2048,16,32,128,16,4,5,384.4013333333333,3
w13,8,64,6,3072,2048,16,32,128,64,4,3,384.8386666666667,3
w13,8,64,6,3072,2048,16,32,128,64,4,4,384.721,3
w13,8,64,6,3072,2048,16,32,128,64,4,5,385.0306666666667,3
w13,8,64,6,3072,2048,16,32,256,1,4,2,383.54866666666663,3
w13,8,64,6,3072,2048,16,32,256,1,4,3,383.88966666666664,3
w13,8,64,6,3072,2048,16,32,256,1,4,4,381.90633333333335,3
w13,8,64,6,3072,2048,16,32,256,1,4,5,381.5116666666666,3
w13,8,64,6,3072,2048,16,32,256,16,4,3,383.90066666666667,3
w13,8,64,6,3072,2048,16,32,256,16,4,4,383.047,3
w13,8,64,6,3072,2048,16,32,256,16,4,5,382.03399999999993,3
w13,8,64,6,3072,2048,16,32,256,32,4,4,382.9726666666667,3
w13,8,64,6,3072,2048,16,32,256,32,4,5,382.50333333333333,3
w13,8,64,6,3072,2048,16,32,256,64,4,2,385.36133333333333,3
w13,8,64,6,3072,2048,16,32,256,64,4,3,385.36100000000005,3
w13,8,64,6,3072,2048,16,32,256,64,4,4,384.13466666666665,3
w13,8,64,6,3072,2048,16,32,256,64,4,5,383.26,3
w13,8,64,6,3072,2048,16,64,128,1,4,3,385.2966666666666,3
w13,8,64,6,3072,2048,16,64,128,1,4,4,382.4506666666667,3
w13,8,64,6,3072,2048,16,64,128,1,4,5,384.72166666666664,3
w13,8,64,6,3072,2048,16,64,128,1,8,2,383.58,3
w13,8,64,6,3072,2048,16,64,128,1,8,3,384.8813333333333,3
w13,8,64,6,3072,2048,16,64,128,1,8,4,385.2863333333333,3
w13,8,64,6,3072,2048,16,64,128,1,8,5,384.27366666666666,3
w13,8,64,6,3072,2048,16,64,128,16,4,5,385.23333333333335,3
w13,8,64,6,3072,2048,16,64,128,16,8,5,385.201,3
w13,8,64,6,3072,2048,16,64,128,64,4,4,384.8283333333334,3
w13,8,64,6,3072,2048,16,64,256,1,4,2,384.38033333333334,3
w13,8,64,6,3072,2048,16,64,256,1,4,3,383.7296666666667,3
w13,8,64,6,3072,2048,16,64,256,1,4,4,383.29299999999995,3
w13,8,64,6,3072,2048,16,64,256,1,4,5,383.7613333333333,3
w13,8,64,6,3072,2048,16,64,256,1,8,2,384.796,3
w13,8,64,6,3072,2048,16,64,256,1,8,3,384.9883333333333,3
w13,8,64,6,3072,2048,16,64,256,1,8,4,384.66799999999995,3
w13,8,64,6,3072,2048,16,64,256,1,8,5,384.2093333333333,3
w13,8,64,6,3072,2048,16,64,256,16,4,3,384.20966666666664,3
w13,8,64,6,3072,2048,16,64,256,16,4,5,383.762,3
w13,8,64,6,3072,2048,16,64,256,16,8,5,384.7316666666666,3
w13,8,64,6,3072,2048,16,64,256,32,4,2,385.2753333333333,3
w13,8,64,6,3072,2048,16,64,256,32,4,5,383.741,3
w13,8,64,6,3072,2048,16,64,256,32,8,2,384.60366666666664,3
w13,8,64,6,3072,2048,16,64,256,32,8,5,385.14799999999997,3
w13,8,64,6,3072,2048,16,64,256,64,4,5,384.0496666666666,3
w13,8,64,6,3072,2048,16,128,128,1,4,2,384.71066666666667,3
w13,8,64,6,3072,2048,16,128,128,1,4,4,384.721,3
w13,8,64,6,3072,2048,16,128,128,1,8,2,383.2176666666667,3
w13,8,64,6,3072,2048,16,128,128,1,8,3,384.4756666666667,3
w13,8,64,6,3072,2048,16,128,128,1,8,4,384.913,3
w13,8,64,6,3072,2048,16,128,128,1,8,5,384.156,3
w13,8,64,6,3072,2048,16,128,128,16,4,2,385.26466666666664,3
w13,8,64,6,3072,2048,16,128,128,16,8,2,384.295,3
w13,8,64,6,3072,2048,32,32,128,1,4,2,384.56166666666667,3
w13,8,64,6,3072,2048,32,32,128,1,4,3,384.72133333333335,3
w13,8,64,6,3072,2048,32,32,128,4,4,2,384.5933333333333,3
w13,8,64,6,3072,2048,32,32,128,64,4,2,385.05233333333337,3
w13,8,64,6,3072,2048,32,64,128,1,4,2,385.1903333333333,3
w13,8,64,6,3072,2048,32,128,128,1,4,2,384.6573333333333,3
w13,8,64,6,3072,2048,32,128,128,1,4,3,383.79333333333335,3
w13,8,64,6,3072,2048,32,128,128,1,8,3,383.6016666666667,3
w13,8,64,6,3072,2048,32,128,128,4,4,3,384.72166666666664,3
w13,8,64,6,3072,2048,32,128,128,4,8,3,384.62533333333334,3
w13,8,64,6,3072,2048,64,64,64,1,4,3,385.0733333333333,3
w13,8,64,6,3584,1536,16,32,128,1,4,2,335.04466666666667,3
w13,8,64,6,3584,1536,16,32,128,1,4,4,337.711,3
w13,8,64,6,3584,1536,16,32,128,1,4,5,336.303,3
w13,8,64,6,3584,1536,16,32,128,4,4,2,336.67633333333333,3
w13,8,64,6,3584,1536,16,32,128,4,4,5,337.4443333333333,3
w13,8,64,6,3584,1536,16,32,128,16,4,2,337.67900000000003,3
w13,8,64,6,3584,1536,16,32,128,16,4,5,336.623,3
w13,8,64,6,3584,1536,16,32,128,32,4,2,336.9853333333333,3
w13,8,64,6,3584,1536,16,32,128,32,4,5,334.9483333333333,3
w13,8,64,6,3584,1536,16,32,128,64,4,2,335.62033333333335,3
w13,8,64,6,3584,1536,16,32,128,64,4,5,336.40933333333334,3
w13,8,64,6,3584,1536,16,32,256,1,4,2,335.79066666666665,3
w13,8,64,6,3584,1536,16,32,256,1,4,3,335.428,3
w13,8,64,6,3584,1536,16,32,256,1,4,4,336.2386666666667,3
w13,8,64,6,3584,1536,16,32,256,1,4,5,336.03633333333335,3
w13,8,64,6,3584,1536,16,32,256,16,4,2,336.2176666666667,3
w13,8,64,6,3584,1536,16,32,256,16,4,3,335.6093333333333,3
w13,8,64,6,3584,1536,16,32,256,16,4,4,336.7933333333333,3
w13,8,64,6,3584,1536,16,32,256,16,4,5,336.868,3
w13,8,64,6,3584,1536,16,32,256,32,4,2,336.036,3
w13,8,64,6,3584,1536,16,32,256,32,4,3,335.71633333333335,3
w13,8,64,6,3584,1536,16,32,256,32,4,4,336.762,3
w13,8,64,6,3584,1536,16,32,256,32,4,5,336.4843333333333,3
w13,8,64,6,3584,1536,16,32,256,64,4,2,337.24133333333333,3
w13,8,64,6,3584,1536,16,32,256,64,4,3,335.84433333333334,3
w13,8,64,6,3584,1536,16,32,256,64,4,5,337.028,3
w13,8,64,6,3584,1536,16,64,128,1,4,3,337.391,3
w13,8,64,6,3584,1536,16,64,128,1,4,4,334.6496666666667,3
w13,8,64,6,3584,1536,16,64,128,1,4,5,334.74566666666664,3
w13,8,64,6,3584,1536,16,64,128,1,8,4,336.66566666666665,3
w13,8,64,6,3584,1536,16,64,128,1,8,5,336.08933333333334,3
w13,8,64,6,3584,1536,16,64,128,16,4,3,337.284,3
w13,8,64,6,3584,1536,16,64,128,16,4,4,335.70533333333333,3
w13,8,64,6,3584,1536,16,64,128,16,4,5,335.66266666666667,3
w13,8,64,6,3584,1536,16,64,128,16,8,4,337.72133333333335,3
w13,8,64,6,3584,1536,16,64,128,16,8,5,335.972,3
w13,8,64,6,3584,1536,16,64,128,32,4,3,336.49466666666666,3
w13,8,64,6,3584,1536,16,64,128,32,4,4,336.2386666666667,3
w13,8,64,6,3584,1536,16,64,128,32,4,5,334.959,3
w13,8,64,6,3584,1536,16,64,128,32,8,4,337.743,3
w13,8,64,6,3584,1536,16,64,128,32,8,5,336.14233333333334,3
w13,8,64,6,3584,1536,16,64,128,64,4,3,337.75333333333333,3
w13,8,64,6,3584,1536,16,64,128,64,4,4,335.6843333333333,3
w13,8,64,6,3584,1536,16,64,128,64,4,5,335.7266666666667,3
w13,8,64,6,3584,1536,16,64,128,64,8,4,337.7746666666667,3
w13,8,64,6,3584,1536,16,64,128,64,8,5,336.868,3
w13,8,64,6,3584,1536,16,64,256,1,4,3,336.20666666666665,3
w13,8,64,6,3584,1536,16,64,256,1,4,5,336.6333333333334,3
w13,8,64,6,3584,1536,16,64,256,1,8,2,335.812,3
w13,8,64,6,3584,1536,16,64,256,1,8,3,336.24933333333337,3
w13,8,64,6,3584,1536,16,64,256,1,8,5,337.27366666666666,3
w13,8,64,6,3584,1536,16,64,256,16,4,3,336.484,3
w13,8,64,6,3584,1536,16,64,256,16,8,2,336.5056666666667,3
w13,8,64,6,3584,1536,16,64,256,16,8,3,336.52666666666664,3
w13,8,64,6,3584,1536,16,64,256,16,8,5,337.94533333333334,3
w13,8,64,6,3584,1536,16,64,256,32,4,3,335.887,3
w13,8,64,6,3584,1536,16,64,256,32,8,2,336.634,3
w13,8,64,6,3584,1536,16,64,256,32,8,3,336.11066666666665,3
w13,8,64,6,3584,1536,16,64,256,64,4,3,336.57,3
w13,8,64,6,3584,1536,16,64,256,64,8,2,336.484,3
w13,8,64,6,3584,1536,16,64,256,64,8,3,337.124,3
w13,8,64,6,3584,1536,16,128,128,1,4,3,337.3693333333334,3
w13,8,64,6,3584,1536,16,128,128,1,4,5,337.764,3
w13,8,64,6,3584,1536,16,128,128,1,8,2,336.292,3
w13,8,64,6,3584,1536,16,128,128,1,8,3,336.719,3
w13,8,64,6,3584,1536,16,128,128,1,8,5,335.08666666666664,3
w13,8,64,6,3584,1536,16,128,128,16,4,3,337.32666666666665,3
w13,8,64,6,3584,1536,16,128,128,16,8,2,336.58,3
w13,8,64,6,3584,1536,16,128,128,16,8,3,336.58,3
w13,8,64,6,3584,1536,16,128,128,16,8,5,335.87666666666667,3
w13,8,64,6,3584,1536,16,128,128,32,4,3,337.95599999999996,3
w13,8,64,6,3584,1536,16,128,128,32,8,2,336.15333333333336,3
w13,8,64,6,3584,1536,16,128,128,32,8,3,336.78266666666667,3
w13,8,64,6,3584,1536,16,128,128,32,8,5,337.135,3
w13,8,64,6,3584,1536,16,128,128,64,8,2,336.996,3
w13,8,64,6,3584,1536,16,128,128,64,8,5,337.668,3
w13,8,64,6,3584,1536,32,32,128,1,4,3,337.252,3
w13,8,64,6,3584,1536,32,32,128,1,4,4,337.34833333333336,3
w13,8,64,6,3584,1536,32,32,128,4,4,3,336.85766666666666,3
w13,8,64,6,3584,1536,32,32,128,16,4,3,337.7,3
w13,8,64,6,3584,1536,32,32,128,64,4,3,336.8786666666667,3
w13,8,64,6,3584,1536,32,128,128,1,4,2,337.34833333333336,3
w13,8,64,6,3584,1536,32,128,128,8,4,2,337.30566666666664,3
w13,8,64,6,3584,1536,32,128,128,16,4,2,337.81766666666664,3
w13,8,64,6,3584,1536,32,128,128,64,4,2,337.77500000000003,3
w13,8,64,6,3584,1536,64,64,64,1,4,5,337.98833333333334,3
w13,8,64,6,3584,1536,64,128,128,1,8,4,337.88166666666666,3
w13,8,64,8,3584,2560,16,16,128,1,4,4,741.0953333333333,3
w13,8,64,8,3584,2560,16,16,256,1,4,3,740.125,3
w13,8,64,8,3584,2560,16,16,256,1,4,4,739.4843333333333,3
w13,8,64,8,3584,2560,16,16,256,1,4,5,739.6550000000001,3
w13,8,64,8,3584,2560,16,16,256,4,4,3,741.3083333333334,3
w13,8,64,8,3584,2560,16,16,256,4,4,4,739.8576666666668,3
w13,8,64,8,3584,2560,16,16,256,4,4,5,740.1883333333334,3
w13,8,64,8,3584,2560,16,32,128,1,4,2,740.221,3
w13,8,64,8,3584,2560,16,32,128,1,4,4,741.4156666666667,3
w13,8,64,8,3584,2560,16,32,128,1,4,5,737.6073333333334,3
w13,8,64,8,3584,2560,16,32,128,1,8,5,740.1353333333333,3
w13,8,64,8,3584,2560,16,32,128,4,4,2,740.605,3
w13,8,64,8,3584,2560,16,32,128,4,4,5,739.218,3
w13,8,64,8,3584,2560,16,32,128,16,4,5,738.5356666666667,3
w13,8,64,8,3584,2560,16,32,128,32,4,4,741.0203333333334,3
w13,8,64,8,3584,2560,16,32,128,32,4,5,740.2736666666666,3
w13,8,64,8,3584,2560,16,32,128,64,4,5,740.3493333333332,3
w13,8,64,8,3584,2560,16,32,256,1,4,2,738.6426666666666,3
w13,8,64,8,3584,2560,16,32,256,1,4,3,734.93,3
w13,8,64,8,3584,2560,16,32,256,1,4,4,736.2743333333333,3
w13,8,64,8,3584,2560,16,32,256,1,4,5,734.3216666666667,3
w13,8,64,8,3584,2560,16,32,256,1,8,5,739.794,3
w13,8,64,8,3584,2560,16,32,256,16,4,2,739.2603333333333,3
w13,8,64,8,3584,2560,16,32,256,16,4,3,737.447,3
w13,8,64,8,3584,2560,16,32,256,16,4,4,736.7216666666667,3
w13,8,64,8,3584,2560,16,32,256,16,4,5,736.1243333333333,3
w13,8,64,8,3584,2560,16,32,256,32,4,2,738.951,3
w13,8,64,8,3584,2560,16,32,256,32,4,3,738.7376666666668,3
w13,8,64,8,3584,2560,16,32,256,32,4,4,739.1963333333333,3
w13,8,64,8,3584,2560,16,32,256,32,4,5,737.0206666666667,3
w13,8,64,8,3584,2560,16,32,256,64,4,2,741.4053333333333,3
w13,8,64,8,3584,2560,16,32,256,64,4,3,740.5836666666668,3
w13,8,64,8,3584,2560,16,32,256,64,4,4,738.4503333333333,3
w13,8,64,8,3584,2560,16,32,256,64,4,5,739.9323333333333,3
w13,8,64,8,3584,2560,16,64,128,1,4,3,740.4236666666666,3
w13,8,64,8,3584,2560,16,64,128,1,4,4,740.1463333333332,3
w13,8,64,8,3584,2560,16,64,128,1,4,5,735.5166666666668,3
w13,8,64,8,3584,2560,16,64,128,1,8,2,741.6823333333333,3
w13,8,64,8,3584,2560,16,64,128,1,8,5,736.0186666666667,3
w13,8,64,8,3584,2560,16,64,128,16,4,3,741.6503333333334,3
w13,8,64,8,3584,2560,16,64,128,16,4,4,740.9353333333333,3
w13,8,64,8,3584,2560,16,64,128,16,4,5,738.7056666666667,3
w13,8,64,8,3584,2560,16,64,128,16,8,5,737.031,3
w13,8,64,8,3584,2560,16,64,128,32,4,4,740.6156666666667,3
w13,8,64,8,3584,2560,16,64,128,32,4,5,738.3646666666667,3
w13,8,64,8,3584,2560,16,64,128,32,8,5,738.4923333333332,3
w13,8,64,8,3584,2560,16,64,128,64,4,5,739.2496666666666,3
w13,8,64,8,3584,2560,16,64,128,64,8,5,740.114,3
w13,8,64,8,3584,2560,16,64,256,1,4,3,736.199,3
w13,8,64,8,3584,2560,16,64,256,1,4,4,737.4156666666667,3
w13,8,64,8,3584,2560,16,64,256,1,4,5,735.57,3
w13,8,64,8,3584,2560,16,64,256,1,8,2,739.378,3
w13,8,64,8,3584,2560,16,64,256,1,8,3,735.5166666666668,3
w13,8,64,8,3584,2560,16,64,256,1,8,4,738.3326666666667,3
w13,8,64,8,3584,2560,16,64,256,1,8,5,735.4853333333334,3
w13,8,64,8,3584,2560,16,64,256,16,4,3,737.2656666666667,3
w13,8,64,8,3584,2560,16,64,256,16,4,4,739.4743333333332,3
w13,8,64,8,3584,2560,16,64,256,16,4,5,737.6186666666666,3
w13,8,64,8,3584,2560,16,64,256,16,8,2,739.5169999999999,3
w13,8,64,8,3584,2560,16,64,256,16,8,3,736.5086666666666,3
w13,8,64,8,3584,2560,16,64,256,16,8,4,740.167,3
w13,8,64,8,3584,2560,16,64,256,16,8,5,737.149,3
w13,8,64,8,3584,2560,16,64,256,32,4,3,738.4603333333333,3
w13,8,64,8,3584,2560,16,64,256,32,4,4,741.1266666666667,3
w13,8,64,8,3584,2560,16,64,256,32,4,5,738.375,3
w13,8,64,8,3584,2560,16,64,256,32,8,2,739.7296666666667,3
w13,8,64,8,3584,2560,16,64,256,32,8,3,738.311,3
w13,8,64,8,3584,2560,16,64,256,32,8,5,738.2363333333333,3
w13,8,64,8,3584,2560,16,64,256,64,4,3,740.4230000000001,3
w13,8,64,8,3584,2560,16,64,256,64,8,3,739.3996666666667,3
w13,8,64,8,3584,2560,16,128,128,1,4,4,741.2876666666666,3
w13,8,64,8,3584,2560,16,128,128,1,4,5,738.1513333333334,3
w13,8,64,8,3584,2560,16,128,128,1,8,4,741.1483333333334,3
w13,8,64,8,3584,2560,16,128,128,1,8,5,735.623,3
w13,8,64,8,3584,2560,16,128,128,16,4,3,741.1916666666666,3
w13,8,64,8,3584,2560,16,128,128,16,4,4,741.2663333333334,3
w13,8,64,8,3584,2560,16,128,128,16,4,5,738.5993333333332,3
w13,8,64,8,3584,2560,16,128,128,16,8,5,737.4896666666667,3
w13,8,64,8,3584,2560,16,128,128,32,4,5,740.1673333333333,3
w13,8,64,8,3584,2560,16,128,128,32,8,5,739.5703333333332,3
w13,8,64,8,3584,2560,16,128,128,64,8,5,740.6256666666667,3
w13,8,64,8,3584,2560,32,32,128,1,4,3,739.4953333333333,3
w13,8,64,8,3584,2560,32,32,128,1,4,4,739.6763333333333,3
w13,8,64,8,3584,2560,32,32,128,1,4,5,739.7833333333333,3
w13,8,64,8,3584,2560,32,32,128,4,4,3,741.2016666666667,3
w13,8,64,8,3584,2560,32,32,128,4,4,4,739.591,3
w13,8,64,8,3584,2560,32,32,128,4,4,5,739.7406666666666,3
w13,8,64,8,3584,2560,32,32,128,16,4,4,739.6126666666665,3
w13,8,64,8,3584,2560,32,32,128,16,4,5,740.4343333333333,3
w13,8,64,8,3584,2560,32,32,128,64,4,3,741.703,3
w13,8,64,8,3584,2560,32,32,256,1,4,3,739.6656666666667,3
w13,8,64,8,3584,2560,32,32,256,1,4,4,738.834,3
w13,8,64,8,3584,2560,32,32,256,4,4,3,740.263,3
w13,8,64,8,3584,2560,32,32,256,4,4,4,739.9430000000001,3
w13,8,64,8,3584,2560,32,32,256,16,4,3,741.5866666666667,3
w13,8,64,8,3584,2560,32,32,256,16,4,4,741.159,3
w13,8,64,8,3584,2560,32,64,128,1,4,2,740.6476666666667,3
w13,8,64,8,3584,2560,32,64,128,1,4,5,738.2686666666667,3
w13,8,64,8,3584,2560,32,64,128,1,8,5,738.9403333333333,3
w13,8,64,8,3584,2560,32,64,128,4,4,2,740.5296666666667,3
w13,8,64,8,3584,2560,32,64,128,4,4,5,739.2293333333333,3
w13,8,64,8,3584,2560,32,64,128,4,8,5,739.2713333333332,3
w13,8,64,8,3584,2560,32,64,128,16,4,2,741.2873333333333,3
w13,8,64,8,3584,2560,32,64,128,16,4,5,739.3673333333332,3
w13,8,64,8,3584,2560,32,64,128,16,8,5,740.0496666666667,3
w13,8,64,8,3584,2560,32,64,128,32,4,5,740.2843333333334,3
w13,8,64,8,3584,2560,32,64,128,32,8,5,740.5196666666667,3
w13,8,64,8,3584,2560,32,64,128,64,4,5,741.7139999999999,3
w13,8,64,8,3584,2560,32,64,128,64,8,5,741.6709999999999,3
w13,8,64,8,3584,2560,32,64,256,1,4,3,740.5509999999999,3
w13,8,64,8,3584,2560,32,64,256,1,8,3,738.7593333333334,3
w13,8,64,8,3584,2560,32,64,256,1,8,5,739.1643333333333,3
w13,8,64,8,3584,2560,32,64,256,8,8,3,741.128,3
w13,8,64,8,3584,2560,32,64,256,8,8,5,739.9643333333333,3
w13,8,64,8,3584,2560,32,64,256,16,4,3,741.224,3
w13,8,64,8,3584,2560,32,64,256,16,8,5,740.861,3
w13,8,64,8,3584,2560,32,128,128,1,4,5,739.2283333333334,3
w13,8,64,8,3584,2560,32,128,128,1,8,5,739.1856666666666,3
w13,8,64,8,3584,2560,32,128,128,4,4,5,738.8123333333333,3
w13,8,64,8,3584,2560,32,128,128,4,8,5,739.4736666666668,3
w13,8,64,8,3584,2560,32,128,128,8,4,5,739.4630000000001,3
w13,8,64,8,3584,2560,32,128,128,8,8,5,739.9536666666667,3
w13,8,64,8,3584,2560,32,128,128,16,4,5,739.7513333333333,3
w13,8,64,8,3584,2560,32,128,128,16,8,5,740.5086666666666,3
w13,8,64,8,3584,2560,32,128,128,32,4,5,740.4443333333332,3
w13,8,64,8,3584,2560,32,128,128,32,8,5,740.551,3
w13,8,128,4,2048,512,16,32,64,1,4,3,46.15533333333334,3
w13,8,128,4,2048,512,16,32,64,16,4,3,46.593333333333334,3
w13,8,128,4,2048,512,16,32,128,1,4,2,46.36966666666666,3
w13,8,128,4,2048,512,16,32,128,4,4,2,46.27333333333333,3
w13,8,128,4,2048,512,16,64,64,1,4,3,46.209333333333326,3
w13,8,128,4,2048,512,16,64,64,1,8,3,46.32666666666666,3
w13,8,128,4,2048,512,16,64,64,16,4,3,46.29433333333333,3
w13,8,128,4,2048,512,16,64,64,16,4,4,46.51866666666666,3
w13,8,128,4,2048,512,16,64,64,16,4,5,46.59366666666667,3
w13,8,128,4,2048,512,16,64,64,32,4,3,46.60433333333333,3
w13,8,128,4,2048,512,16,64,64,32,4,4,46.58266666666666,3
w13,8,128,4,2048,512,16,64,64,32,4,5,46.59366666666667,3
w13,8,128,4,2048,512,16,64,64,64,4,3,46.45466666666667,3
w13,8,128,4,2048,512,16,64,64,64,4,4,46.550666666666665,3
w13,8,128,4,2048,512,16,64,64,64,4,5,46.529666666666664,3
w13,8,128,4,2048,512,16,64,64,64,8,3,46.56133333333333,3
w13,8,128,4,2048,512,16,64,128,16,4,3,46.422666666666665,3
w13,8,128,4,2048,512,16,64,128,32,8,3,46.443999999999996,3
w13,8,128,4,2048,512,16,128,64,1,8,3,46.60433333333333,3
w13,8,128,4,2048,512,16,128,128,1,8,3,46.423,3
w13,8,128,4,2048,512,16,128,128,32,8,3,46.615,3
w13,8,128,4,2048,512,16,128,128,64,8,3,46.583,3
w13,8,128,6,4096,2048,16,16,256,1,4,4,510.92766666666665,3
w13,8,128,6,4096,2048,16,32,128,1,4,3,507.7706666666666,3
w13,8,128,6,4096,2048,16,32,128,1,4,4,508.5916666666667,3
w13,8,128,6,4096,2048,16,32,128,1,4,5,506.1176666666667,3
w13,8,128,6,4096,2048,16,32,128,4,4,3,511.03433333333334,3
w13,8,128,6,4096,2048,16,32,128,4,4,5,506.9386666666667,3
w13,8,128,6,4096,2048,16,32,128,16,4,3,508.2076666666667,3
w13,8,128,6,4096,2048,16,32,128,16,4,5,507.2583333333334,3
w13,8,128,6,4096,2048,16,32,128,32,4,3,508.44266666666664,3
w13,8,128,6,4096,2048,16,32,128,32,4,5,507.02400000000006,3
w13,8,128,6,4096,2048,16,32,128,64,4,3,508.933,3
w13,8,128,6,4096,2048,16,32,128,64,4,4,510.9916666666666,3
w13,8,128,6,4096,2048,16,32,128,64,4,5,507.97299999999996,3
w13,8,128,6,4096,2048,16,32,256,1,4,2,508.30400000000003,3
w13,8,128,6,4096,2048,16,32,256,1,4,3,507.2373333333333,3
w13,8,128,6,4096,2048,16,32,256,1,4,4,507.0876666666666,3
w13,8,128,6,4096,2048,16,32,256,1,4,5,506.55466666666666,3
w13,8,128,6,4096,2048,16,32,256,16,4,2,509.157,3
w13,8,128,6,4096,2048,16,32,256,16,4,3,506.83166666666665,3
w13,8,128,6,4096,2048,16,32,256,16,4,4,507.15166666666664,3
w13,8,128,6,4096,2048,16,32,256,16,4,5,507.26933333333335,3
w13,8,128,6,4096,2048,16,32,256,32,4,2,507.7706666666667,3
w13,8,128,6,4096,2048,16,32,256,32,4,3,507.0986666666667,3
w13,8,128,6,4096,2048,16,32,256,32,4,4,509.1893333333333,3
w13,8,128,6,4096,2048,16,32,256,32,4,5,507.66366666666664,3
w13,8,128,6,4096,2048,16,32,256,64,4,2,508.10133333333334,3
w13,8,128,6,4096,2048,16,32,256,64,4,3,507.59999999999997,3
w13,8,128,6,4096,2048,16,32,256,64,4,4,508.4316666666667,3
w13,8,128,6,4096,2048,16,32,256,64,4,5,508.76233333333334,3
w13,8,128,6,4096,2048,16,64,128,1,4,4,509.5303333333333,3
w13,8,128,6,4096,2048,16,64,128,1,4,5,506.3086666666666,3
w13,8,128,6,4096,2048,16,64,128,1,8,3,508.26099999999997,3
w13,8,128,6,4096,2048,16,64,128,1,8,5,509.189,3
w13,8,128,6,4096,2048,16,64,128,16,4,3,510.288,3
w13,8,128,6,4096,2048,16,64,128,16,4,4,510.32,3
w13,8,128,6,4096,2048,16,64,128,16,4,5,507.19399999999996,3
w13,8,128,6,4096,2048,16,64,128,16,8,3,510.9066666666667,3
w13,8,128,6,4096,2048,16,64,128,16,8,5,508.05833333333334,3
w13,8,128,6,4096,2048,16,64,128,32,4,3,510.35200000000003,3
w13,8,128,6,4096,2048,16,64,128,32,4,4,510.18100000000004,3
w13,8,128,6,4096,2048,16,64,128,32,4,5,507.76,3
w13,8,128,6,4096,2048,16,64,128,32,8,5,510.0316666666667,3
w13,8,128,6,4096,2048,16,64,128,64,4,3,509.82933333333335,3
w13,8,128,6,4096,2048,16,64,128,64,4,4,510.7046666666667,3
w13,8,128,6,4096,2048,16,64,128,64,4,5,507.728,3
w13,8,128,6,4096,2048,16,64,128,64,8,2,510.45866666666666,3
w13,8,128,6,4096,2048,16,64,128,64,8,3,509.7866666666667,3
w13,8,128,6,4096,2048,16,64,256,1,4,2,509.296,3
w13,8,128,6,4096,2048,16,64,256,1,4,3,508.31466666666665,3
w13,8,128,6,4096,2048,16,64,256,1,4,4,509.19966666666664,3
w13,8,128,6,4096,2048,16,64,256,1,4,5,506.384,3
w13,8,128,6,4096,2048,16,64,256,1,8,2,508.9013333333333,3
w13,8,128,6,4096,2048,16,64,256,1,8,3,510.5973333333333,3
w13,8,128,6,4096,2048,16,64,256,1,8,4,509.061,3
w13,8,128,6,4096,2048,16,64,256,1,8,5,507.96233333333333,3
w13,8,128,6,4096,2048,16,64,256,16,4,2,508.78433333333334,3
w13,8,128,6,4096,2048,16,64,256,16,4,3,508.25066666666663,3
w13,8,128,6,4096,2048,16,64,256,16,4,4,508.8053333333333,3
w13,8,128,6,4096,2048,16,64,256,16,4,5,507.84499999999997,3
w13,8,128,6,4096,2048,16,64,256,16,8,2,508.208,3
w13,8,128,6,4096,2048,16,64,256,16,8,4,509.7226666666667,3
w13,8,128,6,4096,2048,16,64,256,16,8,5,509.01866666666666,3
w13,8,128,6,4096,2048,16,64,256,32,4,2,508.92266666666666,3
w13,8,128,6,4096,2048,16,64,256,32,4,3,509.5516666666667,3
w13,8,128,6,4096,2048,16,64,256,32,4,4,508.9866666666667,3
w13,8,128,6,4096,2048,16,64,256,32,4,5,508.336,3
w13,8,128,6,4096,2048,16,64,256,32,8,2,509.76533333333333,3
w13,8,128,6,4096,2048,16,64,256,32,8,3,510.28766666666667,3
w13,8,128,6,4096,2048,16,64,256,32,8,4,510.757,3
w13,8,128,6,4096,2048,16,64,256,32,8,5,509.413,3
w13,8,128,6,4096,2048,16,64,256,64,4,2,509.33833333333337,3
w13,8,128,6,4096,2048,16,64,256,64,4,3,510.3733333333333,3
w13,8,128,6,4096,2048,16,64,256,64,4,4,510.0423333333333,3
w13,8,128,6,4096,2048,16,64,256,64,4,5,509.4023333333333,3
w13,8,128,6,4096,2048,16,64,256,64,8,2,508.3036666666667,3
w13,8,128,6,4096,2048,16,64,256,64,8,3,509.9356666666667,3
w13,8,128,6,4096,2048,16,64,256,64,8,5,511.12000000000006,3
w13,8,128,6,4096,2048,16,128,128,1,4,4,509.1893333333333,3
w13,8,128,6,4096,2048,16,128,128,1,8,2,508.73066666666665,3
w13,8,128,6,4096,2048,16,128,128,1,8,4,509.5523333333333,3
w13,8,128,6,4096,2048,16,128,128,16,4,4,510.57633333333337,3
w13,8,128,6,4096,2048,16,128,128,16,8,2,509.9676666666667,3
w13,8,128,6,4096,2048,16,128,128,16,8,3,510.50100000000003,3
w13,8,128,6,4096,2048,16,128,128,16,8,4,509.13599999999997,3
w13,8,128,6,4096,2048,16,128,128,32,4,4,509.94666666666666,3
w13,8,128,6,4096,2048,16,128,128,32,8,2,509.8293333333333,3
w13,8,128,6,4096,2048,16,128,128,32,8,4,509.0506666666667,3
w13,8,128,6,4096,2048,16,128,128,64,4,2,509.70133333333337,3
w13,8,128,6,4096,2048,16,128,128,64,4,3,509.26433333333335,3
w13,8,128,6,4096,2048,16,128,128,64,4,4,508.4636666666667,3
w13,8,128,6,4096,2048,16,128,128,64,8,2,508.15433333333334,3
w13,8,128,6,4096,2048,16,128,128,64,8,3,510.26666666666665,3
w13,8,128,6,4096,2048,16,128,128,64,8,4,507.78133333333335,3
w13,8,128,6,4096,2048,16,128,128,64,8,5,510.90633333333335,3
w13,8,128,6,4096,2048,32,32,128,64,4,2,511.02366666666666,3
w13,8,128,6,4096,2048,32,32,256,1,4,4,510.4266666666667,3
w13,8,128,6,4096,2048,32,32,256,4,4,4,510.5013333333333,3
w13,8,128,6,4096,2048,32,32,256,16,4,4,510.87433333333337,3
w13,8,128,6,4096,2048,32,64,128,1,4,3,511.20533333333333,3
w13,8,128,6,4096,2048,32,64,128,64,4,2,510.384,3
w13,8,128,6,4096,2048,32,64,128,64,4,3,510.88533333333334,3
w13,8,128,6,4096,2048,32,64,256,1,8,5,510.98133333333334,3
w13,8,128,6,4096,2048,32,64,256,8,8,5,510.82099999999997,3
w13,8,128,6,4096,2048,32,128,128,1,4,3,509.7336666666667,3
w13,8,128,6,4096,2048,32,128,128,1,4,4,509.1893333333333,3
w13,8,128,6,4096,2048,32,128,128,1,8,3,510.05333333333334,3
w13,8,128,6,4096,2048,32,128,128,1,8,4,508.955,3
w13,8,128,6,4096,2048,32,128,128,4,4,4,509.7223333333333,3
w13,8,128,6,4096,2048,32,128,128,4,8,4,508.29300000000006,3
w13,8,128,6,4096,2048,32,128,128,8,4,2,510.8426666666667,3
w13,8,128,6,4096,2048,32,128,128,8,4,3,509.4343333333333,3
w13,8,128,6,4096,2048,32,128,128,8,4,4,509.6583333333333,3
w13,8,128,6,4096,2048,32,128,128,8,8,4,509.4023333333334,3
w13,8,128,6,4096,2048,32,128,128,16,4,2,510.73566666666665,3
w13,8,128,6,4096,2048,32,128,128,16,4,3,509.34933333333333,3
w13,8,128,6,4096,2048,32,128,128,16,4,4,509.35999999999996,3
w13,8,128,6,4096,2048,32,128,128,16,8,3,509.86100000000005,3
w13,8,128,6,4096,2048,32,128,128,16,8,4,509.8186666666666,3
w13,8,128,6,4096,2048,32,128,128,32,4,3,508.6236666666667,3
w13,8,128,6,4096,2048,32,128,128,32,4,4,509.78666666666663,3
w13,8,128,6,4096,2048,32,128,128,32,8,3,509.6476666666667,3
w13,8,128,6,4096,2048,32,128,128,32,8,4,508.997,3
w13,8,128,6,4096,2048,32,128,128,64,4,2,509.19966666666664,3
w13,8,128,6,4096,2048,32,128,128,64,4,3,508.95433333333335,3
w13,8,128,6,4096,2048,32,128,128,64,4,4,510.77866666666665,3
w13,8,128,6,4096,2048,32,128,128,64,8,3,509.4986666666667,3
w13,8,128,6,4096,2048,32,128,128,64,8,4,509.73333333333335,3
w13,8,128,6,4096,2048,64,64,64,1,4,5,508.603,3
w13,8,128,6,4096,2048,64,64,64,4,4,5,510.26666666666665,3
w13,8,128,6,4096,2048,64,64,64,16,4,5,509.81866666666673,3
w13,8,128,6,4096,2048,64,64,64,32,4,5,509.23199999999997,3
w13,8,128,6,4096,2048,64,64,64,64,4,5,509.61566666666664,3
w13,8,128,6,4096,2048,64,64,128,1,4,3,508.00499999999994,3
w13,8,128,6,4096,2048,64,64,128,1,8,3,509.86100000000005,3
w13,8,128,6,4096,2048,64,64,128,4,4,3,509.50966666666665,3
w13,8,128,6,4096,2048,64,64,128,4,8,3,510.93833333333333,3
w13,8,128,6,4096,2048,64,64,128,8,4,3,509.1893333333333,3
w13,8,128,6,4096,2048,64,64,128,8,8,3,510.843,3
w13,8,128,6,4096,2048,64,64,128,16,4,3,508.5063333333333,3
w13,8,128,6,4096,2048,64,64,128,16,8,3,510.576,3
w13,8,128,6,4096,2048,64,64,128,32,4,3,508.82666666666665,3
w13,8,128,6,4096,2048,64,64,128,32,8,3,510.77866666666665,3
w13,8,128,6,4096,2048,64,64,128,64,4,3,509.541,3
w13,8,128,6,4096,2048,64,64,128,64,8,3,510.92800000000005,3
w13,8,128,6,4096,2048,64,128,64,1,4,5,511.07733333333334,3
w13,8,128,6,4096,2048,64,128,64,32,4,5,510.79999999999995,3
w13,8,128,6,4096,2048,64,128,128,1,4,4,510.9703333333334,3
w13,8,128,6,4096,2048,64,128,128,1,8,3,511.02400000000006,3
w13,8,128,6,4096,2048,64,128,128,1,8,4,508.34666666666664,3
w13,8,128,6,4096,2048,64,128,128,4,4,4,510.84233333333333,3
w13,8,128,6,4096,2048,64,128,128,4,8,4,507.91966666666667,3
w13,8,128,6,4096,2048,64,128,128,16,4,4,511.21600000000007,3
w13,8,128,6,4096,2048,64,128,128,16,8,4,508.3786666666667,3
w13,8,128,6,4096,2048,64,128,128,32,8,4,508.6023333333333,3
w13,8,128,6,4096,2048,64,128,128,64,8,4,509.42366666666663,3
w13,8,128,8,2048,768,16,32,128,1,4,2,131.1543333333333,3
w13,8,128,8,2048,768,16,32,128,1,4,5,130.557,3
w13,8,128,8,2048,768,16,32,128,4,4,2,130.59966666666665,3
w13,8,128,8,2048,768,16,32,128,4,4,5,131.41033333333334,3
w13,8,128,8,2048,768,16,32,128,16,4,2,131.45333333333335,3
w13,8,128,8,2048,768,16,32,128,16,4,5,131.25033333333332,3
w13,8,128,8,2048,768,16,32,128,32,4,4,131.51733333333334,3
w13,8,128,8,2048,768,16,32,128,32,4,5,131.30433333333335,3
w13,8,128,8,2048,768,16,32,128,64,4,2,131.50633333333334,3
w13,8,128,8,2048,768,16,32,128,64,4,5,130.66366666666667,3
w13,8,128,8,2048,768,16,32,256,1,4,2,130.61066666666667,3
w13,8,128,8,2048,768,16,32,256,1,4,3,131.32500000000002,3
w13,8,128,8,2048,768,16,32,256,16,4,2,130.82366666666667,3
w13,8,128,8,2048,768,16,32,256,16,4,3,131.00466666666668,3
w13,8,128,8,2048,768,16,32,256,32,4,2,131.45266666666666,3
w13,8,128,8,2048,768,16,32,256,32,4,3,130.87699999999998,3
w13,8,128,8,2048,768,16,32,256,64,4,2,130.82366666666667,3
w13,8,128,8,2048,768,16,64,128,1,4,4,131.50666666666666,3
w13,8,128,8,2048,768,16,64,128,1,4,5,131.32533333333333,3
w13,8,128,8,2048,768,16,64,128,1,8,3,130.85533333333333,3
w13,8,128,8,2048,768,16,64,128,1,8,5,131.5173333333333,3
w13,8,128,8,2048,768,16,64,128,16,4,5,131.197,3
w13,8,128,8,2048,768,16,64,128,16,8,3,130.46066666666667,3
w13,8,128,8,2048,768,16,64,128,16,8,5,131.05833333333334,3
w13,8,128,8,2048,768,16,64,128,32,4,5,130.984,3
w13,8,128,8,2048,768,16,64,128,32,8,3,131.01533333333336,3
w13,8,128,8,2048,768,16,64,128,32,8,4,131.1543333333333,3
w13,8,128,8,2048,768,16,64,128,64,8,3,131.037,3
w13,8,128,8,2048,768,16,64,256,1,4,2,130.73833333333334,3
w13,8,128,8,2048,768,16,64,256,1,8,2,131.51766666666666,3
w13,8,128,8,2048,768,16,64,256,16,4,3,131.21866666666668,3
w13,8,128,8,2048,768,16,64,256,16,8,3,130.9093333333333,3
w13,8,128,8,2048,768,16,64,256,32,4,2,130.87699999999998,3
w13,8,128,8,2048,768,16,64,256,32,8,2,131.50666666666666,3
w13,8,128,8,2048,768,16,64,256,64,8,3,131.38933333333333,3
w13,8,128,8,2048,768,16,128,128,1,8,2,130.20466666666667,3
w13,8,128,8,2048,768,16,128,128,1,8,3,131.154,3
w13,8,128,8,2048,768,16,128,128,1,8,5,131.48499999999999,3
w13,8,128,8,2048,768,16,128,128,16,8,2,130.64233333333334,3
w13,8,128,8,2048,768,16,128,128,32,8,2,131.18633333333332,3
w13,8,128,8,2048,768,16,128,128,64,8,2,131.27200000000002,3
w13,8,128,8,2048,768,32,32,128,4,4,2,131.18633333333332,3
w13,8,128,8,2048,768,32,32,128,16,4,2,131.20766666666665,3
w13,8,128,8,2048,768,32,64,128,16,4,3,131.357,3
w13,8,128,8,2048,768,32,128,128,8,8,3,131.389,3
w13,8,128,8,2048,768,32,128,128,32,4,3,131.51700000000002,3
w13,8,128,8,4096,1536,16,16,256,1,4,5,510.5756666666666,3
w13,8,128,8,4096,1536,16,32,128,1,4,3,507.6956666666667,3
w13,8,128,8,4096,1536,16,32,128,1,4,5,507.2906666666667,3
w13,8,128,8,4096,1536,16,32,128,4,4,3,508.91166666666663,3
w13,8,128,8,4096,1536,16,32,128,4,4,5,506.3833333333334,3
w13,8,128,8,4096,1536,16,32,128,16,4,5,506.8956666666666,3
w13,8,128,8,4096,1536,16,32,128,32,4,3,510.39433333333335,3
w13,8,128,8,4096,1536,16,32,128,32,4,5,507.40766666666667,3
w13,8,128,8,4096,1536,16,32,128,64,4,5,507.22633333333334,3
w13,8,128,8,4096,1536,16,32,256,1,4,2,509.1036666666667,3
w13,8,128,8,4096,1536,16,32,256,1,4,3,507.1623333333334,3
w13,8,128,8,4096,1536,16,32,256,1,4,4,506.9916666666666,3
w13,8,128,8,4096,1536,16,32,256,1,4,5,505.8503333333333,3
w13,8,128,8,4096,1536,16,32,256,16,4,2,510.042,3
w13,8,128,8,4096,1536,16,32,256,16,4,3,507.1623333333334,3
w13,8,128,8,4096,1536,16,32,256,16,4,4,508.7836666666667,3
w13,8,128,8,4096,1536,16,32,256,16,4,5,506.917,3
w13,8,128,8,4096,1536,16,32,256,32,4,2,509.38100000000003,3
w13,8,128,8,4096,1536,16,32,256,32,4,3,507.7916666666667,3
w13,8,128,8,4096,1536,16,32,256,32,4,4,508.719,3
w13,8,128,8,4096,1536,16,32,256,32,4,5,507.66366666666664,3
w13,8,128,8,4096,1536,16,32,256,64,4,3,508.2926666666667,3
w13,8,128,8,4096,1536,16,32,256,64,4,4,509.5623333333333,3
w13,8,128,8,4096,1536,16,32,256,64,4,5,508.0796666666667,3
w13,8,128,8,4096,1536,16,64,128,1,4,3,510.309,3
w13,8,128,8,4096,1536,16,64,128,1,4,4,508.5596666666667,3
w13,8,128,8,4096,1536,16,64,128,1,4,5,505.71133333333336,3
w13,8,128,8,4096,1536,16,64,128,1,8,3,510.48,3
w13,8,128,8,4096,1536,16,64,128,1,8,5,508.9756666666667,3
w13,8,128,8,4096,1536,16,64,128,16,4,4,510.597,3
w13,8,128,8,4096,1536,16,64,128,16,4,5,507.68533333333335,3
w13,8,128,8,4096,1536,16,64,128,16,8,5,508.34633333333335,3
w13,8,128,8,4096,1536,16,64,128,32,4,5,508.33566666666667,3
w13,8,128,8,4096,1536,16,64,128,32,8,5,509.30633333333327,3
w13,8,128,8,4096,1536,16,64,128,64,4,5,507.6746666666666,3
w13,8,128,8,4096,1536,16,64,128,64,8,5,510.0743333333333,3
w13,8,128,8,4096,1536,16,64,256,1,4,2,509.38100000000003,3
w13,8,128,8,4096,1536,16,64,256,1,4,3,508.06933333333336,3
w13,8,128,8,4096,1536,16,64,256,1,4,4,507.9943333333333,3
w13,8,128,8,4096,1536,16,64,256,1,4,5,506.5333333333333,3
w13,8,128,8,4096,1536,16,64,256,1,8,2,508.165,3
w13,8,128,8,4096,1536,16,64,256,1,8,3,509.48766666666666,3
w13,8,128,8,4096,1536,16,64,256,1,8,4,509.0396666666666,3
w13,8,128,8,4096,1536,16,64,256,1,8,5,507.7056666666667,3
w13,8,128,8,4096,1536,16,64,256,16,4,3,509.3806666666667,3
w13,8,128,8,4096,1536,16,64,256,16,4,4,509.5406666666667,3
w13,8,128,8,4096,1536,16,64,256,16,4,5,507.237,3
w13,8,128,8,4096,1536,16,64,256,16,8,2,510.77833333333336,3
w13,8,128,8,4096,1536,16,64,256,16,8,4,509.87166666666667,3
w13,8,128,8,4096,1536,16,64,256,16,8,5,508.613,3
w13,8,128,8,4096,1536,16,64,256,32,4,2,510.5013333333333,3
w13,8,128,8,4096,1536,16,64,256,32,4,3,509.8823333333333,3
w13,8,128,8,4096,1536,16,64,256,32,4,4,509.21033333333327,3
w13,8,128,8,4096,1536,16,64,256,32,4,5,508.901,3
w13,8,128,8,4096,1536,16,64,256,32,8,2,510.5543333333333,3
w13,8,128,8,4096,1536,16,64,256,32,8,5,509.08233333333334,3
w13,8,128,8,4096,1536,16,64,256,64,4,2,509.7436666666667,3
w13,8,128,8,4096,1536,16,64,256,64,4,3,510.76800000000003,3
w13,8,128,8,4096,1536,16,64,256,64,4,5,509.445,3
w13,8,128,8,4096,1536,16,64,256,64,8,2,510.1596666666667,3
w13,8,128,8,4096,1536,16,64,256,64,8,5,510.33033333333333,3
w13,8,128,8,4096,1536,16,128,128,1,4,4,510.34099999999995,3
w13,8,128,8,4096,1536,16,128,128,1,8,2,509.42366666666663,3
w13,8,128,8,4096,1536,16,128,128,1,8,5,510.71433333333334,3
w13,8,128,8,4096,1536,16,128,128,16,8,2,510.59700000000004,3
w13,8,128,8,4096,1536,16,128,128,64,4,4,510.0636666666667,3
w13,8,128,8,4096,1536,16,128,128,64,8,2,509.925,3
w13,8,128,8,4096,1536,32,32,128,1,4,3,510.405,3
w13,8,128,8,4096,1536,32,32,128,4,4,5,510.5753333333334,3
w13,8,128,8,4096,1536,32,32,128,64,4,2,510.4156666666666,3
w13,8,128,8,4096,1536,32,64,128,64,8,2,510.44766666666663,3
w13,8,128,8,4096,1536,32,64,256,1,8,5,509.86100000000005,3
w13,8,128,8,4096,1536,32,128,128,1,4,2,510.66066666666666,3
w13,8,128,8,4096,1536,32,128,128,1,4,3,509.7863333333333,3
w13,8,128,8,4096,1536,32,128,128,1,4,4,509.90366666666665,3
w13,8,128,8,4096,1536,32,128,128,1,8,4,509.253,3
w13,8,128,8,4096,1536,32,128,128,4,4,3,510.757,3
w13,8,128,8,4096,1536,32,128,128,4,8,4,510.34066666666666,3
w13,8,128,8,4096,1536,32,128,128,8,4,4,510.469,3
w13,8,128,8,4096,1536,32,128,128,8,8,4,509.63733333333334,3
w13,8,128,8,4096,1536,32,128,128,16,4,4,509.413,3
w13,8,128,8,4096,1536,32,128,128,16,8,4,509.4556666666667,3
w13,8,128,8,4096,1536,32,128,128,32,4,3,510.426,3
w13,8,128,8,4096,1536,32,128,128,32,4,4,509.77566666666667,3
w13,8,128,8,4096,1536,32,128,128,32,8,4,509.21033333333327,3
w13,8,128,8,4096,1536,32,128,128,64,4,3,510.53299999999996,3
w13,8,128,8,4096,1536,32,128,128,64,4,4,510.128,3
w13,8,128,8,4096,1536,32,128,128,64,8,3,509.1676666666667,3
w13,8,128,8,4096,1536,32,128,128,64,8,4,509.6476666666667,3
w13,8,128,8,4096,1536,64,64,64,1,4,5,509.253,3
w13,8,128,8,4096,1536,64,64,64,4,4,5,510.35166666666663,3
w13,8,128,8,4096,1536,64,64,64,32,4,5,509.45533333333333,3
w13,8,128,8,4096,1536,64,64,128,1,4,3,508.0366666666667,3
w13,8,128,8,4096,1536,64,64,128,1,8,3,510.3086666666666,3
w13,8,128,8,4096,1536,64,64,128,4,4,3,510.09566666666666,3
w13,8,128,8,4096,1536,64,64,128,4,8,3,510.43666666666667,3
w13,8,128,8,4096,1536,64,64,128,8,4,3,509.872,3
w13,8,128,8,4096,1536,64,64,128,16,4,3,509.9463333333333,3
w13,8,128,8,4096,1536,64,64,128,16,8,3,510.77833333333336,3
w13,8,128,8,4096,1536,64,64,128,32,4,3,509.029,3
w13,8,128,8,4096,1536,64,128,64,32,4,5,510.72499999999997,3
w13,8,128,8,4096,1536,64,128,128,1,8,4,508.037,3
w13,8,128,8,4096,1536,64,128,128,4,8,4,509.2103333333334,3
w13,8,128,8,4096,1536,64,128,128,16,8,4,508.5173333333334,3
w13,8,128,8,4096,1536,64,128,128,32,8,4,508.0903333333333,3
w13,8,128,8,4096,1536,64,128,128,64,8,4,509.0076666666667,3
w13,8,128,8,4096,3072,16,16,128,1,4,3,1013.8756666666667,3
w13,8,128,8,4096,3072,16,16,128,1,4,5,1010.9103333333333,3
w13,8,128,8,4096,3072,16,16,128,4,4,4,1012.6386666666667,3
w13,8,128,8,4096,3072,16,16,128,4,4,5,1011.401,3
w13,8,128,8,4096,3072,16,16,256,1,4,3,1010.6333333333333,3
w13,8,128,8,4096,3072,16,16,256,1,4,4,1009.3853333333333,3
w13,8,128,8,4096,3072,16,16,256,1,4,5,1007.9773333333333,3
w13,8,128,8,4096,3072,16,16,256,4,4,3,1010.2703333333334,3
w13,8,128,8,4096,3072,16,16,256,4,4,4,1009.0433333333334,3
w13,8,128,8,4096,3072,16,16,256,4,4,5,1008.297,3
w13,8,128,8,4096,3072,16,32,128,1,4,3,1013.7049999999999,3
w13,8,128,8,4096,3072,16,32,128,1,4,4,1010.9213333333333,3
w13,8,128,8,4096,3072,16,32,128,1,4,5,1006.9423333333334,3
w13,8,128,8,4096,3072,16,32,128,1,8,4,1012.66,3
w13,8,128,8,4096,3072,16,32,128,4,4,4,1012.2123333333334,3
w13,8,128,8,4096,3072,16,32,128,4,4,5,1007.0063333333333,3
w13,8,128,8,4096,3072,16,32,128,4,8,4,1014.025,3
w13,8,128,8,4096,3072,16,32,128,16,4,4,1013.7370000000001,3
w13,8,128,8,4096,3072,16,32,128,16,4,5,1009.0756666666666,3
w13,8,128,8,4096,3072,16,32,128,32,4,5,1008.6063333333333,3
w13,8,128,8,4096,3072,16,32,128,64,4,4,1012.0623333333333,3
w13,8,128,8,4096,3072,16,32,128,64,4,5,1008.4143333333333,3
w13,8,128,8,4096,3072,16,32,256,1,4,2,1008.5853333333333,3
w13,8,128,8,4096,3072,16,32,256,1,4,3,1005.5453333333334,3
w13,8,128,8,4096,3072,16,32,256,1,4,4,1008.212,3
w13,8,128,8,4096,3072,16,32,256,1,4,5,1005.0863333333333,3
w13,8,128,8,4096,3072,16,32,256,1,8,3,1013.8436666666666,3
w13,8,128,8,4096,3072,16,32,256,1,8,4,1013.5769999999999,3
w13,8,128,8,4096,3072,16,32,256,1,8,5,1009.044,3
w13,8,128,8,4096,3072,16,32,256,16,4,2,1010.9956666666667,3
w13,8,128,8,4096,3072,16,32,256,16,4,3,1007.8276666666667,3
w13,8,128,8,4096,3072,16,32,256,16,4,4,1008.5426666666667,3
w13,8,128,8,4096,3072,16,32,256,16,4,5,1004.7663333333334,3
w13,8,128,8,4096,3072,16,32,256,16,8,3,1013.62,3
w13,8,128,8,4096,3072,16,32,256,16,8,4,1013.1183333333333,3
w13,8,128,8,4096,3072,16,32,256,16,8,5,1010.9743333333332,3
w13,8,128,8,4096,3072,16,32,256,32,4,2,1011.9556666666667,3
w13,8,128,8,4096,3072,16,32,256,32,4,3,1012.1476666666667,3
w13,8,128,8,4096,3072,16,32,256,32,4,4,1009.812,3
w13,8,128,8,4096,3072,16,32,256,32,4,5,1006.6223333333334,3
w13,8,128,8,4096,3072,16,32,256,32,8,4,1013.406,3
w13,8,128,8,4096,3072,16,32,256,32,8,5,1012.2116666666667,3
w13,8,128,8,4096,3072,16,32,256,64,4,2,1009.8333333333334,3
w13,8,128,8,4096,3072,16,32,256,64,4,3,1008.5103333333333,3
w13,8,128,8,4096,3072,16,32,256,64,4,4,1009.844,3
w13,8,128,8,4096,3072,16,32,256,64,4,5,1007.4653333333332,3
w13,8,128,8,4096,3072,16,32,256,64,8,3,1014.217,3
w13,8,128,8,4096,3072,16,32,256,64,8,5,1012.1263333333333,3
w13,8,128,8,4096,3072,16,64,128,1,4,3,1014.3556666666667,3
w13,8,128,8,4096,3072,16,64,128,1,4,4,1007.337,3
w13,8,128,8,4096,3072,16,64,128,1,4,5,1004.8090000000001,3
w13,8,128,8,4096,3072,16,64,128,1,8,3,1010.9953333333333,3
w13,8,128,8,4096,3072,16,64,128,1,8,4,1010.9956666666667,3
w13,8,128,8,4096,3072,16,64,128,1,8,5,1007.8916666666668,3
w13,8,128,8,4096,3072,16,64,128,16,4,3,1013.7266666666668,3
w13,8,128,8,4096,3072,16,64,128,16,4,4,1009.1186666666667,3
w13,8,128,8,4096,3072,16,64,128,16,4,5,1007.0383333333333,3
w13,8,128,8,4096,3072,16,64,128,16,8,3,1011.9986666666667,3
w13,8,128,8,4096,3072,16,64,128,16,8,4,1013.4276666666666,3
w13,8,128,8,4096,3072,16,64,128,16,8,5,1008.2973333333333,3
w13,8,128,8,4096,3072,16,64,128,32,4,4,1010.6756666666666,3
w13,8,128,8,4096,3072,16,64,128,32,4,5,1008.0196666666667,3
w13,8,128,8,4096,3072,16,64,128,32,8,3,1012.265,3
w13,8,128,8,4096,3072,16,64,128,32,8,4,1011.86,3
w13,8,128,8,4096,3072,16,64,128,32,8,5,1009.3746666666666,3
w13,8,128,8,4096,3072,16,64,128,64,4,3,1013.8116666666666,3
w13,8,128,8,4096,3072,16,64,128,64,4,4,1009.556,3
w13,8,128,8,4096,3072,16,64,128,64,4,5,1008.66,3
w13,8,128,8,4096,3072,16,64,128,64,8,3,1010.3449999999999,3
w13,8,128,8,4096,3072,16,64,128,64,8,4,1011.2623333333335,3
w13,8,128,8,4096,3072,16,64,128,64,8,5,1008.9053333333333,3
w13,8,128,8,4096,3072,16,64,256,1,4,2,1011.209,3
w13,8,128,8,4096,3072,16,64,256,1,4,3,1005.2463333333334,3
w13,8,128,8,4096,3072,16,64,256,1,4,4,1005.4276666666666,3
w13,8,128,8,4096,3072,16,64,256,1,4,5,1005.2356666666666,3
w13,8,128,8,4096,3072,16,64,256,1,8,2,1013.5446666666667,3
w13,8,128,8,4096,3072,16,64,256,1,8,3,1008.6276666666666,3
w13,8,128,8,4096,3072,16,64,256,1,8,4,1005.6093333333333,3
w13,8,128,8,4096,3072,16,64,256,1,8,5,1005.7370000000001,3
w13,8,128,8,4096,3072,16,64,256,16,4,2,1011.561,3
w13,8,128,8,4096,3072,16,64,256,16,4,3,1007.8386666666667,3
w13,8,128,8,4096,3072,16,64,256,16,4,4,1006.526,3
w13,8,128,8,4096,3072,16,64,256,16,4,5,1005.2570000000001,3
w13,8,128,8,4096,3072,16,64,256,16,8,2,1014.6436666666667,3
w13,8,128,8,4096,3072,16,64,256,16,8,3,1009.982,3
w13,8,128,8,4096,3072,16,64,256,16,8,4,1007.4543333333335,3
w13,8,128,8,4096,3072,16,64,256,16,8,5,1006.0676666666667,3
w13,8,128,8,4096,3072,16,64,256,32,4,2,1012.8946666666667,3
w13,8,128,8,4096,3072,16,64,256,32,4,3,1008.5636666666666,3
w13,8,128,8,4096,3072,16,64,256,32,4,4,1008.8623333333334,3
w13,8,128,8,4096,3072,16,64,256,32,4,5,1006.185,3
w13,8,128,8,4096,3072,16,64,256,32,8,2,1014.0253333333334,3
w13,8,128,8,4096,3072,16,64,256,32,8,3,1010.9953333333333,3
w13,8,128,8,4096,3072,16,64,256,32,8,4,1009.5233333333332,3
w13,8,128,8,4096,3072,16,64,256,32,8,5,1007.2303333333333,3
w13,8,128,8,4096,3072,16,64,256,64,4,2,1010.4733333333334,3
w13,8,128,8,4096,3072,16,64,256,64,4,3,1009.6623333333333,3
w13,8,128,8,4096,3072,16,64,256,64,4,4,1011.583,3
w13,8,128,8,4096,3072,16,64,256,64,4,5,1008.116,3
w13,8,128,8,4096,3072,16,64,256,64,8,2,1014.8893333333334,3
w13,8,128,8,4096,3072,16,64,256,64,8,3,1010.7823333333334,3
w13,8,128,8,4096,3072,16,64,256,64,8,4,1011.593,3
w13,8,128,8,4096,3072,16,64,256,64,8,5,1010.409,3
w13,8,128,8,4096,3072,16,128,128,1,4,4,1010.8253333333333,3
w13,8,128,8,4096,3072,16,128,128,1,4,5,1008.7986666666666,3
w13,8,128,8,4096,3072,16,128,128,1,8,4,1009.1503333333334,3
w13,8,128,8,4096,3072,16,128,128,1,8,5,1006.2486666666667,3
w13,8,128,8,4096,3072,16,128,128,16,4,4,1012.9266666666666,3
w13,8,128,8,4096,3072,16,128,128,16,4,5,1009.1186666666666,3
w13,8,128,8,4096,3072,16,128,128,16,8,4,1011.3263333333333,3
w13,8,128,8,4096,3072,16,128,128,16,8,5,1009.4916666666667,3
w13,8,128,8,4096,3072,16,128,128,32,4,4,1012.265,3
w13,8,128,8,4096,3072,16,128,128,32,4,5,1008.18,3
w13,8,128,8,4096,3072,16,128,128,32,8,2,1014.0676666666667,3
w13,8,128,8,4096,3072,16,128,128,32,8,4,1011.1666666666666,3
w13,8,128,8,4096,3072,16,128,128,32,8,5,1009.0866666666667,3
w13,8,128,8,4096,3072,16,128,128,64,4,4,1010.9213333333333,3
w13,8,128,8,4096,3072,16,128,128,64,4,5,1011.0703333333335,3
w13,8,128,8,4096,3072,16,128,128,64,8,2,1014.1426666666666,3
w13,8,128,8,4096,3072,16,128,128,64,8,4,1010.7933333333334,3
w13,8,128,8,4096,3072,16,128,128,64,8,5,1009.1610000000001,3
w13,8,128,8,4096,3072,32,32,128,1,4,2,1014.505,3
w13,8,128,8,4096,3072,32,32,128,1,4,3,1010.7933333333334,3
w13,8,128,8,4096,3072,32,32,128,1,4,4,1009.2893333333333,3
w13,8,128,8,4096,3072,32,32,128,1,4,5,1008.6063333333333,3
w13,8,128,8,4096,3072,32,32,128,1,8,4,1011.6463333333332,3
w13,8,128,8,4096,3072,32,32,128,1,8,5,1011.9773333333333,3
w13,8,128,8,4096,3072,32,32,128,4,4,3,1011.0813333333334,3
w13,8,128,8,4096,3072,32,32,128,4,4,4,1011.5396666666667,3
w13,8,128,8,4096,3072,32,32,128,4,4,5,1006.7719999999999,3
w13,8,128,8,4096,3072,32,32,128,4,8,4,1012.8623333333334,3
w13,8,128,8,4096,3072,32,32,128,4,8,5,1012.6813333333333,3
w13,8,128,8,4096,3072,32,32,128,16,4,3,1011.8493333333332,3
w13,8,128,8,4096,3072,32,32,128,16,4,4,1011.4863333333333,3
w13,8,128,8,4096,3072,32,32,128,16,4,5,1008.393,3
w13,8,128,8,4096,3072,32,32,128,16,8,4,1013.801,3
w13,8,128,8,4096,3072,32,32,128,16,8,5,1014.4303333333334,3
w13,8,128,8,4096,3072,32,32,128,64,4,3,1011.7426666666667,3
w13,8,128,8,4096,3072,32,32,128,64,4,4,1012.148,3
w13,8,128,8,4096,3072,32,32,128,64,4,5,1011.5823333333333,3
w13,8,128,8,4096,3072,32,32,128,64,8,4,1014.7613333333334,3
w13,8,128,8,4096,3072,32,32,256,1,4,3,1010.2916666666666,3
w13,8,128,8,4096,3072,32,32,256,1,4,4,1007.6886666666666,3
w13,8,128,8,4096,3072,32,32,256,1,8,3,1013.7266666666668,3
w13,8,128,8,4096,3072,32,32,256,1,8,4,1012.5633333333334,3
w13,8,128,8,4096,3072,32,32,256,4,4,3,1009.3213333333333,3
w13,8,128,8,4096,3072,32,32,256,4,4,4,1008.3183333333333,3
w13,8,128,8,4096,3072,32,32,256,4,8,3,1012.265,3
w13,8,128,8,4096,3072,32,32,256,4,8,4,1014.697,3
w13,8,128,8,4096,3072,32,32,256,16,4,3,1010.7186666666666,3
w13,8,128,8,4096,3072,32,32,256,16,4,4,1009.342,3
w13,8,128,8,4096,3072,32,32,256,16,8,3,1013.6303333333334,3
w13,8,128,8,4096,3072,32,32,256,16,8,4,1013.9186666666668,3
w13,8,128,8,4096,3072,32,32,256,32,4,3,1012.1370000000001,3
w13,8,128,8,4096,3072,32,32,256,32,4,4,1011.1023333333333,3
w13,8,128,8,4096,3072,32,64,128,1,4,3,1012.052,3
w13,8,128,8,4096,3072,32,64,128,1,4,4,1011.6039999999999,3
w13,8,128,8,4096,3072,32,64,128,1,4,5,1012.9473333333334,3
w13,8,128,8,4096,3072,32,64,128,1,8,3,1012.9050000000001,3
w13,8,128,8,4096,3072,32,64,128,1,8,4,1012.9156666666667,3
w13,8,128,8,4096,3072,32,64,128,1,8,5,1013.2143333333333,3
w13,8,128,8,4096,3072,32,64,128,4,4,3,1012.9583333333334,3
w13,8,128,8,4096,3072,32,64,128,4,4,4,1014.5583333333334,3
w13,8,128,8,4096,3072,32,64,128,4,4,5,1012.6706666666665,3
w13,8,128,8,4096,3072,32,64,128,4,8,3,1014.761,3
w13,8,128,8,4096,3072,32,64,128,4,8,5,1012.5103333333333,3
w13,8,128,8,4096,3072,32,64,128,16,4,3,1012.5956666666666,3
w13,8,128,8,4096,3072,32,64,128,16,4,4,1014.7933333333334,3
w13,8,128,8,4096,3072,32,64,128,16,4,5,1012.2756666666666,3
w13,8,128,8,4096,3072,32,64,128,16,8,3,1013.129,3
w13,8,128,8,4096,3072,32,64,128,16,8,5,1013.6839999999999,3
w13,8,128,8,4096,3072,32,64,128,32,4,3,1014.7716666666666,3
w13,8,128,8,4096,3072,32,64,128,32,4,4,1014.7823333333332,3
w13,8,128,8,4096,3072,32,64,128,32,4,5,1012.681,3
w13,8,128,8,4096,3072,32,64,128,32,8,5,1014.3126666666667,3
w13,8,128,8,4096,3072,32,64,128,64,4,3,1011.0493333333334,3
w13,8,128,8,4096,3072,32,64,128,64,4,4,1014.1529999999999,3
w13,8,128,8,4096,3072,32,64,128,64,4,5,1014.7613333333334,3
w13,8,128,8,4096,3072,32,64,128,64,8,3,1011.9879999999999,3
w13,8,128,8,4096,3072,32,64,256,1,4,3,1012.4676666666668,3
w13,8,128,8,4096,3072,32,64,256,1,4,5,1014.6333333333333,3
w13,8,128,8,4096,3072,32,64,256,1,8,3,1009.5343333333334,3
w13,8,128,8,4096,3072,32,64,256,1,8,4,1009.0753333333333,3
w13,8,128,8,4096,3072,32,64,256,1,8,5,1008.116,3
w13,8,128,8,4096,3072,32,64,256,8,4,3,1013.3849999999999,3
w13,8,128,8,4096,3072,32,64,256,8,4,5,1014.0676666666667,3
w13,8,128,8,4096,3072,32,64,256,8,8,3,1009.6626666666666,3
w13,8,128,8,4096,3072,32,64,256,8,8,4,1010.0783333333334,3
w13,8,128,8,4096,3072,32,64,256,8,8,5,1009.2673333333333,3
w13,8,128,8,4096,3072,32,64,256,16,4,3,1013.4066666666666,3
w13,8,128,8,4096,3072,32,64,256,16,4,5,1012.937,3
w13,8,128,8,4096,3072,32,64,256,16,8,3,1011.6996666666668,3
w13,8,128,8,4096,3072,32,64,256,16,8,4,1011.6783333333333,3
w13,8,128,8,4096,3072,32,64,256,16,8,5,1008.7449999999999,3
w13,8,128,8,4096,3072,32,64,256,32,4,3,1014.7823333333332,3
w13,8,128,8,4096,3072,32,64,256,32,8,3,1012.372,3
w13,8,128,8,4096,3072,32,64,256,32,8,4,1013.908,3
w13,8,128,8,4096,3072,32,64,256,32,8,5,1010.3126666666667,3
w13,8,128,8,4096,3072,32,64,256,64,8,3,1012.4993333333333,3
w13,8,128,8,4096,3072,32,64,256,64,8,5,1013.0013333333333,3
w13,8,128,8,4096,3072,32,128,128,1,4,3,1011.444,3
w13,8,128,8,4096,3072,32,128,128,1,4,4,1007.4436666666667,3
w13,8,128,8,4096,3072,32,128,128,1,4,5,1008.3503333333333,3
w13,8,128,8,4096,3072,32,128,128,1,8,5,1008.2220000000001,3
w13,8,128,8,4096,3072,32,128,128,4,4,3,1013.5983333333334,3
w13,8,128,8,4096,3072,32,128,128,4,4,4,1008.2866666666667,3
w13,8,128,8,4096,3072,32,128,128,4,4,5,1009.5663333333333,3
w13,8,128,8,4096,3072,32,128,128,4,8,4,1013.8863333333333,3
w13,8,128,8,4096,3072,32,128,128,4,8,5,1010.6973333333334,3
w13,8,128,8,4096,3072,32,128,128,8,4,3,1013.0863333333333,3
w13,8,128,8,4096,3072,32,128,128,8,4,4,1008.18,3
w13,8,128,8,4096,3072,32,128,128,8,4,5,1008.5636666666666,3
w13,8,128,8,4096,3072,32,128,128,8,8,5,1009.7266666666666,3
w13,8,128,8,4096,3072,32,128,128,16,4,3,1012.7346666666667,3
w13,8,128,8,4096,3072,32,128,128,16,4,4,1009.236,3
w13,8,128,8,4096,3072,32,128,128,16,4,5,1008.3183333333333,3
w13,8,128,8,4096,3072,32,128,128,16,8,5,1011.2620000000001,3
w13,8,128,8,4096,3072,32,128,128,32,4,2,1013.5663333333333,3
w13,8,128,8,4096,3072,32,128,128,32,4,3,1012.1583333333333,3
w13,8,128,8,4096,3072,32,128,128,32,4,4,1009.5450000000001,3
w13,8,128,8,4096,3072,32,128,128,32,4,5,1009.0543333333334,3
w13,8,128,8,4096,3072,32,128,128,32,8,4,1013.7263333333334,3
w13,8,128,8,4096,3072,32,128,128,32,8,5,1009.7906666666667,3
w13,8,128,8,4096,3072,32,128,128,64,4,3,1013.118,3
w13,8,128,8,4096,3072,32,128,128,64,4,4,1010.942,3
w13,8,128,8,4096,3072,32,128,128,64,4,5,1011.7420000000001,3
w13,8,128,8,4096,3072,32,128,128,64,8,5,1010.9316666666667,3
w13,8,128,8,4096,3072,64,64,64,16,4,5,1014.0146666666666,3
w13,8,128,8,4096,3072,64,64,128,1,4,3,1010.7506666666667,3
w13,8,128,8,4096,3072,64,64,128,1,4,5,1014.4093333333334,3
w13,8,128,8,4096,3072,64,64,128,1,8,3,1011.7423333333332,3
w13,8,128,8,4096,3072,64,64,128,1,8,5,1011.4646666666667,3
w13,8,128,8,4096,3072,64,64,128,4,4,3,1013.0756666666666,3
w13,8,128,8,4096,3072,64,64,128,4,4,5,1014.4943333333334,3
w13,8,128,8,4096,3072,64,64,128,4,8,3,1013.4386666666666,3
w13,8,128,8,4096,3072,64,64,128,4,8,5,1013.9503333333333,3
w13,8,128,8,4096,3072,64,64,128,8,4,3,1010.9956666666667,3
w13,8,128,8,4096,3072,64,64,128,8,8,3,1013.9716666666667,3
w13,8,128,8,4096,3072,64,64,128,8,8,5,1012.34,3
w13,8,128,8,4096,3072,64,64,128,16,4,3,1013.0540000000001,3
w13,8,128,8,4096,3072,64,64,128,16,8,3,1012.8303333333333,3
w13,8,128,8,4096,3072,64,64,128,16,8,5,1014.0360000000001,3
w13,8,128,8,4096,3072,64,64,128,32,4,3,1013.5666666666666,3
w13,8,128,8,4096,3072,64,128,128,1,4,4,1010.0466666666666,3
w13,8,128,8,4096,3072,64,128,128,1,8,4,1007.7533333333334,3
w13,8,128,8,4096,3072,64,128,128,4,4,4,1010.7396666666667,3
w13,8,128,8,4096,3072,64,128,128,4,8,4,1007.38,3
w13,8,128,8,4096,3072,64,128,128,16,4,4,1011.9023333333333,3
w13,8,128,8,4096,3072,64,128,128,16,8,4,1011.9773333333333,3
w13,8,128,8,4096,3072,64,128,128,32,4,4,1012.1693333333333,3
w13,8,128,8,4096,3072,64,128,128,32,8,4,1009.8333333333334,3
w13,8,128,8,4096,3072,64,128,128,64,4,4,1013.1613333333333,3
w13,8,128,8,4096,3072,64,128,128,64,8,4,1012.1370000000001,3
w13,16,8,2,1024,512,16,64,128,16,8,3,5.527666666666666,3
w13,16,8,2,1024,512,16,64,128,16,8,4,5.559333333333334,3
w13,16,8,2,1024,512,16,64,128,32,8,3,5.517,3
w13,16,8,2,1024,512,16,64,128,32,8,4,5.57,3
w13,16,8,2,1024,512,16,64,128,64,8,3,5.527333333333334,3
w13,16,8,2,1024,512,16,64,128,64,8,4,5.548666666666667,3
w13,16,16,2,1536,768,16,32,128,4,4,2,27.285,3
w13,16,16,2,1536,768,16,32,128,16,4,2,27.445333333333334,3
w13,16,16,2,1536,768,16,32,128,32,4,2,27.46666666666667,3
w13,16,16,4,1536,1024,16,32,64,64,4,3,35.81,3
w13,16,16,4,1536,1024,16,32,128,1,4,2,35.661,3
w13,16,16,4,1536,1024,16,32,128,4,4,2,35.949333333333335,3
w13,16,16,4,1536,1024,16,32,128,16,4,2,35.65,3
w13,16,16,4,1536,1024,16,32,128,64,4,2,35.74633333333333,3
w13,16,16,4,1536,1024,16,64,64,1,4,3,35.821,3
w13,16,16,4,1536,1024,16,64,64,16,4,3,35.916666666666664,3
w13,16,16,4,1536,1024,16,64,128,16,4,2,35.916666666666664,3
w13,16,32,4,2048,768,16,32,64,1,4,3,67.95966666666668,3
w13,16,32,4,2048,768,16,32,64,64,4,3,67.93866666666666,3
w13,16,32,4,2048,768,16,32,256,64,4,2,67.92833333333334,3
w13,16,32,4,2048,768,16,64,64,1,4,3,67.97,3
w13,16,32,4,2048,768,16,64,64,16,4,3,67.661,3
w13,16,32,4,2048,768,16,64,64,32,4,3,67.714,3
w13,16,32,4,2048,768,16,64,128,1,4,2,67.87433333333333,3
w13,16,32,4,2048,768,16,64,128,16,4,2,67.37266666666666,3
w13,16,32,4,2048,768,16,64,128,32,4,2,67.63966666666666,3
w13,16,32,4,2048,768,16,64,128,64,4,2,67.70366666666666,3
w13,16,32,4,2048,768,16,128,64,1,8,3,67.78933333333333,3
w13,16,32,4,2048,768,16,128,128,32,8,2,67.81066666666668,3
w13,16,32,6,3072,1024,16,32,128,1,4,2,132.30133333333333,3
w13,16,32,6,3072,1024,16,32,128,1,4,5,132.44033333333334,3
w13,16,32,6,3072,1024,16,32,128,4,4,2,131.39466666666667,3
w13,16,32,6,3072,1024,16,32,128,4,4,5,132.696,3
w13,16,32,6,3072,1024,16,32,128,16,4,2,131.78933333333333,3
w13,16,32,6,3072,1024,16,32,128,32,4,2,131.587,3
w13,16,32,6,3072,1024,16,32,128,32,4,5,132.142,3
w13,16,32,6,3072,1024,16,32,128,64,4,5,132.15233333333333,3
w13,16,32,6,3072,1024,16,32,256,1,4,3,132.28033333333335,3
w13,16,32,6,3072,1024,16,32,256,16,4,3,132.65366666666668,3
w13,16,32,6,3072,1024,16,32,256,32,4,2,132.65366666666668,3
w13,16,32,6,3072,1024,16,32,256,32,4,3,132.227,3
w13,16,32,6,3072,1024,16,32,256,64,4,3,132.55733333333333,3
w13,16,32,6,3072,1024,16,64,128,1,4,3,132.42933333333335,3
w13,16,32,6,3072,1024,16,64,128,1,4,4,132.451,3
w13,16,32,6,3072,1024,16,64,128,1,4,5,132.10966666666667,3
w13,16,32,6,3072,1024,16,64,128,1,8,5,132.65333333333334,3
w13,16,32,6,3072,1024,16,64,128,16,4,4,132.52533333333335,3
w13,16,32,6,3072,1024,16,64,128,16,4,5,132.41899999999998,3
w13,16,32,6,3072,1024,16,64,128,16,8,3,132.58933333333331,3
w13,16,32,6,3072,1024,16,64,128,32,4,5,132.24833333333333,3
w13,16,32,6,3072,1024,16,64,128,64,4,4,132.33366666666666,3
w13,16,32,6,3072,1024,16,64,128,64,4,5,132.62133333333335,3
w13,16,32,6,3072,1024,16,64,128,64,8,3,132.376,3
w13,16,32,6,3072,1024,16,64,128,64,8,5,132.35433333333333,3
w13,16,32,6,3072,1024,16,64,256,1,4,2,132.38699999999997,3
w13,16,32,6,3072,1024,16,64,256,1,8,3,132.14133333333334,3
w13,16,32,6,3072,1024,16,64,256,16,4,2,132.24833333333333,3
w13,16,32,6,3072,1024,16,64,256,16,8,3,132.71733333333333,3
w13,16,32,6,3072,1024,16,64,256,32,4,2,132.57866666666666,3
w13,16,32,6,3072,1024,16,64,256,64,4,2,132.248,3
w13,16,32,6,3072,1024,16,128,128,1,8,4,132.67466666666667,3
w13,16,32,6,3072,1024,16,128,128,16,8,4,132.15200000000002,3
w13,16,32,6,3072,1024,16,128,128,32,4,2,132.55766666666668,3
w13,16,32,6,3072,1024,16,128,128,64,4,2,132.664,3
w13,16,32,6,3072,1024,16,128,128,64,8,4,132.44,3
w13,16,32,6,3072,1024,32,32,128,1,4,2,132.6,3
w13,16,32,6,3072,1024,32,32,128,16,4,2,132.387,3
w13,16,32,6,3072,1024,64,64,64,16,4,3,132.13066666666666,3
w13,16,60,4,2048,1408,16,32,128,1,4,5,221.20899999999997,3
w13,16,60,4,2048,1408,16,32,128,4,4,2,222.649,3
w13,16,60,4,2048,1408,16,32,128,4,4,5,221.15566666666666,3
w13,16,60,4,2048,1408,16,32,128,16,4,2,222.56333333333336,3
w13,16,60,4,2048,1408,16,32,128,16,4,5,221.79566666666665,3
w13,16,60,4,2048,1408,16,32,128,32,4,4,222.766,3
w13,16,60,4,2048,1408,16,32,128,32,4,5,221.74266666666668,3
w13,16,60,4,2048,1408,16,32,256,1,4,2,220.782,3
w13,16,60,4,2048,1408,16,32,256,1,4,3,220.56933333333333,3
w13,16,60,4,2048,1408,16,32,256,1,4,4,221.6676666666667,3
w13,16,60,4,2048,1408,16,32,256,1,4,5,221.3793333333333,3
w13,16,60,4,2048,1408,16,32,256,16,4,2,220.88866666666664,3
w13,16,60,4,2048,1408,16,32,256,16,4,3,221.33633333333333,3
w13,16,60,4,2048,1408,16,32,256,16,4,4,222.47866666666664,3
w13,16,60,4,2048,1408,16,32,256,16,4,5,221.43266666666668,3
w13,16,60,4,2048,1408,16,32,256,32,4,2,221.93366666666665,3
w13,16,60,4,2048,1408,16,32,256,32,4,3,222.649,3
w13,16,60,4,2048,1408,16,32,256,32,4,4,222.35033333333334,3
w13,16,60,4,2048,1408,16,32,256,32,4,5,222.62800000000001,3
w13,16,60,4,2048,1408,16,64,128,1,4,2,221.58233333333337,3
w13,16,60,4,2048,1408,16,64,128,1,4,3,222.04066666666665,3
w13,16,60,4,2048,1408,16,64,128,1,4,4,221.54,3
w13,16,60,4,2048,1408,16,64,128,1,4,5,220.7603333333333,3
w13,16,60,4,2048,1408,16,64,128,1,8,2,222.07333333333335,3
w13,16,60,4,2048,1408,16,64,128,1,8,3,221.45366666666666,3
w13,16,60,4,2048,1408,16,64,128,1,8,5,220.94233333333332,3
w13,16,60,4,2048,1408,16,64,128,16,4,2,222.44566666666665,3
w13,16,60,4,2048,1408,16,64,128,16,4,3,222.04066666666668,3
w13,16,60,4,2048,1408,16,64,128,16,4,4,221.19833333333335,3
w13,16,60,4,2048,1408,16,64,128,16,4,5,220.6003333333333,3
w13,16,60,4,2048,1408,16,64,128,16,8,2,221.486,3
w13,16,60,4,2048,1408,16,64,128,16,8,3,221.89166666666665,3
w13,16,60,4,2048,1408,16,64,128,16,8,5,222.052,3
w13,16,60,4,2048,1408,16,64,128,32,4,2,221.9126666666667,3
w13,16,60,4,2048,1408,16,64,128,32,4,3,221.36933333333332,3
w13,16,60,4,2048,1408,16,64,128,32,4,4,221.28333333333333,3
w13,16,60,4,2048,1408,16,64,128,32,4,5,221.77433333333332,3
w13,16,60,4,2048,1408,16,64,128,32,8,2,221.90233333333333,3
w13,16,60,4,2048,1408,16,64,128,32,8,3,221.11233333333334,3
w13,16,60,4,2048,1408,16,64,128,32,8,5,221.20866666666666,3
w13,16,60,4,2048,1408,16,64,128,64,4,2,222.46733333333336,3
w13,16,60,4,2048,1408,16,64,128,64,4,3,222.702,3
w13,16,60,4,2048,1408,16,64,128,64,4,4,222.13700000000003,3
w13,16,60,4,2048,1408,16,64,128,64,4,5,222.756,3
w13,16,60,4,2048,1408,16,64,128,64,8,3,221.51833333333335,3
w13,16,60,4,2048,1408,16,64,128,64,8,5,222.5956666666667,3
w13,16,60,4,2048,1408,16,64,256,1,4,2,221.64633333333336,3
w13,16,60,4,2048,1408,16,64,256,1,4,3,222.18966666666665,3
w13,16,60,4,2048,1408,16,64,256,1,4,5,222.745,3
w13,16,60,4,2048,1408,16,64,256,1,8,2,222.45666666666668,3
w13,16,60,4,2048,1408,16,64,256,1,8,3,221.45466666666667,3
w13,16,60,4,2048,1408,16,64,256,16,4,2,221.31566666666666,3
w13,16,60,4,2048,1408,16,64,256,16,4,3,221.12400000000002,3
w13,16,60,4,2048,1408,16,64,256,16,8,2,222.467,3
w13,16,60,4,2048,1408,16,64,256,16,8,3,220.82500000000002,3
w13,16,60,4,2048,1408,16,64,256,32,4,2,222.10433333333333,3
w13,16,60,4,2048,1408,16,64,256,32,4,3,221.76366666666664,3
w13,16,60,4,2048,1408,16,64,256,32,8,2,222.31799999999998,3
w13,16,60,4,2048,1408,16,64,256,32,8,3,221.732,3
w13,16,60,4,2048,1408,16,64,256,64,8,3,222.596,3
w13,16,60,4,2048,1408,16,128,128,1,4,4,222.62800000000001,3
w13,16,60,4,2048,1408,16,128,128,1,8,5,221.48566666666667,3
w13,16,60,4,2048,1408,16,128,128,16,8,5,221.98733333333334,3
w13,16,60,4,2048,1408,16,128,128,32,8,5,222.54266666666663,3
w13,16,60,4,2048,1408,16,128,128,64,8,5,222.308,3
w13,16,60,4,2048,1408,32,32,128,1,4,3,222.27599999999998,3
w13,16,60,4,2048,1408,32,32,128,4,4,4,221.73166666666665,3
w13,16,60,4,2048,1408,32,64,128,1,4,2,222.52033333333335,3
w13,16,60,4,2048,1408,32,64,128,4,4,2,222.21133333333333,3
w13,16,60,4,2048,1408,32,64,128,32,4,2,221.93366666666668,3
w13,16,60,4,2048,1408,32,64,128,32,4,3,222.74433333333332,3
w13,16,60,4,2048,1408,32,128,128,1,4,3,222.18966666666665,3
w13,16,60,4,2048,1408,32,128,128,4,4,3,221.75233333333335,3
w13,16,60,4,2048,1408,32,128,128,4,8,3,222.16933333333336,3
w13,16,60,4,2048,1408,32,128,128,8,4,3,222.393,3
w13,16,60,4,2048,1408,32,128,128,8,8,3,222.52066666666667,3
w13,16,60,4,2048,1408,32,128,128,16,4,3,222.21166666666667,3
w13,16,60,4,2048,1408,32,128,128,32,4,3,222.45666666666668,3
w13,16,60,4,2048,1408,32,128,128,64,8,3,222.702,3
w13,16,60,4,2048,1408,64,64,64,4,4,3,222.53166666666667,3
w13,16,60,4,2048,1408,64,64,64,32,4,3,222.6916666666667,3
w13,16,60,6,3584,2304,16,16,128,1,4,3,626.918,3
w13,16,60,6,3584,2304,16,16,128,1,4,5,628.6149999999999,3
w13,16,60,6,3584,2304,16,16,128,4,4,3,627.292,3
w13,16,60,6,3584,2304,16,16,128,4,4,5,628.326,3
w13,16,60,6,3584,2304,16,16,256,1,4,3,627.7713333333334,3
w13,16,60,6,3584,2304,16,16,256,1,4,4,628.0493333333334,3
w13,16,60,6,3584,2304,16,16,256,1,4,5,627.143,3
w13,16,60,6,3584,2304,16,16,256,4,4,3,628.497,3
w13,16,60,6,3584,2304,16,16,256,4,4,4,628.1873333333333,3
w13,16,60,6,3584,2304,16,16,256,4,4,5,627.857,3
w13,16,60,6,3584,2304,16,32,128,1,4,3,626.5346666666666,3
w13,16,60,6,3584,2304,16,32,128,1,4,4,626.47,3
w13,16,60,6,3584,2304,16,32,128,1,4,5,623.612,3
w13,16,60,6,3584,2304,16,32,128,4,4,3,627.6226666666666,3
w13,16,60,6,3584,2304,16,32,128,4,4,5,624.5503333333332,3
w13,16,60,6,3584,2304,16,32,128,4,8,5,628.273,3
w13,16,60,6,3584,2304,16,32,128,16,4,3,626.7686666666667,3
w13,16,60,6,3584,2304,16,32,128,16,4,4,628.5396666666667,3
w13,16,60,6,3584,2304,16,32,128,16,4,5,624.1126666666667,3
w13,16,60,6,3584,2304,16,32,128,32,4,3,626.8336666666668,3
w13,16,60,6,3584,2304,16,32,128,32,4,4,627.8993333333333,3
w13,16,60,6,3584,2304,16,32,128,32,4,5,624.6033333333334,3
w13,16,60,6,3584,2304,16,32,128,32,8,5,628.6566666666666,3
w13,16,60,6,3584,2304,16,32,128,64,4,3,627.9853333333334,3
w13,16,60,6,3584,2304,16,32,128,64,4,5,625.766,3
w13,16,60,6,3584,2304,16,32,256,1,4,2,624.5823333333333,3
w13,16,60,6,3584,2304,16,32,256,1,4,3,623.4093333333334,3
w13,16,60,6,3584,2304,16,32,256,1,4,4,623.9526666666667,3
w13,16,60,6,3584,2304,16,32,256,1,4,5,622.641,3
w13,16,60,6,3584,2304,16,32,256,1,8,5,628.0923333333334,3
w13,16,60,6,3584,2304,16,32,256,16,4,2,625.105,3
w13,16,60,6,3584,2304,16,32,256,16,4,3,625.0193333333333,3
w13,16,60,6,3584,2304,16,32,256,16,4,4,623.975,3
w13,16,60,6,3584,2304,16,32,256,16,4,5,624.102,3
w13,16,60,6,3584,2304,16,32,256,32,4,2,625.7453333333334,3
w13,16,60,6,3584,2304,16,32,256,32,4,3,624.806,3
w13,16,60,6,3584,2304,16,32,256,32,4,4,626.0646666666667,3
w13,16,60,6,3584,2304,16,32,256,32,4,5,625.255,3
w13,16,60,6,3584,2304,16,32,256,64,4,2,625.7669999999999,3
w13,16,60,6,3584,2304,16,32,256,64,4,3,626.2783333333333,3
w13,16,60,6,3584,2304,16,32,256,64,4,4,625.937,3
w13,16,60,6,3584,2304,16,32,256,64,4,5,626.5563333333333,3
w13,16,60,6,3584,2304,16,64,128,1,4,2,627.654,3
w13,16,60,6,3584,2304,16,64,128,1,4,4,625.2966666666666,3
w13,16,60,6,3584,2304,16,64,128,1,4,5,623.654,3
w13,16,60,6,3584,2304,16,64,128,1,8,3,627.8033333333333,3
w13,16,60,6,3584,2304,16,64,128,1,8,4,628.6463333333332,3
w13,16,60,6,3584,2304,16,64,128,1,8,5,624.679,3
w13,16,60,6,3584,2304,16,64,128,16,4,2,627.6116666666667,3
w13,16,60,6,3584,2304,16,64,128,16,4,4,627.2486666666667,3
w13,16,60,6,3584,2304,16,64,128,16,4,5,624.2416666666667,3
w13,16,60,6,3584,2304,16,64,128,16,8,3,626.2886666666667,3
w13,16,60,6,3584,2304,16,64,128,16,8,4,628.2516666666667,3
w13,16,60,6,3584,2304,16,64,128,16,8,5,624.1883333333334,3
w13,16,60,6,3584,2304,16,64,128,32,4,4,627.7403333333333,3
w13,16,60,6,3584,2304,16,64,128,32,4,5,624.0916666666667,3
w13,16,60,6,3584,2304,16,64,128,32,8,3,627.3453333333333,3
w13,16,60,6,3584,2304,16,64,128,32,8,5,623.9206666666668,3
w13,16,60,6,3584,2304,16,64,128,64,4,4,627.9533333333333,3
w13,16,60,6,3584,2304,16,64,128,64,4,5,626.343,3
w13,16,60,6,3584,2304,16,64,128,64,8,3,627.356,3
w13,16,60,6,3584,2304,16,64,128,64,8,5,625.447,3
w13,16,60,6,3584,2304,16,64,256,1,4,2,626.438,3
w13,16,60,6,3584,2304,16,64,256,1,4,3,623.8353333333333,3
w13,16,60,6,3584,2304,16,64,256,1,4,4,625.2866666666667,3
w13,16,60,6,3584,2304,16,64,256,1,4,5,624.4540000000001,3
w13,16,60,6,3584,2304,16,64,256,1,8,2,625.703,3
w13,16,60,6,3584,2304,16,64,256,1,8,3,623.2810000000001,3
w13,16,60,6,3584,2304,16,64,256,1,8,4,626.6193333333334,3
w13,16,60,6,3584,2304,16,64,256,1,8,5,624.487,3
w13,16,60,6,3584,2304,16,64,256,16,4,2,626.1713333333333,3
w13,16,60,6,3584,2304,16,64,256,16,4,3,624.6893333333334,3
w13,16,60,6,3584,2304,16,64,256,16,4,4,627.5586666666667,3
w13,16,60,6,3584,2304,16,64,256,16,4,5,624.8386666666667,3
w13,16,60,6,3584,2304,16,64,256,16,8,2,626.4166666666666,3
w13,16,60,6,3584,2304,16,64,256,16,8,3,624.2833333333333,3
w13,16,60,6,3584,2304,16,64,256,16,8,4,628.135,3
w13,16,60,6,3584,2304,16,64,256,16,8,5,625.2006666666666,3
w13,16,60,6,3584,2304,16,64,256,32,4,2,627.3023333333333,3
w13,16,60,6,3584,2304,16,64,256,32,4,3,624.6146666666667,3
w13,16,60,6,3584,2304,16,64,256,32,4,4,628.9236666666667,3
w13,16,60,6,3584,2304,16,64,256,32,4,5,626.7793333333333,3
w13,16,60,6,3584,2304,16,64,256,32,8,2,626.8333333333334,3
w13,16,60,6,3584,2304,16,64,256,32,8,3,624.945,3
w13,16,60,6,3584,2304,16,64,256,32,8,5,626.769,3
w13,16,60,6,3584,2304,16,64,256,64,4,2,628.6896666666667,3
w13,16,60,6,3584,2304,16,64,256,64,4,3,626.545,3
w13,16,60,6,3584,2304,16,64,256,64,4,5,627.4413333333333,3
w13,16,60,6,3584,2304,16,64,256,64,8,2,626.7696666666667,3
w13,16,60,6,3584,2304,16,64,256,64,8,3,624.5179999999999,3
w13,16,60,6,3584,2304,16,64,256,64,8,5,627.1423333333333,3
w13,16,60,6,3584,2304,16,128,128,1,4,2,627.3670000000001,3
w13,16,60,6,3584,2304,16,128,128,1,4,4,626.8433333333334,3
w13,16,60,6,3584,2304,16,128,128,1,4,5,625.9263333333333,3
w13,16,60,6,3584,2304,16,128,128,1,8,4,626.2673333333333,3
w13,16,60,6,3584,2304,16,128,128,1,8,5,623.0463333333333,3
w13,16,60,6,3584,2304,16,128,128,16,4,2,627.1533333333333,3
w13,16,60,6,3584,2304,16,128,128,16,4,4,626.161,3
w13,16,60,6,3584,2304,16,128,128,16,4,5,626.7376666666667,3
w13,16,60,6,3584,2304,16,128,128,16,8,4,626.2463333333334,3
w13,16,60,6,3584,2304,16,128,128,16,8,5,623.4843333333333,3
w13,16,60,6,3584,2304,16,128,128,32,4,2,628.71,3
w13,16,60,6,3584,2304,16,128,128,32,4,4,627.2593333333333,3
w13,16,60,6,3584,2304,16,128,128,32,4,5,626.79,3
w13,16,60,6,3584,2304,16,128,128,32,8,4,628.6683333333334,3
w13,16,60,6,3584,2304,16,128,128,32,8,5,624.2946666666667,3
w13,16,60,6,3584,2304,16,128,128,64,4,2,627.5586666666667,3
w13,16,60,6,3584,2304,16,128,128,64,4,4,628.273,3
w13,16,60,6,3584,2304,16,128,128,64,4,5,626.8866666666667,3
w13,16,60,6,3584,2304,16,128,128,64,8,4,627.7073333333333,3
w13,16,60,6,3584,2304,16,128,128,64,8,5,624.7743333333334,3
w13,16,60,6,3584,2304,32,32,128,1,4,3,627.857,3
w13,16,60,6,3584,2304,32,32,128,1,4,4,627.8036666666667,3
w13,16,60,6,3584,2304,32,32,128,1,4,5,626.6833333333334,3
w13,16,60,6,3584,2304,32,32,128,4,4,3,627.8353333333333,3
w13,16,60,6,3584,2304,32,32,128,4,4,4,625.6276666666666,3
w13,16,60,6,3584,2304,32,32,128,4,4,5,626.3739999999999,3
w13,16,60,6,3584,2304,32,32,128,16,4,3,628.6566666666666,3
w13,16,60,6,3584,2304,32,32,128,16,4,4,627.4623333333333,3
w13,16,60,6,3584,2304,32,32,128,16,4,5,627.1419999999999,3
w13,16,60,6,3584,2304,32,32,128,64,4,3,628.5500000000001,3
w13,16,60,6,3584,2304,32,32,128,64,4,4,628.0806666666666,3
w13,16,60,6,3584,2304,32,32,256,1,4,3,627.3666666666667,3
w13,16,60,6,3584,2304,32,32,256,1,4,4,627.7186666666666,3
w13,16,60,6,3584,2304,32,32,256,4,4,3,627.4413333333333,3
w13,16,60,6,3584,2304,32,32,256,4,4,4,628.263,3
w13,16,60,6,3584,2304,32,32,256,16,4,3,628.0383333333333,3
w13,16,60,6,3584,2304,32,64,128,1,4,3,627.1846666666667,3
w13,16,60,6,3584,2304,32,64,128,1,4,4,628.4863333333333,3
w13,16,60,6,3584,2304,32,64,128,1,4,5,625.798,3
w13,16,60,6,3584,2304,32,64,128,1,8,3,628.615,3
w13,16,60,6,3584,2304,32,64,128,1,8,5,627.1750000000001,3
w13,16,60,6,3584,2304,32,64,128,4,4,3,627.9743333333333,3
w13,16,60,6,3584,2304,32,64,128,4,4,4,628.8913333333334,3
w13,16,60,6,3584,2304,32,64,128,4,4,5,626.0646666666667,3
w13,16,60,6,3584,2304,32,64,128,4,8,5,626.8973333333333,3
w13,16,60,6,3584,2304,32,64,128,16,4,3,627.2596666666667,3
w13,16,60,6,3584,2304,32,64,128,16,4,5,626.6516666666666,3
w13,16,60,6,3584,2304,32,64,128,16,8,5,626.6523333333333,3
w13,16,60,6,3584,2304,32,64,128,32,4,5,627.8033333333333,3
w13,16,60,6,3584,2304,32,64,128,32,8,5,627.6116666666667,3
w13,16,60,6,3584,2304,32,64,128,64,4,5,628.497,3
w13,16,60,6,3584,2304,32,64,256,1,8,3,625.8086666666667,3
w13,16,60,6,3584,2304,32,64,256,1,8,5,627.014,3
w13,16,60,6,3584,2304,32,64,256,8,8,3,628.3266666666667,3
w13,16,60,6,3584,2304,32,64,256,8,8,5,627.9430000000001,3
w13,16,60,6,3584,2304,32,64,256,16,8,3,628.8380000000001,3
w13,16,60,6,3584,2304,32,64,256,16,8,5,628.4870000000001,3
w13,16,60,6,3584,2304,32,64,256,32,8,3,627.4193333333334,3
w13,16,60,6,3584,2304,32,128,128,1,4,3,625.3723333333334,3
w13,16,60,6,3584,2304,32,128,128,1,4,5,626.6513333333334,3
w13,16,60,6,3584,2304,32,128,128,1,8,3,625.4466666666667,3
w13,16,60,6,3584,2304,32,128,128,1,8,5,627.473,3
w13,16,60,6,3584,2304,32,128,128,4,4,3,626.3846666666667,3
w13,16,60,6,3584,2304,32,128,128,4,4,5,627.1423333333333,3
w13,16,60,6,3584,2304,32,128,128,4,8,3,625.83,3
w13,16,60,6,3584,2304,32,128,128,4,8,5,625.7766666666666,3
w13,16,60,6,3584,2304,32,128,128,8,4,3,625.8623333333334,3
w13,16,60,6,3584,2304,32,128,128,8,4,5,628.1986666666667,3
w13,16,60,6,3584,2304,32,128,128,8,8,3,626.375,3
w13,16,60,6,3584,2304,32,128,128,8,8,5,626.727,3
w13,16,60,6,3584,2304,32,128,128,16,4,3,625.8833333333333,3
w13,16,60,6,3584,2304,32,128,128,16,4,5,627.6753333333332,3
w13,16,60,6,3584,2304,32,128,128,16,8,3,625.7776666666667,3
w13,16,60,6,3584,2304,32,128,128,16,8,5,628.3903333333334,3
w13,16,60,6,3584,2304,32,128,128,32,4,3,626.14,3
w13,16,60,6,3584,2304,32,128,128,32,4,5,626.8646666666667,3
w13,16,60,6,3584,2304,32,128,128,32,8,3,626.5883333333333,3
w13,16,60,6,3584,2304,32,128,128,32,8,5,627.0786666666667,3
w13,16,60,6,3584,2304,32,128,128,64,4,3,626.438,3
w13,16,60,6,3584,2304,32,128,128,64,4,5,627.2486666666667,3
w13,16,60,6,3584,2304,32,128,128,64,8,3,627.6653333333334,3
w13,16,60,6,3584,2304,32,128,128,64,8,5,627.8566666666667,3
w13,16,60,8,2048,1536,16,32,64,16,4,3,243.14000000000001,3
w13,16,60,8,2048,1536,16,32,128,1,4,2,241.284,3
w13,16,60,8,2048,1536,16,32,128,1,4,4,242.94733333333332,3
w13,16,60,8,2048,1536,16,32,128,1,4,5,241.977,3
w13,16,60,8,2048,1536,16,32,128,4,4,2,240.92033333333333,3
w13,16,60,8,2048,1536,16,32,128,4,4,4,242.33933333333334,3
w13,16,60,8,2048,1536,16,32,128,4,4,5,242.14700000000002,3
w13,16,60,8,2048,1536,16,32,128,16,4,2,241.571,3
w13,16,60,8,2048,1536,16,32,128,16,4,4,242.33899999999997,3
w13,16,60,8,2048,1536,16,32,128,16,4,5,241.924,3
w13,16,60,8,2048,1536,16,32,128,32,4,2,242.361,3
w13,16,60,8,2048,1536,16,32,128,32,4,4,242.67066666666665,3
w13,16,60,8,2048,1536,16,32,128,32,4,5,241.90200000000002,3
w13,16,60,8,2048,1536,16,32,128,64,4,2,241.731,3
w13,16,60,8,2048,1536,16,32,128,64,4,5,242.596,3
w13,16,60,8,2048,1536,16,32,256,1,4,3,241.62466666666668,3
w13,16,60,8,2048,1536,16,32,256,1,4,4,242.467,3
w13,16,60,8,2048,1536,16,32,256,1,4,5,242.09400000000002,3
w13,16,60,8,2048,1536,16,32,256,16,4,3,241.508,3
w13,16,60,8,2048,1536,16,32,256,16,4,4,242.82966666666667,3
w13,16,60,8,2048,1536,16,32,256,16,4,5,242.97933333333333,3
w13,16,60,8,2048,1536,16,32,256,32,4,3,242.03,3
w13,16,60,8,2048,1536,16,32,256,32,4,4,242.98000000000002,3
w13,16,60,8,2048,1536,16,32,256,32,4,5,243.21466666666666,3
w13,16,60,8,2048,1536,16,32,256,64,4,3,242.79866666666666,3
w13,16,60,8,2048,1536,16,32,256,64,4,4,243.19233333333332,3
w13,16,60,8,2048,1536,16,64,128,1,4,2,242.12666666666667,3
w13,16,60,8,2048,1536,16,64,128,1,4,4,241.68933333333334,3
w13,16,60,8,2048,1536,16,64,128,1,4,5,240.87800000000001,3
w13,16,60,8,2048,1536,16,64,128,1,8,3,243.29966666666667,3
w13,16,60,8,2048,1536,16,64,128,1,8,4,242.9896666666667,3
w13,16,60,8,2048,1536,16,64,128,1,8,5,241.51833333333335,3
w13,16,60,8,2048,1536,16,64,128,16,4,2,241.9766666666667,3
w13,16,60,8,2048,1536,16,64,128,16,4,4,242.39300000000003,3
w13,16,60,8,2048,1536,16,64,128,16,4,5,241.54999999999998,3
w13,16,60,8,2048,1536,16,64,128,16,8,5,242.47799999999998,3
w13,16,60,8,2048,1536,16,64,128,32,4,2,241.475,3
w13,16,60,8,2048,1536,16,64,128,32,4,4,241.9766666666667,3
w13,16,60,8,2048,1536,16,64,128,32,4,5,241.68833333333336,3
w13,16,60,8,2048,1536,16,64,128,32,8,3,242.82966666666667,3
w13,16,60,8,2048,1536,16,64,128,32,8,4,242.89466666666667,3
w13,16,60,8,2048,1536,16,64,128,32,8,5,242.18999999999997,3
w13,16,60,8,2048,1536,16,64,128,64,4,2,241.84833333333333,3
w13,16,60,8,2048,1536,16,64,128,64,4,4,242.979,3
w13,16,60,8,2048,1536,16,64,128,64,4,5,242.77666666666667,3
w13,16,60,8,2048,1536,16,64,128,64,8,3,243.25633333333334,3
w13,16,60,8,2048,1536,16,64,128,64,8,5,242.62699999999998,3
w13,16,60,8,2048,1536,16,64,256,1,4,2,242.96900000000002,3
w13,16,60,8,2048,1536,16,64,256,1,4,3,241.92333333333332,3
w13,16,60,8,2048,1536,16,64,256,1,4,5,243.31066666666666,3
w13,16,60,8,2048,1536,16,64,256,1,8,3,241.891,3
w13,16,60,8,2048,1536,16,64,256,16,4,2,242.73466666666664,3
w13,16,60,8,2048,1536,16,64,256,16,4,3,242.31766666666667,3
w13,16,60,8,2048,1536,16,64,256,16,8,3,242.16833333333332,3
w13,16,60,8,2048,1536,16,64,256,32,4,3,242.32933333333335,3
w13,16,60,8,2048,1536,16,64,256,32,8,3,242.32833333333335,3
w13,16,60,8,2048,1536,16,128,128,1,4,2,241.70966666666666,3
w13,16,60,8,2048,1536,16,128,128,1,4,3,242.34966666666665,3
w13,16,60,8,2048,1536,16,128,128,1,8,2,241.47566666666668,3
w13,16,60,8,2048,1536,16,128,128,1,8,3,242.55266666666668,3
w13,16,60,8,2048,1536,16,128,128,1,8,4,242.617,3
w13,16,60,8,2048,1536,16,128,128,1,8,5,241.923,3
w13,16,60,8,2048,1536,16,128,128,16,4,2,243.01200000000003,3
w13,16,60,8,2048,1536,16,128,128,16,8,2,242.13733333333334,3
w13,16,60,8,2048,1536,16,128,128,16,8,5,242.04133333333334,3
w13,16,60,8,2048,1536,16,128,128,32,4,2,242.755,3
w13,16,60,8,2048,1536,16,128,128,32,4,3,243.09633333333332,3
w13,16,60,8,2048,1536,16,128,128,32,8,2,242.11599999999999,3
w13,16,60,8,2048,1536,16,128,128,32,8,3,243.11766666666668,3
w13,16,60,8,2048,1536,16,128,128,32,8,5,243.03333333333333,3
w13,16,60,8,2048,1536,16,128,128,64,4,3,243.05466666666666,3
w13,16,60,8,2048,1536,16,128,128,64,8,2,242.64933333333332,3
w13,16,60,8,2048,1536,16,128,128,64,8,5,242.86266666666666,3
w13,16,60,8,2048,1536,32,32,128,1,4,4,243.225,3
w13,16,60,8,2048,1536,32,32,128,4,4,4,243.20333333333335,3
w13,16,60,8,2048,1536,32,128,128,1,4,2,243.1816666666667,3
w13,16,60,8,2048,1536,32,128,128,1,4,3,243.22433333333333,3
w13,16,60,8,2048,1536,32,128,128,4,4,3,243.15033333333335,3
w13,16,60,8,2048,1536,32,128,128,8,4,2,243.28866666666667,3
w13,16,64,6,3072,2048,16,16,256,1,4,4,511.70700000000005,3
w13,16,64,6,3072,2048,16,32,128,1,4,2,510.4796666666667,3
w13,16,64,6,3072,2048,16,32,128,1,4,4,510.76866666666666,3
w13,16,64,6,3072,2048,16,32,128,1,4,5,508.63533333333334,3
w13,16,64,6,3072,2048,16,32,128,4,4,2,510.35266666666666,3
w13,16,64,6,3072,2048,16,32,128,4,4,5,509.85100000000006,3
w13,16,64,6,3072,2048,16,32,128,16,4,2,511.547,3
w13,16,64,6,3072,2048,16,32,128,16,4,4,511.846,3
w13,16,64,6,3072,2048,16,32,128,16,4,5,511.141,3
w13,16,64,6,3072,2048,16,32,128,32,4,2,512.432,3
w13,16,64,6,3072,2048,16,32,128,32,4,4,512.4646666666666,3
w13,16,64,6,3072,2048,16,32,128,32,4,5,510.32,3
w13,16,64,6,3072,2048,16,32,256,1,4,3,510.032,3
w13,16,64,6,3072,2048,16,32,256,1,4,4,507.79266666666666,3
w13,16,64,6,3072,2048,16,32,256,1,4,5,507.38633333333337,3
w13,16,64,6,3072,2048,16,32,256,16,4,3,510.88533333333334,3
w13,16,64,6,3072,2048,16,32,256,16,4,4,508.2716666666667,3
w13,16,64,6,3072,2048,16,32,256,16,4,5,508.02700000000004,3
w13,16,64,6,3072,2048,16,32,256,32,4,3,510.9816666666666,3
w13,16,64,6,3072,2048,16,32,256,32,4,4,508.67766666666665,3
w13,16,64,6,3072,2048,16,32,256,32,4,5,508.933,3
w13,16,64,6,3072,2048,16,32,256,64,4,5,510.76866666666666,3
w13,16,64,6,3072,2048,16,64,128,1,4,3,510.4483333333333,3
w13,16,64,6,3072,2048,16,64,128,1,4,4,509.30733333333336,3
w13,16,64,6,3072,2048,16,64,128,1,4,5,509.03,3
w13,16,64,6,3072,2048,16,64,128,1,8,3,511.74966666666666,3
w13,16,64,6,3072,2048,16,64,128,1,8,4,511.99466666666666,3
w13,16,64,6,3072,2048,16,64,128,1,8,5,510.5013333333333,3
w13,16,64,6,3072,2048,16,64,128,16,4,4,511.69666666666666,3
w13,16,64,6,3072,2048,16,64,128,16,4,5,509.99,3
w13,16,64,6,3072,2048,16,64,128,16,8,5,510.2453333333333,3
w13,16,64,6,3072,2048,16,64,128,32,4,4,510.94966666666664,3
w13,16,64,6,3072,2048,16,64,128,32,4,5,510.2033333333333,3
w13,16,64,6,3072,2048,16,64,128,32,8,4,511.814,3
w13,16,64,6,3072,2048,16,64,128,32,8,5,511.06666666666666,3
w13,16,64,6,3072,2048,16,64,128,64,4,4,512.4106666666667,3
w13,16,64,6,3072,2048,16,64,128,64,8,4,512.4423333333333,3
w13,16,64,6,3072,2048,16,64,256,1,4,2,510.9066666666667,3
w13,16,64,6,3072,2048,16,64,256,1,4,3,509.382,3
w13,16,64,6,3072,2048,16,64,256,1,4,4,509.126,3
w13,16,64,6,3072,2048,16,64,256,1,4,5,507.99500000000006,3
w13,16,64,6,3072,2048,16,64,256,1,8,3,510.8956666666666,3
w13,16,64,6,3072,2048,16,64,256,1,8,4,509.926,3
w13,16,64,6,3072,2048,16,64,256,1,8,5,508.86966666666666,3
w13,16,64,6,3072,2048,16,64,256,16,4,3,511.2906666666667,3
w13,16,64,6,3072,2048,16,64,256,16,4,4,511.28,3
w13,16,64,6,3072,2048,16,64,256,16,4,5,509.2316666666666,3
w13,16,64,6,3072,2048,16,64,256,16,8,3,510.34099999999995,3
w13,16,64,6,3072,2048,16,64,256,16,8,4,511.6963333333333,3
w13,16,64,6,3072,2048,16,64,256,16,8,5,509.2006666666667,3
w13,16,64,6,3072,2048,16,64,256,32,4,2,511.84566666666666,3
w13,16,64,6,3072,2048,16,64,256,32,4,4,512.4423333333333,3
w13,16,64,6,3072,2048,16,64,256,32,4,5,510.17066666666665,3
w13,16,64,6,3072,2048,16,64,256,32,8,3,511.55733333333336,3
w13,16,64,6,3072,2048,16,64,256,32,8,5,510.44866666666667,3
w13,16,64,6,3072,2048,16,64,256,64,4,5,510.992,3
w13,16,64,6,3072,2048,16,64,256,64,8,5,512.2293333333333,3
w13,16,64,6,3072,2048,16,128,128,1,4,3,511.01399999999995,3
w13,16,64,6,3072,2048,16,128,128,1,4,4,512.0273333333333,3
w13,16,64,6,3072,2048,16,128,128,1,8,3,510.501,3
w13,16,64,6,3072,2048,16,128,128,1,8,5,509.9676666666667,3
w13,16,64,6,3072,2048,16,128,128,16,4,5,511.48333333333335,3
w13,16,64,6,3072,2048,16,128,128,16,8,5,509.57300000000004,3
w13,16,64,6,3072,2048,16,128,128,32,4,5,512.112,3
w13,16,64,6,3072,2048,16,128,128,32,8,5,510.8213333333333,3
w13,16,64,6,3072,2048,32,32,128,1,4,4,512.4853333333333,3
w13,16,64,6,3072,2048,32,32,128,1,4,5,511.34366666666665,3
w13,16,64,6,3072,2048,32,32,128,4,4,2,512.2726666666666,3
w13,16,64,6,3072,2048,32,32,128,4,4,5,511.7916666666667,3
w13,16,64,6,3072,2048,32,32,256,1,4,3,511.81333333333333,3
w13,16,64,6,3072,2048,32,32,256,1,4,4,512.3153333333333,3
w13,16,64,6,3072,2048,32,64,128,1,8,4,512.3256666666667,3
w13,16,64,6,3072,2048,32,64,128,4,8,5,511.84566666666666,3
w13,16,64,6,3072,2048,32,64,256,1,8,5,511.9303333333334,3
w13,16,64,6,3072,2048,32,64,256,8,8,5,512.0163333333334,3
w13,16,64,6,3072,2048,32,128,128,1,4,3,511.33366666666666,3
w13,16,64,6,3072,2048,32,128,128,1,4,5,512.251,3
w13,16,64,6,3072,2048,32,128,128,1,8,3,511.8883333333333,3
w13,16,64,6,3072,2048,32,128,128,4,4,3,511.462,3
w13,16,64,6,3072,2048,32,128,128,4,4,5,512.1873333333333,3
w13,16,64,6,3072,2048,32,128,128,16,4,5,512.4856666666666,3
w13,16,64,6,3072,2048,64,128,128,1,8,4,512.4533333333334,3
w13,16,64,6,3584,1536,16,16,256,1,4,5,448.6556666666667,3
w13,16,64,6,3584,1536,16,16,256,4,4,5,449.79733333333337,3
w13,16,64,6,3584,1536,16,32,128,1,4,3,446.37266666666665,3
w13,16,64,6,3584,1536,16,32,128,1,4,4,448.67699999999996,3
w13,16,64,6,3584,1536,16,32,128,1,4,5,448.453,3
w13,16,64,6,3584,1536,16,32,128,4,4,3,446.416,3
w13,16,64,6,3584,1536,16,32,128,4,4,4,447.749,3
w13,16,64,6,3584,1536,16,32,128,4,4,5,448.25,3
w13,16,64,6,3584,1536,16,32,128,16,4,3,448.06899999999996,3
w13,16,64,6,3584,1536,16,32,128,16,4,4,448.9866666666667,3
w13,16,64,6,3584,1536,16,32,128,16,4,5,447.15200000000004,3
w13,16,64,6,3584,1536,16,32,128,32,4,3,448.06933333333336,3
w13,16,64,6,3584,1536,16,32,128,32,4,5,446.9703333333334,3
w13,16,64,6,3584,1536,16,32,128,64,4,3,447.02366666666666,3
w13,16,64,6,3584,1536,16,32,128,64,4,4,449.6903333333333,3
w13,16,64,6,3584,1536,16,32,128,64,4,5,448.122,3
w13,16,64,6,3584,1536,16,32,256,1,4,2,445.89300000000003,3
w13,16,64,6,3584,1536,16,32,256,1,4,3,446.7463333333333,3
w13,16,64,6,3584,1536,16,32,256,1,4,4,445.3063333333334,3
w13,16,64,6,3584,1536,16,32,256,1,4,5,445.6366666666666,3
w13,16,64,6,3584,1536,16,32,256,16,4,2,447.11966666666666,3
w13,16,64,6,3584,1536,16,32,256,16,4,3,447.9623333333334,3
w13,16,64,6,3584,1536,16,32,256,16,4,4,446.181,3
w13,16,64,6,3584,1536,16,32,256,16,4,5,446.373,3
w13,16,64,6,3584,1536,16,32,256,32,4,2,447.49333333333334,3
w13,16,64,6,3584,1536,16,32,256,32,4,3,449.189,3
w13,16,64,6,3584,1536,16,32,256,32,4,4,446.5116666666666,3
w13,16,64,6,3584,1536,16,32,256,32,4,5,447.674,3
w13,16,64,6,3584,1536,16,32,256,64,4,2,447.397,3
w13,16,64,6,3584,1536,16,32,256,64,4,3,448.965,3
w13,16,64,6,3584,1536,16,32,256,64,4,4,448.3036666666667,3
w13,16,64,6,3584,1536,16,32,256,64,4,5,447.8983333333333,3
w13,16,64,6,3584,1536,16,64,128,1,4,3,447.173,3
w13,16,64,6,3584,1536,16,64,128,1,4,4,446.789,3
w13,16,64,6,3584,1536,16,64,128,1,4,5,448.346,3
w13,16,64,6,3584,1536,16,64,128,1,8,2,449.1673333333333,3
w13,16,64,6,3584,1536,16,64,128,1,8,3,449.0606666666667,3
w13,16,64,6,3584,1536,16,64,128,1,8,4,448.1966666666667,3
w13,16,64,6,3584,1536,16,64,128,1,8,5,449.6266666666667,3
w13,16,64,6,3584,1536,16,64,128,16,4,3,448.613,3
w13,16,64,6,3584,1536,16,64,128,16,4,4,448.4213333333334,3
w13,16,64,6,3584,1536,16,64,128,16,4,5,449.69,3
w13,16,64,6,3584,1536,16,64,128,16,8,3,448.5919999999999,3
w13,16,64,6,3584,1536,16,64,128,16,8,4,449.157,3
w13,16,64,6,3584,1536,16,64,128,16,8,5,449.1356666666666,3
w13,16,64,6,3584,1536,16,64,128,32,4,3,448.325,3
w13,16,64,6,3584,1536,16,64,128,32,4,4,447.845,3
w13,16,64,6,3584,1536,16,64,128,32,4,5,449.285,3
w13,16,64,6,3584,1536,16,64,128,32,8,3,448.83733333333333,3
w13,16,64,6,3584,1536,16,64,128,64,4,3,449.061,3
w13,16,64,6,3584,1536,16,64,128,64,4,4,448.7943333333333,3
w13,16,64,6,3584,1536,16,64,128,64,8,2,448.6133333333334,3
w13,16,64,6,3584,1536,16,64,128,64,8,3,449.488,3
w13,16,64,6,3584,1536,16,64,256,1,4,2,447.8876666666667,3
w13,16,64,6,3584,1536,16,64,256,1,4,3,446.469,3
w13,16,64,6,3584,1536,16,64,256,1,4,4,448.0903333333333,3
w13,16,64,6,3584,1536,16,64,256,1,4,5,446.90633333333335,3
w13,16,64,6,3584,1536,16,64,256,1,8,2,447.237,3
w13,16,64,6,3584,1536,16,64,256,1,8,3,447.2373333333333,3
w13,16,64,6,3584,1536,16,64,256,1,8,4,448.63433333333336,3
w13,16,64,6,3584,1536,16,64,256,1,8,5,446.36266666666666,3
w13,16,64,6,3584,1536,16,64,256,16,4,2,447.75966666666665,3
w13,16,64,6,3584,1536,16,64,256,16,4,3,447.86633333333333,3
w13,16,64,6,3584,1536,16,64,256,16,4,5,447.9086666666667,3
w13,16,64,6,3584,1536,16,64,256,16,8,2,448.517,3
w13,16,64,6,3584,1536,16,64,256,16,8,3,448.53833333333336,3
w13,16,64,6,3584,1536,16,64,256,16,8,5,448.8476666666667,3
w13,16,64,6,3584,1536,16,64,256,32,4,2,448.19699999999995,3
w13,16,64,6,3584,1536,16,64,256,32,4,3,447.3546666666667,3
w13,16,64,6,3584,1536,16,64,256,32,4,5,448.933,3
w13,16,64,6,3584,1536,16,64,256,32,8,2,448.48533333333336,3
w13,16,64,6,3584,1536,16,64,256,32,8,3,448.76233333333334,3
w13,16,64,6,3584,1536,16,64,256,32,8,5,448.7093333333333,3
w13,16,64,6,3584,1536,16,64,256,64,4,2,448.997,3
w13,16,64,6,3584,1536,16,64,256,64,4,3,448.453,3
w13,16,64,6,3584,1536,16,64,256,64,4,5,449.48766666666666,3
w13,16,64,6,3584,1536,16,64,256,64,8,2,448.229,3
w13,16,64,6,3584,1536,16,64,256,64,8,3,449.55199999999996,3
w13,16,64,6,3584,1536,16,64,256,64,8,5,449.797,3
w13,16,64,6,3584,1536,16,128,128,1,4,2,447.95166666666665,3
w13,16,64,6,3584,1536,16,128,128,1,4,3,449.0396666666666,3
w13,16,64,6,3584,1536,16,128,128,1,4,4,449.08233333333334,3
w13,16,64,6,3584,1536,16,128,128,1,4,5,448.4316666666667,3
w13,16,64,6,3584,1536,16,128,128,1,8,2,449.21033333333327,3
w13,16,64,6,3584,1536,16,128,128,1,8,3,449.58366666666666,3
w13,16,64,6,3584,1536,16,128,128,1,8,4,448.7196666666667,3
w13,16,64,6,3584,1536,16,128,128,1,8,5,446.83166666666665,3
w13,16,64,6,3584,1536,16,128,128,16,4,3,449.637,3
w13,16,64,6,3584,1536,16,128,128,16,4,5,449.3066666666667,3
w13,16,64,6,3584,1536,16,128,128,16,8,2,446.2556666666667,3
w13,16,64,6,3584,1536,16,128,128,16,8,4,449.52,3
w13,16,64,6,3584,1536,16,128,128,16,8,5,449.093,3
w13,16,64,6,3584,1536,16,128,128,32,4,2,448.9116666666667,3
w13,16,64,6,3584,1536,16,128,128,32,4,5,449.5943333333333,3
w13,16,64,6,3584,1536,16,128,128,32,8,2,448.93266666666665,3
w13,16,64,6,3584,1536,16,128,128,32,8,3,449.6793333333333,3
w13,16,64,6,3584,1536,16,128,128,64,4,2,448.58099999999996,3
w13,16,64,6,3584,1536,16,128,128,64,8,2,447.89833333333337,3
w13,16,64,6,3584,1536,16,128,128,64,8,4,449.029,3
w13,16,64,6,3584,1536,16,128,128,64,8,5,449.4023333333333,3
w13,16,64,6,3584,1536,32,32,128,1,4,2,448.4636666666667,3
w13,16,64,6,3584,1536,32,32,128,1,4,3,448.23966666666666,3
w13,16,64,6,3584,1536,32,32,128,1,4,4,449.2846666666667,3
w13,16,64,6,3584,1536,32,32,128,1,4,5,449.0933333333333,3
w13,16,64,6,3584,1536,32,32,128,4,4,2,448.8156666666667,3
w13,16,64,6,3584,1536,32,32,128,4,4,3,447.96233333333333,3
w13,16,64,6,3584,1536,32,32,128,16,4,2,449.6476666666667,3
w13,16,64,6,3584,1536,32,32,128,16,4,3,449.4663333333333,3
w13,16,64,6,3584,1536,32,32,128,64,4,2,449.61533333333335,3
w13,16,64,6,3584,1536,32,64,128,1,4,2,449.0183333333334,3
w13,16,64,6,3584,1536,32,64,128,1,4,3,447.984,3
w13,16,64,6,3584,1536,32,64,128,1,4,4,449.786,3
w13,16,64,6,3584,1536,32,64,256,1,8,5,449.37033333333335,3
w13,16,64,6,3584,1536,32,128,128,1,4,2,448.997,3
w13,16,64,6,3584,1536,32,128,128,1,4,3,447.1093333333333,3
w13,16,64,6,3584,1536,32,128,128,1,4,5,449.77566666666667,3
w13,16,64,6,3584,1536,32,128,128,1,8,3,447.99466666666666,3
w13,16,64,6,3584,1536,32,128,128,1,8,4,448.41066666666666,3
w13,16,64,6,3584,1536,32,128,128,4,4,3,448.0903333333333,3
w13,16,64,6,3584,1536,32,128,128,4,8,3,449.2316666666666,3
w13,16,64,6,3584,1536,32,128,128,4,8,4,449.445,3
w13,16,64,6,3584,1536,32,128,128,8,4,2,448.3786666666667,3
w13,16,64,6,3584,1536,32,128,128,8,4,3,449.08233333333334,3
w13,16,64,6,3584,1536,32,128,128,16,4,2,448.805,3
w13,16,64,6,3584,1536,32,128,128,16,4,3,448.9756666666667,3
w13,16,64,6,3584,1536,32,128,128,16,8,3,447.63166666666666,3
w13,16,64,6,3584,1536,32,128,128,32,4,2,449.6583333333333,3
w13,16,64,6,3584,1536,32,128,128,32,4,3,448.7726666666667,3
w13,16,64,6,3584,1536,32,128,128,32,8,3,449.029,3
w13,16,64,6,3584,1536,32,128,128,64,4,2,449.1466666666667,3
w13,16,64,6,3584,1536,32,128,128,64,4,3,449.5303333333333,3
w13,16,64,6,3584,1536,32,128,128,64,8,3,448.68800000000005,3
w13,16,64,6,3584,1536,64,64,64,1,4,3,449.157,3
w13,16,64,6,3584,1536,64,64,64,1,4,5,449.3066666666667,3
w13,16,64,6,3584,1536,64,64,64,4,4,3,448.4213333333333,3
w13,16,64,6,3584,1536,64,128,128,1,8,4,447.9303333333334,3
w13,16,64,6,3584,1536,64,128,128,4,8,4,449.2853333333333,3
w13,16,64,6,3584,1536,64,128,128,16,8,4,448.997,3
w13,16,64,8,3584,2560,16,16,128,1,4,4,743.2393333333333,3
w13,16,64,8,3584,2560,16,16,128,4,4,5,744.1030000000001,3
w13,16,64,8,3584,2560,16,16,256,1,4,3,743.0796666666666,3
w13,16,64,8,3584,2560,16,16,256,1,4,4,742.2796666666667,3
w13,16,64,8,3584,2560,16,16,256,1,4,5,742.5776666666667,3
w13,16,64,8,3584,2560,16,16,256,4,4,3,743.207,3
w13,16,64,8,3584,2560,16,16,256,4,4,4,742.482,3
w13,16,64,8,3584,2560,16,16,256,4,4,5,742.3856666666667,3
w13,16,64,8,3584,2560,16,32,128,1,4,2,743.73,3
w13,16,64,8,3584,2560,16,32,128,1,4,5,739.8366666666667,3
w13,16,64,8,3584,2560,16,32,128,4,4,2,741.8736666666667,3
w13,16,64,8,3584,2560,16,32,128,4,4,5,739.2816666666666,3
w13,16,64,8,3584,2560,16,32,128,16,4,5,740.8076666666666,3
w13,16,64,8,3584,2560,16,32,128,32,4,4,744.498,3
w13,16,64,8,3584,2560,16,32,128,32,4,5,742.2693333333333,3
w13,16,64,8,3584,2560,16,32,128,64,4,5,742.7696666666667,3
w13,16,64,8,3584,2560,16,32,256,1,4,2,739.9113333333333,3
w13,16,64,8,3584,2560,16,32,256,1,4,3,738.7599999999999,3
w13,16,64,8,3584,2560,16,32,256,1,4,4,739.0043333333333,3
w13,16,64,8,3584,2560,16,32,256,1,4,5,737.3829999999999,3
w13,16,64,8,3584,2560,16,32,256,1,8,3,744.498,3
w13,16,64,8,3584,2560,16,32,256,1,8,5,742.1296666666667,3
w13,16,64,8,3584,2560,16,32,256,16,4,2,741.351,3
w13,16,64,8,3584,2560,16,32,256,16,4,3,740.8076666666666,3
w13,16,64,8,3584,2560,16,32,256,16,4,4,739.688,3
w13,16,64,8,3584,2560,16,32,256,16,4,5,738.9623333333334,3
w13,16,64,8,3584,2560,16,32,256,16,8,5,744.0076666666668,3
w13,16,64,8,3584,2560,16,32,256,32,4,2,742.3963333333335,3
w13,16,64,8,3584,2560,16,32,256,32,4,3,742.5679999999999,3
w13,16,64,8,3584,2560,16,32,256,32,4,4,742.5456666666668,3
w13,16,64,8,3584,2560,16,32,256,32,4,5,740.4016666666666,3
w13,16,64,8,3584,2560,16,32,256,64,4,2,743.6236666666667,3
w13,16,64,8,3584,2560,16,32,256,64,4,3,742.8556666666667,3
w13,16,64,8,3584,2560,16,32,256,64,4,4,742.535,3
w13,16,64,8,3584,2560,16,32,256,64,4,5,742.3866666666667,3
w13,16,64,8,3584,2560,16,64,128,1,4,3,744.0496666666667,3
w13,16,64,8,3584,2560,16,64,128,1,4,4,741.1493333333333,3
w13,16,64,8,3584,2560,16,64,128,1,4,5,737.181,3
w13,16,64,8,3584,2560,16,64,128,1,8,2,742.0233333333332,3
w13,16,64,8,3584,2560,16,64,128,1,8,5,738.386,3
w13,16,64,8,3584,2560,16,64,128,16,4,4,744.2959999999999,3
w13,16,64,8,3584,2560,16,64,128,16,4,5,738.8656666666666,3
w13,16,64,8,3584,2560,16,64,128,16,8,2,743.5166666666668,3
w13,16,64,8,3584,2560,16,64,128,16,8,5,739.645,3
w13,16,64,8,3584,2560,16,64,128,32,4,4,743.165,3
w13,16,64,8,3584,2560,16,64,128,32,4,5,740.3803333333334,3
w13,16,64,8,3584,2560,16,64,128,32,8,2,744.1566666666668,3
w13,16,64,8,3584,2560,16,64,128,32,8,5,740.7643333333332,3
w13,16,64,8,3584,2560,16,64,128,64,4,5,741.9173333333333,3
w13,16,64,8,3584,2560,16,64,128,64,8,5,742.834,3
w13,16,64,8,3584,2560,16,64,256,1,4,3,738.7376666666668,3
w13,16,64,8,3584,2560,16,64,256,1,4,4,740.2106666666667,3
w13,16,64,8,3584,2560,16,64,256,1,4,5,738.2046666666666,3
w13,16,64,8,3584,2560,16,64,256,1,8,2,740.1350000000001,3
w13,16,64,8,3584,2560,16,64,256,1,8,3,738.9193333333333,3
w13,16,64,8,3584,2560,16,64,256,1,8,4,739.9653333333332,3
w13,16,64,8,3584,2560,16,64,256,1,8,5,738.375,3
w13,16,64,8,3584,2560,16,64,256,16,4,3,739.527,3
w13,16,64,8,3584,2560,16,64,256,16,4,4,742.311,3
w13,16,64,8,3584,2560,16,64,256,16,4,5,740.4126666666667,3
w13,16,64,8,3584,2560,16,64,256,16,8,2,742.6533333333333,3
w13,16,64,8,3584,2560,16,64,256,16,8,3,738.6633333333334,3
w13,16,64,8,3584,2560,16,64,256,16,8,4,743.6023333333333,3
w13,16,64,8,3584,2560,16,64,256,16,8,5,741.8096666666667,3
w13,16,64,8,3584,2560,16,64,256,32,4,3,741.2336666666666,3
w13,16,64,8,3584,2560,16,64,256,32,4,5,742.407,3
w13,16,64,8,3584,2560,16,64,256,32,8,2,742.8123333333333,3
w13,16,64,8,3584,2560,16,64,256,32,8,3,741.6080000000001,3
w13,16,64,8,3584,2560,16,64,256,32,8,5,742.5456666666668,3
w13,16,64,8,3584,2560,16,64,256,64,4,3,742.7696666666667,3
w13,16,64,8,3584,2560,16,64,256,64,4,5,744.2426666666667,3
w13,16,64,8,3584,2560,16,64,256,64,8,2,744.6156666666667,3
w13,16,64,8,3584,2560,16,64,256,64,8,3,742.4290000000001,3
w13,16,64,8,3584,2560,16,128,128,1,4,4,742.6316666666667,3
w13,16,64,8,3584,2560,16,128,128,1,4,5,739.581,3
w13,16,64,8,3584,2560,16,128,128,1,8,4,743.6446666666667,3
w13,16,64,8,3584,2560,16,128,128,1,8,5,738.0663333333333,3
w13,16,64,8,3584,2560,16,128,128,16,4,3,743.7946666666667,3
w13,16,64,8,3584,2560,16,128,128,16,4,5,741.5866666666667,3
w13,16,64,8,3584,2560,16,128,128,16,8,3,744.1246666666666,3
w13,16,64,8,3584,2560,16,128,128,16,8,4,744.5306666666667,3
w13,16,64,8,3584,2560,16,128,128,16,8,5,739.6126666666665,3
w13,16,64,8,3584,2560,16,128,128,32,4,5,742.109,3
w13,16,64,8,3584,2560,16,128,128,32,8,5,741.0416666666666,3
w13,16,64,8,3584,2560,16,128,128,64,8,5,743.9963333333334,3
w13,16,64,8,3584,2560,32,32,128,1,4,3,742.0556666666666,3
w13,16,64,8,3584,2560,32,32,128,1,4,4,740.4336666666667,3
w13,16,64,8,3584,2560,32,32,128,1,4,5,741.2873333333333,3
w13,16,64,8,3584,2560,32,32,128,4,4,3,744.5513333333333,3
w13,16,64,8,3584,2560,32,32,128,4,4,4,740.3166666666666,3
w13,16,64,8,3584,2560,32,32,128,4,4,5,742.632,3
w13,16,64,8,3584,2560,32,32,128,16,4,3,744.1783333333333,3
w13,16,64,8,3584,2560,32,32,128,16,4,4,741.8849999999999,3
w13,16,64,8,3584,2560,32,32,128,16,4,5,743.1333333333333,3
w13,16,64,8,3584,2560,32,32,256,1,4,3,742.6316666666667,3
w13,16,64,8,3584,2560,32,32,256,1,4,4,741.3513333333334,3
w13,16,64,8,3584,2560,32,32,256,4,4,3,742.3116666666666,3
w13,16,64,8,3584,2560,32,32,256,4,4,4,742.5456666666665,3
w13,16,64,8,3584,2560,32,32,256,16,4,3,744.2633333333333,3
w13,16,64,8,3584,2560,32,32,256,16,4,4,743.602,3
w13,16,64,8,3584,2560,32,64,128,1,4,2,743.8903333333334,3
w13,16,64,8,3584,2560,32,64,128,1,4,5,741.8743333333333,3
w13,16,64,8,3584,2560,32,64,128,1,8,5,741.2553333333334,3
w13,16,64,8,3584,2560,32,64,128,4,4,2,743.3243333333334,3
w13,16,64,8,3584,2560,32,64,128,4,4,5,742.4293333333334,3
w13,16,64,8,3584,2560,32,64,128,4,8,5,743.4636666666667,3
w13,16,64,8,3584,2560,32,64,128,16,4,2,743.8693333333334,3
w13,16,64,8,3584,2560,32,64,128,16,4,5,743.9110000000001,3
w13,16,64,8,3584,2560,32,64,128,16,8,5,743.0266666666666,3
w13,16,64,8,3584,2560,32,64,128,32,4,5,744.4773333333333,3
w13,16,64,8,3584,2560,32,64,128,32,8,5,744.263,3
w13,16,64,8,3584,2560,32,64,256,1,4,3,742.3216666666667,3
w13,16,64,8,3584,2560,32,64,256,1,8,3,740.861,3
w13,16,64,8,3584,2560,32,64,256,1,8,4,743.6236666666667,3
w13,16,64,8,3584,2560,32,64,256,1,8,5,740.6156666666666,3
w13,16,64,8,3584,2560,32,64,256,8,8,3,743.9223333333333,3
w13,16,64,8,3584,2560,32,64,256,8,8,5,741.9173333333333,3
w13,16,64,8,3584,2560,32,64,256,16,8,3,742.8453333333333,3
w13,16,64,8,3584,2560,32,64,256,16,8,5,742.6846666666667,3
w13,16,64,8,3584,2560,32,64,256,32,8,3,744.2959999999999,3
w13,16,64,8,3584,2560,32,128,128,1,4,4,743.6443333333333,3
w13,16,64,8,3584,2560,32,128,128,1,4,5,741.5216666666666,3
w13,16,64,8,3584,2560,32,128,128,1,8,5,740.3593333333333,3
w13,16,64,8,3584,2560,32,128,128,4,4,3,743.9753333333333,3
w13,16,64,8,3584,2560,32,128,128,4,4,5,740.7966666666666,3
w13,16,64,8,3584,2560,32,128,128,4,8,5,741.1060000000001,3
w13,16,64,8,3584,2560,32,128,128,8,4,5,742.2363333333333,3
w13,16,64,8,3584,2560,32,128,128,8,8,5,742.578,3
w13,16,64,8,3584,2560,32,128,128,16,4,5,742.6529999999999,3
w13,16,64,8,3584,2560,32,128,128,16,8,5,742.4399999999999,3
w13,16,64,8,3584,2560,32,128,128,32,4,5,742.8126666666667,3
w13,16,64,8,3584,2560,32,128,128,32,8,5,742.61,3
w13,16,128,4,2048,512,16,32,128,1,4,2,89.354,3
w13,16,128,4,2048,512,16,32,128,1,4,3,89.36466666666666,3
w13,16,128,4,2048,512,16,32,128,1,4,5,89.10833333333333,3
w13,16,128,4,2048,512,16,32,128,4,4,2,88.927,3
w13,16,128,4,2048,512,16,32,128,4,4,5,88.85266666666666,3
w13,16,128,4,2048,512,16,32,128,16,4,2,89.06599999999999,3
w13,16,128,4,2048,512,16,32,128,16,4,5,89.30066666666666,3
w13,16,128,4,2048,512,16,32,128,32,4,2,88.714,3
w13,16,128,4,2048,512,16,32,128,32,4,5,89.247,3
w13,16,128,4,2048,512,16,32,128,64,4,2,89.17233333333333,3
w13,16,128,4,2048,512,16,32,128,64,4,5,89.33266666666667,3
w13,16,128,4,2048,512,16,32,256,1,4,2,89.30066666666666,3
w13,16,128,4,2048,512,16,32,256,1,4,3,88.927,3
w13,16,128,4,2048,512,16,32,256,16,4,3,89.26833333333333,3
w13,16,128,4,2048,512,16,32,256,32,4,2,89.226,3
w13,16,128,4,2048,512,16,32,256,64,4,3,89.322,3
w13,16,128,4,2048,512,16,64,64,1,4,3,89.29033333333332,3
w13,16,128,4,2048,512,16,64,64,16,4,3,89.47166666666665,3
w13,16,128,4,2048,512,16,64,64,32,4,3,89.52466666666668,3
w13,16,128,4,2048,512,16,64,128,1,4,5,88.906,3
w13,16,128,4,2048,512,16,64,128,1,8,3,88.86333333333334,3
w13,16,128,4,2048,512,16,64,128,1,8,5,89.279,3
w13,16,128,4,2048,512,16,64,128,16,4,3,89.03399999999999,3
w13,16,128,4,2048,512,16,64,128,16,4,5,89.32166666666667,3
w13,16,128,4,2048,512,16,64,128,16,8,3,88.87399999999998,3
w13,16,128,4,2048,512,16,64,128,16,8,5,89.31166666666667,3
w13,16,128,4,2048,512,16,64,128,32,4,4,89.60933333333332,3
w13,16,128,4,2048,512,16,64,128,32,8,3,89.39666666666666,3
w13,16,128,4,2048,512,16,64,128,32,8,5,89.55633333333333,3
w13,16,128,4,2048,512,16,64,128,64,4,5,89.50266666666668,3
w13,16,128,4,2048,512,16,64,128,64,8,3,89.03399999999999,3
w13,16,128,4,2048,512,16,64,256,1,4,2,89.23633333333333,3
w13,16,128,4,2048,512,16,64,256,1,8,3,89.36466666666666,3
w13,16,128,4,2048,512,16,64,256,16,4,2,89.36466666666666,3
w13,16,128,4,2048,512,16,64,256,16,4,3,89.51466666666666,3
w13,16,128,4,2048,512,16,64,256,16,8,3,89.57866666666666,3
w13,16,128,4,2048,512,16,64,256,32,4,2,89.54633333333334,3
w13,16,128,4,2048,512,16,64,256,64,4,2,89.47133333333333,3
w13,16,128,4,2048,512,16,128,64,1,8,3,89.48233333333333,3
w13,16,128,4,2048,512,16,128,128,1,4,2,89.42866666666667,3
w13,16,128,4,2048,512,16,128,128,16,8,4,89.34333333333332,3
w13,16,128,4,2048,512,32,32,128,4,4,2,89.53533333333333,3
w13,16,128,4,2048,512,32,32,128,16,4,2,89.37566666666667,3
w13,16,128,4,2048,512,32,128,128,1,8,3,89.53533333333333,3
w13,16,128,4,2048,512,32,128,128,16,8,3,89.55666666666667,3
w13,16,128,4,2048,512,64,64,64,1,4,3,89.30066666666666,3
w13,16,128,4,2048,512,64,64,64,4,4,3,89.25866666666667,3
w13,16,128,4,2048,512,64,64,64,16,4,3,89.47133333333333,3
w13,16,128,4,2048,512,64,64,64,32,4,3,89.26933333333334,3
w13,16,128,6,4096,2048,16,16,128,1,4,4,1012.8083333333333,3
w13,16,128,6,4096,2048,16,16,128,1,4,5,1010.1096666666667,3
w13,16,128,6,4096,2048,16,16,128,4,4,4,1014.0889999999999,3
w13,16,128,6,4096,2048,16,16,128,4,4,5,1012.8833333333333,3
w13,16,128,6,4096,2048,16,16,256,1,4,3,1010.5476666666667,3
w13,16,128,6,4096,2048,16,16,256,1,4,4,1009.0006666666667,3
w13,16,128,6,4096,2048,16,16,256,1,4,5,1008.649,3
w13,16,128,6,4096,2048,16,16,256,4,4,3,1009.2779999999999,3
w13,16,128,6,4096,2048,16,16,256,4,4,4,1008.2113333333333,3
w13,16,128,6,4096,2048,16,16,256,4,4,5,1008.3816666666667,3
w13,16,128,6,4096,2048,16,32,128,1,4,3,1009.8646666666667,3
w13,16,128,6,4096,2048,16,32,128,1,4,4,1012.4456666666666,3
w13,16,128,6,4096,2048,16,32,128,1,4,5,1005.9926666666667,3
w13,16,128,6,4096,2048,16,32,128,4,4,5,1006.9733333333334,3
w13,16,128,6,4096,2048,16,32,128,16,4,4,1010.4083333333333,3
w13,16,128,6,4096,2048,16,32,128,16,4,5,1008.7233333333334,3
w13,16,128,6,4096,2048,16,32,128,16,8,4,1012.2863333333333,3
w13,16,128,6,4096,2048,16,32,128,32,4,4,1009.1930000000001,3
w13,16,128,6,4096,2048,16,32,128,32,4,5,1006.7073333333333,3
w13,16,128,6,4096,2048,16,32,128,32,8,5,1013.8646666666667,3
w13,16,128,6,4096,2048,16,32,128,64,4,4,1011.0806666666667,3
w13,16,128,6,4096,2048,16,32,128,64,4,5,1009.534,3
w13,16,128,6,4096,2048,16,32,128,64,8,4,1013.4273333333334,3
w13,16,128,6,4096,2048,16,32,256,1,4,2,1008.6596666666668,3
w13,16,128,6,4096,2048,16,32,256,1,4,3,1005.7796666666667,3
w13,16,128,6,4096,2048,16,32,256,1,4,4,1006.7716666666666,3
w13,16,128,6,4096,2048,16,32,256,1,4,5,1004.3823333333333,3
w13,16,128,6,4096,2048,16,32,256,1,8,3,1014.1103333333334,3
w13,16,128,6,4096,2048,16,32,256,1,8,4,1012.6166666666667,3
w13,16,128,6,4096,2048,16,32,256,1,8,5,1007.71,3
w13,16,128,6,4096,2048,16,32,256,16,4,2,1009.0966666666667,3
w13,16,128,6,4096,2048,16,32,256,16,4,3,1006.9526666666667,3
w13,16,128,6,4096,2048,16,32,256,16,4,4,1008.7130000000001,3
w13,16,128,6,4096,2048,16,32,256,16,4,5,1006.1316666666667,3
w13,16,128,6,4096,2048,16,32,256,16,8,3,1013.6619999999999,3
w13,16,128,6,4096,2048,16,32,256,16,8,4,1014.0783333333334,3
w13,16,128,6,4096,2048,16,32,256,16,8,5,1010.7289999999999,3
w13,16,128,6,4096,2048,16,32,256,32,4,2,1008.1263333333333,3
w13,16,128,6,4096,2048,16,32,256,32,4,3,1007.2510000000001,3
w13,16,128,6,4096,2048,16,32,256,32,4,4,1007.6139999999999,3
w13,16,128,6,4096,2048,16,32,256,32,4,5,1007.3149999999999,3
w13,16,128,6,4096,2048,16,32,256,32,8,5,1010.8356666666667,3
w13,16,128,6,4096,2048,16,32,256,64,4,2,1009.7049999999999,3
w13,16,128,6,4096,2048,16,32,256,64,4,3,1007.7743333333333,3
w13,16,128,6,4096,2048,16,32,256,64,4,4,1008.4566666666666,3
w13,16,128,6,4096,2048,16,32,256,64,4,5,1008.0300000000001,3
w13,16,128,6,4096,2048,16,32,256,64,8,5,1012.7233333333334,3
w13,16,128,6,4096,2048,16,64,128,1,4,3,1014.0463333333333,3
w13,16,128,6,4096,2048,16,64,128,1,4,4,1007.049,3
w13,16,128,6,4096,2048,16,64,128,1,4,5,1005.79,3
w13,16,128,6,4096,2048,16,64,128,1,8,3,1008.947,3
w13,16,128,6,4096,2048,16,64,128,1,8,4,1011.0590000000001,3
w13,16,128,6,4096,2048,16,64,128,1,8,5,1009.683,3
w13,16,128,6,4096,2048,16,64,128,16,4,3,1013.1073333333334,3
w13,16,128,6,4096,2048,16,64,128,16,4,4,1009.1603333333333,3
w13,16,128,6,4096,2048,16,64,128,16,4,5,1005.8966666666666,3
w13,16,128,6,4096,2048,16,64,128,16,8,3,1009.9713333333333,3
w13,16,128,6,4096,2048,16,64,128,16,8,4,1010.2163333333333,3
w13,16,128,6,4096,2048,16,64,128,16,8,5,1007.3580000000001,3
w13,16,128,6,4096,2048,16,64,128,32,4,3,1011.5923333333334,3
w13,16,128,6,4096,2048,16,64,128,32,4,4,1009.0646666666667,3
w13,16,128,6,4096,2048,16,64,128,32,4,5,1007.9446666666666,3
w13,16,128,6,4096,2048,16,64,128,32,8,3,1009.5656666666667,3
w13,16,128,6,4096,2048,16,64,128,32,8,4,1009.033,3
w13,16,128,6,4096,2048,16,64,128,32,8,5,1007.3046666666665,3
w13,16,128,6,4096,2048,16,64,128,64,4,3,1013.1289999999999,3
w13,16,128,6,4096,2048,16,64,128,64,4,4,1008.0623333333333,3
w13,16,128,6,4096,2048,16,64,128,64,4,5,1006.8566666666667,3
w13,16,128,6,4096,2048,16,64,128,64,8,3,1011.8803333333334,3
w13,16,128,6,4096,2048,16,64,128,64,8,4,1009.8646666666667,3
w13,16,128,6,4096,2048,16,64,128,64,8,5,1007.9336666666667,3
w13,16,128,6,4096,2048,16,64,256,1,4,2,1009.9496666666668,3
w13,16,128,6,4096,2048,16,64,256,1,4,3,1006.4829999999998,3
w13,16,128,6,4096,2048,16,64,256,1,4,4,1006.281,3
w13,16,128,6,4096,2048,16,64,256,1,4,5,1003.9876666666665,3
w13,16,128,6,4096,2048,16,64,256,1,8,2,1011.913,3
w13,16,128,6,4096,2048,16,64,256,1,8,3,1007.966,3
w13,16,128,6,4096,2048,16,64,256,1,8,4,1006.355,3
w13,16,128,6,4096,2048,16,64,256,1,8,5,1005.5233333333332,3
w13,16,128,6,4096,2048,16,64,256,16,4,2,1010.0776666666667,3
w13,16,128,6,4096,2048,16,64,256,16,4,3,1006.2806666666667,3
w13,16,128,6,4096,2048,16,64,256,16,4,4,1011.0483333333333,3
w13,16,128,6,4096,2048,16,64,256,16,4,5,1007.23,3
w13,16,128,6,4096,2048,16,64,256,16,8,2,1011.966,3
w13,16,128,6,4096,2048,16,64,256,16,8,3,1009.982,3
w13,16,128,6,4096,2048,16,64,256,16,8,4,1008.361,3
w13,16,128,6,4096,2048,16,64,256,16,8,5,1006.953,3
w13,16,128,6,4096,2048,16,64,256,32,4,2,1008.4463333333333,3
w13,16,128,6,4096,2048,16,64,256,32,4,3,1007.4113333333333,3
w13,16,128,6,4096,2048,16,64,256,32,4,4,1007.614,3
w13,16,128,6,4096,2048,16,64,256,32,4,5,1006.9736666666666,3
w13,16,128,6,4096,2048,16,64,256,32,8,2,1012.201,3
w13,16,128,6,4096,2048,16,64,256,32,8,3,1009.6619999999999,3
w13,16,128,6,4096,2048,16,64,256,32,8,4,1009.8856666666667,3
w13,16,128,6,4096,2048,16,64,256,32,8,5,1009.0326666666666,3
w13,16,128,6,4096,2048,16,64,256,64,4,2,1009.8963333333335,3
w13,16,128,6,4096,2048,16,64,256,64,4,3,1006.8243333333334,3
w13,16,128,6,4096,2048,16,64,256,64,4,4,1009.1286666666666,3
w13,16,128,6,4096,2048,16,64,256,64,4,5,1008.6060000000001,3
w13,16,128,6,4096,2048,16,64,256,64,8,2,1012.4886666666666,3
w13,16,128,6,4096,2048,16,64,256,64,8,3,1009.4699999999999,3
w13,16,128,6,4096,2048,16,64,256,64,8,4,1010.4726666666666,3
w13,16,128,6,4096,2048,16,64,256,64,8,5,1010.398,3
w13,16,128,6,4096,2048,16,128,128,1,4,2,1013.2673333333333,3
w13,16,128,6,4096,2048,16,128,128,1,4,4,1010.334,3
w13,16,128,6,4096,2048,16,128,128,1,4,5,1007.8063333333333,3
w13,16,128,6,4096,2048,16,128,128,1,8,2,1012.3076666666666,3
w13,16,128,6,4096,2048,16,128,128,1,8,4,1010.0676666666667,3
w13,16,128,6,4096,2048,16,128,128,1,8,5,1006.814,3
w13,16,128,6,4096,2048,16,128,128,16,4,4,1011.3156666666667,3
w13,16,128,6,4096,2048,16,128,128,16,4,5,1007.518,3
w13,16,128,6,4096,2048,16,128,128,16,8,2,1012.926,3
w13,16,128,6,4096,2048,16,128,128,16,8,4,1011.9236666666666,3
w13,16,128,6,4096,2048,16,128,128,16,8,5,1008.5736666666667,3
w13,16,128,6,4096,2048,16,128,128,32,4,2,1012.6486666666666,3
w13,16,128,6,4096,2048,16,128,128,32,4,4,1009.1713333333333,3
w13,16,128,6,4096,2048,16,128,128,32,4,5,1008.1686666666666,3
w13,16,128,6,4096,2048,16,128,128,32,8,2,1010.3236666666667,3
w13,16,128,6,4096,2048,16,128,128,32,8,4,1008.9900000000001,3
w13,16,128,6,4096,2048,16,128,128,32,8,5,1008.8406666666666,3
w13,16,128,6,4096,2048,16,128,128,64,4,2,1013.5446666666667,3
w13,16,128,6,4096,2048,16,128,128,64,4,4,1009.598,3
w13,16,128,6,4096,2048,16,128,128,64,4,5,1008.6700000000001,3
w13,16,128,6,4096,2048,16,128,128,64,8,2,1009.63,3
w13,16,128,6,4096,2048,16,128,128,64,8,4,1009.5236666666666,3
w13,16,128,6,4096,2048,16,128,128,64,8,5,1008.8513333333334,3
w13,16,128,6,4096,2048,32,32,128,1,4,3,1011.2620000000001,3
w13,16,128,6,4096,2048,32,32,128,1,4,4,1009.0536666666667,3
w13,16,128,6,4096,2048,32,32,128,1,4,5,1008.9683333333332,3
w13,16,128,6,4096,2048,32,32,128,1,8,4,1013.1176666666667,3
w13,16,128,6,4096,2048,32,32,128,1,8,5,1010.8136666666666,3
w13,16,128,6,4096,2048,32,32,128,4,4,3,1011.7953333333334,3
w13,16,128,6,4096,2048,32,32,128,4,4,4,1010.2486666666667,3
w13,16,128,6,4096,2048,32,32,128,4,4,5,1008.5103333333333,3
w13,16,128,6,4096,2048,32,32,128,4,8,4,1013.8213333333333,3
w13,16,128,6,4096,2048,32,32,128,4,8,5,1013.7366666666667,3
w13,16,128,6,4096,2048,32,32,128,16,4,3,1012.105,3
w13,16,128,6,4096,2048,32,32,128,16,4,4,1010.5043333333333,3
w13,16,128,6,4096,2048,32,32,128,16,4,5,1010.7503333333333,3
w13,16,128,6,4096,2048,32,32,128,16,8,4,1012.2646666666666,3
w13,16,128,6,4096,2048,32,32,128,16,8,5,1013.0006666666667,3
w13,16,128,6,4096,2048,32,32,128,64,4,3,1009.7156666666666,3
w13,16,128,6,4096,2048,32,32,128,64,4,4,1011.1126666666665,3
w13,16,128,6,4096,2048,32,32,256,1,4,3,1008.489,3
w13,16,128,6,4096,2048,32,32,256,1,4,4,1008.1363333333333,3
w13,16,128,6,4096,2048,32,32,256,1,8,4,1013.5873333333333,3
w13,16,128,6,4096,2048,32,32,256,4,4,3,1008.8829999999999,3
w13,16,128,6,4096,2048,32,32,256,4,4,4,1008.19,3
w13,16,128,6,4096,2048,32,32,256,4,8,4,1013.9076666666666,3
w13,16,128,6,4096,2048,32,32,256,16,4,3,1009.129,3
w13,16,128,6,4096,2048,32,32,256,16,4,4,1009.5336666666667,3
w13,16,128,6,4096,2048,32,32,256,16,8,3,1013.3316666666666,3
w13,16,128,6,4096,2048,32,32,256,32,4,3,1010.9953333333333,3
w13,16,128,6,4096,2048,32,32,256,32,4,4,1009.9396666666667,3
w13,16,128,6,4096,2048,32,64,128,1,4,3,1012.1793333333334,3
w13,16,128,6,4096,2048,32,64,128,1,4,4,1011.1443333333333,3
w13,16,128,6,4096,2048,32,64,128,1,4,5,1009.406,3
w13,16,128,6,4096,2048,32,64,128,1,8,3,1012.4780000000001,3
w13,16,128,6,4096,2048,32,64,128,1,8,5,1013.0753333333333,3
w13,16,128,6,4096,2048,32,64,128,4,4,3,1014.0456666666668,3
w13,16,128,6,4096,2048,32,64,128,4,4,5,1012.1153333333333,3
w13,16,128,6,4096,2048,32,64,128,4,8,5,1011.7316666666667,3
w13,16,128,6,4096,2048,32,64,128,16,4,3,1011.2193333333333,3
w13,16,128,6,4096,2048,32,64,128,16,4,4,1012.958,3
w13,16,128,6,4096,2048,32,64,128,16,4,5,1011.2616666666667,3
w13,16,128,6,4096,2048,32,64,128,16,8,3,1011.3366666666667,3
w13,16,128,6,4096,2048,32,64,128,16,8,5,1010.8566666666666,3
w13,16,128,6,4096,2048,32,64,128,32,4,3,1008.7873333333333,3
w13,16,128,6,4096,2048,32,64,128,32,4,4,1012.3286666666667,3
w13,16,128,6,4096,2048,32,64,128,32,4,5,1012.3389999999999,3
w13,16,128,6,4096,2048,32,64,128,32,8,3,1011.8376666666667,3
w13,16,128,6,4096,2048,32,64,128,32,8,4,1013.2566666666667,3
w13,16,128,6,4096,2048,32,64,128,32,8,5,1013.5976666666667,3
w13,16,128,6,4096,2048,32,64,128,64,4,3,1010.302,3
w13,16,128,6,4096,2048,32,64,128,64,4,4,1013.9823333333334,3
w13,16,128,6,4096,2048,32,64,128,64,4,5,1013.2133333333333,3
w13,16,128,6,4096,2048,32,64,128,64,8,3,1012.4566666666666,3
w13,16,128,6,4096,2048,32,64,128,64,8,4,1012.4673333333334,3
w13,16,128,6,4096,2048,32,64,256,1,4,3,1010.7926666666666,3
w13,16,128,6,4096,2048,32,64,256,1,4,5,1011.7736666666666,3
w13,16,128,6,4096,2048,32,64,256,1,8,3,1009.3206666666666,3
w13,16,128,6,4096,2048,32,64,256,1,8,4,1009.3736666666667,3
w13,16,128,6,4096,2048,32,64,256,1,8,5,1007.763,3
w13,16,128,6,4096,2048,32,64,256,8,4,3,1010.2383333333333,3
w13,16,128,6,4096,2048,32,64,256,8,4,5,1013.0223333333333,3
w13,16,128,6,4096,2048,32,64,256,8,8,3,1007.966,3
w13,16,128,6,4096,2048,32,64,256,8,8,4,1009.651,3
w13,16,128,6,4096,2048,32,64,256,8,8,5,1008.7023333333333,3
w13,16,128,6,4096,2048,32,64,256,16,4,3,1012.9046666666667,3
w13,16,128,6,4096,2048,32,64,256,16,4,5,1013.822,3
w13,16,128,6,4096,2048,32,64,256,16,8,3,1009.7366666666667,3
w13,16,128,6,4096,2048,32,64,256,16,8,4,1012.3820000000001,3
w13,16,128,6,4096,2048,32,64,256,16,8,5,1009.4693333333333,3
w13,16,128,6,4096,2048,32,64,256,32,4,3,1012.2643333333334,3
w13,16,128,6,4096,2048,32,64,256,32,8,3,1012.0086666666666,3
w13,16,128,6,4096,2048,32,64,256,32,8,4,1012.958,3
w13,16,128,6,4096,2048,32,64,256,32,8,5,1010.6433333333333,3
w13,16,128,6,4096,2048,32,64,256,64,4,3,1012.2006666666666,3
w13,16,128,6,4096,2048,32,64,256,64,8,3,1009.8536666666668,3
w13,16,128,6,4096,2048,32,64,256,64,8,5,1012.9256666666666,3
w13,16,128,6,4096,2048,32,128,128,1,4,2,1012.6700000000001,3
w13,16,128,6,4096,2048,32,128,128,1,4,3,1010.2916666666666,3
w13,16,128,6,4096,2048,32,128,128,1,4,4,1008.158,3
w13,16,128,6,4096,2048,32,128,128,1,4,5,1008.5846666666666,3
w13,16,128,6,4096,2048,32,128,128,1,8,5,1008.9900000000001,3
w13,16,128,6,4096,2048,32,128,128,4,4,4,1011.2086666666668,3
w13,16,128,6,4096,2048,32,128,128,4,4,5,1007.6673333333333,3
w13,16,128,6,4096,2048,32,128,128,4,8,5,1010.099,3
w13,16,128,6,4096,2048,32,128,128,8,4,3,1013.3523333333333,3
w13,16,128,6,4096,2048,32,128,128,8,4,4,1009.8650000000001,3
w13,16,128,6,4096,2048,32,128,128,8,4,5,1010.3663333333334,3
w13,16,128,6,4096,2048,32,128,128,8,8,5,1009.5023333333334,3
w13,16,128,6,4096,2048,32,128,128,16,4,3,1013.2033333333333,3
w13,16,128,6,4096,2048,32,128,128,16,4,4,1010.0353333333333,3
w13,16,128,6,4096,2048,32,128,128,16,4,5,1008.8726666666666,3
w13,16,128,6,4096,2048,32,128,128,16,8,5,1009.2886666666667,3
w13,16,128,6,4096,2048,32,128,128,32,4,2,1011.1233333333333,3
w13,16,128,6,4096,2048,32,128,128,32,4,3,1012.2966666666666,3
w13,16,128,6,4096,2048,32,128,128,32,4,4,1009.833,3
w13,16,128,6,4096,2048,32,128,128,32,4,5,1009.9816666666667,3
w13,16,128,6,4096,2048,32,128,128,32,8,5,1009.5556666666666,3
w13,16,128,6,4096,2048,32,128,128,64,4,2,1012.6270000000001,3
w13,16,128,6,4096,2048,32,128,128,64,4,3,1013.0006666666667,3
w13,16,128,6,4096,2048,32,128,128,64,4,4,1010.814,3
w13,16,128,6,4096,2048,32,128,128,64,4,5,1009.4703333333333,3
w13,16,128,6,4096,2048,32,128,128,64,8,5,1009.331,3
w13,16,128,6,4096,2048,64,64,64,1,4,5,1012.3179999999999,3
w13,16,128,6,4096,2048,64,64,64,4,4,5,1013.5873333333334,3
w13,16,128,6,4096,2048,64,64,64,16,4,5,1013.651,3
w13,16,128,6,4096,2048,64,64,128,1,4,3,1010.7073333333334,3
w13,16,128,6,4096,2048,64,64,128,1,8,3,1012.2433333333333,3
w13,16,128,6,4096,2048,64,64,128,1,8,5,1012.6163333333334,3
w13,16,128,6,4096,2048,64,64,128,4,4,3,1011.1446666666667,3
w13,16,128,6,4096,2048,64,64,128,4,8,3,1013.2456666666667,3
w13,16,128,6,4096,2048,64,64,128,4,8,5,1012.9583333333334,3
w13,16,128,6,4096,2048,64,64,128,8,4,3,1012.1363333333334,3
w13,16,128,6,4096,2048,64,64,128,8,8,5,1014.0243333333333,3
w13,16,128,6,4096,2048,64,64,128,16,4,3,1012.0616666666666,3
w13,16,128,6,4096,2048,64,64,128,16,8,5,1013.587,3
w13,16,128,6,4096,2048,64,64,128,32,4,3,1012.8086666666667,3
w13,16,128,6,4096,2048,64,64,128,32,8,3,1013.8216666666667,3
w13,16,128,6,4096,2048,64,64,128,64,4,3,1012.7766666666666,3
w13,16,128,6,4096,2048,64,64,128,64,8,3,1013.9823333333334,3
w13,16,128,6,4096,2048,64,128,128,1,4,4,1009.7796666666667,3
w13,16,128,6,4096,2048,64,128,128,1,8,4,1009.299,3
w13,16,128,6,4096,2048,64,128,128,4,4,4,1010.9206666666668,3
w13,16,128,6,4096,2048,64,128,128,4,8,4,1010.281,3
w13,16,128,6,4096,2048,64,128,128,16,4,4,1013.5123333333335,3
w13,16,128,6,4096,2048,64,128,128,16,8,4,1011.9340000000001,3
w13,16,128,6,4096,2048,64,128,128,32,4,4,1014.0353333333334,3
w13,16,128,6,4096,2048,64,128,128,32,8,4,1012.681,3
w13,16,128,6,4096,2048,64,128,128,64,4,4,1013.5129999999999,3
w13,16,128,6,4096,2048,64,128,128,64,8,4,1013.7686666666667,3
w13,16,128,8,2048,768,16,16,128,1,4,4,258.1583333333333,3
w13,16,128,8,2048,768,16,32,128,1,4,3,256.31333333333333,3
w13,16,128,8,2048,768,16,32,128,1,4,4,257.15566666666666,3
w13,16,128,8,2048,768,16,32,128,1,4,5,255.90766666666664,3
w13,16,128,8,2048,768,16,32,128,4,4,3,257.0593333333333,3
w13,16,128,8,2048,768,16,32,128,4,4,4,256.65433333333334,3
w13,16,128,8,2048,768,16,32,128,4,4,5,256.4303333333333,3
w13,16,128,8,2048,768,16,32,128,16,4,3,257.69966666666664,3
w13,16,128,8,2048,768,16,32,128,16,4,4,257.0813333333333,3
w13,16,128,8,2048,768,16,32,128,16,4,5,256.7183333333333,3
w13,16,128,8,2048,768,16,32,128,32,4,3,258.105,3
w13,16,128,8,2048,768,16,32,128,32,4,4,257.337,3
w13,16,128,8,2048,768,16,32,128,32,4,5,256.88899999999995,3
w13,16,128,8,2048,768,16,32,128,64,4,3,257.678,3
w13,16,128,8,2048,768,16,32,128,64,4,4,257.42266666666666,3
w13,16,128,8,2048,768,16,32,128,64,4,5,256.7716666666667,3
w13,16,128,8,2048,768,16,32,256,1,4,2,256.537,3
w13,16,128,8,2048,768,16,32,256,1,4,3,256.06733333333335,3
w13,16,128,8,2048,768,16,32,256,1,4,4,256.3343333333333,3
w13,16,128,8,2048,768,16,32,256,1,4,5,256.65433333333334,3
w13,16,128,8,2048,768,16,32,256,16,4,2,256.3453333333333,3
w13,16,128,8,2048,768,16,32,256,16,4,3,255.80100000000002,3
w13,16,128,8,2048,768,16,32,256,16,4,4,256.8573333333334,3
w13,16,128,8,2048,768,16,32,256,16,4,5,257.13433333333336,3
w13,16,128,8,2048,768,16,32,256,32,4,2,255.876,3
w13,16,128,8,2048,768,16,32,256,32,4,3,256.836,3
w13,16,128,8,2048,768,16,32,256,32,4,4,257.12333333333333,3
w13,16,128,8,2048,768,16,32,256,32,4,5,257.4866666666667,3
w13,16,128,8,2048,768,16,32,256,64,4,2,256.31333333333333,3
w13,16,128,8,2048,768,16,32,256,64,4,3,256.953,3
w13,16,128,8,2048,768,16,32,256,64,4,4,257.838,3
w13,16,128,8,2048,768,16,32,256,64,4,5,257.61466666666666,3
w13,16,128,8,2048,768,16,64,128,1,4,3,256.59066666666666,3
w13,16,128,8,2048,768,16,64,128,1,4,4,255.96133333333333,3
w13,16,128,8,2048,768,16,64,128,1,4,5,256.1423333333333,3
w13,16,128,8,2048,768,16,64,128,1,8,2,256.50533333333334,3
w13,16,128,8,2048,768,16,64,128,1,8,3,257.02833333333336,3
w13,16,128,8,2048,768,16,64,128,1,8,4,257.63533333333334,3
w13,16,128,8,2048,768,16,64,128,1,8,5,257.03833333333336,3
w13,16,128,8,2048,768,16,64,128,16,4,3,256.601,3
w13,16,128,8,2048,768,16,64,128,16,4,4,256.708,3
w13,16,128,8,2048,768,16,64,128,16,4,5,256.24899999999997,3
w13,16,128,8,2048,768,16,64,128,16,8,2,256.825,3
w13,16,128,8,2048,768,16,64,128,16,8,3,257.689,3
w13,16,128,8,2048,768,16,64,128,16,8,4,256.964,3
w13,16,128,8,2048,768,16,64,128,16,8,5,256.8036666666667,3
w13,16,128,8,2048,768,16,64,128,32,4,3,257.3053333333333,3
w13,16,128,8,2048,768,16,64,128,32,4,4,256.42,3
w13,16,128,8,2048,768,16,64,128,32,4,5,256.35566666666665,3
w13,16,128,8,2048,768,16,64,128,32,8,2,257.37966666666665,3
w13,16,128,8,2048,768,16,64,128,32,8,3,257.16633333333334,3
w13,16,128,8,2048,768,16,64,128,32,8,4,257.71066666666667,3
w13,16,128,8,2048,768,16,64,128,32,8,5,256.526,3
w13,16,128,8,2048,768,16,64,128,64,4,3,257.913,3
w13,16,128,8,2048,768,16,64,128,64,4,4,256.7183333333333,3
w13,16,128,8,2048,768,16,64,128,64,4,5,257.017,3
w13,16,128,8,2048,768,16,64,128,64,8,2,257.18766666666664,3
w13,16,128,8,2048,768,16,64,128,64,8,3,257.017,3
w13,16,128,8,2048,768,16,64,128,64,8,4,257.90233333333333,3
w13,16,128,8,2048,768,16,64,128,64,8,5,257.23066666666665,3
w13,16,128,8,2048,768,16,64,256,1,4,2,256.601,3
w13,16,128,8,2048,768,16,64,256,1,4,3,256.41966666666667,3
w13,16,128,8,2048,768,16,64,256,1,8,2,256.48333333333335,3
w13,16,128,8,2048,768,16,64,256,1,8,3,256.64366666666666,3
w13,16,128,8,2048,768,16,64,256,1,8,5,258.26533333333333,3
w13,16,128,8,2048,768,16,64,256,16,4,2,257.09133333333335,3
w13,16,128,8,2048,768,16,64,256,16,4,3,256.964,3
w13,16,128,8,2048,768,16,64,256,16,8,2,256.964,3
w13,16,128,8,2048,768,16,64,256,16,8,3,256.75033333333334,3
w13,16,128,8,2048,768,16,64,256,32,4,2,256.43066666666664,3
w13,16,128,8,2048,768,16,64,256,32,4,3,256.84666666666664,3
w13,16,128,8,2048,768,16,64,256,32,8,2,257.4116666666667,3
w13,16,128,8,2048,768,16,64,256,32,8,3,256.88899999999995,3
w13,16,128,8,2048,768,16,64,256,64,4,2,257.03866666666664,3
w13,16,128,8,2048,768,16,64,256,64,4,3,257.58233333333334,3
w13,16,128,8,2048,768,16,64,256,64,8,2,256.964,3
w13,16,128,8,2048,768,16,64,256,64,8,3,257.412,3
w13,16,128,8,2048,768,16,128,128,1,4,2,256.41966666666667,3
w13,16,128,8,2048,768,16,128,128,1,4,3,257.43333333333334,3
w13,16,128,8,2048,768,16,128,128,1,8,2,256.0466666666667,3
w13,16,128,8,2048,768,16,128,128,1,8,3,257.2733333333333,3
w13,16,128,8,2048,768,16,128,128,1,8,4,257.252,3
w13,16,128,8,2048,768,16,128,128,1,8,5,257.0493333333333,3
w13,16,128,8,2048,768,16,128,128,16,4,2,257.07033333333334,3
w13,16,128,8,2048,768,16,128,128,16,4,3,258.201,3
w13,16,128,8,2048,768,16,128,128,16,4,4,258.04133333333334,3
w13,16,128,8,2048,768,16,128,128,16,8,2,256.21733333333333,3
w13,16,128,8,2048,768,16,128,128,16,8,3,258.29699999999997,3
w13,16,128,8,2048,768,16,128,128,16,8,4,256.99566666666664,3
w13,16,128,8,2048,768,16,128,128,32,4,2,256.8996666666667,3
w13,16,128,8,2048,768,16,128,128,32,4,4,258.20133333333337,3
w13,16,128,8,2048,768,16,128,128,32,8,2,257.00666666666666,3
w13,16,128,8,2048,768,16,128,128,32,8,3,258.041,3
w13,16,128,8,2048,768,16,128,128,32,8,4,257.3156666666667,3
w13,16,128,8,2048,768,16,128,128,32,8,5,257.7426666666667,3
w13,16,128,8,2048,768,16,128,128,64,4,2,256.7823333333333,3
w13,16,128,8,2048,768,16,128,128,64,4,3,258.2863333333333,3
w13,16,128,8,2048,768,16,128,128,64,8,2,256.409,3
w13,16,128,8,2048,768,16,128,128,64,8,3,257.76366666666667,3
w13,16,128,8,2048,768,16,128,128,64,8,4,258.21166666666664,3
w13,16,128,8,2048,768,32,32,128,1,4,2,257.7423333333333,3
w13,16,128,8,2048,768,32,32,128,1,4,3,257.32666666666665,3
w13,16,128,8,2048,768,32,32,128,4,4,2,257.508,3
w13,16,128,8,2048,768,32,32,128,4,4,3,256.9103333333333,3
w13,16,128,8,2048,768,32,32,128,16,4,2,257.561,3
w13,16,128,8,2048,768,32,32,128,16,4,3,257.348,3
w13,16,128,8,2048,768,32,32,128,16,4,5,258.29699999999997,3
w13,16,128,8,2048,768,32,32,128,64,4,2,257.21999999999997,3
w13,16,128,8,2048,768,32,32,128,64,4,3,257.76366666666667,3
w13,16,128,8,2048,768,32,64,128,1,4,2,257.8813333333333,3
w13,16,128,8,2048,768,32,64,128,4,4,2,258.03066666666666,3
w13,16,128,8,2048,768,32,64,128,4,4,3,257.945,3
w13,16,128,8,2048,768,32,64,128,16,4,2,258.16900000000004,3
w13,16,128,8,2048,768,32,64,128,16,4,3,257.91333333333336,3
w13,16,128,8,2048,768,32,64,128,32,4,3,257.76366666666667,3
w13,16,128,8,2048,768,32,64,128,64,4,2,258.25433333333336,3
w13,16,128,8,2048,768,32,128,128,1,4,2,256.9103333333333,3
w13,16,128,8,2048,768,32,128,128,1,4,3,257.8063333333334,3
w13,16,128,8,2048,768,32,128,128,1,8,3,258.25466666666665,3
w13,16,128,8,2048,768,32,128,128,4,4,2,257.753,3
w13,16,128,8,2048,768,32,128,128,4,4,3,257.03833333333336,3
w13,16,128,8,2048,768,32,128,128,4,8,3,256.729,3
w13,16,128,8,2048,768,32,128,128,8,4,2,257.1666666666667,3
w13,16,128,8,2048,768,32,128,128,8,4,3,257.241,3
w13,16,128,8,2048,768,32,128,128,8,8,3,258.084,3
w13,16,128,8,2048,768,32,128,128,16,4,2,257.593,3
w13,16,128,8,2048,768,32,128,128,16,4,3,257.625,3
w13,16,128,8,2048,768,32,128,128,16,8,3,257.4653333333333,3
w13,16,128,8,2048,768,32,128,128,32,4,2,257.4546666666667,3
w13,16,128,8,2048,768,32,128,128,32,4,3,257.4116666666667,3
w13,16,128,8,2048,768,32,128,128,32,8,3,256.72933333333333,3
w13,16,128,8,2048,768,32,128,128,64,4,3,257.4646666666667,3
w13,16,128,8,2048,768,32,128,128,64,8,3,257.561,3
w13,16,128,8,2048,768,64,64,64,1,4,3,257.77433333333335,3
w13,16,128,8,2048,768,64,64,64,4,4,3,257.561,3
w13,16,128,8,2048,768,64,64,64,16,4,3,258.10533333333336,3
w13,16,128,8,2048,768,64,64,64,32,4,3,257.92366666666663,3
w13,16,128,8,2048,768,64,64,64,64,4,3,258.20133333333337,3
w13,16,128,8,4096,1536,16,16,128,1,4,3,1012.3496666666666,3
w13,16,128,8,4096,1536,16,16,128,1,4,4,1010.9096666666666,3
w13,16,128,8,4096,1536,16,16,128,1,4,5,1010.6959999999999,3
w13,16,128,8,4096,1536,16,16,128,4,4,4,1013.096,3
w13,16,128,8,4096,1536,16,16,128,4,4,5,1010.515,3
w13,16,128,8,4096,1536,16,16,256,1,4,3,1009.032,3
w13,16,128,8,4096,1536,16,16,256,1,4,4,1012.2003333333333,3
w13,16,128,8,4096,1536,16,16,256,1,4,5,1011.7733333333334,3
w13,16,128,8,4096,1536,16,16,256,4,4,3,1010.1306666666666,3
w13,16,128,8,4096,1536,16,16,256,4,4,4,1009.768,3
w13,16,128,8,4096,1536,16,16,256,4,4,5,1007.3470000000001,3
w13,16,128,8,4096,1536,16,32,128,1,4,3,1012.1576666666666,3
w13,16,128,8,4096,1536,16,32,128,1,4,4,1009.5973333333333,3
w13,16,128,8,4096,1536,16,32,128,1,4,5,1006.259,3
w13,16,128,8,4096,1536,16,32,128,1,8,3,1013.1816666666667,3
w13,16,128,8,4096,1536,16,32,128,4,4,5,1006.9946666666666,3
w13,16,128,8,4096,1536,16,32,128,16,4,4,1013.2133333333333,3
w13,16,128,8,4096,1536,16,32,128,16,4,5,1007.7203333333333,3
w13,16,128,8,4096,1536,16,32,128,32,4,4,1011.9976666666666,3
w13,16,128,8,4096,1536,16,32,128,32,4,5,1008.819,3
w13,16,128,8,4096,1536,16,32,128,64,4,5,1010.4293333333334,3
w13,16,128,8,4096,1536,16,32,256,1,4,2,1007.8373333333333,3
w13,16,128,8,4096,1536,16,32,256,1,4,3,1006.355,3
w13,16,128,8,4096,1536,16,32,256,1,4,4,1005.9816666666666,3
w13,16,128,8,4096,1536,16,32,256,1,4,5,1003.1123333333334,3
w13,16,128,8,4096,1536,16,32,256,1,8,3,1011.9763333333334,3
w13,16,128,8,4096,1536,16,32,256,1,8,4,1012.9363333333334,3
w13,16,128,8,4096,1536,16,32,256,1,8,5,1008.2856666666667,3
w13,16,128,8,4096,1536,16,32,256,16,4,2,1011.592,3
w13,16,128,8,4096,1536,16,32,256,16,4,3,1007.752,3
w13,16,128,8,4096,1536,16,32,256,16,4,4,1008.4666666666667,3
w13,16,128,8,4096,1536,16,32,256,16,4,5,1005.7256666666667,3
w13,16,128,8,4096,1536,16,32,256,16,8,5,1010.8026666666666,3
w13,16,128,8,4096,1536,16,32,256,32,4,2,1010.3763333333333,3
w13,16,128,8,4096,1536,16,32,256,32,4,3,1008.6056666666667,3
w13,16,128,8,4096,1536,16,32,256,32,4,4,1008.9573333333333,3
w13,16,128,8,4096,1536,16,32,256,32,4,5,1006.0773333333333,3
w13,16,128,8,4096,1536,16,32,256,32,8,5,1011.4216666666667,3
w13,16,128,8,4096,1536,16,32,256,64,4,3,1009.971,3
w13,16,128,8,4096,1536,16,32,256,64,4,4,1012.2213333333334,3
w13,16,128,8,4096,1536,16,32,256,64,4,5,1008.3603333333334,3
w13,16,128,8,4096,1536,16,64,128,1,4,4,1007.5813333333332,3
w13,16,128,8,4096,1536,16,64,128,1,4,5,1005.224,3
w13,16,128,8,4096,1536,16,64,128,1,8,3,1008.5946666666665,3
w13,16,128,8,4096,1536,16,64,128,1,8,4,1010.0453333333334,3
w13,16,128,8,4096,1536,16,64,128,1,8,5,1006.9736666666666,3
w13,16,128,8,4096,1536,16,64,128,16,4,4,1012.2853333333333,3
w13,16,128,8,4096,1536,16,64,128,16,4,5,1007.9763333333334,3
w13,16,128,8,4096,1536,16,64,128,16,8,3,1012.2856666666667,3
w13,16,128,8,4096,1536,16,64,128,16,8,4,1011.3573333333334,3
w13,16,128,8,4096,1536,16,64,128,16,8,5,1010.0986666666668,3
w13,16,128,8,4096,1536,16,64,128,32,4,4,1009.8963333333335,3
w13,16,128,8,4096,1536,16,64,128,32,4,5,1007.3256666666666,3
w13,16,128,8,4096,1536,16,64,128,32,8,3,1013.1066666666667,3
w13,16,128,8,4096,1536,16,64,128,32,8,4,1011.5276666666667,3
w13,16,128,8,4096,1536,16,64,128,32,8,5,1008.7553333333334,3
w13,16,128,8,4096,1536,16,64,128,64,4,5,1008.7866666666667,3
w13,16,128,8,4096,1536,16,64,128,64,8,3,1012.2963333333333,3
w13,16,128,8,4096,1536,16,64,128,64,8,5,1010.6106666666666,3
w13,16,128,8,4096,1536,16,64,256,1,4,2,1010.0243333333333,3
w13,16,128,8,4096,1536,16,64,256,1,4,3,1005.2346666666667,3
w13,16,128,8,4096,1536,16,64,256,1,4,4,1005.7573333333333,3
w13,16,128,8,4096,1536,16,64,256,1,4,5,1004.8190000000001,3
w13,16,128,8,4096,1536,16,64,256,1,8,2,1012.4883333333333,3
w13,16,128,8,4096,1536,16,64,256,1,8,3,1007.773,3
w13,16,128,8,4096,1536,16,64,256,1,8,4,1005.832,3
w13,16,128,8,4096,1536,16,64,256,1,8,5,1005.4163333333332,3
w13,16,128,8,4096,1536,16,64,256,16,4,2,1013.1606666666667,3
w13,16,128,8,4096,1536,16,64,256,16,4,3,1007.4963333333334,3
w13,16,128,8,4096,1536,16,64,256,16,4,4,1006.8346666666666,3
w13,16,128,8,4096,1536,16,64,256,16,4,5,1005.2773333333333,3
w13,16,128,8,4096,1536,16,64,256,16,8,3,1009.8533333333334,3
w13,16,128,8,4096,1536,16,64,256,16,8,4,1010.6210000000001,3
w13,16,128,8,4096,1536,16,64,256,16,8,5,1006.4186666666666,3
w13,16,128,8,4096,1536,16,64,256,32,4,3,1007.5496666666667,3
w13,16,128,8,4096,1536,16,64,256,32,4,4,1008.5946666666667,3
w13,16,128,8,4096,1536,16,64,256,32,4,5,1006.5893333333333,3
w13,16,128,8,4096,1536,16,64,256,32,8,3,1011.4110000000001,3
w13,16,128,8,4096,1536,16,64,256,32,8,4,1008.8936666666667,3
w13,16,128,8,4096,1536,16,64,256,32,8,5,1008.04,3
w13,16,128,8,4096,1536,16,64,256,64,4,2,1013.0643333333334,3
w13,16,128,8,4096,1536,16,64,256,64,4,3,1010.5253333333334,3
w13,16,128,8,4096,1536,16,64,256,64,4,4,1012.5203333333334,3
w13,16,128,8,4096,1536,16,64,256,64,4,5,1008.6583333333333,3
w13,16,128,8,4096,1536,16,64,256,64,8,3,1011.6453333333334,3
w13,16,128,8,4096,1536,16,64,256,64,8,5,1011.4639999999999,3
w13,16,128,8,4096,1536,16,128,128,1,4,4,1008.797,3
w13,16,128,8,4096,1536,16,128,128,1,4,5,1008.36,3
w13,16,128,8,4096,1536,16,128,128,1,8,4,1009.1173333333332,3
w13,16,128,8,4096,1536,16,128,128,1,8,5,1006.5683333333333,3
w13,16,128,8,4096,1536,16,128,128,16,4,5,1008.5516666666666,3
w13,16,128,8,4096,1536,16,128,128,16,8,5,1008.2536666666666,3
w13,16,128,8,4096,1536,16,128,128,32,4,5,1009.352,3
w13,16,128,8,4096,1536,16,128,128,32,8,5,1009.0106666666667,3
w13,16,128,8,4096,1536,16,128,128,64,4,4,1010.4193333333333,3
w13,16,128,8,4096,1536,16,128,128,64,4,5,1009.395,3
w13,16,128,8,4096,1536,16,128,128,64,8,4,1011.7093333333333,3
w13,16,128,8,4096,1536,16,128,128,64,8,5,1010.3756666666667,3
w13,16,128,8,4096,1536,32,32,128,1,4,2,1011.8696666666666,3
w13,16,128,8,4096,1536,32,32,128,1,4,3,1010.7603333333333,3
w13,16,128,8,4096,1536,32,32,128,1,4,4,1008.7016666666667,3
w13,16,128,8,4096,1536,32,32,128,1,4,5,1008.4883333333333,3
w13,16,128,8,4096,1536,32,32,128,1,8,4,1010.1203333333333,3
w13,16,128,8,4096,1536,32,32,128,1,8,5,1011.1013333333334,3
w13,16,128,8,4096,1536,32,32,128,4,4,4,1009.2666666666668,3
w13,16,128,8,4096,1536,32,32,128,4,4,5,1010.0133333333333,3
w13,16,128,8,4096,1536,32,32,128,4,8,4,1012.8833333333333,3
w13,16,128,8,4096,1536,32,32,128,4,8,5,1011.4320000000001,3
w13,16,128,8,4096,1536,32,32,128,16,4,3,1011.4430000000001,3
w13,16,128,8,4096,1536,32,32,128,16,4,4,1013.0426666666666,3
w13,16,128,8,4096,1536,32,32,128,16,4,5,1009.4163333333332,3
w13,16,128,8,4096,1536,32,32,128,64,4,4,1012.5306666666667,3
w13,16,128,8,4096,1536,32,32,256,1,4,3,1008.7016666666667,3
w13,16,128,8,4096,1536,32,32,256,1,4,4,1010.2906666666667,3
w13,16,128,8,4096,1536,32,32,256,4,4,3,1008.0293333333333,3
w13,16,128,8,4096,1536,32,32,256,4,4,4,1008.072,3
w13,16,128,8,4096,1536,32,32,256,4,8,4,1012.936,3
w13,16,128,8,4096,1536,32,32,256,16,4,3,1011.7199999999999,3
w13,16,128,8,4096,1536,32,32,256,16,4,4,1009.3733333333333,3
w13,16,128,8,4096,1536,32,32,256,32,4,3,1012.531,3
w13,16,128,8,4096,1536,32,32,256,32,4,4,1010.6640000000001,3
w13,16,128,8,4096,1536,32,64,128,1,4,3,1011.944,3
w13,16,128,8,4096,1536,32,64,128,1,4,4,1012.6266666666667,3
w13,16,128,8,4096,1536,32,64,128,1,4,5,1011.1013333333334,3
w13,16,128,8,4096,1536,32,64,128,1,8,3,1012.8293333333332,3
w13,16,128,8,4096,1536,32,64,128,1,8,5,1012.243,3
w13,16,128,8,4096,1536,32,64,128,4,4,5,1012.723,3
w13,16,128,8,4096,1536,32,64,128,4,8,5,1012.5306666666667,3
w13,16,128,8,4096,1536,32,64,128,32,4,5,1013.1703333333334,3
w13,16,128,8,4096,1536,32,64,256,1,4,3,1011.4003333333334,3
w13,16,128,8,4096,1536,32,64,256,1,4,5,1011.976,3
w13,16,128,8,4096,1536,32,64,256,1,8,3,1009.331,3
w13,16,128,8,4096,1536,32,64,256,1,8,4,1009.3629999999999,3
w13,16,128,8,4096,1536,32,64,256,1,8,5,1007.8159999999999,3
w13,16,128,8,4096,1536,32,64,256,8,8,3,1009.5973333333333,3
w13,16,128,8,4096,1536,32,64,256,8,8,4,1010.7176666666668,3
w13,16,128,8,4096,1536,32,64,256,8,8,5,1009.6293333333333,3
w13,16,128,8,4096,1536,32,64,256,16,8,3,1011.4643333333333,3
w13,16,128,8,4096,1536,32,64,256,16,8,4,1011.8056666666666,3
w13,16,128,8,4096,1536,32,64,256,16,8,5,1009.3096666666667,3
w13,16,128,8,4096,1536,32,64,256,32,8,3,1011.4639999999999,3
w13,16,128,8,4096,1536,32,64,256,32,8,4,1013.2243333333332,3
w13,16,128,8,4096,1536,32,64,256,32,8,5,1011.784,3
w13,16,128,8,4096,1536,32,128,128,1,4,3,1010.9520000000001,3
w13,16,128,8,4096,1536,32,128,128,1,4,4,1008.627,3
w13,16,128,8,4096,1536,32,128,128,1,4,5,1008.68,3
w13,16,128,8,4096,1536,32,128,128,1,8,5,1009.928,3
w13,16,128,8,4096,1536,32,128,128,4,4,4,1009.0323333333334,3
w13,16,128,8,4096,1536,32,128,128,4,4,5,1009.4906666666666,3
w13,16,128,8,4096,1536,32,128,128,4,8,5,1010.174,3
w13,16,128,8,4096,1536,32,128,128,8,4,4,1009.5866666666667,3
w13,16,128,8,4096,1536,32,128,128,8,4,5,1009.203,3
w13,16,128,8,4096,1536,32,128,128,8,8,5,1010.0986666666666,3
w13,16,128,8,4096,1536,32,128,128,16,4,3,1012.8403333333334,3
w13,16,128,8,4096,1536,32,128,128,16,4,4,1010.0136666666667,3
w13,16,128,8,4096,1536,32,128,128,16,4,5,1009.619,3
w13,16,128,8,4096,1536,32,128,128,16,8,5,1009.5866666666667,3
w13,16,128,8,4096,1536,32,128,128,32,4,3,1012.4346666666667,3
w13,16,128,8,4096,1536,32,128,128,32,4,4,1009.8536666666668,3
w13,16,128,8,4096,1536,32,128,128,32,4,5,1010.5790000000001,3
w13,16,128,8,4096,1536,32,128,128,32,8,5,1009.875,3
w13,16,128,8,4096,1536,32,128,128,64,4,3,1013.1603333333333,3
w13,16,128,8,4096,1536,32,128,128,64,4,4,1011.1439999999999,3
w13,16,128,8,4096,1536,32,128,128,64,4,5,1010.1096666666666,3
w13,16,128,8,4096,1536,32,128,128,64,8,5,1011.3040000000001,3
w13,16,128,8,4096,1536,64,64,64,1,4,5,1012.5843333333332,3
w13,16,128,8,4096,1536,64,64,128,1,4,3,1010.5463333333333,3
w13,16,128,8,4096,1536,64,64,128,1,8,3,1011.1756666666666,3
w13,16,128,8,4096,1536,64,64,128,1,8,5,1011.379,3
w13,16,128,8,4096,1536,64,64,128,4,4,3,1011.1976666666666,3
w13,16,128,8,4096,1536,64,64,128,4,4,5,1012.915,3
w13,16,128,8,4096,1536,64,64,128,4,8,5,1011.7626666666666,3
w13,16,128,8,4096,1536,64,64,128,8,4,3,1012.2216666666667,3
w13,16,128,8,4096,1536,64,64,128,16,4,3,1012.8613333333333,3
w13,16,128,8,4096,1536,64,128,128,1,4,4,1009.3413333333333,3
w13,16,128,8,4096,1536,64,128,128,1,8,4,1007.5816666666666,3
w13,16,128,8,4096,1536,64,128,128,4,4,4,1010.248,3
w13,16,128,8,4096,1536,64,128,128,4,8,4,1008.531,3
w13,16,128,8,4096,1536,64,128,128,16,4,4,1012.8826666666668,3
w13,16,128,8,4096,1536,64,128,128,16,8,4,1010.6856666666666,3
w13,16,128,8,4096,1536,64,128,128,32,4,4,1012.0936666666666,3
w13,16,128,8,4096,1536,64,128,128,32,8,4,1010.9526666666667,3
w13,16,128,8,4096,1536,64,128,128,64,8,4,1011.5816666666666,3
w13,16,128,8,4096,3072,16,16,128,1,4,3,2013.2,3
w13,16,128,8,4096,3072,16,16,128,1,4,4,2012.0596666666668,3
w13,16,128,8,4096,3072,16,16,128,1,4,5,2006.7786666666668,3
w13,16,128,8,4096,3072,16,16,128,4,4,3,2013.8400000000001,3
w13,16,128,8,4096,3072,16,16,128,4,4,4,2013.211,3
w13,16,128,8,4096,3072,16,16,128,4,4,5,2005.4666666666665,3
w13,16,128,8,4096,3072,16,16,256,1,4,3,2005.6696666666667,3
w13,16,128,8,4096,3072,16,16,256,1,4,4,2003.9093333333333,3
w13,16,128,8,4096,3072,16,16,256,1,4,5,2000.7843333333333,3
w13,16,128,8,4096,3072,16,16,256,4,4,3,2004.539,3
w13,16,128,8,4096,3072,16,16,256,4,4,4,2002.6193333333333,3
w13,16,128,8,4096,3072,16,16,256,4,4,5,2002.4586666666667,3
w13,16,128,8,4096,3072,16,32,128,1,4,2,2015.6426666666666,3
w13,16,128,8,4096,3072,16,32,128,1,4,4,2011.9316666666666,3
w13,16,128,8,4096,3072,16,32,128,1,4,5,2007.5686666666668,3
w13,16,128,8,4096,3072,16,32,128,1,8,3,2011.9203333333335,3
w13,16,128,8,4096,3072,16,32,128,1,8,4,2015.3873333333333,3
w13,16,128,8,4096,3072,16,32,128,1,8,5,2014.7150000000001,3
w13,16,128,8,4096,3072,16,32,128,4,4,2,2018.918,3
w13,16,128,8,4096,3072,16,32,128,4,4,4,2015.0886666666668,3
w13,16,128,8,4096,3072,16,32,128,4,4,5,2007.7386666666669,3
w13,16,128,8,4096,3072,16,32,128,4,8,3,2012.3156666666666,3
w13,16,128,8,4096,3072,16,32,128,4,8,4,2017.2746666666665,3
w13,16,128,8,4096,3072,16,32,128,4,8,5,2012.401,3
w13,16,128,8,4096,3072,16,32,128,16,4,4,2017.2116666666668,3
w13,16,128,8,4096,3072,16,32,128,16,4,5,2010.1493333333335,3
w13,16,128,8,4096,3072,16,32,128,16,8,3,2016.3476666666666,3
w13,16,128,8,4096,3072,16,32,128,16,8,4,2018.3203333333333,3
w13,16,128,8,4096,3072,16,32,128,16,8,5,2017.4353333333336,3
w13,16,128,8,4096,3072,16,32,128,32,4,4,2017.4560000000001,3
w13,16,128,8,4096,3072,16,32,128,32,4,5,2012.9766666666667,3
w13,16,128,8,4096,3072,16,32,128,32,8,3,2019.1953333333333,3
w13,16,128,8,4096,3072,16,32,128,32,8,5,2018.3846666666668,3
w13,16,128,8,4096,3072,16,32,128,64,4,5,2013.691,3
w13,16,128,8,4096,3072,16,32,128,64,8,5,2016.859333333333,3
w13,16,128,8,4096,3072,16,32,256,1,4,2,2008.2513333333334,3
w13,16,128,8,4096,3072,16,32,256,1,4,3,2006.1706666666669,3
w13,16,128,8,4096,3072,16,32,256,1,4,4,2005.2863333333335,3
w13,16,128,8,4096,3072,16,32,256,1,4,5,1999.718,3
w13,16,128,8,4096,3072,16,32,256,1,8,3,2011.7813333333334,3
w13,16,128,8,4096,3072,16,32,256,1,8,4,2010.0113333333331,3
w13,16,128,8,4096,3072,16,32,256,1,8,5,2004.6773333333333,3
w13,16,128,8,4096,3072,16,32,256,16,4,2,2012.7956666666666,3
w13,16,128,8,4096,3072,16,32,256,16,4,3,2008.7206666666668,3
w13,16,128,8,4096,3072,16,32,256,16,4,4,2006.5126666666667,3
w13,16,128,8,4096,3072,16,32,256,16,4,5,2001.8086666666666,3
w13,16,128,8,4096,3072,16,32,256,16,8,3,2014.193,3
w13,16,128,8,4096,3072,16,32,256,16,8,4,2011.9313333333332,3
w13,16,128,8,4096,3072,16,32,256,16,8,5,2006.5126666666667,3
w13,16,128,8,4096,3072,16,32,256,32,4,2,2013.009,3
w13,16,128,8,4096,3072,16,32,256,32,4,3,2012.593,3
w13,16,128,8,4096,3072,16,32,256,32,4,4,2009.4566666666667,3
w13,16,128,8,4096,3072,16,32,256,32,4,5,2003.7286666666666,3
w13,16,128,8,4096,3072,16,32,256,32,8,3,2017.6276666666665,3
w13,16,128,8,4096,3072,16,32,256,32,8,4,2013.5956666666668,3
w13,16,128,8,4096,3072,16,32,256,32,8,5,2009.3500000000001,3
w13,16,128,8,4096,3072,16,32,256,64,4,3,2014.5019999999997,3
w13,16,128,8,4096,3072,16,32,256,64,4,4,2014.7156666666667,3
w13,16,128,8,4096,3072,16,32,256,64,4,5,2007.579,3
w13,16,128,8,4096,3072,16,32,256,64,8,3,2018.2356666666667,3
w13,16,128,8,4096,3072,16,32,256,64,8,5,2014.5983333333334,3
w13,16,128,8,4096,3072,16,64,128,1,4,4,2007.7926666666665,3
w13,16,128,8,4096,3072,16,64,128,1,4,5,2002.6193333333333,3
w13,16,128,8,4096,3072,16,64,128,1,8,2,2017.5316666666668,3
w13,16,128,8,4096,3072,16,64,128,1,8,3,2014.1396666666667,3
w13,16,128,8,4096,3072,16,64,128,1,8,4,2010.3100000000002,3
w13,16,128,8,4096,3072,16,64,128,1,8,5,2004.923,3
w13,16,128,8,4096,3072,16,64,128,16,4,3,2019.003,3
w13,16,128,8,4096,3072,16,64,128,16,4,4,2012.2726666666667,3
w13,16,128,8,4096,3072,16,64,128,16,4,5,2006.9713333333336,3
w13,16,128,8,4096,3072,16,64,128,16,8,2,2019.238,3
w13,16,128,8,4096,3072,16,64,128,16,8,3,2016.2086666666667,3
w13,16,128,8,4096,3072,16,64,128,16,8,4,2011.5263333333332,3
w13,16,128,8,4096,3072,16,64,128,16,8,5,2007.3873333333333,3
w13,16,128,8,4096,3072,16,64,128,32,4,4,2011.9636666666665,3
w13,16,128,8,4096,3072,16,64,128,32,4,5,2008.0810000000001,3
w13,16,128,8,4096,3072,16,64,128,32,8,3,2017.9903333333332,3
w13,16,128,8,4096,3072,16,64,128,32,8,4,2013.9793333333334,3
w13,16,128,8,4096,3072,16,64,128,32,8,5,2008.8163333333334,3
w13,16,128,8,4096,3072,16,64,128,64,4,4,2018.4596666666666,3
w13,16,128,8,4096,3072,16,64,128,64,4,5,2009.4246666666668,3
w13,16,128,8,4096,3072,16,64,128,64,8,4,2019.6326666666666,3
w13,16,128,8,4096,3072,16,64,128,64,8,5,2010.929,3
w13,16,128,8,4096,3072,16,64,256,1,4,2,2012.6356666666668,3
w13,16,128,8,4096,3072,16,64,256,1,4,3,2002.2676666666666,3
w13,16,128,8,4096,3072,16,64,256,1,4,4,2000.2086666666667,3
w13,16,128,8,4096,3072,16,64,256,1,4,5,2000.4436666666668,3
w13,16,128,8,4096,3072,16,64,256,1,8,2,2009.6490000000001,3
w13,16,128,8,4096,3072,16,64,256,1,8,3,2004.6670000000001,3
w13,16,128,8,4096,3072,16,64,256,1,8,4,2001.7873333333334,3
w13,16,128,8,4096,3072,16,64,256,1,8,5,2000.742,3
w13,16,128,8,4096,3072,16,64,256,16,4,2,2013.9156666666668,3
w13,16,128,8,4096,3072,16,64,256,16,4,3,2006.6623333333334,3
w13,16,128,8,4096,3072,16,64,256,16,4,4,2003.5900000000001,3
w13,16,128,8,4096,3072,16,64,256,16,4,5,2001.5846666666666,3
w13,16,128,8,4096,3072,16,64,256,16,8,2,2010.9396666666664,3
w13,16,128,8,4096,3072,16,64,256,16,8,3,2007.7286666666666,3
w13,16,128,8,4096,3072,16,64,256,16,8,4,2004.8486666666668,3
w13,16,128,8,4096,3072,16,64,256,16,8,5,2001.8943333333334,3
w13,16,128,8,4096,3072,16,64,256,32,4,2,2016.87,3
w13,16,128,8,4096,3072,16,64,256,32,4,3,2008.454,3
w13,16,128,8,4096,3072,16,64,256,32,4,4,2006.4063333333334,3
w13,16,128,8,4096,3072,16,64,256,32,4,5,2003.8033333333333,3
w13,16,128,8,4096,3072,16,64,256,32,8,2,2012.4756666666665,3
w13,16,128,8,4096,3072,16,64,256,32,8,3,2009.1793333333335,3
w13,16,128,8,4096,3072,16,64,256,32,8,4,2007.6216666666667,3
w13,16,128,8,4096,3072,16,64,256,32,8,5,2004.7633333333333,3
w13,16,128,8,4096,3072,16,64,256,64,4,3,2009.7766666666666,3
w13,16,128,8,4096,3072,16,64,256,64,4,4,2014.6303333333333,3
w13,16,128,8,4096,3072,16,64,256,64,4,5,2007.6436666666668,3
w13,16,128,8,4096,3072,16,64,256,64,8,3,2011.5473333333332,3
w13,16,128,8,4096,3072,16,64,256,64,8,4,2016.934,3
w13,16,128,8,4096,3072,16,64,256,64,8,5,2009.8086666666668,3
w13,16,128,8,4096,3072,16,128,128,1,4,4,2011.9526666666668,3
w13,16,128,8,4096,3072,16,128,128,1,4,5,2004.1126666666667,3
w13,16,128,8,4096,3072,16,128,128,1,8,2,2015.9846666666665,3
w13,16,128,8,4096,3072,16,128,128,1,8,4,2011.0353333333333,3
w13,16,128,8,4096,3072,16,128,128,1,8,5,2002.662,3
w13,16,128,8,4096,3072,16,128,128,16,4,4,2014.6726666666666,3
w13,16,128,8,4096,3072,16,128,128,16,4,5,2004.9126666666664,3
w13,16,128,8,4096,3072,16,128,128,16,8,4,2013.8946666666668,3
w13,16,128,8,4096,3072,16,128,128,16,8,5,2010.683,3
w13,16,128,8,4096,3072,16,128,128,32,4,4,2014.4166666666667,3
w13,16,128,8,4096,3072,16,128,128,32,4,5,2005.9153333333334,3
w13,16,128,8,4096,3072,16,128,128,32,8,4,2014.2673333333332,3
w13,16,128,8,4096,3072,16,128,128,32,8,5,2003.9953333333333,3
w13,16,128,8,4096,3072,16,128,128,64,4,4,2014.47,3
w13,16,128,8,4096,3072,16,128,128,64,4,5,2008.5606666666665,3
w13,16,128,8,4096,3072,16,128,128,64,8,4,2016.0383333333332,3
w13,16,128,8,4096,3072,16,128,128,64,8,5,2006.5339999999999,3
w13,16,128,8,4096,3072,32,32,128,1,4,3,2012.0276666666666,3
w13,16,128,8,4096,3072,32,32,128,1,4,4,2008.198,3
w13,16,128,8,4096,3072,32,32,128,1,4,5,2005.7133333333334,3
w13,16,128,8,4096,3072,32,32,128,1,8,3,2016.2300000000002,3
w13,16,128,8,4096,3072,32,32,128,1,8,4,2009.798,3
w13,16,128,8,4096,3072,32,32,128,1,8,5,2010.9613333333334,3
w13,16,128,8,4096,3072,32,32,128,4,4,3,2014.1606666666667,3
w13,16,128,8,4096,3072,32,32,128,4,4,4,2007.9313333333332,3
w13,16,128,8,4096,3072,32,32,128,4,4,5,2006.0966666666666,3
w13,16,128,8,4096,3072,32,32,128,4,8,3,2013.6276666666665,3
w13,16,128,8,4096,3072,32,32,128,4,8,4,2011.2913333333333,3
w13,16,128,8,4096,3072,32,32,128,4,8,5,2012.1766666666665,3
w13,16,128,8,4096,3072,32,32,128,16,4,3,2016.4543333333334,3
w13,16,128,8,4096,3072,32,32,128,16,4,4,2011.8353333333334,3
w13,16,128,8,4096,3072,32,32,128,16,4,5,2007.9096666666667,3
w13,16,128,8,4096,3072,32,32,128,16,8,3,2017.8513333333333,3
w13,16,128,8,4096,3072,32,32,128,16,8,4,2015.1313333333335,3
w13,16,128,8,4096,3072,32,32,128,16,8,5,2013.7123333333332,3
w13,16,128,8,4096,3072,32,32,128,64,4,4,2015.259,3
w13,16,128,8,4096,3072,32,32,128,64,4,5,2017.0626666666667,3
w13,16,128,8,4096,3072,32,32,128,64,8,4,2018.8859999999997,3
w13,16,128,8,4096,3072,32,32,256,1,4,2,2017.1689999999999,3
w13,16,128,8,4096,3072,32,32,256,1,4,3,2005.3716666666667,3
w13,16,128,8,4096,3072,32,32,256,1,4,4,2003.2486666666666,3
w13,16,128,8,4096,3072,32,32,256,1,8,3,2010.5339999999999,3
w13,16,128,8,4096,3072,32,32,256,1,8,4,2009.3819999999998,3
w13,16,128,8,4096,3072,32,32,256,4,4,2,2018.651,3
w13,16,128,8,4096,3072,32,32,256,4,4,3,2006.2036666666665,3
w13,16,128,8,4096,3072,32,32,256,4,4,4,2005.393,3
w13,16,128,8,4096,3072,32,32,256,4,8,3,2011.1206666666667,3
w13,16,128,8,4096,3072,32,32,256,4,8,4,2009.798,3
w13,16,128,8,4096,3072,32,32,256,16,4,3,2008.3046666666667,3
w13,16,128,8,4096,3072,32,32,256,16,4,4,2005.4993333333332,3
w13,16,128,8,4096,3072,32,32,256,16,8,3,2013.094,3
w13,16,128,8,4096,3072,32,32,256,16,8,4,2012.4650000000001,3
w13,16,128,8,4096,3072,32,32,256,32,4,3,2011.0143333333333,3
w13,16,128,8,4096,3072,32,32,256,32,4,4,2008.6566666666668,3
w13,16,128,8,4096,3072,32,32,256,32,8,3,2018.481,3
w13,16,128,8,4096,3072,32,32,256,32,8,4,2016.5393333333334,3
w13,16,128,8,4096,3072,32,64,128,1,4,2,2018.4273333333333,3
w13,16,128,8,4096,3072,32,64,128,1,4,3,2014.3103333333336,3
w13,16,128,8,4096,3072,32,64,128,1,4,4,2011.1313333333335,3
w13,16,128,8,4096,3072,32,64,128,1,4,5,2008.198,3
w13,16,128,8,4096,3072,32,64,128,1,8,3,2014.619,3
w13,16,128,8,4096,3072,32,64,128,1,8,4,2012.7633333333333,3
w13,16,128,8,4096,3072,32,64,128,1,8,5,2009.1793333333335,3
w13,16,128,8,4096,3072,32,64,128,4,4,3,2016.6783333333333,3
w13,16,128,8,4096,3072,32,64,128,4,4,4,2013.3393333333333,3
w13,16,128,8,4096,3072,32,64,128,4,4,5,2010.3526666666667,3
w13,16,128,8,4096,3072,32,64,128,4,8,3,2018.8220000000001,3
w13,16,128,8,4096,3072,32,64,128,4,8,4,2016.6783333333333,3
w13,16,128,8,4096,3072,32,64,128,4,8,5,2008.3153333333332,3
w13,16,128,8,4096,3072,32,64,128,16,4,2,2019.7609999999997,3
w13,16,128,8,4096,3072,32,64,128,16,4,3,2016.6036666666666,3
w13,16,128,8,4096,3072,32,64,128,16,4,4,2015.7183333333332,3
w13,16,128,8,4096,3072,32,64,128,16,4,5,2011.2703333333332,3
w13,16,128,8,4096,3072,32,64,128,16,8,3,2019.5583333333334,3
w13,16,128,8,4096,3072,32,64,128,16,8,4,2017.6593333333333,3
w13,16,128,8,4096,3072,32,64,128,16,8,5,2010.79,3
w13,16,128,8,4096,3072,32,64,128,32,4,4,2016.486,3
w13,16,128,8,4096,3072,32,64,128,32,4,5,2013.094,3
w13,16,128,8,4096,3072,32,64,128,32,8,3,2017.0193333333334,3
w13,16,128,8,4096,3072,32,64,128,32,8,4,2019.6756666666668,3
w13,16,128,8,4096,3072,32,64,128,32,8,5,2013.286,3
w13,16,128,8,4096,3072,32,64,128,64,4,5,2014.097,3
w13,16,128,8,4096,3072,32,64,128,64,8,5,2014.0433333333333,3
w13,16,128,8,4096,3072,32,64,256,1,4,2,2013.5420000000001,3
w13,16,128,8,4096,3072,32,64,256,1,4,3,2008.4646666666667,3
w13,16,128,8,4096,3072,32,64,256,1,4,4,2015.3983333333333,3
w13,16,128,8,4096,3072,32,64,256,1,4,5,2007.494,3
w13,16,128,8,4096,3072,32,64,256,1,8,3,2008.209,3
w13,16,128,8,4096,3072,32,64,256,1,8,4,2005.2863333333335,3
w13,16,128,8,4096,3072,32,64,256,1,8,5,2003.718,3
w13,16,128,8,4096,3072,32,64,256,8,4,2,2015.729,3
w13,16,128,8,4096,3072,32,64,256,8,4,3,2009.6490000000001,3
w13,16,128,8,4096,3072,32,64,256,8,4,4,2012.2196666666666,3
w13,16,128,8,4096,3072,32,64,256,8,4,5,2008.9556666666667,3
w13,16,128,8,4096,3072,32,64,256,8,8,3,2008.0703333333333,3
w13,16,128,8,4096,3072,32,64,256,8,8,4,2006.3419999999999,3
w13,16,128,8,4096,3072,32,64,256,8,8,5,2005.6170000000002,3
w13,16,128,8,4096,3072,32,64,256,16,4,2,2016.0703333333333,3
w13,16,128,8,4096,3072,32,64,256,16,4,3,2011.9956666666667,3
w13,16,128,8,4096,3072,32,64,256,16,4,4,2014.5663333333332,3
w13,16,128,8,4096,3072,32,64,256,16,4,5,2009.8410000000001,3
w13,16,128,8,4096,3072,32,64,256,16,8,3,2010.0326666666667,3
w13,16,128,8,4096,3072,32,64,256,16,8,4,2007.4943333333333,3
w13,16,128,8,4096,3072,32,64,256,16,8,5,2005.563,3
w13,16,128,8,4096,3072,32,64,256,32,4,2,2018.9396666666664,3
w13,16,128,8,4096,3072,32,64,256,32,4,3,2013.393,3
w13,16,128,8,4096,3072,32,64,256,32,4,4,2019.334,3
w13,16,128,8,4096,3072,32,64,256,32,4,5,2012.6779999999999,3
w13,16,128,8,4096,3072,32,64,256,32,8,3,2011.6013333333333,3
w13,16,128,8,4096,3072,32,64,256,32,8,4,2016.7846666666667,3
w13,16,128,8,4096,3072,32,64,256,32,8,5,2008.859333333333,3
w13,16,128,8,4096,3072,32,64,256,64,4,3,2014.8756666666668,3
w13,16,128,8,4096,3072,32,64,256,64,4,5,2019.7610000000002,3
w13,16,128,8,4096,3072,32,64,256,64,8,3,2013.6703333333335,3
w13,16,128,8,4096,3072,32,64,256,64,8,5,2014.8220000000001,3
w13,16,128,8,4096,3072,32,128,128,1,4,3,2009.1580000000001,3
w13,16,128,8,4096,3072,32,128,128,1,4,4,2006.5233333333333,3
w13,16,128,8,4096,3072,32,128,128,1,4,5,2005.243333333333,3
w13,16,128,8,4096,3072,32,128,128,1,8,3,2019.0566666666666,3
w13,16,128,8,4096,3072,32,128,128,1,8,4,2009.585,3
w13,16,128,8,4096,3072,32,128,128,1,8,5,2007.3770000000002,3
w13,16,128,8,4096,3072,32,128,128,4,4,3,2013.9896666666666,3
w13,16,128,8,4096,3072,32,128,128,4,4,4,2005.339,3
w13,16,128,8,4096,3072,32,128,128,4,4,5,2005.1793333333335,3
w13,16,128,8,4096,3072,32,128,128,4,8,3,2017.4673333333333,3
w13,16,128,8,4096,3072,32,128,128,4,8,4,2008.39,3
w13,16,128,8,4096,3072,32,128,128,4,8,5,2006.7153333333333,3
w13,16,128,8,4096,3072,32,128,128,8,4,3,2018.875,3
w13,16,128,8,4096,3072,32,128,128,8,4,4,2005.777,3
w13,16,128,8,4096,3072,32,128,128,8,4,5,2006.5446666666667,3
w13,16,128,8,4096,3072,32,128,128,8,8,3,2018.278,3
w13,16,128,8,4096,3072,32,128,128,8,8,4,2007.281,3
w13,16,128,8,4096,3072,32,128,128,8,8,5,2009.2753333333333,3
w13,16,128,8,4096,3072,32,128,128,16,4,3,2011.2383333333335,3
w13,16,128,8,4096,3072,32,128,128,16,4,4,2006.640666666667,3
w13,16,128,8,4096,3072,32,128,128,16,4,5,2005.905,3
w13,16,128,8,4096,3072,32,128,128,16,8,3,2013.8303333333333,3
w13,16,128,8,4096,3072,32,128,128,16,8,4,2010.2996666666668,3
w13,16,128,8,4096,3072,32,128,128,16,8,5,2006.4806666666666,3
w13,16,128,8,4096,3072,32,128,128,32,4,3,2013.2546666666667,3
w13,16,128,8,4096,3072,32,128,128,32,4,4,2007.0996666666667,3
w13,16,128,8,4096,3072,32,128,128,32,4,5,2007.4516666666666,3
w13,16,128,8,4096,3072,32,128,128,32,8,3,2016.5396666666668,3
w13,16,128,8,4096,3072,32,128,128,32,8,4,2011.7610000000002,3
w13,16,128,8,4096,3072,32,128,128,32,8,5,2008.5290000000002,3
w13,16,128,8,4096,3072,32,128,128,64,4,3,2012.049,3
w13,16,128,8,4096,3072,32,128,128,64,4,4,2009.3613333333333,3
w13,16,128,8,4096,3072,32,128,128,64,4,5,2008.4543333333334,3
w13,16,128,8,4096,3072,32,128,128,64,8,3,2012.6996666666666,3
w13,16,128,8,4096,3072,32,128,128,64,8,4,2011.7926666666665,3
w13,16,128,8,4096,3072,32,128,128,64,8,5,2009.1689999999999,3
w13,16,128,8,4096,3072,64,64,64,1,4,5,2012.6036666666666,3
w13,16,128,8,4096,3072,64,64,64,1,8,5,2018.353,3
w13,16,128,8,4096,3072,64,64,64,4,4,5,2013.3286666666665,3
w13,16,128,8,4096,3072,64,64,64,4,8,5,2019.6756666666668,3
w13,16,128,8,4096,3072,64,64,64,16,4,5,2015.2493333333332,3
w13,16,128,8,4096,3072,64,64,64,32,4,5,2016.2196666666666,3
w13,16,128,8,4096,3072,64,64,128,1,4,3,2007.4726666666666,3
w13,16,128,8,4096,3072,64,64,128,1,4,5,2012.049,3
w13,16,128,8,4096,3072,64,64,128,1,8,3,2009.3820000000003,3
w13,16,128,8,4096,3072,64,64,128,1,8,5,2012.0063333333335,3
w13,16,128,8,4096,3072,64,64,128,4,4,3,2009.0833333333333,3
w13,16,128,8,4096,3072,64,64,128,4,4,5,2014.2143333333333,3
w13,16,128,8,4096,3072,64,64,128,4,8,3,2011.5690000000002,3
w13,16,128,8,4096,3072,64,64,128,4,8,5,2011.7823333333333,3
w13,16,128,8,4096,3072,64,64,128,8,4,3,2008.7423333333334,3
w13,16,128,8,4096,3072,64,64,128,8,4,5,2014.1716666666664,3
w13,16,128,8,4096,3072,64,64,128,8,8,3,2012.5393333333334,3
w13,16,128,8,4096,3072,64,64,128,8,8,5,2012.7316666666666,3
w13,16,128,8,4096,3072,64,64,128,16,4,3,2013.3503333333335,3
w13,16,128,8,4096,3072,64,64,128,16,4,5,2017.937,3
w13,16,128,8,4096,3072,64,64,128,16,8,3,2013.8726666666669,3
w13,16,128,8,4096,3072,64,64,128,16,8,5,2014.897,3
w13,16,128,8,4096,3072,64,64,128,32,4,3,2012.8276666666668,3
w13,16,128,8,4096,3072,64,64,128,32,8,3,2014.4703333333334,3
w13,16,128,8,4096,3072,64,64,128,32,8,5,2019.2169999999999,3
w13,16,128,8,4096,3072,64,64,128,64,4,3,2014.737,3
w13,16,128,8,4096,3072,64,64,128,64,8,3,2017.2543333333333,3
w13,16,128,8,4096,3072,64,128,64,1,4,5,2016.2306666666666,3
w13,16,128,8,4096,3072,64,128,64,4,4,5,2018.6946666666665,3
w13,16,128,8,4096,3072,64,128,64,16,4,5,2013.9583333333333,3
w13,16,128,8,4096,3072,64,128,64,16,8,5,2018.662,3
w13,16,128,8,4096,3072,64,128,64,32,4,5,2016.9343333333334,3
w13,16,128,8,4096,3072,64,128,64,64,4,5,2019.0466666666669,3
w13,16,128,8,4096,3072,64,128,128,1,4,4,2008.657,3
w13,16,128,8,4096,3072,64,128,128,1,8,3,2017.4466666666667,3
w13,16,128,8,4096,3072,64,128,128,1,8,4,2011.0673333333334,3
w13,16,128,8,4096,3072,64,128,128,4,4,4,2007.5159999999998,3
w13,16,128,8,4096,3072,64,128,128,4,8,3,2019.6970000000001,3
w13,16,128,8,4096,3072,64,128,128,4,8,4,2004.8803333333333,3
w13,16,128,8,4096,3072,64,128,128,16,4,3,2019.58,3
w13,16,128,8,4096,3072,64,128,128,16,4,4,2006.8116666666667,3
w13,16,128,8,4096,3072,64,128,128,16,8,3,2014.0436666666665,3
w13,16,128,8,4096,3072,64,128,128,16,8,4,2005.9156666666668,3
w13,16,128,8,4096,3072,64,128,128,32,4,4,2008.8386666666665,3
w13,16,128,8,4096,3072,64,128,128,32,8,3,2013.5316666666665,3
w13,16,128,8,4096,3072,64,128,128,32,8,4,2006.6513333333332,3
w13,16,128,8,4096,3072,64,128,128,64,4,4,2009.6596666666665,3
w13,16,128,8,4096,3072,64,128,128,64,8,3,2016.945,3
w13,16,128,8,4096,3072,64,128,128,64,8,4,2009.0623333333333,3
w13,24,8,2,1024,512,16,64,128,16,8,3,5.516333333333333,3
w13,24,8,2,1024,512,16,64,128,32,8,3,5.506,3
w13,24,8,2,1024,512,16,64,128,32,8,4,5.559333333333334,3
w13,24,8,2,1024,512,16,64,128,64,8,3,5.538,3
w13,24,8,2,1024,512,16,64,128,64,8,4,5.548333333333333,3
w13,24,16,2,1536,768,16,32,128,16,4,2,27.264333333333337,3
w13,24,16,4,1536,1024,16,32,64,16,4,3,35.853,3
w13,24,16,4,1536,1024,16,32,64,32,4,3,35.927666666666674,3
w13,24,16,4,1536,1024,16,32,128,64,4,2,35.842333333333336,3
w13,24,16,4,1536,1024,16,64,64,1,4,3,35.60766666666667,3
w13,24,16,4,1536,1024,16,64,64,32,4,3,35.906,3
w13,24,32,4,2048,768,16,32,64,1,4,3,68.131,3
w13,24,32,4,2048,768,16,32,128,4,4,5,68.16233333333334,3
w13,24,32,4,2048,768,16,32,128,16,4,5,68.17333333333333,3
w13,24,32,4,2048,768,16,64,64,1,4,3,67.64999999999999,3
w13,24,32,4,2048,768,16,64,64,1,8,3,68.16199999999999,3
w13,24,32,4,2048,768,16,64,64,16,4,3,67.60833333333333,3
w13,24,32,4,2048,768,16,64,128,1,4,2,67.587,3
w13,24,32,4,2048,768,16,64,128,16,4,2,67.85266666666666,3
w13,24,32,4,2048,768,16,64,128,64,4,2,68.15133333333334,3
w13,24,32,4,2048,768,16,128,128,1,8,2,68.26933333333334,3
w13,24,32,6,3072,1024,16,32,128,1,4,2,132.163,3
w13,24,32,6,3072,1024,16,32,128,1,4,5,132.81366666666668,3
w13,24,32,6,3072,1024,16,32,128,4,4,2,132.611,3
w13,24,32,6,3072,1024,16,32,128,4,4,5,132.163,3
w13,24,32,6,3072,1024,16,32,128,16,4,2,132.67533333333333,3
w13,24,32,6,3072,1024,16,32,128,16,4,5,133.21866666666665,3
w13,24,32,6,3072,1024,16,32,128,32,4,2,132.87733333333333,3
w13,24,32,6,3072,1024,16,32,128,32,4,5,132.36533333333333,3
w13,24,32,6,3072,1024,16,32,128,64,4,2,132.23733333333334,3
w13,24,32,6,3072,1024,16,32,128,64,4,5,132.952,3
w13,24,32,6,3072,1024,16,32,256,1,4,2,133.048,3
w13,24,32,6,3072,1024,16,32,256,1,4,3,132.55733333333333,3
w13,24,32,6,3072,1024,16,32,256,1,4,4,133.33633333333333,3
w13,24,32,6,3072,1024,16,32,256,16,4,2,133.40066666666667,3
w13,24,32,6,3072,1024,16,32,256,16,4,3,133.44266666666667,3
w13,24,32,6,3072,1024,16,32,256,16,4,4,133.443,3
w13,24,32,6,3072,1024,16,32,256,32,4,3,132.46133333333333,3
w13,24,32,6,3072,1024,16,32,256,64,4,2,133.13366666666667,3
w13,24,32,6,3072,1024,16,32,256,64,4,3,133.16566666666665,3
w13,24,32,6,3072,1024,16,64,128,1,4,5,132.91966666666667,3
w13,24,32,6,3072,1024,16,64,128,1,8,3,132.88833333333332,3
w13,24,32,6,3072,1024,16,64,128,1,8,5,132.36533333333333,3
w13,24,32,6,3072,1024,16,64,128,16,4,5,133.03733333333332,3
w13,24,32,6,3072,1024,16,64,128,16,8,3,132.81366666666665,3
w13,24,32,6,3072,1024,16,64,128,16,8,5,132.696,3
w13,24,32,6,3072,1024,16,64,128,32,4,5,133.0053333333333,3
w13,24,32,6,3072,1024,16,64,128,32,8,5,132.94133333333332,3
w13,24,32,6,3072,1024,16,64,128,64,4,5,132.963,3
w13,24,32,6,3072,1024,16,64,128,64,8,3,132.66433333333333,3
w13,24,32,6,3072,1024,16,64,128,64,8,5,132.696,3
w13,24,32,6,3072,1024,16,64,256,1,4,3,132.42966666666666,3
w13,24,32,6,3072,1024,16,64,256,16,4,2,133.38966666666667,3
w13,24,32,6,3072,1024,16,64,256,16,8,3,133.155,3
w13,24,32,6,3072,1024,16,64,256,64,4,2,133.24,3
w13,24,32,6,3072,1024,16,64,256,64,8,3,132.803,3
w13,24,32,6,3072,1024,16,128,128,1,4,2,133.22933333333333,3
w13,24,32,6,3072,1024,16,128,128,1,4,4,132.79233333333335,3
w13,24,32,6,3072,1024,16,128,128,1,8,4,132.15200000000002,3
w13,24,32,6,3072,1024,16,128,128,1,8,5,133.443,3
w13,24,32,6,3072,1024,16,128,128,16,4,2,132.74933333333334,3
w13,24,32,6,3072,1024,16,128,128,16,4,4,133.19733333333332,3
w13,24,32,6,3072,1024,16,128,128,32,4,2,133.17666666666665,3
w13,24,32,6,3072,1024,16,128,128,32,4,4,132.71766666666667,3
w13,24,32,6,3072,1024,16,128,128,32,8,4,132.95266666666666,3
w13,24,32,6,3072,1024,16,128,128,64,4,2,132.78166666666667,3
w13,24,32,6,3072,1024,16,128,128,64,4,4,133.347,3
w13,24,32,6,3072,1024,16,128,128,64,8,4,132.46166666666667,3
w13,24,32,6,3072,1024,32,32,128,4,4,2,133.10166666666666,3
w13,24,32,6,3072,1024,32,32,128,16,4,2,132.995,3
w13,24,32,6,3072,1024,32,32,128,64,4,2,132.803,3
w13,24,32,6,3072,1024,32,64,128,1,4,3,133.02666666666667,3
w13,24,32,6,3072,1024,32,64,128,64,4,3,133.44266666666667,3
w13,24,32,6,3072,1024,32,128,128,1,8,3,133.42133333333334,3
w13,24,32,6,3072,1024,32,128,128,4,8,3,133.4,3
w13,24,32,6,3072,1024,32,128,128,8,4,3,133.40033333333335,3
w13,24,32,6,3072,1024,32,128,128,16,4,3,133.336,3
w13,24,32,6,3072,1024,32,128,128,32,8,3,133.02700000000002,3
w13,24,32,6,3072,1024,32,128,128,64,8,3,133.35733333333334,3
w13,24,32,6,3072,1024,64,64,64,1,4,3,132.131,3
w13,24,32,6,3072,1024,64,64,64,4,4,3,132.72799999999998,3
w13,24,32,6,3072,1024,64,64,64,16,4,3,133.02666666666667,3
w13,24,32,6,3072,1024,64,64,64,32,4,3,133.32566666666665,3
w13,24,32,6,3072,1024,64,64,64,64,4,3,133.10166666666666,3
w13,24,60,4,2048,1408,16,32,128,1,4,4,222.404,3
w13,24,60,4,2048,1408,16,32,128,1,4,5,221.14499999999998,3
w13,24,60,4,2048,1408,16,32,128,4,4,2,222.63766666666666,3
w13,24,60,4,2048,1408,16,32,128,4,4,5,222.10533333333333,3
w13,24,60,4,2048,1408,16,32,128,16,4,5,222.115,3
w13,24,60,4,2048,1408,16,32,128,32,4,2,222.64866666666668,3
w13,24,60,4,2048,1408,16,32,128,32,4,5,222.35033333333334,3
w13,24,60,4,2048,1408,16,32,256,1,4,2,221.45466666666667,3
w13,24,60,4,2048,1408,16,32,256,1,4,3,220.91033333333334,3
w13,24,60,4,2048,1408,16,32,256,1,4,4,221.98766666666666,3
w13,24,60,4,2048,1408,16,32,256,1,4,5,222.28566666666666,3
w13,24,60,4,2048,1408,16,32,256,16,4,2,221.8273333333333,3
w13,24,60,4,2048,1408,16,32,256,16,4,3,221.369,3
w13,24,60,4,2048,1408,16,32,256,16,4,4,221.97733333333335,3
w13,24,60,4,2048,1408,16,32,256,16,4,5,222.43566666666666,3
w13,24,60,4,2048,1408,16,32,256,32,4,2,223.13966666666667,3
w13,24,60,4,2048,1408,16,32,256,32,4,3,222.26533333333336,3
w13,24,60,4,2048,1408,16,32,256,64,4,2,222.47866666666667,3
w13,24,60,4,2048,1408,16,64,128,1,4,2,221.45366666666666,3
w13,24,60,4,2048,1408,16,64,128,1,4,3,221.50733333333332,3
w13,24,60,4,2048,1408,16,64,128,1,4,4,221.55033333333336,3
w13,24,60,4,2048,1408,16,64,128,1,4,5,221.19866666666667,3
w13,24,60,4,2048,1408,16,64,128,1,8,2,222.404,3
w13,24,60,4,2048,1408,16,64,128,1,8,3,222.734,3
w13,24,60,4,2048,1408,16,64,128,1,8,5,221.71033333333332,3
w13,24,60,4,2048,1408,16,64,128,16,4,2,221.646,3
w13,24,60,4,2048,1408,16,64,128,16,4,3,222.55266666666668,3
w13,24,60,4,2048,1408,16,64,128,16,4,4,222.06233333333333,3
w13,24,60,4,2048,1408,16,64,128,16,4,5,222.33966666666666,3
w13,24,60,4,2048,1408,16,64,128,16,8,2,222.26466666666667,3
w13,24,60,4,2048,1408,16,64,128,16,8,3,222.04100000000003,3
w13,24,60,4,2048,1408,16,64,128,16,8,5,221.68833333333336,3
w13,24,60,4,2048,1408,16,64,128,32,4,2,222.25400000000002,3
w13,24,60,4,2048,1408,16,64,128,32,4,3,222.297,3
w13,24,60,4,2048,1408,16,64,128,32,4,4,222.01966666666667,3
w13,24,60,4,2048,1408,16,64,128,32,4,5,221.56066666666666,3
w13,24,60,4,2048,1408,16,64,128,32,8,2,222.13666666666666,3
w13,24,60,4,2048,1408,16,64,128,32,8,3,222.99,3
w13,24,60,4,2048,1408,16,64,128,32,8,5,221.99799999999996,3
w13,24,60,4,2048,1408,16,64,128,64,4,2,222.08366666666666,3
w13,24,60,4,2048,1408,16,64,128,64,4,3,221.89133333333334,3
w13,24,60,4,2048,1408,16,64,128,64,4,4,222.15833333333333,3
w13,24,60,4,2048,1408,16,64,128,64,4,5,222.542,3
w13,24,60,4,2048,1408,16,64,128,64,8,2,222.48833333333334,3
w13,24,60,4,2048,1408,16,64,128,64,8,3,222.56333333333336,3
w13,24,60,4,2048,1408,16,64,128,64,8,5,223.07566666666665,3
w13,24,60,4,2048,1408,16,64,256,1,4,2,222.12666666666667,3
w13,24,60,4,2048,1408,16,64,256,1,4,3,221.92333333333332,3
w13,24,60,4,2048,1408,16,64,256,1,8,2,222.894,3
w13,24,60,4,2048,1408,16,64,256,1,8,3,222.03033333333335,3
w13,24,60,4,2048,1408,16,64,256,16,4,2,222.60666666666665,3
w13,24,60,4,2048,1408,16,64,256,16,4,3,222.42499999999998,3
w13,24,60,4,2048,1408,16,64,256,16,8,3,221.966,3
w13,24,60,4,2048,1408,16,64,256,32,4,2,222.4463333333333,3
w13,24,60,4,2048,1408,16,64,256,32,4,3,222.809,3
w13,24,60,4,2048,1408,16,64,256,32,8,2,223.10800000000003,3
w13,24,60,4,2048,1408,16,64,256,32,8,3,222.00933333333333,3
w13,24,60,4,2048,1408,16,64,256,64,4,2,222.00900000000001,3
w13,24,60,4,2048,1408,16,64,256,64,4,3,222.649,3
w13,24,60,4,2048,1408,16,64,256,64,8,3,223.06466666666665,3
w13,24,60,4,2048,1408,16,128,128,1,8,4,222.83066666666664,3
w13,24,60,4,2048,1408,16,128,128,1,8,5,222.20133333333334,3
w13,24,60,4,2048,1408,16,128,128,16,8,5,222.12666666666667,3
w13,24,60,4,2048,1408,16,128,128,32,4,2,222.88333333333333,3
w13,24,60,4,2048,1408,16,128,128,32,4,4,223.03266666666664,3
w13,24,60,4,2048,1408,16,128,128,32,8,5,221.98799999999997,3
w13,24,60,4,2048,1408,16,128,128,64,8,4,222.71266666666668,3
w13,24,60,4,2048,1408,32,32,128,1,4,4,222.51066666666668,3
w13,24,60,4,2048,1408,32,32,128,16,4,4,223.001,3
w13,24,60,4,2048,1408,32,64,128,1,4,3,222.521,3
w13,24,60,4,2048,1408,32,64,128,4,4,2,222.62766666666667,3
w13,24,60,4,2048,1408,32,64,128,4,4,3,222.52066666666667,3
w13,24,60,4,2048,1408,32,64,128,16,4,2,223.129,3
w13,24,60,4,2048,1408,32,64,128,32,4,3,223.107,3
w13,24,60,4,2048,1408,32,128,128,1,4,3,221.77466666666666,3
w13,24,60,4,2048,1408,32,128,128,1,8,3,221.7636666666667,3
w13,24,60,4,2048,1408,32,128,128,4,4,3,222.563,3
w13,24,60,4,2048,1408,32,128,128,4,8,3,222.713,3
w13,24,60,4,2048,1408,32,128,128,8,4,3,222.68133333333333,3
w13,24,60,4,2048,1408,32,128,128,8,8,3,222.542,3
w13,24,60,4,2048,1408,32,128,128,16,4,3,222.19033333333334,3
w13,24,60,4,2048,1408,32,128,128,32,4,3,222.97966666666665,3
w13,24,60,4,2048,1408,32,128,128,64,4,3,222.97933333333333,3
w13,24,60,4,2048,1408,32,128,128,64,8,3,222.8936666666667,3
w13,24,60,4,2048,1408,64,64,64,4,4,3,222.58466666666666,3
w13,24,60,6,3584,2304,16,16,128,1,4,3,629.0406666666667,3
w13,24,60,6,3584,2304,16,16,128,1,4,5,629.916,3
w13,24,60,6,3584,2304,16,16,128,4,4,3,627.6336666666666,3
w13,24,60,6,3584,2304,16,16,256,1,4,3,628.401,3
w13,24,60,6,3584,2304,16,16,256,1,4,4,628.0173333333333,3
w13,24,60,6,3584,2304,16,16,256,1,4,5,627.5793333333334,3
w13,24,60,6,3584,2304,16,16,256,4,4,3,629.1046666666667,3
w13,24,60,6,3584,2304,16,16,256,4,4,4,628.6683333333334,3
w13,24,60,6,3584,2304,16,16,256,4,4,5,627.4519999999999,3
w13,24,60,6,3584,2304,16,32,128,1,4,3,627.6753333333332,3
w13,24,60,6,3584,2304,16,32,128,1,4,4,628.497,3
w13,24,60,6,3584,2304,16,32,128,1,4,5,625.1803333333334,3
w13,24,60,6,3584,2304,16,32,128,4,4,3,628.476,3
w13,24,60,6,3584,2304,16,32,128,4,4,4,628.967,3
w13,24,60,6,3584,2304,16,32,128,4,4,5,626.0543333333334,3
w13,24,60,6,3584,2304,16,32,128,16,4,3,629.223,3
w13,24,60,6,3584,2304,16,32,128,16,4,5,626.1933333333333,3
w13,24,60,6,3584,2304,16,32,128,32,4,5,628.1239999999999,3
w13,24,60,6,3584,2304,16,32,128,64,4,3,629.894,3
w13,24,60,6,3584,2304,16,32,128,64,4,5,628.145,3
w13,24,60,6,3584,2304,16,32,256,1,4,2,625.8096666666667,3
w13,24,60,6,3584,2304,16,32,256,1,4,3,625.6276666666666,3
w13,24,60,6,3584,2304,16,32,256,1,4,4,624.7633333333333,3
w13,24,60,6,3584,2304,16,32,256,1,4,5,624.1876666666666,3
w13,24,60,6,3584,2304,16,32,256,1,8,5,629.564,3
w13,24,60,6,3584,2304,16,32,256,16,4,2,627.2703333333334,3
w13,24,60,6,3584,2304,16,32,256,16,4,3,626.4806666666667,3
w13,24,60,6,3584,2304,16,32,256,16,4,4,625.607,3
w13,24,60,6,3584,2304,16,32,256,16,4,5,625.9053333333334,3
w13,24,60,6,3584,2304,16,32,256,32,4,2,627.804,3
w13,24,60,6,3584,2304,16,32,256,32,4,3,626.8863333333334,3
w13,24,60,6,3584,2304,16,32,256,32,4,4,626.2033333333334,3
w13,24,60,6,3584,2304,16,32,256,32,4,5,627.4843333333333,3
w13,24,60,6,3584,2304,16,32,256,64,4,2,628.0703333333335,3
w13,24,60,6,3584,2304,16,32,256,64,4,3,627.8786666666666,3
w13,24,60,6,3584,2304,16,32,256,64,4,4,627.7286666666666,3
w13,24,60,6,3584,2304,16,32,256,64,4,5,628.4226666666667,3
w13,24,60,6,3584,2304,16,64,128,1,4,2,629.607,3
w13,24,60,6,3584,2304,16,64,128,1,4,4,626.8870000000001,3
w13,24,60,6,3584,2304,16,64,128,1,4,5,624.134,3
w13,24,60,6,3584,2304,16,64,128,1,8,2,629.8523333333333,3
w13,24,60,6,3584,2304,16,64,128,1,8,3,627.11,3
w13,24,60,6,3584,2304,16,64,128,1,8,5,625.457,3
w13,24,60,6,3584,2304,16,64,128,16,4,2,629.319,3
w13,24,60,6,3584,2304,16,64,128,16,4,4,627.4513333333333,3
w13,24,60,6,3584,2304,16,64,128,16,4,5,626.0546666666668,3
w13,24,60,6,3584,2304,16,64,128,16,8,3,626.7476666666666,3
w13,24,60,6,3584,2304,16,64,128,16,8,4,629.3823333333333,3
w13,24,60,6,3584,2304,16,64,128,16,8,5,626.63,3
w13,24,60,6,3584,2304,16,64,128,32,4,2,629.959,3
w13,24,60,6,3584,2304,16,64,128,32,4,5,626.225,3
w13,24,60,6,3584,2304,16,64,128,32,8,2,628.8593333333333,3
w13,24,60,6,3584,2304,16,64,128,32,8,3,628.7323333333334,3
w13,24,60,6,3584,2304,16,64,128,32,8,5,627.5376666666667,3
w13,24,60,6,3584,2304,16,64,128,64,4,5,628.209,3
w13,24,60,6,3584,2304,16,64,128,64,8,3,628.4333333333333,3
w13,24,60,6,3584,2304,16,64,128,64,8,5,628.284,3
w13,24,60,6,3584,2304,16,64,256,1,4,2,626.9826666666667,3
w13,24,60,6,3584,2304,16,64,256,1,4,3,625.1370000000001,3
w13,24,60,6,3584,2304,16,64,256,1,4,4,627.345,3
w13,24,60,6,3584,2304,16,64,256,1,4,5,625.9056666666667,3
w13,24,60,6,3584,2304,16,64,256,1,8,2,626.8973333333333,3
w13,24,60,6,3584,2304,16,64,256,1,8,3,625.1153333333333,3
w13,24,60,6,3584,2304,16,64,256,1,8,4,628.0496666666667,3
w13,24,60,6,3584,2304,16,64,256,1,8,5,625.4996666666666,3
w13,24,60,6,3584,2304,16,64,256,16,4,2,627.6329999999999,3
w13,24,60,6,3584,2304,16,64,256,16,4,3,625.5210000000001,3
w13,24,60,6,3584,2304,16,64,256,16,4,4,629.4576666666667,3
w13,24,60,6,3584,2304,16,64,256,16,4,5,627.3453333333333,3
w13,24,60,6,3584,2304,16,64,256,16,8,2,627.0146666666666,3
w13,24,60,6,3584,2304,16,64,256,16,8,3,626.1613333333333,3
w13,24,60,6,3584,2304,16,64,256,16,8,5,627.729,3
w13,24,60,6,3584,2304,16,64,256,32,4,2,628.3153333333333,3
w13,24,60,6,3584,2304,16,64,256,32,4,3,626.3106666666666,3
w13,24,60,6,3584,2304,16,64,256,32,4,5,629.0203333333333,3
w13,24,60,6,3584,2304,16,64,256,32,8,2,628.6356666666667,3
w13,24,60,6,3584,2304,16,64,256,32,8,3,627.1316666666667,3
w13,24,60,6,3584,2304,16,64,256,32,8,5,629.0836666666667,3
w13,24,60,6,3584,2304,16,64,256,64,4,2,628.572,3
w13,24,60,6,3584,2304,16,64,256,64,4,3,627.324,3
w13,24,60,6,3584,2304,16,64,256,64,8,2,627.516,3
w13,24,60,6,3584,2304,16,64,256,64,8,3,628.8276666666667,3
w13,24,60,6,3584,2304,16,128,128,1,4,2,628.2093333333333,3
w13,24,60,6,3584,2304,16,128,128,1,4,4,628.273,3
w13,24,60,6,3584,2304,16,128,128,1,4,5,626.5766666666667,3
w13,24,60,6,3584,2304,16,128,128,1,8,4,627.2063333333334,3
w13,24,60,6,3584,2304,16,128,128,1,8,5,623.6763333333333,3
w13,24,60,6,3584,2304,16,128,128,16,4,2,628.6246666666667,3
w13,24,60,6,3584,2304,16,128,128,16,4,4,629.2116666666666,3
w13,24,60,6,3584,2304,16,128,128,16,4,5,627.1213333333334,3
w13,24,60,6,3584,2304,16,128,128,16,8,4,627.868,3
w13,24,60,6,3584,2304,16,128,128,16,8,5,625.745,3
w13,24,60,6,3584,2304,16,128,128,32,4,2,628.561,3
w13,24,60,6,3584,2304,16,128,128,32,4,4,629.2863333333333,3
w13,24,60,6,3584,2304,16,128,128,32,4,5,627.1963333333333,3
w13,24,60,6,3584,2304,16,128,128,32,8,4,629.5746666666668,3
w13,24,60,6,3584,2304,16,128,128,32,8,5,626.214,3
w13,24,60,6,3584,2304,16,128,128,64,4,2,628.6676666666667,3
w13,24,60,6,3584,2304,16,128,128,64,4,4,628.7743333333334,3
w13,24,60,6,3584,2304,16,128,128,64,4,5,629.34,3
w13,24,60,6,3584,2304,16,128,128,64,8,4,629.8093333333333,3
w13,24,60,6,3584,2304,16,128,128,64,8,5,626.4816666666667,3
w13,24,60,6,3584,2304,32,32,128,1,4,3,629.0943333333333,3
w13,24,60,6,3584,2304,32,32,128,1,4,4,628.6253333333334,3
w13,24,60,6,3584,2304,32,32,128,1,4,5,629.0523333333333,3
w13,24,60,6,3584,2304,32,32,128,4,4,3,629.745,3
w13,24,60,6,3584,2304,32,32,128,4,4,4,628.7426666666667,3
w13,24,60,6,3584,2304,32,32,128,4,4,5,628.5183333333333,3
w13,24,60,6,3584,2304,32,32,128,16,4,3,629.0086666666666,3
w13,24,60,6,3584,2304,32,32,128,16,4,4,628.3156666666667,3
w13,24,60,6,3584,2304,32,32,128,16,4,5,628.9876666666667,3
w13,24,60,6,3584,2304,32,32,256,1,4,3,628.1453333333334,3
w13,24,60,6,3584,2304,32,32,256,1,4,4,629.041,3
w13,24,60,6,3584,2304,32,32,256,4,4,3,628.4543333333334,3
w13,24,60,6,3584,2304,32,32,256,4,4,4,629.4036666666667,3
w13,24,60,6,3584,2304,32,32,256,16,4,3,629.628,3
w13,24,60,6,3584,2304,32,64,128,1,4,3,629.5846666666666,3
w13,24,60,6,3584,2304,32,64,128,1,4,5,627.5586666666667,3
w13,24,60,6,3584,2304,32,64,128,1,8,5,628.3263333333333,3
w13,24,60,6,3584,2304,32,64,128,4,4,3,628.9776666666667,3
w13,24,60,6,3584,2304,32,64,128,4,4,5,628.817,3
w13,24,60,6,3584,2304,32,64,128,4,8,3,629.8516666666667,3
w13,24,60,6,3584,2304,32,64,128,4,8,5,628.1983333333333,3
w13,24,60,6,3584,2304,32,64,128,16,4,3,628.4653333333334,3
w13,24,60,6,3584,2304,32,64,128,16,4,5,628.529,3
w13,24,60,6,3584,2304,32,64,128,16,8,5,628.3159999999999,3
w13,24,60,6,3584,2304,32,64,128,32,4,3,629.916,3
w13,24,60,6,3584,2304,32,64,128,32,4,5,629.3286666666667,3
w13,24,60,6,3584,2304,32,64,128,64,8,5,629.7986666666667,3
w13,24,60,6,3584,2304,32,64,256,1,8,3,629.628,3
w13,24,60,6,3584,2304,32,64,256,1,8,5,628.0916666666667,3
w13,24,60,6,3584,2304,32,64,256,8,8,3,628.8066666666667,3
w13,24,60,6,3584,2304,32,64,256,8,8,5,629.0413333333332,3
w13,24,60,6,3584,2304,32,128,128,1,4,3,626.8223333333333,3
w13,24,60,6,3584,2304,32,128,128,1,4,5,627.9856666666666,3
w13,24,60,6,3584,2304,32,128,128,1,8,3,625.895,3
w13,24,60,6,3584,2304,32,128,128,1,8,5,628.5186666666667,3
w13,24,60,6,3584,2304,32,128,128,4,4,3,626.3636666666666,3
w13,24,60,6,3584,2304,32,128,128,4,4,5,627.004,3
w13,24,60,6,3584,2304,32,128,128,4,8,3,626.8870000000001,3
w13,24,60,6,3584,2304,32,128,128,4,8,5,627.5476666666667,3
w13,24,60,6,3584,2304,32,128,128,8,4,3,626.9506666666666,3
w13,24,60,6,3584,2304,32,128,128,8,4,5,628.508,3
w13,24,60,6,3584,2304,32,128,128,8,8,3,626.6626666666667,3
w13,24,60,6,3584,2304,32,128,128,8,8,5,627.5483333333333,3
w13,24,60,6,3584,2304,32,128,128,16,4,3,626.5986666666666,3
w13,24,60,6,3584,2304,32,128,128,16,4,5,629.2546666666667,3
w13,24,60,6,3584,2304,32,128,128,16,8,3,626.8756666666667,3
w13,24,60,6,3584,2304,32,128,128,16,8,5,627.5373333333333,3
w13,24,60,6,3584,2304,32,128,128,32,4,3,627.1103333333333,3
w13,24,60,6,3584,2304,32,128,128,32,4,5,629.1693333333334,3
w13,24,60,6,3584,2304,32,128,128,32,8,3,627.932,3
w13,24,60,6,3584,2304,32,128,128,32,8,5,628.124,3
w13,24,60,6,3584,2304,32,128,128,64,4,3,627.0143333333333,3
w13,24,60,6,3584,2304,32,128,128,64,8,3,627.8249999999999,3
w13,24,60,6,3584,2304,32,128,128,64,8,5,629.7026666666667,3
w13,24,60,8,2048,1536,16,32,64,1,4,3,244.409,3
w13,24,60,8,2048,1536,16,32,128,1,4,2,242.05100000000002,3
w13,24,60,8,2048,1536,16,32,128,1,4,4,243.73733333333334,3
w13,24,60,8,2048,1536,16,32,128,1,4,5,243.06466666666665,3
w13,24,60,8,2048,1536,16,32,128,4,4,2,242.275,3
w13,24,60,8,2048,1536,16,32,128,4,4,4,243.90733333333333,3
w13,24,60,8,2048,1536,16,32,128,4,4,5,243.23533333333333,3
w13,24,60,8,2048,1536,16,32,128,16,4,2,242.467,3
w13,24,60,8,2048,1536,16,32,128,16,4,4,244.09933333333333,3
w13,24,60,8,2048,1536,16,32,128,16,4,5,242.57366666666667,3
w13,24,60,8,2048,1536,16,32,128,32,4,2,243.23533333333333,3
w13,24,60,8,2048,1536,16,32,128,32,4,5,243.06433333333334,3
w13,24,60,8,2048,1536,16,32,128,64,4,2,243.32033333333334,3
w13,24,60,8,2048,1536,16,32,128,64,4,4,244.31300000000002,3
w13,24,60,8,2048,1536,16,32,128,64,4,5,243.78966666666668,3
w13,24,60,8,2048,1536,16,32,256,1,4,2,244.19500000000002,3
w13,24,60,8,2048,1536,16,32,256,1,4,3,243.06499999999997,3
w13,24,60,8,2048,1536,16,32,256,1,4,4,242.96899999999997,3
w13,24,60,8,2048,1536,16,32,256,1,4,5,243.29933333333335,3
w13,24,60,8,2048,1536,16,32,256,16,4,3,243.00033333333332,3
w13,24,60,8,2048,1536,16,32,256,16,4,4,243.5666666666667,3
w13,24,60,8,2048,1536,16,32,256,16,4,5,243.50199999999998,3
w13,24,60,8,2048,1536,16,32,256,32,4,3,242.92600000000002,3
w13,24,60,8,2048,1536,16,32,256,32,4,4,244.11033333333333,3
w13,24,60,8,2048,1536,16,32,256,64,4,3,243.8226666666667,3
w13,24,60,8,2048,1536,16,64,128,1,4,2,243.54433333333336,3
w13,24,60,8,2048,1536,16,64,128,1,4,4,242.947,3
w13,24,60,8,2048,1536,16,64,128,1,4,5,242.67066666666665,3
w13,24,60,8,2048,1536,16,64,128,1,8,4,244.09933333333333,3
w13,24,60,8,2048,1536,16,64,128,1,8,5,242.7976666666667,3
w13,24,60,8,2048,1536,16,64,128,16,4,2,242.07299999999998,3
w13,24,60,8,2048,1536,16,64,128,16,4,4,243.23600000000002,3
w13,24,60,8,2048,1536,16,64,128,16,4,5,243.00066666666666,3
w13,24,60,8,2048,1536,16,64,128,16,8,3,244.1206666666667,3
w13,24,60,8,2048,1536,16,64,128,16,8,4,243.427,3
w13,24,60,8,2048,1536,16,64,128,16,8,5,242.73466666666664,3
w13,24,60,8,2048,1536,16,64,128,32,4,2,242.48866666666666,3
w13,24,60,8,2048,1536,16,64,128,32,4,4,243.5773333333333,3
w13,24,60,8,2048,1536,16,64,128,32,4,5,242.77666666666667,3
w13,24,60,8,2048,1536,16,64,128,32,8,5,243.24666666666667,3
w13,24,60,8,2048,1536,16,64,128,64,4,2,242.25400000000002,3
w13,24,60,8,2048,1536,16,64,128,64,4,4,243.865,3
w13,24,60,8,2048,1536,16,64,128,64,4,5,243.68366666666668,3
w13,24,60,8,2048,1536,16,64,128,64,8,5,243.86433333333335,3
w13,24,60,8,2048,1536,16,64,256,1,4,2,244.302,3
w13,24,60,8,2048,1536,16,64,256,1,4,3,243.12933333333334,3
w13,24,60,8,2048,1536,16,64,256,1,8,3,243.76933333333332,3
w13,24,60,8,2048,1536,16,64,256,16,4,2,244.28033333333335,3
w13,24,60,8,2048,1536,16,64,256,16,4,3,243.385,3
w13,24,60,8,2048,1536,16,64,256,16,8,3,243.10733333333334,3
w13,24,60,8,2048,1536,16,64,256,32,4,2,244.06799999999998,3
w13,24,60,8,2048,1536,16,64,256,32,4,3,243.72633333333337,3
w13,24,60,8,2048,1536,16,64,256,32,8,3,244.04666666666665,3
w13,24,60,8,2048,1536,16,128,128,1,4,2,242.787,3
w13,24,60,8,2048,1536,16,128,128,1,4,3,242.65966666666668,3
w13,24,60,8,2048,1536,16,128,128,1,8,2,242.42433333333335,3
w13,24,60,8,2048,1536,16,128,128,1,8,4,244.23833333333334,3
w13,24,60,8,2048,1536,16,128,128,1,8,5,243.20299999999997,3
w13,24,60,8,2048,1536,16,128,128,16,4,2,243.08633333333333,3
w13,24,60,8,2048,1536,16,128,128,16,4,3,243.886,3
