pipetuning_test/moe_dse/moe_dse_H20_99.csv
weight_type,M,E,topk,H,N,BLOCK_SIZE_M,BLOCK_SIZE_N,BLOCK_SIZE_K,GROUP_SIZE_M,num_warps,num_stages,avg_duration,sample_count
w13,1,8,2,1024,512,16,32,128,1,4,3,4.034,3
w13,1,8,2,1024,512,16,32,128,1,4,5,4.066333333333334,3
w13,1,8,2,1024,512,16,32,128,4,4,3,4.034,3
w13,1,8,2,1024,512,16,32,128,4,4,5,4.0553333333333335,3
w13,1,8,2,1024,512,16,32,128,16,4,3,4.034,3
w13,1,8,2,1024,512,16,32,128,16,4,4,4.055666666666666,3
w13,1,8,2,1024,512,16,32,128,32,4,3,4.034,3
w13,1,8,2,1024,512,16,32,128,32,4,5,4.0553333333333335,3
w13,1,8,2,1024,512,16,32,128,64,4,3,4.044666666666667,3
w13,1,8,2,1024,512,16,32,128,64,4,4,4.066,3
w13,1,8,2,1024,512,16,32,128,64,4,5,4.0553333333333335,3
w13,1,16,2,1536,768,16,64,128,16,8,3,6.231333333333333,3
w13,1,16,2,1536,768,16,64,128,32,8,3,6.199333333333333,3
w13,1,16,2,1536,768,16,64,128,64,8,3,6.199666666666666,3
w13,1,16,4,1536,1024,16,128,64,1,8,3,9.602,3
w13,1,16,4,1536,1024,16,128,64,1,8,4,9.634333333333332,3
w13,1,32,4,2048,768,16,32,128,1,4,3,10.540999999999999,3
w13,1,32,4,2048,768,16,32,128,4,4,3,10.604666666666667,3
w13,1,32,4,2048,768,16,32,128,16,4,3,10.583333333333334,3
w13,1,32,4,2048,768,16,32,128,32,4,3,10.551666666666668,3
w13,1,32,4,2048,768,16,32,128,64,4,3,10.53,3
w13,1,32,6,3072,1024,16,32,128,1,4,4,25.122,3
w13,1,32,6,3072,1024,16,32,128,4,4,3,25.25,3
w13,1,32,6,3072,1024,16,32,128,4,4,4,25.239666666666665,3
w13,1,32,6,3072,1024,16,32,128,16,4,4,25.292666666666666,3
w13,1,32,6,3072,1024,16,32,128,64,4,4,25.06866666666667,3
w13,1,60,4,2048,1408,16,32,128,1,4,4,15.895666666666665,3
w13,1,60,4,2048,1408,16,32,128,4,4,4,15.820666666666668,3
w13,1,60,4,2048,1408,16,32,128,16,4,4,15.916333333333334,3
w13,1,60,4,2048,1408,16,32,128,32,4,4,15.831666666666669,3
w13,1,60,4,2048,1408,16,32,128,64,4,4,15.927333333333332,3
w13,1,60,6,3584,2304,16,64,128,1,4,4,60.86633333333333,3
w13,1,60,6,3584,2304,16,64,128,16,4,4,60.812666666666665,3
w13,1,60,6,3584,2304,16,64,128,32,4,4,60.535333333333334,3
w13,1,60,6,3584,2304,16,64,128,64,4,4,61.05766666666667,3
w13,1,60,6,3584,2304,16,128,128,1,8,3,60.834,3
w13,1,60,8,2048,1536,16,64,64,16,4,3,32.86633333333334,3
w13,1,60,8,2048,1536,16,64,64,32,4,3,32.54633333333333,3
w13,1,64,6,3072,2048,16,64,64,1,4,4,47.778333333333336,3
w13,1,64,6,3072,2048,16,64,64,16,4,3,47.970333333333336,3
w13,1,64,6,3072,2048,16,64,64,16,4,4,48.098333333333336,3
w13,1,64,6,3072,2048,16,64,64,64,4,3,48.034,3
w13,1,64,6,3584,1536,16,64,128,1,4,3,41.068999999999996,3
w13,1,64,6,3584,1536,16,64,128,32,4,3,40.97266666666667,3
w13,1,64,6,3584,1536,16,64,128,64,4,3,41.346000000000004,3
w13,1,64,8,3584,2560,16,64,128,1,4,4,88.109,3
w13,1,64,8,3584,2560,16,64,128,32,4,4,88.61033333333334,3
w13,1,128,4,2048,512,16,64,128,16,8,3,7.586333333333333,3
w13,1,128,4,2048,512,16,64,128,16,8,4,7.650333333333333,3
w13,1,128,4,2048,512,16,64,128,32,8,3,7.5856666666666674,3
w13,1,128,4,2048,512,16,64,128,32,8,4,7.607333333333334,3
w13,1,128,4,2048,512,16,64,128,64,8,3,7.586333333333333,3
w13,1,128,4,2048,512,16,64,128,64,8,4,7.650333333333333,3
w13,1,128,6,4096,2048,16,64,64,1,8,4,63.959333333333326,3
w13,1,128,6,4096,2048,16,64,64,16,4,3,63.51166666666666,3
w13,1,128,6,4096,2048,16,64,64,16,4,4,63.78933333333333,3
w13,1,128,6,4096,2048,16,64,64,32,4,3,63.89566666666666,3
w13,1,128,6,4096,2048,16,64,64,64,4,3,64.08766666666666,3
w13,1,128,6,4096,2048,16,64,64,64,4,4,63.97,3
w13,1,128,6,4096,2048,16,64,128,1,4,2,63.885,3
w13,1,128,6,4096,2048,16,64,128,32,4,4,63.917,3
w13,1,128,6,4096,2048,16,64,128,64,4,4,63.81,3
w13,1,128,6,4096,2048,16,128,128,1,8,3,64.08733333333333,3
w13,1,128,8,2048,768,16,32,128,4,4,4,16.29,3
w13,1,128,8,2048,768,16,32,128,16,4,4,16.386,3
w13,1,128,8,2048,768,16,32,128,32,4,4,16.386333333333333,3
w13,1,128,8,4096,1536,16,32,64,1,4,3,64.38633333333333,3
w13,1,128,8,4096,1536,16,32,64,16,4,3,64.59933333333333,3
w13,1,128,8,4096,1536,16,32,64,64,4,3,64.50366666666667,3
w13,1,128,8,4096,1536,16,64,64,1,4,3,64.35433333333334,3
w13,1,128,8,4096,1536,16,64,64,1,4,4,64.43966666666667,3
w13,1,128,8,4096,1536,16,64,64,16,4,3,64.173,3
w13,1,128,8,4096,1536,16,64,64,16,4,4,64.13,3
w13,1,128,8,4096,1536,16,64,64,16,8,4,64.46066666666667,3
w13,1,128,8,4096,1536,16,64,64,32,4,3,64.09833333333334,3
w13,1,128,8,4096,1536,16,64,64,32,8,4,64.685,3
w13,1,128,8,4096,1536,16,64,64,64,4,3,64.322,3
w13,1,128,8,4096,1536,16,64,64,64,8,4,64.397,3
w13,1,128,8,4096,1536,16,64,128,1,4,2,64.61033333333334,3
w13,1,128,8,4096,1536,16,64,128,1,8,2,64.64233333333333,3
w13,1,128,8,4096,1536,16,64,128,16,4,2,64.31133333333334,3
w13,1,128,8,4096,1536,16,64,128,32,4,2,64.33266666666667,3
w13,1,128,8,4096,1536,16,64,128,64,4,4,64.66366666666666,3
w13,1,128,8,4096,1536,16,128,128,64,8,3,64.546,3
w13,1,128,8,4096,3072,16,32,128,4,4,5,119.81033333333333,3
w13,1,128,8,4096,3072,16,32,128,64,4,5,119.62933333333332,3
w13,1,128,8,4096,3072,16,64,128,1,4,3,118.63733333333334,3
w13,2,8,2,1024,512,16,64,128,16,8,3,4.887333333333333,3
w13,2,8,2,1024,512,16,64,128,16,8,4,4.929666666666667,3
w13,2,8,2,1024,512,16,64,128,32,8,3,4.909,3
w13,2,8,2,1024,512,16,64,128,32,8,4,4.9303333333333335,3
w13,2,8,2,1024,512,16,64,128,64,8,3,4.898,3
w13,2,8,2,1024,512,16,64,128,64,8,4,4.919333333333333,3
w13,2,16,2,1536,768,16,32,128,1,4,3,8.449666666666666,3
w13,2,16,2,1536,768,16,32,128,4,4,3,8.514,3
w13,2,16,2,1536,768,16,32,128,16,4,3,8.482,3
w13,2,16,2,1536,768,16,32,128,32,4,3,8.503666666666666,3
w13,2,16,4,1536,1024,16,128,64,1,8,4,16.631666666666664,3
w13,2,32,4,2048,768,16,32,128,1,4,3,16.461,3
w13,2,32,4,2048,768,16,32,128,1,4,4,16.343333333333334,3
w13,2,32,4,2048,768,16,32,128,4,4,4,16.439,3
w13,2,32,4,2048,768,16,32,128,16,4,3,16.450333333333333,3
w13,2,32,4,2048,768,16,32,128,16,4,4,16.364666666666665,3
w13,2,32,4,2048,768,16,32,128,32,4,4,16.396666666666665,3
w13,2,32,4,2048,768,16,32,128,64,4,4,16.45,3
w13,2,32,6,3072,1024,16,64,64,1,4,4,47.586333333333336,3
w13,2,32,6,3072,1024,16,64,64,16,4,4,48.066,3
w13,2,32,6,3072,1024,16,64,64,32,4,4,47.86366666666667,3
w13,2,32,6,3072,1024,16,64,64,64,4,4,47.76733333333333,3
w13,2,60,4,2048,1408,16,64,64,1,4,3,30.893,3
w13,2,60,4,2048,1408,16,64,64,1,4,4,30.754,3
w13,2,60,4,2048,1408,16,64,64,16,4,3,30.828999999999997,3
w13,2,60,4,2048,1408,16,64,64,32,4,4,30.73266666666667,3
w13,2,60,4,2048,1408,16,64,64,64,4,4,30.91433333333333,3
w13,2,60,6,3584,2304,16,64,128,1,4,4,116.36533333333334,3
w13,2,60,6,3584,2304,16,128,128,1,4,3,115.74666666666667,3
w13,2,60,6,3584,2304,16,128,128,1,8,3,115.52233333333334,3
w13,2,60,6,3584,2304,16,128,128,1,8,4,116.09866666666666,3
w13,2,60,6,3584,2304,16,128,128,16,4,3,116.35433333333333,3
w13,2,60,6,3584,2304,16,128,128,16,8,3,115.34166666666665,3
w13,2,60,6,3584,2304,16,128,128,16,8,4,115.98133333333334,3
w13,2,60,6,3584,2304,16,128,128,32,8,3,115.20266666666667,3
w13,2,60,6,3584,2304,16,128,128,64,8,3,115.23433333333332,3
w13,2,60,8,2048,1536,16,64,128,1,4,3,61.442,3
w13,2,60,8,2048,1536,16,64,128,16,4,3,61.23933333333334,3
w13,2,60,8,2048,1536,16,64,128,32,4,3,61.29266666666666,3
w13,2,60,8,2048,1536,16,64,128,64,4,3,61.14333333333334,3
w13,2,64,6,3072,2048,16,64,128,1,4,3,89.176,3
w13,2,64,6,3072,2048,16,64,128,16,4,3,88.66399999999999,3
w13,2,64,6,3072,2048,16,64,128,32,4,3,88.84500000000001,3
w13,2,64,6,3072,2048,16,64,128,64,4,3,89.00466666666667,3
w13,2,64,6,3584,1536,16,128,128,1,8,4,79.373,3
w13,2,64,6,3584,1536,16,128,128,16,8,4,79.39433333333334,3
w13,2,64,6,3584,1536,16,128,128,32,8,4,80.16199999999999,3
w13,2,64,6,3584,1536,16,128,128,64,8,4,79.928,3
w13,2,64,8,3584,2560,16,128,128,1,8,3,167.07500000000002,3
w13,2,64,8,3584,2560,16,128,128,16,8,3,168.46166666666667,3
w13,2,64,8,3584,2560,16,128,128,32,8,3,167.85333333333332,3
w13,2,64,8,3584,2560,16,128,128,64,8,3,167.363,3
w13,2,128,4,2048,512,16,64,128,1,4,3,12.066333333333333,3
w13,2,128,4,2048,512,16,64,128,16,4,3,12.055333333333332,3
w13,2,128,4,2048,512,16,64,128,32,4,3,12.034,3
w13,2,128,4,2048,512,16,64,128,64,4,3,12.076666666666668,3
w13,2,128,4,2048,512,16,128,64,1,8,3,11.96,3
w13,2,128,4,2048,512,16,128,64,1,8,4,12.023666666666665,3
w13,2,128,6,4096,2048,16,64,128,1,4,3,118.89333333333333,3
w13,2,128,6,4096,2048,16,64,128,16,8,5,120.06633333333333,3
w13,2,128,6,4096,2048,16,64,128,32,4,4,120.07733333333333,3
w13,2,128,8,2048,768,16,32,64,1,4,3,32.86633333333333,3
w13,2,128,8,2048,768,16,32,64,32,4,3,32.88733333333334,3
w13,2,128,8,2048,768,16,64,64,1,4,3,32.88766666666667,3
w13,2,128,8,2048,768,16,64,64,1,4,4,32.802,3
w13,2,128,8,2048,768,16,64,64,16,4,3,32.69533333333334,3
w13,2,128,8,2048,768,16,64,64,64,4,3,32.685,3
w13,2,128,8,2048,768,16,64,128,16,4,2,32.77033333333333,3
w13,2,128,8,2048,768,16,64,128,64,4,2,32.802,3
w13,2,128,8,4096,1536,16,32,128,4,4,5,120.43933333333332,3
w13,2,128,8,4096,1536,16,32,128,16,4,5,120.557,3
w13,2,128,8,4096,1536,16,32,128,32,4,5,120.15166666666666,3
w13,2,128,8,4096,1536,16,32,128,64,4,5,119.70400000000001,3
w13,2,128,8,4096,1536,16,64,128,1,4,3,120.50366666666667,3
w13,2,128,8,4096,1536,16,64,128,1,4,4,120.74933333333333,3
w13,2,128,8,4096,1536,16,64,128,16,4,3,120.14066666666668,3
w13,2,128,8,4096,1536,16,64,128,16,4,4,120.88799999999999,3
w13,2,128,8,4096,1536,16,64,128,32,4,4,120.37599999999999,3
w13,2,128,8,4096,1536,16,64,128,32,4,5,119.96,3
w13,2,128,8,4096,1536,16,64,128,32,8,5,120.80266666666667,3
w13,2,128,8,4096,1536,16,64,128,64,4,4,120.52533333333334,3
w13,2,128,8,4096,1536,16,64,128,64,4,5,120.54633333333334,3
w13,2,128,8,4096,1536,16,64,128,64,8,5,120.56766666666668,3
w13,2,128,8,4096,3072,16,32,128,16,4,4,227.03233333333333,3
w13,2,128,8,4096,3072,16,32,128,32,4,4,226.72299999999998,3
w13,2,128,8,4096,3072,16,32,128,64,4,4,226.41333333333333,3
w13,2,128,8,4096,3072,16,64,128,1,4,4,226.23233333333334,3
w13,2,128,8,4096,3072,16,64,128,16,4,4,225.14433333333332,3
w13,2,128,8,4096,3072,16,64,128,16,8,3,225.82666666666668,3
w13,2,128,8,4096,3072,16,64,128,16,8,4,227.20266666666666,3
w13,2,128,8,4096,3072,16,64,128,32,4,4,225.05866666666665,3
w13,2,128,8,4096,3072,16,64,128,32,8,3,225.93366666666665,3
w13,2,128,8,4096,3072,16,64,128,32,8,4,226.63733333333334,3
w13,2,128,8,4096,3072,16,64,128,64,4,4,225.187,3
w13,2,128,8,4096,3072,16,64,128,64,8,3,226.136,3
w13,2,128,8,4096,3072,16,128,128,16,8,3,227.09633333333332,3
w13,4,8,2,1024,512,16,128,64,1,8,3,6.967666666666666,3
w13,4,8,2,1024,512,16,128,64,1,8,4,7.010000000000001,3
w13,4,16,2,1536,768,16,32,128,1,4,3,12.716666666666667,3
w13,4,16,2,1536,768,16,32,128,1,4,4,12.738,3
w13,4,16,2,1536,768,16,32,128,4,4,4,12.716666666666667,3
w13,4,16,2,1536,768,16,32,128,16,4,3,12.748666666666665,3
w13,4,16,2,1536,768,16,32,128,16,4,4,12.759333333333332,3
w13,4,16,2,1536,768,16,32,128,32,4,3,12.695666666666668,3
w13,4,16,2,1536,768,16,32,128,32,4,4,12.738,3
w13,4,16,2,1536,768,16,32,128,64,4,3,12.684666666666667,3
w13,4,16,2,1536,768,16,32,128,64,4,4,12.705999999999998,3
w13,4,16,4,1536,1024,16,64,64,1,4,3,32.492666666666665,3
w13,4,16,4,1536,1024,16,64,64,32,4,3,32.39666666666667,3
w13,4,16,4,1536,1024,16,64,64,64,4,3,32.386,3
w13,4,32,4,2048,768,16,64,64,1,4,3,32.183,3
w13,4,32,4,2048,768,16,64,64,16,4,3,32.119,3
w13,4,32,4,2048,768,16,64,64,32,4,3,32.08733333333333,3
w13,4,32,6,3072,1024,16,64,128,1,4,3,88.96233333333333,3
w13,4,32,6,3072,1024,16,64,128,16,4,3,89.14366666666666,3
w13,4,32,6,3072,1024,16,64,128,32,4,3,88.51400000000001,3
w13,4,32,6,3072,1024,16,64,128,64,4,3,88.63166666666666,3
w13,4,60,4,2048,1408,16,64,128,1,4,3,55.681999999999995,3
w13,4,60,4,2048,1408,16,64,128,16,4,3,55.864,3
w13,4,60,4,2048,1408,16,64,128,32,4,3,55.821,3
w13,4,60,4,2048,1408,16,64,128,64,4,3,55.970333333333336,3
w13,4,60,6,3584,2304,16,128,128,1,8,3,222.16133333333335,3
w13,4,60,6,3584,2304,16,128,128,1,8,4,224.09233333333336,3
w13,4,60,6,3584,2304,16,128,128,16,4,3,223.65466666666666,3
w13,4,60,6,3584,2304,16,128,128,16,8,3,222.4813333333333,3
w13,4,60,6,3584,2304,16,128,128,32,8,3,223.01500000000001,3
w13,4,60,6,3584,2304,16,128,128,64,8,3,222.16066666666666,3
w13,4,60,6,3584,2304,16,128,128,64,8,4,224.25266666666667,3
w13,4,60,8,2048,1536,16,64,128,1,4,2,117.11166666666668,3
w13,4,60,8,2048,1536,16,64,128,1,4,3,116.05533333333334,3
w13,4,60,8,2048,1536,16,64,128,1,4,4,116.36533333333334,3
w13,4,60,8,2048,1536,16,64,128,16,4,2,116.88766666666668,3
w13,4,60,8,2048,1536,16,64,128,16,4,3,117.03733333333332,3
w13,4,60,8,2048,1536,16,64,128,16,4,4,116.85533333333335,3
w13,4,60,8,2048,1536,16,64,128,32,4,3,116.45033333333333,3
w13,4,60,8,2048,1536,16,64,128,64,4,2,117.12233333333334,3
w13,4,60,8,2048,1536,16,64,128,64,4,3,116.589,3
w13,4,60,8,2048,1536,16,128,128,1,8,4,116.62133333333333,3
w13,4,60,8,2048,1536,16,128,128,16,8,4,117.048,3
w13,4,60,8,2048,1536,16,128,128,64,8,4,117.09033333333333,3
w13,4,64,6,3072,2048,16,64,128,1,4,3,171.98233333333334,3
w13,4,64,6,3072,2048,16,64,128,1,4,4,173.263,3
w13,4,64,6,3072,2048,16,64,128,16,4,3,172.09933333333333,3
w13,4,64,6,3072,2048,16,64,128,32,4,3,171.53366666666668,3
w13,4,64,6,3072,2048,16,64,128,64,4,3,172.04566666666665,3
w13,4,64,6,3072,2048,16,128,128,1,8,4,172.4416666666667,3
w13,4,64,6,3072,2048,16,128,128,16,8,4,172.7296666666667,3
w13,4,64,6,3072,2048,16,128,128,32,8,4,172.63333333333333,3
w13,4,64,6,3072,2048,16,128,128,64,8,4,172.12066666666666,3
w13,4,64,6,3584,1536,16,64,128,1,4,3,150.45833333333334,3
w13,4,64,6,3584,1536,16,64,128,16,4,3,151.109,3
w13,4,64,6,3584,1536,16,64,128,16,4,4,151.792,3
w13,4,64,6,3584,1536,16,64,128,32,4,3,151.52566666666667,3
w13,4,64,6,3584,1536,16,64,128,64,4,3,151.38666666666666,3
w13,4,64,8,3584,2560,16,64,128,1,4,3,324.41900000000004,3
w13,4,64,8,3584,2560,16,64,128,1,4,4,326.60633333333334,3
w13,4,64,8,3584,2560,16,64,128,16,4,3,327.5656666666667,3
w13,4,64,8,3584,2560,16,64,128,32,4,3,327.48133333333334,3
w13,4,64,8,3584,2560,16,64,128,64,4,3,325.987,3
w13,4,64,8,3584,2560,16,64,128,64,4,4,327.6943333333333,3
w13,4,64,8,3584,2560,16,128,128,16,8,4,326.7343333333333,3
w13,4,128,4,2048,512,16,32,128,1,4,3,22.807333333333332,3
w13,4,128,4,2048,512,16,32,128,16,4,3,22.807000000000002,3
w13,4,128,4,2048,512,16,32,128,64,4,3,22.668666666666667,3
w13,4,128,4,2048,512,16,128,64,1,8,5,22.87166666666667,3
w13,4,128,6,4096,2048,16,64,128,1,4,4,225.68200000000002,3
w13,4,128,6,4096,2048,16,64,128,16,4,4,224.658,3
w13,4,128,6,4096,2048,16,64,128,32,4,4,224.914,3
w13,4,128,6,4096,2048,16,64,128,64,4,4,224.82833333333335,3
w13,4,128,6,4096,2048,16,64,128,64,8,3,226.55666666666664,3
w13,4,128,8,2048,768,16,32,128,1,4,4,61.74533333333333,3
w13,4,128,8,2048,768,16,64,128,1,4,3,61.32966666666667,3
w13,4,128,8,2048,768,16,64,128,16,4,3,61.23266666666667,3
w13,4,128,8,2048,768,16,64,128,32,4,3,61.24366666666666,3
w13,4,128,8,2048,768,16,64,128,64,4,3,61.468333333333334,3
w13,4,128,8,4096,1536,16,32,128,32,4,4,226.29633333333334,3
w13,4,128,8,4096,1536,16,64,128,1,4,4,226.5523333333333,3
w13,4,128,8,4096,1536,16,64,128,32,4,4,225.05866666666665,3
w13,4,128,8,4096,1536,16,64,128,32,8,3,226.81866666666667,3
w13,4,128,8,4096,1536,16,64,128,64,4,4,226.24266666666665,3
w13,4,128,8,4096,1536,16,64,128,64,8,3,226.48833333333334,3
w13,4,128,8,4096,3072,16,32,128,16,4,4,439.90599999999995,3
w13,4,128,8,4096,3072,16,64,128,16,4,3,440.09799999999996,3
w13,4,128,8,4096,3072,16,64,128,16,4,4,438.26433333333335,3
w13,4,128,8,4096,3072,16,64,128,16,8,4,439.5333333333333,3
w13,4,128,8,4096,3072,16,64,128,32,4,4,439.7673333333334,3
w13,4,128,8,4096,3072,16,64,128,32,8,4,440.876,3
w13,4,128,8,4096,3072,16,64,128,64,4,4,439.789,3
w13,4,128,8,4096,3072,16,128,128,16,8,4,436.633,3
w13,4,128,8,4096,3072,16,128,128,32,8,4,439.906,3
w13,8,8,2,1024,512,16,128,64,1,8,3,6.956666666666666,3
w13,8,8,2,1024,512,16,128,64,1,8,4,6.967333333333333,3
w13,8,16,2,1536,768,16,64,64,1,4,4,25.17533333333333,3
w13,8,16,4,1536,1024,16,64,64,1,4,3,32.215333333333334,3
w13,8,32,4,2048,768,16,64,128,1,4,3,60.60933333333333,3
w13,8,32,4,2048,768,16,64,128,16,4,3,60.907999999999994,3
w13,8,32,4,2048,768,16,64,128,64,4,3,60.823,3
w13,8,32,6,3072,1024,16,32,128,1,4,3,119.48033333333332,3
w13,8,32,6,3072,1024,16,32,128,4,4,3,118.50866666666667,3
w13,8,32,6,3072,1024,16,32,128,16,4,3,119.03133333333334,3
w13,8,32,6,3072,1024,16,32,128,32,4,3,118.66866666666665,3
w13,8,32,6,3072,1024,16,32,128,64,4,3,119.25566666666667,3
w13,8,32,6,3072,1024,16,64,128,1,4,3,119.68266666666666,3
w13,8,32,6,3072,1024,16,64,128,16,4,3,119.106,3
w13,8,32,6,3072,1024,16,64,128,32,4,3,119.43733333333334,3
w13,8,32,6,3072,1024,16,64,128,64,4,2,119.53333333333335,3
w13,8,32,6,3072,1024,16,64,128,64,4,3,119.67233333333333,3
w13,8,32,6,3072,1024,16,128,128,1,8,4,119.51133333333333,3
w13,8,32,6,3072,1024,16,128,128,16,8,4,119.39433333333334,3
w13,8,32,6,3072,1024,16,128,128,32,8,4,119.23466666666667,3
w13,8,60,4,2048,1408,16,64,128,1,4,3,106.221,3
w13,8,60,4,2048,1408,16,64,128,16,4,3,106.91433333333333,3
w13,8,60,4,2048,1408,16,64,128,64,4,3,106.76566666666668,3
w13,8,60,4,2048,1408,16,128,128,1,8,4,107.28766666666667,3
w13,8,60,6,3584,2304,16,32,128,1,4,4,438.3926666666666,3
w13,8,60,6,3584,2304,16,32,128,32,4,4,439.66266666666667,3
w13,8,60,6,3584,2304,16,64,128,1,4,3,435.37466666666666,3
w13,8,60,6,3584,2304,16,64,128,1,4,4,435.684,3
w13,8,60,6,3584,2304,16,64,128,16,4,3,435.80133333333333,3
w13,8,60,6,3584,2304,16,64,128,16,4,4,436.6116666666667,3
w13,8,60,6,3584,2304,16,64,128,32,4,3,436.4626666666666,3
w13,8,60,6,3584,2304,16,64,128,32,4,4,437.11266666666666,3
w13,8,60,6,3584,2304,16,64,128,64,4,3,435.33166666666665,3
w13,8,60,6,3584,2304,16,64,128,64,4,4,438.44666666666666,3
w13,8,60,6,3584,2304,16,128,128,1,8,4,435.8546666666667,3
w13,8,60,6,3584,2304,16,128,128,16,4,4,439.1186666666667,3
w13,8,60,6,3584,2304,16,128,128,16,8,3,438.4786666666667,3
w13,8,60,6,3584,2304,16,128,128,16,8,4,436.18533333333335,3
w13,8,60,6,3584,2304,16,128,128,32,4,4,439.52399999999994,3
w13,8,60,6,3584,2304,16,128,128,32,8,3,438.3183333333333,3
w13,8,60,6,3584,2304,16,128,128,32,8,4,436.537,3
w13,8,60,6,3584,2304,16,128,128,64,4,4,439.65166666666664,3
w13,8,60,6,3584,2304,16,128,128,64,8,3,438.724,3
w13,8,60,6,3584,2304,16,128,128,64,8,4,436.2706666666666,3
w13,8,60,8,2048,1536,16,64,128,1,4,3,207.77866666666668,3
w13,8,60,8,2048,1536,16,64,128,16,4,3,209.112,3
w13,8,60,8,2048,1536,16,128,128,1,8,3,207.26699999999997,3
w13,8,64,6,3072,2048,16,32,128,1,4,3,335.04366666666664,3
w13,8,64,6,3072,2048,16,64,128,1,4,3,333.74233333333336,3
w13,8,64,6,3072,2048,16,64,128,1,4,4,333.42266666666666,3
w13,8,64,6,3072,2048,16,64,128,16,4,3,334.63866666666667,3
w13,8,64,6,3072,2048,16,64,128,16,4,4,334.201,3
w13,8,64,6,3072,2048,16,64,128,32,4,3,333.966,3
w13,8,64,6,3072,2048,16,64,128,32,4,4,333.57099999999997,3
w13,8,64,6,3072,2048,16,64,128,64,4,4,334.63866666666667,3
w13,8,64,6,3072,2048,16,128,128,1,8,3,332.185,3
w13,8,64,6,3072,2048,16,128,128,1,8,4,333.86966666666666,3
w13,8,64,6,3072,2048,16,128,128,16,8,3,333.19800000000004,3
w13,8,64,6,3072,2048,16,128,128,16,8,4,335.45933333333335,3
w13,8,64,6,3072,2048,16,128,128,32,4,3,335.07599999999996,3
w13,8,64,6,3072,2048,16,128,128,32,8,3,332.388,3
w13,8,64,6,3072,2048,16,128,128,32,8,4,335.06533333333334,3
w13,8,64,6,3072,2048,16,128,128,64,8,3,332.974,3
w13,8,64,6,3584,1536,16,32,128,1,4,4,296.88866666666667,3
w13,8,64,6,3584,1536,16,32,128,4,4,4,297.82733333333334,3
w13,8,64,6,3584,1536,16,32,128,16,4,4,298.65933333333334,3
w13,8,64,6,3584,1536,16,32,128,64,4,4,298.4886666666667,3
w13,8,64,6,3584,1536,16,64,128,1,4,3,296.963,3
w13,8,64,6,3584,1536,16,64,128,1,4,4,296.0783333333334,3
w13,8,64,6,3584,1536,16,64,128,16,4,3,297.753,3
w13,8,64,6,3584,1536,16,64,128,16,4,4,297.1766666666667,3
w13,8,64,6,3584,1536,16,64,128,32,4,3,297.05899999999997,3
w13,8,64,6,3584,1536,16,64,128,32,4,4,297.646,3
w13,8,64,6,3584,1536,16,64,128,64,4,3,297.955,3
w13,8,64,6,3584,1536,16,64,128,64,4,4,297.17633333333333,3
w13,8,64,6,3584,1536,16,128,128,1,4,3,297.8483333333333,3
w13,8,64,6,3584,1536,16,128,128,1,8,3,295.939,3
w13,8,64,6,3584,1536,16,128,128,1,8,4,296.9633333333333,3
w13,8,64,6,3584,1536,16,128,128,16,4,3,298.44599999999997,3
w13,8,64,6,3584,1536,16,128,128,16,8,3,297.9873333333333,3
w13,8,64,6,3584,1536,16,128,128,16,8,4,296.34433333333334,3
w13,8,64,6,3584,1536,16,128,128,32,4,3,298.702,3
w13,8,64,6,3584,1536,16,128,128,32,8,3,297.52833333333336,3
w13,8,64,6,3584,1536,16,128,128,32,8,4,298.08366666666666,3
w13,8,64,6,3584,1536,16,128,128,64,8,3,298.755,3
w13,8,64,6,3584,1536,16,128,128,64,8,4,296.74966666666666,3
w13,8,64,8,3584,2560,16,32,128,1,4,3,644.9753333333333,3
w13,8,64,8,3584,2560,16,32,128,1,4,4,641.669,3
w13,8,64,8,3584,2560,16,32,128,4,4,3,643.9623333333334,3
w13,8,64,8,3584,2560,16,32,128,4,4,4,643.5993333333333,3
w13,8,64,8,3584,2560,16,32,128,64,4,3,643.6956666666666,3
w13,8,64,8,3584,2560,16,64,128,1,4,3,639.5573333333333,3
w13,8,64,8,3584,2560,16,64,128,1,4,4,640.1436666666667,3
w13,8,64,8,3584,2560,16,64,128,16,4,3,640.709,3
w13,8,64,8,3584,2560,16,64,128,16,4,4,643.1943333333334,3
w13,8,64,8,3584,2560,16,64,128,32,4,3,641.3703333333333,3
w13,8,64,8,3584,2560,16,64,128,32,4,4,644.4746666666666,3
w13,8,64,8,3584,2560,16,64,128,64,4,3,639.1306666666666,3
w13,8,64,8,3584,2560,16,128,128,1,4,3,643.2056666666666,3
w13,8,64,8,3584,2560,16,128,128,1,4,4,642.341,3
w13,8,64,8,3584,2560,16,128,128,1,8,3,638.906,3
w13,8,64,8,3584,2560,16,128,128,1,8,4,639.44,3
w13,8,64,8,3584,2560,16,128,128,16,4,3,645.317,3
w13,8,64,8,3584,2560,16,128,128,16,4,4,645.2743333333334,3
w13,8,64,8,3584,2560,16,128,128,16,8,3,640.8906666666667,3
w13,8,64,8,3584,2560,16,128,128,16,8,4,641.2959999999999,3
w13,8,64,8,3584,2560,16,128,128,32,4,3,645.349,3
w13,8,64,8,3584,2560,16,128,128,32,8,3,641.5836666666667,3
w13,8,64,8,3584,2560,16,128,128,32,8,4,641.5196666666667,3
w13,8,64,8,3584,2560,16,128,128,64,4,3,643.7386666666666,3
w13,8,64,8,3584,2560,16,128,128,64,4,4,644.4316666666667,3
w13,8,64,8,3584,2560,16,128,128,64,8,3,640.5706666666666,3
w13,8,64,8,3584,2560,16,128,128,64,8,4,641.2636666666667,3
w13,8,128,4,2048,512,16,64,64,1,4,3,42.082,3
w13,8,128,4,2048,512,16,64,64,16,4,3,42.11433333333333,3
w13,8,128,4,2048,512,16,64,128,1,4,2,42.01833333333334,3
w13,8,128,4,2048,512,16,64,128,16,4,2,41.86866666666666,3
w13,8,128,4,2048,512,16,64,128,32,4,2,41.97533333333333,3
w13,8,128,4,2048,512,16,64,128,64,4,2,41.73,3
w13,8,128,4,2048,512,16,128,64,1,8,3,42.00733333333333,3
w13,8,128,6,4096,2048,16,32,128,16,4,4,442.31866666666673,3
w13,8,128,6,4096,2048,16,32,128,32,4,4,442.44666666666666,3
w13,8,128,6,4096,2048,16,32,128,64,4,4,442.9693333333333,3
w13,8,128,6,4096,2048,16,64,128,1,4,4,442.1586666666667,3
w13,8,128,6,4096,2048,16,64,128,16,4,3,441.337,3
w13,8,128,6,4096,2048,16,64,128,16,4,4,439.71599999999995,3
w13,8,128,6,4096,2048,16,64,128,16,8,4,441.796,3
w13,8,128,6,4096,2048,16,64,128,32,4,3,442.9683333333333,3
w13,8,128,6,4096,2048,16,64,128,32,4,4,441.25199999999995,3
w13,8,128,6,4096,2048,16,64,128,32,8,4,442.436,3
w13,8,128,6,4096,2048,16,64,128,64,4,3,443.13899999999995,3
w13,8,128,6,4096,2048,16,64,128,64,4,4,439.8113333333333,3
w13,8,128,6,4096,2048,16,64,128,64,8,4,442.7666666666667,3
w13,8,128,6,4096,2048,16,128,128,16,8,4,438.71299999999997,3
w13,8,128,6,4096,2048,16,128,128,32,8,4,440.355,3
w13,8,128,8,2048,768,16,64,128,1,4,3,115.79533333333335,3
w13,8,128,8,2048,768,16,64,128,1,4,4,116.39266666666667,3
w13,8,128,8,2048,768,16,64,128,16,4,3,116.69166666666666,3
w13,8,128,8,2048,768,16,64,128,16,4,4,116.68033333333334,3
w13,8,128,8,2048,768,16,128,128,1,8,3,116.243,3
w13,8,128,8,2048,768,16,128,128,1,8,4,115.76366666666667,3
w13,8,128,8,4096,1536,16,32,128,16,4,4,441.5613333333333,3
w13,8,128,8,4096,1536,16,32,128,32,4,4,441.44399999999996,3
w13,8,128,8,4096,1536,16,64,128,1,4,4,443.89633333333336,3
w13,8,128,8,4096,1536,16,64,128,16,4,3,441.326,3
w13,8,128,8,4096,1536,16,64,128,16,4,4,441.47599999999994,3
w13,8,128,8,4096,1536,16,64,128,16,8,4,442.8733333333334,3
w13,8,128,8,4096,1536,16,64,128,32,4,3,441.6786666666667,3
w13,8,128,8,4096,1536,16,64,128,32,4,4,440.7393333333334,3
w13,8,128,8,4096,1536,16,64,128,32,8,4,441.7426666666667,3
w13,8,128,8,4096,1536,16,64,128,64,4,4,441.9343333333333,3
w13,8,128,8,4096,1536,16,128,128,16,8,4,439.4703333333334,3
w13,8,128,8,4096,1536,16,128,128,32,8,4,443.80033333333336,3
w13,8,128,8,4096,1536,16,128,128,64,8,3,443.31033333333335,3
w13,8,128,8,4096,1536,16,128,128,64,8,4,442.1263333333333,3
w13,8,128,8,4096,3072,16,32,128,4,4,3,874.7683333333334,3
w13,8,128,8,4096,3072,16,32,128,4,4,4,870.5443333333333,3
w13,8,128,8,4096,3072,16,32,128,16,4,3,872.3683333333333,3
w13,8,128,8,4096,3072,16,32,128,16,4,4,868.3470000000001,3
w13,8,128,8,4096,3072,16,32,128,32,4,3,875.7496666666666,3
w13,8,128,8,4096,3072,16,32,128,32,4,4,874.1713333333333,3
w13,8,128,8,4096,3072,16,32,128,64,4,3,875.59,3
w13,8,128,8,4096,3072,16,64,128,1,4,3,874.2773333333334,3
w13,8,128,8,4096,3072,16,64,128,1,4,4,874.1170000000001,3
w13,8,128,8,4096,3072,16,64,128,16,4,3,869.8186666666667,3
w13,8,128,8,4096,3072,16,64,128,16,4,4,867.6,3
w13,8,128,8,4096,3072,16,64,128,16,8,3,873.3286666666667,3
w13,8,128,8,4096,3072,16,64,128,16,8,4,871.494,3
w13,8,128,8,4096,3072,16,64,128,32,4,3,872.5713333333333,3
w13,8,128,8,4096,3072,16,64,128,32,4,4,870.3100000000001,3
w13,8,128,8,4096,3072,16,64,128,32,8,4,872.5173333333333,3
w13,8,128,8,4096,3072,16,64,128,64,4,3,873.8716666666666,3
w13,8,128,8,4096,3072,16,64,128,64,4,4,872.8486666666666,3
w13,8,128,8,4096,3072,16,128,128,16,4,3,868.4323333333333,3
w13,8,128,8,4096,3072,16,128,128,16,4,4,871.91,3
w13,8,128,8,4096,3072,16,128,128,16,8,3,869.3710000000001,3
w13,8,128,8,4096,3072,16,128,128,16,8,4,867.7283333333334,3
w13,8,128,8,4096,3072,16,128,128,32,4,3,872.3789999999999,3
w13,8,128,8,4096,3072,16,128,128,32,4,4,873.6486666666666,3
w13,8,128,8,4096,3072,16,128,128,32,8,3,871.2379999999999,3
w13,8,128,8,4096,3072,16,128,128,32,8,4,870.9383333333334,3
w13,8,128,8,4096,3072,16,128,128,64,4,3,876.2076666666667,3
w13,8,128,8,4096,3072,16,128,128,64,8,3,874.7040000000001,3
w13,8,128,8,4096,3072,16,128,128,64,8,4,874.918,3
w13,16,8,2,1024,512,16,128,64,1,8,3,6.977999999999999,3
w13,16,16,2,1536,768,16,64,64,1,4,4,25.09,3
w13,16,16,4,1536,1024,16,64,64,1,4,3,32.877,3
w13,16,16,4,1536,1024,16,64,64,16,4,3,33.01533333333334,3
w13,16,16,4,1536,1024,16,64,64,32,4,3,33.047333333333334,3
w13,16,16,4,1536,1024,16,64,128,1,4,2,33.122,3
w13,16,16,4,1536,1024,16,64,128,16,4,2,32.812999999999995,3
w13,16,16,4,1536,1024,16,64,128,32,4,2,33.07933333333333,3
w13,16,32,4,2048,768,16,64,128,1,4,3,61.46333333333333,3
w13,16,32,4,2048,768,16,64,128,16,4,3,61.901,3
w13,16,32,4,2048,768,16,64,128,32,4,3,61.34633333333333,3
w13,16,32,4,2048,768,16,64,128,64,4,3,61.87966666666667,3
w13,16,32,6,3072,1024,16,32,128,1,4,3,119.02066666666667,3
w13,16,32,6,3072,1024,16,32,128,4,4,3,119.72533333333332,3
w13,16,32,6,3072,1024,16,32,128,16,4,3,118.59433333333334,3
w13,16,32,6,3072,1024,16,32,128,32,4,3,119.117,3
w13,16,32,6,3072,1024,16,64,128,32,4,2,119.73599999999999,3
w13,16,32,6,3072,1024,16,64,128,32,4,3,119.384,3
w13,16,32,6,3072,1024,16,64,128,64,4,2,119.448,3
w13,16,32,6,3072,1024,16,64,128,64,4,3,119.71466666666667,3
w13,16,32,6,3072,1024,16,128,128,32,8,4,119.19133333333333,3
w13,16,60,4,2048,1408,16,64,128,1,4,3,190.67999999999998,3
w13,16,60,4,2048,1408,16,64,128,1,4,4,192.131,3
w13,16,60,4,2048,1408,16,64,128,16,4,4,192.55700000000002,3
w13,16,60,4,2048,1408,16,128,128,1,8,3,191.33066666666664,3
w13,16,60,4,2048,1408,16,128,128,1,8,4,192.0666666666667,3
w13,16,60,6,3584,2304,16,32,128,1,4,4,545.2093333333333,3
w13,16,60,6,3584,2304,16,32,128,16,4,4,544.7189999999999,3
w13,16,60,6,3584,2304,16,64,128,1,4,3,544.602,3
w13,16,60,6,3584,2304,16,64,128,16,4,3,542.6183333333333,3
w13,16,60,6,3584,2304,16,64,128,32,4,3,541.2413333333333,3
w13,16,60,6,3584,2304,16,64,128,64,4,3,541.8926666666666,3
w13,16,60,6,3584,2304,16,128,128,1,4,3,543.7056666666666,3
w13,16,60,6,3584,2304,16,128,128,1,8,3,541.103,3
w13,16,60,6,3584,2304,16,128,128,1,8,4,541.8069999999999,3
w13,16,60,6,3584,2304,16,128,128,16,4,3,542.7563333333333,3
w13,16,60,6,3584,2304,16,128,128,16,8,3,540.6226666666666,3
w13,16,60,6,3584,2304,16,128,128,16,8,4,541.9563333333334,3
w13,16,60,6,3584,2304,16,128,128,32,4,3,543.2786666666666,3
w13,16,60,6,3584,2304,16,128,128,32,8,3,541.8919999999999,3
w13,16,60,6,3584,2304,16,128,128,32,8,4,542.81,3
w13,16,60,6,3584,2304,16,128,128,64,4,3,545.3273333333333,3
w13,16,60,6,3584,2304,16,128,128,64,8,3,544.9113333333333,3
w13,16,60,6,3584,2304,16,128,128,64,8,4,543.535,3
w13,16,60,8,2048,1536,16,64,128,1,4,3,209.05866666666668,3
w13,16,60,8,2048,1536,16,128,128,1,8,3,208.07766666666666,3
w13,16,60,8,2048,1536,16,128,128,1,8,4,210.179,3
w13,16,60,8,2048,1536,16,128,128,32,8,3,210.12566666666666,3
w13,16,64,6,3072,2048,16,32,128,1,4,3,443.6946666666667,3
w13,16,64,6,3072,2048,16,32,128,1,4,4,445.23066666666665,3
w13,16,64,6,3072,2048,16,32,128,4,4,3,445.02833333333336,3
w13,16,64,6,3072,2048,16,32,128,4,4,4,445.63633333333337,3
w13,16,64,6,3072,2048,16,32,128,16,4,4,445.4866666666667,3
w13,16,64,6,3072,2048,16,32,128,32,4,3,443.4493333333333,3
w13,16,64,6,3072,2048,16,32,128,32,4,4,445.167,3
w13,16,64,6,3072,2048,16,64,128,1,4,3,443.8866666666667,3
w13,16,64,6,3072,2048,16,64,128,1,4,4,441.6893333333333,3
w13,16,64,6,3072,2048,16,64,128,16,4,3,442.07366666666667,3
w13,16,64,6,3072,2048,16,64,128,16,4,4,443.5133333333333,3
w13,16,64,6,3072,2048,16,64,128,32,4,3,442.692,3
w13,16,64,6,3072,2048,16,64,128,32,4,4,443.38533333333334,3
w13,16,64,6,3072,2048,16,64,128,64,4,3,442.5753333333334,3
w13,16,64,6,3072,2048,16,64,128,64,4,4,445.18800000000005,3
w13,16,64,6,3072,2048,16,128,128,1,4,3,444.98533333333336,3
w13,16,64,6,3072,2048,16,128,128,1,4,4,444.76133333333337,3
w13,16,64,6,3072,2048,16,128,128,1,8,3,441.9883333333333,3
w13,16,64,6,3072,2048,16,128,128,1,8,4,441.46566666666666,3
w13,16,64,6,3072,2048,16,128,128,16,4,3,443.9083333333333,3
w13,16,64,6,3072,2048,16,128,128,16,4,4,445.7746666666667,3
w13,16,64,6,3072,2048,16,128,128,16,8,3,442.02,3
w13,16,64,6,3072,2048,16,128,128,16,8,4,442.47866666666664,3
w13,16,64,6,3072,2048,16,128,128,32,4,3,445.32666666666665,3
w13,16,64,6,3072,2048,16,128,128,32,4,4,445.57199999999995,3
w13,16,64,6,3072,2048,16,128,128,32,8,3,442.52133333333336,3
w13,16,64,6,3072,2048,16,128,128,32,8,4,442.52133333333336,3
w13,16,64,6,3072,2048,16,128,128,64,8,3,441.69,3
w13,16,64,6,3072,2048,16,128,128,64,8,4,443.7373333333333,3
w13,16,64,6,3584,1536,16,32,128,1,4,3,392.06766666666664,3
w13,16,64,6,3584,1536,16,32,128,1,4,4,391.0973333333333,3
w13,16,64,6,3584,1536,16,64,128,1,4,3,390.0406666666667,3
w13,16,64,6,3584,1536,16,64,128,1,4,4,389.07033333333334,3
w13,16,64,6,3584,1536,16,64,128,16,4,3,388.51533333333333,3
w13,16,64,6,3584,1536,16,64,128,16,4,4,390.61733333333336,3
w13,16,64,6,3584,1536,16,64,128,32,4,3,389.8163333333334,3
w13,16,64,6,3584,1536,16,64,128,32,4,4,390.73466666666667,3
w13,16,64,6,3584,1536,16,128,128,1,4,3,392.18533333333335,3
w13,16,64,6,3584,1536,16,128,128,1,8,3,388.78266666666667,3
w13,16,64,6,3584,1536,16,128,128,1,8,4,390.40366666666665,3
w13,16,64,6,3584,1536,16,128,128,16,4,3,391.04400000000004,3
w13,16,64,6,3584,1536,16,128,128,16,8,3,389.4653333333333,3
w13,16,64,6,3584,1536,16,128,128,16,8,4,390.83,3
w13,16,64,6,3584,1536,16,128,128,32,4,3,392.132,3
w13,16,64,6,3584,1536,16,128,128,32,8,3,388.2803333333333,3
w13,16,64,6,3584,1536,16,128,128,32,8,4,391.67233333333337,3
w13,16,64,6,3584,1536,16,128,128,64,4,3,391.74800000000005,3
w13,16,64,6,3584,1536,16,128,128,64,8,3,390.36133333333333,3
w13,16,64,8,3584,2560,16,32,128,1,4,3,644.0156666666667,3
w13,16,64,8,3584,2560,16,32,128,1,4,4,643.7916666666666,3
w13,16,64,8,3584,2560,16,32,128,4,4,4,644.773,3
w13,16,64,8,3584,2560,16,32,128,16,4,4,645.3493333333333,3
w13,16,64,8,3584,2560,16,32,128,32,4,4,645.8186666666667,3
w13,16,64,8,3584,2560,16,64,128,1,4,3,639.845,3
w13,16,64,8,3584,2560,16,64,128,1,4,4,642.1596666666667,3
w13,16,64,8,3584,2560,16,64,128,16,4,3,642.2666666666668,3
w13,16,64,8,3584,2560,16,64,128,32,4,3,642.3413333333333,3
w13,16,64,8,3584,2560,16,64,128,32,4,4,645.573,3
w13,16,64,8,3584,2560,16,64,128,64,4,3,641.3703333333333,3
w13,16,64,8,3584,2560,16,128,128,1,4,3,644.624,3
w13,16,64,8,3584,2560,16,128,128,1,4,4,643.269,3
w13,16,64,8,3584,2560,16,128,128,1,8,3,641.4023333333333,3
w13,16,64,8,3584,2560,16,128,128,1,8,4,640.1436666666667,3
w13,16,64,8,3584,2560,16,128,128,16,4,3,645.5943333333333,3
w13,16,64,8,3584,2560,16,128,128,16,4,4,645.9996666666667,3
w13,16,64,8,3584,2560,16,128,128,16,8,3,641.765,3
w13,16,64,8,3584,2560,16,128,128,16,8,4,642.8960000000001,3
w13,16,64,8,3584,2560,16,128,128,32,4,3,645.765,3
w13,16,64,8,3584,2560,16,128,128,32,4,4,646.128,3
w13,16,64,8,3584,2560,16,128,128,32,8,3,642.2663333333334,3
w13,16,64,8,3584,2560,16,128,128,32,8,4,644.3249999999999,3
w13,16,64,8,3584,2560,16,128,128,64,4,3,645.445,3
w13,16,64,8,3584,2560,16,128,128,64,8,3,642.7143333333333,3
w13,16,64,8,3584,2560,16,128,128,64,8,4,643.717,3
w13,16,128,4,2048,512,16,64,128,16,4,2,79.21333333333332,3
w13,16,128,4,2048,512,16,64,128,32,4,2,79.70333333333333,3
w13,16,128,4,2048,512,16,64,128,64,4,2,79.672,3
w13,16,128,6,4096,2048,16,32,128,16,4,3,875.973,3
w13,16,128,6,4096,2048,16,32,128,16,4,4,871.654,3
w13,16,128,6,4096,2048,16,32,128,32,4,4,873.3386666666667,3
w13,16,128,6,4096,2048,16,32,128,64,4,4,876.3786666666666,3
w13,16,128,6,4096,2048,16,64,128,1,4,4,875.0773333333333,3
w13,16,128,6,4096,2048,16,64,128,16,4,3,875.995,3
w13,16,128,6,4096,2048,16,64,128,16,4,4,868.3573333333334,3
w13,16,128,6,4096,2048,16,64,128,16,8,3,876.1439999999999,3
w13,16,128,6,4096,2048,16,64,128,16,8,4,871.0243333333334,3
w13,16,128,6,4096,2048,16,64,128,32,4,3,872.9440000000001,3
w13,16,128,6,4096,2048,16,64,128,32,4,4,869.4556666666667,3
w13,16,128,6,4096,2048,16,64,128,32,8,4,873.2646666666666,3
w13,16,128,6,4096,2048,16,64,128,64,4,4,872.5713333333333,3
w13,16,128,6,4096,2048,16,64,128,64,8,4,875.8983333333334,3
w13,16,128,6,4096,2048,16,128,128,1,8,4,876.8163333333333,3
w13,16,128,6,4096,2048,16,128,128,16,4,3,871.9200000000001,3
w13,16,128,6,4096,2048,16,128,128,16,4,4,872.016,3
w13,16,128,6,4096,2048,16,128,128,16,8,3,872.3036666666667,3
w13,16,128,6,4096,2048,16,128,128,16,8,4,870.2346666666666,3
w13,16,128,6,4096,2048,16,128,128,32,4,3,875.3873333333335,3
w13,16,128,6,4096,2048,16,128,128,32,4,4,875.5253333333334,3
w13,16,128,6,4096,2048,16,128,128,32,8,3,873.4673333333334,3
w13,16,128,6,4096,2048,16,128,128,32,8,4,871.9313333333333,3
w13,16,128,6,4096,2048,16,128,128,64,4,3,876.2403333333333,3
w13,16,128,6,4096,2048,16,128,128,64,4,4,876.6460000000001,3
w13,16,128,6,4096,2048,16,128,128,64,8,3,876.4753333333333,3
w13,16,128,6,4096,2048,16,128,128,64,8,4,873.9046666666667,3
w13,16,128,8,2048,768,16,64,128,1,4,3,221.78366666666668,3
w13,16,128,8,2048,768,16,64,128,1,4,4,222.179,3
w13,16,128,8,2048,768,16,64,128,64,4,3,222.29633333333334,3
w13,16,128,8,2048,768,16,128,128,1,8,3,220.34399999999997,3
w13,16,128,8,2048,768,16,128,128,1,8,4,222.56300000000002,3
w13,16,128,8,4096,1536,16,32,128,4,4,3,875.9846666666667,3
w13,16,128,8,4096,1536,16,32,128,4,4,4,870.2773333333333,3
w13,16,128,8,4096,1536,16,32,128,16,4,3,874.9493333333334,3
w13,16,128,8,4096,1536,16,32,128,16,4,4,873.4353333333333,3
w13,16,128,8,4096,1536,16,32,128,32,4,3,873.3706666666667,3
w13,16,128,8,4096,1536,16,32,128,32,4,4,871.9206666666665,3
w13,16,128,8,4096,1536,16,32,128,64,4,3,875.8879999999999,3
w13,16,128,8,4096,1536,16,32,128,64,4,4,874.587,3
w13,16,128,8,4096,1536,16,64,128,1,4,3,873.5633333333334,3
w13,16,128,8,4096,1536,16,64,128,1,4,4,875.5360000000001,3
w13,16,128,8,4096,1536,16,64,128,16,4,3,872.2403333333333,3
w13,16,128,8,4096,1536,16,64,128,16,4,4,867.9306666666666,3
w13,16,128,8,4096,1536,16,64,128,16,8,4,871.718,3
w13,16,128,8,4096,1536,16,64,128,32,4,3,872.0803333333333,3
w13,16,128,8,4096,1536,16,64,128,32,4,4,869.734,3
w13,16,128,8,4096,1536,16,64,128,32,8,4,871.6640000000001,3
w13,16,128,8,4096,1536,16,64,128,64,4,3,870.779,3
w13,16,128,8,4096,1536,16,64,128,64,4,4,871.44,3
w13,16,128,8,4096,1536,16,64,128,64,8,4,874.5866666666667,3
w13,16,128,8,4096,1536,16,128,128,1,8,4,875.6963333333333,3
w13,16,128,8,4096,1536,16,128,128,16,4,3,871.6326666666668,3
w13,16,128,8,4096,1536,16,128,128,16,4,4,873.9046666666667,3
w13,16,128,8,4096,1536,16,128,128,16,8,3,871.7496666666666,3
w13,16,128,8,4096,1536,16,128,128,16,8,4,869.509,3
w13,16,128,8,4096,1536,16,128,128,32,4,3,872.5713333333333,3
w13,16,128,8,4096,1536,16,128,128,32,4,4,873.4986666666667,3
w13,16,128,8,4096,1536,16,128,128,32,8,3,873.6060000000001,3
w13,16,128,8,4096,1536,16,128,128,32,8,4,872.0806666666667,3
w13,16,128,8,4096,1536,16,128,128,64,4,3,873.7873333333333,3
w13,16,128,8,4096,1536,16,128,128,64,4,4,874.9176666666666,3
w13,16,128,8,4096,1536,16,128,128,64,8,3,875.1846666666667,3
w13,16,128,8,4096,1536,16,128,128,64,8,4,871.6956666666666,3
w13,16,128,8,4096,3072,16,32,128,1,4,3,1742.9006666666667,3
w13,16,128,8,4096,3072,16,32,128,1,4,4,1738.57,3
w13,16,128,8,4096,3072,16,32,128,4,4,3,1731.5076666666666,3
w13,16,128,8,4096,3072,16,32,128,4,4,4,1727.4763333333333,3
w13,16,128,8,4096,3072,16,32,128,4,4,5,1743.0496666666666,3
w13,16,128,8,4096,3072,16,32,128,16,4,3,1726.6333333333332,3
w13,16,128,8,4096,3072,16,32,128,16,4,4,1726.0366666666669,3
w13,16,128,8,4096,3072,16,32,128,32,4,3,1732.287,3
w13,16,128,8,4096,3072,16,32,128,32,4,4,1730.4736666666668,3
w13,16,128,8,4096,3072,16,32,128,64,4,3,1735.402,3
w13,16,128,8,4096,3072,16,32,128,64,4,4,1739.0396666666666,3
w13,16,128,8,4096,3072,16,64,128,16,4,3,1730.6443333333334,3
w13,16,128,8,4096,3072,16,64,128,16,4,4,1736.49,3
w13,16,128,8,4096,3072,16,64,128,32,4,3,1733.727,3
w13,16,128,8,4096,3072,16,64,128,64,4,3,1736.362,3
w13,16,128,8,4096,3072,16,128,128,1,8,3,1742.9643333333333,3
w13,16,128,8,4096,3072,16,128,128,16,4,3,1731.5826666666665,3
w13,16,128,8,4096,3072,16,128,128,16,4,4,1731.7003333333334,3
w13,16,128,8,4096,3072,16,128,128,16,8,3,1728.9913333333334,3
w13,16,128,8,4096,3072,16,128,128,16,8,4,1725.7913333333333,3
w13,16,128,8,4096,3072,16,128,128,32,4,3,1733.4073333333333,3
w13,16,128,8,4096,3072,16,128,128,32,4,4,1736.586,3
w13,16,128,8,4096,3072,16,128,128,32,8,3,1731.2313333333332,3
w13,16,128,8,4096,3072,16,128,128,32,8,4,1729.4926666666668,3
w13,16,128,8,4096,3072,16,128,128,64,4,3,1735.722,3
w13,16,128,8,4096,3072,16,128,128,64,4,4,1738.9326666666666,3
w13,16,128,8,4096,3072,16,128,128,64,8,3,1733.4920000000002,3
w13,16,128,8,4096,3072,16,128,128,64,8,4,1735.1563333333334,3
w13,24,8,2,1024,512,16,128,64,1,8,3,7.073666666666667,3
w13,24,8,2,1024,512,16,128,64,1,8,4,7.0953333333333335,3
w13,24,16,2,1536,768,16,64,64,1,4,4,25.773,3
w13,24,16,2,1536,768,16,64,64,16,4,3,25.889666666666667,3
w13,24,16,2,1536,768,16,64,64,16,4,4,25.94366666666667,3
w13,24,16,2,1536,768,16,64,64,64,4,3,25.719333333333335,3
w13,24,16,2,1536,768,16,64,64,64,4,4,25.783666666666665,3
w13,24,16,2,1536,768,16,64,128,16,4,2,25.826333333333334,3
w13,24,16,4,1536,1024,16,64,64,1,4,3,33.068666666666665,3
w13,24,16,4,1536,1024,16,64,64,16,4,3,32.89833333333333,3
w13,24,16,4,1536,1024,16,64,64,32,4,3,32.92966666666667,3
w13,24,16,4,1536,1024,16,64,64,64,4,3,32.994,3
w13,24,16,4,1536,1024,16,64,128,16,4,2,33.03666666666667,3
w13,24,16,4,1536,1024,16,64,128,32,4,2,32.961999999999996,3
w13,24,32,4,2048,768,16,64,128,1,4,3,61.666333333333334,3
w13,24,32,4,2048,768,16,64,128,16,4,3,61.74066666666667,3
w13,24,32,4,2048,768,16,64,128,32,4,3,62.135333333333335,3
w13,24,32,4,2048,768,16,64,128,64,4,3,61.78333333333333,3
w13,24,32,6,3072,1024,16,32,128,1,4,3,119.52233333333334,3
w13,24,32,6,3072,1024,16,32,128,4,4,3,119.75733333333334,3
w13,24,32,6,3072,1024,16,32,128,16,4,3,119.38366666666667,3
w13,24,32,6,3072,1024,16,32,128,32,4,3,119.69333333333333,3
w13,24,32,6,3072,1024,16,32,128,64,4,3,120.16233333333332,3
w13,24,32,6,3072,1024,16,64,64,16,4,5,120.173,3
w13,24,32,6,3072,1024,16,64,128,1,4,2,119.72466666666666,3
w13,24,32,6,3072,1024,16,64,128,1,4,3,119.62866666666667,3
w13,24,32,6,3072,1024,16,64,128,16,4,2,119.92766666666667,3
w13,24,32,6,3072,1024,16,64,128,16,4,3,119.71433333333334,3
w13,24,32,6,3072,1024,16,64,128,32,4,2,119.07433333333334,3
w13,24,32,6,3072,1024,16,64,128,32,4,3,120.00266666666666,3
w13,24,32,6,3072,1024,16,64,128,64,4,2,119.86366666666667,3
w13,24,32,6,3072,1024,16,64,128,64,4,3,119.67166666666667,3
w13,24,32,6,3072,1024,16,128,128,16,8,4,119.77833333333332,3
w13,24,32,6,3072,1024,16,128,128,32,8,4,119.85366666666668,3
w13,24,32,6,3072,1024,16,128,128,64,8,4,119.68266666666666,3
w13,24,60,4,2048,1408,16,64,128,1,4,3,192.46133333333333,3
w13,24,60,4,2048,1408,16,64,128,1,4,4,192.21633333333332,3
w13,24,60,4,2048,1408,16,128,128,1,8,3,190.6483333333333,3
w13,24,60,6,3584,2304,16,32,128,1,4,4,545.1986666666667,3
w13,24,60,6,3584,2304,16,64,128,1,4,3,540.196,3
w13,24,60,6,3584,2304,16,64,128,1,4,4,543.8553333333333,3
w13,24,60,6,3584,2304,16,64,128,16,4,3,540.8366666666667,3
w13,24,60,6,3584,2304,16,64,128,32,4,3,542.5859999999999,3
w13,24,60,6,3584,2304,16,64,128,64,4,3,542.3086666666667,3
w13,24,60,6,3584,2304,16,128,128,1,4,3,544.8903333333333,3
w13,24,60,6,3584,2304,16,128,128,1,8,3,540.9216666666667,3
w13,24,60,6,3584,2304,16,128,128,1,8,4,541.7223333333333,3
w13,24,60,6,3584,2304,16,128,128,16,4,3,543.3746666666667,3
w13,24,60,6,3584,2304,16,128,128,16,8,3,543.7916666666666,3
w13,24,60,6,3584,2304,16,128,128,16,8,4,542.3829999999999,3
w13,24,60,6,3584,2304,16,128,128,32,8,3,543.1726666666667,3
w13,24,60,6,3584,2304,16,128,128,32,8,4,542.9383333333334,3
w13,24,60,6,3584,2304,16,128,128,64,4,3,545.6476666666666,3
w13,24,60,6,3584,2304,16,128,128,64,8,3,544.3143333333334,3
w13,24,60,8,2048,1536,16,64,128,1,4,3,210.275,3
w13,24,60,8,2048,1536,16,64,128,1,4,4,210.04033333333334,3
w13,24,60,8,2048,1536,16,64,128,32,4,3,210.64766666666665,3
w13,24,60,8,2048,1536,16,128,128,1,8,3,209.35766666666666,3
w13,24,60,8,2048,1536,16,128,128,1,8,4,211.33,3
w13,24,60,8,2048,1536,16,128,128,16,8,3,211.37300000000002,3
w13,24,60,8,2048,1536,16,128,128,32,8,3,211.17100000000002,3
w13,24,64,6,3072,2048,16,32,128,1,4,4,444.3776666666667,3
w13,24,64,6,3072,2048,16,32,128,4,4,4,444.86833333333334,3
w13,24,64,6,3072,2048,16,32,128,16,4,4,445.647,3
w13,24,64,6,3072,2048,16,64,128,1,4,3,444.292,3
w13,24,64,6,3072,2048,16,64,128,1,4,4,443.48133333333334,3
w13,24,64,6,3072,2048,16,64,128,16,4,3,442.596,3
w13,24,64,6,3072,2048,16,64,128,16,4,4,444.8253333333334,3
w13,24,64,6,3072,2048,16,64,128,32,4,3,445.02833333333336,3
w13,24,64,6,3072,2048,16,64,128,32,4,4,444.175,3
w13,24,64,6,3072,2048,16,64,128,64,4,3,443.4926666666667,3
w13,24,64,6,3072,2048,16,64,128,64,4,4,446.1586666666667,3
w13,24,64,6,3072,2048,16,128,128,1,4,3,444.964,3
w13,24,64,6,3072,2048,16,128,128,1,4,4,445.30566666666664,3
w13,24,64,6,3072,2048,16,128,128,1,8,3,443.18266666666665,3
w13,24,64,6,3072,2048,16,128,128,1,8,4,441.8813333333333,3
w13,24,64,6,3072,2048,16,128,128,16,4,3,445.71066666666667,3
w13,24,64,6,3072,2048,16,128,128,16,8,3,443.247,3
w13,24,64,6,3072,2048,16,128,128,16,8,4,443.35366666666664,3
w13,24,64,6,3072,2048,16,128,128,32,4,3,446.34,3
w13,24,64,6,3072,2048,16,128,128,32,4,4,445.4866666666667,3
w13,24,64,6,3072,2048,16,128,128,32,8,3,442.10533333333336,3
w13,24,64,6,3072,2048,16,128,128,32,8,4,442.3296666666667,3
w13,24,64,6,3072,2048,16,128,128,64,8,3,444.5373333333334,3
w13,24,64,6,3072,2048,16,128,128,64,8,4,444.21700000000004,3
w13,24,64,6,3584,1536,16,64,128,1,4,3,391.98199999999997,3
w13,24,64,6,3584,1536,16,64,128,1,4,4,389.77400000000006,3
w13,24,64,6,3584,1536,16,64,128,16,4,3,390.3183333333333,3
w13,24,64,6,3584,1536,16,64,128,16,4,4,390.5746666666667,3
w13,24,64,6,3584,1536,16,64,128,32,4,3,392.40866666666665,3
w13,24,64,6,3584,1536,16,64,128,32,4,4,392.11033333333336,3
w13,24,64,6,3584,1536,16,64,128,64,4,3,392.387,3
w13,24,64,6,3584,1536,16,128,128,1,8,3,389.76366666666667,3
w13,24,64,6,3584,1536,16,128,128,1,8,4,391.086,3
w13,24,64,6,3584,1536,16,128,128,16,4,3,391.257,3
w13,24,64,6,3584,1536,16,128,128,16,8,3,388.79333333333335,3
w13,24,64,6,3584,1536,16,128,128,16,8,4,391.012,3
w13,24,64,6,3584,1536,16,128,128,32,4,3,391.76933333333335,3
w13,24,64,6,3584,1536,16,128,128,32,8,3,389.8376666666666,3
w13,24,64,6,3584,1536,16,128,128,32,8,4,392.52666666666664,3
w13,24,64,6,3584,1536,16,128,128,64,4,3,392.35566666666665,3
w13,24,64,6,3584,1536,16,128,128,64,8,3,388.98533333333336,3
w13,24,64,6,3584,1536,16,128,128,64,8,4,392.537,3
w13,24,64,8,3584,2560,16,32,128,1,4,3,646.7253333333333,3
w13,24,64,8,3584,2560,16,32,128,1,4,4,643.408,3
w13,24,64,8,3584,2560,16,32,128,4,4,4,646.0003333333333,3
w13,24,64,8,3584,2560,16,32,128,16,4,4,646.8960000000001,3
w13,24,64,8,3584,2560,16,64,128,1,4,3,641.0823333333334,3
w13,24,64,8,3584,2560,16,64,128,1,4,4,642.3306666666666,3
w13,24,64,8,3584,2560,16,64,128,16,4,3,644.9226666666667,3
w13,24,64,8,3584,2560,16,64,128,16,4,4,647.024,3
w13,24,64,8,3584,2560,16,64,128,32,4,3,646.064,3
w13,24,64,8,3584,2560,16,64,128,64,4,3,645.4879999999999,3
w13,24,64,8,3584,2560,16,128,128,1,4,3,645.1363333333334,3
w13,24,64,8,3584,2560,16,128,128,1,4,4,644.5386666666667,3
w13,24,64,8,3584,2560,16,128,128,1,8,3,643.2266666666667,3
w13,24,64,8,3584,2560,16,128,128,1,8,4,640.8373333333334,3
w13,24,64,8,3584,2560,16,128,128,16,4,3,646.4373333333333,3
w13,24,64,8,3584,2560,16,128,128,16,8,3,643.8346666666667,3
w13,24,64,8,3584,2560,16,128,128,16,8,4,643.8343333333333,3
w13,24,64,8,3584,2560,16,128,128,32,8,3,645.1466666666666,3
w13,24,64,8,3584,2560,16,128,128,32,8,4,645.1466666666666,3
w13,24,64,8,3584,2560,16,128,128,64,8,3,644.5703333333333,3
w13,24,64,8,3584,2560,16,128,128,64,8,4,645.669,3
w13,24,128,4,2048,512,16,64,128,1,4,3,116.58966666666667,3
w13,24,128,4,2048,512,16,64,128,1,4,4,115.88499999999999,3
w13,24,128,4,2048,512,16,64,128,32,4,2,116.66399999999999,3
w13,24,128,4,2048,512,16,128,128,1,8,4,115.587,3
w13,24,128,4,2048,512,16,128,128,16,8,4,116.557,3
w13,24,128,4,2048,512,16,128,128,32,8,4,116.579,3
w13,24,128,4,2048,512,16,128,128,64,8,4,116.53633333333333,3
w13,24,128,6,4096,2048,16,32,128,16,4,3,1158.6733333333334,3
w13,24,128,6,4096,2048,16,32,128,16,4,4,1155.8573333333334,3
w13,24,128,6,4096,2048,16,32,128,32,4,3,1159.5056666666667,3
w13,24,128,6,4096,2048,16,32,128,32,4,4,1159.452,3
w13,24,128,6,4096,2048,16,32,128,64,4,3,1161.7026666666668,3
w13,24,128,6,4096,2048,16,32,128,64,4,4,1162.1616666666666,3
w13,24,128,6,4096,2048,16,64,128,1,4,3,1164.0383333333332,3
w13,24,128,6,4096,2048,16,64,128,1,4,4,1163.0469999999998,3
w13,24,128,6,4096,2048,16,64,128,16,4,3,1156.839,3
w13,24,128,6,4096,2048,16,64,128,16,4,4,1152.4866666666667,3
w13,24,128,6,4096,2048,16,64,128,16,8,3,1161.2223333333334,3
w13,24,128,6,4096,2048,16,64,128,16,8,4,1156.2946666666667,3
w13,24,128,6,4096,2048,16,64,128,32,4,3,1155.8896666666667,3
w13,24,128,6,4096,2048,16,64,128,32,4,4,1154.8763333333334,3
w13,24,128,6,4096,2048,16,64,128,32,8,3,1163.4093333333333,3
w13,24,128,6,4096,2048,16,64,128,32,8,4,1157.9696666666666,3
w13,24,128,6,4096,2048,16,64,128,64,4,3,1161.927,3
w13,24,128,6,4096,2048,16,64,128,64,4,4,1158.2683333333334,3
w13,24,128,6,4096,2048,16,64,128,64,8,4,1161.415,3
w13,24,128,6,4096,2048,16,128,128,16,4,3,1156.8813333333333,3
w13,24,128,6,4096,2048,16,128,128,16,4,4,1157.0203333333332,3
w13,24,128,6,4096,2048,16,128,128,16,8,3,1159.6013333333333,3
w13,24,128,6,4096,2048,16,128,128,16,8,4,1153.8946666666668,3
w13,24,128,6,4096,2048,16,128,128,32,4,3,1163.4313333333332,3
w13,24,128,6,4096,2048,16,128,128,32,4,4,1160.263,3
w13,24,128,6,4096,2048,16,128,128,32,8,3,1159.7936666666667,3
w13,24,128,6,4096,2048,16,128,128,32,8,4,1159.175,3
w13,24,128,6,4096,2048,16,128,128,64,8,4,1163.8366666666668,3
w13,24,128,8,2048,768,16,64,128,1,4,3,221.17600000000002,3
w13,24,128,8,2048,768,16,64,128,1,4,4,222.12566666666666,3
w13,24,128,8,2048,768,16,64,128,16,4,3,222.8083333333333,3
w13,24,128,8,2048,768,16,64,128,32,4,3,223.235,3
w13,24,128,8,2048,768,16,128,128,1,8,3,221.54966666666667,3
w13,24,128,8,2048,768,16,128,128,1,8,4,222.31799999999998,3
w13,24,128,8,2048,768,16,128,128,32,8,3,222.8936666666667,3
w13,24,128,8,4096,1536,16,32,128,1,4,4,878.5873333333334,3
w13,24,128,8,4096,1536,16,32,128,4,4,4,876.7626666666666,3
w13,24,128,8,4096,1536,16,32,128,16,4,3,874.1170000000001,3
w13,24,128,8,4096,1536,16,32,128,16,4,4,872.4319999999999,3
w13,24,128,8,4096,1536,16,32,128,32,4,3,875.4193333333333,3
w13,24,128,8,4096,1536,16,32,128,32,4,4,874.5123333333335,3
w13,24,128,8,4096,1536,16,32,128,64,4,3,877.8290000000001,3
w13,24,128,8,4096,1536,16,32,128,64,4,4,876.5286666666666,3
w13,24,128,8,4096,1536,16,64,128,1,4,3,877.84,3
w13,24,128,8,4096,1536,16,64,128,1,4,4,877.4456666666666,3
w13,24,128,8,4096,1536,16,64,128,16,4,3,874.4273333333334,3
w13,24,128,8,4096,1536,16,64,128,16,4,4,871.814,3
w13,24,128,8,4096,1536,16,64,128,16,8,3,877.0503333333332,3
w13,24,128,8,4096,1536,16,64,128,16,8,4,873.8503333333333,3
w13,24,128,8,4096,1536,16,64,128,32,4,3,872.6353333333333,3
w13,24,128,8,4096,1536,16,64,128,32,4,4,870.3953333333334,3
w13,24,128,8,4096,1536,16,64,128,32,8,4,873.936,3
w13,24,128,8,4096,1536,16,64,128,64,4,3,876.902,3
w13,24,128,8,4096,1536,16,64,128,64,4,4,873.542,3
w13,24,128,8,4096,1536,16,64,128,64,8,4,876.9340000000001,3
w13,24,128,8,4096,1536,16,128,128,1,4,3,878.4063333333334,3
w13,24,128,8,4096,1536,16,128,128,1,8,3,877.8086666666667,3
w13,24,128,8,4096,1536,16,128,128,16,4,3,871.1206666666667,3
w13,24,128,8,4096,1536,16,128,128,16,4,4,874.427,3
w13,24,128,8,4096,1536,16,128,128,16,8,3,874.6296666666667,3
w13,24,128,8,4096,1536,16,128,128,16,8,4,870.7366666666667,3
w13,24,128,8,4096,1536,16,128,128,32,4,3,876.0806666666667,3
w13,24,128,8,4096,1536,16,128,128,32,4,4,876.9446666666666,3
w13,24,128,8,4096,1536,16,128,128,32,8,3,876.5279999999999,3
w13,24,128,8,4096,1536,16,128,128,32,8,4,874.4056666666667,3
w13,24,128,8,4096,1536,16,128,128,64,4,3,876.006,3
w13,24,128,8,4096,1536,16,128,128,64,8,3,876.0163333333334,3
w13,24,128,8,4096,1536,16,128,128,64,8,4,875.8133333333334,3
w13,24,128,8,4096,3072,16,32,128,4,4,3,1734.1016666666667,3
w13,24,128,8,4096,3072,16,32,128,4,4,4,1731.4026666666668,3
w13,24,128,8,4096,3072,16,32,128,16,4,3,1729.2483333333332,3
w13,24,128,8,4096,3072,16,32,128,16,4,4,1728.394,3
w13,24,128,8,4096,3072,16,32,128,32,4,3,1733.3763333333334,3
w13,24,128,8,4096,3072,16,32,128,32,4,4,1731.9886666666669,3
w13,24,128,8,4096,3072,16,32,128,64,4,3,1736.3196666666665,3
w13,24,128,8,4096,3072,16,32,128,64,4,4,1738.9440000000002,3
w13,24,128,8,4096,3072,16,64,128,16,4,3,1730.2820000000002,3
w13,24,128,8,4096,3072,16,64,128,16,4,4,1724.1486666666667,3
w13,24,128,8,4096,3072,16,64,128,32,4,3,1731.2953333333335,3
w13,24,128,8,4096,3072,16,64,128,32,4,4,1732.0423333333335,3
w13,24,128,8,4096,3072,16,64,128,64,4,3,1736.3943333333334,3
w13,24,128,8,4096,3072,16,64,128,64,4,4,1739.264,3
w13,24,128,8,4096,3072,16,128,128,16,4,3,1731.808,3
w13,24,128,8,4096,3072,16,128,128,16,4,4,1726.2616666666665,3
w13,24,128,8,4096,3072,16,128,128,16,8,3,1728.907,3
w13,24,128,8,4096,3072,16,128,128,16,8,4,1724.459,3
w13,24,128,8,4096,3072,16,128,128,32,4,3,1731.0613333333333,3
w13,24,128,8,4096,3072,16,128,128,32,4,4,1730.7093333333335,3
w13,24,128,8,4096,3072,16,128,128,32,8,3,1730.7839999999999,3
w13,24,128,8,4096,3072,16,128,128,32,8,4,1728.6933333333334,3
w13,24,128,8,4096,3072,16,128,128,64,4,3,1738.5813333333333,3
w13,24,128,8,4096,3072,16,128,128,64,4,4,1739.5093333333334,3
w13,24,128,8,4096,3072,16,128,128,64,8,3,1738.763,3
w13,24,128,8,4096,3072,16,128,128,64,8,4,1737.8986666666667,3
w13,32,8,2,1024,512,16,128,64,1,8,3,7.117,3
w13,32,8,2,1024,512,16,128,64,1,8,4,7.169999999999999,3
w13,32,16,2,1536,768,16,64,64,1,4,4,25.52733333333333,3
w13,32,16,2,1536,768,16,64,64,16,4,4,25.71966666666667,3
w13,32,16,4,1536,1024,16,64,64,16,4,3,32.844,3
w13,32,16,4,1536,1024,16,64,64,32,4,3,32.866,3
w13,32,16,4,1536,1024,16,64,64,64,4,3,32.86633333333334,3
w13,32,32,4,2048,768,16,64,128,1,4,3,61.709,3
w13,32,32,4,2048,768,16,64,128,16,4,3,61.836666666666666,3
w13,32,32,6,3072,1024,16,32,128,1,4,3,119.789,3
w13,32,32,6,3072,1024,16,32,128,4,4,3,119.94866666666667,3
w13,32,32,6,3072,1024,16,32,128,16,4,3,119.853,3
w13,32,32,6,3072,1024,16,32,128,32,4,3,120.35466666666666,3
w13,32,32,6,3072,1024,16,32,128,64,4,3,119.72500000000001,3
w13,32,32,6,3072,1024,16,64,64,1,4,5,120.22633333333333,3
w13,32,32,6,3072,1024,16,64,128,1,4,3,120.54633333333334,3
w13,32,32,6,3072,1024,16,64,128,16,4,2,120.42900000000002,3
w13,32,32,6,3072,1024,16,64,128,16,4,3,120.83466666666668,3
w13,32,32,6,3072,1024,16,64,128,32,4,2,120.07766666666667,3
w13,32,32,6,3072,1024,16,64,128,32,4,3,120.49333333333334,3
w13,32,32,6,3072,1024,16,64,128,64,4,2,120.48233333333333,3
w13,32,32,6,3072,1024,16,128,128,16,8,4,120.53566666666666,3
w13,32,32,6,3072,1024,16,128,128,32,8,4,119.71433333333334,3
w13,32,32,6,3072,1024,16,128,128,64,8,4,120.21600000000001,3
w13,32,60,4,2048,1408,16,128,128,1,8,3,191.06433333333334,3
w13,32,60,4,2048,1408,16,128,128,1,8,4,192.41866666666667,3
w13,32,60,6,3584,2304,16,32,128,1,4,4,545.295,3
w13,32,60,6,3584,2304,16,32,128,16,4,4,546.959,3
w13,32,60,6,3584,2304,16,64,128,1,4,3,543.5356666666667,3
w13,32,60,6,3584,2304,16,64,128,1,4,4,545.0713333333333,3
w13,32,60,6,3584,2304,16,64,128,16,4,3,543.0873333333334,3
w13,32,60,6,3584,2304,16,64,128,16,4,4,545.9776666666667,3
w13,32,60,6,3584,2304,16,64,128,32,4,3,542.5753333333333,3
w13,32,60,6,3584,2304,16,64,128,64,4,3,545.2946666666667,3
w13,32,60,6,3584,2304,16,128,128,1,4,3,545.9563333333334,3
w13,32,60,6,3584,2304,16,128,128,1,8,3,542.628,3
w13,32,60,6,3584,2304,16,128,128,1,8,4,542.5543333333334,3
w13,32,60,6,3584,2304,16,128,128,16,4,3,544.549,3
w13,32,60,6,3584,2304,16,128,128,16,8,3,541.8183333333333,3
w13,32,60,6,3584,2304,16,128,128,16,8,4,543.183,3
w13,32,60,6,3584,2304,16,128,128,32,4,3,545.541,3
w13,32,60,6,3584,2304,16,128,128,32,8,3,542.9703333333333,3
w13,32,60,6,3584,2304,16,128,128,32,8,4,544.303,3
w13,32,60,6,3584,2304,16,128,128,64,8,3,545.9986666666667,3
w13,32,60,6,3584,2304,16,128,128,64,8,4,545.6153333333333,3
w13,32,60,8,2048,1536,16,64,128,1,4,3,210.466,3
w13,32,60,8,2048,1536,16,64,128,1,4,4,211.35233333333335,3
w13,32,60,8,2048,1536,16,64,128,16,4,3,211.8213333333333,3
w13,32,60,8,2048,1536,16,64,128,32,4,3,211.83166666666668,3
w13,32,60,8,2048,1536,16,64,128,64,4,3,211.75766666666667,3
w13,32,60,8,2048,1536,16,128,128,1,8,3,210.595,3
w13,32,60,8,2048,1536,16,128,128,1,8,4,212.09866666666667,3
w13,32,60,8,2048,1536,16,128,128,32,8,3,211.90633333333335,3
w13,32,60,8,2048,1536,16,128,128,64,8,3,211.82066666666665,3
w13,32,64,6,3072,2048,16,32,128,1,4,3,446.404,3
w13,32,64,6,3072,2048,16,32,128,1,4,4,445.51866666666666,3
w13,32,64,6,3072,2048,16,32,128,4,4,4,446.308,3
w13,32,64,6,3072,2048,16,32,128,32,4,4,447.57766666666663,3
w13,32,64,6,3072,2048,16,64,128,1,4,3,443.30033333333336,3
w13,32,64,6,3072,2048,16,64,128,1,4,4,443.42800000000005,3
w13,32,64,6,3072,2048,16,64,128,16,4,3,444.6333333333334,3
w13,32,64,6,3072,2048,16,64,128,16,4,4,445.02833333333336,3
w13,32,64,6,3072,2048,16,64,128,32,4,3,444.8896666666667,3
w13,32,64,6,3072,2048,16,64,128,32,4,4,445.7426666666667,3
w13,32,64,6,3072,2048,16,64,128,64,4,3,445.5506666666667,3
w13,32,64,6,3072,2048,16,128,128,1,4,3,447.4816666666666,3
w13,32,64,6,3072,2048,16,128,128,1,4,4,446.3933333333334,3
w13,32,64,6,3072,2048,16,128,128,1,8,3,443.15066666666667,3
w13,32,64,6,3072,2048,16,128,128,1,8,4,443.2146666666667,3
w13,32,64,6,3072,2048,16,128,128,16,4,3,446.2763333333333,3
w13,32,64,6,3072,2048,16,128,128,16,8,3,443.18266666666665,3
w13,32,64,6,3072,2048,16,128,128,16,8,4,444.1856666666667,3
w13,32,64,6,3072,2048,16,128,128,32,4,3,447.3106666666667,3
w13,32,64,6,3072,2048,16,128,128,32,4,4,446.98033333333336,3
w13,32,64,6,3072,2048,16,128,128,32,8,3,444.62266666666665,3
w13,32,64,6,3072,2048,16,128,128,32,8,4,443.5986666666667,3
w13,32,64,6,3072,2048,16,128,128,64,4,3,446.81,3
w13,32,64,6,3072,2048,16,128,128,64,8,3,444.5586666666666,3
w13,32,64,6,3072,2048,16,128,128,64,8,4,445.57199999999995,3
w13,32,64,6,3584,1536,16,32,128,1,4,3,393.33733333333333,3
w13,32,64,6,3584,1536,16,32,128,1,4,4,392.4726666666666,3
w13,32,64,6,3584,1536,16,64,128,1,4,3,391.5986666666667,3
w13,32,64,6,3584,1536,16,64,128,1,4,4,390.02,3
w13,32,64,6,3584,1536,16,64,128,16,4,3,391.34200000000004,3
w13,32,64,6,3584,1536,16,64,128,16,4,4,392.3666666666666,3
w13,32,64,6,3584,1536,16,64,128,32,4,3,391.2456666666667,3
w13,32,64,6,3584,1536,16,64,128,32,4,4,392.228,3
w13,32,64,6,3584,1536,16,64,128,64,4,3,392.932,3
w13,32,64,6,3584,1536,16,128,128,1,8,3,390.0306666666667,3
w13,32,64,6,3584,1536,16,128,128,1,8,4,391.513,3
w13,32,64,6,3584,1536,16,128,128,16,4,3,392.28099999999995,3
w13,32,64,6,3584,1536,16,128,128,16,8,3,390.564,3
w13,32,64,6,3584,1536,16,128,128,16,8,4,392.921,3
w13,32,64,6,3584,1536,16,128,128,32,4,3,393.1023333333333,3
w13,32,64,6,3584,1536,16,128,128,32,8,3,389.4973333333334,3
w13,32,64,6,3584,1536,16,128,128,32,8,4,391.31033333333335,3
w13,32,64,6,3584,1536,16,128,128,64,4,3,392.88899999999995,3
w13,32,64,6,3584,1536,16,128,128,64,8,3,391.9080000000001,3
w13,32,64,8,3584,2560,16,32,128,1,4,4,644.3466666666667,3
w13,32,64,8,3584,2560,16,32,128,4,4,4,648.261,3
w13,32,64,8,3584,2560,16,64,128,1,4,3,643.632,3
w13,32,64,8,3584,2560,16,64,128,1,4,4,645.1999999999999,3
w13,32,64,8,3584,2560,16,64,128,16,4,3,646.0746666666666,3
w13,32,64,8,3584,2560,16,64,128,32,4,3,647.2696666666667,3
w13,32,64,8,3584,2560,16,64,128,64,4,3,646.245,3
w13,32,64,8,3584,2560,16,128,128,1,4,3,647.173,3
w13,32,64,8,3584,2560,16,128,128,1,4,4,645.424,3
w13,32,64,8,3584,2560,16,128,128,1,8,3,644.3573333333334,3
w13,32,64,8,3584,2560,16,128,128,1,8,4,641.8933333333333,3
w13,32,64,8,3584,2560,16,128,128,16,4,3,647.4183333333334,3
w13,32,64,8,3584,2560,16,128,128,16,8,3,644.2399999999999,3
w13,32,64,8,3584,2560,16,128,128,16,8,4,645.424,3
w13,32,64,8,3584,2560,16,128,128,32,8,3,644.2823333333333,3
w13,32,64,8,3584,2560,16,128,128,32,8,4,645.8183333333333,3
w13,32,64,8,3584,2560,16,128,128,64,8,3,645.7543333333333,3
w13,32,64,8,3584,2560,16,128,128,64,8,4,647.8670000000001,3
w13,32,128,4,2048,512,16,64,128,1,4,3,152.11933333333334,3
w13,32,128,4,2048,512,16,64,128,1,4,4,150.60566666666668,3
w13,32,128,4,2048,512,16,64,128,32,4,3,150.691,3
w13,32,128,4,2048,512,16,64,128,32,4,4,151.72533333333334,3
w13,32,128,4,2048,512,16,64,128,64,4,3,151.46933333333334,3
w13,32,128,4,2048,512,16,64,128,64,4,4,151.288,3
w13,32,128,4,2048,512,16,128,128,1,8,3,151.683,3
w13,32,128,4,2048,512,16,128,128,1,8,4,150.659,3
w13,32,128,4,2048,512,16,128,128,16,8,4,151.96,3
w13,32,128,4,2048,512,16,128,128,32,8,3,151.91733333333332,3
w13,32,128,4,2048,512,16,128,128,32,8,4,151.672,3
w13,32,128,6,4096,2048,16,32,128,16,4,3,1159.2606666666668,3
w13,32,128,6,4096,2048,16,32,128,16,4,4,1157.074,3
w13,32,128,6,4096,2048,16,32,128,32,4,3,1161.6606666666667,3
w13,32,128,6,4096,2048,16,32,128,32,4,4,1159.8046666666667,3
w13,32,128,6,4096,2048,16,64,128,16,4,3,1158.3966666666668,3
w13,32,128,6,4096,2048,16,64,128,16,4,4,1153.81,3
w13,32,128,6,4096,2048,16,64,128,16,8,4,1158.215,3
w13,32,128,6,4096,2048,16,64,128,32,4,3,1158.322,3
w13,32,128,6,4096,2048,16,64,128,32,4,4,1156.1993333333332,3
w13,32,128,6,4096,2048,16,64,128,32,8,4,1159.1966666666667,3
w13,32,128,6,4096,2048,16,64,128,64,4,3,1162.898,3
w13,32,128,6,4096,2048,16,64,128,64,4,4,1161.746,3
w13,32,128,6,4096,2048,16,64,128,64,8,4,1163.794,3
w13,32,128,6,4096,2048,16,128,128,1,8,4,1165.4366666666667,3
w13,32,128,6,4096,2048,16,128,128,16,4,3,1160.6683333333333,3
w13,32,128,6,4096,2048,16,128,128,16,4,4,1160.733,3
w13,32,128,6,4096,2048,16,128,128,16,8,3,1162.2473333333335,3
w13,32,128,6,4096,2048,16,128,128,16,8,4,1156.7749999999999,3
w13,32,128,6,4096,2048,16,128,128,32,4,3,1161.1483333333333,3
w13,32,128,6,4096,2048,16,128,128,32,4,4,1160.6903333333332,3
w13,32,128,6,4096,2048,16,128,128,32,8,3,1160.818,3
w13,32,128,6,4096,2048,16,128,128,32,8,4,1159.5696666666665,3
w13,32,128,6,4096,2048,16,128,128,64,8,4,1162.7806666666668,3
w13,32,128,8,2048,768,16,64,128,1,4,3,221.62433333333334,3
w13,32,128,8,2048,768,16,64,128,1,4,4,222.90466666666666,3
w13,32,128,8,2048,768,16,64,128,32,4,3,223.60799999999998,3
w13,32,128,8,2048,768,16,64,128,64,4,3,223.57633333333334,3
w13,32,128,8,2048,768,16,128,128,1,8,3,222.23233333333334,3
w13,32,128,8,2048,768,16,128,128,16,8,3,223.779,3
w13,32,128,8,4096,1536,16,32,128,4,4,3,876.8166666666666,3
w13,32,128,8,4096,1536,16,32,128,4,4,4,872.9766666666668,3
w13,32,128,8,4096,1536,16,32,128,4,4,5,876.8273333333333,3
w13,32,128,8,4096,1536,16,32,128,16,4,3,876.8273333333333,3
w13,32,128,8,4096,1536,16,32,128,16,4,4,873.8303333333333,3
w13,32,128,8,4096,1536,16,32,128,32,4,3,877.915,3
w13,32,128,8,4096,1536,16,32,128,32,4,4,874.4593333333332,3
w13,32,128,8,4096,1536,16,32,128,64,4,3,876.3473333333333,3
w13,32,128,8,4096,1536,16,32,128,64,4,4,875.302,3
w13,32,128,8,4096,1536,16,64,128,1,4,3,876.966,3
w13,32,128,8,4096,1536,16,64,128,1,4,4,876.4756666666667,3
w13,32,128,8,4096,1536,16,64,128,16,4,3,875.2696666666667,3
w13,32,128,8,4096,1536,16,64,128,16,4,4,870.4593333333332,3
w13,32,128,8,4096,1536,16,64,128,16,8,4,874.011,3
w13,32,128,8,4096,1536,16,64,128,32,4,3,875.1529999999999,3
w13,32,128,8,4096,1536,16,64,128,32,4,4,870.9393333333334,3
w13,32,128,8,4096,1536,16,64,128,32,8,4,875.0566666666667,3
w13,32,128,8,4096,1536,16,64,128,64,4,3,877.1150000000001,3
w13,32,128,8,4096,1536,16,64,128,64,4,4,874.3526666666667,3
w13,32,128,8,4096,1536,16,64,128,64,8,4,877.5099999999999,3
w13,32,128,8,4096,1536,16,128,128,1,8,3,878.7793333333333,3
w13,32,128,8,4096,1536,16,128,128,16,4,3,873.958,3
w13,32,128,8,4096,1536,16,128,128,16,4,4,876.9976666666666,3
w13,32,128,8,4096,1536,16,128,128,16,8,3,875.0883333333333,3
w13,32,128,8,4096,1536,16,128,128,16,8,4,871.27,3
w13,32,128,8,4096,1536,16,128,128,32,4,3,874.3953333333334,3
w13,32,128,8,4096,1536,16,128,128,32,4,4,875.0673333333334,3
w13,32,128,8,4096,1536,16,128,128,32,8,3,875.601,3
w13,32,128,8,4096,1536,16,128,128,32,8,4,873.734,3
w13,32,128,8,4096,1536,16,128,128,64,4,3,876.2403333333333,3
w13,32,128,8,4096,1536,16,128,128,64,4,4,877.3706666666667,3
w13,32,128,8,4096,1536,16,128,128,64,8,3,878.8113333333334,3
w13,32,128,8,4096,1536,16,128,128,64,8,4,875.4726666666667,3
w13,32,128,8,4096,3072,16,32,128,1,4,4,1742.6670000000001,3
w13,32,128,8,4096,3072,16,32,128,4,4,3,1735.83,3
w13,32,128,8,4096,3072,16,32,128,4,4,4,1733.0349999999999,3
w13,32,128,8,4096,3072,16,32,128,4,4,5,1740.8966666666665,3
w13,32,128,8,4096,3072,16,32,128,16,4,3,1732.6943333333336,3
w13,32,128,8,4096,3072,16,32,128,16,4,4,1729.8886666666667,3
w13,32,128,8,4096,3072,16,32,128,32,4,3,1739.8193333333336,3
w13,32,128,8,4096,3072,16,32,128,32,4,4,1736.7686666666668,3
w13,32,128,8,4096,3072,16,32,128,64,4,3,1741.3766666666668,3
w13,32,128,8,4096,3072,16,64,128,16,4,3,1729.2376666666667,3
w13,32,128,8,4096,3072,16,64,128,16,4,4,1726.7636666666665,3
w13,32,128,8,4096,3072,16,64,128,16,8,3,1741.5373333333334,3
w13,32,128,8,4096,3072,16,64,128,16,8,4,1731.7023333333334,3
w13,32,128,8,4096,3072,16,64,128,32,4,3,1735.1363333333331,3
w13,32,128,8,4096,3072,16,64,128,32,4,4,1731.8403333333335,3
w13,32,128,8,4096,3072,16,64,128,32,8,4,1739.8406666666667,3
w13,32,128,8,4096,3072,16,64,128,64,4,3,1736.4166666666667,3
w13,32,128,8,4096,3072,16,64,128,64,4,4,1742.0483333333334,3
w13,32,128,8,4096,3072,16,128,128,16,4,3,1731.2856666666667,3
w13,32,128,8,4096,3072,16,128,128,16,4,4,1727.5420000000001,3
w13,32,128,8,4096,3072,16,128,128,16,8,3,1729.537,3
w13,32,128,8,4096,3072,16,128,128,16,8,4,1725.4513333333334,3
w13,32,128,8,4096,3072,16,128,128,32,4,3,1734.0486666666666,3
w13,32,128,8,4096,3072,16,128,128,32,4,4,1735.0083333333332,3
w13,32,128,8,4096,3072,16,128,128,32,8,3,1733.6433333333334,3
w13,32,128,8,4096,3072,16,128,128,32,8,4,1731.7123333333332,3
w13,32,128,8,4096,3072,16,128,128,64,4,3,1739.8509999999999,3
w13,32,128,8,4096,3072,16,128,128,64,4,4,1741.5896666666667,3
w13,32,128,8,4096,3072,16,128,128,64,8,3,1736.4913333333334,3
w13,32,128,8,4096,3072,16,128,128,64,8,4,1739.2223333333332,3
w13,48,8,2,1024,512,16,128,64,1,8,3,7.233999999999999,3
w13,48,8,2,1024,512,16,128,64,1,8,4,7.287333333333334,3
w13,48,8,2,1024,512,16,128,64,1,8,5,7.297999999999999,3
w13,48,16,2,1536,768,16,32,64,1,4,3,26.03933333333333,3
w13,48,16,2,1536,768,16,64,64,1,4,4,25.975333333333335,3
w13,48,16,2,1536,768,16,64,64,16,4,3,25.99666666666667,3
w13,48,16,2,1536,768,16,64,64,64,4,3,25.826000000000004,3
w13,48,16,2,1536,768,16,64,64,64,4,4,25.901,3
w13,48,16,2,1536,768,16,64,128,16,4,2,25.81533333333333,3
w13,48,16,4,1536,1024,16,64,64,1,4,3,32.909,3
w13,48,16,4,1536,1024,16,64,64,32,4,3,32.64266666666666,3
w13,48,16,4,1536,1024,16,64,128,1,4,2,32.95133333333334,3
w13,48,32,4,2048,768,16,64,128,1,4,3,61.954,3
w13,48,32,4,2048,768,16,64,128,16,4,3,62.263666666666666,3
w13,48,32,4,2048,768,16,64,128,32,4,3,61.677,3
w13,48,32,4,2048,768,16,64,128,64,4,3,61.97566666666666,3
w13,48,32,6,3072,1024,16,32,128,1,4,3,119.67166666666667,3
w13,48,32,6,3072,1024,16,32,128,4,4,3,119.77833333333335,3
w13,48,32,6,3072,1024,16,32,128,16,4,3,120.09833333333331,3
w13,48,32,6,3072,1024,16,32,128,32,4,3,119.72500000000001,3
w13,48,32,6,3072,1024,16,32,128,64,4,3,119.43733333333334,3
w13,48,32,6,3072,1024,16,64,128,1,4,2,120.33300000000001,3
w13,48,32,6,3072,1024,16,64,128,16,4,2,120.472,3
w13,48,32,6,3072,1024,16,64,128,16,4,3,120.23733333333332,3
w13,48,32,6,3072,1024,16,64,128,32,4,2,120.536,3
w13,48,32,6,3072,1024,16,64,128,64,4,2,120.61066666666666,3
w13,48,32,6,3072,1024,16,64,128,64,4,3,120.568,3
w13,48,32,6,3072,1024,16,128,128,16,8,4,120.45066666666666,3
w13,48,32,6,3072,1024,16,128,128,64,8,4,120.54633333333334,3
w13,48,60,4,2048,1408,16,64,128,1,4,3,193.02666666666664,3
w13,48,60,4,2048,1408,16,128,128,1,8,3,191.8213333333333,3
w13,48,60,6,3584,2304,16,32,128,1,4,4,547.7806666666667,3
w13,48,60,6,3584,2304,16,32,128,4,4,4,547.9616666666666,3
w13,48,60,6,3584,2304,16,32,128,16,4,4,549.647,3
w13,48,60,6,3584,2304,16,64,128,1,4,3,545.1990000000001,3
w13,48,60,6,3584,2304,16,64,128,1,4,4,545.5516666666667,3
w13,48,60,6,3584,2304,16,64,128,16,4,3,544.5063333333334,3
w13,48,60,6,3584,2304,16,64,128,16,4,4,548.4636666666667,3
w13,48,60,6,3584,2304,16,64,128,32,4,3,546.287,3
w13,48,60,6,3584,2304,16,64,128,64,4,3,546.4796666666666,3
w13,48,60,6,3584,2304,16,128,128,1,4,3,547.6423333333333,3
w13,48,60,6,3584,2304,16,128,128,1,4,4,548.8580000000001,3
w13,48,60,6,3584,2304,16,128,128,1,8,3,544.6446666666667,3
w13,48,60,6,3584,2304,16,128,128,1,8,4,544.1536666666667,3
w13,48,60,6,3584,2304,16,128,128,16,4,3,546.5543333333334,3
w13,48,60,6,3584,2304,16,128,128,16,4,4,549.3063333333333,3
w13,48,60,6,3584,2304,16,128,128,16,8,3,545.4016666666666,3
w13,48,60,6,3584,2304,16,128,128,16,8,4,545.338,3
w13,48,60,6,3584,2304,16,128,128,32,4,3,547.685,3
w13,48,60,6,3584,2304,16,128,128,32,8,3,545.3913333333334,3
w13,48,60,6,3584,2304,16,128,128,32,8,4,546.4683333333334,3
w13,48,60,6,3584,2304,16,128,128,64,4,3,549.231,3
w13,48,60,6,3584,2304,16,128,128,64,8,3,548.2283333333334,3
w13,48,60,6,3584,2304,16,128,128,64,8,4,548.3993333333334,3
w13,48,60,8,2048,1536,16,64,128,1,4,3,212.067,3
w13,48,60,8,2048,1536,16,128,128,1,8,3,210.691,3
w13,48,60,8,2048,1536,16,128,128,16,8,3,211.8216666666667,3
w13,48,64,6,3072,2048,16,32,128,1,4,3,447.96166666666664,3
w13,48,64,6,3072,2048,16,32,128,1,4,4,445.76433333333335,3
w13,48,64,6,3072,2048,16,32,128,4,4,3,447.38533333333334,3
w13,48,64,6,3072,2048,16,32,128,4,4,4,447.087,3
w13,48,64,6,3072,2048,16,64,128,1,4,3,445.6686666666667,3
w13,48,64,6,3072,2048,16,64,128,1,4,4,444.8573333333334,3
w13,48,64,6,3072,2048,16,64,128,16,4,3,447.759,3
w13,48,64,6,3072,2048,16,64,128,16,4,4,447.89733333333334,3
w13,48,64,6,3072,2048,16,64,128,32,4,3,448.20666666666665,3
w13,48,64,6,3072,2048,16,64,128,64,4,3,447.54566666666665,3
w13,48,64,6,3072,2048,16,128,128,1,4,3,447.7803333333333,3
w13,48,64,6,3072,2048,16,128,128,1,8,3,444.53766666666667,3
w13,48,64,6,3072,2048,16,128,128,1,8,4,443.8546666666666,3
w13,48,64,6,3072,2048,16,128,128,16,8,3,445.44433333333336,3
w13,48,64,6,3072,2048,16,128,128,16,8,4,446.0946666666666,3
w13,48,64,6,3072,2048,16,128,128,32,8,3,445.44433333333336,3
w13,48,64,6,3072,2048,16,128,128,32,8,4,445.97766666666666,3
w13,48,64,6,3072,2048,16,128,128,64,8,3,446.8413333333333,3
w13,48,64,6,3072,2048,16,128,128,64,8,4,447.83366666666666,3
w13,48,64,6,3584,1536,16,32,128,1,4,4,392.97433333333333,3
w13,48,64,6,3584,1536,16,64,128,1,4,3,391.78,3
w13,48,64,6,3584,1536,16,64,128,1,4,4,392.377,3
w13,48,64,6,3584,1536,16,64,128,16,4,3,392.0566666666667,3
w13,48,64,6,3584,1536,16,64,128,16,4,4,393.08133333333336,3
w13,48,64,6,3584,1536,16,64,128,32,4,3,393.3156666666667,3
w13,48,64,6,3584,1536,16,64,128,32,4,4,394.0306666666667,3
w13,48,64,6,3584,1536,16,64,128,64,4,3,395.001,3
w13,48,64,6,3584,1536,16,128,128,1,4,3,393.8923333333333,3
w13,48,64,6,3584,1536,16,128,128,1,8,3,391.8113333333333,3
w13,48,64,6,3584,1536,16,128,128,1,8,4,392.4403333333333,3
w13,48,64,6,3584,1536,16,128,128,16,4,3,393.66799999999995,3
w13,48,64,6,3584,1536,16,128,128,16,8,3,391.08666666666664,3
w13,48,64,6,3584,1536,16,128,128,16,8,4,393.0493333333334,3
w13,48,64,6,3584,1536,16,128,128,32,4,3,394.67066666666665,3
w13,48,64,6,3584,1536,16,128,128,32,8,3,391.7906666666667,3
w13,48,64,6,3584,1536,16,128,128,32,8,4,394.596,3
w13,48,64,6,3584,1536,16,128,128,64,4,3,394.8196666666667,3
w13,48,64,6,3584,1536,16,128,128,64,8,3,392.3663333333334,3
w13,48,64,8,3584,2560,16,32,128,1,4,3,650.8213333333333,3
w13,48,64,8,3584,2560,16,32,128,1,4,4,647.7386666666666,3
w13,48,64,8,3584,2560,16,32,128,4,4,4,649.808,3
w13,48,64,8,3584,2560,16,64,128,1,4,3,645.9573333333333,3
w13,48,64,8,3584,2560,16,64,128,1,4,4,647.4933333333333,3
w13,48,64,8,3584,2560,16,64,128,16,4,3,649.9363333333333,3
w13,48,64,8,3584,2560,16,64,128,32,4,3,649.9143333333333,3
w13,48,64,8,3584,2560,16,64,128,64,4,3,650.2026666666667,3
w13,48,64,8,3584,2560,16,128,128,1,4,3,648.091,3
w13,48,64,8,3584,2560,16,128,128,1,4,4,648.8906666666667,3
w13,48,64,8,3584,2560,16,128,128,1,8,3,646.107,3
w13,48,64,8,3584,2560,16,128,128,1,8,4,644.8906666666667,3
w13,48,64,8,3584,2560,16,128,128,16,4,3,649.6906666666667,3
w13,48,64,8,3584,2560,16,128,128,16,8,3,648.0913333333333,3
w13,48,64,8,3584,2560,16,128,128,16,8,4,648.2823333333334,3
w13,48,64,8,3584,2560,16,128,128,32,8,3,649.6476666666666,3
w13,48,64,8,3584,2560,16,128,128,32,8,4,649.1039999999999,3
w13,48,64,8,3584,2560,16,128,128,64,8,3,649.7446666666666,3
w13,48,64,8,3584,2560,16,128,128,64,8,4,649.3386666666667,3
w13,48,128,4,2048,512,16,64,128,1,4,3,151.34133333333332,3
w13,48,128,4,2048,512,16,64,128,1,4,4,150.659,3
w13,48,128,4,2048,512,16,64,128,32,4,3,152.02366666666668,3
w13,48,128,4,2048,512,16,128,128,1,8,3,150.88266666666667,3
w13,48,128,4,2048,512,16,128,128,1,8,4,151.16033333333334,3
w13,48,128,4,2048,512,16,128,128,32,8,3,151.70433333333332,3
w13,48,128,6,4096,2048,16,32,128,1,4,4,1166.9626666666666,3
w13,48,128,6,4096,2048,16,32,128,16,4,3,1161.5116666666665,3
w13,48,128,6,4096,2048,16,32,128,16,4,4,1161.1483333333333,3
w13,48,128,6,4096,2048,16,32,128,16,4,5,1167.9866666666667,3
w13,48,128,6,4096,2048,16,32,128,32,4,3,1165.4793333333334,3
w13,48,128,6,4096,2048,16,32,128,32,4,4,1164.8826666666666,3
w13,48,128,6,4096,2048,16,32,128,64,4,3,1167.3893333333333,3
w13,48,128,6,4096,2048,16,32,128,64,4,4,1166.066,3
w13,48,128,6,4096,2048,16,64,128,1,4,3,1168.1893333333335,3
w13,48,128,6,4096,2048,16,64,128,1,4,4,1168.189,3
w13,48,128,6,4096,2048,16,64,128,16,4,3,1159.3146666666667,3
w13,48,128,6,4096,2048,16,64,128,16,4,4,1158.2256666666667,3
w13,48,128,6,4096,2048,16,64,128,16,8,3,1164.4556666666667,3
w13,48,128,6,4096,2048,16,64,128,16,8,4,1160.2736666666667,3
w13,48,128,6,4096,2048,16,64,128,32,4,3,1160.0603333333333,3
w13,48,128,6,4096,2048,16,64,128,32,4,4,1160.8823333333332,3
w13,48,128,6,4096,2048,16,64,128,32,8,3,1169.2133333333334,3
w13,48,128,6,4096,2048,16,64,128,32,8,4,1164.3703333333333,3
w13,48,128,6,4096,2048,16,64,128,64,4,3,1165.2023333333334,3
w13,48,128,6,4096,2048,16,64,128,64,4,4,1163.3786666666667,3
w13,48,128,6,4096,2048,16,64,128,64,8,4,1167.816,3
w13,48,128,6,4096,2048,16,128,128,1,4,3,1169.128,3
w13,48,128,6,4096,2048,16,128,128,1,8,3,1168.6053333333334,3
w13,48,128,6,4096,2048,16,128,128,16,4,3,1163.165,3
w13,48,128,6,4096,2048,16,128,128,16,4,4,1159.474,3
w13,48,128,6,4096,2048,16,128,128,16,8,3,1160.4773333333333,3
w13,48,128,6,4096,2048,16,128,128,16,8,4,1157.7676666666666,3
w13,48,128,6,4096,2048,16,128,128,32,4,3,1165.3623333333335,3
w13,48,128,6,4096,2048,16,128,128,32,4,4,1162.7813333333334,3
w13,48,128,6,4096,2048,16,128,128,32,8,3,1162.3006666666668,3
w13,48,128,6,4096,2048,16,128,128,32,8,4,1161.4370000000001,3
w13,48,128,6,4096,2048,16,128,128,64,8,3,1168.6693333333333,3
w13,48,128,6,4096,2048,16,128,128,64,8,4,1169.3626666666667,3
w13,48,128,8,2048,768,16,64,128,1,4,3,223.06433333333334,3
w13,48,128,8,2048,768,16,64,128,1,4,4,223.74699999999999,3
w13,48,128,8,2048,768,16,64,128,16,4,3,224.55766666666668,3
w13,48,128,8,2048,768,16,64,128,16,4,4,224.739,3
w13,48,128,8,2048,768,16,64,128,32,4,3,224.23766666666666,3
w13,48,128,8,2048,768,16,64,128,64,4,3,224.51533333333336,3
w13,48,128,8,2048,768,16,128,128,1,4,3,224.643,3
w13,48,128,8,2048,768,16,128,128,1,8,3,222.979,3
w13,48,128,8,2048,768,16,128,128,1,8,4,224.16333333333333,3
w13,48,128,8,2048,768,16,128,128,16,8,3,224.771,3
w13,48,128,8,2048,768,16,128,128,32,8,3,224.408,3
w13,48,128,8,4096,1536,16,32,128,1,4,3,880.2086666666668,3
w13,48,128,8,4096,1536,16,32,128,1,4,4,881.2223333333333,3
w13,48,128,8,4096,1536,16,32,128,4,4,4,879.7503333333334,3
w13,48,128,8,4096,1536,16,32,128,4,4,5,879.6433333333334,3
w13,48,128,8,4096,1536,16,32,128,16,4,3,878.5450000000001,3
w13,48,128,8,4096,1536,16,32,128,16,4,4,877.5846666666666,3
w13,48,128,8,4096,1536,16,32,128,32,4,3,877.8086666666667,3
w13,48,128,8,4096,1536,16,32,128,32,4,4,878.3103333333333,3
w13,48,128,8,4096,1536,16,32,128,64,4,4,880.977,3
w13,48,128,8,4096,1536,16,64,128,1,4,4,880.977,3
w13,48,128,8,4096,1536,16,64,128,16,4,3,880.5396666666667,3
w13,48,128,8,4096,1536,16,64,128,16,4,4,873.926,3
w13,48,128,8,4096,1536,16,64,128,16,8,4,878.1396666666666,3
w13,48,128,8,4096,1536,16,64,128,32,4,3,877.4246666666667,3
w13,48,128,8,4096,1536,16,64,128,32,4,4,876.1233333333333,3
w13,48,128,8,4096,1536,16,64,128,32,8,4,878.5659999999999,3
w13,48,128,8,4096,1536,16,64,128,64,4,3,879.0143333333334,3
w13,48,128,8,4096,1536,16,64,128,64,4,4,876.8913333333334,3
w13,48,128,8,4096,1536,16,64,128,64,8,4,880.0383333333333,3
w13,48,128,8,4096,1536,16,128,128,16,4,3,874.2143333333333,3
w13,48,128,8,4096,1536,16,128,128,16,4,4,876.7743333333333,3
w13,48,128,8,4096,1536,16,128,128,16,8,3,873.9583333333334,3
w13,48,128,8,4096,1536,16,128,128,16,8,4,872.5076666666668,3
w13,48,128,8,4096,1536,16,128,128,32,4,4,878.5553333333334,3
w13,48,128,8,4096,1536,16,128,128,32,8,3,876.5183333333334,3
w13,48,128,8,4096,1536,16,128,128,32,8,4,877.1156666666666,3
w13,48,128,8,4096,1536,16,128,128,64,4,4,880.7743333333334,3
w13,48,128,8,4096,1536,16,128,128,64,8,3,879.4946666666666,3
w13,48,128,8,4096,1536,16,128,128,64,8,4,877.2966666666667,3
w13,48,128,8,4096,3072,16,32,128,4,4,3,1740.1826666666666,3
w13,48,128,8,4096,3072,16,32,128,4,4,4,1737.2916666666667,3
w13,48,128,8,4096,3072,16,32,128,4,4,5,1741.1526666666666,3
w13,48,128,8,4096,3072,16,32,128,16,4,3,1738.262,3
w13,48,128,8,4096,3072,16,32,128,16,4,4,1735.713,3
w13,48,128,8,4096,3072,16,32,128,16,4,5,1743.6589999999999,3
w13,48,128,8,4096,3072,16,32,128,32,4,3,1743.9906666666666,3
w13,48,128,8,4096,3072,16,32,128,32,4,4,1740.9396666666664,3
w13,48,128,8,4096,3072,16,64,128,16,4,3,1737.2596666666668,3
w13,48,128,8,4096,3072,16,64,128,16,4,4,1730.6036666666666,3
w13,48,128,8,4096,3072,16,64,128,16,8,3,1744.2566666666664,3
w13,48,128,8,4096,3072,16,64,128,16,8,4,1735.7346666666665,3
w13,48,128,8,4096,3072,16,64,128,32,4,3,1738.8486666666668,3
w13,48,128,8,4096,3072,16,64,128,32,4,4,1736.737,3
w13,48,128,8,4096,3072,16,64,128,32,8,4,1738.6036666666666,3
w13,48,128,8,4096,3072,16,64,128,64,4,3,1742.5926666666667,3
w13,48,128,8,4096,3072,16,64,128,64,4,4,1743.5739999999998,3
w13,48,128,8,4096,3072,16,128,128,16,4,3,1735.2013333333334,3
w13,48,128,8,4096,3072,16,128,128,16,4,4,1731.3293333333334,3
w13,48,128,8,4096,3072,16,128,128,16,8,3,1733.42,3
w13,48,128,8,4096,3072,16,128,128,16,8,4,1729.537,3
w13,48,128,8,4096,3072,16,128,128,32,4,3,1737.1213333333333,3
w13,48,128,8,4096,3072,16,128,128,32,4,4,1735.7983333333334,3
w13,48,128,8,4096,3072,16,128,128,32,8,3,1735.5426666666665,3
w13,48,128,8,4096,3072,16,128,128,32,8,4,1734.7853333333333,3
w13,48,128,8,4096,3072,16,128,128,64,4,3,1744.876,3
w13,48,128,8,4096,3072,16,128,128,64,4,4,1746.4116666666666,3
w13,48,128,8,4096,3072,16,128,128,64,8,3,1743.7346666666665,3
w13,48,128,8,4096,3072,16,128,128,64,8,4,1744.3313333333333,3
w13,64,8,2,1024,512,16,128,64,1,8,3,7.372333333333334,3
w13,64,8,2,1024,512,16,128,64,1,8,4,7.308333333333334,3
w13,64,16,2,1536,768,16,32,64,1,4,3,26.060999999999996,3
w13,64,16,2,1536,768,16,64,64,1,4,3,25.911333333333335,3
w13,64,16,2,1536,768,16,64,64,16,4,4,26.039666666666665,3
w13,64,16,2,1536,768,16,64,64,64,4,3,26.10366666666667,3
w13,64,16,4,1536,1024,16,64,64,1,4,3,33.29266666666667,3
w13,64,16,4,1536,1024,16,64,64,16,4,3,33.367666666666665,3
w13,64,16,4,1536,1024,16,64,64,64,4,3,33.282333333333334,3
w13,64,16,4,1536,1024,16,64,128,16,4,2,33.33533333333333,3
w13,64,16,4,1536,1024,16,64,128,32,4,2,33.153999999999996,3
w13,64,32,4,2048,768,16,64,128,1,4,3,61.858666666666664,3
w13,64,32,4,2048,768,16,64,128,32,4,3,62.477000000000004,3
w13,64,32,6,3072,1024,16,32,128,1,4,3,121.293,3
w13,64,32,6,3072,1024,16,32,128,4,4,3,120.39733333333334,3
w13,64,32,6,3072,1024,16,32,128,16,4,3,121.05833333333334,3
w13,64,32,6,3072,1024,16,64,64,1,4,5,121.53800000000001,3
w13,64,32,6,3072,1024,16,64,128,16,4,3,121.101,3
w13,64,32,6,3072,1024,16,64,128,32,4,2,121.30366666666667,3
w13,64,32,6,3072,1024,16,64,128,32,4,3,121.06933333333332,3
w13,64,32,6,3072,1024,16,64,128,64,4,3,121.54899999999999,3
w13,64,32,6,3072,1024,16,128,128,1,8,4,121.197,3
w13,64,32,6,3072,1024,16,128,128,16,8,4,121.42133333333334,3
w13,64,32,6,3072,1024,16,128,128,64,8,4,121.31433333333332,3
w13,64,60,4,2048,1408,16,64,128,1,4,3,194.808,3
w13,64,60,4,2048,1408,16,64,128,1,4,4,194.54133333333334,3
w13,64,60,4,2048,1408,16,64,128,16,4,3,195.0856666666667,3
w13,64,60,4,2048,1408,16,64,128,32,4,3,194.71166666666667,3
w13,64,60,4,2048,1408,16,128,128,1,4,3,194.979,3
w13,64,60,4,2048,1408,16,128,128,1,8,3,193.21866666666665,3
w13,64,60,4,2048,1408,16,128,128,1,8,4,193.869,3
w13,64,60,4,2048,1408,16,128,128,16,8,3,194.9043333333333,3
w13,64,60,4,2048,1408,16,128,128,32,8,3,194.33866666666665,3
w13,64,60,4,2048,1408,16,128,128,64,8,3,194.275,3
w13,64,60,6,3584,2304,16,32,128,1,4,4,550.7136666666667,3
w13,64,60,6,3584,2304,16,32,128,16,4,4,550.234,3
w13,64,60,6,3584,2304,16,64,128,1,4,3,546.7676666666666,3
w13,64,60,6,3584,2304,16,64,128,1,4,4,548.2603333333333,3
w13,64,60,6,3584,2304,16,64,128,16,4,3,546.8743333333333,3
w13,64,60,6,3584,2304,16,64,128,16,4,4,549.125,3
w13,64,60,6,3584,2304,16,64,128,32,4,3,547.557,3
w13,64,60,6,3584,2304,16,64,128,32,4,4,550.9593333333333,3
w13,64,60,6,3584,2304,16,64,128,64,4,3,550.447,3
w13,64,60,6,3584,2304,16,128,128,1,4,3,548.8153333333333,3
w13,64,60,6,3584,2304,16,128,128,1,4,4,550.2126666666667,3
w13,64,60,6,3584,2304,16,128,128,1,8,3,546.9163333333333,3
w13,64,60,6,3584,2304,16,128,128,1,8,4,545.6903333333333,3
w13,64,60,6,3584,2304,16,128,128,16,4,3,548.1756666666666,3
w13,64,60,6,3584,2304,16,128,128,16,4,4,550.8103333333333,3
w13,64,60,6,3584,2304,16,128,128,16,8,3,547.845,3
w13,64,60,6,3584,2304,16,128,128,16,8,4,547.002,3
w13,64,60,6,3584,2304,16,128,128,32,4,3,548.4523333333333,3
w13,64,60,6,3584,2304,16,128,128,32,8,3,547.9726666666667,3
w13,64,60,6,3584,2304,16,128,128,32,8,4,547.8023333333333,3
w13,64,60,6,3584,2304,16,128,128,64,4,3,550.6393333333334,3
w13,64,60,6,3584,2304,16,128,128,64,8,3,550.0743333333334,3
w13,64,60,6,3584,2304,16,128,128,64,8,4,550.2769999999999,3
w13,64,60,8,2048,1536,16,64,128,1,4,3,212.8563333333333,3
w13,64,60,8,2048,1536,16,64,128,1,4,4,214.232,3
w13,64,60,8,2048,1536,16,128,128,1,8,3,212.451,3
w13,64,60,8,2048,1536,16,128,128,1,8,4,214.43500000000003,3
w13,64,60,8,2048,1536,16,128,128,64,8,3,214.40200000000002,3
w13,64,64,6,3072,2048,16,32,128,1,4,3,449.47633333333334,3
w13,64,64,6,3072,2048,16,32,128,1,4,4,447.32099999999997,3
w13,64,64,6,3072,2048,16,32,128,4,4,3,449.57233333333335,3
w13,64,64,6,3072,2048,16,32,128,4,4,4,448.28133333333335,3
w13,64,64,6,3072,2048,16,64,128,1,4,3,445.78566666666666,3
w13,64,64,6,3072,2048,16,64,128,1,4,4,445.91366666666664,3
w13,64,64,6,3072,2048,16,64,128,16,4,3,449.07099999999997,3
w13,64,64,6,3072,2048,16,64,128,16,4,4,449.44399999999996,3
w13,64,64,6,3072,2048,16,64,128,32,4,4,449.583,3
w13,64,64,6,3072,2048,16,128,128,1,4,3,448.74,3
w13,64,64,6,3072,2048,16,128,128,1,4,4,449.4983333333333,3
w13,64,64,6,3072,2048,16,128,128,1,8,3,445.62600000000003,3
w13,64,64,6,3072,2048,16,128,128,1,8,4,445.4013333333333,3
w13,64,64,6,3072,2048,16,128,128,16,8,3,447.055,3
w13,64,64,6,3072,2048,16,128,128,16,8,4,447.311,3
w13,64,64,6,3072,2048,16,128,128,32,8,3,446.92699999999996,3
w13,64,64,6,3072,2048,16,128,128,32,8,4,447.663,3
w13,64,64,6,3072,2048,16,128,128,64,8,3,448.1213333333333,3
w13,64,64,6,3072,2048,16,128,128,64,8,4,448.93233333333336,3
w13,64,64,6,3584,1536,16,32,128,1,4,4,393.15599999999995,3
w13,64,64,6,3584,1536,16,64,128,1,4,3,393.604,3
w13,64,64,6,3584,1536,16,64,128,1,4,4,392.05733333333336,3
w13,64,64,6,3584,1536,16,64,128,16,4,3,392.94233333333335,3
w13,64,64,6,3584,1536,16,64,128,16,4,4,393.71066666666667,3
w13,64,64,6,3584,1536,16,64,128,32,4,4,394.564,3
w13,64,64,6,3584,1536,16,128,128,1,4,3,394.64900000000006,3
w13,64,64,6,3584,1536,16,128,128,1,8,3,392.7716666666667,3
w13,64,64,6,3584,1536,16,128,128,1,8,4,392.30266666666665,3
w13,64,64,6,3584,1536,16,128,128,16,4,3,393.95599999999996,3
w13,64,64,6,3584,1536,16,128,128,16,8,3,390.916,3
w13,64,64,6,3584,1536,16,128,128,16,8,4,394.39300000000003,3
w13,64,64,6,3584,1536,16,128,128,32,4,3,394.8516666666667,3
w13,64,64,6,3584,1536,16,128,128,32,8,3,394.45733333333334,3
w13,64,64,6,3584,1536,16,128,128,32,8,4,394.45700000000005,3
w13,64,64,8,3584,2560,16,32,128,1,4,4,650.1926666666667,3
w13,64,64,8,3584,2560,16,32,128,4,4,4,652.453,3
w13,64,64,8,3584,2560,16,64,128,1,4,3,649.371,3
w13,64,64,8,3584,2560,16,64,128,1,4,4,649.5303333333334,3
w13,64,64,8,3584,2560,16,64,128,16,4,3,652.08,3
w13,64,64,8,3584,2560,16,64,128,32,4,3,652.1016666666667,3
w13,64,64,8,3584,2560,16,64,128,64,4,3,652.688,3
w13,64,64,8,3584,2560,16,128,128,1,4,3,649.9463333333333,3
w13,64,64,8,3584,2560,16,128,128,1,4,4,649.7553333333334,3
w13,64,64,8,3584,2560,16,128,128,1,8,3,648.1329999999999,3
w13,64,64,8,3584,2560,16,128,128,1,8,4,646.5866666666667,3
w13,64,64,8,3584,2560,16,128,128,16,4,3,650.9703333333333,3
w13,64,64,8,3584,2560,16,128,128,16,8,3,649.264,3
w13,64,64,8,3584,2560,16,128,128,16,8,4,649.8823333333333,3
w13,64,64,8,3584,2560,16,128,128,32,4,3,652.8376666666667,3
w13,64,64,8,3584,2560,16,128,128,32,8,3,650.1283333333333,3
w13,64,64,8,3584,2560,16,128,128,32,8,4,650.3523333333333,3
w13,64,64,8,3584,2560,16,128,128,64,8,3,652.166,3
w13,64,128,4,2048,512,16,64,128,1,4,3,151.61866666666666,3
w13,64,128,4,2048,512,16,64,128,1,4,4,150.65866666666668,3
w13,64,128,4,2048,512,16,128,128,1,8,3,151.11766666666665,3
w13,64,128,4,2048,512,16,128,128,1,8,4,151.64000000000001,3
w13,64,128,4,2048,512,16,128,128,16,8,3,151.96033333333332,3
w13,64,128,4,2048,512,16,128,128,32,8,3,151.65,3
w13,64,128,6,4096,2048,16,32,128,1,4,4,1169.2346666666665,3
w13,64,128,6,4096,2048,16,32,128,4,4,5,1171.1333333333332,3
w13,64,128,6,4096,2048,16,32,128,16,4,3,1166.28,3
w13,64,128,6,4096,2048,16,32,128,16,4,4,1164.7436666666665,3
w13,64,128,6,4096,2048,16,32,128,16,4,5,1171.2716666666668,3
w13,64,128,6,4096,2048,16,32,128,32,4,3,1168.424,3
w13,64,128,6,4096,2048,16,32,128,32,4,4,1165.9386666666667,3
w13,64,128,6,4096,2048,16,32,128,64,4,3,1171.9336666666666,3
w13,64,128,6,4096,2048,16,64,128,1,4,4,1171.4003333333333,3
w13,64,128,6,4096,2048,16,64,128,16,4,3,1164.4026666666666,3
w13,64,128,6,4096,2048,16,64,128,16,4,4,1160.2533333333333,3
w13,64,128,6,4096,2048,16,64,128,16,8,3,1168.6803333333335,3
w13,64,128,6,4096,2048,16,64,128,16,8,4,1162.963,3
w13,64,128,6,4096,2048,16,64,128,32,4,3,1166.952,3
w13,64,128,6,4096,2048,16,64,128,32,4,4,1162.7176666666667,3
w13,64,128,6,4096,2048,16,64,128,32,8,3,1171.4106666666667,3
w13,64,128,6,4096,2048,16,64,128,32,8,4,1165.277,3
w13,64,128,6,4096,2048,16,64,128,64,4,3,1166.675,3
w13,64,128,6,4096,2048,16,64,128,64,4,4,1168.573,3
w13,64,128,6,4096,2048,16,64,128,64,8,4,1171.1656666666665,3
w13,64,128,6,4096,2048,16,128,128,1,4,3,1171.304,3
w13,64,128,6,4096,2048,16,128,128,1,8,3,1171.3676666666668,3
w13,64,128,6,4096,2048,16,128,128,1,8,4,1168.7973333333332,3
w13,64,128,6,4096,2048,16,128,128,16,4,3,1163.3363333333334,3
w13,64,128,6,4096,2048,16,128,128,16,4,4,1162.9946666666667,3
w13,64,128,6,4096,2048,16,128,128,16,8,3,1164.4883333333335,3
w13,64,128,6,4096,2048,16,128,128,16,8,4,1161.0426666666667,3
w13,64,128,6,4096,2048,16,128,128,32,4,3,1167.1013333333333,3
w13,64,128,6,4096,2048,16,128,128,32,4,4,1165.6506666666667,3
w13,64,128,6,4096,2048,16,128,128,32,8,3,1166.44,3
w13,64,128,6,4096,2048,16,128,128,32,8,4,1165.0320000000002,3
w13,64,128,6,4096,2048,16,128,128,64,8,3,1171.2293333333334,3
w13,64,128,6,4096,2048,16,128,128,64,8,4,1168.7653333333335,3
w13,64,128,8,2048,768,16,64,128,1,4,3,223.854,3
w13,64,128,8,2048,768,16,64,128,1,4,4,223.9706666666667,3
w13,64,128,8,2048,768,16,128,128,1,8,3,222.48799999999997,3
w13,64,128,8,2048,768,16,128,128,1,8,4,224.61100000000002,3
w13,64,128,8,4096,1536,16,32,128,1,4,5,881.6063333333333,3
w13,64,128,8,4096,1536,16,32,128,4,4,4,876.6043333333333,3
w13,64,128,8,4096,1536,16,32,128,4,4,5,876.8493333333332,3
w13,64,128,8,4096,1536,16,32,128,16,4,3,882.3103333333333,3
w13,64,128,8,4096,1536,16,32,128,16,4,4,879.0036666666666,3
w13,64,128,8,4096,1536,16,32,128,16,4,5,882.993,3
w13,64,128,8,4096,1536,16,32,128,32,4,3,880.6886666666666,3
w13,64,128,8,4096,1536,16,32,128,32,4,4,879.3883333333333,3
w13,64,128,8,4096,1536,16,32,128,32,4,5,883.5903333333332,3
w13,64,128,8,4096,1536,16,32,128,64,4,3,883.004,3
w13,64,128,8,4096,1536,16,32,128,64,4,4,881.4459999999999,3
w13,64,128,8,4096,1536,16,64,128,1,4,3,881.6383333333333,3
w13,64,128,8,4096,1536,16,64,128,1,4,4,883.3553333333333,3
w13,64,128,8,4096,1536,16,64,128,16,4,3,876.9026666666667,3
w13,64,128,8,4096,1536,16,64,128,16,4,4,877.009,3
w13,64,128,8,4096,1536,16,64,128,16,8,3,882.7479999999999,3
w13,64,128,8,4096,1536,16,64,128,16,8,4,880.1986666666667,3
w13,64,128,8,4096,1536,16,64,128,32,4,3,878.812,3
w13,64,128,8,4096,1536,16,64,128,32,4,4,876.689,3
w13,64,128,8,4096,1536,16,64,128,32,8,4,879.2280000000001,3
w13,64,128,8,4096,1536,16,64,128,64,4,3,880.166,3
w13,64,128,8,4096,1536,16,64,128,64,4,4,880.1986666666667,3
w13,64,128,8,4096,1536,16,128,128,1,4,3,882.7696666666667,3
w13,64,128,8,4096,1536,16,128,128,1,8,3,881.1366666666667,3
w13,64,128,8,4096,1536,16,128,128,1,8,4,881.1156666666666,3
w13,64,128,8,4096,1536,16,128,128,16,4,3,877.3286666666667,3
w13,64,128,8,4096,1536,16,128,128,16,4,4,877.596,3
w13,64,128,8,4096,1536,16,128,128,16,8,3,878.0966666666667,3
w13,64,128,8,4096,1536,16,128,128,16,8,4,875.4196666666667,3
w13,64,128,8,4096,1536,16,128,128,32,4,3,879.6753333333332,3
w13,64,128,8,4096,1536,16,128,128,32,4,4,880.188,3
w13,64,128,8,4096,1536,16,128,128,32,8,3,878.8436666666666,3
w13,64,128,8,4096,1536,16,128,128,32,8,4,877.4573333333334,3
w13,64,128,8,4096,1536,16,128,128,64,4,3,882.2463333333334,3
w13,64,128,8,4096,1536,16,128,128,64,4,4,882.8763333333333,3
w13,64,128,8,4096,1536,16,128,128,64,8,3,879.1846666666667,3
w13,64,128,8,4096,1536,16,128,128,64,8,4,878.833,3
w13,64,128,8,4096,3072,16,32,128,4,4,3,1744.9823333333334,3
w13,64,128,8,4096,3072,16,32,128,4,4,4,1741.8999999999999,3
w13,64,128,8,4096,3072,16,32,128,4,4,5,1742.6149999999998,3
w13,64,128,8,4096,3072,16,32,128,16,4,3,1741.1533333333334,3
w13,64,128,8,4096,3072,16,32,128,16,4,4,1739.9483333333335,3
w13,64,128,8,4096,3072,16,32,128,16,4,5,1746.6786666666667,3
w13,64,128,8,4096,3072,16,32,128,32,4,3,1747.1593333333333,3
w13,64,128,8,4096,3072,16,32,128,32,4,4,1746.3376666666666,3
w13,64,128,8,4096,3072,16,64,128,16,4,3,1737.5266666666666,3
w13,64,128,8,4096,3072,16,64,128,16,4,4,1735.9906666666666,3
w13,64,128,8,4096,3072,16,64,128,16,8,3,1746.4973333333335,3
w13,64,128,8,4096,3072,16,64,128,16,8,4,1737.932,3
w13,64,128,8,4096,3072,16,64,128,32,4,3,1744.2893333333334,3
w13,64,128,8,4096,3072,16,64,128,32,4,4,1741.5803333333333,3
w13,64,128,8,4096,3072,16,64,128,32,8,4,1747.682,3
w13,64,128,8,4096,3072,16,128,128,16,4,3,1737.2283333333332,3
w13,64,128,8,4096,3072,16,128,128,16,4,4,1733.5373333333334,3
w13,64,128,8,4096,3072,16,128,128,16,8,3,1736.5453333333332,3
w13,64,128,8,4096,3072,16,128,128,16,8,4,1731.18,3
w13,64,128,8,4096,3072,16,128,128,32,4,3,1741.6760000000002,3
w13,64,128,8,4096,3072,16,128,128,32,4,4,1739.7240000000002,3
w13,64,128,8,4096,3072,16,128,128,32,8,3,1739.692,3
w13,64,128,8,4096,3072,16,128,128,32,8,4,1738.5506666666668,3
w13,64,128,8,4096,3072,16,128,128,64,4,3,1746.2733333333333,3
w13,64,128,8,4096,3072,16,128,128,64,8,3,1745.964,3
w13,64,128,8,4096,3072,16,128,128,64,8,4,1745.996,3
w13,96,8,2,1024,512,16,128,32,1,4,4,10.284333333333334,3
w13,96,16,2,1536,768,16,32,64,16,4,3,26.476333333333333,3
w13,96,16,2,1536,768,16,64,64,1,4,4,26.25266666666667,3
w13,96,16,2,1536,768,16,64,64,16,4,3,26.498,3
w13,96,16,2,1536,768,16,64,64,16,4,4,26.380666666666666,3
w13,96,16,2,1536,768,16,64,64,32,4,3,26.380666666666666,3
w13,96,16,2,1536,768,16,64,64,32,4,4,26.498,3
w13,96,16,2,1536,768,16,64,64,64,4,3,26.306,3
w13,96,16,4,1536,1024,32,64,64,1,4,4,45.666,3
w13,96,16,4,1536,1024,32,64,64,1,8,4,45.37833333333333,3
w13,96,16,4,1536,1024,32,64,64,1,8,5,45.51666666666666,3
w13,96,16,4,1536,1024,32,64,128,4,8,3,45.324666666666666,3
w13,96,16,4,1536,1024,32,64,128,16,8,3,45.27166666666667,3
w13,96,16,4,1536,1024,32,64,128,32,8,3,45.35666666666666,3
w13,96,16,4,1536,1024,32,64,128,64,8,3,45.357,3
w13,96,32,4,2048,768,16,64,128,1,4,3,63.02066666666667,3
w13,96,32,4,2048,768,16,64,128,16,4,3,63.096000000000004,3
w13,96,32,4,2048,768,16,64,128,32,4,3,63.245000000000005,3
w13,96,32,4,2048,768,16,64,128,64,4,3,63.169999999999995,3
w13,96,32,4,2048,768,16,128,128,1,8,3,63.074333333333335,3
w13,96,32,6,3072,1024,32,64,64,1,4,4,166.882,3
w13,96,32,6,3072,1024,32,64,64,64,4,4,167.56533333333334,3
w13,96,32,6,3072,1024,32,64,128,4,8,3,167.13833333333332,3
w13,96,32,6,3072,1024,32,64,128,16,8,3,167.28733333333335,3
w13,96,32,6,3072,1024,32,64,128,32,4,3,167.49,3
w13,96,32,6,3072,1024,32,64,128,32,8,3,167.28733333333332,3
w13,96,32,6,3072,1024,32,64,128,64,4,3,167.72566666666668,3
w13,96,32,6,3072,1024,32,64,128,64,8,3,166.86066666666667,3
w13,96,32,6,3072,1024,32,128,64,1,4,3,166.48766666666668,3
w13,96,32,6,3072,1024,32,128,64,1,4,4,166.1676666666667,3
w13,96,60,4,2048,1408,16,128,128,1,8,3,193.22933333333333,3
w13,96,60,4,2048,1408,16,128,128,16,8,3,195.07466666666664,3
w13,96,60,6,3584,2304,16,32,128,1,4,4,552.7510000000001,3
w13,96,60,6,3584,2304,16,32,128,1,4,5,554.1696666666667,3
w13,96,60,6,3584,2304,16,64,128,1,4,3,550.533,3
w13,96,60,6,3584,2304,16,64,128,1,4,4,552.677,3
w13,96,60,6,3584,2304,16,64,128,16,4,3,551.802,3
w13,96,60,6,3584,2304,16,64,128,16,4,4,553.189,3
w13,96,60,6,3584,2304,16,64,128,32,4,3,551.8983333333333,3
w13,96,60,6,3584,2304,16,128,128,1,4,3,552.5703333333333,3
w13,96,60,6,3584,2304,16,128,128,1,4,4,554.0846666666666,3
w13,96,60,6,3584,2304,16,128,128,1,8,3,548.8476666666667,3
w13,96,60,6,3584,2304,16,128,128,1,8,4,548.7623333333332,3
w13,96,60,6,3584,2304,16,128,128,16,4,3,551.8663333333334,3
w13,96,60,6,3584,2304,16,128,128,16,4,4,553.8716666666667,3
w13,96,60,6,3584,2304,16,128,128,16,8,3,550.6073333333334,3
w13,96,60,6,3584,2304,16,128,128,16,8,4,549.8183333333333,3
w13,96,60,6,3584,2304,16,128,128,32,4,3,552.698,3
w13,96,60,6,3584,2304,16,128,128,32,8,3,551.1303333333334,3
w13,96,60,6,3584,2304,16,128,128,32,8,4,551.29,3
w13,96,60,6,3584,2304,16,128,128,64,8,3,554.2126666666667,3
w13,96,60,6,3584,2304,16,128,128,64,8,4,554.1166666666667,3
w13,96,60,8,2048,1536,16,64,128,1,4,3,214.09366666666665,3
w13,96,60,8,2048,1536,16,64,128,1,4,4,216.18433333333334,3
w13,96,60,8,2048,1536,16,128,128,1,4,3,216.10966666666664,3
w13,96,60,8,2048,1536,16,128,128,1,8,3,214.02966666666666,3
w13,96,60,8,2048,1536,16,128,128,1,8,4,215.86433333333332,3
w13,96,60,8,2048,1536,16,128,128,32,8,3,215.843,3
w13,96,64,6,3072,2048,16,32,128,1,4,3,450.959,3
w13,96,64,6,3072,2048,16,32,128,1,4,4,449.231,3
w13,96,64,6,3072,2048,16,64,128,1,4,3,448.3243333333333,3
w13,96,64,6,3072,2048,16,64,128,1,4,4,449.3376666666666,3
w13,96,64,6,3072,2048,16,64,128,16,4,3,449.135,3
w13,96,64,6,3072,2048,16,64,128,32,4,3,449.007,3
w13,96,64,6,3072,2048,16,128,128,1,8,3,446.82,3
w13,96,64,6,3072,2048,16,128,128,1,8,4,448.132,3
w13,96,64,6,3072,2048,16,128,128,16,8,3,449.423,3
w13,96,64,6,3072,2048,16,128,128,16,8,4,449.95599999999996,3
w13,96,64,6,3072,2048,16,128,128,32,4,3,450.9376666666667,3
w13,96,64,6,3072,2048,16,128,128,32,8,3,448.28133333333335,3
w13,96,64,6,3072,2048,16,128,128,32,8,4,450.5643333333333,3
w13,96,64,6,3072,2048,16,128,128,64,8,3,450.06333333333333,3
w13,96,64,6,3584,1536,16,32,128,1,4,4,396.644,3
w13,96,64,6,3584,1536,16,64,128,1,4,4,394.77700000000004,3
w13,96,64,6,3584,1536,16,64,128,16,4,3,395.481,3
w13,96,64,6,3584,1536,16,64,128,16,4,4,396.388,3
w13,96,64,6,3584,1536,16,64,128,32,4,3,396.60099999999994,3
w13,96,64,6,3584,1536,16,128,128,1,4,3,396.4413333333334,3
w13,96,64,6,3584,1536,16,128,128,1,8,3,394.58500000000004,3
w13,96,64,6,3584,1536,16,128,128,1,8,4,394.8623333333333,3
w13,96,64,6,3584,1536,16,128,128,16,4,3,396.2706666666666,3
w13,96,64,6,3584,1536,16,128,128,16,8,3,393.1666666666667,3
w13,96,64,6,3584,1536,16,128,128,16,8,4,395.12899999999996,3
w13,96,64,6,3584,1536,16,128,128,32,8,3,393.817,3
w13,96,64,6,3584,1536,16,128,128,64,8,3,395.8443333333333,3
w13,96,64,8,3584,2560,16,32,128,1,4,4,655.0136666666667,3
w13,96,64,8,3584,2560,16,32,128,1,4,5,657.061,3
w13,96,64,8,3584,2560,16,64,128,1,4,3,653.7973333333333,3
w13,96,64,8,3584,2560,16,64,128,1,4,4,654.9606666666667,3
w13,96,64,8,3584,2560,16,64,128,16,4,3,658.1173333333332,3
w13,96,64,8,3584,2560,16,128,128,1,4,3,653.9793333333333,3
w13,96,64,8,3584,2560,16,128,128,1,4,4,656.1653333333334,3
w13,96,64,8,3584,2560,16,128,128,1,8,3,652.5286666666667,3
w13,96,64,8,3584,2560,16,128,128,1,8,4,651.7386666666666,3
w13,96,64,8,3584,2560,16,128,128,16,4,3,656.9653333333334,3
w13,96,64,8,3584,2560,16,128,128,16,4,4,658.1706666666666,3
w13,96,64,8,3584,2560,16,128,128,16,8,3,654.2773333333333,3
w13,96,64,8,3584,2560,16,128,128,16,8,4,655.728,3
w13,96,64,8,3584,2560,16,128,128,32,8,3,656.3576666666667,3
w13,96,64,8,3584,2560,16,128,128,32,8,4,656.6883333333334,3
w13,96,64,8,3584,2560,16,128,128,64,8,3,657.7333333333333,3
w13,96,128,4,2048,512,16,32,128,1,4,3,152.78166666666667,3
w13,96,128,4,2048,512,16,64,128,1,4,2,152.963,3
w13,96,128,4,2048,512,16,64,128,1,4,4,151.917,3
w13,96,128,4,2048,512,16,64,128,32,4,3,152.82433333333333,3
w13,96,128,4,2048,512,16,64,128,64,4,3,152.9523333333333,3
w13,96,128,4,2048,512,16,128,128,1,8,3,151.459,3
w13,96,128,4,2048,512,16,128,128,1,8,4,151.907,3
w13,96,128,4,2048,512,16,128,128,32,8,3,152.40766666666664,3
w13,96,128,6,4096,2048,16,32,128,4,4,5,1172.531,3
w13,96,128,6,4096,2048,16,32,128,16,4,3,1170.9096666666667,3
w13,96,128,6,4096,2048,16,32,128,16,4,4,1167.1443333333334,3
w13,96,128,6,4096,2048,16,32,128,16,4,5,1173.0216666666668,3
w13,96,128,6,4096,2048,16,32,128,32,4,4,1172.4350000000002,3
w13,96,128,6,4096,2048,16,64,128,16,4,3,1171.6776666666667,3
w13,96,128,6,4096,2048,16,64,128,16,4,4,1162.856,3
w13,96,128,6,4096,2048,16,64,128,16,8,3,1172.691,3
w13,96,128,6,4096,2048,16,64,128,16,8,4,1166.6426666666666,3
w13,96,128,6,4096,2048,16,64,128,32,4,3,1172.211,3
w13,96,128,6,4096,2048,16,64,128,32,4,4,1168.1896666666669,3
w13,96,128,6,4096,2048,16,64,128,32,8,4,1170.7923333333333,3
w13,96,128,6,4096,2048,16,64,128,64,4,4,1172.9256666666668,3
w13,96,128,6,4096,2048,16,128,128,1,4,3,1173.6833333333334,3
w13,96,128,6,4096,2048,16,128,128,1,8,3,1173.2666666666667,3
w13,96,128,6,4096,2048,16,128,128,16,4,3,1168.1256666666668,3
w13,96,128,6,4096,2048,16,128,128,16,4,4,1165.8536666666666,3
w13,96,128,6,4096,2048,16,128,128,16,8,3,1166.526,3
w13,96,128,6,4096,2048,16,128,128,16,8,4,1163.2506666666666,3
w13,96,128,6,4096,2048,16,128,128,32,4,3,1170.6426666666666,3
w13,96,128,6,4096,2048,16,128,128,32,4,4,1169.1390000000001,3
w13,96,128,6,4096,2048,16,128,128,32,8,3,1170.696,3
w13,96,128,6,4096,2048,16,128,128,32,8,4,1168.8726666666666,3
w13,96,128,8,2048,768,16,64,128,1,4,3,224.47233333333335,3
w13,96,128,8,2048,768,16,128,128,1,8,3,224.91033333333334,3
w13,96,128,8,2048,768,16,128,128,1,8,4,225.67766666666668,3
w13,96,128,8,2048,768,16,128,128,16,8,3,226.24300000000002,3
w13,96,128,8,4096,1536,16,32,128,1,4,5,887.3773333333334,3
w13,96,128,8,4096,1536,16,32,128,4,4,4,886.14,3
w13,96,128,8,4096,1536,16,32,128,4,4,5,884.252,3
w13,96,128,8,4096,1536,16,32,128,16,4,3,886.343,3
w13,96,128,8,4096,1536,16,32,128,16,4,4,884.1446666666667,3
w13,96,128,8,4096,1536,16,32,128,16,4,5,886.15,3
w13,96,128,8,4096,1536,16,32,128,32,4,3,886.3743333333333,3
w13,96,128,8,4096,1536,16,32,128,32,4,4,883.1746666666667,3
w13,96,128,8,4096,1536,16,32,128,32,4,5,887.0363333333333,3
w13,96,128,8,4096,1536,16,32,128,64,4,3,886.4486666666667,3
w13,96,128,8,4096,1536,16,32,128,64,4,4,886.8966666666666,3
w13,96,128,8,4096,1536,16,64,128,1,4,4,886.438,3
w13,96,128,8,4096,1536,16,64,128,16,4,3,883.1216666666666,3
w13,96,128,8,4096,1536,16,64,128,16,4,4,881.062,3
w13,96,128,8,4096,1536,16,64,128,16,8,3,885.6276666666666,3
w13,96,128,8,4096,1536,16,64,128,16,8,4,883.3560000000001,3
w13,96,128,8,4096,1536,16,64,128,32,4,3,880.9879999999999,3
w13,96,128,8,4096,1536,16,64,128,32,4,4,882.2566666666667,3
w13,96,128,8,4096,1536,16,64,128,32,8,4,884.1236666666667,3
w13,96,128,8,4096,1536,16,64,128,64,4,3,885.2546666666667,3
w13,96,128,8,4096,1536,16,64,128,64,4,4,885.4253333333332,3
w13,96,128,8,4096,1536,16,128,128,1,4,3,886.3533333333334,3
w13,96,128,8,4096,1536,16,128,128,1,8,3,884.8276666666667,3
w13,96,128,8,4096,1536,16,128,128,1,8,4,884.9029999999999,3
w13,96,128,8,4096,1536,16,128,128,16,4,3,880.8816666666667,3
w13,96,128,8,4096,1536,16,128,128,16,4,4,880.3586666666666,3
w13,96,128,8,4096,1536,16,128,128,16,8,3,879.3023333333334,3
w13,96,128,8,4096,1536,16,128,128,16,8,4,878.6619999999999,3
w13,96,128,8,4096,1536,16,128,128,32,4,3,886.044,3
w13,96,128,8,4096,1536,16,128,128,32,4,4,884.743,3
w13,96,128,8,4096,1536,16,128,128,32,8,3,882.033,3
w13,96,128,8,4096,1536,16,128,128,32,8,4,881.959,3
w13,96,128,8,4096,1536,16,128,128,64,4,4,887.335,3
w13,96,128,8,4096,1536,16,128,128,64,8,3,885.6816666666667,3
w13,96,128,8,4096,1536,16,128,128,64,8,4,884.0276666666667,3
w13,96,128,8,4096,3072,16,32,128,1,4,5,1756.439,3
w13,96,128,8,4096,3072,16,32,128,4,4,3,1756.2146666666667,3
w13,96,128,8,4096,3072,16,32,128,4,4,4,1751.543,3
w13,96,128,8,4096,3072,16,32,128,4,4,5,1749.0573333333334,3
w13,96,128,8,4096,3072,16,32,128,16,4,3,1754.9566666666667,3
w13,96,128,8,4096,3072,16,32,128,16,4,4,1747.607,3
w13,96,128,8,4096,3072,16,32,128,16,4,5,1751.959,3
w13,96,128,8,4096,3072,16,32,128,32,4,3,1756.1193333333333,3
w13,96,128,8,4096,3072,16,32,128,32,4,4,1753.7939999999999,3
w13,96,128,8,4096,3072,16,64,128,16,4,3,1748.108,3
w13,96,128,8,4096,3072,16,64,128,16,4,4,1744.3963333333334,3
w13,96,128,8,4096,3072,16,64,128,16,8,3,1755.1696666666667,3
w13,96,128,8,4096,3072,16,64,128,16,8,4,1747.735,3
w13,96,128,8,4096,3072,16,64,128,32,4,3,1754.6366666666665,3
w13,96,128,8,4096,3072,16,64,128,32,4,4,1750.1993333333332,3
w13,96,128,8,4096,3072,16,64,128,32,8,4,1753.5159999999998,3
w13,96,128,8,4096,3072,16,128,128,1,8,3,1755.7143333333333,3
w13,96,128,8,4096,3072,16,128,128,16,4,3,1744.461,3
w13,96,128,8,4096,3072,16,128,128,16,4,4,1740.1719999999998,3
w13,96,128,8,4096,3072,16,128,128,16,8,3,1744.3856666666668,3
w13,96,128,8,4096,3072,16,128,128,16,8,4,1739.1593333333333,3
w13,96,128,8,4096,3072,16,128,128,32,4,3,1747.671,3
w13,96,128,8,4096,3072,16,128,128,32,4,4,1746.3590000000002,3
w13,96,128,8,4096,3072,16,128,128,32,8,3,1746.3166666666666,3
w13,96,128,8,4096,3072,16,128,128,32,8,4,1744.3116666666667,3
w13,96,128,8,4096,3072,16,128,128,64,4,3,1756.173,3
w13,96,128,8,4096,3072,16,128,128,64,8,3,1754.8280000000002,3
w13,128,8,2,1024,512,16,128,32,1,4,3,10.434,3
w13,128,8,2,1024,512,16,128,32,1,4,4,10.434,3
w13,128,8,2,1024,512,32,64,64,16,8,2,10.519333333333334,3
w13,128,8,2,1024,512,32,64,64,64,8,2,10.53,3
w13,128,16,2,1536,768,16,64,64,1,4,3,26.327333333333332,3
w13,128,16,2,1536,768,16,64,64,1,4,4,26.124666666666666,3
w13,128,16,2,1536,768,16,64,64,16,4,3,26.338000000000005,3
w13,128,16,2,1536,768,16,64,64,64,4,3,26.146,3
w13,128,16,4,1536,1024,32,64,64,1,4,4,45.65533333333334,3
w13,128,16,4,1536,1024,32,64,64,1,8,4,45.42066666666667,3
w13,128,16,4,1536,1024,32,64,128,4,8,3,45.48499999999999,3
w13,128,16,4,1536,1024,32,64,128,16,8,3,45.495666666666665,3
w13,128,16,4,1536,1024,32,64,128,32,8,3,45.36766666666667,3
w13,128,16,4,1536,1024,32,64,128,64,8,3,45.303666666666665,3
w13,128,32,4,2048,768,16,64,128,1,4,3,63.11666666666667,3
w13,128,32,4,2048,768,16,64,128,16,4,3,63.544000000000004,3
w13,128,32,4,2048,768,16,64,128,64,4,3,63.61833333333334,3
w13,128,32,6,3072,1024,32,64,64,1,4,4,167.66133333333335,3
w13,128,32,6,3072,1024,32,64,64,1,8,4,167.61833333333334,3
w13,128,32,6,3072,1024,32,64,128,4,8,3,167.70433333333332,3
w13,128,32,6,3072,1024,32,64,128,16,8,3,167.27766666666665,3
w13,128,32,6,3072,1024,32,64,128,32,8,3,167.64000000000001,3
w13,128,32,6,3072,1024,32,64,128,64,8,3,167.75766666666667,3
w13,128,32,6,3072,1024,32,128,64,1,4,3,166.50966666666667,3
w13,128,32,6,3072,1024,32,128,64,1,4,4,166.24266666666668,3
w13,128,60,4,2048,1408,16,64,128,1,4,3,195.39499999999998,3
w13,128,60,4,2048,1408,16,64,128,1,4,4,196.48266666666666,3
w13,128,60,4,2048,1408,16,128,128,1,4,3,196.78166666666667,3
w13,128,60,4,2048,1408,16,128,128,1,8,3,194.84,3
w13,128,60,4,2048,1408,16,128,128,1,8,4,195.928,3
w13,128,60,4,2048,1408,16,128,128,32,8,3,196.40800000000002,3
w13,128,60,6,3584,2304,16,64,128,1,4,3,555.3326666666667,3
w13,128,60,6,3584,2304,16,64,128,1,4,4,556.026,3
w13,128,60,6,3584,2304,16,64,128,16,4,3,553.9143333333333,3
w13,128,60,6,3584,2304,16,64,128,16,4,4,555.9733333333334,3
w13,128,60,6,3584,2304,16,64,128,32,4,3,555.013,3
w13,128,60,6,3584,2304,16,128,128,1,4,3,553.1143333333333,3
w13,128,60,6,3584,2304,16,128,128,1,8,3,552.3036666666667,3
w13,128,60,6,3584,2304,16,128,128,1,8,4,550.5966666666667,3
w13,128,60,6,3584,2304,16,128,128,16,4,3,554.5113333333334,3
w13,128,60,6,3584,2304,16,128,128,16,8,3,550.757,3
w13,128,60,6,3584,2304,16,128,128,16,8,4,551.8236666666667,3
w13,128,60,6,3584,2304,16,128,128,32,4,3,554.01,3
w13,128,60,6,3584,2304,16,128,128,32,8,3,552.0583333333333,3
w13,128,60,6,3584,2304,16,128,128,32,8,4,552.794,3
w13,128,60,8,2048,1536,32,64,64,1,4,3,289.763,3
w13,128,60,8,2048,1536,32,64,64,1,4,4,289.699,3
w13,128,60,8,2048,1536,32,64,64,16,4,3,291.72566666666665,3
w13,128,60,8,2048,1536,32,64,64,16,4,4,290.9683333333333,3
w13,128,60,8,2048,1536,32,64,64,64,4,3,289.1976666666667,3
w13,128,60,8,2048,1536,32,64,64,64,4,4,288.8136666666667,3
w13,128,64,6,3072,2048,16,32,128,1,4,4,452.07933333333335,3
w13,128,64,6,3072,2048,16,32,128,4,4,4,453.0183333333334,3
w13,128,64,6,3072,2048,16,64,128,1,4,3,450.27666666666664,3
w13,128,64,6,3072,2048,16,64,128,1,4,4,451.279,3
w13,128,64,6,3072,2048,16,64,128,16,4,3,452.645,3
w13,128,64,6,3072,2048,16,64,128,16,4,4,453.1133333333334,3
w13,128,64,6,3072,2048,16,128,128,1,8,3,448.8573333333334,3
w13,128,64,6,3072,2048,16,128,128,1,8,4,449.359,3
w13,128,64,6,3072,2048,16,128,128,16,8,3,451.204,3
w13,128,64,6,3072,2048,16,128,128,16,8,4,452.3883333333333,3
w13,128,64,6,3072,2048,16,128,128,32,8,3,450.6176666666667,3
w13,128,64,6,3072,2048,16,128,128,32,8,4,451.83366666666666,3
w13,128,64,6,3072,2048,16,128,128,64,8,3,451.90866666666665,3
w13,128,64,6,3584,1536,16,32,128,1,4,4,397.8923333333334,3
w13,128,64,6,3584,1536,16,64,128,1,4,3,397.95599999999996,3
w13,128,64,6,3584,1536,16,64,128,1,4,4,397.56166666666667,3
w13,128,64,6,3584,1536,16,64,128,16,4,3,398.041,3
w13,128,64,6,3584,1536,16,64,128,16,4,4,398.61733333333336,3
w13,128,64,6,3584,1536,16,128,128,1,4,3,398.64933333333335,3
w13,128,64,6,3584,1536,16,128,128,1,8,3,394.884,3
w13,128,64,6,3584,1536,16,128,128,1,8,4,397.625,3
w13,128,64,6,3584,1536,16,128,128,16,8,3,394.80933333333337,3
w13,128,64,6,3584,1536,16,128,128,16,8,4,398.4463333333333,3
w13,128,64,6,3584,1536,16,128,128,32,8,3,396.8143333333333,3
w13,128,64,6,3584,1536,16,128,128,64,8,3,397.8383333333333,3
w13,128,64,8,3584,2560,16,64,128,1,4,3,659.2483333333333,3
w13,128,64,8,3584,2560,16,64,128,1,4,4,658.3623333333334,3
w13,128,64,8,3584,2560,16,128,128,1,4,3,659.3233333333334,3
w13,128,64,8,3584,2560,16,128,128,1,4,4,658.779,3
w13,128,64,8,3584,2560,16,128,128,1,8,3,656.582,3
w13,128,64,8,3584,2560,16,128,128,1,8,4,654.5443333333333,3
w13,128,64,8,3584,2560,16,128,128,16,4,3,659.3123333333333,3
w13,128,64,8,3584,2560,16,128,128,16,8,3,657.2109999999999,3
w13,128,64,8,3584,2560,16,128,128,16,8,4,657.6593333333334,3
w13,128,64,8,3584,2560,16,128,128,32,8,3,657.872,3
w13,128,64,8,3584,2560,16,128,128,32,8,4,658.6083333333332,3
w13,128,128,4,2048,512,16,32,128,1,4,3,152.81333333333336,3
w13,128,128,4,2048,512,16,64,128,1,4,4,152.98433333333332,3
w13,128,128,4,2048,512,16,64,128,32,4,3,153.24,3
w13,128,128,4,2048,512,16,64,128,64,4,3,153.09066666666666,3
w13,128,128,4,2048,512,16,128,128,1,8,3,151.72566666666668,3
w13,128,128,4,2048,512,16,128,128,1,8,4,152.45066666666665,3
w13,128,128,4,2048,512,16,128,128,16,8,3,152.57899999999998,3
w13,128,128,4,2048,512,16,128,128,32,8,3,153.02700000000002,3
w13,128,128,6,4096,2048,16,32,128,1,4,4,1178.9096666666667,3
w13,128,128,6,4096,2048,16,32,128,1,4,5,1177.2776666666666,3
w13,128,128,6,4096,2048,16,32,128,4,4,5,1175.8590000000002,3
w13,128,128,6,4096,2048,16,32,128,16,4,3,1174.5366666666666,3
w13,128,128,6,4096,2048,16,32,128,16,4,4,1172.5526666666667,3
w13,128,128,6,4096,2048,16,32,128,16,4,5,1174.8346666666666,3
w13,128,128,6,4096,2048,16,32,128,32,4,3,1178.9103333333333,3
w13,128,128,6,4096,2048,16,32,128,32,4,4,1174.4936666666665,3
w13,128,128,6,4096,2048,16,64,128,1,4,4,1177.3743333333334,3
w13,128,128,6,4096,2048,16,64,128,16,4,3,1175.102,3
w13,128,128,6,4096,2048,16,64,128,16,4,4,1169.1076666666668,3
w13,128,128,6,4096,2048,16,64,128,16,8,3,1177.6726666666666,3
w13,128,128,6,4096,2048,16,64,128,16,8,4,1172.0723333333333,3
w13,128,128,6,4096,2048,16,64,128,32,4,3,1176.1156666666668,3
w13,128,128,6,4096,2048,16,64,128,32,4,4,1171.0266666666666,3
w13,128,128,6,4096,2048,16,64,128,32,8,4,1173.8106666666665,3
w13,128,128,6,4096,2048,16,64,128,64,4,4,1178.0133333333333,3
w13,128,128,6,4096,2048,16,128,128,1,4,3,1177.6090000000002,3
w13,128,128,6,4096,2048,16,128,128,1,4,4,1178.6753333333334,3
w13,128,128,6,4096,2048,16,128,128,1,8,3,1177.6403333333335,3
w13,128,128,6,4096,2048,16,128,128,1,8,4,1175.3043333333333,3
w13,128,128,6,4096,2048,16,128,128,16,4,3,1172.585,3
w13,128,128,6,4096,2048,16,128,128,16,4,4,1170.6216666666667,3
w13,128,128,6,4096,2048,16,128,128,16,8,3,1169.4586666666667,3
w13,128,128,6,4096,2048,16,128,128,16,8,4,1167.1976666666667,3
w13,128,128,6,4096,2048,16,128,128,32,4,3,1174.9099999999999,3
w13,128,128,6,4096,2048,16,128,128,32,4,4,1172.7333333333333,3
w13,128,128,6,4096,2048,16,128,128,32,8,3,1171.6346666666666,3
w13,128,128,6,4096,2048,16,128,128,32,8,4,1169.992,3
w13,128,128,6,4096,2048,16,128,128,64,8,4,1178.622,3
w13,128,128,8,2048,768,16,64,128,1,4,3,226.63766666666666,3
w13,128,128,8,2048,768,16,64,128,1,4,4,227.24566666666666,3
w13,128,128,8,2048,768,16,128,128,1,8,3,225.97633333333332,3
w13,128,128,8,2048,768,16,128,128,1,8,4,227.46933333333334,3
w13,128,128,8,2048,768,16,128,128,16,8,3,227.67233333333334,3
w13,128,128,8,2048,768,16,128,128,32,8,3,227.22400000000002,3
w13,128,128,8,2048,768,16,128,128,64,8,3,228.19533333333334,3
w13,128,128,8,4096,1536,16,32,128,1,4,5,888.4866666666667,3
w13,128,128,8,4096,1536,16,32,128,4,4,4,885.4576666666667,3
w13,128,128,8,4096,1536,16,32,128,4,4,5,882.6836666666667,3
w13,128,128,8,4096,1536,16,32,128,16,4,3,887.6966666666667,3
w13,128,128,8,4096,1536,16,32,128,16,4,4,886.151,3
w13,128,128,8,4096,1536,16,32,128,16,4,5,887.9636666666667,3
w13,128,128,8,4096,1536,16,32,128,32,4,4,888.38,3
w13,128,128,8,4096,1536,16,32,128,32,4,5,889.5213333333332,3
w13,128,128,8,4096,1536,16,32,128,64,4,4,888.8063333333333,3
w13,128,128,8,4096,1536,16,64,128,16,4,3,887.3133333333334,3
w13,128,128,8,4096,1536,16,64,128,16,4,4,884.625,3
w13,128,128,8,4096,1536,16,64,128,16,8,3,889.1909999999999,3
w13,128,128,8,4096,1536,16,64,128,16,8,4,887.3133333333334,3
w13,128,128,8,4096,1536,16,64,128,32,4,3,885.8306666666667,3
w13,128,128,8,4096,1536,16,64,128,32,4,4,885.735,3
w13,128,128,8,4096,1536,16,64,128,64,4,3,887.708,3
w13,128,128,8,4096,1536,16,64,128,64,4,4,888.8593333333333,3
w13,128,128,8,4096,1536,16,128,128,1,8,3,887.0786666666667,3
w13,128,128,8,4096,1536,16,128,128,1,8,4,888.476,3
w13,128,128,8,4096,1536,16,128,128,16,4,3,886.4813333333333,3
w13,128,128,8,4096,1536,16,128,128,16,4,4,886.2676666666666,3
w13,128,128,8,4096,1536,16,128,128,16,8,3,883.526,3
w13,128,128,8,4096,1536,16,128,128,16,8,4,880.7323333333334,3
w13,128,128,8,4096,1536,16,128,128,32,4,3,885.9796666666666,3
w13,128,128,8,4096,1536,16,128,128,32,4,4,885.8626666666665,3
w13,128,128,8,4096,1536,16,128,128,32,8,3,882.7373333333334,3
w13,128,128,8,4096,1536,16,128,128,32,8,4,884.2416666666667,3
w13,128,128,8,4096,1536,16,128,128,64,8,3,886.311,3
w13,128,128,8,4096,1536,16,128,128,64,8,4,887.9323333333333,3
w13,128,128,8,4096,3072,16,32,128,4,4,4,1759.8950000000002,3
w13,128,128,8,4096,3072,16,32,128,4,4,5,1754.8393333333333,3
w13,128,128,8,4096,3072,16,32,128,16,4,3,1757.4530000000002,3
w13,128,128,8,4096,3072,16,32,128,16,4,4,1755.906,3
w13,128,128,8,4096,3072,16,32,128,16,4,5,1760.1516666666666,3
w13,128,128,8,4096,3072,16,64,128,16,4,3,1755.5326666666667,3
w13,128,128,8,4096,3072,16,64,128,16,4,4,1751.756666666667,3
w13,128,128,8,4096,3072,16,64,128,16,8,3,1760.5566666666666,3
w13,128,128,8,4096,3072,16,64,128,16,8,4,1755.01,3
w13,128,128,8,4096,3072,16,64,128,32,4,4,1757.6766666666665,3
w13,128,128,8,4096,3072,16,64,128,32,8,4,1761.186,3
w13,128,128,8,4096,3072,16,128,128,16,4,3,1749.954,3
w13,128,128,8,4096,3072,16,128,128,16,4,4,1748.3436666666666,3
w13,128,128,8,4096,3072,16,128,128,16,8,3,1746.5296666666666,3
w13,128,128,8,4096,3072,16,128,128,16,8,4,1743.9273333333333,3
w13,128,128,8,4096,3072,16,128,128,32,4,3,1753.2713333333334,3
w13,128,128,8,4096,3072,16,128,128,32,4,4,1754.6686666666667,3
w13,128,128,8,4096,3072,16,128,128,32,8,3,1751.4476666666667,3
w13,128,128,8,4096,3072,16,128,128,32,8,4,1751.1913333333334,3
w13,256,8,2,1024,512,64,64,64,1,4,2,11.703333333333333,3
w13,256,8,2,1024,512,64,64,64,1,4,3,11.713666666666667,3
w13,256,8,2,1024,512,64,64,64,4,8,2,11.703333333333333,3
w13,256,8,2,1024,512,64,64,64,16,8,2,11.671666666666667,3
w13,256,8,2,1024,512,64,64,64,32,8,2,11.628666666666668,3
w13,256,8,2,1024,512,64,64,64,64,8,2,11.639333333333333,3
w13,256,8,2,1024,512,64,128,32,8,4,3,11.596666666666666,3
w13,256,8,2,1024,512,64,128,32,8,4,4,11.682333333333332,3
w13,256,8,2,1024,512,64,128,32,8,8,3,11.618,3
w13,256,8,2,1024,512,64,128,32,8,8,4,11.692666666666668,3
w13,256,16,2,1536,768,32,64,64,1,4,4,34.03933333333333,3
w13,256,16,2,1536,768,32,64,64,1,8,4,34.050333333333334,3
w13,256,16,2,1536,768,32,64,64,16,4,4,34.317,3
w13,256,16,2,1536,768,32,64,64,64,4,4,34.23166666666666,3
w13,256,16,2,1536,768,32,64,128,4,8,3,34.221,3
w13,256,16,2,1536,768,32,64,128,16,8,3,34.220666666666666,3
w13,256,16,2,1536,768,32,64,128,32,8,3,34.209666666666664,3
w13,256,16,4,1536,1024,64,64,64,1,4,4,53.101,3
w13,256,16,4,1536,1024,64,64,64,4,4,4,53.282333333333334,3
w13,256,16,4,1536,1024,64,64,64,16,4,4,53.303666666666665,3
w13,256,16,4,1536,1024,64,64,64,32,4,4,53.07933333333333,3
w13,256,16,4,1536,1024,64,64,64,32,8,4,53.282333333333334,3
w13,256,16,4,1536,1024,64,64,64,64,4,4,52.96233333333333,3
w13,256,16,4,1536,1024,64,64,64,64,8,4,53.39966666666667,3
w13,256,32,4,2048,768,32,64,64,1,4,4,81.85833333333333,3
w13,256,32,4,2048,768,32,64,64,1,8,4,82.56233333333334,3
w13,256,32,4,2048,768,32,64,64,1,8,5,82.13566666666667,3
w13,256,32,4,2048,768,32,64,64,16,4,4,82.64766666666667,3
w13,256,32,4,2048,768,32,64,64,64,4,4,82.42366666666668,3
w13,256,32,4,2048,768,32,128,64,1,4,4,81.96466666666667,3
w13,256,32,6,3072,1024,64,64,64,1,4,3,201.46366666666665,3
w13,256,32,6,3072,1024,64,64,64,1,4,4,200.78166666666667,3
w13,256,32,6,3072,1024,64,64,64,4,4,4,200.56833333333336,3
w13,256,32,6,3072,1024,64,64,64,16,4,4,200.9416666666667,3
w13,256,32,6,3072,1024,64,64,64,32,4,3,201.75199999999998,3
w13,256,32,6,3072,1024,64,64,64,32,4,4,200.55766666666668,3
w13,256,32,6,3072,1024,64,64,64,64,4,4,200.8456666666667,3
w13,256,32,6,3072,1024,64,128,64,1,4,3,200.9946666666667,3
w13,256,32,6,3072,1024,64,128,64,1,4,4,200.739,3
w13,256,32,6,3072,1024,64,128,64,1,8,3,201.09,3
w13,256,32,6,3072,1024,64,128,64,4,4,3,201.56000000000003,3
w13,256,32,6,3072,1024,64,128,64,4,4,4,200.50366666666665,3
w13,256,32,6,3072,1024,64,128,64,4,8,3,200.56799999999998,3
w13,256,32,6,3072,1024,64,128,64,16,4,3,200.74966666666668,3
w13,256,32,6,3072,1024,64,128,64,16,4,4,200.08833333333334,3
w13,256,32,6,3072,1024,64,128,64,16,8,3,200.131,3
w13,256,32,6,3072,1024,64,128,64,32,4,4,200.23733333333334,3
w13,256,32,6,3072,1024,64,128,64,32,8,3,200.653,3
w13,256,32,6,3072,1024,64,128,64,64,4,3,201.31500000000003,3
w13,256,32,6,3072,1024,64,128,64,64,4,4,200.87766666666667,3
w13,256,32,6,3072,1024,64,128,64,64,8,3,200.50433333333334,3
w13,256,60,4,2048,1408,32,64,64,1,4,4,265.4963333333333,3
w13,256,60,4,2048,1408,32,128,64,1,4,3,263.502,3
w13,256,60,4,2048,1408,32,128,64,1,4,4,264.0566666666667,3
w13,256,60,6,3584,2304,32,64,64,1,4,4,742.1926666666667,3
w13,256,60,6,3584,2304,32,64,64,64,4,4,742.8106666666666,3
w13,256,60,6,3584,2304,32,128,64,1,4,3,736.0486666666666,3
w13,256,60,6,3584,2304,32,128,64,1,4,4,737.083,3
w13,256,60,8,2048,1536,64,64,64,1,4,3,350.41433333333333,3
w13,256,60,8,2048,1536,64,64,64,1,4,4,349.1556666666667,3
w13,256,60,8,2048,1536,64,64,64,4,4,4,349.0163333333333,3
w13,256,60,8,2048,1536,64,64,64,16,4,3,349.75233333333335,3
w13,256,60,8,2048,1536,64,64,64,16,4,4,348.3766666666667,3
w13,256,60,8,2048,1536,64,64,64,32,4,3,349.49666666666667,3
w13,256,60,8,2048,1536,64,64,64,32,4,4,347.2036666666666,3
w13,256,60,8,2048,1536,64,64,64,64,4,4,350.478,3
w13,256,64,6,3072,2048,32,64,64,1,4,3,607.6746666666667,3
w13,256,64,6,3072,2048,32,64,64,1,4,4,603.8343333333333,3
w13,256,64,6,3072,2048,32,64,64,16,4,4,607.6853333333333,3
w13,256,64,6,3072,2048,32,64,64,16,8,4,606.8106666666666,3
w13,256,64,6,3072,2048,32,64,64,64,4,3,605.232,3
w13,256,64,6,3072,2048,32,64,64,64,4,4,604.2503333333333,3
w13,256,64,6,3072,2048,32,64,64,64,8,4,606.9173333333333,3
w13,256,64,6,3072,2048,32,64,128,1,4,3,609.3389999999999,3
w13,256,64,6,3072,2048,32,64,128,4,4,3,609.6583333333333,3
w13,256,64,6,3072,2048,32,64,128,4,8,3,609.7336666666666,3
w13,256,64,6,3072,2048,32,64,128,16,8,3,609.723,3
w13,256,64,6,3072,2048,32,64,128,32,4,3,608.9756666666667,3
w13,256,64,6,3072,2048,32,64,128,32,8,3,608.9756666666666,3
w13,256,64,6,3072,2048,32,64,128,64,4,3,608.9119999999999,3
w13,256,64,6,3072,2048,32,64,128,64,8,3,608.7943333333333,3
w13,256,64,6,3072,2048,32,128,64,1,4,3,607.461,3
w13,256,64,6,3072,2048,32,128,64,1,4,4,609.776,3
w13,256,64,6,3584,1536,32,64,64,1,4,3,535.5036666666666,3
w13,256,64,6,3584,1536,32,64,64,1,4,4,533.0176666666666,3
w13,256,64,6,3584,1536,32,64,64,1,8,4,535.7596666666667,3
w13,256,64,6,3584,1536,32,64,64,1,8,5,535.9943333333333,3
w13,256,64,6,3584,1536,32,64,64,16,4,3,535.8016666666666,3
w13,256,64,6,3584,1536,32,64,64,16,4,4,533.914,3
w13,256,64,6,3584,1536,32,64,64,16,8,4,536.2396666666667,3
w13,256,64,6,3584,1536,32,64,64,64,4,3,535.6953333333333,3
w13,256,64,6,3584,1536,32,64,64,64,4,4,532.7613333333333,3
w13,256,64,6,3584,1536,32,64,64,64,8,4,535.2686666666667,3
w13,256,64,6,3584,1536,32,64,128,1,4,3,535.0236666666666,3
w13,256,64,6,3584,1536,32,64,128,4,4,3,535.493,3
w13,256,64,6,3584,1536,32,64,128,4,8,3,537.5300000000001,3
w13,256,64,6,3584,1536,32,64,128,16,4,3,537.082,3
w13,256,64,6,3584,1536,32,64,128,16,8,3,535.3216666666667,3
w13,256,64,6,3584,1536,32,64,128,32,4,3,537.029,3
w13,256,64,6,3584,1536,32,64,128,32,8,3,536.1963333333333,3
w13,256,64,6,3584,1536,32,64,128,64,4,3,535.2043333333334,3
w13,256,64,6,3584,1536,32,64,128,64,8,3,535.2579999999999,3
w13,256,64,6,3584,1536,32,128,64,1,4,3,534.831,3
w13,256,64,6,3584,1536,32,128,64,1,4,4,532.4526666666667,3
w13,256,64,6,3584,1536,32,128,64,16,4,3,537.6583333333333,3
w13,256,64,8,3584,2560,32,64,64,1,4,3,873.927,3
w13,256,64,8,3584,2560,32,64,64,1,4,4,872.8603333333334,3
w13,256,64,8,3584,2560,32,64,64,1,8,4,880.071,3
w13,256,64,8,3584,2560,32,64,64,1,8,5,878.727,3
w13,256,64,8,3584,2560,32,64,64,16,4,3,876.2520000000001,3
w13,256,64,8,3584,2560,32,64,64,16,4,4,877.8416666666667,3
w13,256,64,8,3584,2560,32,64,64,16,8,4,876.2843333333334,3
w13,256,64,8,3584,2560,32,64,64,64,4,3,875.7509999999999,3
w13,256,64,8,3584,2560,32,64,64,64,4,4,875.1213333333334,3
w13,256,64,8,3584,2560,32,64,64,64,8,4,876.0279999999999,3
w13,256,64,8,3584,2560,32,64,128,1,4,3,879.6443333333333,3
w13,256,64,8,3584,2560,32,64,128,16,8,3,878.748,3
w13,256,64,8,3584,2560,32,64,128,32,4,3,878.8870000000001,3
w13,256,64,8,3584,2560,32,128,64,1,4,3,871.5373333333333,3
w13,256,64,8,3584,2560,32,128,64,1,4,4,877.319,3
w13,256,64,8,3584,2560,32,128,64,4,4,3,879.7509999999999,3
w13,256,64,8,3584,2560,32,128,64,16,4,3,878.8866666666667,3
w13,256,128,4,2048,512,16,64,128,1,4,3,153.54933333333332,3
w13,256,128,4,2048,512,16,64,128,1,4,4,154.15733333333333,3
w13,256,128,4,2048,512,16,128,128,1,8,3,153.18666666666664,3
w13,256,128,4,2048,512,16,128,128,1,8,4,154.65866666666668,3
w13,256,128,4,2048,512,16,128,128,32,8,3,154.36033333333333,3
w13,256,128,6,4096,2048,16,32,128,1,4,5,1187.646,3
w13,256,128,6,4096,2048,16,32,128,4,4,5,1187.3366666666668,3
w13,256,128,6,4096,2048,16,32,128,16,4,5,1187.6033333333332,3
w13,256,128,6,4096,2048,16,64,128,16,4,3,1187.9126666666668,3
w13,256,128,6,4096,2048,16,64,128,16,4,4,1184.7873333333334,3
w13,256,128,6,4096,2048,16,64,128,16,8,3,1188.6696666666667,3
w13,256,128,6,4096,2048,16,64,128,16,8,4,1187.2296666666668,3
w13,256,128,6,4096,2048,16,64,128,32,4,3,1187.8483333333334,3
w13,256,128,6,4096,2048,16,64,128,32,4,4,1187.806,3
w13,256,128,6,4096,2048,16,128,128,1,4,3,1187.6029999999998,3
w13,256,128,6,4096,2048,16,128,128,1,8,3,1186.889,3
w13,256,128,6,4096,2048,16,128,128,1,8,4,1188.1153333333334,3
w13,256,128,6,4096,2048,16,128,128,16,4,3,1180.9686666666666,3
w13,256,128,6,4096,2048,16,128,128,16,4,4,1179.5393333333334,3
w13,256,128,6,4096,2048,16,128,128,16,8,3,1178.942,3
w13,256,128,6,4096,2048,16,128,128,16,8,4,1178.0246666666665,3
w13,256,128,6,4096,2048,16,128,128,32,4,3,1189.0856666666666,3
w13,256,128,6,4096,2048,16,128,128,32,4,4,1186.1850000000002,3
w13,256,128,6,4096,2048,16,128,128,32,8,3,1183.9873333333333,3
w13,256,128,6,4096,2048,16,128,128,32,8,4,1183.646,3
w13,256,128,8,2048,768,16,64,128,1,4,3,229.27233333333334,3
w13,256,128,8,2048,768,16,64,128,1,4,4,231.38400000000001,3
w13,256,128,8,2048,768,16,128,128,1,8,3,229.17600000000002,3
w13,256,128,8,2048,768,16,128,128,1,8,4,231.438,3
w13,256,128,8,2048,768,16,128,128,32,8,3,231.13933333333333,3
w13,256,128,8,4096,1536,16,32,128,4,4,5,898.4386666666666,3
w13,256,128,8,4096,1536,16,32,128,16,4,4,901.3613333333333,3
w13,256,128,8,4096,1536,16,32,128,16,4,5,900.828,3
w13,256,128,8,4096,1536,16,32,128,32,4,4,900.9989999999999,3
w13,256,128,8,4096,1536,16,32,128,32,4,5,901.5426666666667,3
w13,256,128,8,4096,1536,16,64,128,16,4,3,899.8683333333333,3
w13,256,128,8,4096,1536,16,64,128,16,4,4,898.5880000000001,3
w13,256,128,8,4096,1536,16,64,128,16,8,3,900.8496666666666,3
w13,256,128,8,4096,1536,16,64,128,16,8,4,900.8066666666667,3
w13,256,128,8,4096,1536,16,64,128,32,4,3,900.5079999999999,3
w13,256,128,8,4096,1536,16,64,128,32,4,4,898.8870000000001,3
w13,256,128,8,4096,1536,16,64,128,32,8,4,900.0283333333333,3
w13,256,128,8,4096,1536,16,128,128,1,4,3,901.7033333333334,3
w13,256,128,8,4096,1536,16,128,128,1,8,3,899.324,3
w13,256,128,8,4096,1536,16,128,128,1,8,4,901.82,3
w13,256,128,8,4096,1536,16,128,128,16,4,3,896.2416666666667,3
w13,256,128,8,4096,1536,16,128,128,16,4,4,895.6546666666667,3
w13,256,128,8,4096,1536,16,128,128,16,8,3,892.956,3
w13,256,128,8,4096,1536,16,128,128,16,8,4,894.4066666666668,3
w13,256,128,8,4096,1536,16,128,128,32,4,3,898.364,3
w13,256,128,8,4096,1536,16,128,128,32,4,4,899.5373333333333,3
w13,256,128,8,4096,1536,16,128,128,32,8,3,897.2443333333334,3
w13,256,128,8,4096,1536,16,128,128,32,8,4,896.636,3
w13,256,128,8,4096,1536,16,128,128,64,4,3,901.9696666666667,3
w13,256,128,8,4096,3072,16,64,128,16,4,3,1782.8826666666666,3
w13,256,128,8,4096,3072,16,64,128,16,4,4,1779.405,3
w13,256,128,8,4096,3072,16,64,128,16,8,4,1781.7943333333333,3
w13,256,128,8,4096,3072,16,64,128,32,4,4,1783.1706666666666,3
w13,256,128,8,4096,3072,16,128,128,16,4,3,1772.152,3
w13,256,128,8,4096,3072,16,128,128,16,4,4,1769.0690000000002,3
w13,256,128,8,4096,3072,16,128,128,16,8,3,1771.3836666666666,3
w13,256,128,8,4096,3072,16,128,128,16,8,4,1766.7543333333333,3
w13,256,128,8,4096,3072,16,128,128,32,4,3,1776.7596666666668,3
w13,256,128,8,4096,3072,16,128,128,32,4,4,1775.6180000000002,3
w13,256,128,8,4096,3072,16,128,128,32,8,3,1774.3383333333334,3
w13,256,128,8,4096,3072,16,128,128,32,8,4,1771.8853333333334,3
w13,512,8,2,1024,512,64,32,128,1,4,2,20.674,3
w13,512,8,2,1024,512,64,32,128,16,4,2,20.833666666666666,3
w13,512,16,2,1536,768,64,64,64,1,8,4,39.90633333333333,3
w13,512,16,2,1536,768,64,64,64,4,8,4,39.83133333333333,3
w13,512,16,2,1536,768,64,64,64,16,8,4,39.81033333333334,3
w13,512,16,2,1536,768,64,64,64,32,8,4,40.173,3
w13,512,16,2,1536,768,64,64,64,64,8,4,40.00233333333333,3
w13,512,16,4,1536,1024,64,64,64,1,4,3,101.229,3
w13,512,16,4,1536,1024,64,64,64,1,4,4,101.35700000000001,3
w13,512,16,4,1536,1024,64,64,64,4,4,3,101.154,3
w13,512,16,4,1536,1024,64,64,64,4,4,4,101.03733333333334,3
w13,512,16,4,1536,1024,64,64,64,16,4,3,101.22933333333333,3
w13,512,16,4,1536,1024,64,64,64,16,4,4,101.15466666666667,3
w13,512,16,4,1536,1024,64,64,64,32,4,3,101.27166666666666,3
w13,512,16,4,1536,1024,64,64,64,32,4,4,101.25,3
w13,512,16,4,1536,1024,64,64,64,64,4,3,101.33566666666667,3
w13,512,16,4,1536,1024,64,64,64,64,4,4,101.21833333333332,3
w13,512,16,4,1536,1024,64,128,64,1,4,3,101.57033333333334,3
w13,512,16,4,1536,1024,64,128,64,1,4,4,101.16533333333332,3
w13,512,16,4,1536,1024,64,128,64,4,4,3,101.432,3
w13,512,16,4,1536,1024,64,128,64,4,4,4,101.229,3
w13,512,16,4,1536,1024,64,128,64,16,4,3,101.581,3
w13,512,16,4,1536,1024,64,128,64,16,4,4,101.18633333333332,3
w13,512,16,4,1536,1024,64,128,64,16,8,3,101.98633333333333,3
w13,512,16,4,1536,1024,64,128,64,32,4,3,101.47433333333333,3
w13,512,16,4,1536,1024,64,128,64,32,4,4,101.05833333333334,3
w13,512,16,4,1536,1024,64,128,64,64,4,3,101.325,3
w13,512,16,4,1536,1024,64,128,64,64,4,4,100.99466666666666,3
w13,512,16,4,1536,1024,64,128,64,64,8,3,101.76233333333334,3
w13,512,16,4,1536,1024,128,64,64,1,8,3,101.421,3
w13,512,16,4,1536,1024,128,64,64,1,8,4,101.41033333333333,3
w13,512,16,4,1536,1024,128,64,64,16,8,3,101.43166666666667,3
w13,512,16,4,1536,1024,128,64,64,16,8,4,101.65566666666666,3
w13,512,32,4,2048,768,64,64,64,1,4,4,98.85033333333332,3
w13,512,32,4,2048,768,64,64,64,4,4,4,99.117,3
w13,512,32,4,2048,768,64,64,64,16,4,4,99.08466666666668,3
w13,512,32,4,2048,768,64,64,64,32,4,4,98.38133333333333,3
w13,512,32,4,2048,768,64,64,64,64,4,4,99.04266666666666,3
w13,512,32,4,2048,768,64,128,32,8,8,5,98.94666666666667,3
w13,512,32,4,2048,768,64,128,64,1,8,3,98.67966666666666,3
w13,512,32,4,2048,768,64,128,64,4,8,3,98.62633333333333,3
w13,512,32,4,2048,768,64,128,64,16,8,3,98.74366666666667,3
w13,512,32,4,2048,768,64,128,64,32,8,3,98.88233333333334,3
w13,512,32,4,2048,768,64,128,64,64,8,3,98.31666666666666,3
w13,512,32,6,3072,1024,64,64,64,1,4,3,380.53666666666663,3
w13,512,32,6,3072,1024,64,64,64,1,4,4,379.82166666666666,3
w13,512,32,6,3072,1024,64,64,64,4,4,3,379.23566666666665,3
w13,512,32,6,3072,1024,64,64,64,4,4,4,378.2006666666666,3
w13,512,32,6,3072,1024,64,64,64,16,4,3,379.04333333333335,3
w13,512,32,6,3072,1024,64,64,64,16,4,4,378.3926666666667,3
w13,512,32,6,3072,1024,64,64,64,32,4,3,379.9186666666667,3
w13,512,32,6,3072,1024,64,64,64,32,4,4,379.50233333333335,3
w13,512,32,6,3072,1024,64,64,64,64,4,3,379.88566666666674,3
w13,512,32,6,3072,1024,64,64,64,64,4,4,379.2996666666666,3
w13,512,60,4,2048,1408,64,64,64,1,4,3,321.41133333333335,3
w13,512,60,4,2048,1408,64,64,64,1,4,4,319.779,3
w13,512,60,4,2048,1408,64,64,64,4,4,4,320.9203333333333,3
w13,512,60,4,2048,1408,64,64,64,16,4,3,322.105,3
w13,512,60,4,2048,1408,64,64,64,16,4,4,321.1876666666667,3
w13,512,60,4,2048,1408,64,64,64,32,4,3,321.67799999999994,3
w13,512,60,4,2048,1408,64,64,64,32,4,4,320.9526666666667,3
w13,512,60,4,2048,1408,64,64,64,64,4,3,321.5183333333333,3
w13,512,60,4,2048,1408,64,64,64,64,4,4,320.91066666666666,3
w13,512,60,4,2048,1408,64,128,32,8,8,4,322.0403333333333,3
w13,512,60,4,2048,1408,64,128,32,8,8,5,322.43533333333335,3
w13,512,60,4,2048,1408,64,128,64,1,4,3,322.10533333333336,3
w13,512,60,4,2048,1408,64,128,64,1,4,4,321.39033333333333,3
w13,512,60,4,2048,1408,64,128,64,1,8,3,321.9873333333333,3
w13,512,60,4,2048,1408,64,128,64,4,4,3,322.115,3
w13,512,60,4,2048,1408,64,128,64,4,4,4,320.67533333333336,3
w13,512,60,4,2048,1408,64,128,64,4,8,3,321.62433333333337,3
w13,512,60,4,2048,1408,64,128,64,16,4,3,321.22999999999996,3
w13,512,60,4,2048,1408,64,128,64,16,4,4,320.185,3
w13,512,60,4,2048,1408,64,128,64,16,8,3,320.356,3
w13,512,60,4,2048,1408,64,128,64,32,4,3,320.07866666666666,3
w13,512,60,4,2048,1408,64,128,64,32,4,4,320.40866666666665,3
w13,512,60,4,2048,1408,64,128,64,32,8,3,321.646,3
w13,512,60,4,2048,1408,64,128,64,64,4,3,322.9693333333333,3
w13,512,60,4,2048,1408,64,128,64,64,4,4,321.10266666666666,3
w13,512,60,4,2048,1408,64,128,64,64,8,3,321.8063333333333,3
w13,512,60,6,3584,2304,64,64,64,4,4,3,908.7426666666667,3
w13,512,60,6,3584,2304,64,64,64,4,4,4,908.3483333333334,3
w13,512,60,6,3584,2304,64,64,64,16,4,4,908.6149999999999,3
w13,512,60,6,3584,2304,64,64,64,32,4,4,907.2493333333333,3
w13,512,60,6,3584,2304,64,64,64,64,4,4,905.4686666666666,3
w13,512,60,6,3584,2304,64,128,64,1,4,3,903.5266666666666,3
w13,512,60,6,3584,2304,64,128,64,1,4,4,901.4473333333334,3
w13,512,60,6,3584,2304,64,128,64,4,4,3,908.9776666666667,3
w13,512,60,6,3584,2304,64,128,64,4,4,4,904.252,3
w13,512,60,6,3584,2304,64,128,64,16,4,2,909.4466666666667,3
w13,512,60,6,3584,2304,64,128,64,16,4,3,904.6469999999999,3
w13,512,60,6,3584,2304,64,128,64,16,4,4,900.6149999999999,3
w13,512,60,6,3584,2304,64,128,64,16,8,3,908.2416666666667,3
w13,512,60,6,3584,2304,64,128,64,32,4,4,904.9029999999999,3
w13,512,60,6,3584,2304,64,128,64,64,4,3,907.335,3
w13,512,60,6,3584,2304,64,128,64,64,4,4,904.2310000000001,3
w13,512,60,6,3584,2304,64,128,64,64,8,3,907.4203333333334,3
w13,512,60,8,2048,1536,64,64,64,1,4,4,690.0099999999999,3
w13,512,60,8,2048,1536,64,64,64,4,4,3,688.837,3
w13,512,60,8,2048,1536,64,64,64,4,4,4,687.674,3
w13,512,60,8,2048,1536,64,64,64,16,4,3,691.3533333333334,3
w13,512,60,8,2048,1536,64,64,64,16,4,4,689.3703333333333,3
w13,512,60,8,2048,1536,64,64,64,32,4,3,691.4606666666667,3
w13,512,60,8,2048,1536,64,64,64,32,4,4,687.6523333333334,3
w13,512,60,8,2048,1536,64,64,64,64,4,3,689.509,3
w13,512,60,8,2048,1536,64,64,64,64,4,4,687.8016666666666,3
w13,512,60,8,2048,1536,64,128,32,8,8,4,689.9780000000001,3
w13,512,60,8,2048,1536,64,128,32,8,8,5,690.533,3
w13,512,60,8,2048,1536,64,128,64,1,4,3,687.034,3
w13,512,60,8,2048,1536,64,128,64,1,4,4,684.965,3
w13,512,60,8,2048,1536,64,128,64,1,8,3,689.7433333333333,3
w13,512,60,8,2048,1536,64,128,64,4,4,3,684.986,3
w13,512,60,8,2048,1536,64,128,64,4,4,4,685.989,3
w13,512,60,8,2048,1536,64,128,64,4,8,3,691.5566666666667,3
w13,512,60,8,2048,1536,64,128,64,16,4,3,686.8416666666667,3
w13,512,60,8,2048,1536,64,128,64,16,4,4,687.7596666666667,3
w13,512,60,8,2048,1536,64,128,64,16,8,3,689.253,3
w13,512,60,8,2048,1536,64,128,64,32,4,3,685.1356666666667,3
w13,512,60,8,2048,1536,64,128,64,32,4,4,684.901,3
w13,512,60,8,2048,1536,64,128,64,32,8,3,691.0233333333334,3
w13,512,60,8,2048,1536,64,128,64,64,4,3,687.5563333333333,3
w13,512,60,8,2048,1536,64,128,64,64,4,4,687.5563333333333,3
w13,512,60,8,2048,1536,64,128,64,64,8,3,691.4283333333333,3
w13,512,60,8,2048,1536,128,64,64,1,8,3,687.759,3
w13,512,60,8,2048,1536,128,64,64,1,8,4,688.4953333333333,3
w13,512,60,8,2048,1536,128,64,64,16,8,3,687.5143333333334,3
w13,512,60,8,2048,1536,128,64,64,16,8,4,688.4743333333332,3
w13,512,64,6,3072,2048,64,64,64,1,4,3,742.8006666666666,3
w13,512,64,6,3072,2048,64,64,64,1,4,4,741.4143333333333,3
w13,512,64,6,3072,2048,64,64,64,4,4,3,741.6806666666666,3
w13,512,64,6,3072,2048,64,64,64,4,4,4,738.0219999999999,3
w13,512,64,6,3072,2048,64,64,64,16,4,3,739.0033333333334,3
w13,512,64,6,3072,2048,64,64,64,16,4,4,739.5366666666667,3
w13,512,64,6,3072,2048,64,64,64,32,4,3,742.9499999999999,3
w13,512,64,6,3072,2048,64,64,64,32,4,4,738.4806666666667,3
w13,512,64,6,3072,2048,64,64,64,64,4,3,739.7076666666667,3
w13,512,64,6,3072,2048,64,64,64,64,4,4,736.3583333333332,3
w13,512,64,6,3584,1536,64,64,64,1,4,4,650.6080000000001,3
w13,512,64,6,3584,1536,64,64,64,4,4,4,651.6103333333334,3
w13,512,64,6,3584,1536,64,64,64,16,4,4,648.1116666666667,3
w13,512,64,6,3584,1536,64,64,64,64,4,4,648.773,3
w13,512,64,6,3584,1536,64,128,64,1,4,3,650.4796666666666,3
w13,512,64,6,3584,1536,64,128,64,1,4,4,648.0476666666667,3
w13,512,64,6,3584,1536,64,128,64,1,8,3,648.485,3
w13,512,64,6,3584,1536,64,128,64,4,4,3,647.9406666666667,3
w13,512,64,6,3584,1536,64,128,64,4,4,4,645.3919999999999,3
w13,512,64,6,3584,1536,64,128,64,4,8,3,651.312,3
w13,512,64,6,3584,1536,64,128,64,16,4,3,650.9923333333332,3
w13,512,64,6,3584,1536,64,128,64,16,4,4,648.9226666666667,3
w13,512,64,6,3584,1536,64,128,64,32,4,3,650.416,3
w13,512,64,6,3584,1536,64,128,64,32,4,4,647.6853333333333,3
w13,512,64,6,3584,1536,64,128,64,32,8,3,651.163,3
w13,512,64,6,3584,1536,64,128,64,64,4,3,648.6133333333333,3
w13,512,64,6,3584,1536,64,128,64,64,4,4,647.984,3
w13,512,64,6,3584,1536,64,128,64,64,8,3,651.6636666666667,3
w13,512,64,8,3584,2560,64,64,64,4,4,4,1069.715,3
w13,512,64,8,3584,2560,64,64,64,16,4,3,1074.035,3
w13,512,64,8,3584,2560,64,64,64,16,4,4,1070.579,3
w13,512,64,8,3584,2560,64,64,64,32,4,3,1068.3706666666667,3
w13,512,64,8,3584,2560,64,64,64,32,4,4,1068.712,3
w13,512,64,8,3584,2560,64,64,64,64,4,3,1071.6986666666667,3
w13,512,64,8,3584,2560,64,64,64,64,4,4,1069.7359999999999,3
w13,512,64,8,3584,2560,64,128,64,1,4,3,1072.9683333333332,3
w13,512,64,8,3584,2560,64,128,64,1,4,4,1067.1436666666666,3
w13,512,64,8,3584,2560,64,128,64,1,8,3,1070.0026666666665,3
w13,512,64,8,3584,2560,64,128,64,4,4,3,1066.3546666666668,3
w13,512,64,8,3584,2560,64,128,64,4,4,4,1064.541,3
w13,512,64,8,3584,2560,64,128,64,16,4,4,1071.1653333333334,3
w13,512,64,8,3584,2560,64,128,64,16,8,3,1071.2826666666667,3
w13,512,64,8,3584,2560,64,128,64,32,4,3,1065.032,3
w13,512,64,8,3584,2560,64,128,64,32,4,4,1063.7306666666666,3
w13,512,64,8,3584,2560,64,128,64,64,4,3,1072.6693333333333,3
w13,512,64,8,3584,2560,64,128,64,64,4,4,1067.3999999999999,3
w13,512,64,8,3584,2560,64,128,64,64,8,3,1072.8083333333334,3
w13,512,128,4,2048,512,16,128,128,1,8,3,154.456,3
w13,512,128,4,2048,512,16,128,128,32,8,3,155.91766666666666,3
w13,512,128,6,4096,2048,32,64,64,1,4,3,1587.5416666666667,3
w13,512,128,6,4096,2048,32,64,64,1,4,4,1587.9256666666668,3
w13,512,128,6,4096,2048,32,64,64,1,8,4,1588.8216666666667,3
w13,512,128,6,4096,2048,32,64,64,1,8,5,1586.4216666666664,3
w13,512,128,6,4096,2048,32,64,64,16,4,3,1588.4696666666666,3
w13,512,128,6,4096,2048,32,64,64,16,8,4,1586.9123333333334,3
w13,512,128,6,4096,2048,32,64,64,64,4,3,1588.6936666666668,3
w13,512,128,6,4096,2048,32,64,64,64,4,4,1586.347,3
w13,512,128,6,4096,2048,32,64,64,64,8,4,1588.4163333333333,3
w13,512,128,6,4096,2048,32,128,64,1,4,3,1573.7813333333334,3
w13,512,128,6,4096,2048,32,128,64,1,4,4,1579.8400000000001,3
w13,512,128,8,2048,768,32,64,64,1,4,3,312.59,3
w13,512,128,8,2048,768,32,64,64,1,4,4,312.0253333333333,3
w13,512,128,8,2048,768,32,64,64,16,4,3,312.7823333333333,3
w13,512,128,8,2048,768,32,64,64,16,4,4,312.64366666666666,3
w13,512,128,8,2048,768,32,128,64,1,4,3,310.08366666666666,3
w13,512,128,8,2048,768,32,128,64,1,4,4,312.3983333333333,3
w13,512,128,8,4096,1536,32,64,64,1,4,3,1193.5653333333332,3
w13,512,128,8,4096,1536,32,64,64,1,4,4,1192.2213333333332,3
w13,512,128,8,4096,1536,32,64,64,1,8,4,1196.7546666666667,3
w13,512,128,8,4096,1536,32,64,64,1,8,5,1191.4536666666665,3
w13,512,128,8,4096,1536,32,64,64,16,4,3,1195.5286666666668,3
w13,512,128,8,4096,1536,32,64,64,16,4,4,1195.2613333333334,3
w13,512,128,8,4096,1536,32,64,64,16,8,4,1198.3016666666665,3
w13,512,128,8,4096,1536,32,64,64,64,4,3,1197.64,3
w13,512,128,8,4096,1536,32,64,64,64,4,4,1191.7846666666667,3
w13,512,128,8,4096,1536,32,64,64,64,8,4,1197.7256666666667,3
w13,512,128,8,4096,1536,32,64,128,4,4,3,1199.4646666666667,3
w13,512,128,8,4096,1536,32,64,128,4,8,3,1199.1016666666667,3
w13,512,128,8,4096,1536,32,64,128,16,8,3,1198.59,3
w13,512,128,8,4096,1536,32,64,128,64,4,3,1198.7076666666667,3
w13,512,128,8,4096,1536,32,128,64,1,4,3,1188.2,3
w13,512,128,8,4096,1536,32,128,64,1,4,4,1196.9153333333334,3
w13,512,128,8,4096,3072,32,64,64,1,4,4,2360.4326666666666,3
w13,512,128,8,4096,3072,32,128,64,1,4,3,2337.019,3
w13,512,128,8,4096,3072,32,128,64,1,4,4,2347.664,3
w13,1024,8,2,1024,512,64,64,64,1,4,3,35.586000000000006,3
w13,1024,8,2,1024,512,64,64,64,1,4,4,35.54333333333333,3
w13,1024,8,2,1024,512,64,64,64,4,4,2,35.788666666666664,3
w13,1024,8,2,1024,512,64,64,64,4,4,3,35.44733333333333,3
w13,1024,8,2,1024,512,64,64,64,4,4,4,35.60766666666667,3
w13,1024,8,2,1024,512,64,64,64,16,4,3,35.54333333333333,3
w13,1024,8,2,1024,512,64,64,64,16,4,4,35.661,3
w13,1024,8,2,1024,512,64,64,64,32,4,3,35.63966666666667,3
w13,1024,8,2,1024,512,64,64,64,32,4,4,35.586000000000006,3
w13,1024,8,2,1024,512,64,64,64,64,4,3,35.47933333333333,3
w13,1024,8,2,1024,512,64,64,64,64,4,4,35.714,3
w13,1024,16,2,1536,768,64,64,64,1,4,4,73.49533333333333,3
w13,1024,16,2,1536,768,64,64,64,4,4,4,73.22933333333333,3
w13,1024,16,2,1536,768,64,64,64,16,4,3,73.91166666666666,3
w13,1024,16,2,1536,768,64,64,64,16,4,4,73.61266666666667,3
w13,1024,16,2,1536,768,64,64,64,32,4,4,73.39933333333333,3
w13,1024,16,2,1536,768,64,64,64,64,4,3,73.68766666666666,3
w13,1024,16,2,1536,768,64,64,64,64,4,4,73.60233333333333,3
w13,1024,16,2,1536,768,64,128,64,1,4,4,73.65533333333333,3
w13,1024,16,2,1536,768,64,128,64,4,4,3,73.53833333333334,3
w13,1024,16,2,1536,768,64,128,64,4,4,4,73.517,3
w13,1024,16,2,1536,768,64,128,64,16,4,4,73.54866666666668,3
w13,1024,16,2,1536,768,64,128,64,32,4,4,73.58066666666667,3
w13,1024,16,2,1536,768,64,128,64,64,4,4,73.43133333333333,3
w13,1024,16,2,1536,768,128,64,64,1,8,3,73.41033333333333,3
w13,1024,16,2,1536,768,128,64,64,1,8,4,73.43133333333333,3
w13,1024,16,2,1536,768,128,64,64,16,8,3,73.29299999999999,3
w13,1024,16,2,1536,768,128,64,64,16,8,4,73.35733333333333,3
w13,1024,16,4,1536,1024,64,64,64,1,4,2,192.71733333333336,3
w13,1024,16,4,1536,1024,64,64,64,1,4,3,191.9383333333333,3
w13,1024,16,4,1536,1024,64,64,64,1,4,4,191.55466666666666,3
w13,1024,16,4,1536,1024,64,64,64,4,4,2,192.88733333333334,3
w13,1024,16,4,1536,1024,64,64,64,4,4,3,191.80033333333336,3
w13,1024,16,4,1536,1024,64,64,64,4,4,4,191.75666666666666,3
w13,1024,16,4,1536,1024,64,64,64,16,4,3,192.45066666666665,3
w13,1024,16,4,1536,1024,64,64,64,16,4,4,191.72533333333334,3
w13,1024,16,4,1536,1024,64,64,64,32,4,3,192.83433333333332,3
w13,1024,16,4,1536,1024,64,64,64,32,4,4,191.85366666666667,3
w13,1024,16,4,1536,1024,64,64,64,64,4,3,191.725,3
w13,1024,16,4,1536,1024,64,64,64,64,4,4,191.34166666666667,3
w13,1024,32,4,2048,768,64,64,64,4,4,4,189.763,3
w13,1024,32,4,2048,768,64,64,64,16,4,3,190.41366666666667,3
w13,1024,32,4,2048,768,64,64,64,16,4,4,190.13566666666668,3
w13,1024,32,4,2048,768,64,64,64,32,4,4,190.40266666666665,3
w13,1024,32,4,2048,768,64,64,64,64,4,4,190.39233333333334,3
w13,1024,32,4,2048,768,64,128,32,8,8,4,190.6483333333333,3
w13,1024,32,4,2048,768,64,128,32,8,8,5,190.4563333333333,3
w13,1024,32,4,2048,768,64,128,64,1,4,3,189.05866666666665,3
w13,1024,32,4,2048,768,64,128,64,1,4,4,188.9523333333333,3
w13,1024,32,4,2048,768,64,128,64,4,4,3,190.179,3
w13,1024,32,4,2048,768,64,128,64,4,4,4,189.73066666666668,3
w13,1024,32,4,2048,768,64,128,64,4,8,3,190.6163333333333,3
w13,1024,32,4,2048,768,64,128,64,16,4,3,189.187,3
w13,1024,32,4,2048,768,64,128,64,16,4,4,188.79166666666666,3
w13,1024,32,4,2048,768,64,128,64,16,8,3,189.965,3
w13,1024,32,4,2048,768,64,128,64,32,4,3,189.43233333333333,3
w13,1024,32,4,2048,768,64,128,64,32,4,4,188.952,3
w13,1024,32,4,2048,768,64,128,64,32,8,3,190.36,3
w13,1024,32,4,2048,768,64,128,64,64,4,3,189.667,3
w13,1024,32,4,2048,768,64,128,64,64,4,4,189.72033333333334,3
w13,1024,32,4,2048,768,64,256,32,8,8,3,190.21033333333332,3
w13,1024,32,4,2048,768,64,256,32,8,8,4,190.05066666666667,3
w13,1024,32,4,2048,768,64,256,32,8,8,5,190.45633333333333,3
w13,1024,32,4,2048,768,64,256,32,32,8,4,190.65866666666668,3
w13,1024,32,4,2048,768,128,64,64,1,8,3,189.69866666666667,3
w13,1024,32,4,2048,768,128,64,64,1,8,4,189.56000000000003,3
w13,1024,32,4,2048,768,128,64,64,16,8,3,189.66666666666666,3
w13,1024,32,4,2048,768,128,64,64,16,8,4,189.69833333333335,3
w13,1024,32,4,2048,768,128,128,64,1,8,3,189.72033333333334,3
w13,1024,32,4,2048,768,128,128,64,4,4,3,190.42433333333335,3
w13,1024,32,4,2048,768,128,128,64,4,8,3,189.0376666666667,3
w13,1024,32,4,2048,768,128,128,64,8,4,3,190.57366666666667,3
w13,1024,32,4,2048,768,128,128,64,8,8,3,189.67766666666668,3
w13,1024,32,4,2048,768,128,128,64,16,8,3,189.81633333333335,3
w13,1024,32,4,2048,768,128,128,64,32,8,3,189.19766666666666,3
w13,1024,32,4,2048,768,128,128,64,64,4,3,190.46666666666667,3
w13,1024,32,4,2048,768,128,128,64,64,8,3,189.28266666666664,3
w13,1024,32,6,3072,1024,64,64,64,1,4,2,562.276,3
w13,1024,32,6,3072,1024,64,64,64,1,4,3,560.0786666666667,3
w13,1024,32,6,3072,1024,64,64,64,1,4,4,559.5136666666667,3
w13,1024,32,6,3072,1024,64,64,64,4,4,3,560.2816666666666,3
w13,1024,32,6,3072,1024,64,64,64,4,4,4,560.7399999999999,3
w13,1024,32,6,3072,1024,64,64,64,16,4,3,561.7959999999999,3
w13,1024,32,6,3072,1024,64,64,64,16,4,4,561.1353333333333,3
w13,1024,32,6,3072,1024,64,64,64,32,4,3,559.9506666666666,3
w13,1024,32,6,3072,1024,64,64,64,32,4,4,559.3746666666667,3
w13,1024,32,6,3072,1024,64,64,64,64,4,3,561.6256666666667,3
w13,1024,32,6,3072,1024,64,64,64,64,4,4,561.3053333333334,3
w13,1024,32,6,3072,1024,64,128,32,8,4,3,561.3906666666667,3
w13,1024,32,6,3072,1024,64,128,32,8,4,4,559.844,3
w13,1024,32,6,3072,1024,64,128,32,8,8,4,561.6683333333334,3
w13,1024,32,6,3072,1024,64,128,64,1,4,2,560.2493333333333,3
w13,1024,32,6,3072,1024,64,128,64,1,4,3,558.223,3
w13,1024,32,6,3072,1024,64,128,64,1,4,4,557.0386666666667,3
w13,1024,32,6,3072,1024,64,128,64,4,4,2,558.34,3
w13,1024,32,6,3072,1024,64,128,64,4,4,3,557.316,3
w13,1024,32,6,3072,1024,64,128,64,4,4,4,556.8573333333334,3
w13,1024,32,6,3072,1024,64,128,64,4,8,3,560.3453333333333,3
w13,1024,32,6,3072,1024,64,128,64,16,4,2,560.9963333333334,3
w13,1024,32,6,3072,1024,64,128,64,16,4,3,558.8626666666667,3
w13,1024,32,6,3072,1024,64,128,64,16,4,4,558.2013333333333,3
w13,1024,32,6,3072,1024,64,128,64,16,8,3,561.8493333333334,3
w13,1024,32,6,3072,1024,64,128,64,32,4,2,560.1216666666666,3
w13,1024,32,6,3072,1024,64,128,64,32,4,3,559.3003333333334,3
w13,1024,32,6,3072,1024,64,128,64,32,4,4,558.1693333333334,3
w13,1024,32,6,3072,1024,64,128,64,32,8,3,560.3773333333334,3
w13,1024,32,6,3072,1024,64,128,64,64,4,2,558.1053333333333,3
w13,1024,32,6,3072,1024,64,128,64,64,4,3,558.436,3
w13,1024,32,6,3072,1024,64,128,64,64,4,4,556.8146666666667,3
w13,1024,32,6,3072,1024,64,128,64,64,8,3,560.3986666666666,3
w13,1024,32,6,3072,1024,64,256,32,8,8,3,558.5749999999999,3
w13,1024,32,6,3072,1024,64,256,32,8,8,4,557.935,3
w13,1024,32,6,3072,1024,64,256,32,8,8,5,557.743,3
w13,1024,32,6,3072,1024,64,256,32,32,8,3,558.5749999999999,3
w13,1024,32,6,3072,1024,64,256,32,32,8,4,559.4813333333333,3
w13,1024,32,6,3072,1024,64,256,32,32,8,5,559.311,3
w13,1024,60,4,2048,1408,64,64,64,1,4,3,633.9036666666667,3
w13,1024,60,4,2048,1408,64,64,64,1,4,4,632.389,3
w13,1024,60,4,2048,1408,64,64,64,4,4,3,633.52,3
w13,1024,60,4,2048,1408,64,64,64,4,4,4,631.9946666666666,3
w13,1024,60,4,2048,1408,64,64,64,16,4,3,635.0133333333333,3
w13,1024,60,4,2048,1408,64,64,64,16,4,4,633.4023333333333,3
w13,1024,60,4,2048,1408,64,64,64,32,4,3,633.5836666666667,3
w13,1024,60,4,2048,1408,64,64,64,32,4,4,632.2716666666666,3
w13,1024,60,4,2048,1408,64,64,64,64,4,3,635.4076666666666,3
w13,1024,60,4,2048,1408,64,64,64,64,4,4,634.1486666666666,3
w13,1024,60,4,2048,1408,64,128,32,8,8,4,633.989,3
w13,1024,60,4,2048,1408,64,128,32,8,8,5,634.5116666666667,3
w13,1024,60,4,2048,1408,64,128,64,1,4,3,631.7493333333333,3
w13,1024,60,4,2048,1408,64,128,64,1,4,4,631.482,3
w13,1024,60,4,2048,1408,64,128,64,1,8,3,634.2873333333333,3
w13,1024,60,4,2048,1408,64,128,64,4,4,2,631.578,3
w13,1024,60,4,2048,1408,64,128,64,4,4,3,629.701,3
w13,1024,60,4,2048,1408,64,128,64,4,4,4,629.6793333333334,3
w13,1024,60,4,2048,1408,64,128,64,16,4,2,633.1033333333334,3
w13,1024,60,4,2048,1408,64,128,64,16,4,3,631.7703333333333,3
w13,1024,60,4,2048,1408,64,128,64,16,4,4,631.1406666666667,3
w13,1024,60,4,2048,1408,64,128,64,16,8,3,633.5196666666667,3
w13,1024,60,4,2048,1408,64,128,64,32,4,3,630.0956666666666,3
w13,1024,60,4,2048,1408,64,128,64,32,4,4,630.565,3
w13,1024,60,4,2048,1408,64,128,64,32,8,3,635.3006666666666,3
w13,1024,60,4,2048,1408,64,128,64,64,4,3,631.706,3
w13,1024,60,4,2048,1408,64,128,64,64,4,4,631.898,3
w13,1024,60,4,2048,1408,64,128,64,64,8,3,633.8076666666666,3
w13,1024,60,4,2048,1408,64,256,32,8,8,3,630.6926666666667,3
w13,1024,60,4,2048,1408,64,256,32,8,8,4,630.7993333333334,3
w13,1024,60,4,2048,1408,64,256,32,8,8,5,630.9173333333333,3
w13,1024,60,4,2048,1408,64,256,32,32,8,3,630.906,3
w13,1024,60,4,2048,1408,64,256,32,32,8,4,632.3246666666666,3
w13,1024,60,4,2048,1408,64,256,32,32,8,5,632.2823333333334,3
w13,1024,60,4,2048,1408,128,64,64,1,4,3,634.5433333333334,3
w13,1024,60,4,2048,1408,128,64,64,1,8,3,632.1326666666668,3
w13,1024,60,4,2048,1408,128,64,64,1,8,4,632.8476666666667,3
w13,1024,60,4,2048,1408,128,64,64,16,8,3,633.5943333333333,3
w13,1024,60,4,2048,1408,128,64,64,16,8,4,634.7249999999999,3
w13,1024,60,4,2048,1408,128,128,64,1,4,3,633.5513333333333,3
w13,1024,60,4,2048,1408,128,128,64,1,8,3,631.4396666666667,3
w13,1024,60,4,2048,1408,128,128,64,4,4,3,631.578,3
w13,1024,60,4,2048,1408,128,128,64,4,8,3,629.1353333333333,3
w13,1024,60,4,2048,1408,128,128,64,8,4,3,632.0256666666667,3
w13,1024,60,4,2048,1408,128,128,64,8,8,3,630.0636666666667,3
w13,1024,60,4,2048,1408,128,128,64,16,4,3,632.6766666666666,3
w13,1024,60,4,2048,1408,128,128,64,16,8,3,630.085,3
w13,1024,60,4,2048,1408,128,128,64,32,4,3,633.8823333333333,3
w13,1024,60,4,2048,1408,128,128,64,32,8,3,631.1193333333334,3
w13,1024,60,4,2048,1408,128,128,64,64,4,3,632.346,3
w13,1024,60,4,2048,1408,128,128,64,64,8,3,629.9783333333334,3
w13,1024,60,6,3584,2304,64,64,64,1,4,3,1795.4146666666668,3
w13,1024,60,6,3584,2304,64,64,64,1,4,4,1793.9106666666667,3
w13,1024,60,6,3584,2304,64,64,64,4,4,2,1800.0333333333335,3
w13,1024,60,6,3584,2304,64,64,64,4,4,3,1788.961,3
w13,1024,60,6,3584,2304,64,64,64,4,4,4,1792.256666666667,3
w13,1024,60,6,3584,2304,64,64,64,16,4,2,1799.713,3
w13,1024,60,6,3584,2304,64,64,64,16,4,3,1788.844,3
w13,1024,60,6,3584,2304,64,64,64,16,4,4,1785.6223333333335,3
w13,1024,60,6,3584,2304,64,64,64,32,4,3,1795.3293333333331,3
w13,1024,60,6,3584,2304,64,64,64,32,4,4,1786.924,3
w13,1024,60,6,3584,2304,64,64,64,64,4,3,1796.0226666666667,3
w13,1024,60,6,3584,2304,64,64,64,64,4,4,1792.6196666666667,3
w13,1024,60,6,3584,2304,64,128,32,8,4,3,1794.9663333333335,3
w13,1024,60,6,3584,2304,64,128,32,8,4,4,1794.7210000000002,3
w13,1024,60,6,3584,2304,64,128,32,8,4,5,1803.6490000000001,3
w13,1024,60,6,3584,2304,64,128,32,8,8,4,1803.5533333333333,3
w13,1024,60,6,3584,2304,64,128,64,1,4,3,1794.5826666666665,3
w13,1024,60,6,3584,2304,64,128,64,1,4,4,1789.8146666666664,3
w13,1024,60,6,3584,2304,64,128,64,1,8,3,1803.436,3
w13,1024,60,6,3584,2304,64,128,64,4,4,3,1800.9186666666665,3
w13,1024,60,6,3584,2304,64,128,64,4,4,4,1797.7183333333332,3
w13,1024,60,6,3584,2304,64,128,64,4,8,3,1803.6066666666666,3
w13,1024,60,6,3584,2304,64,128,64,16,4,2,1797.729,3
w13,1024,60,6,3584,2304,64,128,64,16,4,3,1801.5796666666665,3
w13,1024,60,6,3584,2304,64,128,64,16,4,4,1797.1636666666666,3
w13,1024,60,6,3584,2304,64,128,64,32,4,2,1796.4170000000001,3
w13,1024,60,6,3584,2304,64,128,64,32,4,3,1795.5963333333332,3
w13,1024,60,6,3584,2304,64,128,64,32,4,4,1792.8546666666668,3
w13,1024,60,6,3584,2304,64,128,64,64,4,2,1799.3613333333333,3
w13,1024,60,6,3584,2304,64,128,64,64,4,3,1796.8010000000002,3
w13,1024,60,6,3584,2304,64,128,64,64,4,4,1792.0546666666667,3
w13,1024,60,6,3584,2304,64,256,32,8,8,3,1795.4783333333332,3
w13,1024,60,6,3584,2304,64,256,32,8,8,4,1800.417666666667,3
w13,1024,60,6,3584,2304,64,256,32,8,8,5,1800.4920000000002,3
w13,1024,60,6,3584,2304,64,256,32,32,8,3,1795.7346666666665,3
w13,1024,60,6,3584,2304,64,256,32,32,8,4,1794.0063333333335,3
w13,1024,60,6,3584,2304,64,256,32,32,8,5,1793.665,3
w13,1024,60,6,3584,2304,128,64,64,1,8,4,1799.5106666666668,3
w13,1024,60,6,3584,2304,128,64,64,16,8,3,1802.732,3
w13,1024,60,6,3584,2304,128,128,64,1,4,3,1800.4066666666668,3
w13,1024,60,6,3584,2304,128,128,64,1,8,3,1792.6733333333334,3
w13,1024,60,6,3584,2304,128,128,64,4,4,3,1799.575,3
w13,1024,60,6,3584,2304,128,128,64,4,8,3,1798.316,3
w13,1024,60,6,3584,2304,128,128,64,8,4,3,1800.1080000000002,3
w13,1024,60,6,3584,2304,128,128,64,8,8,3,1791.8729999999998,3
w13,1024,60,6,3584,2304,128,128,64,16,4,3,1799.9693333333332,3
w13,1024,60,6,3584,2304,128,128,64,16,8,3,1792.5453333333335,3
w13,1024,60,6,3584,2304,128,128,64,32,8,3,1792.6943333333336,3
w13,1024,60,6,3584,2304,128,128,64,64,4,3,1800.4276666666667,3
w13,1024,60,6,3584,2304,128,128,64,64,8,3,1797.3026666666665,3
w13,1024,60,8,2048,1536,64,64,64,1,4,2,1035.43,3
w13,1024,60,8,2048,1536,64,64,64,1,4,3,1035.0673333333334,3
w13,1024,60,8,2048,1536,64,64,64,1,4,4,1033.6486666666667,3
w13,1024,60,8,2048,1536,64,64,64,4,4,3,1032.4223333333332,3
w13,1024,60,8,2048,1536,64,64,64,4,4,4,1029.8836666666666,3
w13,1024,60,8,2048,1536,64,64,64,16,4,2,1035.366,3
w13,1024,60,8,2048,1536,64,64,64,16,4,3,1032.369,3
w13,1024,60,8,2048,1536,64,64,64,16,4,4,1029.4676666666667,3
w13,1024,60,8,2048,1536,64,64,64,32,4,2,1038.7266666666667,3
w13,1024,60,8,2048,1536,64,64,64,32,4,3,1032.401,3
w13,1024,60,8,2048,1536,64,64,64,32,4,4,1029.6276666666665,3
w13,1024,60,8,2048,1536,64,64,64,64,4,2,1038.9076666666667,3
w13,1024,60,8,2048,1536,64,64,64,64,4,3,1035.5690000000002,3
w13,1024,60,8,2048,1536,64,64,64,64,4,4,1032.8490000000002,3
w13,1024,60,8,2048,1536,64,128,32,8,4,3,1037.3613333333333,3
w13,1024,60,8,2048,1536,64,128,32,8,4,4,1035.9423333333334,3
w13,1024,60,8,2048,1536,64,128,64,1,4,2,1039.1526666666666,3
w13,1024,60,8,2048,1536,64,128,64,1,4,3,1038.2783333333334,3
w13,1024,60,8,2048,1536,64,128,64,1,4,4,1032.561,3
w13,1024,60,8,2048,1536,64,128,64,4,4,2,1038.1823333333334,3
w13,1024,60,8,2048,1536,64,128,64,4,4,3,1038.5876666666666,3
w13,1024,60,8,2048,1536,64,128,64,4,4,4,1035.7183333333332,3
w13,1024,60,8,2048,1536,64,128,64,16,4,2,1036.0063333333335,3
w13,1024,60,8,2048,1536,64,128,64,16,4,3,1034.8866666666665,3
w13,1024,60,8,2048,1536,64,128,64,16,4,4,1033.211,3
w13,1024,60,8,2048,1536,64,128,64,32,4,2,1039.121,3
w13,1024,60,8,2048,1536,64,128,64,32,4,3,1035.9633333333334,3
w13,1024,60,8,2048,1536,64,128,64,32,4,4,1036.0913333333335,3
w13,1024,60,8,2048,1536,64,128,64,64,4,2,1038.748,3
w13,1024,60,8,2048,1536,64,128,64,64,4,3,1037.7233333333334,3
w13,1024,60,8,2048,1536,64,128,64,64,4,4,1036.998,3
w13,1024,60,8,2048,1536,64,256,32,8,8,3,1036.689,3
w13,1024,60,8,2048,1536,64,256,32,8,8,4,1036.39,3
w13,1024,60,8,2048,1536,64,256,32,8,8,5,1036.2403333333334,3
w13,1024,60,8,2048,1536,64,256,32,32,8,3,1039.2163333333333,3
w13,1024,60,8,2048,1536,64,256,32,32,8,4,1038.6726666666666,3
w13,1024,60,8,2048,1536,64,256,32,32,8,5,1038.5666666666666,3
w13,1024,64,6,3072,2048,64,64,64,1,4,3,1468.0206666666666,3
w13,1024,64,6,3072,2048,64,64,64,1,4,4,1465.1509999999998,3
w13,1024,64,6,3072,2048,64,64,64,4,4,2,1467.626,3
w13,1024,64,6,3072,2048,64,64,64,4,4,3,1459.722,3
w13,1024,64,6,3072,2048,64,64,64,4,4,4,1467.6899999999998,3
w13,1024,64,6,3072,2048,64,64,64,16,4,2,1467.9246666666666,3
w13,1024,64,6,3072,2048,64,64,64,16,4,3,1459.5510000000002,3
w13,1024,64,6,3072,2048,64,64,64,16,4,4,1459.519,3
w13,1024,64,6,3072,2048,64,64,64,32,4,3,1464.8096666666668,3
w13,1024,64,6,3072,2048,64,64,64,32,4,4,1464.6180000000002,3
w13,1024,64,6,3072,2048,64,64,64,64,4,3,1464.0633333333335,3
w13,1024,64,6,3072,2048,64,64,64,64,4,4,1464.0313333333334,3
w13,1024,64,6,3072,2048,64,128,32,8,4,4,1465.7166666666665,3
w13,1024,64,6,3072,2048,64,128,32,8,8,3,1464.9486666666664,3
w13,1024,64,6,3072,2048,64,128,32,8,8,4,1463.5086666666666,3
w13,1024,64,6,3072,2048,64,128,32,8,8,5,1467.4873333333333,3
w13,1024,64,6,3072,2048,64,128,64,1,4,3,1461.8983333333333,3
w13,1024,64,6,3072,2048,64,128,64,1,4,4,1458.6873333333333,3
w13,1024,64,6,3072,2048,64,128,64,1,8,3,1464.7669999999998,3
w13,1024,64,6,3072,2048,64,128,64,4,4,2,1459.5833333333333,3
w13,1024,64,6,3072,2048,64,128,64,4,4,3,1460.031,3
w13,1024,64,6,3072,2048,64,128,64,4,4,4,1459.1886666666667,3
w13,1024,64,6,3072,2048,64,128,64,4,8,3,1469.0873333333336,3
w13,1024,64,6,3072,2048,64,128,64,16,4,2,1459.3059999999998,3
w13,1024,64,6,3072,2048,64,128,64,16,4,3,1457.3003333333334,3
w13,1024,64,6,3072,2048,64,128,64,16,4,4,1454.698,3
w13,1024,64,6,3072,2048,64,128,64,32,4,2,1463.6363333333331,3
w13,1024,64,6,3072,2048,64,128,64,32,4,3,1456.575,3
w13,1024,64,6,3072,2048,64,128,64,32,4,4,1454.8793333333333,3
w13,1024,64,6,3072,2048,64,128,64,32,8,3,1464.2443333333333,3
w13,1024,64,6,3072,2048,64,128,64,64,4,2,1464.17,3
w13,1024,64,6,3072,2048,64,128,64,64,4,3,1461.0233333333333,3
w13,1024,64,6,3072,2048,64,128,64,64,4,4,1458.7936666666665,3
w13,1024,64,6,3072,2048,64,128,64,64,8,3,1464.1483333333333,3
w13,1024,64,6,3072,2048,128,64,64,1,4,3,1465.6629999999998,3
w13,1024,64,6,3072,2048,128,64,64,1,8,3,1467.5086666666666,3
w13,1024,64,6,3072,2048,128,64,64,1,8,4,1466.9219999999998,3
w13,1024,64,6,3072,2048,128,64,64,16,8,3,1462.3246666666666,3
w13,1024,64,6,3072,2048,128,64,64,16,8,4,1462.1003333333335,3
w13,1024,64,6,3584,1536,64,64,64,1,4,3,1278.131,3
w13,1024,64,6,3584,1536,64,64,64,1,4,4,1273.6616666666666,3
w13,1024,64,6,3584,1536,64,64,64,4,4,2,1283.8053333333335,3
w13,1024,64,6,3584,1536,64,64,64,4,4,3,1274.4616666666668,3
w13,1024,64,6,3584,1536,64,64,64,4,4,4,1272.744,3
w13,1024,64,6,3584,1536,64,64,64,16,4,3,1278.504,3
w13,1024,64,6,3584,1536,64,64,64,16,4,4,1276.9893333333332,3
w13,1024,64,6,3584,1536,64,64,64,32,4,3,1279.0486666666666,3
w13,1024,64,6,3584,1536,64,64,64,32,4,4,1276.787,3
w13,1024,64,6,3584,1536,64,64,64,64,4,2,1284.1793333333333,3
w13,1024,64,6,3584,1536,64,64,64,64,4,3,1274.7183333333332,3
w13,1024,64,6,3584,1536,64,64,64,64,4,4,1273.0433333333333,3
w13,1024,64,6,3584,1536,64,128,32,8,4,3,1283.6779999999999,3
w13,1024,64,6,3584,1536,64,128,64,1,4,3,1283.6993333333332,3
w13,1024,64,6,3584,1536,64,128,64,1,4,4,1279.72,3
w13,1024,64,6,3584,1536,64,128,64,4,4,4,1280.681,3
w13,1024,64,6,3584,1536,64,128,64,16,4,4,1284.5203333333332,3
w13,1024,64,6,3584,1536,64,128,64,32,4,2,1285.3100000000002,3
w13,1024,64,6,3584,1536,64,128,64,32,4,3,1284.9473333333333,3
w13,1024,64,6,3584,1536,64,128,64,32,4,4,1284.6163333333334,3
w13,1024,64,6,3584,1536,64,128,64,64,4,3,1285.1386666666667,3
w13,1024,64,6,3584,1536,64,128,64,64,4,4,1281.128,3
w13,1024,64,6,3584,1536,64,256,32,8,8,5,1282.7279999999998,3
w13,1024,64,6,3584,1536,128,64,64,16,8,3,1285.5339999999999,3
w13,1024,64,6,3584,1536,128,128,64,1,8,3,1281.6296666666667,3
w13,1024,64,6,3584,1536,128,128,64,4,8,3,1285.363,3
w13,1024,64,6,3584,1536,128,128,64,8,8,3,1281.2883333333332,3
w13,1024,64,6,3584,1536,128,128,64,16,8,3,1281.3950000000002,3
w13,1024,64,6,3584,1536,128,128,64,64,8,3,1281.6726666666666,3
w13,1024,64,8,3584,2560,64,64,64,1,4,3,2123.3523333333333,3
w13,1024,64,8,3584,2560,64,64,64,1,4,4,2125.5606666666667,3
w13,1024,64,8,3584,2560,64,64,64,4,4,3,2124.7183333333337,3
w13,1024,64,8,3584,2560,64,64,64,4,4,4,2123.331,3
w13,1024,64,8,3584,2560,64,64,64,16,4,2,2133.326,3
w13,1024,64,8,3584,2560,64,64,64,16,4,3,2125.7736666666665,3
w13,1024,64,8,3584,2560,64,64,64,16,4,4,2122.7983333333336,3
w13,1024,64,8,3584,2560,64,64,64,32,4,2,2132.803,3
w13,1024,64,8,3584,2560,64,64,64,32,4,3,2126.797666666667,3
w13,1024,64,8,3584,2560,64,64,64,32,4,4,2122.5733333333333,3
w13,1024,64,8,3584,2560,64,64,64,64,4,2,2133.3469999999998,3
w13,1024,64,8,3584,2560,64,64,64,64,4,3,2125.4966666666664,3
w13,1024,64,8,3584,2560,64,64,64,64,4,4,2122.371,3
w13,1024,64,8,3584,2560,64,128,32,8,4,3,2119.3953333333334,3
w13,1024,64,8,3584,2560,64,128,32,8,4,4,2118.766,3
w13,1024,64,8,3584,2560,64,128,32,8,4,5,2121.9656666666665,3
w13,1024,64,8,3584,2560,64,128,32,8,8,4,2130.2753333333335,3
w13,1024,64,8,3584,2560,64,128,32,8,8,5,2133.5606666666667,3
w13,1024,64,8,3584,2560,64,128,64,1,4,3,2117.5073333333335,3
w13,1024,64,8,3584,2560,64,128,64,1,4,4,2112.9736666666668,3
w13,1024,64,8,3584,2560,64,128,64,4,4,2,2128.846,3
w13,1024,64,8,3584,2560,64,128,64,4,4,3,2118.19,3
w13,1024,64,8,3584,2560,64,128,64,4,4,4,2114.9256666666665,3
w13,1024,64,8,3584,2560,64,128,64,16,4,2,2127.480666666667,3
w13,1024,64,8,3584,2560,64,128,64,16,4,3,2119.2459999999996,3
w13,1024,64,8,3584,2560,64,128,64,16,4,4,2116.3656666666666,3
w13,1024,64,8,3584,2560,64,128,64,32,4,2,2127.864666666667,3
w13,1024,64,8,3584,2560,64,128,64,32,4,3,2119.373666666667,3
w13,1024,64,8,3584,2560,64,128,64,32,4,4,2116.3123333333333,3
w13,1024,64,8,3584,2560,64,128,64,64,4,2,2128.718,3
w13,1024,64,8,3584,2560,64,128,64,64,4,3,2121.7523333333334,3
w13,1024,64,8,3584,2560,64,128,64,64,4,4,2114.7980000000002,3
w13,1024,64,8,3584,2560,64,128,64,64,8,3,2127.982,3
w13,1024,64,8,3584,2560,64,256,32,8,8,3,2127.896666666667,3
w13,1024,64,8,3584,2560,64,256,32,8,8,4,2125.1659999999997,3
w13,1024,64,8,3584,2560,64,256,32,8,8,5,2125.8483333333334,3
w13,1024,64,8,3584,2560,64,256,32,32,8,3,2127.9500000000003,3
w13,1024,64,8,3584,2560,64,256,32,32,8,4,2125.0273333333334,3
w13,1024,64,8,3584,2560,64,256,32,32,8,5,2125.379,3
w13,1024,64,8,3584,2560,128,64,64,1,4,3,2130.4030000000002,3
w13,1024,64,8,3584,2560,128,64,64,1,8,3,2118.8296666666665,3
w13,1024,64,8,3584,2560,128,64,64,1,8,4,2123.949666666667,3
w13,1024,64,8,3584,2560,128,64,64,16,8,3,2122.3926666666666,3
w13,1024,64,8,3584,2560,128,64,64,16,8,4,2124.451333333333,3
w13,1024,64,8,3584,2560,128,128,64,1,4,3,2126.2753333333335,3
w13,1024,64,8,3584,2560,128,128,64,1,8,3,2123.1600000000003,3
w13,1024,64,8,3584,2560,128,128,64,4,4,3,2125.4533333333334,3
w13,1024,64,8,3584,2560,128,128,64,4,8,3,2122.4243333333334,3
w13,1024,64,8,3584,2560,128,128,64,8,4,3,2124.686,3
w13,1024,64,8,3584,2560,128,128,64,8,8,3,2120.2376666666664,3
w13,1024,64,8,3584,2560,128,128,64,16,4,3,2130.904666666667,3
w13,1024,64,8,3584,2560,128,128,64,16,8,3,2121.1766666666667,3
w13,1024,64,8,3584,2560,128,128,64,32,4,3,2131.0326666666665,3
w13,1024,64,8,3584,2560,128,128,64,32,8,3,2116.6856666666667,3
w13,1024,64,8,3584,2560,128,128,64,64,4,3,2130.211333333333,3
w13,1024,64,8,3584,2560,128,128,64,64,8,3,2114.605666666667,3
w13,1024,128,4,2048,512,32,64,64,1,4,3,212.8456666666667,3
w13,1024,128,4,2048,512,32,64,64,1,4,4,211.62966666666668,3
w13,1024,128,4,2048,512,32,64,64,16,4,4,212.78166666666667,3
w13,1024,128,4,2048,512,32,64,64,64,4,4,213.21899999999997,3
w13,1024,128,6,4096,2048,64,64,64,1,4,4,1950.0396666666668,3
w13,1024,128,6,4096,2048,64,64,64,4,4,3,1955.4046666666666,3
w13,1024,128,6,4096,2048,64,64,64,4,4,4,1946.8819999999998,3
w13,1024,128,6,4096,2048,64,64,64,16,4,3,1950.0713333333333,3
w13,1024,128,6,4096,2048,64,64,64,16,4,4,1946.018,3
w13,1024,128,6,4096,2048,64,64,64,32,4,3,1956.589,3
w13,1024,128,6,4096,2048,64,64,64,32,4,4,1950.317,3
w13,1024,128,6,4096,2048,64,64,64,64,4,3,1956.4393333333335,3
w13,1024,128,6,4096,2048,64,64,64,64,4,4,1954.6580000000001,3
w13,1024,128,6,4096,2048,64,128,32,8,8,5,1951.4263333333336,3
w13,1024,128,6,4096,2048,64,128,64,1,4,3,1944.5243333333335,3
w13,1024,128,6,4096,2048,64,128,64,1,4,4,1944.6526666666668,3
w13,1024,128,6,4096,2048,64,128,64,1,8,3,1951.778,3
w13,1024,128,6,4096,2048,64,128,64,1,8,4,1956.0020000000002,3
w13,1024,128,6,4096,2048,64,128,64,4,4,3,1952.631,3
w13,1024,128,6,4096,2048,64,128,64,4,4,4,1943.8313333333333,3
w13,1024,128,6,4096,2048,64,128,64,4,8,3,1948.269,3
w13,1024,128,6,4096,2048,64,128,64,16,4,3,1950.1883333333335,3
w13,1024,128,6,4096,2048,64,128,64,16,4,4,1939.4043333333332,3
w13,1024,128,6,4096,2048,64,128,64,16,8,3,1954.9356666666665,3
w13,1024,128,6,4096,2048,64,128,64,32,4,3,1944.7806666666668,3
w13,1024,128,6,4096,2048,64,128,64,32,4,4,1938.0926666666667,3
w13,1024,128,6,4096,2048,64,128,64,32,8,3,1957.186,3
w13,1024,128,6,4096,2048,64,128,64,32,8,4,1956.1623333333334,3
w13,1024,128,6,4096,2048,64,128,64,64,4,3,1955.3513333333333,3
w13,1024,128,6,4096,2048,64,128,64,64,4,4,1944.8553333333332,3
w13,1024,128,6,4096,2048,64,128,64,64,8,3,1947.7033333333331,3
w13,1024,128,8,2048,768,64,64,64,1,4,3,378.85133333333334,3
w13,1024,128,8,2048,768,64,64,64,1,4,4,376.52566666666667,3
w13,1024,128,8,2048,768,64,64,64,4,4,4,377.5606666666667,3
w13,1024,128,8,2048,768,64,64,64,16,4,3,379.42699999999996,3
w13,1024,128,8,2048,768,64,64,64,16,4,4,377.1666666666667,3
w13,1024,128,8,2048,768,64,64,64,32,4,3,379.50199999999995,3
w13,1024,128,8,2048,768,64,64,64,64,4,4,377.316,3
w13,1024,128,8,2048,768,64,128,64,1,4,3,377.9983333333334,3
w13,1024,128,8,2048,768,64,128,64,1,4,4,376.8883333333333,3
w13,1024,128,8,2048,768,64,128,64,1,8,3,377.43333333333334,3
w13,1024,128,8,2048,768,64,128,64,4,4,4,376.30199999999996,3
w13,1024,128,8,2048,768,64,128,64,4,8,3,379.214,3
w13,1024,128,8,2048,768,64,128,64,16,4,3,378.105,3
w13,1024,128,8,2048,768,64,128,64,16,4,4,378.9053333333333,3
w13,1024,128,8,2048,768,64,128,64,16,8,3,379.172,3
w13,1024,128,8,2048,768,64,128,64,32,4,4,378.83,3
w13,1024,128,8,2048,768,64,128,64,32,8,3,378.13733333333334,3
w13,1024,128,8,2048,768,64,128,64,64,4,3,378.60566666666665,3
w13,1024,128,8,2048,768,64,128,64,64,4,4,376.708,3
w13,1024,128,8,2048,768,64,128,64,64,8,3,378.79866666666663,3
w13,1024,128,8,2048,768,64,256,32,8,8,4,379.34233333333333,3
w13,1024,128,8,4096,1536,64,64,64,1,4,3,1466.666,3
w13,1024,128,8,4096,1536,64,64,64,1,4,4,1463.7963333333335,3
w13,1024,128,8,4096,1536,64,64,64,4,4,3,1469.0446666666667,3
w13,1024,128,8,4096,1536,64,64,64,4,4,4,1466.9643333333333,3
w13,1024,128,8,4096,1536,64,64,64,16,4,3,1463.7323333333334,3
w13,1024,128,8,4096,1536,64,64,64,16,4,4,1461.5776666666668,3
w13,1024,128,8,4096,1536,64,64,64,32,4,4,1468.7883333333332,3
w13,1024,128,8,4096,1536,64,64,64,64,4,2,1475.8073333333334,3
w13,1024,128,8,4096,1536,64,64,64,64,4,3,1464.4153333333334,3
w13,1024,128,8,4096,1536,64,64,64,64,4,4,1463.8596666666665,3
w13,1024,128,8,4096,1536,64,128,64,1,4,2,1474.4313333333332,3
w13,1024,128,8,4096,1536,64,128,64,1,4,3,1473.4489999999998,3
w13,1024,128,8,4096,1536,64,128,64,1,4,4,1470.4093333333333,3
w13,1024,128,8,4096,1536,64,128,64,1,8,3,1475.7003333333334,3
w13,1024,128,8,4096,1536,64,128,64,4,4,4,1468.0953333333334,3
w13,1024,128,8,4096,1536,64,128,64,16,4,2,1474.9003333333333,3
w13,1024,128,8,4096,1536,64,128,64,16,4,3,1472.1696666666667,3
w13,1024,128,8,4096,1536,64,128,64,16,4,4,1471.9556666666667,3
w13,1024,128,8,4096,1536,64,128,64,16,8,3,1475.6996666666666,3
w13,1024,128,8,4096,1536,64,128,64,32,4,3,1474.4096666666667,3
w13,1024,128,8,4096,1536,64,128,64,32,4,4,1465.6943333333331,3
w13,1024,128,8,4096,1536,64,128,64,64,4,4,1471.3370000000002,3
w13,1024,128,8,4096,1536,64,128,64,64,8,3,1475.7750000000003,3
w13,1024,128,8,4096,1536,64,256,32,32,8,4,1474.9536666666665,3
w13,1024,128,8,4096,3072,64,64,64,1,4,3,2919.7630000000004,3
w13,1024,128,8,4096,3072,64,64,64,1,4,4,2920.1576666666665,3
w13,1024,128,8,4096,3072,64,64,64,4,4,3,2912.435,3
w13,1024,128,8,4096,3072,64,64,64,4,4,4,2913.1283333333336,3
w13,1024,128,8,4096,3072,64,64,64,16,4,3,2917.960333333333,3
w13,1024,128,8,4096,3072,64,64,64,16,4,4,2907.0266666666666,3
w13,1024,128,8,4096,3072,64,64,64,32,4,4,2910.1523333333334,3
w13,1024,128,8,4096,3072,64,64,64,64,4,4,2918.2270000000003,3
w13,1024,128,8,4096,3072,64,128,32,8,8,4,2916.6803333333332,3
w13,1024,128,8,4096,3072,64,128,32,8,8,5,2915.699,3
w13,1024,128,8,4096,3072,64,128,64,1,4,3,2913.9919999999997,3
w13,1024,128,8,4096,3072,64,128,64,1,4,4,2901.171333333333,3
w13,1024,128,8,4096,3072,64,128,64,1,8,3,2918.2376666666664,3
w13,1024,128,8,4096,3072,64,128,64,4,4,3,2898.088,3
w13,1024,128,8,4096,3072,64,128,64,4,4,4,2900.819,3
w13,1024,128,8,4096,3072,64,128,64,4,8,3,2909.875,3
w13,1024,128,8,4096,3072,64,128,64,16,4,3,2897.9816666666666,3
w13,1024,128,8,4096,3072,64,128,64,16,4,4,2891.1440000000002,3
w13,1024,128,8,4096,3072,64,128,64,32,4,3,2912.424333333333,3
w13,1024,128,8,4096,3072,64,128,64,32,4,4,2892.1999999999994,3
w13,1024,128,8,4096,3072,64,128,64,32,8,3,2920.306666666667,3
w13,1024,128,8,4096,3072,64,128,64,64,4,3,2909.715,3
w13,1024,128,8,4096,3072,64,128,64,64,4,4,2905.3843333333334,3
w13,1024,128,8,4096,3072,64,128,64,64,8,3,2911.155,3
w13,1536,8,2,1024,512,64,64,64,1,4,4,49.93266666666667,3
w13,1536,8,2,1024,512,64,64,64,4,4,4,49.772999999999996,3
w13,1536,8,2,1024,512,64,64,64,16,4,4,49.84766666666667,3
w13,1536,8,2,1024,512,64,64,64,32,4,2,49.730333333333334,3
w13,1536,8,2,1024,512,64,64,64,32,4,4,49.538000000000004,3
w13,1536,8,2,1024,512,64,64,64,64,4,2,49.666333333333334,3
w13,1536,8,2,1024,512,64,64,64,64,4,4,49.53799999999999,3
w13,1536,8,2,1024,512,64,128,32,8,8,3,49.76233333333332,3
w13,1536,8,2,1024,512,64,128,64,1,4,3,49.900666666666666,3
w13,1536,8,2,1024,512,64,128,64,4,4,3,49.65566666666666,3
w13,1536,8,2,1024,512,64,128,64,16,4,3,49.57033333333334,3
w13,1536,8,2,1024,512,64,128,64,32,4,3,49.452666666666666,3
w13,1536,8,2,1024,512,64,128,64,64,4,3,49.538333333333334,3
w13,1536,8,2,1024,512,64,128,64,64,4,4,49.48466666666667,3
w13,1536,8,2,1024,512,128,64,64,1,8,3,49.52766666666667,3
w13,1536,8,2,1024,512,128,64,64,1,8,4,49.73,3
w13,1536,8,2,1024,512,128,64,64,16,8,3,49.56,3
w13,1536,8,2,1024,512,128,64,64,16,8,4,49.580666666666666,3
w13,1536,16,2,1536,768,64,64,64,1,4,3,108.81333333333333,3
w13,1536,16,2,1536,768,64,64,64,1,4,4,108.58933333333334,3
w13,1536,16,2,1536,768,64,64,64,4,4,3,108.408,3
w13,1536,16,2,1536,768,64,64,64,4,4,4,108.25833333333333,3
w13,1536,16,2,1536,768,64,64,64,16,4,3,108.63166666666666,3
w13,1536,16,2,1536,768,64,64,64,16,4,4,108.31166666666667,3
w13,1536,16,2,1536,768,64,64,64,32,4,3,108.96199999999999,3
w13,1536,16,2,1536,768,64,64,64,32,4,4,108.75966666666666,3
w13,1536,16,2,1536,768,64,64,64,64,4,3,108.95166666666667,3
w13,1536,16,2,1536,768,64,64,64,64,4,4,108.59933333333333,3
w13,1536,16,4,1536,1024,64,64,64,1,4,2,283.1816666666667,3
w13,1536,16,4,1536,1024,64,64,64,1,4,3,282.584,3
w13,1536,16,4,1536,1024,64,64,64,1,4,4,281.58166666666665,3
w13,1536,16,4,1536,1024,64,64,64,4,4,3,283.075,3
w13,1536,16,4,1536,1024,64,64,64,4,4,4,282.915,3
w13,1536,16,4,1536,1024,64,64,64,16,4,3,283.0536666666667,3
w13,1536,16,4,1536,1024,64,64,64,16,4,4,282.31766666666664,3
w13,1536,16,4,1536,1024,64,64,64,32,4,3,282.25399999999996,3
w13,1536,16,4,1536,1024,64,64,64,32,4,4,281.56033333333335,3
w13,1536,16,4,1536,1024,64,64,64,64,4,3,282.91499999999996,3
w13,1536,16,4,1536,1024,64,64,64,64,4,4,281.95533333333333,3
w13,1536,16,4,1536,1024,64,128,32,8,8,4,283.0216666666667,3
w13,1536,16,4,1536,1024,64,128,64,1,4,2,281.6456666666666,3
w13,1536,16,4,1536,1024,64,128,64,1,4,3,281.027,3
w13,1536,16,4,1536,1024,64,128,64,1,4,4,281.2083333333333,3
w13,1536,16,4,1536,1024,64,128,64,4,4,2,282.211,3
w13,1536,16,4,1536,1024,64,128,64,4,4,3,281.30466666666666,3
w13,1536,16,4,1536,1024,64,128,64,4,4,4,280.39733333333334,3
w13,1536,16,4,1536,1024,64,128,64,4,8,3,282.9683333333333,3
w13,1536,16,4,1536,1024,64,128,64,16,4,2,281.64566666666667,3
w13,1536,16,4,1536,1024,64,128,64,16,4,3,281.05899999999997,3
w13,1536,16,4,1536,1024,64,128,64,16,4,4,280.66433333333333,3
w13,1536,16,4,1536,1024,64,128,64,16,8,3,282.819,3
w13,1536,16,4,1536,1024,64,128,64,32,4,2,281.57099999999997,3
w13,1536,16,4,1536,1024,64,128,64,32,4,3,281.635,3
w13,1536,16,4,1536,1024,64,128,64,32,4,4,281.03766666666667,3
w13,1536,16,4,1536,1024,64,128,64,64,4,2,282.38166666666666,3
w13,1536,16,4,1536,1024,64,128,64,64,4,3,281.70966666666664,3
w13,1536,16,4,1536,1024,64,128,64,64,4,4,281.251,3
w13,1536,16,4,1536,1024,64,256,32,8,8,4,282.723,3
w13,1536,16,4,1536,1024,64,256,32,8,8,5,283.19233333333335,3
w13,1536,16,4,1536,1024,64,256,32,32,8,4,283.043,3
w13,1536,16,4,1536,1024,64,256,32,32,8,5,283.0853333333333,3
w13,1536,16,4,1536,1024,128,64,64,1,8,3,280.9203333333333,3
w13,1536,16,4,1536,1024,128,64,64,1,8,4,282.09366666666665,3
w13,1536,16,4,1536,1024,128,64,64,16,8,3,281.411,3
w13,1536,16,4,1536,1024,128,64,64,16,8,4,282.478,3
w13,1536,16,4,1536,1024,128,128,64,1,8,3,281.347,3
w13,1536,16,4,1536,1024,128,128,64,4,8,3,281.2296666666667,3
w13,1536,16,4,1536,1024,128,128,64,8,8,3,281.123,3
w13,1536,16,4,1536,1024,128,128,64,16,8,3,281.123,3
w13,1536,16,4,1536,1024,128,128,64,32,8,3,281.00600000000003,3
w13,1536,16,4,1536,1024,128,128,64,64,8,3,281.14433333333335,3
w13,1536,32,4,2048,768,64,64,64,4,4,3,282.25333333333333,3
w13,1536,32,4,2048,768,64,64,64,4,4,4,281.774,3
w13,1536,32,4,2048,768,64,64,64,32,4,3,282.65933333333334,3
w13,1536,32,4,2048,768,64,64,64,32,4,4,281.8376666666666,3
w13,1536,32,4,2048,768,64,64,64,64,4,4,282.88266666666664,3
w13,1536,32,4,2048,768,64,128,64,1,4,3,281.443,3
w13,1536,32,4,2048,768,64,128,64,1,4,4,280.2483333333334,3
w13,1536,32,4,2048,768,64,128,64,1,8,3,282.89366666666666,3
w13,1536,32,4,2048,768,64,128,64,4,4,3,281.29366666666664,3
w13,1536,32,4,2048,768,64,128,64,4,4,4,280.6856666666667,3
w13,1536,32,4,2048,768,64,128,64,16,4,2,282.9256666666667,3
w13,1536,32,4,2048,768,64,128,64,16,4,3,281.5926666666667,3
w13,1536,32,4,2048,768,64,128,64,16,4,4,281.2936666666667,3
w13,1536,32,4,2048,768,64,128,64,16,8,3,282.883,3
w13,1536,32,4,2048,768,64,128,64,32,4,3,280.88866666666667,3
w13,1536,32,4,2048,768,64,128,64,32,4,4,280.46166666666664,3
w13,1536,32,4,2048,768,64,128,64,32,8,3,282.755,3
w13,1536,32,4,2048,768,64,128,64,64,4,3,281.8486666666667,3
w13,1536,32,4,2048,768,64,128,64,64,4,4,281.2296666666667,3
w13,1536,32,6,3072,1024,64,64,64,1,4,3,923.9736666666666,3
w13,1536,32,6,3072,1024,64,64,64,1,4,4,922.875,3
w13,1536,32,6,3072,1024,64,64,64,4,4,2,923.7713333333332,3
w13,1536,32,6,3072,1024,64,64,64,4,4,3,921.5206666666667,3
w13,1536,32,6,3072,1024,64,64,64,4,4,4,920.4113333333333,3
w13,1536,32,6,3072,1024,64,64,64,16,4,3,924.2613333333334,3
w13,1536,32,6,3072,1024,64,64,64,16,4,4,922.5443333333333,3
w13,1536,32,6,3072,1024,64,64,64,32,4,3,920.891,3
w13,1536,32,6,3072,1024,64,64,64,32,4,4,922.5013333333333,3
w13,1536,32,6,3072,1024,64,64,64,64,4,3,920.8696666666666,3
w13,1536,32,6,3072,1024,64,64,64,64,4,4,919.6640000000001,3
w13,1536,32,6,3072,1024,64,128,32,8,8,3,920.507,3
w13,1536,32,6,3072,1024,64,128,32,8,8,4,919.6966666666667,3
w13,1536,32,6,3072,1024,64,128,32,8,8,5,920.582,3
w13,1536,32,6,3072,1024,64,128,64,1,4,3,917.584,3
w13,1536,32,6,3072,1024,64,128,64,1,4,4,915.2486666666667,3
w13,1536,32,6,3072,1024,64,128,64,1,8,3,924.4216666666666,3
w13,1536,32,6,3072,1024,64,128,64,4,4,2,919.6326666666668,3
w13,1536,32,6,3072,1024,64,128,64,4,4,3,919.206,3
w13,1536,32,6,3072,1024,64,128,64,4,4,4,916.9653333333332,3
w13,1536,32,6,3072,1024,64,128,64,4,8,3,921.2429999999999,3
w13,1536,32,6,3072,1024,64,128,64,16,4,3,920.2933333333334,3
w13,1536,32,6,3072,1024,64,128,64,16,4,4,918.8746666666666,3
w13,1536,32,6,3072,1024,64,128,64,16,8,3,924.1553333333333,3
w13,1536,32,6,3072,1024,64,128,64,32,4,2,917.5523333333334,3
w13,1536,32,6,3072,1024,64,128,64,32,4,3,917.3070000000001,3
w13,1536,32,6,3072,1024,64,128,64,32,4,4,915.8563333333333,3
w13,1536,32,6,3072,1024,64,128,64,32,8,3,921.0513333333333,3
w13,1536,32,6,3072,1024,64,128,64,64,4,2,920.2723333333333,3
w13,1536,32,6,3072,1024,64,128,64,64,4,3,920.6453333333333,3
w13,1536,32,6,3072,1024,64,128,64,64,4,4,918.672,3
w13,1536,32,6,3072,1024,64,128,64,64,8,3,921.3283333333334,3
w13,1536,60,4,2048,1408,64,64,64,1,4,3,636.634,3
w13,1536,60,4,2048,1408,64,64,64,1,4,4,635.7913333333333,3
w13,1536,60,4,2048,1408,64,64,64,4,4,3,634.245,3
w13,1536,60,4,2048,1408,64,64,64,4,4,4,632.57,3
w13,1536,60,4,2048,1408,64,64,64,16,4,3,634.2126666666667,3
w13,1536,60,4,2048,1408,64,64,64,16,4,4,632.538,3
w13,1536,60,4,2048,1408,64,64,64,32,4,3,636.2393333333333,3
w13,1536,60,4,2048,1408,64,64,64,32,4,4,634.1276666666666,3
w13,1536,60,4,2048,1408,64,64,64,64,4,3,634.2553333333334,3
w13,1536,60,4,2048,1408,64,64,64,64,4,4,634.7566666666667,3
w13,1536,60,4,2048,1408,64,128,32,8,4,4,634.6613333333333,3
w13,1536,60,4,2048,1408,64,128,32,8,8,3,635.5459999999999,3
w13,1536,60,4,2048,1408,64,128,32,8,8,4,633.1783333333334,3
w13,1536,60,4,2048,1408,64,128,32,8,8,5,633.9140000000001,3
w13,1536,60,4,2048,1408,64,128,64,1,4,3,630.437,3
w13,1536,60,4,2048,1408,64,128,64,1,4,4,632.3566666666667,3
w13,1536,60,4,2048,1408,64,128,64,4,4,2,632.8156666666667,3
w13,1536,60,4,2048,1408,64,128,64,4,4,3,630.6716666666666,3
w13,1536,60,4,2048,1408,64,128,64,4,4,4,631.813,3
w13,1536,60,4,2048,1408,64,128,64,4,8,3,636.7406666666667,3
w13,1536,60,4,2048,1408,64,128,64,16,4,2,634.4906666666667,3
w13,1536,60,4,2048,1408,64,128,64,16,4,3,632.8903333333333,3
w13,1536,60,4,2048,1408,64,128,64,16,4,4,633.5196666666667,3
w13,1536,60,4,2048,1408,64,128,64,16,8,3,634.5756666666666,3
w13,1536,60,4,2048,1408,64,128,64,32,4,2,634.181,3
w13,1536,60,4,2048,1408,64,128,64,32,4,3,633.9463333333333,3
w13,1536,60,4,2048,1408,64,128,64,32,4,4,633.466,3
w13,1536,60,4,2048,1408,64,128,64,32,8,3,636.6766666666667,3
w13,1536,60,4,2048,1408,64,128,64,64,4,3,631.034,3
w13,1536,60,4,2048,1408,64,128,64,64,4,4,630.533,3
w13,1536,60,4,2048,1408,64,256,32,8,8,3,633.957,3
w13,1536,60,4,2048,1408,64,256,32,8,8,4,631.781,3
w13,1536,60,4,2048,1408,64,256,32,8,8,5,632.0686666666667,3
w13,1536,60,4,2048,1408,64,256,32,32,8,3,634.3299999999999,3
w13,1536,60,4,2048,1408,64,256,32,32,8,4,634.074,3
w13,1536,60,4,2048,1408,64,256,32,32,8,5,633.9356666666666,3
w13,1536,60,4,2048,1408,128,64,64,1,8,3,632.0583333333333,3
w13,1536,60,4,2048,1408,128,64,64,1,8,4,633.21,3
w13,1536,60,4,2048,1408,128,64,64,16,8,3,634.6076666666667,3
w13,1536,60,4,2048,1408,128,64,64,16,8,4,634.7463333333334,3
w13,1536,60,4,2048,1408,128,128,64,1,4,3,633.9033333333333,3
w13,1536,60,4,2048,1408,128,128,64,1,8,3,630.6926666666667,3
w13,1536,60,4,2048,1408,128,128,64,4,4,3,634.394,3
w13,1536,60,4,2048,1408,128,128,64,4,8,3,632.1223333333334,3
w13,1536,60,4,2048,1408,128,128,64,8,4,3,634.1593333333334,3
w13,1536,60,4,2048,1408,128,128,64,8,8,3,631.034,3
w13,1536,60,4,2048,1408,128,128,64,16,4,3,634.2876666666666,3
w13,1536,60,4,2048,1408,128,128,64,16,8,3,632.8046666666667,3
w13,1536,60,4,2048,1408,128,128,64,32,4,3,635.3753333333333,3
w13,1536,60,4,2048,1408,128,128,64,32,8,3,632.0903333333334,3
w13,1536,60,4,2048,1408,128,128,64,64,8,3,630.3733333333333,3
w13,1536,60,6,3584,2304,64,64,64,1,4,2,2689.4776666666667,3
w13,1536,60,6,3584,2304,64,64,64,1,4,3,2683.0243333333333,3
w13,1536,60,6,3584,2304,64,64,64,1,4,4,2680.016666666667,3
w13,1536,60,6,3584,2304,64,64,64,4,4,2,2703.761,3
w13,1536,60,6,3584,2304,64,64,64,4,4,3,2692.2729999999997,3
w13,1536,60,6,3584,2304,64,64,64,4,4,4,2686.31,3
w13,1536,60,6,3584,2304,64,64,64,16,4,2,2702.9396666666667,3
w13,1536,60,6,3584,2304,64,64,64,16,4,3,2689.7663333333335,3
w13,1536,60,6,3584,2304,64,64,64,16,4,4,2679.9956666666667,3
w13,1536,60,6,3584,2304,64,64,64,32,4,2,2701.616666666667,3
w13,1536,60,6,3584,2304,64,64,64,32,4,3,2682.117666666667,3
w13,1536,60,6,3584,2304,64,64,64,32,4,4,2679.846,3
w13,1536,60,6,3584,2304,64,64,64,64,4,2,2694.054,3
w13,1536,60,6,3584,2304,64,64,64,64,4,3,2683.11,3
w13,1536,60,6,3584,2304,64,64,64,64,4,4,2679.622,3
w13,1536,60,6,3584,2304,64,128,32,8,4,3,2697.179666666667,3
w13,1536,60,6,3584,2304,64,128,32,8,4,4,2696.166,3
w13,1536,60,6,3584,2304,64,128,32,8,4,5,2696.1343333333334,3
w13,1536,60,6,3584,2304,64,128,32,8,8,3,2698.0653333333335,3
w13,1536,60,6,3584,2304,64,128,32,8,8,4,2692.806,3
w13,1536,60,6,3584,2304,64,128,32,8,8,5,2695.6223333333332,3
w13,1536,60,6,3584,2304,64,128,64,1,4,2,2699.078,3
w13,1536,60,6,3584,2304,64,128,64,1,4,3,2688.667,3
w13,1536,60,6,3584,2304,64,128,64,1,4,4,2685.0196666666666,3
w13,1536,60,6,3584,2304,64,128,64,1,8,3,2699.067666666667,3
w13,1536,60,6,3584,2304,64,128,64,1,8,4,2703.931666666667,3
w13,1536,60,6,3584,2304,64,128,64,4,4,2,2697.0303333333336,3
w13,1536,60,6,3584,2304,64,128,64,4,4,3,2690.1073333333334,3
w13,1536,60,6,3584,2304,64,128,64,4,4,4,2686.8113333333336,3
w13,1536,60,6,3584,2304,64,128,64,4,8,3,2698.6513333333332,3
w13,1536,60,6,3584,2304,64,128,64,16,4,2,2696.4006666666664,3
w13,1536,60,6,3584,2304,64,128,64,16,4,3,2686.7046666666665,3
w13,1536,60,6,3584,2304,64,128,64,16,4,4,2682.5126666666665,3
w13,1536,60,6,3584,2304,64,128,64,16,8,3,2705.7983333333336,3
w13,1536,60,6,3584,2304,64,128,64,32,4,2,2687.4833333333336,3
w13,1536,60,6,3584,2304,64,128,64,32,4,3,2685.0406666666668,3
w13,1536,60,6,3584,2304,64,128,64,32,4,4,2683.0139999999997,3
w13,1536,60,6,3584,2304,64,128,64,32,8,3,2706.2033333333334,3
w13,1536,60,6,3584,2304,64,128,64,64,4,2,2686.79,3
w13,1536,60,6,3584,2304,64,128,64,64,4,3,2686.5016666666666,3
w13,1536,60,6,3584,2304,64,128,64,64,4,4,2682.8006666666665,3
w13,1536,60,6,3584,2304,64,128,64,64,8,3,2706.4386666666664,3
w13,1536,60,6,3584,2304,64,128,64,64,8,4,2705.51,3
w13,1536,60,6,3584,2304,64,256,32,8,8,3,2697.6376666666665,3
w13,1536,60,6,3584,2304,64,256,32,8,8,4,2695.3873333333336,3
w13,1536,60,6,3584,2304,64,256,32,8,8,5,2694.971666666667,3
w13,1536,60,6,3584,2304,64,256,32,32,8,3,2695.345,3
w13,1536,60,6,3584,2304,64,256,32,32,8,4,2694.854,3
w13,1536,60,6,3584,2304,64,256,32,32,8,5,2686.4803333333334,3
w13,1536,60,6,3584,2304,64,256,64,1,4,2,2702.8753333333334,3
w13,1536,60,6,3584,2304,64,256,64,4,4,2,2703.429666666667,3
w13,1536,60,6,3584,2304,64,256,64,32,4,2,2705.808666666667,3
w13,1536,60,6,3584,2304,64,256,64,64,4,2,2704.6993333333335,3
w13,1536,60,8,2048,1536,64,64,64,1,4,2,1377.6286666666667,3
w13,1536,60,8,2048,1536,64,64,64,1,4,3,1376.1356666666668,3
w13,1536,60,8,2048,1536,64,64,64,1,4,4,1376.808,3
w13,1536,60,8,2048,1536,64,64,64,4,4,2,1378.3013333333336,3
w13,1536,60,8,2048,1536,64,64,64,4,4,3,1378.9306666666664,3
w13,1536,60,8,2048,1536,64,64,64,4,4,4,1375.4846666666665,3
w13,1536,60,8,2048,1536,64,64,64,16,4,3,1378.6319999999998,3
w13,1536,60,8,2048,1536,64,64,64,16,4,4,1375.2933333333333,3
w13,1536,60,8,2048,1536,64,64,64,32,4,3,1376.1883333333335,3
w13,1536,60,8,2048,1536,64,64,64,32,4,4,1371.5280000000002,3
w13,1536,60,8,2048,1536,64,64,64,64,4,2,1379.0906666666667,3
w13,1536,60,8,2048,1536,64,64,64,64,4,3,1374.8773333333331,3
w13,1536,60,8,2048,1536,64,64,64,64,4,4,1371.282,3
w13,1536,60,8,2048,1536,64,128,32,8,4,3,1378.7913333333333,3
w13,1536,60,8,2048,1536,64,128,32,8,4,4,1368.5296666666666,3
w13,1536,60,8,2048,1536,64,128,32,8,8,3,1377.2549999999999,3
w13,1536,60,8,2048,1536,64,128,32,8,8,4,1377.192,3
w13,1536,60,8,2048,1536,64,128,32,8,8,5,1378.493333333333,3
w13,1536,60,8,2048,1536,64,128,64,1,4,3,1365.799,3
w13,1536,60,8,2048,1536,64,128,64,1,4,4,1366.4076666666667,3
w13,1536,60,8,2048,1536,64,128,64,4,4,2,1369.9163333333333,3
w13,1536,60,8,2048,1536,64,128,64,4,4,3,1368.6903333333332,3
w13,1536,60,8,2048,1536,64,128,64,4,4,4,1372.6586666666665,3
w13,1536,60,8,2048,1536,64,128,64,16,4,2,1369.8426666666667,3
w13,1536,60,8,2048,1536,64,128,64,16,4,3,1367.4526666666668,3
w13,1536,60,8,2048,1536,64,128,64,16,4,4,1370.781,3
w13,1536,60,8,2048,1536,64,128,64,16,8,3,1376.4133333333332,3
w13,1536,60,8,2048,1536,64,128,64,32,4,2,1374.1413333333333,3
w13,1536,60,8,2048,1536,64,128,64,32,4,3,1374.0556666666669,3
w13,1536,60,8,2048,1536,64,128,64,32,4,4,1371.9326666666666,3
w13,1536,60,8,2048,1536,64,128,64,32,8,3,1376.6480000000001,3
w13,1536,60,8,2048,1536,64,128,64,64,4,2,1369.6823333333334,3
w13,1536,60,8,2048,1536,64,128,64,64,4,3,1366.4929999999997,3
w13,1536,60,8,2048,1536,64,128,64,64,4,4,1368.509,3
w13,1536,60,8,2048,1536,64,128,64,64,8,3,1375.8476666666666,3
w13,1536,60,8,2048,1536,64,256,32,8,8,3,1369.9383333333335,3
w13,1536,60,8,2048,1536,64,256,32,8,8,4,1370.5566666666666,3
w13,1536,60,8,2048,1536,64,256,32,8,8,5,1370.0236666666667,3
w13,1536,60,8,2048,1536,64,256,32,32,8,3,1370.1303333333333,3
w13,1536,60,8,2048,1536,64,256,32,32,8,4,1370.5033333333333,3
w13,1536,60,8,2048,1536,64,256,32,32,8,5,1369.714,3
w13,1536,60,8,2048,1536,128,64,64,1,4,3,1376.0293333333332,3
w13,1536,60,8,2048,1536,128,64,64,1,8,3,1371.1863333333333,3
w13,1536,60,8,2048,1536,128,64,64,1,8,4,1375.9440000000002,3
w13,1536,60,8,2048,1536,128,64,64,16,8,2,1378.6526666666668,3
w13,1536,60,8,2048,1536,128,64,64,16,8,3,1374.6426666666666,3
w13,1536,60,8,2048,1536,128,64,64,16,8,4,1379.304,3
w13,1536,60,8,2048,1536,128,128,64,1,4,3,1372.04,3
w13,1536,60,8,2048,1536,128,128,64,1,8,3,1368.584,3
w13,1536,60,8,2048,1536,128,128,64,4,4,3,1371.9223333333332,3
w13,1536,60,8,2048,1536,128,128,64,4,8,3,1368.3490000000002,3
w13,1536,60,8,2048,1536,128,128,64,8,4,3,1372.167333333333,3
w13,1536,60,8,2048,1536,128,128,64,8,8,3,1368.061333333333,3
w13,1536,60,8,2048,1536,128,128,64,16,4,3,1371.4956666666667,3
w13,1536,60,8,2048,1536,128,128,64,16,8,3,1367.8796666666667,3
w13,1536,60,8,2048,1536,128,128,64,32,4,3,1371.3566666666666,3
w13,1536,60,8,2048,1536,128,128,64,32,8,3,1368.1573333333333,3
w13,1536,60,8,2048,1536,128,128,64,64,4,3,1371.7403333333332,3
w13,1536,60,8,2048,1536,128,128,64,64,8,3,1367.869,3
w13,1536,64,6,3072,2048,64,64,64,1,4,2,2184.376,3
w13,1536,64,6,3072,2048,64,64,64,1,4,3,2181.368,3
w13,1536,64,6,3072,2048,64,64,64,1,4,4,2176.5896666666667,3
w13,1536,64,6,3072,2048,64,64,64,4,4,3,2187.416333333333,3
w13,1536,64,6,3072,2048,64,64,64,4,4,4,2175.8529999999996,3
w13,1536,64,6,3072,2048,64,64,64,16,4,3,2185.623666666667,3
w13,1536,64,6,3072,2048,64,64,64,16,4,4,2176.0666666666666,3
w13,1536,64,6,3072,2048,64,64,64,32,4,3,2180.739,3
w13,1536,64,6,3072,2048,64,64,64,32,4,4,2176.419,3
w13,1536,64,6,3072,2048,64,64,64,64,4,3,2179.5873333333334,3
w13,1536,64,6,3072,2048,64,64,64,64,4,4,2176.674666666667,3
w13,1536,64,6,3072,2048,64,128,32,8,8,2,2187.619,3
w13,1536,64,6,3072,2048,64,128,32,8,8,3,2181.891,3
w13,1536,64,6,3072,2048,64,128,32,8,8,4,2176.706333333333,3
w13,1536,64,6,3072,2048,64,128,32,8,8,5,2185.4103333333333,3
w13,1536,64,6,3072,2048,64,128,64,1,4,3,2176.237,3
w13,1536,64,6,3072,2048,64,128,64,1,4,4,2165.955,3
w13,1536,64,6,3072,2048,64,128,64,1,8,3,2181.197333333333,3
w13,1536,64,6,3072,2048,64,128,64,4,4,3,2172.045,3
w13,1536,64,6,3072,2048,64,128,64,4,4,4,2169.741,3
w13,1536,64,6,3072,2048,64,128,64,16,4,2,2172.9950000000003,3
w13,1536,64,6,3072,2048,64,128,64,16,4,3,2173.5393333333336,3
w13,1536,64,6,3072,2048,64,128,64,16,4,4,2173.027,3
w13,1536,64,6,3072,2048,64,128,64,32,4,2,2173.3469999999998,3
w13,1536,64,6,3072,2048,64,128,64,32,4,3,2170.4886666666666,3
w13,1536,64,6,3072,2048,64,128,64,32,4,4,2171.4159999999997,3
w13,1536,64,6,3072,2048,64,128,64,64,4,2,2173.4636666666665,3
w13,1536,64,6,3072,2048,64,128,64,64,4,3,2170.583666666667,3
w13,1536,64,6,3072,2048,64,128,64,64,4,4,2176.824666666667,3
w13,1536,64,6,3584,1536,64,64,64,1,4,2,1919.4246666666668,3
w13,1536,64,6,3584,1536,64,64,64,1,4,3,1912.5666666666666,3
w13,1536,64,6,3584,1536,64,64,64,1,4,4,1911.2430000000002,3
w13,1536,64,6,3584,1536,64,64,64,4,4,2,1927.393,3
w13,1536,64,6,3584,1536,64,64,64,4,4,3,1913.5793333333334,3
w13,1536,64,6,3584,1536,64,64,64,4,4,4,1910.827,3
w13,1536,64,6,3584,1536,64,64,64,16,4,2,1928.0646666666664,3
w13,1536,64,6,3584,1536,64,64,64,16,4,3,1913.4936666666665,3
w13,1536,64,6,3584,1536,64,64,64,16,4,4,1911.7663333333333,3
w13,1536,64,6,3584,1536,64,64,64,32,4,2,1922.4963333333333,3
w13,1536,64,6,3584,1536,64,64,64,32,4,3,1913.4836666666667,3
w13,1536,64,6,3584,1536,64,64,64,32,4,4,1911.041,3
w13,1536,64,6,3584,1536,64,64,64,64,4,2,1922.4753333333335,3
w13,1536,64,6,3584,1536,64,64,64,64,4,3,1913.7933333333333,3
w13,1536,64,6,3584,1536,64,64,64,64,4,4,1911.0833333333333,3
w13,1536,64,6,3584,1536,64,128,32,8,4,3,1927.6493333333335,3
w13,1536,64,6,3584,1536,64,128,32,8,4,4,1926.6886666666667,3
w13,1536,64,6,3584,1536,64,128,32,8,4,5,1928.2146666666667,3
w13,1536,64,6,3584,1536,64,128,32,8,8,3,1929.057,3
w13,1536,64,6,3584,1536,64,128,32,8,8,4,1924.1719999999998,3
w13,1536,64,6,3584,1536,64,128,32,8,8,5,1926.4436666666668,3
w13,1536,64,6,3584,1536,64,128,64,1,4,2,1921.7286666666666,3
w13,1536,64,6,3584,1536,64,128,64,1,4,3,1925.3026666666665,3
w13,1536,64,6,3584,1536,64,128,64,1,4,4,1918.9453333333333,3
w13,1536,64,6,3584,1536,64,128,64,4,4,2,1928.7693333333334,3
w13,1536,64,6,3584,1536,64,128,64,4,4,3,1926.2520000000002,3
w13,1536,64,6,3584,1536,64,128,64,4,4,4,1921.7610000000002,3
w13,1536,64,6,3584,1536,64,128,64,16,4,2,1925.9533333333336,3
w13,1536,64,6,3584,1536,64,128,64,16,4,3,1926.4013333333332,3
w13,1536,64,6,3584,1536,64,128,64,16,4,4,1922.5183333333334,3
w13,1536,64,6,3584,1536,64,128,64,32,4,2,1927.7343333333336,3
w13,1536,64,6,3584,1536,64,128,64,32,4,3,1925.9736666666668,3
w13,1536,64,6,3584,1536,64,128,64,32,4,4,1919.4456666666665,3
w13,1536,64,6,3584,1536,64,128,64,32,8,3,1929.0573333333334,3
w13,1536,64,6,3584,1536,64,128,64,64,4,2,1925.228,3
w13,1536,64,6,3584,1536,64,128,64,64,4,3,1927.6063333333332,3
w13,1536,64,6,3584,1536,64,128,64,64,4,4,1917.0456666666666,3
w13,1536,64,6,3584,1536,64,128,64,64,8,3,1929.6539999999998,3
w13,1536,64,6,3584,1536,64,256,32,8,8,3,1922.3796666666667,3
w13,1536,64,6,3584,1536,64,256,32,8,8,4,1921.2920000000001,3
w13,1536,64,6,3584,1536,64,256,32,8,8,5,1920.8653333333332,3
w13,1536,64,6,3584,1536,64,256,32,32,8,3,1921.323,3
w13,1536,64,6,3584,1536,64,256,32,32,8,4,1920.811,3
w13,1536,64,6,3584,1536,64,256,32,32,8,5,1920.652,3
w13,1536,64,8,3584,2560,64,64,64,1,4,3,3177.6829999999995,3
w13,1536,64,8,3584,2560,64,64,64,1,4,4,3181.032333333333,3
w13,1536,64,8,3584,2560,64,64,64,4,4,2,3188.862333333333,3
w13,1536,64,8,3584,2560,64,64,64,4,4,3,3188.9796666666666,3
w13,1536,64,8,3584,2560,64,64,64,4,4,4,3187.7630000000004,3
w13,1536,64,8,3584,2560,64,64,64,16,4,3,3180.8940000000002,3
w13,1536,64,8,3584,2560,64,64,64,16,4,4,3179.134,3
w13,1536,64,8,3584,2560,64,64,64,32,4,2,3188.1479999999997,3
w13,1536,64,8,3584,2560,64,64,64,32,4,3,3179.016333333333,3
w13,1536,64,8,3584,2560,64,64,64,32,4,4,3187.678,3
w13,1536,64,8,3584,2560,64,64,64,64,4,3,3188.3396666666667,3
w13,1536,64,8,3584,2560,64,64,64,64,4,4,3178.1740000000004,3
w13,1536,64,8,3584,2560,64,128,32,8,4,5,3179.891333333333,3
w13,1536,64,8,3584,2560,64,128,32,8,8,3,3185.3106666666667,3
w13,1536,64,8,3584,2560,64,128,32,8,8,4,3182.2703333333334,3
w13,1536,64,8,3584,2560,64,128,32,8,8,5,3187.9876666666664,3
w13,1536,64,8,3584,2560,64,128,64,1,4,2,3192.9689999999996,3
w13,1536,64,8,3584,2560,64,128,64,1,4,3,3182.814,3
w13,1536,64,8,3584,2560,64,128,64,1,4,4,3163.625,3
w13,1536,64,8,3584,2560,64,128,64,4,4,2,3176.147333333334,3
w13,1536,64,8,3584,2560,64,128,64,4,4,3,3173.277666666667,3
w13,1536,64,8,3584,2560,64,128,64,4,4,4,3171.304666666667,3
w13,1536,64,8,3584,2560,64,128,64,4,8,3,3186.355,3
w13,1536,64,8,3584,2560,64,128,64,16,4,2,3184.883,3
w13,1536,64,8,3584,2560,64,128,64,16,4,3,3181.502,3
w13,1536,64,8,3584,2560,64,128,64,16,4,4,3171.7206666666666,3
w13,1536,64,8,3584,2560,64,128,64,32,4,2,3176.6913333333337,3
w13,1536,64,8,3584,2560,64,128,64,32,4,3,3166.963333333333,3
w13,1536,64,8,3584,2560,64,128,64,32,4,4,3163.197666666667,3
w13,1536,64,8,3584,2560,64,128,64,32,8,3,3193.384666666667,3
w13,1536,64,8,3584,2560,64,128,64,64,4,2,3185.2996666666663,3
w13,1536,64,8,3584,2560,64,128,64,64,4,3,3183.1873333333333,3
w13,1536,64,8,3584,2560,64,128,64,64,4,4,3172.477666666667,3
w13,1536,64,8,3584,2560,64,256,64,64,4,2,3194.995666666667,3
w13,1536,128,4,2048,512,64,64,64,1,4,3,257.04866666666663,3
w13,1536,128,4,2048,512,64,64,64,1,4,4,256.803,3
w13,1536,128,4,2048,512,64,64,64,4,4,3,257.80566666666664,3
w13,1536,128,4,2048,512,64,64,64,4,4,4,257.4003333333333,3
w13,1536,128,4,2048,512,64,64,64,16,4,3,257.07033333333334,3
w13,1536,128,4,2048,512,64,64,64,16,4,4,255.6723333333333,3
w13,1536,128,4,2048,512,64,64,64,32,4,3,256.686,3
w13,1536,128,4,2048,512,64,64,64,32,4,4,256.39799999999997,3
w13,1536,128,4,2048,512,64,64,64,64,4,4,256.5683333333333,3
w13,1536,128,6,4096,2048,64,64,64,1,4,2,3880.1073333333334,3
w13,1536,128,6,4096,2048,64,64,64,1,4,3,3880.2253333333333,3
w13,1536,128,6,4096,2048,64,64,64,1,4,4,3875.2540000000004,3
w13,1536,128,6,4096,2048,64,64,64,4,4,2,3886.902,3
w13,1536,128,6,4096,2048,64,64,64,4,4,3,3877.1313333333333,3
w13,1536,128,6,4096,2048,64,64,64,4,4,4,3865.5156666666667,3
w13,1536,128,6,4096,2048,64,64,64,16,4,2,3892.726,3
w13,1536,128,6,4096,2048,64,64,64,16,4,3,3866.5930000000003,3
w13,1536,128,6,4096,2048,64,64,64,16,4,4,3866.0383333333334,3
w13,1536,128,6,4096,2048,64,64,64,32,4,2,3889.473,3
w13,1536,128,6,4096,2048,64,64,64,32,4,3,3866.7100000000005,3
w13,1536,128,6,4096,2048,64,64,64,32,4,4,3872.4486666666667,3
w13,1536,128,6,4096,2048,64,64,64,64,4,2,3881.3126666666667,3
w13,1536,128,6,4096,2048,64,64,64,64,4,3,3867.6056666666664,3
w13,1536,128,6,4096,2048,64,64,64,64,4,4,3874.838333333333,3
w13,1536,128,6,4096,2048,64,128,32,8,4,3,3873.4836666666665,3
w13,1536,128,6,4096,2048,64,128,32,8,4,4,3869.3126666666667,3
w13,1536,128,6,4096,2048,64,128,32,8,4,5,3883.0409999999997,3
w13,1536,128,6,4096,2048,64,128,32,8,8,3,3894.443333333333,3
w13,1536,128,6,4096,2048,64,128,32,8,8,4,3876.5446666666667,3
w13,1536,128,6,4096,2048,64,128,32,8,8,5,3879.499333333333,3
w13,1536,128,6,4096,2048,64,128,64,1,4,2,3888.118,3
w13,1536,128,6,4096,2048,64,128,64,1,4,3,3873.4303333333332,3
w13,1536,128,6,4096,2048,64,128,64,1,4,4,3861.6323333333335,3
w13,1536,128,6,4096,2048,64,128,64,1,8,3,3889.3126666666667,3
w13,1536,128,6,4096,2048,64,128,64,1,8,4,3890.678,3
w13,1536,128,6,4096,2048,64,128,64,4,4,2,3878.7523333333334,3
w13,1536,128,6,4096,2048,64,128,64,4,4,3,3875.35,3
w13,1536,128,6,4096,2048,64,128,64,4,4,4,3866.3153333333335,3
w13,1536,128,6,4096,2048,64,128,64,4,8,3,3881.142,3
w13,1536,128,6,4096,2048,64,128,64,4,8,4,3890.614,3
w13,1536,128,6,4096,2048,64,128,64,16,4,2,3868.6406666666667,3
w13,1536,128,6,4096,2048,64,128,64,16,4,3,3873.6856666666667,3
w13,1536,128,6,4096,2048,64,128,64,16,4,4,3875.936333333333,3
w13,1536,128,6,4096,2048,64,128,64,16,8,3,3880.9926666666665,3
w13,1536,128,6,4096,2048,64,128,64,16,8,4,3890.219333333333,3
w13,1536,128,6,4096,2048,64,128,64,32,4,2,3868.8536666666664,3
w13,1536,128,6,4096,2048,64,128,64,32,4,3,3873.835333333334,3
w13,1536,128,6,4096,2048,64,128,64,32,4,4,3875.6803333333332,3
w13,1536,128,6,4096,2048,64,128,64,32,8,3,3881.11,3
w13,1536,128,6,4096,2048,64,128,64,64,4,2,3869.6006666666667,3
w13,1536,128,6,4096,2048,64,128,64,64,4,3,3864.416333333333,3
w13,1536,128,6,4096,2048,64,128,64,64,4,4,3864.5660000000003,3
w13,1536,128,6,4096,2048,64,128,64,64,8,3,3891.2646666666665,3
w13,1536,128,6,4096,2048,64,256,32,8,8,3,3880.779,3
w13,1536,128,6,4096,2048,64,256,32,8,8,4,3880.5553333333337,3
w13,1536,128,6,4096,2048,64,256,32,8,8,5,3869.8349999999996,3
w13,1536,128,6,4096,2048,64,256,32,32,8,3,3870.8266666666664,3
w13,1536,128,6,4096,2048,64,256,32,32,8,4,3882.0913333333333,3
w13,1536,128,6,4096,2048,64,256,32,32,8,5,3880.886,3
w13,1536,128,6,4096,2048,128,64,64,1,4,3,3884.9500000000003,3
w13,1536,128,6,4096,2048,128,64,64,1,8,2,3892.0856666666664,3
w13,1536,128,6,4096,2048,128,64,64,1,8,3,3879.6803333333337,3
w13,1536,128,6,4096,2048,128,64,64,1,8,4,3884.1603333333333,3
w13,1536,128,6,4096,2048,128,64,64,16,8,3,3877.824666666667,3
w13,1536,128,6,4096,2048,128,64,64,16,8,4,3882.123,3
w13,1536,128,6,4096,2048,128,128,64,1,4,3,3889.867333333333,3
w13,1536,128,6,4096,2048,128,128,64,1,8,3,3870.998,3
w13,1536,128,6,4096,2048,128,128,64,4,4,3,3879.5310000000004,3
w13,1536,128,6,4096,2048,128,128,64,4,8,3,3888.7900000000004,3
w13,1536,128,6,4096,2048,128,128,64,8,4,3,3879.99,3
w13,1536,128,6,4096,2048,128,128,64,8,8,3,3872.309333333333,3
w13,1536,128,6,4096,2048,128,128,64,16,4,3,3888.267,3
w13,1536,128,6,4096,2048,128,128,64,16,8,3,3872.192333333333,3
w13,1536,128,6,4096,2048,128,128,64,32,4,3,3879.584666666667,3
w13,1536,128,6,4096,2048,128,128,64,32,8,3,3873.1096666666667,3
w13,1536,128,6,4096,2048,128,128,64,64,4,3,3877.9096666666665,3
w13,1536,128,6,4096,2048,128,128,64,64,8,3,3874.4746666666665,3
w13,1536,128,8,2048,768,64,64,64,1,4,2,741.0073333333333,3
w13,1536,128,8,2048,768,64,64,64,1,4,3,736.3143333333334,3
w13,1536,128,8,2048,768,64,64,64,1,4,4,737.1996666666668,3
w13,1536,128,8,2048,768,64,64,64,4,4,2,739.93,3
w13,1536,128,8,2048,768,64,64,64,4,4,3,738.5223333333333,3
w13,1536,128,8,2048,768,64,64,64,4,4,4,736.3996666666667,3
w13,1536,128,8,2048,768,64,64,64,16,4,2,740.0369999999999,3
w13,1536,128,8,2048,768,64,64,64,16,4,3,738.5753333333333,3
w13,1536,128,8,2048,768,64,64,64,16,4,4,736.3136666666666,3
w13,1536,128,8,2048,768,64,64,64,32,4,3,738.1916666666666,3
w13,1536,128,8,2048,768,64,64,64,32,4,4,734.7356666666666,3
w13,1536,128,8,2048,768,64,64,64,64,4,3,736.1013333333334,3
w13,1536,128,8,2048,768,64,64,64,64,4,4,734.266,3
w13,1536,128,8,2048,768,64,128,32,8,4,4,741.466,3
w13,1536,128,8,2048,768,64,128,64,1,4,4,738.7139999999999,3
w13,1536,128,8,2048,768,64,128,64,4,4,4,741.4983333333333,3
w13,1536,128,8,2048,768,64,128,64,16,4,4,740.6126666666665,3
w13,1536,128,8,2048,768,64,128,64,32,4,3,741.0079999999999,3
w13,1536,128,8,2048,768,64,128,64,32,4,4,739.8876666666666,3
w13,1536,128,8,2048,768,64,128,64,64,4,4,739.7379999999999,3
w13,1536,128,8,2048,768,64,256,32,8,8,4,741.3696666666666,3
w13,1536,128,8,2048,768,128,128,64,1,8,3,740.869,3
w13,1536,128,8,2048,768,128,128,64,4,8,3,740.1330000000002,3
w13,1536,128,8,2048,768,128,128,64,8,8,3,740.176,3
w13,1536,128,8,2048,768,128,128,64,16,8,3,740.0903333333332,3
w13,1536,128,8,2048,768,128,128,64,64,8,3,740.1116666666667,3
w13,1536,128,8,4096,1536,64,64,64,1,4,3,2905.744,3
w13,1536,128,8,4096,1536,64,64,64,1,4,4,2904.7946666666667,3
w13,1536,128,8,4096,1536,64,64,64,4,4,3,2914.4373333333333,3
w13,1536,128,8,4096,1536,64,64,64,4,4,4,2910.5443333333333,3
w13,1536,128,8,4096,1536,64,64,64,16,4,3,2911.8456666666666,3
w13,1536,128,8,4096,1536,64,64,64,16,4,4,2900.7306666666664,3
w13,1536,128,8,4096,1536,64,64,64,32,4,3,2902.8323333333333,3
w13,1536,128,8,4096,1536,64,64,64,32,4,4,2909.616,3
w13,1536,128,8,4096,1536,64,64,64,64,4,3,2914.3416666666667,3
w13,1536,128,8,4096,1536,64,64,64,64,4,4,2900.539,3
w13,1536,128,8,4096,1536,64,128,32,8,8,3,2914.8530000000005,3
w13,1536,128,8,4096,1536,64,128,32,8,8,4,2909.6373333333336,3
w13,1536,128,8,4096,1536,64,128,32,8,8,5,2898.9809999999998,3
w13,1536,128,8,4096,1536,64,128,64,1,4,2,2914.0,3
w13,1536,128,8,4096,1536,64,128,64,1,4,3,2902.117333333333,3
w13,1536,128,8,4096,1536,64,128,64,1,4,4,2886.3306666666667,3
w13,1536,128,8,4096,1536,64,128,64,1,8,3,2912.1013333333335,3
w13,1536,128,8,4096,1536,64,128,64,4,4,2,2904.475,3
w13,1536,128,8,4096,1536,64,128,64,4,4,3,2896.08,3
w13,1536,128,8,4096,1536,64,128,64,4,4,4,2889.541333333333,3
w13,1536,128,8,4096,1536,64,128,64,4,8,3,2903.226666666667,3
w13,1536,128,8,4096,1536,64,128,64,16,4,2,2894.9286666666667,3
w13,1536,128,8,4096,1536,64,128,64,16,4,3,2894.2236666666668,3
w13,1536,128,8,4096,1536,64,128,64,16,4,4,2890.992,3
w13,1536,128,8,4096,1536,64,128,64,16,8,3,2903.141333333333,3
w13,1536,128,8,4096,1536,64,128,64,32,4,2,2904.250666666667,3
w13,1536,128,8,4096,1536,64,128,64,32,4,3,2894.522333333333,3
w13,1536,128,8,4096,1536,64,128,64,32,4,4,2899.1946666666663,3
w13,1536,128,8,4096,1536,64,128,64,32,8,3,2903.312,3
w13,1536,128,8,4096,1536,64,128,64,64,4,2,2895.2053333333333,3
w13,1536,128,8,4096,1536,64,128,64,64,4,3,2894.2880000000005,3
w13,1536,128,8,4096,1536,64,128,64,64,4,4,2900.3356666666664,3
w13,1536,128,8,4096,1536,64,128,64,64,8,3,2902.5226666666663,3
w13,1536,128,8,4096,1536,128,64,64,1,4,3,2902.7146666666667,3
w13,1536,128,8,4096,1536,128,64,64,1,8,3,2895.2263333333335,3
w13,1536,128,8,4096,1536,128,64,64,1,8,4,2898.6289999999995,3
w13,1536,128,8,4096,1536,128,64,64,16,8,3,2896.0373333333337,3
w13,1536,128,8,4096,1536,128,64,64,16,8,4,2897.4773333333337,3
w13,1536,128,8,4096,3072,64,64,64,1,4,3,5796.215333333334,3
w13,1536,128,8,4096,3072,64,64,64,1,4,4,5808.044999999999,3
w13,1536,128,8,4096,3072,64,64,64,4,4,3,5792.162333333334,3
w13,1536,128,8,4096,3072,64,64,64,4,4,4,5788.044666666666,3
w13,1536,128,8,4096,3072,64,64,64,16,4,3,5806.957333333333,3
w13,1536,128,8,4096,3072,64,64,64,16,4,4,5788.268333333333,3
w13,1536,128,8,4096,3072,64,64,64,32,4,2,5813.868666666666,3
w13,1536,128,8,4096,3072,64,64,64,32,4,3,5806.253,3
w13,1536,128,8,4096,3072,64,64,64,32,4,4,5787.6393333333335,3
w13,1536,128,8,4096,3072,64,64,64,64,4,2,5812.066333333333,3
w13,1536,128,8,4096,3072,64,64,64,64,4,3,5806.135666666666,3
w13,1536,128,8,4096,3072,64,64,64,64,4,4,5803.287333333334,3
w13,1536,128,8,4096,3072,64,128,32,8,4,3,5794.956666666666,3
w13,1536,128,8,4096,3072,64,128,32,8,4,4,5794.797,3
w13,1536,128,8,4096,3072,64,128,32,8,4,5,5797.751333333334,3
w13,1536,128,8,4096,3072,64,128,32,8,8,3,5799.095333333334,3
w13,1536,128,8,4096,3072,64,128,32,8,8,4,5786.679,3
w13,1536,128,8,4096,3072,64,128,32,8,8,5,5806.391333333333,3
w13,1536,128,8,4096,3072,64,128,64,1,4,2,5794.796666666666,3
w13,1536,128,8,4096,3072,64,128,64,1,4,3,5770.540666666667,3
w13,1536,128,8,4096,3072,64,128,64,1,4,4,5782.017666666667,3
w13,1536,128,8,4096,3072,64,128,64,1,8,3,5810.242000000001,3
w13,1536,128,8,4096,3072,64,128,64,1,8,4,5801.740999999999,3
w13,1536,128,8,4096,3072,64,128,64,4,4,2,5796.908666666666,3
w13,1536,128,8,4096,3072,64,128,64,4,4,3,5775.8206666666665,3
w13,1536,128,8,4096,3072,64,128,64,4,4,4,5769.068666666666,3
w13,1536,128,8,4096,3072,64,128,64,4,8,3,5812.791333333334,3
w13,1536,128,8,4096,3072,64,128,64,4,8,4,5805.378333333333,3
w13,1536,128,8,4096,3072,64,128,64,16,4,2,5793.708333333333,3
w13,1536,128,8,4096,3072,64,128,64,16,4,3,5777.473999999999,3
w13,1536,128,8,4096,3072,64,128,64,16,4,4,5770.1990000000005,3
w13,1536,128,8,4096,3072,64,128,64,16,8,3,5795.7243333333345,3
w13,1536,128,8,4096,3072,64,128,64,16,8,4,5802.306,3
w13,1536,128,8,4096,3072,64,128,64,32,4,2,5776.418000000001,3
w13,1536,128,8,4096,3072,64,128,64,32,4,3,5773.7300000000005,3
w13,1536,128,8,4096,3072,64,128,64,32,4,4,5769.559666666667,3
w13,1536,128,8,4096,3072,64,128,64,32,8,3,5813.068333333333,3
w13,1536,128,8,4096,3072,64,128,64,32,8,4,5801.751,3
w13,1536,128,8,4096,3072,64,128,64,64,4,2,5796.535333333333,3
w13,1536,128,8,4096,3072,64,128,64,64,4,3,5775.020333333334,3
w13,1536,128,8,4096,3072,64,128,64,64,4,4,5771.948666666666,3
w13,1536,128,8,4096,3072,64,128,64,64,8,3,5794.241333333334,3
w13,1536,128,8,4096,3072,64,128,64,64,8,4,5803.895,3
w13,1536,128,8,4096,3072,64,256,32,8,8,3,5792.897666666667,3
w13,1536,128,8,4096,3072,64,256,32,8,8,4,5774.625666666667,3
w13,1536,128,8,4096,3072,64,256,32,8,8,5,5773.804,3
w13,1536,128,8,4096,3072,64,256,32,32,8,3,5772.93,3
w13,1536,128,8,4096,3072,64,256,32,32,8,4,5774.465333333334,3
w13,1536,128,8,4096,3072,64,256,32,32,8,5,5792.844,3
w13,1536,128,8,4096,3072,64,256,64,1,4,2,5802.603999999999,3
w13,1536,128,8,4096,3072,128,64,64,1,4,3,5795.051666666666,3
w13,1536,128,8,4096,3072,128,64,64,1,8,2,5816.918999999999,3
w13,1536,128,8,4096,3072,128,64,64,1,8,3,5801.334333333333,3
w13,1536,128,8,4096,3072,128,64,64,1,8,4,5790.593,3
w13,1536,128,8,4096,3072,128,64,64,16,8,2,5818.113666666667,3
w13,1536,128,8,4096,3072,128,64,64,16,8,3,5784.577,3
w13,1536,128,8,4096,3072,128,64,64,16,8,4,5787.979666666666,3
w13,1536,128,8,4096,3072,128,128,64,1,4,3,5789.537,3
w13,1536,128,8,4096,3072,128,128,64,1,8,3,5778.209,3
w13,1536,128,8,4096,3072,128,128,64,4,4,3,5787.798333333333,3
w13,1536,128,8,4096,3072,128,128,64,4,8,3,5789.377,3
w13,1536,128,8,4096,3072,128,128,64,8,4,3,5786.614333333334,3
w13,1536,128,8,4096,3072,128,128,64,8,8,3,5785.985000000001,3
w13,1536,128,8,4096,3072,128,128,64,16,4,3,5785.025000000001,3
w13,1536,128,8,4096,3072,128,128,64,16,8,3,5770.230333333333,3
w13,1536,128,8,4096,3072,128,128,64,32,4,3,5788.342333333333,3
w13,1536,128,8,4096,3072,128,128,64,32,8,3,5770.07,3
w13,1536,128,8,4096,3072,128,128,64,64,4,3,5789.046333333333,3
w13,1536,128,8,4096,3072,128,128,64,64,8,3,5769.8460000000005,3
w13,2048,8,2,1024,512,64,64,64,1,4,2,68.354,3
w13,2048,8,2,1024,512,64,64,64,1,4,3,68.32233333333333,3
w13,2048,8,2,1024,512,64,64,64,1,4,4,68.02366666666667,3
w13,2048,8,2,1024,512,64,64,64,4,4,3,68.29066666666667,3
w13,2048,8,2,1024,512,64,64,64,4,4,4,68.09833333333334,3
w13,2048,8,2,1024,512,64,64,64,16,4,3,68.29033333333332,3
w13,2048,8,2,1024,512,64,64,64,16,4,4,67.95966666666668,3
w13,2048,8,2,1024,512,64,64,64,32,4,2,68.08733333333333,3
w13,2048,8,2,1024,512,64,64,64,32,4,3,67.97033333333333,3
w13,2048,8,2,1024,512,64,64,64,32,4,4,67.746,3
w13,2048,8,2,1024,512,64,64,64,64,4,2,68.205,3
w13,2048,8,2,1024,512,64,64,64,64,4,3,67.95966666666668,3
w13,2048,8,2,1024,512,64,64,64,64,4,4,67.73566666666666,3
w13,2048,8,2,1024,512,64,128,32,8,8,3,68.38633333333333,3
w13,2048,8,2,1024,512,64,128,64,1,4,3,67.93866666666666,3
w13,2048,8,2,1024,512,64,128,64,1,4,4,67.93866666666666,3
w13,2048,8,2,1024,512,64,128,64,4,4,3,68.098,3
w13,2048,8,2,1024,512,64,128,64,4,4,4,67.88466666666666,3
w13,2048,8,2,1024,512,64,128,64,16,4,3,68.15133333333334,3
w13,2048,8,2,1024,512,64,128,64,16,4,4,68.00200000000001,3
w13,2048,8,2,1024,512,64,128,64,32,4,3,68.322,3
w13,2048,8,2,1024,512,64,128,64,32,4,4,68.077,3
w13,2048,8,2,1024,512,64,128,64,64,4,3,68.045,3
w13,2048,8,2,1024,512,64,128,64,64,4,4,68.02366666666667,3
w13,2048,8,2,1024,512,128,64,64,1,8,3,68.109,3
w13,2048,8,2,1024,512,128,64,64,1,8,4,68.20466666666667,3
w13,2048,8,2,1024,512,128,64,64,16,8,3,68.11966666666666,3
w13,2048,8,2,1024,512,128,64,64,16,8,4,68.098,3
w13,2048,16,2,1536,768,64,64,64,4,4,3,143.299,3
w13,2048,16,2,1536,768,64,64,64,4,4,4,143.0533333333333,3
w13,2048,16,2,1536,768,64,64,64,16,4,3,143.42666666666665,3
w13,2048,16,2,1536,768,64,64,64,16,4,4,143.15933333333334,3
w13,2048,16,2,1536,768,64,64,64,64,4,4,143.30933333333334,3
w13,2048,16,2,1536,768,64,128,32,8,8,4,143.20266666666666,3
w13,2048,16,2,1536,768,64,128,64,1,4,3,142.82899999999998,3
w13,2048,16,2,1536,768,64,128,64,1,4,4,142.093,3
w13,2048,16,2,1536,768,64,128,64,4,4,2,143.085,3
w13,2048,16,2,1536,768,64,128,64,4,4,3,142.89266666666666,3
w13,2048,16,2,1536,768,64,128,64,4,4,4,142.69066666666666,3
w13,2048,16,2,1536,768,64,128,64,16,4,2,143.38400000000001,3
w13,2048,16,2,1536,768,64,128,64,16,4,3,143.07433333333333,3
w13,2048,16,2,1536,768,64,128,64,16,4,4,142.63733333333334,3
w13,2048,16,2,1536,768,64,128,64,32,4,3,142.69,3
w13,2048,16,2,1536,768,64,128,64,32,4,4,142.189,3
w13,2048,16,2,1536,768,64,128,64,64,4,2,142.76533333333336,3
w13,2048,16,2,1536,768,64,128,64,64,4,3,142.28566666666666,3
w13,2048,16,2,1536,768,64,128,64,64,4,4,142.30666666666667,3
w13,2048,16,2,1536,768,64,256,32,8,8,3,143.24566666666666,3
w13,2048,16,2,1536,768,64,256,32,8,8,4,143.2446666666667,3
w13,2048,16,2,1536,768,64,256,32,8,8,5,143.17,3
w13,2048,16,2,1536,768,64,256,32,32,8,4,143.46866666666668,3
w13,2048,16,2,1536,768,64,256,32,32,8,5,143.41533333333334,3
w13,2048,16,2,1536,768,128,64,64,1,8,3,142.49866666666665,3
w13,2048,16,2,1536,768,128,64,64,1,8,4,143.13833333333335,3
w13,2048,16,2,1536,768,128,64,64,16,8,3,142.74333333333334,3
w13,2048,16,2,1536,768,128,64,64,16,8,4,143.20266666666666,3
w13,2048,16,2,1536,768,128,128,64,1,8,3,143.13866666666667,3
w13,2048,16,2,1536,768,128,128,64,4,8,3,142.64733333333334,3
w13,2048,16,2,1536,768,128,128,64,8,8,3,142.80833333333334,3
w13,2048,16,2,1536,768,128,128,64,16,8,3,142.74366666666666,3
w13,2048,16,2,1536,768,128,128,64,32,8,3,142.67966666666666,3
w13,2048,16,2,1536,768,128,128,64,64,8,3,143.352,3
w13,2048,16,4,1536,1024,64,64,64,1,4,3,373.5926666666667,3
w13,2048,16,4,1536,1024,64,64,64,1,4,4,372.846,3
w13,2048,16,4,1536,1024,64,64,64,4,4,2,374.2753333333333,3
w13,2048,16,4,1536,1024,64,64,64,4,4,3,373.326,3
w13,2048,16,4,1536,1024,64,64,64,4,4,4,372.66466666666673,3
w13,2048,16,4,1536,1024,64,64,64,16,4,2,373.42233333333337,3
w13,2048,16,4,1536,1024,64,64,64,16,4,3,372.45166666666665,3
w13,2048,16,4,1536,1024,64,64,64,16,4,4,371.459,3
w13,2048,16,4,1536,1024,64,64,64,32,4,2,374.4246666666666,3
w13,2048,16,4,1536,1024,64,64,64,32,4,3,373.6566666666667,3
w13,2048,16,4,1536,1024,64,64,64,32,4,4,372.88899999999995,3
w13,2048,16,4,1536,1024,64,64,64,64,4,2,374.638,3
w13,2048,16,4,1536,1024,64,64,64,64,4,3,373.62533333333334,3
w13,2048,16,4,1536,1024,64,64,64,64,4,4,372.483,3
w13,2048,32,4,2048,768,64,64,64,1,4,4,375.37433333333337,3
w13,2048,32,4,2048,768,64,64,64,4,4,3,374.7873333333334,3
w13,2048,32,4,2048,768,64,64,64,4,4,4,373.6673333333333,3
w13,2048,32,4,2048,768,64,64,64,16,4,4,374.436,3
w13,2048,32,4,2048,768,64,64,64,32,4,3,375.4696666666667,3
w13,2048,32,4,2048,768,64,64,64,32,4,4,374.64900000000006,3
w13,2048,32,4,2048,768,64,64,64,64,4,3,374.9476666666667,3
w13,2048,32,4,2048,768,64,64,64,64,4,4,373.78433333333334,3
w13,2048,32,4,2048,768,64,128,32,8,4,4,375.459,3
w13,2048,32,4,2048,768,64,128,32,8,8,3,375.7906666666666,3
w13,2048,32,4,2048,768,64,128,32,8,8,4,374.5,3
w13,2048,32,4,2048,768,64,128,32,8,8,5,374.94733333333335,3
w13,2048,32,4,2048,768,64,128,64,1,4,2,373.6783333333333,3
w13,2048,32,4,2048,768,64,128,64,1,4,3,374.00933333333336,3
w13,2048,32,4,2048,768,64,128,64,1,4,4,373.401,3
w13,2048,32,4,2048,768,64,128,64,4,4,2,373.6993333333333,3
w13,2048,32,4,2048,768,64,128,64,4,4,3,372.441,3
w13,2048,32,4,2048,768,64,128,64,4,4,4,372.10966666666667,3
w13,2048,32,4,2048,768,64,128,64,4,8,3,375.1073333333334,3
w13,2048,32,4,2048,768,64,128,64,16,4,2,374.8306666666667,3
w13,2048,32,4,2048,768,64,128,64,16,4,3,374.7663333333333,3
w13,2048,32,4,2048,768,64,128,64,16,4,4,373.7633333333333,3
w13,2048,32,4,2048,768,64,128,64,32,4,2,374.01966666666664,3
w13,2048,32,4,2048,768,64,128,64,32,4,3,373.2513333333333,3
w13,2048,32,4,2048,768,64,128,64,32,4,4,372.708,3
w13,2048,32,4,2048,768,64,128,64,64,4,2,374.79833333333335,3
w13,2048,32,4,2048,768,64,128,64,64,4,3,374.59566666666666,3
w13,2048,32,4,2048,768,64,128,64,64,4,4,373.7423333333333,3
w13,2048,32,4,2048,768,64,128,64,64,8,3,375.1496666666667,3
w13,2048,32,4,2048,768,64,256,32,8,8,3,373.84833333333336,3
w13,2048,32,4,2048,768,64,256,32,8,8,4,374.084,3
w13,2048,32,4,2048,768,64,256,32,8,8,5,373.58166666666665,3
w13,2048,32,4,2048,768,64,256,32,32,8,3,374.297,3
w13,2048,32,4,2048,768,64,256,32,32,8,4,374.11533333333335,3
w13,2048,32,4,2048,768,64,256,32,32,8,5,374.723,3
w13,2048,32,4,2048,768,128,64,64,1,8,3,374.69166666666666,3
w13,2048,32,4,2048,768,128,64,64,1,8,4,375.8433333333333,3
w13,2048,32,4,2048,768,128,64,64,16,8,3,373.51833333333326,3
w13,2048,32,4,2048,768,128,128,64,1,8,3,373.14466666666664,3
w13,2048,32,4,2048,768,128,128,64,4,8,3,373.0913333333333,3
w13,2048,32,4,2048,768,128,128,64,8,8,3,373.29400000000004,3
w13,2048,32,4,2048,768,128,128,64,16,8,3,373.3476666666667,3
w13,2048,32,4,2048,768,128,128,64,32,8,3,373.3053333333333,3
w13,2048,32,4,2048,768,128,128,64,64,4,3,375.8326666666667,3
w13,2048,32,4,2048,768,128,128,64,64,8,3,373.49666666666667,3
w13,2048,32,6,3072,1024,64,64,64,1,4,2,1108.5186666666666,3
w13,2048,32,6,3072,1024,64,64,64,1,4,3,1107.079,3
w13,2048,32,6,3072,1024,64,64,64,1,4,4,1100.348,3
w13,2048,32,6,3072,1024,64,64,64,4,4,2,1108.7633333333333,3
w13,2048,32,6,3072,1024,64,64,64,4,4,3,1105.5956666666668,3
w13,2048,32,6,3072,1024,64,64,64,4,4,4,1104.1243333333332,3
w13,2048,32,6,3072,1024,64,64,64,16,4,2,1106.1403333333333,3
w13,2048,32,6,3072,1024,64,64,64,16,4,3,1102.3426666666667,3
w13,2048,32,6,3072,1024,64,64,64,16,4,4,1103.5803333333333,3
w13,2048,32,6,3072,1024,64,64,64,32,4,2,1105.7446666666667,3
w13,2048,32,6,3072,1024,64,64,64,32,4,3,1102.3213333333333,3
w13,2048,32,6,3072,1024,64,64,64,32,4,4,1100.5606666666667,3
w13,2048,32,6,3072,1024,64,64,64,64,4,2,1109.191,3
w13,2048,32,6,3072,1024,64,64,64,64,4,3,1103.8036666666667,3
w13,2048,32,6,3072,1024,64,64,64,64,4,4,1100.8493333333333,3
w13,2048,32,6,3072,1024,64,128,32,8,4,4,1110.6196666666667,3
w13,2048,32,6,3072,1024,64,128,64,1,4,4,1109.318,3
w13,2048,32,6,3072,1024,64,128,64,4,4,3,1110.076,3
w13,2048,32,6,3072,1024,64,128,64,16,4,3,1110.4593333333332,3
w13,2048,32,6,3072,1024,64,128,64,16,4,4,1108.9766666666667,3
w13,2048,32,6,3072,1024,64,128,64,32,4,3,1110.6733333333334,3
w13,2048,32,6,3072,1024,64,128,64,32,4,4,1108.0816666666667,3
w13,2048,32,6,3072,1024,64,128,64,64,4,4,1110.4063333333334,3
w13,2048,32,6,3072,1024,64,256,32,8,8,4,1110.0646666666667,3
w13,2048,32,6,3072,1024,64,256,32,8,8,5,1110.119,3
w13,2048,32,6,3072,1024,128,128,64,1,8,3,1109.1473333333333,3
w13,2048,32,6,3072,1024,128,128,64,4,8,3,1108.785,3
w13,2048,32,6,3072,1024,128,128,64,8,8,3,1109.2756666666667,3
w13,2048,32,6,3072,1024,128,128,64,16,8,3,1109.1376666666667,3
w13,2048,32,6,3072,1024,128,128,64,32,8,3,1109.03,3
w13,2048,32,6,3072,1024,128,128,64,64,8,3,1109.1696666666667,3
w13,2048,60,4,2048,1408,64,64,64,1,4,3,948.6676666666667,3
w13,2048,60,4,2048,1408,64,64,64,1,4,4,948.7206666666667,3
w13,2048,60,4,2048,1408,64,64,64,4,4,2,952.0486666666666,3
w13,2048,60,4,2048,1408,64,64,64,4,4,3,947.91,3
w13,2048,60,4,2048,1408,64,64,64,4,4,4,948.678,3
w13,2048,60,4,2048,1408,64,64,64,16,4,2,951.6973333333332,3
w13,2048,60,4,2048,1408,64,64,64,16,4,3,951.2173333333334,3
w13,2048,60,4,2048,1408,64,64,64,16,4,4,948.4646666666667,3
w13,2048,60,4,2048,1408,64,64,64,32,4,2,951.985,3
w13,2048,60,4,2048,1408,64,64,64,32,4,3,948.561,3
w13,2048,60,4,2048,1408,64,64,64,32,4,4,948.3476666666667,3
w13,2048,60,4,2048,1408,64,64,64,64,4,3,948.3363333333333,3
w13,2048,60,4,2048,1408,64,64,64,64,4,4,948.625,3
w13,2048,60,4,2048,1408,64,128,32,8,4,5,951.0673333333334,3
w13,2048,60,4,2048,1408,64,128,32,8,8,3,947.9316666666667,3
w13,2048,60,4,2048,1408,64,128,32,8,8,4,947.1529999999999,3
w13,2048,60,4,2048,1408,64,128,32,8,8,5,947.8143333333333,3
w13,2048,60,4,2048,1408,64,128,64,1,4,3,945.9366666666666,3
w13,2048,60,4,2048,1408,64,128,64,1,4,4,944.4006666666668,3
w13,2048,60,4,2048,1408,64,128,64,1,8,3,949.6276666666666,3
w13,2048,60,4,2048,1408,64,128,64,4,4,2,949.2223333333333,3
w13,2048,60,4,2048,1408,64,128,64,4,4,3,945.8943333333333,3
w13,2048,60,4,2048,1408,64,128,64,4,4,4,945.8299999999999,3
w13,2048,60,4,2048,1408,64,128,64,4,8,3,949.3393333333333,3
w13,2048,60,4,2048,1408,64,128,64,16,4,2,949.7446666666666,3
w13,2048,60,4,2048,1408,64,128,64,16,4,3,942.8433333333332,3
w13,2048,60,4,2048,1408,64,128,64,16,4,4,942.8863333333334,3
w13,2048,60,4,2048,1408,64,128,64,16,8,3,951.4726666666667,3
w13,2048,60,4,2048,1408,64,128,64,32,4,2,947.302,3
w13,2048,60,4,2048,1408,64,128,64,32,4,3,942.8650000000001,3
w13,2048,60,4,2048,1408,64,128,64,32,4,4,943.174,3
w13,2048,60,4,2048,1408,64,128,64,32,8,3,948.8596666666667,3
w13,2048,60,4,2048,1408,64,128,64,64,4,2,944.9023333333334,3
w13,2048,60,4,2048,1408,64,128,64,64,4,3,946.0113333333334,3
w13,2048,60,4,2048,1408,64,128,64,64,4,4,945.2543333333333,3
w13,2048,60,4,2048,1408,64,128,64,64,8,3,949.9899999999999,3
w13,2048,60,6,3584,2304,64,64,64,1,4,2,3581.131,3
w13,2048,60,6,3584,2304,64,64,64,1,4,3,3569.045,3
w13,2048,60,6,3584,2304,64,64,64,1,4,4,3565.355,3
w13,2048,60,6,3584,2304,64,64,64,4,4,2,3582.5603333333333,3
w13,2048,60,6,3584,2304,64,64,64,4,4,3,3569.963333333333,3
w13,2048,60,6,3584,2304,64,64,64,4,4,4,3578.3896666666665,3
w13,2048,60,6,3584,2304,64,64,64,16,4,3,3580.213333333333,3
w13,2048,60,6,3584,2304,64,64,64,16,4,4,3564.2773333333334,3
w13,2048,60,6,3584,2304,64,64,64,32,4,2,3582.6246666666666,3
w13,2048,60,6,3584,2304,64,64,64,32,4,3,3569.6103333333335,3
w13,2048,60,6,3584,2304,64,64,64,32,4,4,3576.4906666666666,3
w13,2048,60,6,3584,2304,64,64,64,64,4,3,3580.7786666666666,3
w13,2048,60,6,3584,2304,64,64,64,64,4,4,3565.7386666666666,3
w13,2048,60,6,3584,2304,64,128,32,8,4,4,3577.355333333333,3
w13,2048,60,6,3584,2304,64,128,32,8,4,5,3556.0750000000003,3
w13,2048,60,6,3584,2304,64,128,32,8,8,2,3585.3333333333335,3
w13,2048,60,6,3584,2304,64,128,32,8,8,3,3565.696,3
w13,2048,60,6,3584,2304,64,128,32,8,8,4,3564.117666666667,3
w13,2048,60,6,3584,2304,64,128,32,8,8,5,3581.3223333333335,3
w13,2048,60,6,3584,2304,64,128,64,1,4,2,3584.9816666666666,3
w13,2048,60,6,3584,2304,64,128,64,1,4,3,3565.0983333333334,3
w13,2048,60,6,3584,2304,64,128,64,1,4,4,3551.8823333333335,3
w13,2048,60,6,3584,2304,64,128,64,1,8,3,3583.9043333333334,3
w13,2048,60,6,3584,2304,64,128,64,4,4,2,3559.8513333333335,3
w13,2048,60,6,3584,2304,64,128,64,4,4,3,3558.0903333333335,3
w13,2048,60,6,3584,2304,64,128,64,4,4,4,3569.0879999999997,3
w13,2048,60,6,3584,2304,64,128,64,4,8,3,3574.1336666666666,3
w13,2048,60,6,3584,2304,64,128,64,16,4,2,3559.029,3
w13,2048,60,6,3584,2304,64,128,64,16,4,3,3555.9463333333333,3
w13,2048,60,6,3584,2304,64,128,64,16,4,4,3567.104333333333,3
w13,2048,60,6,3584,2304,64,128,64,16,8,3,3574.1766666666667,3
w13,2048,60,6,3584,2304,64,128,64,32,4,2,3559.925333333333,3
w13,2048,60,6,3584,2304,64,128,64,32,4,3,3563.1569999999997,3
w13,2048,60,6,3584,2304,64,128,64,32,4,4,3574.6030000000005,3
w13,2048,60,6,3584,2304,64,128,64,32,8,3,3575.7226666666666,3
w13,2048,60,6,3584,2304,64,128,64,64,4,2,3559.168666666667,3
w13,2048,60,6,3584,2304,64,128,64,64,4,3,3558.197666666667,3
w13,2048,60,6,3584,2304,64,128,64,64,4,4,3557.141333333333,3
w13,2048,60,6,3584,2304,64,128,64,64,8,3,3574.3573333333334,3
w13,2048,60,6,3584,2304,64,256,32,8,8,4,3582.773333333333,3
w13,2048,60,6,3584,2304,64,256,32,8,8,5,3579.8086666666663,3
w13,2048,60,6,3584,2304,64,256,32,32,8,4,3580.683333333333,3
w13,2048,60,6,3584,2304,64,256,32,32,8,5,3580.0850000000005,3
w13,2048,60,6,3584,2304,64,256,64,8,4,2,3584.9926666666665,3
w13,2048,60,6,3584,2304,64,256,64,32,4,2,3580.7143333333333,3
w13,2048,60,6,3584,2304,128,64,64,1,4,3,3569.578666666667,3
w13,2048,60,6,3584,2304,128,64,64,1,8,3,3573.4083333333333,3
w13,2048,60,6,3584,2304,128,64,64,1,8,4,3581.5046666666663,3
w13,2048,60,6,3584,2304,128,64,64,16,8,3,3573.824,3
w13,2048,60,6,3584,2304,128,64,64,16,8,4,3578.7946666666667,3
w13,2048,60,6,3584,2304,128,128,64,1,4,3,3586.7100000000005,3
w13,2048,60,6,3584,2304,128,128,64,1,8,3,3575.882666666667,3
w13,2048,60,6,3584,2304,128,128,64,4,4,3,3587.093333333333,3
w13,2048,60,6,3584,2304,128,128,64,4,8,3,3577.0353333333333,3
w13,2048,60,6,3584,2304,128,128,64,8,4,3,3586.848,3
w13,2048,60,6,3584,2304,128,128,64,8,8,3,3577.056,3
w13,2048,60,6,3584,2304,128,128,64,16,4,3,3586.699,3
w13,2048,60,6,3584,2304,128,128,64,16,8,3,3576.895666666667,3
w13,2048,60,6,3584,2304,128,128,64,32,4,3,3587.616,3
w13,2048,60,6,3584,2304,128,128,64,32,8,3,3576.3736666666664,3
w13,2048,60,6,3584,2304,128,128,64,64,8,3,3576.266333333333,3
w13,2048,60,8,2048,1536,64,64,64,1,4,2,1722.0249999999999,3
w13,2048,60,8,2048,1536,64,64,64,1,4,3,1722.3770000000002,3
w13,2048,60,8,2048,1536,64,64,64,1,4,4,1718.9959999999999,3
w13,2048,60,8,2048,1536,64,64,64,4,4,2,1721.2250000000001,3
w13,2048,60,8,2048,1536,64,64,64,4,4,3,1718.8256666666666,3
w13,2048,60,8,2048,1536,64,64,64,4,4,4,1713.5343333333333,3
w13,2048,60,8,2048,1536,64,64,64,16,4,2,1725.5453333333335,3
w13,2048,60,8,2048,1536,64,64,64,16,4,3,1722.5373333333334,3
w13,2048,60,8,2048,1536,64,64,64,16,4,4,1715.5083333333332,3
w13,2048,60,8,2048,1536,64,64,64,32,4,2,1720.4573333333335,3
w13,2048,60,8,2048,1536,64,64,64,32,4,3,1717.7796666666666,3
w13,2048,60,8,2048,1536,64,64,64,32,4,4,1718.1103333333333,3
w13,2048,60,8,2048,1536,64,64,64,64,4,2,1726.036,3
w13,2048,60,8,2048,1536,64,64,64,64,4,3,1722.8786666666667,3
w13,2048,60,8,2048,1536,64,64,64,64,4,4,1713.3106666666665,3
w13,2048,60,8,2048,1536,64,128,32,8,4,4,1725.812,3
w13,2048,60,8,2048,1536,64,128,32,8,4,5,1723.049,3
w13,2048,60,8,2048,1536,64,128,32,8,8,2,1726.804,3
w13,2048,60,8,2048,1536,64,128,32,8,8,3,1722.537,3
w13,2048,60,8,2048,1536,64,128,32,8,8,4,1725.2783333333334,3
w13,2048,60,8,2048,1536,64,128,32,8,8,5,1727.2733333333333,3
w13,2048,60,8,2048,1536,64,128,64,1,4,2,1723.1236666666666,3
w13,2048,60,8,2048,1536,64,128,64,1,4,3,1712.937,3
w13,2048,60,8,2048,1536,64,128,64,1,4,4,1712.8943333333334,3
w13,2048,60,8,2048,1536,64,128,64,1,8,3,1725.684,3
w13,2048,60,8,2048,1536,64,128,64,4,4,2,1722.5266666666666,3
w13,2048,60,8,2048,1536,64,128,64,4,4,3,1721.1716666666664,3
w13,2048,60,8,2048,1536,64,128,64,4,4,4,1719.4436666666668,3
w13,2048,60,8,2048,1536,64,128,64,4,8,3,1726.3556666666666,3
w13,2048,60,8,2048,1536,64,128,64,16,4,2,1717.9076666666667,3
w13,2048,60,8,2048,1536,64,128,64,16,4,3,1715.6786666666667,3
w13,2048,60,8,2048,1536,64,128,64,16,4,4,1714.857,3
w13,2048,60,8,2048,1536,64,128,64,16,8,3,1726.3126666666667,3
w13,2048,60,8,2048,1536,64,128,64,32,4,2,1718.3133333333335,3
w13,2048,60,8,2048,1536,64,128,64,32,4,3,1716.1903333333332,3
w13,2048,60,8,2048,1536,64,128,64,32,4,4,1715.3693333333333,3
w13,2048,60,8,2048,1536,64,128,64,64,4,2,1717.2036666666665,3
w13,2048,60,8,2048,1536,64,128,64,64,4,3,1714.964,3
w13,2048,60,8,2048,1536,64,128,64,64,4,4,1714.4303333333335,3
w13,2048,64,6,3072,2048,64,64,64,1,4,2,2185.271666666667,3
w13,2048,64,6,3072,2048,64,64,64,1,4,3,2182.616,3
w13,2048,64,6,3072,2048,64,64,64,1,4,4,2186.712666666667,3
w13,2048,64,6,3072,2048,64,64,64,4,4,3,2189.197666666667,3
w13,2048,64,6,3072,2048,64,64,64,4,4,4,2186.221,3
w13,2048,64,6,3072,2048,64,64,64,16,4,2,2190.6476666666667,3
w13,2048,64,6,3072,2048,64,64,64,16,4,3,2181.047666666667,3
w13,2048,64,6,3072,2048,64,64,64,16,4,4,2179.341,3
w13,2048,64,6,3072,2048,64,64,64,32,4,2,2190.7866666666664,3
w13,2048,64,6,3072,2048,64,64,64,32,4,3,2188.7599999999998,3
w13,2048,64,6,3072,2048,64,64,64,32,4,4,2186.595,3
w13,2048,64,6,3072,2048,64,64,64,64,4,3,2186.4663333333333,3
w13,2048,64,6,3072,2048,64,64,64,64,4,4,2178.2000000000003,3
w13,2048,64,6,3072,2048,64,128,32,8,8,3,2190.6476666666663,3
w13,2048,64,6,3072,2048,64,128,32,8,8,4,2187.7466666666664,3
w13,2048,64,6,3072,2048,64,128,32,8,8,5,2182.9573333333333,3
w13,2048,64,6,3072,2048,64,128,64,1,4,2,2187.4476666666665,3
w13,2048,64,6,3072,2048,64,128,64,1,4,3,2171.4906666666666,3
w13,2048,64,6,3072,2048,64,128,64,1,4,4,2176.7923333333333,3
w13,2048,64,6,3072,2048,64,128,64,1,8,3,2183.0743333333335,3
w13,2048,64,6,3072,2048,64,128,64,4,4,3,2180.8883333333333,3
w13,2048,64,6,3072,2048,64,128,64,4,4,4,2177.3783333333336,3
w13,2048,64,6,3072,2048,64,128,64,4,8,3,2183.0533333333333,3
w13,2048,64,6,3072,2048,64,128,64,16,4,2,2183.6396666666665,3
w13,2048,64,6,3072,2048,64,128,64,16,4,3,2172.0983333333334,3
w13,2048,64,6,3072,2048,64,128,64,16,4,4,2174.4556666666667,3
w13,2048,64,6,3072,2048,64,128,64,16,8,3,2190.3276666666666,3
w13,2048,64,6,3072,2048,64,128,64,32,4,2,2176.27,3
w13,2048,64,6,3072,2048,64,128,64,32,4,3,2180.6110000000003,3
w13,2048,64,6,3072,2048,64,128,64,32,4,4,2177.666333333333,3
w13,2048,64,6,3072,2048,64,128,64,32,8,3,2182.2636666666667,3
w13,2048,64,6,3072,2048,64,128,64,64,4,3,2177.3996666666667,3
w13,2048,64,6,3072,2048,64,128,64,64,4,4,2172.717666666667,3
w13,2048,64,6,3072,2048,64,128,64,64,8,3,2190.2853333333333,3
w13,2048,64,6,3584,1536,64,64,64,1,4,2,1919.9260000000002,3
w13,2048,64,6,3584,1536,64,64,64,1,4,3,1919.1046666666668,3
w13,2048,64,6,3584,1536,64,64,64,1,4,4,1917.792666666667,3
w13,2048,64,6,3584,1536,64,64,64,4,4,2,1928.0536666666667,3
w13,2048,64,6,3584,1536,64,64,64,4,4,3,1919.5526666666665,3
w13,2048,64,6,3584,1536,64,64,64,4,4,4,1916.6093333333336,3
w13,2048,64,6,3584,1536,64,64,64,16,4,2,1928.961,3
w13,2048,64,6,3584,1536,64,64,64,16,4,3,1915.8093333333334,3
w13,2048,64,6,3584,1536,64,64,64,16,4,4,1913.6756666666668,3
w13,2048,64,6,3584,1536,64,64,64,32,4,2,1923.126,3
w13,2048,64,6,3584,1536,64,64,64,32,4,3,1919.1899999999998,3
w13,2048,64,6,3584,1536,64,64,64,32,4,4,1919.2436666666665,3
w13,2048,64,6,3584,1536,64,64,64,64,4,2,1928.6086666666667,3
w13,2048,64,6,3584,1536,64,64,64,64,4,3,1919.2223333333332,3
w13,2048,64,6,3584,1536,64,64,64,64,4,4,1913.4403333333332,3
w13,2048,64,6,3584,1536,64,128,32,8,4,3,1923.7133333333334,3
w13,2048,64,6,3584,1536,64,128,32,8,4,4,1928.9176666666665,3
w13,2048,64,6,3584,1536,64,128,32,8,4,5,1930.6359999999997,3
w13,2048,64,6,3584,1536,64,128,32,8,8,3,1931.393,3
w13,2048,64,6,3584,1536,64,128,32,8,8,4,1926.7206666666668,3
w13,2048,64,6,3584,1536,64,128,32,8,8,5,1928.6090000000002,3
w13,2048,64,6,3584,1536,64,128,64,1,4,2,1932.6513333333332,3
w13,2048,64,6,3584,1536,64,128,64,1,4,3,1927.0510000000002,3
w13,2048,64,6,3584,1536,64,128,64,1,4,4,1920.5873333333336,3
w13,2048,64,6,3584,1536,64,128,64,1,8,3,1931.211,3
w13,2048,64,6,3584,1536,64,128,64,4,4,2,1929.772,3
w13,2048,64,6,3584,1536,64,128,64,4,4,3,1921.1313333333335,3
w13,2048,64,6,3584,1536,64,128,64,4,4,4,1918.2830000000001,3
w13,2048,64,6,3584,1536,64,128,64,16,4,2,1927.4253333333334,3
w13,2048,64,6,3584,1536,64,128,64,16,4,3,1919.393,3
w13,2048,64,6,3584,1536,64,128,64,16,4,4,1925.9533333333331,3
w13,2048,64,6,3584,1536,64,128,64,16,8,3,1930.9666666666665,3
w13,2048,64,6,3584,1536,64,128,64,32,4,2,1927.3606666666667,3
w13,2048,64,6,3584,1536,64,128,64,32,4,3,1925.9743333333333,3
w13,2048,64,6,3584,1536,64,128,64,32,4,4,1922.8163333333334,3
w13,2048,64,6,3584,1536,64,128,64,32,8,3,1930.305,3
w13,2048,64,6,3584,1536,64,128,64,64,4,2,1927.4783333333335,3
w13,2048,64,6,3584,1536,64,128,64,64,4,3,1920.555,3
w13,2048,64,6,3584,1536,64,128,64,64,4,4,1916.5983333333334,3
w13,2048,64,6,3584,1536,64,256,32,8,8,3,1932.0333333333335,3
w13,2048,64,6,3584,1536,64,256,32,8,8,4,1929.1000000000001,3
w13,2048,64,6,3584,1536,64,256,32,8,8,5,1928.705,3
w13,2048,64,6,3584,1536,64,256,32,32,8,3,1929.0349999999999,3
w13,2048,64,6,3584,1536,64,256,32,32,8,4,1923.0413333333333,3
w13,2048,64,6,3584,1536,64,256,32,32,8,5,1923.1689999999999,3
w13,2048,64,8,3584,2560,64,64,64,1,4,2,4245.614333333334,3
w13,2048,64,8,3584,2560,64,64,64,1,4,3,4231.843,3
w13,2048,64,8,3584,2560,64,64,64,1,4,4,4228.120333333333,3
w13,2048,64,8,3584,2560,64,64,64,4,4,2,4256.3983333333335,3
w13,2048,64,8,3584,2560,64,64,64,4,4,3,4245.998333333334,3
w13,2048,64,8,3584,2560,64,64,64,4,4,4,4224.963333333333,3
w13,2048,64,8,3584,2560,64,64,64,16,4,2,4256.782333333334,3
w13,2048,64,8,3584,2560,64,64,64,16,4,3,4244.622333333334,3
w13,2048,64,8,3584,2560,64,64,64,16,4,4,4224.152666666667,3
w13,2048,64,8,3584,2560,64,64,64,32,4,2,4254.1156666666675,3
w13,2048,64,8,3584,2560,64,64,64,32,4,3,4246.1686666666665,3
w13,2048,64,8,3584,2560,64,64,64,32,4,4,4231.214,3
w13,2048,64,8,3584,2560,64,64,64,64,4,2,4242.169,3
w13,2048,64,8,3584,2560,64,64,64,64,4,3,4244.280666666667,3
w13,2048,64,8,3584,2560,64,64,64,64,4,4,4239.054,3
w13,2048,64,8,3584,2560,64,128,32,8,4,3,4224.269666666666,3
w13,2048,64,8,3584,2560,64,128,32,8,4,4,4220.462,3
w13,2048,64,8,3584,2560,64,128,32,8,4,5,4225.635333333333,3
w13,2048,64,8,3584,2560,64,128,32,8,8,3,4249.070333333333,3
w13,2048,64,8,3584,2560,64,128,32,8,8,4,4234.936666666667,3
w13,2048,64,8,3584,2560,64,128,32,8,8,5,4239.63,3
w13,2048,64,8,3584,2560,64,128,64,1,4,2,4242.958,3
w13,2048,64,8,3584,2560,64,128,64,1,4,3,4232.558,3
w13,2048,64,8,3584,2560,64,128,64,1,4,4,4215.1393333333335,3
w13,2048,64,8,3584,2560,64,128,64,1,8,3,4253.998333333333,3
w13,2048,64,8,3584,2560,64,128,64,4,4,2,4236.963333333333,3
w13,2048,64,8,3584,2560,64,128,64,4,4,3,4230.723333333333,3
w13,2048,64,8,3584,2560,64,128,64,4,4,4,4221.326333333333,3
w13,2048,64,8,3584,2560,64,128,64,4,8,3,4246.136666666666,3
w13,2048,64,8,3584,2560,64,128,64,16,4,2,4226.051333333333,3
w13,2048,64,8,3584,2560,64,128,64,16,4,3,4219.79,3
w13,2048,64,8,3584,2560,64,128,64,16,4,4,4224.899,3
w13,2048,64,8,3584,2560,64,128,64,16,8,3,4246.232333333333,3
w13,2048,64,8,3584,2560,64,128,64,32,4,2,4228.067,3
w13,2048,64,8,3584,2560,64,128,64,32,4,3,4220.910333333333,3
w13,2048,64,8,3584,2560,64,128,64,32,4,4,4223.491333333333,3
w13,2048,64,8,3584,2560,64,128,64,32,8,3,4245.827666666667,3
w13,2048,64,8,3584,2560,64,128,64,64,4,2,4235.8223333333335,3
w13,2048,64,8,3584,2560,64,128,64,64,4,3,4219.288666666666,3
w13,2048,64,8,3584,2560,64,128,64,64,4,4,4222.648666666667,3
w13,2048,64,8,3584,2560,64,128,64,64,8,3,4256.259666666666,3
w13,2048,64,8,3584,2560,64,256,32,8,8,3,4242.3713333333335,3
w13,2048,64,8,3584,2560,64,256,32,8,8,4,4240.227666666667,3
w13,2048,64,8,3584,2560,64,256,32,8,8,5,4231.331,3
w13,2048,64,8,3584,2560,64,256,32,32,8,3,4231.129,3
w13,2048,64,8,3584,2560,64,256,32,32,8,4,4226.584666666667,3
w13,2048,64,8,3584,2560,64,256,32,32,8,5,4226.787333333334,3
w13,2048,64,8,3584,2560,64,256,64,4,4,2,4244.59,3
w13,2048,64,8,3584,2560,64,256,64,8,4,2,4243.8116666666665,3
w13,2048,64,8,3584,2560,64,256,64,16,4,2,4240.174,3
w13,2048,64,8,3584,2560,64,256,64,32,4,2,4247.544666666667,3
w13,2048,64,8,3584,2560,64,256,64,64,4,2,4244.558333333333,3
w13,2048,64,8,3584,2560,128,64,64,1,4,3,4236.185,3
w13,2048,64,8,3584,2560,128,64,64,1,8,2,4249.1123333333335,3
w13,2048,64,8,3584,2560,128,64,64,1,8,3,4245.294,3
w13,2048,64,8,3584,2560,128,64,64,1,8,4,4251.192666666667,3
w13,2048,64,8,3584,2560,128,64,64,16,4,2,4252.515333333333,3
w13,2048,64,8,3584,2560,128,64,64,16,8,3,4236.194666666666,3
w13,2048,64,8,3584,2560,128,64,64,16,8,4,4240.067666666667,3
w13,2048,64,8,3584,2560,128,128,64,1,4,3,4241.6990000000005,3
w13,2048,64,8,3584,2560,128,128,64,1,8,3,4220.152666666667,3
w13,2048,64,8,3584,2560,128,128,64,4,4,3,4237.016333333333,3
w13,2048,64,8,3584,2560,128,128,64,4,8,3,4221.582333333333,3
w13,2048,64,8,3584,2560,128,128,64,8,4,3,4237.539,3
w13,2048,64,8,3584,2560,128,128,64,8,8,3,4220.067666666667,3
w13,2048,64,8,3584,2560,128,128,64,16,4,3,4239.288666666666,3
w13,2048,64,8,3584,2560,128,128,64,16,8,3,4221.294333333333,3
w13,2048,64,8,3584,2560,128,128,64,32,4,3,4239.117333333334,3
w13,2048,64,8,3584,2560,128,128,64,32,8,3,4220.803333333333,3
w13,2048,64,8,3584,2560,128,128,64,64,4,3,4239.950333333333,3
w13,2048,64,8,3584,2560,128,128,64,64,8,3,4220.7609999999995,3
w13,2048,128,4,2048,512,64,64,64,1,4,3,257.3576666666667,3
w13,2048,128,4,2048,512,64,64,64,1,4,4,255.93933333333334,3
w13,2048,128,4,2048,512,64,64,64,4,4,4,255.89666666666668,3
w13,2048,128,4,2048,512,64,64,64,16,4,4,257.30400000000003,3
w13,2048,128,4,2048,512,64,64,64,32,4,3,258.25333333333333,3
w13,2048,128,4,2048,512,64,64,64,32,4,4,257.88033333333334,3
w13,2048,128,4,2048,512,64,64,64,64,4,3,257.56033333333335,3
w13,2048,128,4,2048,512,64,64,64,64,4,4,256.974,3
w13,2048,128,6,4096,2048,64,64,64,1,4,2,3882.1443333333336,3
w13,2048,128,6,4096,2048,64,64,64,1,4,3,3871.968333333333,3
w13,2048,128,6,4096,2048,64,64,64,1,4,4,3876.6299999999997,3
w13,2048,128,6,4096,2048,64,64,64,4,4,2,3894.645666666667,3
w13,2048,128,6,4096,2048,64,64,64,4,4,3,3875.819,3
w13,2048,128,6,4096,2048,64,64,64,4,4,4,3866.5813333333335,3
w13,2048,128,6,4096,2048,64,64,64,16,4,2,3885.333666666667,3
w13,2048,128,6,4096,2048,64,64,64,16,4,3,3881.9843333333333,3
w13,2048,128,6,4096,2048,64,64,64,16,4,4,3875.488,3
w13,2048,128,6,4096,2048,64,64,64,32,4,2,3895.3073333333336,3
w13,2048,128,6,4096,2048,64,64,64,32,4,3,3867.733,3
w13,2048,128,6,4096,2048,64,64,64,32,4,4,3876.854,3
w13,2048,128,6,4096,2048,64,64,64,64,4,2,3881.878,3
w13,2048,128,6,4096,2048,64,64,64,64,4,3,3879.328,3
w13,2048,128,6,4096,2048,64,64,64,64,4,4,3866.219333333333,3
w13,2048,128,6,4096,2048,64,128,32,8,4,3,3875.211,3
w13,2048,128,6,4096,2048,64,128,32,8,4,4,3882.3146666666667,3
w13,2048,128,6,4096,2048,64,128,32,8,4,5,3880.171,3
w13,2048,128,6,4096,2048,64,128,32,8,8,3,3898.1866666666665,3
w13,2048,128,6,4096,2048,64,128,32,8,8,4,3889.003,3
w13,2048,128,6,4096,2048,64,128,32,8,8,5,3881.5676666666664,3
w13,2048,128,6,4096,2048,64,128,64,1,4,2,3882.752,3
w13,2048,128,6,4096,2048,64,128,64,1,4,3,3875.349333333333,3
w13,2048,128,6,4096,2048,64,128,64,1,4,4,3863.3176666666664,3
w13,2048,128,6,4096,2048,64,128,64,1,8,3,3883.402666666667,3
w13,2048,128,6,4096,2048,64,128,64,1,8,4,3890.3683333333333,3
w13,2048,128,6,4096,2048,64,128,64,4,4,2,3872.2343333333333,3
w13,2048,128,6,4096,2048,64,128,64,4,4,3,3868.128,3
w13,2048,128,6,4096,2048,64,128,64,4,4,4,3875.6803333333337,3
w13,2048,128,6,4096,2048,64,128,64,4,8,3,3883.979333333333,3
w13,2048,128,6,4096,2048,64,128,64,16,4,2,3870.4006666666664,3
w13,2048,128,6,4096,2048,64,128,64,16,4,3,3866.7943333333333,3
w13,2048,128,6,4096,2048,64,128,64,16,4,4,3867.3710000000005,3
w13,2048,128,6,4096,2048,64,128,64,16,8,3,3882.709666666667,3
w13,2048,128,6,4096,2048,64,128,64,16,8,4,3899.861666666666,3
w13,2048,128,6,4096,2048,64,128,64,32,4,2,3869.963333333333,3
w13,2048,128,6,4096,2048,64,128,64,32,4,3,3876.853333333333,3
w13,2048,128,6,4096,2048,64,128,64,32,4,4,3879.0506666666665,3
w13,2048,128,6,4096,2048,64,128,64,32,8,3,3884.363,3
w13,2048,128,6,4096,2048,64,128,64,32,8,4,3900.4166666666665,3
w13,2048,128,6,4096,2048,64,128,64,64,4,2,3871.4133333333334,3
w13,2048,128,6,4096,2048,64,128,64,64,4,3,3876.3303333333333,3
w13,2048,128,6,4096,2048,64,128,64,64,4,4,3868.0643333333333,3
w13,2048,128,6,4096,2048,64,128,64,64,8,3,3887.9786666666664,3
w13,2048,128,6,4096,2048,64,128,64,64,8,4,3900.267,3
w13,2048,128,6,4096,2048,64,256,32,8,8,3,3883.83,3
w13,2048,128,6,4096,2048,64,256,32,8,8,4,3871.5310000000004,3
w13,2048,128,6,4096,2048,64,256,32,8,8,5,3872.288,3
w13,2048,128,6,4096,2048,64,256,32,32,8,3,3873.258333333333,3
w13,2048,128,6,4096,2048,64,256,32,32,8,4,3883.9149999999995,3
w13,2048,128,6,4096,2048,64,256,32,32,8,5,3883.8296666666665,3
w13,2048,128,6,4096,2048,128,64,64,1,4,3,3883.36,3
w13,2048,128,6,4096,2048,128,64,64,1,8,3,3887.509,3
w13,2048,128,6,4096,2048,128,64,64,1,8,4,3881.6003333333333,3
w13,2048,128,6,4096,2048,128,64,64,16,8,3,3887.9573333333333,3
w13,2048,128,6,4096,2048,128,64,64,16,8,4,3880.1920000000005,3
w13,2048,128,6,4096,2048,128,128,64,1,4,3,3892.3953333333334,3
w13,2048,128,6,4096,2048,128,128,64,1,8,3,3876.8213333333333,3
w13,2048,128,6,4096,2048,128,128,64,4,4,3,3893.728333333333,3
w13,2048,128,6,4096,2048,128,128,64,4,8,3,3876.3626666666664,3
w13,2048,128,6,4096,2048,128,128,64,8,4,3,3881.525666666667,3
w13,2048,128,6,4096,2048,128,128,64,8,8,3,3877.322666666667,3
w13,2048,128,6,4096,2048,128,128,64,16,4,3,3880.629333333333,3
w13,2048,128,6,4096,2048,128,128,64,16,8,3,3879.5093333333334,3
w13,2048,128,6,4096,2048,128,128,64,32,4,3,3880.7576666666664,3
w13,2048,128,6,4096,2048,128,128,64,32,8,3,3889.1730000000002,3
w13,2048,128,6,4096,2048,128,128,64,64,4,3,3882.090666666667,3
w13,2048,128,6,4096,2048,128,128,64,64,8,3,3877.194333333333,3
w13,2048,128,8,2048,768,64,64,64,1,4,3,737.1460000000001,3
w13,2048,128,8,2048,768,64,64,64,1,4,4,736.8583333333332,3
w13,2048,128,8,2048,768,64,64,64,4,4,2,740.826,3
w13,2048,128,8,2048,768,64,64,64,4,4,4,734.81,3
w13,2048,128,8,2048,768,64,64,64,16,4,2,741.114,3
w13,2048,128,8,2048,768,64,64,64,16,4,4,737.093,3
w13,2048,128,8,2048,768,64,64,64,32,4,2,740.1863333333334,3
w13,2048,128,8,2048,768,64,64,64,32,4,3,739.973,3
w13,2048,128,8,2048,768,64,64,64,32,4,4,739.2579999999999,3
w13,2048,128,8,2048,768,64,64,64,64,4,2,740.7620000000001,3
w13,2048,128,8,2048,768,64,64,64,64,4,3,739.6850000000001,3
w13,2048,128,8,2048,768,64,64,64,64,4,4,738.266,3
w13,2048,128,8,2048,768,64,128,64,1,4,3,741.7539999999999,3
w13,2048,128,8,2048,768,64,128,64,1,4,4,739.6956666666666,3
w13,2048,128,8,2048,768,64,128,64,4,4,3,741.882,3
w13,2048,128,8,2048,768,64,128,64,16,4,3,741.9566666666666,3
w13,2048,128,8,2048,768,64,128,64,16,4,4,742.085,3
w13,2048,128,8,2048,768,64,128,64,64,4,3,741.8926666666666,3
w13,2048,128,8,4096,1536,64,64,64,1,4,3,2912.8160000000003,3
w13,2048,128,8,4096,1536,64,64,64,1,4,4,2915.1093333333333,3
w13,2048,128,8,4096,1536,64,64,64,4,4,2,2916.89,3
w13,2048,128,8,4096,1536,64,64,64,4,4,3,2907.0346666666665,3
w13,2048,128,8,4096,1536,64,64,64,4,4,4,2914.9806666666664,3
w13,2048,128,8,4096,1536,64,64,64,16,4,2,2918.3726666666666,3
w13,2048,128,8,4096,1536,64,64,64,16,4,3,2915.7810000000004,3
w13,2048,128,8,4096,1536,64,64,64,16,4,4,2903.098,3
w13,2048,128,8,4096,1536,64,64,64,32,4,2,2917.7973333333334,3
w13,2048,128,8,4096,1536,64,64,64,32,4,3,2920.4533333333334,3
w13,2048,128,8,4096,1536,64,64,64,32,4,4,2903.833666666667,3
w13,2048,128,8,4096,1536,64,64,64,64,4,2,2920.282333333333,3
w13,2048,128,8,4096,1536,64,64,64,64,4,3,2921.2956666666664,3
w13,2048,128,8,4096,1536,64,64,64,64,4,4,2903.9726666666666,3
w13,2048,128,8,4096,1536,64,128,32,8,8,3,2920.4206666666664,3
w13,2048,128,8,4096,1536,64,128,32,8,8,4,2901.796333333333,3
w13,2048,128,8,4096,1536,64,128,32,8,8,5,2920.4736666666668,3
w13,2048,128,8,4096,1536,64,128,64,1,4,3,2894.2019999999998,3
w13,2048,128,8,4096,1536,64,128,64,1,4,4,2899.023333333333,3
w13,2048,128,8,4096,1536,64,128,64,1,8,3,2915.9509999999996,3
w13,2048,128,8,4096,1536,64,128,64,4,4,2,2900.6659999999997,3
w13,2048,128,8,4096,1536,64,128,64,4,4,3,2897.6266666666666,3
w13,2048,128,8,4096,1536,64,128,64,4,4,4,2897.0826666666667,3
w13,2048,128,8,4096,1536,64,128,64,4,8,3,2914.586,3
w13,2048,128,8,4096,1536,64,128,64,16,4,2,2915.5146666666665,3
w13,2048,128,8,4096,1536,64,128,64,16,4,3,2896.058333333333,3
w13,2048,128,8,4096,1536,64,128,64,16,4,4,2905.5406666666663,3
w13,2048,128,8,4096,1536,64,128,64,16,8,3,2908.1006666666667,3
w13,2048,128,8,4096,1536,64,128,64,32,4,2,2899.6523333333334,3
w13,2048,128,8,4096,1536,64,128,64,32,4,3,2895.717,3
w13,2048,128,8,4096,1536,64,128,64,32,4,4,2905.967,3
w13,2048,128,8,4096,1536,64,128,64,32,8,3,2917.6366666666668,3
w13,2048,128,8,4096,1536,64,128,64,64,4,2,2898.9809999999998,3
w13,2048,128,8,4096,1536,64,128,64,64,4,3,2905.9353333333333,3
w13,2048,128,8,4096,1536,64,128,64,64,4,4,2897.2309999999998,3
w13,2048,128,8,4096,1536,64,128,64,64,8,3,2907.0123333333336,3
w13,2048,128,8,4096,1536,128,64,64,1,8,3,2921.0499999999997,3
w13,2048,128,8,4096,1536,128,64,64,16,8,3,2921.7856666666667,3
w13,2048,128,8,4096,3072,64,64,64,1,4,2,5823.841,3
w13,2048,128,8,4096,3072,64,64,64,1,4,3,5800.171333333333,3
w13,2048,128,8,4096,3072,64,64,64,1,4,4,5813.227666666667,3
w13,2048,128,8,4096,3072,64,64,64,4,4,2,5832.076,3
w13,2048,128,8,4096,3072,64,64,64,4,4,3,5799.638333333333,3
w13,2048,128,8,4096,3072,64,64,64,4,4,4,5796.491333333334,3
w13,2048,128,8,4096,3072,64,64,64,16,4,2,5813.409333333333,3
w13,2048,128,8,4096,3072,64,64,64,16,4,3,5807.542666666667,3
w13,2048,128,8,4096,3072,64,64,64,16,4,4,5809.078333333334,3
w13,2048,128,8,4096,3072,64,64,64,32,4,2,5831.456999999999,3
w13,2048,128,8,4096,3072,64,64,64,32,4,3,5806.454333333334,3
w13,2048,128,8,4096,3072,64,64,64,32,4,4,5793.793000000001,3
w13,2048,128,8,4096,3072,64,64,64,64,4,2,5813.632999999999,3
w13,2048,128,8,4096,3072,64,64,64,64,4,3,5811.734333333334,3
w13,2048,128,8,4096,3072,64,64,64,64,4,4,5806.017,3
w13,2048,128,8,4096,3072,64,128,32,8,4,4,5808.992666666666,3
w13,2048,128,8,4096,3072,64,128,32,8,4,5,5827.329000000001,3
w13,2048,128,8,4096,3072,64,128,32,8,8,3,5804.704999999999,3
w13,2048,128,8,4096,3072,64,128,32,8,8,4,5815.659,3
w13,2048,128,8,4096,3072,64,128,32,8,8,5,5800.609,3
w13,2048,128,8,4096,3072,64,128,64,1,4,2,5815.818666666666,3
w13,2048,128,8,4096,3072,64,128,64,1,4,3,5778.934,3
w13,2048,128,8,4096,3072,64,128,64,1,4,4,5780.469666666667,3
w13,2048,128,8,4096,3072,64,128,64,1,8,3,5817.654333333333,3
w13,2048,128,8,4096,3072,64,128,64,1,8,4,5813.75,3
w13,2048,128,8,4096,3072,64,128,64,4,4,2,5786.305,3
w13,2048,128,8,4096,3072,64,128,64,4,4,3,5796.043666666667,3
w13,2048,128,8,4096,3072,64,128,64,4,4,4,5794.720333333334,3
w13,2048,128,8,4096,3072,64,128,64,4,8,3,5800.545000000001,3
w13,2048,128,8,4096,3072,64,128,64,4,8,4,5832.641,3
w13,2048,128,8,4096,3072,64,128,64,16,4,2,5792.011333333333,3
w13,2048,128,8,4096,3072,64,128,64,16,4,3,5791.349666666666,3
w13,2048,128,8,4096,3072,64,128,64,16,4,4,5797.931333333334,3
w13,2048,128,8,4096,3072,64,128,64,16,8,3,5819.126333333334,3
w13,2048,128,8,4096,3072,64,128,64,16,8,4,5815.745,3
w13,2048,128,8,4096,3072,64,128,64,32,4,2,5784.992666666666,3
w13,2048,128,8,4096,3072,64,128,64,32,4,3,5782.187000000001,3
w13,2048,128,8,4096,3072,64,128,64,32,4,4,5775.787666666666,3
w13,2048,128,8,4096,3072,64,128,64,32,8,3,5800.129,3
w13,2048,128,8,4096,3072,64,128,64,64,4,2,5797.419000000001,3
w13,2048,128,8,4096,3072,64,128,64,64,4,3,5798.485666666667,3
w13,2048,128,8,4096,3072,64,128,64,64,4,4,5782.229666666666,3
w13,2048,128,8,4096,3072,64,128,64,64,8,3,5820.321,3
w13,2048,128,8,4096,3072,64,128,64,64,8,4,5816.555333333334,3
w13,2048,128,8,4096,3072,64,256,32,8,8,3,5786.848999999999,3
w13,2048,128,8,4096,3072,64,256,32,8,8,4,5805.642666666667,3
w13,2048,128,8,4096,3072,64,256,32,8,8,5,5785.088,3
w13,2048,128,8,4096,3072,64,256,32,32,8,3,5803.818666666667,3
w13,2048,128,8,4096,3072,64,256,32,32,8,4,5784.747,3
w13,2048,128,8,4096,3072,64,256,32,32,8,5,5805.205999999999,3
w13,2048,128,8,4096,3072,64,256,64,1,4,2,5809.888666666667,3
w13,2048,128,8,4096,3072,128,64,64,1,4,3,5796.213333333333,3
w13,2048,128,8,4096,3072,128,64,64,1,8,2,5825.877666666667,3
w13,2048,128,8,4096,3072,128,64,64,1,8,3,5805.941333333333,3
w13,2048,128,8,4096,3072,128,64,64,1,8,4,5798.602666666667,3
w13,2048,128,8,4096,3072,128,64,64,16,8,3,5808.192333333333,3
w13,2048,128,8,4096,3072,128,64,64,16,8,4,5802.5706666666665,3
w13,2048,128,8,4096,3072,128,128,64,1,4,3,5804.8853333333345,3
w13,2048,128,8,4096,3072,128,128,64,1,8,3,5782.954333333332,3
w13,2048,128,8,4096,3072,128,128,64,4,4,3,5799.477,3
w13,2048,128,8,4096,3072,128,128,64,4,8,3,5782.751666666667,3
w13,2048,128,8,4096,3072,128,128,64,8,4,3,5801.877,3
w13,2048,128,8,4096,3072,128,128,64,8,8,3,5799.381333333334,3
w13,2048,128,8,4096,3072,128,128,64,16,4,3,5798.8696666666665,3
w13,2048,128,8,4096,3072,128,128,64,16,8,3,5781.813333333334,3
w13,2048,128,8,4096,3072,128,128,64,32,4,3,5799.605333333333,3
w13,2048,128,8,4096,3072,128,128,64,32,8,3,5782.5380000000005,3
w13,2048,128,8,4096,3072,128,128,64,64,4,3,5795.722333333334,3
w13,2048,128,8,4096,3072,128,128,64,64,8,3,5782.581000000001,3
w13,3072,8,2,1024,512,64,64,64,1,4,2,96.781,3
w13,3072,8,2,1024,512,64,64,64,1,4,4,96.31166666666667,3
w13,3072,8,2,1024,512,64,64,64,4,4,3,96.67399999999999,3
w13,3072,8,2,1024,512,64,64,64,4,4,4,96.29,3
w13,3072,8,2,1024,512,64,64,64,16,4,4,96.48266666666666,3
w13,3072,8,2,1024,512,64,64,64,32,4,2,96.65333333333332,3
w13,3072,8,2,1024,512,64,64,64,32,4,3,96.32233333333333,3
w13,3072,8,2,1024,512,64,64,64,32,4,4,96.09833333333334,3
w13,3072,8,2,1024,512,64,64,64,64,4,2,96.71666666666665,3
w13,3072,8,2,1024,512,64,64,64,64,4,3,96.40733333333333,3
w13,3072,8,2,1024,512,64,64,64,64,4,4,95.938,3
w13,3072,8,2,1024,512,64,128,32,8,8,3,96.63166666666666,3
w13,3072,8,2,1024,512,64,128,32,8,8,4,96.69533333333334,3
w13,3072,8,2,1024,512,64,128,32,8,8,5,96.75966666666666,3
w13,3072,8,2,1024,512,64,128,64,1,4,3,96.33300000000001,3
w13,3072,8,2,1024,512,64,128,64,1,4,4,95.83166666666666,3
w13,3072,8,2,1024,512,64,128,64,4,4,2,96.16199999999999,3
w13,3072,8,2,1024,512,64,128,64,4,4,3,96.06633333333333,3
w13,3072,8,2,1024,512,64,128,64,4,4,4,95.89566666666667,3
w13,3072,8,2,1024,512,64,128,64,16,4,3,96.63166666666666,3
w13,3072,8,2,1024,512,64,128,64,16,4,4,96.493,3
w13,3072,8,2,1024,512,64,128,64,32,4,3,96.37533333333333,3
w13,3072,8,2,1024,512,64,128,64,32,4,4,96.67399999999999,3
w13,3072,8,2,1024,512,64,128,64,64,4,2,96.63166666666666,3
w13,3072,8,2,1024,512,64,128,64,64,4,3,96.39666666666666,3
w13,3072,8,2,1024,512,64,128,64,64,4,4,96.69600000000001,3
w13,3072,8,2,1024,512,128,64,64,1,8,3,96.08766666666668,3
w13,3072,8,2,1024,512,128,64,64,1,8,4,96.35433333333333,3
w13,3072,8,2,1024,512,128,64,64,16,8,3,96.109,3
w13,3072,8,2,1024,512,128,64,64,16,8,4,96.25833333333333,3
w13,3072,8,2,1024,512,128,128,64,1,8,3,96.301,3
w13,3072,8,2,1024,512,128,128,64,4,8,3,96.29,3
w13,3072,8,2,1024,512,128,128,64,8,8,3,96.38633333333333,3
w13,3072,8,2,1024,512,128,128,64,16,8,3,96.397,3
w13,3072,8,2,1024,512,128,128,64,32,8,3,96.34333333333335,3
w13,3072,8,2,1024,512,128,128,64,64,8,3,96.397,3
w13,3072,16,2,1536,768,64,64,64,1,4,2,213.05899999999997,3
w13,3072,16,2,1536,768,64,64,64,1,4,3,212.867,3
w13,3072,16,2,1536,768,64,64,64,1,4,4,212.37599999999998,3
w13,3072,16,2,1536,768,64,64,64,4,4,4,213.04833333333332,3
w13,3072,16,2,1536,768,64,64,64,16,4,3,213.36833333333334,3
w13,3072,16,2,1536,768,64,64,64,16,4,4,212.408,3
w13,3072,16,2,1536,768,64,64,64,32,4,3,213.1016666666667,3
w13,3072,16,2,1536,768,64,64,64,32,4,4,212.6,3
w13,3072,16,2,1536,768,64,64,64,64,4,4,213.389,3
w13,3072,16,2,1536,768,64,128,32,8,8,3,213.15466666666669,3
w13,3072,16,2,1536,768,64,128,32,8,8,4,212.86633333333336,3
w13,3072,16,2,1536,768,64,128,32,8,8,5,213.13366666666664,3
w13,3072,16,2,1536,768,64,128,64,1,4,3,211.65099999999998,3
w13,3072,16,2,1536,768,64,128,64,1,4,4,211.54433333333336,3
w13,3072,16,2,1536,768,64,128,64,4,4,2,212.78166666666667,3
w13,3072,16,2,1536,768,64,128,64,4,4,3,212.2266666666667,3
w13,3072,16,2,1536,768,64,128,64,4,4,4,211.82133333333334,3
w13,3072,16,2,1536,768,64,128,64,4,8,3,213.357,3
w13,3072,16,2,1536,768,64,128,64,16,4,2,211.992,3
w13,3072,16,2,1536,768,64,128,64,16,4,3,211.55466666666666,3
w13,3072,16,2,1536,768,64,128,64,16,4,4,211.36233333333334,3
w13,3072,16,2,1536,768,64,128,64,16,8,3,213.33633333333333,3
w13,3072,16,2,1536,768,64,128,64,32,4,3,212.17366666666666,3
w13,3072,16,2,1536,768,64,128,64,32,4,4,212.0773333333333,3
w13,3072,16,2,1536,768,64,128,64,64,4,3,212.6003333333333,3
w13,3072,16,2,1536,768,64,128,64,64,4,4,212.42966666666666,3
w13,3072,16,2,1536,768,64,128,64,64,8,3,213.336,3
w13,3072,16,2,1536,768,128,64,64,1,8,3,212.312,3
w13,3072,16,2,1536,768,128,64,64,16,8,3,212.04533333333333,3
w13,3072,16,2,1536,768,128,64,64,16,8,4,213.01633333333334,3
w13,3072,16,4,1536,1024,64,64,64,1,4,2,553.9986666666667,3
w13,3072,16,4,1536,1024,64,64,64,1,4,3,553.6896666666667,3
w13,3072,16,4,1536,1024,64,64,64,1,4,4,552.3346666666666,3
w13,3072,16,4,1536,1024,64,64,64,4,4,2,554.2546666666667,3
w13,3072,16,4,1536,1024,64,64,64,4,4,3,553.2093333333333,3
w13,3072,16,4,1536,1024,64,64,64,4,4,4,552.3453333333333,3
w13,3072,16,4,1536,1024,64,64,64,16,4,2,556.2493333333333,3
w13,3072,16,4,1536,1024,64,64,64,16,4,3,555.4276666666666,3
w13,3072,16,4,1536,1024,64,64,64,16,4,4,553.9883333333333,3
w13,3072,16,4,1536,1024,64,64,64,32,4,2,554.4683333333334,3
w13,3072,16,4,1536,1024,64,64,64,32,4,3,553.8283333333334,3
w13,3072,16,4,1536,1024,64,64,64,32,4,4,552.2280000000001,3
w13,3072,16,4,1536,1024,64,64,64,64,4,2,556.4526666666667,3
w13,3072,16,4,1536,1024,64,64,64,64,4,3,555.8336666666668,3
w13,3072,16,4,1536,1024,64,64,64,64,4,4,553.914,3
w13,3072,16,4,1536,1024,64,128,64,1,4,2,557.4656666666666,3
w13,3072,16,4,1536,1024,64,128,64,1,4,3,555.9513333333333,3
w13,3072,16,4,1536,1024,64,128,64,1,4,4,555.5243333333334,3
w13,3072,16,4,1536,1024,64,128,64,4,4,2,557.7746666666667,3
w13,3072,16,4,1536,1024,64,128,64,4,4,4,556.794,3
w13,3072,16,4,1536,1024,64,128,64,16,4,3,557.2843333333334,3
w13,3072,16,4,1536,1024,64,128,64,16,4,4,556.207,3
w13,3072,16,4,1536,1024,64,128,64,32,4,3,557.7429999999999,3
w13,3072,16,4,1536,1024,64,128,64,32,4,4,555.9296666666667,3
w13,3072,16,4,1536,1024,64,128,64,64,4,4,557.2626666666666,3
w13,3072,16,4,1536,1024,128,64,64,16,8,3,557.775,3
w13,3072,16,4,1536,1024,128,128,64,1,8,3,557.4653333333334,3
w13,3072,16,4,1536,1024,128,128,64,4,8,3,557.252,3
w13,3072,16,4,1536,1024,128,128,64,8,8,3,557.1666666666666,3
w13,3072,16,4,1536,1024,128,128,64,16,8,3,557.359,3
w13,3072,16,4,1536,1024,128,128,64,32,8,3,557.4226666666667,3
w13,3072,16,4,1536,1024,128,128,64,64,8,3,557.423,3
w13,3072,32,4,2048,768,64,64,64,1,4,2,560.2496666666666,3
w13,3072,32,4,2048,768,64,64,64,1,4,3,559.2043333333332,3
w13,3072,32,4,2048,768,64,64,64,4,4,2,560.1213333333334,3
w13,3072,32,4,2048,768,64,64,64,4,4,3,558.8416666666667,3
w13,3072,32,4,2048,768,64,64,64,4,4,4,557.9136666666667,3
w13,3072,32,4,2048,768,64,64,64,16,4,2,561.348,3
w13,3072,32,4,2048,768,64,64,64,16,4,3,558.991,3
w13,3072,32,4,2048,768,64,64,64,16,4,4,557.7959999999999,3
w13,3072,32,4,2048,768,64,64,64,32,4,2,561.3486666666666,3
w13,3072,32,4,2048,768,64,64,64,32,4,3,560.687,3
w13,3072,32,4,2048,768,64,64,64,32,4,4,559.0546666666668,3
w13,3072,32,4,2048,768,64,64,64,64,4,3,560.132,3
w13,3072,32,4,2048,768,64,64,64,64,4,4,559.3000000000001,3
w13,3072,32,4,2048,768,64,128,32,8,4,4,558.756,3
w13,3072,32,4,2048,768,64,128,32,8,8,3,559.6093333333333,3
w13,3072,32,4,2048,768,64,128,32,8,8,4,560.4733333333334,3
w13,3072,32,4,2048,768,64,128,32,8,8,5,561.3696666666666,3
w13,3072,32,4,2048,768,64,128,64,1,4,2,559.5346666666666,3
w13,3072,32,4,2048,768,64,128,64,1,4,3,559.343,3
w13,3072,32,4,2048,768,64,128,64,1,4,4,557.1453333333334,3
w13,3072,32,4,2048,768,64,128,64,1,8,3,561.0173333333333,3
w13,3072,32,4,2048,768,64,128,64,4,4,2,559.4066666666666,3
w13,3072,32,4,2048,768,64,128,64,4,4,3,558.1163333333334,3
w13,3072,32,4,2048,768,64,128,64,4,4,4,557.6576666666666,3
w13,3072,32,4,2048,768,64,128,64,4,8,3,560.612,3
w13,3072,32,4,2048,768,64,128,64,16,4,2,558.1803333333334,3
w13,3072,32,4,2048,768,64,128,64,16,4,3,556.9430000000001,3
w13,3072,32,4,2048,768,64,128,64,16,4,4,556.4846666666667,3
w13,3072,32,4,2048,768,64,128,64,16,8,3,559.898,3
w13,3072,32,4,2048,768,64,128,64,32,4,2,559.5883333333333,3
w13,3072,32,4,2048,768,64,128,64,32,4,3,558.7776666666667,3
w13,3072,32,4,2048,768,64,128,64,32,4,4,555.9616666666667,3
w13,3072,32,4,2048,768,64,128,64,32,8,3,560.0790000000001,3
w13,3072,32,4,2048,768,64,128,64,64,4,2,557.9883333333333,3
w13,3072,32,4,2048,768,64,128,64,64,4,3,556.6653333333334,3
w13,3072,32,4,2048,768,64,128,64,64,4,4,557.0600000000001,3
w13,3072,32,4,2048,768,64,128,64,64,8,3,560.132,3
w13,3072,32,4,2048,768,64,256,32,8,8,3,559.7906666666667,3
w13,3072,32,4,2048,768,64,256,32,8,8,4,559.9613333333333,3
w13,3072,32,4,2048,768,64,256,32,8,8,5,559.5880000000001,3
w13,3072,32,4,2048,768,64,256,32,32,8,3,558.8306666666666,3
w13,3072,32,4,2048,768,64,256,32,32,8,4,558.5536666666667,3
w13,3072,32,4,2048,768,64,256,32,32,8,5,558.2336666666666,3
w13,3072,32,4,2048,768,128,64,64,1,4,3,560.7719999999999,2
w13,3072,32,4,2048,768,128,64,64,1,8,3,559.4816666666667,3
w13,3072,32,4,2048,768,128,64,64,16,8,3,557.775,3
w13,3072,32,4,2048,768,128,64,64,16,8,4,559.695,3
w13,3072,32,4,2048,768,128,128,64,1,8,3,557.6043333333333,3
w13,3072,32,4,2048,768,128,128,64,4,8,3,557.3373333333333,3
w13,3072,32,4,2048,768,128,128,64,8,4,3,561.3373333333334,3
w13,3072,32,4,2048,768,128,128,64,8,8,3,557.2199999999999,3
w13,3072,32,4,2048,768,128,128,64,16,4,3,560.623,3
w13,3072,32,4,2048,768,128,128,64,16,8,3,557.2843333333334,3
w13,3072,32,4,2048,768,128,128,64,32,4,3,560.1216666666667,3
w13,3072,32,4,2048,768,128,128,64,32,8,3,557.5723333333334,3
w13,3072,32,4,2048,768,128,128,64,64,4,3,560.1216666666668,3
w13,3072,32,4,2048,768,128,128,64,64,8,3,557.3159999999999,3
w13,3072,32,6,3072,1024,64,64,64,1,4,2,1658.1853333333336,3
w13,3072,32,6,3072,1024,64,64,64,1,4,3,1658.3663333333334,3
w13,3072,32,6,3072,1024,64,64,64,1,4,4,1656.521,3
w13,3072,32,6,3072,1024,64,64,64,4,4,2,1656.051666666667,3
w13,3072,32,6,3072,1024,64,64,64,4,4,3,1660.8626666666667,3
w13,3072,32,6,3072,1024,64,64,64,4,4,4,1655.5076666666666,3
w13,3072,32,6,3072,1024,64,64,64,16,4,2,1661.4276666666665,3
w13,3072,32,6,3072,1024,64,64,64,16,4,3,1658.9103333333333,3
w13,3072,32,6,3072,1024,64,64,64,16,4,4,1655.689,3
w13,3072,32,6,3072,1024,64,64,64,32,4,2,1662.2703333333332,3
w13,3072,32,6,3072,1024,64,64,64,32,4,3,1658.932,3
w13,3072,32,6,3072,1024,64,64,64,32,4,4,1652.8406666666667,3
w13,3072,32,6,3072,1024,64,64,64,64,4,2,1661.353,3
w13,3072,32,6,3072,1024,64,64,64,64,4,3,1656.4890000000003,3
w13,3072,32,6,3072,1024,64,64,64,64,4,4,1653.0433333333333,3
w13,3072,32,6,3072,1024,64,128,32,8,4,3,1663.0923333333333,3
w13,3072,32,6,3072,1024,64,128,32,8,4,4,1662.1850000000002,3
w13,3072,32,6,3072,1024,64,128,32,8,4,5,1663.7743333333335,3
w13,3072,32,6,3072,1024,64,128,32,8,8,2,1668.5316666666668,3
w13,3072,32,6,3072,1024,64,128,32,8,8,3,1664.7556666666667,3
w13,3072,32,6,3072,1024,64,128,32,8,8,4,1665.8963333333334,3
w13,3072,32,6,3072,1024,64,128,32,8,8,5,1667.0276666666666,3
w13,3072,32,6,3072,1024,64,128,64,1,4,2,1663.6463333333334,3
w13,3072,32,6,3072,1024,64,128,64,1,4,3,1664.0516666666665,3
w13,3072,32,6,3072,1024,64,128,64,1,4,4,1659.3163333333334,3
w13,3072,32,6,3072,1024,64,128,64,1,8,3,1667.999,3
w13,3072,32,6,3072,1024,64,128,64,4,4,2,1662.249,3
w13,3072,32,6,3072,1024,64,128,64,4,4,3,1659.273,3
w13,3072,32,6,3072,1024,64,128,64,4,4,4,1657.3103333333336,3
w13,3072,32,6,3072,1024,64,128,64,16,4,2,1664.6490000000001,3
w13,3072,32,6,3072,1024,64,128,64,16,4,3,1661.0010000000002,3
w13,3072,32,6,3072,1024,64,128,64,16,4,4,1657.4486666666664,3
w13,3072,32,6,3072,1024,64,128,64,16,8,3,1667.8386666666665,3
w13,3072,32,6,3072,1024,64,128,64,32,4,2,1661.321,3
w13,3072,32,6,3072,1024,64,128,64,32,4,3,1660.8196666666665,3
w13,3072,32,6,3072,1024,64,128,64,32,4,4,1657.9613333333334,3
w13,3072,32,6,3072,1024,64,128,64,64,4,2,1661.769,3
w13,3072,32,6,3072,1024,64,128,64,64,4,3,1662.2386666666669,3
w13,3072,32,6,3072,1024,64,128,64,64,4,4,1656.2973333333332,3
w13,3072,32,6,3072,1024,64,128,64,64,8,3,1668.745,3
w13,3072,32,6,3072,1024,64,256,32,8,8,3,1664.3616666666667,3
w13,3072,32,6,3072,1024,64,256,32,8,8,4,1662.3346666666666,3
w13,3072,32,6,3072,1024,64,256,32,8,8,5,1662.3453333333334,3
w13,3072,32,6,3072,1024,64,256,32,32,8,3,1668.116,3
w13,3072,32,6,3072,1024,64,256,32,32,8,4,1666.6760000000002,3
w13,3072,32,6,3072,1024,64,256,32,32,8,5,1666.782,3
w13,3072,32,6,3072,1024,64,256,64,1,4,2,1663.5503333333334,3
w13,3072,32,6,3072,1024,64,256,64,4,4,2,1663.2513333333334,3
w13,3072,32,6,3072,1024,64,256,64,8,4,2,1664.6490000000001,3
w13,3072,32,6,3072,1024,64,256,64,16,4,2,1666.505,3
w13,3072,32,6,3072,1024,64,256,64,64,4,2,1664.3933333333334,3
w13,3072,60,4,2048,1408,64,64,64,1,4,2,1265.6393333333333,3
w13,3072,60,4,2048,1408,64,64,64,1,4,3,1263.8906666666667,3
w13,3072,60,4,2048,1408,64,64,64,1,4,4,1265.9063333333334,3
w13,3072,60,4,2048,1408,64,64,64,4,4,3,1265.9696666666666,3
w13,3072,60,4,2048,1408,64,64,64,4,4,4,1262.7486666666666,3
w13,3072,60,4,2048,1408,64,64,64,16,4,3,1262.4713333333332,3
w13,3072,60,4,2048,1408,64,64,64,16,4,4,1259.538,3
w13,3072,60,4,2048,1408,64,64,64,32,4,2,1265.607,3
w13,3072,60,4,2048,1408,64,64,64,32,4,3,1265.959,3
w13,3072,60,4,2048,1408,64,64,64,32,4,4,1262.2256666666665,3
w13,3072,60,4,2048,1408,64,64,64,64,4,3,1263.0896666666667,3
w13,3072,60,4,2048,1408,64,64,64,64,4,4,1259.9323333333334,3
w13,3072,60,4,2048,1408,64,128,32,8,4,3,1259.8793333333333,3
w13,3072,60,4,2048,1408,64,128,32,8,4,4,1257.8736666666666,3
w13,3072,60,4,2048,1408,64,128,32,8,8,3,1264.765,3
w13,3072,60,4,2048,1408,64,128,32,8,8,4,1261.4476666666667,3
w13,3072,60,4,2048,1408,64,128,32,8,8,5,1263.2076666666667,3
w13,3072,60,4,2048,1408,64,128,64,1,4,2,1257.8636666666666,3
w13,3072,60,4,2048,1408,64,128,64,1,4,3,1258.951,3
w13,3072,60,4,2048,1408,64,128,64,1,4,4,1257.1803333333335,3
w13,3072,60,4,2048,1408,64,128,64,1,8,3,1264.6363333333331,3
w13,3072,60,4,2048,1408,64,128,64,4,4,2,1257.7253333333333,3
w13,3072,60,4,2048,1408,64,128,64,4,4,3,1256.8396666666667,3
w13,3072,60,4,2048,1408,64,128,64,4,4,4,1257.2773333333334,3
w13,3072,60,4,2048,1408,64,128,64,4,8,3,1264.4983333333332,3
w13,3072,60,4,2048,1408,64,128,64,16,4,2,1258.3436666666666,3
w13,3072,60,4,2048,1408,64,128,64,16,4,3,1259.3566666666666,3
w13,3072,60,4,2048,1408,64,128,64,16,4,4,1261.821,3
w13,3072,60,4,2048,1408,64,128,64,16,8,3,1264.3803333333333,3
w13,3072,60,4,2048,1408,64,128,64,32,4,2,1262.3010000000002,3
w13,3072,60,4,2048,1408,64,128,64,32,4,3,1262.3113333333333,3
w13,3072,60,4,2048,1408,64,128,64,32,4,4,1255.8366666666666,3
w13,3072,60,4,2048,1408,64,128,64,32,8,3,1264.0926666666667,3
w13,3072,60,4,2048,1408,64,128,64,64,4,2,1257.9913333333334,3
w13,3072,60,4,2048,1408,64,128,64,64,4,3,1256.242,3
w13,3072,60,4,2048,1408,64,128,64,64,4,4,1260.4123333333334,3
w13,3072,60,4,2048,1408,64,128,64,64,8,3,1264.1783333333333,3
w13,3072,60,4,2048,1408,64,256,32,8,8,3,1261.9706666666668,3
w13,3072,60,4,2048,1408,64,256,32,8,8,4,1262.2896666666666,3
w13,3072,60,4,2048,1408,64,256,32,8,8,5,1261.7456666666667,3
w13,3072,60,4,2048,1408,64,256,32,32,8,3,1258.642,3
w13,3072,60,4,2048,1408,64,256,32,32,8,4,1262.6209999999999,3
w13,3072,60,4,2048,1408,64,256,32,32,8,5,1261.9696666666666,3
w13,3072,60,4,2048,1408,128,64,64,1,4,3,1263.8629999999998,2
w13,3072,60,4,2048,1408,128,64,64,1,8,3,1259.6663333333333,3
w13,3072,60,4,2048,1408,128,64,64,1,8,4,1264.093,3
w13,3072,60,4,2048,1408,128,64,64,16,8,2,1267.442,3
w13,3072,60,4,2048,1408,128,64,64,16,8,3,1260.1996666666666,3
w13,3072,60,4,2048,1408,128,64,64,16,8,4,1263.25,3
w13,3072,60,4,2048,1408,128,128,64,1,4,3,1262.0443333333333,3
w13,3072,60,4,2048,1408,128,128,64,1,8,3,1257.5216666666665,3
w13,3072,60,4,2048,1408,128,128,64,4,4,3,1261.2016666666668,3
w13,3072,60,4,2048,1408,128,128,64,4,8,3,1257.33,3
w13,3072,60,4,2048,1408,128,128,64,8,4,3,1261.831,3
w13,3072,60,4,2048,1408,128,128,64,8,8,3,1256.9673333333333,3
w13,3072,60,4,2048,1408,128,128,64,16,4,3,1260.8606666666667,3
w13,3072,60,4,2048,1408,128,128,64,16,8,3,1257.0423333333333,3
w13,3072,60,4,2048,1408,128,128,64,32,4,3,1261.362,3
w13,3072,60,4,2048,1408,128,128,64,32,8,3,1257.191,3
w13,3072,60,4,2048,1408,128,128,64,64,4,3,1262.0233333333333,3
w13,3072,60,4,2048,1408,128,128,64,64,8,3,1257.0739999999998,3
w13,3072,60,6,3584,2304,64,64,64,1,4,2,4470.159333333333,3
w13,3072,60,6,3584,2304,64,64,64,1,4,3,4465.21,3
w13,3072,60,6,3584,2304,64,64,64,1,4,4,4457.700666666667,3
w13,3072,60,6,3584,2304,64,64,64,4,4,3,4462.724666666666,3
w13,3072,60,6,3584,2304,64,64,64,4,4,4,4458.020666666666,3
w13,3072,60,6,3584,2304,64,64,64,16,4,3,4463.545666666666,3
w13,3072,60,6,3584,2304,64,64,64,16,4,4,4458.425666666667,3
w13,3072,60,6,3584,2304,64,64,64,32,4,2,4473.253000000001,3
w13,3072,60,6,3584,2304,64,64,64,32,4,3,4464.143333333333,3
w13,3072,60,6,3584,2304,64,64,64,32,4,4,4470.916333333334,3
w13,3072,60,6,3584,2304,64,64,64,64,4,2,4474.053,3
w13,3072,60,6,3584,2304,64,64,64,64,4,3,4468.751333333334,3
w13,3072,60,6,3584,2304,64,64,64,64,4,4,4471.13,3
w13,3072,60,6,3584,2304,64,128,32,8,4,3,4472.314,3
w13,3072,60,6,3584,2304,64,128,32,8,4,4,4471.151,3
w13,3072,60,6,3584,2304,64,128,32,8,4,5,4469.796666666666,3
w13,3072,60,6,3584,2304,64,128,32,8,8,3,4476.452333333334,3
