pipetuning_test/moe_dse/moe_dse_PRO6000S_99.csv
weight_type,M,E,topk,H,N,BLOCK_SIZE_M,BLOCK_SIZE_N,BLOCK_SIZE_K,GROUP_SIZE_M,num_warps,num_stages,avg_duration,sample_count
w13,1,8,2,1024,512,16,16,64,1,4,4,3.714,3
w13,1,16,2,1536,768,16,32,128,1,4,3,4.748,3
w13,1,16,2,1536,768,16,32,128,1,4,4,4.748666666666667,3
w13,1,16,2,1536,768,16,32,128,4,4,3,4.780666666666666,3
w13,1,16,2,1536,768,16,32,128,4,4,4,4.738,3
w13,1,16,2,1536,768,16,32,128,16,4,4,4.738,3
w13,1,16,2,1536,768,16,32,128,32,4,3,4.77,3
w13,1,16,2,1536,768,16,32,128,32,4,4,4.759333333333333,3
w13,1,16,2,1536,768,16,32,128,64,4,3,4.77,3
w13,1,16,2,1536,768,16,32,128,64,4,4,4.748666666666667,3
w13,1,16,4,1536,1024,16,64,64,1,4,4,6.903333333333333,3
w13,1,16,4,1536,1024,16,64,64,1,8,4,6.935,3
w13,1,16,4,1536,1024,16,64,128,1,8,4,6.956333333333333,3
w13,1,32,4,2048,768,16,64,64,1,4,4,7.031333333333333,3
w13,1,32,6,3072,1024,16,128,64,1,8,4,14.999333333333333,3
w13,1,60,4,2048,1408,16,64,128,1,8,4,10.348666666666666,3
w13,1,60,4,2048,1408,16,64,128,16,8,4,10.444666666666665,3
w13,1,60,4,2048,1408,16,64,128,64,8,4,10.434,3
w13,1,60,6,3584,2304,16,32,64,1,4,2,118.70100000000001,3
w13,1,60,6,3584,2304,16,32,128,4,4,2,118.99933333333333,3
w13,1,60,6,3584,2304,16,32,128,16,4,2,118.91433333333333,3
w13,1,60,6,3584,2304,16,32,128,32,4,2,119.106,3
w13,1,60,6,3584,2304,16,32,128,64,4,2,118.829,3
w13,1,60,6,3584,2304,16,64,128,1,8,2,118.24233333333332,3
w13,1,60,6,3584,2304,16,64,128,16,4,2,118.125,3
w13,1,60,6,3584,2304,16,64,128,16,8,2,118.85033333333332,3
w13,1,60,6,3584,2304,16,64,128,32,4,2,118.79700000000001,3
w13,1,60,6,3584,2304,16,64,128,32,8,2,118.13566666666667,3
w13,1,60,6,3584,2304,16,64,128,64,4,2,118.42333333333333,3
w13,1,60,6,3584,2304,16,64,128,64,8,2,118.37033333333333,3
w13,1,60,6,3584,2304,32,32,256,1,4,2,118.60466666666667,3
w13,1,60,6,3584,2304,32,64,128,1,8,2,119.20233333333334,3
w13,1,60,6,3584,2304,32,64,128,4,4,2,119.09566666666666,3
w13,1,60,6,3584,2304,32,64,128,32,4,2,118.86066666666666,3
w13,1,60,6,3584,2304,32,64,128,64,8,2,119.13799999999999,3
w13,1,60,8,2048,1536,16,256,32,8,4,4,17.569666666666667,3
w13,1,64,6,3072,2048,16,32,128,4,4,2,60.812666666666665,3
w13,1,64,6,3072,2048,16,32,128,32,4,2,60.812666666666665,3
w13,1,64,6,3072,2048,16,32,128,64,4,2,60.674,3
w13,1,64,6,3072,2048,16,64,128,1,8,2,61.11166666666667,3
w13,1,64,6,3072,2048,16,64,128,16,4,2,61.20733333333333,3
w13,1,64,6,3072,2048,16,64,128,16,8,2,60.961999999999996,3
w13,1,64,6,3072,2048,16,64,128,32,4,2,60.61033333333333,3
w13,1,64,6,3072,2048,16,64,128,64,4,2,61.12199999999999,3
w13,1,64,6,3584,1536,16,64,128,64,8,3,25.01533333333333,3
w13,1,64,6,3584,1536,16,128,128,1,8,3,24.802000000000003,3
w13,1,64,8,3584,2560,16,32,64,1,4,2,185.79433333333336,3
w13,1,64,8,3584,2560,16,32,256,16,4,2,185.965,3
w13,1,64,8,3584,2560,16,64,256,16,4,2,186.89333333333335,3
w13,1,64,8,3584,2560,32,32,64,1,4,2,186.88233333333332,3
w13,1,64,8,3584,2560,32,64,256,8,4,2,187.38400000000001,3
w13,1,64,8,3584,2560,64,32,128,16,4,2,187.288,3
w13,1,64,8,3584,2560,64,64,64,1,4,2,187.24466666666663,3
w13,1,128,4,2048,512,16,32,128,1,4,4,5.633666666666667,3
w13,1,128,4,2048,512,16,32,128,4,4,4,5.655333333333334,3
w13,1,128,4,2048,512,16,32,128,16,4,4,5.655333333333334,3
w13,1,128,4,2048,512,16,32,128,32,4,4,5.634,3
w13,1,128,4,2048,512,16,32,128,64,4,4,5.623333333333334,3
w13,1,128,6,4096,2048,16,64,128,1,8,2,117.07933333333334,3
w13,1,128,6,4096,2048,16,64,128,16,4,2,115.99166666666666,3
w13,1,128,6,4096,2048,16,64,128,16,8,2,116.781,3
w13,1,128,6,4096,2048,16,64,128,32,4,2,116.37566666666667,3
w13,1,128,6,4096,2048,16,64,128,32,8,2,117.04733333333333,3
w13,1,128,6,4096,2048,16,64,128,64,4,2,116.79166666666667,3
w13,1,128,6,4096,2048,32,64,128,32,4,2,117.13266666666668,3
w13,1,128,8,2048,768,16,128,64,1,8,4,10.189,3
w13,1,128,8,4096,1536,16,64,128,1,8,2,117.41000000000001,3
w13,1,128,8,4096,1536,16,64,128,16,4,2,116.63133333333333,3
w13,1,128,8,4096,1536,32,64,128,1,8,2,117.677,3
w13,1,128,8,4096,1536,32,64,128,4,4,2,117.60199999999999,3
w13,1,128,8,4096,1536,32,64,128,16,4,2,117.07966666666668,3
w13,1,128,8,4096,3072,16,32,64,1,4,2,261.6023333333333,3
w13,1,128,8,4096,3072,16,64,64,1,8,2,262.02933333333334,3
w13,1,128,8,4096,3072,32,32,64,1,4,2,262.018,3
w13,1,128,8,4096,3072,32,32,256,1,4,2,260.2476666666667,3
w13,2,8,2,1024,512,16,32,128,4,4,4,3.8633333333333333,3
w13,2,8,2,1024,512,16,32,128,16,4,4,3.8843333333333336,3
w13,2,8,2,1024,512,16,32,128,32,4,4,3.8953333333333333,3
w13,2,16,2,1536,768,16,64,64,1,4,4,5.729666666666667,3
w13,2,16,4,1536,1024,16,64,64,1,4,4,10.796333333333331,3
w13,2,16,4,1536,1024,16,128,64,1,8,4,10.839666666666666,3
w13,2,32,4,2048,768,16,128,64,1,8,4,10.53,3
w13,2,32,6,3072,1024,16,32,128,32,4,2,60.84466666666666,3
w13,2,32,6,3072,1024,16,32,128,64,4,2,60.941,3
w13,2,60,4,2048,1408,16,64,64,32,8,4,17.399666666666665,3
w13,2,60,4,2048,1408,16,128,64,1,8,4,17.399333333333335,3
w13,2,60,4,2048,1408,16,128,64,16,8,4,17.335333333333335,3
w13,2,60,4,2048,1408,16,128,64,32,8,4,17.292666666666666,3
w13,2,60,4,2048,1408,16,128,64,64,8,4,17.356666666666666,3
w13,2,60,6,3584,2304,16,32,256,1,4,2,256.0563333333333,3
w13,2,60,6,3584,2304,16,32,256,16,4,2,255.56533333333334,3
w13,2,60,6,3584,2304,16,64,256,1,4,2,256.99466666666666,3
w13,2,60,6,3584,2304,16,64,256,16,4,2,257.9013333333333,3
w13,2,60,6,3584,2304,32,32,128,1,4,2,257.10133333333334,3
w13,2,60,6,3584,2304,32,64,256,1,4,2,257.82633333333337,3
w13,2,60,6,3584,2304,64,32,256,1,4,2,258.11466666666666,3
w13,2,60,8,2048,1536,16,32,64,1,4,2,118.89266666666667,3
w13,2,60,8,2048,1536,32,32,64,1,4,2,118.18799999999999,3
w13,2,64,6,3072,2048,32,32,256,1,4,2,193.31433333333334,3
w13,2,64,6,3072,2048,32,32,256,16,4,2,194.08233333333337,3
w13,2,64,6,3584,1536,16,32,64,1,4,2,163.309,3
w13,2,64,6,3584,1536,32,32,64,1,4,2,163.67133333333334,3
w13,2,64,8,3584,2560,16,16,128,1,4,2,385.1546666666666,3
w13,2,64,8,3584,2560,16,16,128,1,4,3,384.728,3
w13,2,64,8,3584,2560,16,16,128,1,4,4,384.66433333333333,3
w13,2,64,8,3584,2560,16,16,128,4,4,2,385.315,3
w13,2,64,8,3584,2560,16,16,128,4,4,3,385.14433333333335,3
w13,2,64,8,3584,2560,16,16,128,4,4,4,385.21866666666665,3
w13,2,64,8,3584,2560,16,16,256,1,4,2,384.6426666666666,3
w13,2,64,8,3584,2560,16,16,256,1,4,4,385.34666666666664,3
w13,2,64,8,3584,2560,16,16,256,4,4,2,384.9626666666666,3
w13,2,64,8,3584,2560,16,16,256,4,4,4,385.3043333333333,3
w13,2,64,8,3584,2560,16,32,128,1,4,2,384.8776666666667,3
w13,2,64,8,3584,2560,16,32,128,1,4,3,384.76,3
w13,2,64,8,3584,2560,16,32,128,1,4,4,384.83466666666664,3
w13,2,64,8,3584,2560,16,32,128,1,8,2,385.04833333333335,3
w13,2,64,8,3584,2560,16,32,128,1,8,3,385.2616666666666,3
w13,2,64,8,3584,2560,16,32,128,1,8,4,385.03766666666667,3
w13,2,64,8,3584,2560,16,32,128,4,4,4,384.83500000000004,3
w13,2,64,8,3584,2560,16,32,128,4,8,2,385.30400000000003,3
w13,2,64,8,3584,2560,16,32,128,4,8,4,385.3043333333333,3
w13,2,64,8,3584,2560,16,32,128,16,4,3,385.0696666666667,3
w13,2,64,8,3584,2560,16,32,128,16,4,4,384.7283333333333,3
w13,2,64,8,3584,2560,16,32,128,16,8,4,385.27233333333334,3
w13,2,64,8,3584,2560,16,32,128,32,4,3,384.85633333333334,3
w13,2,64,8,3584,2560,16,32,128,32,8,4,385.17633333333333,3
w13,2,64,8,3584,2560,16,32,128,64,4,3,385.18666666666667,3
w13,2,64,8,3584,2560,16,32,128,64,4,4,385.2083333333333,3
w13,2,64,8,3584,2560,16,32,128,64,8,4,385.14433333333335,3
w13,2,64,8,3584,2560,16,32,256,1,4,2,382.9576666666667,3
w13,2,64,8,3584,2560,16,32,256,1,4,3,385.17633333333333,3
w13,2,64,8,3584,2560,16,32,256,1,8,4,385.3576666666666,3
w13,2,64,8,3584,2560,16,32,256,16,4,2,381.5176666666666,3
w13,2,64,8,3584,2560,16,32,256,16,8,3,385.36833333333334,3
w13,2,64,8,3584,2560,16,32,256,64,4,2,385.29366666666664,3
w13,2,64,8,3584,2560,16,32,256,64,4,3,385.36833333333334,3
w13,2,64,8,3584,2560,16,32,256,64,8,2,385.272,3
w13,2,64,8,3584,2560,16,64,128,1,4,2,384.31199999999995,3
w13,2,64,8,3584,2560,16,64,128,1,4,3,385.33633333333336,3
w13,2,64,8,3584,2560,16,64,128,1,4,4,385.04866666666663,3
w13,2,64,8,3584,2560,16,64,128,1,8,3,385.04833333333335,3
w13,2,64,8,3584,2560,16,64,128,1,8,4,384.547,3
w13,2,64,8,3584,2560,16,64,128,16,4,2,384.52566666666667,3
w13,2,64,8,3584,2560,16,64,128,16,8,4,385.347,3
w13,2,64,8,3584,2560,16,64,128,32,4,3,385.18700000000007,3
w13,2,64,8,3584,2560,16,64,128,32,8,4,385.166,3
w13,2,64,8,3584,2560,16,64,128,64,4,3,385.112,3
w13,2,64,8,3584,2560,16,64,128,64,4,4,385.27233333333334,3
w13,2,64,8,3584,2560,16,64,128,64,8,4,385.14433333333335,3
w13,2,64,8,3584,2560,16,64,256,1,4,2,382.9793333333334,3
w13,2,64,8,3584,2560,16,64,256,1,8,3,385.36833333333334,3
w13,2,64,8,3584,2560,16,64,256,16,4,2,382.49933333333337,3
w13,2,64,8,3584,2560,16,128,128,1,4,2,383.9073333333333,3
w13,2,64,8,3584,2560,16,128,128,1,8,3,385.33633333333336,3
w13,2,64,8,3584,2560,16,128,128,16,4,2,384.3123333333333,3
w13,2,64,8,3584,2560,32,16,128,4,4,3,384.9736666666667,3
w13,2,64,8,3584,2560,32,32,128,1,4,2,382.47766666666666,3
w13,2,64,8,3584,2560,32,32,128,1,4,3,384.85633333333334,3
w13,2,64,8,3584,2560,32,32,128,1,8,2,385.059,3
w13,2,64,8,3584,2560,32,32,128,1,8,3,385.25066666666663,3
w13,2,64,8,3584,2560,32,32,128,4,4,3,385.17633333333333,3
w13,2,64,8,3584,2560,32,32,128,16,4,3,385.1656666666667,3
w13,2,64,8,3584,2560,32,32,128,16,8,3,385.36833333333334,3
w13,2,64,8,3584,2560,32,32,128,64,4,3,385.123,3
w13,2,64,8,3584,2560,32,32,128,64,8,3,385.368,3
w13,2,64,8,3584,2560,32,32,256,1,4,2,382.16833333333335,3
w13,2,64,8,3584,2560,32,32,256,1,8,3,385.0056666666667,3
w13,2,64,8,3584,2560,32,32,256,32,4,2,385.13366666666667,3
w13,2,64,8,3584,2560,32,32,256,32,8,2,385.368,3
w13,2,64,8,3584,2560,32,64,128,1,4,2,384.4723333333333,3
w13,2,64,8,3584,2560,32,64,128,1,4,4,384.9736666666667,3
w13,2,64,8,3584,2560,32,64,128,1,8,4,385.219,3
w13,2,64,8,3584,2560,32,64,128,4,4,4,385.3576666666666,3
w13,2,64,8,3584,2560,32,64,128,4,8,4,385.347,3
w13,2,64,8,3584,2560,32,64,128,32,8,4,385.18699999999995,3
w13,2,64,8,3584,2560,32,64,256,1,4,2,383.6293333333333,3
w13,2,64,8,3584,2560,32,128,128,1,4,2,384.6000000000001,3
w13,2,64,8,3584,2560,64,32,128,16,4,2,385.3043333333333,3
w13,2,64,8,3584,2560,64,32,256,1,4,2,383.779,3
w13,2,128,4,2048,512,16,64,64,1,4,4,7.884666666666667,3
w13,2,128,4,2048,512,16,64,64,16,4,4,7.906333333333333,3
w13,2,128,4,2048,512,16,64,64,32,4,4,7.938,3
w13,2,128,4,2048,512,16,64,64,64,4,4,7.927333333333333,3
w13,2,128,4,2048,512,16,64,128,16,8,4,7.938,3
w13,2,128,4,2048,512,16,64,128,32,8,4,7.863333333333333,3
w13,2,128,4,2048,512,16,64,128,64,8,4,7.874,3
w13,2,128,6,4096,2048,32,32,64,1,4,2,261.49600000000004,3
w13,2,128,6,4096,2048,32,32,256,1,4,2,259.0423333333334,3
w13,2,128,8,2048,768,16,256,32,8,4,4,17.420666666666666,3
w13,2,128,8,4096,1536,16,32,64,1,4,2,260.91966666666667,3
w13,2,128,8,4096,1536,32,32,64,1,4,2,261.05833333333334,3
w13,2,128,8,4096,1536,32,32,128,16,4,2,262.0183333333334,3
w13,2,128,8,4096,1536,32,32,256,1,4,2,259.6716666666667,3
w13,2,128,8,4096,1536,32,32,256,16,4,2,261.09,3
w13,2,128,8,4096,3072,16,16,64,1,4,3,526.7436666666666,3
w13,2,128,8,4096,3072,16,16,64,1,4,4,529.6663333333333,3
w13,2,128,8,4096,3072,16,16,64,1,8,4,527.3626666666668,3
w13,2,128,8,4096,3072,16,16,128,1,4,2,527.8636666666666,3
w13,2,128,8,4096,3072,16,16,128,1,4,3,526.4876666666667,3
w13,2,128,8,4096,3072,16,16,128,1,4,4,529.3036666666667,3
w13,2,128,8,4096,3072,16,16,128,1,8,3,529.2503333333334,3
w13,2,128,8,4096,3072,16,16,128,4,4,2,529.0793333333332,3
w13,2,128,8,4096,3072,16,16,128,4,4,3,527.2236666666666,3
w13,2,128,8,4096,3072,16,16,128,4,4,4,529.2613333333333,3
w13,2,128,8,4096,3072,16,16,128,4,8,3,528.7386666666666,3
w13,2,128,8,4096,3072,16,16,256,1,4,2,527.6823333333333,3
w13,2,128,8,4096,3072,16,16,256,1,4,3,527.0853333333333,3
w13,2,128,8,4096,3072,16,16,256,1,4,4,528.4183333333334,3
w13,2,128,8,4096,3072,16,16,256,1,8,3,528.9836666666666,3
w13,2,128,8,4096,3072,16,16,256,4,4,2,527.405,3
w13,2,128,8,4096,3072,16,16,256,4,4,3,527.277,3
w13,2,128,8,4096,3072,16,16,256,4,4,4,527.1706666666666,3
w13,2,128,8,4096,3072,16,16,256,4,8,3,527.714,3
w13,2,128,8,4096,3072,16,16,256,4,8,4,529.069,3
w13,2,128,8,4096,3072,16,32,64,1,4,2,528.6526666666667,3
w13,2,128,8,4096,3072,16,32,64,1,4,3,525.8473333333333,3
w13,2,128,8,4096,3072,16,32,64,1,4,4,526.0613333333333,3
w13,2,128,8,4096,3072,16,32,64,1,8,2,528.2903333333334,3
w13,2,128,8,4096,3072,16,32,64,1,8,3,528.6423333333333,3
w13,2,128,8,4096,3072,16,32,64,1,8,4,528.1093333333333,3
w13,2,128,8,4096,3072,16,32,64,16,4,3,526.9566666666666,3
w13,2,128,8,4096,3072,16,32,64,16,4,4,527.1383333333333,3
w13,2,128,8,4096,3072,16,32,64,16,8,3,528.7813333333334,3
w13,2,128,8,4096,3072,16,32,64,16,8,4,529.8366666666667,3
w13,2,128,8,4096,3072,16,32,64,32,4,3,526.6370000000001,3
w13,2,128,8,4096,3072,16,32,64,32,4,4,526.6476666666666,3
w13,2,128,8,4096,3072,16,32,64,32,8,4,529.4,3
w13,2,128,8,4096,3072,16,32,64,64,4,3,527.17,3
w13,2,128,8,4096,3072,16,32,64,64,4,4,527.1916666666666,3
w13,2,128,8,4096,3072,16,32,64,64,8,3,529.1653333333334,3
w13,2,128,8,4096,3072,16,32,64,64,8,4,529.3353333333333,3
w13,2,128,8,4096,3072,16,32,128,1,4,2,524.5573333333333,3
w13,2,128,8,4096,3072,16,32,128,1,4,4,528.0983333333334,3
w13,2,128,8,4096,3072,16,32,128,1,8,2,527.5226666666666,3
w13,2,128,8,4096,3072,16,32,128,4,4,2,526.6793333333334,3
w13,2,128,8,4096,3072,16,32,128,4,4,4,527.8743333333333,3
w13,2,128,8,4096,3072,16,32,128,16,4,2,526.4346666666667,3
w13,2,128,8,4096,3072,16,32,128,16,4,4,527.597,3
w13,2,128,8,4096,3072,16,32,128,16,8,2,528.7493333333333,3
w13,2,128,8,4096,3072,16,32,128,16,8,4,529.304,3
w13,2,128,8,4096,3072,16,32,128,32,4,2,526.0396666666667,3
w13,2,128,8,4096,3072,16,32,128,32,4,4,527.2236666666666,3
w13,2,128,8,4096,3072,16,32,128,32,8,2,529.2503333333333,3
w13,2,128,8,4096,3072,16,32,128,64,4,2,526.0713333333333,3
w13,2,128,8,4096,3072,16,32,128,64,4,4,527.6930000000001,3
w13,2,128,8,4096,3072,16,32,128,64,8,2,529.1116666666667,3
w13,2,128,8,4096,3072,16,32,128,64,8,4,529.293,3
w13,2,128,8,4096,3072,16,32,256,1,4,3,528.173,3
w13,2,128,8,4096,3072,16,32,256,1,4,4,528.034,3
w13,2,128,8,4096,3072,16,32,256,1,8,4,527.4053333333333,3
w13,2,128,8,4096,3072,16,32,256,16,4,3,528.9623333333334,3
w13,2,128,8,4096,3072,16,32,256,16,4,4,528.216,3
w13,2,128,8,4096,3072,16,32,256,16,8,3,529.5386666666667,3
w13,2,128,8,4096,3072,16,32,256,16,8,4,528.7913333333333,3
w13,2,128,8,4096,3072,16,32,256,32,4,3,529.0053333333333,3
w13,2,128,8,4096,3072,16,32,256,32,4,4,528.3436666666666,3
w13,2,128,8,4096,3072,16,32,256,32,8,3,529.4316666666667,3
w13,2,128,8,4096,3072,16,32,256,32,8,4,528.2906666666667,3
w13,2,128,8,4096,3072,16,32,256,64,4,3,528.6636666666667,3
w13,2,128,8,4096,3072,16,32,256,64,4,4,528.5253333333334,3
w13,2,128,8,4096,3072,16,32,256,64,8,3,529.5593333333333,3
w13,2,128,8,4096,3072,16,32,256,64,8,4,528.333,3
w13,2,128,8,4096,3072,16,64,64,1,4,2,527.842,3
w13,2,128,8,4096,3072,16,64,64,1,4,4,527.7463333333334,3
w13,2,128,8,4096,3072,16,64,64,1,8,2,528.3646666666667,3
w13,2,128,8,4096,3072,16,64,64,1,8,4,527.821,3
w13,2,128,8,4096,3072,16,64,64,16,4,2,526.84,3
w13,2,128,8,4096,3072,16,64,64,32,4,2,526.7223333333333,3
w13,2,128,8,4096,3072,16,64,64,64,4,2,527.0853333333333,3
w13,2,128,8,4096,3072,16,64,64,64,4,4,529.5706666666666,3
w13,2,128,8,4096,3072,16,64,128,1,4,4,528.664,3
w13,2,128,8,4096,3072,16,64,128,1,8,4,529.4313333333333,3
w13,2,128,8,4096,3072,16,128,64,1,8,4,528.5463333333333,3
w13,2,128,8,4096,3072,16,128,64,16,8,4,529.496,3
w13,2,128,8,4096,3072,16,128,64,32,8,4,529.2296666666667,3
w13,2,128,8,4096,3072,16,128,64,64,8,4,529.2716666666666,3
w13,2,128,8,4096,3072,16,128,128,1,8,3,529.837,3
w13,2,128,8,4096,3072,32,16,128,4,4,4,527.7463333333334,3
w13,2,128,8,4096,3072,32,32,64,1,4,2,528.0343333333334,3
w13,2,128,8,4096,3072,32,32,64,1,4,3,526.4236666666667,3
w13,2,128,8,4096,3072,32,32,64,1,8,2,528.013,3
w13,2,128,8,4096,3072,32,32,64,1,8,3,529.805,3
w13,2,128,8,4096,3072,32,32,64,32,4,3,526.9253333333332,3
w13,2,128,8,4096,3072,32,32,64,32,8,3,529.7413333333334,3
w13,2,128,8,4096,3072,32,32,64,64,4,3,527.256,3
w13,2,128,8,4096,3072,32,32,64,128,4,3,527.1063333333333,3
w13,2,128,8,4096,3072,32,32,128,1,4,2,526.2103333333333,3
w13,2,128,8,4096,3072,32,32,128,1,4,3,526.552,3
w13,2,128,8,4096,3072,32,32,128,1,4,4,529.1006666666667,3
w13,2,128,8,4096,3072,32,32,128,1,8,3,526.8606666666667,3
w13,2,128,8,4096,3072,32,32,128,4,4,2,528.813,3
w13,2,128,8,4096,3072,32,32,128,4,4,3,527.1916666666667,3
w13,2,128,8,4096,3072,32,32,128,4,4,4,529.8266666666667,3
w13,2,128,8,4096,3072,32,32,128,4,8,3,526.9036666666667,3
w13,2,128,8,4096,3072,32,32,128,16,4,2,527.0,3
w13,2,128,8,4096,3072,32,32,128,16,4,3,526.658,3
w13,2,128,8,4096,3072,32,32,128,16,4,4,529.1433333333333,3
w13,2,128,8,4096,3072,32,32,128,16,8,3,527.1063333333333,3
w13,2,128,8,4096,3072,32,32,128,64,4,2,526.9886666666666,3
w13,2,128,8,4096,3072,32,32,128,64,4,3,527.0853333333333,3
w13,2,128,8,4096,3072,32,32,128,64,4,4,528.7913333333335,3
w13,2,128,8,4096,3072,32,32,128,64,8,3,526.6476666666666,3
w13,2,128,8,4096,3072,32,32,256,1,4,2,525.7406666666667,3
w13,2,128,8,4096,3072,32,32,256,1,4,3,527.2126666666667,3
w13,2,128,8,4096,3072,32,32,256,1,4,4,527.0743333333334,3
w13,2,128,8,4096,3072,32,32,256,1,8,2,527.5006666666667,3
w13,2,128,8,4096,3072,32,32,256,1,8,3,527.6823333333333,3
w13,2,128,8,4096,3072,32,32,256,1,8,4,527.544,3
w13,2,128,8,4096,3072,32,32,256,4,4,2,527.917,3
w13,2,128,8,4096,3072,32,32,256,4,4,3,526.968,3
w13,2,128,8,4096,3072,32,32,256,4,4,4,526.9993333333333,3
w13,2,128,8,4096,3072,32,32,256,4,8,2,527.7779999999999,3
w13,2,128,8,4096,3072,32,32,256,4,8,3,526.8183333333333,3
w13,2,128,8,4096,3072,32,32,256,4,8,4,527.3836666666667,3
w13,2,128,8,4096,3072,32,32,256,16,4,2,527.8103333333333,3
w13,2,128,8,4096,3072,32,32,256,16,4,3,526.8506666666667,3
w13,2,128,8,4096,3072,32,32,256,16,4,4,527.9276666666666,3
w13,2,128,8,4096,3072,32,32,256,16,8,2,528.4399999999999,3
w13,2,128,8,4096,3072,32,32,256,16,8,3,526.9676666666667,3
w13,2,128,8,4096,3072,32,32,256,16,8,4,528.1726666666667,3
w13,2,128,8,4096,3072,32,32,256,32,4,2,528.3013333333333,3
w13,2,128,8,4096,3072,32,32,256,32,4,3,527.234,3
w13,2,128,8,4096,3072,32,32,256,32,4,4,527.448,3
w13,2,128,8,4096,3072,32,32,256,32,8,2,527.6503333333334,3
w13,2,128,8,4096,3072,32,32,256,32,8,3,526.7866666666666,3
w13,2,128,8,4096,3072,32,32,256,32,8,4,528.2263333333334,3
w13,2,128,8,4096,3072,32,64,128,1,4,4,528.8666666666667,3
w13,2,128,8,4096,3072,32,128,64,1,8,2,529.101,3
w13,2,128,8,4096,3072,64,32,256,1,8,3,529.5706666666666,3
w13,2,128,8,4096,3072,64,64,128,1,4,2,526.6046666666666,3
w13,2,128,8,4096,3072,64,64,128,4,4,2,527.4903333333333,3
w13,2,128,8,4096,3072,64,64,128,16,4,2,529.8376666666667,3
w13,2,128,8,4096,3072,64,64,128,32,4,2,529.1120000000001,3
w13,4,8,2,1024,512,16,64,64,1,4,4,5.037,3
w13,4,16,2,1536,768,16,128,64,1,8,4,8.334999999999999,3
w13,4,16,4,1536,1024,16,64,64,1,4,3,18.380666666666666,3
w13,4,16,4,1536,1024,16,64,64,1,4,4,18.348666666666666,3
w13,4,16,4,1536,1024,16,64,64,16,4,3,18.284666666666666,3
w13,4,16,4,1536,1024,16,64,64,16,4,4,18.391333333333336,3
w13,4,16,4,1536,1024,16,64,64,32,4,3,18.242,3
w13,4,16,4,1536,1024,16,64,64,32,4,4,18.327333333333332,3
w13,4,16,4,1536,1024,16,64,64,64,4,3,18.34866666666667,3
w13,4,16,4,1536,1024,16,64,64,64,4,4,18.37,3
w13,4,32,4,2048,768,16,256,32,8,4,4,18.37,3
w13,4,32,6,3072,1024,32,32,128,64,4,2,195.09533333333331,3
w13,4,32,6,3072,1024,32,32,256,1,4,2,194.23166666666665,3
w13,4,32,6,3072,1024,32,32,256,32,4,2,195.42633333333333,3
w13,4,60,4,2048,1408,16,32,64,1,4,2,103.60766666666666,3
w13,4,60,4,2048,1408,16,128,64,1,8,2,104.589,3
w13,4,60,4,2048,1408,32,32,64,1,4,2,104.38633333333333,3
w13,4,60,6,3584,2304,16,16,64,1,4,3,520.5896666666666,3
w13,4,60,6,3584,2304,16,16,128,1,4,2,518.3603333333334,3
w13,4,60,6,3584,2304,16,16,128,1,4,3,519.779,3
w13,4,60,6,3584,2304,16,16,128,1,4,4,520.5790000000001,3
w13,4,60,6,3584,2304,16,16,128,4,4,2,518.6163333333334,3
w13,4,60,6,3584,2304,16,16,128,4,4,3,518.371,3
w13,4,60,6,3584,2304,16,16,128,4,4,4,520.5790000000001,3
w13,4,60,6,3584,2304,16,16,256,1,4,2,518.8296666666666,3
w13,4,60,6,3584,2304,16,16,256,1,4,3,519.2243333333333,3
w13,4,60,6,3584,2304,16,16,256,1,4,4,518.6803333333334,3
w13,4,60,6,3584,2304,16,16,256,1,8,4,520.8346666666666,3
w13,4,60,6,3584,2304,16,16,256,4,4,2,519.011,3
w13,4,60,6,3584,2304,16,16,256,4,4,3,519.6513333333334,3
w13,4,60,6,3584,2304,16,16,256,4,4,4,519.0749999999999,3
w13,4,60,6,3584,2304,16,16,256,4,8,4,520.643,3
w13,4,60,6,3584,2304,16,32,64,1,4,3,520.5893333333333,3
w13,4,60,6,3584,2304,16,32,128,1,4,2,518.2643333333334,3
w13,4,60,6,3584,2304,16,32,128,1,4,3,518.0296666666667,3
w13,4,60,6,3584,2304,16,32,128,1,4,4,518.9153333333334,3
w13,4,60,6,3584,2304,16,32,128,1,8,2,518.6166666666667,3
w13,4,60,6,3584,2304,16,32,128,1,8,3,518.7656666666667,3
w13,4,60,6,3584,2304,16,32,128,1,8,4,520.782,3
w13,4,60,6,3584,2304,16,32,128,4,4,2,519.1283333333333,3
w13,4,60,6,3584,2304,16,32,128,4,4,3,518.1576666666666,3
w13,4,60,6,3584,2304,16,32,128,4,4,4,519.3626666666667,3
w13,4,60,6,3584,2304,16,32,128,4,8,2,518.5953333333333,3
w13,4,60,6,3584,2304,16,32,128,4,8,3,519.0,3
w13,4,60,6,3584,2304,16,32,128,4,8,4,520.7073333333333,3
w13,4,60,6,3584,2304,16,32,128,16,4,2,519.139,3
w13,4,60,6,3584,2304,16,32,128,16,4,3,518.2856666666667,3
w13,4,60,6,3584,2304,16,32,128,16,4,4,518.9789999999999,3
w13,4,60,6,3584,2304,16,32,128,16,8,2,519.832,3
w13,4,60,6,3584,2304,16,32,128,16,8,3,518.8936666666667,3
w13,4,60,6,3584,2304,16,32,128,16,8,4,520.8456666666667,3
w13,4,60,6,3584,2304,16,32,128,32,4,2,519.3633333333333,3
w13,4,60,6,3584,2304,16,32,128,32,4,3,519.0646666666667,3
w13,4,60,6,3584,2304,16,32,128,32,4,4,518.8296666666666,3
w13,4,60,6,3584,2304,16,32,128,32,8,2,518.8936666666667,3
w13,4,60,6,3584,2304,16,32,128,32,8,3,519.1926666666667,3
w13,4,60,6,3584,2304,16,32,128,64,4,2,520.1523333333333,3
w13,4,60,6,3584,2304,16,32,128,64,4,3,519.0323333333332,3
w13,4,60,6,3584,2304,16,32,128,64,4,4,519.2563333333334,3
w13,4,60,6,3584,2304,16,32,128,64,8,2,518.9686666666666,3
w13,4,60,6,3584,2304,16,32,128,64,8,3,519.5873333333334,3
w13,4,60,6,3584,2304,16,32,128,64,8,4,520.6323333333333,3
w13,4,60,6,3584,2304,16,32,256,1,4,2,515.8753333333333,3
w13,4,60,6,3584,2304,16,32,256,1,4,3,519.139,3
w13,4,60,6,3584,2304,16,32,256,1,4,4,518.8403333333333,3
w13,4,60,6,3584,2304,16,32,256,1,8,2,519.4266666666667,3
w13,4,60,6,3584,2304,16,32,256,1,8,4,519.534,3
w13,4,60,6,3584,2304,16,32,256,16,4,2,518.1793333333334,3
w13,4,60,6,3584,2304,16,32,256,16,4,3,520.6963333333333,3
w13,4,60,6,3584,2304,16,32,256,16,4,4,518.8829999999999,3
w13,4,60,6,3584,2304,16,32,256,16,8,2,518.8616666666667,3
w13,4,60,6,3584,2304,16,32,256,16,8,4,519.0433333333334,3
w13,4,60,6,3584,2304,16,32,256,32,4,2,519.1283333333334,3
w13,4,60,6,3584,2304,16,32,256,32,4,3,520.5576666666667,3
w13,4,60,6,3584,2304,16,32,256,32,4,4,519.3526666666667,3
w13,4,60,6,3584,2304,16,32,256,32,8,2,519.544,3
w13,4,60,6,3584,2304,16,32,256,32,8,4,519.6616666666667,3
w13,4,60,6,3584,2304,16,32,256,64,4,2,518.7233333333334,3
w13,4,60,6,3584,2304,16,32,256,64,4,3,520.6750000000001,3
w13,4,60,6,3584,2304,16,32,256,64,4,4,519.427,3
w13,4,60,6,3584,2304,16,32,256,64,8,2,519.1393333333334,3
w13,4,60,6,3584,2304,16,32,256,64,8,4,519.5443333333334,3
w13,4,60,6,3584,2304,16,64,128,1,4,2,520.2803333333333,3
w13,4,60,6,3584,2304,16,64,128,1,4,3,519.0536666666667,3
w13,4,60,6,3584,2304,16,64,128,1,4,4,519.1603333333334,3
w13,4,60,6,3584,2304,16,64,128,1,8,2,520.6856666666666,3
w13,4,60,6,3584,2304,16,64,128,1,8,3,519.1073333333334,3
w13,4,60,6,3584,2304,16,64,128,1,8,4,519.6936666666667,3
w13,4,60,6,3584,2304,16,64,128,16,4,3,519.4486666666667,3
w13,4,60,6,3584,2304,16,64,128,16,4,4,519.7043333333334,3
w13,4,60,6,3584,2304,16,64,128,16,8,2,520.974,3
w13,4,60,6,3584,2304,16,64,128,16,8,3,519.5336666666667,3
w13,4,60,6,3584,2304,16,64,128,16,8,4,519.9923333333332,3
w13,4,60,6,3584,2304,16,64,128,32,4,2,520.4293333333334,3
w13,4,60,6,3584,2304,16,64,128,32,4,3,519.0963333333333,3
w13,4,60,6,3584,2304,16,64,128,32,4,4,519.6723333333333,3
w13,4,60,6,3584,2304,16,64,128,32,8,2,520.8886666666667,3
w13,4,60,6,3584,2304,16,64,128,32,8,3,519.1923333333333,3
w13,4,60,6,3584,2304,16,64,128,32,8,4,520.4083333333333,3
w13,4,60,6,3584,2304,16,64,128,64,4,3,518.8829999999999,3
w13,4,60,6,3584,2304,16,64,128,64,4,4,519.7256666666667,3
w13,4,60,6,3584,2304,16,64,128,64,8,2,520.792,3
w13,4,60,6,3584,2304,16,64,128,64,8,3,519.3629999999999,3
w13,4,60,6,3584,2304,16,64,128,64,8,4,519.7683333333333,3
w13,4,60,6,3584,2304,16,64,256,1,4,2,516.7710000000001,3
w13,4,60,6,3584,2304,16,64,256,1,4,3,520.344,3
w13,4,60,6,3584,2304,16,64,256,1,8,2,518.4883333333333,3
w13,4,60,6,3584,2304,16,64,256,1,8,3,520.5466666666666,3
w13,4,60,6,3584,2304,16,64,256,16,4,2,519.3953333333334,3
w13,4,60,6,3584,2304,16,64,256,16,8,2,518.9893333333333,3
w13,4,60,6,3584,2304,16,64,256,32,4,2,519.203,3
w13,4,60,6,3584,2304,16,64,256,32,8,2,519.4163333333332,3
w13,4,60,6,3584,2304,16,64,256,64,4,2,519.331,3
w13,4,60,6,3584,2304,16,64,256,64,8,2,518.819,3
w13,4,60,6,3584,2304,16,128,128,1,4,2,520.6216666666667,3
w13,4,60,6,3584,2304,16,128,128,1,4,3,519.3526666666667,3
w13,4,60,6,3584,2304,16,128,128,1,8,3,518.3603333333334,3
w13,4,60,6,3584,2304,16,128,128,16,4,3,519.9176666666667,3
w13,4,60,6,3584,2304,16,128,128,16,8,3,519.5446666666667,3
w13,4,60,6,3584,2304,16,128,128,32,4,3,519.971,3
w13,4,60,6,3584,2304,16,128,128,32,8,3,519.3946666666667,3
w13,4,60,6,3584,2304,16,128,128,64,4,3,519.9496666666668,3
w13,4,60,6,3584,2304,16,128,128,64,8,3,519.715,3
w13,4,60,6,3584,2304,32,16,128,4,4,2,519.1493333333334,3
w13,4,60,6,3584,2304,32,16,128,4,4,3,520.1633333333333,3
w13,4,60,6,3584,2304,32,16,128,4,4,4,518.958,3
w13,4,60,6,3584,2304,32,32,64,1,4,3,519.8533333333334,3
w13,4,60,6,3584,2304,32,32,64,1,4,4,520.7176666666666,3
w13,4,60,6,3584,2304,32,32,64,1,8,3,520.1846666666667,3
w13,4,60,6,3584,2304,32,32,64,32,4,3,520.6643333333333,3
w13,4,60,6,3584,2304,32,32,64,64,4,3,520.515,3
w13,4,60,6,3584,2304,32,32,64,128,4,3,520.739,3
w13,4,60,6,3584,2304,32,32,128,1,4,2,517.368,3
w13,4,60,6,3584,2304,32,32,128,1,4,4,520.0243333333334,3
w13,4,60,6,3584,2304,32,32,128,1,8,2,518.6486666666666,3
w13,4,60,6,3584,2304,32,32,128,4,4,2,518.3713333333334,3
w13,4,60,6,3584,2304,32,32,128,4,4,4,520.1523333333333,3
w13,4,60,6,3584,2304,32,32,128,4,8,2,518.478,3
w13,4,60,6,3584,2304,32,32,128,16,4,2,519.0216666666666,3
w13,4,60,6,3584,2304,32,32,128,16,4,4,520.835,3
w13,4,60,6,3584,2304,32,32,128,16,8,2,519.8533333333334,3
w13,4,60,6,3584,2304,32,32,128,64,4,2,519.6726666666667,3
w13,4,60,6,3584,2304,32,32,128,64,4,4,520.5043333333333,3
w13,4,60,6,3584,2304,32,32,128,64,8,2,519.5336666666667,3
w13,4,60,6,3584,2304,32,32,256,1,4,3,519.1393333333334,3
w13,4,60,6,3584,2304,32,32,256,1,4,4,519.6616666666666,3
w13,4,60,6,3584,2304,32,32,256,1,8,3,519.0963333333333,3
w13,4,60,6,3584,2304,32,32,256,1,8,4,519.5016666666667,3
w13,4,60,6,3584,2304,32,32,256,4,4,3,519.054,3
w13,4,60,6,3584,2304,32,32,256,4,4,4,519.31,3
w13,4,60,6,3584,2304,32,32,256,4,8,3,518.8833333333333,3
w13,4,60,6,3584,2304,32,32,256,4,8,4,520.003,3
w13,4,60,6,3584,2304,32,32,256,16,4,3,519.6403333333334,3
w13,4,60,6,3584,2304,32,32,256,16,4,4,519.4163333333333,3
w13,4,60,6,3584,2304,32,32,256,16,8,3,519.4913333333333,3
w13,4,60,6,3584,2304,32,32,256,16,8,4,519.555,3
w13,4,60,6,3584,2304,32,32,256,32,4,3,520.0136666666667,3
w13,4,60,6,3584,2304,32,32,256,32,4,4,520.2803333333333,3
w13,4,60,6,3584,2304,32,32,256,32,8,3,520.3870000000001,3
w13,4,60,6,3584,2304,32,32,256,32,8,4,519.4166666666666,3
w13,4,60,6,3584,2304,32,64,128,1,4,2,518.7016666666667,3
w13,4,60,6,3584,2304,32,64,128,1,4,3,519.4483333333333,3
w13,4,60,6,3584,2304,32,64,128,1,4,4,519.779,3
w13,4,60,6,3584,2304,32,64,128,1,8,2,520.7493333333333,3
w13,4,60,6,3584,2304,32,64,128,1,8,3,518.7976666666667,3
w13,4,60,6,3584,2304,32,64,128,1,8,4,520.291,3
w13,4,60,6,3584,2304,32,64,128,4,4,2,519.939,3
w13,4,60,6,3584,2304,32,64,128,4,4,3,518.8936666666667,3
w13,4,60,6,3584,2304,32,64,128,4,4,4,520.0243333333333,3
w13,4,60,6,3584,2304,32,64,128,4,8,2,520.3123333333333,3
w13,4,60,6,3584,2304,32,64,128,4,8,3,519.3629999999999,3
w13,4,60,6,3584,2304,32,64,128,4,8,4,520.1203333333333,3
w13,4,60,6,3584,2304,32,64,128,16,4,3,520.7713333333332,3
w13,4,60,6,3584,2304,32,64,128,16,4,4,519.9923333333332,3
w13,4,60,6,3584,2304,32,64,128,16,8,3,519.2563333333334,3
w13,4,60,6,3584,2304,32,64,128,16,8,4,520.3553333333333,3
w13,4,60,6,3584,2304,32,64,128,32,4,3,520.0136666666666,3
w13,4,60,6,3584,2304,32,64,128,32,4,4,519.8539999999999,3
w13,4,60,6,3584,2304,32,64,128,32,8,3,520.4083333333333,3
w13,4,60,6,3584,2304,32,64,128,32,8,4,520.4086666666667,3
w13,4,60,6,3584,2304,32,64,128,64,4,3,519.523,3
w13,4,60,6,3584,2304,32,64,128,64,4,4,520.1523333333333,3
w13,4,60,6,3584,2304,32,64,128,64,8,2,520.4086666666667,3
w13,4,60,6,3584,2304,32,64,128,64,8,3,519.747,3
w13,4,60,6,3584,2304,32,64,128,64,8,4,519.9923333333334,3
w13,4,60,6,3584,2304,32,64,256,1,4,2,517.3149999999999,3
w13,4,60,6,3584,2304,32,64,256,1,8,2,518.9256666666666,3
w13,4,60,6,3584,2304,32,64,256,8,4,2,519.5443333333334,3
w13,4,60,6,3584,2304,32,64,256,8,8,2,519.2456666666667,3
w13,4,60,6,3584,2304,32,64,256,16,4,2,520.024,3
w13,4,60,6,3584,2304,32,64,256,16,8,2,519.1496666666667,3
w13,4,60,6,3584,2304,32,64,256,32,4,2,519.4913333333333,3
w13,4,60,6,3584,2304,32,64,256,32,8,2,519.8323333333334,3
w13,4,60,6,3584,2304,32,64,256,64,4,2,520.3870000000001,3
w13,4,60,6,3584,2304,32,64,256,64,8,2,519.3946666666667,3
w13,4,60,6,3584,2304,32,128,128,1,4,3,520.003,3
w13,4,60,6,3584,2304,32,128,128,1,8,3,519.427,3
w13,4,60,6,3584,2304,32,128,128,4,4,3,520.1953333333333,3
w13,4,60,6,3584,2304,32,128,128,4,8,3,519.2986666666667,3
w13,4,60,6,3584,2304,32,128,128,8,4,3,520.2273333333333,3
w13,4,60,6,3584,2304,32,128,128,8,8,3,519.2776666666667,3
w13,4,60,6,3584,2304,32,128,128,16,4,3,519.843,3
w13,4,60,6,3584,2304,32,128,128,16,8,3,520.4616666666667,3
w13,4,60,6,3584,2304,32,128,128,32,4,3,520.5153333333333,3
w13,4,60,6,3584,2304,32,128,128,32,8,3,520.3976666666666,3
w13,4,60,6,3584,2304,32,128,128,64,4,3,520.1416666666668,3
w13,4,60,6,3584,2304,32,128,128,64,8,3,520.8883333333333,3
w13,4,60,6,3584,2304,64,32,128,1,4,2,520.686,3
w13,4,60,6,3584,2304,64,32,128,1,8,2,520.1733333333333,3
w13,4,60,6,3584,2304,64,32,128,16,4,2,520.6216666666667,3
w13,4,60,6,3584,2304,64,32,256,1,8,3,520.718,3
w13,4,60,6,3584,2304,64,64,128,1,8,2,520.5573333333333,3
w13,4,60,6,3584,2304,64,128,128,1,8,3,520.8993333333333,3
w13,4,60,6,3584,2304,64,128,128,4,8,3,520.4830000000001,3
w13,4,60,8,2048,1536,16,32,128,1,4,2,261.30333333333334,3
w13,4,60,8,2048,1536,16,32,256,1,4,2,262.306,3
w13,4,60,8,2048,1536,32,16,128,4,4,2,262.306,3
w13,4,60,8,2048,1536,32,32,128,1,4,2,259.75666666666666,3
w13,4,60,8,2048,1536,32,32,256,1,4,2,260.47133333333335,3
w13,4,60,8,2048,1536,64,64,128,1,4,2,260.3533333333333,3
w13,4,64,6,3072,2048,16,16,64,1,4,3,399.10699999999997,3
w13,4,64,6,3072,2048,16,16,128,1,4,3,396.6003333333333,3
w13,4,64,6,3072,2048,16,16,128,1,4,4,398.79766666666666,3
w13,4,64,6,3072,2048,16,16,128,1,8,3,397.47499999999997,3
w13,4,64,6,3072,2048,16,16,128,4,4,3,397.5496666666666,3
w13,4,64,6,3072,2048,16,16,128,4,4,4,398.41333333333336,3
w13,4,64,6,3072,2048,16,16,256,1,4,2,396.291,3
w13,4,64,6,3072,2048,16,16,256,1,4,3,396.10966666666667,3
w13,4,64,6,3072,2048,16,16,256,1,4,4,396.9203333333333,3
w13,4,64,6,3072,2048,16,16,256,1,8,3,397.5919999999999,3
w13,4,64,6,3072,2048,16,16,256,1,8,4,398.3709999999999,3
w13,4,64,6,3072,2048,16,16,256,4,4,2,397.4003333333333,3
w13,4,64,6,3072,2048,16,16,256,4,4,3,396.30133333333333,3
w13,4,64,6,3072,2048,16,16,256,4,4,4,396.013,3
w13,4,64,6,3072,2048,16,16,256,4,8,3,396.93100000000004,3
w13,4,64,6,3072,2048,16,16,256,4,8,4,397.77366666666666,3
w13,4,64,6,3072,2048,16,32,128,1,4,2,397.08033333333333,3
w13,4,64,6,3072,2048,16,32,128,1,4,4,396.90933333333334,3
w13,4,64,6,3072,2048,16,32,128,1,8,4,398.6376666666667,3
w13,4,64,6,3072,2048,16,32,128,4,4,2,398.37100000000004,3
w13,4,64,6,3072,2048,16,32,128,4,4,4,396.387,3
w13,4,64,6,3072,2048,16,32,128,4,8,4,398.38166666666666,3
w13,4,64,6,3072,2048,16,32,128,16,4,2,399.0533333333333,3
w13,4,64,6,3072,2048,16,32,128,16,4,4,397.827,3
w13,4,64,6,3072,2048,16,32,128,16,8,4,398.95733333333334,3
w13,4,64,6,3072,2048,16,32,128,32,4,2,398.296,3
w13,4,64,6,3072,2048,16,32,128,32,4,3,398.915,3
w13,4,64,6,3072,2048,16,32,128,32,4,4,398.47766666666666,3
w13,4,64,6,3072,2048,16,32,128,64,4,2,397.99766666666665,3
w13,4,64,6,3072,2048,16,32,256,1,4,2,397.67766666666665,3
w13,4,64,6,3072,2048,16,32,256,1,4,3,398.12566666666663,3
w13,4,64,6,3072,2048,16,32,256,1,4,4,396.41900000000004,3
w13,4,64,6,3072,2048,16,32,256,1,8,3,398.65900000000005,3
w13,4,64,6,3072,2048,16,32,256,1,8,4,396.05600000000004,3
w13,4,64,6,3072,2048,16,32,256,16,4,3,398.147,3
w13,4,64,6,3072,2048,16,32,256,16,4,4,396.70700000000005,3
w13,4,64,6,3072,2048,16,32,256,16,8,3,399.07466666666664,3
w13,4,64,6,3072,2048,16,32,256,16,8,4,396.7816666666667,3
w13,4,64,6,3072,2048,16,32,256,32,4,4,397.06933333333336,3
w13,4,64,6,3072,2048,16,32,256,32,8,4,397.4536666666666,3
w13,4,64,6,3072,2048,16,32,256,64,4,3,398.7546666666667,3
w13,4,64,6,3072,2048,16,32,256,64,4,4,397.0806666666667,3
w13,4,64,6,3072,2048,16,32,256,64,8,4,397.0056666666666,3
w13,4,64,6,3072,2048,16,64,128,1,4,4,397.4216666666666,3
w13,4,64,6,3072,2048,16,64,128,1,8,4,397.33566666666667,3
w13,4,64,6,3072,2048,16,64,128,16,4,4,398.07233333333335,3
w13,4,64,6,3072,2048,16,64,128,16,8,4,398.0083333333334,3
w13,4,64,6,3072,2048,16,64,128,32,4,4,397.37899999999996,3
w13,4,64,6,3072,2048,16,64,128,32,8,4,397.7626666666667,3
w13,4,64,6,3072,2048,16,64,128,64,4,4,397.2083333333333,3
w13,4,64,6,3072,2048,16,64,128,64,8,4,397.6556666666667,3
w13,4,64,6,3072,2048,16,64,256,1,4,2,398.90433333333334,3
w13,4,64,6,3072,2048,16,64,256,1,4,3,397.699,3
w13,4,64,6,3072,2048,16,64,256,1,8,3,398.29566666666665,3
w13,4,64,6,3072,2048,16,64,256,16,4,3,398.09366666666665,3
w13,4,64,6,3072,2048,16,64,256,16,8,3,398.53099999999995,3
w13,4,64,6,3072,2048,16,64,256,32,4,3,398.6266666666667,3
w13,4,64,6,3072,2048,16,64,256,32,8,3,398.7543333333333,3
w13,4,64,6,3072,2048,16,64,256,64,4,3,398.8503333333333,3
w13,4,64,6,3072,2048,16,64,256,64,8,3,398.64799999999997,3
w13,4,64,6,3072,2048,32,16,128,4,4,3,397.1333333333334,3
w13,4,64,6,3072,2048,32,16,128,4,4,4,396.4936666666667,3
w13,4,64,6,3072,2048,32,16,128,4,8,4,398.76533333333333,3
w13,4,64,6,3072,2048,32,32,128,1,4,3,397.38966666666664,3
w13,4,64,6,3072,2048,32,32,128,1,4,4,398.50933333333336,3
w13,4,64,6,3072,2048,32,32,128,1,8,3,397.7093333333333,3
w13,4,64,6,3072,2048,32,32,128,4,4,3,397.02700000000004,3
w13,4,64,6,3072,2048,32,32,128,4,4,4,398.15766666666667,3
w13,4,64,6,3072,2048,32,32,128,4,8,3,397.6453333333333,3
w13,4,64,6,3072,2048,32,32,128,16,4,3,397.9123333333334,3
w13,4,64,6,3072,2048,32,32,128,16,8,3,397.46433333333334,3
w13,4,64,6,3072,2048,32,32,128,64,4,3,397.9433333333333,3
w13,4,64,6,3072,2048,32,32,128,64,8,3,397.94433333333336,3
w13,4,64,6,3072,2048,32,32,256,1,4,2,395.23499999999996,3
w13,4,64,6,3072,2048,32,32,256,1,4,3,396.6323333333333,3
w13,4,64,6,3072,2048,32,32,256,1,4,4,396.483,3
w13,4,64,6,3072,2048,32,32,256,1,8,2,397.1863333333333,3
w13,4,64,6,3072,2048,32,32,256,1,8,3,397.1016666666667,3
w13,4,64,6,3072,2048,32,32,256,1,8,4,396.61100000000005,3
w13,4,64,6,3072,2048,32,32,256,4,4,2,396.99500000000006,3
w13,4,64,6,3072,2048,32,32,256,4,4,3,396.3976666666667,3
w13,4,64,6,3072,2048,32,32,256,4,4,4,396.49333333333334,3
w13,4,64,6,3072,2048,32,32,256,4,8,2,397.0586666666666,3
w13,4,64,6,3072,2048,32,32,256,4,8,3,396.6003333333333,3
w13,4,64,6,3072,2048,32,32,256,4,8,4,396.66433333333333,3
w13,4,64,6,3072,2048,32,32,256,16,4,2,396.8243333333333,3
w13,4,64,6,3072,2048,32,32,256,16,4,3,396.93100000000004,3
w13,4,64,6,3072,2048,32,32,256,16,4,4,396.80266666666665,3
w13,4,64,6,3072,2048,32,32,256,16,8,2,397.901,3
w13,4,64,6,3072,2048,32,32,256,16,8,3,397.16499999999996,3
w13,4,64,6,3072,2048,32,32,256,16,8,4,396.7283333333333,3
w13,4,64,6,3072,2048,32,32,256,32,4,2,398.499,3
w13,4,64,6,3072,2048,32,32,256,32,4,3,397.4536666666666,3
w13,4,64,6,3072,2048,32,32,256,32,4,4,397.84833333333336,3
w13,4,64,6,3072,2048,32,32,256,32,8,2,398.6803333333333,3
w13,4,64,6,3072,2048,32,32,256,32,8,3,397.635,3
w13,4,64,6,3072,2048,32,32,256,32,8,4,397.09100000000007,3
w13,4,64,6,3072,2048,32,64,128,1,4,4,397.73033333333336,3
w13,4,64,6,3072,2048,32,64,128,1,8,4,397.912,3
w13,4,64,6,3072,2048,32,64,128,4,4,4,397.65633333333335,3
w13,4,64,6,3072,2048,32,64,128,4,8,4,397.94366666666673,3
w13,4,64,6,3072,2048,32,64,128,16,4,4,398.8396666666667,3
w13,4,64,6,3072,2048,32,64,128,16,8,4,398.7443333333333,3
w13,4,64,6,3072,2048,32,64,128,32,4,4,397.859,3
w13,4,64,6,3072,2048,32,64,128,32,8,4,398.4669999999999,3
w13,4,64,6,3072,2048,32,64,128,64,4,4,397.955,3
w13,4,64,6,3072,2048,32,64,128,64,8,4,398.46700000000004,3
w13,4,64,6,3072,2048,32,64,256,1,8,3,398.7443333333333,3
w13,4,64,6,3072,2048,32,64,256,8,4,3,399.13899999999995,3
w13,4,64,6,3072,2048,32,64,256,32,8,3,399.203,3
w13,4,64,6,3072,2048,64,32,256,1,4,3,399.22433333333333,3
w13,4,64,6,3072,2048,64,32,256,1,8,3,398.2426666666667,3
w13,4,64,6,3072,2048,64,64,128,1,4,2,398.5623333333333,3
w13,4,64,6,3072,2048,64,64,128,4,4,2,398.9146666666666,3
w13,4,64,6,3072,2048,64,64,128,8,4,2,398.9363333333333,3
w13,4,64,6,3584,1536,16,16,64,1,4,4,347.3296666666667,3
w13,4,64,6,3584,1536,16,16,128,1,4,2,347.2656666666667,3
w13,4,64,6,3584,1536,16,16,128,1,4,3,346.87100000000004,3
w13,4,64,6,3584,1536,16,16,128,1,8,3,347.30833333333334,3
w13,4,64,6,3584,1536,16,16,128,4,4,2,347.202,3
w13,4,64,6,3584,1536,16,16,128,4,4,3,347.01,3
w13,4,64,6,3584,1536,16,16,128,4,8,3,347.7136666666667,3
w13,4,64,6,3584,1536,16,16,256,1,4,2,347.2656666666667,3
w13,4,64,6,3584,1536,16,16,256,1,4,4,347.63933333333335,3
w13,4,64,6,3584,1536,16,16,256,4,4,2,346.7863333333333,3
w13,4,64,6,3584,1536,16,16,256,4,4,4,347.78866666666664,3
w13,4,64,6,3584,1536,16,32,64,1,4,4,347.91633333333334,3
w13,4,64,6,3584,1536,16,32,128,1,4,2,344.801,3
w13,4,64,6,3584,1536,16,32,128,1,4,4,348.2473333333333,3
w13,4,64,6,3584,1536,16,32,128,1,8,2,347.5756666666666,3
w13,4,64,6,3584,1536,16,32,128,4,4,2,347.6816666666667,3
w13,4,64,6,3584,1536,16,32,128,4,8,2,347.63899999999995,3
w13,4,64,6,3584,1536,16,32,128,16,4,2,348.03399999999993,3
w13,4,64,6,3584,1536,16,32,128,16,8,2,347.66066666666666,3
w13,4,64,6,3584,1536,16,32,256,1,4,4,347.6496666666667,3
w13,4,64,6,3584,1536,16,32,256,1,8,4,347.69233333333335,3
w13,4,64,6,3584,1536,16,32,256,16,4,4,347.7676666666666,3
w13,4,64,6,3584,1536,16,32,256,16,8,4,348.0336666666667,3
w13,4,64,6,3584,1536,16,32,256,32,4,4,347.43699999999995,3
w13,4,64,6,3584,1536,16,32,256,64,4,4,347.51099999999997,3
w13,4,64,6,3584,1536,16,64,128,1,4,2,347.127,3
w13,4,64,6,3584,1536,16,64,128,1,8,2,347.074,3
w13,4,64,6,3584,1536,16,64,128,16,4,2,346.8923333333333,3
w13,4,64,6,3584,1536,16,64,128,16,8,2,347.2336666666667,3
w13,4,64,6,3584,1536,16,64,128,32,4,2,347.2336666666667,3
w13,4,64,6,3584,1536,16,128,128,1,4,2,347.671,3
w13,4,64,6,3584,1536,16,128,128,1,8,2,347.5536666666667,3
w13,4,64,6,3584,1536,16,128,128,16,4,2,348.03399999999993,3
w13,4,64,6,3584,1536,16,128,128,16,8,2,347.72499999999997,3
w13,4,64,6,3584,1536,32,16,128,4,4,2,347.202,3
w13,4,64,6,3584,1536,32,32,128,1,4,2,346.94599999999997,3
w13,4,64,6,3584,1536,32,32,128,1,8,2,347.5543333333333,3
w13,4,64,6,3584,1536,32,32,128,4,4,2,347.54333333333335,3
w13,4,64,6,3584,1536,32,32,128,4,8,2,347.6603333333333,3
w13,4,64,6,3584,1536,32,32,128,16,4,2,348.15166666666664,3
w13,4,64,6,3584,1536,32,32,128,16,8,2,348.1193333333333,3
w13,4,64,6,3584,1536,32,32,256,1,4,4,348.17233333333337,3
w13,4,64,6,3584,1536,32,32,256,1,8,4,347.9913333333334,3
w13,4,64,6,3584,1536,32,32,256,4,4,4,347.25499999999994,3
w13,4,64,6,3584,1536,32,32,256,4,8,4,347.93800000000005,3
w13,4,64,6,3584,1536,32,32,256,16,4,4,348.2363333333333,3
w13,4,64,6,3584,1536,32,32,256,16,8,4,348.247,3
w13,4,64,6,3584,1536,32,32,256,32,4,4,348.04466666666667,3
w13,4,64,6,3584,1536,32,64,128,1,4,2,346.551,3
w13,4,64,6,3584,1536,32,64,128,1,8,2,347.5753333333334,3
w13,4,64,6,3584,1536,32,64,128,4,4,2,347.479,3
w13,4,64,6,3584,1536,32,64,128,4,8,2,347.40433333333334,3
w13,4,64,6,3584,1536,32,64,128,16,4,2,347.87399999999997,3
w13,4,64,6,3584,1536,32,64,128,16,8,2,347.6073333333334,3
w13,4,64,6,3584,1536,32,64,128,32,4,2,347.29766666666666,3
w13,4,64,6,3584,1536,32,128,128,1,4,2,348.269,3
w13,4,64,6,3584,1536,32,128,128,1,8,2,348.066,3
w13,4,64,6,3584,1536,32,128,128,4,8,2,347.73566666666665,3
w13,4,64,6,3584,1536,32,128,128,8,8,2,347.6286666666667,3
w13,4,64,6,3584,1536,32,128,128,16,8,2,348.15166666666664,3
w13,4,64,8,3584,2560,16,16,64,1,4,3,767.5346666666666,3
w13,4,64,8,3584,2560,16,16,64,1,4,4,772.4303333333334,3
w13,4,64,8,3584,2560,16,16,128,1,4,2,766.9476666666666,3
w13,4,64,8,3584,2560,16,16,128,1,4,3,766.4786666666665,3
w13,4,64,8,3584,2560,16,16,128,1,4,4,767.652,3
w13,4,64,8,3584,2560,16,16,128,1,8,3,768.004,3
w13,4,64,8,3584,2560,16,16,128,1,8,4,769.476,3
w13,4,64,8,3584,2560,16,16,128,4,4,2,767.4066666666668,3
w13,4,64,8,3584,2560,16,16,128,4,4,3,766.649,3
w13,4,64,8,3584,2560,16,16,128,4,4,4,766.4996666666666,3
w13,4,64,8,3584,2560,16,16,128,4,8,3,767.6946666666666,3
w13,4,64,8,3584,2560,16,16,128,4,8,4,768.2703333333334,3
w13,4,64,8,3584,2560,16,16,256,1,4,2,768.5586666666667,3
w13,4,64,8,3584,2560,16,16,256,1,4,3,767.364,3
w13,4,64,8,3584,2560,16,16,256,1,4,4,767.0646666666667,3
w13,4,64,8,3584,2560,16,16,256,1,8,2,768.3560000000001,3
w13,4,64,8,3584,2560,16,16,256,1,8,3,770.5533333333333,3
w13,4,64,8,3584,2560,16,16,256,1,8,4,769.0813333333334,3
w13,4,64,8,3584,2560,16,16,256,4,4,2,766.8306666666667,3
w13,4,64,8,3584,2560,16,16,256,4,4,3,767.5133333333333,3
w13,4,64,8,3584,2560,16,16,256,4,4,4,766.9266666666666,3
w13,4,64,8,3584,2560,16,16,256,4,8,2,768.2386666666666,3
w13,4,64,8,3584,2560,16,16,256,4,8,3,770.9583333333334,3
w13,4,64,8,3584,2560,16,16,256,4,8,4,768.676,3
w13,4,64,8,3584,2560,16,32,64,1,4,3,770.0196666666667,3
w13,4,64,8,3584,2560,16,32,64,1,4,4,770.6276666666666,3
w13,4,64,8,3584,2560,16,32,64,1,8,3,769.1986666666667,3
w13,4,64,8,3584,2560,16,32,64,1,8,4,771.4703333333333,3
w13,4,64,8,3584,2560,16,32,64,16,4,3,771.2999999999998,3
w13,4,64,8,3584,2560,16,32,64,16,4,4,771.6836666666667,3
w13,4,64,8,3584,2560,16,32,64,16,8,3,770.4466666666667,3
w13,4,64,8,3584,2560,16,32,64,32,4,3,770.5,3
w13,4,64,8,3584,2560,16,32,64,32,4,4,771.268,3
w13,4,64,8,3584,2560,16,32,64,32,8,3,771.9826666666667,3
w13,4,64,8,3584,2560,16,32,64,64,4,3,770.7346666666666,3
w13,4,64,8,3584,2560,16,32,64,64,4,4,772.494,3
w13,4,64,8,3584,2560,16,32,64,64,8,3,772.6759999999999,3
w13,4,64,8,3584,2560,16,32,64,64,8,4,773.0703333333335,3
w13,4,64,8,3584,2560,16,32,128,1,4,2,766.2863333333333,3
w13,4,64,8,3584,2560,16,32,128,1,4,3,766.724,3
w13,4,64,8,3584,2560,16,32,128,1,4,4,766.1053333333333,3
w13,4,64,8,3584,2560,16,32,128,1,8,2,766.852,3
w13,4,64,8,3584,2560,16,32,128,1,8,3,767.5556666666666,3
w13,4,64,8,3584,2560,16,32,128,1,8,4,767.268,3
w13,4,64,8,3584,2560,16,32,128,4,4,2,767.3636666666666,3
w13,4,64,8,3584,2560,16,32,128,4,4,3,767.5343333333334,3
w13,4,64,8,3584,2560,16,32,128,4,4,4,766.0733333333334,3
w13,4,64,8,3584,2560,16,32,128,4,8,2,767.428,3
w13,4,64,8,3584,2560,16,32,128,4,8,3,768.1423333333333,3
w13,4,64,8,3584,2560,16,32,128,4,8,4,766.8306666666667,3
w13,4,64,8,3584,2560,16,32,128,16,4,2,768.1853333333333,3
w13,4,64,8,3584,2560,16,32,128,16,4,3,768.2813333333334,3
w13,4,64,8,3584,2560,16,32,128,16,4,4,767.0120000000001,3
w13,4,64,8,3584,2560,16,32,128,16,8,2,769.0383333333334,3
w13,4,64,8,3584,2560,16,32,128,16,8,3,767.7373333333334,3
w13,4,64,8,3584,2560,16,32,128,16,8,4,768.1529999999999,3
w13,4,64,8,3584,2560,16,32,128,32,4,2,768.0566666666667,3
w13,4,64,8,3584,2560,16,32,128,32,4,3,767.9396666666667,3
w13,4,64,8,3584,2560,16,32,128,32,4,4,767.3533333333334,3
w13,4,64,8,3584,2560,16,32,128,32,8,2,768.4946666666666,3
w13,4,64,8,3584,2560,16,32,128,32,8,3,767.9076666666666,3
w13,4,64,8,3584,2560,16,32,128,32,8,4,768.8466666666667,3
w13,4,64,8,3584,2560,16,32,128,64,4,2,767.9399999999999,3
w13,4,64,8,3584,2560,16,32,128,64,4,3,767.9506666666666,3
w13,4,64,8,3584,2560,16,32,128,64,4,4,768.0573333333333,3
w13,4,64,8,3584,2560,16,32,128,64,8,2,769.081,3
w13,4,64,8,3584,2560,16,32,128,64,8,3,768.9110000000001,3
w13,4,64,8,3584,2560,16,32,128,64,8,4,768.1640000000001,3
w13,4,64,8,3584,2560,16,32,256,1,4,2,766.148,3
w13,4,64,8,3584,2560,16,32,256,1,4,3,766.4573333333334,3
w13,4,64,8,3584,2560,16,32,256,1,4,4,767.1186666666666,3
w13,4,64,8,3584,2560,16,32,256,1,8,2,767.3213333333333,3
w13,4,64,8,3584,2560,16,32,256,1,8,3,767.4173333333333,3
w13,4,64,8,3584,2560,16,32,256,1,8,4,767.3103333333333,3
w13,4,64,8,3584,2560,16,32,256,16,4,2,767.4173333333333,3
w13,4,64,8,3584,2560,16,32,256,16,4,3,767.3746666666667,3
w13,4,64,8,3584,2560,16,32,256,16,4,4,767.844,3
w13,4,64,8,3584,2560,16,32,256,16,8,2,768.3879999999999,3
w13,4,64,8,3584,2560,16,32,256,16,8,3,767.1503333333334,3
w13,4,64,8,3584,2560,16,32,256,16,8,4,768.2600000000001,3
w13,4,64,8,3584,2560,16,32,256,32,4,2,767.6306666666666,3
w13,4,64,8,3584,2560,16,32,256,32,4,3,768.1206666666667,3
w13,4,64,8,3584,2560,16,32,256,32,4,4,767.8546666666667,3
w13,4,64,8,3584,2560,16,32,256,32,8,2,768.8679999999999,3
w13,4,64,8,3584,2560,16,32,256,32,8,3,767.9396666666667,3
w13,4,64,8,3584,2560,16,32,256,32,8,4,768.8040000000001,3
w13,4,64,8,3584,2560,16,32,256,64,4,2,767.2893333333333,3
w13,4,64,8,3584,2560,16,32,256,64,4,3,767.609,3
w13,4,64,8,3584,2560,16,32,256,64,4,4,767.9720000000001,3
w13,4,64,8,3584,2560,16,32,256,64,8,2,767.6946666666666,3
w13,4,64,8,3584,2560,16,32,256,64,8,3,768.6329999999999,3
w13,4,64,8,3584,2560,16,32,256,64,8,4,769.3156666666667,3
w13,4,64,8,3584,2560,16,64,64,1,4,3,769.3159999999999,3
w13,4,64,8,3584,2560,16,64,64,1,4,4,770.4146666666667,3
w13,4,64,8,3584,2560,16,64,64,1,8,3,770.265,3
w13,4,64,8,3584,2560,16,64,64,1,8,4,769.9876666666668,3
w13,4,64,8,3584,2560,16,64,64,16,4,3,771.2043333333335,3
w13,4,64,8,3584,2560,16,64,64,16,4,4,773.1236666666667,3
w13,4,64,8,3584,2560,16,64,64,16,8,3,771.9396666666667,3
w13,4,64,8,3584,2560,16,64,64,16,8,4,772.4200000000001,3
w13,4,64,8,3584,2560,16,64,64,32,4,3,771.0333333333333,3
w13,4,64,8,3584,2560,16,64,64,32,8,3,772.1959999999999,3
w13,4,64,8,3584,2560,16,64,64,64,4,3,771.3853333333333,3
w13,4,64,8,3584,2560,16,64,64,64,8,3,771.7373333333334,3
w13,4,64,8,3584,2560,16,64,128,1,4,2,766.4573333333333,3
w13,4,64,8,3584,2560,16,64,128,1,4,3,767.1613333333333,3
w13,4,64,8,3584,2560,16,64,128,1,4,4,766.692,3
w13,4,64,8,3584,2560,16,64,128,1,8,2,766.532,3
w13,4,64,8,3584,2560,16,64,128,1,8,3,767.5236666666666,3
w13,4,64,8,3584,2560,16,64,128,1,8,4,766.3933333333334,3
w13,4,64,8,3584,2560,16,64,128,16,4,2,768.1746666666667,3
w13,4,64,8,3584,2560,16,64,128,16,4,3,767.9506666666666,3
w13,4,64,8,3584,2560,16,64,128,16,4,4,766.895,3
w13,4,64,8,3584,2560,16,64,128,16,8,2,768.0573333333333,3
w13,4,64,8,3584,2560,16,64,128,16,8,3,767.7693333333333,3
w13,4,64,8,3584,2560,16,64,128,16,8,4,767.3423333333334,3
w13,4,64,8,3584,2560,16,64,128,32,4,2,767.7693333333333,3
w13,4,64,8,3584,2560,16,64,128,32,4,3,768.0146666666666,3
w13,4,64,8,3584,2560,16,64,128,32,4,4,767.3743333333333,3
w13,4,64,8,3584,2560,16,64,128,32,8,2,768.1853333333333,3
w13,4,64,8,3584,2560,16,64,128,32,8,3,767.5243333333334,3
w13,4,64,8,3584,2560,16,64,128,32,8,4,768.6973333333332,3
w13,4,64,8,3584,2560,16,64,128,64,4,2,767.3000000000001,3
w13,4,64,8,3584,2560,16,64,128,64,4,3,768.1853333333333,3
w13,4,64,8,3584,2560,16,64,128,64,4,4,767.5026666666666,3
w13,4,64,8,3584,2560,16,64,128,64,8,2,767.9826666666667,3
w13,4,64,8,3584,2560,16,64,128,64,8,3,767.7053333333333,3
w13,4,64,8,3584,2560,16,64,128,64,8,4,767.9720000000001,3
w13,4,64,8,3584,2560,16,64,256,1,4,2,766.5,3
w13,4,64,8,3584,2560,16,64,256,1,4,3,767.0010000000001,3
w13,4,64,8,3584,2560,16,64,256,1,8,2,767.2893333333333,3
w13,4,64,8,3584,2560,16,64,256,1,8,3,766.6170000000001,3
w13,4,64,8,3584,2560,16,64,256,16,4,2,767.5666666666666,3
w13,4,64,8,3584,2560,16,64,256,16,4,3,767.7370000000001,3
w13,4,64,8,3584,2560,16,64,256,16,8,2,768.0143333333334,3
w13,4,64,8,3584,2560,16,64,256,16,8,3,767.268,3
w13,4,64,8,3584,2560,16,64,256,32,4,2,767.9609999999999,3
w13,4,64,8,3584,2560,16,64,256,32,4,3,768.4626666666667,3
w13,4,64,8,3584,2560,16,64,256,32,8,2,767.9826666666667,3
w13,4,64,8,3584,2560,16,64,256,32,8,3,768.2063333333334,3
w13,4,64,8,3584,2560,16,64,256,64,4,2,768.1103333333334,3
w13,4,64,8,3584,2560,16,64,256,64,4,3,768.3023333333334,3
w13,4,64,8,3584,2560,16,64,256,64,8,2,768.1856666666666,3
w13,4,64,8,3584,2560,16,64,256,64,8,3,767.6626666666666,3
w13,4,64,8,3584,2560,16,128,64,1,4,3,771.6946666666666,3
w13,4,64,8,3584,2560,16,128,64,1,4,4,771.076,3
w13,4,64,8,3584,2560,16,128,64,1,8,3,770.5853333333333,3
w13,4,64,8,3584,2560,16,128,64,1,8,4,771.801,3
w13,4,64,8,3584,2560,16,128,64,16,4,4,772.7289999999999,3
w13,4,64,8,3584,2560,16,128,64,16,8,3,773.1026666666667,3
w13,4,64,8,3584,2560,16,128,64,32,4,4,772.9,3
w13,4,64,8,3584,2560,16,128,64,32,8,4,772.9423333333334,3
w13,4,64,8,3584,2560,16,128,64,64,8,3,773.0913333333334,3
w13,4,64,8,3584,2560,16,128,128,1,4,2,767.3426666666668,3
w13,4,64,8,3584,2560,16,128,128,1,4,3,767.8863333333334,3
w13,4,64,8,3584,2560,16,128,128,1,8,2,767.8116666666666,3
w13,4,64,8,3584,2560,16,128,128,1,8,3,766.628,3
w13,4,64,8,3584,2560,16,128,128,16,4,2,769.348,3
w13,4,64,8,3584,2560,16,128,128,16,4,3,768.3986666666666,3
w13,4,64,8,3584,2560,16,128,128,16,8,2,769.1346666666667,3
w13,4,64,8,3584,2560,16,128,128,16,8,3,767.9293333333334,3
w13,4,64,8,3584,2560,16,128,128,32,4,2,768.6653333333334,3
w13,4,64,8,3584,2560,16,128,128,32,4,3,768.3666666666667,3
w13,4,64,8,3584,2560,16,128,128,32,8,2,768.1210000000001,3
w13,4,64,8,3584,2560,16,128,128,32,8,3,767.4706666666666,3
w13,4,64,8,3584,2560,16,128,128,64,4,2,769.2093333333333,3
w13,4,64,8,3584,2560,16,128,128,64,4,3,769.1133333333333,3
w13,4,64,8,3584,2560,16,128,128,64,8,2,767.9609999999999,3
w13,4,64,8,3584,2560,16,128,128,64,8,3,767.0973333333333,3
w13,4,64,8,3584,2560,32,16,128,4,4,2,765.668,3
w13,4,64,8,3584,2560,32,16,128,4,4,3,766.4566666666666,3
w13,4,64,8,3584,2560,32,16,128,4,4,4,768.2173333333334,3
w13,4,64,8,3584,2560,32,16,128,4,8,3,767.428,3
w13,4,64,8,3584,2560,32,16,128,4,8,4,770.5213333333332,3
w13,4,64,8,3584,2560,32,32,64,1,4,3,769.156,3
w13,4,64,8,3584,2560,32,32,64,1,4,4,771.6303333333334,3
w13,4,64,8,3584,2560,32,32,64,1,8,3,769.7426666666667,3
w13,4,64,8,3584,2560,32,32,64,1,8,4,772.7400000000001,3
w13,4,64,8,3584,2560,32,32,64,32,4,3,771.8013333333333,3
w13,4,64,8,3584,2560,32,32,64,32,4,4,772.6973333333334,3
w13,4,64,8,3584,2560,32,32,64,32,8,3,771.524,3
w13,4,64,8,3584,2560,32,32,64,64,4,3,772.8253333333332,3
w13,4,64,8,3584,2560,32,32,64,64,4,4,772.8249999999999,3
w13,4,64,8,3584,2560,32,32,64,64,8,3,772.0143333333334,3
w13,4,64,8,3584,2560,32,32,64,64,8,4,772.9,3
w13,4,64,8,3584,2560,32,32,64,128,4,3,772.6863333333334,3
w13,4,64,8,3584,2560,32,32,64,128,4,4,773.06,3
w13,4,64,8,3584,2560,32,32,64,128,8,4,773.1666666666666,3
w13,4,64,8,3584,2560,32,32,128,1,4,2,765.5186666666667,3
w13,4,64,8,3584,2560,32,32,128,1,4,3,769.8066666666667,3
w13,4,64,8,3584,2560,32,32,128,1,4,4,767.0009999999999,3
w13,4,64,8,3584,2560,32,32,128,1,8,2,767.033,3
w13,4,64,8,3584,2560,32,32,128,1,8,4,767.6943333333334,3
w13,4,64,8,3584,2560,32,32,128,4,4,2,767.4813333333333,3
w13,4,64,8,3584,2560,32,32,128,4,4,3,771.5343333333334,3
w13,4,64,8,3584,2560,32,32,128,4,4,4,767.1613333333333,3
w13,4,64,8,3584,2560,32,32,128,4,8,2,767.5666666666666,3
w13,4,64,8,3584,2560,32,32,128,4,8,4,767.375,3
w13,4,64,8,3584,2560,32,32,128,16,4,2,769.1986666666667,3
w13,4,64,8,3584,2560,32,32,128,16,4,3,770.5210000000001,3
w13,4,64,8,3584,2560,32,32,128,16,4,4,767.3213333333333,3
w13,4,64,8,3584,2560,32,32,128,16,8,2,769.0279999999999,3
w13,4,64,8,3584,2560,32,32,128,16,8,3,773.1663333333332,3
w13,4,64,8,3584,2560,32,32,128,16,8,4,767.9933333333333,3
w13,4,64,8,3584,2560,32,32,128,64,4,2,768.3556666666667,3
w13,4,64,8,3584,2560,32,32,128,64,4,3,771.3213333333333,3
w13,4,64,8,3584,2560,32,32,128,64,4,4,767.9506666666666,3
w13,4,64,8,3584,2560,32,32,128,64,8,2,768.292,3
w13,4,64,8,3584,2560,32,32,128,64,8,4,768.676,3
w13,4,64,8,3584,2560,32,32,256,1,4,2,770.7453333333333,3
w13,4,64,8,3584,2560,32,32,256,1,4,3,768.0356666666667,3
w13,4,64,8,3584,2560,32,32,256,1,4,4,767.0013333333333,3
w13,4,64,8,3584,2560,32,32,256,1,8,2,772.0786666666667,3
w13,4,64,8,3584,2560,32,32,256,1,8,3,767.7583333333333,3
w13,4,64,8,3584,2560,32,32,256,1,8,4,768.228,3
w13,4,64,8,3584,2560,32,32,256,4,4,3,768.1,3
w13,4,64,8,3584,2560,32,32,256,4,4,4,767.2146666666667,3
w13,4,64,8,3584,2560,32,32,256,4,8,3,767.748,3
w13,4,64,8,3584,2560,32,32,256,4,8,4,767.364,3
w13,4,64,8,3584,2560,32,32,256,16,4,3,768.3666666666667,3
w13,4,64,8,3584,2560,32,32,256,16,4,4,768.1426666666666,3
w13,4,64,8,3584,2560,32,32,256,16,8,3,768.0360000000001,3
w13,4,64,8,3584,2560,32,32,256,16,8,4,768.0679999999999,3
w13,4,64,8,3584,2560,32,32,256,32,4,3,768.985,3
w13,4,64,8,3584,2560,32,32,256,32,4,4,768.3879999999999,3
w13,4,64,8,3584,2560,32,32,256,32,8,3,768.9319999999999,3
w13,4,64,8,3584,2560,32,32,256,32,8,4,768.9213333333333,3
w13,4,64,8,3584,2560,32,64,64,1,4,3,772.3026666666666,3
w13,4,64,8,3584,2560,32,64,64,1,4,4,771.4386666666666,3
w13,4,64,8,3584,2560,32,64,64,1,8,3,770.9373333333333,3
w13,4,64,8,3584,2560,32,64,64,1,8,4,771.428,3
w13,4,64,8,3584,2560,32,64,64,16,8,3,772.3879999999999,3
w13,4,64,8,3584,2560,32,64,64,64,8,3,772.3240000000001,3
w13,4,64,8,3584,2560,32,64,128,1,4,2,767.2040000000001,3
w13,4,64,8,3584,2560,32,64,128,1,4,3,766.8843333333334,3
w13,4,64,8,3584,2560,32,64,128,1,4,4,767.076,3
w13,4,64,8,3584,2560,32,64,128,1,8,2,767.2576666666668,3
w13,4,64,8,3584,2560,32,64,128,1,8,3,766.8626666666668,3
w13,4,64,8,3584,2560,32,64,128,1,8,4,767.1826666666666,3
w13,4,64,8,3584,2560,32,64,128,4,4,2,767.7693333333333,3
w13,4,64,8,3584,2560,32,64,128,4,4,3,767.6306666666666,3
w13,4,64,8,3584,2560,32,64,128,4,4,4,766.8523333333333,3
w13,4,64,8,3584,2560,32,64,128,4,8,2,767.62,3
w13,4,64,8,3584,2560,32,64,128,4,8,3,767.6839999999999,3
w13,4,64,8,3584,2560,32,64,128,4,8,4,766.6706666666665,3
w13,4,64,8,3584,2560,32,64,128,16,4,2,768.3879999999999,3
w13,4,64,8,3584,2560,32,64,128,16,4,3,769.0603333333333,3
w13,4,64,8,3584,2560,32,64,128,16,4,4,767.6516666666666,3
w13,4,64,8,3584,2560,32,64,128,16,8,2,769.1876666666667,3
w13,4,64,8,3584,2560,32,64,128,16,8,3,768.0896666666667,3
w13,4,64,8,3584,2560,32,64,128,16,8,4,767.6626666666667,3
w13,4,64,8,3584,2560,32,64,128,32,4,2,768.0576666666666,3
w13,4,64,8,3584,2560,32,64,128,32,4,3,768.8683333333333,3
w13,4,64,8,3584,2560,32,64,128,32,4,4,768.0790000000001,3
w13,4,64,8,3584,2560,32,64,128,32,8,2,768.3986666666666,3
w13,4,64,8,3584,2560,32,64,128,32,8,3,768.0786666666667,3
w13,4,64,8,3584,2560,32,64,128,32,8,4,768.9216666666666,3
w13,4,64,8,3584,2560,32,64,128,64,4,2,768.5799999999999,3
w13,4,64,8,3584,2560,32,64,128,64,4,3,768.8789999999999,3
w13,4,64,8,3584,2560,32,64,128,64,4,4,767.919,3
w13,4,64,8,3584,2560,32,64,128,64,8,2,768.6336666666666,3
w13,4,64,8,3584,2560,32,64,128,64,8,3,767.6093333333333,3
w13,4,64,8,3584,2560,32,64,128,64,8,4,768.4626666666667,3
w13,4,64,8,3584,2560,32,64,256,1,4,2,767.3960000000001,3
w13,4,64,8,3584,2560,32,64,256,1,4,3,767.5023333333334,3
w13,4,64,8,3584,2560,32,64,256,1,8,2,769.5826666666667,3
w13,4,64,8,3584,2560,32,64,256,1,8,3,766.8626666666665,3
w13,4,64,8,3584,2560,32,64,256,8,4,2,767.3636666666666,3
w13,4,64,8,3584,2560,32,64,256,8,4,3,767.9506666666666,3
w13,4,64,8,3584,2560,32,64,256,8,8,2,767.3323333333333,3
w13,4,64,8,3584,2560,32,64,256,8,8,3,766.948,3
w13,4,64,8,3584,2560,32,64,256,16,4,2,767.652,3
w13,4,64,8,3584,2560,32,64,256,16,4,3,768.132,3
w13,4,64,8,3584,2560,32,64,256,16,8,2,768.2063333333334,3
w13,4,64,8,3584,2560,32,64,256,16,8,3,767.4923333333332,3
w13,4,64,8,3584,2560,32,64,256,32,4,2,768.3879999999999,3
w13,4,64,8,3584,2560,32,64,256,32,4,3,768.6016666666666,3
w13,4,64,8,3584,2560,32,64,256,32,8,2,767.8116666666666,3
w13,4,64,8,3584,2560,32,64,256,32,8,3,768.217,3
w13,4,64,8,3584,2560,32,64,256,64,4,2,768.2493333333333,3
w13,4,64,8,3584,2560,32,64,256,64,4,3,769.0066666666667,3
w13,4,64,8,3584,2560,32,64,256,64,8,2,768.324,3
w13,4,64,8,3584,2560,32,64,256,64,8,3,768.3883333333333,3
w13,4,64,8,3584,2560,32,128,64,1,4,4,773.092,3
w13,4,64,8,3584,2560,32,128,64,1,8,4,772.708,3
w13,4,64,8,3584,2560,32,128,64,4,4,4,772.0679999999999,3
w13,4,64,8,3584,2560,32,128,64,4,8,4,772.6439999999999,3
w13,4,64,8,3584,2560,32,128,128,1,4,2,768.6653333333334,3
w13,4,64,8,3584,2560,32,128,128,1,4,3,768.2386666666666,3
w13,4,64,8,3584,2560,32,128,128,1,8,2,767.5456666666668,3
w13,4,64,8,3584,2560,32,128,128,1,8,3,767.0653333333333,3
w13,4,64,8,3584,2560,32,128,128,4,4,2,769.1773333333334,3
w13,4,64,8,3584,2560,32,128,128,4,4,3,768.0679999999999,3
w13,4,64,8,3584,2560,32,128,128,4,8,2,768.2280000000001,3
w13,4,64,8,3584,2560,32,128,128,4,8,3,767.343,3
w13,4,64,8,3584,2560,32,128,128,8,4,2,769.6790000000001,3
w13,4,64,8,3584,2560,32,128,128,8,4,3,768.6226666666666,3
w13,4,64,8,3584,2560,32,128,128,8,8,2,770.4253333333332,3
w13,4,64,8,3584,2560,32,128,128,8,8,3,767.7800000000001,3
w13,4,64,8,3584,2560,32,128,128,16,4,2,770.7883333333333,3
w13,4,64,8,3584,2560,32,128,128,16,4,3,768.7296666666666,3
w13,4,64,8,3584,2560,32,128,128,16,8,2,770.7986666666666,3
w13,4,64,8,3584,2560,32,128,128,16,8,3,768.2493333333333,3
w13,4,64,8,3584,2560,32,128,128,32,4,2,770.1586666666667,3
w13,4,64,8,3584,2560,32,128,128,32,4,3,768.9639999999999,3
w13,4,64,8,3584,2560,32,128,128,32,8,2,768.7936666666668,3
w13,4,64,8,3584,2560,32,128,128,32,8,3,767.8543333333333,3
w13,4,64,8,3584,2560,32,128,128,64,4,2,769.9666666666667,3
w13,4,64,8,3584,2560,32,128,128,64,4,3,769.391,3
w13,4,64,8,3584,2560,32,128,128,64,8,2,769.4119999999999,3
w13,4,64,8,3584,2560,32,128,128,64,8,3,767.62,3
w13,4,64,8,3584,2560,64,16,128,1,4,2,771.46,3
w13,4,64,8,3584,2560,64,32,128,1,4,2,767.695,3
w13,4,64,8,3584,2560,64,32,128,1,4,3,767.5773333333333,3
w13,4,64,8,3584,2560,64,32,128,1,4,4,772.0466666666666,3
w13,4,64,8,3584,2560,64,32,128,1,8,2,768.0573333333333,3
w13,4,64,8,3584,2560,64,32,128,1,8,3,768.2710000000001,3
w13,4,64,8,3584,2560,64,32,128,1,8,4,771.535,3
w13,4,64,8,3584,2560,64,32,128,16,4,2,769.263,3
w13,4,64,8,3584,2560,64,32,128,16,4,3,769.1666666666666,3
w13,4,64,8,3584,2560,64,32,128,16,8,2,770.4676666666668,3
w13,4,64,8,3584,2560,64,32,128,16,8,3,768.8786666666666,3
w13,4,64,8,3584,2560,64,32,256,1,4,2,768.0256666666666,3
w13,4,64,8,3584,2560,64,32,256,1,4,3,769.8813333333334,3
w13,4,64,8,3584,2560,64,32,256,1,8,2,768.569,3
w13,4,64,8,3584,2560,64,32,256,1,8,3,769.6146666666667,3
w13,4,64,8,3584,2560,64,64,64,1,4,4,772.8253333333333,3
w13,4,64,8,3584,2560,64,64,64,4,4,4,773.1563333333334,3
w13,4,64,8,3584,2560,64,64,128,1,4,2,768.0680000000001,3
w13,4,64,8,3584,2560,64,64,128,1,4,3,768.4413333333333,3
w13,4,64,8,3584,2560,64,64,128,1,4,4,767.6946666666666,3
w13,4,64,8,3584,2560,64,64,128,1,8,2,767.9186666666666,3
w13,4,64,8,3584,2560,64,64,128,1,8,3,767.5876666666667,3
w13,4,64,8,3584,2560,64,64,128,1,8,4,768.5903333333332,3
w13,4,64,8,3584,2560,64,64,128,4,4,2,769.348,3
w13,4,64,8,3584,2560,64,64,128,4,4,3,769.5186666666667,3
w13,4,64,8,3584,2560,64,64,128,4,4,4,768.5586666666667,3
w13,4,64,8,3584,2560,64,64,128,4,8,2,768.7933333333334,3
w13,4,64,8,3584,2560,64,64,128,4,8,3,769.0279999999999,3
w13,4,64,8,3584,2560,64,64,128,4,8,4,768.1743333333334,3
w13,4,64,8,3584,2560,64,64,128,8,4,2,771.2146666666667,3
w13,4,64,8,3584,2560,64,64,128,8,4,3,769.1026666666667,3
w13,4,64,8,3584,2560,64,64,128,8,4,4,768.569,3
w13,4,64,8,3584,2560,64,64,128,8,8,2,771.5136666666667,3
w13,4,64,8,3584,2560,64,64,128,8,8,3,768.6973333333334,3
w13,4,64,8,3584,2560,64,64,128,8,8,4,768.6333333333333,3
w13,4,64,8,3584,2560,64,64,128,16,4,2,770.0093333333334,3
w13,4,64,8,3584,2560,64,64,128,16,4,3,770.735,3
w13,4,64,8,3584,2560,64,64,128,16,4,4,769.2946666666667,3
w13,4,64,8,3584,2560,64,64,128,16,8,2,771.6626666666666,3
w13,4,64,8,3584,2560,64,64,128,16,8,3,770.948,3
w13,4,64,8,3584,2560,64,64,128,16,8,4,769.0283333333333,3
w13,4,64,8,3584,2560,64,64,128,32,4,2,770.2336666666666,3
w13,4,64,8,3584,2560,64,64,128,32,4,3,773.1239999999999,3
w13,4,64,8,3584,2560,64,64,128,32,4,4,769.8919999999999,3
w13,4,64,8,3584,2560,64,64,128,32,8,2,771.7696666666667,3
w13,4,64,8,3584,2560,64,64,128,32,8,4,769.54,3
w13,4,64,8,3584,2560,64,64,128,64,4,2,770.0623333333333,3
w13,4,64,8,3584,2560,64,64,128,64,4,4,769.9346666666667,3
w13,4,64,8,3584,2560,64,64,128,64,8,2,772.473,3
w13,4,64,8,3584,2560,64,64,128,64,8,4,769.7533333333334,3
w13,4,64,8,3584,2560,64,128,128,1,8,3,768.6333333333333,3
w13,4,64,8,3584,2560,64,128,128,4,8,3,770.2336666666666,3
w13,4,64,8,3584,2560,64,128,128,16,8,3,770.02,3
w13,4,64,8,3584,2560,64,128,128,32,8,3,770.1053333333333,3
w13,4,64,8,3584,2560,64,128,128,64,8,3,769.3159999999999,3
w13,4,64,8,3584,2560,128,64,128,1,4,3,772.9853333333334,3
w13,4,64,8,3584,2560,128,64,128,1,8,3,771.1080000000001,3
w13,4,128,4,2048,512,16,32,128,16,4,3,12.567333333333332,3
w13,4,128,4,2048,512,16,32,128,32,4,3,12.525,3
w13,4,128,4,2048,512,16,32,128,64,4,3,12.567333333333332,3
w13,4,128,4,2048,512,16,64,64,1,4,4,12.546,3
w13,4,128,4,2048,512,16,64,64,16,4,4,12.620666666666665,3
w13,4,128,4,2048,512,16,64,64,32,4,4,12.577666666666666,3
w13,4,128,4,2048,512,16,64,64,64,4,4,12.631666666666666,3
w13,4,128,6,4096,2048,16,16,64,1,4,3,528.6743333333333,3
w13,4,128,6,4096,2048,16,16,64,1,4,4,529.0369999999999,3
w13,4,128,6,4096,2048,16,16,64,1,8,4,527.5973333333333,3
w13,4,128,6,4096,2048,16,16,128,1,4,2,527.427,3
w13,4,128,6,4096,2048,16,16,128,1,4,3,526.3816666666667,3
w13,4,128,6,4096,2048,16,16,128,1,8,3,527.256,3
w13,4,128,6,4096,2048,16,16,128,4,4,2,527.1916666666667,3
w13,4,128,6,4096,2048,16,16,128,4,4,3,526.2103333333333,3
w13,4,128,6,4096,2048,16,16,128,4,4,4,529.0266666666666,3
w13,4,128,6,4096,2048,16,16,128,4,8,3,527.49,3
w13,4,128,6,4096,2048,16,16,256,1,4,2,526.2423333333332,3
w13,4,128,6,4096,2048,16,16,256,1,4,3,526.605,3
w13,4,128,6,4096,2048,16,16,256,1,4,4,527.832,3
w13,4,128,6,4096,2048,16,16,256,1,8,3,528.7063333333334,3
w13,4,128,6,4096,2048,16,16,256,4,4,2,526.04,3
w13,4,128,6,4096,2048,16,16,256,4,4,3,526.68,3
w13,4,128,6,4096,2048,16,16,256,4,4,4,527.0533333333334,3
w13,4,128,6,4096,2048,16,16,256,4,8,3,527.651,3
w13,4,128,6,4096,2048,16,16,256,4,8,4,528.835,3
w13,4,128,6,4096,2048,16,32,64,1,4,2,527.5016666666667,3
w13,4,128,6,4096,2048,16,32,64,1,4,3,525.4536666666667,3
w13,4,128,6,4096,2048,16,32,64,1,4,4,526.0616666666666,3
w13,4,128,6,4096,2048,16,32,64,1,8,2,527.2776666666667,3
w13,4,128,6,4096,2048,16,32,64,1,8,3,528.6963333333333,3
w13,4,128,6,4096,2048,16,32,64,16,4,3,528.1416666666668,3
w13,4,128,6,4096,2048,16,32,64,16,4,4,528.099,3
w13,4,128,6,4096,2048,16,32,64,16,8,3,527.9920000000001,3
w13,4,128,6,4096,2048,16,32,64,32,4,3,527.0103333333333,3
w13,4,128,6,4096,2048,16,32,64,32,4,4,528.6743333333334,3
w13,4,128,6,4096,2048,16,32,64,32,8,3,528.9416666666667,3
w13,4,128,6,4096,2048,16,32,64,32,8,4,528.2376666666667,3
w13,4,128,6,4096,2048,16,32,64,64,4,3,527.2243333333332,3
w13,4,128,6,4096,2048,16,32,64,64,4,4,528.3336666666668,3
w13,4,128,6,4096,2048,16,32,64,64,8,3,529.2189999999999,3
w13,4,128,6,4096,2048,16,32,64,64,8,4,528.3443333333333,3
w13,4,128,6,4096,2048,16,32,128,1,4,2,524.2696666666667,3
w13,4,128,6,4096,2048,16,32,128,1,4,4,526.712,3
w13,4,128,6,4096,2048,16,32,128,1,8,2,528.419,3
w13,4,128,6,4096,2048,16,32,128,1,8,4,529.2616666666667,3
w13,4,128,6,4096,2048,16,32,128,4,4,2,525.4423333333333,3
w13,4,128,6,4096,2048,16,32,128,4,4,4,526.68,3
w13,4,128,6,4096,2048,16,32,128,4,8,2,528.301,3
w13,4,128,6,4096,2048,16,32,128,4,8,4,528.7706666666667,3
w13,4,128,6,4096,2048,16,32,128,16,4,2,525.837,3
w13,4,128,6,4096,2048,16,32,128,16,4,4,526.978,3
w13,4,128,6,4096,2048,16,32,128,16,8,2,529.0583333333333,3
w13,4,128,6,4096,2048,16,32,128,32,4,2,526.1036666666668,3
w13,4,128,6,4096,2048,16,32,128,32,4,4,528.4716666666667,3
w13,4,128,6,4096,2048,16,32,128,32,8,2,528.6746666666667,3
w13,4,128,6,4096,2048,16,32,128,64,4,2,525.4536666666667,3
w13,4,128,6,4096,2048,16,32,128,64,4,3,529.4533333333334,3
w13,4,128,6,4096,2048,16,32,128,64,4,4,528.9523333333333,3
w13,4,128,6,4096,2048,16,32,256,1,4,3,527.9923333333334,3
w13,4,128,6,4096,2048,16,32,256,1,4,4,526.8190000000001,3
w13,4,128,6,4096,2048,16,32,256,1,8,4,528.1416666666668,3
w13,4,128,6,4096,2048,16,32,256,16,4,4,527.2130000000001,3
w13,4,128,6,4096,2048,16,32,256,16,8,4,527.6613333333333,3
w13,4,128,6,4096,2048,16,32,256,32,4,4,528.1626666666666,3
w13,4,128,6,4096,2048,16,32,256,32,8,4,528.003,3
w13,4,128,6,4096,2048,16,32,256,64,4,4,527.3096666666667,3
w13,4,128,6,4096,2048,16,32,256,64,8,4,528.5043333333333,3
w13,4,128,6,4096,2048,16,64,64,1,4,2,526.9256666666666,3
w13,4,128,6,4096,2048,16,64,64,1,4,4,526.7123333333334,3
w13,4,128,6,4096,2048,16,64,64,1,8,2,527.288,3
w13,4,128,6,4096,2048,16,64,64,1,8,4,528.6216666666667,3
w13,4,128,6,4096,2048,16,64,64,16,4,2,527.8103333333333,3
w13,4,128,6,4096,2048,16,64,64,16,4,4,529.5169999999999,3
w13,4,128,6,4096,2048,16,64,64,32,4,2,528.611,3
w13,4,128,6,4096,2048,16,64,64,32,4,4,528.067,3
w13,4,128,6,4096,2048,16,64,64,32,8,4,528.835,3
w13,4,128,6,4096,2048,16,64,64,64,4,2,528.7283333333334,3
w13,4,128,6,4096,2048,16,64,64,64,4,4,527.7896666666667,3
w13,4,128,6,4096,2048,16,64,64,64,8,4,529.3356666666667,3
w13,4,128,6,4096,2048,16,64,128,1,4,4,527.2243333333333,3
w13,4,128,6,4096,2048,16,64,128,1,8,4,527.3736666666666,3
w13,4,128,6,4096,2048,16,64,128,16,4,3,529.0590000000001,3
w13,4,128,6,4096,2048,16,64,128,32,4,3,528.4286666666667,3
w13,4,128,6,4096,2048,16,64,128,32,8,3,528.3653333333333,3
w13,4,128,6,4096,2048,16,64,128,64,4,3,528.8663333333333,3
w13,4,128,6,4096,2048,16,64,128,64,8,3,529.0373333333333,3
w13,4,128,6,4096,2048,16,128,64,64,8,2,529.1123333333334,3
w13,4,128,6,4096,2048,32,16,128,4,4,2,526.2106666666667,3
w13,4,128,6,4096,2048,32,16,128,4,4,4,527.2663333333334,3
w13,4,128,6,4096,2048,32,32,64,1,4,2,529.5070000000001,3
w13,4,128,6,4096,2048,32,32,64,1,4,3,526.5736666666667,3
w13,4,128,6,4096,2048,32,32,64,1,8,2,527.6403333333334,3
w13,4,128,6,4096,2048,32,32,64,1,8,3,528.195,3
w13,4,128,6,4096,2048,32,32,64,32,4,3,528.6316666666667,3
w13,4,128,6,4096,2048,32,32,64,64,4,3,527.874,3
w13,4,128,6,4096,2048,32,32,64,128,4,3,528.291,3
w13,4,128,6,4096,2048,32,32,128,1,4,2,526.0406666666667,3
w13,4,128,6,4096,2048,32,32,128,1,4,3,526.3173333333333,3
w13,4,128,6,4096,2048,32,32,128,1,4,4,528.2686666666667,3
w13,4,128,6,4096,2048,32,32,128,1,8,2,528.2586666666666,3
w13,4,128,6,4096,2048,32,32,128,1,8,3,526.5946666666667,3
w13,4,128,6,4096,2048,32,32,128,4,4,2,526.2003333333333,3
w13,4,128,6,4096,2048,32,32,128,4,4,3,527.0213333333332,3
w13,4,128,6,4096,2048,32,32,128,4,4,4,528.3763333333333,3
w13,4,128,6,4096,2048,32,32,128,4,8,2,529.4536666666667,3
w13,4,128,6,4096,2048,32,32,128,4,8,3,527.0856666666667,3
w13,4,128,6,4096,2048,32,32,128,16,4,2,526.8936666666667,3
w13,4,128,6,4096,2048,32,32,128,16,4,3,526.5843333333333,3
w13,4,128,6,4096,2048,32,32,128,16,4,4,529.1973333333334,3
w13,4,128,6,4096,2048,32,32,128,16,8,3,526.5943333333333,3
w13,4,128,6,4096,2048,32,32,128,64,4,2,527.3946666666667,3
w13,4,128,6,4096,2048,32,32,128,64,4,3,526.3276666666667,3
w13,4,128,6,4096,2048,32,32,128,64,8,2,529.5176666666666,3
w13,4,128,6,4096,2048,32,32,128,64,8,3,526.627,3
w13,4,128,6,4096,2048,32,32,256,1,4,2,524.8456666666667,3
w13,4,128,6,4096,2048,32,32,256,1,4,3,527.0216666666666,3
w13,4,128,6,4096,2048,32,32,256,1,4,4,527.3736666666667,3
w13,4,128,6,4096,2048,32,32,256,1,8,2,527.0749999999999,3
w13,4,128,6,4096,2048,32,32,256,1,8,3,526.3816666666667,3
w13,4,128,6,4096,2048,32,32,256,1,8,4,526.947,3
w13,4,128,6,4096,2048,32,32,256,4,4,2,527.459,3
w13,4,128,6,4096,2048,32,32,256,4,4,3,526.808,3
w13,4,128,6,4096,2048,32,32,256,4,4,4,527.1383333333333,3
w13,4,128,6,4096,2048,32,32,256,4,8,2,527.7253333333333,3
w13,4,128,6,4096,2048,32,32,256,4,8,3,526.4456666666666,3
w13,4,128,6,4096,2048,32,32,256,4,8,4,527.1070000000001,3
w13,4,128,6,4096,2048,32,32,256,16,4,2,526.9256666666666,3
w13,4,128,6,4096,2048,32,32,256,16,4,3,526.8936666666667,3
w13,4,128,6,4096,2048,32,32,256,16,4,4,527.4056666666667,3
w13,4,128,6,4096,2048,32,32,256,16,8,2,526.9576666666667,3
w13,4,128,6,4096,2048,32,32,256,16,8,3,526.4776666666667,3
w13,4,128,6,4096,2048,32,32,256,16,8,4,528.451,3
w13,4,128,6,4096,2048,32,32,256,32,4,2,527.4053333333333,3
w13,4,128,6,4096,2048,32,32,256,32,4,3,526.7976666666667,3
w13,4,128,6,4096,2048,32,32,256,32,4,4,527.3306666666666,3
w13,4,128,6,4096,2048,32,32,256,32,8,2,527.0426666666667,3
w13,4,128,6,4096,2048,32,32,256,32,8,3,526.5943333333333,3
w13,4,128,6,4096,2048,32,32,256,32,8,4,527.6186666666666,3
w13,4,128,6,4096,2048,32,64,64,1,8,2,528.1089999999999,3
w13,4,128,6,4096,2048,32,64,128,1,4,4,528.227,3
w13,4,128,6,4096,2048,32,64,128,1,8,4,529.1543333333333,3
w13,4,128,6,4096,2048,32,64,128,4,4,4,528.9203333333334,3
w13,4,128,6,4096,2048,32,64,128,4,8,4,529.4313333333333,3
w13,4,128,6,4096,2048,32,128,64,1,8,2,528.1836666666667,3
w13,4,128,6,4096,2048,64,32,256,1,4,3,528.1306666666667,3
w13,4,128,6,4096,2048,64,32,256,1,8,3,527.747,3
w13,4,128,6,4096,2048,64,64,128,1,4,2,526.9789999999999,3
w13,4,128,6,4096,2048,64,64,128,4,4,2,526.9256666666666,3
w13,4,128,6,4096,2048,64,64,128,8,4,2,527.235,3
w13,4,128,6,4096,2048,64,64,128,16,4,2,527.203,3
w13,4,128,6,4096,2048,64,64,128,32,4,2,527.2136666666667,3
w13,4,128,6,4096,2048,64,64,128,64,4,2,527.6723333333333,3
w13,4,128,8,2048,768,16,32,64,1,4,2,118.51933333333334,3
w13,4,128,8,2048,768,32,32,64,1,4,2,118.97833333333334,3
w13,4,128,8,4096,1536,16,16,64,1,4,3,528.0666666666666,3
w13,4,128,8,4096,1536,16,16,64,1,4,4,528.9623333333334,3
w13,4,128,8,4096,1536,16,16,64,1,8,4,527.2666666666668,3
w13,4,128,8,4096,1536,16,16,128,1,4,2,527.5866666666667,3
w13,4,128,8,4096,1536,16,16,128,1,4,3,526.5306666666667,3
w13,4,128,8,4096,1536,16,16,128,1,4,4,528.6533333333333,3
w13,4,128,8,4096,1536,16,16,128,1,8,2,529.997,3
w13,4,128,8,4096,1536,16,16,128,1,8,3,527.1063333333333,3
w13,4,128,8,4096,1536,16,16,128,4,4,2,527.9283333333333,3
w13,4,128,8,4096,1536,16,16,128,4,4,3,526.36,3
w13,4,128,8,4096,1536,16,16,128,4,8,3,527.4050000000001,3
w13,4,128,8,4096,1536,16,16,256,1,4,2,526.7226666666667,3
w13,4,128,8,4096,1536,16,16,256,1,4,3,526.7013333333333,3
w13,4,128,8,4096,1536,16,16,256,1,4,4,527.0533333333333,3
w13,4,128,8,4096,1536,16,16,256,1,8,3,527.4903333333333,3
w13,4,128,8,4096,1536,16,16,256,1,8,4,529.2933333333334,3
w13,4,128,8,4096,1536,16,16,256,4,4,2,526.0186666666667,3
w13,4,128,8,4096,1536,16,16,256,4,4,3,526.9146666666667,3
w13,4,128,8,4096,1536,16,16,256,4,4,4,527.5116666666667,3
w13,4,128,8,4096,1536,16,16,256,4,8,3,528.2373333333334,3
w13,4,128,8,4096,1536,16,16,256,4,8,4,528.7063333333334,3
w13,4,128,8,4096,1536,16,32,64,1,4,2,527.2556666666667,3
w13,4,128,8,4096,1536,16,32,64,1,4,3,525.4636666666667,3
w13,4,128,8,4096,1536,16,32,64,1,4,4,525.7196666666667,3
w13,4,128,8,4096,1536,16,32,64,1,8,2,527.949,3
w13,4,128,8,4096,1536,16,32,64,1,8,3,527.7356666666666,3
w13,4,128,8,4096,1536,16,32,64,1,8,4,527.288,3
w13,4,128,8,4096,1536,16,32,64,16,4,4,528.899,3
w13,4,128,8,4096,1536,16,32,64,32,4,3,526.349,3
w13,4,128,8,4096,1536,16,32,64,32,4,4,528.2800000000001,3
w13,4,128,8,4096,1536,16,32,64,32,8,4,528.4826666666667,3
w13,4,128,8,4096,1536,16,32,64,64,4,3,526.1036666666668,3
w13,4,128,8,4096,1536,16,32,64,64,4,4,529.0799999999999,3
w13,4,128,8,4096,1536,16,32,64,64,8,4,528.7386666666666,3
w13,4,128,8,4096,1536,16,32,128,1,4,2,524.7066666666666,3
w13,4,128,8,4096,1536,16,32,128,1,4,4,526.8933333333333,3
w13,4,128,8,4096,1536,16,32,128,1,8,2,528.3226666666666,3
w13,4,128,8,4096,1536,16,32,128,1,8,4,529.1116666666667,3
w13,4,128,8,4096,1536,16,32,128,4,4,2,528.6423333333333,3
w13,4,128,8,4096,1536,16,32,128,4,4,4,529.0476666666667,3
w13,4,128,8,4096,1536,16,32,128,4,8,2,528.4823333333334,3
w13,4,128,8,4096,1536,16,32,128,32,4,2,526.7333333333332,3
w13,4,128,8,4096,1536,16,32,128,32,4,3,529.507,3
w13,4,128,8,4096,1536,16,32,128,32,8,2,528.0343333333334,3
w13,4,128,8,4096,1536,16,32,128,64,4,2,525.9013333333334,3
w13,4,128,8,4096,1536,16,32,128,64,4,3,529.8159999999999,3
w13,4,128,8,4096,1536,16,32,128,64,8,2,528.8236666666667,3
w13,4,128,8,4096,1536,16,32,256,1,4,3,527.736,3
w13,4,128,8,4096,1536,16,32,256,1,4,4,527.5116666666667,3
w13,4,128,8,4096,1536,16,32,256,1,8,3,529.9653333333333,3
w13,4,128,8,4096,1536,16,32,256,1,8,4,527.3416666666667,3
w13,4,128,8,4096,1536,16,32,256,16,4,4,529.8159999999999,3
w13,4,128,8,4096,1536,16,32,256,32,4,4,527.672,3
w13,4,128,8,4096,1536,16,32,256,32,8,4,527.928,3
w13,4,128,8,4096,1536,16,32,256,64,4,4,527.7783333333333,3
w13,4,128,8,4096,1536,16,32,256,64,8,4,527.9383333333334,3
w13,4,128,8,4096,1536,16,64,64,1,4,2,526.6906666666667,3
w13,4,128,8,4096,1536,16,64,64,1,4,4,527.2983333333333,3
w13,4,128,8,4096,1536,16,64,64,1,8,2,527.523,3
w13,4,128,8,4096,1536,16,64,64,1,8,4,528.248,3
w13,4,128,8,4096,1536,16,64,64,16,4,2,526.68,3
w13,4,128,8,4096,1536,16,64,64,32,4,2,528.3436666666666,3
w13,4,128,8,4096,1536,16,64,64,64,4,2,528.2373333333334,3
w13,4,128,8,4096,1536,16,64,128,1,4,4,527.7570000000001,3
w13,4,128,8,4096,1536,16,64,128,1,8,4,527.6396666666666,3
w13,4,128,8,4096,1536,16,64,256,1,4,3,529.848,3
w13,4,128,8,4096,1536,16,128,64,16,8,4,529.4316666666667,3
w13,4,128,8,4096,1536,16,128,64,32,4,2,529.592,3
w13,4,128,8,4096,1536,16,128,64,32,4,4,529.8373333333333,3
w13,4,128,8,4096,1536,16,128,64,32,8,2,527.4266666666667,3
w13,4,128,8,4096,1536,16,128,64,32,8,4,528.5893333333333,3
w13,4,128,8,4096,1536,16,128,64,64,4,2,528.8133333333334,3
w13,4,128,8,4096,1536,16,128,64,64,4,4,529.5923333333334,3
w13,4,128,8,4096,1536,16,128,64,64,8,2,527.7783333333333,3
w13,4,128,8,4096,1536,16,128,64,64,8,4,528.6536666666667,3
w13,4,128,8,4096,1536,32,16,128,4,4,4,527.4373333333333,3
w13,4,128,8,4096,1536,32,32,64,1,4,2,529.2503333333333,3
w13,4,128,8,4096,1536,32,32,64,1,4,3,526.8933333333333,3
w13,4,128,8,4096,1536,32,32,64,1,8,2,527.8853333333333,3
w13,4,128,8,4096,1536,32,32,64,1,8,3,528.7916666666666,3
w13,4,128,8,4096,1536,32,32,64,32,4,3,527.4476666666666,3
w13,4,128,8,4096,1536,32,32,64,32,8,3,529.5386666666667,3
w13,4,128,8,4096,1536,32,32,64,64,4,3,526.5623333333334,3
w13,4,128,8,4096,1536,32,32,64,64,8,3,528.888,3
w13,4,128,8,4096,1536,32,32,64,128,4,3,527.2666666666668,3
w13,4,128,8,4096,1536,32,32,64,128,8,3,529.496,3
w13,4,128,8,4096,1536,32,32,128,1,4,2,526.1573333333333,3
w13,4,128,8,4096,1536,32,32,128,1,4,3,527.032,3
w13,4,128,8,4096,1536,32,32,128,1,4,4,528.6636666666667,3
w13,4,128,8,4096,1536,32,32,128,1,8,2,528.2689999999999,3
w13,4,128,8,4096,1536,32,32,128,1,8,3,526.4556666666666,3
w13,4,128,8,4096,1536,32,32,128,4,4,2,527.8426666666667,3
w13,4,128,8,4096,1536,32,32,128,4,4,3,526.9143333333333,3
w13,4,128,8,4096,1536,32,32,128,4,8,2,529.1436666666667,3
w13,4,128,8,4096,1536,32,32,128,4,8,3,526.8716666666666,3
w13,4,128,8,4096,1536,32,32,128,16,4,2,529.9436666666667,3
w13,4,128,8,4096,1536,32,32,128,16,4,3,528.6853333333333,3
w13,4,128,8,4096,1536,32,32,128,16,8,3,528.504,3
w13,4,128,8,4096,1536,32,32,128,64,4,2,527.3093333333334,3
w13,4,128,8,4096,1536,32,32,128,64,8,2,529.5813333333334,3
w13,4,128,8,4096,1536,32,32,256,1,4,2,524.9946666666666,3
w13,4,128,8,4096,1536,32,32,256,1,4,3,526.7226666666667,3
w13,4,128,8,4096,1536,32,32,256,1,4,4,527.2986666666667,3
w13,4,128,8,4096,1536,32,32,256,1,8,2,527.32,3
w13,4,128,8,4096,1536,32,32,256,1,8,3,527.7146666666666,3
w13,4,128,8,4096,1536,32,32,256,1,8,4,527.5866666666667,3
w13,4,128,8,4096,1536,32,32,256,4,4,2,527.5756666666667,3
w13,4,128,8,4096,1536,32,32,256,4,4,3,526.8183333333333,3
w13,4,128,8,4096,1536,32,32,256,4,4,4,527.3736666666667,3
w13,4,128,8,4096,1536,32,32,256,4,8,2,527.0213333333332,3
w13,4,128,8,4096,1536,32,32,256,4,8,3,526.7866666666667,3
w13,4,128,8,4096,1536,32,32,256,4,8,4,526.776,3
w13,4,128,8,4096,1536,32,32,256,16,8,2,528.1306666666667,3
w13,4,128,8,4096,1536,32,32,256,32,4,2,529.101,3
w13,4,128,8,4096,1536,32,32,256,32,4,3,528.6106666666666,3
w13,4,128,8,4096,1536,32,32,256,32,4,4,527.7896666666667,3
w13,4,128,8,4096,1536,32,32,256,32,8,2,529.5276666666667,3
w13,4,128,8,4096,1536,32,32,256,32,8,3,527.2023333333333,3
w13,4,128,8,4096,1536,32,32,256,32,8,4,528.2906666666667,3
w13,4,128,8,4096,1536,32,64,64,1,8,2,529.3573333333334,3
w13,4,128,8,4096,1536,32,64,128,1,4,4,529.5703333333333,3
w13,4,128,8,4096,1536,32,64,128,1,8,4,528.4076666666666,3
w13,4,128,8,4096,1536,32,128,64,1,8,2,528.3223333333334,3
w13,4,128,8,4096,1536,64,32,256,1,4,3,528.8773333333334,3
w13,4,128,8,4096,1536,64,32,256,1,8,3,528.8133333333334,3
w13,4,128,8,4096,1536,64,64,128,1,4,2,528.3013333333333,3
w13,4,128,8,4096,3072,16,16,64,1,4,3,1055.3100000000002,3
w13,4,128,8,4096,3072,16,16,64,1,4,4,1054.2430000000002,3
w13,4,128,8,4096,3072,16,16,64,1,8,2,1056.2916666666667,3
w13,4,128,8,4096,3072,16,16,64,1,8,3,1051.3096666666668,3
w13,4,128,8,4096,3072,16,16,64,1,8,4,1051.3096666666668,3
w13,4,128,8,4096,3072,16,16,128,1,4,2,1049.3043333333333,3
w13,4,128,8,4096,3072,16,16,128,1,4,3,1053.6456666666666,3
w13,4,128,8,4096,3072,16,16,128,1,4,4,1051.2030000000002,3
w13,4,128,8,4096,3072,16,16,128,1,8,2,1049.5923333333333,3
w13,4,128,8,4096,3072,16,16,128,1,8,3,1055.0643333333335,3
w13,4,128,8,4096,3072,16,16,128,1,8,4,1055.714,3
w13,4,128,8,4096,3072,16,16,128,4,4,2,1050.2856666666667,3
w13,4,128,8,4096,3072,16,16,128,4,4,3,1055.0746666666666,3
w13,4,128,8,4096,3072,16,16,128,4,4,4,1049.8590000000002,3
w13,4,128,8,4096,3072,16,16,128,4,8,2,1049.5496666666666,3
w13,4,128,8,4096,3072,16,16,128,4,8,3,1056.0243333333333,3
w13,4,128,8,4096,3072,16,16,128,4,8,4,1055.4163333333333,3
w13,4,128,8,4096,3072,16,16,256,1,4,2,1050.6270000000002,3
w13,4,128,8,4096,3072,16,16,256,1,4,3,1049.2830000000001,3
w13,4,128,8,4096,3072,16,16,256,1,4,4,1051.747,3
w13,4,128,8,4096,3072,16,16,256,1,8,2,1055.523,3
w13,4,128,8,4096,3072,16,16,256,1,8,3,1051.8853333333334,3
w13,4,128,8,4096,3072,16,16,256,1,8,4,1053.827,3
w13,4,128,8,4096,3072,16,16,256,4,4,2,1052.0033333333333,3
w13,4,128,8,4096,3072,16,16,256,4,4,3,1049.539,3
w13,4,128,8,4096,3072,16,16,256,4,4,4,1049.987,3
w13,4,128,8,4096,3072,16,16,256,4,8,2,1053.443,3
w13,4,128,8,4096,3072,16,16,256,4,8,3,1050.6696666666667,3
w13,4,128,8,4096,3072,16,16,256,4,8,4,1052.0456666666666,3
w13,4,128,8,4096,3072,16,32,64,1,4,2,1052.7176666666667,3
w13,4,128,8,4096,3072,16,32,64,1,4,3,1048.7283333333332,3
w13,4,128,8,4096,3072,16,32,64,1,4,4,1050.8723333333335,3
w13,4,128,8,4096,3072,16,32,64,1,8,2,1051.8216666666667,3
w13,4,128,8,4096,3072,16,32,64,1,8,3,1049.4113333333332,3
w13,4,128,8,4096,3072,16,32,64,1,8,4,1049.187,3
w13,4,128,8,4096,3072,16,32,64,16,4,3,1053.6883333333333,3
w13,4,128,8,4096,3072,16,32,64,16,4,4,1054.2003333333334,3
w13,4,128,8,4096,3072,16,32,64,16,8,3,1052.7920000000001,3
w13,4,128,8,4096,3072,16,32,64,16,8,4,1053.3256666666666,3
w13,4,128,8,4096,3072,16,32,64,32,4,3,1057.5816666666667,3
w13,4,128,8,4096,3072,16,32,64,32,4,4,1050.3286666666665,3
w13,4,128,8,4096,3072,16,32,64,32,8,3,1051.8326666666665,3
w13,4,128,8,4096,3072,16,32,64,32,8,4,1051.1283333333333,3
w13,4,128,8,4096,3072,16,32,64,64,4,3,1057.5176666666666,3
w13,4,128,8,4096,3072,16,32,64,64,4,4,1050.8296666666668,3
w13,4,128,8,4096,3072,16,32,64,64,8,3,1053.0483333333334,3
w13,4,128,8,4096,3072,16,32,64,64,8,4,1051.0536666666667,3
w13,4,128,8,4096,3072,16,32,128,1,4,2,1048.8243333333332,3
w13,4,128,8,4096,3072,16,32,128,1,4,3,1049.827,3
w13,4,128,8,4096,3072,16,32,128,1,4,4,1050.211,3
w13,4,128,8,4096,3072,16,32,128,1,8,2,1048.3976666666667,3
w13,4,128,8,4096,3072,16,32,128,1,8,3,1056.5893333333333,3
w13,4,128,8,4096,3072,16,32,128,1,8,4,1051.491,3
w13,4,128,8,4096,3072,16,32,128,4,4,2,1048.5893333333333,3
w13,4,128,8,4096,3072,16,32,128,4,4,3,1051.0856666666666,3
w13,4,128,8,4096,3072,16,32,128,4,4,4,1050.4776666666667,3
w13,4,128,8,4096,3072,16,32,128,4,8,2,1049.1336666666666,3
w13,4,128,8,4096,3072,16,32,128,4,8,3,1057.166,3
w13,4,128,8,4096,3072,16,32,128,4,8,4,1050.6589999999999,3
w13,4,128,8,4096,3072,16,32,128,16,4,2,1050.712,3
w13,4,128,8,4096,3072,16,32,128,16,4,3,1050.115,3
w13,4,128,8,4096,3072,16,32,128,16,4,4,1050.0186666666666,3
w13,4,128,8,4096,3072,16,32,128,16,8,2,1051.2883333333334,3
w13,4,128,8,4096,3072,16,32,128,16,8,3,1055.171,3
w13,4,128,8,4096,3072,16,32,128,16,8,4,1053.0696666666665,3
w13,4,128,8,4096,3072,16,32,128,32,4,2,1053.9226666666666,3
w13,4,128,8,4096,3072,16,32,128,32,4,3,1055.4056666666668,3
w13,4,128,8,4096,3072,16,32,128,32,4,4,1053.219,3
w13,4,128,8,4096,3072,16,32,128,32,8,2,1048.8136666666667,3
w13,4,128,8,4096,3072,16,32,128,32,8,3,1058.4026666666666,3
w13,4,128,8,4096,3072,16,32,128,32,8,4,1054.4669999999999,3
w13,4,128,8,4096,3072,16,32,128,64,4,2,1054.7763333333332,3
w13,4,128,8,4096,3072,16,32,128,64,4,3,1055.747,3
w13,4,128,8,4096,3072,16,32,128,64,4,4,1052.2056666666667,3
w13,4,128,8,4096,3072,16,32,128,64,8,2,1049.539,3
w13,4,128,8,4096,3072,16,32,128,64,8,3,1057.1336666666666,3
w13,4,128,8,4096,3072,16,32,128,64,8,4,1054.4669999999999,3
w13,4,128,8,4096,3072,16,32,256,1,4,2,1054.339,3
w13,4,128,8,4096,3072,16,32,256,1,4,3,1051.1283333333333,3
w13,4,128,8,4096,3072,16,32,256,1,4,4,1051.1176666666668,3
w13,4,128,8,4096,3072,16,32,256,1,8,2,1054.3496666666667,3
w13,4,128,8,4096,3072,16,32,256,1,8,3,1053.0159999999998,3
w13,4,128,8,4096,3072,16,32,256,1,8,4,1050.6803333333335,3
w13,4,128,8,4096,3072,16,32,256,16,4,2,1052.8239999999998,3
w13,4,128,8,4096,3072,16,32,256,16,4,3,1052.003,3
w13,4,128,8,4096,3072,16,32,256,16,4,4,1050.3926666666666,3
w13,4,128,8,4096,3072,16,32,256,16,8,2,1056.6856666666665,3
w13,4,128,8,4096,3072,16,32,256,16,8,3,1052.9203333333335,3
w13,4,128,8,4096,3072,16,32,256,16,8,4,1051.203,3
w13,4,128,8,4096,3072,16,32,256,32,4,2,1057.763,3
w13,4,128,8,4096,3072,16,32,256,32,4,3,1053.1976666666667,3
w13,4,128,8,4096,3072,16,32,256,32,4,4,1053.635,3
w13,4,128,8,4096,3072,16,32,256,32,8,2,1057.1870000000001,3
w13,4,128,8,4096,3072,16,32,256,32,8,3,1053.5813333333333,3
w13,4,128,8,4096,3072,16,32,256,32,8,4,1054.2643333333333,3
w13,4,128,8,4096,3072,16,32,256,64,4,2,1057.037,3
w13,4,128,8,4096,3072,16,32,256,64,4,3,1052.8776666666665,3
w13,4,128,8,4096,3072,16,32,256,64,4,4,1053.0910000000001,3
w13,4,128,8,4096,3072,16,32,256,64,8,2,1058.2003333333332,3
w13,4,128,8,4096,3072,16,32,256,64,8,3,1054.7226666666666,3
w13,4,128,8,4096,3072,16,32,256,64,8,4,1053.379,3
w13,4,128,8,4096,3072,16,64,64,1,4,2,1057.8376666666666,3
w13,4,128,8,4096,3072,16,64,64,1,4,4,1049.4426666666666,3
w13,4,128,8,4096,3072,16,64,64,1,8,2,1052.611,3
w13,4,128,8,4096,3072,16,64,64,1,8,3,1053.5496666666666,3
w13,4,128,8,4096,3072,16,64,64,1,8,4,1048.7176666666667,3
w13,4,128,8,4096,3072,16,64,64,16,4,2,1055.9283333333333,3
w13,4,128,8,4096,3072,16,64,64,16,4,3,1056.9096666666667,3
w13,4,128,8,4096,3072,16,64,64,16,4,4,1056.5256666666667,3
w13,4,128,8,4096,3072,16,64,64,16,8,3,1053.112,3
w13,4,128,8,4096,3072,16,64,64,32,4,3,1054.787,3
w13,4,128,8,4096,3072,16,64,64,32,4,4,1058.488,3
w13,4,128,8,4096,3072,16,64,64,32,8,3,1051.7146666666667,3
w13,4,128,8,4096,3072,16,64,64,32,8,4,1058.1470000000002,3
w13,4,128,8,4096,3072,16,64,64,64,4,3,1053.9869999999999,3
w13,4,128,8,4096,3072,16,64,64,64,4,4,1057.1763333333333,3
w13,4,128,8,4096,3072,16,64,64,64,8,3,1052.4403333333332,3
w13,4,128,8,4096,3072,16,64,64,64,8,4,1058.4243333333334,3
w13,4,128,8,4096,3072,16,64,128,1,4,3,1051.3416666666665,3
w13,4,128,8,4096,3072,16,64,128,1,4,4,1051.1496666666667,3
w13,4,128,8,4096,3072,16,64,128,1,8,3,1052.4833333333333,3
w13,4,128,8,4096,3072,16,64,128,1,8,4,1050.3926666666666,3
w13,4,128,8,4096,3072,16,64,128,16,4,4,1058.4456666666667,3
w13,4,128,8,4096,3072,16,64,128,32,4,2,1057.0913333333335,3
w13,4,128,8,4096,3072,16,64,128,32,8,2,1057.4006666666667,3
w13,4,128,8,4096,3072,16,64,128,64,4,2,1053.87,3
w13,4,128,8,4096,3072,16,64,128,64,4,3,1058.03,3
w13,4,128,8,4096,3072,16,64,128,64,8,2,1057.027,3
w13,4,128,8,4096,3072,16,64,256,1,4,3,1052.5683333333334,3
w13,4,128,8,4096,3072,16,64,256,1,8,2,1057.7526666666665,3
w13,4,128,8,4096,3072,16,64,256,1,8,3,1052.2696666666668,3
w13,4,128,8,4096,3072,16,64,256,16,4,3,1056.0883333333334,3
w13,4,128,8,4096,3072,16,64,256,16,8,3,1056.3553333333332,3
w13,4,128,8,4096,3072,16,64,256,32,4,3,1058.4886666666669,3
w13,4,128,8,4096,3072,16,64,256,64,4,3,1057.166,3
w13,4,128,8,4096,3072,16,128,64,1,4,2,1052.174,3
w13,4,128,8,4096,3072,16,128,64,1,8,2,1051.6943333333331,3
w13,4,128,8,4096,3072,16,128,64,1,8,3,1049.6993333333332,3
w13,4,128,8,4096,3072,16,128,64,16,4,2,1054.1473333333333,3
w13,4,128,8,4096,3072,16,128,64,16,4,3,1054.1793333333333,3
w13,4,128,8,4096,3072,16,128,64,16,8,2,1052.59,3
w13,4,128,8,4096,3072,16,128,64,16,8,3,1051.9393333333335,3
w13,4,128,8,4096,3072,16,128,64,32,4,2,1055.9283333333333,3
w13,4,128,8,4096,3072,16,128,64,32,4,3,1053.1233333333332,3
w13,4,128,8,4096,3072,16,128,64,32,8,2,1054.115,3
w13,4,128,8,4096,3072,16,128,64,32,8,3,1053.0483333333334,3
w13,4,128,8,4096,3072,16,128,64,64,4,2,1052.366,3
w13,4,128,8,4096,3072,16,128,64,64,4,3,1053.3796666666667,3
w13,4,128,8,4096,3072,16,128,64,64,8,2,1053.6033333333335,3
w13,4,128,8,4096,3072,16,128,64,64,8,3,1052.43,3
w13,4,128,8,4096,3072,16,128,128,16,4,2,1058.211,3
w13,4,128,8,4096,3072,16,128,128,32,4,2,1055.7256666666665,3
w13,4,128,8,4096,3072,16,128,128,32,8,2,1056.0886666666665,3
w13,4,128,8,4096,3072,16,128,128,64,4,2,1054.638,3
w13,4,128,8,4096,3072,16,128,128,64,8,2,1056.195,3
w13,4,128,8,4096,3072,16,256,64,1,4,3,1054.4136666666666,3
w13,4,128,8,4096,3072,16,256,64,1,8,3,1052.0243333333333,3
w13,4,128,8,4096,3072,16,256,64,16,4,3,1057.8913333333333,3
w13,4,128,8,4096,3072,16,256,64,16,8,3,1054.7873333333334,3
w13,4,128,8,4096,3072,16,256,64,32,4,3,1055.9393333333335,3
w13,4,128,8,4096,3072,16,256,64,32,8,3,1056.8459999999998,3
w13,4,128,8,4096,3072,16,256,64,64,4,3,1055.811,3
w13,4,128,8,4096,3072,16,256,64,64,8,3,1053.2403333333334,3
w13,4,128,8,4096,3072,32,16,128,4,4,3,1049.731,3
w13,4,128,8,4096,3072,32,16,128,4,4,4,1050.4353333333333,3
w13,4,128,8,4096,3072,32,16,128,4,8,2,1051.086,3
w13,4,128,8,4096,3072,32,16,128,4,8,3,1056.174,3
w13,4,128,8,4096,3072,32,16,128,4,8,4,1053.219,3
w13,4,128,8,4096,3072,32,32,64,1,4,2,1050.7659999999998,3
w13,4,128,8,4096,3072,32,32,64,1,4,3,1048.4833333333333,3
w13,4,128,8,4096,3072,32,32,64,1,4,4,1054.9256666666668,3
w13,4,128,8,4096,3072,32,32,64,1,8,2,1051.9073333333333,3
w13,4,128,8,4096,3072,32,32,64,1,8,3,1049.6246666666666,3
w13,4,128,8,4096,3072,32,32,64,32,4,3,1050.3176666666666,3
w13,4,128,8,4096,3072,32,32,64,32,8,3,1049.4116666666666,3
w13,4,128,8,4096,3072,32,32,64,64,4,3,1049.7633333333333,3
w13,4,128,8,4096,3072,32,32,64,64,8,3,1050.0406666666668,3
w13,4,128,8,4096,3072,32,32,64,128,4,3,1049.486,3
w13,4,128,8,4096,3072,32,32,64,128,8,3,1050.03,3
w13,4,128,8,4096,3072,32,32,128,1,4,2,1048.0353333333333,3
w13,4,128,8,4096,3072,32,32,128,1,4,3,1049.8483333333334,3
w13,4,128,8,4096,3072,32,32,128,1,4,4,1050.1046666666668,3
w13,4,128,8,4096,3072,32,32,128,1,8,2,1049.4006666666667,3
w13,4,128,8,4096,3072,32,32,128,1,8,3,1050.3286666666665,3
w13,4,128,8,4096,3072,32,32,128,1,8,4,1052.1526666666666,3
w13,4,128,8,4096,3072,32,32,128,4,4,2,1049.7416666666668,3
w13,4,128,8,4096,3072,32,32,128,4,4,3,1049.71,3
w13,4,128,8,4096,3072,32,32,128,4,4,4,1051.9283333333333,3
w13,4,128,8,4096,3072,32,32,128,4,8,2,1050.094,3
w13,4,128,8,4096,3072,32,32,128,4,8,3,1050.1256666666668,3
w13,4,128,8,4096,3072,32,32,128,4,8,4,1051.8643333333332,3
w13,4,128,8,4096,3072,32,32,128,16,4,2,1053.2833333333333,3
w13,4,128,8,4096,3072,32,32,128,16,4,3,1050.0513333333333,3
w13,4,128,8,4096,3072,32,32,128,16,4,4,1051.715,3
w13,4,128,8,4096,3072,32,32,128,16,8,2,1050.414,3
w13,4,128,8,4096,3072,32,32,128,16,8,3,1050.318,3
w13,4,128,8,4096,3072,32,32,128,16,8,4,1053.1976666666667,3
w13,4,128,8,4096,3072,32,32,128,64,4,2,1049.1660000000002,3
w13,4,128,8,4096,3072,32,32,128,64,4,4,1053.806,3
w13,4,128,8,4096,3072,32,32,128,64,8,2,1049.0483333333334,3
w13,4,128,8,4096,3072,32,32,128,64,8,4,1055.246,3
w13,4,128,8,4096,3072,32,32,256,1,4,2,1048.5896666666667,3
w13,4,128,8,4096,3072,32,32,256,1,4,3,1050.4566666666667,3
w13,4,128,8,4096,3072,32,32,256,1,4,4,1050.3926666666666,3
w13,4,128,8,4096,3072,32,32,256,1,8,2,1050.6270000000002,3
w13,4,128,8,4096,3072,32,32,256,1,8,3,1050.2646666666667,3
w13,4,128,8,4096,3072,32,32,256,1,8,4,1050.723,3
w13,4,128,8,4096,3072,32,32,256,4,4,2,1050.318,3
w13,4,128,8,4096,3072,32,32,256,4,4,3,1049.9873333333333,3
w13,4,128,8,4096,3072,32,32,256,4,4,4,1050.638,3
w13,4,128,8,4096,3072,32,32,256,4,8,2,1050.8403333333333,3
w13,4,128,8,4096,3072,32,32,256,4,8,3,1049.5603333333333,3
w13,4,128,8,4096,3072,32,32,256,4,8,4,1050.787,3
w13,4,128,8,4096,3072,32,32,256,16,4,2,1050.115,3
w13,4,128,8,4096,3072,32,32,256,16,4,3,1051.096,3
w13,4,128,8,4096,3072,32,32,256,16,4,4,1050.7876666666668,3
w13,4,128,8,4096,3072,32,32,256,16,8,2,1049.806,3
w13,4,128,8,4096,3072,32,32,256,16,8,3,1050.7553333333333,3
w13,4,128,8,4096,3072,32,32,256,16,8,4,1050.9473333333333,3
w13,4,128,8,4096,3072,32,32,256,32,4,3,1055.1496666666665,3
w13,4,128,8,4096,3072,32,32,256,32,4,4,1053.4433333333334,3
w13,4,128,8,4096,3072,32,32,256,32,8,3,1055.598,3
w13,4,128,8,4096,3072,32,32,256,32,8,4,1054.0296666666666,3
w13,4,128,8,4096,3072,32,64,64,1,4,2,1058.4776666666667,3
w13,4,128,8,4096,3072,32,64,64,1,4,4,1051.3636666666669,3
w13,4,128,8,4096,3072,32,64,64,1,8,2,1054.4136666666666,3
w13,4,128,8,4096,3072,32,64,64,1,8,4,1052.1846666666668,3
w13,4,128,8,4096,3072,32,64,64,64,8,3,1056.9953333333333,3
w13,4,128,8,4096,3072,32,64,128,1,4,3,1055.1816666666666,3
w13,4,128,8,4096,3072,32,64,128,1,4,4,1049.6243333333334,3
w13,4,128,8,4096,3072,32,64,128,1,8,3,1053.3686666666665,3
w13,4,128,8,4096,3072,32,64,128,1,8,4,1051.9930000000002,3
w13,4,128,8,4096,3072,32,64,128,4,4,3,1053.337,3
w13,4,128,8,4096,3072,32,64,128,4,4,4,1053.3149999999998,3
w13,4,128,8,4096,3072,32,64,128,4,8,3,1052.2803333333334,3
w13,4,128,8,4096,3072,32,64,128,4,8,4,1053.6566666666665,3
w13,4,128,8,4096,3072,32,64,128,16,4,4,1058.51,3
w13,4,128,8,4096,3072,32,64,128,64,4,2,1058.3816666666667,3
w13,4,128,8,4096,3072,32,64,256,1,4,2,1056.046,3
w13,4,128,8,4096,3072,32,64,256,1,4,3,1053.006,3
w13,4,128,8,4096,3072,32,64,256,1,8,3,1051.502,3
w13,4,128,8,4096,3072,32,64,256,8,4,3,1053.9233333333334,3
w13,4,128,8,4096,3072,32,64,256,8,8,3,1054.393,3
w13,4,128,8,4096,3072,32,64,256,16,4,3,1057.198,3
w13,4,128,8,4096,3072,32,64,256,16,8,3,1057.6993333333332,3
w13,4,128,8,4096,3072,32,128,64,1,8,2,1053.4856666666667,3
w13,4,128,8,4096,3072,32,128,64,16,4,3,1054.318,3
w13,4,128,8,4096,3072,32,128,64,16,8,3,1054.8083333333334,3
w13,4,128,8,4096,3072,32,128,64,32,4,3,1054.8410000000001,3
w13,4,128,8,4096,3072,32,128,64,32,8,3,1053.6886666666667,3
w13,4,128,8,4096,3072,32,128,64,64,4,3,1054.3606666666667,3
w13,4,128,8,4096,3072,32,128,64,64,8,3,1052.771,3
w13,4,128,8,4096,3072,32,128,128,32,4,2,1057.8163333333332,3
w13,4,128,8,4096,3072,32,128,128,32,8,2,1056.6326666666666,3
w13,4,128,8,4096,3072,32,128,128,64,4,2,1058.4243333333334,3
w13,4,128,8,4096,3072,32,128,128,64,8,2,1055.79,3
w13,4,128,8,4096,3072,32,256,64,1,4,3,1055.8860000000002,3
w13,4,128,8,4096,3072,32,256,64,1,8,3,1056.003,3
w13,4,128,8,4096,3072,32,256,64,32,4,3,1058.1476666666667,3
w13,4,128,8,4096,3072,32,256,64,32,8,3,1056.035,3
w13,4,128,8,4096,3072,32,256,64,64,4,3,1057.3046666666667,3
w13,4,128,8,4096,3072,32,256,64,64,8,3,1056.558,3
w13,4,128,8,4096,3072,64,16,128,1,4,2,1056.1953333333333,3
w13,4,128,8,4096,3072,64,16,128,1,4,3,1053.4433333333334,3
w13,4,128,8,4096,3072,64,16,128,1,4,4,1055.8753333333334,3
w13,4,128,8,4096,3072,64,16,128,1,8,2,1056.7713333333334,3
w13,4,128,8,4096,3072,64,16,128,1,8,3,1052.0136666666667,3
w13,4,128,8,4096,3072,64,16,128,1,8,4,1055.5016666666668,3
w13,4,128,8,4096,3072,64,32,128,1,4,3,1051.4916666666666,3
w13,4,128,8,4096,3072,64,32,128,1,4,4,1054.9793333333334,3
w13,4,128,8,4096,3072,64,32,128,1,8,3,1052.387,3
w13,4,128,8,4096,3072,64,32,128,1,8,4,1053.9766666666667,3
w13,4,128,8,4096,3072,64,32,128,16,4,3,1051.6296666666667,3
w13,4,128,8,4096,3072,64,32,128,16,4,4,1053.5073333333332,3
w13,4,128,8,4096,3072,64,32,128,16,8,3,1053.0910000000001,3
w13,4,128,8,4096,3072,64,32,128,16,8,4,1054.4993333333334,3
w13,4,128,8,4096,3072,64,32,256,1,4,2,1052.6223333333335,3
w13,4,128,8,4096,3072,64,32,256,1,4,3,1051.3523333333333,3
w13,4,128,8,4096,3072,64,32,256,1,8,2,1053.3793333333333,3
w13,4,128,8,4096,3072,64,32,256,1,8,3,1051.8113333333333,3
w13,4,128,8,4096,3072,64,64,64,1,4,3,1051.9603333333332,3
w13,4,128,8,4096,3072,64,64,64,1,8,3,1052.0993333333333,3
w13,4,128,8,4096,3072,64,64,64,32,8,3,1058.4033333333334,3
w13,4,128,8,4096,3072,64,64,128,1,4,2,1052.1096666666665,3
w13,4,128,8,4096,3072,64,64,128,1,4,3,1051.0856666666666,3
w13,4,128,8,4096,3072,64,64,128,1,4,4,1054.7340000000002,3
w13,4,128,8,4096,3072,64,64,128,1,8,3,1050.5313333333334,3
w13,4,128,8,4096,3072,64,64,128,1,8,4,1055.235,3
w13,4,128,8,4096,3072,64,64,128,4,4,3,1051.9286666666667,3
w13,4,128,8,4096,3072,64,64,128,4,4,4,1055.054,3
w13,4,128,8,4096,3072,64,64,128,4,8,3,1050.9683333333332,3
w13,4,128,8,4096,3072,64,64,128,4,8,4,1053.9553333333333,3
w13,4,128,8,4096,3072,64,64,128,8,4,4,1057.9126666666668,3
w13,4,128,8,4096,3072,64,64,128,8,8,3,1057.379,3
w13,4,128,8,4096,3072,64,64,128,32,4,2,1054.6270000000002,3
w13,4,128,8,4096,3072,64,64,128,64,4,2,1054.5523333333333,3
w13,4,128,8,4096,3072,64,128,64,1,4,2,1055.2673333333335,3
w13,4,128,8,4096,3072,64,128,64,4,4,2,1058.414,3
w13,4,128,8,4096,3072,64,128,64,32,4,3,1057.678,3
w13,4,128,8,4096,3072,64,128,64,32,8,3,1058.0086666666668,3
w13,4,128,8,4096,3072,64,128,64,64,4,3,1058.5633333333333,3
w13,8,8,2,1024,512,16,64,64,16,4,4,5.1113333333333335,3
w13,8,8,2,1024,512,16,64,64,32,4,4,5.132666666666666,3
w13,8,8,2,1024,512,16,64,64,64,4,4,5.1433333333333335,3
w13,8,16,2,1536,768,16,32,64,1,4,3,14.822000000000001,3
w13,8,16,2,1536,768,16,32,64,16,4,3,14.844,3
w13,8,16,2,1536,768,16,32,64,32,4,3,14.811666666666667,3
w13,8,16,2,1536,768,16,32,64,64,4,3,14.811666666666667,3
w13,8,16,2,1536,768,16,64,32,1,4,4,14.843666666666666,3
w13,8,16,2,1536,768,16,64,64,1,4,3,14.822000000000001,3
w13,8,16,2,1536,768,16,64,64,1,4,4,14.844333333333333,3
w13,8,16,2,1536,768,16,256,32,8,4,4,14.758666666666668,3
w13,8,16,4,1536,1024,16,64,64,1,4,4,18.647333333333336,3
w13,8,16,4,1536,1024,16,64,64,16,4,3,18.572666666666667,3
w13,8,16,4,1536,1024,16,64,64,16,4,4,18.540666666666667,3
w13,8,16,4,1536,1024,16,64,64,32,4,3,18.594,3
w13,8,16,4,1536,1024,16,64,64,32,4,4,18.519333333333336,3
w13,8,16,4,1536,1024,16,64,64,64,4,3,18.69,3
w13,8,16,4,1536,1024,16,64,64,64,4,4,18.53,3
w13,8,32,4,2048,768,16,32,64,1,4,2,117.95466666666668,3
w13,8,32,4,2048,768,16,128,64,1,8,2,118.92466666666667,3
w13,8,32,4,2048,768,32,32,64,1,4,2,118.11399999999999,3
w13,8,32,6,3072,1024,16,32,256,1,4,2,261.41,3
w13,8,32,6,3072,1024,16,64,256,1,4,2,261.965,3
w13,8,32,6,3072,1024,32,32,256,1,4,2,260.845,3
w13,8,32,6,3072,1024,32,64,256,1,4,2,262.11466666666666,3
w13,8,60,4,2048,1408,16,32,128,1,4,2,237.442,3
w13,8,60,4,2048,1408,16,32,256,1,4,2,238.28533333333334,3
w13,8,60,4,2048,1408,16,64,128,1,4,2,238.87166666666667,3
w13,8,60,4,2048,1408,16,64,256,1,4,2,239.13866666666664,3
w13,8,60,4,2048,1408,16,128,64,16,8,2,239.71400000000003,3
w13,8,60,4,2048,1408,16,128,128,1,4,2,239.309,3
w13,8,60,4,2048,1408,32,16,128,4,4,2,239.554,3
w13,8,60,4,2048,1408,32,32,128,1,4,2,238.99966666666668,3
w13,8,60,4,2048,1408,32,32,256,1,4,2,238.77533333333335,3
w13,8,60,4,2048,1408,32,64,128,1,4,2,238.13566666666668,3
w13,8,60,4,2048,1408,32,64,256,1,4,2,239.52266666666665,3
w13,8,60,4,2048,1408,64,64,128,1,4,2,238.968,3
w13,8,60,6,3584,2304,16,16,64,1,4,3,1035.8973333333333,3
w13,8,60,6,3584,2304,16,16,64,1,4,4,1036.996,3
w13,8,60,6,3584,2304,16,16,64,1,8,4,1043.2896666666668,3
w13,8,60,6,3584,2304,16,16,128,1,4,2,1034.127,3
w13,8,60,6,3584,2304,16,16,128,1,4,3,1033.4866666666667,3
w13,8,60,6,3584,2304,16,16,128,1,4,4,1034.212,3
w13,8,60,6,3584,2304,16,16,128,1,8,2,1038.511,3
w13,8,60,6,3584,2304,16,16,128,1,8,3,1034.4573333333333,3
w13,8,60,6,3584,2304,16,16,128,1,8,4,1038.6713333333335,3
w13,8,60,6,3584,2304,16,16,128,4,4,2,1035.7376666666667,3
w13,8,60,6,3584,2304,16,16,128,4,4,3,1033.4546666666668,3
w13,8,60,6,3584,2304,16,16,128,4,4,4,1034.191,3
w13,8,60,6,3584,2304,16,16,128,4,8,2,1042.404,3
w13,8,60,6,3584,2304,16,16,128,4,8,3,1035.0123333333333,3
w13,8,60,6,3584,2304,16,16,128,4,8,4,1037.8813333333335,3
w13,8,60,6,3584,2304,16,16,256,1,4,2,1032.9746666666667,3
w13,8,60,6,3584,2304,16,16,256,1,4,3,1033.5936666666666,3
w13,8,60,6,3584,2304,16,16,256,1,4,4,1033.743,3
w13,8,60,6,3584,2304,16,16,256,1,8,2,1036.1000000000001,3
w13,8,60,6,3584,2304,16,16,256,1,8,3,1036.4416666666666,3
w13,8,60,6,3584,2304,16,16,256,1,8,4,1035.3216666666667,3
w13,8,60,6,3584,2304,16,16,256,4,4,2,1033.5293333333332,3
w13,8,60,6,3584,2304,16,16,256,4,4,3,1033.5829999999999,3
w13,8,60,6,3584,2304,16,16,256,4,4,4,1034.4573333333335,3
w13,8,60,6,3584,2304,16,16,256,4,8,2,1036.7079999999999,3
w13,8,60,6,3584,2304,16,16,256,4,8,3,1035.2146666666667,3
w13,8,60,6,3584,2304,16,16,256,4,8,4,1036.196,3
w13,8,60,6,3584,2304,16,32,64,1,4,3,1036.932,3
w13,8,60,6,3584,2304,16,32,64,1,4,4,1038.5426666666665,3
w13,8,60,6,3584,2304,16,32,64,1,8,3,1042.5426666666665,3
w13,8,60,6,3584,2304,16,32,64,1,8,4,1041.0813333333333,3
w13,8,60,6,3584,2304,16,32,64,16,4,3,1040.4626666666666,3
w13,8,60,6,3584,2304,16,32,64,16,4,4,1040.9963333333333,3
w13,8,60,6,3584,2304,16,32,64,16,8,4,1043.172,3
w13,8,60,6,3584,2304,16,32,64,32,4,3,1040.4203333333332,3
w13,8,60,6,3584,2304,16,32,64,32,4,4,1040.655,3
w13,8,60,6,3584,2304,16,32,64,64,4,3,1040.6546666666666,3
w13,8,60,6,3584,2304,16,32,64,64,4,4,1040.9213333333335,3
w13,8,60,6,3584,2304,16,32,128,1,4,2,1033.4123333333334,3
w13,8,60,6,3584,2304,16,32,128,1,4,3,1035.6626666666668,3
w13,8,60,6,3584,2304,16,32,128,1,4,4,1034.0096666666666,3
w13,8,60,6,3584,2304,16,32,128,1,8,2,1035.0656666666666,3
w13,8,60,6,3584,2304,16,32,128,1,8,3,1038.084,3
w13,8,60,6,3584,2304,16,32,128,1,8,4,1034.5856666666666,3
w13,8,60,6,3584,2304,16,32,128,4,4,2,1035.876,3
w13,8,60,6,3584,2304,16,32,128,4,4,3,1037.0813333333333,3
w13,8,60,6,3584,2304,16,32,128,4,4,4,1034.0733333333333,3
w13,8,60,6,3584,2304,16,32,128,4,8,2,1036.6970000000001,3
w13,8,60,6,3584,2304,16,32,128,4,8,3,1038.7776666666666,3
w13,8,60,6,3584,2304,16,32,128,4,8,4,1034.7453333333333,3
w13,8,60,6,3584,2304,16,32,128,16,4,2,1037.0919999999999,3
w13,8,60,6,3584,2304,16,32,128,16,4,3,1038.436,3
w13,8,60,6,3584,2304,16,32,128,16,4,4,1034.6493333333335,3
w13,8,60,6,3584,2304,16,32,128,16,8,2,1036.2920000000001,3
w13,8,60,6,3584,2304,16,32,128,16,8,3,1038.916,3
w13,8,60,6,3584,2304,16,32,128,16,8,4,1035.3213333333333,3
w13,8,60,6,3584,2304,16,32,128,32,4,2,1036.9003333333333,3
w13,8,60,6,3584,2304,16,32,128,32,4,3,1037.86,3
w13,8,60,6,3584,2304,16,32,128,32,4,4,1035.268,3
w13,8,60,6,3584,2304,16,32,128,32,8,2,1036.0249999999999,3
w13,8,60,6,3584,2304,16,32,128,32,8,3,1038.5213333333334,3
w13,8,60,6,3584,2304,16,32,128,32,8,4,1035.7906666666668,3
w13,8,60,6,3584,2304,16,32,128,64,4,2,1038.3723333333335,3
w13,8,60,6,3584,2304,16,32,128,64,4,3,1037.935,3
w13,8,60,6,3584,2304,16,32,128,64,4,4,1035.663,3
w13,8,60,6,3584,2304,16,32,128,64,8,2,1036.9216666666669,3
w13,8,60,6,3584,2304,16,32,128,64,8,3,1038.82,3
w13,8,60,6,3584,2304,16,32,128,64,8,4,1036.751,3
w13,8,60,6,3584,2304,16,32,256,1,4,2,1034.7346666666665,3
w13,8,60,6,3584,2304,16,32,256,1,4,3,1033.7963333333335,3
w13,8,60,6,3584,2304,16,32,256,1,4,4,1034.2763333333332,3
w13,8,60,6,3584,2304,16,32,256,1,8,2,1036.7293333333334,3
w13,8,60,6,3584,2304,16,32,256,1,8,3,1035.183,3
w13,8,60,6,3584,2304,16,32,256,1,8,4,1035.1933333333334,3
w13,8,60,6,3584,2304,16,32,256,16,4,2,1037.924,3
w13,8,60,6,3584,2304,16,32,256,16,4,3,1034.9906666666666,3
w13,8,60,6,3584,2304,16,32,256,16,4,4,1034.9376666666667,3
w13,8,60,6,3584,2304,16,32,256,16,8,2,1040.452,3
w13,8,60,6,3584,2304,16,32,256,16,8,3,1035.2683333333334,3
w13,8,60,6,3584,2304,16,32,256,16,8,4,1035.0756666666666,3
w13,8,60,6,3584,2304,16,32,256,32,4,2,1038.714,3
w13,8,60,6,3584,2304,16,32,256,32,4,3,1034.9376666666667,3
w13,8,60,6,3584,2304,16,32,256,32,4,4,1035.8763333333334,3
w13,8,60,6,3584,2304,16,32,256,32,8,2,1039.9933333333336,3
w13,8,60,6,3584,2304,16,32,256,32,8,3,1036.548,3
w13,8,60,6,3584,2304,16,32,256,32,8,4,1035.6626666666668,3
w13,8,60,6,3584,2304,16,32,256,64,4,2,1039.5346666666667,3
w13,8,60,6,3584,2304,16,32,256,64,4,3,1036.8253333333332,3
w13,8,60,6,3584,2304,16,32,256,64,4,4,1035.9826666666668,3
w13,8,60,6,3584,2304,16,32,256,64,8,2,1041.3056666666666,3
w13,8,60,6,3584,2304,16,32,256,64,8,3,1036.6760000000002,3
w13,8,60,6,3584,2304,16,32,256,64,8,4,1036.2923333333333,3
w13,8,60,6,3584,2304,16,64,64,1,4,3,1040.9426666666666,3
w13,8,60,6,3584,2304,16,64,64,1,4,4,1040.0043333333333,3
w13,8,60,6,3584,2304,16,64,64,1,8,3,1040.2283333333332,3
w13,8,60,6,3584,2304,16,64,64,1,8,4,1040.8466666666666,3
w13,8,60,6,3584,2304,16,64,64,16,4,3,1043.0653333333332,3
w13,8,60,6,3584,2304,16,64,64,16,4,4,1042.948,3
w13,8,60,6,3584,2304,16,64,64,16,8,4,1043.2466666666667,3
w13,8,60,6,3584,2304,16,64,64,32,4,3,1041.508,3
w13,8,60,6,3584,2304,16,64,64,32,4,4,1043.2683333333334,3
w13,8,60,6,3584,2304,16,64,64,32,8,3,1042.9376666666667,3
w13,8,60,6,3584,2304,16,64,64,32,8,4,1043.1080000000002,3
w13,8,60,6,3584,2304,16,64,64,64,4,3,1042.4683333333332,3
w13,8,60,6,3584,2304,16,64,64,64,4,4,1042.82,3
w13,8,60,6,3584,2304,16,64,64,64,8,3,1042.287,3
w13,8,60,6,3584,2304,16,64,128,1,4,2,1033.6146666666666,3
w13,8,60,6,3584,2304,16,64,128,1,4,3,1037.828,3
w13,8,60,6,3584,2304,16,64,128,1,4,4,1034.724,3
w13,8,60,6,3584,2304,16,64,128,1,8,2,1033.2413333333334,3
w13,8,60,6,3584,2304,16,64,128,1,8,3,1038.5426666666665,3
w13,8,60,6,3584,2304,16,64,128,1,8,4,1033.9023333333334,3
w13,8,60,6,3584,2304,16,64,128,16,4,2,1036.1109999999999,3
w13,8,60,6,3584,2304,16,64,128,16,4,3,1040.388,3
w13,8,60,6,3584,2304,16,64,128,16,4,4,1034.8096666666668,3
w13,8,60,6,3584,2304,16,64,128,16,8,2,1035.4386666666667,3
w13,8,60,6,3584,2304,16,64,128,16,8,3,1038.5216666666668,3
w13,8,60,6,3584,2304,16,64,128,16,8,4,1035.4066666666665,3
w13,8,60,6,3584,2304,16,64,128,32,4,2,1036.644,3
w13,8,60,6,3584,2304,16,64,128,32,4,3,1039.247,3
w13,8,60,6,3584,2304,16,64,128,32,4,4,1035.0973333333334,3
w13,8,60,6,3584,2304,16,64,128,32,8,2,1035.5559999999998,3
w13,8,60,6,3584,2304,16,64,128,32,8,3,1040.5373333333334,3
w13,8,60,6,3584,2304,16,64,128,32,8,4,1035.492,3
w13,8,60,6,3584,2304,16,64,128,64,4,2,1036.164,3
w13,8,60,6,3584,2304,16,64,128,64,4,3,1039.7269999999999,3
w13,8,60,6,3584,2304,16,64,128,64,4,4,1036.0363333333335,3
w13,8,60,6,3584,2304,16,64,128,64,8,2,1036.7079999999999,3
w13,8,60,6,3584,2304,16,64,128,64,8,3,1039.9506666666666,3
w13,8,60,6,3584,2304,16,64,128,64,8,4,1035.684,3
w13,8,60,6,3584,2304,16,64,256,1,4,2,1038.372,3
w13,8,60,6,3584,2304,16,64,256,1,4,3,1034.0733333333333,3
w13,8,60,6,3584,2304,16,64,256,1,8,2,1039.6200000000001,3
w13,8,60,6,3584,2304,16,64,256,1,8,3,1034.532,3
w13,8,60,6,3584,2304,16,64,256,16,4,2,1038.852,3
w13,8,60,6,3584,2304,16,64,256,16,4,3,1035.247,3
w13,8,60,6,3584,2304,16,64,256,16,8,2,1040.932,3
w13,8,60,6,3584,2304,16,64,256,16,8,3,1035.855,3
w13,8,60,6,3584,2304,16,64,256,32,4,2,1040.143,3
w13,8,60,6,3584,2304,16,64,256,32,4,3,1035.5243333333333,3
w13,8,60,6,3584,2304,16,64,256,32,8,2,1040.4093333333333,3
w13,8,60,6,3584,2304,16,64,256,32,8,3,1035.3743333333332,3
w13,8,60,6,3584,2304,16,64,256,64,4,2,1040.9426666666666,3
w13,8,60,6,3584,2304,16,64,256,64,4,3,1036.2063333333333,3
w13,8,60,6,3584,2304,16,64,256,64,8,2,1041.0706666666667,3
w13,8,60,6,3584,2304,16,64,256,64,8,3,1036.2813333333334,3
w13,8,60,6,3584,2304,16,128,64,1,4,2,1042.8196666666665,3
w13,8,60,6,3584,2304,16,128,64,1,4,3,1041.4440000000002,3
w13,8,60,6,3584,2304,16,128,64,1,8,2,1042.7453333333333,3
w13,8,60,6,3584,2304,16,128,64,1,8,3,1040.7933333333333,3
w13,8,60,6,3584,2304,16,128,64,16,4,3,1043.3746666666666,3
w13,8,60,6,3584,2304,16,128,64,32,8,3,1042.4783333333335,3
w13,8,60,6,3584,2304,16,128,128,1,4,2,1033.9986666666666,3
w13,8,60,6,3584,2304,16,128,128,1,4,3,1039.7160000000001,3
w13,8,60,6,3584,2304,16,128,128,1,8,2,1033.6360000000002,3
w13,8,60,6,3584,2304,16,128,128,1,8,3,1039.7479999999998,3
w13,8,60,6,3584,2304,16,128,128,16,4,2,1035.823,3
w13,8,60,6,3584,2304,16,128,128,16,4,3,1041.9986666666666,3
w13,8,60,6,3584,2304,16,128,128,16,8,2,1035.204,3
w13,8,60,6,3584,2304,16,128,128,16,8,3,1040.7083333333333,3
w13,8,60,6,3584,2304,16,128,128,32,4,2,1035.951,3
w13,8,60,6,3584,2304,16,128,128,32,4,3,1041.6893333333335,3
w13,8,60,6,3584,2304,16,128,128,32,8,2,1035.1293333333333,3
w13,8,60,6,3584,2304,16,128,128,32,8,3,1041.423,3
w13,8,60,6,3584,2304,16,128,128,64,4,2,1037.0710000000001,3
w13,8,60,6,3584,2304,16,128,128,64,4,3,1041.8386666666668,3
w13,8,60,6,3584,2304,16,128,128,64,8,2,1036.4306666666666,3
w13,8,60,6,3584,2304,16,128,128,64,8,3,1041.6786666666667,3
w13,8,60,6,3584,2304,16,256,64,1,4,3,1043.1616666666666,3
w13,8,60,6,3584,2304,16,256,64,1,8,3,1041.6576666666667,3
w13,8,60,6,3584,2304,32,16,128,4,4,2,1035.855,3
w13,8,60,6,3584,2304,32,16,128,4,4,3,1034.532,3
w13,8,60,6,3584,2304,32,16,128,4,4,4,1035.3853333333334,3
w13,8,60,6,3584,2304,32,16,128,4,8,2,1041.807,3
w13,8,60,6,3584,2304,32,16,128,4,8,3,1037.3693333333333,3
w13,8,60,6,3584,2304,32,16,128,4,8,4,1038.2013333333334,3
w13,8,60,6,3584,2304,32,32,64,1,4,3,1037.3693333333333,3
w13,8,60,6,3584,2304,32,32,64,1,4,4,1041.295,3
w13,8,60,6,3584,2304,32,32,64,1,8,3,1039.5773333333334,3
w13,8,60,6,3584,2304,32,32,64,32,4,3,1041.2520000000002,3
w13,8,60,6,3584,2304,32,32,64,32,8,3,1041.2416666666666,3
w13,8,60,6,3584,2304,32,32,64,64,4,3,1043.3213333333333,3
w13,8,60,6,3584,2304,32,32,64,64,8,3,1042.799,3
w13,8,60,6,3584,2304,32,32,64,128,4,3,1042.4146666666668,3
w13,8,60,6,3584,2304,32,32,64,128,8,3,1043.3963333333334,3
w13,8,60,6,3584,2304,32,32,128,1,4,2,1034.0306666666668,3
w13,8,60,6,3584,2304,32,32,128,1,4,3,1036.2816666666665,3
w13,8,60,6,3584,2304,32,32,128,1,4,4,1034.852,3
w13,8,60,6,3584,2304,32,32,128,1,8,2,1035.7906666666668,3
w13,8,60,6,3584,2304,32,32,128,1,8,3,1035.8866666666665,3
w13,8,60,6,3584,2304,32,32,128,1,8,4,1036.0783333333334,3
w13,8,60,6,3584,2304,32,32,128,4,4,2,1035.876,3
w13,8,60,6,3584,2304,32,32,128,4,4,3,1035.2893333333334,3
w13,8,60,6,3584,2304,32,32,128,4,4,4,1035.3426666666667,3
w13,8,60,6,3584,2304,32,32,128,4,8,2,1037.0493333333334,3
w13,8,60,6,3584,2304,32,32,128,4,8,3,1037.3693333333333,3
w13,8,60,6,3584,2304,32,32,128,4,8,4,1035.8016666666665,3
w13,8,60,6,3584,2304,32,32,128,16,4,2,1036.1533333333334,3
w13,8,60,6,3584,2304,32,32,128,16,4,3,1036.6866666666667,3
w13,8,60,6,3584,2304,32,32,128,16,4,4,1035.684,3
w13,8,60,6,3584,2304,32,32,128,16,8,2,1037.1879999999999,3
w13,8,60,6,3584,2304,32,32,128,16,8,3,1036.4523333333334,3
w13,8,60,6,3584,2304,32,32,128,16,8,4,1036.2279999999998,3
w13,8,60,6,3584,2304,32,32,128,64,4,2,1036.8039999999999,3
w13,8,60,6,3584,2304,32,32,128,64,4,3,1036.8790000000001,3
w13,8,60,6,3584,2304,32,32,128,64,4,4,1036.8466666666666,3
w13,8,60,6,3584,2304,32,32,128,64,8,2,1037.1883333333333,3
w13,8,60,6,3584,2304,32,32,128,64,8,3,1038.1693333333333,3
w13,8,60,6,3584,2304,32,32,128,64,8,4,1038.148,3
w13,8,60,6,3584,2304,32,32,256,1,4,2,1035.4173333333333,3
w13,8,60,6,3584,2304,32,32,256,1,4,3,1033.7213333333332,3
w13,8,60,6,3584,2304,32,32,256,1,4,4,1034.5213333333334,3
w13,8,60,6,3584,2304,32,32,256,1,8,2,1037.423,3
w13,8,60,6,3584,2304,32,32,256,1,8,3,1035.3963333333334,3
w13,8,60,6,3584,2304,32,32,256,1,8,4,1034.372,3
w13,8,60,6,3584,2304,32,32,256,4,4,2,1036.7933333333333,3
w13,8,60,6,3584,2304,32,32,256,4,4,3,1034.98,3
w13,8,60,6,3584,2304,32,32,256,4,4,4,1034.3826666666666,3
w13,8,60,6,3584,2304,32,32,256,4,8,2,1037.3586666666667,3
w13,8,60,6,3584,2304,32,32,256,4,8,3,1034.852,3
w13,8,60,6,3584,2304,32,32,256,4,8,4,1035.364,3
w13,8,60,6,3584,2304,32,32,256,16,4,2,1036.58,3
w13,8,60,6,3584,2304,32,32,256,16,4,3,1035.556,3
w13,8,60,6,3584,2304,32,32,256,16,4,4,1036.1000000000001,3
w13,8,60,6,3584,2304,32,32,256,16,8,2,1037.7216666666666,3
w13,8,60,6,3584,2304,32,32,256,16,8,3,1035.396,3
w13,8,60,6,3584,2304,32,32,256,16,8,4,1035.8226666666667,3
w13,8,60,6,3584,2304,32,32,256,32,4,2,1036.772,3
w13,8,60,6,3584,2304,32,32,256,32,4,3,1035.7906666666665,3
w13,8,60,6,3584,2304,32,32,256,32,4,4,1035.3,3
w13,8,60,6,3584,2304,32,32,256,32,8,2,1036.7079999999999,3
w13,8,60,6,3584,2304,32,32,256,32,8,3,1035.876,3
w13,8,60,6,3584,2304,32,32,256,32,8,4,1035.919,3
w13,8,60,6,3584,2304,32,64,64,1,8,3,1040.9963333333333,3
w13,8,60,6,3584,2304,32,64,128,1,4,2,1033.7,3
w13,8,60,6,3584,2304,32,64,128,1,4,3,1039.865,3
w13,8,60,6,3584,2304,32,64,128,1,4,4,1034.18,3
w13,8,60,6,3584,2304,32,64,128,1,8,2,1034.7456666666667,3
w13,8,60,6,3584,2304,32,64,128,1,8,3,1042.0093333333334,3
w13,8,60,6,3584,2304,32,64,128,1,8,4,1034.3823333333332,3
w13,8,60,6,3584,2304,32,64,128,4,4,2,1035.4813333333334,3
w13,8,60,6,3584,2304,32,64,128,4,4,3,1040.9530000000002,3
w13,8,60,6,3584,2304,32,64,128,4,4,4,1034.372,3
w13,8,60,6,3584,2304,32,64,128,4,8,2,1035.2466666666667,3
w13,8,60,6,3584,2304,32,64,128,4,8,3,1043.3746666666666,3
w13,8,60,6,3584,2304,32,64,128,4,8,4,1034.9906666666666,3
w13,8,60,6,3584,2304,32,64,128,16,4,2,1036.3243333333332,3
w13,8,60,6,3584,2304,32,64,128,16,4,3,1041.924,3
w13,8,60,6,3584,2304,32,64,128,16,4,4,1035.5023333333331,3
w13,8,60,6,3584,2304,32,64,128,16,8,2,1036.356,3
w13,8,60,6,3584,2304,32,64,128,16,8,3,1042.8413333333335,3
w13,8,60,6,3584,2304,32,64,128,16,8,4,1036.4093333333333,3
w13,8,60,6,3584,2304,32,64,128,32,4,2,1037.1136666666666,3
w13,8,60,6,3584,2304,32,64,128,32,4,3,1040.2066666666667,3
w13,8,60,6,3584,2304,32,64,128,32,4,4,1035.7373333333333,3
w13,8,60,6,3584,2304,32,64,128,32,8,2,1035.8653333333332,3
w13,8,60,6,3584,2304,32,64,128,32,8,3,1043.076,3
w13,8,60,6,3584,2304,32,64,128,32,8,4,1035.6200000000001,3
w13,8,60,6,3584,2304,32,64,128,64,4,2,1036.8256666666666,3
w13,8,60,6,3584,2304,32,64,128,64,4,3,1039.236,3
w13,8,60,6,3584,2304,32,64,128,64,4,4,1036.847,3
w13,8,60,6,3584,2304,32,64,128,64,8,2,1037.231,3
w13,8,60,6,3584,2304,32,64,128,64,8,3,1043.055,3
w13,8,60,6,3584,2304,32,64,128,64,8,4,1036.0576666666666,3
w13,8,60,6,3584,2304,32,64,256,1,4,2,1039.9723333333334,3
w13,8,60,6,3584,2304,32,64,256,1,4,3,1034.7346666666665,3
w13,8,60,6,3584,2304,32,64,256,1,8,2,1042.052,3
w13,8,60,6,3584,2304,32,64,256,1,8,3,1034.4043333333334,3
w13,8,60,6,3584,2304,32,64,256,8,4,2,1042.927,3
w13,8,60,6,3584,2304,32,64,256,8,4,3,1035.46,3
w13,8,60,6,3584,2304,32,64,256,8,8,2,1041.390666666667,3
w13,8,60,6,3584,2304,32,64,256,8,8,3,1034.9696666666666,3
w13,8,60,6,3584,2304,32,64,256,16,4,2,1042.244,3
w13,8,60,6,3584,2304,32,64,256,16,4,3,1036.0786666666665,3
w13,8,60,6,3584,2304,32,64,256,16,8,2,1042.1056666666666,3
w13,8,60,6,3584,2304,32,64,256,16,8,3,1035.7903333333334,3
w13,8,60,6,3584,2304,32,64,256,32,4,2,1042.436,3
w13,8,60,6,3584,2304,32,64,256,32,4,3,1035.7586666666666,3
w13,8,60,6,3584,2304,32,64,256,32,8,2,1041.796,3
w13,8,60,6,3584,2304,32,64,256,32,8,3,1035.7266666666667,3
w13,8,60,6,3584,2304,32,64,256,64,4,2,1042.4893333333332,3
w13,8,60,6,3584,2304,32,64,256,64,4,3,1036.8253333333334,3
w13,8,60,6,3584,2304,32,64,256,64,8,2,1043.14,3
w13,8,60,6,3584,2304,32,64,256,64,8,3,1036.5266666666666,3
w13,8,60,6,3584,2304,32,128,64,1,8,3,1042.308,3
w13,8,60,6,3584,2304,32,128,128,1,4,2,1035.535,3
w13,8,60,6,3584,2304,32,128,128,1,4,3,1042.5213333333334,3
w13,8,60,6,3584,2304,32,128,128,1,8,2,1033.9773333333333,3
w13,8,60,6,3584,2304,32,128,128,1,8,3,1041.732,3
w13,8,60,6,3584,2304,32,128,128,4,4,2,1036.6123333333333,3
w13,8,60,6,3584,2304,32,128,128,4,4,3,1042.969,3
w13,8,60,6,3584,2304,32,128,128,4,8,2,1035.876,3
w13,8,60,6,3584,2304,32,128,128,4,8,3,1041.9136666666666,3
w13,8,60,6,3584,2304,32,128,128,8,4,2,1035.919,3
w13,8,60,6,3584,2304,32,128,128,8,4,3,1042.361,3
w13,8,60,6,3584,2304,32,128,128,8,8,2,1035.3323333333333,3
w13,8,60,6,3584,2304,32,128,128,8,8,3,1043.012,3
w13,8,60,6,3584,2304,32,128,128,16,4,2,1036.9536666666665,3
w13,8,60,6,3584,2304,32,128,128,16,8,2,1035.8976666666667,3
w13,8,60,6,3584,2304,32,128,128,16,8,3,1042.6923333333334,3
w13,8,60,6,3584,2304,32,128,128,32,4,2,1037.2736666666667,3
w13,8,60,6,3584,2304,32,128,128,32,8,2,1036.1966666666667,3
w13,8,60,6,3584,2304,32,128,128,32,8,3,1041.7856666666667,3
w13,8,60,6,3584,2304,32,128,128,64,4,2,1037.8706666666667,3
w13,8,60,6,3584,2304,32,128,128,64,8,2,1039.0333333333335,3
w13,8,60,6,3584,2304,32,128,128,64,8,3,1043.1616666666666,3
w13,8,60,6,3584,2304,64,16,128,1,4,2,1041.2946666666667,3
w13,8,60,6,3584,2304,64,16,128,1,4,3,1041.5293333333334,3
w13,8,60,6,3584,2304,64,16,128,1,8,3,1041.3483333333334,3
w13,8,60,6,3584,2304,64,32,128,1,4,2,1040.9853333333333,3
w13,8,60,6,3584,2304,64,32,128,1,4,3,1035.9186666666667,3
w13,8,60,6,3584,2304,64,32,128,1,4,4,1036.7293333333334,3
w13,8,60,6,3584,2304,64,32,128,1,8,3,1036.7503333333334,3
w13,8,60,6,3584,2304,64,32,128,1,8,4,1036.281,3
w13,8,60,6,3584,2304,64,32,128,16,4,3,1036.7616666666665,3
w13,8,60,6,3584,2304,64,32,128,16,8,3,1037.5720000000001,3
w13,8,60,6,3584,2304,64,32,256,1,4,2,1036.996,3
w13,8,60,6,3584,2304,64,32,256,1,4,3,1036.2386666666669,3
w13,8,60,6,3584,2304,64,32,256,1,8,2,1036.5053333333333,3
w13,8,60,6,3584,2304,64,32,256,1,8,3,1035.3323333333335,3
w13,8,60,6,3584,2304,64,64,128,1,4,3,1035.5133333333333,3
w13,8,60,6,3584,2304,64,64,128,1,4,4,1036.4309999999998,3
w13,8,60,6,3584,2304,64,64,128,1,8,3,1036.1109999999999,3
w13,8,60,6,3584,2304,64,64,128,1,8,4,1036.6013333333333,3
w13,8,60,6,3584,2304,64,64,128,4,4,3,1039.1723333333332,3
w13,8,60,6,3584,2304,64,64,128,4,4,4,1036.3456666666668,3
w13,8,60,6,3584,2304,64,64,128,4,8,3,1040.5586666666666,3
w13,8,60,6,3584,2304,64,64,128,4,8,4,1036.3776666666665,3
w13,8,60,6,3584,2304,64,64,128,8,4,3,1038.4573333333333,3
w13,8,60,6,3584,2304,64,64,128,8,4,4,1036.9536666666665,3
w13,8,60,6,3584,2304,64,64,128,8,8,3,1039.6306666666667,3
w13,8,60,6,3584,2304,64,64,128,8,8,4,1036.42,3
w13,8,60,6,3584,2304,64,64,128,16,4,3,1038.148,3
w13,8,60,6,3584,2304,64,64,128,16,4,4,1037.0063333333333,3
w13,8,60,6,3584,2304,64,64,128,16,8,3,1037.0706666666667,3
w13,8,60,6,3584,2304,64,64,128,16,8,4,1036.8683333333333,3
w13,8,60,6,3584,2304,64,64,128,32,4,3,1038.5533333333333,3
w13,8,60,6,3584,2304,64,64,128,32,4,4,1037.0603333333333,3
w13,8,60,6,3584,2304,64,64,128,32,8,3,1038.7883333333332,3
w13,8,60,6,3584,2304,64,64,128,32,8,4,1037.903,3
w13,8,60,6,3584,2304,64,64,128,64,4,4,1038.1589999999999,3
w13,8,60,6,3584,2304,64,64,128,64,8,4,1037.9776666666667,3
w13,8,60,6,3584,2304,64,128,128,1,4,2,1037.4336666666668,3
w13,8,60,6,3584,2304,64,128,128,1,8,2,1035.9296666666667,3
w13,8,60,6,3584,2304,64,128,128,4,4,2,1038.4576666666667,3
w13,8,60,6,3584,2304,64,128,128,4,8,2,1038.0306666666665,3
w13,8,60,6,3584,2304,64,128,128,16,4,2,1038.7243333333333,3
w13,8,60,6,3584,2304,64,128,128,16,8,2,1038.4256666666668,3
w13,8,60,6,3584,2304,64,128,128,32,4,2,1038.2016666666666,3
w13,8,60,6,3584,2304,64,128,128,32,8,2,1038.8306666666667,3
w13,8,60,6,3584,2304,64,128,128,64,4,2,1040.6233333333332,3
w13,8,60,6,3584,2304,64,128,128,64,8,2,1041.8283333333334,3
w13,8,60,8,2048,1536,16,16,64,1,4,3,494.86033333333336,3
w13,8,60,8,2048,1536,16,16,64,1,4,4,495.92733333333337,3
w13,8,60,8,2048,1536,16,16,64,1,8,4,496.0553333333333,3
w13,8,60,8,2048,1536,16,16,128,1,4,3,495.16966666666667,3
w13,8,60,8,2048,1536,16,16,128,1,4,4,494.9669999999999,3
w13,8,60,8,2048,1536,16,16,128,4,4,3,495.3616666666667,3
w13,8,60,8,2048,1536,16,16,128,4,4,4,495.46866666666665,3
w13,8,60,8,2048,1536,16,16,256,1,4,2,494.5406666666666,3
w13,8,60,8,2048,1536,16,16,256,1,4,3,495.3396666666667,3
w13,8,60,8,2048,1536,16,16,256,1,4,4,495.93799999999993,3
w13,8,60,8,2048,1536,16,16,256,1,8,2,495.8313333333333,3
w13,8,60,8,2048,1536,16,16,256,1,8,3,496.3966666666667,3
w13,8,60,8,2048,1536,16,16,256,1,8,4,496.46066666666667,3
w13,8,60,8,2048,1536,16,16,256,4,4,2,494.978,3
w13,8,60,8,2048,1536,16,16,256,4,4,3,494.6786666666667,3
w13,8,60,8,2048,1536,16,16,256,4,4,4,495.2763333333333,3
w13,8,60,8,2048,1536,16,16,256,4,8,3,495.57466666666664,3
w13,8,60,8,2048,1536,16,16,256,4,8,4,496.2583333333334,3
w13,8,60,8,2048,1536,16,32,64,1,4,2,495.586,3
w13,8,60,8,2048,1536,16,32,64,1,4,3,493.911,3
w13,8,60,8,2048,1536,16,32,64,1,4,4,495.90599999999995,3
w13,8,60,8,2048,1536,16,32,64,1,8,3,496.311,3
w13,8,60,8,2048,1536,16,32,64,1,8,4,496.19399999999996,3
w13,8,60,8,2048,1536,16,32,64,16,4,3,494.6043333333334,3
w13,8,60,8,2048,1536,16,32,64,16,4,4,496.00199999999995,3
w13,8,60,8,2048,1536,16,32,64,32,4,3,494.508,3
w13,8,60,8,2048,1536,16,32,64,32,8,4,496.546,3
w13,8,60,8,2048,1536,16,32,64,64,4,3,494.46600000000007,3
w13,8,60,8,2048,1536,16,32,64,64,4,4,495.83099999999996,3
w13,8,60,8,2048,1536,16,32,128,1,4,2,491.6286666666667,3
w13,8,60,8,2048,1536,16,32,128,1,4,3,494.4873333333333,3
w13,8,60,8,2048,1536,16,32,128,1,4,4,494.4023333333333,3
w13,8,60,8,2048,1536,16,32,128,1,8,3,494.903,3
w13,8,60,8,2048,1536,16,32,128,1,8,4,494.8713333333333,3
w13,8,60,8,2048,1536,16,32,128,4,4,2,494.12466666666666,3
w13,8,60,8,2048,1536,16,32,128,4,4,3,495.03133333333335,3
w13,8,60,8,2048,1536,16,32,128,4,4,4,494.75399999999996,3
w13,8,60,8,2048,1536,16,32,128,4,8,3,495.03133333333335,3
w13,8,60,8,2048,1536,16,32,128,4,8,4,495.9373333333333,3
w13,8,60,8,2048,1536,16,32,128,16,4,2,494.498,3
w13,8,60,8,2048,1536,16,32,128,16,4,3,494.76433333333335,3
w13,8,60,8,2048,1536,16,32,128,16,4,4,495.106,3
w13,8,60,8,2048,1536,16,32,128,16,8,3,495.1803333333333,3
w13,8,60,8,2048,1536,16,32,128,16,8,4,495.31899999999996,3
w13,8,60,8,2048,1536,16,32,128,32,4,2,494.90333333333336,3
w13,8,60,8,2048,1536,16,32,128,32,4,3,494.551,3
w13,8,60,8,2048,1536,16,32,128,32,4,4,495.3296666666667,3
w13,8,60,8,2048,1536,16,32,128,32,8,3,495.33033333333333,3
w13,8,60,8,2048,1536,16,32,128,32,8,4,495.14866666666666,3
w13,8,60,8,2048,1536,16,32,128,64,4,2,494.818,3
w13,8,60,8,2048,1536,16,32,128,64,4,3,495.15900000000005,3
w13,8,60,8,2048,1536,16,32,128,64,4,4,495.44699999999995,3
w13,8,60,8,2048,1536,16,32,128,64,8,3,495.415,3
w13,8,60,8,2048,1536,16,32,128,64,8,4,495.63899999999995,3
w13,8,60,8,2048,1536,16,32,256,1,4,2,493.04733333333337,3
w13,8,60,8,2048,1536,16,32,256,1,4,3,494.786,3
w13,8,60,8,2048,1536,16,32,256,1,4,4,495.426,3
w13,8,60,8,2048,1536,16,32,256,1,8,2,495.863,3
w13,8,60,8,2048,1536,16,32,256,1,8,3,494.978,3
w13,8,60,8,2048,1536,16,32,256,1,8,4,495.50066666666663,3
w13,8,60,8,2048,1536,16,32,256,16,4,2,494.786,3
w13,8,60,8,2048,1536,16,32,256,16,4,3,495.27666666666664,3
w13,8,60,8,2048,1536,16,32,256,16,4,4,495.51099999999997,3
w13,8,60,8,2048,1536,16,32,256,16,8,2,495.20166666666665,3
w13,8,60,8,2048,1536,16,32,256,16,8,3,495.394,3
w13,8,60,8,2048,1536,16,32,256,16,8,4,495.778,3
w13,8,60,8,2048,1536,16,32,256,32,4,2,494.99933333333337,3
w13,8,60,8,2048,1536,16,32,256,32,4,3,495.74600000000004,3
w13,8,60,8,2048,1536,16,32,256,32,4,4,495.60699999999997,3
w13,8,60,8,2048,1536,16,32,256,32,8,2,495.22333333333336,3
w13,8,60,8,2048,1536,16,32,256,32,8,3,495.8206666666667,3
w13,8,60,8,2048,1536,16,32,256,32,8,4,495.78833333333336,3
w13,8,60,8,2048,1536,16,32,256,64,4,2,495.50066666666663,3
w13,8,60,8,2048,1536,16,32,256,64,4,3,495.874,3
w13,8,60,8,2048,1536,16,32,256,64,4,4,496.17233333333337,3
w13,8,60,8,2048,1536,16,32,256,64,8,2,495.91633333333334,3
w13,8,60,8,2048,1536,16,32,256,64,8,3,496.48199999999997,3
w13,8,60,8,2048,1536,16,32,256,64,8,4,495.92699999999996,3
w13,8,60,8,2048,1536,16,64,64,1,4,2,495.12699999999995,3
w13,8,60,8,2048,1536,16,64,64,1,4,3,494.4123333333334,3
w13,8,60,8,2048,1536,16,64,64,1,4,4,496.50333333333333,3
w13,8,60,8,2048,1536,16,64,64,1,8,2,494.743,3
w13,8,60,8,2048,1536,16,64,64,1,8,3,494.5083333333334,3
w13,8,60,8,2048,1536,16,64,64,1,8,4,494.978,3
w13,8,60,8,2048,1536,16,64,64,16,4,2,495.8523333333333,3
w13,8,60,8,2048,1536,16,64,64,16,4,3,494.615,3
w13,8,60,8,2048,1536,16,64,64,16,4,4,496.11899999999997,3
w13,8,60,8,2048,1536,16,64,64,16,8,3,494.594,3
w13,8,60,8,2048,1536,16,64,64,16,8,4,496.1406666666667,3
w13,8,60,8,2048,1536,16,64,64,32,4,3,495.09499999999997,3
w13,8,60,8,2048,1536,16,64,64,32,4,4,495.586,3
w13,8,60,8,2048,1536,16,64,64,32,8,3,495.1913333333334,3
w13,8,60,8,2048,1536,16,64,64,32,8,4,495.66066666666666,3
w13,8,60,8,2048,1536,16,64,64,64,4,3,495.7456666666667,3
w13,8,60,8,2048,1536,16,64,64,64,8,3,495.9376666666667,3
w13,8,60,8,2048,1536,16,64,64,64,8,4,495.81,3
w13,8,60,8,2048,1536,16,64,128,1,4,2,493.69800000000004,3
w13,8,60,8,2048,1536,16,64,128,1,4,3,494.5296666666666,3
w13,8,60,8,2048,1536,16,64,128,1,4,4,495.54333333333335,3
w13,8,60,8,2048,1536,16,64,128,1,8,2,494.02833333333336,3
w13,8,60,8,2048,1536,16,64,128,1,8,3,494.29466666666667,3
w13,8,60,8,2048,1536,16,64,128,1,8,4,494.99933333333337,3
w13,8,60,8,2048,1536,16,64,128,16,4,2,494.7326666666666,3
w13,8,60,8,2048,1536,16,64,128,16,4,3,494.722,3
w13,8,60,8,2048,1536,16,64,128,16,4,4,495.1913333333334,3
w13,8,60,8,2048,1536,16,64,128,16,8,2,494.3913333333333,3
w13,8,60,8,2048,1536,16,64,128,16,8,3,494.76433333333335,3
w13,8,60,8,2048,1536,16,64,128,16,8,4,494.83933333333334,3
w13,8,60,8,2048,1536,16,64,128,32,4,2,494.8709999999999,3
w13,8,60,8,2048,1536,16,64,128,32,4,3,495.50033333333334,3
w13,8,60,8,2048,1536,16,64,128,32,4,4,495.46866666666665,3
w13,8,60,8,2048,1536,16,64,128,32,8,2,494.5083333333334,3
w13,8,60,8,2048,1536,16,64,128,32,8,3,495.15900000000005,3
w13,8,60,8,2048,1536,16,64,128,32,8,4,495.18066666666664,3
w13,8,60,8,2048,1536,16,64,128,64,4,2,495.2763333333333,3
w13,8,60,8,2048,1536,16,64,128,64,4,3,495.031,3
w13,8,60,8,2048,1536,16,64,128,64,4,4,495.7673333333334,3
w13,8,60,8,2048,1536,16,64,128,64,8,2,495.88433333333336,3
w13,8,60,8,2048,1536,16,64,128,64,8,3,495.38300000000004,3
w13,8,60,8,2048,1536,16,64,128,64,8,4,495.85266666666666,3
w13,8,60,8,2048,1536,16,64,256,1,4,2,492.86566666666664,3
w13,8,60,8,2048,1536,16,64,256,1,4,3,495.30833333333334,3
w13,8,60,8,2048,1536,16,64,256,1,8,2,495.29766666666666,3
w13,8,60,8,2048,1536,16,64,256,1,8,3,494.9566666666667,3
w13,8,60,8,2048,1536,16,64,256,16,4,2,495.22333333333336,3
w13,8,60,8,2048,1536,16,64,256,16,4,3,495.81,3
w13,8,60,8,2048,1536,16,64,256,16,8,2,495.13733333333334,3
w13,8,60,8,2048,1536,16,64,256,16,8,3,495.66066666666666,3
w13,8,60,8,2048,1536,16,64,256,32,4,2,495.2126666666666,3
w13,8,60,8,2048,1536,16,64,256,32,4,3,495.94866666666667,3
w13,8,60,8,2048,1536,16,64,256,32,8,2,495.138,3
w13,8,60,8,2048,1536,16,64,256,32,8,3,495.93833333333333,3
w13,8,60,8,2048,1536,16,64,256,64,4,2,495.884,3
w13,8,60,8,2048,1536,16,64,256,64,4,3,496.49233333333336,3
w13,8,60,8,2048,1536,16,64,256,64,8,2,495.12699999999995,3
w13,8,60,8,2048,1536,16,64,256,64,8,3,496.4073333333333,3
w13,8,60,8,2048,1536,16,128,64,1,4,2,496.0553333333333,3
w13,8,60,8,2048,1536,16,128,64,1,4,3,494.90333333333336,3
w13,8,60,8,2048,1536,16,128,64,1,4,4,494.3906666666667,3
w13,8,60,8,2048,1536,16,128,64,1,8,3,494.78566666666666,3
w13,8,60,8,2048,1536,16,128,64,1,8,4,494.231,3
w13,8,60,8,2048,1536,16,128,64,16,4,3,495.17,3
w13,8,60,8,2048,1536,16,128,64,16,4,4,494.91333333333336,3
w13,8,60,8,2048,1536,16,128,64,16,8,3,495.06300000000005,3
w13,8,60,8,2048,1536,16,128,64,16,8,4,494.359,3
w13,8,60,8,2048,1536,16,128,64,32,4,3,495.266,3
w13,8,60,8,2048,1536,16,128,64,32,4,4,495.6073333333334,3
w13,8,60,8,2048,1536,16,128,64,32,8,3,495.73533333333336,3
w13,8,60,8,2048,1536,16,128,64,32,8,4,495.4363333333333,3
w13,8,60,8,2048,1536,16,128,64,64,8,4,496.07633333333337,3
w13,8,60,8,2048,1536,16,128,128,1,4,2,493.922,3
w13,8,60,8,2048,1536,16,128,128,1,4,3,495.1483333333333,3
w13,8,60,8,2048,1536,16,128,128,1,8,2,494.30600000000004,3
w13,8,60,8,2048,1536,16,128,128,1,8,3,494.27400000000006,3
w13,8,60,8,2048,1536,16,128,128,16,4,2,496.247,3
w13,8,60,8,2048,1536,16,128,128,16,4,3,495.06300000000005,3
w13,8,60,8,2048,1536,16,128,128,16,8,2,494.818,3
w13,8,60,8,2048,1536,16,128,128,16,8,3,494.9243333333333,3
w13,8,60,8,2048,1536,16,128,128,32,4,2,495.92699999999996,3
w13,8,60,8,2048,1536,16,128,128,32,4,3,495.25499999999994,3
w13,8,60,8,2048,1536,16,128,128,32,8,2,494.98866666666663,3
w13,8,60,8,2048,1536,16,128,128,32,8,3,495.69266666666664,3
w13,8,60,8,2048,1536,16,128,128,64,4,2,495.234,3
w13,8,60,8,2048,1536,16,128,128,64,4,3,495.37266666666665,3
w13,8,60,8,2048,1536,16,128,128,64,8,2,495.1266666666667,3
w13,8,60,8,2048,1536,16,128,128,64,8,3,495.202,3
w13,8,60,8,2048,1536,16,256,64,1,4,3,496.5566666666667,3
w13,8,60,8,2048,1536,16,256,64,1,8,3,496.0443333333333,3
w13,8,60,8,2048,1536,16,256,64,16,8,2,496.39633333333336,3
w13,8,60,8,2048,1536,16,256,64,16,8,3,496.38599999999997,3
w13,8,60,8,2048,1536,32,16,128,4,4,2,493.23900000000003,3
w13,8,60,8,2048,1536,32,16,128,4,4,3,495.2126666666666,3
w13,8,60,8,2048,1536,32,16,128,4,4,4,495.9376666666667,3
w13,8,60,8,2048,1536,32,32,64,1,4,2,496.503,3
w13,8,60,8,2048,1536,32,32,64,1,4,4,494.64733333333334,3
w13,8,60,8,2048,1536,32,32,64,1,8,4,495.714,3
w13,8,60,8,2048,1536,32,32,64,32,4,4,495.2336666666667,3
w13,8,60,8,2048,1536,32,32,64,32,8,4,495.90599999999995,3
w13,8,60,8,2048,1536,32,32,64,64,4,4,495.3296666666667,3
w13,8,60,8,2048,1536,32,32,64,64,8,4,495.60699999999997,3
w13,8,60,8,2048,1536,32,32,64,128,4,4,495.16966666666667,3
w13,8,60,8,2048,1536,32,32,64,128,8,4,495.69233333333335,3
w13,8,60,8,2048,1536,32,32,128,1,4,2,496.03433333333334,3
w13,8,60,8,2048,1536,32,32,128,1,4,3,495.2126666666666,3
w13,8,60,8,2048,1536,32,32,128,1,4,4,496.1513333333333,3
w13,8,60,8,2048,1536,32,32,128,1,8,4,496.25766666666664,3
w13,8,60,8,2048,1536,32,32,128,4,4,3,494.88166666666666,3
w13,8,60,8,2048,1536,32,32,128,4,4,4,495.586,3
w13,8,60,8,2048,1536,32,32,128,4,8,3,496.535,3
w13,8,60,8,2048,1536,32,32,128,4,8,4,495.85266666666666,3
w13,8,60,8,2048,1536,32,32,128,16,4,3,495.4363333333333,3
w13,8,60,8,2048,1536,32,32,128,16,4,4,495.682,3
w13,8,60,8,2048,1536,32,32,128,16,8,3,496.55633333333327,3
w13,8,60,8,2048,1536,32,32,128,16,8,4,495.9593333333333,3
w13,8,60,8,2048,1536,32,32,128,64,4,3,495.8523333333333,3
w13,8,60,8,2048,1536,32,32,128,64,4,4,496.07633333333337,3
w13,8,60,8,2048,1536,32,32,128,64,8,3,496.35366666666664,3
w13,8,60,8,2048,1536,32,32,128,64,8,4,496.24666666666667,3
w13,8,60,8,2048,1536,32,32,256,1,4,2,494.7006666666666,3
w13,8,60,8,2048,1536,32,32,256,1,4,3,495.3086666666666,3
w13,8,60,8,2048,1536,32,32,256,1,4,4,494.8926666666666,3
w13,8,60,8,2048,1536,32,32,256,1,8,3,495.1913333333334,3
w13,8,60,8,2048,1536,32,32,256,1,8,4,495.50033333333334,3
w13,8,60,8,2048,1536,32,32,256,4,4,3,495.06333333333333,3
w13,8,60,8,2048,1536,32,32,256,4,4,4,495.56466666666665,3
w13,8,60,8,2048,1536,32,32,256,4,8,3,495.33,3
w13,8,60,8,2048,1536,32,32,256,4,8,4,495.2656666666667,3
w13,8,60,8,2048,1536,32,32,256,16,4,2,496.56733333333335,3
w13,8,60,8,2048,1536,32,32,256,16,4,3,495.1803333333333,3
w13,8,60,8,2048,1536,32,32,256,16,4,4,495.20166666666665,3
w13,8,60,8,2048,1536,32,32,256,16,8,2,496.4286666666667,3
w13,8,60,8,2048,1536,32,32,256,16,8,3,495.532,3
w13,8,60,8,2048,1536,32,32,256,16,8,4,495.46866666666665,3
w13,8,60,8,2048,1536,32,32,256,32,4,3,495.8633333333334,3
w13,8,60,8,2048,1536,32,32,256,32,4,4,495.82033333333334,3
w13,8,60,8,2048,1536,32,32,256,32,8,3,496.3433333333333,3
w13,8,60,8,2048,1536,32,32,256,32,8,4,496.03400000000005,3
w13,8,60,8,2048,1536,32,64,64,1,4,3,495.56466666666665,3
w13,8,60,8,2048,1536,32,64,64,1,4,4,494.65799999999996,3
w13,8,60,8,2048,1536,32,64,64,1,8,3,494.99933333333337,3
w13,8,60,8,2048,1536,32,64,64,1,8,4,494.508,3
w13,8,60,8,2048,1536,32,64,64,16,4,3,495.4576666666667,3
w13,8,60,8,2048,1536,32,64,64,16,4,4,494.8926666666666,3
w13,8,60,8,2048,1536,32,64,64,16,8,3,496.00199999999995,3
w13,8,60,8,2048,1536,32,64,64,16,8,4,495.575,3
w13,8,60,8,2048,1536,32,64,64,64,4,4,496.28999999999996,3
w13,8,60,8,2048,1536,32,64,64,64,8,3,496.578,3
w13,8,60,8,2048,1536,32,64,64,64,8,4,495.6393333333333,3
w13,8,60,8,2048,1536,32,64,128,1,4,2,492.67366666666663,3
w13,8,60,8,2048,1536,32,64,128,1,4,3,495.458,3
w13,8,60,8,2048,1536,32,64,128,1,4,4,495.692,3
w13,8,60,8,2048,1536,32,64,128,1,8,2,494.2846666666667,3
w13,8,60,8,2048,1536,32,64,128,1,8,3,494.807,3
w13,8,60,8,2048,1536,32,64,128,1,8,4,495.682,3
w13,8,60,8,2048,1536,32,64,128,4,4,2,494.6793333333333,3
w13,8,60,8,2048,1536,32,64,128,4,4,3,495.01,3
w13,8,60,8,2048,1536,32,64,128,4,4,4,495.37266666666665,3
w13,8,60,8,2048,1536,32,64,128,4,8,2,495.234,3
w13,8,60,8,2048,1536,32,64,128,4,8,3,494.94599999999997,3
w13,8,60,8,2048,1536,32,64,128,4,8,4,495.17,3
w13,8,60,8,2048,1536,32,64,128,16,4,2,495.10566666666665,3
w13,8,60,8,2048,1536,32,64,128,16,4,3,495.07366666666667,3
w13,8,60,8,2048,1536,32,64,128,16,4,4,495.6496666666667,3
w13,8,60,8,2048,1536,32,64,128,16,8,2,494.6793333333333,3
w13,8,60,8,2048,1536,32,64,128,16,8,3,494.84999999999997,3
w13,8,60,8,2048,1536,32,64,128,16,8,4,495.82033333333334,3
w13,8,60,8,2048,1536,32,64,128,32,4,2,495.44733333333335,3
w13,8,60,8,2048,1536,32,64,128,32,4,3,495.202,3
w13,8,60,8,2048,1536,32,64,128,32,4,4,495.7459999999999,3
w13,8,60,8,2048,1536,32,64,128,32,8,2,494.935,3
w13,8,60,8,2048,1536,32,64,128,32,8,3,495.362,3
w13,8,60,8,2048,1536,32,64,128,32,8,4,495.35099999999994,3
w13,8,60,8,2048,1536,32,64,128,64,4,2,495.3833333333334,3
w13,8,60,8,2048,1536,32,64,128,64,4,3,496.0976666666667,3
w13,8,60,8,2048,1536,32,64,128,64,4,4,496.3113333333333,3
w13,8,60,8,2048,1536,32,64,128,64,8,2,495.8953333333333,3
w13,8,60,8,2048,1536,32,64,128,64,8,3,495.08466666666664,3
w13,8,60,8,2048,1536,32,64,128,64,8,4,495.85266666666666,3
w13,8,60,8,2048,1536,32,64,256,1,4,2,493.9753333333333,3
w13,8,60,8,2048,1536,32,64,256,1,4,3,495.99133333333333,3
w13,8,60,8,2048,1536,32,64,256,1,8,2,494.978,3
w13,8,60,8,2048,1536,32,64,256,1,8,3,495.714,3
w13,8,60,8,2048,1536,32,64,256,8,4,2,495.75666666666666,3
w13,8,60,8,2048,1536,32,64,256,8,4,3,495.89466666666664,3
w13,8,60,8,2048,1536,32,64,256,8,8,2,495.074,3
w13,8,60,8,2048,1536,32,64,256,8,8,3,495.522,3
w13,8,60,8,2048,1536,32,64,256,16,4,2,496.0553333333333,3
w13,8,60,8,2048,1536,32,64,256,16,8,2,495.37266666666665,3
w13,8,60,8,2048,1536,32,64,256,16,8,3,495.874,3
w13,8,60,8,2048,1536,32,64,256,32,4,2,495.96999999999997,3
w13,8,60,8,2048,1536,32,64,256,32,8,2,495.06333333333333,3
w13,8,60,8,2048,1536,32,64,256,32,8,3,496.2366666666667,3
w13,8,60,8,2048,1536,32,64,256,64,8,2,495.73533333333336,3
w13,8,60,8,2048,1536,32,128,64,1,4,2,495.138,3
w13,8,60,8,2048,1536,32,128,64,1,4,3,495.7246666666667,3
w13,8,60,8,2048,1536,32,128,64,1,4,4,494.7753333333333,3
w13,8,60,8,2048,1536,32,128,64,1,8,2,496.5353333333333,3
w13,8,60,8,2048,1536,32,128,64,1,8,3,495.54299999999995,3
w13,8,60,8,2048,1536,32,128,64,1,8,4,494.45533333333333,3
w13,8,60,8,2048,1536,32,128,64,4,4,2,495.959,3
w13,8,60,8,2048,1536,32,128,64,4,4,3,495.671,3
w13,8,60,8,2048,1536,32,128,64,4,4,4,495.4793333333334,3
w13,8,60,8,2048,1536,32,128,64,4,8,2,496.27933333333334,3
w13,8,60,8,2048,1536,32,128,64,4,8,3,495.50066666666663,3
w13,8,60,8,2048,1536,32,128,64,4,8,4,495.54299999999995,3
w13,8,60,8,2048,1536,32,128,64,16,4,2,496.07666666666665,3
w13,8,60,8,2048,1536,32,128,64,16,4,3,495.59633333333335,3
w13,8,60,8,2048,1536,32,128,64,16,4,4,494.95666666666665,3
w13,8,60,8,2048,1536,32,128,64,16,8,2,496.10833333333335,3
w13,8,60,8,2048,1536,32,128,64,16,8,3,495.8206666666667,3
w13,8,60,8,2048,1536,32,128,64,16,8,4,494.743,3
w13,8,60,8,2048,1536,32,128,64,32,4,2,496.3433333333333,3
w13,8,60,8,2048,1536,32,128,64,32,4,4,496.08733333333333,3
w13,8,60,8,2048,1536,32,128,64,32,8,2,496.3323333333333,3
w13,8,60,8,2048,1536,32,128,64,32,8,3,496.1086666666667,3
w13,8,60,8,2048,1536,32,128,64,32,8,4,495.7563333333333,3
w13,8,60,8,2048,1536,32,128,128,1,4,2,493.9536666666667,3
w13,8,60,8,2048,1536,32,128,128,1,4,3,495.73533333333336,3
w13,8,60,8,2048,1536,32,128,128,1,8,2,494.6046666666667,3
w13,8,60,8,2048,1536,32,128,128,1,8,3,494.722,3
w13,8,60,8,2048,1536,32,128,128,4,4,2,496.32199999999995,3
w13,8,60,8,2048,1536,32,128,128,4,4,3,495.6073333333334,3
w13,8,60,8,2048,1536,32,128,128,4,8,2,494.96700000000004,3
w13,8,60,8,2048,1536,32,128,128,4,8,3,495.05266666666665,3
w13,8,60,8,2048,1536,32,128,128,8,4,2,495.69266666666664,3
w13,8,60,8,2048,1536,32,128,128,8,4,3,495.4046666666666,3
w13,8,60,8,2048,1536,32,128,128,8,8,2,495.15933333333334,3
w13,8,60,8,2048,1536,32,128,128,8,8,3,495.6496666666667,3
w13,8,60,8,2048,1536,32,128,128,16,4,2,496.29,3
w13,8,60,8,2048,1536,32,128,128,16,4,3,495.7673333333334,3
w13,8,60,8,2048,1536,32,128,128,16,8,2,495.308,3
w13,8,60,8,2048,1536,32,128,128,16,8,3,495.46866666666665,3
w13,8,60,8,2048,1536,32,128,128,32,4,2,496.3326666666667,3
w13,8,60,8,2048,1536,32,128,128,32,4,3,495.51133333333337,3
w13,8,60,8,2048,1536,32,128,128,32,8,2,495.682,3
w13,8,60,8,2048,1536,32,128,128,32,8,3,495.54333333333335,3
w13,8,60,8,2048,1536,32,128,128,64,4,2,495.94866666666667,3
w13,8,60,8,2048,1536,32,128,128,64,4,3,495.7456666666667,3
w13,8,60,8,2048,1536,32,128,128,64,8,2,496.07633333333337,3
w13,8,60,8,2048,1536,32,128,128,64,8,3,495.22333333333336,3
w13,8,60,8,2048,1536,32,256,64,1,4,2,496.56733333333335,3
w13,8,60,8,2048,1536,32,256,64,1,4,3,496.44966666666664,3
w13,8,60,8,2048,1536,64,32,128,1,4,2,495.63866666666667,3
w13,8,60,8,2048,1536,64,32,128,1,4,3,496.4286666666667,3
w13,8,60,8,2048,1536,64,32,128,1,8,2,494.8286666666666,3
w13,8,60,8,2048,1536,64,32,128,16,4,2,495.17,3
w13,8,60,8,2048,1536,64,32,128,16,4,3,496.36466666666666,3
w13,8,60,8,2048,1536,64,32,128,16,8,2,495.1803333333333,3
w13,8,60,8,2048,1536,64,32,256,1,8,3,496.32199999999995,3
w13,8,60,8,2048,1536,64,64,64,1,4,2,495.50066666666663,3
w13,8,60,8,2048,1536,64,64,64,1,4,4,495.54333333333335,3
w13,8,60,8,2048,1536,64,64,64,1,8,2,495.39366666666666,3
w13,8,60,8,2048,1536,64,64,64,1,8,4,495.874,3
w13,8,60,8,2048,1536,64,64,64,4,4,4,495.8313333333333,3
w13,8,60,8,2048,1536,64,64,64,4,8,4,496.4286666666667,3
w13,8,60,8,2048,1536,64,64,64,16,4,4,495.24500000000006,3
w13,8,60,8,2048,1536,64,64,64,16,8,4,495.9273333333333,3
w13,8,60,8,2048,1536,64,64,128,1,4,3,496.19399999999996,3
w13,8,60,8,2048,1536,64,64,128,1,4,4,496.45,3
w13,8,60,8,2048,1536,64,64,128,1,8,2,494.9026666666667,3
w13,8,60,8,2048,1536,64,64,128,1,8,3,496.4926666666667,3
w13,8,60,8,2048,1536,64,64,128,1,8,4,496.2366666666667,3
w13,8,60,8,2048,1536,64,64,128,4,4,3,496.08733333333333,3
w13,8,60,8,2048,1536,64,64,128,4,8,2,494.61533333333335,3
w13,8,60,8,2048,1536,64,64,128,4,8,3,496.162,3
w13,8,60,8,2048,1536,64,64,128,4,8,4,495.85266666666666,3
w13,8,60,8,2048,1536,64,64,128,8,4,3,495.54333333333335,3
w13,8,60,8,2048,1536,64,64,128,8,4,4,496.02299999999997,3
w13,8,60,8,2048,1536,64,64,128,8,8,2,494.786,3
w13,8,60,8,2048,1536,64,64,128,8,8,3,495.12733333333335,3
w13,8,60,8,2048,1536,64,64,128,8,8,4,495.98066666666665,3
w13,8,60,8,2048,1536,64,64,128,16,4,3,495.97,3
w13,8,60,8,2048,1536,64,64,128,16,8,2,496.46066666666667,3
w13,8,60,8,2048,1536,64,64,128,16,8,3,496.013,3
w13,8,60,8,2048,1536,64,64,128,16,8,4,495.84200000000004,3
w13,8,60,8,2048,1536,64,64,128,32,4,3,496.1406666666667,3
w13,8,60,8,2048,1536,64,64,128,32,8,3,496.5886666666667,3
w13,8,60,8,2048,1536,64,64,128,64,4,3,496.2473333333333,3
w13,8,60,8,2048,1536,64,64,128,64,8,3,495.9593333333333,3
w13,8,60,8,2048,1536,64,128,64,1,4,4,495.874,3
w13,8,60,8,2048,1536,64,128,64,1,8,2,495.74600000000004,3
w13,8,60,8,2048,1536,64,128,64,1,8,3,496.0553333333333,3
w13,8,60,8,2048,1536,64,128,64,1,8,4,495.92733333333337,3
w13,8,60,8,2048,1536,64,128,64,16,4,4,496.28999999999996,3
w13,8,60,8,2048,1536,64,128,64,16,8,2,496.37533333333334,3
w13,8,60,8,2048,1536,64,128,64,16,8,4,496.04466666666667,3
w13,8,60,8,2048,1536,64,128,128,1,4,2,495.74600000000004,3
w13,8,60,8,2048,1536,64,128,128,1,8,3,496.18333333333334,3
w13,8,60,8,2048,1536,64,128,128,4,8,3,496.50333333333333,3
w13,8,60,8,2048,1536,64,128,128,16,8,3,495.97,3
w13,8,60,8,2048,1536,64,128,128,64,8,3,496.3113333333333,3
w13,8,60,8,2048,1536,128,64,64,1,8,3,496.4393333333333,3
w13,8,60,8,2048,1536,128,64,128,16,8,2,496.1086666666667,3
w13,8,64,6,3072,2048,16,16,64,1,4,3,793.7959999999999,3
w13,8,64,6,3072,2048,16,16,128,1,4,2,791.598,3
w13,8,64,6,3072,2048,16,16,128,1,4,3,791.46,3
w13,8,64,6,3072,2048,16,16,128,1,4,4,791.4273333333334,3
w13,8,64,6,3072,2048,16,16,128,1,8,2,792.708,3
w13,8,64,6,3072,2048,16,16,128,1,8,3,795.3953333333333,3
w13,8,64,6,3072,2048,16,16,128,1,8,4,794.4250000000001,3
w13,8,64,6,3072,2048,16,16,128,4,4,2,793.4973333333334,3
w13,8,64,6,3072,2048,16,16,128,4,4,3,792.8033333333333,3
w13,8,64,6,3072,2048,16,16,128,4,4,4,792.7933333333334,3
w13,8,64,6,3072,2048,16,16,128,4,8,2,795.5336666666667,3
w13,8,64,6,3072,2048,16,16,128,4,8,3,795.652,3
w13,8,64,6,3072,2048,16,16,128,4,8,4,793.38,3
w13,8,64,6,3072,2048,16,16,256,1,4,2,791.129,3
w13,8,64,6,3072,2048,16,16,256,1,4,3,788.4413333333333,3
w13,8,64,6,3072,2048,16,16,256,1,4,4,789.1869999999999,3
w13,8,64,6,3072,2048,16,16,256,1,8,2,791.5133333333333,3
w13,8,64,6,3072,2048,16,16,256,1,8,3,791.1926666666667,3
w13,8,64,6,3072,2048,16,16,256,1,8,4,790.6493333333333,3
w13,8,64,6,3072,2048,16,16,256,4,4,2,792.8356666666667,3
w13,8,64,6,3072,2048,16,16,256,4,4,3,788.857,3
w13,8,64,6,3072,2048,16,16,256,4,4,4,788.8359999999999,3
w13,8,64,6,3072,2048,16,16,256,4,8,2,792.2173333333334,3
w13,8,64,6,3072,2048,16,16,256,4,8,3,790.564,3
w13,8,64,6,3072,2048,16,16,256,4,8,4,789.966,3
w13,8,64,6,3072,2048,16,32,64,1,4,3,794.18,3
w13,8,64,6,3072,2048,16,32,64,1,4,4,795.8226666666666,3
w13,8,64,6,3072,2048,16,32,64,32,4,3,794.457,3
w13,8,64,6,3072,2048,16,32,64,32,4,4,796.1853333333333,3
w13,8,64,6,3072,2048,16,32,64,64,4,3,793.3586666666666,3
w13,8,64,6,3072,2048,16,32,64,64,4,4,793.9126666666667,3
w13,8,64,6,3072,2048,16,32,64,64,8,3,793.7959999999999,3
w13,8,64,6,3072,2048,16,32,64,64,8,4,794.2756666666668,3
w13,8,64,6,3072,2048,16,32,128,1,4,2,789.8173333333334,3
w13,8,64,6,3072,2048,16,32,128,1,4,3,791.0003333333334,3
w13,8,64,6,3072,2048,16,32,128,1,4,4,789.1453333333333,3
w13,8,64,6,3072,2048,16,32,128,1,8,2,791.5446666666667,3
w13,8,64,6,3072,2048,16,32,128,1,8,3,795.0973333333333,3
w13,8,64,6,3072,2048,16,32,128,1,8,4,791.5766666666667,3
w13,8,64,6,3072,2048,16,32,128,4,4,2,792.2599999999999,3
w13,8,64,6,3072,2048,16,32,128,4,4,3,794.436,3
w13,8,64,6,3072,2048,16,32,128,4,4,4,790.243,3
w13,8,64,6,3072,2048,16,32,128,4,8,2,794.3826666666668,3
w13,8,64,6,3072,2048,16,32,128,4,8,4,791.9293333333334,3
w13,8,64,6,3072,2048,16,32,128,16,4,2,794.116,3
w13,8,64,6,3072,2048,16,32,128,16,4,3,791.8119999999999,3
w13,8,64,6,3072,2048,16,32,128,16,4,4,788.9843333333333,3
w13,8,64,6,3072,2048,16,32,128,16,8,2,792.4946666666666,3
w13,8,64,6,3072,2048,16,32,128,16,8,3,794.1256666666667,3
w13,8,64,6,3072,2048,16,32,128,16,8,4,790.0733333333333,3
w13,8,64,6,3072,2048,16,32,128,32,4,2,792.3876666666666,3
w13,8,64,6,3072,2048,16,32,128,32,4,3,792.7076666666667,3
w13,8,64,6,3072,2048,16,32,128,32,4,4,789.3159999999999,3
w13,8,64,6,3072,2048,16,32,128,32,8,2,790.8833333333333,3
w13,8,64,6,3072,2048,16,32,128,32,8,3,794.3293333333332,3
w13,8,64,6,3072,2048,16,32,128,32,8,4,790.1896666666667,3
w13,8,64,6,3072,2048,16,32,128,64,4,2,791.3000000000001,3
w13,8,64,6,3072,2048,16,32,128,64,4,3,792.355,3
w13,8,64,6,3072,2048,16,32,128,64,4,4,789.3693333333334,3
w13,8,64,6,3072,2048,16,32,128,64,8,2,790.8616666666667,3
w13,8,64,6,3072,2048,16,32,128,64,8,3,793.2199999999999,3
w13,8,64,6,3072,2048,16,32,128,64,8,4,790.7983333333333,3
w13,8,64,6,3072,2048,16,32,256,1,4,2,791.8326666666667,3
w13,8,64,6,3072,2048,16,32,256,1,4,3,789.1239999999999,3
w13,8,64,6,3072,2048,16,32,256,1,4,4,789.0063333333334,3
w13,8,64,6,3072,2048,16,32,256,1,8,2,794.2113333333333,3
w13,8,64,6,3072,2048,16,32,256,1,8,3,790.457,3
w13,8,64,6,3072,2048,16,32,256,1,8,4,789.9340000000001,3
w13,8,64,6,3072,2048,16,32,256,16,4,2,792.6013333333334,3
w13,8,64,6,3072,2048,16,32,256,16,4,3,789.6460000000001,3
w13,8,64,6,3072,2048,16,32,256,16,4,4,789.7959999999999,3
w13,8,64,6,3072,2048,16,32,256,16,8,2,792.6966666666667,3
w13,8,64,6,3072,2048,16,32,256,16,8,3,790.1266666666667,3
w13,8,64,6,3072,2048,16,32,256,16,8,4,790.5203333333333,3
w13,8,64,6,3072,2048,16,32,256,32,4,2,793.3053333333334,3
w13,8,64,6,3072,2048,16,32,256,32,4,3,789.9229999999999,3
w13,8,64,6,3072,2048,16,32,256,32,4,4,790.0619999999999,3
w13,8,64,6,3072,2048,16,32,256,32,8,2,794.98,3
w13,8,64,6,3072,2048,16,32,256,32,8,3,790.436,3
w13,8,64,6,3072,2048,16,32,256,32,8,4,791.1283333333334,3
w13,8,64,6,3072,2048,16,32,256,64,4,2,793.924,3
w13,8,64,6,3072,2048,16,32,256,64,4,3,790.393,3
w13,8,64,6,3072,2048,16,32,256,64,4,4,790.5213333333335,3
w13,8,64,6,3072,2048,16,32,256,64,8,2,794.436,3
w13,8,64,6,3072,2048,16,32,256,64,8,3,790.4886666666666,3
w13,8,64,6,3072,2048,16,32,256,64,8,4,790.98,3
w13,8,64,6,3072,2048,16,64,64,1,4,4,795.8436666666666,3
w13,8,64,6,3072,2048,16,64,64,1,8,4,795.5343333333334,3
w13,8,64,6,3072,2048,16,64,64,64,4,4,795.1613333333333,3
w13,8,64,6,3072,2048,16,64,64,64,8,4,795.6626666666666,3
w13,8,64,6,3072,2048,16,64,128,1,4,2,795.609,3
w13,8,64,6,3072,2048,16,64,128,1,4,3,792.8146666666667,3
w13,8,64,6,3072,2048,16,64,128,1,4,4,790.5206666666667,3
w13,8,64,6,3072,2048,16,64,128,1,8,3,793.9446666666666,3
w13,8,64,6,3072,2048,16,64,128,1,8,4,790.3826666666668,3
w13,8,64,6,3072,2048,16,64,128,16,4,3,793.561,3
w13,8,64,6,3072,2048,16,64,128,16,4,4,789.348,3
w13,8,64,6,3072,2048,16,64,128,16,8,3,794.468,3
w13,8,64,6,3072,2048,16,64,128,16,8,4,789.7313333333333,3
w13,8,64,6,3072,2048,16,64,128,32,4,2,796.0146666666666,3
w13,8,64,6,3072,2048,16,64,128,32,4,3,793.8383333333333,3
w13,8,64,6,3072,2048,16,64,128,32,4,4,789.2946666666667,3
w13,8,64,6,3072,2048,16,64,128,32,8,3,795.225,3
w13,8,64,6,3072,2048,16,64,128,32,8,4,789.4226666666667,3
w13,8,64,6,3072,2048,16,64,128,64,4,2,795.0113333333334,3
w13,8,64,6,3072,2048,16,64,128,64,4,3,794.084,3
w13,8,64,6,3072,2048,16,64,128,64,4,4,789.4856666666668,3
w13,8,64,6,3072,2048,16,64,128,64,8,3,793.5506666666666,3
w13,8,64,6,3072,2048,16,64,128,64,8,4,790.532,3
w13,8,64,6,3072,2048,16,64,256,1,4,2,794.276,3
w13,8,64,6,3072,2048,16,64,256,1,4,3,790.19,3
w13,8,64,6,3072,2048,16,64,256,1,8,2,794.9906666666666,3
w13,8,64,6,3072,2048,16,64,256,1,8,3,789.3159999999999,3
w13,8,64,6,3072,2048,16,64,256,16,4,3,789.7426666666667,3
w13,8,64,6,3072,2048,16,64,256,16,8,3,789.6783333333333,3
w13,8,64,6,3072,2048,16,64,256,32,4,2,795.0973333333333,3
w13,8,64,6,3072,2048,16,64,256,32,4,3,790.2226666666667,3
w13,8,64,6,3072,2048,16,64,256,32,8,2,796.1213333333334,3
w13,8,64,6,3072,2048,16,64,256,32,8,3,789.6786666666667,3
w13,8,64,6,3072,2048,16,64,256,64,4,2,795.748,3
w13,8,64,6,3072,2048,16,64,256,64,4,3,790.308,3
w13,8,64,6,3072,2048,16,64,256,64,8,2,796.2386666666666,3
w13,8,64,6,3072,2048,16,64,256,64,8,3,790.4456666666666,3
w13,8,64,6,3072,2048,16,128,128,1,4,3,795.2573333333333,3
w13,8,64,6,3072,2048,16,128,128,1,8,3,794.5103333333333,3
w13,8,64,6,3072,2048,16,128,128,32,4,3,795.9933333333333,3
w13,8,64,6,3072,2048,16,128,128,32,8,3,795.8963333333332,3
w13,8,64,6,3072,2048,16,128,128,64,4,3,796.302,3
w13,8,64,6,3072,2048,16,128,128,64,8,3,794.9899999999999,3
w13,8,64,6,3072,2048,32,16,128,4,4,2,795.172,3
w13,8,64,6,3072,2048,32,16,128,4,4,3,790.4143333333333,3
w13,8,64,6,3072,2048,32,16,128,4,4,4,788.718,3
w13,8,64,6,3072,2048,32,16,128,4,8,2,796.0039999999999,3
w13,8,64,6,3072,2048,32,16,128,4,8,3,792.3026666666668,3
w13,8,64,6,3072,2048,32,16,128,4,8,4,790.7020000000001,3
w13,8,64,6,3072,2048,32,32,64,1,4,3,794.4466666666667,3
w13,8,64,6,3072,2048,32,32,64,1,8,3,795.0970000000001,3
w13,8,64,6,3072,2048,32,32,64,32,4,3,796.0033333333334,3
w13,8,64,6,3072,2048,32,32,64,32,8,3,795.9293333333334,3
w13,8,64,6,3072,2048,32,32,64,64,4,3,793.305,3
w13,8,64,6,3072,2048,32,32,64,64,8,3,793.6253333333334,3
w13,8,64,6,3072,2048,32,32,64,128,4,3,793.2623333333332,3
w13,8,64,6,3072,2048,32,32,64,128,8,3,793.9870000000001,3
w13,8,64,6,3072,2048,32,32,128,1,4,2,790.628,3
w13,8,64,6,3072,2048,32,32,128,1,4,3,790.1586666666666,3
w13,8,64,6,3072,2048,32,32,128,1,4,4,791.2036666666667,3
w13,8,64,6,3072,2048,32,32,128,1,8,2,791.7046666666666,3
w13,8,64,6,3072,2048,32,32,128,1,8,3,791.1186666666666,3
w13,8,64,6,3072,2048,32,32,128,1,8,4,791.5986666666668,3
w13,8,64,6,3072,2048,32,32,128,4,4,2,793.3366666666667,3
w13,8,64,6,3072,2048,32,32,128,4,4,3,791.6306666666666,3
w13,8,64,6,3072,2048,32,32,128,4,4,4,792.1096666666667,3
w13,8,64,6,3072,2048,32,32,128,4,8,2,794.5,3
w13,8,64,6,3072,2048,32,32,128,4,8,3,792.1640000000001,3
w13,8,64,6,3072,2048,32,32,128,4,8,4,792.2916666666666,3
w13,8,64,6,3072,2048,32,32,128,16,4,2,792.0673333333334,3
w13,8,64,6,3072,2048,32,32,128,16,4,3,790.1053333333333,3
w13,8,64,6,3072,2048,32,32,128,16,4,4,789.9133333333333,3
w13,8,64,6,3072,2048,32,32,128,16,8,2,792.9956666666667,3
w13,8,64,6,3072,2048,32,32,128,16,8,3,790.0616666666666,3
w13,8,64,6,3072,2048,32,32,128,16,8,4,790.98,3
w13,8,64,6,3072,2048,32,32,128,64,4,2,790.596,3
w13,8,64,6,3072,2048,32,32,128,64,4,3,790.5843333333333,3
w13,8,64,6,3072,2048,32,32,128,64,4,4,789.9026666666667,3
w13,8,64,6,3072,2048,32,32,128,64,8,2,791.0333333333333,3
w13,8,64,6,3072,2048,32,32,128,64,8,3,788.942,3
w13,8,64,6,3072,2048,32,32,128,64,8,4,791.3416666666667,3
w13,8,64,6,3072,2048,32,32,256,1,4,2,788.6116666666667,3
w13,8,64,6,3072,2048,32,32,256,1,4,3,789.2413333333334,3
w13,8,64,6,3072,2048,32,32,256,1,4,4,788.9523333333333,3
w13,8,64,6,3072,2048,32,32,256,1,8,2,790.6173333333332,3
w13,8,64,6,3072,2048,32,32,256,1,8,3,788.9,3
w13,8,64,6,3072,2048,32,32,256,1,8,4,788.996,3
w13,8,64,6,3072,2048,32,32,256,4,4,2,790.4456666666666,3
w13,8,64,6,3072,2048,32,32,256,4,4,3,789.5823333333334,3
w13,8,64,6,3072,2048,32,32,256,4,4,4,789.3266666666667,3
w13,8,64,6,3072,2048,32,32,256,4,8,2,790.628,3
w13,8,64,6,3072,2048,32,32,256,4,8,3,789.1233333333333,3
w13,8,64,6,3072,2048,32,32,256,4,8,4,789.284,3
w13,8,64,6,3072,2048,32,32,256,16,4,2,789.636,3
w13,8,64,6,3072,2048,32,32,256,16,4,3,790.7016666666667,3
w13,8,64,6,3072,2048,32,32,256,16,4,4,789.8173333333334,3
w13,8,64,6,3072,2048,32,32,256,16,8,2,789.7213333333333,3
w13,8,64,6,3072,2048,32,32,256,16,8,3,790.308,3
w13,8,64,6,3072,2048,32,32,256,16,8,4,790.062,3
w13,8,64,6,3072,2048,32,32,256,32,4,2,789.091,3
w13,8,64,6,3072,2048,32,32,256,32,4,3,790.457,3
w13,8,64,6,3072,2048,32,32,256,32,4,4,790.1259999999999,3
w13,8,64,6,3072,2048,32,32,256,32,8,2,788.8040000000001,3
w13,8,64,6,3072,2048,32,32,256,32,8,3,790.468,3
w13,8,64,6,3072,2048,32,32,256,32,8,4,790.2006666666666,3
w13,8,64,6,3072,2048,32,64,128,1,4,3,794.3926666666666,3
w13,8,64,6,3072,2048,32,64,128,1,4,4,790.6066666666667,3
w13,8,64,6,3072,2048,32,64,128,1,8,4,791.1826666666666,3
w13,8,64,6,3072,2048,32,64,128,4,4,4,791.4813333333333,3
w13,8,64,6,3072,2048,32,64,128,4,8,4,791.107,3
w13,8,64,6,3072,2048,32,64,128,16,4,3,794.9373333333333,3
w13,8,64,6,3072,2048,32,64,128,16,4,4,789.444,3
w13,8,64,6,3072,2048,32,64,128,16,8,3,795.1816666666667,3
w13,8,64,6,3072,2048,32,64,128,16,8,4,790.4786666666668,3
w13,8,64,6,3072,2048,32,64,128,32,4,3,795.9283333333333,3
w13,8,64,6,3072,2048,32,64,128,32,4,4,789.7423333333332,3
w13,8,64,6,3072,2048,32,64,128,32,8,3,794.2109999999999,3
w13,8,64,6,3072,2048,32,64,128,32,8,4,790.3389999999999,3
w13,8,64,6,3072,2048,32,64,128,64,4,3,794.3293333333335,3
w13,8,64,6,3072,2048,32,64,128,64,4,4,789.8386666666667,3
w13,8,64,6,3072,2048,32,64,128,64,8,3,794.3716666666666,3
w13,8,64,6,3072,2048,32,64,128,64,8,4,790.2653333333334,3
w13,8,64,6,3072,2048,32,64,256,1,4,3,790.3710000000001,3
w13,8,64,6,3072,2048,32,64,256,1,8,3,790.0733333333333,3
w13,8,64,6,3072,2048,32,64,256,8,4,3,790.4893333333333,3
w13,8,64,6,3072,2048,32,64,256,8,8,3,790.2860000000001,3
w13,8,64,6,3072,2048,32,64,256,16,4,3,790.6706666666668,3
w13,8,64,6,3072,2048,32,64,256,16,8,3,790.0626666666667,3
w13,8,64,6,3072,2048,32,64,256,32,4,3,790.7346666666667,3
w13,8,64,6,3072,2048,32,64,256,32,8,3,790.9366666666666,3
w13,8,64,6,3072,2048,32,64,256,64,4,3,791.2253333333333,3
w13,8,64,6,3072,2048,32,64,256,64,8,2,796.2913333333332,3
w13,8,64,6,3072,2048,32,64,256,64,8,3,790.2756666666668,3
w13,8,64,6,3072,2048,64,32,128,1,4,3,791.556,3
w13,8,64,6,3072,2048,64,32,128,1,4,4,791.9186666666668,3
w13,8,64,6,3072,2048,64,32,128,1,8,3,792.43,3
w13,8,64,6,3072,2048,64,32,128,1,8,4,791.9929999999999,3
w13,8,64,6,3072,2048,64,32,128,16,4,3,791.4813333333333,3
w13,8,64,6,3072,2048,64,32,128,16,4,4,794.9366666666666,3
w13,8,64,6,3072,2048,64,32,128,16,8,3,790.958,3
w13,8,64,6,3072,2048,64,32,128,16,8,4,795.2673333333333,3
w13,8,64,6,3072,2048,64,32,256,1,4,2,792.163,3
w13,8,64,6,3072,2048,64,32,256,1,4,3,790.2860000000001,3
w13,8,64,6,3072,2048,64,32,256,1,8,2,792.5043333333333,3
w13,8,64,6,3072,2048,64,32,256,1,8,3,790.19,3
w13,8,64,6,3072,2048,64,64,128,1,4,2,794.0946666666667,3
w13,8,64,6,3072,2048,64,64,128,1,4,3,792.7186666666666,3
w13,8,64,6,3072,2048,64,64,128,1,4,4,793.0706666666666,3
w13,8,64,6,3072,2048,64,64,128,1,8,3,794.0733333333334,3
w13,8,64,6,3072,2048,64,64,128,1,8,4,794.18,3
w13,8,64,6,3072,2048,64,64,128,4,4,2,794.9043333333333,3
w13,8,64,6,3072,2048,64,64,128,4,4,3,793.4003333333334,3
w13,8,64,6,3072,2048,64,64,128,4,4,4,793.6039999999999,3
w13,8,64,6,3072,2048,64,64,128,4,8,3,794.9693333333333,3
w13,8,64,6,3072,2048,64,64,128,4,8,4,793.9666666666667,3
w13,8,64,6,3072,2048,64,64,128,8,4,2,795.076,3
w13,8,64,6,3072,2048,64,64,128,8,4,3,792.8573333333334,3
w13,8,64,6,3072,2048,64,64,128,8,4,4,791.6946666666666,3
w13,8,64,6,3072,2048,64,64,128,8,8,3,792.6013333333334,3
w13,8,64,6,3072,2048,64,64,128,8,8,4,792.9746666666666,3
w13,8,64,6,3072,2048,64,64,128,16,4,2,796.3879999999999,3
w13,8,64,6,3072,2048,64,64,128,16,4,3,792.1636666666667,3
w13,8,64,6,3072,2048,64,64,128,16,4,4,791.427,3
w13,8,64,6,3072,2048,64,64,128,16,8,3,791.1923333333334,3
w13,8,64,6,3072,2048,64,64,128,16,8,4,792.6966666666667,3
w13,8,64,6,3072,2048,64,64,128,32,4,2,794.3393333333333,3
w13,8,64,6,3072,2048,64,64,128,32,4,3,791.203,3
w13,8,64,6,3072,2048,64,64,128,32,4,4,790.6593333333334,3
w13,8,64,6,3072,2048,64,64,128,32,8,3,790.5736666666667,3
w13,8,64,6,3072,2048,64,64,128,32,8,4,791.8433333333334,3
w13,8,64,6,3072,2048,64,64,128,64,4,2,793.6996666666668,3
w13,8,64,6,3072,2048,64,64,128,64,4,3,791.5769999999999,3
w13,8,64,6,3072,2048,64,64,128,64,4,4,791.3746666666666,3
w13,8,64,6,3072,2048,64,64,128,64,8,3,790.4893333333333,3
w13,8,64,6,3072,2048,64,64,128,64,8,4,792.0573333333333,3
w13,8,64,6,3584,1536,16,16,64,1,4,3,691.777,3
w13,8,64,6,3584,1536,16,16,64,1,4,4,695.5856666666667,3
w13,8,64,6,3584,1536,16,16,64,1,8,4,697.0369999999999,3
w13,8,64,6,3584,1536,16,16,128,1,4,2,690.3046666666668,3
w13,8,64,6,3584,1536,16,16,128,1,4,3,690.0696666666666,3
w13,8,64,6,3584,1536,16,16,128,1,4,4,691.2006666666666,3
w13,8,64,6,3584,1536,16,16,128,1,8,3,692.1076666666668,3
w13,8,64,6,3584,1536,16,16,128,4,4,2,690.422,3
w13,8,64,6,3584,1536,16,16,128,4,4,3,690.1656666666667,3
w13,8,64,6,3584,1536,16,16,128,4,4,4,691.9476666666666,3
w13,8,64,6,3584,1536,16,16,128,4,8,3,691.4033333333333,3
w13,8,64,6,3584,1536,16,16,256,1,4,2,690.2510000000001,3
w13,8,64,6,3584,1536,16,16,256,1,4,3,690.7953333333334,3
w13,8,64,6,3584,1536,16,16,256,1,4,4,690.7846666666668,3
w13,8,64,6,3584,1536,16,16,256,1,8,2,695.319,3
w13,8,64,6,3584,1536,16,16,256,1,8,3,693.708,3
w13,8,64,6,3584,1536,16,16,256,1,8,4,693.1746666666667,3
w13,8,64,6,3584,1536,16,16,256,4,4,2,690.3896666666666,3
w13,8,64,6,3584,1536,16,16,256,4,4,3,690.8806666666666,3
w13,8,64,6,3584,1536,16,16,256,4,4,4,691.1793333333334,3
w13,8,64,6,3584,1536,16,16,256,4,8,2,696.8233333333334,3
w13,8,64,6,3584,1536,16,16,256,4,8,3,693.0569999999999,3
w13,8,64,6,3584,1536,16,16,256,4,8,4,693.0039999999999,3
w13,8,64,6,3584,1536,16,32,64,1,4,3,692.449,3
w13,8,64,6,3584,1536,16,32,64,1,4,4,693.0996666666666,3
w13,8,64,6,3584,1536,16,32,64,1,8,4,695.4263333333333,3
w13,8,64,6,3584,1536,16,32,64,16,4,3,693.7616666666667,3
w13,8,64,6,3584,1536,16,32,64,16,4,4,695.9376666666667,3
w13,8,64,6,3584,1536,16,32,64,32,4,3,694.2306666666667,3
w13,8,64,6,3584,1536,16,32,64,32,4,4,695.4263333333333,3
w13,8,64,6,3584,1536,16,32,64,32,8,4,696.6419999999999,3
w13,8,64,6,3584,1536,16,32,64,64,4,3,694.9456666666666,3
w13,8,64,6,3584,1536,16,32,64,64,4,4,695.2763333333332,3
w13,8,64,6,3584,1536,16,32,64,64,8,4,696.5993333333332,3
w13,8,64,6,3584,1536,16,32,128,1,4,2,690.6676666666667,3
w13,8,64,6,3584,1536,16,32,128,1,4,3,693.3026666666666,3
w13,8,64,6,3584,1536,16,32,128,1,4,4,691.2539999999999,3
w13,8,64,6,3584,1536,16,32,128,1,8,2,690.8913333333334,3
w13,8,64,6,3584,1536,16,32,128,1,8,4,692.2783333333333,3
w13,8,64,6,3584,1536,16,32,128,4,4,2,690.699,3
w13,8,64,6,3584,1536,16,32,128,4,4,3,693.0573333333333,3
w13,8,64,6,3584,1536,16,32,128,4,4,4,690.6353333333333,3
w13,8,64,6,3584,1536,16,32,128,4,8,2,690.3793333333333,3
w13,8,64,6,3584,1536,16,32,128,4,8,4,692.748,3
w13,8,64,6,3584,1536,16,32,128,16,4,2,692.524,3
w13,8,64,6,3584,1536,16,32,128,16,4,3,692.9613333333333,3
w13,8,64,6,3584,1536,16,32,128,16,4,4,691.1043333333333,3
w13,8,64,6,3584,1536,16,32,128,16,8,2,691.3820000000001,3
w13,8,64,6,3584,1536,16,32,128,16,8,3,695.1166666666667,3
w13,8,64,6,3584,1536,16,32,128,16,8,4,692.8223333333334,3
w13,8,64,6,3584,1536,16,32,128,32,4,2,691.7130000000001,3
w13,8,64,6,3584,1536,16,32,128,32,4,3,692.428,3
w13,8,64,6,3584,1536,16,32,128,32,4,4,691.467,3
w13,8,64,6,3584,1536,16,32,128,32,8,2,690.7523333333334,3
w13,8,64,6,3584,1536,16,32,128,32,8,3,695.2446666666666,3
w13,8,64,6,3584,1536,16,32,128,32,8,4,693.1640000000001,3
w13,8,64,6,3584,1536,16,32,128,64,4,2,692.8226666666666,3
w13,8,64,6,3584,1536,16,32,128,64,4,3,692.6726666666667,3
w13,8,64,6,3584,1536,16,32,128,64,4,4,692.2463333333334,3
w13,8,64,6,3584,1536,16,32,128,64,8,2,691.0406666666667,3
w13,8,64,6,3584,1536,16,32,128,64,8,3,694.4866666666667,3
w13,8,64,6,3584,1536,16,32,128,64,8,4,692.641,3
w13,8,64,6,3584,1536,16,32,256,1,4,2,692.7156666666666,3
w13,8,64,6,3584,1536,16,32,256,1,4,3,692.4813333333333,3
w13,8,64,6,3584,1536,16,32,256,1,4,4,690.7956666666665,3
w13,8,64,6,3584,1536,16,32,256,1,8,3,692.5876666666667,3
w13,8,64,6,3584,1536,16,32,256,1,8,4,692.0646666666667,3
w13,8,64,6,3584,1536,16,32,256,16,4,2,693.2066666666666,3
w13,8,64,6,3584,1536,16,32,256,16,4,3,692.1610000000001,3
w13,8,64,6,3584,1536,16,32,256,16,4,4,692.1503333333334,3
w13,8,64,6,3584,1536,16,32,256,16,8,2,695.4366666666666,3
w13,8,64,6,3584,1536,16,32,256,16,8,3,693.6333333333333,3
w13,8,64,6,3584,1536,16,32,256,16,8,4,691.6060000000001,3
w13,8,64,6,3584,1536,16,32,256,32,4,2,693.1959999999999,3
w13,8,64,6,3584,1536,16,32,256,32,4,3,692.1610000000001,3
w13,8,64,6,3584,1536,16,32,256,32,4,4,691.2543333333333,3
w13,8,64,6,3584,1536,16,32,256,32,8,2,696.4393333333334,3
w13,8,64,6,3584,1536,16,32,256,32,8,3,693.5913333333334,3
w13,8,64,6,3584,1536,16,32,256,32,8,4,691.7873333333333,3
w13,8,64,6,3584,1536,16,32,256,64,4,2,693.6973333333334,3
w13,8,64,6,3584,1536,16,32,256,64,4,3,692.5986666666666,3
w13,8,64,6,3584,1536,16,32,256,64,4,4,691.6596666666666,3
w13,8,64,6,3584,1536,16,32,256,64,8,2,696.5993333333332,3
w13,8,64,6,3584,1536,16,32,256,64,8,3,694.0813333333334,3
w13,8,64,6,3584,1536,16,32,256,64,8,4,692.235,3
w13,8,64,6,3584,1536,16,64,64,1,4,4,696.2579999999999,3
w13,8,64,6,3584,1536,16,64,64,32,4,2,696.6956666666666,3
w13,8,64,6,3584,1536,16,64,128,1,4,3,692.3846666666667,3
w13,8,64,6,3584,1536,16,64,128,1,4,4,690.881,3
w13,8,64,6,3584,1536,16,64,128,1,8,3,692.9823333333334,3
w13,8,64,6,3584,1536,16,64,128,1,8,4,691.8403333333332,3
w13,8,64,6,3584,1536,16,64,128,16,4,3,693.1533333333333,3
w13,8,64,6,3584,1536,16,64,128,16,4,4,691.1793333333334,3
w13,8,64,6,3584,1536,16,64,128,16,8,3,693.1850000000001,3
w13,8,64,6,3584,1536,16,64,128,16,8,4,691.5206666666667,3
w13,8,64,6,3584,1536,16,64,128,32,4,3,692.172,3
w13,8,64,6,3584,1536,16,64,128,32,4,4,691.1156666666666,3
w13,8,64,6,3584,1536,16,64,128,32,8,3,692.4483333333334,3
w13,8,64,6,3584,1536,16,64,128,32,8,4,691.7980000000001,3
w13,8,64,6,3584,1536,16,64,128,64,4,3,693.3876666666666,3
w13,8,64,6,3584,1536,16,64,128,64,4,4,691.8939999999999,3
w13,8,64,6,3584,1536,16,64,128,64,8,3,693.0573333333333,3
w13,8,64,6,3584,1536,16,64,128,64,8,4,691.8733333333333,3
w13,8,64,6,3584,1536,16,64,256,1,4,2,694.3263333333333,3
w13,8,64,6,3584,1536,16,64,256,1,4,3,692.46,3
w13,8,64,6,3584,1536,16,64,256,1,8,3,692.3000000000001,3
w13,8,64,6,3584,1536,16,64,256,16,4,2,694.4226666666667,3
w13,8,64,6,3584,1536,16,64,256,16,4,3,692.9826666666667,3
w13,8,64,6,3584,1536,16,64,256,16,8,2,695.372,3
w13,8,64,6,3584,1536,16,64,256,16,8,3,692.4273333333334,3
w13,8,64,6,3584,1536,16,64,256,32,4,2,695.703,3
w13,8,64,6,3584,1536,16,64,256,32,4,3,693.6333333333333,3
w13,8,64,6,3584,1536,16,64,256,32,8,2,696.0766666666667,3
w13,8,64,6,3584,1536,16,64,256,32,8,3,693.1103333333334,3
w13,8,64,6,3584,1536,16,64,256,64,4,2,695.6066666666666,3
w13,8,64,6,3584,1536,16,64,256,64,4,3,693.4523333333333,3
w13,8,64,6,3584,1536,16,64,256,64,8,2,695.5003333333334,3
w13,8,64,6,3584,1536,16,64,256,64,8,3,693.1533333333333,3
w13,8,64,6,3584,1536,16,128,128,1,4,3,694.2843333333334,3
w13,8,64,6,3584,1536,16,128,128,1,8,3,693.1423333333333,3
w13,8,64,6,3584,1536,16,128,128,16,4,3,695.6606666666667,3
w13,8,64,6,3584,1536,16,128,128,16,8,3,694.9776666666667,3
w13,8,64,6,3584,1536,16,128,128,32,4,3,695.1803333333334,3
w13,8,64,6,3584,1536,16,128,128,32,8,3,694.935,3
w13,8,64,6,3584,1536,16,128,128,64,4,3,695.458,3
w13,8,64,6,3584,1536,16,128,128,64,8,3,694.8496666666666,3
w13,8,64,6,3584,1536,16,256,64,1,4,2,696.5463333333333,3
w13,8,64,6,3584,1536,16,256,64,1,8,2,695.8206666666666,3
w13,8,64,6,3584,1536,32,16,128,4,4,3,691.6593333333334,3
w13,8,64,6,3584,1536,32,16,128,4,4,4,691.5949999999999,3
w13,8,64,6,3584,1536,32,16,128,4,8,3,696.226,3
w13,8,64,6,3584,1536,32,16,128,4,8,4,693.3453333333333,3
w13,8,64,6,3584,1536,32,32,64,1,4,3,692.8649999999999,3
w13,8,64,6,3584,1536,32,32,64,1,8,3,693.3773333333334,3
w13,8,64,6,3584,1536,32,32,64,32,4,3,694.252,3
w13,8,64,6,3584,1536,32,32,64,32,8,3,694.4333333333334,3
w13,8,64,6,3584,1536,32,32,64,64,4,3,694.199,3
w13,8,64,6,3584,1536,32,32,64,64,8,3,695.3083333333334,3
w13,8,64,6,3584,1536,32,32,64,128,4,3,693.9106666666667,3
w13,8,64,6,3584,1536,32,32,64,128,8,3,694.8386666666667,3
w13,8,64,6,3584,1536,32,32,128,1,4,2,690.2620000000001,3
w13,8,64,6,3584,1536,32,32,128,1,4,3,692.8759999999999,3
w13,8,64,6,3584,1536,32,32,128,1,4,4,692.1286666666666,3
w13,8,64,6,3584,1536,32,32,128,1,8,2,690.3043333333334,3
w13,8,64,6,3584,1536,32,32,128,1,8,3,696.8983333333334,3
w13,8,64,6,3584,1536,32,32,128,1,8,4,693.7933333333334,3
w13,8,64,6,3584,1536,32,32,128,4,4,2,690.422,3
w13,8,64,6,3584,1536,32,32,128,4,4,3,692.7266666666666,3
w13,8,64,6,3584,1536,32,32,128,4,4,4,692.0970000000001,3
w13,8,64,6,3584,1536,32,32,128,4,8,2,690.486,3
w13,8,64,6,3584,1536,32,32,128,4,8,3,695.9699999999999,3
w13,8,64,6,3584,1536,32,32,128,4,8,4,694.0496666666667,3
w13,8,64,6,3584,1536,32,32,128,16,4,2,690.859,3
w13,8,64,6,3584,1536,32,32,128,16,4,3,692.9290000000001,3
w13,8,64,6,3584,1536,32,32,128,16,4,4,692.257,3
w13,8,64,6,3584,1536,32,32,128,16,8,2,690.774,3
w13,8,64,6,3584,1536,32,32,128,16,8,3,695.927,3
w13,8,64,6,3584,1536,32,32,128,16,8,4,693.5693333333334,3
w13,8,64,6,3584,1536,32,32,128,64,4,2,691.8406666666666,3
w13,8,64,6,3584,1536,32,32,128,64,4,3,692.7053333333333,3
w13,8,64,6,3584,1536,32,32,128,64,4,4,692.6306666666666,3
w13,8,64,6,3584,1536,32,32,128,64,8,2,691.7446666666666,3
w13,8,64,6,3584,1536,32,32,128,64,8,3,695.639,3
w13,8,64,6,3584,1536,32,32,128,64,8,4,693.4626666666667,3
w13,8,64,6,3584,1536,32,32,256,1,4,2,694.6683333333334,3
w13,8,64,6,3584,1536,32,32,256,1,4,3,691.4463333333333,3
w13,8,64,6,3584,1536,32,32,256,1,4,4,691.3076666666666,3
w13,8,64,6,3584,1536,32,32,256,1,8,2,696.183,3
w13,8,64,6,3584,1536,32,32,256,1,8,3,690.9016666666666,3
w13,8,64,6,3584,1536,32,32,256,1,8,4,691.4993333333333,3
w13,8,64,6,3584,1536,32,32,256,4,4,2,696.1619999999999,3
w13,8,64,6,3584,1536,32,32,256,4,4,3,691.9050000000001,3
w13,8,64,6,3584,1536,32,32,256,4,4,4,691.2220000000001,3
w13,8,64,6,3584,1536,32,32,256,4,8,2,696.5886666666667,3
w13,8,64,6,3584,1536,32,32,256,4,8,3,691.2753333333334,3
w13,8,64,6,3584,1536,32,32,256,4,8,4,691.393,3
w13,8,64,6,3584,1536,32,32,256,16,4,2,696.3539999999999,3
w13,8,64,6,3584,1536,32,32,256,16,4,3,691.2323333333334,3
w13,8,64,6,3584,1536,32,32,256,16,4,4,691.6273333333334,3
w13,8,64,6,3584,1536,32,32,256,16,8,2,696.6316666666667,3
w13,8,64,6,3584,1536,32,32,256,16,8,3,691.0193333333333,3
w13,8,64,6,3584,1536,32,32,256,16,8,4,691.4883333333333,3
w13,8,64,6,3584,1536,32,32,256,32,4,2,696.3116666666666,3
w13,8,64,6,3584,1536,32,32,256,32,4,3,691.2753333333334,3
w13,8,64,6,3584,1536,32,32,256,32,4,4,691.2856666666667,3
w13,8,64,6,3584,1536,32,32,256,32,8,3,691.2856666666667,3
w13,8,64,6,3584,1536,32,32,256,32,8,4,691.5313333333334,3
w13,8,64,6,3584,1536,32,64,128,1,4,3,693.5053333333334,3
w13,8,64,6,3584,1536,32,64,128,1,4,4,691.6273333333334,3
w13,8,64,6,3584,1536,32,64,128,1,8,3,695.1586666666667,3
w13,8,64,6,3584,1536,32,64,128,1,8,4,692.5773333333333,3
w13,8,64,6,3584,1536,32,64,128,4,4,3,693.4200000000001,3
w13,8,64,6,3584,1536,32,64,128,4,4,4,691.489,3
w13,8,64,6,3584,1536,32,64,128,4,8,3,693.7400000000001,3
w13,8,64,6,3584,1536,32,64,128,4,8,4,692.3746666666666,3
w13,8,64,6,3584,1536,32,64,128,16,4,3,694.0073333333333,3
w13,8,64,6,3584,1536,32,64,128,16,4,4,691.724,3
w13,8,64,6,3584,1536,32,64,128,16,8,3,693.8786666666666,3
w13,8,64,6,3584,1536,32,64,128,16,8,4,692.3636666666666,3
w13,8,64,6,3584,1536,32,64,128,32,4,3,692.908,3
w13,8,64,6,3584,1536,32,64,128,32,4,4,692.0756666666666,3
w13,8,64,6,3584,1536,32,64,128,32,8,3,693.8040000000001,3
w13,8,64,6,3584,1536,32,64,128,32,8,4,692.332,3
w13,8,64,6,3584,1536,32,64,128,64,4,3,693.4416666666666,3
w13,8,64,6,3584,1536,32,64,128,64,4,4,692.8336666666668,3
w13,8,64,6,3584,1536,32,64,128,64,8,3,693.9639999999999,3
w13,8,64,6,3584,1536,32,64,128,64,8,4,692.7689999999999,3
w13,8,64,6,3584,1536,32,64,256,1,4,2,695.2656666666667,3
w13,8,64,6,3584,1536,32,64,256,1,4,3,694.4976666666666,3
w13,8,64,6,3584,1536,32,64,256,1,8,3,693.4630000000001,3
w13,8,64,6,3584,1536,32,64,256,8,4,3,693.5266666666666,3
w13,8,64,6,3584,1536,32,64,256,8,8,2,696.8556666666667,3
w13,8,64,6,3584,1536,32,64,256,8,8,3,692.812,3
w13,8,64,6,3584,1536,32,64,256,16,4,2,696.5883333333333,3
w13,8,64,6,3584,1536,32,64,256,16,4,3,693.9643333333333,3
w13,8,64,6,3584,1536,32,64,256,16,8,2,696.6846666666667,3
w13,8,64,6,3584,1536,32,64,256,16,8,3,693.3666666666667,3
w13,8,64,6,3584,1536,32,64,256,32,4,3,695.0526666666666,3
w13,8,64,6,3584,1536,32,64,256,32,8,2,696.9936666666666,3
w13,8,64,6,3584,1536,32,64,256,32,8,3,694.0386666666667,3
w13,8,64,6,3584,1536,32,64,256,64,4,3,694.348,3
w13,8,64,6,3584,1536,32,64,256,64,8,3,694.0493333333334,3
w13,8,64,6,3584,1536,32,128,64,1,4,2,696.9086666666667,3
w13,8,64,6,3584,1536,32,128,128,1,4,3,695.831,3
w13,8,64,6,3584,1536,32,128,128,1,8,3,693.9746666666666,3
w13,8,64,6,3584,1536,32,128,128,4,4,3,696.1726666666667,3
w13,8,64,6,3584,1536,32,128,128,4,8,3,694.54,3
w13,8,64,6,3584,1536,32,128,128,8,4,3,696.0443333333333,3
w13,8,64,6,3584,1536,32,128,128,8,8,3,695.3086666666667,3
w13,8,64,6,3584,1536,32,128,128,16,4,3,696.4393333333334,3
w13,8,64,6,3584,1536,32,128,128,32,4,3,696.002,3
w13,8,64,6,3584,1536,32,128,128,32,8,3,695.7136666666667,3
w13,8,64,6,3584,1536,32,128,128,64,4,3,697.0153333333333,3
w13,8,64,6,3584,1536,32,128,128,64,8,3,695.4363333333334,3
w13,8,64,6,3584,1536,64,32,128,1,4,3,694.2310000000001,3
w13,8,64,6,3584,1536,64,32,128,1,4,4,694.9989999999999,3
w13,8,64,6,3584,1536,64,32,128,1,8,3,695.3083333333334,3
w13,8,64,6,3584,1536,64,32,128,1,8,4,694.3696666666666,3
w13,8,64,6,3584,1536,64,32,128,16,4,3,694.4126666666666,3
w13,8,64,6,3584,1536,64,32,128,16,4,4,696.9616666666667,3
w13,8,64,6,3584,1536,64,32,128,16,8,3,695.7033333333334,3
w13,8,64,6,3584,1536,64,32,128,16,8,4,696.9830000000001,3
w13,8,64,6,3584,1536,64,32,256,1,4,2,695.895,3
w13,8,64,6,3584,1536,64,32,256,1,4,3,693.9323333333333,3
w13,8,64,6,3584,1536,64,32,256,1,8,2,696.3543333333333,3
w13,8,64,6,3584,1536,64,32,256,1,8,3,692.3953333333334,3
w13,8,64,6,3584,1536,64,64,128,1,4,3,693.9426666666667,3
w13,8,64,6,3584,1536,64,64,128,1,4,4,694.0813333333332,3
w13,8,64,6,3584,1536,64,64,128,1,8,3,694.5079999999999,3
w13,8,64,6,3584,1536,64,64,128,1,8,4,695.052,3
w13,8,64,6,3584,1536,64,64,128,4,4,3,694.3696666666666,3
w13,8,64,6,3584,1536,64,64,128,4,4,4,692.8116666666666,3
w13,8,64,6,3584,1536,64,64,128,4,8,3,694.2416666666667,3
w13,8,64,6,3584,1536,64,64,128,4,8,4,695.2233333333334,3
w13,8,64,6,3584,1536,64,64,128,8,4,3,694.4656666666666,3
w13,8,64,6,3584,1536,64,64,128,8,4,4,693.7613333333334,3
w13,8,64,6,3584,1536,64,64,128,8,8,3,694.4656666666666,3
w13,8,64,6,3584,1536,64,64,128,8,8,4,693.5799999999999,3
w13,8,64,6,3584,1536,64,64,128,16,4,3,694.6146666666667,3
w13,8,64,6,3584,1536,64,64,128,16,4,4,693.6013333333334,3
w13,8,64,6,3584,1536,64,64,128,16,8,3,694.2523333333334,3
w13,8,64,6,3584,1536,64,64,128,16,8,4,694.2733333333334,3
w13,8,64,6,3584,1536,64,64,128,32,4,3,696.3539999999999,3
w13,8,64,6,3584,1536,64,64,128,32,4,4,694.167,3
w13,8,64,6,3584,1536,64,64,128,32,8,3,696.4286666666667,3
w13,8,64,6,3584,1536,64,64,128,32,8,4,694.2306666666667,3
w13,8,64,6,3584,1536,64,64,128,64,4,4,694.9776666666667,3
w13,8,64,6,3584,1536,64,64,128,64,8,4,695.1379999999999,3
w13,8,64,8,3584,2560,16,16,64,1,4,3,1532.635,3
w13,8,64,8,3584,2560,16,16,64,1,4,4,1536.934,3
w13,8,64,8,3584,2560,16,16,64,1,8,3,1536.6566666666665,3
w13,8,64,8,3584,2560,16,16,64,1,8,4,1542.2463333333333,3
w13,8,64,8,3584,2560,16,16,128,1,4,2,1530.3313333333335,3
w13,8,64,8,3584,2560,16,16,128,1,4,3,1529.7446666666667,3
w13,8,64,8,3584,2560,16,16,128,1,4,4,1530.5553333333335,3
w13,8,64,8,3584,2560,16,16,128,1,8,2,1537.8410000000001,3
w13,8,64,8,3584,2560,16,16,128,1,8,3,1531.3233333333335,3
w13,8,64,8,3584,2560,16,16,128,1,8,4,1534.2353333333333,3
w13,8,64,8,3584,2560,16,16,128,4,4,2,1532.134,3
w13,8,64,8,3584,2560,16,16,128,4,4,3,1530.854,3
w13,8,64,8,3584,2560,16,16,128,4,4,4,1530.5019999999997,3
w13,8,64,8,3584,2560,16,16,128,4,8,2,1537.4566666666667,3
w13,8,64,8,3584,2560,16,16,128,4,8,3,1532.55,3
w13,8,64,8,3584,2560,16,16,128,4,8,4,1534.6086666666667,3
w13,8,64,8,3584,2560,16,16,256,1,4,2,1530.4913333333334,3
w13,8,64,8,3584,2560,16,16,256,1,4,3,1530.2993333333334,3
w13,8,64,8,3584,2560,16,16,256,1,4,4,1531.0033333333333,3
w13,8,64,8,3584,2560,16,16,256,1,8,2,1533.7659999999998,3
w13,8,64,8,3584,2560,16,16,256,1,8,3,1532.177,3
w13,8,64,8,3584,2560,16,16,256,1,8,4,1531.7606666666668,3
w13,8,64,8,3584,2560,16,16,256,4,4,2,1532.4326666666666,3
w13,8,64,8,3584,2560,16,16,256,4,4,3,1529.9043333333332,3
w13,8,64,8,3584,2560,16,16,256,4,4,4,1529.3286666666665,3
w13,8,64,8,3584,2560,16,16,256,4,8,2,1533.8086666666666,3
w13,8,64,8,3584,2560,16,16,256,4,8,3,1531.4193333333333,3
w13,8,64,8,3584,2560,16,16,256,4,8,4,1531.0353333333333,3
w13,8,64,8,3584,2560,16,32,64,1,4,3,1534.961,3
w13,8,64,8,3584,2560,16,32,64,1,4,4,1537.6493333333335,3
w13,8,64,8,3584,2560,16,32,64,1,8,3,1536.6673333333335,3
w13,8,64,8,3584,2560,16,32,64,1,8,4,1538.5766666666666,3
w13,8,64,8,3584,2560,16,32,64,16,4,3,1537.4886666666669,3
w13,8,64,8,3584,2560,16,32,64,16,4,4,1541.5846666666666,3
w13,8,64,8,3584,2560,16,32,64,16,8,3,1540.0273333333334,3
w13,8,64,8,3584,2560,16,32,64,16,8,4,1544.5289999999998,3
w13,8,64,8,3584,2560,16,32,64,32,4,3,1536.4113333333335,3
w13,8,64,8,3584,2560,16,32,64,32,4,4,1541.4033333333334,3
w13,8,64,8,3584,2560,16,32,64,32,8,3,1540.6996666666666,3
w13,8,64,8,3584,2560,16,32,64,32,8,4,1543.1633333333332,3
w13,8,64,8,3584,2560,16,32,64,64,4,3,1539.2486666666666,3
w13,8,64,8,3584,2560,16,32,64,64,4,4,1543.6863333333333,3
w13,8,64,8,3584,2560,16,32,64,64,8,3,1542.6196666666667,3
w13,8,64,8,3584,2560,16,32,128,1,4,2,1530.0113333333331,3
w13,8,64,8,3584,2560,16,32,128,1,4,3,1529.5103333333334,3
w13,8,64,8,3584,2560,16,32,128,1,4,4,1529.478,3
w13,8,64,8,3584,2560,16,32,128,1,8,2,1529.1793333333333,3
w13,8,64,8,3584,2560,16,32,128,1,8,3,1530.1393333333333,3
w13,8,64,8,3584,2560,16,32,128,1,8,4,1532.7213333333336,3
w13,8,64,8,3584,2560,16,32,128,4,4,2,1531.7286666666666,3
w13,8,64,8,3584,2560,16,32,128,4,4,3,1529.6166666666668,3
w13,8,64,8,3584,2560,16,32,128,4,4,4,1530.5016666666668,3
w13,8,64,8,3584,2560,16,32,128,4,8,2,1531.963,3
w13,8,64,8,3584,2560,16,32,128,4,8,3,1530.7579999999998,3
w13,8,64,8,3584,2560,16,32,128,4,8,4,1532.6996666666666,3
w13,8,64,8,3584,2560,16,32,128,16,4,2,1532.3156666666666,3
w13,8,64,8,3584,2560,16,32,128,16,4,3,1530.7259999999999,3
w13,8,64,8,3584,2560,16,32,128,16,4,4,1531.622,3
w13,8,64,8,3584,2560,16,32,128,16,8,2,1530.566,3
w13,8,64,8,3584,2560,16,32,128,16,8,3,1531.8456666666668,3
w13,8,64,8,3584,2560,16,32,128,16,8,4,1533.4566666666667,3
w13,8,64,8,3584,2560,16,32,128,32,4,2,1531.408666666667,3
w13,8,64,8,3584,2560,16,32,128,32,4,3,1532.3156666666666,3
w13,8,64,8,3584,2560,16,32,128,32,4,4,1531.3976666666667,3
w13,8,64,8,3584,2560,16,32,128,32,8,2,1531.1850000000002,3
w13,8,64,8,3584,2560,16,32,128,32,8,3,1530.8753333333334,3
w13,8,64,8,3584,2560,16,32,128,32,8,4,1533.5313333333334,3
w13,8,64,8,3584,2560,16,32,128,64,4,2,1535.0356666666667,3
w13,8,64,8,3584,2560,16,32,128,64,4,3,1531.6223333333335,3
w13,8,64,8,3584,2560,16,32,128,64,4,4,1533.5103333333334,3
w13,8,64,8,3584,2560,16,32,128,64,8,2,1536.5396666666666,3
w13,8,64,8,3584,2560,16,32,128,64,8,3,1533.0833333333333,3
w13,8,64,8,3584,2560,16,32,128,64,8,4,1533.5313333333334,3
w13,8,64,8,3584,2560,16,32,256,1,4,2,1529.4886666666669,3
w13,8,64,8,3584,2560,16,32,256,1,4,3,1529.7443333333333,3
w13,8,64,8,3584,2560,16,32,256,1,4,4,1530.2246666666667,3
w13,8,64,8,3584,2560,16,32,256,1,8,2,1529.4246666666666,3
w13,8,64,8,3584,2560,16,32,256,1,8,3,1530.1823333333334,3
w13,8,64,8,3584,2560,16,32,256,1,8,4,1529.798,3
w13,8,64,8,3584,2560,16,32,256,16,4,2,1529.7443333333333,3
w13,8,64,8,3584,2560,16,32,256,16,4,3,1531.174,3
w13,8,64,8,3584,2560,16,32,256,16,4,4,1531.366,3
w13,8,64,8,3584,2560,16,32,256,16,8,2,1531.1419999999998,3
w13,8,64,8,3584,2560,16,32,256,16,8,3,1530.9926666666668,3
w13,8,64,8,3584,2560,16,32,256,16,8,4,1531.2486666666666,3
w13,8,64,8,3584,2560,16,32,256,32,4,2,1530.4276666666667,3
w13,8,64,8,3584,2560,16,32,256,32,4,3,1533.1796666666667,3
w13,8,64,8,3584,2560,16,32,256,32,4,4,1532.6353333333334,3
w13,8,64,8,3584,2560,16,32,256,32,8,2,1531.5473333333332,3
w13,8,64,8,3584,2560,16,32,256,32,8,3,1531.878,3
w13,8,64,8,3584,2560,16,32,256,32,8,4,1532.6566666666668,3
w13,8,64,8,3584,2560,16,32,256,64,4,2,1531.5583333333334,3
w13,8,64,8,3584,2560,16,32,256,64,4,3,1532.9976666666669,3
w13,8,64,8,3584,2560,16,32,256,64,4,4,1533.4566666666667,3
w13,8,64,8,3584,2560,16,32,256,64,8,2,1532.134,3
w13,8,64,8,3584,2560,16,32,256,64,8,3,1533.062,3
w13,8,64,8,3584,2560,16,32,256,64,8,4,1533.7233333333334,3
w13,8,64,8,3584,2560,16,64,64,1,4,3,1534.3739999999998,3
w13,8,64,8,3584,2560,16,64,64,1,4,4,1537.414,3
w13,8,64,8,3584,2560,16,64,64,1,8,3,1537.222,3
w13,8,64,8,3584,2560,16,64,64,1,8,4,1537.8833333333332,3
w13,8,64,8,3584,2560,16,64,64,16,4,3,1539.8033333333333,3
w13,8,64,8,3584,2560,16,64,64,16,4,4,1541.329,3
w13,8,64,8,3584,2560,16,64,64,16,8,3,1539.2699999999998,3
w13,8,64,8,3584,2560,16,64,64,16,8,4,1541.4993333333332,3
w13,8,64,8,3584,2560,16,64,64,32,4,3,1540.2300000000002,3
w13,8,64,8,3584,2560,16,64,64,32,4,4,1540.6673333333335,3
w13,8,64,8,3584,2560,16,64,64,32,8,3,1541.7666666666667,3
w13,8,64,8,3584,2560,16,64,64,32,8,4,1540.6993333333332,3
w13,8,64,8,3584,2560,16,64,64,64,4,3,1542.278,3
w13,8,64,8,3584,2560,16,64,64,64,4,4,1543.6326666666666,3
w13,8,64,8,3584,2560,16,64,64,64,8,3,1544.3046666666667,3
w13,8,64,8,3584,2560,16,64,128,1,4,2,1530.865,3
w13,8,64,8,3584,2560,16,64,128,1,4,3,1530.0330000000001,3
w13,8,64,8,3584,2560,16,64,128,1,4,4,1530.8113333333333,3
w13,8,64,8,3584,2560,16,64,128,1,8,2,1530.6726666666666,3
w13,8,64,8,3584,2560,16,64,128,1,8,3,1530.1503333333333,3
w13,8,64,8,3584,2560,16,64,128,1,8,4,1531.4193333333333,3
w13,8,64,8,3584,2560,16,64,128,16,4,2,1532.7843333333333,3
w13,8,64,8,3584,2560,16,64,128,16,4,3,1531.5153333333335,3
w13,8,64,8,3584,2560,16,64,128,16,4,4,1531.857,3
w13,8,64,8,3584,2560,16,64,128,16,8,2,1533.894,3
w13,8,64,8,3584,2560,16,64,128,16,8,3,1531.5153333333335,3
w13,8,64,8,3584,2560,16,64,128,16,8,4,1532.379,3
w13,8,64,8,3584,2560,16,64,128,32,4,2,1531.7073333333335,3
w13,8,64,8,3584,2560,16,64,128,32,4,3,1530.9926666666668,3
w13,8,64,8,3584,2560,16,64,128,32,4,4,1532.71,3
w13,8,64,8,3584,2560,16,64,128,32,8,2,1532.486,3
w13,8,64,8,3584,2560,16,64,128,32,8,3,1530.8646666666666,3
w13,8,64,8,3584,2560,16,64,128,32,8,4,1533.5743333333332,3
w13,8,64,8,3584,2560,16,64,128,64,4,2,1534.7793333333332,3
w13,8,64,8,3584,2560,16,64,128,64,4,3,1531.9743333333333,3
w13,8,64,8,3584,2560,16,64,128,64,4,4,1533.9473333333335,3
w13,8,64,8,3584,2560,16,64,128,64,8,2,1534.8006666666668,3
w13,8,64,8,3584,2560,16,64,128,64,8,3,1533.5526666666667,3
w13,8,64,8,3584,2560,16,64,128,64,8,4,1533.2326666666668,3
w13,8,64,8,3584,2560,16,64,256,1,4,2,1530.001,3
w13,8,64,8,3584,2560,16,64,256,1,4,3,1530.1073333333334,3
w13,8,64,8,3584,2560,16,64,256,1,8,2,1530.2036666666665,3
w13,8,64,8,3584,2560,16,64,256,1,8,3,1529.5523333333333,3
w13,8,64,8,3584,2560,16,64,256,16,4,2,1529.9156666666665,3
w13,8,64,8,3584,2560,16,64,256,16,4,3,1531.451,3
w13,8,64,8,3584,2560,16,64,256,16,8,2,1529.7983333333334,3
w13,8,64,8,3584,2560,16,64,256,16,8,3,1531.6326666666666,3
w13,8,64,8,3584,2560,16,64,256,32,4,2,1531.313,3
w13,8,64,8,3584,2560,16,64,256,32,4,3,1532.4116666666666,3
w13,8,64,8,3584,2560,16,64,256,32,8,2,1531.4406666666666,3
w13,8,64,8,3584,2560,16,64,256,32,8,3,1532.475333333333,3
w13,8,64,8,3584,2560,16,64,256,64,4,2,1532.934,3
w13,8,64,8,3584,2560,16,64,256,64,4,3,1533.99,3
w13,8,64,8,3584,2560,16,64,256,64,8,2,1531.9740000000002,3
w13,8,64,8,3584,2560,16,64,256,64,8,3,1533.1046666666668,3
w13,8,64,8,3584,2560,16,128,64,1,4,2,1542.321,3
w13,8,64,8,3584,2560,16,128,64,1,4,3,1539.0776666666668,3
w13,8,64,8,3584,2560,16,128,64,1,4,4,1538.2676666666666,3
w13,8,64,8,3584,2560,16,128,64,1,8,2,1541.5739999999998,3
w13,8,64,8,3584,2560,16,128,64,1,8,3,1539.9740000000002,3
w13,8,64,8,3584,2560,16,128,64,1,8,4,1537.1476666666667,3
w13,8,64,8,3584,2560,16,128,64,16,4,2,1543.8033333333333,3
w13,8,64,8,3584,2560,16,128,64,16,4,3,1541.5953333333334,3
w13,8,64,8,3584,2560,16,128,64,16,4,4,1540.113,3
w13,8,64,8,3584,2560,16,128,64,16,8,2,1543.7183333333335,3
w13,8,64,8,3584,2560,16,128,64,16,8,3,1540.667333333333,3
w13,8,64,8,3584,2560,16,128,64,16,8,4,1539.7716666666665,3
w13,8,64,8,3584,2560,16,128,64,32,4,3,1543.8463333333332,3
w13,8,64,8,3584,2560,16,128,64,32,4,4,1542.4066666666668,3
w13,8,64,8,3584,2560,16,128,64,32,8,3,1543.7496666666666,3
w13,8,64,8,3584,2560,16,128,64,32,8,4,1541.0623333333333,3
w13,8,64,8,3584,2560,16,128,128,1,4,2,1529.9260000000002,3
w13,8,64,8,3584,2560,16,128,128,1,4,3,1530.2033333333336,3
w13,8,64,8,3584,2560,16,128,128,1,8,2,1529.7450000000001,3
w13,8,64,8,3584,2560,16,128,128,1,8,3,1529.8410000000001,3
w13,8,64,8,3584,2560,16,128,128,16,4,2,1532.859333333333,3
w13,8,64,8,3584,2560,16,128,128,16,4,3,1531.0356666666667,3
w13,8,64,8,3584,2560,16,128,128,16,8,2,1533.425,3
w13,8,64,8,3584,2560,16,128,128,16,8,3,1530.2250000000001,3
w13,8,64,8,3584,2560,16,128,128,32,4,2,1531.8029999999999,3
w13,8,64,8,3584,2560,16,128,128,32,4,3,1531.974,3
w13,8,64,8,3584,2560,16,128,128,32,8,2,1531.7393333333332,3
w13,8,64,8,3584,2560,16,128,128,32,8,3,1530.854,3
w13,8,64,8,3584,2560,16,128,128,64,4,2,1535.4836666666667,3
w13,8,64,8,3584,2560,16,128,128,64,4,3,1533.0086666666666,3
w13,8,64,8,3584,2560,16,128,128,64,8,2,1535.75,3
w13,8,64,8,3584,2560,16,128,128,64,8,3,1533.4143333333334,3
w13,8,64,8,3584,2560,16,256,64,1,4,3,1540.9979999999998,3
w13,8,64,8,3584,2560,16,256,64,1,8,2,1543.8993333333335,3
w13,8,64,8,3584,2560,16,256,64,1,8,3,1541.83,3
w13,8,64,8,3584,2560,16,256,64,16,4,3,1543.6543333333332,3
w13,8,64,8,3584,2560,16,256,64,16,8,3,1541.8190000000002,3
w13,8,64,8,3584,2560,16,256,64,32,4,3,1543.2913333333333,3
w13,8,64,8,3584,2560,16,256,64,32,8,3,1543.2706666666666,3
w13,8,64,8,3584,2560,32,16,128,4,4,2,1530.1823333333334,3
w13,8,64,8,3584,2560,32,16,128,4,4,3,1530.4166666666667,3
w13,8,64,8,3584,2560,32,16,128,4,4,4,1531.3023333333333,3
w13,8,64,8,3584,2560,32,16,128,4,8,2,1537.286,3
w13,8,64,8,3584,2560,32,16,128,4,8,3,1533.1899999999998,3
w13,8,64,8,3584,2560,32,16,128,4,8,4,1533.3286666666665,3
w13,8,64,8,3584,2560,32,32,64,1,4,3,1534.5553333333335,3
w13,8,64,8,3584,2560,32,32,64,1,4,4,1537.3716666666667,3
w13,8,64,8,3584,2560,32,32,64,1,8,3,1534.705,3
w13,8,64,8,3584,2560,32,32,64,1,8,4,1537.8086666666666,3
w13,8,64,8,3584,2560,32,32,64,32,4,3,1537.99,3
w13,8,64,8,3584,2560,32,32,64,32,4,4,1540.934,3
w13,8,64,8,3584,2560,32,32,64,32,8,3,1539.3766666666668,3
w13,8,64,8,3584,2560,32,32,64,32,8,4,1541.5846666666666,3
w13,8,64,8,3584,2560,32,32,64,64,4,4,1544.2086666666667,3
w13,8,64,8,3584,2560,32,32,64,128,4,4,1544.3793333333333,3
w13,8,64,8,3584,2560,32,32,64,128,8,4,1544.2086666666667,3
w13,8,64,8,3584,2560,32,32,128,1,4,2,1529.5846666666666,3
w13,8,64,8,3584,2560,32,32,128,1,4,3,1532.198,3
w13,8,64,8,3584,2560,32,32,128,1,4,4,1531.942,3
w13,8,64,8,3584,2560,32,32,128,1,8,2,1530.8646666666666,3
w13,8,64,8,3584,2560,32,32,128,1,8,3,1532.6246666666666,3
w13,8,64,8,3584,2560,32,32,128,1,8,4,1532.977,3
w13,8,64,8,3584,2560,32,32,128,4,4,2,1530.5023333333331,3
w13,8,64,8,3584,2560,32,32,128,4,4,3,1532.2086666666667,3
w13,8,64,8,3584,2560,32,32,128,4,4,4,1532.1016666666667,3
w13,8,64,8,3584,2560,32,32,128,4,8,2,1531.8246666666666,3
w13,8,64,8,3584,2560,32,32,128,4,8,3,1533.8509999999999,3
w13,8,64,8,3584,2560,32,32,128,4,8,4,1531.8886666666667,3
w13,8,64,8,3584,2560,32,32,128,16,4,2,1531.014,3
w13,8,64,8,3584,2560,32,32,128,16,4,3,1533.062,3
w13,8,64,8,3584,2560,32,32,128,16,4,4,1532.166,3
w13,8,64,8,3584,2560,32,32,128,16,8,2,1531.3766666666668,3
w13,8,64,8,3584,2560,32,32,128,16,8,3,1532.9553333333333,3
w13,8,64,8,3584,2560,32,32,128,16,8,4,1534.0756666666666,3
w13,8,64,8,3584,2560,32,32,128,64,4,2,1538.5766666666666,3
w13,8,64,8,3584,2560,32,32,128,64,4,3,1534.1500000000003,3
w13,8,64,8,3584,2560,32,32,128,64,4,4,1534.9503333333332,3
w13,8,64,8,3584,2560,32,32,128,64,8,2,1536.0379999999998,3
w13,8,64,8,3584,2560,32,32,128,64,8,3,1534.3953333333332,3
w13,8,64,8,3584,2560,32,32,128,64,8,4,1534.1286666666667,3
w13,8,64,8,3584,2560,32,32,256,1,4,2,1531.8566666666666,3
w13,8,64,8,3584,2560,32,32,256,1,4,3,1529.5526666666667,3
w13,8,64,8,3584,2560,32,32,256,1,4,4,1529.7983333333334,3
w13,8,64,8,3584,2560,32,32,256,1,8,2,1531.9636666666665,3
w13,8,64,8,3584,2560,32,32,256,1,8,3,1529.6490000000001,3
w13,8,64,8,3584,2560,32,32,256,1,8,4,1529.4886666666669,3
w13,8,64,8,3584,2560,32,32,256,4,4,2,1533.585,3
w13,8,64,8,3584,2560,32,32,256,4,4,3,1530.5766666666666,3
w13,8,64,8,3584,2560,32,32,256,4,4,4,1529.8726666666669,3
w13,8,64,8,3584,2560,32,32,256,4,8,2,1533.1793333333335,3
w13,8,64,8,3584,2560,32,32,256,4,8,3,1529.67,3
w13,8,64,8,3584,2560,32,32,256,4,8,4,1530.5343333333333,3
w13,8,64,8,3584,2560,32,32,256,16,4,2,1533.2006666666666,3
w13,8,64,8,3584,2560,32,32,256,16,4,3,1531.174,3
w13,8,64,8,3584,2560,32,32,256,16,4,4,1531.9633333333334,3
w13,8,64,8,3584,2560,32,32,256,16,8,2,1533.5420000000001,3
w13,8,64,8,3584,2560,32,32,256,16,8,3,1531.5049999999999,3
w13,8,64,8,3584,2560,32,32,256,16,8,4,1531.2273333333333,3
w13,8,64,8,3584,2560,32,32,256,32,4,2,1534.214,3
w13,8,64,8,3584,2560,32,32,256,32,4,3,1532.4006666666667,3
w13,8,64,8,3584,2560,32,32,256,32,4,4,1531.8886666666667,3
w13,8,64,8,3584,2560,32,32,256,32,8,2,1536.0593333333334,3
w13,8,64,8,3584,2560,32,32,256,32,8,3,1532.8059999999998,3
w13,8,64,8,3584,2560,32,32,256,32,8,4,1532.176666666667,3
w13,8,64,8,3584,2560,32,64,64,1,4,2,1544.518,3
w13,8,64,8,3584,2560,32,64,64,1,4,3,1540.7523333333331,3
w13,8,64,8,3584,2560,32,64,64,1,4,4,1539.2276666666667,3
w13,8,64,8,3584,2560,32,64,64,1,8,3,1539.6753333333334,3
w13,8,64,8,3584,2560,32,64,64,1,8,4,1538.7259999999999,3
w13,8,64,8,3584,2560,32,64,64,16,4,3,1542.7793333333332,3
w13,8,64,8,3584,2560,32,64,64,16,4,4,1540.0913333333335,3
w13,8,64,8,3584,2560,32,64,64,16,8,3,1541.179666666667,3
w13,8,64,8,3584,2560,32,64,64,16,8,4,1539.6646666666668,3
w13,8,64,8,3584,2560,32,64,128,1,4,2,1530.875,3
w13,8,64,8,3584,2560,32,64,128,1,4,3,1530.8010000000002,3
w13,8,64,8,3584,2560,32,64,128,1,4,4,1531.8246666666666,3
w13,8,64,8,3584,2560,32,64,128,1,8,2,1530.7686666666668,3
w13,8,64,8,3584,2560,32,64,128,1,8,3,1529.7446666666667,3
w13,8,64,8,3584,2560,32,64,128,1,8,4,1532.2623333333333,3
w13,8,64,8,3584,2560,32,64,128,4,4,2,1531.6223333333335,3
w13,8,64,8,3584,2560,32,64,128,4,4,3,1531.0349999999999,3
w13,8,64,8,3584,2560,32,64,128,4,4,4,1533.2969999999998,3
w13,8,64,8,3584,2560,32,64,128,4,8,2,1531.0673333333334,3
w13,8,64,8,3584,2560,32,64,128,4,8,3,1530.8753333333334,3
w13,8,64,8,3584,2560,32,64,128,4,8,4,1531.7286666666666,3
w13,8,64,8,3584,2560,32,64,128,16,4,2,1533.702,3
w13,8,64,8,3584,2560,32,64,128,16,4,3,1531.11,3
w13,8,64,8,3584,2560,32,64,128,16,4,4,1533.3183333333334,3
w13,8,64,8,3584,2560,32,64,128,16,8,2,1536.1873333333333,3
w13,8,64,8,3584,2560,32,64,128,16,8,3,1531.3873333333333,3
w13,8,64,8,3584,2560,32,64,128,16,8,4,1533.3393333333333,3
w13,8,64,8,3584,2560,32,64,128,32,4,2,1531.7823333333333,3
w13,8,64,8,3584,2560,32,64,128,32,4,3,1532.4646666666667,3
w13,8,64,8,3584,2560,32,64,128,32,4,4,1534.3313333333333,3
w13,8,64,8,3584,2560,32,64,128,32,8,2,1532.742,3
w13,8,64,8,3584,2560,32,64,128,32,8,3,1531.9846666666665,3
w13,8,64,8,3584,2560,32,64,128,32,8,4,1533.4143333333334,3
w13,8,64,8,3584,2560,32,64,128,64,4,2,1535.099,3
w13,8,64,8,3584,2560,32,64,128,64,4,3,1532.7633333333333,3
w13,8,64,8,3584,2560,32,64,128,64,4,4,1535.0036666666667,3
w13,8,64,8,3584,2560,32,64,128,64,8,2,1535.089,3
w13,8,64,8,3584,2560,32,64,128,64,8,3,1533.7873333333334,3
w13,8,64,8,3584,2560,32,64,128,64,8,4,1534.6403333333335,3
w13,8,64,8,3584,2560,32,64,256,1,4,2,1529.5420000000001,3
w13,8,64,8,3584,2560,32,64,256,1,4,3,1530.8220000000001,3
w13,8,64,8,3584,2560,32,64,256,1,8,2,1531.8563333333332,3
w13,8,64,8,3584,2560,32,64,256,1,8,3,1531.0033333333333,3
w13,8,64,8,3584,2560,32,64,256,8,4,2,1530.5339999999999,3
w13,8,64,8,3584,2560,32,64,256,8,4,3,1531.4513333333332,3
w13,8,64,8,3584,2560,32,64,256,8,8,2,1530.3526666666667,3
w13,8,64,8,3584,2560,32,64,256,8,8,3,1530.8006666666668,3
w13,8,64,8,3584,2560,32,64,256,16,4,2,1530.662,3
w13,8,64,8,3584,2560,32,64,256,16,4,3,1532.6993333333332,3
w13,8,64,8,3584,2560,32,64,256,16,8,2,1530.182,3
w13,8,64,8,3584,2560,32,64,256,16,8,3,1531.131666666667,3
w13,8,64,8,3584,2560,32,64,256,32,4,2,1532.273,3
w13,8,64,8,3584,2560,32,64,256,32,4,3,1532.6673333333335,3
w13,8,64,8,3584,2560,32,64,256,32,8,2,1531.4513333333332,3
w13,8,64,8,3584,2560,32,64,256,32,8,3,1533.3393333333333,3
w13,8,64,8,3584,2560,32,64,256,64,4,2,1533.3286666666665,3
w13,8,64,8,3584,2560,32,64,256,64,4,3,1533.9046666666666,3
w13,8,64,8,3584,2560,32,64,256,64,8,2,1532.7953333333335,3
w13,8,64,8,3584,2560,32,64,256,64,8,3,1534.662,3
w13,8,64,8,3584,2560,32,128,64,1,4,3,1541.9366666666665,3
w13,8,64,8,3584,2560,32,128,64,1,4,4,1538.9823333333334,3
w13,8,64,8,3584,2560,32,128,64,1,8,3,1542.5446666666667,3
w13,8,64,8,3584,2560,32,128,64,1,8,4,1539.2806666666665,3
w13,8,64,8,3584,2560,32,128,64,4,4,4,1540.3793333333333,3
w13,8,64,8,3584,2560,32,128,64,4,8,3,1543.1850000000002,3
w13,8,64,8,3584,2560,32,128,64,4,8,4,1539.8353333333334,3
w13,8,64,8,3584,2560,32,128,64,16,4,3,1543.408666666667,3
w13,8,64,8,3584,2560,32,128,64,16,4,4,1541.1899999999998,3
w13,8,64,8,3584,2560,32,128,64,16,8,3,1542.1606666666667,3
w13,8,64,8,3584,2560,32,128,64,16,8,4,1540.7313333333332,3
w13,8,64,8,3584,2560,32,128,64,32,4,3,1543.7606666666668,3
w13,8,64,8,3584,2560,32,128,64,32,4,4,1543.9099999999999,3
w13,8,64,8,3584,2560,32,128,64,32,8,3,1544.198,3
w13,8,64,8,3584,2560,32,128,64,32,8,4,1542.3953333333332,3
w13,8,64,8,3584,2560,32,128,128,1,4,2,1530.7686666666668,3
w13,8,64,8,3584,2560,32,128,128,1,4,3,1530.640666666667,3
w13,8,64,8,3584,2560,32,128,128,1,8,2,1530.0546666666667,3
w13,8,64,8,3584,2560,32,128,128,1,8,3,1529.9153333333334,3
w13,8,64,8,3584,2560,32,128,128,4,4,2,1532.6779999999999,3
w13,8,64,8,3584,2560,32,128,128,4,4,3,1530.8006666666668,3
w13,8,64,8,3584,2560,32,128,128,4,8,2,1531.6006666666665,3
w13,8,64,8,3584,2560,32,128,128,4,8,3,1530.4596666666666,3
w13,8,64,8,3584,2560,32,128,128,8,4,2,1532.732,3
w13,8,64,8,3584,2560,32,128,128,8,4,3,1530.8436666666666,3
w13,8,64,8,3584,2560,32,128,128,8,8,2,1531.6113333333333,3
w13,8,64,8,3584,2560,32,128,128,8,8,3,1530.7259999999999,3
w13,8,64,8,3584,2560,32,128,128,16,4,2,1533.8513333333333,3
w13,8,64,8,3584,2560,32,128,128,16,4,3,1531.6009999999999,3
w13,8,64,8,3584,2560,32,128,128,16,8,2,1533.5103333333334,3
w13,8,64,8,3584,2560,32,128,128,16,8,3,1531.0783333333336,3
w13,8,64,8,3584,2560,32,128,128,32,4,2,1532.4436666666668,3
w13,8,64,8,3584,2560,32,128,128,32,4,3,1532.3793333333333,3
w13,8,64,8,3584,2560,32,128,128,32,8,2,1532.2513333333334,3
w13,8,64,8,3584,2560,32,128,128,32,8,3,1531.1953333333333,3
w13,8,64,8,3584,2560,32,128,128,64,4,2,1537.0516666666665,3
w13,8,64,8,3584,2560,32,128,128,64,4,3,1534.5019999999997,3
w13,8,64,8,3584,2560,32,128,128,64,8,2,1536.4006666666667,3
w13,8,64,8,3584,2560,32,128,128,64,8,3,1534.6090000000002,3
w13,8,64,8,3584,2560,32,256,64,1,4,3,1544.0383333333332,3
w13,8,64,8,3584,2560,32,256,64,16,4,3,1544.3366666666668,3
w13,8,64,8,3584,2560,32,256,64,16,8,3,1543.814,3
w13,8,64,8,3584,2560,32,256,64,32,8,3,1544.4113333333335,3
w13,8,64,8,3584,2560,64,16,128,1,4,2,1539.5046666666667,3
w13,8,64,8,3584,2560,64,16,128,1,4,3,1542.182,3
w13,8,64,8,3584,2560,64,16,128,1,8,2,1540.3473333333334,3
w13,8,64,8,3584,2560,64,16,128,1,8,3,1542.5019999999997,3
w13,8,64,8,3584,2560,64,32,128,1,4,2,1531.3446666666666,3
w13,8,64,8,3584,2560,64,32,128,1,4,3,1533.4246666666668,3
w13,8,64,8,3584,2560,64,32,128,1,4,4,1534.5336666666665,3
w13,8,64,8,3584,2560,64,32,128,1,8,2,1530.438,3
w13,8,64,8,3584,2560,64,32,128,1,8,3,1534.246,3
w13,8,64,8,3584,2560,64,32,128,1,8,4,1533.2326666666668,3
w13,8,64,8,3584,2560,64,32,128,16,4,2,1532.6779999999999,3
w13,8,64,8,3584,2560,64,32,128,16,4,3,1534.939333333333,3
w13,8,64,8,3584,2560,64,32,128,16,4,4,1542.0646666666669,3
w13,8,64,8,3584,2560,64,32,128,16,8,2,1532.9553333333333,3
w13,8,64,8,3584,2560,64,32,128,16,8,3,1534.5553333333335,3
w13,8,64,8,3584,2560,64,32,128,16,8,4,1541.4353333333331,3
w13,8,64,8,3584,2560,64,32,256,1,4,2,1533.8943333333334,3
w13,8,64,8,3584,2560,64,32,256,1,4,3,1531.6970000000001,3
w13,8,64,8,3584,2560,64,32,256,1,8,2,1535.302,3
w13,8,64,8,3584,2560,64,32,256,1,8,3,1530.3310000000001,3
w13,8,64,8,3584,2560,64,64,64,1,4,4,1541.8086666666668,3
w13,8,64,8,3584,2560,64,64,64,1,8,4,1541.318,3
w13,8,64,8,3584,2560,64,64,64,4,4,4,1542.6409999999998,3
w13,8,64,8,3584,2560,64,64,64,16,4,4,1542.5236666666667,3
w13,8,64,8,3584,2560,64,64,128,1,4,2,1541.0513333333336,3
w13,8,64,8,3584,2560,64,64,128,1,4,3,1533.6593333333333,3
w13,8,64,8,3584,2560,64,64,128,1,4,4,1534.7153333333333,3
w13,8,64,8,3584,2560,64,64,128,1,8,2,1531.7823333333333,3
w13,8,64,8,3584,2560,64,64,128,1,8,3,1533.243333333333,3
w13,8,64,8,3584,2560,64,64,128,1,8,4,1535.4303333333335,3
w13,8,64,8,3584,2560,64,64,128,4,4,2,1542.7790000000002,3
w13,8,64,8,3584,2560,64,64,128,4,4,3,1534.0013333333334,3
w13,8,64,8,3584,2560,64,64,128,4,4,4,1536.2093333333332,3
w13,8,64,8,3584,2560,64,64,128,4,8,2,1534.6193333333333,3
w13,8,64,8,3584,2560,64,64,128,4,8,3,1534.2563333333335,3
w13,8,64,8,3584,2560,64,64,128,4,8,4,1535.3873333333333,3
w13,8,64,8,3584,2560,64,64,128,8,4,3,1532.9660000000001,3
w13,8,64,8,3584,2560,64,64,128,8,4,4,1534.4703333333334,3
w13,8,64,8,3584,2560,64,64,128,8,8,2,1533.9903333333332,3
w13,8,64,8,3584,2560,64,64,128,8,8,3,1534.1286666666667,3
w13,8,64,8,3584,2560,64,64,128,8,8,4,1533.777,3
w13,8,64,8,3584,2560,64,64,128,16,4,2,1543.814,3
w13,8,64,8,3584,2560,64,64,128,16,4,3,1537.6383333333333,3
w13,8,64,8,3584,2560,64,64,128,16,4,4,1534.6943333333331,3
w13,8,64,8,3584,2560,64,64,128,16,8,2,1535.889,3
w13,8,64,8,3584,2560,64,64,128,16,8,3,1540.0596666666668,3
w13,8,64,8,3584,2560,64,64,128,16,8,4,1534.7796666666666,3
w13,8,64,8,3584,2560,64,64,128,32,4,2,1543.7926666666665,3
w13,8,64,8,3584,2560,64,64,128,32,4,3,1541.4996666666666,3
w13,8,64,8,3584,2560,64,64,128,32,4,4,1535.2273333333333,3
w13,8,64,8,3584,2560,64,64,128,32,8,2,1541.99,3
w13,8,64,8,3584,2560,64,64,128,32,8,3,1542.2783333333334,3
w13,8,64,8,3584,2560,64,64,128,32,8,4,1537.4783333333335,3
w13,8,64,8,3584,2560,64,64,128,64,4,3,1540.518,3
w13,8,64,8,3584,2560,64,64,128,64,4,4,1537.2006666666666,3
w13,8,64,8,3584,2560,64,64,128,64,8,3,1541.2436666666665,3
w13,8,64,8,3584,2560,64,64,128,64,8,4,1537.6166666666668,3
w13,8,64,8,3584,2560,64,128,64,1,8,4,1544.5183333333334,3
w13,8,64,8,3584,2560,64,128,128,1,4,2,1531.9533333333331,3
w13,8,64,8,3584,2560,64,128,128,1,4,3,1542.1396666666667,3
w13,8,64,8,3584,2560,64,128,128,1,8,2,1532.8706666666667,3
w13,8,64,8,3584,2560,64,128,128,1,8,3,1530.9930000000002,3
w13,8,64,8,3584,2560,64,128,128,4,4,2,1532.9876666666667,3
w13,8,64,8,3584,2560,64,128,128,4,4,3,1541.6490000000001,3
w13,8,64,8,3584,2560,64,128,128,4,8,2,1533.457333333333,3
w13,8,64,8,3584,2560,64,128,128,4,8,3,1531.899666666667,3
w13,8,64,8,3584,2560,64,128,128,16,4,2,1536.0813333333333,3
w13,8,64,8,3584,2560,64,128,128,16,4,3,1541.7556666666667,3
w13,8,64,8,3584,2560,64,128,128,16,8,2,1536.369,3
w13,8,64,8,3584,2560,64,128,128,16,8,3,1533.0836666666667,3
w13,8,64,8,3584,2560,64,128,128,32,4,2,1535.793,3
w13,8,64,8,3584,2560,64,128,128,32,4,3,1542.4703333333334,3
w13,8,64,8,3584,2560,64,128,128,32,8,2,1534.3636666666669,3
w13,8,64,8,3584,2560,64,128,128,32,8,3,1532.9233333333332,3
w13,8,64,8,3584,2560,64,128,128,64,4,2,1538.4809999999998,3
w13,8,64,8,3584,2560,64,128,128,64,8,2,1538.844,3
w13,8,64,8,3584,2560,64,128,128,64,8,3,1536.2520000000002,3
w13,8,64,8,3584,2560,128,64,128,1,8,2,1542.14,3
w13,8,64,8,3584,2560,128,64,128,1,8,3,1543.5906666666667,3
w13,8,128,4,2048,512,16,32,64,16,4,3,23.543333333333333,3
w13,8,128,4,2048,512,16,32,64,32,4,3,23.586,3
w13,8,128,4,2048,512,16,64,64,1,4,3,23.394000000000002,3
w13,8,128,4,2048,512,16,64,64,1,4,4,23.628666666666664,3
w13,8,128,4,2048,512,16,64,64,1,8,4,23.394000000000002,3
w13,8,128,4,2048,512,16,64,64,16,8,4,23.61833333333333,3
w13,8,128,6,4096,2048,16,16,64,1,4,3,1050.8516666666667,3
w13,8,128,6,4096,2048,16,16,64,1,4,4,1049.9660000000001,3
w13,8,128,6,4096,2048,16,16,64,1,8,2,1057.3686666666665,3
w13,8,128,6,4096,2048,16,16,64,1,8,3,1050.6383333333333,3
w13,8,128,6,4096,2048,16,16,64,1,8,4,1050.7663333333333,3
w13,8,128,6,4096,2048,16,16,128,1,4,2,1048.441,3
w13,8,128,6,4096,2048,16,16,128,1,4,3,1054.702,3
w13,8,128,6,4096,2048,16,16,128,1,4,4,1050.67,3
w13,8,128,6,4096,2048,16,16,128,1,8,2,1049.3473333333334,3
w13,8,128,6,4096,2048,16,16,128,1,8,4,1054.2006666666668,3
w13,8,128,6,4096,2048,16,16,128,4,4,2,1049.3263333333332,3
w13,8,128,6,4096,2048,16,16,128,4,4,3,1055.235,3
w13,8,128,6,4096,2048,16,16,128,4,4,4,1050.0086666666666,3
w13,8,128,6,4096,2048,16,16,128,4,8,2,1049.7743333333335,3
w13,8,128,6,4096,2048,16,16,128,4,8,4,1053.5926666666667,3
w13,8,128,6,4096,2048,16,16,256,1,4,2,1054.3713333333333,3
w13,8,128,6,4096,2048,16,16,256,1,4,3,1050.03,3
w13,8,128,6,4096,2048,16,16,256,1,4,4,1050.5633333333333,3
w13,8,128,6,4096,2048,16,16,256,1,8,2,1054.3183333333334,3
w13,8,128,6,4096,2048,16,16,256,1,8,3,1051.9503333333334,3
w13,8,128,6,4096,2048,16,16,256,1,8,4,1051.566,3
w13,8,128,6,4096,2048,16,16,256,4,4,2,1056.1209999999999,3
w13,8,128,6,4096,2048,16,16,256,4,4,3,1049.422,3
w13,8,128,6,4096,2048,16,16,256,4,4,4,1049.6779999999999,3
w13,8,128,6,4096,2048,16,16,256,4,8,2,1053.9873333333333,3
w13,8,128,6,4096,2048,16,16,256,4,8,3,1050.969,3
w13,8,128,6,4096,2048,16,16,256,4,8,4,1051.9713333333332,3
w13,8,128,6,4096,2048,16,32,64,1,4,2,1053.465,3
w13,8,128,6,4096,2048,16,32,64,1,4,3,1049.1983333333335,3
w13,8,128,6,4096,2048,16,32,64,1,4,4,1050.9579999999999,3
w13,8,128,6,4096,2048,16,32,64,1,8,2,1051.6086666666667,3
w13,8,128,6,4096,2048,16,32,64,1,8,3,1049.4436666666668,3
w13,8,128,6,4096,2048,16,32,64,1,8,4,1049.8486666666668,3
w13,8,128,6,4096,2048,16,32,64,16,4,3,1052.8566666666666,3
w13,8,128,6,4096,2048,16,32,64,16,4,4,1053.646,3
w13,8,128,6,4096,2048,16,32,64,16,8,3,1051.246,3
w13,8,128,6,4096,2048,16,32,64,16,8,4,1054.8086666666666,3
w13,8,128,6,4096,2048,16,32,64,32,4,3,1051.0543333333333,3
w13,8,128,6,4096,2048,16,32,64,32,4,4,1051.2033333333334,3
w13,8,128,6,4096,2048,16,32,64,32,8,3,1050.478,3
w13,8,128,6,4096,2048,16,32,64,32,8,4,1052.1633333333332,3
w13,8,128,6,4096,2048,16,32,64,64,4,3,1053.2623333333333,3
w13,8,128,6,4096,2048,16,32,64,64,4,4,1052.3446666666666,3
w13,8,128,6,4096,2048,16,32,64,64,8,3,1051.0753333333332,3
w13,8,128,6,4096,2048,16,32,64,64,8,4,1052.9633333333334,3
w13,8,128,6,4096,2048,16,32,128,1,4,2,1048.3983333333333,3
w13,8,128,6,4096,2048,16,32,128,1,4,3,1049.454,3
w13,8,128,6,4096,2048,16,32,128,1,4,4,1049.081,3
w13,8,128,6,4096,2048,16,32,128,1,8,2,1048.558,3
w13,8,128,6,4096,2048,16,32,128,1,8,3,1055.0536666666667,3
w13,8,128,6,4096,2048,16,32,128,1,8,4,1050.51,3
w13,8,128,6,4096,2048,16,32,128,4,4,2,1049.1663333333333,3
w13,8,128,6,4096,2048,16,32,128,4,4,3,1049.5396666666666,3
w13,8,128,6,4096,2048,16,32,128,4,4,4,1049.2623333333333,3
w13,8,128,6,4096,2048,16,32,128,4,8,2,1049.3153333333332,3
w13,8,128,6,4096,2048,16,32,128,4,8,3,1056.782,3
w13,8,128,6,4096,2048,16,32,128,4,8,4,1050.713,3
w13,8,128,6,4096,2048,16,32,128,16,4,2,1049.881,3
w13,8,128,6,4096,2048,16,32,128,16,4,3,1051.577,3
w13,8,128,6,4096,2048,16,32,128,16,4,4,1050.7766666666666,3
w13,8,128,6,4096,2048,16,32,128,16,8,2,1049.7526666666665,3
w13,8,128,6,4096,2048,16,32,128,16,8,3,1054.1046666666668,3
w13,8,128,6,4096,2048,16,32,128,16,8,4,1051.918,3
w13,8,128,6,4096,2048,16,32,128,32,4,2,1049.326,3
w13,8,128,6,4096,2048,16,32,128,32,4,3,1055.5446666666667,3
w13,8,128,6,4096,2048,16,32,128,32,4,4,1051.3419999999999,3
w13,8,128,6,4096,2048,16,32,128,32,8,2,1050.3286666666665,3
w13,8,128,6,4096,2048,16,32,128,32,8,3,1055.982,3
w13,8,128,6,4096,2048,16,32,128,32,8,4,1053.486,3
w13,8,128,6,4096,2048,16,32,128,64,4,2,1049.945,3
w13,8,128,6,4096,2048,16,32,128,64,4,3,1056.8033333333333,3
w13,8,128,6,4096,2048,16,32,128,64,4,4,1051.0003333333334,3
w13,8,128,6,4096,2048,16,32,128,64,8,2,1049.3156666666666,3
w13,8,128,6,4096,2048,16,32,128,64,8,4,1053.657,3
w13,8,128,6,4096,2048,16,32,256,1,4,2,1052.9426666666666,3
w13,8,128,6,4096,2048,16,32,256,1,4,3,1049.134,3
w13,8,128,6,4096,2048,16,32,256,1,4,4,1050.201,3
w13,8,128,6,4096,2048,16,32,256,1,8,2,1055.9606666666666,3
w13,8,128,6,4096,2048,16,32,256,1,8,3,1050.7340000000002,3
w13,8,128,6,4096,2048,16,32,256,1,8,4,1051.2996666666666,3
w13,8,128,6,4096,2048,16,32,256,16,4,2,1052.6326666666666,3
w13,8,128,6,4096,2048,16,32,256,16,4,3,1052.2273333333335,3
w13,8,128,6,4096,2048,16,32,256,16,4,4,1050.9156666666668,3
w13,8,128,6,4096,2048,16,32,256,16,8,2,1054.201,3
w13,8,128,6,4096,2048,16,32,256,16,8,3,1054.3393333333333,3
w13,8,128,6,4096,2048,16,32,256,16,8,4,1051.1716666666666,3
w13,8,128,6,4096,2048,16,32,256,32,4,2,1056.0996666666667,3
w13,8,128,6,4096,2048,16,32,256,32,4,3,1053.2833333333333,3
w13,8,128,6,4096,2048,16,32,256,32,4,4,1051.0006666666666,3
w13,8,128,6,4096,2048,16,32,256,32,8,2,1057.5926666666667,3
w13,8,128,6,4096,2048,16,32,256,32,8,3,1055.7046666666668,3
w13,8,128,6,4096,2048,16,32,256,32,8,4,1052.0993333333333,3
w13,8,128,6,4096,2048,16,32,256,64,4,2,1058.6806666666666,3
w13,8,128,6,4096,2048,16,32,256,64,4,3,1053.9343333333334,3
w13,8,128,6,4096,2048,16,32,256,64,4,4,1051.9393333333335,3
w13,8,128,6,4096,2048,16,32,256,64,8,3,1054.6596666666667,3
w13,8,128,6,4096,2048,16,32,256,64,8,4,1053.0166666666667,3
w13,8,128,6,4096,2048,16,64,64,1,4,2,1052.5156666666664,3
w13,8,128,6,4096,2048,16,64,64,1,4,4,1049.678,3
w13,8,128,6,4096,2048,16,64,64,1,8,2,1052.526,3
w13,8,128,6,4096,2048,16,64,64,1,8,3,1052.8353333333334,3
w13,8,128,6,4096,2048,16,64,64,1,8,4,1049.2623333333333,3
w13,8,128,6,4096,2048,16,64,64,16,4,3,1056.1526666666666,3
w13,8,128,6,4096,2048,16,64,64,16,4,4,1054.0086666666666,3
w13,8,128,6,4096,2048,16,64,64,16,8,3,1055.1606666666667,3
w13,8,128,6,4096,2048,16,64,64,16,8,4,1055.7266666666667,3
w13,8,128,6,4096,2048,16,64,64,32,4,3,1054.3393333333333,3
w13,8,128,6,4096,2048,16,64,64,32,4,4,1050.7340000000002,3
w13,8,128,6,4096,2048,16,64,64,32,8,3,1054.2646666666667,3
w13,8,128,6,4096,2048,16,64,64,32,8,4,1052.91,3
w13,8,128,6,4096,2048,16,64,64,64,4,4,1052.6113333333333,3
w13,8,128,6,4096,2048,16,64,64,64,8,4,1052.8036666666667,3
w13,8,128,6,4096,2048,16,64,128,1,4,3,1051.0753333333334,3
w13,8,128,6,4096,2048,16,64,128,1,4,4,1049.5393333333334,3
w13,8,128,6,4096,2048,16,64,128,1,8,3,1051.3419999999999,3
w13,8,128,6,4096,2048,16,64,128,1,8,4,1049.39,3
w13,8,128,6,4096,2048,16,64,128,16,4,2,1057.1126666666667,3
w13,8,128,6,4096,2048,16,64,128,16,4,3,1057.4756666666665,3
w13,8,128,6,4096,2048,16,64,128,16,4,4,1052.4833333333333,3
w13,8,128,6,4096,2048,16,64,128,16,8,3,1058.457,3
w13,8,128,6,4096,2048,16,64,128,16,8,4,1050.9476666666667,3
w13,8,128,6,4096,2048,16,64,128,32,4,2,1055.673,3
w13,8,128,6,4096,2048,16,64,128,32,4,3,1057.7956666666666,3
w13,8,128,6,4096,2048,16,64,128,32,4,4,1052.3236666666667,3
w13,8,128,6,4096,2048,16,64,128,32,8,2,1057.8703333333333,3
w13,8,128,6,4096,2048,16,64,128,32,8,3,1057.9979999999998,3
w13,8,128,6,4096,2048,16,64,128,32,8,4,1052.153,3
w13,8,128,6,4096,2048,16,64,128,64,4,2,1052.793,3
w13,8,128,6,4096,2048,16,64,128,64,4,3,1056.793,3
w13,8,128,6,4096,2048,16,64,128,64,4,4,1051.79,3
w13,8,128,6,4096,2048,16,64,128,64,8,2,1053.8486666666668,3
w13,8,128,6,4096,2048,16,64,128,64,8,4,1051.9073333333333,3
w13,8,128,6,4096,2048,16,64,256,1,4,2,1054.0196666666668,3
w13,8,128,6,4096,2048,16,64,256,1,4,3,1052.1633333333332,3
w13,8,128,6,4096,2048,16,64,256,1,8,2,1054.2756666666667,3
w13,8,128,6,4096,2048,16,64,256,1,8,3,1051.9073333333333,3
w13,8,128,6,4096,2048,16,64,256,16,4,3,1053.2406666666666,3
w13,8,128,6,4096,2048,16,64,256,16,8,3,1053.8916666666667,3
w13,8,128,6,4096,2048,16,64,256,32,4,3,1053.8593333333336,3
w13,8,128,6,4096,2048,16,64,256,32,8,3,1054.3823333333332,3
w13,8,128,6,4096,2048,16,64,256,64,4,3,1055.1076666666668,3
w13,8,128,6,4096,2048,16,64,256,64,8,3,1054.2003333333334,3
w13,8,128,6,4096,2048,16,128,64,1,4,2,1050.5743333333332,3
w13,8,128,6,4096,2048,16,128,64,1,4,3,1056.5473333333332,3
w13,8,128,6,4096,2048,16,128,64,1,8,2,1051.2566666666667,3
w13,8,128,6,4096,2048,16,128,64,1,8,3,1050.8946666666668,3
w13,8,128,6,4096,2048,16,128,64,1,8,4,1058.5316666666665,3
w13,8,128,6,4096,2048,16,128,64,16,4,2,1054.7766666666666,3
w13,8,128,6,4096,2048,16,128,64,16,8,2,1054.7236666666668,3
w13,8,128,6,4096,2048,16,128,64,16,8,3,1055.897,3
w13,8,128,6,4096,2048,16,128,64,32,4,2,1055.5126666666665,3
w13,8,128,6,4096,2048,16,128,64,32,4,3,1053.4543333333334,3
w13,8,128,6,4096,2048,16,128,64,32,8,2,1054.969,3
w13,8,128,6,4096,2048,16,128,64,32,8,3,1052.5256666666667,3
w13,8,128,6,4096,2048,16,128,64,64,8,2,1055.7263333333333,3
w13,8,128,6,4096,2048,16,128,64,64,8,3,1057.7953333333332,3
w13,8,128,6,4096,2048,16,128,128,16,4,2,1057.0910000000001,3
w13,8,128,6,4096,2048,16,128,128,16,8,2,1056.2166666666665,3
w13,8,128,6,4096,2048,16,128,128,32,4,2,1054.819,3
w13,8,128,6,4096,2048,16,128,128,32,8,2,1054.3500000000001,3
w13,8,128,6,4096,2048,16,128,128,64,4,2,1054.4143333333334,3
w13,8,128,6,4096,2048,16,128,128,64,8,2,1055.2569999999998,3
w13,8,128,6,4096,2048,16,256,64,1,4,3,1055.8966666666668,3
w13,8,128,6,4096,2048,16,256,64,1,8,3,1053.8703333333333,3
w13,8,128,6,4096,2048,16,256,64,32,4,3,1058.585,3
w13,8,128,6,4096,2048,16,256,64,64,8,3,1057.422,3
w13,8,128,6,4096,2048,32,16,128,4,4,2,1050.3183333333334,3
w13,8,128,6,4096,2048,32,16,128,4,4,3,1049.8059999999998,3
w13,8,128,6,4096,2048,32,16,128,4,4,4,1049.646,3
w13,8,128,6,4096,2048,32,16,128,4,8,2,1049.998,3
w13,8,128,6,4096,2048,32,16,128,4,8,3,1054.3819999999998,3
w13,8,128,6,4096,2048,32,16,128,4,8,4,1051.4276666666667,3
w13,8,128,6,4096,2048,32,32,64,1,4,2,1053.8803333333333,3
w13,8,128,6,4096,2048,32,32,64,1,4,3,1049.8916666666667,3
w13,8,128,6,4096,2048,32,32,64,1,4,4,1054.318,3
w13,8,128,6,4096,2048,32,32,64,1,8,2,1051.7576666666666,3
w13,8,128,6,4096,2048,32,32,64,1,8,3,1048.7393333333332,3
w13,8,128,6,4096,2048,32,32,64,1,8,4,1058.137,3
w13,8,128,6,4096,2048,32,32,64,32,4,3,1051.1076666666665,3
w13,8,128,6,4096,2048,32,32,64,32,8,3,1050.2540000000001,3
w13,8,128,6,4096,2048,32,32,64,64,4,3,1051.854,3
w13,8,128,6,4096,2048,32,32,64,64,4,4,1058.4673333333333,3
w13,8,128,6,4096,2048,32,32,64,64,8,3,1050.5420000000001,3
w13,8,128,6,4096,2048,32,32,64,128,4,3,1050.9793333333334,3
w13,8,128,6,4096,2048,32,32,64,128,4,4,1058.6063333333334,3
w13,8,128,6,4096,2048,32,32,64,128,8,3,1050.5529999999999,3
w13,8,128,6,4096,2048,32,32,128,1,4,2,1048.142,3
w13,8,128,6,4096,2048,32,32,128,1,4,3,1050.99,3
w13,8,128,6,4096,2048,32,32,128,1,4,4,1051.0003333333334,3
w13,8,128,6,4096,2048,32,32,128,1,8,2,1048.7183333333332,3
w13,8,128,6,4096,2048,32,32,128,1,8,3,1055.854,3
w13,8,128,6,4096,2048,32,32,128,1,8,4,1050.201,3
w13,8,128,6,4096,2048,32,32,128,4,4,2,1049.1983333333333,3
w13,8,128,6,4096,2048,32,32,128,4,4,3,1050.2116666666668,3
w13,8,128,6,4096,2048,32,32,128,4,4,4,1049.806,3
w13,8,128,6,4096,2048,32,32,128,4,8,2,1049.07,3
w13,8,128,6,4096,2048,32,32,128,4,8,3,1049.9553333333333,3
w13,8,128,6,4096,2048,32,32,128,4,8,4,1051.8433333333332,3
w13,8,128,6,4096,2048,32,32,128,16,4,2,1048.7926666666665,3
w13,8,128,6,4096,2048,32,32,128,16,4,3,1049.8593333333333,3
w13,8,128,6,4096,2048,32,32,128,16,4,4,1052.142,3
w13,8,128,6,4096,2048,32,32,128,16,8,2,1049.39,3
w13,8,128,6,4096,2048,32,32,128,16,8,3,1051.5233333333333,3
w13,8,128,6,4096,2048,32,32,128,16,8,4,1053.1236666666666,3
w13,8,128,6,4096,2048,32,32,128,64,4,2,1049.4006666666667,3
w13,8,128,6,4096,2048,32,32,128,64,4,3,1050.4036666666668,3
w13,8,128,6,4096,2048,32,32,128,64,4,4,1052.7606666666668,3
w13,8,128,6,4096,2048,32,32,128,64,8,2,1050.521,3
w13,8,128,6,4096,2048,32,32,128,64,8,3,1050.3606666666667,3
w13,8,128,6,4096,2048,32,32,128,64,8,4,1055.161,3
w13,8,128,6,4096,2048,32,32,256,1,4,2,1051.6623333333334,3
w13,8,128,6,4096,2048,32,32,256,1,4,3,1049.4003333333333,3
w13,8,128,6,4096,2048,32,32,256,1,4,4,1050.585,3
w13,8,128,6,4096,2048,32,32,256,1,8,2,1051.022,3
w13,8,128,6,4096,2048,32,32,256,1,8,3,1049.5396666666668,3
w13,8,128,6,4096,2048,32,32,256,1,8,4,1050.4246666666668,3
w13,8,128,6,4096,2048,32,32,256,4,4,2,1049.6563333333334,3
w13,8,128,6,4096,2048,32,32,256,4,4,3,1049.9343333333334,3
w13,8,128,6,4096,2048,32,32,256,4,4,4,1050.009,3
w13,8,128,6,4096,2048,32,32,256,4,8,2,1051.9393333333335,3
w13,8,128,6,4096,2048,32,32,256,4,8,3,1049.6463333333334,3
w13,8,128,6,4096,2048,32,32,256,4,8,4,1050.5633333333333,3
w13,8,128,6,4096,2048,32,32,256,16,4,2,1050.7766666666666,3
w13,8,128,6,4096,2048,32,32,256,16,4,3,1050.4033333333334,3
w13,8,128,6,4096,2048,32,32,256,16,4,4,1051.043,3
w13,8,128,6,4096,2048,32,32,256,16,8,2,1049.8806666666667,3
w13,8,128,6,4096,2048,32,32,256,16,8,3,1050.8300000000002,3
w13,8,128,6,4096,2048,32,32,256,16,8,4,1051.3636666666666,3
w13,8,128,6,4096,2048,32,32,256,32,4,2,1050.2543333333333,3
w13,8,128,6,4096,2048,32,32,256,32,4,3,1050.7763333333335,3
w13,8,128,6,4096,2048,32,32,256,32,4,4,1051.4276666666667,3
w13,8,128,6,4096,2048,32,32,256,32,8,2,1049.6886666666667,3
w13,8,128,6,4096,2048,32,32,256,32,8,3,1051.0436666666667,3
w13,8,128,6,4096,2048,32,32,256,32,8,4,1052.121,3
w13,8,128,6,4096,2048,32,64,64,1,4,4,1052.067,3
w13,8,128,6,4096,2048,32,64,64,1,8,2,1052.8033333333333,3
w13,8,128,6,4096,2048,32,64,64,1,8,4,1052.8566666666666,3
w13,8,128,6,4096,2048,32,64,128,1,4,3,1053.2830000000001,3
w13,8,128,6,4096,2048,32,64,128,1,4,4,1049.9126666666668,3
w13,8,128,6,4096,2048,32,64,128,1,8,3,1052.857,3
w13,8,128,6,4096,2048,32,64,128,1,8,4,1049.7203333333334,3
w13,8,128,6,4096,2048,32,64,128,4,4,3,1054.6273333333334,3
w13,8,128,6,4096,2048,32,64,128,4,4,4,1050.381666666667,3
w13,8,128,6,4096,2048,32,64,128,4,8,3,1054.894,3
w13,8,128,6,4096,2048,32,64,128,4,8,4,1051.8756666666666,3
w13,8,128,6,4096,2048,32,64,128,16,4,4,1052.622,3
w13,8,128,6,4096,2048,32,64,128,16,8,4,1051.4596666666666,3
w13,8,128,6,4096,2048,32,64,128,32,4,2,1057.9233333333334,3
w13,8,128,6,4096,2048,32,64,128,32,4,4,1053.6573333333333,3
w13,8,128,6,4096,2048,32,64,128,32,8,4,1052.7716666666668,3
w13,8,128,6,4096,2048,32,64,128,64,4,2,1054.446,3
w13,8,128,6,4096,2048,32,64,128,64,4,4,1051.918,3
w13,8,128,6,4096,2048,32,64,128,64,8,2,1057.55,3
w13,8,128,6,4096,2048,32,64,128,64,8,4,1052.867,3
w13,8,128,6,4096,2048,32,64,256,1,4,2,1056.558,3
w13,8,128,6,4096,2048,32,64,256,1,4,3,1051.8006666666668,3
w13,8,128,6,4096,2048,32,64,256,1,8,2,1054.6490000000001,3
w13,8,128,6,4096,2048,32,64,256,1,8,3,1051.4063333333334,3
w13,8,128,6,4096,2048,32,64,256,8,4,3,1054.201,3
w13,8,128,6,4096,2048,32,64,256,8,8,2,1057.39,3
w13,8,128,6,4096,2048,32,64,256,8,8,3,1054.297,3
w13,8,128,6,4096,2048,32,64,256,16,4,3,1054.6703333333332,3
w13,8,128,6,4096,2048,32,64,256,16,8,3,1055.182,3
w13,8,128,6,4096,2048,32,64,256,32,4,3,1055.2783333333334,3
w13,8,128,6,4096,2048,32,64,256,32,8,3,1055.662,3
w13,8,128,6,4096,2048,32,64,256,64,4,3,1056.0249999999999,3
w13,8,128,6,4096,2048,32,64,256,64,8,3,1055.2033333333331,3
w13,8,128,6,4096,2048,32,128,64,1,8,2,1051.4063333333334,3
w13,8,128,6,4096,2048,32,128,64,32,4,3,1055.0433333333333,3
w13,8,128,6,4096,2048,32,128,64,32,8,3,1056.4833333333333,3
w13,8,128,6,4096,2048,32,128,128,16,8,2,1058.6916666666666,3
w13,8,128,6,4096,2048,32,128,128,32,4,2,1056.8996666666667,3
w13,8,128,6,4096,2048,32,128,128,32,8,2,1056.9523333333334,3
w13,8,128,6,4096,2048,32,128,128,64,4,2,1056.686,3
w13,8,128,6,4096,2048,32,128,128,64,8,2,1055.3846666666666,3
w13,8,128,6,4096,2048,32,256,64,1,4,3,1058.1366666666668,3
w13,8,128,6,4096,2048,64,16,128,1,4,2,1056.3656666666666,3
w13,8,128,6,4096,2048,64,16,128,1,4,3,1052.5796666666665,3
w13,8,128,6,4096,2048,64,16,128,1,4,4,1055.79,3
w13,8,128,6,4096,2048,64,16,128,1,8,2,1057.6246666666666,3
w13,8,128,6,4096,2048,64,16,128,1,8,3,1052.2383333333335,3
w13,8,128,6,4096,2048,64,16,128,1,8,4,1054.8616666666667,3
w13,8,128,6,4096,2048,64,32,128,1,4,3,1051.7366666666667,3
w13,8,128,6,4096,2048,64,32,128,1,4,4,1053.7736666666667,3
w13,8,128,6,4096,2048,64,32,128,1,8,3,1052.3556666666666,3
w13,8,128,6,4096,2048,64,32,128,1,8,4,1052.91,3
w13,8,128,6,4096,2048,64,32,128,16,4,3,1052.057,3
w13,8,128,6,4096,2048,64,32,128,16,4,4,1056.878,3
w13,8,128,6,4096,2048,64,32,128,16,8,3,1052.2593333333332,3
w13,8,128,6,4096,2048,64,32,128,16,8,4,1055.097,3
w13,8,128,6,4096,2048,64,32,256,1,4,2,1052.9846666666665,3
w13,8,128,6,4096,2048,64,32,256,1,4,3,1051.854,3
w13,8,128,6,4096,2048,64,32,256,1,8,2,1053.6036666666666,3
w13,8,128,6,4096,2048,64,32,256,1,8,3,1050.67,3
w13,8,128,6,4096,2048,64,64,64,1,4,3,1055.0543333333333,3
w13,8,128,6,4096,2048,64,64,64,1,8,3,1052.0033333333333,3
w13,8,128,6,4096,2048,64,64,64,4,4,3,1055.246,3
w13,8,128,6,4096,2048,64,64,64,4,4,4,1058.489,3
w13,8,128,6,4096,2048,64,64,64,4,8,3,1053.902,3
w13,8,128,6,4096,2048,64,64,64,16,4,3,1057.433,3
w13,8,128,6,4096,2048,64,64,64,32,4,3,1056.1523333333332,3
w13,8,128,6,4096,2048,64,64,64,32,8,3,1056.1316666666667,3
w13,8,128,6,4096,2048,64,64,128,1,4,2,1052.014,3
w13,8,128,6,4096,2048,64,64,128,1,4,3,1051.1286666666667,3
w13,8,128,6,4096,2048,64,64,128,1,4,4,1053.5816666666667,3
w13,8,128,6,4096,2048,64,64,128,1,8,3,1051.5766666666666,3
w13,8,128,6,4096,2048,64,64,128,1,8,4,1055.2996666666668,3
w13,8,128,6,4096,2048,64,64,128,4,4,2,1052.5259999999998,3
w13,8,128,6,4096,2048,64,64,128,4,4,3,1052.057,3
w13,8,128,6,4096,2048,64,64,128,4,4,4,1053.1983333333335,3
w13,8,128,6,4096,2048,64,64,128,4,8,3,1051.3423333333333,3
w13,8,128,6,4096,2048,64,64,128,4,8,4,1053.635,3
w13,8,128,6,4096,2048,64,64,128,8,4,2,1052.5686666666668,3
w13,8,128,6,4096,2048,64,64,128,8,4,3,1051.214,3
w13,8,128,6,4096,2048,64,64,128,8,4,4,1054.2323333333334,3
w13,8,128,6,4096,2048,64,64,128,8,8,3,1051.172,3
w13,8,128,6,4096,2048,64,64,128,8,8,4,1054.6703333333332,3
w13,8,128,6,4096,2048,64,64,128,16,4,2,1053.4966666666667,3
w13,8,128,6,4096,2048,64,64,128,16,4,3,1051.6943333333331,3
w13,8,128,6,4096,2048,64,64,128,16,4,4,1055.8326666666665,3
w13,8,128,6,4096,2048,64,64,128,16,8,3,1051.9073333333333,3
w13,8,128,6,4096,2048,64,64,128,16,8,4,1056.398,3
w13,8,128,6,4096,2048,64,64,128,32,4,2,1053.262,3
w13,8,128,6,4096,2048,64,64,128,32,4,3,1050.6703333333332,3
w13,8,128,6,4096,2048,64,64,128,32,4,4,1056.0249999999999,3
w13,8,128,6,4096,2048,64,64,128,32,8,3,1051.8220000000001,3
w13,8,128,6,4096,2048,64,64,128,32,8,4,1056.1846666666668,3
w13,8,128,6,4096,2048,64,64,128,64,4,2,1053.806,3
w13,8,128,6,4096,2048,64,64,128,64,4,3,1052.782,3
w13,8,128,6,4096,2048,64,64,128,64,4,4,1055.2353333333333,3
w13,8,128,6,4096,2048,64,64,128,64,8,3,1051.9073333333333,3
w13,8,128,6,4096,2048,64,64,128,64,8,4,1056.0036666666667,3
w13,8,128,6,4096,2048,64,128,64,1,4,2,1053.6676666666667,3
w13,8,128,6,4096,2048,64,128,64,32,8,3,1057.1133333333335,3
w13,8,128,8,2048,768,16,32,128,1,4,2,260.71700000000004,3
w13,8,128,8,2048,768,16,32,256,1,4,2,262.37066666666664,3
w13,8,128,8,2048,768,16,64,64,16,4,2,262.541,3
w13,8,128,8,2048,768,32,16,128,4,4,2,261.9866666666667,3
w13,8,128,8,2048,768,32,32,128,1,4,2,259.9916666666667,3
w13,8,128,8,2048,768,32,32,256,1,4,2,260.557,3
w13,8,128,8,2048,768,64,64,128,1,4,2,260.205,3
w13,8,128,8,4096,1536,16,16,64,1,4,3,1050.2753333333333,3
w13,8,128,8,4096,1536,16,16,64,1,4,4,1050.606,3
w13,8,128,8,4096,1536,16,16,64,1,8,2,1056.7283333333332,3
w13,8,128,8,4096,1536,16,16,64,1,8,3,1050.787,3
w13,8,128,8,4096,1536,16,16,64,1,8,4,1050.7656666666664,3
w13,8,128,8,4096,1536,16,16,128,1,4,2,1048.7606666666668,3
w13,8,128,8,4096,1536,16,16,128,1,4,3,1054.5420000000001,3
w13,8,128,8,4096,1536,16,16,128,1,4,4,1050.1793333333333,3
w13,8,128,8,4096,1536,16,16,128,1,8,2,1049.9763333333333,3
w13,8,128,8,4096,1536,16,16,128,1,8,4,1053.7203333333334,3
w13,8,128,8,4096,1536,16,16,128,4,4,2,1048.6966666666667,3
w13,8,128,8,4096,1536,16,16,128,4,4,3,1053.8483333333334,3
w13,8,128,8,4096,1536,16,16,128,4,4,4,1053.1553333333334,3
w13,8,128,8,4096,1536,16,16,128,4,8,2,1051.1603333333333,3
w13,8,128,8,4096,1536,16,16,128,4,8,4,1057.2723333333333,3
w13,8,128,8,4096,1536,16,16,256,1,4,2,1056.3443333333335,3
w13,8,128,8,4096,1536,16,16,256,1,4,3,1050.7123333333332,3
w13,8,128,8,4096,1536,16,16,256,1,4,4,1050.2643333333333,3
w13,8,128,8,4096,1536,16,16,256,1,8,2,1052.5683333333334,3
w13,8,128,8,4096,1536,16,16,256,1,8,3,1051.2669999999998,3
w13,8,128,8,4096,1536,16,16,256,1,8,4,1052.2163333333333,3
w13,8,128,8,4096,1536,16,16,256,4,4,2,1055.7259999999999,3
w13,8,128,8,4096,1536,16,16,256,4,4,3,1049.6776666666667,3
w13,8,128,8,4096,1536,16,16,256,4,4,4,1049.9656666666667,3
w13,8,128,8,4096,1536,16,16,256,4,8,2,1055.6833333333334,3
w13,8,128,8,4096,1536,16,16,256,4,8,3,1051.2136666666668,3
w13,8,128,8,4096,1536,16,16,256,4,8,4,1051.7259999999999,3
w13,8,128,8,4096,1536,16,32,64,1,4,2,1052.5686666666668,3
w13,8,128,8,4096,1536,16,32,64,1,4,3,1048.8563333333334,3
w13,8,128,8,4096,1536,16,32,64,1,4,4,1051.267,3
w13,8,128,8,4096,1536,16,32,64,1,8,2,1051.9603333333334,3
w13,8,128,8,4096,1536,16,32,64,1,8,3,1050.094,3
w13,8,128,8,4096,1536,16,32,64,1,8,4,1049.8593333333333,3
w13,8,128,8,4096,1536,16,32,64,16,8,4,1055.3843333333334,3
w13,8,128,8,4096,1536,16,32,64,32,4,3,1054.0403333333334,3
w13,8,128,8,4096,1536,16,32,64,32,4,4,1057.4536666666665,3
w13,8,128,8,4096,1536,16,32,64,32,8,4,1058.222,3
w13,8,128,8,4096,1536,16,32,128,1,4,2,1048.131,3
w13,8,128,8,4096,1536,16,32,128,1,4,3,1049.7313333333334,3
w13,8,128,8,4096,1536,16,32,128,1,4,4,1049.2833333333335,3
w13,8,128,8,4096,1536,16,32,128,1,8,2,1048.7496666666666,3
w13,8,128,8,4096,1536,16,32,128,1,8,3,1057.1763333333333,3
w13,8,128,8,4096,1536,16,32,128,1,8,4,1050.3283333333334,3
w13,8,128,8,4096,1536,16,32,128,4,4,2,1052.3126666666667,3
w13,8,128,8,4096,1536,16,32,128,4,4,3,1049.4853333333333,3
w13,8,128,8,4096,1536,16,32,128,4,4,4,1053.1760000000002,3
w13,8,128,8,4096,1536,16,32,128,4,8,2,1049.7520000000002,3
w13,8,128,8,4096,1536,16,32,128,4,8,3,1056.3763333333334,3
w13,8,128,8,4096,1536,16,32,128,4,8,4,1053.315,3
w13,8,128,8,4096,1536,16,32,128,32,4,2,1055.5336666666665,3
w13,8,128,8,4096,1536,16,32,128,32,4,3,1055.7363333333333,3
w13,8,128,8,4096,1536,16,32,128,32,4,4,1058.0083333333332,3
w13,8,128,8,4096,1536,16,32,128,32,8,2,1057.5073333333332,3
w13,8,128,8,4096,1536,16,32,128,32,8,3,1057.2403333333334,3
w13,8,128,8,4096,1536,16,32,128,64,4,2,1055.235,3
w13,8,128,8,4096,1536,16,32,128,64,8,2,1057.2939999999999,3
w13,8,128,8,4096,1536,16,32,256,1,4,2,1050.4783333333332,3
w13,8,128,8,4096,1536,16,32,256,1,4,3,1049.2293333333334,3
w13,8,128,8,4096,1536,16,32,256,1,4,4,1050.009,3
w13,8,128,8,4096,1536,16,32,256,1,8,2,1056.931,3
w13,8,128,8,4096,1536,16,32,256,1,8,3,1049.9766666666667,3
w13,8,128,8,4096,1536,16,32,256,1,8,4,1050.9046666666666,3
w13,8,128,8,4096,1536,16,32,256,16,4,3,1058.4773333333333,3
w13,8,128,8,4096,1536,16,32,256,16,4,4,1056.2803333333334,3
w13,8,128,8,4096,1536,16,32,256,16,8,3,1057.923,3
w13,8,128,8,4096,1536,16,32,256,16,8,4,1057.8803333333333,3
w13,8,128,8,4096,1536,16,32,256,32,4,2,1058.5526666666667,3
w13,8,128,8,4096,1536,16,32,256,32,4,3,1053.71,3
w13,8,128,8,4096,1536,16,32,256,32,4,4,1053.5393333333334,3
w13,8,128,8,4096,1536,16,32,256,32,8,2,1058.019,3
w13,8,128,8,4096,1536,16,32,256,32,8,3,1053.6566666666665,3
w13,8,128,8,4096,1536,16,32,256,32,8,4,1054.947,3
w13,8,128,8,4096,1536,16,32,256,64,4,4,1057.6993333333332,3
w13,8,128,8,4096,1536,16,32,256,64,8,4,1057.1336666666666,3
w13,8,128,8,4096,1536,16,64,64,1,4,2,1053.6456666666666,3
w13,8,128,8,4096,1536,16,64,64,1,4,4,1048.5896666666667,3
w13,8,128,8,4096,1536,16,64,64,1,8,2,1051.4806666666666,3
w13,8,128,8,4096,1536,16,64,64,1,8,3,1051.9713333333332,3
w13,8,128,8,4096,1536,16,64,64,1,8,4,1049.07,3
w13,8,128,8,4096,1536,16,64,64,16,4,2,1055.4166666666667,3
w13,8,128,8,4096,1536,16,64,128,1,4,3,1051.7683333333334,3
w13,8,128,8,4096,1536,16,64,128,1,4,4,1049.55,3
w13,8,128,8,4096,1536,16,64,128,1,8,3,1052.451,3
w13,8,128,8,4096,1536,16,64,128,1,8,4,1049.4966666666667,3
w13,8,128,8,4096,1536,16,64,256,1,4,2,1052.6213333333333,3
w13,8,128,8,4096,1536,16,64,256,1,4,3,1051.3843333333334,3
w13,8,128,8,4096,1536,16,64,256,1,8,2,1054.8406666666667,3
w13,8,128,8,4096,1536,16,64,256,1,8,3,1051.1823333333334,3
w13,8,128,8,4096,1536,16,128,64,1,4,2,1050.403,3
w13,8,128,8,4096,1536,16,128,64,1,8,2,1050.5313333333334,3
w13,8,128,8,4096,1536,16,128,64,1,8,3,1051.9283333333333,3
w13,8,128,8,4096,1536,16,128,64,16,4,2,1052.547,3
w13,8,128,8,4096,1536,16,128,64,16,4,3,1052.5469999999998,3
w13,8,128,8,4096,1536,16,128,64,16,8,2,1053.5176666666666,3
w13,8,128,8,4096,1536,16,128,64,16,8,3,1050.6803333333335,3
w13,8,128,8,4096,1536,16,128,64,32,4,2,1053.539,3
w13,8,128,8,4096,1536,16,128,64,32,4,3,1054.371,3
w13,8,128,8,4096,1536,16,128,64,32,8,2,1052.451,3
w13,8,128,8,4096,1536,16,128,64,32,8,3,1053.6136666666669,3
w13,8,128,8,4096,1536,16,128,128,16,4,2,1057.955,3
w13,8,128,8,4096,1536,16,128,128,16,8,2,1056.2696666666668,3
w13,8,128,8,4096,1536,16,128,128,32,4,2,1056.2486666666666,3
w13,8,128,8,4096,1536,16,128,128,32,8,2,1055.9496666666666,3
w13,8,128,8,4096,1536,16,128,128,64,4,2,1055.5233333333333,3
w13,8,128,8,4096,1536,16,128,128,64,8,2,1054.478,3
w13,8,128,8,4096,1536,16,256,64,1,4,3,1057.987,3
w13,8,128,8,4096,1536,16,256,64,1,8,3,1056.2593333333334,3
w13,8,128,8,4096,1536,16,256,64,16,4,3,1056.963,3
w13,8,128,8,4096,1536,16,256,64,16,8,3,1053.8056666666666,3
w13,8,128,8,4096,1536,16,256,64,32,4,3,1054.7343333333336,3
w13,8,128,8,4096,1536,16,256,64,32,8,3,1053.923,3
w13,8,128,8,4096,1536,32,16,128,4,4,3,1054.6696666666667,3
w13,8,128,8,4096,1536,32,16,128,4,4,4,1049.8056666666666,3
w13,8,128,8,4096,1536,32,16,128,4,8,2,1051.2356666666667,3
w13,8,128,8,4096,1536,32,16,128,4,8,3,1058.2966666666669,3
w13,8,128,8,4096,1536,32,16,128,4,8,4,1052.8136666666667,3
w13,8,128,8,4096,1536,32,32,64,1,4,2,1053.0586666666668,3
w13,8,128,8,4096,1536,32,32,64,1,4,3,1049.5073333333332,3
w13,8,128,8,4096,1536,32,32,64,1,4,4,1054.2003333333334,3
w13,8,128,8,4096,1536,32,32,64,1,8,2,1052.2163333333335,3
w13,8,128,8,4096,1536,32,32,64,1,8,3,1049.7096666666666,3
w13,8,128,8,4096,1536,32,32,64,32,4,3,1057.9233333333334,3
w13,8,128,8,4096,1536,32,32,128,1,4,2,1048.1736666666668,3
w13,8,128,8,4096,1536,32,32,128,1,4,3,1050.211,3
w13,8,128,8,4096,1536,32,32,128,1,4,4,1050.3816666666667,3
w13,8,128,8,4096,1536,32,32,128,1,8,2,1048.878,3
w13,8,128,8,4096,1536,32,32,128,1,8,3,1057.3576666666665,3
w13,8,128,8,4096,1536,32,32,128,1,8,4,1051.235,3
w13,8,128,8,4096,1536,32,32,128,4,4,2,1048.707,3
w13,8,128,8,4096,1536,32,32,128,4,4,3,1052.1843333333334,3
w13,8,128,8,4096,1536,32,32,128,4,4,4,1056.5363333333335,3
w13,8,128,8,4096,1536,32,32,128,4,8,2,1049.9016666666666,3
w13,8,128,8,4096,1536,32,32,128,4,8,3,1052.8883333333333,3
w13,8,128,8,4096,1536,32,32,128,4,8,4,1055.587,3
w13,8,128,8,4096,1536,32,32,128,16,4,2,1057.8166666666666,3
w13,8,128,8,4096,1536,32,32,128,64,4,2,1057.9446666666665,3
w13,8,128,8,4096,1536,32,32,256,1,4,2,1048.5686666666668,3
w13,8,128,8,4096,1536,32,32,256,1,4,3,1050.1580000000001,3
w13,8,128,8,4096,1536,32,32,256,1,4,4,1050.179,3
w13,8,128,8,4096,1536,32,32,256,1,8,2,1050.6696666666667,3
w13,8,128,8,4096,1536,32,32,256,1,8,3,1049.87,3
w13,8,128,8,4096,1536,32,32,256,1,8,4,1051.7153333333333,3
w13,8,128,8,4096,1536,32,32,256,4,4,2,1051.2563333333335,3
w13,8,128,8,4096,1536,32,32,256,4,4,3,1050.0086666666666,3
w13,8,128,8,4096,1536,32,32,256,4,4,4,1050.6163333333334,3
w13,8,128,8,4096,1536,32,32,256,4,8,2,1050.883,3
w13,8,128,8,4096,1536,32,32,256,4,8,3,1049.8909999999998,3
w13,8,128,8,4096,1536,32,32,256,4,8,4,1051.214,3
w13,8,128,8,4096,1536,32,32,256,16,4,4,1055.9496666666666,3
w13,8,128,8,4096,1536,32,32,256,32,4,3,1053.0486666666666,3
w13,8,128,8,4096,1536,32,32,256,32,4,4,1054.0510000000002,3
w13,8,128,8,4096,1536,32,32,256,32,8,2,1057.827,3
w13,8,128,8,4096,1536,32,32,256,32,8,3,1052.5473333333332,3
w13,8,128,8,4096,1536,32,32,256,32,8,4,1055.1816666666666,3
w13,8,128,8,4096,1536,32,64,64,1,4,4,1053.3363333333334,3
w13,8,128,8,4096,1536,32,64,64,1,8,2,1051.907,3
w13,8,128,8,4096,1536,32,64,64,1,8,4,1054.9256666666668,3
w13,8,128,8,4096,1536,32,64,128,1,4,3,1054.5416666666667,3
w13,8,128,8,4096,1536,32,64,128,1,4,4,1049.731,3
w13,8,128,8,4096,1536,32,64,128,1,8,3,1052.7496666666666,3
w13,8,128,8,4096,1536,32,64,128,1,8,4,1051.427,3
w13,8,128,8,4096,1536,32,64,128,4,4,3,1054.3823333333332,3
w13,8,128,8,4096,1536,32,64,128,4,4,4,1053.6243333333332,3
w13,8,128,8,4096,1536,32,64,128,4,8,3,1052.4083333333335,3
w13,8,128,8,4096,1536,32,64,128,4,8,4,1053.9123333333334,3
w13,8,128,8,4096,1536,32,64,256,1,4,2,1056.9309999999998,3
w13,8,128,8,4096,1536,32,64,256,1,4,3,1053.2083333333333,3
w13,8,128,8,4096,1536,32,64,256,1,8,3,1053.2833333333335,3
w13,8,128,8,4096,1536,32,64,256,8,4,2,1057.4856666666667,3
w13,8,128,8,4096,1536,32,64,256,8,4,3,1055.811,3
w13,8,128,8,4096,1536,32,64,256,8,8,3,1054.0296666666666,3
w13,8,128,8,4096,1536,32,128,64,1,8,2,1052.7066666666667,3
w13,8,128,8,4096,1536,32,128,64,1,8,3,1055.8856666666668,3
w13,8,128,8,4096,1536,32,128,64,16,4,3,1053.8059999999998,3
w13,8,128,8,4096,1536,32,128,64,16,8,3,1054.1043333333334,3
w13,8,128,8,4096,1536,32,128,64,32,4,3,1055.8433333333332,3
w13,8,128,8,4096,1536,32,128,64,32,8,3,1055.0643333333335,3
w13,8,128,8,4096,1536,32,128,128,32,4,2,1058.6163333333334,3
w13,8,128,8,4096,1536,32,128,128,32,8,2,1056.1416666666667,3
w13,8,128,8,4096,1536,32,128,128,64,8,2,1057.219,3
w13,8,128,8,4096,1536,32,256,64,1,8,3,1056.6966666666667,3
w13,8,128,8,4096,1536,32,256,64,16,4,3,1058.5526666666667,3
w13,8,128,8,4096,1536,32,256,64,16,8,3,1055.9710000000002,3
w13,8,128,8,4096,1536,32,256,64,32,4,3,1057.7096666666666,3
w13,8,128,8,4096,1536,32,256,64,32,8,3,1057.55,3
w13,8,128,8,4096,1536,64,16,128,1,4,2,1055.267,3
w13,8,128,8,4096,1536,64,16,128,1,4,3,1053.3576666666668,3
w13,8,128,8,4096,1536,64,16,128,1,4,4,1056.1736666666666,3
w13,8,128,8,4096,1536,64,16,128,1,8,2,1057.07,3
w13,8,128,8,4096,1536,64,16,128,1,8,3,1052.9953333333333,3
w13,8,128,8,4096,1536,64,16,128,1,8,4,1057.1976666666667,3
w13,8,128,8,4096,1536,64,32,128,1,4,3,1051.427,3
w13,8,128,8,4096,1536,64,32,128,1,4,4,1054.787,3
w13,8,128,8,4096,1536,64,32,128,1,8,3,1053.1126666666667,3
w13,8,128,8,4096,1536,64,32,128,1,8,4,1053.3573333333334,3
w13,8,128,8,4096,1536,64,32,256,1,4,2,1052.2803333333334,3
w13,8,128,8,4096,1536,64,32,256,1,4,3,1052.7816666666668,3
w13,8,128,8,4096,1536,64,32,256,1,8,2,1053.4323333333334,3
w13,8,128,8,4096,1536,64,32,256,1,8,3,1051.9073333333333,3
w13,8,128,8,4096,1536,64,64,64,1,4,3,1054.6589999999999,3
w13,8,128,8,4096,1536,64,64,64,1,8,3,1051.5443333333333,3
w13,8,128,8,4096,1536,64,64,128,1,4,2,1050.819,3
w13,8,128,8,4096,1536,64,64,128,1,4,3,1051.1283333333333,3
w13,8,128,8,4096,1536,64,64,128,1,4,4,1053.2406666666666,3
w13,8,128,8,4096,1536,64,64,128,1,8,3,1050.6486666666667,3
w13,8,128,8,4096,1536,64,64,128,1,8,4,1054.211,3
w13,8,128,8,4096,1536,64,64,128,4,4,3,1057.5603333333333,3
w13,8,128,8,4096,1536,64,64,128,4,4,4,1057.742,3
w13,8,128,8,4096,1536,64,64,128,4,8,3,1055.491,3
w13,8,128,8,4096,1536,64,64,128,8,4,3,1056.5043333333333,3
w13,8,128,8,4096,1536,64,64,128,8,8,3,1057.827,3
w13,8,128,8,4096,1536,64,64,128,32,4,2,1056.323,3
w13,8,128,8,4096,1536,64,128,64,1,4,2,1053.1656666666668,3
w13,8,128,8,4096,1536,64,128,64,4,4,2,1057.2516666666668,3
w13,8,128,8,4096,1536,64,128,64,16,4,2,1055.875,3
w13,8,128,8,4096,1536,64,128,64,16,8,3,1058.4466666666667,3
w13,8,128,8,4096,1536,64,128,64,32,4,2,1057.1233333333332,3
w13,8,128,8,4096,3072,16,16,64,1,4,3,2094.863,3
w13,8,128,8,4096,3072,16,16,64,1,4,4,2098.7136666666665,3
w13,8,128,8,4096,3072,16,16,64,1,8,2,2103.460333333333,3
w13,8,128,8,4096,3072,16,16,64,1,8,3,2095.866,3
w13,8,128,8,4096,3072,16,16,64,1,8,4,2098.489666666667,3
w13,8,128,8,4096,3072,16,16,128,1,4,2,2100.1536666666666,3
w13,8,128,8,4096,3072,16,16,128,1,4,3,2098.255333333333,3
w13,8,128,8,4096,3072,16,16,128,1,4,4,2096.9643333333333,3
w13,8,128,8,4096,3072,16,16,128,1,8,2,2095.204333333333,3
w13,8,128,8,4096,3072,16,16,128,1,8,3,2104.143,3
w13,8,128,8,4096,3072,16,16,128,1,8,4,2099.4816666666666,3
w13,8,128,8,4096,3072,16,16,128,4,4,2,2098.4153333333334,3
w13,8,128,8,4096,3072,16,16,128,4,4,3,2098.735,3
w13,8,128,8,4096,3072,16,16,128,4,4,4,2096.058,3
w13,8,128,8,4096,3072,16,16,128,4,8,2,2096.303,3
w13,8,128,8,4096,3072,16,16,128,4,8,3,2104.794,3
w13,8,128,8,4096,3072,16,16,128,4,8,4,2099.7803333333336,3
w13,8,128,8,4096,3072,16,16,256,1,4,2,2098.521666666667,3
w13,8,128,8,4096,3072,16,16,256,1,4,3,2097.4976666666666,3
w13,8,128,8,4096,3072,16,16,256,1,4,4,2096.0043333333333,3
w13,8,128,8,4096,3072,16,16,256,1,8,2,2100.2926666666667,3
w13,8,128,8,4096,3072,16,16,256,1,8,3,2097.178,3
w13,8,128,8,4096,3072,16,16,256,1,8,4,2098.778,3
w13,8,128,8,4096,3072,16,16,256,4,4,2,2097.711,3
w13,8,128,8,4096,3072,16,16,256,4,4,3,2095.3216666666667,3
w13,8,128,8,4096,3072,16,16,256,4,4,4,2096.6126666666664,3
w13,8,128,8,4096,3072,16,16,256,4,8,2,2098.7143333333333,3
w13,8,128,8,4096,3072,16,16,256,4,8,3,2096.9756666666667,3
w13,8,128,8,4096,3072,16,16,256,4,8,4,2098.3520000000003,3
w13,8,128,8,4096,3072,16,32,64,1,4,2,2098.213,3
w13,8,128,8,4096,3072,16,32,64,1,4,3,2094.789,3
w13,8,128,8,4096,3072,16,32,64,1,4,4,2101.775666666667,3
w13,8,128,8,4096,3072,16,32,64,1,8,2,2096.592,3
w13,8,128,8,4096,3072,16,32,64,1,8,3,2096.4533333333334,3
w13,8,128,8,4096,3072,16,32,64,1,8,4,2095.9303333333332,3
w13,8,128,8,4096,3072,16,32,64,16,4,2,2108.6023333333333,3
w13,8,128,8,4096,3072,16,32,64,16,4,3,2111.354333333333,3
w13,8,128,8,4096,3072,16,32,64,16,8,2,2108.6876666666667,3
w13,8,128,8,4096,3072,16,32,64,16,8,3,2112.9863333333333,3
w13,8,128,8,4096,3072,16,32,64,16,8,4,2107.3970000000004,3
w13,8,128,8,4096,3072,16,32,64,32,4,3,2111.0986666666668,3
w13,8,128,8,4096,3072,16,32,64,32,4,4,2108.7093333333332,3
w13,8,128,8,4096,3072,16,32,64,32,8,4,2111.7276666666667,3
w13,8,128,8,4096,3072,16,32,128,1,4,2,2093.3173333333334,3
w13,8,128,8,4096,3072,16,32,128,1,4,3,2095.109,3
w13,8,128,8,4096,3072,16,32,128,1,4,4,2095.76,3
w13,8,128,8,4096,3072,16,32,128,1,8,2,2102.8103333333333,3
w13,8,128,8,4096,3072,16,32,128,1,8,3,2096.271666666667,3
w13,8,128,8,4096,3072,16,32,128,1,8,4,2096.997,3
w13,8,128,8,4096,3072,16,32,128,4,4,2,2094.4480000000003,3
w13,8,128,8,4096,3072,16,32,128,4,4,3,2095.962666666667,3
w13,8,128,8,4096,3072,16,32,128,4,4,4,2096.624,3
w13,8,128,8,4096,3072,16,32,128,4,8,2,2107.6316666666667,3
w13,8,128,8,4096,3072,16,32,128,4,8,3,2097.5513333333333,3
w13,8,128,8,4096,3072,16,32,128,4,8,4,2096.634666666667,3
w13,8,128,8,4096,3072,16,32,128,16,4,2,2104.3253333333337,3
w13,8,128,8,4096,3072,16,32,128,16,4,3,2101.637,3
w13,8,128,8,4096,3072,16,32,128,16,4,4,2100.0266666666666,3
w13,8,128,8,4096,3072,16,32,128,16,8,3,2103.7276666666667,3
w13,8,128,8,4096,3072,16,32,128,16,8,4,2101.1786666666667,3
w13,8,128,8,4096,3072,16,32,128,32,4,2,2112.8053333333332,3
w13,8,128,8,4096,3072,16,32,128,32,4,3,2103.632,3
w13,8,128,8,4096,3072,16,32,128,32,8,2,2110.0423333333333,3
w13,8,128,8,4096,3072,16,32,128,32,8,3,2106.0533333333333,3
w13,8,128,8,4096,3072,16,32,256,1,4,2,2094.2343333333333,3
w13,8,128,8,4096,3072,16,32,256,1,4,3,2097.6266666666666,3
w13,8,128,8,4096,3072,16,32,256,1,4,4,2095.6743333333334,3
w13,8,128,8,4096,3072,16,32,256,1,8,2,2101.9783333333335,3
w13,8,128,8,4096,3072,16,32,256,1,8,3,2097.967666666667,3
w13,8,128,8,4096,3072,16,32,256,1,8,4,2097.5626666666667,3
w13,8,128,8,4096,3072,16,32,256,16,4,2,2103.237333333333,3
w13,8,128,8,4096,3072,16,32,256,16,4,3,2104.2400000000002,3
w13,8,128,8,4096,3072,16,32,256,16,4,4,2108.592,3
w13,8,128,8,4096,3072,16,32,256,16,8,2,2104.8586666666665,3
w13,8,128,8,4096,3072,16,32,256,16,8,3,2102.2236666666668,3
w13,8,128,8,4096,3072,16,32,256,16,8,4,2111.578666666667,3
w13,8,128,8,4096,3072,16,32,256,32,4,2,2106.543666666667,3
w13,8,128,8,4096,3072,16,32,256,32,4,3,2111.994666666667,3
w13,8,128,8,4096,3072,16,32,256,32,8,2,2108.463333333333,3
w13,8,128,8,4096,3072,16,32,256,64,4,4,2111.887666666667,3
w13,8,128,8,4096,3072,16,32,256,64,8,4,2111.77,3
w13,8,128,8,4096,3072,16,64,64,1,4,3,2097.9463333333333,3
w13,8,128,8,4096,3072,16,64,64,1,4,4,2095.418333333333,3
w13,8,128,8,4096,3072,16,64,64,1,8,2,2097.1676666666667,3
w13,8,128,8,4096,3072,16,64,64,1,8,4,2096.9223333333334,3
w13,8,128,8,4096,3072,16,64,64,16,4,2,2112.5706666666665,3
w13,8,128,8,4096,3072,16,64,64,16,8,2,2111.28,3
w13,8,128,8,4096,3072,16,64,64,32,4,2,2108.282333333333,3
w13,8,128,8,4096,3072,16,64,128,1,4,2,2100.0480000000002,3
w13,8,128,8,4096,3072,16,64,128,1,4,3,2098.757,3
w13,8,128,8,4096,3072,16,64,128,1,4,4,2095.663666666667,3
w13,8,128,8,4096,3072,16,64,128,1,8,2,2099.546333333333,3
w13,8,128,8,4096,3072,16,64,128,1,8,3,2097.626333333333,3
w13,8,128,8,4096,3072,16,64,128,1,8,4,2096.293,3
w13,8,128,8,4096,3072,16,64,128,16,4,2,2113.5516666666667,3
w13,8,128,8,4096,3072,16,64,128,16,4,4,2111.2693333333336,3
w13,8,128,8,4096,3072,16,64,128,16,8,2,2113.7653333333333,3
w13,8,128,8,4096,3072,16,64,128,16,8,4,2110.1276666666668,3
w13,8,128,8,4096,3072,16,64,256,1,4,2,2098.341,3
w13,8,128,8,4096,3072,16,64,256,1,4,3,2097.253,3
w13,8,128,8,4096,3072,16,64,256,1,8,2,2105.68,3
w13,8,128,8,4096,3072,16,64,256,1,8,3,2097.242333333333,3
w13,8,128,8,4096,3072,16,64,256,16,4,3,2110.96,3
w13,8,128,8,4096,3072,16,64,256,16,8,3,2109.445,3
w13,8,128,8,4096,3072,16,128,64,1,4,2,2095.802333333333,3
w13,8,128,8,4096,3072,16,128,64,1,4,3,2107.855666666667,3
w13,8,128,8,4096,3072,16,128,64,1,4,4,2102.757,3
w13,8,128,8,4096,3072,16,128,64,1,8,2,2096.9223333333334,3
w13,8,128,8,4096,3072,16,128,64,1,8,3,2112.666333333333,3
w13,8,128,8,4096,3072,16,128,64,1,8,4,2103.1730000000002,3
w13,8,128,8,4096,3072,16,128,64,16,4,2,2098.1703333333335,3
w13,8,128,8,4096,3072,16,128,64,16,4,3,2109.701333333333,3
w13,8,128,8,4096,3072,16,128,64,16,4,4,2105.552,3
w13,8,128,8,4096,3072,16,128,64,16,8,2,2099.013,3
w13,8,128,8,4096,3072,16,128,64,16,8,3,2108.111666666666,3
w13,8,128,8,4096,3072,16,128,64,16,8,4,2105.1356666666666,3
w13,8,128,8,4096,3072,16,128,64,32,4,2,2102.4686666666666,3
w13,8,128,8,4096,3072,16,128,64,32,4,3,2112.3036666666667,3
w13,8,128,8,4096,3072,16,128,64,32,4,4,2104.9756666666667,3
w13,8,128,8,4096,3072,16,128,64,32,8,2,2101.765,3
w13,8,128,8,4096,3072,16,128,64,32,8,3,2110.0,3
w13,8,128,8,4096,3072,16,128,64,32,8,4,2103.226666666667,3
w13,8,128,8,4096,3072,16,128,64,64,4,4,2106.4693333333335,3
w13,8,128,8,4096,3072,16,128,64,64,8,4,2106.981,3
w13,8,128,8,4096,3072,16,128,128,1,4,2,2111.1943333333334,3
w13,8,128,8,4096,3072,16,128,128,1,4,3,2104.282333333333,3
w13,8,128,8,4096,3072,16,128,128,1,8,2,2110.6293333333338,3
w13,8,128,8,4096,3072,16,128,128,1,8,3,2103.504,3
w13,8,128,8,4096,3072,16,128,128,16,4,3,2105.157,3
w13,8,128,8,4096,3072,16,128,128,16,8,3,2104.645,3
w13,8,128,8,4096,3072,16,128,128,32,4,3,2104.56,3
w13,8,128,8,4096,3072,16,128,128,32,8,3,2105.1893333333333,3
w13,8,128,8,4096,3072,16,128,128,64,4,3,2105.8396666666667,3
w13,8,128,8,4096,3072,16,128,128,64,8,3,2106.469,3
w13,8,128,8,4096,3072,16,256,64,1,8,2,2099.748666666667,3
w13,8,128,8,4096,3072,16,256,64,16,4,2,2102.9493333333335,3
w13,8,128,8,4096,3072,16,256,64,16,8,2,2100.1653333333334,3
w13,8,128,8,4096,3072,16,256,64,32,4,2,2114.3946666666666,3
w13,8,128,8,4096,3072,16,256,64,32,8,2,2111.365333333333,3
w13,8,128,8,4096,3072,32,16,128,4,4,2,2106.9066666666663,3
w13,8,128,8,4096,3072,32,16,128,4,4,3,2095.1200000000003,3
w13,8,128,8,4096,3072,32,16,128,4,4,4,2097.690666666667,3
w13,8,128,8,4096,3072,32,16,128,4,8,2,2095.8986666666665,3
w13,8,128,8,4096,3072,32,16,128,4,8,3,2097.3276666666666,3
w13,8,128,8,4096,3072,32,16,128,4,8,4,2099.248,3
w13,8,128,8,4096,3072,32,32,64,1,4,2,2097.5513333333333,3
w13,8,128,8,4096,3072,32,32,64,1,4,3,2100.7090000000003,3
w13,8,128,8,4096,3072,32,32,64,1,4,4,2096.517333333333,3
w13,8,128,8,4096,3072,32,32,64,1,8,2,2095.1730000000002,3
w13,8,128,8,4096,3072,32,32,64,1,8,3,2106.703666666667,3
w13,8,128,8,4096,3072,32,32,64,1,8,4,2095.866666666667,3
w13,8,128,8,4096,3072,32,32,64,32,4,3,2104.4743333333336,3
w13,8,128,8,4096,3072,32,32,64,32,8,3,2103.642333333333,3
w13,8,128,8,4096,3072,32,32,128,1,4,2,2099.8023333333335,3
w13,8,128,8,4096,3072,32,32,128,1,4,3,2095.333,3
w13,8,128,8,4096,3072,32,32,128,1,4,4,2095.5679999999998,3
w13,8,128,8,4096,3072,32,32,128,1,8,2,2111.5570000000002,3
w13,8,128,8,4096,3072,32,32,128,1,8,3,2096.282333333333,3
w13,8,128,8,4096,3072,32,32,128,1,8,4,2096.6986666666667,3
w13,8,128,8,4096,3072,32,32,128,4,4,2,2100.346,3
w13,8,128,8,4096,3072,32,32,128,4,4,3,2095.525333333333,3
w13,8,128,8,4096,3072,32,32,128,4,4,4,2096.9863333333337,3
w13,8,128,8,4096,3072,32,32,128,4,8,2,2109.530666666667,3
w13,8,128,8,4096,3072,32,32,128,4,8,3,2096.293,3
w13,8,128,8,4096,3072,32,32,128,4,8,4,2097.6053333333334,3
w13,8,128,8,4096,3072,32,32,128,16,4,3,2105.936,3
w13,8,128,8,4096,3072,32,32,128,16,4,4,2100.005,3
w13,8,128,8,4096,3072,32,32,128,16,8,3,2104.976,3
w13,8,128,8,4096,3072,32,32,128,16,8,4,2101.2746666666667,3
w13,8,128,8,4096,3072,32,32,128,64,4,2,2112.8153333333335,3
w13,8,128,8,4096,3072,32,32,256,1,4,2,2095.6316666666667,3
w13,8,128,8,4096,3072,32,32,256,1,4,3,2095.7916666666665,3
w13,8,128,8,4096,3072,32,32,256,1,4,4,2095.652666666667,3
w13,8,128,8,4096,3072,32,32,256,1,8,2,2095.119666666667,3
w13,8,128,8,4096,3072,32,32,256,1,8,3,2098.2450000000003,3
w13,8,128,8,4096,3072,32,32,256,1,8,4,2096.3783333333336,3
w13,8,128,8,4096,3072,32,32,256,4,4,2,2095.3333333333335,3
w13,8,128,8,4096,3072,32,32,256,4,4,3,2095.6743333333334,3
w13,8,128,8,4096,3072,32,32,256,4,4,4,2095.5893333333333,3
w13,8,128,8,4096,3072,32,32,256,4,8,2,2096.9436666666666,3
w13,8,128,8,4096,3072,32,32,256,4,8,3,2095.610666666667,3
w13,8,128,8,4096,3072,32,32,256,4,8,4,2096.1543333333334,3
w13,8,128,8,4096,3072,32,32,256,16,4,2,2104.848,3
w13,8,128,8,4096,3072,32,32,256,16,4,3,2105.9143333333336,3
w13,8,128,8,4096,3072,32,32,256,16,4,4,2107.9943333333335,3
w13,8,128,8,4096,3072,32,32,256,16,8,2,2101.6476666666667,3
w13,8,128,8,4096,3072,32,32,256,16,8,3,2101.3813333333333,3
w13,8,128,8,4096,3072,32,32,256,16,8,4,2112.623666666667,3
w13,8,128,8,4096,3072,32,64,64,1,4,2,2107.3973333333333,3
w13,8,128,8,4096,3072,32,64,64,1,4,3,2100.474333333333,3
w13,8,128,8,4096,3072,32,64,64,1,4,4,2095.973,3
w13,8,128,8,4096,3072,32,64,64,1,8,2,2098.970333333333,3
w13,8,128,8,4096,3072,32,64,64,1,8,3,2103.088,3
w13,8,128,8,4096,3072,32,64,64,1,8,4,2096.5916666666667,3
w13,8,128,8,4096,3072,32,64,128,1,4,2,2099.0983333333334,3
w13,8,128,8,4096,3072,32,64,128,1,4,3,2097.637,3
w13,8,128,8,4096,3072,32,64,128,1,4,4,2096.123,3
w13,8,128,8,4096,3072,32,64,128,1,8,2,2101.541333333333,3
w13,8,128,8,4096,3072,32,64,128,1,8,3,2097.818333333333,3
w13,8,128,8,4096,3072,32,64,128,1,8,4,2097.3703333333333,3
w13,8,128,8,4096,3072,32,64,128,4,4,2,2099.471666666667,3
w13,8,128,8,4096,3072,32,64,128,4,4,3,2096.933333333333,3
w13,8,128,8,4096,3072,32,64,128,4,4,4,2097.744,3
w13,8,128,8,4096,3072,32,64,128,4,8,2,2099.5356666666667,3
w13,8,128,8,4096,3072,32,64,128,4,8,3,2097.6796666666664,3
w13,8,128,8,4096,3072,32,64,128,4,8,4,2096.6126666666664,3
w13,8,128,8,4096,3072,32,64,128,16,4,4,2114.1493333333333,3
w13,8,128,8,4096,3072,32,64,128,16,8,2,2111.685,3
w13,8,128,8,4096,3072,32,64,128,16,8,4,2110.7996666666663,3
w13,8,128,8,4096,3072,32,64,256,1,4,2,2100.421333333333,3
w13,8,128,8,4096,3072,32,64,256,1,4,3,2096.6769999999997,3
w13,8,128,8,4096,3072,32,64,256,1,8,2,2097.1246666666666,3
w13,8,128,8,4096,3072,32,64,256,1,8,3,2097.1253333333334,3
w13,8,128,8,4096,3072,32,64,256,8,4,2,2109.232,3
w13,8,128,8,4096,3072,32,64,256,8,4,3,2100.208,3
w13,8,128,8,4096,3072,32,64,256,8,8,2,2110.1703333333335,3
w13,8,128,8,4096,3072,32,64,256,8,8,3,2099.1516666666666,3
w13,8,128,8,4096,3072,32,64,256,16,4,3,2108.7729999999997,3
w13,8,128,8,4096,3072,32,64,256,16,8,2,2112.8053333333332,3
w13,8,128,8,4096,3072,32,64,256,16,8,3,2108.8579999999997,3
w13,8,128,8,4096,3072,32,128,64,1,4,3,2109.9893333333334,3
w13,8,128,8,4096,3072,32,128,64,1,4,4,2106.1066666666666,3
w13,8,128,8,4096,3072,32,128,64,1,8,2,2098.0106666666666,3
w13,8,128,8,4096,3072,32,128,64,1,8,3,2110.8316666666665,3
w13,8,128,8,4096,3072,32,128,64,1,8,4,2103.664,3
w13,8,128,8,4096,3072,32,128,64,4,4,3,2113.2636666666667,3
w13,8,128,8,4096,3072,32,128,64,4,4,4,2105.786666666667,3
w13,8,128,8,4096,3072,32,128,64,4,8,4,2104.784,3
w13,8,128,8,4096,3072,32,128,64,16,4,4,2108.431666666667,3
w13,8,128,8,4096,3072,32,128,64,16,8,3,2114.4476666666665,3
w13,8,128,8,4096,3072,32,128,64,16,8,4,2107.759666666667,3
w13,8,128,8,4096,3072,32,128,64,32,4,2,2111.1516666666666,3
w13,8,128,8,4096,3072,32,128,64,32,4,3,2112.7946666666667,3
w13,8,128,8,4096,3072,32,128,64,32,4,4,2109.1143333333334,3
w13,8,128,8,4096,3072,32,128,64,32,8,3,2111.7386666666666,3
w13,8,128,8,4096,3072,32,128,64,32,8,4,2109.4240000000004,3
w13,8,128,8,4096,3072,32,128,64,64,4,4,2110.181,3
w13,8,128,8,4096,3072,32,128,64,64,8,4,2110.244666666667,3
w13,8,128,8,4096,3072,32,128,128,1,4,3,2106.9813333333336,3
w13,8,128,8,4096,3072,32,128,128,1,8,2,2112.464,3
w13,8,128,8,4096,3072,32,128,128,1,8,3,2106.448,3
w13,8,128,8,4096,3072,32,128,128,4,4,3,2106.5543333333335,3
w13,8,128,8,4096,3072,32,128,128,4,8,2,2113.9680000000003,3
w13,8,128,8,4096,3072,32,128,128,4,8,3,2105.786666666667,3
w13,8,128,8,4096,3072,32,128,128,8,4,3,2106.32,3
w13,8,128,8,4096,3072,32,128,128,8,8,3,2106.5756666666666,3
w13,8,128,8,4096,3072,32,128,128,16,4,3,2108.4106666666667,3
w13,8,128,8,4096,3072,32,128,128,16,8,3,2107.6209999999996,3
w13,8,128,8,4096,3072,32,128,128,32,4,3,2108.421333333333,3
w13,8,128,8,4096,3072,32,128,128,32,8,3,2107.237,3
w13,8,128,8,4096,3072,32,128,128,64,4,3,2109.967666666667,3
w13,8,128,8,4096,3072,32,128,128,64,8,3,2108.2826666666665,3
w13,8,128,8,4096,3072,32,256,64,16,4,2,2105.3813333333333,3
w13,8,128,8,4096,3072,32,256,64,16,8,2,2108.954333333333,3
w13,8,128,8,4096,3072,32,256,64,32,4,2,2114.394333333333,3
w13,8,128,8,4096,3072,32,256,64,32,8,2,2109.1356666666666,3
w13,8,128,8,4096,3072,64,16,128,1,4,2,2096.0796666666665,3
w13,8,128,8,4096,3072,64,16,128,1,4,3,2100.2606666666666,3
w13,8,128,8,4096,3072,64,16,128,1,4,4,2101.7116666666666,3
w13,8,128,8,4096,3072,64,16,128,1,8,2,2098.917,3
w13,8,128,8,4096,3072,64,16,128,1,8,3,2101.136,3
w13,8,128,8,4096,3072,64,16,128,1,8,4,2101.210333333333,3
w13,8,128,8,4096,3072,64,32,128,1,4,2,2098.8746666666666,3
w13,8,128,8,4096,3072,64,32,128,1,4,3,2096.9436666666666,3
w13,8,128,8,4096,3072,64,32,128,1,4,4,2100.869,3
w13,8,128,8,4096,3072,64,32,128,1,8,2,2100.9223333333334,3
w13,8,128,8,4096,3072,64,32,128,1,8,3,2098.021,3
w13,8,128,8,4096,3072,64,32,128,1,8,4,2100.239666666667,3
w13,8,128,8,4096,3072,64,32,128,16,4,3,2108.453,3
w13,8,128,8,4096,3072,64,32,128,16,4,4,2105.157333333333,3
w13,8,128,8,4096,3072,64,32,128,16,8,3,2107.5996666666665,3
w13,8,128,8,4096,3072,64,32,128,16,8,4,2104.4636666666665,3
w13,8,128,8,4096,3072,64,32,256,1,4,2,2097.3489999999997,3
w13,8,128,8,4096,3072,64,32,256,1,4,3,2098.607666666667,3
w13,8,128,8,4096,3072,64,32,256,1,8,2,2097.104,3
w13,8,128,8,4096,3072,64,32,256,1,8,3,2097.9036666666666,3
w13,8,128,8,4096,3072,64,64,64,1,4,3,2097.2636666666667,3
w13,8,128,8,4096,3072,64,64,64,1,4,4,2104.8263333333334,3
w13,8,128,8,4096,3072,64,64,64,1,8,3,2099.6956666666665,3
w13,8,128,8,4096,3072,64,64,64,1,8,4,2105.8076666666666,3
w13,8,128,8,4096,3072,64,64,64,4,4,4,2106.4266666666667,3
w13,8,128,8,4096,3072,64,64,64,4,8,3,2113.413,3
w13,8,128,8,4096,3072,64,64,64,4,8,4,2110.202333333333,3
w13,8,128,8,4096,3072,64,64,128,1,4,2,2096.4106666666667,3
w13,8,128,8,4096,3072,64,64,128,1,4,3,2097.029,3
w13,8,128,8,4096,3072,64,64,128,1,4,4,2097.4553333333333,3
w13,8,128,8,4096,3072,64,64,128,1,8,2,2098.16,3
w13,8,128,8,4096,3072,64,64,128,1,8,3,2096.6876666666667,3
w13,8,128,8,4096,3072,64,64,128,1,8,4,2097.6583333333333,3
w13,8,128,8,4096,3072,64,64,128,4,4,2,2102.970333333333,3
w13,8,128,8,4096,3072,64,64,128,4,4,3,2096.559333333333,3
w13,8,128,8,4096,3072,64,64,128,4,4,4,2100.3036666666667,3
w13,8,128,8,4096,3072,64,64,128,4,8,2,2096.8693333333335,3
w13,8,128,8,4096,3072,64,64,128,4,8,3,2097.3063333333334,3
w13,8,128,8,4096,3072,64,64,128,4,8,4,2097.8503333333333,3
w13,8,128,8,4096,3072,64,64,128,8,4,2,2111.119666666667,3
w13,8,128,8,4096,3072,64,64,128,8,4,3,2103.0453333333335,3
w13,8,128,8,4096,3072,64,64,128,8,4,4,2101.072,3
w13,8,128,8,4096,3072,64,64,128,8,8,3,2110.351666666667,3
w13,8,128,8,4096,3072,64,64,128,8,8,4,2103.4933333333333,3
w13,8,128,8,4096,3072,64,64,128,16,4,2,2105.765,3
w13,8,128,8,4096,3072,64,64,128,16,4,4,2110.512,3
w13,8,128,8,4096,3072,64,64,128,16,8,4,2112.805,3
w13,8,128,8,4096,3072,64,64,128,32,4,2,2112.7516666666666,3
w13,8,128,8,4096,3072,64,64,128,32,8,2,2111.4293333333335,3
w13,8,128,8,4096,3072,64,128,64,1,4,2,2103.4083333333333,3
w13,8,128,8,4096,3072,64,128,64,1,4,4,2113.883333333333,3
w13,8,128,8,4096,3072,64,128,64,1,8,4,2111.1093333333333,3
w13,8,128,8,4096,3072,64,128,64,4,4,2,2108.4320000000002,3
w13,8,128,8,4096,3072,64,128,64,16,4,2,2113.5523333333335,3
w13,8,128,8,4096,3072,64,128,128,1,8,3,2108.143666666667,3
w13,8,128,8,4096,3072,64,128,128,4,8,3,2112.4646666666667,3
w13,8,128,8,4096,3072,128,32,128,1,4,2,2103.8346666666666,3
w13,8,128,8,4096,3072,128,32,128,1,4,3,2108.922666666667,3
w13,8,128,8,4096,3072,128,32,128,1,8,2,2104.112333333333,3
w13,8,128,8,4096,3072,128,32,128,1,8,3,2108.592,3
w13,8,128,8,4096,3072,128,64,64,1,4,2,2103.1733333333336,3
w13,8,128,8,4096,3072,128,64,64,1,4,3,2110.6086666666665,3
w13,8,128,8,4096,3072,128,64,64,1,4,4,2100.4966666666664,3
w13,8,128,8,4096,3072,128,64,64,1,8,2,2108.9656666666665,3
w13,8,128,8,4096,3072,128,64,64,1,8,3,2107.259,3
w13,8,128,8,4096,3072,128,64,64,1,8,4,2098.8536666666664,3
w13,8,128,8,4096,3072,128,64,64,16,4,2,2114.128666666667,3
w13,8,128,8,4096,3072,128,64,128,1,4,3,2103.5473333333334,3
w13,8,128,8,4096,3072,128,64,128,1,8,3,2098.7360000000003,3
w13,16,8,2,1024,512,16,64,64,16,4,4,5.207333333333334,3
w13,16,8,2,1024,512,16,64,64,32,4,4,5.196666666666666,3
w13,16,8,2,1024,512,16,64,64,64,4,4,5.164666666666666,3
w13,16,16,2,1536,768,16,256,32,8,4,4,14.854333333333335,3
w13,16,16,4,1536,1024,16,64,64,1,4,3,18.839333333333332,3
w13,16,16,4,1536,1024,16,64,64,1,4,4,18.754,3
w13,16,16,4,1536,1024,16,64,64,16,4,3,18.924666666666667,3
w13,16,16,4,1536,1024,16,64,64,16,4,4,18.903333333333336,3
w13,16,16,4,1536,1024,16,64,64,16,8,3,18.903333333333336,3
w13,16,16,4,1536,1024,16,64,64,32,4,3,18.754,3
w13,16,16,4,1536,1024,16,64,64,32,4,4,18.775333333333336,3
w13,16,16,4,1536,1024,16,64,64,32,8,4,18.871333333333336,3
w13,16,16,4,1536,1024,16,64,64,64,4,3,18.86066666666667,3
w13,16,16,4,1536,1024,16,64,64,64,4,4,18.743333333333336,3
w13,16,16,4,1536,1024,16,64,64,64,8,3,18.892666666666667,3
w13,16,16,4,1536,1024,16,64,64,64,8,4,18.818,3
w13,16,16,4,1536,1024,16,128,32,1,4,4,18.892666666666667,3
w13,16,32,4,2048,768,16,32,64,1,4,2,118.03933333333333,3
w13,16,32,4,2048,768,32,32,64,1,4,2,118.66866666666665,3
w13,16,32,6,3072,1024,16,32,256,1,4,2,262.253,3
w13,16,32,6,3072,1024,16,64,256,1,4,2,262.978,3
w13,16,32,6,3072,1024,32,32,256,1,4,2,262.1356666666666,3
w13,16,32,6,3072,1024,32,64,128,1,4,2,264.72766666666666,3
w13,16,32,6,3072,1024,32,64,256,1,4,2,263.25533333333334,3
w13,16,60,4,2048,1408,16,16,64,1,4,4,454.03999999999996,3
w13,16,60,4,2048,1408,16,16,64,1,8,4,454.23199999999997,3
w13,16,60,4,2048,1408,16,16,128,1,4,2,453.1123333333333,3
w13,16,60,4,2048,1408,16,16,128,1,4,3,454.16833333333335,3
w13,16,60,4,2048,1408,16,16,128,1,4,4,454.31766666666664,3
w13,16,60,4,2048,1408,16,16,128,4,4,2,453.112,3
w13,16,60,4,2048,1408,16,16,128,4,4,3,454.008,3
w13,16,60,4,2048,1408,16,16,128,4,4,4,453.731,3
w13,16,60,4,2048,1408,16,16,256,1,4,2,454.6476666666667,3
w13,16,60,4,2048,1408,16,16,256,1,4,3,453.539,3
w13,16,60,4,2048,1408,16,16,256,1,4,4,453.48533333333336,3
w13,16,60,4,2048,1408,16,16,256,1,8,3,455.00033333333334,3
w13,16,60,4,2048,1408,16,16,256,1,8,4,454.94699999999995,3
w13,16,60,4,2048,1408,16,16,256,4,4,2,454.4023333333334,3
w13,16,60,4,2048,1408,16,16,256,4,4,3,453.7626666666667,3
w13,16,60,4,2048,1408,16,16,256,4,4,4,453.87966666666665,3
w13,16,60,4,2048,1408,16,16,256,4,8,3,454.616,3
w13,16,60,4,2048,1408,16,16,256,4,8,4,454.7123333333334,3
w13,16,60,4,2048,1408,16,32,64,1,4,4,453.63433333333336,3
w13,16,60,4,2048,1408,16,32,64,1,8,2,454.96733333333333,3
w13,16,60,4,2048,1408,16,32,64,1,8,3,454.9783333333333,3
w13,16,60,4,2048,1408,16,32,64,1,8,4,454.47700000000003,3
w13,16,60,4,2048,1408,16,32,64,16,4,4,454.7546666666667,3
w13,16,60,4,2048,1408,16,32,64,16,8,3,454.48766666666666,3
w13,16,60,4,2048,1408,16,32,64,32,8,3,454.4026666666667,3
w13,16,60,4,2048,1408,16,32,128,1,4,2,454.21066666666667,3
w13,16,60,4,2048,1408,16,32,128,1,4,3,453.67699999999996,3
w13,16,60,4,2048,1408,16,32,128,1,4,4,454.05,3
w13,16,60,4,2048,1408,16,32,128,1,8,2,453.18699999999995,3
w13,16,60,4,2048,1408,16,32,128,1,8,3,454.28566666666666,3
w13,16,60,4,2048,1408,16,32,128,1,8,4,453.88033333333334,3
w13,16,60,4,2048,1408,16,32,128,4,4,3,453.78399999999993,3
w13,16,60,4,2048,1408,16,32,128,4,4,4,453.8476666666666,3
w13,16,60,4,2048,1408,16,32,128,4,8,2,453.50600000000003,3
w13,16,60,4,2048,1408,16,32,128,4,8,3,454.6586666666667,3
w13,16,60,4,2048,1408,16,32,128,4,8,4,454.7226666666666,3
w13,16,60,4,2048,1408,16,32,128,16,4,3,453.7416666666666,3
w13,16,60,4,2048,1408,16,32,128,16,4,4,453.464,3
w13,16,60,4,2048,1408,16,32,128,16,8,2,453.432,3
w13,16,60,4,2048,1408,16,32,128,16,8,3,454.16766666666666,3
w13,16,60,4,2048,1408,16,32,128,16,8,4,454.23199999999997,3
w13,16,60,4,2048,1408,16,32,128,32,4,3,454.16833333333335,3
w13,16,60,4,2048,1408,16,32,128,32,4,4,454.627,3
w13,16,60,4,2048,1408,16,32,128,32,8,2,453.763,3
w13,16,60,4,2048,1408,16,32,128,32,8,3,454.80766666666665,3
w13,16,60,4,2048,1408,16,32,128,32,8,4,454.82933333333335,3
w13,16,60,4,2048,1408,16,32,128,64,4,3,454.14633333333336,3
w13,16,60,4,2048,1408,16,32,128,64,4,4,454.66966666666667,3
w13,16,60,4,2048,1408,16,32,128,64,8,2,454.979,3
w13,16,60,4,2048,1408,16,32,128,64,8,3,454.691,3
w13,16,60,4,2048,1408,16,32,256,1,4,2,451.88533333333334,3
w13,16,60,4,2048,1408,16,32,256,1,4,3,453.98633333333333,3
w13,16,60,4,2048,1408,16,32,256,1,4,4,453.53833333333336,3
w13,16,60,4,2048,1408,16,32,256,1,8,2,454.8933333333334,3
w13,16,60,4,2048,1408,16,32,256,1,8,3,454.115,3
w13,16,60,4,2048,1408,16,32,256,1,8,4,454.06166666666667,3
w13,16,60,4,2048,1408,16,32,256,16,4,2,453.93333333333334,3
w13,16,60,4,2048,1408,16,32,256,16,4,3,454.23199999999997,3
w13,16,60,4,2048,1408,16,32,256,16,4,4,454.5623333333333,3
w13,16,60,4,2048,1408,16,32,256,16,8,2,454.4026666666667,3
w13,16,60,4,2048,1408,16,32,256,16,8,3,454.6266666666667,3
w13,16,60,4,2048,1408,16,32,256,16,8,4,454.49899999999997,3
w13,16,60,4,2048,1408,16,32,256,32,4,2,454.4243333333334,3
w13,16,60,4,2048,1408,16,32,256,32,4,3,454.2746666666667,3
w13,16,60,4,2048,1408,16,32,256,32,4,4,454.66900000000004,3
w13,16,60,4,2048,1408,16,32,256,32,8,2,454.5946666666667,3
w13,16,60,4,2048,1408,16,32,256,32,8,4,454.63733333333334,3
w13,16,60,4,2048,1408,16,32,256,64,4,2,454.75500000000005,3
w13,16,60,4,2048,1408,16,32,256,64,8,2,454.8826666666667,3
w13,16,60,4,2048,1408,16,64,64,1,4,2,454.9363333333333,3
w13,16,60,4,2048,1408,16,64,64,1,4,3,454.285,3
w13,16,60,4,2048,1408,16,64,64,1,4,4,454.32766666666663,3
w13,16,60,4,2048,1408,16,64,64,1,8,3,453.4213333333333,3
w13,16,60,4,2048,1408,16,64,64,1,8,4,453.28266666666667,3
w13,16,60,4,2048,1408,16,64,128,1,4,2,450.45633333333336,3
w13,16,60,4,2048,1408,16,64,128,1,4,3,453.9123333333334,3
w13,16,60,4,2048,1408,16,64,128,1,4,4,453.9973333333333,3
w13,16,60,4,2048,1408,16,64,128,1,8,2,452.72766666666666,3
w13,16,60,4,2048,1408,16,64,128,1,8,3,453.6453333333333,3
w13,16,60,4,2048,1408,16,64,128,1,8,4,453.965,3
w13,16,60,4,2048,1408,16,64,128,16,4,2,453.1863333333333,3
w13,16,60,4,2048,1408,16,64,128,16,4,3,453.96566666666666,3
w13,16,60,4,2048,1408,16,64,128,16,4,4,454.019,3
w13,16,60,4,2048,1408,16,64,128,16,8,2,453.507,3
w13,16,60,4,2048,1408,16,64,128,16,8,3,453.859,3
w13,16,60,4,2048,1408,16,64,128,16,8,4,454.2003333333334,3
w13,16,60,4,2048,1408,16,64,128,32,4,2,453.38933333333335,3
w13,16,60,4,2048,1408,16,64,128,32,4,3,454.70133333333337,3
w13,16,60,4,2048,1408,16,64,128,32,4,4,454.317,3
w13,16,60,4,2048,1408,16,64,128,32,8,2,453.8053333333334,3
w13,16,60,4,2048,1408,16,64,128,32,8,3,453.827,3
w13,16,60,4,2048,1408,16,64,128,32,8,4,454.5203333333334,3
w13,16,60,4,2048,1408,16,64,128,64,4,3,454.34933333333333,3
w13,16,60,4,2048,1408,16,64,128,64,8,3,454.1676666666667,3
w13,16,60,4,2048,1408,16,64,256,1,4,2,451.5653333333333,3
w13,16,60,4,2048,1408,16,64,256,1,4,3,453.795,3
w13,16,60,4,2048,1408,16,64,256,1,8,3,453.94399999999996,3
w13,16,60,4,2048,1408,16,64,256,16,4,2,454.28566666666666,3
w13,16,60,4,2048,1408,16,64,256,16,4,3,454.3706666666667,3
w13,16,60,4,2048,1408,16,64,256,16,8,2,454.0613333333333,3
w13,16,60,4,2048,1408,16,64,256,16,8,3,454.13633333333337,3
w13,16,60,4,2048,1408,16,64,256,32,4,2,454.32766666666663,3
w13,16,60,4,2048,1408,16,64,256,32,4,3,454.7543333333333,3
w13,16,60,4,2048,1408,16,64,256,32,8,2,454.595,3
w13,16,60,4,2048,1408,16,64,256,32,8,3,454.64799999999997,3
w13,16,60,4,2048,1408,16,64,256,64,8,2,454.21066666666667,3
w13,16,60,4,2048,1408,16,64,256,64,8,3,454.8183333333333,3
w13,16,60,4,2048,1408,16,128,64,1,4,3,453.44266666666664,3
w13,16,60,4,2048,1408,16,128,64,1,4,4,454.31766666666664,3
w13,16,60,4,2048,1408,16,128,64,1,8,3,453.336,3
w13,16,60,4,2048,1408,16,128,64,1,8,4,453.40000000000003,3
w13,16,60,4,2048,1408,16,128,128,1,4,2,451.949,3
w13,16,60,4,2048,1408,16,128,128,1,4,3,454.5306666666667,3
w13,16,60,4,2048,1408,16,128,128,1,8,2,452.89866666666666,3
w13,16,60,4,2048,1408,16,128,128,1,8,3,453.44266666666664,3
w13,16,60,4,2048,1408,16,128,128,16,4,2,453.77299999999997,3
w13,16,60,4,2048,1408,16,128,128,16,4,3,454.68,3
w13,16,60,4,2048,1408,16,128,128,16,8,2,453.325,3
w13,16,60,4,2048,1408,16,128,128,16,8,3,454.6903333333333,3
w13,16,60,4,2048,1408,16,128,128,32,4,2,453.82666666666665,3
w13,16,60,4,2048,1408,16,128,128,32,4,3,454.5416666666667,3
w13,16,60,4,2048,1408,16,128,128,32,8,2,453.144,3
w13,16,60,4,2048,1408,16,128,128,32,8,3,453.965,3
w13,16,60,4,2048,1408,16,128,128,64,8,3,454.70133333333337,3
w13,16,60,4,2048,1408,32,16,128,4,4,4,454.4773333333333,3
w13,16,60,4,2048,1408,32,32,64,1,4,3,453.67766666666665,3
w13,16,60,4,2048,1408,32,32,64,1,4,4,454.6266666666667,3
w13,16,60,4,2048,1408,32,32,64,1,8,2,454.872,3
w13,16,60,4,2048,1408,32,32,64,1,8,3,453.71999999999997,3
w13,16,60,4,2048,1408,32,32,64,1,8,4,454.81866666666673,3
w13,16,60,4,2048,1408,32,32,64,32,4,3,454.38100000000003,3
w13,16,60,4,2048,1408,32,32,64,32,4,4,454.76500000000004,3
w13,16,60,4,2048,1408,32,32,64,32,8,3,454.6366666666666,3
w13,16,60,4,2048,1408,32,32,128,1,4,2,450.76533333333333,3
w13,16,60,4,2048,1408,32,32,128,1,4,3,454.157,3
w13,16,60,4,2048,1408,32,32,128,1,4,4,454.07233333333335,3
w13,16,60,4,2048,1408,32,32,128,1,8,2,454.04033333333336,3
w13,16,60,4,2048,1408,32,32,128,1,8,3,453.8906666666667,3
w13,16,60,4,2048,1408,32,32,128,4,4,2,453.1863333333333,3
w13,16,60,4,2048,1408,32,32,128,4,4,3,453.7733333333333,3
w13,16,60,4,2048,1408,32,32,128,4,4,4,454.808,3
w13,16,60,4,2048,1408,32,32,128,4,8,2,454.4983333333334,3
w13,16,60,4,2048,1408,32,32,128,4,8,3,454.5516666666667,3
w13,16,60,4,2048,1408,32,32,128,16,4,2,453.70966666666664,3
w13,16,60,4,2048,1408,32,32,128,16,4,3,454.08233333333334,3
w13,16,60,4,2048,1408,32,32,128,16,4,4,454.99966666666666,3
w13,16,60,4,2048,1408,32,32,128,16,8,2,454.16799999999995,3
w13,16,60,4,2048,1408,32,32,128,16,8,3,454.41366666666664,3
w13,16,60,4,2048,1408,32,32,128,64,4,2,454.90366666666665,3
w13,16,60,4,2048,1408,32,32,128,64,4,3,454.6693333333333,3
w13,16,60,4,2048,1408,32,32,128,64,8,3,454.8826666666667,3
w13,16,60,4,2048,1408,32,32,256,1,4,2,452.12000000000006,3
w13,16,60,4,2048,1408,32,32,256,1,4,3,453.33633333333336,3
w13,16,60,4,2048,1408,32,32,256,1,4,4,453.38933333333335,3
w13,16,60,4,2048,1408,32,32,256,1,8,3,453.77366666666666,3
w13,16,60,4,2048,1408,32,32,256,1,8,4,454.2003333333333,3
w13,16,60,4,2048,1408,32,32,256,4,4,2,453.9866666666667,3
w13,16,60,4,2048,1408,32,32,256,4,4,3,454.1573333333333,3
w13,16,60,4,2048,1408,32,32,256,4,4,4,453.9333333333334,3
w13,16,60,4,2048,1408,32,32,256,4,8,2,454.104,3
w13,16,60,4,2048,1408,32,32,256,4,8,3,454.6483333333333,3
w13,16,60,4,2048,1408,32,32,256,4,8,4,454.1463333333333,3
w13,16,60,4,2048,1408,32,32,256,16,4,2,453.94399999999996,3
w13,16,60,4,2048,1408,32,32,256,16,4,3,455.0,3
w13,16,60,4,2048,1408,32,32,256,16,4,4,454.38100000000003,3
w13,16,60,4,2048,1408,32,32,256,16,8,2,454.61566666666664,3
