pipetuning_test/moe_dse/moe_dse_A100_99.csv
weight_type,M,E,topk,H,N,BLOCK_SIZE_M,BLOCK_SIZE_N,BLOCK_SIZE_K,GROUP_SIZE_M,num_warps,num_stages,avg_duration,sample_count
w13,1,8,2,1024,512,16,32,128,1,4,3,7.383,3
w13,1,8,2,1024,512,16,32,128,16,4,3,7.394000000000001,3
w13,1,8,2,1024,512,16,64,64,64,4,3,7.330000000000001,3
w13,1,8,2,1024,512,16,64,64,64,4,4,7.361666666666667,3
w13,1,8,2,1024,512,16,64,64,64,4,5,7.372333333333334,3
w13,1,16,2,1536,768,16,32,128,1,4,3,9.580666666666668,3
w13,1,16,2,1536,768,16,32,128,4,4,3,9.57,3
w13,1,16,2,1536,768,16,32,128,16,4,3,9.612666666666668,3
w13,1,16,2,1536,768,16,32,128,32,4,3,9.57,3
w13,1,16,2,1536,768,16,32,128,64,4,3,9.569666666666667,3
w13,1,16,4,1536,1024,16,128,128,64,8,4,12.577999999999998,3
w13,1,32,4,2048,768,16,64,128,1,8,3,11.106,3
w13,1,32,4,2048,768,16,64,128,1,8,4,11.212666666666665,3
w13,1,32,6,3072,1024,16,64,64,1,4,5,46.082,3
w13,1,32,6,3072,1024,16,128,128,1,8,4,46.17766666666666,3
w13,1,32,6,3072,1024,16,128,128,32,4,3,45.782999999999994,3
w13,1,32,6,3072,1024,16,128,128,32,4,4,46.157000000000004,3
w13,1,32,6,3072,1024,16,128,128,32,4,5,46.178,3
w13,1,60,4,2048,1408,16,128,128,1,8,3,30.316999999999997,3
w13,1,60,6,3584,2304,16,64,128,32,8,3,107.95933333333333,3
w13,1,60,6,3584,2304,16,128,128,64,8,3,108.546,3
w13,1,60,8,2048,1536,16,64,256,32,4,2,60.02333333333333,3
w13,1,64,6,3072,2048,16,32,128,1,4,4,86.62633333333333,3
w13,1,64,6,3072,2048,16,64,128,1,4,4,86.541,3
w13,1,64,6,3072,2048,16,64,128,32,4,3,86.61533333333334,3
w13,1,64,6,3072,2048,16,64,128,64,4,3,86.54066666666667,3
w13,1,64,6,3072,2048,16,64,128,64,8,4,86.69033333333334,3
w13,1,64,6,3072,2048,16,128,128,1,8,3,85.901,3
w13,1,64,6,3072,2048,16,128,128,1,8,4,86.64733333333334,3
w13,1,64,6,3072,2048,16,128,128,16,8,3,86.42399999999999,3
w13,1,64,6,3072,2048,16,128,128,32,4,3,86.71166666666666,3
w13,1,64,6,3072,2048,16,128,128,64,8,3,86.06099999999999,3
w13,1,64,6,3584,1536,16,32,128,1,4,5,76.69533333333334,3
w13,1,64,6,3584,1536,16,64,128,16,4,3,76.834,3
w13,1,64,6,3584,1536,16,64,128,16,8,3,77.30333333333333,3
w13,1,64,6,3584,1536,16,64,128,32,4,3,76.62066666666666,3
w13,1,64,6,3584,1536,16,64,128,64,4,3,77.282,3
w13,1,64,8,3584,2560,16,64,128,64,8,4,161.89033333333333,3
w13,1,64,8,3584,2560,16,64,256,16,4,3,162.157,3
w13,1,64,8,3584,2560,16,128,128,1,4,2,162.05033333333333,3
w13,1,64,8,3584,2560,16,128,128,1,8,2,162.12533333333332,3
w13,1,64,8,3584,2560,16,128,128,1,8,3,161.99699999999999,3
w13,1,64,8,3584,2560,16,128,128,16,8,2,162.125,3
w13,1,64,8,3584,2560,16,128,128,16,8,4,161.1543333333333,3
w13,1,64,8,3584,2560,16,128,128,32,4,2,161.47466666666665,3
w13,1,64,8,3584,2560,16,128,128,32,8,3,161.07933333333332,3
w13,1,64,8,3584,2560,16,128,128,64,4,2,161.77333333333334,3
w13,1,64,8,3584,2560,16,128,128,64,4,4,162.19966666666667,3
w13,1,64,8,3584,2560,16,128,128,64,8,2,160.64233333333334,3
w13,1,64,8,3584,2560,16,128,128,64,8,5,161.357,3
w13,1,64,8,3584,2560,32,32,128,1,4,3,161.53833333333333,3
w13,1,64,8,3584,2560,32,32,128,4,4,3,160.65333333333334,3
w13,1,64,8,3584,2560,32,32,128,64,4,3,161.624,3
w13,1,128,4,2048,512,16,64,128,1,8,3,13.004666666666665,3
w13,1,128,4,2048,512,16,64,128,1,8,5,13.089999999999998,3
w13,1,128,6,4096,2048,16,64,128,1,4,2,109.89033333333333,3
w13,1,128,6,4096,2048,16,64,128,16,4,2,110.77533333333334,3
w13,1,128,6,4096,2048,16,128,128,1,4,2,110.41300000000001,3
w13,1,128,6,4096,2048,16,128,128,1,4,3,110.64766666666667,3
w13,1,128,6,4096,2048,16,128,128,1,8,2,109.794,3
w13,1,128,6,4096,2048,16,128,128,1,8,3,109.98633333333333,3
w13,1,128,8,2048,768,16,64,128,16,4,3,32.834,3
w13,1,128,8,2048,768,16,128,128,1,8,3,32.61000000000001,3
w13,1,128,8,4096,1536,16,64,128,1,4,2,110.74366666666667,3
w13,1,128,8,4096,1536,16,64,128,1,4,3,110.093,3
w13,1,128,8,4096,1536,16,128,128,1,8,2,110.69033333333334,3
w13,1,128,8,4096,1536,16,128,128,1,8,3,110.74333333333334,3
w13,1,128,8,4096,1536,16,128,128,32,8,3,110.733,3
w13,1,128,8,4096,1536,16,128,128,32,8,5,109.741,3
w13,1,128,8,4096,3072,16,64,128,32,4,3,220.952,3
w13,1,128,8,4096,3072,16,64,128,32,4,4,221.1976666666667,3
w13,1,128,8,4096,3072,16,64,128,64,4,3,220.82399999999998,3
w13,1,128,8,4096,3072,16,64,128,64,4,4,219.86366666666666,3
w13,1,128,8,4096,3072,16,64,256,1,4,2,221.635,3
w13,1,128,8,4096,3072,16,64,256,1,4,3,221.67666666666665,3
w13,1,128,8,4096,3072,16,64,256,16,4,3,220.13,3
w13,1,128,8,4096,3072,16,64,256,32,4,3,219.48033333333333,3
w13,1,128,8,4096,3072,16,128,128,1,4,3,219.77866666666668,3
w13,1,128,8,4096,3072,16,128,128,1,4,5,221.64499999999998,3
w13,1,128,8,4096,3072,16,128,128,1,8,3,220.94133333333335,3
w13,1,128,8,4096,3072,16,128,128,16,4,4,220.97299999999998,3
w13,1,128,8,4096,3072,16,128,128,16,4,5,220.962,3
w13,1,128,8,4096,3072,16,128,128,16,8,5,221.64533333333335,3
w13,1,128,8,4096,3072,16,128,128,32,4,5,221.58066666666664,3
w13,1,128,8,4096,3072,16,128,128,32,8,3,220.045,3
w13,1,128,8,4096,3072,16,128,128,64,4,3,221.57066666666665,3
w13,1,128,8,4096,3072,16,128,128,64,4,5,220.888,3
w13,1,128,8,4096,3072,16,128,128,64,8,4,221.46366666666668,3
w13,1,128,8,4096,3072,32,128,128,32,4,3,221.677,3
w13,1,128,8,4096,3072,32,128,128,64,4,3,221.4,3
w13,2,8,2,1024,512,16,64,128,1,8,3,8.61,3
w13,2,8,2,1024,512,16,64,128,1,8,4,8.545666666666667,3
w13,2,16,2,1536,768,16,64,128,1,8,3,9.185666666666668,3
w13,2,16,2,1536,768,16,64,128,1,8,5,9.271333333333333,3
w13,2,16,4,1536,1024,16,32,128,1,4,3,33.80466666666666,3
w13,2,16,4,1536,1024,16,32,128,4,4,2,33.48466666666667,3
w13,2,16,4,1536,1024,16,32,128,16,4,2,33.80466666666667,3
w13,2,16,4,1536,1024,16,32,128,32,4,2,33.71933333333333,3
w13,2,16,4,1536,1024,16,32,128,32,4,3,33.708666666666666,3
w13,2,16,4,1536,1024,16,32,128,64,4,2,33.80466666666666,3
w13,2,16,4,1536,1024,16,32,256,1,4,2,33.71933333333333,3
w13,2,16,4,1536,1024,16,32,256,16,4,2,33.698,3
w13,2,32,4,2048,768,16,64,128,1,4,3,31.554333333333332,3
w13,2,32,4,2048,768,16,64,128,1,8,3,31.53233333333333,3
w13,2,32,4,2048,768,16,64,128,32,8,3,31.596999999999998,3
w13,2,32,4,2048,768,16,128,128,1,8,3,31.415000000000003,3
w13,2,32,6,3072,1024,16,128,128,1,8,3,85.474,3
w13,2,60,4,2048,1408,16,32,128,32,4,2,53.954,3
w13,2,60,4,2048,1408,16,128,128,1,8,3,54.46633333333333,3
w13,2,60,4,2048,1408,16,128,128,16,8,3,54.25300000000001,3
w13,2,60,4,2048,1408,16,128,128,32,8,3,54.39166666666667,3
w13,2,60,4,2048,1408,16,128,128,64,8,3,54.39166666666667,3
w13,2,60,6,3584,2304,16,64,128,1,4,3,216.88766666666666,3
w13,2,60,6,3584,2304,16,64,128,1,4,4,217.09033333333332,3
w13,2,60,6,3584,2304,16,64,128,1,4,5,216.54633333333334,3
w13,2,60,6,3584,2304,16,64,128,1,8,5,216.674,3
w13,2,60,6,3584,2304,16,64,128,16,4,3,215.94866666666667,3
w13,2,60,6,3584,2304,16,64,128,16,4,5,215.66099999999997,3
w13,2,60,6,3584,2304,16,64,128,16,8,3,216.33266666666668,3
w13,2,60,6,3584,2304,16,64,128,32,4,5,216.8983333333333,3
w13,2,60,6,3584,2304,16,64,128,64,4,3,215.106,3
w13,2,60,6,3584,2304,16,64,128,64,8,3,217.23933333333335,3
w13,2,60,6,3584,2304,16,64,256,1,4,3,216.514,3
w13,2,60,6,3584,2304,16,64,256,16,4,3,217.25033333333332,3
w13,2,60,6,3584,2304,16,64,256,16,8,3,216.845,3
w13,2,60,6,3584,2304,16,64,256,64,4,3,217.005,3
w13,2,60,6,3584,2304,16,128,128,1,4,2,215.70366666666666,3
w13,2,60,6,3584,2304,16,128,128,1,4,3,216.6206666666667,3
w13,2,60,6,3584,2304,16,128,128,1,8,3,215.458,3
w13,2,60,6,3584,2304,16,128,128,1,8,5,216.365,3
w13,2,60,6,3584,2304,16,128,128,16,4,5,217.27133333333333,3
w13,2,60,6,3584,2304,16,128,128,16,8,3,215.83133333333333,3
w13,2,60,6,3584,2304,16,128,128,32,4,2,216.86599999999999,3
w13,2,60,6,3584,2304,16,128,128,32,4,3,216.845,3
w13,2,60,6,3584,2304,16,128,128,32,4,5,216.78066666666666,3
w13,2,60,6,3584,2304,16,128,128,64,4,3,216.99433333333332,3
w13,2,60,6,3584,2304,32,128,128,32,4,3,217.2073333333333,3
w13,2,60,8,2048,1536,16,64,128,16,4,5,111.37333333333333,3
w13,2,60,8,2048,1536,16,64,128,16,8,3,111.93833333333333,3
w13,2,60,8,2048,1536,16,64,128,32,4,3,111.57533333333333,3
w13,2,60,8,2048,1536,16,64,128,32,4,4,110.978,3
w13,2,60,8,2048,1536,16,64,128,64,8,4,110.98866666666667,3
w13,2,60,8,2048,1536,16,64,256,16,8,3,111.87400000000001,3
w13,2,60,8,2048,1536,16,64,256,16,8,4,111.58633333333334,3
w13,2,64,6,3072,2048,16,32,128,16,4,2,166.66933333333333,3
w13,2,64,6,3072,2048,16,32,128,32,4,2,167.181,3
w13,2,64,6,3072,2048,16,32,256,32,4,3,167.138,3
w13,2,64,6,3072,2048,16,32,256,64,4,3,166.68,3
w13,2,64,6,3072,2048,16,32,256,64,8,3,166.96733333333336,3
w13,2,64,6,3072,2048,16,64,128,16,4,3,167.45833333333334,3
w13,2,64,6,3072,2048,16,64,256,1,4,3,167.54399999999998,3
w13,2,64,6,3072,2048,16,64,256,16,4,2,167.341,3
w13,2,64,6,3072,2048,16,64,256,64,8,3,167.70366666666666,3
w13,2,64,6,3072,2048,16,128,128,1,4,2,166.96766666666667,3
w13,2,64,6,3072,2048,16,128,128,1,8,3,166.74366666666666,3
w13,2,64,6,3072,2048,16,128,128,64,8,3,167.39466666666667,3
w13,2,64,6,3072,2048,32,32,128,16,4,3,167.533,3
w13,2,64,6,3072,2048,32,32,128,16,8,3,167.47966666666665,3
w13,2,64,6,3072,2048,32,32,128,64,4,2,166.925,3
w13,2,64,6,3072,2048,32,32,128,64,8,3,167.48,3
w13,2,64,6,3072,2048,32,64,128,16,8,2,167.27700000000002,3
w13,2,64,6,3072,2048,32,64,128,32,8,2,167.57533333333333,3
w13,2,64,6,3072,2048,32,64,128,64,8,2,167.63966666666667,3
w13,2,64,6,3072,2048,32,128,128,16,8,2,167.22366666666667,3
w13,2,64,6,3072,2048,32,128,128,32,8,2,167.298,3
w13,2,64,6,3072,2048,32,128,128,64,8,2,166.11433333333332,3
w13,2,64,6,3584,1536,16,32,128,1,4,4,144.21566666666666,3
w13,2,64,6,3584,1536,16,32,128,16,4,5,145.12266666666667,3
w13,2,64,6,3584,1536,16,32,256,32,4,3,145.602,3
w13,2,64,6,3584,1536,16,64,128,1,4,2,145.48499999999999,3
w13,2,64,6,3584,1536,16,64,128,1,4,4,145.06866666666667,3
w13,2,64,6,3584,1536,16,64,256,64,8,2,145.18666666666667,3
w13,2,64,6,3584,1536,16,128,128,32,4,4,145.37800000000001,3
w13,2,64,6,3584,1536,16,128,128,32,8,4,145.47433333333333,3
w13,2,64,6,3584,1536,16,128,128,64,4,5,145.62366666666665,3
w13,2,64,6,3584,1536,32,32,128,1,4,3,145.14366666666666,3
w13,2,64,6,3584,1536,32,64,128,16,8,3,144.40733333333333,3
w13,2,64,8,3584,2560,16,16,256,4,4,2,320.3976666666667,3
w13,2,64,8,3584,2560,16,32,128,16,4,3,320.643,3
w13,2,64,8,3584,2560,16,32,128,64,4,3,320.12033333333335,3
w13,2,64,8,3584,2560,16,64,128,1,4,3,319.66166666666663,3
w13,2,64,8,3584,2560,16,64,128,1,8,3,318.4243333333333,3
w13,2,64,8,3584,2560,16,64,128,16,4,3,319.32,3
w13,2,64,8,3584,2560,16,64,128,16,4,5,318.3496666666667,3
w13,2,64,8,3584,2560,16,64,128,16,8,3,319.043,3
w13,2,64,8,3584,2560,16,64,128,16,8,5,320.61100000000005,3
w13,2,64,8,3584,2560,16,64,128,32,4,3,318.595,3
w13,2,64,8,3584,2560,16,64,128,32,8,3,320.5466666666666,3
w13,2,64,8,3584,2560,16,64,128,64,4,3,318.8403333333333,3
w13,2,64,8,3584,2560,16,64,256,1,4,3,319.8636666666667,3
w13,2,64,8,3584,2560,16,64,256,1,4,5,320.6426666666667,3
w13,2,64,8,3584,2560,16,64,256,1,8,3,320.6856666666667,3
w13,2,64,8,3584,2560,16,64,256,16,4,2,319.555,3
w13,2,64,8,3584,2560,16,64,256,16,4,3,317.6236666666667,3
w13,2,64,8,3584,2560,16,64,256,16,4,5,320.21599999999995,3
w13,2,64,8,3584,2560,16,64,256,16,8,3,319.5013333333333,3
w13,2,64,8,3584,2560,16,64,256,32,4,2,318.936,3
w13,2,64,8,3584,2560,16,64,256,32,4,3,318.10433333333333,3
w13,2,64,8,3584,2560,16,64,256,32,8,3,320.1413333333333,3
w13,2,64,8,3584,2560,16,64,256,64,4,2,319.82099999999997,3
w13,2,64,8,3584,2560,16,64,256,64,4,3,318.2323333333333,3
w13,2,64,8,3584,2560,16,64,256,64,4,5,320.66433333333333,3
w13,2,64,8,3584,2560,16,128,128,1,4,3,320.365,3
w13,2,64,8,3584,2560,16,128,128,1,8,3,317.96566666666666,3
w13,2,64,8,3584,2560,16,128,128,1,8,5,319.51233333333334,3
w13,2,64,8,3584,2560,16,128,128,16,4,3,318.74399999999997,3
w13,2,64,8,3584,2560,16,128,128,16,4,5,320.48266666666666,3
w13,2,64,8,3584,2560,16,128,128,16,8,3,318.0083333333333,3
w13,2,64,8,3584,2560,16,128,128,16,8,5,320.259,3
w13,2,64,8,3584,2560,16,128,128,32,4,3,318.8933333333334,3
w13,2,64,8,3584,2560,16,128,128,32,8,3,319.57633333333337,3
w13,2,64,8,3584,2560,16,128,128,32,8,5,318.8186666666667,3
w13,2,64,8,3584,2560,16,128,128,64,4,3,318.947,3
w13,2,64,8,3584,2560,16,128,128,64,4,5,319.9603333333334,3
w13,2,64,8,3584,2560,16,128,128,64,8,3,318.47766666666666,3
w13,2,64,8,3584,2560,32,128,128,1,4,3,319.07466666666664,3
w13,2,64,8,3584,2560,32,128,128,4,4,3,320.13100000000003,3
w13,2,64,8,3584,2560,32,128,128,32,4,3,319.36266666666666,3
w13,2,64,8,3584,2560,32,128,128,64,4,3,319.43766666666664,3
w13,2,128,4,2048,512,16,64,64,1,4,5,19.479666666666663,3
w13,2,128,6,4096,2048,16,32,256,32,4,3,221.933,3
w13,2,128,6,4096,2048,16,64,128,1,4,3,221.35666666666665,3
w13,2,128,6,4096,2048,16,64,128,1,4,4,221.97566666666668,3
w13,2,128,6,4096,2048,16,64,128,1,8,3,221.837,3
w13,2,128,6,4096,2048,16,64,128,16,4,3,221.85800000000003,3
w13,2,128,6,4096,2048,16,64,128,32,4,5,221.74099999999999,3
w13,2,128,6,4096,2048,16,64,128,64,4,3,221.54899999999998,3
w13,2,128,6,4096,2048,16,64,128,64,4,4,221.59166666666667,3
w13,2,128,6,4096,2048,16,64,256,1,4,3,220.664,3
w13,2,128,6,4096,2048,16,64,256,16,4,3,221.357,3
w13,2,128,6,4096,2048,16,64,256,16,4,4,221.773,3
w13,2,128,6,4096,2048,16,64,256,16,4,5,221.09033333333332,3
w13,2,128,6,4096,2048,16,64,256,32,4,4,221.82633333333334,3
w13,2,128,6,4096,2048,16,64,256,32,4,5,221.63433333333333,3
w13,2,128,6,4096,2048,16,64,256,32,8,5,220.61033333333333,3
w13,2,128,6,4096,2048,16,64,256,64,4,3,220.37533333333332,3
w13,2,128,6,4096,2048,16,64,256,64,4,5,221.112,3
w13,2,128,6,4096,2048,16,64,256,64,8,5,221.95433333333332,3
w13,2,128,6,4096,2048,16,128,128,1,8,5,219.89533333333335,3
w13,2,128,6,4096,2048,16,128,128,16,4,2,221.76200000000003,3
w13,2,128,6,4096,2048,16,128,128,16,4,5,221.624,3
w13,2,128,6,4096,2048,16,128,128,32,4,3,220.37533333333332,3
w13,2,128,6,4096,2048,16,128,128,32,8,3,221.78333333333333,3
w13,2,128,6,4096,2048,16,128,128,32,8,5,221.45333333333335,3
w13,2,128,6,4096,2048,16,128,128,64,8,4,221.25033333333332,3
w13,2,128,6,4096,2048,16,128,128,64,8,5,221.60233333333335,3
w13,2,128,6,4096,2048,32,128,128,16,4,3,221.837,3
w13,2,128,8,2048,768,16,32,128,1,4,2,58.498333333333335,3
w13,2,128,8,2048,768,16,32,128,4,4,2,58.28466666666666,3
w13,2,128,8,2048,768,16,32,128,16,4,2,58.156666666666666,3
w13,2,128,8,2048,768,16,64,128,1,4,3,58.540666666666674,3
w13,2,128,8,2048,768,16,128,128,1,8,2,58.519666666666666,3
w13,2,128,8,2048,768,16,128,128,1,8,3,57.97533333333333,3
w13,2,128,8,2048,768,16,128,128,32,8,3,58.413000000000004,3
w13,2,128,8,4096,1536,16,32,256,64,4,3,221.65600000000003,3
w13,2,128,8,4096,1536,16,64,128,16,4,3,220.952,3
w13,2,128,8,4096,1536,16,64,128,32,4,5,221.08,3
w13,2,128,8,4096,1536,16,64,128,64,4,5,220.42933333333335,3
w13,2,128,8,4096,1536,16,64,256,1,4,2,222.00766666666667,3
w13,2,128,8,4096,1536,16,64,256,1,4,3,220.23733333333334,3
w13,2,128,8,4096,1536,16,64,256,1,4,5,220.73833333333334,3
w13,2,128,8,4096,1536,16,64,256,16,4,3,221.50633333333334,3
w13,2,128,8,4096,1536,16,64,256,16,8,3,220.941,3
w13,2,128,8,4096,1536,16,64,256,16,8,5,221.73033333333333,3
w13,2,128,8,4096,1536,16,64,256,32,4,3,220.26933333333332,3
w13,2,128,8,4096,1536,16,64,256,32,4,4,222.03966666666668,3
w13,2,128,8,4096,1536,16,64,256,32,4,5,219.86366666666666,3
w13,2,128,8,4096,1536,16,64,256,32,8,5,221.61299999999997,3
w13,2,128,8,4096,1536,16,64,256,64,4,3,220.80266666666668,3
w13,2,128,8,4096,1536,16,64,256,64,8,5,221.73066666666668,3
w13,2,128,8,4096,1536,16,128,128,1,8,4,221.11166666666668,3
w13,2,128,8,4096,1536,16,128,128,1,8,5,221.95466666666667,3
w13,2,128,8,4096,1536,16,128,128,16,4,2,221.50666666666666,3
w13,2,128,8,4096,1536,16,128,128,16,4,3,221.32533333333333,3
w13,2,128,8,4096,1536,16,128,128,16,4,4,221.45333333333335,3
w13,2,128,8,4096,1536,16,128,128,16,4,5,220.3116666666667,3
w13,2,128,8,4096,1536,16,128,128,16,8,3,221.58133333333333,3
w13,2,128,8,4096,1536,16,128,128,16,8,4,221.98633333333336,3
w13,2,128,8,4096,1536,16,128,128,32,8,3,221.66666666666666,3
w13,2,128,8,4096,1536,16,128,128,32,8,4,221.965,3
w13,2,128,8,4096,1536,16,128,128,32,8,5,220.792,3
w13,2,128,8,4096,1536,16,128,128,64,8,5,221.55966666666666,3
w13,2,128,8,4096,3072,16,64,256,1,4,2,433.4113333333333,3
w13,2,128,8,4096,3072,16,64,256,1,4,3,432.878,3
w13,2,128,8,4096,3072,16,64,256,16,4,2,432.878,3
w13,2,128,8,4096,3072,16,64,256,16,4,3,430.90433333333334,3
w13,2,128,8,4096,3072,16,64,256,16,4,5,432.3443333333333,3
w13,2,128,8,4096,3072,16,64,256,16,8,3,432.46233333333333,3
w13,2,128,8,4096,3072,16,64,256,16,8,5,433.95533333333333,3
w13,2,128,8,4096,3072,16,64,256,32,4,2,431.40633333333335,3
w13,2,128,8,4096,3072,16,64,256,32,4,3,431.0323333333333,3
w13,2,128,8,4096,3072,16,64,256,32,4,5,432.70700000000005,3
w13,2,128,8,4096,3072,16,64,256,32,8,5,430.64866666666666,3
w13,2,128,8,4096,3072,16,64,256,64,4,2,430.0296666666666,3
w13,2,128,8,4096,3072,16,64,256,64,4,3,432.42966666666666,3
w13,2,128,8,4096,3072,16,64,256,64,4,5,431.57633333333337,3
w13,2,128,8,4096,3072,16,128,128,16,8,3,433.39000000000004,3
w13,2,128,8,4096,3072,16,128,128,64,4,5,433.923,3
w13,4,8,2,1024,512,16,128,64,1,4,4,10.732666666666667,3
w13,4,8,2,1024,512,16,128,64,1,4,5,10.796333333333331,3
w13,4,16,2,1536,768,16,32,256,16,4,2,23.992,3
w13,4,16,2,1536,768,16,32,256,64,4,2,24.131333333333334,3
w13,4,16,2,1536,768,16,64,128,16,8,3,24.206,3
w13,4,16,4,1536,1024,32,64,128,4,4,2,59.50066666666667,3
w13,4,32,4,2048,768,16,32,128,4,4,2,58.60466666666667,3
w13,4,32,4,2048,768,16,32,128,16,4,2,58.434,3
w13,4,32,4,2048,768,16,32,128,64,4,2,58.274,3
w13,4,32,4,2048,768,16,64,128,1,4,2,58.85033333333333,3
w13,4,32,4,2048,768,16,64,128,16,4,3,58.786,3
w13,4,32,4,2048,768,16,64,128,64,4,3,58.81766666666667,3
w13,4,32,4,2048,768,16,128,128,1,8,3,58.34866666666667,3
w13,4,32,4,2048,768,16,128,128,16,8,3,58.77533333333333,3
w13,4,32,6,3072,1024,16,128,128,1,8,4,164.55700000000002,3
w13,4,32,6,3072,1024,16,128,128,16,4,2,166.06066666666666,3
w13,4,32,6,3072,1024,16,128,128,16,4,3,165.741,3
w13,4,32,6,3072,1024,32,32,128,64,4,3,166.1783333333333,3
w13,4,60,4,2048,1408,16,64,128,1,4,2,102.63733333333333,3
w13,4,60,4,2048,1408,16,64,128,16,4,2,102.157,3
w13,4,60,4,2048,1408,16,64,128,16,4,3,102.67999999999999,3
w13,4,60,4,2048,1408,16,64,128,32,4,2,102.83933333333334,3
w13,4,60,4,2048,1408,16,64,128,32,4,3,102.57266666666665,3
w13,4,60,4,2048,1408,16,64,128,64,4,2,102.17833333333333,3
w13,4,60,4,2048,1408,16,128,128,1,4,2,102.86066666666666,3
w13,4,60,4,2048,1408,16,128,128,1,8,3,102.413,3
w13,4,60,4,2048,1408,16,128,128,16,4,2,102.03966666666668,3
w13,4,60,4,2048,1408,16,128,128,16,8,3,101.85833333333333,3
w13,4,60,4,2048,1408,16,128,128,32,4,2,102.818,3
w13,4,60,4,2048,1408,16,128,128,32,8,3,102.30633333333333,3
w13,4,60,4,2048,1408,16,128,128,64,8,3,102.85033333333332,3
w13,4,60,6,3584,2304,16,64,128,16,4,3,426.7546666666667,3
w13,4,60,6,3584,2304,16,64,128,16,8,3,427.52233333333334,3
w13,4,60,6,3584,2304,16,64,128,32,4,3,426.50933333333336,3
w13,4,60,6,3584,2304,16,64,128,64,4,3,428.0133333333333,3
w13,4,60,6,3584,2304,16,64,256,1,4,3,425.3253333333334,3
w13,4,60,6,3584,2304,16,64,256,1,8,3,426.541,3
w13,4,60,6,3584,2304,16,64,256,16,4,2,427.8533333333333,3
w13,4,60,6,3584,2304,16,64,256,16,4,3,425.6233333333334,3
w13,4,60,6,3584,2304,16,64,256,32,4,2,426.73333333333335,3
w13,4,60,6,3584,2304,16,64,256,32,4,3,424.37566666666663,3
w13,4,60,6,3584,2304,16,64,256,64,4,2,427.46900000000005,3
w13,4,60,6,3584,2304,16,64,256,64,4,3,423.86366666666663,3
w13,4,60,6,3584,2304,16,128,128,1,4,2,425.79466666666667,3
w13,4,60,6,3584,2304,16,128,128,1,4,3,426.157,3
w13,4,60,6,3584,2304,16,128,128,1,4,5,428.06666666666666,3
w13,4,60,6,3584,2304,16,128,128,1,8,3,427.83166666666665,3
w13,4,60,6,3584,2304,16,128,128,1,8,5,426.3706666666667,3
w13,4,60,6,3584,2304,16,128,128,16,4,2,426.904,3
w13,4,60,6,3584,2304,16,128,128,16,4,3,426.061,3
w13,4,60,6,3584,2304,16,128,128,16,8,3,427.5756666666667,3
w13,4,60,6,3584,2304,16,128,128,32,4,3,428.13033333333334,3
w13,4,60,6,3584,2304,16,128,128,32,4,5,427.7146666666667,3
w13,4,60,6,3584,2304,16,128,128,32,8,3,426.797,3
w13,4,60,6,3584,2304,16,128,128,32,8,5,427.42633333333333,3
w13,4,60,6,3584,2304,16,128,128,64,4,2,427.853,3
w13,4,60,6,3584,2304,16,128,128,64,4,3,425.2823333333333,3
w13,4,60,6,3584,2304,16,128,128,64,8,3,427.565,3
w13,4,60,6,3584,2304,32,128,128,8,4,3,427.76800000000003,3
w13,4,60,6,3584,2304,32,128,128,16,4,3,427.49033333333335,3
w13,4,60,8,2048,1536,16,64,128,64,4,3,221.22866666666667,3
w13,4,60,8,2048,1536,16,64,128,64,4,5,221.698,3
w13,4,60,8,2048,1536,16,64,256,32,8,3,221.58033333333333,3
w13,4,60,8,2048,1536,16,64,256,64,4,2,221.154,3
w13,4,60,8,2048,1536,16,64,256,64,4,3,221.36733333333333,3
w13,4,60,8,2048,1536,16,128,128,1,8,3,219.97,3
w13,4,60,8,2048,1536,16,128,128,1,8,5,221.54866666666666,3
w13,4,60,8,2048,1536,16,128,128,16,4,5,221.41033333333334,3
w13,4,60,8,2048,1536,16,128,128,16,8,3,219.62833333333333,3
w13,4,60,8,2048,1536,16,128,128,16,8,4,220.9623333333333,3
w13,4,60,8,2048,1536,16,128,128,16,8,5,220.95133333333334,3
w13,4,60,8,2048,1536,16,128,128,32,4,2,220.29,3
w13,4,60,8,2048,1536,16,128,128,32,4,3,219.57533333333333,3
w13,4,60,8,2048,1536,16,128,128,32,4,4,221.62333333333333,3
w13,4,60,8,2048,1536,16,128,128,32,4,5,220.39633333333336,3
w13,4,60,8,2048,1536,16,128,128,32,8,3,219.53300000000002,3
w13,4,60,8,2048,1536,16,128,128,32,8,5,220.802,3
w13,4,60,8,2048,1536,16,128,128,64,4,2,220.3646666666667,3
w13,4,60,8,2048,1536,16,128,128,64,4,3,220.43933333333334,3
w13,4,60,8,2048,1536,16,128,128,64,4,5,220.33266666666668,3
w13,4,60,8,2048,1536,16,128,128,64,8,3,219.69299999999998,3
w13,4,60,8,2048,1536,16,128,128,64,8,4,221.06866666666667,3
w13,4,60,8,2048,1536,16,128,128,64,8,5,220.14066666666668,3
w13,4,64,6,3072,2048,16,16,256,1,4,2,330.5416666666667,3
w13,4,64,6,3072,2048,16,32,128,1,4,3,330.1786666666667,3
w13,4,64,6,3072,2048,16,32,256,32,4,2,330.2323333333333,3
w13,4,64,6,3072,2048,16,64,128,1,4,3,330.1566666666667,3
w13,4,64,6,3072,2048,16,64,128,1,8,3,328.4936666666667,3
w13,4,64,6,3072,2048,16,64,128,16,4,3,330.45633333333336,3
w13,4,64,6,3072,2048,16,64,128,16,4,5,330.24233333333336,3
w13,4,64,6,3072,2048,16,64,128,16,8,3,329.5176666666667,3
w13,4,64,6,3072,2048,16,64,128,32,4,3,328.31199999999995,3
w13,4,64,6,3072,2048,16,64,128,32,8,3,328.77,3
w13,4,64,6,3072,2048,16,64,128,64,8,3,327.3736666666667,3
w13,4,64,6,3072,2048,16,64,256,1,4,2,330.125,3
w13,4,64,6,3072,2048,16,64,256,1,4,3,329.84833333333336,3
w13,4,64,6,3072,2048,16,64,256,1,4,5,330.0826666666667,3
w13,4,64,6,3072,2048,16,64,256,16,4,2,329.7203333333333,3
w13,4,64,6,3072,2048,16,64,256,16,4,3,328.45033333333333,3
w13,4,64,6,3072,2048,16,64,256,32,4,2,329.06966666666665,3
w13,4,64,6,3072,2048,16,64,256,64,4,2,328.739,3
w13,4,64,6,3072,2048,16,64,256,64,4,3,328.216,3
w13,4,64,6,3072,2048,16,128,128,1,4,2,329.38866666666667,3
w13,4,64,6,3072,2048,16,128,128,1,8,3,328.81333333333333,3
w13,4,64,6,3072,2048,16,128,128,1,8,5,330.66966666666667,3
w13,4,64,6,3072,2048,16,128,128,16,4,2,330.07233333333335,3
w13,4,64,6,3072,2048,16,128,128,16,4,3,330.1466666666667,3
w13,4,64,6,3072,2048,16,128,128,16,4,5,329.75166666666667,3
w13,4,64,6,3072,2048,16,128,128,16,8,3,327.8,3
w13,4,64,6,3072,2048,16,128,128,16,8,5,330.07166666666666,3
w13,4,64,6,3072,2048,16,128,128,32,4,2,330.3283333333333,3
w13,4,64,6,3072,2048,16,128,128,32,4,3,329.987,3
w13,4,64,6,3072,2048,16,128,128,32,4,5,329.77366666666666,3
w13,4,64,6,3072,2048,16,128,128,32,8,3,329.027,3
w13,4,64,6,3072,2048,16,128,128,32,8,5,330.531,3
w13,4,64,6,3072,2048,16,128,128,64,4,2,330.264,3
w13,4,64,6,3072,2048,16,128,128,64,4,3,328.9406666666667,3
w13,4,64,6,3072,2048,16,128,128,64,8,3,328.0133333333333,3
w13,4,64,6,3072,2048,16,128,128,64,8,5,329.4003333333333,3
w13,4,64,6,3072,2048,32,128,128,8,4,3,330.403,3
w13,4,64,6,3584,1536,16,32,128,1,4,3,290.605,3
w13,4,64,6,3584,1536,16,64,128,1,4,3,288.5036666666667,3
w13,4,64,6,3584,1536,16,64,128,1,4,5,290.1143333333334,3
w13,4,64,6,3584,1536,16,64,128,1,8,3,289.752,3
w13,4,64,6,3584,1536,16,64,128,16,4,3,289.86899999999997,3
w13,4,64,6,3584,1536,16,64,128,16,4,5,290.541,3
w13,4,64,6,3584,1536,16,64,128,16,8,3,288.493,3
w13,4,64,6,3584,1536,16,64,128,32,4,3,289.3143333333333,3
w13,4,64,6,3584,1536,16,64,128,32,8,3,290.26366666666667,3
w13,4,64,6,3584,1536,16,64,128,64,4,3,289.059,3
w13,4,64,6,3584,1536,16,64,128,64,8,3,290.253,3
w13,4,64,6,3584,1536,16,64,256,1,4,2,287.8636666666667,3
w13,4,64,6,3584,1536,16,64,256,1,4,3,289.8906666666667,3
w13,4,64,6,3584,1536,16,64,256,1,4,5,288.46133333333336,3
w13,4,64,6,3584,1536,16,64,256,16,4,2,290.2316666666666,3
w13,4,64,6,3584,1536,16,64,256,16,4,3,288.2373333333333,3
w13,4,64,6,3584,1536,16,64,256,16,4,5,289.29333333333335,3
w13,4,64,6,3584,1536,16,64,256,32,4,2,290.5303333333333,3
w13,4,64,6,3584,1536,16,64,256,64,4,2,290.232,3
w13,4,64,6,3584,1536,16,64,256,64,4,5,290.509,3
w13,4,64,6,3584,1536,16,128,128,1,4,3,290.17866666666663,3
w13,4,64,6,3584,1536,16,128,128,1,4,5,289.0263333333333,3
w13,4,64,6,3584,1536,16,128,128,1,8,3,287.7146666666667,3
w13,4,64,6,3584,1536,16,128,128,1,8,4,289.229,3
w13,4,64,6,3584,1536,16,128,128,1,8,5,289.21866666666665,3
w13,4,64,6,3584,1536,16,128,128,16,4,3,290.35966666666667,3
w13,4,64,6,3584,1536,16,128,128,32,4,3,288.8983333333333,3
w13,4,64,6,3584,1536,16,128,128,32,8,3,289.53833333333336,3
w13,4,64,6,3584,1536,16,128,128,64,4,3,290.25333333333333,3
w13,4,64,6,3584,1536,16,128,128,64,8,3,289.66633333333334,3
w13,4,64,6,3584,1536,32,128,128,1,4,3,289.709,3
w13,4,64,6,3584,1536,32,128,128,4,4,3,289.325,3
w13,4,64,8,3584,2560,16,64,128,1,4,3,629.252,3
w13,4,64,8,3584,2560,16,64,128,1,8,3,629.8066666666667,3
w13,4,64,8,3584,2560,16,64,128,16,4,3,631.3636666666666,3
w13,4,64,8,3584,2560,16,64,128,16,8,3,632.409,3
w13,4,64,8,3584,2560,16,64,128,32,4,3,632.9533333333334,3
w13,4,64,8,3584,2560,16,64,128,32,8,3,632.6866666666666,3
w13,4,64,8,3584,2560,16,64,128,64,4,3,631.9183333333334,3
w13,4,64,8,3584,2560,16,64,128,64,4,5,632.9853333333333,3
w13,4,64,8,3584,2560,16,64,128,64,8,3,631.1613333333333,3
w13,4,64,8,3584,2560,16,64,256,1,4,2,631.0113333333334,3
w13,4,64,8,3584,2560,16,64,256,1,4,3,627.172,3
w13,4,64,8,3584,2560,16,64,256,1,4,5,631.4066666666666,3
w13,4,64,8,3584,2560,16,64,256,1,8,3,631.332,3
w13,4,64,8,3584,2560,16,64,256,16,4,2,630.393,3
w13,4,64,8,3584,2560,16,64,256,16,4,3,627.8646666666667,3
w13,4,64,8,3584,2560,16,64,256,16,4,5,629.6893333333334,3
w13,4,64,8,3584,2560,16,64,256,16,8,3,631.076,3
w13,4,64,8,3584,2560,16,64,256,32,4,2,628.2706666666667,3
w13,4,64,8,3584,2560,16,64,256,32,4,3,628.5053333333334,3
w13,4,64,8,3584,2560,16,64,256,32,4,5,629.977,3
w13,4,64,8,3584,2560,16,64,256,32,8,3,630.3713333333334,3
w13,4,64,8,3584,2560,16,64,256,64,4,2,631.1293333333333,3
w13,4,64,8,3584,2560,16,64,256,64,4,3,627.0006666666667,3
w13,4,64,8,3584,2560,16,64,256,64,4,5,630.8729999999999,3
w13,4,64,8,3584,2560,16,64,256,64,8,3,629.9453333333333,3
w13,4,64,8,3584,2560,16,64,256,64,8,5,632.8253333333333,3
w13,4,64,8,3584,2560,16,128,128,1,4,2,631.0973333333333,3
w13,4,64,8,3584,2560,16,128,128,1,4,3,629.5186666666667,3
w13,4,64,8,3584,2560,16,128,128,1,8,3,629.9986666666667,3
w13,4,64,8,3584,2560,16,128,128,1,8,5,630.6386666666666,3
w13,4,64,8,3584,2560,16,128,128,16,4,2,630.852,3
w13,4,64,8,3584,2560,16,128,128,16,4,3,631.3100000000001,3
w13,4,64,8,3584,2560,16,128,128,16,4,5,632.6013333333334,3
w13,4,64,8,3584,2560,16,128,128,16,8,3,629.817,3
w13,4,64,8,3584,2560,16,128,128,16,8,5,631.2996666666667,3
w13,4,64,8,3584,2560,16,128,128,32,4,2,630.574,3
w13,4,64,8,3584,2560,16,128,128,32,4,3,629.4643333333333,3
w13,4,64,8,3584,2560,16,128,128,32,4,5,633.188,3
w13,4,64,8,3584,2560,16,128,128,32,8,3,628.708,3
w13,4,64,8,3584,2560,16,128,128,32,8,5,631.8866666666667,3
w13,4,64,8,3584,2560,16,128,128,64,4,2,631.4386666666666,3
w13,4,64,8,3584,2560,16,128,128,64,4,3,628.4626666666667,3
w13,4,64,8,3584,2560,16,128,128,64,4,5,632.323,3
w13,4,64,8,3584,2560,16,128,128,64,8,3,631.3746666666666,3
w13,4,64,8,3584,2560,16,128,128,64,8,5,631.897,3
w13,4,64,8,3584,2560,32,128,128,1,4,3,632.8253333333333,3
w13,4,64,8,3584,2560,32,128,128,4,4,3,630.969,3
w13,4,64,8,3584,2560,32,128,128,8,4,3,632.2600000000001,3
w13,4,64,8,3584,2560,32,128,128,32,4,3,631.3106666666666,3
w13,4,64,8,3584,2560,32,128,128,64,4,3,632.6226666666666,3
w13,4,128,4,2048,512,16,32,128,1,4,3,41.31433333333333,3
w13,4,128,4,2048,512,16,32,128,4,4,3,41.50666666666667,3
w13,4,128,4,2048,512,16,32,128,16,4,3,41.52766666666667,3
w13,4,128,4,2048,512,16,32,128,64,4,3,41.516666666666666,3
w13,4,128,4,2048,512,16,32,256,16,4,2,41.46333333333333,3
w13,4,128,4,2048,512,16,64,128,1,4,3,41.549,3
w13,4,128,6,4096,2048,16,64,128,1,4,5,435.73600000000005,3
w13,4,128,6,4096,2048,16,64,128,16,4,4,436.19433333333336,3
w13,4,128,6,4096,2048,16,64,128,32,4,4,435.843,3
w13,4,128,6,4096,2048,16,64,128,32,8,3,436.067,3
w13,4,128,6,4096,2048,16,64,256,1,4,2,435.60833333333335,3
w13,4,128,6,4096,2048,16,64,256,1,4,3,433.827,3
w13,4,128,6,4096,2048,16,64,256,1,4,5,432.9203333333333,3
w13,4,128,6,4096,2048,16,64,256,1,8,3,434.9783333333333,3
w13,4,128,6,4096,2048,16,64,256,1,8,5,436.07666666666665,3
w13,4,128,6,4096,2048,16,64,256,16,4,2,435.757,3
w13,4,128,6,4096,2048,16,64,256,16,4,3,432.99500000000006,3
w13,4,128,6,4096,2048,16,64,256,16,4,5,433.155,3
w13,4,128,6,4096,2048,16,64,256,16,8,3,435.37266666666665,3
w13,4,128,6,4096,2048,16,64,256,16,8,5,435.98133333333334,3
w13,4,128,6,4096,2048,16,64,256,32,4,2,432.0243333333333,3
w13,4,128,6,4096,2048,16,64,256,32,4,3,433.46433333333334,3
w13,4,128,6,4096,2048,16,64,256,32,4,5,433.27233333333334,3
w13,4,128,6,4096,2048,16,64,256,64,4,2,433.60266666666666,3
w13,4,128,6,4096,2048,16,64,256,64,4,3,431.89633333333336,3
w13,4,128,6,4096,2048,16,64,256,64,4,5,434.7656666666667,3
w13,4,128,6,4096,2048,16,64,256,64,8,3,433.96566666666666,3
w13,4,128,6,4096,2048,16,64,256,64,8,5,435.4056666666667,3
w13,4,128,6,4096,2048,16,128,128,1,4,5,434.9683333333333,3
w13,4,128,6,4096,2048,16,128,128,16,4,3,434.1466666666667,3
w13,4,128,6,4096,2048,16,128,128,16,4,4,435.8106666666667,3
w13,4,128,6,4096,2048,16,128,128,16,4,5,436.13033333333334,3
w13,4,128,6,4096,2048,16,128,128,64,4,5,434.28566666666666,3
w13,4,128,6,4096,2048,16,128,128,64,8,5,436.109,3
w13,4,128,8,2048,768,16,32,128,1,4,4,111.426,3
w13,4,128,8,2048,768,16,32,128,16,4,4,111.36266666666666,3
w13,4,128,8,2048,768,16,64,128,1,4,4,111.36200000000001,3
w13,4,128,8,2048,768,16,64,128,16,8,4,112.01299999999999,3
w13,4,128,8,2048,768,16,64,128,32,4,3,111.693,3
w13,4,128,8,2048,768,16,64,128,64,4,4,111.99166666666667,3
w13,4,128,8,2048,768,16,64,128,64,8,4,111.704,3
w13,4,128,8,2048,768,16,128,128,1,8,4,111.84266666666667,3
w13,4,128,8,2048,768,16,128,128,1,8,5,111.63999999999999,3
w13,4,128,8,2048,768,16,128,128,16,4,2,112.01299999999999,3
w13,4,128,8,2048,768,16,128,128,16,4,4,111.77866666666667,3
w13,4,128,8,2048,768,16,128,128,16,8,3,111.60733333333333,3
w13,4,128,8,2048,768,16,128,128,16,8,4,111.63966666666666,3
w13,4,128,8,2048,768,16,128,128,32,8,5,111.746,3
w13,4,128,8,2048,768,16,128,128,64,4,3,111.49033333333334,3
w13,4,128,8,2048,768,16,128,128,64,8,3,111.88499999999999,3
w13,4,128,8,2048,768,16,128,128,64,8,4,111.586,3
w13,4,128,8,2048,768,16,128,128,64,8,5,110.91466666666668,3
w13,4,128,8,4096,1536,16,64,128,64,4,5,433.3253333333334,3
w13,4,128,8,4096,1536,16,64,256,1,4,3,432.099,3
w13,4,128,8,4096,1536,16,64,256,1,4,5,432.7283333333333,3
w13,4,128,8,4096,1536,16,64,256,16,4,3,429.29333333333335,3
w13,4,128,8,4096,1536,16,64,256,16,4,5,432.61100000000005,3
w13,4,128,8,4096,1536,16,64,256,16,8,3,433.13366666666667,3
w13,4,128,8,4096,1536,16,64,256,32,4,3,431.2033333333333,3
w13,4,128,8,4096,1536,16,64,256,32,4,5,432.2056666666667,3
w13,4,128,8,4096,1536,16,64,256,32,8,3,432.9843333333333,3
w13,4,128,8,4096,1536,16,64,256,64,4,3,431.83200000000005,3
w13,4,128,8,4096,1536,16,64,256,64,4,5,432.2163333333333,3
w13,4,128,8,4096,1536,16,64,256,64,8,3,432.56766666666664,3
w13,4,128,8,4096,1536,16,128,128,64,4,5,433.05899999999997,3
w13,4,128,8,4096,3072,16,64,256,1,4,2,857.3273333333333,3
w13,4,128,8,4096,3072,16,64,256,1,4,3,853.6253333333334,3
w13,4,128,8,4096,3072,16,64,256,1,4,5,856.0156666666667,3
w13,4,128,8,4096,3072,16,64,256,1,8,5,859.3646666666667,3
w13,4,128,8,4096,3072,16,64,256,16,4,2,859.2793333333333,3
w13,4,128,8,4096,3072,16,64,256,16,4,3,851.5143333333334,3
w13,4,128,8,4096,3072,16,64,256,16,4,5,855.3969999999999,3
w13,4,128,8,4096,3072,16,64,256,16,8,3,857.4236666666666,3
w13,4,128,8,4096,3072,16,64,256,32,4,2,856.837,3
w13,4,128,8,4096,3072,16,64,256,32,4,3,852.869,3
w13,4,128,8,4096,3072,16,64,256,32,4,5,854.5426666666667,3
w13,4,128,8,4096,3072,16,64,256,64,4,2,858.6823333333333,3
w13,4,128,8,4096,3072,16,64,256,64,4,3,852.6866666666666,3
w13,4,128,8,4096,3072,16,64,256,64,4,5,857.3693333333334,3
w13,4,128,8,4096,3072,16,64,256,64,8,3,857.7323333333334,3
w13,4,128,8,4096,3072,16,64,256,64,8,5,859.5133333333333,3
w13,4,128,8,4096,3072,16,128,128,1,4,3,859.8873333333332,3
w13,4,128,8,4096,3072,16,128,128,16,4,3,858.949,3
w13,4,128,8,4096,3072,16,128,128,64,4,3,859.9516666666667,3
w13,8,8,2,1024,512,16,128,64,64,4,4,9.271333333333333,3
w13,8,8,2,1024,512,16,128,64,64,4,5,9.293,3
w13,8,16,2,1536,768,16,32,128,1,4,2,45.62433333333333,3
w13,8,16,2,1536,768,16,128,128,1,8,2,45.538666666666664,3
w13,8,16,2,1536,768,16,128,128,1,8,4,45.22966666666667,3
w13,8,16,4,1536,1024,16,64,128,16,4,2,60.71733333333333,3
w13,8,16,4,1536,1024,16,64,128,32,4,2,60.364666666666665,3
w13,8,16,4,1536,1024,16,64,128,64,4,2,60.845,3
w13,8,32,4,2048,768,16,32,128,1,4,2,111.46866666666666,3
w13,8,32,4,2048,768,16,32,128,32,4,2,111.06366666666668,3
w13,8,32,4,2048,768,16,32,128,64,4,2,111.41566666666667,3
w13,8,32,4,2048,768,16,64,128,16,4,3,111.47966666666667,3
w13,8,32,4,2048,768,16,64,128,32,8,4,110.93566666666668,3
w13,8,32,4,2048,768,16,64,128,64,8,4,111.77833333333332,3
w13,8,32,4,2048,768,16,128,128,1,4,2,112.02366666666667,3
w13,8,32,4,2048,768,16,128,128,1,8,3,111.40466666666667,3
w13,8,32,4,2048,768,16,128,128,16,8,3,111.31933333333332,3
w13,8,32,4,2048,768,16,128,128,16,8,4,111.95933333333333,3
w13,8,32,4,2048,768,16,128,128,32,8,3,111.82099999999998,3
w13,8,32,4,2048,768,16,128,128,64,8,4,111.97066666666667,3
w13,8,32,6,3072,1024,16,128,128,64,8,4,219.298,3
w13,8,32,6,3072,1024,32,32,128,1,4,3,219.85299999999998,3
w13,8,32,6,3072,1024,32,32,128,16,8,3,221.389,3
w13,8,60,4,2048,1408,16,16,256,1,4,2,203.73633333333336,3
w13,8,60,4,2048,1408,16,64,128,1,4,5,201.98600000000002,3
w13,8,60,4,2048,1408,16,64,128,1,8,3,202.77533333333335,3
w13,8,60,4,2048,1408,16,64,128,16,4,5,203.46966666666665,3
w13,8,60,4,2048,1408,16,64,128,32,4,2,202.15766666666664,3
w13,8,60,4,2048,1408,16,64,128,32,4,4,203.21366666666665,3
w13,8,60,4,2048,1408,16,64,128,32,4,5,203.917,3
w13,8,60,4,2048,1408,16,64,128,64,4,2,203.52233333333334,3
w13,8,60,4,2048,1408,16,64,128,64,4,5,203.896,3
w13,8,60,4,2048,1408,16,64,256,16,4,3,203.55466666666666,3
w13,8,60,4,2048,1408,16,128,128,1,8,5,203.85366666666667,3
w13,8,60,4,2048,1408,16,128,128,16,8,5,203.40466666666666,3
w13,8,60,4,2048,1408,16,128,128,32,4,5,203.63966666666667,3
w13,8,60,4,2048,1408,16,128,128,32,8,4,203.62966666666668,3
w13,8,60,4,2048,1408,16,128,128,32,8,5,203.87466666666668,3
w13,8,60,4,2048,1408,16,128,128,64,4,3,203.75766666666667,3
w13,8,60,4,2048,1408,32,32,128,1,8,3,203.41533333333334,3
w13,8,60,6,3584,2304,16,64,128,1,4,3,846.9366666666666,3
w13,8,60,6,3584,2304,16,64,128,1,4,5,847.9496666666668,3
w13,8,60,6,3584,2304,16,64,128,1,8,3,849.667,3
w13,8,60,6,3584,2304,16,64,128,16,4,3,848.526,3
w13,8,60,6,3584,2304,16,64,128,16,4,5,850.4459999999999,3
w13,8,60,6,3584,2304,16,64,128,16,8,3,850.9576666666667,3
w13,8,60,6,3584,2304,16,64,128,32,4,3,846.9473333333334,3
w13,8,60,6,3584,2304,16,64,128,64,4,3,846.3603333333334,3
w13,8,60,6,3584,2304,16,64,128,64,8,3,849.0376666666666,3
w13,8,60,6,3584,2304,16,64,256,1,4,2,844.3556666666667,3
w13,8,60,6,3584,2304,16,64,256,1,4,3,842.9899999999999,3
w13,8,60,6,3584,2304,16,64,256,1,4,5,848.9743333333332,3
w13,8,60,6,3584,2304,16,64,256,1,8,3,847.9603333333333,3
w13,8,60,6,3584,2304,16,64,256,1,8,5,850.3069999999999,3
w13,8,60,6,3584,2304,16,64,256,16,4,2,843.8966666666666,3
w13,8,60,6,3584,2304,16,64,256,16,4,3,843.3526666666667,3
w13,8,60,6,3584,2304,16,64,256,16,4,5,848.7076666666667,3
w13,8,60,6,3584,2304,16,64,256,16,8,3,847.2566666666667,3
w13,8,60,6,3584,2304,16,64,256,16,8,5,850.2003333333333,3
w13,8,60,6,3584,2304,16,64,256,32,4,2,845.4966666666666,3
w13,8,60,6,3584,2304,16,64,256,32,4,3,844.9736666666666,3
w13,8,60,6,3584,2304,16,64,256,32,4,5,847.8856666666667,3
w13,8,60,6,3584,2304,16,64,256,32,8,3,847.1709999999999,3
w13,8,60,6,3584,2304,16,64,256,32,8,5,849.9553333333333,3
w13,8,60,6,3584,2304,16,64,256,64,4,2,847.8646666666667,3
w13,8,60,6,3584,2304,16,64,256,64,4,3,843.7476666666666,3
w13,8,60,6,3584,2304,16,64,256,64,8,3,848.4616666666667,3
w13,8,60,6,3584,2304,16,128,128,1,4,2,847.822,3
w13,8,60,6,3584,2304,16,128,128,1,4,3,842.4673333333334,3
w13,8,60,6,3584,2304,16,128,128,1,4,5,848.1423333333332,3
w13,8,60,6,3584,2304,16,128,128,1,8,3,845.5926666666666,3
w13,8,60,6,3584,2304,16,128,128,1,8,5,847.0966666666667,3
w13,8,60,6,3584,2304,16,128,128,16,4,2,849.8273333333333,3
w13,8,60,6,3584,2304,16,128,128,16,4,3,846.4029999999999,3
w13,8,60,6,3584,2304,16,128,128,16,4,5,847.2776666666667,3
w13,8,60,6,3584,2304,16,128,128,16,8,3,847.8539999999999,3
w13,8,60,6,3584,2304,16,128,128,16,8,5,848.75,3
w13,8,60,6,3584,2304,16,128,128,32,4,2,846.4563333333334,3
w13,8,60,6,3584,2304,16,128,128,32,4,3,846.5313333333334,3
w13,8,60,6,3584,2304,16,128,128,32,4,5,849.4963333333334,3
w13,8,60,6,3584,2304,16,128,128,32,8,3,845.87,3
w13,8,60,6,3584,2304,16,128,128,32,8,5,848.8993333333333,3
w13,8,60,6,3584,2304,16,128,128,64,4,2,850.5953333333333,3
w13,8,60,6,3584,2304,16,128,128,64,4,3,846.5736666666667,3
w13,8,60,6,3584,2304,16,128,128,64,4,5,847.3096666666667,3
w13,8,60,6,3584,2304,16,128,128,64,8,3,847.5236666666666,3
w13,8,60,6,3584,2304,16,128,128,64,8,5,850.1256666666667,3
w13,8,60,6,3584,2304,32,128,128,1,4,3,847.6406666666667,3
w13,8,60,6,3584,2304,32,128,128,4,4,3,849.39,3
w13,8,60,6,3584,2304,32,128,128,8,4,3,849.3896666666666,3
w13,8,60,6,3584,2304,32,128,128,32,4,3,849.689,3
w13,8,60,6,3584,2304,32,128,128,64,4,3,850.2109999999999,3
w13,8,60,8,2048,1536,16,64,128,1,8,3,407.394,3
w13,8,60,8,2048,1536,16,64,128,16,4,3,405.45266666666663,3
w13,8,60,8,2048,1536,16,64,128,16,4,5,407.7463333333333,3
w13,8,60,8,2048,1536,16,64,128,16,8,3,405.933,3
w13,8,60,8,2048,1536,16,64,128,32,4,3,405.57,3
w13,8,60,8,2048,1536,16,64,128,32,4,5,407.85266666666666,3
w13,8,60,8,2048,1536,16,64,128,32,8,3,406.5303333333333,3
w13,8,60,8,2048,1536,16,64,128,64,4,3,405.1863333333333,3
w13,8,60,8,2048,1536,16,64,128,64,4,5,406.6266666666667,3
w13,8,60,8,2048,1536,16,64,128,64,8,3,407.34100000000007,3
w13,8,60,8,2048,1536,16,64,256,16,4,2,407.73566666666665,3
w13,8,60,8,2048,1536,16,64,256,16,4,3,407.5330000000001,3
w13,8,60,8,2048,1536,16,64,256,32,4,3,408.0126666666667,3
w13,8,60,8,2048,1536,16,64,256,64,4,3,405.5273333333333,3
w13,8,60,8,2048,1536,16,128,128,1,4,3,406.146,3
w13,8,60,8,2048,1536,16,128,128,1,8,3,405.709,3
w13,8,60,8,2048,1536,16,128,128,16,4,2,406.541,3
w13,8,60,8,2048,1536,16,128,128,16,4,3,404.48199999999997,3
w13,8,60,8,2048,1536,16,128,128,16,4,5,407.5543333333333,3
w13,8,60,8,2048,1536,16,128,128,16,8,3,404.6846666666667,3
w13,8,60,8,2048,1536,16,128,128,16,8,5,405.0263333333333,3
w13,8,60,8,2048,1536,16,128,128,32,4,3,405.4103333333333,3
w13,8,60,8,2048,1536,16,128,128,32,4,5,406.26366666666667,3
w13,8,60,8,2048,1536,16,128,128,32,8,3,406.093,3
w13,8,60,8,2048,1536,16,128,128,32,8,5,406.349,3
w13,8,60,8,2048,1536,16,128,128,64,4,3,403.949,3
w13,8,60,8,2048,1536,16,128,128,64,4,5,407.93833333333333,3
w13,8,60,8,2048,1536,16,128,128,64,8,3,406.0396666666666,3
w13,8,60,8,2048,1536,16,128,128,64,8,5,406.8503333333333,3
w13,8,60,8,2048,1536,32,128,128,8,4,3,407.73566666666665,3
w13,8,60,8,2048,1536,32,128,128,32,4,3,407.08500000000004,3
w13,8,60,8,2048,1536,32,128,128,64,4,3,407.2343333333333,3
w13,8,64,6,3072,2048,16,64,128,1,8,3,650.1156666666667,3
w13,8,64,6,3072,2048,16,64,128,16,4,3,647.886,3
w13,8,64,6,3072,2048,16,64,128,16,4,5,649.3366666666667,3
w13,8,64,6,3072,2048,16,64,128,16,8,3,644.366,3
w13,8,64,6,3072,2048,16,64,128,32,4,3,647.118,3
w13,8,64,6,3072,2048,16,64,128,32,4,5,649.3583333333333,3
w13,8,64,6,3072,2048,16,64,128,32,8,3,648.1526666666667,3
w13,8,64,6,3072,2048,16,64,128,64,4,3,648.0886666666667,3
w13,8,64,6,3072,2048,16,64,128,64,8,3,646.9686666666666,3
w13,8,64,6,3072,2048,16,64,256,1,4,2,649.3580000000001,3
w13,8,64,6,3072,2048,16,64,256,1,4,3,645.5716666666666,3
w13,8,64,6,3072,2048,16,64,256,1,4,5,649.5393333333333,3
w13,8,64,6,3072,2048,16,64,256,16,4,2,645.5713333333333,3
w13,8,64,6,3072,2048,16,64,256,16,4,3,644.0673333333334,3
w13,8,64,6,3072,2048,16,64,256,16,8,3,649.0806666666666,3
w13,8,64,6,3072,2048,16,64,256,32,4,2,646.5103333333333,3
w13,8,64,6,3072,2048,16,64,256,32,4,3,645.614,3
w13,8,64,6,3072,2048,16,64,256,32,8,3,647.982,3
w13,8,64,6,3072,2048,16,64,256,64,4,2,648.025,3
w13,8,64,6,3072,2048,16,64,256,64,4,3,645.657,3
w13,8,64,6,3072,2048,16,64,256,64,8,3,650.0403333333334,3
w13,8,64,6,3072,2048,16,128,128,1,4,3,646.083,3
w13,8,64,6,3072,2048,16,128,128,1,4,5,648.8996666666667,3
w13,8,64,6,3072,2048,16,128,128,1,8,3,647.5986666666666,3
w13,8,64,6,3072,2048,16,128,128,1,8,5,649.39,3
w13,8,64,6,3072,2048,16,128,128,16,4,2,647.8753333333333,3
w13,8,64,6,3072,2048,16,128,128,16,4,3,646.0836666666668,3
w13,8,64,6,3072,2048,16,128,128,16,4,5,648.558,3
w13,8,64,6,3072,2048,16,128,128,16,8,3,648.5796666666666,3
w13,8,64,6,3072,2048,16,128,128,16,8,5,649.5073333333333,3
w13,8,64,6,3072,2048,16,128,128,32,4,3,646.1796666666667,3
w13,8,64,6,3072,2048,16,128,128,32,4,5,650.2756666666668,3
w13,8,64,6,3072,2048,16,128,128,32,8,3,648.4086666666667,3
w13,8,64,6,3072,2048,16,128,128,32,8,5,650.2966666666666,3
w13,8,64,6,3072,2048,16,128,128,64,4,2,649.2086666666667,3
w13,8,64,6,3072,2048,16,128,128,64,4,3,646.7339999999999,3
w13,8,64,6,3072,2048,16,128,128,64,4,5,648.8993333333333,3
w13,8,64,6,3072,2048,16,128,128,64,8,3,649.1983333333334,3
w13,8,64,6,3072,2048,32,128,128,8,4,3,650.062,3
w13,8,64,6,3584,1536,16,64,128,1,4,3,566.147,3
w13,8,64,6,3584,1536,16,64,128,1,4,5,567.0536666666667,3
w13,8,64,6,3584,1536,16,64,128,1,8,3,566.6693333333334,3
w13,8,64,6,3584,1536,16,64,128,16,4,3,568.1203333333333,3
w13,8,64,6,3584,1536,16,64,128,16,8,3,566.446,3
w13,8,64,6,3584,1536,16,64,128,32,4,3,568.451,3
w13,8,64,6,3584,1536,16,64,128,32,8,3,566.4993333333333,3
w13,8,64,6,3584,1536,16,64,128,64,4,3,566.3069999999999,3
w13,8,64,6,3584,1536,16,64,128,64,8,3,567.0856666666667,3
w13,8,64,6,3584,1536,16,64,256,1,4,2,568.1416666666667,3
w13,8,64,6,3584,1536,16,64,256,1,4,3,563.0433333333334,3
w13,8,64,6,3584,1536,16,64,256,1,4,5,567.4803333333333,3
w13,8,64,6,3584,1536,16,64,256,1,8,3,566.4456666666666,3
w13,8,64,6,3584,1536,16,64,256,16,4,3,566.0406666666667,3
w13,8,64,6,3584,1536,16,64,256,16,4,5,567.9283333333333,3
w13,8,64,6,3584,1536,16,64,256,32,4,3,565.6030000000001,3
w13,8,64,6,3584,1536,16,64,256,32,8,3,567.6506666666667,3
w13,8,64,6,3584,1536,16,64,256,64,4,3,568.451,3
w13,8,64,6,3584,1536,16,64,256,64,8,3,567.6723333333333,3
w13,8,64,6,3584,1536,16,128,128,1,4,5,567.587,3
w13,8,64,6,3584,1536,16,128,128,1,8,5,566.8296666666666,3
w13,8,64,6,3584,1536,16,128,128,16,4,5,567.203,3
w13,8,64,6,3584,1536,16,128,128,16,8,5,568.3763333333334,3
w13,8,64,6,3584,1536,16,128,128,64,4,3,568.1416666666668,3
w13,8,64,8,3584,2560,16,64,128,1,4,3,1254.9393333333335,3
w13,8,64,8,3584,2560,16,64,128,1,4,5,1254.0326666666667,3
w13,8,64,8,3584,2560,16,64,128,1,8,3,1255.6323333333332,3
w13,8,64,8,3584,2560,16,64,128,16,4,3,1254.5126666666665,3
w13,8,64,8,3584,2560,16,64,128,32,4,3,1253.3500000000001,3
w13,8,64,8,3584,2560,16,64,128,32,4,5,1254.5339999999999,3
w13,8,64,8,3584,2560,16,64,256,1,4,2,1248.3153333333332,3
w13,8,64,8,3584,2560,16,64,256,1,4,3,1244.2726666666667,3
w13,8,64,8,3584,2560,16,64,256,1,4,5,1249.9046666666666,3
w13,8,64,8,3584,2560,16,64,256,1,8,3,1251.814,3
w13,8,64,8,3584,2560,16,64,256,1,8,5,1254.054,3
w13,8,64,8,3584,2560,16,64,256,16,4,2,1248.7416666666668,3
w13,8,64,8,3584,2560,16,64,256,16,4,3,1243.0773333333334,3
w13,8,64,8,3584,2560,16,64,256,16,4,5,1248.9656666666667,3
w13,8,64,8,3584,2560,16,64,256,16,8,3,1250.3419999999999,3
w13,8,64,8,3584,2560,16,64,256,16,8,5,1252.6456666666666,3
w13,8,64,8,3584,2560,16,64,256,32,4,2,1247.334,3
w13,8,64,8,3584,2560,16,64,256,32,4,3,1244.1233333333332,3
w13,8,64,8,3584,2560,16,64,256,32,4,5,1253.3819999999998,3
w13,8,64,8,3584,2560,16,64,256,32,8,3,1250.7793333333332,3
w13,8,64,8,3584,2560,16,64,256,64,4,2,1244.5393333333334,3
w13,8,64,8,3584,2560,16,64,256,64,4,3,1243.0776666666668,3
w13,8,64,8,3584,2560,16,64,256,64,8,3,1253.297,3
w13,8,64,8,3584,2560,16,128,128,1,4,2,1249.7659999999998,3
w13,8,64,8,3584,2560,16,128,128,1,4,3,1249.6163333333334,3
w13,8,64,8,3584,2560,16,128,128,1,4,5,1252.4543333333334,3
w13,8,64,8,3584,2560,16,128,128,1,8,3,1253.83,3
w13,8,64,8,3584,2560,16,128,128,1,8,5,1252.0806666666667,3
w13,8,64,8,3584,2560,16,128,128,16,4,3,1249.7023333333334,3
w13,8,64,8,3584,2560,16,128,128,16,4,5,1252.0913333333335,3
w13,8,64,8,3584,2560,16,128,128,16,8,3,1255.0033333333333,3
w13,8,64,8,3584,2560,16,128,128,16,8,5,1254.8753333333334,3
w13,8,64,8,3584,2560,16,128,128,32,4,2,1254.278,3
w13,8,64,8,3584,2560,16,128,128,32,4,3,1253.7876666666666,3
w13,8,64,8,3584,2560,16,128,128,64,4,3,1253.926,3
w13,8,64,8,3584,2560,16,128,128,64,8,3,1253.03,3
w13,8,64,8,3584,2560,32,128,128,1,4,3,1255.6216666666667,3
w13,8,64,8,3584,2560,32,128,128,1,4,5,1255.43,3
w13,8,64,8,3584,2560,32,128,128,16,4,5,1253.67,3
w13,8,64,8,3584,2560,32,128,128,32,4,3,1252.4646666666667,3
w13,8,128,4,2048,512,16,64,128,1,4,2,75.84233333333334,3
w13,8,128,4,2048,512,16,64,128,16,4,2,76.09833333333334,3
w13,8,128,4,2048,512,16,64,128,16,8,2,76.37533333333333,3
w13,8,128,4,2048,512,16,64,128,32,4,2,76.08733333333333,3
w13,8,128,4,2048,512,16,64,128,64,4,2,75.94933333333333,3
w13,8,128,4,2048,512,16,64,128,64,8,2,75.94866666666667,3
w13,8,128,4,2048,512,16,128,128,32,8,2,76.30066666666666,3
w13,8,128,6,4096,2048,16,64,128,32,4,3,860.9633333333333,3
w13,8,128,6,4096,2048,16,64,128,32,8,3,861.6146666666667,3
w13,8,128,6,4096,2048,16,64,256,1,4,2,860.1213333333334,3
w13,8,128,6,4096,2048,16,64,256,1,4,3,853.9026666666667,3
w13,8,128,6,4096,2048,16,64,256,1,4,5,857.5293333333333,3
w13,8,128,6,4096,2048,16,64,256,1,8,3,860.0143333333334,3
w13,8,128,6,4096,2048,16,64,256,16,4,2,861.0276666666667,3
w13,8,128,6,4096,2048,16,64,256,16,4,3,854.4246666666667,3
w13,8,128,6,4096,2048,16,64,256,16,4,5,855.7263333333334,3
w13,8,128,6,4096,2048,16,64,256,16,8,3,858.34,3
w13,8,128,6,4096,2048,16,64,256,16,8,5,859.7049999999999,3
w13,8,128,6,4096,2048,16,64,256,32,4,2,860.3563333333333,3
w13,8,128,6,4096,2048,16,64,256,32,4,3,853.753,3
w13,8,128,6,4096,2048,16,64,256,32,4,5,856.302,3
w13,8,128,6,4096,2048,16,64,256,32,8,3,858.4143333333333,3
w13,8,128,6,4096,2048,16,64,256,32,8,5,860.3346666666666,3
w13,8,128,6,4096,2048,16,64,256,64,4,2,859.8866666666667,3
w13,8,128,6,4096,2048,16,64,256,64,4,3,853.476,3
w13,8,128,6,4096,2048,16,64,256,64,4,5,855.3960000000001,3
w13,8,128,6,4096,2048,16,64,256,64,8,3,861.4546666666666,3
w13,8,128,6,4096,2048,16,64,256,64,8,5,862.009,3
w13,8,128,6,4096,2048,16,128,128,16,4,5,860.217,3
w13,8,128,6,4096,2048,16,128,128,32,4,3,859.9720000000001,3
w13,8,128,6,4096,2048,16,128,128,64,4,3,861.337,3
w13,8,128,6,4096,2048,32,128,128,4,4,3,861.86,3
w13,8,128,8,2048,768,16,64,128,1,4,3,219.46899999999997,3
w13,8,128,8,2048,768,16,64,128,1,8,3,220.77066666666667,3
w13,8,128,8,2048,768,16,64,128,16,4,3,218.60566666666668,3
w13,8,128,8,2048,768,16,64,128,32,4,3,219.38433333333333,3
w13,8,128,8,2048,768,16,64,128,32,8,3,219.928,3
w13,8,128,8,2048,768,16,64,128,32,8,5,220.739,3
w13,8,128,8,2048,768,16,64,256,64,4,3,220.67466666666667,3
w13,8,128,8,2048,768,16,128,128,1,4,3,219.65,3
w13,8,128,8,2048,768,16,128,128,16,8,3,220.66333333333333,3
w13,8,128,8,2048,768,16,128,128,32,4,2,218.79733333333334,3
w13,8,128,8,2048,768,16,128,128,32,4,3,220.14133333333334,3
w13,8,128,8,2048,768,16,128,128,32,8,3,218.56300000000002,3
w13,8,128,8,2048,768,16,128,128,64,4,5,219.288,3
w13,8,128,8,2048,768,16,128,128,64,8,3,219.60766666666666,3
w13,8,128,8,2048,768,32,32,128,64,4,3,220.194,3
w13,8,128,8,2048,768,32,128,128,64,4,3,220.42966666666666,3
w13,8,128,8,4096,1536,16,64,128,32,4,3,858.7453333333333,3
w13,8,128,8,4096,1536,16,64,128,64,4,3,861.732,3
w13,8,128,8,4096,1536,16,64,256,1,4,2,859.2896666666666,3
w13,8,128,8,4096,1536,16,64,256,1,4,3,853.4336666666667,3
w13,8,128,8,4096,1536,16,64,256,1,4,5,857.2946666666667,3
w13,8,128,8,4096,1536,16,64,256,1,8,3,860.5056666666666,3
w13,8,128,8,4096,1536,16,64,256,1,8,5,860.3883333333333,3
w13,8,128,8,4096,1536,16,64,256,16,4,2,858.3186666666667,3
w13,8,128,8,4096,1536,16,64,256,16,4,3,856.6653333333334,3
w13,8,128,8,4096,1536,16,64,256,16,4,5,855.9720000000001,3
w13,8,128,8,4096,1536,16,64,256,16,8,3,861.1776666666666,3
w13,8,128,8,4096,1536,16,64,256,16,8,5,860.8896666666666,3
w13,8,128,8,4096,1536,16,64,256,32,4,2,857.7643333333332,3
w13,8,128,8,4096,1536,16,64,256,32,4,3,853.3266666666667,3
w13,8,128,8,4096,1536,16,64,256,32,4,5,856.7936666666666,3
w13,8,128,8,4096,1536,16,64,256,32,8,3,859.439,3
w13,8,128,8,4096,1536,16,64,256,64,4,2,860.1426666666666,3
w13,8,128,8,4096,1536,16,64,256,64,4,3,854.8093333333333,3
w13,8,128,8,4096,1536,16,64,256,64,4,5,857.6786666666667,3
w13,8,128,8,4096,1536,16,64,256,64,8,3,859.9296666666665,3
w13,8,128,8,4096,1536,16,128,128,16,4,3,861.1663333333332,3
w13,8,128,8,4096,1536,16,128,128,16,4,5,861.6039999999999,3
w13,8,128,8,4096,1536,16,128,128,16,8,3,861.828,3
w13,8,128,8,4096,1536,16,128,128,32,4,5,861.476,3
w13,8,128,8,4096,1536,16,128,128,64,4,3,861.7109999999999,3
w13,8,128,8,4096,1536,16,128,128,64,4,5,860.9003333333334,3
w13,8,128,8,4096,3072,16,64,128,16,4,3,1711.272,3
w13,8,128,8,4096,3072,16,64,128,32,4,3,1708.5413333333333,3
w13,8,128,8,4096,3072,16,64,256,1,4,2,1701.1493333333335,3
w13,8,128,8,4096,3072,16,64,256,1,4,3,1698.5253333333333,3
w13,8,128,8,4096,3072,16,64,256,1,4,5,1700.6589999999999,3
w13,8,128,8,4096,3072,16,64,256,1,8,3,1709.6076666666668,3
w13,8,128,8,4096,3072,16,64,256,1,8,5,1707.0910000000001,3
w13,8,128,8,4096,3072,16,64,256,16,4,2,1697.629,3
w13,8,128,8,4096,3072,16,64,256,16,4,3,1695.7196666666666,3
w13,8,128,8,4096,3072,16,64,256,16,4,5,1697.5439999999999,3
w13,8,128,8,4096,3072,16,64,256,16,8,3,1706.4293333333335,3
w13,8,128,8,4096,3072,16,64,256,16,8,5,1706.952,3
w13,8,128,8,4096,3072,16,64,256,32,4,2,1700.861,3
w13,8,128,8,4096,3072,16,64,256,32,4,3,1697.1283333333333,3
w13,8,128,8,4096,3072,16,64,256,32,4,5,1699.4746666666667,3
w13,8,128,8,4096,3072,16,64,256,32,8,3,1708.6263333333334,3
w13,8,128,8,4096,3072,16,64,256,32,8,5,1707.336,3
w13,8,128,8,4096,3072,16,64,256,64,4,2,1703.399666666667,3
w13,8,128,8,4096,3072,16,64,256,64,4,3,1696.4026666666668,3
w13,8,128,8,4096,3072,16,64,256,64,4,5,1701.9279999999999,3
w13,8,128,8,4096,3072,16,64,256,64,8,3,1708.637,3
w13,8,128,8,4096,3072,16,64,256,64,8,5,1705.6716666666664,3
w13,8,128,8,4096,3072,16,128,128,1,4,3,1712.1786666666667,3
w13,8,128,8,4096,3072,16,128,128,16,4,3,1708.7866666666666,3
w13,8,128,8,4096,3072,16,128,128,16,8,3,1712.3386666666665,3
w13,16,8,2,1024,512,16,128,64,1,4,4,10.807333333333332,3
w13,16,8,2,1024,512,16,128,64,1,4,5,10.882,3
w13,16,16,2,1536,768,16,128,128,1,8,4,45.047333333333334,3
w13,16,16,4,1536,1024,16,64,128,1,4,2,58.85,3
w13,16,16,4,1536,1024,16,64,128,1,8,2,58.818000000000005,3
w13,16,16,4,1536,1024,16,64,128,16,4,2,58.51933333333333,3
w13,16,16,4,1536,1024,16,64,128,32,4,2,58.925000000000004,3
w13,16,32,4,2048,768,16,64,128,1,8,4,112.24733333333332,3
w13,16,32,4,2048,768,16,64,128,16,4,3,112.05566666666668,3
w13,16,32,4,2048,768,16,64,128,16,8,4,111.95933333333335,3
w13,16,32,4,2048,768,16,64,128,32,8,4,112.173,3
w13,16,32,4,2048,768,16,128,128,1,8,3,111.17066666666666,3
w13,16,32,4,2048,768,16,128,128,16,8,3,111.76733333333334,3
w13,16,32,4,2048,768,16,128,128,64,8,4,112.16199999999999,3
w13,16,32,6,3072,1024,16,64,128,1,4,5,222.85,3
w13,16,32,6,3072,1024,16,64,128,1,8,3,222.20000000000002,3
w13,16,32,6,3072,1024,16,64,128,16,4,5,222.338,3
w13,16,32,6,3072,1024,16,64,128,64,4,5,222.89266666666666,3
w13,16,32,6,3072,1024,16,64,256,16,4,3,222.61566666666667,3
w13,16,32,6,3072,1024,16,64,256,64,4,3,222.658,3
w13,16,32,6,3072,1024,16,128,128,1,8,4,222.19933333333333,3
w13,16,32,6,3072,1024,16,128,128,1,8,5,222.45533333333333,3
w13,16,32,6,3072,1024,16,128,128,16,8,3,222.45566666666664,3
w13,16,32,6,3072,1024,16,128,128,16,8,5,220.78099999999998,3
w13,16,32,6,3072,1024,16,128,128,32,8,5,222.87166666666667,3
w13,16,32,6,3072,1024,16,128,128,64,8,5,222.13566666666668,3
w13,16,60,4,2048,1408,16,64,128,1,4,2,375.7683333333334,3
w13,16,60,4,2048,1408,16,64,128,1,4,3,374.19,3
w13,16,60,4,2048,1408,16,64,128,16,4,2,375.5336666666667,3
w13,16,60,4,2048,1408,16,64,128,16,4,3,373.90166666666664,3
w13,16,60,4,2048,1408,16,64,128,16,4,5,374.81899999999996,3
w13,16,60,4,2048,1408,16,64,128,16,8,3,373.731,3
w13,16,60,4,2048,1408,16,64,128,32,4,3,375.08566666666667,3
w13,16,60,4,2048,1408,16,64,128,32,8,3,375.118,3
w13,16,60,4,2048,1408,16,64,128,64,4,2,376.42966666666666,3
w13,16,60,4,2048,1408,16,64,128,64,4,3,373.48566666666665,3
w13,16,60,4,2048,1408,16,64,128,64,4,5,374.49966666666666,3
w13,16,60,4,2048,1408,16,64,128,64,8,3,374.5843333333333,3
w13,16,60,4,2048,1408,16,64,256,16,4,3,375.9283333333333,3
w13,16,60,4,2048,1408,16,64,256,32,4,3,376.4086666666667,3
w13,16,60,4,2048,1408,16,64,256,64,4,2,376.26966666666664,3
w13,16,60,4,2048,1408,16,64,256,64,4,3,375.67233333333337,3
w13,16,60,4,2048,1408,16,128,128,1,4,2,376.1523333333334,3
w13,16,60,4,2048,1408,16,128,128,1,4,3,374.81866666666673,3
w13,16,60,4,2048,1408,16,128,128,1,8,3,375.08566666666667,3
w13,16,60,4,2048,1408,16,128,128,16,4,2,373.86966666666666,3
w13,16,60,4,2048,1408,16,128,128,16,4,3,373.5713333333333,3
w13,16,60,4,2048,1408,16,128,128,16,4,5,376.07733333333334,3
w13,16,60,4,2048,1408,16,128,128,16,8,3,373.5606666666667,3
w13,16,60,4,2048,1408,16,128,128,16,8,5,374.083,3
w13,16,60,4,2048,1408,16,128,128,32,4,3,373.2296666666667,3
w13,16,60,4,2048,1408,16,128,128,32,4,5,375.203,3
w13,16,60,4,2048,1408,16,128,128,32,8,3,373.5176666666667,3
w13,16,60,4,2048,1408,16,128,128,32,8,5,376.32300000000004,3
w13,16,60,4,2048,1408,16,128,128,64,4,2,375.7253333333333,3
w13,16,60,4,2048,1408,16,128,128,64,4,3,372.7816666666667,3
w13,16,60,4,2048,1408,16,128,128,64,8,3,375.73600000000005,3
w13,16,60,4,2048,1408,16,128,128,64,8,5,375.16,3
w13,16,60,6,3584,2304,16,64,128,1,4,3,1061.7533333333333,3
w13,16,60,6,3584,2304,16,64,128,16,4,3,1060.0896666666667,3
w13,16,60,6,3584,2304,16,64,128,16,8,3,1064.164,3
w13,16,60,6,3584,2304,16,64,128,32,4,3,1059.5456666666666,3
w13,16,60,6,3584,2304,16,64,128,32,8,3,1063.5456666666666,3
w13,16,60,6,3584,2304,16,64,128,64,4,3,1059.9613333333334,3
w13,16,60,6,3584,2304,16,64,256,1,4,2,1056.9853333333333,3
w13,16,60,6,3584,2304,16,64,256,1,4,3,1056.047,3
w13,16,60,6,3584,2304,16,64,256,1,4,5,1060.5910000000001,3
w13,16,60,6,3584,2304,16,64,256,1,8,3,1060.4523333333334,3
w13,16,60,6,3584,2304,16,64,256,1,8,5,1062.372,3
w13,16,60,6,3584,2304,16,64,256,16,4,2,1056.548,3
w13,16,60,6,3584,2304,16,64,256,16,4,3,1053.6253333333334,3
w13,16,60,6,3584,2304,16,64,256,16,4,5,1060.8786666666667,3
w13,16,60,6,3584,2304,16,64,256,16,8,3,1062.8416666666667,3
w13,16,60,6,3584,2304,16,64,256,32,4,2,1059.1933333333334,3
w13,16,60,6,3584,2304,16,64,256,32,4,3,1056.079,3
w13,16,60,6,3584,2304,16,64,256,32,4,5,1059.0866666666668,3
w13,16,60,6,3584,2304,16,64,256,32,8,5,1064.1746666666666,3
w13,16,60,6,3584,2304,16,64,256,64,4,2,1060.1106666666667,3
w13,16,60,6,3584,2304,16,64,256,64,4,3,1054.8413333333335,3
w13,16,60,6,3584,2304,16,64,256,64,4,5,1063.9293333333333,3
w13,16,60,6,3584,2304,16,128,128,1,4,2,1061.8283333333331,3
w13,16,60,6,3584,2304,16,128,128,1,4,3,1058.628,3
w13,16,60,6,3584,2304,16,128,128,1,4,5,1062.0626666666667,3
w13,16,60,6,3584,2304,16,128,128,1,8,3,1059.8123333333333,3
w13,16,60,6,3584,2304,16,128,128,1,8,5,1061.1773333333333,3
w13,16,60,6,3584,2304,16,128,128,16,4,2,1060.6333333333332,3
w13,16,60,6,3584,2304,16,128,128,16,4,3,1058.0096666666666,3
w13,16,60,6,3584,2304,16,128,128,16,4,5,1061.103,3
w13,16,60,6,3584,2304,16,128,128,16,8,3,1061.3266666666668,3
w13,16,60,6,3584,2304,16,128,128,16,8,5,1064.1643333333334,3
w13,16,60,6,3584,2304,16,128,128,32,4,2,1062.436,3
w13,16,60,6,3584,2304,16,128,128,32,4,3,1058.5426666666665,3
w13,16,60,6,3584,2304,16,128,128,32,4,5,1061.7856666666667,3
w13,16,60,6,3584,2304,16,128,128,32,8,3,1063.332,3
w13,16,60,6,3584,2304,16,128,128,32,8,5,1063.9826666666668,3
w13,16,60,6,3584,2304,16,128,128,64,4,3,1056.9213333333335,3
w13,16,60,6,3584,2304,16,128,128,64,4,5,1063.0866666666668,3
w13,16,60,6,3584,2304,16,128,128,64,8,3,1062.2766666666666,3
w13,16,60,6,3584,2304,32,128,128,4,4,3,1062.8100000000002,3
w13,16,60,6,3584,2304,32,128,128,8,4,3,1063.7163333333335,3
w13,16,60,6,3584,2304,32,128,128,8,4,5,1064.2393333333332,3
w13,16,60,6,3584,2304,32,128,128,64,4,3,1063.407,3
w13,16,60,8,2048,1536,16,64,128,16,4,3,408.749,3
w13,16,60,8,2048,1536,16,64,128,16,4,5,408.38633333333337,3
w13,16,60,8,2048,1536,16,64,128,16,8,3,408.557,3
w13,16,60,8,2048,1536,16,64,128,32,4,3,408.173,3
w13,16,60,8,2048,1536,16,64,128,32,8,3,407.6073333333334,3
w13,16,60,8,2048,1536,16,64,128,64,4,5,408.0876666666666,3
w13,16,60,8,2048,1536,16,64,128,64,8,3,408.96233333333333,3
w13,16,60,8,2048,1536,16,128,128,1,4,3,407.597,3
w13,16,60,8,2048,1536,16,128,128,1,8,3,408.557,3
w13,16,60,8,2048,1536,16,128,128,16,4,3,405.176,3
w13,16,60,8,2048,1536,16,128,128,16,4,5,408.15166666666664,3
w13,16,60,8,2048,1536,16,128,128,16,8,3,406.2636666666667,3
w13,16,60,8,2048,1536,16,128,128,16,8,5,407.28766666666667,3
w13,16,60,8,2048,1536,16,128,128,32,4,2,407.5653333333333,3
w13,16,60,8,2048,1536,16,128,128,32,4,3,405.05833333333334,3
w13,16,60,8,2048,1536,16,128,128,32,4,5,408.8766666666667,3
w13,16,60,8,2048,1536,16,128,128,32,8,3,405.8476666666667,3
w13,16,60,8,2048,1536,16,128,128,64,4,3,406.56166666666667,3
w13,16,60,8,2048,1536,16,128,128,64,8,3,408.8343333333334,3
w13,16,60,8,2048,1536,16,128,128,64,8,5,409.0263333333333,3
w13,16,60,8,2048,1536,32,128,128,8,4,3,408.96233333333333,3
w13,16,60,8,2048,1536,32,128,128,32,8,3,408.728,3
w13,16,64,6,3072,2048,16,64,128,1,4,3,863.2146666666667,3
w13,16,64,6,3072,2048,16,64,128,1,8,3,866.127,3
w13,16,64,6,3072,2048,16,64,128,16,4,2,862.5106666666667,3
w13,16,64,6,3072,2048,16,64,128,16,4,3,862.0306666666667,3
w13,16,64,6,3072,2048,16,64,128,16,8,3,863.3960000000001,3
w13,16,64,6,3072,2048,16,64,128,32,4,2,864.4519999999999,3
w13,16,64,6,3072,2048,16,64,128,32,4,3,861.1563333333334,3
w13,16,64,6,3072,2048,16,64,128,32,4,5,865.4336666666667,3
w13,16,64,6,3072,2048,16,64,128,32,8,3,863.9403333333333,3
w13,16,64,6,3072,2048,16,64,128,64,4,3,862.1906666666667,3
w13,16,64,6,3072,2048,16,64,128,64,4,5,864.9006666666668,3
w13,16,64,6,3072,2048,16,64,128,64,8,3,865.4870000000001,3
w13,16,64,6,3072,2048,16,64,256,1,4,2,859.6523333333333,3
w13,16,64,6,3072,2048,16,64,256,1,4,3,860.5266666666666,3
w13,16,64,6,3072,2048,16,64,256,1,4,5,865.8173333333334,3
w13,16,64,6,3072,2048,16,64,256,16,4,2,859.3106666666666,3
w13,16,64,6,3072,2048,16,64,256,16,4,3,861.3056666666666,3
w13,16,64,6,3072,2048,16,64,256,16,8,3,863.076,3
w13,16,64,6,3072,2048,16,64,256,32,4,2,859.1826666666666,3
w13,16,64,6,3072,2048,16,64,256,32,4,3,861.7323333333334,3
w13,16,64,6,3072,2048,16,64,256,32,8,3,865.636,3
w13,16,64,6,3072,2048,16,64,256,64,4,2,859.087,3
w13,16,64,6,3072,2048,16,64,256,64,4,3,862.1053333333333,3
w13,16,64,6,3072,2048,16,64,256,64,8,3,866.159,3
w13,16,64,6,3072,2048,16,128,128,1,4,2,865.5723333333334,3
w13,16,64,6,3072,2048,16,128,128,1,4,3,862.8946666666667,3
w13,16,64,6,3072,2048,16,128,128,1,4,5,865.4443333333334,3
w13,16,64,6,3072,2048,16,128,128,1,8,3,861.9350000000001,3
w13,16,64,6,3072,2048,16,128,128,1,8,5,865.2736666666666,3
w13,16,64,6,3072,2048,16,128,128,16,4,2,858.7453333333333,3
w13,16,64,6,3072,2048,16,128,128,16,4,3,859.8656666666666,3
w13,16,64,6,3072,2048,16,128,128,16,4,5,860.3243333333334,3
w13,16,64,6,3072,2048,16,128,128,16,8,3,860.1959999999999,3
w13,16,64,6,3072,2048,16,128,128,16,8,5,864.111,3
w13,16,64,6,3072,2048,16,128,128,32,4,2,862.3083333333334,3
w13,16,64,6,3072,2048,16,128,128,32,4,3,857.6573333333332,3
w13,16,64,6,3072,2048,16,128,128,32,4,5,864.6439999999999,3
w13,16,64,6,3072,2048,16,128,128,32,8,3,860.8040000000001,3
w13,16,64,6,3072,2048,16,128,128,64,4,2,865.071,3
w13,16,64,6,3072,2048,16,128,128,64,4,3,861.1026666666667,3
w13,16,64,6,3072,2048,16,128,128,64,4,5,865.0816666666666,3
w13,16,64,6,3072,2048,16,128,128,64,8,3,859.706,3
w13,16,64,6,3072,2048,16,128,128,64,8,5,865.4656666666666,3
w13,16,64,6,3072,2048,32,128,128,1,4,3,863.535,3
w13,16,64,6,3072,2048,32,128,128,4,4,3,861.4446666666666,3
w13,16,64,6,3072,2048,32,128,128,8,4,3,862.2126666666667,3
w13,16,64,6,3072,2048,32,128,128,8,8,3,865.4549999999999,3
w13,16,64,6,3072,2048,32,128,128,16,4,3,862.052,3
w13,16,64,6,3072,2048,32,128,128,16,8,3,865.9993333333333,3
w13,16,64,6,3072,2048,32,128,128,32,4,3,863.3106666666666,3
w13,16,64,6,3072,2048,32,128,128,64,4,3,861.6039999999999,3
w13,16,64,6,3072,2048,32,128,128,64,4,5,865.1673333333333,3
w13,16,64,6,3584,1536,16,64,128,1,4,5,757.465,3
w13,16,64,6,3584,1536,16,64,128,1,8,3,755.6626666666667,3
w13,16,64,6,3584,1536,16,64,256,1,4,2,754.6700000000001,3
w13,16,64,6,3584,1536,16,64,256,1,4,3,750.1266666666667,3
w13,16,64,6,3584,1536,16,64,256,1,4,5,756.9843333333333,3
w13,16,64,6,3584,1536,16,64,256,1,8,3,755.8650000000001,3
w13,16,64,6,3584,1536,16,64,256,16,4,2,755.7579999999999,3
w13,16,64,6,3584,1536,16,64,256,16,4,3,753.5826666666667,3
w13,16,64,6,3584,1536,16,64,256,16,4,5,757.2296666666667,3
w13,16,64,6,3584,1536,16,64,256,32,4,3,755.5343333333334,3
w13,16,64,6,3584,1536,16,64,256,32,4,5,755.8753333333334,3
w13,16,64,6,3584,1536,16,64,256,32,8,3,757.2623333333335,3
w13,16,64,6,3584,1536,16,64,256,64,4,2,757.1346666666667,3
w13,16,64,6,3584,1536,16,64,256,64,4,3,755.5766666666667,3
w13,16,64,6,3584,1536,16,128,128,1,4,3,754.276,3
w13,16,64,6,3584,1536,16,128,128,1,4,5,756.0886666666667,3
w13,16,64,6,3584,1536,16,128,128,1,8,3,755.6093333333333,3
w13,16,64,6,3584,1536,16,128,128,1,8,5,754.7133333333333,3
w13,16,64,6,3584,1536,16,128,128,16,4,3,753.9446666666666,3
w13,16,64,6,3584,1536,16,128,128,16,4,5,757.5613333333334,3
w13,16,64,6,3584,1536,16,128,128,32,4,3,755.0009999999999,3
w13,16,64,8,3584,2560,16,64,128,1,4,3,1255.8999999999999,3
w13,16,64,8,3584,2560,16,64,128,16,4,3,1257.788,3
w13,16,64,8,3584,2560,16,64,128,32,4,3,1255.7936666666667,3
w13,16,64,8,3584,2560,16,64,128,64,4,3,1259.0786666666665,3
w13,16,64,8,3584,2560,16,64,256,1,4,2,1254.268,3
w13,16,64,8,3584,2560,16,64,256,1,4,3,1249.095,3
w13,16,64,8,3584,2560,16,64,256,1,4,5,1254.5773333333334,3
w13,16,64,8,3584,2560,16,64,256,1,8,3,1256.1883333333333,3
w13,16,64,8,3584,2560,16,64,256,1,8,5,1259.1326666666666,3
w13,16,64,8,3584,2560,16,64,256,16,4,2,1253.2653333333333,3
w13,16,64,8,3584,2560,16,64,256,16,4,3,1247.271,3
w13,16,64,8,3584,2560,16,64,256,16,4,5,1255.943,3
w13,16,64,8,3584,2560,16,64,256,16,8,3,1255.8576666666668,3
w13,16,64,8,3584,2560,16,64,256,16,8,5,1258.6843333333334,3
w13,16,64,8,3584,2560,16,64,256,32,4,2,1252.9563333333333,3
w13,16,64,8,3584,2560,16,64,256,32,4,3,1247.7613333333334,3
w13,16,64,8,3584,2560,16,64,256,32,4,5,1257.9056666666668,3
w13,16,64,8,3584,2560,16,64,256,32,8,3,1255.825,3
w13,16,64,8,3584,2560,16,64,256,64,4,2,1253.1266666666668,3
w13,16,64,8,3584,2560,16,64,256,64,4,3,1251.3023333333333,3
w13,16,64,8,3584,2560,16,128,128,1,4,2,1257.5106666666668,3
w13,16,64,8,3584,2560,16,128,128,1,4,3,1254.1193333333333,3
w13,16,64,8,3584,2560,16,128,128,1,4,5,1255.5376666666666,3
w13,16,64,8,3584,2560,16,128,128,1,8,3,1255.1853333333333,3
w13,16,64,8,3584,2560,16,128,128,1,8,5,1254.6843333333334,3
w13,16,64,8,3584,2560,16,128,128,16,4,2,1257.9803333333332,3
w13,16,64,8,3584,2560,16,128,128,16,4,3,1254.1936666666668,3
w13,16,64,8,3584,2560,16,128,128,16,4,5,1255.1856666666665,3
w13,16,64,8,3584,2560,16,128,128,16,8,3,1257.0523333333333,3
w13,16,64,8,3584,2560,16,128,128,16,8,5,1257.82,3
w13,16,64,8,3584,2560,16,128,128,32,4,2,1258.972,3
w13,16,64,8,3584,2560,16,128,128,32,4,3,1257.607,3
w13,16,64,8,3584,2560,16,128,128,32,8,5,1259.5696666666668,3
w13,16,64,8,3584,2560,16,128,128,64,4,2,1258.5986666666665,3
w13,16,64,8,3584,2560,32,128,128,8,4,3,1259.7610000000002,3
w13,16,64,8,3584,2560,32,128,128,16,4,3,1257.4146666666666,3
w13,16,64,8,3584,2560,32,128,128,32,4,3,1259.7403333333332,3
w13,16,128,4,2048,512,16,16,128,1,4,3,148.47233333333335,3
w13,16,128,4,2048,512,16,16,128,4,4,3,149.37833333333333,3
w13,16,128,4,2048,512,16,32,128,1,8,3,149.1436666666667,3
w13,16,128,4,2048,512,16,32,128,4,8,3,149.475,3
w13,16,128,4,2048,512,16,32,128,64,4,4,148.71766666666667,3
w13,16,128,4,2048,512,16,64,128,1,4,3,149.34633333333332,3
w13,16,128,4,2048,512,16,64,128,1,4,5,149.54966666666667,3
w13,16,128,4,2048,512,16,64,128,1,8,2,148.78133333333332,3
w13,16,128,4,2048,512,16,64,128,16,8,2,149.61333333333332,3
w13,16,128,4,2048,512,16,64,128,32,4,3,148.97333333333333,3
w13,16,128,4,2048,512,16,64,128,64,4,4,149.58166666666668,3
w13,16,128,4,2048,512,16,64,256,64,4,3,149.9226666666667,3
w13,16,128,4,2048,512,16,128,128,1,4,3,149.79433333333333,3
w13,16,128,4,2048,512,16,128,128,1,8,3,148.45066666666665,3
w13,16,128,4,2048,512,16,128,128,16,8,3,149.28266666666664,3
w13,16,128,4,2048,512,16,128,128,32,4,3,148.64266666666666,3
w13,16,128,4,2048,512,16,128,128,32,8,3,148.72799999999998,3
w13,16,128,4,2048,512,16,128,128,64,4,3,148.46099999999998,3
w13,16,128,4,2048,512,16,128,128,64,4,4,149.93333333333334,3
w13,16,128,4,2048,512,16,128,128,64,8,3,149.45366666666666,3
w13,16,128,4,2048,512,32,32,128,4,4,3,149.55966666666666,3
w13,16,128,4,2048,512,32,32,128,64,8,3,149.48499999999999,3
w13,16,128,4,2048,512,32,128,128,4,4,3,149.88,3
w13,16,128,4,2048,512,32,128,128,8,4,3,149.84799999999998,3
w13,16,128,6,4096,2048,16,64,256,1,4,2,1701.372,3
w13,16,128,6,4096,2048,16,64,256,1,4,3,1699.0683333333334,3
w13,16,128,6,4096,2048,16,64,256,1,4,5,1703.8466666666666,3
w13,16,128,6,4096,2048,16,64,256,1,8,3,1710.5243333333335,3
w13,16,128,6,4096,2048,16,64,256,1,8,5,1709.3616666666667,3
w13,16,128,6,4096,2048,16,64,256,16,4,2,1704.0600000000002,3
w13,16,128,6,4096,2048,16,64,256,16,4,3,1695.943,3
w13,16,128,6,4096,2048,16,64,256,16,4,5,1701.9583333333333,3
w13,16,128,6,4096,2048,16,64,256,16,8,3,1708.9236666666666,3
w13,16,128,6,4096,2048,16,64,256,16,8,5,1710.972,3
w13,16,128,6,4096,2048,16,64,256,32,4,2,1705.692,3
w13,16,128,6,4096,2048,16,64,256,32,4,3,1697.2969999999998,3
w13,16,128,6,4096,2048,16,64,256,32,4,5,1704.1883333333335,3
w13,16,128,6,4096,2048,16,64,256,32,8,3,1710.588,3
w13,16,128,6,4096,2048,16,64,256,32,8,5,1711.9853333333333,3
w13,16,128,6,4096,2048,16,64,256,64,4,2,1703.2496666666666,3
w13,16,128,6,4096,2048,16,64,256,64,4,3,1696.6996666666666,3
w13,16,128,6,4096,2048,16,64,256,64,4,5,1707.335,3
w13,16,128,6,4096,2048,16,64,256,64,8,3,1710.7696666666668,3
w13,16,128,6,4096,2048,16,64,256,64,8,5,1713.0096666666668,3
w13,16,128,6,4096,2048,16,128,128,16,4,3,1712.7216666666666,3
w13,16,128,8,2048,768,16,64,128,1,4,3,433.923,3
w13,16,128,8,2048,768,16,64,128,1,4,5,433.47499999999997,3
w13,16,128,8,2048,768,16,64,128,32,4,2,432.9636666666667,3
w13,16,128,8,2048,768,16,64,128,32,4,3,431.972,3
w13,16,128,8,2048,768,16,64,128,32,4,5,433.02700000000004,3
w13,16,128,8,2048,768,16,64,128,32,8,3,431.99333333333334,3
w13,16,128,8,2048,768,16,64,128,64,4,2,433.2616666666667,3
w13,16,128,8,2048,768,16,64,128,64,4,3,433.0696666666667,3
w13,16,128,8,2048,768,16,64,128,64,4,5,430.16833333333335,3
w13,16,128,8,2048,768,16,64,128,64,8,3,432.32300000000004,3
w13,16,128,8,2048,768,16,64,256,16,4,2,434.051,3
w13,16,128,8,2048,768,16,64,256,32,4,3,430.809,3
w13,16,128,8,2048,768,16,128,128,1,8,3,433.7846666666667,3
w13,16,128,8,2048,768,16,128,128,16,4,2,431.90799999999996,3
w13,16,128,8,2048,768,16,128,128,16,4,3,431.374,3
w13,16,128,8,2048,768,16,128,128,16,8,3,431.09633333333335,3
w13,16,128,8,2048,768,16,128,128,32,4,2,433.53999999999996,3
w13,16,128,8,2048,768,16,128,128,32,4,3,431.182,3
w13,16,128,8,2048,768,16,128,128,32,4,5,431.7796666666666,3
w13,16,128,8,2048,768,16,128,128,32,8,3,430.00933333333336,3
w13,16,128,8,2048,768,16,128,128,32,8,5,433.2616666666667,3
w13,16,128,8,2048,768,16,128,128,64,4,2,431.1076666666666,3
w13,16,128,8,2048,768,16,128,128,64,4,3,431.097,3
w13,16,128,8,2048,768,16,128,128,64,4,5,433.3576666666666,3
w13,16,128,8,2048,768,16,128,128,64,8,3,431.57633333333337,3
w13,16,128,8,2048,768,16,128,128,64,8,5,432.6433333333334,3
w13,16,128,8,2048,768,32,128,128,32,4,3,431.747,3
w13,16,128,8,4096,1536,16,64,128,32,4,3,1712.4126666666668,3
w13,16,128,8,4096,1536,16,64,256,1,4,2,1706.9620000000002,3
w13,16,128,8,4096,1536,16,64,256,1,4,3,1698.0126666666667,3
w13,16,128,8,4096,1536,16,64,256,1,4,5,1705.2023333333334,3
w13,16,128,8,4096,1536,16,64,256,1,8,3,1709.202,3
w13,16,128,8,4096,1536,16,64,256,1,8,5,1709.0633333333335,3
w13,16,128,8,4096,1536,16,64,256,16,4,2,1704.8073333333334,3
w13,16,128,8,4096,1536,16,64,256,16,4,3,1699.1109999999999,3
w13,16,128,8,4096,1536,16,64,256,16,4,5,1703.0153333333335,3
w13,16,128,8,4096,1536,16,64,256,16,8,3,1707.5379999999998,3
w13,16,128,8,4096,1536,16,64,256,16,8,5,1706.7913333333333,3
w13,16,128,8,4096,1536,16,64,256,32,4,2,1703.3886666666667,3
w13,16,128,8,4096,1536,16,64,256,32,4,3,1695.8896666666667,3
w13,16,128,8,4096,1536,16,64,256,32,4,5,1701.6286666666667,3
w13,16,128,8,4096,1536,16,64,256,32,8,3,1710.2043333333334,3
w13,16,128,8,4096,1536,16,64,256,32,8,5,1707.0690000000002,3
w13,16,128,8,4096,1536,16,64,256,64,4,2,1701.191,3
w13,16,128,8,4096,1536,16,64,256,64,4,3,1699.666,3
w13,16,128,8,4096,1536,16,64,256,64,4,5,1705.7033333333331,3
w13,16,128,8,4096,1536,16,64,256,64,8,3,1711.0256666666667,3
w13,16,128,8,4096,1536,16,64,256,64,8,5,1712.5833333333333,3
w13,16,128,8,4096,1536,16,128,128,1,4,3,1711.687,3
w13,16,128,8,4096,3072,16,64,128,16,4,3,3416.0696666666663,3
w13,16,128,8,4096,3072,16,64,256,1,4,2,3393.5946666666664,3
w13,16,128,8,4096,3072,16,64,256,1,4,3,3383.610666666667,3
w13,16,128,8,4096,3072,16,64,256,1,4,5,3399.141333333333,3
w13,16,128,8,4096,3072,16,64,256,1,8,3,3408.7306666666664,3
w13,16,128,8,4096,3072,16,64,256,1,8,5,3406.2990000000004,3
w13,16,128,8,4096,3072,16,64,256,16,4,2,3386.0743333333335,3
w13,16,128,8,4096,3072,16,64,256,16,4,3,3382.1920000000005,3
w13,16,128,8,4096,3072,16,64,256,16,4,5,3392.304,3
w13,16,128,8,4096,3072,16,64,256,16,8,3,3406.5550000000003,3
w13,16,128,8,4096,3072,16,64,256,16,8,5,3398.8216666666667,3
w13,16,128,8,4096,3072,16,64,256,32,4,2,3389.3916666666664,3
w13,16,128,8,4096,3072,16,64,256,32,4,3,3384.1756666666665,3
w13,16,128,8,4096,3072,16,64,256,32,4,5,3394.4266666666667,3
w13,16,128,8,4096,3072,16,64,256,32,8,3,3404.0480000000002,3
w13,16,128,8,4096,3072,16,64,256,32,8,5,3404.986666666666,3
w13,16,128,8,4096,3072,16,64,256,64,4,2,3396.24,3
w13,16,128,8,4096,3072,16,64,256,64,4,3,3384.378666666667,3
w13,16,128,8,4096,3072,16,64,256,64,4,5,3397.0826666666667,3
w13,16,128,8,4096,3072,16,64,256,64,8,3,3404.208,3
w13,16,128,8,4096,3072,16,64,256,64,8,5,3414.3520000000003,3
w13,16,128,8,4096,3072,16,128,128,16,4,2,3410.438,3
w13,16,128,8,4096,3072,16,128,128,16,4,3,3413.926333333333,3
w13,16,128,8,4096,3072,16,128,128,32,4,2,3412.5713333333333,3
w13,16,128,8,4096,3072,16,128,128,64,4,2,3414.726,3
w13,24,8,2,1024,512,16,128,64,1,4,4,9.623,3
w13,24,8,2,1024,512,16,128,64,1,4,5,9.687,3
w13,24,16,2,1536,768,16,128,128,1,8,2,45.911333333333324,3
w13,24,16,2,1536,768,16,128,128,1,8,3,45.79366666666667,3
w13,24,16,2,1536,768,16,128,128,1,8,4,45.52733333333333,3
w13,24,16,2,1536,768,16,128,128,16,8,3,45.815333333333335,3
w13,24,16,2,1536,768,16,128,128,32,8,3,45.911333333333324,3
w13,24,16,4,1536,1024,16,64,128,1,4,2,59.842000000000006,3
w13,24,16,4,1536,1024,16,64,128,1,8,2,59.681999999999995,3
w13,24,16,4,1536,1024,16,64,128,16,4,2,59.54366666666667,3
w13,24,16,4,1536,1024,16,64,128,32,4,2,59.852666666666664,3
w13,24,16,4,1536,1024,16,64,128,64,4,2,59.63966666666667,3
w13,24,32,4,2048,768,16,32,128,64,4,2,112.472,3
w13,24,32,4,2048,768,16,64,128,16,4,3,112.24766666666666,3
w13,24,32,4,2048,768,16,64,128,64,4,5,112.664,3
w13,24,32,4,2048,768,16,128,128,1,4,2,112.56733333333334,3
w13,24,32,4,2048,768,16,128,128,1,8,3,112.50366666666666,3
w13,24,32,4,2048,768,16,128,128,16,4,2,112.05533333333334,3
w13,24,32,4,2048,768,16,128,128,32,8,3,111.73566666666666,3
w13,24,32,4,2048,768,16,128,128,64,4,2,112.85533333333335,3
w13,24,32,4,2048,768,16,128,128,64,8,3,112.84500000000001,3
w13,24,32,6,3072,1024,16,64,128,1,8,5,223.84233333333336,3
w13,24,32,6,3072,1024,16,64,128,32,8,3,224.184,3
w13,24,32,6,3072,1024,16,64,128,64,8,3,224.16233333333335,3
w13,24,32,6,3072,1024,16,64,256,1,4,3,224.02366666666663,3
w13,24,32,6,3072,1024,16,64,256,16,4,3,224.034,3
w13,24,32,6,3072,1024,16,128,128,1,4,3,223.71433333333334,3
w13,24,32,6,3072,1024,16,128,128,1,8,3,223.896,3
w13,24,32,6,3072,1024,16,128,128,1,8,4,223.70333333333335,3
w13,24,32,6,3072,1024,16,128,128,1,8,5,223.821,3
w13,24,32,6,3072,1024,16,128,128,16,8,3,224.30066666666667,3
w13,24,32,6,3072,1024,16,128,128,16,8,5,222.59433333333334,3
w13,24,32,6,3072,1024,16,128,128,32,4,3,222.53066666666666,3
w13,24,32,6,3072,1024,16,128,128,32,4,5,224.1303333333333,3
w13,24,32,6,3072,1024,16,128,128,32,8,5,224.00233333333333,3
w13,24,32,6,3072,1024,16,128,128,64,4,3,224.25833333333335,3
w13,24,32,6,3072,1024,16,128,128,64,8,3,223.46900000000002,3
w13,24,32,6,3072,1024,16,128,128,64,8,5,222.125,3
w13,24,32,6,3072,1024,32,32,256,16,4,2,223.68266666666668,3
w13,24,32,6,3072,1024,32,32,256,32,4,2,224.1726666666667,3
w13,24,60,4,2048,1408,16,16,128,4,4,5,376.84566666666666,3
w13,24,60,4,2048,1408,16,64,128,1,4,3,377.05899999999997,3
w13,24,60,4,2048,1408,16,64,128,1,8,3,376.067,3
w13,24,60,4,2048,1408,16,64,128,16,4,3,375.38433333333336,3
w13,24,60,4,2048,1408,16,64,128,16,4,5,376.5043333333333,3
w13,24,60,4,2048,1408,16,64,128,16,8,3,373.912,3
w13,24,60,4,2048,1408,16,64,128,32,4,2,376.942,3
w13,24,60,4,2048,1408,16,64,128,32,4,3,375.491,3
w13,24,60,4,2048,1408,16,64,128,32,8,3,375.8323333333333,3
w13,24,60,4,2048,1408,16,64,128,64,4,3,375.7683333333334,3
w13,24,60,4,2048,1408,16,64,128,64,4,5,376.7176666666667,3
w13,24,60,4,2048,1408,16,64,128,64,8,3,376.3123333333333,3
w13,24,60,4,2048,1408,16,64,256,16,4,3,376.568,3
w13,24,60,4,2048,1408,16,64,256,64,4,3,376.984,3
w13,24,60,4,2048,1408,16,128,128,1,4,2,376.5043333333333,3
w13,24,60,4,2048,1408,16,128,128,1,4,3,374.7336666666667,3
w13,24,60,4,2048,1408,16,128,128,1,8,3,376.792,3
w13,24,60,4,2048,1408,16,128,128,1,8,5,376.93100000000004,3
w13,24,60,4,2048,1408,16,128,128,16,4,3,373.49666666666667,3
w13,24,60,4,2048,1408,16,128,128,16,4,5,375.939,3
w13,24,60,4,2048,1408,16,128,128,16,8,3,373.84833333333336,3
w13,24,60,4,2048,1408,16,128,128,16,8,5,377.1656666666667,3
w13,24,60,4,2048,1408,16,128,128,32,8,3,377.134,3
w13,24,60,4,2048,1408,16,128,128,32,8,5,375.70433333333335,3
w13,24,60,4,2048,1408,16,128,128,64,4,3,375.36266666666666,3
w13,24,60,4,2048,1408,16,128,128,64,8,3,376.483,3
w13,24,60,4,2048,1408,16,128,128,64,8,5,376.36566666666664,3
w13,24,60,6,3584,2304,16,64,128,16,4,3,1064.8253333333332,3
w13,24,60,6,3584,2304,16,64,128,32,4,3,1065.2103333333332,3
w13,24,60,6,3584,2304,16,64,128,64,4,3,1065.5510000000002,3
w13,24,60,6,3584,2304,16,64,256,1,4,2,1061.6786666666667,3
w13,24,60,6,3584,2304,16,64,256,1,4,3,1055.7803333333334,3
w13,24,60,6,3584,2304,16,64,256,1,4,5,1064.9650000000001,3
w13,24,60,6,3584,2304,16,64,256,1,8,3,1063.3436666666666,3
w13,24,60,6,3584,2304,16,64,256,16,4,2,1061.082,3
w13,24,60,6,3584,2304,16,64,256,16,4,3,1055.9293333333333,3
w13,24,60,6,3584,2304,16,64,256,16,4,5,1062.191,3
w13,24,60,6,3584,2304,16,64,256,32,4,2,1061.9993333333334,3
w13,24,60,6,3584,2304,16,64,256,32,4,3,1060.41,3
w13,24,60,6,3584,2304,16,64,256,32,4,5,1065.146,3
w13,24,60,6,3584,2304,16,64,256,32,8,3,1064.9536666666665,3
w13,24,60,6,3584,2304,16,64,256,32,8,5,1066.0203333333332,3
w13,24,60,6,3584,2304,16,64,256,64,4,2,1061.22,3
w13,24,60,6,3584,2304,16,64,256,64,4,3,1057.637,3
w13,24,60,6,3584,2304,16,128,128,1,4,2,1063.1513333333332,3
w13,24,60,6,3584,2304,16,128,128,1,4,3,1060.25,3
w13,24,60,6,3584,2304,16,128,128,1,4,5,1064.4840000000002,3
w13,24,60,6,3584,2304,16,128,128,1,8,3,1060.335,3
w13,24,60,6,3584,2304,16,128,128,1,8,5,1065.5083333333334,3
w13,24,60,6,3584,2304,16,128,128,16,4,2,1066.245,3
w13,24,60,6,3584,2304,16,128,128,16,4,3,1061.615,3
w13,24,60,6,3584,2304,16,128,128,16,4,5,1062.5966666666666,3
w13,24,60,6,3584,2304,16,128,128,16,8,3,1064.7836666666665,3
w13,24,60,6,3584,2304,16,128,128,16,8,5,1064.8583333333333,3
w13,24,60,6,3584,2304,16,128,128,32,4,3,1062.5963333333332,3
w13,24,60,6,3584,2304,16,128,128,32,4,5,1064.5696666666665,3
w13,24,60,6,3584,2304,16,128,128,32,8,3,1062.9273333333333,3
w13,24,60,6,3584,2304,16,128,128,64,4,3,1060.9436666666668,3
w13,24,60,6,3584,2304,16,128,128,64,4,5,1066.33,3
w13,24,60,6,3584,2304,16,128,128,64,8,5,1065.86,3
w13,24,60,6,3584,2304,32,128,128,1,4,3,1062.6183333333333,3
w13,24,60,6,3584,2304,32,128,128,16,4,3,1065.797,3
w13,24,60,6,3584,2304,32,128,128,64,4,3,1065.8396666666667,3
w13,24,60,8,2048,1536,16,64,128,16,4,3,411.032,3
w13,24,60,8,2048,1536,16,64,128,16,8,3,411.192,3
w13,24,60,8,2048,1536,16,64,128,32,4,3,411.11699999999996,3
w13,24,60,8,2048,1536,16,64,128,64,8,3,411.4373333333333,3
w13,24,60,8,2048,1536,16,128,128,1,8,3,410.74399999999997,3
w13,24,60,8,2048,1536,16,128,128,16,4,2,407.92800000000005,3
w13,24,60,8,2048,1536,16,128,128,16,4,3,407.512,3
w13,24,60,8,2048,1536,16,128,128,16,4,5,411.24500000000006,3
w13,24,60,8,2048,1536,16,128,128,16,8,3,408.37566666666663,3
w13,24,60,8,2048,1536,16,128,128,32,4,3,408.461,3
w13,24,60,8,2048,1536,16,128,128,32,4,5,411.21299999999997,3
w13,24,60,8,2048,1536,16,128,128,32,8,3,409.368,3
w13,24,60,8,2048,1536,16,128,128,32,8,5,411.17066666666665,3
w13,24,60,8,2048,1536,16,128,128,64,4,3,408.46133333333336,3
w13,24,60,8,2048,1536,16,128,128,64,4,5,411.4796666666667,3
w13,24,60,8,2048,1536,16,128,128,64,8,3,410.0183333333334,3
w13,24,60,8,2048,1536,16,128,128,64,8,5,410.488,3
w13,24,64,6,3072,2048,16,64,128,1,4,3,867.0660000000001,3
w13,24,64,6,3072,2048,16,64,128,1,8,3,865.7006666666666,3
w13,24,64,6,3072,2048,16,64,128,16,4,2,866.7886666666667,3
w13,24,64,6,3072,2048,16,64,128,16,4,3,863.4713333333333,3
w13,24,64,6,3072,2048,16,64,128,16,4,5,865.7330000000001,3
w13,24,64,6,3072,2048,16,64,128,16,8,3,865.4126666666666,3
w13,24,64,6,3072,2048,16,64,128,32,4,2,868.015,3
w13,24,64,6,3072,2048,16,64,128,32,4,3,863.1403333333334,3
w13,24,64,6,3072,2048,16,64,128,32,8,3,866.6923333333334,3
w13,24,64,6,3072,2048,16,64,128,64,4,3,863.4393333333334,3
w13,24,64,6,3072,2048,16,64,128,64,4,5,867.663,3
w13,24,64,6,3072,2048,16,64,128,64,8,3,868.773,3
w13,24,64,6,3072,2048,16,64,256,1,4,2,865.3806666666666,3
w13,24,64,6,3072,2048,16,64,256,1,4,3,863.247,3
w13,24,64,6,3072,2048,16,64,256,1,4,5,867.8553333333333,3
w13,24,64,6,3072,2048,16,64,256,1,8,3,865.3696666666666,3
w13,24,64,6,3072,2048,16,64,256,16,4,2,864.5480000000001,3
w13,24,64,6,3072,2048,16,64,256,16,4,3,860.6446666666667,3
w13,24,64,6,3072,2048,16,64,256,16,4,5,868.3346666666666,3
w13,24,64,6,3072,2048,16,64,256,16,8,3,867.0020000000001,3
w13,24,64,6,3072,2048,16,64,256,32,4,2,862.4153333333334,3
w13,24,64,6,3072,2048,16,64,256,32,4,3,860.111,3
w13,24,64,6,3072,2048,16,64,256,32,4,5,868.591,3
w13,24,64,6,3072,2048,16,64,256,64,4,2,864.0476666666667,3
w13,24,64,6,3072,2048,16,64,256,64,4,3,866.074,3
w13,24,64,6,3072,2048,16,128,128,1,4,2,863.29,3
w13,24,64,6,3072,2048,16,128,128,1,4,3,864.7193333333335,3
w13,24,64,6,3072,2048,16,128,128,1,4,5,867.418,3
w13,24,64,6,3072,2048,16,128,128,1,8,3,864.8466666666667,3
w13,24,64,6,3072,2048,16,128,128,16,4,2,861.4446666666666,3
w13,24,64,6,3072,2048,16,128,128,16,4,3,861.1240000000001,3
w13,24,64,6,3072,2048,16,128,128,16,4,5,864.2286666666668,3
w13,24,64,6,3072,2048,16,128,128,16,8,3,862.2550000000001,3
w13,24,64,6,3072,2048,16,128,128,16,8,5,865.029,3
w13,24,64,6,3072,2048,16,128,128,32,4,2,864.6126666666668,3
w13,24,64,6,3072,2048,16,128,128,32,4,3,860.9643333333333,3
w13,24,64,6,3072,2048,16,128,128,32,4,5,862.4903333333333,3
w13,24,64,6,3072,2048,16,128,128,32,8,3,864.6663333333332,3
w13,24,64,6,3072,2048,16,128,128,32,8,5,863.7703333333334,3
w13,24,64,6,3072,2048,16,128,128,64,4,2,860.997,3
w13,24,64,6,3072,2048,16,128,128,64,4,3,862.1376666666666,3
w13,24,64,6,3072,2048,16,128,128,64,4,5,865.9453333333335,3
w13,24,64,6,3072,2048,16,128,128,64,8,3,862.692,3
w13,24,64,6,3072,2048,16,128,128,64,8,5,867.7373333333334,3
w13,24,64,6,3072,2048,32,128,128,1,4,3,868.1329999999999,3
w13,24,64,6,3072,2048,32,128,128,4,4,3,865.9886666666666,3
w13,24,64,6,3072,2048,32,128,128,4,4,5,867.5996666666666,3
w13,24,64,6,3072,2048,32,128,128,8,4,3,864.9753333333333,3
w13,24,64,6,3072,2048,32,128,128,16,4,3,865.743,3
w13,24,64,6,3072,2048,32,128,128,32,4,3,865.37,3
w13,24,64,6,3072,2048,32,128,128,32,4,5,868.5596666666667,3
w13,24,64,6,3072,2048,32,128,128,64,4,3,866.884,3
w13,24,64,6,3584,1536,16,64,128,1,4,3,757.5393333333333,3
w13,24,64,6,3584,1536,16,64,128,1,4,5,758.7026666666667,3
w13,24,64,6,3584,1536,16,64,128,1,8,3,759.0333333333334,3
w13,24,64,6,3584,1536,16,64,128,16,4,3,761.4013333333334,3
w13,24,64,6,3584,1536,16,64,128,16,4,5,760.8886666666667,3
w13,24,64,6,3584,1536,16,64,128,16,8,3,760.6866666666666,3
w13,24,64,6,3584,1536,16,64,128,32,4,3,760.7400000000001,3
w13,24,64,6,3584,1536,16,64,256,1,4,2,755.1933333333333,3
w13,24,64,6,3584,1536,16,64,256,1,4,3,754.4140000000001,3
w13,24,64,6,3584,1536,16,64,256,1,4,5,757.859,3
w13,24,64,6,3584,1536,16,64,256,1,8,3,756.4093333333334,3
w13,24,64,6,3584,1536,16,64,256,1,8,5,760.4736666666668,3
w13,24,64,6,3584,1536,16,64,256,16,4,2,757.3586666666666,3
w13,24,64,6,3584,1536,16,64,256,16,4,3,755.5986666666668,3
w13,24,64,6,3584,1536,16,64,256,16,4,5,758.1370000000001,3
w13,24,64,6,3584,1536,16,64,256,16,8,3,759.5666666666666,3
w13,24,64,6,3584,1536,16,64,256,32,4,2,757.2943333333333,3
w13,24,64,6,3584,1536,16,64,256,32,4,3,756.377,3
w13,24,64,6,3584,1536,16,64,256,32,4,5,760.6863333333334,3
w13,24,64,6,3584,1536,16,64,256,32,8,3,760.0569999999999,3
w13,24,64,6,3584,1536,16,64,256,64,4,2,759.225,3
w13,24,64,6,3584,1536,16,64,256,64,4,3,758.2653333333333,3
w13,24,64,6,3584,1536,16,64,256,64,8,3,761.774,3
w13,24,64,6,3584,1536,16,128,128,1,4,2,760.7293333333333,3
w13,24,64,6,3584,1536,16,128,128,1,4,3,755.534,3
w13,24,64,6,3584,1536,16,128,128,1,4,5,757.1883333333334,3
w13,24,64,6,3584,1536,16,128,128,1,8,3,757.5826666666667,3
w13,24,64,6,3584,1536,16,128,128,1,8,5,759.3000000000001,3
w13,24,64,6,3584,1536,16,128,128,16,4,3,758.5,3
w13,24,64,6,3584,1536,16,128,128,16,4,5,759.0966666666667,3
w13,24,64,6,3584,1536,16,128,128,16,8,3,761.2093333333333,3
w13,24,64,6,3584,1536,16,128,128,16,8,5,758.852,3
w13,24,64,6,3584,1536,16,128,128,32,4,2,761.998,3
w13,24,64,6,3584,1536,16,128,128,32,4,3,755.5986666666668,3
w13,24,64,6,3584,1536,16,128,128,32,8,3,762.0193333333333,3
w13,24,64,6,3584,1536,16,128,128,64,4,2,761.3796666666667,3
w13,24,64,6,3584,1536,16,128,128,64,4,5,759.4813333333333,3
w13,24,64,6,3584,1536,32,128,128,1,4,3,760.0036666666666,3
w13,24,64,6,3584,1536,32,128,128,1,4,5,761.7426666666667,3
w13,24,64,6,3584,1536,32,128,128,4,4,5,761.3693333333334,3
w13,24,64,6,3584,1536,32,128,128,8,4,3,760.1,3
w13,24,64,6,3584,1536,32,128,128,16,4,3,760.1,3
w13,24,64,6,3584,1536,32,128,128,32,4,3,761.2733333333332,3
w13,24,64,8,3584,2560,16,64,128,1,4,3,1265.448,3
w13,24,64,8,3584,2560,16,64,128,16,4,3,1264.4763333333333,3
w13,24,64,8,3584,2560,16,64,128,32,4,3,1264.5403333333334,3
w13,24,64,8,3584,2560,16,64,256,1,4,2,1253.7250000000001,3
w13,24,64,8,3584,2560,16,64,256,1,4,3,1255.0683333333334,3
w13,24,64,8,3584,2560,16,64,256,1,4,5,1260.8606666666667,3
w13,24,64,8,3584,2560,16,64,256,1,8,3,1260.8396666666667,3
w13,24,64,8,3584,2560,16,64,256,1,8,5,1264.8503333333333,3
w13,24,64,8,3584,2560,16,64,256,16,4,2,1256.2740000000001,3
w13,24,64,8,3584,2560,16,64,256,16,4,3,1255.9433333333334,3
w13,24,64,8,3584,2560,16,64,256,16,4,5,1263.1109999999999,3
w13,24,64,8,3584,2560,16,64,256,16,8,3,1262.6523333333332,3
w13,24,64,8,3584,2560,16,64,256,32,4,2,1256.6683333333333,3
w13,24,64,8,3584,2560,16,64,256,32,4,3,1254.749,3
w13,24,64,8,3584,2560,16,64,256,32,4,5,1263.0043333333333,3
w13,24,64,8,3584,2560,16,64,256,32,8,3,1263.7513333333334,3
w13,24,64,8,3584,2560,16,64,256,64,4,2,1258.471,3
w13,24,64,8,3584,2560,16,64,256,64,4,3,1256.936,3
w13,24,64,8,3584,2560,16,128,128,1,4,2,1259.762,3
w13,24,64,8,3584,2560,16,128,128,1,4,3,1262.2043333333334,3
w13,24,64,8,3584,2560,16,128,128,1,4,5,1261.4683333333332,3
w13,24,64,8,3584,2560,16,128,128,1,8,3,1262.7806666666668,3
w13,24,64,8,3584,2560,16,128,128,1,8,5,1260.392,3
w13,24,64,8,3584,2560,16,128,128,16,4,2,1260.0613333333333,3
w13,24,64,8,3584,2560,16,128,128,16,4,3,1256.999,3
w13,24,64,8,3584,2560,16,128,128,16,4,5,1260.0396666666668,3
w13,24,64,8,3584,2560,16,128,128,16,8,3,1260.2740000000001,3
w13,24,64,8,3584,2560,16,128,128,16,8,5,1260.381,3
w13,24,64,8,3584,2560,16,128,128,32,4,2,1255.3356666666666,3
w13,24,64,8,3584,2560,16,128,128,32,4,3,1263.111,3
w13,24,64,8,3584,2560,16,128,128,32,4,5,1264.4126666666666,3
w13,24,64,8,3584,2560,16,128,128,32,8,3,1263.6553333333334,3
w13,24,64,8,3584,2560,16,128,128,32,8,5,1264.018,3
w13,24,64,8,3584,2560,16,128,128,64,4,2,1265.1593333333333,3
w13,24,64,8,3584,2560,16,128,128,64,4,3,1259.0153333333335,3
w13,24,64,8,3584,2560,32,128,128,1,4,3,1261.9066666666668,3
w13,24,64,8,3584,2560,32,128,128,1,4,5,1263.9223333333332,3
w13,24,64,8,3584,2560,32,128,128,8,4,3,1263.2076666666667,3
w13,24,64,8,3584,2560,32,128,128,8,4,5,1264.6046666666668,3
w13,24,64,8,3584,2560,32,128,128,32,4,3,1264.8500000000001,3
w13,24,128,4,2048,512,16,32,128,1,4,3,220.48300000000003,3
w13,24,128,4,2048,512,16,64,128,1,4,3,220.8456666666667,3
w13,24,128,4,2048,512,16,64,128,1,8,3,221.06966666666668,3
w13,24,128,4,2048,512,16,64,128,32,4,3,221.06966666666668,3
w13,24,128,4,2048,512,16,64,128,32,4,5,220.419,3
w13,24,128,4,2048,512,16,64,128,64,4,3,220.81366666666668,3
w13,24,128,4,2048,512,16,128,128,1,4,2,221.08033333333333,3
w13,24,128,4,2048,512,16,128,128,1,4,3,221.38966666666667,3
w13,24,128,4,2048,512,16,128,128,16,8,3,219.96033333333332,3
w13,24,128,4,2048,512,16,128,128,32,4,2,220.952,3
w13,24,128,4,2048,512,16,128,128,32,8,3,221.38966666666667,3
w13,24,128,4,2048,512,16,128,128,64,4,3,221.1336666666667,3
w13,24,128,4,2048,512,16,128,128,64,8,3,219.19233333333332,3
w13,24,128,4,2048,512,16,128,128,64,8,4,220.82433333333333,3
w13,24,128,4,2048,512,16,128,128,64,8,5,221.08066666666664,3
w13,24,128,4,2048,512,32,64,128,64,4,3,220.58966666666666,3
w13,24,128,6,4096,2048,16,64,128,1,4,3,2282.357,3
w13,24,128,6,4096,2048,16,64,128,16,4,3,2283.231333333333,3
w13,24,128,6,4096,2048,16,64,128,32,4,3,2281.898333333333,3
w13,24,128,6,4096,2048,16,64,256,1,4,2,2269.7490000000003,3
w13,24,128,6,4096,2048,16,64,256,1,4,3,2261.802,3
w13,24,128,6,4096,2048,16,64,256,1,4,5,2266.3783333333336,3
w13,24,128,6,4096,2048,16,64,256,1,8,3,2275.8293333333336,3
w13,24,128,6,4096,2048,16,64,256,1,8,5,2279.957,3
w13,24,128,6,4096,2048,16,64,256,16,4,2,2273.6956666666665,3
w13,24,128,6,4096,2048,16,64,256,16,4,3,2261.141,3
w13,24,128,6,4096,2048,16,64,256,16,4,5,2268.4796666666666,3
w13,24,128,6,4096,2048,16,64,256,16,8,3,2278.7726666666663,3
w13,24,128,6,4096,2048,16,64,256,16,8,5,2278.7729999999997,3
w13,24,128,6,4096,2048,16,64,256,32,4,2,2265.898333333333,3
w13,24,128,6,4096,2048,16,64,256,32,4,3,2261.5570000000002,3
w13,24,128,6,4096,2048,16,64,256,32,4,5,2268.362333333333,3
w13,24,128,6,4096,2048,16,64,256,32,8,3,2275.2426666666665,3
w13,24,128,6,4096,2048,16,64,256,32,8,5,2276.4796666666666,3
w13,24,128,6,4096,2048,16,64,256,64,4,2,2269.7703333333334,3
w13,24,128,6,4096,2048,16,64,256,64,4,3,2265.6739999999995,3
w13,24,128,6,4096,2048,16,64,256,64,4,5,2274.592,3
w13,24,128,6,4096,2048,16,64,256,64,8,3,2281.7923333333333,3
w13,24,128,6,4096,2048,16,64,256,64,8,5,2281.781333333333,3
w13,24,128,6,4096,2048,16,128,128,1,4,5,2283.8826666666664,3
w13,24,128,6,4096,2048,16,128,128,16,4,2,2281.173666666667,3
w13,24,128,6,4096,2048,16,128,128,32,4,2,2280.8643333333334,3
w13,24,128,6,4096,2048,16,128,128,64,4,2,2282.0376666666666,3
w13,24,128,8,2048,768,16,64,128,1,4,3,432.60133333333334,3
w13,24,128,8,2048,768,16,64,128,16,4,3,433.529,3
w13,24,128,8,2048,768,16,64,128,16,4,5,434.65933333333334,3
w13,24,128,8,2048,768,16,64,128,32,4,3,431.86533333333335,3
w13,24,128,8,2048,768,16,64,128,32,8,3,434.606,3
w13,24,128,8,2048,768,16,64,128,64,4,3,433.25100000000003,3
w13,24,128,8,2048,768,16,64,128,64,4,5,433.828,3
w13,24,128,8,2048,768,16,64,256,32,4,2,434.4243333333333,3
w13,24,128,8,2048,768,16,64,256,64,4,3,434.382,3
w13,24,128,8,2048,768,16,128,128,1,4,2,434.79866666666663,3
w13,24,128,8,2048,768,16,128,128,16,4,2,433.028,3
w13,24,128,8,2048,768,16,128,128,16,4,3,434.8413333333333,3
w13,24,128,8,2048,768,16,128,128,16,4,5,433.796,3
w13,24,128,8,2048,768,16,128,128,16,8,3,432.3016666666667,3
w13,24,128,8,2048,768,16,128,128,16,8,5,433.251,3
w13,24,128,8,2048,768,16,128,128,32,4,2,433.0273333333333,3
w13,24,128,8,2048,768,16,128,128,32,4,3,430.99066666666664,3
w13,24,128,8,2048,768,16,128,128,32,4,5,434.18966666666665,3
w13,24,128,8,2048,768,16,128,128,32,8,3,434.03000000000003,3
w13,24,128,8,2048,768,16,128,128,64,4,2,433.5933333333333,3
w13,24,128,8,2048,768,16,128,128,64,4,3,431.588,3
w13,24,128,8,2048,768,16,128,128,64,8,3,430.499,3
w13,24,128,8,2048,768,32,128,128,32,4,3,434.47866666666664,3
w13,24,128,8,4096,1536,16,64,128,32,4,3,1717.6616666666666,3
w13,24,128,8,4096,1536,16,64,256,1,4,2,1708.446,3
w13,24,128,8,4096,1536,16,64,256,1,4,3,1701.097,3
w13,24,128,8,4096,1536,16,64,256,1,4,5,1706.0986666666668,3
w13,24,128,8,4096,1536,16,64,256,1,8,3,1712.2216666666666,3
w13,24,128,8,4096,1536,16,64,256,1,8,5,1712.329,3
w13,24,128,8,4096,1536,16,64,256,16,4,2,1710.3873333333333,3
w13,24,128,8,4096,1536,16,64,256,16,4,3,1701.3093333333334,3
w13,24,128,8,4096,1536,16,64,256,16,4,5,1704.062,3
w13,24,128,8,4096,1536,16,64,256,16,8,3,1714.7823333333333,3
w13,24,128,8,4096,1536,16,64,256,16,8,5,1712.4776666666667,3
w13,24,128,8,4096,1536,16,64,256,32,4,2,1706.238,3
w13,24,128,8,4096,1536,16,64,256,32,4,3,1704.4886666666669,3
w13,24,128,8,4096,1536,16,64,256,32,4,5,1704.7023333333334,3
w13,24,128,8,4096,1536,16,64,256,32,8,3,1709.555,3
w13,24,128,8,4096,1536,16,64,256,32,8,5,1714.611,3
w13,24,128,8,4096,1536,16,64,256,64,4,2,1706.302,3
w13,24,128,8,4096,1536,16,64,256,64,4,3,1702.6533333333334,3
w13,24,128,8,4096,1536,16,64,256,64,4,5,1708.4673333333333,3
w13,24,128,8,4096,1536,16,64,256,64,8,3,1715.859333333333,3
w13,24,128,8,4096,1536,16,64,256,64,8,5,1715.8063333333332,3
w13,24,128,8,4096,1536,16,128,128,1,4,3,1717.054,3
w13,24,128,8,4096,1536,16,128,128,32,4,2,1715.689,3
w13,24,128,8,4096,1536,16,128,128,32,4,3,1715.5503333333334,3
w13,24,128,8,4096,1536,16,128,128,64,4,2,1716.9579999999999,3
w13,24,128,8,4096,1536,16,128,128,64,4,3,1711.6246666666666,3
w13,24,128,8,4096,3072,16,64,128,16,4,2,3425.0203333333334,3
w13,24,128,8,4096,3072,16,64,128,16,4,3,3422.525,3
w13,24,128,8,4096,3072,16,64,128,32,4,3,3425.1703333333335,3
w13,24,128,8,4096,3072,16,64,128,64,4,3,3420.828666666667,3
w13,24,128,8,4096,3072,16,64,256,1,4,2,3402.855,3
w13,24,128,8,4096,3072,16,64,256,1,4,3,3391.8259999999996,3
w13,24,128,8,4096,3072,16,64,256,1,4,5,3402.951333333333,3
w13,24,128,8,4096,3072,16,64,256,1,8,3,3413.778,3
w13,24,128,8,4096,3072,16,64,256,1,8,5,3412.8179999999998,3
w13,24,128,8,4096,3072,16,64,256,16,4,2,3396.999333333333,3
w13,24,128,8,4096,3072,16,64,256,16,4,3,3391.9966666666664,3
w13,24,128,8,4096,3072,16,64,256,16,4,5,3396.3806666666665,3
w13,24,128,8,4096,3072,16,64,256,16,8,3,3411.6873333333333,3
w13,24,128,8,4096,3072,16,64,256,16,8,5,3410.706,3
w13,24,128,8,4096,3072,16,64,256,32,4,2,3399.7189999999996,3
w13,24,128,8,4096,3072,16,64,256,32,4,3,3395.719333333333,3
w13,24,128,8,4096,3072,16,64,256,32,4,5,3400.828666666667,3
w13,24,128,8,4096,3072,16,64,256,32,8,3,3416.871333333333,3
w13,24,128,8,4096,3072,16,64,256,32,8,5,3408.422666666667,3
w13,24,128,8,4096,3072,16,64,256,64,4,2,3398.9089999999997,3
w13,24,128,8,4096,3072,16,64,256,64,4,3,3394.3323333333333,3
w13,24,128,8,4096,3072,16,64,256,64,4,5,3407.4526666666666,3
w13,24,128,8,4096,3072,16,64,256,64,8,3,3415.5913333333338,3
w13,24,128,8,4096,3072,16,64,256,64,8,5,3421.405,3
w13,24,128,8,4096,3072,16,128,128,1,4,2,3425.5866666666666,3
w13,24,128,8,4096,3072,16,128,128,1,4,3,3424.328,3
w13,24,128,8,4096,3072,16,128,128,16,4,2,3415.858666666667,3
w13,24,128,8,4096,3072,16,128,128,16,4,3,3421.298666666667,3
w13,24,128,8,4096,3072,16,128,128,32,4,2,3420.253666666667,3
w13,24,128,8,4096,3072,16,128,128,32,4,3,3422.066666666667,3
w13,24,128,8,4096,3072,16,128,128,32,4,5,3423.047666666667,3
w13,24,128,8,4096,3072,16,128,128,64,4,2,3414.9413333333337,3
w13,32,8,2,1024,512,16,128,64,1,4,4,8.823666666666666,3
w13,32,8,2,1024,512,16,128,64,1,4,5,8.887,3
w13,32,16,2,1536,768,16,32,128,32,4,2,45.922,3
w13,32,16,2,1536,768,16,64,128,64,4,2,46.02866666666667,3
w13,32,16,2,1536,768,16,128,128,1,8,3,45.88999999999999,3
w13,32,16,2,1536,768,16,128,128,1,8,4,45.580666666666666,3
w13,32,16,2,1536,768,16,128,128,16,8,3,45.93266666666667,3
w13,32,16,2,1536,768,16,128,128,64,8,3,45.922,3
w13,32,16,4,1536,1024,16,64,128,1,4,2,59.617999999999995,3
w13,32,16,4,1536,1024,16,64,128,1,8,2,60.172666666666665,3
w13,32,16,4,1536,1024,16,64,128,16,4,2,59.906,3
w13,32,16,4,1536,1024,16,64,128,32,4,2,59.69266666666667,3
w13,32,16,4,1536,1024,16,64,128,64,4,2,59.61833333333334,3
w13,32,16,4,1536,1024,16,64,128,64,8,2,59.96966666666666,3
w13,32,16,4,1536,1024,16,128,128,1,8,2,59.57533333333333,3
w13,32,32,4,2048,768,16,64,128,16,4,3,112.31133333333334,3
w13,32,32,4,2048,768,16,128,128,1,8,3,112.32266666666665,3
w13,32,32,4,2048,768,16,128,128,1,8,4,111.693,3
w13,32,32,6,3072,1024,16,64,128,1,4,4,226.30633333333333,3
w13,32,32,6,3072,1024,16,64,128,1,4,5,226.25300000000001,3
w13,32,32,6,3072,1024,16,64,128,1,8,3,225.453,3
w13,32,32,6,3072,1024,16,64,128,1,8,4,225.93266666666668,3
w13,32,32,6,3072,1024,16,64,128,16,8,2,226.26366666666664,3
w13,32,32,6,3072,1024,16,64,128,16,8,3,224.98333333333335,3
w13,32,32,6,3072,1024,16,64,128,64,4,4,226.2313333333333,3
w13,32,32,6,3072,1024,16,64,256,1,4,3,225.8153333333333,3
w13,32,32,6,3072,1024,16,64,256,16,4,2,226.28466666666668,3
w13,32,32,6,3072,1024,16,64,256,16,4,3,226.0716666666667,3
w13,32,32,6,3072,1024,16,64,256,32,4,3,224.141,3
w13,32,32,6,3072,1024,16,64,256,64,4,3,225.74099999999999,3
w13,32,32,6,3072,1024,16,64,256,64,8,3,224.65300000000002,3
w13,32,32,6,3072,1024,16,128,128,1,4,3,224.09866666666667,3
w13,32,32,6,3072,1024,16,128,128,1,4,5,226.018,3
w13,32,32,6,3072,1024,16,128,128,1,8,3,226.242,3
w13,32,32,6,3072,1024,16,128,128,1,8,4,224.18366666666665,3
w13,32,32,6,3072,1024,16,128,128,1,8,5,224.941,3
w13,32,32,6,3072,1024,16,128,128,16,4,3,224.69566666666665,3
w13,32,32,6,3072,1024,16,128,128,16,4,4,225.27200000000002,3
w13,32,32,6,3072,1024,16,128,128,16,4,5,226.285,3
w13,32,32,6,3072,1024,16,128,128,16,8,5,226.00766666666667,3
w13,32,32,6,3072,1024,16,128,128,32,4,3,224.045,3
w13,32,32,6,3072,1024,16,128,128,32,4,5,225.99733333333333,3
w13,32,32,6,3072,1024,16,128,128,32,8,3,224.95133333333334,3
w13,32,32,6,3072,1024,16,128,128,32,8,5,225.005,3
w13,32,32,6,3072,1024,16,128,128,64,4,3,224.27966666666666,3
w13,32,32,6,3072,1024,16,128,128,64,4,5,225.74099999999999,3
w13,32,32,6,3072,1024,16,128,128,64,8,4,225.87966666666668,3
w13,32,32,6,3072,1024,32,32,256,1,4,2,225.20733333333337,3
w13,32,32,6,3072,1024,32,32,256,4,4,2,225.57033333333334,3
w13,32,32,6,3072,1024,32,32,256,16,4,2,226.061,3
w13,32,32,6,3072,1024,32,64,256,1,8,2,225.64499999999998,3
w13,32,60,4,2048,1408,16,64,128,1,8,3,377.24,3
w13,32,60,4,2048,1408,16,64,128,16,4,3,377.59233333333333,3
w13,32,60,4,2048,1408,16,64,128,16,4,5,378.211,3
w13,32,60,4,2048,1408,16,64,128,16,8,3,376.23766666666666,3
w13,32,60,4,2048,1408,16,64,128,32,4,3,377.507,3
w13,32,60,4,2048,1408,16,64,128,32,8,3,375.3306666666667,3
w13,32,60,4,2048,1408,16,64,128,64,4,3,376.9203333333333,3
w13,32,60,4,2048,1408,16,64,128,64,4,5,377.9336666666666,3
w13,32,60,4,2048,1408,16,64,128,64,8,3,377.40066666666667,3
w13,32,60,4,2048,1408,16,64,256,16,4,3,377.90166666666664,3
w13,32,60,4,2048,1408,16,128,128,1,4,2,377.52833333333336,3
w13,32,60,4,2048,1408,16,128,128,1,4,3,376.05633333333327,3
w13,32,60,4,2048,1408,16,128,128,1,8,3,376.93100000000004,3
w13,32,60,4,2048,1408,16,128,128,16,4,2,374.7656666666667,3
w13,32,60,4,2048,1408,16,128,128,16,4,3,375.13933333333335,3
w13,32,60,4,2048,1408,16,128,128,16,4,5,378.5203333333334,3
w13,32,60,4,2048,1408,16,128,128,16,8,3,376.6113333333333,3
w13,32,60,4,2048,1408,16,128,128,16,8,5,377.6773333333333,3
w13,32,60,4,2048,1408,16,128,128,32,4,3,376.52566666666667,3
w13,32,60,4,2048,1408,16,128,128,32,4,5,378.051,3
w13,32,60,4,2048,1408,16,128,128,32,8,3,376.98466666666667,3
w13,32,60,4,2048,1408,16,128,128,64,4,3,376.97333333333336,3
w13,32,60,4,2048,1408,16,128,128,64,4,5,378.13633333333337,3
w13,32,60,4,2048,1408,16,128,128,64,8,3,375.1073333333334,3
w13,32,60,4,2048,1408,32,128,128,64,4,3,378.53133333333335,3
w13,32,60,6,3584,2304,16,64,128,16,4,3,1066.619,3
w13,32,60,6,3584,2304,16,64,128,16,8,3,1068.1116666666667,3
w13,32,60,6,3584,2304,16,64,128,32,4,3,1068.1226666666666,3
w13,32,60,6,3584,2304,16,64,128,64,4,3,1069.616,3
w13,32,60,6,3584,2304,16,64,256,1,4,2,1064.229,3
w13,32,60,6,3584,2304,16,64,256,1,4,3,1060.4746666666667,3
w13,32,60,6,3584,2304,16,64,256,1,4,5,1064.7196666666666,3
w13,32,60,6,3584,2304,16,64,256,1,8,3,1065.6906666666666,3
w13,32,60,6,3584,2304,16,64,256,16,4,2,1066.469,3
w13,32,60,6,3584,2304,16,64,256,16,4,3,1062.8643333333332,3
w13,32,60,6,3584,2304,16,64,256,16,4,5,1067.536,3
w13,32,60,6,3584,2304,16,64,256,16,8,3,1067.9840000000002,3
w13,32,60,6,3584,2304,16,64,256,16,8,5,1069.5733333333333,3
w13,32,60,6,3584,2304,16,64,256,32,4,2,1064.2933333333333,3
w13,32,60,6,3584,2304,16,64,256,32,4,3,1060.8480000000002,3
w13,32,60,6,3584,2304,16,64,256,32,4,5,1067.867,3
w13,32,60,6,3584,2304,16,64,256,32,8,5,1070.7253333333335,3
w13,32,60,6,3584,2304,16,64,256,64,4,2,1064.379,3
w13,32,60,6,3584,2304,16,64,256,64,4,3,1066.3093333333334,3
w13,32,60,6,3584,2304,16,128,128,1,4,2,1064.4853333333333,3
w13,32,60,6,3584,2304,16,128,128,1,4,3,1064.4536666666665,3
w13,32,60,6,3584,2304,16,128,128,1,4,5,1066.4476666666667,3
w13,32,60,6,3584,2304,16,128,128,1,8,3,1063.728,3
w13,32,60,6,3584,2304,16,128,128,1,8,5,1064.7626666666667,3
w13,32,60,6,3584,2304,16,128,128,16,4,2,1068.1223333333335,3
w13,32,60,6,3584,2304,16,128,128,16,4,3,1062.107,3
w13,32,60,6,3584,2304,16,128,128,16,4,5,1065.0293333333332,3
w13,32,60,6,3584,2304,16,128,128,16,8,3,1063.9413333333334,3
w13,32,60,6,3584,2304,16,128,128,16,8,5,1070.2133333333334,3
w13,32,60,6,3584,2304,16,128,128,32,4,2,1069.5093333333332,3
w13,32,60,6,3584,2304,16,128,128,32,4,3,1063.9516666666666,3
w13,32,60,6,3584,2304,16,128,128,32,4,5,1065.221,3
w13,32,60,6,3584,2304,16,128,128,32,8,3,1064.4533333333331,3
w13,32,60,6,3584,2304,16,128,128,32,8,5,1069.7969999999998,3
w13,32,60,6,3584,2304,16,128,128,64,4,2,1067.76,3
w13,32,60,6,3584,2304,16,128,128,64,4,3,1068.0056666666667,3
w13,32,60,6,3584,2304,16,128,128,64,4,5,1070.7253333333333,3
w13,32,60,6,3584,2304,16,128,128,64,8,3,1067.12,3
w13,32,60,6,3584,2304,16,128,128,64,8,5,1069.4343333333334,3
w13,32,60,6,3584,2304,32,128,128,1,4,3,1067.8663333333334,3
w13,32,60,6,3584,2304,32,128,128,4,4,3,1067.0343333333333,3
w13,32,60,6,3584,2304,32,128,128,8,4,3,1069.9473333333333,3
w13,32,60,6,3584,2304,32,128,128,8,4,5,1069.8293333333334,3
w13,32,60,6,3584,2304,32,128,128,16,4,3,1069.1043333333334,3
w13,32,60,6,3584,2304,32,128,128,32,4,3,1070.406,3
w13,32,60,6,3584,2304,32,128,128,64,4,3,1067.6209999999999,3
w13,32,60,8,2048,1536,16,128,128,1,8,3,411.86366666666663,3
w13,32,60,8,2048,1536,16,128,128,16,4,3,410.349,3
w13,32,60,8,2048,1536,16,128,128,16,8,3,411.2456666666667,3
w13,32,60,8,2048,1536,16,128,128,32,4,3,408.163,3
w13,32,60,8,2048,1536,16,128,128,32,4,5,411.9283333333333,3
w13,32,60,8,2048,1536,16,128,128,32,8,3,408.95233333333334,3
w13,32,60,8,2048,1536,16,128,128,64,4,3,411.58666666666664,3
w13,32,60,8,2048,1536,16,128,128,64,4,5,412.1093333333333,3
w13,32,60,8,2048,1536,16,128,128,64,8,3,410.81866666666673,3
w13,32,64,6,3072,2048,16,64,128,16,4,3,867.5676666666667,3
w13,32,64,6,3072,2048,16,64,128,32,4,3,865.9563333333334,3
w13,32,64,6,3072,2048,16,64,128,64,4,3,866.65,3
w13,32,64,6,3072,2048,16,64,256,1,4,3,866.564,3
w13,32,64,6,3072,2048,16,64,256,16,4,2,866.6823333333333,3
w13,32,64,6,3072,2048,16,64,256,16,4,3,865.7863333333333,3
w13,32,64,6,3072,2048,16,64,256,16,8,3,867.4926666666667,3
w13,32,64,6,3072,2048,16,64,256,32,4,2,867.0663333333333,3
w13,32,64,6,3072,2048,16,64,256,32,4,3,864.5799999999999,3
w13,32,64,6,3072,2048,16,64,256,64,4,2,867.0556666666666,3
w13,32,64,6,3072,2048,16,128,128,1,4,3,863.29,3
w13,32,64,6,3072,2048,16,128,128,1,4,5,866.65,3
w13,32,64,6,3072,2048,16,128,128,1,8,3,864.378,3
w13,32,64,6,3072,2048,16,128,128,1,8,5,866.7243333333332,3
w13,32,64,6,3072,2048,16,128,128,16,4,2,863.002,3
w13,32,64,6,3072,2048,16,128,128,16,4,3,861.349,3
w13,32,64,6,3072,2048,16,128,128,16,4,5,866.0953333333333,3
w13,32,64,6,3072,2048,16,128,128,16,8,3,863.0123333333335,3
w13,32,64,6,3072,2048,16,128,128,16,8,5,867.535,3
w13,32,64,6,3072,2048,16,128,128,32,4,2,862.9163333333332,3
w13,32,64,6,3072,2048,16,128,128,32,4,3,859.6743333333334,3
w13,32,64,6,3072,2048,16,128,128,32,4,5,866.8846666666667,3
w13,32,64,6,3072,2048,16,128,128,32,8,3,860.6446666666667,3
w13,32,64,6,3072,2048,16,128,128,64,4,2,866.7356666666666,3
w13,32,64,6,3072,2048,16,128,128,64,4,3,864.143,3
w13,32,64,6,3072,2048,32,128,128,1,4,3,865.8290000000001,3
w13,32,64,6,3072,2048,32,128,128,8,4,3,864.8583333333332,3
w13,32,64,6,3072,2048,32,128,128,32,4,3,865.6366666666667,3
w13,32,64,6,3584,1536,16,64,128,1,4,5,763.2253333333333,3
w13,32,64,6,3584,1536,16,64,128,1,8,3,763.8759999999999,3
w13,32,64,6,3584,1536,16,64,128,32,4,3,762.5426666666666,3
w13,32,64,6,3584,1536,16,64,128,32,8,3,763.8436666666666,3
w13,32,64,6,3584,1536,16,64,256,1,4,2,758.6383333333333,3
w13,32,64,6,3584,1536,16,64,256,1,4,3,756.8783333333334,3
w13,32,64,6,3584,1536,16,64,256,1,4,5,757.156,3
w13,32,64,6,3584,1536,16,64,256,1,8,3,762.799,3
w13,32,64,6,3584,1536,16,64,256,1,8,5,760.9319999999999,3
w13,32,64,6,3584,1536,16,64,256,16,4,2,760.5160000000001,3
w13,32,64,6,3584,1536,16,64,256,16,4,3,760.7613333333334,3
w13,32,64,6,3584,1536,16,64,256,16,4,5,762.7663333333334,3
w13,32,64,6,3584,1536,16,64,256,16,8,3,762.7986666666666,3
w13,32,64,6,3584,1536,16,64,256,32,4,2,761.8813333333334,3
w13,32,64,6,3584,1536,16,64,256,32,4,3,760.1213333333334,3
w13,32,64,6,3584,1536,16,64,256,32,4,5,762.66,3
w13,32,64,6,3584,1536,16,64,256,64,4,2,762.4356666666666,3
w13,32,64,6,3584,1536,16,64,256,64,4,3,760.1316666666667,3
w13,32,64,6,3584,1536,16,64,256,64,8,3,764.4836666666666,3
w13,32,64,6,3584,1536,16,128,128,1,4,2,763.172,3
w13,32,64,6,3584,1536,16,128,128,1,4,3,760.0573333333333,3
w13,32,64,6,3584,1536,16,128,128,1,4,5,760.1529999999999,3
w13,32,64,6,3584,1536,16,128,128,1,8,3,758.8093333333333,3
w13,32,64,6,3584,1536,16,128,128,1,8,5,761.7959999999999,3
w13,32,64,6,3584,1536,16,128,128,16,4,3,759.4596666666666,3
w13,32,64,6,3584,1536,16,128,128,16,4,5,761.593,3
w13,32,64,6,3584,1536,16,128,128,16,8,3,762.756,3
w13,32,64,6,3584,1536,16,128,128,32,4,3,760.2706666666667,3
w13,32,64,6,3584,1536,16,128,128,32,4,5,761.2303333333333,3
w13,32,64,6,3584,1536,16,128,128,32,8,3,762.873,3
w13,32,64,6,3584,1536,16,128,128,64,4,3,760.9106666666667,3
w13,32,64,6,3584,1536,32,128,128,1,4,3,764.3026666666668,3
w13,32,64,6,3584,1536,32,128,128,8,4,3,762.2013333333333,3
w13,32,64,6,3584,1536,32,128,128,16,4,3,764.0790000000001,3
w13,32,64,8,3584,2560,16,64,128,32,4,3,1269.2346666666665,3
w13,32,64,8,3584,2560,16,64,256,1,4,2,1260.701,3
w13,32,64,8,3584,2560,16,64,256,1,4,3,1256.8933333333332,3
w13,32,64,8,3584,2560,16,64,256,1,4,5,1264.861,3
w13,32,64,8,3584,2560,16,64,256,1,8,3,1267.0696666666665,3
w13,32,64,8,3584,2560,16,64,256,1,8,5,1266.1626666666666,3
w13,32,64,8,3584,2560,16,64,256,16,4,2,1262.1943333333334,3
w13,32,64,8,3584,2560,16,64,256,16,4,3,1261.1173333333334,3
w13,32,64,8,3584,2560,16,64,256,16,4,5,1264.6693333333335,3
w13,32,64,8,3584,2560,16,64,256,16,8,3,1268.648,3
w13,32,64,8,3584,2560,16,64,256,16,8,5,1268.1786666666667,3
w13,32,64,8,3584,2560,16,64,256,32,4,2,1260.4453333333333,3
w13,32,64,8,3584,2560,16,64,256,32,4,3,1260.061,3
w13,32,64,8,3584,2560,16,64,256,32,4,5,1268.509,3
w13,32,64,8,3584,2560,16,64,256,64,4,2,1266.418,3
w13,32,64,8,3584,2560,16,64,256,64,4,3,1264.3493333333333,3
w13,32,64,8,3584,2560,16,128,128,1,4,2,1264.2213333333332,3
w13,32,64,8,3584,2560,16,128,128,1,4,3,1258.557,3
w13,32,64,8,3584,2560,16,128,128,1,4,5,1267.7303333333332,3
w13,32,64,8,3584,2560,16,128,128,1,8,3,1261.267,3
w13,32,64,8,3584,2560,16,128,128,1,8,5,1262.5573333333334,3
w13,32,64,8,3584,2560,16,128,128,16,4,2,1263.4426666666668,3
w13,32,64,8,3584,2560,16,128,128,16,4,3,1262.5573333333334,3
w13,32,64,8,3584,2560,16,128,128,16,4,5,1262.4293333333333,3
w13,32,64,8,3584,2560,16,128,128,16,8,3,1264.9033333333334,3
w13,32,64,8,3584,2560,16,128,128,16,8,5,1265.7033333333334,3
w13,32,64,8,3584,2560,16,128,128,32,4,2,1267.9223333333332,3
w13,32,64,8,3584,2560,16,128,128,32,4,3,1263.0906666666667,3
w13,32,64,8,3584,2560,16,128,128,32,4,5,1266.3223333333333,3
w13,32,64,8,3584,2560,16,128,128,32,8,3,1267.6343333333334,3
w13,32,64,8,3584,2560,16,128,128,32,8,5,1267.6666666666667,3
w13,32,64,8,3584,2560,16,128,128,64,4,2,1264.2743333333335,3
w13,32,64,8,3584,2560,16,128,128,64,4,3,1268.5093333333334,3
w13,32,64,8,3584,2560,16,128,128,64,8,3,1268.4666666666667,3
w13,32,64,8,3584,2560,32,128,128,1,4,3,1267.1763333333336,3
w13,32,64,8,3584,2560,32,128,128,8,4,3,1266.056,3
w13,32,64,8,3584,2560,32,128,128,8,4,5,1267.2299999999998,3
w13,32,64,8,3584,2560,32,128,128,16,4,3,1262.4826666666668,3
w13,32,64,8,3584,2560,32,128,128,32,4,3,1267.4213333333335,3
w13,32,128,4,2048,512,16,64,128,32,4,3,290.65933333333334,3
w13,32,128,4,2048,512,16,64,128,32,8,3,291.715,3
w13,32,128,4,2048,512,16,64,128,64,4,3,291.77933333333334,3
w13,32,128,4,2048,512,16,128,128,1,8,3,291.502,3
w13,32,128,4,2048,512,16,128,128,32,4,5,292.4723333333333,3
w13,32,128,4,2048,512,16,128,128,64,4,3,291.42699999999996,3
w13,32,128,4,2048,512,16,128,128,64,4,5,292.2806666666667,3
w13,32,128,4,2048,512,16,128,128,64,8,3,289.6886666666667,3
w13,32,128,6,4096,2048,16,64,256,1,4,2,2273.9756666666667,3
w13,32,128,6,4096,2048,16,64,256,1,4,3,2263.8316666666665,3
w13,32,128,6,4096,2048,16,64,256,1,4,5,2268.2046666666665,3
w13,32,128,6,4096,2048,16,64,256,1,8,3,2279.778,3
w13,32,128,6,4096,2048,16,64,256,1,8,5,2276.653,3
w13,32,128,6,4096,2048,16,64,256,16,4,2,2274.5086666666666,3
w13,32,128,6,4096,2048,16,64,256,16,4,3,2260.5353333333333,3
w13,32,128,6,4096,2048,16,64,256,16,4,5,2268.4716666666664,3
w13,32,128,6,4096,2048,16,64,256,16,8,3,2278.4873333333335,3
w13,32,128,6,4096,2048,16,64,256,16,8,5,2277.4636666666665,3
w13,32,128,6,4096,2048,16,64,256,32,4,2,2268.9516666666664,3
w13,32,128,6,4096,2048,16,64,256,32,4,3,2264.8873333333336,3
w13,32,128,6,4096,2048,16,64,256,32,4,5,2273.6553333333336,3
w13,32,128,6,4096,2048,16,64,256,32,8,3,2281.2606666666666,3
w13,32,128,6,4096,2048,16,64,256,32,8,5,2279.3196666666668,3
w13,32,128,6,4096,2048,16,64,256,64,4,2,2272.108666666667,3
w13,32,128,6,4096,2048,16,64,256,64,4,3,2268.7273333333333,3
w13,32,128,6,4096,2048,16,64,256,64,4,5,2277.5596666666665,3
w13,32,128,6,4096,2048,16,128,128,1,4,3,2282.284666666667,3
w13,32,128,8,2048,768,16,64,128,1,8,3,435.4173333333333,3
w13,32,128,8,2048,768,16,64,128,16,4,3,436.35566666666665,3
w13,32,128,8,2048,768,16,64,128,16,8,3,436.9746666666667,3
w13,32,128,8,2048,768,16,64,128,32,4,2,436.24933333333337,3
w13,32,128,8,2048,768,16,64,128,32,4,3,433.796,3
w13,32,128,8,2048,768,16,64,128,32,4,5,436.8993333333333,3
w13,32,128,8,2048,768,16,64,128,32,8,3,435.36366666666663,3
w13,32,128,8,2048,768,16,64,128,64,4,3,435.06500000000005,3
w13,32,128,8,2048,768,16,64,128,64,4,5,436.3123333333333,3
w13,32,128,8,2048,768,16,64,128,64,8,3,435.18266666666665,3
w13,32,128,8,2048,768,16,128,128,1,4,2,436.0253333333333,3
w13,32,128,8,2048,768,16,128,128,1,4,3,436.13200000000006,3
w13,32,128,8,2048,768,16,128,128,1,8,5,436.39833333333337,3
w13,32,128,8,2048,768,16,128,128,16,4,2,433.4653333333333,3
w13,32,128,8,2048,768,16,128,128,16,4,3,433.23033333333336,3
w13,32,128,8,2048,768,16,128,128,16,4,5,436.31333333333333,3
w13,32,128,8,2048,768,16,128,128,16,8,3,434.06166666666667,3
w13,32,128,8,2048,768,16,128,128,16,8,5,436.25933333333336,3
w13,32,128,8,2048,768,16,128,128,32,4,2,435.3416666666667,3
w13,32,128,8,2048,768,16,128,128,32,4,3,432.7716666666667,3
w13,32,128,8,2048,768,16,128,128,32,4,5,436.036,3
w13,32,128,8,2048,768,16,128,128,32,8,3,434.24333333333334,3
w13,32,128,8,2048,768,16,128,128,32,8,5,436.3126666666667,3
w13,32,128,8,2048,768,16,128,128,64,4,2,433.1123333333333,3
w13,32,128,8,2048,768,16,128,128,64,4,3,433.1553333333333,3
w13,32,128,8,2048,768,16,128,128,64,8,3,435.78000000000003,3
w13,32,128,8,2048,768,16,128,128,64,8,5,435.91833333333335,3
w13,32,128,8,4096,1536,16,64,128,1,4,3,1721.2789999999998,3
w13,32,128,8,4096,1536,16,64,128,32,4,3,1722.7083333333333,3
w13,32,128,8,4096,1536,16,64,128,64,4,3,1720.2336666666667,3
w13,32,128,8,4096,1536,16,64,256,1,4,2,1710.463,3
w13,32,128,8,4096,1536,16,64,256,1,4,3,1705.9716666666666,3
w13,32,128,8,4096,1536,16,64,256,1,4,5,1709.0656666666666,3
w13,32,128,8,4096,1536,16,64,256,1,8,3,1720.3086666666668,3
w13,32,128,8,4096,1536,16,64,256,1,8,5,1718.3136666666667,3
w13,32,128,8,4096,1536,16,64,256,16,4,2,1712.3933333333334,3
w13,32,128,8,4096,1536,16,64,256,16,4,3,1708.6176666666668,3
w13,32,128,8,4096,1536,16,64,256,16,4,5,1713.631,3
w13,32,128,8,4096,1536,16,64,256,16,8,3,1718.0256666666667,3
w13,32,128,8,4096,1536,16,64,256,16,8,5,1719.0393333333334,3
w13,32,128,8,4096,1536,16,64,256,32,4,2,1707.9136666666666,3
w13,32,128,8,4096,1536,16,64,256,32,4,3,1707.487,3
w13,32,128,8,4096,1536,16,64,256,32,4,5,1711.5829999999999,3
w13,32,128,8,4096,1536,16,64,256,32,8,3,1715.7963333333335,3
w13,32,128,8,4096,1536,16,64,256,32,8,5,1720.2549999999999,3
w13,32,128,8,4096,1536,16,64,256,64,4,2,1711.3376666666666,3
w13,32,128,8,4096,1536,16,64,256,64,4,3,1708.2976666666666,3
w13,32,128,8,4096,1536,16,64,256,64,4,5,1713.801333333333,3
w13,32,128,8,4096,1536,16,64,256,64,8,3,1720.3403333333333,3
w13,32,128,8,4096,1536,16,64,256,64,8,5,1723.039,3
w13,32,128,8,4096,1536,16,128,128,1,4,3,1720.3933333333334,3
w13,32,128,8,4096,1536,16,128,128,1,4,5,1721.524666666667,3
w13,32,128,8,4096,1536,16,128,128,1,8,3,1722.975333333333,3
w13,32,128,8,4096,1536,16,128,128,32,4,2,1718.3353333333334,3
w13,32,128,8,4096,1536,16,128,128,32,4,3,1717.2683333333334,3
w13,32,128,8,4096,1536,16,128,128,64,4,2,1723.103,3
w13,32,128,8,4096,1536,32,128,128,16,4,3,1722.7616666666665,3
w13,32,128,8,4096,3072,16,64,128,16,4,2,3430.3113333333336,3
w13,32,128,8,4096,3072,16,64,128,16,4,3,3431.879333333333,3
w13,32,128,8,4096,3072,16,64,128,32,4,2,3431.645666666667,3
w13,32,128,8,4096,3072,16,64,128,32,4,3,3430.567333333334,3
w13,32,128,8,4096,3072,16,64,128,64,4,2,3431.9539999999997,3
w13,32,128,8,4096,3072,16,64,128,64,4,3,3432.8403333333335,3
w13,32,128,8,4096,3072,16,64,256,1,4,2,3408.605333333333,3
w13,32,128,8,4096,3072,16,64,256,1,4,3,3398.5246666666667,3
w13,32,128,8,4096,3072,16,64,256,1,4,5,3406.354,3
w13,32,128,8,4096,3072,16,64,256,1,8,3,3422.951333333333,3
w13,32,128,8,4096,3072,16,64,256,1,8,5,3418.962,3
w13,32,128,8,4096,3072,16,64,256,16,4,2,3406.6210000000005,3
w13,32,128,8,4096,3072,16,64,256,16,4,3,3399.89,3
w13,32,128,8,4096,3072,16,64,256,16,4,5,3408.0723333333335,3
w13,32,128,8,4096,3072,16,64,256,16,8,3,3419.8160000000003,3
w13,32,128,8,4096,3072,16,64,256,16,8,5,3416.1783333333333,3
w13,32,128,8,4096,3072,16,64,256,32,4,2,3409.3413333333333,3
w13,32,128,8,4096,3072,16,64,256,32,4,3,3405.2136666666665,3
w13,32,128,8,4096,3072,16,64,256,32,4,5,3408.146666666667,3
w13,32,128,8,4096,3072,16,64,256,32,8,3,3423.1226666666666,3
w13,32,128,8,4096,3072,16,64,256,32,8,5,3420.8826666666664,3
w13,32,128,8,4096,3072,16,64,256,64,4,2,3409.586333333333,3
w13,32,128,8,4096,3072,16,64,256,64,4,3,3400.1469999999995,3
w13,32,128,8,4096,3072,16,64,256,64,4,5,3416.4133333333334,3
w13,32,128,8,4096,3072,16,64,256,64,8,3,3423.4216666666666,3
w13,32,128,8,4096,3072,16,64,256,64,8,5,3428.1893333333333,3
w13,32,128,8,4096,3072,16,128,128,1,4,3,3429.885333333333,3
w13,32,128,8,4096,3072,16,128,128,16,4,2,3417.3626666666664,3
w13,32,128,8,4096,3072,16,128,128,16,4,3,3422.856333333333,3
w13,32,128,8,4096,3072,16,128,128,32,4,2,3419.3683333333333,3
w13,32,128,8,4096,3072,16,128,128,32,4,3,3424.637666666667,3
w13,32,128,8,4096,3072,16,128,128,64,4,2,3427.656333333334,3
w13,32,128,8,4096,3072,16,128,128,64,4,3,3432.2533333333336,3
w13,48,8,2,1024,512,16,128,64,1,4,4,8.855333333333332,3
w13,48,16,2,1536,768,16,32,128,16,4,2,46.35933333333333,3
w13,48,16,2,1536,768,16,32,128,32,4,2,46.733000000000004,3
w13,48,16,2,1536,768,16,64,128,1,4,3,46.391333333333336,3
w13,48,16,2,1536,768,16,64,128,16,4,2,46.70066666666667,3
w13,48,16,2,1536,768,16,128,128,1,4,3,46.55166666666667,3
w13,48,16,2,1536,768,16,128,128,1,8,2,46.61533333333333,3
w13,48,16,2,1536,768,16,128,128,1,8,3,46.31666666666666,3
w13,48,16,2,1536,768,16,128,128,16,8,3,46.47666666666667,3
w13,48,16,2,1536,768,16,128,128,32,8,3,46.61533333333333,3
w13,48,16,2,1536,768,16,128,128,64,4,3,46.626,3
w13,48,16,2,1536,768,16,128,128,64,8,3,46.583333333333336,3
w13,48,16,4,1536,1024,16,64,128,16,4,2,60.21533333333334,3
w13,48,16,4,1536,1024,16,64,128,32,4,2,59.714333333333336,3
w13,48,16,4,1536,1024,16,128,128,16,8,2,60.279333333333334,3
w13,48,32,4,2048,768,16,32,128,4,4,2,113.538,3
w13,48,32,4,2048,768,16,64,128,1,4,3,114.01833333333333,3
w13,48,32,4,2048,768,16,64,128,1,8,3,114.05033333333331,3
w13,48,32,4,2048,768,16,64,128,32,8,4,113.75166666666667,3
w13,48,32,4,2048,768,16,128,128,1,4,2,114.18866666666668,3
w13,48,32,4,2048,768,16,128,128,1,8,4,114.18900000000001,3
w13,48,32,4,2048,768,16,128,128,16,4,2,113.165,3
w13,48,32,4,2048,768,16,128,128,16,4,3,113.84766666666667,3
w13,48,32,4,2048,768,16,128,128,16,8,3,114.157,3
w13,48,32,4,2048,768,16,128,128,32,4,2,113.27166666666666,3
w13,48,32,4,2048,768,16,128,128,32,4,3,114.30633333333333,3
w13,48,32,4,2048,768,16,128,128,64,4,2,113.28233333333333,3
w13,48,32,4,2048,768,16,128,128,64,8,3,113.31466666666667,3
w13,48,32,4,2048,768,32,64,128,16,8,2,114.29566666666666,3
w13,48,32,4,2048,768,32,128,128,1,8,2,113.83699999999999,3
w13,48,32,4,2048,768,32,128,128,1,8,3,113.70866666666666,3
w13,48,32,4,2048,768,32,128,128,32,8,2,114.15666666666665,3
w13,48,32,6,3072,1024,16,64,128,1,4,4,226.48766666666666,3
w13,48,32,6,3072,1024,16,64,128,1,8,3,227.117,3
w13,48,32,6,3072,1024,16,64,128,16,8,2,227.309,3
w13,48,32,6,3072,1024,16,64,128,16,8,4,227.33033333333333,3
w13,48,32,6,3072,1024,16,64,128,16,8,5,225.92233333333334,3
w13,48,32,6,3072,1024,16,64,128,64,8,3,226.82899999999998,3
w13,48,32,6,3072,1024,16,64,256,1,4,3,226.54100000000003,3
w13,48,32,6,3072,1024,16,64,256,16,4,3,227.32000000000002,3
w13,48,32,6,3072,1024,16,128,128,1,4,3,225.101,3
w13,48,32,6,3072,1024,16,128,128,1,8,3,225.55966666666666,3
w13,48,32,6,3072,1024,16,128,128,1,8,4,227.11733333333333,3
w13,48,32,6,3072,1024,16,128,128,1,8,5,225.7733333333333,3
w13,48,32,6,3072,1024,16,128,128,16,4,3,226.59433333333334,3
w13,48,32,6,3072,1024,16,128,128,16,8,3,225.44233333333332,3
w13,48,32,6,3072,1024,16,128,128,16,8,5,226.47733333333335,3
w13,48,32,6,3072,1024,16,128,128,32,4,3,226.00766666666667,3
w13,48,32,6,3072,1024,16,128,128,32,4,5,226.73266666666666,3
w13,48,32,6,3072,1024,16,128,128,32,8,3,225.46333333333334,3
w13,48,32,6,3072,1024,16,128,128,64,4,3,227.07433333333333,3
w13,48,32,6,3072,1024,16,128,128,64,4,5,226.45533333333333,3
w13,48,32,6,3072,1024,16,128,128,64,8,3,226.65833333333333,3
w13,48,32,6,3072,1024,16,128,128,64,8,5,227.14933333333332,3
w13,48,32,6,3072,1024,32,32,256,4,4,2,226.28533333333334,3
w13,48,32,6,3072,1024,32,64,256,8,8,2,226.38066666666668,3
w13,48,32,6,3072,1024,32,128,128,32,8,5,226.92533333333336,3
w13,48,60,4,2048,1408,16,64,128,1,4,3,379.907,3
w13,48,60,4,2048,1408,16,64,128,16,4,2,380.0243333333333,3
w13,48,60,4,2048,1408,16,64,128,16,4,3,379.747,3
w13,48,60,4,2048,1408,16,64,128,16,4,5,380.0026666666667,3
w13,48,60,4,2048,1408,16,64,128,16,8,3,378.7656666666667,3
w13,48,60,4,2048,1408,16,64,128,32,4,3,379.4376666666667,3
w13,48,60,4,2048,1408,16,64,128,64,4,3,379.5016666666667,3
w13,48,60,4,2048,1408,16,64,128,64,8,3,380.2803333333333,3
w13,48,60,4,2048,1408,16,64,256,16,4,3,379.2563333333333,3
w13,48,60,4,2048,1408,16,128,128,1,4,2,379.363,3
w13,48,60,4,2048,1408,16,128,128,1,4,3,378.339,3
w13,48,60,4,2048,1408,16,128,128,16,4,3,376.7073333333333,3
w13,48,60,4,2048,1408,16,128,128,16,4,5,379.64033333333333,3
w13,48,60,4,2048,1408,16,128,128,16,8,3,377.40066666666667,3
w13,48,60,4,2048,1408,16,128,128,16,8,5,378.79766666666666,3
w13,48,60,4,2048,1408,16,128,128,32,4,3,377.731,3
w13,48,60,4,2048,1408,16,128,128,32,4,5,380.0883333333333,3
w13,48,60,4,2048,1408,16,128,128,32,8,3,378.22166666666664,3
w13,48,60,4,2048,1408,16,128,128,32,8,5,379.69399999999996,3
w13,48,60,4,2048,1408,16,128,128,64,4,2,380.23766666666666,3
w13,48,60,4,2048,1408,16,128,128,64,4,3,378.98966666666666,3
w13,48,60,4,2048,1408,32,128,128,8,4,3,380.1843333333333,3
w13,48,60,6,3584,2304,16,64,128,1,4,3,1076.678,3
w13,48,60,6,3584,2304,16,64,128,16,4,2,1077.1466666666665,3
w13,48,60,6,3584,2304,16,64,128,32,4,3,1077.2006666666666,3
w13,48,60,6,3584,2304,16,64,128,64,4,3,1076.6883333333333,3
w13,48,60,6,3584,2304,16,64,256,1,4,2,1068.1553333333334,3
w13,48,60,6,3584,2304,16,64,256,1,4,3,1066.693,3
w13,48,60,6,3584,2304,16,64,256,1,4,5,1071.7606666666668,3
w13,48,60,6,3584,2304,16,64,256,1,8,3,1074.8423333333333,3
w13,48,60,6,3584,2304,16,64,256,1,8,5,1076.8166666666666,3
w13,48,60,6,3584,2304,16,64,256,16,4,2,1069.9686666666666,3
w13,48,60,6,3584,2304,16,64,256,16,4,3,1067.9840000000002,3
w13,48,60,6,3584,2304,16,64,256,16,4,5,1075.1306666666667,3
w13,48,60,6,3584,2304,16,64,256,16,8,3,1073.9579999999999,3
w13,48,60,6,3584,2304,16,64,256,16,8,5,1076.2083333333333,3
w13,48,60,6,3584,2304,16,64,256,32,4,2,1070.373,3
w13,48,60,6,3584,2304,16,64,256,32,4,3,1068.8903333333335,3
w13,48,60,6,3584,2304,16,64,256,32,4,5,1076.8486666666668,3
w13,48,60,6,3584,2304,16,64,256,32,8,3,1073.4246666666668,3
w13,48,60,6,3584,2304,16,64,256,64,4,2,1071.1633333333332,3
w13,48,60,6,3584,2304,16,64,256,64,4,3,1071.9846666666665,3
w13,48,60,6,3584,2304,16,128,128,1,4,2,1070.246,3
w13,48,60,6,3584,2304,16,128,128,1,4,3,1067.814,3
w13,48,60,6,3584,2304,16,128,128,1,4,5,1071.2273333333335,3
w13,48,60,6,3584,2304,16,128,128,1,8,3,1067.9526666666668,3
w13,48,60,6,3584,2304,16,128,128,1,8,5,1073.3493333333333,3
w13,48,60,6,3584,2304,16,128,128,16,4,2,1075.771,3
w13,48,60,6,3584,2304,16,128,128,16,4,3,1066.6933333333334,3
w13,48,60,6,3584,2304,16,128,128,16,4,5,1068.9873333333333,3
w13,48,60,6,3584,2304,16,128,128,16,8,3,1071.366,3
w13,48,60,6,3584,2304,16,128,128,16,8,5,1076.2513333333334,3
w13,48,60,6,3584,2304,16,128,128,32,4,2,1070.982,3
w13,48,60,6,3584,2304,16,128,128,32,4,3,1069.9260000000002,3
w13,48,60,6,3584,2304,16,128,128,32,4,5,1072.7313333333334,3
w13,48,60,6,3584,2304,16,128,128,32,8,3,1071.3873333333333,3
w13,48,60,6,3584,2304,16,128,128,32,8,5,1075.5573333333334,3
w13,48,60,6,3584,2304,16,128,128,64,4,2,1075.7279999999998,3
w13,48,60,6,3584,2304,16,128,128,64,4,3,1070.6186666666665,3
w13,48,60,6,3584,2304,16,128,128,64,4,5,1077.03,3
w13,48,60,6,3584,2304,16,128,128,64,8,3,1073.509,3
w13,48,60,6,3584,2304,32,128,128,1,4,3,1075.3446666666666,3
w13,48,60,6,3584,2304,32,128,128,1,4,5,1075.9526666666668,3
w13,48,60,6,3584,2304,32,128,128,1,8,3,1076.4966666666667,3
w13,48,60,6,3584,2304,32,128,128,4,4,3,1073.6903333333332,3
w13,48,60,6,3584,2304,32,128,128,4,4,5,1077.1683333333333,3
w13,48,60,6,3584,2304,32,128,128,8,4,3,1074.63,3
w13,48,60,6,3584,2304,32,128,128,16,4,3,1075.4936666666665,3
w13,48,60,6,3584,2304,32,128,128,32,4,3,1072.1126666666667,3
w13,48,60,8,2048,1536,16,128,128,1,8,3,412.8776666666667,3
w13,48,60,8,2048,1536,16,128,128,16,4,2,414.403,3
w13,48,60,8,2048,1536,16,128,128,16,4,3,411.779,3
w13,48,60,8,2048,1536,16,128,128,16,8,3,414.0506666666667,3
w13,48,60,8,2048,1536,16,128,128,32,4,3,413.1223333333333,3
w13,48,60,8,2048,1536,16,128,128,32,8,3,411.32033333333334,3
w13,48,60,8,2048,1536,16,128,128,64,4,2,414.91499999999996,3
w13,48,60,8,2048,1536,16,128,128,64,4,3,412.89900000000006,3
w13,48,60,8,2048,1536,16,128,128,64,8,3,413.827,3
w13,48,64,6,3072,2048,16,64,128,16,4,3,872.4103333333333,3
w13,48,64,6,3072,2048,16,64,256,1,4,2,871.0880000000001,3
w13,48,64,6,3072,2048,16,64,256,1,4,3,868.8686666666666,3
w13,48,64,6,3072,2048,16,64,256,1,8,3,872.5703333333332,3
w13,48,64,6,3072,2048,16,64,256,16,4,2,871.2583333333333,3
w13,48,64,6,3072,2048,16,64,256,16,4,3,871.7173333333334,3
w13,48,64,6,3072,2048,16,64,256,32,4,2,871.8023333333334,3
w13,48,64,6,3072,2048,16,64,256,64,4,2,871.1943333333334,3
w13,48,64,6,3072,2048,16,64,256,64,4,3,873.3813333333334,3
w13,48,64,6,3072,2048,16,128,128,1,4,2,867.6853333333333,3
w13,48,64,6,3072,2048,16,128,128,1,4,3,868.6236666666667,3
w13,48,64,6,3072,2048,16,128,128,1,4,5,872.677,3
w13,48,64,6,3072,2048,16,128,128,1,8,3,866.5116666666667,3
w13,48,64,6,3072,2048,16,128,128,1,8,5,871.6103333333334,3
w13,48,64,6,3072,2048,16,128,128,16,4,2,866.4796666666667,3
w13,48,64,6,3072,2048,16,128,128,16,4,3,867.1516666666666,3
w13,48,64,6,3072,2048,16,128,128,16,4,5,872.6876666666667,3
w13,48,64,6,3072,2048,16,128,128,16,8,3,864.8583333333332,3
w13,48,64,6,3072,2048,16,128,128,16,8,5,870.8956666666667,3
w13,48,64,6,3072,2048,16,128,128,32,4,2,870.4476666666666,3
w13,48,64,6,3072,2048,16,128,128,32,4,3,868.3996666666667,3
w13,48,64,6,3072,2048,16,128,128,32,8,3,869.4233333333333,3
w13,48,64,6,3072,2048,16,128,128,64,4,2,867.5036666666666,3
w13,48,64,6,3072,2048,16,128,128,64,4,3,866.5970000000001,3
w13,48,64,6,3072,2048,16,128,128,64,8,3,870.9386666666666,3
w13,48,64,6,3072,2048,32,128,128,1,4,3,872.1543333333333,3
w13,48,64,6,3072,2048,32,128,128,4,4,3,869.8823333333333,3
w13,48,64,6,3072,2048,32,128,128,8,4,3,868.4423333333334,3
w13,48,64,6,3072,2048,32,128,128,16,4,3,871.3223333333334,3
w13,48,64,6,3072,2048,32,128,128,32,4,3,873.52,3
w13,48,64,6,3584,1536,16,64,128,1,4,5,764.922,3
w13,48,64,6,3584,1536,16,64,128,1,8,3,767.727,3
w13,48,64,6,3584,1536,16,64,128,16,4,3,767.556,3
w13,48,64,6,3584,1536,16,64,128,32,4,3,765.6469999999999,3
w13,48,64,6,3584,1536,16,64,128,32,8,3,767.5456666666668,3
w13,48,64,6,3584,1536,16,64,256,1,4,2,761.7746666666667,3
w13,48,64,6,3584,1536,16,64,256,1,4,3,760.708,3
w13,48,64,6,3584,1536,16,64,256,1,4,5,762.9803333333333,3
w13,48,64,6,3584,1536,16,64,256,1,8,3,763.855,3
w13,48,64,6,3584,1536,16,64,256,16,4,2,764.1323333333333,3
w13,48,64,6,3584,1536,16,64,256,16,4,3,763.3856666666667,3
w13,48,64,6,3584,1536,16,64,256,16,4,5,764.9,3
w13,48,64,6,3584,1536,16,64,256,16,8,3,764.4630000000001,3
w13,48,64,6,3584,1536,16,64,256,32,4,2,763.9506666666666,3
w13,48,64,6,3584,1536,16,64,256,32,4,3,762.6176666666667,3
w13,48,64,6,3584,1536,16,64,256,32,4,5,766.1483333333334,3
w13,48,64,6,3584,1536,16,64,256,32,8,3,767.1080000000001,3
w13,48,64,6,3584,1536,16,64,256,64,4,2,767.5776666666667,3
w13,48,64,6,3584,1536,16,64,256,64,4,3,763.919,3
w13,48,64,6,3584,1536,16,128,128,1,4,3,760.4946666666666,3
w13,48,64,6,3584,1536,16,128,128,1,4,5,763.0226666666667,3
w13,48,64,6,3584,1536,16,128,128,1,8,3,763.5880000000001,3
w13,48,64,6,3584,1536,16,128,128,1,8,5,760.8253333333332,3
w13,48,64,6,3584,1536,16,128,128,16,4,3,760.623,3
w13,48,64,6,3584,1536,16,128,128,16,4,5,766.415,3
w13,48,64,6,3584,1536,16,128,128,16,8,3,767.4706666666667,3
w13,48,64,6,3584,1536,16,128,128,16,8,5,768.1750000000001,3
w13,48,64,6,3584,1536,16,128,128,32,4,3,760.9746666666666,3
w13,48,64,6,3584,1536,16,128,128,32,4,5,763.8016666666666,3
w13,48,64,6,3584,1536,16,128,128,32,8,3,764.0893333333333,3
w13,48,64,6,3584,1536,16,128,128,64,4,2,765.199,3
w13,48,64,6,3584,1536,16,128,128,64,4,3,763.3643333333333,3
w13,48,64,6,3584,1536,16,128,128,64,8,5,767.7906666666668,3
w13,48,64,6,3584,1536,32,128,128,1,4,3,767.0546666666665,3
w13,48,64,6,3584,1536,32,128,128,1,4,5,767.556,3
w13,48,64,6,3584,1536,32,128,128,4,4,3,768.1536666666667,3
w13,48,64,6,3584,1536,32,128,128,8,4,3,766.8629999999999,3
w13,48,64,6,3584,1536,32,128,128,8,4,5,767.0866666666667,3
w13,48,64,6,3584,1536,32,128,128,16,4,3,767.3746666666666,3
w13,48,64,6,3584,1536,32,128,128,32,4,3,765.5079999999999,3
w13,48,64,8,3584,2560,16,64,128,1,4,3,1275.9763333333333,3
w13,48,64,8,3584,2560,16,64,256,1,4,2,1269.918,3
w13,48,64,8,3584,2560,16,64,256,1,4,3,1266.8986666666667,3
w13,48,64,8,3584,2560,16,64,256,1,4,5,1273.1493333333333,3
w13,48,64,8,3584,2560,16,64,256,1,8,3,1276.2753333333333,3
w13,48,64,8,3584,2560,16,64,256,1,8,5,1276.595,3
w13,48,64,8,3584,2560,16,64,256,16,4,2,1270.5786666666665,3
w13,48,64,8,3584,2560,16,64,256,16,4,3,1266.4399999999998,3
w13,48,64,8,3584,2560,16,64,256,16,4,5,1275.6346666666666,3
w13,48,64,8,3584,2560,16,64,256,16,8,3,1274.3123333333333,3
w13,48,64,8,3584,2560,16,64,256,32,4,2,1270.7179999999998,3
w13,48,64,8,3584,2560,16,64,256,32,4,3,1269.576,3
w13,48,64,8,3584,2560,16,64,256,32,8,3,1276.2216666666666,3
w13,48,64,8,3584,2560,16,64,256,64,4,2,1273.224,3
w13,48,64,8,3584,2560,16,64,256,64,4,3,1274.5046666666667,3
w13,48,64,8,3584,2560,16,128,128,1,4,2,1270.7393333333332,3
w13,48,64,8,3584,2560,16,128,128,1,4,3,1264.5206666666666,3
w13,48,64,8,3584,2560,16,128,128,1,4,5,1271.5919999999999,3
w13,48,64,8,3584,2560,16,128,128,1,8,3,1269.4056666666665,3
w13,48,64,8,3584,2560,16,128,128,1,8,5,1270.4293333333333,3
w13,48,64,8,3584,2560,16,128,128,16,4,2,1267.1556666666665,3
w13,48,64,8,3584,2560,16,128,128,16,4,3,1269.1706666666666,3
w13,48,64,8,3584,2560,16,128,128,16,4,5,1268.7546666666667,3
w13,48,64,8,3584,2560,16,128,128,16,8,3,1269.3633333333335,3
w13,48,64,8,3584,2560,16,128,128,16,8,5,1268.6589999999999,3
w13,48,64,8,3584,2560,16,128,128,32,4,2,1265.1706666666666,3
w13,48,64,8,3584,2560,16,128,128,32,4,3,1275.4006666666667,3
w13,48,64,8,3584,2560,16,128,128,32,4,5,1271.0803333333333,3
w13,48,64,8,3584,2560,16,128,128,32,8,3,1274.2163333333333,3
w13,48,64,8,3584,2560,16,128,128,32,8,5,1275.1226666666666,3
w13,48,64,8,3584,2560,16,128,128,64,4,2,1272.755,3
w13,48,64,8,3584,2560,16,128,128,64,4,3,1271.1016666666667,3
w13,48,64,8,3584,2560,16,128,128,64,8,3,1276.915,3
w13,48,64,8,3584,2560,32,128,128,1,4,3,1272.232,3
w13,48,64,8,3584,2560,32,128,128,1,4,5,1274.0776666666668,3
w13,48,64,8,3584,2560,32,128,128,1,8,3,1277.2456666666667,3
w13,48,64,8,3584,2560,32,128,128,4,4,3,1276.4883333333335,3
w13,48,64,8,3584,2560,32,128,128,4,4,5,1276.2536666666667,3
w13,48,64,8,3584,2560,32,128,128,8,4,3,1274.483,3
w13,48,64,8,3584,2560,32,128,128,8,4,5,1273.9816666666668,3
w13,48,64,8,3584,2560,32,128,128,16,4,3,1270.227,3
w13,48,128,4,2048,512,16,64,128,1,8,3,294.094,3
w13,48,128,4,2048,512,16,64,128,16,4,3,293.795,3
w13,48,128,4,2048,512,16,64,128,16,8,3,293.689,3
w13,48,128,4,2048,512,16,64,128,16,8,5,293.64566666666667,3
w13,48,128,4,2048,512,16,64,128,32,4,3,292.4406666666667,3
w13,48,128,4,2048,512,16,64,128,32,4,5,293.96633333333335,3
w13,48,128,4,2048,512,16,64,128,32,8,3,293.3686666666667,3
w13,48,128,4,2048,512,16,64,128,64,4,3,294.1793333333333,3
w13,48,128,4,2048,512,16,64,128,64,4,5,293.6886666666667,3
w13,48,128,4,2048,512,16,64,128,64,8,3,293.443,3
w13,48,128,4,2048,512,16,64,256,32,4,3,293.29400000000004,3
w13,48,128,4,2048,512,16,128,128,1,4,3,293.2616666666667,3
w13,48,128,4,2048,512,16,128,128,1,8,3,293.21933333333334,3
w13,48,128,4,2048,512,16,128,128,16,4,3,293.71,3
w13,48,128,4,2048,512,16,128,128,16,8,3,293.966,3
w13,48,128,4,2048,512,16,128,128,32,4,5,293.8913333333333,3
w13,48,128,4,2048,512,16,128,128,32,8,3,293.337,3
w13,48,128,4,2048,512,16,128,128,64,4,3,293.8063333333334,3
w13,48,128,4,2048,512,16,128,128,64,4,5,294.0833333333333,3
w13,48,128,4,2048,512,16,128,128,64,8,3,291.38466666666665,3
w13,48,128,4,2048,512,16,128,128,64,8,5,293.91266666666667,3
w13,48,128,6,4096,2048,16,64,256,1,4,2,2283.374,3
w13,48,128,6,4096,2048,16,64,256,1,4,3,2273.5176666666666,3
w13,48,128,6,4096,2048,16,64,256,1,4,5,2281.518,3
w13,48,128,6,4096,2048,16,64,256,1,8,3,2290.211333333333,3
w13,48,128,6,4096,2048,16,64,256,1,8,5,2286.371333333333,3
w13,48,128,6,4096,2048,16,64,256,16,4,2,2278.2856666666667,3
w13,48,128,6,4096,2048,16,64,256,16,4,3,2272.75,3
w13,48,128,6,4096,2048,16,64,256,16,4,5,2278.1793333333335,3
w13,48,128,6,4096,2048,16,64,256,16,8,3,2284.483333333333,3
w13,48,128,6,4096,2048,16,64,256,16,8,5,2285.6993333333335,3
w13,48,128,6,4096,2048,16,64,256,32,4,2,2277.9553333333333,3
w13,48,128,6,4096,2048,16,64,256,32,4,3,2274.5523333333335,3
w13,48,128,6,4096,2048,16,64,256,32,4,5,2281.976666666667,3
w13,48,128,6,4096,2048,16,64,256,32,8,3,2291.789666666667,3
w13,48,128,6,4096,2048,16,64,256,32,8,5,2291.395666666667,3
w13,48,128,6,4096,2048,16,64,256,64,4,2,2285.7633333333333,3
w13,48,128,6,4096,2048,16,64,256,64,4,3,2278.2863333333335,3
w13,48,128,6,4096,2048,16,64,256,64,4,5,2289.8700000000003,3
w13,48,128,6,4096,2048,16,64,256,64,8,3,2293.9876666666664,3
w13,48,128,6,4096,2048,16,128,128,1,4,2,2295.1820000000002,3
w13,48,128,6,4096,2048,16,128,128,1,4,3,2293.134,3
w13,48,128,6,4096,2048,16,128,128,1,4,5,2291.6513333333332,3
w13,48,128,6,4096,2048,16,128,128,1,8,3,2294.744666666667,3
w13,48,128,6,4096,2048,16,128,128,16,4,2,2291.000666666667,3
w13,48,128,6,4096,2048,16,128,128,16,4,3,2295.565666666667,3
w13,48,128,6,4096,2048,16,128,128,16,4,5,2293.432666666667,3
w13,48,128,6,4096,2048,16,128,128,32,4,2,2290.19,3
w13,48,128,6,4096,2048,16,128,128,32,4,3,2287.587666666667,3
w13,48,128,8,2048,768,16,64,128,16,4,3,436.75033333333334,3
w13,48,128,8,2048,768,16,64,128,64,4,2,437.81666666666666,3
w13,48,128,8,2048,768,16,128,128,1,8,3,435.89733333333334,3
w13,48,128,8,2048,768,16,128,128,16,4,2,437.6573333333333,3
w13,48,128,8,2048,768,16,128,128,16,4,3,435.2353333333333,3
w13,48,128,8,2048,768,16,128,128,16,8,3,436.676,3
w13,48,128,8,2048,768,16,128,128,32,4,2,434.6493333333333,3
w13,48,128,8,2048,768,16,128,128,32,4,3,433.4646666666667,3
w13,48,128,8,2048,768,16,128,128,32,8,3,436.18533333333335,3
w13,48,128,8,2048,768,16,128,128,64,4,2,435.21433333333334,3
w13,48,128,8,2048,768,16,128,128,64,4,5,437.03833333333336,3
w13,48,128,8,2048,768,16,128,128,64,8,3,436.87833333333333,3
w13,48,128,8,2048,768,16,128,128,64,8,5,437.2626666666667,3
w13,48,128,8,4096,1536,16,64,256,1,4,2,1716.1923333333334,3
w13,48,128,8,4096,1536,16,64,256,1,4,3,1709.866,3
w13,48,128,8,4096,1536,16,64,256,1,4,5,1714.6563333333334,3
w13,48,128,8,4096,1536,16,64,256,1,8,3,1725.6533333333334,3
w13,48,128,8,4096,1536,16,64,256,1,8,5,1722.218,3
w13,48,128,8,4096,1536,16,64,256,16,4,2,1714.8590000000002,3
w13,48,128,8,4096,1536,16,64,256,16,4,3,1714.5173333333332,3
w13,48,128,8,4096,1536,16,64,256,16,4,5,1720.5543333333335,3
w13,48,128,8,4096,1536,16,64,256,16,8,3,1724.5016666666668,3
w13,48,128,8,4096,1536,16,64,256,16,8,5,1723.1683333333333,3
w13,48,128,8,4096,1536,16,64,256,32,4,2,1718.6343333333334,3
w13,48,128,8,4096,1536,16,64,256,32,4,3,1711.8190000000002,3
w13,48,128,8,4096,1536,16,64,256,32,4,5,1718.709,3
w13,48,128,8,4096,1536,16,64,256,32,8,5,1723.2740000000001,3
w13,48,128,8,4096,1536,16,64,256,64,4,2,1718.2830000000001,3
w13,48,128,8,4096,1536,16,64,256,64,4,3,1715.1993333333332,3
w13,48,128,8,4096,1536,16,64,256,64,4,5,1723.9356666666665,3
w13,48,128,8,4096,1536,16,128,128,1,4,3,1723.7759999999998,3
w13,48,128,8,4096,1536,16,128,128,16,4,3,1726.0159999999998,3
w13,48,128,8,4096,1536,16,128,128,16,4,5,1726.9013333333332,3
w13,48,128,8,4096,1536,16,128,128,32,4,2,1725.9203333333335,3
w13,48,128,8,4096,1536,16,128,128,32,4,3,1725.9413333333334,3
w13,48,128,8,4096,3072,16,64,128,16,4,2,3447.4743333333336,3
w13,48,128,8,4096,3072,16,64,256,1,4,2,3421.97,3
w13,48,128,8,4096,3072,16,64,256,1,4,3,3413.5113333333334,3
w13,48,128,8,4096,3072,16,64,256,1,4,5,3427.762,3
w13,48,128,8,4096,3072,16,64,256,1,8,3,3440.3710000000005,3
w13,48,128,8,4096,3072,16,64,256,1,8,5,3432.338333333333,3
w13,48,128,8,4096,3072,16,64,256,16,4,2,3415.8583333333336,3
w13,48,128,8,4096,3072,16,64,256,16,4,3,3414.099,3
w13,48,128,8,4096,3072,16,64,256,16,4,5,3422.855333333333,3
w13,48,128,8,4096,3072,16,64,256,16,8,3,3435.506,3
w13,48,128,8,4096,3072,16,64,256,16,8,5,3431.3356666666664,3
w13,48,128,8,4096,3072,16,64,256,32,4,2,3420.9036666666666,3
w13,48,128,8,4096,3072,16,64,256,32,4,3,3414.4286666666667,3
w13,48,128,8,4096,3072,16,64,256,32,4,5,3424.1353333333336,3
w13,48,128,8,4096,3072,16,64,256,32,8,3,3434.781333333334,3
w13,48,128,8,4096,3072,16,64,256,32,8,5,3431.6023333333337,3
w13,48,128,8,4096,3072,16,64,256,64,4,2,3422.301,3
w13,48,128,8,4096,3072,16,64,256,64,4,3,3419.0056666666665,3
w13,48,128,8,4096,3072,16,64,256,64,4,5,3435.9966666666664,3
w13,48,128,8,4096,3072,16,64,256,64,8,3,3441.042,3
w13,48,128,8,4096,3072,16,64,256,64,8,5,3445.074666666667,3
w13,48,128,8,4096,3072,16,128,128,1,4,3,3442.2263333333335,3
w13,48,128,8,4096,3072,16,128,128,1,8,3,3446.5253333333335,3
w13,48,128,8,4096,3072,16,128,128,16,4,2,3430.258,3
w13,48,128,8,4096,3072,16,128,128,16,4,3,3437.6506666666664,3
w13,48,128,8,4096,3072,16,128,128,16,4,5,3441.9173333333333,3
w13,48,128,8,4096,3072,16,128,128,16,8,3,3443.2826666666665,3
w13,48,128,8,4096,3072,16,128,128,32,4,2,3438.0446666666667,3
w13,48,128,8,4096,3072,16,128,128,32,4,3,3439.8153333333335,3
w13,48,128,8,4096,3072,16,128,128,32,4,5,3446.5896666666667,3
w13,48,128,8,4096,3072,16,128,128,32,8,3,3444.3703333333337,3
w13,48,128,8,4096,3072,16,128,128,64,4,2,3435.5699999999997,3
w13,48,128,8,4096,3072,16,128,128,64,4,3,3443.6346666666664,3
w13,48,128,8,4096,3072,32,128,128,16,4,3,3441.2776666666664,3
w13,64,8,2,1024,512,16,128,64,1,4,4,9.516666666666667,3
w13,64,16,2,1536,768,16,32,128,4,4,2,46.53,3
w13,64,16,2,1536,768,16,32,128,16,4,2,46.44466666666667,3
w13,64,16,2,1536,768,16,32,128,32,4,2,46.455000000000005,3
w13,64,16,2,1536,768,16,64,128,32,4,2,46.775,3
w13,64,16,2,1536,768,16,128,128,1,8,2,46.31666666666666,3
w13,64,16,2,1536,768,16,128,128,1,8,3,46.775,3
w13,64,16,2,1536,768,16,128,128,16,8,3,46.61533333333333,3
w13,64,16,2,1536,768,16,128,128,64,8,2,46.593999999999994,3
w13,64,16,4,1536,1024,16,64,128,1,4,2,60.439666666666675,3
w13,64,16,4,1536,1024,16,64,128,1,8,2,60.54566666666667,3
w13,64,16,4,1536,1024,16,64,128,16,4,2,60.364666666666665,3
w13,64,16,4,1536,1024,16,64,128,32,4,2,60.578,3
w13,64,16,4,1536,1024,16,64,128,32,8,2,60.738,3
w13,64,16,4,1536,1024,16,64,128,64,4,2,60.21533333333334,3
w13,64,16,4,1536,1024,16,128,128,1,8,2,60.26866666666666,3
w13,64,32,4,2048,768,16,32,128,4,4,4,113.91166666666668,3
w13,64,32,4,2048,768,16,128,128,1,4,2,113.61333333333333,3
w13,64,32,4,2048,768,16,128,128,1,8,3,112.93066666666668,3
w13,64,32,4,2048,768,16,128,128,1,8,4,113.77300000000001,3
w13,64,32,4,2048,768,16,128,128,16,8,3,113.79466666666667,3
w13,64,32,4,2048,768,16,128,128,64,8,3,113.94366666666667,3
w13,64,32,4,2048,768,16,128,128,64,8,4,113.17566666666666,3
w13,64,32,6,3072,1024,16,64,128,1,4,4,228.61033333333333,3
w13,64,32,6,3072,1024,16,64,128,1,8,2,228.90866666666668,3
w13,64,32,6,3072,1024,16,64,128,1,8,3,227.90633333333335,3
w13,64,32,6,3072,1024,16,64,128,16,8,2,227.39433333333332,3
w13,64,32,6,3072,1024,16,64,128,64,8,3,227.70366666666666,3
w13,64,32,6,3072,1024,16,64,256,1,4,3,228.22666666666666,3
w13,64,32,6,3072,1024,16,64,256,16,4,3,228.482,3
w13,64,32,6,3072,1024,16,128,128,1,8,3,226.62633333333335,3
w13,64,32,6,3072,1024,16,128,128,1,8,5,228.48266666666666,3
w13,64,32,6,3072,1024,16,128,128,16,4,3,227.29866666666666,3
w13,64,32,6,3072,1024,16,128,128,16,4,5,228.68533333333335,3
w13,64,32,6,3072,1024,16,128,128,16,8,3,228.84500000000003,3
w13,64,32,6,3072,1024,16,128,128,32,4,3,226.89333333333335,3
w13,64,32,6,3072,1024,16,128,128,32,8,3,228.365,3
w13,64,32,6,3072,1024,16,128,128,64,4,3,228.41866666666667,3
w13,64,32,6,3072,1024,16,128,128,64,8,3,227.064,3
w13,64,32,6,3072,1024,32,32,128,1,8,3,228.64266666666666,3
w13,64,32,6,3072,1024,32,32,256,4,4,2,228.21533333333332,3
w13,64,32,6,3072,1024,32,128,128,32,4,3,228.47199999999998,3
w13,64,60,4,2048,1408,16,64,128,16,4,3,380.5466666666666,3
w13,64,60,4,2048,1408,16,64,128,16,8,3,379.4483333333333,3
w13,64,60,4,2048,1408,16,64,256,16,4,3,380.74966666666666,3
w13,64,60,4,2048,1408,16,128,128,1,4,3,379.4483333333333,3
w13,64,60,4,2048,1408,16,128,128,1,8,3,379.88533333333334,3
w13,64,60,4,2048,1408,16,128,128,1,8,5,380.97333333333336,3
w13,64,60,4,2048,1408,16,128,128,16,4,3,377.67800000000005,3
w13,64,60,4,2048,1408,16,128,128,16,4,5,380.93100000000004,3
w13,64,60,4,2048,1408,16,128,128,16,8,5,381.37899999999996,3
w13,64,60,4,2048,1408,16,128,128,32,4,3,379.23499999999996,3
w13,64,60,4,2048,1408,16,128,128,32,8,3,379.811,3
w13,64,60,4,2048,1408,16,128,128,32,8,5,379.8966666666667,3
w13,64,60,4,2048,1408,16,128,128,64,4,2,381.10200000000003,3
w13,64,60,4,2048,1408,16,128,128,64,4,3,380.334,3
w13,64,60,4,2048,1408,16,128,128,64,8,3,379.49133333333333,3
w13,64,60,6,3584,2304,16,64,128,1,4,3,1080.9766666666667,3
w13,64,60,6,3584,2304,16,64,256,1,4,2,1073.254,3
w13,64,60,6,3584,2304,16,64,256,1,4,3,1070.9073333333333,3
w13,64,60,6,3584,2304,16,64,256,1,4,5,1076.7096666666666,3
w13,64,60,6,3584,2304,16,64,256,1,8,3,1078.8966666666668,3
w13,64,60,6,3584,2304,16,64,256,1,8,5,1080.8486666666665,3
w13,64,60,6,3584,2304,16,64,256,16,4,2,1072.7206666666668,3
w13,64,60,6,3584,2304,16,64,256,16,4,3,1073.5206666666666,3
w13,64,60,6,3584,2304,16,64,256,16,4,5,1079.974,3
w13,64,60,6,3584,2304,16,64,256,16,8,3,1080.571,3
w13,64,60,6,3584,2304,16,64,256,16,8,5,1081.1046666666668,3
w13,64,60,6,3584,2304,16,64,256,32,4,2,1074.3100000000002,3
w13,64,60,6,3584,2304,16,64,256,32,4,3,1073.8086666666666,3
w13,64,60,6,3584,2304,16,64,256,32,4,5,1081.2326666666665,3
w13,64,60,6,3584,2304,16,64,256,32,8,3,1079.5686666666668,3
w13,64,60,6,3584,2304,16,64,256,64,4,2,1077.5526666666667,3
w13,64,60,6,3584,2304,16,64,256,64,4,3,1080.7953333333332,3
w13,64,60,6,3584,2304,16,128,128,1,4,2,1070.4803333333332,3
w13,64,60,6,3584,2304,16,128,128,1,4,3,1073.691,3
w13,64,60,6,3584,2304,16,128,128,1,4,5,1073.7763333333332,3
w13,64,60,6,3584,2304,16,128,128,1,8,3,1075.9633333333334,3
w13,64,60,6,3584,2304,16,128,128,1,8,5,1075.4083333333335,3
w13,64,60,6,3584,2304,16,128,128,16,4,2,1072.5283333333334,3
w13,64,60,6,3584,2304,16,128,128,16,4,3,1073.169,3
w13,64,60,6,3584,2304,16,128,128,16,4,5,1075.4086666666667,3
w13,64,60,6,3584,2304,16,128,128,16,8,3,1076.571,3
w13,64,60,6,3584,2304,16,128,128,16,8,5,1077.755,3
w13,64,60,6,3584,2304,16,128,128,32,4,2,1074.1393333333333,3
w13,64,60,6,3584,2304,16,128,128,32,4,3,1074.1499999999999,3
w13,64,60,6,3584,2304,16,128,128,32,4,5,1078.256666666667,3
w13,64,60,6,3584,2304,16,128,128,32,8,3,1076.454,3
w13,64,60,6,3584,2304,16,128,128,32,8,5,1078.8006666666668,3
w13,64,60,6,3584,2304,16,128,128,64,4,2,1075.2486666666666,3
w13,64,60,6,3584,2304,16,128,128,64,4,3,1077.2003333333334,3
w13,64,60,6,3584,2304,16,128,128,64,8,3,1078.651,3
w13,64,60,6,3584,2304,32,128,128,1,4,3,1078.1180000000002,3
w13,64,60,6,3584,2304,32,128,128,1,4,5,1080.7416666666668,3
w13,64,60,6,3584,2304,32,128,128,1,8,3,1078.9603333333334,3
w13,64,60,6,3584,2304,32,128,128,4,4,3,1076.7846666666667,3
w13,64,60,6,3584,2304,32,128,128,4,4,5,1080.646,3
w13,64,60,6,3584,2304,32,128,128,8,4,3,1079.4406666666666,3
w13,64,60,6,3584,2304,32,128,128,8,4,5,1077.691,3
w13,64,60,6,3584,2304,32,128,128,16,4,3,1081.0723333333333,3
w13,64,60,6,3584,2304,32,128,128,32,4,3,1078.1286666666667,3
w13,64,60,6,3584,2304,32,128,128,32,4,5,1081.03,3
w13,64,60,8,2048,1536,16,128,128,1,4,3,414.8183333333333,3
w13,64,60,8,2048,1536,16,128,128,1,8,3,417.37899999999996,3
w13,64,60,8,2048,1536,16,128,128,16,4,2,415.3196666666667,3
w13,64,60,8,2048,1536,16,128,128,16,4,3,414.07233333333335,3
w13,64,60,8,2048,1536,16,128,128,16,8,3,415.21333333333337,3
w13,64,60,8,2048,1536,16,128,128,32,4,3,414.4346666666667,3
w13,64,60,8,2048,1536,16,128,128,32,8,3,414.051,3
w13,64,60,8,2048,1536,16,128,128,64,4,3,415.5013333333333,3
w13,64,60,8,2048,1536,16,128,128,64,8,3,416.41900000000004,3
w13,64,60,8,2048,1536,32,128,128,8,4,3,417.61366666666663,3
w13,64,60,8,2048,1536,32,128,128,16,4,3,417.4856666666667,3
w13,64,64,6,3072,2048,16,64,128,1,8,3,878.3306666666667,3
w13,64,64,6,3072,2048,16,64,128,16,4,3,878.5756666666666,3
w13,64,64,6,3072,2048,16,64,256,1,4,2,877.1573333333332,3
w13,64,64,6,3072,2048,16,64,256,1,4,3,872.9546666666666,3
w13,64,64,6,3072,2048,16,64,256,16,4,2,875.6003333333333,3
w13,64,64,6,3072,2048,16,64,256,16,4,3,874.341,3
w13,64,64,6,3072,2048,16,64,256,32,4,2,875.4720000000001,3
w13,64,64,6,3072,2048,16,64,256,32,4,3,876.7733333333334,3
w13,64,64,6,3072,2048,16,64,256,64,4,2,877.4776666666667,3
w13,64,64,6,3072,2048,16,128,128,1,4,2,873.7330000000001,3
w13,64,64,6,3072,2048,16,128,128,1,4,3,873.1999999999999,3
w13,64,64,6,3072,2048,16,128,128,1,4,5,878.5116666666667,3
w13,64,64,6,3072,2048,16,128,128,1,8,3,872.2506666666667,3
w13,64,64,6,3072,2048,16,128,128,1,8,5,875.8556666666667,3
w13,64,64,6,3072,2048,16,128,128,16,4,2,874.0213333333335,3
w13,64,64,6,3072,2048,16,128,128,16,4,3,869.9676666666668,3
w13,64,64,6,3072,2048,16,128,128,16,4,5,877.1356666666667,3
w13,64,64,6,3072,2048,16,128,128,16,8,3,872.9756666666667,3
w13,64,64,6,3072,2048,16,128,128,16,8,5,876.3466666666667,3
w13,64,64,6,3072,2048,16,128,128,32,4,2,875.0243333333333,3
w13,64,64,6,3072,2048,16,128,128,32,4,3,871.8773333333334,3
w13,64,64,6,3072,2048,16,128,128,32,4,5,876.6346666666667,3
w13,64,64,6,3072,2048,16,128,128,32,8,3,871.0876666666667,3
w13,64,64,6,3072,2048,16,128,128,64,4,2,875.3760000000001,3
w13,64,64,6,3072,2048,16,128,128,64,4,3,872.6346666666667,3
w13,64,64,6,3072,2048,16,128,128,64,4,5,878.3089999999999,3
w13,64,64,6,3072,2048,16,128,128,64,8,3,874.1066666666667,3
w13,64,64,6,3072,2048,32,128,128,1,4,3,877.5413333333332,3
w13,64,64,6,3072,2048,32,128,128,4,4,3,873.3813333333334,3
w13,64,64,6,3072,2048,32,128,128,4,8,3,877.3063333333333,3
w13,64,64,6,3072,2048,32,128,128,8,4,3,873.9893333333333,3
w13,64,64,6,3072,2048,32,128,128,16,4,3,872.6239999999999,3
w13,64,64,6,3072,2048,32,128,128,32,4,3,876.9123333333333,3
w13,64,64,6,3584,1536,16,64,256,1,4,2,767.919,3
w13,64,64,6,3584,1536,16,64,256,1,4,3,764.4306666666666,3
w13,64,64,6,3584,1536,16,64,256,1,4,5,768.2923333333333,3
w13,64,64,6,3584,1536,16,64,256,1,8,3,769.4763333333334,3
w13,64,64,6,3584,1536,16,64,256,1,8,5,770.5963333333333,3
w13,64,64,6,3584,1536,16,64,256,16,4,2,768.0576666666666,3
w13,64,64,6,3584,1536,16,64,256,16,4,3,767.9506666666666,3
w13,64,64,6,3584,1536,16,64,256,16,4,5,770.9266666666666,3
w13,64,64,6,3584,1536,16,64,256,16,8,3,770.2873333333333,3
w13,64,64,6,3584,1536,16,64,256,32,4,2,770.084,3
w13,64,64,6,3584,1536,16,64,256,32,4,3,768.3453333333333,3
w13,64,64,6,3584,1536,16,64,256,64,4,3,769.9346666666667,3
w13,64,64,6,3584,1536,16,128,128,1,4,2,766.895,3
w13,64,64,6,3584,1536,16,128,128,1,4,3,764.7193333333333,3
w13,64,64,6,3584,1536,16,128,128,1,4,5,765.3269999999999,3
w13,64,64,6,3584,1536,16,128,128,1,8,3,767.2256666666667,3
w13,64,64,6,3584,1536,16,128,128,1,8,5,764.1963333333333,3
w13,64,64,6,3584,1536,16,128,128,16,4,2,770.3299999999999,3
w13,64,64,6,3584,1536,16,128,128,16,4,3,766.4256666666666,3
w13,64,64,6,3584,1536,16,128,128,16,4,5,769.4230000000001,3
w13,64,64,6,3584,1536,16,128,128,16,8,3,768.1643333333333,3
w13,64,64,6,3584,1536,16,128,128,16,8,5,768.5593333333333,3
w13,64,64,6,3584,1536,16,128,128,32,4,2,770.724,3
w13,64,64,6,3584,1536,16,128,128,32,4,3,765.636,3
w13,64,64,6,3584,1536,16,128,128,32,8,3,769.0390000000001,3
w13,64,64,6,3584,1536,16,128,128,64,4,3,767.4920000000001,3
w13,64,64,6,3584,1536,16,128,128,64,8,3,771.407,3
w13,64,64,6,3584,1536,32,128,128,1,4,3,770.7246666666666,3
w13,64,64,6,3584,1536,32,128,128,1,4,5,771.834,3
w13,64,64,6,3584,1536,32,128,128,1,8,3,771.7056666666667,3
w13,64,64,6,3584,1536,32,128,128,4,4,3,770.8523333333333,3
w13,64,64,6,3584,1536,32,128,128,8,4,3,770.4683333333332,3
w13,64,64,6,3584,1536,32,128,128,16,4,3,769.2093333333333,3
w13,64,64,6,3584,1536,32,128,128,16,4,5,771.4923333333332,3
w13,64,64,6,3584,1536,32,128,128,32,4,3,769.114,3
w13,64,64,6,3584,1536,32,128,128,64,4,3,771.791,3
w13,64,64,8,3584,2560,16,64,128,1,4,2,1283.2196666666666,3
w13,64,64,8,3584,2560,16,64,128,1,4,3,1284.0623333333333,3
w13,64,64,8,3584,2560,16,64,256,1,4,2,1274.8890000000001,3
w13,64,64,8,3584,2560,16,64,256,1,4,3,1271.9979999999998,3
w13,64,64,8,3584,2560,16,64,256,1,4,5,1279.8376666666666,3
w13,64,64,8,3584,2560,16,64,256,1,8,3,1281.0966666666666,3
w13,64,64,8,3584,2560,16,64,256,1,8,5,1282.3336666666667,3
w13,64,64,8,3584,2560,16,64,256,16,4,2,1277.0326666666667,3
w13,64,64,8,3584,2560,16,64,256,16,4,3,1273.7046666666665,3
w13,64,64,8,3584,2560,16,64,256,16,4,5,1281.5236666666667,3
w13,64,64,8,3584,2560,16,64,256,16,8,3,1283.3263333333332,3
w13,64,64,8,3584,2560,16,64,256,32,4,2,1278.3976666666667,3
w13,64,64,8,3584,2560,16,64,256,32,4,3,1275.8486666666668,3
w13,64,64,8,3584,2560,16,64,256,64,4,2,1282.1846666666668,3
w13,64,64,8,3584,2560,16,64,256,64,4,3,1283.5926666666667,3
w13,64,64,8,3584,2560,16,128,128,1,4,2,1274.7820000000002,3
w13,64,64,8,3584,2560,16,128,128,1,4,3,1274.7606666666668,3
w13,64,64,8,3584,2560,16,128,128,1,4,5,1276.1576666666667,3
w13,64,64,8,3584,2560,16,128,128,1,8,3,1274.686,3
w13,64,64,8,3584,2560,16,128,128,1,8,5,1275.2403333333334,3
w13,64,64,8,3584,2560,16,128,128,16,4,2,1278.3876666666665,3
w13,64,64,8,3584,2560,16,128,128,16,4,3,1274.4833333333333,3
w13,64,64,8,3584,2560,16,128,128,16,4,5,1275.934,3
w13,64,64,8,3584,2560,16,128,128,16,8,3,1277.9076666666667,3
w13,64,64,8,3584,2560,16,128,128,16,8,5,1281.0966666666666,3
w13,64,64,8,3584,2560,16,128,128,32,4,2,1276.5420000000001,3
w13,64,64,8,3584,2560,16,128,128,32,4,3,1277.3313333333333,3
w13,64,64,8,3584,2560,16,128,128,32,4,5,1279.9553333333333,3
w13,64,64,8,3584,2560,16,128,128,32,8,3,1280.5206666666666,3
w13,64,64,8,3584,2560,16,128,128,32,8,5,1284.6063333333334,3
w13,64,64,8,3584,2560,16,128,128,64,4,2,1278.9743333333333,3
w13,64,64,8,3584,2560,16,128,128,64,4,3,1282.5046666666667,3
w13,64,64,8,3584,2560,32,128,128,1,4,3,1277.438,3
w13,64,64,8,3584,2560,32,128,128,1,4,5,1281.8436666666666,3
w13,64,64,8,3584,2560,32,128,128,4,4,3,1282.6009999999999,3
w13,64,64,8,3584,2560,32,128,128,4,4,5,1281.705,3
w13,64,64,8,3584,2560,32,128,128,8,4,3,1276.9583333333333,3
w13,64,64,8,3584,2560,32,128,128,8,4,5,1283.3796666666667,3
w13,64,64,8,3584,2560,32,128,128,8,8,3,1284.6593333333333,3
w13,64,64,8,3584,2560,32,128,128,8,8,5,1283.977,3
w13,64,64,8,3584,2560,32,128,128,16,4,3,1273.8863333333334,3
w13,64,64,8,3584,2560,32,128,128,16,4,5,1282.494,3
w13,64,64,8,3584,2560,32,128,128,32,4,3,1281.9183333333333,3
w13,64,128,4,2048,512,16,32,128,64,4,3,296.0566666666667,3
w13,64,128,4,2048,512,16,64,128,1,4,2,295.502,3
w13,64,128,4,2048,512,16,64,128,1,4,3,294.84066666666666,3
w13,64,128,4,2048,512,16,64,128,1,4,5,296.2916666666667,3
w13,64,128,4,2048,512,16,64,128,1,8,3,293.54966666666667,3
w13,64,128,4,2048,512,16,64,128,16,4,3,294.7763333333333,3
w13,64,128,4,2048,512,16,64,128,16,8,3,296.2063333333333,3
w13,64,128,4,2048,512,16,64,128,32,4,2,294.75533333333334,3
w13,64,128,4,2048,512,16,64,128,32,4,3,294.3496666666667,3
w13,64,128,4,2048,512,16,64,128,32,4,5,295.3633333333333,3
w13,64,128,4,2048,512,16,64,128,32,8,3,295.2673333333333,3
w13,64,128,4,2048,512,16,64,128,64,4,3,295.30966666666666,3
w13,64,128,4,2048,512,16,64,128,64,4,5,296.45133333333337,3
w13,64,128,4,2048,512,16,64,128,64,8,3,293.62433333333337,3
w13,64,128,4,2048,512,16,64,256,32,4,2,295.6513333333333,3
w13,64,128,4,2048,512,16,64,256,64,4,2,296.10966666666667,3
w13,64,128,4,2048,512,16,64,256,64,4,3,295.76866666666666,3
w13,64,128,4,2048,512,16,128,128,1,4,3,293.998,3
w13,64,128,4,2048,512,16,128,128,1,8,3,293.806,3
w13,64,128,4,2048,512,16,128,128,1,8,5,294.3926666666667,3
w13,64,128,4,2048,512,16,128,128,16,4,3,296.0563333333333,3
w13,64,128,4,2048,512,16,128,128,32,4,2,295.34200000000004,3
w13,64,128,4,2048,512,16,128,128,32,4,3,294.56300000000005,3
w13,64,128,4,2048,512,16,128,128,32,8,3,293.8806666666667,3
w13,64,128,4,2048,512,16,128,128,64,4,3,294.5416666666667,3
w13,64,128,4,2048,512,16,128,128,64,4,5,295.63033333333334,3
w13,64,128,4,2048,512,16,128,128,64,8,3,294.03,3
w13,64,128,4,2048,512,16,128,128,64,8,5,296.2166666666667,3
w13,64,128,6,4096,2048,16,64,256,1,4,2,2286.3726666666666,3
w13,64,128,6,4096,2048,16,64,256,1,4,3,2277.742666666667,3
w13,64,128,6,4096,2048,16,64,256,1,4,5,2282.3506666666667,3
w13,64,128,6,4096,2048,16,64,256,1,8,3,2296.1643333333336,3
w13,64,128,6,4096,2048,16,64,256,1,8,5,2292.036,3
w13,64,128,6,4096,2048,16,64,256,16,4,2,2286.0843333333337,3
w13,64,128,6,4096,2048,16,64,256,16,4,3,2278.3610000000003,3
w13,64,128,6,4096,2048,16,64,256,16,4,5,2286.0843333333337,3
w13,64,128,6,4096,2048,16,64,256,16,8,3,2293.646666666667,3
w13,64,128,6,4096,2048,16,64,256,16,8,5,2293.145666666667,3
w13,64,128,6,4096,2048,16,64,256,32,4,2,2284.036,3
w13,64,128,6,4096,2048,16,64,256,32,4,3,2283.0333333333333,3
w13,64,128,6,4096,2048,16,64,256,32,4,5,2286.9696666666664,3
w13,64,128,6,4096,2048,16,64,256,32,8,3,2298.958666666667,3
w13,64,128,6,4096,2048,16,64,256,32,8,5,2296.772333333333,3
w13,64,128,6,4096,2048,16,64,256,64,4,2,2294.095,3
w13,64,128,6,4096,2048,16,64,256,64,4,3,2287.0336666666667,3
w13,64,128,6,4096,2048,16,128,128,1,4,3,2299.4176666666667,3
w13,64,128,6,4096,2048,16,128,128,1,4,5,2299.5879999999997,3
w13,64,128,6,4096,2048,16,128,128,16,4,3,2297.273333333333,3
w13,64,128,6,4096,2048,16,128,128,32,4,2,2298.1380000000004,3
w13,64,128,6,4096,2048,16,128,128,32,4,3,2299.2043333333336,3
w13,64,128,8,2048,768,16,64,128,32,4,2,438.6383333333333,3
w13,64,128,8,2048,768,16,128,128,1,4,2,438.8733333333333,3
w13,64,128,8,2048,768,16,128,128,1,4,3,439.58799999999997,3
w13,64,128,8,2048,768,16,128,128,16,4,2,438.478,3
w13,64,128,8,2048,768,16,128,128,16,4,3,436.3126666666667,3
w13,64,128,8,2048,768,16,128,128,16,8,3,438.49966666666666,3
w13,64,128,8,2048,768,16,128,128,32,4,2,439.36366666666663,3
w13,64,128,8,2048,768,16,128,128,32,4,3,436.579,3
w13,64,128,8,2048,768,16,128,128,32,4,5,439.0116666666666,3
w13,64,128,8,2048,768,16,128,128,32,8,3,435.61899999999997,3
w13,64,128,8,2048,768,16,128,128,32,8,5,439.1396666666667,3
w13,64,128,8,2048,768,16,128,128,64,4,2,436.00333333333333,3
w13,64,128,8,2048,768,16,128,128,64,4,3,438.2966666666667,3
w13,64,128,8,2048,768,16,128,128,64,4,5,439.6836666666666,3
w13,64,128,8,2048,768,16,128,128,64,8,3,438.1793333333333,3
w13,64,128,8,2048,768,16,128,128,64,8,5,439.66266666666667,3
w13,64,128,8,4096,1536,16,64,128,16,4,3,1733.8886666666667,3
w13,64,128,8,4096,1536,16,64,256,1,4,2,1725.8033333333333,3
w13,64,128,8,4096,1536,16,64,256,1,4,3,1717.643,3
w13,64,128,8,4096,1536,16,64,256,1,4,5,1720.1496666666665,3
w13,64,128,8,4096,1536,16,64,256,1,8,3,1732.7896666666666,3
w13,64,128,8,4096,1536,16,64,256,1,8,5,1727.1260000000002,3
w13,64,128,8,4096,1536,16,64,256,16,4,2,1725.9309999999998,3
w13,64,128,8,4096,1536,16,64,256,16,4,3,1720.7043333333334,3
w13,64,128,8,4096,1536,16,64,256,16,4,5,1722.7306666666666,3
w13,64,128,8,4096,1536,16,64,256,16,8,3,1731.9686666666666,3
w13,64,128,8,4096,1536,16,64,256,32,4,2,1721.4296666666667,3
w13,64,128,8,4096,1536,16,64,256,32,4,3,1720.5763333333334,3
w13,64,128,8,4096,1536,16,64,256,32,4,5,1730.0696666666665,3
w13,64,128,8,4096,1536,16,64,256,32,8,3,1729.4189999999999,3
w13,64,128,8,4096,1536,16,64,256,32,8,5,1726.0483333333334,3
w13,64,128,8,4096,1536,16,64,256,64,4,2,1725.0249999999999,3
w13,64,128,8,4096,1536,16,64,256,64,4,3,1725.5363333333335,3
w13,64,128,8,4096,1536,16,64,256,64,4,5,1731.7123333333336,3
w13,64,128,8,4096,1536,16,64,256,64,8,3,1734.7096666666666,3
w13,64,128,8,4096,1536,16,128,128,1,4,2,1729.9206666666666,3
w13,64,128,8,4096,1536,16,128,128,1,4,3,1732.086,3
w13,64,128,8,4096,1536,16,128,128,1,8,3,1731.5523333333333,3
w13,64,128,8,4096,1536,16,128,128,1,8,5,1734.475333333333,3
w13,64,128,8,4096,1536,16,128,128,16,4,3,1728.5439999999999,3
w13,64,128,8,4096,1536,16,128,128,16,4,5,1734.486,3
w13,64,128,8,4096,1536,16,128,128,32,4,2,1733.515,3
w13,64,128,8,4096,1536,16,128,128,32,4,3,1729.291,3
w13,64,128,8,4096,1536,16,128,128,32,8,3,1734.3793333333333,3
w13,64,128,8,4096,1536,16,128,128,64,4,2,1734.4750000000001,3
w13,64,128,8,4096,1536,16,128,128,64,4,3,1733.9416666666666,3
w13,64,128,8,4096,1536,32,128,128,1,4,3,1732.6616666666669,3
w13,64,128,8,4096,1536,32,128,128,16,4,3,1733.227,3
w13,64,128,8,4096,3072,16,64,256,1,4,2,3436.6476666666663,3
w13,64,128,8,4096,3072,16,64,256,1,4,3,3424.2953333333335,3
w13,64,128,8,4096,3072,16,64,256,1,4,5,3436.498,3
w13,64,128,8,4096,3072,16,64,256,1,8,3,3452.572666666667,3
w13,64,128,8,4096,3072,16,64,256,1,8,5,3448.6479999999997,3
w13,64,128,8,4096,3072,16,64,256,16,4,2,3433.714,3
w13,64,128,8,4096,3072,16,64,256,16,4,3,3422.2909999999997,3
w13,64,128,8,4096,3072,16,64,256,16,4,5,3437.1380000000004,3
w13,64,128,8,4096,3072,16,64,256,16,8,3,3445.927333333333,3
w13,64,128,8,4096,3072,16,64,256,16,8,5,3448.5193333333336,3
w13,64,128,8,4096,3072,16,64,256,32,4,2,3434.322666666667,3
w13,64,128,8,4096,3072,16,64,256,32,4,3,3429.853333333333,3
w13,64,128,8,4096,3072,16,64,256,32,4,5,3437.9809999999998,3
w13,64,128,8,4096,3072,16,64,256,32,8,3,3453.49,3
w13,64,128,8,4096,3072,16,64,256,32,8,5,3448.0823333333333,3
w13,64,128,8,4096,3072,16,64,256,64,4,2,3440.679666666667,3
w13,64,128,8,4096,3072,16,64,256,64,4,3,3435.517333333333,3
w13,64,128,8,4096,3072,16,64,256,64,4,5,3453.469333333333,3
w13,64,128,8,4096,3072,16,64,256,64,8,3,3452.221666666667,3
w13,64,128,8,4096,3072,16,128,128,1,4,3,3447.8050000000003,3
w13,64,128,8,4096,3072,16,128,128,16,4,2,3438.727666666667,3
w13,64,128,8,4096,3072,16,128,128,16,4,3,3442.3230000000003,3
w13,64,128,8,4096,3072,16,128,128,16,4,5,3451.143666666667,3
w13,64,128,8,4096,3072,16,128,128,32,4,2,3438.9623333333334,3
w13,64,128,8,4096,3072,16,128,128,32,4,3,3448.6910000000003,3
w13,64,128,8,4096,3072,16,128,128,32,4,5,3454.045,3
w13,64,128,8,4096,3072,16,128,128,64,4,2,3445.671333333333,3
w13,64,128,8,4096,3072,16,128,128,64,4,3,3450.002,3
w13,64,128,8,4096,3072,32,128,128,16,4,3,3454.3763333333336,3
w13,96,8,2,1024,512,32,128,64,1,4,3,12.770000000000001,3
w13,96,8,2,1024,512,32,128,64,1,4,4,12.727666666666666,3
w13,96,8,2,1024,512,32,128,64,1,4,5,12.844666666666667,3
w13,96,16,2,1536,768,16,128,128,1,8,3,46.41266666666667,3
w13,96,16,2,1536,768,16,128,128,64,8,3,46.69,3
w13,96,16,4,1536,1024,32,64,128,16,4,2,62.10333333333333,3
w13,96,16,4,1536,1024,32,64,128,64,4,2,62.071333333333335,3
w13,96,32,4,2048,768,16,128,128,1,4,2,113.53833333333334,3
w13,96,32,4,2048,768,16,128,128,16,4,2,114.01833333333333,3
w13,96,32,4,2048,768,16,128,128,32,4,2,113.43133333333333,3
w13,96,32,4,2048,768,16,128,128,32,8,3,114.23133333333334,3
w13,96,32,6,3072,1024,16,128,128,16,8,3,232.25833333333333,3
w13,96,32,6,3072,1024,32,32,128,16,4,3,231.437,3
w13,96,32,6,3072,1024,32,32,256,1,4,2,231.021,3
w13,96,32,6,3072,1024,32,32,256,4,4,2,230.35999999999999,3
w13,96,32,6,3072,1024,32,32,256,16,4,2,231.25566666666668,3
w13,96,32,6,3072,1024,32,64,128,1,4,2,231.94899999999998,3
w13,96,32,6,3072,1024,32,64,128,4,4,2,232.00233333333335,3
w13,96,32,6,3072,1024,32,64,128,32,4,2,232.03433333333336,3
w13,96,32,6,3072,1024,32,64,256,1,8,2,231.58633333333333,3
w13,96,32,6,3072,1024,32,64,256,16,8,2,231.81033333333335,3
w13,96,32,6,3072,1024,32,128,128,1,4,5,232.525,3
w13,96,32,6,3072,1024,32,128,128,1,8,4,232.53566666666666,3
w13,96,32,6,3072,1024,32,128,128,4,4,3,230.89333333333335,3
w13,96,32,6,3072,1024,32,128,128,4,8,3,231.533,3
w13,96,32,6,3072,1024,32,128,128,8,4,3,231.85333333333332,3
w13,96,32,6,3072,1024,32,128,128,8,8,3,232.2156666666667,3
w13,96,32,6,3072,1024,32,128,128,32,4,3,231.52233333333334,3
w13,96,32,6,3072,1024,64,128,128,1,8,3,232.48233333333334,3
w13,96,32,6,3072,1024,64,128,128,16,8,3,231.37333333333333,3
w13,96,32,6,3072,1024,64,128,128,32,8,3,231.71466666666666,3
w13,96,60,4,2048,1408,16,64,128,1,4,3,384.7923333333333,3
w13,96,60,4,2048,1408,16,64,128,16,8,3,384.1206666666667,3
w13,96,60,4,2048,1408,16,128,128,1,4,3,382.083,3
w13,96,60,4,2048,1408,16,128,128,1,8,3,381.11266666666666,3
w13,96,60,4,2048,1408,16,128,128,1,8,5,384.526,3
w13,96,60,4,2048,1408,16,128,128,16,4,2,383.94966666666664,3
w13,96,60,4,2048,1408,16,128,128,16,4,3,381.52833333333336,3
w13,96,60,4,2048,1408,16,128,128,16,4,5,384.31199999999995,3
w13,96,60,4,2048,1408,16,128,128,16,8,3,382.03000000000003,3
w13,96,60,4,2048,1408,16,128,128,16,8,5,383.57633333333337,3
w13,96,60,4,2048,1408,16,128,128,32,4,2,382.862,3
w13,96,60,4,2048,1408,16,128,128,32,4,3,382.7443333333333,3
w13,96,60,4,2048,1408,16,128,128,64,4,3,382.13633333333337,3
w13,96,60,4,2048,1408,16,128,128,64,8,3,383.33099999999996,3
w13,96,60,4,2048,1408,32,128,128,32,4,3,383.33099999999996,3
w13,96,60,6,3584,2304,16,64,256,1,4,2,1080.1766666666665,3
w13,96,60,6,3584,2304,16,64,256,1,4,3,1080.6143333333332,3
w13,96,60,6,3584,2304,16,64,256,1,4,5,1084.9660000000001,3
w13,96,60,6,3584,2304,16,64,256,16,4,2,1083.9206666666666,3
w13,96,60,6,3584,2304,16,64,256,16,4,3,1083.6963333333333,3
w13,96,60,6,3584,2304,16,64,256,32,4,2,1087.483,3
w13,96,60,6,3584,2304,16,64,256,32,4,3,1086.086,3
w13,96,60,6,3584,2304,16,128,128,1,4,2,1078.7896666666668,3
w13,96,60,6,3584,2304,16,128,128,1,4,3,1076.7740000000001,3
w13,96,60,6,3584,2304,16,128,128,1,4,5,1082.7793333333334,3
w13,96,60,6,3584,2304,16,128,128,1,8,3,1082.1926666666666,3
w13,96,60,6,3584,2304,16,128,128,1,8,5,1083.2060000000001,3
w13,96,60,6,3584,2304,16,128,128,16,4,2,1079.4296666666667,3
w13,96,60,6,3584,2304,16,128,128,16,4,3,1081.3286666666665,3
w13,96,60,6,3584,2304,16,128,128,16,4,5,1086.4806666666666,3
w13,96,60,6,3584,2304,16,128,128,16,8,3,1085.8826666666666,3
w13,96,60,6,3584,2304,16,128,128,16,8,5,1087.046,3
w13,96,60,6,3584,2304,16,128,128,32,4,2,1083.494,3
w13,96,60,6,3584,2304,16,128,128,32,4,3,1083.3553333333332,3
w13,96,60,6,3584,2304,16,128,128,32,8,3,1085.4673333333333,3
w13,96,60,6,3584,2304,16,128,128,64,4,2,1083.355,3
w13,96,60,6,3584,2304,16,128,128,64,4,3,1086.0006666666666,3
w13,96,60,6,3584,2304,32,128,128,1,4,3,1083.3976666666667,3
w13,96,60,6,3584,2304,32,128,128,4,4,3,1087.3446666666666,3
w13,96,60,6,3584,2304,32,128,128,16,4,3,1082.406,3
w13,96,60,6,3584,2304,32,128,128,32,4,3,1084.6566666666665,3
w13,96,60,8,2048,1536,16,128,128,1,4,3,421.1233333333333,3
w13,96,60,8,2048,1536,16,128,128,1,8,3,422.5416666666667,3
w13,96,60,8,2048,1536,16,128,128,16,4,2,421.155,3
w13,96,60,8,2048,1536,16,128,128,16,4,3,419.45866666666666,3
w13,96,60,8,2048,1536,16,128,128,16,8,3,422.0613333333333,3
w13,96,60,8,2048,1536,16,128,128,32,4,2,423.0643333333333,3
w13,96,60,8,2048,1536,16,128,128,32,4,3,420.5043333333333,3
w13,96,60,8,2048,1536,16,128,128,32,8,3,419.7683333333334,3
w13,96,60,8,2048,1536,16,128,128,64,4,2,421.65633333333335,3
w13,96,60,8,2048,1536,16,128,128,64,4,3,420.06666666666666,3
w13,96,60,8,2048,1536,16,128,128,64,8,3,420.4293333333333,3
w13,96,60,8,2048,1536,32,128,128,8,4,3,421.57099999999997,3
w13,96,64,6,3072,2048,16,64,256,16,4,3,882.2133333333335,3
w13,96,64,6,3072,2048,16,128,128,1,4,3,879.109,3
w13,96,64,6,3072,2048,16,128,128,1,4,5,881.7546666666667,3
w13,96,64,6,3072,2048,16,128,128,1,8,3,880.8373333333334,3
w13,96,64,6,3072,2048,16,128,128,16,4,2,873.616,3
w13,96,64,6,3072,2048,16,128,128,16,4,3,875.4503333333333,3
w13,96,64,6,3072,2048,16,128,128,16,8,3,879.4399999999999,3
w13,96,64,6,3072,2048,16,128,128,32,4,2,877.755,3
w13,96,64,6,3072,2048,16,128,128,32,4,3,880.2936666666666,3
w13,96,64,6,3072,2048,16,128,128,32,8,3,881.2959999999999,3
w13,96,64,6,3072,2048,16,128,128,64,4,2,881.328,3
w13,96,64,6,3072,2048,16,128,128,64,4,3,879.835,3
w13,96,64,6,3072,2048,16,128,128,64,8,3,881.9573333333334,3
w13,96,64,6,3072,2048,32,128,128,1,4,3,881.7866666666665,3
w13,96,64,6,3072,2048,32,128,128,4,4,3,881.1039999999999,3
w13,96,64,6,3072,2048,32,128,128,32,4,3,881.531,3
w13,96,64,6,3584,1536,16,64,256,1,4,2,769.2423333333332,3
w13,96,64,6,3584,1536,16,64,256,1,4,3,767.94,3
w13,96,64,6,3584,1536,16,64,256,1,4,5,770.8526666666667,3
w13,96,64,6,3584,1536,16,64,256,1,8,3,773.6476666666667,3
w13,96,64,6,3584,1536,16,64,256,1,8,5,772.6763333333333,3
w13,96,64,6,3584,1536,16,64,256,16,4,3,770.074,3
w13,96,64,6,3584,1536,16,128,128,1,4,3,766.4050000000001,3
w13,96,64,6,3584,1536,16,128,128,1,4,5,773.156,3
w13,96,64,6,3584,1536,16,128,128,1,8,3,769.7323333333334,3
w13,96,64,6,3584,1536,16,128,128,1,8,5,772.869,3
w13,96,64,6,3584,1536,16,128,128,16,4,3,769.8823333333333,3
w13,96,64,6,3584,1536,16,128,128,16,4,5,773.0603333333333,3
w13,96,64,6,3584,1536,16,128,128,16,8,3,773.2420000000001,3
w13,96,64,6,3584,1536,16,128,128,16,8,5,772.6236666666667,3
w13,96,64,6,3584,1536,16,128,128,32,4,3,765.957,3
w13,96,64,6,3584,1536,16,128,128,64,4,3,773.4979999999999,3
w13,96,64,6,3584,1536,32,128,128,1,4,3,772.0473333333333,3
w13,96,64,6,3584,1536,32,128,128,8,4,3,770.8416666666667,3
w13,96,64,6,3584,1536,32,128,128,32,4,3,772.7086666666668,3
w13,96,64,8,3584,2560,16,64,256,1,4,2,1289.4173333333333,3
w13,96,64,8,3584,2560,16,64,256,1,4,3,1286.8996666666667,3
w13,96,64,8,3584,2560,16,64,256,16,4,2,1290.4196666666667,3
w13,96,64,8,3584,2560,16,64,256,16,4,3,1290.0573333333334,3
w13,96,64,8,3584,2560,16,128,128,1,4,2,1277.929,3
w13,96,64,8,3584,2560,16,128,128,1,4,3,1286.0996666666667,3
w13,96,64,8,3584,2560,16,128,128,1,4,5,1285.812,3
w13,96,64,8,3584,2560,16,128,128,1,8,3,1289.3103333333333,3
w13,96,64,8,3584,2560,16,128,128,16,4,2,1289.4596666666666,3
w13,96,64,8,3584,2560,16,128,128,16,4,3,1281.663,3
w13,96,64,8,3584,2560,16,128,128,16,4,5,1290.345,3
w13,96,64,8,3584,2560,16,128,128,16,8,3,1288.969,3
w13,96,64,8,3584,2560,16,128,128,32,4,2,1285.8756666666668,3
w13,96,64,8,3584,2560,16,128,128,32,4,3,1281.4063333333334,3
w13,96,64,8,3584,2560,16,128,128,64,4,2,1286.665,3
w13,96,64,8,3584,2560,16,128,128,64,4,3,1290.74,3
w13,96,64,8,3584,2560,32,128,128,1,4,3,1287.8276666666668,3
w13,96,64,8,3584,2560,32,128,128,4,4,3,1290.1960000000001,3
w13,96,64,8,3584,2560,32,128,128,8,4,3,1289.6626666666666,3
w13,96,128,4,2048,512,16,64,128,16,4,2,295.38466666666665,3
w13,96,128,4,2048,512,16,64,128,32,4,2,294.58466666666664,3
w13,96,128,4,2048,512,16,64,128,64,4,3,296.2166666666667,3
w13,96,128,4,2048,512,16,64,128,64,8,3,294.958,3
w13,96,128,4,2048,512,16,128,128,1,4,3,295.34166666666664,3
w13,96,128,4,2048,512,16,128,128,1,8,5,295.6086666666667,3
w13,96,128,4,2048,512,16,128,128,16,4,3,295.491,3
w13,96,128,4,2048,512,16,128,128,16,8,3,295.1603333333333,3
w13,96,128,4,2048,512,16,128,128,32,4,3,294.638,3
w13,96,128,4,2048,512,16,128,128,32,8,3,294.14733333333334,3
w13,96,128,4,2048,512,16,128,128,64,4,3,293.326,3
w13,96,128,4,2048,512,16,128,128,64,8,3,296.217,3
w13,96,128,6,4096,2048,16,64,256,1,4,2,2293.1246666666666,3
w13,96,128,6,4096,2048,16,64,256,1,4,3,2288.6233333333334,3
w13,96,128,6,4096,2048,16,64,256,1,4,5,2297.775666666667,3
w13,96,128,6,4096,2048,16,64,256,1,8,3,2306.8213333333333,3
w13,96,128,6,4096,2048,16,64,256,1,8,5,2301.7543333333333,3
w13,96,128,6,4096,2048,16,64,256,16,4,2,2297.914,3
w13,96,128,6,4096,2048,16,64,256,16,4,3,2292.144,3
w13,96,128,6,4096,2048,16,64,256,16,4,5,2298.7353333333335,3
w13,96,128,6,4096,2048,16,64,256,16,8,3,2309.3493333333336,3
w13,96,128,6,4096,2048,16,64,256,16,8,5,2303.2906666666663,3
w13,96,128,6,4096,2048,16,64,256,32,4,2,2298.1273333333334,3
w13,96,128,6,4096,2048,16,64,256,32,4,3,2291.364666666667,3
w13,96,128,6,4096,2048,16,64,256,32,4,5,2300.4743333333336,3
w13,96,128,6,4096,2048,16,64,256,32,8,3,2308.3996666666667,3
w13,96,128,6,4096,2048,16,64,256,32,8,5,2309.701,3
w13,96,128,6,4096,2048,16,64,256,64,4,2,2308.047666666667,3
w13,96,128,6,4096,2048,16,64,256,64,4,3,2301.210333333333,3
w13,96,128,6,4096,2048,16,128,128,1,4,2,2305.1246666666666,3
w13,96,128,6,4096,2048,16,128,128,1,4,3,2304.346,3
w13,96,128,6,4096,2048,16,128,128,1,4,5,2306.7999999999997,3
w13,96,128,6,4096,2048,16,128,128,1,8,3,2309.5626666666667,3
w13,96,128,6,4096,2048,16,128,128,16,4,2,2310.629,3
w13,96,128,6,4096,2048,16,128,128,32,4,2,2303.514333333333,3
w13,96,128,6,4096,2048,16,128,128,32,4,3,2310.2663333333335,3
w13,96,128,6,4096,2048,32,128,128,4,4,3,2309.488,3
w13,96,128,6,4096,2048,32,128,128,32,4,3,2310.6506666666664,3
w13,96,128,8,2048,768,16,64,128,1,4,2,447.161,3
w13,96,128,8,2048,768,16,64,128,1,4,3,445.2626666666667,3
w13,96,128,8,2048,768,16,64,128,1,4,5,446.6276666666667,3
w13,96,128,8,2048,768,16,64,128,1,8,3,447.1503333333333,3
w13,96,128,8,2048,768,16,64,128,16,4,2,443.2673333333334,3
w13,96,128,8,2048,768,16,64,128,16,4,3,443.513,3
w13,96,128,8,2048,768,16,64,128,16,4,5,444.068,3
w13,96,128,8,2048,768,16,64,128,16,8,3,445.92366666666663,3
w13,96,128,8,2048,768,16,64,128,32,4,2,442.734,3
w13,96,128,8,2048,768,16,64,128,32,4,3,443.097,3
w13,96,128,8,2048,768,16,64,128,32,4,5,445.4653333333333,3
w13,96,128,8,2048,768,16,64,128,32,8,3,444.2916666666667,3
w13,96,128,8,2048,768,16,64,128,64,4,3,445.049,3
w13,96,128,8,2048,768,16,64,128,64,4,5,446.7343333333333,3
w13,96,128,8,2048,768,16,64,128,64,8,3,445.11266666666666,3
w13,96,128,8,2048,768,16,64,256,1,4,2,446.308,3
w13,96,128,8,2048,768,16,64,256,16,4,2,445.8813333333333,3
w13,96,128,8,2048,768,16,64,256,16,4,3,446.42533333333336,3
w13,96,128,8,2048,768,16,64,256,32,4,2,446.5746666666667,3
w13,96,128,8,2048,768,16,64,256,32,4,3,446.75533333333334,3
w13,96,128,8,2048,768,16,64,256,64,4,3,445.9346666666667,3
w13,96,128,8,4096,1536,16,64,256,1,4,2,1732.811,3
w13,96,128,8,4096,1536,16,64,256,1,4,3,1730.1016666666667,3
w13,96,128,8,4096,1536,16,64,256,1,4,5,1733.2166666666665,3
w13,96,128,8,4096,1536,16,64,256,1,8,3,1743.381666666667,3
w13,96,128,8,4096,1536,16,64,256,1,8,5,1738.8166666666666,3
w13,96,128,8,4096,1536,16,64,256,16,4,2,1735.5736666666664,3
w13,96,128,8,4096,1536,16,64,256,16,4,3,1733.398,3
w13,96,128,8,4096,1536,16,64,256,16,4,5,1736.0113333333331,3
w13,96,128,8,4096,1536,16,64,256,16,8,3,1741.8563333333332,3
w13,96,128,8,4096,1536,16,64,256,16,8,5,1742.5816666666667,3
w13,96,128,8,4096,1536,16,64,256,32,4,2,1734.2616666666665,3
w13,96,128,8,4096,1536,16,64,256,32,4,3,1731.7340000000002,3
w13,96,128,8,4096,1536,16,64,256,32,4,5,1737.4616666666668,3
w13,96,128,8,4096,1536,16,64,256,32,8,3,1740.1603333333333,3
w13,96,128,8,4096,1536,16,64,256,32,8,5,1743.0616666666665,3
w13,96,128,8,4096,1536,16,64,256,64,4,2,1738.6666666666667,3
w13,96,128,8,4096,1536,16,64,256,64,4,3,1739.4886666666669,3
w13,96,128,8,4096,1536,16,128,128,1,4,2,1743.563,3
w13,96,128,8,4096,1536,16,128,128,1,4,3,1742.9336666666668,3
w13,96,128,8,4096,1536,16,128,128,1,4,5,1745.707,3
w13,96,128,8,4096,1536,16,128,128,1,8,3,1746.7740000000001,3
w13,96,128,8,4096,1536,16,128,128,1,8,5,1746.1123333333333,3
w13,96,128,8,4096,1536,16,128,128,16,4,2,1739.6809999999998,3
w13,96,128,8,4096,1536,16,128,128,16,4,3,1740.3526666666667,3
w13,96,128,8,4096,1536,16,128,128,16,4,5,1742.7956666666666,3
w13,96,128,8,4096,1536,16,128,128,16,8,3,1742.6033333333335,3
w13,96,128,8,4096,1536,16,128,128,16,8,5,1745.58,3
w13,96,128,8,4096,1536,16,128,128,32,4,2,1739.4246666666668,3
w13,96,128,8,4096,1536,16,128,128,32,4,3,1741.0563333333332,3
w13,96,128,8,4096,1536,16,128,128,32,4,5,1746.219,3
w13,96,128,8,4096,1536,16,128,128,32,8,3,1745.3773333333331,3
w13,96,128,8,4096,1536,16,128,128,64,4,2,1741.0146666666667,3
w13,96,128,8,4096,1536,16,128,128,64,4,3,1743.1476666666665,3
w13,96,128,8,4096,1536,32,128,128,1,4,3,1744.6083333333333,3
w13,96,128,8,4096,1536,32,128,128,4,4,5,1747.2120000000002,3
w13,96,128,8,4096,1536,32,128,128,16,4,3,1742.987,3
w13,96,128,8,4096,1536,32,128,128,32,4,3,1747.2430000000002,3
w13,96,128,8,4096,3072,16,64,256,1,4,2,3454.5353333333333,3
w13,96,128,8,4096,3072,16,64,256,1,4,3,3452.946,3
w13,96,128,8,4096,3072,16,64,256,1,4,5,3458.855333333333,3
w13,96,128,8,4096,3072,16,64,256,1,8,3,3476.242,3
w13,96,128,8,4096,3072,16,64,256,1,8,5,3471.2720000000004,3
w13,96,128,8,4096,3072,16,64,256,16,4,2,3453.6506666666664,3
w13,96,128,8,4096,3072,16,64,256,16,4,3,3451.6553333333336,3
w13,96,128,8,4096,3072,16,64,256,16,4,5,3459.8366666666666,3
w13,96,128,8,4096,3072,16,64,256,16,8,3,3471.239666666667,3
w13,96,128,8,4096,3072,16,64,256,16,8,5,3467.613,3
w13,96,128,8,4096,3072,16,64,256,32,4,2,3455.346666666667,3
w13,96,128,8,4096,3072,16,64,256,32,4,3,3452.8496666666665,3
w13,96,128,8,4096,3072,16,64,256,32,4,5,3463.9013333333332,3
w13,96,128,8,4096,3072,16,64,256,32,8,3,3471.7513333333336,3
w13,96,128,8,4096,3072,16,64,256,32,8,5,3474.1620000000003,3
w13,96,128,8,4096,3072,16,64,256,64,4,2,3462.61,3
w13,96,128,8,4096,3072,16,64,256,64,4,3,3462.983666666667,3
w13,96,128,8,4096,3072,16,64,256,64,4,5,3485.768,3
w13,96,128,8,4096,3072,16,64,256,64,8,3,3481.0633333333335,3
w13,96,128,8,4096,3072,16,128,128,1,4,2,3469.2980000000002,3
w13,96,128,8,4096,3072,16,128,128,1,4,3,3469.885333333333,3
w13,96,128,8,4096,3072,16,128,128,1,4,5,3479.2503333333334,3
w13,96,128,8,4096,3072,16,128,128,1,8,3,3485.6823333333336,3
w13,96,128,8,4096,3072,16,128,128,1,8,5,3484.3493333333336,3
w13,96,128,8,4096,3072,16,128,128,16,4,2,3461.672,3
w13,96,128,8,4096,3072,16,128,128,16,4,3,3466.2263333333335,3
w13,96,128,8,4096,3072,16,128,128,16,4,4,3483.1973333333335,3
w13,96,128,8,4096,3072,16,128,128,16,4,5,3475.634,3
w13,96,128,8,4096,3072,16,128,128,16,8,3,3477.597333333333,3
w13,96,128,8,4096,3072,16,128,128,16,8,5,3481.735666666667,3
w13,96,128,8,4096,3072,16,128,128,32,4,2,3459.634,3
w13,96,128,8,4096,3072,16,128,128,32,4,3,3464.7009999999996,3
w13,96,128,8,4096,3072,16,128,128,32,4,5,3477.874,3
w13,96,128,8,4096,3072,16,128,128,32,8,3,3483.1433333333334,3
w13,96,128,8,4096,3072,16,128,128,32,8,5,3484.381,3
w13,96,128,8,4096,3072,16,128,128,64,4,2,3473.415333333333,3
w13,96,128,8,4096,3072,16,128,128,64,4,3,3479.186,3
w13,96,128,8,4096,3072,32,128,128,1,4,3,3480.029,3
w13,96,128,8,4096,3072,32,128,128,4,4,5,3483.804666666667,3
w13,96,128,8,4096,3072,32,128,128,8,4,3,3474.780666666667,3
w13,96,128,8,4096,3072,32,128,128,8,4,5,3480.0399999999995,3
w13,96,128,8,4096,3072,32,128,128,16,4,3,3474.258,3
w13,96,128,8,4096,3072,32,128,128,16,4,5,3480.797,3
w13,96,128,8,4096,3072,32,128,128,32,4,3,3473.650666666667,3
w13,96,128,8,4096,3072,32,128,128,32,4,5,3484.029666666667,3
w13,128,8,2,1024,512,32,128,64,1,4,3,12.876666666666665,3
w13,128,8,2,1024,512,32,128,64,1,4,4,12.919333333333332,3
w13,128,8,2,1024,512,32,128,64,1,4,5,13.005,3
w13,128,16,2,1536,768,16,32,128,4,4,2,47.25533333333334,3
w13,128,16,2,1536,768,16,32,128,16,4,2,46.967000000000006,3
w13,128,16,2,1536,768,16,64,128,32,4,2,47.03133333333333,3
w13,128,16,2,1536,768,16,128,128,1,8,2,46.95633333333333,3
w13,128,16,2,1536,768,16,128,128,1,8,3,47.24466666666667,3
w13,128,16,2,1536,768,16,128,128,64,8,2,47.01,3
w13,128,16,4,1536,1024,32,64,128,16,4,2,63.522,3
w13,128,16,4,1536,1024,32,64,128,32,4,2,63.50066666666667,3
w13,128,16,4,1536,1024,32,64,128,64,4,2,63.12733333333333,3
w13,128,32,4,2048,768,16,128,128,1,4,2,115.25533333333334,3
w13,128,32,4,2048,768,16,128,128,1,8,3,114.957,3
w13,128,32,4,2048,768,16,128,128,1,8,4,115.245,3
w13,128,32,4,2048,768,16,128,128,16,4,2,115.55433333333333,3
w13,128,32,4,2048,768,16,128,128,16,8,3,114.541,3
w13,128,32,6,3072,1024,32,32,128,4,8,3,233.944,3
w13,128,32,6,3072,1024,32,32,256,1,4,2,232.8133333333333,3
w13,128,32,6,3072,1024,32,32,256,4,4,2,233.27133333333336,3
w13,128,32,6,3072,1024,32,64,128,4,4,2,232.30133333333333,3
w13,128,32,6,3072,1024,32,64,128,16,4,2,233.46366666666668,3
w13,128,32,6,3072,1024,32,64,128,32,4,2,231.8213333333333,3
w13,128,32,6,3072,1024,32,64,128,64,4,2,232.05633333333333,3
w13,128,32,6,3072,1024,32,64,256,8,8,2,233.64533333333335,3
w13,128,32,6,3072,1024,32,128,128,1,4,5,232.59966666666665,3
w13,128,32,6,3072,1024,32,128,128,4,4,3,232.9623333333333,3
w13,128,32,6,3072,1024,32,128,128,4,4,5,234.093,3
w13,128,32,6,3072,1024,32,128,128,32,4,2,232.73833333333334,3
w13,128,32,6,3072,1024,32,128,128,32,8,3,233.65566666666666,3
w13,128,32,6,3072,1024,32,128,128,64,4,3,232.85533333333333,3
w13,128,60,4,2048,1408,16,128,128,1,4,3,386.40333333333336,3
w13,128,60,4,2048,1408,16,128,128,1,8,3,385.1976666666667,3
w13,128,60,4,2048,1408,16,128,128,16,4,2,385.58166666666665,3
w13,128,60,4,2048,1408,16,128,128,16,4,3,382.8296666666667,3
w13,128,60,4,2048,1408,16,128,128,16,4,5,386.3283333333333,3
w13,128,60,4,2048,1408,16,128,128,16,8,3,384.867,3
w13,128,60,4,2048,1408,16,128,128,32,4,3,385.358,3
w13,128,60,4,2048,1408,16,128,128,32,8,3,385.752,3
w13,128,60,4,2048,1408,16,128,128,64,4,3,385.1656666666667,3
w13,128,60,4,2048,1408,32,128,128,16,4,3,384.8776666666667,3
w13,128,60,6,3584,2304,16,64,256,1,4,2,1090.47,3
w13,128,60,6,3584,2304,16,64,256,1,4,3,1087.782,3
w13,128,60,6,3584,2304,16,64,256,16,4,2,1090.7793333333332,3
w13,128,60,6,3584,2304,16,64,256,16,4,3,1092.3686666666665,3
w13,128,60,6,3584,2304,16,64,256,32,4,2,1092.1870000000001,3
w13,128,60,6,3584,2304,16,128,128,1,4,2,1082.3206666666667,3
w13,128,60,6,3584,2304,16,128,128,1,4,3,1088.3149999999998,3
w13,128,60,6,3584,2304,16,128,128,1,4,5,1090.4056666666668,3
w13,128,60,6,3584,2304,16,128,128,1,8,3,1085.5529999999999,3
w13,128,60,6,3584,2304,16,128,128,1,8,5,1091.846,3
w13,128,60,6,3584,2304,16,128,128,16,4,2,1090.9606666666666,3
w13,128,60,6,3584,2304,16,128,128,16,4,3,1087.974,3
w13,128,60,6,3584,2304,16,128,128,16,4,5,1092.8486666666668,3
w13,128,60,6,3584,2304,16,128,128,16,8,3,1093.2113333333334,3
w13,128,60,6,3584,2304,16,128,128,32,4,3,1090.5446666666667,3
w13,128,60,6,3584,2304,16,128,128,32,8,3,1089.5843333333332,3
w13,128,60,6,3584,2304,16,128,128,64,4,2,1092.0273333333334,3
w13,128,60,6,3584,2304,16,128,128,64,4,3,1092.4113333333332,3
w13,128,60,6,3584,2304,32,128,128,1,4,3,1091.6646666666666,3
w13,128,60,6,3584,2304,32,128,128,4,4,3,1092.294,3
w13,128,60,6,3584,2304,32,128,128,8,4,3,1091.43,3
w13,128,60,6,3584,2304,32,128,128,16,4,3,1092.1766666666665,3
w13,128,60,8,2048,1536,16,32,128,4,4,3,440.878,3
w13,128,60,8,2048,1536,16,32,128,16,4,3,441.59233333333333,3
w13,128,60,8,2048,1536,32,16,128,4,4,4,437.8163333333334,3
w13,128,60,8,2048,1536,32,32,128,4,4,2,439.73600000000005,3
w13,128,60,8,2048,1536,32,32,128,16,4,2,439.13933333333335,3
w13,128,60,8,2048,1536,32,128,128,1,8,3,441.62433333333337,3
w13,128,60,8,2048,1536,32,128,128,4,4,3,441.251,3
w13,128,60,8,2048,1536,32,128,128,4,8,3,437.90166666666664,3
w13,128,60,8,2048,1536,32,128,128,16,4,3,437.795,3
w13,128,60,8,2048,1536,32,128,128,16,4,5,441.5493333333334,3
w13,128,60,8,2048,1536,32,128,128,32,4,3,441.7626666666667,3
w13,128,60,8,2048,1536,32,128,128,32,4,5,439.5016666666667,3
w13,128,60,8,2048,1536,32,128,128,32,8,3,437.43233333333336,3
w13,128,60,8,2048,1536,32,128,128,64,4,3,439.8966666666667,3
w13,128,60,8,2048,1536,32,128,128,64,8,3,437.699,3
w13,128,64,6,3072,2048,16,64,256,1,4,2,888.8903333333334,3
w13,128,64,6,3072,2048,16,64,256,1,4,3,889.8613333333333,3
w13,128,64,6,3072,2048,16,64,256,16,4,2,891.1946666666666,3
w13,128,64,6,3072,2048,16,64,256,64,4,2,891.6743333333334,3
w13,128,64,6,3072,2048,16,128,128,1,4,2,882.9596666666666,3
w13,128,64,6,3072,2048,16,128,128,1,4,3,884.805,3
w13,128,64,6,3072,2048,16,128,128,1,4,5,888.1866666666666,3
w13,128,64,6,3072,2048,16,128,128,1,8,3,884.645,3
w13,128,64,6,3072,2048,16,128,128,1,8,5,889.0186666666667,3
w13,128,64,6,3072,2048,16,128,128,16,4,2,883.8879999999999,3
w13,128,64,6,3072,2048,16,128,128,16,4,3,885.232,3
w13,128,64,6,3072,2048,16,128,128,16,4,5,889.4023333333333,3
w13,128,64,6,3072,2048,16,128,128,16,8,3,886.2776666666667,3
w13,128,64,6,3072,2048,16,128,128,16,8,5,887.3969999999999,3
w13,128,64,6,3072,2048,16,128,128,32,4,2,885.872,3
w13,128,64,6,3072,2048,16,128,128,32,4,3,886.875,3
w13,128,64,6,3072,2048,16,128,128,32,8,3,887.0453333333334,3
w13,128,64,6,3072,2048,16,128,128,64,4,2,884.3893333333332,3
w13,128,64,6,3072,2048,16,128,128,64,4,3,886.299,3
w13,128,64,6,3072,2048,16,128,128,64,8,3,890.4050000000001,3
w13,128,64,6,3072,2048,32,128,128,1,4,3,885.467,3
w13,128,64,6,3072,2048,32,128,128,4,4,3,888.5493333333334,3
w13,128,64,6,3072,2048,32,128,128,4,4,5,890.5016666666667,3
w13,128,64,6,3072,2048,32,128,128,8,4,3,886.4050000000001,3
w13,128,64,6,3072,2048,32,128,128,8,8,3,890.9173333333333,3
w13,128,64,6,3072,2048,32,128,128,16,4,3,884.891,3
w13,128,64,6,3072,2048,32,128,128,32,4,3,890.235,3
w13,128,64,6,3072,2048,32,128,128,64,4,3,891.4613333333333,3
w13,128,64,6,3584,1536,16,64,256,1,4,3,775.5353333333333,3
w13,128,64,6,3584,1536,16,64,256,1,4,5,777.8290000000001,3
w13,128,64,6,3584,1536,16,128,128,1,4,2,775.5463333333333,3
w13,128,64,6,3584,1536,16,128,128,1,4,3,774.725,3
w13,128,64,6,3584,1536,16,128,128,1,4,5,776.4413333333333,3
w13,128,64,6,3584,1536,16,128,128,1,8,3,773.765,3
w13,128,64,6,3584,1536,16,128,128,1,8,5,776.709,3
w13,128,64,6,3584,1536,16,128,128,16,4,3,770.7033333333334,3
w13,128,64,6,3584,1536,16,128,128,16,4,5,777.178,3
w13,128,64,6,3584,1536,16,128,128,16,8,3,778.2023333333333,3
w13,128,64,6,3584,1536,16,128,128,32,4,2,778.373,3
w13,128,64,6,3584,1536,16,128,128,32,4,3,774.6610000000001,3
w13,128,64,6,3584,1536,32,128,128,1,4,3,777.114,3
w13,128,64,6,3584,1536,32,128,128,4,4,3,778.4583333333334,3
w13,128,64,8,3584,2560,16,64,256,1,4,2,1303.369,3
w13,128,64,8,3584,2560,16,64,256,1,4,3,1300.991,3
w13,128,64,8,3584,2560,16,64,256,16,4,2,1302.26,3
w13,128,64,8,3584,2560,16,64,256,16,4,3,1304.063,3
w13,128,64,8,3584,2560,16,64,256,32,4,2,1305.0656666666666,3
w13,128,64,8,3584,2560,16,64,256,32,4,3,1303.5726666666667,3
w13,128,64,8,3584,2560,16,128,128,1,4,2,1294.527,3
w13,128,64,8,3584,2560,16,128,128,1,4,3,1295.8703333333333,3
w13,128,64,8,3584,2560,16,128,128,1,4,5,1302.345,3
w13,128,64,8,3584,2560,16,128,128,1,8,3,1297.972,3
w13,128,64,8,3584,2560,16,128,128,1,8,5,1300.8943333333334,3
w13,128,64,8,3584,2560,16,128,128,16,4,2,1293.545,3
w13,128,64,8,3584,2560,16,128,128,16,4,3,1295.1566666666668,3
w13,128,64,8,3584,2560,16,128,128,16,4,5,1300.7883333333332,3
w13,128,64,8,3584,2560,16,128,128,16,8,3,1296.1263333333334,3
w13,128,64,8,3584,2560,16,128,128,16,8,5,1299.7533333333333,3
w13,128,64,8,3584,2560,16,128,128,32,4,2,1293.2143333333333,3
w13,128,64,8,3584,2560,16,128,128,32,4,3,1299.2093333333335,3
w13,128,64,8,3584,2560,16,128,128,32,4,5,1303.839,3
w13,128,64,8,3584,2560,16,128,128,32,8,3,1299.9983333333332,3
w13,128,64,8,3584,2560,16,128,128,64,4,2,1298.2169999999999,3
w13,128,64,8,3584,2560,16,128,128,64,4,3,1304.265,3
w13,128,64,8,3584,2560,32,128,128,1,4,3,1298.9423333333334,3
w13,128,64,8,3584,2560,32,128,128,1,4,5,1303.4440000000002,3
w13,128,64,8,3584,2560,32,128,128,1,8,3,1306.2063333333333,3
w13,128,64,8,3584,2560,32,128,128,4,4,3,1304.0096666666666,3
w13,128,64,8,3584,2560,32,128,128,8,4,3,1298.0576666666666,3
w13,128,64,8,3584,2560,32,128,128,8,4,5,1303.8066666666666,3
w13,128,64,8,3584,2560,32,128,128,8,8,3,1304.6706666666666,3
w13,128,64,8,3584,2560,32,128,128,16,4,3,1300.3509999999999,3
w13,128,64,8,3584,2560,32,128,128,16,4,5,1303.743333333333,3
w13,128,64,8,3584,2560,32,128,128,32,4,3,1302.2816666666668,3
w13,128,128,4,2048,512,16,16,64,1,4,5,302.23266666666666,3
w13,128,128,4,2048,512,16,16,128,1,4,2,301.518,3
w13,128,128,4,2048,512,16,16,128,4,4,2,302.8193333333333,3
w13,128,128,4,2048,512,16,16,256,1,4,2,301.8383333333333,3
w13,128,128,4,2048,512,16,16,256,1,4,4,301.03833333333336,3
w13,128,128,4,2048,512,16,16,256,4,4,2,302.382,3
w13,128,128,4,2048,512,16,16,256,4,4,4,301.582,3
w13,128,128,4,2048,512,16,32,64,1,4,5,303.08666666666664,3
w13,128,128,4,2048,512,16,32,128,32,4,3,303.96066666666667,3
w13,128,128,4,2048,512,16,64,128,32,8,3,303.982,3
w13,128,128,4,2048,512,16,128,128,1,8,5,303.5233333333333,3
w13,128,128,6,4096,2048,16,64,256,1,4,2,2308.378666666667,3
w13,128,128,6,4096,2048,16,64,256,1,4,3,2299.5253333333335,3
w13,128,128,6,4096,2048,16,64,256,1,4,5,2305.114666666667,3
w13,128,128,6,4096,2048,16,64,256,1,8,3,2315.3226666666665,3
w13,128,128,6,4096,2048,16,64,256,1,8,5,2311.92,3
w13,128,128,6,4096,2048,16,64,256,16,4,2,2304.72,3
w13,128,128,6,4096,2048,16,64,256,16,4,3,2304.9653333333335,3
w13,128,128,6,4096,2048,16,64,256,16,4,5,2313.0183333333334,3
w13,128,128,6,4096,2048,16,64,256,16,8,3,2320.346666666667,3
w13,128,128,6,4096,2048,16,64,256,16,8,5,2317.7013333333334,3
w13,128,128,6,4096,2048,16,64,256,32,4,2,2306.607666666667,3
w13,128,128,6,4096,2048,16,64,256,32,4,3,2307.152,3
w13,128,128,6,4096,2048,16,64,256,32,4,5,2312.3143333333333,3
w13,128,128,6,4096,2048,16,64,256,64,4,2,2319.653333333333,3
w13,128,128,6,4096,2048,16,64,256,64,4,3,2316.912,3
w13,128,128,6,4096,2048,16,128,128,1,4,2,2314.064,3
w13,128,128,6,4096,2048,16,128,128,1,4,3,2315.312,3
w13,128,128,6,4096,2048,16,128,128,1,4,5,2316.229333333333,3
w13,128,128,6,4096,2048,16,128,128,1,8,3,2318.5969999999998,3
w13,128,128,6,4096,2048,16,128,128,1,8,5,2320.592,3
w13,128,128,6,4096,2048,16,128,128,16,4,2,2317.690666666667,3
w13,128,128,6,4096,2048,16,128,128,16,4,3,2317.2639999999997,3
w13,128,128,6,4096,2048,16,128,128,16,8,3,2322.043,3
w13,128,128,6,4096,2048,16,128,128,32,4,2,2314.7146666666667,3
w13,128,128,6,4096,2048,16,128,128,32,4,3,2319.8133333333335,3
w13,128,128,6,4096,2048,32,128,128,1,4,3,2316.529,3
w13,128,128,6,4096,2048,32,128,128,1,4,5,2319.3873333333336,3
w13,128,128,6,4096,2048,32,128,128,4,4,3,2320.2936666666665,3
w13,128,128,8,2048,768,16,64,128,16,4,3,447.3106666666667,3
w13,128,128,8,2048,768,16,64,128,16,8,3,448.484,3
w13,128,128,8,2048,768,16,64,128,32,4,2,444.174,3
w13,128,128,8,2048,768,16,64,128,32,4,3,448.5793333333333,3
w13,128,128,8,2048,768,16,64,128,32,8,3,447.3213333333333,3
w13,128,128,8,2048,768,16,64,128,64,4,2,446.1793333333333,3
w13,128,128,8,2048,768,16,64,128,64,4,3,448.56866666666673,3
w13,128,128,8,2048,768,16,64,128,64,8,3,446.9583333333333,3
w13,128,128,8,2048,768,32,128,128,8,4,3,446.1693333333333,3
w13,128,128,8,2048,768,32,128,128,16,4,3,446.094,3
w13,128,128,8,2048,768,32,128,128,32,4,3,444.90000000000003,3
w13,128,128,8,2048,768,32,128,128,32,8,3,447.72599999999994,3
w13,128,128,8,2048,768,32,128,128,64,4,3,446.26533333333333,3
w13,128,128,8,2048,768,32,128,128,64,8,3,448.60099999999994,3
w13,128,128,8,4096,1536,16,64,256,1,4,2,1741.4193333333333,3
w13,128,128,8,4096,1536,16,64,256,1,4,3,1736.5020000000002,3
w13,128,128,8,4096,1536,16,64,256,1,4,5,1744.0006666666668,3
w13,128,128,8,4096,1536,16,64,256,1,8,3,1753.057,3
w13,128,128,8,4096,1536,16,64,256,1,8,5,1749.6643333333334,3
w13,128,128,8,4096,1536,16,64,256,16,4,2,1744.1823333333332,3
w13,128,128,8,4096,1536,16,64,256,16,4,3,1742.8916666666667,3
w13,128,128,8,4096,1536,16,64,256,16,4,5,1746.5283333333334,3
w13,128,128,8,4096,1536,16,64,256,16,8,3,1753.8563333333332,3
w13,128,128,8,4096,1536,16,64,256,16,8,5,1753.9523333333334,3
w13,128,128,8,4096,1536,16,64,256,32,4,2,1742.9133333333332,3
w13,128,128,8,4096,1536,16,64,256,32,4,3,1742.5603333333336,3
w13,128,128,8,4096,1536,16,64,256,32,4,5,1749.7393333333332,3
w13,128,128,8,4096,1536,16,64,256,64,4,2,1749.8136666666667,3
w13,128,128,8,4096,1536,16,64,256,64,4,3,1748.4696666666666,3
w13,128,128,8,4096,1536,16,128,128,1,4,2,1750.9129999999998,3
w13,128,128,8,4096,1536,16,128,128,1,4,3,1748.854,3
w13,128,128,8,4096,1536,16,128,128,1,4,5,1749.9203333333335,3
w13,128,128,8,4096,1536,16,128,128,1,8,3,1752.5019999999997,3
w13,128,128,8,4096,1536,16,128,128,16,4,2,1748.7906666666668,3
w13,128,128,8,4096,1536,16,128,128,16,4,3,1749.259,3
w13,128,128,8,4096,1536,16,128,128,16,4,5,1753.9096666666665,3
w13,128,128,8,4096,1536,16,128,128,16,8,3,1751.084,3
w13,128,128,8,4096,1536,16,128,128,32,4,2,1749.6966666666667,3
w13,128,128,8,4096,1536,16,128,128,32,4,3,1747.4566666666667,3
w13,128,128,8,4096,1536,16,128,128,32,4,5,1751.552333333333,3
w13,128,128,8,4096,1536,16,128,128,64,4,2,1751.7016666666666,3
w13,128,128,8,4096,1536,16,128,128,64,4,3,1753.9416666666666,3
w13,128,128,8,4096,1536,32,128,128,1,4,3,1749.6223333333335,3
w13,128,128,8,4096,1536,32,128,128,16,4,3,1749.5576666666666,3
w13,128,128,8,4096,1536,32,128,128,32,4,3,1753.8033333333333,3
w13,128,128,8,4096,3072,16,64,256,1,4,2,3482.843666666667,3
w13,128,128,8,4096,3072,16,64,256,1,4,3,3466.630333333333,3
w13,128,128,8,4096,3072,16,64,256,1,4,5,3475.153,3
w13,128,128,8,4096,3072,16,64,256,1,8,3,3494.8116666666665,3
w13,128,128,8,4096,3072,16,64,256,1,8,5,3486.108,3
w13,128,128,8,4096,3072,16,64,256,16,4,2,3471.1,3
w13,128,128,8,4096,3072,16,64,256,16,4,3,3469.34,3
w13,128,128,8,4096,3072,16,64,256,16,4,5,3479.494666666667,3
w13,128,128,8,4096,3072,16,64,256,16,8,3,3496.124,3
w13,128,128,8,4096,3072,16,64,256,16,8,5,3489.3186666666666,3
w13,128,128,8,4096,3072,16,64,256,32,4,2,3474.0226666666663,3
w13,128,128,8,4096,3072,16,64,256,32,4,3,3474.3423333333335,3
w13,128,128,8,4096,3072,16,64,256,32,4,5,3490.7479999999996,3
w13,128,128,8,4096,3072,16,64,256,32,8,3,3492.326333333333,3
w13,128,128,8,4096,3072,16,64,256,32,8,5,3495.5049999999997,3
w13,128,128,8,4096,3072,16,64,256,64,4,2,3485.3503333333333,3
w13,128,128,8,4096,3072,16,64,256,64,4,3,3486.6836666666663,3
w13,128,128,8,4096,3072,16,128,128,1,4,2,3495.3986666666665,3
w13,128,128,8,4096,3072,16,128,128,1,4,3,3481.671,3
w13,128,128,8,4096,3072,16,128,128,1,4,5,3488.252,3
w13,128,128,8,4096,3072,16,128,128,1,8,3,3500.0496666666663,3
w13,128,128,8,4096,3072,16,128,128,1,8,5,3500.732,3
w13,128,128,8,4096,3072,16,128,128,16,4,2,3477.9159999999997,3
w13,128,128,8,4096,3072,16,128,128,16,4,3,3481.116,3
w13,128,128,8,4096,3072,16,128,128,16,4,5,3494.481333333333,3
w13,128,128,8,4096,3072,16,128,128,16,8,3,3495.974666666667,3
w13,128,128,8,4096,3072,16,128,128,16,8,5,3500.7316666666666,3
w13,128,128,8,4096,3072,16,128,128,32,4,2,3483.046333333333,3
w13,128,128,8,4096,3072,16,128,128,32,4,3,3488.7213333333334,3
w13,128,128,8,4096,3072,16,128,128,32,4,5,3497.4466666666667,3
w13,128,128,8,4096,3072,16,128,128,64,4,2,3497.0310000000004,3
w13,128,128,8,4096,3072,32,128,128,1,4,3,3492.817333333333,3
w13,128,128,8,4096,3072,32,128,128,1,4,5,3496.903333333333,3
w13,128,128,8,4096,3072,32,128,128,4,4,3,3500.007,3
w13,128,128,8,4096,3072,32,128,128,8,4,3,3494.268666666667,3
w13,128,128,8,4096,3072,32,128,128,8,4,5,3500.3593333333333,3
w13,128,128,8,4096,3072,32,128,128,16,4,3,3491.2713333333336,3
w13,128,128,8,4096,3072,32,128,128,16,4,5,3500.4126666666666,3
w13,128,128,8,4096,3072,32,128,128,32,4,3,3491.868,3
w13,256,8,2,1024,512,64,64,64,1,4,3,17.826,3
w13,256,8,2,1024,512,64,128,64,1,4,3,17.847333333333335,3
w13,256,8,2,1024,512,64,128,64,1,4,4,17.89,3
w13,256,8,2,1024,512,64,128,64,1,4,5,17.858,3
w13,256,8,2,1024,512,64,128,128,1,8,3,17.718999999999998,3
w13,256,16,2,1536,768,32,64,128,1,4,2,49.93266666666667,3
w13,256,16,2,1536,768,32,128,128,1,8,2,49.900666666666666,3
w13,256,16,2,1536,768,32,128,128,1,8,3,49.99666666666667,3
w13,256,16,2,1536,768,32,128,128,8,4,3,49.623,3
w13,256,16,2,1536,768,32,128,128,16,4,3,49.51666666666667,3
w13,256,16,2,1536,768,32,128,128,32,4,3,49.84766666666667,3
w13,256,16,2,1536,768,32,128,128,32,8,2,49.93266666666667,3
w13,256,16,2,1536,768,32,128,128,64,4,3,49.56999999999999,3
w13,256,16,2,1536,768,32,128,128,64,8,3,49.77266666666666,3
w13,256,16,4,1536,1024,64,64,64,1,4,4,73.101,3
w13,256,16,4,1536,1024,64,64,64,1,8,4,73.37833333333333,3
w13,256,16,4,1536,1024,64,64,64,4,8,4,73.22866666666665,3
w13,256,32,4,2048,768,32,32,128,1,4,2,119.79966666666667,3
w13,256,32,4,2048,768,32,32,128,4,4,2,119.04233333333333,3
w13,256,32,4,2048,768,32,32,128,16,4,2,119.693,3
w13,256,32,4,2048,768,32,64,128,1,8,2,118.67933333333333,3
w13,256,32,4,2048,768,32,64,128,16,8,2,119.73566666666666,3
w13,256,32,4,2048,768,32,64,128,32,8,2,119.77833333333332,3
w13,256,32,4,2048,768,32,64,128,64,8,2,119.75733333333334,3
w13,256,32,6,3072,1024,64,128,128,1,8,3,237.698,3
w13,256,60,4,2048,1408,32,128,128,1,8,3,405.62466666666666,3
w13,256,60,4,2048,1408,32,128,128,1,8,5,407.53399999999993,3
w13,256,60,4,2048,1408,32,128,128,4,4,3,407.48033333333336,3
w13,256,60,4,2048,1408,32,128,128,4,8,3,407.3736666666667,3
w13,256,60,4,2048,1408,32,128,128,8,4,3,406.90500000000003,3
w13,256,60,4,2048,1408,32,128,128,8,8,3,406.8516666666667,3
w13,256,60,4,2048,1408,32,128,128,16,4,3,405.86966666666666,3
w13,256,60,4,2048,1408,32,128,128,16,4,5,407.4483333333333,3
w13,256,60,4,2048,1408,32,128,128,16,8,3,403.80033333333336,3
w13,256,60,4,2048,1408,32,128,128,32,4,3,405.01666666666665,3
w13,256,60,6,3584,2304,32,128,128,1,4,2,1120.454,3
w13,256,60,6,3584,2304,32,128,128,1,4,3,1114.1286666666667,3
w13,256,60,6,3584,2304,32,128,128,1,4,5,1123.5159999999998,3
w13,256,60,6,3584,2304,32,128,128,1,8,3,1117.6916666666666,3
w13,256,60,6,3584,2304,32,128,128,1,8,5,1119.2060000000001,3
w13,256,60,6,3584,2304,32,128,128,4,4,2,1118.7796666666666,3
w13,256,60,6,3584,2304,32,128,128,4,4,3,1115.1313333333335,3
w13,256,60,6,3584,2304,32,128,128,4,4,5,1124.1556666666668,3
w13,256,60,6,3584,2304,32,128,128,4,8,3,1122.0116666666665,3
w13,256,60,6,3584,2304,32,128,128,8,4,2,1120.9553333333333,3
w13,256,60,6,3584,2304,32,128,128,8,4,3,1114.8863333333331,3
w13,256,60,6,3584,2304,32,128,128,8,4,5,1125.2433333333336,3
w13,256,60,6,3584,2304,32,128,128,8,8,3,1120.0913333333333,3
w13,256,60,6,3584,2304,32,128,128,16,4,2,1119.825,3
w13,256,60,6,3584,2304,32,128,128,16,4,3,1116.369,3
w13,256,60,6,3584,2304,32,128,128,16,8,3,1120.8913333333333,3
w13,256,60,6,3584,2304,32,128,128,32,4,3,1122.2569999999998,3
w13,256,60,8,2048,1536,64,64,64,1,4,3,467.491,3
w13,256,60,8,2048,1536,64,64,64,1,4,5,467.6086666666667,3
w13,256,60,8,2048,1536,64,64,64,4,4,3,469.48566666666665,3
w13,256,60,8,2048,1536,64,64,64,4,4,5,466.2326666666666,3
w13,256,60,8,2048,1536,64,64,64,16,4,3,466.62733333333335,3
w13,256,60,8,2048,1536,64,64,64,16,4,4,470.4456666666667,3
w13,256,60,8,2048,1536,64,64,64,16,4,5,467.67266666666666,3
w13,256,60,8,2048,1536,64,64,64,32,4,5,470.3286666666666,3
w13,256,60,8,2048,1536,64,128,64,1,4,3,465.859,3
w13,256,60,8,2048,1536,64,128,64,1,4,4,468.93066666666664,3
w13,256,60,8,2048,1536,64,128,64,4,4,3,469.443,3
w13,256,60,8,2048,1536,64,128,64,4,4,4,470.435,3
w13,256,60,8,2048,1536,64,128,64,16,4,3,468.01366666666667,3
w13,256,60,8,2048,1536,64,128,128,1,4,2,468.035,3
w13,256,60,8,2048,1536,64,128,128,4,4,2,467.09666666666664,3
w13,256,60,8,2048,1536,64,128,128,16,4,2,466.67,3
w13,256,60,8,2048,1536,64,128,128,32,4,2,466.58466666666664,3
w13,256,60,8,2048,1536,64,128,128,64,4,2,467.907,3
w13,256,60,8,2048,1536,64,256,64,1,8,4,469.8486666666667,3
w13,256,64,6,3072,2048,32,128,128,1,4,3,903.7173333333334,3
w13,256,64,6,3072,2048,32,128,128,1,4,5,910.7040000000001,3
w13,256,64,6,3072,2048,32,128,128,1,8,3,910.437,3
w13,256,64,6,3072,2048,32,128,128,1,8,5,910.8636666666666,3
w13,256,64,6,3072,2048,32,128,128,4,4,3,906.2456666666667,3
w13,256,64,6,3072,2048,32,128,128,4,4,5,911.899,3
w13,256,64,6,3072,2048,32,128,128,4,8,3,909.8403333333334,3
w13,256,64,6,3072,2048,32,128,128,8,4,2,911.3973333333333,3
w13,256,64,6,3072,2048,32,128,128,8,4,3,906.0636666666666,3
w13,256,64,6,3072,2048,32,128,128,8,8,3,911.974,3
w13,256,64,6,3072,2048,32,128,128,16,4,3,910.0956666666667,3
w13,256,64,6,3072,2048,32,128,128,16,8,3,911.8883333333333,3
w13,256,64,6,3072,2048,32,128,128,32,4,3,912.293,3
w13,256,64,6,3584,1536,32,128,128,1,4,2,798.2233333333334,3
w13,256,64,6,3584,1536,32,128,128,1,4,3,793.4666666666667,3
w13,256,64,6,3584,1536,32,128,128,1,4,5,798.9276666666666,3
w13,256,64,6,3584,1536,32,128,128,1,8,3,800.069,3
w13,256,64,6,3584,1536,32,128,128,4,4,3,794.3939999999999,3
w13,256,64,6,3584,1536,32,128,128,4,4,5,798.906,3
w13,256,64,6,3584,1536,32,128,128,4,8,3,797.274,3
w13,256,64,6,3584,1536,32,128,128,8,4,2,801.0293333333334,3
w13,256,64,6,3584,1536,32,128,128,8,4,3,793.1566666666668,3
w13,256,64,6,3584,1536,32,128,128,8,8,3,798.7886666666667,3
w13,256,64,6,3584,1536,32,128,128,16,4,2,797.797,3
w13,256,64,6,3584,1536,32,128,128,16,4,3,796.709,3
w13,256,64,6,3584,1536,32,128,128,16,8,3,799.8023333333334,3
w13,256,64,6,3584,1536,32,128,128,32,4,2,799.6953333333335,3
w13,256,64,6,3584,1536,32,128,128,32,4,3,795.8770000000001,3
w13,256,64,8,3584,2560,32,128,128,1,4,2,1335.1566666666668,3
w13,256,64,8,3584,2560,32,128,128,1,4,3,1334.41,3
w13,256,64,8,3584,2560,32,128,128,1,4,5,1337.802,3
w13,256,64,8,3584,2560,32,128,128,1,8,3,1339.2956666666666,3
w13,256,64,8,3584,2560,32,128,128,4,4,2,1339.5623333333333,3
w13,256,64,8,3584,2560,32,128,128,4,4,3,1338.1753333333334,3
w13,256,64,8,3584,2560,32,128,128,4,8,3,1340.5646666666667,3
w13,256,64,8,3584,2560,32,128,128,8,4,2,1337.3433333333332,3
w13,256,64,8,3584,2560,32,128,128,8,4,3,1329.7913333333333,3
w13,256,64,8,3584,2560,32,128,128,8,4,5,1341.0233333333333,3
w13,256,64,8,3584,2560,32,128,128,8,8,3,1332.8313333333333,3
w13,256,64,8,3584,2560,32,128,128,16,4,2,1337.2686666666666,3
w13,256,64,8,3584,2560,32,128,128,16,4,3,1331.8503333333335,3
w13,256,64,8,3584,2560,32,128,128,16,4,5,1338.9006666666667,3
w13,256,64,8,3584,2560,32,128,128,16,8,3,1340.3513333333333,3
w13,256,64,8,3584,2560,32,128,128,32,4,2,1340.2446666666667,3
w13,256,64,8,3584,2560,32,128,128,32,4,3,1338.3033333333333,3
w13,256,128,4,2048,512,16,64,128,1,4,2,300.06733333333335,3
w13,256,128,4,2048,512,16,64,128,1,4,3,302.8193333333333,3
w13,256,128,4,2048,512,16,64,128,1,8,3,300.771,3
w13,256,128,4,2048,512,16,64,128,16,4,2,302.20033333333333,3
w13,256,128,4,2048,512,16,64,128,16,4,3,302.915,3
w13,256,128,4,2048,512,16,64,128,16,8,3,301.401,3
w13,256,128,4,2048,512,16,64,128,32,4,2,300.86733333333336,3
w13,256,128,4,2048,512,16,64,128,32,4,3,301.454,3
w13,256,128,4,2048,512,16,64,128,32,8,3,302.19,3
w13,256,128,4,2048,512,16,64,128,64,4,2,301.9766666666667,3
w13,256,128,4,2048,512,16,64,128,64,4,3,301.26166666666666,3
w13,256,128,4,2048,512,16,64,128,64,8,3,302.3926666666667,3
w13,256,128,4,2048,512,16,64,256,1,4,3,302.6913333333333,3
w13,256,128,6,4096,2048,16,64,256,1,4,2,2335.4723333333336,3
w13,256,128,6,4096,2048,16,64,256,1,4,3,2329.157333333333,3
w13,256,128,6,4096,2048,16,64,256,1,4,5,2340.0056666666665,3
w13,256,128,6,4096,2048,16,64,256,1,8,3,2349.2856666666667,3
w13,256,128,6,4096,2048,16,64,256,1,8,5,2348.0273333333334,3
w13,256,128,6,4096,2048,16,64,256,16,4,2,2347.899,3
w13,256,128,6,4096,2048,16,64,256,16,4,3,2339.8566666666666,3
w13,256,128,6,4096,2048,16,64,256,16,4,5,2349.1683333333335,3
w13,256,128,6,4096,2048,16,64,256,32,4,2,2347.7819999999997,3
w13,256,128,6,4096,2048,16,64,256,32,4,3,2347.291333333333,3
w13,256,128,6,4096,2048,16,128,128,1,4,2,2344.699666666667,3
w13,256,128,6,4096,2048,16,128,128,1,4,3,2344.4863333333333,3
w13,256,128,6,4096,2048,16,128,128,1,4,5,2349.744666666667,3
w13,256,128,6,4096,2048,16,128,128,1,8,3,2346.8963333333336,3
w13,256,128,6,4096,2048,16,128,128,1,8,5,2350.993,3
w13,256,128,6,4096,2048,16,128,128,16,4,2,2346.630333333333,3
w13,256,128,6,4096,2048,16,128,128,16,4,3,2348.8056666666666,3
w13,256,128,6,4096,2048,16,128,128,32,4,2,2351.003666666667,3
w13,256,128,6,4096,2048,16,128,128,32,4,3,2352.017,3
w13,256,128,6,4096,2048,32,128,128,1,4,3,2347.5686666666666,3
w13,256,128,6,4096,2048,32,128,128,1,4,5,2349.7876666666666,3
w13,256,128,6,4096,2048,32,128,128,4,4,3,2347.0243333333333,3
w13,256,128,6,4096,2048,32,128,128,4,4,5,2350.16,3
w13,256,128,8,2048,768,16,32,128,1,4,3,464.61133333333333,3
w13,256,128,8,2048,768,16,32,128,4,4,3,462.66,3
w13,256,128,8,2048,768,16,32,128,16,4,3,462.297,3
w13,256,128,8,2048,768,16,32,128,32,4,2,464.0466666666666,3
w13,256,128,8,2048,768,16,32,128,32,4,3,465.63599999999997,3
w13,256,128,8,2048,768,16,32,256,1,4,2,466.4893333333334,3
w13,256,128,8,2048,768,16,32,256,16,4,2,464.6546666666666,3
w13,256,128,8,2048,768,16,64,128,16,8,3,466.7556666666667,3
w13,256,128,8,2048,768,16,64,128,32,4,3,464.9316666666667,3
w13,256,128,8,2048,768,16,64,128,64,4,3,465.0916666666667,3
w13,256,128,8,2048,768,16,64,128,64,8,3,462.41433333333333,3
w13,256,128,8,2048,768,16,128,128,1,4,5,466.222,3
w13,256,128,8,2048,768,16,128,128,1,8,3,464.3666666666666,3
w13,256,128,8,2048,768,16,128,128,1,8,5,464.47333333333336,3
w13,256,128,8,2048,768,16,128,128,16,4,3,465.10266666666666,3
w13,256,128,8,2048,768,16,128,128,16,4,5,465.9556666666667,3
w13,256,128,8,2048,768,16,128,128,16,8,2,464.37733333333335,3
w13,256,128,8,2048,768,16,128,128,16,8,3,463.705,3
w13,256,128,8,2048,768,16,128,128,32,4,3,464.66533333333336,3
w13,256,128,8,2048,768,16,128,128,32,4,5,463.2463333333333,3
w13,256,128,8,2048,768,16,128,128,32,8,3,462.86266666666666,3
w13,256,128,8,2048,768,16,128,128,32,8,5,463.48066666666665,3
w13,256,128,8,2048,768,16,128,128,64,8,3,463.0013333333333,3
w13,256,128,8,2048,768,16,128,128,64,8,5,465.7316666666666,3
w13,256,128,8,2048,768,32,128,128,16,4,3,466.7126666666666,3
w13,256,128,8,2048,768,32,128,128,32,4,2,466.201,3
w13,256,128,8,2048,768,32,128,128,32,4,3,463.076,3
w13,256,128,8,2048,768,32,128,128,32,8,3,466.1586666666667,3
w13,256,128,8,2048,768,32,128,128,64,4,3,466.79866666666663,3
w13,256,128,8,4096,1536,16,64,256,1,4,2,1774.2516666666668,3
w13,256,128,8,4096,1536,16,64,256,1,4,3,1776.0223333333333,3
w13,256,128,8,4096,1536,16,64,256,1,4,5,1781.3876666666667,3
w13,256,128,8,4096,1536,16,64,256,1,8,3,1789.8463333333332,3
w13,256,128,8,4096,1536,16,64,256,1,8,5,1787.4039999999998,3
w13,256,128,8,4096,1536,16,64,256,16,4,2,1774.0276666666666,3
w13,256,128,8,4096,1536,16,64,256,16,4,3,1778.8483333333334,3
w13,256,128,8,4096,1536,16,64,256,16,4,5,1787.4466666666667,3
w13,256,128,8,4096,1536,16,64,256,16,8,3,1786.5606666666665,3
w13,256,128,8,4096,1536,16,64,256,16,8,5,1790.732,3
w13,256,128,8,4096,1536,16,64,256,32,4,2,1776.8973333333333,3
w13,256,128,8,4096,1536,16,64,256,32,4,3,1780.7586666666666,3
w13,256,128,8,4096,1536,16,64,256,32,4,5,1786.6140000000003,3
w13,256,128,8,4096,1536,16,64,256,32,8,3,1789.5159999999998,3
w13,256,128,8,4096,1536,16,64,256,32,8,5,1790.9126666666664,3
w13,256,128,8,4096,1536,16,64,256,64,4,2,1782.8280000000002,3
w13,256,128,8,4096,1536,16,128,128,1,4,2,1777.5796666666665,3
w13,256,128,8,4096,1536,16,128,128,1,4,3,1779.7023333333334,3
w13,256,128,8,4096,1536,16,128,128,1,4,4,1780.7583333333332,3
w13,256,128,8,4096,1536,16,128,128,1,4,5,1784.8436666666666,3
w13,256,128,8,4096,1536,16,128,128,1,8,2,1786.838,3
w13,256,128,8,4096,1536,16,128,128,1,8,3,1782.8280000000002,3
w13,256,128,8,4096,1536,16,128,128,1,8,4,1787.361,3
w13,256,128,8,4096,1536,16,128,128,1,8,5,1782.7853333333333,3
w13,256,128,8,4096,1536,16,128,128,16,4,2,1774.6143333333332,3
w13,256,128,8,4096,1536,16,128,128,16,4,3,1778.017,3
w13,256,128,8,4096,1536,16,128,128,16,4,4,1785.8036666666667,3
w13,256,128,8,4096,1536,16,128,128,16,4,5,1783.4246666666666,3
w13,256,128,8,4096,1536,16,128,128,16,8,2,1787.5103333333334,3
w13,256,128,8,4096,1536,16,128,128,16,8,3,1783.7663333333333,3
w13,256,128,8,4096,1536,16,128,128,16,8,4,1788.321,3
w13,256,128,8,4096,1536,16,128,128,16,8,5,1786.8490000000002,3
w13,256,128,8,4096,1536,16,128,128,32,4,2,1776.0226666666667,3
w13,256,128,8,4096,1536,16,128,128,32,4,3,1778.945,3
w13,256,128,8,4096,1536,16,128,128,32,4,4,1791.350333333333,3
w13,256,128,8,4096,1536,16,128,128,32,4,5,1791.2969999999998,3
w13,256,128,8,4096,1536,16,128,128,32,8,2,1786.0166666666667,3
w13,256,128,8,4096,1536,16,128,128,32,8,3,1784.8116666666665,3
w13,256,128,8,4096,1536,16,128,128,64,4,2,1783.1373333333333,3
w13,256,128,8,4096,1536,16,128,128,64,8,2,1788.609333333333,3
w13,256,128,8,4096,1536,32,128,128,1,4,2,1787.5533333333333,3
w13,256,128,8,4096,1536,32,128,128,1,4,3,1780.0116666666665,3
w13,256,128,8,4096,1536,32,128,128,1,4,4,1790.2516666666668,3
w13,256,128,8,4096,1536,32,128,128,1,4,5,1786.3476666666666,3
w13,256,128,8,4096,1536,32,128,128,1,8,3,1791.7343333333336,3
w13,256,128,8,4096,1536,32,128,128,1,8,5,1789.985,3
w13,256,128,8,4096,1536,32,128,128,4,4,2,1790.0703333333333,3
w13,256,128,8,4096,1536,32,128,128,4,4,3,1784.406,3
w13,256,128,8,4096,1536,32,128,128,4,4,5,1788.9183333333333,3
w13,256,128,8,4096,1536,32,128,128,8,4,2,1787.3823333333332,3
w13,256,128,8,4096,1536,32,128,128,8,4,3,1785.1743333333334,3
w13,256,128,8,4096,1536,32,128,128,8,4,4,1791.041,3
w13,256,128,8,4096,1536,32,128,128,8,4,5,1788.6943333333336,3
w13,256,128,8,4096,1536,32,128,128,16,4,2,1788.1396666666667,3
w13,256,128,8,4096,1536,32,128,128,16,4,3,1780.0753333333334,3
w13,256,128,8,4096,1536,32,128,128,16,4,5,1787.5316666666668,3
w13,256,128,8,4096,1536,32,128,128,32,4,2,1791.2546666666667,3
w13,256,128,8,4096,1536,32,128,128,32,4,3,1784.598,3
w13,256,128,8,4096,1536,32,128,128,32,8,3,1790.6143333333332,3
w13,256,128,8,4096,3072,16,64,256,1,4,2,3543.633,3
w13,256,128,8,4096,3072,16,64,256,1,4,3,3539.59,3
w13,256,128,8,4096,3072,16,64,256,1,4,5,3549.798666666667,3
w13,256,128,8,4096,3072,16,64,256,1,8,3,3562.779666666667,3
w13,256,128,8,4096,3072,16,64,256,1,8,5,3555.7613333333334,3
w13,256,128,8,4096,3072,16,64,256,16,4,2,3535.1209999999996,3
w13,256,128,8,4096,3072,16,64,256,16,4,3,3540.6356666666666,3
w13,256,128,8,4096,3072,16,64,256,16,4,5,3553.809333333333,3
w13,256,128,8,4096,3072,16,64,256,16,8,3,3558.289,3
w13,256,128,8,4096,3072,16,64,256,16,8,5,3560.763666666667,3
w13,256,128,8,4096,3072,16,64,256,32,4,2,3545.6059999999998,3
w13,256,128,8,4096,3072,16,64,256,32,4,3,3549.1366666666668,3
w13,256,128,8,4096,3072,16,64,256,32,4,5,3557.179666666667,3
w13,256,128,8,4096,3072,16,64,256,32,8,3,3562.3423333333335,3
w13,256,128,8,4096,3072,16,64,256,32,8,5,3567.4303333333337,3
w13,256,128,8,4096,3072,16,64,256,64,4,2,3563.0570000000002,3
w13,256,128,8,4096,3072,16,128,128,1,4,2,3538.9393333333333,3
w13,256,128,8,4096,3072,16,128,128,1,4,3,3542.598,3
w13,256,128,8,4096,3072,16,128,128,1,4,4,3563.611666666666,3
w13,256,128,8,4096,3072,16,128,128,1,4,5,3549.9689999999996,3
w13,256,128,8,4096,3072,16,128,128,1,8,2,3563.398333333333,3
w13,256,128,8,4096,3072,16,128,128,1,8,3,3555.7076666666667,3
w13,256,128,8,4096,3072,16,128,128,1,8,4,3563.0356666666667,3
w13,256,128,8,4096,3072,16,128,128,1,8,5,3559.6756666666665,3
w13,256,128,8,4096,3072,16,128,128,16,4,2,3534.1396666666665,3
w13,256,128,8,4096,3072,16,128,128,16,4,3,3535.931666666667,3
w13,256,128,8,4096,3072,16,128,128,16,4,4,3557.787666666667,3
w13,256,128,8,4096,3072,16,128,128,16,4,5,3549.628,3
w13,256,128,8,4096,3072,16,128,128,16,8,2,3553.915333333333,3
w13,256,128,8,4096,3072,16,128,128,16,8,3,3551.558333333333,3
w13,256,128,8,4096,3072,16,128,128,16,8,4,3567.675333333333,3
w13,256,128,8,4096,3072,16,128,128,16,8,5,3563.5153333333333,3
w13,256,128,8,4096,3072,16,128,128,32,4,2,3545.6596666666665,3
w13,256,128,8,4096,3072,16,128,128,32,4,3,3550.6839999999997,3
w13,256,128,8,4096,3072,16,128,128,32,4,5,3563.5156666666667,3
w13,256,128,8,4096,3072,16,128,128,32,8,2,3554.352666666667,3
w13,256,128,8,4096,3072,16,128,128,32,8,3,3563.590666666667,3
w13,256,128,8,4096,3072,16,128,128,64,4,2,3563.7606666666666,3
w13,256,128,8,4096,3072,32,128,128,1,4,2,3564.6786666666667,3
w13,256,128,8,4096,3072,32,128,128,1,4,3,3552.2836666666667,3
w13,256,128,8,4096,3072,32,128,128,1,4,5,3554.748,3
w13,256,128,8,4096,3072,32,128,128,1,8,3,3564.5826666666667,3
w13,256,128,8,4096,3072,32,128,128,1,8,5,3564.3266666666664,3
w13,256,128,8,4096,3072,32,128,128,4,4,2,3562.7053333333333,3
w13,256,128,8,4096,3072,32,128,128,4,4,3,3558.6839999999997,3
w13,256,128,8,4096,3072,32,128,128,4,4,5,3560.401,3
w13,256,128,8,4096,3072,32,128,128,8,4,2,3556.5823333333333,3
w13,256,128,8,4096,3072,32,128,128,8,4,3,3552.486666666666,3
w13,256,128,8,4096,3072,32,128,128,8,4,4,3567.4950000000003,3
w13,256,128,8,4096,3072,32,128,128,8,4,5,3560.102666666667,3
w13,256,128,8,4096,3072,32,128,128,8,8,3,3568.4329999999995,3
w13,256,128,8,4096,3072,32,128,128,16,4,2,3554.9183333333335,3
w13,256,128,8,4096,3072,32,128,128,16,4,3,3546.7263333333335,3
w13,256,128,8,4096,3072,32,128,128,16,4,5,3555.121333333333,3
w13,256,128,8,4096,3072,32,128,128,16,8,3,3561.958666666667,3
w13,256,128,8,4096,3072,32,128,128,32,4,2,3561.5103333333336,3
w13,256,128,8,4096,3072,32,128,128,32,4,3,3555.0253333333335,3
w13,512,8,2,1024,512,64,64,64,1,4,3,20.215,3
w13,512,8,2,1024,512,64,64,64,16,4,3,20.354,3
w13,512,16,2,1536,768,64,128,128,1,8,3,54.476333333333336,3
w13,512,16,2,1536,768,64,128,128,1,8,4,54.050000000000004,3
w13,512,16,4,1536,1024,64,128,64,1,4,3,83.842,3
w13,512,32,4,2048,768,64,64,64,1,4,3,135.89533333333333,3
w13,512,32,4,2048,768,64,64,64,4,4,3,135.10633333333334,3
w13,512,32,4,2048,768,64,64,64,16,4,3,135.18066666666667,3
w13,512,32,4,2048,768,64,64,64,32,4,3,135.53300000000002,3
w13,512,32,4,2048,768,64,64,64,64,4,3,135.72533333333334,3
w13,512,32,6,3072,1024,128,256,64,1,8,4,325.24,3
w13,512,60,4,2048,1408,64,64,64,1,4,3,424.3766666666667,3
w13,512,60,4,2048,1408,64,64,64,1,8,5,428.1846666666667,3
w13,512,60,4,2048,1408,64,64,64,4,4,3,424.61100000000005,3
w13,512,60,4,2048,1408,64,64,64,4,4,4,426.70166666666665,3
w13,512,60,4,2048,1408,64,64,64,16,4,3,426.69100000000003,3
w13,512,60,4,2048,1408,64,64,128,1,4,2,424.163,3
w13,512,60,4,2048,1408,64,64,128,1,8,3,426.85099999999994,3
w13,512,60,4,2048,1408,64,64,128,4,4,2,424.5363333333333,3
w13,512,60,4,2048,1408,64,64,128,4,8,3,428.0346666666667,3
w13,512,60,4,2048,1408,64,64,128,8,4,2,424.39733333333334,3
w13,512,60,4,2048,1408,64,64,128,16,4,2,424.3976666666667,3
w13,512,60,4,2048,1408,64,64,128,32,4,2,424.55766666666665,3
w13,512,60,4,2048,1408,64,128,64,4,4,5,428.3766666666667,3
w13,512,60,4,2048,1408,64,128,64,4,8,5,427.4696666666667,3
w13,512,60,6,3584,2304,64,128,128,1,8,4,1185.575,3
w13,512,60,6,3584,2304,64,128,128,4,8,4,1188.9243333333334,3
w13,512,60,8,2048,1536,32,256,64,1,8,3,542.8829999999999,3
w13,512,60,8,2048,1536,128,256,64,1,8,3,539.2243333333333,3
w13,512,60,8,2048,1536,128,256,64,16,8,3,542.0083333333333,3
w13,512,64,6,3072,2048,64,128,128,1,8,4,977.861,3
w13,512,64,6,3072,2048,64,128,128,4,8,4,980.3996666666667,3
w13,512,64,6,3072,2048,64,128,128,16,8,4,984.6990000000001,3
w13,512,64,6,3584,1536,64,128,128,1,8,4,853.4663333333333,3
w13,512,64,8,3584,2560,64,128,128,1,8,4,1424.832,3
w13,512,64,8,3584,2560,64,128,128,4,4,4,1424.6823333333334,3
w13,512,64,8,3584,2560,64,128,128,4,8,4,1411.6053333333332,3
w13,512,64,8,3584,2560,64,128,128,16,4,4,1423.8613333333333,3
w13,512,64,8,3584,2560,64,128,128,16,8,4,1413.6850000000002,3
w13,512,128,4,2048,512,16,32,128,1,4,3,313.038,3
w13,512,128,4,2048,512,16,32,128,1,4,4,313.7203333333334,3
w13,512,128,4,2048,512,16,32,128,4,4,3,311.875,3
w13,512,128,4,2048,512,16,32,128,4,4,4,312.0776666666667,3
w13,512,128,4,2048,512,16,32,128,16,4,3,312.451,3
w13,512,128,4,2048,512,16,32,128,32,4,3,310.766,3
w13,512,128,4,2048,512,16,32,128,64,4,3,313.5396666666666,3
w13,512,128,4,2048,512,16,32,256,1,4,2,313.7526666666667,3
w13,512,128,4,2048,512,16,64,128,16,8,3,313.678,3
w13,512,128,4,2048,512,16,64,128,32,4,2,311.075,3
w13,512,128,4,2048,512,16,64,128,32,8,3,313.81666666666666,3
w13,512,128,4,2048,512,16,128,128,1,8,5,311.9286666666667,3
w13,512,128,4,2048,512,16,128,128,16,4,3,313.81666666666666,3
w13,512,128,4,2048,512,16,128,128,16,8,3,312.59,3
w13,512,128,4,2048,512,16,128,128,32,4,3,313.75233333333335,3
w13,512,128,4,2048,512,16,128,128,32,8,3,313.13433333333336,3
w13,512,128,6,4096,2048,32,128,128,1,4,2,2434.1183333333333,3
w13,512,128,6,4096,2048,32,128,128,1,4,3,2415.4303333333332,3
w13,512,128,6,4096,2048,32,128,128,1,4,4,2428.379,3
w13,512,128,6,4096,2048,32,128,128,1,4,5,2420.6993333333335,3
w13,512,128,6,4096,2048,32,128,128,1,8,3,2423.7819999999997,3
w13,512,128,6,4096,2048,32,128,128,1,8,4,2438.661666666667,3
w13,512,128,6,4096,2048,32,128,128,1,8,5,2429.8833333333337,3
w13,512,128,6,4096,2048,32,128,128,4,4,2,2425.254,3
w13,512,128,6,4096,2048,32,128,128,4,4,3,2415.2273333333333,3
w13,512,128,6,4096,2048,32,128,128,4,4,4,2434.3313333333335,3
w13,512,128,6,4096,2048,32,128,128,4,4,5,2419.7286666666664,3
w13,512,128,6,4096,2048,32,128,128,4,8,3,2423.867,3
w13,512,128,6,4096,2048,32,128,128,8,4,2,2430.0856666666664,3
w13,512,128,6,4096,2048,32,128,128,8,4,3,2425.7123333333334,3
w13,512,128,6,4096,2048,32,128,128,8,4,4,2432.0056666666665,3
w13,512,128,6,4096,2048,32,128,128,8,4,5,2427.7496666666666,3
w13,512,128,6,4096,2048,32,128,128,8,8,3,2433.894333333333,3
w13,512,128,6,4096,2048,32,128,128,16,4,2,2430.7046666666665,3
w13,512,128,6,4096,2048,32,128,128,16,4,3,2420.7633333333333,3
w13,512,128,6,4096,2048,32,128,128,16,4,4,2435.0783333333334,3
w13,512,128,6,4096,2048,32,128,128,16,4,5,2432.9556666666667,3
w13,512,128,6,4096,2048,32,128,128,16,8,3,2433.35,3
w13,512,128,6,4096,2048,32,128,128,32,4,2,2433.0086666666666,3
w13,512,128,6,4096,2048,32,128,128,32,4,3,2435.675,3
w13,512,128,6,4096,2048,64,128,128,1,8,4,2426.7893333333336,3
w13,512,128,6,4096,2048,64,128,128,4,8,4,2432.144333333333,3
w13,512,128,8,2048,768,32,128,128,4,4,3,466.9373333333333,3
w13,512,128,8,2048,768,32,128,128,8,4,2,466.84099999999995,3
w13,512,128,8,2048,768,32,128,128,8,4,3,468.72866666666664,3
w13,512,128,8,2048,768,32,128,128,8,8,3,468.7283333333333,3
w13,512,128,8,2048,768,32,128,128,16,4,2,465.529,3
w13,512,128,8,2048,768,32,128,128,16,4,3,466.83033333333333,3
w13,512,128,8,2048,768,32,128,128,16,8,3,468.66433333333333,3
w13,512,128,8,2048,768,32,128,128,32,4,2,469.94433333333336,3
w13,512,128,8,2048,768,32,128,128,32,4,3,466.74533333333335,3
w13,512,128,8,2048,768,32,128,128,64,4,3,468.88933333333335,3
w13,512,128,8,4096,1536,32,128,128,1,4,2,1854.8166666666666,3
w13,512,128,8,4096,1536,32,128,128,1,4,3,1840.2673333333332,3
w13,512,128,8,4096,1536,32,128,128,1,4,4,1855.7446666666667,3
w13,512,128,8,4096,1536,32,128,128,1,4,5,1857.2913333333333,3
w13,512,128,8,4096,1536,32,128,128,1,8,3,1851.4356666666665,3
w13,512,128,8,4096,1536,32,128,128,4,4,2,1852.7263333333333,3
w13,512,128,8,4096,1536,32,128,128,4,4,3,1849.718,3
w13,512,128,8,4096,1536,32,128,128,4,4,4,1854.5926666666667,3
w13,512,128,8,4096,1536,32,128,128,4,4,5,1856.673,3
w13,512,128,8,4096,1536,32,128,128,4,8,3,1853.5683333333334,3
w13,512,128,8,4096,1536,32,128,128,8,4,2,1852.6723333333332,3
w13,512,128,8,4096,1536,32,128,128,8,4,3,1840.3739999999998,3
w13,512,128,8,4096,1536,32,128,128,8,4,4,1858.3793333333333,3
w13,512,128,8,4096,1536,32,128,128,8,4,5,1855.82,3
w13,512,128,8,4096,1536,32,128,128,8,8,3,1851.2003333333332,3
w13,512,128,8,4096,1536,32,128,128,16,4,2,1849.6756666666668,3
w13,512,128,8,4096,1536,32,128,128,16,4,3,1842.2513333333334,3
w13,512,128,8,4096,1536,32,128,128,16,4,4,1853.5469999999998,3
w13,512,128,8,4096,1536,32,128,128,16,4,5,1854.6036666666666,3
w13,512,128,8,4096,1536,32,128,128,16,8,3,1840.2886666666666,3
w13,512,128,8,4096,1536,32,128,128,32,4,2,1856.5236666666667,3
w13,512,128,8,4096,1536,32,128,128,32,4,3,1846.4646666666667,3
w13,512,128,8,4096,1536,32,128,128,32,8,3,1848.5133333333333,3
w13,512,128,8,4096,3072,32,128,128,1,4,2,3643.612333333333,3
w13,512,128,8,4096,3072,32,128,128,1,4,3,3632.3163333333337,3
w13,512,128,8,4096,3072,32,128,128,1,4,4,3655.431,3
w13,512,128,8,4096,3072,32,128,128,1,4,5,3647.3880000000004,3
w13,512,128,8,4096,3072,32,128,128,1,8,3,3651.345333333333,3
w13,512,128,8,4096,3072,32,128,128,1,8,4,3663.697666666667,3
w13,512,128,8,4096,3072,32,128,128,1,8,5,3657.564,3
w13,512,128,8,4096,3072,32,128,128,4,4,2,3640.5293333333334,3
w13,512,128,8,4096,3072,32,128,128,4,4,3,3648.4120000000003,3
w13,512,128,8,4096,3072,32,128,128,4,4,4,3657.3079999999995,3
w13,512,128,8,4096,3072,32,128,128,4,4,5,3656.1666666666665,3
w13,512,128,8,4096,3072,32,128,128,4,8,3,3648.5080000000003,3
w13,512,128,8,4096,3072,32,128,128,4,8,4,3666.7906666666663,3
w13,512,128,8,4096,3072,32,128,128,8,4,2,3630.2996666666672,3
w13,512,128,8,4096,3072,32,128,128,8,4,3,3642.962,3
w13,512,128,8,4096,3072,32,128,128,8,4,4,3647.836333333333,3
w13,512,128,8,4096,3072,32,128,128,8,4,5,3647.7719999999995,3
w13,512,128,8,4096,3072,32,128,128,8,8,3,3652.3266666666664,3
w13,512,128,8,4096,3072,32,128,128,8,8,4,3665.617333333333,3
w13,512,128,8,4096,3072,32,128,128,16,4,2,3630.492,3
w13,512,128,8,4096,3072,32,128,128,16,4,3,3634.9723333333336,3
w13,512,128,8,4096,3072,32,128,128,16,4,4,3660.4763333333335,3
w13,512,128,8,4096,3072,32,128,128,16,4,5,3653.478333333333,3
w13,512,128,8,4096,3072,32,128,128,16,8,3,3650.065666666667,3
w13,512,128,8,4096,3072,32,128,128,16,8,4,3665.0409999999997,3
w13,512,128,8,4096,3072,32,128,128,32,4,2,3656.3909999999996,3
w13,512,128,8,4096,3072,32,128,128,32,4,3,3660.9353333333333,3
w13,1024,8,2,1024,512,64,128,32,8,4,4,39.778,3
w13,1024,8,2,1024,512,64,128,64,1,4,3,39.554,3
w13,1024,16,2,1536,768,128,256,64,1,8,3,66.96733333333333,3
w13,1024,16,4,1536,1024,128,64,64,16,4,3,147.917,3
w13,1024,32,4,2048,768,128,256,64,1,8,3,155.917,3
w13,1024,32,4,2048,768,128,256,64,1,8,4,156.24766666666667,3
w13,1024,32,6,3072,1024,64,128,64,16,4,3,479.0323333333333,3
w13,1024,32,6,3072,1024,64,128,64,32,4,3,475.80033333333336,3
w13,1024,32,6,3072,1024,64,128,64,64,4,3,476.8676666666667,3
w13,1024,60,4,2048,1408,64,128,64,4,4,3,487.48066666666665,3
w13,1024,60,4,2048,1408,64,128,64,16,4,3,491.939,3
w13,1024,60,4,2048,1408,64,128,64,32,4,3,489.699,3
w13,1024,60,6,3584,2304,128,256,64,1,8,3,1358.3429999999998,3
w13,1024,60,8,2048,1536,64,128,64,1,4,3,839.8009999999999,3
w13,1024,60,8,2048,1536,64,128,64,16,4,3,845.8383333333335,3
w13,1024,60,8,2048,1536,64,128,64,32,4,3,842.4250000000001,3
w13,1024,60,8,2048,1536,64,128,64,64,4,3,837.9023333333333,3
w13,1024,64,6,3072,2048,128,256,64,1,8,3,1133.8193333333331,3
w13,1024,64,6,3072,2048,128,256,64,1,8,4,1128.0806666666667,3
w13,1024,64,6,3072,2048,128,256,64,16,8,3,1136.8696666666667,3
w13,1024,64,6,3072,2048,128,256,64,16,8,4,1134.8853333333334,3
w13,1024,64,6,3584,1536,128,256,64,1,8,3,1030.1490000000001,3
w13,1024,64,6,3584,1536,128,256,64,1,8,4,1019.8663333333334,3
w13,1024,64,6,3584,1536,128,256,64,16,8,4,1028.25,3
w13,1024,64,8,3584,2560,128,256,64,1,8,3,1615.798,3
w13,1024,64,8,3584,2560,128,256,64,1,8,4,1620.79,3
w13,1024,64,8,3584,2560,128,256,64,16,8,3,1628.8223333333335,3
w13,1024,128,4,2048,512,32,128,128,1,8,3,320.59999999999997,3
w13,1024,128,4,2048,512,32,128,128,4,4,3,322.3713333333333,3
w13,1024,128,4,2048,512,32,128,128,4,8,3,323.715,3
w13,1024,128,4,2048,512,32,128,128,8,4,3,323.0643333333333,3
w13,1024,128,4,2048,512,32,128,128,32,4,3,322.115,3
w13,1024,128,4,2048,512,32,128,128,32,8,3,323.8006666666667,3
w13,1024,128,6,4096,2048,64,128,128,1,8,4,2533.3163333333337,3
w13,1024,128,6,4096,2048,64,128,128,4,8,4,2534.9159999999997,3
w13,1024,128,6,4096,2048,64,128,128,16,8,4,2552.462,3
w13,1024,128,8,2048,768,64,128,64,1,4,3,508.95266666666663,3
w13,1024,128,8,2048,768,64,128,64,4,4,3,511.5986666666666,3
w13,1024,128,8,2048,768,64,128,64,16,4,3,510.98966666666666,3
w13,1024,128,8,4096,1536,64,128,64,1,4,3,1972.5756666666666,3
w13,1024,128,8,4096,1536,64,128,64,1,4,5,1965.013,3
w13,1024,128,8,4096,1536,64,128,64,1,8,5,1972.341333333333,3
w13,1024,128,8,4096,1536,64,128,128,1,8,4,1953.0663333333334,3
w13,1024,128,8,4096,1536,64,128,128,4,8,4,1959.7756666666667,3
w13,1024,128,8,4096,1536,64,128,128,16,8,4,1961.7056666666667,3
w13,1024,128,8,4096,3072,64,128,128,1,8,4,3869.4976666666666,3
w13,1024,128,8,4096,3072,64,128,128,4,8,4,3891.150666666667,3
w13,1024,128,8,4096,3072,64,128,128,16,8,4,3880.89,3
w13,1536,8,2,1024,512,128,256,64,16,8,3,41.91133333333333,3
w13,1536,8,2,1024,512,128,256,64,32,8,3,41.826,3
w13,1536,8,2,1024,512,128,256,64,64,8,3,41.80466666666667,3
w13,1536,8,2,1024,512,128,256,64,64,8,4,42.199333333333335,3
w13,1536,16,2,1536,768,64,128,64,1,4,3,105.61233333333332,3
w13,1536,16,2,1536,768,64,128,64,16,4,3,106.62566666666667,3
w13,1536,16,4,1536,1024,128,256,64,1,8,3,211.768,3
w13,1536,32,4,2048,768,64,128,64,32,4,3,209.251,3
w13,1536,32,4,2048,768,64,128,64,64,4,3,207.80033333333336,3
w13,1536,32,6,3072,1024,64,128,64,1,4,3,756.7726666666667,3
w13,1536,32,6,3072,1024,64,128,64,4,4,3,758.9696666666667,3
w13,1536,32,6,3072,1024,64,128,64,16,4,3,759.6413333333334,3
w13,1536,32,6,3072,1024,64,128,64,32,4,3,754.2973333333333,3
w13,1536,32,6,3072,1024,64,128,64,64,4,3,753.444,3
w13,1536,60,4,2048,1408,128,256,64,1,8,4,529.528,3
w13,1536,60,6,3584,2304,64,128,64,32,4,3,2158.6873333333333,3
w13,1536,60,6,3584,2304,64,128,64,64,4,3,2158.1856666666667,3
w13,1536,60,8,2048,1536,128,256,64,1,8,3,934.8616666666667,3
w13,1536,60,8,2048,1536,128,256,64,1,8,4,935.9713333333334,3
w13,1536,60,8,2048,1536,256,128,64,1,8,3,936.0679999999999,3
w13,1536,60,8,2048,1536,256,128,64,1,8,4,940.6013333333334,3
w13,1536,64,6,3072,2048,64,128,64,16,4,3,1753.8313333333333,3
w13,1536,64,6,3072,2048,64,128,64,32,4,3,1749.3509999999999,3
w13,1536,64,6,3072,2048,64,128,64,64,4,3,1749.5856666666666,3
w13,1536,64,6,3584,1536,64,128,64,16,4,3,1538.406,3
w13,1536,64,6,3584,1536,64,128,64,32,4,3,1528.7423333333334,3
w13,1536,64,6,3584,1536,64,128,64,64,4,3,1526.5446666666667,3
w13,1536,64,8,3584,2560,64,128,64,16,4,3,2649.8836666666666,3
w13,1536,64,8,3584,2560,64,128,64,32,4,3,2638.993,3
w13,1536,64,8,3584,2560,64,128,64,64,4,3,2638.459666666667,3
w13,1536,128,4,2048,512,64,64,64,1,4,3,341.6673333333333,3
w13,1536,128,4,2048,512,64,64,64,1,4,5,343.779,3
w13,1536,128,4,2048,512,64,64,64,4,4,3,343.1066666666666,3
w13,1536,128,4,2048,512,64,64,64,4,4,5,344.21600000000007,3
w13,1536,128,4,2048,512,64,128,64,1,4,4,342.66966666666667,3
w13,1536,128,4,2048,512,64,128,128,1,4,2,340.7923333333333,3
w13,1536,128,4,2048,512,64,128,128,4,4,2,342.17900000000003,3
w13,1536,128,4,2048,512,64,128,128,32,4,2,341.5493333333334,3
w13,1536,128,6,4096,2048,128,256,64,1,8,3,2823.5339999999997,3
w13,1536,128,8,2048,768,128,256,64,1,8,4,601.9340000000001,3
w13,1536,128,8,4096,1536,128,256,64,1,8,3,2153.951333333333,3
w13,1536,128,8,4096,1536,128,256,64,1,8,4,2173.3316666666665,3
w13,1536,128,8,4096,3072,128,256,64,1,8,3,4312.727,3
w13,1536,128,8,4096,3072,128,256,64,1,8,4,4320.663333333333,3
w13,2048,8,2,1024,512,64,128,32,8,4,4,63.37266666666667,3
w13,2048,8,2,1024,512,64,128,32,8,4,5,63.78866666666667,3
w13,2048,8,2,1024,512,64,128,64,1,4,3,63.202,3
w13,2048,8,2,1024,512,64,128,64,16,4,3,63.83166666666667,3
w13,2048,16,2,1536,768,128,256,64,1,8,3,109.23933333333333,3
w13,2048,16,2,1536,768,256,128,64,1,8,3,109.05766666666666,3
w13,2048,16,4,1536,1024,128,256,64,1,8,3,266.66966666666667,3
w13,2048,16,4,1536,1024,128,256,64,32,8,3,268.74933333333337,3
w13,2048,16,4,1536,1024,256,128,64,1,8,3,266.403,3
w13,2048,32,4,2048,768,128,256,64,1,8,3,272.6426666666666,3
w13,2048,32,4,2048,768,128,256,64,1,8,4,274.49833333333333,3
w13,2048,32,4,2048,768,256,128,64,1,8,3,273.67766666666665,3
w13,2048,32,4,2048,768,256,128,64,1,8,4,275.28766666666667,3
w13,2048,32,6,3072,1024,128,256,64,1,8,3,777.5616666666666,3
w13,2048,32,6,3072,1024,128,256,64,1,8,4,781.1356666666667,3
w13,2048,32,6,3072,1024,128,256,64,16,8,3,782.0949999999999,3
w13,2048,32,6,3072,1024,128,256,64,32,8,3,782.3623333333334,3
w13,2048,32,6,3072,1024,128,256,64,64,8,3,784.5383333333334,3
w13,2048,60,4,2048,1408,64,128,64,1,4,3,775.8216666666667,3
w13,2048,60,4,2048,1408,64,128,64,16,4,3,778.723,3
w13,2048,60,4,2048,1408,64,128,64,32,4,3,773.1873333333333,3
w13,2048,60,4,2048,1408,64,128,64,64,4,3,771.9926666666667,3
w13,2048,60,6,3584,2304,128,256,64,1,8,3,2250.3663333333334,3
w13,2048,60,6,3584,2304,128,256,64,1,8,4,2255.0606666666667,3
w13,2048,60,6,3584,2304,128,256,64,16,8,3,2266.0363333333335,3
w13,2048,60,6,3584,2304,128,256,64,32,8,3,2268.2336666666665,3
w13,2048,60,6,3584,2304,128,256,64,64,8,3,2263.753666666667,3
w13,2048,60,6,3584,2304,256,128,64,1,8,3,2247.369666666667,3
w13,2048,60,6,3584,2304,256,128,64,1,8,4,2266.4313333333334,3
w13,2048,60,8,2048,1536,128,256,64,1,8,3,1335.6953333333333,3
w13,2048,60,8,2048,1536,128,256,64,1,8,4,1345.6899999999998,3
w13,2048,64,6,3072,2048,64,128,64,32,4,3,1813.0313333333334,3
w13,2048,64,6,3072,2048,64,128,64,64,4,3,1818.162,3
w13,2048,64,6,3584,1536,64,128,64,32,4,3,1602.7686666666668,3
w13,2048,64,6,3584,1536,64,128,64,64,4,3,1600.5073333333332,3
w13,2048,64,6,3584,1536,64,256,64,1,4,3,1598.854,3
w13,2048,64,8,3584,2560,128,256,64,16,8,3,2727.622,3
w13,2048,64,8,3584,2560,128,256,64,32,8,3,2725.9686666666666,3
w13,2048,64,8,3584,2560,128,256,64,32,8,4,2741.4563333333335,3
w13,2048,64,8,3584,2560,128,256,64,64,8,3,2739.75,3
w13,2048,64,8,3584,2560,256,128,64,1,8,3,2715.0886666666665,3
w13,2048,64,8,3584,2560,256,128,64,1,8,4,2730.523333333333,3
w13,2048,128,4,2048,512,64,64,64,1,4,3,347.22433333333333,3
w13,2048,128,4,2048,512,64,128,64,1,4,4,348.28000000000003,3
w13,2048,128,4,2048,512,64,128,128,1,4,2,346.45633333333336,3
w13,2048,128,4,2048,512,64,128,128,4,4,2,345.763,3
w13,2048,128,4,2048,512,64,128,128,16,4,2,346.8296666666667,3
w13,2048,128,4,2048,512,64,128,128,32,4,2,346.4883333333334,3
w13,2048,128,6,4096,2048,128,256,64,1,8,3,2849.090666666667,3
w13,2048,128,8,2048,768,128,256,64,1,8,4,611.662,3
w13,2048,128,8,4096,1536,128,256,64,1,8,3,2179.113,3
w13,2048,128,8,4096,1536,128,256,64,1,8,4,2197.1183333333333,3
w13,2048,128,8,4096,3072,128,256,64,1,8,3,4354.828,3
w13,2048,128,8,4096,3072,128,256,64,1,8,4,4389.153333333333,3
w13,3072,8,2,1024,512,128,256,64,1,8,3,76.88733333333334,3
w13,3072,8,2,1024,512,256,128,64,1,8,3,76.90866666666666,3
w13,3072,16,2,1536,768,128,256,64,1,8,3,161.367,3
w13,3072,16,2,1536,768,128,256,64,1,8,4,162.89233333333334,3
w13,3072,16,4,1536,1024,128,256,64,1,8,3,419.0216666666667,3
w13,3072,16,4,1536,1024,128,256,64,1,8,4,420.7176666666667,3
w13,3072,16,4,1536,1024,256,128,64,1,8,3,419.1496666666667,3
w13,3072,16,4,1536,1024,256,128,64,1,8,4,422.8403333333333,3
w13,3072,32,4,2048,768,128,256,64,1,8,3,403.9176666666667,3
w13,3072,32,4,2048,768,128,256,64,1,8,4,406.638,3
w13,3072,32,6,3072,1024,64,128,64,1,4,3,1146.5766666666666,3
w13,3072,32,6,3072,1024,64,128,64,4,4,3,1151.0463333333335,3
w13,3072,32,6,3072,1024,64,128,64,16,4,3,1150.3419999999999,3
w13,3072,32,6,3072,1024,64,128,64,32,4,3,1147.2166666666667,3
w13,3072,32,6,3072,1024,64,128,64,64,4,3,1144.2299999999998,3
w13,3072,60,4,2048,1408,128,256,64,1,8,3,869.8906666666667,3
w13,3072,60,4,2048,1408,128,256,64,1,8,4,868.6536666666667,3
w13,3072,60,4,2048,1408,256,128,64,1,8,3,867.0536666666667,3
w13,3072,60,4,2048,1408,256,128,64,1,8,4,872.8566666666667,3
w13,3072,60,6,3584,2304,128,256,64,1,8,3,3357.921,3
w13,3072,60,6,3584,2304,128,256,64,1,8,4,3374.411666666667,3
w13,3072,60,6,3584,2304,128,256,64,32,8,3,3380.396,3
w13,3072,60,6,3584,2304,128,256,64,64,8,3,3382.9666666666667,3
w13,3072,60,8,2048,1536,128,256,64,1,8,3,1798.2233333333334,3
w13,3072,60,8,2048,1536,128,256,64,1,8,4,1810.405,3
w13,3072,60,8,2048,1536,256,128,64,1,8,3,1802.1809999999998,3
w13,3072,60,8,2048,1536,256,128,64,1,8,4,1814.1386666666667,3
w13,3072,64,6,3072,2048,128,256,64,1,8,3,2800.5533333333333,3
w13,3072,64,6,3072,2048,128,256,64,1,8,4,2812.4893333333334,3
w13,3072,64,6,3072,2048,128,256,64,16,8,3,2817.7053333333333,3
w13,3072,64,6,3072,2048,128,256,64,32,8,3,2819.658,3
w13,3072,64,6,3072,2048,128,256,64,64,8,3,2822.9753333333333,3
w13,3072,64,6,3584,1536,64,256,64,16,4,3,2176.145666666667,3
w13,3072,64,6,3584,1536,64,256,64,32,4,3,2171.047,3
w13,3072,64,6,3584,1536,64,256,64,64,4,3,2173.8103333333333,3
w13,3072,64,8,3584,2560,128,256,64,1,8,3,4061.836333333333,3
w13,3072,64,8,3584,2560,128,256,64,1,8,4,4070.8176666666664,3
w13,3072,64,8,3584,2560,128,256,64,16,8,3,4071.2549999999997,3
w13,3072,64,8,3584,2560,128,256,64,16,8,4,4095.788666666667,3
w13,3072,64,8,3584,2560,128,256,64,32,8,3,4073.453,3
w13,3072,64,8,3584,2560,128,256,64,32,8,4,4092.9413333333337,3
w13,3072,64,8,3584,2560,128,256,64,64,8,3,4080.0023333333334,3
w13,3072,128,4,2048,512,128,256,64,1,8,3,392.74966666666666,3
w13,3072,128,6,4096,2048,64,128,64,16,4,3,3886.0533333333333,3
w13,3072,128,6,4096,2048,64,128,64,32,4,3,3875.429,3
w13,3072,128,8,2048,768,64,128,64,1,4,3,793.4543333333335,3
w13,3072,128,8,2048,768,64,128,64,4,4,3,797.6030000000001,3
w13,3072,128,8,4096,1536,64,256,64,64,4,3,3066.112333333333,3
w13,3072,128,8,4096,3072,64,128,64,16,4,3,7154.388666666667,3
w13,3072,128,8,4096,3072,64,128,64,32,4,3,7098.718666666667,3
w13,3072,128,8,4096,3072,64,128,64,64,4,3,7153.545333333333,3
w13,3072,128,8,4096,3072,64,256,64,8,4,3,7165.692999999999,3
w13,3072,128,8,4096,3072,64,256,64,16,4,3,7132.573,3
w13,3072,128,8,4096,3072,64,256,64,32,4,3,7137.895666666666,3
w13,3072,128,8,4096,3072,64,256,64,64,4,3,7150.002,3
w13,4096,8,2,1024,512,256,128,64,1,8,3,112.53533333333333,3
w13,4096,16,2,1536,768,64,128,64,1,4,3,204.51366666666664,3
w13,4096,16,4,1536,1024,128,256,64,1,8,3,525.7420000000001,3
w13,4096,16,4,1536,1024,128,256,64,16,8,3,527.982,3
w13,4096,16,4,1536,1024,128,256,64,32,8,3,527.534,3
w13,4096,16,4,1536,1024,256,128,64,1,8,3,523.9499999999999,3
w13,4096,16,4,1536,1024,256,128,64,1,8,4,527.8433333333334,3
w13,4096,32,4,2048,768,128,256,64,1,8,3,535.3636666666666,3
w13,4096,32,4,2048,768,128,256,64,1,8,4,536.7923333333333,3
w13,4096,32,4,2048,768,256,128,64,1,8,3,536.899,3
w13,4096,32,4,2048,768,256,128,64,1,8,4,538.9899999999999,3
w13,4096,32,6,3072,1024,128,256,64,1,8,3,1457.3403333333333,3
w13,4096,32,6,3072,1024,128,256,64,1,8,4,1460.3163333333334,3
w13,4096,32,6,3072,1024,128,256,64,16,8,3,1464.7856666666667,3
w13,4096,32,6,3072,1024,128,256,64,32,8,3,1465.8096666666668,3
w13,4096,32,6,3072,1024,128,256,64,64,8,3,1466.5136666666667,3
w13,4096,32,6,3072,1024,256,128,64,1,8,3,1459.527,3
w13,4096,32,6,3072,1024,256,128,64,1,8,4,1471.5696666666665,3
w13,4096,60,4,2048,1408,128,256,64,1,8,3,1261.7103333333334,3
w13,4096,60,4,2048,1408,128,256,64,1,8,4,1268.9743333333333,3
w13,4096,60,6,3584,2304,128,256,64,1,8,3,4476.8679999999995,3
w13,4096,60,6,3584,2304,128,256,64,1,8,4,4497.519,3
w13,4096,60,6,3584,2304,128,256,64,16,8,3,4499.055,3
w13,4096,60,6,3584,2304,128,256,64,32,8,3,4502.384,3
w13,4096,60,6,3584,2304,128,256,64,64,8,3,4502.575333333333,3
w13,4096,60,6,3584,2304,256,128,64,1,8,3,4497.775333333334,3
w13,4096,60,8,2048,1536,128,256,64,1,8,3,2260.112,3
w13,4096,60,8,2048,1536,128,256,64,1,8,4,2274.9176666666667,3
w13,4096,64,6,3072,2048,128,256,64,1,8,3,2811.8179999999998,3
w13,4096,64,6,3072,2048,128,256,64,1,8,4,2824.2876666666666,3
w13,4096,64,6,3072,2048,128,256,64,16,8,3,2832.084666666667,3
w13,4096,64,6,3072,2048,128,256,64,32,8,3,2833.376,3
w13,4096,64,6,3072,2048,128,256,64,64,8,3,2836.6186666666667,3
w13,4096,64,6,3584,1536,128,256,64,1,8,3,2461.9166666666665,3
w13,4096,64,6,3584,1536,128,256,64,1,8,4,2472.1136666666666,3
w13,4096,64,6,3584,1536,128,256,64,16,8,3,2477.618,3
w13,4096,64,6,3584,1536,128,256,64,32,8,3,2479.08,3
w13,4096,64,6,3584,1536,128,256,64,64,8,3,2480.392333333333,3
w13,4096,64,8,3584,2560,128,256,64,1,8,3,5397.565,3
w13,4096,64,8,3584,2560,128,256,64,1,8,4,5409.202666666667,3
w13,4096,64,8,3584,2560,128,256,64,16,8,3,5411.794666666667,3
w13,4096,64,8,3584,2560,128,256,64,16,8,4,5436.211333333334,3
w13,4096,64,8,3584,2560,128,256,64,32,8,3,5413.011666666666,3
w13,4096,64,8,3584,2560,128,256,64,32,8,4,5444.029666666666,3
w13,4096,64,8,3584,2560,128,256,64,64,8,3,5418.729,3
w13,4096,64,8,3584,2560,256,128,64,1,8,3,5407.838,3
w13,4096,128,4,2048,512,128,256,64,1,8,3,403.042,3
w13,4096,128,6,4096,2048,64,256,64,8,4,3,4201.498,3
w13,4096,128,8,2048,768,128,256,64,1,8,3,1003.5133333333333,3
w13,4096,128,8,2048,768,128,256,64,1,8,4,1006.148,3
w13,4096,128,8,2048,768,256,128,64,1,8,3,1006.6816666666667,3
w13,4096,128,8,2048,768,256,128,64,1,8,4,1011.6623333333333,3
w13,4096,128,8,4096,1536,128,256,64,1,8,3,3699.7360000000003,3
w13,4096,128,8,4096,1536,128,256,64,1,8,4,3693.2820000000006,3
w13,4096,128,8,4096,1536,128,256,64,16,8,3,3716.280666666667,3
w13,4096,128,8,4096,1536,128,256,64,16,8,4,3716.952333333333,3
w13,4096,128,8,4096,1536,128,256,64,32,8,3,3719.779,3
w13,4096,128,8,4096,1536,128,256,64,32,8,4,3720.3549999999996,3
w13,4096,128,8,4096,1536,128,256,64,64,8,4,3729.3253333333337,3
w13,4096,128,8,4096,1536,256,128,64,1,8,3,3719.854,3
w13,4096,128,8,4096,1536,256,128,64,1,8,4,3713.0166666666664,3
w13,4096,128,8,4096,3072,128,256,64,16,8,3,7318.517666666667,3
w13,4096,128,8,4096,3072,128,256,64,16,8,4,7369.622333333333,3
w13,4096,128,8,4096,3072,128,256,64,32,8,3,7349.409,3
w13,4096,128,8,4096,3072,128,256,64,32,8,4,7389.335,3
w13,4096,128,8,4096,3072,128,256,64,64,8,3,7338.925333333333,3
w13,4096,128,8,4096,3072,256,128,64,1,8,3,7326.083,3
w13,4096,128,8,4096,3072,256,128,64,1,8,4,7340.706666666666,3
