pipetuning_test/moe_dse/moe_dse_A40_top3.csv
weight_type,M,E,topk,H,N,BLOCK_SIZE_M,BLOCK_SIZE_N,BLOCK_SIZE_K,GROUP_SIZE_M,num_warps,num_stages,smem_size_KB,avg_duration,sample_count
w13,1,8,2,1024,512,16,32,128,1,4,4,49.0,5.143666666666667,3
w13,1,8,2,1024,512,16,32,128,4,4,4,49.0,5.153666666666666,3
w13,1,8,2,1024,512,16,32,128,16,4,4,49.0,5.175666666666667,3
w13,1,16,2,1536,768,16,16,256,4,4,2,32.5,19.266,3
w13,1,16,2,1536,768,16,32,128,32,4,2,25.0,19.575333333333333,3
w13,1,16,2,1536,768,16,64,128,1,8,4,82.0,19.586,3
w13,1,16,4,1536,1024,16,32,128,4,4,2,25.0,46.435,3
w13,1,16,4,1536,1024,16,32,128,32,4,2,25.0,46.50933333333333,3
w13,1,16,4,1536,1024,16,32,128,64,4,2,25.0,46.583666666666666,3
w13,1,32,4,2048,768,16,32,128,32,4,2,25.0,45.964666666666666,3
w13,1,32,4,2048,768,16,32,128,4,4,2,25.0,45.99699999999999,3
w13,1,32,4,2048,768,16,32,128,64,4,2,25.0,46.02866666666667,3
w13,1,32,6,3072,1024,16,16,256,4,4,4,64.5,132.04600000000002,3
w13,1,32,6,3072,1024,32,32,256,4,8,3,98.0,132.20533333333336,3
w13,1,32,6,3072,1024,16,32,256,1,8,3,73.0,132.20566666666664,3
w13,1,60,4,2048,1408,16,16,256,4,4,3,48.5,81.60199999999999,3
w13,1,60,4,2048,1408,16,16,256,1,4,3,48.5,81.90066666666667,3
w13,1,60,4,2048,1408,16,16,128,1,4,3,24.5,82.00733333333334,3
w13,1,60,6,3584,2304,16,16,256,4,4,3,48.5,335.2666666666667,3
w13,1,60,6,3584,2304,16,16,256,1,4,3,48.5,336.50433333333336,3
w13,1,60,6,3584,2304,32,32,256,1,4,3,98.0,336.54699999999997,3
w13,1,60,8,2048,1536,16,16,256,1,4,3,48.5,173.229,3
w13,1,60,8,2048,1536,16,32,256,64,4,3,73.0,173.46400000000003,3
w13,1,60,8,2048,1536,16,16,256,1,4,4,64.5,173.51733333333334,3
w13,1,64,6,3072,2048,16,32,256,64,4,3,73.0,257.8163333333334,3
w13,1,64,6,3072,2048,16,32,256,16,4,3,73.0,257.83733333333333,3
w13,1,64,6,3072,2048,16,32,256,64,8,3,73.0,258.0933333333333,3
w13,1,64,6,3584,1536,16,16,256,4,4,3,48.5,225.43166666666664,3
w13,1,64,6,3584,1536,16,16,256,1,4,3,48.5,225.677,3
w13,1,64,6,3584,1536,32,32,256,4,8,3,98.0,226.03966666666668,3
w13,1,64,8,3584,2560,32,32,256,1,4,3,98.0,495.40166666666664,3
w13,1,64,8,3584,2560,16,16,256,4,4,3,48.5,495.81766666666664,3
w13,1,64,8,3584,2560,16,32,256,16,4,3,73.0,495.96633333333335,3
w13,1,128,4,2048,512,16,16,256,4,4,2,32.5,31.831666666666667,3
w13,1,128,4,2048,512,16,32,128,32,4,2,25.0,31.89533333333333,3
w13,1,128,4,2048,512,16,32,128,16,4,2,25.0,31.938333333333333,3
w13,1,128,6,4096,2048,16,32,256,64,4,3,73.0,342.1376666666667,3
w13,1,128,6,4096,2048,16,32,256,16,4,3,73.0,342.29733333333337,3
w13,1,128,6,4096,2048,16,32,256,64,8,3,73.0,342.51033333333334,3
w13,1,128,8,2048,768,16,16,256,4,4,4,64.5,88.87733333333334,3
w13,1,128,8,2048,768,16,16,256,1,4,4,64.5,88.89866666666667,3
w13,1,128,8,2048,768,16,32,256,16,8,3,73.0,89.05866666666668,3
w13,1,128,8,4096,1536,16,32,256,16,4,3,73.0,342.06200000000007,3
w13,1,128,8,4096,1536,16,32,256,64,8,3,73.0,342.56333333333333,3
w13,1,128,8,4096,1536,16,32,256,64,4,3,73.0,342.58466666666664,3
w13,1,128,8,4096,3072,16,16,256,1,4,3,48.5,677.5603333333333,3
w13,1,128,8,4096,3072,16,16,256,4,4,3,48.5,679.1073333333333,3
w13,1,128,8,4096,3072,32,32,256,4,4,3,98.0,679.3736666666667,3
w13,2,8,2,1024,512,16,32,256,1,8,2,49.0,15.756666666666666,3
w13,2,8,2,1024,512,16,32,256,64,4,2,49.0,16.140666666666664,3
w13,2,8,2,1024,512,16,32,256,32,4,2,49.0,16.257666666666665,3
w13,2,16,2,1536,768,16,32,128,16,4,2,25.0,34.91433333333333,3
w13,2,16,2,1536,768,16,32,128,32,4,2,25.0,34.967333333333336,3
w13,2,16,2,1536,768,16,32,128,64,4,2,25.0,34.98866666666667,3
w13,2,16,4,1536,1024,16,32,128,16,4,2,25.0,89.39966666666665,3
w13,2,16,4,1536,1024,16,32,128,32,4,2,25.0,89.43166666666666,3
w13,2,16,4,1536,1024,16,32,128,64,4,2,25.0,89.53833333333334,3
w13,2,32,4,2048,768,16,32,256,16,8,3,73.0,88.98333333333335,3
w13,2,32,4,2048,768,16,32,128,32,8,3,37.0,89.03699999999999,3
w13,2,32,4,2048,768,16,16,256,4,4,4,64.5,89.05866666666667,3
w13,2,32,6,3072,1024,16,32,256,32,4,3,73.0,258.53133333333335,3
w13,2,32,6,3072,1024,16,32,256,64,8,3,73.0,258.61600000000004,3
w13,2,32,6,3072,1024,16,32,256,32,8,3,73.0,258.6166666666666,3
w13,2,60,4,2048,1408,16,16,256,4,4,3,48.5,158.41166666666666,3
w13,2,60,4,2048,1408,16,16,256,1,4,3,48.5,158.80733333333333,3
w13,2,60,4,2048,1408,16,32,256,32,4,3,73.0,159.03133333333335,3
w13,2,60,6,3584,2304,16,16,256,4,4,3,48.5,664.5053333333334,3
w13,2,60,6,3584,2304,32,32,256,1,4,3,98.0,664.686,3
w13,2,60,6,3584,2304,16,16,256,1,4,3,48.5,665.3586666666666,3
w13,2,60,8,2048,1536,16,16,256,1,4,3,48.5,341.1333333333333,3
w13,2,60,8,2048,1536,16,16,256,4,4,3,48.5,341.38866666666667,3
w13,2,60,8,2048,1536,16,32,256,1,4,3,73.0,341.5276666666666,3
w13,2,64,6,3072,2048,32,32,256,1,4,3,98.0,509.348,3
w13,2,64,6,3072,2048,32,32,256,4,4,3,98.0,509.59366666666665,3
w13,2,64,6,3072,2048,16,16,256,4,4,3,48.5,509.91333333333336,3
w13,2,64,6,3584,1536,32,32,256,1,4,3,98.0,445.8593333333333,3
w13,2,64,6,3584,1536,32,32,256,16,4,3,98.0,446.094,3
w13,2,64,6,3584,1536,32,32,256,4,4,3,98.0,446.11466666666666,3
w13,2,64,8,3584,2560,32,32,256,1,4,3,98.0,981.713,3
w13,2,64,8,3584,2560,32,32,256,4,4,3,98.0,981.9256666666666,3
w13,2,64,8,3584,2560,32,32,256,1,8,3,98.0,982.065,3
w13,2,128,4,2048,512,16,32,128,1,4,2,25.0,60.812999999999995,3
w13,2,128,4,2048,512,32,16,128,4,4,3,37.0,60.85566666666667,3
w13,2,128,4,2048,512,16,64,128,64,8,2,42.0,60.86666666666667,3
w13,2,128,6,4096,2048,16,16,256,4,4,3,48.5,676.955,3
w13,2,128,6,4096,2048,16,16,256,1,4,3,48.5,678.4060000000001,3
w13,2,128,6,4096,2048,32,32,256,1,4,3,98.0,678.7366666666667,3
w13,2,128,8,2048,768,16,32,256,32,4,3,73.0,173.3793333333333,3
w13,2,128,8,2048,768,16,32,256,64,4,3,73.0,173.47466666666665,3
w13,2,128,8,2048,768,16,32,256,16,4,3,73.0,173.50699999999998,3
w13,2,128,8,4096,1536,16,16,256,1,4,3,48.5,677.8186666666667,3
w13,2,128,8,4096,1536,16,32,256,32,4,3,73.0,678.8960000000001,3
w13,2,128,8,4096,1536,16,16,256,4,4,3,48.5,679.0770000000001,3
w13,2,128,8,4096,3072,16,16,256,1,4,3,48.5,1348.5913333333335,3
w13,2,128,8,4096,3072,16,16,256,4,4,3,48.5,1348.634,3
w13,2,128,8,4096,3072,32,32,256,1,4,3,98.0,1350.9056666666668,3
w13,4,8,2,1024,512,16,32,128,16,4,2,25.0,31.671333333333337,3
w13,4,8,2,1024,512,16,32,128,4,4,2,25.0,31.69333333333333,3
w13,4,8,2,1024,512,16,32,128,64,4,2,25.0,31.768333333333334,3
w13,4,16,2,1536,768,16,32,128,32,4,2,25.0,67.80199999999999,3
w13,4,16,2,1536,768,16,32,128,4,4,2,25.0,67.84366666666666,3
w13,4,16,2,1536,768,16,32,128,64,4,2,25.0,67.844,3
w13,4,16,4,1536,1024,16,16,256,4,4,3,48.5,173.43233333333333,3
w13,4,16,4,1536,1024,32,32,256,16,4,3,98.0,173.66666666666666,3
w13,4,16,4,1536,1024,32,32,256,16,8,3,98.0,173.731,3
w13,4,32,4,2048,768,16,32,256,16,4,3,73.0,173.41166666666666,3
w13,4,32,4,2048,768,16,16,256,1,4,3,48.5,173.43200000000002,3
w13,4,32,4,2048,768,16,32,256,32,4,3,73.0,173.45366666666666,3
w13,4,32,6,3072,1024,16,16,256,4,4,3,48.5,508.836,3
w13,4,32,6,3072,1024,32,32,256,1,4,3,98.0,509.316,3
w13,4,32,6,3072,1024,32,32,256,4,4,3,98.0,509.3376666666666,3
w13,4,60,4,2048,1408,16,16,256,4,4,3,48.5,312.16200000000003,3
w13,4,60,4,2048,1408,16,16,256,1,4,3,48.5,312.89799999999997,3
w13,4,60,4,2048,1408,16,32,256,16,4,3,73.0,313.41,3
w13,4,60,6,3584,2304,16,16,256,4,4,3,48.5,1323.814,3
w13,4,60,6,3584,2304,32,32,256,1,4,3,98.0,1324.3786666666667,3
w13,4,60,6,3584,2304,16,16,256,1,4,3,48.5,1324.571333333333,3
w13,4,60,8,2048,1536,16,16,256,4,4,3,48.5,676.0876666666667,3
w13,4,60,8,2048,1536,16,16,256,1,4,3,48.5,676.1303333333333,3
w13,4,60,8,2048,1536,32,32,256,1,4,3,98.0,677.005,3
w13,4,64,6,3072,2048,16,16,256,4,4,3,48.5,1009.361,3
w13,4,64,6,3072,2048,32,32,256,1,4,3,98.0,1010.63,3
w13,4,64,6,3072,2048,32,32,256,4,4,3,98.0,1011.2806666666668,3
w13,4,64,6,3584,1536,32,32,256,1,4,3,98.0,884.3026666666666,3
w13,4,64,6,3584,1536,32,32,256,4,4,3,98.0,884.4733333333334,3
w13,4,64,6,3584,1536,16,16,256,4,4,3,48.5,885.0923333333334,3
w13,4,64,8,3584,2560,32,32,256,1,4,3,98.0,1954.783,3
w13,4,64,8,3584,2560,32,32,256,4,4,3,98.0,1956.938,3
w13,4,64,8,3584,2560,32,32,256,1,8,3,98.0,1957.237,3
w13,4,128,4,2048,512,16,16,128,4,4,3,24.5,117.625,3
w13,4,128,4,2048,512,16,16,256,4,4,2,32.5,117.65733333333333,3
w13,4,128,4,2048,512,16,16,256,4,4,4,64.5,117.68866666666668,3
w13,4,128,6,4096,2048,16,16,256,4,4,3,48.5,1348.5106666666668,3
w13,4,128,6,4096,2048,16,16,256,1,4,3,48.5,1349.642,3
w13,4,128,6,4096,2048,32,32,256,1,4,3,98.0,1350.090333333333,3
w13,4,128,8,2048,768,16,16,256,4,4,3,48.5,340.44166666666666,3
w13,4,128,8,2048,768,16,16,256,1,4,3,48.5,340.69700000000006,3
w13,4,128,8,2048,768,16,32,256,1,4,3,73.0,341.72133333333335,3
w13,4,128,8,4096,1536,16,16,256,1,4,3,48.5,1348.3396666666667,3
w13,4,128,8,4096,1536,16,16,256,4,4,3,48.5,1348.563,3
w13,4,128,8,4096,1536,32,32,256,1,4,3,98.0,1351.0596666666668,3
w13,4,128,8,4096,3072,16,16,256,1,4,3,48.5,2690.492333333333,3
w13,4,128,8,4096,3072,16,16,256,4,4,3,48.5,2692.0603333333333,3
w13,4,128,8,4096,3072,32,32,256,1,4,3,98.0,2696.242,3
w13,8,8,2,1024,512,16,32,128,4,4,2,25.0,31.906666666666663,3
w13,8,8,2,1024,512,16,32,128,32,4,2,25.0,31.927333333333333,3
w13,8,8,2,1024,512,16,32,128,64,4,2,25.0,31.948666666666668,3
w13,8,16,2,1536,768,16,16,256,1,4,3,48.5,131.083,3
w13,8,16,2,1536,768,16,16,256,4,4,3,48.5,131.22066666666663,3
w13,8,16,2,1536,768,16,32,256,32,4,3,73.0,131.67966666666666,3
w13,8,16,4,1536,1024,16,16,256,4,4,3,48.5,173.43200000000002,3
w13,8,16,4,1536,1024,16,16,256,1,4,3,48.5,174.29633333333334,3
w13,8,16,4,1536,1024,32,32,256,16,8,3,98.0,174.595,3
w13,8,32,4,2048,768,16,16,256,4,4,3,48.5,341.3433333333333,3
w13,8,32,4,2048,768,16,16,256,1,4,3,48.5,341.56766666666664,3
w13,8,32,4,2048,768,16,16,256,4,4,4,64.5,341.856,3
w13,8,32,6,3072,1024,16,16,256,4,4,3,48.5,676.4213333333333,3
w13,8,32,6,3072,1024,32,32,256,1,4,3,98.0,676.709,3
w13,8,32,6,3072,1024,32,32,256,4,4,3,98.0,677.9256666666666,3
w13,8,60,4,2048,1408,16,16,256,4,4,3,48.5,619.4473333333334,3
w13,8,60,4,2048,1408,16,16,256,1,4,3,48.5,620.0666666666667,3
w13,8,60,4,2048,1408,16,32,256,16,4,3,73.0,621.0473333333333,3
w13,8,60,6,3584,2304,32,32,256,1,4,3,98.0,2637.4386666666664,3
w13,8,60,6,3584,2304,32,32,256,4,4,3,98.0,2640.638333333334,3
w13,8,60,6,3584,2304,16,16,256,1,4,3,48.5,2641.0653333333335,3
w13,8,60,8,2048,1536,16,16,256,4,4,3,48.5,1263.0426666666667,3
w13,8,60,8,2048,1536,32,32,256,1,4,3,98.0,1263.533,3
w13,8,60,8,2048,1536,16,16,256,1,4,3,48.5,1263.7576666666666,3
w13,8,64,6,3072,2048,16,16,256,4,4,3,48.5,2012.6603333333333,3
w13,8,64,6,3072,2048,32,32,256,1,4,3,98.0,2013.9193333333333,3
w13,8,64,6,3072,2048,32,32,256,4,4,3,98.0,2016.383,3
w13,8,64,6,3584,1536,32,32,256,1,4,3,98.0,1761.0836666666669,3
w13,8,64,6,3584,1536,32,32,256,4,4,3,98.0,1761.5100000000002,3
w13,8,64,6,3584,1536,16,16,256,1,4,3,48.5,1762.5556666666664,3
w13,8,64,8,3584,2560,32,32,256,1,4,3,98.0,3901.9373333333338,3
w13,8,64,8,3584,2560,32,32,256,1,8,3,98.0,3905.746333333333,3
w13,8,64,8,3584,2560,32,32,256,4,4,3,98.0,3907.2073333333337,3
w13,8,128,4,2048,512,16,16,256,1,4,4,64.5,229.47633333333337,3
w13,8,128,4,2048,512,16,16,256,4,4,4,64.5,229.76466666666667,3
w13,8,128,4,2048,512,16,16,256,1,4,3,48.5,229.81833333333336,3
w13,8,128,6,4096,2048,16,16,256,4,4,3,48.5,2690.3866666666668,3
w13,8,128,6,4096,2048,16,16,256,1,4,3,48.5,2691.101666666667,3
w13,8,128,6,4096,2048,16,32,256,1,4,3,73.0,2695.4746666666665,3
w13,8,128,8,2048,768,16,16,256,1,4,3,48.5,675.547,3
w13,8,128,8,2048,768,16,16,256,4,4,3,48.5,676.2936666666667,3
w13,8,128,8,2048,768,16,32,256,16,4,3,73.0,677.0936666666666,3
w13,8,128,8,4096,1536,16,16,256,1,4,3,48.5,2690.4476666666665,3
w13,8,128,8,4096,1536,16,16,256,4,4,3,48.5,2691.706666666667,3
w13,8,128,8,4096,1536,16,32,256,16,4,3,73.0,2696.4,3
w13,8,128,8,4096,3072,16,16,256,1,4,3,48.5,5375.223666666666,3
w13,8,128,8,4096,3072,16,16,256,4,4,3,48.5,5376.727666666667,3
w13,8,128,8,4096,3072,32,32,256,1,4,3,98.0,5380.664333333333,3
w13,16,8,2,1024,512,16,32,128,64,4,2,25.0,31.949,3
w13,16,8,2,1024,512,16,32,128,16,4,2,25.0,32.01266666666667,3
w13,16,8,2,1024,512,16,32,128,32,4,2,25.0,32.077,3
w13,16,16,2,1536,768,16,16,256,4,4,3,48.5,131.16833333333332,3
w13,16,16,2,1536,768,16,16,256,1,4,3,48.5,131.31733333333332,3
w13,16,16,2,1536,768,16,16,256,1,4,4,64.5,131.99933333333334,3
w13,16,16,4,1536,1024,16,16,256,4,4,3,48.5,173.9226666666667,3
w13,16,16,4,1536,1024,16,16,256,1,4,3,48.5,174.8083333333333,3
w13,16,16,4,1536,1024,16,32,256,1,4,3,73.0,175.128,3
w13,16,32,4,2048,768,16,16,256,4,4,3,48.5,340.86833333333334,3
w13,16,32,4,2048,768,16,16,256,1,4,3,48.5,341.44399999999996,3
w13,16,32,4,2048,768,32,32,256,1,4,3,98.0,342.4793333333334,3
w13,16,32,6,3072,1024,16,16,256,4,4,3,48.5,677.6583333333333,3
w13,16,32,6,3072,1024,32,32,256,1,4,3,98.0,678.2023333333333,3
w13,16,32,6,3072,1024,16,16,256,1,4,3,48.5,678.6503333333334,3
w13,16,60,4,2048,1408,16,16,256,4,4,3,48.5,1157.9433333333334,3
w13,16,60,4,2048,1408,16,16,256,1,4,3,48.5,1158.4979999999998,3
w13,16,60,4,2048,1408,16,32,256,16,4,3,73.0,1159.2663333333333,3
w13,16,60,6,3584,2304,32,32,256,1,4,3,98.0,3296.908,3
w13,16,60,6,3584,2304,32,32,256,1,8,3,98.0,3301.4413333333337,3
w13,16,60,6,3584,2304,32,32,256,4,4,3,98.0,3302.422666666667,3
w13,16,60,8,2048,1536,16,16,256,1,4,3,48.5,1265.4113333333332,3
w13,16,60,8,2048,1536,16,16,256,4,4,3,48.5,1265.9236666666666,3
w13,16,60,8,2048,1536,32,32,256,1,4,3,98.0,1266.3396666666663,3
w13,16,64,6,3072,2048,16,16,256,4,4,3,48.5,2683.7883333333334,3
w13,16,64,6,3072,2048,32,32,256,1,4,3,98.0,2684.652,3
w13,16,64,6,3072,2048,32,32,256,4,4,3,98.0,2687.1380000000004,3
w13,16,64,6,3584,1536,32,32,256,1,4,3,98.0,2350.013,3
w13,16,64,6,3584,1536,16,16,256,1,4,3,48.5,2350.578666666667,3
w13,16,64,6,3584,1536,16,16,256,4,4,3,48.5,2350.909333333333,3
w13,16,64,8,3584,2560,32,32,256,1,4,3,98.0,3907.6766666666663,3
w13,16,64,8,3584,2560,32,32,256,1,8,3,98.0,3911.8583333333336,3
w13,16,64,8,3584,2560,32,32,256,4,4,3,98.0,3912.935333333334,3
w13,16,128,4,2048,512,16,32,256,1,4,3,73.0,453.34066666666666,3
w13,16,128,4,2048,512,16,16,256,1,4,3,48.5,453.43666666666667,3
w13,16,128,4,2048,512,16,32,256,1,8,3,73.0,453.43666666666667,3
w13,16,128,6,4096,2048,16,16,256,4,4,3,48.5,5374.727,3
w13,16,128,6,4096,2048,16,16,256,1,4,3,48.5,5377.073333333334,3
w13,16,128,6,4096,2048,32,32,256,1,4,3,98.0,5381.458333333333,3
w13,16,128,8,2048,768,16,16,256,4,4,3,48.5,1346.9640000000002,3
w13,16,128,8,2048,768,16,16,256,1,4,3,48.5,1347.7106666666668,3
w13,16,128,8,2048,768,32,32,256,1,4,3,98.0,1348.2436666666665,3
w13,16,128,8,4096,1536,16,16,256,1,4,3,48.5,5375.041,3
w13,16,128,8,4096,1536,16,16,256,4,4,3,48.5,5376.651666666666,3
w13,16,128,8,4096,1536,32,32,256,1,4,3,98.0,5382.092,3
w13,16,128,8,4096,3072,16,16,256,1,4,3,48.5,10742.81,3
w13,16,128,8,4096,3072,16,16,256,4,4,3,48.5,10747.822666666669,3
w13,16,128,8,4096,3072,32,32,256,1,4,3,98.0,10753.443333333333,3
w13,24,8,2,1024,512,16,32,128,1,8,2,25.0,32.193999999999996,3
w13,24,8,2,1024,512,16,32,128,32,4,2,25.0,32.193999999999996,3
w13,24,8,2,1024,512,16,32,128,16,4,2,25.0,32.20466666666667,3
w13,24,16,2,1536,768,16,16,256,1,4,3,48.5,131.86433333333332,3
w13,24,16,2,1536,768,16,16,256,4,4,3,48.5,132.01366666666664,3
w13,24,16,2,1536,768,16,16,256,4,4,4,64.5,132.739,3
w13,24,16,4,1536,1024,16,16,256,4,4,3,48.5,174.75466666666668,3
w13,24,16,4,1536,1024,16,16,256,1,4,3,48.5,175.56566666666666,3
w13,24,16,4,1536,1024,16,32,256,64,4,3,73.0,175.875,3
w13,24,32,4,2048,768,16,16,256,4,4,3,48.5,341.4546666666667,3
w13,24,32,4,2048,768,16,16,256,1,4,3,48.5,341.94533333333334,3
w13,24,32,4,2048,768,16,32,256,1,4,3,73.0,343.23600000000005,3
w13,24,32,6,3072,1024,16,16,256,4,4,3,48.5,679.6103333333334,3
w13,24,32,6,3072,1024,32,32,256,1,4,3,98.0,679.7703333333334,3
w13,24,32,6,3072,1024,16,16,256,1,4,3,48.5,680.24,3
w13,24,60,4,2048,1408,16,16,256,4,4,3,48.5,1159.17,3
w13,24,60,4,2048,1408,16,16,256,1,4,3,48.5,1159.6180000000002,3
w13,24,60,4,2048,1408,16,32,256,16,4,3,73.0,1161.698,3
w13,24,60,6,3584,2304,32,32,256,1,4,3,98.0,3300.1090000000004,3
w13,24,60,6,3584,2304,32,32,256,1,8,3,98.0,3303.820333333333,3
w13,24,60,6,3584,2304,16,16,256,1,4,3,48.5,3305.9960000000005,3
w13,24,60,8,2048,1536,16,16,256,1,4,3,48.5,1266.9476666666667,3
w13,24,60,8,2048,1536,32,32,256,1,4,3,98.0,1268.121666666667,3
w13,24,60,8,2048,1536,16,16,256,4,4,3,48.5,1268.1850000000002,3
w13,24,64,6,3072,2048,16,16,256,4,4,3,48.5,2687.5533333333333,3
w13,24,64,6,3072,2048,32,32,256,1,4,3,98.0,2688.055666666666,3
w13,24,64,6,3072,2048,16,16,256,1,4,3,48.5,2689.718666666667,3
w13,24,64,6,3584,1536,32,32,256,1,4,3,98.0,2350.0353333333333,3
w13,24,64,6,3584,1536,16,16,256,1,4,3,48.5,2352.947,3
w13,24,64,6,3584,1536,16,16,256,4,4,3,48.5,2354.3016666666667,3
w13,24,64,8,3584,2560,32,32,256,1,4,3,98.0,3912.327,3
w13,24,64,8,3584,2560,32,32,256,1,8,3,98.0,3916.924333333333,3
w13,24,64,8,3584,2560,16,16,256,1,4,3,48.5,3921.1596666666665,3
w13,24,128,4,2048,512,16,16,256,1,4,3,48.5,676.1806666666666,3
w13,24,128,4,2048,512,16,32,256,1,4,3,73.0,677.0013333333333,3
w13,24,128,4,2048,512,16,16,256,4,4,3,48.5,677.066,3
w13,24,128,6,4096,2048,16,16,256,4,4,3,48.5,7165.153666666668,3
w13,24,128,6,4096,2048,16,16,256,1,4,3,48.5,7167.030666666667,3
w13,24,128,6,4096,2048,32,32,256,1,4,3,98.0,7174.637333333333,3
w13,24,128,8,2048,768,16,16,256,1,4,3,48.5,1347.8916666666669,3
w13,24,128,8,2048,768,16,16,256,4,4,3,48.5,1348.1476666666667,3
w13,24,128,8,2048,768,32,32,256,1,4,3,98.0,1348.8836666666666,3
w13,24,128,8,4096,1536,16,16,256,1,4,3,48.5,5375.991999999999,3
w13,24,128,8,4096,1536,16,16,256,4,4,3,48.5,5379.7373333333335,3
w13,24,128,8,4096,1536,32,32,256,1,4,3,98.0,5385.977,3
w13,24,128,8,4096,3072,16,16,256,1,4,3,48.5,10749.111666666668,3
w13,24,128,8,4096,3072,16,16,256,4,4,3,48.5,10755.789,3
w13,24,128,8,4096,3072,32,32,256,1,4,3,98.0,10759.980333333331,3
w13,32,8,2,1024,512,16,32,128,16,4,2,25.0,32.08733333333333,3
w13,32,8,2,1024,512,16,32,128,4,4,2,25.0,32.18366666666667,3
w13,32,8,2,1024,512,16,32,128,64,4,2,25.0,32.258,3
w13,32,16,2,1536,768,16,16,256,4,4,3,48.5,131.90666666666667,3
w13,32,16,2,1536,768,16,16,256,1,4,3,48.5,131.96033333333332,3
w13,32,16,2,1536,768,16,32,256,1,4,3,73.0,132.952,3
w13,32,16,4,1536,1024,16,16,256,4,4,3,48.5,175.36266666666666,3
w13,32,16,4,1536,1024,16,16,256,1,4,3,48.5,175.45899999999995,3
w13,32,16,4,1536,1024,16,32,256,1,4,3,73.0,176.23733333333334,3
w13,32,32,4,2048,768,16,16,256,4,4,3,48.5,342.372,3
w13,32,32,4,2048,768,16,16,256,1,4,3,48.5,342.4256666666667,3
w13,32,32,4,2048,768,16,32,256,1,4,3,73.0,343.5353333333333,3
w13,32,32,6,3072,1024,16,16,256,1,4,3,48.5,681.04,3
w13,32,32,6,3072,1024,32,32,256,1,4,3,98.0,681.477,3
w13,32,32,6,3072,1024,16,16,256,4,4,3,48.5,681.9996666666667,3
w13,32,60,4,2048,1408,16,16,256,1,4,3,48.5,1160.4716666666666,3
w13,32,60,4,2048,1408,16,16,256,4,4,3,48.5,1161.058,3
w13,32,60,4,2048,1408,16,32,256,16,4,3,73.0,1162.37,3
w13,32,60,6,3584,2304,32,32,256,1,4,3,98.0,3304.023333333333,3
w13,32,60,6,3584,2304,32,32,256,1,8,3,98.0,3307.884666666667,3
w13,32,60,6,3584,2304,16,16,256,1,4,3,48.5,3310.4126666666666,3
w13,32,60,8,2048,1536,16,16,256,1,4,3,48.5,1268.9643333333331,3
w13,32,60,8,2048,1536,16,16,256,4,4,3,48.5,1270.053,3
w13,32,60,8,2048,1536,32,32,256,1,4,3,98.0,1270.1376666666667,3
w13,32,64,6,3072,2048,16,16,256,4,4,3,48.5,2690.7646666666665,3
w13,32,64,6,3072,2048,32,32,256,1,4,3,98.0,2691.3300000000004,3
w13,32,64,6,3072,2048,16,16,256,1,4,3,48.5,2691.372666666666,3
w13,32,64,6,3584,1536,32,32,256,1,4,3,98.0,2354.8246666666664,3
w13,32,64,6,3584,1536,16,16,256,1,4,3,48.5,2355.4649999999997,3
w13,32,64,6,3584,1536,16,16,256,4,4,3,48.5,2356.2863333333335,3
w13,32,64,8,3584,2560,32,32,256,1,4,3,98.0,3918.023333333333,3
w13,32,64,8,3584,2560,32,32,256,1,8,3,98.0,3922.6096666666663,3
w13,32,64,8,3584,2560,32,32,256,4,4,3,98.0,3925.201333333333,3
w13,32,128,4,2048,512,16,16,256,1,4,3,48.5,899.8629999999999,3
w13,32,128,4,2048,512,16,32,256,1,4,3,73.0,900.3533333333334,3
w13,32,128,4,2048,512,32,32,256,1,4,3,98.0,900.3533333333334,3
w13,32,128,6,4096,2048,16,16,256,4,4,3,48.5,7167.566333333333,3
w13,32,128,6,4096,2048,16,16,256,1,4,3,48.5,7168.473000000001,3
w13,32,128,6,4096,2048,32,32,256,1,4,3,98.0,7177.646333333333,3
w13,32,128,8,2048,768,16,16,256,1,4,3,48.5,1348.4786666666666,3
w13,32,128,8,2048,768,16,16,256,4,4,3,48.5,1349.588,3
w13,32,128,8,2048,768,16,32,256,1,4,3,73.0,1351.0706666666667,3
w13,32,128,8,4096,1536,16,16,256,1,4,3,48.5,5380.5053333333335,3
w13,32,128,8,4096,1536,16,16,256,4,4,3,48.5,5382.958666666666,3
w13,32,128,8,4096,1536,16,32,256,1,4,3,73.0,5389.422666666666,3
w13,32,128,8,4096,3072,16,16,256,1,4,3,48.5,10753.098666666669,3
w13,32,128,8,4096,3072,16,16,256,4,4,3,48.5,10762.603,3
w13,32,128,8,4096,3072,32,32,256,1,4,3,98.0,10766.697,3
w13,48,8,2,1024,512,16,32,128,64,4,2,25.0,32.429,3
w13,48,8,2,1024,512,16,32,128,16,4,2,25.0,32.43933333333333,3
w13,48,8,2,1024,512,16,64,128,64,8,2,42.0,32.49366666666666,3
w13,48,16,2,1536,768,16,16,256,1,4,3,48.5,132.30166666666668,3
w13,48,16,2,1536,768,16,16,256,4,4,3,48.5,132.97366666666667,3
w13,48,16,2,1536,768,16,32,256,1,4,3,73.0,133.02666666666667,3
w13,48,16,4,1536,1024,16,16,256,4,4,3,48.5,176.024,3
w13,48,16,4,1536,1024,16,16,256,1,4,3,48.5,177.08033333333333,3
w13,48,16,4,1536,1024,16,32,256,1,8,3,73.0,177.62433333333334,3
w13,48,32,4,2048,768,16,16,256,4,4,3,48.5,343.2573333333333,3
w13,48,32,4,2048,768,16,16,256,1,4,3,48.5,343.9506666666666,3
w13,48,32,4,2048,768,16,32,256,1,4,3,73.0,344.815,3
w13,48,32,6,3072,1024,16,16,256,1,4,3,48.5,683.1516666666666,3
w13,48,32,6,3072,1024,16,16,256,4,4,3,48.5,683.2263333333334,3
w13,48,32,6,3072,1024,32,32,256,1,4,3,98.0,683.696,3
w13,48,60,4,2048,1408,16,16,256,1,4,3,48.5,1162.6153333333334,3
w13,48,60,4,2048,1408,16,16,256,4,4,3,48.5,1162.9996666666666,3
w13,48,60,4,2048,1408,32,32,256,1,4,3,98.0,1164.3226666666667,3
w13,48,60,6,3584,2304,32,32,256,1,4,3,98.0,3310.594333333333,3
w13,48,60,6,3584,2304,32,32,256,1,8,3,98.0,3315.661,3
w13,48,60,6,3584,2304,16,16,256,1,4,3,48.5,3316.322,3
w13,48,60,8,2048,1536,16,16,256,1,4,3,48.5,1272.5166666666669,3
w13,48,60,8,2048,1536,32,32,256,1,4,3,98.0,1274.469,3
w13,48,60,8,2048,1536,16,16,256,4,4,3,48.5,1275.1303333333333,3
w13,48,64,6,3072,2048,32,32,256,1,4,3,98.0,2696.3433333333337,3
w13,48,64,6,3072,2048,16,16,256,1,4,3,48.5,2697.078666666667,3
w13,48,64,6,3072,2048,16,16,256,4,4,3,48.5,2697.4199999999996,3
w13,48,64,6,3584,1536,32,32,256,1,4,3,98.0,2358.1953333333336,3
w13,48,64,6,3584,1536,16,16,256,1,4,3,48.5,2359.593,3
w13,48,64,6,3584,1536,16,16,256,4,4,3,48.5,2361.8113333333336,3
w13,48,64,8,3584,2560,32,32,256,1,4,3,98.0,3927.794,3
w13,48,64,8,3584,2560,32,32,256,1,8,3,98.0,3930.940666666667,3
w13,48,64,8,3584,2560,16,16,256,1,4,3,48.5,3935.964333333334,3
w13,48,128,4,2048,512,16,16,256,1,4,3,48.5,900.9403333333332,3
w13,48,128,4,2048,512,16,32,256,1,4,3,73.0,901.3353333333334,3
w13,48,128,4,2048,512,16,16,256,4,4,3,48.5,901.5166666666668,3
w13,48,128,6,4096,2048,16,16,256,1,4,3,48.5,7172.366333333334,3
w13,48,128,6,4096,2048,16,16,256,4,4,3,48.5,7173.3043333333335,3
w13,48,128,6,4096,2048,16,32,256,1,4,3,73.0,7184.793000000001,3
w13,48,128,8,2048,768,16,16,256,1,4,3,48.5,1350.1213333333333,3
w13,48,128,8,2048,768,32,32,256,1,4,3,98.0,1351.7430000000002,3
w13,48,128,8,2048,768,16,16,256,4,4,3,48.5,1352.2116666666668,3
w13,48,128,8,4096,1536,16,16,256,1,4,3,48.5,5382.415,3
w13,48,128,8,4096,1536,16,16,256,4,4,3,48.5,5387.886666666666,3
w13,48,128,8,4096,1536,16,32,256,1,4,3,73.0,5390.798666666667,3
w13,48,128,8,4096,3072,16,16,256,1,4,3,48.5,10761.768333333332,3
w13,48,128,8,4096,3072,16,16,256,4,4,3,48.5,10771.901666666665,3
w13,48,128,8,4096,3072,16,32,256,1,4,3,73.0,10778.664333333332,3
w13,64,8,2,1024,512,16,32,128,32,4,2,25.0,32.53566666666667,3
w13,64,8,2,1024,512,16,32,128,4,4,2,25.0,32.58866666666666,3
w13,64,8,2,1024,512,16,32,128,64,4,2,25.0,32.65266666666667,3
w13,64,16,2,1536,768,16,16,256,1,4,3,48.5,132.84533333333334,3
w13,64,16,2,1536,768,16,16,256,4,4,3,48.5,132.888,3
w13,64,16,2,1536,768,16,32,256,1,4,3,73.0,133.44299999999998,3
w13,64,16,4,1536,1024,16,16,256,4,4,3,48.5,176.92033333333336,3
w13,64,16,4,1536,1024,16,16,256,1,4,3,48.5,177.17600000000002,3
w13,64,16,4,1536,1024,32,32,256,1,8,3,98.0,178.07199999999995,3
w13,64,32,4,2048,768,16,16,256,4,4,3,48.5,343.855,3
w13,64,32,4,2048,768,16,16,256,1,4,3,48.5,344.0786666666667,3
w13,64,32,4,2048,768,16,32,256,1,4,3,73.0,345.05999999999995,3
w13,64,32,6,3072,1024,16,16,256,1,4,3,48.5,685.3710000000001,3
w13,64,32,6,3072,1024,16,16,256,4,4,3,48.5,685.467,3
w13,64,32,6,3072,1024,32,32,256,1,4,3,98.0,686.256,3
w13,64,60,4,2048,1408,16,16,256,1,4,3,48.5,1164.823666666667,3
w13,64,60,4,2048,1408,16,16,256,4,4,3,48.5,1165.218,3
w13,64,60,4,2048,1408,32,32,256,1,4,3,98.0,1166.775666666667,3
w13,64,60,6,3584,2304,32,32,256,1,4,3,98.0,3317.3673333333336,3
w13,64,60,6,3584,2304,32,32,256,1,8,3,98.0,3322.455333333334,3
w13,64,60,6,3584,2304,16,16,256,1,4,3,48.5,3322.999333333333,3
w13,64,60,8,2048,1536,16,16,256,1,4,3,48.5,1276.3996666666665,3
w13,64,60,8,2048,1536,16,16,256,4,4,3,48.5,1277.904,3
w13,64,60,8,2048,1536,32,32,256,1,4,3,98.0,1278.2343333333336,3
w13,64,64,6,3072,2048,32,32,256,1,4,3,98.0,2701.6973333333335,3
w13,64,64,6,3072,2048,16,16,256,4,4,3,48.5,2701.8683333333333,3
w13,64,64,6,3072,2048,16,16,256,1,4,3,48.5,2702.7646666666665,3
w13,64,64,6,3584,1536,16,16,256,1,4,3,48.5,2363.891666666667,3
w13,64,64,6,3584,1536,32,32,256,1,4,3,98.0,2364.819333333334,3
w13,64,64,6,3584,1536,16,16,256,4,4,3,48.5,2367.7206666666666,3
w13,64,64,8,3584,2560,32,32,256,1,4,3,98.0,3935.996000000001,3
w13,64,64,8,3584,2560,32,32,256,1,8,3,98.0,3941.4893333333334,3
w13,64,64,8,3584,2560,16,16,256,1,4,3,48.5,3943.196,3
w13,64,128,4,2048,512,16,16,256,1,4,3,48.5,901.3986666666666,3
w13,64,128,4,2048,512,16,32,256,1,4,3,73.0,902.2946666666668,3
w13,64,128,4,2048,512,16,16,256,4,4,3,48.5,902.3906666666668,3
w13,64,128,6,4096,2048,16,16,256,1,4,3,48.5,7178.668666666667,3
w13,64,128,6,4096,2048,16,16,256,4,4,3,48.5,7179.970666666667,3
w13,64,128,6,4096,2048,16,32,256,1,4,3,73.0,7189.218666666667,3
w13,64,128,8,2048,768,16,16,256,1,4,3,48.5,1352.9053333333334,3
w13,64,128,8,2048,768,32,32,256,1,4,3,98.0,1353.7476666666666,3
w13,64,128,8,2048,768,16,16,256,4,4,3,48.5,1354.057,3
w13,64,128,8,4096,1536,16,16,256,1,4,3,48.5,5387.5453333333335,3
w13,64,128,8,4096,1536,16,32,256,1,4,3,73.0,5393.059666666667,3
w13,64,128,8,4096,1536,16,16,256,4,4,3,48.5,5393.625333333333,3
w13,64,128,8,4096,3072,16,16,256,1,4,3,48.5,10768.998666666666,3
w13,64,128,8,4096,3072,16,32,256,1,4,3,73.0,10784.082,3
w13,64,128,8,4096,3072,16,16,256,4,4,3,48.5,10786.940666666667,3
w13,96,8,2,1024,512,16,32,128,1,4,2,25.0,32.792,3
w13,96,8,2,1024,512,16,32,128,16,4,2,25.0,33.016,3
w13,96,8,2,1024,512,32,32,128,64,8,2,34.0,33.05833333333333,3
w13,96,16,2,1536,768,16,16,256,1,4,3,48.5,133.42133333333334,3
w13,96,16,2,1536,768,16,16,256,4,4,3,48.5,133.95466666666667,3
w13,96,16,2,1536,768,16,32,128,4,4,2,25.0,134.39233333333334,3
w13,96,16,4,1536,1024,32,32,128,1,4,2,34.0,180.31233333333333,3
w13,96,16,4,1536,1024,32,32,128,4,4,2,34.0,180.32333333333335,3
w13,96,16,4,1536,1024,32,32,256,16,4,3,98.0,180.472,3
w13,96,32,4,2048,768,16,16,256,1,4,3,48.5,345.7,3
w13,96,32,4,2048,768,16,16,256,4,4,3,48.5,346.00933333333336,3
w13,96,32,4,2048,768,16,32,256,1,8,3,73.0,347.52500000000003,3
w13,96,32,6,3072,1024,32,32,256,1,4,3,98.0,690.3953333333333,3
w13,96,32,6,3072,1024,32,32,256,1,8,3,98.0,691.3016666666666,3
w13,96,32,6,3072,1024,16,16,256,4,4,3,48.5,693.6053333333333,3
w13,96,60,4,2048,1408,16,16,256,1,4,3,48.5,1168.013,3
w13,96,60,4,2048,1408,16,16,256,4,4,3,48.5,1169.5276666666666,3
w13,96,60,4,2048,1408,32,32,256,1,4,3,98.0,1170.8606666666665,3
w13,96,60,6,3584,2304,32,32,256,1,4,3,98.0,3329.3880000000004,3
w13,96,60,6,3584,2304,16,16,256,1,4,3,48.5,3334.039666666667,3
w13,96,60,6,3584,2304,32,32,256,1,8,3,98.0,3335.490333333333,3
w13,96,60,8,2048,1536,16,16,256,1,4,3,48.5,1282.1066666666666,3
w13,96,60,8,2048,1536,16,16,256,4,4,3,48.5,1284.5173333333332,3
w13,96,60,8,2048,1536,32,32,256,1,4,3,98.0,1285.3386666666663,3
w13,96,64,6,3072,2048,16,16,256,1,4,3,48.5,2710.3906666666667,3
w13,96,64,6,3072,2048,32,32,256,1,4,3,98.0,2711.179666666667,3
w13,96,64,6,3072,2048,16,16,256,4,4,3,48.5,2711.969,3
w13,96,64,6,3584,1536,32,32,256,1,4,3,98.0,2371.0913333333333,3
w13,96,64,6,3584,1536,16,16,256,1,4,3,48.5,2371.166,3
w13,96,64,6,3584,1536,16,16,256,4,4,3,48.5,2376.8303333333333,3
w13,96,64,8,3584,2560,32,32,256,1,4,3,98.0,3952.944666666667,3
w13,96,64,8,3584,2560,16,16,256,1,4,3,48.5,3958.2683333333334,3
w13,96,64,8,3584,2560,32,32,256,1,8,3,98.0,3965.159,3
w13,96,128,4,2048,512,16,16,256,1,4,3,48.5,902.9886666666666,3
w13,96,128,4,2048,512,16,32,256,1,4,3,73.0,903.6496666666668,3
w13,96,128,4,2048,512,16,16,256,4,4,3,48.5,903.949,3
w13,96,128,6,4096,2048,16,16,256,1,4,3,48.5,7187.810333333334,3
w13,96,128,6,4096,2048,16,16,256,4,4,3,48.5,7190.391,3
w13,96,128,6,4096,2048,16,32,256,1,4,3,73.0,7196.93,3
w13,96,128,8,2048,768,16,16,256,1,4,3,48.5,1356.467666666667,3
w13,96,128,8,2048,768,16,16,256,4,4,3,48.5,1358.1,3
w13,96,128,8,2048,768,32,32,256,1,4,3,98.0,1358.6546666666666,3
w13,96,128,8,4096,1536,16,16,256,1,4,3,48.5,5396.899666666667,3
w13,96,128,8,4096,1536,16,32,256,1,4,3,73.0,5401.166333333334,3
w13,96,128,8,4096,1536,16,16,256,4,4,3,48.5,5405.336666666667,3
w13,96,128,8,4096,3072,16,16,256,1,4,3,48.5,10783.856666666668,3
w13,96,128,8,4096,3072,16,32,256,1,4,3,73.0,10790.363,3
w13,96,128,8,4096,3072,16,16,256,4,4,3,48.5,10804.464999999998,3
w13,128,8,2,1024,512,16,32,128,1,4,2,25.0,33.282333333333334,3
w13,128,8,2,1024,512,32,32,128,64,4,2,34.0,33.431666666666665,3
w13,128,8,2,1024,512,16,64,128,1,8,2,42.0,33.496,3
w13,128,16,2,1536,768,16,16,256,4,4,3,48.5,134.04033333333334,3
w13,128,16,2,1536,768,16,16,256,1,4,3,48.5,134.10433333333333,3
w13,128,16,2,1536,768,16,32,128,1,4,2,25.0,135.032,3
w13,128,16,4,1536,1024,32,32,256,1,8,3,98.0,181.22933333333333,3
w13,128,16,4,1536,1024,32,32,256,16,4,3,98.0,181.31499999999997,3
w13,128,16,4,1536,1024,32,32,256,32,8,3,98.0,181.379,3
w13,128,32,4,2048,768,16,16,256,1,4,3,48.5,346.91633333333334,3
w13,128,32,4,2048,768,16,16,256,4,4,3,48.5,347.2683333333334,3
w13,128,32,4,2048,768,16,32,256,1,4,3,73.0,348.63366666666667,3
w13,128,32,6,3072,1024,32,32,256,1,4,3,98.0,694.5553333333334,3
w13,128,32,6,3072,1024,32,32,256,1,8,3,98.0,695.4193333333334,3
w13,128,32,6,3072,1024,32,32,256,4,4,3,98.0,698.7046666666666,3
w13,128,60,4,2048,1408,16,16,256,1,4,3,48.5,1171.255666666667,3
w13,128,60,4,2048,1408,32,32,256,1,4,3,98.0,1173.399666666667,3
w13,128,60,4,2048,1408,16,16,256,4,4,3,48.5,1173.8153333333332,3
w13,128,60,6,3584,2304,32,32,256,1,4,3,98.0,3340.012666666667,3
w13,128,60,6,3584,2304,16,16,256,1,4,3,48.5,3343.895,3
w13,128,60,6,3584,2304,32,32,256,1,8,3,98.0,3346.380333333333,3
w13,128,60,8,2048,1536,32,32,256,1,4,3,98.0,1290.075,3
w13,128,60,8,2048,1536,32,32,256,1,8,3,98.0,1291.781,3
w13,128,60,8,2048,1536,32,32,256,4,4,3,98.0,1295.9736666666663,3
w13,128,64,6,3072,2048,16,16,256,1,4,3,48.5,2719.543,3
w13,128,64,6,3072,2048,32,32,256,1,4,3,98.0,2720.4283333333333,3
w13,128,64,6,3072,2048,16,16,256,4,4,3,48.5,2720.8759999999997,3
w13,128,64,6,3584,1536,16,16,256,1,4,3,48.5,2375.934333333333,3
w13,128,64,6,3584,1536,32,32,256,1,4,3,98.0,2381.363666666666,3
w13,128,64,6,3584,1536,16,16,256,4,4,3,48.5,2382.974333333333,3
w13,128,64,8,3584,2560,32,32,256,1,4,3,98.0,3964.924,3
w13,128,64,8,3584,2560,16,16,256,1,4,3,48.5,3969.4256666666665,3
w13,128,64,8,3584,2560,32,32,256,1,8,3,98.0,3978.364666666667,3
w13,128,128,4,2048,512,16,16,256,1,4,3,48.5,903.7673333333332,3
w13,128,128,4,2048,512,16,32,256,1,4,3,73.0,904.9933333333332,3
w13,128,128,4,2048,512,16,16,256,4,4,3,48.5,905.42,3
w13,128,128,6,4096,2048,16,16,256,4,4,3,48.5,7201.217333333334,3
w13,128,128,6,4096,2048,16,16,256,1,4,3,48.5,7201.932000000001,3
w13,128,128,6,4096,2048,16,32,256,1,4,3,73.0,7209.473000000001,3
w13,128,128,8,2048,768,16,16,256,1,4,3,48.5,1359.8916666666669,3
w13,128,128,8,2048,768,32,32,256,1,4,3,98.0,1363.0496666666666,3
w13,128,128,8,2048,768,16,32,256,1,4,3,73.0,1363.0706666666667,3
w13,128,128,8,4096,1536,16,16,256,1,4,3,48.5,5408.045666666666,3
w13,128,128,8,4096,1536,16,32,256,1,4,3,73.0,5412.152333333334,3
w13,128,128,8,4096,1536,16,16,256,4,4,3,48.5,5418.349666666666,3
w13,128,128,8,4096,3072,16,16,256,1,4,3,48.5,10803.087999999998,3
w13,128,128,8,4096,3072,16,32,256,1,4,3,73.0,10806.928,3
w13,128,128,8,4096,3072,16,16,256,4,4,3,48.5,10829.040333333332,3
w13,256,8,2,1024,512,32,64,128,1,8,2,52.0,35.266,3
w13,256,8,2,1024,512,64,32,128,16,4,2,52.0,35.660999999999994,3
w13,256,8,2,1024,512,64,32,128,1,8,2,52.0,35.875,3
w13,256,16,2,1536,768,32,32,128,1,4,2,34.0,137.88000000000002,3
w13,256,16,2,1536,768,32,32,128,4,8,2,34.0,138.01866666666666,3
w13,256,16,2,1536,768,32,64,128,1,8,3,76.0,138.22166666666666,3
w13,256,16,4,1536,1024,64,32,256,1,8,3,148.0,189.52833333333336,3
w13,256,16,4,1536,1024,64,128,128,4,8,2,112.0,189.74166666666667,3
w13,256,16,4,1536,1024,64,128,128,1,8,2,112.0,190.12566666666663,3
w13,256,32,4,2048,768,32,32,256,1,8,3,98.0,355.17266666666666,3
w13,256,32,4,2048,768,32,32,256,1,4,3,98.0,355.343,3
w13,256,32,4,2048,768,32,32,256,4,4,3,98.0,356.463,3
w13,256,32,6,3072,1024,64,32,256,1,4,3,148.0,718.8436666666666,3
w13,256,32,6,3072,1024,64,32,256,1,8,3,148.0,720.8596666666666,3
w13,256,32,6,3072,1024,64,64,128,1,8,3,104.0,722.1716666666666,3
w13,256,60,4,2048,1408,32,32,256,1,4,3,98.0,1186.0396666666666,3
w13,256,60,4,2048,1408,32,32,256,1,8,3,98.0,1187.298,3
w13,256,60,4,2048,1408,32,32,256,4,4,3,98.0,1190.8073333333334,3
w13,256,60,6,3584,2304,32,32,256,1,4,3,98.0,3382.6470000000004,3
w13,256,60,6,3584,2304,32,32,256,1,8,3,98.0,3387.276,3
w13,256,60,6,3584,2304,32,32,256,4,4,3,98.0,3399.3403333333335,3
w13,256,60,8,2048,1536,64,32,256,1,8,3,148.0,1314.2886666666666,3
w13,256,60,8,2048,1536,64,32,256,1,4,3,148.0,1316.294,3
w13,256,60,8,2048,1536,32,64,256,8,8,3,148.0,1320.923,3
w13,256,64,6,3072,2048,32,32,256,1,4,3,98.0,2748.875666666667,3
w13,256,64,6,3072,2048,32,32,256,1,8,3,98.0,2756.929666666667,3
w13,256,64,6,3072,2048,32,32,256,4,4,3,98.0,2760.2466666666664,3
w13,256,64,6,3584,1536,32,32,256,1,4,3,98.0,2409.842666666667,3
w13,256,64,6,3584,1536,32,32,256,1,8,3,98.0,2415.411,3
w13,256,64,6,3584,1536,32,32,256,4,4,3,98.0,2420.2966666666666,3
w13,256,64,8,3584,2560,32,32,256,1,4,3,98.0,4023.698,3
w13,256,64,8,3584,2560,16,64,256,16,4,3,122.0,4032.317000000001,3
w13,256,64,8,3584,2560,32,32,256,1,8,3,98.0,4035.047666666667,3
w13,256,128,4,2048,512,16,16,256,1,4,3,48.5,909.922,3
w13,256,128,4,2048,512,16,32,256,1,4,3,73.0,910.1566666666666,3
w13,256,128,4,2048,512,16,16,256,4,4,3,48.5,911.9483333333332,3
w13,256,128,6,4096,2048,16,16,256,1,4,3,48.5,7235.297333333333,3
w13,256,128,6,4096,2048,16,16,256,4,4,3,48.5,7236.630666666667,3
w13,256,128,6,4096,2048,16,32,256,1,4,3,73.0,7241.175,3
w13,256,128,8,2048,768,16,16,256,1,4,3,48.5,1375.7213333333332,3
w13,256,128,8,2048,768,16,32,256,1,4,3,73.0,1376.543,3
w13,256,128,8,2048,768,32,32,256,1,4,3,98.0,1376.7136666666663,3
w13,256,128,8,4096,1536,16,16,256,1,4,3,48.5,5442.669666666666,3
w13,256,128,8,4096,1536,16,32,256,1,4,3,73.0,5451.107,3
w13,256,128,8,4096,1536,16,16,256,4,4,3,48.5,5455.672333333333,3
w13,256,128,8,4096,3072,16,16,256,1,4,3,48.5,10872.539333333334,3
w13,256,128,8,4096,3072,16,32,256,1,4,3,73.0,10897.296666666669,3
w13,256,128,8,4096,3072,16,16,256,4,4,3,48.5,10905.062,3
w13,512,8,2,1024,512,64,64,64,1,4,2,40.0,40.24733333333333,3
w13,512,8,2,1024,512,64,128,128,32,8,2,112.0,40.364666666666665,3
w13,512,8,2,1024,512,64,128,128,64,8,2,112.0,40.525666666666666,3
w13,512,16,2,1536,768,32,64,128,1,8,2,52.0,144.62166666666667,3
w13,512,16,2,1536,768,64,64,128,4,4,2,72.0,145.42166666666665,3
w13,512,16,2,1536,768,64,64,128,1,4,2,72.0,145.56033333333335,3
w13,512,16,4,1536,1024,64,64,64,16,4,3,56.0,215.684,3
w13,512,16,4,1536,1024,64,64,128,16,4,2,72.0,215.833,3
w13,512,16,4,1536,1024,64,64,64,16,8,3,56.0,216.74966666666668,3
w13,512,32,4,2048,768,32,128,128,1,8,2,88.0,367.7273333333333,3
w13,512,32,4,2048,768,32,64,128,1,8,2,52.0,368.3993333333333,3
w13,512,32,4,2048,768,32,64,128,1,4,2,52.0,368.39933333333335,3
w13,512,32,6,3072,1024,64,128,128,4,8,3,160.0,762.3106666666667,3
w13,512,32,6,3072,1024,128,64,128,1,8,3,160.0,764.3053333333334,3
w13,512,32,6,3072,1024,64,64,128,4,4,2,72.0,766.7906666666668,3
w13,512,60,4,2048,1408,64,32,256,1,8,3,148.0,1208.866,3
w13,512,60,4,2048,1408,64,32,256,1,4,3,148.0,1211.042,3
w13,512,60,4,2048,1408,32,64,256,8,8,3,148.0,1214.3059999999998,3
w13,512,60,6,3584,2304,64,32,256,1,4,3,148.0,3464.2473333333332,3
w13,512,60,6,3584,2304,32,64,256,8,4,3,148.0,3479.0626666666667,3
w13,512,60,6,3584,2304,64,32,256,1,8,3,148.0,3479.607333333334,3
w13,512,60,8,2048,1536,64,64,128,4,4,2,72.0,1381.0510000000002,3
w13,512,60,8,2048,1536,128,64,128,1,8,3,160.0,1386.6836666666666,3
w13,512,60,8,2048,1536,128,64,128,1,8,2,112.0,1391.227666666667,3
w13,512,64,6,3072,2048,64,32,256,1,4,3,148.0,2809.7509999999997,3
w13,512,64,6,3072,2048,64,32,256,1,8,3,148.0,2810.914,3
w13,512,64,6,3072,2048,32,64,256,8,4,3,148.0,2826.2093333333337,3
w13,512,64,6,3584,1536,64,32,256,1,4,3,148.0,2481.6406666666667,3
w13,512,64,6,3584,1536,64,128,128,1,8,3,160.0,2482.142666666666,3
w13,512,64,6,3584,1536,32,64,256,8,4,3,148.0,2484.691666666667,3
w13,512,64,8,3584,2560,64,32,256,1,4,3,148.0,4129.1179999999995,3
w13,512,64,8,3584,2560,64,32,256,1,8,3,148.0,4138.974666666666,3
w13,512,64,8,3584,2560,32,64,256,8,4,3,148.0,4140.574,3
w13,512,128,4,2048,512,16,16,256,1,4,3,48.5,918.7646666666666,3
w13,512,128,4,2048,512,16,16,256,4,4,3,48.5,918.8286666666668,3
w13,512,128,4,2048,512,16,32,256,1,4,3,73.0,921.0363333333332,3
w13,512,128,6,4096,2048,16,16,256,4,4,3,48.5,7340.290000000001,3
w13,512,128,6,4096,2048,32,32,256,1,4,3,98.0,7344.429333333333,3
w13,512,128,6,4096,2048,32,32,256,1,4,4,130.0,7349.996999999999,3
w13,512,128,8,2048,768,32,32,256,1,8,3,98.0,1396.7663333333333,3
w13,512,128,8,2048,768,32,32,256,1,4,3,98.0,1397.4276666666665,3
w13,512,128,8,2048,768,32,32,256,1,4,4,130.0,1400.7456666666667,3
w13,512,128,8,4096,1536,32,32,256,1,4,4,130.0,5538.393666666667,3
w13,512,128,8,4096,1536,16,32,256,16,4,3,73.0,5541.668999999999,3
w13,512,128,8,4096,1536,32,64,256,1,8,3,148.0,5541.796333333333,3
w13,512,128,8,4096,3072,32,32,256,1,8,4,130.0,11063.816333333334,3
w13,512,128,8,4096,3072,16,32,256,16,4,3,73.0,11064.637,3
w13,512,128,8,4096,3072,32,32,256,1,4,4,130.0,11065.512,3
w13,1024,8,2,1024,512,128,256,64,1,8,3,208.0,53.869,3
w13,1024,8,2,1024,512,256,128,64,1,8,3,208.0,54.59466666666666,3
w13,1024,8,2,1024,512,128,256,64,32,8,3,208.0,54.79666666666666,3
w13,1024,16,2,1536,768,64,128,128,4,8,3,160.0,162.787,3
w13,1024,16,2,1536,768,128,64,128,1,8,3,160.0,165.15566666666666,3
w13,1024,16,2,1536,768,64,64,64,4,4,4,72.0,167.17166666666665,3
w13,1024,16,4,1536,1024,64,128,64,32,8,3,88.0,285.1666666666667,3
w13,1024,16,4,1536,1024,64,128,64,4,8,3,88.0,286.46733333333333,3
w13,1024,16,4,1536,1024,64,128,64,16,8,3,88.0,287.449,3
w13,1024,32,4,2048,768,64,128,128,1,8,2,112.0,406.1060000000001,3
w13,1024,32,4,2048,768,128,64,128,1,4,2,112.0,406.73533333333336,3
w13,1024,32,4,2048,768,128,64,128,1,8,2,112.0,408.8686666666667,3
w13,1024,32,6,3072,1024,64,256,64,1,4,2,112.0,951.6556666666668,3
w13,1024,32,6,3072,1024,64,128,128,32,8,2,112.0,957.3306666666668,3
w13,1024,32,6,3072,1024,64,128,128,64,8,2,112.0,961.3306666666668,3
w13,1024,60,4,2048,1408,128,64,128,1,8,2,112.0,1271.4583333333333,3
w13,1024,60,4,2048,1408,64,128,128,4,8,2,112.0,1271.885,3
w13,1024,60,4,2048,1408,128,64,128,1,8,3,160.0,1272.994,3
w13,1024,60,6,3584,2304,128,64,128,1,8,3,160.0,3606.348666666667,3
w13,1024,60,6,3584,2304,128,64,128,1,4,3,160.0,3613.6873333333338,3
w13,1024,60,6,3584,2304,128,64,128,1,8,2,112.0,3614.829,3
w13,1024,60,8,2048,1536,256,128,64,1,8,3,208.0,1690.1833333333334,3
w13,1024,60,8,2048,1536,64,128,128,32,8,2,112.0,1707.953666666667,3
w13,1024,60,8,2048,1536,128,256,64,16,8,3,208.0,1722.023,3
w13,1024,64,6,3072,2048,128,64,128,1,8,3,160.0,2937.8160000000003,3
w13,1024,64,6,3072,2048,128,64,128,1,4,3,160.0,2941.0263333333332,3
w13,1024,64,6,3072,2048,64,128,128,4,8,3,160.0,2941.624,3
w13,1024,64,6,3584,1536,64,128,128,4,8,2,112.0,2590.5049999999997,3
w13,1024,64,6,3584,1536,64,128,128,4,8,3,160.0,2592.063,3
w13,1024,64,6,3584,1536,128,64,128,1,8,3,160.0,2592.148333333333,3
w13,1024,64,8,3584,2560,128,64,128,1,8,3,160.0,4335.554,3
w13,1024,64,8,3584,2560,128,64,128,1,4,3,160.0,4338.263666666667,3
w13,1024,64,8,3584,2560,128,64,128,1,4,2,112.0,4343.756333333334,3
w13,1024,128,4,2048,512,32,32,256,1,4,3,98.0,936.2903333333334,3
w13,1024,128,4,2048,512,32,32,256,1,8,3,98.0,938.413,3
w13,1024,128,4,2048,512,32,32,256,4,4,3,98.0,939.9486666666668,3
w13,1024,128,6,4096,2048,32,32,256,4,4,3,98.0,7488.335666666667,3
w13,1024,128,6,4096,2048,32,32,256,4,4,4,130.0,7503.087666666666,3
w13,1024,128,6,4096,2048,32,32,256,16,4,3,98.0,7509.818666666666,3
w13,1024,128,8,2048,768,64,32,256,1,8,3,148.0,1441.0863333333334,3
w13,1024,128,8,2048,768,64,32,256,1,4,3,148.0,1443.7743333333335,3
w13,1024,128,8,2048,768,32,64,256,8,8,3,148.0,1446.9636666666668,3
w13,1024,128,8,4096,1536,32,64,256,16,4,3,148.0,5688.997333333333,3
w13,1024,128,8,4096,1536,64,128,128,1,8,2,112.0,5698.949333333333,3
w13,1024,128,8,4096,1536,32,64,256,8,4,3,148.0,5702.427333333333,3
w13,1024,128,8,4096,3072,32,64,256,8,4,3,148.0,11280.437333333335,3
w13,1024,128,8,4096,3072,32,64,256,16,4,3,148.0,11332.779,3
w13,1024,128,8,4096,3072,64,32,256,1,4,2,100.0,11353.719,3
w13,1536,8,2,1024,512,64,128,32,8,4,3,52.0,77.11200000000001,3
w13,1536,8,2,1024,512,64,128,64,1,8,3,88.0,77.15433333333334,3
w13,1536,8,2,1024,512,64,128,64,16,8,3,88.0,77.389,3
w13,1536,16,2,1536,768,64,128,64,1,4,2,64.0,193.20866666666663,3
w13,1536,16,2,1536,768,64,128,64,1,8,3,88.0,200.73933333333332,3
w13,1536,16,2,1536,768,64,256,64,1,4,2,112.0,202.77666666666664,3
w13,1536,16,4,1536,1024,128,256,64,1,8,3,208.0,379.887,3
w13,1536,16,4,1536,1024,128,256,64,32,8,3,208.0,380.18533333333335,3
w13,1536,16,4,1536,1024,128,256,64,64,8,3,208.0,380.794,3
w13,1536,32,4,2048,768,64,128,64,1,4,2,64.0,473.85066666666665,3
w13,1536,32,4,2048,768,256,128,64,1,8,3,208.0,496.78366666666665,3
w13,1536,32,4,2048,768,64,128,128,32,8,2,112.0,497.0396666666666,3
w13,1536,32,6,3072,1024,64,128,64,16,8,3,88.0,1313.2906666666663,3
w13,1536,32,6,3072,1024,64,128,64,32,8,3,88.0,1315.7546666666665,3
w13,1536,32,6,3072,1024,64,128,64,16,4,3,88.0,1329.6746666666668,3
w13,1536,60,4,2048,1408,128,64,128,1,8,2,112.0,1299.5863333333334,3
w13,1536,60,4,2048,1408,128,64,128,1,4,2,112.0,1303.042333333333,3
w13,1536,60,4,2048,1408,64,128,128,4,8,2,112.0,1303.0853333333332,3
w13,1536,60,6,3584,2304,256,128,64,1,8,3,208.0,4254.232666666667,3
w13,1536,60,6,3584,2304,128,256,64,16,8,3,208.0,4298.073333333334,3
w13,1536,60,6,3584,2304,128,256,64,32,8,3,208.0,4330.393666666666,3
w13,1536,60,8,2048,1536,256,128,64,1,8,3,208.0,1745.5646666666664,3
w13,1536,60,8,2048,1536,128,256,64,16,8,3,208.0,1776.9136666666666,3
w13,1536,60,8,2048,1536,128,256,64,32,8,3,208.0,1787.399,3
w13,1536,64,6,3072,2048,256,128,64,1,8,3,208.0,3507.738,3
w13,1536,64,6,3072,2048,128,256,64,16,8,3,208.0,3542.479,3
w13,1536,64,6,3072,2048,128,256,64,32,8,3,208.0,3566.2346666666667,3
w13,1536,64,6,3584,1536,256,128,64,1,8,3,208.0,3086.464,3
w13,1536,64,6,3584,1536,128,256,64,16,8,3,208.0,3108.875,3
w13,1536,64,6,3584,1536,128,256,64,32,8,3,208.0,3122.4533333333334,3
w13,1536,64,8,3584,2560,256,128,64,1,8,3,208.0,5176.8786666666665,3
w13,1536,64,8,3584,2560,128,256,64,16,8,3,208.0,5197.9456666666665,3
w13,1536,64,8,3584,2560,128,256,64,32,8,3,208.0,5239.599333333334,3
w13,1536,128,4,2048,512,64,32,256,1,8,3,148.0,956.823,3
w13,1536,128,4,2048,512,64,32,256,1,4,3,148.0,959.18,3
w13,1536,128,4,2048,512,32,64,256,8,8,3,148.0,961.7403333333332,3
w13,1536,128,6,4096,2048,128,64,128,1,4,3,160.0,7667.793666666667,3
w13,1536,128,6,4096,2048,128,64,128,1,8,3,160.0,7698.226333333333,3
w13,1536,128,6,4096,2048,128,64,128,1,8,2,112.0,7700.956666666668,3
w13,1536,128,8,2048,768,64,128,128,1,8,2,112.0,1516.9366666666665,3
w13,1536,128,8,2048,768,128,64,128,1,8,2,112.0,1521.107,3
w13,1536,128,8,2048,768,64,128,128,4,8,3,160.0,1525.0433333333333,3
w13,1536,128,8,4096,1536,128,64,128,1,8,2,112.0,5882.353333333333,3
w13,1536,128,8,4096,1536,128,64,128,1,4,2,112.0,5883.121,3
w13,1536,128,8,4096,1536,64,64,128,16,4,2,72.0,5902.791,3
w13,1536,128,8,4096,3072,64,64,128,16,4,2,72.0,11678.426,3
w13,1536,128,8,4096,3072,128,64,128,1,4,3,160.0,11700.154333333332,3
w13,1536,128,8,4096,3072,128,64,128,1,8,2,112.0,11705.615666666668,3
w13,2048,8,2,1024,512,64,128,32,8,8,4,64.0,100.32266666666663,3
w13,2048,8,2,1024,512,64,128,32,8,4,3,52.0,100.85566666666666,3
w13,2048,8,2,1024,512,64,128,32,8,8,3,52.0,101.27166666666666,3
w13,2048,16,2,1536,768,128,128,64,4,8,3,128.0,217.998,3
w13,2048,16,2,1536,768,128,128,64,4,8,4,160.0,219.60833333333335,3
w13,2048,16,2,1536,768,64,128,64,4,8,3,88.0,221.2516666666667,3
w13,2048,16,4,1536,1024,64,256,32,8,4,3,92.0,502.73566666666665,3
w13,2048,16,4,1536,1024,64,256,32,32,4,3,92.0,503.963,3
w13,2048,16,4,1536,1024,128,256,64,16,8,3,208.0,514.5336666666667,3
w13,2048,32,4,2048,768,128,256,64,1,8,3,208.0,520.7623333333332,3
w13,2048,32,4,2048,768,256,128,64,1,8,3,208.0,524.7413333333334,3
w13,2048,32,4,2048,768,128,256,64,16,8,3,208.0,525.6476666666666,3
w13,2048,32,6,3072,1024,128,256,64,16,8,3,208.0,1433.2066666666667,3
w13,2048,32,6,3072,1024,128,256,64,32,8,3,208.0,1435.1050000000002,3
w13,2048,32,6,3072,1024,128,256,64,1,8,3,208.0,1437.5366666666666,3
w13,2048,60,4,2048,1408,256,128,64,1,8,3,208.0,1527.6286666666667,3
w13,2048,60,4,2048,1408,128,256,64,16,8,3,208.0,1559.1273333333336,3
w13,2048,60,4,2048,1408,128,256,64,32,8,3,208.0,1565.09,3
w13,2048,60,6,3584,2304,256,128,64,1,8,3,208.0,4368.377333333334,3
w13,2048,60,6,3584,2304,128,256,64,16,8,3,208.0,4422.138,3
w13,2048,60,6,3584,2304,128,256,64,32,8,3,208.0,4508.954333333334,3
w13,2048,60,8,2048,1536,64,128,64,32,8,3,88.0,2389.3103333333333,3
w13,2048,60,8,2048,1536,64,128,64,64,8,3,88.0,2393.6203333333333,3
w13,2048,60,8,2048,1536,64,128,64,16,8,3,88.0,2401.3213333333333,3
w13,2048,64,6,3072,2048,256,128,64,1,8,3,208.0,3574.5966666666664,3
w13,2048,64,6,3072,2048,128,256,64,16,8,3,208.0,3635.343666666667,3
w13,2048,64,6,3072,2048,128,256,64,32,8,3,208.0,3688.528,3
w13,2048,64,6,3584,1536,256,128,64,1,8,3,208.0,3152.906333333334,3
w13,2048,64,6,3584,1536,128,256,64,16,8,3,208.0,3182.72,3
w13,2048,64,6,3584,1536,128,256,64,32,8,3,208.0,3217.7923333333333,3
w13,2048,64,8,3584,2560,128,256,64,16,8,3,208.0,5334.225333333333,3
w13,2048,64,8,3584,2560,256,128,64,1,8,3,208.0,5345.627666666667,3
w13,2048,64,8,3584,2560,128,256,64,32,8,3,208.0,5428.434,3
w13,2048,128,4,2048,512,64,32,256,1,8,3,148.0,969.4523333333332,3
w13,2048,128,4,2048,512,64,32,256,1,4,3,148.0,969.516,3
w13,2048,128,4,2048,512,32,64,256,8,8,3,148.0,976.3963333333336,3
w13,2048,128,6,4096,2048,128,64,128,1,8,2,112.0,7778.599666666666,3
w13,2048,128,6,4096,2048,128,64,128,1,4,3,160.0,7797.394666666667,3
w13,2048,128,6,4096,2048,128,64,128,1,4,2,112.0,7800.445,3
w13,2048,128,8,2048,768,64,128,128,16,8,2,112.0,1563.9223333333332,3
w13,2048,128,8,2048,768,128,64,128,1,8,3,160.0,1569.2773333333332,3
w13,2048,128,8,2048,768,64,128,128,16,4,2,112.0,1572.1363333333331,3
w13,2048,128,8,4096,1536,128,64,128,1,8,2,112.0,5983.567999999999,3
w13,2048,128,8,4096,1536,128,64,128,1,4,2,112.0,5991.547666666666,3
w13,2048,128,8,4096,1536,128,64,128,1,8,3,160.0,6003.803333333333,3
w13,2048,128,8,4096,3072,64,64,128,4,4,4,136.0,11797.882333333337,3
w13,2048,128,8,4096,3072,64,64,128,16,8,4,136.0,11833.788,3
w13,2048,128,8,4096,3072,64,64,128,4,8,4,136.0,11860.005666666666,3
w13,3072,8,2,1024,512,64,256,32,8,4,3,92.0,133.35733333333334,3
w13,3072,8,2,1024,512,64,256,32,32,4,3,92.0,134.68033333333332,3
w13,3072,8,2,1024,512,64,128,32,8,8,4,64.0,141.50699999999998,3
w13,3072,16,2,1536,768,128,128,64,1,8,3,128.0,297.00666666666666,3
w13,3072,16,2,1536,768,64,256,32,8,4,3,92.0,297.5296666666667,3
w13,3072,16,2,1536,768,128,128,64,1,4,3,128.0,298.98,3
w13,3072,16,4,1536,1024,128,256,64,1,8,3,208.0,735.6653333333334,3
w13,3072,16,4,1536,1024,128,256,64,32,8,3,208.0,738.1933333333333,3
w13,3072,16,4,1536,1024,128,256,64,16,8,3,208.0,738.7479999999999,3
w13,3072,32,4,2048,768,128,256,64,64,8,3,208.0,718.7156666666666,3
w13,3072,32,4,2048,768,128,256,64,1,8,3,208.0,719.4520000000001,3
w13,3072,32,4,2048,768,128,256,64,16,8,3,208.0,720.828,3
w13,3072,32,6,3072,1024,64,256,32,32,4,3,92.0,2224.732333333334,3
w13,3072,32,6,3072,1024,128,256,64,32,8,3,208.0,2257.9486666666667,3
w13,3072,32,6,3072,1024,128,256,64,16,8,3,208.0,2260.284666666667,3
w13,3072,60,4,2048,1408,256,128,64,1,8,3,208.0,1588.428666666667,3
w13,3072,60,4,2048,1408,128,256,64,16,8,3,208.0,1619.4146666666668,3
w13,3072,60,4,2048,1408,128,256,64,32,8,3,208.0,1663.1056666666666,3
w13,3072,60,6,3584,2304,128,256,64,16,8,3,208.0,6469.675,3
w13,3072,60,6,3584,2304,128,256,64,32,8,3,208.0,6479.221333333334,3
w13,3072,60,6,3584,2304,128,256,64,64,8,3,208.0,6491.327999999999,3
w13,3072,60,8,2048,1536,128,256,64,16,8,3,208.0,3304.1290000000004,3
w13,3072,60,8,2048,1536,128,256,64,32,8,3,208.0,3307.542,3
w13,3072,60,8,2048,1536,128,256,64,64,8,3,208.0,3323.34,3
w13,3072,64,6,3072,2048,128,256,64,32,8,3,208.0,5248.427333333333,3
w13,3072,64,6,3072,2048,128,256,64,16,8,3,208.0,5249.697,3
w13,3072,64,6,3072,2048,128,256,64,64,8,3,208.0,5254.720333333334,3
w13,3072,64,6,3584,1536,128,256,64,32,8,3,208.0,4596.879,3
w13,3072,64,6,3584,1536,128,256,64,64,8,3,208.0,4602.660666666667,3
w13,3072,64,6,3584,1536,128,256,64,16,8,3,208.0,4609.209666666667,3
w13,3072,64,8,3584,2560,128,256,64,64,8,3,208.0,7854.934333333334,3
w13,3072,64,8,3584,2560,128,256,64,16,8,3,208.0,7857.7406666666675,3
w13,3072,64,8,3584,2560,128,256,64,32,8,3,208.0,7866.358666666667,3
w13,3072,128,4,2048,512,64,64,128,4,8,4,136.0,1015.5746666666668,3
w13,3072,128,4,2048,512,64,64,128,8,8,4,136.0,1023.575,3
w13,3072,128,4,2048,512,64,64,128,8,4,4,136.0,1024.0763333333334,3
w13,3072,128,6,4096,2048,256,128,64,1,8,3,208.0,9077.212666666666,3
w13,3072,128,6,4096,2048,128,256,64,16,8,3,208.0,9206.472,3
w13,3072,128,6,4096,2048,128,256,64,32,8,3,208.0,9369.907666666668,3
w13,3072,128,8,2048,768,256,128,64,1,8,3,208.0,1861.2463333333335,3
w13,3072,128,8,2048,768,128,256,64,1,8,3,208.0,1868.1903333333332,3
w13,3072,128,8,2048,768,128,256,64,16,8,3,208.0,1874.0783333333336,3
w13,3072,128,8,4096,1536,256,128,64,1,8,3,208.0,6996.183666666667,3
w13,3072,128,8,4096,1536,128,256,64,16,8,3,208.0,7024.343000000001,3
w13,3072,128,8,4096,1536,128,256,64,32,8,3,208.0,7076.002333333334,3
w13,3072,128,8,4096,3072,256,128,64,1,8,3,208.0,14061.129666666668,3
w13,3072,128,8,4096,3072,128,256,64,16,8,3,208.0,14281.290333333332,3
w13,3072,128,8,4096,3072,128,256,64,32,8,3,208.0,14479.68,3
w13,4096,8,2,1024,512,64,256,32,8,4,3,92.0,180.96366666666663,3
w13,4096,8,2,1024,512,64,256,32,32,4,3,92.0,181.347,3
w13,4096,8,2,1024,512,64,128,32,8,8,4,64.0,183.07566666666665,3
w13,4096,16,2,1536,768,128,256,64,1,8,3,208.0,380.19699999999995,3
w13,4096,16,2,1536,768,128,256,64,16,8,3,208.0,380.9433333333333,3
w13,4096,16,2,1536,768,128,256,64,32,8,3,208.0,383.482,3
w13,4096,16,4,1536,1024,128,256,64,1,8,3,208.0,951.6036666666664,3
w13,4096,16,4,1536,1024,128,256,64,32,8,3,208.0,954.088,3
w13,4096,16,4,1536,1024,128,256,64,16,8,3,208.0,954.4193333333332,3
w13,4096,32,4,2048,768,128,256,64,32,8,3,208.0,970.4933333333332,3
w13,4096,32,4,2048,768,128,256,64,64,8,3,208.0,973.4053333333336,3
w13,4096,32,4,2048,768,128,256,64,16,8,3,208.0,977.416,3
w13,4096,32,6,3072,1024,128,256,64,16,8,3,208.0,2714.314,3
w13,4096,32,6,3072,1024,128,256,64,32,8,3,208.0,2717.8776666666668,3
w13,4096,32,6,3072,1024,128,256,64,64,8,3,208.0,2724.661,3
w13,4096,60,4,2048,1408,64,128,64,16,8,3,88.0,2219.9796666666666,3
w13,4096,60,4,2048,1408,64,128,64,16,4,3,88.0,2241.409,3
w13,4096,60,4,2048,1408,64,128,64,32,8,3,88.0,2244.107666666667,3
w13,4096,60,6,3584,2304,128,256,64,16,8,3,208.0,8520.742666666667,3
w13,4096,60,6,3584,2304,128,256,64,32,8,3,208.0,8560.742666666667,3
w13,4096,60,6,3584,2304,128,256,64,64,8,3,208.0,8560.827666666666,3
w13,4096,60,8,2048,1536,128,256,64,32,8,3,208.0,4122.606,3
w13,4096,60,8,2048,1536,128,256,64,16,8,3,208.0,4124.696333333333,3
w13,4096,60,8,2048,1536,128,256,64,64,8,3,208.0,4128.771333333333,3
w13,4096,64,6,3072,2048,128,256,64,16,8,3,208.0,5399.468,3
w13,4096,64,6,3072,2048,128,256,64,32,8,3,208.0,5413.131666666666,3
w13,4096,64,6,3072,2048,128,256,64,64,8,3,208.0,5417.174666666667,3
w13,4096,64,6,3584,1536,128,256,64,64,8,3,208.0,4748.484666666666,3
w13,4096,64,6,3584,1536,128,256,64,16,8,3,208.0,4754.2119999999995,3
w13,4096,64,6,3584,1536,128,256,64,32,8,3,208.0,4757.444666666666,3
w13,4096,64,8,3584,2560,128,256,64,16,8,3,208.0,10302.246333333334,3
w13,4096,64,8,3584,2560,128,256,64,32,8,3,208.0,10314.160666666668,3
w13,4096,64,8,3584,2560,128,256,64,64,8,3,208.0,10346.128666666667,3
w13,4096,128,4,2048,512,128,64,128,1,8,3,160.0,1054.785,3
w13,4096,128,4,2048,512,64,64,128,4,4,2,72.0,1055.1373333333331,3
w13,4096,128,4,2048,512,64,128,128,4,8,3,160.0,1056.5026666666668,3
w13,4096,128,6,4096,2048,256,128,64,1,8,3,208.0,9335.006,3
w13,4096,128,6,4096,2048,128,256,64,16,8,3,208.0,9522.377666666667,3
w13,4096,128,6,4096,2048,128,256,64,32,8,3,208.0,9810.827666666666,3
w13,4096,128,8,2048,768,256,128,64,1,8,3,208.0,1935.1243333333337,3
w13,4096,128,8,2048,768,128,256,64,16,8,3,208.0,1949.8756666666668,3
w13,4096,128,8,2048,768,128,256,64,1,8,3,208.0,1964.4996666666664,3
w13,4096,128,8,4096,1536,128,256,64,16,8,3,208.0,7237.473999999999,3
w13,4096,128,8,4096,1536,256,128,64,1,8,3,208.0,7253.549999999999,3
w13,4096,128,8,4096,1536,128,256,64,32,8,3,208.0,7436.143,3
w13,4096,128,8,4096,3072,256,128,64,1,8,3,208.0,14600.064666666667,3
w13,4096,128,8,4096,3072,128,256,64,16,8,3,208.0,14714.721,3
w13,4096,128,8,4096,3072,128,256,64,32,8,3,208.0,15363.490666666668,3
